Sheet: 藏宝图配置
A1: key | B1: min_lv | C1: max_lv | D1: type_list | E1: scene_list | F1: goods_list | G1: monster_list
A2: key
A3: key | B3: 最小等级 | C3: 最大等级 | D3: 随机类型列表 | E3: 场景 | F3: 可获取道具 | G3: 可开出怪物
A4: 1 | B4: 1 | C4: 59 | D4: [{1,5},{2, 40},{3, 50},{4,5}] | E4: [{20100,82,66,92,71},{20100,114,89,121,94},{20100,104,59,114,64},{20100,89,39,98,45},{20100,33,18,39,22},{20100,11,33,17,36},{20100,44,69,50,73},{20100,22,87,28,91},{20100,109,16,117,21},{20102,45,16,51,20},{20102,76,16,83,19},{20102,74,35,80,39},{20102,54,43,59,46},{20102,10,58,16,54},{20102,19,26,25,30},{20102,6,39,13,46},{20102,3,9,8,12},{20204,30,35,35,39},{20204,15,32,20,36},{20204,32,9,36,11},{20206,28,23,33,26},{20207,36,34,40,37},{20208,32,4,37,8},{20209,20,16,29,21},{20210,13,13,20,16},{20211,42,43,47,46},{20213,23,29,27,33},{20214,14,23,24,28},{20215,18,11,27,16},{20103,32,32,42,37},{20213,9,9,14,12},{20216,19,8,32,18}] | F4: =工作表3!R[12]C[7] -> [{{110085,1,4},390},{{110086,1,2},390},{{110087,1,1},390},{{110088,1,1},195},{{110089,1,3},333},{{110090,1,1},500},{{110091,1,1},250},{{110003,1,6},333},{{110140,1,1},333},{{110160,1,3},333},{{110219,1,1},500},{{110208,1,1},200},{{110210,1,1},100},{{110109,1,1},25}] | G4: [{8602,90},{8652,10}]
A5: 2 | B5: 60 | C5: 64 | D5: [{1,5},{2, 40},{3, 50},{4,5}] | E5: [{20100,82,66,92,71},{20100,114,89,121,94},{20100,104,59,114,64},{20100,89,39,98,45},{20100,33,18,39,22},{20100,11,33,17,36},{20100,44,69,50,73},{20100,22,87,28,91},{20100,109,16,117,21},{20102,45,16,51,20},{20102,76,16,83,19},{20102,74,35,80,39},{20102,54,43,59,46},{20102,10,58,16,54},{20102,19,26,25,30},{20102,6,39,13,46},{20102,3,9,8,12},{20204,30,35,35,39},{20204,15,32,20,36},{20204,32,9,36,11},{20206,28,23,33,26},{20207,36,34,40,37},{20208,32,4,37,8},{20209,20,16,29,21},{20210,13,13,20,16},{20211,42,43,47,46},{20213,23,29,27,33},{20214,14,23,24,28},{20215,18,11,27,16},{20103,32,32,42,37},{20213,9,9,14,12},{20216,19,8,32,18},{20217,16,43,22,46},{20217,22,4,29,8},{20233,25,23,32,27}] | F5: =R[-1]C -> [{{110085,1,4},390},{{110086,1,2},390},{{110087,1,1},390},{{110088,1,1},195},{{110089,1,3},333},{{110090,1,1},500},{{110091,1,1},250},{{110003,1,6},333},{{110140,1,1},333},{{110160,1,3},333},{{110219,1,1},500},{{110208,1,1},200},{{110210,1,1},100},{{110109,1,1},25}] | G5: [{8603,90},{8653,10}]
A6: 3 | B6: 65 | C6: 69 | D6: [{1,5},{2, 40},{3, 50},{4,5}] | E6: [{20100,82,66,92,71},{20100,114,89,121,94},{20100,104,59,114,64},{20100,89,39,98,45},{20100,33,18,39,22},{20100,11,33,17,36},{20100,44,69,50,73},{20100,22,87,28,91},{20100,109,16,117,21},{20102,45,16,51,20},{20102,76,16,83,19},{20102,74,35,80,39},{20102,54,43,59,46},{20102,10,58,16,54},{20102,19,26,25,30},{20102,6,39,13,46},{20102,3,9,8,12},{20204,30,35,35,39},{20204,15,32,20,36},{20204,32,9,36,11},{20206,28,23,33,26},{20207,36,34,40,37},{20208,32,4,37,8},{20209,20,16,29,21},{20210,13,13,20,16},{20211,42,43,47,46},{20213,23,29,27,33},{20214,14,23,24,28},{20215,18,11,27,16},{20103,32,32,42,37},{20213,9,9,14,12},{20216,19,8,32,18},{20217,16,43,22,46},{20217,22,4,29,8},{20233,25,23,32,27},{20105,13,16,21,19},{20105,60,23,65,27},{20105,67,6,72,10},{20105,57,36,63,40}] | F6: =R[-1]C -> [{{110085,1,4},390},{{110086,1,2},390},{{110087,1,1},390},{{110088,1,1},195},{{110089,1,3},333},{{110090,1,1},500},{{110091,1,1},250},{{110003,1,6},333},{{110140,1,1},333},{{110160,1,3},333},{{110219,1,1},500},{{110208,1,1},200},{{110210,1,1},100},{{110109,1,1},25}] | G6: [{8604,90},{8654,10}]
A7: 4 | B7: 70 | C7: 74 | D7: [{1,5},{2, 40},{3, 50},{4,5}] | E7: [{20100,82,66,92,71},{20100,114,89,121,94},{20100,104,59,114,64},{20100,89,39,98,45},{20100,33,18,39,22},{20100,11,33,17,36},{20100,44,69,50,73},{20100,22,87,28,91},{20100,109,16,117,21},{20102,45,16,51,20},{20102,76,16,83,19},{20102,74,35,80,39},{20102,54,43,59,46},{20102,10,58,16,54},{20102,19,26,25,30},{20102,6,39,13,46},{20102,3,9,8,12},{20204,30,35,35,39},{20204,15,32,20,36},{20204,32,9,36,11},{20206,28,23,33,26},{20207,36,34,40,37},{20208,32,4,37,8},{20209,20,16,29,21},{20210,13,13,20,16},{20211,42,43,47,46},{20213,23,29,27,33},{20214,14,23,24,28},{20215,18,11,27,16},{20103,32,32,42,37},{20213,9,9,14,12},{20216,19,8,32,18},{20217,16,43,22,46},{20217,22,4,29,8},{20233,25,23,32,27},{20105,13,16,21,19},{20105,60,23,65,27},{20105,67,6,72,10},{20105,57,36,63,40}] | F7: =工作表3!R[23]C[7] -> [{{110092,1,1},125},{{110093,1,1},62},{{110094,1,1},31},{{110099,1,1},333},{{110100,1,1},166},{{110101,1,1},83},{{110003,1,6},333},{{110140,1,1},333},{{110160,1,3},333},{{110219,1,1},500},{{110210,1,1},100},{{110212,1,1},50},{{110109,1,1},25},{{110163,1,1},10}] | G7: [{8605,90},{8655,10}]
A8: 5 | B8: 75 | C8: 79 | D8: [{1,5},{2, 40},{3, 50},{4,5}] | E8: [{20100,82,66,92,71},{20100,114,89,121,94},{20100,104,59,114,64},{20100,89,39,98,45},{20100,33,18,39,22},{20100,11,33,17,36},{20100,44,69,50,73},{20100,22,87,28,91},{20100,109,16,117,21},{20102,45,16,51,20},{20102,76,16,83,19},{20102,74,35,80,39},{20102,54,43,59,46},{20102,10,58,16,54},{20102,19,26,25,30},{20102,6,39,13,46},{20102,3,9,8,12},{20204,30,35,35,39},{20204,15,32,20,36},{20204,32,9,36,11},{20206,28,23,33,26},{20207,36,34,40,37},{20208,32,4,37,8},{20209,20,16,29,21},{20210,13,13,20,16},{20211,42,43,47,46},{20213,23,29,27,33},{20214,14,23,24,28},{20215,18,11,27,16},{20103,32,32,42,37},{20213,9,9,14,12},{20216,19,8,32,18},{20217,16,43,22,46},{20217,22,4,29,8},{20233,25,23,32,27},{20105,13,16,21,19},{20105,60,23,65,27},{20105,67,6,72,10},{20105,57,36,63,40}] | F8: =R[-1]C -> [{{110092,1,1},125},{{110093,1,1},62},{{110094,1,1},31},{{110099,1,1},333},{{110100,1,1},166},{{110101,1,1},83},{{110003,1,6},333},{{110140,1,1},333},{{110160,1,3},333},{{110219,1,1},500},{{110210,1,1},100},{{110212,1,1},50},{{110109,1,1},25},{{110163,1,1},10}] | G8: [{8606,90},{8656,10}]
A9: 6 | B9: 80 | C9: 84 | D9: [{1,5},{2, 40},{3, 50},{4,5}] | E9: [{20100,82,66,92,71},{20100,114,89,121,94},{20100,104,59,114,64},{20100,89,39,98,45},{20100,33,18,39,22},{20100,11,33,17,36},{20100,44,69,50,73},{20100,22,87,28,91},{20100,109,16,117,21},{20102,45,16,51,20},{20102,76,16,83,19},{20102,74,35,80,39},{20102,54,43,59,46},{20102,10,58,16,54},{20102,19,26,25,30},{20102,6,39,13,46},{20102,3,9,8,12},{20204,30,35,35,39},{20204,15,32,20,36},{20204,32,9,36,11},{20206,28,23,33,26},{20207,36,34,40,37},{20208,32,4,37,8},{20209,20,16,29,21},{20210,13,13,20,16},{20211,42,43,47,46},{20213,23,29,27,33},{20214,14,23,24,28},{20215,18,11,27,16},{20103,32,32,42,37},{20213,9,9,14,12},{20216,19,8,32,18},{20217,16,43,22,46},{20217,22,4,29,8},{20233,25,23,32,27},{20105,13,16,21,19},{20105,60,23,65,27},{20105,67,6,72,10},{20105,57,36,63,40},{20234,47,37,53,40},{20234,16,42,22,46},{20235,8,5,13,8},{20235,19,5,27,9},{20236,44,34,50,37},{20236,24,28,28,31},{20236,19,10,23,13},{20236,42,18,46,20}] | F9: =工作表3!R[37]C[7] -> [{{110093,1,1},62},{{110094,1,1},31},{{110095,1,1},15},{{110100,1,1},166},{{110101,1,1},83},{{110102,1,1},41},{{110103,1,1},20},{{110104,1,1},10},{{110003,1,6},333},{{110140,1,1},333},{{110160,1,3},333},{{110219,1,1},500},{{110210,1,1},100},{{110212,1,1},50},{{110109,1,1},28},{{110163,1,1},10}] | G9: [{8607,90},{8657,10}]
A10: 7 | B10: 85 | C10: 89 | D10: [{1,5},{2, 40},{3, 50},{4,5}] | E10: [{20100,82,66,92,71},{20100,114,89,121,94},{20100,104,59,114,64},{20100,89,39,98,45},{20100,33,18,39,22},{20100,11,33,17,36},{20100,44,69,50,73},{20100,22,87,28,91},{20100,109,16,117,21},{20102,45,16,51,20},{20102,76,16,83,19},{20102,74,35,80,39},{20102,54,43,59,46},{20102,10,58,16,54},{20102,19,26,25,30},{20102,6,39,13,46},{20102,3,9,8,12},{20204,30,35,35,39},{20204,15,32,20,36},{20204,32,9,36,11},{20206,28,23,33,26},{20207,36,34,40,37},{20208,32,4,37,8},{20209,20,16,29,21},{20210,13,13,20,16},{20211,42,43,47,46},{20213,23,29,27,33},{20214,14,23,24,28},{20215,18,11,27,16},{20103,32,32,42,37},{20213,9,9,14,12},{20216,19,8,32,18},{20217,16,43,22,46},{20217,22,4,29,8},{20233,25,23,32,27},{20105,13,16,21,19},{20105,60,23,65,27},{20105,67,6,72,10},{20105,57,36,63,40},{20234,47,37,53,40},{20234,16,42,22,46},{20235,8,5,13,8},{20235,19,5,27,9},{20236,44,34,50,37},{20236,24,28,28,31},{20236,19,10,23,13},{20236,42,18,46,20}] | F10: =R[-1]C -> [{{110093,1,1},62},{{110094,1,1},31},{{110095,1,1},15},{{110100,1,1},166},{{110101,1,1},83},{{110102,1,1},41},{{110103,1,1},20},{{110104,1,1},10},{{110003,1,6},333},{{110140,1,1},333},{{110160,1,3},333},{{110219,1,1},500},{{110210,1,1},100},{{110212,1,1},50},{{110109,1,1},28},{{110163,1,1},10}] | G10: [{8608,90},{8658,10}]
A11: 8 | B11: 90 | C11: 94 | D11: [{1,5},{2, 40},{3, 50},{4,5}] | E11: [{20100,82,66,92,71},{20100,114,89,121,94},{20100,104,59,114,64},{20100,89,39,98,45},{20100,33,18,39,22},{20100,11,33,17,36},{20100,44,69,50,73},{20100,22,87,28,91},{20100,109,16,117,21},{20102,45,16,51,20},{20102,76,16,83,19},{20102,74,35,80,39},{20102,54,43,59,46},{20102,10,58,16,54},{20102,19,26,25,30},{20102,6,39,13,46},{20102,3,9,8,12},{20204,30,35,35,39},{20204,15,32,20,36},{20204,32,9,36,11},{20206,28,23,33,26},{20207,36,34,40,37},{20208,32,4,37,8},{20209,20,16,29,21},{20210,13,13,20,16},{20211,42,43,47,46},{20213,23,29,27,33},{20214,14,23,24,28},{20215,18,11,27,16},{20103,32,32,42,37},{20213,9,9,14,12},{20216,19,8,32,18},{20217,16,43,22,46},{20217,22,4,29,8},{20233,25,23,32,27},{20105,13,16,21,19},{20105,60,23,65,27},{20105,67,6,72,10},{20105,57,36,63,40},{20234,47,37,53,40},{20234,16,42,22,46},{20235,8,5,13,8},{20235,19,5,27,9},{20236,44,34,50,37},{20236,24,28,28,31},{20236,19,10,23,13},{20236,42,18,46,20}] | F11: =R[-1]C -> [{{110093,1,1},62},{{110094,1,1},31},{{110095,1,1},15},{{110100,1,1},166},{{110101,1,1},83},{{110102,1,1},41},{{110103,1,1},20},{{110104,1,1},10},{{110003,1,6},333},{{110140,1,1},333},{{110160,1,3},333},{{110219,1,1},500},{{110210,1,1},100},{{110212,1,1},50},{{110109,1,1},28},{{110163,1,1},10}] | G11: [{8609,90},{8659,10}]
A12: 9 | B12: 95 | C12: 130 | D12: [{1,5},{2, 40},{3, 50},{4,5}] | E12: [{20100,82,66,92,71},{20100,114,89,121,94},{20100,104,59,114,64},{20100,89,39,98,45},{20100,33,18,39,22},{20100,11,33,17,36},{20100,44,69,50,73},{20100,22,87,28,91},{20100,109,16,117,21},{20102,45,16,51,20},{20102,76,16,83,19},{20102,74,35,80,39},{20102,54,43,59,46},{20102,10,58,16,54},{20102,19,26,25,30},{20102,6,39,13,46},{20102,3,9,8,12},{20204,30,35,35,39},{20204,15,32,20,36},{20204,32,9,36,11},{20206,28,23,33,26},{20207,36,34,40,37},{20208,32,4,37,8},{20209,20,16,29,21},{20210,13,13,20,16},{20211,42,43,47,46},{20213,23,29,27,33},{20214,14,23,24,28},{20215,18,11,27,16},{20103,32,32,42,37},{20213,9,9,14,12},{20216,19,8,32,18},{20217,16,43,22,46},{20217,22,4,29,8},{20233,25,23,32,27},{20105,13,16,21,19},{20105,60,23,65,27},{20105,67,6,72,10},{20105,57,36,63,40},{20234,47,37,53,40},{20234,16,42,22,46},{20235,8,5,13,8},{20235,19,5,27,9},{20236,44,34,50,37},{20236,24,28,28,31},{20236,19,10,23,13},{20236,42,18,46,20}] | F12: =R[-1]C -> [{{110093,1,1},62},{{110094,1,1},31},{{110095,1,1},15},{{110100,1,1},166},{{110101,1,1},83},{{110102,1,1},41},{{110103,1,1},20},{{110104,1,1},10},{{110003,1,6},333},{{110140,1,1},333},{{110160,1,3},333},{{110219,1,1},500},{{110210,1,1},100},{{110212,1,1},50},{{110109,1,1},28},{{110163,1,1},10}] | G12: [{8610,90},{8660,10}]

Sheet: 说明
A1: [{物品ID,是否绑定,数量}]
A3: 0:非绑定
A4: 1:绑定
A6: 随机类型列表
A7: 1 | B7: 百分比扣血
A8: 2 | B8: 获得道具
A9: 3 | B9: 挖出怪物
A10: 4 | B10: 挖空

Sheet: 工作表3
B1: 藏宝图价值/元宝 | C1: 30 | G1: 10000
A2: ID | B2: 物品 | C2: 单价 | D2: 数量 | E2: 数量优化 | F2: 总价值 | G2: 权重 | H2: 概率 | I2: 等级 | J2: 期望
A3: 110085 | B3: 黑铁矿+7 | C3: 6.4 | D3: =INT(R1C[-1]/RC[-1]) -> 4 | E3: =IF(RC[-1]=0,RC[-1]+1,RC[-1]) -> 4 | F3: =RC[-3]*RC[-1] -> 25.6 | G3: =INT((1/RC[-1])*R1C) -> 390 | H3: =RC[-1]/SUM(R3C[-1]:R16C[-1]) -> 0.0912921348314607 | I3: 60 | J3: =RC[-4]*RC[-2] -> 2.33707865168539 | K3: ="{{"&RC[-10]&",1,"&RC[-6]&"},"&RC[-4]&"}," -> {{110085,1,4},390}, | L3: =RC[-1] -> {{110085,1,4},390},
A4: 110086 | B4: 黑铁矿+8 | C4: 12.8 | D4: =INT(R1C[-1]/RC[-1]) -> 2 | E4: =IF(RC[-1]=0,RC[-1]+1,RC[-1]) -> 2 | F4: =RC[-3]*RC[-1] -> 25.6 | G4: =INT((1/RC[-1])*R1C) -> 390 | H4: =RC[-1]/SUM(R3C[-1]:R16C[-1]) -> 0.0912921348314607 | I4: 60 | J4: =RC[-4]*RC[-2] -> 2.33707865168539 | K4: ="{{"&RC[-10]&",1,"&RC[-6]&"},"&RC[-4]&"}," -> {{110086,1,2},390}, | L4: =R[-1]C&RC[-1] -> {{110085,1,4},390},{{110086,1,2},390},
A5: 110087 | B5: 黑铁矿+9 | C5: 25.6 | D5: =INT(R1C[-1]/RC[-1]) -> 1 | E5: =IF(RC[-1]=0,RC[-1]+1,RC[-1]) -> 1 | F5: =RC[-3]*RC[-1] -> 25.6 | G5: =INT((1/RC[-1])*R1C) -> 390 | H5: =RC[-1]/SUM(R3C[-1]:R16C[-1]) -> 0.0912921348314607 | I5: 60 | J5: =RC[-4]*RC[-2] -> 2.33707865168539 | K5: ="{{"&RC[-10]&",1,"&RC[-6]&"},"&RC[-4]&"}," -> {{110087,1,1},390}, | L5: =R[-1]C&RC[-1] -> {{110085,1,4},390},{{110086,1,2},390},{{110087,1,1},390},
A6: 110088 | B6: 黑铁矿+10 | C6: 51.2 | D6: =INT(R1C[-1]/RC[-1]) -> 0 | E6: =IF(RC[-1]=0,RC[-1]+1,RC[-1]) -> 1 | F6: =RC[-3]*RC[-1] -> 51.2 | G6: =INT((1/RC[-1])*R1C) -> 195 | H6: =RC[-1]/SUM(R3C[-1]:R16C[-1]) -> 0.0456460674157303 | I6: 60 | J6: =RC[-4]*RC[-2] -> 2.33707865168539 | K6: ="{{"&RC[-10]&",1,"&RC[-6]&"},"&RC[-4]&"}," -> {{110088,1,1},195}, | L6: =R[-1]C&RC[-1] -> {{110085,1,4},390},{{110086,1,2},390},{{110087,1,1},390},{{110088,1,1},195},
A7: 110089 | B7: 玄冰铁+1 | C7: 10 | D7: =INT(R1C[-1]/RC[-1]) -> 3 | E7: =IF(RC[-1]=0,RC[-1]+1,RC[-1]) -> 3 | F7: =RC[-3]*RC[-1] -> 30 | G7: =INT((1/RC[-1])*R1C) -> 333 | H7: =RC[-1]/SUM(R3C[-1]:R16C[-1]) -> 0.0779494382022472 | I7: 60 | J7: =RC[-4]*RC[-2] -> 2.33848314606742 | K7: ="{{"&RC[-10]&",1,"&RC[-6]&"},"&RC[-4]&"}," -> {{110089,1,3},333}, | L7: =R[-1]C&RC[-1] -> {{110085,1,4},390},{{110086,1,2},390},{{110087,1,1},390},{{110088,1,1},195},{{110089,1,3},333},
A8: 110090 | B8: 玄冰铁+2 | C8: 20 | D8: =INT(R1C[-1]/RC[-1]) -> 1 | E8: =IF(RC[-1]=0,RC[-1]+1,RC[-1]) -> 1 | F8: =RC[-3]*RC[-1] -> 20 | G8: =INT((1/RC[-1])*R1C) -> 500 | H8: =RC[-1]/SUM(R3C[-1]:R16C[-1]) -> 0.117041198501873 | I8: 60 | J8: =RC[-4]*RC[-2] -> 2.34082397003745 | K8: ="{{"&RC[-10]&",1,"&RC[-6]&"},"&RC[-4]&"}," -> {{110090,1,1},500}, | L8: =R[-1]C&RC[-1] -> {{110085,1,4},390},{{110086,1,2},390},{{110087,1,1},390},{{110088,1,1},195},{{110089,1,3},333},{{110090,1,1},500},
A9: 110091 | B9: 玄冰铁+3 | C9: 40 | D9: =INT(R1C[-1]/RC[-1]) -> 0 | E9: =IF(RC[-1]=0,RC[-1]+1,RC[-1]) -> 1 | F9: =RC[-3]*RC[-1] -> 40 | G9: =INT((1/RC[-1])*R1C) -> 250 | H9: =RC[-1]/SUM(R3C[-1]:R16C[-1]) -> 0.0585205992509363 | I9: 60 | J9: =RC[-4]*RC[-2] -> 2.34082397003745 | K9: ="{{"&RC[-10]&",1,"&RC[-6]&"},"&RC[-4]&"}," -> {{110091,1,1},250}, | L9: =R[-1]C&RC[-1] -> {{110085,1,4},390},{{110086,1,2},390},{{110087,1,1},390},{{110088,1,1},195},{{110089,1,3},333},{{110090,1,1},500},{{110091,1,1},250},
A10: 110003 | B10: 洗炼石 | C10: 5 | D10: =INT(R1C[-1]/RC[-1]) -> 6 | E10: =IF(RC[-1]=0,RC[-1]+1,RC[-1]) -> 6 | F10: =RC[-3]*RC[-1] -> 30 | G10: =INT((1/RC[-1])*R1C) -> 333 | H10: =RC[-1]/SUM(R3C[-1]:R16C[-1]) -> 0.0779494382022472 | I10: 60 | J10: =RC[-4]*RC[-2] -> 2.33848314606742 | K10: ="{{"&RC[-10]&",1,"&RC[-6]&"},"&RC[-4]&"}," -> {{110003,1,6},333}, | L10: =R[-1]C&RC[-1] -> {{110085,1,4},390},{{110086,1,2},390},{{110087,1,1},390},{{110088,1,1},195},{{110089,1,3},333},{{110090,1,1},500},{{110091,1,1},250},{{110003,1,6},333},
A11: 110140 | B11: 进阶丹 | C11: 30 | D11: =INT(R1C[-1]/RC[-1]) -> 1 | E11: =IF(RC[-1]=0,RC[-1]+1,RC[-1]) -> 1 | F11: =RC[-3]*RC[-1] -> 30 | G11: =INT((1/RC[-1])*R1C) -> 333 | H11: =RC[-1]/SUM(R3C[-1]:R16C[-1]) -> 0.0779494382022472 | I11: 60 | J11: =RC[-4]*RC[-2] -> 2.33848314606742 | K11: ="{{"&RC[-10]&",1,"&RC[-6]&"},"&RC[-4]&"}," -> {{110140,1,1},333}, | L11: =R[-1]C&RC[-1] -> {{110085,1,4},390},{{110086,1,2},390},{{110087,1,1},390},{{110088,1,1},195},{{110089,1,3},333},{{110090,1,1},500},{{110091,1,1},250},{{110003,1,6},333},{{110140,1,1},333},
A12: 110160 | B12: 铸魂精华 | C12: 10 | D12: =INT(R1C[-1]/RC[-1]) -> 3 | E12: =IF(RC[-1]=0,RC[-1]+1,RC[-1]) -> 3 | F12: =RC[-3]*RC[-1] -> 30 | G12: =INT((1/RC[-1])*R1C) -> 333 | H12: =RC[-1]/SUM(R3C[-1]:R16C[-1]) -> 0.0779494382022472 | I12: 60 | J12: =RC[-4]*RC[-2] -> 2.33848314606742 | K12: ="{{"&RC[-10]&",1,"&RC[-6]&"},"&RC[-4]&"}," -> {{110160,1,3},333}, | L12: =R[-1]C&RC[-1] -> {{110085,1,4},390},{{110086,1,2},390},{{110087,1,1},390},{{110088,1,1},195},{{110089,1,3},333},{{110090,1,1},500},{{110091,1,1},250},{{110003,1,6},333},{{110140,1,1},333},{{110160,1,3},333},
A13: 110219 | B13: 高级全能印记 | C13: 20 | D13: =INT(R1C[-1]/RC[-1]) -> 1 | E13: =IF(RC[-1]=0,RC[-1]+1,RC[-1]) -> 1 | F13: =RC[-3]*RC[-1] -> 20 | G13: =INT((1/RC[-1])*R1C) -> 500 | H13: =RC[-1]/SUM(R3C[-1]:R16C[-1]) -> 0.117041198501873 | I13: 60 | J13: =RC[-4]*RC[-2] -> 2.34082397003745 | K13: ="{{"&RC[-10]&",1,"&RC[-6]&"},"&RC[-4]&"}," -> {{110219,1,1},500}, | L13: =R[-1]C&RC[-1] -> {{110085,1,4},390},{{110086,1,2},390},{{110087,1,1},390},{{110088,1,1},195},{{110089,1,3},333},{{110090,1,1},500},{{110091,1,1},250},{{110003,1,6},333},{{110140,1,1},333},{{110160,1,3},333},{{110219,1,1},500},
A14: 110208 | B14: 50元宝 | C14: 50 | D14: =INT(R1C[-1]/RC[-1]) -> 0 | E14: =IF(RC[-1]=0,RC[-1]+1,RC[-1]) -> 1 | F14: =RC[-3]*RC[-1] -> 50 | G14: =INT((1/RC[-1])*R1C) -> 200 | H14: =RC[-1]/SUM(R3C[-1]:R16C[-1]) -> 0.0468164794007491 | I14: 60 | J14: =RC[-4]*RC[-2] -> 2.34082397003745 | K14: ="{{"&RC[-10]&",1,"&RC[-6]&"},"&RC[-4]&"}," -> {{110208,1,1},200}, | L14: =R[-1]C&RC[-1] -> {{110085,1,4},390},{{110086,1,2},390},{{110087,1,1},390},{{110088,1,1},195},{{110089,1,3},333},{{110090,1,1},500},{{110091,1,1},250},{{110003,1,6},333},{{110140,1,1},333},{{110160,1,3},333},{{110219,1,1},500},{{110208,1,1},200},
A15: 110210 | B15: 100绑定元宝 | C15: 100 | D15: =INT(R1C[-1]/RC[-1]) -> 0 | E15: =IF(RC[-1]=0,RC[-1]+1,RC[-1]) -> 1 | F15: =RC[-3]*RC[-1] -> 100 | G15: =INT((1/RC[-1])*R1C) -> 100 | H15: =RC[-1]/SUM(R3C[-1]:R16C[-1]) -> 0.0234082397003745 | I15: 60 | J15: =RC[-4]*RC[-2] -> 2.34082397003745 | K15: ="{{"&RC[-10]&",1,"&RC[-6]&"},"&RC[-4]&"}," -> {{110210,1,1},100}, | L15: =R[-1]C&RC[-1] -> {{110085,1,4},390},{{110086,1,2},390},{{110087,1,1},390},{{110088,1,1},195},{{110089,1,3},333},{{110090,1,1},500},{{110091,1,1},250},{{110003,1,6},333},{{110140,1,1},333},{{110160,1,3},333},{{110219,1,1},500},{{110208,1,1},200},{{110210,1,1},100},
A16: 110109 | B16: 金刚石 | C16: 400 | D16: =INT(R1C[-1]/RC[-1]) -> 0 | E16: =IF(RC[-1]=0,RC[-1]+1,RC[-1]) -> 1 | F16: =RC[-3]*RC[-1] -> 400 | G16: =INT((1/RC[-1])*R1C) -> 25 | H16: =RC[-1]/SUM(R3C[-1]:R16C[-1]) -> 0.00585205992509363 | I16: 60 | J16: =RC[-4]*RC[-2] -> 2.34082397003745 | K16: ="{{"&RC[-10]&",1,"&RC[-6]&"},"&RC[-4]&"}" -> {{110109,1,1},25} | L16: =R[-1]C&RC[-1] -> {{110085,1,4},390},{{110086,1,2},390},{{110087,1,1},390},{{110088,1,1},195},{{110089,1,3},333},{{110090,1,1},500},{{110091,1,1},250},{{110003,1,6},333},{{110140,1,1},333},{{110160,1,3},333},{{110219,1,1},500},{{110208,1,1},200},{{110210,1,1},100},{{110109,1,1},25} | M16: ="["&RC[-1]&"]" -> [{{110085,1,4},390},{{110086,1,2},390},{{110087,1,1},390},{{110088,1,1},195},{{110089,1,3},333},{{110090,1,1},500},{{110091,1,1},250},{{110003,1,6},333},{{110140,1,1},333},{{110160,1,3},333},{{110219,1,1},500},{{110208,1,1},200},{{110210,1,1},100},{{110109,1,1},25}]
A17: 110092 | B17: 玄冰铁+4 | C17: 80 | D17: =INT(R1C[-1]/RC[-1]) -> 0 | E17: =IF(RC[-1]=0,RC[-1]+1,RC[-1]) -> 1 | F17: =RC[-3]*RC[-1] -> 80 | G17: =INT((1/RC[-1])*R1C) -> 125 | H17: =RC[-1]/SUM(R17C[-1]:R30C[-1]) -> 0.0503220611916264 | I17: 70 | J17: =RC[-4]*RC[-2] -> 4.02576489533011 | K17: ="{{"&RC[-10]&",1,"&RC[-6]&"},"&RC[-4]&"}," -> {{110092,1,1},125}, | L17: =RC[-1] -> {{110092,1,1},125},
A18: 110093 | B18: 玄冰铁+5 | C18: 160 | D18: =INT(R1C[-1]/RC[-1]) -> 0 | E18: =IF(RC[-1]=0,RC[-1]+1,RC[-1]) -> 1 | F18: =RC[-3]*RC[-1] -> 160 | G18: =INT((1/RC[-1])*R1C) -> 62 | H18: =RC[-1]/SUM(R17C[-1]:R30C[-1]) -> 0.0249597423510467 | I18: 70 | J18: =RC[-4]*RC[-2] -> 3.99355877616747 | K18: ="{{"&RC[-10]&",1,"&RC[-6]&"},"&RC[-4]&"}," -> {{110093,1,1},62}, | L18: =R[-1]C&RC[-1] -> {{110092,1,1},125},{{110093,1,1},62},
A19: 110094 | B19: 玄冰铁+6 | C19: 320 | D19: =INT(R1C[-1]/RC[-1]) -> 0 | E19: =IF(RC[-1]=0,RC[-1]+1,RC[-1]) -> 1 | F19: =RC[-3]*RC[-1] -> 320 | G19: =INT((1/RC[-1])*R1C) -> 31 | H19: =RC[-1]/SUM(R17C[-1]:R30C[-1]) -> 0.0124798711755233 | I19: 70 | J19: =RC[-4]*RC[-2] -> 3.99355877616747 | K19: ="{{"&RC[-10]&",1,"&RC[-6]&"},"&RC[-4]&"}," -> {{110094,1,1},31}, | L19: =R[-1]C&RC[-1] -> {{110092,1,1},125},{{110093,1,1},62},{{110094,1,1},31},
A20: 110099 | B20: 紫水晶+1 | C20: 30 | D20: =INT(R1C[-1]/RC[-1]) -> 1 | E20: =IF(RC[-1]=0,RC[-1]+1,RC[-1]) -> 1 | F20: =RC[-3]*RC[-1] -> 30 | G20: =INT((1/RC[-1])*R1C) -> 333 | H20: =RC[-1]/SUM(R17C[-1]:R30C[-1]) -> 0.134057971014493 | I20: 70 | J20: =RC[-4]*RC[-2] -> 4.02173913043478 | K20: ="{{"&RC[-10]&",1,"&RC[-6]&"},"&RC[-4]&"}," -> {{110099,1,1},333}, | L20: =R[-1]C&RC[-1] -> {{110092,1,1},125},{{110093,1,1},62},{{110094,1,1},31},{{110099,1,1},333},
A21: 110100 | B21: 紫水晶+2 | C21: 60 | D21: =INT(R1C[-1]/RC[-1]) -> 0 | E21: =IF(RC[-1]=0,RC[-1]+1,RC[-1]) -> 1 | F21: =RC[-3]*RC[-1] -> 60 | G21: =INT((1/RC[-1])*R1C) -> 166 | H21: =RC[-1]/SUM(R17C[-1]:R30C[-1]) -> 0.0668276972624799 | I21: 70 | J21: =RC[-4]*RC[-2] -> 4.00966183574879 | K21: ="{{"&RC[-10]&",1,"&RC[-6]&"},"&RC[-4]&"}," -> {{110100,1,1},166}, | L21: =R[-1]C&RC[-1] -> {{110092,1,1},125},{{110093,1,1},62},{{110094,1,1},31},{{110099,1,1},333},{{110100,1,1},166},
A22: 110101 | B22: 紫水晶+3 | C22: 120 | D22: =INT(R1C[-1]/RC[-1]) -> 0 | E22: =IF(RC[-1]=0,RC[-1]+1,RC[-1]) -> 1 | F22: =RC[-3]*RC[-1] -> 120 | G22: =INT((1/RC[-1])*R1C) -> 83 | H22: =RC[-1]/SUM(R17C[-1]:R30C[-1]) -> 0.0334138486312399 | I22: 70 | J22: =RC[-4]*RC[-2] -> 4.00966183574879 | K22: ="{{"&RC[-10]&",1,"&RC[-6]&"},"&RC[-4]&"}," -> {{110101,1,1},83}, | L22: =R[-1]C&RC[-1] -> {{110092,1,1},125},{{110093,1,1},62},{{110094,1,1},31},{{110099,1,1},333},{{110100,1,1},166},{{110101,1,1},83},
A23: 110003 | B23: 洗炼石 | C23: 5 | D23: =INT(R1C[-1]/RC[-1]) -> 6 | E23: =IF(RC[-1]=0,RC[-1]+1,RC[-1]) -> 6 | F23: =RC[-3]*RC[-1] -> 30 | G23: =INT((1/RC[-1])*R1C) -> 333 | H23: =RC[-1]/SUM(R17C[-1]:R30C[-1]) -> 0.134057971014493 | I23: 70 | J23: =RC[-4]*RC[-2] -> 4.02173913043478 | K23: ="{{"&RC[-10]&",1,"&RC[-6]&"},"&RC[-4]&"}," -> {{110003,1,6},333}, | L23: =R[-1]C&RC[-1] -> {{110092,1,1},125},{{110093,1,1},62},{{110094,1,1},31},{{110099,1,1},333},{{110100,1,1},166},{{110101,1,1},83},{{110003,1,6},333},
A24: 110140 | B24: 进阶丹 | C24: 30 | D24: =INT(R1C[-1]/RC[-1]) -> 1 | E24: =IF(RC[-1]=0,RC[-1]+1,RC[-1]) -> 1 | F24: =RC[-3]*RC[-1] -> 30 | G24: =INT((1/RC[-1])*R1C) -> 333 | H24: =RC[-1]/SUM(R17C[-1]:R30C[-1]) -> 0.134057971014493 | I24: 70 | J24: =RC[-4]*RC[-2] -> 4.02173913043478 | K24: ="{{"&RC[-10]&",1,"&RC[-6]&"},"&RC[-4]&"}," -> {{110140,1,1},333}, | L24: =R[-1]C&RC[-1] -> {{110092,1,1},125},{{110093,1,1},62},{{110094,1,1},31},{{110099,1,1},333},{{110100,1,1},166},{{110101,1,1},83},{{110003,1,6},333},{{110140,1,1},333},
A25: 110160 | B25: 铸魂精华 | C25: 10 | D25: =INT(R1C[-1]/RC[-1]) -> 3 | E25: =IF(RC[-1]=0,RC[-1]+1,RC[-1]) -> 3 | F25: =RC[-3]*RC[-1] -> 30 | G25: =INT((1/RC[-1])*R1C) -> 333 | H25: =RC[-1]/SUM(R17C[-1]:R30C[-1]) -> 0.134057971014493 | I25: 70 | J25: =RC[-4]*RC[-2] -> 4.02173913043478 | K25: ="{{"&RC[-10]&",1,"&RC[-6]&"},"&RC[-4]&"}," -> {{110160,1,3},333}, | L25: =R[-1]C&RC[-1] -> {{110092,1,1},125},{{110093,1,1},62},{{110094,1,1},31},{{110099,1,1},333},{{110100,1,1},166},{{110101,1,1},83},{{110003,1,6},333},{{110140,1,1},333},{{110160,1,3},333},
A26: 110219 | B26: 高级全能印记 | C26: 20 | D26: =INT(R1C[-1]/RC[-1]) -> 1 | E26: =IF(RC[-1]=0,RC[-1]+1,RC[-1]) -> 1 | F26: =RC[-3]*RC[-1] -> 20 | G26: =INT((1/RC[-1])*R1C) -> 500 | H26: =RC[-1]/SUM(R17C[-1]:R30C[-1]) -> 0.201288244766506 | I26: 70 | J26: =RC[-4]*RC[-2] -> 4.02576489533011 | K26: ="{{"&RC[-10]&",1,"&RC[-6]&"},"&RC[-4]&"}," -> {{110219,1,1},500}, | L26: =R[-1]C&RC[-1] -> {{110092,1,1},125},{{110093,1,1},62},{{110094,1,1},31},{{110099,1,1},333},{{110100,1,1},166},{{110101,1,1},83},{{110003,1,6},333},{{110140,1,1},333},{{110160,1,3},333},{{110219,1,1},500},
A27: 110210 | B27: 100元宝 | C27: 100 | D27: =INT(R1C[-1]/RC[-1]) -> 0 | E27: =IF(RC[-1]=0,RC[-1]+1,RC[-1]) -> 1 | F27: =RC[-3]*RC[-1] -> 100 | G27: =INT((1/RC[-1])*R1C) -> 100 | H27: =RC[-1]/SUM(R17C[-1]:R30C[-1]) -> 0.0402576489533011 | I27: 70 | J27: =RC[-4]*RC[-2] -> 4.02576489533011 | K27: ="{{"&RC[-10]&",1,"&RC[-6]&"},"&RC[-4]&"}," -> {{110210,1,1},100}, | L27: =R[-1]C&RC[-1] -> {{110092,1,1},125},{{110093,1,1},62},{{110094,1,1},31},{{110099,1,1},333},{{110100,1,1},166},{{110101,1,1},83},{{110003,1,6},333},{{110140,1,1},333},{{110160,1,3},333},{{110219,1,1},500},{{110210,1,1},100},
A28: 110212 | B28: 200绑定元宝 | C28: 200 | D28: =INT(R1C[-1]/RC[-1]) -> 0 | E28: =IF(RC[-1]=0,RC[-1]+1,RC[-1]) -> 1 | F28: =RC[-3]*RC[-1] -> 200 | G28: =INT((1/RC[-1])*R1C) -> 50 | H28: =RC[-1]/SUM(R17C[-1]:R30C[-1]) -> 0.0201288244766506 | I28: 70 | J28: =RC[-4]*RC[-2] -> 4.02576489533011 | K28: ="{{"&RC[-10]&",1,"&RC[-6]&"},"&RC[-4]&"}," -> {{110212,1,1},50}, | L28: =R[-1]C&RC[-1] -> {{110092,1,1},125},{{110093,1,1},62},{{110094,1,1},31},{{110099,1,1},333},{{110100,1,1},166},{{110101,1,1},83},{{110003,1,6},333},{{110140,1,1},333},{{110160,1,3},333},{{110219,1,1},500},{{110210,1,1},100},{{110212,1,1},50},
A29: 110109 | B29: 金刚石 | C29: 400 | D29: =INT(R1C[-1]/RC[-1]) -> 0 | E29: =IF(RC[-1]=0,RC[-1]+1,RC[-1]) -> 1 | F29: =RC[-3]*RC[-1] -> 400 | G29: =INT((1/RC[-1])*R1C) -> 25 | H29: =RC[-1]/SUM(R17C[-1]:R30C[-1]) -> 0.0100644122383253 | I29: 70 | J29: =RC[-4]*RC[-2] -> 4.02576489533011 | K29: ="{{"&RC[-10]&",1,"&RC[-6]&"},"&RC[-4]&"}," -> {{110109,1,1},25}, | L29: =R[-1]C&RC[-1] -> {{110092,1,1},125},{{110093,1,1},62},{{110094,1,1},31},{{110099,1,1},333},{{110100,1,1},166},{{110101,1,1},83},{{110003,1,6},333},{{110140,1,1},333},{{110160,1,3},333},{{110219,1,1},500},{{110210,1,1},100},{{110212,1,1},50},{{110109,1,1},25},
A30: 110163 | B30: 上古神石 | C30: 1000 | D30: =INT(R1C[-1]/RC[-1]) -> 0 | E30: =IF(RC[-1]=0,RC[-1]+1,RC[-1]) -> 1 | F30: =RC[-3]*RC[-1] -> 1000 | G30: =INT((1/RC[-1])*R1C) -> 10 | H30: =RC[-1]/SUM(R17C[-1]:R30C[-1]) -> 0.00402576489533011 | I30: 70 | J30: =RC[-4]*RC[-2] -> 4.02576489533011 | K30: ="{{"&RC[-10]&",1,"&RC[-6]&"},"&RC[-4]&"}" -> {{110163,1,1},10} | L30: =R[-1]C&RC[-1] -> {{110092,1,1},125},{{110093,1,1},62},{{110094,1,1},31},{{110099,1,1},333},{{110100,1,1},166},{{110101,1,1},83},{{110003,1,6},333},{{110140,1,1},333},{{110160,1,3},333},{{110219,1,1},500},{{110210,1,1},100},{{110212,1,1},50},{{110109,1,1},25},{{110163,1,1},10} | M30: ="["&RC[-1]&"]" -> [{{110092,1,1},125},{{110093,1,1},62},{{110094,1,1},31},{{110099,1,1},333},{{110100,1,1},166},{{110101,1,1},83},{{110003,1,6},333},{{110140,1,1},333},{{110160,1,3},333},{{110219,1,1},500},{{110210,1,1},100},{{110212,1,1},50},{{110109,1,1},25},{{110163,1,1},10}]
A31: 110093 | B31: 玄冰铁+5 | C31: 160 | D31: =INT(R1C[-1]/RC[-1]) -> 0 | E31: =IF(RC[-1]=0,RC[-1]+1,RC[-1]) -> 1 | F31: =RC[-3]*RC[-1] -> 160 | G31: =INT((1/RC[-1])*R1C) -> 62 | H31: =RC[-1]/SUM(R31C[-1]:R46C[-1]) -> 0.0293144208037825 | I31: 80 | J31: =RC[-4]*RC[-2] -> 4.6903073286052 | K31: ="{{"&RC[-10]&",1,"&RC[-6]&"},"&RC[-4]&"}," -> {{110093,1,1},62}, | L31: =RC[-1] -> {{110093,1,1},62},
A32: 110094 | B32: 玄冰铁+6 | C32: 320 | D32: =INT(R1C[-1]/RC[-1]) -> 0 | E32: =IF(RC[-1]=0,RC[-1]+1,RC[-1]) -> 1 | F32: =RC[-3]*RC[-1] -> 320 | G32: =INT((1/RC[-1])*R1C) -> 31 | H32: =RC[-1]/SUM(R31C[-1]:R46C[-1]) -> 0.0146572104018913 | I32: 80 | J32: =RC[-4]*RC[-2] -> 4.6903073286052 | K32: ="{{"&RC[-10]&",1,"&RC[-6]&"},"&RC[-4]&"}," -> {{110094,1,1},31}, | L32: =R[-1]C&RC[-1] -> {{110093,1,1},62},{{110094,1,1},31},
A33: 110095 | B33: 玄冰铁+7 | C33: 640 | D33: =INT(R1C[-1]/RC[-1]) -> 0 | E33: =IF(RC[-1]=0,RC[-1]+1,RC[-1]) -> 1 | F33: =RC[-3]*RC[-1] -> 640 | G33: =INT((1/RC[-1])*R1C) -> 15 | H33: =RC[-1]/SUM(R31C[-1]:R46C[-1]) -> 0.00709219858156028 | I33: 80 | J33: =RC[-4]*RC[-2] -> 4.53900709219858 | K33: ="{{"&RC[-10]&",1,"&RC[-6]&"},"&RC[-4]&"}," -> {{110095,1,1},15}, | L33: =R[-1]C&RC[-1] -> {{110093,1,1},62},{{110094,1,1},31},{{110095,1,1},15},
A34: 110100 | B34: 紫水晶+2 | C34: 60 | D34: =INT(R1C[-1]/RC[-1]) -> 0 | E34: =IF(RC[-1]=0,RC[-1]+1,RC[-1]) -> 1 | F34: =RC[-3]*RC[-1] -> 60 | G34: =INT((1/RC[-1])*R1C) -> 166 | H34: =RC[-1]/SUM(R31C[-1]:R46C[-1]) -> 0.0784869976359338 | I34: 80 | J34: =RC[-4]*RC[-2] -> 4.70921985815603 | K34: ="{{"&RC[-10]&",1,"&RC[-6]&"},"&RC[-4]&"}," -> {{110100,1,1},166}, | L34: =R[-1]C&RC[-1] -> {{110093,1,1},62},{{110094,1,1},31},{{110095,1,1},15},{{110100,1,1},166},
A35: 110101 | B35: 紫水晶+3 | C35: 120 | D35: =INT(R1C[-1]/RC[-1]) -> 0 | E35: =IF(RC[-1]=0,RC[-1]+1,RC[-1]) -> 1 | F35: =RC[-3]*RC[-1] -> 120 | G35: =INT((1/RC[-1])*R1C) -> 83 | H35: =RC[-1]/SUM(R31C[-1]:R46C[-1]) -> 0.0392434988179669 | I35: 80 | J35: =RC[-4]*RC[-2] -> 4.70921985815603 | K35: ="{{"&RC[-10]&",1,"&RC[-6]&"},"&RC[-4]&"}," -> {{110101,1,1},83}, | L35: =R[-1]C&RC[-1] -> {{110093,1,1},62},{{110094,1,1},31},{{110095,1,1},15},{{110100,1,1},166},{{110101,1,1},83},
A36: 110102 | B36: 紫水晶+4 | C36: 240 | D36: =INT(R1C[-1]/RC[-1]) -> 0 | E36: =IF(RC[-1]=0,RC[-1]+1,RC[-1]) -> 1 | F36: =RC[-3]*RC[-1] -> 240 | G36: =INT((1/RC[-1])*R1C) -> 41 | H36: =RC[-1]/SUM(R31C[-1]:R46C[-1]) -> 0.0193853427895981 | I36: 80 | J36: =RC[-4]*RC[-2] -> 4.65248226950355 | K36: ="{{"&RC[-10]&",1,"&RC[-6]&"},"&RC[-4]&"}," -> {{110102,1,1},41}, | L36: =R[-1]C&RC[-1] -> {{110093,1,1},62},{{110094,1,1},31},{{110095,1,1},15},{{110100,1,1},166},{{110101,1,1},83},{{110102,1,1},41},
A37: 110103 | B37: 紫水晶+5 | C37: 480 | D37: =INT(R1C[-1]/RC[-1]) -> 0 | E37: =IF(RC[-1]=0,RC[-1]+1,RC[-1]) -> 1 | F37: =RC[-3]*RC[-1] -> 480 | G37: =INT((1/RC[-1])*R1C) -> 20 | H37: =RC[-1]/SUM(R31C[-1]:R46C[-1]) -> 0.00945626477541371 | I37: 80 | J37: =RC[-4]*RC[-2] -> 4.53900709219858 | K37: ="{{"&RC[-10]&",1,"&RC[-6]&"},"&RC[-4]&"}," -> {{110103,1,1},20}, | L37: =R[-1]C&RC[-1] -> {{110093,1,1},62},{{110094,1,1},31},{{110095,1,1},15},{{110100,1,1},166},{{110101,1,1},83},{{110102,1,1},41},{{110103,1,1},20},
A38: 110104 | B38: 紫水晶+6 | C38: 960 | D38: =INT(R1C[-1]/RC[-1]) -> 0 | E38: =IF(RC[-1]=0,RC[-1]+1,RC[-1]) -> 1 | F38: =RC[-3]*RC[-1] -> 960 | G38: =INT((1/RC[-1])*R1C) -> 10 | H38: =RC[-1]/SUM(R31C[-1]:R46C[-1]) -> 0.00472813238770686 | I38: 80 | J38: =RC[-4]*RC[-2] -> 4.53900709219858 | K38: ="{{"&RC[-10]&",1,"&RC[-6]&"},"&RC[-4]&"}," -> {{110104,1,1},10}, | L38: =R[-1]C&RC[-1] -> {{110093,1,1},62},{{110094,1,1},31},{{110095,1,1},15},{{110100,1,1},166},{{110101,1,1},83},{{110102,1,1},41},{{110103,1,1},20},{{110104,1,1},10},
A39: 110003 | B39: 洗炼石 | C39: 5 | D39: =INT(R1C[-1]/RC[-1]) -> 6 | E39: =IF(RC[-1]=0,RC[-1]+1,RC[-1]) -> 6 | F39: =RC[-3]*RC[-1] -> 30 | G39: =INT((1/RC[-1])*R1C) -> 333 | H39: =RC[-1]/SUM(R31C[-1]:R46C[-1]) -> 0.157446808510638 | I39: 80 | J39: =RC[-4]*RC[-2] -> 4.72340425531915 | K39: ="{{"&RC[-10]&",1,"&RC[-6]&"},"&RC[-4]&"}," -> {{110003,1,6},333}, | L39: =R[-1]C&RC[-1] -> {{110093,1,1},62},{{110094,1,1},31},{{110095,1,1},15},{{110100,1,1},166},{{110101,1,1},83},{{110102,1,1},41},{{110103,1,1},20},{{110104,1,1},10},{{110003,1,6},333},
A40: 110140 | B40: 进阶丹 | C40: 30 | D40: =INT(R1C[-1]/RC[-1]) -> 1 | E40: =IF(RC[-1]=0,RC[-1]+1,RC[-1]) -> 1 | F40: =RC[-3]*RC[-1] -> 30 | G40: =INT((1/RC[-1])*R1C) -> 333 | H40: =RC[-1]/SUM(R31C[-1]:R46C[-1]) -> 0.157446808510638 | I40: 80 | J40: =RC[-4]*RC[-2] -> 4.72340425531915 | K40: ="{{"&RC[-10]&",1,"&RC[-6]&"},"&RC[-4]&"}," -> {{110140,1,1},333}, | L40: =R[-1]C&RC[-1] -> {{110093,1,1},62},{{110094,1,1},31},{{110095,1,1},15},{{110100,1,1},166},{{110101,1,1},83},{{110102,1,1},41},{{110103,1,1},20},{{110104,1,1},10},{{110003,1,6},333},{{110140,1,1},333},
A41: 110160 | B41: 铸魂精华 | C41: 10 | D41: =INT(R1C[-1]/RC[-1]) -> 3 | E41: =IF(RC[-1]=0,RC[-1]+1,RC[-1]) -> 3 | F41: =RC[-3]*RC[-1] -> 30 | G41: =INT((1/RC[-1])*R1C) -> 333 | H41: =RC[-1]/SUM(R31C[-1]:R46C[-1]) -> 0.157446808510638 | I41: 80 | J41: =RC[-4]*RC[-2] -> 4.72340425531915 | K41: ="{{"&RC[-10]&",1,"&RC[-6]&"},"&RC[-4]&"}," -> {{110160,1,3},333}, | L41: =R[-1]C&RC[-1] -> {{110093,1,1},62},{{110094,1,1},31},{{110095,1,1},15},{{110100,1,1},166},{{110101,1,1},83},{{110102,1,1},41},{{110103,1,1},20},{{110104,1,1},10},{{110003,1,6},333},{{110140,1,1},333},{{110160,1,3},333},
A42: 110219 | B42: 高级全能印记 | C42: 20 | D42: =INT(R1C[-1]/RC[-1]) -> 1 | E42: =IF(RC[-1]=0,RC[-1]+1,RC[-1]) -> 1 | F42: =RC[-3]*RC[-1] -> 20 | G42: =INT((1/RC[-1])*R1C) -> 500 | H42: =RC[-1]/SUM(R31C[-1]:R46C[-1]) -> 0.236406619385343 | I42: 80 | J42: =RC[-4]*RC[-2] -> 4.72813238770686 | K42: ="{{"&RC[-10]&",1,"&RC[-6]&"},"&RC[-4]&"}," -> {{110219,1,1},500}, | L42: =R[-1]C&RC[-1] -> {{110093,1,1},62},{{110094,1,1},31},{{110095,1,1},15},{{110100,1,1},166},{{110101,1,1},83},{{110102,1,1},41},{{110103,1,1},20},{{110104,1,1},10},{{110003,1,6},333},{{110140,1,1},333},{{110160,1,3},333},{{110219,1,1},500},
A43: 110210 | B43: 100元宝 | C43: 100 | D43: =INT(R1C[-1]/RC[-1]) -> 0 | E43: =IF(RC[-1]=0,RC[-1]+1,RC[-1]) -> 1 | F43: =RC[-3]*RC[-1] -> 100 | G43: =INT((1/RC[-1])*R1C) -> 100 | H43: =RC[-1]/SUM(R31C[-1]:R46C[-1]) -> 0.0472813238770686 | I43: 80 | J43: =RC[-4]*RC[-2] -> 4.72813238770686 | K43: ="{{"&RC[-10]&",1,"&RC[-6]&"},"&RC[-4]&"}," -> {{110210,1,1},100}, | L43: =R[-1]C&RC[-1] -> {{110093,1,1},62},{{110094,1,1},31},{{110095,1,1},15},{{110100,1,1},166},{{110101,1,1},83},{{110102,1,1},41},{{110103,1,1},20},{{110104,1,1},10},{{110003,1,6},333},{{110140,1,1},333},{{110160,1,3},333},{{110219,1,1},500},{{110210,1,1},100},
A44: 110212 | B44: 200绑定元宝 | C44: 200 | D44: =INT(R1C[-1]/RC[-1]) -> 0 | E44: =IF(RC[-1]=0,RC[-1]+1,RC[-1]) -> 1 | F44: =RC[-3]*RC[-1] -> 200 | G44: =INT((1/RC[-1])*R1C) -> 50 | H44: =RC[-1]/SUM(R31C[-1]:R46C[-1]) -> 0.0236406619385343 | I44: 80 | J44: =RC[-4]*RC[-2] -> 4.72813238770686 | K44: ="{{"&RC[-10]&",1,"&RC[-6]&"},"&RC[-4]&"}," -> {{110212,1,1},50}, | L44: =R[-1]C&RC[-1] -> {{110093,1,1},62},{{110094,1,1},31},{{110095,1,1},15},{{110100,1,1},166},{{110101,1,1},83},{{110102,1,1},41},{{110103,1,1},20},{{110104,1,1},10},{{110003,1,6},333},{{110140,1,1},333},{{110160,1,3},333},{{110219,1,1},500},{{110210,1,1},100},{{110212,1,1},50},
A45: 110109 | B45: 金刚石 | C45: 350 | D45: =INT(R1C[-1]/RC[-1]) -> 0 | E45: =IF(RC[-1]=0,RC[-1]+1,RC[-1]) -> 1 | F45: =RC[-3]*RC[-1] -> 350 | G45: =INT((1/RC[-1])*R1C) -> 28 | H45: =RC[-1]/SUM(R31C[-1]:R46C[-1]) -> 0.0132387706855792 | I45: 80 | J45: =RC[-4]*RC[-2] -> 4.63356973995272 | K45: ="{{"&RC[-10]&",1,"&RC[-6]&"},"&RC[-4]&"}," -> {{110109,1,1},28}, | L45: =R[-1]C&RC[-1] -> {{110093,1,1},62},{{110094,1,1},31},{{110095,1,1},15},{{110100,1,1},166},{{110101,1,1},83},{{110102,1,1},41},{{110103,1,1},20},{{110104,1,1},10},{{110003,1,6},333},{{110140,1,1},333},{{110160,1,3},333},{{110219,1,1},500},{{110210,1,1},100},{{110212,1,1},50},{{110109,1,1},28},
A46: 110163 | B46: 上古神石 | C46: 1000 | D46: =INT(R1C[-1]/RC[-1]) -> 0 | E46: =IF(RC[-1]=0,RC[-1]+1,RC[-1]) -> 1 | F46: =RC[-3]*RC[-1] -> 1000 | G46: =INT((1/RC[-1])*R1C) -> 10 | H46: =RC[-1]/SUM(R31C[-1]:R46C[-1]) -> 0.00472813238770686 | I46: 80 | J46: =RC[-4]*RC[-2] -> 4.72813238770686 | K46: ="{{"&RC[-10]&",1,"&RC[-6]&"},"&RC[-4]&"}" -> {{110163,1,1},10} | L46: =R[-1]C&RC[-1] -> {{110093,1,1},62},{{110094,1,1},31},{{110095,1,1},15},{{110100,1,1},166},{{110101,1,1},83},{{110102,1,1},41},{{110103,1,1},20},{{110104,1,1},10},{{110003,1,6},333},{{110140,1,1},333},{{110160,1,3},333},{{110219,1,1},500},{{110210,1,1},100},{{110212,1,1},50},{{110109,1,1},28},{{110163,1,1},10} | M46: ="["&RC[-1]&"]" -> [{{110093,1,1},62},{{110094,1,1},31},{{110095,1,1},15},{{110100,1,1},166},{{110101,1,1},83},{{110102,1,1},41},{{110103,1,1},20},{{110104,1,1},10},{{110003,1,6},333},{{110140,1,1},333},{{110160,1,3},333},{{110219,1,1},500},{{110210,1,1},100},{{110212,1,1},50},{{110109,1,1},28},{{110163,1,1},10}]