Sheet: 洗炼配置
A1: key | B1: sub_type | C1: star | D1: lv | E1: attr_list
A2: key | B2: sub_type | C2: star | D2: lv | E2: attr_list | F2: content_list
A3: 递增key | B3: 装备子类型 | C3: 属性条数 | D3: 神器等级 | E3: 属性列表 | F3: 属性列表 | H3: 备注 | I3: 属性1 | J3: 属性2 | K3: 属性1 | L3: 加成 | M3: 属性2加成 | N3: 加成 | O3: 属性3加成 | P3: 加成 | Q3: 属性4加成 | R3: 加成 | S3: 属性5加成 | T3: 加成 | U3: 属性6加成 | V3: 加成
A4: 1 | B4: 1 | C4: 1 | D4: 1 | E4: ="[{"&RC[6]&","&RC[7]&"},{"&RC[8]&","&RC[9]&"},{"&RC[10]&","&RC[11]&"}]" -> [{40,5},{42,5},{44,5}] | F4: ="[{"&RC[3]&","&RC[6]&"}]" -> [{"最小攻击",5}] | H4: 武器 | I4: "最小攻击" | K4: 40 | L4: 5 | M4: 42 | N4: 5 | O4: 44 | P4: 5
A5: 2 | B5: =R[-1]C -> 1 | C5: 1 | D5: 2 | E5: ="[{"&RC[6]&","&RC[7]&"},{"&RC[8]&","&RC[9]&"},{"&RC[10]&","&RC[11]&"}]" -> [{40,10},{42,10},{44,10}] | F5: ="[{"&RC[3]&","&RC[6]&"}]" -> [{"最小攻击",10}] | H5: 武器 | I5: "最小攻击" | K5: 40 | L5: 10 | M5: 42 | N5: 10 | O5: 44 | P5: 10
A6: 3 | B6: =R[-1]C -> 1 | C6: 1 | D6: 3 | E6: ="[{"&RC[6]&","&RC[7]&"},{"&RC[8]&","&RC[9]&"},{"&RC[10]&","&RC[11]&"}]" -> [{40,15},{42,15},{44,15}] | F6: ="[{"&RC[3]&","&RC[6]&"}]" -> [{"最小攻击",15}] | H6: 武器 | I6: "最小攻击" | K6: 40 | L6: 15 | M6: 42 | N6: 15 | O6: 44 | P6: 15
A7: 4 | B7: =R[-1]C -> 1 | C7: 1 | D7: 4 | E7: ="[{"&RC[6]&","&RC[7]&"},{"&RC[8]&","&RC[9]&"},{"&RC[10]&","&RC[11]&"}]" -> [{40,20},{42,20},{44,20}] | F7: ="[{"&RC[3]&","&RC[6]&"}]" -> [{"最小攻击",20}] | H7: 武器 | I7: "最小攻击" | K7: 40 | L7: 20 | M7: 42 | N7: 20 | O7: 44 | P7: 20
A8: 5 | B8: =R[-1]C -> 1 | C8: 1 | D8: 5 | E8: ="[{"&RC[6]&","&RC[7]&"},{"&RC[8]&","&RC[9]&"},{"&RC[10]&","&RC[11]&"}]" -> [{40,25},{42,25},{44,25}] | F8: ="[{"&RC[3]&","&RC[6]&"}]" -> [{"最小攻击",25}] | H8: 武器 | I8: "最小攻击" | K8: 40 | L8: 25 | M8: 42 | N8: 25 | O8: 44 | P8: 25
A9: 6 | B9: =R[-1]C -> 1 | C9: 1 | D9: 6 | E9: ="[{"&RC[6]&","&RC[7]&"},{"&RC[8]&","&RC[9]&"},{"&RC[10]&","&RC[11]&"}]" -> [{40,30},{42,30},{44,30}] | F9: ="[{"&RC[3]&","&RC[6]&"}]" -> [{"最小攻击",30}] | H9: 武器 | I9: "最小攻击" | K9: 40 | L9: 30 | M9: 42 | N9: 30 | O9: 44 | P9: 30
A10: 7 | B10: =R[-1]C -> 1 | C10: 1 | D10: 7 | E10: ="[{"&RC[6]&","&RC[7]&"},{"&RC[8]&","&RC[9]&"},{"&RC[10]&","&RC[11]&"}]" -> [{40,35},{42,35},{44,35}] | F10: ="[{"&RC[3]&","&RC[6]&"}]" -> [{"最小攻击",35}] | H10: 武器 | I10: "最小攻击" | K10: 40 | L10: 35 | M10: 42 | N10: 35 | O10: 44 | P10: 35
A11: 8 | B11: =R[-1]C -> 1 | C11: 1 | D11: 8 | E11: ="[{"&RC[6]&","&RC[7]&"},{"&RC[8]&","&RC[9]&"},{"&RC[10]&","&RC[11]&"}]" -> [{40,40},{42,40},{44,40}] | F11: ="[{"&RC[3]&","&RC[6]&"}]" -> [{"最小攻击",40}] | H11: 武器 | I11: "最小攻击" | K11: 40 | L11: 40 | M11: 42 | N11: 40 | O11: 44 | P11: 40
A12: 9 | B12: =R[-1]C -> 1 | C12: 1 | D12: 9 | E12: ="[{"&RC[6]&","&RC[7]&"},{"&RC[8]&","&RC[9]&"},{"&RC[10]&","&RC[11]&"}]" -> [{40,45},{42,45},{44,45}] | F12: ="[{"&RC[3]&","&RC[6]&"}]" -> [{"最小攻击",45}] | H12: 武器 | I12: "最小攻击" | K12: 40 | L12: 45 | M12: 42 | N12: 45 | O12: 44 | P12: 45
A13: 10 | B13: =R[-1]C -> 1 | C13: 1 | D13: 10 | E13: ="[{"&RC[6]&","&RC[7]&"},{"&RC[8]&","&RC[9]&"},{"&RC[10]&","&RC[11]&"}]" -> [{40,50},{42,50},{44,50}] | F13: ="[{"&RC[3]&","&RC[6]&"}]" -> [{"最小攻击",50}] | H13: 武器 | I13: "最小攻击" | K13: 40 | L13: 50 | M13: 42 | N13: 50 | O13: 44 | P13: 50
A14: 11 | B14: =R[-10]C+1 -> 2 | C14: 1 | D14: 1 | E14: ="[{"&RC[6]&","&RC[7]&"}]" -> [{46,5}] | F14: ="[{"&RC[3]&","&RC[6]&"}]" -> [{"最小物防",5}] | H14: 衣服 | I14: "最小物防" | K14: 46 | L14: 5
A15: 12 | B15: =R[-10]C+1 -> 2 | C15: 1 | D15: 2 | E15: ="[{"&RC[6]&","&RC[7]&"}]" -> [{46,10}] | F15: ="[{"&RC[3]&","&RC[6]&"}]" -> [{"最小物防",10}] | H15: 衣服 | I15: "最小物防" | K15: 46 | L15: 10
A16: 13 | B16: =R[-10]C+1 -> 2 | C16: 1 | D16: 3 | E16: ="[{"&RC[6]&","&RC[7]&"}]" -> [{46,15}] | F16: ="[{"&RC[3]&","&RC[6]&"}]" -> [{"最小物防",15}] | H16: 衣服 | I16: "最小物防" | K16: 46 | L16: 15
A17: 14 | B17: =R[-10]C+1 -> 2 | C17: 1 | D17: 4 | E17: ="[{"&RC[6]&","&RC[7]&"}]" -> [{46,20}] | F17: ="[{"&RC[3]&","&RC[6]&"}]" -> [{"最小物防",20}] | H17: 衣服 | I17: "最小物防" | K17: 46 | L17: 20
A18: 15 | B18: =R[-10]C+1 -> 2 | C18: 1 | D18: 5 | E18: ="[{"&RC[6]&","&RC[7]&"}]" -> [{46,25}] | F18: ="[{"&RC[3]&","&RC[6]&"}]" -> [{"最小物防",25}] | H18: 衣服 | I18: "最小物防" | K18: 46 | L18: 25
A19: 16 | B19: =R[-10]C+1 -> 2 | C19: 1 | D19: 6 | E19: ="[{"&RC[6]&","&RC[7]&"}]" -> [{46,30}] | F19: ="[{"&RC[3]&","&RC[6]&"}]" -> [{"最小物防",30}] | H19: 衣服 | I19: "最小物防" | K19: 46 | L19: 30
A20: 17 | B20: =R[-10]C+1 -> 2 | C20: 1 | D20: 7 | E20: ="[{"&RC[6]&","&RC[7]&"}]" -> [{46,35}] | F20: ="[{"&RC[3]&","&RC[6]&"}]" -> [{"最小物防",35}] | H20: 衣服 | I20: "最小物防" | K20: 46 | L20: 35
A21: 18 | B21: =R[-10]C+1 -> 2 | C21: 1 | D21: 8 | E21: ="[{"&RC[6]&","&RC[7]&"}]" -> [{46,40}] | F21: ="[{"&RC[3]&","&RC[6]&"}]" -> [{"最小物防",40}] | H21: 衣服 | I21: "最小物防" | K21: 46 | L21: 40
A22: 19 | B22: =R[-10]C+1 -> 2 | C22: 1 | D22: 9 | E22: ="[{"&RC[6]&","&RC[7]&"}]" -> [{46,45}] | F22: ="[{"&RC[3]&","&RC[6]&"}]" -> [{"最小物防",45}] | H22: 衣服 | I22: "最小物防" | K22: 46 | L22: 45
A23: 20 | B23: =R[-10]C+1 -> 2 | C23: 1 | D23: 10 | E23: ="[{"&RC[6]&","&RC[7]&"}]" -> [{46,50}] | F23: ="[{"&RC[3]&","&RC[6]&"}]" -> [{"最小物防",50}] | H23: 衣服 | I23: "最小物防" | K23: 46 | L23: 50
A24: 21 | B24: =R[-10]C+1 -> 3 | C24: 1 | D24: 1 | E24: ="[{"&RC[6]&","&RC[7]&"}]" -> [{48,5}] | F24: ="[{"&RC[3]&","&RC[6]&"}]" -> [{"最小法防",5}] | H24: 头盔 | I24: "最小法防" | K24: 48 | L24: 5
A25: 22 | B25: =R[-10]C+1 -> 3 | C25: 1 | D25: 2 | E25: ="[{"&RC[6]&","&RC[7]&"}]" -> [{48,10}] | F25: ="[{"&RC[3]&","&RC[6]&"}]" -> [{"最小法防",10}] | H25: 头盔 | I25: "最小法防" | K25: 48 | L25: 10
A26: 23 | B26: =R[-10]C+1 -> 3 | C26: 1 | D26: 3 | E26: ="[{"&RC[6]&","&RC[7]&"}]" -> [{48,15}] | F26: ="[{"&RC[3]&","&RC[6]&"}]" -> [{"最小法防",15}] | H26: 头盔 | I26: "最小法防" | K26: 48 | L26: 15
A27: 24 | B27: =R[-10]C+1 -> 3 | C27: 1 | D27: 4 | E27: ="[{"&RC[6]&","&RC[7]&"}]" -> [{48,20}] | F27: ="[{"&RC[3]&","&RC[6]&"}]" -> [{"最小法防",20}] | H27: 头盔 | I27: "最小法防" | K27: 48 | L27: 20
A28: 25 | B28: =R[-10]C+1 -> 3 | C28: 1 | D28: 5 | E28: ="[{"&RC[6]&","&RC[7]&"}]" -> [{48,25}] | F28: ="[{"&RC[3]&","&RC[6]&"}]" -> [{"最小法防",25}] | H28: 头盔 | I28: "最小法防" | K28: 48 | L28: 25
A29: 26 | B29: =R[-10]C+1 -> 3 | C29: 1 | D29: 6 | E29: ="[{"&RC[6]&","&RC[7]&"}]" -> [{48,30}] | F29: ="[{"&RC[3]&","&RC[6]&"}]" -> [{"最小法防",30}] | H29: 头盔 | I29: "最小法防" | K29: 48 | L29: 30
A30: 27 | B30: =R[-10]C+1 -> 3 | C30: 1 | D30: 7 | E30: ="[{"&RC[6]&","&RC[7]&"}]" -> [{48,35}] | F30: ="[{"&RC[3]&","&RC[6]&"}]" -> [{"最小法防",35}] | H30: 头盔 | I30: "最小法防" | K30: 48 | L30: 35
A31: 28 | B31: =R[-10]C+1 -> 3 | C31: 1 | D31: 8 | E31: ="[{"&RC[6]&","&RC[7]&"}]" -> [{48,40}] | F31: ="[{"&RC[3]&","&RC[6]&"}]" -> [{"最小法防",40}] | H31: 头盔 | I31: "最小法防" | K31: 48 | L31: 40
A32: 29 | B32: =R[-10]C+1 -> 3 | C32: 1 | D32: 9 | E32: ="[{"&RC[6]&","&RC[7]&"}]" -> [{48,45}] | F32: ="[{"&RC[3]&","&RC[6]&"}]" -> [{"最小法防",45}] | H32: 头盔 | I32: "最小法防" | K32: 48 | L32: 45
A33: 30 | B33: =R[-10]C+1 -> 3 | C33: 1 | D33: 10 | E33: ="[{"&RC[6]&","&RC[7]&"}]" -> [{48,50}] | F33: ="[{"&RC[3]&","&RC[6]&"}]" -> [{"最小法防",50}] | H33: 头盔 | I33: "最小法防" | K33: 48 | L33: 50
A34: 31 | B34: =R[-10]C+1 -> 4 | C34: 1 | D34: 1 | E34: ="[{"&RC[6]&","&RC[7]&"}]" -> [{68,5}] | F34: ="[{"&RC[3]&","&RC[6]&"}]" -> [{"挂机金币",5}] | H34: 项链 | I34: "挂机金币" | K34: 68 | L34: 5
A35: 32 | B35: =R[-10]C+1 -> 4 | C35: 1 | D35: 2 | E35: ="[{"&RC[6]&","&RC[7]&"}]" -> [{68,10}] | F35: ="[{"&RC[3]&","&RC[6]&"}]" -> [{"挂机金币",10}] | H35: 项链 | I35: "挂机金币" | K35: 68 | L35: 10
A36: 33 | B36: =R[-10]C+1 -> 4 | C36: 1 | D36: 3 | E36: ="[{"&RC[6]&","&RC[7]&"}]" -> [{68,15}] | F36: ="[{"&RC[3]&","&RC[6]&"}]" -> [{"挂机金币",15}] | H36: 项链 | I36: "挂机金币" | K36: 68 | L36: 15
A37: 34 | B37: =R[-10]C+1 -> 4 | C37: 1 | D37: 4 | E37: ="[{"&RC[6]&","&RC[7]&"}]" -> [{68,20}] | F37: ="[{"&RC[3]&","&RC[6]&"}]" -> [{"挂机金币",20}] | H37: 项链 | I37: "挂机金币" | K37: 68 | L37: 20
A38: 35 | B38: =R[-10]C+1 -> 4 | C38: 1 | D38: 5 | E38: ="[{"&RC[6]&","&RC[7]&"}]" -> [{68,25}] | F38: ="[{"&RC[3]&","&RC[6]&"}]" -> [{"挂机金币",25}] | H38: 项链 | I38: "挂机金币" | K38: 68 | L38: 25
A39: 36 | B39: =R[-10]C+1 -> 4 | C39: 1 | D39: 6 | E39: ="[{"&RC[6]&","&RC[7]&"}]" -> [{68,30}] | F39: ="[{"&RC[3]&","&RC[6]&"}]" -> [{"挂机金币",30}] | H39: 项链 | I39: "挂机金币" | K39: 68 | L39: 30
A40: 37 | B40: =R[-10]C+1 -> 4 | C40: 1 | D40: 7 | E40: ="[{"&RC[6]&","&RC[7]&"}]" -> [{68,35}] | F40: ="[{"&RC[3]&","&RC[6]&"}]" -> [{"挂机金币",35}] | H40: 项链 | I40: "挂机金币" | K40: 68 | L40: 35
A41: 38 | B41: =R[-10]C+1 -> 4 | C41: 1 | D41: 8 | E41: ="[{"&RC[6]&","&RC[7]&"}]" -> [{68,40}] | F41: ="[{"&RC[3]&","&RC[6]&"}]" -> [{"挂机金币",40}] | H41: 项链 | I41: "挂机金币" | K41: 68 | L41: 40
A42: 39 | B42: =R[-10]C+1 -> 4 | C42: 1 | D42: 9 | E42: ="[{"&RC[6]&","&RC[7]&"}]" -> [{68,45}] | F42: ="[{"&RC[3]&","&RC[6]&"}]" -> [{"挂机金币",45}] | H42: 项链 | I42: "挂机金币" | K42: 68 | L42: 45
A43: 40 | B43: =R[-10]C+1 -> 4 | C43: 1 | D43: 10 | E43: ="[{"&RC[6]&","&RC[7]&"}]" -> [{68,50}] | F43: ="[{"&RC[3]&","&RC[6]&"}]" -> [{"挂机金币",50}] | H43: 项链 | I43: "挂机金币" | K43: 68 | L43: 50
A44: 41 | B44: =R[-10]C+1 -> 5 | C44: 1 | D44: 1 | E44: ="[{"&RC[6]&","&RC[7]&"}]" -> [{69,5}] | F44: ="[{"&RC[3]&","&RC[6]&"}]" -> [{"挂机经验",5}] | H44: 勋章 | I44: "挂机经验" | K44: 69 | L44: 5
A45: 42 | B45: =R[-10]C+1 -> 5 | C45: 1 | D45: 2 | E45: ="[{"&RC[6]&","&RC[7]&"}]" -> [{69,10}] | F45: ="[{"&RC[3]&","&RC[6]&"}]" -> [{"挂机经验",10}] | H45: 勋章 | I45: "挂机经验" | K45: 69 | L45: 10
A46: 43 | B46: =R[-10]C+1 -> 5 | C46: 1 | D46: 3 | E46: ="[{"&RC[6]&","&RC[7]&"}]" -> [{69,15}] | F46: ="[{"&RC[3]&","&RC[6]&"}]" -> [{"挂机经验",15}] | H46: 勋章 | I46: "挂机经验" | K46: 69 | L46: 15
A47: 44 | B47: =R[-10]C+1 -> 5 | C47: 1 | D47: 4 | E47: ="[{"&RC[6]&","&RC[7]&"}]" -> [{69,20}] | F47: ="[{"&RC[3]&","&RC[6]&"}]" -> [{"挂机经验",20}] | H47: 勋章 | I47: "挂机经验" | K47: 69 | L47: 20
A48: 45 | B48: =R[-10]C+1 -> 5 | C48: 1 | D48: 5 | E48: ="[{"&RC[6]&","&RC[7]&"}]" -> [{69,25}] | F48: ="[{"&RC[3]&","&RC[6]&"}]" -> [{"挂机经验",25}] | H48: 勋章 | I48: "挂机经验" | K48: 69 | L48: 25
A49: 46 | B49: =R[-10]C+1 -> 5 | C49: 1 | D49: 6 | E49: ="[{"&RC[6]&","&RC[7]&"}]" -> [{69,30}] | F49: ="[{"&RC[3]&","&RC[6]&"}]" -> [{"挂机经验",30}] | H49: 勋章 | I49: "挂机经验" | K49: 69 | L49: 30
A50: 47 | B50: =R[-10]C+1 -> 5 | C50: 1 | D50: 7 | E50: ="[{"&RC[6]&","&RC[7]&"}]" -> [{69,35}] | F50: ="[{"&RC[3]&","&RC[6]&"}]" -> [{"挂机经验",35}] | H50: 勋章 | I50: "挂机经验" | K50: 69 | L50: 35
A51: 48 | B51: =R[-10]C+1 -> 5 | C51: 1 | D51: 8 | E51: ="[{"&RC[6]&","&RC[7]&"}]" -> [{69,40}] | F51: ="[{"&RC[3]&","&RC[6]&"}]" -> [{"挂机经验",40}] | H51: 勋章 | I51: "挂机经验" | K51: 69 | L51: 40
A52: 49 | B52: =R[-10]C+1 -> 5 | C52: 1 | D52: 9 | E52: ="[{"&RC[6]&","&RC[7]&"}]" -> [{69,45}] | F52: ="[{"&RC[3]&","&RC[6]&"}]" -> [{"挂机经验",45}] | H52: 勋章 | I52: "挂机经验" | K52: 69 | L52: 45
A53: 50 | B53: =R[-10]C+1 -> 5 | C53: 1 | D53: 10 | E53: ="[{"&RC[6]&","&RC[7]&"}]" -> [{69,50}] | F53: ="[{"&RC[3]&","&RC[6]&"}]" -> [{"挂机经验",50}] | H53: 勋章 | I53: "挂机经验" | K53: 69 | L53: 50
A54: 51 | B54: =R[-10]C+1 -> 6 | C54: 1 | D54: 1 | E54: ="[{"&RC[6]&","&RC[7]&"}]" -> [{50,5}] | F54: ="[{"&RC[3]&","&RC[6]&"}]" -> [{"暴击",5}] | H54: 手镯 | I54: "暴击" | K54: 50 | L54: 5
A55: 52 | B55: =R[-10]C+1 -> 6 | C55: 1 | D55: 2 | E55: ="[{"&RC[6]&","&RC[7]&"}]" -> [{50,10}] | F55: ="[{"&RC[3]&","&RC[6]&"}]" -> [{"暴击",10}] | H55: 手镯 | I55: "暴击" | K55: 50 | L55: 10
A56: 53 | B56: =R[-10]C+1 -> 6 | C56: 1 | D56: 3 | E56: ="[{"&RC[6]&","&RC[7]&"}]" -> [{50,15}] | F56: ="[{"&RC[3]&","&RC[6]&"}]" -> [{"暴击",15}] | H56: 手镯 | I56: "暴击" | K56: 50 | L56: 15
A57: 54 | B57: =R[-10]C+1 -> 6 | C57: 1 | D57: 4 | E57: ="[{"&RC[6]&","&RC[7]&"}]" -> [{50,20}] | F57: ="[{"&RC[3]&","&RC[6]&"}]" -> [{"暴击",20}] | H57: 手镯 | I57: "暴击" | K57: 50 | L57: 20
A58: 55 | B58: =R[-10]C+1 -> 6 | C58: 1 | D58: 5 | E58: ="[{"&RC[6]&","&RC[7]&"}]" -> [{50,25}] | F58: ="[{"&RC[3]&","&RC[6]&"}]" -> [{"暴击",25}] | H58: 手镯 | I58: "暴击" | K58: 50 | L58: 25
A59: 56 | B59: =R[-10]C+1 -> 6 | C59: 1 | D59: 6 | E59: ="[{"&RC[6]&","&RC[7]&"}]" -> [{50,30}] | F59: ="[{"&RC[3]&","&RC[6]&"}]" -> [{"暴击",30}] | H59: 手镯 | I59: "暴击" | K59: 50 | L59: 30
A60: 57 | B60: =R[-10]C+1 -> 6 | C60: 1 | D60: 7 | E60: ="[{"&RC[6]&","&RC[7]&"}]" -> [{50,35}] | F60: ="[{"&RC[3]&","&RC[6]&"}]" -> [{"暴击",35}] | H60: 手镯 | I60: "暴击" | K60: 50 | L60: 35
A61: 58 | B61: =R[-10]C+1 -> 6 | C61: 1 | D61: 8 | E61: ="[{"&RC[6]&","&RC[7]&"}]" -> [{50,40}] | F61: ="[{"&RC[3]&","&RC[6]&"}]" -> [{"暴击",40}] | H61: 手镯 | I61: "暴击" | K61: 50 | L61: 40
A62: 59 | B62: =R[-10]C+1 -> 6 | C62: 1 | D62: 9 | E62: ="[{"&RC[6]&","&RC[7]&"}]" -> [{50,45}] | F62: ="[{"&RC[3]&","&RC[6]&"}]" -> [{"暴击",45}] | H62: 手镯 | I62: "暴击" | K62: 50 | L62: 45
A63: 60 | B63: =R[-10]C+1 -> 6 | C63: 1 | D63: 10 | E63: ="[{"&RC[6]&","&RC[7]&"}]" -> [{50,50}] | F63: ="[{"&RC[3]&","&RC[6]&"}]" -> [{"暴击",50}] | H63: 手镯 | I63: "暴击" | K63: 50 | L63: 50
A64: 61 | B64: =R[-10]C+1 -> 7 | C64: 1 | D64: 1 | E64: ="[{"&RC[6]&","&RC[7]&"}]" -> [{51,5}] | F64: ="[{"&RC[3]&","&RC[6]&"}]" -> [{"暴击力",5}] | H64: 戒指 | I64: "暴击力" | K64: 51 | L64: 5
A65: 62 | B65: =R[-10]C+1 -> 7 | C65: 1 | D65: 2 | E65: ="[{"&RC[6]&","&RC[7]&"}]" -> [{51,10}] | F65: ="[{"&RC[3]&","&RC[6]&"}]" -> [{"暴击力",10}] | H65: 戒指 | I65: "暴击力" | K65: 51 | L65: 10
A66: 63 | B66: =R[-10]C+1 -> 7 | C66: 1 | D66: 3 | E66: ="[{"&RC[6]&","&RC[7]&"}]" -> [{51,15}] | F66: ="[{"&RC[3]&","&RC[6]&"}]" -> [{"暴击力",15}] | H66: 戒指 | I66: "暴击力" | K66: 51 | L66: 15
A67: 64 | B67: =R[-10]C+1 -> 7 | C67: 1 | D67: 4 | E67: ="[{"&RC[6]&","&RC[7]&"}]" -> [{51,20}] | F67: ="[{"&RC[3]&","&RC[6]&"}]" -> [{"暴击力",20}] | H67: 戒指 | I67: "暴击力" | K67: 51 | L67: 20
A68: 65 | B68: =R[-10]C+1 -> 7 | C68: 1 | D68: 5 | E68: ="[{"&RC[6]&","&RC[7]&"}]" -> [{51,25}] | F68: ="[{"&RC[3]&","&RC[6]&"}]" -> [{"暴击力",25}] | H68: 戒指 | I68: "暴击力" | K68: 51 | L68: 25
A69: 66 | B69: =R[-10]C+1 -> 7 | C69: 1 | D69: 6 | E69: ="[{"&RC[6]&","&RC[7]&"}]" -> [{51,30}] | F69: ="[{"&RC[3]&","&RC[6]&"}]" -> [{"暴击力",30}] | H69: 戒指 | I69: "暴击力" | K69: 51 | L69: 30
A70: 67 | B70: =R[-10]C+1 -> 7 | C70: 1 | D70: 7 | E70: ="[{"&RC[6]&","&RC[7]&"}]" -> [{51,35}] | F70: ="[{"&RC[3]&","&RC[6]&"}]" -> [{"暴击力",35}] | H70: 戒指 | I70: "暴击力" | K70: 51 | L70: 35
A71: 68 | B71: =R[-10]C+1 -> 7 | C71: 1 | D71: 8 | E71: ="[{"&RC[6]&","&RC[7]&"}]" -> [{51,40}] | F71: ="[{"&RC[3]&","&RC[6]&"}]" -> [{"暴击力",40}] | H71: 戒指 | I71: "暴击力" | K71: 51 | L71: 40
A72: 69 | B72: =R[-10]C+1 -> 7 | C72: 1 | D72: 9 | E72: ="[{"&RC[6]&","&RC[7]&"}]" -> [{51,45}] | F72: ="[{"&RC[3]&","&RC[6]&"}]" -> [{"暴击力",45}] | H72: 戒指 | I72: "暴击力" | K72: 51 | L72: 45
A73: 70 | B73: =R[-10]C+1 -> 7 | C73: 1 | D73: 10 | E73: ="[{"&RC[6]&","&RC[7]&"}]" -> [{51,50}] | F73: ="[{"&RC[3]&","&RC[6]&"}]" -> [{"暴击力",50}] | H73: 戒指 | I73: "暴击力" | K73: 51 | L73: 50
A74: 71 | B74: =R[-10]C+1 -> 8 | C74: 1 | D74: 1 | E74: ="[{"&RC[6]&","&RC[7]&"}]" -> [{39,5}] | F74: ="[{"&RC[3]&","&RC[6]&"}]" -> [{"魔法",5}] | H74: 腰带 | I74: "魔法" | K74: 39 | L74: 5
A75: 72 | B75: =R[-10]C+1 -> 8 | C75: 1 | D75: 2 | E75: ="[{"&RC[6]&","&RC[7]&"}]" -> [{39,10}] | F75: ="[{"&RC[3]&","&RC[6]&"}]" -> [{"魔法",10}] | H75: 腰带 | I75: "魔法" | K75: 39 | L75: 10
A76: 73 | B76: =R[-10]C+1 -> 8 | C76: 1 | D76: 3 | E76: ="[{"&RC[6]&","&RC[7]&"}]" -> [{39,15}] | F76: ="[{"&RC[3]&","&RC[6]&"}]" -> [{"魔法",15}] | H76: 腰带 | I76: "魔法" | K76: 39 | L76: 15
A77: 74 | B77: =R[-10]C+1 -> 8 | C77: 1 | D77: 4 | E77: ="[{"&RC[6]&","&RC[7]&"}]" -> [{39,20}] | F77: ="[{"&RC[3]&","&RC[6]&"}]" -> [{"魔法",20}] | H77: 腰带 | I77: "魔法" | K77: 39 | L77: 20
A78: 75 | B78: =R[-10]C+1 -> 8 | C78: 1 | D78: 5 | E78: ="[{"&RC[6]&","&RC[7]&"}]" -> [{39,25}] | F78: ="[{"&RC[3]&","&RC[6]&"}]" -> [{"魔法",25}] | H78: 腰带 | I78: "魔法" | K78: 39 | L78: 25
A79: 76 | B79: =R[-10]C+1 -> 8 | C79: 1 | D79: 6 | E79: ="[{"&RC[6]&","&RC[7]&"}]" -> [{39,30}] | F79: ="[{"&RC[3]&","&RC[6]&"}]" -> [{"魔法",30}] | H79: 腰带 | I79: "魔法" | K79: 39 | L79: 30
A80: 77 | B80: =R[-10]C+1 -> 8 | C80: 1 | D80: 7 | E80: ="[{"&RC[6]&","&RC[7]&"}]" -> [{39,35}] | F80: ="[{"&RC[3]&","&RC[6]&"}]" -> [{"魔法",35}] | H80: 腰带 | I80: "魔法" | K80: 39 | L80: 35
A81: 78 | B81: =R[-10]C+1 -> 8 | C81: 1 | D81: 8 | E81: ="[{"&RC[6]&","&RC[7]&"}]" -> [{39,40}] | F81: ="[{"&RC[3]&","&RC[6]&"}]" -> [{"魔法",40}] | H81: 腰带 | I81: "魔法" | K81: 39 | L81: 40
A82: 79 | B82: =R[-10]C+1 -> 8 | C82: 1 | D82: 9 | E82: ="[{"&RC[6]&","&RC[7]&"}]" -> [{39,45}] | F82: ="[{"&RC[3]&","&RC[6]&"}]" -> [{"魔法",45}] | H82: 腰带 | I82: "魔法" | K82: 39 | L82: 45
A83: 80 | B83: =R[-10]C+1 -> 8 | C83: 1 | D83: 10 | E83: ="[{"&RC[6]&","&RC[7]&"}]" -> [{39,50}] | F83: ="[{"&RC[3]&","&RC[6]&"}]" -> [{"魔法",50}] | H83: 腰带 | I83: "魔法" | K83: 39 | L83: 50
A84: 81 | B84: =R[-10]C+1 -> 9 | C84: 1 | D84: 1 | E84: ="[{"&RC[6]&","&RC[7]&"}]" -> [{52,5}] | F84: ="[{"&RC[3]&","&RC[6]&"}]" -> [{"准确",5}] | H84: 裤子 | I84: "准确" | K84: 52 | L84: 5
A85: 82 | B85: =R[-10]C+1 -> 9 | C85: 1 | D85: 2 | E85: ="[{"&RC[6]&","&RC[7]&"}]" -> [{52,10}] | F85: ="[{"&RC[3]&","&RC[6]&"}]" -> [{"准确",10}] | H85: 裤子 | I85: "准确" | K85: 52 | L85: 10
A86: 83 | B86: =R[-10]C+1 -> 9 | C86: 1 | D86: 3 | E86: ="[{"&RC[6]&","&RC[7]&"}]" -> [{52,15}] | F86: ="[{"&RC[3]&","&RC[6]&"}]" -> [{"准确",15}] | H86: 裤子 | I86: "准确" | K86: 52 | L86: 15
A87: 84 | B87: =R[-10]C+1 -> 9 | C87: 1 | D87: 4 | E87: ="[{"&RC[6]&","&RC[7]&"}]" -> [{52,20}] | F87: ="[{"&RC[3]&","&RC[6]&"}]" -> [{"准确",20}] | H87: 裤子 | I87: "准确" | K87: 52 | L87: 20
A88: 85 | B88: =R[-10]C+1 -> 9 | C88: 1 | D88: 5 | E88: ="[{"&RC[6]&","&RC[7]&"}]" -> [{52,25}] | F88: ="[{"&RC[3]&","&RC[6]&"}]" -> [{"准确",25}] | H88: 裤子 | I88: "准确" | K88: 52 | L88: 25
A89: 86 | B89: =R[-10]C+1 -> 9 | C89: 1 | D89: 6 | E89: ="[{"&RC[6]&","&RC[7]&"}]" -> [{52,30}] | F89: ="[{"&RC[3]&","&RC[6]&"}]" -> [{"准确",30}] | H89: 裤子 | I89: "准确" | K89: 52 | L89: 30
A90: 87 | B90: =R[-10]C+1 -> 9 | C90: 1 | D90: 7 | E90: ="[{"&RC[6]&","&RC[7]&"}]" -> [{52,35}] | F90: ="[{"&RC[3]&","&RC[6]&"}]" -> [{"准确",35}] | H90: 裤子 | I90: "准确" | K90: 52 | L90: 35
A91: 88 | B91: =R[-10]C+1 -> 9 | C91: 1 | D91: 8 | E91: ="[{"&RC[6]&","&RC[7]&"}]" -> [{52,40}] | F91: ="[{"&RC[3]&","&RC[6]&"}]" -> [{"准确",40}] | H91: 裤子 | I91: "准确" | K91: 52 | L91: 40
A92: 89 | B92: =R[-10]C+1 -> 9 | C92: 1 | D92: 9 | E92: ="[{"&RC[6]&","&RC[7]&"}]" -> [{52,45}] | F92: ="[{"&RC[3]&","&RC[6]&"}]" -> [{"准确",45}] | H92: 裤子 | I92: "准确" | K92: 52 | L92: 45
A93: 90 | B93: =R[-10]C+1 -> 9 | C93: 1 | D93: 10 | E93: ="[{"&RC[6]&","&RC[7]&"}]" -> [{52,50}] | F93: ="[{"&RC[3]&","&RC[6]&"}]" -> [{"准确",50}] | H93: 裤子 | I93: "准确" | K93: 52 | L93: 50
A94: 91 | B94: =R[-10]C+1 -> 10 | C94: 1 | D94: 1 | E94: ="[{"&RC[6]&","&RC[7]&"}]" -> [{53,5}] | F94: ="[{"&RC[3]&","&RC[6]&"}]" -> [{"敏捷",5}] | H94: 鞋子 | I94: "敏捷" | K94: 53 | L94: 5
A95: 92 | B95: =R[-10]C+1 -> 10 | C95: 1 | D95: 2 | E95: ="[{"&RC[6]&","&RC[7]&"}]" -> [{53,10}] | F95: ="[{"&RC[3]&","&RC[6]&"}]" -> [{"敏捷",10}] | H95: 鞋子 | I95: "敏捷" | K95: 53 | L95: 10
A96: 93 | B96: =R[-10]C+1 -> 10 | C96: 1 | D96: 3 | E96: ="[{"&RC[6]&","&RC[7]&"}]" -> [{53,15}] | F96: ="[{"&RC[3]&","&RC[6]&"}]" -> [{"敏捷",15}] | H96: 鞋子 | I96: "敏捷" | K96: 53 | L96: 15
A97: 94 | B97: =R[-10]C+1 -> 10 | C97: 1 | D97: 4 | E97: ="[{"&RC[6]&","&RC[7]&"}]" -> [{53,20}] | F97: ="[{"&RC[3]&","&RC[6]&"}]" -> [{"敏捷",20}] | H97: 鞋子 | I97: "敏捷" | K97: 53 | L97: 20
A98: 95 | B98: =R[-10]C+1 -> 10 | C98: 1 | D98: 5 | E98: ="[{"&RC[6]&","&RC[7]&"}]" -> [{53,25}] | F98: ="[{"&RC[3]&","&RC[6]&"}]" -> [{"敏捷",25}] | H98: 鞋子 | I98: "敏捷" | K98: 53 | L98: 25
A99: 96 | B99: =R[-10]C+1 -> 10 | C99: 1 | D99: 6 | E99: ="[{"&RC[6]&","&RC[7]&"}]" -> [{53,30}] | F99: ="[{"&RC[3]&","&RC[6]&"}]" -> [{"敏捷",30}] | H99: 鞋子 | I99: "敏捷" | K99: 53 | L99: 30
A100: 97 | B100: =R[-10]C+1 -> 10 | C100: 1 | D100: 7 | E100: ="[{"&RC[6]&","&RC[7]&"}]" -> [{53,35}] | F100: ="[{"&RC[3]&","&RC[6]&"}]" -> [{"敏捷",35}] | H100: 鞋子 | I100: "敏捷" | K100: 53 | L100: 35
A101: 98 | B101: =R[-10]C+1 -> 10 | C101: 1 | D101: 8 | E101: ="[{"&RC[6]&","&RC[7]&"}]" -> [{53,40}] | F101: ="[{"&RC[3]&","&RC[6]&"}]" -> [{"敏捷",40}] | H101: 鞋子 | I101: "敏捷" | K101: 53 | L101: 40
A102: 99 | B102: =R[-10]C+1 -> 10 | C102: 1 | D102: 9 | E102: ="[{"&RC[6]&","&RC[7]&"}]" -> [{53,45}] | F102: ="[{"&RC[3]&","&RC[6]&"}]" -> [{"敏捷",45}] | H102: 鞋子 | I102: "敏捷" | K102: 53 | L102: 45
A103: 100 | B103: =R[-10]C+1 -> 10 | C103: 1 | D103: 10 | E103: ="[{"&RC[6]&","&RC[7]&"}]" -> [{53,50}] | F103: ="[{"&RC[3]&","&RC[6]&"}]" -> [{"敏捷",50}] | H103: 鞋子 | I103: "敏捷" | K103: 53 | L103: 50
A104: 101 | B104: 1 | C104: 2 | D104: 1 | E104: ="[{"&RC[6]&","&RC[7]&"},{"&RC[8]&","&RC[9]&"},{"&RC[10]&","&RC[11]&"},{"&RC[12]&","&RC[13]&"},{"&RC[14]&","&RC[15]&"},{"&RC[16]&","&RC[17]&"}]" -> [{40,5},{42,5},{44,5},{41,5},{43,5},{45,5}] | F104: ="[{"&RC[3]&","&RC[6]&"},{"&RC[4]&","&RC[8]&"}]" -> [{"最小攻击",5},{"最大攻击",5}] | H104: 武器 | I104: "最小攻击" | J104: "最大攻击" | K104: 40 | L104: 5 | M104: 42 | N104: 5 | O104: 44 | P104: 5 | Q104: 41 | R104: 5 | S104: 43 | T104: 5 | U104: 45 | V104: 5
A105: 102 | B105: 1 | C105: 2 | D105: 2 | E105: ="[{"&RC[6]&","&RC[7]&"},{"&RC[8]&","&RC[9]&"},{"&RC[10]&","&RC[11]&"},{"&RC[12]&","&RC[13]&"},{"&RC[14]&","&RC[15]&"},{"&RC[16]&","&RC[17]&"}]" -> [{40,10},{42,10},{44,10},{41,10},{43,10},{45,10}] | F105: ="[{"&RC[3]&","&RC[6]&"},{"&RC[4]&","&RC[8]&"}]" -> [{"最小攻击",10},{"最大攻击",10}] | H105: 武器 | I105: "最小攻击" | J105: "最大攻击" | K105: 40 | L105: 10 | M105: 42 | N105: 10 | O105: 44 | P105: 10 | Q105: 41 | R105: 10 | S105: 43 | T105: 10 | U105: 45 | V105: 10
A106: 103 | B106: 1 | C106: 2 | D106: 3 | E106: ="[{"&RC[6]&","&RC[7]&"},{"&RC[8]&","&RC[9]&"},{"&RC[10]&","&RC[11]&"},{"&RC[12]&","&RC[13]&"},{"&RC[14]&","&RC[15]&"},{"&RC[16]&","&RC[17]&"}]" -> [{40,15},{42,15},{44,15},{41,15},{43,15},{45,15}] | F106: ="[{"&RC[3]&","&RC[6]&"},{"&RC[4]&","&RC[8]&"}]" -> [{"最小攻击",15},{"最大攻击",15}] | H106: 武器 | I106: "最小攻击" | J106: "最大攻击" | K106: 40 | L106: 15 | M106: 42 | N106: 15 | O106: 44 | P106: 15 | Q106: 41 | R106: 15 | S106: 43 | T106: 15 | U106: 45 | V106: 15
A107: 104 | B107: 1 | C107: 2 | D107: 4 | E107: ="[{"&RC[6]&","&RC[7]&"},{"&RC[8]&","&RC[9]&"},{"&RC[10]&","&RC[11]&"},{"&RC[12]&","&RC[13]&"},{"&RC[14]&","&RC[15]&"},{"&RC[16]&","&RC[17]&"}]" -> [{40,20},{42,20},{44,20},{41,20},{43,20},{45,20}] | F107: ="[{"&RC[3]&","&RC[6]&"},{"&RC[4]&","&RC[8]&"}]" -> [{"最小攻击",20},{"最大攻击",20}] | H107: 武器 | I107: "最小攻击" | J107: "最大攻击" | K107: 40 | L107: 20 | M107: 42 | N107: 20 | O107: 44 | P107: 20 | Q107: 41 | R107: 20 | S107: 43 | T107: 20 | U107: 45 | V107: 20
A108: 105 | B108: 1 | C108: 2 | D108: 5 | E108: ="[{"&RC[6]&","&RC[7]&"},{"&RC[8]&","&RC[9]&"},{"&RC[10]&","&RC[11]&"},{"&RC[12]&","&RC[13]&"},{"&RC[14]&","&RC[15]&"},{"&RC[16]&","&RC[17]&"}]" -> [{40,25},{42,25},{44,25},{41,25},{43,25},{45,25}] | F108: ="[{"&RC[3]&","&RC[6]&"},{"&RC[4]&","&RC[8]&"}]" -> [{"最小攻击",25},{"最大攻击",25}] | H108: 武器 | I108: "最小攻击" | J108: "最大攻击" | K108: 40 | L108: 25 | M108: 42 | N108: 25 | O108: 44 | P108: 25 | Q108: 41 | R108: 25 | S108: 43 | T108: 25 | U108: 45 | V108: 25
A109: 106 | B109: 1 | C109: 2 | D109: 6 | E109: ="[{"&RC[6]&","&RC[7]&"},{"&RC[8]&","&RC[9]&"},{"&RC[10]&","&RC[11]&"},{"&RC[12]&","&RC[13]&"},{"&RC[14]&","&RC[15]&"},{"&RC[16]&","&RC[17]&"}]" -> [{40,30},{42,30},{44,30},{41,30},{43,30},{45,30}] | F109: ="[{"&RC[3]&","&RC[6]&"},{"&RC[4]&","&RC[8]&"}]" -> [{"最小攻击",30},{"最大攻击",30}] | H109: 武器 | I109: "最小攻击" | J109: "最大攻击" | K109: 40 | L109: 30 | M109: 42 | N109: 30 | O109: 44 | P109: 30 | Q109: 41 | R109: 30 | S109: 43 | T109: 30 | U109: 45 | V109: 30
A110: 107 | B110: 1 | C110: 2 | D110: 7 | E110: ="[{"&RC[6]&","&RC[7]&"},{"&RC[8]&","&RC[9]&"},{"&RC[10]&","&RC[11]&"},{"&RC[12]&","&RC[13]&"},{"&RC[14]&","&RC[15]&"},{"&RC[16]&","&RC[17]&"}]" -> [{40,35},{42,35},{44,35},{41,35},{43,35},{45,35}] | F110: ="[{"&RC[3]&","&RC[6]&"},{"&RC[4]&","&RC[8]&"}]" -> [{"最小攻击",35},{"最大攻击",35}] | H110: 武器 | I110: "最小攻击" | J110: "最大攻击" | K110: 40 | L110: 35 | M110: 42 | N110: 35 | O110: 44 | P110: 35 | Q110: 41 | R110: 35 | S110: 43 | T110: 35 | U110: 45 | V110: 35
A111: 108 | B111: 1 | C111: 2 | D111: 8 | E111: ="[{"&RC[6]&","&RC[7]&"},{"&RC[8]&","&RC[9]&"},{"&RC[10]&","&RC[11]&"},{"&RC[12]&","&RC[13]&"},{"&RC[14]&","&RC[15]&"},{"&RC[16]&","&RC[17]&"}]" -> [{40,40},{42,40},{44,40},{41,40},{43,40},{45,40}] | F111: ="[{"&RC[3]&","&RC[6]&"},{"&RC[4]&","&RC[8]&"}]" -> [{"最小攻击",40},{"最大攻击",40}] | H111: 武器 | I111: "最小攻击" | J111: "最大攻击" | K111: 40 | L111: 40 | M111: 42 | N111: 40 | O111: 44 | P111: 40 | Q111: 41 | R111: 40 | S111: 43 | T111: 40 | U111: 45 | V111: 40
A112: 109 | B112: 1 | C112: 2 | D112: 9 | E112: ="[{"&RC[6]&","&RC[7]&"},{"&RC[8]&","&RC[9]&"},{"&RC[10]&","&RC[11]&"},{"&RC[12]&","&RC[13]&"},{"&RC[14]&","&RC[15]&"},{"&RC[16]&","&RC[17]&"}]" -> [{40,45},{42,45},{44,45},{41,45},{43,45},{45,45}] | F112: ="[{"&RC[3]&","&RC[6]&"},{"&RC[4]&","&RC[8]&"}]" -> [{"最小攻击",45},{"最大攻击",45}] | H112: 武器 | I112: "最小攻击" | J112: "最大攻击" | K112: 40 | L112: 45 | M112: 42 | N112: 45 | O112: 44 | P112: 45 | Q112: 41 | R112: 45 | S112: 43 | T112: 45 | U112: 45 | V112: 45
A113: 110 | B113: 1 | C113: 2 | D113: 10 | E113: ="[{"&RC[6]&","&RC[7]&"},{"&RC[8]&","&RC[9]&"},{"&RC[10]&","&RC[11]&"},{"&RC[12]&","&RC[13]&"},{"&RC[14]&","&RC[15]&"},{"&RC[16]&","&RC[17]&"}]" -> [{40,50},{42,50},{44,50},{41,50},{43,50},{45,50}] | F113: ="[{"&RC[3]&","&RC[6]&"},{"&RC[4]&","&RC[8]&"}]" -> [{"最小攻击",50},{"最大攻击",50}] | H113: 武器 | I113: "最小攻击" | J113: "最大攻击" | K113: 40 | L113: 50 | M113: 42 | N113: 50 | O113: 44 | P113: 50 | Q113: 41 | R113: 50 | S113: 43 | T113: 50 | U113: 45 | V113: 50
A114: 111 | B114: 2 | C114: 2 | D114: 1 | E114: ="[{"&RC[6]&","&RC[7]&"},{"&RC[8]&","&RC[9]&"}]" -> [{46,5},{47,5}] | F114: ="[{"&RC[3]&","&RC[6]&"},{"&RC[4]&","&RC[8]&"}]" -> [{"最小物防",5},{"最大物防",5}] | H114: 衣服 | I114: "最小物防" | J114: "最大物防" | K114: 46 | L114: 5 | M114: 47 | N114: 5
A115: 112 | B115: 2 | C115: 2 | D115: 2 | E115: ="[{"&RC[6]&","&RC[7]&"},{"&RC[8]&","&RC[9]&"}]" -> [{46,10},{47,10}] | F115: ="[{"&RC[3]&","&RC[6]&"},{"&RC[4]&","&RC[8]&"}]" -> [{"最小物防",10},{"最大物防",10}] | H115: 衣服 | I115: "最小物防" | J115: "最大物防" | K115: 46 | L115: 10 | M115: 47 | N115: 10
A116: 113 | B116: 2 | C116: 2 | D116: 3 | E116: ="[{"&RC[6]&","&RC[7]&"},{"&RC[8]&","&RC[9]&"}]" -> [{46,15},{47,15}] | F116: ="[{"&RC[3]&","&RC[6]&"},{"&RC[4]&","&RC[8]&"}]" -> [{"最小物防",15},{"最大物防",15}] | H116: 衣服 | I116: "最小物防" | J116: "最大物防" | K116: 46 | L116: 15 | M116: 47 | N116: 15
A117: 114 | B117: 2 | C117: 2 | D117: 4 | E117: ="[{"&RC[6]&","&RC[7]&"},{"&RC[8]&","&RC[9]&"}]" -> [{46,20},{47,20}] | F117: ="[{"&RC[3]&","&RC[6]&"},{"&RC[4]&","&RC[8]&"}]" -> [{"最小物防",20},{"最大物防",20}] | H117: 衣服 | I117: "最小物防" | J117: "最大物防" | K117: 46 | L117: 20 | M117: 47 | N117: 20
A118: 115 | B118: 2 | C118: 2 | D118: 5 | E118: ="[{"&RC[6]&","&RC[7]&"},{"&RC[8]&","&RC[9]&"}]" -> [{46,25},{47,25}] | F118: ="[{"&RC[3]&","&RC[6]&"},{"&RC[4]&","&RC[8]&"}]" -> [{"最小物防",25},{"最大物防",25}] | H118: 衣服 | I118: "最小物防" | J118: "最大物防" | K118: 46 | L118: 25 | M118: 47 | N118: 25
A119: 116 | B119: 2 | C119: 2 | D119: 6 | E119: ="[{"&RC[6]&","&RC[7]&"},{"&RC[8]&","&RC[9]&"}]" -> [{46,30},{47,30}] | F119: ="[{"&RC[3]&","&RC[6]&"},{"&RC[4]&","&RC[8]&"}]" -> [{"最小物防",30},{"最大物防",30}] | H119: 衣服 | I119: "最小物防" | J119: "最大物防" | K119: 46 | L119: 30 | M119: 47 | N119: 30
A120: 117 | B120: 2 | C120: 2 | D120: 7 | E120: ="[{"&RC[6]&","&RC[7]&"},{"&RC[8]&","&RC[9]&"}]" -> [{46,35},{47,35}] | F120: ="[{"&RC[3]&","&RC[6]&"},{"&RC[4]&","&RC[8]&"}]" -> [{"最小物防",35},{"最大物防",35}] | H120: 衣服 | I120: "最小物防" | J120: "最大物防" | K120: 46 | L120: 35 | M120: 47 | N120: 35
A121: 118 | B121: 2 | C121: 2 | D121: 8 | E121: ="[{"&RC[6]&","&RC[7]&"},{"&RC[8]&","&RC[9]&"}]" -> [{46,40},{47,40}] | F121: ="[{"&RC[3]&","&RC[6]&"},{"&RC[4]&","&RC[8]&"}]" -> [{"最小物防",40},{"最大物防",40}] | H121: 衣服 | I121: "最小物防" | J121: "最大物防" | K121: 46 | L121: 40 | M121: 47 | N121: 40
A122: 119 | B122: 2 | C122: 2 | D122: 9 | E122: ="[{"&RC[6]&","&RC[7]&"},{"&RC[8]&","&RC[9]&"}]" -> [{46,45},{47,45}] | F122: ="[{"&RC[3]&","&RC[6]&"},{"&RC[4]&","&RC[8]&"}]" -> [{"最小物防",45},{"最大物防",45}] | H122: 衣服 | I122: "最小物防" | J122: "最大物防" | K122: 46 | L122: 45 | M122: 47 | N122: 45
A123: 120 | B123: 2 | C123: 2 | D123: 10 | E123: ="[{"&RC[6]&","&RC[7]&"},{"&RC[8]&","&RC[9]&"}]" -> [{46,50},{47,50}] | F123: ="[{"&RC[3]&","&RC[6]&"},{"&RC[4]&","&RC[8]&"}]" -> [{"最小物防",50},{"最大物防",50}] | H123: 衣服 | I123: "最小物防" | J123: "最大物防" | K123: 46 | L123: 50 | M123: 47 | N123: 50
A124: 121 | B124: 3 | C124: 2 | D124: 1 | E124: ="[{"&RC[6]&","&RC[7]&"},{"&RC[8]&","&RC[9]&"}]" -> [{48,5},{49,5}] | F124: ="[{"&RC[3]&","&RC[6]&"},{"&RC[4]&","&RC[8]&"}]" -> [{"最小法防",5},{"最大法防",5}] | H124: 头盔 | I124: "最小法防" | J124: "最大法防" | K124: 48 | L124: 5 | M124: 49 | N124: 5
A125: 122 | B125: 3 | C125: 2 | D125: 2 | E125: ="[{"&RC[6]&","&RC[7]&"},{"&RC[8]&","&RC[9]&"}]" -> [{48,10},{49,10}] | F125: ="[{"&RC[3]&","&RC[6]&"},{"&RC[4]&","&RC[8]&"}]" -> [{"最小法防",10},{"最大法防",10}] | H125: 头盔 | I125: "最小法防" | J125: "最大法防" | K125: 48 | L125: 10 | M125: 49 | N125: 10
A126: 123 | B126: 3 | C126: 2 | D126: 3 | E126: ="[{"&RC[6]&","&RC[7]&"},{"&RC[8]&","&RC[9]&"}]" -> [{48,15},{49,15}] | F126: ="[{"&RC[3]&","&RC[6]&"},{"&RC[4]&","&RC[8]&"}]" -> [{"最小法防",15},{"最大法防",15}] | H126: 头盔 | I126: "最小法防" | J126: "最大法防" | K126: 48 | L126: 15 | M126: 49 | N126: 15
A127: 124 | B127: 3 | C127: 2 | D127: 4 | E127: ="[{"&RC[6]&","&RC[7]&"},{"&RC[8]&","&RC[9]&"}]" -> [{48,20},{49,20}] | F127: ="[{"&RC[3]&","&RC[6]&"},{"&RC[4]&","&RC[8]&"}]" -> [{"最小法防",20},{"最大法防",20}] | H127: 头盔 | I127: "最小法防" | J127: "最大法防" | K127: 48 | L127: 20 | M127: 49 | N127: 20
A128: 125 | B128: 3 | C128: 2 | D128: 5 | E128: ="[{"&RC[6]&","&RC[7]&"},{"&RC[8]&","&RC[9]&"}]" -> [{48,25},{49,25}] | F128: ="[{"&RC[3]&","&RC[6]&"},{"&RC[4]&","&RC[8]&"}]" -> [{"最小法防",25},{"最大法防",25}] | H128: 头盔 | I128: "最小法防" | J128: "最大法防" | K128: 48 | L128: 25 | M128: 49 | N128: 25
A129: 126 | B129: 3 | C129: 2 | D129: 6 | E129: ="[{"&RC[6]&","&RC[7]&"},{"&RC[8]&","&RC[9]&"}]" -> [{48,30},{49,30}] | F129: ="[{"&RC[3]&","&RC[6]&"},{"&RC[4]&","&RC[8]&"}]" -> [{"最小法防",30},{"最大法防",30}] | H129: 头盔 | I129: "最小法防" | J129: "最大法防" | K129: 48 | L129: 30 | M129: 49 | N129: 30
A130: 127 | B130: 3 | C130: 2 | D130: 7 | E130: ="[{"&RC[6]&","&RC[7]&"},{"&RC[8]&","&RC[9]&"}]" -> [{48,35},{49,35}] | F130: ="[{"&RC[3]&","&RC[6]&"},{"&RC[4]&","&RC[8]&"}]" -> [{"最小法防",35},{"最大法防",35}] | H130: 头盔 | I130: "最小法防" | J130: "最大法防" | K130: 48 | L130: 35 | M130: 49 | N130: 35
A131: 128 | B131: 3 | C131: 2 | D131: 8 | E131: ="[{"&RC[6]&","&RC[7]&"},{"&RC[8]&","&RC[9]&"}]" -> [{48,40},{49,40}] | F131: ="[{"&RC[3]&","&RC[6]&"},{"&RC[4]&","&RC[8]&"}]" -> [{"最小法防",40},{"最大法防",40}] | H131: 头盔 | I131: "最小法防" | J131: "最大法防" | K131: 48 | L131: 40 | M131: 49 | N131: 40
A132: 129 | B132: 3 | C132: 2 | D132: 9 | E132: ="[{"&RC[6]&","&RC[7]&"},{"&RC[8]&","&RC[9]&"}]" -> [{48,45},{49,45}] | F132: ="[{"&RC[3]&","&RC[6]&"},{"&RC[4]&","&RC[8]&"}]" -> [{"最小法防",45},{"最大法防",45}] | H132: 头盔 | I132: "最小法防" | J132: "最大法防" | K132: 48 | L132: 45 | M132: 49 | N132: 45
A133: 130 | B133: 3 | C133: 2 | D133: 10 | E133: ="[{"&RC[6]&","&RC[7]&"},{"&RC[8]&","&RC[9]&"}]" -> [{48,50},{49,50}] | F133: ="[{"&RC[3]&","&RC[6]&"},{"&RC[4]&","&RC[8]&"}]" -> [{"最小法防",50},{"最大法防",50}] | H133: 头盔 | I133: "最小法防" | J133: "最大法防" | K133: 48 | L133: 50 | M133: 49 | N133: 50
A134: 131 | B134: 4 | C134: 2 | D134: 1 | E134: ="[{"&RC[6]&","&RC[7]&"},{"&RC[8]&","&RC[9]&"}]" -> [{68,5},{54,5}] | F134: ="[{"&RC[3]&","&RC[6]&"},{"&RC[4]&","&RC[8]&"}]" -> [{"挂机金币",5},{"伤害加深",5}] | H134: 项链 | I134: "挂机金币" | J134: "伤害加深" | K134: 68 | L134: 5 | M134: 54 | N134: 5
A135: 132 | B135: 4 | C135: 2 | D135: 2 | E135: ="[{"&RC[6]&","&RC[7]&"},{"&RC[8]&","&RC[9]&"}]" -> [{68,10},{54,10}] | F135: ="[{"&RC[3]&","&RC[6]&"},{"&RC[4]&","&RC[8]&"}]" -> [{"挂机金币",10},{"伤害加深",10}] | H135: 项链 | I135: "挂机金币" | J135: "伤害加深" | K135: 68 | L135: 10 | M135: 54 | N135: 10
A136: 133 | B136: 4 | C136: 2 | D136: 3 | E136: ="[{"&RC[6]&","&RC[7]&"},{"&RC[8]&","&RC[9]&"}]" -> [{68,15},{54,15}] | F136: ="[{"&RC[3]&","&RC[6]&"},{"&RC[4]&","&RC[8]&"}]" -> [{"挂机金币",15},{"伤害加深",15}] | H136: 项链 | I136: "挂机金币" | J136: "伤害加深" | K136: 68 | L136: 15 | M136: 54 | N136: 15
A137: 134 | B137: 4 | C137: 2 | D137: 4 | E137: ="[{"&RC[6]&","&RC[7]&"},{"&RC[8]&","&RC[9]&"}]" -> [{68,20},{54,20}] | F137: ="[{"&RC[3]&","&RC[6]&"},{"&RC[4]&","&RC[8]&"}]" -> [{"挂机金币",20},{"伤害加深",20}] | H137: 项链 | I137: "挂机金币" | J137: "伤害加深" | K137: 68 | L137: 20 | M137: 54 | N137: 20
A138: 135 | B138: 4 | C138: 2 | D138: 5 | E138: ="[{"&RC[6]&","&RC[7]&"},{"&RC[8]&","&RC[9]&"}]" -> [{68,25},{54,25}] | F138: ="[{"&RC[3]&","&RC[6]&"},{"&RC[4]&","&RC[8]&"}]" -> [{"挂机金币",25},{"伤害加深",25}] | H138: 项链 | I138: "挂机金币" | J138: "伤害加深" | K138: 68 | L138: 25 | M138: 54 | N138: 25
A139: 136 | B139: 4 | C139: 2 | D139: 6 | E139: ="[{"&RC[6]&","&RC[7]&"},{"&RC[8]&","&RC[9]&"}]" -> [{68,30},{54,30}] | F139: ="[{"&RC[3]&","&RC[6]&"},{"&RC[4]&","&RC[8]&"}]" -> [{"挂机金币",30},{"伤害加深",30}] | H139: 项链 | I139: "挂机金币" | J139: "伤害加深" | K139: 68 | L139: 30 | M139: 54 | N139: 30
A140: 137 | B140: 4 | C140: 2 | D140: 7 | E140: ="[{"&RC[6]&","&RC[7]&"},{"&RC[8]&","&RC[9]&"}]" -> [{68,35},{54,35}] | F140: ="[{"&RC[3]&","&RC[6]&"},{"&RC[4]&","&RC[8]&"}]" -> [{"挂机金币",35},{"伤害加深",35}] | H140: 项链 | I140: "挂机金币" | J140: "伤害加深" | K140: 68 | L140: 35 | M140: 54 | N140: 35
A141: 138 | B141: 4 | C141: 2 | D141: 8 | E141: ="[{"&RC[6]&","&RC[7]&"},{"&RC[8]&","&RC[9]&"}]" -> [{68,40},{54,40}] | F141: ="[{"&RC[3]&","&RC[6]&"},{"&RC[4]&","&RC[8]&"}]" -> [{"挂机金币",40},{"伤害加深",40}] | H141: 项链 | I141: "挂机金币" | J141: "伤害加深" | K141: 68 | L141: 40 | M141: 54 | N141: 40
A142: 139 | B142: 4 | C142: 2 | D142: 9 | E142: ="[{"&RC[6]&","&RC[7]&"},{"&RC[8]&","&RC[9]&"}]" -> [{68,45},{54,45}] | F142: ="[{"&RC[3]&","&RC[6]&"},{"&RC[4]&","&RC[8]&"}]" -> [{"挂机金币",45},{"伤害加深",45}] | H142: 项链 | I142: "挂机金币" | J142: "伤害加深" | K142: 68 | L142: 45 | M142: 54 | N142: 45
A143: 140 | B143: 4 | C143: 2 | D143: 10 | E143: ="[{"&RC[6]&","&RC[7]&"},{"&RC[8]&","&RC[9]&"}]" -> [{68,50},{54,50}] | F143: ="[{"&RC[3]&","&RC[6]&"},{"&RC[4]&","&RC[8]&"}]" -> [{"挂机金币",50},{"伤害加深",50}] | H143: 项链 | I143: "挂机金币" | J143: "伤害加深" | K143: 68 | L143: 50 | M143: 54 | N143: 50
A144: 141 | B144: 5 | C144: 2 | D144: 1 | E144: ="[{"&RC[6]&","&RC[7]&"},{"&RC[8]&","&RC[9]&"}]" -> [{69,5},{55,5}] | F144: ="[{"&RC[3]&","&RC[6]&"},{"&RC[4]&","&RC[8]&"}]" -> [{"挂机经验",5},{"伤害减免",5}] | H144: 勋章 | I144: "挂机经验" | J144: "伤害减免" | K144: 69 | L144: 5 | M144: 55 | N144: 5
A145: 142 | B145: 5 | C145: 2 | D145: 2 | E145: ="[{"&RC[6]&","&RC[7]&"},{"&RC[8]&","&RC[9]&"}]" -> [{69,10},{55,10}] | F145: ="[{"&RC[3]&","&RC[6]&"},{"&RC[4]&","&RC[8]&"}]" -> [{"挂机经验",10},{"伤害减免",10}] | H145: 勋章 | I145: "挂机经验" | J145: "伤害减免" | K145: 69 | L145: 10 | M145: 55 | N145: 10
A146: 143 | B146: 5 | C146: 2 | D146: 3 | E146: ="[{"&RC[6]&","&RC[7]&"},{"&RC[8]&","&RC[9]&"}]" -> [{69,15},{55,15}] | F146: ="[{"&RC[3]&","&RC[6]&"},{"&RC[4]&","&RC[8]&"}]" -> [{"挂机经验",15},{"伤害减免",15}] | H146: 勋章 | I146: "挂机经验" | J146: "伤害减免" | K146: 69 | L146: 15 | M146: 55 | N146: 15
A147: 144 | B147: 5 | C147: 2 | D147: 4 | E147: ="[{"&RC[6]&","&RC[7]&"},{"&RC[8]&","&RC[9]&"}]" -> [{69,20},{55,20}] | F147: ="[{"&RC[3]&","&RC[6]&"},{"&RC[4]&","&RC[8]&"}]" -> [{"挂机经验",20},{"伤害减免",20}] | H147: 勋章 | I147: "挂机经验" | J147: "伤害减免" | K147: 69 | L147: 20 | M147: 55 | N147: 20
A148: 145 | B148: 5 | C148: 2 | D148: 5 | E148: ="[{"&RC[6]&","&RC[7]&"},{"&RC[8]&","&RC[9]&"}]" -> [{69,25},{55,25}] | F148: ="[{"&RC[3]&","&RC[6]&"},{"&RC[4]&","&RC[8]&"}]" -> [{"挂机经验",25},{"伤害减免",25}] | H148: 勋章 | I148: "挂机经验" | J148: "伤害减免" | K148: 69 | L148: 25 | M148: 55 | N148: 25
A149: 146 | B149: 5 | C149: 2 | D149: 6 | E149: ="[{"&RC[6]&","&RC[7]&"},{"&RC[8]&","&RC[9]&"}]" -> [{69,30},{55,30}] | F149: ="[{"&RC[3]&","&RC[6]&"},{"&RC[4]&","&RC[8]&"}]" -> [{"挂机经验",30},{"伤害减免",30}] | H149: 勋章 | I149: "挂机经验" | J149: "伤害减免" | K149: 69 | L149: 30 | M149: 55 | N149: 30
A150: 147 | B150: 5 | C150: 2 | D150: 7 | E150: ="[{"&RC[6]&","&RC[7]&"},{"&RC[8]&","&RC[9]&"}]" -> [{69,35},{55,35}] | F150: ="[{"&RC[3]&","&RC[6]&"},{"&RC[4]&","&RC[8]&"}]" -> [{"挂机经验",35},{"伤害减免",35}] | H150: 勋章 | I150: "挂机经验" | J150: "伤害减免" | K150: 69 | L150: 35 | M150: 55 | N150: 35
A151: 148 | B151: 5 | C151: 2 | D151: 8 | E151: ="[{"&RC[6]&","&RC[7]&"},{"&RC[8]&","&RC[9]&"}]" -> [{69,40},{55,40}] | F151: ="[{"&RC[3]&","&RC[6]&"},{"&RC[4]&","&RC[8]&"}]" -> [{"挂机经验",40},{"伤害减免",40}] | H151: 勋章 | I151: "挂机经验" | J151: "伤害减免" | K151: 69 | L151: 40 | M151: 55 | N151: 40
A152: 149 | B152: 5 | C152: 2 | D152: 9 | E152: ="[{"&RC[6]&","&RC[7]&"},{"&RC[8]&","&RC[9]&"}]" -> [{69,45},{55,45}] | F152: ="[{"&RC[3]&","&RC[6]&"},{"&RC[4]&","&RC[8]&"}]" -> [{"挂机经验",45},{"伤害减免",45}] | H152: 勋章 | I152: "挂机经验" | J152: "伤害减免" | K152: 69 | L152: 45 | M152: 55 | N152: 45
A153: 150 | B153: 5 | C153: 2 | D153: 10 | E153: ="[{"&RC[6]&","&RC[7]&"},{"&RC[8]&","&RC[9]&"}]" -> [{69,50},{55,50}] | F153: ="[{"&RC[3]&","&RC[6]&"},{"&RC[4]&","&RC[8]&"}]" -> [{"挂机经验",50},{"伤害减免",50}] | H153: 勋章 | I153: "挂机经验" | J153: "伤害减免" | K153: 69 | L153: 50 | M153: 55 | N153: 50
A154: 151 | B154: 6 | C154: 2 | D154: 1 | E154: ="[{"&RC[6]&","&RC[7]&"},{"&RC[8]&","&RC[9]&"}]" -> [{50,5},{60,5}] | F154: ="[{"&RC[3]&","&RC[6]&"},{"&RC[4]&","&RC[8]&"}]" -> [{"暴击",5},{"生命恢复",5}] | H154: 手镯 | I154: "暴击" | J154: "生命恢复" | K154: 50 | L154: 5 | M154: 60 | N154: 5
A155: 152 | B155: 6 | C155: 2 | D155: 2 | E155: ="[{"&RC[6]&","&RC[7]&"},{"&RC[8]&","&RC[9]&"}]" -> [{50,10},{60,10}] | F155: ="[{"&RC[3]&","&RC[6]&"},{"&RC[4]&","&RC[8]&"}]" -> [{"暴击",10},{"生命恢复",10}] | H155: 手镯 | I155: "暴击" | J155: "生命恢复" | K155: 50 | L155: 10 | M155: 60 | N155: 10
A156: 153 | B156: 6 | C156: 2 | D156: 3 | E156: ="[{"&RC[6]&","&RC[7]&"},{"&RC[8]&","&RC[9]&"}]" -> [{50,15},{60,15}] | F156: ="[{"&RC[3]&","&RC[6]&"},{"&RC[4]&","&RC[8]&"}]" -> [{"暴击",15},{"生命恢复",15}] | H156: 手镯 | I156: "暴击" | J156: "生命恢复" | K156: 50 | L156: 15 | M156: 60 | N156: 15
A157: 154 | B157: 6 | C157: 2 | D157: 4 | E157: ="[{"&RC[6]&","&RC[7]&"},{"&RC[8]&","&RC[9]&"}]" -> [{50,20},{60,20}] | F157: ="[{"&RC[3]&","&RC[6]&"},{"&RC[4]&","&RC[8]&"}]" -> [{"暴击",20},{"生命恢复",20}] | H157: 手镯 | I157: "暴击" | J157: "生命恢复" | K157: 50 | L157: 20 | M157: 60 | N157: 20
A158: 155 | B158: 6 | C158: 2 | D158: 5 | E158: ="[{"&RC[6]&","&RC[7]&"},{"&RC[8]&","&RC[9]&"}]" -> [{50,25},{60,25}] | F158: ="[{"&RC[3]&","&RC[6]&"},{"&RC[4]&","&RC[8]&"}]" -> [{"暴击",25},{"生命恢复",25}] | H158: 手镯 | I158: "暴击" | J158: "生命恢复" | K158: 50 | L158: 25 | M158: 60 | N158: 25
A159: 156 | B159: 6 | C159: 2 | D159: 6 | E159: ="[{"&RC[6]&","&RC[7]&"},{"&RC[8]&","&RC[9]&"}]" -> [{50,30},{60,30}] | F159: ="[{"&RC[3]&","&RC[6]&"},{"&RC[4]&","&RC[8]&"}]" -> [{"暴击",30},{"生命恢复",30}] | H159: 手镯 | I159: "暴击" | J159: "生命恢复" | K159: 50 | L159: 30 | M159: 60 | N159: 30
A160: 157 | B160: 6 | C160: 2 | D160: 7 | E160: ="[{"&RC[6]&","&RC[7]&"},{"&RC[8]&","&RC[9]&"}]" -> [{50,35},{60,35}] | F160: ="[{"&RC[3]&","&RC[6]&"},{"&RC[4]&","&RC[8]&"}]" -> [{"暴击",35},{"生命恢复",35}] | H160: 手镯 | I160: "暴击" | J160: "生命恢复" | K160: 50 | L160: 35 | M160: 60 | N160: 35
A161: 158 | B161: 6 | C161: 2 | D161: 8 | E161: ="[{"&RC[6]&","&RC[7]&"},{"&RC[8]&","&RC[9]&"}]" -> [{50,40},{60,40}] | F161: ="[{"&RC[3]&","&RC[6]&"},{"&RC[4]&","&RC[8]&"}]" -> [{"暴击",40},{"生命恢复",40}] | H161: 手镯 | I161: "暴击" | J161: "生命恢复" | K161: 50 | L161: 40 | M161: 60 | N161: 40
A162: 159 | B162: 6 | C162: 2 | D162: 9 | E162: ="[{"&RC[6]&","&RC[7]&"},{"&RC[8]&","&RC[9]&"}]" -> [{50,45},{60,45}] | F162: ="[{"&RC[3]&","&RC[6]&"},{"&RC[4]&","&RC[8]&"}]" -> [{"暴击",45},{"生命恢复",45}] | H162: 手镯 | I162: "暴击" | J162: "生命恢复" | K162: 50 | L162: 45 | M162: 60 | N162: 45
A163: 160 | B163: 6 | C163: 2 | D163: 10 | E163: ="[{"&RC[6]&","&RC[7]&"},{"&RC[8]&","&RC[9]&"}]" -> [{50,50},{60,50}] | F163: ="[{"&RC[3]&","&RC[6]&"},{"&RC[4]&","&RC[8]&"}]" -> [{"暴击",50},{"生命恢复",50}] | H163: 手镯 | I163: "暴击" | J163: "生命恢复" | K163: 50 | L163: 50 | M163: 60 | N163: 50
A164: 161 | B164: 7 | C164: 2 | D164: 1 | E164: ="[{"&RC[6]&","&RC[7]&"},{"&RC[8]&","&RC[9]&"}]" -> [{51,5},{61,5}] | F164: ="[{"&RC[3]&","&RC[6]&"},{"&RC[4]&","&RC[8]&"}]" -> [{"暴击力",5},{"魔法恢复",5}] | H164: 戒指 | I164: "暴击力" | J164: "魔法恢复" | K164: 51 | L164: 5 | M164: 61 | N164: 5
A165: 162 | B165: 7 | C165: 2 | D165: 2 | E165: ="[{"&RC[6]&","&RC[7]&"},{"&RC[8]&","&RC[9]&"}]" -> [{51,10},{61,10}] | F165: ="[{"&RC[3]&","&RC[6]&"},{"&RC[4]&","&RC[8]&"}]" -> [{"暴击力",10},{"魔法恢复",10}] | H165: 戒指 | I165: "暴击力" | J165: "魔法恢复" | K165: 51 | L165: 10 | M165: 61 | N165: 10
A166: 163 | B166: 7 | C166: 2 | D166: 3 | E166: ="[{"&RC[6]&","&RC[7]&"},{"&RC[8]&","&RC[9]&"}]" -> [{51,15},{61,15}] | F166: ="[{"&RC[3]&","&RC[6]&"},{"&RC[4]&","&RC[8]&"}]" -> [{"暴击力",15},{"魔法恢复",15}] | H166: 戒指 | I166: "暴击力" | J166: "魔法恢复" | K166: 51 | L166: 15 | M166: 61 | N166: 15
A167: 164 | B167: 7 | C167: 2 | D167: 4 | E167: ="[{"&RC[6]&","&RC[7]&"},{"&RC[8]&","&RC[9]&"}]" -> [{51,20},{61,20}] | F167: ="[{"&RC[3]&","&RC[6]&"},{"&RC[4]&","&RC[8]&"}]" -> [{"暴击力",20},{"魔法恢复",20}] | H167: 戒指 | I167: "暴击力" | J167: "魔法恢复" | K167: 51 | L167: 20 | M167: 61 | N167: 20
A168: 165 | B168: 7 | C168: 2 | D168: 5 | E168: ="[{"&RC[6]&","&RC[7]&"},{"&RC[8]&","&RC[9]&"}]" -> [{51,25},{61,25}] | F168: ="[{"&RC[3]&","&RC[6]&"},{"&RC[4]&","&RC[8]&"}]" -> [{"暴击力",25},{"魔法恢复",25}] | H168: 戒指 | I168: "暴击力" | J168: "魔法恢复" | K168: 51 | L168: 25 | M168: 61 | N168: 25
A169: 166 | B169: 7 | C169: 2 | D169: 6 | E169: ="[{"&RC[6]&","&RC[7]&"},{"&RC[8]&","&RC[9]&"}]" -> [{51,30},{61,30}] | F169: ="[{"&RC[3]&","&RC[6]&"},{"&RC[4]&","&RC[8]&"}]" -> [{"暴击力",30},{"魔法恢复",30}] | H169: 戒指 | I169: "暴击力" | J169: "魔法恢复" | K169: 51 | L169: 30 | M169: 61 | N169: 30
A170: 167 | B170: 7 | C170: 2 | D170: 7 | E170: ="[{"&RC[6]&","&RC[7]&"},{"&RC[8]&","&RC[9]&"}]" -> [{51,35},{61,35}] | F170: ="[{"&RC[3]&","&RC[6]&"},{"&RC[4]&","&RC[8]&"}]" -> [{"暴击力",35},{"魔法恢复",35}] | H170: 戒指 | I170: "暴击力" | J170: "魔法恢复" | K170: 51 | L170: 35 | M170: 61 | N170: 35
A171: 168 | B171: 7 | C171: 2 | D171: 8 | E171: ="[{"&RC[6]&","&RC[7]&"},{"&RC[8]&","&RC[9]&"}]" -> [{51,40},{61,40}] | F171: ="[{"&RC[3]&","&RC[6]&"},{"&RC[4]&","&RC[8]&"}]" -> [{"暴击力",40},{"魔法恢复",40}] | H171: 戒指 | I171: "暴击力" | J171: "魔法恢复" | K171: 51 | L171: 40 | M171: 61 | N171: 40
A172: 169 | B172: 7 | C172: 2 | D172: 9 | E172: ="[{"&RC[6]&","&RC[7]&"},{"&RC[8]&","&RC[9]&"}]" -> [{51,45},{61,45}] | F172: ="[{"&RC[3]&","&RC[6]&"},{"&RC[4]&","&RC[8]&"}]" -> [{"暴击力",45},{"魔法恢复",45}] | H172: 戒指 | I172: "暴击力" | J172: "魔法恢复" | K172: 51 | L172: 45 | M172: 61 | N172: 45
A173: 170 | B173: 7 | C173: 2 | D173: 10 | E173: ="[{"&RC[6]&","&RC[7]&"},{"&RC[8]&","&RC[9]&"}]" -> [{51,50},{61,50}] | F173: ="[{"&RC[3]&","&RC[6]&"},{"&RC[4]&","&RC[8]&"}]" -> [{"暴击力",50},{"魔法恢复",50}] | H173: 戒指 | I173: "暴击力" | J173: "魔法恢复" | K173: 51 | L173: 50 | M173: 61 | N173: 50
A174: 171 | B174: 8 | C174: 2 | D174: 1 | E174: ="[{"&RC[6]&","&RC[7]&"},{"&RC[8]&","&RC[9]&"}]" -> [{39,5},{38,5}] | F174: ="[{"&RC[3]&","&RC[6]&"},{"&RC[4]&","&RC[8]&"}]" -> [{"生命",5},{"魔法",5}] | H174: 腰带 | I174: "生命" | J174: "魔法" | K174: 39 | L174: 5 | M174: 38 | N174: 5
A175: 172 | B175: 8 | C175: 2 | D175: 2 | E175: ="[{"&RC[6]&","&RC[7]&"},{"&RC[8]&","&RC[9]&"}]" -> [{39,10},{38,10}] | F175: ="[{"&RC[3]&","&RC[6]&"},{"&RC[4]&","&RC[8]&"}]" -> [{"生命",10},{"魔法",10}] | H175: 腰带 | I175: "生命" | J175: "魔法" | K175: 39 | L175: 10 | M175: 38 | N175: 10
A176: 173 | B176: 8 | C176: 2 | D176: 3 | E176: ="[{"&RC[6]&","&RC[7]&"},{"&RC[8]&","&RC[9]&"}]" -> [{39,15},{38,15}] | F176: ="[{"&RC[3]&","&RC[6]&"},{"&RC[4]&","&RC[8]&"}]" -> [{"生命",15},{"魔法",15}] | H176: 腰带 | I176: "生命" | J176: "魔法" | K176: 39 | L176: 15 | M176: 38 | N176: 15
A177: 174 | B177: 8 | C177: 2 | D177: 4 | E177: ="[{"&RC[6]&","&RC[7]&"},{"&RC[8]&","&RC[9]&"}]" -> [{39,20},{38,20}] | F177: ="[{"&RC[3]&","&RC[6]&"},{"&RC[4]&","&RC[8]&"}]" -> [{"生命",20},{"魔法",20}] | H177: 腰带 | I177: "生命" | J177: "魔法" | K177: 39 | L177: 20 | M177: 38 | N177: 20
A178: 175 | B178: 8 | C178: 2 | D178: 5 | E178: ="[{"&RC[6]&","&RC[7]&"},{"&RC[8]&","&RC[9]&"}]" -> [{39,25},{38,25}] | F178: ="[{"&RC[3]&","&RC[6]&"},{"&RC[4]&","&RC[8]&"}]" -> [{"生命",25},{"魔法",25}] | H178: 腰带 | I178: "生命" | J178: "魔法" | K178: 39 | L178: 25 | M178: 38 | N178: 25
A179: 176 | B179: 8 | C179: 2 | D179: 6 | E179: ="[{"&RC[6]&","&RC[7]&"},{"&RC[8]&","&RC[9]&"}]" -> [{39,30},{38,30}] | F179: ="[{"&RC[3]&","&RC[6]&"},{"&RC[4]&","&RC[8]&"}]" -> [{"生命",30},{"魔法",30}] | H179: 腰带 | I179: "生命" | J179: "魔法" | K179: 39 | L179: 30 | M179: 38 | N179: 30
A180: 177 | B180: 8 | C180: 2 | D180: 7 | E180: ="[{"&RC[6]&","&RC[7]&"},{"&RC[8]&","&RC[9]&"}]" -> [{39,35},{38,35}] | F180: ="[{"&RC[3]&","&RC[6]&"},{"&RC[4]&","&RC[8]&"}]" -> [{"生命",35},{"魔法",35}] | H180: 腰带 | I180: "生命" | J180: "魔法" | K180: 39 | L180: 35 | M180: 38 | N180: 35
A181: 178 | B181: 8 | C181: 2 | D181: 8 | E181: ="[{"&RC[6]&","&RC[7]&"},{"&RC[8]&","&RC[9]&"}]" -> [{39,40},{38,40}] | F181: ="[{"&RC[3]&","&RC[6]&"},{"&RC[4]&","&RC[8]&"}]" -> [{"生命",40},{"魔法",40}] | H181: 腰带 | I181: "生命" | J181: "魔法" | K181: 39 | L181: 40 | M181: 38 | N181: 40
A182: 179 | B182: 8 | C182: 2 | D182: 9 | E182: ="[{"&RC[6]&","&RC[7]&"},{"&RC[8]&","&RC[9]&"}]" -> [{39,45},{38,45}] | F182: ="[{"&RC[3]&","&RC[6]&"},{"&RC[4]&","&RC[8]&"}]" -> [{"生命",45},{"魔法",45}] | H182: 腰带 | I182: "生命" | J182: "魔法" | K182: 39 | L182: 45 | M182: 38 | N182: 45
A183: 180 | B183: 8 | C183: 2 | D183: 10 | E183: ="[{"&RC[6]&","&RC[7]&"},{"&RC[8]&","&RC[9]&"}]" -> [{39,50},{38,50}] | F183: ="[{"&RC[3]&","&RC[6]&"},{"&RC[4]&","&RC[8]&"}]" -> [{"生命",50},{"魔法",50}] | H183: 腰带 | I183: "生命" | J183: "魔法" | K183: 39 | L183: 50 | M183: 38 | N183: 50
A184: 181 | B184: 9 | C184: 2 | D184: 1 | E184: ="[{"&RC[6]&","&RC[7]&"},{"&RC[8]&","&RC[9]&"}]" -> [{52,5},{58,5}] | F184: ="[{"&RC[3]&","&RC[6]&"},{"&RC[4]&","&RC[8]&"}]" -> [{"准确",5},{"魔法命中",5}] | H184: 裤子 | I184: "准确" | J184: "魔法命中" | K184: 52 | L184: 5 | M184: 58 | N184: 5
A185: 182 | B185: 9 | C185: 2 | D185: 2 | E185: ="[{"&RC[6]&","&RC[7]&"},{"&RC[8]&","&RC[9]&"}]" -> [{52,10},{58,10}] | F185: ="[{"&RC[3]&","&RC[6]&"},{"&RC[4]&","&RC[8]&"}]" -> [{"准确",10},{"魔法命中",10}] | H185: 裤子 | I185: "准确" | J185: "魔法命中" | K185: 52 | L185: 10 | M185: 58 | N185: 10
A186: 183 | B186: 9 | C186: 2 | D186: 3 | E186: ="[{"&RC[6]&","&RC[7]&"},{"&RC[8]&","&RC[9]&"}]" -> [{52,15},{58,15}] | F186: ="[{"&RC[3]&","&RC[6]&"},{"&RC[4]&","&RC[8]&"}]" -> [{"准确",15},{"魔法命中",15}] | H186: 裤子 | I186: "准确" | J186: "魔法命中" | K186: 52 | L186: 15 | M186: 58 | N186: 15
A187: 184 | B187: 9 | C187: 2 | D187: 4 | E187: ="[{"&RC[6]&","&RC[7]&"},{"&RC[8]&","&RC[9]&"}]" -> [{52,20},{58,20}] | F187: ="[{"&RC[3]&","&RC[6]&"},{"&RC[4]&","&RC[8]&"}]" -> [{"准确",20},{"魔法命中",20}] | H187: 裤子 | I187: "准确" | J187: "魔法命中" | K187: 52 | L187: 20 | M187: 58 | N187: 20
A188: 185 | B188: 9 | C188: 2 | D188: 5 | E188: ="[{"&RC[6]&","&RC[7]&"},{"&RC[8]&","&RC[9]&"}]" -> [{52,25},{58,25}] | F188: ="[{"&RC[3]&","&RC[6]&"},{"&RC[4]&","&RC[8]&"}]" -> [{"准确",25},{"魔法命中",25}] | H188: 裤子 | I188: "准确" | J188: "魔法命中" | K188: 52 | L188: 25 | M188: 58 | N188: 25
A189: 186 | B189: 9 | C189: 2 | D189: 6 | E189: ="[{"&RC[6]&","&RC[7]&"},{"&RC[8]&","&RC[9]&"}]" -> [{52,30},{58,30}] | F189: ="[{"&RC[3]&","&RC[6]&"},{"&RC[4]&","&RC[8]&"}]" -> [{"准确",30},{"魔法命中",30}] | H189: 裤子 | I189: "准确" | J189: "魔法命中" | K189: 52 | L189: 30 | M189: 58 | N189: 30
A190: 187 | B190: 9 | C190: 2 | D190: 7 | E190: ="[{"&RC[6]&","&RC[7]&"},{"&RC[8]&","&RC[9]&"}]" -> [{52,35},{58,35}] | F190: ="[{"&RC[3]&","&RC[6]&"},{"&RC[4]&","&RC[8]&"}]" -> [{"准确",35},{"魔法命中",35}] | H190: 裤子 | I190: "准确" | J190: "魔法命中" | K190: 52 | L190: 35 | M190: 58 | N190: 35
A191: 188 | B191: 9 | C191: 2 | D191: 8 | E191: ="[{"&RC[6]&","&RC[7]&"},{"&RC[8]&","&RC[9]&"}]" -> [{52,40},{58,40}] | F191: ="[{"&RC[3]&","&RC[6]&"},{"&RC[4]&","&RC[8]&"}]" -> [{"准确",40},{"魔法命中",40}] | H191: 裤子 | I191: "准确" | J191: "魔法命中" | K191: 52 | L191: 40 | M191: 58 | N191: 40
A192: 189 | B192: 9 | C192: 2 | D192: 9 | E192: ="[{"&RC[6]&","&RC[7]&"},{"&RC[8]&","&RC[9]&"}]" -> [{52,45},{58,45}] | F192: ="[{"&RC[3]&","&RC[6]&"},{"&RC[4]&","&RC[8]&"}]" -> [{"准确",45},{"魔法命中",45}] | H192: 裤子 | I192: "准确" | J192: "魔法命中" | K192: 52 | L192: 45 | M192: 58 | N192: 45
A193: 190 | B193: 9 | C193: 2 | D193: 10 | E193: ="[{"&RC[6]&","&RC[7]&"},{"&RC[8]&","&RC[9]&"}]" -> [{52,50},{58,50}] | F193: ="[{"&RC[3]&","&RC[6]&"},{"&RC[4]&","&RC[8]&"}]" -> [{"准确",50},{"魔法命中",50}] | H193: 裤子 | I193: "准确" | J193: "魔法命中" | K193: 52 | L193: 50 | M193: 58 | N193: 50
A194: 191 | B194: 10 | C194: 2 | D194: 1 | E194: ="[{"&RC[6]&","&RC[7]&"},{"&RC[8]&","&RC[9]&"}]" -> [{53,5},{59,5}] | F194: ="[{"&RC[3]&","&RC[6]&"},{"&RC[4]&","&RC[8]&"}]" -> [{"敏捷",5},{"魔法闪避",5}] | H194: 鞋子 | I194: "敏捷" | J194: "魔法闪避" | K194: 53 | L194: 5 | M194: 59 | N194: 5
A195: 192 | B195: 10 | C195: 2 | D195: 2 | E195: ="[{"&RC[6]&","&RC[7]&"},{"&RC[8]&","&RC[9]&"}]" -> [{53,10},{59,10}] | F195: ="[{"&RC[3]&","&RC[6]&"},{"&RC[4]&","&RC[8]&"}]" -> [{"敏捷",10},{"魔法闪避",10}] | H195: 鞋子 | I195: "敏捷" | J195: "魔法闪避" | K195: 53 | L195: 10 | M195: 59 | N195: 10
A196: 193 | B196: 10 | C196: 2 | D196: 3 | E196: ="[{"&RC[6]&","&RC[7]&"},{"&RC[8]&","&RC[9]&"}]" -> [{53,15},{59,15}] | F196: ="[{"&RC[3]&","&RC[6]&"},{"&RC[4]&","&RC[8]&"}]" -> [{"敏捷",15},{"魔法闪避",15}] | H196: 鞋子 | I196: "敏捷" | J196: "魔法闪避" | K196: 53 | L196: 15 | M196: 59 | N196: 15
A197: 194 | B197: 10 | C197: 2 | D197: 4 | E197: ="[{"&RC[6]&","&RC[7]&"},{"&RC[8]&","&RC[9]&"}]" -> [{53,20},{59,20}] | F197: ="[{"&RC[3]&","&RC[6]&"},{"&RC[4]&","&RC[8]&"}]" -> [{"敏捷",20},{"魔法闪避",20}] | H197: 鞋子 | I197: "敏捷" | J197: "魔法闪避" | K197: 53 | L197: 20 | M197: 59 | N197: 20
A198: 195 | B198: 10 | C198: 2 | D198: 5 | E198: ="[{"&RC[6]&","&RC[7]&"},{"&RC[8]&","&RC[9]&"}]" -> [{53,25},{59,25}] | F198: ="[{"&RC[3]&","&RC[6]&"},{"&RC[4]&","&RC[8]&"}]" -> [{"敏捷",25},{"魔法闪避",25}] | H198: 鞋子 | I198: "敏捷" | J198: "魔法闪避" | K198: 53 | L198: 25 | M198: 59 | N198: 25
A199: 196 | B199: 10 | C199: 2 | D199: 6 | E199: ="[{"&RC[6]&","&RC[7]&"},{"&RC[8]&","&RC[9]&"}]" -> [{53,30},{59,30}] | F199: ="[{"&RC[3]&","&RC[6]&"},{"&RC[4]&","&RC[8]&"}]" -> [{"敏捷",30},{"魔法闪避",30}] | H199: 鞋子 | I199: "敏捷" | J199: "魔法闪避" | K199: 53 | L199: 30 | M199: 59 | N199: 30
A200: 197 | B200: 10 | C200: 2 | D200: 7 | E200: ="[{"&RC[6]&","&RC[7]&"},{"&RC[8]&","&RC[9]&"}]" -> [{53,35},{59,35}] | F200: ="[{"&RC[3]&","&RC[6]&"},{"&RC[4]&","&RC[8]&"}]" -> [{"敏捷",35},{"魔法闪避",35}] | H200: 鞋子 | I200: "敏捷" | J200: "魔法闪避" | K200: 53 | L200: 35 | M200: 59 | N200: 35
A201: 198 | B201: 10 | C201: 2 | D201: 8 | E201: ="[{"&RC[6]&","&RC[7]&"},{"&RC[8]&","&RC[9]&"}]" -> [{53,40},{59,40}] | F201: ="[{"&RC[3]&","&RC[6]&"},{"&RC[4]&","&RC[8]&"}]" -> [{"敏捷",40},{"魔法闪避",40}] | H201: 鞋子 | I201: "敏捷" | J201: "魔法闪避" | K201: 53 | L201: 40 | M201: 59 | N201: 40
A202: 199 | B202: 10 | C202: 2 | D202: 9 | E202: ="[{"&RC[6]&","&RC[7]&"},{"&RC[8]&","&RC[9]&"}]" -> [{53,45},{59,45}] | F202: ="[{"&RC[3]&","&RC[6]&"},{"&RC[4]&","&RC[8]&"}]" -> [{"敏捷",45},{"魔法闪避",45}] | H202: 鞋子 | I202: "敏捷" | J202: "魔法闪避" | K202: 53 | L202: 45 | M202: 59 | N202: 45
A203: 200 | B203: 10 | C203: 2 | D203: 10 | E203: ="[{"&RC[6]&","&RC[7]&"},{"&RC[8]&","&RC[9]&"}]" -> [{53,50},{59,50}] | F203: ="[{"&RC[3]&","&RC[6]&"},{"&RC[4]&","&RC[8]&"}]" -> [{"敏捷",50},{"魔法闪避",50}] | H203: 鞋子 | I203: "敏捷" | J203: "魔法闪避" | K203: 53 | L203: 50 | M203: 59 | N203: 50