Sheet: 礼包配置
A1: key | B1: goods
A2: key | B2: goods
A3: 礼包id | B3: 道具 | C3: 描述
A4: 101 | B4: [{200010,1,1},{200011,1,1},{200012,1,1},{200013,1,1},{200015,1,1},{200016,1,1},{200017,1,1},{200019,1,1}]
A5: 102 | B5: [{201010,1,1},{201011,1,1},{201012,1,1},{201013,1,1},{201015,1,1},{201016,1,1},{201017,1,1},{201019,1,1}]
A6: 103 | B6: [{202010,1,1},{202011,1,1},{202012,1,1},{202013,1,1},{202015,1,1},{202016,1,1},{202017,1,1},{202019,1,1}]
A7: 104 | B7: [{110009,0,100000}]
A8: 105 | B8: [{305006,0,1},{110008,0,5000}]
A9: 106 | B9: [{305007,0,1},{110008,0,5000}]
A10: 107 | B10: [{305008,0,1},{110008,0,5000}]
A11: 108 | B11: [{110009,0,50000},{110004,1,99},{110005,1,99}] | C11: 累积1天礼包
A12: 109 | B12: [{110009,0,50000},{110079,1,50},{110128,1,1}] | C12: 累积2天礼包
A13: 110 | B13: [{110009,0,50000},{110003,1,10},{110007,1,20}] | C13: 累积3天礼包
A14: 111 | B14: [{110009,0,50000},{110076,1,99},{110077,1,99}] | C14: 累积4天礼包
A15: 112 | B15: [{110009,0,50000},{110078,1,20},{110129,1,1}] | C15: 累积5天礼包
A16: 113 | B16: [{110009,0,50000},{110049,1,10},{110054,1,10}] | C16: 累积6天礼包
A17: 114 | B17: [{110009,0,50000},{110083,1,20},{110045,1,1000}] | C17: 累积7天礼包
A18: 115 | B18: [{110009,0,10000}] | C18: 在线1分钟
A19: 116 | B19: [{110009,0,10000},{110045,1,30}] | C19: 在线5分钟
A20: 117 | B20: [{110009,0,10000},{110078,1,10}] | C20: 在线15分钟
A21: 118 | B21: [{110009,0,10000},{110004,1,20}] | C21: 在线30分钟
A22: 119 | B22: [{110009,0,10000},{110005,1,20}] | C22: 在线60分钟
A23: 120 | B23: [{110009,0,10000},{110079,1,5}] | C23: 在线120分钟
A24: 121 | B24: [{200020,0,1},{307000,1,1},{110140,1,5},{110007,1,20},{110083,1,20},{110050,1,1},{110127,1,10},{110078,1,20}] | C24: 战士首充礼包
A25: 122 | B25: [{201020,0,1},{307200,1,1},{110140,1,5},{110007,1,20},{110083,1,20},{110050,1,1},{110127,1,10},{110078,1,20}] | C25: 法师首充礼包
A26: 123 | B26: [{202020,0,1},{307400,1,1},{110140,1,5},{110007,1,20},{110083,1,20},{110050,1,1},{110127,1,10},{110078,1,20}] | C26: 道士首充礼包
A27: 124 | B27: [{200030,0,1},{110049,0,20}] | C27: 战神武器箱(战)
A28: 125 | B28: [{201030,0,1},{110049,0,20}] | C28: 法神武器箱(法)
A29: 126 | B29: [{202030,0,1},{110049,0,20}] | C29: 天尊武器箱(道)
A30: 127 | B30: [{110057,0,99999999},{305009,0,1},{110058,0,99},{110008,0,9999999},{110009,0,9999999},{110088,0,999},{110098,0,999},{110108,0,999},{110109,0,999},{110076,0,999},{110077,0,999},{110048,0,1},{110024,0,1},{110025,0,1}] | C30: 战士测试专用切勿外传
A31: 128 | B31: [{110057,0,99999999},{305009,0,1},{110058,0,99},{110008,0,9999999},{110009,0,9999999},{110088,0,999},{110098,0,999},{110108,0,999},{110109,0,999},{110076,0,999},{110077,0,999},{110048,0,1},{110040,0,1},{110067,0,1}] | C31: 法师测试专用切勿外传
A32: 129 | B32: [{110057,0,99999999},{305009,0,1},{110058,0,99},{110008,0,9999999},{110009,0,9999999},{110088,0,999},{110098,0,999},{110108,0,999},{110109,0,999},{110076,0,999},{110077,0,999},{110048,0,1},{110031,0,1},{110032,0,1}] | C32: 道士测试专用切勿外传
A33: 130 | B33: [{110076,1,99}]
A34: 131 | B34: [{110077,1,99}]
A35: 132 | B35: [{110064,0,991},{307000,0,1},{200060,0,1},{200061,0,1},{200062,0,1},{200063,0,2},{200065,0,1},{200066,0,2},{200067,0,1},{200069,0,1},{110049,0,99},{110048 ,0,1},{110059,0,9999},{110065,0,999999},{110078,0,999},{110088,0,999},{110098,0,999},{110108,0,999},{110109,0,297},{110127,0,99},{110045,0,9999},{110008,0,999999},{110009,0,999999},{110003,0,999},{110006,0,198},{110022,0,1},{110023,0,1},{110024,0,1},{110025,0,1},{110013,0,297},{110076,0,999},{110077,0,999},{110195,0,999999},{110196,0,999999},{110197,0,999999},{110198,0,999999}] | C35: 战士平台测试专用包
A36: 133 | B36: [{110064,0,991},{307200,0,1},{201060,0,1},{201061,0,1},{201062,0,1},{201063,0,2},{201065,0,1},{201066,0,2},{201067,0,1},{201069,0,1},{110049,0,99},{110048 ,0,1},{110059,0,9999},{110065,0,999999},{110078,0,999},{110088,0,999},{110098,0,999},{110108,0,999},{110109,0,297},{110127,0,99},{110045,0,9999},{110008,0,999999},{110009,0,999999},{110003,0,999},{110006,0,198},{110034,0,1},{110035,0,1},{110067,0,1},{110040,0,1},{110013,0,297},{110076,0,999},{110077,0,999},{110195,0,999999},{110196,0,9999},{110197,0,9999},{110198,0,9999}] | C36: 法师平台测试专用包
A37: 134 | B37: [{110064,0,991},{307400,0,1},{202060,0,1},{202061,0,1},{202062,0,1},{202063,0,2},{202065,0,1},{202066,0,2},{202067,0,1},{202069,0,1},{110049,0,99},{110048 ,0,1},{110059,0,9999},{110065,0,999999},{110078,0,999},{110088,0,999},{110098,0,999},{110108,0,999},{110109,0,297},{110127,0,99},{110045,0,9999},{110008,0,999999},{110009,0,999999},{110003,0,999},{110006,0,198},{110027,0,1},{110029,0,1},{110031,0,1},{110032,0,1},{110013,0,297},{110076,0,999},{110077,0,999},{110195,0,999999},{110196,0,999999},{110197,0,999999},{110198,0,999999}] | C37: 道士平台测试专用包
A38: 135 | B38: [{200032,0,1},{200033,0,1},{200035,0,1},{200036,0,1},{200037,0,1},{200039,0,1},{201032,0,1},{201033,0,1},{201035,0,1},{201036,0,1},{201037,0,1},{201039,0,1},{202032,0,1},{202033,0,1},{202035,0,1},{202036,0,1},{202037,0,1},{202039,0,1}] | C38: 金刚石装备箱
A39: 136 | B39: [{110160,0,50}] | C39: 铸魂精华礼包
A40: 137 | B40: [{110123,1,1},{110064,1,15}] | C40: 刷榜礼包（GS礼包）
A41: 138 | B41: [{200020,0,1},{200021,0,1},{200022,0,1},{200023,0,2},{200025,0,1},{200026,0,2},{200027,0,1},{200029,0,1}] | C41: 98元礼包（GS礼包） 战士
A42: 139 | B42: [{201020,0,1},{201021,0,1},{201022,0,1},{201023,0,2},{201025,0,1},{201026,0,2},{201027,0,1},{201029,0,1}] | C42: 98元礼包（GS礼包） 法师
A43: 140 | B43: [{202020,0,1},{202021,0,1},{202022,0,1},{202023,0,2},{202025,0,1},{202026,0,2},{202027,0,1},{202029,0,1}] | C43: 98元礼包（GS礼包） 道士
A44: 141 | B44: [{110213,1,1},{110214,1,1},{110008,1,2000},{110050,1,5},{110150,1,1000},{110048,1,1}] | C44: 首充礼包（GS礼包）
A45: 142 | B45: [{110008,1,80000},{110088,1,200},{110095,1,100},{110150,1,80000},{110109,1,50},{110045,1,100000},{110064,1,300},{308000,1,1},{110050,1,10}] | C45: 高级道具礼包（GS礼包）
A46: 143 | B46: [{110086, 1, 5}] | C46: V1补偿宝箱
A47: 144 | B47: [{110003, 1, 50},{110225, 1, 1}] | C47: V2补偿宝箱
A48: 145 | B48: [{110226, 1, 1}] | C48: V3补偿宝箱
A49: 146 | B49: [{110253, 1, 1},{110109, 1, 2}] | C49: V4补偿宝箱[2.2版本]
A50: 147 | B50: [{110228, 1, 1},{110109, 1, 4}] | C50: V5补偿宝箱[2.2版本]
A51: 148 | B51: [{110229, 1, 1},{110109, 1, 5}] | C51: V6补偿宝箱[2.2版本]
A52: 149 | B52: [{110230, 1, 1},{110109, 1, 7}] | C52: V7补偿宝箱[2.2版本]
A53: 150 | B53: [{110231, 1, 1},{110163, 1, 4}] | C53: V8补偿宝箱[2.2版本]
A54: 151 | B54: [{110232, 1, 1},{110163, 1, 5}] | C54: V9补偿宝箱[2.2版本]
A55: 152 | B55: [{110233, 1, 1},{110163, 1, 8},{110255, 1, 1}] | C55: V10补偿宝箱[2.2版本]
A56: 153 | B56: [{110234, 1, 1},{110163, 1, 15},{110255, 1, 1}] | C56: V11补偿宝箱[2.2版本]
A57: 154 | B57: [{110235, 1, 1},{305030, 1, 1},{110255, 1, 1},{110260, 1, 20}] | C57: V12补偿宝箱[2.2版本]
A58: 155 | B58: [{110127,1,10}] | C58: 翅膀预告礼包
A59: 156 | B59: [{110079,1,10},{110009,1,10000}] | C59: 强化预告礼包
A60: =R[-1]C+1 -> 157 | B60: [{110079,1,10},{110009,1,5000}] | C60: 提纯预告礼包
A61: =R[-1]C+1 -> 158 | B61: [{110003,1,5},{110009,1,5000}] | C61: 洗炼预告礼包
A62: =R[-1]C+1 -> 159 | B62: [{110010,1,20},{110009,1,5000}] | C62: 打造预告礼包
A63: =R[-1]C+1 -> 160 | B63: [{110045,1,50}] | C63: 老兵预告礼包
A64: =R[-1]C+1 -> 161 | B64: [{110065,1,800}] | C64: 勋章预告礼包
A65: =R[-1]C+1 -> 162 | B65: [{110045,1,50},{110009,1,10000},{110003,1,10}] | C65: 副本预告礼包
A66: =R[-1]C+1 -> 163 | B66: [{110065,1,1000}] | C66: 胜者预告礼包
A67: =R[-1]C+1 -> 164 | B67: [{110080,1,10},{110003,1,10},{110009,1,10000}] | C67: 暗殿预告礼包
A68: =R[-1]C+1 -> 165 | B68: [{110081,1,10},{110003,1,10},{110009,1,10000}] | C68: 屠龙预告礼包
A69: =R[-1]C+1 -> 166 | B69: [{110082,1,10},{110003,1,10},{110009,1,10000}] | C69: 攻城预告礼包
A70: =R[-1]C+1 -> 167 | B70: [{110045,1,50},{110160,1,5}] | C70: 铸魂预告礼包
A71: =R[-1]C+1 -> 168 | B71: [{110045,1,100}] | C71: 传承预告礼包
A72: =R[-1]C+1 -> 169 | B72: [{110223,1,1}] | C72: 宝图预告礼包
A73: =R[-1]C+1 -> 170 | B73: [{110083,1,10},{110003,1,10}] | C73: BOSS预告礼包
A74: 171 | B74: [{110003,1,2},{110006,1,5},{110056,1,1},{110078,1,2}] | C74: 初级中秋礼包
A75: 172 | B75: [{110003,1,5},{110007,1,5},{110009,1,20000},{110089,1,1}] | C75: 中级中秋礼包
A76: 173 | B76: [{110193,1,1},{110003,1,10},{110045,1,188},{110090,1,2}] | C76: 高级中秋礼包
A77: 174 | B77: [{110260,1,10},{309411,1,1}] | C77: 战坐骑预告礼包
A78: 175 | B78: [{110260,1,10},{309416,1,1}] | C78: 道坐骑预告礼包
A79: 176 | B79: [{110260,1,10},{309421,1,1}] | C79: 法坐骑预告礼包
A80: 177 | B80: [{200020,0,1},{200021,0,1},{200022,0,1},{200023,0,2}] | C80: VIP战士
A81: 178 | B81: [{201020,0,1},{201021,0,1},{201022,0,1},{201023,0,2}] | C81: VIP法师
A82: 179 | B82: [{202020,0,1},{202021,0,1},{202022,0,1}] | C82: VIP道士
A83: 180 | B83: [{110003,1,2},{110006,1,5},{110056,1,1}] | C83: 初级重阳礼包
A84: 181 | B84: [{110003,1,5},{110007,1,5},{110009,1,20000},{110099,1,1}] | C84: 中级重阳礼包
A85: 182 | B85: [{110193,1,1},{110003,1,5},{110045,1,188},{110260,1,1}] | C85: 高级重阳礼包
A86: 183 | B86: [{110259,1,15},{110259,1,15},{110259,1,15},{110259,1,15}] | C86: VIP7坐骑限购礼包
A87: 184 | B87: [{110259,1,200},{110259,1,200},{110259,1,200},{110259,1,200}] | C87: VIP12坐骑限购礼包
A88: 185 | B88: [{110259,1,585},{110259,1,585},{110259,1,585},{110259,1,585}] | C88: VIP13坐骑限购礼包
A89: 186 | B89: [{110091,1,20},{110050,1,5},{110007,1,20},{110056,1,2}] | C89: V3优惠礼包
A90: 187 | B90: [{110003,1,100},{110049,1,20},{110193,1,20},{110149,1,1}] | C90: V5优惠礼包
A91: 188 | B91: [{110222,1,10},{110222,1,10},{110222,1,10},{110222,1,10}] | C91: V8秘籍礼包
A92: 189 | B92: [{110096,1,5},{110193,1,20},{110160,1,200},{110149,1,2}] | C92: V9玄冰礼包
A93: 190 | B93: [{110105,1,5},{110193,1,25},{110160,1,250},{110149,1,3}] | C93: V10水晶礼包
A94: 191 | B94: [{110106,1,5},{110193,1,30},{110160,1,300},{110149,1,5}] | C94: V11水晶礼包
A95: 192 | B95: [{110294,1,15}] | C95: V14天神礼包
A96: 193 | B96: [{110294,1,25}] | C96: V15天神礼包
A97: 194 | B97: [{110025,1,1}] | C97: 技能礼包（逐日剑术）
A98: 195 | B98: [{110040,1,1}] | C98: 技能礼包（流星火雨）
A99: 196 | B99: [{110032,1,1}] | C99: 技能礼包（嗜血术）
A100: 197 | B100: [{110003,1,2},{110007,1,3},{110056,1,1},{110152,1,5}] | C100: 初级圣诞礼包
A101: 198 | B101: [{110003,1,5},{110007,1,3},{110050,1,1},{110100,1,1}] | C101: 中级圣诞礼包
A102: 199 | B102: [{110054,1,2},{110007,1,5},{110193,1,2},{110260,1,2}] | C102: 高级圣诞礼包
A103: 200 | B103: [{110003,1,3},{110007,1,10},{110193,1,5},{110078,1,5}] | C103: 初级春节礼包
A104: 201 | B104: [{110003,1,8},{110007,1,30},{110050,1,1},{110100,1,1}] | C104: 中级春节礼包
A105: 202 | B105: [{110003,1,30},{110054,1,5},{110260,1,5},{110045,1,666}] | C105: 高级春节礼包

Sheet: 工作表2
A3: [{物品ID,是否绑定,数量}]
A5: 0:非绑定
A6: 1:绑定
K8: 200032 | L8: 雷霆项链 | M8: ="{"&RC[-2]&",0,1}," -> {200032,0,1}, | N8: =RC[-1] -> {200032,0,1},
B9: 110078 | C9: 小飞鞋 | K9: 200033 | L9: 雷霆戒指 | M9: ="{"&RC[-2]&",0,1}," -> {200033,0,1}, | N9: =R[-1]C&RC[-1] -> {200032,0,1},{200033,0,1},
B10: 305009 | C10: 测试神器 | K10: 200035 | L10: 雷霆头盔 | M10: ="{"&RC[-2]&",0,1}," -> {200035,0,1}, | N10: =R[-1]C&RC[-1] -> {200032,0,1},{200033,0,1},{200035,0,1},
B11: 110076 | C11: 超级金创药 | K11: 200036 | L11: 雷霆护腕 | M11: ="{"&RC[-2]&",0,1}," -> {200036,0,1}, | N11: =R[-1]C&RC[-1] -> {200032,0,1},{200033,0,1},{200035,0,1},{200036,0,1},
B12: 110077 | C12: 超级魔法药 | K12: 200037 | L12: 雷霆腰带 | M12: ="{"&RC[-2]&",0,1}," -> {200037,0,1}, | N12: =R[-1]C&RC[-1] -> {200032,0,1},{200033,0,1},{200035,0,1},{200036,0,1},{200037,0,1},
B13: 110048 | C13: 沃玛号角 | K13: 200039 | L13: 雷霆战靴 | M13: ="{"&RC[-2]&",0,1}," -> {200039,0,1}, | N13: =R[-1]C&RC[-1] -> {200032,0,1},{200033,0,1},{200035,0,1},{200036,0,1},{200037,0,1},{200039,0,1},
B14: 110088 | C14: 黑铁矿+10 | K14: 201032 | L14: 烈焰项链 | M14: ="{"&RC[-2]&",0,1}," -> {201032,0,1}, | N14: =R[-1]C&RC[-1] -> {200032,0,1},{200033,0,1},{200035,0,1},{200036,0,1},{200037,0,1},{200039,0,1},{201032,0,1},
B15: 110098 | C15: 紫水晶+10 | K15: 201033 | L15: 烈焰戒指 | M15: ="{"&RC[-2]&",0,1}," -> {201033,0,1}, | N15: =R[-1]C&RC[-1] -> {200032,0,1},{200033,0,1},{200035,0,1},{200036,0,1},{200037,0,1},{200039,0,1},{201032,0,1},{201033,0,1},
B16: 110108 | C16: 玄冰铁+10 | K16: 201035 | L16: 烈焰头盔 | M16: ="{"&RC[-2]&",0,1}," -> {201035,0,1}, | N16: =R[-1]C&RC[-1] -> {200032,0,1},{200033,0,1},{200035,0,1},{200036,0,1},{200037,0,1},{200039,0,1},{201032,0,1},{201033,0,1},{201035,0,1},
B17: 110109 | C17: 金刚石 | K17: 201036 | L17: 烈焰护腕 | M17: ="{"&RC[-2]&",0,1}," -> {201036,0,1}, | N17: =R[-1]C&RC[-1] -> {200032,0,1},{200033,0,1},{200035,0,1},{200036,0,1},{200037,0,1},{200039,0,1},{201032,0,1},{201033,0,1},{201035,0,1},{201036,0,1},
K18: 201037 | L18: 烈焰腰带 | M18: ="{"&RC[-2]&",0,1}," -> {201037,0,1}, | N18: =R[-1]C&RC[-1] -> {200032,0,1},{200033,0,1},{200035,0,1},{200036,0,1},{200037,0,1},{200039,0,1},{201032,0,1},{201033,0,1},{201035,0,1},{201036,0,1},{201037,0,1},
K19: 201039 | L19: 烈焰魔靴 | M19: ="{"&RC[-2]&",0,1}," -> {201039,0,1}, | N19: =R[-1]C&RC[-1] -> {200032,0,1},{200033,0,1},{200035,0,1},{200036,0,1},{200037,0,1},{200039,0,1},{201032,0,1},{201033,0,1},{201035,0,1},{201036,0,1},{201037,0,1},{201039,0,1},
K20: 202032 | L20: 光芒道链 | M20: ="{"&RC[-2]&",0,1}," -> {202032,0,1}, | N20: =R[-1]C&RC[-1] -> {200032,0,1},{200033,0,1},{200035,0,1},{200036,0,1},{200037,0,1},{200039,0,1},{201032,0,1},{201033,0,1},{201035,0,1},{201036,0,1},{201037,0,1},{201039,0,1},{202032,0,1},
B21: 110058 | C21: 副本卷轴 | K21: 202033 | L21: 光芒道戒 | M21: ="{"&RC[-2]&",0,1}," -> {202033,0,1}, | N21: =R[-1]C&RC[-1] -> {200032,0,1},{200033,0,1},{200035,0,1},{200036,0,1},{200037,0,1},{200039,0,1},{201032,0,1},{201033,0,1},{201035,0,1},{201036,0,1},{201037,0,1},{201039,0,1},{202032,0,1},{202033,0,1},
B22: 110008 | C22: 元宝 | K22: 202035 | L22: 光芒头盔 | M22: ="{"&RC[-2]&",0,1}," -> {202035,0,1}, | N22: =R[-1]C&RC[-1] -> {200032,0,1},{200033,0,1},{200035,0,1},{200036,0,1},{200037,0,1},{200039,0,1},{201032,0,1},{201033,0,1},{201035,0,1},{201036,0,1},{201037,0,1},{201039,0,1},{202032,0,1},{202033,0,1},{202035,0,1},
B23: 110009 | C23: 金币 | K23: 202036 | L23: 光芒护腕 | M23: ="{"&RC[-2]&",0,1}," -> {202036,0,1}, | N23: =R[-1]C&RC[-1] -> {200032,0,1},{200033,0,1},{200035,0,1},{200036,0,1},{200037,0,1},{200039,0,1},{201032,0,1},{201033,0,1},{201035,0,1},{201036,0,1},{201037,0,1},{201039,0,1},{202032,0,1},{202033,0,1},{202035,0,1},{202036,0,1},
K24: 202037 | L24: 光芒腰带 | M24: ="{"&RC[-2]&",0,1}," -> {202037,0,1}, | N24: =R[-1]C&RC[-1] -> {200032,0,1},{200033,0,1},{200035,0,1},{200036,0,1},{200037,0,1},{200039,0,1},{201032,0,1},{201033,0,1},{201035,0,1},{201036,0,1},{201037,0,1},{201039,0,1},{202032,0,1},{202033,0,1},{202035,0,1},{202036,0,1},{202037,0,1},
K25: 202039 | L25: 光芒道靴 | M25: ="{"&RC[-2]&",0,1}" -> {202039,0,1} | N25: =R[-1]C&RC[-1] -> {200032,0,1},{200033,0,1},{200035,0,1},{200036,0,1},{200037,0,1},{200039,0,1},{201032,0,1},{201033,0,1},{201035,0,1},{201036,0,1},{201037,0,1},{201039,0,1},{202032,0,1},{202033,0,1},{202035,0,1},{202036,0,1},{202037,0,1},{202039,0,1}
B27: 110024 | C27: 狂风斩 | E27: 110031 | F27: 召唤神兽 | H27: 110040 | I27: 流星火雨
B28: 110025 | C28: 逐日剑法 | E28: 110032 | F28: 嗜血术 | H28: 110067 | I28: 诱惑之光 | N28: ="["&R[-3]C&"]" -> [{200032,0,1},{200033,0,1},{200035,0,1},{200036,0,1},{200037,0,1},{200039,0,1},{201032,0,1},{201033,0,1},{201035,0,1},{201036,0,1},{201037,0,1},{201039,0,1},{202032,0,1},{202033,0,1},{202035,0,1},{202036,0,1},{202037,0,1},{202039,0,1}]