Sheet: 开服活动详细信息表
A1: id | B1: num_min | C1: num_max | D1: weight
A3: ID | B3: 掉落万分比下限 | C3: 掉落万分比上限 | D3: 掉落权重
A4: 1 | B4: 1 | C4: 1000 | D4: 100
A5: 2 | B5: =R[-1]C+1000 -> 1001 | C5: =R[-1]C+1000 -> 2000 | D5: 200
A6: 3 | B6: =R[-1]C+1000 -> 2001 | C6: =R[-1]C+1000 -> 3000 | D6: 200
A7: 4 | B7: =R[-1]C+1000 -> 3001 | C7: =R[-1]C+1000 -> 4000 | D7: 300
A8: 5 | B8: =R[-1]C+1000 -> 4001 | C8: =R[-1]C+1000 -> 5000 | D8: 300
A9: 6 | B9: =R[-1]C+1000 -> 5001 | C9: =R[-1]C+1000 -> 6000 | D9: 300
A10: 7 | B10: =R[-1]C+1000 -> 6001 | C10: =R[-1]C+1000 -> 7000 | D10: 200
A11: 8 | B11: =R[-1]C+1000 -> 7001 | C11: =R[-1]C+1000 -> 8000 | D11: 100
A12: 9 | B12: =R[-1]C+1000 -> 8001 | C12: =R[-1]C+1000 -> 9000 | D12: 50
A13: 10 | B13: =R[-1]C+1000 -> 9001 | C13: =R[-1]C+1000 -> 10000 | D13: 50

Sheet: 工作表2
A2: type | B2: 1个数字1个类型
B4: 类型10，装备排行，value条件参数： {50,5} 表示50级以上装备穿戴5件