Sheet: 充值
A1: key | B1: jade | C1: first_giving | D1: common_giving | G1: rmb | I1: counter_id | J1: time_counter_id | K1: month_day | L1: month_jade
A2: key | B2: jade | C2: first_giving | D2: common_giving | E2: giving_desc | F2: common_desc | G2: rmb | H2: icon | M2: markIcon | N2: number
A3: 属性对应的key | B3: 充值元宝 | C3: 第一次返利 | D3: 正常返利 | E3: 第一次返利描述 | F3: 正常返利描述 | G3: 人民币 | H3: 图标 | I3: 计数器id | J3: 充值计数器ID | K3: 月卡天数（大于0表示月卡，等于0表示普通充值） | L3: 月卡领取元宝 | M3: 左上角图标 | N3: 排序字段
A4: 1 | B4: 300 | C4: 0 | D4: 0 | G4: 30 | H4: charge_monthCard | I4: 10050 | J4: 0 | K4: 30 | L4: 100 | M4: chargeLimit | N4: 1 | O4: 0.1 | P4: =RC[-13]*RC[-1] -> 0 | Q4: 6
A5: 2 | B5: 60 | C5: =RC[-1] -> 60 | D5: 0 | E5: ="首次充值返利"&RC[-2]&"元宝" -> 首次充值返利60元宝 | G5: =RC[-5]/10 -> 6 | H5: coin2 | I5: 10013 | J5: 10131 | K5: 0 | L5: 0 | M5: chargeDouble | N5: 2 | O5: 0.11 | P5: =RC[-13]*RC[-1] -> 6.6 | Q5: 33
A6: 3 | B6: 250 | C6: =RC[-1] -> 250 | D6: 0 | E6: ="首次充值返利"&RC[-2]&"元宝" -> 首次充值返利250元宝 | G6: 25 | H6: coin3 | I6: 10014 | J6: 10131 | K6: 0 | L6: 0 | M6: chargeDouble | N6: 3 | O6: 0.12 | P6: =RC[-13]*RC[-1] -> 30 | Q6: 118
A7: 4 | B7: 680 | C7: =RC[-1] -> 680 | D7: 0 | E7: ="首次充值返利"&RC[-2]&"元宝" -> 首次充值返利680元宝 | G7: 68 | H7: coin4 | I7: 10015 | J7: 0 | K7: 0 | L7: 0 | M7: chargeDouble | N7: 4 | O7: 0.13 | P7: =RC[-13]*RC[-1] -> 88.4 | Q7: 258
A8: 5 | B8: 980 | C8: =RC[-1] -> 980 | D8: 0 | E8: ="首次充值返利"&RC[-2]&"元宝" -> 首次充值返利980元宝 | G8: 98 | H8: coin5 | I8: 10016 | J8: 0 | K8: 0 | L8: 0 | M8: chargeDouble | N8: 5 | O8: 0.14000000000000001 | P8: =RC[-13]*RC[-1] -> 137.20000000000002 | Q8: 460
A9: 6 | B9: 3280 | C9: =RC[-1] -> 3280 | D9: 0 | E9: ="首次充值返利"&RC[-2]&"元宝" -> 首次充值返利3280元宝 | G9: 328 | H9: coin6 | I9: 10018 | J9: 0 | K9: 0 | L9: 0 | M9: chargeDouble | N9: 7 | O9: 0.16 | P9: =RC[-13]*RC[-1] -> 524.79999999999995 | Q9: 1580
A10: 7 | B10: 6480 | C10: =RC[-1] -> 6480 | D10: 0 | E10: ="首次充值返利"&RC[-2]&"元宝" -> 首次充值返利6480元宝 | G10: 648 | H10: coin6 | I10: 10019 | J10: 0 | K10: 0 | L10: 0 | M10: chargeDouble | N10: 8 | O10: 0.17 | P10: =RC[-13]*RC[-1] -> 1101.6000000000001 | Q10: 3366
A11: 8 | B11: 19980 | C11: =RC[-1] -> 19980 | D11: 0 | E11: ="首次充值返利"&RC[-2]&"元宝" -> 首次充值返利19980元宝 | G11: 1998 | H11: coin6 | I11: 10047 | J11: 0 | K11: 0 | L11: 0 | M11: chargeDouble | N11: 9
A12: 9 | B12: 1980 | C12: =RC[-1] -> 1980 | D12: 0 | E12: ="首次充值返利"&RC[-2]&"元宝" -> 首次充值返利1980元宝 | G12: 198 | H12: coin5 | I12: 10017 | J12: 0 | K12: 0 | L12: 0 | M12: chargeDouble | N12: 6