Sheet: 锻造消耗表
A1: counter_id | C1: period_unit | D1: period | E1: limit_value | F1: base_time
A2: counter_id | C2: period_unit | D2: period | E2: limit_value | F2: base_time
A3: 计数器id | B3: 计数器描述 | C3: 周期单位 | D3: 周期数 | E3: 限制数量 | F3: 基准日期
A4: 10001 | B4: 装备锻造刷新次数 | C4: day | D4: 1 | E4: 3 | F4: {{2015,1,1},{0,0,0}}
A5: 10002 | B5: 捐献类型1 | C5: day | D5: 1 | E5: 1 | F5: {{2015,1,1},{0,0,0}}
A6: 10003 | B6: 捐献类型2 | C6: day | D6: 1 | E6: 1 | F6: {{2015,1,1},{0,0,0}}
A7: 10004 | B7: 捐献类型3 | C7: day | D7: 1 | E7: 1 | F7: {{2015,1,1},{0,0,0}}
A8: 10005 | B8: 玩家离开帮会3小时限制 | C8: hour | D8: 3 | E8: 1 | F8: {{2015,1,1},{0,0,0}}
A9: 10006 | B9: 竞技场挑战次数 | C9: day | D9: 1 | E9: 999 | F9: {{2015,1,1},{0,0,0}}
A10: 10007 | B10: 功勋任务接取次数 | C10: day | D10: 1 | E10: 5 | F10: {{2015,1,1},{0,0,0}}
A11: 10008 | B11: 免费膜拜 | C11: day | D11: 1 | E11: 1 | F11: {{2015,1,1},{0,0,0}}
A12: 10009 | B12: 付费膜拜 | C12: day | D12: 1 | E12: 1 | F12: {{2015,1,1},{0,0,0}}
A13: 10010 | B13: 免费原地复活 | C13: day | D13: 1 | E13: 99 | F13: {{2015,1,1},{0,0,0}}
A14: 10011 | B14: 副本已经购买的次数 | C14: day | D14: 1 | E14: 99 | F14: {{2015,1,1},{0,0,0}}
A15: 10012 | B15: 红名清洗次数 | C15: day | D15: 1 | E15: 99 | F15: {{2015,1,1},{0,0,0}}
A16: 10013 | B16: 充值返利60元宝 | C16: forever | D16: 1 | E16: 99999 | F16: {{2015,1,1},{0,0,0}}
A17: 10014 | B17: 充值返利250元宝 | C17: forever | D17: 1 | E17: 99999 | F17: {{2015,1,1},{0,0,0}}
A18: 10015 | B18: 充值返利680元宝 | C18: forever | D18: 1 | E18: 99999 | F18: {{2015,1,1},{0,0,0}}
A19: 10016 | B19: 充值返利980元宝 | C19: forever | D19: 1 | E19: 99999 | F19: {{2015,1,1},{0,0,0}}
A20: 10017 | B20: 充值返利1980元宝 | C20: forever | D20: 1 | E20: 99999 | F20: {{2015,1,1},{0,0,0}}
A21: 10018 | B21: 充值返利3280元宝 | C21: forever | D21: 1 | E21: 99999 | F21: {{2015,1,1},{0,0,0}}
A22: 10019 | B22: 充值返利6480元宝 | C22: forever | D22: 1 | E22: 99999 | F22: {{2015,1,1},{0,0,0}}
A23: 10020 | B23: 充值返利9980元宝 | C23: forever | D23: 1 | E23: 99999 | F23: {{2015,1,1},{0,0,0}}
A24: 10021 | B24: 首充 | C24: forever | D24: 1 | E24: 1 | F24: {{2015,1,1},{0,0,0}}
A25: 10022 | B25: 玩家累计登录天数 | C25: forever | D25: 1 | E25: 99999 | F25: {{2015,1,1},{0,0,0}}
A26: 10023 | B26: 玩家累计当天在线时长 | C26: day | D26: 1 | E26: 99999999 | F26: {{2015,1,1},{0,0,0}}
A27: 10024 | B27: 登录1天奖励 | C27: forever | D27: 1 | E27: 1 | F27: {{2015,1,1},{0,0,0}}
A28: 10025 | B28: 登录2天奖励 | C28: forever | D28: 1 | E28: 1 | F28: {{2015,1,1},{0,0,0}}
A29: 10026 | B29: 登录3天奖励 | C29: forever | D29: 1 | E29: 1 | F29: {{2015,1,1},{0,0,0}}
A30: 10027 | B30: 登录4天奖励 | C30: forever | D30: 1 | E30: 1 | F30: {{2015,1,1},{0,0,0}}
A31: 10028 | B31: 登录5天奖励 | C31: forever | D31: 1 | E31: 1 | F31: {{2015,1,1},{0,0,0}}
A32: 10029 | B32: 登录6天奖励 | C32: forever | D32: 1 | E32: 1 | F32: {{2015,1,1},{0,0,0}}
A33: 10030 | B33: 登录7天奖励 | C33: forever | D33: 1 | E33: 1 | F33: {{2015,1,1},{0,0,0}}
A34: 10031 | B34: 当日在线1分钟奖励 | C34: day | D34: 1 | E34: 1 | F34: {{2015,1,1},{0,0,0}}
A35: 10032 | B35: 当日在线5分钟奖励 | C35: day | D35: 1 | E35: 1 | F35: {{2015,1,1},{0,0,0}}
A36: 10033 | B36: 当日在线15分钟奖励 | C36: day | D36: 1 | E36: 1 | F36: {{2015,1,1},{0,0,0}}
A37: 10034 | B37: 当日在线30分钟奖励 | C37: day | D37: 1 | E37: 1 | F37: {{2015,1,1},{0,0,0}}
A38: 10035 | B38: 当日在线60分钟奖励 | C38: day | D38: 1 | E38: 1 | F38: {{2015,1,1},{0,0,0}}
A39: 10036 | B39: 当日在线120分钟奖励 | C39: day | D39: 1 | E39: 1 | F39: {{2015,1,1},{0,0,0}}
A40: 10037 | B40: 首充礼包 | C40: forever | D40: 1 | E40: 1 | F40: {{2015,1,1},{0,0,0}}
A41: 10038 | B41: 每月签到累计次数 | C41: month | D41: 1 | E41: 31 | F41: {{2015,1,1},{0,0,0}}
A42: 10039 | B42: 每日签到 | C42: day | D42: 1 | E42: 1 | F42: {{2015,1,1},{0,0,0}}
A43: 10040 | B43: 日常任务接取次数 | C43: day | D43: 1 | E43: 10 | F43: {{2015,1,1},{0,0,0}}
A44: 10041 | B44: 功勋任务元宝花费次数 | C44: day | D44: 1 | E44: 99 | F44: {{2015,1,1},{0,0,0}}
A45: 10042 | B45: 日常任务元宝花费次数 | C45: day | D45: 1 | E45: 99 | F45: {{2015,1,1},{0,0,0}}
A46: 10043 | B46: 世界boss传送次数 | C46: day | D46: 1 | E46: 99 | F46: {{2015,1,1},{0,0,0}}
A47: 10044 | B47: 周任务 | C47: week | D47: 1 | E47: 1 | F47: {{2015,1,1},{0,0,0}}
A48: 10045 | B48: 挂机免费次数 | C48: day | D48: 1 | E48: 5 | F48: {{2015,1,1},{0,0,0}}
A49: 10046 | B49: 挂机购买次数 | C49: day | D49: 1 | E49: 5 | F49: {{2015,1,1},{0,0,0}}
A50: 10047 | B50: 充值19800反利 | C50: forever | D50: 1 | E50: 99999 | F50: {{2015,1,1},{0,0,0}}
A51: 10048 | B51: 充值29980反利 | C51: forever | D51: 1 | E51: 99999 | F51: {{2015,1,1},{0,0,0}}
A52: 10049 | B52: 充值58980反利 | C52: forever | D52: 1 | E52: 99999 | F52: {{2015,1,1},{0,0,0}}
A53: 10050 | B53: 月卡 | C53: day | D53: 30 | E53: 1 | F53: {{2015,1,1},{0,0,0}}
A54: 10051 | B54: 等级15级 | C54: forever | D54: 1 | E54: 1 | F54: {{2015,1,1},{0,0,0}}
A55: 10052 | B55: 等级25级 | C55: forever | D55: 1 | E55: 1 | F55: {{2015,1,1},{0,0,0}}
A56: 10053 | B56: 等级35级 | C56: forever | D56: 1 | E56: 1 | F56: {{2015,1,1},{0,0,0}}
A57: 10054 | B57: 等级45级 | C57: forever | D57: 1 | E57: 1 | F57: {{2015,1,1},{0,0,0}}
A58: 10055 | B58: 等级50级 | C58: forever | D58: 1 | E58: 1 | F58: {{2015,1,1},{0,0,0}}
A59: 10056 | B59: 等级55级 | C59: forever | D59: 1 | E59: 1 | F59: {{2015,1,1},{0,0,0}}
A60: 10057 | B60: 等级60级 | C60: forever | D60: 1 | E60: 1 | F60: {{2015,1,1},{0,0,0}}
A61: 10058 | B61: 每天杀人获得功勋上限 | C61: day | D61: 1 | E61: 500 | F61: {{2015,1,1},{0,0,0}}
A62: 10059 | B62: 高级生命印记限购次数 | C62: day | D62: 1 | E62: 40 | F62: {{2015,1,1},{0,0,0}}
A63: 10060 | B63: 高级攻击印记限购次数 | C63: day | D63: 1 | E63: 40 | F63: {{2015,1,1},{0,0,0}}
A64: 10061 | B64: 高级物防印记限购次数 | C64: day | D64: 1 | E64: 40 | F64: {{2015,1,1},{0,0,0}}
A65: 10062 | B65: 高级魔防印记限购次数 | C65: day | D65: 1 | E65: 40 | F65: {{2015,1,1},{0,0,0}}
A66: 10063 | B66: [{110147,0,1}] | C66: day | D66: 1 | E66: 20 | F66: {{2015,1,1},{0,0,0}} | G66: 测试
A67: 10064 | B67: [{110147,0,1}] | C67: day | D67: 1 | E67: 20 | F67: {{2015,1,1},{0,0,0}} | G67: 测试
A68: 10065 | B68: 神秘商人购买上限 | C68: day | D68: 1 | E68: 50 | F68: {{2015,1,1},{0,0,0}}
A69: 10066 | B69: 上古神石*5出现次数 | C69: day | D69: 1 | E69: 2 | F69: {{2015,1,1},{0,0,0}} | G69: 神秘商人刷新出现次数/每天
A70: 10067 | B70: 上古神石*10出现次数 | C70: day | D70: 1 | E70: 2 | F70: {{2015,1,1},{0,0,0}} | G70: 神秘商人刷新出现次数/每天
A71: 10068 | B71: 超级幸运油出现次数 | C71: day | D71: 1 | E71: 5 | F71: {{2015,1,1},{0,0,0}} | G71: 神秘商人刷新出现次数/每天
A72: 10069 | B72: 宝图任务接取次数 | C72: day | D72: 1 | E72: 10 | F72: {{2015,1,1},{0,0,0}}
A73: 10070 | B73: 宝图任务元宝完成次数 | C73: day | D73: 1 | E73: 99 | F73: {{2015,1,1},{0,0,0}}
A74: 10071 | B74: 答题双倍积分道具次数 | C74: week | D74: 1 | E74: 10 | F74: {{2015,1,1},{0,0,0}}
A75: 10072 | B75: 答题难度减半道具次数 | C75: week | D75: 1 | E75: 10 | F75: {{2015,1,1},{0,0,0}}
A76: 10073 | B76: 答题免答道具次数 | C76: week | D76: 1 | E76: 10 | F76: {{2015,1,1},{0,0,0}}
A77: 10074 | B77: 40级资源包礼包 | C77: forever | D77: 1 | E77: 1 | F77: {{2015,1,1},{0,0,0}}
A78: 10075 | B78: 50级资源包礼包 | C78: forever | D78: 1 | E78: 1 | F78: {{2015,1,1},{0,0,0}}
A79: 10076 | B79: 70级资源包礼包 | C79: forever | D79: 1 | E79: 1 | F79: {{2015,1,1},{0,0,0}}
A80: 10077 | B80: 黑铁矿+5强化礼包 | C80: forever | D80: 1 | E80: 10 | F80: {{2015,1,1},{0,0,0}} | G80: 开服限购
A81: 10078 | B81: 玄冰铁+1强化礼包 | C81: forever | D81: 1 | E81: 10 | F81: {{2015,1,1},{0,0,0}} | G81: 开服限购
A82: 10079 | B82: 玄冰铁+5强化礼包 | C82: forever | D82: 1 | E82: 10 | F82: {{2015,1,1},{0,0,0}} | G82: 开服限购
A83: 10080 | B83: 玄冰铁+6强化礼包 | C83: forever | D83: 1 | E83: 5 | F83: {{2015,1,1},{0,0,0}} | G83: 开服限购
A84: 10081 | B84: 初级全能印记礼包 | C84: forever | D84: 1 | E84: 10 | F84: {{2015,1,1},{0,0,0}} | G84: 开服限购
A85: 10082 | B85: 中级全能印记礼包 | C85: forever | D85: 1 | E85: 10 | F85: {{2015,1,1},{0,0,0}} | G85: 开服限购
A86: 10083 | B86: 高级全能印记礼包 | C86: forever | D86: 1 | E86: 10 | F86: {{2015,1,1},{0,0,0}} | G86: 开服限购
A87: =R[-1]C+1 -> 10084 | B87: 翅膀预告礼包 | C87: forever | D87: 1 | E87: 1 | F87: {{2015,1,1},{0,0,0}}
A88: =R[-1]C+1 -> 10085 | B88: 强化预告礼包 | C88: forever | D88: 1 | E88: 1 | F88: {{2015,1,1},{0,0,0}}
A89: =R[-1]C+1 -> 10086 | B89: 提纯预告礼包 | C89: forever | D89: 1 | E89: 1 | F89: {{2015,1,1},{0,0,0}}
A90: =R[-1]C+1 -> 10087 | B90: 洗炼预告礼包 | C90: forever | D90: 1 | E90: 1 | F90: {{2015,1,1},{0,0,0}}
A91: =R[-1]C+1 -> 10088 | B91: 打造预告礼包 | C91: forever | D91: 1 | E91: 1 | F91: {{2015,1,1},{0,0,0}}
A92: =R[-1]C+1 -> 10089 | B92: 老兵预告礼包 | C92: forever | D92: 1 | E92: 1 | F92: {{2015,1,1},{0,0,0}}
A93: =R[-1]C+1 -> 10090 | B93: 勋章预告礼包 | C93: forever | D93: 1 | E93: 1 | F93: {{2015,1,1},{0,0,0}}
A94: =R[-1]C+1 -> 10091 | B94: 副本预告礼包 | C94: forever | D94: 1 | E94: 1 | F94: {{2015,1,1},{0,0,0}}
A95: =R[-1]C+1 -> 10092 | B95: 胜者预告礼包 | C95: forever | D95: 1 | E95: 1 | F95: {{2015,1,1},{0,0,0}}
A96: =R[-1]C+1 -> 10093 | B96: 暗殿预告礼包 | C96: forever | D96: 1 | E96: 1 | F96: {{2015,1,1},{0,0,0}}
A97: =R[-1]C+1 -> 10094 | B97: 屠龙预告礼包 | C97: forever | D97: 1 | E97: 1 | F97: {{2015,1,1},{0,0,0}}
A98: =R[-1]C+1 -> 10095 | B98: 攻城预告礼包 | C98: forever | D98: 1 | E98: 1 | F98: {{2015,1,1},{0,0,0}}
A99: =R[-1]C+1 -> 10096 | B99: 铸魂预告礼包 | C99: forever | D99: 1 | E99: 1 | F99: {{2015,1,1},{0,0,0}}
A100: =R[-1]C+1 -> 10097 | B100: 传承预告礼包 | C100: forever | D100: 1 | E100: 1 | F100: {{2015,1,1},{0,0,0}}
A101: =R[-1]C+1 -> 10098 | B101: 宝图预告礼包 | C101: forever | D101: 1 | E101: 1 | F101: {{2015,1,1},{0,0,0}}
A102: =R[-1]C+1 -> 10099 | B102: BOSS预告礼包 | C102: forever | D102: 1 | E102: 1 | F102: {{2015,1,1},{0,0,0}}
A103: =R[-1]C+1 -> 10100 | B103: 坐骑装备1祝福值(1-3级) | C103: forever | D103: 1 | E103: 9999999 | F103: {{2015,1,1},{0,0,0}}
A104: =R[-1]C+1 -> 10101 | B104: 坐骑装备1祝福值(4-15级) | C104: day | D104: 1 | E104: 9999999 | F104: {{2015,1,1},{0,0,0}}
A105: =R[-1]C+1 -> 10102 | B105: 坐骑装备2祝福值(1-3级) | C105: forever | D105: 1 | E105: 9999999 | F105: {{2015,1,1},{0,0,0}}
A106: =R[-1]C+1 -> 10103 | B106: 坐骑装备2祝福值(4-15级) | C106: day | D106: 1 | E106: 9999999 | F106: {{2015,1,1},{0,0,0}}
A107: =R[-1]C+1 -> 10104 | B107: 坐骑装备3祝福值(1-3级) | C107: forever | D107: 1 | E107: 9999999 | F107: {{2015,1,1},{0,0,0}}
A108: =R[-1]C+1 -> 10105 | B108: 坐骑装备3祝福值(4-15级) | C108: day | D108: 1 | E108: 9999999 | F108: {{2015,1,1},{0,0,0}}
A109: =R[-1]C+1 -> 10106 | B109: 坐骑装备4祝福值(1-3级) | C109: forever | D109: 1 | E109: 9999999 | F109: {{2015,1,1},{0,0,0}}
A110: =R[-1]C+1 -> 10107 | B110: 坐骑装备4祝福值(4-15级) | C110: day | D110: 1 | E110: 9999999 | F110: {{2015,1,1},{0,0,0}}
A111: 10108 | B111: VIP1限购礼包 | C111: forever | D111: 1 | E111: 1 | F111: {{2015,1,1},{0,0,0}}
A112: 10109 | B112: VIP2限购礼包 | C112: forever | D112: 1 | E112: 1 | F112: {{2015,1,1},{0,0,0}}
A113: 10110 | B113: VIP3限购礼包 | C113: forever | D113: 1 | E113: 1 | F113: {{2015,1,1},{0,0,0}}
A114: 10111 | B114: VIP4限购礼包 | C114: forever | D114: 1 | E114: 1 | F114: {{2015,1,1},{0,0,0}}
A115: 10112 | B115: VIP5限购礼包 | C115: forever | D115: 1 | E115: 1 | F115: {{2015,1,1},{0,0,0}}
A116: 10113 | B116: VIP6限购礼包 | C116: forever | D116: 1 | E116: 1 | F116: {{2015,1,1},{0,0,0}}
A117: 10114 | B117: VIP7限购礼包 | C117: forever | D117: 1 | E117: 1 | F117: {{2015,1,1},{0,0,0}}
A118: 10115 | B118: VIP8限购礼包 | C118: forever | D118: 1 | E118: 1 | F118: {{2015,1,1},{0,0,0}}
A119: 10116 | B119: VIP9限购礼包 | C119: forever | D119: 1 | E119: 1 | F119: {{2015,1,1},{0,0,0}}
A120: 10117 | B120: VIP10限购礼包 | C120: forever | D120: 1 | E120: 1 | F120: {{2015,1,1},{0,0,0}}
A121: 10118 | B121: VIP11限购礼包 | C121: forever | D121: 1 | E121: 1 | F121: {{2015,1,1},{0,0,0}}
A122: 10119 | B122: VIP12限购礼包 | C122: forever | D122: 1 | E122: 1 | F122: {{2015,1,1},{0,0,0}}
A123: 10120 | B123: VIP13限购礼包 | C123: forever | D123: 1 | E123: 1 | F123: {{2015,1,1},{0,0,0}}
A124: 10121 | B124: VIP14限购礼包 | C124: forever | D124: 1 | E124: 1 | F124: {{2015,1,1},{0,0,0}}
A125: 10122 | B125: VIP15限购礼包 | C125: forever | D125: 1 | E125: 1 | F125: {{2015,1,1},{0,0,0}}
A126: 10123 | B126: V7坐骑限购礼包 | C126: forever | D126: 1 | E126: 1 | F126: {{2015,1,1},{0,0,0}}
A127: 10124 | B127: V12坐骑限购礼包 | C127: forever | D127: 1 | E127: 1 | F127: {{2015,1,1},{0,0,0}}
A128: 10125 | B128: V13坐骑限购礼包 | C128: forever | D128: 1 | E128: 1 | F128: {{2015,1,1},{0,0,0}}
A129: 10126 | B129: 幻化进阶丹 | C129: day | D129: 1 | E129: 10 | F129: {{2015,1,1},{0,0,0}} | G129: 合服活动
A130: 10127 | B130: 通灵神石 | C130: day | D130: 1 | E130: 10 | F130: {{2015,1,1},{0,0,0}} | G130: 合服活动
A131: 10128 | B131: 洗练石 | C131: day | D131: 1 | E131: 20 | F131: {{2015,1,1},{0,0,0}} | G131: 合服活动
A132: 10129 | B132: 女娲神石 | C132: day | D132: 1 | E132: 10 | F132: {{2015,1,1},{0,0,0}} | G132: 合服活动
A133: 10130 | B133: 神皇秘境 | C133: day | D133: 1 | E133: 100000 | F133: {{2015,1,1},{0,0,0}} | G133: 神皇秘境每日抽奖数
A134: 10131 | B134: 充值统计 | C134: day | D134: 1 | E134: 999999 | F134: {{2015,1,1},{0,0,0}} | G134: 用于防止代充坏账