Sheet: 强化分解
A1: key | B1: goods_list
A2: key | B2: goods_list
A3: 强化等级 | B3: 分解后获得道具列表
A4: 0 | B4: [] | D4: 强化 | K4: 100%等价返还 | M4: 分解获得
A5: 1 | B5: ="[{"&RC[12]&",0,"&RC[13]&"}]" -> [{110081,0,1}] | D5: 1 | E5: 110079 | F5: 黑铁矿+1 | G5: 110079 | H5: =R[1]C/2 -> 0.09765625 | I5: =RC[-1]*5 -> 0.48828125 | J5: =RC[-1] -> 0.48828125 | K5: =RC[-1]*1 -> 0.48828125 | L5: =RC[-1]/VLOOKUP(RC[1],C[-6]:C[-4],3,0) -> 1.25 | M5: 黑铁矿+3 | N5: =VLOOKUP(RC[-1],C[-8]:C[-7],2,0) -> 110081 | O5: =INT(RC[-3]) -> 1
A6: 2 | B6: ="[{"&RC[12]&",0,"&RC[13]&"}]" -> [{110082,0,1}] | D6: 2 | E6: 110080 | F6: 黑铁矿+2 | G6: 110080 | H6: =R[1]C/2 -> 0.1953125 | I6: =RC[-1]*5 -> 0.9765625 | J6: =R[-1]C+RC[-1] -> 1.46484375 | K6: =RC[-1]*1 -> 1.46484375 | L6: =RC[-1]/VLOOKUP(RC[1],C[-6]:C[-4],3,0) -> 1.875 | M6: 黑铁矿+4 | N6: =VLOOKUP(RC[-1],C[-8]:C[-7],2,0) -> 110082 | O6: =INT(RC[-3]) -> 1
A7: 3 | B7: ="[{"&RC[12]&",0,"&RC[13]&"}]" -> [{110084,0,2}] | D7: 3 | E7: 110081 | F7: 黑铁矿+3 | G7: 110081 | H7: =R[1]C/2 -> 0.390625 | I7: =RC[-1]*5 -> 1.953125 | J7: =R[-1]C+RC[-1] -> 3.41796875 | K7: =RC[-1]*1 -> 3.41796875 | L7: =RC[-1]/VLOOKUP(RC[1],C[-6]:C[-4],3,0) -> 1.09375 | M7: 黑铁矿+6 | N7: =VLOOKUP(RC[-1],C[-8]:C[-7],2,0) -> 110084 | O7: =INT(RC[-3])+1 -> 2
A8: 4 | B8: ="[{"&RC[12]&",0,"&RC[13]&"}]" -> [{110085,0,2}] | D8: 4 | E8: 110082 | F8: 黑铁矿+4 | G8: 110082 | H8: =R[1]C/2 -> 0.78125 | I8: =RC[-1]*5 -> 3.90625 | J8: =R[-1]C+RC[-1] -> 7.32421875 | K8: =RC[-1]*1 -> 7.32421875 | L8: =RC[-1]/VLOOKUP(RC[1],C[-6]:C[-4],3,0) -> 1.171875 | M8: 黑铁矿+7 | N8: =VLOOKUP(RC[-1],C[-8]:C[-7],2,0) -> 110085 | O8: =INT(RC[-3])+1 -> 2
A9: 5 | B9: ="[{"&RC[12]&",0,"&RC[13]&"}]" -> [{110086,0,2}] | D9: 5 | E9: 110083 | F9: 黑铁矿+5 | G9: 110083 | H9: =R[1]C/2 -> 1.5625 | I9: =RC[-1]*5 -> 7.8125 | J9: =R[-1]C+RC[-1] -> 15.13671875 | K9: =RC[-1]*1 -> 15.13671875 | L9: =RC[-1]/VLOOKUP(RC[1],C[-6]:C[-4],3,0) -> 1.2109375 | M9: 黑铁矿+8 | N9: =VLOOKUP(RC[-1],C[-8]:C[-7],2,0) -> 110086 | O9: =INT(RC[-3])+1 -> 2
A10: 6 | B10: ="[{"&RC[12]&",0,"&RC[13]&"}]" -> [{110087,0,2}] | D10: 6 | E10: 110084 | F10: 黑铁矿+6 | G10: 110084 | H10: =R[1]C/2 -> 3.125 | I10: =RC[-1]*5 -> 15.625 | J10: =R[-1]C+RC[-1] -> 30.76171875 | K10: =RC[-1]*1 -> 30.76171875 | L10: =RC[-1]/VLOOKUP(RC[1],C[-6]:C[-4],3,0) -> 1.23046875 | M10: 黑铁矿+9 | N10: =VLOOKUP(RC[-1],C[-8]:C[-7],2,0) -> 110087 | O10: =INT(RC[-3])+1 -> 2
A11: 7 | B11: ="[{"&RC[12]&",0,"&RC[13]&"}]" -> [{110087,0,3}] | D11: 7 | E11: 110085 | F11: 黑铁矿+7 | G11: 110085 | H11: =R[1]C/2 -> 6.25 | I11: =RC[-1]*5 -> 31.25 | J11: =R[-1]C+RC[-1] -> 62.01171875 | K11: =RC[-1]*1 -> 62.01171875 | L11: =RC[-1]/VLOOKUP(RC[1],C[-6]:C[-4],3,0) -> 2.48046875 | M11: 黑铁矿+9 | N11: =VLOOKUP(RC[-1],C[-8]:C[-7],2,0) -> 110087 | O11: =INT(RC[-3])+1 -> 3
A12: 8 | B12: ="[{"&RC[12]&",0,"&RC[13]&"}]" -> [{110087,0,5}] | D12: 8 | E12: 110086 | F12: 黑铁矿+8 | G12: 110086 | H12: =R[1]C/2 -> 12.5 | I12: =RC[-1]*5 -> 62.5 | J12: =R[-1]C+RC[-1] -> 124.51171875 | K12: =RC[-1]*1 -> 124.51171875 | L12: =RC[-1]/VLOOKUP(RC[1],C[-6]:C[-4],3,0) -> 4.98046875 | M12: 黑铁矿+9 | N12: =VLOOKUP(RC[-1],C[-8]:C[-7],2,0) -> 110087 | O12: =INT(RC[-3])+1 -> 5
A13: 9 | B13: ="[{"&RC[12]&",0,"&RC[13]&"}]" -> [{110087,0,10}] | D13: 9 | E13: 110087 | F13: 黑铁矿+9 | G13: 110087 | H13: =R[1]C/2 -> 25 | I13: =RC[-1]*5 -> 125 | J13: =R[-1]C+RC[-1] -> 249.51171875 | K13: =RC[-1]*1 -> 249.51171875 | L13: =RC[-1]/VLOOKUP(RC[1],C[-6]:C[-4],3,0) -> 9.98046875 | M13: 黑铁矿+9 | N13: =VLOOKUP(RC[-1],C[-8]:C[-7],2,0) -> 110087 | O13: =INT(RC[-3])+1 -> 10
A14: 10 | B14: ="[{"&RC[12]&",0,"&RC[13]&"}]" -> [{110088,0,10}] | D14: 10 | E14: 110088 | F14: 黑铁矿+10 | G14: 110088 | H14: 50 | I14: =RC[-1]*5 -> 250 | J14: =R[-1]C+RC[-1] -> 499.51171875 | K14: =RC[-1]*1 -> 499.51171875 | L14: =RC[-1]/VLOOKUP(RC[1],C[-6]:C[-4],3,0) -> 9.990234375 | M14: 黑铁矿+10 | N14: =VLOOKUP(RC[-1],C[-8]:C[-7],2,0) -> 110088 | O14: =INT(RC[-3])+1 -> 10
A15: 11 | B15: ="[{"&RC[12]&",0,"&RC[13]&"}"&RC[14]&"]" -> [{110091,0,1},{110088,0,8}] | D15: 11 | E15: 110089 | F15: 玄冰铁+1 | G15: 110089 | H15: 10 | I15: =RC[-1]*5 -> 50 | J15: =RC[-1] -> 50 | K15: =RC[-1]*1 -> 50 | L15: =RC[-1]/VLOOKUP(RC[1],C[-6]:C[-4],3,0) -> 1.25 | M15: 玄冰铁+3 | N15: =VLOOKUP(RC[-1],C[-8]:C[-7],2,0) -> 110091 | O15: =INT(RC[-3]) -> 1 | P15: ,{110088,0,8}
A16: 12 | B16: ="[{"&RC[12]&",0,"&RC[13]&"}"&RC[14]&"]" -> [{110092,0,1},{110088,0,8}] | D16: 12 | E16: 110090 | F16: 玄冰铁+2 | G16: 110090 | H16: =R[-1]C*2 -> 20 | I16: =RC[-1]*5 -> 100 | J16: =R[-1]C+RC[-1] -> 150 | K16: =RC[-1]*1 -> 150 | L16: =RC[-1]/VLOOKUP(RC[1],C[-6]:C[-4],3,0) -> 1.875 | M16: 玄冰铁+4 | N16: =VLOOKUP(RC[-1],C[-8]:C[-7],2,0) -> 110092 | O16: =INT(RC[-3]) -> 1 | P16: ,{110088,0,8}
A17: 13 | B17: ="[{"&RC[12]&",0,"&RC[13]&"}"&RC[14]&"]" -> [{110094,0,1},{110088,0,8}] | D17: 13 | E17: 110091 | F17: 玄冰铁+3 | G17: 110091 | H17: =R[-1]C*2 -> 40 | I17: =RC[-1]*5 -> 200 | J17: =R[-1]C+RC[-1] -> 350 | K17: =RC[-1]*1 -> 350 | L17: =RC[-1]/VLOOKUP(RC[1],C[-6]:C[-4],3,0) -> 1.09375 | M17: 玄冰铁+6 | N17: =VLOOKUP(RC[-1],C[-8]:C[-7],2,0) -> 110094 | O17: =INT(RC[-3]) -> 1 | P17: ,{110088,0,8}
A18: 14 | B18: ="[{"&RC[12]&",0,"&RC[13]&"}"&RC[14]&"]" -> [{110094,0,3},{110088,0,8}] | D18: 14 | E18: 110092 | F18: 玄冰铁+4 | G18: 110092 | H18: =R[-1]C*2 -> 80 | I18: =RC[-1]*5 -> 400 | J18: =R[-1]C+RC[-1] -> 750 | K18: =RC[-1]*1 -> 750 | L18: =RC[-1]/VLOOKUP(RC[1],C[-6]:C[-4],3,0) -> 2.34375 | M18: 玄冰铁+6 | N18: =VLOOKUP(RC[-1],C[-8]:C[-7],2,0) -> 110094 | O18: =INT(RC[-3])+1 -> 3 | P18: ,{110088,0,8}
A19: 15 | B19: ="[{"&RC[12]&",0,"&RC[13]&"}"&RC[14]&"]" -> [{110094,0,5},{110088,0,8}] | D19: 15 | E19: 110093 | F19: 玄冰铁+5 | G19: 110093 | H19: =R[-1]C*2 -> 160 | I19: =RC[-1]*5 -> 800 | J19: =R[-1]C+RC[-1] -> 1550 | K19: =RC[-1]*1 -> 1550 | L19: =RC[-1]/VLOOKUP(RC[1],C[-6]:C[-4],3,0) -> 4.84375 | M19: 玄冰铁+6 | N19: =VLOOKUP(RC[-1],C[-8]:C[-7],2,0) -> 110094 | O19: =INT(RC[-3])+1 -> 5 | P19: ,{110088,0,8}
A20: 16 | B20: ="[{"&RC[12]&",0,"&RC[13]&"}"&RC[14]&"]" -> [{110094,0,10},{110088,0,8}] | D20: 16 | E20: 110094 | F20: 玄冰铁+6 | G20: 110094 | H20: =R[-1]C*2 -> 320 | I20: =RC[-1]*5 -> 1600 | J20: =R[-1]C+RC[-1] -> 3150 | K20: =RC[-1]*1 -> 3150 | L20: =RC[-1]/VLOOKUP(RC[1],C[-6]:C[-4],3,0) -> 9.84375 | M20: 玄冰铁+6 | N20: =VLOOKUP(RC[-1],C[-8]:C[-7],2,0) -> 110094 | O20: =INT(RC[-3])+1 -> 10 | P20: ,{110088,0,8}
A21: 17 | B21: ="[{"&RC[12]&",0,"&RC[13]&"}"&RC[14]&"]" -> [{110094,0,20},{110088,0,8}] | D21: 17 | E21: 110095 | F21: 玄冰铁+7 | G21: 110095 | H21: =R[-1]C*2 -> 640 | I21: =RC[-1]*5 -> 3200 | J21: =R[-1]C+RC[-1] -> 6350 | K21: =RC[-1]*1 -> 6350 | L21: =RC[-1]/VLOOKUP(RC[1],C[-6]:C[-4],3,0) -> 19.84375 | M21: 玄冰铁+6 | N21: =VLOOKUP(RC[-1],C[-8]:C[-7],2,0) -> 110094 | O21: =INT(RC[-3])+1 -> 20 | P21: ,{110088,0,8}
A22: 18 | B22: ="[{"&RC[12]&",0,"&RC[13]&"}"&RC[14]&"]" -> [{110094,0,40},{110088,0,8}] | D22: 18 | E22: 110096 | F22: 玄冰铁+8 | G22: 110096 | H22: =R[-1]C*2 -> 1280 | I22: =RC[-1]*5 -> 6400 | J22: =R[-1]C+RC[-1] -> 12750 | K22: =RC[-1]*1 -> 12750 | L22: =RC[-1]/VLOOKUP(RC[1],C[-6]:C[-4],3,0) -> 39.84375 | M22: 玄冰铁+6 | N22: =VLOOKUP(RC[-1],C[-8]:C[-7],2,0) -> 110094 | O22: =INT(RC[-3])+1 -> 40 | P22: ,{110088,0,8}
A23: 19 | B23: ="[{"&RC[12]&",0,"&RC[13]&"}"&RC[14]&"]" -> [{110094,0,80},{110088,0,8}] | D23: 19 | E23: 110097 | F23: 玄冰铁+9 | G23: 110097 | H23: =R[-1]C*2 -> 2560 | I23: =RC[-1]*5 -> 12800 | J23: =R[-1]C+RC[-1] -> 25550 | K23: =RC[-1]*1 -> 25550 | L23: =RC[-1]/VLOOKUP(RC[1],C[-6]:C[-4],3,0) -> 79.84375 | M23: 玄冰铁+6 | N23: =VLOOKUP(RC[-1],C[-8]:C[-7],2,0) -> 110094 | O23: =INT(RC[-3])+1 -> 80 | P23: ,{110088,0,8}
A24: 20 | B24: ="[{"&RC[12]&",0,"&RC[13]&"}"&RC[14]&"]" -> [{110094,0,160},{110088,0,8}] | D24: 20 | E24: 110098 | F24: 玄冰铁+10 | G24: 110098 | H24: =R[-1]C*2 -> 5120 | I24: =RC[-1]*5 -> 25600 | J24: =R[-1]C+RC[-1] -> 51150 | K24: =RC[-1]*1 -> 51150 | L24: =RC[-1]/VLOOKUP(RC[1],C[-6]:C[-4],3,0) -> 159.84375 | M24: 玄冰铁+6 | N24: =VLOOKUP(RC[-1],C[-8]:C[-7],2,0) -> 110094 | O24: =INT(RC[-3])+1 -> 160 | P24: ,{110088,0,8}
A25: 21 | B25: ="[{"&RC[12]&",0,"&RC[13]&"}"&RC[14]&"]" -> [{110101,0,1},{110088,0,8},{110098,0,8}] | D25: 21 | E25: 110099 | F25: 紫水晶+1 | G25: 110099 | H25: 25 | I25: =RC[-1]*5 -> 125 | J25: =RC[-1] -> 125 | K25: =RC[-1]*1 -> 125 | L25: =RC[-1]/VLOOKUP(RC[1],C[-6]:C[-4],3,0) -> 1.25 | M25: 紫水晶+3 | N25: =VLOOKUP(RC[-1],C[-8]:C[-7],2,0) -> 110101 | O25: =INT(RC[-3]) -> 1 | P25: ,{110088,0,8},{110098,0,8}
A26: 22 | B26: ="[{"&RC[12]&",0,"&RC[13]&"}"&RC[14]&"]" -> [{110102,0,1},{110088,0,8},{110098,0,8}] | D26: 22 | E26: 110100 | F26: 紫水晶+2 | G26: 110100 | H26: =R[-1]C*2 -> 50 | I26: =RC[-1]*5 -> 250 | J26: =R[-1]C+RC[-1] -> 375 | K26: =RC[-1]*1 -> 375 | L26: =RC[-1]/VLOOKUP(RC[1],C[-6]:C[-4],3,0) -> 1.875 | M26: 紫水晶+4 | N26: =VLOOKUP(RC[-1],C[-8]:C[-7],2,0) -> 110102 | O26: =INT(RC[-3]) -> 1 | P26: ,{110088,0,8},{110098,0,8}
A27: 23 | B27: ="[{"&RC[12]&",0,"&RC[13]&"}"&RC[14]&"]" -> [{110104,0,2},{110088,0,8},{110098,0,8}] | D27: 23 | E27: 110101 | F27: 紫水晶+3 | G27: 110101 | H27: =R[-1]C*2 -> 100 | I27: =RC[-1]*5 -> 500 | J27: =R[-1]C+RC[-1] -> 875 | K27: =RC[-1]*1 -> 875 | L27: =RC[-1]/VLOOKUP(RC[1],C[-6]:C[-4],3,0) -> 1.09375 | M27: 紫水晶+6 | N27: =VLOOKUP(RC[-1],C[-8]:C[-7],2,0) -> 110104 | O27: =INT(RC[-3])+1 -> 2 | P27: ,{110088,0,8},{110098,0,8}
A28: 24 | B28: ="[{"&RC[12]&",0,"&RC[13]&"}"&RC[14]&"]" -> [{110104,0,3},{110088,0,8},{110098,0,8}] | D28: 24 | E28: 110102 | F28: 紫水晶+4 | G28: 110102 | H28: =R[-1]C*2 -> 200 | I28: =RC[-1]*5 -> 1000 | J28: =R[-1]C+RC[-1] -> 1875 | K28: =RC[-1]*1 -> 1875 | L28: =RC[-1]/VLOOKUP(RC[1],C[-6]:C[-4],3,0) -> 2.34375 | M28: 紫水晶+6 | N28: =VLOOKUP(RC[-1],C[-8]:C[-7],2,0) -> 110104 | O28: =INT(RC[-3])+1 -> 3 | P28: ,{110088,0,8},{110098,0,8}
A29: 25 | B29: ="[{"&RC[12]&",0,"&RC[13]&"}"&RC[14]&"]" -> [{110104,0,5},{110088,0,8},{110098,0,8}] | D29: 25 | E29: 110103 | F29: 紫水晶+5 | G29: 110103 | H29: =R[-1]C*2 -> 400 | I29: =RC[-1]*5 -> 2000 | J29: =R[-1]C+RC[-1] -> 3875 | K29: =RC[-1]*1 -> 3875 | L29: =RC[-1]/VLOOKUP(RC[1],C[-6]:C[-4],3,0) -> 4.84375 | M29: 紫水晶+6 | N29: =VLOOKUP(RC[-1],C[-8]:C[-7],2,0) -> 110104 | O29: =INT(RC[-3])+1 -> 5 | P29: ,{110088,0,8},{110098,0,8}
A30: 26 | B30: ="[{"&RC[12]&",0,"&RC[13]&"}"&RC[14]&"]" -> [{110104,0,10},{110088,0,8},{110098,0,8}] | D30: 26 | E30: 110104 | F30: 紫水晶+6 | G30: 110104 | H30: =R[-1]C*2 -> 800 | I30: =RC[-1]*5 -> 4000 | J30: =R[-1]C+RC[-1] -> 7875 | K30: =RC[-1]*1 -> 7875 | L30: =RC[-1]/VLOOKUP(RC[1],C[-6]:C[-4],3,0) -> 9.84375 | M30: 紫水晶+6 | N30: =VLOOKUP(RC[-1],C[-8]:C[-7],2,0) -> 110104 | O30: =INT(RC[-3])+1 -> 10 | P30: ,{110088,0,8},{110098,0,8}
A31: 27 | B31: ="[{"&RC[12]&",0,"&RC[13]&"}"&RC[14]&"]" -> [{110104,0,20},{110088,0,8},{110098,0,8}] | D31: 27 | E31: 110105 | F31: 紫水晶+7 | G31: 110105 | H31: =R[-1]C*2 -> 1600 | I31: =RC[-1]*5 -> 8000 | J31: =R[-1]C+RC[-1] -> 15875 | K31: =RC[-1]*1 -> 15875 | L31: =RC[-1]/VLOOKUP(RC[1],C[-6]:C[-4],3,0) -> 19.84375 | M31: 紫水晶+6 | N31: =VLOOKUP(RC[-1],C[-8]:C[-7],2,0) -> 110104 | O31: =INT(RC[-3])+1 -> 20 | P31: ,{110088,0,8},{110098,0,8}
A32: 28 | B32: ="[{"&RC[12]&",0,"&RC[13]&"}"&RC[14]&"]" -> [{110104,0,40},{110088,0,8},{110098,0,8}] | D32: 28 | E32: 110106 | F32: 紫水晶+8 | G32: 110106 | H32: =R[-1]C*2 -> 3200 | I32: =RC[-1]*5 -> 16000 | J32: =R[-1]C+RC[-1] -> 31875 | K32: =RC[-1]*1 -> 31875 | L32: =RC[-1]/VLOOKUP(RC[1],C[-6]:C[-4],3,0) -> 39.84375 | M32: 紫水晶+6 | N32: =VLOOKUP(RC[-1],C[-8]:C[-7],2,0) -> 110104 | O32: =INT(RC[-3])+1 -> 40 | P32: ,{110088,0,8},{110098,0,8}
A33: 29 | B33: ="[{"&RC[12]&",0,"&RC[13]&"}"&RC[14]&"]" -> [{110104,0,80},{110088,0,8},{110098,0,8}] | D33: 29 | E33: 110107 | F33: 紫水晶+9 | G33: 110107 | H33: =R[-1]C*2 -> 6400 | I33: =RC[-1]*5 -> 32000 | J33: =R[-1]C+RC[-1] -> 63875 | K33: =RC[-1]*1 -> 63875 | L33: =RC[-1]/VLOOKUP(RC[1],C[-6]:C[-4],3,0) -> 79.84375 | M33: 紫水晶+6 | N33: =VLOOKUP(RC[-1],C[-8]:C[-7],2,0) -> 110104 | O33: =INT(RC[-3])+1 -> 80 | P33: ,{110088,0,8},{110098,0,8}
A34: 30 | B34: ="[{"&RC[12]&",0,"&RC[13]&"}"&RC[14]&"]" -> [{110104,0,160},{110088,0,8},{110098,0,8}] | D34: 30 | E34: 110108 | F34: 紫水晶+10 | G34: 110108 | H34: =R[-1]C*2 -> 12800 | I34: =RC[-1]*5 -> 64000 | J34: =R[-1]C+RC[-1] -> 127875 | K34: =RC[-1]*1 -> 127875 | L34: =RC[-1]/VLOOKUP(RC[1],C[-6]:C[-4],3,0) -> 159.84375 | M34: 紫水晶+6 | N34: =VLOOKUP(RC[-1],C[-8]:C[-7],2,0) -> 110104 | O34: =INT(RC[-3])+1 -> 160 | P34: ,{110088,0,8},{110098,0,8}
A35: 31 | B35: ="[{"&RC[12]&",0,"&RC[13]&"}"&RC[14]&"]" -> [{110102,0,1},{110088,0,8},{110098,0,8}] | D35: 31 | E35: 110099 | F35: 紫水晶+1 | G35: 110099 | H35: 25 | I35: 250 | J35: 250 | K35: 250 | L35: 1.25 | M35: 紫水晶+4 | N35: =VLOOKUP(RC[-1],C[-8]:C[-7],2,0) -> 110102 | O35: 1 | P35: ,{110088,0,8},{110098,0,8}
A36: 32 | B36: ="[{"&RC[12]&",0,"&RC[13]&"}"&RC[14]&"]" -> [{110103,0,1},{110088,0,8},{110098,0,8}] | D36: 32 | E36: 110100 | F36: 紫水晶+2 | G36: 110100 | H36: 50 | I36: 500 | J36: 750 | K36: 750 | L36: 1.875 | M36: 紫水晶+5 | N36: =VLOOKUP(RC[-1],C[-8]:C[-7],2,0) -> 110103 | O36: 1 | P36: ,{110088,0,8},{110098,0,8}
A37: 33 | B37: ="[{"&RC[12]&",0,"&RC[13]&"}"&RC[14]&"]" -> [{110104,0,2},{110088,0,8},{110098,0,8}] | D37: 33 | E37: 110101 | F37: 紫水晶+3 | G37: 110101 | H37: 100 | I37: 1000 | J37: 1750 | K37: 1750 | L37: 2.1875 | M37: 紫水晶+6 | N37: =VLOOKUP(RC[-1],C[-8]:C[-7],2,0) -> 110104 | O37: 2 | P37: ,{110088,0,8},{110098,0,8}
A38: 34 | B38: ="[{"&RC[12]&",0,"&RC[13]&"}"&RC[14]&"]" -> [{110104,0,4},{110088,0,8},{110098,0,8}] | D38: 34 | E38: 110102 | F38: 紫水晶+4 | G38: 110102 | H38: 200 | I38: 2000 | J38: 3750 | K38: 3750 | L38: 4.6875 | M38: 紫水晶+6 | N38: =VLOOKUP(RC[-1],C[-8]:C[-7],2,0) -> 110104 | O38: 4 | P38: ,{110088,0,8},{110098,0,8}
A39: 35 | B39: ="[{"&RC[12]&",0,"&RC[13]&"}"&RC[14]&"]" -> [{110104,0,9},{110088,0,8},{110098,0,8}] | D39: 35 | E39: 110103 | F39: 紫水晶+5 | G39: 110103 | H39: 400 | I39: 4000 | J39: 7750 | K39: 7750 | L39: 9.6875 | M39: 紫水晶+6 | N39: =VLOOKUP(RC[-1],C[-8]:C[-7],2,0) -> 110104 | O39: 9 | P39: ,{110088,0,8},{110098,0,8}
A40: 36 | B40: ="[{"&RC[12]&",0,"&RC[13]&"}"&RC[14]&"]" -> [{110104,0,19},{110088,0,8},{110098,0,8}] | D40: 36 | E40: 110104 | F40: 紫水晶+6 | G40: 110104 | H40: 800 | I40: 8000 | J40: 15750 | K40: 15750 | L40: 19.6875 | M40: 紫水晶+6 | N40: =VLOOKUP(RC[-1],C[-8]:C[-7],2,0) -> 110104 | O40: 19 | P40: ,{110088,0,8},{110098,0,8}
A41: 37 | B41: ="[{"&RC[12]&",0,"&RC[13]&"}"&RC[14]&"]" -> [{110104,0,39},{110088,0,8},{110098,0,8}] | D41: 37 | E41: 110105 | F41: 紫水晶+7 | G41: 110105 | H41: 1600 | I41: 16000 | J41: 31750 | K41: 31750 | L41: 39.6875 | M41: 紫水晶+6 | N41: =VLOOKUP(RC[-1],C[-8]:C[-7],2,0) -> 110104 | O41: 39 | P41: ,{110088,0,8},{110098,0,8}
A42: 38 | B42: ="[{"&RC[12]&",0,"&RC[13]&"}"&RC[14]&"]" -> [{110104,0,79},{110088,0,8},{110098,0,8}] | D42: 38 | E42: 110106 | F42: 紫水晶+8 | G42: 110106 | H42: 3200 | I42: 32000 | J42: 63750 | K42: 63750 | L42: 79.6875 | M42: 紫水晶+6 | N42: =VLOOKUP(RC[-1],C[-8]:C[-7],2,0) -> 110104 | O42: 79 | P42: ,{110088,0,8},{110098,0,8}
A43: 39 | B43: ="[{"&RC[12]&",0,"&RC[13]&"}"&RC[14]&"]" -> [{110104,0,159},{110088,0,8},{110098,0,8}] | D43: 39 | E43: 110107 | F43: 紫水晶+9 | G43: 110107 | H43: 6400 | I43: 64000 | J43: 127750 | K43: 127750 | L43: 159.6875 | M43: 紫水晶+6 | N43: =VLOOKUP(RC[-1],C[-8]:C[-7],2,0) -> 110104 | O43: 159 | P43: ,{110088,0,8},{110098,0,8}
A44: 40 | B44: ="[{"&RC[12]&",0,"&RC[13]&"}"&RC[14]&"]" -> [{110104,0,319},{110088,0,8},{110098,0,8}] | D44: 40 | E44: 110108 | F44: 紫水晶+10 | G44: 110108 | H44: 12800 | I44: 128000 | J44: 255750 | K44: 255750 | L44: 319.6875 | M44: 紫水晶+6 | N44: =VLOOKUP(RC[-1],C[-8]:C[-7],2,0) -> 110104 | O44: 319 | P44: ,{110088,0,8},{110098,0,8}

Sheet: 工作表2
A3: [{物品ID,是否绑定,数量}]
A5: 0:非绑定
A6: 1:绑定