Sheet: 洗练转移元宝消费
A1: key | B1: min_percent | C1: max_percent | D1: jade
A2: key | B2: min_percent | C2: max_percent | D2: jade
A3: key | B3: 最小百分比 | C3: 最大百分比 | D3: 需要元宝数量 | E3: 元宝消耗/总 | F3: 洗炼石 | G3: 洗炼次数
A4: 1 | B4: 1 | C4: 1000 | D4: =RC[1]/4 -> 5 | E4: =RC[1]*5 -> 20 | F4: =RC[1]*4 -> 4 | G4: 1
A5: 2 | B5: 1001 | C5: 2000 | D5: =RC[1]/4 -> 10 | E5: =RC[1]*5 -> 40 | F5: =RC[1]*4 -> 8 | G5: 2
A6: 3 | B6: 2001 | C6: 3000 | D6: =RC[1]/4 -> 15 | E6: =RC[1]*5 -> 60 | F6: =RC[1]*4 -> 12 | G6: 3
A7: 4 | B7: 3001 | C7: 4000 | D7: =RC[1]/4 -> 25 | E7: =RC[1]*5 -> 100 | F7: =RC[1]*4 -> 20 | G7: 5
A8: 5 | B8: 4001 | C8: 5000 | D8: =RC[1]/4 -> 50 | E8: =RC[1]*5 -> 200 | F8: =RC[1]*4 -> 40 | G8: 10
A9: 6 | B9: 5001 | C9: 6000 | D9: =RC[1]/4 -> 150 | E9: =RC[1]*5 -> 600 | F9: =RC[1]*4 -> 120 | G9: 30
A10: 7 | B10: 6001 | C10: 7000 | D10: =RC[1]/4 -> 250 | E10: =RC[1]*5 -> 1000 | F10: =RC[1]*4 -> 200 | G10: 50
A11: 8 | B11: 7001 | C11: 8000 | D11: =RC[1]/4 -> 350 | E11: =RC[1]*5 -> 1400 | F11: =RC[1]*4 -> 280 | G11: 70
A12: 9 | B12: 8001 | C12: 9000 | D12: =RC[1]/4 -> 450 | E12: =RC[1]*5 -> 1800 | F12: =RC[1]*4 -> 360 | G12: 90
A13: 10 | B13: 9001 | C13: 10000 | D13: =RC[1]/4 -> 500 | E13: =RC[1]*5 -> 2000 | F13: =RC[1]*4 -> 400 | G13: 100

Sheet: 说明
A1: [{物品ID,是否绑定,数量}]
A3: 0:非绑定
A4: 1:绑定