Sheet: 套装属性
B1: key | C1: min_count | D1: max_count | E1: hp | F1: mp | G1: min_ac | H1: max_ac | I1: min_mac | J1: max_mac | K1: min_sc | L1: max_sc | M1: min_def | N1: max_def | O1: min_res | P1: max_res | Q1: crit | R1: crit_att | S1: hit | T1: dodge
A2: id | B2: key | C2: count | E2: hp | F2: mp | G2: min_ac | H2: max_ac | I2: min_mac | J2: max_mac | K2: min_sc | L2: max_sc | M2: min_def | N2: max_def | O2: min_res | P2: max_res | Q2: crit | R2: crit_att | S2: hit | T2: dodge
A3: id | B3: 套装id | C3: 最小套件数 | D3: 最大套件数 | E3: 生命 | F3: 魔法 | G3: 最小物理攻击 | H3: 最大物理攻击 | I3: 最小魔法攻击 | J3: 最大魔法攻击 | K3: 最小道术攻击 | L3: 最大道术攻击 | M3: 最小物防 | N3: 最大物防 | O3: 最小法防 | P3: 最大法防 | Q3: 暴击 | R3: 暴击力 | S3: 准确 | T3: 敏捷
A4: 1 | B4: 1000 | C4: 2 | D4: =R[1]C[-1]-1 -> 4 | E4: 0 | F4: 0 | G4: 0 | H4: 0 | I4: 0 | J4: 0 | K4: 0 | L4: 0 | M4: 7 | N4: 16 | O4: 5 | P4: 12 | Q4: 0 | R4: 0 | S4: 0 | T4: 0
A5: 2 | B5: 1000 | C5: 5 | D5: =R[1]C[-1]-1 -> 6 | E5: 438 | F5: 0 | G5: 0 | H5: 0 | I5: 0 | J5: 0 | K5: 0 | L5: 0 | M5: 0 | N5: 0 | O5: 0 | P5: 0 | Q5: 0 | R5: 0 | S5: 0 | T5: 0
A6: 3 | B6: 1000 | C6: 7 | D6: 10 | E6: 0 | F6: 0 | G6: 16 | H6: 33 | I6: 0 | J6: 0 | K6: 0 | L6: 0 | M6: =R[-1]C -> 0 | N6: =R[-1]C -> 0 | O6: =R[-1]C -> 0 | P6: =R[-1]C -> 0 | Q6: 0 | R6: 0 | S6: 0 | T6: 0
A7: 4 | B7: 1001 | C7: =R[-3]C -> 2 | D7: =R[-3]C -> 4 | E7: 0 | F7: 0 | G7: 0 | H7: 0 | I7: 0 | J7: 0 | K7: 0 | L7: 0 | M7: 16 | N7: 34 | O7: 12 | P7: 25 | Q7: 0 | R7: 0 | S7: 0 | T7: 0
A8: 5 | B8: 1001 | C8: =R[-3]C -> 5 | D8: =R[-3]C -> 6 | E8: 897 | F8: 0 | G8: 0 | H8: 0 | I8: 0 | J8: 0 | K8: 0 | L8: 0 | M8: 0 | N8: 0 | O8: 0 | P8: 0 | Q8: 0 | R8: 0 | S8: 0 | T8: 0
A9: 6 | B9: 1001 | C9: =R[-3]C -> 7 | D9: =R[-3]C -> 10 | E9: 0 | F9: 0 | G9: 34 | H9: 69 | I9: 0 | J9: 0 | K9: 0 | L9: 0 | M9: =R[-1]C -> 0 | N9: =R[-1]C -> 0 | O9: =R[-1]C -> 0 | P9: =R[-1]C -> 0 | Q9: 0 | R9: 0 | S9: 0 | T9: 0
A10: 7 | B10: 1002 | C10: =R[-3]C -> 2 | D10: =R[-3]C -> 4 | E10: 0 | F10: 0 | G10: 0 | H10: 0 | I10: 0 | J10: 0 | K10: 0 | L10: 0 | M10: 27 | N10: 55 | O10: 19 | P10: 40 | Q10: 0 | R10: 0 | S10: 0 | T10: 0
A11: 8 | B11: 1002 | C11: =R[-3]C -> 5 | D11: =R[-3]C -> 6 | E11: 1462 | F11: 0 | G11: 0 | H11: 0 | I11: 0 | J11: 0 | K11: 0 | L11: 0 | M11: 0 | N11: 0 | O11: 0 | P11: 0 | Q11: 0 | R11: 0 | S11: 0 | T11: 0
A12: 9 | B12: 1002 | C12: =R[-3]C -> 7 | D12: =R[-3]C -> 10 | E12: 0 | F12: 0 | G12: 56 | H12: 112 | I12: 0 | J12: 0 | K12: 0 | L12: 0 | M12: =R[-1]C -> 0 | N12: =R[-1]C -> 0 | O12: =R[-1]C -> 0 | P12: =R[-1]C -> 0 | Q12: 0 | R12: 0 | S12: 0 | T12: 0
A13: 10 | B13: 1003 | C13: =R[-3]C -> 2 | D13: =R[-3]C -> 4 | E13: 0 | F13: 0 | G13: 0 | H13: 0 | I13: 0 | J13: 0 | K13: 0 | L13: 0 | M13: 45 | N13: 90 | O13: 33 | P13: 66 | Q13: 0 | R13: 0 | S13: 0 | T13: 0
A14: 11 | B14: 1003 | C14: =R[-3]C -> 5 | D14: =R[-3]C -> 6 | E14: 2340 | F14: 0 | G14: 0 | H14: 0 | I14: 0 | J14: 0 | K14: 0 | L14: 0 | M14: 0 | N14: 0 | O14: 0 | P14: 0 | Q14: 0 | R14: 0 | S14: 0 | T14: 0
A15: 12 | B15: 1003 | C15: =R[-3]C -> 7 | D15: =R[-3]C -> 10 | E15: 0 | F15: 0 | G15: 90 | H15: 180 | I15: 0 | J15: 0 | K15: 0 | L15: 0 | M15: =R[-1]C -> 0 | N15: =R[-1]C -> 0 | O15: =R[-1]C -> 0 | P15: =R[-1]C -> 0 | Q15: 0 | R15: 0 | S15: 0 | T15: 0
A16: 13 | B16: 1004 | C16: =R[-3]C -> 2 | D16: =R[-3]C -> 4 | E16: 0 | F16: 0 | G16: 0 | H16: 0 | I16: 0 | J16: 0 | K16: 0 | L16: 0 | M16: 69 | N16: 138 | O16: 50 | P16: 101 | Q16: 0 | R16: 0 | S16: 0 | T16: 0
A17: 14 | B17: 1004 | C17: =R[-3]C -> 5 | D17: =R[-3]C -> 6 | E17: 3616 | F17: 0 | G17: 0 | H17: 0 | I17: 0 | J17: 0 | K17: 0 | L17: 0 | M17: 0 | N17: 0 | O17: 0 | P17: 0 | Q17: 0 | R17: 0 | S17: 0 | T17: 0
A18: 15 | B18: 1004 | C18: =R[-3]C -> 7 | D18: =R[-3]C -> 10 | E18: 0 | F18: 0 | G18: 139 | H18: 278 | I18: 0 | J18: 0 | K18: 0 | L18: 0 | M18: =R[-1]C -> 0 | N18: =R[-1]C -> 0 | O18: =R[-1]C -> 0 | P18: =R[-1]C -> 0 | Q18: 0 | R18: 0 | S18: 0 | T18: 0
A19: 16 | B19: 1005 | C19: =R[-3]C -> 2 | D19: =R[-3]C -> 4 | E19: 0 | F19: 0 | G19: 0 | H19: 0 | I19: 0 | J19: 0 | K19: 0 | L19: 0 | M19: 105 | N19: 210 | O19: 77 | P19: 154 | Q19: 0 | R19: 0 | S19: 0 | T19: 0
A20: 17 | B20: 1005 | C20: =R[-3]C -> 5 | D20: =R[-3]C -> 6 | E20: 5460 | F20: 0 | G20: 0 | H20: 0 | I20: 0 | J20: 0 | K20: 0 | L20: 0 | M20: 0 | N20: 0 | O20: 0 | P20: 0 | Q20: 0 | R20: 0 | S20: 0 | T20: 0
A21: 18 | B21: 1005 | C21: =R[-3]C -> 7 | D21: =R[-3]C -> 10 | E21: 0 | F21: 0 | G21: 210 | H21: 420 | I21: 0 | J21: 0 | K21: 0 | L21: 0 | M21: =R[-1]C -> 0 | N21: =R[-1]C -> 0 | O21: =R[-1]C -> 0 | P21: =R[-1]C -> 0 | Q21: 0 | R21: 0 | S21: 0 | T21: 0
A22: 19 | B22: 1006 | C22: =R[-3]C -> 2 | D22: =R[-3]C -> 4 | E22: 0 | F22: 0 | G22: 0 | H22: 0 | I22: 0 | J22: 0 | K22: 0 | L22: 0 | M22: 151 | N22: 303 | O22: 111 | P22: 222 | Q22: 0 | R22: 0 | S22: 0 | T22: 0
A23: 20 | B23: 1006 | C23: =R[-3]C -> 5 | D23: =R[-3]C -> 6 | E23: 7897 | F23: 0 | G23: 0 | H23: 0 | I23: 0 | J23: 0 | K23: 0 | L23: 0 | M23: 0 | N23: 0 | O23: 0 | P23: 0 | Q23: 0 | R23: 0 | S23: 0 | T23: 0
A24: 21 | B24: 1006 | C24: =R[-3]C -> 7 | D24: =R[-3]C -> 10 | E24: 0 | F24: 0 | G24: 303 | H24: 607 | I24: 0 | J24: 0 | K24: 0 | L24: 0 | M24: 0 | N24: 0 | O24: 0 | P24: 0 | Q24: 0 | R24: 0 | S24: 0 | T24: 0
A25: 22 | B25: 1007 | C25: 2 | D25: 4 | E25: 0 | F25: 0 | G25: 0 | H25: 0 | I25: 0 | J25: 0 | K25: 0 | L25: 0 | M25: 214 | N25: 430 | O25: 157 | P25: 315 | Q25: 0 | R25: 0 | S25: 0 | T25: 0
A26: 23 | B26: 1007 | C26: 5 | D26: 6 | E26: 11212 | F26: 0 | G26: 0 | H26: 0 | I26: 0 | J26: 0 | K26: 0 | L26: 0 | M26: 0 | N26: 0 | O26: 0 | P26: 0 | Q26: 0 | R26: 0 | S26: 0 | T26: 0
A27: 24 | B27: 1007 | C27: 7 | D27: 10 | E27: 0 | F27: 0 | G27: 431 | H27: 862 | I27: 0 | J27: 0 | K27: 0 | L27: 0 | M27: 0 | N27: 0 | O27: 0 | P27: 0 | Q27: 0 | R27: 0 | S27: 0 | T27: 0
A28: 25 | B28: 1008 | C28: 2 | D28: 4 | E28: 0 | F28: 0 | G28: 0 | H28: 0 | I28: 0 | J28: 0 | K28: 0 | L28: 0 | M28: 288 | N28: 577 | O28: 211 | P28: 423 | Q28: 0 | R28: 0 | S28: 0 | T28: 0
A29: 26 | B29: 1008 | C29: 5 | D29: 6 | E29: 15015 | F29: 0 | G29: 0 | H29: 0 | I29: 0 | J29: 0 | K29: 0 | L29: 0 | M29: 0 | N29: 0 | O29: 0 | P29: 0 | Q29: 0 | R29: 0 | S29: 0 | T29: 0
A30: 27 | B30: 1008 | C30: 7 | D30: 10 | E30: 0 | F30: 0 | G30: 577 | H30: 1155 | I30: 0 | J30: 0 | K30: 0 | L30: 0 | M30: 0 | N30: 0 | O30: 0 | P30: 0 | Q30: 0 | R30: 0 | S30: 0 | T30: 0
A31: 28 | B31: 2000 | C31: =R[-18]C -> 2 | D31: =R[-18]C -> 4 | E31: 0 | F31: 0 | G31: 0 | H31: 0 | I31: 0 | J31: 0 | K31: 0 | L31: 0 | M31: 3 | N31: 7 | O31: 6 | P31: 14 | Q31: 0 | R31: 0 | S31: 0 | T31: 0
A32: 29 | B32: 2000 | C32: =R[-18]C -> 5 | D32: =R[-18]C -> 6 | E32: 235 | F32: 0 | G32: 0 | H32: 0 | I32: 0 | J32: 0 | K32: 0 | L32: 0 | M32: 0 | N32: 0 | O32: 0 | P32: 0 | Q32: 0 | R32: 0 | S32: 0 | T32: 0
A33: 30 | B33: 2000 | C33: =R[-18]C -> 7 | D33: =R[-18]C -> 10 | E33: 0 | F33: 0 | G33: 0 | H33: 0 | I33: 17 | J33: 36 | K33: 0 | L33: 0 | M33: =R[-1]C -> 0 | N33: =R[-1]C -> 0 | O33: =R[-1]C -> 0 | P33: =R[-1]C -> 0 | Q33: 0 | R33: 0 | S33: 0 | T33: 0
A34: 31 | B34: 2001 | C34: =R[-3]C -> 2 | D34: =R[-3]C -> 4 | E34: 0 | F34: 0 | G34: 0 | H34: 0 | I34: 0 | J34: 0 | K34: 0 | L34: 0 | M34: 7 | N34: 16 | O34: 14 | P34: 29 | Q34: 0 | R34: 0 | S34: 0 | T34: 0
A35: 32 | B35: 2001 | C35: =R[-3]C -> 5 | D35: =R[-3]C -> 6 | E35: 483 | F35: 0 | G35: 0 | H35: 0 | I35: 0 | J35: 0 | K35: 0 | L35: 0 | M35: 0 | N35: 0 | O35: 0 | P35: 0 | Q35: 0 | R35: 0 | S35: 0 | T35: 0
A36: 33 | B36: 2001 | C36: =R[-3]C -> 7 | D36: =R[-3]C -> 10 | E36: 0 | F36: 0 | G36: 0 | H36: 0 | I36: 37 | J36: 75 | K36: 0 | L36: 0 | M36: =R[-1]C -> 0 | N36: =R[-1]C -> 0 | O36: =R[-1]C -> 0 | P36: =R[-1]C -> 0 | Q36: 0 | R36: 0 | S36: 0 | T36: 0
A37: 34 | B37: 2002 | C37: =R[-3]C -> 2 | D37: =R[-3]C -> 4 | E37: 0 | F37: 0 | G37: 0 | H37: 0 | I37: 0 | J37: 0 | K37: 0 | L37: 0 | M37: 12 | N37: 25 | O37: 23 | P37: 48 | Q37: 0 | R37: 0 | S37: 0 | T37: 0
A38: 35 | B38: 2002 | C38: =R[-3]C -> 5 | D38: =R[-3]C -> 6 | E38: 787 | F38: 0 | G38: 0 | H38: 0 | I38: 0 | J38: 0 | K38: 0 | L38: 0 | M38: 0 | N38: 0 | O38: 0 | P38: 0 | Q38: 0 | R38: 0 | S38: 0 | T38: 0
A39: 36 | B39: 2002 | C39: =R[-3]C -> 7 | D39: =R[-3]C -> 10 | E39: 0 | F39: 0 | G39: 0 | H39: 0 | I39: 61 | J39: 123 | K39: 0 | L39: 0 | M39: =R[-1]C -> 0 | N39: =R[-1]C -> 0 | O39: =R[-1]C -> 0 | P39: =R[-1]C -> 0 | Q39: 0 | R39: 0 | S39: 0 | T39: 0
A40: 37 | B40: 2003 | C40: =R[-3]C -> 2 | D40: =R[-3]C -> 4 | E40: 0 | F40: 0 | G40: 0 | H40: 0 | I40: 0 | J40: 0 | K40: 0 | L40: 0 | M40: 21 | N40: 42 | O40: 39 | P40: 78 | Q40: 0 | R40: 0 | S40: 0 | T40: 0
A41: 38 | B41: 2003 | C41: =R[-3]C -> 5 | D41: =R[-3]C -> 6 | E41: 1260 | F41: 0 | G41: 0 | H41: 0 | I41: 0 | J41: 0 | K41: 0 | L41: 0 | M41: 0 | N41: 0 | O41: 0 | P41: 0 | Q41: 0 | R41: 0 | S41: 0 | T41: 0
A42: 39 | B42: 2003 | C42: =R[-3]C -> 7 | D42: =R[-3]C -> 10 | E42: 0 | F42: 0 | G42: 0 | H42: 0 | I42: 99 | J42: 198 | K42: 0 | L42: 0 | M42: =R[-1]C -> 0 | N42: =R[-1]C -> 0 | O42: =R[-1]C -> 0 | P42: =R[-1]C -> 0 | Q42: 0 | R42: 0 | S42: 0 | T42: 0
A43: 40 | B43: 2004 | C43: =R[-3]C -> 2 | D43: =R[-3]C -> 4 | E43: 0 | F43: 0 | G43: 0 | H43: 0 | I43: 0 | J43: 0 | K43: 0 | L43: 0 | M43: 32 | N43: 64 | O43: 59 | P43: 119 | Q43: 0 | R43: 0 | S43: 0 | T43: 0
A44: 41 | B44: 2004 | C44: =R[-3]C -> 5 | D44: =R[-3]C -> 6 | E44: 1947 | F44: 0 | G44: 0 | H44: 0 | I44: 0 | J44: 0 | K44: 0 | L44: 0 | M44: 0 | N44: 0 | O44: 0 | P44: 0 | Q44: 0 | R44: 0 | S44: 0 | T44: 0
A45: 42 | B45: 2004 | C45: =R[-3]C -> 7 | D45: =R[-3]C -> 10 | E45: 0 | F45: 0 | G45: 0 | H45: 0 | I45: 152 | J45: 305 | K45: 0 | L45: 0 | M45: =R[-1]C -> 0 | N45: =R[-1]C -> 0 | O45: =R[-1]C -> 0 | P45: =R[-1]C -> 0 | Q45: 0 | R45: 0 | S45: 0 | T45: 0
A46: 43 | B46: 2005 | C46: =R[-3]C -> 2 | D46: =R[-3]C -> 4 | E46: 0 | F46: 0 | G46: 0 | H46: 0 | I46: 0 | J46: 0 | K46: 0 | L46: 0 | M46: 49 | N46: 98 | O46: 91 | P46: 182 | Q46: 0 | R46: 0 | S46: 0 | T46: 0
A47: 44 | B47: 2005 | C47: =R[-3]C -> 5 | D47: =R[-3]C -> 6 | E47: 2940 | F47: 0 | G47: 0 | H47: 0 | I47: 0 | J47: 0 | K47: 0 | L47: 0 | M47: 0 | N47: 0 | O47: 0 | P47: 0 | Q47: 0 | R47: 0 | S47: 0 | T47: 0
A48: 45 | B48: 2005 | C48: =R[-3]C -> 7 | D48: =R[-3]C -> 10 | E48: 0 | F48: 0 | G48: 0 | H48: 0 | I48: 231 | J48: 462 | K48: 0 | L48: 0 | M48: =R[-1]C -> 0 | N48: =R[-1]C -> 0 | O48: =R[-1]C -> 0 | P48: =R[-1]C -> 0 | Q48: 0 | R48: 0 | S48: 0 | T48: 0
A49: 46 | B49: 2006 | C49: =R[-3]C -> 2 | D49: =R[-3]C -> 4 | E49: 0 | F49: 0 | G49: 0 | H49: 0 | I49: 0 | J49: 0 | K49: 0 | L49: 0 | M49: 70 | N49: 141 | O49: 131 | P49: 262 | Q49: 0 | R49: 0 | S49: 0 | T49: 0
A50: 47 | B50: 2006 | C50: =R[-3]C -> 5 | D50: =R[-3]C -> 6 | E50: 4252 | F50: 0 | G50: 0 | H50: 0 | I50: 0 | J50: 0 | K50: 0 | L50: 0 | M50: 0 | N50: 0 | O50: 0 | P50: 0 | Q50: 0 | R50: 0 | S50: 0 | T50: 0
A51: 48 | B51: 2006 | C51: =R[-3]C -> 7 | D51: =R[-3]C -> 10 | E51: 0 | F51: 0 | G51: 0 | H51: 0 | I51: 333 | J51: 667 | K51: 0 | L51: 0 | M51: 0 | N51: 0 | O51: 0 | P51: 0 | Q51: 0 | R51: 0 | S51: 0 | T51: 0
A52: 49 | B52: 2007 | C52: 2 | D52: 4 | E52: 0 | F52: 0 | G52: 0 | H52: 0 | I52: 0 | J52: 0 | K52: 0 | L52: 0 | M52: 100 | N52: 200 | O52: 185 | P52: 373 | Q52: 0 | R52: 0 | S52: 0 | T52: 0
A53: 50 | B53: 2007 | C53: 5 | D53: 6 | E53: 6037 | F53: 0 | G53: 0 | H53: 0 | I53: 0 | J53: 0 | K53: 0 | L53: 0 | M53: 0 | N53: 0 | O53: 0 | P53: 0 | Q53: 0 | R53: 0 | S53: 0 | T53: 0
A54: 51 | B54: 2007 | C54: 7 | D54: 10 | E54: 0 | F54: 0 | G54: 0 | H54: 0 | I54: 474 | J54: 948 | K54: 0 | L54: 0 | M54: 0 | N54: 0 | O54: 0 | P54: 0 | Q54: 0 | R54: 0 | S54: 0 | T54: 0
A55: 52 | B55: 2008 | C55: 2 | D55: 4 | E55: 0 | F55: 0 | G55: 0 | H55: 0 | I55: 0 | J55: 0 | K55: 0 | L55: 0 | M55: 134 | N55: 269 | O55: 249 | P55: 500 | Q55: 0 | R55: 0 | S55: 0 | T55: 0
A56: 53 | B56: 2008 | C56: 5 | D56: 6 | E56: 8085 | F56: 0 | G56: 0 | H56: 0 | I56: 0 | J56: 0 | K56: 0 | L56: 0 | M56: 0 | N56: 0 | O56: 0 | P56: 0 | Q56: 0 | R56: 0 | S56: 0 | T56: 0
A57: 54 | B57: 2008 | C57: 7 | D57: 10 | E57: 0 | F57: 0 | G57: 0 | H57: 0 | I57: 634 | J57: 1270 | K57: 0 | L57: 0 | M57: 0 | N57: 0 | O57: 0 | P57: 0 | Q57: 0 | R57: 0 | S57: 0 | T57: 0
A58: 55 | B58: 3000 | C58: =R[-18]C -> 2 | D58: =R[-15]C -> 4 | E58: 0 | F58: 0 | G58: 0 | H58: 0 | I58: 0 | J58: 0 | K58: 0 | L58: 0 | M58: 5 | N58: 11 | O58: 5 | P58: 11 | Q58: 0 | R58: 0 | S58: 0 | T58: 0
A59: 56 | B59: 3000 | C59: =R[-18]C -> 5 | D59: =R[-18]C -> 6 | E59: 337 | F59: 0 | G59: 0 | H59: 0 | I59: 0 | J59: 0 | K59: 0 | L59: 0 | M59: 0 | N59: 0 | O59: 0 | P59: 0 | Q59: 0 | R59: 0 | S59: 0 | T59: 0
A60: 57 | B60: 3000 | C60: =R[-18]C -> 7 | D60: =R[-18]C -> 10 | E60: 0 | F60: 0 | G60: 0 | H60: 0 | I60: 0 | J60: 0 | K60: 16 | L60: 33 | M60: =R[-1]C -> 0 | N60: =R[-1]C -> 0 | O60: =R[-1]C -> 0 | P60: =R[-1]C -> 0 | Q60: 0 | R60: 0 | S60: 0 | T60: 0
A61: 58 | B61: 3001 | C61: =R[-3]C -> 2 | D61: =R[-3]C -> 4 | E61: 0 | F61: 0 | G61: 0 | H61: 0 | I61: 0 | J61: 0 | K61: 0 | L61: 0 | M61: 11 | N61: 23 | O61: 11 | P61: 23 | Q61: 0 | R61: 0 | S61: 0 | T61: 0
A62: 59 | B62: 3001 | C62: =R[-3]C -> 5 | D62: =R[-3]C -> 6 | E62: 690 | F62: 0 | G62: 0 | H62: 0 | I62: 0 | J62: 0 | K62: 0 | L62: 0 | M62: 0 | N62: 0 | O62: 0 | P62: 0 | Q62: 0 | R62: 0 | S62: 0 | T62: 0
A63: 60 | B63: 3001 | C63: =R[-3]C -> 7 | D63: =R[-3]C -> 10 | E63: 0 | F63: 0 | G63: 0 | H63: 0 | I63: 0 | J63: 0 | K63: 34 | L63: 69 | M63: =R[-1]C -> 0 | N63: =R[-1]C -> 0 | O63: =R[-1]C -> 0 | P63: =R[-1]C -> 0 | Q63: 0 | R63: 0 | S63: 0 | T63: 0
A64: 61 | B64: 3002 | C64: =R[-3]C -> 2 | D64: =R[-3]C -> 4 | E64: 0 | F64: 0 | G64: 0 | H64: 0 | I64: 0 | J64: 0 | K64: 0 | L64: 0 | M64: 18 | N64: 37 | O64: 18 | P64: 37 | Q64: 0 | R64: 0 | S64: 0 | T64: 0
A65: 62 | B65: 3002 | C65: =R[-3]C -> 5 | D65: =R[-3]C -> 6 | E65: 1125 | F65: 0 | G65: 0 | H65: 0 | I65: 0 | J65: 0 | K65: 0 | L65: 0 | M65: 0 | N65: 0 | O65: 0 | P65: 0 | Q65: 0 | R65: 0 | S65: 0 | T65: 0
A66: 63 | B66: 3002 | C66: =R[-3]C -> 7 | D66: =R[-3]C -> 10 | E66: 0 | F66: 0 | G66: 0 | H66: 0 | I66: 0 | J66: 0 | K66: 56 | L66: 112 | M66: =R[-1]C -> 0 | N66: =R[-1]C -> 0 | O66: =R[-1]C -> 0 | P66: =R[-1]C -> 0 | Q66: 0 | R66: 0 | S66: 0 | T66: 0
A67: 64 | B67: 3003 | C67: =R[-3]C -> 2 | D67: =R[-3]C -> 4 | E67: 0 | F67: 0 | G67: 0 | H67: 0 | I67: 0 | J67: 0 | K67: 0 | L67: 0 | M67: 30 | N67: 60 | O67: 30 | P67: 60 | Q67: 0 | R67: 0 | S67: 0 | T67: 0
A68: 65 | B68: 3003 | C68: =R[-3]C -> 5 | D68: =R[-3]C -> 6 | E68: 1800 | F68: 0 | G68: 0 | H68: 0 | I68: 0 | J68: 0 | K68: 0 | L68: 0 | M68: 0 | N68: 0 | O68: 0 | P68: 0 | Q68: 0 | R68: 0 | S68: 0 | T68: 0
A69: 66 | B69: 3003 | C69: =R[-3]C -> 7 | D69: =R[-3]C -> 10 | E69: 0 | F69: 0 | G69: 0 | H69: 0 | I69: 0 | J69: 0 | K69: 90 | L69: 180 | M69: =R[-1]C -> 0 | N69: =R[-1]C -> 0 | O69: =R[-1]C -> 0 | P69: =R[-1]C -> 0 | Q69: 0 | R69: 0 | S69: 0 | T69: 0
A70: 67 | B70: 3004 | C70: =R[-3]C -> 2 | D70: =R[-3]C -> 4 | E70: 0 | F70: 0 | G70: 0 | H70: 0 | I70: 0 | J70: 0 | K70: 0 | L70: 0 | M70: 46 | N70: 92 | O70: 46 | P70: 92 | Q70: 0 | R70: 0 | S70: 0 | T70: 0
A71: 68 | B71: 3004 | C71: =R[-3]C -> 5 | D71: =R[-3]C -> 6 | E71: 2782 | F71: 0 | G71: 0 | H71: 0 | I71: 0 | J71: 0 | K71: 0 | L71: 0 | M71: 0 | N71: 0 | O71: 0 | P71: 0 | Q71: 0 | R71: 0 | S71: 0 | T71: 0
A72: 69 | B72: 3004 | C72: =R[-3]C -> 7 | D72: =R[-3]C -> 10 | E72: 0 | F72: 0 | G72: 0 | H72: 0 | I72: 0 | J72: 0 | K72: 139 | L72: 278 | M72: =R[-1]C -> 0 | N72: =R[-1]C -> 0 | O72: =R[-1]C -> 0 | P72: =R[-1]C -> 0 | Q72: 0 | R72: 0 | S72: 0 | T72: 0
A73: 70 | B73: 3005 | C73: =R[-3]C -> 2 | D73: =R[-3]C -> 4 | E73: 0 | F73: 0 | G73: 0 | H73: 0 | I73: 0 | J73: 0 | K73: 0 | L73: 0 | M73: 70 | N73: 140 | O73: 70 | P73: 140 | Q73: 0 | R73: 0 | S73: 0 | T73: 0
A74: 71 | B74: 3005 | C74: =R[-3]C -> 5 | D74: =R[-3]C -> 6 | E74: 4200 | F74: 0 | G74: 0 | H74: 0 | I74: 0 | J74: 0 | K74: 0 | L74: 0 | M74: 0 | N74: 0 | O74: 0 | P74: 0 | Q74: 0 | R74: 0 | S74: 0 | T74: 0
A75: 72 | B75: 3005 | C75: =R[-3]C -> 7 | D75: =R[-3]C -> 10 | E75: 0 | F75: 0 | G75: 0 | H75: 0 | I75: 0 | J75: 0 | K75: 210 | L75: 420 | M75: =R[-1]C -> 0 | N75: =R[-1]C -> 0 | O75: =R[-1]C -> 0 | P75: =R[-1]C -> 0 | Q75: 0 | R75: 0 | S75: 0 | T75: 0
A76: 73 | B76: 3006 | C76: =R[-3]C -> 2 | D76: =R[-3]C -> 4 | E76: 0 | F76: 0 | G76: 0 | H76: 0 | I76: 0 | J76: 0 | K76: 0 | L76: 0 | M76: 101 | N76: 202 | O76: 101 | P76: 202 | Q76: 0 | R76: 0 | S76: 0 | T76: 0
A77: 74 | B77: 3006 | C77: =R[-3]C -> 5 | D77: =R[-3]C -> 6 | E77: 6075 | F77: 0 | G77: 0 | H77: 0 | I77: 0 | J77: 0 | K77: 0 | L77: 0 | M77: 0 | N77: 0 | O77: 0 | P77: 0 | Q77: 0 | R77: 0 | S77: 0 | T77: 0
A78: 75 | B78: 3006 | C78: =R[-3]C -> 7 | D78: =R[-3]C -> 10 | E78: 0 | F78: 0 | G78: 0 | H78: 0 | I78: 0 | J78: 0 | K78: 303 | L78: 607 | M78: 0 | N78: 0 | O78: 0 | P78: 0 | Q78: 0 | R78: 0 | S78: 0 | T78: 0
A79: 76 | B79: 3007 | C79: 2 | D79: 4 | E79: 0 | F79: 0 | G79: 0 | H79: 0 | I79: 0 | J79: 0 | K79: 0 | L79: 0 | M79: 143 | N79: 287 | O79: 143 | P79: 287 | Q79: 0 | R79: 0 | S79: 0 | T79: 0
A80: 77 | B80: 3007 | C80: 5 | D80: 6 | E80: 8625 | F80: 0 | G80: 0 | H80: 0 | I80: 0 | J80: 0 | K80: 0 | L80: 0 | M80: 0 | N80: 0 | O80: 0 | P80: 0 | Q80: 0 | R80: 0 | S80: 0 | T80: 0
A81: 78 | B81: 3007 | C81: 7 | D81: 10 | E81: 0 | F81: 0 | G81: 0 | H81: 0 | I81: 0 | J81: 0 | K81: 431 | L81: 862 | M81: 0 | N81: 0 | O81: 0 | P81: 0 | Q81: 0 | R81: 0 | S81: 0 | T81: 0
A82: 79 | B82: 3008 | C82: 2 | D82: 4 | E82: 0 | F82: 0 | G82: 0 | H82: 0 | I82: 0 | J82: 0 | K82: 0 | L82: 0 | M82: 192 | N82: 385 | O82: 192 | P82: 385 | Q82: 0 | R82: 0 | S82: 0 | T82: 0
A83: 80 | B83: 3008 | C83: 5 | D83: 6 | E83: 11550 | F83: 0 | G83: 0 | H83: 0 | I83: 0 | J83: 0 | K83: 0 | L83: 0 | M83: 0 | N83: 0 | O83: 0 | P83: 0 | Q83: 0 | R83: 0 | S83: 0 | T83: 0
A84: 81 | B84: 3008 | C84: 7 | D84: 10 | E84: 0 | F84: 0 | G84: 0 | H84: 0 | I84: 0 | J84: 0 | K84: 577 | L84: 1155 | M84: 0 | N84: 0 | O84: 0 | P84: 0 | Q84: 0 | R84: 0 | S84: 0 | T84: 0