Sheet: 装备锻造表
A1: key | B1: rate | C1: quality_rate
A2: key | B2: rate | C2: quality_rate
A3: {神器星级, 等极段1, 等级段2} | B3: 锻造装备出现几率 | C3: 品质出现几率 | E3: 是否神器
A4: ="{"&RC[4]&","&RC[5]&","&RC[6]&"}" -> {0,1,10} | B4: 10000 | C4: [{1,10000}] | E4: 0 | F4: 1 | G4: 10
A5: ="{"&RC[4]&","&RC[5]&","&RC[6]&"}" -> {0,11,20} | B5: 10000 | C5: [{2,10000}] | E5: 0 | F5: =R[-1]C+10 -> 11 | G5: =R[-1]C+10 -> 20
A6: ="{"&RC[4]&","&RC[5]&","&RC[6]&"}" -> {0,21,30} | B6: 10000 | C6: [{3,10000}] | E6: 0 | F6: =R[-1]C+10 -> 21 | G6: =R[-1]C+10 -> 30
A7: ="{"&RC[4]&","&RC[5]&","&RC[6]&"}" -> {0,31,40} | B7: 10000 | C7: [{4,10000}] | E7: 0 | F7: =R[-1]C+10 -> 31 | G7: =R[-1]C+10 -> 40
A8: ="{"&RC[4]&","&RC[5]&","&RC[6]&"}" -> {0,41,50} | B8: 10000 | C8: [{4,10000}] | E8: 0 | F8: =R[-1]C+10 -> 41 | G8: =R[-1]C+10 -> 50
A9: ="{"&RC[4]&","&RC[5]&","&RC[6]&"}" -> {0,51,60} | B9: 10000 | C9: [{5,10000}] | E9: 0 | F9: =R[-1]C+10 -> 51 | G9: =R[-1]C+10 -> 60
A10: ="{"&RC[4]&","&RC[5]&","&RC[6]&"}" -> {0,61,70} | B10: 10000 | C10: [{5,10000}] | E10: 0 | F10: =R[-1]C+10 -> 61 | G10: =R[-1]C+10 -> 70
A11: ="{"&RC[4]&","&RC[5]&","&RC[6]&"}" -> {0,71,80} | B11: 10000 | C11: [{5,10000}] | E11: 0 | F11: =R[-1]C+10 -> 71 | G11: =R[-1]C+10 -> 80
A12: ="{"&RC[4]&","&RC[5]&","&RC[6]&"}" -> {0,81,90} | B12: 10000 | C12: [{5,10000}] | E12: 0 | F12: =R[-1]C+10 -> 81 | G12: =R[-1]C+10 -> 90
A13: ="{"&RC[4]&","&RC[5]&","&RC[6]&"}" -> {0,91,100} | B13: 10000 | C13: [{5,10000}] | E13: 0 | F13: =R[-1]C+10 -> 91 | G13: =R[-1]C+10 -> 100
A14: ="{"&RC[4]&","&RC[5]&","&RC[6]&"}" -> {1,1,10} | B14: 0 | C14: [{1,10000}] | E14: 1 | F14: 1 | G14: 10
A15: ="{"&RC[4]&","&RC[5]&","&RC[6]&"}" -> {1,11,20} | B15: 0 | C15: [{2,10000}] | E15: 1 | F15: =R[-1]C+10 -> 11 | G15: =R[-1]C+10 -> 20
A16: ="{"&RC[4]&","&RC[5]&","&RC[6]&"}" -> {1,21,30} | B16: 0 | C16: [{3,10000}] | E16: 1 | F16: =R[-1]C+10 -> 21 | G16: =R[-1]C+10 -> 30
A17: ="{"&RC[4]&","&RC[5]&","&RC[6]&"}" -> {1,31,40} | B17: 0 | C17: [{4,10000}] | E17: 1 | F17: =R[-1]C+10 -> 31 | G17: =R[-1]C+10 -> 40
A18: ="{"&RC[4]&","&RC[5]&","&RC[6]&"}" -> {1,41,50} | B18: 0 | C18: [{4,10000}] | E18: 1 | F18: =R[-1]C+10 -> 41 | G18: =R[-1]C+10 -> 50
A19: ="{"&RC[4]&","&RC[5]&","&RC[6]&"}" -> {1,51,60} | B19: 0 | C19: [{5,10000}] | E19: 1 | F19: =R[-1]C+10 -> 51 | G19: =R[-1]C+10 -> 60
A20: ="{"&RC[4]&","&RC[5]&","&RC[6]&"}" -> {1,61,70} | B20: 0 | C20: [{5,10000}] | E20: 1 | F20: =R[-1]C+10 -> 61 | G20: =R[-1]C+10 -> 70
A21: ="{"&RC[4]&","&RC[5]&","&RC[6]&"}" -> {1,71,80} | B21: 0 | C21: [{5,10000}] | E21: 1 | F21: =R[-1]C+10 -> 71 | G21: =R[-1]C+10 -> 80
A22: ="{"&RC[4]&","&RC[5]&","&RC[6]&"}" -> {1,81,90} | B22: 0 | C22: [{5,10000}] | E22: 1 | F22: =R[-1]C+10 -> 81 | G22: =R[-1]C+10 -> 90
A23: ="{"&RC[4]&","&RC[5]&","&RC[6]&"}" -> {1,91,100} | B23: 0 | C23: [{5,10000}] | E23: 1 | F23: =R[-1]C+10 -> 91 | G23: =R[-1]C+10 -> 100