Sheet: 洗炼配置
A1: id | B1: quality | C1: sub_type | D1: career | E1: min_lv | F1: max_lv | G1: branch_num | H1: use_coin | I1: use_goods | J1: use_goods_num | K1: attr_rate | L1: attr_max_value | M1: bap_rate
A2: id | B2: quality | C2: sub_type | E2: min_lv | F2: max_lv | G2: branch_num | H2: use_coin | I2: use_goods | J2: use_goods_num
A3: id | B3: 品质 | C3: 装备子类型 | D3: 职业 | E3: 最小等级 | F3: 最大等级 | G3: 洗炼出现属性条数 | H3: 消耗金钱 | I3: 消耗道具id | J3: 消耗道具数 | K3: 洗炼出属性概率 | L3: 属性最大值 | M3: 洗练率
A4: 1 | B4: 2 | C4: 1 | D4: 1000 | E4: 1 | F4: 10 | G4: 1 | H4: 5000 | I4: 110003 | J4: 1 | K4: =配置模型!R15C[-6] -> [{7,6},{8,4},{9,0},{10,0},{11,0},{12,0},{17,10},{18,8},{19,1},{23,4},{24,10}] | L4: =配置模型!R[44]C[1] -> [{7,27},{8,55},{9,27},{10,55},{11,27},{12,55},{17,18},{18,110},{19,3},{23,37},{24,37}] | M4: =配置模型!R[60]C[-6] -> [{0,1,[1,30]},{1,2,[11,40]},{2,5,[21,50]},{5,10,[31,60]},{10,20,[41,60]},{30,20,[51,70]},{50,10,[61,80]},{70,5,[71,80]},{100,2,[81,90]},{150,1,[91,100]}]
A5: 2 | B5: 2 | C5: 1 | D5: 1000 | E5: =R[-1]C+10 -> 11 | F5: =R[-1]C+10 -> 20 | G5: 1 | H5: 5000 | I5: 110003 | J5: 1 | K5: =R[-1]C -> [{7,6},{8,4},{9,0},{10,0},{11,0},{12,0},{17,10},{18,8},{19,1},{23,4},{24,10}] | L5: =R[-1]C -> [{7,27},{8,55},{9,27},{10,55},{11,27},{12,55},{17,18},{18,110},{19,3},{23,37},{24,37}] | M5: =R[-1]C -> [{0,1,[1,30]},{1,2,[11,40]},{2,5,[21,50]},{5,10,[31,60]},{10,20,[41,60]},{30,20,[51,70]},{50,10,[61,80]},{70,5,[71,80]},{100,2,[81,90]},{150,1,[91,100]}]
A6: 3 | B6: 2 | C6: 1 | D6: 1000 | E6: =R[-1]C+10 -> 21 | F6: =R[-1]C+10 -> 30 | G6: 1 | H6: 5000 | I6: 110003 | J6: 1 | K6: =R[-1]C -> [{7,6},{8,4},{9,0},{10,0},{11,0},{12,0},{17,10},{18,8},{19,1},{23,4},{24,10}] | L6: =R[-1]C -> [{7,27},{8,55},{9,27},{10,55},{11,27},{12,55},{17,18},{18,110},{19,3},{23,37},{24,37}] | M6: =R[-1]C -> [{0,1,[1,30]},{1,2,[11,40]},{2,5,[21,50]},{5,10,[31,60]},{10,20,[41,60]},{30,20,[51,70]},{50,10,[61,80]},{70,5,[71,80]},{100,2,[81,90]},{150,1,[91,100]}]
A7: 4 | B7: 2 | C7: 1 | D7: 1000 | E7: =R[-1]C+10 -> 31 | F7: =R[-1]C+10 -> 40 | G7: 1 | H7: 5000 | I7: 110003 | J7: 1 | K7: =R[-1]C -> [{7,6},{8,4},{9,0},{10,0},{11,0},{12,0},{17,10},{18,8},{19,1},{23,4},{24,10}] | L7: =R[-1]C -> [{7,27},{8,55},{9,27},{10,55},{11,27},{12,55},{17,18},{18,110},{19,3},{23,37},{24,37}] | M7: =R[-1]C -> [{0,1,[1,30]},{1,2,[11,40]},{2,5,[21,50]},{5,10,[31,60]},{10,20,[41,60]},{30,20,[51,70]},{50,10,[61,80]},{70,5,[71,80]},{100,2,[81,90]},{150,1,[91,100]}]
A8: 5 | B8: 2 | C8: 1 | D8: 1000 | E8: =R[-1]C+10 -> 41 | F8: =R[-1]C+10 -> 50 | G8: 1 | H8: 5000 | I8: 110003 | J8: 1 | K8: =R[-1]C -> [{7,6},{8,4},{9,0},{10,0},{11,0},{12,0},{17,10},{18,8},{19,1},{23,4},{24,10}] | L8: =R[-1]C -> [{7,27},{8,55},{9,27},{10,55},{11,27},{12,55},{17,18},{18,110},{19,3},{23,37},{24,37}] | M8: =R[-1]C -> [{0,1,[1,30]},{1,2,[11,40]},{2,5,[21,50]},{5,10,[31,60]},{10,20,[41,60]},{30,20,[51,70]},{50,10,[61,80]},{70,5,[71,80]},{100,2,[81,90]},{150,1,[91,100]}]
A9: 6 | B9: 2 | C9: 1 | D9: 1000 | E9: =R[-1]C+10 -> 51 | F9: =R[-1]C+10 -> 60 | G9: 1 | H9: 5000 | I9: 110003 | J9: 1 | K9: =R[-1]C -> [{7,6},{8,4},{9,0},{10,0},{11,0},{12,0},{17,10},{18,8},{19,1},{23,4},{24,10}] | L9: =R[-1]C -> [{7,27},{8,55},{9,27},{10,55},{11,27},{12,55},{17,18},{18,110},{19,3},{23,37},{24,37}] | M9: =R[-1]C -> [{0,1,[1,30]},{1,2,[11,40]},{2,5,[21,50]},{5,10,[31,60]},{10,20,[41,60]},{30,20,[51,70]},{50,10,[61,80]},{70,5,[71,80]},{100,2,[81,90]},{150,1,[91,100]}]
A10: 7 | B10: 2 | C10: 1 | D10: 1000 | E10: =R[-1]C+10 -> 61 | F10: =R[-1]C+10 -> 70 | G10: 1 | H10: 5000 | I10: 110003 | J10: 1 | K10: =R[-1]C -> [{7,6},{8,4},{9,0},{10,0},{11,0},{12,0},{17,10},{18,8},{19,1},{23,4},{24,10}] | L10: =R[-1]C -> [{7,27},{8,55},{9,27},{10,55},{11,27},{12,55},{17,18},{18,110},{19,3},{23,37},{24,37}] | M10: =R[-1]C -> [{0,1,[1,30]},{1,2,[11,40]},{2,5,[21,50]},{5,10,[31,60]},{10,20,[41,60]},{30,20,[51,70]},{50,10,[61,80]},{70,5,[71,80]},{100,2,[81,90]},{150,1,[91,100]}]
A11: 8 | B11: 2 | C11: 1 | D11: 1000 | E11: =R[-1]C+10 -> 71 | F11: =R[-1]C+10 -> 80 | G11: 1 | H11: 5000 | I11: 110003 | J11: 1 | K11: =R[-1]C -> [{7,6},{8,4},{9,0},{10,0},{11,0},{12,0},{17,10},{18,8},{19,1},{23,4},{24,10}] | L11: =R[-1]C -> [{7,27},{8,55},{9,27},{10,55},{11,27},{12,55},{17,18},{18,110},{19,3},{23,37},{24,37}] | M11: =R[-1]C -> [{0,1,[1,30]},{1,2,[11,40]},{2,5,[21,50]},{5,10,[31,60]},{10,20,[41,60]},{30,20,[51,70]},{50,10,[61,80]},{70,5,[71,80]},{100,2,[81,90]},{150,1,[91,100]}]
A12: 9 | B12: 2 | C12: 1 | D12: 1000 | E12: =R[-1]C+10 -> 81 | F12: =R[-1]C+10 -> 90 | G12: 1 | H12: 5000 | I12: 110003 | J12: 1 | K12: =R[-1]C -> [{7,6},{8,4},{9,0},{10,0},{11,0},{12,0},{17,10},{18,8},{19,1},{23,4},{24,10}] | L12: =R[-1]C -> [{7,27},{8,55},{9,27},{10,55},{11,27},{12,55},{17,18},{18,110},{19,3},{23,37},{24,37}] | M12: =R[-1]C -> [{0,1,[1,30]},{1,2,[11,40]},{2,5,[21,50]},{5,10,[31,60]},{10,20,[41,60]},{30,20,[51,70]},{50,10,[61,80]},{70,5,[71,80]},{100,2,[81,90]},{150,1,[91,100]}]
A13: 10 | B13: 3 | C13: 1 | D13: 1000 | E13: =R[-9]C -> 1 | F13: =R[-9]C -> 10 | G13: 2 | H13: 10000 | I13: 110003 | J13: 2 | K13: =R[-1]C -> [{7,6},{8,4},{9,0},{10,0},{11,0},{12,0},{17,10},{18,8},{19,1},{23,4},{24,10}] | L13: =R[-1]C -> [{7,27},{8,55},{9,27},{10,55},{11,27},{12,55},{17,18},{18,110},{19,3},{23,37},{24,37}] | M13: =R[-1]C -> [{0,1,[1,30]},{1,2,[11,40]},{2,5,[21,50]},{5,10,[31,60]},{10,20,[41,60]},{30,20,[51,70]},{50,10,[61,80]},{70,5,[71,80]},{100,2,[81,90]},{150,1,[91,100]}]
A14: 11 | B14: 3 | C14: 1 | D14: 1000 | E14: =R[-9]C -> 11 | F14: =R[-9]C -> 20 | G14: 2 | H14: 10000 | I14: 110003 | J14: 2 | K14: =R[-1]C -> [{7,6},{8,4},{9,0},{10,0},{11,0},{12,0},{17,10},{18,8},{19,1},{23,4},{24,10}] | L14: =R[-1]C -> [{7,27},{8,55},{9,27},{10,55},{11,27},{12,55},{17,18},{18,110},{19,3},{23,37},{24,37}] | M14: =R[-1]C -> [{0,1,[1,30]},{1,2,[11,40]},{2,5,[21,50]},{5,10,[31,60]},{10,20,[41,60]},{30,20,[51,70]},{50,10,[61,80]},{70,5,[71,80]},{100,2,[81,90]},{150,1,[91,100]}]
A15: 12 | B15: 3 | C15: 1 | D15: 1000 | E15: =R[-9]C -> 21 | F15: =R[-9]C -> 30 | G15: 2 | H15: 10000 | I15: 110003 | J15: 2 | K15: =R[-1]C -> [{7,6},{8,4},{9,0},{10,0},{11,0},{12,0},{17,10},{18,8},{19,1},{23,4},{24,10}] | L15: =R[-1]C -> [{7,27},{8,55},{9,27},{10,55},{11,27},{12,55},{17,18},{18,110},{19,3},{23,37},{24,37}] | M15: =R[-1]C -> [{0,1,[1,30]},{1,2,[11,40]},{2,5,[21,50]},{5,10,[31,60]},{10,20,[41,60]},{30,20,[51,70]},{50,10,[61,80]},{70,5,[71,80]},{100,2,[81,90]},{150,1,[91,100]}]
A16: 13 | B16: 3 | C16: 1 | D16: 1000 | E16: =R[-9]C -> 31 | F16: =R[-9]C -> 40 | G16: 2 | H16: 10000 | I16: 110003 | J16: 2 | K16: =R[-1]C -> [{7,6},{8,4},{9,0},{10,0},{11,0},{12,0},{17,10},{18,8},{19,1},{23,4},{24,10}] | L16: =R[-1]C -> [{7,27},{8,55},{9,27},{10,55},{11,27},{12,55},{17,18},{18,110},{19,3},{23,37},{24,37}] | M16: =R[-1]C -> [{0,1,[1,30]},{1,2,[11,40]},{2,5,[21,50]},{5,10,[31,60]},{10,20,[41,60]},{30,20,[51,70]},{50,10,[61,80]},{70,5,[71,80]},{100,2,[81,90]},{150,1,[91,100]}]
A17: 14 | B17: 3 | C17: 1 | D17: 1000 | E17: =R[-9]C -> 41 | F17: =R[-9]C -> 50 | G17: 2 | H17: 10000 | I17: 110003 | J17: 2 | K17: =R[-1]C -> [{7,6},{8,4},{9,0},{10,0},{11,0},{12,0},{17,10},{18,8},{19,1},{23,4},{24,10}] | L17: =R[-1]C -> [{7,27},{8,55},{9,27},{10,55},{11,27},{12,55},{17,18},{18,110},{19,3},{23,37},{24,37}] | M17: =R[-1]C -> [{0,1,[1,30]},{1,2,[11,40]},{2,5,[21,50]},{5,10,[31,60]},{10,20,[41,60]},{30,20,[51,70]},{50,10,[61,80]},{70,5,[71,80]},{100,2,[81,90]},{150,1,[91,100]}]
A18: 15 | B18: 3 | C18: 1 | D18: 1000 | E18: =R[-9]C -> 51 | F18: =R[-9]C -> 60 | G18: 2 | H18: 10000 | I18: 110003 | J18: 2 | K18: =R[-1]C -> [{7,6},{8,4},{9,0},{10,0},{11,0},{12,0},{17,10},{18,8},{19,1},{23,4},{24,10}] | L18: =R[-1]C -> [{7,27},{8,55},{9,27},{10,55},{11,27},{12,55},{17,18},{18,110},{19,3},{23,37},{24,37}] | M18: =R[-1]C -> [{0,1,[1,30]},{1,2,[11,40]},{2,5,[21,50]},{5,10,[31,60]},{10,20,[41,60]},{30,20,[51,70]},{50,10,[61,80]},{70,5,[71,80]},{100,2,[81,90]},{150,1,[91,100]}]
A19: 16 | B19: 3 | C19: 1 | D19: 1000 | E19: =R[-9]C -> 61 | F19: =R[-9]C -> 70 | G19: 2 | H19: 10000 | I19: 110003 | J19: 2 | K19: =R[-1]C -> [{7,6},{8,4},{9,0},{10,0},{11,0},{12,0},{17,10},{18,8},{19,1},{23,4},{24,10}] | L19: =R[-1]C -> [{7,27},{8,55},{9,27},{10,55},{11,27},{12,55},{17,18},{18,110},{19,3},{23,37},{24,37}] | M19: =R[-1]C -> [{0,1,[1,30]},{1,2,[11,40]},{2,5,[21,50]},{5,10,[31,60]},{10,20,[41,60]},{30,20,[51,70]},{50,10,[61,80]},{70,5,[71,80]},{100,2,[81,90]},{150,1,[91,100]}]
A20: 17 | B20: 3 | C20: 1 | D20: 1000 | E20: =R[-9]C -> 71 | F20: =R[-9]C -> 80 | G20: 2 | H20: 10000 | I20: 110003 | J20: 2 | K20: =R[-1]C -> [{7,6},{8,4},{9,0},{10,0},{11,0},{12,0},{17,10},{18,8},{19,1},{23,4},{24,10}] | L20: =R[-1]C -> [{7,27},{8,55},{9,27},{10,55},{11,27},{12,55},{17,18},{18,110},{19,3},{23,37},{24,37}] | M20: =R[-1]C -> [{0,1,[1,30]},{1,2,[11,40]},{2,5,[21,50]},{5,10,[31,60]},{10,20,[41,60]},{30,20,[51,70]},{50,10,[61,80]},{70,5,[71,80]},{100,2,[81,90]},{150,1,[91,100]}]
A21: 18 | B21: 3 | C21: 1 | D21: 1000 | E21: =R[-9]C -> 81 | F21: =R[-9]C -> 90 | G21: 2 | H21: 10000 | I21: 110003 | J21: 2 | K21: =R[-1]C -> [{7,6},{8,4},{9,0},{10,0},{11,0},{12,0},{17,10},{18,8},{19,1},{23,4},{24,10}] | L21: =R[-1]C -> [{7,27},{8,55},{9,27},{10,55},{11,27},{12,55},{17,18},{18,110},{19,3},{23,37},{24,37}] | M21: =R[-1]C -> [{0,1,[1,30]},{1,2,[11,40]},{2,5,[21,50]},{5,10,[31,60]},{10,20,[41,60]},{30,20,[51,70]},{50,10,[61,80]},{70,5,[71,80]},{100,2,[81,90]},{150,1,[91,100]}]
A22: 19 | B22: 4 | C22: 1 | D22: 1000 | E22: =R[-9]C -> 1 | F22: =R[-9]C -> 10 | G22: 3 | H22: 15000 | I22: 110003 | J22: 3 | K22: =R[-1]C -> [{7,6},{8,4},{9,0},{10,0},{11,0},{12,0},{17,10},{18,8},{19,1},{23,4},{24,10}] | L22: =R[-1]C -> [{7,27},{8,55},{9,27},{10,55},{11,27},{12,55},{17,18},{18,110},{19,3},{23,37},{24,37}] | M22: =R[-1]C -> [{0,1,[1,30]},{1,2,[11,40]},{2,5,[21,50]},{5,10,[31,60]},{10,20,[41,60]},{30,20,[51,70]},{50,10,[61,80]},{70,5,[71,80]},{100,2,[81,90]},{150,1,[91,100]}]
A23: 20 | B23: 4 | C23: 1 | D23: 1000 | E23: =R[-9]C -> 11 | F23: =R[-9]C -> 20 | G23: 3 | H23: 15000 | I23: 110003 | J23: 3 | K23: =R[-1]C -> [{7,6},{8,4},{9,0},{10,0},{11,0},{12,0},{17,10},{18,8},{19,1},{23,4},{24,10}] | L23: =R[-1]C -> [{7,27},{8,55},{9,27},{10,55},{11,27},{12,55},{17,18},{18,110},{19,3},{23,37},{24,37}] | M23: =R[-1]C -> [{0,1,[1,30]},{1,2,[11,40]},{2,5,[21,50]},{5,10,[31,60]},{10,20,[41,60]},{30,20,[51,70]},{50,10,[61,80]},{70,5,[71,80]},{100,2,[81,90]},{150,1,[91,100]}]
A24: 21 | B24: 4 | C24: 1 | D24: 1000 | E24: =R[-9]C -> 21 | F24: =R[-9]C -> 30 | G24: 3 | H24: 15000 | I24: 110003 | J24: 3 | K24: =R[-1]C -> [{7,6},{8,4},{9,0},{10,0},{11,0},{12,0},{17,10},{18,8},{19,1},{23,4},{24,10}] | L24: =R[-1]C -> [{7,27},{8,55},{9,27},{10,55},{11,27},{12,55},{17,18},{18,110},{19,3},{23,37},{24,37}] | M24: =R[-1]C -> [{0,1,[1,30]},{1,2,[11,40]},{2,5,[21,50]},{5,10,[31,60]},{10,20,[41,60]},{30,20,[51,70]},{50,10,[61,80]},{70,5,[71,80]},{100,2,[81,90]},{150,1,[91,100]}]
A25: 22 | B25: 4 | C25: 1 | D25: 1000 | E25: =R[-9]C -> 31 | F25: =R[-9]C -> 40 | G25: 3 | H25: 15000 | I25: 110003 | J25: 3 | K25: =R[-1]C -> [{7,6},{8,4},{9,0},{10,0},{11,0},{12,0},{17,10},{18,8},{19,1},{23,4},{24,10}] | L25: =R[-1]C -> [{7,27},{8,55},{9,27},{10,55},{11,27},{12,55},{17,18},{18,110},{19,3},{23,37},{24,37}] | M25: =R[-1]C -> [{0,1,[1,30]},{1,2,[11,40]},{2,5,[21,50]},{5,10,[31,60]},{10,20,[41,60]},{30,20,[51,70]},{50,10,[61,80]},{70,5,[71,80]},{100,2,[81,90]},{150,1,[91,100]}]
A26: 23 | B26: 4 | C26: 1 | D26: 1000 | E26: =R[-9]C -> 41 | F26: =R[-9]C -> 50 | G26: 3 | H26: 15000 | I26: 110003 | J26: 3 | K26: =R[-1]C -> [{7,6},{8,4},{9,0},{10,0},{11,0},{12,0},{17,10},{18,8},{19,1},{23,4},{24,10}] | L26: =R[-1]C -> [{7,27},{8,55},{9,27},{10,55},{11,27},{12,55},{17,18},{18,110},{19,3},{23,37},{24,37}] | M26: =R[-1]C -> [{0,1,[1,30]},{1,2,[11,40]},{2,5,[21,50]},{5,10,[31,60]},{10,20,[41,60]},{30,20,[51,70]},{50,10,[61,80]},{70,5,[71,80]},{100,2,[81,90]},{150,1,[91,100]}]
A27: 24 | B27: 4 | C27: 1 | D27: 1000 | E27: =R[-9]C -> 51 | F27: =R[-9]C -> 60 | G27: 3 | H27: 15000 | I27: 110003 | J27: 3 | K27: =R[-1]C -> [{7,6},{8,4},{9,0},{10,0},{11,0},{12,0},{17,10},{18,8},{19,1},{23,4},{24,10}] | L27: =R[-1]C -> [{7,27},{8,55},{9,27},{10,55},{11,27},{12,55},{17,18},{18,110},{19,3},{23,37},{24,37}] | M27: =R[-1]C -> [{0,1,[1,30]},{1,2,[11,40]},{2,5,[21,50]},{5,10,[31,60]},{10,20,[41,60]},{30,20,[51,70]},{50,10,[61,80]},{70,5,[71,80]},{100,2,[81,90]},{150,1,[91,100]}]
A28: 25 | B28: 4 | C28: 1 | D28: 1000 | E28: =R[-9]C -> 61 | F28: =R[-9]C -> 70 | G28: 3 | H28: 15000 | I28: 110003 | J28: 3 | K28: =R[-1]C -> [{7,6},{8,4},{9,0},{10,0},{11,0},{12,0},{17,10},{18,8},{19,1},{23,4},{24,10}] | L28: =R[-1]C -> [{7,27},{8,55},{9,27},{10,55},{11,27},{12,55},{17,18},{18,110},{19,3},{23,37},{24,37}] | M28: =R[-1]C -> [{0,1,[1,30]},{1,2,[11,40]},{2,5,[21,50]},{5,10,[31,60]},{10,20,[41,60]},{30,20,[51,70]},{50,10,[61,80]},{70,5,[71,80]},{100,2,[81,90]},{150,1,[91,100]}]
A29: 26 | B29: 4 | C29: 1 | D29: 1000 | E29: =R[-9]C -> 71 | F29: =R[-9]C -> 80 | G29: 3 | H29: 15000 | I29: 110003 | J29: 3 | K29: =R[-1]C -> [{7,6},{8,4},{9,0},{10,0},{11,0},{12,0},{17,10},{18,8},{19,1},{23,4},{24,10}] | L29: =R[-1]C -> [{7,27},{8,55},{9,27},{10,55},{11,27},{12,55},{17,18},{18,110},{19,3},{23,37},{24,37}] | M29: =R[-1]C -> [{0,1,[1,30]},{1,2,[11,40]},{2,5,[21,50]},{5,10,[31,60]},{10,20,[41,60]},{30,20,[51,70]},{50,10,[61,80]},{70,5,[71,80]},{100,2,[81,90]},{150,1,[91,100]}]
A30: 27 | B30: 4 | C30: 1 | D30: 1000 | E30: =R[-9]C -> 81 | F30: =R[-9]C -> 90 | G30: 3 | H30: 15000 | I30: 110003 | J30: 3 | K30: =R[-1]C -> [{7,6},{8,4},{9,0},{10,0},{11,0},{12,0},{17,10},{18,8},{19,1},{23,4},{24,10}] | L30: =R[-1]C -> [{7,27},{8,55},{9,27},{10,55},{11,27},{12,55},{17,18},{18,110},{19,3},{23,37},{24,37}] | M30: =R[-1]C -> [{0,1,[1,30]},{1,2,[11,40]},{2,5,[21,50]},{5,10,[31,60]},{10,20,[41,60]},{30,20,[51,70]},{50,10,[61,80]},{70,5,[71,80]},{100,2,[81,90]},{150,1,[91,100]}]
A31: 28 | B31: 5 | C31: 1 | D31: 1000 | E31: =R[-9]C -> 1 | F31: =R[-9]C -> 10 | G31: 4 | H31: 20000 | I31: 110003 | J31: 4 | K31: =R[-1]C -> [{7,6},{8,4},{9,0},{10,0},{11,0},{12,0},{17,10},{18,8},{19,1},{23,4},{24,10}] | L31: =R[-1]C -> [{7,27},{8,55},{9,27},{10,55},{11,27},{12,55},{17,18},{18,110},{19,3},{23,37},{24,37}] | M31: =R[-1]C -> [{0,1,[1,30]},{1,2,[11,40]},{2,5,[21,50]},{5,10,[31,60]},{10,20,[41,60]},{30,20,[51,70]},{50,10,[61,80]},{70,5,[71,80]},{100,2,[81,90]},{150,1,[91,100]}]
A32: 29 | B32: 5 | C32: 1 | D32: 1000 | E32: =R[-9]C -> 11 | F32: =R[-9]C -> 20 | G32: 4 | H32: 20000 | I32: 110003 | J32: 4 | K32: =R[-1]C -> [{7,6},{8,4},{9,0},{10,0},{11,0},{12,0},{17,10},{18,8},{19,1},{23,4},{24,10}] | L32: =R[-1]C -> [{7,27},{8,55},{9,27},{10,55},{11,27},{12,55},{17,18},{18,110},{19,3},{23,37},{24,37}] | M32: =R[-1]C -> [{0,1,[1,30]},{1,2,[11,40]},{2,5,[21,50]},{5,10,[31,60]},{10,20,[41,60]},{30,20,[51,70]},{50,10,[61,80]},{70,5,[71,80]},{100,2,[81,90]},{150,1,[91,100]}]
A33: 30 | B33: 5 | C33: 1 | D33: 1000 | E33: =R[-9]C -> 21 | F33: =R[-9]C -> 30 | G33: 4 | H33: 20000 | I33: 110003 | J33: 4 | K33: =R[-1]C -> [{7,6},{8,4},{9,0},{10,0},{11,0},{12,0},{17,10},{18,8},{19,1},{23,4},{24,10}] | L33: =R[-1]C -> [{7,27},{8,55},{9,27},{10,55},{11,27},{12,55},{17,18},{18,110},{19,3},{23,37},{24,37}] | M33: =R[-1]C -> [{0,1,[1,30]},{1,2,[11,40]},{2,5,[21,50]},{5,10,[31,60]},{10,20,[41,60]},{30,20,[51,70]},{50,10,[61,80]},{70,5,[71,80]},{100,2,[81,90]},{150,1,[91,100]}]
A34: 31 | B34: 5 | C34: 1 | D34: 1000 | E34: =R[-9]C -> 31 | F34: =R[-9]C -> 40 | G34: 4 | H34: 20000 | I34: 110003 | J34: 4 | K34: =R[-1]C -> [{7,6},{8,4},{9,0},{10,0},{11,0},{12,0},{17,10},{18,8},{19,1},{23,4},{24,10}] | L34: =R[-1]C -> [{7,27},{8,55},{9,27},{10,55},{11,27},{12,55},{17,18},{18,110},{19,3},{23,37},{24,37}] | M34: =R[-1]C -> [{0,1,[1,30]},{1,2,[11,40]},{2,5,[21,50]},{5,10,[31,60]},{10,20,[41,60]},{30,20,[51,70]},{50,10,[61,80]},{70,5,[71,80]},{100,2,[81,90]},{150,1,[91,100]}]
A35: 32 | B35: 5 | C35: 1 | D35: 1000 | E35: =R[-9]C -> 41 | F35: =R[-9]C -> 50 | G35: 4 | H35: 20000 | I35: 110003 | J35: 4 | K35: =R[-1]C -> [{7,6},{8,4},{9,0},{10,0},{11,0},{12,0},{17,10},{18,8},{19,1},{23,4},{24,10}] | L35: =R[-1]C -> [{7,27},{8,55},{9,27},{10,55},{11,27},{12,55},{17,18},{18,110},{19,3},{23,37},{24,37}] | M35: =R[-1]C -> [{0,1,[1,30]},{1,2,[11,40]},{2,5,[21,50]},{5,10,[31,60]},{10,20,[41,60]},{30,20,[51,70]},{50,10,[61,80]},{70,5,[71,80]},{100,2,[81,90]},{150,1,[91,100]}]
A36: 33 | B36: 5 | C36: 1 | D36: 1000 | E36: =R[-9]C -> 51 | F36: =R[-9]C -> 60 | G36: 4 | H36: 20000 | I36: 110003 | J36: 4 | K36: =R[-1]C -> [{7,6},{8,4},{9,0},{10,0},{11,0},{12,0},{17,10},{18,8},{19,1},{23,4},{24,10}] | L36: =R[-1]C -> [{7,27},{8,55},{9,27},{10,55},{11,27},{12,55},{17,18},{18,110},{19,3},{23,37},{24,37}] | M36: =R[-1]C -> [{0,1,[1,30]},{1,2,[11,40]},{2,5,[21,50]},{5,10,[31,60]},{10,20,[41,60]},{30,20,[51,70]},{50,10,[61,80]},{70,5,[71,80]},{100,2,[81,90]},{150,1,[91,100]}]
A37: 34 | B37: 5 | C37: 1 | D37: 1000 | E37: =R[-9]C -> 61 | F37: =R[-9]C -> 70 | G37: 4 | H37: 20000 | I37: 110003 | J37: 4 | K37: =R[-1]C -> [{7,6},{8,4},{9,0},{10,0},{11,0},{12,0},{17,10},{18,8},{19,1},{23,4},{24,10}] | L37: =R[-1]C -> [{7,27},{8,55},{9,27},{10,55},{11,27},{12,55},{17,18},{18,110},{19,3},{23,37},{24,37}] | M37: =R[-1]C -> [{0,1,[1,30]},{1,2,[11,40]},{2,5,[21,50]},{5,10,[31,60]},{10,20,[41,60]},{30,20,[51,70]},{50,10,[61,80]},{70,5,[71,80]},{100,2,[81,90]},{150,1,[91,100]}]
A38: 35 | B38: 5 | C38: 1 | D38: 1000 | E38: =R[-9]C -> 71 | F38: =R[-9]C -> 80 | G38: 4 | H38: 20000 | I38: 110003 | J38: 4 | K38: =R[-1]C -> [{7,6},{8,4},{9,0},{10,0},{11,0},{12,0},{17,10},{18,8},{19,1},{23,4},{24,10}] | L38: =R[-1]C -> [{7,27},{8,55},{9,27},{10,55},{11,27},{12,55},{17,18},{18,110},{19,3},{23,37},{24,37}] | M38: =R[-1]C -> [{0,1,[1,30]},{1,2,[11,40]},{2,5,[21,50]},{5,10,[31,60]},{10,20,[41,60]},{30,20,[51,70]},{50,10,[61,80]},{70,5,[71,80]},{100,2,[81,90]},{150,1,[91,100]}]
A39: 36 | B39: 5 | C39: 1 | D39: 1000 | E39: =R[-9]C -> 81 | F39: =R[-9]C -> 90 | G39: 4 | H39: 20000 | I39: 110003 | J39: 4 | K39: =R[-1]C -> [{7,6},{8,4},{9,0},{10,0},{11,0},{12,0},{17,10},{18,8},{19,1},{23,4},{24,10}] | L39: =R[-1]C -> [{7,27},{8,55},{9,27},{10,55},{11,27},{12,55},{17,18},{18,110},{19,3},{23,37},{24,37}] | M39: =R[-1]C -> [{0,1,[1,30]},{1,2,[11,40]},{2,5,[21,50]},{5,10,[31,60]},{10,20,[41,60]},{30,20,[51,70]},{50,10,[61,80]},{70,5,[71,80]},{100,2,[81,90]},{150,1,[91,100]}]
A40: 37 | B40: 6 | C40: 1 | D40: 1000 | E40: =R[-9]C -> 1 | F40: =R[-9]C -> 10 | G40: 5 | H40: 20000 | I40: 110003 | J40: 5 | K40: =R[-1]C -> [{7,6},{8,4},{9,0},{10,0},{11,0},{12,0},{17,10},{18,8},{19,1},{23,4},{24,10}] | L40: =R[-1]C -> [{7,27},{8,55},{9,27},{10,55},{11,27},{12,55},{17,18},{18,110},{19,3},{23,37},{24,37}] | M40: =R[-1]C -> [{0,1,[1,30]},{1,2,[11,40]},{2,5,[21,50]},{5,10,[31,60]},{10,20,[41,60]},{30,20,[51,70]},{50,10,[61,80]},{70,5,[71,80]},{100,2,[81,90]},{150,1,[91,100]}]
A41: 38 | B41: 6 | C41: 1 | D41: 1000 | E41: =R[-9]C -> 11 | F41: =R[-9]C -> 20 | G41: 5 | H41: 20000 | I41: 110003 | J41: 5 | K41: =R[-1]C -> [{7,6},{8,4},{9,0},{10,0},{11,0},{12,0},{17,10},{18,8},{19,1},{23,4},{24,10}] | L41: =R[-1]C -> [{7,27},{8,55},{9,27},{10,55},{11,27},{12,55},{17,18},{18,110},{19,3},{23,37},{24,37}] | M41: =R[-1]C -> [{0,1,[1,30]},{1,2,[11,40]},{2,5,[21,50]},{5,10,[31,60]},{10,20,[41,60]},{30,20,[51,70]},{50,10,[61,80]},{70,5,[71,80]},{100,2,[81,90]},{150,1,[91,100]}]
A42: 39 | B42: 6 | C42: 1 | D42: 1000 | E42: =R[-9]C -> 21 | F42: =R[-9]C -> 30 | G42: 5 | H42: 20000 | I42: 110003 | J42: 5 | K42: =R[-1]C -> [{7,6},{8,4},{9,0},{10,0},{11,0},{12,0},{17,10},{18,8},{19,1},{23,4},{24,10}] | L42: =R[-1]C -> [{7,27},{8,55},{9,27},{10,55},{11,27},{12,55},{17,18},{18,110},{19,3},{23,37},{24,37}] | M42: =R[-1]C -> [{0,1,[1,30]},{1,2,[11,40]},{2,5,[21,50]},{5,10,[31,60]},{10,20,[41,60]},{30,20,[51,70]},{50,10,[61,80]},{70,5,[71,80]},{100,2,[81,90]},{150,1,[91,100]}]
A43: 40 | B43: 6 | C43: 1 | D43: 1000 | E43: =R[-9]C -> 31 | F43: =R[-9]C -> 40 | G43: 5 | H43: 20000 | I43: 110003 | J43: 5 | K43: =R[-1]C -> [{7,6},{8,4},{9,0},{10,0},{11,0},{12,0},{17,10},{18,8},{19,1},{23,4},{24,10}] | L43: =R[-1]C -> [{7,27},{8,55},{9,27},{10,55},{11,27},{12,55},{17,18},{18,110},{19,3},{23,37},{24,37}] | M43: =R[-1]C -> [{0,1,[1,30]},{1,2,[11,40]},{2,5,[21,50]},{5,10,[31,60]},{10,20,[41,60]},{30,20,[51,70]},{50,10,[61,80]},{70,5,[71,80]},{100,2,[81,90]},{150,1,[91,100]}]
A44: 41 | B44: 6 | C44: 1 | D44: 1000 | E44: =R[-9]C -> 41 | F44: =R[-9]C -> 50 | G44: 5 | H44: 20000 | I44: 110003 | J44: 5 | K44: =R[-1]C -> [{7,6},{8,4},{9,0},{10,0},{11,0},{12,0},{17,10},{18,8},{19,1},{23,4},{24,10}] | L44: =R[-1]C -> [{7,27},{8,55},{9,27},{10,55},{11,27},{12,55},{17,18},{18,110},{19,3},{23,37},{24,37}] | M44: =R[-1]C -> [{0,1,[1,30]},{1,2,[11,40]},{2,5,[21,50]},{5,10,[31,60]},{10,20,[41,60]},{30,20,[51,70]},{50,10,[61,80]},{70,5,[71,80]},{100,2,[81,90]},{150,1,[91,100]}]
A45: 42 | B45: 6 | C45: 1 | D45: 1000 | E45: =R[-9]C -> 51 | F45: =R[-9]C -> 60 | G45: 5 | H45: 20000 | I45: 110003 | J45: 5 | K45: =R[-1]C -> [{7,6},{8,4},{9,0},{10,0},{11,0},{12,0},{17,10},{18,8},{19,1},{23,4},{24,10}] | L45: =R[-1]C -> [{7,27},{8,55},{9,27},{10,55},{11,27},{12,55},{17,18},{18,110},{19,3},{23,37},{24,37}] | M45: =R[-1]C -> [{0,1,[1,30]},{1,2,[11,40]},{2,5,[21,50]},{5,10,[31,60]},{10,20,[41,60]},{30,20,[51,70]},{50,10,[61,80]},{70,5,[71,80]},{100,2,[81,90]},{150,1,[91,100]}]
A46: 43 | B46: 6 | C46: 1 | D46: 1000 | E46: =R[-9]C -> 61 | F46: =R[-9]C -> 70 | G46: 5 | H46: 20000 | I46: 110003 | J46: 5 | K46: =R[-1]C -> [{7,6},{8,4},{9,0},{10,0},{11,0},{12,0},{17,10},{18,8},{19,1},{23,4},{24,10}] | L46: =R[-1]C -> [{7,27},{8,55},{9,27},{10,55},{11,27},{12,55},{17,18},{18,110},{19,3},{23,37},{24,37}] | M46: =R[-1]C -> [{0,1,[1,30]},{1,2,[11,40]},{2,5,[21,50]},{5,10,[31,60]},{10,20,[41,60]},{30,20,[51,70]},{50,10,[61,80]},{70,5,[71,80]},{100,2,[81,90]},{150,1,[91,100]}]
A47: 44 | B47: 6 | C47: 1 | D47: 1000 | E47: =R[-9]C -> 71 | F47: =R[-9]C -> 80 | G47: 5 | H47: 20000 | I47: 110003 | J47: 5 | K47: =R[-1]C -> [{7,6},{8,4},{9,0},{10,0},{11,0},{12,0},{17,10},{18,8},{19,1},{23,4},{24,10}] | L47: =R[-1]C -> [{7,27},{8,55},{9,27},{10,55},{11,27},{12,55},{17,18},{18,110},{19,3},{23,37},{24,37}] | M47: =R[-1]C -> [{0,1,[1,30]},{1,2,[11,40]},{2,5,[21,50]},{5,10,[31,60]},{10,20,[41,60]},{30,20,[51,70]},{50,10,[61,80]},{70,5,[71,80]},{100,2,[81,90]},{150,1,[91,100]}]
A48: 45 | B48: 6 | C48: 1 | D48: 1000 | E48: =R[-9]C -> 81 | F48: =R[-9]C -> 90 | G48: 5 | H48: 20000 | I48: 110003 | J48: 5 | K48: =R[-1]C -> [{7,6},{8,4},{9,0},{10,0},{11,0},{12,0},{17,10},{18,8},{19,1},{23,4},{24,10}] | L48: =R[-1]C -> [{7,27},{8,55},{9,27},{10,55},{11,27},{12,55},{17,18},{18,110},{19,3},{23,37},{24,37}] | M48: =R[-1]C -> [{0,1,[1,30]},{1,2,[11,40]},{2,5,[21,50]},{5,10,[31,60]},{10,20,[41,60]},{30,20,[51,70]},{50,10,[61,80]},{70,5,[71,80]},{100,2,[81,90]},{150,1,[91,100]}]
A49: 46 | B49: 2 | C49: 4 | D49: 1000 | E49: =R[-18]C -> 1 | F49: =R[-18]C -> 10 | G49: 1 | H49: 5000 | I49: 110003 | J49: 1 | K49: =R[-1]C -> [{7,6},{8,4},{9,0},{10,0},{11,0},{12,0},{17,10},{18,8},{19,1},{23,4},{24,10}] | L49: =R[-1]C -> [{7,27},{8,55},{9,27},{10,55},{11,27},{12,55},{17,18},{18,110},{19,3},{23,37},{24,37}] | M49: =R[-1]C -> [{0,1,[1,30]},{1,2,[11,40]},{2,5,[21,50]},{5,10,[31,60]},{10,20,[41,60]},{30,20,[51,70]},{50,10,[61,80]},{70,5,[71,80]},{100,2,[81,90]},{150,1,[91,100]}]
A50: 47 | B50: 2 | C50: 4 | D50: 1000 | E50: =R[-18]C -> 11 | F50: =R[-18]C -> 20 | G50: 1 | H50: 5000 | I50: 110003 | J50: 1 | K50: =R[-1]C -> [{7,6},{8,4},{9,0},{10,0},{11,0},{12,0},{17,10},{18,8},{19,1},{23,4},{24,10}] | L50: =R[-1]C -> [{7,27},{8,55},{9,27},{10,55},{11,27},{12,55},{17,18},{18,110},{19,3},{23,37},{24,37}] | M50: =R[-1]C -> [{0,1,[1,30]},{1,2,[11,40]},{2,5,[21,50]},{5,10,[31,60]},{10,20,[41,60]},{30,20,[51,70]},{50,10,[61,80]},{70,5,[71,80]},{100,2,[81,90]},{150,1,[91,100]}]
A51: 48 | B51: 2 | C51: 4 | D51: 1000 | E51: =R[-18]C -> 21 | F51: =R[-18]C -> 30 | G51: 1 | H51: 5000 | I51: 110003 | J51: 1 | K51: =R[-1]C -> [{7,6},{8,4},{9,0},{10,0},{11,0},{12,0},{17,10},{18,8},{19,1},{23,4},{24,10}] | L51: =R[-1]C -> [{7,27},{8,55},{9,27},{10,55},{11,27},{12,55},{17,18},{18,110},{19,3},{23,37},{24,37}] | M51: =R[-1]C -> [{0,1,[1,30]},{1,2,[11,40]},{2,5,[21,50]},{5,10,[31,60]},{10,20,[41,60]},{30,20,[51,70]},{50,10,[61,80]},{70,5,[71,80]},{100,2,[81,90]},{150,1,[91,100]}]
A52: 49 | B52: 2 | C52: 4 | D52: 1000 | E52: =R[-18]C -> 31 | F52: =R[-18]C -> 40 | G52: 1 | H52: 5000 | I52: 110003 | J52: 1 | K52: =R[-1]C -> [{7,6},{8,4},{9,0},{10,0},{11,0},{12,0},{17,10},{18,8},{19,1},{23,4},{24,10}] | L52: =R[-1]C -> [{7,27},{8,55},{9,27},{10,55},{11,27},{12,55},{17,18},{18,110},{19,3},{23,37},{24,37}] | M52: =R[-1]C -> [{0,1,[1,30]},{1,2,[11,40]},{2,5,[21,50]},{5,10,[31,60]},{10,20,[41,60]},{30,20,[51,70]},{50,10,[61,80]},{70,5,[71,80]},{100,2,[81,90]},{150,1,[91,100]}]
A53: 50 | B53: 2 | C53: 4 | D53: 1000 | E53: =R[-18]C -> 41 | F53: =R[-18]C -> 50 | G53: 1 | H53: 5000 | I53: 110003 | J53: 1 | K53: =R[-1]C -> [{7,6},{8,4},{9,0},{10,0},{11,0},{12,0},{17,10},{18,8},{19,1},{23,4},{24,10}] | L53: =R[-1]C -> [{7,27},{8,55},{9,27},{10,55},{11,27},{12,55},{17,18},{18,110},{19,3},{23,37},{24,37}] | M53: =R[-1]C -> [{0,1,[1,30]},{1,2,[11,40]},{2,5,[21,50]},{5,10,[31,60]},{10,20,[41,60]},{30,20,[51,70]},{50,10,[61,80]},{70,5,[71,80]},{100,2,[81,90]},{150,1,[91,100]}]
A54: 51 | B54: 2 | C54: 4 | D54: 1000 | E54: =R[-18]C -> 51 | F54: =R[-18]C -> 60 | G54: 1 | H54: 5000 | I54: 110003 | J54: 1 | K54: =R[-1]C -> [{7,6},{8,4},{9,0},{10,0},{11,0},{12,0},{17,10},{18,8},{19,1},{23,4},{24,10}] | L54: =R[-1]C -> [{7,27},{8,55},{9,27},{10,55},{11,27},{12,55},{17,18},{18,110},{19,3},{23,37},{24,37}] | M54: =R[-1]C -> [{0,1,[1,30]},{1,2,[11,40]},{2,5,[21,50]},{5,10,[31,60]},{10,20,[41,60]},{30,20,[51,70]},{50,10,[61,80]},{70,5,[71,80]},{100,2,[81,90]},{150,1,[91,100]}]
A55: 52 | B55: 2 | C55: 4 | D55: 1000 | E55: =R[-18]C -> 61 | F55: =R[-18]C -> 70 | G55: 1 | H55: 5000 | I55: 110003 | J55: 1 | K55: =R[-1]C -> [{7,6},{8,4},{9,0},{10,0},{11,0},{12,0},{17,10},{18,8},{19,1},{23,4},{24,10}] | L55: =R[-1]C -> [{7,27},{8,55},{9,27},{10,55},{11,27},{12,55},{17,18},{18,110},{19,3},{23,37},{24,37}] | M55: =R[-1]C -> [{0,1,[1,30]},{1,2,[11,40]},{2,5,[21,50]},{5,10,[31,60]},{10,20,[41,60]},{30,20,[51,70]},{50,10,[61,80]},{70,5,[71,80]},{100,2,[81,90]},{150,1,[91,100]}]
A56: 53 | B56: 2 | C56: 4 | D56: 1000 | E56: =R[-18]C -> 71 | F56: =R[-18]C -> 80 | G56: 1 | H56: 5000 | I56: 110003 | J56: 1 | K56: =R[-1]C -> [{7,6},{8,4},{9,0},{10,0},{11,0},{12,0},{17,10},{18,8},{19,1},{23,4},{24,10}] | L56: =R[-1]C -> [{7,27},{8,55},{9,27},{10,55},{11,27},{12,55},{17,18},{18,110},{19,3},{23,37},{24,37}] | M56: =R[-1]C -> [{0,1,[1,30]},{1,2,[11,40]},{2,5,[21,50]},{5,10,[31,60]},{10,20,[41,60]},{30,20,[51,70]},{50,10,[61,80]},{70,5,[71,80]},{100,2,[81,90]},{150,1,[91,100]}]
A57: 54 | B57: 2 | C57: 4 | D57: 1000 | E57: =R[-18]C -> 81 | F57: =R[-18]C -> 90 | G57: 1 | H57: 5000 | I57: 110003 | J57: 1 | K57: =R[-1]C -> [{7,6},{8,4},{9,0},{10,0},{11,0},{12,0},{17,10},{18,8},{19,1},{23,4},{24,10}] | L57: =R[-1]C -> [{7,27},{8,55},{9,27},{10,55},{11,27},{12,55},{17,18},{18,110},{19,3},{23,37},{24,37}] | M57: =R[-1]C -> [{0,1,[1,30]},{1,2,[11,40]},{2,5,[21,50]},{5,10,[31,60]},{10,20,[41,60]},{30,20,[51,70]},{50,10,[61,80]},{70,5,[71,80]},{100,2,[81,90]},{150,1,[91,100]}]
A58: 55 | B58: 3 | C58: 4 | D58: 1000 | E58: =R[-9]C -> 1 | F58: =R[-9]C -> 10 | G58: 2 | H58: 10000 | I58: 110003 | J58: 2 | K58: =R[-1]C -> [{7,6},{8,4},{9,0},{10,0},{11,0},{12,0},{17,10},{18,8},{19,1},{23,4},{24,10}] | L58: =R[-1]C -> [{7,27},{8,55},{9,27},{10,55},{11,27},{12,55},{17,18},{18,110},{19,3},{23,37},{24,37}] | M58: =R[-1]C -> [{0,1,[1,30]},{1,2,[11,40]},{2,5,[21,50]},{5,10,[31,60]},{10,20,[41,60]},{30,20,[51,70]},{50,10,[61,80]},{70,5,[71,80]},{100,2,[81,90]},{150,1,[91,100]}]
A59: 56 | B59: 3 | C59: 4 | D59: 1000 | E59: =R[-9]C -> 11 | F59: =R[-9]C -> 20 | G59: 2 | H59: 10000 | I59: 110003 | J59: 2 | K59: =R[-1]C -> [{7,6},{8,4},{9,0},{10,0},{11,0},{12,0},{17,10},{18,8},{19,1},{23,4},{24,10}] | L59: =R[-1]C -> [{7,27},{8,55},{9,27},{10,55},{11,27},{12,55},{17,18},{18,110},{19,3},{23,37},{24,37}] | M59: =R[-1]C -> [{0,1,[1,30]},{1,2,[11,40]},{2,5,[21,50]},{5,10,[31,60]},{10,20,[41,60]},{30,20,[51,70]},{50,10,[61,80]},{70,5,[71,80]},{100,2,[81,90]},{150,1,[91,100]}]
A60: 57 | B60: 3 | C60: 4 | D60: 1000 | E60: =R[-9]C -> 21 | F60: =R[-9]C -> 30 | G60: 2 | H60: 10000 | I60: 110003 | J60: 2 | K60: =R[-1]C -> [{7,6},{8,4},{9,0},{10,0},{11,0},{12,0},{17,10},{18,8},{19,1},{23,4},{24,10}] | L60: =R[-1]C -> [{7,27},{8,55},{9,27},{10,55},{11,27},{12,55},{17,18},{18,110},{19,3},{23,37},{24,37}] | M60: =R[-1]C -> [{0,1,[1,30]},{1,2,[11,40]},{2,5,[21,50]},{5,10,[31,60]},{10,20,[41,60]},{30,20,[51,70]},{50,10,[61,80]},{70,5,[71,80]},{100,2,[81,90]},{150,1,[91,100]}]
A61: 58 | B61: 3 | C61: 4 | D61: 1000 | E61: =R[-9]C -> 31 | F61: =R[-9]C -> 40 | G61: 2 | H61: 10000 | I61: 110003 | J61: 2 | K61: =R[-1]C -> [{7,6},{8,4},{9,0},{10,0},{11,0},{12,0},{17,10},{18,8},{19,1},{23,4},{24,10}] | L61: =R[-1]C -> [{7,27},{8,55},{9,27},{10,55},{11,27},{12,55},{17,18},{18,110},{19,3},{23,37},{24,37}] | M61: =R[-1]C -> [{0,1,[1,30]},{1,2,[11,40]},{2,5,[21,50]},{5,10,[31,60]},{10,20,[41,60]},{30,20,[51,70]},{50,10,[61,80]},{70,5,[71,80]},{100,2,[81,90]},{150,1,[91,100]}]
A62: 59 | B62: 3 | C62: 4 | D62: 1000 | E62: =R[-9]C -> 41 | F62: =R[-9]C -> 50 | G62: 2 | H62: 10000 | I62: 110003 | J62: 2 | K62: =R[-1]C -> [{7,6},{8,4},{9,0},{10,0},{11,0},{12,0},{17,10},{18,8},{19,1},{23,4},{24,10}] | L62: =R[-1]C -> [{7,27},{8,55},{9,27},{10,55},{11,27},{12,55},{17,18},{18,110},{19,3},{23,37},{24,37}] | M62: =R[-1]C -> [{0,1,[1,30]},{1,2,[11,40]},{2,5,[21,50]},{5,10,[31,60]},{10,20,[41,60]},{30,20,[51,70]},{50,10,[61,80]},{70,5,[71,80]},{100,2,[81,90]},{150,1,[91,100]}]
A63: 60 | B63: 3 | C63: 4 | D63: 1000 | E63: =R[-9]C -> 51 | F63: =R[-9]C -> 60 | G63: 2 | H63: 10000 | I63: 110003 | J63: 2 | K63: =R[-1]C -> [{7,6},{8,4},{9,0},{10,0},{11,0},{12,0},{17,10},{18,8},{19,1},{23,4},{24,10}] | L63: =R[-1]C -> [{7,27},{8,55},{9,27},{10,55},{11,27},{12,55},{17,18},{18,110},{19,3},{23,37},{24,37}] | M63: =R[-1]C -> [{0,1,[1,30]},{1,2,[11,40]},{2,5,[21,50]},{5,10,[31,60]},{10,20,[41,60]},{30,20,[51,70]},{50,10,[61,80]},{70,5,[71,80]},{100,2,[81,90]},{150,1,[91,100]}]
A64: 61 | B64: 3 | C64: 4 | D64: 1000 | E64: =R[-9]C -> 61 | F64: =R[-9]C -> 70 | G64: 2 | H64: 10000 | I64: 110003 | J64: 2 | K64: =R[-1]C -> [{7,6},{8,4},{9,0},{10,0},{11,0},{12,0},{17,10},{18,8},{19,1},{23,4},{24,10}] | L64: =R[-1]C -> [{7,27},{8,55},{9,27},{10,55},{11,27},{12,55},{17,18},{18,110},{19,3},{23,37},{24,37}] | M64: =R[-1]C -> [{0,1,[1,30]},{1,2,[11,40]},{2,5,[21,50]},{5,10,[31,60]},{10,20,[41,60]},{30,20,[51,70]},{50,10,[61,80]},{70,5,[71,80]},{100,2,[81,90]},{150,1,[91,100]}]
A65: 62 | B65: 3 | C65: 4 | D65: 1000 | E65: =R[-9]C -> 71 | F65: =R[-9]C -> 80 | G65: 2 | H65: 10000 | I65: 110003 | J65: 2 | K65: =R[-1]C -> [{7,6},{8,4},{9,0},{10,0},{11,0},{12,0},{17,10},{18,8},{19,1},{23,4},{24,10}] | L65: =R[-1]C -> [{7,27},{8,55},{9,27},{10,55},{11,27},{12,55},{17,18},{18,110},{19,3},{23,37},{24,37}] | M65: =R[-1]C -> [{0,1,[1,30]},{1,2,[11,40]},{2,5,[21,50]},{5,10,[31,60]},{10,20,[41,60]},{30,20,[51,70]},{50,10,[61,80]},{70,5,[71,80]},{100,2,[81,90]},{150,1,[91,100]}]
A66: 63 | B66: 3 | C66: 4 | D66: 1000 | E66: =R[-9]C -> 81 | F66: =R[-9]C -> 90 | G66: 2 | H66: 10000 | I66: 110003 | J66: 2 | K66: =R[-1]C -> [{7,6},{8,4},{9,0},{10,0},{11,0},{12,0},{17,10},{18,8},{19,1},{23,4},{24,10}] | L66: =R[-1]C -> [{7,27},{8,55},{9,27},{10,55},{11,27},{12,55},{17,18},{18,110},{19,3},{23,37},{24,37}] | M66: =R[-1]C -> [{0,1,[1,30]},{1,2,[11,40]},{2,5,[21,50]},{5,10,[31,60]},{10,20,[41,60]},{30,20,[51,70]},{50,10,[61,80]},{70,5,[71,80]},{100,2,[81,90]},{150,1,[91,100]}]
A67: 64 | B67: 4 | C67: 4 | D67: 1000 | E67: =R[-9]C -> 1 | F67: =R[-9]C -> 10 | G67: 3 | H67: 15000 | I67: 110003 | J67: 3 | K67: =R[-1]C -> [{7,6},{8,4},{9,0},{10,0},{11,0},{12,0},{17,10},{18,8},{19,1},{23,4},{24,10}] | L67: =R[-1]C -> [{7,27},{8,55},{9,27},{10,55},{11,27},{12,55},{17,18},{18,110},{19,3},{23,37},{24,37}] | M67: =R[-1]C -> [{0,1,[1,30]},{1,2,[11,40]},{2,5,[21,50]},{5,10,[31,60]},{10,20,[41,60]},{30,20,[51,70]},{50,10,[61,80]},{70,5,[71,80]},{100,2,[81,90]},{150,1,[91,100]}]
A68: 65 | B68: 4 | C68: 4 | D68: 1000 | E68: =R[-9]C -> 11 | F68: =R[-9]C -> 20 | G68: 3 | H68: 15000 | I68: 110003 | J68: 3 | K68: =R[-1]C -> [{7,6},{8,4},{9,0},{10,0},{11,0},{12,0},{17,10},{18,8},{19,1},{23,4},{24,10}] | L68: =R[-1]C -> [{7,27},{8,55},{9,27},{10,55},{11,27},{12,55},{17,18},{18,110},{19,3},{23,37},{24,37}] | M68: =R[-1]C -> [{0,1,[1,30]},{1,2,[11,40]},{2,5,[21,50]},{5,10,[31,60]},{10,20,[41,60]},{30,20,[51,70]},{50,10,[61,80]},{70,5,[71,80]},{100,2,[81,90]},{150,1,[91,100]}]
A69: 66 | B69: 4 | C69: 4 | D69: 1000 | E69: =R[-9]C -> 21 | F69: =R[-9]C -> 30 | G69: 3 | H69: 15000 | I69: 110003 | J69: 3 | K69: =R[-1]C -> [{7,6},{8,4},{9,0},{10,0},{11,0},{12,0},{17,10},{18,8},{19,1},{23,4},{24,10}] | L69: =R[-1]C -> [{7,27},{8,55},{9,27},{10,55},{11,27},{12,55},{17,18},{18,110},{19,3},{23,37},{24,37}] | M69: =R[-1]C -> [{0,1,[1,30]},{1,2,[11,40]},{2,5,[21,50]},{5,10,[31,60]},{10,20,[41,60]},{30,20,[51,70]},{50,10,[61,80]},{70,5,[71,80]},{100,2,[81,90]},{150,1,[91,100]}]
A70: 67 | B70: 4 | C70: 4 | D70: 1000 | E70: =R[-9]C -> 31 | F70: =R[-9]C -> 40 | G70: 3 | H70: 15000 | I70: 110003 | J70: 3 | K70: =R[-1]C -> [{7,6},{8,4},{9,0},{10,0},{11,0},{12,0},{17,10},{18,8},{19,1},{23,4},{24,10}] | L70: =R[-1]C -> [{7,27},{8,55},{9,27},{10,55},{11,27},{12,55},{17,18},{18,110},{19,3},{23,37},{24,37}] | M70: =R[-1]C -> [{0,1,[1,30]},{1,2,[11,40]},{2,5,[21,50]},{5,10,[31,60]},{10,20,[41,60]},{30,20,[51,70]},{50,10,[61,80]},{70,5,[71,80]},{100,2,[81,90]},{150,1,[91,100]}]
A71: 68 | B71: 4 | C71: 4 | D71: 1000 | E71: =R[-9]C -> 41 | F71: =R[-9]C -> 50 | G71: 3 | H71: 15000 | I71: 110003 | J71: 3 | K71: =R[-1]C -> [{7,6},{8,4},{9,0},{10,0},{11,0},{12,0},{17,10},{18,8},{19,1},{23,4},{24,10}] | L71: =R[-1]C -> [{7,27},{8,55},{9,27},{10,55},{11,27},{12,55},{17,18},{18,110},{19,3},{23,37},{24,37}] | M71: =R[-1]C -> [{0,1,[1,30]},{1,2,[11,40]},{2,5,[21,50]},{5,10,[31,60]},{10,20,[41,60]},{30,20,[51,70]},{50,10,[61,80]},{70,5,[71,80]},{100,2,[81,90]},{150,1,[91,100]}]
A72: 69 | B72: 4 | C72: 4 | D72: 1000 | E72: =R[-9]C -> 51 | F72: =R[-9]C -> 60 | G72: 3 | H72: 15000 | I72: 110003 | J72: 3 | K72: =R[-1]C -> [{7,6},{8,4},{9,0},{10,0},{11,0},{12,0},{17,10},{18,8},{19,1},{23,4},{24,10}] | L72: =R[-1]C -> [{7,27},{8,55},{9,27},{10,55},{11,27},{12,55},{17,18},{18,110},{19,3},{23,37},{24,37}] | M72: =R[-1]C -> [{0,1,[1,30]},{1,2,[11,40]},{2,5,[21,50]},{5,10,[31,60]},{10,20,[41,60]},{30,20,[51,70]},{50,10,[61,80]},{70,5,[71,80]},{100,2,[81,90]},{150,1,[91,100]}]
A73: 70 | B73: 4 | C73: 4 | D73: 1000 | E73: =R[-9]C -> 61 | F73: =R[-9]C -> 70 | G73: 3 | H73: 15000 | I73: 110003 | J73: 3 | K73: =R[-1]C -> [{7,6},{8,4},{9,0},{10,0},{11,0},{12,0},{17,10},{18,8},{19,1},{23,4},{24,10}] | L73: =R[-1]C -> [{7,27},{8,55},{9,27},{10,55},{11,27},{12,55},{17,18},{18,110},{19,3},{23,37},{24,37}] | M73: =R[-1]C -> [{0,1,[1,30]},{1,2,[11,40]},{2,5,[21,50]},{5,10,[31,60]},{10,20,[41,60]},{30,20,[51,70]},{50,10,[61,80]},{70,5,[71,80]},{100,2,[81,90]},{150,1,[91,100]}]
A74: 71 | B74: 4 | C74: 4 | D74: 1000 | E74: =R[-9]C -> 71 | F74: =R[-9]C -> 80 | G74: 3 | H74: 15000 | I74: 110003 | J74: 3 | K74: =R[-1]C -> [{7,6},{8,4},{9,0},{10,0},{11,0},{12,0},{17,10},{18,8},{19,1},{23,4},{24,10}] | L74: =R[-1]C -> [{7,27},{8,55},{9,27},{10,55},{11,27},{12,55},{17,18},{18,110},{19,3},{23,37},{24,37}] | M74: =R[-1]C -> [{0,1,[1,30]},{1,2,[11,40]},{2,5,[21,50]},{5,10,[31,60]},{10,20,[41,60]},{30,20,[51,70]},{50,10,[61,80]},{70,5,[71,80]},{100,2,[81,90]},{150,1,[91,100]}]
A75: 72 | B75: 4 | C75: 4 | D75: 1000 | E75: =R[-9]C -> 81 | F75: =R[-9]C -> 90 | G75: 3 | H75: 15000 | I75: 110003 | J75: 3 | K75: =R[-1]C -> [{7,6},{8,4},{9,0},{10,0},{11,0},{12,0},{17,10},{18,8},{19,1},{23,4},{24,10}] | L75: =R[-1]C -> [{7,27},{8,55},{9,27},{10,55},{11,27},{12,55},{17,18},{18,110},{19,3},{23,37},{24,37}] | M75: =R[-1]C -> [{0,1,[1,30]},{1,2,[11,40]},{2,5,[21,50]},{5,10,[31,60]},{10,20,[41,60]},{30,20,[51,70]},{50,10,[61,80]},{70,5,[71,80]},{100,2,[81,90]},{150,1,[91,100]}]
A76: 73 | B76: 5 | C76: 4 | D76: 1000 | E76: =R[-9]C -> 1 | F76: =R[-9]C -> 10 | G76: 4 | H76: 20000 | I76: 110003 | J76: 4 | K76: =R[-1]C -> [{7,6},{8,4},{9,0},{10,0},{11,0},{12,0},{17,10},{18,8},{19,1},{23,4},{24,10}] | L76: =R[-1]C -> [{7,27},{8,55},{9,27},{10,55},{11,27},{12,55},{17,18},{18,110},{19,3},{23,37},{24,37}] | M76: =R[-1]C -> [{0,1,[1,30]},{1,2,[11,40]},{2,5,[21,50]},{5,10,[31,60]},{10,20,[41,60]},{30,20,[51,70]},{50,10,[61,80]},{70,5,[71,80]},{100,2,[81,90]},{150,1,[91,100]}]
A77: 74 | B77: 5 | C77: 4 | D77: 1000 | E77: =R[-9]C -> 11 | F77: =R[-9]C -> 20 | G77: 4 | H77: 20000 | I77: 110003 | J77: 4 | K77: =R[-1]C -> [{7,6},{8,4},{9,0},{10,0},{11,0},{12,0},{17,10},{18,8},{19,1},{23,4},{24,10}] | L77: =R[-1]C -> [{7,27},{8,55},{9,27},{10,55},{11,27},{12,55},{17,18},{18,110},{19,3},{23,37},{24,37}] | M77: =R[-1]C -> [{0,1,[1,30]},{1,2,[11,40]},{2,5,[21,50]},{5,10,[31,60]},{10,20,[41,60]},{30,20,[51,70]},{50,10,[61,80]},{70,5,[71,80]},{100,2,[81,90]},{150,1,[91,100]}]
A78: 75 | B78: 5 | C78: 4 | D78: 1000 | E78: =R[-9]C -> 21 | F78: =R[-9]C -> 30 | G78: 4 | H78: 20000 | I78: 110003 | J78: 4 | K78: =R[-1]C -> [{7,6},{8,4},{9,0},{10,0},{11,0},{12,0},{17,10},{18,8},{19,1},{23,4},{24,10}] | L78: =R[-1]C -> [{7,27},{8,55},{9,27},{10,55},{11,27},{12,55},{17,18},{18,110},{19,3},{23,37},{24,37}] | M78: =R[-1]C -> [{0,1,[1,30]},{1,2,[11,40]},{2,5,[21,50]},{5,10,[31,60]},{10,20,[41,60]},{30,20,[51,70]},{50,10,[61,80]},{70,5,[71,80]},{100,2,[81,90]},{150,1,[91,100]}]
A79: 76 | B79: 5 | C79: 4 | D79: 1000 | E79: =R[-9]C -> 31 | F79: =R[-9]C -> 40 | G79: 4 | H79: 20000 | I79: 110003 | J79: 4 | K79: =R[-1]C -> [{7,6},{8,4},{9,0},{10,0},{11,0},{12,0},{17,10},{18,8},{19,1},{23,4},{24,10}] | L79: =R[-1]C -> [{7,27},{8,55},{9,27},{10,55},{11,27},{12,55},{17,18},{18,110},{19,3},{23,37},{24,37}] | M79: =R[-1]C -> [{0,1,[1,30]},{1,2,[11,40]},{2,5,[21,50]},{5,10,[31,60]},{10,20,[41,60]},{30,20,[51,70]},{50,10,[61,80]},{70,5,[71,80]},{100,2,[81,90]},{150,1,[91,100]}]
A80: 77 | B80: 5 | C80: 4 | D80: 1000 | E80: =R[-9]C -> 41 | F80: =R[-9]C -> 50 | G80: 4 | H80: 20000 | I80: 110003 | J80: 4 | K80: =R[-1]C -> [{7,6},{8,4},{9,0},{10,0},{11,0},{12,0},{17,10},{18,8},{19,1},{23,4},{24,10}] | L80: =R[-1]C -> [{7,27},{8,55},{9,27},{10,55},{11,27},{12,55},{17,18},{18,110},{19,3},{23,37},{24,37}] | M80: =R[-1]C -> [{0,1,[1,30]},{1,2,[11,40]},{2,5,[21,50]},{5,10,[31,60]},{10,20,[41,60]},{30,20,[51,70]},{50,10,[61,80]},{70,5,[71,80]},{100,2,[81,90]},{150,1,[91,100]}]
A81: 78 | B81: 5 | C81: 4 | D81: 1000 | E81: =R[-9]C -> 51 | F81: =R[-9]C -> 60 | G81: 4 | H81: 20000 | I81: 110003 | J81: 4 | K81: =R[-1]C -> [{7,6},{8,4},{9,0},{10,0},{11,0},{12,0},{17,10},{18,8},{19,1},{23,4},{24,10}] | L81: =R[-1]C -> [{7,27},{8,55},{9,27},{10,55},{11,27},{12,55},{17,18},{18,110},{19,3},{23,37},{24,37}] | M81: =R[-1]C -> [{0,1,[1,30]},{1,2,[11,40]},{2,5,[21,50]},{5,10,[31,60]},{10,20,[41,60]},{30,20,[51,70]},{50,10,[61,80]},{70,5,[71,80]},{100,2,[81,90]},{150,1,[91,100]}]
A82: 79 | B82: 5 | C82: 4 | D82: 1000 | E82: =R[-9]C -> 61 | F82: =R[-9]C -> 70 | G82: 4 | H82: 20000 | I82: 110003 | J82: 4 | K82: =R[-1]C -> [{7,6},{8,4},{9,0},{10,0},{11,0},{12,0},{17,10},{18,8},{19,1},{23,4},{24,10}] | L82: =R[-1]C -> [{7,27},{8,55},{9,27},{10,55},{11,27},{12,55},{17,18},{18,110},{19,3},{23,37},{24,37}] | M82: =R[-1]C -> [{0,1,[1,30]},{1,2,[11,40]},{2,5,[21,50]},{5,10,[31,60]},{10,20,[41,60]},{30,20,[51,70]},{50,10,[61,80]},{70,5,[71,80]},{100,2,[81,90]},{150,1,[91,100]}]
A83: 80 | B83: 5 | C83: 4 | D83: 1000 | E83: =R[-9]C -> 71 | F83: =R[-9]C -> 80 | G83: 4 | H83: 20000 | I83: 110003 | J83: 4 | K83: =R[-1]C -> [{7,6},{8,4},{9,0},{10,0},{11,0},{12,0},{17,10},{18,8},{19,1},{23,4},{24,10}] | L83: =R[-1]C -> [{7,27},{8,55},{9,27},{10,55},{11,27},{12,55},{17,18},{18,110},{19,3},{23,37},{24,37}] | M83: =R[-1]C -> [{0,1,[1,30]},{1,2,[11,40]},{2,5,[21,50]},{5,10,[31,60]},{10,20,[41,60]},{30,20,[51,70]},{50,10,[61,80]},{70,5,[71,80]},{100,2,[81,90]},{150,1,[91,100]}]
A84: 81 | B84: 5 | C84: 4 | D84: 1000 | E84: =R[-9]C -> 81 | F84: =R[-9]C -> 90 | G84: 4 | H84: 20000 | I84: 110003 | J84: 4 | K84: =R[-1]C -> [{7,6},{8,4},{9,0},{10,0},{11,0},{12,0},{17,10},{18,8},{19,1},{23,4},{24,10}] | L84: =R[-1]C -> [{7,27},{8,55},{9,27},{10,55},{11,27},{12,55},{17,18},{18,110},{19,3},{23,37},{24,37}] | M84: =R[-1]C -> [{0,1,[1,30]},{1,2,[11,40]},{2,5,[21,50]},{5,10,[31,60]},{10,20,[41,60]},{30,20,[51,70]},{50,10,[61,80]},{70,5,[71,80]},{100,2,[81,90]},{150,1,[91,100]}]
A85: 82 | B85: 6 | C85: 4 | D85: 1000 | E85: =R[-9]C -> 1 | F85: =R[-9]C -> 10 | G85: 5 | H85: 20000 | I85: 110003 | J85: 5 | K85: =R[-1]C -> [{7,6},{8,4},{9,0},{10,0},{11,0},{12,0},{17,10},{18,8},{19,1},{23,4},{24,10}] | L85: =R[-1]C -> [{7,27},{8,55},{9,27},{10,55},{11,27},{12,55},{17,18},{18,110},{19,3},{23,37},{24,37}] | M85: =R[-1]C -> [{0,1,[1,30]},{1,2,[11,40]},{2,5,[21,50]},{5,10,[31,60]},{10,20,[41,60]},{30,20,[51,70]},{50,10,[61,80]},{70,5,[71,80]},{100,2,[81,90]},{150,1,[91,100]}]
A86: 83 | B86: 6 | C86: 4 | D86: 1000 | E86: =R[-9]C -> 11 | F86: =R[-9]C -> 20 | G86: 5 | H86: 20000 | I86: 110003 | J86: 5 | K86: =R[-1]C -> [{7,6},{8,4},{9,0},{10,0},{11,0},{12,0},{17,10},{18,8},{19,1},{23,4},{24,10}] | L86: =R[-1]C -> [{7,27},{8,55},{9,27},{10,55},{11,27},{12,55},{17,18},{18,110},{19,3},{23,37},{24,37}] | M86: =R[-1]C -> [{0,1,[1,30]},{1,2,[11,40]},{2,5,[21,50]},{5,10,[31,60]},{10,20,[41,60]},{30,20,[51,70]},{50,10,[61,80]},{70,5,[71,80]},{100,2,[81,90]},{150,1,[91,100]}]
A87: 84 | B87: 6 | C87: 4 | D87: 1000 | E87: =R[-9]C -> 21 | F87: =R[-9]C -> 30 | G87: 5 | H87: 20000 | I87: 110003 | J87: 5 | K87: =R[-1]C -> [{7,6},{8,4},{9,0},{10,0},{11,0},{12,0},{17,10},{18,8},{19,1},{23,4},{24,10}] | L87: =R[-1]C -> [{7,27},{8,55},{9,27},{10,55},{11,27},{12,55},{17,18},{18,110},{19,3},{23,37},{24,37}] | M87: =R[-1]C -> [{0,1,[1,30]},{1,2,[11,40]},{2,5,[21,50]},{5,10,[31,60]},{10,20,[41,60]},{30,20,[51,70]},{50,10,[61,80]},{70,5,[71,80]},{100,2,[81,90]},{150,1,[91,100]}]
A88: 85 | B88: 6 | C88: 4 | D88: 1000 | E88: =R[-9]C -> 31 | F88: =R[-9]C -> 40 | G88: 5 | H88: 20000 | I88: 110003 | J88: 5 | K88: =R[-1]C -> [{7,6},{8,4},{9,0},{10,0},{11,0},{12,0},{17,10},{18,8},{19,1},{23,4},{24,10}] | L88: =R[-1]C -> [{7,27},{8,55},{9,27},{10,55},{11,27},{12,55},{17,18},{18,110},{19,3},{23,37},{24,37}] | M88: =R[-1]C -> [{0,1,[1,30]},{1,2,[11,40]},{2,5,[21,50]},{5,10,[31,60]},{10,20,[41,60]},{30,20,[51,70]},{50,10,[61,80]},{70,5,[71,80]},{100,2,[81,90]},{150,1,[91,100]}]
A89: 86 | B89: 6 | C89: 4 | D89: 1000 | E89: =R[-9]C -> 41 | F89: =R[-9]C -> 50 | G89: 5 | H89: 20000 | I89: 110003 | J89: 5 | K89: =R[-1]C -> [{7,6},{8,4},{9,0},{10,0},{11,0},{12,0},{17,10},{18,8},{19,1},{23,4},{24,10}] | L89: =R[-1]C -> [{7,27},{8,55},{9,27},{10,55},{11,27},{12,55},{17,18},{18,110},{19,3},{23,37},{24,37}] | M89: =R[-1]C -> [{0,1,[1,30]},{1,2,[11,40]},{2,5,[21,50]},{5,10,[31,60]},{10,20,[41,60]},{30,20,[51,70]},{50,10,[61,80]},{70,5,[71,80]},{100,2,[81,90]},{150,1,[91,100]}]
A90: 87 | B90: 6 | C90: 4 | D90: 1000 | E90: =R[-9]C -> 51 | F90: =R[-9]C -> 60 | G90: 5 | H90: 20000 | I90: 110003 | J90: 5 | K90: =R[-1]C -> [{7,6},{8,4},{9,0},{10,0},{11,0},{12,0},{17,10},{18,8},{19,1},{23,4},{24,10}] | L90: =R[-1]C -> [{7,27},{8,55},{9,27},{10,55},{11,27},{12,55},{17,18},{18,110},{19,3},{23,37},{24,37}] | M90: =R[-1]C -> [{0,1,[1,30]},{1,2,[11,40]},{2,5,[21,50]},{5,10,[31,60]},{10,20,[41,60]},{30,20,[51,70]},{50,10,[61,80]},{70,5,[71,80]},{100,2,[81,90]},{150,1,[91,100]}]
A91: 88 | B91: 6 | C91: 4 | D91: 1000 | E91: =R[-9]C -> 61 | F91: =R[-9]C -> 70 | G91: 5 | H91: 20000 | I91: 110003 | J91: 5 | K91: =R[-1]C -> [{7,6},{8,4},{9,0},{10,0},{11,0},{12,0},{17,10},{18,8},{19,1},{23,4},{24,10}] | L91: =R[-1]C -> [{7,27},{8,55},{9,27},{10,55},{11,27},{12,55},{17,18},{18,110},{19,3},{23,37},{24,37}] | M91: =R[-1]C -> [{0,1,[1,30]},{1,2,[11,40]},{2,5,[21,50]},{5,10,[31,60]},{10,20,[41,60]},{30,20,[51,70]},{50,10,[61,80]},{70,5,[71,80]},{100,2,[81,90]},{150,1,[91,100]}]
A92: 89 | B92: 6 | C92: 4 | D92: 1000 | E92: =R[-9]C -> 71 | F92: =R[-9]C -> 80 | G92: 5 | H92: 20000 | I92: 110003 | J92: 5 | K92: =R[-1]C -> [{7,6},{8,4},{9,0},{10,0},{11,0},{12,0},{17,10},{18,8},{19,1},{23,4},{24,10}] | L92: =R[-1]C -> [{7,27},{8,55},{9,27},{10,55},{11,27},{12,55},{17,18},{18,110},{19,3},{23,37},{24,37}] | M92: =R[-1]C -> [{0,1,[1,30]},{1,2,[11,40]},{2,5,[21,50]},{5,10,[31,60]},{10,20,[41,60]},{30,20,[51,70]},{50,10,[61,80]},{70,5,[71,80]},{100,2,[81,90]},{150,1,[91,100]}]
A93: 90 | B93: 6 | C93: 4 | D93: 1000 | E93: =R[-9]C -> 81 | F93: =R[-9]C -> 90 | G93: 5 | H93: 20000 | I93: 110003 | J93: 5 | K93: =R[-1]C -> [{7,6},{8,4},{9,0},{10,0},{11,0},{12,0},{17,10},{18,8},{19,1},{23,4},{24,10}] | L93: =R[-1]C -> [{7,27},{8,55},{9,27},{10,55},{11,27},{12,55},{17,18},{18,110},{19,3},{23,37},{24,37}] | M93: =R[-1]C -> [{0,1,[1,30]},{1,2,[11,40]},{2,5,[21,50]},{5,10,[31,60]},{10,20,[41,60]},{30,20,[51,70]},{50,10,[61,80]},{70,5,[71,80]},{100,2,[81,90]},{150,1,[91,100]}]
A94: 91 | B94: 2 | C94: 6 | D94: 1000 | E94: =R[-18]C -> 1 | F94: =R[-18]C -> 10 | G94: 1 | H94: 5000 | I94: 110003 | J94: 1 | K94: =R[-1]C -> [{7,6},{8,4},{9,0},{10,0},{11,0},{12,0},{17,10},{18,8},{19,1},{23,4},{24,10}] | L94: =R[-1]C -> [{7,27},{8,55},{9,27},{10,55},{11,27},{12,55},{17,18},{18,110},{19,3},{23,37},{24,37}] | M94: =R[-1]C -> [{0,1,[1,30]},{1,2,[11,40]},{2,5,[21,50]},{5,10,[31,60]},{10,20,[41,60]},{30,20,[51,70]},{50,10,[61,80]},{70,5,[71,80]},{100,2,[81,90]},{150,1,[91,100]}]
A95: 92 | B95: 2 | C95: 6 | D95: 1000 | E95: =R[-18]C -> 11 | F95: =R[-18]C -> 20 | G95: 1 | H95: 5000 | I95: 110003 | J95: 1 | K95: =R[-1]C -> [{7,6},{8,4},{9,0},{10,0},{11,0},{12,0},{17,10},{18,8},{19,1},{23,4},{24,10}] | L95: =R[-1]C -> [{7,27},{8,55},{9,27},{10,55},{11,27},{12,55},{17,18},{18,110},{19,3},{23,37},{24,37}] | M95: =R[-1]C -> [{0,1,[1,30]},{1,2,[11,40]},{2,5,[21,50]},{5,10,[31,60]},{10,20,[41,60]},{30,20,[51,70]},{50,10,[61,80]},{70,5,[71,80]},{100,2,[81,90]},{150,1,[91,100]}]
A96: 93 | B96: 2 | C96: 6 | D96: 1000 | E96: =R[-18]C -> 21 | F96: =R[-18]C -> 30 | G96: 1 | H96: 5000 | I96: 110003 | J96: 1 | K96: =R[-1]C -> [{7,6},{8,4},{9,0},{10,0},{11,0},{12,0},{17,10},{18,8},{19,1},{23,4},{24,10}] | L96: =R[-1]C -> [{7,27},{8,55},{9,27},{10,55},{11,27},{12,55},{17,18},{18,110},{19,3},{23,37},{24,37}] | M96: =R[-1]C -> [{0,1,[1,30]},{1,2,[11,40]},{2,5,[21,50]},{5,10,[31,60]},{10,20,[41,60]},{30,20,[51,70]},{50,10,[61,80]},{70,5,[71,80]},{100,2,[81,90]},{150,1,[91,100]}]
A97: 94 | B97: 2 | C97: 6 | D97: 1000 | E97: =R[-18]C -> 31 | F97: =R[-18]C -> 40 | G97: 1 | H97: 5000 | I97: 110003 | J97: 1 | K97: =R[-1]C -> [{7,6},{8,4},{9,0},{10,0},{11,0},{12,0},{17,10},{18,8},{19,1},{23,4},{24,10}] | L97: =R[-1]C -> [{7,27},{8,55},{9,27},{10,55},{11,27},{12,55},{17,18},{18,110},{19,3},{23,37},{24,37}] | M97: =R[-1]C -> [{0,1,[1,30]},{1,2,[11,40]},{2,5,[21,50]},{5,10,[31,60]},{10,20,[41,60]},{30,20,[51,70]},{50,10,[61,80]},{70,5,[71,80]},{100,2,[81,90]},{150,1,[91,100]}]
A98: 95 | B98: 2 | C98: 6 | D98: 1000 | E98: =R[-18]C -> 41 | F98: =R[-18]C -> 50 | G98: 1 | H98: 5000 | I98: 110003 | J98: 1 | K98: =R[-1]C -> [{7,6},{8,4},{9,0},{10,0},{11,0},{12,0},{17,10},{18,8},{19,1},{23,4},{24,10}] | L98: =R[-1]C -> [{7,27},{8,55},{9,27},{10,55},{11,27},{12,55},{17,18},{18,110},{19,3},{23,37},{24,37}] | M98: =R[-1]C -> [{0,1,[1,30]},{1,2,[11,40]},{2,5,[21,50]},{5,10,[31,60]},{10,20,[41,60]},{30,20,[51,70]},{50,10,[61,80]},{70,5,[71,80]},{100,2,[81,90]},{150,1,[91,100]}]
A99: 96 | B99: 2 | C99: 6 | D99: 1000 | E99: =R[-18]C -> 51 | F99: =R[-18]C -> 60 | G99: 1 | H99: 5000 | I99: 110003 | J99: 1 | K99: =R[-1]C -> [{7,6},{8,4},{9,0},{10,0},{11,0},{12,0},{17,10},{18,8},{19,1},{23,4},{24,10}] | L99: =R[-1]C -> [{7,27},{8,55},{9,27},{10,55},{11,27},{12,55},{17,18},{18,110},{19,3},{23,37},{24,37}] | M99: =R[-1]C -> [{0,1,[1,30]},{1,2,[11,40]},{2,5,[21,50]},{5,10,[31,60]},{10,20,[41,60]},{30,20,[51,70]},{50,10,[61,80]},{70,5,[71,80]},{100,2,[81,90]},{150,1,[91,100]}]
A100: 97 | B100: 2 | C100: 6 | D100: 1000 | E100: =R[-18]C -> 61 | F100: =R[-18]C -> 70 | G100: 1 | H100: 5000 | I100: 110003 | J100: 1 | K100: =R[-1]C -> [{7,6},{8,4},{9,0},{10,0},{11,0},{12,0},{17,10},{18,8},{19,1},{23,4},{24,10}] | L100: =R[-1]C -> [{7,27},{8,55},{9,27},{10,55},{11,27},{12,55},{17,18},{18,110},{19,3},{23,37},{24,37}] | M100: =R[-1]C -> [{0,1,[1,30]},{1,2,[11,40]},{2,5,[21,50]},{5,10,[31,60]},{10,20,[41,60]},{30,20,[51,70]},{50,10,[61,80]},{70,5,[71,80]},{100,2,[81,90]},{150,1,[91,100]}]
A101: 98 | B101: 2 | C101: 6 | D101: 1000 | E101: =R[-18]C -> 71 | F101: =R[-18]C -> 80 | G101: 1 | H101: 5000 | I101: 110003 | J101: 1 | K101: =R[-1]C -> [{7,6},{8,4},{9,0},{10,0},{11,0},{12,0},{17,10},{18,8},{19,1},{23,4},{24,10}] | L101: =R[-1]C -> [{7,27},{8,55},{9,27},{10,55},{11,27},{12,55},{17,18},{18,110},{19,3},{23,37},{24,37}] | M101: =R[-1]C -> [{0,1,[1,30]},{1,2,[11,40]},{2,5,[21,50]},{5,10,[31,60]},{10,20,[41,60]},{30,20,[51,70]},{50,10,[61,80]},{70,5,[71,80]},{100,2,[81,90]},{150,1,[91,100]}]
A102: 99 | B102: 2 | C102: 6 | D102: 1000 | E102: =R[-18]C -> 81 | F102: =R[-18]C -> 90 | G102: 1 | H102: 5000 | I102: 110003 | J102: 1 | K102: =R[-1]C -> [{7,6},{8,4},{9,0},{10,0},{11,0},{12,0},{17,10},{18,8},{19,1},{23,4},{24,10}] | L102: =R[-1]C -> [{7,27},{8,55},{9,27},{10,55},{11,27},{12,55},{17,18},{18,110},{19,3},{23,37},{24,37}] | M102: =R[-1]C -> [{0,1,[1,30]},{1,2,[11,40]},{2,5,[21,50]},{5,10,[31,60]},{10,20,[41,60]},{30,20,[51,70]},{50,10,[61,80]},{70,5,[71,80]},{100,2,[81,90]},{150,1,[91,100]}]
A103: 100 | B103: 3 | C103: 6 | D103: 1000 | E103: =R[-9]C -> 1 | F103: =R[-9]C -> 10 | G103: 2 | H103: 10000 | I103: 110003 | J103: 2 | K103: =R[-1]C -> [{7,6},{8,4},{9,0},{10,0},{11,0},{12,0},{17,10},{18,8},{19,1},{23,4},{24,10}] | L103: =R[-1]C -> [{7,27},{8,55},{9,27},{10,55},{11,27},{12,55},{17,18},{18,110},{19,3},{23,37},{24,37}] | M103: =R[-1]C -> [{0,1,[1,30]},{1,2,[11,40]},{2,5,[21,50]},{5,10,[31,60]},{10,20,[41,60]},{30,20,[51,70]},{50,10,[61,80]},{70,5,[71,80]},{100,2,[81,90]},{150,1,[91,100]}]
A104: 101 | B104: 3 | C104: 6 | D104: 1000 | E104: =R[-9]C -> 11 | F104: =R[-9]C -> 20 | G104: 2 | H104: 10000 | I104: 110003 | J104: 2 | K104: =R[-1]C -> [{7,6},{8,4},{9,0},{10,0},{11,0},{12,0},{17,10},{18,8},{19,1},{23,4},{24,10}] | L104: =R[-1]C -> [{7,27},{8,55},{9,27},{10,55},{11,27},{12,55},{17,18},{18,110},{19,3},{23,37},{24,37}] | M104: =R[-1]C -> [{0,1,[1,30]},{1,2,[11,40]},{2,5,[21,50]},{5,10,[31,60]},{10,20,[41,60]},{30,20,[51,70]},{50,10,[61,80]},{70,5,[71,80]},{100,2,[81,90]},{150,1,[91,100]}]
A105: 102 | B105: 3 | C105: 6 | D105: 1000 | E105: =R[-9]C -> 21 | F105: =R[-9]C -> 30 | G105: 2 | H105: 10000 | I105: 110003 | J105: 2 | K105: =R[-1]C -> [{7,6},{8,4},{9,0},{10,0},{11,0},{12,0},{17,10},{18,8},{19,1},{23,4},{24,10}] | L105: =R[-1]C -> [{7,27},{8,55},{9,27},{10,55},{11,27},{12,55},{17,18},{18,110},{19,3},{23,37},{24,37}] | M105: =R[-1]C -> [{0,1,[1,30]},{1,2,[11,40]},{2,5,[21,50]},{5,10,[31,60]},{10,20,[41,60]},{30,20,[51,70]},{50,10,[61,80]},{70,5,[71,80]},{100,2,[81,90]},{150,1,[91,100]}]
A106: 103 | B106: 3 | C106: 6 | D106: 1000 | E106: =R[-9]C -> 31 | F106: =R[-9]C -> 40 | G106: 2 | H106: 10000 | I106: 110003 | J106: 2 | K106: =R[-1]C -> [{7,6},{8,4},{9,0},{10,0},{11,0},{12,0},{17,10},{18,8},{19,1},{23,4},{24,10}] | L106: =R[-1]C -> [{7,27},{8,55},{9,27},{10,55},{11,27},{12,55},{17,18},{18,110},{19,3},{23,37},{24,37}] | M106: =R[-1]C -> [{0,1,[1,30]},{1,2,[11,40]},{2,5,[21,50]},{5,10,[31,60]},{10,20,[41,60]},{30,20,[51,70]},{50,10,[61,80]},{70,5,[71,80]},{100,2,[81,90]},{150,1,[91,100]}]
A107: 104 | B107: 3 | C107: 6 | D107: 1000 | E107: =R[-9]C -> 41 | F107: =R[-9]C -> 50 | G107: 2 | H107: 10000 | I107: 110003 | J107: 2 | K107: =R[-1]C -> [{7,6},{8,4},{9,0},{10,0},{11,0},{12,0},{17,10},{18,8},{19,1},{23,4},{24,10}] | L107: =R[-1]C -> [{7,27},{8,55},{9,27},{10,55},{11,27},{12,55},{17,18},{18,110},{19,3},{23,37},{24,37}] | M107: =R[-1]C -> [{0,1,[1,30]},{1,2,[11,40]},{2,5,[21,50]},{5,10,[31,60]},{10,20,[41,60]},{30,20,[51,70]},{50,10,[61,80]},{70,5,[71,80]},{100,2,[81,90]},{150,1,[91,100]}]
A108: 105 | B108: 3 | C108: 6 | D108: 1000 | E108: =R[-9]C -> 51 | F108: =R[-9]C -> 60 | G108: 2 | H108: 10000 | I108: 110003 | J108: 2 | K108: =R[-1]C -> [{7,6},{8,4},{9,0},{10,0},{11,0},{12,0},{17,10},{18,8},{19,1},{23,4},{24,10}] | L108: =R[-1]C -> [{7,27},{8,55},{9,27},{10,55},{11,27},{12,55},{17,18},{18,110},{19,3},{23,37},{24,37}] | M108: =R[-1]C -> [{0,1,[1,30]},{1,2,[11,40]},{2,5,[21,50]},{5,10,[31,60]},{10,20,[41,60]},{30,20,[51,70]},{50,10,[61,80]},{70,5,[71,80]},{100,2,[81,90]},{150,1,[91,100]}]
A109: 106 | B109: 3 | C109: 6 | D109: 1000 | E109: =R[-9]C -> 61 | F109: =R[-9]C -> 70 | G109: 2 | H109: 10000 | I109: 110003 | J109: 2 | K109: =R[-1]C -> [{7,6},{8,4},{9,0},{10,0},{11,0},{12,0},{17,10},{18,8},{19,1},{23,4},{24,10}] | L109: =R[-1]C -> [{7,27},{8,55},{9,27},{10,55},{11,27},{12,55},{17,18},{18,110},{19,3},{23,37},{24,37}] | M109: =R[-1]C -> [{0,1,[1,30]},{1,2,[11,40]},{2,5,[21,50]},{5,10,[31,60]},{10,20,[41,60]},{30,20,[51,70]},{50,10,[61,80]},{70,5,[71,80]},{100,2,[81,90]},{150,1,[91,100]}]
A110: 107 | B110: 3 | C110: 6 | D110: 1000 | E110: =R[-9]C -> 71 | F110: =R[-9]C -> 80 | G110: 2 | H110: 10000 | I110: 110003 | J110: 2 | K110: =R[-1]C -> [{7,6},{8,4},{9,0},{10,0},{11,0},{12,0},{17,10},{18,8},{19,1},{23,4},{24,10}] | L110: =R[-1]C -> [{7,27},{8,55},{9,27},{10,55},{11,27},{12,55},{17,18},{18,110},{19,3},{23,37},{24,37}] | M110: =R[-1]C -> [{0,1,[1,30]},{1,2,[11,40]},{2,5,[21,50]},{5,10,[31,60]},{10,20,[41,60]},{30,20,[51,70]},{50,10,[61,80]},{70,5,[71,80]},{100,2,[81,90]},{150,1,[91,100]}]
A111: 108 | B111: 3 | C111: 6 | D111: 1000 | E111: =R[-9]C -> 81 | F111: =R[-9]C -> 90 | G111: 2 | H111: 10000 | I111: 110003 | J111: 2 | K111: =R[-1]C -> [{7,6},{8,4},{9,0},{10,0},{11,0},{12,0},{17,10},{18,8},{19,1},{23,4},{24,10}] | L111: =R[-1]C -> [{7,27},{8,55},{9,27},{10,55},{11,27},{12,55},{17,18},{18,110},{19,3},{23,37},{24,37}] | M111: =R[-1]C -> [{0,1,[1,30]},{1,2,[11,40]},{2,5,[21,50]},{5,10,[31,60]},{10,20,[41,60]},{30,20,[51,70]},{50,10,[61,80]},{70,5,[71,80]},{100,2,[81,90]},{150,1,[91,100]}]
A112: 109 | B112: 4 | C112: 6 | D112: 1000 | E112: =R[-9]C -> 1 | F112: =R[-9]C -> 10 | G112: 3 | H112: 15000 | I112: 110003 | J112: 3 | K112: =R[-1]C -> [{7,6},{8,4},{9,0},{10,0},{11,0},{12,0},{17,10},{18,8},{19,1},{23,4},{24,10}] | L112: =R[-1]C -> [{7,27},{8,55},{9,27},{10,55},{11,27},{12,55},{17,18},{18,110},{19,3},{23,37},{24,37}] | M112: =R[-1]C -> [{0,1,[1,30]},{1,2,[11,40]},{2,5,[21,50]},{5,10,[31,60]},{10,20,[41,60]},{30,20,[51,70]},{50,10,[61,80]},{70,5,[71,80]},{100,2,[81,90]},{150,1,[91,100]}]
A113: 110 | B113: 4 | C113: 6 | D113: 1000 | E113: =R[-9]C -> 11 | F113: =R[-9]C -> 20 | G113: 3 | H113: 15000 | I113: 110003 | J113: 3 | K113: =R[-1]C -> [{7,6},{8,4},{9,0},{10,0},{11,0},{12,0},{17,10},{18,8},{19,1},{23,4},{24,10}] | L113: =R[-1]C -> [{7,27},{8,55},{9,27},{10,55},{11,27},{12,55},{17,18},{18,110},{19,3},{23,37},{24,37}] | M113: =R[-1]C -> [{0,1,[1,30]},{1,2,[11,40]},{2,5,[21,50]},{5,10,[31,60]},{10,20,[41,60]},{30,20,[51,70]},{50,10,[61,80]},{70,5,[71,80]},{100,2,[81,90]},{150,1,[91,100]}]
A114: 111 | B114: 4 | C114: 6 | D114: 1000 | E114: =R[-9]C -> 21 | F114: =R[-9]C -> 30 | G114: 3 | H114: 15000 | I114: 110003 | J114: 3 | K114: =R[-1]C -> [{7,6},{8,4},{9,0},{10,0},{11,0},{12,0},{17,10},{18,8},{19,1},{23,4},{24,10}] | L114: =R[-1]C -> [{7,27},{8,55},{9,27},{10,55},{11,27},{12,55},{17,18},{18,110},{19,3},{23,37},{24,37}] | M114: =R[-1]C -> [{0,1,[1,30]},{1,2,[11,40]},{2,5,[21,50]},{5,10,[31,60]},{10,20,[41,60]},{30,20,[51,70]},{50,10,[61,80]},{70,5,[71,80]},{100,2,[81,90]},{150,1,[91,100]}]
A115: 112 | B115: 4 | C115: 6 | D115: 1000 | E115: =R[-9]C -> 31 | F115: =R[-9]C -> 40 | G115: 3 | H115: 15000 | I115: 110003 | J115: 3 | K115: =R[-1]C -> [{7,6},{8,4},{9,0},{10,0},{11,0},{12,0},{17,10},{18,8},{19,1},{23,4},{24,10}] | L115: =R[-1]C -> [{7,27},{8,55},{9,27},{10,55},{11,27},{12,55},{17,18},{18,110},{19,3},{23,37},{24,37}] | M115: =R[-1]C -> [{0,1,[1,30]},{1,2,[11,40]},{2,5,[21,50]},{5,10,[31,60]},{10,20,[41,60]},{30,20,[51,70]},{50,10,[61,80]},{70,5,[71,80]},{100,2,[81,90]},{150,1,[91,100]}]
A116: 113 | B116: 4 | C116: 6 | D116: 1000 | E116: =R[-9]C -> 41 | F116: =R[-9]C -> 50 | G116: 3 | H116: 15000 | I116: 110003 | J116: 3 | K116: =R[-1]C -> [{7,6},{8,4},{9,0},{10,0},{11,0},{12,0},{17,10},{18,8},{19,1},{23,4},{24,10}] | L116: =R[-1]C -> [{7,27},{8,55},{9,27},{10,55},{11,27},{12,55},{17,18},{18,110},{19,3},{23,37},{24,37}] | M116: =R[-1]C -> [{0,1,[1,30]},{1,2,[11,40]},{2,5,[21,50]},{5,10,[31,60]},{10,20,[41,60]},{30,20,[51,70]},{50,10,[61,80]},{70,5,[71,80]},{100,2,[81,90]},{150,1,[91,100]}]
A117: 114 | B117: 4 | C117: 6 | D117: 1000 | E117: =R[-9]C -> 51 | F117: =R[-9]C -> 60 | G117: 3 | H117: 15000 | I117: 110003 | J117: 3 | K117: =R[-1]C -> [{7,6},{8,4},{9,0},{10,0},{11,0},{12,0},{17,10},{18,8},{19,1},{23,4},{24,10}] | L117: =R[-1]C -> [{7,27},{8,55},{9,27},{10,55},{11,27},{12,55},{17,18},{18,110},{19,3},{23,37},{24,37}] | M117: =R[-1]C -> [{0,1,[1,30]},{1,2,[11,40]},{2,5,[21,50]},{5,10,[31,60]},{10,20,[41,60]},{30,20,[51,70]},{50,10,[61,80]},{70,5,[71,80]},{100,2,[81,90]},{150,1,[91,100]}]
A118: 115 | B118: 4 | C118: 6 | D118: 1000 | E118: =R[-9]C -> 61 | F118: =R[-9]C -> 70 | G118: 3 | H118: 15000 | I118: 110003 | J118: 3 | K118: =R[-1]C -> [{7,6},{8,4},{9,0},{10,0},{11,0},{12,0},{17,10},{18,8},{19,1},{23,4},{24,10}] | L118: =R[-1]C -> [{7,27},{8,55},{9,27},{10,55},{11,27},{12,55},{17,18},{18,110},{19,3},{23,37},{24,37}] | M118: =R[-1]C -> [{0,1,[1,30]},{1,2,[11,40]},{2,5,[21,50]},{5,10,[31,60]},{10,20,[41,60]},{30,20,[51,70]},{50,10,[61,80]},{70,5,[71,80]},{100,2,[81,90]},{150,1,[91,100]}]
A119: 116 | B119: 4 | C119: 6 | D119: 1000 | E119: =R[-9]C -> 71 | F119: =R[-9]C -> 80 | G119: 3 | H119: 15000 | I119: 110003 | J119: 3 | K119: =R[-1]C -> [{7,6},{8,4},{9,0},{10,0},{11,0},{12,0},{17,10},{18,8},{19,1},{23,4},{24,10}] | L119: =R[-1]C -> [{7,27},{8,55},{9,27},{10,55},{11,27},{12,55},{17,18},{18,110},{19,3},{23,37},{24,37}] | M119: =R[-1]C -> [{0,1,[1,30]},{1,2,[11,40]},{2,5,[21,50]},{5,10,[31,60]},{10,20,[41,60]},{30,20,[51,70]},{50,10,[61,80]},{70,5,[71,80]},{100,2,[81,90]},{150,1,[91,100]}]
A120: 117 | B120: 4 | C120: 6 | D120: 1000 | E120: =R[-9]C -> 81 | F120: =R[-9]C -> 90 | G120: 3 | H120: 15000 | I120: 110003 | J120: 3 | K120: =R[-1]C -> [{7,6},{8,4},{9,0},{10,0},{11,0},{12,0},{17,10},{18,8},{19,1},{23,4},{24,10}] | L120: =R[-1]C -> [{7,27},{8,55},{9,27},{10,55},{11,27},{12,55},{17,18},{18,110},{19,3},{23,37},{24,37}] | M120: =R[-1]C -> [{0,1,[1,30]},{1,2,[11,40]},{2,5,[21,50]},{5,10,[31,60]},{10,20,[41,60]},{30,20,[51,70]},{50,10,[61,80]},{70,5,[71,80]},{100,2,[81,90]},{150,1,[91,100]}]
A121: 118 | B121: 5 | C121: 6 | D121: 1000 | E121: =R[-9]C -> 1 | F121: =R[-9]C -> 10 | G121: 4 | H121: 20000 | I121: 110003 | J121: 4 | K121: =R[-1]C -> [{7,6},{8,4},{9,0},{10,0},{11,0},{12,0},{17,10},{18,8},{19,1},{23,4},{24,10}] | L121: =R[-1]C -> [{7,27},{8,55},{9,27},{10,55},{11,27},{12,55},{17,18},{18,110},{19,3},{23,37},{24,37}] | M121: =R[-1]C -> [{0,1,[1,30]},{1,2,[11,40]},{2,5,[21,50]},{5,10,[31,60]},{10,20,[41,60]},{30,20,[51,70]},{50,10,[61,80]},{70,5,[71,80]},{100,2,[81,90]},{150,1,[91,100]}]
A122: 119 | B122: 5 | C122: 6 | D122: 1000 | E122: =R[-9]C -> 11 | F122: =R[-9]C -> 20 | G122: 4 | H122: 20000 | I122: 110003 | J122: 4 | K122: =R[-1]C -> [{7,6},{8,4},{9,0},{10,0},{11,0},{12,0},{17,10},{18,8},{19,1},{23,4},{24,10}] | L122: =R[-1]C -> [{7,27},{8,55},{9,27},{10,55},{11,27},{12,55},{17,18},{18,110},{19,3},{23,37},{24,37}] | M122: =R[-1]C -> [{0,1,[1,30]},{1,2,[11,40]},{2,5,[21,50]},{5,10,[31,60]},{10,20,[41,60]},{30,20,[51,70]},{50,10,[61,80]},{70,5,[71,80]},{100,2,[81,90]},{150,1,[91,100]}]
A123: 120 | B123: 5 | C123: 6 | D123: 1000 | E123: =R[-9]C -> 21 | F123: =R[-9]C -> 30 | G123: 4 | H123: 20000 | I123: 110003 | J123: 4 | K123: =R[-1]C -> [{7,6},{8,4},{9,0},{10,0},{11,0},{12,0},{17,10},{18,8},{19,1},{23,4},{24,10}] | L123: =R[-1]C -> [{7,27},{8,55},{9,27},{10,55},{11,27},{12,55},{17,18},{18,110},{19,3},{23,37},{24,37}] | M123: =R[-1]C -> [{0,1,[1,30]},{1,2,[11,40]},{2,5,[21,50]},{5,10,[31,60]},{10,20,[41,60]},{30,20,[51,70]},{50,10,[61,80]},{70,5,[71,80]},{100,2,[81,90]},{150,1,[91,100]}]
A124: 121 | B124: 5 | C124: 6 | D124: 1000 | E124: =R[-9]C -> 31 | F124: =R[-9]C -> 40 | G124: 4 | H124: 20000 | I124: 110003 | J124: 4 | K124: =R[-1]C -> [{7,6},{8,4},{9,0},{10,0},{11,0},{12,0},{17,10},{18,8},{19,1},{23,4},{24,10}] | L124: =R[-1]C -> [{7,27},{8,55},{9,27},{10,55},{11,27},{12,55},{17,18},{18,110},{19,3},{23,37},{24,37}] | M124: =R[-1]C -> [{0,1,[1,30]},{1,2,[11,40]},{2,5,[21,50]},{5,10,[31,60]},{10,20,[41,60]},{30,20,[51,70]},{50,10,[61,80]},{70,5,[71,80]},{100,2,[81,90]},{150,1,[91,100]}]
A125: 122 | B125: 5 | C125: 6 | D125: 1000 | E125: =R[-9]C -> 41 | F125: =R[-9]C -> 50 | G125: 4 | H125: 20000 | I125: 110003 | J125: 4 | K125: =R[-1]C -> [{7,6},{8,4},{9,0},{10,0},{11,0},{12,0},{17,10},{18,8},{19,1},{23,4},{24,10}] | L125: =R[-1]C -> [{7,27},{8,55},{9,27},{10,55},{11,27},{12,55},{17,18},{18,110},{19,3},{23,37},{24,37}] | M125: =R[-1]C -> [{0,1,[1,30]},{1,2,[11,40]},{2,5,[21,50]},{5,10,[31,60]},{10,20,[41,60]},{30,20,[51,70]},{50,10,[61,80]},{70,5,[71,80]},{100,2,[81,90]},{150,1,[91,100]}]
A126: 123 | B126: 5 | C126: 6 | D126: 1000 | E126: =R[-9]C -> 51 | F126: =R[-9]C -> 60 | G126: 4 | H126: 20000 | I126: 110003 | J126: 4 | K126: =R[-1]C -> [{7,6},{8,4},{9,0},{10,0},{11,0},{12,0},{17,10},{18,8},{19,1},{23,4},{24,10}] | L126: =R[-1]C -> [{7,27},{8,55},{9,27},{10,55},{11,27},{12,55},{17,18},{18,110},{19,3},{23,37},{24,37}] | M126: =R[-1]C -> [{0,1,[1,30]},{1,2,[11,40]},{2,5,[21,50]},{5,10,[31,60]},{10,20,[41,60]},{30,20,[51,70]},{50,10,[61,80]},{70,5,[71,80]},{100,2,[81,90]},{150,1,[91,100]}]
A127: 124 | B127: 5 | C127: 6 | D127: 1000 | E127: =R[-9]C -> 61 | F127: =R[-9]C -> 70 | G127: 4 | H127: 20000 | I127: 110003 | J127: 4 | K127: =R[-1]C -> [{7,6},{8,4},{9,0},{10,0},{11,0},{12,0},{17,10},{18,8},{19,1},{23,4},{24,10}] | L127: =R[-1]C -> [{7,27},{8,55},{9,27},{10,55},{11,27},{12,55},{17,18},{18,110},{19,3},{23,37},{24,37}] | M127: =R[-1]C -> [{0,1,[1,30]},{1,2,[11,40]},{2,5,[21,50]},{5,10,[31,60]},{10,20,[41,60]},{30,20,[51,70]},{50,10,[61,80]},{70,5,[71,80]},{100,2,[81,90]},{150,1,[91,100]}]
A128: 125 | B128: 5 | C128: 6 | D128: 1000 | E128: =R[-9]C -> 71 | F128: =R[-9]C -> 80 | G128: 4 | H128: 20000 | I128: 110003 | J128: 4 | K128: =R[-1]C -> [{7,6},{8,4},{9,0},{10,0},{11,0},{12,0},{17,10},{18,8},{19,1},{23,4},{24,10}] | L128: =R[-1]C -> [{7,27},{8,55},{9,27},{10,55},{11,27},{12,55},{17,18},{18,110},{19,3},{23,37},{24,37}] | M128: =R[-1]C -> [{0,1,[1,30]},{1,2,[11,40]},{2,5,[21,50]},{5,10,[31,60]},{10,20,[41,60]},{30,20,[51,70]},{50,10,[61,80]},{70,5,[71,80]},{100,2,[81,90]},{150,1,[91,100]}]
A129: 126 | B129: 5 | C129: 6 | D129: 1000 | E129: =R[-9]C -> 81 | F129: =R[-9]C -> 90 | G129: 4 | H129: 20000 | I129: 110003 | J129: 4 | K129: =R[-1]C -> [{7,6},{8,4},{9,0},{10,0},{11,0},{12,0},{17,10},{18,8},{19,1},{23,4},{24,10}] | L129: =R[-1]C -> [{7,27},{8,55},{9,27},{10,55},{11,27},{12,55},{17,18},{18,110},{19,3},{23,37},{24,37}] | M129: =R[-1]C -> [{0,1,[1,30]},{1,2,[11,40]},{2,5,[21,50]},{5,10,[31,60]},{10,20,[41,60]},{30,20,[51,70]},{50,10,[61,80]},{70,5,[71,80]},{100,2,[81,90]},{150,1,[91,100]}]
A130: 127 | B130: 6 | C130: 6 | D130: 1000 | E130: =R[-9]C -> 1 | F130: =R[-9]C -> 10 | G130: 5 | H130: 20000 | I130: 110003 | J130: 5 | K130: =R[-1]C -> [{7,6},{8,4},{9,0},{10,0},{11,0},{12,0},{17,10},{18,8},{19,1},{23,4},{24,10}] | L130: =R[-1]C -> [{7,27},{8,55},{9,27},{10,55},{11,27},{12,55},{17,18},{18,110},{19,3},{23,37},{24,37}] | M130: =R[-1]C -> [{0,1,[1,30]},{1,2,[11,40]},{2,5,[21,50]},{5,10,[31,60]},{10,20,[41,60]},{30,20,[51,70]},{50,10,[61,80]},{70,5,[71,80]},{100,2,[81,90]},{150,1,[91,100]}]
A131: 128 | B131: 6 | C131: 6 | D131: 1000 | E131: =R[-9]C -> 11 | F131: =R[-9]C -> 20 | G131: 5 | H131: 20000 | I131: 110003 | J131: 5 | K131: =R[-1]C -> [{7,6},{8,4},{9,0},{10,0},{11,0},{12,0},{17,10},{18,8},{19,1},{23,4},{24,10}] | L131: =R[-1]C -> [{7,27},{8,55},{9,27},{10,55},{11,27},{12,55},{17,18},{18,110},{19,3},{23,37},{24,37}] | M131: =R[-1]C -> [{0,1,[1,30]},{1,2,[11,40]},{2,5,[21,50]},{5,10,[31,60]},{10,20,[41,60]},{30,20,[51,70]},{50,10,[61,80]},{70,5,[71,80]},{100,2,[81,90]},{150,1,[91,100]}]
A132: 129 | B132: 6 | C132: 6 | D132: 1000 | E132: =R[-9]C -> 21 | F132: =R[-9]C -> 30 | G132: 5 | H132: 20000 | I132: 110003 | J132: 5 | K132: =R[-1]C -> [{7,6},{8,4},{9,0},{10,0},{11,0},{12,0},{17,10},{18,8},{19,1},{23,4},{24,10}] | L132: =R[-1]C -> [{7,27},{8,55},{9,27},{10,55},{11,27},{12,55},{17,18},{18,110},{19,3},{23,37},{24,37}] | M132: =R[-1]C -> [{0,1,[1,30]},{1,2,[11,40]},{2,5,[21,50]},{5,10,[31,60]},{10,20,[41,60]},{30,20,[51,70]},{50,10,[61,80]},{70,5,[71,80]},{100,2,[81,90]},{150,1,[91,100]}]
A133: 130 | B133: 6 | C133: 6 | D133: 1000 | E133: =R[-9]C -> 31 | F133: =R[-9]C -> 40 | G133: 5 | H133: 20000 | I133: 110003 | J133: 5 | K133: =R[-1]C -> [{7,6},{8,4},{9,0},{10,0},{11,0},{12,0},{17,10},{18,8},{19,1},{23,4},{24,10}] | L133: =R[-1]C -> [{7,27},{8,55},{9,27},{10,55},{11,27},{12,55},{17,18},{18,110},{19,3},{23,37},{24,37}] | M133: =R[-1]C -> [{0,1,[1,30]},{1,2,[11,40]},{2,5,[21,50]},{5,10,[31,60]},{10,20,[41,60]},{30,20,[51,70]},{50,10,[61,80]},{70,5,[71,80]},{100,2,[81,90]},{150,1,[91,100]}]
A134: 131 | B134: 6 | C134: 6 | D134: 1000 | E134: =R[-9]C -> 41 | F134: =R[-9]C -> 50 | G134: 5 | H134: 20000 | I134: 110003 | J134: 5 | K134: =R[-1]C -> [{7,6},{8,4},{9,0},{10,0},{11,0},{12,0},{17,10},{18,8},{19,1},{23,4},{24,10}] | L134: =R[-1]C -> [{7,27},{8,55},{9,27},{10,55},{11,27},{12,55},{17,18},{18,110},{19,3},{23,37},{24,37}] | M134: =R[-1]C -> [{0,1,[1,30]},{1,2,[11,40]},{2,5,[21,50]},{5,10,[31,60]},{10,20,[41,60]},{30,20,[51,70]},{50,10,[61,80]},{70,5,[71,80]},{100,2,[81,90]},{150,1,[91,100]}]
A135: 132 | B135: 6 | C135: 6 | D135: 1000 | E135: =R[-9]C -> 51 | F135: =R[-9]C -> 60 | G135: 5 | H135: 20000 | I135: 110003 | J135: 5 | K135: =R[-1]C -> [{7,6},{8,4},{9,0},{10,0},{11,0},{12,0},{17,10},{18,8},{19,1},{23,4},{24,10}] | L135: =R[-1]C -> [{7,27},{8,55},{9,27},{10,55},{11,27},{12,55},{17,18},{18,110},{19,3},{23,37},{24,37}] | M135: =R[-1]C -> [{0,1,[1,30]},{1,2,[11,40]},{2,5,[21,50]},{5,10,[31,60]},{10,20,[41,60]},{30,20,[51,70]},{50,10,[61,80]},{70,5,[71,80]},{100,2,[81,90]},{150,1,[91,100]}]
A136: 133 | B136: 6 | C136: 6 | D136: 1000 | E136: =R[-9]C -> 61 | F136: =R[-9]C -> 70 | G136: 5 | H136: 20000 | I136: 110003 | J136: 5 | K136: =R[-1]C -> [{7,6},{8,4},{9,0},{10,0},{11,0},{12,0},{17,10},{18,8},{19,1},{23,4},{24,10}] | L136: =R[-1]C -> [{7,27},{8,55},{9,27},{10,55},{11,27},{12,55},{17,18},{18,110},{19,3},{23,37},{24,37}] | M136: =R[-1]C -> [{0,1,[1,30]},{1,2,[11,40]},{2,5,[21,50]},{5,10,[31,60]},{10,20,[41,60]},{30,20,[51,70]},{50,10,[61,80]},{70,5,[71,80]},{100,2,[81,90]},{150,1,[91,100]}]
A137: 134 | B137: 6 | C137: 6 | D137: 1000 | E137: =R[-9]C -> 71 | F137: =R[-9]C -> 80 | G137: 5 | H137: 20000 | I137: 110003 | J137: 5 | K137: =R[-1]C -> [{7,6},{8,4},{9,0},{10,0},{11,0},{12,0},{17,10},{18,8},{19,1},{23,4},{24,10}] | L137: =R[-1]C -> [{7,27},{8,55},{9,27},{10,55},{11,27},{12,55},{17,18},{18,110},{19,3},{23,37},{24,37}] | M137: =R[-1]C -> [{0,1,[1,30]},{1,2,[11,40]},{2,5,[21,50]},{5,10,[31,60]},{10,20,[41,60]},{30,20,[51,70]},{50,10,[61,80]},{70,5,[71,80]},{100,2,[81,90]},{150,1,[91,100]}]
A138: 135 | B138: 6 | C138: 6 | D138: 1000 | E138: =R[-9]C -> 81 | F138: =R[-9]C -> 90 | G138: 5 | H138: 20000 | I138: 110003 | J138: 5 | K138: =R[-1]C -> [{7,6},{8,4},{9,0},{10,0},{11,0},{12,0},{17,10},{18,8},{19,1},{23,4},{24,10}] | L138: =R[-1]C -> [{7,27},{8,55},{9,27},{10,55},{11,27},{12,55},{17,18},{18,110},{19,3},{23,37},{24,37}] | M138: =R[-1]C -> [{0,1,[1,30]},{1,2,[11,40]},{2,5,[21,50]},{5,10,[31,60]},{10,20,[41,60]},{30,20,[51,70]},{50,10,[61,80]},{70,5,[71,80]},{100,2,[81,90]},{150,1,[91,100]}]
A139: 136 | B139: 2 | C139: 7 | D139: 1000 | E139: =R[-18]C -> 1 | F139: =R[-18]C -> 10 | G139: 1 | H139: 5000 | I139: 110003 | J139: 1 | K139: =R[-1]C -> [{7,6},{8,4},{9,0},{10,0},{11,0},{12,0},{17,10},{18,8},{19,1},{23,4},{24,10}] | L139: =R[-1]C -> [{7,27},{8,55},{9,27},{10,55},{11,27},{12,55},{17,18},{18,110},{19,3},{23,37},{24,37}] | M139: =R[-1]C -> [{0,1,[1,30]},{1,2,[11,40]},{2,5,[21,50]},{5,10,[31,60]},{10,20,[41,60]},{30,20,[51,70]},{50,10,[61,80]},{70,5,[71,80]},{100,2,[81,90]},{150,1,[91,100]}]
A140: 137 | B140: 2 | C140: 7 | D140: 1000 | E140: =R[-18]C -> 11 | F140: =R[-18]C -> 20 | G140: 1 | H140: 5000 | I140: 110003 | J140: 1 | K140: =R[-1]C -> [{7,6},{8,4},{9,0},{10,0},{11,0},{12,0},{17,10},{18,8},{19,1},{23,4},{24,10}] | L140: =R[-1]C -> [{7,27},{8,55},{9,27},{10,55},{11,27},{12,55},{17,18},{18,110},{19,3},{23,37},{24,37}] | M140: =R[-1]C -> [{0,1,[1,30]},{1,2,[11,40]},{2,5,[21,50]},{5,10,[31,60]},{10,20,[41,60]},{30,20,[51,70]},{50,10,[61,80]},{70,5,[71,80]},{100,2,[81,90]},{150,1,[91,100]}]
A141: 138 | B141: 2 | C141: 7 | D141: 1000 | E141: =R[-18]C -> 21 | F141: =R[-18]C -> 30 | G141: 1 | H141: 5000 | I141: 110003 | J141: 1 | K141: =R[-1]C -> [{7,6},{8,4},{9,0},{10,0},{11,0},{12,0},{17,10},{18,8},{19,1},{23,4},{24,10}] | L141: =R[-1]C -> [{7,27},{8,55},{9,27},{10,55},{11,27},{12,55},{17,18},{18,110},{19,3},{23,37},{24,37}] | M141: =R[-1]C -> [{0,1,[1,30]},{1,2,[11,40]},{2,5,[21,50]},{5,10,[31,60]},{10,20,[41,60]},{30,20,[51,70]},{50,10,[61,80]},{70,5,[71,80]},{100,2,[81,90]},{150,1,[91,100]}]
A142: 139 | B142: 2 | C142: 7 | D142: 1000 | E142: =R[-18]C -> 31 | F142: =R[-18]C -> 40 | G142: 1 | H142: 5000 | I142: 110003 | J142: 1 | K142: =R[-1]C -> [{7,6},{8,4},{9,0},{10,0},{11,0},{12,0},{17,10},{18,8},{19,1},{23,4},{24,10}] | L142: =R[-1]C -> [{7,27},{8,55},{9,27},{10,55},{11,27},{12,55},{17,18},{18,110},{19,3},{23,37},{24,37}] | M142: =R[-1]C -> [{0,1,[1,30]},{1,2,[11,40]},{2,5,[21,50]},{5,10,[31,60]},{10,20,[41,60]},{30,20,[51,70]},{50,10,[61,80]},{70,5,[71,80]},{100,2,[81,90]},{150,1,[91,100]}]
A143: 140 | B143: 2 | C143: 7 | D143: 1000 | E143: =R[-18]C -> 41 | F143: =R[-18]C -> 50 | G143: 1 | H143: 5000 | I143: 110003 | J143: 1 | K143: =R[-1]C -> [{7,6},{8,4},{9,0},{10,0},{11,0},{12,0},{17,10},{18,8},{19,1},{23,4},{24,10}] | L143: =R[-1]C -> [{7,27},{8,55},{9,27},{10,55},{11,27},{12,55},{17,18},{18,110},{19,3},{23,37},{24,37}] | M143: =R[-1]C -> [{0,1,[1,30]},{1,2,[11,40]},{2,5,[21,50]},{5,10,[31,60]},{10,20,[41,60]},{30,20,[51,70]},{50,10,[61,80]},{70,5,[71,80]},{100,2,[81,90]},{150,1,[91,100]}]
A144: 141 | B144: 2 | C144: 7 | D144: 1000 | E144: =R[-18]C -> 51 | F144: =R[-18]C -> 60 | G144: 1 | H144: 5000 | I144: 110003 | J144: 1 | K144: =R[-1]C -> [{7,6},{8,4},{9,0},{10,0},{11,0},{12,0},{17,10},{18,8},{19,1},{23,4},{24,10}] | L144: =R[-1]C -> [{7,27},{8,55},{9,27},{10,55},{11,27},{12,55},{17,18},{18,110},{19,3},{23,37},{24,37}] | M144: =R[-1]C -> [{0,1,[1,30]},{1,2,[11,40]},{2,5,[21,50]},{5,10,[31,60]},{10,20,[41,60]},{30,20,[51,70]},{50,10,[61,80]},{70,5,[71,80]},{100,2,[81,90]},{150,1,[91,100]}]
A145: 142 | B145: 2 | C145: 7 | D145: 1000 | E145: =R[-18]C -> 61 | F145: =R[-18]C -> 70 | G145: 1 | H145: 5000 | I145: 110003 | J145: 1 | K145: =R[-1]C -> [{7,6},{8,4},{9,0},{10,0},{11,0},{12,0},{17,10},{18,8},{19,1},{23,4},{24,10}] | L145: =R[-1]C -> [{7,27},{8,55},{9,27},{10,55},{11,27},{12,55},{17,18},{18,110},{19,3},{23,37},{24,37}] | M145: =R[-1]C -> [{0,1,[1,30]},{1,2,[11,40]},{2,5,[21,50]},{5,10,[31,60]},{10,20,[41,60]},{30,20,[51,70]},{50,10,[61,80]},{70,5,[71,80]},{100,2,[81,90]},{150,1,[91,100]}]
A146: 143 | B146: 2 | C146: 7 | D146: 1000 | E146: =R[-18]C -> 71 | F146: =R[-18]C -> 80 | G146: 1 | H146: 5000 | I146: 110003 | J146: 1 | K146: =R[-1]C -> [{7,6},{8,4},{9,0},{10,0},{11,0},{12,0},{17,10},{18,8},{19,1},{23,4},{24,10}] | L146: =R[-1]C -> [{7,27},{8,55},{9,27},{10,55},{11,27},{12,55},{17,18},{18,110},{19,3},{23,37},{24,37}] | M146: =R[-1]C -> [{0,1,[1,30]},{1,2,[11,40]},{2,5,[21,50]},{5,10,[31,60]},{10,20,[41,60]},{30,20,[51,70]},{50,10,[61,80]},{70,5,[71,80]},{100,2,[81,90]},{150,1,[91,100]}]
A147: 144 | B147: 2 | C147: 7 | D147: 1000 | E147: =R[-18]C -> 81 | F147: =R[-18]C -> 90 | G147: 1 | H147: 5000 | I147: 110003 | J147: 1 | K147: =R[-1]C -> [{7,6},{8,4},{9,0},{10,0},{11,0},{12,0},{17,10},{18,8},{19,1},{23,4},{24,10}] | L147: =R[-1]C -> [{7,27},{8,55},{9,27},{10,55},{11,27},{12,55},{17,18},{18,110},{19,3},{23,37},{24,37}] | M147: =R[-1]C -> [{0,1,[1,30]},{1,2,[11,40]},{2,5,[21,50]},{5,10,[31,60]},{10,20,[41,60]},{30,20,[51,70]},{50,10,[61,80]},{70,5,[71,80]},{100,2,[81,90]},{150,1,[91,100]}]
A148: 145 | B148: 3 | C148: 7 | D148: 1000 | E148: =R[-9]C -> 1 | F148: =R[-9]C -> 10 | G148: 2 | H148: 10000 | I148: 110003 | J148: 2 | K148: =R[-1]C -> [{7,6},{8,4},{9,0},{10,0},{11,0},{12,0},{17,10},{18,8},{19,1},{23,4},{24,10}] | L148: =R[-1]C -> [{7,27},{8,55},{9,27},{10,55},{11,27},{12,55},{17,18},{18,110},{19,3},{23,37},{24,37}] | M148: =R[-1]C -> [{0,1,[1,30]},{1,2,[11,40]},{2,5,[21,50]},{5,10,[31,60]},{10,20,[41,60]},{30,20,[51,70]},{50,10,[61,80]},{70,5,[71,80]},{100,2,[81,90]},{150,1,[91,100]}]
A149: 146 | B149: 3 | C149: 7 | D149: 1000 | E149: =R[-9]C -> 11 | F149: =R[-9]C -> 20 | G149: 2 | H149: 10000 | I149: 110003 | J149: 2 | K149: =R[-1]C -> [{7,6},{8,4},{9,0},{10,0},{11,0},{12,0},{17,10},{18,8},{19,1},{23,4},{24,10}] | L149: =R[-1]C -> [{7,27},{8,55},{9,27},{10,55},{11,27},{12,55},{17,18},{18,110},{19,3},{23,37},{24,37}] | M149: =R[-1]C -> [{0,1,[1,30]},{1,2,[11,40]},{2,5,[21,50]},{5,10,[31,60]},{10,20,[41,60]},{30,20,[51,70]},{50,10,[61,80]},{70,5,[71,80]},{100,2,[81,90]},{150,1,[91,100]}]
A150: 147 | B150: 3 | C150: 7 | D150: 1000 | E150: =R[-9]C -> 21 | F150: =R[-9]C -> 30 | G150: 2 | H150: 10000 | I150: 110003 | J150: 2 | K150: =R[-1]C -> [{7,6},{8,4},{9,0},{10,0},{11,0},{12,0},{17,10},{18,8},{19,1},{23,4},{24,10}] | L150: =R[-1]C -> [{7,27},{8,55},{9,27},{10,55},{11,27},{12,55},{17,18},{18,110},{19,3},{23,37},{24,37}] | M150: =R[-1]C -> [{0,1,[1,30]},{1,2,[11,40]},{2,5,[21,50]},{5,10,[31,60]},{10,20,[41,60]},{30,20,[51,70]},{50,10,[61,80]},{70,5,[71,80]},{100,2,[81,90]},{150,1,[91,100]}]
A151: 148 | B151: 3 | C151: 7 | D151: 1000 | E151: =R[-9]C -> 31 | F151: =R[-9]C -> 40 | G151: 2 | H151: 10000 | I151: 110003 | J151: 2 | K151: =R[-1]C -> [{7,6},{8,4},{9,0},{10,0},{11,0},{12,0},{17,10},{18,8},{19,1},{23,4},{24,10}] | L151: =R[-1]C -> [{7,27},{8,55},{9,27},{10,55},{11,27},{12,55},{17,18},{18,110},{19,3},{23,37},{24,37}] | M151: =R[-1]C -> [{0,1,[1,30]},{1,2,[11,40]},{2,5,[21,50]},{5,10,[31,60]},{10,20,[41,60]},{30,20,[51,70]},{50,10,[61,80]},{70,5,[71,80]},{100,2,[81,90]},{150,1,[91,100]}]
A152: 149 | B152: 3 | C152: 7 | D152: 1000 | E152: =R[-9]C -> 41 | F152: =R[-9]C -> 50 | G152: 2 | H152: 10000 | I152: 110003 | J152: 2 | K152: =R[-1]C -> [{7,6},{8,4},{9,0},{10,0},{11,0},{12,0},{17,10},{18,8},{19,1},{23,4},{24,10}] | L152: =R[-1]C -> [{7,27},{8,55},{9,27},{10,55},{11,27},{12,55},{17,18},{18,110},{19,3},{23,37},{24,37}] | M152: =R[-1]C -> [{0,1,[1,30]},{1,2,[11,40]},{2,5,[21,50]},{5,10,[31,60]},{10,20,[41,60]},{30,20,[51,70]},{50,10,[61,80]},{70,5,[71,80]},{100,2,[81,90]},{150,1,[91,100]}]
A153: 150 | B153: 3 | C153: 7 | D153: 1000 | E153: =R[-9]C -> 51 | F153: =R[-9]C -> 60 | G153: 2 | H153: 10000 | I153: 110003 | J153: 2 | K153: =R[-1]C -> [{7,6},{8,4},{9,0},{10,0},{11,0},{12,0},{17,10},{18,8},{19,1},{23,4},{24,10}] | L153: =R[-1]C -> [{7,27},{8,55},{9,27},{10,55},{11,27},{12,55},{17,18},{18,110},{19,3},{23,37},{24,37}] | M153: =R[-1]C -> [{0,1,[1,30]},{1,2,[11,40]},{2,5,[21,50]},{5,10,[31,60]},{10,20,[41,60]},{30,20,[51,70]},{50,10,[61,80]},{70,5,[71,80]},{100,2,[81,90]},{150,1,[91,100]}]
A154: 151 | B154: 3 | C154: 7 | D154: 1000 | E154: =R[-9]C -> 61 | F154: =R[-9]C -> 70 | G154: 2 | H154: 10000 | I154: 110003 | J154: 2 | K154: =R[-1]C -> [{7,6},{8,4},{9,0},{10,0},{11,0},{12,0},{17,10},{18,8},{19,1},{23,4},{24,10}] | L154: =R[-1]C -> [{7,27},{8,55},{9,27},{10,55},{11,27},{12,55},{17,18},{18,110},{19,3},{23,37},{24,37}] | M154: =R[-1]C -> [{0,1,[1,30]},{1,2,[11,40]},{2,5,[21,50]},{5,10,[31,60]},{10,20,[41,60]},{30,20,[51,70]},{50,10,[61,80]},{70,5,[71,80]},{100,2,[81,90]},{150,1,[91,100]}]
A155: 152 | B155: 3 | C155: 7 | D155: 1000 | E155: =R[-9]C -> 71 | F155: =R[-9]C -> 80 | G155: 2 | H155: 10000 | I155: 110003 | J155: 2 | K155: =R[-1]C -> [{7,6},{8,4},{9,0},{10,0},{11,0},{12,0},{17,10},{18,8},{19,1},{23,4},{24,10}] | L155: =R[-1]C -> [{7,27},{8,55},{9,27},{10,55},{11,27},{12,55},{17,18},{18,110},{19,3},{23,37},{24,37}] | M155: =R[-1]C -> [{0,1,[1,30]},{1,2,[11,40]},{2,5,[21,50]},{5,10,[31,60]},{10,20,[41,60]},{30,20,[51,70]},{50,10,[61,80]},{70,5,[71,80]},{100,2,[81,90]},{150,1,[91,100]}]
A156: 153 | B156: 3 | C156: 7 | D156: 1000 | E156: =R[-9]C -> 81 | F156: =R[-9]C -> 90 | G156: 2 | H156: 10000 | I156: 110003 | J156: 2 | K156: =R[-1]C -> [{7,6},{8,4},{9,0},{10,0},{11,0},{12,0},{17,10},{18,8},{19,1},{23,4},{24,10}] | L156: =R[-1]C -> [{7,27},{8,55},{9,27},{10,55},{11,27},{12,55},{17,18},{18,110},{19,3},{23,37},{24,37}] | M156: =R[-1]C -> [{0,1,[1,30]},{1,2,[11,40]},{2,5,[21,50]},{5,10,[31,60]},{10,20,[41,60]},{30,20,[51,70]},{50,10,[61,80]},{70,5,[71,80]},{100,2,[81,90]},{150,1,[91,100]}]
A157: 154 | B157: 4 | C157: 7 | D157: 1000 | E157: =R[-9]C -> 1 | F157: =R[-9]C -> 10 | G157: 3 | H157: 15000 | I157: 110003 | J157: 3 | K157: =R[-1]C -> [{7,6},{8,4},{9,0},{10,0},{11,0},{12,0},{17,10},{18,8},{19,1},{23,4},{24,10}] | L157: =R[-1]C -> [{7,27},{8,55},{9,27},{10,55},{11,27},{12,55},{17,18},{18,110},{19,3},{23,37},{24,37}] | M157: =R[-1]C -> [{0,1,[1,30]},{1,2,[11,40]},{2,5,[21,50]},{5,10,[31,60]},{10,20,[41,60]},{30,20,[51,70]},{50,10,[61,80]},{70,5,[71,80]},{100,2,[81,90]},{150,1,[91,100]}]
A158: 155 | B158: 4 | C158: 7 | D158: 1000 | E158: =R[-9]C -> 11 | F158: =R[-9]C -> 20 | G158: 3 | H158: 15000 | I158: 110003 | J158: 3 | K158: =R[-1]C -> [{7,6},{8,4},{9,0},{10,0},{11,0},{12,0},{17,10},{18,8},{19,1},{23,4},{24,10}] | L158: =R[-1]C -> [{7,27},{8,55},{9,27},{10,55},{11,27},{12,55},{17,18},{18,110},{19,3},{23,37},{24,37}] | M158: =R[-1]C -> [{0,1,[1,30]},{1,2,[11,40]},{2,5,[21,50]},{5,10,[31,60]},{10,20,[41,60]},{30,20,[51,70]},{50,10,[61,80]},{70,5,[71,80]},{100,2,[81,90]},{150,1,[91,100]}]
A159: 156 | B159: 4 | C159: 7 | D159: 1000 | E159: =R[-9]C -> 21 | F159: =R[-9]C -> 30 | G159: 3 | H159: 15000 | I159: 110003 | J159: 3 | K159: =R[-1]C -> [{7,6},{8,4},{9,0},{10,0},{11,0},{12,0},{17,10},{18,8},{19,1},{23,4},{24,10}] | L159: =R[-1]C -> [{7,27},{8,55},{9,27},{10,55},{11,27},{12,55},{17,18},{18,110},{19,3},{23,37},{24,37}] | M159: =R[-1]C -> [{0,1,[1,30]},{1,2,[11,40]},{2,5,[21,50]},{5,10,[31,60]},{10,20,[41,60]},{30,20,[51,70]},{50,10,[61,80]},{70,5,[71,80]},{100,2,[81,90]},{150,1,[91,100]}]
A160: 157 | B160: 4 | C160: 7 | D160: 1000 | E160: =R[-9]C -> 31 | F160: =R[-9]C -> 40 | G160: 3 | H160: 15000 | I160: 110003 | J160: 3 | K160: =R[-1]C -> [{7,6},{8,4},{9,0},{10,0},{11,0},{12,0},{17,10},{18,8},{19,1},{23,4},{24,10}] | L160: =R[-1]C -> [{7,27},{8,55},{9,27},{10,55},{11,27},{12,55},{17,18},{18,110},{19,3},{23,37},{24,37}] | M160: =R[-1]C -> [{0,1,[1,30]},{1,2,[11,40]},{2,5,[21,50]},{5,10,[31,60]},{10,20,[41,60]},{30,20,[51,70]},{50,10,[61,80]},{70,5,[71,80]},{100,2,[81,90]},{150,1,[91,100]}]
A161: 158 | B161: 4 | C161: 7 | D161: 1000 | E161: =R[-9]C -> 41 | F161: =R[-9]C -> 50 | G161: 3 | H161: 15000 | I161: 110003 | J161: 3 | K161: =R[-1]C -> [{7,6},{8,4},{9,0},{10,0},{11,0},{12,0},{17,10},{18,8},{19,1},{23,4},{24,10}] | L161: =R[-1]C -> [{7,27},{8,55},{9,27},{10,55},{11,27},{12,55},{17,18},{18,110},{19,3},{23,37},{24,37}] | M161: =R[-1]C -> [{0,1,[1,30]},{1,2,[11,40]},{2,5,[21,50]},{5,10,[31,60]},{10,20,[41,60]},{30,20,[51,70]},{50,10,[61,80]},{70,5,[71,80]},{100,2,[81,90]},{150,1,[91,100]}]
A162: 159 | B162: 4 | C162: 7 | D162: 1000 | E162: =R[-9]C -> 51 | F162: =R[-9]C -> 60 | G162: 3 | H162: 15000 | I162: 110003 | J162: 3 | K162: =R[-1]C -> [{7,6},{8,4},{9,0},{10,0},{11,0},{12,0},{17,10},{18,8},{19,1},{23,4},{24,10}] | L162: =R[-1]C -> [{7,27},{8,55},{9,27},{10,55},{11,27},{12,55},{17,18},{18,110},{19,3},{23,37},{24,37}] | M162: =R[-1]C -> [{0,1,[1,30]},{1,2,[11,40]},{2,5,[21,50]},{5,10,[31,60]},{10,20,[41,60]},{30,20,[51,70]},{50,10,[61,80]},{70,5,[71,80]},{100,2,[81,90]},{150,1,[91,100]}]
A163: 160 | B163: 4 | C163: 7 | D163: 1000 | E163: =R[-9]C -> 61 | F163: =R[-9]C -> 70 | G163: 3 | H163: 15000 | I163: 110003 | J163: 3 | K163: =R[-1]C -> [{7,6},{8,4},{9,0},{10,0},{11,0},{12,0},{17,10},{18,8},{19,1},{23,4},{24,10}] | L163: =R[-1]C -> [{7,27},{8,55},{9,27},{10,55},{11,27},{12,55},{17,18},{18,110},{19,3},{23,37},{24,37}] | M163: =R[-1]C -> [{0,1,[1,30]},{1,2,[11,40]},{2,5,[21,50]},{5,10,[31,60]},{10,20,[41,60]},{30,20,[51,70]},{50,10,[61,80]},{70,5,[71,80]},{100,2,[81,90]},{150,1,[91,100]}]
A164: 161 | B164: 4 | C164: 7 | D164: 1000 | E164: =R[-9]C -> 71 | F164: =R[-9]C -> 80 | G164: 3 | H164: 15000 | I164: 110003 | J164: 3 | K164: =R[-1]C -> [{7,6},{8,4},{9,0},{10,0},{11,0},{12,0},{17,10},{18,8},{19,1},{23,4},{24,10}] | L164: =R[-1]C -> [{7,27},{8,55},{9,27},{10,55},{11,27},{12,55},{17,18},{18,110},{19,3},{23,37},{24,37}] | M164: =R[-1]C -> [{0,1,[1,30]},{1,2,[11,40]},{2,5,[21,50]},{5,10,[31,60]},{10,20,[41,60]},{30,20,[51,70]},{50,10,[61,80]},{70,5,[71,80]},{100,2,[81,90]},{150,1,[91,100]}]
A165: 162 | B165: 4 | C165: 7 | D165: 1000 | E165: =R[-9]C -> 81 | F165: =R[-9]C -> 90 | G165: 3 | H165: 15000 | I165: 110003 | J165: 3 | K165: =R[-1]C -> [{7,6},{8,4},{9,0},{10,0},{11,0},{12,0},{17,10},{18,8},{19,1},{23,4},{24,10}] | L165: =R[-1]C -> [{7,27},{8,55},{9,27},{10,55},{11,27},{12,55},{17,18},{18,110},{19,3},{23,37},{24,37}] | M165: =R[-1]C -> [{0,1,[1,30]},{1,2,[11,40]},{2,5,[21,50]},{5,10,[31,60]},{10,20,[41,60]},{30,20,[51,70]},{50,10,[61,80]},{70,5,[71,80]},{100,2,[81,90]},{150,1,[91,100]}]
A166: 163 | B166: 5 | C166: 7 | D166: 1000 | E166: =R[-9]C -> 1 | F166: =R[-9]C -> 10 | G166: 4 | H166: 20000 | I166: 110003 | J166: 4 | K166: =R[-1]C -> [{7,6},{8,4},{9,0},{10,0},{11,0},{12,0},{17,10},{18,8},{19,1},{23,4},{24,10}] | L166: =R[-1]C -> [{7,27},{8,55},{9,27},{10,55},{11,27},{12,55},{17,18},{18,110},{19,3},{23,37},{24,37}] | M166: =R[-1]C -> [{0,1,[1,30]},{1,2,[11,40]},{2,5,[21,50]},{5,10,[31,60]},{10,20,[41,60]},{30,20,[51,70]},{50,10,[61,80]},{70,5,[71,80]},{100,2,[81,90]},{150,1,[91,100]}]
A167: 164 | B167: 5 | C167: 7 | D167: 1000 | E167: =R[-9]C -> 11 | F167: =R[-9]C -> 20 | G167: 4 | H167: 20000 | I167: 110003 | J167: 4 | K167: =R[-1]C -> [{7,6},{8,4},{9,0},{10,0},{11,0},{12,0},{17,10},{18,8},{19,1},{23,4},{24,10}] | L167: =R[-1]C -> [{7,27},{8,55},{9,27},{10,55},{11,27},{12,55},{17,18},{18,110},{19,3},{23,37},{24,37}] | M167: =R[-1]C -> [{0,1,[1,30]},{1,2,[11,40]},{2,5,[21,50]},{5,10,[31,60]},{10,20,[41,60]},{30,20,[51,70]},{50,10,[61,80]},{70,5,[71,80]},{100,2,[81,90]},{150,1,[91,100]}]
A168: 165 | B168: 5 | C168: 7 | D168: 1000 | E168: =R[-9]C -> 21 | F168: =R[-9]C -> 30 | G168: 4 | H168: 20000 | I168: 110003 | J168: 4 | K168: =R[-1]C -> [{7,6},{8,4},{9,0},{10,0},{11,0},{12,0},{17,10},{18,8},{19,1},{23,4},{24,10}] | L168: =R[-1]C -> [{7,27},{8,55},{9,27},{10,55},{11,27},{12,55},{17,18},{18,110},{19,3},{23,37},{24,37}] | M168: =R[-1]C -> [{0,1,[1,30]},{1,2,[11,40]},{2,5,[21,50]},{5,10,[31,60]},{10,20,[41,60]},{30,20,[51,70]},{50,10,[61,80]},{70,5,[71,80]},{100,2,[81,90]},{150,1,[91,100]}]
A169: 166 | B169: 5 | C169: 7 | D169: 1000 | E169: =R[-9]C -> 31 | F169: =R[-9]C -> 40 | G169: 4 | H169: 20000 | I169: 110003 | J169: 4 | K169: =R[-1]C -> [{7,6},{8,4},{9,0},{10,0},{11,0},{12,0},{17,10},{18,8},{19,1},{23,4},{24,10}] | L169: =R[-1]C -> [{7,27},{8,55},{9,27},{10,55},{11,27},{12,55},{17,18},{18,110},{19,3},{23,37},{24,37}] | M169: =R[-1]C -> [{0,1,[1,30]},{1,2,[11,40]},{2,5,[21,50]},{5,10,[31,60]},{10,20,[41,60]},{30,20,[51,70]},{50,10,[61,80]},{70,5,[71,80]},{100,2,[81,90]},{150,1,[91,100]}]
A170: 167 | B170: 5 | C170: 7 | D170: 1000 | E170: =R[-9]C -> 41 | F170: =R[-9]C -> 50 | G170: 4 | H170: 20000 | I170: 110003 | J170: 4 | K170: =R[-1]C -> [{7,6},{8,4},{9,0},{10,0},{11,0},{12,0},{17,10},{18,8},{19,1},{23,4},{24,10}] | L170: =R[-1]C -> [{7,27},{8,55},{9,27},{10,55},{11,27},{12,55},{17,18},{18,110},{19,3},{23,37},{24,37}] | M170: =R[-1]C -> [{0,1,[1,30]},{1,2,[11,40]},{2,5,[21,50]},{5,10,[31,60]},{10,20,[41,60]},{30,20,[51,70]},{50,10,[61,80]},{70,5,[71,80]},{100,2,[81,90]},{150,1,[91,100]}]
A171: 168 | B171: 5 | C171: 7 | D171: 1000 | E171: =R[-9]C -> 51 | F171: =R[-9]C -> 60 | G171: 4 | H171: 20000 | I171: 110003 | J171: 4 | K171: =R[-1]C -> [{7,6},{8,4},{9,0},{10,0},{11,0},{12,0},{17,10},{18,8},{19,1},{23,4},{24,10}] | L171: =R[-1]C -> [{7,27},{8,55},{9,27},{10,55},{11,27},{12,55},{17,18},{18,110},{19,3},{23,37},{24,37}] | M171: =R[-1]C -> [{0,1,[1,30]},{1,2,[11,40]},{2,5,[21,50]},{5,10,[31,60]},{10,20,[41,60]},{30,20,[51,70]},{50,10,[61,80]},{70,5,[71,80]},{100,2,[81,90]},{150,1,[91,100]}]
A172: 169 | B172: 5 | C172: 7 | D172: 1000 | E172: =R[-9]C -> 61 | F172: =R[-9]C -> 70 | G172: 4 | H172: 20000 | I172: 110003 | J172: 4 | K172: =R[-1]C -> [{7,6},{8,4},{9,0},{10,0},{11,0},{12,0},{17,10},{18,8},{19,1},{23,4},{24,10}] | L172: =R[-1]C -> [{7,27},{8,55},{9,27},{10,55},{11,27},{12,55},{17,18},{18,110},{19,3},{23,37},{24,37}] | M172: =R[-1]C -> [{0,1,[1,30]},{1,2,[11,40]},{2,5,[21,50]},{5,10,[31,60]},{10,20,[41,60]},{30,20,[51,70]},{50,10,[61,80]},{70,5,[71,80]},{100,2,[81,90]},{150,1,[91,100]}]
A173: 170 | B173: 5 | C173: 7 | D173: 1000 | E173: =R[-9]C -> 71 | F173: =R[-9]C -> 80 | G173: 4 | H173: 20000 | I173: 110003 | J173: 4 | K173: =R[-1]C -> [{7,6},{8,4},{9,0},{10,0},{11,0},{12,0},{17,10},{18,8},{19,1},{23,4},{24,10}] | L173: =R[-1]C -> [{7,27},{8,55},{9,27},{10,55},{11,27},{12,55},{17,18},{18,110},{19,3},{23,37},{24,37}] | M173: =R[-1]C -> [{0,1,[1,30]},{1,2,[11,40]},{2,5,[21,50]},{5,10,[31,60]},{10,20,[41,60]},{30,20,[51,70]},{50,10,[61,80]},{70,5,[71,80]},{100,2,[81,90]},{150,1,[91,100]}]
A174: 171 | B174: 5 | C174: 7 | D174: 1000 | E174: =R[-9]C -> 81 | F174: =R[-9]C -> 90 | G174: 4 | H174: 20000 | I174: 110003 | J174: 4 | K174: =R[-1]C -> [{7,6},{8,4},{9,0},{10,0},{11,0},{12,0},{17,10},{18,8},{19,1},{23,4},{24,10}] | L174: =R[-1]C -> [{7,27},{8,55},{9,27},{10,55},{11,27},{12,55},{17,18},{18,110},{19,3},{23,37},{24,37}] | M174: =R[-1]C -> [{0,1,[1,30]},{1,2,[11,40]},{2,5,[21,50]},{5,10,[31,60]},{10,20,[41,60]},{30,20,[51,70]},{50,10,[61,80]},{70,5,[71,80]},{100,2,[81,90]},{150,1,[91,100]}]
A175: 172 | B175: 6 | C175: 7 | D175: 1000 | E175: =R[-9]C -> 1 | F175: =R[-9]C -> 10 | G175: 5 | H175: 20000 | I175: 110003 | J175: 5 | K175: =R[-1]C -> [{7,6},{8,4},{9,0},{10,0},{11,0},{12,0},{17,10},{18,8},{19,1},{23,4},{24,10}] | L175: =R[-1]C -> [{7,27},{8,55},{9,27},{10,55},{11,27},{12,55},{17,18},{18,110},{19,3},{23,37},{24,37}] | M175: =R[-1]C -> [{0,1,[1,30]},{1,2,[11,40]},{2,5,[21,50]},{5,10,[31,60]},{10,20,[41,60]},{30,20,[51,70]},{50,10,[61,80]},{70,5,[71,80]},{100,2,[81,90]},{150,1,[91,100]}]
A176: 173 | B176: 6 | C176: 7 | D176: 1000 | E176: =R[-9]C -> 11 | F176: =R[-9]C -> 20 | G176: 5 | H176: 20000 | I176: 110003 | J176: 5 | K176: =R[-1]C -> [{7,6},{8,4},{9,0},{10,0},{11,0},{12,0},{17,10},{18,8},{19,1},{23,4},{24,10}] | L176: =R[-1]C -> [{7,27},{8,55},{9,27},{10,55},{11,27},{12,55},{17,18},{18,110},{19,3},{23,37},{24,37}] | M176: =R[-1]C -> [{0,1,[1,30]},{1,2,[11,40]},{2,5,[21,50]},{5,10,[31,60]},{10,20,[41,60]},{30,20,[51,70]},{50,10,[61,80]},{70,5,[71,80]},{100,2,[81,90]},{150,1,[91,100]}]
A177: 174 | B177: 6 | C177: 7 | D177: 1000 | E177: =R[-9]C -> 21 | F177: =R[-9]C -> 30 | G177: 5 | H177: 20000 | I177: 110003 | J177: 5 | K177: =R[-1]C -> [{7,6},{8,4},{9,0},{10,0},{11,0},{12,0},{17,10},{18,8},{19,1},{23,4},{24,10}] | L177: =R[-1]C -> [{7,27},{8,55},{9,27},{10,55},{11,27},{12,55},{17,18},{18,110},{19,3},{23,37},{24,37}] | M177: =R[-1]C -> [{0,1,[1,30]},{1,2,[11,40]},{2,5,[21,50]},{5,10,[31,60]},{10,20,[41,60]},{30,20,[51,70]},{50,10,[61,80]},{70,5,[71,80]},{100,2,[81,90]},{150,1,[91,100]}]
A178: 175 | B178: 6 | C178: 7 | D178: 1000 | E178: =R[-9]C -> 31 | F178: =R[-9]C -> 40 | G178: 5 | H178: 20000 | I178: 110003 | J178: 5 | K178: =R[-1]C -> [{7,6},{8,4},{9,0},{10,0},{11,0},{12,0},{17,10},{18,8},{19,1},{23,4},{24,10}] | L178: =R[-1]C -> [{7,27},{8,55},{9,27},{10,55},{11,27},{12,55},{17,18},{18,110},{19,3},{23,37},{24,37}] | M178: =R[-1]C -> [{0,1,[1,30]},{1,2,[11,40]},{2,5,[21,50]},{5,10,[31,60]},{10,20,[41,60]},{30,20,[51,70]},{50,10,[61,80]},{70,5,[71,80]},{100,2,[81,90]},{150,1,[91,100]}]
A179: 176 | B179: 6 | C179: 7 | D179: 1000 | E179: =R[-9]C -> 41 | F179: =R[-9]C -> 50 | G179: 5 | H179: 20000 | I179: 110003 | J179: 5 | K179: =R[-1]C -> [{7,6},{8,4},{9,0},{10,0},{11,0},{12,0},{17,10},{18,8},{19,1},{23,4},{24,10}] | L179: =R[-1]C -> [{7,27},{8,55},{9,27},{10,55},{11,27},{12,55},{17,18},{18,110},{19,3},{23,37},{24,37}] | M179: =R[-1]C -> [{0,1,[1,30]},{1,2,[11,40]},{2,5,[21,50]},{5,10,[31,60]},{10,20,[41,60]},{30,20,[51,70]},{50,10,[61,80]},{70,5,[71,80]},{100,2,[81,90]},{150,1,[91,100]}]
A180: 177 | B180: 6 | C180: 7 | D180: 1000 | E180: =R[-9]C -> 51 | F180: =R[-9]C -> 60 | G180: 5 | H180: 20000 | I180: 110003 | J180: 5 | K180: =R[-1]C -> [{7,6},{8,4},{9,0},{10,0},{11,0},{12,0},{17,10},{18,8},{19,1},{23,4},{24,10}] | L180: =R[-1]C -> [{7,27},{8,55},{9,27},{10,55},{11,27},{12,55},{17,18},{18,110},{19,3},{23,37},{24,37}] | M180: =R[-1]C -> [{0,1,[1,30]},{1,2,[11,40]},{2,5,[21,50]},{5,10,[31,60]},{10,20,[41,60]},{30,20,[51,70]},{50,10,[61,80]},{70,5,[71,80]},{100,2,[81,90]},{150,1,[91,100]}]
A181: 178 | B181: 6 | C181: 7 | D181: 1000 | E181: =R[-9]C -> 61 | F181: =R[-9]C -> 70 | G181: 5 | H181: 20000 | I181: 110003 | J181: 5 | K181: =R[-1]C -> [{7,6},{8,4},{9,0},{10,0},{11,0},{12,0},{17,10},{18,8},{19,1},{23,4},{24,10}] | L181: =R[-1]C -> [{7,27},{8,55},{9,27},{10,55},{11,27},{12,55},{17,18},{18,110},{19,3},{23,37},{24,37}] | M181: =R[-1]C -> [{0,1,[1,30]},{1,2,[11,40]},{2,5,[21,50]},{5,10,[31,60]},{10,20,[41,60]},{30,20,[51,70]},{50,10,[61,80]},{70,5,[71,80]},{100,2,[81,90]},{150,1,[91,100]}]
A182: 179 | B182: 6 | C182: 7 | D182: 1000 | E182: =R[-9]C -> 71 | F182: =R[-9]C -> 80 | G182: 5 | H182: 20000 | I182: 110003 | J182: 5 | K182: =R[-1]C -> [{7,6},{8,4},{9,0},{10,0},{11,0},{12,0},{17,10},{18,8},{19,1},{23,4},{24,10}] | L182: =R[-1]C -> [{7,27},{8,55},{9,27},{10,55},{11,27},{12,55},{17,18},{18,110},{19,3},{23,37},{24,37}] | M182: =R[-1]C -> [{0,1,[1,30]},{1,2,[11,40]},{2,5,[21,50]},{5,10,[31,60]},{10,20,[41,60]},{30,20,[51,70]},{50,10,[61,80]},{70,5,[71,80]},{100,2,[81,90]},{150,1,[91,100]}]
A183: 180 | B183: 6 | C183: 7 | D183: 1000 | E183: =R[-9]C -> 81 | F183: =R[-9]C -> 90 | G183: 5 | H183: 20000 | I183: 110003 | J183: 5 | K183: =R[-1]C -> [{7,6},{8,4},{9,0},{10,0},{11,0},{12,0},{17,10},{18,8},{19,1},{23,4},{24,10}] | L183: =R[-1]C -> [{7,27},{8,55},{9,27},{10,55},{11,27},{12,55},{17,18},{18,110},{19,3},{23,37},{24,37}] | M183: =R[-1]C -> [{0,1,[1,30]},{1,2,[11,40]},{2,5,[21,50]},{5,10,[31,60]},{10,20,[41,60]},{30,20,[51,70]},{50,10,[61,80]},{70,5,[71,80]},{100,2,[81,90]},{150,1,[91,100]}]
A184: 181 | B184: 2 | C184: 1 | D184: 2000 | E184: 1 | F184: 10 | G184: 1 | H184: 5000 | I184: 110003 | J184: 1 | K184: =配置模型!R15C -> [{7,0},{8,0},{9,6},{10,4},{11,0},{12,0},{17,10},{18,8},{19,1},{23,4},{24,10}] | L184: =R[-10]C -> [{7,27},{8,55},{9,27},{10,55},{11,27},{12,55},{17,18},{18,110},{19,3},{23,37},{24,37}] | M184: =R[-10]C -> [{0,1,[1,30]},{1,2,[11,40]},{2,5,[21,50]},{5,10,[31,60]},{10,20,[41,60]},{30,20,[51,70]},{50,10,[61,80]},{70,5,[71,80]},{100,2,[81,90]},{150,1,[91,100]}]
A185: 182 | B185: 2 | C185: 1 | D185: 2000 | E185: =R[-1]C+10 -> 11 | F185: =R[-1]C+10 -> 20 | G185: 1 | H185: 5000 | I185: 110003 | J185: 1 | K185: =R[-1]C -> [{7,0},{8,0},{9,6},{10,4},{11,0},{12,0},{17,10},{18,8},{19,1},{23,4},{24,10}] | L185: =R[-1]C -> [{7,27},{8,55},{9,27},{10,55},{11,27},{12,55},{17,18},{18,110},{19,3},{23,37},{24,37}] | M185: =R[-1]C -> [{0,1,[1,30]},{1,2,[11,40]},{2,5,[21,50]},{5,10,[31,60]},{10,20,[41,60]},{30,20,[51,70]},{50,10,[61,80]},{70,5,[71,80]},{100,2,[81,90]},{150,1,[91,100]}]
A186: 183 | B186: 2 | C186: 1 | D186: 2000 | E186: =R[-1]C+10 -> 21 | F186: =R[-1]C+10 -> 30 | G186: 1 | H186: 5000 | I186: 110003 | J186: 1 | K186: =R[-1]C -> [{7,0},{8,0},{9,6},{10,4},{11,0},{12,0},{17,10},{18,8},{19,1},{23,4},{24,10}] | L186: =R[-1]C -> [{7,27},{8,55},{9,27},{10,55},{11,27},{12,55},{17,18},{18,110},{19,3},{23,37},{24,37}] | M186: =R[-1]C -> [{0,1,[1,30]},{1,2,[11,40]},{2,5,[21,50]},{5,10,[31,60]},{10,20,[41,60]},{30,20,[51,70]},{50,10,[61,80]},{70,5,[71,80]},{100,2,[81,90]},{150,1,[91,100]}]
A187: 184 | B187: 2 | C187: 1 | D187: 2000 | E187: =R[-1]C+10 -> 31 | F187: =R[-1]C+10 -> 40 | G187: 1 | H187: 5000 | I187: 110003 | J187: 1 | K187: =R[-1]C -> [{7,0},{8,0},{9,6},{10,4},{11,0},{12,0},{17,10},{18,8},{19,1},{23,4},{24,10}] | L187: =R[-1]C -> [{7,27},{8,55},{9,27},{10,55},{11,27},{12,55},{17,18},{18,110},{19,3},{23,37},{24,37}] | M187: =R[-1]C -> [{0,1,[1,30]},{1,2,[11,40]},{2,5,[21,50]},{5,10,[31,60]},{10,20,[41,60]},{30,20,[51,70]},{50,10,[61,80]},{70,5,[71,80]},{100,2,[81,90]},{150,1,[91,100]}]
A188: 185 | B188: 2 | C188: 1 | D188: 2000 | E188: =R[-1]C+10 -> 41 | F188: =R[-1]C+10 -> 50 | G188: 1 | H188: 5000 | I188: 110003 | J188: 1 | K188: =R[-1]C -> [{7,0},{8,0},{9,6},{10,4},{11,0},{12,0},{17,10},{18,8},{19,1},{23,4},{24,10}] | L188: =R[-1]C -> [{7,27},{8,55},{9,27},{10,55},{11,27},{12,55},{17,18},{18,110},{19,3},{23,37},{24,37}] | M188: =R[-1]C -> [{0,1,[1,30]},{1,2,[11,40]},{2,5,[21,50]},{5,10,[31,60]},{10,20,[41,60]},{30,20,[51,70]},{50,10,[61,80]},{70,5,[71,80]},{100,2,[81,90]},{150,1,[91,100]}]
A189: 186 | B189: 2 | C189: 1 | D189: 2000 | E189: =R[-1]C+10 -> 51 | F189: =R[-1]C+10 -> 60 | G189: 1 | H189: 5000 | I189: 110003 | J189: 1 | K189: =R[-1]C -> [{7,0},{8,0},{9,6},{10,4},{11,0},{12,0},{17,10},{18,8},{19,1},{23,4},{24,10}] | L189: =R[-1]C -> [{7,27},{8,55},{9,27},{10,55},{11,27},{12,55},{17,18},{18,110},{19,3},{23,37},{24,37}] | M189: =R[-1]C -> [{0,1,[1,30]},{1,2,[11,40]},{2,5,[21,50]},{5,10,[31,60]},{10,20,[41,60]},{30,20,[51,70]},{50,10,[61,80]},{70,5,[71,80]},{100,2,[81,90]},{150,1,[91,100]}]
A190: 187 | B190: 2 | C190: 1 | D190: 2000 | E190: =R[-1]C+10 -> 61 | F190: =R[-1]C+10 -> 70 | G190: 1 | H190: 5000 | I190: 110003 | J190: 1 | K190: =R[-1]C -> [{7,0},{8,0},{9,6},{10,4},{11,0},{12,0},{17,10},{18,8},{19,1},{23,4},{24,10}] | L190: =R[-1]C -> [{7,27},{8,55},{9,27},{10,55},{11,27},{12,55},{17,18},{18,110},{19,3},{23,37},{24,37}] | M190: =R[-1]C -> [{0,1,[1,30]},{1,2,[11,40]},{2,5,[21,50]},{5,10,[31,60]},{10,20,[41,60]},{30,20,[51,70]},{50,10,[61,80]},{70,5,[71,80]},{100,2,[81,90]},{150,1,[91,100]}]
A191: 188 | B191: 2 | C191: 1 | D191: 2000 | E191: =R[-1]C+10 -> 71 | F191: =R[-1]C+10 -> 80 | G191: 1 | H191: 5000 | I191: 110003 | J191: 1 | K191: =R[-1]C -> [{7,0},{8,0},{9,6},{10,4},{11,0},{12,0},{17,10},{18,8},{19,1},{23,4},{24,10}] | L191: =R[-1]C -> [{7,27},{8,55},{9,27},{10,55},{11,27},{12,55},{17,18},{18,110},{19,3},{23,37},{24,37}] | M191: =R[-1]C -> [{0,1,[1,30]},{1,2,[11,40]},{2,5,[21,50]},{5,10,[31,60]},{10,20,[41,60]},{30,20,[51,70]},{50,10,[61,80]},{70,5,[71,80]},{100,2,[81,90]},{150,1,[91,100]}]
A192: 189 | B192: 2 | C192: 1 | D192: 2000 | E192: =R[-1]C+10 -> 81 | F192: =R[-1]C+10 -> 90 | G192: 1 | H192: 5000 | I192: 110003 | J192: 1 | K192: =R[-1]C -> [{7,0},{8,0},{9,6},{10,4},{11,0},{12,0},{17,10},{18,8},{19,1},{23,4},{24,10}] | L192: =R[-1]C -> [{7,27},{8,55},{9,27},{10,55},{11,27},{12,55},{17,18},{18,110},{19,3},{23,37},{24,37}] | M192: =R[-1]C -> [{0,1,[1,30]},{1,2,[11,40]},{2,5,[21,50]},{5,10,[31,60]},{10,20,[41,60]},{30,20,[51,70]},{50,10,[61,80]},{70,5,[71,80]},{100,2,[81,90]},{150,1,[91,100]}]
A193: 190 | B193: 3 | C193: 1 | D193: 2000 | E193: =R[-9]C -> 1 | F193: =R[-9]C -> 10 | G193: 2 | H193: 10000 | I193: 110003 | J193: 2 | K193: =R[-1]C -> [{7,0},{8,0},{9,6},{10,4},{11,0},{12,0},{17,10},{18,8},{19,1},{23,4},{24,10}] | L193: =R[-1]C -> [{7,27},{8,55},{9,27},{10,55},{11,27},{12,55},{17,18},{18,110},{19,3},{23,37},{24,37}] | M193: =R[-1]C -> [{0,1,[1,30]},{1,2,[11,40]},{2,5,[21,50]},{5,10,[31,60]},{10,20,[41,60]},{30,20,[51,70]},{50,10,[61,80]},{70,5,[71,80]},{100,2,[81,90]},{150,1,[91,100]}]
A194: 191 | B194: 3 | C194: 1 | D194: 2000 | E194: =R[-9]C -> 11 | F194: =R[-9]C -> 20 | G194: 2 | H194: 10000 | I194: 110003 | J194: 2 | K194: =R[-1]C -> [{7,0},{8,0},{9,6},{10,4},{11,0},{12,0},{17,10},{18,8},{19,1},{23,4},{24,10}] | L194: =R[-1]C -> [{7,27},{8,55},{9,27},{10,55},{11,27},{12,55},{17,18},{18,110},{19,3},{23,37},{24,37}] | M194: =R[-1]C -> [{0,1,[1,30]},{1,2,[11,40]},{2,5,[21,50]},{5,10,[31,60]},{10,20,[41,60]},{30,20,[51,70]},{50,10,[61,80]},{70,5,[71,80]},{100,2,[81,90]},{150,1,[91,100]}]
A195: 192 | B195: 3 | C195: 1 | D195: 2000 | E195: =R[-9]C -> 21 | F195: =R[-9]C -> 30 | G195: 2 | H195: 10000 | I195: 110003 | J195: 2 | K195: =R[-1]C -> [{7,0},{8,0},{9,6},{10,4},{11,0},{12,0},{17,10},{18,8},{19,1},{23,4},{24,10}] | L195: =R[-1]C -> [{7,27},{8,55},{9,27},{10,55},{11,27},{12,55},{17,18},{18,110},{19,3},{23,37},{24,37}] | M195: =R[-1]C -> [{0,1,[1,30]},{1,2,[11,40]},{2,5,[21,50]},{5,10,[31,60]},{10,20,[41,60]},{30,20,[51,70]},{50,10,[61,80]},{70,5,[71,80]},{100,2,[81,90]},{150,1,[91,100]}]
A196: 193 | B196: 3 | C196: 1 | D196: 2000 | E196: =R[-9]C -> 31 | F196: =R[-9]C -> 40 | G196: 2 | H196: 10000 | I196: 110003 | J196: 2 | K196: =R[-1]C -> [{7,0},{8,0},{9,6},{10,4},{11,0},{12,0},{17,10},{18,8},{19,1},{23,4},{24,10}] | L196: =R[-1]C -> [{7,27},{8,55},{9,27},{10,55},{11,27},{12,55},{17,18},{18,110},{19,3},{23,37},{24,37}] | M196: =R[-1]C -> [{0,1,[1,30]},{1,2,[11,40]},{2,5,[21,50]},{5,10,[31,60]},{10,20,[41,60]},{30,20,[51,70]},{50,10,[61,80]},{70,5,[71,80]},{100,2,[81,90]},{150,1,[91,100]}]
A197: 194 | B197: 3 | C197: 1 | D197: 2000 | E197: =R[-9]C -> 41 | F197: =R[-9]C -> 50 | G197: 2 | H197: 10000 | I197: 110003 | J197: 2 | K197: =R[-1]C -> [{7,0},{8,0},{9,6},{10,4},{11,0},{12,0},{17,10},{18,8},{19,1},{23,4},{24,10}] | L197: =R[-1]C -> [{7,27},{8,55},{9,27},{10,55},{11,27},{12,55},{17,18},{18,110},{19,3},{23,37},{24,37}] | M197: =R[-1]C -> [{0,1,[1,30]},{1,2,[11,40]},{2,5,[21,50]},{5,10,[31,60]},{10,20,[41,60]},{30,20,[51,70]},{50,10,[61,80]},{70,5,[71,80]},{100,2,[81,90]},{150,1,[91,100]}]
A198: 195 | B198: 3 | C198: 1 | D198: 2000 | E198: =R[-9]C -> 51 | F198: =R[-9]C -> 60 | G198: 2 | H198: 10000 | I198: 110003 | J198: 2 | K198: =R[-1]C -> [{7,0},{8,0},{9,6},{10,4},{11,0},{12,0},{17,10},{18,8},{19,1},{23,4},{24,10}] | L198: =R[-1]C -> [{7,27},{8,55},{9,27},{10,55},{11,27},{12,55},{17,18},{18,110},{19,3},{23,37},{24,37}] | M198: =R[-1]C -> [{0,1,[1,30]},{1,2,[11,40]},{2,5,[21,50]},{5,10,[31,60]},{10,20,[41,60]},{30,20,[51,70]},{50,10,[61,80]},{70,5,[71,80]},{100,2,[81,90]},{150,1,[91,100]}]
A199: 196 | B199: 3 | C199: 1 | D199: 2000 | E199: =R[-9]C -> 61 | F199: =R[-9]C -> 70 | G199: 2 | H199: 10000 | I199: 110003 | J199: 2 | K199: =R[-1]C -> [{7,0},{8,0},{9,6},{10,4},{11,0},{12,0},{17,10},{18,8},{19,1},{23,4},{24,10}] | L199: =R[-1]C -> [{7,27},{8,55},{9,27},{10,55},{11,27},{12,55},{17,18},{18,110},{19,3},{23,37},{24,37}] | M199: =R[-1]C -> [{0,1,[1,30]},{1,2,[11,40]},{2,5,[21,50]},{5,10,[31,60]},{10,20,[41,60]},{30,20,[51,70]},{50,10,[61,80]},{70,5,[71,80]},{100,2,[81,90]},{150,1,[91,100]}]
A200: 197 | B200: 3 | C200: 1 | D200: 2000 | E200: =R[-9]C -> 71 | F200: =R[-9]C -> 80 | G200: 2 | H200: 10000 | I200: 110003 | J200: 2 | K200: =R[-1]C -> [{7,0},{8,0},{9,6},{10,4},{11,0},{12,0},{17,10},{18,8},{19,1},{23,4},{24,10}] | L200: =R[-1]C -> [{7,27},{8,55},{9,27},{10,55},{11,27},{12,55},{17,18},{18,110},{19,3},{23,37},{24,37}] | M200: =R[-1]C -> [{0,1,[1,30]},{1,2,[11,40]},{2,5,[21,50]},{5,10,[31,60]},{10,20,[41,60]},{30,20,[51,70]},{50,10,[61,80]},{70,5,[71,80]},{100,2,[81,90]},{150,1,[91,100]}]
A201: 198 | B201: 3 | C201: 1 | D201: 2000 | E201: =R[-9]C -> 81 | F201: =R[-9]C -> 90 | G201: 2 | H201: 10000 | I201: 110003 | J201: 2 | K201: =R[-1]C -> [{7,0},{8,0},{9,6},{10,4},{11,0},{12,0},{17,10},{18,8},{19,1},{23,4},{24,10}] | L201: =R[-1]C -> [{7,27},{8,55},{9,27},{10,55},{11,27},{12,55},{17,18},{18,110},{19,3},{23,37},{24,37}] | M201: =R[-1]C -> [{0,1,[1,30]},{1,2,[11,40]},{2,5,[21,50]},{5,10,[31,60]},{10,20,[41,60]},{30,20,[51,70]},{50,10,[61,80]},{70,5,[71,80]},{100,2,[81,90]},{150,1,[91,100]}]
A202: 199 | B202: 4 | C202: 1 | D202: 2000 | E202: =R[-9]C -> 1 | F202: =R[-9]C -> 10 | G202: 3 | H202: 15000 | I202: 110003 | J202: 3 | K202: =R[-1]C -> [{7,0},{8,0},{9,6},{10,4},{11,0},{12,0},{17,10},{18,8},{19,1},{23,4},{24,10}] | L202: =R[-1]C -> [{7,27},{8,55},{9,27},{10,55},{11,27},{12,55},{17,18},{18,110},{19,3},{23,37},{24,37}] | M202: =R[-1]C -> [{0,1,[1,30]},{1,2,[11,40]},{2,5,[21,50]},{5,10,[31,60]},{10,20,[41,60]},{30,20,[51,70]},{50,10,[61,80]},{70,5,[71,80]},{100,2,[81,90]},{150,1,[91,100]}]
A203: 200 | B203: 4 | C203: 1 | D203: 2000 | E203: =R[-9]C -> 11 | F203: =R[-9]C -> 20 | G203: 3 | H203: 15000 | I203: 110003 | J203: 3 | K203: =R[-1]C -> [{7,0},{8,0},{9,6},{10,4},{11,0},{12,0},{17,10},{18,8},{19,1},{23,4},{24,10}] | L203: =R[-1]C -> [{7,27},{8,55},{9,27},{10,55},{11,27},{12,55},{17,18},{18,110},{19,3},{23,37},{24,37}] | M203: =R[-1]C -> [{0,1,[1,30]},{1,2,[11,40]},{2,5,[21,50]},{5,10,[31,60]},{10,20,[41,60]},{30,20,[51,70]},{50,10,[61,80]},{70,5,[71,80]},{100,2,[81,90]},{150,1,[91,100]}]
A204: 201 | B204: 4 | C204: 1 | D204: 2000 | E204: =R[-9]C -> 21 | F204: =R[-9]C -> 30 | G204: 3 | H204: 15000 | I204: 110003 | J204: 3 | K204: =R[-1]C -> [{7,0},{8,0},{9,6},{10,4},{11,0},{12,0},{17,10},{18,8},{19,1},{23,4},{24,10}] | L204: =R[-1]C -> [{7,27},{8,55},{9,27},{10,55},{11,27},{12,55},{17,18},{18,110},{19,3},{23,37},{24,37}] | M204: =R[-1]C -> [{0,1,[1,30]},{1,2,[11,40]},{2,5,[21,50]},{5,10,[31,60]},{10,20,[41,60]},{30,20,[51,70]},{50,10,[61,80]},{70,5,[71,80]},{100,2,[81,90]},{150,1,[91,100]}]
A205: 202 | B205: 4 | C205: 1 | D205: 2000 | E205: =R[-9]C -> 31 | F205: =R[-9]C -> 40 | G205: 3 | H205: 15000 | I205: 110003 | J205: 3 | K205: =R[-1]C -> [{7,0},{8,0},{9,6},{10,4},{11,0},{12,0},{17,10},{18,8},{19,1},{23,4},{24,10}] | L205: =R[-1]C -> [{7,27},{8,55},{9,27},{10,55},{11,27},{12,55},{17,18},{18,110},{19,3},{23,37},{24,37}] | M205: =R[-1]C -> [{0,1,[1,30]},{1,2,[11,40]},{2,5,[21,50]},{5,10,[31,60]},{10,20,[41,60]},{30,20,[51,70]},{50,10,[61,80]},{70,5,[71,80]},{100,2,[81,90]},{150,1,[91,100]}]
A206: 203 | B206: 4 | C206: 1 | D206: 2000 | E206: =R[-9]C -> 41 | F206: =R[-9]C -> 50 | G206: 3 | H206: 15000 | I206: 110003 | J206: 3 | K206: =R[-1]C -> [{7,0},{8,0},{9,6},{10,4},{11,0},{12,0},{17,10},{18,8},{19,1},{23,4},{24,10}] | L206: =R[-1]C -> [{7,27},{8,55},{9,27},{10,55},{11,27},{12,55},{17,18},{18,110},{19,3},{23,37},{24,37}] | M206: =R[-1]C -> [{0,1,[1,30]},{1,2,[11,40]},{2,5,[21,50]},{5,10,[31,60]},{10,20,[41,60]},{30,20,[51,70]},{50,10,[61,80]},{70,5,[71,80]},{100,2,[81,90]},{150,1,[91,100]}]
A207: 204 | B207: 4 | C207: 1 | D207: 2000 | E207: =R[-9]C -> 51 | F207: =R[-9]C -> 60 | G207: 3 | H207: 15000 | I207: 110003 | J207: 3 | K207: =R[-1]C -> [{7,0},{8,0},{9,6},{10,4},{11,0},{12,0},{17,10},{18,8},{19,1},{23,4},{24,10}] | L207: =R[-1]C -> [{7,27},{8,55},{9,27},{10,55},{11,27},{12,55},{17,18},{18,110},{19,3},{23,37},{24,37}] | M207: =R[-1]C -> [{0,1,[1,30]},{1,2,[11,40]},{2,5,[21,50]},{5,10,[31,60]},{10,20,[41,60]},{30,20,[51,70]},{50,10,[61,80]},{70,5,[71,80]},{100,2,[81,90]},{150,1,[91,100]}]
A208: 205 | B208: 4 | C208: 1 | D208: 2000 | E208: =R[-9]C -> 61 | F208: =R[-9]C -> 70 | G208: 3 | H208: 15000 | I208: 110003 | J208: 3 | K208: =R[-1]C -> [{7,0},{8,0},{9,6},{10,4},{11,0},{12,0},{17,10},{18,8},{19,1},{23,4},{24,10}] | L208: =R[-1]C -> [{7,27},{8,55},{9,27},{10,55},{11,27},{12,55},{17,18},{18,110},{19,3},{23,37},{24,37}] | M208: =R[-1]C -> [{0,1,[1,30]},{1,2,[11,40]},{2,5,[21,50]},{5,10,[31,60]},{10,20,[41,60]},{30,20,[51,70]},{50,10,[61,80]},{70,5,[71,80]},{100,2,[81,90]},{150,1,[91,100]}]
A209: 206 | B209: 4 | C209: 1 | D209: 2000 | E209: =R[-9]C -> 71 | F209: =R[-9]C -> 80 | G209: 3 | H209: 15000 | I209: 110003 | J209: 3 | K209: =R[-1]C -> [{7,0},{8,0},{9,6},{10,4},{11,0},{12,0},{17,10},{18,8},{19,1},{23,4},{24,10}] | L209: =R[-1]C -> [{7,27},{8,55},{9,27},{10,55},{11,27},{12,55},{17,18},{18,110},{19,3},{23,37},{24,37}] | M209: =R[-1]C -> [{0,1,[1,30]},{1,2,[11,40]},{2,5,[21,50]},{5,10,[31,60]},{10,20,[41,60]},{30,20,[51,70]},{50,10,[61,80]},{70,5,[71,80]},{100,2,[81,90]},{150,1,[91,100]}]
A210: 207 | B210: 4 | C210: 1 | D210: 2000 | E210: =R[-9]C -> 81 | F210: =R[-9]C -> 90 | G210: 3 | H210: 15000 | I210: 110003 | J210: 3 | K210: =R[-1]C -> [{7,0},{8,0},{9,6},{10,4},{11,0},{12,0},{17,10},{18,8},{19,1},{23,4},{24,10}] | L210: =R[-1]C -> [{7,27},{8,55},{9,27},{10,55},{11,27},{12,55},{17,18},{18,110},{19,3},{23,37},{24,37}] | M210: =R[-1]C -> [{0,1,[1,30]},{1,2,[11,40]},{2,5,[21,50]},{5,10,[31,60]},{10,20,[41,60]},{30,20,[51,70]},{50,10,[61,80]},{70,5,[71,80]},{100,2,[81,90]},{150,1,[91,100]}]
A211: 208 | B211: 5 | C211: 1 | D211: 2000 | E211: =R[-9]C -> 1 | F211: =R[-9]C -> 10 | G211: 4 | H211: 20000 | I211: 110003 | J211: 4 | K211: =R[-1]C -> [{7,0},{8,0},{9,6},{10,4},{11,0},{12,0},{17,10},{18,8},{19,1},{23,4},{24,10}] | L211: =R[-1]C -> [{7,27},{8,55},{9,27},{10,55},{11,27},{12,55},{17,18},{18,110},{19,3},{23,37},{24,37}] | M211: =R[-1]C -> [{0,1,[1,30]},{1,2,[11,40]},{2,5,[21,50]},{5,10,[31,60]},{10,20,[41,60]},{30,20,[51,70]},{50,10,[61,80]},{70,5,[71,80]},{100,2,[81,90]},{150,1,[91,100]}]
A212: 209 | B212: 5 | C212: 1 | D212: 2000 | E212: =R[-9]C -> 11 | F212: =R[-9]C -> 20 | G212: 4 | H212: 20000 | I212: 110003 | J212: 4 | K212: =R[-1]C -> [{7,0},{8,0},{9,6},{10,4},{11,0},{12,0},{17,10},{18,8},{19,1},{23,4},{24,10}] | L212: =R[-1]C -> [{7,27},{8,55},{9,27},{10,55},{11,27},{12,55},{17,18},{18,110},{19,3},{23,37},{24,37}] | M212: =R[-1]C -> [{0,1,[1,30]},{1,2,[11,40]},{2,5,[21,50]},{5,10,[31,60]},{10,20,[41,60]},{30,20,[51,70]},{50,10,[61,80]},{70,5,[71,80]},{100,2,[81,90]},{150,1,[91,100]}]
A213: 210 | B213: 5 | C213: 1 | D213: 2000 | E213: =R[-9]C -> 21 | F213: =R[-9]C -> 30 | G213: 4 | H213: 20000 | I213: 110003 | J213: 4 | K213: =R[-1]C -> [{7,0},{8,0},{9,6},{10,4},{11,0},{12,0},{17,10},{18,8},{19,1},{23,4},{24,10}] | L213: =R[-1]C -> [{7,27},{8,55},{9,27},{10,55},{11,27},{12,55},{17,18},{18,110},{19,3},{23,37},{24,37}] | M213: =R[-1]C -> [{0,1,[1,30]},{1,2,[11,40]},{2,5,[21,50]},{5,10,[31,60]},{10,20,[41,60]},{30,20,[51,70]},{50,10,[61,80]},{70,5,[71,80]},{100,2,[81,90]},{150,1,[91,100]}]
A214: 211 | B214: 5 | C214: 1 | D214: 2000 | E214: =R[-9]C -> 31 | F214: =R[-9]C -> 40 | G214: 4 | H214: 20000 | I214: 110003 | J214: 4 | K214: =R[-1]C -> [{7,0},{8,0},{9,6},{10,4},{11,0},{12,0},{17,10},{18,8},{19,1},{23,4},{24,10}] | L214: =R[-1]C -> [{7,27},{8,55},{9,27},{10,55},{11,27},{12,55},{17,18},{18,110},{19,3},{23,37},{24,37}] | M214: =R[-1]C -> [{0,1,[1,30]},{1,2,[11,40]},{2,5,[21,50]},{5,10,[31,60]},{10,20,[41,60]},{30,20,[51,70]},{50,10,[61,80]},{70,5,[71,80]},{100,2,[81,90]},{150,1,[91,100]}]
A215: 212 | B215: 5 | C215: 1 | D215: 2000 | E215: =R[-9]C -> 41 | F215: =R[-9]C -> 50 | G215: 4 | H215: 20000 | I215: 110003 | J215: 4 | K215: =R[-1]C -> [{7,0},{8,0},{9,6},{10,4},{11,0},{12,0},{17,10},{18,8},{19,1},{23,4},{24,10}] | L215: =R[-1]C -> [{7,27},{8,55},{9,27},{10,55},{11,27},{12,55},{17,18},{18,110},{19,3},{23,37},{24,37}] | M215: =R[-1]C -> [{0,1,[1,30]},{1,2,[11,40]},{2,5,[21,50]},{5,10,[31,60]},{10,20,[41,60]},{30,20,[51,70]},{50,10,[61,80]},{70,5,[71,80]},{100,2,[81,90]},{150,1,[91,100]}]
A216: 213 | B216: 5 | C216: 1 | D216: 2000 | E216: =R[-9]C -> 51 | F216: =R[-9]C -> 60 | G216: 4 | H216: 20000 | I216: 110003 | J216: 4 | K216: =R[-1]C -> [{7,0},{8,0},{9,6},{10,4},{11,0},{12,0},{17,10},{18,8},{19,1},{23,4},{24,10}] | L216: =R[-1]C -> [{7,27},{8,55},{9,27},{10,55},{11,27},{12,55},{17,18},{18,110},{19,3},{23,37},{24,37}] | M216: =R[-1]C -> [{0,1,[1,30]},{1,2,[11,40]},{2,5,[21,50]},{5,10,[31,60]},{10,20,[41,60]},{30,20,[51,70]},{50,10,[61,80]},{70,5,[71,80]},{100,2,[81,90]},{150,1,[91,100]}]
A217: 214 | B217: 5 | C217: 1 | D217: 2000 | E217: =R[-9]C -> 61 | F217: =R[-9]C -> 70 | G217: 4 | H217: 20000 | I217: 110003 | J217: 4 | K217: =R[-1]C -> [{7,0},{8,0},{9,6},{10,4},{11,0},{12,0},{17,10},{18,8},{19,1},{23,4},{24,10}] | L217: =R[-1]C -> [{7,27},{8,55},{9,27},{10,55},{11,27},{12,55},{17,18},{18,110},{19,3},{23,37},{24,37}] | M217: =R[-1]C -> [{0,1,[1,30]},{1,2,[11,40]},{2,5,[21,50]},{5,10,[31,60]},{10,20,[41,60]},{30,20,[51,70]},{50,10,[61,80]},{70,5,[71,80]},{100,2,[81,90]},{150,1,[91,100]}]
A218: 215 | B218: 5 | C218: 1 | D218: 2000 | E218: =R[-9]C -> 71 | F218: =R[-9]C -> 80 | G218: 4 | H218: 20000 | I218: 110003 | J218: 4 | K218: =R[-1]C -> [{7,0},{8,0},{9,6},{10,4},{11,0},{12,0},{17,10},{18,8},{19,1},{23,4},{24,10}] | L218: =R[-1]C -> [{7,27},{8,55},{9,27},{10,55},{11,27},{12,55},{17,18},{18,110},{19,3},{23,37},{24,37}] | M218: =R[-1]C -> [{0,1,[1,30]},{1,2,[11,40]},{2,5,[21,50]},{5,10,[31,60]},{10,20,[41,60]},{30,20,[51,70]},{50,10,[61,80]},{70,5,[71,80]},{100,2,[81,90]},{150,1,[91,100]}]
A219: 216 | B219: 5 | C219: 1 | D219: 2000 | E219: =R[-9]C -> 81 | F219: =R[-9]C -> 90 | G219: 4 | H219: 20000 | I219: 110003 | J219: 4 | K219: =R[-1]C -> [{7,0},{8,0},{9,6},{10,4},{11,0},{12,0},{17,10},{18,8},{19,1},{23,4},{24,10}] | L219: =R[-1]C -> [{7,27},{8,55},{9,27},{10,55},{11,27},{12,55},{17,18},{18,110},{19,3},{23,37},{24,37}] | M219: =R[-1]C -> [{0,1,[1,30]},{1,2,[11,40]},{2,5,[21,50]},{5,10,[31,60]},{10,20,[41,60]},{30,20,[51,70]},{50,10,[61,80]},{70,5,[71,80]},{100,2,[81,90]},{150,1,[91,100]}]
A220: 217 | B220: 6 | C220: 1 | D220: 2000 | E220: =R[-9]C -> 1 | F220: =R[-9]C -> 10 | G220: 5 | H220: 20000 | I220: 110003 | J220: 5 | K220: =R[-1]C -> [{7,0},{8,0},{9,6},{10,4},{11,0},{12,0},{17,10},{18,8},{19,1},{23,4},{24,10}] | L220: =R[-1]C -> [{7,27},{8,55},{9,27},{10,55},{11,27},{12,55},{17,18},{18,110},{19,3},{23,37},{24,37}] | M220: =R[-1]C -> [{0,1,[1,30]},{1,2,[11,40]},{2,5,[21,50]},{5,10,[31,60]},{10,20,[41,60]},{30,20,[51,70]},{50,10,[61,80]},{70,5,[71,80]},{100,2,[81,90]},{150,1,[91,100]}]
A221: 218 | B221: 6 | C221: 1 | D221: 2000 | E221: =R[-9]C -> 11 | F221: =R[-9]C -> 20 | G221: 5 | H221: 20000 | I221: 110003 | J221: 5 | K221: =R[-1]C -> [{7,0},{8,0},{9,6},{10,4},{11,0},{12,0},{17,10},{18,8},{19,1},{23,4},{24,10}] | L221: =R[-1]C -> [{7,27},{8,55},{9,27},{10,55},{11,27},{12,55},{17,18},{18,110},{19,3},{23,37},{24,37}] | M221: =R[-1]C -> [{0,1,[1,30]},{1,2,[11,40]},{2,5,[21,50]},{5,10,[31,60]},{10,20,[41,60]},{30,20,[51,70]},{50,10,[61,80]},{70,5,[71,80]},{100,2,[81,90]},{150,1,[91,100]}]
A222: 219 | B222: 6 | C222: 1 | D222: 2000 | E222: =R[-9]C -> 21 | F222: =R[-9]C -> 30 | G222: 5 | H222: 20000 | I222: 110003 | J222: 5 | K222: =R[-1]C -> [{7,0},{8,0},{9,6},{10,4},{11,0},{12,0},{17,10},{18,8},{19,1},{23,4},{24,10}] | L222: =R[-1]C -> [{7,27},{8,55},{9,27},{10,55},{11,27},{12,55},{17,18},{18,110},{19,3},{23,37},{24,37}] | M222: =R[-1]C -> [{0,1,[1,30]},{1,2,[11,40]},{2,5,[21,50]},{5,10,[31,60]},{10,20,[41,60]},{30,20,[51,70]},{50,10,[61,80]},{70,5,[71,80]},{100,2,[81,90]},{150,1,[91,100]}]
A223: 220 | B223: 6 | C223: 1 | D223: 2000 | E223: =R[-9]C -> 31 | F223: =R[-9]C -> 40 | G223: 5 | H223: 20000 | I223: 110003 | J223: 5 | K223: =R[-1]C -> [{7,0},{8,0},{9,6},{10,4},{11,0},{12,0},{17,10},{18,8},{19,1},{23,4},{24,10}] | L223: =R[-1]C -> [{7,27},{8,55},{9,27},{10,55},{11,27},{12,55},{17,18},{18,110},{19,3},{23,37},{24,37}] | M223: =R[-1]C -> [{0,1,[1,30]},{1,2,[11,40]},{2,5,[21,50]},{5,10,[31,60]},{10,20,[41,60]},{30,20,[51,70]},{50,10,[61,80]},{70,5,[71,80]},{100,2,[81,90]},{150,1,[91,100]}]
A224: 221 | B224: 6 | C224: 1 | D224: 2000 | E224: =R[-9]C -> 41 | F224: =R[-9]C -> 50 | G224: 5 | H224: 20000 | I224: 110003 | J224: 5 | K224: =R[-1]C -> [{7,0},{8,0},{9,6},{10,4},{11,0},{12,0},{17,10},{18,8},{19,1},{23,4},{24,10}] | L224: =R[-1]C -> [{7,27},{8,55},{9,27},{10,55},{11,27},{12,55},{17,18},{18,110},{19,3},{23,37},{24,37}] | M224: =R[-1]C -> [{0,1,[1,30]},{1,2,[11,40]},{2,5,[21,50]},{5,10,[31,60]},{10,20,[41,60]},{30,20,[51,70]},{50,10,[61,80]},{70,5,[71,80]},{100,2,[81,90]},{150,1,[91,100]}]
A225: 222 | B225: 6 | C225: 1 | D225: 2000 | E225: =R[-9]C -> 51 | F225: =R[-9]C -> 60 | G225: 5 | H225: 20000 | I225: 110003 | J225: 5 | K225: =R[-1]C -> [{7,0},{8,0},{9,6},{10,4},{11,0},{12,0},{17,10},{18,8},{19,1},{23,4},{24,10}] | L225: =R[-1]C -> [{7,27},{8,55},{9,27},{10,55},{11,27},{12,55},{17,18},{18,110},{19,3},{23,37},{24,37}] | M225: =R[-1]C -> [{0,1,[1,30]},{1,2,[11,40]},{2,5,[21,50]},{5,10,[31,60]},{10,20,[41,60]},{30,20,[51,70]},{50,10,[61,80]},{70,5,[71,80]},{100,2,[81,90]},{150,1,[91,100]}]
A226: 223 | B226: 6 | C226: 1 | D226: 2000 | E226: =R[-9]C -> 61 | F226: =R[-9]C -> 70 | G226: 5 | H226: 20000 | I226: 110003 | J226: 5 | K226: =R[-1]C -> [{7,0},{8,0},{9,6},{10,4},{11,0},{12,0},{17,10},{18,8},{19,1},{23,4},{24,10}] | L226: =R[-1]C -> [{7,27},{8,55},{9,27},{10,55},{11,27},{12,55},{17,18},{18,110},{19,3},{23,37},{24,37}] | M226: =R[-1]C -> [{0,1,[1,30]},{1,2,[11,40]},{2,5,[21,50]},{5,10,[31,60]},{10,20,[41,60]},{30,20,[51,70]},{50,10,[61,80]},{70,5,[71,80]},{100,2,[81,90]},{150,1,[91,100]}]
A227: 224 | B227: 6 | C227: 1 | D227: 2000 | E227: =R[-9]C -> 71 | F227: =R[-9]C -> 80 | G227: 5 | H227: 20000 | I227: 110003 | J227: 5 | K227: =R[-1]C -> [{7,0},{8,0},{9,6},{10,4},{11,0},{12,0},{17,10},{18,8},{19,1},{23,4},{24,10}] | L227: =R[-1]C -> [{7,27},{8,55},{9,27},{10,55},{11,27},{12,55},{17,18},{18,110},{19,3},{23,37},{24,37}] | M227: =R[-1]C -> [{0,1,[1,30]},{1,2,[11,40]},{2,5,[21,50]},{5,10,[31,60]},{10,20,[41,60]},{30,20,[51,70]},{50,10,[61,80]},{70,5,[71,80]},{100,2,[81,90]},{150,1,[91,100]}]
A228: 225 | B228: 6 | C228: 1 | D228: 2000 | E228: =R[-9]C -> 81 | F228: =R[-9]C -> 90 | G228: 5 | H228: 20000 | I228: 110003 | J228: 5 | K228: =R[-1]C -> [{7,0},{8,0},{9,6},{10,4},{11,0},{12,0},{17,10},{18,8},{19,1},{23,4},{24,10}] | L228: =R[-1]C -> [{7,27},{8,55},{9,27},{10,55},{11,27},{12,55},{17,18},{18,110},{19,3},{23,37},{24,37}] | M228: =R[-1]C -> [{0,1,[1,30]},{1,2,[11,40]},{2,5,[21,50]},{5,10,[31,60]},{10,20,[41,60]},{30,20,[51,70]},{50,10,[61,80]},{70,5,[71,80]},{100,2,[81,90]},{150,1,[91,100]}]
A229: 226 | B229: 2 | C229: 4 | D229: 2000 | E229: =R[-18]C -> 1 | F229: =R[-18]C -> 10 | G229: 1 | H229: 5000 | I229: 110003 | J229: 1 | K229: =R[-1]C -> [{7,0},{8,0},{9,6},{10,4},{11,0},{12,0},{17,10},{18,8},{19,1},{23,4},{24,10}] | L229: =R[-1]C -> [{7,27},{8,55},{9,27},{10,55},{11,27},{12,55},{17,18},{18,110},{19,3},{23,37},{24,37}] | M229: =R[-1]C -> [{0,1,[1,30]},{1,2,[11,40]},{2,5,[21,50]},{5,10,[31,60]},{10,20,[41,60]},{30,20,[51,70]},{50,10,[61,80]},{70,5,[71,80]},{100,2,[81,90]},{150,1,[91,100]}]
A230: 227 | B230: 2 | C230: 4 | D230: 2000 | E230: =R[-18]C -> 11 | F230: =R[-18]C -> 20 | G230: 1 | H230: 5000 | I230: 110003 | J230: 1 | K230: =R[-1]C -> [{7,0},{8,0},{9,6},{10,4},{11,0},{12,0},{17,10},{18,8},{19,1},{23,4},{24,10}] | L230: =R[-1]C -> [{7,27},{8,55},{9,27},{10,55},{11,27},{12,55},{17,18},{18,110},{19,3},{23,37},{24,37}] | M230: =R[-1]C -> [{0,1,[1,30]},{1,2,[11,40]},{2,5,[21,50]},{5,10,[31,60]},{10,20,[41,60]},{30,20,[51,70]},{50,10,[61,80]},{70,5,[71,80]},{100,2,[81,90]},{150,1,[91,100]}]
A231: 228 | B231: 2 | C231: 4 | D231: 2000 | E231: =R[-18]C -> 21 | F231: =R[-18]C -> 30 | G231: 1 | H231: 5000 | I231: 110003 | J231: 1 | K231: =R[-1]C -> [{7,0},{8,0},{9,6},{10,4},{11,0},{12,0},{17,10},{18,8},{19,1},{23,4},{24,10}] | L231: =R[-1]C -> [{7,27},{8,55},{9,27},{10,55},{11,27},{12,55},{17,18},{18,110},{19,3},{23,37},{24,37}] | M231: =R[-1]C -> [{0,1,[1,30]},{1,2,[11,40]},{2,5,[21,50]},{5,10,[31,60]},{10,20,[41,60]},{30,20,[51,70]},{50,10,[61,80]},{70,5,[71,80]},{100,2,[81,90]},{150,1,[91,100]}]
A232: 229 | B232: 2 | C232: 4 | D232: 2000 | E232: =R[-18]C -> 31 | F232: =R[-18]C -> 40 | G232: 1 | H232: 5000 | I232: 110003 | J232: 1 | K232: =R[-1]C -> [{7,0},{8,0},{9,6},{10,4},{11,0},{12,0},{17,10},{18,8},{19,1},{23,4},{24,10}] | L232: =R[-1]C -> [{7,27},{8,55},{9,27},{10,55},{11,27},{12,55},{17,18},{18,110},{19,3},{23,37},{24,37}] | M232: =R[-1]C -> [{0,1,[1,30]},{1,2,[11,40]},{2,5,[21,50]},{5,10,[31,60]},{10,20,[41,60]},{30,20,[51,70]},{50,10,[61,80]},{70,5,[71,80]},{100,2,[81,90]},{150,1,[91,100]}]
A233: 230 | B233: 2 | C233: 4 | D233: 2000 | E233: =R[-18]C -> 41 | F233: =R[-18]C -> 50 | G233: 1 | H233: 5000 | I233: 110003 | J233: 1 | K233: =R[-1]C -> [{7,0},{8,0},{9,6},{10,4},{11,0},{12,0},{17,10},{18,8},{19,1},{23,4},{24,10}] | L233: =R[-1]C -> [{7,27},{8,55},{9,27},{10,55},{11,27},{12,55},{17,18},{18,110},{19,3},{23,37},{24,37}] | M233: =R[-1]C -> [{0,1,[1,30]},{1,2,[11,40]},{2,5,[21,50]},{5,10,[31,60]},{10,20,[41,60]},{30,20,[51,70]},{50,10,[61,80]},{70,5,[71,80]},{100,2,[81,90]},{150,1,[91,100]}]
A234: 231 | B234: 2 | C234: 4 | D234: 2000 | E234: =R[-18]C -> 51 | F234: =R[-18]C -> 60 | G234: 1 | H234: 5000 | I234: 110003 | J234: 1 | K234: =R[-1]C -> [{7,0},{8,0},{9,6},{10,4},{11,0},{12,0},{17,10},{18,8},{19,1},{23,4},{24,10}] | L234: =R[-1]C -> [{7,27},{8,55},{9,27},{10,55},{11,27},{12,55},{17,18},{18,110},{19,3},{23,37},{24,37}] | M234: =R[-1]C -> [{0,1,[1,30]},{1,2,[11,40]},{2,5,[21,50]},{5,10,[31,60]},{10,20,[41,60]},{30,20,[51,70]},{50,10,[61,80]},{70,5,[71,80]},{100,2,[81,90]},{150,1,[91,100]}]
A235: 232 | B235: 2 | C235: 4 | D235: 2000 | E235: =R[-18]C -> 61 | F235: =R[-18]C -> 70 | G235: 1 | H235: 5000 | I235: 110003 | J235: 1 | K235: =R[-1]C -> [{7,0},{8,0},{9,6},{10,4},{11,0},{12,0},{17,10},{18,8},{19,1},{23,4},{24,10}] | L235: =R[-1]C -> [{7,27},{8,55},{9,27},{10,55},{11,27},{12,55},{17,18},{18,110},{19,3},{23,37},{24,37}] | M235: =R[-1]C -> [{0,1,[1,30]},{1,2,[11,40]},{2,5,[21,50]},{5,10,[31,60]},{10,20,[41,60]},{30,20,[51,70]},{50,10,[61,80]},{70,5,[71,80]},{100,2,[81,90]},{150,1,[91,100]}]
A236: 233 | B236: 2 | C236: 4 | D236: 2000 | E236: =R[-18]C -> 71 | F236: =R[-18]C -> 80 | G236: 1 | H236: 5000 | I236: 110003 | J236: 1 | K236: =R[-1]C -> [{7,0},{8,0},{9,6},{10,4},{11,0},{12,0},{17,10},{18,8},{19,1},{23,4},{24,10}] | L236: =R[-1]C -> [{7,27},{8,55},{9,27},{10,55},{11,27},{12,55},{17,18},{18,110},{19,3},{23,37},{24,37}] | M236: =R[-1]C -> [{0,1,[1,30]},{1,2,[11,40]},{2,5,[21,50]},{5,10,[31,60]},{10,20,[41,60]},{30,20,[51,70]},{50,10,[61,80]},{70,5,[71,80]},{100,2,[81,90]},{150,1,[91,100]}]
A237: 234 | B237: 2 | C237: 4 | D237: 2000 | E237: =R[-18]C -> 81 | F237: =R[-18]C -> 90 | G237: 1 | H237: 5000 | I237: 110003 | J237: 1 | K237: =R[-1]C -> [{7,0},{8,0},{9,6},{10,4},{11,0},{12,0},{17,10},{18,8},{19,1},{23,4},{24,10}] | L237: =R[-1]C -> [{7,27},{8,55},{9,27},{10,55},{11,27},{12,55},{17,18},{18,110},{19,3},{23,37},{24,37}] | M237: =R[-1]C -> [{0,1,[1,30]},{1,2,[11,40]},{2,5,[21,50]},{5,10,[31,60]},{10,20,[41,60]},{30,20,[51,70]},{50,10,[61,80]},{70,5,[71,80]},{100,2,[81,90]},{150,1,[91,100]}]
A238: 235 | B238: 3 | C238: 4 | D238: 2000 | E238: =R[-9]C -> 1 | F238: =R[-9]C -> 10 | G238: 2 | H238: 10000 | I238: 110003 | J238: 2 | K238: =R[-1]C -> [{7,0},{8,0},{9,6},{10,4},{11,0},{12,0},{17,10},{18,8},{19,1},{23,4},{24,10}] | L238: =R[-1]C -> [{7,27},{8,55},{9,27},{10,55},{11,27},{12,55},{17,18},{18,110},{19,3},{23,37},{24,37}] | M238: =R[-1]C -> [{0,1,[1,30]},{1,2,[11,40]},{2,5,[21,50]},{5,10,[31,60]},{10,20,[41,60]},{30,20,[51,70]},{50,10,[61,80]},{70,5,[71,80]},{100,2,[81,90]},{150,1,[91,100]}]
A239: 236 | B239: 3 | C239: 4 | D239: 2000 | E239: =R[-9]C -> 11 | F239: =R[-9]C -> 20 | G239: 2 | H239: 10000 | I239: 110003 | J239: 2 | K239: =R[-1]C -> [{7,0},{8,0},{9,6},{10,4},{11,0},{12,0},{17,10},{18,8},{19,1},{23,4},{24,10}] | L239: =R[-1]C -> [{7,27},{8,55},{9,27},{10,55},{11,27},{12,55},{17,18},{18,110},{19,3},{23,37},{24,37}] | M239: =R[-1]C -> [{0,1,[1,30]},{1,2,[11,40]},{2,5,[21,50]},{5,10,[31,60]},{10,20,[41,60]},{30,20,[51,70]},{50,10,[61,80]},{70,5,[71,80]},{100,2,[81,90]},{150,1,[91,100]}]
A240: 237 | B240: 3 | C240: 4 | D240: 2000 | E240: =R[-9]C -> 21 | F240: =R[-9]C -> 30 | G240: 2 | H240: 10000 | I240: 110003 | J240: 2 | K240: =R[-1]C -> [{7,0},{8,0},{9,6},{10,4},{11,0},{12,0},{17,10},{18,8},{19,1},{23,4},{24,10}] | L240: =R[-1]C -> [{7,27},{8,55},{9,27},{10,55},{11,27},{12,55},{17,18},{18,110},{19,3},{23,37},{24,37}] | M240: =R[-1]C -> [{0,1,[1,30]},{1,2,[11,40]},{2,5,[21,50]},{5,10,[31,60]},{10,20,[41,60]},{30,20,[51,70]},{50,10,[61,80]},{70,5,[71,80]},{100,2,[81,90]},{150,1,[91,100]}]
A241: 238 | B241: 3 | C241: 4 | D241: 2000 | E241: =R[-9]C -> 31 | F241: =R[-9]C -> 40 | G241: 2 | H241: 10000 | I241: 110003 | J241: 2 | K241: =R[-1]C -> [{7,0},{8,0},{9,6},{10,4},{11,0},{12,0},{17,10},{18,8},{19,1},{23,4},{24,10}] | L241: =R[-1]C -> [{7,27},{8,55},{9,27},{10,55},{11,27},{12,55},{17,18},{18,110},{19,3},{23,37},{24,37}] | M241: =R[-1]C -> [{0,1,[1,30]},{1,2,[11,40]},{2,5,[21,50]},{5,10,[31,60]},{10,20,[41,60]},{30,20,[51,70]},{50,10,[61,80]},{70,5,[71,80]},{100,2,[81,90]},{150,1,[91,100]}]
A242: 239 | B242: 3 | C242: 4 | D242: 2000 | E242: =R[-9]C -> 41 | F242: =R[-9]C -> 50 | G242: 2 | H242: 10000 | I242: 110003 | J242: 2 | K242: =R[-1]C -> [{7,0},{8,0},{9,6},{10,4},{11,0},{12,0},{17,10},{18,8},{19,1},{23,4},{24,10}] | L242: =R[-1]C -> [{7,27},{8,55},{9,27},{10,55},{11,27},{12,55},{17,18},{18,110},{19,3},{23,37},{24,37}] | M242: =R[-1]C -> [{0,1,[1,30]},{1,2,[11,40]},{2,5,[21,50]},{5,10,[31,60]},{10,20,[41,60]},{30,20,[51,70]},{50,10,[61,80]},{70,5,[71,80]},{100,2,[81,90]},{150,1,[91,100]}]
A243: 240 | B243: 3 | C243: 4 | D243: 2000 | E243: =R[-9]C -> 51 | F243: =R[-9]C -> 60 | G243: 2 | H243: 10000 | I243: 110003 | J243: 2 | K243: =R[-1]C -> [{7,0},{8,0},{9,6},{10,4},{11,0},{12,0},{17,10},{18,8},{19,1},{23,4},{24,10}] | L243: =R[-1]C -> [{7,27},{8,55},{9,27},{10,55},{11,27},{12,55},{17,18},{18,110},{19,3},{23,37},{24,37}] | M243: =R[-1]C -> [{0,1,[1,30]},{1,2,[11,40]},{2,5,[21,50]},{5,10,[31,60]},{10,20,[41,60]},{30,20,[51,70]},{50,10,[61,80]},{70,5,[71,80]},{100,2,[81,90]},{150,1,[91,100]}]
A244: 241 | B244: 3 | C244: 4 | D244: 2000 | E244: =R[-9]C -> 61 | F244: =R[-9]C -> 70 | G244: 2 | H244: 10000 | I244: 110003 | J244: 2 | K244: =R[-1]C -> [{7,0},{8,0},{9,6},{10,4},{11,0},{12,0},{17,10},{18,8},{19,1},{23,4},{24,10}] | L244: =R[-1]C -> [{7,27},{8,55},{9,27},{10,55},{11,27},{12,55},{17,18},{18,110},{19,3},{23,37},{24,37}] | M244: =R[-1]C -> [{0,1,[1,30]},{1,2,[11,40]},{2,5,[21,50]},{5,10,[31,60]},{10,20,[41,60]},{30,20,[51,70]},{50,10,[61,80]},{70,5,[71,80]},{100,2,[81,90]},{150,1,[91,100]}]
A245: 242 | B245: 3 | C245: 4 | D245: 2000 | E245: =R[-9]C -> 71 | F245: =R[-9]C -> 80 | G245: 2 | H245: 10000 | I245: 110003 | J245: 2 | K245: =R[-1]C -> [{7,0},{8,0},{9,6},{10,4},{11,0},{12,0},{17,10},{18,8},{19,1},{23,4},{24,10}] | L245: =R[-1]C -> [{7,27},{8,55},{9,27},{10,55},{11,27},{12,55},{17,18},{18,110},{19,3},{23,37},{24,37}] | M245: =R[-1]C -> [{0,1,[1,30]},{1,2,[11,40]},{2,5,[21,50]},{5,10,[31,60]},{10,20,[41,60]},{30,20,[51,70]},{50,10,[61,80]},{70,5,[71,80]},{100,2,[81,90]},{150,1,[91,100]}]
A246: 243 | B246: 3 | C246: 4 | D246: 2000 | E246: =R[-9]C -> 81 | F246: =R[-9]C -> 90 | G246: 2 | H246: 10000 | I246: 110003 | J246: 2 | K246: =R[-1]C -> [{7,0},{8,0},{9,6},{10,4},{11,0},{12,0},{17,10},{18,8},{19,1},{23,4},{24,10}] | L246: =R[-1]C -> [{7,27},{8,55},{9,27},{10,55},{11,27},{12,55},{17,18},{18,110},{19,3},{23,37},{24,37}] | M246: =R[-1]C -> [{0,1,[1,30]},{1,2,[11,40]},{2,5,[21,50]},{5,10,[31,60]},{10,20,[41,60]},{30,20,[51,70]},{50,10,[61,80]},{70,5,[71,80]},{100,2,[81,90]},{150,1,[91,100]}]
A247: 244 | B247: 4 | C247: 4 | D247: 2000 | E247: =R[-9]C -> 1 | F247: =R[-9]C -> 10 | G247: 3 | H247: 15000 | I247: 110003 | J247: 3 | K247: =R[-1]C -> [{7,0},{8,0},{9,6},{10,4},{11,0},{12,0},{17,10},{18,8},{19,1},{23,4},{24,10}] | L247: =R[-1]C -> [{7,27},{8,55},{9,27},{10,55},{11,27},{12,55},{17,18},{18,110},{19,3},{23,37},{24,37}] | M247: =R[-1]C -> [{0,1,[1,30]},{1,2,[11,40]},{2,5,[21,50]},{5,10,[31,60]},{10,20,[41,60]},{30,20,[51,70]},{50,10,[61,80]},{70,5,[71,80]},{100,2,[81,90]},{150,1,[91,100]}]
A248: 245 | B248: 4 | C248: 4 | D248: 2000 | E248: =R[-9]C -> 11 | F248: =R[-9]C -> 20 | G248: 3 | H248: 15000 | I248: 110003 | J248: 3 | K248: =R[-1]C -> [{7,0},{8,0},{9,6},{10,4},{11,0},{12,0},{17,10},{18,8},{19,1},{23,4},{24,10}] | L248: =R[-1]C -> [{7,27},{8,55},{9,27},{10,55},{11,27},{12,55},{17,18},{18,110},{19,3},{23,37},{24,37}] | M248: =R[-1]C -> [{0,1,[1,30]},{1,2,[11,40]},{2,5,[21,50]},{5,10,[31,60]},{10,20,[41,60]},{30,20,[51,70]},{50,10,[61,80]},{70,5,[71,80]},{100,2,[81,90]},{150,1,[91,100]}]
A249: 246 | B249: 4 | C249: 4 | D249: 2000 | E249: =R[-9]C -> 21 | F249: =R[-9]C -> 30 | G249: 3 | H249: 15000 | I249: 110003 | J249: 3 | K249: =R[-1]C -> [{7,0},{8,0},{9,6},{10,4},{11,0},{12,0},{17,10},{18,8},{19,1},{23,4},{24,10}] | L249: =R[-1]C -> [{7,27},{8,55},{9,27},{10,55},{11,27},{12,55},{17,18},{18,110},{19,3},{23,37},{24,37}] | M249: =R[-1]C -> [{0,1,[1,30]},{1,2,[11,40]},{2,5,[21,50]},{5,10,[31,60]},{10,20,[41,60]},{30,20,[51,70]},{50,10,[61,80]},{70,5,[71,80]},{100,2,[81,90]},{150,1,[91,100]}]
A250: 247 | B250: 4 | C250: 4 | D250: 2000 | E250: =R[-9]C -> 31 | F250: =R[-9]C -> 40 | G250: 3 | H250: 15000 | I250: 110003 | J250: 3 | K250: =R[-1]C -> [{7,0},{8,0},{9,6},{10,4},{11,0},{12,0},{17,10},{18,8},{19,1},{23,4},{24,10}] | L250: =R[-1]C -> [{7,27},{8,55},{9,27},{10,55},{11,27},{12,55},{17,18},{18,110},{19,3},{23,37},{24,37}] | M250: =R[-1]C -> [{0,1,[1,30]},{1,2,[11,40]},{2,5,[21,50]},{5,10,[31,60]},{10,20,[41,60]},{30,20,[51,70]},{50,10,[61,80]},{70,5,[71,80]},{100,2,[81,90]},{150,1,[91,100]}]
A251: 248 | B251: 4 | C251: 4 | D251: 2000 | E251: =R[-9]C -> 41 | F251: =R[-9]C -> 50 | G251: 3 | H251: 15000 | I251: 110003 | J251: 3 | K251: =R[-1]C -> [{7,0},{8,0},{9,6},{10,4},{11,0},{12,0},{17,10},{18,8},{19,1},{23,4},{24,10}] | L251: =R[-1]C -> [{7,27},{8,55},{9,27},{10,55},{11,27},{12,55},{17,18},{18,110},{19,3},{23,37},{24,37}] | M251: =R[-1]C -> [{0,1,[1,30]},{1,2,[11,40]},{2,5,[21,50]},{5,10,[31,60]},{10,20,[41,60]},{30,20,[51,70]},{50,10,[61,80]},{70,5,[71,80]},{100,2,[81,90]},{150,1,[91,100]}]
A252: 249 | B252: 4 | C252: 4 | D252: 2000 | E252: =R[-9]C -> 51 | F252: =R[-9]C -> 60 | G252: 3 | H252: 15000 | I252: 110003 | J252: 3 | K252: =R[-1]C -> [{7,0},{8,0},{9,6},{10,4},{11,0},{12,0},{17,10},{18,8},{19,1},{23,4},{24,10}] | L252: =R[-1]C -> [{7,27},{8,55},{9,27},{10,55},{11,27},{12,55},{17,18},{18,110},{19,3},{23,37},{24,37}] | M252: =R[-1]C -> [{0,1,[1,30]},{1,2,[11,40]},{2,5,[21,50]},{5,10,[31,60]},{10,20,[41,60]},{30,20,[51,70]},{50,10,[61,80]},{70,5,[71,80]},{100,2,[81,90]},{150,1,[91,100]}]
A253: 250 | B253: 4 | C253: 4 | D253: 2000 | E253: =R[-9]C -> 61 | F253: =R[-9]C -> 70 | G253: 3 | H253: 15000 | I253: 110003 | J253: 3 | K253: =R[-1]C -> [{7,0},{8,0},{9,6},{10,4},{11,0},{12,0},{17,10},{18,8},{19,1},{23,4},{24,10}] | L253: =R[-1]C -> [{7,27},{8,55},{9,27},{10,55},{11,27},{12,55},{17,18},{18,110},{19,3},{23,37},{24,37}] | M253: =R[-1]C -> [{0,1,[1,30]},{1,2,[11,40]},{2,5,[21,50]},{5,10,[31,60]},{10,20,[41,60]},{30,20,[51,70]},{50,10,[61,80]},{70,5,[71,80]},{100,2,[81,90]},{150,1,[91,100]}]
A254: 251 | B254: 4 | C254: 4 | D254: 2000 | E254: =R[-9]C -> 71 | F254: =R[-9]C -> 80 | G254: 3 | H254: 15000 | I254: 110003 | J254: 3 | K254: =R[-1]C -> [{7,0},{8,0},{9,6},{10,4},{11,0},{12,0},{17,10},{18,8},{19,1},{23,4},{24,10}] | L254: =R[-1]C -> [{7,27},{8,55},{9,27},{10,55},{11,27},{12,55},{17,18},{18,110},{19,3},{23,37},{24,37}] | M254: =R[-1]C -> [{0,1,[1,30]},{1,2,[11,40]},{2,5,[21,50]},{5,10,[31,60]},{10,20,[41,60]},{30,20,[51,70]},{50,10,[61,80]},{70,5,[71,80]},{100,2,[81,90]},{150,1,[91,100]}]
A255: 252 | B255: 4 | C255: 4 | D255: 2000 | E255: =R[-9]C -> 81 | F255: =R[-9]C -> 90 | G255: 3 | H255: 15000 | I255: 110003 | J255: 3 | K255: =R[-1]C -> [{7,0},{8,0},{9,6},{10,4},{11,0},{12,0},{17,10},{18,8},{19,1},{23,4},{24,10}] | L255: =R[-1]C -> [{7,27},{8,55},{9,27},{10,55},{11,27},{12,55},{17,18},{18,110},{19,3},{23,37},{24,37}] | M255: =R[-1]C -> [{0,1,[1,30]},{1,2,[11,40]},{2,5,[21,50]},{5,10,[31,60]},{10,20,[41,60]},{30,20,[51,70]},{50,10,[61,80]},{70,5,[71,80]},{100,2,[81,90]},{150,1,[91,100]}]
A256: 253 | B256: 5 | C256: 4 | D256: 2000 | E256: =R[-9]C -> 1 | F256: =R[-9]C -> 10 | G256: 4 | H256: 20000 | I256: 110003 | J256: 4 | K256: =R[-1]C -> [{7,0},{8,0},{9,6},{10,4},{11,0},{12,0},{17,10},{18,8},{19,1},{23,4},{24,10}] | L256: =R[-1]C -> [{7,27},{8,55},{9,27},{10,55},{11,27},{12,55},{17,18},{18,110},{19,3},{23,37},{24,37}] | M256: =R[-1]C -> [{0,1,[1,30]},{1,2,[11,40]},{2,5,[21,50]},{5,10,[31,60]},{10,20,[41,60]},{30,20,[51,70]},{50,10,[61,80]},{70,5,[71,80]},{100,2,[81,90]},{150,1,[91,100]}]
A257: 254 | B257: 5 | C257: 4 | D257: 2000 | E257: =R[-9]C -> 11 | F257: =R[-9]C -> 20 | G257: 4 | H257: 20000 | I257: 110003 | J257: 4 | K257: =R[-1]C -> [{7,0},{8,0},{9,6},{10,4},{11,0},{12,0},{17,10},{18,8},{19,1},{23,4},{24,10}] | L257: =R[-1]C -> [{7,27},{8,55},{9,27},{10,55},{11,27},{12,55},{17,18},{18,110},{19,3},{23,37},{24,37}] | M257: =R[-1]C -> [{0,1,[1,30]},{1,2,[11,40]},{2,5,[21,50]},{5,10,[31,60]},{10,20,[41,60]},{30,20,[51,70]},{50,10,[61,80]},{70,5,[71,80]},{100,2,[81,90]},{150,1,[91,100]}]
A258: 255 | B258: 5 | C258: 4 | D258: 2000 | E258: =R[-9]C -> 21 | F258: =R[-9]C -> 30 | G258: 4 | H258: 20000 | I258: 110003 | J258: 4 | K258: =R[-1]C -> [{7,0},{8,0},{9,6},{10,4},{11,0},{12,0},{17,10},{18,8},{19,1},{23,4},{24,10}] | L258: =R[-1]C -> [{7,27},{8,55},{9,27},{10,55},{11,27},{12,55},{17,18},{18,110},{19,3},{23,37},{24,37}] | M258: =R[-1]C -> [{0,1,[1,30]},{1,2,[11,40]},{2,5,[21,50]},{5,10,[31,60]},{10,20,[41,60]},{30,20,[51,70]},{50,10,[61,80]},{70,5,[71,80]},{100,2,[81,90]},{150,1,[91,100]}]
A259: 256 | B259: 5 | C259: 4 | D259: 2000 | E259: =R[-9]C -> 31 | F259: =R[-9]C -> 40 | G259: 4 | H259: 20000 | I259: 110003 | J259: 4 | K259: =R[-1]C -> [{7,0},{8,0},{9,6},{10,4},{11,0},{12,0},{17,10},{18,8},{19,1},{23,4},{24,10}] | L259: =R[-1]C -> [{7,27},{8,55},{9,27},{10,55},{11,27},{12,55},{17,18},{18,110},{19,3},{23,37},{24,37}] | M259: =R[-1]C -> [{0,1,[1,30]},{1,2,[11,40]},{2,5,[21,50]},{5,10,[31,60]},{10,20,[41,60]},{30,20,[51,70]},{50,10,[61,80]},{70,5,[71,80]},{100,2,[81,90]},{150,1,[91,100]}]
A260: 257 | B260: 5 | C260: 4 | D260: 2000 | E260: =R[-9]C -> 41 | F260: =R[-9]C -> 50 | G260: 4 | H260: 20000 | I260: 110003 | J260: 4 | K260: =R[-1]C -> [{7,0},{8,0},{9,6},{10,4},{11,0},{12,0},{17,10},{18,8},{19,1},{23,4},{24,10}] | L260: =R[-1]C -> [{7,27},{8,55},{9,27},{10,55},{11,27},{12,55},{17,18},{18,110},{19,3},{23,37},{24,37}] | M260: =R[-1]C -> [{0,1,[1,30]},{1,2,[11,40]},{2,5,[21,50]},{5,10,[31,60]},{10,20,[41,60]},{30,20,[51,70]},{50,10,[61,80]},{70,5,[71,80]},{100,2,[81,90]},{150,1,[91,100]}]
A261: 258 | B261: 5 | C261: 4 | D261: 2000 | E261: =R[-9]C -> 51 | F261: =R[-9]C -> 60 | G261: 4 | H261: 20000 | I261: 110003 | J261: 4 | K261: =R[-1]C -> [{7,0},{8,0},{9,6},{10,4},{11,0},{12,0},{17,10},{18,8},{19,1},{23,4},{24,10}] | L261: =R[-1]C -> [{7,27},{8,55},{9,27},{10,55},{11,27},{12,55},{17,18},{18,110},{19,3},{23,37},{24,37}] | M261: =R[-1]C -> [{0,1,[1,30]},{1,2,[11,40]},{2,5,[21,50]},{5,10,[31,60]},{10,20,[41,60]},{30,20,[51,70]},{50,10,[61,80]},{70,5,[71,80]},{100,2,[81,90]},{150,1,[91,100]}]
A262: 259 | B262: 5 | C262: 4 | D262: 2000 | E262: =R[-9]C -> 61 | F262: =R[-9]C -> 70 | G262: 4 | H262: 20000 | I262: 110003 | J262: 4 | K262: =R[-1]C -> [{7,0},{8,0},{9,6},{10,4},{11,0},{12,0},{17,10},{18,8},{19,1},{23,4},{24,10}] | L262: =R[-1]C -> [{7,27},{8,55},{9,27},{10,55},{11,27},{12,55},{17,18},{18,110},{19,3},{23,37},{24,37}] | M262: =R[-1]C -> [{0,1,[1,30]},{1,2,[11,40]},{2,5,[21,50]},{5,10,[31,60]},{10,20,[41,60]},{30,20,[51,70]},{50,10,[61,80]},{70,5,[71,80]},{100,2,[81,90]},{150,1,[91,100]}]
A263: 260 | B263: 5 | C263: 4 | D263: 2000 | E263: =R[-9]C -> 71 | F263: =R[-9]C -> 80 | G263: 4 | H263: 20000 | I263: 110003 | J263: 4 | K263: =R[-1]C -> [{7,0},{8,0},{9,6},{10,4},{11,0},{12,0},{17,10},{18,8},{19,1},{23,4},{24,10}] | L263: =R[-1]C -> [{7,27},{8,55},{9,27},{10,55},{11,27},{12,55},{17,18},{18,110},{19,3},{23,37},{24,37}] | M263: =R[-1]C -> [{0,1,[1,30]},{1,2,[11,40]},{2,5,[21,50]},{5,10,[31,60]},{10,20,[41,60]},{30,20,[51,70]},{50,10,[61,80]},{70,5,[71,80]},{100,2,[81,90]},{150,1,[91,100]}]
A264: 261 | B264: 5 | C264: 4 | D264: 2000 | E264: =R[-9]C -> 81 | F264: =R[-9]C -> 90 | G264: 4 | H264: 20000 | I264: 110003 | J264: 4 | K264: =R[-1]C -> [{7,0},{8,0},{9,6},{10,4},{11,0},{12,0},{17,10},{18,8},{19,1},{23,4},{24,10}] | L264: =R[-1]C -> [{7,27},{8,55},{9,27},{10,55},{11,27},{12,55},{17,18},{18,110},{19,3},{23,37},{24,37}] | M264: =R[-1]C -> [{0,1,[1,30]},{1,2,[11,40]},{2,5,[21,50]},{5,10,[31,60]},{10,20,[41,60]},{30,20,[51,70]},{50,10,[61,80]},{70,5,[71,80]},{100,2,[81,90]},{150,1,[91,100]}]
A265: 262 | B265: 6 | C265: 4 | D265: 2000 | E265: =R[-9]C -> 1 | F265: =R[-9]C -> 10 | G265: 5 | H265: 20000 | I265: 110003 | J265: 5 | K265: =R[-1]C -> [{7,0},{8,0},{9,6},{10,4},{11,0},{12,0},{17,10},{18,8},{19,1},{23,4},{24,10}] | L265: =R[-1]C -> [{7,27},{8,55},{9,27},{10,55},{11,27},{12,55},{17,18},{18,110},{19,3},{23,37},{24,37}] | M265: =R[-1]C -> [{0,1,[1,30]},{1,2,[11,40]},{2,5,[21,50]},{5,10,[31,60]},{10,20,[41,60]},{30,20,[51,70]},{50,10,[61,80]},{70,5,[71,80]},{100,2,[81,90]},{150,1,[91,100]}]
A266: 263 | B266: 6 | C266: 4 | D266: 2000 | E266: =R[-9]C -> 11 | F266: =R[-9]C -> 20 | G266: 5 | H266: 20000 | I266: 110003 | J266: 5 | K266: =R[-1]C -> [{7,0},{8,0},{9,6},{10,4},{11,0},{12,0},{17,10},{18,8},{19,1},{23,4},{24,10}] | L266: =R[-1]C -> [{7,27},{8,55},{9,27},{10,55},{11,27},{12,55},{17,18},{18,110},{19,3},{23,37},{24,37}] | M266: =R[-1]C -> [{0,1,[1,30]},{1,2,[11,40]},{2,5,[21,50]},{5,10,[31,60]},{10,20,[41,60]},{30,20,[51,70]},{50,10,[61,80]},{70,5,[71,80]},{100,2,[81,90]},{150,1,[91,100]}]
A267: 264 | B267: 6 | C267: 4 | D267: 2000 | E267: =R[-9]C -> 21 | F267: =R[-9]C -> 30 | G267: 5 | H267: 20000 | I267: 110003 | J267: 5 | K267: =R[-1]C -> [{7,0},{8,0},{9,6},{10,4},{11,0},{12,0},{17,10},{18,8},{19,1},{23,4},{24,10}] | L267: =R[-1]C -> [{7,27},{8,55},{9,27},{10,55},{11,27},{12,55},{17,18},{18,110},{19,3},{23,37},{24,37}] | M267: =R[-1]C -> [{0,1,[1,30]},{1,2,[11,40]},{2,5,[21,50]},{5,10,[31,60]},{10,20,[41,60]},{30,20,[51,70]},{50,10,[61,80]},{70,5,[71,80]},{100,2,[81,90]},{150,1,[91,100]}]
A268: 265 | B268: 6 | C268: 4 | D268: 2000 | E268: =R[-9]C -> 31 | F268: =R[-9]C -> 40 | G268: 5 | H268: 20000 | I268: 110003 | J268: 5 | K268: =R[-1]C -> [{7,0},{8,0},{9,6},{10,4},{11,0},{12,0},{17,10},{18,8},{19,1},{23,4},{24,10}] | L268: =R[-1]C -> [{7,27},{8,55},{9,27},{10,55},{11,27},{12,55},{17,18},{18,110},{19,3},{23,37},{24,37}] | M268: =R[-1]C -> [{0,1,[1,30]},{1,2,[11,40]},{2,5,[21,50]},{5,10,[31,60]},{10,20,[41,60]},{30,20,[51,70]},{50,10,[61,80]},{70,5,[71,80]},{100,2,[81,90]},{150,1,[91,100]}]
A269: 266 | B269: 6 | C269: 4 | D269: 2000 | E269: =R[-9]C -> 41 | F269: =R[-9]C -> 50 | G269: 5 | H269: 20000 | I269: 110003 | J269: 5 | K269: =R[-1]C -> [{7,0},{8,0},{9,6},{10,4},{11,0},{12,0},{17,10},{18,8},{19,1},{23,4},{24,10}] | L269: =R[-1]C -> [{7,27},{8,55},{9,27},{10,55},{11,27},{12,55},{17,18},{18,110},{19,3},{23,37},{24,37}] | M269: =R[-1]C -> [{0,1,[1,30]},{1,2,[11,40]},{2,5,[21,50]},{5,10,[31,60]},{10,20,[41,60]},{30,20,[51,70]},{50,10,[61,80]},{70,5,[71,80]},{100,2,[81,90]},{150,1,[91,100]}]
A270: 267 | B270: 6 | C270: 4 | D270: 2000 | E270: =R[-9]C -> 51 | F270: =R[-9]C -> 60 | G270: 5 | H270: 20000 | I270: 110003 | J270: 5 | K270: =R[-1]C -> [{7,0},{8,0},{9,6},{10,4},{11,0},{12,0},{17,10},{18,8},{19,1},{23,4},{24,10}] | L270: =R[-1]C -> [{7,27},{8,55},{9,27},{10,55},{11,27},{12,55},{17,18},{18,110},{19,3},{23,37},{24,37}] | M270: =R[-1]C -> [{0,1,[1,30]},{1,2,[11,40]},{2,5,[21,50]},{5,10,[31,60]},{10,20,[41,60]},{30,20,[51,70]},{50,10,[61,80]},{70,5,[71,80]},{100,2,[81,90]},{150,1,[91,100]}]
A271: 268 | B271: 6 | C271: 4 | D271: 2000 | E271: =R[-9]C -> 61 | F271: =R[-9]C -> 70 | G271: 5 | H271: 20000 | I271: 110003 | J271: 5 | K271: =R[-1]C -> [{7,0},{8,0},{9,6},{10,4},{11,0},{12,0},{17,10},{18,8},{19,1},{23,4},{24,10}] | L271: =R[-1]C -> [{7,27},{8,55},{9,27},{10,55},{11,27},{12,55},{17,18},{18,110},{19,3},{23,37},{24,37}] | M271: =R[-1]C -> [{0,1,[1,30]},{1,2,[11,40]},{2,5,[21,50]},{5,10,[31,60]},{10,20,[41,60]},{30,20,[51,70]},{50,10,[61,80]},{70,5,[71,80]},{100,2,[81,90]},{150,1,[91,100]}]
A272: 269 | B272: 6 | C272: 4 | D272: 2000 | E272: =R[-9]C -> 71 | F272: =R[-9]C -> 80 | G272: 5 | H272: 20000 | I272: 110003 | J272: 5 | K272: =R[-1]C -> [{7,0},{8,0},{9,6},{10,4},{11,0},{12,0},{17,10},{18,8},{19,1},{23,4},{24,10}] | L272: =R[-1]C -> [{7,27},{8,55},{9,27},{10,55},{11,27},{12,55},{17,18},{18,110},{19,3},{23,37},{24,37}] | M272: =R[-1]C -> [{0,1,[1,30]},{1,2,[11,40]},{2,5,[21,50]},{5,10,[31,60]},{10,20,[41,60]},{30,20,[51,70]},{50,10,[61,80]},{70,5,[71,80]},{100,2,[81,90]},{150,1,[91,100]}]
A273: 270 | B273: 6 | C273: 4 | D273: 2000 | E273: =R[-9]C -> 81 | F273: =R[-9]C -> 90 | G273: 5 | H273: 20000 | I273: 110003 | J273: 5 | K273: =R[-1]C -> [{7,0},{8,0},{9,6},{10,4},{11,0},{12,0},{17,10},{18,8},{19,1},{23,4},{24,10}] | L273: =R[-1]C -> [{7,27},{8,55},{9,27},{10,55},{11,27},{12,55},{17,18},{18,110},{19,3},{23,37},{24,37}] | M273: =R[-1]C -> [{0,1,[1,30]},{1,2,[11,40]},{2,5,[21,50]},{5,10,[31,60]},{10,20,[41,60]},{30,20,[51,70]},{50,10,[61,80]},{70,5,[71,80]},{100,2,[81,90]},{150,1,[91,100]}]
A274: 271 | B274: 2 | C274: 6 | D274: 2000 | E274: =R[-18]C -> 1 | F274: =R[-18]C -> 10 | G274: 1 | H274: 5000 | I274: 110003 | J274: 1 | K274: =R[-1]C -> [{7,0},{8,0},{9,6},{10,4},{11,0},{12,0},{17,10},{18,8},{19,1},{23,4},{24,10}] | L274: =R[-1]C -> [{7,27},{8,55},{9,27},{10,55},{11,27},{12,55},{17,18},{18,110},{19,3},{23,37},{24,37}] | M274: =R[-1]C -> [{0,1,[1,30]},{1,2,[11,40]},{2,5,[21,50]},{5,10,[31,60]},{10,20,[41,60]},{30,20,[51,70]},{50,10,[61,80]},{70,5,[71,80]},{100,2,[81,90]},{150,1,[91,100]}]
A275: 272 | B275: 2 | C275: 6 | D275: 2000 | E275: =R[-18]C -> 11 | F275: =R[-18]C -> 20 | G275: 1 | H275: 5000 | I275: 110003 | J275: 1 | K275: =R[-1]C -> [{7,0},{8,0},{9,6},{10,4},{11,0},{12,0},{17,10},{18,8},{19,1},{23,4},{24,10}] | L275: =R[-1]C -> [{7,27},{8,55},{9,27},{10,55},{11,27},{12,55},{17,18},{18,110},{19,3},{23,37},{24,37}] | M275: =R[-1]C -> [{0,1,[1,30]},{1,2,[11,40]},{2,5,[21,50]},{5,10,[31,60]},{10,20,[41,60]},{30,20,[51,70]},{50,10,[61,80]},{70,5,[71,80]},{100,2,[81,90]},{150,1,[91,100]}]
A276: 273 | B276: 2 | C276: 6 | D276: 2000 | E276: =R[-18]C -> 21 | F276: =R[-18]C -> 30 | G276: 1 | H276: 5000 | I276: 110003 | J276: 1 | K276: =R[-1]C -> [{7,0},{8,0},{9,6},{10,4},{11,0},{12,0},{17,10},{18,8},{19,1},{23,4},{24,10}] | L276: =R[-1]C -> [{7,27},{8,55},{9,27},{10,55},{11,27},{12,55},{17,18},{18,110},{19,3},{23,37},{24,37}] | M276: =R[-1]C -> [{0,1,[1,30]},{1,2,[11,40]},{2,5,[21,50]},{5,10,[31,60]},{10,20,[41,60]},{30,20,[51,70]},{50,10,[61,80]},{70,5,[71,80]},{100,2,[81,90]},{150,1,[91,100]}]
A277: 274 | B277: 2 | C277: 6 | D277: 2000 | E277: =R[-18]C -> 31 | F277: =R[-18]C -> 40 | G277: 1 | H277: 5000 | I277: 110003 | J277: 1 | K277: =R[-1]C -> [{7,0},{8,0},{9,6},{10,4},{11,0},{12,0},{17,10},{18,8},{19,1},{23,4},{24,10}] | L277: =R[-1]C -> [{7,27},{8,55},{9,27},{10,55},{11,27},{12,55},{17,18},{18,110},{19,3},{23,37},{24,37}] | M277: =R[-1]C -> [{0,1,[1,30]},{1,2,[11,40]},{2,5,[21,50]},{5,10,[31,60]},{10,20,[41,60]},{30,20,[51,70]},{50,10,[61,80]},{70,5,[71,80]},{100,2,[81,90]},{150,1,[91,100]}]
A278: 275 | B278: 2 | C278: 6 | D278: 2000 | E278: =R[-18]C -> 41 | F278: =R[-18]C -> 50 | G278: 1 | H278: 5000 | I278: 110003 | J278: 1 | K278: =R[-1]C -> [{7,0},{8,0},{9,6},{10,4},{11,0},{12,0},{17,10},{18,8},{19,1},{23,4},{24,10}] | L278: =R[-1]C -> [{7,27},{8,55},{9,27},{10,55},{11,27},{12,55},{17,18},{18,110},{19,3},{23,37},{24,37}] | M278: =R[-1]C -> [{0,1,[1,30]},{1,2,[11,40]},{2,5,[21,50]},{5,10,[31,60]},{10,20,[41,60]},{30,20,[51,70]},{50,10,[61,80]},{70,5,[71,80]},{100,2,[81,90]},{150,1,[91,100]}]
A279: 276 | B279: 2 | C279: 6 | D279: 2000 | E279: =R[-18]C -> 51 | F279: =R[-18]C -> 60 | G279: 1 | H279: 5000 | I279: 110003 | J279: 1 | K279: =R[-1]C -> [{7,0},{8,0},{9,6},{10,4},{11,0},{12,0},{17,10},{18,8},{19,1},{23,4},{24,10}] | L279: =R[-1]C -> [{7,27},{8,55},{9,27},{10,55},{11,27},{12,55},{17,18},{18,110},{19,3},{23,37},{24,37}] | M279: =R[-1]C -> [{0,1,[1,30]},{1,2,[11,40]},{2,5,[21,50]},{5,10,[31,60]},{10,20,[41,60]},{30,20,[51,70]},{50,10,[61,80]},{70,5,[71,80]},{100,2,[81,90]},{150,1,[91,100]}]
A280: 277 | B280: 2 | C280: 6 | D280: 2000 | E280: =R[-18]C -> 61 | F280: =R[-18]C -> 70 | G280: 1 | H280: 5000 | I280: 110003 | J280: 1 | K280: =R[-1]C -> [{7,0},{8,0},{9,6},{10,4},{11,0},{12,0},{17,10},{18,8},{19,1},{23,4},{24,10}] | L280: =R[-1]C -> [{7,27},{8,55},{9,27},{10,55},{11,27},{12,55},{17,18},{18,110},{19,3},{23,37},{24,37}] | M280: =R[-1]C -> [{0,1,[1,30]},{1,2,[11,40]},{2,5,[21,50]},{5,10,[31,60]},{10,20,[41,60]},{30,20,[51,70]},{50,10,[61,80]},{70,5,[71,80]},{100,2,[81,90]},{150,1,[91,100]}]
A281: 278 | B281: 2 | C281: 6 | D281: 2000 | E281: =R[-18]C -> 71 | F281: =R[-18]C -> 80 | G281: 1 | H281: 5000 | I281: 110003 | J281: 1 | K281: =R[-1]C -> [{7,0},{8,0},{9,6},{10,4},{11,0},{12,0},{17,10},{18,8},{19,1},{23,4},{24,10}] | L281: =R[-1]C -> [{7,27},{8,55},{9,27},{10,55},{11,27},{12,55},{17,18},{18,110},{19,3},{23,37},{24,37}] | M281: =R[-1]C -> [{0,1,[1,30]},{1,2,[11,40]},{2,5,[21,50]},{5,10,[31,60]},{10,20,[41,60]},{30,20,[51,70]},{50,10,[61,80]},{70,5,[71,80]},{100,2,[81,90]},{150,1,[91,100]}]
A282: 279 | B282: 2 | C282: 6 | D282: 2000 | E282: =R[-18]C -> 81 | F282: =R[-18]C -> 90 | G282: 1 | H282: 5000 | I282: 110003 | J282: 1 | K282: =R[-1]C -> [{7,0},{8,0},{9,6},{10,4},{11,0},{12,0},{17,10},{18,8},{19,1},{23,4},{24,10}] | L282: =R[-1]C -> [{7,27},{8,55},{9,27},{10,55},{11,27},{12,55},{17,18},{18,110},{19,3},{23,37},{24,37}] | M282: =R[-1]C -> [{0,1,[1,30]},{1,2,[11,40]},{2,5,[21,50]},{5,10,[31,60]},{10,20,[41,60]},{30,20,[51,70]},{50,10,[61,80]},{70,5,[71,80]},{100,2,[81,90]},{150,1,[91,100]}]
A283: 280 | B283: 3 | C283: 6 | D283: 2000 | E283: =R[-9]C -> 1 | F283: =R[-9]C -> 10 | G283: 2 | H283: 10000 | I283: 110003 | J283: 2 | K283: =R[-1]C -> [{7,0},{8,0},{9,6},{10,4},{11,0},{12,0},{17,10},{18,8},{19,1},{23,4},{24,10}] | L283: =R[-1]C -> [{7,27},{8,55},{9,27},{10,55},{11,27},{12,55},{17,18},{18,110},{19,3},{23,37},{24,37}] | M283: =R[-1]C -> [{0,1,[1,30]},{1,2,[11,40]},{2,5,[21,50]},{5,10,[31,60]},{10,20,[41,60]},{30,20,[51,70]},{50,10,[61,80]},{70,5,[71,80]},{100,2,[81,90]},{150,1,[91,100]}]
A284: 281 | B284: 3 | C284: 6 | D284: 2000 | E284: =R[-9]C -> 11 | F284: =R[-9]C -> 20 | G284: 2 | H284: 10000 | I284: 110003 | J284: 2 | K284: =R[-1]C -> [{7,0},{8,0},{9,6},{10,4},{11,0},{12,0},{17,10},{18,8},{19,1},{23,4},{24,10}] | L284: =R[-1]C -> [{7,27},{8,55},{9,27},{10,55},{11,27},{12,55},{17,18},{18,110},{19,3},{23,37},{24,37}] | M284: =R[-1]C -> [{0,1,[1,30]},{1,2,[11,40]},{2,5,[21,50]},{5,10,[31,60]},{10,20,[41,60]},{30,20,[51,70]},{50,10,[61,80]},{70,5,[71,80]},{100,2,[81,90]},{150,1,[91,100]}]
A285: 282 | B285: 3 | C285: 6 | D285: 2000 | E285: =R[-9]C -> 21 | F285: =R[-9]C -> 30 | G285: 2 | H285: 10000 | I285: 110003 | J285: 2 | K285: =R[-1]C -> [{7,0},{8,0},{9,6},{10,4},{11,0},{12,0},{17,10},{18,8},{19,1},{23,4},{24,10}] | L285: =R[-1]C -> [{7,27},{8,55},{9,27},{10,55},{11,27},{12,55},{17,18},{18,110},{19,3},{23,37},{24,37}] | M285: =R[-1]C -> [{0,1,[1,30]},{1,2,[11,40]},{2,5,[21,50]},{5,10,[31,60]},{10,20,[41,60]},{30,20,[51,70]},{50,10,[61,80]},{70,5,[71,80]},{100,2,[81,90]},{150,1,[91,100]}]
A286: 283 | B286: 3 | C286: 6 | D286: 2000 | E286: =R[-9]C -> 31 | F286: =R[-9]C -> 40 | G286: 2 | H286: 10000 | I286: 110003 | J286: 2 | K286: =R[-1]C -> [{7,0},{8,0},{9,6},{10,4},{11,0},{12,0},{17,10},{18,8},{19,1},{23,4},{24,10}] | L286: =R[-1]C -> [{7,27},{8,55},{9,27},{10,55},{11,27},{12,55},{17,18},{18,110},{19,3},{23,37},{24,37}] | M286: =R[-1]C -> [{0,1,[1,30]},{1,2,[11,40]},{2,5,[21,50]},{5,10,[31,60]},{10,20,[41,60]},{30,20,[51,70]},{50,10,[61,80]},{70,5,[71,80]},{100,2,[81,90]},{150,1,[91,100]}]
A287: 284 | B287: 3 | C287: 6 | D287: 2000 | E287: =R[-9]C -> 41 | F287: =R[-9]C -> 50 | G287: 2 | H287: 10000 | I287: 110003 | J287: 2 | K287: =R[-1]C -> [{7,0},{8,0},{9,6},{10,4},{11,0},{12,0},{17,10},{18,8},{19,1},{23,4},{24,10}] | L287: =R[-1]C -> [{7,27},{8,55},{9,27},{10,55},{11,27},{12,55},{17,18},{18,110},{19,3},{23,37},{24,37}] | M287: =R[-1]C -> [{0,1,[1,30]},{1,2,[11,40]},{2,5,[21,50]},{5,10,[31,60]},{10,20,[41,60]},{30,20,[51,70]},{50,10,[61,80]},{70,5,[71,80]},{100,2,[81,90]},{150,1,[91,100]}]
A288: 285 | B288: 3 | C288: 6 | D288: 2000 | E288: =R[-9]C -> 51 | F288: =R[-9]C -> 60 | G288: 2 | H288: 10000 | I288: 110003 | J288: 2 | K288: =R[-1]C -> [{7,0},{8,0},{9,6},{10,4},{11,0},{12,0},{17,10},{18,8},{19,1},{23,4},{24,10}] | L288: =R[-1]C -> [{7,27},{8,55},{9,27},{10,55},{11,27},{12,55},{17,18},{18,110},{19,3},{23,37},{24,37}] | M288: =R[-1]C -> [{0,1,[1,30]},{1,2,[11,40]},{2,5,[21,50]},{5,10,[31,60]},{10,20,[41,60]},{30,20,[51,70]},{50,10,[61,80]},{70,5,[71,80]},{100,2,[81,90]},{150,1,[91,100]}]
A289: 286 | B289: 3 | C289: 6 | D289: 2000 | E289: =R[-9]C -> 61 | F289: =R[-9]C -> 70 | G289: 2 | H289: 10000 | I289: 110003 | J289: 2 | K289: =R[-1]C -> [{7,0},{8,0},{9,6},{10,4},{11,0},{12,0},{17,10},{18,8},{19,1},{23,4},{24,10}] | L289: =R[-1]C -> [{7,27},{8,55},{9,27},{10,55},{11,27},{12,55},{17,18},{18,110},{19,3},{23,37},{24,37}] | M289: =R[-1]C -> [{0,1,[1,30]},{1,2,[11,40]},{2,5,[21,50]},{5,10,[31,60]},{10,20,[41,60]},{30,20,[51,70]},{50,10,[61,80]},{70,5,[71,80]},{100,2,[81,90]},{150,1,[91,100]}]
A290: 287 | B290: 3 | C290: 6 | D290: 2000 | E290: =R[-9]C -> 71 | F290: =R[-9]C -> 80 | G290: 2 | H290: 10000 | I290: 110003 | J290: 2 | K290: =R[-1]C -> [{7,0},{8,0},{9,6},{10,4},{11,0},{12,0},{17,10},{18,8},{19,1},{23,4},{24,10}] | L290: =R[-1]C -> [{7,27},{8,55},{9,27},{10,55},{11,27},{12,55},{17,18},{18,110},{19,3},{23,37},{24,37}] | M290: =R[-1]C -> [{0,1,[1,30]},{1,2,[11,40]},{2,5,[21,50]},{5,10,[31,60]},{10,20,[41,60]},{30,20,[51,70]},{50,10,[61,80]},{70,5,[71,80]},{100,2,[81,90]},{150,1,[91,100]}]
A291: 288 | B291: 3 | C291: 6 | D291: 2000 | E291: =R[-9]C -> 81 | F291: =R[-9]C -> 90 | G291: 2 | H291: 10000 | I291: 110003 | J291: 2 | K291: =R[-1]C -> [{7,0},{8,0},{9,6},{10,4},{11,0},{12,0},{17,10},{18,8},{19,1},{23,4},{24,10}] | L291: =R[-1]C -> [{7,27},{8,55},{9,27},{10,55},{11,27},{12,55},{17,18},{18,110},{19,3},{23,37},{24,37}] | M291: =R[-1]C -> [{0,1,[1,30]},{1,2,[11,40]},{2,5,[21,50]},{5,10,[31,60]},{10,20,[41,60]},{30,20,[51,70]},{50,10,[61,80]},{70,5,[71,80]},{100,2,[81,90]},{150,1,[91,100]}]
A292: 289 | B292: 4 | C292: 6 | D292: 2000 | E292: =R[-9]C -> 1 | F292: =R[-9]C -> 10 | G292: 3 | H292: 15000 | I292: 110003 | J292: 3 | K292: =R[-1]C -> [{7,0},{8,0},{9,6},{10,4},{11,0},{12,0},{17,10},{18,8},{19,1},{23,4},{24,10}] | L292: =R[-1]C -> [{7,27},{8,55},{9,27},{10,55},{11,27},{12,55},{17,18},{18,110},{19,3},{23,37},{24,37}] | M292: =R[-1]C -> [{0,1,[1,30]},{1,2,[11,40]},{2,5,[21,50]},{5,10,[31,60]},{10,20,[41,60]},{30,20,[51,70]},{50,10,[61,80]},{70,5,[71,80]},{100,2,[81,90]},{150,1,[91,100]}]
A293: 290 | B293: 4 | C293: 6 | D293: 2000 | E293: =R[-9]C -> 11 | F293: =R[-9]C -> 20 | G293: 3 | H293: 15000 | I293: 110003 | J293: 3 | K293: =R[-1]C -> [{7,0},{8,0},{9,6},{10,4},{11,0},{12,0},{17,10},{18,8},{19,1},{23,4},{24,10}] | L293: =R[-1]C -> [{7,27},{8,55},{9,27},{10,55},{11,27},{12,55},{17,18},{18,110},{19,3},{23,37},{24,37}] | M293: =R[-1]C -> [{0,1,[1,30]},{1,2,[11,40]},{2,5,[21,50]},{5,10,[31,60]},{10,20,[41,60]},{30,20,[51,70]},{50,10,[61,80]},{70,5,[71,80]},{100,2,[81,90]},{150,1,[91,100]}]
A294: 291 | B294: 4 | C294: 6 | D294: 2000 | E294: =R[-9]C -> 21 | F294: =R[-9]C -> 30 | G294: 3 | H294: 15000 | I294: 110003 | J294: 3 | K294: =R[-1]C -> [{7,0},{8,0},{9,6},{10,4},{11,0},{12,0},{17,10},{18,8},{19,1},{23,4},{24,10}] | L294: =R[-1]C -> [{7,27},{8,55},{9,27},{10,55},{11,27},{12,55},{17,18},{18,110},{19,3},{23,37},{24,37}] | M294: =R[-1]C -> [{0,1,[1,30]},{1,2,[11,40]},{2,5,[21,50]},{5,10,[31,60]},{10,20,[41,60]},{30,20,[51,70]},{50,10,[61,80]},{70,5,[71,80]},{100,2,[81,90]},{150,1,[91,100]}]
A295: 292 | B295: 4 | C295: 6 | D295: 2000 | E295: =R[-9]C -> 31 | F295: =R[-9]C -> 40 | G295: 3 | H295: 15000 | I295: 110003 | J295: 3 | K295: =R[-1]C -> [{7,0},{8,0},{9,6},{10,4},{11,0},{12,0},{17,10},{18,8},{19,1},{23,4},{24,10}] | L295: =R[-1]C -> [{7,27},{8,55},{9,27},{10,55},{11,27},{12,55},{17,18},{18,110},{19,3},{23,37},{24,37}] | M295: =R[-1]C -> [{0,1,[1,30]},{1,2,[11,40]},{2,5,[21,50]},{5,10,[31,60]},{10,20,[41,60]},{30,20,[51,70]},{50,10,[61,80]},{70,5,[71,80]},{100,2,[81,90]},{150,1,[91,100]}]
A296: 293 | B296: 4 | C296: 6 | D296: 2000 | E296: =R[-9]C -> 41 | F296: =R[-9]C -> 50 | G296: 3 | H296: 15000 | I296: 110003 | J296: 3 | K296: =R[-1]C -> [{7,0},{8,0},{9,6},{10,4},{11,0},{12,0},{17,10},{18,8},{19,1},{23,4},{24,10}] | L296: =R[-1]C -> [{7,27},{8,55},{9,27},{10,55},{11,27},{12,55},{17,18},{18,110},{19,3},{23,37},{24,37}] | M296: =R[-1]C -> [{0,1,[1,30]},{1,2,[11,40]},{2,5,[21,50]},{5,10,[31,60]},{10,20,[41,60]},{30,20,[51,70]},{50,10,[61,80]},{70,5,[71,80]},{100,2,[81,90]},{150,1,[91,100]}]
A297: 294 | B297: 4 | C297: 6 | D297: 2000 | E297: =R[-9]C -> 51 | F297: =R[-9]C -> 60 | G297: 3 | H297: 15000 | I297: 110003 | J297: 3 | K297: =R[-1]C -> [{7,0},{8,0},{9,6},{10,4},{11,0},{12,0},{17,10},{18,8},{19,1},{23,4},{24,10}] | L297: =R[-1]C -> [{7,27},{8,55},{9,27},{10,55},{11,27},{12,55},{17,18},{18,110},{19,3},{23,37},{24,37}] | M297: =R[-1]C -> [{0,1,[1,30]},{1,2,[11,40]},{2,5,[21,50]},{5,10,[31,60]},{10,20,[41,60]},{30,20,[51,70]},{50,10,[61,80]},{70,5,[71,80]},{100,2,[81,90]},{150,1,[91,100]}]
A298: 295 | B298: 4 | C298: 6 | D298: 2000 | E298: =R[-9]C -> 61 | F298: =R[-9]C -> 70 | G298: 3 | H298: 15000 | I298: 110003 | J298: 3 | K298: =R[-1]C -> [{7,0},{8,0},{9,6},{10,4},{11,0},{12,0},{17,10},{18,8},{19,1},{23,4},{24,10}] | L298: =R[-1]C -> [{7,27},{8,55},{9,27},{10,55},{11,27},{12,55},{17,18},{18,110},{19,3},{23,37},{24,37}] | M298: =R[-1]C -> [{0,1,[1,30]},{1,2,[11,40]},{2,5,[21,50]},{5,10,[31,60]},{10,20,[41,60]},{30,20,[51,70]},{50,10,[61,80]},{70,5,[71,80]},{100,2,[81,90]},{150,1,[91,100]}]
A299: 296 | B299: 4 | C299: 6 | D299: 2000 | E299: =R[-9]C -> 71 | F299: =R[-9]C -> 80 | G299: 3 | H299: 15000 | I299: 110003 | J299: 3 | K299: =R[-1]C -> [{7,0},{8,0},{9,6},{10,4},{11,0},{12,0},{17,10},{18,8},{19,1},{23,4},{24,10}] | L299: =R[-1]C -> [{7,27},{8,55},{9,27},{10,55},{11,27},{12,55},{17,18},{18,110},{19,3},{23,37},{24,37}] | M299: =R[-1]C -> [{0,1,[1,30]},{1,2,[11,40]},{2,5,[21,50]},{5,10,[31,60]},{10,20,[41,60]},{30,20,[51,70]},{50,10,[61,80]},{70,5,[71,80]},{100,2,[81,90]},{150,1,[91,100]}]
A300: 297 | B300: 4 | C300: 6 | D300: 2000 | E300: =R[-9]C -> 81 | F300: =R[-9]C -> 90 | G300: 3 | H300: 15000 | I300: 110003 | J300: 3 | K300: =R[-1]C -> [{7,0},{8,0},{9,6},{10,4},{11,0},{12,0},{17,10},{18,8},{19,1},{23,4},{24,10}] | L300: =R[-1]C -> [{7,27},{8,55},{9,27},{10,55},{11,27},{12,55},{17,18},{18,110},{19,3},{23,37},{24,37}] | M300: =R[-1]C -> [{0,1,[1,30]},{1,2,[11,40]},{2,5,[21,50]},{5,10,[31,60]},{10,20,[41,60]},{30,20,[51,70]},{50,10,[61,80]},{70,5,[71,80]},{100,2,[81,90]},{150,1,[91,100]}]
A301: 298 | B301: 5 | C301: 6 | D301: 2000 | E301: =R[-9]C -> 1 | F301: =R[-9]C -> 10 | G301: 4 | H301: 20000 | I301: 110003 | J301: 4 | K301: =R[-1]C -> [{7,0},{8,0},{9,6},{10,4},{11,0},{12,0},{17,10},{18,8},{19,1},{23,4},{24,10}] | L301: =R[-1]C -> [{7,27},{8,55},{9,27},{10,55},{11,27},{12,55},{17,18},{18,110},{19,3},{23,37},{24,37}] | M301: =R[-1]C -> [{0,1,[1,30]},{1,2,[11,40]},{2,5,[21,50]},{5,10,[31,60]},{10,20,[41,60]},{30,20,[51,70]},{50,10,[61,80]},{70,5,[71,80]},{100,2,[81,90]},{150,1,[91,100]}]
A302: 299 | B302: 5 | C302: 6 | D302: 2000 | E302: =R[-9]C -> 11 | F302: =R[-9]C -> 20 | G302: 4 | H302: 20000 | I302: 110003 | J302: 4 | K302: =R[-1]C -> [{7,0},{8,0},{9,6},{10,4},{11,0},{12,0},{17,10},{18,8},{19,1},{23,4},{24,10}] | L302: =R[-1]C -> [{7,27},{8,55},{9,27},{10,55},{11,27},{12,55},{17,18},{18,110},{19,3},{23,37},{24,37}] | M302: =R[-1]C -> [{0,1,[1,30]},{1,2,[11,40]},{2,5,[21,50]},{5,10,[31,60]},{10,20,[41,60]},{30,20,[51,70]},{50,10,[61,80]},{70,5,[71,80]},{100,2,[81,90]},{150,1,[91,100]}]
A303: 300 | B303: 5 | C303: 6 | D303: 2000 | E303: =R[-9]C -> 21 | F303: =R[-9]C -> 30 | G303: 4 | H303: 20000 | I303: 110003 | J303: 4 | K303: =R[-1]C -> [{7,0},{8,0},{9,6},{10,4},{11,0},{12,0},{17,10},{18,8},{19,1},{23,4},{24,10}] | L303: =R[-1]C -> [{7,27},{8,55},{9,27},{10,55},{11,27},{12,55},{17,18},{18,110},{19,3},{23,37},{24,37}] | M303: =R[-1]C -> [{0,1,[1,30]},{1,2,[11,40]},{2,5,[21,50]},{5,10,[31,60]},{10,20,[41,60]},{30,20,[51,70]},{50,10,[61,80]},{70,5,[71,80]},{100,2,[81,90]},{150,1,[91,100]}]
A304: 301 | B304: 5 | C304: 6 | D304: 2000 | E304: =R[-9]C -> 31 | F304: =R[-9]C -> 40 | G304: 4 | H304: 20000 | I304: 110003 | J304: 4 | K304: =R[-1]C -> [{7,0},{8,0},{9,6},{10,4},{11,0},{12,0},{17,10},{18,8},{19,1},{23,4},{24,10}] | L304: =R[-1]C -> [{7,27},{8,55},{9,27},{10,55},{11,27},{12,55},{17,18},{18,110},{19,3},{23,37},{24,37}] | M304: =R[-1]C -> [{0,1,[1,30]},{1,2,[11,40]},{2,5,[21,50]},{5,10,[31,60]},{10,20,[41,60]},{30,20,[51,70]},{50,10,[61,80]},{70,5,[71,80]},{100,2,[81,90]},{150,1,[91,100]}]
A305: 302 | B305: 5 | C305: 6 | D305: 2000 | E305: =R[-9]C -> 41 | F305: =R[-9]C -> 50 | G305: 4 | H305: 20000 | I305: 110003 | J305: 4 | K305: =R[-1]C -> [{7,0},{8,0},{9,6},{10,4},{11,0},{12,0},{17,10},{18,8},{19,1},{23,4},{24,10}] | L305: =R[-1]C -> [{7,27},{8,55},{9,27},{10,55},{11,27},{12,55},{17,18},{18,110},{19,3},{23,37},{24,37}] | M305: =R[-1]C -> [{0,1,[1,30]},{1,2,[11,40]},{2,5,[21,50]},{5,10,[31,60]},{10,20,[41,60]},{30,20,[51,70]},{50,10,[61,80]},{70,5,[71,80]},{100,2,[81,90]},{150,1,[91,100]}]
A306: 303 | B306: 5 | C306: 6 | D306: 2000 | E306: =R[-9]C -> 51 | F306: =R[-9]C -> 60 | G306: 4 | H306: 20000 | I306: 110003 | J306: 4 | K306: =R[-1]C -> [{7,0},{8,0},{9,6},{10,4},{11,0},{12,0},{17,10},{18,8},{19,1},{23,4},{24,10}] | L306: =R[-1]C -> [{7,27},{8,55},{9,27},{10,55},{11,27},{12,55},{17,18},{18,110},{19,3},{23,37},{24,37}] | M306: =R[-1]C -> [{0,1,[1,30]},{1,2,[11,40]},{2,5,[21,50]},{5,10,[31,60]},{10,20,[41,60]},{30,20,[51,70]},{50,10,[61,80]},{70,5,[71,80]},{100,2,[81,90]},{150,1,[91,100]}]
A307: 304 | B307: 5 | C307: 6 | D307: 2000 | E307: =R[-9]C -> 61 | F307: =R[-9]C -> 70 | G307: 4 | H307: 20000 | I307: 110003 | J307: 4 | K307: =R[-1]C -> [{7,0},{8,0},{9,6},{10,4},{11,0},{12,0},{17,10},{18,8},{19,1},{23,4},{24,10}] | L307: =R[-1]C -> [{7,27},{8,55},{9,27},{10,55},{11,27},{12,55},{17,18},{18,110},{19,3},{23,37},{24,37}] | M307: =R[-1]C -> [{0,1,[1,30]},{1,2,[11,40]},{2,5,[21,50]},{5,10,[31,60]},{10,20,[41,60]},{30,20,[51,70]},{50,10,[61,80]},{70,5,[71,80]},{100,2,[81,90]},{150,1,[91,100]}]
A308: 305 | B308: 5 | C308: 6 | D308: 2000 | E308: =R[-9]C -> 71 | F308: =R[-9]C -> 80 | G308: 4 | H308: 20000 | I308: 110003 | J308: 4 | K308: =R[-1]C -> [{7,0},{8,0},{9,6},{10,4},{11,0},{12,0},{17,10},{18,8},{19,1},{23,4},{24,10}] | L308: =R[-1]C -> [{7,27},{8,55},{9,27},{10,55},{11,27},{12,55},{17,18},{18,110},{19,3},{23,37},{24,37}] | M308: =R[-1]C -> [{0,1,[1,30]},{1,2,[11,40]},{2,5,[21,50]},{5,10,[31,60]},{10,20,[41,60]},{30,20,[51,70]},{50,10,[61,80]},{70,5,[71,80]},{100,2,[81,90]},{150,1,[91,100]}]
A309: 306 | B309: 5 | C309: 6 | D309: 2000 | E309: =R[-9]C -> 81 | F309: =R[-9]C -> 90 | G309: 4 | H309: 20000 | I309: 110003 | J309: 4 | K309: =R[-1]C -> [{7,0},{8,0},{9,6},{10,4},{11,0},{12,0},{17,10},{18,8},{19,1},{23,4},{24,10}] | L309: =R[-1]C -> [{7,27},{8,55},{9,27},{10,55},{11,27},{12,55},{17,18},{18,110},{19,3},{23,37},{24,37}] | M309: =R[-1]C -> [{0,1,[1,30]},{1,2,[11,40]},{2,5,[21,50]},{5,10,[31,60]},{10,20,[41,60]},{30,20,[51,70]},{50,10,[61,80]},{70,5,[71,80]},{100,2,[81,90]},{150,1,[91,100]}]
A310: 307 | B310: 6 | C310: 6 | D310: 2000 | E310: =R[-9]C -> 1 | F310: =R[-9]C -> 10 | G310: 5 | H310: 20000 | I310: 110003 | J310: 5 | K310: =R[-1]C -> [{7,0},{8,0},{9,6},{10,4},{11,0},{12,0},{17,10},{18,8},{19,1},{23,4},{24,10}] | L310: =R[-1]C -> [{7,27},{8,55},{9,27},{10,55},{11,27},{12,55},{17,18},{18,110},{19,3},{23,37},{24,37}] | M310: =R[-1]C -> [{0,1,[1,30]},{1,2,[11,40]},{2,5,[21,50]},{5,10,[31,60]},{10,20,[41,60]},{30,20,[51,70]},{50,10,[61,80]},{70,5,[71,80]},{100,2,[81,90]},{150,1,[91,100]}]
A311: 308 | B311: 6 | C311: 6 | D311: 2000 | E311: =R[-9]C -> 11 | F311: =R[-9]C -> 20 | G311: 5 | H311: 20000 | I311: 110003 | J311: 5 | K311: =R[-1]C -> [{7,0},{8,0},{9,6},{10,4},{11,0},{12,0},{17,10},{18,8},{19,1},{23,4},{24,10}] | L311: =R[-1]C -> [{7,27},{8,55},{9,27},{10,55},{11,27},{12,55},{17,18},{18,110},{19,3},{23,37},{24,37}] | M311: =R[-1]C -> [{0,1,[1,30]},{1,2,[11,40]},{2,5,[21,50]},{5,10,[31,60]},{10,20,[41,60]},{30,20,[51,70]},{50,10,[61,80]},{70,5,[71,80]},{100,2,[81,90]},{150,1,[91,100]}]
A312: 309 | B312: 6 | C312: 6 | D312: 2000 | E312: =R[-9]C -> 21 | F312: =R[-9]C -> 30 | G312: 5 | H312: 20000 | I312: 110003 | J312: 5 | K312: =R[-1]C -> [{7,0},{8,0},{9,6},{10,4},{11,0},{12,0},{17,10},{18,8},{19,1},{23,4},{24,10}] | L312: =R[-1]C -> [{7,27},{8,55},{9,27},{10,55},{11,27},{12,55},{17,18},{18,110},{19,3},{23,37},{24,37}] | M312: =R[-1]C -> [{0,1,[1,30]},{1,2,[11,40]},{2,5,[21,50]},{5,10,[31,60]},{10,20,[41,60]},{30,20,[51,70]},{50,10,[61,80]},{70,5,[71,80]},{100,2,[81,90]},{150,1,[91,100]}]
A313: 310 | B313: 6 | C313: 6 | D313: 2000 | E313: =R[-9]C -> 31 | F313: =R[-9]C -> 40 | G313: 5 | H313: 20000 | I313: 110003 | J313: 5 | K313: =R[-1]C -> [{7,0},{8,0},{9,6},{10,4},{11,0},{12,0},{17,10},{18,8},{19,1},{23,4},{24,10}] | L313: =R[-1]C -> [{7,27},{8,55},{9,27},{10,55},{11,27},{12,55},{17,18},{18,110},{19,3},{23,37},{24,37}] | M313: =R[-1]C -> [{0,1,[1,30]},{1,2,[11,40]},{2,5,[21,50]},{5,10,[31,60]},{10,20,[41,60]},{30,20,[51,70]},{50,10,[61,80]},{70,5,[71,80]},{100,2,[81,90]},{150,1,[91,100]}]
A314: 311 | B314: 6 | C314: 6 | D314: 2000 | E314: =R[-9]C -> 41 | F314: =R[-9]C -> 50 | G314: 5 | H314: 20000 | I314: 110003 | J314: 5 | K314: =R[-1]C -> [{7,0},{8,0},{9,6},{10,4},{11,0},{12,0},{17,10},{18,8},{19,1},{23,4},{24,10}] | L314: =R[-1]C -> [{7,27},{8,55},{9,27},{10,55},{11,27},{12,55},{17,18},{18,110},{19,3},{23,37},{24,37}] | M314: =R[-1]C -> [{0,1,[1,30]},{1,2,[11,40]},{2,5,[21,50]},{5,10,[31,60]},{10,20,[41,60]},{30,20,[51,70]},{50,10,[61,80]},{70,5,[71,80]},{100,2,[81,90]},{150,1,[91,100]}]
A315: 312 | B315: 6 | C315: 6 | D315: 2000 | E315: =R[-9]C -> 51 | F315: =R[-9]C -> 60 | G315: 5 | H315: 20000 | I315: 110003 | J315: 5 | K315: =R[-1]C -> [{7,0},{8,0},{9,6},{10,4},{11,0},{12,0},{17,10},{18,8},{19,1},{23,4},{24,10}] | L315: =R[-1]C -> [{7,27},{8,55},{9,27},{10,55},{11,27},{12,55},{17,18},{18,110},{19,3},{23,37},{24,37}] | M315: =R[-1]C -> [{0,1,[1,30]},{1,2,[11,40]},{2,5,[21,50]},{5,10,[31,60]},{10,20,[41,60]},{30,20,[51,70]},{50,10,[61,80]},{70,5,[71,80]},{100,2,[81,90]},{150,1,[91,100]}]
A316: 313 | B316: 6 | C316: 6 | D316: 2000 | E316: =R[-9]C -> 61 | F316: =R[-9]C -> 70 | G316: 5 | H316: 20000 | I316: 110003 | J316: 5 | K316: =R[-1]C -> [{7,0},{8,0},{9,6},{10,4},{11,0},{12,0},{17,10},{18,8},{19,1},{23,4},{24,10}] | L316: =R[-1]C -> [{7,27},{8,55},{9,27},{10,55},{11,27},{12,55},{17,18},{18,110},{19,3},{23,37},{24,37}] | M316: =R[-1]C -> [{0,1,[1,30]},{1,2,[11,40]},{2,5,[21,50]},{5,10,[31,60]},{10,20,[41,60]},{30,20,[51,70]},{50,10,[61,80]},{70,5,[71,80]},{100,2,[81,90]},{150,1,[91,100]}]
A317: 314 | B317: 6 | C317: 6 | D317: 2000 | E317: =R[-9]C -> 71 | F317: =R[-9]C -> 80 | G317: 5 | H317: 20000 | I317: 110003 | J317: 5 | K317: =R[-1]C -> [{7,0},{8,0},{9,6},{10,4},{11,0},{12,0},{17,10},{18,8},{19,1},{23,4},{24,10}] | L317: =R[-1]C -> [{7,27},{8,55},{9,27},{10,55},{11,27},{12,55},{17,18},{18,110},{19,3},{23,37},{24,37}] | M317: =R[-1]C -> [{0,1,[1,30]},{1,2,[11,40]},{2,5,[21,50]},{5,10,[31,60]},{10,20,[41,60]},{30,20,[51,70]},{50,10,[61,80]},{70,5,[71,80]},{100,2,[81,90]},{150,1,[91,100]}]
A318: 315 | B318: 6 | C318: 6 | D318: 2000 | E318: =R[-9]C -> 81 | F318: =R[-9]C -> 90 | G318: 5 | H318: 20000 | I318: 110003 | J318: 5 | K318: =R[-1]C -> [{7,0},{8,0},{9,6},{10,4},{11,0},{12,0},{17,10},{18,8},{19,1},{23,4},{24,10}] | L318: =R[-1]C -> [{7,27},{8,55},{9,27},{10,55},{11,27},{12,55},{17,18},{18,110},{19,3},{23,37},{24,37}] | M318: =R[-1]C -> [{0,1,[1,30]},{1,2,[11,40]},{2,5,[21,50]},{5,10,[31,60]},{10,20,[41,60]},{30,20,[51,70]},{50,10,[61,80]},{70,5,[71,80]},{100,2,[81,90]},{150,1,[91,100]}]
A319: 316 | B319: 2 | C319: 7 | D319: 2000 | E319: =R[-18]C -> 1 | F319: =R[-18]C -> 10 | G319: 1 | H319: 5000 | I319: 110003 | J319: 1 | K319: =R[-1]C -> [{7,0},{8,0},{9,6},{10,4},{11,0},{12,0},{17,10},{18,8},{19,1},{23,4},{24,10}] | L319: =R[-1]C -> [{7,27},{8,55},{9,27},{10,55},{11,27},{12,55},{17,18},{18,110},{19,3},{23,37},{24,37}] | M319: =R[-1]C -> [{0,1,[1,30]},{1,2,[11,40]},{2,5,[21,50]},{5,10,[31,60]},{10,20,[41,60]},{30,20,[51,70]},{50,10,[61,80]},{70,5,[71,80]},{100,2,[81,90]},{150,1,[91,100]}]
A320: 317 | B320: 2 | C320: 7 | D320: 2000 | E320: =R[-18]C -> 11 | F320: =R[-18]C -> 20 | G320: 1 | H320: 5000 | I320: 110003 | J320: 1 | K320: =R[-1]C -> [{7,0},{8,0},{9,6},{10,4},{11,0},{12,0},{17,10},{18,8},{19,1},{23,4},{24,10}] | L320: =R[-1]C -> [{7,27},{8,55},{9,27},{10,55},{11,27},{12,55},{17,18},{18,110},{19,3},{23,37},{24,37}] | M320: =R[-1]C -> [{0,1,[1,30]},{1,2,[11,40]},{2,5,[21,50]},{5,10,[31,60]},{10,20,[41,60]},{30,20,[51,70]},{50,10,[61,80]},{70,5,[71,80]},{100,2,[81,90]},{150,1,[91,100]}]
A321: 318 | B321: 2 | C321: 7 | D321: 2000 | E321: =R[-18]C -> 21 | F321: =R[-18]C -> 30 | G321: 1 | H321: 5000 | I321: 110003 | J321: 1 | K321: =R[-1]C -> [{7,0},{8,0},{9,6},{10,4},{11,0},{12,0},{17,10},{18,8},{19,1},{23,4},{24,10}] | L321: =R[-1]C -> [{7,27},{8,55},{9,27},{10,55},{11,27},{12,55},{17,18},{18,110},{19,3},{23,37},{24,37}] | M321: =R[-1]C -> [{0,1,[1,30]},{1,2,[11,40]},{2,5,[21,50]},{5,10,[31,60]},{10,20,[41,60]},{30,20,[51,70]},{50,10,[61,80]},{70,5,[71,80]},{100,2,[81,90]},{150,1,[91,100]}]
A322: 319 | B322: 2 | C322: 7 | D322: 2000 | E322: =R[-18]C -> 31 | F322: =R[-18]C -> 40 | G322: 1 | H322: 5000 | I322: 110003 | J322: 1 | K322: =R[-1]C -> [{7,0},{8,0},{9,6},{10,4},{11,0},{12,0},{17,10},{18,8},{19,1},{23,4},{24,10}] | L322: =R[-1]C -> [{7,27},{8,55},{9,27},{10,55},{11,27},{12,55},{17,18},{18,110},{19,3},{23,37},{24,37}] | M322: =R[-1]C -> [{0,1,[1,30]},{1,2,[11,40]},{2,5,[21,50]},{5,10,[31,60]},{10,20,[41,60]},{30,20,[51,70]},{50,10,[61,80]},{70,5,[71,80]},{100,2,[81,90]},{150,1,[91,100]}]
A323: 320 | B323: 2 | C323: 7 | D323: 2000 | E323: =R[-18]C -> 41 | F323: =R[-18]C -> 50 | G323: 1 | H323: 5000 | I323: 110003 | J323: 1 | K323: =R[-1]C -> [{7,0},{8,0},{9,6},{10,4},{11,0},{12,0},{17,10},{18,8},{19,1},{23,4},{24,10}] | L323: =R[-1]C -> [{7,27},{8,55},{9,27},{10,55},{11,27},{12,55},{17,18},{18,110},{19,3},{23,37},{24,37}] | M323: =R[-1]C -> [{0,1,[1,30]},{1,2,[11,40]},{2,5,[21,50]},{5,10,[31,60]},{10,20,[41,60]},{30,20,[51,70]},{50,10,[61,80]},{70,5,[71,80]},{100,2,[81,90]},{150,1,[91,100]}]
A324: 321 | B324: 2 | C324: 7 | D324: 2000 | E324: =R[-18]C -> 51 | F324: =R[-18]C -> 60 | G324: 1 | H324: 5000 | I324: 110003 | J324: 1 | K324: =R[-1]C -> [{7,0},{8,0},{9,6},{10,4},{11,0},{12,0},{17,10},{18,8},{19,1},{23,4},{24,10}] | L324: =R[-1]C -> [{7,27},{8,55},{9,27},{10,55},{11,27},{12,55},{17,18},{18,110},{19,3},{23,37},{24,37}] | M324: =R[-1]C -> [{0,1,[1,30]},{1,2,[11,40]},{2,5,[21,50]},{5,10,[31,60]},{10,20,[41,60]},{30,20,[51,70]},{50,10,[61,80]},{70,5,[71,80]},{100,2,[81,90]},{150,1,[91,100]}]
A325: 322 | B325: 2 | C325: 7 | D325: 2000 | E325: =R[-18]C -> 61 | F325: =R[-18]C -> 70 | G325: 1 | H325: 5000 | I325: 110003 | J325: 1 | K325: =R[-1]C -> [{7,0},{8,0},{9,6},{10,4},{11,0},{12,0},{17,10},{18,8},{19,1},{23,4},{24,10}] | L325: =R[-1]C -> [{7,27},{8,55},{9,27},{10,55},{11,27},{12,55},{17,18},{18,110},{19,3},{23,37},{24,37}] | M325: =R[-1]C -> [{0,1,[1,30]},{1,2,[11,40]},{2,5,[21,50]},{5,10,[31,60]},{10,20,[41,60]},{30,20,[51,70]},{50,10,[61,80]},{70,5,[71,80]},{100,2,[81,90]},{150,1,[91,100]}]
A326: 323 | B326: 2 | C326: 7 | D326: 2000 | E326: =R[-18]C -> 71 | F326: =R[-18]C -> 80 | G326: 1 | H326: 5000 | I326: 110003 | J326: 1 | K326: =R[-1]C -> [{7,0},{8,0},{9,6},{10,4},{11,0},{12,0},{17,10},{18,8},{19,1},{23,4},{24,10}] | L326: =R[-1]C -> [{7,27},{8,55},{9,27},{10,55},{11,27},{12,55},{17,18},{18,110},{19,3},{23,37},{24,37}] | M326: =R[-1]C -> [{0,1,[1,30]},{1,2,[11,40]},{2,5,[21,50]},{5,10,[31,60]},{10,20,[41,60]},{30,20,[51,70]},{50,10,[61,80]},{70,5,[71,80]},{100,2,[81,90]},{150,1,[91,100]}]
A327: 324 | B327: 2 | C327: 7 | D327: 2000 | E327: =R[-18]C -> 81 | F327: =R[-18]C -> 90 | G327: 1 | H327: 5000 | I327: 110003 | J327: 1 | K327: =R[-1]C -> [{7,0},{8,0},{9,6},{10,4},{11,0},{12,0},{17,10},{18,8},{19,1},{23,4},{24,10}] | L327: =R[-1]C -> [{7,27},{8,55},{9,27},{10,55},{11,27},{12,55},{17,18},{18,110},{19,3},{23,37},{24,37}] | M327: =R[-1]C -> [{0,1,[1,30]},{1,2,[11,40]},{2,5,[21,50]},{5,10,[31,60]},{10,20,[41,60]},{30,20,[51,70]},{50,10,[61,80]},{70,5,[71,80]},{100,2,[81,90]},{150,1,[91,100]}]
A328: 325 | B328: 3 | C328: 7 | D328: 2000 | E328: =R[-9]C -> 1 | F328: =R[-9]C -> 10 | G328: 2 | H328: 10000 | I328: 110003 | J328: 2 | K328: =R[-1]C -> [{7,0},{8,0},{9,6},{10,4},{11,0},{12,0},{17,10},{18,8},{19,1},{23,4},{24,10}] | L328: =R[-1]C -> [{7,27},{8,55},{9,27},{10,55},{11,27},{12,55},{17,18},{18,110},{19,3},{23,37},{24,37}] | M328: =R[-1]C -> [{0,1,[1,30]},{1,2,[11,40]},{2,5,[21,50]},{5,10,[31,60]},{10,20,[41,60]},{30,20,[51,70]},{50,10,[61,80]},{70,5,[71,80]},{100,2,[81,90]},{150,1,[91,100]}]
A329: 326 | B329: 3 | C329: 7 | D329: 2000 | E329: =R[-9]C -> 11 | F329: =R[-9]C -> 20 | G329: 2 | H329: 10000 | I329: 110003 | J329: 2 | K329: =R[-1]C -> [{7,0},{8,0},{9,6},{10,4},{11,0},{12,0},{17,10},{18,8},{19,1},{23,4},{24,10}] | L329: =R[-1]C -> [{7,27},{8,55},{9,27},{10,55},{11,27},{12,55},{17,18},{18,110},{19,3},{23,37},{24,37}] | M329: =R[-1]C -> [{0,1,[1,30]},{1,2,[11,40]},{2,5,[21,50]},{5,10,[31,60]},{10,20,[41,60]},{30,20,[51,70]},{50,10,[61,80]},{70,5,[71,80]},{100,2,[81,90]},{150,1,[91,100]}]
A330: 327 | B330: 3 | C330: 7 | D330: 2000 | E330: =R[-9]C -> 21 | F330: =R[-9]C -> 30 | G330: 2 | H330: 10000 | I330: 110003 | J330: 2 | K330: =R[-1]C -> [{7,0},{8,0},{9,6},{10,4},{11,0},{12,0},{17,10},{18,8},{19,1},{23,4},{24,10}] | L330: =R[-1]C -> [{7,27},{8,55},{9,27},{10,55},{11,27},{12,55},{17,18},{18,110},{19,3},{23,37},{24,37}] | M330: =R[-1]C -> [{0,1,[1,30]},{1,2,[11,40]},{2,5,[21,50]},{5,10,[31,60]},{10,20,[41,60]},{30,20,[51,70]},{50,10,[61,80]},{70,5,[71,80]},{100,2,[81,90]},{150,1,[91,100]}]
A331: 328 | B331: 3 | C331: 7 | D331: 2000 | E331: =R[-9]C -> 31 | F331: =R[-9]C -> 40 | G331: 2 | H331: 10000 | I331: 110003 | J331: 2 | K331: =R[-1]C -> [{7,0},{8,0},{9,6},{10,4},{11,0},{12,0},{17,10},{18,8},{19,1},{23,4},{24,10}] | L331: =R[-1]C -> [{7,27},{8,55},{9,27},{10,55},{11,27},{12,55},{17,18},{18,110},{19,3},{23,37},{24,37}] | M331: =R[-1]C -> [{0,1,[1,30]},{1,2,[11,40]},{2,5,[21,50]},{5,10,[31,60]},{10,20,[41,60]},{30,20,[51,70]},{50,10,[61,80]},{70,5,[71,80]},{100,2,[81,90]},{150,1,[91,100]}]
A332: 329 | B332: 3 | C332: 7 | D332: 2000 | E332: =R[-9]C -> 41 | F332: =R[-9]C -> 50 | G332: 2 | H332: 10000 | I332: 110003 | J332: 2 | K332: =R[-1]C -> [{7,0},{8,0},{9,6},{10,4},{11,0},{12,0},{17,10},{18,8},{19,1},{23,4},{24,10}] | L332: =R[-1]C -> [{7,27},{8,55},{9,27},{10,55},{11,27},{12,55},{17,18},{18,110},{19,3},{23,37},{24,37}] | M332: =R[-1]C -> [{0,1,[1,30]},{1,2,[11,40]},{2,5,[21,50]},{5,10,[31,60]},{10,20,[41,60]},{30,20,[51,70]},{50,10,[61,80]},{70,5,[71,80]},{100,2,[81,90]},{150,1,[91,100]}]
A333: 330 | B333: 3 | C333: 7 | D333: 2000 | E333: =R[-9]C -> 51 | F333: =R[-9]C -> 60 | G333: 2 | H333: 10000 | I333: 110003 | J333: 2 | K333: =R[-1]C -> [{7,0},{8,0},{9,6},{10,4},{11,0},{12,0},{17,10},{18,8},{19,1},{23,4},{24,10}] | L333: =R[-1]C -> [{7,27},{8,55},{9,27},{10,55},{11,27},{12,55},{17,18},{18,110},{19,3},{23,37},{24,37}] | M333: =R[-1]C -> [{0,1,[1,30]},{1,2,[11,40]},{2,5,[21,50]},{5,10,[31,60]},{10,20,[41,60]},{30,20,[51,70]},{50,10,[61,80]},{70,5,[71,80]},{100,2,[81,90]},{150,1,[91,100]}]
A334: 331 | B334: 3 | C334: 7 | D334: 2000 | E334: =R[-9]C -> 61 | F334: =R[-9]C -> 70 | G334: 2 | H334: 10000 | I334: 110003 | J334: 2 | K334: =R[-1]C -> [{7,0},{8,0},{9,6},{10,4},{11,0},{12,0},{17,10},{18,8},{19,1},{23,4},{24,10}] | L334: =R[-1]C -> [{7,27},{8,55},{9,27},{10,55},{11,27},{12,55},{17,18},{18,110},{19,3},{23,37},{24,37}] | M334: =R[-1]C -> [{0,1,[1,30]},{1,2,[11,40]},{2,5,[21,50]},{5,10,[31,60]},{10,20,[41,60]},{30,20,[51,70]},{50,10,[61,80]},{70,5,[71,80]},{100,2,[81,90]},{150,1,[91,100]}]
A335: 332 | B335: 3 | C335: 7 | D335: 2000 | E335: =R[-9]C -> 71 | F335: =R[-9]C -> 80 | G335: 2 | H335: 10000 | I335: 110003 | J335: 2 | K335: =R[-1]C -> [{7,0},{8,0},{9,6},{10,4},{11,0},{12,0},{17,10},{18,8},{19,1},{23,4},{24,10}] | L335: =R[-1]C -> [{7,27},{8,55},{9,27},{10,55},{11,27},{12,55},{17,18},{18,110},{19,3},{23,37},{24,37}] | M335: =R[-1]C -> [{0,1,[1,30]},{1,2,[11,40]},{2,5,[21,50]},{5,10,[31,60]},{10,20,[41,60]},{30,20,[51,70]},{50,10,[61,80]},{70,5,[71,80]},{100,2,[81,90]},{150,1,[91,100]}]
A336: 333 | B336: 3 | C336: 7 | D336: 2000 | E336: =R[-9]C -> 81 | F336: =R[-9]C -> 90 | G336: 2 | H336: 10000 | I336: 110003 | J336: 2 | K336: =R[-1]C -> [{7,0},{8,0},{9,6},{10,4},{11,0},{12,0},{17,10},{18,8},{19,1},{23,4},{24,10}] | L336: =R[-1]C -> [{7,27},{8,55},{9,27},{10,55},{11,27},{12,55},{17,18},{18,110},{19,3},{23,37},{24,37}] | M336: =R[-1]C -> [{0,1,[1,30]},{1,2,[11,40]},{2,5,[21,50]},{5,10,[31,60]},{10,20,[41,60]},{30,20,[51,70]},{50,10,[61,80]},{70,5,[71,80]},{100,2,[81,90]},{150,1,[91,100]}]
A337: 334 | B337: 4 | C337: 7 | D337: 2000 | E337: =R[-9]C -> 1 | F337: =R[-9]C -> 10 | G337: 3 | H337: 15000 | I337: 110003 | J337: 3 | K337: =R[-1]C -> [{7,0},{8,0},{9,6},{10,4},{11,0},{12,0},{17,10},{18,8},{19,1},{23,4},{24,10}] | L337: =R[-1]C -> [{7,27},{8,55},{9,27},{10,55},{11,27},{12,55},{17,18},{18,110},{19,3},{23,37},{24,37}] | M337: =R[-1]C -> [{0,1,[1,30]},{1,2,[11,40]},{2,5,[21,50]},{5,10,[31,60]},{10,20,[41,60]},{30,20,[51,70]},{50,10,[61,80]},{70,5,[71,80]},{100,2,[81,90]},{150,1,[91,100]}]
A338: 335 | B338: 4 | C338: 7 | D338: 2000 | E338: =R[-9]C -> 11 | F338: =R[-9]C -> 20 | G338: 3 | H338: 15000 | I338: 110003 | J338: 3 | K338: =R[-1]C -> [{7,0},{8,0},{9,6},{10,4},{11,0},{12,0},{17,10},{18,8},{19,1},{23,4},{24,10}] | L338: =R[-1]C -> [{7,27},{8,55},{9,27},{10,55},{11,27},{12,55},{17,18},{18,110},{19,3},{23,37},{24,37}] | M338: =R[-1]C -> [{0,1,[1,30]},{1,2,[11,40]},{2,5,[21,50]},{5,10,[31,60]},{10,20,[41,60]},{30,20,[51,70]},{50,10,[61,80]},{70,5,[71,80]},{100,2,[81,90]},{150,1,[91,100]}]
A339: 336 | B339: 4 | C339: 7 | D339: 2000 | E339: =R[-9]C -> 21 | F339: =R[-9]C -> 30 | G339: 3 | H339: 15000 | I339: 110003 | J339: 3 | K339: =R[-1]C -> [{7,0},{8,0},{9,6},{10,4},{11,0},{12,0},{17,10},{18,8},{19,1},{23,4},{24,10}] | L339: =R[-1]C -> [{7,27},{8,55},{9,27},{10,55},{11,27},{12,55},{17,18},{18,110},{19,3},{23,37},{24,37}] | M339: =R[-1]C -> [{0,1,[1,30]},{1,2,[11,40]},{2,5,[21,50]},{5,10,[31,60]},{10,20,[41,60]},{30,20,[51,70]},{50,10,[61,80]},{70,5,[71,80]},{100,2,[81,90]},{150,1,[91,100]}]
A340: 337 | B340: 4 | C340: 7 | D340: 2000 | E340: =R[-9]C -> 31 | F340: =R[-9]C -> 40 | G340: 3 | H340: 15000 | I340: 110003 | J340: 3 | K340: =R[-1]C -> [{7,0},{8,0},{9,6},{10,4},{11,0},{12,0},{17,10},{18,8},{19,1},{23,4},{24,10}] | L340: =R[-1]C -> [{7,27},{8,55},{9,27},{10,55},{11,27},{12,55},{17,18},{18,110},{19,3},{23,37},{24,37}] | M340: =R[-1]C -> [{0,1,[1,30]},{1,2,[11,40]},{2,5,[21,50]},{5,10,[31,60]},{10,20,[41,60]},{30,20,[51,70]},{50,10,[61,80]},{70,5,[71,80]},{100,2,[81,90]},{150,1,[91,100]}]
A341: 338 | B341: 4 | C341: 7 | D341: 2000 | E341: =R[-9]C -> 41 | F341: =R[-9]C -> 50 | G341: 3 | H341: 15000 | I341: 110003 | J341: 3 | K341: =R[-1]C -> [{7,0},{8,0},{9,6},{10,4},{11,0},{12,0},{17,10},{18,8},{19,1},{23,4},{24,10}] | L341: =R[-1]C -> [{7,27},{8,55},{9,27},{10,55},{11,27},{12,55},{17,18},{18,110},{19,3},{23,37},{24,37}] | M341: =R[-1]C -> [{0,1,[1,30]},{1,2,[11,40]},{2,5,[21,50]},{5,10,[31,60]},{10,20,[41,60]},{30,20,[51,70]},{50,10,[61,80]},{70,5,[71,80]},{100,2,[81,90]},{150,1,[91,100]}]
A342: 339 | B342: 4 | C342: 7 | D342: 2000 | E342: =R[-9]C -> 51 | F342: =R[-9]C -> 60 | G342: 3 | H342: 15000 | I342: 110003 | J342: 3 | K342: =R[-1]C -> [{7,0},{8,0},{9,6},{10,4},{11,0},{12,0},{17,10},{18,8},{19,1},{23,4},{24,10}] | L342: =R[-1]C -> [{7,27},{8,55},{9,27},{10,55},{11,27},{12,55},{17,18},{18,110},{19,3},{23,37},{24,37}] | M342: =R[-1]C -> [{0,1,[1,30]},{1,2,[11,40]},{2,5,[21,50]},{5,10,[31,60]},{10,20,[41,60]},{30,20,[51,70]},{50,10,[61,80]},{70,5,[71,80]},{100,2,[81,90]},{150,1,[91,100]}]
A343: 340 | B343: 4 | C343: 7 | D343: 2000 | E343: =R[-9]C -> 61 | F343: =R[-9]C -> 70 | G343: 3 | H343: 15000 | I343: 110003 | J343: 3 | K343: =R[-1]C -> [{7,0},{8,0},{9,6},{10,4},{11,0},{12,0},{17,10},{18,8},{19,1},{23,4},{24,10}] | L343: =R[-1]C -> [{7,27},{8,55},{9,27},{10,55},{11,27},{12,55},{17,18},{18,110},{19,3},{23,37},{24,37}] | M343: =R[-1]C -> [{0,1,[1,30]},{1,2,[11,40]},{2,5,[21,50]},{5,10,[31,60]},{10,20,[41,60]},{30,20,[51,70]},{50,10,[61,80]},{70,5,[71,80]},{100,2,[81,90]},{150,1,[91,100]}]
A344: 341 | B344: 4 | C344: 7 | D344: 2000 | E344: =R[-9]C -> 71 | F344: =R[-9]C -> 80 | G344: 3 | H344: 15000 | I344: 110003 | J344: 3 | K344: =R[-1]C -> [{7,0},{8,0},{9,6},{10,4},{11,0},{12,0},{17,10},{18,8},{19,1},{23,4},{24,10}] | L344: =R[-1]C -> [{7,27},{8,55},{9,27},{10,55},{11,27},{12,55},{17,18},{18,110},{19,3},{23,37},{24,37}] | M344: =R[-1]C -> [{0,1,[1,30]},{1,2,[11,40]},{2,5,[21,50]},{5,10,[31,60]},{10,20,[41,60]},{30,20,[51,70]},{50,10,[61,80]},{70,5,[71,80]},{100,2,[81,90]},{150,1,[91,100]}]
A345: 342 | B345: 4 | C345: 7 | D345: 2000 | E345: =R[-9]C -> 81 | F345: =R[-9]C -> 90 | G345: 3 | H345: 15000 | I345: 110003 | J345: 3 | K345: =R[-1]C -> [{7,0},{8,0},{9,6},{10,4},{11,0},{12,0},{17,10},{18,8},{19,1},{23,4},{24,10}] | L345: =R[-1]C -> [{7,27},{8,55},{9,27},{10,55},{11,27},{12,55},{17,18},{18,110},{19,3},{23,37},{24,37}] | M345: =R[-1]C -> [{0,1,[1,30]},{1,2,[11,40]},{2,5,[21,50]},{5,10,[31,60]},{10,20,[41,60]},{30,20,[51,70]},{50,10,[61,80]},{70,5,[71,80]},{100,2,[81,90]},{150,1,[91,100]}]
A346: 343 | B346: 5 | C346: 7 | D346: 2000 | E346: =R[-9]C -> 1 | F346: =R[-9]C -> 10 | G346: 4 | H346: 20000 | I346: 110003 | J346: 4 | K346: =R[-1]C -> [{7,0},{8,0},{9,6},{10,4},{11,0},{12,0},{17,10},{18,8},{19,1},{23,4},{24,10}] | L346: =R[-1]C -> [{7,27},{8,55},{9,27},{10,55},{11,27},{12,55},{17,18},{18,110},{19,3},{23,37},{24,37}] | M346: =R[-1]C -> [{0,1,[1,30]},{1,2,[11,40]},{2,5,[21,50]},{5,10,[31,60]},{10,20,[41,60]},{30,20,[51,70]},{50,10,[61,80]},{70,5,[71,80]},{100,2,[81,90]},{150,1,[91,100]}]
A347: 344 | B347: 5 | C347: 7 | D347: 2000 | E347: =R[-9]C -> 11 | F347: =R[-9]C -> 20 | G347: 4 | H347: 20000 | I347: 110003 | J347: 4 | K347: =R[-1]C -> [{7,0},{8,0},{9,6},{10,4},{11,0},{12,0},{17,10},{18,8},{19,1},{23,4},{24,10}] | L347: =R[-1]C -> [{7,27},{8,55},{9,27},{10,55},{11,27},{12,55},{17,18},{18,110},{19,3},{23,37},{24,37}] | M347: =R[-1]C -> [{0,1,[1,30]},{1,2,[11,40]},{2,5,[21,50]},{5,10,[31,60]},{10,20,[41,60]},{30,20,[51,70]},{50,10,[61,80]},{70,5,[71,80]},{100,2,[81,90]},{150,1,[91,100]}]
A348: 345 | B348: 5 | C348: 7 | D348: 2000 | E348: =R[-9]C -> 21 | F348: =R[-9]C -> 30 | G348: 4 | H348: 20000 | I348: 110003 | J348: 4 | K348: =R[-1]C -> [{7,0},{8,0},{9,6},{10,4},{11,0},{12,0},{17,10},{18,8},{19,1},{23,4},{24,10}] | L348: =R[-1]C -> [{7,27},{8,55},{9,27},{10,55},{11,27},{12,55},{17,18},{18,110},{19,3},{23,37},{24,37}] | M348: =R[-1]C -> [{0,1,[1,30]},{1,2,[11,40]},{2,5,[21,50]},{5,10,[31,60]},{10,20,[41,60]},{30,20,[51,70]},{50,10,[61,80]},{70,5,[71,80]},{100,2,[81,90]},{150,1,[91,100]}]
A349: 346 | B349: 5 | C349: 7 | D349: 2000 | E349: =R[-9]C -> 31 | F349: =R[-9]C -> 40 | G349: 4 | H349: 20000 | I349: 110003 | J349: 4 | K349: =R[-1]C -> [{7,0},{8,0},{9,6},{10,4},{11,0},{12,0},{17,10},{18,8},{19,1},{23,4},{24,10}] | L349: =R[-1]C -> [{7,27},{8,55},{9,27},{10,55},{11,27},{12,55},{17,18},{18,110},{19,3},{23,37},{24,37}] | M349: =R[-1]C -> [{0,1,[1,30]},{1,2,[11,40]},{2,5,[21,50]},{5,10,[31,60]},{10,20,[41,60]},{30,20,[51,70]},{50,10,[61,80]},{70,5,[71,80]},{100,2,[81,90]},{150,1,[91,100]}]
A350: 347 | B350: 5 | C350: 7 | D350: 2000 | E350: =R[-9]C -> 41 | F350: =R[-9]C -> 50 | G350: 4 | H350: 20000 | I350: 110003 | J350: 4 | K350: =R[-1]C -> [{7,0},{8,0},{9,6},{10,4},{11,0},{12,0},{17,10},{18,8},{19,1},{23,4},{24,10}] | L350: =R[-1]C -> [{7,27},{8,55},{9,27},{10,55},{11,27},{12,55},{17,18},{18,110},{19,3},{23,37},{24,37}] | M350: =R[-1]C -> [{0,1,[1,30]},{1,2,[11,40]},{2,5,[21,50]},{5,10,[31,60]},{10,20,[41,60]},{30,20,[51,70]},{50,10,[61,80]},{70,5,[71,80]},{100,2,[81,90]},{150,1,[91,100]}]
A351: 348 | B351: 5 | C351: 7 | D351: 2000 | E351: =R[-9]C -> 51 | F351: =R[-9]C -> 60 | G351: 4 | H351: 20000 | I351: 110003 | J351: 4 | K351: =R[-1]C -> [{7,0},{8,0},{9,6},{10,4},{11,0},{12,0},{17,10},{18,8},{19,1},{23,4},{24,10}] | L351: =R[-1]C -> [{7,27},{8,55},{9,27},{10,55},{11,27},{12,55},{17,18},{18,110},{19,3},{23,37},{24,37}] | M351: =R[-1]C -> [{0,1,[1,30]},{1,2,[11,40]},{2,5,[21,50]},{5,10,[31,60]},{10,20,[41,60]},{30,20,[51,70]},{50,10,[61,80]},{70,5,[71,80]},{100,2,[81,90]},{150,1,[91,100]}]
A352: 349 | B352: 5 | C352: 7 | D352: 2000 | E352: =R[-9]C -> 61 | F352: =R[-9]C -> 70 | G352: 4 | H352: 20000 | I352: 110003 | J352: 4 | K352: =R[-1]C -> [{7,0},{8,0},{9,6},{10,4},{11,0},{12,0},{17,10},{18,8},{19,1},{23,4},{24,10}] | L352: =R[-1]C -> [{7,27},{8,55},{9,27},{10,55},{11,27},{12,55},{17,18},{18,110},{19,3},{23,37},{24,37}] | M352: =R[-1]C -> [{0,1,[1,30]},{1,2,[11,40]},{2,5,[21,50]},{5,10,[31,60]},{10,20,[41,60]},{30,20,[51,70]},{50,10,[61,80]},{70,5,[71,80]},{100,2,[81,90]},{150,1,[91,100]}]
A353: 350 | B353: 5 | C353: 7 | D353: 2000 | E353: =R[-9]C -> 71 | F353: =R[-9]C -> 80 | G353: 4 | H353: 20000 | I353: 110003 | J353: 4 | K353: =R[-1]C -> [{7,0},{8,0},{9,6},{10,4},{11,0},{12,0},{17,10},{18,8},{19,1},{23,4},{24,10}] | L353: =R[-1]C -> [{7,27},{8,55},{9,27},{10,55},{11,27},{12,55},{17,18},{18,110},{19,3},{23,37},{24,37}] | M353: =R[-1]C -> [{0,1,[1,30]},{1,2,[11,40]},{2,5,[21,50]},{5,10,[31,60]},{10,20,[41,60]},{30,20,[51,70]},{50,10,[61,80]},{70,5,[71,80]},{100,2,[81,90]},{150,1,[91,100]}]
A354: 351 | B354: 5 | C354: 7 | D354: 2000 | E354: =R[-9]C -> 81 | F354: =R[-9]C -> 90 | G354: 4 | H354: 20000 | I354: 110003 | J354: 4 | K354: =R[-1]C -> [{7,0},{8,0},{9,6},{10,4},{11,0},{12,0},{17,10},{18,8},{19,1},{23,4},{24,10}] | L354: =R[-1]C -> [{7,27},{8,55},{9,27},{10,55},{11,27},{12,55},{17,18},{18,110},{19,3},{23,37},{24,37}] | M354: =R[-1]C -> [{0,1,[1,30]},{1,2,[11,40]},{2,5,[21,50]},{5,10,[31,60]},{10,20,[41,60]},{30,20,[51,70]},{50,10,[61,80]},{70,5,[71,80]},{100,2,[81,90]},{150,1,[91,100]}]
A355: 352 | B355: 6 | C355: 7 | D355: 2000 | E355: =R[-9]C -> 1 | F355: =R[-9]C -> 10 | G355: 5 | H355: 20000 | I355: 110003 | J355: 5 | K355: =R[-1]C -> [{7,0},{8,0},{9,6},{10,4},{11,0},{12,0},{17,10},{18,8},{19,1},{23,4},{24,10}] | L355: =R[-1]C -> [{7,27},{8,55},{9,27},{10,55},{11,27},{12,55},{17,18},{18,110},{19,3},{23,37},{24,37}] | M355: =R[-1]C -> [{0,1,[1,30]},{1,2,[11,40]},{2,5,[21,50]},{5,10,[31,60]},{10,20,[41,60]},{30,20,[51,70]},{50,10,[61,80]},{70,5,[71,80]},{100,2,[81,90]},{150,1,[91,100]}]
A356: 353 | B356: 6 | C356: 7 | D356: 2000 | E356: =R[-9]C -> 11 | F356: =R[-9]C -> 20 | G356: 5 | H356: 20000 | I356: 110003 | J356: 5 | K356: =R[-1]C -> [{7,0},{8,0},{9,6},{10,4},{11,0},{12,0},{17,10},{18,8},{19,1},{23,4},{24,10}] | L356: =R[-1]C -> [{7,27},{8,55},{9,27},{10,55},{11,27},{12,55},{17,18},{18,110},{19,3},{23,37},{24,37}] | M356: =R[-1]C -> [{0,1,[1,30]},{1,2,[11,40]},{2,5,[21,50]},{5,10,[31,60]},{10,20,[41,60]},{30,20,[51,70]},{50,10,[61,80]},{70,5,[71,80]},{100,2,[81,90]},{150,1,[91,100]}]
A357: 354 | B357: 6 | C357: 7 | D357: 2000 | E357: =R[-9]C -> 21 | F357: =R[-9]C -> 30 | G357: 5 | H357: 20000 | I357: 110003 | J357: 5 | K357: =R[-1]C -> [{7,0},{8,0},{9,6},{10,4},{11,0},{12,0},{17,10},{18,8},{19,1},{23,4},{24,10}] | L357: =R[-1]C -> [{7,27},{8,55},{9,27},{10,55},{11,27},{12,55},{17,18},{18,110},{19,3},{23,37},{24,37}] | M357: =R[-1]C -> [{0,1,[1,30]},{1,2,[11,40]},{2,5,[21,50]},{5,10,[31,60]},{10,20,[41,60]},{30,20,[51,70]},{50,10,[61,80]},{70,5,[71,80]},{100,2,[81,90]},{150,1,[91,100]}]
A358: 355 | B358: 6 | C358: 7 | D358: 2000 | E358: =R[-9]C -> 31 | F358: =R[-9]C -> 40 | G358: 5 | H358: 20000 | I358: 110003 | J358: 5 | K358: =R[-1]C -> [{7,0},{8,0},{9,6},{10,4},{11,0},{12,0},{17,10},{18,8},{19,1},{23,4},{24,10}] | L358: =R[-1]C -> [{7,27},{8,55},{9,27},{10,55},{11,27},{12,55},{17,18},{18,110},{19,3},{23,37},{24,37}] | M358: =R[-1]C -> [{0,1,[1,30]},{1,2,[11,40]},{2,5,[21,50]},{5,10,[31,60]},{10,20,[41,60]},{30,20,[51,70]},{50,10,[61,80]},{70,5,[71,80]},{100,2,[81,90]},{150,1,[91,100]}]
A359: 356 | B359: 6 | C359: 7 | D359: 2000 | E359: =R[-9]C -> 41 | F359: =R[-9]C -> 50 | G359: 5 | H359: 20000 | I359: 110003 | J359: 5 | K359: =R[-1]C -> [{7,0},{8,0},{9,6},{10,4},{11,0},{12,0},{17,10},{18,8},{19,1},{23,4},{24,10}] | L359: =R[-1]C -> [{7,27},{8,55},{9,27},{10,55},{11,27},{12,55},{17,18},{18,110},{19,3},{23,37},{24,37}] | M359: =R[-1]C -> [{0,1,[1,30]},{1,2,[11,40]},{2,5,[21,50]},{5,10,[31,60]},{10,20,[41,60]},{30,20,[51,70]},{50,10,[61,80]},{70,5,[71,80]},{100,2,[81,90]},{150,1,[91,100]}]
A360: 357 | B360: 6 | C360: 7 | D360: 2000 | E360: =R[-9]C -> 51 | F360: =R[-9]C -> 60 | G360: 5 | H360: 20000 | I360: 110003 | J360: 5 | K360: =R[-1]C -> [{7,0},{8,0},{9,6},{10,4},{11,0},{12,0},{17,10},{18,8},{19,1},{23,4},{24,10}] | L360: =R[-1]C -> [{7,27},{8,55},{9,27},{10,55},{11,27},{12,55},{17,18},{18,110},{19,3},{23,37},{24,37}] | M360: =R[-1]C -> [{0,1,[1,30]},{1,2,[11,40]},{2,5,[21,50]},{5,10,[31,60]},{10,20,[41,60]},{30,20,[51,70]},{50,10,[61,80]},{70,5,[71,80]},{100,2,[81,90]},{150,1,[91,100]}]
A361: 358 | B361: 6 | C361: 7 | D361: 2000 | E361: =R[-9]C -> 61 | F361: =R[-9]C -> 70 | G361: 5 | H361: 20000 | I361: 110003 | J361: 5 | K361: =R[-1]C -> [{7,0},{8,0},{9,6},{10,4},{11,0},{12,0},{17,10},{18,8},{19,1},{23,4},{24,10}] | L361: =R[-1]C -> [{7,27},{8,55},{9,27},{10,55},{11,27},{12,55},{17,18},{18,110},{19,3},{23,37},{24,37}] | M361: =R[-1]C -> [{0,1,[1,30]},{1,2,[11,40]},{2,5,[21,50]},{5,10,[31,60]},{10,20,[41,60]},{30,20,[51,70]},{50,10,[61,80]},{70,5,[71,80]},{100,2,[81,90]},{150,1,[91,100]}]
A362: 359 | B362: 6 | C362: 7 | D362: 2000 | E362: =R[-9]C -> 71 | F362: =R[-9]C -> 80 | G362: 5 | H362: 20000 | I362: 110003 | J362: 5 | K362: =R[-1]C -> [{7,0},{8,0},{9,6},{10,4},{11,0},{12,0},{17,10},{18,8},{19,1},{23,4},{24,10}] | L362: =R[-1]C -> [{7,27},{8,55},{9,27},{10,55},{11,27},{12,55},{17,18},{18,110},{19,3},{23,37},{24,37}] | M362: =R[-1]C -> [{0,1,[1,30]},{1,2,[11,40]},{2,5,[21,50]},{5,10,[31,60]},{10,20,[41,60]},{30,20,[51,70]},{50,10,[61,80]},{70,5,[71,80]},{100,2,[81,90]},{150,1,[91,100]}]
A363: 360 | B363: 6 | C363: 7 | D363: 2000 | E363: =R[-9]C -> 81 | F363: =R[-9]C -> 90 | G363: 5 | H363: 20000 | I363: 110003 | J363: 5 | K363: =R[-1]C -> [{7,0},{8,0},{9,6},{10,4},{11,0},{12,0},{17,10},{18,8},{19,1},{23,4},{24,10}] | L363: =R[-1]C -> [{7,27},{8,55},{9,27},{10,55},{11,27},{12,55},{17,18},{18,110},{19,3},{23,37},{24,37}] | M363: =R[-1]C -> [{0,1,[1,30]},{1,2,[11,40]},{2,5,[21,50]},{5,10,[31,60]},{10,20,[41,60]},{30,20,[51,70]},{50,10,[61,80]},{70,5,[71,80]},{100,2,[81,90]},{150,1,[91,100]}]
A364: 361 | B364: 2 | C364: 1 | D364: 3000 | E364: 1 | F364: 10 | G364: 1 | H364: 5000 | I364: 110003 | J364: 1 | K364: =配置模型!R[-349]C[6] -> [{7,0},{8,0},{9,0},{10,0},{11,6},{12,4},{17,10},{18,8},{19,1},{23,4},{24,10}] | L364: =R[-10]C -> [{7,27},{8,55},{9,27},{10,55},{11,27},{12,55},{17,18},{18,110},{19,3},{23,37},{24,37}] | M364: =R[-10]C -> [{0,1,[1,30]},{1,2,[11,40]},{2,5,[21,50]},{5,10,[31,60]},{10,20,[41,60]},{30,20,[51,70]},{50,10,[61,80]},{70,5,[71,80]},{100,2,[81,90]},{150,1,[91,100]}]
A365: 362 | B365: 2 | C365: 1 | D365: 3000 | E365: =R[-1]C+10 -> 11 | F365: =R[-1]C+10 -> 20 | G365: 1 | H365: 5000 | I365: 110003 | J365: 1 | K365: =R[-1]C -> [{7,0},{8,0},{9,0},{10,0},{11,6},{12,4},{17,10},{18,8},{19,1},{23,4},{24,10}] | L365: =R[-1]C -> [{7,27},{8,55},{9,27},{10,55},{11,27},{12,55},{17,18},{18,110},{19,3},{23,37},{24,37}] | M365: =R[-1]C -> [{0,1,[1,30]},{1,2,[11,40]},{2,5,[21,50]},{5,10,[31,60]},{10,20,[41,60]},{30,20,[51,70]},{50,10,[61,80]},{70,5,[71,80]},{100,2,[81,90]},{150,1,[91,100]}]
A366: 363 | B366: 2 | C366: 1 | D366: 3000 | E366: =R[-1]C+10 -> 21 | F366: =R[-1]C+10 -> 30 | G366: 1 | H366: 5000 | I366: 110003 | J366: 1 | K366: =R[-1]C -> [{7,0},{8,0},{9,0},{10,0},{11,6},{12,4},{17,10},{18,8},{19,1},{23,4},{24,10}] | L366: =R[-1]C -> [{7,27},{8,55},{9,27},{10,55},{11,27},{12,55},{17,18},{18,110},{19,3},{23,37},{24,37}] | M366: =R[-1]C -> [{0,1,[1,30]},{1,2,[11,40]},{2,5,[21,50]},{5,10,[31,60]},{10,20,[41,60]},{30,20,[51,70]},{50,10,[61,80]},{70,5,[71,80]},{100,2,[81,90]},{150,1,[91,100]}]
A367: 364 | B367: 2 | C367: 1 | D367: 3000 | E367: =R[-1]C+10 -> 31 | F367: =R[-1]C+10 -> 40 | G367: 1 | H367: 5000 | I367: 110003 | J367: 1 | K367: =R[-1]C -> [{7,0},{8,0},{9,0},{10,0},{11,6},{12,4},{17,10},{18,8},{19,1},{23,4},{24,10}] | L367: =R[-1]C -> [{7,27},{8,55},{9,27},{10,55},{11,27},{12,55},{17,18},{18,110},{19,3},{23,37},{24,37}] | M367: =R[-1]C -> [{0,1,[1,30]},{1,2,[11,40]},{2,5,[21,50]},{5,10,[31,60]},{10,20,[41,60]},{30,20,[51,70]},{50,10,[61,80]},{70,5,[71,80]},{100,2,[81,90]},{150,1,[91,100]}]
A368: 365 | B368: 2 | C368: 1 | D368: 3000 | E368: =R[-1]C+10 -> 41 | F368: =R[-1]C+10 -> 50 | G368: 1 | H368: 5000 | I368: 110003 | J368: 1 | K368: =R[-1]C -> [{7,0},{8,0},{9,0},{10,0},{11,6},{12,4},{17,10},{18,8},{19,1},{23,4},{24,10}] | L368: =R[-1]C -> [{7,27},{8,55},{9,27},{10,55},{11,27},{12,55},{17,18},{18,110},{19,3},{23,37},{24,37}] | M368: =R[-1]C -> [{0,1,[1,30]},{1,2,[11,40]},{2,5,[21,50]},{5,10,[31,60]},{10,20,[41,60]},{30,20,[51,70]},{50,10,[61,80]},{70,5,[71,80]},{100,2,[81,90]},{150,1,[91,100]}]
A369: 366 | B369: 2 | C369: 1 | D369: 3000 | E369: =R[-1]C+10 -> 51 | F369: =R[-1]C+10 -> 60 | G369: 1 | H369: 5000 | I369: 110003 | J369: 1 | K369: =R[-1]C -> [{7,0},{8,0},{9,0},{10,0},{11,6},{12,4},{17,10},{18,8},{19,1},{23,4},{24,10}] | L369: =R[-1]C -> [{7,27},{8,55},{9,27},{10,55},{11,27},{12,55},{17,18},{18,110},{19,3},{23,37},{24,37}] | M369: =R[-1]C -> [{0,1,[1,30]},{1,2,[11,40]},{2,5,[21,50]},{5,10,[31,60]},{10,20,[41,60]},{30,20,[51,70]},{50,10,[61,80]},{70,5,[71,80]},{100,2,[81,90]},{150,1,[91,100]}]
A370: 367 | B370: 2 | C370: 1 | D370: 3000 | E370: =R[-1]C+10 -> 61 | F370: =R[-1]C+10 -> 70 | G370: 1 | H370: 5000 | I370: 110003 | J370: 1 | K370: =R[-1]C -> [{7,0},{8,0},{9,0},{10,0},{11,6},{12,4},{17,10},{18,8},{19,1},{23,4},{24,10}] | L370: =R[-1]C -> [{7,27},{8,55},{9,27},{10,55},{11,27},{12,55},{17,18},{18,110},{19,3},{23,37},{24,37}] | M370: =R[-1]C -> [{0,1,[1,30]},{1,2,[11,40]},{2,5,[21,50]},{5,10,[31,60]},{10,20,[41,60]},{30,20,[51,70]},{50,10,[61,80]},{70,5,[71,80]},{100,2,[81,90]},{150,1,[91,100]}]
A371: 368 | B371: 2 | C371: 1 | D371: 3000 | E371: =R[-1]C+10 -> 71 | F371: =R[-1]C+10 -> 80 | G371: 1 | H371: 5000 | I371: 110003 | J371: 1 | K371: =R[-1]C -> [{7,0},{8,0},{9,0},{10,0},{11,6},{12,4},{17,10},{18,8},{19,1},{23,4},{24,10}] | L371: =R[-1]C -> [{7,27},{8,55},{9,27},{10,55},{11,27},{12,55},{17,18},{18,110},{19,3},{23,37},{24,37}] | M371: =R[-1]C -> [{0,1,[1,30]},{1,2,[11,40]},{2,5,[21,50]},{5,10,[31,60]},{10,20,[41,60]},{30,20,[51,70]},{50,10,[61,80]},{70,5,[71,80]},{100,2,[81,90]},{150,1,[91,100]}]
A372: 369 | B372: 2 | C372: 1 | D372: 3000 | E372: =R[-1]C+10 -> 81 | F372: =R[-1]C+10 -> 90 | G372: 1 | H372: 5000 | I372: 110003 | J372: 1 | K372: =R[-1]C -> [{7,0},{8,0},{9,0},{10,0},{11,6},{12,4},{17,10},{18,8},{19,1},{23,4},{24,10}] | L372: =R[-1]C -> [{7,27},{8,55},{9,27},{10,55},{11,27},{12,55},{17,18},{18,110},{19,3},{23,37},{24,37}] | M372: =R[-1]C -> [{0,1,[1,30]},{1,2,[11,40]},{2,5,[21,50]},{5,10,[31,60]},{10,20,[41,60]},{30,20,[51,70]},{50,10,[61,80]},{70,5,[71,80]},{100,2,[81,90]},{150,1,[91,100]}]
A373: 370 | B373: 3 | C373: 1 | D373: 3000 | E373: =R[-9]C -> 1 | F373: =R[-9]C -> 10 | G373: 2 | H373: 10000 | I373: 110003 | J373: 2 | K373: =R[-1]C -> [{7,0},{8,0},{9,0},{10,0},{11,6},{12,4},{17,10},{18,8},{19,1},{23,4},{24,10}] | L373: =R[-1]C -> [{7,27},{8,55},{9,27},{10,55},{11,27},{12,55},{17,18},{18,110},{19,3},{23,37},{24,37}] | M373: =R[-1]C -> [{0,1,[1,30]},{1,2,[11,40]},{2,5,[21,50]},{5,10,[31,60]},{10,20,[41,60]},{30,20,[51,70]},{50,10,[61,80]},{70,5,[71,80]},{100,2,[81,90]},{150,1,[91,100]}]
A374: 371 | B374: 3 | C374: 1 | D374: 3000 | E374: =R[-9]C -> 11 | F374: =R[-9]C -> 20 | G374: 2 | H374: 10000 | I374: 110003 | J374: 2 | K374: =R[-1]C -> [{7,0},{8,0},{9,0},{10,0},{11,6},{12,4},{17,10},{18,8},{19,1},{23,4},{24,10}] | L374: =R[-1]C -> [{7,27},{8,55},{9,27},{10,55},{11,27},{12,55},{17,18},{18,110},{19,3},{23,37},{24,37}] | M374: =R[-1]C -> [{0,1,[1,30]},{1,2,[11,40]},{2,5,[21,50]},{5,10,[31,60]},{10,20,[41,60]},{30,20,[51,70]},{50,10,[61,80]},{70,5,[71,80]},{100,2,[81,90]},{150,1,[91,100]}]
A375: 372 | B375: 3 | C375: 1 | D375: 3000 | E375: =R[-9]C -> 21 | F375: =R[-9]C -> 30 | G375: 2 | H375: 10000 | I375: 110003 | J375: 2 | K375: =R[-1]C -> [{7,0},{8,0},{9,0},{10,0},{11,6},{12,4},{17,10},{18,8},{19,1},{23,4},{24,10}] | L375: =R[-1]C -> [{7,27},{8,55},{9,27},{10,55},{11,27},{12,55},{17,18},{18,110},{19,3},{23,37},{24,37}] | M375: =R[-1]C -> [{0,1,[1,30]},{1,2,[11,40]},{2,5,[21,50]},{5,10,[31,60]},{10,20,[41,60]},{30,20,[51,70]},{50,10,[61,80]},{70,5,[71,80]},{100,2,[81,90]},{150,1,[91,100]}]
A376: 373 | B376: 3 | C376: 1 | D376: 3000 | E376: =R[-9]C -> 31 | F376: =R[-9]C -> 40 | G376: 2 | H376: 10000 | I376: 110003 | J376: 2 | K376: =R[-1]C -> [{7,0},{8,0},{9,0},{10,0},{11,6},{12,4},{17,10},{18,8},{19,1},{23,4},{24,10}] | L376: =R[-1]C -> [{7,27},{8,55},{9,27},{10,55},{11,27},{12,55},{17,18},{18,110},{19,3},{23,37},{24,37}] | M376: =R[-1]C -> [{0,1,[1,30]},{1,2,[11,40]},{2,5,[21,50]},{5,10,[31,60]},{10,20,[41,60]},{30,20,[51,70]},{50,10,[61,80]},{70,5,[71,80]},{100,2,[81,90]},{150,1,[91,100]}]
A377: 374 | B377: 3 | C377: 1 | D377: 3000 | E377: =R[-9]C -> 41 | F377: =R[-9]C -> 50 | G377: 2 | H377: 10000 | I377: 110003 | J377: 2 | K377: =R[-1]C -> [{7,0},{8,0},{9,0},{10,0},{11,6},{12,4},{17,10},{18,8},{19,1},{23,4},{24,10}] | L377: =R[-1]C -> [{7,27},{8,55},{9,27},{10,55},{11,27},{12,55},{17,18},{18,110},{19,3},{23,37},{24,37}] | M377: =R[-1]C -> [{0,1,[1,30]},{1,2,[11,40]},{2,5,[21,50]},{5,10,[31,60]},{10,20,[41,60]},{30,20,[51,70]},{50,10,[61,80]},{70,5,[71,80]},{100,2,[81,90]},{150,1,[91,100]}]
A378: 375 | B378: 3 | C378: 1 | D378: 3000 | E378: =R[-9]C -> 51 | F378: =R[-9]C -> 60 | G378: 2 | H378: 10000 | I378: 110003 | J378: 2 | K378: =R[-1]C -> [{7,0},{8,0},{9,0},{10,0},{11,6},{12,4},{17,10},{18,8},{19,1},{23,4},{24,10}] | L378: =R[-1]C -> [{7,27},{8,55},{9,27},{10,55},{11,27},{12,55},{17,18},{18,110},{19,3},{23,37},{24,37}] | M378: =R[-1]C -> [{0,1,[1,30]},{1,2,[11,40]},{2,5,[21,50]},{5,10,[31,60]},{10,20,[41,60]},{30,20,[51,70]},{50,10,[61,80]},{70,5,[71,80]},{100,2,[81,90]},{150,1,[91,100]}]
A379: 376 | B379: 3 | C379: 1 | D379: 3000 | E379: =R[-9]C -> 61 | F379: =R[-9]C -> 70 | G379: 2 | H379: 10000 | I379: 110003 | J379: 2 | K379: =R[-1]C -> [{7,0},{8,0},{9,0},{10,0},{11,6},{12,4},{17,10},{18,8},{19,1},{23,4},{24,10}] | L379: =R[-1]C -> [{7,27},{8,55},{9,27},{10,55},{11,27},{12,55},{17,18},{18,110},{19,3},{23,37},{24,37}] | M379: =R[-1]C -> [{0,1,[1,30]},{1,2,[11,40]},{2,5,[21,50]},{5,10,[31,60]},{10,20,[41,60]},{30,20,[51,70]},{50,10,[61,80]},{70,5,[71,80]},{100,2,[81,90]},{150,1,[91,100]}]
A380: 377 | B380: 3 | C380: 1 | D380: 3000 | E380: =R[-9]C -> 71 | F380: =R[-9]C -> 80 | G380: 2 | H380: 10000 | I380: 110003 | J380: 2 | K380: =R[-1]C -> [{7,0},{8,0},{9,0},{10,0},{11,6},{12,4},{17,10},{18,8},{19,1},{23,4},{24,10}] | L380: =R[-1]C -> [{7,27},{8,55},{9,27},{10,55},{11,27},{12,55},{17,18},{18,110},{19,3},{23,37},{24,37}] | M380: =R[-1]C -> [{0,1,[1,30]},{1,2,[11,40]},{2,5,[21,50]},{5,10,[31,60]},{10,20,[41,60]},{30,20,[51,70]},{50,10,[61,80]},{70,5,[71,80]},{100,2,[81,90]},{150,1,[91,100]}]
A381: 378 | B381: 3 | C381: 1 | D381: 3000 | E381: =R[-9]C -> 81 | F381: =R[-9]C -> 90 | G381: 2 | H381: 10000 | I381: 110003 | J381: 2 | K381: =R[-1]C -> [{7,0},{8,0},{9,0},{10,0},{11,6},{12,4},{17,10},{18,8},{19,1},{23,4},{24,10}] | L381: =R[-1]C -> [{7,27},{8,55},{9,27},{10,55},{11,27},{12,55},{17,18},{18,110},{19,3},{23,37},{24,37}] | M381: =R[-1]C -> [{0,1,[1,30]},{1,2,[11,40]},{2,5,[21,50]},{5,10,[31,60]},{10,20,[41,60]},{30,20,[51,70]},{50,10,[61,80]},{70,5,[71,80]},{100,2,[81,90]},{150,1,[91,100]}]
A382: 379 | B382: 4 | C382: 1 | D382: 3000 | E382: =R[-9]C -> 1 | F382: =R[-9]C -> 10 | G382: 3 | H382: 15000 | I382: 110003 | J382: 3 | K382: =R[-1]C -> [{7,0},{8,0},{9,0},{10,0},{11,6},{12,4},{17,10},{18,8},{19,1},{23,4},{24,10}] | L382: =R[-1]C -> [{7,27},{8,55},{9,27},{10,55},{11,27},{12,55},{17,18},{18,110},{19,3},{23,37},{24,37}] | M382: =R[-1]C -> [{0,1,[1,30]},{1,2,[11,40]},{2,5,[21,50]},{5,10,[31,60]},{10,20,[41,60]},{30,20,[51,70]},{50,10,[61,80]},{70,5,[71,80]},{100,2,[81,90]},{150,1,[91,100]}]
A383: 380 | B383: 4 | C383: 1 | D383: 3000 | E383: =R[-9]C -> 11 | F383: =R[-9]C -> 20 | G383: 3 | H383: 15000 | I383: 110003 | J383: 3 | K383: =R[-1]C -> [{7,0},{8,0},{9,0},{10,0},{11,6},{12,4},{17,10},{18,8},{19,1},{23,4},{24,10}] | L383: =R[-1]C -> [{7,27},{8,55},{9,27},{10,55},{11,27},{12,55},{17,18},{18,110},{19,3},{23,37},{24,37}] | M383: =R[-1]C -> [{0,1,[1,30]},{1,2,[11,40]},{2,5,[21,50]},{5,10,[31,60]},{10,20,[41,60]},{30,20,[51,70]},{50,10,[61,80]},{70,5,[71,80]},{100,2,[81,90]},{150,1,[91,100]}]
A384: 381 | B384: 4 | C384: 1 | D384: 3000 | E384: =R[-9]C -> 21 | F384: =R[-9]C -> 30 | G384: 3 | H384: 15000 | I384: 110003 | J384: 3 | K384: =R[-1]C -> [{7,0},{8,0},{9,0},{10,0},{11,6},{12,4},{17,10},{18,8},{19,1},{23,4},{24,10}] | L384: =R[-1]C -> [{7,27},{8,55},{9,27},{10,55},{11,27},{12,55},{17,18},{18,110},{19,3},{23,37},{24,37}] | M384: =R[-1]C -> [{0,1,[1,30]},{1,2,[11,40]},{2,5,[21,50]},{5,10,[31,60]},{10,20,[41,60]},{30,20,[51,70]},{50,10,[61,80]},{70,5,[71,80]},{100,2,[81,90]},{150,1,[91,100]}]
A385: 382 | B385: 4 | C385: 1 | D385: 3000 | E385: =R[-9]C -> 31 | F385: =R[-9]C -> 40 | G385: 3 | H385: 15000 | I385: 110003 | J385: 3 | K385: =R[-1]C -> [{7,0},{8,0},{9,0},{10,0},{11,6},{12,4},{17,10},{18,8},{19,1},{23,4},{24,10}] | L385: =R[-1]C -> [{7,27},{8,55},{9,27},{10,55},{11,27},{12,55},{17,18},{18,110},{19,3},{23,37},{24,37}] | M385: =R[-1]C -> [{0,1,[1,30]},{1,2,[11,40]},{2,5,[21,50]},{5,10,[31,60]},{10,20,[41,60]},{30,20,[51,70]},{50,10,[61,80]},{70,5,[71,80]},{100,2,[81,90]},{150,1,[91,100]}]
A386: 383 | B386: 4 | C386: 1 | D386: 3000 | E386: =R[-9]C -> 41 | F386: =R[-9]C -> 50 | G386: 3 | H386: 15000 | I386: 110003 | J386: 3 | K386: =R[-1]C -> [{7,0},{8,0},{9,0},{10,0},{11,6},{12,4},{17,10},{18,8},{19,1},{23,4},{24,10}] | L386: =R[-1]C -> [{7,27},{8,55},{9,27},{10,55},{11,27},{12,55},{17,18},{18,110},{19,3},{23,37},{24,37}] | M386: =R[-1]C -> [{0,1,[1,30]},{1,2,[11,40]},{2,5,[21,50]},{5,10,[31,60]},{10,20,[41,60]},{30,20,[51,70]},{50,10,[61,80]},{70,5,[71,80]},{100,2,[81,90]},{150,1,[91,100]}]
A387: 384 | B387: 4 | C387: 1 | D387: 3000 | E387: =R[-9]C -> 51 | F387: =R[-9]C -> 60 | G387: 3 | H387: 15000 | I387: 110003 | J387: 3 | K387: =R[-1]C -> [{7,0},{8,0},{9,0},{10,0},{11,6},{12,4},{17,10},{18,8},{19,1},{23,4},{24,10}] | L387: =R[-1]C -> [{7,27},{8,55},{9,27},{10,55},{11,27},{12,55},{17,18},{18,110},{19,3},{23,37},{24,37}] | M387: =R[-1]C -> [{0,1,[1,30]},{1,2,[11,40]},{2,5,[21,50]},{5,10,[31,60]},{10,20,[41,60]},{30,20,[51,70]},{50,10,[61,80]},{70,5,[71,80]},{100,2,[81,90]},{150,1,[91,100]}]
A388: 385 | B388: 4 | C388: 1 | D388: 3000 | E388: =R[-9]C -> 61 | F388: =R[-9]C -> 70 | G388: 3 | H388: 15000 | I388: 110003 | J388: 3 | K388: =R[-1]C -> [{7,0},{8,0},{9,0},{10,0},{11,6},{12,4},{17,10},{18,8},{19,1},{23,4},{24,10}] | L388: =R[-1]C -> [{7,27},{8,55},{9,27},{10,55},{11,27},{12,55},{17,18},{18,110},{19,3},{23,37},{24,37}] | M388: =R[-1]C -> [{0,1,[1,30]},{1,2,[11,40]},{2,5,[21,50]},{5,10,[31,60]},{10,20,[41,60]},{30,20,[51,70]},{50,10,[61,80]},{70,5,[71,80]},{100,2,[81,90]},{150,1,[91,100]}]
A389: 386 | B389: 4 | C389: 1 | D389: 3000 | E389: =R[-9]C -> 71 | F389: =R[-9]C -> 80 | G389: 3 | H389: 15000 | I389: 110003 | J389: 3 | K389: =R[-1]C -> [{7,0},{8,0},{9,0},{10,0},{11,6},{12,4},{17,10},{18,8},{19,1},{23,4},{24,10}] | L389: =R[-1]C -> [{7,27},{8,55},{9,27},{10,55},{11,27},{12,55},{17,18},{18,110},{19,3},{23,37},{24,37}] | M389: =R[-1]C -> [{0,1,[1,30]},{1,2,[11,40]},{2,5,[21,50]},{5,10,[31,60]},{10,20,[41,60]},{30,20,[51,70]},{50,10,[61,80]},{70,5,[71,80]},{100,2,[81,90]},{150,1,[91,100]}]
A390: 387 | B390: 4 | C390: 1 | D390: 3000 | E390: =R[-9]C -> 81 | F390: =R[-9]C -> 90 | G390: 3 | H390: 15000 | I390: 110003 | J390: 3 | K390: =R[-1]C -> [{7,0},{8,0},{9,0},{10,0},{11,6},{12,4},{17,10},{18,8},{19,1},{23,4},{24,10}] | L390: =R[-1]C -> [{7,27},{8,55},{9,27},{10,55},{11,27},{12,55},{17,18},{18,110},{19,3},{23,37},{24,37}] | M390: =R[-1]C -> [{0,1,[1,30]},{1,2,[11,40]},{2,5,[21,50]},{5,10,[31,60]},{10,20,[41,60]},{30,20,[51,70]},{50,10,[61,80]},{70,5,[71,80]},{100,2,[81,90]},{150,1,[91,100]}]
A391: 388 | B391: 5 | C391: 1 | D391: 3000 | E391: =R[-9]C -> 1 | F391: =R[-9]C -> 10 | G391: 4 | H391: 20000 | I391: 110003 | J391: 4 | K391: =R[-1]C -> [{7,0},{8,0},{9,0},{10,0},{11,6},{12,4},{17,10},{18,8},{19,1},{23,4},{24,10}] | L391: =R[-1]C -> [{7,27},{8,55},{9,27},{10,55},{11,27},{12,55},{17,18},{18,110},{19,3},{23,37},{24,37}] | M391: =R[-1]C -> [{0,1,[1,30]},{1,2,[11,40]},{2,5,[21,50]},{5,10,[31,60]},{10,20,[41,60]},{30,20,[51,70]},{50,10,[61,80]},{70,5,[71,80]},{100,2,[81,90]},{150,1,[91,100]}]
A392: 389 | B392: 5 | C392: 1 | D392: 3000 | E392: =R[-9]C -> 11 | F392: =R[-9]C -> 20 | G392: 4 | H392: 20000 | I392: 110003 | J392: 4 | K392: =R[-1]C -> [{7,0},{8,0},{9,0},{10,0},{11,6},{12,4},{17,10},{18,8},{19,1},{23,4},{24,10}] | L392: =R[-1]C -> [{7,27},{8,55},{9,27},{10,55},{11,27},{12,55},{17,18},{18,110},{19,3},{23,37},{24,37}] | M392: =R[-1]C -> [{0,1,[1,30]},{1,2,[11,40]},{2,5,[21,50]},{5,10,[31,60]},{10,20,[41,60]},{30,20,[51,70]},{50,10,[61,80]},{70,5,[71,80]},{100,2,[81,90]},{150,1,[91,100]}]
A393: 390 | B393: 5 | C393: 1 | D393: 3000 | E393: =R[-9]C -> 21 | F393: =R[-9]C -> 30 | G393: 4 | H393: 20000 | I393: 110003 | J393: 4 | K393: =R[-1]C -> [{7,0},{8,0},{9,0},{10,0},{11,6},{12,4},{17,10},{18,8},{19,1},{23,4},{24,10}] | L393: =R[-1]C -> [{7,27},{8,55},{9,27},{10,55},{11,27},{12,55},{17,18},{18,110},{19,3},{23,37},{24,37}] | M393: =R[-1]C -> [{0,1,[1,30]},{1,2,[11,40]},{2,5,[21,50]},{5,10,[31,60]},{10,20,[41,60]},{30,20,[51,70]},{50,10,[61,80]},{70,5,[71,80]},{100,2,[81,90]},{150,1,[91,100]}]
A394: 391 | B394: 5 | C394: 1 | D394: 3000 | E394: =R[-9]C -> 31 | F394: =R[-9]C -> 40 | G394: 4 | H394: 20000 | I394: 110003 | J394: 4 | K394: =R[-1]C -> [{7,0},{8,0},{9,0},{10,0},{11,6},{12,4},{17,10},{18,8},{19,1},{23,4},{24,10}] | L394: =R[-1]C -> [{7,27},{8,55},{9,27},{10,55},{11,27},{12,55},{17,18},{18,110},{19,3},{23,37},{24,37}] | M394: =R[-1]C -> [{0,1,[1,30]},{1,2,[11,40]},{2,5,[21,50]},{5,10,[31,60]},{10,20,[41,60]},{30,20,[51,70]},{50,10,[61,80]},{70,5,[71,80]},{100,2,[81,90]},{150,1,[91,100]}]
A395: 392 | B395: 5 | C395: 1 | D395: 3000 | E395: =R[-9]C -> 41 | F395: =R[-9]C -> 50 | G395: 4 | H395: 20000 | I395: 110003 | J395: 4 | K395: =R[-1]C -> [{7,0},{8,0},{9,0},{10,0},{11,6},{12,4},{17,10},{18,8},{19,1},{23,4},{24,10}] | L395: =R[-1]C -> [{7,27},{8,55},{9,27},{10,55},{11,27},{12,55},{17,18},{18,110},{19,3},{23,37},{24,37}] | M395: =R[-1]C -> [{0,1,[1,30]},{1,2,[11,40]},{2,5,[21,50]},{5,10,[31,60]},{10,20,[41,60]},{30,20,[51,70]},{50,10,[61,80]},{70,5,[71,80]},{100,2,[81,90]},{150,1,[91,100]}]
A396: 393 | B396: 5 | C396: 1 | D396: 3000 | E396: =R[-9]C -> 51 | F396: =R[-9]C -> 60 | G396: 4 | H396: 20000 | I396: 110003 | J396: 4 | K396: =R[-1]C -> [{7,0},{8,0},{9,0},{10,0},{11,6},{12,4},{17,10},{18,8},{19,1},{23,4},{24,10}] | L396: =R[-1]C -> [{7,27},{8,55},{9,27},{10,55},{11,27},{12,55},{17,18},{18,110},{19,3},{23,37},{24,37}] | M396: =R[-1]C -> [{0,1,[1,30]},{1,2,[11,40]},{2,5,[21,50]},{5,10,[31,60]},{10,20,[41,60]},{30,20,[51,70]},{50,10,[61,80]},{70,5,[71,80]},{100,2,[81,90]},{150,1,[91,100]}]
A397: 394 | B397: 5 | C397: 1 | D397: 3000 | E397: =R[-9]C -> 61 | F397: =R[-9]C -> 70 | G397: 4 | H397: 20000 | I397: 110003 | J397: 4 | K397: =R[-1]C -> [{7,0},{8,0},{9,0},{10,0},{11,6},{12,4},{17,10},{18,8},{19,1},{23,4},{24,10}] | L397: =R[-1]C -> [{7,27},{8,55},{9,27},{10,55},{11,27},{12,55},{17,18},{18,110},{19,3},{23,37},{24,37}] | M397: =R[-1]C -> [{0,1,[1,30]},{1,2,[11,40]},{2,5,[21,50]},{5,10,[31,60]},{10,20,[41,60]},{30,20,[51,70]},{50,10,[61,80]},{70,5,[71,80]},{100,2,[81,90]},{150,1,[91,100]}]
A398: 395 | B398: 5 | C398: 1 | D398: 3000 | E398: =R[-9]C -> 71 | F398: =R[-9]C -> 80 | G398: 4 | H398: 20000 | I398: 110003 | J398: 4 | K398: =R[-1]C -> [{7,0},{8,0},{9,0},{10,0},{11,6},{12,4},{17,10},{18,8},{19,1},{23,4},{24,10}] | L398: =R[-1]C -> [{7,27},{8,55},{9,27},{10,55},{11,27},{12,55},{17,18},{18,110},{19,3},{23,37},{24,37}] | M398: =R[-1]C -> [{0,1,[1,30]},{1,2,[11,40]},{2,5,[21,50]},{5,10,[31,60]},{10,20,[41,60]},{30,20,[51,70]},{50,10,[61,80]},{70,5,[71,80]},{100,2,[81,90]},{150,1,[91,100]}]
A399: 396 | B399: 5 | C399: 1 | D399: 3000 | E399: =R[-9]C -> 81 | F399: =R[-9]C -> 90 | G399: 4 | H399: 20000 | I399: 110003 | J399: 4 | K399: =R[-1]C -> [{7,0},{8,0},{9,0},{10,0},{11,6},{12,4},{17,10},{18,8},{19,1},{23,4},{24,10}] | L399: =R[-1]C -> [{7,27},{8,55},{9,27},{10,55},{11,27},{12,55},{17,18},{18,110},{19,3},{23,37},{24,37}] | M399: =R[-1]C -> [{0,1,[1,30]},{1,2,[11,40]},{2,5,[21,50]},{5,10,[31,60]},{10,20,[41,60]},{30,20,[51,70]},{50,10,[61,80]},{70,5,[71,80]},{100,2,[81,90]},{150,1,[91,100]}]
A400: 397 | B400: 6 | C400: 1 | D400: 3000 | E400: =R[-9]C -> 1 | F400: =R[-9]C -> 10 | G400: 5 | H400: 20000 | I400: 110003 | J400: 5 | K400: =R[-1]C -> [{7,0},{8,0},{9,0},{10,0},{11,6},{12,4},{17,10},{18,8},{19,1},{23,4},{24,10}] | L400: =R[-1]C -> [{7,27},{8,55},{9,27},{10,55},{11,27},{12,55},{17,18},{18,110},{19,3},{23,37},{24,37}] | M400: =R[-1]C -> [{0,1,[1,30]},{1,2,[11,40]},{2,5,[21,50]},{5,10,[31,60]},{10,20,[41,60]},{30,20,[51,70]},{50,10,[61,80]},{70,5,[71,80]},{100,2,[81,90]},{150,1,[91,100]}]
A401: 398 | B401: 6 | C401: 1 | D401: 3000 | E401: =R[-9]C -> 11 | F401: =R[-9]C -> 20 | G401: 5 | H401: 20000 | I401: 110003 | J401: 5 | K401: =R[-1]C -> [{7,0},{8,0},{9,0},{10,0},{11,6},{12,4},{17,10},{18,8},{19,1},{23,4},{24,10}] | L401: =R[-1]C -> [{7,27},{8,55},{9,27},{10,55},{11,27},{12,55},{17,18},{18,110},{19,3},{23,37},{24,37}] | M401: =R[-1]C -> [{0,1,[1,30]},{1,2,[11,40]},{2,5,[21,50]},{5,10,[31,60]},{10,20,[41,60]},{30,20,[51,70]},{50,10,[61,80]},{70,5,[71,80]},{100,2,[81,90]},{150,1,[91,100]}]
A402: 399 | B402: 6 | C402: 1 | D402: 3000 | E402: =R[-9]C -> 21 | F402: =R[-9]C -> 30 | G402: 5 | H402: 20000 | I402: 110003 | J402: 5 | K402: =R[-1]C -> [{7,0},{8,0},{9,0},{10,0},{11,6},{12,4},{17,10},{18,8},{19,1},{23,4},{24,10}] | L402: =R[-1]C -> [{7,27},{8,55},{9,27},{10,55},{11,27},{12,55},{17,18},{18,110},{19,3},{23,37},{24,37}] | M402: =R[-1]C -> [{0,1,[1,30]},{1,2,[11,40]},{2,5,[21,50]},{5,10,[31,60]},{10,20,[41,60]},{30,20,[51,70]},{50,10,[61,80]},{70,5,[71,80]},{100,2,[81,90]},{150,1,[91,100]}]
A403: 400 | B403: 6 | C403: 1 | D403: 3000 | E403: =R[-9]C -> 31 | F403: =R[-9]C -> 40 | G403: 5 | H403: 20000 | I403: 110003 | J403: 5 | K403: =R[-1]C -> [{7,0},{8,0},{9,0},{10,0},{11,6},{12,4},{17,10},{18,8},{19,1},{23,4},{24,10}] | L403: =R[-1]C -> [{7,27},{8,55},{9,27},{10,55},{11,27},{12,55},{17,18},{18,110},{19,3},{23,37},{24,37}] | M403: =R[-1]C -> [{0,1,[1,30]},{1,2,[11,40]},{2,5,[21,50]},{5,10,[31,60]},{10,20,[41,60]},{30,20,[51,70]},{50,10,[61,80]},{70,5,[71,80]},{100,2,[81,90]},{150,1,[91,100]}]
A404: 401 | B404: 6 | C404: 1 | D404: 3000 | E404: =R[-9]C -> 41 | F404: =R[-9]C -> 50 | G404: 5 | H404: 20000 | I404: 110003 | J404: 5 | K404: =R[-1]C -> [{7,0},{8,0},{9,0},{10,0},{11,6},{12,4},{17,10},{18,8},{19,1},{23,4},{24,10}] | L404: =R[-1]C -> [{7,27},{8,55},{9,27},{10,55},{11,27},{12,55},{17,18},{18,110},{19,3},{23,37},{24,37}] | M404: =R[-1]C -> [{0,1,[1,30]},{1,2,[11,40]},{2,5,[21,50]},{5,10,[31,60]},{10,20,[41,60]},{30,20,[51,70]},{50,10,[61,80]},{70,5,[71,80]},{100,2,[81,90]},{150,1,[91,100]}]
A405: 402 | B405: 6 | C405: 1 | D405: 3000 | E405: =R[-9]C -> 51 | F405: =R[-9]C -> 60 | G405: 5 | H405: 20000 | I405: 110003 | J405: 5 | K405: =R[-1]C -> [{7,0},{8,0},{9,0},{10,0},{11,6},{12,4},{17,10},{18,8},{19,1},{23,4},{24,10}] | L405: =R[-1]C -> [{7,27},{8,55},{9,27},{10,55},{11,27},{12,55},{17,18},{18,110},{19,3},{23,37},{24,37}] | M405: =R[-1]C -> [{0,1,[1,30]},{1,2,[11,40]},{2,5,[21,50]},{5,10,[31,60]},{10,20,[41,60]},{30,20,[51,70]},{50,10,[61,80]},{70,5,[71,80]},{100,2,[81,90]},{150,1,[91,100]}]
A406: 403 | B406: 6 | C406: 1 | D406: 3000 | E406: =R[-9]C -> 61 | F406: =R[-9]C -> 70 | G406: 5 | H406: 20000 | I406: 110003 | J406: 5 | K406: =R[-1]C -> [{7,0},{8,0},{9,0},{10,0},{11,6},{12,4},{17,10},{18,8},{19,1},{23,4},{24,10}] | L406: =R[-1]C -> [{7,27},{8,55},{9,27},{10,55},{11,27},{12,55},{17,18},{18,110},{19,3},{23,37},{24,37}] | M406: =R[-1]C -> [{0,1,[1,30]},{1,2,[11,40]},{2,5,[21,50]},{5,10,[31,60]},{10,20,[41,60]},{30,20,[51,70]},{50,10,[61,80]},{70,5,[71,80]},{100,2,[81,90]},{150,1,[91,100]}]
A407: 404 | B407: 6 | C407: 1 | D407: 3000 | E407: =R[-9]C -> 71 | F407: =R[-9]C -> 80 | G407: 5 | H407: 20000 | I407: 110003 | J407: 5 | K407: =R[-1]C -> [{7,0},{8,0},{9,0},{10,0},{11,6},{12,4},{17,10},{18,8},{19,1},{23,4},{24,10}] | L407: =R[-1]C -> [{7,27},{8,55},{9,27},{10,55},{11,27},{12,55},{17,18},{18,110},{19,3},{23,37},{24,37}] | M407: =R[-1]C -> [{0,1,[1,30]},{1,2,[11,40]},{2,5,[21,50]},{5,10,[31,60]},{10,20,[41,60]},{30,20,[51,70]},{50,10,[61,80]},{70,5,[71,80]},{100,2,[81,90]},{150,1,[91,100]}]
A408: 405 | B408: 6 | C408: 1 | D408: 3000 | E408: =R[-9]C -> 81 | F408: =R[-9]C -> 90 | G408: 5 | H408: 20000 | I408: 110003 | J408: 5 | K408: =R[-1]C -> [{7,0},{8,0},{9,0},{10,0},{11,6},{12,4},{17,10},{18,8},{19,1},{23,4},{24,10}] | L408: =R[-1]C -> [{7,27},{8,55},{9,27},{10,55},{11,27},{12,55},{17,18},{18,110},{19,3},{23,37},{24,37}] | M408: =R[-1]C -> [{0,1,[1,30]},{1,2,[11,40]},{2,5,[21,50]},{5,10,[31,60]},{10,20,[41,60]},{30,20,[51,70]},{50,10,[61,80]},{70,5,[71,80]},{100,2,[81,90]},{150,1,[91,100]}]
A409: 406 | B409: 2 | C409: 4 | D409: 3000 | E409: =R[-18]C -> 1 | F409: =R[-18]C -> 10 | G409: 1 | H409: 5000 | I409: 110003 | J409: 1 | K409: =R[-1]C -> [{7,0},{8,0},{9,0},{10,0},{11,6},{12,4},{17,10},{18,8},{19,1},{23,4},{24,10}] | L409: =R[-10]C -> [{7,27},{8,55},{9,27},{10,55},{11,27},{12,55},{17,18},{18,110},{19,3},{23,37},{24,37}] | M409: =R[-10]C -> [{0,1,[1,30]},{1,2,[11,40]},{2,5,[21,50]},{5,10,[31,60]},{10,20,[41,60]},{30,20,[51,70]},{50,10,[61,80]},{70,5,[71,80]},{100,2,[81,90]},{150,1,[91,100]}]
A410: 407 | B410: 2 | C410: 4 | D410: 3000 | E410: =R[-18]C -> 11 | F410: =R[-18]C -> 20 | G410: 1 | H410: 5000 | I410: 110003 | J410: 1 | K410: =R[-1]C -> [{7,0},{8,0},{9,0},{10,0},{11,6},{12,4},{17,10},{18,8},{19,1},{23,4},{24,10}] | L410: =R[-10]C -> [{7,27},{8,55},{9,27},{10,55},{11,27},{12,55},{17,18},{18,110},{19,3},{23,37},{24,37}] | M410: =R[-10]C -> [{0,1,[1,30]},{1,2,[11,40]},{2,5,[21,50]},{5,10,[31,60]},{10,20,[41,60]},{30,20,[51,70]},{50,10,[61,80]},{70,5,[71,80]},{100,2,[81,90]},{150,1,[91,100]}]
A411: 408 | B411: 2 | C411: 4 | D411: 3000 | E411: =R[-18]C -> 21 | F411: =R[-18]C -> 30 | G411: 1 | H411: 5000 | I411: 110003 | J411: 1 | K411: =R[-1]C -> [{7,0},{8,0},{9,0},{10,0},{11,6},{12,4},{17,10},{18,8},{19,1},{23,4},{24,10}] | L411: =R[-1]C -> [{7,27},{8,55},{9,27},{10,55},{11,27},{12,55},{17,18},{18,110},{19,3},{23,37},{24,37}] | M411: =R[-1]C -> [{0,1,[1,30]},{1,2,[11,40]},{2,5,[21,50]},{5,10,[31,60]},{10,20,[41,60]},{30,20,[51,70]},{50,10,[61,80]},{70,5,[71,80]},{100,2,[81,90]},{150,1,[91,100]}]
A412: 409 | B412: 2 | C412: 4 | D412: 3000 | E412: =R[-18]C -> 31 | F412: =R[-18]C -> 40 | G412: 1 | H412: 5000 | I412: 110003 | J412: 1 | K412: =R[-1]C -> [{7,0},{8,0},{9,0},{10,0},{11,6},{12,4},{17,10},{18,8},{19,1},{23,4},{24,10}] | L412: =R[-1]C -> [{7,27},{8,55},{9,27},{10,55},{11,27},{12,55},{17,18},{18,110},{19,3},{23,37},{24,37}] | M412: =R[-1]C -> [{0,1,[1,30]},{1,2,[11,40]},{2,5,[21,50]},{5,10,[31,60]},{10,20,[41,60]},{30,20,[51,70]},{50,10,[61,80]},{70,5,[71,80]},{100,2,[81,90]},{150,1,[91,100]}]
A413: 410 | B413: 2 | C413: 4 | D413: 3000 | E413: =R[-18]C -> 41 | F413: =R[-18]C -> 50 | G413: 1 | H413: 5000 | I413: 110003 | J413: 1 | K413: =R[-1]C -> [{7,0},{8,0},{9,0},{10,0},{11,6},{12,4},{17,10},{18,8},{19,1},{23,4},{24,10}] | L413: =R[-1]C -> [{7,27},{8,55},{9,27},{10,55},{11,27},{12,55},{17,18},{18,110},{19,3},{23,37},{24,37}] | M413: =R[-1]C -> [{0,1,[1,30]},{1,2,[11,40]},{2,5,[21,50]},{5,10,[31,60]},{10,20,[41,60]},{30,20,[51,70]},{50,10,[61,80]},{70,5,[71,80]},{100,2,[81,90]},{150,1,[91,100]}]
A414: 411 | B414: 2 | C414: 4 | D414: 3000 | E414: =R[-18]C -> 51 | F414: =R[-18]C -> 60 | G414: 1 | H414: 5000 | I414: 110003 | J414: 1 | K414: =R[-1]C -> [{7,0},{8,0},{9,0},{10,0},{11,6},{12,4},{17,10},{18,8},{19,1},{23,4},{24,10}] | L414: =R[-1]C -> [{7,27},{8,55},{9,27},{10,55},{11,27},{12,55},{17,18},{18,110},{19,3},{23,37},{24,37}] | M414: =R[-1]C -> [{0,1,[1,30]},{1,2,[11,40]},{2,5,[21,50]},{5,10,[31,60]},{10,20,[41,60]},{30,20,[51,70]},{50,10,[61,80]},{70,5,[71,80]},{100,2,[81,90]},{150,1,[91,100]}]
A415: 412 | B415: 2 | C415: 4 | D415: 3000 | E415: =R[-18]C -> 61 | F415: =R[-18]C -> 70 | G415: 1 | H415: 5000 | I415: 110003 | J415: 1 | K415: =R[-1]C -> [{7,0},{8,0},{9,0},{10,0},{11,6},{12,4},{17,10},{18,8},{19,1},{23,4},{24,10}] | L415: =R[-1]C -> [{7,27},{8,55},{9,27},{10,55},{11,27},{12,55},{17,18},{18,110},{19,3},{23,37},{24,37}] | M415: =R[-1]C -> [{0,1,[1,30]},{1,2,[11,40]},{2,5,[21,50]},{5,10,[31,60]},{10,20,[41,60]},{30,20,[51,70]},{50,10,[61,80]},{70,5,[71,80]},{100,2,[81,90]},{150,1,[91,100]}]
A416: 413 | B416: 2 | C416: 4 | D416: 3000 | E416: =R[-18]C -> 71 | F416: =R[-18]C -> 80 | G416: 1 | H416: 5000 | I416: 110003 | J416: 1 | K416: =R[-1]C -> [{7,0},{8,0},{9,0},{10,0},{11,6},{12,4},{17,10},{18,8},{19,1},{23,4},{24,10}] | L416: =R[-1]C -> [{7,27},{8,55},{9,27},{10,55},{11,27},{12,55},{17,18},{18,110},{19,3},{23,37},{24,37}] | M416: =R[-1]C -> [{0,1,[1,30]},{1,2,[11,40]},{2,5,[21,50]},{5,10,[31,60]},{10,20,[41,60]},{30,20,[51,70]},{50,10,[61,80]},{70,5,[71,80]},{100,2,[81,90]},{150,1,[91,100]}]
A417: 414 | B417: 2 | C417: 4 | D417: 3000 | E417: =R[-18]C -> 81 | F417: =R[-18]C -> 90 | G417: 1 | H417: 5000 | I417: 110003 | J417: 1 | K417: =R[-1]C -> [{7,0},{8,0},{9,0},{10,0},{11,6},{12,4},{17,10},{18,8},{19,1},{23,4},{24,10}] | L417: =R[-1]C -> [{7,27},{8,55},{9,27},{10,55},{11,27},{12,55},{17,18},{18,110},{19,3},{23,37},{24,37}] | M417: =R[-1]C -> [{0,1,[1,30]},{1,2,[11,40]},{2,5,[21,50]},{5,10,[31,60]},{10,20,[41,60]},{30,20,[51,70]},{50,10,[61,80]},{70,5,[71,80]},{100,2,[81,90]},{150,1,[91,100]}]
A418: 415 | B418: 3 | C418: 4 | D418: 3000 | E418: =R[-9]C -> 1 | F418: =R[-9]C -> 10 | G418: 2 | H418: 10000 | I418: 110003 | J418: 2 | K418: =R[-1]C -> [{7,0},{8,0},{9,0},{10,0},{11,6},{12,4},{17,10},{18,8},{19,1},{23,4},{24,10}] | L418: =R[-1]C -> [{7,27},{8,55},{9,27},{10,55},{11,27},{12,55},{17,18},{18,110},{19,3},{23,37},{24,37}] | M418: =R[-1]C -> [{0,1,[1,30]},{1,2,[11,40]},{2,5,[21,50]},{5,10,[31,60]},{10,20,[41,60]},{30,20,[51,70]},{50,10,[61,80]},{70,5,[71,80]},{100,2,[81,90]},{150,1,[91,100]}]
A419: 416 | B419: 3 | C419: 4 | D419: 3000 | E419: =R[-9]C -> 11 | F419: =R[-9]C -> 20 | G419: 2 | H419: 10000 | I419: 110003 | J419: 2 | K419: =R[-1]C -> [{7,0},{8,0},{9,0},{10,0},{11,6},{12,4},{17,10},{18,8},{19,1},{23,4},{24,10}] | L419: =R[-1]C -> [{7,27},{8,55},{9,27},{10,55},{11,27},{12,55},{17,18},{18,110},{19,3},{23,37},{24,37}] | M419: =R[-1]C -> [{0,1,[1,30]},{1,2,[11,40]},{2,5,[21,50]},{5,10,[31,60]},{10,20,[41,60]},{30,20,[51,70]},{50,10,[61,80]},{70,5,[71,80]},{100,2,[81,90]},{150,1,[91,100]}]
A420: 417 | B420: 3 | C420: 4 | D420: 3000 | E420: =R[-9]C -> 21 | F420: =R[-9]C -> 30 | G420: 2 | H420: 10000 | I420: 110003 | J420: 2 | K420: =R[-1]C -> [{7,0},{8,0},{9,0},{10,0},{11,6},{12,4},{17,10},{18,8},{19,1},{23,4},{24,10}] | L420: =R[-1]C -> [{7,27},{8,55},{9,27},{10,55},{11,27},{12,55},{17,18},{18,110},{19,3},{23,37},{24,37}] | M420: =R[-1]C -> [{0,1,[1,30]},{1,2,[11,40]},{2,5,[21,50]},{5,10,[31,60]},{10,20,[41,60]},{30,20,[51,70]},{50,10,[61,80]},{70,5,[71,80]},{100,2,[81,90]},{150,1,[91,100]}]
A421: 418 | B421: 3 | C421: 4 | D421: 3000 | E421: =R[-9]C -> 31 | F421: =R[-9]C -> 40 | G421: 2 | H421: 10000 | I421: 110003 | J421: 2 | K421: =R[-1]C -> [{7,0},{8,0},{9,0},{10,0},{11,6},{12,4},{17,10},{18,8},{19,1},{23,4},{24,10}] | L421: =R[-1]C -> [{7,27},{8,55},{9,27},{10,55},{11,27},{12,55},{17,18},{18,110},{19,3},{23,37},{24,37}] | M421: =R[-1]C -> [{0,1,[1,30]},{1,2,[11,40]},{2,5,[21,50]},{5,10,[31,60]},{10,20,[41,60]},{30,20,[51,70]},{50,10,[61,80]},{70,5,[71,80]},{100,2,[81,90]},{150,1,[91,100]}]
A422: 419 | B422: 3 | C422: 4 | D422: 3000 | E422: =R[-9]C -> 41 | F422: =R[-9]C -> 50 | G422: 2 | H422: 10000 | I422: 110003 | J422: 2 | K422: =R[-1]C -> [{7,0},{8,0},{9,0},{10,0},{11,6},{12,4},{17,10},{18,8},{19,1},{23,4},{24,10}] | L422: =R[-1]C -> [{7,27},{8,55},{9,27},{10,55},{11,27},{12,55},{17,18},{18,110},{19,3},{23,37},{24,37}] | M422: =R[-1]C -> [{0,1,[1,30]},{1,2,[11,40]},{2,5,[21,50]},{5,10,[31,60]},{10,20,[41,60]},{30,20,[51,70]},{50,10,[61,80]},{70,5,[71,80]},{100,2,[81,90]},{150,1,[91,100]}]
A423: 420 | B423: 3 | C423: 4 | D423: 3000 | E423: =R[-9]C -> 51 | F423: =R[-9]C -> 60 | G423: 2 | H423: 10000 | I423: 110003 | J423: 2 | K423: =R[-1]C -> [{7,0},{8,0},{9,0},{10,0},{11,6},{12,4},{17,10},{18,8},{19,1},{23,4},{24,10}] | L423: =R[-1]C -> [{7,27},{8,55},{9,27},{10,55},{11,27},{12,55},{17,18},{18,110},{19,3},{23,37},{24,37}] | M423: =R[-1]C -> [{0,1,[1,30]},{1,2,[11,40]},{2,5,[21,50]},{5,10,[31,60]},{10,20,[41,60]},{30,20,[51,70]},{50,10,[61,80]},{70,5,[71,80]},{100,2,[81,90]},{150,1,[91,100]}]
A424: 421 | B424: 3 | C424: 4 | D424: 3000 | E424: =R[-9]C -> 61 | F424: =R[-9]C -> 70 | G424: 2 | H424: 10000 | I424: 110003 | J424: 2 | K424: =R[-1]C -> [{7,0},{8,0},{9,0},{10,0},{11,6},{12,4},{17,10},{18,8},{19,1},{23,4},{24,10}] | L424: =R[-1]C -> [{7,27},{8,55},{9,27},{10,55},{11,27},{12,55},{17,18},{18,110},{19,3},{23,37},{24,37}] | M424: =R[-1]C -> [{0,1,[1,30]},{1,2,[11,40]},{2,5,[21,50]},{5,10,[31,60]},{10,20,[41,60]},{30,20,[51,70]},{50,10,[61,80]},{70,5,[71,80]},{100,2,[81,90]},{150,1,[91,100]}]
A425: 422 | B425: 3 | C425: 4 | D425: 3000 | E425: =R[-9]C -> 71 | F425: =R[-9]C -> 80 | G425: 2 | H425: 10000 | I425: 110003 | J425: 2 | K425: =R[-1]C -> [{7,0},{8,0},{9,0},{10,0},{11,6},{12,4},{17,10},{18,8},{19,1},{23,4},{24,10}] | L425: =R[-1]C -> [{7,27},{8,55},{9,27},{10,55},{11,27},{12,55},{17,18},{18,110},{19,3},{23,37},{24,37}] | M425: =R[-1]C -> [{0,1,[1,30]},{1,2,[11,40]},{2,5,[21,50]},{5,10,[31,60]},{10,20,[41,60]},{30,20,[51,70]},{50,10,[61,80]},{70,5,[71,80]},{100,2,[81,90]},{150,1,[91,100]}]
A426: 423 | B426: 3 | C426: 4 | D426: 3000 | E426: =R[-9]C -> 81 | F426: =R[-9]C -> 90 | G426: 2 | H426: 10000 | I426: 110003 | J426: 2 | K426: =R[-1]C -> [{7,0},{8,0},{9,0},{10,0},{11,6},{12,4},{17,10},{18,8},{19,1},{23,4},{24,10}] | L426: =R[-1]C -> [{7,27},{8,55},{9,27},{10,55},{11,27},{12,55},{17,18},{18,110},{19,3},{23,37},{24,37}] | M426: =R[-1]C -> [{0,1,[1,30]},{1,2,[11,40]},{2,5,[21,50]},{5,10,[31,60]},{10,20,[41,60]},{30,20,[51,70]},{50,10,[61,80]},{70,5,[71,80]},{100,2,[81,90]},{150,1,[91,100]}]
A427: 424 | B427: 4 | C427: 4 | D427: 3000 | E427: =R[-9]C -> 1 | F427: =R[-9]C -> 10 | G427: 3 | H427: 15000 | I427: 110003 | J427: 3 | K427: =R[-1]C -> [{7,0},{8,0},{9,0},{10,0},{11,6},{12,4},{17,10},{18,8},{19,1},{23,4},{24,10}] | L427: =R[-1]C -> [{7,27},{8,55},{9,27},{10,55},{11,27},{12,55},{17,18},{18,110},{19,3},{23,37},{24,37}] | M427: =R[-1]C -> [{0,1,[1,30]},{1,2,[11,40]},{2,5,[21,50]},{5,10,[31,60]},{10,20,[41,60]},{30,20,[51,70]},{50,10,[61,80]},{70,5,[71,80]},{100,2,[81,90]},{150,1,[91,100]}]
A428: 425 | B428: 4 | C428: 4 | D428: 3000 | E428: =R[-9]C -> 11 | F428: =R[-9]C -> 20 | G428: 3 | H428: 15000 | I428: 110003 | J428: 3 | K428: =R[-1]C -> [{7,0},{8,0},{9,0},{10,0},{11,6},{12,4},{17,10},{18,8},{19,1},{23,4},{24,10}] | L428: =R[-1]C -> [{7,27},{8,55},{9,27},{10,55},{11,27},{12,55},{17,18},{18,110},{19,3},{23,37},{24,37}] | M428: =R[-1]C -> [{0,1,[1,30]},{1,2,[11,40]},{2,5,[21,50]},{5,10,[31,60]},{10,20,[41,60]},{30,20,[51,70]},{50,10,[61,80]},{70,5,[71,80]},{100,2,[81,90]},{150,1,[91,100]}]
A429: 426 | B429: 4 | C429: 4 | D429: 3000 | E429: =R[-9]C -> 21 | F429: =R[-9]C -> 30 | G429: 3 | H429: 15000 | I429: 110003 | J429: 3 | K429: =R[-1]C -> [{7,0},{8,0},{9,0},{10,0},{11,6},{12,4},{17,10},{18,8},{19,1},{23,4},{24,10}] | L429: =R[-1]C -> [{7,27},{8,55},{9,27},{10,55},{11,27},{12,55},{17,18},{18,110},{19,3},{23,37},{24,37}] | M429: =R[-1]C -> [{0,1,[1,30]},{1,2,[11,40]},{2,5,[21,50]},{5,10,[31,60]},{10,20,[41,60]},{30,20,[51,70]},{50,10,[61,80]},{70,5,[71,80]},{100,2,[81,90]},{150,1,[91,100]}]
A430: 427 | B430: 4 | C430: 4 | D430: 3000 | E430: =R[-9]C -> 31 | F430: =R[-9]C -> 40 | G430: 3 | H430: 15000 | I430: 110003 | J430: 3 | K430: =R[-1]C -> [{7,0},{8,0},{9,0},{10,0},{11,6},{12,4},{17,10},{18,8},{19,1},{23,4},{24,10}] | L430: =R[-1]C -> [{7,27},{8,55},{9,27},{10,55},{11,27},{12,55},{17,18},{18,110},{19,3},{23,37},{24,37}] | M430: =R[-1]C -> [{0,1,[1,30]},{1,2,[11,40]},{2,5,[21,50]},{5,10,[31,60]},{10,20,[41,60]},{30,20,[51,70]},{50,10,[61,80]},{70,5,[71,80]},{100,2,[81,90]},{150,1,[91,100]}]
A431: 428 | B431: 4 | C431: 4 | D431: 3000 | E431: =R[-9]C -> 41 | F431: =R[-9]C -> 50 | G431: 3 | H431: 15000 | I431: 110003 | J431: 3 | K431: =R[-1]C -> [{7,0},{8,0},{9,0},{10,0},{11,6},{12,4},{17,10},{18,8},{19,1},{23,4},{24,10}] | L431: =R[-1]C -> [{7,27},{8,55},{9,27},{10,55},{11,27},{12,55},{17,18},{18,110},{19,3},{23,37},{24,37}] | M431: =R[-1]C -> [{0,1,[1,30]},{1,2,[11,40]},{2,5,[21,50]},{5,10,[31,60]},{10,20,[41,60]},{30,20,[51,70]},{50,10,[61,80]},{70,5,[71,80]},{100,2,[81,90]},{150,1,[91,100]}]
A432: 429 | B432: 4 | C432: 4 | D432: 3000 | E432: =R[-9]C -> 51 | F432: =R[-9]C -> 60 | G432: 3 | H432: 15000 | I432: 110003 | J432: 3 | K432: =R[-1]C -> [{7,0},{8,0},{9,0},{10,0},{11,6},{12,4},{17,10},{18,8},{19,1},{23,4},{24,10}] | L432: =R[-1]C -> [{7,27},{8,55},{9,27},{10,55},{11,27},{12,55},{17,18},{18,110},{19,3},{23,37},{24,37}] | M432: =R[-1]C -> [{0,1,[1,30]},{1,2,[11,40]},{2,5,[21,50]},{5,10,[31,60]},{10,20,[41,60]},{30,20,[51,70]},{50,10,[61,80]},{70,5,[71,80]},{100,2,[81,90]},{150,1,[91,100]}]
A433: 430 | B433: 4 | C433: 4 | D433: 3000 | E433: =R[-9]C -> 61 | F433: =R[-9]C -> 70 | G433: 3 | H433: 15000 | I433: 110003 | J433: 3 | K433: =R[-1]C -> [{7,0},{8,0},{9,0},{10,0},{11,6},{12,4},{17,10},{18,8},{19,1},{23,4},{24,10}] | L433: =R[-1]C -> [{7,27},{8,55},{9,27},{10,55},{11,27},{12,55},{17,18},{18,110},{19,3},{23,37},{24,37}] | M433: =R[-1]C -> [{0,1,[1,30]},{1,2,[11,40]},{2,5,[21,50]},{5,10,[31,60]},{10,20,[41,60]},{30,20,[51,70]},{50,10,[61,80]},{70,5,[71,80]},{100,2,[81,90]},{150,1,[91,100]}]
A434: 431 | B434: 4 | C434: 4 | D434: 3000 | E434: =R[-9]C -> 71 | F434: =R[-9]C -> 80 | G434: 3 | H434: 15000 | I434: 110003 | J434: 3 | K434: =R[-1]C -> [{7,0},{8,0},{9,0},{10,0},{11,6},{12,4},{17,10},{18,8},{19,1},{23,4},{24,10}] | L434: =R[-1]C -> [{7,27},{8,55},{9,27},{10,55},{11,27},{12,55},{17,18},{18,110},{19,3},{23,37},{24,37}] | M434: =R[-1]C -> [{0,1,[1,30]},{1,2,[11,40]},{2,5,[21,50]},{5,10,[31,60]},{10,20,[41,60]},{30,20,[51,70]},{50,10,[61,80]},{70,5,[71,80]},{100,2,[81,90]},{150,1,[91,100]}]
A435: 432 | B435: 4 | C435: 4 | D435: 3000 | E435: =R[-9]C -> 81 | F435: =R[-9]C -> 90 | G435: 3 | H435: 15000 | I435: 110003 | J435: 3 | K435: =R[-1]C -> [{7,0},{8,0},{9,0},{10,0},{11,6},{12,4},{17,10},{18,8},{19,1},{23,4},{24,10}] | L435: =R[-1]C -> [{7,27},{8,55},{9,27},{10,55},{11,27},{12,55},{17,18},{18,110},{19,3},{23,37},{24,37}] | M435: =R[-1]C -> [{0,1,[1,30]},{1,2,[11,40]},{2,5,[21,50]},{5,10,[31,60]},{10,20,[41,60]},{30,20,[51,70]},{50,10,[61,80]},{70,5,[71,80]},{100,2,[81,90]},{150,1,[91,100]}]
A436: 433 | B436: 5 | C436: 4 | D436: 3000 | E436: =R[-9]C -> 1 | F436: =R[-9]C -> 10 | G436: 4 | H436: 20000 | I436: 110003 | J436: 4 | K436: =R[-1]C -> [{7,0},{8,0},{9,0},{10,0},{11,6},{12,4},{17,10},{18,8},{19,1},{23,4},{24,10}] | L436: =R[-1]C -> [{7,27},{8,55},{9,27},{10,55},{11,27},{12,55},{17,18},{18,110},{19,3},{23,37},{24,37}] | M436: =R[-1]C -> [{0,1,[1,30]},{1,2,[11,40]},{2,5,[21,50]},{5,10,[31,60]},{10,20,[41,60]},{30,20,[51,70]},{50,10,[61,80]},{70,5,[71,80]},{100,2,[81,90]},{150,1,[91,100]}]
A437: 434 | B437: 5 | C437: 4 | D437: 3000 | E437: =R[-9]C -> 11 | F437: =R[-9]C -> 20 | G437: 4 | H437: 20000 | I437: 110003 | J437: 4 | K437: =R[-1]C -> [{7,0},{8,0},{9,0},{10,0},{11,6},{12,4},{17,10},{18,8},{19,1},{23,4},{24,10}] | L437: =R[-1]C -> [{7,27},{8,55},{9,27},{10,55},{11,27},{12,55},{17,18},{18,110},{19,3},{23,37},{24,37}] | M437: =R[-1]C -> [{0,1,[1,30]},{1,2,[11,40]},{2,5,[21,50]},{5,10,[31,60]},{10,20,[41,60]},{30,20,[51,70]},{50,10,[61,80]},{70,5,[71,80]},{100,2,[81,90]},{150,1,[91,100]}]
A438: 435 | B438: 5 | C438: 4 | D438: 3000 | E438: =R[-9]C -> 21 | F438: =R[-9]C -> 30 | G438: 4 | H438: 20000 | I438: 110003 | J438: 4 | K438: =R[-1]C -> [{7,0},{8,0},{9,0},{10,0},{11,6},{12,4},{17,10},{18,8},{19,1},{23,4},{24,10}] | L438: =R[-1]C -> [{7,27},{8,55},{9,27},{10,55},{11,27},{12,55},{17,18},{18,110},{19,3},{23,37},{24,37}] | M438: =R[-1]C -> [{0,1,[1,30]},{1,2,[11,40]},{2,5,[21,50]},{5,10,[31,60]},{10,20,[41,60]},{30,20,[51,70]},{50,10,[61,80]},{70,5,[71,80]},{100,2,[81,90]},{150,1,[91,100]}]
A439: 436 | B439: 5 | C439: 4 | D439: 3000 | E439: =R[-9]C -> 31 | F439: =R[-9]C -> 40 | G439: 4 | H439: 20000 | I439: 110003 | J439: 4 | K439: =R[-1]C -> [{7,0},{8,0},{9,0},{10,0},{11,6},{12,4},{17,10},{18,8},{19,1},{23,4},{24,10}] | L439: =R[-1]C -> [{7,27},{8,55},{9,27},{10,55},{11,27},{12,55},{17,18},{18,110},{19,3},{23,37},{24,37}] | M439: =R[-1]C -> [{0,1,[1,30]},{1,2,[11,40]},{2,5,[21,50]},{5,10,[31,60]},{10,20,[41,60]},{30,20,[51,70]},{50,10,[61,80]},{70,5,[71,80]},{100,2,[81,90]},{150,1,[91,100]}]
A440: 437 | B440: 5 | C440: 4 | D440: 3000 | E440: =R[-9]C -> 41 | F440: =R[-9]C -> 50 | G440: 4 | H440: 20000 | I440: 110003 | J440: 4 | K440: =R[-1]C -> [{7,0},{8,0},{9,0},{10,0},{11,6},{12,4},{17,10},{18,8},{19,1},{23,4},{24,10}] | L440: =R[-1]C -> [{7,27},{8,55},{9,27},{10,55},{11,27},{12,55},{17,18},{18,110},{19,3},{23,37},{24,37}] | M440: =R[-1]C -> [{0,1,[1,30]},{1,2,[11,40]},{2,5,[21,50]},{5,10,[31,60]},{10,20,[41,60]},{30,20,[51,70]},{50,10,[61,80]},{70,5,[71,80]},{100,2,[81,90]},{150,1,[91,100]}]
A441: 438 | B441: 5 | C441: 4 | D441: 3000 | E441: =R[-9]C -> 51 | F441: =R[-9]C -> 60 | G441: 4 | H441: 20000 | I441: 110003 | J441: 4 | K441: =R[-1]C -> [{7,0},{8,0},{9,0},{10,0},{11,6},{12,4},{17,10},{18,8},{19,1},{23,4},{24,10}] | L441: =R[-1]C -> [{7,27},{8,55},{9,27},{10,55},{11,27},{12,55},{17,18},{18,110},{19,3},{23,37},{24,37}] | M441: =R[-1]C -> [{0,1,[1,30]},{1,2,[11,40]},{2,5,[21,50]},{5,10,[31,60]},{10,20,[41,60]},{30,20,[51,70]},{50,10,[61,80]},{70,5,[71,80]},{100,2,[81,90]},{150,1,[91,100]}]
A442: 439 | B442: 5 | C442: 4 | D442: 3000 | E442: =R[-9]C -> 61 | F442: =R[-9]C -> 70 | G442: 4 | H442: 20000 | I442: 110003 | J442: 4 | K442: =R[-1]C -> [{7,0},{8,0},{9,0},{10,0},{11,6},{12,4},{17,10},{18,8},{19,1},{23,4},{24,10}] | L442: =R[-1]C -> [{7,27},{8,55},{9,27},{10,55},{11,27},{12,55},{17,18},{18,110},{19,3},{23,37},{24,37}] | M442: =R[-1]C -> [{0,1,[1,30]},{1,2,[11,40]},{2,5,[21,50]},{5,10,[31,60]},{10,20,[41,60]},{30,20,[51,70]},{50,10,[61,80]},{70,5,[71,80]},{100,2,[81,90]},{150,1,[91,100]}]
A443: 440 | B443: 5 | C443: 4 | D443: 3000 | E443: =R[-9]C -> 71 | F443: =R[-9]C -> 80 | G443: 4 | H443: 20000 | I443: 110003 | J443: 4 | K443: =R[-1]C -> [{7,0},{8,0},{9,0},{10,0},{11,6},{12,4},{17,10},{18,8},{19,1},{23,4},{24,10}] | L443: =R[-1]C -> [{7,27},{8,55},{9,27},{10,55},{11,27},{12,55},{17,18},{18,110},{19,3},{23,37},{24,37}] | M443: =R[-1]C -> [{0,1,[1,30]},{1,2,[11,40]},{2,5,[21,50]},{5,10,[31,60]},{10,20,[41,60]},{30,20,[51,70]},{50,10,[61,80]},{70,5,[71,80]},{100,2,[81,90]},{150,1,[91,100]}]
A444: 441 | B444: 5 | C444: 4 | D444: 3000 | E444: =R[-9]C -> 81 | F444: =R[-9]C -> 90 | G444: 4 | H444: 20000 | I444: 110003 | J444: 4 | K444: =R[-1]C -> [{7,0},{8,0},{9,0},{10,0},{11,6},{12,4},{17,10},{18,8},{19,1},{23,4},{24,10}] | L444: =R[-1]C -> [{7,27},{8,55},{9,27},{10,55},{11,27},{12,55},{17,18},{18,110},{19,3},{23,37},{24,37}] | M444: =R[-1]C -> [{0,1,[1,30]},{1,2,[11,40]},{2,5,[21,50]},{5,10,[31,60]},{10,20,[41,60]},{30,20,[51,70]},{50,10,[61,80]},{70,5,[71,80]},{100,2,[81,90]},{150,1,[91,100]}]
A445: 442 | B445: 6 | C445: 4 | D445: 3000 | E445: =R[-9]C -> 1 | F445: =R[-9]C -> 10 | G445: 5 | H445: 20000 | I445: 110003 | J445: 5 | K445: =R[-1]C -> [{7,0},{8,0},{9,0},{10,0},{11,6},{12,4},{17,10},{18,8},{19,1},{23,4},{24,10}] | L445: =R[-1]C -> [{7,27},{8,55},{9,27},{10,55},{11,27},{12,55},{17,18},{18,110},{19,3},{23,37},{24,37}] | M445: =R[-1]C -> [{0,1,[1,30]},{1,2,[11,40]},{2,5,[21,50]},{5,10,[31,60]},{10,20,[41,60]},{30,20,[51,70]},{50,10,[61,80]},{70,5,[71,80]},{100,2,[81,90]},{150,1,[91,100]}]
A446: 443 | B446: 6 | C446: 4 | D446: 3000 | E446: =R[-9]C -> 11 | F446: =R[-9]C -> 20 | G446: 5 | H446: 20000 | I446: 110003 | J446: 5 | K446: =R[-1]C -> [{7,0},{8,0},{9,0},{10,0},{11,6},{12,4},{17,10},{18,8},{19,1},{23,4},{24,10}] | L446: =R[-1]C -> [{7,27},{8,55},{9,27},{10,55},{11,27},{12,55},{17,18},{18,110},{19,3},{23,37},{24,37}] | M446: =R[-1]C -> [{0,1,[1,30]},{1,2,[11,40]},{2,5,[21,50]},{5,10,[31,60]},{10,20,[41,60]},{30,20,[51,70]},{50,10,[61,80]},{70,5,[71,80]},{100,2,[81,90]},{150,1,[91,100]}]
A447: 444 | B447: 6 | C447: 4 | D447: 3000 | E447: =R[-9]C -> 21 | F447: =R[-9]C -> 30 | G447: 5 | H447: 20000 | I447: 110003 | J447: 5 | K447: =R[-1]C -> [{7,0},{8,0},{9,0},{10,0},{11,6},{12,4},{17,10},{18,8},{19,1},{23,4},{24,10}] | L447: =R[-1]C -> [{7,27},{8,55},{9,27},{10,55},{11,27},{12,55},{17,18},{18,110},{19,3},{23,37},{24,37}] | M447: =R[-1]C -> [{0,1,[1,30]},{1,2,[11,40]},{2,5,[21,50]},{5,10,[31,60]},{10,20,[41,60]},{30,20,[51,70]},{50,10,[61,80]},{70,5,[71,80]},{100,2,[81,90]},{150,1,[91,100]}]
A448: 445 | B448: 6 | C448: 4 | D448: 3000 | E448: =R[-9]C -> 31 | F448: =R[-9]C -> 40 | G448: 5 | H448: 20000 | I448: 110003 | J448: 5 | K448: =R[-1]C -> [{7,0},{8,0},{9,0},{10,0},{11,6},{12,4},{17,10},{18,8},{19,1},{23,4},{24,10}] | L448: =R[-1]C -> [{7,27},{8,55},{9,27},{10,55},{11,27},{12,55},{17,18},{18,110},{19,3},{23,37},{24,37}] | M448: =R[-1]C -> [{0,1,[1,30]},{1,2,[11,40]},{2,5,[21,50]},{5,10,[31,60]},{10,20,[41,60]},{30,20,[51,70]},{50,10,[61,80]},{70,5,[71,80]},{100,2,[81,90]},{150,1,[91,100]}]
A449: 446 | B449: 6 | C449: 4 | D449: 3000 | E449: =R[-9]C -> 41 | F449: =R[-9]C -> 50 | G449: 5 | H449: 20000 | I449: 110003 | J449: 5 | K449: =R[-1]C -> [{7,0},{8,0},{9,0},{10,0},{11,6},{12,4},{17,10},{18,8},{19,1},{23,4},{24,10}] | L449: =R[-1]C -> [{7,27},{8,55},{9,27},{10,55},{11,27},{12,55},{17,18},{18,110},{19,3},{23,37},{24,37}] | M449: =R[-1]C -> [{0,1,[1,30]},{1,2,[11,40]},{2,5,[21,50]},{5,10,[31,60]},{10,20,[41,60]},{30,20,[51,70]},{50,10,[61,80]},{70,5,[71,80]},{100,2,[81,90]},{150,1,[91,100]}]
A450: 447 | B450: 6 | C450: 4 | D450: 3000 | E450: =R[-9]C -> 51 | F450: =R[-9]C -> 60 | G450: 5 | H450: 20000 | I450: 110003 | J450: 5 | K450: =R[-1]C -> [{7,0},{8,0},{9,0},{10,0},{11,6},{12,4},{17,10},{18,8},{19,1},{23,4},{24,10}] | L450: =R[-1]C -> [{7,27},{8,55},{9,27},{10,55},{11,27},{12,55},{17,18},{18,110},{19,3},{23,37},{24,37}] | M450: =R[-1]C -> [{0,1,[1,30]},{1,2,[11,40]},{2,5,[21,50]},{5,10,[31,60]},{10,20,[41,60]},{30,20,[51,70]},{50,10,[61,80]},{70,5,[71,80]},{100,2,[81,90]},{150,1,[91,100]}]
A451: 448 | B451: 6 | C451: 4 | D451: 3000 | E451: =R[-9]C -> 61 | F451: =R[-9]C -> 70 | G451: 5 | H451: 20000 | I451: 110003 | J451: 5 | K451: =R[-1]C -> [{7,0},{8,0},{9,0},{10,0},{11,6},{12,4},{17,10},{18,8},{19,1},{23,4},{24,10}] | L451: =R[-1]C -> [{7,27},{8,55},{9,27},{10,55},{11,27},{12,55},{17,18},{18,110},{19,3},{23,37},{24,37}] | M451: =R[-1]C -> [{0,1,[1,30]},{1,2,[11,40]},{2,5,[21,50]},{5,10,[31,60]},{10,20,[41,60]},{30,20,[51,70]},{50,10,[61,80]},{70,5,[71,80]},{100,2,[81,90]},{150,1,[91,100]}]
A452: 449 | B452: 6 | C452: 4 | D452: 3000 | E452: =R[-9]C -> 71 | F452: =R[-9]C -> 80 | G452: 5 | H452: 20000 | I452: 110003 | J452: 5 | K452: =R[-1]C -> [{7,0},{8,0},{9,0},{10,0},{11,6},{12,4},{17,10},{18,8},{19,1},{23,4},{24,10}] | L452: =R[-1]C -> [{7,27},{8,55},{9,27},{10,55},{11,27},{12,55},{17,18},{18,110},{19,3},{23,37},{24,37}] | M452: =R[-1]C -> [{0,1,[1,30]},{1,2,[11,40]},{2,5,[21,50]},{5,10,[31,60]},{10,20,[41,60]},{30,20,[51,70]},{50,10,[61,80]},{70,5,[71,80]},{100,2,[81,90]},{150,1,[91,100]}]
A453: 450 | B453: 6 | C453: 4 | D453: 3000 | E453: =R[-9]C -> 81 | F453: =R[-9]C -> 90 | G453: 5 | H453: 20000 | I453: 110003 | J453: 5 | K453: =R[-1]C -> [{7,0},{8,0},{9,0},{10,0},{11,6},{12,4},{17,10},{18,8},{19,1},{23,4},{24,10}] | L453: =R[-1]C -> [{7,27},{8,55},{9,27},{10,55},{11,27},{12,55},{17,18},{18,110},{19,3},{23,37},{24,37}] | M453: =R[-1]C -> [{0,1,[1,30]},{1,2,[11,40]},{2,5,[21,50]},{5,10,[31,60]},{10,20,[41,60]},{30,20,[51,70]},{50,10,[61,80]},{70,5,[71,80]},{100,2,[81,90]},{150,1,[91,100]}]
A454: 451 | B454: 2 | C454: 6 | D454: 3000 | E454: =R[-18]C -> 1 | F454: =R[-18]C -> 10 | G454: 1 | H454: 5000 | I454: 110003 | J454: 1 | K454: =R[-1]C -> [{7,0},{8,0},{9,0},{10,0},{11,6},{12,4},{17,10},{18,8},{19,1},{23,4},{24,10}] | L454: =R[-1]C -> [{7,27},{8,55},{9,27},{10,55},{11,27},{12,55},{17,18},{18,110},{19,3},{23,37},{24,37}] | M454: =R[-1]C -> [{0,1,[1,30]},{1,2,[11,40]},{2,5,[21,50]},{5,10,[31,60]},{10,20,[41,60]},{30,20,[51,70]},{50,10,[61,80]},{70,5,[71,80]},{100,2,[81,90]},{150,1,[91,100]}]
A455: 452 | B455: 2 | C455: 6 | D455: 3000 | E455: =R[-18]C -> 11 | F455: =R[-18]C -> 20 | G455: 1 | H455: 5000 | I455: 110003 | J455: 1 | K455: =R[-1]C -> [{7,0},{8,0},{9,0},{10,0},{11,6},{12,4},{17,10},{18,8},{19,1},{23,4},{24,10}] | L455: =R[-1]C -> [{7,27},{8,55},{9,27},{10,55},{11,27},{12,55},{17,18},{18,110},{19,3},{23,37},{24,37}] | M455: =R[-1]C -> [{0,1,[1,30]},{1,2,[11,40]},{2,5,[21,50]},{5,10,[31,60]},{10,20,[41,60]},{30,20,[51,70]},{50,10,[61,80]},{70,5,[71,80]},{100,2,[81,90]},{150,1,[91,100]}]
A456: 453 | B456: 2 | C456: 6 | D456: 3000 | E456: =R[-18]C -> 21 | F456: =R[-18]C -> 30 | G456: 1 | H456: 5000 | I456: 110003 | J456: 1 | K456: =R[-1]C -> [{7,0},{8,0},{9,0},{10,0},{11,6},{12,4},{17,10},{18,8},{19,1},{23,4},{24,10}] | L456: =R[-1]C -> [{7,27},{8,55},{9,27},{10,55},{11,27},{12,55},{17,18},{18,110},{19,3},{23,37},{24,37}] | M456: =R[-1]C -> [{0,1,[1,30]},{1,2,[11,40]},{2,5,[21,50]},{5,10,[31,60]},{10,20,[41,60]},{30,20,[51,70]},{50,10,[61,80]},{70,5,[71,80]},{100,2,[81,90]},{150,1,[91,100]}]
A457: 454 | B457: 2 | C457: 6 | D457: 3000 | E457: =R[-18]C -> 31 | F457: =R[-18]C -> 40 | G457: 1 | H457: 5000 | I457: 110003 | J457: 1 | K457: =R[-1]C -> [{7,0},{8,0},{9,0},{10,0},{11,6},{12,4},{17,10},{18,8},{19,1},{23,4},{24,10}] | L457: =R[-1]C -> [{7,27},{8,55},{9,27},{10,55},{11,27},{12,55},{17,18},{18,110},{19,3},{23,37},{24,37}] | M457: =R[-1]C -> [{0,1,[1,30]},{1,2,[11,40]},{2,5,[21,50]},{5,10,[31,60]},{10,20,[41,60]},{30,20,[51,70]},{50,10,[61,80]},{70,5,[71,80]},{100,2,[81,90]},{150,1,[91,100]}]
A458: 455 | B458: 2 | C458: 6 | D458: 3000 | E458: =R[-18]C -> 41 | F458: =R[-18]C -> 50 | G458: 1 | H458: 5000 | I458: 110003 | J458: 1 | K458: =R[-1]C -> [{7,0},{8,0},{9,0},{10,0},{11,6},{12,4},{17,10},{18,8},{19,1},{23,4},{24,10}] | L458: =R[-1]C -> [{7,27},{8,55},{9,27},{10,55},{11,27},{12,55},{17,18},{18,110},{19,3},{23,37},{24,37}] | M458: =R[-1]C -> [{0,1,[1,30]},{1,2,[11,40]},{2,5,[21,50]},{5,10,[31,60]},{10,20,[41,60]},{30,20,[51,70]},{50,10,[61,80]},{70,5,[71,80]},{100,2,[81,90]},{150,1,[91,100]}]
A459: 456 | B459: 2 | C459: 6 | D459: 3000 | E459: =R[-18]C -> 51 | F459: =R[-18]C -> 60 | G459: 1 | H459: 5000 | I459: 110003 | J459: 1 | K459: =R[-1]C -> [{7,0},{8,0},{9,0},{10,0},{11,6},{12,4},{17,10},{18,8},{19,1},{23,4},{24,10}] | L459: =R[-1]C -> [{7,27},{8,55},{9,27},{10,55},{11,27},{12,55},{17,18},{18,110},{19,3},{23,37},{24,37}] | M459: =R[-1]C -> [{0,1,[1,30]},{1,2,[11,40]},{2,5,[21,50]},{5,10,[31,60]},{10,20,[41,60]},{30,20,[51,70]},{50,10,[61,80]},{70,5,[71,80]},{100,2,[81,90]},{150,1,[91,100]}]
A460: 457 | B460: 2 | C460: 6 | D460: 3000 | E460: =R[-18]C -> 61 | F460: =R[-18]C -> 70 | G460: 1 | H460: 5000 | I460: 110003 | J460: 1 | K460: =R[-1]C -> [{7,0},{8,0},{9,0},{10,0},{11,6},{12,4},{17,10},{18,8},{19,1},{23,4},{24,10}] | L460: =R[-1]C -> [{7,27},{8,55},{9,27},{10,55},{11,27},{12,55},{17,18},{18,110},{19,3},{23,37},{24,37}] | M460: =R[-1]C -> [{0,1,[1,30]},{1,2,[11,40]},{2,5,[21,50]},{5,10,[31,60]},{10,20,[41,60]},{30,20,[51,70]},{50,10,[61,80]},{70,5,[71,80]},{100,2,[81,90]},{150,1,[91,100]}]
A461: 458 | B461: 2 | C461: 6 | D461: 3000 | E461: =R[-18]C -> 71 | F461: =R[-18]C -> 80 | G461: 1 | H461: 5000 | I461: 110003 | J461: 1 | K461: =R[-1]C -> [{7,0},{8,0},{9,0},{10,0},{11,6},{12,4},{17,10},{18,8},{19,1},{23,4},{24,10}] | L461: =R[-1]C -> [{7,27},{8,55},{9,27},{10,55},{11,27},{12,55},{17,18},{18,110},{19,3},{23,37},{24,37}] | M461: =R[-1]C -> [{0,1,[1,30]},{1,2,[11,40]},{2,5,[21,50]},{5,10,[31,60]},{10,20,[41,60]},{30,20,[51,70]},{50,10,[61,80]},{70,5,[71,80]},{100,2,[81,90]},{150,1,[91,100]}]
A462: 459 | B462: 2 | C462: 6 | D462: 3000 | E462: =R[-18]C -> 81 | F462: =R[-18]C -> 90 | G462: 1 | H462: 5000 | I462: 110003 | J462: 1 | K462: =R[-1]C -> [{7,0},{8,0},{9,0},{10,0},{11,6},{12,4},{17,10},{18,8},{19,1},{23,4},{24,10}] | L462: =R[-1]C -> [{7,27},{8,55},{9,27},{10,55},{11,27},{12,55},{17,18},{18,110},{19,3},{23,37},{24,37}] | M462: =R[-1]C -> [{0,1,[1,30]},{1,2,[11,40]},{2,5,[21,50]},{5,10,[31,60]},{10,20,[41,60]},{30,20,[51,70]},{50,10,[61,80]},{70,5,[71,80]},{100,2,[81,90]},{150,1,[91,100]}]
A463: 460 | B463: 3 | C463: 6 | D463: 3000 | E463: =R[-9]C -> 1 | F463: =R[-9]C -> 10 | G463: 2 | H463: 10000 | I463: 110003 | J463: 2 | K463: =R[-1]C -> [{7,0},{8,0},{9,0},{10,0},{11,6},{12,4},{17,10},{18,8},{19,1},{23,4},{24,10}] | L463: =R[-1]C -> [{7,27},{8,55},{9,27},{10,55},{11,27},{12,55},{17,18},{18,110},{19,3},{23,37},{24,37}] | M463: =R[-1]C -> [{0,1,[1,30]},{1,2,[11,40]},{2,5,[21,50]},{5,10,[31,60]},{10,20,[41,60]},{30,20,[51,70]},{50,10,[61,80]},{70,5,[71,80]},{100,2,[81,90]},{150,1,[91,100]}]
A464: 461 | B464: 3 | C464: 6 | D464: 3000 | E464: =R[-9]C -> 11 | F464: =R[-9]C -> 20 | G464: 2 | H464: 10000 | I464: 110003 | J464: 2 | K464: =R[-1]C -> [{7,0},{8,0},{9,0},{10,0},{11,6},{12,4},{17,10},{18,8},{19,1},{23,4},{24,10}] | L464: =R[-1]C -> [{7,27},{8,55},{9,27},{10,55},{11,27},{12,55},{17,18},{18,110},{19,3},{23,37},{24,37}] | M464: =R[-1]C -> [{0,1,[1,30]},{1,2,[11,40]},{2,5,[21,50]},{5,10,[31,60]},{10,20,[41,60]},{30,20,[51,70]},{50,10,[61,80]},{70,5,[71,80]},{100,2,[81,90]},{150,1,[91,100]}]
A465: 462 | B465: 3 | C465: 6 | D465: 3000 | E465: =R[-9]C -> 21 | F465: =R[-9]C -> 30 | G465: 2 | H465: 10000 | I465: 110003 | J465: 2 | K465: =R[-1]C -> [{7,0},{8,0},{9,0},{10,0},{11,6},{12,4},{17,10},{18,8},{19,1},{23,4},{24,10}] | L465: =R[-1]C -> [{7,27},{8,55},{9,27},{10,55},{11,27},{12,55},{17,18},{18,110},{19,3},{23,37},{24,37}] | M465: =R[-1]C -> [{0,1,[1,30]},{1,2,[11,40]},{2,5,[21,50]},{5,10,[31,60]},{10,20,[41,60]},{30,20,[51,70]},{50,10,[61,80]},{70,5,[71,80]},{100,2,[81,90]},{150,1,[91,100]}]
A466: 463 | B466: 3 | C466: 6 | D466: 3000 | E466: =R[-9]C -> 31 | F466: =R[-9]C -> 40 | G466: 2 | H466: 10000 | I466: 110003 | J466: 2 | K466: =R[-1]C -> [{7,0},{8,0},{9,0},{10,0},{11,6},{12,4},{17,10},{18,8},{19,1},{23,4},{24,10}] | L466: =R[-1]C -> [{7,27},{8,55},{9,27},{10,55},{11,27},{12,55},{17,18},{18,110},{19,3},{23,37},{24,37}] | M466: =R[-1]C -> [{0,1,[1,30]},{1,2,[11,40]},{2,5,[21,50]},{5,10,[31,60]},{10,20,[41,60]},{30,20,[51,70]},{50,10,[61,80]},{70,5,[71,80]},{100,2,[81,90]},{150,1,[91,100]}]
A467: 464 | B467: 3 | C467: 6 | D467: 3000 | E467: =R[-9]C -> 41 | F467: =R[-9]C -> 50 | G467: 2 | H467: 10000 | I467: 110003 | J467: 2 | K467: =R[-1]C -> [{7,0},{8,0},{9,0},{10,0},{11,6},{12,4},{17,10},{18,8},{19,1},{23,4},{24,10}] | L467: =R[-1]C -> [{7,27},{8,55},{9,27},{10,55},{11,27},{12,55},{17,18},{18,110},{19,3},{23,37},{24,37}] | M467: =R[-1]C -> [{0,1,[1,30]},{1,2,[11,40]},{2,5,[21,50]},{5,10,[31,60]},{10,20,[41,60]},{30,20,[51,70]},{50,10,[61,80]},{70,5,[71,80]},{100,2,[81,90]},{150,1,[91,100]}]
A468: 465 | B468: 3 | C468: 6 | D468: 3000 | E468: =R[-9]C -> 51 | F468: =R[-9]C -> 60 | G468: 2 | H468: 10000 | I468: 110003 | J468: 2 | K468: =R[-1]C -> [{7,0},{8,0},{9,0},{10,0},{11,6},{12,4},{17,10},{18,8},{19,1},{23,4},{24,10}] | L468: =R[-1]C -> [{7,27},{8,55},{9,27},{10,55},{11,27},{12,55},{17,18},{18,110},{19,3},{23,37},{24,37}] | M468: =R[-1]C -> [{0,1,[1,30]},{1,2,[11,40]},{2,5,[21,50]},{5,10,[31,60]},{10,20,[41,60]},{30,20,[51,70]},{50,10,[61,80]},{70,5,[71,80]},{100,2,[81,90]},{150,1,[91,100]}]
A469: 466 | B469: 3 | C469: 6 | D469: 3000 | E469: =R[-9]C -> 61 | F469: =R[-9]C -> 70 | G469: 2 | H469: 10000 | I469: 110003 | J469: 2 | K469: =R[-1]C -> [{7,0},{8,0},{9,0},{10,0},{11,6},{12,4},{17,10},{18,8},{19,1},{23,4},{24,10}] | L469: =R[-1]C -> [{7,27},{8,55},{9,27},{10,55},{11,27},{12,55},{17,18},{18,110},{19,3},{23,37},{24,37}] | M469: =R[-1]C -> [{0,1,[1,30]},{1,2,[11,40]},{2,5,[21,50]},{5,10,[31,60]},{10,20,[41,60]},{30,20,[51,70]},{50,10,[61,80]},{70,5,[71,80]},{100,2,[81,90]},{150,1,[91,100]}]
A470: 467 | B470: 3 | C470: 6 | D470: 3000 | E470: =R[-9]C -> 71 | F470: =R[-9]C -> 80 | G470: 2 | H470: 10000 | I470: 110003 | J470: 2 | K470: =R[-1]C -> [{7,0},{8,0},{9,0},{10,0},{11,6},{12,4},{17,10},{18,8},{19,1},{23,4},{24,10}] | L470: =R[-1]C -> [{7,27},{8,55},{9,27},{10,55},{11,27},{12,55},{17,18},{18,110},{19,3},{23,37},{24,37}] | M470: =R[-1]C -> [{0,1,[1,30]},{1,2,[11,40]},{2,5,[21,50]},{5,10,[31,60]},{10,20,[41,60]},{30,20,[51,70]},{50,10,[61,80]},{70,5,[71,80]},{100,2,[81,90]},{150,1,[91,100]}]
A471: 468 | B471: 3 | C471: 6 | D471: 3000 | E471: =R[-9]C -> 81 | F471: =R[-9]C -> 90 | G471: 2 | H471: 10000 | I471: 110003 | J471: 2 | K471: =R[-1]C -> [{7,0},{8,0},{9,0},{10,0},{11,6},{12,4},{17,10},{18,8},{19,1},{23,4},{24,10}] | L471: =R[-1]C -> [{7,27},{8,55},{9,27},{10,55},{11,27},{12,55},{17,18},{18,110},{19,3},{23,37},{24,37}] | M471: =R[-1]C -> [{0,1,[1,30]},{1,2,[11,40]},{2,5,[21,50]},{5,10,[31,60]},{10,20,[41,60]},{30,20,[51,70]},{50,10,[61,80]},{70,5,[71,80]},{100,2,[81,90]},{150,1,[91,100]}]
A472: 469 | B472: 4 | C472: 6 | D472: 3000 | E472: =R[-9]C -> 1 | F472: =R[-9]C -> 10 | G472: 3 | H472: 15000 | I472: 110003 | J472: 3 | K472: =R[-1]C -> [{7,0},{8,0},{9,0},{10,0},{11,6},{12,4},{17,10},{18,8},{19,1},{23,4},{24,10}] | L472: =R[-1]C -> [{7,27},{8,55},{9,27},{10,55},{11,27},{12,55},{17,18},{18,110},{19,3},{23,37},{24,37}] | M472: =R[-1]C -> [{0,1,[1,30]},{1,2,[11,40]},{2,5,[21,50]},{5,10,[31,60]},{10,20,[41,60]},{30,20,[51,70]},{50,10,[61,80]},{70,5,[71,80]},{100,2,[81,90]},{150,1,[91,100]}]
A473: 470 | B473: 4 | C473: 6 | D473: 3000 | E473: =R[-9]C -> 11 | F473: =R[-9]C -> 20 | G473: 3 | H473: 15000 | I473: 110003 | J473: 3 | K473: =R[-1]C -> [{7,0},{8,0},{9,0},{10,0},{11,6},{12,4},{17,10},{18,8},{19,1},{23,4},{24,10}] | L473: =R[-1]C -> [{7,27},{8,55},{9,27},{10,55},{11,27},{12,55},{17,18},{18,110},{19,3},{23,37},{24,37}] | M473: =R[-1]C -> [{0,1,[1,30]},{1,2,[11,40]},{2,5,[21,50]},{5,10,[31,60]},{10,20,[41,60]},{30,20,[51,70]},{50,10,[61,80]},{70,5,[71,80]},{100,2,[81,90]},{150,1,[91,100]}]
A474: 471 | B474: 4 | C474: 6 | D474: 3000 | E474: =R[-9]C -> 21 | F474: =R[-9]C -> 30 | G474: 3 | H474: 15000 | I474: 110003 | J474: 3 | K474: =R[-1]C -> [{7,0},{8,0},{9,0},{10,0},{11,6},{12,4},{17,10},{18,8},{19,1},{23,4},{24,10}] | L474: =R[-1]C -> [{7,27},{8,55},{9,27},{10,55},{11,27},{12,55},{17,18},{18,110},{19,3},{23,37},{24,37}] | M474: =R[-1]C -> [{0,1,[1,30]},{1,2,[11,40]},{2,5,[21,50]},{5,10,[31,60]},{10,20,[41,60]},{30,20,[51,70]},{50,10,[61,80]},{70,5,[71,80]},{100,2,[81,90]},{150,1,[91,100]}]
A475: 472 | B475: 4 | C475: 6 | D475: 3000 | E475: =R[-9]C -> 31 | F475: =R[-9]C -> 40 | G475: 3 | H475: 15000 | I475: 110003 | J475: 3 | K475: =R[-1]C -> [{7,0},{8,0},{9,0},{10,0},{11,6},{12,4},{17,10},{18,8},{19,1},{23,4},{24,10}] | L475: =R[-1]C -> [{7,27},{8,55},{9,27},{10,55},{11,27},{12,55},{17,18},{18,110},{19,3},{23,37},{24,37}] | M475: =R[-1]C -> [{0,1,[1,30]},{1,2,[11,40]},{2,5,[21,50]},{5,10,[31,60]},{10,20,[41,60]},{30,20,[51,70]},{50,10,[61,80]},{70,5,[71,80]},{100,2,[81,90]},{150,1,[91,100]}]
A476: 473 | B476: 4 | C476: 6 | D476: 3000 | E476: =R[-9]C -> 41 | F476: =R[-9]C -> 50 | G476: 3 | H476: 15000 | I476: 110003 | J476: 3 | K476: =R[-1]C -> [{7,0},{8,0},{9,0},{10,0},{11,6},{12,4},{17,10},{18,8},{19,1},{23,4},{24,10}] | L476: =R[-1]C -> [{7,27},{8,55},{9,27},{10,55},{11,27},{12,55},{17,18},{18,110},{19,3},{23,37},{24,37}] | M476: =R[-1]C -> [{0,1,[1,30]},{1,2,[11,40]},{2,5,[21,50]},{5,10,[31,60]},{10,20,[41,60]},{30,20,[51,70]},{50,10,[61,80]},{70,5,[71,80]},{100,2,[81,90]},{150,1,[91,100]}]
A477: 474 | B477: 4 | C477: 6 | D477: 3000 | E477: =R[-9]C -> 51 | F477: =R[-9]C -> 60 | G477: 3 | H477: 15000 | I477: 110003 | J477: 3 | K477: =R[-1]C -> [{7,0},{8,0},{9,0},{10,0},{11,6},{12,4},{17,10},{18,8},{19,1},{23,4},{24,10}] | L477: =R[-1]C -> [{7,27},{8,55},{9,27},{10,55},{11,27},{12,55},{17,18},{18,110},{19,3},{23,37},{24,37}] | M477: =R[-1]C -> [{0,1,[1,30]},{1,2,[11,40]},{2,5,[21,50]},{5,10,[31,60]},{10,20,[41,60]},{30,20,[51,70]},{50,10,[61,80]},{70,5,[71,80]},{100,2,[81,90]},{150,1,[91,100]}]
A478: 475 | B478: 4 | C478: 6 | D478: 3000 | E478: =R[-9]C -> 61 | F478: =R[-9]C -> 70 | G478: 3 | H478: 15000 | I478: 110003 | J478: 3 | K478: =R[-1]C -> [{7,0},{8,0},{9,0},{10,0},{11,6},{12,4},{17,10},{18,8},{19,1},{23,4},{24,10}] | L478: =R[-1]C -> [{7,27},{8,55},{9,27},{10,55},{11,27},{12,55},{17,18},{18,110},{19,3},{23,37},{24,37}] | M478: =R[-1]C -> [{0,1,[1,30]},{1,2,[11,40]},{2,5,[21,50]},{5,10,[31,60]},{10,20,[41,60]},{30,20,[51,70]},{50,10,[61,80]},{70,5,[71,80]},{100,2,[81,90]},{150,1,[91,100]}]
A479: 476 | B479: 4 | C479: 6 | D479: 3000 | E479: =R[-9]C -> 71 | F479: =R[-9]C -> 80 | G479: 3 | H479: 15000 | I479: 110003 | J479: 3 | K479: =R[-1]C -> [{7,0},{8,0},{9,0},{10,0},{11,6},{12,4},{17,10},{18,8},{19,1},{23,4},{24,10}] | L479: =R[-1]C -> [{7,27},{8,55},{9,27},{10,55},{11,27},{12,55},{17,18},{18,110},{19,3},{23,37},{24,37}] | M479: =R[-1]C -> [{0,1,[1,30]},{1,2,[11,40]},{2,5,[21,50]},{5,10,[31,60]},{10,20,[41,60]},{30,20,[51,70]},{50,10,[61,80]},{70,5,[71,80]},{100,2,[81,90]},{150,1,[91,100]}]
A480: 477 | B480: 4 | C480: 6 | D480: 3000 | E480: =R[-9]C -> 81 | F480: =R[-9]C -> 90 | G480: 3 | H480: 15000 | I480: 110003 | J480: 3 | K480: =R[-1]C -> [{7,0},{8,0},{9,0},{10,0},{11,6},{12,4},{17,10},{18,8},{19,1},{23,4},{24,10}] | L480: =R[-1]C -> [{7,27},{8,55},{9,27},{10,55},{11,27},{12,55},{17,18},{18,110},{19,3},{23,37},{24,37}] | M480: =R[-1]C -> [{0,1,[1,30]},{1,2,[11,40]},{2,5,[21,50]},{5,10,[31,60]},{10,20,[41,60]},{30,20,[51,70]},{50,10,[61,80]},{70,5,[71,80]},{100,2,[81,90]},{150,1,[91,100]}]
A481: 478 | B481: 5 | C481: 6 | D481: 3000 | E481: =R[-9]C -> 1 | F481: =R[-9]C -> 10 | G481: 4 | H481: 20000 | I481: 110003 | J481: 4 | K481: =R[-1]C -> [{7,0},{8,0},{9,0},{10,0},{11,6},{12,4},{17,10},{18,8},{19,1},{23,4},{24,10}] | L481: =R[-1]C -> [{7,27},{8,55},{9,27},{10,55},{11,27},{12,55},{17,18},{18,110},{19,3},{23,37},{24,37}] | M481: =R[-1]C -> [{0,1,[1,30]},{1,2,[11,40]},{2,5,[21,50]},{5,10,[31,60]},{10,20,[41,60]},{30,20,[51,70]},{50,10,[61,80]},{70,5,[71,80]},{100,2,[81,90]},{150,1,[91,100]}]
A482: 479 | B482: 5 | C482: 6 | D482: 3000 | E482: =R[-9]C -> 11 | F482: =R[-9]C -> 20 | G482: 4 | H482: 20000 | I482: 110003 | J482: 4 | K482: =R[-1]C -> [{7,0},{8,0},{9,0},{10,0},{11,6},{12,4},{17,10},{18,8},{19,1},{23,4},{24,10}] | L482: =R[-1]C -> [{7,27},{8,55},{9,27},{10,55},{11,27},{12,55},{17,18},{18,110},{19,3},{23,37},{24,37}] | M482: =R[-1]C -> [{0,1,[1,30]},{1,2,[11,40]},{2,5,[21,50]},{5,10,[31,60]},{10,20,[41,60]},{30,20,[51,70]},{50,10,[61,80]},{70,5,[71,80]},{100,2,[81,90]},{150,1,[91,100]}]
A483: 480 | B483: 5 | C483: 6 | D483: 3000 | E483: =R[-9]C -> 21 | F483: =R[-9]C -> 30 | G483: 4 | H483: 20000 | I483: 110003 | J483: 4 | K483: =R[-1]C -> [{7,0},{8,0},{9,0},{10,0},{11,6},{12,4},{17,10},{18,8},{19,1},{23,4},{24,10}] | L483: =R[-1]C -> [{7,27},{8,55},{9,27},{10,55},{11,27},{12,55},{17,18},{18,110},{19,3},{23,37},{24,37}] | M483: =R[-1]C -> [{0,1,[1,30]},{1,2,[11,40]},{2,5,[21,50]},{5,10,[31,60]},{10,20,[41,60]},{30,20,[51,70]},{50,10,[61,80]},{70,5,[71,80]},{100,2,[81,90]},{150,1,[91,100]}]
A484: 481 | B484: 5 | C484: 6 | D484: 3000 | E484: =R[-9]C -> 31 | F484: =R[-9]C -> 40 | G484: 4 | H484: 20000 | I484: 110003 | J484: 4 | K484: =R[-1]C -> [{7,0},{8,0},{9,0},{10,0},{11,6},{12,4},{17,10},{18,8},{19,1},{23,4},{24,10}] | L484: =R[-1]C -> [{7,27},{8,55},{9,27},{10,55},{11,27},{12,55},{17,18},{18,110},{19,3},{23,37},{24,37}] | M484: =R[-1]C -> [{0,1,[1,30]},{1,2,[11,40]},{2,5,[21,50]},{5,10,[31,60]},{10,20,[41,60]},{30,20,[51,70]},{50,10,[61,80]},{70,5,[71,80]},{100,2,[81,90]},{150,1,[91,100]}]
A485: 482 | B485: 5 | C485: 6 | D485: 3000 | E485: =R[-9]C -> 41 | F485: =R[-9]C -> 50 | G485: 4 | H485: 20000 | I485: 110003 | J485: 4 | K485: =R[-1]C -> [{7,0},{8,0},{9,0},{10,0},{11,6},{12,4},{17,10},{18,8},{19,1},{23,4},{24,10}] | L485: =R[-1]C -> [{7,27},{8,55},{9,27},{10,55},{11,27},{12,55},{17,18},{18,110},{19,3},{23,37},{24,37}] | M485: =R[-1]C -> [{0,1,[1,30]},{1,2,[11,40]},{2,5,[21,50]},{5,10,[31,60]},{10,20,[41,60]},{30,20,[51,70]},{50,10,[61,80]},{70,5,[71,80]},{100,2,[81,90]},{150,1,[91,100]}]
A486: 483 | B486: 5 | C486: 6 | D486: 3000 | E486: =R[-9]C -> 51 | F486: =R[-9]C -> 60 | G486: 4 | H486: 20000 | I486: 110003 | J486: 4 | K486: =R[-1]C -> [{7,0},{8,0},{9,0},{10,0},{11,6},{12,4},{17,10},{18,8},{19,1},{23,4},{24,10}] | L486: =R[-1]C -> [{7,27},{8,55},{9,27},{10,55},{11,27},{12,55},{17,18},{18,110},{19,3},{23,37},{24,37}] | M486: =R[-1]C -> [{0,1,[1,30]},{1,2,[11,40]},{2,5,[21,50]},{5,10,[31,60]},{10,20,[41,60]},{30,20,[51,70]},{50,10,[61,80]},{70,5,[71,80]},{100,2,[81,90]},{150,1,[91,100]}]
A487: 484 | B487: 5 | C487: 6 | D487: 3000 | E487: =R[-9]C -> 61 | F487: =R[-9]C -> 70 | G487: 4 | H487: 20000 | I487: 110003 | J487: 4 | K487: =R[-1]C -> [{7,0},{8,0},{9,0},{10,0},{11,6},{12,4},{17,10},{18,8},{19,1},{23,4},{24,10}] | L487: =R[-1]C -> [{7,27},{8,55},{9,27},{10,55},{11,27},{12,55},{17,18},{18,110},{19,3},{23,37},{24,37}] | M487: =R[-1]C -> [{0,1,[1,30]},{1,2,[11,40]},{2,5,[21,50]},{5,10,[31,60]},{10,20,[41,60]},{30,20,[51,70]},{50,10,[61,80]},{70,5,[71,80]},{100,2,[81,90]},{150,1,[91,100]}]
A488: 485 | B488: 5 | C488: 6 | D488: 3000 | E488: =R[-9]C -> 71 | F488: =R[-9]C -> 80 | G488: 4 | H488: 20000 | I488: 110003 | J488: 4 | K488: =R[-1]C -> [{7,0},{8,0},{9,0},{10,0},{11,6},{12,4},{17,10},{18,8},{19,1},{23,4},{24,10}] | L488: =R[-1]C -> [{7,27},{8,55},{9,27},{10,55},{11,27},{12,55},{17,18},{18,110},{19,3},{23,37},{24,37}] | M488: =R[-1]C -> [{0,1,[1,30]},{1,2,[11,40]},{2,5,[21,50]},{5,10,[31,60]},{10,20,[41,60]},{30,20,[51,70]},{50,10,[61,80]},{70,5,[71,80]},{100,2,[81,90]},{150,1,[91,100]}]
A489: 486 | B489: 5 | C489: 6 | D489: 3000 | E489: =R[-9]C -> 81 | F489: =R[-9]C -> 90 | G489: 4 | H489: 20000 | I489: 110003 | J489: 4 | K489: =R[-1]C -> [{7,0},{8,0},{9,0},{10,0},{11,6},{12,4},{17,10},{18,8},{19,1},{23,4},{24,10}] | L489: =R[-1]C -> [{7,27},{8,55},{9,27},{10,55},{11,27},{12,55},{17,18},{18,110},{19,3},{23,37},{24,37}] | M489: =R[-1]C -> [{0,1,[1,30]},{1,2,[11,40]},{2,5,[21,50]},{5,10,[31,60]},{10,20,[41,60]},{30,20,[51,70]},{50,10,[61,80]},{70,5,[71,80]},{100,2,[81,90]},{150,1,[91,100]}]
A490: 487 | B490: 6 | C490: 6 | D490: 3000 | E490: =R[-9]C -> 1 | F490: =R[-9]C -> 10 | G490: 5 | H490: 20000 | I490: 110003 | J490: 5 | K490: =R[-1]C -> [{7,0},{8,0},{9,0},{10,0},{11,6},{12,4},{17,10},{18,8},{19,1},{23,4},{24,10}] | L490: =R[-1]C -> [{7,27},{8,55},{9,27},{10,55},{11,27},{12,55},{17,18},{18,110},{19,3},{23,37},{24,37}] | M490: =R[-1]C -> [{0,1,[1,30]},{1,2,[11,40]},{2,5,[21,50]},{5,10,[31,60]},{10,20,[41,60]},{30,20,[51,70]},{50,10,[61,80]},{70,5,[71,80]},{100,2,[81,90]},{150,1,[91,100]}]
A491: 488 | B491: 6 | C491: 6 | D491: 3000 | E491: =R[-9]C -> 11 | F491: =R[-9]C -> 20 | G491: 5 | H491: 20000 | I491: 110003 | J491: 5 | K491: =R[-1]C -> [{7,0},{8,0},{9,0},{10,0},{11,6},{12,4},{17,10},{18,8},{19,1},{23,4},{24,10}] | L491: =R[-1]C -> [{7,27},{8,55},{9,27},{10,55},{11,27},{12,55},{17,18},{18,110},{19,3},{23,37},{24,37}] | M491: =R[-1]C -> [{0,1,[1,30]},{1,2,[11,40]},{2,5,[21,50]},{5,10,[31,60]},{10,20,[41,60]},{30,20,[51,70]},{50,10,[61,80]},{70,5,[71,80]},{100,2,[81,90]},{150,1,[91,100]}]
A492: 489 | B492: 6 | C492: 6 | D492: 3000 | E492: =R[-9]C -> 21 | F492: =R[-9]C -> 30 | G492: 5 | H492: 20000 | I492: 110003 | J492: 5 | K492: =R[-1]C -> [{7,0},{8,0},{9,0},{10,0},{11,6},{12,4},{17,10},{18,8},{19,1},{23,4},{24,10}] | L492: =R[-1]C -> [{7,27},{8,55},{9,27},{10,55},{11,27},{12,55},{17,18},{18,110},{19,3},{23,37},{24,37}] | M492: =R[-1]C -> [{0,1,[1,30]},{1,2,[11,40]},{2,5,[21,50]},{5,10,[31,60]},{10,20,[41,60]},{30,20,[51,70]},{50,10,[61,80]},{70,5,[71,80]},{100,2,[81,90]},{150,1,[91,100]}]
A493: 490 | B493: 6 | C493: 6 | D493: 3000 | E493: =R[-9]C -> 31 | F493: =R[-9]C -> 40 | G493: 5 | H493: 20000 | I493: 110003 | J493: 5 | K493: =R[-1]C -> [{7,0},{8,0},{9,0},{10,0},{11,6},{12,4},{17,10},{18,8},{19,1},{23,4},{24,10}] | L493: =R[-1]C -> [{7,27},{8,55},{9,27},{10,55},{11,27},{12,55},{17,18},{18,110},{19,3},{23,37},{24,37}] | M493: =R[-1]C -> [{0,1,[1,30]},{1,2,[11,40]},{2,5,[21,50]},{5,10,[31,60]},{10,20,[41,60]},{30,20,[51,70]},{50,10,[61,80]},{70,5,[71,80]},{100,2,[81,90]},{150,1,[91,100]}]
A494: 491 | B494: 6 | C494: 6 | D494: 3000 | E494: =R[-9]C -> 41 | F494: =R[-9]C -> 50 | G494: 5 | H494: 20000 | I494: 110003 | J494: 5 | K494: =R[-1]C -> [{7,0},{8,0},{9,0},{10,0},{11,6},{12,4},{17,10},{18,8},{19,1},{23,4},{24,10}] | L494: =R[-1]C -> [{7,27},{8,55},{9,27},{10,55},{11,27},{12,55},{17,18},{18,110},{19,3},{23,37},{24,37}] | M494: =R[-1]C -> [{0,1,[1,30]},{1,2,[11,40]},{2,5,[21,50]},{5,10,[31,60]},{10,20,[41,60]},{30,20,[51,70]},{50,10,[61,80]},{70,5,[71,80]},{100,2,[81,90]},{150,1,[91,100]}]
A495: 492 | B495: 6 | C495: 6 | D495: 3000 | E495: =R[-9]C -> 51 | F495: =R[-9]C -> 60 | G495: 5 | H495: 20000 | I495: 110003 | J495: 5 | K495: =R[-1]C -> [{7,0},{8,0},{9,0},{10,0},{11,6},{12,4},{17,10},{18,8},{19,1},{23,4},{24,10}] | L495: =R[-1]C -> [{7,27},{8,55},{9,27},{10,55},{11,27},{12,55},{17,18},{18,110},{19,3},{23,37},{24,37}] | M495: =R[-1]C -> [{0,1,[1,30]},{1,2,[11,40]},{2,5,[21,50]},{5,10,[31,60]},{10,20,[41,60]},{30,20,[51,70]},{50,10,[61,80]},{70,5,[71,80]},{100,2,[81,90]},{150,1,[91,100]}]
A496: 493 | B496: 6 | C496: 6 | D496: 3000 | E496: =R[-9]C -> 61 | F496: =R[-9]C -> 70 | G496: 5 | H496: 20000 | I496: 110003 | J496: 5 | K496: =R[-1]C -> [{7,0},{8,0},{9,0},{10,0},{11,6},{12,4},{17,10},{18,8},{19,1},{23,4},{24,10}] | L496: =R[-1]C -> [{7,27},{8,55},{9,27},{10,55},{11,27},{12,55},{17,18},{18,110},{19,3},{23,37},{24,37}] | M496: =R[-1]C -> [{0,1,[1,30]},{1,2,[11,40]},{2,5,[21,50]},{5,10,[31,60]},{10,20,[41,60]},{30,20,[51,70]},{50,10,[61,80]},{70,5,[71,80]},{100,2,[81,90]},{150,1,[91,100]}]
A497: 494 | B497: 6 | C497: 6 | D497: 3000 | E497: =R[-9]C -> 71 | F497: =R[-9]C -> 80 | G497: 5 | H497: 20000 | I497: 110003 | J497: 5 | K497: =R[-1]C -> [{7,0},{8,0},{9,0},{10,0},{11,6},{12,4},{17,10},{18,8},{19,1},{23,4},{24,10}] | L497: =R[-1]C -> [{7,27},{8,55},{9,27},{10,55},{11,27},{12,55},{17,18},{18,110},{19,3},{23,37},{24,37}] | M497: =R[-1]C -> [{0,1,[1,30]},{1,2,[11,40]},{2,5,[21,50]},{5,10,[31,60]},{10,20,[41,60]},{30,20,[51,70]},{50,10,[61,80]},{70,5,[71,80]},{100,2,[81,90]},{150,1,[91,100]}]
A498: 495 | B498: 6 | C498: 6 | D498: 3000 | E498: =R[-9]C -> 81 | F498: =R[-9]C -> 90 | G498: 5 | H498: 20000 | I498: 110003 | J498: 5 | K498: =R[-1]C -> [{7,0},{8,0},{9,0},{10,0},{11,6},{12,4},{17,10},{18,8},{19,1},{23,4},{24,10}] | L498: =R[-1]C -> [{7,27},{8,55},{9,27},{10,55},{11,27},{12,55},{17,18},{18,110},{19,3},{23,37},{24,37}] | M498: =R[-1]C -> [{0,1,[1,30]},{1,2,[11,40]},{2,5,[21,50]},{5,10,[31,60]},{10,20,[41,60]},{30,20,[51,70]},{50,10,[61,80]},{70,5,[71,80]},{100,2,[81,90]},{150,1,[91,100]}]
A499: 496 | B499: 2 | C499: 7 | D499: 3000 | E499: =R[-18]C -> 1 | F499: =R[-18]C -> 10 | G499: 1 | H499: 5000 | I499: 110003 | J499: 1 | K499: =R[-1]C -> [{7,0},{8,0},{9,0},{10,0},{11,6},{12,4},{17,10},{18,8},{19,1},{23,4},{24,10}] | L499: =R[-1]C -> [{7,27},{8,55},{9,27},{10,55},{11,27},{12,55},{17,18},{18,110},{19,3},{23,37},{24,37}] | M499: =R[-1]C -> [{0,1,[1,30]},{1,2,[11,40]},{2,5,[21,50]},{5,10,[31,60]},{10,20,[41,60]},{30,20,[51,70]},{50,10,[61,80]},{70,5,[71,80]},{100,2,[81,90]},{150,1,[91,100]}]
A500: 497 | B500: 2 | C500: 7 | D500: 3000 | E500: =R[-18]C -> 11 | F500: =R[-18]C -> 20 | G500: 1 | H500: 5000 | I500: 110003 | J500: 1 | K500: =R[-1]C -> [{7,0},{8,0},{9,0},{10,0},{11,6},{12,4},{17,10},{18,8},{19,1},{23,4},{24,10}] | L500: =R[-1]C -> [{7,27},{8,55},{9,27},{10,55},{11,27},{12,55},{17,18},{18,110},{19,3},{23,37},{24,37}] | M500: =R[-1]C -> [{0,1,[1,30]},{1,2,[11,40]},{2,5,[21,50]},{5,10,[31,60]},{10,20,[41,60]},{30,20,[51,70]},{50,10,[61,80]},{70,5,[71,80]},{100,2,[81,90]},{150,1,[91,100]}]
A501: 498 | B501: 2 | C501: 7 | D501: 3000 | E501: =R[-18]C -> 21 | F501: =R[-18]C -> 30 | G501: 1 | H501: 5000 | I501: 110003 | J501: 1 | K501: =R[-1]C -> [{7,0},{8,0},{9,0},{10,0},{11,6},{12,4},{17,10},{18,8},{19,1},{23,4},{24,10}] | L501: =R[-1]C -> [{7,27},{8,55},{9,27},{10,55},{11,27},{12,55},{17,18},{18,110},{19,3},{23,37},{24,37}] | M501: =R[-1]C -> [{0,1,[1,30]},{1,2,[11,40]},{2,5,[21,50]},{5,10,[31,60]},{10,20,[41,60]},{30,20,[51,70]},{50,10,[61,80]},{70,5,[71,80]},{100,2,[81,90]},{150,1,[91,100]}]
A502: 499 | B502: 2 | C502: 7 | D502: 3000 | E502: =R[-18]C -> 31 | F502: =R[-18]C -> 40 | G502: 1 | H502: 5000 | I502: 110003 | J502: 1 | K502: =R[-1]C -> [{7,0},{8,0},{9,0},{10,0},{11,6},{12,4},{17,10},{18,8},{19,1},{23,4},{24,10}] | L502: =R[-1]C -> [{7,27},{8,55},{9,27},{10,55},{11,27},{12,55},{17,18},{18,110},{19,3},{23,37},{24,37}] | M502: =R[-1]C -> [{0,1,[1,30]},{1,2,[11,40]},{2,5,[21,50]},{5,10,[31,60]},{10,20,[41,60]},{30,20,[51,70]},{50,10,[61,80]},{70,5,[71,80]},{100,2,[81,90]},{150,1,[91,100]}]
A503: 500 | B503: 2 | C503: 7 | D503: 3000 | E503: =R[-18]C -> 41 | F503: =R[-18]C -> 50 | G503: 1 | H503: 5000 | I503: 110003 | J503: 1 | K503: =R[-1]C -> [{7,0},{8,0},{9,0},{10,0},{11,6},{12,4},{17,10},{18,8},{19,1},{23,4},{24,10}] | L503: =R[-1]C -> [{7,27},{8,55},{9,27},{10,55},{11,27},{12,55},{17,18},{18,110},{19,3},{23,37},{24,37}] | M503: =R[-1]C -> [{0,1,[1,30]},{1,2,[11,40]},{2,5,[21,50]},{5,10,[31,60]},{10,20,[41,60]},{30,20,[51,70]},{50,10,[61,80]},{70,5,[71,80]},{100,2,[81,90]},{150,1,[91,100]}]
A504: 501 | B504: 2 | C504: 7 | D504: 3000 | E504: =R[-18]C -> 51 | F504: =R[-18]C -> 60 | G504: 1 | H504: 5000 | I504: 110003 | J504: 1 | K504: =R[-1]C -> [{7,0},{8,0},{9,0},{10,0},{11,6},{12,4},{17,10},{18,8},{19,1},{23,4},{24,10}] | L504: =R[-1]C -> [{7,27},{8,55},{9,27},{10,55},{11,27},{12,55},{17,18},{18,110},{19,3},{23,37},{24,37}] | M504: =R[-1]C -> [{0,1,[1,30]},{1,2,[11,40]},{2,5,[21,50]},{5,10,[31,60]},{10,20,[41,60]},{30,20,[51,70]},{50,10,[61,80]},{70,5,[71,80]},{100,2,[81,90]},{150,1,[91,100]}]
A505: 502 | B505: 2 | C505: 7 | D505: 3000 | E505: =R[-18]C -> 61 | F505: =R[-18]C -> 70 | G505: 1 | H505: 5000 | I505: 110003 | J505: 1 | K505: =R[-1]C -> [{7,0},{8,0},{9,0},{10,0},{11,6},{12,4},{17,10},{18,8},{19,1},{23,4},{24,10}] | L505: =R[-1]C -> [{7,27},{8,55},{9,27},{10,55},{11,27},{12,55},{17,18},{18,110},{19,3},{23,37},{24,37}] | M505: =R[-1]C -> [{0,1,[1,30]},{1,2,[11,40]},{2,5,[21,50]},{5,10,[31,60]},{10,20,[41,60]},{30,20,[51,70]},{50,10,[61,80]},{70,5,[71,80]},{100,2,[81,90]},{150,1,[91,100]}]
A506: 503 | B506: 2 | C506: 7 | D506: 3000 | E506: =R[-18]C -> 71 | F506: =R[-18]C -> 80 | G506: 1 | H506: 5000 | I506: 110003 | J506: 1 | K506: =R[-1]C -> [{7,0},{8,0},{9,0},{10,0},{11,6},{12,4},{17,10},{18,8},{19,1},{23,4},{24,10}] | L506: =R[-1]C -> [{7,27},{8,55},{9,27},{10,55},{11,27},{12,55},{17,18},{18,110},{19,3},{23,37},{24,37}] | M506: =R[-1]C -> [{0,1,[1,30]},{1,2,[11,40]},{2,5,[21,50]},{5,10,[31,60]},{10,20,[41,60]},{30,20,[51,70]},{50,10,[61,80]},{70,5,[71,80]},{100,2,[81,90]},{150,1,[91,100]}]
A507: 504 | B507: 2 | C507: 7 | D507: 3000 | E507: =R[-18]C -> 81 | F507: =R[-18]C -> 90 | G507: 1 | H507: 5000 | I507: 110003 | J507: 1 | K507: =R[-1]C -> [{7,0},{8,0},{9,0},{10,0},{11,6},{12,4},{17,10},{18,8},{19,1},{23,4},{24,10}] | L507: =R[-1]C -> [{7,27},{8,55},{9,27},{10,55},{11,27},{12,55},{17,18},{18,110},{19,3},{23,37},{24,37}] | M507: =R[-1]C -> [{0,1,[1,30]},{1,2,[11,40]},{2,5,[21,50]},{5,10,[31,60]},{10,20,[41,60]},{30,20,[51,70]},{50,10,[61,80]},{70,5,[71,80]},{100,2,[81,90]},{150,1,[91,100]}]
A508: 505 | B508: 3 | C508: 7 | D508: 3000 | E508: =R[-9]C -> 1 | F508: =R[-9]C -> 10 | G508: 2 | H508: 10000 | I508: 110003 | J508: 2 | K508: =R[-1]C -> [{7,0},{8,0},{9,0},{10,0},{11,6},{12,4},{17,10},{18,8},{19,1},{23,4},{24,10}] | L508: =R[-1]C -> [{7,27},{8,55},{9,27},{10,55},{11,27},{12,55},{17,18},{18,110},{19,3},{23,37},{24,37}] | M508: =R[-1]C -> [{0,1,[1,30]},{1,2,[11,40]},{2,5,[21,50]},{5,10,[31,60]},{10,20,[41,60]},{30,20,[51,70]},{50,10,[61,80]},{70,5,[71,80]},{100,2,[81,90]},{150,1,[91,100]}]
A509: 506 | B509: 3 | C509: 7 | D509: 3000 | E509: =R[-9]C -> 11 | F509: =R[-9]C -> 20 | G509: 2 | H509: 10000 | I509: 110003 | J509: 2 | K509: =R[-1]C -> [{7,0},{8,0},{9,0},{10,0},{11,6},{12,4},{17,10},{18,8},{19,1},{23,4},{24,10}] | L509: =R[-1]C -> [{7,27},{8,55},{9,27},{10,55},{11,27},{12,55},{17,18},{18,110},{19,3},{23,37},{24,37}] | M509: =R[-1]C -> [{0,1,[1,30]},{1,2,[11,40]},{2,5,[21,50]},{5,10,[31,60]},{10,20,[41,60]},{30,20,[51,70]},{50,10,[61,80]},{70,5,[71,80]},{100,2,[81,90]},{150,1,[91,100]}]
A510: 507 | B510: 3 | C510: 7 | D510: 3000 | E510: =R[-9]C -> 21 | F510: =R[-9]C -> 30 | G510: 2 | H510: 10000 | I510: 110003 | J510: 2 | K510: =R[-1]C -> [{7,0},{8,0},{9,0},{10,0},{11,6},{12,4},{17,10},{18,8},{19,1},{23,4},{24,10}] | L510: =R[-1]C -> [{7,27},{8,55},{9,27},{10,55},{11,27},{12,55},{17,18},{18,110},{19,3},{23,37},{24,37}] | M510: =R[-1]C -> [{0,1,[1,30]},{1,2,[11,40]},{2,5,[21,50]},{5,10,[31,60]},{10,20,[41,60]},{30,20,[51,70]},{50,10,[61,80]},{70,5,[71,80]},{100,2,[81,90]},{150,1,[91,100]}]
A511: 508 | B511: 3 | C511: 7 | D511: 3000 | E511: =R[-9]C -> 31 | F511: =R[-9]C -> 40 | G511: 2 | H511: 10000 | I511: 110003 | J511: 2 | K511: =R[-1]C -> [{7,0},{8,0},{9,0},{10,0},{11,6},{12,4},{17,10},{18,8},{19,1},{23,4},{24,10}] | L511: =R[-1]C -> [{7,27},{8,55},{9,27},{10,55},{11,27},{12,55},{17,18},{18,110},{19,3},{23,37},{24,37}] | M511: =R[-1]C -> [{0,1,[1,30]},{1,2,[11,40]},{2,5,[21,50]},{5,10,[31,60]},{10,20,[41,60]},{30,20,[51,70]},{50,10,[61,80]},{70,5,[71,80]},{100,2,[81,90]},{150,1,[91,100]}]
A512: 509 | B512: 3 | C512: 7 | D512: 3000 | E512: =R[-9]C -> 41 | F512: =R[-9]C -> 50 | G512: 2 | H512: 10000 | I512: 110003 | J512: 2 | K512: =R[-1]C -> [{7,0},{8,0},{9,0},{10,0},{11,6},{12,4},{17,10},{18,8},{19,1},{23,4},{24,10}] | L512: =R[-1]C -> [{7,27},{8,55},{9,27},{10,55},{11,27},{12,55},{17,18},{18,110},{19,3},{23,37},{24,37}] | M512: =R[-1]C -> [{0,1,[1,30]},{1,2,[11,40]},{2,5,[21,50]},{5,10,[31,60]},{10,20,[41,60]},{30,20,[51,70]},{50,10,[61,80]},{70,5,[71,80]},{100,2,[81,90]},{150,1,[91,100]}]
A513: 510 | B513: 3 | C513: 7 | D513: 3000 | E513: =R[-9]C -> 51 | F513: =R[-9]C -> 60 | G513: 2 | H513: 10000 | I513: 110003 | J513: 2 | K513: =R[-1]C -> [{7,0},{8,0},{9,0},{10,0},{11,6},{12,4},{17,10},{18,8},{19,1},{23,4},{24,10}] | L513: =R[-1]C -> [{7,27},{8,55},{9,27},{10,55},{11,27},{12,55},{17,18},{18,110},{19,3},{23,37},{24,37}] | M513: =R[-1]C -> [{0,1,[1,30]},{1,2,[11,40]},{2,5,[21,50]},{5,10,[31,60]},{10,20,[41,60]},{30,20,[51,70]},{50,10,[61,80]},{70,5,[71,80]},{100,2,[81,90]},{150,1,[91,100]}]
A514: 511 | B514: 3 | C514: 7 | D514: 3000 | E514: =R[-9]C -> 61 | F514: =R[-9]C -> 70 | G514: 2 | H514: 10000 | I514: 110003 | J514: 2 | K514: =R[-1]C -> [{7,0},{8,0},{9,0},{10,0},{11,6},{12,4},{17,10},{18,8},{19,1},{23,4},{24,10}] | L514: =R[-1]C -> [{7,27},{8,55},{9,27},{10,55},{11,27},{12,55},{17,18},{18,110},{19,3},{23,37},{24,37}] | M514: =R[-1]C -> [{0,1,[1,30]},{1,2,[11,40]},{2,5,[21,50]},{5,10,[31,60]},{10,20,[41,60]},{30,20,[51,70]},{50,10,[61,80]},{70,5,[71,80]},{100,2,[81,90]},{150,1,[91,100]}]
A515: 512 | B515: 3 | C515: 7 | D515: 3000 | E515: =R[-9]C -> 71 | F515: =R[-9]C -> 80 | G515: 2 | H515: 10000 | I515: 110003 | J515: 2 | K515: =R[-1]C -> [{7,0},{8,0},{9,0},{10,0},{11,6},{12,4},{17,10},{18,8},{19,1},{23,4},{24,10}] | L515: =R[-1]C -> [{7,27},{8,55},{9,27},{10,55},{11,27},{12,55},{17,18},{18,110},{19,3},{23,37},{24,37}] | M515: =R[-1]C -> [{0,1,[1,30]},{1,2,[11,40]},{2,5,[21,50]},{5,10,[31,60]},{10,20,[41,60]},{30,20,[51,70]},{50,10,[61,80]},{70,5,[71,80]},{100,2,[81,90]},{150,1,[91,100]}]
A516: 513 | B516: 3 | C516: 7 | D516: 3000 | E516: =R[-9]C -> 81 | F516: =R[-9]C -> 90 | G516: 2 | H516: 10000 | I516: 110003 | J516: 2 | K516: =R[-1]C -> [{7,0},{8,0},{9,0},{10,0},{11,6},{12,4},{17,10},{18,8},{19,1},{23,4},{24,10}] | L516: =R[-1]C -> [{7,27},{8,55},{9,27},{10,55},{11,27},{12,55},{17,18},{18,110},{19,3},{23,37},{24,37}] | M516: =R[-1]C -> [{0,1,[1,30]},{1,2,[11,40]},{2,5,[21,50]},{5,10,[31,60]},{10,20,[41,60]},{30,20,[51,70]},{50,10,[61,80]},{70,5,[71,80]},{100,2,[81,90]},{150,1,[91,100]}]
A517: 514 | B517: 4 | C517: 7 | D517: 3000 | E517: =R[-9]C -> 1 | F517: =R[-9]C -> 10 | G517: 3 | H517: 15000 | I517: 110003 | J517: 3 | K517: =R[-1]C -> [{7,0},{8,0},{9,0},{10,0},{11,6},{12,4},{17,10},{18,8},{19,1},{23,4},{24,10}] | L517: =R[-1]C -> [{7,27},{8,55},{9,27},{10,55},{11,27},{12,55},{17,18},{18,110},{19,3},{23,37},{24,37}] | M517: =R[-1]C -> [{0,1,[1,30]},{1,2,[11,40]},{2,5,[21,50]},{5,10,[31,60]},{10,20,[41,60]},{30,20,[51,70]},{50,10,[61,80]},{70,5,[71,80]},{100,2,[81,90]},{150,1,[91,100]}]
A518: 515 | B518: 4 | C518: 7 | D518: 3000 | E518: =R[-9]C -> 11 | F518: =R[-9]C -> 20 | G518: 3 | H518: 15000 | I518: 110003 | J518: 3 | K518: =R[-1]C -> [{7,0},{8,0},{9,0},{10,0},{11,6},{12,4},{17,10},{18,8},{19,1},{23,4},{24,10}] | L518: =R[-1]C -> [{7,27},{8,55},{9,27},{10,55},{11,27},{12,55},{17,18},{18,110},{19,3},{23,37},{24,37}] | M518: =R[-1]C -> [{0,1,[1,30]},{1,2,[11,40]},{2,5,[21,50]},{5,10,[31,60]},{10,20,[41,60]},{30,20,[51,70]},{50,10,[61,80]},{70,5,[71,80]},{100,2,[81,90]},{150,1,[91,100]}]
A519: 516 | B519: 4 | C519: 7 | D519: 3000 | E519: =R[-9]C -> 21 | F519: =R[-9]C -> 30 | G519: 3 | H519: 15000 | I519: 110003 | J519: 3 | K519: =R[-1]C -> [{7,0},{8,0},{9,0},{10,0},{11,6},{12,4},{17,10},{18,8},{19,1},{23,4},{24,10}] | L519: =R[-1]C -> [{7,27},{8,55},{9,27},{10,55},{11,27},{12,55},{17,18},{18,110},{19,3},{23,37},{24,37}] | M519: =R[-1]C -> [{0,1,[1,30]},{1,2,[11,40]},{2,5,[21,50]},{5,10,[31,60]},{10,20,[41,60]},{30,20,[51,70]},{50,10,[61,80]},{70,5,[71,80]},{100,2,[81,90]},{150,1,[91,100]}]
A520: 517 | B520: 4 | C520: 7 | D520: 3000 | E520: =R[-9]C -> 31 | F520: =R[-9]C -> 40 | G520: 3 | H520: 15000 | I520: 110003 | J520: 3 | K520: =R[-1]C -> [{7,0},{8,0},{9,0},{10,0},{11,6},{12,4},{17,10},{18,8},{19,1},{23,4},{24,10}] | L520: =R[-1]C -> [{7,27},{8,55},{9,27},{10,55},{11,27},{12,55},{17,18},{18,110},{19,3},{23,37},{24,37}] | M520: =R[-1]C -> [{0,1,[1,30]},{1,2,[11,40]},{2,5,[21,50]},{5,10,[31,60]},{10,20,[41,60]},{30,20,[51,70]},{50,10,[61,80]},{70,5,[71,80]},{100,2,[81,90]},{150,1,[91,100]}]
A521: 518 | B521: 4 | C521: 7 | D521: 3000 | E521: =R[-9]C -> 41 | F521: =R[-9]C -> 50 | G521: 3 | H521: 15000 | I521: 110003 | J521: 3 | K521: =R[-1]C -> [{7,0},{8,0},{9,0},{10,0},{11,6},{12,4},{17,10},{18,8},{19,1},{23,4},{24,10}] | L521: =R[-1]C -> [{7,27},{8,55},{9,27},{10,55},{11,27},{12,55},{17,18},{18,110},{19,3},{23,37},{24,37}] | M521: =R[-1]C -> [{0,1,[1,30]},{1,2,[11,40]},{2,5,[21,50]},{5,10,[31,60]},{10,20,[41,60]},{30,20,[51,70]},{50,10,[61,80]},{70,5,[71,80]},{100,2,[81,90]},{150,1,[91,100]}]
A522: 519 | B522: 4 | C522: 7 | D522: 3000 | E522: =R[-9]C -> 51 | F522: =R[-9]C -> 60 | G522: 3 | H522: 15000 | I522: 110003 | J522: 3 | K522: =R[-1]C -> [{7,0},{8,0},{9,0},{10,0},{11,6},{12,4},{17,10},{18,8},{19,1},{23,4},{24,10}] | L522: =R[-1]C -> [{7,27},{8,55},{9,27},{10,55},{11,27},{12,55},{17,18},{18,110},{19,3},{23,37},{24,37}] | M522: =R[-1]C -> [{0,1,[1,30]},{1,2,[11,40]},{2,5,[21,50]},{5,10,[31,60]},{10,20,[41,60]},{30,20,[51,70]},{50,10,[61,80]},{70,5,[71,80]},{100,2,[81,90]},{150,1,[91,100]}]
A523: 520 | B523: 4 | C523: 7 | D523: 3000 | E523: =R[-9]C -> 61 | F523: =R[-9]C -> 70 | G523: 3 | H523: 15000 | I523: 110003 | J523: 3 | K523: =R[-1]C -> [{7,0},{8,0},{9,0},{10,0},{11,6},{12,4},{17,10},{18,8},{19,1},{23,4},{24,10}] | L523: =R[-1]C -> [{7,27},{8,55},{9,27},{10,55},{11,27},{12,55},{17,18},{18,110},{19,3},{23,37},{24,37}] | M523: =R[-1]C -> [{0,1,[1,30]},{1,2,[11,40]},{2,5,[21,50]},{5,10,[31,60]},{10,20,[41,60]},{30,20,[51,70]},{50,10,[61,80]},{70,5,[71,80]},{100,2,[81,90]},{150,1,[91,100]}]
A524: 521 | B524: 4 | C524: 7 | D524: 3000 | E524: =R[-9]C -> 71 | F524: =R[-9]C -> 80 | G524: 3 | H524: 15000 | I524: 110003 | J524: 3 | K524: =R[-1]C -> [{7,0},{8,0},{9,0},{10,0},{11,6},{12,4},{17,10},{18,8},{19,1},{23,4},{24,10}] | L524: =R[-1]C -> [{7,27},{8,55},{9,27},{10,55},{11,27},{12,55},{17,18},{18,110},{19,3},{23,37},{24,37}] | M524: =R[-1]C -> [{0,1,[1,30]},{1,2,[11,40]},{2,5,[21,50]},{5,10,[31,60]},{10,20,[41,60]},{30,20,[51,70]},{50,10,[61,80]},{70,5,[71,80]},{100,2,[81,90]},{150,1,[91,100]}]
A525: 522 | B525: 4 | C525: 7 | D525: 3000 | E525: =R[-9]C -> 81 | F525: =R[-9]C -> 90 | G525: 3 | H525: 15000 | I525: 110003 | J525: 3 | K525: =R[-1]C -> [{7,0},{8,0},{9,0},{10,0},{11,6},{12,4},{17,10},{18,8},{19,1},{23,4},{24,10}] | L525: =R[-1]C -> [{7,27},{8,55},{9,27},{10,55},{11,27},{12,55},{17,18},{18,110},{19,3},{23,37},{24,37}] | M525: =R[-1]C -> [{0,1,[1,30]},{1,2,[11,40]},{2,5,[21,50]},{5,10,[31,60]},{10,20,[41,60]},{30,20,[51,70]},{50,10,[61,80]},{70,5,[71,80]},{100,2,[81,90]},{150,1,[91,100]}]
A526: 523 | B526: 5 | C526: 7 | D526: 3000 | E526: =R[-9]C -> 1 | F526: =R[-9]C -> 10 | G526: 4 | H526: 20000 | I526: 110003 | J526: 4 | K526: =R[-1]C -> [{7,0},{8,0},{9,0},{10,0},{11,6},{12,4},{17,10},{18,8},{19,1},{23,4},{24,10}] | L526: =R[-1]C -> [{7,27},{8,55},{9,27},{10,55},{11,27},{12,55},{17,18},{18,110},{19,3},{23,37},{24,37}] | M526: =R[-1]C -> [{0,1,[1,30]},{1,2,[11,40]},{2,5,[21,50]},{5,10,[31,60]},{10,20,[41,60]},{30,20,[51,70]},{50,10,[61,80]},{70,5,[71,80]},{100,2,[81,90]},{150,1,[91,100]}]
A527: 524 | B527: 5 | C527: 7 | D527: 3000 | E527: =R[-9]C -> 11 | F527: =R[-9]C -> 20 | G527: 4 | H527: 20000 | I527: 110003 | J527: 4 | K527: =R[-1]C -> [{7,0},{8,0},{9,0},{10,0},{11,6},{12,4},{17,10},{18,8},{19,1},{23,4},{24,10}] | L527: =R[-1]C -> [{7,27},{8,55},{9,27},{10,55},{11,27},{12,55},{17,18},{18,110},{19,3},{23,37},{24,37}] | M527: =R[-1]C -> [{0,1,[1,30]},{1,2,[11,40]},{2,5,[21,50]},{5,10,[31,60]},{10,20,[41,60]},{30,20,[51,70]},{50,10,[61,80]},{70,5,[71,80]},{100,2,[81,90]},{150,1,[91,100]}]
A528: 525 | B528: 5 | C528: 7 | D528: 3000 | E528: =R[-9]C -> 21 | F528: =R[-9]C -> 30 | G528: 4 | H528: 20000 | I528: 110003 | J528: 4 | K528: =R[-1]C -> [{7,0},{8,0},{9,0},{10,0},{11,6},{12,4},{17,10},{18,8},{19,1},{23,4},{24,10}] | L528: =R[-1]C -> [{7,27},{8,55},{9,27},{10,55},{11,27},{12,55},{17,18},{18,110},{19,3},{23,37},{24,37}] | M528: =R[-1]C -> [{0,1,[1,30]},{1,2,[11,40]},{2,5,[21,50]},{5,10,[31,60]},{10,20,[41,60]},{30,20,[51,70]},{50,10,[61,80]},{70,5,[71,80]},{100,2,[81,90]},{150,1,[91,100]}]
A529: 526 | B529: 5 | C529: 7 | D529: 3000 | E529: =R[-9]C -> 31 | F529: =R[-9]C -> 40 | G529: 4 | H529: 20000 | I529: 110003 | J529: 4 | K529: =R[-1]C -> [{7,0},{8,0},{9,0},{10,0},{11,6},{12,4},{17,10},{18,8},{19,1},{23,4},{24,10}] | L529: =R[-1]C -> [{7,27},{8,55},{9,27},{10,55},{11,27},{12,55},{17,18},{18,110},{19,3},{23,37},{24,37}] | M529: =R[-1]C -> [{0,1,[1,30]},{1,2,[11,40]},{2,5,[21,50]},{5,10,[31,60]},{10,20,[41,60]},{30,20,[51,70]},{50,10,[61,80]},{70,5,[71,80]},{100,2,[81,90]},{150,1,[91,100]}]
A530: 527 | B530: 5 | C530: 7 | D530: 3000 | E530: =R[-9]C -> 41 | F530: =R[-9]C -> 50 | G530: 4 | H530: 20000 | I530: 110003 | J530: 4 | K530: =R[-1]C -> [{7,0},{8,0},{9,0},{10,0},{11,6},{12,4},{17,10},{18,8},{19,1},{23,4},{24,10}] | L530: =R[-1]C -> [{7,27},{8,55},{9,27},{10,55},{11,27},{12,55},{17,18},{18,110},{19,3},{23,37},{24,37}] | M530: =R[-1]C -> [{0,1,[1,30]},{1,2,[11,40]},{2,5,[21,50]},{5,10,[31,60]},{10,20,[41,60]},{30,20,[51,70]},{50,10,[61,80]},{70,5,[71,80]},{100,2,[81,90]},{150,1,[91,100]}]
A531: 528 | B531: 5 | C531: 7 | D531: 3000 | E531: =R[-9]C -> 51 | F531: =R[-9]C -> 60 | G531: 4 | H531: 20000 | I531: 110003 | J531: 4 | K531: =R[-1]C -> [{7,0},{8,0},{9,0},{10,0},{11,6},{12,4},{17,10},{18,8},{19,1},{23,4},{24,10}] | L531: =R[-1]C -> [{7,27},{8,55},{9,27},{10,55},{11,27},{12,55},{17,18},{18,110},{19,3},{23,37},{24,37}] | M531: =R[-1]C -> [{0,1,[1,30]},{1,2,[11,40]},{2,5,[21,50]},{5,10,[31,60]},{10,20,[41,60]},{30,20,[51,70]},{50,10,[61,80]},{70,5,[71,80]},{100,2,[81,90]},{150,1,[91,100]}]
A532: 529 | B532: 5 | C532: 7 | D532: 3000 | E532: =R[-9]C -> 61 | F532: =R[-9]C -> 70 | G532: 4 | H532: 20000 | I532: 110003 | J532: 4 | K532: =R[-1]C -> [{7,0},{8,0},{9,0},{10,0},{11,6},{12,4},{17,10},{18,8},{19,1},{23,4},{24,10}] | L532: =R[-1]C -> [{7,27},{8,55},{9,27},{10,55},{11,27},{12,55},{17,18},{18,110},{19,3},{23,37},{24,37}] | M532: =R[-1]C -> [{0,1,[1,30]},{1,2,[11,40]},{2,5,[21,50]},{5,10,[31,60]},{10,20,[41,60]},{30,20,[51,70]},{50,10,[61,80]},{70,5,[71,80]},{100,2,[81,90]},{150,1,[91,100]}]
A533: 530 | B533: 5 | C533: 7 | D533: 3000 | E533: =R[-9]C -> 71 | F533: =R[-9]C -> 80 | G533: 4 | H533: 20000 | I533: 110003 | J533: 4 | K533: =R[-1]C -> [{7,0},{8,0},{9,0},{10,0},{11,6},{12,4},{17,10},{18,8},{19,1},{23,4},{24,10}] | L533: =R[-1]C -> [{7,27},{8,55},{9,27},{10,55},{11,27},{12,55},{17,18},{18,110},{19,3},{23,37},{24,37}] | M533: =R[-1]C -> [{0,1,[1,30]},{1,2,[11,40]},{2,5,[21,50]},{5,10,[31,60]},{10,20,[41,60]},{30,20,[51,70]},{50,10,[61,80]},{70,5,[71,80]},{100,2,[81,90]},{150,1,[91,100]}]
A534: 531 | B534: 5 | C534: 7 | D534: 3000 | E534: =R[-9]C -> 81 | F534: =R[-9]C -> 90 | G534: 4 | H534: 20000 | I534: 110003 | J534: 4 | K534: =R[-1]C -> [{7,0},{8,0},{9,0},{10,0},{11,6},{12,4},{17,10},{18,8},{19,1},{23,4},{24,10}] | L534: =R[-1]C -> [{7,27},{8,55},{9,27},{10,55},{11,27},{12,55},{17,18},{18,110},{19,3},{23,37},{24,37}] | M534: =R[-1]C -> [{0,1,[1,30]},{1,2,[11,40]},{2,5,[21,50]},{5,10,[31,60]},{10,20,[41,60]},{30,20,[51,70]},{50,10,[61,80]},{70,5,[71,80]},{100,2,[81,90]},{150,1,[91,100]}]
A535: 532 | B535: 6 | C535: 7 | D535: 3000 | E535: =R[-9]C -> 1 | F535: =R[-9]C -> 10 | G535: 5 | H535: 20000 | I535: 110003 | J535: 5 | K535: =R[-1]C -> [{7,0},{8,0},{9,0},{10,0},{11,6},{12,4},{17,10},{18,8},{19,1},{23,4},{24,10}] | L535: =R[-1]C -> [{7,27},{8,55},{9,27},{10,55},{11,27},{12,55},{17,18},{18,110},{19,3},{23,37},{24,37}] | M535: =R[-1]C -> [{0,1,[1,30]},{1,2,[11,40]},{2,5,[21,50]},{5,10,[31,60]},{10,20,[41,60]},{30,20,[51,70]},{50,10,[61,80]},{70,5,[71,80]},{100,2,[81,90]},{150,1,[91,100]}]
A536: 533 | B536: 6 | C536: 7 | D536: 3000 | E536: =R[-9]C -> 11 | F536: =R[-9]C -> 20 | G536: 5 | H536: 20000 | I536: 110003 | J536: 5 | K536: =R[-1]C -> [{7,0},{8,0},{9,0},{10,0},{11,6},{12,4},{17,10},{18,8},{19,1},{23,4},{24,10}] | L536: =R[-1]C -> [{7,27},{8,55},{9,27},{10,55},{11,27},{12,55},{17,18},{18,110},{19,3},{23,37},{24,37}] | M536: =R[-1]C -> [{0,1,[1,30]},{1,2,[11,40]},{2,5,[21,50]},{5,10,[31,60]},{10,20,[41,60]},{30,20,[51,70]},{50,10,[61,80]},{70,5,[71,80]},{100,2,[81,90]},{150,1,[91,100]}]
A537: 534 | B537: 6 | C537: 7 | D537: 3000 | E537: =R[-9]C -> 21 | F537: =R[-9]C -> 30 | G537: 5 | H537: 20000 | I537: 110003 | J537: 5 | K537: =R[-1]C -> [{7,0},{8,0},{9,0},{10,0},{11,6},{12,4},{17,10},{18,8},{19,1},{23,4},{24,10}] | L537: =R[-1]C -> [{7,27},{8,55},{9,27},{10,55},{11,27},{12,55},{17,18},{18,110},{19,3},{23,37},{24,37}] | M537: =R[-1]C -> [{0,1,[1,30]},{1,2,[11,40]},{2,5,[21,50]},{5,10,[31,60]},{10,20,[41,60]},{30,20,[51,70]},{50,10,[61,80]},{70,5,[71,80]},{100,2,[81,90]},{150,1,[91,100]}]
A538: 535 | B538: 6 | C538: 7 | D538: 3000 | E538: =R[-9]C -> 31 | F538: =R[-9]C -> 40 | G538: 5 | H538: 20000 | I538: 110003 | J538: 5 | K538: =R[-1]C -> [{7,0},{8,0},{9,0},{10,0},{11,6},{12,4},{17,10},{18,8},{19,1},{23,4},{24,10}] | L538: =R[-1]C -> [{7,27},{8,55},{9,27},{10,55},{11,27},{12,55},{17,18},{18,110},{19,3},{23,37},{24,37}] | M538: =R[-1]C -> [{0,1,[1,30]},{1,2,[11,40]},{2,5,[21,50]},{5,10,[31,60]},{10,20,[41,60]},{30,20,[51,70]},{50,10,[61,80]},{70,5,[71,80]},{100,2,[81,90]},{150,1,[91,100]}]
A539: 536 | B539: 6 | C539: 7 | D539: 3000 | E539: =R[-9]C -> 41 | F539: =R[-9]C -> 50 | G539: 5 | H539: 20000 | I539: 110003 | J539: 5 | K539: =R[-1]C -> [{7,0},{8,0},{9,0},{10,0},{11,6},{12,4},{17,10},{18,8},{19,1},{23,4},{24,10}] | L539: =R[-1]C -> [{7,27},{8,55},{9,27},{10,55},{11,27},{12,55},{17,18},{18,110},{19,3},{23,37},{24,37}] | M539: =R[-1]C -> [{0,1,[1,30]},{1,2,[11,40]},{2,5,[21,50]},{5,10,[31,60]},{10,20,[41,60]},{30,20,[51,70]},{50,10,[61,80]},{70,5,[71,80]},{100,2,[81,90]},{150,1,[91,100]}]
A540: 537 | B540: 6 | C540: 7 | D540: 3000 | E540: =R[-9]C -> 51 | F540: =R[-9]C -> 60 | G540: 5 | H540: 20000 | I540: 110003 | J540: 5 | K540: =R[-1]C -> [{7,0},{8,0},{9,0},{10,0},{11,6},{12,4},{17,10},{18,8},{19,1},{23,4},{24,10}] | L540: =R[-1]C -> [{7,27},{8,55},{9,27},{10,55},{11,27},{12,55},{17,18},{18,110},{19,3},{23,37},{24,37}] | M540: =R[-1]C -> [{0,1,[1,30]},{1,2,[11,40]},{2,5,[21,50]},{5,10,[31,60]},{10,20,[41,60]},{30,20,[51,70]},{50,10,[61,80]},{70,5,[71,80]},{100,2,[81,90]},{150,1,[91,100]}]
A541: 538 | B541: 6 | C541: 7 | D541: 3000 | E541: =R[-9]C -> 61 | F541: =R[-9]C -> 70 | G541: 5 | H541: 20000 | I541: 110003 | J541: 5 | K541: =R[-1]C -> [{7,0},{8,0},{9,0},{10,0},{11,6},{12,4},{17,10},{18,8},{19,1},{23,4},{24,10}] | L541: =R[-1]C -> [{7,27},{8,55},{9,27},{10,55},{11,27},{12,55},{17,18},{18,110},{19,3},{23,37},{24,37}] | M541: =R[-1]C -> [{0,1,[1,30]},{1,2,[11,40]},{2,5,[21,50]},{5,10,[31,60]},{10,20,[41,60]},{30,20,[51,70]},{50,10,[61,80]},{70,5,[71,80]},{100,2,[81,90]},{150,1,[91,100]}]
A542: 539 | B542: 6 | C542: 7 | D542: 3000 | E542: =R[-9]C -> 71 | F542: =R[-9]C -> 80 | G542: 5 | H542: 20000 | I542: 110003 | J542: 5 | K542: =R[-1]C -> [{7,0},{8,0},{9,0},{10,0},{11,6},{12,4},{17,10},{18,8},{19,1},{23,4},{24,10}] | L542: =R[-1]C -> [{7,27},{8,55},{9,27},{10,55},{11,27},{12,55},{17,18},{18,110},{19,3},{23,37},{24,37}] | M542: =R[-1]C -> [{0,1,[1,30]},{1,2,[11,40]},{2,5,[21,50]},{5,10,[31,60]},{10,20,[41,60]},{30,20,[51,70]},{50,10,[61,80]},{70,5,[71,80]},{100,2,[81,90]},{150,1,[91,100]}]
A543: 540 | B543: 6 | C543: 7 | D543: 3000 | E543: =R[-9]C -> 81 | F543: =R[-9]C -> 90 | G543: 5 | H543: 20000 | I543: 110003 | J543: 5 | K543: =R[-1]C -> [{7,0},{8,0},{9,0},{10,0},{11,6},{12,4},{17,10},{18,8},{19,1},{23,4},{24,10}] | L543: =R[-1]C -> [{7,27},{8,55},{9,27},{10,55},{11,27},{12,55},{17,18},{18,110},{19,3},{23,37},{24,37}] | M543: =R[-1]C -> [{0,1,[1,30]},{1,2,[11,40]},{2,5,[21,50]},{5,10,[31,60]},{10,20,[41,60]},{30,20,[51,70]},{50,10,[61,80]},{70,5,[71,80]},{100,2,[81,90]},{150,1,[91,100]}]
A544: 541 | B544: 2 | C544: 1 | D544: 0 | E544: 1 | F544: 10 | G544: 1 | H544: 5000 | I544: 110003 | J544: 1 | K544: =配置模型!R15C[12] -> [{7,3},{8,3},{9,3},{10,3},{11,3},{12,3},{17,10},{18,8},{19,1},{23,4},{24,10}] | L544: =R[-10]C -> [{7,27},{8,55},{9,27},{10,55},{11,27},{12,55},{17,18},{18,110},{19,3},{23,37},{24,37}] | M544: =R[-10]C -> [{0,1,[1,30]},{1,2,[11,40]},{2,5,[21,50]},{5,10,[31,60]},{10,20,[41,60]},{30,20,[51,70]},{50,10,[61,80]},{70,5,[71,80]},{100,2,[81,90]},{150,1,[91,100]}]
A545: 542 | B545: 2 | C545: 1 | D545: 0 | E545: =R[-1]C+10 -> 11 | F545: =R[-1]C+10 -> 20 | G545: 1 | H545: 5000 | I545: 110003 | J545: 1 | K545: =R[-1]C -> [{7,3},{8,3},{9,3},{10,3},{11,3},{12,3},{17,10},{18,8},{19,1},{23,4},{24,10}] | L545: =R[-1]C -> [{7,27},{8,55},{9,27},{10,55},{11,27},{12,55},{17,18},{18,110},{19,3},{23,37},{24,37}] | M545: =R[-1]C -> [{0,1,[1,30]},{1,2,[11,40]},{2,5,[21,50]},{5,10,[31,60]},{10,20,[41,60]},{30,20,[51,70]},{50,10,[61,80]},{70,5,[71,80]},{100,2,[81,90]},{150,1,[91,100]}]
A546: 543 | B546: 2 | C546: 1 | D546: 0 | E546: =R[-1]C+10 -> 21 | F546: =R[-1]C+10 -> 30 | G546: 1 | H546: 5000 | I546: 110003 | J546: 1 | K546: =R[-1]C -> [{7,3},{8,3},{9,3},{10,3},{11,3},{12,3},{17,10},{18,8},{19,1},{23,4},{24,10}] | L546: =R[-1]C -> [{7,27},{8,55},{9,27},{10,55},{11,27},{12,55},{17,18},{18,110},{19,3},{23,37},{24,37}] | M546: =R[-1]C -> [{0,1,[1,30]},{1,2,[11,40]},{2,5,[21,50]},{5,10,[31,60]},{10,20,[41,60]},{30,20,[51,70]},{50,10,[61,80]},{70,5,[71,80]},{100,2,[81,90]},{150,1,[91,100]}]
A547: 544 | B547: 2 | C547: 1 | D547: 0 | E547: =R[-1]C+10 -> 31 | F547: =R[-1]C+10 -> 40 | G547: 1 | H547: 5000 | I547: 110003 | J547: 1 | K547: =R[-1]C -> [{7,3},{8,3},{9,3},{10,3},{11,3},{12,3},{17,10},{18,8},{19,1},{23,4},{24,10}] | L547: =R[-1]C -> [{7,27},{8,55},{9,27},{10,55},{11,27},{12,55},{17,18},{18,110},{19,3},{23,37},{24,37}] | M547: =R[-1]C -> [{0,1,[1,30]},{1,2,[11,40]},{2,5,[21,50]},{5,10,[31,60]},{10,20,[41,60]},{30,20,[51,70]},{50,10,[61,80]},{70,5,[71,80]},{100,2,[81,90]},{150,1,[91,100]}]
A548: 545 | B548: 2 | C548: 1 | D548: 0 | E548: =R[-1]C+10 -> 41 | F548: =R[-1]C+10 -> 50 | G548: 1 | H548: 5000 | I548: 110003 | J548: 1 | K548: =R[-1]C -> [{7,3},{8,3},{9,3},{10,3},{11,3},{12,3},{17,10},{18,8},{19,1},{23,4},{24,10}] | L548: =R[-1]C -> [{7,27},{8,55},{9,27},{10,55},{11,27},{12,55},{17,18},{18,110},{19,3},{23,37},{24,37}] | M548: =R[-1]C -> [{0,1,[1,30]},{1,2,[11,40]},{2,5,[21,50]},{5,10,[31,60]},{10,20,[41,60]},{30,20,[51,70]},{50,10,[61,80]},{70,5,[71,80]},{100,2,[81,90]},{150,1,[91,100]}]
A549: 546 | B549: 2 | C549: 1 | D549: 0 | E549: =R[-1]C+10 -> 51 | F549: =R[-1]C+10 -> 60 | G549: 1 | H549: 5000 | I549: 110003 | J549: 1 | K549: =R[-1]C -> [{7,3},{8,3},{9,3},{10,3},{11,3},{12,3},{17,10},{18,8},{19,1},{23,4},{24,10}] | L549: =R[-1]C -> [{7,27},{8,55},{9,27},{10,55},{11,27},{12,55},{17,18},{18,110},{19,3},{23,37},{24,37}] | M549: =R[-1]C -> [{0,1,[1,30]},{1,2,[11,40]},{2,5,[21,50]},{5,10,[31,60]},{10,20,[41,60]},{30,20,[51,70]},{50,10,[61,80]},{70,5,[71,80]},{100,2,[81,90]},{150,1,[91,100]}]
A550: 547 | B550: 2 | C550: 1 | D550: 0 | E550: =R[-1]C+10 -> 61 | F550: =R[-1]C+10 -> 70 | G550: 1 | H550: 5000 | I550: 110003 | J550: 1 | K550: =R[-1]C -> [{7,3},{8,3},{9,3},{10,3},{11,3},{12,3},{17,10},{18,8},{19,1},{23,4},{24,10}] | L550: =R[-1]C -> [{7,27},{8,55},{9,27},{10,55},{11,27},{12,55},{17,18},{18,110},{19,3},{23,37},{24,37}] | M550: =R[-1]C -> [{0,1,[1,30]},{1,2,[11,40]},{2,5,[21,50]},{5,10,[31,60]},{10,20,[41,60]},{30,20,[51,70]},{50,10,[61,80]},{70,5,[71,80]},{100,2,[81,90]},{150,1,[91,100]}]
A551: 548 | B551: 2 | C551: 1 | D551: 0 | E551: =R[-1]C+10 -> 71 | F551: =R[-1]C+10 -> 80 | G551: 1 | H551: 5000 | I551: 110003 | J551: 1 | K551: =R[-1]C -> [{7,3},{8,3},{9,3},{10,3},{11,3},{12,3},{17,10},{18,8},{19,1},{23,4},{24,10}] | L551: =R[-1]C -> [{7,27},{8,55},{9,27},{10,55},{11,27},{12,55},{17,18},{18,110},{19,3},{23,37},{24,37}] | M551: =R[-1]C -> [{0,1,[1,30]},{1,2,[11,40]},{2,5,[21,50]},{5,10,[31,60]},{10,20,[41,60]},{30,20,[51,70]},{50,10,[61,80]},{70,5,[71,80]},{100,2,[81,90]},{150,1,[91,100]}]
A552: 549 | B552: 2 | C552: 1 | D552: 0 | E552: =R[-1]C+10 -> 81 | F552: =R[-1]C+10 -> 90 | G552: 1 | H552: 5000 | I552: 110003 | J552: 1 | K552: =R[-1]C -> [{7,3},{8,3},{9,3},{10,3},{11,3},{12,3},{17,10},{18,8},{19,1},{23,4},{24,10}] | L552: =R[-1]C -> [{7,27},{8,55},{9,27},{10,55},{11,27},{12,55},{17,18},{18,110},{19,3},{23,37},{24,37}] | M552: =R[-1]C -> [{0,1,[1,30]},{1,2,[11,40]},{2,5,[21,50]},{5,10,[31,60]},{10,20,[41,60]},{30,20,[51,70]},{50,10,[61,80]},{70,5,[71,80]},{100,2,[81,90]},{150,1,[91,100]}]
A553: 550 | B553: 3 | C553: 1 | D553: 0 | E553: =R[-9]C -> 1 | F553: =R[-9]C -> 10 | G553: 2 | H553: 10000 | I553: 110003 | J553: 2 | K553: =R[-1]C -> [{7,3},{8,3},{9,3},{10,3},{11,3},{12,3},{17,10},{18,8},{19,1},{23,4},{24,10}] | L553: =R[-1]C -> [{7,27},{8,55},{9,27},{10,55},{11,27},{12,55},{17,18},{18,110},{19,3},{23,37},{24,37}] | M553: =R[-1]C -> [{0,1,[1,30]},{1,2,[11,40]},{2,5,[21,50]},{5,10,[31,60]},{10,20,[41,60]},{30,20,[51,70]},{50,10,[61,80]},{70,5,[71,80]},{100,2,[81,90]},{150,1,[91,100]}]
A554: 551 | B554: 3 | C554: 1 | D554: 0 | E554: =R[-9]C -> 11 | F554: =R[-9]C -> 20 | G554: 2 | H554: 10000 | I554: 110003 | J554: 2 | K554: =R[-1]C -> [{7,3},{8,3},{9,3},{10,3},{11,3},{12,3},{17,10},{18,8},{19,1},{23,4},{24,10}] | L554: =R[-1]C -> [{7,27},{8,55},{9,27},{10,55},{11,27},{12,55},{17,18},{18,110},{19,3},{23,37},{24,37}] | M554: =R[-1]C -> [{0,1,[1,30]},{1,2,[11,40]},{2,5,[21,50]},{5,10,[31,60]},{10,20,[41,60]},{30,20,[51,70]},{50,10,[61,80]},{70,5,[71,80]},{100,2,[81,90]},{150,1,[91,100]}]
A555: 552 | B555: 3 | C555: 1 | D555: 0 | E555: =R[-9]C -> 21 | F555: =R[-9]C -> 30 | G555: 2 | H555: 10000 | I555: 110003 | J555: 2 | K555: =R[-1]C -> [{7,3},{8,3},{9,3},{10,3},{11,3},{12,3},{17,10},{18,8},{19,1},{23,4},{24,10}] | L555: =R[-1]C -> [{7,27},{8,55},{9,27},{10,55},{11,27},{12,55},{17,18},{18,110},{19,3},{23,37},{24,37}] | M555: =R[-1]C -> [{0,1,[1,30]},{1,2,[11,40]},{2,5,[21,50]},{5,10,[31,60]},{10,20,[41,60]},{30,20,[51,70]},{50,10,[61,80]},{70,5,[71,80]},{100,2,[81,90]},{150,1,[91,100]}]
A556: 553 | B556: 3 | C556: 1 | D556: 0 | E556: =R[-9]C -> 31 | F556: =R[-9]C -> 40 | G556: 2 | H556: 10000 | I556: 110003 | J556: 2 | K556: =R[-1]C -> [{7,3},{8,3},{9,3},{10,3},{11,3},{12,3},{17,10},{18,8},{19,1},{23,4},{24,10}] | L556: =R[-1]C -> [{7,27},{8,55},{9,27},{10,55},{11,27},{12,55},{17,18},{18,110},{19,3},{23,37},{24,37}] | M556: =R[-1]C -> [{0,1,[1,30]},{1,2,[11,40]},{2,5,[21,50]},{5,10,[31,60]},{10,20,[41,60]},{30,20,[51,70]},{50,10,[61,80]},{70,5,[71,80]},{100,2,[81,90]},{150,1,[91,100]}]
A557: 554 | B557: 3 | C557: 1 | D557: 0 | E557: =R[-9]C -> 41 | F557: =R[-9]C -> 50 | G557: 2 | H557: 10000 | I557: 110003 | J557: 2 | K557: =R[-1]C -> [{7,3},{8,3},{9,3},{10,3},{11,3},{12,3},{17,10},{18,8},{19,1},{23,4},{24,10}] | L557: =R[-1]C -> [{7,27},{8,55},{9,27},{10,55},{11,27},{12,55},{17,18},{18,110},{19,3},{23,37},{24,37}] | M557: =R[-1]C -> [{0,1,[1,30]},{1,2,[11,40]},{2,5,[21,50]},{5,10,[31,60]},{10,20,[41,60]},{30,20,[51,70]},{50,10,[61,80]},{70,5,[71,80]},{100,2,[81,90]},{150,1,[91,100]}]
A558: 555 | B558: 3 | C558: 1 | D558: 0 | E558: =R[-9]C -> 51 | F558: =R[-9]C -> 60 | G558: 2 | H558: 10000 | I558: 110003 | J558: 2 | K558: =R[-1]C -> [{7,3},{8,3},{9,3},{10,3},{11,3},{12,3},{17,10},{18,8},{19,1},{23,4},{24,10}] | L558: =R[-1]C -> [{7,27},{8,55},{9,27},{10,55},{11,27},{12,55},{17,18},{18,110},{19,3},{23,37},{24,37}] | M558: =R[-1]C -> [{0,1,[1,30]},{1,2,[11,40]},{2,5,[21,50]},{5,10,[31,60]},{10,20,[41,60]},{30,20,[51,70]},{50,10,[61,80]},{70,5,[71,80]},{100,2,[81,90]},{150,1,[91,100]}]
A559: 556 | B559: 3 | C559: 1 | D559: 0 | E559: =R[-9]C -> 61 | F559: =R[-9]C -> 70 | G559: 2 | H559: 10000 | I559: 110003 | J559: 2 | K559: =R[-1]C -> [{7,3},{8,3},{9,3},{10,3},{11,3},{12,3},{17,10},{18,8},{19,1},{23,4},{24,10}] | L559: =R[-1]C -> [{7,27},{8,55},{9,27},{10,55},{11,27},{12,55},{17,18},{18,110},{19,3},{23,37},{24,37}] | M559: =R[-1]C -> [{0,1,[1,30]},{1,2,[11,40]},{2,5,[21,50]},{5,10,[31,60]},{10,20,[41,60]},{30,20,[51,70]},{50,10,[61,80]},{70,5,[71,80]},{100,2,[81,90]},{150,1,[91,100]}]
A560: 557 | B560: 3 | C560: 1 | D560: 0 | E560: =R[-9]C -> 71 | F560: =R[-9]C -> 80 | G560: 2 | H560: 10000 | I560: 110003 | J560: 2 | K560: =R[-1]C -> [{7,3},{8,3},{9,3},{10,3},{11,3},{12,3},{17,10},{18,8},{19,1},{23,4},{24,10}] | L560: =R[-1]C -> [{7,27},{8,55},{9,27},{10,55},{11,27},{12,55},{17,18},{18,110},{19,3},{23,37},{24,37}] | M560: =R[-1]C -> [{0,1,[1,30]},{1,2,[11,40]},{2,5,[21,50]},{5,10,[31,60]},{10,20,[41,60]},{30,20,[51,70]},{50,10,[61,80]},{70,5,[71,80]},{100,2,[81,90]},{150,1,[91,100]}]
A561: 558 | B561: 3 | C561: 1 | D561: 0 | E561: =R[-9]C -> 81 | F561: =R[-9]C -> 90 | G561: 2 | H561: 10000 | I561: 110003 | J561: 2 | K561: =R[-1]C -> [{7,3},{8,3},{9,3},{10,3},{11,3},{12,3},{17,10},{18,8},{19,1},{23,4},{24,10}] | L561: =R[-1]C -> [{7,27},{8,55},{9,27},{10,55},{11,27},{12,55},{17,18},{18,110},{19,3},{23,37},{24,37}] | M561: =R[-1]C -> [{0,1,[1,30]},{1,2,[11,40]},{2,5,[21,50]},{5,10,[31,60]},{10,20,[41,60]},{30,20,[51,70]},{50,10,[61,80]},{70,5,[71,80]},{100,2,[81,90]},{150,1,[91,100]}]
A562: 559 | B562: 4 | C562: 1 | D562: 0 | E562: =R[-9]C -> 1 | F562: =R[-9]C -> 10 | G562: 3 | H562: 15000 | I562: 110003 | J562: 3 | K562: =R[-1]C -> [{7,3},{8,3},{9,3},{10,3},{11,3},{12,3},{17,10},{18,8},{19,1},{23,4},{24,10}] | L562: =R[-1]C -> [{7,27},{8,55},{9,27},{10,55},{11,27},{12,55},{17,18},{18,110},{19,3},{23,37},{24,37}] | M562: =R[-1]C -> [{0,1,[1,30]},{1,2,[11,40]},{2,5,[21,50]},{5,10,[31,60]},{10,20,[41,60]},{30,20,[51,70]},{50,10,[61,80]},{70,5,[71,80]},{100,2,[81,90]},{150,1,[91,100]}]
A563: 560 | B563: 4 | C563: 1 | D563: 0 | E563: =R[-9]C -> 11 | F563: =R[-9]C -> 20 | G563: 3 | H563: 15000 | I563: 110003 | J563: 3 | K563: =R[-1]C -> [{7,3},{8,3},{9,3},{10,3},{11,3},{12,3},{17,10},{18,8},{19,1},{23,4},{24,10}] | L563: =R[-1]C -> [{7,27},{8,55},{9,27},{10,55},{11,27},{12,55},{17,18},{18,110},{19,3},{23,37},{24,37}] | M563: =R[-1]C -> [{0,1,[1,30]},{1,2,[11,40]},{2,5,[21,50]},{5,10,[31,60]},{10,20,[41,60]},{30,20,[51,70]},{50,10,[61,80]},{70,5,[71,80]},{100,2,[81,90]},{150,1,[91,100]}]
A564: 561 | B564: 4 | C564: 1 | D564: 0 | E564: =R[-9]C -> 21 | F564: =R[-9]C -> 30 | G564: 3 | H564: 15000 | I564: 110003 | J564: 3 | K564: =R[-1]C -> [{7,3},{8,3},{9,3},{10,3},{11,3},{12,3},{17,10},{18,8},{19,1},{23,4},{24,10}] | L564: =R[-1]C -> [{7,27},{8,55},{9,27},{10,55},{11,27},{12,55},{17,18},{18,110},{19,3},{23,37},{24,37}] | M564: =R[-1]C -> [{0,1,[1,30]},{1,2,[11,40]},{2,5,[21,50]},{5,10,[31,60]},{10,20,[41,60]},{30,20,[51,70]},{50,10,[61,80]},{70,5,[71,80]},{100,2,[81,90]},{150,1,[91,100]}]
A565: 562 | B565: 4 | C565: 1 | D565: 0 | E565: =R[-9]C -> 31 | F565: =R[-9]C -> 40 | G565: 3 | H565: 15000 | I565: 110003 | J565: 3 | K565: =R[-1]C -> [{7,3},{8,3},{9,3},{10,3},{11,3},{12,3},{17,10},{18,8},{19,1},{23,4},{24,10}] | L565: =R[-1]C -> [{7,27},{8,55},{9,27},{10,55},{11,27},{12,55},{17,18},{18,110},{19,3},{23,37},{24,37}] | M565: =R[-1]C -> [{0,1,[1,30]},{1,2,[11,40]},{2,5,[21,50]},{5,10,[31,60]},{10,20,[41,60]},{30,20,[51,70]},{50,10,[61,80]},{70,5,[71,80]},{100,2,[81,90]},{150,1,[91,100]}]
A566: 563 | B566: 4 | C566: 1 | D566: 0 | E566: =R[-9]C -> 41 | F566: =R[-9]C -> 50 | G566: 3 | H566: 15000 | I566: 110003 | J566: 3 | K566: =R[-1]C -> [{7,3},{8,3},{9,3},{10,3},{11,3},{12,3},{17,10},{18,8},{19,1},{23,4},{24,10}] | L566: =R[-1]C -> [{7,27},{8,55},{9,27},{10,55},{11,27},{12,55},{17,18},{18,110},{19,3},{23,37},{24,37}] | M566: =R[-1]C -> [{0,1,[1,30]},{1,2,[11,40]},{2,5,[21,50]},{5,10,[31,60]},{10,20,[41,60]},{30,20,[51,70]},{50,10,[61,80]},{70,5,[71,80]},{100,2,[81,90]},{150,1,[91,100]}]
A567: 564 | B567: 4 | C567: 1 | D567: 0 | E567: =R[-9]C -> 51 | F567: =R[-9]C -> 60 | G567: 3 | H567: 15000 | I567: 110003 | J567: 3 | K567: =R[-1]C -> [{7,3},{8,3},{9,3},{10,3},{11,3},{12,3},{17,10},{18,8},{19,1},{23,4},{24,10}] | L567: =R[-1]C -> [{7,27},{8,55},{9,27},{10,55},{11,27},{12,55},{17,18},{18,110},{19,3},{23,37},{24,37}] | M567: =R[-1]C -> [{0,1,[1,30]},{1,2,[11,40]},{2,5,[21,50]},{5,10,[31,60]},{10,20,[41,60]},{30,20,[51,70]},{50,10,[61,80]},{70,5,[71,80]},{100,2,[81,90]},{150,1,[91,100]}]
A568: 565 | B568: 4 | C568: 1 | D568: 0 | E568: =R[-9]C -> 61 | F568: =R[-9]C -> 70 | G568: 3 | H568: 15000 | I568: 110003 | J568: 3 | K568: =R[-1]C -> [{7,3},{8,3},{9,3},{10,3},{11,3},{12,3},{17,10},{18,8},{19,1},{23,4},{24,10}] | L568: =R[-1]C -> [{7,27},{8,55},{9,27},{10,55},{11,27},{12,55},{17,18},{18,110},{19,3},{23,37},{24,37}] | M568: =R[-1]C -> [{0,1,[1,30]},{1,2,[11,40]},{2,5,[21,50]},{5,10,[31,60]},{10,20,[41,60]},{30,20,[51,70]},{50,10,[61,80]},{70,5,[71,80]},{100,2,[81,90]},{150,1,[91,100]}]
A569: 566 | B569: 4 | C569: 1 | D569: 0 | E569: =R[-9]C -> 71 | F569: =R[-9]C -> 80 | G569: 3 | H569: 15000 | I569: 110003 | J569: 3 | K569: =R[-1]C -> [{7,3},{8,3},{9,3},{10,3},{11,3},{12,3},{17,10},{18,8},{19,1},{23,4},{24,10}] | L569: =R[-1]C -> [{7,27},{8,55},{9,27},{10,55},{11,27},{12,55},{17,18},{18,110},{19,3},{23,37},{24,37}] | M569: =R[-1]C -> [{0,1,[1,30]},{1,2,[11,40]},{2,5,[21,50]},{5,10,[31,60]},{10,20,[41,60]},{30,20,[51,70]},{50,10,[61,80]},{70,5,[71,80]},{100,2,[81,90]},{150,1,[91,100]}]
A570: 567 | B570: 4 | C570: 1 | D570: 0 | E570: =R[-9]C -> 81 | F570: =R[-9]C -> 90 | G570: 3 | H570: 15000 | I570: 110003 | J570: 3 | K570: =R[-1]C -> [{7,3},{8,3},{9,3},{10,3},{11,3},{12,3},{17,10},{18,8},{19,1},{23,4},{24,10}] | L570: =R[-1]C -> [{7,27},{8,55},{9,27},{10,55},{11,27},{12,55},{17,18},{18,110},{19,3},{23,37},{24,37}] | M570: =R[-1]C -> [{0,1,[1,30]},{1,2,[11,40]},{2,5,[21,50]},{5,10,[31,60]},{10,20,[41,60]},{30,20,[51,70]},{50,10,[61,80]},{70,5,[71,80]},{100,2,[81,90]},{150,1,[91,100]}]
A571: 568 | B571: 5 | C571: 1 | D571: 0 | E571: =R[-9]C -> 1 | F571: =R[-9]C -> 10 | G571: 4 | H571: 20000 | I571: 110003 | J571: 4 | K571: =R[-1]C -> [{7,3},{8,3},{9,3},{10,3},{11,3},{12,3},{17,10},{18,8},{19,1},{23,4},{24,10}] | L571: =R[-1]C -> [{7,27},{8,55},{9,27},{10,55},{11,27},{12,55},{17,18},{18,110},{19,3},{23,37},{24,37}] | M571: =R[-1]C -> [{0,1,[1,30]},{1,2,[11,40]},{2,5,[21,50]},{5,10,[31,60]},{10,20,[41,60]},{30,20,[51,70]},{50,10,[61,80]},{70,5,[71,80]},{100,2,[81,90]},{150,1,[91,100]}]
A572: 569 | B572: 5 | C572: 1 | D572: 0 | E572: =R[-9]C -> 11 | F572: =R[-9]C -> 20 | G572: 4 | H572: 20000 | I572: 110003 | J572: 4 | K572: =R[-1]C -> [{7,3},{8,3},{9,3},{10,3},{11,3},{12,3},{17,10},{18,8},{19,1},{23,4},{24,10}] | L572: =R[-1]C -> [{7,27},{8,55},{9,27},{10,55},{11,27},{12,55},{17,18},{18,110},{19,3},{23,37},{24,37}] | M572: =R[-1]C -> [{0,1,[1,30]},{1,2,[11,40]},{2,5,[21,50]},{5,10,[31,60]},{10,20,[41,60]},{30,20,[51,70]},{50,10,[61,80]},{70,5,[71,80]},{100,2,[81,90]},{150,1,[91,100]}]
A573: 570 | B573: 5 | C573: 1 | D573: 0 | E573: =R[-9]C -> 21 | F573: =R[-9]C -> 30 | G573: 4 | H573: 20000 | I573: 110003 | J573: 4 | K573: =R[-1]C -> [{7,3},{8,3},{9,3},{10,3},{11,3},{12,3},{17,10},{18,8},{19,1},{23,4},{24,10}] | L573: =R[-1]C -> [{7,27},{8,55},{9,27},{10,55},{11,27},{12,55},{17,18},{18,110},{19,3},{23,37},{24,37}] | M573: =R[-1]C -> [{0,1,[1,30]},{1,2,[11,40]},{2,5,[21,50]},{5,10,[31,60]},{10,20,[41,60]},{30,20,[51,70]},{50,10,[61,80]},{70,5,[71,80]},{100,2,[81,90]},{150,1,[91,100]}]
A574: 571 | B574: 5 | C574: 1 | D574: 0 | E574: =R[-9]C -> 31 | F574: =R[-9]C -> 40 | G574: 4 | H574: 20000 | I574: 110003 | J574: 4 | K574: =R[-1]C -> [{7,3},{8,3},{9,3},{10,3},{11,3},{12,3},{17,10},{18,8},{19,1},{23,4},{24,10}] | L574: =R[-1]C -> [{7,27},{8,55},{9,27},{10,55},{11,27},{12,55},{17,18},{18,110},{19,3},{23,37},{24,37}] | M574: =R[-1]C -> [{0,1,[1,30]},{1,2,[11,40]},{2,5,[21,50]},{5,10,[31,60]},{10,20,[41,60]},{30,20,[51,70]},{50,10,[61,80]},{70,5,[71,80]},{100,2,[81,90]},{150,1,[91,100]}]
A575: 572 | B575: 5 | C575: 1 | D575: 0 | E575: =R[-9]C -> 41 | F575: =R[-9]C -> 50 | G575: 4 | H575: 20000 | I575: 110003 | J575: 4 | K575: =R[-1]C -> [{7,3},{8,3},{9,3},{10,3},{11,3},{12,3},{17,10},{18,8},{19,1},{23,4},{24,10}] | L575: =R[-1]C -> [{7,27},{8,55},{9,27},{10,55},{11,27},{12,55},{17,18},{18,110},{19,3},{23,37},{24,37}] | M575: =R[-1]C -> [{0,1,[1,30]},{1,2,[11,40]},{2,5,[21,50]},{5,10,[31,60]},{10,20,[41,60]},{30,20,[51,70]},{50,10,[61,80]},{70,5,[71,80]},{100,2,[81,90]},{150,1,[91,100]}]
A576: 573 | B576: 5 | C576: 1 | D576: 0 | E576: =R[-9]C -> 51 | F576: =R[-9]C -> 60 | G576: 4 | H576: 20000 | I576: 110003 | J576: 4 | K576: =R[-1]C -> [{7,3},{8,3},{9,3},{10,3},{11,3},{12,3},{17,10},{18,8},{19,1},{23,4},{24,10}] | L576: =R[-1]C -> [{7,27},{8,55},{9,27},{10,55},{11,27},{12,55},{17,18},{18,110},{19,3},{23,37},{24,37}] | M576: =R[-1]C -> [{0,1,[1,30]},{1,2,[11,40]},{2,5,[21,50]},{5,10,[31,60]},{10,20,[41,60]},{30,20,[51,70]},{50,10,[61,80]},{70,5,[71,80]},{100,2,[81,90]},{150,1,[91,100]}]
A577: 574 | B577: 5 | C577: 1 | D577: 0 | E577: =R[-9]C -> 61 | F577: =R[-9]C -> 70 | G577: 4 | H577: 20000 | I577: 110003 | J577: 4 | K577: =R[-1]C -> [{7,3},{8,3},{9,3},{10,3},{11,3},{12,3},{17,10},{18,8},{19,1},{23,4},{24,10}] | L577: =R[-1]C -> [{7,27},{8,55},{9,27},{10,55},{11,27},{12,55},{17,18},{18,110},{19,3},{23,37},{24,37}] | M577: =R[-1]C -> [{0,1,[1,30]},{1,2,[11,40]},{2,5,[21,50]},{5,10,[31,60]},{10,20,[41,60]},{30,20,[51,70]},{50,10,[61,80]},{70,5,[71,80]},{100,2,[81,90]},{150,1,[91,100]}]
A578: 575 | B578: 5 | C578: 1 | D578: 0 | E578: =R[-9]C -> 71 | F578: =R[-9]C -> 80 | G578: 4 | H578: 20000 | I578: 110003 | J578: 4 | K578: =R[-1]C -> [{7,3},{8,3},{9,3},{10,3},{11,3},{12,3},{17,10},{18,8},{19,1},{23,4},{24,10}] | L578: =R[-1]C -> [{7,27},{8,55},{9,27},{10,55},{11,27},{12,55},{17,18},{18,110},{19,3},{23,37},{24,37}] | M578: =R[-1]C -> [{0,1,[1,30]},{1,2,[11,40]},{2,5,[21,50]},{5,10,[31,60]},{10,20,[41,60]},{30,20,[51,70]},{50,10,[61,80]},{70,5,[71,80]},{100,2,[81,90]},{150,1,[91,100]}]
A579: 576 | B579: 5 | C579: 1 | D579: 0 | E579: =R[-9]C -> 81 | F579: =R[-9]C -> 90 | G579: 4 | H579: 20000 | I579: 110003 | J579: 4 | K579: =R[-1]C -> [{7,3},{8,3},{9,3},{10,3},{11,3},{12,3},{17,10},{18,8},{19,1},{23,4},{24,10}] | L579: =R[-1]C -> [{7,27},{8,55},{9,27},{10,55},{11,27},{12,55},{17,18},{18,110},{19,3},{23,37},{24,37}] | M579: =R[-1]C -> [{0,1,[1,30]},{1,2,[11,40]},{2,5,[21,50]},{5,10,[31,60]},{10,20,[41,60]},{30,20,[51,70]},{50,10,[61,80]},{70,5,[71,80]},{100,2,[81,90]},{150,1,[91,100]}]
A580: 577 | B580: 6 | C580: 1 | D580: 0 | E580: =R[-9]C -> 1 | F580: =R[-9]C -> 10 | G580: 5 | H580: 20000 | I580: 110003 | J580: 5 | K580: =R[-1]C -> [{7,3},{8,3},{9,3},{10,3},{11,3},{12,3},{17,10},{18,8},{19,1},{23,4},{24,10}] | L580: =R[-1]C -> [{7,27},{8,55},{9,27},{10,55},{11,27},{12,55},{17,18},{18,110},{19,3},{23,37},{24,37}] | M580: =R[-1]C -> [{0,1,[1,30]},{1,2,[11,40]},{2,5,[21,50]},{5,10,[31,60]},{10,20,[41,60]},{30,20,[51,70]},{50,10,[61,80]},{70,5,[71,80]},{100,2,[81,90]},{150,1,[91,100]}]
A581: 578 | B581: 6 | C581: 1 | D581: 0 | E581: =R[-9]C -> 11 | F581: =R[-9]C -> 20 | G581: 5 | H581: 20000 | I581: 110003 | J581: 5 | K581: =R[-1]C -> [{7,3},{8,3},{9,3},{10,3},{11,3},{12,3},{17,10},{18,8},{19,1},{23,4},{24,10}] | L581: =R[-1]C -> [{7,27},{8,55},{9,27},{10,55},{11,27},{12,55},{17,18},{18,110},{19,3},{23,37},{24,37}] | M581: =R[-1]C -> [{0,1,[1,30]},{1,2,[11,40]},{2,5,[21,50]},{5,10,[31,60]},{10,20,[41,60]},{30,20,[51,70]},{50,10,[61,80]},{70,5,[71,80]},{100,2,[81,90]},{150,1,[91,100]}]
A582: 579 | B582: 6 | C582: 1 | D582: 0 | E582: =R[-9]C -> 21 | F582: =R[-9]C -> 30 | G582: 5 | H582: 20000 | I582: 110003 | J582: 5 | K582: =R[-1]C -> [{7,3},{8,3},{9,3},{10,3},{11,3},{12,3},{17,10},{18,8},{19,1},{23,4},{24,10}] | L582: =R[-1]C -> [{7,27},{8,55},{9,27},{10,55},{11,27},{12,55},{17,18},{18,110},{19,3},{23,37},{24,37}] | M582: =R[-1]C -> [{0,1,[1,30]},{1,2,[11,40]},{2,5,[21,50]},{5,10,[31,60]},{10,20,[41,60]},{30,20,[51,70]},{50,10,[61,80]},{70,5,[71,80]},{100,2,[81,90]},{150,1,[91,100]}]
A583: 580 | B583: 6 | C583: 1 | D583: 0 | E583: =R[-9]C -> 31 | F583: =R[-9]C -> 40 | G583: 5 | H583: 20000 | I583: 110003 | J583: 5 | K583: =R[-1]C -> [{7,3},{8,3},{9,3},{10,3},{11,3},{12,3},{17,10},{18,8},{19,1},{23,4},{24,10}] | L583: =R[-1]C -> [{7,27},{8,55},{9,27},{10,55},{11,27},{12,55},{17,18},{18,110},{19,3},{23,37},{24,37}] | M583: =R[-1]C -> [{0,1,[1,30]},{1,2,[11,40]},{2,5,[21,50]},{5,10,[31,60]},{10,20,[41,60]},{30,20,[51,70]},{50,10,[61,80]},{70,5,[71,80]},{100,2,[81,90]},{150,1,[91,100]}]
A584: 581 | B584: 6 | C584: 1 | D584: 0 | E584: =R[-9]C -> 41 | F584: =R[-9]C -> 50 | G584: 5 | H584: 20000 | I584: 110003 | J584: 5 | K584: =R[-1]C -> [{7,3},{8,3},{9,3},{10,3},{11,3},{12,3},{17,10},{18,8},{19,1},{23,4},{24,10}] | L584: =R[-1]C -> [{7,27},{8,55},{9,27},{10,55},{11,27},{12,55},{17,18},{18,110},{19,3},{23,37},{24,37}] | M584: =R[-1]C -> [{0,1,[1,30]},{1,2,[11,40]},{2,5,[21,50]},{5,10,[31,60]},{10,20,[41,60]},{30,20,[51,70]},{50,10,[61,80]},{70,5,[71,80]},{100,2,[81,90]},{150,1,[91,100]}]
A585: 582 | B585: 6 | C585: 1 | D585: 0 | E585: =R[-9]C -> 51 | F585: =R[-9]C -> 60 | G585: 5 | H585: 20000 | I585: 110003 | J585: 5 | K585: =R[-1]C -> [{7,3},{8,3},{9,3},{10,3},{11,3},{12,3},{17,10},{18,8},{19,1},{23,4},{24,10}] | L585: =R[-1]C -> [{7,27},{8,55},{9,27},{10,55},{11,27},{12,55},{17,18},{18,110},{19,3},{23,37},{24,37}] | M585: =R[-1]C -> [{0,1,[1,30]},{1,2,[11,40]},{2,5,[21,50]},{5,10,[31,60]},{10,20,[41,60]},{30,20,[51,70]},{50,10,[61,80]},{70,5,[71,80]},{100,2,[81,90]},{150,1,[91,100]}]
A586: 583 | B586: 6 | C586: 1 | D586: 0 | E586: =R[-9]C -> 61 | F586: =R[-9]C -> 70 | G586: 5 | H586: 20000 | I586: 110003 | J586: 5 | K586: =R[-1]C -> [{7,3},{8,3},{9,3},{10,3},{11,3},{12,3},{17,10},{18,8},{19,1},{23,4},{24,10}] | L586: =R[-1]C -> [{7,27},{8,55},{9,27},{10,55},{11,27},{12,55},{17,18},{18,110},{19,3},{23,37},{24,37}] | M586: =R[-1]C -> [{0,1,[1,30]},{1,2,[11,40]},{2,5,[21,50]},{5,10,[31,60]},{10,20,[41,60]},{30,20,[51,70]},{50,10,[61,80]},{70,5,[71,80]},{100,2,[81,90]},{150,1,[91,100]}]
A587: 584 | B587: 6 | C587: 1 | D587: 0 | E587: =R[-9]C -> 71 | F587: =R[-9]C -> 80 | G587: 5 | H587: 20000 | I587: 110003 | J587: 5 | K587: =R[-1]C -> [{7,3},{8,3},{9,3},{10,3},{11,3},{12,3},{17,10},{18,8},{19,1},{23,4},{24,10}] | L587: =R[-1]C -> [{7,27},{8,55},{9,27},{10,55},{11,27},{12,55},{17,18},{18,110},{19,3},{23,37},{24,37}] | M587: =R[-1]C -> [{0,1,[1,30]},{1,2,[11,40]},{2,5,[21,50]},{5,10,[31,60]},{10,20,[41,60]},{30,20,[51,70]},{50,10,[61,80]},{70,5,[71,80]},{100,2,[81,90]},{150,1,[91,100]}]
A588: 585 | B588: 6 | C588: 1 | D588: 0 | E588: =R[-9]C -> 81 | F588: =R[-9]C -> 90 | G588: 5 | H588: 20000 | I588: 110003 | J588: 5 | K588: =R[-1]C -> [{7,3},{8,3},{9,3},{10,3},{11,3},{12,3},{17,10},{18,8},{19,1},{23,4},{24,10}] | L588: =R[-1]C -> [{7,27},{8,55},{9,27},{10,55},{11,27},{12,55},{17,18},{18,110},{19,3},{23,37},{24,37}] | M588: =R[-1]C -> [{0,1,[1,30]},{1,2,[11,40]},{2,5,[21,50]},{5,10,[31,60]},{10,20,[41,60]},{30,20,[51,70]},{50,10,[61,80]},{70,5,[71,80]},{100,2,[81,90]},{150,1,[91,100]}]
A589: 586 | B589: 2 | C589: 4 | D589: 0 | E589: =R[-18]C -> 1 | F589: =R[-18]C -> 10 | G589: 1 | H589: 5000 | I589: 110003 | J589: 1 | K589: =R[-1]C -> [{7,3},{8,3},{9,3},{10,3},{11,3},{12,3},{17,10},{18,8},{19,1},{23,4},{24,10}] | L589: =R[-1]C -> [{7,27},{8,55},{9,27},{10,55},{11,27},{12,55},{17,18},{18,110},{19,3},{23,37},{24,37}] | M589: =R[-1]C -> [{0,1,[1,30]},{1,2,[11,40]},{2,5,[21,50]},{5,10,[31,60]},{10,20,[41,60]},{30,20,[51,70]},{50,10,[61,80]},{70,5,[71,80]},{100,2,[81,90]},{150,1,[91,100]}]
A590: 587 | B590: 2 | C590: 4 | D590: 0 | E590: =R[-18]C -> 11 | F590: =R[-18]C -> 20 | G590: 1 | H590: 5000 | I590: 110003 | J590: 1 | K590: =R[-1]C -> [{7,3},{8,3},{9,3},{10,3},{11,3},{12,3},{17,10},{18,8},{19,1},{23,4},{24,10}] | L590: =R[-1]C -> [{7,27},{8,55},{9,27},{10,55},{11,27},{12,55},{17,18},{18,110},{19,3},{23,37},{24,37}] | M590: =R[-1]C -> [{0,1,[1,30]},{1,2,[11,40]},{2,5,[21,50]},{5,10,[31,60]},{10,20,[41,60]},{30,20,[51,70]},{50,10,[61,80]},{70,5,[71,80]},{100,2,[81,90]},{150,1,[91,100]}]
A591: 588 | B591: 2 | C591: 4 | D591: 0 | E591: =R[-18]C -> 21 | F591: =R[-18]C -> 30 | G591: 1 | H591: 5000 | I591: 110003 | J591: 1 | K591: =R[-1]C -> [{7,3},{8,3},{9,3},{10,3},{11,3},{12,3},{17,10},{18,8},{19,1},{23,4},{24,10}] | L591: =R[-1]C -> [{7,27},{8,55},{9,27},{10,55},{11,27},{12,55},{17,18},{18,110},{19,3},{23,37},{24,37}] | M591: =R[-1]C -> [{0,1,[1,30]},{1,2,[11,40]},{2,5,[21,50]},{5,10,[31,60]},{10,20,[41,60]},{30,20,[51,70]},{50,10,[61,80]},{70,5,[71,80]},{100,2,[81,90]},{150,1,[91,100]}]
A592: 589 | B592: 2 | C592: 4 | D592: 0 | E592: =R[-18]C -> 31 | F592: =R[-18]C -> 40 | G592: 1 | H592: 5000 | I592: 110003 | J592: 1 | K592: =R[-1]C -> [{7,3},{8,3},{9,3},{10,3},{11,3},{12,3},{17,10},{18,8},{19,1},{23,4},{24,10}] | L592: =R[-1]C -> [{7,27},{8,55},{9,27},{10,55},{11,27},{12,55},{17,18},{18,110},{19,3},{23,37},{24,37}] | M592: =R[-1]C -> [{0,1,[1,30]},{1,2,[11,40]},{2,5,[21,50]},{5,10,[31,60]},{10,20,[41,60]},{30,20,[51,70]},{50,10,[61,80]},{70,5,[71,80]},{100,2,[81,90]},{150,1,[91,100]}]
A593: 590 | B593: 2 | C593: 4 | D593: 0 | E593: =R[-18]C -> 41 | F593: =R[-18]C -> 50 | G593: 1 | H593: 5000 | I593: 110003 | J593: 1 | K593: =R[-1]C -> [{7,3},{8,3},{9,3},{10,3},{11,3},{12,3},{17,10},{18,8},{19,1},{23,4},{24,10}] | L593: =R[-1]C -> [{7,27},{8,55},{9,27},{10,55},{11,27},{12,55},{17,18},{18,110},{19,3},{23,37},{24,37}] | M593: =R[-1]C -> [{0,1,[1,30]},{1,2,[11,40]},{2,5,[21,50]},{5,10,[31,60]},{10,20,[41,60]},{30,20,[51,70]},{50,10,[61,80]},{70,5,[71,80]},{100,2,[81,90]},{150,1,[91,100]}]
A594: 591 | B594: 2 | C594: 4 | D594: 0 | E594: =R[-18]C -> 51 | F594: =R[-18]C -> 60 | G594: 1 | H594: 5000 | I594: 110003 | J594: 1 | K594: =R[-1]C -> [{7,3},{8,3},{9,3},{10,3},{11,3},{12,3},{17,10},{18,8},{19,1},{23,4},{24,10}] | L594: =R[-1]C -> [{7,27},{8,55},{9,27},{10,55},{11,27},{12,55},{17,18},{18,110},{19,3},{23,37},{24,37}] | M594: =R[-1]C -> [{0,1,[1,30]},{1,2,[11,40]},{2,5,[21,50]},{5,10,[31,60]},{10,20,[41,60]},{30,20,[51,70]},{50,10,[61,80]},{70,5,[71,80]},{100,2,[81,90]},{150,1,[91,100]}]
A595: 592 | B595: 2 | C595: 4 | D595: 0 | E595: =R[-18]C -> 61 | F595: =R[-18]C -> 70 | G595: 1 | H595: 5000 | I595: 110003 | J595: 1 | K595: =R[-1]C -> [{7,3},{8,3},{9,3},{10,3},{11,3},{12,3},{17,10},{18,8},{19,1},{23,4},{24,10}] | L595: =R[-1]C -> [{7,27},{8,55},{9,27},{10,55},{11,27},{12,55},{17,18},{18,110},{19,3},{23,37},{24,37}] | M595: =R[-1]C -> [{0,1,[1,30]},{1,2,[11,40]},{2,5,[21,50]},{5,10,[31,60]},{10,20,[41,60]},{30,20,[51,70]},{50,10,[61,80]},{70,5,[71,80]},{100,2,[81,90]},{150,1,[91,100]}]
A596: 593 | B596: 2 | C596: 4 | D596: 0 | E596: =R[-18]C -> 71 | F596: =R[-18]C -> 80 | G596: 1 | H596: 5000 | I596: 110003 | J596: 1 | K596: =R[-1]C -> [{7,3},{8,3},{9,3},{10,3},{11,3},{12,3},{17,10},{18,8},{19,1},{23,4},{24,10}] | L596: =R[-1]C -> [{7,27},{8,55},{9,27},{10,55},{11,27},{12,55},{17,18},{18,110},{19,3},{23,37},{24,37}] | M596: =R[-1]C -> [{0,1,[1,30]},{1,2,[11,40]},{2,5,[21,50]},{5,10,[31,60]},{10,20,[41,60]},{30,20,[51,70]},{50,10,[61,80]},{70,5,[71,80]},{100,2,[81,90]},{150,1,[91,100]}]
A597: 594 | B597: 2 | C597: 4 | D597: 0 | E597: =R[-18]C -> 81 | F597: =R[-18]C -> 90 | G597: 1 | H597: 5000 | I597: 110003 | J597: 1 | K597: =R[-1]C -> [{7,3},{8,3},{9,3},{10,3},{11,3},{12,3},{17,10},{18,8},{19,1},{23,4},{24,10}] | L597: =R[-1]C -> [{7,27},{8,55},{9,27},{10,55},{11,27},{12,55},{17,18},{18,110},{19,3},{23,37},{24,37}] | M597: =R[-1]C -> [{0,1,[1,30]},{1,2,[11,40]},{2,5,[21,50]},{5,10,[31,60]},{10,20,[41,60]},{30,20,[51,70]},{50,10,[61,80]},{70,5,[71,80]},{100,2,[81,90]},{150,1,[91,100]}]
A598: 595 | B598: 3 | C598: 4 | D598: 0 | E598: =R[-9]C -> 1 | F598: =R[-9]C -> 10 | G598: 2 | H598: 10000 | I598: 110003 | J598: 2 | K598: =R[-1]C -> [{7,3},{8,3},{9,3},{10,3},{11,3},{12,3},{17,10},{18,8},{19,1},{23,4},{24,10}] | L598: =R[-1]C -> [{7,27},{8,55},{9,27},{10,55},{11,27},{12,55},{17,18},{18,110},{19,3},{23,37},{24,37}] | M598: =R[-1]C -> [{0,1,[1,30]},{1,2,[11,40]},{2,5,[21,50]},{5,10,[31,60]},{10,20,[41,60]},{30,20,[51,70]},{50,10,[61,80]},{70,5,[71,80]},{100,2,[81,90]},{150,1,[91,100]}]
A599: 596 | B599: 3 | C599: 4 | D599: 0 | E599: =R[-9]C -> 11 | F599: =R[-9]C -> 20 | G599: 2 | H599: 10000 | I599: 110003 | J599: 2 | K599: =R[-1]C -> [{7,3},{8,3},{9,3},{10,3},{11,3},{12,3},{17,10},{18,8},{19,1},{23,4},{24,10}] | L599: =R[-1]C -> [{7,27},{8,55},{9,27},{10,55},{11,27},{12,55},{17,18},{18,110},{19,3},{23,37},{24,37}] | M599: =R[-1]C -> [{0,1,[1,30]},{1,2,[11,40]},{2,5,[21,50]},{5,10,[31,60]},{10,20,[41,60]},{30,20,[51,70]},{50,10,[61,80]},{70,5,[71,80]},{100,2,[81,90]},{150,1,[91,100]}]
A600: 597 | B600: 3 | C600: 4 | D600: 0 | E600: =R[-9]C -> 21 | F600: =R[-9]C -> 30 | G600: 2 | H600: 10000 | I600: 110003 | J600: 2 | K600: =R[-1]C -> [{7,3},{8,3},{9,3},{10,3},{11,3},{12,3},{17,10},{18,8},{19,1},{23,4},{24,10}] | L600: =R[-1]C -> [{7,27},{8,55},{9,27},{10,55},{11,27},{12,55},{17,18},{18,110},{19,3},{23,37},{24,37}] | M600: =R[-1]C -> [{0,1,[1,30]},{1,2,[11,40]},{2,5,[21,50]},{5,10,[31,60]},{10,20,[41,60]},{30,20,[51,70]},{50,10,[61,80]},{70,5,[71,80]},{100,2,[81,90]},{150,1,[91,100]}]
A601: 598 | B601: 3 | C601: 4 | D601: 0 | E601: =R[-9]C -> 31 | F601: =R[-9]C -> 40 | G601: 2 | H601: 10000 | I601: 110003 | J601: 2 | K601: =R[-1]C -> [{7,3},{8,3},{9,3},{10,3},{11,3},{12,3},{17,10},{18,8},{19,1},{23,4},{24,10}] | L601: =R[-1]C -> [{7,27},{8,55},{9,27},{10,55},{11,27},{12,55},{17,18},{18,110},{19,3},{23,37},{24,37}] | M601: =R[-1]C -> [{0,1,[1,30]},{1,2,[11,40]},{2,5,[21,50]},{5,10,[31,60]},{10,20,[41,60]},{30,20,[51,70]},{50,10,[61,80]},{70,5,[71,80]},{100,2,[81,90]},{150,1,[91,100]}]
A602: 599 | B602: 3 | C602: 4 | D602: 0 | E602: =R[-9]C -> 41 | F602: =R[-9]C -> 50 | G602: 2 | H602: 10000 | I602: 110003 | J602: 2 | K602: =R[-1]C -> [{7,3},{8,3},{9,3},{10,3},{11,3},{12,3},{17,10},{18,8},{19,1},{23,4},{24,10}] | L602: =R[-1]C -> [{7,27},{8,55},{9,27},{10,55},{11,27},{12,55},{17,18},{18,110},{19,3},{23,37},{24,37}] | M602: =R[-1]C -> [{0,1,[1,30]},{1,2,[11,40]},{2,5,[21,50]},{5,10,[31,60]},{10,20,[41,60]},{30,20,[51,70]},{50,10,[61,80]},{70,5,[71,80]},{100,2,[81,90]},{150,1,[91,100]}]
A603: 600 | B603: 3 | C603: 4 | D603: 0 | E603: =R[-9]C -> 51 | F603: =R[-9]C -> 60 | G603: 2 | H603: 10000 | I603: 110003 | J603: 2 | K603: =R[-1]C -> [{7,3},{8,3},{9,3},{10,3},{11,3},{12,3},{17,10},{18,8},{19,1},{23,4},{24,10}] | L603: =R[-1]C -> [{7,27},{8,55},{9,27},{10,55},{11,27},{12,55},{17,18},{18,110},{19,3},{23,37},{24,37}] | M603: =R[-1]C -> [{0,1,[1,30]},{1,2,[11,40]},{2,5,[21,50]},{5,10,[31,60]},{10,20,[41,60]},{30,20,[51,70]},{50,10,[61,80]},{70,5,[71,80]},{100,2,[81,90]},{150,1,[91,100]}]
A604: 601 | B604: 3 | C604: 4 | D604: 0 | E604: =R[-9]C -> 61 | F604: =R[-9]C -> 70 | G604: 2 | H604: 10000 | I604: 110003 | J604: 2 | K604: =R[-1]C -> [{7,3},{8,3},{9,3},{10,3},{11,3},{12,3},{17,10},{18,8},{19,1},{23,4},{24,10}] | L604: =R[-1]C -> [{7,27},{8,55},{9,27},{10,55},{11,27},{12,55},{17,18},{18,110},{19,3},{23,37},{24,37}] | M604: =R[-1]C -> [{0,1,[1,30]},{1,2,[11,40]},{2,5,[21,50]},{5,10,[31,60]},{10,20,[41,60]},{30,20,[51,70]},{50,10,[61,80]},{70,5,[71,80]},{100,2,[81,90]},{150,1,[91,100]}]
A605: 602 | B605: 3 | C605: 4 | D605: 0 | E605: =R[-9]C -> 71 | F605: =R[-9]C -> 80 | G605: 2 | H605: 10000 | I605: 110003 | J605: 2 | K605: =R[-1]C -> [{7,3},{8,3},{9,3},{10,3},{11,3},{12,3},{17,10},{18,8},{19,1},{23,4},{24,10}] | L605: =R[-1]C -> [{7,27},{8,55},{9,27},{10,55},{11,27},{12,55},{17,18},{18,110},{19,3},{23,37},{24,37}] | M605: =R[-1]C -> [{0,1,[1,30]},{1,2,[11,40]},{2,5,[21,50]},{5,10,[31,60]},{10,20,[41,60]},{30,20,[51,70]},{50,10,[61,80]},{70,5,[71,80]},{100,2,[81,90]},{150,1,[91,100]}]
A606: 603 | B606: 3 | C606: 4 | D606: 0 | E606: =R[-9]C -> 81 | F606: =R[-9]C -> 90 | G606: 2 | H606: 10000 | I606: 110003 | J606: 2 | K606: =R[-1]C -> [{7,3},{8,3},{9,3},{10,3},{11,3},{12,3},{17,10},{18,8},{19,1},{23,4},{24,10}] | L606: =R[-1]C -> [{7,27},{8,55},{9,27},{10,55},{11,27},{12,55},{17,18},{18,110},{19,3},{23,37},{24,37}] | M606: =R[-1]C -> [{0,1,[1,30]},{1,2,[11,40]},{2,5,[21,50]},{5,10,[31,60]},{10,20,[41,60]},{30,20,[51,70]},{50,10,[61,80]},{70,5,[71,80]},{100,2,[81,90]},{150,1,[91,100]}]
A607: 604 | B607: 4 | C607: 4 | D607: 0 | E607: =R[-9]C -> 1 | F607: =R[-9]C -> 10 | G607: 3 | H607: 15000 | I607: 110003 | J607: 3 | K607: =R[-1]C -> [{7,3},{8,3},{9,3},{10,3},{11,3},{12,3},{17,10},{18,8},{19,1},{23,4},{24,10}] | L607: =R[-1]C -> [{7,27},{8,55},{9,27},{10,55},{11,27},{12,55},{17,18},{18,110},{19,3},{23,37},{24,37}] | M607: =R[-1]C -> [{0,1,[1,30]},{1,2,[11,40]},{2,5,[21,50]},{5,10,[31,60]},{10,20,[41,60]},{30,20,[51,70]},{50,10,[61,80]},{70,5,[71,80]},{100,2,[81,90]},{150,1,[91,100]}]
A608: 605 | B608: 4 | C608: 4 | D608: 0 | E608: =R[-9]C -> 11 | F608: =R[-9]C -> 20 | G608: 3 | H608: 15000 | I608: 110003 | J608: 3 | K608: =R[-1]C -> [{7,3},{8,3},{9,3},{10,3},{11,3},{12,3},{17,10},{18,8},{19,1},{23,4},{24,10}] | L608: =R[-1]C -> [{7,27},{8,55},{9,27},{10,55},{11,27},{12,55},{17,18},{18,110},{19,3},{23,37},{24,37}] | M608: =R[-1]C -> [{0,1,[1,30]},{1,2,[11,40]},{2,5,[21,50]},{5,10,[31,60]},{10,20,[41,60]},{30,20,[51,70]},{50,10,[61,80]},{70,5,[71,80]},{100,2,[81,90]},{150,1,[91,100]}]
A609: 606 | B609: 4 | C609: 4 | D609: 0 | E609: =R[-9]C -> 21 | F609: =R[-9]C -> 30 | G609: 3 | H609: 15000 | I609: 110003 | J609: 3 | K609: =R[-1]C -> [{7,3},{8,3},{9,3},{10,3},{11,3},{12,3},{17,10},{18,8},{19,1},{23,4},{24,10}] | L609: =R[-1]C -> [{7,27},{8,55},{9,27},{10,55},{11,27},{12,55},{17,18},{18,110},{19,3},{23,37},{24,37}] | M609: =R[-1]C -> [{0,1,[1,30]},{1,2,[11,40]},{2,5,[21,50]},{5,10,[31,60]},{10,20,[41,60]},{30,20,[51,70]},{50,10,[61,80]},{70,5,[71,80]},{100,2,[81,90]},{150,1,[91,100]}]
A610: 607 | B610: 4 | C610: 4 | D610: 0 | E610: =R[-9]C -> 31 | F610: =R[-9]C -> 40 | G610: 3 | H610: 15000 | I610: 110003 | J610: 3 | K610: =R[-1]C -> [{7,3},{8,3},{9,3},{10,3},{11,3},{12,3},{17,10},{18,8},{19,1},{23,4},{24,10}] | L610: =R[-1]C -> [{7,27},{8,55},{9,27},{10,55},{11,27},{12,55},{17,18},{18,110},{19,3},{23,37},{24,37}] | M610: =R[-1]C -> [{0,1,[1,30]},{1,2,[11,40]},{2,5,[21,50]},{5,10,[31,60]},{10,20,[41,60]},{30,20,[51,70]},{50,10,[61,80]},{70,5,[71,80]},{100,2,[81,90]},{150,1,[91,100]}]
A611: 608 | B611: 4 | C611: 4 | D611: 0 | E611: =R[-9]C -> 41 | F611: =R[-9]C -> 50 | G611: 3 | H611: 15000 | I611: 110003 | J611: 3 | K611: =R[-1]C -> [{7,3},{8,3},{9,3},{10,3},{11,3},{12,3},{17,10},{18,8},{19,1},{23,4},{24,10}] | L611: =R[-1]C -> [{7,27},{8,55},{9,27},{10,55},{11,27},{12,55},{17,18},{18,110},{19,3},{23,37},{24,37}] | M611: =R[-1]C -> [{0,1,[1,30]},{1,2,[11,40]},{2,5,[21,50]},{5,10,[31,60]},{10,20,[41,60]},{30,20,[51,70]},{50,10,[61,80]},{70,5,[71,80]},{100,2,[81,90]},{150,1,[91,100]}]
A612: 609 | B612: 4 | C612: 4 | D612: 0 | E612: =R[-9]C -> 51 | F612: =R[-9]C -> 60 | G612: 3 | H612: 15000 | I612: 110003 | J612: 3 | K612: =R[-1]C -> [{7,3},{8,3},{9,3},{10,3},{11,3},{12,3},{17,10},{18,8},{19,1},{23,4},{24,10}] | L612: =R[-1]C -> [{7,27},{8,55},{9,27},{10,55},{11,27},{12,55},{17,18},{18,110},{19,3},{23,37},{24,37}] | M612: =R[-1]C -> [{0,1,[1,30]},{1,2,[11,40]},{2,5,[21,50]},{5,10,[31,60]},{10,20,[41,60]},{30,20,[51,70]},{50,10,[61,80]},{70,5,[71,80]},{100,2,[81,90]},{150,1,[91,100]}]
A613: 610 | B613: 4 | C613: 4 | D613: 0 | E613: =R[-9]C -> 61 | F613: =R[-9]C -> 70 | G613: 3 | H613: 15000 | I613: 110003 | J613: 3 | K613: =R[-1]C -> [{7,3},{8,3},{9,3},{10,3},{11,3},{12,3},{17,10},{18,8},{19,1},{23,4},{24,10}] | L613: =R[-1]C -> [{7,27},{8,55},{9,27},{10,55},{11,27},{12,55},{17,18},{18,110},{19,3},{23,37},{24,37}] | M613: =R[-1]C -> [{0,1,[1,30]},{1,2,[11,40]},{2,5,[21,50]},{5,10,[31,60]},{10,20,[41,60]},{30,20,[51,70]},{50,10,[61,80]},{70,5,[71,80]},{100,2,[81,90]},{150,1,[91,100]}]
A614: 611 | B614: 4 | C614: 4 | D614: 0 | E614: =R[-9]C -> 71 | F614: =R[-9]C -> 80 | G614: 3 | H614: 15000 | I614: 110003 | J614: 3 | K614: =R[-1]C -> [{7,3},{8,3},{9,3},{10,3},{11,3},{12,3},{17,10},{18,8},{19,1},{23,4},{24,10}] | L614: =R[-1]C -> [{7,27},{8,55},{9,27},{10,55},{11,27},{12,55},{17,18},{18,110},{19,3},{23,37},{24,37}] | M614: =R[-1]C -> [{0,1,[1,30]},{1,2,[11,40]},{2,5,[21,50]},{5,10,[31,60]},{10,20,[41,60]},{30,20,[51,70]},{50,10,[61,80]},{70,5,[71,80]},{100,2,[81,90]},{150,1,[91,100]}]
A615: 612 | B615: 4 | C615: 4 | D615: 0 | E615: =R[-9]C -> 81 | F615: =R[-9]C -> 90 | G615: 3 | H615: 15000 | I615: 110003 | J615: 3 | K615: =R[-1]C -> [{7,3},{8,3},{9,3},{10,3},{11,3},{12,3},{17,10},{18,8},{19,1},{23,4},{24,10}] | L615: =R[-1]C -> [{7,27},{8,55},{9,27},{10,55},{11,27},{12,55},{17,18},{18,110},{19,3},{23,37},{24,37}] | M615: =R[-1]C -> [{0,1,[1,30]},{1,2,[11,40]},{2,5,[21,50]},{5,10,[31,60]},{10,20,[41,60]},{30,20,[51,70]},{50,10,[61,80]},{70,5,[71,80]},{100,2,[81,90]},{150,1,[91,100]}]
A616: 613 | B616: 5 | C616: 4 | D616: 0 | E616: =R[-9]C -> 1 | F616: =R[-9]C -> 10 | G616: 4 | H616: 20000 | I616: 110003 | J616: 4 | K616: =R[-1]C -> [{7,3},{8,3},{9,3},{10,3},{11,3},{12,3},{17,10},{18,8},{19,1},{23,4},{24,10}] | L616: =R[-1]C -> [{7,27},{8,55},{9,27},{10,55},{11,27},{12,55},{17,18},{18,110},{19,3},{23,37},{24,37}] | M616: =R[-1]C -> [{0,1,[1,30]},{1,2,[11,40]},{2,5,[21,50]},{5,10,[31,60]},{10,20,[41,60]},{30,20,[51,70]},{50,10,[61,80]},{70,5,[71,80]},{100,2,[81,90]},{150,1,[91,100]}]
A617: 614 | B617: 5 | C617: 4 | D617: 0 | E617: =R[-9]C -> 11 | F617: =R[-9]C -> 20 | G617: 4 | H617: 20000 | I617: 110003 | J617: 4 | K617: =R[-1]C -> [{7,3},{8,3},{9,3},{10,3},{11,3},{12,3},{17,10},{18,8},{19,1},{23,4},{24,10}] | L617: =R[-1]C -> [{7,27},{8,55},{9,27},{10,55},{11,27},{12,55},{17,18},{18,110},{19,3},{23,37},{24,37}] | M617: =R[-1]C -> [{0,1,[1,30]},{1,2,[11,40]},{2,5,[21,50]},{5,10,[31,60]},{10,20,[41,60]},{30,20,[51,70]},{50,10,[61,80]},{70,5,[71,80]},{100,2,[81,90]},{150,1,[91,100]}]
A618: 615 | B618: 5 | C618: 4 | D618: 0 | E618: =R[-9]C -> 21 | F618: =R[-9]C -> 30 | G618: 4 | H618: 20000 | I618: 110003 | J618: 4 | K618: =R[-1]C -> [{7,3},{8,3},{9,3},{10,3},{11,3},{12,3},{17,10},{18,8},{19,1},{23,4},{24,10}] | L618: =R[-1]C -> [{7,27},{8,55},{9,27},{10,55},{11,27},{12,55},{17,18},{18,110},{19,3},{23,37},{24,37}] | M618: =R[-1]C -> [{0,1,[1,30]},{1,2,[11,40]},{2,5,[21,50]},{5,10,[31,60]},{10,20,[41,60]},{30,20,[51,70]},{50,10,[61,80]},{70,5,[71,80]},{100,2,[81,90]},{150,1,[91,100]}]
A619: 616 | B619: 5 | C619: 4 | D619: 0 | E619: =R[-9]C -> 31 | F619: =R[-9]C -> 40 | G619: 4 | H619: 20000 | I619: 110003 | J619: 4 | K619: =R[-1]C -> [{7,3},{8,3},{9,3},{10,3},{11,3},{12,3},{17,10},{18,8},{19,1},{23,4},{24,10}] | L619: =R[-1]C -> [{7,27},{8,55},{9,27},{10,55},{11,27},{12,55},{17,18},{18,110},{19,3},{23,37},{24,37}] | M619: =R[-1]C -> [{0,1,[1,30]},{1,2,[11,40]},{2,5,[21,50]},{5,10,[31,60]},{10,20,[41,60]},{30,20,[51,70]},{50,10,[61,80]},{70,5,[71,80]},{100,2,[81,90]},{150,1,[91,100]}]
A620: 617 | B620: 5 | C620: 4 | D620: 0 | E620: =R[-9]C -> 41 | F620: =R[-9]C -> 50 | G620: 4 | H620: 20000 | I620: 110003 | J620: 4 | K620: =R[-1]C -> [{7,3},{8,3},{9,3},{10,3},{11,3},{12,3},{17,10},{18,8},{19,1},{23,4},{24,10}] | L620: =R[-1]C -> [{7,27},{8,55},{9,27},{10,55},{11,27},{12,55},{17,18},{18,110},{19,3},{23,37},{24,37}] | M620: =R[-1]C -> [{0,1,[1,30]},{1,2,[11,40]},{2,5,[21,50]},{5,10,[31,60]},{10,20,[41,60]},{30,20,[51,70]},{50,10,[61,80]},{70,5,[71,80]},{100,2,[81,90]},{150,1,[91,100]}]
A621: 618 | B621: 5 | C621: 4 | D621: 0 | E621: =R[-9]C -> 51 | F621: =R[-9]C -> 60 | G621: 4 | H621: 20000 | I621: 110003 | J621: 4 | K621: =R[-1]C -> [{7,3},{8,3},{9,3},{10,3},{11,3},{12,3},{17,10},{18,8},{19,1},{23,4},{24,10}] | L621: =R[-1]C -> [{7,27},{8,55},{9,27},{10,55},{11,27},{12,55},{17,18},{18,110},{19,3},{23,37},{24,37}] | M621: =R[-1]C -> [{0,1,[1,30]},{1,2,[11,40]},{2,5,[21,50]},{5,10,[31,60]},{10,20,[41,60]},{30,20,[51,70]},{50,10,[61,80]},{70,5,[71,80]},{100,2,[81,90]},{150,1,[91,100]}]
A622: 619 | B622: 5 | C622: 4 | D622: 0 | E622: =R[-9]C -> 61 | F622: =R[-9]C -> 70 | G622: 4 | H622: 20000 | I622: 110003 | J622: 4 | K622: =R[-1]C -> [{7,3},{8,3},{9,3},{10,3},{11,3},{12,3},{17,10},{18,8},{19,1},{23,4},{24,10}] | L622: =R[-1]C -> [{7,27},{8,55},{9,27},{10,55},{11,27},{12,55},{17,18},{18,110},{19,3},{23,37},{24,37}] | M622: =R[-1]C -> [{0,1,[1,30]},{1,2,[11,40]},{2,5,[21,50]},{5,10,[31,60]},{10,20,[41,60]},{30,20,[51,70]},{50,10,[61,80]},{70,5,[71,80]},{100,2,[81,90]},{150,1,[91,100]}]
A623: 620 | B623: 5 | C623: 4 | D623: 0 | E623: =R[-9]C -> 71 | F623: =R[-9]C -> 80 | G623: 4 | H623: 20000 | I623: 110003 | J623: 4 | K623: =R[-1]C -> [{7,3},{8,3},{9,3},{10,3},{11,3},{12,3},{17,10},{18,8},{19,1},{23,4},{24,10}] | L623: =R[-1]C -> [{7,27},{8,55},{9,27},{10,55},{11,27},{12,55},{17,18},{18,110},{19,3},{23,37},{24,37}] | M623: =R[-1]C -> [{0,1,[1,30]},{1,2,[11,40]},{2,5,[21,50]},{5,10,[31,60]},{10,20,[41,60]},{30,20,[51,70]},{50,10,[61,80]},{70,5,[71,80]},{100,2,[81,90]},{150,1,[91,100]}]
A624: 621 | B624: 5 | C624: 4 | D624: 0 | E624: =R[-9]C -> 81 | F624: =R[-9]C -> 90 | G624: 4 | H624: 20000 | I624: 110003 | J624: 4 | K624: =R[-1]C -> [{7,3},{8,3},{9,3},{10,3},{11,3},{12,3},{17,10},{18,8},{19,1},{23,4},{24,10}] | L624: =R[-1]C -> [{7,27},{8,55},{9,27},{10,55},{11,27},{12,55},{17,18},{18,110},{19,3},{23,37},{24,37}] | M624: =R[-1]C -> [{0,1,[1,30]},{1,2,[11,40]},{2,5,[21,50]},{5,10,[31,60]},{10,20,[41,60]},{30,20,[51,70]},{50,10,[61,80]},{70,5,[71,80]},{100,2,[81,90]},{150,1,[91,100]}]
A625: 622 | B625: 6 | C625: 4 | D625: 0 | E625: =R[-9]C -> 1 | F625: =R[-9]C -> 10 | G625: 5 | H625: 20000 | I625: 110003 | J625: 5 | K625: =R[-1]C -> [{7,3},{8,3},{9,3},{10,3},{11,3},{12,3},{17,10},{18,8},{19,1},{23,4},{24,10}] | L625: =R[-1]C -> [{7,27},{8,55},{9,27},{10,55},{11,27},{12,55},{17,18},{18,110},{19,3},{23,37},{24,37}] | M625: =R[-1]C -> [{0,1,[1,30]},{1,2,[11,40]},{2,5,[21,50]},{5,10,[31,60]},{10,20,[41,60]},{30,20,[51,70]},{50,10,[61,80]},{70,5,[71,80]},{100,2,[81,90]},{150,1,[91,100]}]
A626: 623 | B626: 6 | C626: 4 | D626: 0 | E626: =R[-9]C -> 11 | F626: =R[-9]C -> 20 | G626: 5 | H626: 20000 | I626: 110003 | J626: 5 | K626: =R[-1]C -> [{7,3},{8,3},{9,3},{10,3},{11,3},{12,3},{17,10},{18,8},{19,1},{23,4},{24,10}] | L626: =R[-1]C -> [{7,27},{8,55},{9,27},{10,55},{11,27},{12,55},{17,18},{18,110},{19,3},{23,37},{24,37}] | M626: =R[-1]C -> [{0,1,[1,30]},{1,2,[11,40]},{2,5,[21,50]},{5,10,[31,60]},{10,20,[41,60]},{30,20,[51,70]},{50,10,[61,80]},{70,5,[71,80]},{100,2,[81,90]},{150,1,[91,100]}]
A627: 624 | B627: 6 | C627: 4 | D627: 0 | E627: =R[-9]C -> 21 | F627: =R[-9]C -> 30 | G627: 5 | H627: 20000 | I627: 110003 | J627: 5 | K627: =R[-1]C -> [{7,3},{8,3},{9,3},{10,3},{11,3},{12,3},{17,10},{18,8},{19,1},{23,4},{24,10}] | L627: =R[-1]C -> [{7,27},{8,55},{9,27},{10,55},{11,27},{12,55},{17,18},{18,110},{19,3},{23,37},{24,37}] | M627: =R[-1]C -> [{0,1,[1,30]},{1,2,[11,40]},{2,5,[21,50]},{5,10,[31,60]},{10,20,[41,60]},{30,20,[51,70]},{50,10,[61,80]},{70,5,[71,80]},{100,2,[81,90]},{150,1,[91,100]}]
A628: 625 | B628: 6 | C628: 4 | D628: 0 | E628: =R[-9]C -> 31 | F628: =R[-9]C -> 40 | G628: 5 | H628: 20000 | I628: 110003 | J628: 5 | K628: =R[-1]C -> [{7,3},{8,3},{9,3},{10,3},{11,3},{12,3},{17,10},{18,8},{19,1},{23,4},{24,10}] | L628: =R[-1]C -> [{7,27},{8,55},{9,27},{10,55},{11,27},{12,55},{17,18},{18,110},{19,3},{23,37},{24,37}] | M628: =R[-1]C -> [{0,1,[1,30]},{1,2,[11,40]},{2,5,[21,50]},{5,10,[31,60]},{10,20,[41,60]},{30,20,[51,70]},{50,10,[61,80]},{70,5,[71,80]},{100,2,[81,90]},{150,1,[91,100]}]
A629: 626 | B629: 6 | C629: 4 | D629: 0 | E629: =R[-9]C -> 41 | F629: =R[-9]C -> 50 | G629: 5 | H629: 20000 | I629: 110003 | J629: 5 | K629: =R[-1]C -> [{7,3},{8,3},{9,3},{10,3},{11,3},{12,3},{17,10},{18,8},{19,1},{23,4},{24,10}] | L629: =R[-1]C -> [{7,27},{8,55},{9,27},{10,55},{11,27},{12,55},{17,18},{18,110},{19,3},{23,37},{24,37}] | M629: =R[-1]C -> [{0,1,[1,30]},{1,2,[11,40]},{2,5,[21,50]},{5,10,[31,60]},{10,20,[41,60]},{30,20,[51,70]},{50,10,[61,80]},{70,5,[71,80]},{100,2,[81,90]},{150,1,[91,100]}]
A630: 627 | B630: 6 | C630: 4 | D630: 0 | E630: =R[-9]C -> 51 | F630: =R[-9]C -> 60 | G630: 5 | H630: 20000 | I630: 110003 | J630: 5 | K630: =R[-1]C -> [{7,3},{8,3},{9,3},{10,3},{11,3},{12,3},{17,10},{18,8},{19,1},{23,4},{24,10}] | L630: =R[-1]C -> [{7,27},{8,55},{9,27},{10,55},{11,27},{12,55},{17,18},{18,110},{19,3},{23,37},{24,37}] | M630: =R[-1]C -> [{0,1,[1,30]},{1,2,[11,40]},{2,5,[21,50]},{5,10,[31,60]},{10,20,[41,60]},{30,20,[51,70]},{50,10,[61,80]},{70,5,[71,80]},{100,2,[81,90]},{150,1,[91,100]}]
A631: 628 | B631: 6 | C631: 4 | D631: 0 | E631: =R[-9]C -> 61 | F631: =R[-9]C -> 70 | G631: 5 | H631: 20000 | I631: 110003 | J631: 5 | K631: =R[-1]C -> [{7,3},{8,3},{9,3},{10,3},{11,3},{12,3},{17,10},{18,8},{19,1},{23,4},{24,10}] | L631: =R[-1]C -> [{7,27},{8,55},{9,27},{10,55},{11,27},{12,55},{17,18},{18,110},{19,3},{23,37},{24,37}] | M631: =R[-1]C -> [{0,1,[1,30]},{1,2,[11,40]},{2,5,[21,50]},{5,10,[31,60]},{10,20,[41,60]},{30,20,[51,70]},{50,10,[61,80]},{70,5,[71,80]},{100,2,[81,90]},{150,1,[91,100]}]
A632: 629 | B632: 6 | C632: 4 | D632: 0 | E632: =R[-9]C -> 71 | F632: =R[-9]C -> 80 | G632: 5 | H632: 20000 | I632: 110003 | J632: 5 | K632: =R[-1]C -> [{7,3},{8,3},{9,3},{10,3},{11,3},{12,3},{17,10},{18,8},{19,1},{23,4},{24,10}] | L632: =R[-1]C -> [{7,27},{8,55},{9,27},{10,55},{11,27},{12,55},{17,18},{18,110},{19,3},{23,37},{24,37}] | M632: =R[-1]C -> [{0,1,[1,30]},{1,2,[11,40]},{2,5,[21,50]},{5,10,[31,60]},{10,20,[41,60]},{30,20,[51,70]},{50,10,[61,80]},{70,5,[71,80]},{100,2,[81,90]},{150,1,[91,100]}]
A633: 630 | B633: 6 | C633: 4 | D633: 0 | E633: =R[-9]C -> 81 | F633: =R[-9]C -> 90 | G633: 5 | H633: 20000 | I633: 110003 | J633: 5 | K633: =R[-1]C -> [{7,3},{8,3},{9,3},{10,3},{11,3},{12,3},{17,10},{18,8},{19,1},{23,4},{24,10}] | L633: =R[-1]C -> [{7,27},{8,55},{9,27},{10,55},{11,27},{12,55},{17,18},{18,110},{19,3},{23,37},{24,37}] | M633: =R[-1]C -> [{0,1,[1,30]},{1,2,[11,40]},{2,5,[21,50]},{5,10,[31,60]},{10,20,[41,60]},{30,20,[51,70]},{50,10,[61,80]},{70,5,[71,80]},{100,2,[81,90]},{150,1,[91,100]}]
A634: 631 | B634: 2 | C634: 6 | D634: 0 | E634: =R[-18]C -> 1 | F634: =R[-18]C -> 10 | G634: 1 | H634: 5000 | I634: 110003 | J634: 1 | K634: =R[-1]C -> [{7,3},{8,3},{9,3},{10,3},{11,3},{12,3},{17,10},{18,8},{19,1},{23,4},{24,10}] | L634: =R[-1]C -> [{7,27},{8,55},{9,27},{10,55},{11,27},{12,55},{17,18},{18,110},{19,3},{23,37},{24,37}] | M634: =R[-1]C -> [{0,1,[1,30]},{1,2,[11,40]},{2,5,[21,50]},{5,10,[31,60]},{10,20,[41,60]},{30,20,[51,70]},{50,10,[61,80]},{70,5,[71,80]},{100,2,[81,90]},{150,1,[91,100]}]
A635: 632 | B635: 2 | C635: 6 | D635: 0 | E635: =R[-18]C -> 11 | F635: =R[-18]C -> 20 | G635: 1 | H635: 5000 | I635: 110003 | J635: 1 | K635: =R[-1]C -> [{7,3},{8,3},{9,3},{10,3},{11,3},{12,3},{17,10},{18,8},{19,1},{23,4},{24,10}] | L635: =R[-1]C -> [{7,27},{8,55},{9,27},{10,55},{11,27},{12,55},{17,18},{18,110},{19,3},{23,37},{24,37}] | M635: =R[-1]C -> [{0,1,[1,30]},{1,2,[11,40]},{2,5,[21,50]},{5,10,[31,60]},{10,20,[41,60]},{30,20,[51,70]},{50,10,[61,80]},{70,5,[71,80]},{100,2,[81,90]},{150,1,[91,100]}]
A636: 633 | B636: 2 | C636: 6 | D636: 0 | E636: =R[-18]C -> 21 | F636: =R[-18]C -> 30 | G636: 1 | H636: 5000 | I636: 110003 | J636: 1 | K636: =R[-1]C -> [{7,3},{8,3},{9,3},{10,3},{11,3},{12,3},{17,10},{18,8},{19,1},{23,4},{24,10}] | L636: =R[-1]C -> [{7,27},{8,55},{9,27},{10,55},{11,27},{12,55},{17,18},{18,110},{19,3},{23,37},{24,37}] | M636: =R[-1]C -> [{0,1,[1,30]},{1,2,[11,40]},{2,5,[21,50]},{5,10,[31,60]},{10,20,[41,60]},{30,20,[51,70]},{50,10,[61,80]},{70,5,[71,80]},{100,2,[81,90]},{150,1,[91,100]}]
A637: 634 | B637: 2 | C637: 6 | D637: 0 | E637: =R[-18]C -> 31 | F637: =R[-18]C -> 40 | G637: 1 | H637: 5000 | I637: 110003 | J637: 1 | K637: =R[-1]C -> [{7,3},{8,3},{9,3},{10,3},{11,3},{12,3},{17,10},{18,8},{19,1},{23,4},{24,10}] | L637: =R[-1]C -> [{7,27},{8,55},{9,27},{10,55},{11,27},{12,55},{17,18},{18,110},{19,3},{23,37},{24,37}] | M637: =R[-1]C -> [{0,1,[1,30]},{1,2,[11,40]},{2,5,[21,50]},{5,10,[31,60]},{10,20,[41,60]},{30,20,[51,70]},{50,10,[61,80]},{70,5,[71,80]},{100,2,[81,90]},{150,1,[91,100]}]
A638: 635 | B638: 2 | C638: 6 | D638: 0 | E638: =R[-18]C -> 41 | F638: =R[-18]C -> 50 | G638: 1 | H638: 5000 | I638: 110003 | J638: 1 | K638: =R[-1]C -> [{7,3},{8,3},{9,3},{10,3},{11,3},{12,3},{17,10},{18,8},{19,1},{23,4},{24,10}] | L638: =R[-1]C -> [{7,27},{8,55},{9,27},{10,55},{11,27},{12,55},{17,18},{18,110},{19,3},{23,37},{24,37}] | M638: =R[-1]C -> [{0,1,[1,30]},{1,2,[11,40]},{2,5,[21,50]},{5,10,[31,60]},{10,20,[41,60]},{30,20,[51,70]},{50,10,[61,80]},{70,5,[71,80]},{100,2,[81,90]},{150,1,[91,100]}]
A639: 636 | B639: 2 | C639: 6 | D639: 0 | E639: =R[-18]C -> 51 | F639: =R[-18]C -> 60 | G639: 1 | H639: 5000 | I639: 110003 | J639: 1 | K639: =R[-1]C -> [{7,3},{8,3},{9,3},{10,3},{11,3},{12,3},{17,10},{18,8},{19,1},{23,4},{24,10}] | L639: =R[-1]C -> [{7,27},{8,55},{9,27},{10,55},{11,27},{12,55},{17,18},{18,110},{19,3},{23,37},{24,37}] | M639: =R[-1]C -> [{0,1,[1,30]},{1,2,[11,40]},{2,5,[21,50]},{5,10,[31,60]},{10,20,[41,60]},{30,20,[51,70]},{50,10,[61,80]},{70,5,[71,80]},{100,2,[81,90]},{150,1,[91,100]}]
A640: 637 | B640: 2 | C640: 6 | D640: 0 | E640: =R[-18]C -> 61 | F640: =R[-18]C -> 70 | G640: 1 | H640: 5000 | I640: 110003 | J640: 1 | K640: =R[-1]C -> [{7,3},{8,3},{9,3},{10,3},{11,3},{12,3},{17,10},{18,8},{19,1},{23,4},{24,10}] | L640: =R[-1]C -> [{7,27},{8,55},{9,27},{10,55},{11,27},{12,55},{17,18},{18,110},{19,3},{23,37},{24,37}] | M640: =R[-1]C -> [{0,1,[1,30]},{1,2,[11,40]},{2,5,[21,50]},{5,10,[31,60]},{10,20,[41,60]},{30,20,[51,70]},{50,10,[61,80]},{70,5,[71,80]},{100,2,[81,90]},{150,1,[91,100]}]
A641: 638 | B641: 2 | C641: 6 | D641: 0 | E641: =R[-18]C -> 71 | F641: =R[-18]C -> 80 | G641: 1 | H641: 5000 | I641: 110003 | J641: 1 | K641: =R[-1]C -> [{7,3},{8,3},{9,3},{10,3},{11,3},{12,3},{17,10},{18,8},{19,1},{23,4},{24,10}] | L641: =R[-1]C -> [{7,27},{8,55},{9,27},{10,55},{11,27},{12,55},{17,18},{18,110},{19,3},{23,37},{24,37}] | M641: =R[-1]C -> [{0,1,[1,30]},{1,2,[11,40]},{2,5,[21,50]},{5,10,[31,60]},{10,20,[41,60]},{30,20,[51,70]},{50,10,[61,80]},{70,5,[71,80]},{100,2,[81,90]},{150,1,[91,100]}]
A642: 639 | B642: 2 | C642: 6 | D642: 0 | E642: =R[-18]C -> 81 | F642: =R[-18]C -> 90 | G642: 1 | H642: 5000 | I642: 110003 | J642: 1 | K642: =R[-1]C -> [{7,3},{8,3},{9,3},{10,3},{11,3},{12,3},{17,10},{18,8},{19,1},{23,4},{24,10}] | L642: =R[-1]C -> [{7,27},{8,55},{9,27},{10,55},{11,27},{12,55},{17,18},{18,110},{19,3},{23,37},{24,37}] | M642: =R[-1]C -> [{0,1,[1,30]},{1,2,[11,40]},{2,5,[21,50]},{5,10,[31,60]},{10,20,[41,60]},{30,20,[51,70]},{50,10,[61,80]},{70,5,[71,80]},{100,2,[81,90]},{150,1,[91,100]}]
A643: 640 | B643: 3 | C643: 6 | D643: 0 | E643: =R[-9]C -> 1 | F643: =R[-9]C -> 10 | G643: 2 | H643: 10000 | I643: 110003 | J643: 2 | K643: =R[-1]C -> [{7,3},{8,3},{9,3},{10,3},{11,3},{12,3},{17,10},{18,8},{19,1},{23,4},{24,10}] | L643: =R[-1]C -> [{7,27},{8,55},{9,27},{10,55},{11,27},{12,55},{17,18},{18,110},{19,3},{23,37},{24,37}] | M643: =R[-1]C -> [{0,1,[1,30]},{1,2,[11,40]},{2,5,[21,50]},{5,10,[31,60]},{10,20,[41,60]},{30,20,[51,70]},{50,10,[61,80]},{70,5,[71,80]},{100,2,[81,90]},{150,1,[91,100]}]
A644: 641 | B644: 3 | C644: 6 | D644: 0 | E644: =R[-9]C -> 11 | F644: =R[-9]C -> 20 | G644: 2 | H644: 10000 | I644: 110003 | J644: 2 | K644: =R[-1]C -> [{7,3},{8,3},{9,3},{10,3},{11,3},{12,3},{17,10},{18,8},{19,1},{23,4},{24,10}] | L644: =R[-1]C -> [{7,27},{8,55},{9,27},{10,55},{11,27},{12,55},{17,18},{18,110},{19,3},{23,37},{24,37}] | M644: =R[-1]C -> [{0,1,[1,30]},{1,2,[11,40]},{2,5,[21,50]},{5,10,[31,60]},{10,20,[41,60]},{30,20,[51,70]},{50,10,[61,80]},{70,5,[71,80]},{100,2,[81,90]},{150,1,[91,100]}]
A645: 642 | B645: 3 | C645: 6 | D645: 0 | E645: =R[-9]C -> 21 | F645: =R[-9]C -> 30 | G645: 2 | H645: 10000 | I645: 110003 | J645: 2 | K645: =R[-1]C -> [{7,3},{8,3},{9,3},{10,3},{11,3},{12,3},{17,10},{18,8},{19,1},{23,4},{24,10}] | L645: =R[-1]C -> [{7,27},{8,55},{9,27},{10,55},{11,27},{12,55},{17,18},{18,110},{19,3},{23,37},{24,37}] | M645: =R[-1]C -> [{0,1,[1,30]},{1,2,[11,40]},{2,5,[21,50]},{5,10,[31,60]},{10,20,[41,60]},{30,20,[51,70]},{50,10,[61,80]},{70,5,[71,80]},{100,2,[81,90]},{150,1,[91,100]}]
A646: 643 | B646: 3 | C646: 6 | D646: 0 | E646: =R[-9]C -> 31 | F646: =R[-9]C -> 40 | G646: 2 | H646: 10000 | I646: 110003 | J646: 2 | K646: =R[-1]C -> [{7,3},{8,3},{9,3},{10,3},{11,3},{12,3},{17,10},{18,8},{19,1},{23,4},{24,10}] | L646: =R[-1]C -> [{7,27},{8,55},{9,27},{10,55},{11,27},{12,55},{17,18},{18,110},{19,3},{23,37},{24,37}] | M646: =R[-1]C -> [{0,1,[1,30]},{1,2,[11,40]},{2,5,[21,50]},{5,10,[31,60]},{10,20,[41,60]},{30,20,[51,70]},{50,10,[61,80]},{70,5,[71,80]},{100,2,[81,90]},{150,1,[91,100]}]
A647: 644 | B647: 3 | C647: 6 | D647: 0 | E647: =R[-9]C -> 41 | F647: =R[-9]C -> 50 | G647: 2 | H647: 10000 | I647: 110003 | J647: 2 | K647: =R[-1]C -> [{7,3},{8,3},{9,3},{10,3},{11,3},{12,3},{17,10},{18,8},{19,1},{23,4},{24,10}] | L647: =R[-1]C -> [{7,27},{8,55},{9,27},{10,55},{11,27},{12,55},{17,18},{18,110},{19,3},{23,37},{24,37}] | M647: =R[-1]C -> [{0,1,[1,30]},{1,2,[11,40]},{2,5,[21,50]},{5,10,[31,60]},{10,20,[41,60]},{30,20,[51,70]},{50,10,[61,80]},{70,5,[71,80]},{100,2,[81,90]},{150,1,[91,100]}]
A648: 645 | B648: 3 | C648: 6 | D648: 0 | E648: =R[-9]C -> 51 | F648: =R[-9]C -> 60 | G648: 2 | H648: 10000 | I648: 110003 | J648: 2 | K648: =R[-1]C -> [{7,3},{8,3},{9,3},{10,3},{11,3},{12,3},{17,10},{18,8},{19,1},{23,4},{24,10}] | L648: =R[-1]C -> [{7,27},{8,55},{9,27},{10,55},{11,27},{12,55},{17,18},{18,110},{19,3},{23,37},{24,37}] | M648: =R[-1]C -> [{0,1,[1,30]},{1,2,[11,40]},{2,5,[21,50]},{5,10,[31,60]},{10,20,[41,60]},{30,20,[51,70]},{50,10,[61,80]},{70,5,[71,80]},{100,2,[81,90]},{150,1,[91,100]}]
A649: 646 | B649: 3 | C649: 6 | D649: 0 | E649: =R[-9]C -> 61 | F649: =R[-9]C -> 70 | G649: 2 | H649: 10000 | I649: 110003 | J649: 2 | K649: =R[-1]C -> [{7,3},{8,3},{9,3},{10,3},{11,3},{12,3},{17,10},{18,8},{19,1},{23,4},{24,10}] | L649: =R[-1]C -> [{7,27},{8,55},{9,27},{10,55},{11,27},{12,55},{17,18},{18,110},{19,3},{23,37},{24,37}] | M649: =R[-1]C -> [{0,1,[1,30]},{1,2,[11,40]},{2,5,[21,50]},{5,10,[31,60]},{10,20,[41,60]},{30,20,[51,70]},{50,10,[61,80]},{70,5,[71,80]},{100,2,[81,90]},{150,1,[91,100]}]
A650: 647 | B650: 3 | C650: 6 | D650: 0 | E650: =R[-9]C -> 71 | F650: =R[-9]C -> 80 | G650: 2 | H650: 10000 | I650: 110003 | J650: 2 | K650: =R[-1]C -> [{7,3},{8,3},{9,3},{10,3},{11,3},{12,3},{17,10},{18,8},{19,1},{23,4},{24,10}] | L650: =R[-1]C -> [{7,27},{8,55},{9,27},{10,55},{11,27},{12,55},{17,18},{18,110},{19,3},{23,37},{24,37}] | M650: =R[-1]C -> [{0,1,[1,30]},{1,2,[11,40]},{2,5,[21,50]},{5,10,[31,60]},{10,20,[41,60]},{30,20,[51,70]},{50,10,[61,80]},{70,5,[71,80]},{100,2,[81,90]},{150,1,[91,100]}]
A651: 648 | B651: 3 | C651: 6 | D651: 0 | E651: =R[-9]C -> 81 | F651: =R[-9]C -> 90 | G651: 2 | H651: 10000 | I651: 110003 | J651: 2 | K651: =R[-1]C -> [{7,3},{8,3},{9,3},{10,3},{11,3},{12,3},{17,10},{18,8},{19,1},{23,4},{24,10}] | L651: =R[-1]C -> [{7,27},{8,55},{9,27},{10,55},{11,27},{12,55},{17,18},{18,110},{19,3},{23,37},{24,37}] | M651: =R[-1]C -> [{0,1,[1,30]},{1,2,[11,40]},{2,5,[21,50]},{5,10,[31,60]},{10,20,[41,60]},{30,20,[51,70]},{50,10,[61,80]},{70,5,[71,80]},{100,2,[81,90]},{150,1,[91,100]}]
A652: 649 | B652: 4 | C652: 6 | D652: 0 | E652: =R[-9]C -> 1 | F652: =R[-9]C -> 10 | G652: 3 | H652: 15000 | I652: 110003 | J652: 3 | K652: =R[-1]C -> [{7,3},{8,3},{9,3},{10,3},{11,3},{12,3},{17,10},{18,8},{19,1},{23,4},{24,10}] | L652: =R[-1]C -> [{7,27},{8,55},{9,27},{10,55},{11,27},{12,55},{17,18},{18,110},{19,3},{23,37},{24,37}] | M652: =R[-1]C -> [{0,1,[1,30]},{1,2,[11,40]},{2,5,[21,50]},{5,10,[31,60]},{10,20,[41,60]},{30,20,[51,70]},{50,10,[61,80]},{70,5,[71,80]},{100,2,[81,90]},{150,1,[91,100]}]
A653: 650 | B653: 4 | C653: 6 | D653: 0 | E653: =R[-9]C -> 11 | F653: =R[-9]C -> 20 | G653: 3 | H653: 15000 | I653: 110003 | J653: 3 | K653: =R[-1]C -> [{7,3},{8,3},{9,3},{10,3},{11,3},{12,3},{17,10},{18,8},{19,1},{23,4},{24,10}] | L653: =R[-1]C -> [{7,27},{8,55},{9,27},{10,55},{11,27},{12,55},{17,18},{18,110},{19,3},{23,37},{24,37}] | M653: =R[-1]C -> [{0,1,[1,30]},{1,2,[11,40]},{2,5,[21,50]},{5,10,[31,60]},{10,20,[41,60]},{30,20,[51,70]},{50,10,[61,80]},{70,5,[71,80]},{100,2,[81,90]},{150,1,[91,100]}]
A654: 651 | B654: 4 | C654: 6 | D654: 0 | E654: =R[-9]C -> 21 | F654: =R[-9]C -> 30 | G654: 3 | H654: 15000 | I654: 110003 | J654: 3 | K654: =R[-1]C -> [{7,3},{8,3},{9,3},{10,3},{11,3},{12,3},{17,10},{18,8},{19,1},{23,4},{24,10}] | L654: =R[-1]C -> [{7,27},{8,55},{9,27},{10,55},{11,27},{12,55},{17,18},{18,110},{19,3},{23,37},{24,37}] | M654: =R[-1]C -> [{0,1,[1,30]},{1,2,[11,40]},{2,5,[21,50]},{5,10,[31,60]},{10,20,[41,60]},{30,20,[51,70]},{50,10,[61,80]},{70,5,[71,80]},{100,2,[81,90]},{150,1,[91,100]}]
A655: 652 | B655: 4 | C655: 6 | D655: 0 | E655: =R[-9]C -> 31 | F655: =R[-9]C -> 40 | G655: 3 | H655: 15000 | I655: 110003 | J655: 3 | K655: =R[-1]C -> [{7,3},{8,3},{9,3},{10,3},{11,3},{12,3},{17,10},{18,8},{19,1},{23,4},{24,10}] | L655: =R[-1]C -> [{7,27},{8,55},{9,27},{10,55},{11,27},{12,55},{17,18},{18,110},{19,3},{23,37},{24,37}] | M655: =R[-1]C -> [{0,1,[1,30]},{1,2,[11,40]},{2,5,[21,50]},{5,10,[31,60]},{10,20,[41,60]},{30,20,[51,70]},{50,10,[61,80]},{70,5,[71,80]},{100,2,[81,90]},{150,1,[91,100]}]
A656: 653 | B656: 4 | C656: 6 | D656: 0 | E656: =R[-9]C -> 41 | F656: =R[-9]C -> 50 | G656: 3 | H656: 15000 | I656: 110003 | J656: 3 | K656: =R[-1]C -> [{7,3},{8,3},{9,3},{10,3},{11,3},{12,3},{17,10},{18,8},{19,1},{23,4},{24,10}] | L656: =R[-1]C -> [{7,27},{8,55},{9,27},{10,55},{11,27},{12,55},{17,18},{18,110},{19,3},{23,37},{24,37}] | M656: =R[-1]C -> [{0,1,[1,30]},{1,2,[11,40]},{2,5,[21,50]},{5,10,[31,60]},{10,20,[41,60]},{30,20,[51,70]},{50,10,[61,80]},{70,5,[71,80]},{100,2,[81,90]},{150,1,[91,100]}]
A657: 654 | B657: 4 | C657: 6 | D657: 0 | E657: =R[-9]C -> 51 | F657: =R[-9]C -> 60 | G657: 3 | H657: 15000 | I657: 110003 | J657: 3 | K657: =R[-1]C -> [{7,3},{8,3},{9,3},{10,3},{11,3},{12,3},{17,10},{18,8},{19,1},{23,4},{24,10}] | L657: =R[-1]C -> [{7,27},{8,55},{9,27},{10,55},{11,27},{12,55},{17,18},{18,110},{19,3},{23,37},{24,37}] | M657: =R[-1]C -> [{0,1,[1,30]},{1,2,[11,40]},{2,5,[21,50]},{5,10,[31,60]},{10,20,[41,60]},{30,20,[51,70]},{50,10,[61,80]},{70,5,[71,80]},{100,2,[81,90]},{150,1,[91,100]}]
A658: 655 | B658: 4 | C658: 6 | D658: 0 | E658: =R[-9]C -> 61 | F658: =R[-9]C -> 70 | G658: 3 | H658: 15000 | I658: 110003 | J658: 3 | K658: =R[-1]C -> [{7,3},{8,3},{9,3},{10,3},{11,3},{12,3},{17,10},{18,8},{19,1},{23,4},{24,10}] | L658: =R[-1]C -> [{7,27},{8,55},{9,27},{10,55},{11,27},{12,55},{17,18},{18,110},{19,3},{23,37},{24,37}] | M658: =R[-1]C -> [{0,1,[1,30]},{1,2,[11,40]},{2,5,[21,50]},{5,10,[31,60]},{10,20,[41,60]},{30,20,[51,70]},{50,10,[61,80]},{70,5,[71,80]},{100,2,[81,90]},{150,1,[91,100]}]
A659: 656 | B659: 4 | C659: 6 | D659: 0 | E659: =R[-9]C -> 71 | F659: =R[-9]C -> 80 | G659: 3 | H659: 15000 | I659: 110003 | J659: 3 | K659: =R[-1]C -> [{7,3},{8,3},{9,3},{10,3},{11,3},{12,3},{17,10},{18,8},{19,1},{23,4},{24,10}] | L659: =R[-1]C -> [{7,27},{8,55},{9,27},{10,55},{11,27},{12,55},{17,18},{18,110},{19,3},{23,37},{24,37}] | M659: =R[-1]C -> [{0,1,[1,30]},{1,2,[11,40]},{2,5,[21,50]},{5,10,[31,60]},{10,20,[41,60]},{30,20,[51,70]},{50,10,[61,80]},{70,5,[71,80]},{100,2,[81,90]},{150,1,[91,100]}]
A660: 657 | B660: 4 | C660: 6 | D660: 0 | E660: =R[-9]C -> 81 | F660: =R[-9]C -> 90 | G660: 3 | H660: 15000 | I660: 110003 | J660: 3 | K660: =R[-1]C -> [{7,3},{8,3},{9,3},{10,3},{11,3},{12,3},{17,10},{18,8},{19,1},{23,4},{24,10}] | L660: =R[-1]C -> [{7,27},{8,55},{9,27},{10,55},{11,27},{12,55},{17,18},{18,110},{19,3},{23,37},{24,37}] | M660: =R[-1]C -> [{0,1,[1,30]},{1,2,[11,40]},{2,5,[21,50]},{5,10,[31,60]},{10,20,[41,60]},{30,20,[51,70]},{50,10,[61,80]},{70,5,[71,80]},{100,2,[81,90]},{150,1,[91,100]}]
A661: 658 | B661: 5 | C661: 6 | D661: 0 | E661: =R[-9]C -> 1 | F661: =R[-9]C -> 10 | G661: 4 | H661: 20000 | I661: 110003 | J661: 4 | K661: =R[-1]C -> [{7,3},{8,3},{9,3},{10,3},{11,3},{12,3},{17,10},{18,8},{19,1},{23,4},{24,10}] | L661: =R[-1]C -> [{7,27},{8,55},{9,27},{10,55},{11,27},{12,55},{17,18},{18,110},{19,3},{23,37},{24,37}] | M661: =R[-1]C -> [{0,1,[1,30]},{1,2,[11,40]},{2,5,[21,50]},{5,10,[31,60]},{10,20,[41,60]},{30,20,[51,70]},{50,10,[61,80]},{70,5,[71,80]},{100,2,[81,90]},{150,1,[91,100]}]
A662: 659 | B662: 5 | C662: 6 | D662: 0 | E662: =R[-9]C -> 11 | F662: =R[-9]C -> 20 | G662: 4 | H662: 20000 | I662: 110003 | J662: 4 | K662: =R[-1]C -> [{7,3},{8,3},{9,3},{10,3},{11,3},{12,3},{17,10},{18,8},{19,1},{23,4},{24,10}] | L662: =R[-1]C -> [{7,27},{8,55},{9,27},{10,55},{11,27},{12,55},{17,18},{18,110},{19,3},{23,37},{24,37}] | M662: =R[-1]C -> [{0,1,[1,30]},{1,2,[11,40]},{2,5,[21,50]},{5,10,[31,60]},{10,20,[41,60]},{30,20,[51,70]},{50,10,[61,80]},{70,5,[71,80]},{100,2,[81,90]},{150,1,[91,100]}]
A663: 660 | B663: 5 | C663: 6 | D663: 0 | E663: =R[-9]C -> 21 | F663: =R[-9]C -> 30 | G663: 4 | H663: 20000 | I663: 110003 | J663: 4 | K663: =R[-1]C -> [{7,3},{8,3},{9,3},{10,3},{11,3},{12,3},{17,10},{18,8},{19,1},{23,4},{24,10}] | L663: =R[-1]C -> [{7,27},{8,55},{9,27},{10,55},{11,27},{12,55},{17,18},{18,110},{19,3},{23,37},{24,37}] | M663: =R[-1]C -> [{0,1,[1,30]},{1,2,[11,40]},{2,5,[21,50]},{5,10,[31,60]},{10,20,[41,60]},{30,20,[51,70]},{50,10,[61,80]},{70,5,[71,80]},{100,2,[81,90]},{150,1,[91,100]}]
A664: 661 | B664: 5 | C664: 6 | D664: 0 | E664: =R[-9]C -> 31 | F664: =R[-9]C -> 40 | G664: 4 | H664: 20000 | I664: 110003 | J664: 4 | K664: =R[-1]C -> [{7,3},{8,3},{9,3},{10,3},{11,3},{12,3},{17,10},{18,8},{19,1},{23,4},{24,10}] | L664: =R[-1]C -> [{7,27},{8,55},{9,27},{10,55},{11,27},{12,55},{17,18},{18,110},{19,3},{23,37},{24,37}] | M664: =R[-1]C -> [{0,1,[1,30]},{1,2,[11,40]},{2,5,[21,50]},{5,10,[31,60]},{10,20,[41,60]},{30,20,[51,70]},{50,10,[61,80]},{70,5,[71,80]},{100,2,[81,90]},{150,1,[91,100]}]
A665: 662 | B665: 5 | C665: 6 | D665: 0 | E665: =R[-9]C -> 41 | F665: =R[-9]C -> 50 | G665: 4 | H665: 20000 | I665: 110003 | J665: 4 | K665: =R[-1]C -> [{7,3},{8,3},{9,3},{10,3},{11,3},{12,3},{17,10},{18,8},{19,1},{23,4},{24,10}] | L665: =R[-1]C -> [{7,27},{8,55},{9,27},{10,55},{11,27},{12,55},{17,18},{18,110},{19,3},{23,37},{24,37}] | M665: =R[-1]C -> [{0,1,[1,30]},{1,2,[11,40]},{2,5,[21,50]},{5,10,[31,60]},{10,20,[41,60]},{30,20,[51,70]},{50,10,[61,80]},{70,5,[71,80]},{100,2,[81,90]},{150,1,[91,100]}]
A666: 663 | B666: 5 | C666: 6 | D666: 0 | E666: =R[-9]C -> 51 | F666: =R[-9]C -> 60 | G666: 4 | H666: 20000 | I666: 110003 | J666: 4 | K666: =R[-1]C -> [{7,3},{8,3},{9,3},{10,3},{11,3},{12,3},{17,10},{18,8},{19,1},{23,4},{24,10}] | L666: =R[-1]C -> [{7,27},{8,55},{9,27},{10,55},{11,27},{12,55},{17,18},{18,110},{19,3},{23,37},{24,37}] | M666: =R[-1]C -> [{0,1,[1,30]},{1,2,[11,40]},{2,5,[21,50]},{5,10,[31,60]},{10,20,[41,60]},{30,20,[51,70]},{50,10,[61,80]},{70,5,[71,80]},{100,2,[81,90]},{150,1,[91,100]}]
A667: 664 | B667: 5 | C667: 6 | D667: 0 | E667: =R[-9]C -> 61 | F667: =R[-9]C -> 70 | G667: 4 | H667: 20000 | I667: 110003 | J667: 4 | K667: =R[-1]C -> [{7,3},{8,3},{9,3},{10,3},{11,3},{12,3},{17,10},{18,8},{19,1},{23,4},{24,10}] | L667: =R[-1]C -> [{7,27},{8,55},{9,27},{10,55},{11,27},{12,55},{17,18},{18,110},{19,3},{23,37},{24,37}] | M667: =R[-1]C -> [{0,1,[1,30]},{1,2,[11,40]},{2,5,[21,50]},{5,10,[31,60]},{10,20,[41,60]},{30,20,[51,70]},{50,10,[61,80]},{70,5,[71,80]},{100,2,[81,90]},{150,1,[91,100]}]
A668: 665 | B668: 5 | C668: 6 | D668: 0 | E668: =R[-9]C -> 71 | F668: =R[-9]C -> 80 | G668: 4 | H668: 20000 | I668: 110003 | J668: 4 | K668: =R[-1]C -> [{7,3},{8,3},{9,3},{10,3},{11,3},{12,3},{17,10},{18,8},{19,1},{23,4},{24,10}] | L668: =R[-1]C -> [{7,27},{8,55},{9,27},{10,55},{11,27},{12,55},{17,18},{18,110},{19,3},{23,37},{24,37}] | M668: =R[-1]C -> [{0,1,[1,30]},{1,2,[11,40]},{2,5,[21,50]},{5,10,[31,60]},{10,20,[41,60]},{30,20,[51,70]},{50,10,[61,80]},{70,5,[71,80]},{100,2,[81,90]},{150,1,[91,100]}]
A669: 666 | B669: 5 | C669: 6 | D669: 0 | E669: =R[-9]C -> 81 | F669: =R[-9]C -> 90 | G669: 4 | H669: 20000 | I669: 110003 | J669: 4 | K669: =R[-1]C -> [{7,3},{8,3},{9,3},{10,3},{11,3},{12,3},{17,10},{18,8},{19,1},{23,4},{24,10}] | L669: =R[-1]C -> [{7,27},{8,55},{9,27},{10,55},{11,27},{12,55},{17,18},{18,110},{19,3},{23,37},{24,37}] | M669: =R[-1]C -> [{0,1,[1,30]},{1,2,[11,40]},{2,5,[21,50]},{5,10,[31,60]},{10,20,[41,60]},{30,20,[51,70]},{50,10,[61,80]},{70,5,[71,80]},{100,2,[81,90]},{150,1,[91,100]}]
A670: 667 | B670: 6 | C670: 6 | D670: 0 | E670: =R[-9]C -> 1 | F670: =R[-9]C -> 10 | G670: 5 | H670: 20000 | I670: 110003 | J670: 5 | K670: =R[-1]C -> [{7,3},{8,3},{9,3},{10,3},{11,3},{12,3},{17,10},{18,8},{19,1},{23,4},{24,10}] | L670: =R[-1]C -> [{7,27},{8,55},{9,27},{10,55},{11,27},{12,55},{17,18},{18,110},{19,3},{23,37},{24,37}] | M670: =R[-1]C -> [{0,1,[1,30]},{1,2,[11,40]},{2,5,[21,50]},{5,10,[31,60]},{10,20,[41,60]},{30,20,[51,70]},{50,10,[61,80]},{70,5,[71,80]},{100,2,[81,90]},{150,1,[91,100]}]
A671: 668 | B671: 6 | C671: 6 | D671: 0 | E671: =R[-9]C -> 11 | F671: =R[-9]C -> 20 | G671: 5 | H671: 20000 | I671: 110003 | J671: 5 | K671: =R[-1]C -> [{7,3},{8,3},{9,3},{10,3},{11,3},{12,3},{17,10},{18,8},{19,1},{23,4},{24,10}] | L671: =R[-1]C -> [{7,27},{8,55},{9,27},{10,55},{11,27},{12,55},{17,18},{18,110},{19,3},{23,37},{24,37}] | M671: =R[-1]C -> [{0,1,[1,30]},{1,2,[11,40]},{2,5,[21,50]},{5,10,[31,60]},{10,20,[41,60]},{30,20,[51,70]},{50,10,[61,80]},{70,5,[71,80]},{100,2,[81,90]},{150,1,[91,100]}]
A672: 669 | B672: 6 | C672: 6 | D672: 0 | E672: =R[-9]C -> 21 | F672: =R[-9]C -> 30 | G672: 5 | H672: 20000 | I672: 110003 | J672: 5 | K672: =R[-1]C -> [{7,3},{8,3},{9,3},{10,3},{11,3},{12,3},{17,10},{18,8},{19,1},{23,4},{24,10}] | L672: =R[-1]C -> [{7,27},{8,55},{9,27},{10,55},{11,27},{12,55},{17,18},{18,110},{19,3},{23,37},{24,37}] | M672: =R[-1]C -> [{0,1,[1,30]},{1,2,[11,40]},{2,5,[21,50]},{5,10,[31,60]},{10,20,[41,60]},{30,20,[51,70]},{50,10,[61,80]},{70,5,[71,80]},{100,2,[81,90]},{150,1,[91,100]}]
A673: 670 | B673: 6 | C673: 6 | D673: 0 | E673: =R[-9]C -> 31 | F673: =R[-9]C -> 40 | G673: 5 | H673: 20000 | I673: 110003 | J673: 5 | K673: =R[-1]C -> [{7,3},{8,3},{9,3},{10,3},{11,3},{12,3},{17,10},{18,8},{19,1},{23,4},{24,10}] | L673: =R[-1]C -> [{7,27},{8,55},{9,27},{10,55},{11,27},{12,55},{17,18},{18,110},{19,3},{23,37},{24,37}] | M673: =R[-1]C -> [{0,1,[1,30]},{1,2,[11,40]},{2,5,[21,50]},{5,10,[31,60]},{10,20,[41,60]},{30,20,[51,70]},{50,10,[61,80]},{70,5,[71,80]},{100,2,[81,90]},{150,1,[91,100]}]
A674: 671 | B674: 6 | C674: 6 | D674: 0 | E674: =R[-9]C -> 41 | F674: =R[-9]C -> 50 | G674: 5 | H674: 20000 | I674: 110003 | J674: 5 | K674: =R[-1]C -> [{7,3},{8,3},{9,3},{10,3},{11,3},{12,3},{17,10},{18,8},{19,1},{23,4},{24,10}] | L674: =R[-1]C -> [{7,27},{8,55},{9,27},{10,55},{11,27},{12,55},{17,18},{18,110},{19,3},{23,37},{24,37}] | M674: =R[-1]C -> [{0,1,[1,30]},{1,2,[11,40]},{2,5,[21,50]},{5,10,[31,60]},{10,20,[41,60]},{30,20,[51,70]},{50,10,[61,80]},{70,5,[71,80]},{100,2,[81,90]},{150,1,[91,100]}]
A675: 672 | B675: 6 | C675: 6 | D675: 0 | E675: =R[-9]C -> 51 | F675: =R[-9]C -> 60 | G675: 5 | H675: 20000 | I675: 110003 | J675: 5 | K675: =R[-1]C -> [{7,3},{8,3},{9,3},{10,3},{11,3},{12,3},{17,10},{18,8},{19,1},{23,4},{24,10}] | L675: =R[-1]C -> [{7,27},{8,55},{9,27},{10,55},{11,27},{12,55},{17,18},{18,110},{19,3},{23,37},{24,37}] | M675: =R[-1]C -> [{0,1,[1,30]},{1,2,[11,40]},{2,5,[21,50]},{5,10,[31,60]},{10,20,[41,60]},{30,20,[51,70]},{50,10,[61,80]},{70,5,[71,80]},{100,2,[81,90]},{150,1,[91,100]}]
A676: 673 | B676: 6 | C676: 6 | D676: 0 | E676: =R[-9]C -> 61 | F676: =R[-9]C -> 70 | G676: 5 | H676: 20000 | I676: 110003 | J676: 5 | K676: =R[-1]C -> [{7,3},{8,3},{9,3},{10,3},{11,3},{12,3},{17,10},{18,8},{19,1},{23,4},{24,10}] | L676: =R[-1]C -> [{7,27},{8,55},{9,27},{10,55},{11,27},{12,55},{17,18},{18,110},{19,3},{23,37},{24,37}] | M676: =R[-1]C -> [{0,1,[1,30]},{1,2,[11,40]},{2,5,[21,50]},{5,10,[31,60]},{10,20,[41,60]},{30,20,[51,70]},{50,10,[61,80]},{70,5,[71,80]},{100,2,[81,90]},{150,1,[91,100]}]
A677: 674 | B677: 6 | C677: 6 | D677: 0 | E677: =R[-9]C -> 71 | F677: =R[-9]C -> 80 | G677: 5 | H677: 20000 | I677: 110003 | J677: 5 | K677: =R[-1]C -> [{7,3},{8,3},{9,3},{10,3},{11,3},{12,3},{17,10},{18,8},{19,1},{23,4},{24,10}] | L677: =R[-1]C -> [{7,27},{8,55},{9,27},{10,55},{11,27},{12,55},{17,18},{18,110},{19,3},{23,37},{24,37}] | M677: =R[-1]C -> [{0,1,[1,30]},{1,2,[11,40]},{2,5,[21,50]},{5,10,[31,60]},{10,20,[41,60]},{30,20,[51,70]},{50,10,[61,80]},{70,5,[71,80]},{100,2,[81,90]},{150,1,[91,100]}]
A678: 675 | B678: 6 | C678: 6 | D678: 0 | E678: =R[-9]C -> 81 | F678: =R[-9]C -> 90 | G678: 5 | H678: 20000 | I678: 110003 | J678: 5 | K678: =R[-1]C -> [{7,3},{8,3},{9,3},{10,3},{11,3},{12,3},{17,10},{18,8},{19,1},{23,4},{24,10}] | L678: =R[-1]C -> [{7,27},{8,55},{9,27},{10,55},{11,27},{12,55},{17,18},{18,110},{19,3},{23,37},{24,37}] | M678: =R[-1]C -> [{0,1,[1,30]},{1,2,[11,40]},{2,5,[21,50]},{5,10,[31,60]},{10,20,[41,60]},{30,20,[51,70]},{50,10,[61,80]},{70,5,[71,80]},{100,2,[81,90]},{150,1,[91,100]}]
A679: 676 | B679: 2 | C679: 7 | D679: 0 | E679: =R[-18]C -> 1 | F679: =R[-18]C -> 10 | G679: 1 | H679: 5000 | I679: 110003 | J679: 1 | K679: =R[-1]C -> [{7,3},{8,3},{9,3},{10,3},{11,3},{12,3},{17,10},{18,8},{19,1},{23,4},{24,10}] | L679: =R[-1]C -> [{7,27},{8,55},{9,27},{10,55},{11,27},{12,55},{17,18},{18,110},{19,3},{23,37},{24,37}] | M679: =R[-1]C -> [{0,1,[1,30]},{1,2,[11,40]},{2,5,[21,50]},{5,10,[31,60]},{10,20,[41,60]},{30,20,[51,70]},{50,10,[61,80]},{70,5,[71,80]},{100,2,[81,90]},{150,1,[91,100]}]
A680: 677 | B680: 2 | C680: 7 | D680: 0 | E680: =R[-18]C -> 11 | F680: =R[-18]C -> 20 | G680: 1 | H680: 5000 | I680: 110003 | J680: 1 | K680: =R[-1]C -> [{7,3},{8,3},{9,3},{10,3},{11,3},{12,3},{17,10},{18,8},{19,1},{23,4},{24,10}] | L680: =R[-1]C -> [{7,27},{8,55},{9,27},{10,55},{11,27},{12,55},{17,18},{18,110},{19,3},{23,37},{24,37}] | M680: =R[-1]C -> [{0,1,[1,30]},{1,2,[11,40]},{2,5,[21,50]},{5,10,[31,60]},{10,20,[41,60]},{30,20,[51,70]},{50,10,[61,80]},{70,5,[71,80]},{100,2,[81,90]},{150,1,[91,100]}]
A681: 678 | B681: 2 | C681: 7 | D681: 0 | E681: =R[-18]C -> 21 | F681: =R[-18]C -> 30 | G681: 1 | H681: 5000 | I681: 110003 | J681: 1 | K681: =R[-1]C -> [{7,3},{8,3},{9,3},{10,3},{11,3},{12,3},{17,10},{18,8},{19,1},{23,4},{24,10}] | L681: =R[-1]C -> [{7,27},{8,55},{9,27},{10,55},{11,27},{12,55},{17,18},{18,110},{19,3},{23,37},{24,37}] | M681: =R[-1]C -> [{0,1,[1,30]},{1,2,[11,40]},{2,5,[21,50]},{5,10,[31,60]},{10,20,[41,60]},{30,20,[51,70]},{50,10,[61,80]},{70,5,[71,80]},{100,2,[81,90]},{150,1,[91,100]}]
A682: 679 | B682: 2 | C682: 7 | D682: 0 | E682: =R[-18]C -> 31 | F682: =R[-18]C -> 40 | G682: 1 | H682: 5000 | I682: 110003 | J682: 1 | K682: =R[-1]C -> [{7,3},{8,3},{9,3},{10,3},{11,3},{12,3},{17,10},{18,8},{19,1},{23,4},{24,10}] | L682: =R[-1]C -> [{7,27},{8,55},{9,27},{10,55},{11,27},{12,55},{17,18},{18,110},{19,3},{23,37},{24,37}] | M682: =R[-1]C -> [{0,1,[1,30]},{1,2,[11,40]},{2,5,[21,50]},{5,10,[31,60]},{10,20,[41,60]},{30,20,[51,70]},{50,10,[61,80]},{70,5,[71,80]},{100,2,[81,90]},{150,1,[91,100]}]
A683: 680 | B683: 2 | C683: 7 | D683: 0 | E683: =R[-18]C -> 41 | F683: =R[-18]C -> 50 | G683: 1 | H683: 5000 | I683: 110003 | J683: 1 | K683: =R[-1]C -> [{7,3},{8,3},{9,3},{10,3},{11,3},{12,3},{17,10},{18,8},{19,1},{23,4},{24,10}] | L683: =R[-1]C -> [{7,27},{8,55},{9,27},{10,55},{11,27},{12,55},{17,18},{18,110},{19,3},{23,37},{24,37}] | M683: =R[-1]C -> [{0,1,[1,30]},{1,2,[11,40]},{2,5,[21,50]},{5,10,[31,60]},{10,20,[41,60]},{30,20,[51,70]},{50,10,[61,80]},{70,5,[71,80]},{100,2,[81,90]},{150,1,[91,100]}]
A684: 681 | B684: 2 | C684: 7 | D684: 0 | E684: =R[-18]C -> 51 | F684: =R[-18]C -> 60 | G684: 1 | H684: 5000 | I684: 110003 | J684: 1 | K684: =R[-1]C -> [{7,3},{8,3},{9,3},{10,3},{11,3},{12,3},{17,10},{18,8},{19,1},{23,4},{24,10}] | L684: =R[-1]C -> [{7,27},{8,55},{9,27},{10,55},{11,27},{12,55},{17,18},{18,110},{19,3},{23,37},{24,37}] | M684: =R[-1]C -> [{0,1,[1,30]},{1,2,[11,40]},{2,5,[21,50]},{5,10,[31,60]},{10,20,[41,60]},{30,20,[51,70]},{50,10,[61,80]},{70,5,[71,80]},{100,2,[81,90]},{150,1,[91,100]}]
A685: 682 | B685: 2 | C685: 7 | D685: 0 | E685: =R[-18]C -> 61 | F685: =R[-18]C -> 70 | G685: 1 | H685: 5000 | I685: 110003 | J685: 1 | K685: =R[-1]C -> [{7,3},{8,3},{9,3},{10,3},{11,3},{12,3},{17,10},{18,8},{19,1},{23,4},{24,10}] | L685: =R[-1]C -> [{7,27},{8,55},{9,27},{10,55},{11,27},{12,55},{17,18},{18,110},{19,3},{23,37},{24,37}] | M685: =R[-1]C -> [{0,1,[1,30]},{1,2,[11,40]},{2,5,[21,50]},{5,10,[31,60]},{10,20,[41,60]},{30,20,[51,70]},{50,10,[61,80]},{70,5,[71,80]},{100,2,[81,90]},{150,1,[91,100]}]
A686: 683 | B686: 2 | C686: 7 | D686: 0 | E686: =R[-18]C -> 71 | F686: =R[-18]C -> 80 | G686: 1 | H686: 5000 | I686: 110003 | J686: 1 | K686: =R[-1]C -> [{7,3},{8,3},{9,3},{10,3},{11,3},{12,3},{17,10},{18,8},{19,1},{23,4},{24,10}] | L686: =R[-1]C -> [{7,27},{8,55},{9,27},{10,55},{11,27},{12,55},{17,18},{18,110},{19,3},{23,37},{24,37}] | M686: =R[-1]C -> [{0,1,[1,30]},{1,2,[11,40]},{2,5,[21,50]},{5,10,[31,60]},{10,20,[41,60]},{30,20,[51,70]},{50,10,[61,80]},{70,5,[71,80]},{100,2,[81,90]},{150,1,[91,100]}]
A687: 684 | B687: 2 | C687: 7 | D687: 0 | E687: =R[-18]C -> 81 | F687: =R[-18]C -> 90 | G687: 1 | H687: 5000 | I687: 110003 | J687: 1 | K687: =R[-1]C -> [{7,3},{8,3},{9,3},{10,3},{11,3},{12,3},{17,10},{18,8},{19,1},{23,4},{24,10}] | L687: =R[-1]C -> [{7,27},{8,55},{9,27},{10,55},{11,27},{12,55},{17,18},{18,110},{19,3},{23,37},{24,37}] | M687: =R[-1]C -> [{0,1,[1,30]},{1,2,[11,40]},{2,5,[21,50]},{5,10,[31,60]},{10,20,[41,60]},{30,20,[51,70]},{50,10,[61,80]},{70,5,[71,80]},{100,2,[81,90]},{150,1,[91,100]}]
A688: 685 | B688: 3 | C688: 7 | D688: 0 | E688: =R[-9]C -> 1 | F688: =R[-9]C -> 10 | G688: 2 | H688: 10000 | I688: 110003 | J688: 2 | K688: =R[-1]C -> [{7,3},{8,3},{9,3},{10,3},{11,3},{12,3},{17,10},{18,8},{19,1},{23,4},{24,10}] | L688: =R[-1]C -> [{7,27},{8,55},{9,27},{10,55},{11,27},{12,55},{17,18},{18,110},{19,3},{23,37},{24,37}] | M688: =R[-1]C -> [{0,1,[1,30]},{1,2,[11,40]},{2,5,[21,50]},{5,10,[31,60]},{10,20,[41,60]},{30,20,[51,70]},{50,10,[61,80]},{70,5,[71,80]},{100,2,[81,90]},{150,1,[91,100]}]
A689: 686 | B689: 3 | C689: 7 | D689: 0 | E689: =R[-9]C -> 11 | F689: =R[-9]C -> 20 | G689: 2 | H689: 10000 | I689: 110003 | J689: 2 | K689: =R[-1]C -> [{7,3},{8,3},{9,3},{10,3},{11,3},{12,3},{17,10},{18,8},{19,1},{23,4},{24,10}] | L689: =R[-1]C -> [{7,27},{8,55},{9,27},{10,55},{11,27},{12,55},{17,18},{18,110},{19,3},{23,37},{24,37}] | M689: =R[-1]C -> [{0,1,[1,30]},{1,2,[11,40]},{2,5,[21,50]},{5,10,[31,60]},{10,20,[41,60]},{30,20,[51,70]},{50,10,[61,80]},{70,5,[71,80]},{100,2,[81,90]},{150,1,[91,100]}]
A690: 687 | B690: 3 | C690: 7 | D690: 0 | E690: =R[-9]C -> 21 | F690: =R[-9]C -> 30 | G690: 2 | H690: 10000 | I690: 110003 | J690: 2 | K690: =R[-1]C -> [{7,3},{8,3},{9,3},{10,3},{11,3},{12,3},{17,10},{18,8},{19,1},{23,4},{24,10}] | L690: =R[-1]C -> [{7,27},{8,55},{9,27},{10,55},{11,27},{12,55},{17,18},{18,110},{19,3},{23,37},{24,37}] | M690: =R[-1]C -> [{0,1,[1,30]},{1,2,[11,40]},{2,5,[21,50]},{5,10,[31,60]},{10,20,[41,60]},{30,20,[51,70]},{50,10,[61,80]},{70,5,[71,80]},{100,2,[81,90]},{150,1,[91,100]}]
A691: 688 | B691: 3 | C691: 7 | D691: 0 | E691: =R[-9]C -> 31 | F691: =R[-9]C -> 40 | G691: 2 | H691: 10000 | I691: 110003 | J691: 2 | K691: =R[-1]C -> [{7,3},{8,3},{9,3},{10,3},{11,3},{12,3},{17,10},{18,8},{19,1},{23,4},{24,10}] | L691: =R[-1]C -> [{7,27},{8,55},{9,27},{10,55},{11,27},{12,55},{17,18},{18,110},{19,3},{23,37},{24,37}] | M691: =R[-1]C -> [{0,1,[1,30]},{1,2,[11,40]},{2,5,[21,50]},{5,10,[31,60]},{10,20,[41,60]},{30,20,[51,70]},{50,10,[61,80]},{70,5,[71,80]},{100,2,[81,90]},{150,1,[91,100]}]
A692: 689 | B692: 3 | C692: 7 | D692: 0 | E692: =R[-9]C -> 41 | F692: =R[-9]C -> 50 | G692: 2 | H692: 10000 | I692: 110003 | J692: 2 | K692: =R[-1]C -> [{7,3},{8,3},{9,3},{10,3},{11,3},{12,3},{17,10},{18,8},{19,1},{23,4},{24,10}] | L692: =R[-1]C -> [{7,27},{8,55},{9,27},{10,55},{11,27},{12,55},{17,18},{18,110},{19,3},{23,37},{24,37}] | M692: =R[-1]C -> [{0,1,[1,30]},{1,2,[11,40]},{2,5,[21,50]},{5,10,[31,60]},{10,20,[41,60]},{30,20,[51,70]},{50,10,[61,80]},{70,5,[71,80]},{100,2,[81,90]},{150,1,[91,100]}]
A693: 690 | B693: 3 | C693: 7 | D693: 0 | E693: =R[-9]C -> 51 | F693: =R[-9]C -> 60 | G693: 2 | H693: 10000 | I693: 110003 | J693: 2 | K693: =R[-1]C -> [{7,3},{8,3},{9,3},{10,3},{11,3},{12,3},{17,10},{18,8},{19,1},{23,4},{24,10}] | L693: =R[-1]C -> [{7,27},{8,55},{9,27},{10,55},{11,27},{12,55},{17,18},{18,110},{19,3},{23,37},{24,37}] | M693: =R[-1]C -> [{0,1,[1,30]},{1,2,[11,40]},{2,5,[21,50]},{5,10,[31,60]},{10,20,[41,60]},{30,20,[51,70]},{50,10,[61,80]},{70,5,[71,80]},{100,2,[81,90]},{150,1,[91,100]}]
A694: 691 | B694: 3 | C694: 7 | D694: 0 | E694: =R[-9]C -> 61 | F694: =R[-9]C -> 70 | G694: 2 | H694: 10000 | I694: 110003 | J694: 2 | K694: =R[-1]C -> [{7,3},{8,3},{9,3},{10,3},{11,3},{12,3},{17,10},{18,8},{19,1},{23,4},{24,10}] | L694: =R[-1]C -> [{7,27},{8,55},{9,27},{10,55},{11,27},{12,55},{17,18},{18,110},{19,3},{23,37},{24,37}] | M694: =R[-1]C -> [{0,1,[1,30]},{1,2,[11,40]},{2,5,[21,50]},{5,10,[31,60]},{10,20,[41,60]},{30,20,[51,70]},{50,10,[61,80]},{70,5,[71,80]},{100,2,[81,90]},{150,1,[91,100]}]
A695: 692 | B695: 3 | C695: 7 | D695: 0 | E695: =R[-9]C -> 71 | F695: =R[-9]C -> 80 | G695: 2 | H695: 10000 | I695: 110003 | J695: 2 | K695: =R[-1]C -> [{7,3},{8,3},{9,3},{10,3},{11,3},{12,3},{17,10},{18,8},{19,1},{23,4},{24,10}] | L695: =R[-1]C -> [{7,27},{8,55},{9,27},{10,55},{11,27},{12,55},{17,18},{18,110},{19,3},{23,37},{24,37}] | M695: =R[-1]C -> [{0,1,[1,30]},{1,2,[11,40]},{2,5,[21,50]},{5,10,[31,60]},{10,20,[41,60]},{30,20,[51,70]},{50,10,[61,80]},{70,5,[71,80]},{100,2,[81,90]},{150,1,[91,100]}]
A696: 693 | B696: 3 | C696: 7 | D696: 0 | E696: =R[-9]C -> 81 | F696: =R[-9]C -> 90 | G696: 2 | H696: 10000 | I696: 110003 | J696: 2 | K696: =R[-1]C -> [{7,3},{8,3},{9,3},{10,3},{11,3},{12,3},{17,10},{18,8},{19,1},{23,4},{24,10}] | L696: =R[-1]C -> [{7,27},{8,55},{9,27},{10,55},{11,27},{12,55},{17,18},{18,110},{19,3},{23,37},{24,37}] | M696: =R[-1]C -> [{0,1,[1,30]},{1,2,[11,40]},{2,5,[21,50]},{5,10,[31,60]},{10,20,[41,60]},{30,20,[51,70]},{50,10,[61,80]},{70,5,[71,80]},{100,2,[81,90]},{150,1,[91,100]}]
A697: 694 | B697: 4 | C697: 7 | D697: 0 | E697: =R[-9]C -> 1 | F697: =R[-9]C -> 10 | G697: 3 | H697: 15000 | I697: 110003 | J697: 3 | K697: =R[-1]C -> [{7,3},{8,3},{9,3},{10,3},{11,3},{12,3},{17,10},{18,8},{19,1},{23,4},{24,10}] | L697: =R[-1]C -> [{7,27},{8,55},{9,27},{10,55},{11,27},{12,55},{17,18},{18,110},{19,3},{23,37},{24,37}] | M697: =R[-1]C -> [{0,1,[1,30]},{1,2,[11,40]},{2,5,[21,50]},{5,10,[31,60]},{10,20,[41,60]},{30,20,[51,70]},{50,10,[61,80]},{70,5,[71,80]},{100,2,[81,90]},{150,1,[91,100]}]
A698: 695 | B698: 4 | C698: 7 | D698: 0 | E698: =R[-9]C -> 11 | F698: =R[-9]C -> 20 | G698: 3 | H698: 15000 | I698: 110003 | J698: 3 | K698: =R[-1]C -> [{7,3},{8,3},{9,3},{10,3},{11,3},{12,3},{17,10},{18,8},{19,1},{23,4},{24,10}] | L698: =R[-1]C -> [{7,27},{8,55},{9,27},{10,55},{11,27},{12,55},{17,18},{18,110},{19,3},{23,37},{24,37}] | M698: =R[-1]C -> [{0,1,[1,30]},{1,2,[11,40]},{2,5,[21,50]},{5,10,[31,60]},{10,20,[41,60]},{30,20,[51,70]},{50,10,[61,80]},{70,5,[71,80]},{100,2,[81,90]},{150,1,[91,100]}]
A699: 696 | B699: 4 | C699: 7 | D699: 0 | E699: =R[-9]C -> 21 | F699: =R[-9]C -> 30 | G699: 3 | H699: 15000 | I699: 110003 | J699: 3 | K699: =R[-1]C -> [{7,3},{8,3},{9,3},{10,3},{11,3},{12,3},{17,10},{18,8},{19,1},{23,4},{24,10}] | L699: =R[-1]C -> [{7,27},{8,55},{9,27},{10,55},{11,27},{12,55},{17,18},{18,110},{19,3},{23,37},{24,37}] | M699: =R[-1]C -> [{0,1,[1,30]},{1,2,[11,40]},{2,5,[21,50]},{5,10,[31,60]},{10,20,[41,60]},{30,20,[51,70]},{50,10,[61,80]},{70,5,[71,80]},{100,2,[81,90]},{150,1,[91,100]}]
A700: 697 | B700: 4 | C700: 7 | D700: 0 | E700: =R[-9]C -> 31 | F700: =R[-9]C -> 40 | G700: 3 | H700: 15000 | I700: 110003 | J700: 3 | K700: =R[-1]C -> [{7,3},{8,3},{9,3},{10,3},{11,3},{12,3},{17,10},{18,8},{19,1},{23,4},{24,10}] | L700: =R[-1]C -> [{7,27},{8,55},{9,27},{10,55},{11,27},{12,55},{17,18},{18,110},{19,3},{23,37},{24,37}] | M700: =R[-1]C -> [{0,1,[1,30]},{1,2,[11,40]},{2,5,[21,50]},{5,10,[31,60]},{10,20,[41,60]},{30,20,[51,70]},{50,10,[61,80]},{70,5,[71,80]},{100,2,[81,90]},{150,1,[91,100]}]
A701: 698 | B701: 4 | C701: 7 | D701: 0 | E701: =R[-9]C -> 41 | F701: =R[-9]C -> 50 | G701: 3 | H701: 15000 | I701: 110003 | J701: 3 | K701: =R[-1]C -> [{7,3},{8,3},{9,3},{10,3},{11,3},{12,3},{17,10},{18,8},{19,1},{23,4},{24,10}] | L701: =R[-1]C -> [{7,27},{8,55},{9,27},{10,55},{11,27},{12,55},{17,18},{18,110},{19,3},{23,37},{24,37}] | M701: =R[-1]C -> [{0,1,[1,30]},{1,2,[11,40]},{2,5,[21,50]},{5,10,[31,60]},{10,20,[41,60]},{30,20,[51,70]},{50,10,[61,80]},{70,5,[71,80]},{100,2,[81,90]},{150,1,[91,100]}]
A702: 699 | B702: 4 | C702: 7 | D702: 0 | E702: =R[-9]C -> 51 | F702: =R[-9]C -> 60 | G702: 3 | H702: 15000 | I702: 110003 | J702: 3 | K702: =R[-1]C -> [{7,3},{8,3},{9,3},{10,3},{11,3},{12,3},{17,10},{18,8},{19,1},{23,4},{24,10}] | L702: =R[-1]C -> [{7,27},{8,55},{9,27},{10,55},{11,27},{12,55},{17,18},{18,110},{19,3},{23,37},{24,37}] | M702: =R[-1]C -> [{0,1,[1,30]},{1,2,[11,40]},{2,5,[21,50]},{5,10,[31,60]},{10,20,[41,60]},{30,20,[51,70]},{50,10,[61,80]},{70,5,[71,80]},{100,2,[81,90]},{150,1,[91,100]}]
A703: 700 | B703: 4 | C703: 7 | D703: 0 | E703: =R[-9]C -> 61 | F703: =R[-9]C -> 70 | G703: 3 | H703: 15000 | I703: 110003 | J703: 3 | K703: =R[-1]C -> [{7,3},{8,3},{9,3},{10,3},{11,3},{12,3},{17,10},{18,8},{19,1},{23,4},{24,10}] | L703: =R[-1]C -> [{7,27},{8,55},{9,27},{10,55},{11,27},{12,55},{17,18},{18,110},{19,3},{23,37},{24,37}] | M703: =R[-1]C -> [{0,1,[1,30]},{1,2,[11,40]},{2,5,[21,50]},{5,10,[31,60]},{10,20,[41,60]},{30,20,[51,70]},{50,10,[61,80]},{70,5,[71,80]},{100,2,[81,90]},{150,1,[91,100]}]
A704: 701 | B704: 4 | C704: 7 | D704: 0 | E704: =R[-9]C -> 71 | F704: =R[-9]C -> 80 | G704: 3 | H704: 15000 | I704: 110003 | J704: 3 | K704: =R[-1]C -> [{7,3},{8,3},{9,3},{10,3},{11,3},{12,3},{17,10},{18,8},{19,1},{23,4},{24,10}] | L704: =R[-1]C -> [{7,27},{8,55},{9,27},{10,55},{11,27},{12,55},{17,18},{18,110},{19,3},{23,37},{24,37}] | M704: =R[-1]C -> [{0,1,[1,30]},{1,2,[11,40]},{2,5,[21,50]},{5,10,[31,60]},{10,20,[41,60]},{30,20,[51,70]},{50,10,[61,80]},{70,5,[71,80]},{100,2,[81,90]},{150,1,[91,100]}]
A705: 702 | B705: 4 | C705: 7 | D705: 0 | E705: =R[-9]C -> 81 | F705: =R[-9]C -> 90 | G705: 3 | H705: 15000 | I705: 110003 | J705: 3 | K705: =R[-1]C -> [{7,3},{8,3},{9,3},{10,3},{11,3},{12,3},{17,10},{18,8},{19,1},{23,4},{24,10}] | L705: =R[-1]C -> [{7,27},{8,55},{9,27},{10,55},{11,27},{12,55},{17,18},{18,110},{19,3},{23,37},{24,37}] | M705: =R[-1]C -> [{0,1,[1,30]},{1,2,[11,40]},{2,5,[21,50]},{5,10,[31,60]},{10,20,[41,60]},{30,20,[51,70]},{50,10,[61,80]},{70,5,[71,80]},{100,2,[81,90]},{150,1,[91,100]}]
A706: 703 | B706: 5 | C706: 7 | D706: 0 | E706: =R[-9]C -> 1 | F706: =R[-9]C -> 10 | G706: 4 | H706: 20000 | I706: 110003 | J706: 4 | K706: =R[-1]C -> [{7,3},{8,3},{9,3},{10,3},{11,3},{12,3},{17,10},{18,8},{19,1},{23,4},{24,10}] | L706: =R[-1]C -> [{7,27},{8,55},{9,27},{10,55},{11,27},{12,55},{17,18},{18,110},{19,3},{23,37},{24,37}] | M706: =R[-1]C -> [{0,1,[1,30]},{1,2,[11,40]},{2,5,[21,50]},{5,10,[31,60]},{10,20,[41,60]},{30,20,[51,70]},{50,10,[61,80]},{70,5,[71,80]},{100,2,[81,90]},{150,1,[91,100]}]
A707: 704 | B707: 5 | C707: 7 | D707: 0 | E707: =R[-9]C -> 11 | F707: =R[-9]C -> 20 | G707: 4 | H707: 20000 | I707: 110003 | J707: 4 | K707: =R[-1]C -> [{7,3},{8,3},{9,3},{10,3},{11,3},{12,3},{17,10},{18,8},{19,1},{23,4},{24,10}] | L707: =R[-1]C -> [{7,27},{8,55},{9,27},{10,55},{11,27},{12,55},{17,18},{18,110},{19,3},{23,37},{24,37}] | M707: =R[-1]C -> [{0,1,[1,30]},{1,2,[11,40]},{2,5,[21,50]},{5,10,[31,60]},{10,20,[41,60]},{30,20,[51,70]},{50,10,[61,80]},{70,5,[71,80]},{100,2,[81,90]},{150,1,[91,100]}]
A708: 705 | B708: 5 | C708: 7 | D708: 0 | E708: =R[-9]C -> 21 | F708: =R[-9]C -> 30 | G708: 4 | H708: 20000 | I708: 110003 | J708: 4 | K708: =R[-1]C -> [{7,3},{8,3},{9,3},{10,3},{11,3},{12,3},{17,10},{18,8},{19,1},{23,4},{24,10}] | L708: =R[-1]C -> [{7,27},{8,55},{9,27},{10,55},{11,27},{12,55},{17,18},{18,110},{19,3},{23,37},{24,37}] | M708: =R[-1]C -> [{0,1,[1,30]},{1,2,[11,40]},{2,5,[21,50]},{5,10,[31,60]},{10,20,[41,60]},{30,20,[51,70]},{50,10,[61,80]},{70,5,[71,80]},{100,2,[81,90]},{150,1,[91,100]}]
A709: 706 | B709: 5 | C709: 7 | D709: 0 | E709: =R[-9]C -> 31 | F709: =R[-9]C -> 40 | G709: 4 | H709: 20000 | I709: 110003 | J709: 4 | K709: =R[-1]C -> [{7,3},{8,3},{9,3},{10,3},{11,3},{12,3},{17,10},{18,8},{19,1},{23,4},{24,10}] | L709: =R[-1]C -> [{7,27},{8,55},{9,27},{10,55},{11,27},{12,55},{17,18},{18,110},{19,3},{23,37},{24,37}] | M709: =R[-1]C -> [{0,1,[1,30]},{1,2,[11,40]},{2,5,[21,50]},{5,10,[31,60]},{10,20,[41,60]},{30,20,[51,70]},{50,10,[61,80]},{70,5,[71,80]},{100,2,[81,90]},{150,1,[91,100]}]
A710: 707 | B710: 5 | C710: 7 | D710: 0 | E710: =R[-9]C -> 41 | F710: =R[-9]C -> 50 | G710: 4 | H710: 20000 | I710: 110003 | J710: 4 | K710: =R[-1]C -> [{7,3},{8,3},{9,3},{10,3},{11,3},{12,3},{17,10},{18,8},{19,1},{23,4},{24,10}] | L710: =R[-1]C -> [{7,27},{8,55},{9,27},{10,55},{11,27},{12,55},{17,18},{18,110},{19,3},{23,37},{24,37}] | M710: =R[-1]C -> [{0,1,[1,30]},{1,2,[11,40]},{2,5,[21,50]},{5,10,[31,60]},{10,20,[41,60]},{30,20,[51,70]},{50,10,[61,80]},{70,5,[71,80]},{100,2,[81,90]},{150,1,[91,100]}]
A711: 708 | B711: 5 | C711: 7 | D711: 0 | E711: =R[-9]C -> 51 | F711: =R[-9]C -> 60 | G711: 4 | H711: 20000 | I711: 110003 | J711: 4 | K711: =R[-1]C -> [{7,3},{8,3},{9,3},{10,3},{11,3},{12,3},{17,10},{18,8},{19,1},{23,4},{24,10}] | L711: =R[-1]C -> [{7,27},{8,55},{9,27},{10,55},{11,27},{12,55},{17,18},{18,110},{19,3},{23,37},{24,37}] | M711: =R[-1]C -> [{0,1,[1,30]},{1,2,[11,40]},{2,5,[21,50]},{5,10,[31,60]},{10,20,[41,60]},{30,20,[51,70]},{50,10,[61,80]},{70,5,[71,80]},{100,2,[81,90]},{150,1,[91,100]}]
A712: 709 | B712: 5 | C712: 7 | D712: 0 | E712: =R[-9]C -> 61 | F712: =R[-9]C -> 70 | G712: 4 | H712: 20000 | I712: 110003 | J712: 4 | K712: =R[-1]C -> [{7,3},{8,3},{9,3},{10,3},{11,3},{12,3},{17,10},{18,8},{19,1},{23,4},{24,10}] | L712: =R[-1]C -> [{7,27},{8,55},{9,27},{10,55},{11,27},{12,55},{17,18},{18,110},{19,3},{23,37},{24,37}] | M712: =R[-1]C -> [{0,1,[1,30]},{1,2,[11,40]},{2,5,[21,50]},{5,10,[31,60]},{10,20,[41,60]},{30,20,[51,70]},{50,10,[61,80]},{70,5,[71,80]},{100,2,[81,90]},{150,1,[91,100]}]
A713: 710 | B713: 5 | C713: 7 | D713: 0 | E713: =R[-9]C -> 71 | F713: =R[-9]C -> 80 | G713: 4 | H713: 20000 | I713: 110003 | J713: 4 | K713: =R[-1]C -> [{7,3},{8,3},{9,3},{10,3},{11,3},{12,3},{17,10},{18,8},{19,1},{23,4},{24,10}] | L713: =R[-1]C -> [{7,27},{8,55},{9,27},{10,55},{11,27},{12,55},{17,18},{18,110},{19,3},{23,37},{24,37}] | M713: =R[-1]C -> [{0,1,[1,30]},{1,2,[11,40]},{2,5,[21,50]},{5,10,[31,60]},{10,20,[41,60]},{30,20,[51,70]},{50,10,[61,80]},{70,5,[71,80]},{100,2,[81,90]},{150,1,[91,100]}]
A714: 711 | B714: 5 | C714: 7 | D714: 0 | E714: =R[-9]C -> 81 | F714: =R[-9]C -> 90 | G714: 4 | H714: 20000 | I714: 110003 | J714: 4 | K714: =R[-1]C -> [{7,3},{8,3},{9,3},{10,3},{11,3},{12,3},{17,10},{18,8},{19,1},{23,4},{24,10}] | L714: =R[-1]C -> [{7,27},{8,55},{9,27},{10,55},{11,27},{12,55},{17,18},{18,110},{19,3},{23,37},{24,37}] | M714: =R[-1]C -> [{0,1,[1,30]},{1,2,[11,40]},{2,5,[21,50]},{5,10,[31,60]},{10,20,[41,60]},{30,20,[51,70]},{50,10,[61,80]},{70,5,[71,80]},{100,2,[81,90]},{150,1,[91,100]}]
A715: 712 | B715: 6 | C715: 7 | D715: 0 | E715: =R[-9]C -> 1 | F715: =R[-9]C -> 10 | G715: 5 | H715: 20000 | I715: 110003 | J715: 5 | K715: =R[-1]C -> [{7,3},{8,3},{9,3},{10,3},{11,3},{12,3},{17,10},{18,8},{19,1},{23,4},{24,10}] | L715: =R[-1]C -> [{7,27},{8,55},{9,27},{10,55},{11,27},{12,55},{17,18},{18,110},{19,3},{23,37},{24,37}] | M715: =R[-1]C -> [{0,1,[1,30]},{1,2,[11,40]},{2,5,[21,50]},{5,10,[31,60]},{10,20,[41,60]},{30,20,[51,70]},{50,10,[61,80]},{70,5,[71,80]},{100,2,[81,90]},{150,1,[91,100]}]
A716: 713 | B716: 6 | C716: 7 | D716: 0 | E716: =R[-9]C -> 11 | F716: =R[-9]C -> 20 | G716: 5 | H716: 20000 | I716: 110003 | J716: 5 | K716: =R[-1]C -> [{7,3},{8,3},{9,3},{10,3},{11,3},{12,3},{17,10},{18,8},{19,1},{23,4},{24,10}] | L716: =R[-1]C -> [{7,27},{8,55},{9,27},{10,55},{11,27},{12,55},{17,18},{18,110},{19,3},{23,37},{24,37}] | M716: =R[-1]C -> [{0,1,[1,30]},{1,2,[11,40]},{2,5,[21,50]},{5,10,[31,60]},{10,20,[41,60]},{30,20,[51,70]},{50,10,[61,80]},{70,5,[71,80]},{100,2,[81,90]},{150,1,[91,100]}]
A717: 714 | B717: 6 | C717: 7 | D717: 0 | E717: =R[-9]C -> 21 | F717: =R[-9]C -> 30 | G717: 5 | H717: 20000 | I717: 110003 | J717: 5 | K717: =R[-1]C -> [{7,3},{8,3},{9,3},{10,3},{11,3},{12,3},{17,10},{18,8},{19,1},{23,4},{24,10}] | L717: =R[-1]C -> [{7,27},{8,55},{9,27},{10,55},{11,27},{12,55},{17,18},{18,110},{19,3},{23,37},{24,37}] | M717: =R[-1]C -> [{0,1,[1,30]},{1,2,[11,40]},{2,5,[21,50]},{5,10,[31,60]},{10,20,[41,60]},{30,20,[51,70]},{50,10,[61,80]},{70,5,[71,80]},{100,2,[81,90]},{150,1,[91,100]}]
A718: 715 | B718: 6 | C718: 7 | D718: 0 | E718: =R[-9]C -> 31 | F718: =R[-9]C -> 40 | G718: 5 | H718: 20000 | I718: 110003 | J718: 5 | K718: =R[-1]C -> [{7,3},{8,3},{9,3},{10,3},{11,3},{12,3},{17,10},{18,8},{19,1},{23,4},{24,10}] | L718: =R[-1]C -> [{7,27},{8,55},{9,27},{10,55},{11,27},{12,55},{17,18},{18,110},{19,3},{23,37},{24,37}] | M718: =R[-1]C -> [{0,1,[1,30]},{1,2,[11,40]},{2,5,[21,50]},{5,10,[31,60]},{10,20,[41,60]},{30,20,[51,70]},{50,10,[61,80]},{70,5,[71,80]},{100,2,[81,90]},{150,1,[91,100]}]
A719: 716 | B719: 6 | C719: 7 | D719: 0 | E719: =R[-9]C -> 41 | F719: =R[-9]C -> 50 | G719: 5 | H719: 20000 | I719: 110003 | J719: 5 | K719: =R[-1]C -> [{7,3},{8,3},{9,3},{10,3},{11,3},{12,3},{17,10},{18,8},{19,1},{23,4},{24,10}] | L719: =R[-1]C -> [{7,27},{8,55},{9,27},{10,55},{11,27},{12,55},{17,18},{18,110},{19,3},{23,37},{24,37}] | M719: =R[-1]C -> [{0,1,[1,30]},{1,2,[11,40]},{2,5,[21,50]},{5,10,[31,60]},{10,20,[41,60]},{30,20,[51,70]},{50,10,[61,80]},{70,5,[71,80]},{100,2,[81,90]},{150,1,[91,100]}]
A720: 717 | B720: 6 | C720: 7 | D720: 0 | E720: =R[-9]C -> 51 | F720: =R[-9]C -> 60 | G720: 5 | H720: 20000 | I720: 110003 | J720: 5 | K720: =R[-1]C -> [{7,3},{8,3},{9,3},{10,3},{11,3},{12,3},{17,10},{18,8},{19,1},{23,4},{24,10}] | L720: =R[-1]C -> [{7,27},{8,55},{9,27},{10,55},{11,27},{12,55},{17,18},{18,110},{19,3},{23,37},{24,37}] | M720: =R[-1]C -> [{0,1,[1,30]},{1,2,[11,40]},{2,5,[21,50]},{5,10,[31,60]},{10,20,[41,60]},{30,20,[51,70]},{50,10,[61,80]},{70,5,[71,80]},{100,2,[81,90]},{150,1,[91,100]}]
A721: 718 | B721: 6 | C721: 7 | D721: 0 | E721: =R[-9]C -> 61 | F721: =R[-9]C -> 70 | G721: 5 | H721: 20000 | I721: 110003 | J721: 5 | K721: =R[-1]C -> [{7,3},{8,3},{9,3},{10,3},{11,3},{12,3},{17,10},{18,8},{19,1},{23,4},{24,10}] | L721: =R[-1]C -> [{7,27},{8,55},{9,27},{10,55},{11,27},{12,55},{17,18},{18,110},{19,3},{23,37},{24,37}] | M721: =R[-1]C -> [{0,1,[1,30]},{1,2,[11,40]},{2,5,[21,50]},{5,10,[31,60]},{10,20,[41,60]},{30,20,[51,70]},{50,10,[61,80]},{70,5,[71,80]},{100,2,[81,90]},{150,1,[91,100]}]
A722: 719 | B722: 6 | C722: 7 | D722: 0 | E722: =R[-9]C -> 71 | F722: =R[-9]C -> 80 | G722: 5 | H722: 20000 | I722: 110003 | J722: 5 | K722: =R[-1]C -> [{7,3},{8,3},{9,3},{10,3},{11,3},{12,3},{17,10},{18,8},{19,1},{23,4},{24,10}] | L722: =R[-1]C -> [{7,27},{8,55},{9,27},{10,55},{11,27},{12,55},{17,18},{18,110},{19,3},{23,37},{24,37}] | M722: =R[-1]C -> [{0,1,[1,30]},{1,2,[11,40]},{2,5,[21,50]},{5,10,[31,60]},{10,20,[41,60]},{30,20,[51,70]},{50,10,[61,80]},{70,5,[71,80]},{100,2,[81,90]},{150,1,[91,100]}]
A723: 720 | B723: 6 | C723: 7 | D723: 0 | E723: =R[-9]C -> 81 | F723: =R[-9]C -> 90 | G723: 5 | H723: 20000 | I723: 110003 | J723: 5 | K723: =R[-1]C -> [{7,3},{8,3},{9,3},{10,3},{11,3},{12,3},{17,10},{18,8},{19,1},{23,4},{24,10}] | L723: =R[-1]C -> [{7,27},{8,55},{9,27},{10,55},{11,27},{12,55},{17,18},{18,110},{19,3},{23,37},{24,37}] | M723: =R[-1]C -> [{0,1,[1,30]},{1,2,[11,40]},{2,5,[21,50]},{5,10,[31,60]},{10,20,[41,60]},{30,20,[51,70]},{50,10,[61,80]},{70,5,[71,80]},{100,2,[81,90]},{150,1,[91,100]}]
A724: 721 | B724: 2 | C724: 1 | D724: 0 | E724: 1 | F724: 10 | G724: 1 | H724: 5000 | I724: 110003 | J724: 1 | K724: =R[-1]C -> [{7,3},{8,3},{9,3},{10,3},{11,3},{12,3},{17,10},{18,8},{19,1},{23,4},{24,10}] | L724: =R[-1]C -> [{7,27},{8,55},{9,27},{10,55},{11,27},{12,55},{17,18},{18,110},{19,3},{23,37},{24,37}] | M724: =R[-1]C -> [{0,1,[1,30]},{1,2,[11,40]},{2,5,[21,50]},{5,10,[31,60]},{10,20,[41,60]},{30,20,[51,70]},{50,10,[61,80]},{70,5,[71,80]},{100,2,[81,90]},{150,1,[91,100]}]
A725: 722 | B725: 2 | C725: 1 | D725: 0 | E725: =R[-1]C+10 -> 11 | F725: =R[-1]C+10 -> 20 | G725: 1 | H725: 5000 | I725: 110003 | J725: 1 | K725: =R[-1]C -> [{7,3},{8,3},{9,3},{10,3},{11,3},{12,3},{17,10},{18,8},{19,1},{23,4},{24,10}] | L725: =R[-1]C -> [{7,27},{8,55},{9,27},{10,55},{11,27},{12,55},{17,18},{18,110},{19,3},{23,37},{24,37}] | M725: =R[-1]C -> [{0,1,[1,30]},{1,2,[11,40]},{2,5,[21,50]},{5,10,[31,60]},{10,20,[41,60]},{30,20,[51,70]},{50,10,[61,80]},{70,5,[71,80]},{100,2,[81,90]},{150,1,[91,100]}]
A726: 723 | B726: 2 | C726: 1 | D726: 0 | E726: =R[-1]C+10 -> 21 | F726: =R[-1]C+10 -> 30 | G726: 1 | H726: 5000 | I726: 110003 | J726: 1 | K726: =R[-1]C -> [{7,3},{8,3},{9,3},{10,3},{11,3},{12,3},{17,10},{18,8},{19,1},{23,4},{24,10}] | L726: =R[-1]C -> [{7,27},{8,55},{9,27},{10,55},{11,27},{12,55},{17,18},{18,110},{19,3},{23,37},{24,37}] | M726: =R[-1]C -> [{0,1,[1,30]},{1,2,[11,40]},{2,5,[21,50]},{5,10,[31,60]},{10,20,[41,60]},{30,20,[51,70]},{50,10,[61,80]},{70,5,[71,80]},{100,2,[81,90]},{150,1,[91,100]}]
A727: 724 | B727: 2 | C727: 1 | D727: 0 | E727: =R[-1]C+10 -> 31 | F727: =R[-1]C+10 -> 40 | G727: 1 | H727: 5000 | I727: 110003 | J727: 1 | K727: =R[-1]C -> [{7,3},{8,3},{9,3},{10,3},{11,3},{12,3},{17,10},{18,8},{19,1},{23,4},{24,10}] | L727: =R[-1]C -> [{7,27},{8,55},{9,27},{10,55},{11,27},{12,55},{17,18},{18,110},{19,3},{23,37},{24,37}] | M727: =R[-1]C -> [{0,1,[1,30]},{1,2,[11,40]},{2,5,[21,50]},{5,10,[31,60]},{10,20,[41,60]},{30,20,[51,70]},{50,10,[61,80]},{70,5,[71,80]},{100,2,[81,90]},{150,1,[91,100]}]
A728: 725 | B728: 2 | C728: 1 | D728: 0 | E728: =R[-1]C+10 -> 41 | F728: =R[-1]C+10 -> 50 | G728: 1 | H728: 5000 | I728: 110003 | J728: 1 | K728: =R[-1]C -> [{7,3},{8,3},{9,3},{10,3},{11,3},{12,3},{17,10},{18,8},{19,1},{23,4},{24,10}] | L728: =R[-1]C -> [{7,27},{8,55},{9,27},{10,55},{11,27},{12,55},{17,18},{18,110},{19,3},{23,37},{24,37}] | M728: =R[-1]C -> [{0,1,[1,30]},{1,2,[11,40]},{2,5,[21,50]},{5,10,[31,60]},{10,20,[41,60]},{30,20,[51,70]},{50,10,[61,80]},{70,5,[71,80]},{100,2,[81,90]},{150,1,[91,100]}]
A729: 726 | B729: 2 | C729: 1 | D729: 0 | E729: =R[-1]C+10 -> 51 | F729: =R[-1]C+10 -> 60 | G729: 1 | H729: 5000 | I729: 110003 | J729: 1 | K729: =R[-1]C -> [{7,3},{8,3},{9,3},{10,3},{11,3},{12,3},{17,10},{18,8},{19,1},{23,4},{24,10}] | L729: =R[-1]C -> [{7,27},{8,55},{9,27},{10,55},{11,27},{12,55},{17,18},{18,110},{19,3},{23,37},{24,37}] | M729: =R[-1]C -> [{0,1,[1,30]},{1,2,[11,40]},{2,5,[21,50]},{5,10,[31,60]},{10,20,[41,60]},{30,20,[51,70]},{50,10,[61,80]},{70,5,[71,80]},{100,2,[81,90]},{150,1,[91,100]}]
A730: 727 | B730: 2 | C730: 1 | D730: 0 | E730: =R[-1]C+10 -> 61 | F730: =R[-1]C+10 -> 70 | G730: 1 | H730: 5000 | I730: 110003 | J730: 1 | K730: =R[-1]C -> [{7,3},{8,3},{9,3},{10,3},{11,3},{12,3},{17,10},{18,8},{19,1},{23,4},{24,10}] | L730: =R[-1]C -> [{7,27},{8,55},{9,27},{10,55},{11,27},{12,55},{17,18},{18,110},{19,3},{23,37},{24,37}] | M730: =R[-1]C -> [{0,1,[1,30]},{1,2,[11,40]},{2,5,[21,50]},{5,10,[31,60]},{10,20,[41,60]},{30,20,[51,70]},{50,10,[61,80]},{70,5,[71,80]},{100,2,[81,90]},{150,1,[91,100]}]
A731: 728 | B731: 2 | C731: 1 | D731: 0 | E731: =R[-1]C+10 -> 71 | F731: =R[-1]C+10 -> 80 | G731: 1 | H731: 5000 | I731: 110003 | J731: 1 | K731: =R[-1]C -> [{7,3},{8,3},{9,3},{10,3},{11,3},{12,3},{17,10},{18,8},{19,1},{23,4},{24,10}] | L731: =R[-1]C -> [{7,27},{8,55},{9,27},{10,55},{11,27},{12,55},{17,18},{18,110},{19,3},{23,37},{24,37}] | M731: =R[-1]C -> [{0,1,[1,30]},{1,2,[11,40]},{2,5,[21,50]},{5,10,[31,60]},{10,20,[41,60]},{30,20,[51,70]},{50,10,[61,80]},{70,5,[71,80]},{100,2,[81,90]},{150,1,[91,100]}]
A732: 729 | B732: 2 | C732: 1 | D732: 0 | E732: =R[-1]C+10 -> 81 | F732: =R[-1]C+10 -> 90 | G732: 1 | H732: 5000 | I732: 110003 | J732: 1 | K732: =R[-1]C -> [{7,3},{8,3},{9,3},{10,3},{11,3},{12,3},{17,10},{18,8},{19,1},{23,4},{24,10}] | L732: =R[-1]C -> [{7,27},{8,55},{9,27},{10,55},{11,27},{12,55},{17,18},{18,110},{19,3},{23,37},{24,37}] | M732: =R[-1]C -> [{0,1,[1,30]},{1,2,[11,40]},{2,5,[21,50]},{5,10,[31,60]},{10,20,[41,60]},{30,20,[51,70]},{50,10,[61,80]},{70,5,[71,80]},{100,2,[81,90]},{150,1,[91,100]}]
A733: 730 | B733: 3 | C733: 1 | D733: 0 | E733: =R[-9]C -> 1 | F733: =R[-9]C -> 10 | G733: 2 | H733: 10000 | I733: 110003 | J733: 2 | K733: =R[-1]C -> [{7,3},{8,3},{9,3},{10,3},{11,3},{12,3},{17,10},{18,8},{19,1},{23,4},{24,10}] | L733: =R[-1]C -> [{7,27},{8,55},{9,27},{10,55},{11,27},{12,55},{17,18},{18,110},{19,3},{23,37},{24,37}] | M733: =R[-1]C -> [{0,1,[1,30]},{1,2,[11,40]},{2,5,[21,50]},{5,10,[31,60]},{10,20,[41,60]},{30,20,[51,70]},{50,10,[61,80]},{70,5,[71,80]},{100,2,[81,90]},{150,1,[91,100]}]
A734: 731 | B734: 3 | C734: 1 | D734: 0 | E734: =R[-9]C -> 11 | F734: =R[-9]C -> 20 | G734: 2 | H734: 10000 | I734: 110003 | J734: 2 | K734: =R[-1]C -> [{7,3},{8,3},{9,3},{10,3},{11,3},{12,3},{17,10},{18,8},{19,1},{23,4},{24,10}] | L734: =R[-1]C -> [{7,27},{8,55},{9,27},{10,55},{11,27},{12,55},{17,18},{18,110},{19,3},{23,37},{24,37}] | M734: =R[-1]C -> [{0,1,[1,30]},{1,2,[11,40]},{2,5,[21,50]},{5,10,[31,60]},{10,20,[41,60]},{30,20,[51,70]},{50,10,[61,80]},{70,5,[71,80]},{100,2,[81,90]},{150,1,[91,100]}]
A735: 732 | B735: 3 | C735: 1 | D735: 0 | E735: =R[-9]C -> 21 | F735: =R[-9]C -> 30 | G735: 2 | H735: 10000 | I735: 110003 | J735: 2 | K735: =R[-1]C -> [{7,3},{8,3},{9,3},{10,3},{11,3},{12,3},{17,10},{18,8},{19,1},{23,4},{24,10}] | L735: =R[-1]C -> [{7,27},{8,55},{9,27},{10,55},{11,27},{12,55},{17,18},{18,110},{19,3},{23,37},{24,37}] | M735: =R[-1]C -> [{0,1,[1,30]},{1,2,[11,40]},{2,5,[21,50]},{5,10,[31,60]},{10,20,[41,60]},{30,20,[51,70]},{50,10,[61,80]},{70,5,[71,80]},{100,2,[81,90]},{150,1,[91,100]}]
A736: 733 | B736: 3 | C736: 1 | D736: 0 | E736: =R[-9]C -> 31 | F736: =R[-9]C -> 40 | G736: 2 | H736: 10000 | I736: 110003 | J736: 2 | K736: =R[-1]C -> [{7,3},{8,3},{9,3},{10,3},{11,3},{12,3},{17,10},{18,8},{19,1},{23,4},{24,10}] | L736: =R[-1]C -> [{7,27},{8,55},{9,27},{10,55},{11,27},{12,55},{17,18},{18,110},{19,3},{23,37},{24,37}] | M736: =R[-1]C -> [{0,1,[1,30]},{1,2,[11,40]},{2,5,[21,50]},{5,10,[31,60]},{10,20,[41,60]},{30,20,[51,70]},{50,10,[61,80]},{70,5,[71,80]},{100,2,[81,90]},{150,1,[91,100]}]
A737: 734 | B737: 3 | C737: 1 | D737: 0 | E737: =R[-9]C -> 41 | F737: =R[-9]C -> 50 | G737: 2 | H737: 10000 | I737: 110003 | J737: 2 | K737: =R[-1]C -> [{7,3},{8,3},{9,3},{10,3},{11,3},{12,3},{17,10},{18,8},{19,1},{23,4},{24,10}] | L737: =R[-1]C -> [{7,27},{8,55},{9,27},{10,55},{11,27},{12,55},{17,18},{18,110},{19,3},{23,37},{24,37}] | M737: =R[-1]C -> [{0,1,[1,30]},{1,2,[11,40]},{2,5,[21,50]},{5,10,[31,60]},{10,20,[41,60]},{30,20,[51,70]},{50,10,[61,80]},{70,5,[71,80]},{100,2,[81,90]},{150,1,[91,100]}]
A738: 735 | B738: 3 | C738: 1 | D738: 0 | E738: =R[-9]C -> 51 | F738: =R[-9]C -> 60 | G738: 2 | H738: 10000 | I738: 110003 | J738: 2 | K738: =R[-1]C -> [{7,3},{8,3},{9,3},{10,3},{11,3},{12,3},{17,10},{18,8},{19,1},{23,4},{24,10}] | L738: =R[-1]C -> [{7,27},{8,55},{9,27},{10,55},{11,27},{12,55},{17,18},{18,110},{19,3},{23,37},{24,37}] | M738: =R[-1]C -> [{0,1,[1,30]},{1,2,[11,40]},{2,5,[21,50]},{5,10,[31,60]},{10,20,[41,60]},{30,20,[51,70]},{50,10,[61,80]},{70,5,[71,80]},{100,2,[81,90]},{150,1,[91,100]}]
A739: 736 | B739: 3 | C739: 1 | D739: 0 | E739: =R[-9]C -> 61 | F739: =R[-9]C -> 70 | G739: 2 | H739: 10000 | I739: 110003 | J739: 2 | K739: =R[-1]C -> [{7,3},{8,3},{9,3},{10,3},{11,3},{12,3},{17,10},{18,8},{19,1},{23,4},{24,10}] | L739: =R[-1]C -> [{7,27},{8,55},{9,27},{10,55},{11,27},{12,55},{17,18},{18,110},{19,3},{23,37},{24,37}] | M739: =R[-1]C -> [{0,1,[1,30]},{1,2,[11,40]},{2,5,[21,50]},{5,10,[31,60]},{10,20,[41,60]},{30,20,[51,70]},{50,10,[61,80]},{70,5,[71,80]},{100,2,[81,90]},{150,1,[91,100]}]
A740: 737 | B740: 3 | C740: 1 | D740: 0 | E740: =R[-9]C -> 71 | F740: =R[-9]C -> 80 | G740: 2 | H740: 10000 | I740: 110003 | J740: 2 | K740: =R[-1]C -> [{7,3},{8,3},{9,3},{10,3},{11,3},{12,3},{17,10},{18,8},{19,1},{23,4},{24,10}] | L740: =R[-1]C -> [{7,27},{8,55},{9,27},{10,55},{11,27},{12,55},{17,18},{18,110},{19,3},{23,37},{24,37}] | M740: =R[-1]C -> [{0,1,[1,30]},{1,2,[11,40]},{2,5,[21,50]},{5,10,[31,60]},{10,20,[41,60]},{30,20,[51,70]},{50,10,[61,80]},{70,5,[71,80]},{100,2,[81,90]},{150,1,[91,100]}]
A741: 738 | B741: 3 | C741: 1 | D741: 0 | E741: =R[-9]C -> 81 | F741: =R[-9]C -> 90 | G741: 2 | H741: 10000 | I741: 110003 | J741: 2 | K741: =R[-1]C -> [{7,3},{8,3},{9,3},{10,3},{11,3},{12,3},{17,10},{18,8},{19,1},{23,4},{24,10}] | L741: =R[-1]C -> [{7,27},{8,55},{9,27},{10,55},{11,27},{12,55},{17,18},{18,110},{19,3},{23,37},{24,37}] | M741: =R[-1]C -> [{0,1,[1,30]},{1,2,[11,40]},{2,5,[21,50]},{5,10,[31,60]},{10,20,[41,60]},{30,20,[51,70]},{50,10,[61,80]},{70,5,[71,80]},{100,2,[81,90]},{150,1,[91,100]}]
A742: 739 | B742: 4 | C742: 1 | D742: 0 | E742: =R[-9]C -> 1 | F742: =R[-9]C -> 10 | G742: 3 | H742: 15000 | I742: 110003 | J742: 3 | K742: =R[-1]C -> [{7,3},{8,3},{9,3},{10,3},{11,3},{12,3},{17,10},{18,8},{19,1},{23,4},{24,10}] | L742: =R[-1]C -> [{7,27},{8,55},{9,27},{10,55},{11,27},{12,55},{17,18},{18,110},{19,3},{23,37},{24,37}] | M742: =R[-1]C -> [{0,1,[1,30]},{1,2,[11,40]},{2,5,[21,50]},{5,10,[31,60]},{10,20,[41,60]},{30,20,[51,70]},{50,10,[61,80]},{70,5,[71,80]},{100,2,[81,90]},{150,1,[91,100]}]
A743: 740 | B743: 4 | C743: 1 | D743: 0 | E743: =R[-9]C -> 11 | F743: =R[-9]C -> 20 | G743: 3 | H743: 15000 | I743: 110003 | J743: 3 | K743: =R[-1]C -> [{7,3},{8,3},{9,3},{10,3},{11,3},{12,3},{17,10},{18,8},{19,1},{23,4},{24,10}] | L743: =R[-1]C -> [{7,27},{8,55},{9,27},{10,55},{11,27},{12,55},{17,18},{18,110},{19,3},{23,37},{24,37}] | M743: =R[-1]C -> [{0,1,[1,30]},{1,2,[11,40]},{2,5,[21,50]},{5,10,[31,60]},{10,20,[41,60]},{30,20,[51,70]},{50,10,[61,80]},{70,5,[71,80]},{100,2,[81,90]},{150,1,[91,100]}]
A744: 741 | B744: 4 | C744: 1 | D744: 0 | E744: =R[-9]C -> 21 | F744: =R[-9]C -> 30 | G744: 3 | H744: 15000 | I744: 110003 | J744: 3 | K744: =R[-1]C -> [{7,3},{8,3},{9,3},{10,3},{11,3},{12,3},{17,10},{18,8},{19,1},{23,4},{24,10}] | L744: =R[-1]C -> [{7,27},{8,55},{9,27},{10,55},{11,27},{12,55},{17,18},{18,110},{19,3},{23,37},{24,37}] | M744: =R[-1]C -> [{0,1,[1,30]},{1,2,[11,40]},{2,5,[21,50]},{5,10,[31,60]},{10,20,[41,60]},{30,20,[51,70]},{50,10,[61,80]},{70,5,[71,80]},{100,2,[81,90]},{150,1,[91,100]}]
A745: 742 | B745: 4 | C745: 1 | D745: 0 | E745: =R[-9]C -> 31 | F745: =R[-9]C -> 40 | G745: 3 | H745: 15000 | I745: 110003 | J745: 3 | K745: =R[-1]C -> [{7,3},{8,3},{9,3},{10,3},{11,3},{12,3},{17,10},{18,8},{19,1},{23,4},{24,10}] | L745: =R[-1]C -> [{7,27},{8,55},{9,27},{10,55},{11,27},{12,55},{17,18},{18,110},{19,3},{23,37},{24,37}] | M745: =R[-1]C -> [{0,1,[1,30]},{1,2,[11,40]},{2,5,[21,50]},{5,10,[31,60]},{10,20,[41,60]},{30,20,[51,70]},{50,10,[61,80]},{70,5,[71,80]},{100,2,[81,90]},{150,1,[91,100]}]
A746: 743 | B746: 4 | C746: 1 | D746: 0 | E746: =R[-9]C -> 41 | F746: =R[-9]C -> 50 | G746: 3 | H746: 15000 | I746: 110003 | J746: 3 | K746: =R[-1]C -> [{7,3},{8,3},{9,3},{10,3},{11,3},{12,3},{17,10},{18,8},{19,1},{23,4},{24,10}] | L746: =R[-1]C -> [{7,27},{8,55},{9,27},{10,55},{11,27},{12,55},{17,18},{18,110},{19,3},{23,37},{24,37}] | M746: =R[-1]C -> [{0,1,[1,30]},{1,2,[11,40]},{2,5,[21,50]},{5,10,[31,60]},{10,20,[41,60]},{30,20,[51,70]},{50,10,[61,80]},{70,5,[71,80]},{100,2,[81,90]},{150,1,[91,100]}]
A747: 744 | B747: 4 | C747: 1 | D747: 0 | E747: =R[-9]C -> 51 | F747: =R[-9]C -> 60 | G747: 3 | H747: 15000 | I747: 110003 | J747: 3 | K747: =R[-1]C -> [{7,3},{8,3},{9,3},{10,3},{11,3},{12,3},{17,10},{18,8},{19,1},{23,4},{24,10}] | L747: =R[-1]C -> [{7,27},{8,55},{9,27},{10,55},{11,27},{12,55},{17,18},{18,110},{19,3},{23,37},{24,37}] | M747: =R[-1]C -> [{0,1,[1,30]},{1,2,[11,40]},{2,5,[21,50]},{5,10,[31,60]},{10,20,[41,60]},{30,20,[51,70]},{50,10,[61,80]},{70,5,[71,80]},{100,2,[81,90]},{150,1,[91,100]}]
A748: 745 | B748: 4 | C748: 1 | D748: 0 | E748: =R[-9]C -> 61 | F748: =R[-9]C -> 70 | G748: 3 | H748: 15000 | I748: 110003 | J748: 3 | K748: =R[-1]C -> [{7,3},{8,3},{9,3},{10,3},{11,3},{12,3},{17,10},{18,8},{19,1},{23,4},{24,10}] | L748: =R[-1]C -> [{7,27},{8,55},{9,27},{10,55},{11,27},{12,55},{17,18},{18,110},{19,3},{23,37},{24,37}] | M748: =R[-1]C -> [{0,1,[1,30]},{1,2,[11,40]},{2,5,[21,50]},{5,10,[31,60]},{10,20,[41,60]},{30,20,[51,70]},{50,10,[61,80]},{70,5,[71,80]},{100,2,[81,90]},{150,1,[91,100]}]
A749: 746 | B749: 4 | C749: 1 | D749: 0 | E749: =R[-9]C -> 71 | F749: =R[-9]C -> 80 | G749: 3 | H749: 15000 | I749: 110003 | J749: 3 | K749: =R[-1]C -> [{7,3},{8,3},{9,3},{10,3},{11,3},{12,3},{17,10},{18,8},{19,1},{23,4},{24,10}] | L749: =R[-1]C -> [{7,27},{8,55},{9,27},{10,55},{11,27},{12,55},{17,18},{18,110},{19,3},{23,37},{24,37}] | M749: =R[-1]C -> [{0,1,[1,30]},{1,2,[11,40]},{2,5,[21,50]},{5,10,[31,60]},{10,20,[41,60]},{30,20,[51,70]},{50,10,[61,80]},{70,5,[71,80]},{100,2,[81,90]},{150,1,[91,100]}]
A750: 747 | B750: 4 | C750: 1 | D750: 0 | E750: =R[-9]C -> 81 | F750: =R[-9]C -> 90 | G750: 3 | H750: 15000 | I750: 110003 | J750: 3 | K750: =R[-1]C -> [{7,3},{8,3},{9,3},{10,3},{11,3},{12,3},{17,10},{18,8},{19,1},{23,4},{24,10}] | L750: =R[-1]C -> [{7,27},{8,55},{9,27},{10,55},{11,27},{12,55},{17,18},{18,110},{19,3},{23,37},{24,37}] | M750: =R[-1]C -> [{0,1,[1,30]},{1,2,[11,40]},{2,5,[21,50]},{5,10,[31,60]},{10,20,[41,60]},{30,20,[51,70]},{50,10,[61,80]},{70,5,[71,80]},{100,2,[81,90]},{150,1,[91,100]}]
A751: 748 | B751: 5 | C751: 1 | D751: 0 | E751: =R[-9]C -> 1 | F751: =R[-9]C -> 10 | G751: 4 | H751: 20000 | I751: 110003 | J751: 4 | K751: =R[-1]C -> [{7,3},{8,3},{9,3},{10,3},{11,3},{12,3},{17,10},{18,8},{19,1},{23,4},{24,10}] | L751: =R[-1]C -> [{7,27},{8,55},{9,27},{10,55},{11,27},{12,55},{17,18},{18,110},{19,3},{23,37},{24,37}] | M751: =R[-1]C -> [{0,1,[1,30]},{1,2,[11,40]},{2,5,[21,50]},{5,10,[31,60]},{10,20,[41,60]},{30,20,[51,70]},{50,10,[61,80]},{70,5,[71,80]},{100,2,[81,90]},{150,1,[91,100]}]
A752: 749 | B752: 5 | C752: 1 | D752: 0 | E752: =R[-9]C -> 11 | F752: =R[-9]C -> 20 | G752: 4 | H752: 20000 | I752: 110003 | J752: 4 | K752: =R[-1]C -> [{7,3},{8,3},{9,3},{10,3},{11,3},{12,3},{17,10},{18,8},{19,1},{23,4},{24,10}] | L752: =R[-1]C -> [{7,27},{8,55},{9,27},{10,55},{11,27},{12,55},{17,18},{18,110},{19,3},{23,37},{24,37}] | M752: =R[-1]C -> [{0,1,[1,30]},{1,2,[11,40]},{2,5,[21,50]},{5,10,[31,60]},{10,20,[41,60]},{30,20,[51,70]},{50,10,[61,80]},{70,5,[71,80]},{100,2,[81,90]},{150,1,[91,100]}]
A753: 750 | B753: 5 | C753: 1 | D753: 0 | E753: =R[-9]C -> 21 | F753: =R[-9]C -> 30 | G753: 4 | H753: 20000 | I753: 110003 | J753: 4 | K753: =R[-1]C -> [{7,3},{8,3},{9,3},{10,3},{11,3},{12,3},{17,10},{18,8},{19,1},{23,4},{24,10}] | L753: =R[-1]C -> [{7,27},{8,55},{9,27},{10,55},{11,27},{12,55},{17,18},{18,110},{19,3},{23,37},{24,37}] | M753: =R[-1]C -> [{0,1,[1,30]},{1,2,[11,40]},{2,5,[21,50]},{5,10,[31,60]},{10,20,[41,60]},{30,20,[51,70]},{50,10,[61,80]},{70,5,[71,80]},{100,2,[81,90]},{150,1,[91,100]}]
A754: 751 | B754: 5 | C754: 1 | D754: 0 | E754: =R[-9]C -> 31 | F754: =R[-9]C -> 40 | G754: 4 | H754: 20000 | I754: 110003 | J754: 4 | K754: =R[-1]C -> [{7,3},{8,3},{9,3},{10,3},{11,3},{12,3},{17,10},{18,8},{19,1},{23,4},{24,10}] | L754: =R[-1]C -> [{7,27},{8,55},{9,27},{10,55},{11,27},{12,55},{17,18},{18,110},{19,3},{23,37},{24,37}] | M754: =R[-1]C -> [{0,1,[1,30]},{1,2,[11,40]},{2,5,[21,50]},{5,10,[31,60]},{10,20,[41,60]},{30,20,[51,70]},{50,10,[61,80]},{70,5,[71,80]},{100,2,[81,90]},{150,1,[91,100]}]
A755: 752 | B755: 5 | C755: 1 | D755: 0 | E755: =R[-9]C -> 41 | F755: =R[-9]C -> 50 | G755: 4 | H755: 20000 | I755: 110003 | J755: 4 | K755: =R[-1]C -> [{7,3},{8,3},{9,3},{10,3},{11,3},{12,3},{17,10},{18,8},{19,1},{23,4},{24,10}] | L755: =R[-1]C -> [{7,27},{8,55},{9,27},{10,55},{11,27},{12,55},{17,18},{18,110},{19,3},{23,37},{24,37}] | M755: =R[-1]C -> [{0,1,[1,30]},{1,2,[11,40]},{2,5,[21,50]},{5,10,[31,60]},{10,20,[41,60]},{30,20,[51,70]},{50,10,[61,80]},{70,5,[71,80]},{100,2,[81,90]},{150,1,[91,100]}]
A756: 753 | B756: 5 | C756: 1 | D756: 0 | E756: =R[-9]C -> 51 | F756: =R[-9]C -> 60 | G756: 4 | H756: 20000 | I756: 110003 | J756: 4 | K756: =R[-1]C -> [{7,3},{8,3},{9,3},{10,3},{11,3},{12,3},{17,10},{18,8},{19,1},{23,4},{24,10}] | L756: =R[-1]C -> [{7,27},{8,55},{9,27},{10,55},{11,27},{12,55},{17,18},{18,110},{19,3},{23,37},{24,37}] | M756: =R[-1]C -> [{0,1,[1,30]},{1,2,[11,40]},{2,5,[21,50]},{5,10,[31,60]},{10,20,[41,60]},{30,20,[51,70]},{50,10,[61,80]},{70,5,[71,80]},{100,2,[81,90]},{150,1,[91,100]}]
A757: 754 | B757: 5 | C757: 1 | D757: 0 | E757: =R[-9]C -> 61 | F757: =R[-9]C -> 70 | G757: 4 | H757: 20000 | I757: 110003 | J757: 4 | K757: =R[-1]C -> [{7,3},{8,3},{9,3},{10,3},{11,3},{12,3},{17,10},{18,8},{19,1},{23,4},{24,10}] | L757: =R[-1]C -> [{7,27},{8,55},{9,27},{10,55},{11,27},{12,55},{17,18},{18,110},{19,3},{23,37},{24,37}] | M757: =R[-1]C -> [{0,1,[1,30]},{1,2,[11,40]},{2,5,[21,50]},{5,10,[31,60]},{10,20,[41,60]},{30,20,[51,70]},{50,10,[61,80]},{70,5,[71,80]},{100,2,[81,90]},{150,1,[91,100]}]
A758: 755 | B758: 5 | C758: 1 | D758: 0 | E758: =R[-9]C -> 71 | F758: =R[-9]C -> 80 | G758: 4 | H758: 20000 | I758: 110003 | J758: 4 | K758: =R[-1]C -> [{7,3},{8,3},{9,3},{10,3},{11,3},{12,3},{17,10},{18,8},{19,1},{23,4},{24,10}] | L758: =R[-1]C -> [{7,27},{8,55},{9,27},{10,55},{11,27},{12,55},{17,18},{18,110},{19,3},{23,37},{24,37}] | M758: =R[-1]C -> [{0,1,[1,30]},{1,2,[11,40]},{2,5,[21,50]},{5,10,[31,60]},{10,20,[41,60]},{30,20,[51,70]},{50,10,[61,80]},{70,5,[71,80]},{100,2,[81,90]},{150,1,[91,100]}]
A759: 756 | B759: 5 | C759: 1 | D759: 0 | E759: =R[-9]C -> 81 | F759: =R[-9]C -> 90 | G759: 4 | H759: 20000 | I759: 110003 | J759: 4 | K759: =R[-1]C -> [{7,3},{8,3},{9,3},{10,3},{11,3},{12,3},{17,10},{18,8},{19,1},{23,4},{24,10}] | L759: =R[-1]C -> [{7,27},{8,55},{9,27},{10,55},{11,27},{12,55},{17,18},{18,110},{19,3},{23,37},{24,37}] | M759: =R[-1]C -> [{0,1,[1,30]},{1,2,[11,40]},{2,5,[21,50]},{5,10,[31,60]},{10,20,[41,60]},{30,20,[51,70]},{50,10,[61,80]},{70,5,[71,80]},{100,2,[81,90]},{150,1,[91,100]}]
A760: 757 | B760: 6 | C760: 1 | D760: 0 | E760: =R[-9]C -> 1 | F760: =R[-9]C -> 10 | G760: 5 | H760: 20000 | I760: 110003 | J760: 5 | K760: =R[-1]C -> [{7,3},{8,3},{9,3},{10,3},{11,3},{12,3},{17,10},{18,8},{19,1},{23,4},{24,10}] | L760: =R[-1]C -> [{7,27},{8,55},{9,27},{10,55},{11,27},{12,55},{17,18},{18,110},{19,3},{23,37},{24,37}] | M760: =R[-1]C -> [{0,1,[1,30]},{1,2,[11,40]},{2,5,[21,50]},{5,10,[31,60]},{10,20,[41,60]},{30,20,[51,70]},{50,10,[61,80]},{70,5,[71,80]},{100,2,[81,90]},{150,1,[91,100]}]
A761: 758 | B761: 6 | C761: 1 | D761: 0 | E761: =R[-9]C -> 11 | F761: =R[-9]C -> 20 | G761: 5 | H761: 20000 | I761: 110003 | J761: 5 | K761: =R[-1]C -> [{7,3},{8,3},{9,3},{10,3},{11,3},{12,3},{17,10},{18,8},{19,1},{23,4},{24,10}] | L761: =R[-1]C -> [{7,27},{8,55},{9,27},{10,55},{11,27},{12,55},{17,18},{18,110},{19,3},{23,37},{24,37}] | M761: =R[-1]C -> [{0,1,[1,30]},{1,2,[11,40]},{2,5,[21,50]},{5,10,[31,60]},{10,20,[41,60]},{30,20,[51,70]},{50,10,[61,80]},{70,5,[71,80]},{100,2,[81,90]},{150,1,[91,100]}]
A762: 759 | B762: 6 | C762: 1 | D762: 0 | E762: =R[-9]C -> 21 | F762: =R[-9]C -> 30 | G762: 5 | H762: 20000 | I762: 110003 | J762: 5 | K762: =R[-1]C -> [{7,3},{8,3},{9,3},{10,3},{11,3},{12,3},{17,10},{18,8},{19,1},{23,4},{24,10}] | L762: =R[-1]C -> [{7,27},{8,55},{9,27},{10,55},{11,27},{12,55},{17,18},{18,110},{19,3},{23,37},{24,37}] | M762: =R[-1]C -> [{0,1,[1,30]},{1,2,[11,40]},{2,5,[21,50]},{5,10,[31,60]},{10,20,[41,60]},{30,20,[51,70]},{50,10,[61,80]},{70,5,[71,80]},{100,2,[81,90]},{150,1,[91,100]}]
A763: 760 | B763: 6 | C763: 1 | D763: 0 | E763: =R[-9]C -> 31 | F763: =R[-9]C -> 40 | G763: 5 | H763: 20000 | I763: 110003 | J763: 5 | K763: =R[-1]C -> [{7,3},{8,3},{9,3},{10,3},{11,3},{12,3},{17,10},{18,8},{19,1},{23,4},{24,10}] | L763: =R[-1]C -> [{7,27},{8,55},{9,27},{10,55},{11,27},{12,55},{17,18},{18,110},{19,3},{23,37},{24,37}] | M763: =R[-1]C -> [{0,1,[1,30]},{1,2,[11,40]},{2,5,[21,50]},{5,10,[31,60]},{10,20,[41,60]},{30,20,[51,70]},{50,10,[61,80]},{70,5,[71,80]},{100,2,[81,90]},{150,1,[91,100]}]
A764: 761 | B764: 6 | C764: 1 | D764: 0 | E764: =R[-9]C -> 41 | F764: =R[-9]C -> 50 | G764: 5 | H764: 20000 | I764: 110003 | J764: 5 | K764: =R[-1]C -> [{7,3},{8,3},{9,3},{10,3},{11,3},{12,3},{17,10},{18,8},{19,1},{23,4},{24,10}] | L764: =R[-1]C -> [{7,27},{8,55},{9,27},{10,55},{11,27},{12,55},{17,18},{18,110},{19,3},{23,37},{24,37}] | M764: =R[-1]C -> [{0,1,[1,30]},{1,2,[11,40]},{2,5,[21,50]},{5,10,[31,60]},{10,20,[41,60]},{30,20,[51,70]},{50,10,[61,80]},{70,5,[71,80]},{100,2,[81,90]},{150,1,[91,100]}]
A765: 762 | B765: 6 | C765: 1 | D765: 0 | E765: =R[-9]C -> 51 | F765: =R[-9]C -> 60 | G765: 5 | H765: 20000 | I765: 110003 | J765: 5 | K765: =R[-1]C -> [{7,3},{8,3},{9,3},{10,3},{11,3},{12,3},{17,10},{18,8},{19,1},{23,4},{24,10}] | L765: =R[-1]C -> [{7,27},{8,55},{9,27},{10,55},{11,27},{12,55},{17,18},{18,110},{19,3},{23,37},{24,37}] | M765: =R[-1]C -> [{0,1,[1,30]},{1,2,[11,40]},{2,5,[21,50]},{5,10,[31,60]},{10,20,[41,60]},{30,20,[51,70]},{50,10,[61,80]},{70,5,[71,80]},{100,2,[81,90]},{150,1,[91,100]}]
A766: 763 | B766: 6 | C766: 1 | D766: 0 | E766: =R[-9]C -> 61 | F766: =R[-9]C -> 70 | G766: 5 | H766: 20000 | I766: 110003 | J766: 5 | K766: =R[-1]C -> [{7,3},{8,3},{9,3},{10,3},{11,3},{12,3},{17,10},{18,8},{19,1},{23,4},{24,10}] | L766: =R[-1]C -> [{7,27},{8,55},{9,27},{10,55},{11,27},{12,55},{17,18},{18,110},{19,3},{23,37},{24,37}] | M766: =R[-1]C -> [{0,1,[1,30]},{1,2,[11,40]},{2,5,[21,50]},{5,10,[31,60]},{10,20,[41,60]},{30,20,[51,70]},{50,10,[61,80]},{70,5,[71,80]},{100,2,[81,90]},{150,1,[91,100]}]
A767: 764 | B767: 6 | C767: 1 | D767: 0 | E767: =R[-9]C -> 71 | F767: =R[-9]C -> 80 | G767: 5 | H767: 20000 | I767: 110003 | J767: 5 | K767: =R[-1]C -> [{7,3},{8,3},{9,3},{10,3},{11,3},{12,3},{17,10},{18,8},{19,1},{23,4},{24,10}] | L767: =R[-1]C -> [{7,27},{8,55},{9,27},{10,55},{11,27},{12,55},{17,18},{18,110},{19,3},{23,37},{24,37}] | M767: =R[-1]C -> [{0,1,[1,30]},{1,2,[11,40]},{2,5,[21,50]},{5,10,[31,60]},{10,20,[41,60]},{30,20,[51,70]},{50,10,[61,80]},{70,5,[71,80]},{100,2,[81,90]},{150,1,[91,100]}]
A768: 765 | B768: 6 | C768: 1 | D768: 0 | E768: =R[-9]C -> 81 | F768: =R[-9]C -> 90 | G768: 5 | H768: 20000 | I768: 110003 | J768: 5 | K768: =R[-1]C -> [{7,3},{8,3},{9,3},{10,3},{11,3},{12,3},{17,10},{18,8},{19,1},{23,4},{24,10}] | L768: =R[-1]C -> [{7,27},{8,55},{9,27},{10,55},{11,27},{12,55},{17,18},{18,110},{19,3},{23,37},{24,37}] | M768: =R[-1]C -> [{0,1,[1,30]},{1,2,[11,40]},{2,5,[21,50]},{5,10,[31,60]},{10,20,[41,60]},{30,20,[51,70]},{50,10,[61,80]},{70,5,[71,80]},{100,2,[81,90]},{150,1,[91,100]}]
A769: 766 | B769: 2 | C769: 4 | D769: 0 | E769: =R[-18]C -> 1 | F769: =R[-18]C -> 10 | G769: 1 | H769: 5000 | I769: 110003 | J769: 1 | K769: =R[-1]C -> [{7,3},{8,3},{9,3},{10,3},{11,3},{12,3},{17,10},{18,8},{19,1},{23,4},{24,10}] | L769: =R[-1]C -> [{7,27},{8,55},{9,27},{10,55},{11,27},{12,55},{17,18},{18,110},{19,3},{23,37},{24,37}] | M769: =R[-1]C -> [{0,1,[1,30]},{1,2,[11,40]},{2,5,[21,50]},{5,10,[31,60]},{10,20,[41,60]},{30,20,[51,70]},{50,10,[61,80]},{70,5,[71,80]},{100,2,[81,90]},{150,1,[91,100]}]
A770: 767 | B770: 2 | C770: 4 | D770: 0 | E770: =R[-18]C -> 11 | F770: =R[-18]C -> 20 | G770: 1 | H770: 5000 | I770: 110003 | J770: 1 | K770: =R[-1]C -> [{7,3},{8,3},{9,3},{10,3},{11,3},{12,3},{17,10},{18,8},{19,1},{23,4},{24,10}] | L770: =R[-1]C -> [{7,27},{8,55},{9,27},{10,55},{11,27},{12,55},{17,18},{18,110},{19,3},{23,37},{24,37}] | M770: =R[-1]C -> [{0,1,[1,30]},{1,2,[11,40]},{2,5,[21,50]},{5,10,[31,60]},{10,20,[41,60]},{30,20,[51,70]},{50,10,[61,80]},{70,5,[71,80]},{100,2,[81,90]},{150,1,[91,100]}]
A771: 768 | B771: 2 | C771: 4 | D771: 0 | E771: =R[-18]C -> 21 | F771: =R[-18]C -> 30 | G771: 1 | H771: 5000 | I771: 110003 | J771: 1 | K771: =R[-1]C -> [{7,3},{8,3},{9,3},{10,3},{11,3},{12,3},{17,10},{18,8},{19,1},{23,4},{24,10}] | L771: =R[-1]C -> [{7,27},{8,55},{9,27},{10,55},{11,27},{12,55},{17,18},{18,110},{19,3},{23,37},{24,37}] | M771: =R[-1]C -> [{0,1,[1,30]},{1,2,[11,40]},{2,5,[21,50]},{5,10,[31,60]},{10,20,[41,60]},{30,20,[51,70]},{50,10,[61,80]},{70,5,[71,80]},{100,2,[81,90]},{150,1,[91,100]}]
A772: 769 | B772: 2 | C772: 4 | D772: 0 | E772: =R[-18]C -> 31 | F772: =R[-18]C -> 40 | G772: 1 | H772: 5000 | I772: 110003 | J772: 1 | K772: =R[-1]C -> [{7,3},{8,3},{9,3},{10,3},{11,3},{12,3},{17,10},{18,8},{19,1},{23,4},{24,10}] | L772: =R[-1]C -> [{7,27},{8,55},{9,27},{10,55},{11,27},{12,55},{17,18},{18,110},{19,3},{23,37},{24,37}] | M772: =R[-1]C -> [{0,1,[1,30]},{1,2,[11,40]},{2,5,[21,50]},{5,10,[31,60]},{10,20,[41,60]},{30,20,[51,70]},{50,10,[61,80]},{70,5,[71,80]},{100,2,[81,90]},{150,1,[91,100]}]
A773: 770 | B773: 2 | C773: 4 | D773: 0 | E773: =R[-18]C -> 41 | F773: =R[-18]C -> 50 | G773: 1 | H773: 5000 | I773: 110003 | J773: 1 | K773: =R[-1]C -> [{7,3},{8,3},{9,3},{10,3},{11,3},{12,3},{17,10},{18,8},{19,1},{23,4},{24,10}] | L773: =R[-1]C -> [{7,27},{8,55},{9,27},{10,55},{11,27},{12,55},{17,18},{18,110},{19,3},{23,37},{24,37}] | M773: =R[-1]C -> [{0,1,[1,30]},{1,2,[11,40]},{2,5,[21,50]},{5,10,[31,60]},{10,20,[41,60]},{30,20,[51,70]},{50,10,[61,80]},{70,5,[71,80]},{100,2,[81,90]},{150,1,[91,100]}]
A774: 771 | B774: 2 | C774: 4 | D774: 0 | E774: =R[-18]C -> 51 | F774: =R[-18]C -> 60 | G774: 1 | H774: 5000 | I774: 110003 | J774: 1 | K774: =R[-1]C -> [{7,3},{8,3},{9,3},{10,3},{11,3},{12,3},{17,10},{18,8},{19,1},{23,4},{24,10}] | L774: =R[-1]C -> [{7,27},{8,55},{9,27},{10,55},{11,27},{12,55},{17,18},{18,110},{19,3},{23,37},{24,37}] | M774: =R[-1]C -> [{0,1,[1,30]},{1,2,[11,40]},{2,5,[21,50]},{5,10,[31,60]},{10,20,[41,60]},{30,20,[51,70]},{50,10,[61,80]},{70,5,[71,80]},{100,2,[81,90]},{150,1,[91,100]}]
A775: 772 | B775: 2 | C775: 4 | D775: 0 | E775: =R[-18]C -> 61 | F775: =R[-18]C -> 70 | G775: 1 | H775: 5000 | I775: 110003 | J775: 1 | K775: =R[-1]C -> [{7,3},{8,3},{9,3},{10,3},{11,3},{12,3},{17,10},{18,8},{19,1},{23,4},{24,10}] | L775: =R[-1]C -> [{7,27},{8,55},{9,27},{10,55},{11,27},{12,55},{17,18},{18,110},{19,3},{23,37},{24,37}] | M775: =R[-1]C -> [{0,1,[1,30]},{1,2,[11,40]},{2,5,[21,50]},{5,10,[31,60]},{10,20,[41,60]},{30,20,[51,70]},{50,10,[61,80]},{70,5,[71,80]},{100,2,[81,90]},{150,1,[91,100]}]
A776: 773 | B776: 2 | C776: 4 | D776: 0 | E776: =R[-18]C -> 71 | F776: =R[-18]C -> 80 | G776: 1 | H776: 5000 | I776: 110003 | J776: 1 | K776: =R[-1]C -> [{7,3},{8,3},{9,3},{10,3},{11,3},{12,3},{17,10},{18,8},{19,1},{23,4},{24,10}] | L776: =R[-1]C -> [{7,27},{8,55},{9,27},{10,55},{11,27},{12,55},{17,18},{18,110},{19,3},{23,37},{24,37}] | M776: =R[-1]C -> [{0,1,[1,30]},{1,2,[11,40]},{2,5,[21,50]},{5,10,[31,60]},{10,20,[41,60]},{30,20,[51,70]},{50,10,[61,80]},{70,5,[71,80]},{100,2,[81,90]},{150,1,[91,100]}]
A777: 774 | B777: 2 | C777: 4 | D777: 0 | E777: =R[-18]C -> 81 | F777: =R[-18]C -> 90 | G777: 1 | H777: 5000 | I777: 110003 | J777: 1 | K777: =R[-1]C -> [{7,3},{8,3},{9,3},{10,3},{11,3},{12,3},{17,10},{18,8},{19,1},{23,4},{24,10}] | L777: =R[-1]C -> [{7,27},{8,55},{9,27},{10,55},{11,27},{12,55},{17,18},{18,110},{19,3},{23,37},{24,37}] | M777: =R[-1]C -> [{0,1,[1,30]},{1,2,[11,40]},{2,5,[21,50]},{5,10,[31,60]},{10,20,[41,60]},{30,20,[51,70]},{50,10,[61,80]},{70,5,[71,80]},{100,2,[81,90]},{150,1,[91,100]}]
A778: 775 | B778: 3 | C778: 4 | D778: 0 | E778: =R[-9]C -> 1 | F778: =R[-9]C -> 10 | G778: 2 | H778: 10000 | I778: 110003 | J778: 2 | K778: =R[-1]C -> [{7,3},{8,3},{9,3},{10,3},{11,3},{12,3},{17,10},{18,8},{19,1},{23,4},{24,10}] | L778: =R[-1]C -> [{7,27},{8,55},{9,27},{10,55},{11,27},{12,55},{17,18},{18,110},{19,3},{23,37},{24,37}] | M778: =R[-1]C -> [{0,1,[1,30]},{1,2,[11,40]},{2,5,[21,50]},{5,10,[31,60]},{10,20,[41,60]},{30,20,[51,70]},{50,10,[61,80]},{70,5,[71,80]},{100,2,[81,90]},{150,1,[91,100]}]
A779: 776 | B779: 3 | C779: 4 | D779: 0 | E779: =R[-9]C -> 11 | F779: =R[-9]C -> 20 | G779: 2 | H779: 10000 | I779: 110003 | J779: 2 | K779: =R[-1]C -> [{7,3},{8,3},{9,3},{10,3},{11,3},{12,3},{17,10},{18,8},{19,1},{23,4},{24,10}] | L779: =R[-1]C -> [{7,27},{8,55},{9,27},{10,55},{11,27},{12,55},{17,18},{18,110},{19,3},{23,37},{24,37}] | M779: =R[-1]C -> [{0,1,[1,30]},{1,2,[11,40]},{2,5,[21,50]},{5,10,[31,60]},{10,20,[41,60]},{30,20,[51,70]},{50,10,[61,80]},{70,5,[71,80]},{100,2,[81,90]},{150,1,[91,100]}]
A780: 777 | B780: 3 | C780: 4 | D780: 0 | E780: =R[-9]C -> 21 | F780: =R[-9]C -> 30 | G780: 2 | H780: 10000 | I780: 110003 | J780: 2 | K780: =R[-1]C -> [{7,3},{8,3},{9,3},{10,3},{11,3},{12,3},{17,10},{18,8},{19,1},{23,4},{24,10}] | L780: =R[-1]C -> [{7,27},{8,55},{9,27},{10,55},{11,27},{12,55},{17,18},{18,110},{19,3},{23,37},{24,37}] | M780: =R[-1]C -> [{0,1,[1,30]},{1,2,[11,40]},{2,5,[21,50]},{5,10,[31,60]},{10,20,[41,60]},{30,20,[51,70]},{50,10,[61,80]},{70,5,[71,80]},{100,2,[81,90]},{150,1,[91,100]}]
A781: 778 | B781: 3 | C781: 4 | D781: 0 | E781: =R[-9]C -> 31 | F781: =R[-9]C -> 40 | G781: 2 | H781: 10000 | I781: 110003 | J781: 2 | K781: =R[-1]C -> [{7,3},{8,3},{9,3},{10,3},{11,3},{12,3},{17,10},{18,8},{19,1},{23,4},{24,10}] | L781: =R[-1]C -> [{7,27},{8,55},{9,27},{10,55},{11,27},{12,55},{17,18},{18,110},{19,3},{23,37},{24,37}] | M781: =R[-1]C -> [{0,1,[1,30]},{1,2,[11,40]},{2,5,[21,50]},{5,10,[31,60]},{10,20,[41,60]},{30,20,[51,70]},{50,10,[61,80]},{70,5,[71,80]},{100,2,[81,90]},{150,1,[91,100]}]
A782: 779 | B782: 3 | C782: 4 | D782: 0 | E782: =R[-9]C -> 41 | F782: =R[-9]C -> 50 | G782: 2 | H782: 10000 | I782: 110003 | J782: 2 | K782: =R[-1]C -> [{7,3},{8,3},{9,3},{10,3},{11,3},{12,3},{17,10},{18,8},{19,1},{23,4},{24,10}] | L782: =R[-1]C -> [{7,27},{8,55},{9,27},{10,55},{11,27},{12,55},{17,18},{18,110},{19,3},{23,37},{24,37}] | M782: =R[-1]C -> [{0,1,[1,30]},{1,2,[11,40]},{2,5,[21,50]},{5,10,[31,60]},{10,20,[41,60]},{30,20,[51,70]},{50,10,[61,80]},{70,5,[71,80]},{100,2,[81,90]},{150,1,[91,100]}]
A783: 780 | B783: 3 | C783: 4 | D783: 0 | E783: =R[-9]C -> 51 | F783: =R[-9]C -> 60 | G783: 2 | H783: 10000 | I783: 110003 | J783: 2 | K783: =R[-1]C -> [{7,3},{8,3},{9,3},{10,3},{11,3},{12,3},{17,10},{18,8},{19,1},{23,4},{24,10}] | L783: =R[-1]C -> [{7,27},{8,55},{9,27},{10,55},{11,27},{12,55},{17,18},{18,110},{19,3},{23,37},{24,37}] | M783: =R[-1]C -> [{0,1,[1,30]},{1,2,[11,40]},{2,5,[21,50]},{5,10,[31,60]},{10,20,[41,60]},{30,20,[51,70]},{50,10,[61,80]},{70,5,[71,80]},{100,2,[81,90]},{150,1,[91,100]}]
A784: 781 | B784: 3 | C784: 4 | D784: 0 | E784: =R[-9]C -> 61 | F784: =R[-9]C -> 70 | G784: 2 | H784: 10000 | I784: 110003 | J784: 2 | K784: =R[-1]C -> [{7,3},{8,3},{9,3},{10,3},{11,3},{12,3},{17,10},{18,8},{19,1},{23,4},{24,10}] | L784: =R[-1]C -> [{7,27},{8,55},{9,27},{10,55},{11,27},{12,55},{17,18},{18,110},{19,3},{23,37},{24,37}] | M784: =R[-1]C -> [{0,1,[1,30]},{1,2,[11,40]},{2,5,[21,50]},{5,10,[31,60]},{10,20,[41,60]},{30,20,[51,70]},{50,10,[61,80]},{70,5,[71,80]},{100,2,[81,90]},{150,1,[91,100]}]
A785: 782 | B785: 3 | C785: 4 | D785: 0 | E785: =R[-9]C -> 71 | F785: =R[-9]C -> 80 | G785: 2 | H785: 10000 | I785: 110003 | J785: 2 | K785: =R[-1]C -> [{7,3},{8,3},{9,3},{10,3},{11,3},{12,3},{17,10},{18,8},{19,1},{23,4},{24,10}] | L785: =R[-1]C -> [{7,27},{8,55},{9,27},{10,55},{11,27},{12,55},{17,18},{18,110},{19,3},{23,37},{24,37}] | M785: =R[-1]C -> [{0,1,[1,30]},{1,2,[11,40]},{2,5,[21,50]},{5,10,[31,60]},{10,20,[41,60]},{30,20,[51,70]},{50,10,[61,80]},{70,5,[71,80]},{100,2,[81,90]},{150,1,[91,100]}]
A786: 783 | B786: 3 | C786: 4 | D786: 0 | E786: =R[-9]C -> 81 | F786: =R[-9]C -> 90 | G786: 2 | H786: 10000 | I786: 110003 | J786: 2 | K786: =R[-1]C -> [{7,3},{8,3},{9,3},{10,3},{11,3},{12,3},{17,10},{18,8},{19,1},{23,4},{24,10}] | L786: =R[-1]C -> [{7,27},{8,55},{9,27},{10,55},{11,27},{12,55},{17,18},{18,110},{19,3},{23,37},{24,37}] | M786: =R[-1]C -> [{0,1,[1,30]},{1,2,[11,40]},{2,5,[21,50]},{5,10,[31,60]},{10,20,[41,60]},{30,20,[51,70]},{50,10,[61,80]},{70,5,[71,80]},{100,2,[81,90]},{150,1,[91,100]}]
A787: 784 | B787: 4 | C787: 4 | D787: 0 | E787: =R[-9]C -> 1 | F787: =R[-9]C -> 10 | G787: 3 | H787: 15000 | I787: 110003 | J787: 3 | K787: =R[-1]C -> [{7,3},{8,3},{9,3},{10,3},{11,3},{12,3},{17,10},{18,8},{19,1},{23,4},{24,10}] | L787: =R[-1]C -> [{7,27},{8,55},{9,27},{10,55},{11,27},{12,55},{17,18},{18,110},{19,3},{23,37},{24,37}] | M787: =R[-1]C -> [{0,1,[1,30]},{1,2,[11,40]},{2,5,[21,50]},{5,10,[31,60]},{10,20,[41,60]},{30,20,[51,70]},{50,10,[61,80]},{70,5,[71,80]},{100,2,[81,90]},{150,1,[91,100]}]
A788: 785 | B788: 4 | C788: 4 | D788: 0 | E788: =R[-9]C -> 11 | F788: =R[-9]C -> 20 | G788: 3 | H788: 15000 | I788: 110003 | J788: 3 | K788: =R[-1]C -> [{7,3},{8,3},{9,3},{10,3},{11,3},{12,3},{17,10},{18,8},{19,1},{23,4},{24,10}] | L788: =R[-1]C -> [{7,27},{8,55},{9,27},{10,55},{11,27},{12,55},{17,18},{18,110},{19,3},{23,37},{24,37}] | M788: =R[-1]C -> [{0,1,[1,30]},{1,2,[11,40]},{2,5,[21,50]},{5,10,[31,60]},{10,20,[41,60]},{30,20,[51,70]},{50,10,[61,80]},{70,5,[71,80]},{100,2,[81,90]},{150,1,[91,100]}]
A789: 786 | B789: 4 | C789: 4 | D789: 0 | E789: =R[-9]C -> 21 | F789: =R[-9]C -> 30 | G789: 3 | H789: 15000 | I789: 110003 | J789: 3 | K789: =R[-1]C -> [{7,3},{8,3},{9,3},{10,3},{11,3},{12,3},{17,10},{18,8},{19,1},{23,4},{24,10}] | L789: =R[-1]C -> [{7,27},{8,55},{9,27},{10,55},{11,27},{12,55},{17,18},{18,110},{19,3},{23,37},{24,37}] | M789: =R[-1]C -> [{0,1,[1,30]},{1,2,[11,40]},{2,5,[21,50]},{5,10,[31,60]},{10,20,[41,60]},{30,20,[51,70]},{50,10,[61,80]},{70,5,[71,80]},{100,2,[81,90]},{150,1,[91,100]}]
A790: 787 | B790: 4 | C790: 4 | D790: 0 | E790: =R[-9]C -> 31 | F790: =R[-9]C -> 40 | G790: 3 | H790: 15000 | I790: 110003 | J790: 3 | K790: =R[-1]C -> [{7,3},{8,3},{9,3},{10,3},{11,3},{12,3},{17,10},{18,8},{19,1},{23,4},{24,10}] | L790: =R[-1]C -> [{7,27},{8,55},{9,27},{10,55},{11,27},{12,55},{17,18},{18,110},{19,3},{23,37},{24,37}] | M790: =R[-1]C -> [{0,1,[1,30]},{1,2,[11,40]},{2,5,[21,50]},{5,10,[31,60]},{10,20,[41,60]},{30,20,[51,70]},{50,10,[61,80]},{70,5,[71,80]},{100,2,[81,90]},{150,1,[91,100]}]
A791: 788 | B791: 4 | C791: 4 | D791: 0 | E791: =R[-9]C -> 41 | F791: =R[-9]C -> 50 | G791: 3 | H791: 15000 | I791: 110003 | J791: 3 | K791: =R[-1]C -> [{7,3},{8,3},{9,3},{10,3},{11,3},{12,3},{17,10},{18,8},{19,1},{23,4},{24,10}] | L791: =R[-1]C -> [{7,27},{8,55},{9,27},{10,55},{11,27},{12,55},{17,18},{18,110},{19,3},{23,37},{24,37}] | M791: =R[-1]C -> [{0,1,[1,30]},{1,2,[11,40]},{2,5,[21,50]},{5,10,[31,60]},{10,20,[41,60]},{30,20,[51,70]},{50,10,[61,80]},{70,5,[71,80]},{100,2,[81,90]},{150,1,[91,100]}]
A792: 789 | B792: 4 | C792: 4 | D792: 0 | E792: =R[-9]C -> 51 | F792: =R[-9]C -> 60 | G792: 3 | H792: 15000 | I792: 110003 | J792: 3 | K792: =R[-1]C -> [{7,3},{8,3},{9,3},{10,3},{11,3},{12,3},{17,10},{18,8},{19,1},{23,4},{24,10}] | L792: =R[-1]C -> [{7,27},{8,55},{9,27},{10,55},{11,27},{12,55},{17,18},{18,110},{19,3},{23,37},{24,37}] | M792: =R[-1]C -> [{0,1,[1,30]},{1,2,[11,40]},{2,5,[21,50]},{5,10,[31,60]},{10,20,[41,60]},{30,20,[51,70]},{50,10,[61,80]},{70,5,[71,80]},{100,2,[81,90]},{150,1,[91,100]}]
A793: 790 | B793: 4 | C793: 4 | D793: 0 | E793: =R[-9]C -> 61 | F793: =R[-9]C -> 70 | G793: 3 | H793: 15000 | I793: 110003 | J793: 3 | K793: =R[-1]C -> [{7,3},{8,3},{9,3},{10,3},{11,3},{12,3},{17,10},{18,8},{19,1},{23,4},{24,10}] | L793: =R[-1]C -> [{7,27},{8,55},{9,27},{10,55},{11,27},{12,55},{17,18},{18,110},{19,3},{23,37},{24,37}] | M793: =R[-1]C -> [{0,1,[1,30]},{1,2,[11,40]},{2,5,[21,50]},{5,10,[31,60]},{10,20,[41,60]},{30,20,[51,70]},{50,10,[61,80]},{70,5,[71,80]},{100,2,[81,90]},{150,1,[91,100]}]
A794: 791 | B794: 4 | C794: 4 | D794: 0 | E794: =R[-9]C -> 71 | F794: =R[-9]C -> 80 | G794: 3 | H794: 15000 | I794: 110003 | J794: 3 | K794: =R[-1]C -> [{7,3},{8,3},{9,3},{10,3},{11,3},{12,3},{17,10},{18,8},{19,1},{23,4},{24,10}] | L794: =R[-1]C -> [{7,27},{8,55},{9,27},{10,55},{11,27},{12,55},{17,18},{18,110},{19,3},{23,37},{24,37}] | M794: =R[-1]C -> [{0,1,[1,30]},{1,2,[11,40]},{2,5,[21,50]},{5,10,[31,60]},{10,20,[41,60]},{30,20,[51,70]},{50,10,[61,80]},{70,5,[71,80]},{100,2,[81,90]},{150,1,[91,100]}]
A795: 792 | B795: 4 | C795: 4 | D795: 0 | E795: =R[-9]C -> 81 | F795: =R[-9]C -> 90 | G795: 3 | H795: 15000 | I795: 110003 | J795: 3 | K795: =R[-1]C -> [{7,3},{8,3},{9,3},{10,3},{11,3},{12,3},{17,10},{18,8},{19,1},{23,4},{24,10}] | L795: =R[-1]C -> [{7,27},{8,55},{9,27},{10,55},{11,27},{12,55},{17,18},{18,110},{19,3},{23,37},{24,37}] | M795: =R[-1]C -> [{0,1,[1,30]},{1,2,[11,40]},{2,5,[21,50]},{5,10,[31,60]},{10,20,[41,60]},{30,20,[51,70]},{50,10,[61,80]},{70,5,[71,80]},{100,2,[81,90]},{150,1,[91,100]}]
A796: 793 | B796: 5 | C796: 4 | D796: 0 | E796: =R[-9]C -> 1 | F796: =R[-9]C -> 10 | G796: 4 | H796: 20000 | I796: 110003 | J796: 4 | K796: =R[-1]C -> [{7,3},{8,3},{9,3},{10,3},{11,3},{12,3},{17,10},{18,8},{19,1},{23,4},{24,10}] | L796: =R[-1]C -> [{7,27},{8,55},{9,27},{10,55},{11,27},{12,55},{17,18},{18,110},{19,3},{23,37},{24,37}] | M796: =R[-1]C -> [{0,1,[1,30]},{1,2,[11,40]},{2,5,[21,50]},{5,10,[31,60]},{10,20,[41,60]},{30,20,[51,70]},{50,10,[61,80]},{70,5,[71,80]},{100,2,[81,90]},{150,1,[91,100]}]
A797: 794 | B797: 5 | C797: 4 | D797: 0 | E797: =R[-9]C -> 11 | F797: =R[-9]C -> 20 | G797: 4 | H797: 20000 | I797: 110003 | J797: 4 | K797: =R[-1]C -> [{7,3},{8,3},{9,3},{10,3},{11,3},{12,3},{17,10},{18,8},{19,1},{23,4},{24,10}] | L797: =R[-1]C -> [{7,27},{8,55},{9,27},{10,55},{11,27},{12,55},{17,18},{18,110},{19,3},{23,37},{24,37}] | M797: =R[-1]C -> [{0,1,[1,30]},{1,2,[11,40]},{2,5,[21,50]},{5,10,[31,60]},{10,20,[41,60]},{30,20,[51,70]},{50,10,[61,80]},{70,5,[71,80]},{100,2,[81,90]},{150,1,[91,100]}]
A798: 795 | B798: 5 | C798: 4 | D798: 0 | E798: =R[-9]C -> 21 | F798: =R[-9]C -> 30 | G798: 4 | H798: 20000 | I798: 110003 | J798: 4 | K798: =R[-1]C -> [{7,3},{8,3},{9,3},{10,3},{11,3},{12,3},{17,10},{18,8},{19,1},{23,4},{24,10}] | L798: =R[-1]C -> [{7,27},{8,55},{9,27},{10,55},{11,27},{12,55},{17,18},{18,110},{19,3},{23,37},{24,37}] | M798: =R[-1]C -> [{0,1,[1,30]},{1,2,[11,40]},{2,5,[21,50]},{5,10,[31,60]},{10,20,[41,60]},{30,20,[51,70]},{50,10,[61,80]},{70,5,[71,80]},{100,2,[81,90]},{150,1,[91,100]}]
A799: 796 | B799: 5 | C799: 4 | D799: 0 | E799: =R[-9]C -> 31 | F799: =R[-9]C -> 40 | G799: 4 | H799: 20000 | I799: 110003 | J799: 4 | K799: =R[-1]C -> [{7,3},{8,3},{9,3},{10,3},{11,3},{12,3},{17,10},{18,8},{19,1},{23,4},{24,10}] | L799: =R[-1]C -> [{7,27},{8,55},{9,27},{10,55},{11,27},{12,55},{17,18},{18,110},{19,3},{23,37},{24,37}] | M799: =R[-1]C -> [{0,1,[1,30]},{1,2,[11,40]},{2,5,[21,50]},{5,10,[31,60]},{10,20,[41,60]},{30,20,[51,70]},{50,10,[61,80]},{70,5,[71,80]},{100,2,[81,90]},{150,1,[91,100]}]
A800: 797 | B800: 5 | C800: 4 | D800: 0 | E800: =R[-9]C -> 41 | F800: =R[-9]C -> 50 | G800: 4 | H800: 20000 | I800: 110003 | J800: 4 | K800: =R[-1]C -> [{7,3},{8,3},{9,3},{10,3},{11,3},{12,3},{17,10},{18,8},{19,1},{23,4},{24,10}] | L800: =R[-1]C -> [{7,27},{8,55},{9,27},{10,55},{11,27},{12,55},{17,18},{18,110},{19,3},{23,37},{24,37}] | M800: =R[-1]C -> [{0,1,[1,30]},{1,2,[11,40]},{2,5,[21,50]},{5,10,[31,60]},{10,20,[41,60]},{30,20,[51,70]},{50,10,[61,80]},{70,5,[71,80]},{100,2,[81,90]},{150,1,[91,100]}]
A801: 798 | B801: 5 | C801: 4 | D801: 0 | E801: =R[-9]C -> 51 | F801: =R[-9]C -> 60 | G801: 4 | H801: 20000 | I801: 110003 | J801: 4 | K801: =R[-1]C -> [{7,3},{8,3},{9,3},{10,3},{11,3},{12,3},{17,10},{18,8},{19,1},{23,4},{24,10}] | L801: =R[-1]C -> [{7,27},{8,55},{9,27},{10,55},{11,27},{12,55},{17,18},{18,110},{19,3},{23,37},{24,37}] | M801: =R[-1]C -> [{0,1,[1,30]},{1,2,[11,40]},{2,5,[21,50]},{5,10,[31,60]},{10,20,[41,60]},{30,20,[51,70]},{50,10,[61,80]},{70,5,[71,80]},{100,2,[81,90]},{150,1,[91,100]}]
A802: 799 | B802: 5 | C802: 4 | D802: 0 | E802: =R[-9]C -> 61 | F802: =R[-9]C -> 70 | G802: 4 | H802: 20000 | I802: 110003 | J802: 4 | K802: =R[-1]C -> [{7,3},{8,3},{9,3},{10,3},{11,3},{12,3},{17,10},{18,8},{19,1},{23,4},{24,10}] | L802: =R[-1]C -> [{7,27},{8,55},{9,27},{10,55},{11,27},{12,55},{17,18},{18,110},{19,3},{23,37},{24,37}] | M802: =R[-1]C -> [{0,1,[1,30]},{1,2,[11,40]},{2,5,[21,50]},{5,10,[31,60]},{10,20,[41,60]},{30,20,[51,70]},{50,10,[61,80]},{70,5,[71,80]},{100,2,[81,90]},{150,1,[91,100]}]
A803: 800 | B803: 5 | C803: 4 | D803: 0 | E803: =R[-9]C -> 71 | F803: =R[-9]C -> 80 | G803: 4 | H803: 20000 | I803: 110003 | J803: 4 | K803: =R[-1]C -> [{7,3},{8,3},{9,3},{10,3},{11,3},{12,3},{17,10},{18,8},{19,1},{23,4},{24,10}] | L803: =R[-1]C -> [{7,27},{8,55},{9,27},{10,55},{11,27},{12,55},{17,18},{18,110},{19,3},{23,37},{24,37}] | M803: =R[-1]C -> [{0,1,[1,30]},{1,2,[11,40]},{2,5,[21,50]},{5,10,[31,60]},{10,20,[41,60]},{30,20,[51,70]},{50,10,[61,80]},{70,5,[71,80]},{100,2,[81,90]},{150,1,[91,100]}]
A804: 801 | B804: 5 | C804: 4 | D804: 0 | E804: =R[-9]C -> 81 | F804: =R[-9]C -> 90 | G804: 4 | H804: 20000 | I804: 110003 | J804: 4 | K804: =R[-1]C -> [{7,3},{8,3},{9,3},{10,3},{11,3},{12,3},{17,10},{18,8},{19,1},{23,4},{24,10}] | L804: =R[-1]C -> [{7,27},{8,55},{9,27},{10,55},{11,27},{12,55},{17,18},{18,110},{19,3},{23,37},{24,37}] | M804: =R[-1]C -> [{0,1,[1,30]},{1,2,[11,40]},{2,5,[21,50]},{5,10,[31,60]},{10,20,[41,60]},{30,20,[51,70]},{50,10,[61,80]},{70,5,[71,80]},{100,2,[81,90]},{150,1,[91,100]}]
A805: 802 | B805: 6 | C805: 4 | D805: 0 | E805: =R[-9]C -> 1 | F805: =R[-9]C -> 10 | G805: 5 | H805: 20000 | I805: 110003 | J805: 5 | K805: =R[-1]C -> [{7,3},{8,3},{9,3},{10,3},{11,3},{12,3},{17,10},{18,8},{19,1},{23,4},{24,10}] | L805: =R[-1]C -> [{7,27},{8,55},{9,27},{10,55},{11,27},{12,55},{17,18},{18,110},{19,3},{23,37},{24,37}] | M805: =R[-1]C -> [{0,1,[1,30]},{1,2,[11,40]},{2,5,[21,50]},{5,10,[31,60]},{10,20,[41,60]},{30,20,[51,70]},{50,10,[61,80]},{70,5,[71,80]},{100,2,[81,90]},{150,1,[91,100]}]
A806: 803 | B806: 6 | C806: 4 | D806: 0 | E806: =R[-9]C -> 11 | F806: =R[-9]C -> 20 | G806: 5 | H806: 20000 | I806: 110003 | J806: 5 | K806: =R[-1]C -> [{7,3},{8,3},{9,3},{10,3},{11,3},{12,3},{17,10},{18,8},{19,1},{23,4},{24,10}] | L806: =R[-1]C -> [{7,27},{8,55},{9,27},{10,55},{11,27},{12,55},{17,18},{18,110},{19,3},{23,37},{24,37}] | M806: =R[-1]C -> [{0,1,[1,30]},{1,2,[11,40]},{2,5,[21,50]},{5,10,[31,60]},{10,20,[41,60]},{30,20,[51,70]},{50,10,[61,80]},{70,5,[71,80]},{100,2,[81,90]},{150,1,[91,100]}]
A807: 804 | B807: 6 | C807: 4 | D807: 0 | E807: =R[-9]C -> 21 | F807: =R[-9]C -> 30 | G807: 5 | H807: 20000 | I807: 110003 | J807: 5 | K807: =R[-1]C -> [{7,3},{8,3},{9,3},{10,3},{11,3},{12,3},{17,10},{18,8},{19,1},{23,4},{24,10}] | L807: =R[-1]C -> [{7,27},{8,55},{9,27},{10,55},{11,27},{12,55},{17,18},{18,110},{19,3},{23,37},{24,37}] | M807: =R[-1]C -> [{0,1,[1,30]},{1,2,[11,40]},{2,5,[21,50]},{5,10,[31,60]},{10,20,[41,60]},{30,20,[51,70]},{50,10,[61,80]},{70,5,[71,80]},{100,2,[81,90]},{150,1,[91,100]}]
A808: 805 | B808: 6 | C808: 4 | D808: 0 | E808: =R[-9]C -> 31 | F808: =R[-9]C -> 40 | G808: 5 | H808: 20000 | I808: 110003 | J808: 5 | K808: =R[-1]C -> [{7,3},{8,3},{9,3},{10,3},{11,3},{12,3},{17,10},{18,8},{19,1},{23,4},{24,10}] | L808: =R[-1]C -> [{7,27},{8,55},{9,27},{10,55},{11,27},{12,55},{17,18},{18,110},{19,3},{23,37},{24,37}] | M808: =R[-1]C -> [{0,1,[1,30]},{1,2,[11,40]},{2,5,[21,50]},{5,10,[31,60]},{10,20,[41,60]},{30,20,[51,70]},{50,10,[61,80]},{70,5,[71,80]},{100,2,[81,90]},{150,1,[91,100]}]
A809: 806 | B809: 6 | C809: 4 | D809: 0 | E809: =R[-9]C -> 41 | F809: =R[-9]C -> 50 | G809: 5 | H809: 20000 | I809: 110003 | J809: 5 | K809: =R[-1]C -> [{7,3},{8,3},{9,3},{10,3},{11,3},{12,3},{17,10},{18,8},{19,1},{23,4},{24,10}] | L809: =R[-1]C -> [{7,27},{8,55},{9,27},{10,55},{11,27},{12,55},{17,18},{18,110},{19,3},{23,37},{24,37}] | M809: =R[-1]C -> [{0,1,[1,30]},{1,2,[11,40]},{2,5,[21,50]},{5,10,[31,60]},{10,20,[41,60]},{30,20,[51,70]},{50,10,[61,80]},{70,5,[71,80]},{100,2,[81,90]},{150,1,[91,100]}]
A810: 807 | B810: 6 | C810: 4 | D810: 0 | E810: =R[-9]C -> 51 | F810: =R[-9]C -> 60 | G810: 5 | H810: 20000 | I810: 110003 | J810: 5 | K810: =R[-1]C -> [{7,3},{8,3},{9,3},{10,3},{11,3},{12,3},{17,10},{18,8},{19,1},{23,4},{24,10}] | L810: =R[-1]C -> [{7,27},{8,55},{9,27},{10,55},{11,27},{12,55},{17,18},{18,110},{19,3},{23,37},{24,37}] | M810: =R[-1]C -> [{0,1,[1,30]},{1,2,[11,40]},{2,5,[21,50]},{5,10,[31,60]},{10,20,[41,60]},{30,20,[51,70]},{50,10,[61,80]},{70,5,[71,80]},{100,2,[81,90]},{150,1,[91,100]}]
A811: 808 | B811: 6 | C811: 4 | D811: 0 | E811: =R[-9]C -> 61 | F811: =R[-9]C -> 70 | G811: 5 | H811: 20000 | I811: 110003 | J811: 5 | K811: =R[-1]C -> [{7,3},{8,3},{9,3},{10,3},{11,3},{12,3},{17,10},{18,8},{19,1},{23,4},{24,10}] | L811: =R[-1]C -> [{7,27},{8,55},{9,27},{10,55},{11,27},{12,55},{17,18},{18,110},{19,3},{23,37},{24,37}] | M811: =R[-1]C -> [{0,1,[1,30]},{1,2,[11,40]},{2,5,[21,50]},{5,10,[31,60]},{10,20,[41,60]},{30,20,[51,70]},{50,10,[61,80]},{70,5,[71,80]},{100,2,[81,90]},{150,1,[91,100]}]
A812: 809 | B812: 6 | C812: 4 | D812: 0 | E812: =R[-9]C -> 71 | F812: =R[-9]C -> 80 | G812: 5 | H812: 20000 | I812: 110003 | J812: 5 | K812: =R[-1]C -> [{7,3},{8,3},{9,3},{10,3},{11,3},{12,3},{17,10},{18,8},{19,1},{23,4},{24,10}] | L812: =R[-1]C -> [{7,27},{8,55},{9,27},{10,55},{11,27},{12,55},{17,18},{18,110},{19,3},{23,37},{24,37}] | M812: =R[-1]C -> [{0,1,[1,30]},{1,2,[11,40]},{2,5,[21,50]},{5,10,[31,60]},{10,20,[41,60]},{30,20,[51,70]},{50,10,[61,80]},{70,5,[71,80]},{100,2,[81,90]},{150,1,[91,100]}]
A813: 810 | B813: 6 | C813: 4 | D813: 0 | E813: =R[-9]C -> 81 | F813: =R[-9]C -> 90 | G813: 5 | H813: 20000 | I813: 110003 | J813: 5 | K813: =R[-1]C -> [{7,3},{8,3},{9,3},{10,3},{11,3},{12,3},{17,10},{18,8},{19,1},{23,4},{24,10}] | L813: =R[-1]C -> [{7,27},{8,55},{9,27},{10,55},{11,27},{12,55},{17,18},{18,110},{19,3},{23,37},{24,37}] | M813: =R[-1]C -> [{0,1,[1,30]},{1,2,[11,40]},{2,5,[21,50]},{5,10,[31,60]},{10,20,[41,60]},{30,20,[51,70]},{50,10,[61,80]},{70,5,[71,80]},{100,2,[81,90]},{150,1,[91,100]}]
A814: 811 | B814: 2 | C814: 6 | D814: 0 | E814: =R[-18]C -> 1 | F814: =R[-18]C -> 10 | G814: 1 | H814: 5000 | I814: 110003 | J814: 1 | K814: =R[-1]C -> [{7,3},{8,3},{9,3},{10,3},{11,3},{12,3},{17,10},{18,8},{19,1},{23,4},{24,10}] | L814: =R[-1]C -> [{7,27},{8,55},{9,27},{10,55},{11,27},{12,55},{17,18},{18,110},{19,3},{23,37},{24,37}] | M814: =R[-1]C -> [{0,1,[1,30]},{1,2,[11,40]},{2,5,[21,50]},{5,10,[31,60]},{10,20,[41,60]},{30,20,[51,70]},{50,10,[61,80]},{70,5,[71,80]},{100,2,[81,90]},{150,1,[91,100]}]
A815: 812 | B815: 2 | C815: 6 | D815: 0 | E815: =R[-18]C -> 11 | F815: =R[-18]C -> 20 | G815: 1 | H815: 5000 | I815: 110003 | J815: 1 | K815: =R[-1]C -> [{7,3},{8,3},{9,3},{10,3},{11,3},{12,3},{17,10},{18,8},{19,1},{23,4},{24,10}] | L815: =R[-1]C -> [{7,27},{8,55},{9,27},{10,55},{11,27},{12,55},{17,18},{18,110},{19,3},{23,37},{24,37}] | M815: =R[-1]C -> [{0,1,[1,30]},{1,2,[11,40]},{2,5,[21,50]},{5,10,[31,60]},{10,20,[41,60]},{30,20,[51,70]},{50,10,[61,80]},{70,5,[71,80]},{100,2,[81,90]},{150,1,[91,100]}]
A816: 813 | B816: 2 | C816: 6 | D816: 0 | E816: =R[-18]C -> 21 | F816: =R[-18]C -> 30 | G816: 1 | H816: 5000 | I816: 110003 | J816: 1 | K816: =R[-1]C -> [{7,3},{8,3},{9,3},{10,3},{11,3},{12,3},{17,10},{18,8},{19,1},{23,4},{24,10}] | L816: =R[-1]C -> [{7,27},{8,55},{9,27},{10,55},{11,27},{12,55},{17,18},{18,110},{19,3},{23,37},{24,37}] | M816: =R[-1]C -> [{0,1,[1,30]},{1,2,[11,40]},{2,5,[21,50]},{5,10,[31,60]},{10,20,[41,60]},{30,20,[51,70]},{50,10,[61,80]},{70,5,[71,80]},{100,2,[81,90]},{150,1,[91,100]}]
A817: 814 | B817: 2 | C817: 6 | D817: 0 | E817: =R[-18]C -> 31 | F817: =R[-18]C -> 40 | G817: 1 | H817: 5000 | I817: 110003 | J817: 1 | K817: =R[-1]C -> [{7,3},{8,3},{9,3},{10,3},{11,3},{12,3},{17,10},{18,8},{19,1},{23,4},{24,10}] | L817: =R[-1]C -> [{7,27},{8,55},{9,27},{10,55},{11,27},{12,55},{17,18},{18,110},{19,3},{23,37},{24,37}] | M817: =R[-1]C -> [{0,1,[1,30]},{1,2,[11,40]},{2,5,[21,50]},{5,10,[31,60]},{10,20,[41,60]},{30,20,[51,70]},{50,10,[61,80]},{70,5,[71,80]},{100,2,[81,90]},{150,1,[91,100]}]
A818: 815 | B818: 2 | C818: 6 | D818: 0 | E818: =R[-18]C -> 41 | F818: =R[-18]C -> 50 | G818: 1 | H818: 5000 | I818: 110003 | J818: 1 | K818: =R[-1]C -> [{7,3},{8,3},{9,3},{10,3},{11,3},{12,3},{17,10},{18,8},{19,1},{23,4},{24,10}] | L818: =R[-1]C -> [{7,27},{8,55},{9,27},{10,55},{11,27},{12,55},{17,18},{18,110},{19,3},{23,37},{24,37}] | M818: =R[-1]C -> [{0,1,[1,30]},{1,2,[11,40]},{2,5,[21,50]},{5,10,[31,60]},{10,20,[41,60]},{30,20,[51,70]},{50,10,[61,80]},{70,5,[71,80]},{100,2,[81,90]},{150,1,[91,100]}]
A819: 816 | B819: 2 | C819: 6 | D819: 0 | E819: =R[-18]C -> 51 | F819: =R[-18]C -> 60 | G819: 1 | H819: 5000 | I819: 110003 | J819: 1 | K819: =R[-1]C -> [{7,3},{8,3},{9,3},{10,3},{11,3},{12,3},{17,10},{18,8},{19,1},{23,4},{24,10}] | L819: =R[-1]C -> [{7,27},{8,55},{9,27},{10,55},{11,27},{12,55},{17,18},{18,110},{19,3},{23,37},{24,37}] | M819: =R[-1]C -> [{0,1,[1,30]},{1,2,[11,40]},{2,5,[21,50]},{5,10,[31,60]},{10,20,[41,60]},{30,20,[51,70]},{50,10,[61,80]},{70,5,[71,80]},{100,2,[81,90]},{150,1,[91,100]}]
A820: 817 | B820: 2 | C820: 6 | D820: 0 | E820: =R[-18]C -> 61 | F820: =R[-18]C -> 70 | G820: 1 | H820: 5000 | I820: 110003 | J820: 1 | K820: =R[-1]C -> [{7,3},{8,3},{9,3},{10,3},{11,3},{12,3},{17,10},{18,8},{19,1},{23,4},{24,10}] | L820: =R[-1]C -> [{7,27},{8,55},{9,27},{10,55},{11,27},{12,55},{17,18},{18,110},{19,3},{23,37},{24,37}] | M820: =R[-1]C -> [{0,1,[1,30]},{1,2,[11,40]},{2,5,[21,50]},{5,10,[31,60]},{10,20,[41,60]},{30,20,[51,70]},{50,10,[61,80]},{70,5,[71,80]},{100,2,[81,90]},{150,1,[91,100]}]
A821: 818 | B821: 2 | C821: 6 | D821: 0 | E821: =R[-18]C -> 71 | F821: =R[-18]C -> 80 | G821: 1 | H821: 5000 | I821: 110003 | J821: 1 | K821: =R[-1]C -> [{7,3},{8,3},{9,3},{10,3},{11,3},{12,3},{17,10},{18,8},{19,1},{23,4},{24,10}] | L821: =R[-1]C -> [{7,27},{8,55},{9,27},{10,55},{11,27},{12,55},{17,18},{18,110},{19,3},{23,37},{24,37}] | M821: =R[-1]C -> [{0,1,[1,30]},{1,2,[11,40]},{2,5,[21,50]},{5,10,[31,60]},{10,20,[41,60]},{30,20,[51,70]},{50,10,[61,80]},{70,5,[71,80]},{100,2,[81,90]},{150,1,[91,100]}]
A822: 819 | B822: 2 | C822: 6 | D822: 0 | E822: =R[-18]C -> 81 | F822: =R[-18]C -> 90 | G822: 1 | H822: 5000 | I822: 110003 | J822: 1 | K822: =R[-1]C -> [{7,3},{8,3},{9,3},{10,3},{11,3},{12,3},{17,10},{18,8},{19,1},{23,4},{24,10}] | L822: =R[-1]C -> [{7,27},{8,55},{9,27},{10,55},{11,27},{12,55},{17,18},{18,110},{19,3},{23,37},{24,37}] | M822: =R[-1]C -> [{0,1,[1,30]},{1,2,[11,40]},{2,5,[21,50]},{5,10,[31,60]},{10,20,[41,60]},{30,20,[51,70]},{50,10,[61,80]},{70,5,[71,80]},{100,2,[81,90]},{150,1,[91,100]}]
A823: 820 | B823: 3 | C823: 6 | D823: 0 | E823: =R[-9]C -> 1 | F823: =R[-9]C -> 10 | G823: 2 | H823: 10000 | I823: 110003 | J823: 2 | K823: =R[-1]C -> [{7,3},{8,3},{9,3},{10,3},{11,3},{12,3},{17,10},{18,8},{19,1},{23,4},{24,10}] | L823: =R[-1]C -> [{7,27},{8,55},{9,27},{10,55},{11,27},{12,55},{17,18},{18,110},{19,3},{23,37},{24,37}] | M823: =R[-1]C -> [{0,1,[1,30]},{1,2,[11,40]},{2,5,[21,50]},{5,10,[31,60]},{10,20,[41,60]},{30,20,[51,70]},{50,10,[61,80]},{70,5,[71,80]},{100,2,[81,90]},{150,1,[91,100]}]
A824: 821 | B824: 3 | C824: 6 | D824: 0 | E824: =R[-9]C -> 11 | F824: =R[-9]C -> 20 | G824: 2 | H824: 10000 | I824: 110003 | J824: 2 | K824: =R[-1]C -> [{7,3},{8,3},{9,3},{10,3},{11,3},{12,3},{17,10},{18,8},{19,1},{23,4},{24,10}] | L824: =R[-1]C -> [{7,27},{8,55},{9,27},{10,55},{11,27},{12,55},{17,18},{18,110},{19,3},{23,37},{24,37}] | M824: =R[-1]C -> [{0,1,[1,30]},{1,2,[11,40]},{2,5,[21,50]},{5,10,[31,60]},{10,20,[41,60]},{30,20,[51,70]},{50,10,[61,80]},{70,5,[71,80]},{100,2,[81,90]},{150,1,[91,100]}]
A825: 822 | B825: 3 | C825: 6 | D825: 0 | E825: =R[-9]C -> 21 | F825: =R[-9]C -> 30 | G825: 2 | H825: 10000 | I825: 110003 | J825: 2 | K825: =R[-1]C -> [{7,3},{8,3},{9,3},{10,3},{11,3},{12,3},{17,10},{18,8},{19,1},{23,4},{24,10}] | L825: =R[-1]C -> [{7,27},{8,55},{9,27},{10,55},{11,27},{12,55},{17,18},{18,110},{19,3},{23,37},{24,37}] | M825: =R[-1]C -> [{0,1,[1,30]},{1,2,[11,40]},{2,5,[21,50]},{5,10,[31,60]},{10,20,[41,60]},{30,20,[51,70]},{50,10,[61,80]},{70,5,[71,80]},{100,2,[81,90]},{150,1,[91,100]}]
A826: 823 | B826: 3 | C826: 6 | D826: 0 | E826: =R[-9]C -> 31 | F826: =R[-9]C -> 40 | G826: 2 | H826: 10000 | I826: 110003 | J826: 2 | K826: =R[-1]C -> [{7,3},{8,3},{9,3},{10,3},{11,3},{12,3},{17,10},{18,8},{19,1},{23,4},{24,10}] | L826: =R[-1]C -> [{7,27},{8,55},{9,27},{10,55},{11,27},{12,55},{17,18},{18,110},{19,3},{23,37},{24,37}] | M826: =R[-1]C -> [{0,1,[1,30]},{1,2,[11,40]},{2,5,[21,50]},{5,10,[31,60]},{10,20,[41,60]},{30,20,[51,70]},{50,10,[61,80]},{70,5,[71,80]},{100,2,[81,90]},{150,1,[91,100]}]
A827: 824 | B827: 3 | C827: 6 | D827: 0 | E827: =R[-9]C -> 41 | F827: =R[-9]C -> 50 | G827: 2 | H827: 10000 | I827: 110003 | J827: 2 | K827: =R[-1]C -> [{7,3},{8,3},{9,3},{10,3},{11,3},{12,3},{17,10},{18,8},{19,1},{23,4},{24,10}] | L827: =R[-1]C -> [{7,27},{8,55},{9,27},{10,55},{11,27},{12,55},{17,18},{18,110},{19,3},{23,37},{24,37}] | M827: =R[-1]C -> [{0,1,[1,30]},{1,2,[11,40]},{2,5,[21,50]},{5,10,[31,60]},{10,20,[41,60]},{30,20,[51,70]},{50,10,[61,80]},{70,5,[71,80]},{100,2,[81,90]},{150,1,[91,100]}]
A828: 825 | B828: 3 | C828: 6 | D828: 0 | E828: =R[-9]C -> 51 | F828: =R[-9]C -> 60 | G828: 2 | H828: 10000 | I828: 110003 | J828: 2 | K828: =R[-1]C -> [{7,3},{8,3},{9,3},{10,3},{11,3},{12,3},{17,10},{18,8},{19,1},{23,4},{24,10}] | L828: =R[-1]C -> [{7,27},{8,55},{9,27},{10,55},{11,27},{12,55},{17,18},{18,110},{19,3},{23,37},{24,37}] | M828: =R[-1]C -> [{0,1,[1,30]},{1,2,[11,40]},{2,5,[21,50]},{5,10,[31,60]},{10,20,[41,60]},{30,20,[51,70]},{50,10,[61,80]},{70,5,[71,80]},{100,2,[81,90]},{150,1,[91,100]}]
A829: 826 | B829: 3 | C829: 6 | D829: 0 | E829: =R[-9]C -> 61 | F829: =R[-9]C -> 70 | G829: 2 | H829: 10000 | I829: 110003 | J829: 2 | K829: =R[-1]C -> [{7,3},{8,3},{9,3},{10,3},{11,3},{12,3},{17,10},{18,8},{19,1},{23,4},{24,10}] | L829: =R[-1]C -> [{7,27},{8,55},{9,27},{10,55},{11,27},{12,55},{17,18},{18,110},{19,3},{23,37},{24,37}] | M829: =R[-1]C -> [{0,1,[1,30]},{1,2,[11,40]},{2,5,[21,50]},{5,10,[31,60]},{10,20,[41,60]},{30,20,[51,70]},{50,10,[61,80]},{70,5,[71,80]},{100,2,[81,90]},{150,1,[91,100]}]
A830: 827 | B830: 3 | C830: 6 | D830: 0 | E830: =R[-9]C -> 71 | F830: =R[-9]C -> 80 | G830: 2 | H830: 10000 | I830: 110003 | J830: 2 | K830: =R[-1]C -> [{7,3},{8,3},{9,3},{10,3},{11,3},{12,3},{17,10},{18,8},{19,1},{23,4},{24,10}] | L830: =R[-1]C -> [{7,27},{8,55},{9,27},{10,55},{11,27},{12,55},{17,18},{18,110},{19,3},{23,37},{24,37}] | M830: =R[-1]C -> [{0,1,[1,30]},{1,2,[11,40]},{2,5,[21,50]},{5,10,[31,60]},{10,20,[41,60]},{30,20,[51,70]},{50,10,[61,80]},{70,5,[71,80]},{100,2,[81,90]},{150,1,[91,100]}]
A831: 828 | B831: 3 | C831: 6 | D831: 0 | E831: =R[-9]C -> 81 | F831: =R[-9]C -> 90 | G831: 2 | H831: 10000 | I831: 110003 | J831: 2 | K831: =R[-1]C -> [{7,3},{8,3},{9,3},{10,3},{11,3},{12,3},{17,10},{18,8},{19,1},{23,4},{24,10}] | L831: =R[-1]C -> [{7,27},{8,55},{9,27},{10,55},{11,27},{12,55},{17,18},{18,110},{19,3},{23,37},{24,37}] | M831: =R[-1]C -> [{0,1,[1,30]},{1,2,[11,40]},{2,5,[21,50]},{5,10,[31,60]},{10,20,[41,60]},{30,20,[51,70]},{50,10,[61,80]},{70,5,[71,80]},{100,2,[81,90]},{150,1,[91,100]}]
A832: 829 | B832: 4 | C832: 6 | D832: 0 | E832: =R[-9]C -> 1 | F832: =R[-9]C -> 10 | G832: 3 | H832: 15000 | I832: 110003 | J832: 3 | K832: =R[-1]C -> [{7,3},{8,3},{9,3},{10,3},{11,3},{12,3},{17,10},{18,8},{19,1},{23,4},{24,10}] | L832: =R[-1]C -> [{7,27},{8,55},{9,27},{10,55},{11,27},{12,55},{17,18},{18,110},{19,3},{23,37},{24,37}] | M832: =R[-1]C -> [{0,1,[1,30]},{1,2,[11,40]},{2,5,[21,50]},{5,10,[31,60]},{10,20,[41,60]},{30,20,[51,70]},{50,10,[61,80]},{70,5,[71,80]},{100,2,[81,90]},{150,1,[91,100]}]
A833: 830 | B833: 4 | C833: 6 | D833: 0 | E833: =R[-9]C -> 11 | F833: =R[-9]C -> 20 | G833: 3 | H833: 15000 | I833: 110003 | J833: 3 | K833: =R[-1]C -> [{7,3},{8,3},{9,3},{10,3},{11,3},{12,3},{17,10},{18,8},{19,1},{23,4},{24,10}] | L833: =R[-1]C -> [{7,27},{8,55},{9,27},{10,55},{11,27},{12,55},{17,18},{18,110},{19,3},{23,37},{24,37}] | M833: =R[-1]C -> [{0,1,[1,30]},{1,2,[11,40]},{2,5,[21,50]},{5,10,[31,60]},{10,20,[41,60]},{30,20,[51,70]},{50,10,[61,80]},{70,5,[71,80]},{100,2,[81,90]},{150,1,[91,100]}]
A834: 831 | B834: 4 | C834: 6 | D834: 0 | E834: =R[-9]C -> 21 | F834: =R[-9]C -> 30 | G834: 3 | H834: 15000 | I834: 110003 | J834: 3 | K834: =R[-1]C -> [{7,3},{8,3},{9,3},{10,3},{11,3},{12,3},{17,10},{18,8},{19,1},{23,4},{24,10}] | L834: =R[-1]C -> [{7,27},{8,55},{9,27},{10,55},{11,27},{12,55},{17,18},{18,110},{19,3},{23,37},{24,37}] | M834: =R[-1]C -> [{0,1,[1,30]},{1,2,[11,40]},{2,5,[21,50]},{5,10,[31,60]},{10,20,[41,60]},{30,20,[51,70]},{50,10,[61,80]},{70,5,[71,80]},{100,2,[81,90]},{150,1,[91,100]}]
A835: 832 | B835: 4 | C835: 6 | D835: 0 | E835: =R[-9]C -> 31 | F835: =R[-9]C -> 40 | G835: 3 | H835: 15000 | I835: 110003 | J835: 3 | K835: =R[-1]C -> [{7,3},{8,3},{9,3},{10,3},{11,3},{12,3},{17,10},{18,8},{19,1},{23,4},{24,10}] | L835: =R[-1]C -> [{7,27},{8,55},{9,27},{10,55},{11,27},{12,55},{17,18},{18,110},{19,3},{23,37},{24,37}] | M835: =R[-1]C -> [{0,1,[1,30]},{1,2,[11,40]},{2,5,[21,50]},{5,10,[31,60]},{10,20,[41,60]},{30,20,[51,70]},{50,10,[61,80]},{70,5,[71,80]},{100,2,[81,90]},{150,1,[91,100]}]
A836: 833 | B836: 4 | C836: 6 | D836: 0 | E836: =R[-9]C -> 41 | F836: =R[-9]C -> 50 | G836: 3 | H836: 15000 | I836: 110003 | J836: 3 | K836: =R[-1]C -> [{7,3},{8,3},{9,3},{10,3},{11,3},{12,3},{17,10},{18,8},{19,1},{23,4},{24,10}] | L836: =R[-1]C -> [{7,27},{8,55},{9,27},{10,55},{11,27},{12,55},{17,18},{18,110},{19,3},{23,37},{24,37}] | M836: =R[-1]C -> [{0,1,[1,30]},{1,2,[11,40]},{2,5,[21,50]},{5,10,[31,60]},{10,20,[41,60]},{30,20,[51,70]},{50,10,[61,80]},{70,5,[71,80]},{100,2,[81,90]},{150,1,[91,100]}]
A837: 834 | B837: 4 | C837: 6 | D837: 0 | E837: =R[-9]C -> 51 | F837: =R[-9]C -> 60 | G837: 3 | H837: 15000 | I837: 110003 | J837: 3 | K837: =R[-1]C -> [{7,3},{8,3},{9,3},{10,3},{11,3},{12,3},{17,10},{18,8},{19,1},{23,4},{24,10}] | L837: =R[-1]C -> [{7,27},{8,55},{9,27},{10,55},{11,27},{12,55},{17,18},{18,110},{19,3},{23,37},{24,37}] | M837: =R[-1]C -> [{0,1,[1,30]},{1,2,[11,40]},{2,5,[21,50]},{5,10,[31,60]},{10,20,[41,60]},{30,20,[51,70]},{50,10,[61,80]},{70,5,[71,80]},{100,2,[81,90]},{150,1,[91,100]}]
A838: 835 | B838: 4 | C838: 6 | D838: 0 | E838: =R[-9]C -> 61 | F838: =R[-9]C -> 70 | G838: 3 | H838: 15000 | I838: 110003 | J838: 3 | K838: =R[-1]C -> [{7,3},{8,3},{9,3},{10,3},{11,3},{12,3},{17,10},{18,8},{19,1},{23,4},{24,10}] | L838: =R[-1]C -> [{7,27},{8,55},{9,27},{10,55},{11,27},{12,55},{17,18},{18,110},{19,3},{23,37},{24,37}] | M838: =R[-1]C -> [{0,1,[1,30]},{1,2,[11,40]},{2,5,[21,50]},{5,10,[31,60]},{10,20,[41,60]},{30,20,[51,70]},{50,10,[61,80]},{70,5,[71,80]},{100,2,[81,90]},{150,1,[91,100]}]
A839: 836 | B839: 4 | C839: 6 | D839: 0 | E839: =R[-9]C -> 71 | F839: =R[-9]C -> 80 | G839: 3 | H839: 15000 | I839: 110003 | J839: 3 | K839: =R[-1]C -> [{7,3},{8,3},{9,3},{10,3},{11,3},{12,3},{17,10},{18,8},{19,1},{23,4},{24,10}] | L839: =R[-1]C -> [{7,27},{8,55},{9,27},{10,55},{11,27},{12,55},{17,18},{18,110},{19,3},{23,37},{24,37}] | M839: =R[-1]C -> [{0,1,[1,30]},{1,2,[11,40]},{2,5,[21,50]},{5,10,[31,60]},{10,20,[41,60]},{30,20,[51,70]},{50,10,[61,80]},{70,5,[71,80]},{100,2,[81,90]},{150,1,[91,100]}]
A840: 837 | B840: 4 | C840: 6 | D840: 0 | E840: =R[-9]C -> 81 | F840: =R[-9]C -> 90 | G840: 3 | H840: 15000 | I840: 110003 | J840: 3 | K840: =R[-1]C -> [{7,3},{8,3},{9,3},{10,3},{11,3},{12,3},{17,10},{18,8},{19,1},{23,4},{24,10}] | L840: =R[-1]C -> [{7,27},{8,55},{9,27},{10,55},{11,27},{12,55},{17,18},{18,110},{19,3},{23,37},{24,37}] | M840: =R[-1]C -> [{0,1,[1,30]},{1,2,[11,40]},{2,5,[21,50]},{5,10,[31,60]},{10,20,[41,60]},{30,20,[51,70]},{50,10,[61,80]},{70,5,[71,80]},{100,2,[81,90]},{150,1,[91,100]}]
A841: 838 | B841: 5 | C841: 6 | D841: 0 | E841: =R[-9]C -> 1 | F841: =R[-9]C -> 10 | G841: 4 | H841: 20000 | I841: 110003 | J841: 4 | K841: =R[-1]C -> [{7,3},{8,3},{9,3},{10,3},{11,3},{12,3},{17,10},{18,8},{19,1},{23,4},{24,10}] | L841: =R[-1]C -> [{7,27},{8,55},{9,27},{10,55},{11,27},{12,55},{17,18},{18,110},{19,3},{23,37},{24,37}] | M841: =R[-1]C -> [{0,1,[1,30]},{1,2,[11,40]},{2,5,[21,50]},{5,10,[31,60]},{10,20,[41,60]},{30,20,[51,70]},{50,10,[61,80]},{70,5,[71,80]},{100,2,[81,90]},{150,1,[91,100]}]
A842: 839 | B842: 5 | C842: 6 | D842: 0 | E842: =R[-9]C -> 11 | F842: =R[-9]C -> 20 | G842: 4 | H842: 20000 | I842: 110003 | J842: 4 | K842: =R[-1]C -> [{7,3},{8,3},{9,3},{10,3},{11,3},{12,3},{17,10},{18,8},{19,1},{23,4},{24,10}] | L842: =R[-1]C -> [{7,27},{8,55},{9,27},{10,55},{11,27},{12,55},{17,18},{18,110},{19,3},{23,37},{24,37}] | M842: =R[-1]C -> [{0,1,[1,30]},{1,2,[11,40]},{2,5,[21,50]},{5,10,[31,60]},{10,20,[41,60]},{30,20,[51,70]},{50,10,[61,80]},{70,5,[71,80]},{100,2,[81,90]},{150,1,[91,100]}]
A843: 840 | B843: 5 | C843: 6 | D843: 0 | E843: =R[-9]C -> 21 | F843: =R[-9]C -> 30 | G843: 4 | H843: 20000 | I843: 110003 | J843: 4 | K843: =R[-1]C -> [{7,3},{8,3},{9,3},{10,3},{11,3},{12,3},{17,10},{18,8},{19,1},{23,4},{24,10}] | L843: =R[-1]C -> [{7,27},{8,55},{9,27},{10,55},{11,27},{12,55},{17,18},{18,110},{19,3},{23,37},{24,37}] | M843: =R[-1]C -> [{0,1,[1,30]},{1,2,[11,40]},{2,5,[21,50]},{5,10,[31,60]},{10,20,[41,60]},{30,20,[51,70]},{50,10,[61,80]},{70,5,[71,80]},{100,2,[81,90]},{150,1,[91,100]}]
A844: 841 | B844: 5 | C844: 6 | D844: 0 | E844: =R[-9]C -> 31 | F844: =R[-9]C -> 40 | G844: 4 | H844: 20000 | I844: 110003 | J844: 4 | K844: =R[-1]C -> [{7,3},{8,3},{9,3},{10,3},{11,3},{12,3},{17,10},{18,8},{19,1},{23,4},{24,10}] | L844: =R[-1]C -> [{7,27},{8,55},{9,27},{10,55},{11,27},{12,55},{17,18},{18,110},{19,3},{23,37},{24,37}] | M844: =R[-1]C -> [{0,1,[1,30]},{1,2,[11,40]},{2,5,[21,50]},{5,10,[31,60]},{10,20,[41,60]},{30,20,[51,70]},{50,10,[61,80]},{70,5,[71,80]},{100,2,[81,90]},{150,1,[91,100]}]
A845: 842 | B845: 5 | C845: 6 | D845: 0 | E845: =R[-9]C -> 41 | F845: =R[-9]C -> 50 | G845: 4 | H845: 20000 | I845: 110003 | J845: 4 | K845: =R[-1]C -> [{7,3},{8,3},{9,3},{10,3},{11,3},{12,3},{17,10},{18,8},{19,1},{23,4},{24,10}] | L845: =R[-1]C -> [{7,27},{8,55},{9,27},{10,55},{11,27},{12,55},{17,18},{18,110},{19,3},{23,37},{24,37}] | M845: =R[-1]C -> [{0,1,[1,30]},{1,2,[11,40]},{2,5,[21,50]},{5,10,[31,60]},{10,20,[41,60]},{30,20,[51,70]},{50,10,[61,80]},{70,5,[71,80]},{100,2,[81,90]},{150,1,[91,100]}]
A846: 843 | B846: 5 | C846: 6 | D846: 0 | E846: =R[-9]C -> 51 | F846: =R[-9]C -> 60 | G846: 4 | H846: 20000 | I846: 110003 | J846: 4 | K846: =R[-1]C -> [{7,3},{8,3},{9,3},{10,3},{11,3},{12,3},{17,10},{18,8},{19,1},{23,4},{24,10}] | L846: =R[-1]C -> [{7,27},{8,55},{9,27},{10,55},{11,27},{12,55},{17,18},{18,110},{19,3},{23,37},{24,37}] | M846: =R[-1]C -> [{0,1,[1,30]},{1,2,[11,40]},{2,5,[21,50]},{5,10,[31,60]},{10,20,[41,60]},{30,20,[51,70]},{50,10,[61,80]},{70,5,[71,80]},{100,2,[81,90]},{150,1,[91,100]}]
A847: 844 | B847: 5 | C847: 6 | D847: 0 | E847: =R[-9]C -> 61 | F847: =R[-9]C -> 70 | G847: 4 | H847: 20000 | I847: 110003 | J847: 4 | K847: =R[-1]C -> [{7,3},{8,3},{9,3},{10,3},{11,3},{12,3},{17,10},{18,8},{19,1},{23,4},{24,10}] | L847: =R[-1]C -> [{7,27},{8,55},{9,27},{10,55},{11,27},{12,55},{17,18},{18,110},{19,3},{23,37},{24,37}] | M847: =R[-1]C -> [{0,1,[1,30]},{1,2,[11,40]},{2,5,[21,50]},{5,10,[31,60]},{10,20,[41,60]},{30,20,[51,70]},{50,10,[61,80]},{70,5,[71,80]},{100,2,[81,90]},{150,1,[91,100]}]
A848: 845 | B848: 5 | C848: 6 | D848: 0 | E848: =R[-9]C -> 71 | F848: =R[-9]C -> 80 | G848: 4 | H848: 20000 | I848: 110003 | J848: 4 | K848: =R[-1]C -> [{7,3},{8,3},{9,3},{10,3},{11,3},{12,3},{17,10},{18,8},{19,1},{23,4},{24,10}] | L848: =R[-1]C -> [{7,27},{8,55},{9,27},{10,55},{11,27},{12,55},{17,18},{18,110},{19,3},{23,37},{24,37}] | M848: =R[-1]C -> [{0,1,[1,30]},{1,2,[11,40]},{2,5,[21,50]},{5,10,[31,60]},{10,20,[41,60]},{30,20,[51,70]},{50,10,[61,80]},{70,5,[71,80]},{100,2,[81,90]},{150,1,[91,100]}]
A849: 846 | B849: 5 | C849: 6 | D849: 0 | E849: =R[-9]C -> 81 | F849: =R[-9]C -> 90 | G849: 4 | H849: 20000 | I849: 110003 | J849: 4 | K849: =R[-1]C -> [{7,3},{8,3},{9,3},{10,3},{11,3},{12,3},{17,10},{18,8},{19,1},{23,4},{24,10}] | L849: =R[-1]C -> [{7,27},{8,55},{9,27},{10,55},{11,27},{12,55},{17,18},{18,110},{19,3},{23,37},{24,37}] | M849: =R[-1]C -> [{0,1,[1,30]},{1,2,[11,40]},{2,5,[21,50]},{5,10,[31,60]},{10,20,[41,60]},{30,20,[51,70]},{50,10,[61,80]},{70,5,[71,80]},{100,2,[81,90]},{150,1,[91,100]}]
A850: 847 | B850: 6 | C850: 6 | D850: 0 | E850: =R[-9]C -> 1 | F850: =R[-9]C -> 10 | G850: 5 | H850: 20000 | I850: 110003 | J850: 5 | K850: =R[-1]C -> [{7,3},{8,3},{9,3},{10,3},{11,3},{12,3},{17,10},{18,8},{19,1},{23,4},{24,10}] | L850: =R[-1]C -> [{7,27},{8,55},{9,27},{10,55},{11,27},{12,55},{17,18},{18,110},{19,3},{23,37},{24,37}] | M850: =R[-1]C -> [{0,1,[1,30]},{1,2,[11,40]},{2,5,[21,50]},{5,10,[31,60]},{10,20,[41,60]},{30,20,[51,70]},{50,10,[61,80]},{70,5,[71,80]},{100,2,[81,90]},{150,1,[91,100]}]
A851: 848 | B851: 6 | C851: 6 | D851: 0 | E851: =R[-9]C -> 11 | F851: =R[-9]C -> 20 | G851: 5 | H851: 20000 | I851: 110003 | J851: 5 | K851: =R[-1]C -> [{7,3},{8,3},{9,3},{10,3},{11,3},{12,3},{17,10},{18,8},{19,1},{23,4},{24,10}] | L851: =R[-1]C -> [{7,27},{8,55},{9,27},{10,55},{11,27},{12,55},{17,18},{18,110},{19,3},{23,37},{24,37}] | M851: =R[-1]C -> [{0,1,[1,30]},{1,2,[11,40]},{2,5,[21,50]},{5,10,[31,60]},{10,20,[41,60]},{30,20,[51,70]},{50,10,[61,80]},{70,5,[71,80]},{100,2,[81,90]},{150,1,[91,100]}]
A852: 849 | B852: 6 | C852: 6 | D852: 0 | E852: =R[-9]C -> 21 | F852: =R[-9]C -> 30 | G852: 5 | H852: 20000 | I852: 110003 | J852: 5 | K852: =R[-1]C -> [{7,3},{8,3},{9,3},{10,3},{11,3},{12,3},{17,10},{18,8},{19,1},{23,4},{24,10}] | L852: =R[-1]C -> [{7,27},{8,55},{9,27},{10,55},{11,27},{12,55},{17,18},{18,110},{19,3},{23,37},{24,37}] | M852: =R[-1]C -> [{0,1,[1,30]},{1,2,[11,40]},{2,5,[21,50]},{5,10,[31,60]},{10,20,[41,60]},{30,20,[51,70]},{50,10,[61,80]},{70,5,[71,80]},{100,2,[81,90]},{150,1,[91,100]}]
A853: 850 | B853: 6 | C853: 6 | D853: 0 | E853: =R[-9]C -> 31 | F853: =R[-9]C -> 40 | G853: 5 | H853: 20000 | I853: 110003 | J853: 5 | K853: =R[-1]C -> [{7,3},{8,3},{9,3},{10,3},{11,3},{12,3},{17,10},{18,8},{19,1},{23,4},{24,10}] | L853: =R[-1]C -> [{7,27},{8,55},{9,27},{10,55},{11,27},{12,55},{17,18},{18,110},{19,3},{23,37},{24,37}] | M853: =R[-1]C -> [{0,1,[1,30]},{1,2,[11,40]},{2,5,[21,50]},{5,10,[31,60]},{10,20,[41,60]},{30,20,[51,70]},{50,10,[61,80]},{70,5,[71,80]},{100,2,[81,90]},{150,1,[91,100]}]
A854: 851 | B854: 6 | C854: 6 | D854: 0 | E854: =R[-9]C -> 41 | F854: =R[-9]C -> 50 | G854: 5 | H854: 20000 | I854: 110003 | J854: 5 | K854: =R[-1]C -> [{7,3},{8,3},{9,3},{10,3},{11,3},{12,3},{17,10},{18,8},{19,1},{23,4},{24,10}] | L854: =R[-1]C -> [{7,27},{8,55},{9,27},{10,55},{11,27},{12,55},{17,18},{18,110},{19,3},{23,37},{24,37}] | M854: =R[-1]C -> [{0,1,[1,30]},{1,2,[11,40]},{2,5,[21,50]},{5,10,[31,60]},{10,20,[41,60]},{30,20,[51,70]},{50,10,[61,80]},{70,5,[71,80]},{100,2,[81,90]},{150,1,[91,100]}]
A855: 852 | B855: 6 | C855: 6 | D855: 0 | E855: =R[-9]C -> 51 | F855: =R[-9]C -> 60 | G855: 5 | H855: 20000 | I855: 110003 | J855: 5 | K855: =R[-1]C -> [{7,3},{8,3},{9,3},{10,3},{11,3},{12,3},{17,10},{18,8},{19,1},{23,4},{24,10}] | L855: =R[-1]C -> [{7,27},{8,55},{9,27},{10,55},{11,27},{12,55},{17,18},{18,110},{19,3},{23,37},{24,37}] | M855: =R[-1]C -> [{0,1,[1,30]},{1,2,[11,40]},{2,5,[21,50]},{5,10,[31,60]},{10,20,[41,60]},{30,20,[51,70]},{50,10,[61,80]},{70,5,[71,80]},{100,2,[81,90]},{150,1,[91,100]}]
A856: 853 | B856: 6 | C856: 6 | D856: 0 | E856: =R[-9]C -> 61 | F856: =R[-9]C -> 70 | G856: 5 | H856: 20000 | I856: 110003 | J856: 5 | K856: =R[-1]C -> [{7,3},{8,3},{9,3},{10,3},{11,3},{12,3},{17,10},{18,8},{19,1},{23,4},{24,10}] | L856: =R[-1]C -> [{7,27},{8,55},{9,27},{10,55},{11,27},{12,55},{17,18},{18,110},{19,3},{23,37},{24,37}] | M856: =R[-1]C -> [{0,1,[1,30]},{1,2,[11,40]},{2,5,[21,50]},{5,10,[31,60]},{10,20,[41,60]},{30,20,[51,70]},{50,10,[61,80]},{70,5,[71,80]},{100,2,[81,90]},{150,1,[91,100]}]
A857: 854 | B857: 6 | C857: 6 | D857: 0 | E857: =R[-9]C -> 71 | F857: =R[-9]C -> 80 | G857: 5 | H857: 20000 | I857: 110003 | J857: 5 | K857: =R[-1]C -> [{7,3},{8,3},{9,3},{10,3},{11,3},{12,3},{17,10},{18,8},{19,1},{23,4},{24,10}] | L857: =R[-1]C -> [{7,27},{8,55},{9,27},{10,55},{11,27},{12,55},{17,18},{18,110},{19,3},{23,37},{24,37}] | M857: =R[-1]C -> [{0,1,[1,30]},{1,2,[11,40]},{2,5,[21,50]},{5,10,[31,60]},{10,20,[41,60]},{30,20,[51,70]},{50,10,[61,80]},{70,5,[71,80]},{100,2,[81,90]},{150,1,[91,100]}]
A858: 855 | B858: 6 | C858: 6 | D858: 0 | E858: =R[-9]C -> 81 | F858: =R[-9]C -> 90 | G858: 5 | H858: 20000 | I858: 110003 | J858: 5 | K858: =R[-1]C -> [{7,3},{8,3},{9,3},{10,3},{11,3},{12,3},{17,10},{18,8},{19,1},{23,4},{24,10}] | L858: =R[-1]C -> [{7,27},{8,55},{9,27},{10,55},{11,27},{12,55},{17,18},{18,110},{19,3},{23,37},{24,37}] | M858: =R[-1]C -> [{0,1,[1,30]},{1,2,[11,40]},{2,5,[21,50]},{5,10,[31,60]},{10,20,[41,60]},{30,20,[51,70]},{50,10,[61,80]},{70,5,[71,80]},{100,2,[81,90]},{150,1,[91,100]}]
A859: 856 | B859: 2 | C859: 7 | D859: 0 | E859: =R[-18]C -> 1 | F859: =R[-18]C -> 10 | G859: 1 | H859: 5000 | I859: 110003 | J859: 1 | K859: =R[-1]C -> [{7,3},{8,3},{9,3},{10,3},{11,3},{12,3},{17,10},{18,8},{19,1},{23,4},{24,10}] | L859: =R[-1]C -> [{7,27},{8,55},{9,27},{10,55},{11,27},{12,55},{17,18},{18,110},{19,3},{23,37},{24,37}] | M859: =R[-1]C -> [{0,1,[1,30]},{1,2,[11,40]},{2,5,[21,50]},{5,10,[31,60]},{10,20,[41,60]},{30,20,[51,70]},{50,10,[61,80]},{70,5,[71,80]},{100,2,[81,90]},{150,1,[91,100]}]
A860: 857 | B860: 2 | C860: 7 | D860: 0 | E860: =R[-18]C -> 11 | F860: =R[-18]C -> 20 | G860: 1 | H860: 5000 | I860: 110003 | J860: 1 | K860: =R[-1]C -> [{7,3},{8,3},{9,3},{10,3},{11,3},{12,3},{17,10},{18,8},{19,1},{23,4},{24,10}] | L860: =R[-1]C -> [{7,27},{8,55},{9,27},{10,55},{11,27},{12,55},{17,18},{18,110},{19,3},{23,37},{24,37}] | M860: =R[-1]C -> [{0,1,[1,30]},{1,2,[11,40]},{2,5,[21,50]},{5,10,[31,60]},{10,20,[41,60]},{30,20,[51,70]},{50,10,[61,80]},{70,5,[71,80]},{100,2,[81,90]},{150,1,[91,100]}]
A861: 858 | B861: 2 | C861: 7 | D861: 0 | E861: =R[-18]C -> 21 | F861: =R[-18]C -> 30 | G861: 1 | H861: 5000 | I861: 110003 | J861: 1 | K861: =R[-1]C -> [{7,3},{8,3},{9,3},{10,3},{11,3},{12,3},{17,10},{18,8},{19,1},{23,4},{24,10}] | L861: =R[-1]C -> [{7,27},{8,55},{9,27},{10,55},{11,27},{12,55},{17,18},{18,110},{19,3},{23,37},{24,37}] | M861: =R[-1]C -> [{0,1,[1,30]},{1,2,[11,40]},{2,5,[21,50]},{5,10,[31,60]},{10,20,[41,60]},{30,20,[51,70]},{50,10,[61,80]},{70,5,[71,80]},{100,2,[81,90]},{150,1,[91,100]}]
A862: 859 | B862: 2 | C862: 7 | D862: 0 | E862: =R[-18]C -> 31 | F862: =R[-18]C -> 40 | G862: 1 | H862: 5000 | I862: 110003 | J862: 1 | K862: =R[-1]C -> [{7,3},{8,3},{9,3},{10,3},{11,3},{12,3},{17,10},{18,8},{19,1},{23,4},{24,10}] | L862: =R[-1]C -> [{7,27},{8,55},{9,27},{10,55},{11,27},{12,55},{17,18},{18,110},{19,3},{23,37},{24,37}] | M862: =R[-1]C -> [{0,1,[1,30]},{1,2,[11,40]},{2,5,[21,50]},{5,10,[31,60]},{10,20,[41,60]},{30,20,[51,70]},{50,10,[61,80]},{70,5,[71,80]},{100,2,[81,90]},{150,1,[91,100]}]
A863: 860 | B863: 2 | C863: 7 | D863: 0 | E863: =R[-18]C -> 41 | F863: =R[-18]C -> 50 | G863: 1 | H863: 5000 | I863: 110003 | J863: 1 | K863: =R[-1]C -> [{7,3},{8,3},{9,3},{10,3},{11,3},{12,3},{17,10},{18,8},{19,1},{23,4},{24,10}] | L863: =R[-1]C -> [{7,27},{8,55},{9,27},{10,55},{11,27},{12,55},{17,18},{18,110},{19,3},{23,37},{24,37}] | M863: =R[-1]C -> [{0,1,[1,30]},{1,2,[11,40]},{2,5,[21,50]},{5,10,[31,60]},{10,20,[41,60]},{30,20,[51,70]},{50,10,[61,80]},{70,5,[71,80]},{100,2,[81,90]},{150,1,[91,100]}]
A864: 861 | B864: 2 | C864: 7 | D864: 0 | E864: =R[-18]C -> 51 | F864: =R[-18]C -> 60 | G864: 1 | H864: 5000 | I864: 110003 | J864: 1 | K864: =R[-1]C -> [{7,3},{8,3},{9,3},{10,3},{11,3},{12,3},{17,10},{18,8},{19,1},{23,4},{24,10}] | L864: =R[-1]C -> [{7,27},{8,55},{9,27},{10,55},{11,27},{12,55},{17,18},{18,110},{19,3},{23,37},{24,37}] | M864: =R[-1]C -> [{0,1,[1,30]},{1,2,[11,40]},{2,5,[21,50]},{5,10,[31,60]},{10,20,[41,60]},{30,20,[51,70]},{50,10,[61,80]},{70,5,[71,80]},{100,2,[81,90]},{150,1,[91,100]}]
A865: 862 | B865: 2 | C865: 7 | D865: 0 | E865: =R[-18]C -> 61 | F865: =R[-18]C -> 70 | G865: 1 | H865: 5000 | I865: 110003 | J865: 1 | K865: =R[-1]C -> [{7,3},{8,3},{9,3},{10,3},{11,3},{12,3},{17,10},{18,8},{19,1},{23,4},{24,10}] | L865: =R[-1]C -> [{7,27},{8,55},{9,27},{10,55},{11,27},{12,55},{17,18},{18,110},{19,3},{23,37},{24,37}] | M865: =R[-1]C -> [{0,1,[1,30]},{1,2,[11,40]},{2,5,[21,50]},{5,10,[31,60]},{10,20,[41,60]},{30,20,[51,70]},{50,10,[61,80]},{70,5,[71,80]},{100,2,[81,90]},{150,1,[91,100]}]
A866: 863 | B866: 2 | C866: 7 | D866: 0 | E866: =R[-18]C -> 71 | F866: =R[-18]C -> 80 | G866: 1 | H866: 5000 | I866: 110003 | J866: 1 | K866: =R[-1]C -> [{7,3},{8,3},{9,3},{10,3},{11,3},{12,3},{17,10},{18,8},{19,1},{23,4},{24,10}] | L866: =R[-1]C -> [{7,27},{8,55},{9,27},{10,55},{11,27},{12,55},{17,18},{18,110},{19,3},{23,37},{24,37}] | M866: =R[-1]C -> [{0,1,[1,30]},{1,2,[11,40]},{2,5,[21,50]},{5,10,[31,60]},{10,20,[41,60]},{30,20,[51,70]},{50,10,[61,80]},{70,5,[71,80]},{100,2,[81,90]},{150,1,[91,100]}]
A867: 864 | B867: 2 | C867: 7 | D867: 0 | E867: =R[-18]C -> 81 | F867: =R[-18]C -> 90 | G867: 1 | H867: 5000 | I867: 110003 | J867: 1 | K867: =R[-1]C -> [{7,3},{8,3},{9,3},{10,3},{11,3},{12,3},{17,10},{18,8},{19,1},{23,4},{24,10}] | L867: =R[-1]C -> [{7,27},{8,55},{9,27},{10,55},{11,27},{12,55},{17,18},{18,110},{19,3},{23,37},{24,37}] | M867: =R[-1]C -> [{0,1,[1,30]},{1,2,[11,40]},{2,5,[21,50]},{5,10,[31,60]},{10,20,[41,60]},{30,20,[51,70]},{50,10,[61,80]},{70,5,[71,80]},{100,2,[81,90]},{150,1,[91,100]}]
A868: 865 | B868: 3 | C868: 7 | D868: 0 | E868: =R[-9]C -> 1 | F868: =R[-9]C -> 10 | G868: 2 | H868: 10000 | I868: 110003 | J868: 2 | K868: =R[-1]C -> [{7,3},{8,3},{9,3},{10,3},{11,3},{12,3},{17,10},{18,8},{19,1},{23,4},{24,10}] | L868: =R[-1]C -> [{7,27},{8,55},{9,27},{10,55},{11,27},{12,55},{17,18},{18,110},{19,3},{23,37},{24,37}] | M868: =R[-1]C -> [{0,1,[1,30]},{1,2,[11,40]},{2,5,[21,50]},{5,10,[31,60]},{10,20,[41,60]},{30,20,[51,70]},{50,10,[61,80]},{70,5,[71,80]},{100,2,[81,90]},{150,1,[91,100]}]
A869: 866 | B869: 3 | C869: 7 | D869: 0 | E869: =R[-9]C -> 11 | F869: =R[-9]C -> 20 | G869: 2 | H869: 10000 | I869: 110003 | J869: 2 | K869: =R[-1]C -> [{7,3},{8,3},{9,3},{10,3},{11,3},{12,3},{17,10},{18,8},{19,1},{23,4},{24,10}] | L869: =R[-1]C -> [{7,27},{8,55},{9,27},{10,55},{11,27},{12,55},{17,18},{18,110},{19,3},{23,37},{24,37}] | M869: =R[-1]C -> [{0,1,[1,30]},{1,2,[11,40]},{2,5,[21,50]},{5,10,[31,60]},{10,20,[41,60]},{30,20,[51,70]},{50,10,[61,80]},{70,5,[71,80]},{100,2,[81,90]},{150,1,[91,100]}]
A870: 867 | B870: 3 | C870: 7 | D870: 0 | E870: =R[-9]C -> 21 | F870: =R[-9]C -> 30 | G870: 2 | H870: 10000 | I870: 110003 | J870: 2 | K870: =R[-1]C -> [{7,3},{8,3},{9,3},{10,3},{11,3},{12,3},{17,10},{18,8},{19,1},{23,4},{24,10}] | L870: =R[-1]C -> [{7,27},{8,55},{9,27},{10,55},{11,27},{12,55},{17,18},{18,110},{19,3},{23,37},{24,37}] | M870: =R[-1]C -> [{0,1,[1,30]},{1,2,[11,40]},{2,5,[21,50]},{5,10,[31,60]},{10,20,[41,60]},{30,20,[51,70]},{50,10,[61,80]},{70,5,[71,80]},{100,2,[81,90]},{150,1,[91,100]}]
A871: 868 | B871: 3 | C871: 7 | D871: 0 | E871: =R[-9]C -> 31 | F871: =R[-9]C -> 40 | G871: 2 | H871: 10000 | I871: 110003 | J871: 2 | K871: =R[-1]C -> [{7,3},{8,3},{9,3},{10,3},{11,3},{12,3},{17,10},{18,8},{19,1},{23,4},{24,10}] | L871: =R[-1]C -> [{7,27},{8,55},{9,27},{10,55},{11,27},{12,55},{17,18},{18,110},{19,3},{23,37},{24,37}] | M871: =R[-1]C -> [{0,1,[1,30]},{1,2,[11,40]},{2,5,[21,50]},{5,10,[31,60]},{10,20,[41,60]},{30,20,[51,70]},{50,10,[61,80]},{70,5,[71,80]},{100,2,[81,90]},{150,1,[91,100]}]
A872: 869 | B872: 3 | C872: 7 | D872: 0 | E872: =R[-9]C -> 41 | F872: =R[-9]C -> 50 | G872: 2 | H872: 10000 | I872: 110003 | J872: 2 | K872: =R[-1]C -> [{7,3},{8,3},{9,3},{10,3},{11,3},{12,3},{17,10},{18,8},{19,1},{23,4},{24,10}] | L872: =R[-1]C -> [{7,27},{8,55},{9,27},{10,55},{11,27},{12,55},{17,18},{18,110},{19,3},{23,37},{24,37}] | M872: =R[-1]C -> [{0,1,[1,30]},{1,2,[11,40]},{2,5,[21,50]},{5,10,[31,60]},{10,20,[41,60]},{30,20,[51,70]},{50,10,[61,80]},{70,5,[71,80]},{100,2,[81,90]},{150,1,[91,100]}]
A873: 870 | B873: 3 | C873: 7 | D873: 0 | E873: =R[-9]C -> 51 | F873: =R[-9]C -> 60 | G873: 2 | H873: 10000 | I873: 110003 | J873: 2 | K873: =R[-1]C -> [{7,3},{8,3},{9,3},{10,3},{11,3},{12,3},{17,10},{18,8},{19,1},{23,4},{24,10}] | L873: =R[-1]C -> [{7,27},{8,55},{9,27},{10,55},{11,27},{12,55},{17,18},{18,110},{19,3},{23,37},{24,37}] | M873: =R[-1]C -> [{0,1,[1,30]},{1,2,[11,40]},{2,5,[21,50]},{5,10,[31,60]},{10,20,[41,60]},{30,20,[51,70]},{50,10,[61,80]},{70,5,[71,80]},{100,2,[81,90]},{150,1,[91,100]}]
A874: 871 | B874: 3 | C874: 7 | D874: 0 | E874: =R[-9]C -> 61 | F874: =R[-9]C -> 70 | G874: 2 | H874: 10000 | I874: 110003 | J874: 2 | K874: =R[-1]C -> [{7,3},{8,3},{9,3},{10,3},{11,3},{12,3},{17,10},{18,8},{19,1},{23,4},{24,10}] | L874: =R[-1]C -> [{7,27},{8,55},{9,27},{10,55},{11,27},{12,55},{17,18},{18,110},{19,3},{23,37},{24,37}] | M874: =R[-1]C -> [{0,1,[1,30]},{1,2,[11,40]},{2,5,[21,50]},{5,10,[31,60]},{10,20,[41,60]},{30,20,[51,70]},{50,10,[61,80]},{70,5,[71,80]},{100,2,[81,90]},{150,1,[91,100]}]
A875: 872 | B875: 3 | C875: 7 | D875: 0 | E875: =R[-9]C -> 71 | F875: =R[-9]C -> 80 | G875: 2 | H875: 10000 | I875: 110003 | J875: 2 | K875: =R[-1]C -> [{7,3},{8,3},{9,3},{10,3},{11,3},{12,3},{17,10},{18,8},{19,1},{23,4},{24,10}] | L875: =R[-1]C -> [{7,27},{8,55},{9,27},{10,55},{11,27},{12,55},{17,18},{18,110},{19,3},{23,37},{24,37}] | M875: =R[-1]C -> [{0,1,[1,30]},{1,2,[11,40]},{2,5,[21,50]},{5,10,[31,60]},{10,20,[41,60]},{30,20,[51,70]},{50,10,[61,80]},{70,5,[71,80]},{100,2,[81,90]},{150,1,[91,100]}]
A876: 873 | B876: 3 | C876: 7 | D876: 0 | E876: =R[-9]C -> 81 | F876: =R[-9]C -> 90 | G876: 2 | H876: 10000 | I876: 110003 | J876: 2 | K876: =R[-1]C -> [{7,3},{8,3},{9,3},{10,3},{11,3},{12,3},{17,10},{18,8},{19,1},{23,4},{24,10}] | L876: =R[-1]C -> [{7,27},{8,55},{9,27},{10,55},{11,27},{12,55},{17,18},{18,110},{19,3},{23,37},{24,37}] | M876: =R[-1]C -> [{0,1,[1,30]},{1,2,[11,40]},{2,5,[21,50]},{5,10,[31,60]},{10,20,[41,60]},{30,20,[51,70]},{50,10,[61,80]},{70,5,[71,80]},{100,2,[81,90]},{150,1,[91,100]}]
A877: 874 | B877: 4 | C877: 7 | D877: 0 | E877: =R[-9]C -> 1 | F877: =R[-9]C -> 10 | G877: 3 | H877: 15000 | I877: 110003 | J877: 3 | K877: =R[-1]C -> [{7,3},{8,3},{9,3},{10,3},{11,3},{12,3},{17,10},{18,8},{19,1},{23,4},{24,10}] | L877: =R[-1]C -> [{7,27},{8,55},{9,27},{10,55},{11,27},{12,55},{17,18},{18,110},{19,3},{23,37},{24,37}] | M877: =R[-1]C -> [{0,1,[1,30]},{1,2,[11,40]},{2,5,[21,50]},{5,10,[31,60]},{10,20,[41,60]},{30,20,[51,70]},{50,10,[61,80]},{70,5,[71,80]},{100,2,[81,90]},{150,1,[91,100]}]
A878: 875 | B878: 4 | C878: 7 | D878: 0 | E878: =R[-9]C -> 11 | F878: =R[-9]C -> 20 | G878: 3 | H878: 15000 | I878: 110003 | J878: 3 | K878: =R[-1]C -> [{7,3},{8,3},{9,3},{10,3},{11,3},{12,3},{17,10},{18,8},{19,1},{23,4},{24,10}] | L878: =R[-1]C -> [{7,27},{8,55},{9,27},{10,55},{11,27},{12,55},{17,18},{18,110},{19,3},{23,37},{24,37}] | M878: =R[-1]C -> [{0,1,[1,30]},{1,2,[11,40]},{2,5,[21,50]},{5,10,[31,60]},{10,20,[41,60]},{30,20,[51,70]},{50,10,[61,80]},{70,5,[71,80]},{100,2,[81,90]},{150,1,[91,100]}]
A879: 876 | B879: 4 | C879: 7 | D879: 0 | E879: =R[-9]C -> 21 | F879: =R[-9]C -> 30 | G879: 3 | H879: 15000 | I879: 110003 | J879: 3 | K879: =R[-1]C -> [{7,3},{8,3},{9,3},{10,3},{11,3},{12,3},{17,10},{18,8},{19,1},{23,4},{24,10}] | L879: =R[-1]C -> [{7,27},{8,55},{9,27},{10,55},{11,27},{12,55},{17,18},{18,110},{19,3},{23,37},{24,37}] | M879: =R[-1]C -> [{0,1,[1,30]},{1,2,[11,40]},{2,5,[21,50]},{5,10,[31,60]},{10,20,[41,60]},{30,20,[51,70]},{50,10,[61,80]},{70,5,[71,80]},{100,2,[81,90]},{150,1,[91,100]}]
A880: 877 | B880: 4 | C880: 7 | D880: 0 | E880: =R[-9]C -> 31 | F880: =R[-9]C -> 40 | G880: 3 | H880: 15000 | I880: 110003 | J880: 3 | K880: =R[-1]C -> [{7,3},{8,3},{9,3},{10,3},{11,3},{12,3},{17,10},{18,8},{19,1},{23,4},{24,10}] | L880: =R[-1]C -> [{7,27},{8,55},{9,27},{10,55},{11,27},{12,55},{17,18},{18,110},{19,3},{23,37},{24,37}] | M880: =R[-1]C -> [{0,1,[1,30]},{1,2,[11,40]},{2,5,[21,50]},{5,10,[31,60]},{10,20,[41,60]},{30,20,[51,70]},{50,10,[61,80]},{70,5,[71,80]},{100,2,[81,90]},{150,1,[91,100]}]
A881: 878 | B881: 4 | C881: 7 | D881: 0 | E881: =R[-9]C -> 41 | F881: =R[-9]C -> 50 | G881: 3 | H881: 15000 | I881: 110003 | J881: 3 | K881: =R[-1]C -> [{7,3},{8,3},{9,3},{10,3},{11,3},{12,3},{17,10},{18,8},{19,1},{23,4},{24,10}] | L881: =R[-1]C -> [{7,27},{8,55},{9,27},{10,55},{11,27},{12,55},{17,18},{18,110},{19,3},{23,37},{24,37}] | M881: =R[-1]C -> [{0,1,[1,30]},{1,2,[11,40]},{2,5,[21,50]},{5,10,[31,60]},{10,20,[41,60]},{30,20,[51,70]},{50,10,[61,80]},{70,5,[71,80]},{100,2,[81,90]},{150,1,[91,100]}]
A882: 879 | B882: 4 | C882: 7 | D882: 0 | E882: =R[-9]C -> 51 | F882: =R[-9]C -> 60 | G882: 3 | H882: 15000 | I882: 110003 | J882: 3 | K882: =R[-1]C -> [{7,3},{8,3},{9,3},{10,3},{11,3},{12,3},{17,10},{18,8},{19,1},{23,4},{24,10}] | L882: =R[-1]C -> [{7,27},{8,55},{9,27},{10,55},{11,27},{12,55},{17,18},{18,110},{19,3},{23,37},{24,37}] | M882: =R[-1]C -> [{0,1,[1,30]},{1,2,[11,40]},{2,5,[21,50]},{5,10,[31,60]},{10,20,[41,60]},{30,20,[51,70]},{50,10,[61,80]},{70,5,[71,80]},{100,2,[81,90]},{150,1,[91,100]}]
A883: 880 | B883: 4 | C883: 7 | D883: 0 | E883: =R[-9]C -> 61 | F883: =R[-9]C -> 70 | G883: 3 | H883: 15000 | I883: 110003 | J883: 3 | K883: =R[-1]C -> [{7,3},{8,3},{9,3},{10,3},{11,3},{12,3},{17,10},{18,8},{19,1},{23,4},{24,10}] | L883: =R[-1]C -> [{7,27},{8,55},{9,27},{10,55},{11,27},{12,55},{17,18},{18,110},{19,3},{23,37},{24,37}] | M883: =R[-1]C -> [{0,1,[1,30]},{1,2,[11,40]},{2,5,[21,50]},{5,10,[31,60]},{10,20,[41,60]},{30,20,[51,70]},{50,10,[61,80]},{70,5,[71,80]},{100,2,[81,90]},{150,1,[91,100]}]
A884: 881 | B884: 4 | C884: 7 | D884: 0 | E884: =R[-9]C -> 71 | F884: =R[-9]C -> 80 | G884: 3 | H884: 15000 | I884: 110003 | J884: 3 | K884: =R[-1]C -> [{7,3},{8,3},{9,3},{10,3},{11,3},{12,3},{17,10},{18,8},{19,1},{23,4},{24,10}] | L884: =R[-1]C -> [{7,27},{8,55},{9,27},{10,55},{11,27},{12,55},{17,18},{18,110},{19,3},{23,37},{24,37}] | M884: =R[-1]C -> [{0,1,[1,30]},{1,2,[11,40]},{2,5,[21,50]},{5,10,[31,60]},{10,20,[41,60]},{30,20,[51,70]},{50,10,[61,80]},{70,5,[71,80]},{100,2,[81,90]},{150,1,[91,100]}]
A885: 882 | B885: 4 | C885: 7 | D885: 0 | E885: =R[-9]C -> 81 | F885: =R[-9]C -> 90 | G885: 3 | H885: 15000 | I885: 110003 | J885: 3 | K885: =R[-1]C -> [{7,3},{8,3},{9,3},{10,3},{11,3},{12,3},{17,10},{18,8},{19,1},{23,4},{24,10}] | L885: =R[-1]C -> [{7,27},{8,55},{9,27},{10,55},{11,27},{12,55},{17,18},{18,110},{19,3},{23,37},{24,37}] | M885: =R[-1]C -> [{0,1,[1,30]},{1,2,[11,40]},{2,5,[21,50]},{5,10,[31,60]},{10,20,[41,60]},{30,20,[51,70]},{50,10,[61,80]},{70,5,[71,80]},{100,2,[81,90]},{150,1,[91,100]}]
A886: 883 | B886: 5 | C886: 7 | D886: 0 | E886: =R[-9]C -> 1 | F886: =R[-9]C -> 10 | G886: 4 | H886: 20000 | I886: 110003 | J886: 4 | K886: =R[-1]C -> [{7,3},{8,3},{9,3},{10,3},{11,3},{12,3},{17,10},{18,8},{19,1},{23,4},{24,10}] | L886: =R[-1]C -> [{7,27},{8,55},{9,27},{10,55},{11,27},{12,55},{17,18},{18,110},{19,3},{23,37},{24,37}] | M886: =R[-1]C -> [{0,1,[1,30]},{1,2,[11,40]},{2,5,[21,50]},{5,10,[31,60]},{10,20,[41,60]},{30,20,[51,70]},{50,10,[61,80]},{70,5,[71,80]},{100,2,[81,90]},{150,1,[91,100]}]
A887: 884 | B887: 5 | C887: 7 | D887: 0 | E887: =R[-9]C -> 11 | F887: =R[-9]C -> 20 | G887: 4 | H887: 20000 | I887: 110003 | J887: 4 | K887: =R[-1]C -> [{7,3},{8,3},{9,3},{10,3},{11,3},{12,3},{17,10},{18,8},{19,1},{23,4},{24,10}] | L887: =R[-1]C -> [{7,27},{8,55},{9,27},{10,55},{11,27},{12,55},{17,18},{18,110},{19,3},{23,37},{24,37}] | M887: =R[-1]C -> [{0,1,[1,30]},{1,2,[11,40]},{2,5,[21,50]},{5,10,[31,60]},{10,20,[41,60]},{30,20,[51,70]},{50,10,[61,80]},{70,5,[71,80]},{100,2,[81,90]},{150,1,[91,100]}]
A888: 885 | B888: 5 | C888: 7 | D888: 0 | E888: =R[-9]C -> 21 | F888: =R[-9]C -> 30 | G888: 4 | H888: 20000 | I888: 110003 | J888: 4 | K888: =R[-1]C -> [{7,3},{8,3},{9,3},{10,3},{11,3},{12,3},{17,10},{18,8},{19,1},{23,4},{24,10}] | L888: =R[-1]C -> [{7,27},{8,55},{9,27},{10,55},{11,27},{12,55},{17,18},{18,110},{19,3},{23,37},{24,37}] | M888: =R[-1]C -> [{0,1,[1,30]},{1,2,[11,40]},{2,5,[21,50]},{5,10,[31,60]},{10,20,[41,60]},{30,20,[51,70]},{50,10,[61,80]},{70,5,[71,80]},{100,2,[81,90]},{150,1,[91,100]}]
A889: 886 | B889: 5 | C889: 7 | D889: 0 | E889: =R[-9]C -> 31 | F889: =R[-9]C -> 40 | G889: 4 | H889: 20000 | I889: 110003 | J889: 4 | K889: =R[-1]C -> [{7,3},{8,3},{9,3},{10,3},{11,3},{12,3},{17,10},{18,8},{19,1},{23,4},{24,10}] | L889: =R[-1]C -> [{7,27},{8,55},{9,27},{10,55},{11,27},{12,55},{17,18},{18,110},{19,3},{23,37},{24,37}] | M889: =R[-1]C -> [{0,1,[1,30]},{1,2,[11,40]},{2,5,[21,50]},{5,10,[31,60]},{10,20,[41,60]},{30,20,[51,70]},{50,10,[61,80]},{70,5,[71,80]},{100,2,[81,90]},{150,1,[91,100]}]
A890: 887 | B890: 5 | C890: 7 | D890: 0 | E890: =R[-9]C -> 41 | F890: =R[-9]C -> 50 | G890: 4 | H890: 20000 | I890: 110003 | J890: 4 | K890: =R[-1]C -> [{7,3},{8,3},{9,3},{10,3},{11,3},{12,3},{17,10},{18,8},{19,1},{23,4},{24,10}] | L890: =R[-1]C -> [{7,27},{8,55},{9,27},{10,55},{11,27},{12,55},{17,18},{18,110},{19,3},{23,37},{24,37}] | M890: =R[-1]C -> [{0,1,[1,30]},{1,2,[11,40]},{2,5,[21,50]},{5,10,[31,60]},{10,20,[41,60]},{30,20,[51,70]},{50,10,[61,80]},{70,5,[71,80]},{100,2,[81,90]},{150,1,[91,100]}]
A891: 888 | B891: 5 | C891: 7 | D891: 0 | E891: =R[-9]C -> 51 | F891: =R[-9]C -> 60 | G891: 4 | H891: 20000 | I891: 110003 | J891: 4 | K891: =R[-1]C -> [{7,3},{8,3},{9,3},{10,3},{11,3},{12,3},{17,10},{18,8},{19,1},{23,4},{24,10}] | L891: =R[-1]C -> [{7,27},{8,55},{9,27},{10,55},{11,27},{12,55},{17,18},{18,110},{19,3},{23,37},{24,37}] | M891: =R[-1]C -> [{0,1,[1,30]},{1,2,[11,40]},{2,5,[21,50]},{5,10,[31,60]},{10,20,[41,60]},{30,20,[51,70]},{50,10,[61,80]},{70,5,[71,80]},{100,2,[81,90]},{150,1,[91,100]}]
A892: 889 | B892: 5 | C892: 7 | D892: 0 | E892: =R[-9]C -> 61 | F892: =R[-9]C -> 70 | G892: 4 | H892: 20000 | I892: 110003 | J892: 4 | K892: =R[-1]C -> [{7,3},{8,3},{9,3},{10,3},{11,3},{12,3},{17,10},{18,8},{19,1},{23,4},{24,10}] | L892: =R[-1]C -> [{7,27},{8,55},{9,27},{10,55},{11,27},{12,55},{17,18},{18,110},{19,3},{23,37},{24,37}] | M892: =R[-1]C -> [{0,1,[1,30]},{1,2,[11,40]},{2,5,[21,50]},{5,10,[31,60]},{10,20,[41,60]},{30,20,[51,70]},{50,10,[61,80]},{70,5,[71,80]},{100,2,[81,90]},{150,1,[91,100]}]
A893: 890 | B893: 5 | C893: 7 | D893: 0 | E893: =R[-9]C -> 71 | F893: =R[-9]C -> 80 | G893: 4 | H893: 20000 | I893: 110003 | J893: 4 | K893: =R[-1]C -> [{7,3},{8,3},{9,3},{10,3},{11,3},{12,3},{17,10},{18,8},{19,1},{23,4},{24,10}] | L893: =R[-1]C -> [{7,27},{8,55},{9,27},{10,55},{11,27},{12,55},{17,18},{18,110},{19,3},{23,37},{24,37}] | M893: =R[-1]C -> [{0,1,[1,30]},{1,2,[11,40]},{2,5,[21,50]},{5,10,[31,60]},{10,20,[41,60]},{30,20,[51,70]},{50,10,[61,80]},{70,5,[71,80]},{100,2,[81,90]},{150,1,[91,100]}]
A894: 891 | B894: 5 | C894: 7 | D894: 0 | E894: =R[-9]C -> 81 | F894: =R[-9]C -> 90 | G894: 4 | H894: 20000 | I894: 110003 | J894: 4 | K894: =R[-1]C -> [{7,3},{8,3},{9,3},{10,3},{11,3},{12,3},{17,10},{18,8},{19,1},{23,4},{24,10}] | L894: =R[-1]C -> [{7,27},{8,55},{9,27},{10,55},{11,27},{12,55},{17,18},{18,110},{19,3},{23,37},{24,37}] | M894: =R[-1]C -> [{0,1,[1,30]},{1,2,[11,40]},{2,5,[21,50]},{5,10,[31,60]},{10,20,[41,60]},{30,20,[51,70]},{50,10,[61,80]},{70,5,[71,80]},{100,2,[81,90]},{150,1,[91,100]}]
A895: 892 | B895: 6 | C895: 7 | D895: 0 | E895: =R[-9]C -> 1 | F895: =R[-9]C -> 10 | G895: 5 | H895: 20000 | I895: 110003 | J895: 5 | K895: =R[-1]C -> [{7,3},{8,3},{9,3},{10,3},{11,3},{12,3},{17,10},{18,8},{19,1},{23,4},{24,10}] | L895: =R[-1]C -> [{7,27},{8,55},{9,27},{10,55},{11,27},{12,55},{17,18},{18,110},{19,3},{23,37},{24,37}] | M895: =R[-1]C -> [{0,1,[1,30]},{1,2,[11,40]},{2,5,[21,50]},{5,10,[31,60]},{10,20,[41,60]},{30,20,[51,70]},{50,10,[61,80]},{70,5,[71,80]},{100,2,[81,90]},{150,1,[91,100]}]
A896: 893 | B896: 6 | C896: 7 | D896: 0 | E896: =R[-9]C -> 11 | F896: =R[-9]C -> 20 | G896: 5 | H896: 20000 | I896: 110003 | J896: 5 | K896: =R[-1]C -> [{7,3},{8,3},{9,3},{10,3},{11,3},{12,3},{17,10},{18,8},{19,1},{23,4},{24,10}] | L896: =R[-1]C -> [{7,27},{8,55},{9,27},{10,55},{11,27},{12,55},{17,18},{18,110},{19,3},{23,37},{24,37}] | M896: =R[-1]C -> [{0,1,[1,30]},{1,2,[11,40]},{2,5,[21,50]},{5,10,[31,60]},{10,20,[41,60]},{30,20,[51,70]},{50,10,[61,80]},{70,5,[71,80]},{100,2,[81,90]},{150,1,[91,100]}]
A897: 894 | B897: 6 | C897: 7 | D897: 0 | E897: =R[-9]C -> 21 | F897: =R[-9]C -> 30 | G897: 5 | H897: 20000 | I897: 110003 | J897: 5 | K897: =R[-1]C -> [{7,3},{8,3},{9,3},{10,3},{11,3},{12,3},{17,10},{18,8},{19,1},{23,4},{24,10}] | L897: =R[-1]C -> [{7,27},{8,55},{9,27},{10,55},{11,27},{12,55},{17,18},{18,110},{19,3},{23,37},{24,37}] | M897: =R[-1]C -> [{0,1,[1,30]},{1,2,[11,40]},{2,5,[21,50]},{5,10,[31,60]},{10,20,[41,60]},{30,20,[51,70]},{50,10,[61,80]},{70,5,[71,80]},{100,2,[81,90]},{150,1,[91,100]}]
A898: 895 | B898: 6 | C898: 7 | D898: 0 | E898: =R[-9]C -> 31 | F898: =R[-9]C -> 40 | G898: 5 | H898: 20000 | I898: 110003 | J898: 5 | K898: =R[-1]C -> [{7,3},{8,3},{9,3},{10,3},{11,3},{12,3},{17,10},{18,8},{19,1},{23,4},{24,10}] | L898: =R[-1]C -> [{7,27},{8,55},{9,27},{10,55},{11,27},{12,55},{17,18},{18,110},{19,3},{23,37},{24,37}] | M898: =R[-1]C -> [{0,1,[1,30]},{1,2,[11,40]},{2,5,[21,50]},{5,10,[31,60]},{10,20,[41,60]},{30,20,[51,70]},{50,10,[61,80]},{70,5,[71,80]},{100,2,[81,90]},{150,1,[91,100]}]
A899: 896 | B899: 6 | C899: 7 | D899: 0 | E899: =R[-9]C -> 41 | F899: =R[-9]C -> 50 | G899: 5 | H899: 20000 | I899: 110003 | J899: 5 | K899: =R[-1]C -> [{7,3},{8,3},{9,3},{10,3},{11,3},{12,3},{17,10},{18,8},{19,1},{23,4},{24,10}] | L899: =R[-1]C -> [{7,27},{8,55},{9,27},{10,55},{11,27},{12,55},{17,18},{18,110},{19,3},{23,37},{24,37}] | M899: =R[-1]C -> [{0,1,[1,30]},{1,2,[11,40]},{2,5,[21,50]},{5,10,[31,60]},{10,20,[41,60]},{30,20,[51,70]},{50,10,[61,80]},{70,5,[71,80]},{100,2,[81,90]},{150,1,[91,100]}]
A900: 897 | B900: 6 | C900: 7 | D900: 0 | E900: =R[-9]C -> 51 | F900: =R[-9]C -> 60 | G900: 5 | H900: 20000 | I900: 110003 | J900: 5 | K900: =R[-1]C -> [{7,3},{8,3},{9,3},{10,3},{11,3},{12,3},{17,10},{18,8},{19,1},{23,4},{24,10}] | L900: =R[-1]C -> [{7,27},{8,55},{9,27},{10,55},{11,27},{12,55},{17,18},{18,110},{19,3},{23,37},{24,37}] | M900: =R[-1]C -> [{0,1,[1,30]},{1,2,[11,40]},{2,5,[21,50]},{5,10,[31,60]},{10,20,[41,60]},{30,20,[51,70]},{50,10,[61,80]},{70,5,[71,80]},{100,2,[81,90]},{150,1,[91,100]}]
A901: 898 | B901: 6 | C901: 7 | D901: 0 | E901: =R[-9]C -> 61 | F901: =R[-9]C -> 70 | G901: 5 | H901: 20000 | I901: 110003 | J901: 5 | K901: =R[-1]C -> [{7,3},{8,3},{9,3},{10,3},{11,3},{12,3},{17,10},{18,8},{19,1},{23,4},{24,10}] | L901: =R[-1]C -> [{7,27},{8,55},{9,27},{10,55},{11,27},{12,55},{17,18},{18,110},{19,3},{23,37},{24,37}] | M901: =R[-1]C -> [{0,1,[1,30]},{1,2,[11,40]},{2,5,[21,50]},{5,10,[31,60]},{10,20,[41,60]},{30,20,[51,70]},{50,10,[61,80]},{70,5,[71,80]},{100,2,[81,90]},{150,1,[91,100]}]
A902: 899 | B902: 6 | C902: 7 | D902: 0 | E902: =R[-9]C -> 71 | F902: =R[-9]C -> 80 | G902: 5 | H902: 20000 | I902: 110003 | J902: 5 | K902: =R[-1]C -> [{7,3},{8,3},{9,3},{10,3},{11,3},{12,3},{17,10},{18,8},{19,1},{23,4},{24,10}] | L902: =R[-1]C -> [{7,27},{8,55},{9,27},{10,55},{11,27},{12,55},{17,18},{18,110},{19,3},{23,37},{24,37}] | M902: =R[-1]C -> [{0,1,[1,30]},{1,2,[11,40]},{2,5,[21,50]},{5,10,[31,60]},{10,20,[41,60]},{30,20,[51,70]},{50,10,[61,80]},{70,5,[71,80]},{100,2,[81,90]},{150,1,[91,100]}]
A903: 900 | B903: 6 | C903: 7 | D903: 0 | E903: =R[-9]C -> 81 | F903: =R[-9]C -> 90 | G903: 5 | H903: 20000 | I903: 110003 | J903: 5 | K903: =R[-1]C -> [{7,3},{8,3},{9,3},{10,3},{11,3},{12,3},{17,10},{18,8},{19,1},{23,4},{24,10}] | L903: =R[-1]C -> [{7,27},{8,55},{9,27},{10,55},{11,27},{12,55},{17,18},{18,110},{19,3},{23,37},{24,37}] | M903: =R[-1]C -> [{0,1,[1,30]},{1,2,[11,40]},{2,5,[21,50]},{5,10,[31,60]},{10,20,[41,60]},{30,20,[51,70]},{50,10,[61,80]},{70,5,[71,80]},{100,2,[81,90]},{150,1,[91,100]}]
A904: 901 | B904: 2 | C904: 1 | D904: 0 | E904: 1 | F904: 10 | G904: 1 | H904: 5000 | I904: 110003 | J904: 1 | K904: =R[-1]C -> [{7,3},{8,3},{9,3},{10,3},{11,3},{12,3},{17,10},{18,8},{19,1},{23,4},{24,10}] | L904: =R[-1]C -> [{7,27},{8,55},{9,27},{10,55},{11,27},{12,55},{17,18},{18,110},{19,3},{23,37},{24,37}] | M904: =R[-1]C -> [{0,1,[1,30]},{1,2,[11,40]},{2,5,[21,50]},{5,10,[31,60]},{10,20,[41,60]},{30,20,[51,70]},{50,10,[61,80]},{70,5,[71,80]},{100,2,[81,90]},{150,1,[91,100]}]
A905: 902 | B905: 2 | C905: 1 | D905: 0 | E905: =R[-1]C+10 -> 11 | F905: =R[-1]C+10 -> 20 | G905: 1 | H905: 5000 | I905: 110003 | J905: 1 | K905: =R[-1]C -> [{7,3},{8,3},{9,3},{10,3},{11,3},{12,3},{17,10},{18,8},{19,1},{23,4},{24,10}] | L905: =R[-1]C -> [{7,27},{8,55},{9,27},{10,55},{11,27},{12,55},{17,18},{18,110},{19,3},{23,37},{24,37}] | M905: =R[-1]C -> [{0,1,[1,30]},{1,2,[11,40]},{2,5,[21,50]},{5,10,[31,60]},{10,20,[41,60]},{30,20,[51,70]},{50,10,[61,80]},{70,5,[71,80]},{100,2,[81,90]},{150,1,[91,100]}]
A906: 903 | B906: 2 | C906: 1 | D906: 0 | E906: =R[-1]C+10 -> 21 | F906: =R[-1]C+10 -> 30 | G906: 1 | H906: 5000 | I906: 110003 | J906: 1 | K906: =R[-1]C -> [{7,3},{8,3},{9,3},{10,3},{11,3},{12,3},{17,10},{18,8},{19,1},{23,4},{24,10}] | L906: =R[-1]C -> [{7,27},{8,55},{9,27},{10,55},{11,27},{12,55},{17,18},{18,110},{19,3},{23,37},{24,37}] | M906: =R[-1]C -> [{0,1,[1,30]},{1,2,[11,40]},{2,5,[21,50]},{5,10,[31,60]},{10,20,[41,60]},{30,20,[51,70]},{50,10,[61,80]},{70,5,[71,80]},{100,2,[81,90]},{150,1,[91,100]}]
A907: 904 | B907: 2 | C907: 1 | D907: 0 | E907: =R[-1]C+10 -> 31 | F907: =R[-1]C+10 -> 40 | G907: 1 | H907: 5000 | I907: 110003 | J907: 1 | K907: =R[-1]C -> [{7,3},{8,3},{9,3},{10,3},{11,3},{12,3},{17,10},{18,8},{19,1},{23,4},{24,10}] | L907: =R[-1]C -> [{7,27},{8,55},{9,27},{10,55},{11,27},{12,55},{17,18},{18,110},{19,3},{23,37},{24,37}] | M907: =R[-1]C -> [{0,1,[1,30]},{1,2,[11,40]},{2,5,[21,50]},{5,10,[31,60]},{10,20,[41,60]},{30,20,[51,70]},{50,10,[61,80]},{70,5,[71,80]},{100,2,[81,90]},{150,1,[91,100]}]
A908: 905 | B908: 2 | C908: 1 | D908: 0 | E908: =R[-1]C+10 -> 41 | F908: =R[-1]C+10 -> 50 | G908: 1 | H908: 5000 | I908: 110003 | J908: 1 | K908: =R[-1]C -> [{7,3},{8,3},{9,3},{10,3},{11,3},{12,3},{17,10},{18,8},{19,1},{23,4},{24,10}] | L908: =R[-1]C -> [{7,27},{8,55},{9,27},{10,55},{11,27},{12,55},{17,18},{18,110},{19,3},{23,37},{24,37}] | M908: =R[-1]C -> [{0,1,[1,30]},{1,2,[11,40]},{2,5,[21,50]},{5,10,[31,60]},{10,20,[41,60]},{30,20,[51,70]},{50,10,[61,80]},{70,5,[71,80]},{100,2,[81,90]},{150,1,[91,100]}]
A909: 906 | B909: 2 | C909: 1 | D909: 0 | E909: =R[-1]C+10 -> 51 | F909: =R[-1]C+10 -> 60 | G909: 1 | H909: 5000 | I909: 110003 | J909: 1 | K909: =R[-1]C -> [{7,3},{8,3},{9,3},{10,3},{11,3},{12,3},{17,10},{18,8},{19,1},{23,4},{24,10}] | L909: =R[-1]C -> [{7,27},{8,55},{9,27},{10,55},{11,27},{12,55},{17,18},{18,110},{19,3},{23,37},{24,37}] | M909: =R[-1]C -> [{0,1,[1,30]},{1,2,[11,40]},{2,5,[21,50]},{5,10,[31,60]},{10,20,[41,60]},{30,20,[51,70]},{50,10,[61,80]},{70,5,[71,80]},{100,2,[81,90]},{150,1,[91,100]}]
A910: 907 | B910: 2 | C910: 1 | D910: 0 | E910: =R[-1]C+10 -> 61 | F910: =R[-1]C+10 -> 70 | G910: 1 | H910: 5000 | I910: 110003 | J910: 1 | K910: =R[-1]C -> [{7,3},{8,3},{9,3},{10,3},{11,3},{12,3},{17,10},{18,8},{19,1},{23,4},{24,10}] | L910: =R[-1]C -> [{7,27},{8,55},{9,27},{10,55},{11,27},{12,55},{17,18},{18,110},{19,3},{23,37},{24,37}] | M910: =R[-1]C -> [{0,1,[1,30]},{1,2,[11,40]},{2,5,[21,50]},{5,10,[31,60]},{10,20,[41,60]},{30,20,[51,70]},{50,10,[61,80]},{70,5,[71,80]},{100,2,[81,90]},{150,1,[91,100]}]
A911: 908 | B911: 2 | C911: 1 | D911: 0 | E911: =R[-1]C+10 -> 71 | F911: =R[-1]C+10 -> 80 | G911: 1 | H911: 5000 | I911: 110003 | J911: 1 | K911: =R[-1]C -> [{7,3},{8,3},{9,3},{10,3},{11,3},{12,3},{17,10},{18,8},{19,1},{23,4},{24,10}] | L911: =R[-1]C -> [{7,27},{8,55},{9,27},{10,55},{11,27},{12,55},{17,18},{18,110},{19,3},{23,37},{24,37}] | M911: =R[-1]C -> [{0,1,[1,30]},{1,2,[11,40]},{2,5,[21,50]},{5,10,[31,60]},{10,20,[41,60]},{30,20,[51,70]},{50,10,[61,80]},{70,5,[71,80]},{100,2,[81,90]},{150,1,[91,100]}]
A912: 909 | B912: 2 | C912: 1 | D912: 0 | E912: =R[-1]C+10 -> 81 | F912: =R[-1]C+10 -> 90 | G912: 1 | H912: 5000 | I912: 110003 | J912: 1 | K912: =R[-1]C -> [{7,3},{8,3},{9,3},{10,3},{11,3},{12,3},{17,10},{18,8},{19,1},{23,4},{24,10}] | L912: =R[-1]C -> [{7,27},{8,55},{9,27},{10,55},{11,27},{12,55},{17,18},{18,110},{19,3},{23,37},{24,37}] | M912: =R[-1]C -> [{0,1,[1,30]},{1,2,[11,40]},{2,5,[21,50]},{5,10,[31,60]},{10,20,[41,60]},{30,20,[51,70]},{50,10,[61,80]},{70,5,[71,80]},{100,2,[81,90]},{150,1,[91,100]}]
A913: 910 | B913: 3 | C913: 1 | D913: 0 | E913: =R[-9]C -> 1 | F913: =R[-9]C -> 10 | G913: 2 | H913: 10000 | I913: 110003 | J913: 2 | K913: =R[-1]C -> [{7,3},{8,3},{9,3},{10,3},{11,3},{12,3},{17,10},{18,8},{19,1},{23,4},{24,10}] | L913: =R[-1]C -> [{7,27},{8,55},{9,27},{10,55},{11,27},{12,55},{17,18},{18,110},{19,3},{23,37},{24,37}] | M913: =R[-1]C -> [{0,1,[1,30]},{1,2,[11,40]},{2,5,[21,50]},{5,10,[31,60]},{10,20,[41,60]},{30,20,[51,70]},{50,10,[61,80]},{70,5,[71,80]},{100,2,[81,90]},{150,1,[91,100]}]
A914: 911 | B914: 3 | C914: 1 | D914: 0 | E914: =R[-9]C -> 11 | F914: =R[-9]C -> 20 | G914: 2 | H914: 10000 | I914: 110003 | J914: 2 | K914: =R[-1]C -> [{7,3},{8,3},{9,3},{10,3},{11,3},{12,3},{17,10},{18,8},{19,1},{23,4},{24,10}] | L914: =R[-1]C -> [{7,27},{8,55},{9,27},{10,55},{11,27},{12,55},{17,18},{18,110},{19,3},{23,37},{24,37}] | M914: =R[-1]C -> [{0,1,[1,30]},{1,2,[11,40]},{2,5,[21,50]},{5,10,[31,60]},{10,20,[41,60]},{30,20,[51,70]},{50,10,[61,80]},{70,5,[71,80]},{100,2,[81,90]},{150,1,[91,100]}]
A915: 912 | B915: 3 | C915: 1 | D915: 0 | E915: =R[-9]C -> 21 | F915: =R[-9]C -> 30 | G915: 2 | H915: 10000 | I915: 110003 | J915: 2 | K915: =R[-1]C -> [{7,3},{8,3},{9,3},{10,3},{11,3},{12,3},{17,10},{18,8},{19,1},{23,4},{24,10}] | L915: =R[-1]C -> [{7,27},{8,55},{9,27},{10,55},{11,27},{12,55},{17,18},{18,110},{19,3},{23,37},{24,37}] | M915: =R[-1]C -> [{0,1,[1,30]},{1,2,[11,40]},{2,5,[21,50]},{5,10,[31,60]},{10,20,[41,60]},{30,20,[51,70]},{50,10,[61,80]},{70,5,[71,80]},{100,2,[81,90]},{150,1,[91,100]}]
A916: 913 | B916: 3 | C916: 1 | D916: 0 | E916: =R[-9]C -> 31 | F916: =R[-9]C -> 40 | G916: 2 | H916: 10000 | I916: 110003 | J916: 2 | K916: =R[-1]C -> [{7,3},{8,3},{9,3},{10,3},{11,3},{12,3},{17,10},{18,8},{19,1},{23,4},{24,10}] | L916: =R[-1]C -> [{7,27},{8,55},{9,27},{10,55},{11,27},{12,55},{17,18},{18,110},{19,3},{23,37},{24,37}] | M916: =R[-1]C -> [{0,1,[1,30]},{1,2,[11,40]},{2,5,[21,50]},{5,10,[31,60]},{10,20,[41,60]},{30,20,[51,70]},{50,10,[61,80]},{70,5,[71,80]},{100,2,[81,90]},{150,1,[91,100]}]
A917: 914 | B917: 3 | C917: 1 | D917: 0 | E917: =R[-9]C -> 41 | F917: =R[-9]C -> 50 | G917: 2 | H917: 10000 | I917: 110003 | J917: 2 | K917: =R[-1]C -> [{7,3},{8,3},{9,3},{10,3},{11,3},{12,3},{17,10},{18,8},{19,1},{23,4},{24,10}] | L917: =R[-1]C -> [{7,27},{8,55},{9,27},{10,55},{11,27},{12,55},{17,18},{18,110},{19,3},{23,37},{24,37}] | M917: =R[-1]C -> [{0,1,[1,30]},{1,2,[11,40]},{2,5,[21,50]},{5,10,[31,60]},{10,20,[41,60]},{30,20,[51,70]},{50,10,[61,80]},{70,5,[71,80]},{100,2,[81,90]},{150,1,[91,100]}]
A918: 915 | B918: 3 | C918: 1 | D918: 0 | E918: =R[-9]C -> 51 | F918: =R[-9]C -> 60 | G918: 2 | H918: 10000 | I918: 110003 | J918: 2 | K918: =R[-1]C -> [{7,3},{8,3},{9,3},{10,3},{11,3},{12,3},{17,10},{18,8},{19,1},{23,4},{24,10}] | L918: =R[-1]C -> [{7,27},{8,55},{9,27},{10,55},{11,27},{12,55},{17,18},{18,110},{19,3},{23,37},{24,37}] | M918: =R[-1]C -> [{0,1,[1,30]},{1,2,[11,40]},{2,5,[21,50]},{5,10,[31,60]},{10,20,[41,60]},{30,20,[51,70]},{50,10,[61,80]},{70,5,[71,80]},{100,2,[81,90]},{150,1,[91,100]}]
A919: 916 | B919: 3 | C919: 1 | D919: 0 | E919: =R[-9]C -> 61 | F919: =R[-9]C -> 70 | G919: 2 | H919: 10000 | I919: 110003 | J919: 2 | K919: =R[-1]C -> [{7,3},{8,3},{9,3},{10,3},{11,3},{12,3},{17,10},{18,8},{19,1},{23,4},{24,10}] | L919: =R[-1]C -> [{7,27},{8,55},{9,27},{10,55},{11,27},{12,55},{17,18},{18,110},{19,3},{23,37},{24,37}] | M919: =R[-1]C -> [{0,1,[1,30]},{1,2,[11,40]},{2,5,[21,50]},{5,10,[31,60]},{10,20,[41,60]},{30,20,[51,70]},{50,10,[61,80]},{70,5,[71,80]},{100,2,[81,90]},{150,1,[91,100]}]
A920: 917 | B920: 3 | C920: 1 | D920: 0 | E920: =R[-9]C -> 71 | F920: =R[-9]C -> 80 | G920: 2 | H920: 10000 | I920: 110003 | J920: 2 | K920: =R[-1]C -> [{7,3},{8,3},{9,3},{10,3},{11,3},{12,3},{17,10},{18,8},{19,1},{23,4},{24,10}] | L920: =R[-1]C -> [{7,27},{8,55},{9,27},{10,55},{11,27},{12,55},{17,18},{18,110},{19,3},{23,37},{24,37}] | M920: =R[-1]C -> [{0,1,[1,30]},{1,2,[11,40]},{2,5,[21,50]},{5,10,[31,60]},{10,20,[41,60]},{30,20,[51,70]},{50,10,[61,80]},{70,5,[71,80]},{100,2,[81,90]},{150,1,[91,100]}]
A921: 918 | B921: 3 | C921: 1 | D921: 0 | E921: =R[-9]C -> 81 | F921: =R[-9]C -> 90 | G921: 2 | H921: 10000 | I921: 110003 | J921: 2 | K921: =R[-1]C -> [{7,3},{8,3},{9,3},{10,3},{11,3},{12,3},{17,10},{18,8},{19,1},{23,4},{24,10}] | L921: =R[-1]C -> [{7,27},{8,55},{9,27},{10,55},{11,27},{12,55},{17,18},{18,110},{19,3},{23,37},{24,37}] | M921: =R[-1]C -> [{0,1,[1,30]},{1,2,[11,40]},{2,5,[21,50]},{5,10,[31,60]},{10,20,[41,60]},{30,20,[51,70]},{50,10,[61,80]},{70,5,[71,80]},{100,2,[81,90]},{150,1,[91,100]}]
A922: 919 | B922: 4 | C922: 1 | D922: 0 | E922: =R[-9]C -> 1 | F922: =R[-9]C -> 10 | G922: 3 | H922: 15000 | I922: 110003 | J922: 3 | K922: =R[-1]C -> [{7,3},{8,3},{9,3},{10,3},{11,3},{12,3},{17,10},{18,8},{19,1},{23,4},{24,10}] | L922: =R[-1]C -> [{7,27},{8,55},{9,27},{10,55},{11,27},{12,55},{17,18},{18,110},{19,3},{23,37},{24,37}] | M922: =R[-1]C -> [{0,1,[1,30]},{1,2,[11,40]},{2,5,[21,50]},{5,10,[31,60]},{10,20,[41,60]},{30,20,[51,70]},{50,10,[61,80]},{70,5,[71,80]},{100,2,[81,90]},{150,1,[91,100]}]
A923: 920 | B923: 4 | C923: 1 | D923: 0 | E923: =R[-9]C -> 11 | F923: =R[-9]C -> 20 | G923: 3 | H923: 15000 | I923: 110003 | J923: 3 | K923: =R[-1]C -> [{7,3},{8,3},{9,3},{10,3},{11,3},{12,3},{17,10},{18,8},{19,1},{23,4},{24,10}] | L923: =R[-1]C -> [{7,27},{8,55},{9,27},{10,55},{11,27},{12,55},{17,18},{18,110},{19,3},{23,37},{24,37}] | M923: =R[-1]C -> [{0,1,[1,30]},{1,2,[11,40]},{2,5,[21,50]},{5,10,[31,60]},{10,20,[41,60]},{30,20,[51,70]},{50,10,[61,80]},{70,5,[71,80]},{100,2,[81,90]},{150,1,[91,100]}]
A924: 921 | B924: 4 | C924: 1 | D924: 0 | E924: =R[-9]C -> 21 | F924: =R[-9]C -> 30 | G924: 3 | H924: 15000 | I924: 110003 | J924: 3 | K924: =R[-1]C -> [{7,3},{8,3},{9,3},{10,3},{11,3},{12,3},{17,10},{18,8},{19,1},{23,4},{24,10}] | L924: =R[-1]C -> [{7,27},{8,55},{9,27},{10,55},{11,27},{12,55},{17,18},{18,110},{19,3},{23,37},{24,37}] | M924: =R[-1]C -> [{0,1,[1,30]},{1,2,[11,40]},{2,5,[21,50]},{5,10,[31,60]},{10,20,[41,60]},{30,20,[51,70]},{50,10,[61,80]},{70,5,[71,80]},{100,2,[81,90]},{150,1,[91,100]}]
A925: 922 | B925: 4 | C925: 1 | D925: 0 | E925: =R[-9]C -> 31 | F925: =R[-9]C -> 40 | G925: 3 | H925: 15000 | I925: 110003 | J925: 3 | K925: =R[-1]C -> [{7,3},{8,3},{9,3},{10,3},{11,3},{12,3},{17,10},{18,8},{19,1},{23,4},{24,10}] | L925: =R[-1]C -> [{7,27},{8,55},{9,27},{10,55},{11,27},{12,55},{17,18},{18,110},{19,3},{23,37},{24,37}] | M925: =R[-1]C -> [{0,1,[1,30]},{1,2,[11,40]},{2,5,[21,50]},{5,10,[31,60]},{10,20,[41,60]},{30,20,[51,70]},{50,10,[61,80]},{70,5,[71,80]},{100,2,[81,90]},{150,1,[91,100]}]
A926: 923 | B926: 4 | C926: 1 | D926: 0 | E926: =R[-9]C -> 41 | F926: =R[-9]C -> 50 | G926: 3 | H926: 15000 | I926: 110003 | J926: 3 | K926: =R[-1]C -> [{7,3},{8,3},{9,3},{10,3},{11,3},{12,3},{17,10},{18,8},{19,1},{23,4},{24,10}] | L926: =R[-1]C -> [{7,27},{8,55},{9,27},{10,55},{11,27},{12,55},{17,18},{18,110},{19,3},{23,37},{24,37}] | M926: =R[-1]C -> [{0,1,[1,30]},{1,2,[11,40]},{2,5,[21,50]},{5,10,[31,60]},{10,20,[41,60]},{30,20,[51,70]},{50,10,[61,80]},{70,5,[71,80]},{100,2,[81,90]},{150,1,[91,100]}]
A927: 924 | B927: 4 | C927: 1 | D927: 0 | E927: =R[-9]C -> 51 | F927: =R[-9]C -> 60 | G927: 3 | H927: 15000 | I927: 110003 | J927: 3 | K927: =R[-1]C -> [{7,3},{8,3},{9,3},{10,3},{11,3},{12,3},{17,10},{18,8},{19,1},{23,4},{24,10}] | L927: =R[-1]C -> [{7,27},{8,55},{9,27},{10,55},{11,27},{12,55},{17,18},{18,110},{19,3},{23,37},{24,37}] | M927: =R[-1]C -> [{0,1,[1,30]},{1,2,[11,40]},{2,5,[21,50]},{5,10,[31,60]},{10,20,[41,60]},{30,20,[51,70]},{50,10,[61,80]},{70,5,[71,80]},{100,2,[81,90]},{150,1,[91,100]}]
A928: 925 | B928: 4 | C928: 1 | D928: 0 | E928: =R[-9]C -> 61 | F928: =R[-9]C -> 70 | G928: 3 | H928: 15000 | I928: 110003 | J928: 3 | K928: =R[-1]C -> [{7,3},{8,3},{9,3},{10,3},{11,3},{12,3},{17,10},{18,8},{19,1},{23,4},{24,10}] | L928: =R[-1]C -> [{7,27},{8,55},{9,27},{10,55},{11,27},{12,55},{17,18},{18,110},{19,3},{23,37},{24,37}] | M928: =R[-1]C -> [{0,1,[1,30]},{1,2,[11,40]},{2,5,[21,50]},{5,10,[31,60]},{10,20,[41,60]},{30,20,[51,70]},{50,10,[61,80]},{70,5,[71,80]},{100,2,[81,90]},{150,1,[91,100]}]
A929: 926 | B929: 4 | C929: 1 | D929: 0 | E929: =R[-9]C -> 71 | F929: =R[-9]C -> 80 | G929: 3 | H929: 15000 | I929: 110003 | J929: 3 | K929: =R[-1]C -> [{7,3},{8,3},{9,3},{10,3},{11,3},{12,3},{17,10},{18,8},{19,1},{23,4},{24,10}] | L929: =R[-1]C -> [{7,27},{8,55},{9,27},{10,55},{11,27},{12,55},{17,18},{18,110},{19,3},{23,37},{24,37}] | M929: =R[-1]C -> [{0,1,[1,30]},{1,2,[11,40]},{2,5,[21,50]},{5,10,[31,60]},{10,20,[41,60]},{30,20,[51,70]},{50,10,[61,80]},{70,5,[71,80]},{100,2,[81,90]},{150,1,[91,100]}]
A930: 927 | B930: 4 | C930: 1 | D930: 0 | E930: =R[-9]C -> 81 | F930: =R[-9]C -> 90 | G930: 3 | H930: 15000 | I930: 110003 | J930: 3 | K930: =R[-1]C -> [{7,3},{8,3},{9,3},{10,3},{11,3},{12,3},{17,10},{18,8},{19,1},{23,4},{24,10}] | L930: =R[-1]C -> [{7,27},{8,55},{9,27},{10,55},{11,27},{12,55},{17,18},{18,110},{19,3},{23,37},{24,37}] | M930: =R[-1]C -> [{0,1,[1,30]},{1,2,[11,40]},{2,5,[21,50]},{5,10,[31,60]},{10,20,[41,60]},{30,20,[51,70]},{50,10,[61,80]},{70,5,[71,80]},{100,2,[81,90]},{150,1,[91,100]}]
A931: 928 | B931: 5 | C931: 1 | D931: 0 | E931: =R[-9]C -> 1 | F931: =R[-9]C -> 10 | G931: 4 | H931: 20000 | I931: 110003 | J931: 4 | K931: =R[-1]C -> [{7,3},{8,3},{9,3},{10,3},{11,3},{12,3},{17,10},{18,8},{19,1},{23,4},{24,10}] | L931: =R[-1]C -> [{7,27},{8,55},{9,27},{10,55},{11,27},{12,55},{17,18},{18,110},{19,3},{23,37},{24,37}] | M931: =R[-1]C -> [{0,1,[1,30]},{1,2,[11,40]},{2,5,[21,50]},{5,10,[31,60]},{10,20,[41,60]},{30,20,[51,70]},{50,10,[61,80]},{70,5,[71,80]},{100,2,[81,90]},{150,1,[91,100]}]
A932: 929 | B932: 5 | C932: 1 | D932: 0 | E932: =R[-9]C -> 11 | F932: =R[-9]C -> 20 | G932: 4 | H932: 20000 | I932: 110003 | J932: 4 | K932: =R[-1]C -> [{7,3},{8,3},{9,3},{10,3},{11,3},{12,3},{17,10},{18,8},{19,1},{23,4},{24,10}] | L932: =R[-1]C -> [{7,27},{8,55},{9,27},{10,55},{11,27},{12,55},{17,18},{18,110},{19,3},{23,37},{24,37}] | M932: =R[-1]C -> [{0,1,[1,30]},{1,2,[11,40]},{2,5,[21,50]},{5,10,[31,60]},{10,20,[41,60]},{30,20,[51,70]},{50,10,[61,80]},{70,5,[71,80]},{100,2,[81,90]},{150,1,[91,100]}]
A933: 930 | B933: 5 | C933: 1 | D933: 0 | E933: =R[-9]C -> 21 | F933: =R[-9]C -> 30 | G933: 4 | H933: 20000 | I933: 110003 | J933: 4 | K933: =R[-1]C -> [{7,3},{8,3},{9,3},{10,3},{11,3},{12,3},{17,10},{18,8},{19,1},{23,4},{24,10}] | L933: =R[-1]C -> [{7,27},{8,55},{9,27},{10,55},{11,27},{12,55},{17,18},{18,110},{19,3},{23,37},{24,37}] | M933: =R[-1]C -> [{0,1,[1,30]},{1,2,[11,40]},{2,5,[21,50]},{5,10,[31,60]},{10,20,[41,60]},{30,20,[51,70]},{50,10,[61,80]},{70,5,[71,80]},{100,2,[81,90]},{150,1,[91,100]}]
A934: 931 | B934: 5 | C934: 1 | D934: 0 | E934: =R[-9]C -> 31 | F934: =R[-9]C -> 40 | G934: 4 | H934: 20000 | I934: 110003 | J934: 4 | K934: =R[-1]C -> [{7,3},{8,3},{9,3},{10,3},{11,3},{12,3},{17,10},{18,8},{19,1},{23,4},{24,10}] | L934: =R[-1]C -> [{7,27},{8,55},{9,27},{10,55},{11,27},{12,55},{17,18},{18,110},{19,3},{23,37},{24,37}] | M934: =R[-1]C -> [{0,1,[1,30]},{1,2,[11,40]},{2,5,[21,50]},{5,10,[31,60]},{10,20,[41,60]},{30,20,[51,70]},{50,10,[61,80]},{70,5,[71,80]},{100,2,[81,90]},{150,1,[91,100]}]
A935: 932 | B935: 5 | C935: 1 | D935: 0 | E935: =R[-9]C -> 41 | F935: =R[-9]C -> 50 | G935: 4 | H935: 20000 | I935: 110003 | J935: 4 | K935: =R[-1]C -> [{7,3},{8,3},{9,3},{10,3},{11,3},{12,3},{17,10},{18,8},{19,1},{23,4},{24,10}] | L935: =R[-1]C -> [{7,27},{8,55},{9,27},{10,55},{11,27},{12,55},{17,18},{18,110},{19,3},{23,37},{24,37}] | M935: =R[-1]C -> [{0,1,[1,30]},{1,2,[11,40]},{2,5,[21,50]},{5,10,[31,60]},{10,20,[41,60]},{30,20,[51,70]},{50,10,[61,80]},{70,5,[71,80]},{100,2,[81,90]},{150,1,[91,100]}]
A936: 933 | B936: 5 | C936: 1 | D936: 0 | E936: =R[-9]C -> 51 | F936: =R[-9]C -> 60 | G936: 4 | H936: 20000 | I936: 110003 | J936: 4 | K936: =R[-1]C -> [{7,3},{8,3},{9,3},{10,3},{11,3},{12,3},{17,10},{18,8},{19,1},{23,4},{24,10}] | L936: =R[-1]C -> [{7,27},{8,55},{9,27},{10,55},{11,27},{12,55},{17,18},{18,110},{19,3},{23,37},{24,37}] | M936: =R[-1]C -> [{0,1,[1,30]},{1,2,[11,40]},{2,5,[21,50]},{5,10,[31,60]},{10,20,[41,60]},{30,20,[51,70]},{50,10,[61,80]},{70,5,[71,80]},{100,2,[81,90]},{150,1,[91,100]}]
A937: 934 | B937: 5 | C937: 1 | D937: 0 | E937: =R[-9]C -> 61 | F937: =R[-9]C -> 70 | G937: 4 | H937: 20000 | I937: 110003 | J937: 4 | K937: =R[-1]C -> [{7,3},{8,3},{9,3},{10,3},{11,3},{12,3},{17,10},{18,8},{19,1},{23,4},{24,10}] | L937: =R[-1]C -> [{7,27},{8,55},{9,27},{10,55},{11,27},{12,55},{17,18},{18,110},{19,3},{23,37},{24,37}] | M937: =R[-1]C -> [{0,1,[1,30]},{1,2,[11,40]},{2,5,[21,50]},{5,10,[31,60]},{10,20,[41,60]},{30,20,[51,70]},{50,10,[61,80]},{70,5,[71,80]},{100,2,[81,90]},{150,1,[91,100]}]
A938: 935 | B938: 5 | C938: 1 | D938: 0 | E938: =R[-9]C -> 71 | F938: =R[-9]C -> 80 | G938: 4 | H938: 20000 | I938: 110003 | J938: 4 | K938: =R[-1]C -> [{7,3},{8,3},{9,3},{10,3},{11,3},{12,3},{17,10},{18,8},{19,1},{23,4},{24,10}] | L938: =R[-1]C -> [{7,27},{8,55},{9,27},{10,55},{11,27},{12,55},{17,18},{18,110},{19,3},{23,37},{24,37}] | M938: =R[-1]C -> [{0,1,[1,30]},{1,2,[11,40]},{2,5,[21,50]},{5,10,[31,60]},{10,20,[41,60]},{30,20,[51,70]},{50,10,[61,80]},{70,5,[71,80]},{100,2,[81,90]},{150,1,[91,100]}]
A939: 936 | B939: 5 | C939: 1 | D939: 0 | E939: =R[-9]C -> 81 | F939: =R[-9]C -> 90 | G939: 4 | H939: 20000 | I939: 110003 | J939: 4 | K939: =R[-1]C -> [{7,3},{8,3},{9,3},{10,3},{11,3},{12,3},{17,10},{18,8},{19,1},{23,4},{24,10}] | L939: =R[-1]C -> [{7,27},{8,55},{9,27},{10,55},{11,27},{12,55},{17,18},{18,110},{19,3},{23,37},{24,37}] | M939: =R[-1]C -> [{0,1,[1,30]},{1,2,[11,40]},{2,5,[21,50]},{5,10,[31,60]},{10,20,[41,60]},{30,20,[51,70]},{50,10,[61,80]},{70,5,[71,80]},{100,2,[81,90]},{150,1,[91,100]}]
A940: 937 | B940: 6 | C940: 1 | D940: 0 | E940: =R[-9]C -> 1 | F940: =R[-9]C -> 10 | G940: 5 | H940: 20000 | I940: 110003 | J940: 5 | K940: =R[-1]C -> [{7,3},{8,3},{9,3},{10,3},{11,3},{12,3},{17,10},{18,8},{19,1},{23,4},{24,10}] | L940: =R[-1]C -> [{7,27},{8,55},{9,27},{10,55},{11,27},{12,55},{17,18},{18,110},{19,3},{23,37},{24,37}] | M940: =R[-1]C -> [{0,1,[1,30]},{1,2,[11,40]},{2,5,[21,50]},{5,10,[31,60]},{10,20,[41,60]},{30,20,[51,70]},{50,10,[61,80]},{70,5,[71,80]},{100,2,[81,90]},{150,1,[91,100]}]
A941: 938 | B941: 6 | C941: 1 | D941: 0 | E941: =R[-9]C -> 11 | F941: =R[-9]C -> 20 | G941: 5 | H941: 20000 | I941: 110003 | J941: 5 | K941: =R[-1]C -> [{7,3},{8,3},{9,3},{10,3},{11,3},{12,3},{17,10},{18,8},{19,1},{23,4},{24,10}] | L941: =R[-1]C -> [{7,27},{8,55},{9,27},{10,55},{11,27},{12,55},{17,18},{18,110},{19,3},{23,37},{24,37}] | M941: =R[-1]C -> [{0,1,[1,30]},{1,2,[11,40]},{2,5,[21,50]},{5,10,[31,60]},{10,20,[41,60]},{30,20,[51,70]},{50,10,[61,80]},{70,5,[71,80]},{100,2,[81,90]},{150,1,[91,100]}]
A942: 939 | B942: 6 | C942: 1 | D942: 0 | E942: =R[-9]C -> 21 | F942: =R[-9]C -> 30 | G942: 5 | H942: 20000 | I942: 110003 | J942: 5 | K942: =R[-1]C -> [{7,3},{8,3},{9,3},{10,3},{11,3},{12,3},{17,10},{18,8},{19,1},{23,4},{24,10}] | L942: =R[-1]C -> [{7,27},{8,55},{9,27},{10,55},{11,27},{12,55},{17,18},{18,110},{19,3},{23,37},{24,37}] | M942: =R[-1]C -> [{0,1,[1,30]},{1,2,[11,40]},{2,5,[21,50]},{5,10,[31,60]},{10,20,[41,60]},{30,20,[51,70]},{50,10,[61,80]},{70,5,[71,80]},{100,2,[81,90]},{150,1,[91,100]}]
A943: 940 | B943: 6 | C943: 1 | D943: 0 | E943: =R[-9]C -> 31 | F943: =R[-9]C -> 40 | G943: 5 | H943: 20000 | I943: 110003 | J943: 5 | K943: =R[-1]C -> [{7,3},{8,3},{9,3},{10,3},{11,3},{12,3},{17,10},{18,8},{19,1},{23,4},{24,10}] | L943: =R[-1]C -> [{7,27},{8,55},{9,27},{10,55},{11,27},{12,55},{17,18},{18,110},{19,3},{23,37},{24,37}] | M943: =R[-1]C -> [{0,1,[1,30]},{1,2,[11,40]},{2,5,[21,50]},{5,10,[31,60]},{10,20,[41,60]},{30,20,[51,70]},{50,10,[61,80]},{70,5,[71,80]},{100,2,[81,90]},{150,1,[91,100]}]
A944: 941 | B944: 6 | C944: 1 | D944: 0 | E944: =R[-9]C -> 41 | F944: =R[-9]C -> 50 | G944: 5 | H944: 20000 | I944: 110003 | J944: 5 | K944: =R[-1]C -> [{7,3},{8,3},{9,3},{10,3},{11,3},{12,3},{17,10},{18,8},{19,1},{23,4},{24,10}] | L944: =R[-1]C -> [{7,27},{8,55},{9,27},{10,55},{11,27},{12,55},{17,18},{18,110},{19,3},{23,37},{24,37}] | M944: =R[-1]C -> [{0,1,[1,30]},{1,2,[11,40]},{2,5,[21,50]},{5,10,[31,60]},{10,20,[41,60]},{30,20,[51,70]},{50,10,[61,80]},{70,5,[71,80]},{100,2,[81,90]},{150,1,[91,100]}]
A945: 942 | B945: 6 | C945: 1 | D945: 0 | E945: =R[-9]C -> 51 | F945: =R[-9]C -> 60 | G945: 5 | H945: 20000 | I945: 110003 | J945: 5 | K945: =R[-1]C -> [{7,3},{8,3},{9,3},{10,3},{11,3},{12,3},{17,10},{18,8},{19,1},{23,4},{24,10}] | L945: =R[-1]C -> [{7,27},{8,55},{9,27},{10,55},{11,27},{12,55},{17,18},{18,110},{19,3},{23,37},{24,37}] | M945: =R[-1]C -> [{0,1,[1,30]},{1,2,[11,40]},{2,5,[21,50]},{5,10,[31,60]},{10,20,[41,60]},{30,20,[51,70]},{50,10,[61,80]},{70,5,[71,80]},{100,2,[81,90]},{150,1,[91,100]}]
A946: 943 | B946: 6 | C946: 1 | D946: 0 | E946: =R[-9]C -> 61 | F946: =R[-9]C -> 70 | G946: 5 | H946: 20000 | I946: 110003 | J946: 5 | K946: =R[-1]C -> [{7,3},{8,3},{9,3},{10,3},{11,3},{12,3},{17,10},{18,8},{19,1},{23,4},{24,10}] | L946: =R[-1]C -> [{7,27},{8,55},{9,27},{10,55},{11,27},{12,55},{17,18},{18,110},{19,3},{23,37},{24,37}] | M946: =R[-1]C -> [{0,1,[1,30]},{1,2,[11,40]},{2,5,[21,50]},{5,10,[31,60]},{10,20,[41,60]},{30,20,[51,70]},{50,10,[61,80]},{70,5,[71,80]},{100,2,[81,90]},{150,1,[91,100]}]
A947: 944 | B947: 6 | C947: 1 | D947: 0 | E947: =R[-9]C -> 71 | F947: =R[-9]C -> 80 | G947: 5 | H947: 20000 | I947: 110003 | J947: 5 | K947: =R[-1]C -> [{7,3},{8,3},{9,3},{10,3},{11,3},{12,3},{17,10},{18,8},{19,1},{23,4},{24,10}] | L947: =R[-1]C -> [{7,27},{8,55},{9,27},{10,55},{11,27},{12,55},{17,18},{18,110},{19,3},{23,37},{24,37}] | M947: =R[-1]C -> [{0,1,[1,30]},{1,2,[11,40]},{2,5,[21,50]},{5,10,[31,60]},{10,20,[41,60]},{30,20,[51,70]},{50,10,[61,80]},{70,5,[71,80]},{100,2,[81,90]},{150,1,[91,100]}]
A948: 945 | B948: 6 | C948: 1 | D948: 0 | E948: =R[-9]C -> 81 | F948: =R[-9]C -> 90 | G948: 5 | H948: 20000 | I948: 110003 | J948: 5 | K948: =R[-1]C -> [{7,3},{8,3},{9,3},{10,3},{11,3},{12,3},{17,10},{18,8},{19,1},{23,4},{24,10}] | L948: =R[-1]C -> [{7,27},{8,55},{9,27},{10,55},{11,27},{12,55},{17,18},{18,110},{19,3},{23,37},{24,37}] | M948: =R[-1]C -> [{0,1,[1,30]},{1,2,[11,40]},{2,5,[21,50]},{5,10,[31,60]},{10,20,[41,60]},{30,20,[51,70]},{50,10,[61,80]},{70,5,[71,80]},{100,2,[81,90]},{150,1,[91,100]}]
A949: 946 | B949: 2 | C949: 4 | D949: 0 | E949: =R[-18]C -> 1 | F949: =R[-18]C -> 10 | G949: 1 | H949: 5000 | I949: 110003 | J949: 1 | K949: =R[-1]C -> [{7,3},{8,3},{9,3},{10,3},{11,3},{12,3},{17,10},{18,8},{19,1},{23,4},{24,10}] | L949: =R[-1]C -> [{7,27},{8,55},{9,27},{10,55},{11,27},{12,55},{17,18},{18,110},{19,3},{23,37},{24,37}] | M949: =R[-1]C -> [{0,1,[1,30]},{1,2,[11,40]},{2,5,[21,50]},{5,10,[31,60]},{10,20,[41,60]},{30,20,[51,70]},{50,10,[61,80]},{70,5,[71,80]},{100,2,[81,90]},{150,1,[91,100]}]
A950: 947 | B950: 2 | C950: 4 | D950: 0 | E950: =R[-18]C -> 11 | F950: =R[-18]C -> 20 | G950: 1 | H950: 5000 | I950: 110003 | J950: 1 | K950: =R[-1]C -> [{7,3},{8,3},{9,3},{10,3},{11,3},{12,3},{17,10},{18,8},{19,1},{23,4},{24,10}] | L950: =R[-1]C -> [{7,27},{8,55},{9,27},{10,55},{11,27},{12,55},{17,18},{18,110},{19,3},{23,37},{24,37}] | M950: =R[-1]C -> [{0,1,[1,30]},{1,2,[11,40]},{2,5,[21,50]},{5,10,[31,60]},{10,20,[41,60]},{30,20,[51,70]},{50,10,[61,80]},{70,5,[71,80]},{100,2,[81,90]},{150,1,[91,100]}]
A951: 948 | B951: 2 | C951: 4 | D951: 0 | E951: =R[-18]C -> 21 | F951: =R[-18]C -> 30 | G951: 1 | H951: 5000 | I951: 110003 | J951: 1 | K951: =R[-1]C -> [{7,3},{8,3},{9,3},{10,3},{11,3},{12,3},{17,10},{18,8},{19,1},{23,4},{24,10}] | L951: =R[-1]C -> [{7,27},{8,55},{9,27},{10,55},{11,27},{12,55},{17,18},{18,110},{19,3},{23,37},{24,37}] | M951: =R[-1]C -> [{0,1,[1,30]},{1,2,[11,40]},{2,5,[21,50]},{5,10,[31,60]},{10,20,[41,60]},{30,20,[51,70]},{50,10,[61,80]},{70,5,[71,80]},{100,2,[81,90]},{150,1,[91,100]}]
A952: 949 | B952: 2 | C952: 4 | D952: 0 | E952: =R[-18]C -> 31 | F952: =R[-18]C -> 40 | G952: 1 | H952: 5000 | I952: 110003 | J952: 1 | K952: =R[-1]C -> [{7,3},{8,3},{9,3},{10,3},{11,3},{12,3},{17,10},{18,8},{19,1},{23,4},{24,10}] | L952: =R[-1]C -> [{7,27},{8,55},{9,27},{10,55},{11,27},{12,55},{17,18},{18,110},{19,3},{23,37},{24,37}] | M952: =R[-1]C -> [{0,1,[1,30]},{1,2,[11,40]},{2,5,[21,50]},{5,10,[31,60]},{10,20,[41,60]},{30,20,[51,70]},{50,10,[61,80]},{70,5,[71,80]},{100,2,[81,90]},{150,1,[91,100]}]
A953: 950 | B953: 2 | C953: 4 | D953: 0 | E953: =R[-18]C -> 41 | F953: =R[-18]C -> 50 | G953: 1 | H953: 5000 | I953: 110003 | J953: 1 | K953: =R[-1]C -> [{7,3},{8,3},{9,3},{10,3},{11,3},{12,3},{17,10},{18,8},{19,1},{23,4},{24,10}] | L953: =R[-1]C -> [{7,27},{8,55},{9,27},{10,55},{11,27},{12,55},{17,18},{18,110},{19,3},{23,37},{24,37}] | M953: =R[-1]C -> [{0,1,[1,30]},{1,2,[11,40]},{2,5,[21,50]},{5,10,[31,60]},{10,20,[41,60]},{30,20,[51,70]},{50,10,[61,80]},{70,5,[71,80]},{100,2,[81,90]},{150,1,[91,100]}]
A954: 951 | B954: 2 | C954: 4 | D954: 0 | E954: =R[-18]C -> 51 | F954: =R[-18]C -> 60 | G954: 1 | H954: 5000 | I954: 110003 | J954: 1 | K954: =R[-1]C -> [{7,3},{8,3},{9,3},{10,3},{11,3},{12,3},{17,10},{18,8},{19,1},{23,4},{24,10}] | L954: =R[-1]C -> [{7,27},{8,55},{9,27},{10,55},{11,27},{12,55},{17,18},{18,110},{19,3},{23,37},{24,37}] | M954: =R[-1]C -> [{0,1,[1,30]},{1,2,[11,40]},{2,5,[21,50]},{5,10,[31,60]},{10,20,[41,60]},{30,20,[51,70]},{50,10,[61,80]},{70,5,[71,80]},{100,2,[81,90]},{150,1,[91,100]}]
A955: 952 | B955: 2 | C955: 4 | D955: 0 | E955: =R[-18]C -> 61 | F955: =R[-18]C -> 70 | G955: 1 | H955: 5000 | I955: 110003 | J955: 1 | K955: =R[-1]C -> [{7,3},{8,3},{9,3},{10,3},{11,3},{12,3},{17,10},{18,8},{19,1},{23,4},{24,10}] | L955: =R[-1]C -> [{7,27},{8,55},{9,27},{10,55},{11,27},{12,55},{17,18},{18,110},{19,3},{23,37},{24,37}] | M955: =R[-1]C -> [{0,1,[1,30]},{1,2,[11,40]},{2,5,[21,50]},{5,10,[31,60]},{10,20,[41,60]},{30,20,[51,70]},{50,10,[61,80]},{70,5,[71,80]},{100,2,[81,90]},{150,1,[91,100]}]
A956: 953 | B956: 2 | C956: 4 | D956: 0 | E956: =R[-18]C -> 71 | F956: =R[-18]C -> 80 | G956: 1 | H956: 5000 | I956: 110003 | J956: 1 | K956: =R[-1]C -> [{7,3},{8,3},{9,3},{10,3},{11,3},{12,3},{17,10},{18,8},{19,1},{23,4},{24,10}] | L956: =R[-1]C -> [{7,27},{8,55},{9,27},{10,55},{11,27},{12,55},{17,18},{18,110},{19,3},{23,37},{24,37}] | M956: =R[-1]C -> [{0,1,[1,30]},{1,2,[11,40]},{2,5,[21,50]},{5,10,[31,60]},{10,20,[41,60]},{30,20,[51,70]},{50,10,[61,80]},{70,5,[71,80]},{100,2,[81,90]},{150,1,[91,100]}]
A957: 954 | B957: 2 | C957: 4 | D957: 0 | E957: =R[-18]C -> 81 | F957: =R[-18]C -> 90 | G957: 1 | H957: 5000 | I957: 110003 | J957: 1 | K957: =R[-1]C -> [{7,3},{8,3},{9,3},{10,3},{11,3},{12,3},{17,10},{18,8},{19,1},{23,4},{24,10}] | L957: =R[-1]C -> [{7,27},{8,55},{9,27},{10,55},{11,27},{12,55},{17,18},{18,110},{19,3},{23,37},{24,37}] | M957: =R[-1]C -> [{0,1,[1,30]},{1,2,[11,40]},{2,5,[21,50]},{5,10,[31,60]},{10,20,[41,60]},{30,20,[51,70]},{50,10,[61,80]},{70,5,[71,80]},{100,2,[81,90]},{150,1,[91,100]}]
A958: 955 | B958: 3 | C958: 4 | D958: 0 | E958: =R[-9]C -> 1 | F958: =R[-9]C -> 10 | G958: 2 | H958: 10000 | I958: 110003 | J958: 2 | K958: =R[-1]C -> [{7,3},{8,3},{9,3},{10,3},{11,3},{12,3},{17,10},{18,8},{19,1},{23,4},{24,10}] | L958: =R[-1]C -> [{7,27},{8,55},{9,27},{10,55},{11,27},{12,55},{17,18},{18,110},{19,3},{23,37},{24,37}] | M958: =R[-1]C -> [{0,1,[1,30]},{1,2,[11,40]},{2,5,[21,50]},{5,10,[31,60]},{10,20,[41,60]},{30,20,[51,70]},{50,10,[61,80]},{70,5,[71,80]},{100,2,[81,90]},{150,1,[91,100]}]
A959: 956 | B959: 3 | C959: 4 | D959: 0 | E959: =R[-9]C -> 11 | F959: =R[-9]C -> 20 | G959: 2 | H959: 10000 | I959: 110003 | J959: 2 | K959: =R[-1]C -> [{7,3},{8,3},{9,3},{10,3},{11,3},{12,3},{17,10},{18,8},{19,1},{23,4},{24,10}] | L959: =R[-1]C -> [{7,27},{8,55},{9,27},{10,55},{11,27},{12,55},{17,18},{18,110},{19,3},{23,37},{24,37}] | M959: =R[-1]C -> [{0,1,[1,30]},{1,2,[11,40]},{2,5,[21,50]},{5,10,[31,60]},{10,20,[41,60]},{30,20,[51,70]},{50,10,[61,80]},{70,5,[71,80]},{100,2,[81,90]},{150,1,[91,100]}]
A960: 957 | B960: 3 | C960: 4 | D960: 0 | E960: =R[-9]C -> 21 | F960: =R[-9]C -> 30 | G960: 2 | H960: 10000 | I960: 110003 | J960: 2 | K960: =R[-1]C -> [{7,3},{8,3},{9,3},{10,3},{11,3},{12,3},{17,10},{18,8},{19,1},{23,4},{24,10}] | L960: =R[-1]C -> [{7,27},{8,55},{9,27},{10,55},{11,27},{12,55},{17,18},{18,110},{19,3},{23,37},{24,37}] | M960: =R[-1]C -> [{0,1,[1,30]},{1,2,[11,40]},{2,5,[21,50]},{5,10,[31,60]},{10,20,[41,60]},{30,20,[51,70]},{50,10,[61,80]},{70,5,[71,80]},{100,2,[81,90]},{150,1,[91,100]}]
A961: 958 | B961: 3 | C961: 4 | D961: 0 | E961: =R[-9]C -> 31 | F961: =R[-9]C -> 40 | G961: 2 | H961: 10000 | I961: 110003 | J961: 2 | K961: =R[-1]C -> [{7,3},{8,3},{9,3},{10,3},{11,3},{12,3},{17,10},{18,8},{19,1},{23,4},{24,10}] | L961: =R[-1]C -> [{7,27},{8,55},{9,27},{10,55},{11,27},{12,55},{17,18},{18,110},{19,3},{23,37},{24,37}] | M961: =R[-1]C -> [{0,1,[1,30]},{1,2,[11,40]},{2,5,[21,50]},{5,10,[31,60]},{10,20,[41,60]},{30,20,[51,70]},{50,10,[61,80]},{70,5,[71,80]},{100,2,[81,90]},{150,1,[91,100]}]
A962: 959 | B962: 3 | C962: 4 | D962: 0 | E962: =R[-9]C -> 41 | F962: =R[-9]C -> 50 | G962: 2 | H962: 10000 | I962: 110003 | J962: 2 | K962: =R[-1]C -> [{7,3},{8,3},{9,3},{10,3},{11,3},{12,3},{17,10},{18,8},{19,1},{23,4},{24,10}] | L962: =R[-1]C -> [{7,27},{8,55},{9,27},{10,55},{11,27},{12,55},{17,18},{18,110},{19,3},{23,37},{24,37}] | M962: =R[-1]C -> [{0,1,[1,30]},{1,2,[11,40]},{2,5,[21,50]},{5,10,[31,60]},{10,20,[41,60]},{30,20,[51,70]},{50,10,[61,80]},{70,5,[71,80]},{100,2,[81,90]},{150,1,[91,100]}]
A963: 960 | B963: 3 | C963: 4 | D963: 0 | E963: =R[-9]C -> 51 | F963: =R[-9]C -> 60 | G963: 2 | H963: 10000 | I963: 110003 | J963: 2 | K963: =R[-1]C -> [{7,3},{8,3},{9,3},{10,3},{11,3},{12,3},{17,10},{18,8},{19,1},{23,4},{24,10}] | L963: =R[-1]C -> [{7,27},{8,55},{9,27},{10,55},{11,27},{12,55},{17,18},{18,110},{19,3},{23,37},{24,37}] | M963: =R[-1]C -> [{0,1,[1,30]},{1,2,[11,40]},{2,5,[21,50]},{5,10,[31,60]},{10,20,[41,60]},{30,20,[51,70]},{50,10,[61,80]},{70,5,[71,80]},{100,2,[81,90]},{150,1,[91,100]}]
A964: 961 | B964: 3 | C964: 4 | D964: 0 | E964: =R[-9]C -> 61 | F964: =R[-9]C -> 70 | G964: 2 | H964: 10000 | I964: 110003 | J964: 2 | K964: =R[-1]C -> [{7,3},{8,3},{9,3},{10,3},{11,3},{12,3},{17,10},{18,8},{19,1},{23,4},{24,10}] | L964: =R[-1]C -> [{7,27},{8,55},{9,27},{10,55},{11,27},{12,55},{17,18},{18,110},{19,3},{23,37},{24,37}] | M964: =R[-1]C -> [{0,1,[1,30]},{1,2,[11,40]},{2,5,[21,50]},{5,10,[31,60]},{10,20,[41,60]},{30,20,[51,70]},{50,10,[61,80]},{70,5,[71,80]},{100,2,[81,90]},{150,1,[91,100]}]
A965: 962 | B965: 3 | C965: 4 | D965: 0 | E965: =R[-9]C -> 71 | F965: =R[-9]C -> 80 | G965: 2 | H965: 10000 | I965: 110003 | J965: 2 | K965: =R[-1]C -> [{7,3},{8,3},{9,3},{10,3},{11,3},{12,3},{17,10},{18,8},{19,1},{23,4},{24,10}] | L965: =R[-1]C -> [{7,27},{8,55},{9,27},{10,55},{11,27},{12,55},{17,18},{18,110},{19,3},{23,37},{24,37}] | M965: =R[-1]C -> [{0,1,[1,30]},{1,2,[11,40]},{2,5,[21,50]},{5,10,[31,60]},{10,20,[41,60]},{30,20,[51,70]},{50,10,[61,80]},{70,5,[71,80]},{100,2,[81,90]},{150,1,[91,100]}]
A966: 963 | B966: 3 | C966: 4 | D966: 0 | E966: =R[-9]C -> 81 | F966: =R[-9]C -> 90 | G966: 2 | H966: 10000 | I966: 110003 | J966: 2 | K966: =R[-1]C -> [{7,3},{8,3},{9,3},{10,3},{11,3},{12,3},{17,10},{18,8},{19,1},{23,4},{24,10}] | L966: =R[-1]C -> [{7,27},{8,55},{9,27},{10,55},{11,27},{12,55},{17,18},{18,110},{19,3},{23,37},{24,37}] | M966: =R[-1]C -> [{0,1,[1,30]},{1,2,[11,40]},{2,5,[21,50]},{5,10,[31,60]},{10,20,[41,60]},{30,20,[51,70]},{50,10,[61,80]},{70,5,[71,80]},{100,2,[81,90]},{150,1,[91,100]}]
A967: 964 | B967: 4 | C967: 4 | D967: 0 | E967: =R[-9]C -> 1 | F967: =R[-9]C -> 10 | G967: 3 | H967: 15000 | I967: 110003 | J967: 3 | K967: =R[-1]C -> [{7,3},{8,3},{9,3},{10,3},{11,3},{12,3},{17,10},{18,8},{19,1},{23,4},{24,10}] | L967: =R[-1]C -> [{7,27},{8,55},{9,27},{10,55},{11,27},{12,55},{17,18},{18,110},{19,3},{23,37},{24,37}] | M967: =R[-1]C -> [{0,1,[1,30]},{1,2,[11,40]},{2,5,[21,50]},{5,10,[31,60]},{10,20,[41,60]},{30,20,[51,70]},{50,10,[61,80]},{70,5,[71,80]},{100,2,[81,90]},{150,1,[91,100]}]
A968: 965 | B968: 4 | C968: 4 | D968: 0 | E968: =R[-9]C -> 11 | F968: =R[-9]C -> 20 | G968: 3 | H968: 15000 | I968: 110003 | J968: 3 | K968: =R[-1]C -> [{7,3},{8,3},{9,3},{10,3},{11,3},{12,3},{17,10},{18,8},{19,1},{23,4},{24,10}] | L968: =R[-1]C -> [{7,27},{8,55},{9,27},{10,55},{11,27},{12,55},{17,18},{18,110},{19,3},{23,37},{24,37}] | M968: =R[-1]C -> [{0,1,[1,30]},{1,2,[11,40]},{2,5,[21,50]},{5,10,[31,60]},{10,20,[41,60]},{30,20,[51,70]},{50,10,[61,80]},{70,5,[71,80]},{100,2,[81,90]},{150,1,[91,100]}]
A969: 966 | B969: 4 | C969: 4 | D969: 0 | E969: =R[-9]C -> 21 | F969: =R[-9]C -> 30 | G969: 3 | H969: 15000 | I969: 110003 | J969: 3 | K969: =R[-1]C -> [{7,3},{8,3},{9,3},{10,3},{11,3},{12,3},{17,10},{18,8},{19,1},{23,4},{24,10}] | L969: =R[-1]C -> [{7,27},{8,55},{9,27},{10,55},{11,27},{12,55},{17,18},{18,110},{19,3},{23,37},{24,37}] | M969: =R[-1]C -> [{0,1,[1,30]},{1,2,[11,40]},{2,5,[21,50]},{5,10,[31,60]},{10,20,[41,60]},{30,20,[51,70]},{50,10,[61,80]},{70,5,[71,80]},{100,2,[81,90]},{150,1,[91,100]}]
A970: 967 | B970: 4 | C970: 4 | D970: 0 | E970: =R[-9]C -> 31 | F970: =R[-9]C -> 40 | G970: 3 | H970: 15000 | I970: 110003 | J970: 3 | K970: =R[-1]C -> [{7,3},{8,3},{9,3},{10,3},{11,3},{12,3},{17,10},{18,8},{19,1},{23,4},{24,10}] | L970: =R[-1]C -> [{7,27},{8,55},{9,27},{10,55},{11,27},{12,55},{17,18},{18,110},{19,3},{23,37},{24,37}] | M970: =R[-1]C -> [{0,1,[1,30]},{1,2,[11,40]},{2,5,[21,50]},{5,10,[31,60]},{10,20,[41,60]},{30,20,[51,70]},{50,10,[61,80]},{70,5,[71,80]},{100,2,[81,90]},{150,1,[91,100]}]
A971: 968 | B971: 4 | C971: 4 | D971: 0 | E971: =R[-9]C -> 41 | F971: =R[-9]C -> 50 | G971: 3 | H971: 15000 | I971: 110003 | J971: 3 | K971: =R[-1]C -> [{7,3},{8,3},{9,3},{10,3},{11,3},{12,3},{17,10},{18,8},{19,1},{23,4},{24,10}] | L971: =R[-1]C -> [{7,27},{8,55},{9,27},{10,55},{11,27},{12,55},{17,18},{18,110},{19,3},{23,37},{24,37}] | M971: =R[-1]C -> [{0,1,[1,30]},{1,2,[11,40]},{2,5,[21,50]},{5,10,[31,60]},{10,20,[41,60]},{30,20,[51,70]},{50,10,[61,80]},{70,5,[71,80]},{100,2,[81,90]},{150,1,[91,100]}]
A972: 969 | B972: 4 | C972: 4 | D972: 0 | E972: =R[-9]C -> 51 | F972: =R[-9]C -> 60 | G972: 3 | H972: 15000 | I972: 110003 | J972: 3 | K972: =R[-1]C -> [{7,3},{8,3},{9,3},{10,3},{11,3},{12,3},{17,10},{18,8},{19,1},{23,4},{24,10}] | L972: =R[-1]C -> [{7,27},{8,55},{9,27},{10,55},{11,27},{12,55},{17,18},{18,110},{19,3},{23,37},{24,37}] | M972: =R[-1]C -> [{0,1,[1,30]},{1,2,[11,40]},{2,5,[21,50]},{5,10,[31,60]},{10,20,[41,60]},{30,20,[51,70]},{50,10,[61,80]},{70,5,[71,80]},{100,2,[81,90]},{150,1,[91,100]}]
A973: 970 | B973: 4 | C973: 4 | D973: 0 | E973: =R[-9]C -> 61 | F973: =R[-9]C -> 70 | G973: 3 | H973: 15000 | I973: 110003 | J973: 3 | K973: =R[-1]C -> [{7,3},{8,3},{9,3},{10,3},{11,3},{12,3},{17,10},{18,8},{19,1},{23,4},{24,10}] | L973: =R[-1]C -> [{7,27},{8,55},{9,27},{10,55},{11,27},{12,55},{17,18},{18,110},{19,3},{23,37},{24,37}] | M973: =R[-1]C -> [{0,1,[1,30]},{1,2,[11,40]},{2,5,[21,50]},{5,10,[31,60]},{10,20,[41,60]},{30,20,[51,70]},{50,10,[61,80]},{70,5,[71,80]},{100,2,[81,90]},{150,1,[91,100]}]
A974: 971 | B974: 4 | C974: 4 | D974: 0 | E974: =R[-9]C -> 71 | F974: =R[-9]C -> 80 | G974: 3 | H974: 15000 | I974: 110003 | J974: 3 | K974: =R[-1]C -> [{7,3},{8,3},{9,3},{10,3},{11,3},{12,3},{17,10},{18,8},{19,1},{23,4},{24,10}] | L974: =R[-1]C -> [{7,27},{8,55},{9,27},{10,55},{11,27},{12,55},{17,18},{18,110},{19,3},{23,37},{24,37}] | M974: =R[-1]C -> [{0,1,[1,30]},{1,2,[11,40]},{2,5,[21,50]},{5,10,[31,60]},{10,20,[41,60]},{30,20,[51,70]},{50,10,[61,80]},{70,5,[71,80]},{100,2,[81,90]},{150,1,[91,100]}]
A975: 972 | B975: 4 | C975: 4 | D975: 0 | E975: =R[-9]C -> 81 | F975: =R[-9]C -> 90 | G975: 3 | H975: 15000 | I975: 110003 | J975: 3 | K975: =R[-1]C -> [{7,3},{8,3},{9,3},{10,3},{11,3},{12,3},{17,10},{18,8},{19,1},{23,4},{24,10}] | L975: =R[-1]C -> [{7,27},{8,55},{9,27},{10,55},{11,27},{12,55},{17,18},{18,110},{19,3},{23,37},{24,37}] | M975: =R[-1]C -> [{0,1,[1,30]},{1,2,[11,40]},{2,5,[21,50]},{5,10,[31,60]},{10,20,[41,60]},{30,20,[51,70]},{50,10,[61,80]},{70,5,[71,80]},{100,2,[81,90]},{150,1,[91,100]}]
A976: 973 | B976: 5 | C976: 4 | D976: 0 | E976: =R[-9]C -> 1 | F976: =R[-9]C -> 10 | G976: 4 | H976: 20000 | I976: 110003 | J976: 4 | K976: =R[-1]C -> [{7,3},{8,3},{9,3},{10,3},{11,3},{12,3},{17,10},{18,8},{19,1},{23,4},{24,10}] | L976: =R[-1]C -> [{7,27},{8,55},{9,27},{10,55},{11,27},{12,55},{17,18},{18,110},{19,3},{23,37},{24,37}] | M976: =R[-1]C -> [{0,1,[1,30]},{1,2,[11,40]},{2,5,[21,50]},{5,10,[31,60]},{10,20,[41,60]},{30,20,[51,70]},{50,10,[61,80]},{70,5,[71,80]},{100,2,[81,90]},{150,1,[91,100]}]
A977: 974 | B977: 5 | C977: 4 | D977: 0 | E977: =R[-9]C -> 11 | F977: =R[-9]C -> 20 | G977: 4 | H977: 20000 | I977: 110003 | J977: 4 | K977: =R[-1]C -> [{7,3},{8,3},{9,3},{10,3},{11,3},{12,3},{17,10},{18,8},{19,1},{23,4},{24,10}] | L977: =R[-1]C -> [{7,27},{8,55},{9,27},{10,55},{11,27},{12,55},{17,18},{18,110},{19,3},{23,37},{24,37}] | M977: =R[-1]C -> [{0,1,[1,30]},{1,2,[11,40]},{2,5,[21,50]},{5,10,[31,60]},{10,20,[41,60]},{30,20,[51,70]},{50,10,[61,80]},{70,5,[71,80]},{100,2,[81,90]},{150,1,[91,100]}]
A978: 975 | B978: 5 | C978: 4 | D978: 0 | E978: =R[-9]C -> 21 | F978: =R[-9]C -> 30 | G978: 4 | H978: 20000 | I978: 110003 | J978: 4 | K978: =R[-1]C -> [{7,3},{8,3},{9,3},{10,3},{11,3},{12,3},{17,10},{18,8},{19,1},{23,4},{24,10}] | L978: =R[-1]C -> [{7,27},{8,55},{9,27},{10,55},{11,27},{12,55},{17,18},{18,110},{19,3},{23,37},{24,37}] | M978: =R[-1]C -> [{0,1,[1,30]},{1,2,[11,40]},{2,5,[21,50]},{5,10,[31,60]},{10,20,[41,60]},{30,20,[51,70]},{50,10,[61,80]},{70,5,[71,80]},{100,2,[81,90]},{150,1,[91,100]}]
A979: 976 | B979: 5 | C979: 4 | D979: 0 | E979: =R[-9]C -> 31 | F979: =R[-9]C -> 40 | G979: 4 | H979: 20000 | I979: 110003 | J979: 4 | K979: =R[-1]C -> [{7,3},{8,3},{9,3},{10,3},{11,3},{12,3},{17,10},{18,8},{19,1},{23,4},{24,10}] | L979: =R[-1]C -> [{7,27},{8,55},{9,27},{10,55},{11,27},{12,55},{17,18},{18,110},{19,3},{23,37},{24,37}] | M979: =R[-1]C -> [{0,1,[1,30]},{1,2,[11,40]},{2,5,[21,50]},{5,10,[31,60]},{10,20,[41,60]},{30,20,[51,70]},{50,10,[61,80]},{70,5,[71,80]},{100,2,[81,90]},{150,1,[91,100]}]
A980: 977 | B980: 5 | C980: 4 | D980: 0 | E980: =R[-9]C -> 41 | F980: =R[-9]C -> 50 | G980: 4 | H980: 20000 | I980: 110003 | J980: 4 | K980: =R[-1]C -> [{7,3},{8,3},{9,3},{10,3},{11,3},{12,3},{17,10},{18,8},{19,1},{23,4},{24,10}] | L980: =R[-1]C -> [{7,27},{8,55},{9,27},{10,55},{11,27},{12,55},{17,18},{18,110},{19,3},{23,37},{24,37}] | M980: =R[-1]C -> [{0,1,[1,30]},{1,2,[11,40]},{2,5,[21,50]},{5,10,[31,60]},{10,20,[41,60]},{30,20,[51,70]},{50,10,[61,80]},{70,5,[71,80]},{100,2,[81,90]},{150,1,[91,100]}]
A981: 978 | B981: 5 | C981: 4 | D981: 0 | E981: =R[-9]C -> 51 | F981: =R[-9]C -> 60 | G981: 4 | H981: 20000 | I981: 110003 | J981: 4 | K981: =R[-1]C -> [{7,3},{8,3},{9,3},{10,3},{11,3},{12,3},{17,10},{18,8},{19,1},{23,4},{24,10}] | L981: =R[-1]C -> [{7,27},{8,55},{9,27},{10,55},{11,27},{12,55},{17,18},{18,110},{19,3},{23,37},{24,37}] | M981: =R[-1]C -> [{0,1,[1,30]},{1,2,[11,40]},{2,5,[21,50]},{5,10,[31,60]},{10,20,[41,60]},{30,20,[51,70]},{50,10,[61,80]},{70,5,[71,80]},{100,2,[81,90]},{150,1,[91,100]}]
A982: 979 | B982: 5 | C982: 4 | D982: 0 | E982: =R[-9]C -> 61 | F982: =R[-9]C -> 70 | G982: 4 | H982: 20000 | I982: 110003 | J982: 4 | K982: =R[-1]C -> [{7,3},{8,3},{9,3},{10,3},{11,3},{12,3},{17,10},{18,8},{19,1},{23,4},{24,10}] | L982: =R[-1]C -> [{7,27},{8,55},{9,27},{10,55},{11,27},{12,55},{17,18},{18,110},{19,3},{23,37},{24,37}] | M982: =R[-1]C -> [{0,1,[1,30]},{1,2,[11,40]},{2,5,[21,50]},{5,10,[31,60]},{10,20,[41,60]},{30,20,[51,70]},{50,10,[61,80]},{70,5,[71,80]},{100,2,[81,90]},{150,1,[91,100]}]
A983: 980 | B983: 5 | C983: 4 | D983: 0 | E983: =R[-9]C -> 71 | F983: =R[-9]C -> 80 | G983: 4 | H983: 20000 | I983: 110003 | J983: 4 | K983: =R[-1]C -> [{7,3},{8,3},{9,3},{10,3},{11,3},{12,3},{17,10},{18,8},{19,1},{23,4},{24,10}] | L983: =R[-1]C -> [{7,27},{8,55},{9,27},{10,55},{11,27},{12,55},{17,18},{18,110},{19,3},{23,37},{24,37}] | M983: =R[-1]C -> [{0,1,[1,30]},{1,2,[11,40]},{2,5,[21,50]},{5,10,[31,60]},{10,20,[41,60]},{30,20,[51,70]},{50,10,[61,80]},{70,5,[71,80]},{100,2,[81,90]},{150,1,[91,100]}]
A984: 981 | B984: 5 | C984: 4 | D984: 0 | E984: =R[-9]C -> 81 | F984: =R[-9]C -> 90 | G984: 4 | H984: 20000 | I984: 110003 | J984: 4 | K984: =R[-1]C -> [{7,3},{8,3},{9,3},{10,3},{11,3},{12,3},{17,10},{18,8},{19,1},{23,4},{24,10}] | L984: =R[-1]C -> [{7,27},{8,55},{9,27},{10,55},{11,27},{12,55},{17,18},{18,110},{19,3},{23,37},{24,37}] | M984: =R[-1]C -> [{0,1,[1,30]},{1,2,[11,40]},{2,5,[21,50]},{5,10,[31,60]},{10,20,[41,60]},{30,20,[51,70]},{50,10,[61,80]},{70,5,[71,80]},{100,2,[81,90]},{150,1,[91,100]}]
A985: 982 | B985: 6 | C985: 4 | D985: 0 | E985: =R[-9]C -> 1 | F985: =R[-9]C -> 10 | G985: 5 | H985: 20000 | I985: 110003 | J985: 5 | K985: =R[-1]C -> [{7,3},{8,3},{9,3},{10,3},{11,3},{12,3},{17,10},{18,8},{19,1},{23,4},{24,10}] | L985: =R[-1]C -> [{7,27},{8,55},{9,27},{10,55},{11,27},{12,55},{17,18},{18,110},{19,3},{23,37},{24,37}] | M985: =R[-1]C -> [{0,1,[1,30]},{1,2,[11,40]},{2,5,[21,50]},{5,10,[31,60]},{10,20,[41,60]},{30,20,[51,70]},{50,10,[61,80]},{70,5,[71,80]},{100,2,[81,90]},{150,1,[91,100]}]
A986: 983 | B986: 6 | C986: 4 | D986: 0 | E986: =R[-9]C -> 11 | F986: =R[-9]C -> 20 | G986: 5 | H986: 20000 | I986: 110003 | J986: 5 | K986: =R[-1]C -> [{7,3},{8,3},{9,3},{10,3},{11,3},{12,3},{17,10},{18,8},{19,1},{23,4},{24,10}] | L986: =R[-1]C -> [{7,27},{8,55},{9,27},{10,55},{11,27},{12,55},{17,18},{18,110},{19,3},{23,37},{24,37}] | M986: =R[-1]C -> [{0,1,[1,30]},{1,2,[11,40]},{2,5,[21,50]},{5,10,[31,60]},{10,20,[41,60]},{30,20,[51,70]},{50,10,[61,80]},{70,5,[71,80]},{100,2,[81,90]},{150,1,[91,100]}]
A987: 984 | B987: 6 | C987: 4 | D987: 0 | E987: =R[-9]C -> 21 | F987: =R[-9]C -> 30 | G987: 5 | H987: 20000 | I987: 110003 | J987: 5 | K987: =R[-1]C -> [{7,3},{8,3},{9,3},{10,3},{11,3},{12,3},{17,10},{18,8},{19,1},{23,4},{24,10}] | L987: =R[-1]C -> [{7,27},{8,55},{9,27},{10,55},{11,27},{12,55},{17,18},{18,110},{19,3},{23,37},{24,37}] | M987: =R[-1]C -> [{0,1,[1,30]},{1,2,[11,40]},{2,5,[21,50]},{5,10,[31,60]},{10,20,[41,60]},{30,20,[51,70]},{50,10,[61,80]},{70,5,[71,80]},{100,2,[81,90]},{150,1,[91,100]}]
A988: 985 | B988: 6 | C988: 4 | D988: 0 | E988: =R[-9]C -> 31 | F988: =R[-9]C -> 40 | G988: 5 | H988: 20000 | I988: 110003 | J988: 5 | K988: =R[-1]C -> [{7,3},{8,3},{9,3},{10,3},{11,3},{12,3},{17,10},{18,8},{19,1},{23,4},{24,10}] | L988: =R[-1]C -> [{7,27},{8,55},{9,27},{10,55},{11,27},{12,55},{17,18},{18,110},{19,3},{23,37},{24,37}] | M988: =R[-1]C -> [{0,1,[1,30]},{1,2,[11,40]},{2,5,[21,50]},{5,10,[31,60]},{10,20,[41,60]},{30,20,[51,70]},{50,10,[61,80]},{70,5,[71,80]},{100,2,[81,90]},{150,1,[91,100]}]
A989: 986 | B989: 6 | C989: 4 | D989: 0 | E989: =R[-9]C -> 41 | F989: =R[-9]C -> 50 | G989: 5 | H989: 20000 | I989: 110003 | J989: 5 | K989: =R[-1]C -> [{7,3},{8,3},{9,3},{10,3},{11,3},{12,3},{17,10},{18,8},{19,1},{23,4},{24,10}] | L989: =R[-1]C -> [{7,27},{8,55},{9,27},{10,55},{11,27},{12,55},{17,18},{18,110},{19,3},{23,37},{24,37}] | M989: =R[-1]C -> [{0,1,[1,30]},{1,2,[11,40]},{2,5,[21,50]},{5,10,[31,60]},{10,20,[41,60]},{30,20,[51,70]},{50,10,[61,80]},{70,5,[71,80]},{100,2,[81,90]},{150,1,[91,100]}]
A990: 987 | B990: 6 | C990: 4 | D990: 0 | E990: =R[-9]C -> 51 | F990: =R[-9]C -> 60 | G990: 5 | H990: 20000 | I990: 110003 | J990: 5 | K990: =R[-1]C -> [{7,3},{8,3},{9,3},{10,3},{11,3},{12,3},{17,10},{18,8},{19,1},{23,4},{24,10}] | L990: =R[-1]C -> [{7,27},{8,55},{9,27},{10,55},{11,27},{12,55},{17,18},{18,110},{19,3},{23,37},{24,37}] | M990: =R[-1]C -> [{0,1,[1,30]},{1,2,[11,40]},{2,5,[21,50]},{5,10,[31,60]},{10,20,[41,60]},{30,20,[51,70]},{50,10,[61,80]},{70,5,[71,80]},{100,2,[81,90]},{150,1,[91,100]}]
A991: 988 | B991: 6 | C991: 4 | D991: 0 | E991: =R[-9]C -> 61 | F991: =R[-9]C -> 70 | G991: 5 | H991: 20000 | I991: 110003 | J991: 5 | K991: =R[-1]C -> [{7,3},{8,3},{9,3},{10,3},{11,3},{12,3},{17,10},{18,8},{19,1},{23,4},{24,10}] | L991: =R[-1]C -> [{7,27},{8,55},{9,27},{10,55},{11,27},{12,55},{17,18},{18,110},{19,3},{23,37},{24,37}] | M991: =R[-1]C -> [{0,1,[1,30]},{1,2,[11,40]},{2,5,[21,50]},{5,10,[31,60]},{10,20,[41,60]},{30,20,[51,70]},{50,10,[61,80]},{70,5,[71,80]},{100,2,[81,90]},{150,1,[91,100]}]
A992: 989 | B992: 6 | C992: 4 | D992: 0 | E992: =R[-9]C -> 71 | F992: =R[-9]C -> 80 | G992: 5 | H992: 20000 | I992: 110003 | J992: 5 | K992: =R[-1]C -> [{7,3},{8,3},{9,3},{10,3},{11,3},{12,3},{17,10},{18,8},{19,1},{23,4},{24,10}] | L992: =R[-1]C -> [{7,27},{8,55},{9,27},{10,55},{11,27},{12,55},{17,18},{18,110},{19,3},{23,37},{24,37}] | M992: =R[-1]C -> [{0,1,[1,30]},{1,2,[11,40]},{2,5,[21,50]},{5,10,[31,60]},{10,20,[41,60]},{30,20,[51,70]},{50,10,[61,80]},{70,5,[71,80]},{100,2,[81,90]},{150,1,[91,100]}]
A993: 990 | B993: 6 | C993: 4 | D993: 0 | E993: =R[-9]C -> 81 | F993: =R[-9]C -> 90 | G993: 5 | H993: 20000 | I993: 110003 | J993: 5 | K993: =R[-1]C -> [{7,3},{8,3},{9,3},{10,3},{11,3},{12,3},{17,10},{18,8},{19,1},{23,4},{24,10}] | L993: =R[-1]C -> [{7,27},{8,55},{9,27},{10,55},{11,27},{12,55},{17,18},{18,110},{19,3},{23,37},{24,37}] | M993: =R[-1]C -> [{0,1,[1,30]},{1,2,[11,40]},{2,5,[21,50]},{5,10,[31,60]},{10,20,[41,60]},{30,20,[51,70]},{50,10,[61,80]},{70,5,[71,80]},{100,2,[81,90]},{150,1,[91,100]}]
A994: 991 | B994: 2 | C994: 6 | D994: 0 | E994: =R[-18]C -> 1 | F994: =R[-18]C -> 10 | G994: 1 | H994: 5000 | I994: 110003 | J994: 1 | K994: =R[-1]C -> [{7,3},{8,3},{9,3},{10,3},{11,3},{12,3},{17,10},{18,8},{19,1},{23,4},{24,10}] | L994: =R[-1]C -> [{7,27},{8,55},{9,27},{10,55},{11,27},{12,55},{17,18},{18,110},{19,3},{23,37},{24,37}] | M994: =R[-1]C -> [{0,1,[1,30]},{1,2,[11,40]},{2,5,[21,50]},{5,10,[31,60]},{10,20,[41,60]},{30,20,[51,70]},{50,10,[61,80]},{70,5,[71,80]},{100,2,[81,90]},{150,1,[91,100]}]
A995: 992 | B995: 2 | C995: 6 | D995: 0 | E995: =R[-18]C -> 11 | F995: =R[-18]C -> 20 | G995: 1 | H995: 5000 | I995: 110003 | J995: 1 | K995: =R[-1]C -> [{7,3},{8,3},{9,3},{10,3},{11,3},{12,3},{17,10},{18,8},{19,1},{23,4},{24,10}] | L995: =R[-1]C -> [{7,27},{8,55},{9,27},{10,55},{11,27},{12,55},{17,18},{18,110},{19,3},{23,37},{24,37}] | M995: =R[-1]C -> [{0,1,[1,30]},{1,2,[11,40]},{2,5,[21,50]},{5,10,[31,60]},{10,20,[41,60]},{30,20,[51,70]},{50,10,[61,80]},{70,5,[71,80]},{100,2,[81,90]},{150,1,[91,100]}]
A996: 993 | B996: 2 | C996: 6 | D996: 0 | E996: =R[-18]C -> 21 | F996: =R[-18]C -> 30 | G996: 1 | H996: 5000 | I996: 110003 | J996: 1 | K996: =R[-1]C -> [{7,3},{8,3},{9,3},{10,3},{11,3},{12,3},{17,10},{18,8},{19,1},{23,4},{24,10}] | L996: =R[-1]C -> [{7,27},{8,55},{9,27},{10,55},{11,27},{12,55},{17,18},{18,110},{19,3},{23,37},{24,37}] | M996: =R[-1]C -> [{0,1,[1,30]},{1,2,[11,40]},{2,5,[21,50]},{5,10,[31,60]},{10,20,[41,60]},{30,20,[51,70]},{50,10,[61,80]},{70,5,[71,80]},{100,2,[81,90]},{150,1,[91,100]}]
A997: 994 | B997: 2 | C997: 6 | D997: 0 | E997: =R[-18]C -> 31 | F997: =R[-18]C -> 40 | G997: 1 | H997: 5000 | I997: 110003 | J997: 1 | K997: =R[-1]C -> [{7,3},{8,3},{9,3},{10,3},{11,3},{12,3},{17,10},{18,8},{19,1},{23,4},{24,10}] | L997: =R[-1]C -> [{7,27},{8,55},{9,27},{10,55},{11,27},{12,55},{17,18},{18,110},{19,3},{23,37},{24,37}] | M997: =R[-1]C -> [{0,1,[1,30]},{1,2,[11,40]},{2,5,[21,50]},{5,10,[31,60]},{10,20,[41,60]},{30,20,[51,70]},{50,10,[61,80]},{70,5,[71,80]},{100,2,[81,90]},{150,1,[91,100]}]
A998: 995 | B998: 2 | C998: 6 | D998: 0 | E998: =R[-18]C -> 41 | F998: =R[-18]C -> 50 | G998: 1 | H998: 5000 | I998: 110003 | J998: 1 | K998: =R[-1]C -> [{7,3},{8,3},{9,3},{10,3},{11,3},{12,3},{17,10},{18,8},{19,1},{23,4},{24,10}] | L998: =R[-1]C -> [{7,27},{8,55},{9,27},{10,55},{11,27},{12,55},{17,18},{18,110},{19,3},{23,37},{24,37}] | M998: =R[-1]C -> [{0,1,[1,30]},{1,2,[11,40]},{2,5,[21,50]},{5,10,[31,60]},{10,20,[41,60]},{30,20,[51,70]},{50,10,[61,80]},{70,5,[71,80]},{100,2,[81,90]},{150,1,[91,100]}]
A999: 996 | B999: 2 | C999: 6 | D999: 0 | E999: =R[-18]C -> 51 | F999: =R[-18]C -> 60 | G999: 1 | H999: 5000 | I999: 110003 | J999: 1 | K999: =R[-1]C -> [{7,3},{8,3},{9,3},{10,3},{11,3},{12,3},{17,10},{18,8},{19,1},{23,4},{24,10}] | L999: =R[-1]C -> [{7,27},{8,55},{9,27},{10,55},{11,27},{12,55},{17,18},{18,110},{19,3},{23,37},{24,37}] | M999: =R[-1]C -> [{0,1,[1,30]},{1,2,[11,40]},{2,5,[21,50]},{5,10,[31,60]},{10,20,[41,60]},{30,20,[51,70]},{50,10,[61,80]},{70,5,[71,80]},{100,2,[81,90]},{150,1,[91,100]}]
A1000: 997 | B1000: 2 | C1000: 6 | D1000: 0 | E1000: =R[-18]C -> 61 | F1000: =R[-18]C -> 70 | G1000: 1 | H1000: 5000 | I1000: 110003 | J1000: 1 | K1000: =R[-1]C -> [{7,3},{8,3},{9,3},{10,3},{11,3},{12,3},{17,10},{18,8},{19,1},{23,4},{24,10}] | L1000: =R[-1]C -> [{7,27},{8,55},{9,27},{10,55},{11,27},{12,55},{17,18},{18,110},{19,3},{23,37},{24,37}] | M1000: =R[-1]C -> [{0,1,[1,30]},{1,2,[11,40]},{2,5,[21,50]},{5,10,[31,60]},{10,20,[41,60]},{30,20,[51,70]},{50,10,[61,80]},{70,5,[71,80]},{100,2,[81,90]},{150,1,[91,100]}]
A1001: 998 | B1001: 2 | C1001: 6 | D1001: 0 | E1001: =R[-18]C -> 71 | F1001: =R[-18]C -> 80 | G1001: 1 | H1001: 5000 | I1001: 110003 | J1001: 1 | K1001: =R[-1]C -> [{7,3},{8,3},{9,3},{10,3},{11,3},{12,3},{17,10},{18,8},{19,1},{23,4},{24,10}] | L1001: =R[-1]C -> [{7,27},{8,55},{9,27},{10,55},{11,27},{12,55},{17,18},{18,110},{19,3},{23,37},{24,37}] | M1001: =R[-1]C -> [{0,1,[1,30]},{1,2,[11,40]},{2,5,[21,50]},{5,10,[31,60]},{10,20,[41,60]},{30,20,[51,70]},{50,10,[61,80]},{70,5,[71,80]},{100,2,[81,90]},{150,1,[91,100]}]
A1002: 999 | B1002: 2 | C1002: 6 | D1002: 0 | E1002: =R[-18]C -> 81 | F1002: =R[-18]C -> 90 | G1002: 1 | H1002: 5000 | I1002: 110003 | J1002: 1 | K1002: =R[-1]C -> [{7,3},{8,3},{9,3},{10,3},{11,3},{12,3},{17,10},{18,8},{19,1},{23,4},{24,10}] | L1002: =R[-1]C -> [{7,27},{8,55},{9,27},{10,55},{11,27},{12,55},{17,18},{18,110},{19,3},{23,37},{24,37}] | M1002: =R[-1]C -> [{0,1,[1,30]},{1,2,[11,40]},{2,5,[21,50]},{5,10,[31,60]},{10,20,[41,60]},{30,20,[51,70]},{50,10,[61,80]},{70,5,[71,80]},{100,2,[81,90]},{150,1,[91,100]}]
A1003: 1000 | B1003: 3 | C1003: 6 | D1003: 0 | E1003: =R[-9]C -> 1 | F1003: =R[-9]C -> 10 | G1003: 2 | H1003: 10000 | I1003: 110003 | J1003: 2 | K1003: =R[-1]C -> [{7,3},{8,3},{9,3},{10,3},{11,3},{12,3},{17,10},{18,8},{19,1},{23,4},{24,10}] | L1003: =R[-1]C -> [{7,27},{8,55},{9,27},{10,55},{11,27},{12,55},{17,18},{18,110},{19,3},{23,37},{24,37}] | M1003: =R[-1]C -> [{0,1,[1,30]},{1,2,[11,40]},{2,5,[21,50]},{5,10,[31,60]},{10,20,[41,60]},{30,20,[51,70]},{50,10,[61,80]},{70,5,[71,80]},{100,2,[81,90]},{150,1,[91,100]}]
A1004: 1001 | B1004: 3 | C1004: 6 | D1004: 0 | E1004: =R[-9]C -> 11 | F1004: =R[-9]C -> 20 | G1004: 2 | H1004: 10000 | I1004: 110003 | J1004: 2 | K1004: =R[-1]C -> [{7,3},{8,3},{9,3},{10,3},{11,3},{12,3},{17,10},{18,8},{19,1},{23,4},{24,10}] | L1004: =R[-1]C -> [{7,27},{8,55},{9,27},{10,55},{11,27},{12,55},{17,18},{18,110},{19,3},{23,37},{24,37}] | M1004: =R[-1]C -> [{0,1,[1,30]},{1,2,[11,40]},{2,5,[21,50]},{5,10,[31,60]},{10,20,[41,60]},{30,20,[51,70]},{50,10,[61,80]},{70,5,[71,80]},{100,2,[81,90]},{150,1,[91,100]}]
A1005: 1002 | B1005: 3 | C1005: 6 | D1005: 0 | E1005: =R[-9]C -> 21 | F1005: =R[-9]C -> 30 | G1005: 2 | H1005: 10000 | I1005: 110003 | J1005: 2 | K1005: =R[-1]C -> [{7,3},{8,3},{9,3},{10,3},{11,3},{12,3},{17,10},{18,8},{19,1},{23,4},{24,10}] | L1005: =R[-1]C -> [{7,27},{8,55},{9,27},{10,55},{11,27},{12,55},{17,18},{18,110},{19,3},{23,37},{24,37}] | M1005: =R[-1]C -> [{0,1,[1,30]},{1,2,[11,40]},{2,5,[21,50]},{5,10,[31,60]},{10,20,[41,60]},{30,20,[51,70]},{50,10,[61,80]},{70,5,[71,80]},{100,2,[81,90]},{150,1,[91,100]}]
A1006: 1003 | B1006: 3 | C1006: 6 | D1006: 0 | E1006: =R[-9]C -> 31 | F1006: =R[-9]C -> 40 | G1006: 2 | H1006: 10000 | I1006: 110003 | J1006: 2 | K1006: =R[-1]C -> [{7,3},{8,3},{9,3},{10,3},{11,3},{12,3},{17,10},{18,8},{19,1},{23,4},{24,10}] | L1006: =R[-1]C -> [{7,27},{8,55},{9,27},{10,55},{11,27},{12,55},{17,18},{18,110},{19,3},{23,37},{24,37}] | M1006: =R[-1]C -> [{0,1,[1,30]},{1,2,[11,40]},{2,5,[21,50]},{5,10,[31,60]},{10,20,[41,60]},{30,20,[51,70]},{50,10,[61,80]},{70,5,[71,80]},{100,2,[81,90]},{150,1,[91,100]}]
A1007: 1004 | B1007: 3 | C1007: 6 | D1007: 0 | E1007: =R[-9]C -> 41 | F1007: =R[-9]C -> 50 | G1007: 2 | H1007: 10000 | I1007: 110003 | J1007: 2 | K1007: =R[-1]C -> [{7,3},{8,3},{9,3},{10,3},{11,3},{12,3},{17,10},{18,8},{19,1},{23,4},{24,10}] | L1007: =R[-1]C -> [{7,27},{8,55},{9,27},{10,55},{11,27},{12,55},{17,18},{18,110},{19,3},{23,37},{24,37}] | M1007: =R[-1]C -> [{0,1,[1,30]},{1,2,[11,40]},{2,5,[21,50]},{5,10,[31,60]},{10,20,[41,60]},{30,20,[51,70]},{50,10,[61,80]},{70,5,[71,80]},{100,2,[81,90]},{150,1,[91,100]}]
A1008: 1005 | B1008: 3 | C1008: 6 | D1008: 0 | E1008: =R[-9]C -> 51 | F1008: =R[-9]C -> 60 | G1008: 2 | H1008: 10000 | I1008: 110003 | J1008: 2 | K1008: =R[-1]C -> [{7,3},{8,3},{9,3},{10,3},{11,3},{12,3},{17,10},{18,8},{19,1},{23,4},{24,10}] | L1008: =R[-1]C -> [{7,27},{8,55},{9,27},{10,55},{11,27},{12,55},{17,18},{18,110},{19,3},{23,37},{24,37}] | M1008: =R[-1]C -> [{0,1,[1,30]},{1,2,[11,40]},{2,5,[21,50]},{5,10,[31,60]},{10,20,[41,60]},{30,20,[51,70]},{50,10,[61,80]},{70,5,[71,80]},{100,2,[81,90]},{150,1,[91,100]}]
A1009: 1006 | B1009: 3 | C1009: 6 | D1009: 0 | E1009: =R[-9]C -> 61 | F1009: =R[-9]C -> 70 | G1009: 2 | H1009: 10000 | I1009: 110003 | J1009: 2 | K1009: =R[-1]C -> [{7,3},{8,3},{9,3},{10,3},{11,3},{12,3},{17,10},{18,8},{19,1},{23,4},{24,10}] | L1009: =R[-1]C -> [{7,27},{8,55},{9,27},{10,55},{11,27},{12,55},{17,18},{18,110},{19,3},{23,37},{24,37}] | M1009: =R[-1]C -> [{0,1,[1,30]},{1,2,[11,40]},{2,5,[21,50]},{5,10,[31,60]},{10,20,[41,60]},{30,20,[51,70]},{50,10,[61,80]},{70,5,[71,80]},{100,2,[81,90]},{150,1,[91,100]}]
A1010: 1007 | B1010: 3 | C1010: 6 | D1010: 0 | E1010: =R[-9]C -> 71 | F1010: =R[-9]C -> 80 | G1010: 2 | H1010: 10000 | I1010: 110003 | J1010: 2 | K1010: =R[-1]C -> [{7,3},{8,3},{9,3},{10,3},{11,3},{12,3},{17,10},{18,8},{19,1},{23,4},{24,10}] | L1010: =R[-1]C -> [{7,27},{8,55},{9,27},{10,55},{11,27},{12,55},{17,18},{18,110},{19,3},{23,37},{24,37}] | M1010: =R[-1]C -> [{0,1,[1,30]},{1,2,[11,40]},{2,5,[21,50]},{5,10,[31,60]},{10,20,[41,60]},{30,20,[51,70]},{50,10,[61,80]},{70,5,[71,80]},{100,2,[81,90]},{150,1,[91,100]}]
A1011: 1008 | B1011: 3 | C1011: 6 | D1011: 0 | E1011: =R[-9]C -> 81 | F1011: =R[-9]C -> 90 | G1011: 2 | H1011: 10000 | I1011: 110003 | J1011: 2 | K1011: =R[-1]C -> [{7,3},{8,3},{9,3},{10,3},{11,3},{12,3},{17,10},{18,8},{19,1},{23,4},{24,10}] | L1011: =R[-1]C -> [{7,27},{8,55},{9,27},{10,55},{11,27},{12,55},{17,18},{18,110},{19,3},{23,37},{24,37}] | M1011: =R[-1]C -> [{0,1,[1,30]},{1,2,[11,40]},{2,5,[21,50]},{5,10,[31,60]},{10,20,[41,60]},{30,20,[51,70]},{50,10,[61,80]},{70,5,[71,80]},{100,2,[81,90]},{150,1,[91,100]}]
A1012: 1009 | B1012: 4 | C1012: 6 | D1012: 0 | E1012: =R[-9]C -> 1 | F1012: =R[-9]C -> 10 | G1012: 3 | H1012: 15000 | I1012: 110003 | J1012: 3 | K1012: =R[-1]C -> [{7,3},{8,3},{9,3},{10,3},{11,3},{12,3},{17,10},{18,8},{19,1},{23,4},{24,10}] | L1012: =R[-1]C -> [{7,27},{8,55},{9,27},{10,55},{11,27},{12,55},{17,18},{18,110},{19,3},{23,37},{24,37}] | M1012: =R[-1]C -> [{0,1,[1,30]},{1,2,[11,40]},{2,5,[21,50]},{5,10,[31,60]},{10,20,[41,60]},{30,20,[51,70]},{50,10,[61,80]},{70,5,[71,80]},{100,2,[81,90]},{150,1,[91,100]}]
A1013: 1010 | B1013: 4 | C1013: 6 | D1013: 0 | E1013: =R[-9]C -> 11 | F1013: =R[-9]C -> 20 | G1013: 3 | H1013: 15000 | I1013: 110003 | J1013: 3 | K1013: =R[-1]C -> [{7,3},{8,3},{9,3},{10,3},{11,3},{12,3},{17,10},{18,8},{19,1},{23,4},{24,10}] | L1013: =R[-1]C -> [{7,27},{8,55},{9,27},{10,55},{11,27},{12,55},{17,18},{18,110},{19,3},{23,37},{24,37}] | M1013: =R[-1]C -> [{0,1,[1,30]},{1,2,[11,40]},{2,5,[21,50]},{5,10,[31,60]},{10,20,[41,60]},{30,20,[51,70]},{50,10,[61,80]},{70,5,[71,80]},{100,2,[81,90]},{150,1,[91,100]}]
A1014: 1011 | B1014: 4 | C1014: 6 | D1014: 0 | E1014: =R[-9]C -> 21 | F1014: =R[-9]C -> 30 | G1014: 3 | H1014: 15000 | I1014: 110003 | J1014: 3 | K1014: =R[-1]C -> [{7,3},{8,3},{9,3},{10,3},{11,3},{12,3},{17,10},{18,8},{19,1},{23,4},{24,10}] | L1014: =R[-1]C -> [{7,27},{8,55},{9,27},{10,55},{11,27},{12,55},{17,18},{18,110},{19,3},{23,37},{24,37}] | M1014: =R[-1]C -> [{0,1,[1,30]},{1,2,[11,40]},{2,5,[21,50]},{5,10,[31,60]},{10,20,[41,60]},{30,20,[51,70]},{50,10,[61,80]},{70,5,[71,80]},{100,2,[81,90]},{150,1,[91,100]}]
A1015: 1012 | B1015: 4 | C1015: 6 | D1015: 0 | E1015: =R[-9]C -> 31 | F1015: =R[-9]C -> 40 | G1015: 3 | H1015: 15000 | I1015: 110003 | J1015: 3 | K1015: =R[-1]C -> [{7,3},{8,3},{9,3},{10,3},{11,3},{12,3},{17,10},{18,8},{19,1},{23,4},{24,10}] | L1015: =R[-1]C -> [{7,27},{8,55},{9,27},{10,55},{11,27},{12,55},{17,18},{18,110},{19,3},{23,37},{24,37}] | M1015: =R[-1]C -> [{0,1,[1,30]},{1,2,[11,40]},{2,5,[21,50]},{5,10,[31,60]},{10,20,[41,60]},{30,20,[51,70]},{50,10,[61,80]},{70,5,[71,80]},{100,2,[81,90]},{150,1,[91,100]}]
A1016: 1013 | B1016: 4 | C1016: 6 | D1016: 0 | E1016: =R[-9]C -> 41 | F1016: =R[-9]C -> 50 | G1016: 3 | H1016: 15000 | I1016: 110003 | J1016: 3 | K1016: =R[-1]C -> [{7,3},{8,3},{9,3},{10,3},{11,3},{12,3},{17,10},{18,8},{19,1},{23,4},{24,10}] | L1016: =R[-1]C -> [{7,27},{8,55},{9,27},{10,55},{11,27},{12,55},{17,18},{18,110},{19,3},{23,37},{24,37}] | M1016: =R[-1]C -> [{0,1,[1,30]},{1,2,[11,40]},{2,5,[21,50]},{5,10,[31,60]},{10,20,[41,60]},{30,20,[51,70]},{50,10,[61,80]},{70,5,[71,80]},{100,2,[81,90]},{150,1,[91,100]}]
A1017: 1014 | B1017: 4 | C1017: 6 | D1017: 0 | E1017: =R[-9]C -> 51 | F1017: =R[-9]C -> 60 | G1017: 3 | H1017: 15000 | I1017: 110003 | J1017: 3 | K1017: =R[-1]C -> [{7,3},{8,3},{9,3},{10,3},{11,3},{12,3},{17,10},{18,8},{19,1},{23,4},{24,10}] | L1017: =R[-1]C -> [{7,27},{8,55},{9,27},{10,55},{11,27},{12,55},{17,18},{18,110},{19,3},{23,37},{24,37}] | M1017: =R[-1]C -> [{0,1,[1,30]},{1,2,[11,40]},{2,5,[21,50]},{5,10,[31,60]},{10,20,[41,60]},{30,20,[51,70]},{50,10,[61,80]},{70,5,[71,80]},{100,2,[81,90]},{150,1,[91,100]}]
A1018: 1015 | B1018: 4 | C1018: 6 | D1018: 0 | E1018: =R[-9]C -> 61 | F1018: =R[-9]C -> 70 | G1018: 3 | H1018: 15000 | I1018: 110003 | J1018: 3 | K1018: =R[-1]C -> [{7,3},{8,3},{9,3},{10,3},{11,3},{12,3},{17,10},{18,8},{19,1},{23,4},{24,10}] | L1018: =R[-1]C -> [{7,27},{8,55},{9,27},{10,55},{11,27},{12,55},{17,18},{18,110},{19,3},{23,37},{24,37}] | M1018: =R[-1]C -> [{0,1,[1,30]},{1,2,[11,40]},{2,5,[21,50]},{5,10,[31,60]},{10,20,[41,60]},{30,20,[51,70]},{50,10,[61,80]},{70,5,[71,80]},{100,2,[81,90]},{150,1,[91,100]}]
A1019: 1016 | B1019: 4 | C1019: 6 | D1019: 0 | E1019: =R[-9]C -> 71 | F1019: =R[-9]C -> 80 | G1019: 3 | H1019: 15000 | I1019: 110003 | J1019: 3 | K1019: =R[-1]C -> [{7,3},{8,3},{9,3},{10,3},{11,3},{12,3},{17,10},{18,8},{19,1},{23,4},{24,10}] | L1019: =R[-1]C -> [{7,27},{8,55},{9,27},{10,55},{11,27},{12,55},{17,18},{18,110},{19,3},{23,37},{24,37}] | M1019: =R[-1]C -> [{0,1,[1,30]},{1,2,[11,40]},{2,5,[21,50]},{5,10,[31,60]},{10,20,[41,60]},{30,20,[51,70]},{50,10,[61,80]},{70,5,[71,80]},{100,2,[81,90]},{150,1,[91,100]}]
A1020: 1017 | B1020: 4 | C1020: 6 | D1020: 0 | E1020: =R[-9]C -> 81 | F1020: =R[-9]C -> 90 | G1020: 3 | H1020: 15000 | I1020: 110003 | J1020: 3 | K1020: =R[-1]C -> [{7,3},{8,3},{9,3},{10,3},{11,3},{12,3},{17,10},{18,8},{19,1},{23,4},{24,10}] | L1020: =R[-1]C -> [{7,27},{8,55},{9,27},{10,55},{11,27},{12,55},{17,18},{18,110},{19,3},{23,37},{24,37}] | M1020: =R[-1]C -> [{0,1,[1,30]},{1,2,[11,40]},{2,5,[21,50]},{5,10,[31,60]},{10,20,[41,60]},{30,20,[51,70]},{50,10,[61,80]},{70,5,[71,80]},{100,2,[81,90]},{150,1,[91,100]}]
A1021: 1018 | B1021: 5 | C1021: 6 | D1021: 0 | E1021: =R[-9]C -> 1 | F1021: =R[-9]C -> 10 | G1021: 4 | H1021: 20000 | I1021: 110003 | J1021: 4 | K1021: =R[-1]C -> [{7,3},{8,3},{9,3},{10,3},{11,3},{12,3},{17,10},{18,8},{19,1},{23,4},{24,10}] | L1021: =R[-1]C -> [{7,27},{8,55},{9,27},{10,55},{11,27},{12,55},{17,18},{18,110},{19,3},{23,37},{24,37}] | M1021: =R[-1]C -> [{0,1,[1,30]},{1,2,[11,40]},{2,5,[21,50]},{5,10,[31,60]},{10,20,[41,60]},{30,20,[51,70]},{50,10,[61,80]},{70,5,[71,80]},{100,2,[81,90]},{150,1,[91,100]}]
A1022: 1019 | B1022: 5 | C1022: 6 | D1022: 0 | E1022: =R[-9]C -> 11 | F1022: =R[-9]C -> 20 | G1022: 4 | H1022: 20000 | I1022: 110003 | J1022: 4 | K1022: =R[-1]C -> [{7,3},{8,3},{9,3},{10,3},{11,3},{12,3},{17,10},{18,8},{19,1},{23,4},{24,10}] | L1022: =R[-1]C -> [{7,27},{8,55},{9,27},{10,55},{11,27},{12,55},{17,18},{18,110},{19,3},{23,37},{24,37}] | M1022: =R[-1]C -> [{0,1,[1,30]},{1,2,[11,40]},{2,5,[21,50]},{5,10,[31,60]},{10,20,[41,60]},{30,20,[51,70]},{50,10,[61,80]},{70,5,[71,80]},{100,2,[81,90]},{150,1,[91,100]}]
A1023: 1020 | B1023: 5 | C1023: 6 | D1023: 0 | E1023: =R[-9]C -> 21 | F1023: =R[-9]C -> 30 | G1023: 4 | H1023: 20000 | I1023: 110003 | J1023: 4 | K1023: =R[-1]C -> [{7,3},{8,3},{9,3},{10,3},{11,3},{12,3},{17,10},{18,8},{19,1},{23,4},{24,10}] | L1023: =R[-1]C -> [{7,27},{8,55},{9,27},{10,55},{11,27},{12,55},{17,18},{18,110},{19,3},{23,37},{24,37}] | M1023: =R[-1]C -> [{0,1,[1,30]},{1,2,[11,40]},{2,5,[21,50]},{5,10,[31,60]},{10,20,[41,60]},{30,20,[51,70]},{50,10,[61,80]},{70,5,[71,80]},{100,2,[81,90]},{150,1,[91,100]}]
A1024: 1021 | B1024: 5 | C1024: 6 | D1024: 0 | E1024: =R[-9]C -> 31 | F1024: =R[-9]C -> 40 | G1024: 4 | H1024: 20000 | I1024: 110003 | J1024: 4 | K1024: =R[-1]C -> [{7,3},{8,3},{9,3},{10,3},{11,3},{12,3},{17,10},{18,8},{19,1},{23,4},{24,10}] | L1024: =R[-1]C -> [{7,27},{8,55},{9,27},{10,55},{11,27},{12,55},{17,18},{18,110},{19,3},{23,37},{24,37}] | M1024: =R[-1]C -> [{0,1,[1,30]},{1,2,[11,40]},{2,5,[21,50]},{5,10,[31,60]},{10,20,[41,60]},{30,20,[51,70]},{50,10,[61,80]},{70,5,[71,80]},{100,2,[81,90]},{150,1,[91,100]}]
A1025: 1022 | B1025: 5 | C1025: 6 | D1025: 0 | E1025: =R[-9]C -> 41 | F1025: =R[-9]C -> 50 | G1025: 4 | H1025: 20000 | I1025: 110003 | J1025: 4 | K1025: =R[-1]C -> [{7,3},{8,3},{9,3},{10,3},{11,3},{12,3},{17,10},{18,8},{19,1},{23,4},{24,10}] | L1025: =R[-1]C -> [{7,27},{8,55},{9,27},{10,55},{11,27},{12,55},{17,18},{18,110},{19,3},{23,37},{24,37}] | M1025: =R[-1]C -> [{0,1,[1,30]},{1,2,[11,40]},{2,5,[21,50]},{5,10,[31,60]},{10,20,[41,60]},{30,20,[51,70]},{50,10,[61,80]},{70,5,[71,80]},{100,2,[81,90]},{150,1,[91,100]}]
A1026: 1023 | B1026: 5 | C1026: 6 | D1026: 0 | E1026: =R[-9]C -> 51 | F1026: =R[-9]C -> 60 | G1026: 4 | H1026: 20000 | I1026: 110003 | J1026: 4 | K1026: =R[-1]C -> [{7,3},{8,3},{9,3},{10,3},{11,3},{12,3},{17,10},{18,8},{19,1},{23,4},{24,10}] | L1026: =R[-1]C -> [{7,27},{8,55},{9,27},{10,55},{11,27},{12,55},{17,18},{18,110},{19,3},{23,37},{24,37}] | M1026: =R[-1]C -> [{0,1,[1,30]},{1,2,[11,40]},{2,5,[21,50]},{5,10,[31,60]},{10,20,[41,60]},{30,20,[51,70]},{50,10,[61,80]},{70,5,[71,80]},{100,2,[81,90]},{150,1,[91,100]}]
A1027: 1024 | B1027: 5 | C1027: 6 | D1027: 0 | E1027: =R[-9]C -> 61 | F1027: =R[-9]C -> 70 | G1027: 4 | H1027: 20000 | I1027: 110003 | J1027: 4 | K1027: =R[-1]C -> [{7,3},{8,3},{9,3},{10,3},{11,3},{12,3},{17,10},{18,8},{19,1},{23,4},{24,10}] | L1027: =R[-1]C -> [{7,27},{8,55},{9,27},{10,55},{11,27},{12,55},{17,18},{18,110},{19,3},{23,37},{24,37}] | M1027: =R[-1]C -> [{0,1,[1,30]},{1,2,[11,40]},{2,5,[21,50]},{5,10,[31,60]},{10,20,[41,60]},{30,20,[51,70]},{50,10,[61,80]},{70,5,[71,80]},{100,2,[81,90]},{150,1,[91,100]}]
A1028: 1025 | B1028: 5 | C1028: 6 | D1028: 0 | E1028: =R[-9]C -> 71 | F1028: =R[-9]C -> 80 | G1028: 4 | H1028: 20000 | I1028: 110003 | J1028: 4 | K1028: =R[-1]C -> [{7,3},{8,3},{9,3},{10,3},{11,3},{12,3},{17,10},{18,8},{19,1},{23,4},{24,10}] | L1028: =R[-1]C -> [{7,27},{8,55},{9,27},{10,55},{11,27},{12,55},{17,18},{18,110},{19,3},{23,37},{24,37}] | M1028: =R[-1]C -> [{0,1,[1,30]},{1,2,[11,40]},{2,5,[21,50]},{5,10,[31,60]},{10,20,[41,60]},{30,20,[51,70]},{50,10,[61,80]},{70,5,[71,80]},{100,2,[81,90]},{150,1,[91,100]}]
A1029: 1026 | B1029: 5 | C1029: 6 | D1029: 0 | E1029: =R[-9]C -> 81 | F1029: =R[-9]C -> 90 | G1029: 4 | H1029: 20000 | I1029: 110003 | J1029: 4 | K1029: =R[-1]C -> [{7,3},{8,3},{9,3},{10,3},{11,3},{12,3},{17,10},{18,8},{19,1},{23,4},{24,10}] | L1029: =R[-1]C -> [{7,27},{8,55},{9,27},{10,55},{11,27},{12,55},{17,18},{18,110},{19,3},{23,37},{24,37}] | M1029: =R[-1]C -> [{0,1,[1,30]},{1,2,[11,40]},{2,5,[21,50]},{5,10,[31,60]},{10,20,[41,60]},{30,20,[51,70]},{50,10,[61,80]},{70,5,[71,80]},{100,2,[81,90]},{150,1,[91,100]}]
A1030: 1027 | B1030: 6 | C1030: 6 | D1030: 0 | E1030: =R[-9]C -> 1 | F1030: =R[-9]C -> 10 | G1030: 5 | H1030: 20000 | I1030: 110003 | J1030: 5 | K1030: =R[-1]C -> [{7,3},{8,3},{9,3},{10,3},{11,3},{12,3},{17,10},{18,8},{19,1},{23,4},{24,10}] | L1030: =R[-1]C -> [{7,27},{8,55},{9,27},{10,55},{11,27},{12,55},{17,18},{18,110},{19,3},{23,37},{24,37}] | M1030: =R[-1]C -> [{0,1,[1,30]},{1,2,[11,40]},{2,5,[21,50]},{5,10,[31,60]},{10,20,[41,60]},{30,20,[51,70]},{50,10,[61,80]},{70,5,[71,80]},{100,2,[81,90]},{150,1,[91,100]}]
A1031: 1028 | B1031: 6 | C1031: 6 | D1031: 0 | E1031: =R[-9]C -> 11 | F1031: =R[-9]C -> 20 | G1031: 5 | H1031: 20000 | I1031: 110003 | J1031: 5 | K1031: =R[-1]C -> [{7,3},{8,3},{9,3},{10,3},{11,3},{12,3},{17,10},{18,8},{19,1},{23,4},{24,10}] | L1031: =R[-1]C -> [{7,27},{8,55},{9,27},{10,55},{11,27},{12,55},{17,18},{18,110},{19,3},{23,37},{24,37}] | M1031: =R[-1]C -> [{0,1,[1,30]},{1,2,[11,40]},{2,5,[21,50]},{5,10,[31,60]},{10,20,[41,60]},{30,20,[51,70]},{50,10,[61,80]},{70,5,[71,80]},{100,2,[81,90]},{150,1,[91,100]}]
A1032: 1029 | B1032: 6 | C1032: 6 | D1032: 0 | E1032: =R[-9]C -> 21 | F1032: =R[-9]C -> 30 | G1032: 5 | H1032: 20000 | I1032: 110003 | J1032: 5 | K1032: =R[-1]C -> [{7,3},{8,3},{9,3},{10,3},{11,3},{12,3},{17,10},{18,8},{19,1},{23,4},{24,10}] | L1032: =R[-1]C -> [{7,27},{8,55},{9,27},{10,55},{11,27},{12,55},{17,18},{18,110},{19,3},{23,37},{24,37}] | M1032: =R[-1]C -> [{0,1,[1,30]},{1,2,[11,40]},{2,5,[21,50]},{5,10,[31,60]},{10,20,[41,60]},{30,20,[51,70]},{50,10,[61,80]},{70,5,[71,80]},{100,2,[81,90]},{150,1,[91,100]}]
A1033: 1030 | B1033: 6 | C1033: 6 | D1033: 0 | E1033: =R[-9]C -> 31 | F1033: =R[-9]C -> 40 | G1033: 5 | H1033: 20000 | I1033: 110003 | J1033: 5 | K1033: =R[-1]C -> [{7,3},{8,3},{9,3},{10,3},{11,3},{12,3},{17,10},{18,8},{19,1},{23,4},{24,10}] | L1033: =R[-1]C -> [{7,27},{8,55},{9,27},{10,55},{11,27},{12,55},{17,18},{18,110},{19,3},{23,37},{24,37}] | M1033: =R[-1]C -> [{0,1,[1,30]},{1,2,[11,40]},{2,5,[21,50]},{5,10,[31,60]},{10,20,[41,60]},{30,20,[51,70]},{50,10,[61,80]},{70,5,[71,80]},{100,2,[81,90]},{150,1,[91,100]}]
A1034: 1031 | B1034: 6 | C1034: 6 | D1034: 0 | E1034: =R[-9]C -> 41 | F1034: =R[-9]C -> 50 | G1034: 5 | H1034: 20000 | I1034: 110003 | J1034: 5 | K1034: =R[-1]C -> [{7,3},{8,3},{9,3},{10,3},{11,3},{12,3},{17,10},{18,8},{19,1},{23,4},{24,10}] | L1034: =R[-1]C -> [{7,27},{8,55},{9,27},{10,55},{11,27},{12,55},{17,18},{18,110},{19,3},{23,37},{24,37}] | M1034: =R[-1]C -> [{0,1,[1,30]},{1,2,[11,40]},{2,5,[21,50]},{5,10,[31,60]},{10,20,[41,60]},{30,20,[51,70]},{50,10,[61,80]},{70,5,[71,80]},{100,2,[81,90]},{150,1,[91,100]}]
A1035: 1032 | B1035: 6 | C1035: 6 | D1035: 0 | E1035: =R[-9]C -> 51 | F1035: =R[-9]C -> 60 | G1035: 5 | H1035: 20000 | I1035: 110003 | J1035: 5 | K1035: =R[-1]C -> [{7,3},{8,3},{9,3},{10,3},{11,3},{12,3},{17,10},{18,8},{19,1},{23,4},{24,10}] | L1035: =R[-1]C -> [{7,27},{8,55},{9,27},{10,55},{11,27},{12,55},{17,18},{18,110},{19,3},{23,37},{24,37}] | M1035: =R[-1]C -> [{0,1,[1,30]},{1,2,[11,40]},{2,5,[21,50]},{5,10,[31,60]},{10,20,[41,60]},{30,20,[51,70]},{50,10,[61,80]},{70,5,[71,80]},{100,2,[81,90]},{150,1,[91,100]}]
A1036: 1033 | B1036: 6 | C1036: 6 | D1036: 0 | E1036: =R[-9]C -> 61 | F1036: =R[-9]C -> 70 | G1036: 5 | H1036: 20000 | I1036: 110003 | J1036: 5 | K1036: =R[-1]C -> [{7,3},{8,3},{9,3},{10,3},{11,3},{12,3},{17,10},{18,8},{19,1},{23,4},{24,10}] | L1036: =R[-1]C -> [{7,27},{8,55},{9,27},{10,55},{11,27},{12,55},{17,18},{18,110},{19,3},{23,37},{24,37}] | M1036: =R[-1]C -> [{0,1,[1,30]},{1,2,[11,40]},{2,5,[21,50]},{5,10,[31,60]},{10,20,[41,60]},{30,20,[51,70]},{50,10,[61,80]},{70,5,[71,80]},{100,2,[81,90]},{150,1,[91,100]}]
A1037: 1034 | B1037: 6 | C1037: 6 | D1037: 0 | E1037: =R[-9]C -> 71 | F1037: =R[-9]C -> 80 | G1037: 5 | H1037: 20000 | I1037: 110003 | J1037: 5 | K1037: =R[-1]C -> [{7,3},{8,3},{9,3},{10,3},{11,3},{12,3},{17,10},{18,8},{19,1},{23,4},{24,10}] | L1037: =R[-1]C -> [{7,27},{8,55},{9,27},{10,55},{11,27},{12,55},{17,18},{18,110},{19,3},{23,37},{24,37}] | M1037: =R[-1]C -> [{0,1,[1,30]},{1,2,[11,40]},{2,5,[21,50]},{5,10,[31,60]},{10,20,[41,60]},{30,20,[51,70]},{50,10,[61,80]},{70,5,[71,80]},{100,2,[81,90]},{150,1,[91,100]}]
A1038: 1035 | B1038: 6 | C1038: 6 | D1038: 0 | E1038: =R[-9]C -> 81 | F1038: =R[-9]C -> 90 | G1038: 5 | H1038: 20000 | I1038: 110003 | J1038: 5 | K1038: =R[-1]C -> [{7,3},{8,3},{9,3},{10,3},{11,3},{12,3},{17,10},{18,8},{19,1},{23,4},{24,10}] | L1038: =R[-1]C -> [{7,27},{8,55},{9,27},{10,55},{11,27},{12,55},{17,18},{18,110},{19,3},{23,37},{24,37}] | M1038: =R[-1]C -> [{0,1,[1,30]},{1,2,[11,40]},{2,5,[21,50]},{5,10,[31,60]},{10,20,[41,60]},{30,20,[51,70]},{50,10,[61,80]},{70,5,[71,80]},{100,2,[81,90]},{150,1,[91,100]}]
A1039: 1036 | B1039: 2 | C1039: 7 | D1039: 0 | E1039: =R[-18]C -> 1 | F1039: =R[-18]C -> 10 | G1039: 1 | H1039: 5000 | I1039: 110003 | J1039: 1 | K1039: =R[-1]C -> [{7,3},{8,3},{9,3},{10,3},{11,3},{12,3},{17,10},{18,8},{19,1},{23,4},{24,10}] | L1039: =R[-1]C -> [{7,27},{8,55},{9,27},{10,55},{11,27},{12,55},{17,18},{18,110},{19,3},{23,37},{24,37}] | M1039: =R[-1]C -> [{0,1,[1,30]},{1,2,[11,40]},{2,5,[21,50]},{5,10,[31,60]},{10,20,[41,60]},{30,20,[51,70]},{50,10,[61,80]},{70,5,[71,80]},{100,2,[81,90]},{150,1,[91,100]}]
A1040: 1037 | B1040: 2 | C1040: 7 | D1040: 0 | E1040: =R[-18]C -> 11 | F1040: =R[-18]C -> 20 | G1040: 1 | H1040: 5000 | I1040: 110003 | J1040: 1 | K1040: =R[-1]C -> [{7,3},{8,3},{9,3},{10,3},{11,3},{12,3},{17,10},{18,8},{19,1},{23,4},{24,10}] | L1040: =R[-1]C -> [{7,27},{8,55},{9,27},{10,55},{11,27},{12,55},{17,18},{18,110},{19,3},{23,37},{24,37}] | M1040: =R[-1]C -> [{0,1,[1,30]},{1,2,[11,40]},{2,5,[21,50]},{5,10,[31,60]},{10,20,[41,60]},{30,20,[51,70]},{50,10,[61,80]},{70,5,[71,80]},{100,2,[81,90]},{150,1,[91,100]}]
A1041: 1038 | B1041: 2 | C1041: 7 | D1041: 0 | E1041: =R[-18]C -> 21 | F1041: =R[-18]C -> 30 | G1041: 1 | H1041: 5000 | I1041: 110003 | J1041: 1 | K1041: =R[-1]C -> [{7,3},{8,3},{9,3},{10,3},{11,3},{12,3},{17,10},{18,8},{19,1},{23,4},{24,10}] | L1041: =R[-1]C -> [{7,27},{8,55},{9,27},{10,55},{11,27},{12,55},{17,18},{18,110},{19,3},{23,37},{24,37}] | M1041: =R[-1]C -> [{0,1,[1,30]},{1,2,[11,40]},{2,5,[21,50]},{5,10,[31,60]},{10,20,[41,60]},{30,20,[51,70]},{50,10,[61,80]},{70,5,[71,80]},{100,2,[81,90]},{150,1,[91,100]}]
A1042: 1039 | B1042: 2 | C1042: 7 | D1042: 0 | E1042: =R[-18]C -> 31 | F1042: =R[-18]C -> 40 | G1042: 1 | H1042: 5000 | I1042: 110003 | J1042: 1 | K1042: =R[-1]C -> [{7,3},{8,3},{9,3},{10,3},{11,3},{12,3},{17,10},{18,8},{19,1},{23,4},{24,10}] | L1042: =R[-1]C -> [{7,27},{8,55},{9,27},{10,55},{11,27},{12,55},{17,18},{18,110},{19,3},{23,37},{24,37}] | M1042: =R[-1]C -> [{0,1,[1,30]},{1,2,[11,40]},{2,5,[21,50]},{5,10,[31,60]},{10,20,[41,60]},{30,20,[51,70]},{50,10,[61,80]},{70,5,[71,80]},{100,2,[81,90]},{150,1,[91,100]}]
A1043: 1040 | B1043: 2 | C1043: 7 | D1043: 0 | E1043: =R[-18]C -> 41 | F1043: =R[-18]C -> 50 | G1043: 1 | H1043: 5000 | I1043: 110003 | J1043: 1 | K1043: =R[-1]C -> [{7,3},{8,3},{9,3},{10,3},{11,3},{12,3},{17,10},{18,8},{19,1},{23,4},{24,10}] | L1043: =R[-1]C -> [{7,27},{8,55},{9,27},{10,55},{11,27},{12,55},{17,18},{18,110},{19,3},{23,37},{24,37}] | M1043: =R[-1]C -> [{0,1,[1,30]},{1,2,[11,40]},{2,5,[21,50]},{5,10,[31,60]},{10,20,[41,60]},{30,20,[51,70]},{50,10,[61,80]},{70,5,[71,80]},{100,2,[81,90]},{150,1,[91,100]}]
A1044: 1041 | B1044: 2 | C1044: 7 | D1044: 0 | E1044: =R[-18]C -> 51 | F1044: =R[-18]C -> 60 | G1044: 1 | H1044: 5000 | I1044: 110003 | J1044: 1 | K1044: =R[-1]C -> [{7,3},{8,3},{9,3},{10,3},{11,3},{12,3},{17,10},{18,8},{19,1},{23,4},{24,10}] | L1044: =R[-1]C -> [{7,27},{8,55},{9,27},{10,55},{11,27},{12,55},{17,18},{18,110},{19,3},{23,37},{24,37}] | M1044: =R[-1]C -> [{0,1,[1,30]},{1,2,[11,40]},{2,5,[21,50]},{5,10,[31,60]},{10,20,[41,60]},{30,20,[51,70]},{50,10,[61,80]},{70,5,[71,80]},{100,2,[81,90]},{150,1,[91,100]}]
A1045: 1042 | B1045: 2 | C1045: 7 | D1045: 0 | E1045: =R[-18]C -> 61 | F1045: =R[-18]C -> 70 | G1045: 1 | H1045: 5000 | I1045: 110003 | J1045: 1 | K1045: =R[-1]C -> [{7,3},{8,3},{9,3},{10,3},{11,3},{12,3},{17,10},{18,8},{19,1},{23,4},{24,10}] | L1045: =R[-1]C -> [{7,27},{8,55},{9,27},{10,55},{11,27},{12,55},{17,18},{18,110},{19,3},{23,37},{24,37}] | M1045: =R[-1]C -> [{0,1,[1,30]},{1,2,[11,40]},{2,5,[21,50]},{5,10,[31,60]},{10,20,[41,60]},{30,20,[51,70]},{50,10,[61,80]},{70,5,[71,80]},{100,2,[81,90]},{150,1,[91,100]}]
A1046: 1043 | B1046: 2 | C1046: 7 | D1046: 0 | E1046: =R[-18]C -> 71 | F1046: =R[-18]C -> 80 | G1046: 1 | H1046: 5000 | I1046: 110003 | J1046: 1 | K1046: =R[-1]C -> [{7,3},{8,3},{9,3},{10,3},{11,3},{12,3},{17,10},{18,8},{19,1},{23,4},{24,10}] | L1046: =R[-1]C -> [{7,27},{8,55},{9,27},{10,55},{11,27},{12,55},{17,18},{18,110},{19,3},{23,37},{24,37}] | M1046: =R[-1]C -> [{0,1,[1,30]},{1,2,[11,40]},{2,5,[21,50]},{5,10,[31,60]},{10,20,[41,60]},{30,20,[51,70]},{50,10,[61,80]},{70,5,[71,80]},{100,2,[81,90]},{150,1,[91,100]}]
A1047: 1044 | B1047: 2 | C1047: 7 | D1047: 0 | E1047: =R[-18]C -> 81 | F1047: =R[-18]C -> 90 | G1047: 1 | H1047: 5000 | I1047: 110003 | J1047: 1 | K1047: =R[-1]C -> [{7,3},{8,3},{9,3},{10,3},{11,3},{12,3},{17,10},{18,8},{19,1},{23,4},{24,10}] | L1047: =R[-1]C -> [{7,27},{8,55},{9,27},{10,55},{11,27},{12,55},{17,18},{18,110},{19,3},{23,37},{24,37}] | M1047: =R[-1]C -> [{0,1,[1,30]},{1,2,[11,40]},{2,5,[21,50]},{5,10,[31,60]},{10,20,[41,60]},{30,20,[51,70]},{50,10,[61,80]},{70,5,[71,80]},{100,2,[81,90]},{150,1,[91,100]}]
A1048: 1045 | B1048: 3 | C1048: 7 | D1048: 0 | E1048: =R[-9]C -> 1 | F1048: =R[-9]C -> 10 | G1048: 2 | H1048: 10000 | I1048: 110003 | J1048: 2 | K1048: =R[-1]C -> [{7,3},{8,3},{9,3},{10,3},{11,3},{12,3},{17,10},{18,8},{19,1},{23,4},{24,10}] | L1048: =R[-1]C -> [{7,27},{8,55},{9,27},{10,55},{11,27},{12,55},{17,18},{18,110},{19,3},{23,37},{24,37}] | M1048: =R[-1]C -> [{0,1,[1,30]},{1,2,[11,40]},{2,5,[21,50]},{5,10,[31,60]},{10,20,[41,60]},{30,20,[51,70]},{50,10,[61,80]},{70,5,[71,80]},{100,2,[81,90]},{150,1,[91,100]}]
A1049: 1046 | B1049: 3 | C1049: 7 | D1049: 0 | E1049: =R[-9]C -> 11 | F1049: =R[-9]C -> 20 | G1049: 2 | H1049: 10000 | I1049: 110003 | J1049: 2 | K1049: =R[-1]C -> [{7,3},{8,3},{9,3},{10,3},{11,3},{12,3},{17,10},{18,8},{19,1},{23,4},{24,10}] | L1049: =R[-1]C -> [{7,27},{8,55},{9,27},{10,55},{11,27},{12,55},{17,18},{18,110},{19,3},{23,37},{24,37}] | M1049: =R[-1]C -> [{0,1,[1,30]},{1,2,[11,40]},{2,5,[21,50]},{5,10,[31,60]},{10,20,[41,60]},{30,20,[51,70]},{50,10,[61,80]},{70,5,[71,80]},{100,2,[81,90]},{150,1,[91,100]}]
A1050: 1047 | B1050: 3 | C1050: 7 | D1050: 0 | E1050: =R[-9]C -> 21 | F1050: =R[-9]C -> 30 | G1050: 2 | H1050: 10000 | I1050: 110003 | J1050: 2 | K1050: =R[-1]C -> [{7,3},{8,3},{9,3},{10,3},{11,3},{12,3},{17,10},{18,8},{19,1},{23,4},{24,10}] | L1050: =R[-1]C -> [{7,27},{8,55},{9,27},{10,55},{11,27},{12,55},{17,18},{18,110},{19,3},{23,37},{24,37}] | M1050: =R[-1]C -> [{0,1,[1,30]},{1,2,[11,40]},{2,5,[21,50]},{5,10,[31,60]},{10,20,[41,60]},{30,20,[51,70]},{50,10,[61,80]},{70,5,[71,80]},{100,2,[81,90]},{150,1,[91,100]}]
A1051: 1048 | B1051: 3 | C1051: 7 | D1051: 0 | E1051: =R[-9]C -> 31 | F1051: =R[-9]C -> 40 | G1051: 2 | H1051: 10000 | I1051: 110003 | J1051: 2 | K1051: =R[-1]C -> [{7,3},{8,3},{9,3},{10,3},{11,3},{12,3},{17,10},{18,8},{19,1},{23,4},{24,10}] | L1051: =R[-1]C -> [{7,27},{8,55},{9,27},{10,55},{11,27},{12,55},{17,18},{18,110},{19,3},{23,37},{24,37}] | M1051: =R[-1]C -> [{0,1,[1,30]},{1,2,[11,40]},{2,5,[21,50]},{5,10,[31,60]},{10,20,[41,60]},{30,20,[51,70]},{50,10,[61,80]},{70,5,[71,80]},{100,2,[81,90]},{150,1,[91,100]}]
A1052: 1049 | B1052: 3 | C1052: 7 | D1052: 0 | E1052: =R[-9]C -> 41 | F1052: =R[-9]C -> 50 | G1052: 2 | H1052: 10000 | I1052: 110003 | J1052: 2 | K1052: =R[-1]C -> [{7,3},{8,3},{9,3},{10,3},{11,3},{12,3},{17,10},{18,8},{19,1},{23,4},{24,10}] | L1052: =R[-1]C -> [{7,27},{8,55},{9,27},{10,55},{11,27},{12,55},{17,18},{18,110},{19,3},{23,37},{24,37}] | M1052: =R[-1]C -> [{0,1,[1,30]},{1,2,[11,40]},{2,5,[21,50]},{5,10,[31,60]},{10,20,[41,60]},{30,20,[51,70]},{50,10,[61,80]},{70,5,[71,80]},{100,2,[81,90]},{150,1,[91,100]}]
A1053: 1050 | B1053: 3 | C1053: 7 | D1053: 0 | E1053: =R[-9]C -> 51 | F1053: =R[-9]C -> 60 | G1053: 2 | H1053: 10000 | I1053: 110003 | J1053: 2 | K1053: =R[-1]C -> [{7,3},{8,3},{9,3},{10,3},{11,3},{12,3},{17,10},{18,8},{19,1},{23,4},{24,10}] | L1053: =R[-1]C -> [{7,27},{8,55},{9,27},{10,55},{11,27},{12,55},{17,18},{18,110},{19,3},{23,37},{24,37}] | M1053: =R[-1]C -> [{0,1,[1,30]},{1,2,[11,40]},{2,5,[21,50]},{5,10,[31,60]},{10,20,[41,60]},{30,20,[51,70]},{50,10,[61,80]},{70,5,[71,80]},{100,2,[81,90]},{150,1,[91,100]}]
A1054: 1051 | B1054: 3 | C1054: 7 | D1054: 0 | E1054: =R[-9]C -> 61 | F1054: =R[-9]C -> 70 | G1054: 2 | H1054: 10000 | I1054: 110003 | J1054: 2 | K1054: =R[-1]C -> [{7,3},{8,3},{9,3},{10,3},{11,3},{12,3},{17,10},{18,8},{19,1},{23,4},{24,10}] | L1054: =R[-1]C -> [{7,27},{8,55},{9,27},{10,55},{11,27},{12,55},{17,18},{18,110},{19,3},{23,37},{24,37}] | M1054: =R[-1]C -> [{0,1,[1,30]},{1,2,[11,40]},{2,5,[21,50]},{5,10,[31,60]},{10,20,[41,60]},{30,20,[51,70]},{50,10,[61,80]},{70,5,[71,80]},{100,2,[81,90]},{150,1,[91,100]}]
A1055: 1052 | B1055: 3 | C1055: 7 | D1055: 0 | E1055: =R[-9]C -> 71 | F1055: =R[-9]C -> 80 | G1055: 2 | H1055: 10000 | I1055: 110003 | J1055: 2 | K1055: =R[-1]C -> [{7,3},{8,3},{9,3},{10,3},{11,3},{12,3},{17,10},{18,8},{19,1},{23,4},{24,10}] | L1055: =R[-1]C -> [{7,27},{8,55},{9,27},{10,55},{11,27},{12,55},{17,18},{18,110},{19,3},{23,37},{24,37}] | M1055: =R[-1]C -> [{0,1,[1,30]},{1,2,[11,40]},{2,5,[21,50]},{5,10,[31,60]},{10,20,[41,60]},{30,20,[51,70]},{50,10,[61,80]},{70,5,[71,80]},{100,2,[81,90]},{150,1,[91,100]}]
A1056: 1053 | B1056: 3 | C1056: 7 | D1056: 0 | E1056: =R[-9]C -> 81 | F1056: =R[-9]C -> 90 | G1056: 2 | H1056: 10000 | I1056: 110003 | J1056: 2 | K1056: =R[-1]C -> [{7,3},{8,3},{9,3},{10,3},{11,3},{12,3},{17,10},{18,8},{19,1},{23,4},{24,10}] | L1056: =R[-1]C -> [{7,27},{8,55},{9,27},{10,55},{11,27},{12,55},{17,18},{18,110},{19,3},{23,37},{24,37}] | M1056: =R[-1]C -> [{0,1,[1,30]},{1,2,[11,40]},{2,5,[21,50]},{5,10,[31,60]},{10,20,[41,60]},{30,20,[51,70]},{50,10,[61,80]},{70,5,[71,80]},{100,2,[81,90]},{150,1,[91,100]}]
A1057: 1054 | B1057: 4 | C1057: 7 | D1057: 0 | E1057: =R[-9]C -> 1 | F1057: =R[-9]C -> 10 | G1057: 3 | H1057: 15000 | I1057: 110003 | J1057: 3 | K1057: =R[-1]C -> [{7,3},{8,3},{9,3},{10,3},{11,3},{12,3},{17,10},{18,8},{19,1},{23,4},{24,10}] | L1057: =R[-1]C -> [{7,27},{8,55},{9,27},{10,55},{11,27},{12,55},{17,18},{18,110},{19,3},{23,37},{24,37}] | M1057: =R[-1]C -> [{0,1,[1,30]},{1,2,[11,40]},{2,5,[21,50]},{5,10,[31,60]},{10,20,[41,60]},{30,20,[51,70]},{50,10,[61,80]},{70,5,[71,80]},{100,2,[81,90]},{150,1,[91,100]}]
A1058: 1055 | B1058: 4 | C1058: 7 | D1058: 0 | E1058: =R[-9]C -> 11 | F1058: =R[-9]C -> 20 | G1058: 3 | H1058: 15000 | I1058: 110003 | J1058: 3 | K1058: =R[-1]C -> [{7,3},{8,3},{9,3},{10,3},{11,3},{12,3},{17,10},{18,8},{19,1},{23,4},{24,10}] | L1058: =R[-1]C -> [{7,27},{8,55},{9,27},{10,55},{11,27},{12,55},{17,18},{18,110},{19,3},{23,37},{24,37}] | M1058: =R[-1]C -> [{0,1,[1,30]},{1,2,[11,40]},{2,5,[21,50]},{5,10,[31,60]},{10,20,[41,60]},{30,20,[51,70]},{50,10,[61,80]},{70,5,[71,80]},{100,2,[81,90]},{150,1,[91,100]}]
A1059: 1056 | B1059: 4 | C1059: 7 | D1059: 0 | E1059: =R[-9]C -> 21 | F1059: =R[-9]C -> 30 | G1059: 3 | H1059: 15000 | I1059: 110003 | J1059: 3 | K1059: =R[-1]C -> [{7,3},{8,3},{9,3},{10,3},{11,3},{12,3},{17,10},{18,8},{19,1},{23,4},{24,10}] | L1059: =R[-1]C -> [{7,27},{8,55},{9,27},{10,55},{11,27},{12,55},{17,18},{18,110},{19,3},{23,37},{24,37}] | M1059: =R[-1]C -> [{0,1,[1,30]},{1,2,[11,40]},{2,5,[21,50]},{5,10,[31,60]},{10,20,[41,60]},{30,20,[51,70]},{50,10,[61,80]},{70,5,[71,80]},{100,2,[81,90]},{150,1,[91,100]}]
A1060: 1057 | B1060: 4 | C1060: 7 | D1060: 0 | E1060: =R[-9]C -> 31 | F1060: =R[-9]C -> 40 | G1060: 3 | H1060: 15000 | I1060: 110003 | J1060: 3 | K1060: =R[-1]C -> [{7,3},{8,3},{9,3},{10,3},{11,3},{12,3},{17,10},{18,8},{19,1},{23,4},{24,10}] | L1060: =R[-1]C -> [{7,27},{8,55},{9,27},{10,55},{11,27},{12,55},{17,18},{18,110},{19,3},{23,37},{24,37}] | M1060: =R[-1]C -> [{0,1,[1,30]},{1,2,[11,40]},{2,5,[21,50]},{5,10,[31,60]},{10,20,[41,60]},{30,20,[51,70]},{50,10,[61,80]},{70,5,[71,80]},{100,2,[81,90]},{150,1,[91,100]}]
A1061: 1058 | B1061: 4 | C1061: 7 | D1061: 0 | E1061: =R[-9]C -> 41 | F1061: =R[-9]C -> 50 | G1061: 3 | H1061: 15000 | I1061: 110003 | J1061: 3 | K1061: =R[-1]C -> [{7,3},{8,3},{9,3},{10,3},{11,3},{12,3},{17,10},{18,8},{19,1},{23,4},{24,10}] | L1061: =R[-1]C -> [{7,27},{8,55},{9,27},{10,55},{11,27},{12,55},{17,18},{18,110},{19,3},{23,37},{24,37}] | M1061: =R[-1]C -> [{0,1,[1,30]},{1,2,[11,40]},{2,5,[21,50]},{5,10,[31,60]},{10,20,[41,60]},{30,20,[51,70]},{50,10,[61,80]},{70,5,[71,80]},{100,2,[81,90]},{150,1,[91,100]}]
A1062: 1059 | B1062: 4 | C1062: 7 | D1062: 0 | E1062: =R[-9]C -> 51 | F1062: =R[-9]C -> 60 | G1062: 3 | H1062: 15000 | I1062: 110003 | J1062: 3 | K1062: =R[-1]C -> [{7,3},{8,3},{9,3},{10,3},{11,3},{12,3},{17,10},{18,8},{19,1},{23,4},{24,10}] | L1062: =R[-1]C -> [{7,27},{8,55},{9,27},{10,55},{11,27},{12,55},{17,18},{18,110},{19,3},{23,37},{24,37}] | M1062: =R[-1]C -> [{0,1,[1,30]},{1,2,[11,40]},{2,5,[21,50]},{5,10,[31,60]},{10,20,[41,60]},{30,20,[51,70]},{50,10,[61,80]},{70,5,[71,80]},{100,2,[81,90]},{150,1,[91,100]}]
A1063: 1060 | B1063: 4 | C1063: 7 | D1063: 0 | E1063: =R[-9]C -> 61 | F1063: =R[-9]C -> 70 | G1063: 3 | H1063: 15000 | I1063: 110003 | J1063: 3 | K1063: =R[-1]C -> [{7,3},{8,3},{9,3},{10,3},{11,3},{12,3},{17,10},{18,8},{19,1},{23,4},{24,10}] | L1063: =R[-1]C -> [{7,27},{8,55},{9,27},{10,55},{11,27},{12,55},{17,18},{18,110},{19,3},{23,37},{24,37}] | M1063: =R[-1]C -> [{0,1,[1,30]},{1,2,[11,40]},{2,5,[21,50]},{5,10,[31,60]},{10,20,[41,60]},{30,20,[51,70]},{50,10,[61,80]},{70,5,[71,80]},{100,2,[81,90]},{150,1,[91,100]}]
A1064: 1061 | B1064: 4 | C1064: 7 | D1064: 0 | E1064: =R[-9]C -> 71 | F1064: =R[-9]C -> 80 | G1064: 3 | H1064: 15000 | I1064: 110003 | J1064: 3 | K1064: =R[-1]C -> [{7,3},{8,3},{9,3},{10,3},{11,3},{12,3},{17,10},{18,8},{19,1},{23,4},{24,10}] | L1064: =R[-1]C -> [{7,27},{8,55},{9,27},{10,55},{11,27},{12,55},{17,18},{18,110},{19,3},{23,37},{24,37}] | M1064: =R[-1]C -> [{0,1,[1,30]},{1,2,[11,40]},{2,5,[21,50]},{5,10,[31,60]},{10,20,[41,60]},{30,20,[51,70]},{50,10,[61,80]},{70,5,[71,80]},{100,2,[81,90]},{150,1,[91,100]}]
A1065: 1062 | B1065: 4 | C1065: 7 | D1065: 0 | E1065: =R[-9]C -> 81 | F1065: =R[-9]C -> 90 | G1065: 3 | H1065: 15000 | I1065: 110003 | J1065: 3 | K1065: =R[-1]C -> [{7,3},{8,3},{9,3},{10,3},{11,3},{12,3},{17,10},{18,8},{19,1},{23,4},{24,10}] | L1065: =R[-1]C -> [{7,27},{8,55},{9,27},{10,55},{11,27},{12,55},{17,18},{18,110},{19,3},{23,37},{24,37}] | M1065: =R[-1]C -> [{0,1,[1,30]},{1,2,[11,40]},{2,5,[21,50]},{5,10,[31,60]},{10,20,[41,60]},{30,20,[51,70]},{50,10,[61,80]},{70,5,[71,80]},{100,2,[81,90]},{150,1,[91,100]}]
A1066: 1063 | B1066: 5 | C1066: 7 | D1066: 0 | E1066: =R[-9]C -> 1 | F1066: =R[-9]C -> 10 | G1066: 4 | H1066: 20000 | I1066: 110003 | J1066: 4 | K1066: =R[-1]C -> [{7,3},{8,3},{9,3},{10,3},{11,3},{12,3},{17,10},{18,8},{19,1},{23,4},{24,10}] | L1066: =R[-1]C -> [{7,27},{8,55},{9,27},{10,55},{11,27},{12,55},{17,18},{18,110},{19,3},{23,37},{24,37}] | M1066: =R[-1]C -> [{0,1,[1,30]},{1,2,[11,40]},{2,5,[21,50]},{5,10,[31,60]},{10,20,[41,60]},{30,20,[51,70]},{50,10,[61,80]},{70,5,[71,80]},{100,2,[81,90]},{150,1,[91,100]}]
A1067: 1064 | B1067: 5 | C1067: 7 | D1067: 0 | E1067: =R[-9]C -> 11 | F1067: =R[-9]C -> 20 | G1067: 4 | H1067: 20000 | I1067: 110003 | J1067: 4 | K1067: =R[-1]C -> [{7,3},{8,3},{9,3},{10,3},{11,3},{12,3},{17,10},{18,8},{19,1},{23,4},{24,10}] | L1067: =R[-1]C -> [{7,27},{8,55},{9,27},{10,55},{11,27},{12,55},{17,18},{18,110},{19,3},{23,37},{24,37}] | M1067: =R[-1]C -> [{0,1,[1,30]},{1,2,[11,40]},{2,5,[21,50]},{5,10,[31,60]},{10,20,[41,60]},{30,20,[51,70]},{50,10,[61,80]},{70,5,[71,80]},{100,2,[81,90]},{150,1,[91,100]}]
A1068: 1065 | B1068: 5 | C1068: 7 | D1068: 0 | E1068: =R[-9]C -> 21 | F1068: =R[-9]C -> 30 | G1068: 4 | H1068: 20000 | I1068: 110003 | J1068: 4 | K1068: =R[-1]C -> [{7,3},{8,3},{9,3},{10,3},{11,3},{12,3},{17,10},{18,8},{19,1},{23,4},{24,10}] | L1068: =R[-1]C -> [{7,27},{8,55},{9,27},{10,55},{11,27},{12,55},{17,18},{18,110},{19,3},{23,37},{24,37}] | M1068: =R[-1]C -> [{0,1,[1,30]},{1,2,[11,40]},{2,5,[21,50]},{5,10,[31,60]},{10,20,[41,60]},{30,20,[51,70]},{50,10,[61,80]},{70,5,[71,80]},{100,2,[81,90]},{150,1,[91,100]}]
A1069: 1066 | B1069: 5 | C1069: 7 | D1069: 0 | E1069: =R[-9]C -> 31 | F1069: =R[-9]C -> 40 | G1069: 4 | H1069: 20000 | I1069: 110003 | J1069: 4 | K1069: =R[-1]C -> [{7,3},{8,3},{9,3},{10,3},{11,3},{12,3},{17,10},{18,8},{19,1},{23,4},{24,10}] | L1069: =R[-1]C -> [{7,27},{8,55},{9,27},{10,55},{11,27},{12,55},{17,18},{18,110},{19,3},{23,37},{24,37}] | M1069: =R[-1]C -> [{0,1,[1,30]},{1,2,[11,40]},{2,5,[21,50]},{5,10,[31,60]},{10,20,[41,60]},{30,20,[51,70]},{50,10,[61,80]},{70,5,[71,80]},{100,2,[81,90]},{150,1,[91,100]}]
A1070: 1067 | B1070: 5 | C1070: 7 | D1070: 0 | E1070: =R[-9]C -> 41 | F1070: =R[-9]C -> 50 | G1070: 4 | H1070: 20000 | I1070: 110003 | J1070: 4 | K1070: =R[-1]C -> [{7,3},{8,3},{9,3},{10,3},{11,3},{12,3},{17,10},{18,8},{19,1},{23,4},{24,10}] | L1070: =R[-1]C -> [{7,27},{8,55},{9,27},{10,55},{11,27},{12,55},{17,18},{18,110},{19,3},{23,37},{24,37}] | M1070: =R[-1]C -> [{0,1,[1,30]},{1,2,[11,40]},{2,5,[21,50]},{5,10,[31,60]},{10,20,[41,60]},{30,20,[51,70]},{50,10,[61,80]},{70,5,[71,80]},{100,2,[81,90]},{150,1,[91,100]}]
A1071: 1068 | B1071: 5 | C1071: 7 | D1071: 0 | E1071: =R[-9]C -> 51 | F1071: =R[-9]C -> 60 | G1071: 4 | H1071: 20000 | I1071: 110003 | J1071: 4 | K1071: =R[-1]C -> [{7,3},{8,3},{9,3},{10,3},{11,3},{12,3},{17,10},{18,8},{19,1},{23,4},{24,10}] | L1071: =R[-1]C -> [{7,27},{8,55},{9,27},{10,55},{11,27},{12,55},{17,18},{18,110},{19,3},{23,37},{24,37}] | M1071: =R[-1]C -> [{0,1,[1,30]},{1,2,[11,40]},{2,5,[21,50]},{5,10,[31,60]},{10,20,[41,60]},{30,20,[51,70]},{50,10,[61,80]},{70,5,[71,80]},{100,2,[81,90]},{150,1,[91,100]}]
A1072: 1069 | B1072: 5 | C1072: 7 | D1072: 0 | E1072: =R[-9]C -> 61 | F1072: =R[-9]C -> 70 | G1072: 4 | H1072: 20000 | I1072: 110003 | J1072: 4 | K1072: =R[-1]C -> [{7,3},{8,3},{9,3},{10,3},{11,3},{12,3},{17,10},{18,8},{19,1},{23,4},{24,10}] | L1072: =R[-1]C -> [{7,27},{8,55},{9,27},{10,55},{11,27},{12,55},{17,18},{18,110},{19,3},{23,37},{24,37}] | M1072: =R[-1]C -> [{0,1,[1,30]},{1,2,[11,40]},{2,5,[21,50]},{5,10,[31,60]},{10,20,[41,60]},{30,20,[51,70]},{50,10,[61,80]},{70,5,[71,80]},{100,2,[81,90]},{150,1,[91,100]}]
A1073: 1070 | B1073: 5 | C1073: 7 | D1073: 0 | E1073: =R[-9]C -> 71 | F1073: =R[-9]C -> 80 | G1073: 4 | H1073: 20000 | I1073: 110003 | J1073: 4 | K1073: =R[-1]C -> [{7,3},{8,3},{9,3},{10,3},{11,3},{12,3},{17,10},{18,8},{19,1},{23,4},{24,10}] | L1073: =R[-1]C -> [{7,27},{8,55},{9,27},{10,55},{11,27},{12,55},{17,18},{18,110},{19,3},{23,37},{24,37}] | M1073: =R[-1]C -> [{0,1,[1,30]},{1,2,[11,40]},{2,5,[21,50]},{5,10,[31,60]},{10,20,[41,60]},{30,20,[51,70]},{50,10,[61,80]},{70,5,[71,80]},{100,2,[81,90]},{150,1,[91,100]}]
A1074: 1071 | B1074: 5 | C1074: 7 | D1074: 0 | E1074: =R[-9]C -> 81 | F1074: =R[-9]C -> 90 | G1074: 4 | H1074: 20000 | I1074: 110003 | J1074: 4 | K1074: =R[-1]C -> [{7,3},{8,3},{9,3},{10,3},{11,3},{12,3},{17,10},{18,8},{19,1},{23,4},{24,10}] | L1074: =R[-1]C -> [{7,27},{8,55},{9,27},{10,55},{11,27},{12,55},{17,18},{18,110},{19,3},{23,37},{24,37}] | M1074: =R[-1]C -> [{0,1,[1,30]},{1,2,[11,40]},{2,5,[21,50]},{5,10,[31,60]},{10,20,[41,60]},{30,20,[51,70]},{50,10,[61,80]},{70,5,[71,80]},{100,2,[81,90]},{150,1,[91,100]}]
A1075: 1072 | B1075: 6 | C1075: 7 | D1075: 0 | E1075: =R[-9]C -> 1 | F1075: =R[-9]C -> 10 | G1075: 5 | H1075: 20000 | I1075: 110003 | J1075: 5 | K1075: =R[-1]C -> [{7,3},{8,3},{9,3},{10,3},{11,3},{12,3},{17,10},{18,8},{19,1},{23,4},{24,10}] | L1075: =R[-1]C -> [{7,27},{8,55},{9,27},{10,55},{11,27},{12,55},{17,18},{18,110},{19,3},{23,37},{24,37}] | M1075: =R[-1]C -> [{0,1,[1,30]},{1,2,[11,40]},{2,5,[21,50]},{5,10,[31,60]},{10,20,[41,60]},{30,20,[51,70]},{50,10,[61,80]},{70,5,[71,80]},{100,2,[81,90]},{150,1,[91,100]}]
A1076: 1073 | B1076: 6 | C1076: 7 | D1076: 0 | E1076: =R[-9]C -> 11 | F1076: =R[-9]C -> 20 | G1076: 5 | H1076: 20000 | I1076: 110003 | J1076: 5 | K1076: =R[-1]C -> [{7,3},{8,3},{9,3},{10,3},{11,3},{12,3},{17,10},{18,8},{19,1},{23,4},{24,10}] | L1076: =R[-1]C -> [{7,27},{8,55},{9,27},{10,55},{11,27},{12,55},{17,18},{18,110},{19,3},{23,37},{24,37}] | M1076: =R[-1]C -> [{0,1,[1,30]},{1,2,[11,40]},{2,5,[21,50]},{5,10,[31,60]},{10,20,[41,60]},{30,20,[51,70]},{50,10,[61,80]},{70,5,[71,80]},{100,2,[81,90]},{150,1,[91,100]}]
A1077: 1074 | B1077: 6 | C1077: 7 | D1077: 0 | E1077: =R[-9]C -> 21 | F1077: =R[-9]C -> 30 | G1077: 5 | H1077: 20000 | I1077: 110003 | J1077: 5 | K1077: =R[-1]C -> [{7,3},{8,3},{9,3},{10,3},{11,3},{12,3},{17,10},{18,8},{19,1},{23,4},{24,10}] | L1077: =R[-1]C -> [{7,27},{8,55},{9,27},{10,55},{11,27},{12,55},{17,18},{18,110},{19,3},{23,37},{24,37}] | M1077: =R[-1]C -> [{0,1,[1,30]},{1,2,[11,40]},{2,5,[21,50]},{5,10,[31,60]},{10,20,[41,60]},{30,20,[51,70]},{50,10,[61,80]},{70,5,[71,80]},{100,2,[81,90]},{150,1,[91,100]}]
A1078: 1075 | B1078: 6 | C1078: 7 | D1078: 0 | E1078: =R[-9]C -> 31 | F1078: =R[-9]C -> 40 | G1078: 5 | H1078: 20000 | I1078: 110003 | J1078: 5 | K1078: =R[-1]C -> [{7,3},{8,3},{9,3},{10,3},{11,3},{12,3},{17,10},{18,8},{19,1},{23,4},{24,10}] | L1078: =R[-1]C -> [{7,27},{8,55},{9,27},{10,55},{11,27},{12,55},{17,18},{18,110},{19,3},{23,37},{24,37}] | M1078: =R[-1]C -> [{0,1,[1,30]},{1,2,[11,40]},{2,5,[21,50]},{5,10,[31,60]},{10,20,[41,60]},{30,20,[51,70]},{50,10,[61,80]},{70,5,[71,80]},{100,2,[81,90]},{150,1,[91,100]}]
A1079: 1076 | B1079: 6 | C1079: 7 | D1079: 0 | E1079: =R[-9]C -> 41 | F1079: =R[-9]C -> 50 | G1079: 5 | H1079: 20000 | I1079: 110003 | J1079: 5 | K1079: =R[-1]C -> [{7,3},{8,3},{9,3},{10,3},{11,3},{12,3},{17,10},{18,8},{19,1},{23,4},{24,10}] | L1079: =R[-1]C -> [{7,27},{8,55},{9,27},{10,55},{11,27},{12,55},{17,18},{18,110},{19,3},{23,37},{24,37}] | M1079: =R[-1]C -> [{0,1,[1,30]},{1,2,[11,40]},{2,5,[21,50]},{5,10,[31,60]},{10,20,[41,60]},{30,20,[51,70]},{50,10,[61,80]},{70,5,[71,80]},{100,2,[81,90]},{150,1,[91,100]}]
A1080: 1077 | B1080: 6 | C1080: 7 | D1080: 0 | E1080: =R[-9]C -> 51 | F1080: =R[-9]C -> 60 | G1080: 5 | H1080: 20000 | I1080: 110003 | J1080: 5 | K1080: =R[-1]C -> [{7,3},{8,3},{9,3},{10,3},{11,3},{12,3},{17,10},{18,8},{19,1},{23,4},{24,10}] | L1080: =R[-1]C -> [{7,27},{8,55},{9,27},{10,55},{11,27},{12,55},{17,18},{18,110},{19,3},{23,37},{24,37}] | M1080: =R[-1]C -> [{0,1,[1,30]},{1,2,[11,40]},{2,5,[21,50]},{5,10,[31,60]},{10,20,[41,60]},{30,20,[51,70]},{50,10,[61,80]},{70,5,[71,80]},{100,2,[81,90]},{150,1,[91,100]}]
A1081: 1078 | B1081: 6 | C1081: 7 | D1081: 0 | E1081: =R[-9]C -> 61 | F1081: =R[-9]C -> 70 | G1081: 5 | H1081: 20000 | I1081: 110003 | J1081: 5 | K1081: =R[-1]C -> [{7,3},{8,3},{9,3},{10,3},{11,3},{12,3},{17,10},{18,8},{19,1},{23,4},{24,10}] | L1081: =R[-1]C -> [{7,27},{8,55},{9,27},{10,55},{11,27},{12,55},{17,18},{18,110},{19,3},{23,37},{24,37}] | M1081: =R[-1]C -> [{0,1,[1,30]},{1,2,[11,40]},{2,5,[21,50]},{5,10,[31,60]},{10,20,[41,60]},{30,20,[51,70]},{50,10,[61,80]},{70,5,[71,80]},{100,2,[81,90]},{150,1,[91,100]}]
A1082: 1079 | B1082: 6 | C1082: 7 | D1082: 0 | E1082: =R[-9]C -> 71 | F1082: =R[-9]C -> 80 | G1082: 5 | H1082: 20000 | I1082: 110003 | J1082: 5 | K1082: =R[-1]C -> [{7,3},{8,3},{9,3},{10,3},{11,3},{12,3},{17,10},{18,8},{19,1},{23,4},{24,10}] | L1082: =R[-1]C -> [{7,27},{8,55},{9,27},{10,55},{11,27},{12,55},{17,18},{18,110},{19,3},{23,37},{24,37}] | M1082: =R[-1]C -> [{0,1,[1,30]},{1,2,[11,40]},{2,5,[21,50]},{5,10,[31,60]},{10,20,[41,60]},{30,20,[51,70]},{50,10,[61,80]},{70,5,[71,80]},{100,2,[81,90]},{150,1,[91,100]}]
A1083: 1080 | B1083: 6 | C1083: 7 | D1083: 0 | E1083: =R[-9]C -> 81 | F1083: =R[-9]C -> 90 | G1083: 5 | H1083: 20000 | I1083: 110003 | J1083: 5 | K1083: =R[-1]C -> [{7,3},{8,3},{9,3},{10,3},{11,3},{12,3},{17,10},{18,8},{19,1},{23,4},{24,10}] | L1083: =R[-1]C -> [{7,27},{8,55},{9,27},{10,55},{11,27},{12,55},{17,18},{18,110},{19,3},{23,37},{24,37}] | M1083: =R[-1]C -> [{0,1,[1,30]},{1,2,[11,40]},{2,5,[21,50]},{5,10,[31,60]},{10,20,[41,60]},{30,20,[51,70]},{50,10,[61,80]},{70,5,[71,80]},{100,2,[81,90]},{150,1,[91,100]}]
A1084: 1081 | B1084: 2 | C1084: 2 | D1084: 1000 | E1084: =R[-918]C -> 1 | F1084: =R[-918]C -> 10 | G1084: 1 | H1084: 5000 | I1084: 110003 | J1084: 1 | K1084: [{5,10},{6,15},{13,10},{14,5},{15,10},{16,5},{20,1},{27,10},{28,10}] | L1084: =配置模型!R[-971]C[-1] -> [{5,1113},{6,1113},{13,18},{14,37},{15,18},{16,37},{20,3},{27,18},{28,18}] | M1084: =R[-10]C -> [{0,1,[1,30]},{1,2,[11,40]},{2,5,[21,50]},{5,10,[31,60]},{10,20,[41,60]},{30,20,[51,70]},{50,10,[61,80]},{70,5,[71,80]},{100,2,[81,90]},{150,1,[91,100]}]
A1085: 1082 | B1085: 2 | C1085: 2 | D1085: 1000 | E1085: =R[-918]C -> 11 | F1085: =R[-918]C -> 20 | G1085: 1 | H1085: 5000 | I1085: 110003 | J1085: 1 | K1085: [{5,10},{6,15},{13,10},{14,5},{15,10},{16,5},{20,1},{27,10},{28,10}] | L1085: =R[-1]C -> [{5,1113},{6,1113},{13,18},{14,37},{15,18},{16,37},{20,3},{27,18},{28,18}] | M1085: =R[-1]C -> [{0,1,[1,30]},{1,2,[11,40]},{2,5,[21,50]},{5,10,[31,60]},{10,20,[41,60]},{30,20,[51,70]},{50,10,[61,80]},{70,5,[71,80]},{100,2,[81,90]},{150,1,[91,100]}]
A1086: 1083 | B1086: 2 | C1086: 2 | D1086: 1000 | E1086: =R[-918]C -> 21 | F1086: =R[-918]C -> 30 | G1086: 1 | H1086: 5000 | I1086: 110003 | J1086: 1 | K1086: [{5,10},{6,15},{13,10},{14,5},{15,10},{16,5},{20,1},{27,10},{28,10}] | L1086: =R[-1]C -> [{5,1113},{6,1113},{13,18},{14,37},{15,18},{16,37},{20,3},{27,18},{28,18}] | M1086: =R[-1]C -> [{0,1,[1,30]},{1,2,[11,40]},{2,5,[21,50]},{5,10,[31,60]},{10,20,[41,60]},{30,20,[51,70]},{50,10,[61,80]},{70,5,[71,80]},{100,2,[81,90]},{150,1,[91,100]}]
A1087: 1084 | B1087: 2 | C1087: 2 | D1087: 1000 | E1087: =R[-918]C -> 31 | F1087: =R[-918]C -> 40 | G1087: 1 | H1087: 5000 | I1087: 110003 | J1087: 1 | K1087: [{5,10},{6,15},{13,10},{14,5},{15,10},{16,5},{20,1},{27,10},{28,10}] | L1087: =R[-1]C -> [{5,1113},{6,1113},{13,18},{14,37},{15,18},{16,37},{20,3},{27,18},{28,18}] | M1087: =R[-1]C -> [{0,1,[1,30]},{1,2,[11,40]},{2,5,[21,50]},{5,10,[31,60]},{10,20,[41,60]},{30,20,[51,70]},{50,10,[61,80]},{70,5,[71,80]},{100,2,[81,90]},{150,1,[91,100]}]
A1088: 1085 | B1088: 2 | C1088: 2 | D1088: 1000 | E1088: =R[-918]C -> 41 | F1088: =R[-918]C -> 50 | G1088: 1 | H1088: 5000 | I1088: 110003 | J1088: 1 | K1088: [{5,10},{6,15},{13,10},{14,5},{15,10},{16,5},{20,1},{27,10},{28,10}] | L1088: =R[-1]C -> [{5,1113},{6,1113},{13,18},{14,37},{15,18},{16,37},{20,3},{27,18},{28,18}] | M1088: =R[-1]C -> [{0,1,[1,30]},{1,2,[11,40]},{2,5,[21,50]},{5,10,[31,60]},{10,20,[41,60]},{30,20,[51,70]},{50,10,[61,80]},{70,5,[71,80]},{100,2,[81,90]},{150,1,[91,100]}]
A1089: 1086 | B1089: 2 | C1089: 2 | D1089: 1000 | E1089: =R[-918]C -> 51 | F1089: =R[-918]C -> 60 | G1089: 1 | H1089: 5000 | I1089: 110003 | J1089: 1 | K1089: [{5,10},{6,15},{13,10},{14,5},{15,10},{16,5},{20,1},{27,10},{28,10}] | L1089: =R[-1]C -> [{5,1113},{6,1113},{13,18},{14,37},{15,18},{16,37},{20,3},{27,18},{28,18}] | M1089: =R[-1]C -> [{0,1,[1,30]},{1,2,[11,40]},{2,5,[21,50]},{5,10,[31,60]},{10,20,[41,60]},{30,20,[51,70]},{50,10,[61,80]},{70,5,[71,80]},{100,2,[81,90]},{150,1,[91,100]}]
A1090: 1087 | B1090: 2 | C1090: 2 | D1090: 1000 | E1090: =R[-918]C -> 61 | F1090: =R[-918]C -> 70 | G1090: 1 | H1090: 5000 | I1090: 110003 | J1090: 1 | K1090: [{5,10},{6,15},{13,10},{14,5},{15,10},{16,5},{20,1},{27,10},{28,10}] | L1090: =R[-1]C -> [{5,1113},{6,1113},{13,18},{14,37},{15,18},{16,37},{20,3},{27,18},{28,18}] | M1090: =R[-1]C -> [{0,1,[1,30]},{1,2,[11,40]},{2,5,[21,50]},{5,10,[31,60]},{10,20,[41,60]},{30,20,[51,70]},{50,10,[61,80]},{70,5,[71,80]},{100,2,[81,90]},{150,1,[91,100]}]
A1091: 1088 | B1091: 2 | C1091: 2 | D1091: 1000 | E1091: =R[-918]C -> 71 | F1091: =R[-918]C -> 80 | G1091: 1 | H1091: 5000 | I1091: 110003 | J1091: 1 | K1091: [{5,10},{6,15},{13,10},{14,5},{15,10},{16,5},{20,1},{27,10},{28,10}] | L1091: =R[-1]C -> [{5,1113},{6,1113},{13,18},{14,37},{15,18},{16,37},{20,3},{27,18},{28,18}] | M1091: =R[-1]C -> [{0,1,[1,30]},{1,2,[11,40]},{2,5,[21,50]},{5,10,[31,60]},{10,20,[41,60]},{30,20,[51,70]},{50,10,[61,80]},{70,5,[71,80]},{100,2,[81,90]},{150,1,[91,100]}]
A1092: 1089 | B1092: 2 | C1092: 2 | D1092: 1000 | E1092: =R[-918]C -> 81 | F1092: =R[-918]C -> 90 | G1092: 1 | H1092: 5000 | I1092: 110003 | J1092: 1 | K1092: [{5,10},{6,15},{13,10},{14,5},{15,10},{16,5},{20,1},{27,10},{28,10}] | L1092: =R[-1]C -> [{5,1113},{6,1113},{13,18},{14,37},{15,18},{16,37},{20,3},{27,18},{28,18}] | M1092: =R[-1]C -> [{0,1,[1,30]},{1,2,[11,40]},{2,5,[21,50]},{5,10,[31,60]},{10,20,[41,60]},{30,20,[51,70]},{50,10,[61,80]},{70,5,[71,80]},{100,2,[81,90]},{150,1,[91,100]}]
A1093: 1090 | B1093: 3 | C1093: 2 | D1093: 1000 | E1093: =R[-9]C -> 1 | F1093: =R[-9]C -> 10 | G1093: 2 | H1093: 10000 | I1093: 110003 | J1093: 2 | K1093: [{5,10},{6,15},{13,10},{14,5},{15,10},{16,5},{20,1},{27,10},{28,10}] | L1093: =R[-1]C -> [{5,1113},{6,1113},{13,18},{14,37},{15,18},{16,37},{20,3},{27,18},{28,18}] | M1093: =R[-1]C -> [{0,1,[1,30]},{1,2,[11,40]},{2,5,[21,50]},{5,10,[31,60]},{10,20,[41,60]},{30,20,[51,70]},{50,10,[61,80]},{70,5,[71,80]},{100,2,[81,90]},{150,1,[91,100]}]
A1094: 1091 | B1094: 3 | C1094: 2 | D1094: 1000 | E1094: =R[-9]C -> 11 | F1094: =R[-9]C -> 20 | G1094: 2 | H1094: 10000 | I1094: 110003 | J1094: 2 | K1094: [{5,10},{6,15},{13,10},{14,5},{15,10},{16,5},{20,1},{27,10},{28,10}] | L1094: =R[-1]C -> [{5,1113},{6,1113},{13,18},{14,37},{15,18},{16,37},{20,3},{27,18},{28,18}] | M1094: =R[-1]C -> [{0,1,[1,30]},{1,2,[11,40]},{2,5,[21,50]},{5,10,[31,60]},{10,20,[41,60]},{30,20,[51,70]},{50,10,[61,80]},{70,5,[71,80]},{100,2,[81,90]},{150,1,[91,100]}]
A1095: 1092 | B1095: 3 | C1095: 2 | D1095: 1000 | E1095: =R[-9]C -> 21 | F1095: =R[-9]C -> 30 | G1095: 2 | H1095: 10000 | I1095: 110003 | J1095: 2 | K1095: [{5,10},{6,15},{13,10},{14,5},{15,10},{16,5},{20,1},{27,10},{28,10}] | L1095: =R[-1]C -> [{5,1113},{6,1113},{13,18},{14,37},{15,18},{16,37},{20,3},{27,18},{28,18}] | M1095: =R[-1]C -> [{0,1,[1,30]},{1,2,[11,40]},{2,5,[21,50]},{5,10,[31,60]},{10,20,[41,60]},{30,20,[51,70]},{50,10,[61,80]},{70,5,[71,80]},{100,2,[81,90]},{150,1,[91,100]}]
A1096: 1093 | B1096: 3 | C1096: 2 | D1096: 1000 | E1096: =R[-9]C -> 31 | F1096: =R[-9]C -> 40 | G1096: 2 | H1096: 10000 | I1096: 110003 | J1096: 2 | K1096: [{5,10},{6,15},{13,10},{14,5},{15,10},{16,5},{20,1},{27,10},{28,10}] | L1096: =R[-1]C -> [{5,1113},{6,1113},{13,18},{14,37},{15,18},{16,37},{20,3},{27,18},{28,18}] | M1096: =R[-1]C -> [{0,1,[1,30]},{1,2,[11,40]},{2,5,[21,50]},{5,10,[31,60]},{10,20,[41,60]},{30,20,[51,70]},{50,10,[61,80]},{70,5,[71,80]},{100,2,[81,90]},{150,1,[91,100]}]
A1097: 1094 | B1097: 3 | C1097: 2 | D1097: 1000 | E1097: =R[-9]C -> 41 | F1097: =R[-9]C -> 50 | G1097: 2 | H1097: 10000 | I1097: 110003 | J1097: 2 | K1097: [{5,10},{6,15},{13,10},{14,5},{15,10},{16,5},{20,1},{27,10},{28,10}] | L1097: =R[-1]C -> [{5,1113},{6,1113},{13,18},{14,37},{15,18},{16,37},{20,3},{27,18},{28,18}] | M1097: =R[-1]C -> [{0,1,[1,30]},{1,2,[11,40]},{2,5,[21,50]},{5,10,[31,60]},{10,20,[41,60]},{30,20,[51,70]},{50,10,[61,80]},{70,5,[71,80]},{100,2,[81,90]},{150,1,[91,100]}]
A1098: 1095 | B1098: 3 | C1098: 2 | D1098: 1000 | E1098: =R[-9]C -> 51 | F1098: =R[-9]C -> 60 | G1098: 2 | H1098: 10000 | I1098: 110003 | J1098: 2 | K1098: [{5,10},{6,15},{13,10},{14,5},{15,10},{16,5},{20,1},{27,10},{28,10}] | L1098: =R[-1]C -> [{5,1113},{6,1113},{13,18},{14,37},{15,18},{16,37},{20,3},{27,18},{28,18}] | M1098: =R[-1]C -> [{0,1,[1,30]},{1,2,[11,40]},{2,5,[21,50]},{5,10,[31,60]},{10,20,[41,60]},{30,20,[51,70]},{50,10,[61,80]},{70,5,[71,80]},{100,2,[81,90]},{150,1,[91,100]}]
A1099: 1096 | B1099: 3 | C1099: 2 | D1099: 1000 | E1099: =R[-9]C -> 61 | F1099: =R[-9]C -> 70 | G1099: 2 | H1099: 10000 | I1099: 110003 | J1099: 2 | K1099: [{5,10},{6,15},{13,10},{14,5},{15,10},{16,5},{20,1},{27,10},{28,10}] | L1099: =R[-1]C -> [{5,1113},{6,1113},{13,18},{14,37},{15,18},{16,37},{20,3},{27,18},{28,18}] | M1099: =R[-1]C -> [{0,1,[1,30]},{1,2,[11,40]},{2,5,[21,50]},{5,10,[31,60]},{10,20,[41,60]},{30,20,[51,70]},{50,10,[61,80]},{70,5,[71,80]},{100,2,[81,90]},{150,1,[91,100]}]
A1100: 1097 | B1100: 3 | C1100: 2 | D1100: 1000 | E1100: =R[-9]C -> 71 | F1100: =R[-9]C -> 80 | G1100: 2 | H1100: 10000 | I1100: 110003 | J1100: 2 | K1100: [{5,10},{6,15},{13,10},{14,5},{15,10},{16,5},{20,1},{27,10},{28,10}] | L1100: =R[-1]C -> [{5,1113},{6,1113},{13,18},{14,37},{15,18},{16,37},{20,3},{27,18},{28,18}] | M1100: =R[-1]C -> [{0,1,[1,30]},{1,2,[11,40]},{2,5,[21,50]},{5,10,[31,60]},{10,20,[41,60]},{30,20,[51,70]},{50,10,[61,80]},{70,5,[71,80]},{100,2,[81,90]},{150,1,[91,100]}]
A1101: 1098 | B1101: 3 | C1101: 2 | D1101: 1000 | E1101: =R[-9]C -> 81 | F1101: =R[-9]C -> 90 | G1101: 2 | H1101: 10000 | I1101: 110003 | J1101: 2 | K1101: [{5,10},{6,15},{13,10},{14,5},{15,10},{16,5},{20,1},{27,10},{28,10}] | L1101: =R[-1]C -> [{5,1113},{6,1113},{13,18},{14,37},{15,18},{16,37},{20,3},{27,18},{28,18}] | M1101: =R[-1]C -> [{0,1,[1,30]},{1,2,[11,40]},{2,5,[21,50]},{5,10,[31,60]},{10,20,[41,60]},{30,20,[51,70]},{50,10,[61,80]},{70,5,[71,80]},{100,2,[81,90]},{150,1,[91,100]}]
A1102: 1099 | B1102: 4 | C1102: 2 | D1102: 1000 | E1102: =R[-9]C -> 1 | F1102: =R[-9]C -> 10 | G1102: 3 | H1102: 15000 | I1102: 110003 | J1102: 3 | K1102: [{5,10},{6,15},{13,10},{14,5},{15,10},{16,5},{20,1},{27,10},{28,10}] | L1102: =R[-1]C -> [{5,1113},{6,1113},{13,18},{14,37},{15,18},{16,37},{20,3},{27,18},{28,18}] | M1102: =R[-1]C -> [{0,1,[1,30]},{1,2,[11,40]},{2,5,[21,50]},{5,10,[31,60]},{10,20,[41,60]},{30,20,[51,70]},{50,10,[61,80]},{70,5,[71,80]},{100,2,[81,90]},{150,1,[91,100]}]
A1103: 1100 | B1103: 4 | C1103: 2 | D1103: 1000 | E1103: =R[-9]C -> 11 | F1103: =R[-9]C -> 20 | G1103: 3 | H1103: 15000 | I1103: 110003 | J1103: 3 | K1103: [{5,10},{6,15},{13,10},{14,5},{15,10},{16,5},{20,1},{27,10},{28,10}] | L1103: =R[-1]C -> [{5,1113},{6,1113},{13,18},{14,37},{15,18},{16,37},{20,3},{27,18},{28,18}] | M1103: =R[-1]C -> [{0,1,[1,30]},{1,2,[11,40]},{2,5,[21,50]},{5,10,[31,60]},{10,20,[41,60]},{30,20,[51,70]},{50,10,[61,80]},{70,5,[71,80]},{100,2,[81,90]},{150,1,[91,100]}]
A1104: 1101 | B1104: 4 | C1104: 2 | D1104: 1000 | E1104: =R[-9]C -> 21 | F1104: =R[-9]C -> 30 | G1104: 3 | H1104: 15000 | I1104: 110003 | J1104: 3 | K1104: [{5,10},{6,15},{13,10},{14,5},{15,10},{16,5},{20,1},{27,10},{28,10}] | L1104: =R[-1]C -> [{5,1113},{6,1113},{13,18},{14,37},{15,18},{16,37},{20,3},{27,18},{28,18}] | M1104: =R[-1]C -> [{0,1,[1,30]},{1,2,[11,40]},{2,5,[21,50]},{5,10,[31,60]},{10,20,[41,60]},{30,20,[51,70]},{50,10,[61,80]},{70,5,[71,80]},{100,2,[81,90]},{150,1,[91,100]}]
A1105: 1102 | B1105: 4 | C1105: 2 | D1105: 1000 | E1105: =R[-9]C -> 31 | F1105: =R[-9]C -> 40 | G1105: 3 | H1105: 15000 | I1105: 110003 | J1105: 3 | K1105: [{5,10},{6,15},{13,10},{14,5},{15,10},{16,5},{20,1},{27,10},{28,10}] | L1105: =R[-1]C -> [{5,1113},{6,1113},{13,18},{14,37},{15,18},{16,37},{20,3},{27,18},{28,18}] | M1105: =R[-1]C -> [{0,1,[1,30]},{1,2,[11,40]},{2,5,[21,50]},{5,10,[31,60]},{10,20,[41,60]},{30,20,[51,70]},{50,10,[61,80]},{70,5,[71,80]},{100,2,[81,90]},{150,1,[91,100]}]
A1106: 1103 | B1106: 4 | C1106: 2 | D1106: 1000 | E1106: =R[-9]C -> 41 | F1106: =R[-9]C -> 50 | G1106: 3 | H1106: 15000 | I1106: 110003 | J1106: 3 | K1106: [{5,10},{6,15},{13,10},{14,5},{15,10},{16,5},{20,1},{27,10},{28,10}] | L1106: =R[-1]C -> [{5,1113},{6,1113},{13,18},{14,37},{15,18},{16,37},{20,3},{27,18},{28,18}] | M1106: =R[-1]C -> [{0,1,[1,30]},{1,2,[11,40]},{2,5,[21,50]},{5,10,[31,60]},{10,20,[41,60]},{30,20,[51,70]},{50,10,[61,80]},{70,5,[71,80]},{100,2,[81,90]},{150,1,[91,100]}]
A1107: 1104 | B1107: 4 | C1107: 2 | D1107: 1000 | E1107: =R[-9]C -> 51 | F1107: =R[-9]C -> 60 | G1107: 3 | H1107: 15000 | I1107: 110003 | J1107: 3 | K1107: [{5,10},{6,15},{13,10},{14,5},{15,10},{16,5},{20,1},{27,10},{28,10}] | L1107: =R[-1]C -> [{5,1113},{6,1113},{13,18},{14,37},{15,18},{16,37},{20,3},{27,18},{28,18}] | M1107: =R[-1]C -> [{0,1,[1,30]},{1,2,[11,40]},{2,5,[21,50]},{5,10,[31,60]},{10,20,[41,60]},{30,20,[51,70]},{50,10,[61,80]},{70,5,[71,80]},{100,2,[81,90]},{150,1,[91,100]}]
A1108: 1105 | B1108: 4 | C1108: 2 | D1108: 1000 | E1108: =R[-9]C -> 61 | F1108: =R[-9]C -> 70 | G1108: 3 | H1108: 15000 | I1108: 110003 | J1108: 3 | K1108: [{5,10},{6,15},{13,10},{14,5},{15,10},{16,5},{20,1},{27,10},{28,10}] | L1108: =R[-1]C -> [{5,1113},{6,1113},{13,18},{14,37},{15,18},{16,37},{20,3},{27,18},{28,18}] | M1108: =R[-1]C -> [{0,1,[1,30]},{1,2,[11,40]},{2,5,[21,50]},{5,10,[31,60]},{10,20,[41,60]},{30,20,[51,70]},{50,10,[61,80]},{70,5,[71,80]},{100,2,[81,90]},{150,1,[91,100]}]
A1109: 1106 | B1109: 4 | C1109: 2 | D1109: 1000 | E1109: =R[-9]C -> 71 | F1109: =R[-9]C -> 80 | G1109: 3 | H1109: 15000 | I1109: 110003 | J1109: 3 | K1109: [{5,10},{6,15},{13,10},{14,5},{15,10},{16,5},{20,1},{27,10},{28,10}] | L1109: =R[-1]C -> [{5,1113},{6,1113},{13,18},{14,37},{15,18},{16,37},{20,3},{27,18},{28,18}] | M1109: =R[-1]C -> [{0,1,[1,30]},{1,2,[11,40]},{2,5,[21,50]},{5,10,[31,60]},{10,20,[41,60]},{30,20,[51,70]},{50,10,[61,80]},{70,5,[71,80]},{100,2,[81,90]},{150,1,[91,100]}]
A1110: 1107 | B1110: 4 | C1110: 2 | D1110: 1000 | E1110: =R[-9]C -> 81 | F1110: =R[-9]C -> 90 | G1110: 3 | H1110: 15000 | I1110: 110003 | J1110: 3 | K1110: [{5,10},{6,15},{13,10},{14,5},{15,10},{16,5},{20,1},{27,10},{28,10}] | L1110: =R[-1]C -> [{5,1113},{6,1113},{13,18},{14,37},{15,18},{16,37},{20,3},{27,18},{28,18}] | M1110: =R[-1]C -> [{0,1,[1,30]},{1,2,[11,40]},{2,5,[21,50]},{5,10,[31,60]},{10,20,[41,60]},{30,20,[51,70]},{50,10,[61,80]},{70,5,[71,80]},{100,2,[81,90]},{150,1,[91,100]}]
A1111: 1108 | B1111: 5 | C1111: 2 | D1111: 1000 | E1111: =R[-9]C -> 1 | F1111: =R[-9]C -> 10 | G1111: 4 | H1111: 20000 | I1111: 110003 | J1111: 4 | K1111: [{5,10},{6,15},{13,10},{14,5},{15,10},{16,5},{20,1},{27,10},{28,10}] | L1111: =R[-1]C -> [{5,1113},{6,1113},{13,18},{14,37},{15,18},{16,37},{20,3},{27,18},{28,18}] | M1111: =R[-1]C -> [{0,1,[1,30]},{1,2,[11,40]},{2,5,[21,50]},{5,10,[31,60]},{10,20,[41,60]},{30,20,[51,70]},{50,10,[61,80]},{70,5,[71,80]},{100,2,[81,90]},{150,1,[91,100]}]
A1112: 1109 | B1112: 5 | C1112: 2 | D1112: 1000 | E1112: =R[-9]C -> 11 | F1112: =R[-9]C -> 20 | G1112: 4 | H1112: 20000 | I1112: 110003 | J1112: 4 | K1112: [{5,10},{6,15},{13,10},{14,5},{15,10},{16,5},{20,1},{27,10},{28,10}] | L1112: =R[-1]C -> [{5,1113},{6,1113},{13,18},{14,37},{15,18},{16,37},{20,3},{27,18},{28,18}] | M1112: =R[-1]C -> [{0,1,[1,30]},{1,2,[11,40]},{2,5,[21,50]},{5,10,[31,60]},{10,20,[41,60]},{30,20,[51,70]},{50,10,[61,80]},{70,5,[71,80]},{100,2,[81,90]},{150,1,[91,100]}]
A1113: 1110 | B1113: 5 | C1113: 2 | D1113: 1000 | E1113: =R[-9]C -> 21 | F1113: =R[-9]C -> 30 | G1113: 4 | H1113: 20000 | I1113: 110003 | J1113: 4 | K1113: [{5,10},{6,15},{13,10},{14,5},{15,10},{16,5},{20,1},{27,10},{28,10}] | L1113: =R[-1]C -> [{5,1113},{6,1113},{13,18},{14,37},{15,18},{16,37},{20,3},{27,18},{28,18}] | M1113: =R[-1]C -> [{0,1,[1,30]},{1,2,[11,40]},{2,5,[21,50]},{5,10,[31,60]},{10,20,[41,60]},{30,20,[51,70]},{50,10,[61,80]},{70,5,[71,80]},{100,2,[81,90]},{150,1,[91,100]}]
A1114: 1111 | B1114: 5 | C1114: 2 | D1114: 1000 | E1114: =R[-9]C -> 31 | F1114: =R[-9]C -> 40 | G1114: 4 | H1114: 20000 | I1114: 110003 | J1114: 4 | K1114: [{5,10},{6,15},{13,10},{14,5},{15,10},{16,5},{20,1},{27,10},{28,10}] | L1114: =R[-1]C -> [{5,1113},{6,1113},{13,18},{14,37},{15,18},{16,37},{20,3},{27,18},{28,18}] | M1114: =R[-1]C -> [{0,1,[1,30]},{1,2,[11,40]},{2,5,[21,50]},{5,10,[31,60]},{10,20,[41,60]},{30,20,[51,70]},{50,10,[61,80]},{70,5,[71,80]},{100,2,[81,90]},{150,1,[91,100]}]
A1115: 1112 | B1115: 5 | C1115: 2 | D1115: 1000 | E1115: =R[-9]C -> 41 | F1115: =R[-9]C -> 50 | G1115: 4 | H1115: 20000 | I1115: 110003 | J1115: 4 | K1115: [{5,10},{6,15},{13,10},{14,5},{15,10},{16,5},{20,1},{27,10},{28,10}] | L1115: =R[-1]C -> [{5,1113},{6,1113},{13,18},{14,37},{15,18},{16,37},{20,3},{27,18},{28,18}] | M1115: =R[-1]C -> [{0,1,[1,30]},{1,2,[11,40]},{2,5,[21,50]},{5,10,[31,60]},{10,20,[41,60]},{30,20,[51,70]},{50,10,[61,80]},{70,5,[71,80]},{100,2,[81,90]},{150,1,[91,100]}]
A1116: 1113 | B1116: 5 | C1116: 2 | D1116: 1000 | E1116: =R[-9]C -> 51 | F1116: =R[-9]C -> 60 | G1116: 4 | H1116: 20000 | I1116: 110003 | J1116: 4 | K1116: [{5,10},{6,15},{13,10},{14,5},{15,10},{16,5},{20,1},{27,10},{28,10}] | L1116: =R[-1]C -> [{5,1113},{6,1113},{13,18},{14,37},{15,18},{16,37},{20,3},{27,18},{28,18}] | M1116: =R[-1]C -> [{0,1,[1,30]},{1,2,[11,40]},{2,5,[21,50]},{5,10,[31,60]},{10,20,[41,60]},{30,20,[51,70]},{50,10,[61,80]},{70,5,[71,80]},{100,2,[81,90]},{150,1,[91,100]}]
A1117: 1114 | B1117: 5 | C1117: 2 | D1117: 1000 | E1117: =R[-9]C -> 61 | F1117: =R[-9]C -> 70 | G1117: 4 | H1117: 20000 | I1117: 110003 | J1117: 4 | K1117: [{5,10},{6,15},{13,10},{14,5},{15,10},{16,5},{20,1},{27,10},{28,10}] | L1117: =R[-1]C -> [{5,1113},{6,1113},{13,18},{14,37},{15,18},{16,37},{20,3},{27,18},{28,18}] | M1117: =R[-1]C -> [{0,1,[1,30]},{1,2,[11,40]},{2,5,[21,50]},{5,10,[31,60]},{10,20,[41,60]},{30,20,[51,70]},{50,10,[61,80]},{70,5,[71,80]},{100,2,[81,90]},{150,1,[91,100]}]
A1118: 1115 | B1118: 5 | C1118: 2 | D1118: 1000 | E1118: =R[-9]C -> 71 | F1118: =R[-9]C -> 80 | G1118: 4 | H1118: 20000 | I1118: 110003 | J1118: 4 | K1118: [{5,10},{6,15},{13,10},{14,5},{15,10},{16,5},{20,1},{27,10},{28,10}] | L1118: =R[-1]C -> [{5,1113},{6,1113},{13,18},{14,37},{15,18},{16,37},{20,3},{27,18},{28,18}] | M1118: =R[-1]C -> [{0,1,[1,30]},{1,2,[11,40]},{2,5,[21,50]},{5,10,[31,60]},{10,20,[41,60]},{30,20,[51,70]},{50,10,[61,80]},{70,5,[71,80]},{100,2,[81,90]},{150,1,[91,100]}]
A1119: 1116 | B1119: 5 | C1119: 2 | D1119: 1000 | E1119: =R[-9]C -> 81 | F1119: =R[-9]C -> 90 | G1119: 4 | H1119: 20000 | I1119: 110003 | J1119: 4 | K1119: [{5,10},{6,15},{13,10},{14,5},{15,10},{16,5},{20,1},{27,10},{28,10}] | L1119: =R[-1]C -> [{5,1113},{6,1113},{13,18},{14,37},{15,18},{16,37},{20,3},{27,18},{28,18}] | M1119: =R[-1]C -> [{0,1,[1,30]},{1,2,[11,40]},{2,5,[21,50]},{5,10,[31,60]},{10,20,[41,60]},{30,20,[51,70]},{50,10,[61,80]},{70,5,[71,80]},{100,2,[81,90]},{150,1,[91,100]}]
A1120: 1117 | B1120: 6 | C1120: 2 | D1120: 1000 | E1120: =R[-9]C -> 1 | F1120: =R[-9]C -> 10 | G1120: 5 | H1120: 20000 | I1120: 110003 | J1120: 5 | K1120: [{5,10},{6,15},{13,10},{14,5},{15,10},{16,5},{20,1},{27,10},{28,10}] | L1120: =R[-1]C -> [{5,1113},{6,1113},{13,18},{14,37},{15,18},{16,37},{20,3},{27,18},{28,18}] | M1120: =R[-1]C -> [{0,1,[1,30]},{1,2,[11,40]},{2,5,[21,50]},{5,10,[31,60]},{10,20,[41,60]},{30,20,[51,70]},{50,10,[61,80]},{70,5,[71,80]},{100,2,[81,90]},{150,1,[91,100]}]
A1121: 1118 | B1121: 6 | C1121: 2 | D1121: 1000 | E1121: =R[-9]C -> 11 | F1121: =R[-9]C -> 20 | G1121: 5 | H1121: 20000 | I1121: 110003 | J1121: 5 | K1121: [{5,10},{6,15},{13,10},{14,5},{15,10},{16,5},{20,1},{27,10},{28,10}] | L1121: =R[-1]C -> [{5,1113},{6,1113},{13,18},{14,37},{15,18},{16,37},{20,3},{27,18},{28,18}] | M1121: =R[-1]C -> [{0,1,[1,30]},{1,2,[11,40]},{2,5,[21,50]},{5,10,[31,60]},{10,20,[41,60]},{30,20,[51,70]},{50,10,[61,80]},{70,5,[71,80]},{100,2,[81,90]},{150,1,[91,100]}]
A1122: 1119 | B1122: 6 | C1122: 2 | D1122: 1000 | E1122: =R[-9]C -> 21 | F1122: =R[-9]C -> 30 | G1122: 5 | H1122: 20000 | I1122: 110003 | J1122: 5 | K1122: [{5,10},{6,15},{13,10},{14,5},{15,10},{16,5},{20,1},{27,10},{28,10}] | L1122: =R[-1]C -> [{5,1113},{6,1113},{13,18},{14,37},{15,18},{16,37},{20,3},{27,18},{28,18}] | M1122: =R[-1]C -> [{0,1,[1,30]},{1,2,[11,40]},{2,5,[21,50]},{5,10,[31,60]},{10,20,[41,60]},{30,20,[51,70]},{50,10,[61,80]},{70,5,[71,80]},{100,2,[81,90]},{150,1,[91,100]}]
A1123: 1120 | B1123: 6 | C1123: 2 | D1123: 1000 | E1123: =R[-9]C -> 31 | F1123: =R[-9]C -> 40 | G1123: 5 | H1123: 20000 | I1123: 110003 | J1123: 5 | K1123: [{5,10},{6,15},{13,10},{14,5},{15,10},{16,5},{20,1},{27,10},{28,10}] | L1123: =R[-1]C -> [{5,1113},{6,1113},{13,18},{14,37},{15,18},{16,37},{20,3},{27,18},{28,18}] | M1123: =R[-1]C -> [{0,1,[1,30]},{1,2,[11,40]},{2,5,[21,50]},{5,10,[31,60]},{10,20,[41,60]},{30,20,[51,70]},{50,10,[61,80]},{70,5,[71,80]},{100,2,[81,90]},{150,1,[91,100]}]
A1124: 1121 | B1124: 6 | C1124: 2 | D1124: 1000 | E1124: =R[-9]C -> 41 | F1124: =R[-9]C -> 50 | G1124: 5 | H1124: 20000 | I1124: 110003 | J1124: 5 | K1124: [{5,10},{6,15},{13,10},{14,5},{15,10},{16,5},{20,1},{27,10},{28,10}] | L1124: =R[-1]C -> [{5,1113},{6,1113},{13,18},{14,37},{15,18},{16,37},{20,3},{27,18},{28,18}] | M1124: =R[-1]C -> [{0,1,[1,30]},{1,2,[11,40]},{2,5,[21,50]},{5,10,[31,60]},{10,20,[41,60]},{30,20,[51,70]},{50,10,[61,80]},{70,5,[71,80]},{100,2,[81,90]},{150,1,[91,100]}]
A1125: 1122 | B1125: 6 | C1125: 2 | D1125: 1000 | E1125: =R[-9]C -> 51 | F1125: =R[-9]C -> 60 | G1125: 5 | H1125: 20000 | I1125: 110003 | J1125: 5 | K1125: [{5,10},{6,15},{13,10},{14,5},{15,10},{16,5},{20,1},{27,10},{28,10}] | L1125: =R[-1]C -> [{5,1113},{6,1113},{13,18},{14,37},{15,18},{16,37},{20,3},{27,18},{28,18}] | M1125: =R[-1]C -> [{0,1,[1,30]},{1,2,[11,40]},{2,5,[21,50]},{5,10,[31,60]},{10,20,[41,60]},{30,20,[51,70]},{50,10,[61,80]},{70,5,[71,80]},{100,2,[81,90]},{150,1,[91,100]}]
A1126: 1123 | B1126: 6 | C1126: 2 | D1126: 1000 | E1126: =R[-9]C -> 61 | F1126: =R[-9]C -> 70 | G1126: 5 | H1126: 20000 | I1126: 110003 | J1126: 5 | K1126: [{5,10},{6,15},{13,10},{14,5},{15,10},{16,5},{20,1},{27,10},{28,10}] | L1126: =R[-1]C -> [{5,1113},{6,1113},{13,18},{14,37},{15,18},{16,37},{20,3},{27,18},{28,18}] | M1126: =R[-1]C -> [{0,1,[1,30]},{1,2,[11,40]},{2,5,[21,50]},{5,10,[31,60]},{10,20,[41,60]},{30,20,[51,70]},{50,10,[61,80]},{70,5,[71,80]},{100,2,[81,90]},{150,1,[91,100]}]
A1127: 1124 | B1127: 6 | C1127: 2 | D1127: 1000 | E1127: =R[-9]C -> 71 | F1127: =R[-9]C -> 80 | G1127: 5 | H1127: 20000 | I1127: 110003 | J1127: 5 | K1127: [{5,10},{6,15},{13,10},{14,5},{15,10},{16,5},{20,1},{27,10},{28,10}] | L1127: =R[-1]C -> [{5,1113},{6,1113},{13,18},{14,37},{15,18},{16,37},{20,3},{27,18},{28,18}] | M1127: =R[-1]C -> [{0,1,[1,30]},{1,2,[11,40]},{2,5,[21,50]},{5,10,[31,60]},{10,20,[41,60]},{30,20,[51,70]},{50,10,[61,80]},{70,5,[71,80]},{100,2,[81,90]},{150,1,[91,100]}]
A1128: 1125 | B1128: 6 | C1128: 2 | D1128: 1000 | E1128: =R[-9]C -> 81 | F1128: =R[-9]C -> 90 | G1128: 5 | H1128: 20000 | I1128: 110003 | J1128: 5 | K1128: [{5,10},{6,15},{13,10},{14,5},{15,10},{16,5},{20,1},{27,10},{28,10}] | L1128: =R[-1]C -> [{5,1113},{6,1113},{13,18},{14,37},{15,18},{16,37},{20,3},{27,18},{28,18}] | M1128: =R[-1]C -> [{0,1,[1,30]},{1,2,[11,40]},{2,5,[21,50]},{5,10,[31,60]},{10,20,[41,60]},{30,20,[51,70]},{50,10,[61,80]},{70,5,[71,80]},{100,2,[81,90]},{150,1,[91,100]}]
A1129: 1126 | B1129: 2 | C1129: 3 | D1129: 1000 | E1129: =R[-18]C -> 1 | F1129: =R[-18]C -> 10 | G1129: 1 | H1129: 5000 | I1129: 110003 | J1129: 1 | K1129: [{5,10},{6,15},{13,10},{14,5},{15,10},{16,5},{20,1},{27,10},{28,10}] | L1129: =R[-1]C -> [{5,1113},{6,1113},{13,18},{14,37},{15,18},{16,37},{20,3},{27,18},{28,18}] | M1129: =R[-1]C -> [{0,1,[1,30]},{1,2,[11,40]},{2,5,[21,50]},{5,10,[31,60]},{10,20,[41,60]},{30,20,[51,70]},{50,10,[61,80]},{70,5,[71,80]},{100,2,[81,90]},{150,1,[91,100]}]
A1130: 1127 | B1130: 2 | C1130: 3 | D1130: 1000 | E1130: =R[-18]C -> 11 | F1130: =R[-18]C -> 20 | G1130: 1 | H1130: 5000 | I1130: 110003 | J1130: 1 | K1130: [{5,10},{6,15},{13,10},{14,5},{15,10},{16,5},{20,1},{27,10},{28,10}] | L1130: =R[-1]C -> [{5,1113},{6,1113},{13,18},{14,37},{15,18},{16,37},{20,3},{27,18},{28,18}] | M1130: =R[-1]C -> [{0,1,[1,30]},{1,2,[11,40]},{2,5,[21,50]},{5,10,[31,60]},{10,20,[41,60]},{30,20,[51,70]},{50,10,[61,80]},{70,5,[71,80]},{100,2,[81,90]},{150,1,[91,100]}]
A1131: 1128 | B1131: 2 | C1131: 3 | D1131: 1000 | E1131: =R[-18]C -> 21 | F1131: =R[-18]C -> 30 | G1131: 1 | H1131: 5000 | I1131: 110003 | J1131: 1 | K1131: [{5,10},{6,15},{13,10},{14,5},{15,10},{16,5},{20,1},{27,10},{28,10}] | L1131: =R[-1]C -> [{5,1113},{6,1113},{13,18},{14,37},{15,18},{16,37},{20,3},{27,18},{28,18}] | M1131: =R[-1]C -> [{0,1,[1,30]},{1,2,[11,40]},{2,5,[21,50]},{5,10,[31,60]},{10,20,[41,60]},{30,20,[51,70]},{50,10,[61,80]},{70,5,[71,80]},{100,2,[81,90]},{150,1,[91,100]}]
A1132: 1129 | B1132: 2 | C1132: 3 | D1132: 1000 | E1132: =R[-18]C -> 31 | F1132: =R[-18]C -> 40 | G1132: 1 | H1132: 5000 | I1132: 110003 | J1132: 1 | K1132: [{5,10},{6,15},{13,10},{14,5},{15,10},{16,5},{20,1},{27,10},{28,10}] | L1132: =R[-1]C -> [{5,1113},{6,1113},{13,18},{14,37},{15,18},{16,37},{20,3},{27,18},{28,18}] | M1132: =R[-1]C -> [{0,1,[1,30]},{1,2,[11,40]},{2,5,[21,50]},{5,10,[31,60]},{10,20,[41,60]},{30,20,[51,70]},{50,10,[61,80]},{70,5,[71,80]},{100,2,[81,90]},{150,1,[91,100]}]
A1133: 1130 | B1133: 2 | C1133: 3 | D1133: 1000 | E1133: =R[-18]C -> 41 | F1133: =R[-18]C -> 50 | G1133: 1 | H1133: 5000 | I1133: 110003 | J1133: 1 | K1133: [{5,10},{6,15},{13,10},{14,5},{15,10},{16,5},{20,1},{27,10},{28,10}] | L1133: =R[-1]C -> [{5,1113},{6,1113},{13,18},{14,37},{15,18},{16,37},{20,3},{27,18},{28,18}] | M1133: =R[-1]C -> [{0,1,[1,30]},{1,2,[11,40]},{2,5,[21,50]},{5,10,[31,60]},{10,20,[41,60]},{30,20,[51,70]},{50,10,[61,80]},{70,5,[71,80]},{100,2,[81,90]},{150,1,[91,100]}]
A1134: 1131 | B1134: 2 | C1134: 3 | D1134: 1000 | E1134: =R[-18]C -> 51 | F1134: =R[-18]C -> 60 | G1134: 1 | H1134: 5000 | I1134: 110003 | J1134: 1 | K1134: [{5,10},{6,15},{13,10},{14,5},{15,10},{16,5},{20,1},{27,10},{28,10}] | L1134: =R[-1]C -> [{5,1113},{6,1113},{13,18},{14,37},{15,18},{16,37},{20,3},{27,18},{28,18}] | M1134: =R[-1]C -> [{0,1,[1,30]},{1,2,[11,40]},{2,5,[21,50]},{5,10,[31,60]},{10,20,[41,60]},{30,20,[51,70]},{50,10,[61,80]},{70,5,[71,80]},{100,2,[81,90]},{150,1,[91,100]}]
A1135: 1132 | B1135: 2 | C1135: 3 | D1135: 1000 | E1135: =R[-18]C -> 61 | F1135: =R[-18]C -> 70 | G1135: 1 | H1135: 5000 | I1135: 110003 | J1135: 1 | K1135: [{5,10},{6,15},{13,10},{14,5},{15,10},{16,5},{20,1},{27,10},{28,10}] | L1135: =R[-1]C -> [{5,1113},{6,1113},{13,18},{14,37},{15,18},{16,37},{20,3},{27,18},{28,18}] | M1135: =R[-1]C -> [{0,1,[1,30]},{1,2,[11,40]},{2,5,[21,50]},{5,10,[31,60]},{10,20,[41,60]},{30,20,[51,70]},{50,10,[61,80]},{70,5,[71,80]},{100,2,[81,90]},{150,1,[91,100]}]
A1136: 1133 | B1136: 2 | C1136: 3 | D1136: 1000 | E1136: =R[-18]C -> 71 | F1136: =R[-18]C -> 80 | G1136: 1 | H1136: 5000 | I1136: 110003 | J1136: 1 | K1136: [{5,10},{6,15},{13,10},{14,5},{15,10},{16,5},{20,1},{27,10},{28,10}] | L1136: =R[-1]C -> [{5,1113},{6,1113},{13,18},{14,37},{15,18},{16,37},{20,3},{27,18},{28,18}] | M1136: =R[-1]C -> [{0,1,[1,30]},{1,2,[11,40]},{2,5,[21,50]},{5,10,[31,60]},{10,20,[41,60]},{30,20,[51,70]},{50,10,[61,80]},{70,5,[71,80]},{100,2,[81,90]},{150,1,[91,100]}]
A1137: 1134 | B1137: 2 | C1137: 3 | D1137: 1000 | E1137: =R[-18]C -> 81 | F1137: =R[-18]C -> 90 | G1137: 1 | H1137: 5000 | I1137: 110003 | J1137: 1 | K1137: [{5,10},{6,15},{13,10},{14,5},{15,10},{16,5},{20,1},{27,10},{28,10}] | L1137: =R[-1]C -> [{5,1113},{6,1113},{13,18},{14,37},{15,18},{16,37},{20,3},{27,18},{28,18}] | M1137: =R[-1]C -> [{0,1,[1,30]},{1,2,[11,40]},{2,5,[21,50]},{5,10,[31,60]},{10,20,[41,60]},{30,20,[51,70]},{50,10,[61,80]},{70,5,[71,80]},{100,2,[81,90]},{150,1,[91,100]}]
A1138: 1135 | B1138: 3 | C1138: 3 | D1138: 1000 | E1138: =R[-9]C -> 1 | F1138: =R[-9]C -> 10 | G1138: 2 | H1138: 10000 | I1138: 110003 | J1138: 2 | K1138: [{5,10},{6,15},{13,10},{14,5},{15,10},{16,5},{20,1},{27,10},{28,10}] | L1138: =R[-1]C -> [{5,1113},{6,1113},{13,18},{14,37},{15,18},{16,37},{20,3},{27,18},{28,18}] | M1138: =R[-1]C -> [{0,1,[1,30]},{1,2,[11,40]},{2,5,[21,50]},{5,10,[31,60]},{10,20,[41,60]},{30,20,[51,70]},{50,10,[61,80]},{70,5,[71,80]},{100,2,[81,90]},{150,1,[91,100]}]
A1139: 1136 | B1139: 3 | C1139: 3 | D1139: 1000 | E1139: =R[-9]C -> 11 | F1139: =R[-9]C -> 20 | G1139: 2 | H1139: 10000 | I1139: 110003 | J1139: 2 | K1139: [{5,10},{6,15},{13,10},{14,5},{15,10},{16,5},{20,1},{27,10},{28,10}] | L1139: =R[-1]C -> [{5,1113},{6,1113},{13,18},{14,37},{15,18},{16,37},{20,3},{27,18},{28,18}] | M1139: =R[-1]C -> [{0,1,[1,30]},{1,2,[11,40]},{2,5,[21,50]},{5,10,[31,60]},{10,20,[41,60]},{30,20,[51,70]},{50,10,[61,80]},{70,5,[71,80]},{100,2,[81,90]},{150,1,[91,100]}]
A1140: 1137 | B1140: 3 | C1140: 3 | D1140: 1000 | E1140: =R[-9]C -> 21 | F1140: =R[-9]C -> 30 | G1140: 2 | H1140: 10000 | I1140: 110003 | J1140: 2 | K1140: [{5,10},{6,15},{13,10},{14,5},{15,10},{16,5},{20,1},{27,10},{28,10}] | L1140: =R[-1]C -> [{5,1113},{6,1113},{13,18},{14,37},{15,18},{16,37},{20,3},{27,18},{28,18}] | M1140: =R[-1]C -> [{0,1,[1,30]},{1,2,[11,40]},{2,5,[21,50]},{5,10,[31,60]},{10,20,[41,60]},{30,20,[51,70]},{50,10,[61,80]},{70,5,[71,80]},{100,2,[81,90]},{150,1,[91,100]}]
A1141: 1138 | B1141: 3 | C1141: 3 | D1141: 1000 | E1141: =R[-9]C -> 31 | F1141: =R[-9]C -> 40 | G1141: 2 | H1141: 10000 | I1141: 110003 | J1141: 2 | K1141: [{5,10},{6,15},{13,10},{14,5},{15,10},{16,5},{20,1},{27,10},{28,10}] | L1141: =R[-1]C -> [{5,1113},{6,1113},{13,18},{14,37},{15,18},{16,37},{20,3},{27,18},{28,18}] | M1141: =R[-1]C -> [{0,1,[1,30]},{1,2,[11,40]},{2,5,[21,50]},{5,10,[31,60]},{10,20,[41,60]},{30,20,[51,70]},{50,10,[61,80]},{70,5,[71,80]},{100,2,[81,90]},{150,1,[91,100]}]
A1142: 1139 | B1142: 3 | C1142: 3 | D1142: 1000 | E1142: =R[-9]C -> 41 | F1142: =R[-9]C -> 50 | G1142: 2 | H1142: 10000 | I1142: 110003 | J1142: 2 | K1142: [{5,10},{6,15},{13,10},{14,5},{15,10},{16,5},{20,1},{27,10},{28,10}] | L1142: =R[-1]C -> [{5,1113},{6,1113},{13,18},{14,37},{15,18},{16,37},{20,3},{27,18},{28,18}] | M1142: =R[-1]C -> [{0,1,[1,30]},{1,2,[11,40]},{2,5,[21,50]},{5,10,[31,60]},{10,20,[41,60]},{30,20,[51,70]},{50,10,[61,80]},{70,5,[71,80]},{100,2,[81,90]},{150,1,[91,100]}]
A1143: 1140 | B1143: 3 | C1143: 3 | D1143: 1000 | E1143: =R[-9]C -> 51 | F1143: =R[-9]C -> 60 | G1143: 2 | H1143: 10000 | I1143: 110003 | J1143: 2 | K1143: [{5,10},{6,15},{13,10},{14,5},{15,10},{16,5},{20,1},{27,10},{28,10}] | L1143: =R[-1]C -> [{5,1113},{6,1113},{13,18},{14,37},{15,18},{16,37},{20,3},{27,18},{28,18}] | M1143: =R[-1]C -> [{0,1,[1,30]},{1,2,[11,40]},{2,5,[21,50]},{5,10,[31,60]},{10,20,[41,60]},{30,20,[51,70]},{50,10,[61,80]},{70,5,[71,80]},{100,2,[81,90]},{150,1,[91,100]}]
A1144: 1141 | B1144: 3 | C1144: 3 | D1144: 1000 | E1144: =R[-9]C -> 61 | F1144: =R[-9]C -> 70 | G1144: 2 | H1144: 10000 | I1144: 110003 | J1144: 2 | K1144: [{5,10},{6,15},{13,10},{14,5},{15,10},{16,5},{20,1},{27,10},{28,10}] | L1144: =R[-1]C -> [{5,1113},{6,1113},{13,18},{14,37},{15,18},{16,37},{20,3},{27,18},{28,18}] | M1144: =R[-1]C -> [{0,1,[1,30]},{1,2,[11,40]},{2,5,[21,50]},{5,10,[31,60]},{10,20,[41,60]},{30,20,[51,70]},{50,10,[61,80]},{70,5,[71,80]},{100,2,[81,90]},{150,1,[91,100]}]
A1145: 1142 | B1145: 3 | C1145: 3 | D1145: 1000 | E1145: =R[-9]C -> 71 | F1145: =R[-9]C -> 80 | G1145: 2 | H1145: 10000 | I1145: 110003 | J1145: 2 | K1145: [{5,10},{6,15},{13,10},{14,5},{15,10},{16,5},{20,1},{27,10},{28,10}] | L1145: =R[-1]C -> [{5,1113},{6,1113},{13,18},{14,37},{15,18},{16,37},{20,3},{27,18},{28,18}] | M1145: =R[-1]C -> [{0,1,[1,30]},{1,2,[11,40]},{2,5,[21,50]},{5,10,[31,60]},{10,20,[41,60]},{30,20,[51,70]},{50,10,[61,80]},{70,5,[71,80]},{100,2,[81,90]},{150,1,[91,100]}]
A1146: 1143 | B1146: 3 | C1146: 3 | D1146: 1000 | E1146: =R[-9]C -> 81 | F1146: =R[-9]C -> 90 | G1146: 2 | H1146: 10000 | I1146: 110003 | J1146: 2 | K1146: [{5,10},{6,15},{13,10},{14,5},{15,10},{16,5},{20,1},{27,10},{28,10}] | L1146: =R[-1]C -> [{5,1113},{6,1113},{13,18},{14,37},{15,18},{16,37},{20,3},{27,18},{28,18}] | M1146: =R[-1]C -> [{0,1,[1,30]},{1,2,[11,40]},{2,5,[21,50]},{5,10,[31,60]},{10,20,[41,60]},{30,20,[51,70]},{50,10,[61,80]},{70,5,[71,80]},{100,2,[81,90]},{150,1,[91,100]}]
A1147: 1144 | B1147: 4 | C1147: 3 | D1147: 1000 | E1147: =R[-9]C -> 1 | F1147: =R[-9]C -> 10 | G1147: 3 | H1147: 15000 | I1147: 110003 | J1147: 3 | K1147: [{5,10},{6,15},{13,10},{14,5},{15,10},{16,5},{20,1},{27,10},{28,10}] | L1147: =R[-1]C -> [{5,1113},{6,1113},{13,18},{14,37},{15,18},{16,37},{20,3},{27,18},{28,18}] | M1147: =R[-1]C -> [{0,1,[1,30]},{1,2,[11,40]},{2,5,[21,50]},{5,10,[31,60]},{10,20,[41,60]},{30,20,[51,70]},{50,10,[61,80]},{70,5,[71,80]},{100,2,[81,90]},{150,1,[91,100]}]
A1148: 1145 | B1148: 4 | C1148: 3 | D1148: 1000 | E1148: =R[-9]C -> 11 | F1148: =R[-9]C -> 20 | G1148: 3 | H1148: 15000 | I1148: 110003 | J1148: 3 | K1148: [{5,10},{6,15},{13,10},{14,5},{15,10},{16,5},{20,1},{27,10},{28,10}] | L1148: =R[-1]C -> [{5,1113},{6,1113},{13,18},{14,37},{15,18},{16,37},{20,3},{27,18},{28,18}] | M1148: =R[-1]C -> [{0,1,[1,30]},{1,2,[11,40]},{2,5,[21,50]},{5,10,[31,60]},{10,20,[41,60]},{30,20,[51,70]},{50,10,[61,80]},{70,5,[71,80]},{100,2,[81,90]},{150,1,[91,100]}]
A1149: 1146 | B1149: 4 | C1149: 3 | D1149: 1000 | E1149: =R[-9]C -> 21 | F1149: =R[-9]C -> 30 | G1149: 3 | H1149: 15000 | I1149: 110003 | J1149: 3 | K1149: [{5,10},{6,15},{13,10},{14,5},{15,10},{16,5},{20,1},{27,10},{28,10}] | L1149: =R[-1]C -> [{5,1113},{6,1113},{13,18},{14,37},{15,18},{16,37},{20,3},{27,18},{28,18}] | M1149: =R[-1]C -> [{0,1,[1,30]},{1,2,[11,40]},{2,5,[21,50]},{5,10,[31,60]},{10,20,[41,60]},{30,20,[51,70]},{50,10,[61,80]},{70,5,[71,80]},{100,2,[81,90]},{150,1,[91,100]}]
A1150: 1147 | B1150: 4 | C1150: 3 | D1150: 1000 | E1150: =R[-9]C -> 31 | F1150: =R[-9]C -> 40 | G1150: 3 | H1150: 15000 | I1150: 110003 | J1150: 3 | K1150: [{5,10},{6,15},{13,10},{14,5},{15,10},{16,5},{20,1},{27,10},{28,10}] | L1150: =R[-1]C -> [{5,1113},{6,1113},{13,18},{14,37},{15,18},{16,37},{20,3},{27,18},{28,18}] | M1150: =R[-1]C -> [{0,1,[1,30]},{1,2,[11,40]},{2,5,[21,50]},{5,10,[31,60]},{10,20,[41,60]},{30,20,[51,70]},{50,10,[61,80]},{70,5,[71,80]},{100,2,[81,90]},{150,1,[91,100]}]
A1151: 1148 | B1151: 4 | C1151: 3 | D1151: 1000 | E1151: =R[-9]C -> 41 | F1151: =R[-9]C -> 50 | G1151: 3 | H1151: 15000 | I1151: 110003 | J1151: 3 | K1151: [{5,10},{6,15},{13,10},{14,5},{15,10},{16,5},{20,1},{27,10},{28,10}] | L1151: =R[-1]C -> [{5,1113},{6,1113},{13,18},{14,37},{15,18},{16,37},{20,3},{27,18},{28,18}] | M1151: =R[-1]C -> [{0,1,[1,30]},{1,2,[11,40]},{2,5,[21,50]},{5,10,[31,60]},{10,20,[41,60]},{30,20,[51,70]},{50,10,[61,80]},{70,5,[71,80]},{100,2,[81,90]},{150,1,[91,100]}]
A1152: 1149 | B1152: 4 | C1152: 3 | D1152: 1000 | E1152: =R[-9]C -> 51 | F1152: =R[-9]C -> 60 | G1152: 3 | H1152: 15000 | I1152: 110003 | J1152: 3 | K1152: [{5,10},{6,15},{13,10},{14,5},{15,10},{16,5},{20,1},{27,10},{28,10}] | L1152: =R[-1]C -> [{5,1113},{6,1113},{13,18},{14,37},{15,18},{16,37},{20,3},{27,18},{28,18}] | M1152: =R[-1]C -> [{0,1,[1,30]},{1,2,[11,40]},{2,5,[21,50]},{5,10,[31,60]},{10,20,[41,60]},{30,20,[51,70]},{50,10,[61,80]},{70,5,[71,80]},{100,2,[81,90]},{150,1,[91,100]}]
A1153: 1150 | B1153: 4 | C1153: 3 | D1153: 1000 | E1153: =R[-9]C -> 61 | F1153: =R[-9]C -> 70 | G1153: 3 | H1153: 15000 | I1153: 110003 | J1153: 3 | K1153: [{5,10},{6,15},{13,10},{14,5},{15,10},{16,5},{20,1},{27,10},{28,10}] | L1153: =R[-1]C -> [{5,1113},{6,1113},{13,18},{14,37},{15,18},{16,37},{20,3},{27,18},{28,18}] | M1153: =R[-1]C -> [{0,1,[1,30]},{1,2,[11,40]},{2,5,[21,50]},{5,10,[31,60]},{10,20,[41,60]},{30,20,[51,70]},{50,10,[61,80]},{70,5,[71,80]},{100,2,[81,90]},{150,1,[91,100]}]
A1154: 1151 | B1154: 4 | C1154: 3 | D1154: 1000 | E1154: =R[-9]C -> 71 | F1154: =R[-9]C -> 80 | G1154: 3 | H1154: 15000 | I1154: 110003 | J1154: 3 | K1154: [{5,10},{6,15},{13,10},{14,5},{15,10},{16,5},{20,1},{27,10},{28,10}] | L1154: =R[-1]C -> [{5,1113},{6,1113},{13,18},{14,37},{15,18},{16,37},{20,3},{27,18},{28,18}] | M1154: =R[-1]C -> [{0,1,[1,30]},{1,2,[11,40]},{2,5,[21,50]},{5,10,[31,60]},{10,20,[41,60]},{30,20,[51,70]},{50,10,[61,80]},{70,5,[71,80]},{100,2,[81,90]},{150,1,[91,100]}]
A1155: 1152 | B1155: 4 | C1155: 3 | D1155: 1000 | E1155: =R[-9]C -> 81 | F1155: =R[-9]C -> 90 | G1155: 3 | H1155: 15000 | I1155: 110003 | J1155: 3 | K1155: [{5,10},{6,15},{13,10},{14,5},{15,10},{16,5},{20,1},{27,10},{28,10}] | L1155: =R[-1]C -> [{5,1113},{6,1113},{13,18},{14,37},{15,18},{16,37},{20,3},{27,18},{28,18}] | M1155: =R[-1]C -> [{0,1,[1,30]},{1,2,[11,40]},{2,5,[21,50]},{5,10,[31,60]},{10,20,[41,60]},{30,20,[51,70]},{50,10,[61,80]},{70,5,[71,80]},{100,2,[81,90]},{150,1,[91,100]}]
A1156: 1153 | B1156: 5 | C1156: 3 | D1156: 1000 | E1156: =R[-9]C -> 1 | F1156: =R[-9]C -> 10 | G1156: 4 | H1156: 20000 | I1156: 110003 | J1156: 4 | K1156: [{5,10},{6,15},{13,10},{14,5},{15,10},{16,5},{20,1},{27,10},{28,10}] | L1156: =R[-1]C -> [{5,1113},{6,1113},{13,18},{14,37},{15,18},{16,37},{20,3},{27,18},{28,18}] | M1156: =R[-1]C -> [{0,1,[1,30]},{1,2,[11,40]},{2,5,[21,50]},{5,10,[31,60]},{10,20,[41,60]},{30,20,[51,70]},{50,10,[61,80]},{70,5,[71,80]},{100,2,[81,90]},{150,1,[91,100]}]
A1157: 1154 | B1157: 5 | C1157: 3 | D1157: 1000 | E1157: =R[-9]C -> 11 | F1157: =R[-9]C -> 20 | G1157: 4 | H1157: 20000 | I1157: 110003 | J1157: 4 | K1157: [{5,10},{6,15},{13,10},{14,5},{15,10},{16,5},{20,1},{27,10},{28,10}] | L1157: =R[-1]C -> [{5,1113},{6,1113},{13,18},{14,37},{15,18},{16,37},{20,3},{27,18},{28,18}] | M1157: =R[-1]C -> [{0,1,[1,30]},{1,2,[11,40]},{2,5,[21,50]},{5,10,[31,60]},{10,20,[41,60]},{30,20,[51,70]},{50,10,[61,80]},{70,5,[71,80]},{100,2,[81,90]},{150,1,[91,100]}]
A1158: 1155 | B1158: 5 | C1158: 3 | D1158: 1000 | E1158: =R[-9]C -> 21 | F1158: =R[-9]C -> 30 | G1158: 4 | H1158: 20000 | I1158: 110003 | J1158: 4 | K1158: [{5,10},{6,15},{13,10},{14,5},{15,10},{16,5},{20,1},{27,10},{28,10}] | L1158: =R[-1]C -> [{5,1113},{6,1113},{13,18},{14,37},{15,18},{16,37},{20,3},{27,18},{28,18}] | M1158: =R[-1]C -> [{0,1,[1,30]},{1,2,[11,40]},{2,5,[21,50]},{5,10,[31,60]},{10,20,[41,60]},{30,20,[51,70]},{50,10,[61,80]},{70,5,[71,80]},{100,2,[81,90]},{150,1,[91,100]}]
A1159: 1156 | B1159: 5 | C1159: 3 | D1159: 1000 | E1159: =R[-9]C -> 31 | F1159: =R[-9]C -> 40 | G1159: 4 | H1159: 20000 | I1159: 110003 | J1159: 4 | K1159: [{5,10},{6,15},{13,10},{14,5},{15,10},{16,5},{20,1},{27,10},{28,10}] | L1159: =R[-1]C -> [{5,1113},{6,1113},{13,18},{14,37},{15,18},{16,37},{20,3},{27,18},{28,18}] | M1159: =R[-1]C -> [{0,1,[1,30]},{1,2,[11,40]},{2,5,[21,50]},{5,10,[31,60]},{10,20,[41,60]},{30,20,[51,70]},{50,10,[61,80]},{70,5,[71,80]},{100,2,[81,90]},{150,1,[91,100]}]
A1160: 1157 | B1160: 5 | C1160: 3 | D1160: 1000 | E1160: =R[-9]C -> 41 | F1160: =R[-9]C -> 50 | G1160: 4 | H1160: 20000 | I1160: 110003 | J1160: 4 | K1160: [{5,10},{6,15},{13,10},{14,5},{15,10},{16,5},{20,1},{27,10},{28,10}] | L1160: =R[-1]C -> [{5,1113},{6,1113},{13,18},{14,37},{15,18},{16,37},{20,3},{27,18},{28,18}] | M1160: =R[-1]C -> [{0,1,[1,30]},{1,2,[11,40]},{2,5,[21,50]},{5,10,[31,60]},{10,20,[41,60]},{30,20,[51,70]},{50,10,[61,80]},{70,5,[71,80]},{100,2,[81,90]},{150,1,[91,100]}]
A1161: 1158 | B1161: 5 | C1161: 3 | D1161: 1000 | E1161: =R[-9]C -> 51 | F1161: =R[-9]C -> 60 | G1161: 4 | H1161: 20000 | I1161: 110003 | J1161: 4 | K1161: [{5,10},{6,15},{13,10},{14,5},{15,10},{16,5},{20,1},{27,10},{28,10}] | L1161: =R[-1]C -> [{5,1113},{6,1113},{13,18},{14,37},{15,18},{16,37},{20,3},{27,18},{28,18}] | M1161: =R[-1]C -> [{0,1,[1,30]},{1,2,[11,40]},{2,5,[21,50]},{5,10,[31,60]},{10,20,[41,60]},{30,20,[51,70]},{50,10,[61,80]},{70,5,[71,80]},{100,2,[81,90]},{150,1,[91,100]}]
A1162: 1159 | B1162: 5 | C1162: 3 | D1162: 1000 | E1162: =R[-9]C -> 61 | F1162: =R[-9]C -> 70 | G1162: 4 | H1162: 20000 | I1162: 110003 | J1162: 4 | K1162: [{5,10},{6,15},{13,10},{14,5},{15,10},{16,5},{20,1},{27,10},{28,10}] | L1162: =R[-1]C -> [{5,1113},{6,1113},{13,18},{14,37},{15,18},{16,37},{20,3},{27,18},{28,18}] | M1162: =R[-1]C -> [{0,1,[1,30]},{1,2,[11,40]},{2,5,[21,50]},{5,10,[31,60]},{10,20,[41,60]},{30,20,[51,70]},{50,10,[61,80]},{70,5,[71,80]},{100,2,[81,90]},{150,1,[91,100]}]
A1163: 1160 | B1163: 5 | C1163: 3 | D1163: 1000 | E1163: =R[-9]C -> 71 | F1163: =R[-9]C -> 80 | G1163: 4 | H1163: 20000 | I1163: 110003 | J1163: 4 | K1163: [{5,10},{6,15},{13,10},{14,5},{15,10},{16,5},{20,1},{27,10},{28,10}] | L1163: =R[-1]C -> [{5,1113},{6,1113},{13,18},{14,37},{15,18},{16,37},{20,3},{27,18},{28,18}] | M1163: =R[-1]C -> [{0,1,[1,30]},{1,2,[11,40]},{2,5,[21,50]},{5,10,[31,60]},{10,20,[41,60]},{30,20,[51,70]},{50,10,[61,80]},{70,5,[71,80]},{100,2,[81,90]},{150,1,[91,100]}]
A1164: 1161 | B1164: 5 | C1164: 3 | D1164: 1000 | E1164: =R[-9]C -> 81 | F1164: =R[-9]C -> 90 | G1164: 4 | H1164: 20000 | I1164: 110003 | J1164: 4 | K1164: [{5,10},{6,15},{13,10},{14,5},{15,10},{16,5},{20,1},{27,10},{28,10}] | L1164: =R[-1]C -> [{5,1113},{6,1113},{13,18},{14,37},{15,18},{16,37},{20,3},{27,18},{28,18}] | M1164: =R[-1]C -> [{0,1,[1,30]},{1,2,[11,40]},{2,5,[21,50]},{5,10,[31,60]},{10,20,[41,60]},{30,20,[51,70]},{50,10,[61,80]},{70,5,[71,80]},{100,2,[81,90]},{150,1,[91,100]}]
A1165: 1162 | B1165: 6 | C1165: 3 | D1165: 1000 | E1165: =R[-9]C -> 1 | F1165: =R[-9]C -> 10 | G1165: 5 | H1165: 20000 | I1165: 110003 | J1165: 5 | K1165: [{5,10},{6,15},{13,10},{14,5},{15,10},{16,5},{20,1},{27,10},{28,10}] | L1165: =R[-1]C -> [{5,1113},{6,1113},{13,18},{14,37},{15,18},{16,37},{20,3},{27,18},{28,18}] | M1165: =R[-1]C -> [{0,1,[1,30]},{1,2,[11,40]},{2,5,[21,50]},{5,10,[31,60]},{10,20,[41,60]},{30,20,[51,70]},{50,10,[61,80]},{70,5,[71,80]},{100,2,[81,90]},{150,1,[91,100]}]
A1166: 1163 | B1166: 6 | C1166: 3 | D1166: 1000 | E1166: =R[-9]C -> 11 | F1166: =R[-9]C -> 20 | G1166: 5 | H1166: 20000 | I1166: 110003 | J1166: 5 | K1166: [{5,10},{6,15},{13,10},{14,5},{15,10},{16,5},{20,1},{27,10},{28,10}] | L1166: =R[-1]C -> [{5,1113},{6,1113},{13,18},{14,37},{15,18},{16,37},{20,3},{27,18},{28,18}] | M1166: =R[-1]C -> [{0,1,[1,30]},{1,2,[11,40]},{2,5,[21,50]},{5,10,[31,60]},{10,20,[41,60]},{30,20,[51,70]},{50,10,[61,80]},{70,5,[71,80]},{100,2,[81,90]},{150,1,[91,100]}]
A1167: 1164 | B1167: 6 | C1167: 3 | D1167: 1000 | E1167: =R[-9]C -> 21 | F1167: =R[-9]C -> 30 | G1167: 5 | H1167: 20000 | I1167: 110003 | J1167: 5 | K1167: [{5,10},{6,15},{13,10},{14,5},{15,10},{16,5},{20,1},{27,10},{28,10}] | L1167: =R[-1]C -> [{5,1113},{6,1113},{13,18},{14,37},{15,18},{16,37},{20,3},{27,18},{28,18}] | M1167: =R[-1]C -> [{0,1,[1,30]},{1,2,[11,40]},{2,5,[21,50]},{5,10,[31,60]},{10,20,[41,60]},{30,20,[51,70]},{50,10,[61,80]},{70,5,[71,80]},{100,2,[81,90]},{150,1,[91,100]}]
A1168: 1165 | B1168: 6 | C1168: 3 | D1168: 1000 | E1168: =R[-9]C -> 31 | F1168: =R[-9]C -> 40 | G1168: 5 | H1168: 20000 | I1168: 110003 | J1168: 5 | K1168: [{5,10},{6,15},{13,10},{14,5},{15,10},{16,5},{20,1},{27,10},{28,10}] | L1168: =R[-1]C -> [{5,1113},{6,1113},{13,18},{14,37},{15,18},{16,37},{20,3},{27,18},{28,18}] | M1168: =R[-1]C -> [{0,1,[1,30]},{1,2,[11,40]},{2,5,[21,50]},{5,10,[31,60]},{10,20,[41,60]},{30,20,[51,70]},{50,10,[61,80]},{70,5,[71,80]},{100,2,[81,90]},{150,1,[91,100]}]
A1169: 1166 | B1169: 6 | C1169: 3 | D1169: 1000 | E1169: =R[-9]C -> 41 | F1169: =R[-9]C -> 50 | G1169: 5 | H1169: 20000 | I1169: 110003 | J1169: 5 | K1169: [{5,10},{6,15},{13,10},{14,5},{15,10},{16,5},{20,1},{27,10},{28,10}] | L1169: =R[-1]C -> [{5,1113},{6,1113},{13,18},{14,37},{15,18},{16,37},{20,3},{27,18},{28,18}] | M1169: =R[-1]C -> [{0,1,[1,30]},{1,2,[11,40]},{2,5,[21,50]},{5,10,[31,60]},{10,20,[41,60]},{30,20,[51,70]},{50,10,[61,80]},{70,5,[71,80]},{100,2,[81,90]},{150,1,[91,100]}]
A1170: 1167 | B1170: 6 | C1170: 3 | D1170: 1000 | E1170: =R[-9]C -> 51 | F1170: =R[-9]C -> 60 | G1170: 5 | H1170: 20000 | I1170: 110003 | J1170: 5 | K1170: [{5,10},{6,15},{13,10},{14,5},{15,10},{16,5},{20,1},{27,10},{28,10}] | L1170: =R[-1]C -> [{5,1113},{6,1113},{13,18},{14,37},{15,18},{16,37},{20,3},{27,18},{28,18}] | M1170: =R[-1]C -> [{0,1,[1,30]},{1,2,[11,40]},{2,5,[21,50]},{5,10,[31,60]},{10,20,[41,60]},{30,20,[51,70]},{50,10,[61,80]},{70,5,[71,80]},{100,2,[81,90]},{150,1,[91,100]}]
A1171: 1168 | B1171: 6 | C1171: 3 | D1171: 1000 | E1171: =R[-9]C -> 61 | F1171: =R[-9]C -> 70 | G1171: 5 | H1171: 20000 | I1171: 110003 | J1171: 5 | K1171: [{5,10},{6,15},{13,10},{14,5},{15,10},{16,5},{20,1},{27,10},{28,10}] | L1171: =R[-1]C -> [{5,1113},{6,1113},{13,18},{14,37},{15,18},{16,37},{20,3},{27,18},{28,18}] | M1171: =R[-1]C -> [{0,1,[1,30]},{1,2,[11,40]},{2,5,[21,50]},{5,10,[31,60]},{10,20,[41,60]},{30,20,[51,70]},{50,10,[61,80]},{70,5,[71,80]},{100,2,[81,90]},{150,1,[91,100]}]
A1172: 1169 | B1172: 6 | C1172: 3 | D1172: 1000 | E1172: =R[-9]C -> 71 | F1172: =R[-9]C -> 80 | G1172: 5 | H1172: 20000 | I1172: 110003 | J1172: 5 | K1172: [{5,10},{6,15},{13,10},{14,5},{15,10},{16,5},{20,1},{27,10},{28,10}] | L1172: =R[-1]C -> [{5,1113},{6,1113},{13,18},{14,37},{15,18},{16,37},{20,3},{27,18},{28,18}] | M1172: =R[-1]C -> [{0,1,[1,30]},{1,2,[11,40]},{2,5,[21,50]},{5,10,[31,60]},{10,20,[41,60]},{30,20,[51,70]},{50,10,[61,80]},{70,5,[71,80]},{100,2,[81,90]},{150,1,[91,100]}]
A1173: 1170 | B1173: 6 | C1173: 3 | D1173: 1000 | E1173: =R[-9]C -> 81 | F1173: =R[-9]C -> 90 | G1173: 5 | H1173: 20000 | I1173: 110003 | J1173: 5 | K1173: [{5,10},{6,15},{13,10},{14,5},{15,10},{16,5},{20,1},{27,10},{28,10}] | L1173: =R[-1]C -> [{5,1113},{6,1113},{13,18},{14,37},{15,18},{16,37},{20,3},{27,18},{28,18}] | M1173: =R[-1]C -> [{0,1,[1,30]},{1,2,[11,40]},{2,5,[21,50]},{5,10,[31,60]},{10,20,[41,60]},{30,20,[51,70]},{50,10,[61,80]},{70,5,[71,80]},{100,2,[81,90]},{150,1,[91,100]}]
A1174: 1171 | B1174: 2 | C1174: 8 | D1174: 1000 | E1174: =R[-18]C -> 1 | F1174: =R[-18]C -> 10 | G1174: 1 | H1174: 5000 | I1174: 110003 | J1174: 1 | K1174: [{5,10},{6,15},{13,10},{14,5},{15,10},{16,5},{20,1},{27,10},{28,10}] | L1174: =R[-10]C -> [{5,1113},{6,1113},{13,18},{14,37},{15,18},{16,37},{20,3},{27,18},{28,18}] | M1174: =R[-10]C -> [{0,1,[1,30]},{1,2,[11,40]},{2,5,[21,50]},{5,10,[31,60]},{10,20,[41,60]},{30,20,[51,70]},{50,10,[61,80]},{70,5,[71,80]},{100,2,[81,90]},{150,1,[91,100]}]
A1175: 1172 | B1175: 2 | C1175: 8 | D1175: 1000 | E1175: =R[-18]C -> 11 | F1175: =R[-18]C -> 20 | G1175: 1 | H1175: 5000 | I1175: 110003 | J1175: 1 | K1175: [{5,10},{6,15},{13,10},{14,5},{15,10},{16,5},{20,1},{27,10},{28,10}] | L1175: =R[-1]C -> [{5,1113},{6,1113},{13,18},{14,37},{15,18},{16,37},{20,3},{27,18},{28,18}] | M1175: =R[-1]C -> [{0,1,[1,30]},{1,2,[11,40]},{2,5,[21,50]},{5,10,[31,60]},{10,20,[41,60]},{30,20,[51,70]},{50,10,[61,80]},{70,5,[71,80]},{100,2,[81,90]},{150,1,[91,100]}]
A1176: 1173 | B1176: 2 | C1176: 8 | D1176: 1000 | E1176: =R[-18]C -> 21 | F1176: =R[-18]C -> 30 | G1176: 1 | H1176: 5000 | I1176: 110003 | J1176: 1 | K1176: [{5,10},{6,15},{13,10},{14,5},{15,10},{16,5},{20,1},{27,10},{28,10}] | L1176: =R[-1]C -> [{5,1113},{6,1113},{13,18},{14,37},{15,18},{16,37},{20,3},{27,18},{28,18}] | M1176: =R[-1]C -> [{0,1,[1,30]},{1,2,[11,40]},{2,5,[21,50]},{5,10,[31,60]},{10,20,[41,60]},{30,20,[51,70]},{50,10,[61,80]},{70,5,[71,80]},{100,2,[81,90]},{150,1,[91,100]}]
A1177: 1174 | B1177: 2 | C1177: 8 | D1177: 1000 | E1177: =R[-18]C -> 31 | F1177: =R[-18]C -> 40 | G1177: 1 | H1177: 5000 | I1177: 110003 | J1177: 1 | K1177: [{5,10},{6,15},{13,10},{14,5},{15,10},{16,5},{20,1},{27,10},{28,10}] | L1177: =R[-1]C -> [{5,1113},{6,1113},{13,18},{14,37},{15,18},{16,37},{20,3},{27,18},{28,18}] | M1177: =R[-1]C -> [{0,1,[1,30]},{1,2,[11,40]},{2,5,[21,50]},{5,10,[31,60]},{10,20,[41,60]},{30,20,[51,70]},{50,10,[61,80]},{70,5,[71,80]},{100,2,[81,90]},{150,1,[91,100]}]
A1178: 1175 | B1178: 2 | C1178: 8 | D1178: 1000 | E1178: =R[-18]C -> 41 | F1178: =R[-18]C -> 50 | G1178: 1 | H1178: 5000 | I1178: 110003 | J1178: 1 | K1178: [{5,10},{6,15},{13,10},{14,5},{15,10},{16,5},{20,1},{27,10},{28,10}] | L1178: =R[-1]C -> [{5,1113},{6,1113},{13,18},{14,37},{15,18},{16,37},{20,3},{27,18},{28,18}] | M1178: =R[-1]C -> [{0,1,[1,30]},{1,2,[11,40]},{2,5,[21,50]},{5,10,[31,60]},{10,20,[41,60]},{30,20,[51,70]},{50,10,[61,80]},{70,5,[71,80]},{100,2,[81,90]},{150,1,[91,100]}]
A1179: 1176 | B1179: 2 | C1179: 8 | D1179: 1000 | E1179: =R[-18]C -> 51 | F1179: =R[-18]C -> 60 | G1179: 1 | H1179: 5000 | I1179: 110003 | J1179: 1 | K1179: [{5,10},{6,15},{13,10},{14,5},{15,10},{16,5},{20,1},{27,10},{28,10}] | L1179: =R[-1]C -> [{5,1113},{6,1113},{13,18},{14,37},{15,18},{16,37},{20,3},{27,18},{28,18}] | M1179: =R[-1]C -> [{0,1,[1,30]},{1,2,[11,40]},{2,5,[21,50]},{5,10,[31,60]},{10,20,[41,60]},{30,20,[51,70]},{50,10,[61,80]},{70,5,[71,80]},{100,2,[81,90]},{150,1,[91,100]}]
A1180: 1177 | B1180: 2 | C1180: 8 | D1180: 1000 | E1180: =R[-18]C -> 61 | F1180: =R[-18]C -> 70 | G1180: 1 | H1180: 5000 | I1180: 110003 | J1180: 1 | K1180: [{5,10},{6,15},{13,10},{14,5},{15,10},{16,5},{20,1},{27,10},{28,10}] | L1180: =R[-1]C -> [{5,1113},{6,1113},{13,18},{14,37},{15,18},{16,37},{20,3},{27,18},{28,18}] | M1180: =R[-1]C -> [{0,1,[1,30]},{1,2,[11,40]},{2,5,[21,50]},{5,10,[31,60]},{10,20,[41,60]},{30,20,[51,70]},{50,10,[61,80]},{70,5,[71,80]},{100,2,[81,90]},{150,1,[91,100]}]
A1181: 1178 | B1181: 2 | C1181: 8 | D1181: 1000 | E1181: =R[-18]C -> 71 | F1181: =R[-18]C -> 80 | G1181: 1 | H1181: 5000 | I1181: 110003 | J1181: 1 | K1181: [{5,10},{6,15},{13,10},{14,5},{15,10},{16,5},{20,1},{27,10},{28,10}] | L1181: =R[-1]C -> [{5,1113},{6,1113},{13,18},{14,37},{15,18},{16,37},{20,3},{27,18},{28,18}] | M1181: =R[-1]C -> [{0,1,[1,30]},{1,2,[11,40]},{2,5,[21,50]},{5,10,[31,60]},{10,20,[41,60]},{30,20,[51,70]},{50,10,[61,80]},{70,5,[71,80]},{100,2,[81,90]},{150,1,[91,100]}]
A1182: 1179 | B1182: 2 | C1182: 8 | D1182: 1000 | E1182: =R[-18]C -> 81 | F1182: =R[-18]C -> 90 | G1182: 1 | H1182: 5000 | I1182: 110003 | J1182: 1 | K1182: [{5,10},{6,15},{13,10},{14,5},{15,10},{16,5},{20,1},{27,10},{28,10}] | L1182: =R[-1]C -> [{5,1113},{6,1113},{13,18},{14,37},{15,18},{16,37},{20,3},{27,18},{28,18}] | M1182: =R[-1]C -> [{0,1,[1,30]},{1,2,[11,40]},{2,5,[21,50]},{5,10,[31,60]},{10,20,[41,60]},{30,20,[51,70]},{50,10,[61,80]},{70,5,[71,80]},{100,2,[81,90]},{150,1,[91,100]}]
A1183: 1180 | B1183: 3 | C1183: 8 | D1183: 1000 | E1183: =R[-9]C -> 1 | F1183: =R[-9]C -> 10 | G1183: 2 | H1183: 10000 | I1183: 110003 | J1183: 2 | K1183: [{5,10},{6,15},{13,10},{14,5},{15,10},{16,5},{20,1},{27,10},{28,10}] | L1183: =R[-1]C -> [{5,1113},{6,1113},{13,18},{14,37},{15,18},{16,37},{20,3},{27,18},{28,18}] | M1183: =R[-1]C -> [{0,1,[1,30]},{1,2,[11,40]},{2,5,[21,50]},{5,10,[31,60]},{10,20,[41,60]},{30,20,[51,70]},{50,10,[61,80]},{70,5,[71,80]},{100,2,[81,90]},{150,1,[91,100]}]
A1184: 1181 | B1184: 3 | C1184: 8 | D1184: 1000 | E1184: =R[-9]C -> 11 | F1184: =R[-9]C -> 20 | G1184: 2 | H1184: 10000 | I1184: 110003 | J1184: 2 | K1184: [{5,10},{6,15},{13,10},{14,5},{15,10},{16,5},{20,1},{27,10},{28,10}] | L1184: =R[-1]C -> [{5,1113},{6,1113},{13,18},{14,37},{15,18},{16,37},{20,3},{27,18},{28,18}] | M1184: =R[-1]C -> [{0,1,[1,30]},{1,2,[11,40]},{2,5,[21,50]},{5,10,[31,60]},{10,20,[41,60]},{30,20,[51,70]},{50,10,[61,80]},{70,5,[71,80]},{100,2,[81,90]},{150,1,[91,100]}]
A1185: 1182 | B1185: 3 | C1185: 8 | D1185: 1000 | E1185: =R[-9]C -> 21 | F1185: =R[-9]C -> 30 | G1185: 2 | H1185: 10000 | I1185: 110003 | J1185: 2 | K1185: [{5,10},{6,15},{13,10},{14,5},{15,10},{16,5},{20,1},{27,10},{28,10}] | L1185: =R[-1]C -> [{5,1113},{6,1113},{13,18},{14,37},{15,18},{16,37},{20,3},{27,18},{28,18}] | M1185: =R[-1]C -> [{0,1,[1,30]},{1,2,[11,40]},{2,5,[21,50]},{5,10,[31,60]},{10,20,[41,60]},{30,20,[51,70]},{50,10,[61,80]},{70,5,[71,80]},{100,2,[81,90]},{150,1,[91,100]}]
A1186: 1183 | B1186: 3 | C1186: 8 | D1186: 1000 | E1186: =R[-9]C -> 31 | F1186: =R[-9]C -> 40 | G1186: 2 | H1186: 10000 | I1186: 110003 | J1186: 2 | K1186: [{5,10},{6,15},{13,10},{14,5},{15,10},{16,5},{20,1},{27,10},{28,10}] | L1186: =R[-1]C -> [{5,1113},{6,1113},{13,18},{14,37},{15,18},{16,37},{20,3},{27,18},{28,18}] | M1186: =R[-1]C -> [{0,1,[1,30]},{1,2,[11,40]},{2,5,[21,50]},{5,10,[31,60]},{10,20,[41,60]},{30,20,[51,70]},{50,10,[61,80]},{70,5,[71,80]},{100,2,[81,90]},{150,1,[91,100]}]
A1187: 1184 | B1187: 3 | C1187: 8 | D1187: 1000 | E1187: =R[-9]C -> 41 | F1187: =R[-9]C -> 50 | G1187: 2 | H1187: 10000 | I1187: 110003 | J1187: 2 | K1187: [{5,10},{6,15},{13,10},{14,5},{15,10},{16,5},{20,1},{27,10},{28,10}] | L1187: =R[-1]C -> [{5,1113},{6,1113},{13,18},{14,37},{15,18},{16,37},{20,3},{27,18},{28,18}] | M1187: =R[-1]C -> [{0,1,[1,30]},{1,2,[11,40]},{2,5,[21,50]},{5,10,[31,60]},{10,20,[41,60]},{30,20,[51,70]},{50,10,[61,80]},{70,5,[71,80]},{100,2,[81,90]},{150,1,[91,100]}]
A1188: 1185 | B1188: 3 | C1188: 8 | D1188: 1000 | E1188: =R[-9]C -> 51 | F1188: =R[-9]C -> 60 | G1188: 2 | H1188: 10000 | I1188: 110003 | J1188: 2 | K1188: [{5,10},{6,15},{13,10},{14,5},{15,10},{16,5},{20,1},{27,10},{28,10}] | L1188: =R[-1]C -> [{5,1113},{6,1113},{13,18},{14,37},{15,18},{16,37},{20,3},{27,18},{28,18}] | M1188: =R[-1]C -> [{0,1,[1,30]},{1,2,[11,40]},{2,5,[21,50]},{5,10,[31,60]},{10,20,[41,60]},{30,20,[51,70]},{50,10,[61,80]},{70,5,[71,80]},{100,2,[81,90]},{150,1,[91,100]}]
A1189: 1186 | B1189: 3 | C1189: 8 | D1189: 1000 | E1189: =R[-9]C -> 61 | F1189: =R[-9]C -> 70 | G1189: 2 | H1189: 10000 | I1189: 110003 | J1189: 2 | K1189: [{5,10},{6,15},{13,10},{14,5},{15,10},{16,5},{20,1},{27,10},{28,10}] | L1189: =R[-1]C -> [{5,1113},{6,1113},{13,18},{14,37},{15,18},{16,37},{20,3},{27,18},{28,18}] | M1189: =R[-1]C -> [{0,1,[1,30]},{1,2,[11,40]},{2,5,[21,50]},{5,10,[31,60]},{10,20,[41,60]},{30,20,[51,70]},{50,10,[61,80]},{70,5,[71,80]},{100,2,[81,90]},{150,1,[91,100]}]
A1190: 1187 | B1190: 3 | C1190: 8 | D1190: 1000 | E1190: =R[-9]C -> 71 | F1190: =R[-9]C -> 80 | G1190: 2 | H1190: 10000 | I1190: 110003 | J1190: 2 | K1190: [{5,10},{6,15},{13,10},{14,5},{15,10},{16,5},{20,1},{27,10},{28,10}] | L1190: =R[-1]C -> [{5,1113},{6,1113},{13,18},{14,37},{15,18},{16,37},{20,3},{27,18},{28,18}] | M1190: =R[-1]C -> [{0,1,[1,30]},{1,2,[11,40]},{2,5,[21,50]},{5,10,[31,60]},{10,20,[41,60]},{30,20,[51,70]},{50,10,[61,80]},{70,5,[71,80]},{100,2,[81,90]},{150,1,[91,100]}]
A1191: 1188 | B1191: 3 | C1191: 8 | D1191: 1000 | E1191: =R[-9]C -> 81 | F1191: =R[-9]C -> 90 | G1191: 2 | H1191: 10000 | I1191: 110003 | J1191: 2 | K1191: [{5,10},{6,15},{13,10},{14,5},{15,10},{16,5},{20,1},{27,10},{28,10}] | L1191: =R[-1]C -> [{5,1113},{6,1113},{13,18},{14,37},{15,18},{16,37},{20,3},{27,18},{28,18}] | M1191: =R[-1]C -> [{0,1,[1,30]},{1,2,[11,40]},{2,5,[21,50]},{5,10,[31,60]},{10,20,[41,60]},{30,20,[51,70]},{50,10,[61,80]},{70,5,[71,80]},{100,2,[81,90]},{150,1,[91,100]}]
A1192: 1189 | B1192: 4 | C1192: 8 | D1192: 1000 | E1192: =R[-9]C -> 1 | F1192: =R[-9]C -> 10 | G1192: 3 | H1192: 15000 | I1192: 110003 | J1192: 3 | K1192: [{5,10},{6,15},{13,10},{14,5},{15,10},{16,5},{20,1},{27,10},{28,10}] | L1192: =R[-1]C -> [{5,1113},{6,1113},{13,18},{14,37},{15,18},{16,37},{20,3},{27,18},{28,18}] | M1192: =R[-1]C -> [{0,1,[1,30]},{1,2,[11,40]},{2,5,[21,50]},{5,10,[31,60]},{10,20,[41,60]},{30,20,[51,70]},{50,10,[61,80]},{70,5,[71,80]},{100,2,[81,90]},{150,1,[91,100]}]
A1193: 1190 | B1193: 4 | C1193: 8 | D1193: 1000 | E1193: =R[-9]C -> 11 | F1193: =R[-9]C -> 20 | G1193: 3 | H1193: 15000 | I1193: 110003 | J1193: 3 | K1193: [{5,10},{6,15},{13,10},{14,5},{15,10},{16,5},{20,1},{27,10},{28,10}] | L1193: =R[-1]C -> [{5,1113},{6,1113},{13,18},{14,37},{15,18},{16,37},{20,3},{27,18},{28,18}] | M1193: =R[-1]C -> [{0,1,[1,30]},{1,2,[11,40]},{2,5,[21,50]},{5,10,[31,60]},{10,20,[41,60]},{30,20,[51,70]},{50,10,[61,80]},{70,5,[71,80]},{100,2,[81,90]},{150,1,[91,100]}]
A1194: 1191 | B1194: 4 | C1194: 8 | D1194: 1000 | E1194: =R[-9]C -> 21 | F1194: =R[-9]C -> 30 | G1194: 3 | H1194: 15000 | I1194: 110003 | J1194: 3 | K1194: [{5,10},{6,15},{13,10},{14,5},{15,10},{16,5},{20,1},{27,10},{28,10}] | L1194: =R[-1]C -> [{5,1113},{6,1113},{13,18},{14,37},{15,18},{16,37},{20,3},{27,18},{28,18}] | M1194: =R[-1]C -> [{0,1,[1,30]},{1,2,[11,40]},{2,5,[21,50]},{5,10,[31,60]},{10,20,[41,60]},{30,20,[51,70]},{50,10,[61,80]},{70,5,[71,80]},{100,2,[81,90]},{150,1,[91,100]}]
A1195: 1192 | B1195: 4 | C1195: 8 | D1195: 1000 | E1195: =R[-9]C -> 31 | F1195: =R[-9]C -> 40 | G1195: 3 | H1195: 15000 | I1195: 110003 | J1195: 3 | K1195: [{5,10},{6,15},{13,10},{14,5},{15,10},{16,5},{20,1},{27,10},{28,10}] | L1195: =R[-1]C -> [{5,1113},{6,1113},{13,18},{14,37},{15,18},{16,37},{20,3},{27,18},{28,18}] | M1195: =R[-1]C -> [{0,1,[1,30]},{1,2,[11,40]},{2,5,[21,50]},{5,10,[31,60]},{10,20,[41,60]},{30,20,[51,70]},{50,10,[61,80]},{70,5,[71,80]},{100,2,[81,90]},{150,1,[91,100]}]
A1196: 1193 | B1196: 4 | C1196: 8 | D1196: 1000 | E1196: =R[-9]C -> 41 | F1196: =R[-9]C -> 50 | G1196: 3 | H1196: 15000 | I1196: 110003 | J1196: 3 | K1196: [{5,10},{6,15},{13,10},{14,5},{15,10},{16,5},{20,1},{27,10},{28,10}] | L1196: =R[-1]C -> [{5,1113},{6,1113},{13,18},{14,37},{15,18},{16,37},{20,3},{27,18},{28,18}] | M1196: =R[-1]C -> [{0,1,[1,30]},{1,2,[11,40]},{2,5,[21,50]},{5,10,[31,60]},{10,20,[41,60]},{30,20,[51,70]},{50,10,[61,80]},{70,5,[71,80]},{100,2,[81,90]},{150,1,[91,100]}]
A1197: 1194 | B1197: 4 | C1197: 8 | D1197: 1000 | E1197: =R[-9]C -> 51 | F1197: =R[-9]C -> 60 | G1197: 3 | H1197: 15000 | I1197: 110003 | J1197: 3 | K1197: [{5,10},{6,15},{13,10},{14,5},{15,10},{16,5},{20,1},{27,10},{28,10}] | L1197: =R[-1]C -> [{5,1113},{6,1113},{13,18},{14,37},{15,18},{16,37},{20,3},{27,18},{28,18}] | M1197: =R[-1]C -> [{0,1,[1,30]},{1,2,[11,40]},{2,5,[21,50]},{5,10,[31,60]},{10,20,[41,60]},{30,20,[51,70]},{50,10,[61,80]},{70,5,[71,80]},{100,2,[81,90]},{150,1,[91,100]}]
A1198: 1195 | B1198: 4 | C1198: 8 | D1198: 1000 | E1198: =R[-9]C -> 61 | F1198: =R[-9]C -> 70 | G1198: 3 | H1198: 15000 | I1198: 110003 | J1198: 3 | K1198: [{5,10},{6,15},{13,10},{14,5},{15,10},{16,5},{20,1},{27,10},{28,10}] | L1198: =R[-1]C -> [{5,1113},{6,1113},{13,18},{14,37},{15,18},{16,37},{20,3},{27,18},{28,18}] | M1198: =R[-1]C -> [{0,1,[1,30]},{1,2,[11,40]},{2,5,[21,50]},{5,10,[31,60]},{10,20,[41,60]},{30,20,[51,70]},{50,10,[61,80]},{70,5,[71,80]},{100,2,[81,90]},{150,1,[91,100]}]
A1199: 1196 | B1199: 4 | C1199: 8 | D1199: 1000 | E1199: =R[-9]C -> 71 | F1199: =R[-9]C -> 80 | G1199: 3 | H1199: 15000 | I1199: 110003 | J1199: 3 | K1199: [{5,10},{6,15},{13,10},{14,5},{15,10},{16,5},{20,1},{27,10},{28,10}] | L1199: =R[-1]C -> [{5,1113},{6,1113},{13,18},{14,37},{15,18},{16,37},{20,3},{27,18},{28,18}] | M1199: =R[-1]C -> [{0,1,[1,30]},{1,2,[11,40]},{2,5,[21,50]},{5,10,[31,60]},{10,20,[41,60]},{30,20,[51,70]},{50,10,[61,80]},{70,5,[71,80]},{100,2,[81,90]},{150,1,[91,100]}]
A1200: 1197 | B1200: 4 | C1200: 8 | D1200: 1000 | E1200: =R[-9]C -> 81 | F1200: =R[-9]C -> 90 | G1200: 3 | H1200: 15000 | I1200: 110003 | J1200: 3 | K1200: [{5,10},{6,15},{13,10},{14,5},{15,10},{16,5},{20,1},{27,10},{28,10}] | L1200: =R[-1]C -> [{5,1113},{6,1113},{13,18},{14,37},{15,18},{16,37},{20,3},{27,18},{28,18}] | M1200: =R[-1]C -> [{0,1,[1,30]},{1,2,[11,40]},{2,5,[21,50]},{5,10,[31,60]},{10,20,[41,60]},{30,20,[51,70]},{50,10,[61,80]},{70,5,[71,80]},{100,2,[81,90]},{150,1,[91,100]}]
A1201: 1198 | B1201: 5 | C1201: 8 | D1201: 1000 | E1201: =R[-9]C -> 1 | F1201: =R[-9]C -> 10 | G1201: 4 | H1201: 20000 | I1201: 110003 | J1201: 4 | K1201: [{5,10},{6,15},{13,10},{14,5},{15,10},{16,5},{20,1},{27,10},{28,10}] | L1201: =R[-1]C -> [{5,1113},{6,1113},{13,18},{14,37},{15,18},{16,37},{20,3},{27,18},{28,18}] | M1201: =R[-1]C -> [{0,1,[1,30]},{1,2,[11,40]},{2,5,[21,50]},{5,10,[31,60]},{10,20,[41,60]},{30,20,[51,70]},{50,10,[61,80]},{70,5,[71,80]},{100,2,[81,90]},{150,1,[91,100]}]
A1202: 1199 | B1202: 5 | C1202: 8 | D1202: 1000 | E1202: =R[-9]C -> 11 | F1202: =R[-9]C -> 20 | G1202: 4 | H1202: 20000 | I1202: 110003 | J1202: 4 | K1202: [{5,10},{6,15},{13,10},{14,5},{15,10},{16,5},{20,1},{27,10},{28,10}] | L1202: =R[-1]C -> [{5,1113},{6,1113},{13,18},{14,37},{15,18},{16,37},{20,3},{27,18},{28,18}] | M1202: =R[-1]C -> [{0,1,[1,30]},{1,2,[11,40]},{2,5,[21,50]},{5,10,[31,60]},{10,20,[41,60]},{30,20,[51,70]},{50,10,[61,80]},{70,5,[71,80]},{100,2,[81,90]},{150,1,[91,100]}]
A1203: 1200 | B1203: 5 | C1203: 8 | D1203: 1000 | E1203: =R[-9]C -> 21 | F1203: =R[-9]C -> 30 | G1203: 4 | H1203: 20000 | I1203: 110003 | J1203: 4 | K1203: [{5,10},{6,15},{13,10},{14,5},{15,10},{16,5},{20,1},{27,10},{28,10}] | L1203: =R[-1]C -> [{5,1113},{6,1113},{13,18},{14,37},{15,18},{16,37},{20,3},{27,18},{28,18}] | M1203: =R[-1]C -> [{0,1,[1,30]},{1,2,[11,40]},{2,5,[21,50]},{5,10,[31,60]},{10,20,[41,60]},{30,20,[51,70]},{50,10,[61,80]},{70,5,[71,80]},{100,2,[81,90]},{150,1,[91,100]}]
A1204: 1201 | B1204: 5 | C1204: 8 | D1204: 1000 | E1204: =R[-9]C -> 31 | F1204: =R[-9]C -> 40 | G1204: 4 | H1204: 20000 | I1204: 110003 | J1204: 4 | K1204: [{5,10},{6,15},{13,10},{14,5},{15,10},{16,5},{20,1},{27,10},{28,10}] | L1204: =R[-1]C -> [{5,1113},{6,1113},{13,18},{14,37},{15,18},{16,37},{20,3},{27,18},{28,18}] | M1204: =R[-1]C -> [{0,1,[1,30]},{1,2,[11,40]},{2,5,[21,50]},{5,10,[31,60]},{10,20,[41,60]},{30,20,[51,70]},{50,10,[61,80]},{70,5,[71,80]},{100,2,[81,90]},{150,1,[91,100]}]
A1205: 1202 | B1205: 5 | C1205: 8 | D1205: 1000 | E1205: =R[-9]C -> 41 | F1205: =R[-9]C -> 50 | G1205: 4 | H1205: 20000 | I1205: 110003 | J1205: 4 | K1205: [{5,10},{6,15},{13,10},{14,5},{15,10},{16,5},{20,1},{27,10},{28,10}] | L1205: =R[-1]C -> [{5,1113},{6,1113},{13,18},{14,37},{15,18},{16,37},{20,3},{27,18},{28,18}] | M1205: =R[-1]C -> [{0,1,[1,30]},{1,2,[11,40]},{2,5,[21,50]},{5,10,[31,60]},{10,20,[41,60]},{30,20,[51,70]},{50,10,[61,80]},{70,5,[71,80]},{100,2,[81,90]},{150,1,[91,100]}]
A1206: 1203 | B1206: 5 | C1206: 8 | D1206: 1000 | E1206: =R[-9]C -> 51 | F1206: =R[-9]C -> 60 | G1206: 4 | H1206: 20000 | I1206: 110003 | J1206: 4 | K1206: [{5,10},{6,15},{13,10},{14,5},{15,10},{16,5},{20,1},{27,10},{28,10}] | L1206: =R[-1]C -> [{5,1113},{6,1113},{13,18},{14,37},{15,18},{16,37},{20,3},{27,18},{28,18}] | M1206: =R[-1]C -> [{0,1,[1,30]},{1,2,[11,40]},{2,5,[21,50]},{5,10,[31,60]},{10,20,[41,60]},{30,20,[51,70]},{50,10,[61,80]},{70,5,[71,80]},{100,2,[81,90]},{150,1,[91,100]}]
A1207: 1204 | B1207: 5 | C1207: 8 | D1207: 1000 | E1207: =R[-9]C -> 61 | F1207: =R[-9]C -> 70 | G1207: 4 | H1207: 20000 | I1207: 110003 | J1207: 4 | K1207: [{5,10},{6,15},{13,10},{14,5},{15,10},{16,5},{20,1},{27,10},{28,10}] | L1207: =R[-1]C -> [{5,1113},{6,1113},{13,18},{14,37},{15,18},{16,37},{20,3},{27,18},{28,18}] | M1207: =R[-1]C -> [{0,1,[1,30]},{1,2,[11,40]},{2,5,[21,50]},{5,10,[31,60]},{10,20,[41,60]},{30,20,[51,70]},{50,10,[61,80]},{70,5,[71,80]},{100,2,[81,90]},{150,1,[91,100]}]
A1208: 1205 | B1208: 5 | C1208: 8 | D1208: 1000 | E1208: =R[-9]C -> 71 | F1208: =R[-9]C -> 80 | G1208: 4 | H1208: 20000 | I1208: 110003 | J1208: 4 | K1208: [{5,10},{6,15},{13,10},{14,5},{15,10},{16,5},{20,1},{27,10},{28,10}] | L1208: =R[-1]C -> [{5,1113},{6,1113},{13,18},{14,37},{15,18},{16,37},{20,3},{27,18},{28,18}] | M1208: =R[-1]C -> [{0,1,[1,30]},{1,2,[11,40]},{2,5,[21,50]},{5,10,[31,60]},{10,20,[41,60]},{30,20,[51,70]},{50,10,[61,80]},{70,5,[71,80]},{100,2,[81,90]},{150,1,[91,100]}]
A1209: 1206 | B1209: 5 | C1209: 8 | D1209: 1000 | E1209: =R[-9]C -> 81 | F1209: =R[-9]C -> 90 | G1209: 4 | H1209: 20000 | I1209: 110003 | J1209: 4 | K1209: [{5,10},{6,15},{13,10},{14,5},{15,10},{16,5},{20,1},{27,10},{28,10}] | L1209: =R[-1]C -> [{5,1113},{6,1113},{13,18},{14,37},{15,18},{16,37},{20,3},{27,18},{28,18}] | M1209: =R[-1]C -> [{0,1,[1,30]},{1,2,[11,40]},{2,5,[21,50]},{5,10,[31,60]},{10,20,[41,60]},{30,20,[51,70]},{50,10,[61,80]},{70,5,[71,80]},{100,2,[81,90]},{150,1,[91,100]}]
A1210: 1207 | B1210: 6 | C1210: 8 | D1210: 1000 | E1210: =R[-9]C -> 1 | F1210: =R[-9]C -> 10 | G1210: 5 | H1210: 20000 | I1210: 110003 | J1210: 5 | K1210: [{5,10},{6,15},{13,10},{14,5},{15,10},{16,5},{20,1},{27,10},{28,10}] | L1210: =R[-1]C -> [{5,1113},{6,1113},{13,18},{14,37},{15,18},{16,37},{20,3},{27,18},{28,18}] | M1210: =R[-1]C -> [{0,1,[1,30]},{1,2,[11,40]},{2,5,[21,50]},{5,10,[31,60]},{10,20,[41,60]},{30,20,[51,70]},{50,10,[61,80]},{70,5,[71,80]},{100,2,[81,90]},{150,1,[91,100]}]
A1211: 1208 | B1211: 6 | C1211: 8 | D1211: 1000 | E1211: =R[-9]C -> 11 | F1211: =R[-9]C -> 20 | G1211: 5 | H1211: 20000 | I1211: 110003 | J1211: 5 | K1211: [{5,10},{6,15},{13,10},{14,5},{15,10},{16,5},{20,1},{27,10},{28,10}] | L1211: =R[-1]C -> [{5,1113},{6,1113},{13,18},{14,37},{15,18},{16,37},{20,3},{27,18},{28,18}] | M1211: =R[-1]C -> [{0,1,[1,30]},{1,2,[11,40]},{2,5,[21,50]},{5,10,[31,60]},{10,20,[41,60]},{30,20,[51,70]},{50,10,[61,80]},{70,5,[71,80]},{100,2,[81,90]},{150,1,[91,100]}]
A1212: 1209 | B1212: 6 | C1212: 8 | D1212: 1000 | E1212: =R[-9]C -> 21 | F1212: =R[-9]C -> 30 | G1212: 5 | H1212: 20000 | I1212: 110003 | J1212: 5 | K1212: [{5,10},{6,15},{13,10},{14,5},{15,10},{16,5},{20,1},{27,10},{28,10}] | L1212: =R[-1]C -> [{5,1113},{6,1113},{13,18},{14,37},{15,18},{16,37},{20,3},{27,18},{28,18}] | M1212: =R[-1]C -> [{0,1,[1,30]},{1,2,[11,40]},{2,5,[21,50]},{5,10,[31,60]},{10,20,[41,60]},{30,20,[51,70]},{50,10,[61,80]},{70,5,[71,80]},{100,2,[81,90]},{150,1,[91,100]}]
A1213: 1210 | B1213: 6 | C1213: 8 | D1213: 1000 | E1213: =R[-9]C -> 31 | F1213: =R[-9]C -> 40 | G1213: 5 | H1213: 20000 | I1213: 110003 | J1213: 5 | K1213: [{5,10},{6,15},{13,10},{14,5},{15,10},{16,5},{20,1},{27,10},{28,10}] | L1213: =R[-1]C -> [{5,1113},{6,1113},{13,18},{14,37},{15,18},{16,37},{20,3},{27,18},{28,18}] | M1213: =R[-1]C -> [{0,1,[1,30]},{1,2,[11,40]},{2,5,[21,50]},{5,10,[31,60]},{10,20,[41,60]},{30,20,[51,70]},{50,10,[61,80]},{70,5,[71,80]},{100,2,[81,90]},{150,1,[91,100]}]
A1214: 1211 | B1214: 6 | C1214: 8 | D1214: 1000 | E1214: =R[-9]C -> 41 | F1214: =R[-9]C -> 50 | G1214: 5 | H1214: 20000 | I1214: 110003 | J1214: 5 | K1214: [{5,10},{6,15},{13,10},{14,5},{15,10},{16,5},{20,1},{27,10},{28,10}] | L1214: =R[-1]C -> [{5,1113},{6,1113},{13,18},{14,37},{15,18},{16,37},{20,3},{27,18},{28,18}] | M1214: =R[-1]C -> [{0,1,[1,30]},{1,2,[11,40]},{2,5,[21,50]},{5,10,[31,60]},{10,20,[41,60]},{30,20,[51,70]},{50,10,[61,80]},{70,5,[71,80]},{100,2,[81,90]},{150,1,[91,100]}]
A1215: 1212 | B1215: 6 | C1215: 8 | D1215: 1000 | E1215: =R[-9]C -> 51 | F1215: =R[-9]C -> 60 | G1215: 5 | H1215: 20000 | I1215: 110003 | J1215: 5 | K1215: [{5,10},{6,15},{13,10},{14,5},{15,10},{16,5},{20,1},{27,10},{28,10}] | L1215: =R[-1]C -> [{5,1113},{6,1113},{13,18},{14,37},{15,18},{16,37},{20,3},{27,18},{28,18}] | M1215: =R[-1]C -> [{0,1,[1,30]},{1,2,[11,40]},{2,5,[21,50]},{5,10,[31,60]},{10,20,[41,60]},{30,20,[51,70]},{50,10,[61,80]},{70,5,[71,80]},{100,2,[81,90]},{150,1,[91,100]}]
A1216: 1213 | B1216: 6 | C1216: 8 | D1216: 1000 | E1216: =R[-9]C -> 61 | F1216: =R[-9]C -> 70 | G1216: 5 | H1216: 20000 | I1216: 110003 | J1216: 5 | K1216: [{5,10},{6,15},{13,10},{14,5},{15,10},{16,5},{20,1},{27,10},{28,10}] | L1216: =R[-1]C -> [{5,1113},{6,1113},{13,18},{14,37},{15,18},{16,37},{20,3},{27,18},{28,18}] | M1216: =R[-1]C -> [{0,1,[1,30]},{1,2,[11,40]},{2,5,[21,50]},{5,10,[31,60]},{10,20,[41,60]},{30,20,[51,70]},{50,10,[61,80]},{70,5,[71,80]},{100,2,[81,90]},{150,1,[91,100]}]
A1217: 1214 | B1217: 6 | C1217: 8 | D1217: 1000 | E1217: =R[-9]C -> 71 | F1217: =R[-9]C -> 80 | G1217: 5 | H1217: 20000 | I1217: 110003 | J1217: 5 | K1217: [{5,10},{6,15},{13,10},{14,5},{15,10},{16,5},{20,1},{27,10},{28,10}] | L1217: =R[-1]C -> [{5,1113},{6,1113},{13,18},{14,37},{15,18},{16,37},{20,3},{27,18},{28,18}] | M1217: =R[-1]C -> [{0,1,[1,30]},{1,2,[11,40]},{2,5,[21,50]},{5,10,[31,60]},{10,20,[41,60]},{30,20,[51,70]},{50,10,[61,80]},{70,5,[71,80]},{100,2,[81,90]},{150,1,[91,100]}]
A1218: 1215 | B1218: 6 | C1218: 8 | D1218: 1000 | E1218: =R[-9]C -> 81 | F1218: =R[-9]C -> 90 | G1218: 5 | H1218: 20000 | I1218: 110003 | J1218: 5 | K1218: [{5,10},{6,15},{13,10},{14,5},{15,10},{16,5},{20,1},{27,10},{28,10}] | L1218: =R[-1]C -> [{5,1113},{6,1113},{13,18},{14,37},{15,18},{16,37},{20,3},{27,18},{28,18}] | M1218: =R[-1]C -> [{0,1,[1,30]},{1,2,[11,40]},{2,5,[21,50]},{5,10,[31,60]},{10,20,[41,60]},{30,20,[51,70]},{50,10,[61,80]},{70,5,[71,80]},{100,2,[81,90]},{150,1,[91,100]}]
A1219: 1216 | B1219: 2 | C1219: 10 | D1219: 1000 | E1219: =R[-18]C -> 1 | F1219: =R[-18]C -> 10 | G1219: 1 | H1219: 5000 | I1219: 110003 | J1219: 1 | K1219: [{5,10},{6,15},{13,10},{14,5},{15,10},{16,5},{20,1},{27,10},{28,10}] | L1219: =R[-1]C -> [{5,1113},{6,1113},{13,18},{14,37},{15,18},{16,37},{20,3},{27,18},{28,18}] | M1219: =R[-1]C -> [{0,1,[1,30]},{1,2,[11,40]},{2,5,[21,50]},{5,10,[31,60]},{10,20,[41,60]},{30,20,[51,70]},{50,10,[61,80]},{70,5,[71,80]},{100,2,[81,90]},{150,1,[91,100]}]
A1220: 1217 | B1220: 2 | C1220: 10 | D1220: 1000 | E1220: =R[-18]C -> 11 | F1220: =R[-18]C -> 20 | G1220: 1 | H1220: 5000 | I1220: 110003 | J1220: 1 | K1220: [{5,10},{6,15},{13,10},{14,5},{15,10},{16,5},{20,1},{27,10},{28,10}] | L1220: =R[-1]C -> [{5,1113},{6,1113},{13,18},{14,37},{15,18},{16,37},{20,3},{27,18},{28,18}] | M1220: =R[-1]C -> [{0,1,[1,30]},{1,2,[11,40]},{2,5,[21,50]},{5,10,[31,60]},{10,20,[41,60]},{30,20,[51,70]},{50,10,[61,80]},{70,5,[71,80]},{100,2,[81,90]},{150,1,[91,100]}]
A1221: 1218 | B1221: 2 | C1221: 10 | D1221: 1000 | E1221: =R[-18]C -> 21 | F1221: =R[-18]C -> 30 | G1221: 1 | H1221: 5000 | I1221: 110003 | J1221: 1 | K1221: [{5,10},{6,15},{13,10},{14,5},{15,10},{16,5},{20,1},{27,10},{28,10}] | L1221: =R[-1]C -> [{5,1113},{6,1113},{13,18},{14,37},{15,18},{16,37},{20,3},{27,18},{28,18}] | M1221: =R[-1]C -> [{0,1,[1,30]},{1,2,[11,40]},{2,5,[21,50]},{5,10,[31,60]},{10,20,[41,60]},{30,20,[51,70]},{50,10,[61,80]},{70,5,[71,80]},{100,2,[81,90]},{150,1,[91,100]}]
A1222: 1219 | B1222: 2 | C1222: 10 | D1222: 1000 | E1222: =R[-18]C -> 31 | F1222: =R[-18]C -> 40 | G1222: 1 | H1222: 5000 | I1222: 110003 | J1222: 1 | K1222: [{5,10},{6,15},{13,10},{14,5},{15,10},{16,5},{20,1},{27,10},{28,10}] | L1222: =R[-1]C -> [{5,1113},{6,1113},{13,18},{14,37},{15,18},{16,37},{20,3},{27,18},{28,18}] | M1222: =R[-1]C -> [{0,1,[1,30]},{1,2,[11,40]},{2,5,[21,50]},{5,10,[31,60]},{10,20,[41,60]},{30,20,[51,70]},{50,10,[61,80]},{70,5,[71,80]},{100,2,[81,90]},{150,1,[91,100]}]
A1223: 1220 | B1223: 2 | C1223: 10 | D1223: 1000 | E1223: =R[-18]C -> 41 | F1223: =R[-18]C -> 50 | G1223: 1 | H1223: 5000 | I1223: 110003 | J1223: 1 | K1223: [{5,10},{6,15},{13,10},{14,5},{15,10},{16,5},{20,1},{27,10},{28,10}] | L1223: =R[-1]C -> [{5,1113},{6,1113},{13,18},{14,37},{15,18},{16,37},{20,3},{27,18},{28,18}] | M1223: =R[-1]C -> [{0,1,[1,30]},{1,2,[11,40]},{2,5,[21,50]},{5,10,[31,60]},{10,20,[41,60]},{30,20,[51,70]},{50,10,[61,80]},{70,5,[71,80]},{100,2,[81,90]},{150,1,[91,100]}]
A1224: 1221 | B1224: 2 | C1224: 10 | D1224: 1000 | E1224: =R[-18]C -> 51 | F1224: =R[-18]C -> 60 | G1224: 1 | H1224: 5000 | I1224: 110003 | J1224: 1 | K1224: [{5,10},{6,15},{13,10},{14,5},{15,10},{16,5},{20,1},{27,10},{28,10}] | L1224: =R[-1]C -> [{5,1113},{6,1113},{13,18},{14,37},{15,18},{16,37},{20,3},{27,18},{28,18}] | M1224: =R[-1]C -> [{0,1,[1,30]},{1,2,[11,40]},{2,5,[21,50]},{5,10,[31,60]},{10,20,[41,60]},{30,20,[51,70]},{50,10,[61,80]},{70,5,[71,80]},{100,2,[81,90]},{150,1,[91,100]}]
A1225: 1222 | B1225: 2 | C1225: 10 | D1225: 1000 | E1225: =R[-18]C -> 61 | F1225: =R[-18]C -> 70 | G1225: 1 | H1225: 5000 | I1225: 110003 | J1225: 1 | K1225: [{5,10},{6,15},{13,10},{14,5},{15,10},{16,5},{20,1},{27,10},{28,10}] | L1225: =R[-1]C -> [{5,1113},{6,1113},{13,18},{14,37},{15,18},{16,37},{20,3},{27,18},{28,18}] | M1225: =R[-1]C -> [{0,1,[1,30]},{1,2,[11,40]},{2,5,[21,50]},{5,10,[31,60]},{10,20,[41,60]},{30,20,[51,70]},{50,10,[61,80]},{70,5,[71,80]},{100,2,[81,90]},{150,1,[91,100]}]
A1226: 1223 | B1226: 2 | C1226: 10 | D1226: 1000 | E1226: =R[-18]C -> 71 | F1226: =R[-18]C -> 80 | G1226: 1 | H1226: 5000 | I1226: 110003 | J1226: 1 | K1226: [{5,10},{6,15},{13,10},{14,5},{15,10},{16,5},{20,1},{27,10},{28,10}] | L1226: =R[-1]C -> [{5,1113},{6,1113},{13,18},{14,37},{15,18},{16,37},{20,3},{27,18},{28,18}] | M1226: =R[-1]C -> [{0,1,[1,30]},{1,2,[11,40]},{2,5,[21,50]},{5,10,[31,60]},{10,20,[41,60]},{30,20,[51,70]},{50,10,[61,80]},{70,5,[71,80]},{100,2,[81,90]},{150,1,[91,100]}]
A1227: 1224 | B1227: 2 | C1227: 10 | D1227: 1000 | E1227: =R[-18]C -> 81 | F1227: =R[-18]C -> 90 | G1227: 1 | H1227: 5000 | I1227: 110003 | J1227: 1 | K1227: [{5,10},{6,15},{13,10},{14,5},{15,10},{16,5},{20,1},{27,10},{28,10}] | L1227: =R[-1]C -> [{5,1113},{6,1113},{13,18},{14,37},{15,18},{16,37},{20,3},{27,18},{28,18}] | M1227: =R[-1]C -> [{0,1,[1,30]},{1,2,[11,40]},{2,5,[21,50]},{5,10,[31,60]},{10,20,[41,60]},{30,20,[51,70]},{50,10,[61,80]},{70,5,[71,80]},{100,2,[81,90]},{150,1,[91,100]}]
A1228: 1225 | B1228: 3 | C1228: 10 | D1228: 1000 | E1228: =R[-9]C -> 1 | F1228: =R[-9]C -> 10 | G1228: 2 | H1228: 10000 | I1228: 110003 | J1228: 2 | K1228: [{5,10},{6,15},{13,10},{14,5},{15,10},{16,5},{20,1},{27,10},{28,10}] | L1228: =R[-1]C -> [{5,1113},{6,1113},{13,18},{14,37},{15,18},{16,37},{20,3},{27,18},{28,18}] | M1228: =R[-1]C -> [{0,1,[1,30]},{1,2,[11,40]},{2,5,[21,50]},{5,10,[31,60]},{10,20,[41,60]},{30,20,[51,70]},{50,10,[61,80]},{70,5,[71,80]},{100,2,[81,90]},{150,1,[91,100]}]
A1229: 1226 | B1229: 3 | C1229: 10 | D1229: 1000 | E1229: =R[-9]C -> 11 | F1229: =R[-9]C -> 20 | G1229: 2 | H1229: 10000 | I1229: 110003 | J1229: 2 | K1229: [{5,10},{6,15},{13,10},{14,5},{15,10},{16,5},{20,1},{27,10},{28,10}] | L1229: =R[-1]C -> [{5,1113},{6,1113},{13,18},{14,37},{15,18},{16,37},{20,3},{27,18},{28,18}] | M1229: =R[-1]C -> [{0,1,[1,30]},{1,2,[11,40]},{2,5,[21,50]},{5,10,[31,60]},{10,20,[41,60]},{30,20,[51,70]},{50,10,[61,80]},{70,5,[71,80]},{100,2,[81,90]},{150,1,[91,100]}]
A1230: 1227 | B1230: 3 | C1230: 10 | D1230: 1000 | E1230: =R[-9]C -> 21 | F1230: =R[-9]C -> 30 | G1230: 2 | H1230: 10000 | I1230: 110003 | J1230: 2 | K1230: [{5,10},{6,15},{13,10},{14,5},{15,10},{16,5},{20,1},{27,10},{28,10}] | L1230: =R[-1]C -> [{5,1113},{6,1113},{13,18},{14,37},{15,18},{16,37},{20,3},{27,18},{28,18}] | M1230: =R[-1]C -> [{0,1,[1,30]},{1,2,[11,40]},{2,5,[21,50]},{5,10,[31,60]},{10,20,[41,60]},{30,20,[51,70]},{50,10,[61,80]},{70,5,[71,80]},{100,2,[81,90]},{150,1,[91,100]}]
A1231: 1228 | B1231: 3 | C1231: 10 | D1231: 1000 | E1231: =R[-9]C -> 31 | F1231: =R[-9]C -> 40 | G1231: 2 | H1231: 10000 | I1231: 110003 | J1231: 2 | K1231: [{5,10},{6,15},{13,10},{14,5},{15,10},{16,5},{20,1},{27,10},{28,10}] | L1231: =R[-1]C -> [{5,1113},{6,1113},{13,18},{14,37},{15,18},{16,37},{20,3},{27,18},{28,18}] | M1231: =R[-1]C -> [{0,1,[1,30]},{1,2,[11,40]},{2,5,[21,50]},{5,10,[31,60]},{10,20,[41,60]},{30,20,[51,70]},{50,10,[61,80]},{70,5,[71,80]},{100,2,[81,90]},{150,1,[91,100]}]
A1232: 1229 | B1232: 3 | C1232: 10 | D1232: 1000 | E1232: =R[-9]C -> 41 | F1232: =R[-9]C -> 50 | G1232: 2 | H1232: 10000 | I1232: 110003 | J1232: 2 | K1232: [{5,10},{6,15},{13,10},{14,5},{15,10},{16,5},{20,1},{27,10},{28,10}] | L1232: =R[-1]C -> [{5,1113},{6,1113},{13,18},{14,37},{15,18},{16,37},{20,3},{27,18},{28,18}] | M1232: =R[-1]C -> [{0,1,[1,30]},{1,2,[11,40]},{2,5,[21,50]},{5,10,[31,60]},{10,20,[41,60]},{30,20,[51,70]},{50,10,[61,80]},{70,5,[71,80]},{100,2,[81,90]},{150,1,[91,100]}]
A1233: 1230 | B1233: 3 | C1233: 10 | D1233: 1000 | E1233: =R[-9]C -> 51 | F1233: =R[-9]C -> 60 | G1233: 2 | H1233: 10000 | I1233: 110003 | J1233: 2 | K1233: [{5,10},{6,15},{13,10},{14,5},{15,10},{16,5},{20,1},{27,10},{28,10}] | L1233: =R[-1]C -> [{5,1113},{6,1113},{13,18},{14,37},{15,18},{16,37},{20,3},{27,18},{28,18}] | M1233: =R[-1]C -> [{0,1,[1,30]},{1,2,[11,40]},{2,5,[21,50]},{5,10,[31,60]},{10,20,[41,60]},{30,20,[51,70]},{50,10,[61,80]},{70,5,[71,80]},{100,2,[81,90]},{150,1,[91,100]}]
A1234: 1231 | B1234: 3 | C1234: 10 | D1234: 1000 | E1234: =R[-9]C -> 61 | F1234: =R[-9]C -> 70 | G1234: 2 | H1234: 10000 | I1234: 110003 | J1234: 2 | K1234: [{5,10},{6,15},{13,10},{14,5},{15,10},{16,5},{20,1},{27,10},{28,10}] | L1234: =R[-1]C -> [{5,1113},{6,1113},{13,18},{14,37},{15,18},{16,37},{20,3},{27,18},{28,18}] | M1234: =R[-1]C -> [{0,1,[1,30]},{1,2,[11,40]},{2,5,[21,50]},{5,10,[31,60]},{10,20,[41,60]},{30,20,[51,70]},{50,10,[61,80]},{70,5,[71,80]},{100,2,[81,90]},{150,1,[91,100]}]
A1235: 1232 | B1235: 3 | C1235: 10 | D1235: 1000 | E1235: =R[-9]C -> 71 | F1235: =R[-9]C -> 80 | G1235: 2 | H1235: 10000 | I1235: 110003 | J1235: 2 | K1235: [{5,10},{6,15},{13,10},{14,5},{15,10},{16,5},{20,1},{27,10},{28,10}] | L1235: =R[-1]C -> [{5,1113},{6,1113},{13,18},{14,37},{15,18},{16,37},{20,3},{27,18},{28,18}] | M1235: =R[-1]C -> [{0,1,[1,30]},{1,2,[11,40]},{2,5,[21,50]},{5,10,[31,60]},{10,20,[41,60]},{30,20,[51,70]},{50,10,[61,80]},{70,5,[71,80]},{100,2,[81,90]},{150,1,[91,100]}]
A1236: 1233 | B1236: 3 | C1236: 10 | D1236: 1000 | E1236: =R[-9]C -> 81 | F1236: =R[-9]C -> 90 | G1236: 2 | H1236: 10000 | I1236: 110003 | J1236: 2 | K1236: [{5,10},{6,15},{13,10},{14,5},{15,10},{16,5},{20,1},{27,10},{28,10}] | L1236: =R[-1]C -> [{5,1113},{6,1113},{13,18},{14,37},{15,18},{16,37},{20,3},{27,18},{28,18}] | M1236: =R[-1]C -> [{0,1,[1,30]},{1,2,[11,40]},{2,5,[21,50]},{5,10,[31,60]},{10,20,[41,60]},{30,20,[51,70]},{50,10,[61,80]},{70,5,[71,80]},{100,2,[81,90]},{150,1,[91,100]}]
A1237: 1234 | B1237: 4 | C1237: 10 | D1237: 1000 | E1237: =R[-9]C -> 1 | F1237: =R[-9]C -> 10 | G1237: 3 | H1237: 15000 | I1237: 110003 | J1237: 3 | K1237: [{5,10},{6,15},{13,10},{14,5},{15,10},{16,5},{20,1},{27,10},{28,10}] | L1237: =R[-1]C -> [{5,1113},{6,1113},{13,18},{14,37},{15,18},{16,37},{20,3},{27,18},{28,18}] | M1237: =R[-1]C -> [{0,1,[1,30]},{1,2,[11,40]},{2,5,[21,50]},{5,10,[31,60]},{10,20,[41,60]},{30,20,[51,70]},{50,10,[61,80]},{70,5,[71,80]},{100,2,[81,90]},{150,1,[91,100]}]
A1238: 1235 | B1238: 4 | C1238: 10 | D1238: 1000 | E1238: =R[-9]C -> 11 | F1238: =R[-9]C -> 20 | G1238: 3 | H1238: 15000 | I1238: 110003 | J1238: 3 | K1238: [{5,10},{6,15},{13,10},{14,5},{15,10},{16,5},{20,1},{27,10},{28,10}] | L1238: =R[-1]C -> [{5,1113},{6,1113},{13,18},{14,37},{15,18},{16,37},{20,3},{27,18},{28,18}] | M1238: =R[-1]C -> [{0,1,[1,30]},{1,2,[11,40]},{2,5,[21,50]},{5,10,[31,60]},{10,20,[41,60]},{30,20,[51,70]},{50,10,[61,80]},{70,5,[71,80]},{100,2,[81,90]},{150,1,[91,100]}]
A1239: 1236 | B1239: 4 | C1239: 10 | D1239: 1000 | E1239: =R[-9]C -> 21 | F1239: =R[-9]C -> 30 | G1239: 3 | H1239: 15000 | I1239: 110003 | J1239: 3 | K1239: [{5,10},{6,15},{13,10},{14,5},{15,10},{16,5},{20,1},{27,10},{28,10}] | L1239: =R[-1]C -> [{5,1113},{6,1113},{13,18},{14,37},{15,18},{16,37},{20,3},{27,18},{28,18}] | M1239: =R[-1]C -> [{0,1,[1,30]},{1,2,[11,40]},{2,5,[21,50]},{5,10,[31,60]},{10,20,[41,60]},{30,20,[51,70]},{50,10,[61,80]},{70,5,[71,80]},{100,2,[81,90]},{150,1,[91,100]}]
A1240: 1237 | B1240: 4 | C1240: 10 | D1240: 1000 | E1240: =R[-9]C -> 31 | F1240: =R[-9]C -> 40 | G1240: 3 | H1240: 15000 | I1240: 110003 | J1240: 3 | K1240: [{5,10},{6,15},{13,10},{14,5},{15,10},{16,5},{20,1},{27,10},{28,10}] | L1240: =R[-1]C -> [{5,1113},{6,1113},{13,18},{14,37},{15,18},{16,37},{20,3},{27,18},{28,18}] | M1240: =R[-1]C -> [{0,1,[1,30]},{1,2,[11,40]},{2,5,[21,50]},{5,10,[31,60]},{10,20,[41,60]},{30,20,[51,70]},{50,10,[61,80]},{70,5,[71,80]},{100,2,[81,90]},{150,1,[91,100]}]
A1241: 1238 | B1241: 4 | C1241: 10 | D1241: 1000 | E1241: =R[-9]C -> 41 | F1241: =R[-9]C -> 50 | G1241: 3 | H1241: 15000 | I1241: 110003 | J1241: 3 | K1241: [{5,10},{6,15},{13,10},{14,5},{15,10},{16,5},{20,1},{27,10},{28,10}] | L1241: =R[-1]C -> [{5,1113},{6,1113},{13,18},{14,37},{15,18},{16,37},{20,3},{27,18},{28,18}] | M1241: =R[-1]C -> [{0,1,[1,30]},{1,2,[11,40]},{2,5,[21,50]},{5,10,[31,60]},{10,20,[41,60]},{30,20,[51,70]},{50,10,[61,80]},{70,5,[71,80]},{100,2,[81,90]},{150,1,[91,100]}]
A1242: 1239 | B1242: 4 | C1242: 10 | D1242: 1000 | E1242: =R[-9]C -> 51 | F1242: =R[-9]C -> 60 | G1242: 3 | H1242: 15000 | I1242: 110003 | J1242: 3 | K1242: [{5,10},{6,15},{13,10},{14,5},{15,10},{16,5},{20,1},{27,10},{28,10}] | L1242: =R[-1]C -> [{5,1113},{6,1113},{13,18},{14,37},{15,18},{16,37},{20,3},{27,18},{28,18}] | M1242: =R[-1]C -> [{0,1,[1,30]},{1,2,[11,40]},{2,5,[21,50]},{5,10,[31,60]},{10,20,[41,60]},{30,20,[51,70]},{50,10,[61,80]},{70,5,[71,80]},{100,2,[81,90]},{150,1,[91,100]}]
A1243: 1240 | B1243: 4 | C1243: 10 | D1243: 1000 | E1243: =R[-9]C -> 61 | F1243: =R[-9]C -> 70 | G1243: 3 | H1243: 15000 | I1243: 110003 | J1243: 3 | K1243: [{5,10},{6,15},{13,10},{14,5},{15,10},{16,5},{20,1},{27,10},{28,10}] | L1243: =R[-1]C -> [{5,1113},{6,1113},{13,18},{14,37},{15,18},{16,37},{20,3},{27,18},{28,18}] | M1243: =R[-1]C -> [{0,1,[1,30]},{1,2,[11,40]},{2,5,[21,50]},{5,10,[31,60]},{10,20,[41,60]},{30,20,[51,70]},{50,10,[61,80]},{70,5,[71,80]},{100,2,[81,90]},{150,1,[91,100]}]
A1244: 1241 | B1244: 4 | C1244: 10 | D1244: 1000 | E1244: =R[-9]C -> 71 | F1244: =R[-9]C -> 80 | G1244: 3 | H1244: 15000 | I1244: 110003 | J1244: 3 | K1244: [{5,10},{6,15},{13,10},{14,5},{15,10},{16,5},{20,1},{27,10},{28,10}] | L1244: =R[-1]C -> [{5,1113},{6,1113},{13,18},{14,37},{15,18},{16,37},{20,3},{27,18},{28,18}] | M1244: =R[-1]C -> [{0,1,[1,30]},{1,2,[11,40]},{2,5,[21,50]},{5,10,[31,60]},{10,20,[41,60]},{30,20,[51,70]},{50,10,[61,80]},{70,5,[71,80]},{100,2,[81,90]},{150,1,[91,100]}]
A1245: 1242 | B1245: 4 | C1245: 10 | D1245: 1000 | E1245: =R[-9]C -> 81 | F1245: =R[-9]C -> 90 | G1245: 3 | H1245: 15000 | I1245: 110003 | J1245: 3 | K1245: [{5,10},{6,15},{13,10},{14,5},{15,10},{16,5},{20,1},{27,10},{28,10}] | L1245: =R[-1]C -> [{5,1113},{6,1113},{13,18},{14,37},{15,18},{16,37},{20,3},{27,18},{28,18}] | M1245: =R[-1]C -> [{0,1,[1,30]},{1,2,[11,40]},{2,5,[21,50]},{5,10,[31,60]},{10,20,[41,60]},{30,20,[51,70]},{50,10,[61,80]},{70,5,[71,80]},{100,2,[81,90]},{150,1,[91,100]}]
A1246: 1243 | B1246: 5 | C1246: 10 | D1246: 1000 | E1246: =R[-9]C -> 1 | F1246: =R[-9]C -> 10 | G1246: 4 | H1246: 20000 | I1246: 110003 | J1246: 4 | K1246: [{5,10},{6,15},{13,10},{14,5},{15,10},{16,5},{20,1},{27,10},{28,10}] | L1246: =R[-1]C -> [{5,1113},{6,1113},{13,18},{14,37},{15,18},{16,37},{20,3},{27,18},{28,18}] | M1246: =R[-1]C -> [{0,1,[1,30]},{1,2,[11,40]},{2,5,[21,50]},{5,10,[31,60]},{10,20,[41,60]},{30,20,[51,70]},{50,10,[61,80]},{70,5,[71,80]},{100,2,[81,90]},{150,1,[91,100]}]
A1247: 1244 | B1247: 5 | C1247: 10 | D1247: 1000 | E1247: =R[-9]C -> 11 | F1247: =R[-9]C -> 20 | G1247: 4 | H1247: 20000 | I1247: 110003 | J1247: 4 | K1247: [{5,10},{6,15},{13,10},{14,5},{15,10},{16,5},{20,1},{27,10},{28,10}] | L1247: =R[-1]C -> [{5,1113},{6,1113},{13,18},{14,37},{15,18},{16,37},{20,3},{27,18},{28,18}] | M1247: =R[-1]C -> [{0,1,[1,30]},{1,2,[11,40]},{2,5,[21,50]},{5,10,[31,60]},{10,20,[41,60]},{30,20,[51,70]},{50,10,[61,80]},{70,5,[71,80]},{100,2,[81,90]},{150,1,[91,100]}]
A1248: 1245 | B1248: 5 | C1248: 10 | D1248: 1000 | E1248: =R[-9]C -> 21 | F1248: =R[-9]C -> 30 | G1248: 4 | H1248: 20000 | I1248: 110003 | J1248: 4 | K1248: [{5,10},{6,15},{13,10},{14,5},{15,10},{16,5},{20,1},{27,10},{28,10}] | L1248: =R[-1]C -> [{5,1113},{6,1113},{13,18},{14,37},{15,18},{16,37},{20,3},{27,18},{28,18}] | M1248: =R[-1]C -> [{0,1,[1,30]},{1,2,[11,40]},{2,5,[21,50]},{5,10,[31,60]},{10,20,[41,60]},{30,20,[51,70]},{50,10,[61,80]},{70,5,[71,80]},{100,2,[81,90]},{150,1,[91,100]}]
A1249: 1246 | B1249: 5 | C1249: 10 | D1249: 1000 | E1249: =R[-9]C -> 31 | F1249: =R[-9]C -> 40 | G1249: 4 | H1249: 20000 | I1249: 110003 | J1249: 4 | K1249: [{5,10},{6,15},{13,10},{14,5},{15,10},{16,5},{20,1},{27,10},{28,10}] | L1249: =R[-1]C -> [{5,1113},{6,1113},{13,18},{14,37},{15,18},{16,37},{20,3},{27,18},{28,18}] | M1249: =R[-1]C -> [{0,1,[1,30]},{1,2,[11,40]},{2,5,[21,50]},{5,10,[31,60]},{10,20,[41,60]},{30,20,[51,70]},{50,10,[61,80]},{70,5,[71,80]},{100,2,[81,90]},{150,1,[91,100]}]
A1250: 1247 | B1250: 5 | C1250: 10 | D1250: 1000 | E1250: =R[-9]C -> 41 | F1250: =R[-9]C -> 50 | G1250: 4 | H1250: 20000 | I1250: 110003 | J1250: 4 | K1250: [{5,10},{6,15},{13,10},{14,5},{15,10},{16,5},{20,1},{27,10},{28,10}] | L1250: =R[-1]C -> [{5,1113},{6,1113},{13,18},{14,37},{15,18},{16,37},{20,3},{27,18},{28,18}] | M1250: =R[-1]C -> [{0,1,[1,30]},{1,2,[11,40]},{2,5,[21,50]},{5,10,[31,60]},{10,20,[41,60]},{30,20,[51,70]},{50,10,[61,80]},{70,5,[71,80]},{100,2,[81,90]},{150,1,[91,100]}]
A1251: 1248 | B1251: 5 | C1251: 10 | D1251: 1000 | E1251: =R[-9]C -> 51 | F1251: =R[-9]C -> 60 | G1251: 4 | H1251: 20000 | I1251: 110003 | J1251: 4 | K1251: [{5,10},{6,15},{13,10},{14,5},{15,10},{16,5},{20,1},{27,10},{28,10}] | L1251: =R[-1]C -> [{5,1113},{6,1113},{13,18},{14,37},{15,18},{16,37},{20,3},{27,18},{28,18}] | M1251: =R[-1]C -> [{0,1,[1,30]},{1,2,[11,40]},{2,5,[21,50]},{5,10,[31,60]},{10,20,[41,60]},{30,20,[51,70]},{50,10,[61,80]},{70,5,[71,80]},{100,2,[81,90]},{150,1,[91,100]}]
A1252: 1249 | B1252: 5 | C1252: 10 | D1252: 1000 | E1252: =R[-9]C -> 61 | F1252: =R[-9]C -> 70 | G1252: 4 | H1252: 20000 | I1252: 110003 | J1252: 4 | K1252: [{5,10},{6,15},{13,10},{14,5},{15,10},{16,5},{20,1},{27,10},{28,10}] | L1252: =R[-1]C -> [{5,1113},{6,1113},{13,18},{14,37},{15,18},{16,37},{20,3},{27,18},{28,18}] | M1252: =R[-1]C -> [{0,1,[1,30]},{1,2,[11,40]},{2,5,[21,50]},{5,10,[31,60]},{10,20,[41,60]},{30,20,[51,70]},{50,10,[61,80]},{70,5,[71,80]},{100,2,[81,90]},{150,1,[91,100]}]
A1253: 1250 | B1253: 5 | C1253: 10 | D1253: 1000 | E1253: =R[-9]C -> 71 | F1253: =R[-9]C -> 80 | G1253: 4 | H1253: 20000 | I1253: 110003 | J1253: 4 | K1253: [{5,10},{6,15},{13,10},{14,5},{15,10},{16,5},{20,1},{27,10},{28,10}] | L1253: =R[-1]C -> [{5,1113},{6,1113},{13,18},{14,37},{15,18},{16,37},{20,3},{27,18},{28,18}] | M1253: =R[-1]C -> [{0,1,[1,30]},{1,2,[11,40]},{2,5,[21,50]},{5,10,[31,60]},{10,20,[41,60]},{30,20,[51,70]},{50,10,[61,80]},{70,5,[71,80]},{100,2,[81,90]},{150,1,[91,100]}]
A1254: 1251 | B1254: 5 | C1254: 10 | D1254: 1000 | E1254: =R[-9]C -> 81 | F1254: =R[-9]C -> 90 | G1254: 4 | H1254: 20000 | I1254: 110003 | J1254: 4 | K1254: [{5,10},{6,15},{13,10},{14,5},{15,10},{16,5},{20,1},{27,10},{28,10}] | L1254: =R[-1]C -> [{5,1113},{6,1113},{13,18},{14,37},{15,18},{16,37},{20,3},{27,18},{28,18}] | M1254: =R[-1]C -> [{0,1,[1,30]},{1,2,[11,40]},{2,5,[21,50]},{5,10,[31,60]},{10,20,[41,60]},{30,20,[51,70]},{50,10,[61,80]},{70,5,[71,80]},{100,2,[81,90]},{150,1,[91,100]}]
A1255: 1252 | B1255: 6 | C1255: 10 | D1255: 1000 | E1255: =R[-9]C -> 1 | F1255: =R[-9]C -> 10 | G1255: 5 | H1255: 20000 | I1255: 110003 | J1255: 5 | K1255: [{5,10},{6,15},{13,10},{14,5},{15,10},{16,5},{20,1},{27,10},{28,10}] | L1255: =R[-1]C -> [{5,1113},{6,1113},{13,18},{14,37},{15,18},{16,37},{20,3},{27,18},{28,18}] | M1255: =R[-1]C -> [{0,1,[1,30]},{1,2,[11,40]},{2,5,[21,50]},{5,10,[31,60]},{10,20,[41,60]},{30,20,[51,70]},{50,10,[61,80]},{70,5,[71,80]},{100,2,[81,90]},{150,1,[91,100]}]
A1256: 1253 | B1256: 6 | C1256: 10 | D1256: 1000 | E1256: =R[-9]C -> 11 | F1256: =R[-9]C -> 20 | G1256: 5 | H1256: 20000 | I1256: 110003 | J1256: 5 | K1256: [{5,10},{6,15},{13,10},{14,5},{15,10},{16,5},{20,1},{27,10},{28,10}] | L1256: =R[-1]C -> [{5,1113},{6,1113},{13,18},{14,37},{15,18},{16,37},{20,3},{27,18},{28,18}] | M1256: =R[-1]C -> [{0,1,[1,30]},{1,2,[11,40]},{2,5,[21,50]},{5,10,[31,60]},{10,20,[41,60]},{30,20,[51,70]},{50,10,[61,80]},{70,5,[71,80]},{100,2,[81,90]},{150,1,[91,100]}]
A1257: 1254 | B1257: 6 | C1257: 10 | D1257: 1000 | E1257: =R[-9]C -> 21 | F1257: =R[-9]C -> 30 | G1257: 5 | H1257: 20000 | I1257: 110003 | J1257: 5 | K1257: [{5,10},{6,15},{13,10},{14,5},{15,10},{16,5},{20,1},{27,10},{28,10}] | L1257: =R[-1]C -> [{5,1113},{6,1113},{13,18},{14,37},{15,18},{16,37},{20,3},{27,18},{28,18}] | M1257: =R[-1]C -> [{0,1,[1,30]},{1,2,[11,40]},{2,5,[21,50]},{5,10,[31,60]},{10,20,[41,60]},{30,20,[51,70]},{50,10,[61,80]},{70,5,[71,80]},{100,2,[81,90]},{150,1,[91,100]}]
A1258: 1255 | B1258: 6 | C1258: 10 | D1258: 1000 | E1258: =R[-9]C -> 31 | F1258: =R[-9]C -> 40 | G1258: 5 | H1258: 20000 | I1258: 110003 | J1258: 5 | K1258: [{5,10},{6,15},{13,10},{14,5},{15,10},{16,5},{20,1},{27,10},{28,10}] | L1258: =R[-1]C -> [{5,1113},{6,1113},{13,18},{14,37},{15,18},{16,37},{20,3},{27,18},{28,18}] | M1258: =R[-1]C -> [{0,1,[1,30]},{1,2,[11,40]},{2,5,[21,50]},{5,10,[31,60]},{10,20,[41,60]},{30,20,[51,70]},{50,10,[61,80]},{70,5,[71,80]},{100,2,[81,90]},{150,1,[91,100]}]
A1259: 1256 | B1259: 6 | C1259: 10 | D1259: 1000 | E1259: =R[-9]C -> 41 | F1259: =R[-9]C -> 50 | G1259: 5 | H1259: 20000 | I1259: 110003 | J1259: 5 | K1259: [{5,10},{6,15},{13,10},{14,5},{15,10},{16,5},{20,1},{27,10},{28,10}] | L1259: =R[-1]C -> [{5,1113},{6,1113},{13,18},{14,37},{15,18},{16,37},{20,3},{27,18},{28,18}] | M1259: =R[-1]C -> [{0,1,[1,30]},{1,2,[11,40]},{2,5,[21,50]},{5,10,[31,60]},{10,20,[41,60]},{30,20,[51,70]},{50,10,[61,80]},{70,5,[71,80]},{100,2,[81,90]},{150,1,[91,100]}]
A1260: 1257 | B1260: 6 | C1260: 10 | D1260: 1000 | E1260: =R[-9]C -> 51 | F1260: =R[-9]C -> 60 | G1260: 5 | H1260: 20000 | I1260: 110003 | J1260: 5 | K1260: [{5,10},{6,15},{13,10},{14,5},{15,10},{16,5},{20,1},{27,10},{28,10}] | L1260: =R[-1]C -> [{5,1113},{6,1113},{13,18},{14,37},{15,18},{16,37},{20,3},{27,18},{28,18}] | M1260: =R[-1]C -> [{0,1,[1,30]},{1,2,[11,40]},{2,5,[21,50]},{5,10,[31,60]},{10,20,[41,60]},{30,20,[51,70]},{50,10,[61,80]},{70,5,[71,80]},{100,2,[81,90]},{150,1,[91,100]}]
A1261: 1258 | B1261: 6 | C1261: 10 | D1261: 1000 | E1261: =R[-9]C -> 61 | F1261: =R[-9]C -> 70 | G1261: 5 | H1261: 20000 | I1261: 110003 | J1261: 5 | K1261: [{5,10},{6,15},{13,10},{14,5},{15,10},{16,5},{20,1},{27,10},{28,10}] | L1261: =R[-1]C -> [{5,1113},{6,1113},{13,18},{14,37},{15,18},{16,37},{20,3},{27,18},{28,18}] | M1261: =R[-1]C -> [{0,1,[1,30]},{1,2,[11,40]},{2,5,[21,50]},{5,10,[31,60]},{10,20,[41,60]},{30,20,[51,70]},{50,10,[61,80]},{70,5,[71,80]},{100,2,[81,90]},{150,1,[91,100]}]
A1262: 1259 | B1262: 6 | C1262: 10 | D1262: 1000 | E1262: =R[-9]C -> 71 | F1262: =R[-9]C -> 80 | G1262: 5 | H1262: 20000 | I1262: 110003 | J1262: 5 | K1262: [{5,10},{6,15},{13,10},{14,5},{15,10},{16,5},{20,1},{27,10},{28,10}] | L1262: =R[-1]C -> [{5,1113},{6,1113},{13,18},{14,37},{15,18},{16,37},{20,3},{27,18},{28,18}] | M1262: =R[-1]C -> [{0,1,[1,30]},{1,2,[11,40]},{2,5,[21,50]},{5,10,[31,60]},{10,20,[41,60]},{30,20,[51,70]},{50,10,[61,80]},{70,5,[71,80]},{100,2,[81,90]},{150,1,[91,100]}]
A1263: 1260 | B1263: 6 | C1263: 10 | D1263: 1000 | E1263: =R[-9]C -> 81 | F1263: =R[-9]C -> 90 | G1263: 5 | H1263: 20000 | I1263: 110003 | J1263: 5 | K1263: [{5,10},{6,15},{13,10},{14,5},{15,10},{16,5},{20,1},{27,10},{28,10}] | L1263: =R[-1]C -> [{5,1113},{6,1113},{13,18},{14,37},{15,18},{16,37},{20,3},{27,18},{28,18}] | M1263: =R[-1]C -> [{0,1,[1,30]},{1,2,[11,40]},{2,5,[21,50]},{5,10,[31,60]},{10,20,[41,60]},{30,20,[51,70]},{50,10,[61,80]},{70,5,[71,80]},{100,2,[81,90]},{150,1,[91,100]}]
A1264: 1261 | B1264: 2 | C1264: 2 | D1264: 2000 | E1264: =R[-918]C -> 1 | F1264: =R[-918]C -> 10 | G1264: 1 | H1264: 5000 | I1264: 110003 | J1264: 1 | K1264: [{5,10},{6,15},{13,10},{14,5},{15,10},{16,5},{20,1},{27,10},{28,10}] | L1264: =R[-1]C -> [{5,1113},{6,1113},{13,18},{14,37},{15,18},{16,37},{20,3},{27,18},{28,18}] | M1264: =R[-1]C -> [{0,1,[1,30]},{1,2,[11,40]},{2,5,[21,50]},{5,10,[31,60]},{10,20,[41,60]},{30,20,[51,70]},{50,10,[61,80]},{70,5,[71,80]},{100,2,[81,90]},{150,1,[91,100]}]
A1265: 1262 | B1265: 2 | C1265: 2 | D1265: 2000 | E1265: =R[-918]C -> 11 | F1265: =R[-918]C -> 20 | G1265: 1 | H1265: 5000 | I1265: 110003 | J1265: 1 | K1265: [{5,10},{6,15},{13,10},{14,5},{15,10},{16,5},{20,1},{27,10},{28,10}] | L1265: =R[-1]C -> [{5,1113},{6,1113},{13,18},{14,37},{15,18},{16,37},{20,3},{27,18},{28,18}] | M1265: =R[-1]C -> [{0,1,[1,30]},{1,2,[11,40]},{2,5,[21,50]},{5,10,[31,60]},{10,20,[41,60]},{30,20,[51,70]},{50,10,[61,80]},{70,5,[71,80]},{100,2,[81,90]},{150,1,[91,100]}]
A1266: 1263 | B1266: 2 | C1266: 2 | D1266: 2000 | E1266: =R[-918]C -> 21 | F1266: =R[-918]C -> 30 | G1266: 1 | H1266: 5000 | I1266: 110003 | J1266: 1 | K1266: [{5,10},{6,15},{13,10},{14,5},{15,10},{16,5},{20,1},{27,10},{28,10}] | L1266: =R[-1]C -> [{5,1113},{6,1113},{13,18},{14,37},{15,18},{16,37},{20,3},{27,18},{28,18}] | M1266: =R[-1]C -> [{0,1,[1,30]},{1,2,[11,40]},{2,5,[21,50]},{5,10,[31,60]},{10,20,[41,60]},{30,20,[51,70]},{50,10,[61,80]},{70,5,[71,80]},{100,2,[81,90]},{150,1,[91,100]}]
A1267: 1264 | B1267: 2 | C1267: 2 | D1267: 2000 | E1267: =R[-918]C -> 31 | F1267: =R[-918]C -> 40 | G1267: 1 | H1267: 5000 | I1267: 110003 | J1267: 1 | K1267: [{5,10},{6,15},{13,10},{14,5},{15,10},{16,5},{20,1},{27,10},{28,10}] | L1267: =R[-1]C -> [{5,1113},{6,1113},{13,18},{14,37},{15,18},{16,37},{20,3},{27,18},{28,18}] | M1267: =R[-1]C -> [{0,1,[1,30]},{1,2,[11,40]},{2,5,[21,50]},{5,10,[31,60]},{10,20,[41,60]},{30,20,[51,70]},{50,10,[61,80]},{70,5,[71,80]},{100,2,[81,90]},{150,1,[91,100]}]
A1268: 1265 | B1268: 2 | C1268: 2 | D1268: 2000 | E1268: =R[-918]C -> 41 | F1268: =R[-918]C -> 50 | G1268: 1 | H1268: 5000 | I1268: 110003 | J1268: 1 | K1268: [{5,10},{6,15},{13,10},{14,5},{15,10},{16,5},{20,1},{27,10},{28,10}] | L1268: =R[-1]C -> [{5,1113},{6,1113},{13,18},{14,37},{15,18},{16,37},{20,3},{27,18},{28,18}] | M1268: =R[-1]C -> [{0,1,[1,30]},{1,2,[11,40]},{2,5,[21,50]},{5,10,[31,60]},{10,20,[41,60]},{30,20,[51,70]},{50,10,[61,80]},{70,5,[71,80]},{100,2,[81,90]},{150,1,[91,100]}]
A1269: 1266 | B1269: 2 | C1269: 2 | D1269: 2000 | E1269: =R[-918]C -> 51 | F1269: =R[-918]C -> 60 | G1269: 1 | H1269: 5000 | I1269: 110003 | J1269: 1 | K1269: [{5,10},{6,15},{13,10},{14,5},{15,10},{16,5},{20,1},{27,10},{28,10}] | L1269: =R[-1]C -> [{5,1113},{6,1113},{13,18},{14,37},{15,18},{16,37},{20,3},{27,18},{28,18}] | M1269: =R[-1]C -> [{0,1,[1,30]},{1,2,[11,40]},{2,5,[21,50]},{5,10,[31,60]},{10,20,[41,60]},{30,20,[51,70]},{50,10,[61,80]},{70,5,[71,80]},{100,2,[81,90]},{150,1,[91,100]}]
A1270: 1267 | B1270: 2 | C1270: 2 | D1270: 2000 | E1270: =R[-918]C -> 61 | F1270: =R[-918]C -> 70 | G1270: 1 | H1270: 5000 | I1270: 110003 | J1270: 1 | K1270: [{5,10},{6,15},{13,10},{14,5},{15,10},{16,5},{20,1},{27,10},{28,10}] | L1270: =R[-1]C -> [{5,1113},{6,1113},{13,18},{14,37},{15,18},{16,37},{20,3},{27,18},{28,18}] | M1270: =R[-1]C -> [{0,1,[1,30]},{1,2,[11,40]},{2,5,[21,50]},{5,10,[31,60]},{10,20,[41,60]},{30,20,[51,70]},{50,10,[61,80]},{70,5,[71,80]},{100,2,[81,90]},{150,1,[91,100]}]
A1271: 1268 | B1271: 2 | C1271: 2 | D1271: 2000 | E1271: =R[-918]C -> 71 | F1271: =R[-918]C -> 80 | G1271: 1 | H1271: 5000 | I1271: 110003 | J1271: 1 | K1271: [{5,10},{6,15},{13,10},{14,5},{15,10},{16,5},{20,1},{27,10},{28,10}] | L1271: =R[-1]C -> [{5,1113},{6,1113},{13,18},{14,37},{15,18},{16,37},{20,3},{27,18},{28,18}] | M1271: =R[-1]C -> [{0,1,[1,30]},{1,2,[11,40]},{2,5,[21,50]},{5,10,[31,60]},{10,20,[41,60]},{30,20,[51,70]},{50,10,[61,80]},{70,5,[71,80]},{100,2,[81,90]},{150,1,[91,100]}]
A1272: 1269 | B1272: 2 | C1272: 2 | D1272: 2000 | E1272: =R[-918]C -> 81 | F1272: =R[-918]C -> 90 | G1272: 1 | H1272: 5000 | I1272: 110003 | J1272: 1 | K1272: [{5,10},{6,15},{13,10},{14,5},{15,10},{16,5},{20,1},{27,10},{28,10}] | L1272: =R[-1]C -> [{5,1113},{6,1113},{13,18},{14,37},{15,18},{16,37},{20,3},{27,18},{28,18}] | M1272: =R[-1]C -> [{0,1,[1,30]},{1,2,[11,40]},{2,5,[21,50]},{5,10,[31,60]},{10,20,[41,60]},{30,20,[51,70]},{50,10,[61,80]},{70,5,[71,80]},{100,2,[81,90]},{150,1,[91,100]}]
A1273: 1270 | B1273: 3 | C1273: 2 | D1273: 2000 | E1273: =R[-9]C -> 1 | F1273: =R[-9]C -> 10 | G1273: 2 | H1273: 10000 | I1273: 110003 | J1273: 2 | K1273: [{5,10},{6,15},{13,10},{14,5},{15,10},{16,5},{20,1},{27,10},{28,10}] | L1273: =R[-1]C -> [{5,1113},{6,1113},{13,18},{14,37},{15,18},{16,37},{20,3},{27,18},{28,18}] | M1273: =R[-1]C -> [{0,1,[1,30]},{1,2,[11,40]},{2,5,[21,50]},{5,10,[31,60]},{10,20,[41,60]},{30,20,[51,70]},{50,10,[61,80]},{70,5,[71,80]},{100,2,[81,90]},{150,1,[91,100]}]
A1274: 1271 | B1274: 3 | C1274: 2 | D1274: 2000 | E1274: =R[-9]C -> 11 | F1274: =R[-9]C -> 20 | G1274: 2 | H1274: 10000 | I1274: 110003 | J1274: 2 | K1274: [{5,10},{6,15},{13,10},{14,5},{15,10},{16,5},{20,1},{27,10},{28,10}] | L1274: =R[-1]C -> [{5,1113},{6,1113},{13,18},{14,37},{15,18},{16,37},{20,3},{27,18},{28,18}] | M1274: =R[-1]C -> [{0,1,[1,30]},{1,2,[11,40]},{2,5,[21,50]},{5,10,[31,60]},{10,20,[41,60]},{30,20,[51,70]},{50,10,[61,80]},{70,5,[71,80]},{100,2,[81,90]},{150,1,[91,100]}]
A1275: 1272 | B1275: 3 | C1275: 2 | D1275: 2000 | E1275: =R[-9]C -> 21 | F1275: =R[-9]C -> 30 | G1275: 2 | H1275: 10000 | I1275: 110003 | J1275: 2 | K1275: [{5,10},{6,15},{13,10},{14,5},{15,10},{16,5},{20,1},{27,10},{28,10}] | L1275: =R[-1]C -> [{5,1113},{6,1113},{13,18},{14,37},{15,18},{16,37},{20,3},{27,18},{28,18}] | M1275: =R[-1]C -> [{0,1,[1,30]},{1,2,[11,40]},{2,5,[21,50]},{5,10,[31,60]},{10,20,[41,60]},{30,20,[51,70]},{50,10,[61,80]},{70,5,[71,80]},{100,2,[81,90]},{150,1,[91,100]}]
A1276: 1273 | B1276: 3 | C1276: 2 | D1276: 2000 | E1276: =R[-9]C -> 31 | F1276: =R[-9]C -> 40 | G1276: 2 | H1276: 10000 | I1276: 110003 | J1276: 2 | K1276: [{5,10},{6,15},{13,10},{14,5},{15,10},{16,5},{20,1},{27,10},{28,10}] | L1276: =R[-1]C -> [{5,1113},{6,1113},{13,18},{14,37},{15,18},{16,37},{20,3},{27,18},{28,18}] | M1276: =R[-1]C -> [{0,1,[1,30]},{1,2,[11,40]},{2,5,[21,50]},{5,10,[31,60]},{10,20,[41,60]},{30,20,[51,70]},{50,10,[61,80]},{70,5,[71,80]},{100,2,[81,90]},{150,1,[91,100]}]
A1277: 1274 | B1277: 3 | C1277: 2 | D1277: 2000 | E1277: =R[-9]C -> 41 | F1277: =R[-9]C -> 50 | G1277: 2 | H1277: 10000 | I1277: 110003 | J1277: 2 | K1277: [{5,10},{6,15},{13,10},{14,5},{15,10},{16,5},{20,1},{27,10},{28,10}] | L1277: =R[-1]C -> [{5,1113},{6,1113},{13,18},{14,37},{15,18},{16,37},{20,3},{27,18},{28,18}] | M1277: =R[-1]C -> [{0,1,[1,30]},{1,2,[11,40]},{2,5,[21,50]},{5,10,[31,60]},{10,20,[41,60]},{30,20,[51,70]},{50,10,[61,80]},{70,5,[71,80]},{100,2,[81,90]},{150,1,[91,100]}]
A1278: 1275 | B1278: 3 | C1278: 2 | D1278: 2000 | E1278: =R[-9]C -> 51 | F1278: =R[-9]C -> 60 | G1278: 2 | H1278: 10000 | I1278: 110003 | J1278: 2 | K1278: [{5,10},{6,15},{13,10},{14,5},{15,10},{16,5},{20,1},{27,10},{28,10}] | L1278: =R[-1]C -> [{5,1113},{6,1113},{13,18},{14,37},{15,18},{16,37},{20,3},{27,18},{28,18}] | M1278: =R[-1]C -> [{0,1,[1,30]},{1,2,[11,40]},{2,5,[21,50]},{5,10,[31,60]},{10,20,[41,60]},{30,20,[51,70]},{50,10,[61,80]},{70,5,[71,80]},{100,2,[81,90]},{150,1,[91,100]}]
A1279: 1276 | B1279: 3 | C1279: 2 | D1279: 2000 | E1279: =R[-9]C -> 61 | F1279: =R[-9]C -> 70 | G1279: 2 | H1279: 10000 | I1279: 110003 | J1279: 2 | K1279: [{5,10},{6,15},{13,10},{14,5},{15,10},{16,5},{20,1},{27,10},{28,10}] | L1279: =R[-1]C -> [{5,1113},{6,1113},{13,18},{14,37},{15,18},{16,37},{20,3},{27,18},{28,18}] | M1279: =R[-1]C -> [{0,1,[1,30]},{1,2,[11,40]},{2,5,[21,50]},{5,10,[31,60]},{10,20,[41,60]},{30,20,[51,70]},{50,10,[61,80]},{70,5,[71,80]},{100,2,[81,90]},{150,1,[91,100]}]
A1280: 1277 | B1280: 3 | C1280: 2 | D1280: 2000 | E1280: =R[-9]C -> 71 | F1280: =R[-9]C -> 80 | G1280: 2 | H1280: 10000 | I1280: 110003 | J1280: 2 | K1280: [{5,10},{6,15},{13,10},{14,5},{15,10},{16,5},{20,1},{27,10},{28,10}] | L1280: =R[-1]C -> [{5,1113},{6,1113},{13,18},{14,37},{15,18},{16,37},{20,3},{27,18},{28,18}] | M1280: =R[-1]C -> [{0,1,[1,30]},{1,2,[11,40]},{2,5,[21,50]},{5,10,[31,60]},{10,20,[41,60]},{30,20,[51,70]},{50,10,[61,80]},{70,5,[71,80]},{100,2,[81,90]},{150,1,[91,100]}]
A1281: 1278 | B1281: 3 | C1281: 2 | D1281: 2000 | E1281: =R[-9]C -> 81 | F1281: =R[-9]C -> 90 | G1281: 2 | H1281: 10000 | I1281: 110003 | J1281: 2 | K1281: [{5,10},{6,15},{13,10},{14,5},{15,10},{16,5},{20,1},{27,10},{28,10}] | L1281: =R[-1]C -> [{5,1113},{6,1113},{13,18},{14,37},{15,18},{16,37},{20,3},{27,18},{28,18}] | M1281: =R[-1]C -> [{0,1,[1,30]},{1,2,[11,40]},{2,5,[21,50]},{5,10,[31,60]},{10,20,[41,60]},{30,20,[51,70]},{50,10,[61,80]},{70,5,[71,80]},{100,2,[81,90]},{150,1,[91,100]}]
A1282: 1279 | B1282: 4 | C1282: 2 | D1282: 2000 | E1282: =R[-9]C -> 1 | F1282: =R[-9]C -> 10 | G1282: 3 | H1282: 15000 | I1282: 110003 | J1282: 3 | K1282: [{5,10},{6,15},{13,10},{14,5},{15,10},{16,5},{20,1},{27,10},{28,10}] | L1282: =R[-1]C -> [{5,1113},{6,1113},{13,18},{14,37},{15,18},{16,37},{20,3},{27,18},{28,18}] | M1282: =R[-1]C -> [{0,1,[1,30]},{1,2,[11,40]},{2,5,[21,50]},{5,10,[31,60]},{10,20,[41,60]},{30,20,[51,70]},{50,10,[61,80]},{70,5,[71,80]},{100,2,[81,90]},{150,1,[91,100]}]
A1283: 1280 | B1283: 4 | C1283: 2 | D1283: 2000 | E1283: =R[-9]C -> 11 | F1283: =R[-9]C -> 20 | G1283: 3 | H1283: 15000 | I1283: 110003 | J1283: 3 | K1283: [{5,10},{6,15},{13,10},{14,5},{15,10},{16,5},{20,1},{27,10},{28,10}] | L1283: =R[-1]C -> [{5,1113},{6,1113},{13,18},{14,37},{15,18},{16,37},{20,3},{27,18},{28,18}] | M1283: =R[-1]C -> [{0,1,[1,30]},{1,2,[11,40]},{2,5,[21,50]},{5,10,[31,60]},{10,20,[41,60]},{30,20,[51,70]},{50,10,[61,80]},{70,5,[71,80]},{100,2,[81,90]},{150,1,[91,100]}]
A1284: 1281 | B1284: 4 | C1284: 2 | D1284: 2000 | E1284: =R[-9]C -> 21 | F1284: =R[-9]C -> 30 | G1284: 3 | H1284: 15000 | I1284: 110003 | J1284: 3 | K1284: [{5,10},{6,15},{13,10},{14,5},{15,10},{16,5},{20,1},{27,10},{28,10}] | L1284: =R[-1]C -> [{5,1113},{6,1113},{13,18},{14,37},{15,18},{16,37},{20,3},{27,18},{28,18}] | M1284: =R[-1]C -> [{0,1,[1,30]},{1,2,[11,40]},{2,5,[21,50]},{5,10,[31,60]},{10,20,[41,60]},{30,20,[51,70]},{50,10,[61,80]},{70,5,[71,80]},{100,2,[81,90]},{150,1,[91,100]}]
A1285: 1282 | B1285: 4 | C1285: 2 | D1285: 2000 | E1285: =R[-9]C -> 31 | F1285: =R[-9]C -> 40 | G1285: 3 | H1285: 15000 | I1285: 110003 | J1285: 3 | K1285: [{5,10},{6,15},{13,10},{14,5},{15,10},{16,5},{20,1},{27,10},{28,10}] | L1285: =R[-1]C -> [{5,1113},{6,1113},{13,18},{14,37},{15,18},{16,37},{20,3},{27,18},{28,18}] | M1285: =R[-1]C -> [{0,1,[1,30]},{1,2,[11,40]},{2,5,[21,50]},{5,10,[31,60]},{10,20,[41,60]},{30,20,[51,70]},{50,10,[61,80]},{70,5,[71,80]},{100,2,[81,90]},{150,1,[91,100]}]
A1286: 1283 | B1286: 4 | C1286: 2 | D1286: 2000 | E1286: =R[-9]C -> 41 | F1286: =R[-9]C -> 50 | G1286: 3 | H1286: 15000 | I1286: 110003 | J1286: 3 | K1286: [{5,10},{6,15},{13,10},{14,5},{15,10},{16,5},{20,1},{27,10},{28,10}] | L1286: =R[-1]C -> [{5,1113},{6,1113},{13,18},{14,37},{15,18},{16,37},{20,3},{27,18},{28,18}] | M1286: =R[-1]C -> [{0,1,[1,30]},{1,2,[11,40]},{2,5,[21,50]},{5,10,[31,60]},{10,20,[41,60]},{30,20,[51,70]},{50,10,[61,80]},{70,5,[71,80]},{100,2,[81,90]},{150,1,[91,100]}]
A1287: 1284 | B1287: 4 | C1287: 2 | D1287: 2000 | E1287: =R[-9]C -> 51 | F1287: =R[-9]C -> 60 | G1287: 3 | H1287: 15000 | I1287: 110003 | J1287: 3 | K1287: [{5,10},{6,15},{13,10},{14,5},{15,10},{16,5},{20,1},{27,10},{28,10}] | L1287: =R[-1]C -> [{5,1113},{6,1113},{13,18},{14,37},{15,18},{16,37},{20,3},{27,18},{28,18}] | M1287: =R[-1]C -> [{0,1,[1,30]},{1,2,[11,40]},{2,5,[21,50]},{5,10,[31,60]},{10,20,[41,60]},{30,20,[51,70]},{50,10,[61,80]},{70,5,[71,80]},{100,2,[81,90]},{150,1,[91,100]}]
A1288: 1285 | B1288: 4 | C1288: 2 | D1288: 2000 | E1288: =R[-9]C -> 61 | F1288: =R[-9]C -> 70 | G1288: 3 | H1288: 15000 | I1288: 110003 | J1288: 3 | K1288: [{5,10},{6,15},{13,10},{14,5},{15,10},{16,5},{20,1},{27,10},{28,10}] | L1288: =R[-1]C -> [{5,1113},{6,1113},{13,18},{14,37},{15,18},{16,37},{20,3},{27,18},{28,18}] | M1288: =R[-1]C -> [{0,1,[1,30]},{1,2,[11,40]},{2,5,[21,50]},{5,10,[31,60]},{10,20,[41,60]},{30,20,[51,70]},{50,10,[61,80]},{70,5,[71,80]},{100,2,[81,90]},{150,1,[91,100]}]
A1289: 1286 | B1289: 4 | C1289: 2 | D1289: 2000 | E1289: =R[-9]C -> 71 | F1289: =R[-9]C -> 80 | G1289: 3 | H1289: 15000 | I1289: 110003 | J1289: 3 | K1289: [{5,10},{6,15},{13,10},{14,5},{15,10},{16,5},{20,1},{27,10},{28,10}] | L1289: =R[-1]C -> [{5,1113},{6,1113},{13,18},{14,37},{15,18},{16,37},{20,3},{27,18},{28,18}] | M1289: =R[-1]C -> [{0,1,[1,30]},{1,2,[11,40]},{2,5,[21,50]},{5,10,[31,60]},{10,20,[41,60]},{30,20,[51,70]},{50,10,[61,80]},{70,5,[71,80]},{100,2,[81,90]},{150,1,[91,100]}]
A1290: 1287 | B1290: 4 | C1290: 2 | D1290: 2000 | E1290: =R[-9]C -> 81 | F1290: =R[-9]C -> 90 | G1290: 3 | H1290: 15000 | I1290: 110003 | J1290: 3 | K1290: [{5,10},{6,15},{13,10},{14,5},{15,10},{16,5},{20,1},{27,10},{28,10}] | L1290: =R[-1]C -> [{5,1113},{6,1113},{13,18},{14,37},{15,18},{16,37},{20,3},{27,18},{28,18}] | M1290: =R[-1]C -> [{0,1,[1,30]},{1,2,[11,40]},{2,5,[21,50]},{5,10,[31,60]},{10,20,[41,60]},{30,20,[51,70]},{50,10,[61,80]},{70,5,[71,80]},{100,2,[81,90]},{150,1,[91,100]}]
A1291: 1288 | B1291: 5 | C1291: 2 | D1291: 2000 | E1291: =R[-9]C -> 1 | F1291: =R[-9]C -> 10 | G1291: 4 | H1291: 20000 | I1291: 110003 | J1291: 4 | K1291: [{5,10},{6,15},{13,10},{14,5},{15,10},{16,5},{20,1},{27,10},{28,10}] | L1291: =R[-1]C -> [{5,1113},{6,1113},{13,18},{14,37},{15,18},{16,37},{20,3},{27,18},{28,18}] | M1291: =R[-1]C -> [{0,1,[1,30]},{1,2,[11,40]},{2,5,[21,50]},{5,10,[31,60]},{10,20,[41,60]},{30,20,[51,70]},{50,10,[61,80]},{70,5,[71,80]},{100,2,[81,90]},{150,1,[91,100]}]
A1292: 1289 | B1292: 5 | C1292: 2 | D1292: 2000 | E1292: =R[-9]C -> 11 | F1292: =R[-9]C -> 20 | G1292: 4 | H1292: 20000 | I1292: 110003 | J1292: 4 | K1292: [{5,10},{6,15},{13,10},{14,5},{15,10},{16,5},{20,1},{27,10},{28,10}] | L1292: =R[-1]C -> [{5,1113},{6,1113},{13,18},{14,37},{15,18},{16,37},{20,3},{27,18},{28,18}] | M1292: =R[-1]C -> [{0,1,[1,30]},{1,2,[11,40]},{2,5,[21,50]},{5,10,[31,60]},{10,20,[41,60]},{30,20,[51,70]},{50,10,[61,80]},{70,5,[71,80]},{100,2,[81,90]},{150,1,[91,100]}]
A1293: 1290 | B1293: 5 | C1293: 2 | D1293: 2000 | E1293: =R[-9]C -> 21 | F1293: =R[-9]C -> 30 | G1293: 4 | H1293: 20000 | I1293: 110003 | J1293: 4 | K1293: [{5,10},{6,15},{13,10},{14,5},{15,10},{16,5},{20,1},{27,10},{28,10}] | L1293: =R[-1]C -> [{5,1113},{6,1113},{13,18},{14,37},{15,18},{16,37},{20,3},{27,18},{28,18}] | M1293: =R[-1]C -> [{0,1,[1,30]},{1,2,[11,40]},{2,5,[21,50]},{5,10,[31,60]},{10,20,[41,60]},{30,20,[51,70]},{50,10,[61,80]},{70,5,[71,80]},{100,2,[81,90]},{150,1,[91,100]}]
A1294: 1291 | B1294: 5 | C1294: 2 | D1294: 2000 | E1294: =R[-9]C -> 31 | F1294: =R[-9]C -> 40 | G1294: 4 | H1294: 20000 | I1294: 110003 | J1294: 4 | K1294: [{5,10},{6,15},{13,10},{14,5},{15,10},{16,5},{20,1},{27,10},{28,10}] | L1294: =R[-1]C -> [{5,1113},{6,1113},{13,18},{14,37},{15,18},{16,37},{20,3},{27,18},{28,18}] | M1294: =R[-1]C -> [{0,1,[1,30]},{1,2,[11,40]},{2,5,[21,50]},{5,10,[31,60]},{10,20,[41,60]},{30,20,[51,70]},{50,10,[61,80]},{70,5,[71,80]},{100,2,[81,90]},{150,1,[91,100]}]
A1295: 1292 | B1295: 5 | C1295: 2 | D1295: 2000 | E1295: =R[-9]C -> 41 | F1295: =R[-9]C -> 50 | G1295: 4 | H1295: 20000 | I1295: 110003 | J1295: 4 | K1295: [{5,10},{6,15},{13,10},{14,5},{15,10},{16,5},{20,1},{27,10},{28,10}] | L1295: =R[-1]C -> [{5,1113},{6,1113},{13,18},{14,37},{15,18},{16,37},{20,3},{27,18},{28,18}] | M1295: =R[-1]C -> [{0,1,[1,30]},{1,2,[11,40]},{2,5,[21,50]},{5,10,[31,60]},{10,20,[41,60]},{30,20,[51,70]},{50,10,[61,80]},{70,5,[71,80]},{100,2,[81,90]},{150,1,[91,100]}]
A1296: 1293 | B1296: 5 | C1296: 2 | D1296: 2000 | E1296: =R[-9]C -> 51 | F1296: =R[-9]C -> 60 | G1296: 4 | H1296: 20000 | I1296: 110003 | J1296: 4 | K1296: [{5,10},{6,15},{13,10},{14,5},{15,10},{16,5},{20,1},{27,10},{28,10}] | L1296: =R[-1]C -> [{5,1113},{6,1113},{13,18},{14,37},{15,18},{16,37},{20,3},{27,18},{28,18}] | M1296: =R[-1]C -> [{0,1,[1,30]},{1,2,[11,40]},{2,5,[21,50]},{5,10,[31,60]},{10,20,[41,60]},{30,20,[51,70]},{50,10,[61,80]},{70,5,[71,80]},{100,2,[81,90]},{150,1,[91,100]}]
A1297: 1294 | B1297: 5 | C1297: 2 | D1297: 2000 | E1297: =R[-9]C -> 61 | F1297: =R[-9]C -> 70 | G1297: 4 | H1297: 20000 | I1297: 110003 | J1297: 4 | K1297: [{5,10},{6,15},{13,10},{14,5},{15,10},{16,5},{20,1},{27,10},{28,10}] | L1297: =R[-1]C -> [{5,1113},{6,1113},{13,18},{14,37},{15,18},{16,37},{20,3},{27,18},{28,18}] | M1297: =R[-1]C -> [{0,1,[1,30]},{1,2,[11,40]},{2,5,[21,50]},{5,10,[31,60]},{10,20,[41,60]},{30,20,[51,70]},{50,10,[61,80]},{70,5,[71,80]},{100,2,[81,90]},{150,1,[91,100]}]
A1298: 1295 | B1298: 5 | C1298: 2 | D1298: 2000 | E1298: =R[-9]C -> 71 | F1298: =R[-9]C -> 80 | G1298: 4 | H1298: 20000 | I1298: 110003 | J1298: 4 | K1298: [{5,10},{6,15},{13,10},{14,5},{15,10},{16,5},{20,1},{27,10},{28,10}] | L1298: =R[-1]C -> [{5,1113},{6,1113},{13,18},{14,37},{15,18},{16,37},{20,3},{27,18},{28,18}] | M1298: =R[-1]C -> [{0,1,[1,30]},{1,2,[11,40]},{2,5,[21,50]},{5,10,[31,60]},{10,20,[41,60]},{30,20,[51,70]},{50,10,[61,80]},{70,5,[71,80]},{100,2,[81,90]},{150,1,[91,100]}]
A1299: 1296 | B1299: 5 | C1299: 2 | D1299: 2000 | E1299: =R[-9]C -> 81 | F1299: =R[-9]C -> 90 | G1299: 4 | H1299: 20000 | I1299: 110003 | J1299: 4 | K1299: [{5,10},{6,15},{13,10},{14,5},{15,10},{16,5},{20,1},{27,10},{28,10}] | L1299: =R[-1]C -> [{5,1113},{6,1113},{13,18},{14,37},{15,18},{16,37},{20,3},{27,18},{28,18}] | M1299: =R[-1]C -> [{0,1,[1,30]},{1,2,[11,40]},{2,5,[21,50]},{5,10,[31,60]},{10,20,[41,60]},{30,20,[51,70]},{50,10,[61,80]},{70,5,[71,80]},{100,2,[81,90]},{150,1,[91,100]}]
A1300: 1297 | B1300: 6 | C1300: 2 | D1300: 2000 | E1300: =R[-9]C -> 1 | F1300: =R[-9]C -> 10 | G1300: 5 | H1300: 20000 | I1300: 110003 | J1300: 5 | K1300: [{5,10},{6,15},{13,10},{14,5},{15,10},{16,5},{20,1},{27,10},{28,10}] | L1300: =R[-1]C -> [{5,1113},{6,1113},{13,18},{14,37},{15,18},{16,37},{20,3},{27,18},{28,18}] | M1300: =R[-1]C -> [{0,1,[1,30]},{1,2,[11,40]},{2,5,[21,50]},{5,10,[31,60]},{10,20,[41,60]},{30,20,[51,70]},{50,10,[61,80]},{70,5,[71,80]},{100,2,[81,90]},{150,1,[91,100]}]
A1301: 1298 | B1301: 6 | C1301: 2 | D1301: 2000 | E1301: =R[-9]C -> 11 | F1301: =R[-9]C -> 20 | G1301: 5 | H1301: 20000 | I1301: 110003 | J1301: 5 | K1301: [{5,10},{6,15},{13,10},{14,5},{15,10},{16,5},{20,1},{27,10},{28,10}] | L1301: =R[-1]C -> [{5,1113},{6,1113},{13,18},{14,37},{15,18},{16,37},{20,3},{27,18},{28,18}] | M1301: =R[-1]C -> [{0,1,[1,30]},{1,2,[11,40]},{2,5,[21,50]},{5,10,[31,60]},{10,20,[41,60]},{30,20,[51,70]},{50,10,[61,80]},{70,5,[71,80]},{100,2,[81,90]},{150,1,[91,100]}]
A1302: 1299 | B1302: 6 | C1302: 2 | D1302: 2000 | E1302: =R[-9]C -> 21 | F1302: =R[-9]C -> 30 | G1302: 5 | H1302: 20000 | I1302: 110003 | J1302: 5 | K1302: [{5,10},{6,15},{13,10},{14,5},{15,10},{16,5},{20,1},{27,10},{28,10}] | L1302: =R[-1]C -> [{5,1113},{6,1113},{13,18},{14,37},{15,18},{16,37},{20,3},{27,18},{28,18}] | M1302: =R[-1]C -> [{0,1,[1,30]},{1,2,[11,40]},{2,5,[21,50]},{5,10,[31,60]},{10,20,[41,60]},{30,20,[51,70]},{50,10,[61,80]},{70,5,[71,80]},{100,2,[81,90]},{150,1,[91,100]}]
A1303: 1300 | B1303: 6 | C1303: 2 | D1303: 2000 | E1303: =R[-9]C -> 31 | F1303: =R[-9]C -> 40 | G1303: 5 | H1303: 20000 | I1303: 110003 | J1303: 5 | K1303: [{5,10},{6,15},{13,10},{14,5},{15,10},{16,5},{20,1},{27,10},{28,10}] | L1303: =R[-1]C -> [{5,1113},{6,1113},{13,18},{14,37},{15,18},{16,37},{20,3},{27,18},{28,18}] | M1303: =R[-1]C -> [{0,1,[1,30]},{1,2,[11,40]},{2,5,[21,50]},{5,10,[31,60]},{10,20,[41,60]},{30,20,[51,70]},{50,10,[61,80]},{70,5,[71,80]},{100,2,[81,90]},{150,1,[91,100]}]
A1304: 1301 | B1304: 6 | C1304: 2 | D1304: 2000 | E1304: =R[-9]C -> 41 | F1304: =R[-9]C -> 50 | G1304: 5 | H1304: 20000 | I1304: 110003 | J1304: 5 | K1304: [{5,10},{6,15},{13,10},{14,5},{15,10},{16,5},{20,1},{27,10},{28,10}] | L1304: =R[-1]C -> [{5,1113},{6,1113},{13,18},{14,37},{15,18},{16,37},{20,3},{27,18},{28,18}] | M1304: =R[-1]C -> [{0,1,[1,30]},{1,2,[11,40]},{2,5,[21,50]},{5,10,[31,60]},{10,20,[41,60]},{30,20,[51,70]},{50,10,[61,80]},{70,5,[71,80]},{100,2,[81,90]},{150,1,[91,100]}]
A1305: 1302 | B1305: 6 | C1305: 2 | D1305: 2000 | E1305: =R[-9]C -> 51 | F1305: =R[-9]C -> 60 | G1305: 5 | H1305: 20000 | I1305: 110003 | J1305: 5 | K1305: [{5,10},{6,15},{13,10},{14,5},{15,10},{16,5},{20,1},{27,10},{28,10}] | L1305: =R[-1]C -> [{5,1113},{6,1113},{13,18},{14,37},{15,18},{16,37},{20,3},{27,18},{28,18}] | M1305: =R[-1]C -> [{0,1,[1,30]},{1,2,[11,40]},{2,5,[21,50]},{5,10,[31,60]},{10,20,[41,60]},{30,20,[51,70]},{50,10,[61,80]},{70,5,[71,80]},{100,2,[81,90]},{150,1,[91,100]}]
A1306: 1303 | B1306: 6 | C1306: 2 | D1306: 2000 | E1306: =R[-9]C -> 61 | F1306: =R[-9]C -> 70 | G1306: 5 | H1306: 20000 | I1306: 110003 | J1306: 5 | K1306: [{5,10},{6,15},{13,10},{14,5},{15,10},{16,5},{20,1},{27,10},{28,10}] | L1306: =R[-1]C -> [{5,1113},{6,1113},{13,18},{14,37},{15,18},{16,37},{20,3},{27,18},{28,18}] | M1306: =R[-1]C -> [{0,1,[1,30]},{1,2,[11,40]},{2,5,[21,50]},{5,10,[31,60]},{10,20,[41,60]},{30,20,[51,70]},{50,10,[61,80]},{70,5,[71,80]},{100,2,[81,90]},{150,1,[91,100]}]
A1307: 1304 | B1307: 6 | C1307: 2 | D1307: 2000 | E1307: =R[-9]C -> 71 | F1307: =R[-9]C -> 80 | G1307: 5 | H1307: 20000 | I1307: 110003 | J1307: 5 | K1307: [{5,10},{6,15},{13,10},{14,5},{15,10},{16,5},{20,1},{27,10},{28,10}] | L1307: =R[-1]C -> [{5,1113},{6,1113},{13,18},{14,37},{15,18},{16,37},{20,3},{27,18},{28,18}] | M1307: =R[-1]C -> [{0,1,[1,30]},{1,2,[11,40]},{2,5,[21,50]},{5,10,[31,60]},{10,20,[41,60]},{30,20,[51,70]},{50,10,[61,80]},{70,5,[71,80]},{100,2,[81,90]},{150,1,[91,100]}]
A1308: 1305 | B1308: 6 | C1308: 2 | D1308: 2000 | E1308: =R[-9]C -> 81 | F1308: =R[-9]C -> 90 | G1308: 5 | H1308: 20000 | I1308: 110003 | J1308: 5 | K1308: [{5,10},{6,15},{13,10},{14,5},{15,10},{16,5},{20,1},{27,10},{28,10}] | L1308: =R[-1]C -> [{5,1113},{6,1113},{13,18},{14,37},{15,18},{16,37},{20,3},{27,18},{28,18}] | M1308: =R[-1]C -> [{0,1,[1,30]},{1,2,[11,40]},{2,5,[21,50]},{5,10,[31,60]},{10,20,[41,60]},{30,20,[51,70]},{50,10,[61,80]},{70,5,[71,80]},{100,2,[81,90]},{150,1,[91,100]}]
A1309: 1306 | B1309: 2 | C1309: 3 | D1309: 2000 | E1309: =R[-18]C -> 1 | F1309: =R[-18]C -> 10 | G1309: 1 | H1309: 5000 | I1309: 110003 | J1309: 1 | K1309: [{5,10},{6,15},{13,10},{14,5},{15,10},{16,5},{20,1},{27,10},{28,10}] | L1309: =R[-1]C -> [{5,1113},{6,1113},{13,18},{14,37},{15,18},{16,37},{20,3},{27,18},{28,18}] | M1309: =R[-1]C -> [{0,1,[1,30]},{1,2,[11,40]},{2,5,[21,50]},{5,10,[31,60]},{10,20,[41,60]},{30,20,[51,70]},{50,10,[61,80]},{70,5,[71,80]},{100,2,[81,90]},{150,1,[91,100]}]
A1310: 1307 | B1310: 2 | C1310: 3 | D1310: 2000 | E1310: =R[-18]C -> 11 | F1310: =R[-18]C -> 20 | G1310: 1 | H1310: 5000 | I1310: 110003 | J1310: 1 | K1310: [{5,10},{6,15},{13,10},{14,5},{15,10},{16,5},{20,1},{27,10},{28,10}] | L1310: =R[-1]C -> [{5,1113},{6,1113},{13,18},{14,37},{15,18},{16,37},{20,3},{27,18},{28,18}] | M1310: =R[-1]C -> [{0,1,[1,30]},{1,2,[11,40]},{2,5,[21,50]},{5,10,[31,60]},{10,20,[41,60]},{30,20,[51,70]},{50,10,[61,80]},{70,5,[71,80]},{100,2,[81,90]},{150,1,[91,100]}]
A1311: 1308 | B1311: 2 | C1311: 3 | D1311: 2000 | E1311: =R[-18]C -> 21 | F1311: =R[-18]C -> 30 | G1311: 1 | H1311: 5000 | I1311: 110003 | J1311: 1 | K1311: [{5,10},{6,15},{13,10},{14,5},{15,10},{16,5},{20,1},{27,10},{28,10}] | L1311: =R[-1]C -> [{5,1113},{6,1113},{13,18},{14,37},{15,18},{16,37},{20,3},{27,18},{28,18}] | M1311: =R[-1]C -> [{0,1,[1,30]},{1,2,[11,40]},{2,5,[21,50]},{5,10,[31,60]},{10,20,[41,60]},{30,20,[51,70]},{50,10,[61,80]},{70,5,[71,80]},{100,2,[81,90]},{150,1,[91,100]}]
A1312: 1309 | B1312: 2 | C1312: 3 | D1312: 2000 | E1312: =R[-18]C -> 31 | F1312: =R[-18]C -> 40 | G1312: 1 | H1312: 5000 | I1312: 110003 | J1312: 1 | K1312: [{5,10},{6,15},{13,10},{14,5},{15,10},{16,5},{20,1},{27,10},{28,10}] | L1312: =R[-1]C -> [{5,1113},{6,1113},{13,18},{14,37},{15,18},{16,37},{20,3},{27,18},{28,18}] | M1312: =R[-1]C -> [{0,1,[1,30]},{1,2,[11,40]},{2,5,[21,50]},{5,10,[31,60]},{10,20,[41,60]},{30,20,[51,70]},{50,10,[61,80]},{70,5,[71,80]},{100,2,[81,90]},{150,1,[91,100]}]
A1313: 1310 | B1313: 2 | C1313: 3 | D1313: 2000 | E1313: =R[-18]C -> 41 | F1313: =R[-18]C -> 50 | G1313: 1 | H1313: 5000 | I1313: 110003 | J1313: 1 | K1313: [{5,10},{6,15},{13,10},{14,5},{15,10},{16,5},{20,1},{27,10},{28,10}] | L1313: =R[-1]C -> [{5,1113},{6,1113},{13,18},{14,37},{15,18},{16,37},{20,3},{27,18},{28,18}] | M1313: =R[-1]C -> [{0,1,[1,30]},{1,2,[11,40]},{2,5,[21,50]},{5,10,[31,60]},{10,20,[41,60]},{30,20,[51,70]},{50,10,[61,80]},{70,5,[71,80]},{100,2,[81,90]},{150,1,[91,100]}]
A1314: 1311 | B1314: 2 | C1314: 3 | D1314: 2000 | E1314: =R[-18]C -> 51 | F1314: =R[-18]C -> 60 | G1314: 1 | H1314: 5000 | I1314: 110003 | J1314: 1 | K1314: [{5,10},{6,15},{13,10},{14,5},{15,10},{16,5},{20,1},{27,10},{28,10}] | L1314: =R[-1]C -> [{5,1113},{6,1113},{13,18},{14,37},{15,18},{16,37},{20,3},{27,18},{28,18}] | M1314: =R[-1]C -> [{0,1,[1,30]},{1,2,[11,40]},{2,5,[21,50]},{5,10,[31,60]},{10,20,[41,60]},{30,20,[51,70]},{50,10,[61,80]},{70,5,[71,80]},{100,2,[81,90]},{150,1,[91,100]}]
A1315: 1312 | B1315: 2 | C1315: 3 | D1315: 2000 | E1315: =R[-18]C -> 61 | F1315: =R[-18]C -> 70 | G1315: 1 | H1315: 5000 | I1315: 110003 | J1315: 1 | K1315: [{5,10},{6,15},{13,10},{14,5},{15,10},{16,5},{20,1},{27,10},{28,10}] | L1315: =R[-1]C -> [{5,1113},{6,1113},{13,18},{14,37},{15,18},{16,37},{20,3},{27,18},{28,18}] | M1315: =R[-1]C -> [{0,1,[1,30]},{1,2,[11,40]},{2,5,[21,50]},{5,10,[31,60]},{10,20,[41,60]},{30,20,[51,70]},{50,10,[61,80]},{70,5,[71,80]},{100,2,[81,90]},{150,1,[91,100]}]
A1316: 1313 | B1316: 2 | C1316: 3 | D1316: 2000 | E1316: =R[-18]C -> 71 | F1316: =R[-18]C -> 80 | G1316: 1 | H1316: 5000 | I1316: 110003 | J1316: 1 | K1316: [{5,10},{6,15},{13,10},{14,5},{15,10},{16,5},{20,1},{27,10},{28,10}] | L1316: =R[-1]C -> [{5,1113},{6,1113},{13,18},{14,37},{15,18},{16,37},{20,3},{27,18},{28,18}] | M1316: =R[-1]C -> [{0,1,[1,30]},{1,2,[11,40]},{2,5,[21,50]},{5,10,[31,60]},{10,20,[41,60]},{30,20,[51,70]},{50,10,[61,80]},{70,5,[71,80]},{100,2,[81,90]},{150,1,[91,100]}]
A1317: 1314 | B1317: 2 | C1317: 3 | D1317: 2000 | E1317: =R[-18]C -> 81 | F1317: =R[-18]C -> 90 | G1317: 1 | H1317: 5000 | I1317: 110003 | J1317: 1 | K1317: [{5,10},{6,15},{13,10},{14,5},{15,10},{16,5},{20,1},{27,10},{28,10}] | L1317: =R[-1]C -> [{5,1113},{6,1113},{13,18},{14,37},{15,18},{16,37},{20,3},{27,18},{28,18}] | M1317: =R[-1]C -> [{0,1,[1,30]},{1,2,[11,40]},{2,5,[21,50]},{5,10,[31,60]},{10,20,[41,60]},{30,20,[51,70]},{50,10,[61,80]},{70,5,[71,80]},{100,2,[81,90]},{150,1,[91,100]}]
A1318: 1315 | B1318: 3 | C1318: 3 | D1318: 2000 | E1318: =R[-9]C -> 1 | F1318: =R[-9]C -> 10 | G1318: 2 | H1318: 10000 | I1318: 110003 | J1318: 2 | K1318: [{5,10},{6,15},{13,10},{14,5},{15,10},{16,5},{20,1},{27,10},{28,10}] | L1318: =R[-1]C -> [{5,1113},{6,1113},{13,18},{14,37},{15,18},{16,37},{20,3},{27,18},{28,18}] | M1318: =R[-1]C -> [{0,1,[1,30]},{1,2,[11,40]},{2,5,[21,50]},{5,10,[31,60]},{10,20,[41,60]},{30,20,[51,70]},{50,10,[61,80]},{70,5,[71,80]},{100,2,[81,90]},{150,1,[91,100]}]
A1319: 1316 | B1319: 3 | C1319: 3 | D1319: 2000 | E1319: =R[-9]C -> 11 | F1319: =R[-9]C -> 20 | G1319: 2 | H1319: 10000 | I1319: 110003 | J1319: 2 | K1319: [{5,10},{6,15},{13,10},{14,5},{15,10},{16,5},{20,1},{27,10},{28,10}] | L1319: =R[-1]C -> [{5,1113},{6,1113},{13,18},{14,37},{15,18},{16,37},{20,3},{27,18},{28,18}] | M1319: =R[-1]C -> [{0,1,[1,30]},{1,2,[11,40]},{2,5,[21,50]},{5,10,[31,60]},{10,20,[41,60]},{30,20,[51,70]},{50,10,[61,80]},{70,5,[71,80]},{100,2,[81,90]},{150,1,[91,100]}]
A1320: 1317 | B1320: 3 | C1320: 3 | D1320: 2000 | E1320: =R[-9]C -> 21 | F1320: =R[-9]C -> 30 | G1320: 2 | H1320: 10000 | I1320: 110003 | J1320: 2 | K1320: [{5,10},{6,15},{13,10},{14,5},{15,10},{16,5},{20,1},{27,10},{28,10}] | L1320: =R[-1]C -> [{5,1113},{6,1113},{13,18},{14,37},{15,18},{16,37},{20,3},{27,18},{28,18}] | M1320: =R[-1]C -> [{0,1,[1,30]},{1,2,[11,40]},{2,5,[21,50]},{5,10,[31,60]},{10,20,[41,60]},{30,20,[51,70]},{50,10,[61,80]},{70,5,[71,80]},{100,2,[81,90]},{150,1,[91,100]}]
A1321: 1318 | B1321: 3 | C1321: 3 | D1321: 2000 | E1321: =R[-9]C -> 31 | F1321: =R[-9]C -> 40 | G1321: 2 | H1321: 10000 | I1321: 110003 | J1321: 2 | K1321: [{5,10},{6,15},{13,10},{14,5},{15,10},{16,5},{20,1},{27,10},{28,10}] | L1321: =R[-1]C -> [{5,1113},{6,1113},{13,18},{14,37},{15,18},{16,37},{20,3},{27,18},{28,18}] | M1321: =R[-1]C -> [{0,1,[1,30]},{1,2,[11,40]},{2,5,[21,50]},{5,10,[31,60]},{10,20,[41,60]},{30,20,[51,70]},{50,10,[61,80]},{70,5,[71,80]},{100,2,[81,90]},{150,1,[91,100]}]
A1322: 1319 | B1322: 3 | C1322: 3 | D1322: 2000 | E1322: =R[-9]C -> 41 | F1322: =R[-9]C -> 50 | G1322: 2 | H1322: 10000 | I1322: 110003 | J1322: 2 | K1322: [{5,10},{6,15},{13,10},{14,5},{15,10},{16,5},{20,1},{27,10},{28,10}] | L1322: =R[-1]C -> [{5,1113},{6,1113},{13,18},{14,37},{15,18},{16,37},{20,3},{27,18},{28,18}] | M1322: =R[-1]C -> [{0,1,[1,30]},{1,2,[11,40]},{2,5,[21,50]},{5,10,[31,60]},{10,20,[41,60]},{30,20,[51,70]},{50,10,[61,80]},{70,5,[71,80]},{100,2,[81,90]},{150,1,[91,100]}]
A1323: 1320 | B1323: 3 | C1323: 3 | D1323: 2000 | E1323: =R[-9]C -> 51 | F1323: =R[-9]C -> 60 | G1323: 2 | H1323: 10000 | I1323: 110003 | J1323: 2 | K1323: [{5,10},{6,15},{13,10},{14,5},{15,10},{16,5},{20,1},{27,10},{28,10}] | L1323: =R[-1]C -> [{5,1113},{6,1113},{13,18},{14,37},{15,18},{16,37},{20,3},{27,18},{28,18}] | M1323: =R[-1]C -> [{0,1,[1,30]},{1,2,[11,40]},{2,5,[21,50]},{5,10,[31,60]},{10,20,[41,60]},{30,20,[51,70]},{50,10,[61,80]},{70,5,[71,80]},{100,2,[81,90]},{150,1,[91,100]}]
A1324: 1321 | B1324: 3 | C1324: 3 | D1324: 2000 | E1324: =R[-9]C -> 61 | F1324: =R[-9]C -> 70 | G1324: 2 | H1324: 10000 | I1324: 110003 | J1324: 2 | K1324: [{5,10},{6,15},{13,10},{14,5},{15,10},{16,5},{20,1},{27,10},{28,10}] | L1324: =R[-1]C -> [{5,1113},{6,1113},{13,18},{14,37},{15,18},{16,37},{20,3},{27,18},{28,18}] | M1324: =R[-1]C -> [{0,1,[1,30]},{1,2,[11,40]},{2,5,[21,50]},{5,10,[31,60]},{10,20,[41,60]},{30,20,[51,70]},{50,10,[61,80]},{70,5,[71,80]},{100,2,[81,90]},{150,1,[91,100]}]
A1325: 1322 | B1325: 3 | C1325: 3 | D1325: 2000 | E1325: =R[-9]C -> 71 | F1325: =R[-9]C -> 80 | G1325: 2 | H1325: 10000 | I1325: 110003 | J1325: 2 | K1325: [{5,10},{6,15},{13,10},{14,5},{15,10},{16,5},{20,1},{27,10},{28,10}] | L1325: =R[-1]C -> [{5,1113},{6,1113},{13,18},{14,37},{15,18},{16,37},{20,3},{27,18},{28,18}] | M1325: =R[-1]C -> [{0,1,[1,30]},{1,2,[11,40]},{2,5,[21,50]},{5,10,[31,60]},{10,20,[41,60]},{30,20,[51,70]},{50,10,[61,80]},{70,5,[71,80]},{100,2,[81,90]},{150,1,[91,100]}]
A1326: 1323 | B1326: 3 | C1326: 3 | D1326: 2000 | E1326: =R[-9]C -> 81 | F1326: =R[-9]C -> 90 | G1326: 2 | H1326: 10000 | I1326: 110003 | J1326: 2 | K1326: [{5,10},{6,15},{13,10},{14,5},{15,10},{16,5},{20,1},{27,10},{28,10}] | L1326: =R[-1]C -> [{5,1113},{6,1113},{13,18},{14,37},{15,18},{16,37},{20,3},{27,18},{28,18}] | M1326: =R[-1]C -> [{0,1,[1,30]},{1,2,[11,40]},{2,5,[21,50]},{5,10,[31,60]},{10,20,[41,60]},{30,20,[51,70]},{50,10,[61,80]},{70,5,[71,80]},{100,2,[81,90]},{150,1,[91,100]}]
A1327: 1324 | B1327: 4 | C1327: 3 | D1327: 2000 | E1327: =R[-9]C -> 1 | F1327: =R[-9]C -> 10 | G1327: 3 | H1327: 15000 | I1327: 110003 | J1327: 3 | K1327: [{5,10},{6,15},{13,10},{14,5},{15,10},{16,5},{20,1},{27,10},{28,10}] | L1327: =R[-1]C -> [{5,1113},{6,1113},{13,18},{14,37},{15,18},{16,37},{20,3},{27,18},{28,18}] | M1327: =R[-1]C -> [{0,1,[1,30]},{1,2,[11,40]},{2,5,[21,50]},{5,10,[31,60]},{10,20,[41,60]},{30,20,[51,70]},{50,10,[61,80]},{70,5,[71,80]},{100,2,[81,90]},{150,1,[91,100]}]
A1328: 1325 | B1328: 4 | C1328: 3 | D1328: 2000 | E1328: =R[-9]C -> 11 | F1328: =R[-9]C -> 20 | G1328: 3 | H1328: 15000 | I1328: 110003 | J1328: 3 | K1328: [{5,10},{6,15},{13,10},{14,5},{15,10},{16,5},{20,1},{27,10},{28,10}] | L1328: =R[-1]C -> [{5,1113},{6,1113},{13,18},{14,37},{15,18},{16,37},{20,3},{27,18},{28,18}] | M1328: =R[-1]C -> [{0,1,[1,30]},{1,2,[11,40]},{2,5,[21,50]},{5,10,[31,60]},{10,20,[41,60]},{30,20,[51,70]},{50,10,[61,80]},{70,5,[71,80]},{100,2,[81,90]},{150,1,[91,100]}]
A1329: 1326 | B1329: 4 | C1329: 3 | D1329: 2000 | E1329: =R[-9]C -> 21 | F1329: =R[-9]C -> 30 | G1329: 3 | H1329: 15000 | I1329: 110003 | J1329: 3 | K1329: [{5,10},{6,15},{13,10},{14,5},{15,10},{16,5},{20,1},{27,10},{28,10}] | L1329: =R[-1]C -> [{5,1113},{6,1113},{13,18},{14,37},{15,18},{16,37},{20,3},{27,18},{28,18}] | M1329: =R[-1]C -> [{0,1,[1,30]},{1,2,[11,40]},{2,5,[21,50]},{5,10,[31,60]},{10,20,[41,60]},{30,20,[51,70]},{50,10,[61,80]},{70,5,[71,80]},{100,2,[81,90]},{150,1,[91,100]}]
A1330: 1327 | B1330: 4 | C1330: 3 | D1330: 2000 | E1330: =R[-9]C -> 31 | F1330: =R[-9]C -> 40 | G1330: 3 | H1330: 15000 | I1330: 110003 | J1330: 3 | K1330: [{5,10},{6,15},{13,10},{14,5},{15,10},{16,5},{20,1},{27,10},{28,10}] | L1330: =R[-1]C -> [{5,1113},{6,1113},{13,18},{14,37},{15,18},{16,37},{20,3},{27,18},{28,18}] | M1330: =R[-1]C -> [{0,1,[1,30]},{1,2,[11,40]},{2,5,[21,50]},{5,10,[31,60]},{10,20,[41,60]},{30,20,[51,70]},{50,10,[61,80]},{70,5,[71,80]},{100,2,[81,90]},{150,1,[91,100]}]
A1331: 1328 | B1331: 4 | C1331: 3 | D1331: 2000 | E1331: =R[-9]C -> 41 | F1331: =R[-9]C -> 50 | G1331: 3 | H1331: 15000 | I1331: 110003 | J1331: 3 | K1331: [{5,10},{6,15},{13,10},{14,5},{15,10},{16,5},{20,1},{27,10},{28,10}] | L1331: =R[-1]C -> [{5,1113},{6,1113},{13,18},{14,37},{15,18},{16,37},{20,3},{27,18},{28,18}] | M1331: =R[-1]C -> [{0,1,[1,30]},{1,2,[11,40]},{2,5,[21,50]},{5,10,[31,60]},{10,20,[41,60]},{30,20,[51,70]},{50,10,[61,80]},{70,5,[71,80]},{100,2,[81,90]},{150,1,[91,100]}]
A1332: 1329 | B1332: 4 | C1332: 3 | D1332: 2000 | E1332: =R[-9]C -> 51 | F1332: =R[-9]C -> 60 | G1332: 3 | H1332: 15000 | I1332: 110003 | J1332: 3 | K1332: [{5,10},{6,15},{13,10},{14,5},{15,10},{16,5},{20,1},{27,10},{28,10}] | L1332: =R[-1]C -> [{5,1113},{6,1113},{13,18},{14,37},{15,18},{16,37},{20,3},{27,18},{28,18}] | M1332: =R[-1]C -> [{0,1,[1,30]},{1,2,[11,40]},{2,5,[21,50]},{5,10,[31,60]},{10,20,[41,60]},{30,20,[51,70]},{50,10,[61,80]},{70,5,[71,80]},{100,2,[81,90]},{150,1,[91,100]}]
A1333: 1330 | B1333: 4 | C1333: 3 | D1333: 2000 | E1333: =R[-9]C -> 61 | F1333: =R[-9]C -> 70 | G1333: 3 | H1333: 15000 | I1333: 110003 | J1333: 3 | K1333: [{5,10},{6,15},{13,10},{14,5},{15,10},{16,5},{20,1},{27,10},{28,10}] | L1333: =R[-1]C -> [{5,1113},{6,1113},{13,18},{14,37},{15,18},{16,37},{20,3},{27,18},{28,18}] | M1333: =R[-1]C -> [{0,1,[1,30]},{1,2,[11,40]},{2,5,[21,50]},{5,10,[31,60]},{10,20,[41,60]},{30,20,[51,70]},{50,10,[61,80]},{70,5,[71,80]},{100,2,[81,90]},{150,1,[91,100]}]
A1334: 1331 | B1334: 4 | C1334: 3 | D1334: 2000 | E1334: =R[-9]C -> 71 | F1334: =R[-9]C -> 80 | G1334: 3 | H1334: 15000 | I1334: 110003 | J1334: 3 | K1334: [{5,10},{6,15},{13,10},{14,5},{15,10},{16,5},{20,1},{27,10},{28,10}] | L1334: =R[-1]C -> [{5,1113},{6,1113},{13,18},{14,37},{15,18},{16,37},{20,3},{27,18},{28,18}] | M1334: =R[-1]C -> [{0,1,[1,30]},{1,2,[11,40]},{2,5,[21,50]},{5,10,[31,60]},{10,20,[41,60]},{30,20,[51,70]},{50,10,[61,80]},{70,5,[71,80]},{100,2,[81,90]},{150,1,[91,100]}]
A1335: 1332 | B1335: 4 | C1335: 3 | D1335: 2000 | E1335: =R[-9]C -> 81 | F1335: =R[-9]C -> 90 | G1335: 3 | H1335: 15000 | I1335: 110003 | J1335: 3 | K1335: [{5,10},{6,15},{13,10},{14,5},{15,10},{16,5},{20,1},{27,10},{28,10}] | L1335: =R[-1]C -> [{5,1113},{6,1113},{13,18},{14,37},{15,18},{16,37},{20,3},{27,18},{28,18}] | M1335: =R[-1]C -> [{0,1,[1,30]},{1,2,[11,40]},{2,5,[21,50]},{5,10,[31,60]},{10,20,[41,60]},{30,20,[51,70]},{50,10,[61,80]},{70,5,[71,80]},{100,2,[81,90]},{150,1,[91,100]}]
A1336: 1333 | B1336: 5 | C1336: 3 | D1336: 2000 | E1336: =R[-9]C -> 1 | F1336: =R[-9]C -> 10 | G1336: 4 | H1336: 20000 | I1336: 110003 | J1336: 4 | K1336: [{5,10},{6,15},{13,10},{14,5},{15,10},{16,5},{20,1},{27,10},{28,10}] | L1336: =R[-1]C -> [{5,1113},{6,1113},{13,18},{14,37},{15,18},{16,37},{20,3},{27,18},{28,18}] | M1336: =R[-1]C -> [{0,1,[1,30]},{1,2,[11,40]},{2,5,[21,50]},{5,10,[31,60]},{10,20,[41,60]},{30,20,[51,70]},{50,10,[61,80]},{70,5,[71,80]},{100,2,[81,90]},{150,1,[91,100]}]
A1337: 1334 | B1337: 5 | C1337: 3 | D1337: 2000 | E1337: =R[-9]C -> 11 | F1337: =R[-9]C -> 20 | G1337: 4 | H1337: 20000 | I1337: 110003 | J1337: 4 | K1337: [{5,10},{6,15},{13,10},{14,5},{15,10},{16,5},{20,1},{27,10},{28,10}] | L1337: =R[-1]C -> [{5,1113},{6,1113},{13,18},{14,37},{15,18},{16,37},{20,3},{27,18},{28,18}] | M1337: =R[-1]C -> [{0,1,[1,30]},{1,2,[11,40]},{2,5,[21,50]},{5,10,[31,60]},{10,20,[41,60]},{30,20,[51,70]},{50,10,[61,80]},{70,5,[71,80]},{100,2,[81,90]},{150,1,[91,100]}]
A1338: 1335 | B1338: 5 | C1338: 3 | D1338: 2000 | E1338: =R[-9]C -> 21 | F1338: =R[-9]C -> 30 | G1338: 4 | H1338: 20000 | I1338: 110003 | J1338: 4 | K1338: [{5,10},{6,15},{13,10},{14,5},{15,10},{16,5},{20,1},{27,10},{28,10}] | L1338: =R[-1]C -> [{5,1113},{6,1113},{13,18},{14,37},{15,18},{16,37},{20,3},{27,18},{28,18}] | M1338: =R[-1]C -> [{0,1,[1,30]},{1,2,[11,40]},{2,5,[21,50]},{5,10,[31,60]},{10,20,[41,60]},{30,20,[51,70]},{50,10,[61,80]},{70,5,[71,80]},{100,2,[81,90]},{150,1,[91,100]}]
A1339: 1336 | B1339: 5 | C1339: 3 | D1339: 2000 | E1339: =R[-9]C -> 31 | F1339: =R[-9]C -> 40 | G1339: 4 | H1339: 20000 | I1339: 110003 | J1339: 4 | K1339: [{5,10},{6,15},{13,10},{14,5},{15,10},{16,5},{20,1},{27,10},{28,10}] | L1339: =R[-1]C -> [{5,1113},{6,1113},{13,18},{14,37},{15,18},{16,37},{20,3},{27,18},{28,18}] | M1339: =R[-1]C -> [{0,1,[1,30]},{1,2,[11,40]},{2,5,[21,50]},{5,10,[31,60]},{10,20,[41,60]},{30,20,[51,70]},{50,10,[61,80]},{70,5,[71,80]},{100,2,[81,90]},{150,1,[91,100]}]
A1340: 1337 | B1340: 5 | C1340: 3 | D1340: 2000 | E1340: =R[-9]C -> 41 | F1340: =R[-9]C -> 50 | G1340: 4 | H1340: 20000 | I1340: 110003 | J1340: 4 | K1340: [{5,10},{6,15},{13,10},{14,5},{15,10},{16,5},{20,1},{27,10},{28,10}] | L1340: =R[-1]C -> [{5,1113},{6,1113},{13,18},{14,37},{15,18},{16,37},{20,3},{27,18},{28,18}] | M1340: =R[-1]C -> [{0,1,[1,30]},{1,2,[11,40]},{2,5,[21,50]},{5,10,[31,60]},{10,20,[41,60]},{30,20,[51,70]},{50,10,[61,80]},{70,5,[71,80]},{100,2,[81,90]},{150,1,[91,100]}]
A1341: 1338 | B1341: 5 | C1341: 3 | D1341: 2000 | E1341: =R[-9]C -> 51 | F1341: =R[-9]C -> 60 | G1341: 4 | H1341: 20000 | I1341: 110003 | J1341: 4 | K1341: [{5,10},{6,15},{13,10},{14,5},{15,10},{16,5},{20,1},{27,10},{28,10}] | L1341: =R[-1]C -> [{5,1113},{6,1113},{13,18},{14,37},{15,18},{16,37},{20,3},{27,18},{28,18}] | M1341: =R[-1]C -> [{0,1,[1,30]},{1,2,[11,40]},{2,5,[21,50]},{5,10,[31,60]},{10,20,[41,60]},{30,20,[51,70]},{50,10,[61,80]},{70,5,[71,80]},{100,2,[81,90]},{150,1,[91,100]}]
A1342: 1339 | B1342: 5 | C1342: 3 | D1342: 2000 | E1342: =R[-9]C -> 61 | F1342: =R[-9]C -> 70 | G1342: 4 | H1342: 20000 | I1342: 110003 | J1342: 4 | K1342: [{5,10},{6,15},{13,10},{14,5},{15,10},{16,5},{20,1},{27,10},{28,10}] | L1342: =R[-1]C -> [{5,1113},{6,1113},{13,18},{14,37},{15,18},{16,37},{20,3},{27,18},{28,18}] | M1342: =R[-1]C -> [{0,1,[1,30]},{1,2,[11,40]},{2,5,[21,50]},{5,10,[31,60]},{10,20,[41,60]},{30,20,[51,70]},{50,10,[61,80]},{70,5,[71,80]},{100,2,[81,90]},{150,1,[91,100]}]
A1343: 1340 | B1343: 5 | C1343: 3 | D1343: 2000 | E1343: =R[-9]C -> 71 | F1343: =R[-9]C -> 80 | G1343: 4 | H1343: 20000 | I1343: 110003 | J1343: 4 | K1343: [{5,10},{6,15},{13,10},{14,5},{15,10},{16,5},{20,1},{27,10},{28,10}] | L1343: =R[-1]C -> [{5,1113},{6,1113},{13,18},{14,37},{15,18},{16,37},{20,3},{27,18},{28,18}] | M1343: =R[-1]C -> [{0,1,[1,30]},{1,2,[11,40]},{2,5,[21,50]},{5,10,[31,60]},{10,20,[41,60]},{30,20,[51,70]},{50,10,[61,80]},{70,5,[71,80]},{100,2,[81,90]},{150,1,[91,100]}]
A1344: 1341 | B1344: 5 | C1344: 3 | D1344: 2000 | E1344: =R[-9]C -> 81 | F1344: =R[-9]C -> 90 | G1344: 4 | H1344: 20000 | I1344: 110003 | J1344: 4 | K1344: [{5,10},{6,15},{13,10},{14,5},{15,10},{16,5},{20,1},{27,10},{28,10}] | L1344: =R[-1]C -> [{5,1113},{6,1113},{13,18},{14,37},{15,18},{16,37},{20,3},{27,18},{28,18}] | M1344: =R[-1]C -> [{0,1,[1,30]},{1,2,[11,40]},{2,5,[21,50]},{5,10,[31,60]},{10,20,[41,60]},{30,20,[51,70]},{50,10,[61,80]},{70,5,[71,80]},{100,2,[81,90]},{150,1,[91,100]}]
A1345: 1342 | B1345: 6 | C1345: 3 | D1345: 2000 | E1345: =R[-9]C -> 1 | F1345: =R[-9]C -> 10 | G1345: 5 | H1345: 20000 | I1345: 110003 | J1345: 5 | K1345: [{5,10},{6,15},{13,10},{14,5},{15,10},{16,5},{20,1},{27,10},{28,10}] | L1345: =R[-1]C -> [{5,1113},{6,1113},{13,18},{14,37},{15,18},{16,37},{20,3},{27,18},{28,18}] | M1345: =R[-1]C -> [{0,1,[1,30]},{1,2,[11,40]},{2,5,[21,50]},{5,10,[31,60]},{10,20,[41,60]},{30,20,[51,70]},{50,10,[61,80]},{70,5,[71,80]},{100,2,[81,90]},{150,1,[91,100]}]
A1346: 1343 | B1346: 6 | C1346: 3 | D1346: 2000 | E1346: =R[-9]C -> 11 | F1346: =R[-9]C -> 20 | G1346: 5 | H1346: 20000 | I1346: 110003 | J1346: 5 | K1346: [{5,10},{6,15},{13,10},{14,5},{15,10},{16,5},{20,1},{27,10},{28,10}] | L1346: =R[-1]C -> [{5,1113},{6,1113},{13,18},{14,37},{15,18},{16,37},{20,3},{27,18},{28,18}] | M1346: =R[-1]C -> [{0,1,[1,30]},{1,2,[11,40]},{2,5,[21,50]},{5,10,[31,60]},{10,20,[41,60]},{30,20,[51,70]},{50,10,[61,80]},{70,5,[71,80]},{100,2,[81,90]},{150,1,[91,100]}]
A1347: 1344 | B1347: 6 | C1347: 3 | D1347: 2000 | E1347: =R[-9]C -> 21 | F1347: =R[-9]C -> 30 | G1347: 5 | H1347: 20000 | I1347: 110003 | J1347: 5 | K1347: [{5,10},{6,15},{13,10},{14,5},{15,10},{16,5},{20,1},{27,10},{28,10}] | L1347: =R[-1]C -> [{5,1113},{6,1113},{13,18},{14,37},{15,18},{16,37},{20,3},{27,18},{28,18}] | M1347: =R[-1]C -> [{0,1,[1,30]},{1,2,[11,40]},{2,5,[21,50]},{5,10,[31,60]},{10,20,[41,60]},{30,20,[51,70]},{50,10,[61,80]},{70,5,[71,80]},{100,2,[81,90]},{150,1,[91,100]}]
A1348: 1345 | B1348: 6 | C1348: 3 | D1348: 2000 | E1348: =R[-9]C -> 31 | F1348: =R[-9]C -> 40 | G1348: 5 | H1348: 20000 | I1348: 110003 | J1348: 5 | K1348: [{5,10},{6,15},{13,10},{14,5},{15,10},{16,5},{20,1},{27,10},{28,10}] | L1348: =R[-1]C -> [{5,1113},{6,1113},{13,18},{14,37},{15,18},{16,37},{20,3},{27,18},{28,18}] | M1348: =R[-1]C -> [{0,1,[1,30]},{1,2,[11,40]},{2,5,[21,50]},{5,10,[31,60]},{10,20,[41,60]},{30,20,[51,70]},{50,10,[61,80]},{70,5,[71,80]},{100,2,[81,90]},{150,1,[91,100]}]
A1349: 1346 | B1349: 6 | C1349: 3 | D1349: 2000 | E1349: =R[-9]C -> 41 | F1349: =R[-9]C -> 50 | G1349: 5 | H1349: 20000 | I1349: 110003 | J1349: 5 | K1349: [{5,10},{6,15},{13,10},{14,5},{15,10},{16,5},{20,1},{27,10},{28,10}] | L1349: =R[-1]C -> [{5,1113},{6,1113},{13,18},{14,37},{15,18},{16,37},{20,3},{27,18},{28,18}] | M1349: =R[-1]C -> [{0,1,[1,30]},{1,2,[11,40]},{2,5,[21,50]},{5,10,[31,60]},{10,20,[41,60]},{30,20,[51,70]},{50,10,[61,80]},{70,5,[71,80]},{100,2,[81,90]},{150,1,[91,100]}]
A1350: 1347 | B1350: 6 | C1350: 3 | D1350: 2000 | E1350: =R[-9]C -> 51 | F1350: =R[-9]C -> 60 | G1350: 5 | H1350: 20000 | I1350: 110003 | J1350: 5 | K1350: [{5,10},{6,15},{13,10},{14,5},{15,10},{16,5},{20,1},{27,10},{28,10}] | L1350: =R[-1]C -> [{5,1113},{6,1113},{13,18},{14,37},{15,18},{16,37},{20,3},{27,18},{28,18}] | M1350: =R[-1]C -> [{0,1,[1,30]},{1,2,[11,40]},{2,5,[21,50]},{5,10,[31,60]},{10,20,[41,60]},{30,20,[51,70]},{50,10,[61,80]},{70,5,[71,80]},{100,2,[81,90]},{150,1,[91,100]}]
A1351: 1348 | B1351: 6 | C1351: 3 | D1351: 2000 | E1351: =R[-9]C -> 61 | F1351: =R[-9]C -> 70 | G1351: 5 | H1351: 20000 | I1351: 110003 | J1351: 5 | K1351: [{5,10},{6,15},{13,10},{14,5},{15,10},{16,5},{20,1},{27,10},{28,10}] | L1351: =R[-1]C -> [{5,1113},{6,1113},{13,18},{14,37},{15,18},{16,37},{20,3},{27,18},{28,18}] | M1351: =R[-1]C -> [{0,1,[1,30]},{1,2,[11,40]},{2,5,[21,50]},{5,10,[31,60]},{10,20,[41,60]},{30,20,[51,70]},{50,10,[61,80]},{70,5,[71,80]},{100,2,[81,90]},{150,1,[91,100]}]
A1352: 1349 | B1352: 6 | C1352: 3 | D1352: 2000 | E1352: =R[-9]C -> 71 | F1352: =R[-9]C -> 80 | G1352: 5 | H1352: 20000 | I1352: 110003 | J1352: 5 | K1352: [{5,10},{6,15},{13,10},{14,5},{15,10},{16,5},{20,1},{27,10},{28,10}] | L1352: =R[-1]C -> [{5,1113},{6,1113},{13,18},{14,37},{15,18},{16,37},{20,3},{27,18},{28,18}] | M1352: =R[-1]C -> [{0,1,[1,30]},{1,2,[11,40]},{2,5,[21,50]},{5,10,[31,60]},{10,20,[41,60]},{30,20,[51,70]},{50,10,[61,80]},{70,5,[71,80]},{100,2,[81,90]},{150,1,[91,100]}]
A1353: 1350 | B1353: 6 | C1353: 3 | D1353: 2000 | E1353: =R[-9]C -> 81 | F1353: =R[-9]C -> 90 | G1353: 5 | H1353: 20000 | I1353: 110003 | J1353: 5 | K1353: [{5,10},{6,15},{13,10},{14,5},{15,10},{16,5},{20,1},{27,10},{28,10}] | L1353: =R[-1]C -> [{5,1113},{6,1113},{13,18},{14,37},{15,18},{16,37},{20,3},{27,18},{28,18}] | M1353: =R[-1]C -> [{0,1,[1,30]},{1,2,[11,40]},{2,5,[21,50]},{5,10,[31,60]},{10,20,[41,60]},{30,20,[51,70]},{50,10,[61,80]},{70,5,[71,80]},{100,2,[81,90]},{150,1,[91,100]}]
A1354: 1351 | B1354: 2 | C1354: 8 | D1354: 2000 | E1354: =R[-18]C -> 1 | F1354: =R[-18]C -> 10 | G1354: 1 | H1354: 5000 | I1354: 110003 | J1354: 1 | K1354: [{5,10},{6,15},{13,10},{14,5},{15,10},{16,5},{20,1},{27,10},{28,10}] | L1354: =R[-10]C -> [{5,1113},{6,1113},{13,18},{14,37},{15,18},{16,37},{20,3},{27,18},{28,18}] | M1354: =R[-10]C -> [{0,1,[1,30]},{1,2,[11,40]},{2,5,[21,50]},{5,10,[31,60]},{10,20,[41,60]},{30,20,[51,70]},{50,10,[61,80]},{70,5,[71,80]},{100,2,[81,90]},{150,1,[91,100]}]
A1355: 1352 | B1355: 2 | C1355: 8 | D1355: 2000 | E1355: =R[-18]C -> 11 | F1355: =R[-18]C -> 20 | G1355: 1 | H1355: 5000 | I1355: 110003 | J1355: 1 | K1355: [{5,10},{6,15},{13,10},{14,5},{15,10},{16,5},{20,1},{27,10},{28,10}] | L1355: =R[-1]C -> [{5,1113},{6,1113},{13,18},{14,37},{15,18},{16,37},{20,3},{27,18},{28,18}] | M1355: =R[-1]C -> [{0,1,[1,30]},{1,2,[11,40]},{2,5,[21,50]},{5,10,[31,60]},{10,20,[41,60]},{30,20,[51,70]},{50,10,[61,80]},{70,5,[71,80]},{100,2,[81,90]},{150,1,[91,100]}]
A1356: 1353 | B1356: 2 | C1356: 8 | D1356: 2000 | E1356: =R[-18]C -> 21 | F1356: =R[-18]C -> 30 | G1356: 1 | H1356: 5000 | I1356: 110003 | J1356: 1 | K1356: [{5,10},{6,15},{13,10},{14,5},{15,10},{16,5},{20,1},{27,10},{28,10}] | L1356: =R[-1]C -> [{5,1113},{6,1113},{13,18},{14,37},{15,18},{16,37},{20,3},{27,18},{28,18}] | M1356: =R[-1]C -> [{0,1,[1,30]},{1,2,[11,40]},{2,5,[21,50]},{5,10,[31,60]},{10,20,[41,60]},{30,20,[51,70]},{50,10,[61,80]},{70,5,[71,80]},{100,2,[81,90]},{150,1,[91,100]}]
A1357: 1354 | B1357: 2 | C1357: 8 | D1357: 2000 | E1357: =R[-18]C -> 31 | F1357: =R[-18]C -> 40 | G1357: 1 | H1357: 5000 | I1357: 110003 | J1357: 1 | K1357: [{5,10},{6,15},{13,10},{14,5},{15,10},{16,5},{20,1},{27,10},{28,10}] | L1357: =R[-1]C -> [{5,1113},{6,1113},{13,18},{14,37},{15,18},{16,37},{20,3},{27,18},{28,18}] | M1357: =R[-1]C -> [{0,1,[1,30]},{1,2,[11,40]},{2,5,[21,50]},{5,10,[31,60]},{10,20,[41,60]},{30,20,[51,70]},{50,10,[61,80]},{70,5,[71,80]},{100,2,[81,90]},{150,1,[91,100]}]
A1358: 1355 | B1358: 2 | C1358: 8 | D1358: 2000 | E1358: =R[-18]C -> 41 | F1358: =R[-18]C -> 50 | G1358: 1 | H1358: 5000 | I1358: 110003 | J1358: 1 | K1358: [{5,10},{6,15},{13,10},{14,5},{15,10},{16,5},{20,1},{27,10},{28,10}] | L1358: =R[-1]C -> [{5,1113},{6,1113},{13,18},{14,37},{15,18},{16,37},{20,3},{27,18},{28,18}] | M1358: =R[-1]C -> [{0,1,[1,30]},{1,2,[11,40]},{2,5,[21,50]},{5,10,[31,60]},{10,20,[41,60]},{30,20,[51,70]},{50,10,[61,80]},{70,5,[71,80]},{100,2,[81,90]},{150,1,[91,100]}]
A1359: 1356 | B1359: 2 | C1359: 8 | D1359: 2000 | E1359: =R[-18]C -> 51 | F1359: =R[-18]C -> 60 | G1359: 1 | H1359: 5000 | I1359: 110003 | J1359: 1 | K1359: [{5,10},{6,15},{13,10},{14,5},{15,10},{16,5},{20,1},{27,10},{28,10}] | L1359: =R[-1]C -> [{5,1113},{6,1113},{13,18},{14,37},{15,18},{16,37},{20,3},{27,18},{28,18}] | M1359: =R[-1]C -> [{0,1,[1,30]},{1,2,[11,40]},{2,5,[21,50]},{5,10,[31,60]},{10,20,[41,60]},{30,20,[51,70]},{50,10,[61,80]},{70,5,[71,80]},{100,2,[81,90]},{150,1,[91,100]}]
A1360: 1357 | B1360: 2 | C1360: 8 | D1360: 2000 | E1360: =R[-18]C -> 61 | F1360: =R[-18]C -> 70 | G1360: 1 | H1360: 5000 | I1360: 110003 | J1360: 1 | K1360: [{5,10},{6,15},{13,10},{14,5},{15,10},{16,5},{20,1},{27,10},{28,10}] | L1360: =R[-1]C -> [{5,1113},{6,1113},{13,18},{14,37},{15,18},{16,37},{20,3},{27,18},{28,18}] | M1360: =R[-1]C -> [{0,1,[1,30]},{1,2,[11,40]},{2,5,[21,50]},{5,10,[31,60]},{10,20,[41,60]},{30,20,[51,70]},{50,10,[61,80]},{70,5,[71,80]},{100,2,[81,90]},{150,1,[91,100]}]
A1361: 1358 | B1361: 2 | C1361: 8 | D1361: 2000 | E1361: =R[-18]C -> 71 | F1361: =R[-18]C -> 80 | G1361: 1 | H1361: 5000 | I1361: 110003 | J1361: 1 | K1361: [{5,10},{6,15},{13,10},{14,5},{15,10},{16,5},{20,1},{27,10},{28,10}] | L1361: =R[-1]C -> [{5,1113},{6,1113},{13,18},{14,37},{15,18},{16,37},{20,3},{27,18},{28,18}] | M1361: =R[-1]C -> [{0,1,[1,30]},{1,2,[11,40]},{2,5,[21,50]},{5,10,[31,60]},{10,20,[41,60]},{30,20,[51,70]},{50,10,[61,80]},{70,5,[71,80]},{100,2,[81,90]},{150,1,[91,100]}]
A1362: 1359 | B1362: 2 | C1362: 8 | D1362: 2000 | E1362: =R[-18]C -> 81 | F1362: =R[-18]C -> 90 | G1362: 1 | H1362: 5000 | I1362: 110003 | J1362: 1 | K1362: [{5,10},{6,15},{13,10},{14,5},{15,10},{16,5},{20,1},{27,10},{28,10}] | L1362: =R[-1]C -> [{5,1113},{6,1113},{13,18},{14,37},{15,18},{16,37},{20,3},{27,18},{28,18}] | M1362: =R[-1]C -> [{0,1,[1,30]},{1,2,[11,40]},{2,5,[21,50]},{5,10,[31,60]},{10,20,[41,60]},{30,20,[51,70]},{50,10,[61,80]},{70,5,[71,80]},{100,2,[81,90]},{150,1,[91,100]}]
A1363: 1360 | B1363: 3 | C1363: 8 | D1363: 2000 | E1363: =R[-9]C -> 1 | F1363: =R[-9]C -> 10 | G1363: 2 | H1363: 10000 | I1363: 110003 | J1363: 2 | K1363: [{5,10},{6,15},{13,10},{14,5},{15,10},{16,5},{20,1},{27,10},{28,10}] | L1363: =R[-1]C -> [{5,1113},{6,1113},{13,18},{14,37},{15,18},{16,37},{20,3},{27,18},{28,18}] | M1363: =R[-1]C -> [{0,1,[1,30]},{1,2,[11,40]},{2,5,[21,50]},{5,10,[31,60]},{10,20,[41,60]},{30,20,[51,70]},{50,10,[61,80]},{70,5,[71,80]},{100,2,[81,90]},{150,1,[91,100]}]
A1364: 1361 | B1364: 3 | C1364: 8 | D1364: 2000 | E1364: =R[-9]C -> 11 | F1364: =R[-9]C -> 20 | G1364: 2 | H1364: 10000 | I1364: 110003 | J1364: 2 | K1364: [{5,10},{6,15},{13,10},{14,5},{15,10},{16,5},{20,1},{27,10},{28,10}] | L1364: =R[-1]C -> [{5,1113},{6,1113},{13,18},{14,37},{15,18},{16,37},{20,3},{27,18},{28,18}] | M1364: =R[-1]C -> [{0,1,[1,30]},{1,2,[11,40]},{2,5,[21,50]},{5,10,[31,60]},{10,20,[41,60]},{30,20,[51,70]},{50,10,[61,80]},{70,5,[71,80]},{100,2,[81,90]},{150,1,[91,100]}]
A1365: 1362 | B1365: 3 | C1365: 8 | D1365: 2000 | E1365: =R[-9]C -> 21 | F1365: =R[-9]C -> 30 | G1365: 2 | H1365: 10000 | I1365: 110003 | J1365: 2 | K1365: [{5,10},{6,15},{13,10},{14,5},{15,10},{16,5},{20,1},{27,10},{28,10}] | L1365: =R[-1]C -> [{5,1113},{6,1113},{13,18},{14,37},{15,18},{16,37},{20,3},{27,18},{28,18}] | M1365: =R[-1]C -> [{0,1,[1,30]},{1,2,[11,40]},{2,5,[21,50]},{5,10,[31,60]},{10,20,[41,60]},{30,20,[51,70]},{50,10,[61,80]},{70,5,[71,80]},{100,2,[81,90]},{150,1,[91,100]}]
A1366: 1363 | B1366: 3 | C1366: 8 | D1366: 2000 | E1366: =R[-9]C -> 31 | F1366: =R[-9]C -> 40 | G1366: 2 | H1366: 10000 | I1366: 110003 | J1366: 2 | K1366: [{5,10},{6,15},{13,10},{14,5},{15,10},{16,5},{20,1},{27,10},{28,10}] | L1366: =R[-1]C -> [{5,1113},{6,1113},{13,18},{14,37},{15,18},{16,37},{20,3},{27,18},{28,18}] | M1366: =R[-1]C -> [{0,1,[1,30]},{1,2,[11,40]},{2,5,[21,50]},{5,10,[31,60]},{10,20,[41,60]},{30,20,[51,70]},{50,10,[61,80]},{70,5,[71,80]},{100,2,[81,90]},{150,1,[91,100]}]
A1367: 1364 | B1367: 3 | C1367: 8 | D1367: 2000 | E1367: =R[-9]C -> 41 | F1367: =R[-9]C -> 50 | G1367: 2 | H1367: 10000 | I1367: 110003 | J1367: 2 | K1367: [{5,10},{6,15},{13,10},{14,5},{15,10},{16,5},{20,1},{27,10},{28,10}] | L1367: =R[-1]C -> [{5,1113},{6,1113},{13,18},{14,37},{15,18},{16,37},{20,3},{27,18},{28,18}] | M1367: =R[-1]C -> [{0,1,[1,30]},{1,2,[11,40]},{2,5,[21,50]},{5,10,[31,60]},{10,20,[41,60]},{30,20,[51,70]},{50,10,[61,80]},{70,5,[71,80]},{100,2,[81,90]},{150,1,[91,100]}]
A1368: 1365 | B1368: 3 | C1368: 8 | D1368: 2000 | E1368: =R[-9]C -> 51 | F1368: =R[-9]C -> 60 | G1368: 2 | H1368: 10000 | I1368: 110003 | J1368: 2 | K1368: [{5,10},{6,15},{13,10},{14,5},{15,10},{16,5},{20,1},{27,10},{28,10}] | L1368: =R[-1]C -> [{5,1113},{6,1113},{13,18},{14,37},{15,18},{16,37},{20,3},{27,18},{28,18}] | M1368: =R[-1]C -> [{0,1,[1,30]},{1,2,[11,40]},{2,5,[21,50]},{5,10,[31,60]},{10,20,[41,60]},{30,20,[51,70]},{50,10,[61,80]},{70,5,[71,80]},{100,2,[81,90]},{150,1,[91,100]}]
A1369: 1366 | B1369: 3 | C1369: 8 | D1369: 2000 | E1369: =R[-9]C -> 61 | F1369: =R[-9]C -> 70 | G1369: 2 | H1369: 10000 | I1369: 110003 | J1369: 2 | K1369: [{5,10},{6,15},{13,10},{14,5},{15,10},{16,5},{20,1},{27,10},{28,10}] | L1369: =R[-1]C -> [{5,1113},{6,1113},{13,18},{14,37},{15,18},{16,37},{20,3},{27,18},{28,18}] | M1369: =R[-1]C -> [{0,1,[1,30]},{1,2,[11,40]},{2,5,[21,50]},{5,10,[31,60]},{10,20,[41,60]},{30,20,[51,70]},{50,10,[61,80]},{70,5,[71,80]},{100,2,[81,90]},{150,1,[91,100]}]
A1370: 1367 | B1370: 3 | C1370: 8 | D1370: 2000 | E1370: =R[-9]C -> 71 | F1370: =R[-9]C -> 80 | G1370: 2 | H1370: 10000 | I1370: 110003 | J1370: 2 | K1370: [{5,10},{6,15},{13,10},{14,5},{15,10},{16,5},{20,1},{27,10},{28,10}] | L1370: =R[-1]C -> [{5,1113},{6,1113},{13,18},{14,37},{15,18},{16,37},{20,3},{27,18},{28,18}] | M1370: =R[-1]C -> [{0,1,[1,30]},{1,2,[11,40]},{2,5,[21,50]},{5,10,[31,60]},{10,20,[41,60]},{30,20,[51,70]},{50,10,[61,80]},{70,5,[71,80]},{100,2,[81,90]},{150,1,[91,100]}]
A1371: 1368 | B1371: 3 | C1371: 8 | D1371: 2000 | E1371: =R[-9]C -> 81 | F1371: =R[-9]C -> 90 | G1371: 2 | H1371: 10000 | I1371: 110003 | J1371: 2 | K1371: [{5,10},{6,15},{13,10},{14,5},{15,10},{16,5},{20,1},{27,10},{28,10}] | L1371: =R[-1]C -> [{5,1113},{6,1113},{13,18},{14,37},{15,18},{16,37},{20,3},{27,18},{28,18}] | M1371: =R[-1]C -> [{0,1,[1,30]},{1,2,[11,40]},{2,5,[21,50]},{5,10,[31,60]},{10,20,[41,60]},{30,20,[51,70]},{50,10,[61,80]},{70,5,[71,80]},{100,2,[81,90]},{150,1,[91,100]}]
A1372: 1369 | B1372: 4 | C1372: 8 | D1372: 2000 | E1372: =R[-9]C -> 1 | F1372: =R[-9]C -> 10 | G1372: 3 | H1372: 15000 | I1372: 110003 | J1372: 3 | K1372: [{5,10},{6,15},{13,10},{14,5},{15,10},{16,5},{20,1},{27,10},{28,10}] | L1372: =R[-1]C -> [{5,1113},{6,1113},{13,18},{14,37},{15,18},{16,37},{20,3},{27,18},{28,18}] | M1372: =R[-1]C -> [{0,1,[1,30]},{1,2,[11,40]},{2,5,[21,50]},{5,10,[31,60]},{10,20,[41,60]},{30,20,[51,70]},{50,10,[61,80]},{70,5,[71,80]},{100,2,[81,90]},{150,1,[91,100]}]
A1373: 1370 | B1373: 4 | C1373: 8 | D1373: 2000 | E1373: =R[-9]C -> 11 | F1373: =R[-9]C -> 20 | G1373: 3 | H1373: 15000 | I1373: 110003 | J1373: 3 | K1373: [{5,10},{6,15},{13,10},{14,5},{15,10},{16,5},{20,1},{27,10},{28,10}] | L1373: =R[-1]C -> [{5,1113},{6,1113},{13,18},{14,37},{15,18},{16,37},{20,3},{27,18},{28,18}] | M1373: =R[-1]C -> [{0,1,[1,30]},{1,2,[11,40]},{2,5,[21,50]},{5,10,[31,60]},{10,20,[41,60]},{30,20,[51,70]},{50,10,[61,80]},{70,5,[71,80]},{100,2,[81,90]},{150,1,[91,100]}]
A1374: 1371 | B1374: 4 | C1374: 8 | D1374: 2000 | E1374: =R[-9]C -> 21 | F1374: =R[-9]C -> 30 | G1374: 3 | H1374: 15000 | I1374: 110003 | J1374: 3 | K1374: [{5,10},{6,15},{13,10},{14,5},{15,10},{16,5},{20,1},{27,10},{28,10}] | L1374: =R[-1]C -> [{5,1113},{6,1113},{13,18},{14,37},{15,18},{16,37},{20,3},{27,18},{28,18}] | M1374: =R[-1]C -> [{0,1,[1,30]},{1,2,[11,40]},{2,5,[21,50]},{5,10,[31,60]},{10,20,[41,60]},{30,20,[51,70]},{50,10,[61,80]},{70,5,[71,80]},{100,2,[81,90]},{150,1,[91,100]}]
A1375: 1372 | B1375: 4 | C1375: 8 | D1375: 2000 | E1375: =R[-9]C -> 31 | F1375: =R[-9]C -> 40 | G1375: 3 | H1375: 15000 | I1375: 110003 | J1375: 3 | K1375: [{5,10},{6,15},{13,10},{14,5},{15,10},{16,5},{20,1},{27,10},{28,10}] | L1375: =R[-1]C -> [{5,1113},{6,1113},{13,18},{14,37},{15,18},{16,37},{20,3},{27,18},{28,18}] | M1375: =R[-1]C -> [{0,1,[1,30]},{1,2,[11,40]},{2,5,[21,50]},{5,10,[31,60]},{10,20,[41,60]},{30,20,[51,70]},{50,10,[61,80]},{70,5,[71,80]},{100,2,[81,90]},{150,1,[91,100]}]
A1376: 1373 | B1376: 4 | C1376: 8 | D1376: 2000 | E1376: =R[-9]C -> 41 | F1376: =R[-9]C -> 50 | G1376: 3 | H1376: 15000 | I1376: 110003 | J1376: 3 | K1376: [{5,10},{6,15},{13,10},{14,5},{15,10},{16,5},{20,1},{27,10},{28,10}] | L1376: =R[-1]C -> [{5,1113},{6,1113},{13,18},{14,37},{15,18},{16,37},{20,3},{27,18},{28,18}] | M1376: =R[-1]C -> [{0,1,[1,30]},{1,2,[11,40]},{2,5,[21,50]},{5,10,[31,60]},{10,20,[41,60]},{30,20,[51,70]},{50,10,[61,80]},{70,5,[71,80]},{100,2,[81,90]},{150,1,[91,100]}]
A1377: 1374 | B1377: 4 | C1377: 8 | D1377: 2000 | E1377: =R[-9]C -> 51 | F1377: =R[-9]C -> 60 | G1377: 3 | H1377: 15000 | I1377: 110003 | J1377: 3 | K1377: [{5,10},{6,15},{13,10},{14,5},{15,10},{16,5},{20,1},{27,10},{28,10}] | L1377: =R[-1]C -> [{5,1113},{6,1113},{13,18},{14,37},{15,18},{16,37},{20,3},{27,18},{28,18}] | M1377: =R[-1]C -> [{0,1,[1,30]},{1,2,[11,40]},{2,5,[21,50]},{5,10,[31,60]},{10,20,[41,60]},{30,20,[51,70]},{50,10,[61,80]},{70,5,[71,80]},{100,2,[81,90]},{150,1,[91,100]}]
A1378: 1375 | B1378: 4 | C1378: 8 | D1378: 2000 | E1378: =R[-9]C -> 61 | F1378: =R[-9]C -> 70 | G1378: 3 | H1378: 15000 | I1378: 110003 | J1378: 3 | K1378: [{5,10},{6,15},{13,10},{14,5},{15,10},{16,5},{20,1},{27,10},{28,10}] | L1378: =R[-1]C -> [{5,1113},{6,1113},{13,18},{14,37},{15,18},{16,37},{20,3},{27,18},{28,18}] | M1378: =R[-1]C -> [{0,1,[1,30]},{1,2,[11,40]},{2,5,[21,50]},{5,10,[31,60]},{10,20,[41,60]},{30,20,[51,70]},{50,10,[61,80]},{70,5,[71,80]},{100,2,[81,90]},{150,1,[91,100]}]
A1379: 1376 | B1379: 4 | C1379: 8 | D1379: 2000 | E1379: =R[-9]C -> 71 | F1379: =R[-9]C -> 80 | G1379: 3 | H1379: 15000 | I1379: 110003 | J1379: 3 | K1379: [{5,10},{6,15},{13,10},{14,5},{15,10},{16,5},{20,1},{27,10},{28,10}] | L1379: =R[-1]C -> [{5,1113},{6,1113},{13,18},{14,37},{15,18},{16,37},{20,3},{27,18},{28,18}] | M1379: =R[-1]C -> [{0,1,[1,30]},{1,2,[11,40]},{2,5,[21,50]},{5,10,[31,60]},{10,20,[41,60]},{30,20,[51,70]},{50,10,[61,80]},{70,5,[71,80]},{100,2,[81,90]},{150,1,[91,100]}]
A1380: 1377 | B1380: 4 | C1380: 8 | D1380: 2000 | E1380: =R[-9]C -> 81 | F1380: =R[-9]C -> 90 | G1380: 3 | H1380: 15000 | I1380: 110003 | J1380: 3 | K1380: [{5,10},{6,15},{13,10},{14,5},{15,10},{16,5},{20,1},{27,10},{28,10}] | L1380: =R[-1]C -> [{5,1113},{6,1113},{13,18},{14,37},{15,18},{16,37},{20,3},{27,18},{28,18}] | M1380: =R[-1]C -> [{0,1,[1,30]},{1,2,[11,40]},{2,5,[21,50]},{5,10,[31,60]},{10,20,[41,60]},{30,20,[51,70]},{50,10,[61,80]},{70,5,[71,80]},{100,2,[81,90]},{150,1,[91,100]}]
A1381: 1378 | B1381: 5 | C1381: 8 | D1381: 2000 | E1381: =R[-9]C -> 1 | F1381: =R[-9]C -> 10 | G1381: 4 | H1381: 20000 | I1381: 110003 | J1381: 4 | K1381: [{5,10},{6,15},{13,10},{14,5},{15,10},{16,5},{20,1},{27,10},{28,10}] | L1381: =R[-1]C -> [{5,1113},{6,1113},{13,18},{14,37},{15,18},{16,37},{20,3},{27,18},{28,18}] | M1381: =R[-1]C -> [{0,1,[1,30]},{1,2,[11,40]},{2,5,[21,50]},{5,10,[31,60]},{10,20,[41,60]},{30,20,[51,70]},{50,10,[61,80]},{70,5,[71,80]},{100,2,[81,90]},{150,1,[91,100]}]
A1382: 1379 | B1382: 5 | C1382: 8 | D1382: 2000 | E1382: =R[-9]C -> 11 | F1382: =R[-9]C -> 20 | G1382: 4 | H1382: 20000 | I1382: 110003 | J1382: 4 | K1382: [{5,10},{6,15},{13,10},{14,5},{15,10},{16,5},{20,1},{27,10},{28,10}] | L1382: =R[-1]C -> [{5,1113},{6,1113},{13,18},{14,37},{15,18},{16,37},{20,3},{27,18},{28,18}] | M1382: =R[-1]C -> [{0,1,[1,30]},{1,2,[11,40]},{2,5,[21,50]},{5,10,[31,60]},{10,20,[41,60]},{30,20,[51,70]},{50,10,[61,80]},{70,5,[71,80]},{100,2,[81,90]},{150,1,[91,100]}]
A1383: 1380 | B1383: 5 | C1383: 8 | D1383: 2000 | E1383: =R[-9]C -> 21 | F1383: =R[-9]C -> 30 | G1383: 4 | H1383: 20000 | I1383: 110003 | J1383: 4 | K1383: [{5,10},{6,15},{13,10},{14,5},{15,10},{16,5},{20,1},{27,10},{28,10}] | L1383: =R[-1]C -> [{5,1113},{6,1113},{13,18},{14,37},{15,18},{16,37},{20,3},{27,18},{28,18}] | M1383: =R[-1]C -> [{0,1,[1,30]},{1,2,[11,40]},{2,5,[21,50]},{5,10,[31,60]},{10,20,[41,60]},{30,20,[51,70]},{50,10,[61,80]},{70,5,[71,80]},{100,2,[81,90]},{150,1,[91,100]}]
A1384: 1381 | B1384: 5 | C1384: 8 | D1384: 2000 | E1384: =R[-9]C -> 31 | F1384: =R[-9]C -> 40 | G1384: 4 | H1384: 20000 | I1384: 110003 | J1384: 4 | K1384: [{5,10},{6,15},{13,10},{14,5},{15,10},{16,5},{20,1},{27,10},{28,10}] | L1384: =R[-1]C -> [{5,1113},{6,1113},{13,18},{14,37},{15,18},{16,37},{20,3},{27,18},{28,18}] | M1384: =R[-1]C -> [{0,1,[1,30]},{1,2,[11,40]},{2,5,[21,50]},{5,10,[31,60]},{10,20,[41,60]},{30,20,[51,70]},{50,10,[61,80]},{70,5,[71,80]},{100,2,[81,90]},{150,1,[91,100]}]
A1385: 1382 | B1385: 5 | C1385: 8 | D1385: 2000 | E1385: =R[-9]C -> 41 | F1385: =R[-9]C -> 50 | G1385: 4 | H1385: 20000 | I1385: 110003 | J1385: 4 | K1385: [{5,10},{6,15},{13,10},{14,5},{15,10},{16,5},{20,1},{27,10},{28,10}] | L1385: =R[-1]C -> [{5,1113},{6,1113},{13,18},{14,37},{15,18},{16,37},{20,3},{27,18},{28,18}] | M1385: =R[-1]C -> [{0,1,[1,30]},{1,2,[11,40]},{2,5,[21,50]},{5,10,[31,60]},{10,20,[41,60]},{30,20,[51,70]},{50,10,[61,80]},{70,5,[71,80]},{100,2,[81,90]},{150,1,[91,100]}]
A1386: 1383 | B1386: 5 | C1386: 8 | D1386: 2000 | E1386: =R[-9]C -> 51 | F1386: =R[-9]C -> 60 | G1386: 4 | H1386: 20000 | I1386: 110003 | J1386: 4 | K1386: [{5,10},{6,15},{13,10},{14,5},{15,10},{16,5},{20,1},{27,10},{28,10}] | L1386: =R[-1]C -> [{5,1113},{6,1113},{13,18},{14,37},{15,18},{16,37},{20,3},{27,18},{28,18}] | M1386: =R[-1]C -> [{0,1,[1,30]},{1,2,[11,40]},{2,5,[21,50]},{5,10,[31,60]},{10,20,[41,60]},{30,20,[51,70]},{50,10,[61,80]},{70,5,[71,80]},{100,2,[81,90]},{150,1,[91,100]}]
A1387: 1384 | B1387: 5 | C1387: 8 | D1387: 2000 | E1387: =R[-9]C -> 61 | F1387: =R[-9]C -> 70 | G1387: 4 | H1387: 20000 | I1387: 110003 | J1387: 4 | K1387: [{5,10},{6,15},{13,10},{14,5},{15,10},{16,5},{20,1},{27,10},{28,10}] | L1387: =R[-1]C -> [{5,1113},{6,1113},{13,18},{14,37},{15,18},{16,37},{20,3},{27,18},{28,18}] | M1387: =R[-1]C -> [{0,1,[1,30]},{1,2,[11,40]},{2,5,[21,50]},{5,10,[31,60]},{10,20,[41,60]},{30,20,[51,70]},{50,10,[61,80]},{70,5,[71,80]},{100,2,[81,90]},{150,1,[91,100]}]
A1388: 1385 | B1388: 5 | C1388: 8 | D1388: 2000 | E1388: =R[-9]C -> 71 | F1388: =R[-9]C -> 80 | G1388: 4 | H1388: 20000 | I1388: 110003 | J1388: 4 | K1388: [{5,10},{6,15},{13,10},{14,5},{15,10},{16,5},{20,1},{27,10},{28,10}] | L1388: =R[-1]C -> [{5,1113},{6,1113},{13,18},{14,37},{15,18},{16,37},{20,3},{27,18},{28,18}] | M1388: =R[-1]C -> [{0,1,[1,30]},{1,2,[11,40]},{2,5,[21,50]},{5,10,[31,60]},{10,20,[41,60]},{30,20,[51,70]},{50,10,[61,80]},{70,5,[71,80]},{100,2,[81,90]},{150,1,[91,100]}]
A1389: 1386 | B1389: 5 | C1389: 8 | D1389: 2000 | E1389: =R[-9]C -> 81 | F1389: =R[-9]C -> 90 | G1389: 4 | H1389: 20000 | I1389: 110003 | J1389: 4 | K1389: [{5,10},{6,15},{13,10},{14,5},{15,10},{16,5},{20,1},{27,10},{28,10}] | L1389: =R[-1]C -> [{5,1113},{6,1113},{13,18},{14,37},{15,18},{16,37},{20,3},{27,18},{28,18}] | M1389: =R[-1]C -> [{0,1,[1,30]},{1,2,[11,40]},{2,5,[21,50]},{5,10,[31,60]},{10,20,[41,60]},{30,20,[51,70]},{50,10,[61,80]},{70,5,[71,80]},{100,2,[81,90]},{150,1,[91,100]}]
A1390: 1387 | B1390: 6 | C1390: 8 | D1390: 2000 | E1390: =R[-9]C -> 1 | F1390: =R[-9]C -> 10 | G1390: 5 | H1390: 20000 | I1390: 110003 | J1390: 5 | K1390: [{5,10},{6,15},{13,10},{14,5},{15,10},{16,5},{20,1},{27,10},{28,10}] | L1390: =R[-1]C -> [{5,1113},{6,1113},{13,18},{14,37},{15,18},{16,37},{20,3},{27,18},{28,18}] | M1390: =R[-1]C -> [{0,1,[1,30]},{1,2,[11,40]},{2,5,[21,50]},{5,10,[31,60]},{10,20,[41,60]},{30,20,[51,70]},{50,10,[61,80]},{70,5,[71,80]},{100,2,[81,90]},{150,1,[91,100]}]
A1391: 1388 | B1391: 6 | C1391: 8 | D1391: 2000 | E1391: =R[-9]C -> 11 | F1391: =R[-9]C -> 20 | G1391: 5 | H1391: 20000 | I1391: 110003 | J1391: 5 | K1391: [{5,10},{6,15},{13,10},{14,5},{15,10},{16,5},{20,1},{27,10},{28,10}] | L1391: =R[-1]C -> [{5,1113},{6,1113},{13,18},{14,37},{15,18},{16,37},{20,3},{27,18},{28,18}] | M1391: =R[-1]C -> [{0,1,[1,30]},{1,2,[11,40]},{2,5,[21,50]},{5,10,[31,60]},{10,20,[41,60]},{30,20,[51,70]},{50,10,[61,80]},{70,5,[71,80]},{100,2,[81,90]},{150,1,[91,100]}]
A1392: 1389 | B1392: 6 | C1392: 8 | D1392: 2000 | E1392: =R[-9]C -> 21 | F1392: =R[-9]C -> 30 | G1392: 5 | H1392: 20000 | I1392: 110003 | J1392: 5 | K1392: [{5,10},{6,15},{13,10},{14,5},{15,10},{16,5},{20,1},{27,10},{28,10}] | L1392: =R[-1]C -> [{5,1113},{6,1113},{13,18},{14,37},{15,18},{16,37},{20,3},{27,18},{28,18}] | M1392: =R[-1]C -> [{0,1,[1,30]},{1,2,[11,40]},{2,5,[21,50]},{5,10,[31,60]},{10,20,[41,60]},{30,20,[51,70]},{50,10,[61,80]},{70,5,[71,80]},{100,2,[81,90]},{150,1,[91,100]}]
A1393: 1390 | B1393: 6 | C1393: 8 | D1393: 2000 | E1393: =R[-9]C -> 31 | F1393: =R[-9]C -> 40 | G1393: 5 | H1393: 20000 | I1393: 110003 | J1393: 5 | K1393: [{5,10},{6,15},{13,10},{14,5},{15,10},{16,5},{20,1},{27,10},{28,10}] | L1393: =R[-1]C -> [{5,1113},{6,1113},{13,18},{14,37},{15,18},{16,37},{20,3},{27,18},{28,18}] | M1393: =R[-1]C -> [{0,1,[1,30]},{1,2,[11,40]},{2,5,[21,50]},{5,10,[31,60]},{10,20,[41,60]},{30,20,[51,70]},{50,10,[61,80]},{70,5,[71,80]},{100,2,[81,90]},{150,1,[91,100]}]
A1394: 1391 | B1394: 6 | C1394: 8 | D1394: 2000 | E1394: =R[-9]C -> 41 | F1394: =R[-9]C -> 50 | G1394: 5 | H1394: 20000 | I1394: 110003 | J1394: 5 | K1394: [{5,10},{6,15},{13,10},{14,5},{15,10},{16,5},{20,1},{27,10},{28,10}] | L1394: =R[-1]C -> [{5,1113},{6,1113},{13,18},{14,37},{15,18},{16,37},{20,3},{27,18},{28,18}] | M1394: =R[-1]C -> [{0,1,[1,30]},{1,2,[11,40]},{2,5,[21,50]},{5,10,[31,60]},{10,20,[41,60]},{30,20,[51,70]},{50,10,[61,80]},{70,5,[71,80]},{100,2,[81,90]},{150,1,[91,100]}]
A1395: 1392 | B1395: 6 | C1395: 8 | D1395: 2000 | E1395: =R[-9]C -> 51 | F1395: =R[-9]C -> 60 | G1395: 5 | H1395: 20000 | I1395: 110003 | J1395: 5 | K1395: [{5,10},{6,15},{13,10},{14,5},{15,10},{16,5},{20,1},{27,10},{28,10}] | L1395: =R[-1]C -> [{5,1113},{6,1113},{13,18},{14,37},{15,18},{16,37},{20,3},{27,18},{28,18}] | M1395: =R[-1]C -> [{0,1,[1,30]},{1,2,[11,40]},{2,5,[21,50]},{5,10,[31,60]},{10,20,[41,60]},{30,20,[51,70]},{50,10,[61,80]},{70,5,[71,80]},{100,2,[81,90]},{150,1,[91,100]}]
A1396: 1393 | B1396: 6 | C1396: 8 | D1396: 2000 | E1396: =R[-9]C -> 61 | F1396: =R[-9]C -> 70 | G1396: 5 | H1396: 20000 | I1396: 110003 | J1396: 5 | K1396: [{5,10},{6,15},{13,10},{14,5},{15,10},{16,5},{20,1},{27,10},{28,10}] | L1396: =R[-1]C -> [{5,1113},{6,1113},{13,18},{14,37},{15,18},{16,37},{20,3},{27,18},{28,18}] | M1396: =R[-1]C -> [{0,1,[1,30]},{1,2,[11,40]},{2,5,[21,50]},{5,10,[31,60]},{10,20,[41,60]},{30,20,[51,70]},{50,10,[61,80]},{70,5,[71,80]},{100,2,[81,90]},{150,1,[91,100]}]
A1397: 1394 | B1397: 6 | C1397: 8 | D1397: 2000 | E1397: =R[-9]C -> 71 | F1397: =R[-9]C -> 80 | G1397: 5 | H1397: 20000 | I1397: 110003 | J1397: 5 | K1397: [{5,10},{6,15},{13,10},{14,5},{15,10},{16,5},{20,1},{27,10},{28,10}] | L1397: =R[-1]C -> [{5,1113},{6,1113},{13,18},{14,37},{15,18},{16,37},{20,3},{27,18},{28,18}] | M1397: =R[-1]C -> [{0,1,[1,30]},{1,2,[11,40]},{2,5,[21,50]},{5,10,[31,60]},{10,20,[41,60]},{30,20,[51,70]},{50,10,[61,80]},{70,5,[71,80]},{100,2,[81,90]},{150,1,[91,100]}]
A1398: 1395 | B1398: 6 | C1398: 8 | D1398: 2000 | E1398: =R[-9]C -> 81 | F1398: =R[-9]C -> 90 | G1398: 5 | H1398: 20000 | I1398: 110003 | J1398: 5 | K1398: [{5,10},{6,15},{13,10},{14,5},{15,10},{16,5},{20,1},{27,10},{28,10}] | L1398: =R[-1]C -> [{5,1113},{6,1113},{13,18},{14,37},{15,18},{16,37},{20,3},{27,18},{28,18}] | M1398: =R[-1]C -> [{0,1,[1,30]},{1,2,[11,40]},{2,5,[21,50]},{5,10,[31,60]},{10,20,[41,60]},{30,20,[51,70]},{50,10,[61,80]},{70,5,[71,80]},{100,2,[81,90]},{150,1,[91,100]}]
A1399: 1396 | B1399: 2 | C1399: 10 | D1399: 2000 | E1399: =R[-18]C -> 1 | F1399: =R[-18]C -> 10 | G1399: 1 | H1399: 5000 | I1399: 110003 | J1399: 1 | K1399: [{5,10},{6,15},{13,10},{14,5},{15,10},{16,5},{20,1},{27,10},{28,10}] | L1399: =R[-1]C -> [{5,1113},{6,1113},{13,18},{14,37},{15,18},{16,37},{20,3},{27,18},{28,18}] | M1399: =R[-1]C -> [{0,1,[1,30]},{1,2,[11,40]},{2,5,[21,50]},{5,10,[31,60]},{10,20,[41,60]},{30,20,[51,70]},{50,10,[61,80]},{70,5,[71,80]},{100,2,[81,90]},{150,1,[91,100]}]
A1400: 1397 | B1400: 2 | C1400: 10 | D1400: 2000 | E1400: =R[-18]C -> 11 | F1400: =R[-18]C -> 20 | G1400: 1 | H1400: 5000 | I1400: 110003 | J1400: 1 | K1400: [{5,10},{6,15},{13,10},{14,5},{15,10},{16,5},{20,1},{27,10},{28,10}] | L1400: =R[-1]C -> [{5,1113},{6,1113},{13,18},{14,37},{15,18},{16,37},{20,3},{27,18},{28,18}] | M1400: =R[-1]C -> [{0,1,[1,30]},{1,2,[11,40]},{2,5,[21,50]},{5,10,[31,60]},{10,20,[41,60]},{30,20,[51,70]},{50,10,[61,80]},{70,5,[71,80]},{100,2,[81,90]},{150,1,[91,100]}]
A1401: 1398 | B1401: 2 | C1401: 10 | D1401: 2000 | E1401: =R[-18]C -> 21 | F1401: =R[-18]C -> 30 | G1401: 1 | H1401: 5000 | I1401: 110003 | J1401: 1 | K1401: [{5,10},{6,15},{13,10},{14,5},{15,10},{16,5},{20,1},{27,10},{28,10}] | L1401: =R[-1]C -> [{5,1113},{6,1113},{13,18},{14,37},{15,18},{16,37},{20,3},{27,18},{28,18}] | M1401: =R[-1]C -> [{0,1,[1,30]},{1,2,[11,40]},{2,5,[21,50]},{5,10,[31,60]},{10,20,[41,60]},{30,20,[51,70]},{50,10,[61,80]},{70,5,[71,80]},{100,2,[81,90]},{150,1,[91,100]}]
A1402: 1399 | B1402: 2 | C1402: 10 | D1402: 2000 | E1402: =R[-18]C -> 31 | F1402: =R[-18]C -> 40 | G1402: 1 | H1402: 5000 | I1402: 110003 | J1402: 1 | K1402: [{5,10},{6,15},{13,10},{14,5},{15,10},{16,5},{20,1},{27,10},{28,10}] | L1402: =R[-1]C -> [{5,1113},{6,1113},{13,18},{14,37},{15,18},{16,37},{20,3},{27,18},{28,18}] | M1402: =R[-1]C -> [{0,1,[1,30]},{1,2,[11,40]},{2,5,[21,50]},{5,10,[31,60]},{10,20,[41,60]},{30,20,[51,70]},{50,10,[61,80]},{70,5,[71,80]},{100,2,[81,90]},{150,1,[91,100]}]
A1403: 1400 | B1403: 2 | C1403: 10 | D1403: 2000 | E1403: =R[-18]C -> 41 | F1403: =R[-18]C -> 50 | G1403: 1 | H1403: 5000 | I1403: 110003 | J1403: 1 | K1403: [{5,10},{6,15},{13,10},{14,5},{15,10},{16,5},{20,1},{27,10},{28,10}] | L1403: =R[-1]C -> [{5,1113},{6,1113},{13,18},{14,37},{15,18},{16,37},{20,3},{27,18},{28,18}] | M1403: =R[-1]C -> [{0,1,[1,30]},{1,2,[11,40]},{2,5,[21,50]},{5,10,[31,60]},{10,20,[41,60]},{30,20,[51,70]},{50,10,[61,80]},{70,5,[71,80]},{100,2,[81,90]},{150,1,[91,100]}]
A1404: 1401 | B1404: 2 | C1404: 10 | D1404: 2000 | E1404: =R[-18]C -> 51 | F1404: =R[-18]C -> 60 | G1404: 1 | H1404: 5000 | I1404: 110003 | J1404: 1 | K1404: [{5,10},{6,15},{13,10},{14,5},{15,10},{16,5},{20,1},{27,10},{28,10}] | L1404: =R[-1]C -> [{5,1113},{6,1113},{13,18},{14,37},{15,18},{16,37},{20,3},{27,18},{28,18}] | M1404: =R[-1]C -> [{0,1,[1,30]},{1,2,[11,40]},{2,5,[21,50]},{5,10,[31,60]},{10,20,[41,60]},{30,20,[51,70]},{50,10,[61,80]},{70,5,[71,80]},{100,2,[81,90]},{150,1,[91,100]}]
A1405: 1402 | B1405: 2 | C1405: 10 | D1405: 2000 | E1405: =R[-18]C -> 61 | F1405: =R[-18]C -> 70 | G1405: 1 | H1405: 5000 | I1405: 110003 | J1405: 1 | K1405: [{5,10},{6,15},{13,10},{14,5},{15,10},{16,5},{20,1},{27,10},{28,10}] | L1405: =R[-1]C -> [{5,1113},{6,1113},{13,18},{14,37},{15,18},{16,37},{20,3},{27,18},{28,18}] | M1405: =R[-1]C -> [{0,1,[1,30]},{1,2,[11,40]},{2,5,[21,50]},{5,10,[31,60]},{10,20,[41,60]},{30,20,[51,70]},{50,10,[61,80]},{70,5,[71,80]},{100,2,[81,90]},{150,1,[91,100]}]
A1406: 1403 | B1406: 2 | C1406: 10 | D1406: 2000 | E1406: =R[-18]C -> 71 | F1406: =R[-18]C -> 80 | G1406: 1 | H1406: 5000 | I1406: 110003 | J1406: 1 | K1406: [{5,10},{6,15},{13,10},{14,5},{15,10},{16,5},{20,1},{27,10},{28,10}] | L1406: =R[-1]C -> [{5,1113},{6,1113},{13,18},{14,37},{15,18},{16,37},{20,3},{27,18},{28,18}] | M1406: =R[-1]C -> [{0,1,[1,30]},{1,2,[11,40]},{2,5,[21,50]},{5,10,[31,60]},{10,20,[41,60]},{30,20,[51,70]},{50,10,[61,80]},{70,5,[71,80]},{100,2,[81,90]},{150,1,[91,100]}]
A1407: 1404 | B1407: 2 | C1407: 10 | D1407: 2000 | E1407: =R[-18]C -> 81 | F1407: =R[-18]C -> 90 | G1407: 1 | H1407: 5000 | I1407: 110003 | J1407: 1 | K1407: [{5,10},{6,15},{13,10},{14,5},{15,10},{16,5},{20,1},{27,10},{28,10}] | L1407: =R[-1]C -> [{5,1113},{6,1113},{13,18},{14,37},{15,18},{16,37},{20,3},{27,18},{28,18}] | M1407: =R[-1]C -> [{0,1,[1,30]},{1,2,[11,40]},{2,5,[21,50]},{5,10,[31,60]},{10,20,[41,60]},{30,20,[51,70]},{50,10,[61,80]},{70,5,[71,80]},{100,2,[81,90]},{150,1,[91,100]}]
A1408: 1405 | B1408: 3 | C1408: 10 | D1408: 2000 | E1408: =R[-9]C -> 1 | F1408: =R[-9]C -> 10 | G1408: 2 | H1408: 10000 | I1408: 110003 | J1408: 2 | K1408: [{5,10},{6,15},{13,10},{14,5},{15,10},{16,5},{20,1},{27,10},{28,10}] | L1408: =R[-1]C -> [{5,1113},{6,1113},{13,18},{14,37},{15,18},{16,37},{20,3},{27,18},{28,18}] | M1408: =R[-1]C -> [{0,1,[1,30]},{1,2,[11,40]},{2,5,[21,50]},{5,10,[31,60]},{10,20,[41,60]},{30,20,[51,70]},{50,10,[61,80]},{70,5,[71,80]},{100,2,[81,90]},{150,1,[91,100]}]
A1409: 1406 | B1409: 3 | C1409: 10 | D1409: 2000 | E1409: =R[-9]C -> 11 | F1409: =R[-9]C -> 20 | G1409: 2 | H1409: 10000 | I1409: 110003 | J1409: 2 | K1409: [{5,10},{6,15},{13,10},{14,5},{15,10},{16,5},{20,1},{27,10},{28,10}] | L1409: =R[-1]C -> [{5,1113},{6,1113},{13,18},{14,37},{15,18},{16,37},{20,3},{27,18},{28,18}] | M1409: =R[-1]C -> [{0,1,[1,30]},{1,2,[11,40]},{2,5,[21,50]},{5,10,[31,60]},{10,20,[41,60]},{30,20,[51,70]},{50,10,[61,80]},{70,5,[71,80]},{100,2,[81,90]},{150,1,[91,100]}]
A1410: 1407 | B1410: 3 | C1410: 10 | D1410: 2000 | E1410: =R[-9]C -> 21 | F1410: =R[-9]C -> 30 | G1410: 2 | H1410: 10000 | I1410: 110003 | J1410: 2 | K1410: [{5,10},{6,15},{13,10},{14,5},{15,10},{16,5},{20,1},{27,10},{28,10}] | L1410: =R[-1]C -> [{5,1113},{6,1113},{13,18},{14,37},{15,18},{16,37},{20,3},{27,18},{28,18}] | M1410: =R[-1]C -> [{0,1,[1,30]},{1,2,[11,40]},{2,5,[21,50]},{5,10,[31,60]},{10,20,[41,60]},{30,20,[51,70]},{50,10,[61,80]},{70,5,[71,80]},{100,2,[81,90]},{150,1,[91,100]}]
A1411: 1408 | B1411: 3 | C1411: 10 | D1411: 2000 | E1411: =R[-9]C -> 31 | F1411: =R[-9]C -> 40 | G1411: 2 | H1411: 10000 | I1411: 110003 | J1411: 2 | K1411: [{5,10},{6,15},{13,10},{14,5},{15,10},{16,5},{20,1},{27,10},{28,10}] | L1411: =R[-1]C -> [{5,1113},{6,1113},{13,18},{14,37},{15,18},{16,37},{20,3},{27,18},{28,18}] | M1411: =R[-1]C -> [{0,1,[1,30]},{1,2,[11,40]},{2,5,[21,50]},{5,10,[31,60]},{10,20,[41,60]},{30,20,[51,70]},{50,10,[61,80]},{70,5,[71,80]},{100,2,[81,90]},{150,1,[91,100]}]
A1412: 1409 | B1412: 3 | C1412: 10 | D1412: 2000 | E1412: =R[-9]C -> 41 | F1412: =R[-9]C -> 50 | G1412: 2 | H1412: 10000 | I1412: 110003 | J1412: 2 | K1412: [{5,10},{6,15},{13,10},{14,5},{15,10},{16,5},{20,1},{27,10},{28,10}] | L1412: =R[-1]C -> [{5,1113},{6,1113},{13,18},{14,37},{15,18},{16,37},{20,3},{27,18},{28,18}] | M1412: =R[-1]C -> [{0,1,[1,30]},{1,2,[11,40]},{2,5,[21,50]},{5,10,[31,60]},{10,20,[41,60]},{30,20,[51,70]},{50,10,[61,80]},{70,5,[71,80]},{100,2,[81,90]},{150,1,[91,100]}]
A1413: 1410 | B1413: 3 | C1413: 10 | D1413: 2000 | E1413: =R[-9]C -> 51 | F1413: =R[-9]C -> 60 | G1413: 2 | H1413: 10000 | I1413: 110003 | J1413: 2 | K1413: [{5,10},{6,15},{13,10},{14,5},{15,10},{16,5},{20,1},{27,10},{28,10}] | L1413: =R[-1]C -> [{5,1113},{6,1113},{13,18},{14,37},{15,18},{16,37},{20,3},{27,18},{28,18}] | M1413: =R[-1]C -> [{0,1,[1,30]},{1,2,[11,40]},{2,5,[21,50]},{5,10,[31,60]},{10,20,[41,60]},{30,20,[51,70]},{50,10,[61,80]},{70,5,[71,80]},{100,2,[81,90]},{150,1,[91,100]}]
A1414: 1411 | B1414: 3 | C1414: 10 | D1414: 2000 | E1414: =R[-9]C -> 61 | F1414: =R[-9]C -> 70 | G1414: 2 | H1414: 10000 | I1414: 110003 | J1414: 2 | K1414: [{5,10},{6,15},{13,10},{14,5},{15,10},{16,5},{20,1},{27,10},{28,10}] | L1414: =R[-1]C -> [{5,1113},{6,1113},{13,18},{14,37},{15,18},{16,37},{20,3},{27,18},{28,18}] | M1414: =R[-1]C -> [{0,1,[1,30]},{1,2,[11,40]},{2,5,[21,50]},{5,10,[31,60]},{10,20,[41,60]},{30,20,[51,70]},{50,10,[61,80]},{70,5,[71,80]},{100,2,[81,90]},{150,1,[91,100]}]
A1415: 1412 | B1415: 3 | C1415: 10 | D1415: 2000 | E1415: =R[-9]C -> 71 | F1415: =R[-9]C -> 80 | G1415: 2 | H1415: 10000 | I1415: 110003 | J1415: 2 | K1415: [{5,10},{6,15},{13,10},{14,5},{15,10},{16,5},{20,1},{27,10},{28,10}] | L1415: =R[-1]C -> [{5,1113},{6,1113},{13,18},{14,37},{15,18},{16,37},{20,3},{27,18},{28,18}] | M1415: =R[-1]C -> [{0,1,[1,30]},{1,2,[11,40]},{2,5,[21,50]},{5,10,[31,60]},{10,20,[41,60]},{30,20,[51,70]},{50,10,[61,80]},{70,5,[71,80]},{100,2,[81,90]},{150,1,[91,100]}]
A1416: 1413 | B1416: 3 | C1416: 10 | D1416: 2000 | E1416: =R[-9]C -> 81 | F1416: =R[-9]C -> 90 | G1416: 2 | H1416: 10000 | I1416: 110003 | J1416: 2 | K1416: [{5,10},{6,15},{13,10},{14,5},{15,10},{16,5},{20,1},{27,10},{28,10}] | L1416: =R[-1]C -> [{5,1113},{6,1113},{13,18},{14,37},{15,18},{16,37},{20,3},{27,18},{28,18}] | M1416: =R[-1]C -> [{0,1,[1,30]},{1,2,[11,40]},{2,5,[21,50]},{5,10,[31,60]},{10,20,[41,60]},{30,20,[51,70]},{50,10,[61,80]},{70,5,[71,80]},{100,2,[81,90]},{150,1,[91,100]}]
A1417: 1414 | B1417: 4 | C1417: 10 | D1417: 2000 | E1417: =R[-9]C -> 1 | F1417: =R[-9]C -> 10 | G1417: 3 | H1417: 15000 | I1417: 110003 | J1417: 3 | K1417: [{5,10},{6,15},{13,10},{14,5},{15,10},{16,5},{20,1},{27,10},{28,10}] | L1417: =R[-1]C -> [{5,1113},{6,1113},{13,18},{14,37},{15,18},{16,37},{20,3},{27,18},{28,18}] | M1417: =R[-1]C -> [{0,1,[1,30]},{1,2,[11,40]},{2,5,[21,50]},{5,10,[31,60]},{10,20,[41,60]},{30,20,[51,70]},{50,10,[61,80]},{70,5,[71,80]},{100,2,[81,90]},{150,1,[91,100]}]
A1418: 1415 | B1418: 4 | C1418: 10 | D1418: 2000 | E1418: =R[-9]C -> 11 | F1418: =R[-9]C -> 20 | G1418: 3 | H1418: 15000 | I1418: 110003 | J1418: 3 | K1418: [{5,10},{6,15},{13,10},{14,5},{15,10},{16,5},{20,1},{27,10},{28,10}] | L1418: =R[-1]C -> [{5,1113},{6,1113},{13,18},{14,37},{15,18},{16,37},{20,3},{27,18},{28,18}] | M1418: =R[-1]C -> [{0,1,[1,30]},{1,2,[11,40]},{2,5,[21,50]},{5,10,[31,60]},{10,20,[41,60]},{30,20,[51,70]},{50,10,[61,80]},{70,5,[71,80]},{100,2,[81,90]},{150,1,[91,100]}]
A1419: 1416 | B1419: 4 | C1419: 10 | D1419: 2000 | E1419: =R[-9]C -> 21 | F1419: =R[-9]C -> 30 | G1419: 3 | H1419: 15000 | I1419: 110003 | J1419: 3 | K1419: [{5,10},{6,15},{13,10},{14,5},{15,10},{16,5},{20,1},{27,10},{28,10}] | L1419: =R[-1]C -> [{5,1113},{6,1113},{13,18},{14,37},{15,18},{16,37},{20,3},{27,18},{28,18}] | M1419: =R[-1]C -> [{0,1,[1,30]},{1,2,[11,40]},{2,5,[21,50]},{5,10,[31,60]},{10,20,[41,60]},{30,20,[51,70]},{50,10,[61,80]},{70,5,[71,80]},{100,2,[81,90]},{150,1,[91,100]}]
A1420: 1417 | B1420: 4 | C1420: 10 | D1420: 2000 | E1420: =R[-9]C -> 31 | F1420: =R[-9]C -> 40 | G1420: 3 | H1420: 15000 | I1420: 110003 | J1420: 3 | K1420: [{5,10},{6,15},{13,10},{14,5},{15,10},{16,5},{20,1},{27,10},{28,10}] | L1420: =R[-1]C -> [{5,1113},{6,1113},{13,18},{14,37},{15,18},{16,37},{20,3},{27,18},{28,18}] | M1420: =R[-1]C -> [{0,1,[1,30]},{1,2,[11,40]},{2,5,[21,50]},{5,10,[31,60]},{10,20,[41,60]},{30,20,[51,70]},{50,10,[61,80]},{70,5,[71,80]},{100,2,[81,90]},{150,1,[91,100]}]
A1421: 1418 | B1421: 4 | C1421: 10 | D1421: 2000 | E1421: =R[-9]C -> 41 | F1421: =R[-9]C -> 50 | G1421: 3 | H1421: 15000 | I1421: 110003 | J1421: 3 | K1421: [{5,10},{6,15},{13,10},{14,5},{15,10},{16,5},{20,1},{27,10},{28,10}] | L1421: =R[-1]C -> [{5,1113},{6,1113},{13,18},{14,37},{15,18},{16,37},{20,3},{27,18},{28,18}] | M1421: =R[-1]C -> [{0,1,[1,30]},{1,2,[11,40]},{2,5,[21,50]},{5,10,[31,60]},{10,20,[41,60]},{30,20,[51,70]},{50,10,[61,80]},{70,5,[71,80]},{100,2,[81,90]},{150,1,[91,100]}]
A1422: 1419 | B1422: 4 | C1422: 10 | D1422: 2000 | E1422: =R[-9]C -> 51 | F1422: =R[-9]C -> 60 | G1422: 3 | H1422: 15000 | I1422: 110003 | J1422: 3 | K1422: [{5,10},{6,15},{13,10},{14,5},{15,10},{16,5},{20,1},{27,10},{28,10}] | L1422: =R[-1]C -> [{5,1113},{6,1113},{13,18},{14,37},{15,18},{16,37},{20,3},{27,18},{28,18}] | M1422: =R[-1]C -> [{0,1,[1,30]},{1,2,[11,40]},{2,5,[21,50]},{5,10,[31,60]},{10,20,[41,60]},{30,20,[51,70]},{50,10,[61,80]},{70,5,[71,80]},{100,2,[81,90]},{150,1,[91,100]}]
A1423: 1420 | B1423: 4 | C1423: 10 | D1423: 2000 | E1423: =R[-9]C -> 61 | F1423: =R[-9]C -> 70 | G1423: 3 | H1423: 15000 | I1423: 110003 | J1423: 3 | K1423: [{5,10},{6,15},{13,10},{14,5},{15,10},{16,5},{20,1},{27,10},{28,10}] | L1423: =R[-1]C -> [{5,1113},{6,1113},{13,18},{14,37},{15,18},{16,37},{20,3},{27,18},{28,18}] | M1423: =R[-1]C -> [{0,1,[1,30]},{1,2,[11,40]},{2,5,[21,50]},{5,10,[31,60]},{10,20,[41,60]},{30,20,[51,70]},{50,10,[61,80]},{70,5,[71,80]},{100,2,[81,90]},{150,1,[91,100]}]
A1424: 1421 | B1424: 4 | C1424: 10 | D1424: 2000 | E1424: =R[-9]C -> 71 | F1424: =R[-9]C -> 80 | G1424: 3 | H1424: 15000 | I1424: 110003 | J1424: 3 | K1424: [{5,10},{6,15},{13,10},{14,5},{15,10},{16,5},{20,1},{27,10},{28,10}] | L1424: =R[-1]C -> [{5,1113},{6,1113},{13,18},{14,37},{15,18},{16,37},{20,3},{27,18},{28,18}] | M1424: =R[-1]C -> [{0,1,[1,30]},{1,2,[11,40]},{2,5,[21,50]},{5,10,[31,60]},{10,20,[41,60]},{30,20,[51,70]},{50,10,[61,80]},{70,5,[71,80]},{100,2,[81,90]},{150,1,[91,100]}]
A1425: 1422 | B1425: 4 | C1425: 10 | D1425: 2000 | E1425: =R[-9]C -> 81 | F1425: =R[-9]C -> 90 | G1425: 3 | H1425: 15000 | I1425: 110003 | J1425: 3 | K1425: [{5,10},{6,15},{13,10},{14,5},{15,10},{16,5},{20,1},{27,10},{28,10}] | L1425: =R[-1]C -> [{5,1113},{6,1113},{13,18},{14,37},{15,18},{16,37},{20,3},{27,18},{28,18}] | M1425: =R[-1]C -> [{0,1,[1,30]},{1,2,[11,40]},{2,5,[21,50]},{5,10,[31,60]},{10,20,[41,60]},{30,20,[51,70]},{50,10,[61,80]},{70,5,[71,80]},{100,2,[81,90]},{150,1,[91,100]}]
A1426: 1423 | B1426: 5 | C1426: 10 | D1426: 2000 | E1426: =R[-9]C -> 1 | F1426: =R[-9]C -> 10 | G1426: 4 | H1426: 20000 | I1426: 110003 | J1426: 4 | K1426: [{5,10},{6,15},{13,10},{14,5},{15,10},{16,5},{20,1},{27,10},{28,10}] | L1426: =R[-1]C -> [{5,1113},{6,1113},{13,18},{14,37},{15,18},{16,37},{20,3},{27,18},{28,18}] | M1426: =R[-1]C -> [{0,1,[1,30]},{1,2,[11,40]},{2,5,[21,50]},{5,10,[31,60]},{10,20,[41,60]},{30,20,[51,70]},{50,10,[61,80]},{70,5,[71,80]},{100,2,[81,90]},{150,1,[91,100]}]
A1427: 1424 | B1427: 5 | C1427: 10 | D1427: 2000 | E1427: =R[-9]C -> 11 | F1427: =R[-9]C -> 20 | G1427: 4 | H1427: 20000 | I1427: 110003 | J1427: 4 | K1427: [{5,10},{6,15},{13,10},{14,5},{15,10},{16,5},{20,1},{27,10},{28,10}] | L1427: =R[-1]C -> [{5,1113},{6,1113},{13,18},{14,37},{15,18},{16,37},{20,3},{27,18},{28,18}] | M1427: =R[-1]C -> [{0,1,[1,30]},{1,2,[11,40]},{2,5,[21,50]},{5,10,[31,60]},{10,20,[41,60]},{30,20,[51,70]},{50,10,[61,80]},{70,5,[71,80]},{100,2,[81,90]},{150,1,[91,100]}]
A1428: 1425 | B1428: 5 | C1428: 10 | D1428: 2000 | E1428: =R[-9]C -> 21 | F1428: =R[-9]C -> 30 | G1428: 4 | H1428: 20000 | I1428: 110003 | J1428: 4 | K1428: [{5,10},{6,15},{13,10},{14,5},{15,10},{16,5},{20,1},{27,10},{28,10}] | L1428: =R[-1]C -> [{5,1113},{6,1113},{13,18},{14,37},{15,18},{16,37},{20,3},{27,18},{28,18}] | M1428: =R[-1]C -> [{0,1,[1,30]},{1,2,[11,40]},{2,5,[21,50]},{5,10,[31,60]},{10,20,[41,60]},{30,20,[51,70]},{50,10,[61,80]},{70,5,[71,80]},{100,2,[81,90]},{150,1,[91,100]}]
A1429: 1426 | B1429: 5 | C1429: 10 | D1429: 2000 | E1429: =R[-9]C -> 31 | F1429: =R[-9]C -> 40 | G1429: 4 | H1429: 20000 | I1429: 110003 | J1429: 4 | K1429: [{5,10},{6,15},{13,10},{14,5},{15,10},{16,5},{20,1},{27,10},{28,10}] | L1429: =R[-1]C -> [{5,1113},{6,1113},{13,18},{14,37},{15,18},{16,37},{20,3},{27,18},{28,18}] | M1429: =R[-1]C -> [{0,1,[1,30]},{1,2,[11,40]},{2,5,[21,50]},{5,10,[31,60]},{10,20,[41,60]},{30,20,[51,70]},{50,10,[61,80]},{70,5,[71,80]},{100,2,[81,90]},{150,1,[91,100]}]
A1430: 1427 | B1430: 5 | C1430: 10 | D1430: 2000 | E1430: =R[-9]C -> 41 | F1430: =R[-9]C -> 50 | G1430: 4 | H1430: 20000 | I1430: 110003 | J1430: 4 | K1430: [{5,10},{6,15},{13,10},{14,5},{15,10},{16,5},{20,1},{27,10},{28,10}] | L1430: =R[-1]C -> [{5,1113},{6,1113},{13,18},{14,37},{15,18},{16,37},{20,3},{27,18},{28,18}] | M1430: =R[-1]C -> [{0,1,[1,30]},{1,2,[11,40]},{2,5,[21,50]},{5,10,[31,60]},{10,20,[41,60]},{30,20,[51,70]},{50,10,[61,80]},{70,5,[71,80]},{100,2,[81,90]},{150,1,[91,100]}]
A1431: 1428 | B1431: 5 | C1431: 10 | D1431: 2000 | E1431: =R[-9]C -> 51 | F1431: =R[-9]C -> 60 | G1431: 4 | H1431: 20000 | I1431: 110003 | J1431: 4 | K1431: [{5,10},{6,15},{13,10},{14,5},{15,10},{16,5},{20,1},{27,10},{28,10}] | L1431: =R[-1]C -> [{5,1113},{6,1113},{13,18},{14,37},{15,18},{16,37},{20,3},{27,18},{28,18}] | M1431: =R[-1]C -> [{0,1,[1,30]},{1,2,[11,40]},{2,5,[21,50]},{5,10,[31,60]},{10,20,[41,60]},{30,20,[51,70]},{50,10,[61,80]},{70,5,[71,80]},{100,2,[81,90]},{150,1,[91,100]}]
A1432: 1429 | B1432: 5 | C1432: 10 | D1432: 2000 | E1432: =R[-9]C -> 61 | F1432: =R[-9]C -> 70 | G1432: 4 | H1432: 20000 | I1432: 110003 | J1432: 4 | K1432: [{5,10},{6,15},{13,10},{14,5},{15,10},{16,5},{20,1},{27,10},{28,10}] | L1432: =R[-1]C -> [{5,1113},{6,1113},{13,18},{14,37},{15,18},{16,37},{20,3},{27,18},{28,18}] | M1432: =R[-1]C -> [{0,1,[1,30]},{1,2,[11,40]},{2,5,[21,50]},{5,10,[31,60]},{10,20,[41,60]},{30,20,[51,70]},{50,10,[61,80]},{70,5,[71,80]},{100,2,[81,90]},{150,1,[91,100]}]
A1433: 1430 | B1433: 5 | C1433: 10 | D1433: 2000 | E1433: =R[-9]C -> 71 | F1433: =R[-9]C -> 80 | G1433: 4 | H1433: 20000 | I1433: 110003 | J1433: 4 | K1433: [{5,10},{6,15},{13,10},{14,5},{15,10},{16,5},{20,1},{27,10},{28,10}] | L1433: =R[-1]C -> [{5,1113},{6,1113},{13,18},{14,37},{15,18},{16,37},{20,3},{27,18},{28,18}] | M1433: =R[-1]C -> [{0,1,[1,30]},{1,2,[11,40]},{2,5,[21,50]},{5,10,[31,60]},{10,20,[41,60]},{30,20,[51,70]},{50,10,[61,80]},{70,5,[71,80]},{100,2,[81,90]},{150,1,[91,100]}]
A1434: 1431 | B1434: 5 | C1434: 10 | D1434: 2000 | E1434: =R[-9]C -> 81 | F1434: =R[-9]C -> 90 | G1434: 4 | H1434: 20000 | I1434: 110003 | J1434: 4 | K1434: [{5,10},{6,15},{13,10},{14,5},{15,10},{16,5},{20,1},{27,10},{28,10}] | L1434: =R[-1]C -> [{5,1113},{6,1113},{13,18},{14,37},{15,18},{16,37},{20,3},{27,18},{28,18}] | M1434: =R[-1]C -> [{0,1,[1,30]},{1,2,[11,40]},{2,5,[21,50]},{5,10,[31,60]},{10,20,[41,60]},{30,20,[51,70]},{50,10,[61,80]},{70,5,[71,80]},{100,2,[81,90]},{150,1,[91,100]}]
A1435: 1432 | B1435: 6 | C1435: 10 | D1435: 2000 | E1435: =R[-9]C -> 1 | F1435: =R[-9]C -> 10 | G1435: 5 | H1435: 20000 | I1435: 110003 | J1435: 5 | K1435: [{5,10},{6,15},{13,10},{14,5},{15,10},{16,5},{20,1},{27,10},{28,10}] | L1435: =R[-1]C -> [{5,1113},{6,1113},{13,18},{14,37},{15,18},{16,37},{20,3},{27,18},{28,18}] | M1435: =R[-1]C -> [{0,1,[1,30]},{1,2,[11,40]},{2,5,[21,50]},{5,10,[31,60]},{10,20,[41,60]},{30,20,[51,70]},{50,10,[61,80]},{70,5,[71,80]},{100,2,[81,90]},{150,1,[91,100]}]
A1436: 1433 | B1436: 6 | C1436: 10 | D1436: 2000 | E1436: =R[-9]C -> 11 | F1436: =R[-9]C -> 20 | G1436: 5 | H1436: 20000 | I1436: 110003 | J1436: 5 | K1436: [{5,10},{6,15},{13,10},{14,5},{15,10},{16,5},{20,1},{27,10},{28,10}] | L1436: =R[-1]C -> [{5,1113},{6,1113},{13,18},{14,37},{15,18},{16,37},{20,3},{27,18},{28,18}] | M1436: =R[-1]C -> [{0,1,[1,30]},{1,2,[11,40]},{2,5,[21,50]},{5,10,[31,60]},{10,20,[41,60]},{30,20,[51,70]},{50,10,[61,80]},{70,5,[71,80]},{100,2,[81,90]},{150,1,[91,100]}]
A1437: 1434 | B1437: 6 | C1437: 10 | D1437: 2000 | E1437: =R[-9]C -> 21 | F1437: =R[-9]C -> 30 | G1437: 5 | H1437: 20000 | I1437: 110003 | J1437: 5 | K1437: [{5,10},{6,15},{13,10},{14,5},{15,10},{16,5},{20,1},{27,10},{28,10}] | L1437: =R[-1]C -> [{5,1113},{6,1113},{13,18},{14,37},{15,18},{16,37},{20,3},{27,18},{28,18}] | M1437: =R[-1]C -> [{0,1,[1,30]},{1,2,[11,40]},{2,5,[21,50]},{5,10,[31,60]},{10,20,[41,60]},{30,20,[51,70]},{50,10,[61,80]},{70,5,[71,80]},{100,2,[81,90]},{150,1,[91,100]}]
A1438: 1435 | B1438: 6 | C1438: 10 | D1438: 2000 | E1438: =R[-9]C -> 31 | F1438: =R[-9]C -> 40 | G1438: 5 | H1438: 20000 | I1438: 110003 | J1438: 5 | K1438: [{5,10},{6,15},{13,10},{14,5},{15,10},{16,5},{20,1},{27,10},{28,10}] | L1438: =R[-1]C -> [{5,1113},{6,1113},{13,18},{14,37},{15,18},{16,37},{20,3},{27,18},{28,18}] | M1438: =R[-1]C -> [{0,1,[1,30]},{1,2,[11,40]},{2,5,[21,50]},{5,10,[31,60]},{10,20,[41,60]},{30,20,[51,70]},{50,10,[61,80]},{70,5,[71,80]},{100,2,[81,90]},{150,1,[91,100]}]
A1439: 1436 | B1439: 6 | C1439: 10 | D1439: 2000 | E1439: =R[-9]C -> 41 | F1439: =R[-9]C -> 50 | G1439: 5 | H1439: 20000 | I1439: 110003 | J1439: 5 | K1439: [{5,10},{6,15},{13,10},{14,5},{15,10},{16,5},{20,1},{27,10},{28,10}] | L1439: =R[-1]C -> [{5,1113},{6,1113},{13,18},{14,37},{15,18},{16,37},{20,3},{27,18},{28,18}] | M1439: =R[-1]C -> [{0,1,[1,30]},{1,2,[11,40]},{2,5,[21,50]},{5,10,[31,60]},{10,20,[41,60]},{30,20,[51,70]},{50,10,[61,80]},{70,5,[71,80]},{100,2,[81,90]},{150,1,[91,100]}]
A1440: 1437 | B1440: 6 | C1440: 10 | D1440: 2000 | E1440: =R[-9]C -> 51 | F1440: =R[-9]C -> 60 | G1440: 5 | H1440: 20000 | I1440: 110003 | J1440: 5 | K1440: [{5,10},{6,15},{13,10},{14,5},{15,10},{16,5},{20,1},{27,10},{28,10}] | L1440: =R[-1]C -> [{5,1113},{6,1113},{13,18},{14,37},{15,18},{16,37},{20,3},{27,18},{28,18}] | M1440: =R[-1]C -> [{0,1,[1,30]},{1,2,[11,40]},{2,5,[21,50]},{5,10,[31,60]},{10,20,[41,60]},{30,20,[51,70]},{50,10,[61,80]},{70,5,[71,80]},{100,2,[81,90]},{150,1,[91,100]}]
A1441: 1438 | B1441: 6 | C1441: 10 | D1441: 2000 | E1441: =R[-9]C -> 61 | F1441: =R[-9]C -> 70 | G1441: 5 | H1441: 20000 | I1441: 110003 | J1441: 5 | K1441: [{5,10},{6,15},{13,10},{14,5},{15,10},{16,5},{20,1},{27,10},{28,10}] | L1441: =R[-1]C -> [{5,1113},{6,1113},{13,18},{14,37},{15,18},{16,37},{20,3},{27,18},{28,18}] | M1441: =R[-1]C -> [{0,1,[1,30]},{1,2,[11,40]},{2,5,[21,50]},{5,10,[31,60]},{10,20,[41,60]},{30,20,[51,70]},{50,10,[61,80]},{70,5,[71,80]},{100,2,[81,90]},{150,1,[91,100]}]
A1442: 1439 | B1442: 6 | C1442: 10 | D1442: 2000 | E1442: =R[-9]C -> 71 | F1442: =R[-9]C -> 80 | G1442: 5 | H1442: 20000 | I1442: 110003 | J1442: 5 | K1442: [{5,10},{6,15},{13,10},{14,5},{15,10},{16,5},{20,1},{27,10},{28,10}] | L1442: =R[-1]C -> [{5,1113},{6,1113},{13,18},{14,37},{15,18},{16,37},{20,3},{27,18},{28,18}] | M1442: =R[-1]C -> [{0,1,[1,30]},{1,2,[11,40]},{2,5,[21,50]},{5,10,[31,60]},{10,20,[41,60]},{30,20,[51,70]},{50,10,[61,80]},{70,5,[71,80]},{100,2,[81,90]},{150,1,[91,100]}]
A1443: 1440 | B1443: 6 | C1443: 10 | D1443: 2000 | E1443: =R[-9]C -> 81 | F1443: =R[-9]C -> 90 | G1443: 5 | H1443: 20000 | I1443: 110003 | J1443: 5 | K1443: [{5,10},{6,15},{13,10},{14,5},{15,10},{16,5},{20,1},{27,10},{28,10}] | L1443: =R[-1]C -> [{5,1113},{6,1113},{13,18},{14,37},{15,18},{16,37},{20,3},{27,18},{28,18}] | M1443: =R[-1]C -> [{0,1,[1,30]},{1,2,[11,40]},{2,5,[21,50]},{5,10,[31,60]},{10,20,[41,60]},{30,20,[51,70]},{50,10,[61,80]},{70,5,[71,80]},{100,2,[81,90]},{150,1,[91,100]}]
A1444: 1441 | B1444: 2 | C1444: 2 | D1444: 3000 | E1444: =R[-918]C -> 1 | F1444: =R[-918]C -> 10 | G1444: 1 | H1444: 5000 | I1444: 110003 | J1444: 1 | K1444: [{5,10},{6,15},{13,10},{14,5},{15,10},{16,5},{20,1},{27,10},{28,10}] | L1444: =R[-1]C -> [{5,1113},{6,1113},{13,18},{14,37},{15,18},{16,37},{20,3},{27,18},{28,18}] | M1444: =R[-1]C -> [{0,1,[1,30]},{1,2,[11,40]},{2,5,[21,50]},{5,10,[31,60]},{10,20,[41,60]},{30,20,[51,70]},{50,10,[61,80]},{70,5,[71,80]},{100,2,[81,90]},{150,1,[91,100]}]
A1445: 1442 | B1445: 2 | C1445: 2 | D1445: 3000 | E1445: =R[-918]C -> 11 | F1445: =R[-918]C -> 20 | G1445: 1 | H1445: 5000 | I1445: 110003 | J1445: 1 | K1445: [{5,10},{6,15},{13,10},{14,5},{15,10},{16,5},{20,1},{27,10},{28,10}] | L1445: =R[-1]C -> [{5,1113},{6,1113},{13,18},{14,37},{15,18},{16,37},{20,3},{27,18},{28,18}] | M1445: =R[-1]C -> [{0,1,[1,30]},{1,2,[11,40]},{2,5,[21,50]},{5,10,[31,60]},{10,20,[41,60]},{30,20,[51,70]},{50,10,[61,80]},{70,5,[71,80]},{100,2,[81,90]},{150,1,[91,100]}]
A1446: 1443 | B1446: 2 | C1446: 2 | D1446: 3000 | E1446: =R[-918]C -> 21 | F1446: =R[-918]C -> 30 | G1446: 1 | H1446: 5000 | I1446: 110003 | J1446: 1 | K1446: [{5,10},{6,15},{13,10},{14,5},{15,10},{16,5},{20,1},{27,10},{28,10}] | L1446: =R[-1]C -> [{5,1113},{6,1113},{13,18},{14,37},{15,18},{16,37},{20,3},{27,18},{28,18}] | M1446: =R[-1]C -> [{0,1,[1,30]},{1,2,[11,40]},{2,5,[21,50]},{5,10,[31,60]},{10,20,[41,60]},{30,20,[51,70]},{50,10,[61,80]},{70,5,[71,80]},{100,2,[81,90]},{150,1,[91,100]}]
A1447: 1444 | B1447: 2 | C1447: 2 | D1447: 3000 | E1447: =R[-918]C -> 31 | F1447: =R[-918]C -> 40 | G1447: 1 | H1447: 5000 | I1447: 110003 | J1447: 1 | K1447: [{5,10},{6,15},{13,10},{14,5},{15,10},{16,5},{20,1},{27,10},{28,10}] | L1447: =R[-1]C -> [{5,1113},{6,1113},{13,18},{14,37},{15,18},{16,37},{20,3},{27,18},{28,18}] | M1447: =R[-1]C -> [{0,1,[1,30]},{1,2,[11,40]},{2,5,[21,50]},{5,10,[31,60]},{10,20,[41,60]},{30,20,[51,70]},{50,10,[61,80]},{70,5,[71,80]},{100,2,[81,90]},{150,1,[91,100]}]
A1448: 1445 | B1448: 2 | C1448: 2 | D1448: 3000 | E1448: =R[-918]C -> 41 | F1448: =R[-918]C -> 50 | G1448: 1 | H1448: 5000 | I1448: 110003 | J1448: 1 | K1448: [{5,10},{6,15},{13,10},{14,5},{15,10},{16,5},{20,1},{27,10},{28,10}] | L1448: =R[-1]C -> [{5,1113},{6,1113},{13,18},{14,37},{15,18},{16,37},{20,3},{27,18},{28,18}] | M1448: =R[-1]C -> [{0,1,[1,30]},{1,2,[11,40]},{2,5,[21,50]},{5,10,[31,60]},{10,20,[41,60]},{30,20,[51,70]},{50,10,[61,80]},{70,5,[71,80]},{100,2,[81,90]},{150,1,[91,100]}]
A1449: 1446 | B1449: 2 | C1449: 2 | D1449: 3000 | E1449: =R[-918]C -> 51 | F1449: =R[-918]C -> 60 | G1449: 1 | H1449: 5000 | I1449: 110003 | J1449: 1 | K1449: [{5,10},{6,15},{13,10},{14,5},{15,10},{16,5},{20,1},{27,10},{28,10}] | L1449: =R[-1]C -> [{5,1113},{6,1113},{13,18},{14,37},{15,18},{16,37},{20,3},{27,18},{28,18}] | M1449: =R[-1]C -> [{0,1,[1,30]},{1,2,[11,40]},{2,5,[21,50]},{5,10,[31,60]},{10,20,[41,60]},{30,20,[51,70]},{50,10,[61,80]},{70,5,[71,80]},{100,2,[81,90]},{150,1,[91,100]}]
A1450: 1447 | B1450: 2 | C1450: 2 | D1450: 3000 | E1450: =R[-918]C -> 61 | F1450: =R[-918]C -> 70 | G1450: 1 | H1450: 5000 | I1450: 110003 | J1450: 1 | K1450: [{5,10},{6,15},{13,10},{14,5},{15,10},{16,5},{20,1},{27,10},{28,10}] | L1450: =R[-1]C -> [{5,1113},{6,1113},{13,18},{14,37},{15,18},{16,37},{20,3},{27,18},{28,18}] | M1450: =R[-1]C -> [{0,1,[1,30]},{1,2,[11,40]},{2,5,[21,50]},{5,10,[31,60]},{10,20,[41,60]},{30,20,[51,70]},{50,10,[61,80]},{70,5,[71,80]},{100,2,[81,90]},{150,1,[91,100]}]
A1451: 1448 | B1451: 2 | C1451: 2 | D1451: 3000 | E1451: =R[-918]C -> 71 | F1451: =R[-918]C -> 80 | G1451: 1 | H1451: 5000 | I1451: 110003 | J1451: 1 | K1451: [{5,10},{6,15},{13,10},{14,5},{15,10},{16,5},{20,1},{27,10},{28,10}] | L1451: =R[-1]C -> [{5,1113},{6,1113},{13,18},{14,37},{15,18},{16,37},{20,3},{27,18},{28,18}] | M1451: =R[-1]C -> [{0,1,[1,30]},{1,2,[11,40]},{2,5,[21,50]},{5,10,[31,60]},{10,20,[41,60]},{30,20,[51,70]},{50,10,[61,80]},{70,5,[71,80]},{100,2,[81,90]},{150,1,[91,100]}]
A1452: 1449 | B1452: 2 | C1452: 2 | D1452: 3000 | E1452: =R[-918]C -> 81 | F1452: =R[-918]C -> 90 | G1452: 1 | H1452: 5000 | I1452: 110003 | J1452: 1 | K1452: [{5,10},{6,15},{13,10},{14,5},{15,10},{16,5},{20,1},{27,10},{28,10}] | L1452: =R[-1]C -> [{5,1113},{6,1113},{13,18},{14,37},{15,18},{16,37},{20,3},{27,18},{28,18}] | M1452: =R[-1]C -> [{0,1,[1,30]},{1,2,[11,40]},{2,5,[21,50]},{5,10,[31,60]},{10,20,[41,60]},{30,20,[51,70]},{50,10,[61,80]},{70,5,[71,80]},{100,2,[81,90]},{150,1,[91,100]}]
A1453: 1450 | B1453: 3 | C1453: 2 | D1453: 3000 | E1453: =R[-9]C -> 1 | F1453: =R[-9]C -> 10 | G1453: 2 | H1453: 10000 | I1453: 110003 | J1453: 2 | K1453: [{5,10},{6,15},{13,10},{14,5},{15,10},{16,5},{20,1},{27,10},{28,10}] | L1453: =R[-1]C -> [{5,1113},{6,1113},{13,18},{14,37},{15,18},{16,37},{20,3},{27,18},{28,18}] | M1453: =R[-1]C -> [{0,1,[1,30]},{1,2,[11,40]},{2,5,[21,50]},{5,10,[31,60]},{10,20,[41,60]},{30,20,[51,70]},{50,10,[61,80]},{70,5,[71,80]},{100,2,[81,90]},{150,1,[91,100]}]
A1454: 1451 | B1454: 3 | C1454: 2 | D1454: 3000 | E1454: =R[-9]C -> 11 | F1454: =R[-9]C -> 20 | G1454: 2 | H1454: 10000 | I1454: 110003 | J1454: 2 | K1454: [{5,10},{6,15},{13,10},{14,5},{15,10},{16,5},{20,1},{27,10},{28,10}] | L1454: =R[-1]C -> [{5,1113},{6,1113},{13,18},{14,37},{15,18},{16,37},{20,3},{27,18},{28,18}] | M1454: =R[-1]C -> [{0,1,[1,30]},{1,2,[11,40]},{2,5,[21,50]},{5,10,[31,60]},{10,20,[41,60]},{30,20,[51,70]},{50,10,[61,80]},{70,5,[71,80]},{100,2,[81,90]},{150,1,[91,100]}]
A1455: 1452 | B1455: 3 | C1455: 2 | D1455: 3000 | E1455: =R[-9]C -> 21 | F1455: =R[-9]C -> 30 | G1455: 2 | H1455: 10000 | I1455: 110003 | J1455: 2 | K1455: [{5,10},{6,15},{13,10},{14,5},{15,10},{16,5},{20,1},{27,10},{28,10}] | L1455: =R[-1]C -> [{5,1113},{6,1113},{13,18},{14,37},{15,18},{16,37},{20,3},{27,18},{28,18}] | M1455: =R[-1]C -> [{0,1,[1,30]},{1,2,[11,40]},{2,5,[21,50]},{5,10,[31,60]},{10,20,[41,60]},{30,20,[51,70]},{50,10,[61,80]},{70,5,[71,80]},{100,2,[81,90]},{150,1,[91,100]}]
A1456: 1453 | B1456: 3 | C1456: 2 | D1456: 3000 | E1456: =R[-9]C -> 31 | F1456: =R[-9]C -> 40 | G1456: 2 | H1456: 10000 | I1456: 110003 | J1456: 2 | K1456: [{5,10},{6,15},{13,10},{14,5},{15,10},{16,5},{20,1},{27,10},{28,10}] | L1456: =R[-1]C -> [{5,1113},{6,1113},{13,18},{14,37},{15,18},{16,37},{20,3},{27,18},{28,18}] | M1456: =R[-1]C -> [{0,1,[1,30]},{1,2,[11,40]},{2,5,[21,50]},{5,10,[31,60]},{10,20,[41,60]},{30,20,[51,70]},{50,10,[61,80]},{70,5,[71,80]},{100,2,[81,90]},{150,1,[91,100]}]
A1457: 1454 | B1457: 3 | C1457: 2 | D1457: 3000 | E1457: =R[-9]C -> 41 | F1457: =R[-9]C -> 50 | G1457: 2 | H1457: 10000 | I1457: 110003 | J1457: 2 | K1457: [{5,10},{6,15},{13,10},{14,5},{15,10},{16,5},{20,1},{27,10},{28,10}] | L1457: =R[-1]C -> [{5,1113},{6,1113},{13,18},{14,37},{15,18},{16,37},{20,3},{27,18},{28,18}] | M1457: =R[-1]C -> [{0,1,[1,30]},{1,2,[11,40]},{2,5,[21,50]},{5,10,[31,60]},{10,20,[41,60]},{30,20,[51,70]},{50,10,[61,80]},{70,5,[71,80]},{100,2,[81,90]},{150,1,[91,100]}]
A1458: 1455 | B1458: 3 | C1458: 2 | D1458: 3000 | E1458: =R[-9]C -> 51 | F1458: =R[-9]C -> 60 | G1458: 2 | H1458: 10000 | I1458: 110003 | J1458: 2 | K1458: [{5,10},{6,15},{13,10},{14,5},{15,10},{16,5},{20,1},{27,10},{28,10}] | L1458: =R[-1]C -> [{5,1113},{6,1113},{13,18},{14,37},{15,18},{16,37},{20,3},{27,18},{28,18}] | M1458: =R[-1]C -> [{0,1,[1,30]},{1,2,[11,40]},{2,5,[21,50]},{5,10,[31,60]},{10,20,[41,60]},{30,20,[51,70]},{50,10,[61,80]},{70,5,[71,80]},{100,2,[81,90]},{150,1,[91,100]}]
A1459: 1456 | B1459: 3 | C1459: 2 | D1459: 3000 | E1459: =R[-9]C -> 61 | F1459: =R[-9]C -> 70 | G1459: 2 | H1459: 10000 | I1459: 110003 | J1459: 2 | K1459: [{5,10},{6,15},{13,10},{14,5},{15,10},{16,5},{20,1},{27,10},{28,10}] | L1459: =R[-1]C -> [{5,1113},{6,1113},{13,18},{14,37},{15,18},{16,37},{20,3},{27,18},{28,18}] | M1459: =R[-1]C -> [{0,1,[1,30]},{1,2,[11,40]},{2,5,[21,50]},{5,10,[31,60]},{10,20,[41,60]},{30,20,[51,70]},{50,10,[61,80]},{70,5,[71,80]},{100,2,[81,90]},{150,1,[91,100]}]
A1460: 1457 | B1460: 3 | C1460: 2 | D1460: 3000 | E1460: =R[-9]C -> 71 | F1460: =R[-9]C -> 80 | G1460: 2 | H1460: 10000 | I1460: 110003 | J1460: 2 | K1460: [{5,10},{6,15},{13,10},{14,5},{15,10},{16,5},{20,1},{27,10},{28,10}] | L1460: =R[-1]C -> [{5,1113},{6,1113},{13,18},{14,37},{15,18},{16,37},{20,3},{27,18},{28,18}] | M1460: =R[-1]C -> [{0,1,[1,30]},{1,2,[11,40]},{2,5,[21,50]},{5,10,[31,60]},{10,20,[41,60]},{30,20,[51,70]},{50,10,[61,80]},{70,5,[71,80]},{100,2,[81,90]},{150,1,[91,100]}]
A1461: 1458 | B1461: 3 | C1461: 2 | D1461: 3000 | E1461: =R[-9]C -> 81 | F1461: =R[-9]C -> 90 | G1461: 2 | H1461: 10000 | I1461: 110003 | J1461: 2 | K1461: [{5,10},{6,15},{13,10},{14,5},{15,10},{16,5},{20,1},{27,10},{28,10}] | L1461: =R[-1]C -> [{5,1113},{6,1113},{13,18},{14,37},{15,18},{16,37},{20,3},{27,18},{28,18}] | M1461: =R[-1]C -> [{0,1,[1,30]},{1,2,[11,40]},{2,5,[21,50]},{5,10,[31,60]},{10,20,[41,60]},{30,20,[51,70]},{50,10,[61,80]},{70,5,[71,80]},{100,2,[81,90]},{150,1,[91,100]}]
A1462: 1459 | B1462: 4 | C1462: 2 | D1462: 3000 | E1462: =R[-9]C -> 1 | F1462: =R[-9]C -> 10 | G1462: 3 | H1462: 15000 | I1462: 110003 | J1462: 3 | K1462: [{5,10},{6,15},{13,10},{14,5},{15,10},{16,5},{20,1},{27,10},{28,10}] | L1462: =R[-1]C -> [{5,1113},{6,1113},{13,18},{14,37},{15,18},{16,37},{20,3},{27,18},{28,18}] | M1462: =R[-1]C -> [{0,1,[1,30]},{1,2,[11,40]},{2,5,[21,50]},{5,10,[31,60]},{10,20,[41,60]},{30,20,[51,70]},{50,10,[61,80]},{70,5,[71,80]},{100,2,[81,90]},{150,1,[91,100]}]
A1463: 1460 | B1463: 4 | C1463: 2 | D1463: 3000 | E1463: =R[-9]C -> 11 | F1463: =R[-9]C -> 20 | G1463: 3 | H1463: 15000 | I1463: 110003 | J1463: 3 | K1463: [{5,10},{6,15},{13,10},{14,5},{15,10},{16,5},{20,1},{27,10},{28,10}] | L1463: =R[-1]C -> [{5,1113},{6,1113},{13,18},{14,37},{15,18},{16,37},{20,3},{27,18},{28,18}] | M1463: =R[-1]C -> [{0,1,[1,30]},{1,2,[11,40]},{2,5,[21,50]},{5,10,[31,60]},{10,20,[41,60]},{30,20,[51,70]},{50,10,[61,80]},{70,5,[71,80]},{100,2,[81,90]},{150,1,[91,100]}]
A1464: 1461 | B1464: 4 | C1464: 2 | D1464: 3000 | E1464: =R[-9]C -> 21 | F1464: =R[-9]C -> 30 | G1464: 3 | H1464: 15000 | I1464: 110003 | J1464: 3 | K1464: [{5,10},{6,15},{13,10},{14,5},{15,10},{16,5},{20,1},{27,10},{28,10}] | L1464: =R[-1]C -> [{5,1113},{6,1113},{13,18},{14,37},{15,18},{16,37},{20,3},{27,18},{28,18}] | M1464: =R[-1]C -> [{0,1,[1,30]},{1,2,[11,40]},{2,5,[21,50]},{5,10,[31,60]},{10,20,[41,60]},{30,20,[51,70]},{50,10,[61,80]},{70,5,[71,80]},{100,2,[81,90]},{150,1,[91,100]}]
A1465: 1462 | B1465: 4 | C1465: 2 | D1465: 3000 | E1465: =R[-9]C -> 31 | F1465: =R[-9]C -> 40 | G1465: 3 | H1465: 15000 | I1465: 110003 | J1465: 3 | K1465: [{5,10},{6,15},{13,10},{14,5},{15,10},{16,5},{20,1},{27,10},{28,10}] | L1465: =R[-1]C -> [{5,1113},{6,1113},{13,18},{14,37},{15,18},{16,37},{20,3},{27,18},{28,18}] | M1465: =R[-1]C -> [{0,1,[1,30]},{1,2,[11,40]},{2,5,[21,50]},{5,10,[31,60]},{10,20,[41,60]},{30,20,[51,70]},{50,10,[61,80]},{70,5,[71,80]},{100,2,[81,90]},{150,1,[91,100]}]
A1466: 1463 | B1466: 4 | C1466: 2 | D1466: 3000 | E1466: =R[-9]C -> 41 | F1466: =R[-9]C -> 50 | G1466: 3 | H1466: 15000 | I1466: 110003 | J1466: 3 | K1466: [{5,10},{6,15},{13,10},{14,5},{15,10},{16,5},{20,1},{27,10},{28,10}] | L1466: =R[-1]C -> [{5,1113},{6,1113},{13,18},{14,37},{15,18},{16,37},{20,3},{27,18},{28,18}] | M1466: =R[-1]C -> [{0,1,[1,30]},{1,2,[11,40]},{2,5,[21,50]},{5,10,[31,60]},{10,20,[41,60]},{30,20,[51,70]},{50,10,[61,80]},{70,5,[71,80]},{100,2,[81,90]},{150,1,[91,100]}]
A1467: 1464 | B1467: 4 | C1467: 2 | D1467: 3000 | E1467: =R[-9]C -> 51 | F1467: =R[-9]C -> 60 | G1467: 3 | H1467: 15000 | I1467: 110003 | J1467: 3 | K1467: [{5,10},{6,15},{13,10},{14,5},{15,10},{16,5},{20,1},{27,10},{28,10}] | L1467: =R[-1]C -> [{5,1113},{6,1113},{13,18},{14,37},{15,18},{16,37},{20,3},{27,18},{28,18}] | M1467: =R[-1]C -> [{0,1,[1,30]},{1,2,[11,40]},{2,5,[21,50]},{5,10,[31,60]},{10,20,[41,60]},{30,20,[51,70]},{50,10,[61,80]},{70,5,[71,80]},{100,2,[81,90]},{150,1,[91,100]}]
A1468: 1465 | B1468: 4 | C1468: 2 | D1468: 3000 | E1468: =R[-9]C -> 61 | F1468: =R[-9]C -> 70 | G1468: 3 | H1468: 15000 | I1468: 110003 | J1468: 3 | K1468: [{5,10},{6,15},{13,10},{14,5},{15,10},{16,5},{20,1},{27,10},{28,10}] | L1468: =R[-1]C -> [{5,1113},{6,1113},{13,18},{14,37},{15,18},{16,37},{20,3},{27,18},{28,18}] | M1468: =R[-1]C -> [{0,1,[1,30]},{1,2,[11,40]},{2,5,[21,50]},{5,10,[31,60]},{10,20,[41,60]},{30,20,[51,70]},{50,10,[61,80]},{70,5,[71,80]},{100,2,[81,90]},{150,1,[91,100]}]
A1469: 1466 | B1469: 4 | C1469: 2 | D1469: 3000 | E1469: =R[-9]C -> 71 | F1469: =R[-9]C -> 80 | G1469: 3 | H1469: 15000 | I1469: 110003 | J1469: 3 | K1469: [{5,10},{6,15},{13,10},{14,5},{15,10},{16,5},{20,1},{27,10},{28,10}] | L1469: =R[-1]C -> [{5,1113},{6,1113},{13,18},{14,37},{15,18},{16,37},{20,3},{27,18},{28,18}] | M1469: =R[-1]C -> [{0,1,[1,30]},{1,2,[11,40]},{2,5,[21,50]},{5,10,[31,60]},{10,20,[41,60]},{30,20,[51,70]},{50,10,[61,80]},{70,5,[71,80]},{100,2,[81,90]},{150,1,[91,100]}]
A1470: 1467 | B1470: 4 | C1470: 2 | D1470: 3000 | E1470: =R[-9]C -> 81 | F1470: =R[-9]C -> 90 | G1470: 3 | H1470: 15000 | I1470: 110003 | J1470: 3 | K1470: [{5,10},{6,15},{13,10},{14,5},{15,10},{16,5},{20,1},{27,10},{28,10}] | L1470: =R[-1]C -> [{5,1113},{6,1113},{13,18},{14,37},{15,18},{16,37},{20,3},{27,18},{28,18}] | M1470: =R[-1]C -> [{0,1,[1,30]},{1,2,[11,40]},{2,5,[21,50]},{5,10,[31,60]},{10,20,[41,60]},{30,20,[51,70]},{50,10,[61,80]},{70,5,[71,80]},{100,2,[81,90]},{150,1,[91,100]}]
A1471: 1468 | B1471: 5 | C1471: 2 | D1471: 3000 | E1471: =R[-9]C -> 1 | F1471: =R[-9]C -> 10 | G1471: 4 | H1471: 20000 | I1471: 110003 | J1471: 4 | K1471: [{5,10},{6,15},{13,10},{14,5},{15,10},{16,5},{20,1},{27,10},{28,10}] | L1471: =R[-1]C -> [{5,1113},{6,1113},{13,18},{14,37},{15,18},{16,37},{20,3},{27,18},{28,18}] | M1471: =R[-1]C -> [{0,1,[1,30]},{1,2,[11,40]},{2,5,[21,50]},{5,10,[31,60]},{10,20,[41,60]},{30,20,[51,70]},{50,10,[61,80]},{70,5,[71,80]},{100,2,[81,90]},{150,1,[91,100]}]
A1472: 1469 | B1472: 5 | C1472: 2 | D1472: 3000 | E1472: =R[-9]C -> 11 | F1472: =R[-9]C -> 20 | G1472: 4 | H1472: 20000 | I1472: 110003 | J1472: 4 | K1472: [{5,10},{6,15},{13,10},{14,5},{15,10},{16,5},{20,1},{27,10},{28,10}] | L1472: =R[-1]C -> [{5,1113},{6,1113},{13,18},{14,37},{15,18},{16,37},{20,3},{27,18},{28,18}] | M1472: =R[-1]C -> [{0,1,[1,30]},{1,2,[11,40]},{2,5,[21,50]},{5,10,[31,60]},{10,20,[41,60]},{30,20,[51,70]},{50,10,[61,80]},{70,5,[71,80]},{100,2,[81,90]},{150,1,[91,100]}]
A1473: 1470 | B1473: 5 | C1473: 2 | D1473: 3000 | E1473: =R[-9]C -> 21 | F1473: =R[-9]C -> 30 | G1473: 4 | H1473: 20000 | I1473: 110003 | J1473: 4 | K1473: [{5,10},{6,15},{13,10},{14,5},{15,10},{16,5},{20,1},{27,10},{28,10}] | L1473: =R[-1]C -> [{5,1113},{6,1113},{13,18},{14,37},{15,18},{16,37},{20,3},{27,18},{28,18}] | M1473: =R[-1]C -> [{0,1,[1,30]},{1,2,[11,40]},{2,5,[21,50]},{5,10,[31,60]},{10,20,[41,60]},{30,20,[51,70]},{50,10,[61,80]},{70,5,[71,80]},{100,2,[81,90]},{150,1,[91,100]}]
A1474: 1471 | B1474: 5 | C1474: 2 | D1474: 3000 | E1474: =R[-9]C -> 31 | F1474: =R[-9]C -> 40 | G1474: 4 | H1474: 20000 | I1474: 110003 | J1474: 4 | K1474: [{5,10},{6,15},{13,10},{14,5},{15,10},{16,5},{20,1},{27,10},{28,10}] | L1474: =R[-1]C -> [{5,1113},{6,1113},{13,18},{14,37},{15,18},{16,37},{20,3},{27,18},{28,18}] | M1474: =R[-1]C -> [{0,1,[1,30]},{1,2,[11,40]},{2,5,[21,50]},{5,10,[31,60]},{10,20,[41,60]},{30,20,[51,70]},{50,10,[61,80]},{70,5,[71,80]},{100,2,[81,90]},{150,1,[91,100]}]
A1475: 1472 | B1475: 5 | C1475: 2 | D1475: 3000 | E1475: =R[-9]C -> 41 | F1475: =R[-9]C -> 50 | G1475: 4 | H1475: 20000 | I1475: 110003 | J1475: 4 | K1475: [{5,10},{6,15},{13,10},{14,5},{15,10},{16,5},{20,1},{27,10},{28,10}] | L1475: =R[-1]C -> [{5,1113},{6,1113},{13,18},{14,37},{15,18},{16,37},{20,3},{27,18},{28,18}] | M1475: =R[-1]C -> [{0,1,[1,30]},{1,2,[11,40]},{2,5,[21,50]},{5,10,[31,60]},{10,20,[41,60]},{30,20,[51,70]},{50,10,[61,80]},{70,5,[71,80]},{100,2,[81,90]},{150,1,[91,100]}]
A1476: 1473 | B1476: 5 | C1476: 2 | D1476: 3000 | E1476: =R[-9]C -> 51 | F1476: =R[-9]C -> 60 | G1476: 4 | H1476: 20000 | I1476: 110003 | J1476: 4 | K1476: [{5,10},{6,15},{13,10},{14,5},{15,10},{16,5},{20,1},{27,10},{28,10}] | L1476: =R[-1]C -> [{5,1113},{6,1113},{13,18},{14,37},{15,18},{16,37},{20,3},{27,18},{28,18}] | M1476: =R[-1]C -> [{0,1,[1,30]},{1,2,[11,40]},{2,5,[21,50]},{5,10,[31,60]},{10,20,[41,60]},{30,20,[51,70]},{50,10,[61,80]},{70,5,[71,80]},{100,2,[81,90]},{150,1,[91,100]}]
A1477: 1474 | B1477: 5 | C1477: 2 | D1477: 3000 | E1477: =R[-9]C -> 61 | F1477: =R[-9]C -> 70 | G1477: 4 | H1477: 20000 | I1477: 110003 | J1477: 4 | K1477: [{5,10},{6,15},{13,10},{14,5},{15,10},{16,5},{20,1},{27,10},{28,10}] | L1477: =R[-1]C -> [{5,1113},{6,1113},{13,18},{14,37},{15,18},{16,37},{20,3},{27,18},{28,18}] | M1477: =R[-1]C -> [{0,1,[1,30]},{1,2,[11,40]},{2,5,[21,50]},{5,10,[31,60]},{10,20,[41,60]},{30,20,[51,70]},{50,10,[61,80]},{70,5,[71,80]},{100,2,[81,90]},{150,1,[91,100]}]
A1478: 1475 | B1478: 5 | C1478: 2 | D1478: 3000 | E1478: =R[-9]C -> 71 | F1478: =R[-9]C -> 80 | G1478: 4 | H1478: 20000 | I1478: 110003 | J1478: 4 | K1478: [{5,10},{6,15},{13,10},{14,5},{15,10},{16,5},{20,1},{27,10},{28,10}] | L1478: =R[-1]C -> [{5,1113},{6,1113},{13,18},{14,37},{15,18},{16,37},{20,3},{27,18},{28,18}] | M1478: =R[-1]C -> [{0,1,[1,30]},{1,2,[11,40]},{2,5,[21,50]},{5,10,[31,60]},{10,20,[41,60]},{30,20,[51,70]},{50,10,[61,80]},{70,5,[71,80]},{100,2,[81,90]},{150,1,[91,100]}]
A1479: 1476 | B1479: 5 | C1479: 2 | D1479: 3000 | E1479: =R[-9]C -> 81 | F1479: =R[-9]C -> 90 | G1479: 4 | H1479: 20000 | I1479: 110003 | J1479: 4 | K1479: [{5,10},{6,15},{13,10},{14,5},{15,10},{16,5},{20,1},{27,10},{28,10}] | L1479: =R[-1]C -> [{5,1113},{6,1113},{13,18},{14,37},{15,18},{16,37},{20,3},{27,18},{28,18}] | M1479: =R[-1]C -> [{0,1,[1,30]},{1,2,[11,40]},{2,5,[21,50]},{5,10,[31,60]},{10,20,[41,60]},{30,20,[51,70]},{50,10,[61,80]},{70,5,[71,80]},{100,2,[81,90]},{150,1,[91,100]}]
A1480: 1477 | B1480: 6 | C1480: 2 | D1480: 3000 | E1480: =R[-9]C -> 1 | F1480: =R[-9]C -> 10 | G1480: 5 | H1480: 20000 | I1480: 110003 | J1480: 5 | K1480: [{5,10},{6,15},{13,10},{14,5},{15,10},{16,5},{20,1},{27,10},{28,10}] | L1480: =R[-1]C -> [{5,1113},{6,1113},{13,18},{14,37},{15,18},{16,37},{20,3},{27,18},{28,18}] | M1480: =R[-1]C -> [{0,1,[1,30]},{1,2,[11,40]},{2,5,[21,50]},{5,10,[31,60]},{10,20,[41,60]},{30,20,[51,70]},{50,10,[61,80]},{70,5,[71,80]},{100,2,[81,90]},{150,1,[91,100]}]
A1481: 1478 | B1481: 6 | C1481: 2 | D1481: 3000 | E1481: =R[-9]C -> 11 | F1481: =R[-9]C -> 20 | G1481: 5 | H1481: 20000 | I1481: 110003 | J1481: 5 | K1481: [{5,10},{6,15},{13,10},{14,5},{15,10},{16,5},{20,1},{27,10},{28,10}] | L1481: =R[-1]C -> [{5,1113},{6,1113},{13,18},{14,37},{15,18},{16,37},{20,3},{27,18},{28,18}] | M1481: =R[-1]C -> [{0,1,[1,30]},{1,2,[11,40]},{2,5,[21,50]},{5,10,[31,60]},{10,20,[41,60]},{30,20,[51,70]},{50,10,[61,80]},{70,5,[71,80]},{100,2,[81,90]},{150,1,[91,100]}]
A1482: 1479 | B1482: 6 | C1482: 2 | D1482: 3000 | E1482: =R[-9]C -> 21 | F1482: =R[-9]C -> 30 | G1482: 5 | H1482: 20000 | I1482: 110003 | J1482: 5 | K1482: [{5,10},{6,15},{13,10},{14,5},{15,10},{16,5},{20,1},{27,10},{28,10}] | L1482: =R[-1]C -> [{5,1113},{6,1113},{13,18},{14,37},{15,18},{16,37},{20,3},{27,18},{28,18}] | M1482: =R[-1]C -> [{0,1,[1,30]},{1,2,[11,40]},{2,5,[21,50]},{5,10,[31,60]},{10,20,[41,60]},{30,20,[51,70]},{50,10,[61,80]},{70,5,[71,80]},{100,2,[81,90]},{150,1,[91,100]}]
A1483: 1480 | B1483: 6 | C1483: 2 | D1483: 3000 | E1483: =R[-9]C -> 31 | F1483: =R[-9]C -> 40 | G1483: 5 | H1483: 20000 | I1483: 110003 | J1483: 5 | K1483: [{5,10},{6,15},{13,10},{14,5},{15,10},{16,5},{20,1},{27,10},{28,10}] | L1483: =R[-1]C -> [{5,1113},{6,1113},{13,18},{14,37},{15,18},{16,37},{20,3},{27,18},{28,18}] | M1483: =R[-1]C -> [{0,1,[1,30]},{1,2,[11,40]},{2,5,[21,50]},{5,10,[31,60]},{10,20,[41,60]},{30,20,[51,70]},{50,10,[61,80]},{70,5,[71,80]},{100,2,[81,90]},{150,1,[91,100]}]
A1484: 1481 | B1484: 6 | C1484: 2 | D1484: 3000 | E1484: =R[-9]C -> 41 | F1484: =R[-9]C -> 50 | G1484: 5 | H1484: 20000 | I1484: 110003 | J1484: 5 | K1484: [{5,10},{6,15},{13,10},{14,5},{15,10},{16,5},{20,1},{27,10},{28,10}] | L1484: =R[-1]C -> [{5,1113},{6,1113},{13,18},{14,37},{15,18},{16,37},{20,3},{27,18},{28,18}] | M1484: =R[-1]C -> [{0,1,[1,30]},{1,2,[11,40]},{2,5,[21,50]},{5,10,[31,60]},{10,20,[41,60]},{30,20,[51,70]},{50,10,[61,80]},{70,5,[71,80]},{100,2,[81,90]},{150,1,[91,100]}]
A1485: 1482 | B1485: 6 | C1485: 2 | D1485: 3000 | E1485: =R[-9]C -> 51 | F1485: =R[-9]C -> 60 | G1485: 5 | H1485: 20000 | I1485: 110003 | J1485: 5 | K1485: [{5,10},{6,15},{13,10},{14,5},{15,10},{16,5},{20,1},{27,10},{28,10}] | L1485: =R[-1]C -> [{5,1113},{6,1113},{13,18},{14,37},{15,18},{16,37},{20,3},{27,18},{28,18}] | M1485: =R[-1]C -> [{0,1,[1,30]},{1,2,[11,40]},{2,5,[21,50]},{5,10,[31,60]},{10,20,[41,60]},{30,20,[51,70]},{50,10,[61,80]},{70,5,[71,80]},{100,2,[81,90]},{150,1,[91,100]}]
A1486: 1483 | B1486: 6 | C1486: 2 | D1486: 3000 | E1486: =R[-9]C -> 61 | F1486: =R[-9]C -> 70 | G1486: 5 | H1486: 20000 | I1486: 110003 | J1486: 5 | K1486: [{5,10},{6,15},{13,10},{14,5},{15,10},{16,5},{20,1},{27,10},{28,10}] | L1486: =R[-1]C -> [{5,1113},{6,1113},{13,18},{14,37},{15,18},{16,37},{20,3},{27,18},{28,18}] | M1486: =R[-1]C -> [{0,1,[1,30]},{1,2,[11,40]},{2,5,[21,50]},{5,10,[31,60]},{10,20,[41,60]},{30,20,[51,70]},{50,10,[61,80]},{70,5,[71,80]},{100,2,[81,90]},{150,1,[91,100]}]
A1487: 1484 | B1487: 6 | C1487: 2 | D1487: 3000 | E1487: =R[-9]C -> 71 | F1487: =R[-9]C -> 80 | G1487: 5 | H1487: 20000 | I1487: 110003 | J1487: 5 | K1487: [{5,10},{6,15},{13,10},{14,5},{15,10},{16,5},{20,1},{27,10},{28,10}] | L1487: =R[-1]C -> [{5,1113},{6,1113},{13,18},{14,37},{15,18},{16,37},{20,3},{27,18},{28,18}] | M1487: =R[-1]C -> [{0,1,[1,30]},{1,2,[11,40]},{2,5,[21,50]},{5,10,[31,60]},{10,20,[41,60]},{30,20,[51,70]},{50,10,[61,80]},{70,5,[71,80]},{100,2,[81,90]},{150,1,[91,100]}]
A1488: 1485 | B1488: 6 | C1488: 2 | D1488: 3000 | E1488: =R[-9]C -> 81 | F1488: =R[-9]C -> 90 | G1488: 5 | H1488: 20000 | I1488: 110003 | J1488: 5 | K1488: [{5,10},{6,15},{13,10},{14,5},{15,10},{16,5},{20,1},{27,10},{28,10}] | L1488: =R[-1]C -> [{5,1113},{6,1113},{13,18},{14,37},{15,18},{16,37},{20,3},{27,18},{28,18}] | M1488: =R[-1]C -> [{0,1,[1,30]},{1,2,[11,40]},{2,5,[21,50]},{5,10,[31,60]},{10,20,[41,60]},{30,20,[51,70]},{50,10,[61,80]},{70,5,[71,80]},{100,2,[81,90]},{150,1,[91,100]}]
A1489: 1486 | B1489: 2 | C1489: 3 | D1489: 3000 | E1489: =R[-18]C -> 1 | F1489: =R[-18]C -> 10 | G1489: 1 | H1489: 5000 | I1489: 110003 | J1489: 1 | K1489: [{5,10},{6,15},{13,10},{14,5},{15,10},{16,5},{20,1},{27,10},{28,10}] | L1489: =R[-1]C -> [{5,1113},{6,1113},{13,18},{14,37},{15,18},{16,37},{20,3},{27,18},{28,18}] | M1489: =R[-1]C -> [{0,1,[1,30]},{1,2,[11,40]},{2,5,[21,50]},{5,10,[31,60]},{10,20,[41,60]},{30,20,[51,70]},{50,10,[61,80]},{70,5,[71,80]},{100,2,[81,90]},{150,1,[91,100]}]
A1490: 1487 | B1490: 2 | C1490: 3 | D1490: 3000 | E1490: =R[-18]C -> 11 | F1490: =R[-18]C -> 20 | G1490: 1 | H1490: 5000 | I1490: 110003 | J1490: 1 | K1490: [{5,10},{6,15},{13,10},{14,5},{15,10},{16,5},{20,1},{27,10},{28,10}] | L1490: =R[-1]C -> [{5,1113},{6,1113},{13,18},{14,37},{15,18},{16,37},{20,3},{27,18},{28,18}] | M1490: =R[-1]C -> [{0,1,[1,30]},{1,2,[11,40]},{2,5,[21,50]},{5,10,[31,60]},{10,20,[41,60]},{30,20,[51,70]},{50,10,[61,80]},{70,5,[71,80]},{100,2,[81,90]},{150,1,[91,100]}]
A1491: 1488 | B1491: 2 | C1491: 3 | D1491: 3000 | E1491: =R[-18]C -> 21 | F1491: =R[-18]C -> 30 | G1491: 1 | H1491: 5000 | I1491: 110003 | J1491: 1 | K1491: [{5,10},{6,15},{13,10},{14,5},{15,10},{16,5},{20,1},{27,10},{28,10}] | L1491: =R[-1]C -> [{5,1113},{6,1113},{13,18},{14,37},{15,18},{16,37},{20,3},{27,18},{28,18}] | M1491: =R[-1]C -> [{0,1,[1,30]},{1,2,[11,40]},{2,5,[21,50]},{5,10,[31,60]},{10,20,[41,60]},{30,20,[51,70]},{50,10,[61,80]},{70,5,[71,80]},{100,2,[81,90]},{150,1,[91,100]}]
A1492: 1489 | B1492: 2 | C1492: 3 | D1492: 3000 | E1492: =R[-18]C -> 31 | F1492: =R[-18]C -> 40 | G1492: 1 | H1492: 5000 | I1492: 110003 | J1492: 1 | K1492: [{5,10},{6,15},{13,10},{14,5},{15,10},{16,5},{20,1},{27,10},{28,10}] | L1492: =R[-1]C -> [{5,1113},{6,1113},{13,18},{14,37},{15,18},{16,37},{20,3},{27,18},{28,18}] | M1492: =R[-1]C -> [{0,1,[1,30]},{1,2,[11,40]},{2,5,[21,50]},{5,10,[31,60]},{10,20,[41,60]},{30,20,[51,70]},{50,10,[61,80]},{70,5,[71,80]},{100,2,[81,90]},{150,1,[91,100]}]
A1493: 1490 | B1493: 2 | C1493: 3 | D1493: 3000 | E1493: =R[-18]C -> 41 | F1493: =R[-18]C -> 50 | G1493: 1 | H1493: 5000 | I1493: 110003 | J1493: 1 | K1493: [{5,10},{6,15},{13,10},{14,5},{15,10},{16,5},{20,1},{27,10},{28,10}] | L1493: =R[-1]C -> [{5,1113},{6,1113},{13,18},{14,37},{15,18},{16,37},{20,3},{27,18},{28,18}] | M1493: =R[-1]C -> [{0,1,[1,30]},{1,2,[11,40]},{2,5,[21,50]},{5,10,[31,60]},{10,20,[41,60]},{30,20,[51,70]},{50,10,[61,80]},{70,5,[71,80]},{100,2,[81,90]},{150,1,[91,100]}]
A1494: 1491 | B1494: 2 | C1494: 3 | D1494: 3000 | E1494: =R[-18]C -> 51 | F1494: =R[-18]C -> 60 | G1494: 1 | H1494: 5000 | I1494: 110003 | J1494: 1 | K1494: [{5,10},{6,15},{13,10},{14,5},{15,10},{16,5},{20,1},{27,10},{28,10}] | L1494: =R[-1]C -> [{5,1113},{6,1113},{13,18},{14,37},{15,18},{16,37},{20,3},{27,18},{28,18}] | M1494: =R[-1]C -> [{0,1,[1,30]},{1,2,[11,40]},{2,5,[21,50]},{5,10,[31,60]},{10,20,[41,60]},{30,20,[51,70]},{50,10,[61,80]},{70,5,[71,80]},{100,2,[81,90]},{150,1,[91,100]}]
A1495: 1492 | B1495: 2 | C1495: 3 | D1495: 3000 | E1495: =R[-18]C -> 61 | F1495: =R[-18]C -> 70 | G1495: 1 | H1495: 5000 | I1495: 110003 | J1495: 1 | K1495: [{5,10},{6,15},{13,10},{14,5},{15,10},{16,5},{20,1},{27,10},{28,10}] | L1495: =R[-1]C -> [{5,1113},{6,1113},{13,18},{14,37},{15,18},{16,37},{20,3},{27,18},{28,18}] | M1495: =R[-1]C -> [{0,1,[1,30]},{1,2,[11,40]},{2,5,[21,50]},{5,10,[31,60]},{10,20,[41,60]},{30,20,[51,70]},{50,10,[61,80]},{70,5,[71,80]},{100,2,[81,90]},{150,1,[91,100]}]
A1496: 1493 | B1496: 2 | C1496: 3 | D1496: 3000 | E1496: =R[-18]C -> 71 | F1496: =R[-18]C -> 80 | G1496: 1 | H1496: 5000 | I1496: 110003 | J1496: 1 | K1496: [{5,10},{6,15},{13,10},{14,5},{15,10},{16,5},{20,1},{27,10},{28,10}] | L1496: =R[-1]C -> [{5,1113},{6,1113},{13,18},{14,37},{15,18},{16,37},{20,3},{27,18},{28,18}] | M1496: =R[-1]C -> [{0,1,[1,30]},{1,2,[11,40]},{2,5,[21,50]},{5,10,[31,60]},{10,20,[41,60]},{30,20,[51,70]},{50,10,[61,80]},{70,5,[71,80]},{100,2,[81,90]},{150,1,[91,100]}]
A1497: 1494 | B1497: 2 | C1497: 3 | D1497: 3000 | E1497: =R[-18]C -> 81 | F1497: =R[-18]C -> 90 | G1497: 1 | H1497: 5000 | I1497: 110003 | J1497: 1 | K1497: [{5,10},{6,15},{13,10},{14,5},{15,10},{16,5},{20,1},{27,10},{28,10}] | L1497: =R[-1]C -> [{5,1113},{6,1113},{13,18},{14,37},{15,18},{16,37},{20,3},{27,18},{28,18}] | M1497: =R[-1]C -> [{0,1,[1,30]},{1,2,[11,40]},{2,5,[21,50]},{5,10,[31,60]},{10,20,[41,60]},{30,20,[51,70]},{50,10,[61,80]},{70,5,[71,80]},{100,2,[81,90]},{150,1,[91,100]}]
A1498: 1495 | B1498: 3 | C1498: 3 | D1498: 3000 | E1498: =R[-9]C -> 1 | F1498: =R[-9]C -> 10 | G1498: 2 | H1498: 10000 | I1498: 110003 | J1498: 2 | K1498: [{5,10},{6,15},{13,10},{14,5},{15,10},{16,5},{20,1},{27,10},{28,10}] | L1498: =R[-1]C -> [{5,1113},{6,1113},{13,18},{14,37},{15,18},{16,37},{20,3},{27,18},{28,18}] | M1498: =R[-1]C -> [{0,1,[1,30]},{1,2,[11,40]},{2,5,[21,50]},{5,10,[31,60]},{10,20,[41,60]},{30,20,[51,70]},{50,10,[61,80]},{70,5,[71,80]},{100,2,[81,90]},{150,1,[91,100]}]
A1499: 1496 | B1499: 3 | C1499: 3 | D1499: 3000 | E1499: =R[-9]C -> 11 | F1499: =R[-9]C -> 20 | G1499: 2 | H1499: 10000 | I1499: 110003 | J1499: 2 | K1499: [{5,10},{6,15},{13,10},{14,5},{15,10},{16,5},{20,1},{27,10},{28,10}] | L1499: =R[-1]C -> [{5,1113},{6,1113},{13,18},{14,37},{15,18},{16,37},{20,3},{27,18},{28,18}] | M1499: =R[-1]C -> [{0,1,[1,30]},{1,2,[11,40]},{2,5,[21,50]},{5,10,[31,60]},{10,20,[41,60]},{30,20,[51,70]},{50,10,[61,80]},{70,5,[71,80]},{100,2,[81,90]},{150,1,[91,100]}]
A1500: 1497 | B1500: 3 | C1500: 3 | D1500: 3000 | E1500: =R[-9]C -> 21 | F1500: =R[-9]C -> 30 | G1500: 2 | H1500: 10000 | I1500: 110003 | J1500: 2 | K1500: [{5,10},{6,15},{13,10},{14,5},{15,10},{16,5},{20,1},{27,10},{28,10}] | L1500: =R[-1]C -> [{5,1113},{6,1113},{13,18},{14,37},{15,18},{16,37},{20,3},{27,18},{28,18}] | M1500: =R[-1]C -> [{0,1,[1,30]},{1,2,[11,40]},{2,5,[21,50]},{5,10,[31,60]},{10,20,[41,60]},{30,20,[51,70]},{50,10,[61,80]},{70,5,[71,80]},{100,2,[81,90]},{150,1,[91,100]}]
A1501: 1498 | B1501: 3 | C1501: 3 | D1501: 3000 | E1501: =R[-9]C -> 31 | F1501: =R[-9]C -> 40 | G1501: 2 | H1501: 10000 | I1501: 110003 | J1501: 2 | K1501: [{5,10},{6,15},{13,10},{14,5},{15,10},{16,5},{20,1},{27,10},{28,10}] | L1501: =R[-1]C -> [{5,1113},{6,1113},{13,18},{14,37},{15,18},{16,37},{20,3},{27,18},{28,18}] | M1501: =R[-1]C -> [{0,1,[1,30]},{1,2,[11,40]},{2,5,[21,50]},{5,10,[31,60]},{10,20,[41,60]},{30,20,[51,70]},{50,10,[61,80]},{70,5,[71,80]},{100,2,[81,90]},{150,1,[91,100]}]
A1502: 1499 | B1502: 3 | C1502: 3 | D1502: 3000 | E1502: =R[-9]C -> 41 | F1502: =R[-9]C -> 50 | G1502: 2 | H1502: 10000 | I1502: 110003 | J1502: 2 | K1502: [{5,10},{6,15},{13,10},{14,5},{15,10},{16,5},{20,1},{27,10},{28,10}] | L1502: =R[-1]C -> [{5,1113},{6,1113},{13,18},{14,37},{15,18},{16,37},{20,3},{27,18},{28,18}] | M1502: =R[-1]C -> [{0,1,[1,30]},{1,2,[11,40]},{2,5,[21,50]},{5,10,[31,60]},{10,20,[41,60]},{30,20,[51,70]},{50,10,[61,80]},{70,5,[71,80]},{100,2,[81,90]},{150,1,[91,100]}]
A1503: 1500 | B1503: 3 | C1503: 3 | D1503: 3000 | E1503: =R[-9]C -> 51 | F1503: =R[-9]C -> 60 | G1503: 2 | H1503: 10000 | I1503: 110003 | J1503: 2 | K1503: [{5,10},{6,15},{13,10},{14,5},{15,10},{16,5},{20,1},{27,10},{28,10}] | L1503: =R[-1]C -> [{5,1113},{6,1113},{13,18},{14,37},{15,18},{16,37},{20,3},{27,18},{28,18}] | M1503: =R[-1]C -> [{0,1,[1,30]},{1,2,[11,40]},{2,5,[21,50]},{5,10,[31,60]},{10,20,[41,60]},{30,20,[51,70]},{50,10,[61,80]},{70,5,[71,80]},{100,2,[81,90]},{150,1,[91,100]}]
A1504: 1501 | B1504: 3 | C1504: 3 | D1504: 3000 | E1504: =R[-9]C -> 61 | F1504: =R[-9]C -> 70 | G1504: 2 | H1504: 10000 | I1504: 110003 | J1504: 2 | K1504: [{5,10},{6,15},{13,10},{14,5},{15,10},{16,5},{20,1},{27,10},{28,10}] | L1504: =R[-1]C -> [{5,1113},{6,1113},{13,18},{14,37},{15,18},{16,37},{20,3},{27,18},{28,18}] | M1504: =R[-1]C -> [{0,1,[1,30]},{1,2,[11,40]},{2,5,[21,50]},{5,10,[31,60]},{10,20,[41,60]},{30,20,[51,70]},{50,10,[61,80]},{70,5,[71,80]},{100,2,[81,90]},{150,1,[91,100]}]
A1505: 1502 | B1505: 3 | C1505: 3 | D1505: 3000 | E1505: =R[-9]C -> 71 | F1505: =R[-9]C -> 80 | G1505: 2 | H1505: 10000 | I1505: 110003 | J1505: 2 | K1505: [{5,10},{6,15},{13,10},{14,5},{15,10},{16,5},{20,1},{27,10},{28,10}] | L1505: =R[-1]C -> [{5,1113},{6,1113},{13,18},{14,37},{15,18},{16,37},{20,3},{27,18},{28,18}] | M1505: =R[-1]C -> [{0,1,[1,30]},{1,2,[11,40]},{2,5,[21,50]},{5,10,[31,60]},{10,20,[41,60]},{30,20,[51,70]},{50,10,[61,80]},{70,5,[71,80]},{100,2,[81,90]},{150,1,[91,100]}]
A1506: 1503 | B1506: 3 | C1506: 3 | D1506: 3000 | E1506: =R[-9]C -> 81 | F1506: =R[-9]C -> 90 | G1506: 2 | H1506: 10000 | I1506: 110003 | J1506: 2 | K1506: [{5,10},{6,15},{13,10},{14,5},{15,10},{16,5},{20,1},{27,10},{28,10}] | L1506: =R[-1]C -> [{5,1113},{6,1113},{13,18},{14,37},{15,18},{16,37},{20,3},{27,18},{28,18}] | M1506: =R[-1]C -> [{0,1,[1,30]},{1,2,[11,40]},{2,5,[21,50]},{5,10,[31,60]},{10,20,[41,60]},{30,20,[51,70]},{50,10,[61,80]},{70,5,[71,80]},{100,2,[81,90]},{150,1,[91,100]}]
A1507: 1504 | B1507: 4 | C1507: 3 | D1507: 3000 | E1507: =R[-9]C -> 1 | F1507: =R[-9]C -> 10 | G1507: 3 | H1507: 15000 | I1507: 110003 | J1507: 3 | K1507: [{5,10},{6,15},{13,10},{14,5},{15,10},{16,5},{20,1},{27,10},{28,10}] | L1507: =R[-1]C -> [{5,1113},{6,1113},{13,18},{14,37},{15,18},{16,37},{20,3},{27,18},{28,18}] | M1507: =R[-1]C -> [{0,1,[1,30]},{1,2,[11,40]},{2,5,[21,50]},{5,10,[31,60]},{10,20,[41,60]},{30,20,[51,70]},{50,10,[61,80]},{70,5,[71,80]},{100,2,[81,90]},{150,1,[91,100]}]
A1508: 1505 | B1508: 4 | C1508: 3 | D1508: 3000 | E1508: =R[-9]C -> 11 | F1508: =R[-9]C -> 20 | G1508: 3 | H1508: 15000 | I1508: 110003 | J1508: 3 | K1508: [{5,10},{6,15},{13,10},{14,5},{15,10},{16,5},{20,1},{27,10},{28,10}] | L1508: =R[-1]C -> [{5,1113},{6,1113},{13,18},{14,37},{15,18},{16,37},{20,3},{27,18},{28,18}] | M1508: =R[-1]C -> [{0,1,[1,30]},{1,2,[11,40]},{2,5,[21,50]},{5,10,[31,60]},{10,20,[41,60]},{30,20,[51,70]},{50,10,[61,80]},{70,5,[71,80]},{100,2,[81,90]},{150,1,[91,100]}]
A1509: 1506 | B1509: 4 | C1509: 3 | D1509: 3000 | E1509: =R[-9]C -> 21 | F1509: =R[-9]C -> 30 | G1509: 3 | H1509: 15000 | I1509: 110003 | J1509: 3 | K1509: [{5,10},{6,15},{13,10},{14,5},{15,10},{16,5},{20,1},{27,10},{28,10}] | L1509: =R[-1]C -> [{5,1113},{6,1113},{13,18},{14,37},{15,18},{16,37},{20,3},{27,18},{28,18}] | M1509: =R[-1]C -> [{0,1,[1,30]},{1,2,[11,40]},{2,5,[21,50]},{5,10,[31,60]},{10,20,[41,60]},{30,20,[51,70]},{50,10,[61,80]},{70,5,[71,80]},{100,2,[81,90]},{150,1,[91,100]}]
A1510: 1507 | B1510: 4 | C1510: 3 | D1510: 3000 | E1510: =R[-9]C -> 31 | F1510: =R[-9]C -> 40 | G1510: 3 | H1510: 15000 | I1510: 110003 | J1510: 3 | K1510: [{5,10},{6,15},{13,10},{14,5},{15,10},{16,5},{20,1},{27,10},{28,10}] | L1510: =R[-1]C -> [{5,1113},{6,1113},{13,18},{14,37},{15,18},{16,37},{20,3},{27,18},{28,18}] | M1510: =R[-1]C -> [{0,1,[1,30]},{1,2,[11,40]},{2,5,[21,50]},{5,10,[31,60]},{10,20,[41,60]},{30,20,[51,70]},{50,10,[61,80]},{70,5,[71,80]},{100,2,[81,90]},{150,1,[91,100]}]
A1511: 1508 | B1511: 4 | C1511: 3 | D1511: 3000 | E1511: =R[-9]C -> 41 | F1511: =R[-9]C -> 50 | G1511: 3 | H1511: 15000 | I1511: 110003 | J1511: 3 | K1511: [{5,10},{6,15},{13,10},{14,5},{15,10},{16,5},{20,1},{27,10},{28,10}] | L1511: =R[-1]C -> [{5,1113},{6,1113},{13,18},{14,37},{15,18},{16,37},{20,3},{27,18},{28,18}] | M1511: =R[-1]C -> [{0,1,[1,30]},{1,2,[11,40]},{2,5,[21,50]},{5,10,[31,60]},{10,20,[41,60]},{30,20,[51,70]},{50,10,[61,80]},{70,5,[71,80]},{100,2,[81,90]},{150,1,[91,100]}]
A1512: 1509 | B1512: 4 | C1512: 3 | D1512: 3000 | E1512: =R[-9]C -> 51 | F1512: =R[-9]C -> 60 | G1512: 3 | H1512: 15000 | I1512: 110003 | J1512: 3 | K1512: [{5,10},{6,15},{13,10},{14,5},{15,10},{16,5},{20,1},{27,10},{28,10}] | L1512: =R[-1]C -> [{5,1113},{6,1113},{13,18},{14,37},{15,18},{16,37},{20,3},{27,18},{28,18}] | M1512: =R[-1]C -> [{0,1,[1,30]},{1,2,[11,40]},{2,5,[21,50]},{5,10,[31,60]},{10,20,[41,60]},{30,20,[51,70]},{50,10,[61,80]},{70,5,[71,80]},{100,2,[81,90]},{150,1,[91,100]}]
A1513: 1510 | B1513: 4 | C1513: 3 | D1513: 3000 | E1513: =R[-9]C -> 61 | F1513: =R[-9]C -> 70 | G1513: 3 | H1513: 15000 | I1513: 110003 | J1513: 3 | K1513: [{5,10},{6,15},{13,10},{14,5},{15,10},{16,5},{20,1},{27,10},{28,10}] | L1513: =R[-1]C -> [{5,1113},{6,1113},{13,18},{14,37},{15,18},{16,37},{20,3},{27,18},{28,18}] | M1513: =R[-1]C -> [{0,1,[1,30]},{1,2,[11,40]},{2,5,[21,50]},{5,10,[31,60]},{10,20,[41,60]},{30,20,[51,70]},{50,10,[61,80]},{70,5,[71,80]},{100,2,[81,90]},{150,1,[91,100]}]
A1514: 1511 | B1514: 4 | C1514: 3 | D1514: 3000 | E1514: =R[-9]C -> 71 | F1514: =R[-9]C -> 80 | G1514: 3 | H1514: 15000 | I1514: 110003 | J1514: 3 | K1514: [{5,10},{6,15},{13,10},{14,5},{15,10},{16,5},{20,1},{27,10},{28,10}] | L1514: =R[-1]C -> [{5,1113},{6,1113},{13,18},{14,37},{15,18},{16,37},{20,3},{27,18},{28,18}] | M1514: =R[-1]C -> [{0,1,[1,30]},{1,2,[11,40]},{2,5,[21,50]},{5,10,[31,60]},{10,20,[41,60]},{30,20,[51,70]},{50,10,[61,80]},{70,5,[71,80]},{100,2,[81,90]},{150,1,[91,100]}]
A1515: 1512 | B1515: 4 | C1515: 3 | D1515: 3000 | E1515: =R[-9]C -> 81 | F1515: =R[-9]C -> 90 | G1515: 3 | H1515: 15000 | I1515: 110003 | J1515: 3 | K1515: [{5,10},{6,15},{13,10},{14,5},{15,10},{16,5},{20,1},{27,10},{28,10}] | L1515: =R[-1]C -> [{5,1113},{6,1113},{13,18},{14,37},{15,18},{16,37},{20,3},{27,18},{28,18}] | M1515: =R[-1]C -> [{0,1,[1,30]},{1,2,[11,40]},{2,5,[21,50]},{5,10,[31,60]},{10,20,[41,60]},{30,20,[51,70]},{50,10,[61,80]},{70,5,[71,80]},{100,2,[81,90]},{150,1,[91,100]}]
A1516: 1513 | B1516: 5 | C1516: 3 | D1516: 3000 | E1516: =R[-9]C -> 1 | F1516: =R[-9]C -> 10 | G1516: 4 | H1516: 20000 | I1516: 110003 | J1516: 4 | K1516: [{5,10},{6,15},{13,10},{14,5},{15,10},{16,5},{20,1},{27,10},{28,10}] | L1516: =R[-1]C -> [{5,1113},{6,1113},{13,18},{14,37},{15,18},{16,37},{20,3},{27,18},{28,18}] | M1516: =R[-1]C -> [{0,1,[1,30]},{1,2,[11,40]},{2,5,[21,50]},{5,10,[31,60]},{10,20,[41,60]},{30,20,[51,70]},{50,10,[61,80]},{70,5,[71,80]},{100,2,[81,90]},{150,1,[91,100]}]
A1517: 1514 | B1517: 5 | C1517: 3 | D1517: 3000 | E1517: =R[-9]C -> 11 | F1517: =R[-9]C -> 20 | G1517: 4 | H1517: 20000 | I1517: 110003 | J1517: 4 | K1517: [{5,10},{6,15},{13,10},{14,5},{15,10},{16,5},{20,1},{27,10},{28,10}] | L1517: =R[-1]C -> [{5,1113},{6,1113},{13,18},{14,37},{15,18},{16,37},{20,3},{27,18},{28,18}] | M1517: =R[-1]C -> [{0,1,[1,30]},{1,2,[11,40]},{2,5,[21,50]},{5,10,[31,60]},{10,20,[41,60]},{30,20,[51,70]},{50,10,[61,80]},{70,5,[71,80]},{100,2,[81,90]},{150,1,[91,100]}]
A1518: 1515 | B1518: 5 | C1518: 3 | D1518: 3000 | E1518: =R[-9]C -> 21 | F1518: =R[-9]C -> 30 | G1518: 4 | H1518: 20000 | I1518: 110003 | J1518: 4 | K1518: [{5,10},{6,15},{13,10},{14,5},{15,10},{16,5},{20,1},{27,10},{28,10}] | L1518: =R[-1]C -> [{5,1113},{6,1113},{13,18},{14,37},{15,18},{16,37},{20,3},{27,18},{28,18}] | M1518: =R[-1]C -> [{0,1,[1,30]},{1,2,[11,40]},{2,5,[21,50]},{5,10,[31,60]},{10,20,[41,60]},{30,20,[51,70]},{50,10,[61,80]},{70,5,[71,80]},{100,2,[81,90]},{150,1,[91,100]}]
A1519: 1516 | B1519: 5 | C1519: 3 | D1519: 3000 | E1519: =R[-9]C -> 31 | F1519: =R[-9]C -> 40 | G1519: 4 | H1519: 20000 | I1519: 110003 | J1519: 4 | K1519: [{5,10},{6,15},{13,10},{14,5},{15,10},{16,5},{20,1},{27,10},{28,10}] | L1519: =R[-1]C -> [{5,1113},{6,1113},{13,18},{14,37},{15,18},{16,37},{20,3},{27,18},{28,18}] | M1519: =R[-1]C -> [{0,1,[1,30]},{1,2,[11,40]},{2,5,[21,50]},{5,10,[31,60]},{10,20,[41,60]},{30,20,[51,70]},{50,10,[61,80]},{70,5,[71,80]},{100,2,[81,90]},{150,1,[91,100]}]
A1520: 1517 | B1520: 5 | C1520: 3 | D1520: 3000 | E1520: =R[-9]C -> 41 | F1520: =R[-9]C -> 50 | G1520: 4 | H1520: 20000 | I1520: 110003 | J1520: 4 | K1520: [{5,10},{6,15},{13,10},{14,5},{15,10},{16,5},{20,1},{27,10},{28,10}] | L1520: =R[-1]C -> [{5,1113},{6,1113},{13,18},{14,37},{15,18},{16,37},{20,3},{27,18},{28,18}] | M1520: =R[-1]C -> [{0,1,[1,30]},{1,2,[11,40]},{2,5,[21,50]},{5,10,[31,60]},{10,20,[41,60]},{30,20,[51,70]},{50,10,[61,80]},{70,5,[71,80]},{100,2,[81,90]},{150,1,[91,100]}]
A1521: 1518 | B1521: 5 | C1521: 3 | D1521: 3000 | E1521: =R[-9]C -> 51 | F1521: =R[-9]C -> 60 | G1521: 4 | H1521: 20000 | I1521: 110003 | J1521: 4 | K1521: [{5,10},{6,15},{13,10},{14,5},{15,10},{16,5},{20,1},{27,10},{28,10}] | L1521: =R[-1]C -> [{5,1113},{6,1113},{13,18},{14,37},{15,18},{16,37},{20,3},{27,18},{28,18}] | M1521: =R[-1]C -> [{0,1,[1,30]},{1,2,[11,40]},{2,5,[21,50]},{5,10,[31,60]},{10,20,[41,60]},{30,20,[51,70]},{50,10,[61,80]},{70,5,[71,80]},{100,2,[81,90]},{150,1,[91,100]}]
A1522: 1519 | B1522: 5 | C1522: 3 | D1522: 3000 | E1522: =R[-9]C -> 61 | F1522: =R[-9]C -> 70 | G1522: 4 | H1522: 20000 | I1522: 110003 | J1522: 4 | K1522: [{5,10},{6,15},{13,10},{14,5},{15,10},{16,5},{20,1},{27,10},{28,10}] | L1522: =R[-1]C -> [{5,1113},{6,1113},{13,18},{14,37},{15,18},{16,37},{20,3},{27,18},{28,18}] | M1522: =R[-1]C -> [{0,1,[1,30]},{1,2,[11,40]},{2,5,[21,50]},{5,10,[31,60]},{10,20,[41,60]},{30,20,[51,70]},{50,10,[61,80]},{70,5,[71,80]},{100,2,[81,90]},{150,1,[91,100]}]
A1523: 1520 | B1523: 5 | C1523: 3 | D1523: 3000 | E1523: =R[-9]C -> 71 | F1523: =R[-9]C -> 80 | G1523: 4 | H1523: 20000 | I1523: 110003 | J1523: 4 | K1523: [{5,10},{6,15},{13,10},{14,5},{15,10},{16,5},{20,1},{27,10},{28,10}] | L1523: =R[-1]C -> [{5,1113},{6,1113},{13,18},{14,37},{15,18},{16,37},{20,3},{27,18},{28,18}] | M1523: =R[-1]C -> [{0,1,[1,30]},{1,2,[11,40]},{2,5,[21,50]},{5,10,[31,60]},{10,20,[41,60]},{30,20,[51,70]},{50,10,[61,80]},{70,5,[71,80]},{100,2,[81,90]},{150,1,[91,100]}]
A1524: 1521 | B1524: 5 | C1524: 3 | D1524: 3000 | E1524: =R[-9]C -> 81 | F1524: =R[-9]C -> 90 | G1524: 4 | H1524: 20000 | I1524: 110003 | J1524: 4 | K1524: [{5,10},{6,15},{13,10},{14,5},{15,10},{16,5},{20,1},{27,10},{28,10}] | L1524: =R[-1]C -> [{5,1113},{6,1113},{13,18},{14,37},{15,18},{16,37},{20,3},{27,18},{28,18}] | M1524: =R[-1]C -> [{0,1,[1,30]},{1,2,[11,40]},{2,5,[21,50]},{5,10,[31,60]},{10,20,[41,60]},{30,20,[51,70]},{50,10,[61,80]},{70,5,[71,80]},{100,2,[81,90]},{150,1,[91,100]}]
A1525: 1522 | B1525: 6 | C1525: 3 | D1525: 3000 | E1525: =R[-9]C -> 1 | F1525: =R[-9]C -> 10 | G1525: 5 | H1525: 20000 | I1525: 110003 | J1525: 5 | K1525: [{5,10},{6,15},{13,10},{14,5},{15,10},{16,5},{20,1},{27,10},{28,10}] | L1525: =R[-1]C -> [{5,1113},{6,1113},{13,18},{14,37},{15,18},{16,37},{20,3},{27,18},{28,18}] | M1525: =R[-1]C -> [{0,1,[1,30]},{1,2,[11,40]},{2,5,[21,50]},{5,10,[31,60]},{10,20,[41,60]},{30,20,[51,70]},{50,10,[61,80]},{70,5,[71,80]},{100,2,[81,90]},{150,1,[91,100]}]
A1526: 1523 | B1526: 6 | C1526: 3 | D1526: 3000 | E1526: =R[-9]C -> 11 | F1526: =R[-9]C -> 20 | G1526: 5 | H1526: 20000 | I1526: 110003 | J1526: 5 | K1526: [{5,10},{6,15},{13,10},{14,5},{15,10},{16,5},{20,1},{27,10},{28,10}] | L1526: =R[-1]C -> [{5,1113},{6,1113},{13,18},{14,37},{15,18},{16,37},{20,3},{27,18},{28,18}] | M1526: =R[-1]C -> [{0,1,[1,30]},{1,2,[11,40]},{2,5,[21,50]},{5,10,[31,60]},{10,20,[41,60]},{30,20,[51,70]},{50,10,[61,80]},{70,5,[71,80]},{100,2,[81,90]},{150,1,[91,100]}]
A1527: 1524 | B1527: 6 | C1527: 3 | D1527: 3000 | E1527: =R[-9]C -> 21 | F1527: =R[-9]C -> 30 | G1527: 5 | H1527: 20000 | I1527: 110003 | J1527: 5 | K1527: [{5,10},{6,15},{13,10},{14,5},{15,10},{16,5},{20,1},{27,10},{28,10}] | L1527: =R[-1]C -> [{5,1113},{6,1113},{13,18},{14,37},{15,18},{16,37},{20,3},{27,18},{28,18}] | M1527: =R[-1]C -> [{0,1,[1,30]},{1,2,[11,40]},{2,5,[21,50]},{5,10,[31,60]},{10,20,[41,60]},{30,20,[51,70]},{50,10,[61,80]},{70,5,[71,80]},{100,2,[81,90]},{150,1,[91,100]}]
A1528: 1525 | B1528: 6 | C1528: 3 | D1528: 3000 | E1528: =R[-9]C -> 31 | F1528: =R[-9]C -> 40 | G1528: 5 | H1528: 20000 | I1528: 110003 | J1528: 5 | K1528: [{5,10},{6,15},{13,10},{14,5},{15,10},{16,5},{20,1},{27,10},{28,10}] | L1528: =R[-1]C -> [{5,1113},{6,1113},{13,18},{14,37},{15,18},{16,37},{20,3},{27,18},{28,18}] | M1528: =R[-1]C -> [{0,1,[1,30]},{1,2,[11,40]},{2,5,[21,50]},{5,10,[31,60]},{10,20,[41,60]},{30,20,[51,70]},{50,10,[61,80]},{70,5,[71,80]},{100,2,[81,90]},{150,1,[91,100]}]
A1529: 1526 | B1529: 6 | C1529: 3 | D1529: 3000 | E1529: =R[-9]C -> 41 | F1529: =R[-9]C -> 50 | G1529: 5 | H1529: 20000 | I1529: 110003 | J1529: 5 | K1529: [{5,10},{6,15},{13,10},{14,5},{15,10},{16,5},{20,1},{27,10},{28,10}] | L1529: =R[-1]C -> [{5,1113},{6,1113},{13,18},{14,37},{15,18},{16,37},{20,3},{27,18},{28,18}] | M1529: =R[-1]C -> [{0,1,[1,30]},{1,2,[11,40]},{2,5,[21,50]},{5,10,[31,60]},{10,20,[41,60]},{30,20,[51,70]},{50,10,[61,80]},{70,5,[71,80]},{100,2,[81,90]},{150,1,[91,100]}]
A1530: 1527 | B1530: 6 | C1530: 3 | D1530: 3000 | E1530: =R[-9]C -> 51 | F1530: =R[-9]C -> 60 | G1530: 5 | H1530: 20000 | I1530: 110003 | J1530: 5 | K1530: [{5,10},{6,15},{13,10},{14,5},{15,10},{16,5},{20,1},{27,10},{28,10}] | L1530: =R[-1]C -> [{5,1113},{6,1113},{13,18},{14,37},{15,18},{16,37},{20,3},{27,18},{28,18}] | M1530: =R[-1]C -> [{0,1,[1,30]},{1,2,[11,40]},{2,5,[21,50]},{5,10,[31,60]},{10,20,[41,60]},{30,20,[51,70]},{50,10,[61,80]},{70,5,[71,80]},{100,2,[81,90]},{150,1,[91,100]}]
A1531: 1528 | B1531: 6 | C1531: 3 | D1531: 3000 | E1531: =R[-9]C -> 61 | F1531: =R[-9]C -> 70 | G1531: 5 | H1531: 20000 | I1531: 110003 | J1531: 5 | K1531: [{5,10},{6,15},{13,10},{14,5},{15,10},{16,5},{20,1},{27,10},{28,10}] | L1531: =R[-1]C -> [{5,1113},{6,1113},{13,18},{14,37},{15,18},{16,37},{20,3},{27,18},{28,18}] | M1531: =R[-1]C -> [{0,1,[1,30]},{1,2,[11,40]},{2,5,[21,50]},{5,10,[31,60]},{10,20,[41,60]},{30,20,[51,70]},{50,10,[61,80]},{70,5,[71,80]},{100,2,[81,90]},{150,1,[91,100]}]
A1532: 1529 | B1532: 6 | C1532: 3 | D1532: 3000 | E1532: =R[-9]C -> 71 | F1532: =R[-9]C -> 80 | G1532: 5 | H1532: 20000 | I1532: 110003 | J1532: 5 | K1532: [{5,10},{6,15},{13,10},{14,5},{15,10},{16,5},{20,1},{27,10},{28,10}] | L1532: =R[-1]C -> [{5,1113},{6,1113},{13,18},{14,37},{15,18},{16,37},{20,3},{27,18},{28,18}] | M1532: =R[-1]C -> [{0,1,[1,30]},{1,2,[11,40]},{2,5,[21,50]},{5,10,[31,60]},{10,20,[41,60]},{30,20,[51,70]},{50,10,[61,80]},{70,5,[71,80]},{100,2,[81,90]},{150,1,[91,100]}]
A1533: 1530 | B1533: 6 | C1533: 3 | D1533: 3000 | E1533: =R[-9]C -> 81 | F1533: =R[-9]C -> 90 | G1533: 5 | H1533: 20000 | I1533: 110003 | J1533: 5 | K1533: [{5,10},{6,15},{13,10},{14,5},{15,10},{16,5},{20,1},{27,10},{28,10}] | L1533: =R[-1]C -> [{5,1113},{6,1113},{13,18},{14,37},{15,18},{16,37},{20,3},{27,18},{28,18}] | M1533: =R[-1]C -> [{0,1,[1,30]},{1,2,[11,40]},{2,5,[21,50]},{5,10,[31,60]},{10,20,[41,60]},{30,20,[51,70]},{50,10,[61,80]},{70,5,[71,80]},{100,2,[81,90]},{150,1,[91,100]}]
A1534: 1531 | B1534: 2 | C1534: 8 | D1534: 3000 | E1534: =R[-18]C -> 1 | F1534: =R[-18]C -> 10 | G1534: 1 | H1534: 5000 | I1534: 110003 | J1534: 1 | K1534: [{5,10},{6,15},{13,10},{14,5},{15,10},{16,5},{20,1},{27,10},{28,10}] | L1534: =R[-1]C -> [{5,1113},{6,1113},{13,18},{14,37},{15,18},{16,37},{20,3},{27,18},{28,18}] | M1534: =R[-1]C -> [{0,1,[1,30]},{1,2,[11,40]},{2,5,[21,50]},{5,10,[31,60]},{10,20,[41,60]},{30,20,[51,70]},{50,10,[61,80]},{70,5,[71,80]},{100,2,[81,90]},{150,1,[91,100]}]
A1535: 1532 | B1535: 2 | C1535: 8 | D1535: 3000 | E1535: =R[-18]C -> 11 | F1535: =R[-18]C -> 20 | G1535: 1 | H1535: 5000 | I1535: 110003 | J1535: 1 | K1535: [{5,10},{6,15},{13,10},{14,5},{15,10},{16,5},{20,1},{27,10},{28,10}] | L1535: =R[-1]C -> [{5,1113},{6,1113},{13,18},{14,37},{15,18},{16,37},{20,3},{27,18},{28,18}] | M1535: =R[-1]C -> [{0,1,[1,30]},{1,2,[11,40]},{2,5,[21,50]},{5,10,[31,60]},{10,20,[41,60]},{30,20,[51,70]},{50,10,[61,80]},{70,5,[71,80]},{100,2,[81,90]},{150,1,[91,100]}]
A1536: 1533 | B1536: 2 | C1536: 8 | D1536: 3000 | E1536: =R[-18]C -> 21 | F1536: =R[-18]C -> 30 | G1536: 1 | H1536: 5000 | I1536: 110003 | J1536: 1 | K1536: [{5,10},{6,15},{13,10},{14,5},{15,10},{16,5},{20,1},{27,10},{28,10}] | L1536: =R[-1]C -> [{5,1113},{6,1113},{13,18},{14,37},{15,18},{16,37},{20,3},{27,18},{28,18}] | M1536: =R[-1]C -> [{0,1,[1,30]},{1,2,[11,40]},{2,5,[21,50]},{5,10,[31,60]},{10,20,[41,60]},{30,20,[51,70]},{50,10,[61,80]},{70,5,[71,80]},{100,2,[81,90]},{150,1,[91,100]}]
A1537: 1534 | B1537: 2 | C1537: 8 | D1537: 3000 | E1537: =R[-18]C -> 31 | F1537: =R[-18]C -> 40 | G1537: 1 | H1537: 5000 | I1537: 110003 | J1537: 1 | K1537: [{5,10},{6,15},{13,10},{14,5},{15,10},{16,5},{20,1},{27,10},{28,10}] | L1537: =R[-1]C -> [{5,1113},{6,1113},{13,18},{14,37},{15,18},{16,37},{20,3},{27,18},{28,18}] | M1537: =R[-1]C -> [{0,1,[1,30]},{1,2,[11,40]},{2,5,[21,50]},{5,10,[31,60]},{10,20,[41,60]},{30,20,[51,70]},{50,10,[61,80]},{70,5,[71,80]},{100,2,[81,90]},{150,1,[91,100]}]
A1538: 1535 | B1538: 2 | C1538: 8 | D1538: 3000 | E1538: =R[-18]C -> 41 | F1538: =R[-18]C -> 50 | G1538: 1 | H1538: 5000 | I1538: 110003 | J1538: 1 | K1538: [{5,10},{6,15},{13,10},{14,5},{15,10},{16,5},{20,1},{27,10},{28,10}] | L1538: =R[-1]C -> [{5,1113},{6,1113},{13,18},{14,37},{15,18},{16,37},{20,3},{27,18},{28,18}] | M1538: =R[-1]C -> [{0,1,[1,30]},{1,2,[11,40]},{2,5,[21,50]},{5,10,[31,60]},{10,20,[41,60]},{30,20,[51,70]},{50,10,[61,80]},{70,5,[71,80]},{100,2,[81,90]},{150,1,[91,100]}]
A1539: 1536 | B1539: 2 | C1539: 8 | D1539: 3000 | E1539: =R[-18]C -> 51 | F1539: =R[-18]C -> 60 | G1539: 1 | H1539: 5000 | I1539: 110003 | J1539: 1 | K1539: [{5,10},{6,15},{13,10},{14,5},{15,10},{16,5},{20,1},{27,10},{28,10}] | L1539: =R[-1]C -> [{5,1113},{6,1113},{13,18},{14,37},{15,18},{16,37},{20,3},{27,18},{28,18}] | M1539: =R[-1]C -> [{0,1,[1,30]},{1,2,[11,40]},{2,5,[21,50]},{5,10,[31,60]},{10,20,[41,60]},{30,20,[51,70]},{50,10,[61,80]},{70,5,[71,80]},{100,2,[81,90]},{150,1,[91,100]}]
A1540: 1537 | B1540: 2 | C1540: 8 | D1540: 3000 | E1540: =R[-18]C -> 61 | F1540: =R[-18]C -> 70 | G1540: 1 | H1540: 5000 | I1540: 110003 | J1540: 1 | K1540: [{5,10},{6,15},{13,10},{14,5},{15,10},{16,5},{20,1},{27,10},{28,10}] | L1540: =R[-1]C -> [{5,1113},{6,1113},{13,18},{14,37},{15,18},{16,37},{20,3},{27,18},{28,18}] | M1540: =R[-1]C -> [{0,1,[1,30]},{1,2,[11,40]},{2,5,[21,50]},{5,10,[31,60]},{10,20,[41,60]},{30,20,[51,70]},{50,10,[61,80]},{70,5,[71,80]},{100,2,[81,90]},{150,1,[91,100]}]
A1541: 1538 | B1541: 2 | C1541: 8 | D1541: 3000 | E1541: =R[-18]C -> 71 | F1541: =R[-18]C -> 80 | G1541: 1 | H1541: 5000 | I1541: 110003 | J1541: 1 | K1541: [{5,10},{6,15},{13,10},{14,5},{15,10},{16,5},{20,1},{27,10},{28,10}] | L1541: =R[-1]C -> [{5,1113},{6,1113},{13,18},{14,37},{15,18},{16,37},{20,3},{27,18},{28,18}] | M1541: =R[-1]C -> [{0,1,[1,30]},{1,2,[11,40]},{2,5,[21,50]},{5,10,[31,60]},{10,20,[41,60]},{30,20,[51,70]},{50,10,[61,80]},{70,5,[71,80]},{100,2,[81,90]},{150,1,[91,100]}]
A1542: 1539 | B1542: 2 | C1542: 8 | D1542: 3000 | E1542: =R[-18]C -> 81 | F1542: =R[-18]C -> 90 | G1542: 1 | H1542: 5000 | I1542: 110003 | J1542: 1 | K1542: [{5,10},{6,15},{13,10},{14,5},{15,10},{16,5},{20,1},{27,10},{28,10}] | L1542: =R[-1]C -> [{5,1113},{6,1113},{13,18},{14,37},{15,18},{16,37},{20,3},{27,18},{28,18}] | M1542: =R[-1]C -> [{0,1,[1,30]},{1,2,[11,40]},{2,5,[21,50]},{5,10,[31,60]},{10,20,[41,60]},{30,20,[51,70]},{50,10,[61,80]},{70,5,[71,80]},{100,2,[81,90]},{150,1,[91,100]}]
A1543: 1540 | B1543: 3 | C1543: 8 | D1543: 3000 | E1543: =R[-9]C -> 1 | F1543: =R[-9]C -> 10 | G1543: 2 | H1543: 10000 | I1543: 110003 | J1543: 2 | K1543: [{5,10},{6,15},{13,10},{14,5},{15,10},{16,5},{20,1},{27,10},{28,10}] | L1543: =R[-1]C -> [{5,1113},{6,1113},{13,18},{14,37},{15,18},{16,37},{20,3},{27,18},{28,18}] | M1543: =R[-1]C -> [{0,1,[1,30]},{1,2,[11,40]},{2,5,[21,50]},{5,10,[31,60]},{10,20,[41,60]},{30,20,[51,70]},{50,10,[61,80]},{70,5,[71,80]},{100,2,[81,90]},{150,1,[91,100]}]
A1544: 1541 | B1544: 3 | C1544: 8 | D1544: 3000 | E1544: =R[-9]C -> 11 | F1544: =R[-9]C -> 20 | G1544: 2 | H1544: 10000 | I1544: 110003 | J1544: 2 | K1544: [{5,10},{6,15},{13,10},{14,5},{15,10},{16,5},{20,1},{27,10},{28,10}] | L1544: =R[-1]C -> [{5,1113},{6,1113},{13,18},{14,37},{15,18},{16,37},{20,3},{27,18},{28,18}] | M1544: =R[-1]C -> [{0,1,[1,30]},{1,2,[11,40]},{2,5,[21,50]},{5,10,[31,60]},{10,20,[41,60]},{30,20,[51,70]},{50,10,[61,80]},{70,5,[71,80]},{100,2,[81,90]},{150,1,[91,100]}]
A1545: 1542 | B1545: 3 | C1545: 8 | D1545: 3000 | E1545: =R[-9]C -> 21 | F1545: =R[-9]C -> 30 | G1545: 2 | H1545: 10000 | I1545: 110003 | J1545: 2 | K1545: [{5,10},{6,15},{13,10},{14,5},{15,10},{16,5},{20,1},{27,10},{28,10}] | L1545: =R[-1]C -> [{5,1113},{6,1113},{13,18},{14,37},{15,18},{16,37},{20,3},{27,18},{28,18}] | M1545: =R[-1]C -> [{0,1,[1,30]},{1,2,[11,40]},{2,5,[21,50]},{5,10,[31,60]},{10,20,[41,60]},{30,20,[51,70]},{50,10,[61,80]},{70,5,[71,80]},{100,2,[81,90]},{150,1,[91,100]}]
A1546: 1543 | B1546: 3 | C1546: 8 | D1546: 3000 | E1546: =R[-9]C -> 31 | F1546: =R[-9]C -> 40 | G1546: 2 | H1546: 10000 | I1546: 110003 | J1546: 2 | K1546: [{5,10},{6,15},{13,10},{14,5},{15,10},{16,5},{20,1},{27,10},{28,10}] | L1546: =R[-1]C -> [{5,1113},{6,1113},{13,18},{14,37},{15,18},{16,37},{20,3},{27,18},{28,18}] | M1546: =R[-1]C -> [{0,1,[1,30]},{1,2,[11,40]},{2,5,[21,50]},{5,10,[31,60]},{10,20,[41,60]},{30,20,[51,70]},{50,10,[61,80]},{70,5,[71,80]},{100,2,[81,90]},{150,1,[91,100]}]
A1547: 1544 | B1547: 3 | C1547: 8 | D1547: 3000 | E1547: =R[-9]C -> 41 | F1547: =R[-9]C -> 50 | G1547: 2 | H1547: 10000 | I1547: 110003 | J1547: 2 | K1547: [{5,10},{6,15},{13,10},{14,5},{15,10},{16,5},{20,1},{27,10},{28,10}] | L1547: =R[-1]C -> [{5,1113},{6,1113},{13,18},{14,37},{15,18},{16,37},{20,3},{27,18},{28,18}] | M1547: =R[-1]C -> [{0,1,[1,30]},{1,2,[11,40]},{2,5,[21,50]},{5,10,[31,60]},{10,20,[41,60]},{30,20,[51,70]},{50,10,[61,80]},{70,5,[71,80]},{100,2,[81,90]},{150,1,[91,100]}]
A1548: 1545 | B1548: 3 | C1548: 8 | D1548: 3000 | E1548: =R[-9]C -> 51 | F1548: =R[-9]C -> 60 | G1548: 2 | H1548: 10000 | I1548: 110003 | J1548: 2 | K1548: [{5,10},{6,15},{13,10},{14,5},{15,10},{16,5},{20,1},{27,10},{28,10}] | L1548: =R[-1]C -> [{5,1113},{6,1113},{13,18},{14,37},{15,18},{16,37},{20,3},{27,18},{28,18}] | M1548: =R[-1]C -> [{0,1,[1,30]},{1,2,[11,40]},{2,5,[21,50]},{5,10,[31,60]},{10,20,[41,60]},{30,20,[51,70]},{50,10,[61,80]},{70,5,[71,80]},{100,2,[81,90]},{150,1,[91,100]}]
A1549: 1546 | B1549: 3 | C1549: 8 | D1549: 3000 | E1549: =R[-9]C -> 61 | F1549: =R[-9]C -> 70 | G1549: 2 | H1549: 10000 | I1549: 110003 | J1549: 2 | K1549: [{5,10},{6,15},{13,10},{14,5},{15,10},{16,5},{20,1},{27,10},{28,10}] | L1549: =R[-1]C -> [{5,1113},{6,1113},{13,18},{14,37},{15,18},{16,37},{20,3},{27,18},{28,18}] | M1549: =R[-1]C -> [{0,1,[1,30]},{1,2,[11,40]},{2,5,[21,50]},{5,10,[31,60]},{10,20,[41,60]},{30,20,[51,70]},{50,10,[61,80]},{70,5,[71,80]},{100,2,[81,90]},{150,1,[91,100]}]
A1550: 1547 | B1550: 3 | C1550: 8 | D1550: 3000 | E1550: =R[-9]C -> 71 | F1550: =R[-9]C -> 80 | G1550: 2 | H1550: 10000 | I1550: 110003 | J1550: 2 | K1550: [{5,10},{6,15},{13,10},{14,5},{15,10},{16,5},{20,1},{27,10},{28,10}] | L1550: =R[-1]C -> [{5,1113},{6,1113},{13,18},{14,37},{15,18},{16,37},{20,3},{27,18},{28,18}] | M1550: =R[-1]C -> [{0,1,[1,30]},{1,2,[11,40]},{2,5,[21,50]},{5,10,[31,60]},{10,20,[41,60]},{30,20,[51,70]},{50,10,[61,80]},{70,5,[71,80]},{100,2,[81,90]},{150,1,[91,100]}]
A1551: 1548 | B1551: 3 | C1551: 8 | D1551: 3000 | E1551: =R[-9]C -> 81 | F1551: =R[-9]C -> 90 | G1551: 2 | H1551: 10000 | I1551: 110003 | J1551: 2 | K1551: [{5,10},{6,15},{13,10},{14,5},{15,10},{16,5},{20,1},{27,10},{28,10}] | L1551: =R[-1]C -> [{5,1113},{6,1113},{13,18},{14,37},{15,18},{16,37},{20,3},{27,18},{28,18}] | M1551: =R[-1]C -> [{0,1,[1,30]},{1,2,[11,40]},{2,5,[21,50]},{5,10,[31,60]},{10,20,[41,60]},{30,20,[51,70]},{50,10,[61,80]},{70,5,[71,80]},{100,2,[81,90]},{150,1,[91,100]}]
A1552: 1549 | B1552: 4 | C1552: 8 | D1552: 3000 | E1552: =R[-9]C -> 1 | F1552: =R[-9]C -> 10 | G1552: 3 | H1552: 15000 | I1552: 110003 | J1552: 3 | K1552: [{5,10},{6,15},{13,10},{14,5},{15,10},{16,5},{20,1},{27,10},{28,10}] | L1552: =R[-1]C -> [{5,1113},{6,1113},{13,18},{14,37},{15,18},{16,37},{20,3},{27,18},{28,18}] | M1552: =R[-1]C -> [{0,1,[1,30]},{1,2,[11,40]},{2,5,[21,50]},{5,10,[31,60]},{10,20,[41,60]},{30,20,[51,70]},{50,10,[61,80]},{70,5,[71,80]},{100,2,[81,90]},{150,1,[91,100]}]
A1553: 1550 | B1553: 4 | C1553: 8 | D1553: 3000 | E1553: =R[-9]C -> 11 | F1553: =R[-9]C -> 20 | G1553: 3 | H1553: 15000 | I1553: 110003 | J1553: 3 | K1553: [{5,10},{6,15},{13,10},{14,5},{15,10},{16,5},{20,1},{27,10},{28,10}] | L1553: =R[-1]C -> [{5,1113},{6,1113},{13,18},{14,37},{15,18},{16,37},{20,3},{27,18},{28,18}] | M1553: =R[-1]C -> [{0,1,[1,30]},{1,2,[11,40]},{2,5,[21,50]},{5,10,[31,60]},{10,20,[41,60]},{30,20,[51,70]},{50,10,[61,80]},{70,5,[71,80]},{100,2,[81,90]},{150,1,[91,100]}]
A1554: 1551 | B1554: 4 | C1554: 8 | D1554: 3000 | E1554: =R[-9]C -> 21 | F1554: =R[-9]C -> 30 | G1554: 3 | H1554: 15000 | I1554: 110003 | J1554: 3 | K1554: [{5,10},{6,15},{13,10},{14,5},{15,10},{16,5},{20,1},{27,10},{28,10}] | L1554: =R[-1]C -> [{5,1113},{6,1113},{13,18},{14,37},{15,18},{16,37},{20,3},{27,18},{28,18}] | M1554: =R[-1]C -> [{0,1,[1,30]},{1,2,[11,40]},{2,5,[21,50]},{5,10,[31,60]},{10,20,[41,60]},{30,20,[51,70]},{50,10,[61,80]},{70,5,[71,80]},{100,2,[81,90]},{150,1,[91,100]}]
A1555: 1552 | B1555: 4 | C1555: 8 | D1555: 3000 | E1555: =R[-9]C -> 31 | F1555: =R[-9]C -> 40 | G1555: 3 | H1555: 15000 | I1555: 110003 | J1555: 3 | K1555: [{5,10},{6,15},{13,10},{14,5},{15,10},{16,5},{20,1},{27,10},{28,10}] | L1555: =R[-1]C -> [{5,1113},{6,1113},{13,18},{14,37},{15,18},{16,37},{20,3},{27,18},{28,18}] | M1555: =R[-1]C -> [{0,1,[1,30]},{1,2,[11,40]},{2,5,[21,50]},{5,10,[31,60]},{10,20,[41,60]},{30,20,[51,70]},{50,10,[61,80]},{70,5,[71,80]},{100,2,[81,90]},{150,1,[91,100]}]
A1556: 1553 | B1556: 4 | C1556: 8 | D1556: 3000 | E1556: =R[-9]C -> 41 | F1556: =R[-9]C -> 50 | G1556: 3 | H1556: 15000 | I1556: 110003 | J1556: 3 | K1556: [{5,10},{6,15},{13,10},{14,5},{15,10},{16,5},{20,1},{27,10},{28,10}] | L1556: =R[-1]C -> [{5,1113},{6,1113},{13,18},{14,37},{15,18},{16,37},{20,3},{27,18},{28,18}] | M1556: =R[-1]C -> [{0,1,[1,30]},{1,2,[11,40]},{2,5,[21,50]},{5,10,[31,60]},{10,20,[41,60]},{30,20,[51,70]},{50,10,[61,80]},{70,5,[71,80]},{100,2,[81,90]},{150,1,[91,100]}]
A1557: 1554 | B1557: 4 | C1557: 8 | D1557: 3000 | E1557: =R[-9]C -> 51 | F1557: =R[-9]C -> 60 | G1557: 3 | H1557: 15000 | I1557: 110003 | J1557: 3 | K1557: [{5,10},{6,15},{13,10},{14,5},{15,10},{16,5},{20,1},{27,10},{28,10}] | L1557: =R[-1]C -> [{5,1113},{6,1113},{13,18},{14,37},{15,18},{16,37},{20,3},{27,18},{28,18}] | M1557: =R[-1]C -> [{0,1,[1,30]},{1,2,[11,40]},{2,5,[21,50]},{5,10,[31,60]},{10,20,[41,60]},{30,20,[51,70]},{50,10,[61,80]},{70,5,[71,80]},{100,2,[81,90]},{150,1,[91,100]}]
A1558: 1555 | B1558: 4 | C1558: 8 | D1558: 3000 | E1558: =R[-9]C -> 61 | F1558: =R[-9]C -> 70 | G1558: 3 | H1558: 15000 | I1558: 110003 | J1558: 3 | K1558: [{5,10},{6,15},{13,10},{14,5},{15,10},{16,5},{20,1},{27,10},{28,10}] | L1558: =R[-1]C -> [{5,1113},{6,1113},{13,18},{14,37},{15,18},{16,37},{20,3},{27,18},{28,18}] | M1558: =R[-1]C -> [{0,1,[1,30]},{1,2,[11,40]},{2,5,[21,50]},{5,10,[31,60]},{10,20,[41,60]},{30,20,[51,70]},{50,10,[61,80]},{70,5,[71,80]},{100,2,[81,90]},{150,1,[91,100]}]
A1559: 1556 | B1559: 4 | C1559: 8 | D1559: 3000 | E1559: =R[-9]C -> 71 | F1559: =R[-9]C -> 80 | G1559: 3 | H1559: 15000 | I1559: 110003 | J1559: 3 | K1559: [{5,10},{6,15},{13,10},{14,5},{15,10},{16,5},{20,1},{27,10},{28,10}] | L1559: =R[-1]C -> [{5,1113},{6,1113},{13,18},{14,37},{15,18},{16,37},{20,3},{27,18},{28,18}] | M1559: =R[-1]C -> [{0,1,[1,30]},{1,2,[11,40]},{2,5,[21,50]},{5,10,[31,60]},{10,20,[41,60]},{30,20,[51,70]},{50,10,[61,80]},{70,5,[71,80]},{100,2,[81,90]},{150,1,[91,100]}]
A1560: 1557 | B1560: 4 | C1560: 8 | D1560: 3000 | E1560: =R[-9]C -> 81 | F1560: =R[-9]C -> 90 | G1560: 3 | H1560: 15000 | I1560: 110003 | J1560: 3 | K1560: [{5,10},{6,15},{13,10},{14,5},{15,10},{16,5},{20,1},{27,10},{28,10}] | L1560: =R[-1]C -> [{5,1113},{6,1113},{13,18},{14,37},{15,18},{16,37},{20,3},{27,18},{28,18}] | M1560: =R[-1]C -> [{0,1,[1,30]},{1,2,[11,40]},{2,5,[21,50]},{5,10,[31,60]},{10,20,[41,60]},{30,20,[51,70]},{50,10,[61,80]},{70,5,[71,80]},{100,2,[81,90]},{150,1,[91,100]}]
A1561: 1558 | B1561: 5 | C1561: 8 | D1561: 3000 | E1561: =R[-9]C -> 1 | F1561: =R[-9]C -> 10 | G1561: 4 | H1561: 20000 | I1561: 110003 | J1561: 4 | K1561: [{5,10},{6,15},{13,10},{14,5},{15,10},{16,5},{20,1},{27,10},{28,10}] | L1561: =R[-1]C -> [{5,1113},{6,1113},{13,18},{14,37},{15,18},{16,37},{20,3},{27,18},{28,18}] | M1561: =R[-1]C -> [{0,1,[1,30]},{1,2,[11,40]},{2,5,[21,50]},{5,10,[31,60]},{10,20,[41,60]},{30,20,[51,70]},{50,10,[61,80]},{70,5,[71,80]},{100,2,[81,90]},{150,1,[91,100]}]
A1562: 1559 | B1562: 5 | C1562: 8 | D1562: 3000 | E1562: =R[-9]C -> 11 | F1562: =R[-9]C -> 20 | G1562: 4 | H1562: 20000 | I1562: 110003 | J1562: 4 | K1562: [{5,10},{6,15},{13,10},{14,5},{15,10},{16,5},{20,1},{27,10},{28,10}] | L1562: =R[-1]C -> [{5,1113},{6,1113},{13,18},{14,37},{15,18},{16,37},{20,3},{27,18},{28,18}] | M1562: =R[-1]C -> [{0,1,[1,30]},{1,2,[11,40]},{2,5,[21,50]},{5,10,[31,60]},{10,20,[41,60]},{30,20,[51,70]},{50,10,[61,80]},{70,5,[71,80]},{100,2,[81,90]},{150,1,[91,100]}]
A1563: 1560 | B1563: 5 | C1563: 8 | D1563: 3000 | E1563: =R[-9]C -> 21 | F1563: =R[-9]C -> 30 | G1563: 4 | H1563: 20000 | I1563: 110003 | J1563: 4 | K1563: [{5,10},{6,15},{13,10},{14,5},{15,10},{16,5},{20,1},{27,10},{28,10}] | L1563: =R[-1]C -> [{5,1113},{6,1113},{13,18},{14,37},{15,18},{16,37},{20,3},{27,18},{28,18}] | M1563: =R[-1]C -> [{0,1,[1,30]},{1,2,[11,40]},{2,5,[21,50]},{5,10,[31,60]},{10,20,[41,60]},{30,20,[51,70]},{50,10,[61,80]},{70,5,[71,80]},{100,2,[81,90]},{150,1,[91,100]}]
A1564: 1561 | B1564: 5 | C1564: 8 | D1564: 3000 | E1564: =R[-9]C -> 31 | F1564: =R[-9]C -> 40 | G1564: 4 | H1564: 20000 | I1564: 110003 | J1564: 4 | K1564: [{5,10},{6,15},{13,10},{14,5},{15,10},{16,5},{20,1},{27,10},{28,10}] | L1564: =R[-1]C -> [{5,1113},{6,1113},{13,18},{14,37},{15,18},{16,37},{20,3},{27,18},{28,18}] | M1564: =R[-1]C -> [{0,1,[1,30]},{1,2,[11,40]},{2,5,[21,50]},{5,10,[31,60]},{10,20,[41,60]},{30,20,[51,70]},{50,10,[61,80]},{70,5,[71,80]},{100,2,[81,90]},{150,1,[91,100]}]
A1565: 1562 | B1565: 5 | C1565: 8 | D1565: 3000 | E1565: =R[-9]C -> 41 | F1565: =R[-9]C -> 50 | G1565: 4 | H1565: 20000 | I1565: 110003 | J1565: 4 | K1565: [{5,10},{6,15},{13,10},{14,5},{15,10},{16,5},{20,1},{27,10},{28,10}] | L1565: =R[-1]C -> [{5,1113},{6,1113},{13,18},{14,37},{15,18},{16,37},{20,3},{27,18},{28,18}] | M1565: =R[-1]C -> [{0,1,[1,30]},{1,2,[11,40]},{2,5,[21,50]},{5,10,[31,60]},{10,20,[41,60]},{30,20,[51,70]},{50,10,[61,80]},{70,5,[71,80]},{100,2,[81,90]},{150,1,[91,100]}]
A1566: 1563 | B1566: 5 | C1566: 8 | D1566: 3000 | E1566: =R[-9]C -> 51 | F1566: =R[-9]C -> 60 | G1566: 4 | H1566: 20000 | I1566: 110003 | J1566: 4 | K1566: [{5,10},{6,15},{13,10},{14,5},{15,10},{16,5},{20,1},{27,10},{28,10}] | L1566: =R[-1]C -> [{5,1113},{6,1113},{13,18},{14,37},{15,18},{16,37},{20,3},{27,18},{28,18}] | M1566: =R[-1]C -> [{0,1,[1,30]},{1,2,[11,40]},{2,5,[21,50]},{5,10,[31,60]},{10,20,[41,60]},{30,20,[51,70]},{50,10,[61,80]},{70,5,[71,80]},{100,2,[81,90]},{150,1,[91,100]}]
A1567: 1564 | B1567: 5 | C1567: 8 | D1567: 3000 | E1567: =R[-9]C -> 61 | F1567: =R[-9]C -> 70 | G1567: 4 | H1567: 20000 | I1567: 110003 | J1567: 4 | K1567: [{5,10},{6,15},{13,10},{14,5},{15,10},{16,5},{20,1},{27,10},{28,10}] | L1567: =R[-1]C -> [{5,1113},{6,1113},{13,18},{14,37},{15,18},{16,37},{20,3},{27,18},{28,18}] | M1567: =R[-1]C -> [{0,1,[1,30]},{1,2,[11,40]},{2,5,[21,50]},{5,10,[31,60]},{10,20,[41,60]},{30,20,[51,70]},{50,10,[61,80]},{70,5,[71,80]},{100,2,[81,90]},{150,1,[91,100]}]
A1568: 1565 | B1568: 5 | C1568: 8 | D1568: 3000 | E1568: =R[-9]C -> 71 | F1568: =R[-9]C -> 80 | G1568: 4 | H1568: 20000 | I1568: 110003 | J1568: 4 | K1568: [{5,10},{6,15},{13,10},{14,5},{15,10},{16,5},{20,1},{27,10},{28,10}] | L1568: =R[-1]C -> [{5,1113},{6,1113},{13,18},{14,37},{15,18},{16,37},{20,3},{27,18},{28,18}] | M1568: =R[-1]C -> [{0,1,[1,30]},{1,2,[11,40]},{2,5,[21,50]},{5,10,[31,60]},{10,20,[41,60]},{30,20,[51,70]},{50,10,[61,80]},{70,5,[71,80]},{100,2,[81,90]},{150,1,[91,100]}]
A1569: 1566 | B1569: 5 | C1569: 8 | D1569: 3000 | E1569: =R[-9]C -> 81 | F1569: =R[-9]C -> 90 | G1569: 4 | H1569: 20000 | I1569: 110003 | J1569: 4 | K1569: [{5,10},{6,15},{13,10},{14,5},{15,10},{16,5},{20,1},{27,10},{28,10}] | L1569: =R[-1]C -> [{5,1113},{6,1113},{13,18},{14,37},{15,18},{16,37},{20,3},{27,18},{28,18}] | M1569: =R[-1]C -> [{0,1,[1,30]},{1,2,[11,40]},{2,5,[21,50]},{5,10,[31,60]},{10,20,[41,60]},{30,20,[51,70]},{50,10,[61,80]},{70,5,[71,80]},{100,2,[81,90]},{150,1,[91,100]}]
A1570: 1567 | B1570: 6 | C1570: 8 | D1570: 3000 | E1570: =R[-9]C -> 1 | F1570: =R[-9]C -> 10 | G1570: 5 | H1570: 20000 | I1570: 110003 | J1570: 5 | K1570: [{5,10},{6,15},{13,10},{14,5},{15,10},{16,5},{20,1},{27,10},{28,10}] | L1570: =R[-1]C -> [{5,1113},{6,1113},{13,18},{14,37},{15,18},{16,37},{20,3},{27,18},{28,18}] | M1570: =R[-1]C -> [{0,1,[1,30]},{1,2,[11,40]},{2,5,[21,50]},{5,10,[31,60]},{10,20,[41,60]},{30,20,[51,70]},{50,10,[61,80]},{70,5,[71,80]},{100,2,[81,90]},{150,1,[91,100]}]
A1571: 1568 | B1571: 6 | C1571: 8 | D1571: 3000 | E1571: =R[-9]C -> 11 | F1571: =R[-9]C -> 20 | G1571: 5 | H1571: 20000 | I1571: 110003 | J1571: 5 | K1571: [{5,10},{6,15},{13,10},{14,5},{15,10},{16,5},{20,1},{27,10},{28,10}] | L1571: =R[-1]C -> [{5,1113},{6,1113},{13,18},{14,37},{15,18},{16,37},{20,3},{27,18},{28,18}] | M1571: =R[-1]C -> [{0,1,[1,30]},{1,2,[11,40]},{2,5,[21,50]},{5,10,[31,60]},{10,20,[41,60]},{30,20,[51,70]},{50,10,[61,80]},{70,5,[71,80]},{100,2,[81,90]},{150,1,[91,100]}]
A1572: 1569 | B1572: 6 | C1572: 8 | D1572: 3000 | E1572: =R[-9]C -> 21 | F1572: =R[-9]C -> 30 | G1572: 5 | H1572: 20000 | I1572: 110003 | J1572: 5 | K1572: [{5,10},{6,15},{13,10},{14,5},{15,10},{16,5},{20,1},{27,10},{28,10}] | L1572: =R[-1]C -> [{5,1113},{6,1113},{13,18},{14,37},{15,18},{16,37},{20,3},{27,18},{28,18}] | M1572: =R[-1]C -> [{0,1,[1,30]},{1,2,[11,40]},{2,5,[21,50]},{5,10,[31,60]},{10,20,[41,60]},{30,20,[51,70]},{50,10,[61,80]},{70,5,[71,80]},{100,2,[81,90]},{150,1,[91,100]}]
A1573: 1570 | B1573: 6 | C1573: 8 | D1573: 3000 | E1573: =R[-9]C -> 31 | F1573: =R[-9]C -> 40 | G1573: 5 | H1573: 20000 | I1573: 110003 | J1573: 5 | K1573: [{5,10},{6,15},{13,10},{14,5},{15,10},{16,5},{20,1},{27,10},{28,10}] | L1573: =R[-1]C -> [{5,1113},{6,1113},{13,18},{14,37},{15,18},{16,37},{20,3},{27,18},{28,18}] | M1573: =R[-1]C -> [{0,1,[1,30]},{1,2,[11,40]},{2,5,[21,50]},{5,10,[31,60]},{10,20,[41,60]},{30,20,[51,70]},{50,10,[61,80]},{70,5,[71,80]},{100,2,[81,90]},{150,1,[91,100]}]
A1574: 1571 | B1574: 6 | C1574: 8 | D1574: 3000 | E1574: =R[-9]C -> 41 | F1574: =R[-9]C -> 50 | G1574: 5 | H1574: 20000 | I1574: 110003 | J1574: 5 | K1574: [{5,10},{6,15},{13,10},{14,5},{15,10},{16,5},{20,1},{27,10},{28,10}] | L1574: =R[-1]C -> [{5,1113},{6,1113},{13,18},{14,37},{15,18},{16,37},{20,3},{27,18},{28,18}] | M1574: =R[-1]C -> [{0,1,[1,30]},{1,2,[11,40]},{2,5,[21,50]},{5,10,[31,60]},{10,20,[41,60]},{30,20,[51,70]},{50,10,[61,80]},{70,5,[71,80]},{100,2,[81,90]},{150,1,[91,100]}]
A1575: 1572 | B1575: 6 | C1575: 8 | D1575: 3000 | E1575: =R[-9]C -> 51 | F1575: =R[-9]C -> 60 | G1575: 5 | H1575: 20000 | I1575: 110003 | J1575: 5 | K1575: [{5,10},{6,15},{13,10},{14,5},{15,10},{16,5},{20,1},{27,10},{28,10}] | L1575: =R[-1]C -> [{5,1113},{6,1113},{13,18},{14,37},{15,18},{16,37},{20,3},{27,18},{28,18}] | M1575: =R[-1]C -> [{0,1,[1,30]},{1,2,[11,40]},{2,5,[21,50]},{5,10,[31,60]},{10,20,[41,60]},{30,20,[51,70]},{50,10,[61,80]},{70,5,[71,80]},{100,2,[81,90]},{150,1,[91,100]}]
A1576: 1573 | B1576: 6 | C1576: 8 | D1576: 3000 | E1576: =R[-9]C -> 61 | F1576: =R[-9]C -> 70 | G1576: 5 | H1576: 20000 | I1576: 110003 | J1576: 5 | K1576: [{5,10},{6,15},{13,10},{14,5},{15,10},{16,5},{20,1},{27,10},{28,10}] | L1576: =R[-1]C -> [{5,1113},{6,1113},{13,18},{14,37},{15,18},{16,37},{20,3},{27,18},{28,18}] | M1576: =R[-1]C -> [{0,1,[1,30]},{1,2,[11,40]},{2,5,[21,50]},{5,10,[31,60]},{10,20,[41,60]},{30,20,[51,70]},{50,10,[61,80]},{70,5,[71,80]},{100,2,[81,90]},{150,1,[91,100]}]
A1577: 1574 | B1577: 6 | C1577: 8 | D1577: 3000 | E1577: =R[-9]C -> 71 | F1577: =R[-9]C -> 80 | G1577: 5 | H1577: 20000 | I1577: 110003 | J1577: 5 | K1577: [{5,10},{6,15},{13,10},{14,5},{15,10},{16,5},{20,1},{27,10},{28,10}] | L1577: =R[-1]C -> [{5,1113},{6,1113},{13,18},{14,37},{15,18},{16,37},{20,3},{27,18},{28,18}] | M1577: =R[-1]C -> [{0,1,[1,30]},{1,2,[11,40]},{2,5,[21,50]},{5,10,[31,60]},{10,20,[41,60]},{30,20,[51,70]},{50,10,[61,80]},{70,5,[71,80]},{100,2,[81,90]},{150,1,[91,100]}]
A1578: 1575 | B1578: 6 | C1578: 8 | D1578: 3000 | E1578: =R[-9]C -> 81 | F1578: =R[-9]C -> 90 | G1578: 5 | H1578: 20000 | I1578: 110003 | J1578: 5 | K1578: [{5,10},{6,15},{13,10},{14,5},{15,10},{16,5},{20,1},{27,10},{28,10}] | L1578: =R[-1]C -> [{5,1113},{6,1113},{13,18},{14,37},{15,18},{16,37},{20,3},{27,18},{28,18}] | M1578: =R[-1]C -> [{0,1,[1,30]},{1,2,[11,40]},{2,5,[21,50]},{5,10,[31,60]},{10,20,[41,60]},{30,20,[51,70]},{50,10,[61,80]},{70,5,[71,80]},{100,2,[81,90]},{150,1,[91,100]}]
A1579: 1576 | B1579: 2 | C1579: 10 | D1579: 3000 | E1579: =R[-18]C -> 1 | F1579: =R[-18]C -> 10 | G1579: 1 | H1579: 5000 | I1579: 110003 | J1579: 1 | K1579: [{5,10},{6,15},{13,10},{14,5},{15,10},{16,5},{20,1},{27,10},{28,10}] | L1579: =R[-1]C -> [{5,1113},{6,1113},{13,18},{14,37},{15,18},{16,37},{20,3},{27,18},{28,18}] | M1579: =R[-1]C -> [{0,1,[1,30]},{1,2,[11,40]},{2,5,[21,50]},{5,10,[31,60]},{10,20,[41,60]},{30,20,[51,70]},{50,10,[61,80]},{70,5,[71,80]},{100,2,[81,90]},{150,1,[91,100]}]
A1580: 1577 | B1580: 2 | C1580: 10 | D1580: 3000 | E1580: =R[-18]C -> 11 | F1580: =R[-18]C -> 20 | G1580: 1 | H1580: 5000 | I1580: 110003 | J1580: 1 | K1580: [{5,10},{6,15},{13,10},{14,5},{15,10},{16,5},{20,1},{27,10},{28,10}] | L1580: =R[-1]C -> [{5,1113},{6,1113},{13,18},{14,37},{15,18},{16,37},{20,3},{27,18},{28,18}] | M1580: =R[-1]C -> [{0,1,[1,30]},{1,2,[11,40]},{2,5,[21,50]},{5,10,[31,60]},{10,20,[41,60]},{30,20,[51,70]},{50,10,[61,80]},{70,5,[71,80]},{100,2,[81,90]},{150,1,[91,100]}]
A1581: 1578 | B1581: 2 | C1581: 10 | D1581: 3000 | E1581: =R[-18]C -> 21 | F1581: =R[-18]C -> 30 | G1581: 1 | H1581: 5000 | I1581: 110003 | J1581: 1 | K1581: [{5,10},{6,15},{13,10},{14,5},{15,10},{16,5},{20,1},{27,10},{28,10}] | L1581: =R[-1]C -> [{5,1113},{6,1113},{13,18},{14,37},{15,18},{16,37},{20,3},{27,18},{28,18}] | M1581: =R[-1]C -> [{0,1,[1,30]},{1,2,[11,40]},{2,5,[21,50]},{5,10,[31,60]},{10,20,[41,60]},{30,20,[51,70]},{50,10,[61,80]},{70,5,[71,80]},{100,2,[81,90]},{150,1,[91,100]}]
A1582: 1579 | B1582: 2 | C1582: 10 | D1582: 3000 | E1582: =R[-18]C -> 31 | F1582: =R[-18]C -> 40 | G1582: 1 | H1582: 5000 | I1582: 110003 | J1582: 1 | K1582: [{5,10},{6,15},{13,10},{14,5},{15,10},{16,5},{20,1},{27,10},{28,10}] | L1582: =R[-1]C -> [{5,1113},{6,1113},{13,18},{14,37},{15,18},{16,37},{20,3},{27,18},{28,18}] | M1582: =R[-1]C -> [{0,1,[1,30]},{1,2,[11,40]},{2,5,[21,50]},{5,10,[31,60]},{10,20,[41,60]},{30,20,[51,70]},{50,10,[61,80]},{70,5,[71,80]},{100,2,[81,90]},{150,1,[91,100]}]
A1583: 1580 | B1583: 2 | C1583: 10 | D1583: 3000 | E1583: =R[-18]C -> 41 | F1583: =R[-18]C -> 50 | G1583: 1 | H1583: 5000 | I1583: 110003 | J1583: 1 | K1583: [{5,10},{6,15},{13,10},{14,5},{15,10},{16,5},{20,1},{27,10},{28,10}] | L1583: =R[-1]C -> [{5,1113},{6,1113},{13,18},{14,37},{15,18},{16,37},{20,3},{27,18},{28,18}] | M1583: =R[-1]C -> [{0,1,[1,30]},{1,2,[11,40]},{2,5,[21,50]},{5,10,[31,60]},{10,20,[41,60]},{30,20,[51,70]},{50,10,[61,80]},{70,5,[71,80]},{100,2,[81,90]},{150,1,[91,100]}]
A1584: 1581 | B1584: 2 | C1584: 10 | D1584: 3000 | E1584: =R[-18]C -> 51 | F1584: =R[-18]C -> 60 | G1584: 1 | H1584: 5000 | I1584: 110003 | J1584: 1 | K1584: [{5,10},{6,15},{13,10},{14,5},{15,10},{16,5},{20,1},{27,10},{28,10}] | L1584: =R[-1]C -> [{5,1113},{6,1113},{13,18},{14,37},{15,18},{16,37},{20,3},{27,18},{28,18}] | M1584: =R[-1]C -> [{0,1,[1,30]},{1,2,[11,40]},{2,5,[21,50]},{5,10,[31,60]},{10,20,[41,60]},{30,20,[51,70]},{50,10,[61,80]},{70,5,[71,80]},{100,2,[81,90]},{150,1,[91,100]}]
A1585: 1582 | B1585: 2 | C1585: 10 | D1585: 3000 | E1585: =R[-18]C -> 61 | F1585: =R[-18]C -> 70 | G1585: 1 | H1585: 5000 | I1585: 110003 | J1585: 1 | K1585: [{5,10},{6,15},{13,10},{14,5},{15,10},{16,5},{20,1},{27,10},{28,10}] | L1585: =R[-1]C -> [{5,1113},{6,1113},{13,18},{14,37},{15,18},{16,37},{20,3},{27,18},{28,18}] | M1585: =R[-1]C -> [{0,1,[1,30]},{1,2,[11,40]},{2,5,[21,50]},{5,10,[31,60]},{10,20,[41,60]},{30,20,[51,70]},{50,10,[61,80]},{70,5,[71,80]},{100,2,[81,90]},{150,1,[91,100]}]
A1586: 1583 | B1586: 2 | C1586: 10 | D1586: 3000 | E1586: =R[-18]C -> 71 | F1586: =R[-18]C -> 80 | G1586: 1 | H1586: 5000 | I1586: 110003 | J1586: 1 | K1586: [{5,10},{6,15},{13,10},{14,5},{15,10},{16,5},{20,1},{27,10},{28,10}] | L1586: =R[-1]C -> [{5,1113},{6,1113},{13,18},{14,37},{15,18},{16,37},{20,3},{27,18},{28,18}] | M1586: =R[-1]C -> [{0,1,[1,30]},{1,2,[11,40]},{2,5,[21,50]},{5,10,[31,60]},{10,20,[41,60]},{30,20,[51,70]},{50,10,[61,80]},{70,5,[71,80]},{100,2,[81,90]},{150,1,[91,100]}]
A1587: 1584 | B1587: 2 | C1587: 10 | D1587: 3000 | E1587: =R[-18]C -> 81 | F1587: =R[-18]C -> 90 | G1587: 1 | H1587: 5000 | I1587: 110003 | J1587: 1 | K1587: [{5,10},{6,15},{13,10},{14,5},{15,10},{16,5},{20,1},{27,10},{28,10}] | L1587: =R[-1]C -> [{5,1113},{6,1113},{13,18},{14,37},{15,18},{16,37},{20,3},{27,18},{28,18}] | M1587: =R[-1]C -> [{0,1,[1,30]},{1,2,[11,40]},{2,5,[21,50]},{5,10,[31,60]},{10,20,[41,60]},{30,20,[51,70]},{50,10,[61,80]},{70,5,[71,80]},{100,2,[81,90]},{150,1,[91,100]}]
A1588: 1585 | B1588: 3 | C1588: 10 | D1588: 3000 | E1588: =R[-9]C -> 1 | F1588: =R[-9]C -> 10 | G1588: 2 | H1588: 10000 | I1588: 110003 | J1588: 2 | K1588: [{5,10},{6,15},{13,10},{14,5},{15,10},{16,5},{20,1},{27,10},{28,10}] | L1588: =R[-1]C -> [{5,1113},{6,1113},{13,18},{14,37},{15,18},{16,37},{20,3},{27,18},{28,18}] | M1588: =R[-1]C -> [{0,1,[1,30]},{1,2,[11,40]},{2,5,[21,50]},{5,10,[31,60]},{10,20,[41,60]},{30,20,[51,70]},{50,10,[61,80]},{70,5,[71,80]},{100,2,[81,90]},{150,1,[91,100]}]
A1589: 1586 | B1589: 3 | C1589: 10 | D1589: 3000 | E1589: =R[-9]C -> 11 | F1589: =R[-9]C -> 20 | G1589: 2 | H1589: 10000 | I1589: 110003 | J1589: 2 | K1589: [{5,10},{6,15},{13,10},{14,5},{15,10},{16,5},{20,1},{27,10},{28,10}] | L1589: =R[-1]C -> [{5,1113},{6,1113},{13,18},{14,37},{15,18},{16,37},{20,3},{27,18},{28,18}] | M1589: =R[-1]C -> [{0,1,[1,30]},{1,2,[11,40]},{2,5,[21,50]},{5,10,[31,60]},{10,20,[41,60]},{30,20,[51,70]},{50,10,[61,80]},{70,5,[71,80]},{100,2,[81,90]},{150,1,[91,100]}]
A1590: 1587 | B1590: 3 | C1590: 10 | D1590: 3000 | E1590: =R[-9]C -> 21 | F1590: =R[-9]C -> 30 | G1590: 2 | H1590: 10000 | I1590: 110003 | J1590: 2 | K1590: [{5,10},{6,15},{13,10},{14,5},{15,10},{16,5},{20,1},{27,10},{28,10}] | L1590: =R[-1]C -> [{5,1113},{6,1113},{13,18},{14,37},{15,18},{16,37},{20,3},{27,18},{28,18}] | M1590: =R[-1]C -> [{0,1,[1,30]},{1,2,[11,40]},{2,5,[21,50]},{5,10,[31,60]},{10,20,[41,60]},{30,20,[51,70]},{50,10,[61,80]},{70,5,[71,80]},{100,2,[81,90]},{150,1,[91,100]}]
A1591: 1588 | B1591: 3 | C1591: 10 | D1591: 3000 | E1591: =R[-9]C -> 31 | F1591: =R[-9]C -> 40 | G1591: 2 | H1591: 10000 | I1591: 110003 | J1591: 2 | K1591: [{5,10},{6,15},{13,10},{14,5},{15,10},{16,5},{20,1},{27,10},{28,10}] | L1591: =R[-1]C -> [{5,1113},{6,1113},{13,18},{14,37},{15,18},{16,37},{20,3},{27,18},{28,18}] | M1591: =R[-1]C -> [{0,1,[1,30]},{1,2,[11,40]},{2,5,[21,50]},{5,10,[31,60]},{10,20,[41,60]},{30,20,[51,70]},{50,10,[61,80]},{70,5,[71,80]},{100,2,[81,90]},{150,1,[91,100]}]
A1592: 1589 | B1592: 3 | C1592: 10 | D1592: 3000 | E1592: =R[-9]C -> 41 | F1592: =R[-9]C -> 50 | G1592: 2 | H1592: 10000 | I1592: 110003 | J1592: 2 | K1592: [{5,10},{6,15},{13,10},{14,5},{15,10},{16,5},{20,1},{27,10},{28,10}] | L1592: =R[-1]C -> [{5,1113},{6,1113},{13,18},{14,37},{15,18},{16,37},{20,3},{27,18},{28,18}] | M1592: =R[-1]C -> [{0,1,[1,30]},{1,2,[11,40]},{2,5,[21,50]},{5,10,[31,60]},{10,20,[41,60]},{30,20,[51,70]},{50,10,[61,80]},{70,5,[71,80]},{100,2,[81,90]},{150,1,[91,100]}]
A1593: 1590 | B1593: 3 | C1593: 10 | D1593: 3000 | E1593: =R[-9]C -> 51 | F1593: =R[-9]C -> 60 | G1593: 2 | H1593: 10000 | I1593: 110003 | J1593: 2 | K1593: [{5,10},{6,15},{13,10},{14,5},{15,10},{16,5},{20,1},{27,10},{28,10}] | L1593: =R[-1]C -> [{5,1113},{6,1113},{13,18},{14,37},{15,18},{16,37},{20,3},{27,18},{28,18}] | M1593: =R[-1]C -> [{0,1,[1,30]},{1,2,[11,40]},{2,5,[21,50]},{5,10,[31,60]},{10,20,[41,60]},{30,20,[51,70]},{50,10,[61,80]},{70,5,[71,80]},{100,2,[81,90]},{150,1,[91,100]}]
A1594: 1591 | B1594: 3 | C1594: 10 | D1594: 3000 | E1594: =R[-9]C -> 61 | F1594: =R[-9]C -> 70 | G1594: 2 | H1594: 10000 | I1594: 110003 | J1594: 2 | K1594: [{5,10},{6,15},{13,10},{14,5},{15,10},{16,5},{20,1},{27,10},{28,10}] | L1594: =R[-1]C -> [{5,1113},{6,1113},{13,18},{14,37},{15,18},{16,37},{20,3},{27,18},{28,18}] | M1594: =R[-1]C -> [{0,1,[1,30]},{1,2,[11,40]},{2,5,[21,50]},{5,10,[31,60]},{10,20,[41,60]},{30,20,[51,70]},{50,10,[61,80]},{70,5,[71,80]},{100,2,[81,90]},{150,1,[91,100]}]
A1595: 1592 | B1595: 3 | C1595: 10 | D1595: 3000 | E1595: =R[-9]C -> 71 | F1595: =R[-9]C -> 80 | G1595: 2 | H1595: 10000 | I1595: 110003 | J1595: 2 | K1595: [{5,10},{6,15},{13,10},{14,5},{15,10},{16,5},{20,1},{27,10},{28,10}] | L1595: =R[-1]C -> [{5,1113},{6,1113},{13,18},{14,37},{15,18},{16,37},{20,3},{27,18},{28,18}] | M1595: =R[-1]C -> [{0,1,[1,30]},{1,2,[11,40]},{2,5,[21,50]},{5,10,[31,60]},{10,20,[41,60]},{30,20,[51,70]},{50,10,[61,80]},{70,5,[71,80]},{100,2,[81,90]},{150,1,[91,100]}]
A1596: 1593 | B1596: 3 | C1596: 10 | D1596: 3000 | E1596: =R[-9]C -> 81 | F1596: =R[-9]C -> 90 | G1596: 2 | H1596: 10000 | I1596: 110003 | J1596: 2 | K1596: [{5,10},{6,15},{13,10},{14,5},{15,10},{16,5},{20,1},{27,10},{28,10}] | L1596: =R[-1]C -> [{5,1113},{6,1113},{13,18},{14,37},{15,18},{16,37},{20,3},{27,18},{28,18}] | M1596: =R[-1]C -> [{0,1,[1,30]},{1,2,[11,40]},{2,5,[21,50]},{5,10,[31,60]},{10,20,[41,60]},{30,20,[51,70]},{50,10,[61,80]},{70,5,[71,80]},{100,2,[81,90]},{150,1,[91,100]}]
A1597: 1594 | B1597: 4 | C1597: 10 | D1597: 3000 | E1597: =R[-9]C -> 1 | F1597: =R[-9]C -> 10 | G1597: 3 | H1597: 15000 | I1597: 110003 | J1597: 3 | K1597: [{5,10},{6,15},{13,10},{14,5},{15,10},{16,5},{20,1},{27,10},{28,10}] | L1597: =R[-1]C -> [{5,1113},{6,1113},{13,18},{14,37},{15,18},{16,37},{20,3},{27,18},{28,18}] | M1597: =R[-1]C -> [{0,1,[1,30]},{1,2,[11,40]},{2,5,[21,50]},{5,10,[31,60]},{10,20,[41,60]},{30,20,[51,70]},{50,10,[61,80]},{70,5,[71,80]},{100,2,[81,90]},{150,1,[91,100]}]
A1598: 1595 | B1598: 4 | C1598: 10 | D1598: 3000 | E1598: =R[-9]C -> 11 | F1598: =R[-9]C -> 20 | G1598: 3 | H1598: 15000 | I1598: 110003 | J1598: 3 | K1598: [{5,10},{6,15},{13,10},{14,5},{15,10},{16,5},{20,1},{27,10},{28,10}] | L1598: =R[-1]C -> [{5,1113},{6,1113},{13,18},{14,37},{15,18},{16,37},{20,3},{27,18},{28,18}] | M1598: =R[-1]C -> [{0,1,[1,30]},{1,2,[11,40]},{2,5,[21,50]},{5,10,[31,60]},{10,20,[41,60]},{30,20,[51,70]},{50,10,[61,80]},{70,5,[71,80]},{100,2,[81,90]},{150,1,[91,100]}]
A1599: 1596 | B1599: 4 | C1599: 10 | D1599: 3000 | E1599: =R[-9]C -> 21 | F1599: =R[-9]C -> 30 | G1599: 3 | H1599: 15000 | I1599: 110003 | J1599: 3 | K1599: [{5,10},{6,15},{13,10},{14,5},{15,10},{16,5},{20,1},{27,10},{28,10}] | L1599: =R[-1]C -> [{5,1113},{6,1113},{13,18},{14,37},{15,18},{16,37},{20,3},{27,18},{28,18}] | M1599: =R[-1]C -> [{0,1,[1,30]},{1,2,[11,40]},{2,5,[21,50]},{5,10,[31,60]},{10,20,[41,60]},{30,20,[51,70]},{50,10,[61,80]},{70,5,[71,80]},{100,2,[81,90]},{150,1,[91,100]}]
A1600: 1597 | B1600: 4 | C1600: 10 | D1600: 3000 | E1600: =R[-9]C -> 31 | F1600: =R[-9]C -> 40 | G1600: 3 | H1600: 15000 | I1600: 110003 | J1600: 3 | K1600: [{5,10},{6,15},{13,10},{14,5},{15,10},{16,5},{20,1},{27,10},{28,10}] | L1600: =R[-1]C -> [{5,1113},{6,1113},{13,18},{14,37},{15,18},{16,37},{20,3},{27,18},{28,18}] | M1600: =R[-1]C -> [{0,1,[1,30]},{1,2,[11,40]},{2,5,[21,50]},{5,10,[31,60]},{10,20,[41,60]},{30,20,[51,70]},{50,10,[61,80]},{70,5,[71,80]},{100,2,[81,90]},{150,1,[91,100]}]
A1601: 1598 | B1601: 4 | C1601: 10 | D1601: 3000 | E1601: =R[-9]C -> 41 | F1601: =R[-9]C -> 50 | G1601: 3 | H1601: 15000 | I1601: 110003 | J1601: 3 | K1601: [{5,10},{6,15},{13,10},{14,5},{15,10},{16,5},{20,1},{27,10},{28,10}] | L1601: =R[-1]C -> [{5,1113},{6,1113},{13,18},{14,37},{15,18},{16,37},{20,3},{27,18},{28,18}] | M1601: =R[-1]C -> [{0,1,[1,30]},{1,2,[11,40]},{2,5,[21,50]},{5,10,[31,60]},{10,20,[41,60]},{30,20,[51,70]},{50,10,[61,80]},{70,5,[71,80]},{100,2,[81,90]},{150,1,[91,100]}]
A1602: 1599 | B1602: 4 | C1602: 10 | D1602: 3000 | E1602: =R[-9]C -> 51 | F1602: =R[-9]C -> 60 | G1602: 3 | H1602: 15000 | I1602: 110003 | J1602: 3 | K1602: [{5,10},{6,15},{13,10},{14,5},{15,10},{16,5},{20,1},{27,10},{28,10}] | L1602: =R[-1]C -> [{5,1113},{6,1113},{13,18},{14,37},{15,18},{16,37},{20,3},{27,18},{28,18}] | M1602: =R[-1]C -> [{0,1,[1,30]},{1,2,[11,40]},{2,5,[21,50]},{5,10,[31,60]},{10,20,[41,60]},{30,20,[51,70]},{50,10,[61,80]},{70,5,[71,80]},{100,2,[81,90]},{150,1,[91,100]}]
A1603: 1600 | B1603: 4 | C1603: 10 | D1603: 3000 | E1603: =R[-9]C -> 61 | F1603: =R[-9]C -> 70 | G1603: 3 | H1603: 15000 | I1603: 110003 | J1603: 3 | K1603: [{5,10},{6,15},{13,10},{14,5},{15,10},{16,5},{20,1},{27,10},{28,10}] | L1603: =R[-1]C -> [{5,1113},{6,1113},{13,18},{14,37},{15,18},{16,37},{20,3},{27,18},{28,18}] | M1603: =R[-1]C -> [{0,1,[1,30]},{1,2,[11,40]},{2,5,[21,50]},{5,10,[31,60]},{10,20,[41,60]},{30,20,[51,70]},{50,10,[61,80]},{70,5,[71,80]},{100,2,[81,90]},{150,1,[91,100]}]
A1604: 1601 | B1604: 4 | C1604: 10 | D1604: 3000 | E1604: =R[-9]C -> 71 | F1604: =R[-9]C -> 80 | G1604: 3 | H1604: 15000 | I1604: 110003 | J1604: 3 | K1604: [{5,10},{6,15},{13,10},{14,5},{15,10},{16,5},{20,1},{27,10},{28,10}] | L1604: =R[-1]C -> [{5,1113},{6,1113},{13,18},{14,37},{15,18},{16,37},{20,3},{27,18},{28,18}] | M1604: =R[-1]C -> [{0,1,[1,30]},{1,2,[11,40]},{2,5,[21,50]},{5,10,[31,60]},{10,20,[41,60]},{30,20,[51,70]},{50,10,[61,80]},{70,5,[71,80]},{100,2,[81,90]},{150,1,[91,100]}]
A1605: 1602 | B1605: 4 | C1605: 10 | D1605: 3000 | E1605: =R[-9]C -> 81 | F1605: =R[-9]C -> 90 | G1605: 3 | H1605: 15000 | I1605: 110003 | J1605: 3 | K1605: [{5,10},{6,15},{13,10},{14,5},{15,10},{16,5},{20,1},{27,10},{28,10}] | L1605: =R[-1]C -> [{5,1113},{6,1113},{13,18},{14,37},{15,18},{16,37},{20,3},{27,18},{28,18}] | M1605: =R[-1]C -> [{0,1,[1,30]},{1,2,[11,40]},{2,5,[21,50]},{5,10,[31,60]},{10,20,[41,60]},{30,20,[51,70]},{50,10,[61,80]},{70,5,[71,80]},{100,2,[81,90]},{150,1,[91,100]}]
A1606: 1603 | B1606: 5 | C1606: 10 | D1606: 3000 | E1606: =R[-9]C -> 1 | F1606: =R[-9]C -> 10 | G1606: 4 | H1606: 20000 | I1606: 110003 | J1606: 4 | K1606: [{5,10},{6,15},{13,10},{14,5},{15,10},{16,5},{20,1},{27,10},{28,10}] | L1606: =R[-1]C -> [{5,1113},{6,1113},{13,18},{14,37},{15,18},{16,37},{20,3},{27,18},{28,18}] | M1606: =R[-1]C -> [{0,1,[1,30]},{1,2,[11,40]},{2,5,[21,50]},{5,10,[31,60]},{10,20,[41,60]},{30,20,[51,70]},{50,10,[61,80]},{70,5,[71,80]},{100,2,[81,90]},{150,1,[91,100]}]
A1607: 1604 | B1607: 5 | C1607: 10 | D1607: 3000 | E1607: =R[-9]C -> 11 | F1607: =R[-9]C -> 20 | G1607: 4 | H1607: 20000 | I1607: 110003 | J1607: 4 | K1607: [{5,10},{6,15},{13,10},{14,5},{15,10},{16,5},{20,1},{27,10},{28,10}] | L1607: =R[-1]C -> [{5,1113},{6,1113},{13,18},{14,37},{15,18},{16,37},{20,3},{27,18},{28,18}] | M1607: =R[-1]C -> [{0,1,[1,30]},{1,2,[11,40]},{2,5,[21,50]},{5,10,[31,60]},{10,20,[41,60]},{30,20,[51,70]},{50,10,[61,80]},{70,5,[71,80]},{100,2,[81,90]},{150,1,[91,100]}]
A1608: 1605 | B1608: 5 | C1608: 10 | D1608: 3000 | E1608: =R[-9]C -> 21 | F1608: =R[-9]C -> 30 | G1608: 4 | H1608: 20000 | I1608: 110003 | J1608: 4 | K1608: [{5,10},{6,15},{13,10},{14,5},{15,10},{16,5},{20,1},{27,10},{28,10}] | L1608: =R[-1]C -> [{5,1113},{6,1113},{13,18},{14,37},{15,18},{16,37},{20,3},{27,18},{28,18}] | M1608: =R[-1]C -> [{0,1,[1,30]},{1,2,[11,40]},{2,5,[21,50]},{5,10,[31,60]},{10,20,[41,60]},{30,20,[51,70]},{50,10,[61,80]},{70,5,[71,80]},{100,2,[81,90]},{150,1,[91,100]}]
A1609: 1606 | B1609: 5 | C1609: 10 | D1609: 3000 | E1609: =R[-9]C -> 31 | F1609: =R[-9]C -> 40 | G1609: 4 | H1609: 20000 | I1609: 110003 | J1609: 4 | K1609: [{5,10},{6,15},{13,10},{14,5},{15,10},{16,5},{20,1},{27,10},{28,10}] | L1609: =R[-1]C -> [{5,1113},{6,1113},{13,18},{14,37},{15,18},{16,37},{20,3},{27,18},{28,18}] | M1609: =R[-1]C -> [{0,1,[1,30]},{1,2,[11,40]},{2,5,[21,50]},{5,10,[31,60]},{10,20,[41,60]},{30,20,[51,70]},{50,10,[61,80]},{70,5,[71,80]},{100,2,[81,90]},{150,1,[91,100]}]
A1610: 1607 | B1610: 5 | C1610: 10 | D1610: 3000 | E1610: =R[-9]C -> 41 | F1610: =R[-9]C -> 50 | G1610: 4 | H1610: 20000 | I1610: 110003 | J1610: 4 | K1610: [{5,10},{6,15},{13,10},{14,5},{15,10},{16,5},{20,1},{27,10},{28,10}] | L1610: =R[-1]C -> [{5,1113},{6,1113},{13,18},{14,37},{15,18},{16,37},{20,3},{27,18},{28,18}] | M1610: =R[-1]C -> [{0,1,[1,30]},{1,2,[11,40]},{2,5,[21,50]},{5,10,[31,60]},{10,20,[41,60]},{30,20,[51,70]},{50,10,[61,80]},{70,5,[71,80]},{100,2,[81,90]},{150,1,[91,100]}]
A1611: 1608 | B1611: 5 | C1611: 10 | D1611: 3000 | E1611: =R[-9]C -> 51 | F1611: =R[-9]C -> 60 | G1611: 4 | H1611: 20000 | I1611: 110003 | J1611: 4 | K1611: [{5,10},{6,15},{13,10},{14,5},{15,10},{16,5},{20,1},{27,10},{28,10}] | L1611: =R[-1]C -> [{5,1113},{6,1113},{13,18},{14,37},{15,18},{16,37},{20,3},{27,18},{28,18}] | M1611: =R[-1]C -> [{0,1,[1,30]},{1,2,[11,40]},{2,5,[21,50]},{5,10,[31,60]},{10,20,[41,60]},{30,20,[51,70]},{50,10,[61,80]},{70,5,[71,80]},{100,2,[81,90]},{150,1,[91,100]}]
A1612: 1609 | B1612: 5 | C1612: 10 | D1612: 3000 | E1612: =R[-9]C -> 61 | F1612: =R[-9]C -> 70 | G1612: 4 | H1612: 20000 | I1612: 110003 | J1612: 4 | K1612: [{5,10},{6,15},{13,10},{14,5},{15,10},{16,5},{20,1},{27,10},{28,10}] | L1612: =R[-1]C -> [{5,1113},{6,1113},{13,18},{14,37},{15,18},{16,37},{20,3},{27,18},{28,18}] | M1612: =R[-1]C -> [{0,1,[1,30]},{1,2,[11,40]},{2,5,[21,50]},{5,10,[31,60]},{10,20,[41,60]},{30,20,[51,70]},{50,10,[61,80]},{70,5,[71,80]},{100,2,[81,90]},{150,1,[91,100]}]
A1613: 1610 | B1613: 5 | C1613: 10 | D1613: 3000 | E1613: =R[-9]C -> 71 | F1613: =R[-9]C -> 80 | G1613: 4 | H1613: 20000 | I1613: 110003 | J1613: 4 | K1613: [{5,10},{6,15},{13,10},{14,5},{15,10},{16,5},{20,1},{27,10},{28,10}] | L1613: =R[-1]C -> [{5,1113},{6,1113},{13,18},{14,37},{15,18},{16,37},{20,3},{27,18},{28,18}] | M1613: =R[-1]C -> [{0,1,[1,30]},{1,2,[11,40]},{2,5,[21,50]},{5,10,[31,60]},{10,20,[41,60]},{30,20,[51,70]},{50,10,[61,80]},{70,5,[71,80]},{100,2,[81,90]},{150,1,[91,100]}]
A1614: 1611 | B1614: 5 | C1614: 10 | D1614: 3000 | E1614: =R[-9]C -> 81 | F1614: =R[-9]C -> 90 | G1614: 4 | H1614: 20000 | I1614: 110003 | J1614: 4 | K1614: [{5,10},{6,15},{13,10},{14,5},{15,10},{16,5},{20,1},{27,10},{28,10}] | L1614: =R[-1]C -> [{5,1113},{6,1113},{13,18},{14,37},{15,18},{16,37},{20,3},{27,18},{28,18}] | M1614: =R[-1]C -> [{0,1,[1,30]},{1,2,[11,40]},{2,5,[21,50]},{5,10,[31,60]},{10,20,[41,60]},{30,20,[51,70]},{50,10,[61,80]},{70,5,[71,80]},{100,2,[81,90]},{150,1,[91,100]}]
A1615: 1612 | B1615: 6 | C1615: 10 | D1615: 3000 | E1615: =R[-9]C -> 1 | F1615: =R[-9]C -> 10 | G1615: 5 | H1615: 20000 | I1615: 110003 | J1615: 5 | K1615: [{5,10},{6,15},{13,10},{14,5},{15,10},{16,5},{20,1},{27,10},{28,10}] | L1615: =R[-1]C -> [{5,1113},{6,1113},{13,18},{14,37},{15,18},{16,37},{20,3},{27,18},{28,18}] | M1615: =R[-1]C -> [{0,1,[1,30]},{1,2,[11,40]},{2,5,[21,50]},{5,10,[31,60]},{10,20,[41,60]},{30,20,[51,70]},{50,10,[61,80]},{70,5,[71,80]},{100,2,[81,90]},{150,1,[91,100]}]
A1616: 1613 | B1616: 6 | C1616: 10 | D1616: 3000 | E1616: =R[-9]C -> 11 | F1616: =R[-9]C -> 20 | G1616: 5 | H1616: 20000 | I1616: 110003 | J1616: 5 | K1616: [{5,10},{6,15},{13,10},{14,5},{15,10},{16,5},{20,1},{27,10},{28,10}] | L1616: =R[-1]C -> [{5,1113},{6,1113},{13,18},{14,37},{15,18},{16,37},{20,3},{27,18},{28,18}] | M1616: =R[-1]C -> [{0,1,[1,30]},{1,2,[11,40]},{2,5,[21,50]},{5,10,[31,60]},{10,20,[41,60]},{30,20,[51,70]},{50,10,[61,80]},{70,5,[71,80]},{100,2,[81,90]},{150,1,[91,100]}]
A1617: 1614 | B1617: 6 | C1617: 10 | D1617: 3000 | E1617: =R[-9]C -> 21 | F1617: =R[-9]C -> 30 | G1617: 5 | H1617: 20000 | I1617: 110003 | J1617: 5 | K1617: [{5,10},{6,15},{13,10},{14,5},{15,10},{16,5},{20,1},{27,10},{28,10}] | L1617: =R[-1]C -> [{5,1113},{6,1113},{13,18},{14,37},{15,18},{16,37},{20,3},{27,18},{28,18}] | M1617: =R[-1]C -> [{0,1,[1,30]},{1,2,[11,40]},{2,5,[21,50]},{5,10,[31,60]},{10,20,[41,60]},{30,20,[51,70]},{50,10,[61,80]},{70,5,[71,80]},{100,2,[81,90]},{150,1,[91,100]}]
A1618: 1615 | B1618: 6 | C1618: 10 | D1618: 3000 | E1618: =R[-9]C -> 31 | F1618: =R[-9]C -> 40 | G1618: 5 | H1618: 20000 | I1618: 110003 | J1618: 5 | K1618: [{5,10},{6,15},{13,10},{14,5},{15,10},{16,5},{20,1},{27,10},{28,10}] | L1618: =R[-1]C -> [{5,1113},{6,1113},{13,18},{14,37},{15,18},{16,37},{20,3},{27,18},{28,18}] | M1618: =R[-1]C -> [{0,1,[1,30]},{1,2,[11,40]},{2,5,[21,50]},{5,10,[31,60]},{10,20,[41,60]},{30,20,[51,70]},{50,10,[61,80]},{70,5,[71,80]},{100,2,[81,90]},{150,1,[91,100]}]
A1619: 1616 | B1619: 6 | C1619: 10 | D1619: 3000 | E1619: =R[-9]C -> 41 | F1619: =R[-9]C -> 50 | G1619: 5 | H1619: 20000 | I1619: 110003 | J1619: 5 | K1619: [{5,10},{6,15},{13,10},{14,5},{15,10},{16,5},{20,1},{27,10},{28,10}] | L1619: =R[-1]C -> [{5,1113},{6,1113},{13,18},{14,37},{15,18},{16,37},{20,3},{27,18},{28,18}] | M1619: =R[-1]C -> [{0,1,[1,30]},{1,2,[11,40]},{2,5,[21,50]},{5,10,[31,60]},{10,20,[41,60]},{30,20,[51,70]},{50,10,[61,80]},{70,5,[71,80]},{100,2,[81,90]},{150,1,[91,100]}]
A1620: 1617 | B1620: 6 | C1620: 10 | D1620: 3000 | E1620: =R[-9]C -> 51 | F1620: =R[-9]C -> 60 | G1620: 5 | H1620: 20000 | I1620: 110003 | J1620: 5 | K1620: [{5,10},{6,15},{13,10},{14,5},{15,10},{16,5},{20,1},{27,10},{28,10}] | L1620: =R[-1]C -> [{5,1113},{6,1113},{13,18},{14,37},{15,18},{16,37},{20,3},{27,18},{28,18}] | M1620: =R[-1]C -> [{0,1,[1,30]},{1,2,[11,40]},{2,5,[21,50]},{5,10,[31,60]},{10,20,[41,60]},{30,20,[51,70]},{50,10,[61,80]},{70,5,[71,80]},{100,2,[81,90]},{150,1,[91,100]}]
A1621: 1618 | B1621: 6 | C1621: 10 | D1621: 3000 | E1621: =R[-9]C -> 61 | F1621: =R[-9]C -> 70 | G1621: 5 | H1621: 20000 | I1621: 110003 | J1621: 5 | K1621: [{5,10},{6,15},{13,10},{14,5},{15,10},{16,5},{20,1},{27,10},{28,10}] | L1621: =R[-1]C -> [{5,1113},{6,1113},{13,18},{14,37},{15,18},{16,37},{20,3},{27,18},{28,18}] | M1621: =R[-1]C -> [{0,1,[1,30]},{1,2,[11,40]},{2,5,[21,50]},{5,10,[31,60]},{10,20,[41,60]},{30,20,[51,70]},{50,10,[61,80]},{70,5,[71,80]},{100,2,[81,90]},{150,1,[91,100]}]
A1622: 1619 | B1622: 6 | C1622: 10 | D1622: 3000 | E1622: =R[-9]C -> 71 | F1622: =R[-9]C -> 80 | G1622: 5 | H1622: 20000 | I1622: 110003 | J1622: 5 | K1622: [{5,10},{6,15},{13,10},{14,5},{15,10},{16,5},{20,1},{27,10},{28,10}] | L1622: =R[-1]C -> [{5,1113},{6,1113},{13,18},{14,37},{15,18},{16,37},{20,3},{27,18},{28,18}] | M1622: =R[-1]C -> [{0,1,[1,30]},{1,2,[11,40]},{2,5,[21,50]},{5,10,[31,60]},{10,20,[41,60]},{30,20,[51,70]},{50,10,[61,80]},{70,5,[71,80]},{100,2,[81,90]},{150,1,[91,100]}]
A1623: 1620 | B1623: 6 | C1623: 10 | D1623: 3000 | E1623: =R[-9]C -> 81 | F1623: =R[-9]C -> 90 | G1623: 5 | H1623: 20000 | I1623: 110003 | J1623: 5 | K1623: [{5,10},{6,15},{13,10},{14,5},{15,10},{16,5},{20,1},{27,10},{28,10}] | L1623: =R[-1]C -> [{5,1113},{6,1113},{13,18},{14,37},{15,18},{16,37},{20,3},{27,18},{28,18}] | M1623: =R[-1]C -> [{0,1,[1,30]},{1,2,[11,40]},{2,5,[21,50]},{5,10,[31,60]},{10,20,[41,60]},{30,20,[51,70]},{50,10,[61,80]},{70,5,[71,80]},{100,2,[81,90]},{150,1,[91,100]}]
A1624: 1621 | B1624: 2 | C1624: 2 | D1624: 0 | E1624: =R[-918]C -> 1 | F1624: =R[-918]C -> 10 | G1624: 1 | H1624: 5000 | I1624: 110003 | J1624: 1 | K1624: [{5,10},{6,15},{13,10},{14,5},{15,10},{16,5},{20,1},{27,10},{28,10}] | L1624: =R[-1]C -> [{5,1113},{6,1113},{13,18},{14,37},{15,18},{16,37},{20,3},{27,18},{28,18}] | M1624: =R[-1]C -> [{0,1,[1,30]},{1,2,[11,40]},{2,5,[21,50]},{5,10,[31,60]},{10,20,[41,60]},{30,20,[51,70]},{50,10,[61,80]},{70,5,[71,80]},{100,2,[81,90]},{150,1,[91,100]}]
A1625: 1622 | B1625: 2 | C1625: 2 | D1625: 0 | E1625: =R[-918]C -> 11 | F1625: =R[-918]C -> 20 | G1625: 1 | H1625: 5000 | I1625: 110003 | J1625: 1 | K1625: [{5,10},{6,15},{13,10},{14,5},{15,10},{16,5},{20,1},{27,10},{28,10}] | L1625: =R[-1]C -> [{5,1113},{6,1113},{13,18},{14,37},{15,18},{16,37},{20,3},{27,18},{28,18}] | M1625: =R[-1]C -> [{0,1,[1,30]},{1,2,[11,40]},{2,5,[21,50]},{5,10,[31,60]},{10,20,[41,60]},{30,20,[51,70]},{50,10,[61,80]},{70,5,[71,80]},{100,2,[81,90]},{150,1,[91,100]}]
A1626: 1623 | B1626: 2 | C1626: 2 | D1626: 0 | E1626: =R[-918]C -> 21 | F1626: =R[-918]C -> 30 | G1626: 1 | H1626: 5000 | I1626: 110003 | J1626: 1 | K1626: [{5,10},{6,15},{13,10},{14,5},{15,10},{16,5},{20,1},{27,10},{28,10}] | L1626: =R[-1]C -> [{5,1113},{6,1113},{13,18},{14,37},{15,18},{16,37},{20,3},{27,18},{28,18}] | M1626: =R[-1]C -> [{0,1,[1,30]},{1,2,[11,40]},{2,5,[21,50]},{5,10,[31,60]},{10,20,[41,60]},{30,20,[51,70]},{50,10,[61,80]},{70,5,[71,80]},{100,2,[81,90]},{150,1,[91,100]}]
A1627: 1624 | B1627: 2 | C1627: 2 | D1627: 0 | E1627: =R[-918]C -> 31 | F1627: =R[-918]C -> 40 | G1627: 1 | H1627: 5000 | I1627: 110003 | J1627: 1 | K1627: [{5,10},{6,15},{13,10},{14,5},{15,10},{16,5},{20,1},{27,10},{28,10}] | L1627: =R[-1]C -> [{5,1113},{6,1113},{13,18},{14,37},{15,18},{16,37},{20,3},{27,18},{28,18}] | M1627: =R[-1]C -> [{0,1,[1,30]},{1,2,[11,40]},{2,5,[21,50]},{5,10,[31,60]},{10,20,[41,60]},{30,20,[51,70]},{50,10,[61,80]},{70,5,[71,80]},{100,2,[81,90]},{150,1,[91,100]}]
A1628: 1625 | B1628: 2 | C1628: 2 | D1628: 0 | E1628: =R[-918]C -> 41 | F1628: =R[-918]C -> 50 | G1628: 1 | H1628: 5000 | I1628: 110003 | J1628: 1 | K1628: [{5,10},{6,15},{13,10},{14,5},{15,10},{16,5},{20,1},{27,10},{28,10}] | L1628: =R[-1]C -> [{5,1113},{6,1113},{13,18},{14,37},{15,18},{16,37},{20,3},{27,18},{28,18}] | M1628: =R[-1]C -> [{0,1,[1,30]},{1,2,[11,40]},{2,5,[21,50]},{5,10,[31,60]},{10,20,[41,60]},{30,20,[51,70]},{50,10,[61,80]},{70,5,[71,80]},{100,2,[81,90]},{150,1,[91,100]}]
A1629: 1626 | B1629: 2 | C1629: 2 | D1629: 0 | E1629: =R[-918]C -> 51 | F1629: =R[-918]C -> 60 | G1629: 1 | H1629: 5000 | I1629: 110003 | J1629: 1 | K1629: [{5,10},{6,15},{13,10},{14,5},{15,10},{16,5},{20,1},{27,10},{28,10}] | L1629: =R[-1]C -> [{5,1113},{6,1113},{13,18},{14,37},{15,18},{16,37},{20,3},{27,18},{28,18}] | M1629: =R[-1]C -> [{0,1,[1,30]},{1,2,[11,40]},{2,5,[21,50]},{5,10,[31,60]},{10,20,[41,60]},{30,20,[51,70]},{50,10,[61,80]},{70,5,[71,80]},{100,2,[81,90]},{150,1,[91,100]}]
A1630: 1627 | B1630: 2 | C1630: 2 | D1630: 0 | E1630: =R[-918]C -> 61 | F1630: =R[-918]C -> 70 | G1630: 1 | H1630: 5000 | I1630: 110003 | J1630: 1 | K1630: [{5,10},{6,15},{13,10},{14,5},{15,10},{16,5},{20,1},{27,10},{28,10}] | L1630: =R[-1]C -> [{5,1113},{6,1113},{13,18},{14,37},{15,18},{16,37},{20,3},{27,18},{28,18}] | M1630: =R[-1]C -> [{0,1,[1,30]},{1,2,[11,40]},{2,5,[21,50]},{5,10,[31,60]},{10,20,[41,60]},{30,20,[51,70]},{50,10,[61,80]},{70,5,[71,80]},{100,2,[81,90]},{150,1,[91,100]}]
A1631: 1628 | B1631: 2 | C1631: 2 | D1631: 0 | E1631: =R[-918]C -> 71 | F1631: =R[-918]C -> 80 | G1631: 1 | H1631: 5000 | I1631: 110003 | J1631: 1 | K1631: [{5,10},{6,15},{13,10},{14,5},{15,10},{16,5},{20,1},{27,10},{28,10}] | L1631: =R[-1]C -> [{5,1113},{6,1113},{13,18},{14,37},{15,18},{16,37},{20,3},{27,18},{28,18}] | M1631: =R[-1]C -> [{0,1,[1,30]},{1,2,[11,40]},{2,5,[21,50]},{5,10,[31,60]},{10,20,[41,60]},{30,20,[51,70]},{50,10,[61,80]},{70,5,[71,80]},{100,2,[81,90]},{150,1,[91,100]}]
A1632: 1629 | B1632: 2 | C1632: 2 | D1632: 0 | E1632: =R[-918]C -> 81 | F1632: =R[-918]C -> 90 | G1632: 1 | H1632: 5000 | I1632: 110003 | J1632: 1 | K1632: [{5,10},{6,15},{13,10},{14,5},{15,10},{16,5},{20,1},{27,10},{28,10}] | L1632: =R[-1]C -> [{5,1113},{6,1113},{13,18},{14,37},{15,18},{16,37},{20,3},{27,18},{28,18}] | M1632: =R[-1]C -> [{0,1,[1,30]},{1,2,[11,40]},{2,5,[21,50]},{5,10,[31,60]},{10,20,[41,60]},{30,20,[51,70]},{50,10,[61,80]},{70,5,[71,80]},{100,2,[81,90]},{150,1,[91,100]}]
A1633: 1630 | B1633: 3 | C1633: 2 | D1633: 0 | E1633: =R[-9]C -> 1 | F1633: =R[-9]C -> 10 | G1633: 2 | H1633: 10000 | I1633: 110003 | J1633: 2 | K1633: [{5,10},{6,15},{13,10},{14,5},{15,10},{16,5},{20,1},{27,10},{28,10}] | L1633: =R[-1]C -> [{5,1113},{6,1113},{13,18},{14,37},{15,18},{16,37},{20,3},{27,18},{28,18}] | M1633: =R[-1]C -> [{0,1,[1,30]},{1,2,[11,40]},{2,5,[21,50]},{5,10,[31,60]},{10,20,[41,60]},{30,20,[51,70]},{50,10,[61,80]},{70,5,[71,80]},{100,2,[81,90]},{150,1,[91,100]}]
A1634: 1631 | B1634: 3 | C1634: 2 | D1634: 0 | E1634: =R[-9]C -> 11 | F1634: =R[-9]C -> 20 | G1634: 2 | H1634: 10000 | I1634: 110003 | J1634: 2 | K1634: [{5,10},{6,15},{13,10},{14,5},{15,10},{16,5},{20,1},{27,10},{28,10}] | L1634: =R[-1]C -> [{5,1113},{6,1113},{13,18},{14,37},{15,18},{16,37},{20,3},{27,18},{28,18}] | M1634: =R[-1]C -> [{0,1,[1,30]},{1,2,[11,40]},{2,5,[21,50]},{5,10,[31,60]},{10,20,[41,60]},{30,20,[51,70]},{50,10,[61,80]},{70,5,[71,80]},{100,2,[81,90]},{150,1,[91,100]}]
A1635: 1632 | B1635: 3 | C1635: 2 | D1635: 0 | E1635: =R[-9]C -> 21 | F1635: =R[-9]C -> 30 | G1635: 2 | H1635: 10000 | I1635: 110003 | J1635: 2 | K1635: [{5,10},{6,15},{13,10},{14,5},{15,10},{16,5},{20,1},{27,10},{28,10}] | L1635: =R[-1]C -> [{5,1113},{6,1113},{13,18},{14,37},{15,18},{16,37},{20,3},{27,18},{28,18}] | M1635: =R[-1]C -> [{0,1,[1,30]},{1,2,[11,40]},{2,5,[21,50]},{5,10,[31,60]},{10,20,[41,60]},{30,20,[51,70]},{50,10,[61,80]},{70,5,[71,80]},{100,2,[81,90]},{150,1,[91,100]}]
A1636: 1633 | B1636: 3 | C1636: 2 | D1636: 0 | E1636: =R[-9]C -> 31 | F1636: =R[-9]C -> 40 | G1636: 2 | H1636: 10000 | I1636: 110003 | J1636: 2 | K1636: [{5,10},{6,15},{13,10},{14,5},{15,10},{16,5},{20,1},{27,10},{28,10}] | L1636: =R[-1]C -> [{5,1113},{6,1113},{13,18},{14,37},{15,18},{16,37},{20,3},{27,18},{28,18}] | M1636: =R[-1]C -> [{0,1,[1,30]},{1,2,[11,40]},{2,5,[21,50]},{5,10,[31,60]},{10,20,[41,60]},{30,20,[51,70]},{50,10,[61,80]},{70,5,[71,80]},{100,2,[81,90]},{150,1,[91,100]}]
A1637: 1634 | B1637: 3 | C1637: 2 | D1637: 0 | E1637: =R[-9]C -> 41 | F1637: =R[-9]C -> 50 | G1637: 2 | H1637: 10000 | I1637: 110003 | J1637: 2 | K1637: [{5,10},{6,15},{13,10},{14,5},{15,10},{16,5},{20,1},{27,10},{28,10}] | L1637: =R[-1]C -> [{5,1113},{6,1113},{13,18},{14,37},{15,18},{16,37},{20,3},{27,18},{28,18}] | M1637: =R[-1]C -> [{0,1,[1,30]},{1,2,[11,40]},{2,5,[21,50]},{5,10,[31,60]},{10,20,[41,60]},{30,20,[51,70]},{50,10,[61,80]},{70,5,[71,80]},{100,2,[81,90]},{150,1,[91,100]}]
A1638: 1635 | B1638: 3 | C1638: 2 | D1638: 0 | E1638: =R[-9]C -> 51 | F1638: =R[-9]C -> 60 | G1638: 2 | H1638: 10000 | I1638: 110003 | J1638: 2 | K1638: [{5,10},{6,15},{13,10},{14,5},{15,10},{16,5},{20,1},{27,10},{28,10}] | L1638: =R[-1]C -> [{5,1113},{6,1113},{13,18},{14,37},{15,18},{16,37},{20,3},{27,18},{28,18}] | M1638: =R[-1]C -> [{0,1,[1,30]},{1,2,[11,40]},{2,5,[21,50]},{5,10,[31,60]},{10,20,[41,60]},{30,20,[51,70]},{50,10,[61,80]},{70,5,[71,80]},{100,2,[81,90]},{150,1,[91,100]}]
A1639: 1636 | B1639: 3 | C1639: 2 | D1639: 0 | E1639: =R[-9]C -> 61 | F1639: =R[-9]C -> 70 | G1639: 2 | H1639: 10000 | I1639: 110003 | J1639: 2 | K1639: [{5,10},{6,15},{13,10},{14,5},{15,10},{16,5},{20,1},{27,10},{28,10}] | L1639: =R[-1]C -> [{5,1113},{6,1113},{13,18},{14,37},{15,18},{16,37},{20,3},{27,18},{28,18}] | M1639: =R[-1]C -> [{0,1,[1,30]},{1,2,[11,40]},{2,5,[21,50]},{5,10,[31,60]},{10,20,[41,60]},{30,20,[51,70]},{50,10,[61,80]},{70,5,[71,80]},{100,2,[81,90]},{150,1,[91,100]}]
A1640: 1637 | B1640: 3 | C1640: 2 | D1640: 0 | E1640: =R[-9]C -> 71 | F1640: =R[-9]C -> 80 | G1640: 2 | H1640: 10000 | I1640: 110003 | J1640: 2 | K1640: [{5,10},{6,15},{13,10},{14,5},{15,10},{16,5},{20,1},{27,10},{28,10}] | L1640: =R[-1]C -> [{5,1113},{6,1113},{13,18},{14,37},{15,18},{16,37},{20,3},{27,18},{28,18}] | M1640: =R[-1]C -> [{0,1,[1,30]},{1,2,[11,40]},{2,5,[21,50]},{5,10,[31,60]},{10,20,[41,60]},{30,20,[51,70]},{50,10,[61,80]},{70,5,[71,80]},{100,2,[81,90]},{150,1,[91,100]}]
A1641: 1638 | B1641: 3 | C1641: 2 | D1641: 0 | E1641: =R[-9]C -> 81 | F1641: =R[-9]C -> 90 | G1641: 2 | H1641: 10000 | I1641: 110003 | J1641: 2 | K1641: [{5,10},{6,15},{13,10},{14,5},{15,10},{16,5},{20,1},{27,10},{28,10}] | L1641: =R[-1]C -> [{5,1113},{6,1113},{13,18},{14,37},{15,18},{16,37},{20,3},{27,18},{28,18}] | M1641: =R[-1]C -> [{0,1,[1,30]},{1,2,[11,40]},{2,5,[21,50]},{5,10,[31,60]},{10,20,[41,60]},{30,20,[51,70]},{50,10,[61,80]},{70,5,[71,80]},{100,2,[81,90]},{150,1,[91,100]}]
A1642: 1639 | B1642: 4 | C1642: 2 | D1642: 0 | E1642: =R[-9]C -> 1 | F1642: =R[-9]C -> 10 | G1642: 3 | H1642: 15000 | I1642: 110003 | J1642: 3 | K1642: [{5,10},{6,15},{13,10},{14,5},{15,10},{16,5},{20,1},{27,10},{28,10}] | L1642: =R[-1]C -> [{5,1113},{6,1113},{13,18},{14,37},{15,18},{16,37},{20,3},{27,18},{28,18}] | M1642: =R[-1]C -> [{0,1,[1,30]},{1,2,[11,40]},{2,5,[21,50]},{5,10,[31,60]},{10,20,[41,60]},{30,20,[51,70]},{50,10,[61,80]},{70,5,[71,80]},{100,2,[81,90]},{150,1,[91,100]}]
A1643: 1640 | B1643: 4 | C1643: 2 | D1643: 0 | E1643: =R[-9]C -> 11 | F1643: =R[-9]C -> 20 | G1643: 3 | H1643: 15000 | I1643: 110003 | J1643: 3 | K1643: [{5,10},{6,15},{13,10},{14,5},{15,10},{16,5},{20,1},{27,10},{28,10}] | L1643: =R[-1]C -> [{5,1113},{6,1113},{13,18},{14,37},{15,18},{16,37},{20,3},{27,18},{28,18}] | M1643: =R[-1]C -> [{0,1,[1,30]},{1,2,[11,40]},{2,5,[21,50]},{5,10,[31,60]},{10,20,[41,60]},{30,20,[51,70]},{50,10,[61,80]},{70,5,[71,80]},{100,2,[81,90]},{150,1,[91,100]}]
A1644: 1641 | B1644: 4 | C1644: 2 | D1644: 0 | E1644: =R[-9]C -> 21 | F1644: =R[-9]C -> 30 | G1644: 3 | H1644: 15000 | I1644: 110003 | J1644: 3 | K1644: [{5,10},{6,15},{13,10},{14,5},{15,10},{16,5},{20,1},{27,10},{28,10}] | L1644: =R[-1]C -> [{5,1113},{6,1113},{13,18},{14,37},{15,18},{16,37},{20,3},{27,18},{28,18}] | M1644: =R[-1]C -> [{0,1,[1,30]},{1,2,[11,40]},{2,5,[21,50]},{5,10,[31,60]},{10,20,[41,60]},{30,20,[51,70]},{50,10,[61,80]},{70,5,[71,80]},{100,2,[81,90]},{150,1,[91,100]}]
A1645: 1642 | B1645: 4 | C1645: 2 | D1645: 0 | E1645: =R[-9]C -> 31 | F1645: =R[-9]C -> 40 | G1645: 3 | H1645: 15000 | I1645: 110003 | J1645: 3 | K1645: [{5,10},{6,15},{13,10},{14,5},{15,10},{16,5},{20,1},{27,10},{28,10}] | L1645: =R[-1]C -> [{5,1113},{6,1113},{13,18},{14,37},{15,18},{16,37},{20,3},{27,18},{28,18}] | M1645: =R[-1]C -> [{0,1,[1,30]},{1,2,[11,40]},{2,5,[21,50]},{5,10,[31,60]},{10,20,[41,60]},{30,20,[51,70]},{50,10,[61,80]},{70,5,[71,80]},{100,2,[81,90]},{150,1,[91,100]}]
A1646: 1643 | B1646: 4 | C1646: 2 | D1646: 0 | E1646: =R[-9]C -> 41 | F1646: =R[-9]C -> 50 | G1646: 3 | H1646: 15000 | I1646: 110003 | J1646: 3 | K1646: [{5,10},{6,15},{13,10},{14,5},{15,10},{16,5},{20,1},{27,10},{28,10}] | L1646: =R[-1]C -> [{5,1113},{6,1113},{13,18},{14,37},{15,18},{16,37},{20,3},{27,18},{28,18}] | M1646: =R[-1]C -> [{0,1,[1,30]},{1,2,[11,40]},{2,5,[21,50]},{5,10,[31,60]},{10,20,[41,60]},{30,20,[51,70]},{50,10,[61,80]},{70,5,[71,80]},{100,2,[81,90]},{150,1,[91,100]}]
A1647: 1644 | B1647: 4 | C1647: 2 | D1647: 0 | E1647: =R[-9]C -> 51 | F1647: =R[-9]C -> 60 | G1647: 3 | H1647: 15000 | I1647: 110003 | J1647: 3 | K1647: [{5,10},{6,15},{13,10},{14,5},{15,10},{16,5},{20,1},{27,10},{28,10}] | L1647: =R[-1]C -> [{5,1113},{6,1113},{13,18},{14,37},{15,18},{16,37},{20,3},{27,18},{28,18}] | M1647: =R[-1]C -> [{0,1,[1,30]},{1,2,[11,40]},{2,5,[21,50]},{5,10,[31,60]},{10,20,[41,60]},{30,20,[51,70]},{50,10,[61,80]},{70,5,[71,80]},{100,2,[81,90]},{150,1,[91,100]}]
A1648: 1645 | B1648: 4 | C1648: 2 | D1648: 0 | E1648: =R[-9]C -> 61 | F1648: =R[-9]C -> 70 | G1648: 3 | H1648: 15000 | I1648: 110003 | J1648: 3 | K1648: [{5,10},{6,15},{13,10},{14,5},{15,10},{16,5},{20,1},{27,10},{28,10}] | L1648: =R[-1]C -> [{5,1113},{6,1113},{13,18},{14,37},{15,18},{16,37},{20,3},{27,18},{28,18}] | M1648: =R[-1]C -> [{0,1,[1,30]},{1,2,[11,40]},{2,5,[21,50]},{5,10,[31,60]},{10,20,[41,60]},{30,20,[51,70]},{50,10,[61,80]},{70,5,[71,80]},{100,2,[81,90]},{150,1,[91,100]}]
A1649: 1646 | B1649: 4 | C1649: 2 | D1649: 0 | E1649: =R[-9]C -> 71 | F1649: =R[-9]C -> 80 | G1649: 3 | H1649: 15000 | I1649: 110003 | J1649: 3 | K1649: [{5,10},{6,15},{13,10},{14,5},{15,10},{16,5},{20,1},{27,10},{28,10}] | L1649: =R[-1]C -> [{5,1113},{6,1113},{13,18},{14,37},{15,18},{16,37},{20,3},{27,18},{28,18}] | M1649: =R[-1]C -> [{0,1,[1,30]},{1,2,[11,40]},{2,5,[21,50]},{5,10,[31,60]},{10,20,[41,60]},{30,20,[51,70]},{50,10,[61,80]},{70,5,[71,80]},{100,2,[81,90]},{150,1,[91,100]}]
A1650: 1647 | B1650: 4 | C1650: 2 | D1650: 0 | E1650: =R[-9]C -> 81 | F1650: =R[-9]C -> 90 | G1650: 3 | H1650: 15000 | I1650: 110003 | J1650: 3 | K1650: [{5,10},{6,15},{13,10},{14,5},{15,10},{16,5},{20,1},{27,10},{28,10}] | L1650: =R[-1]C -> [{5,1113},{6,1113},{13,18},{14,37},{15,18},{16,37},{20,3},{27,18},{28,18}] | M1650: =R[-1]C -> [{0,1,[1,30]},{1,2,[11,40]},{2,5,[21,50]},{5,10,[31,60]},{10,20,[41,60]},{30,20,[51,70]},{50,10,[61,80]},{70,5,[71,80]},{100,2,[81,90]},{150,1,[91,100]}]
A1651: 1648 | B1651: 5 | C1651: 2 | D1651: 0 | E1651: =R[-9]C -> 1 | F1651: =R[-9]C -> 10 | G1651: 4 | H1651: 20000 | I1651: 110003 | J1651: 4 | K1651: [{5,10},{6,15},{13,10},{14,5},{15,10},{16,5},{20,1},{27,10},{28,10}] | L1651: =R[-1]C -> [{5,1113},{6,1113},{13,18},{14,37},{15,18},{16,37},{20,3},{27,18},{28,18}] | M1651: =R[-1]C -> [{0,1,[1,30]},{1,2,[11,40]},{2,5,[21,50]},{5,10,[31,60]},{10,20,[41,60]},{30,20,[51,70]},{50,10,[61,80]},{70,5,[71,80]},{100,2,[81,90]},{150,1,[91,100]}]
A1652: 1649 | B1652: 5 | C1652: 2 | D1652: 0 | E1652: =R[-9]C -> 11 | F1652: =R[-9]C -> 20 | G1652: 4 | H1652: 20000 | I1652: 110003 | J1652: 4 | K1652: [{5,10},{6,15},{13,10},{14,5},{15,10},{16,5},{20,1},{27,10},{28,10}] | L1652: =R[-1]C -> [{5,1113},{6,1113},{13,18},{14,37},{15,18},{16,37},{20,3},{27,18},{28,18}] | M1652: =R[-1]C -> [{0,1,[1,30]},{1,2,[11,40]},{2,5,[21,50]},{5,10,[31,60]},{10,20,[41,60]},{30,20,[51,70]},{50,10,[61,80]},{70,5,[71,80]},{100,2,[81,90]},{150,1,[91,100]}]
A1653: 1650 | B1653: 5 | C1653: 2 | D1653: 0 | E1653: =R[-9]C -> 21 | F1653: =R[-9]C -> 30 | G1653: 4 | H1653: 20000 | I1653: 110003 | J1653: 4 | K1653: [{5,10},{6,15},{13,10},{14,5},{15,10},{16,5},{20,1},{27,10},{28,10}] | L1653: =R[-1]C -> [{5,1113},{6,1113},{13,18},{14,37},{15,18},{16,37},{20,3},{27,18},{28,18}] | M1653: =R[-1]C -> [{0,1,[1,30]},{1,2,[11,40]},{2,5,[21,50]},{5,10,[31,60]},{10,20,[41,60]},{30,20,[51,70]},{50,10,[61,80]},{70,5,[71,80]},{100,2,[81,90]},{150,1,[91,100]}]
A1654: 1651 | B1654: 5 | C1654: 2 | D1654: 0 | E1654: =R[-9]C -> 31 | F1654: =R[-9]C -> 40 | G1654: 4 | H1654: 20000 | I1654: 110003 | J1654: 4 | K1654: [{5,10},{6,15},{13,10},{14,5},{15,10},{16,5},{20,1},{27,10},{28,10}] | L1654: =R[-1]C -> [{5,1113},{6,1113},{13,18},{14,37},{15,18},{16,37},{20,3},{27,18},{28,18}] | M1654: =R[-1]C -> [{0,1,[1,30]},{1,2,[11,40]},{2,5,[21,50]},{5,10,[31,60]},{10,20,[41,60]},{30,20,[51,70]},{50,10,[61,80]},{70,5,[71,80]},{100,2,[81,90]},{150,1,[91,100]}]
A1655: 1652 | B1655: 5 | C1655: 2 | D1655: 0 | E1655: =R[-9]C -> 41 | F1655: =R[-9]C -> 50 | G1655: 4 | H1655: 20000 | I1655: 110003 | J1655: 4 | K1655: [{5,10},{6,15},{13,10},{14,5},{15,10},{16,5},{20,1},{27,10},{28,10}] | L1655: =R[-1]C -> [{5,1113},{6,1113},{13,18},{14,37},{15,18},{16,37},{20,3},{27,18},{28,18}] | M1655: =R[-1]C -> [{0,1,[1,30]},{1,2,[11,40]},{2,5,[21,50]},{5,10,[31,60]},{10,20,[41,60]},{30,20,[51,70]},{50,10,[61,80]},{70,5,[71,80]},{100,2,[81,90]},{150,1,[91,100]}]
A1656: 1653 | B1656: 5 | C1656: 2 | D1656: 0 | E1656: =R[-9]C -> 51 | F1656: =R[-9]C -> 60 | G1656: 4 | H1656: 20000 | I1656: 110003 | J1656: 4 | K1656: [{5,10},{6,15},{13,10},{14,5},{15,10},{16,5},{20,1},{27,10},{28,10}] | L1656: =R[-1]C -> [{5,1113},{6,1113},{13,18},{14,37},{15,18},{16,37},{20,3},{27,18},{28,18}] | M1656: =R[-1]C -> [{0,1,[1,30]},{1,2,[11,40]},{2,5,[21,50]},{5,10,[31,60]},{10,20,[41,60]},{30,20,[51,70]},{50,10,[61,80]},{70,5,[71,80]},{100,2,[81,90]},{150,1,[91,100]}]
A1657: 1654 | B1657: 5 | C1657: 2 | D1657: 0 | E1657: =R[-9]C -> 61 | F1657: =R[-9]C -> 70 | G1657: 4 | H1657: 20000 | I1657: 110003 | J1657: 4 | K1657: [{5,10},{6,15},{13,10},{14,5},{15,10},{16,5},{20,1},{27,10},{28,10}] | L1657: =R[-1]C -> [{5,1113},{6,1113},{13,18},{14,37},{15,18},{16,37},{20,3},{27,18},{28,18}] | M1657: =R[-1]C -> [{0,1,[1,30]},{1,2,[11,40]},{2,5,[21,50]},{5,10,[31,60]},{10,20,[41,60]},{30,20,[51,70]},{50,10,[61,80]},{70,5,[71,80]},{100,2,[81,90]},{150,1,[91,100]}]
A1658: 1655 | B1658: 5 | C1658: 2 | D1658: 0 | E1658: =R[-9]C -> 71 | F1658: =R[-9]C -> 80 | G1658: 4 | H1658: 20000 | I1658: 110003 | J1658: 4 | K1658: [{5,10},{6,15},{13,10},{14,5},{15,10},{16,5},{20,1},{27,10},{28,10}] | L1658: =R[-1]C -> [{5,1113},{6,1113},{13,18},{14,37},{15,18},{16,37},{20,3},{27,18},{28,18}] | M1658: =R[-1]C -> [{0,1,[1,30]},{1,2,[11,40]},{2,5,[21,50]},{5,10,[31,60]},{10,20,[41,60]},{30,20,[51,70]},{50,10,[61,80]},{70,5,[71,80]},{100,2,[81,90]},{150,1,[91,100]}]
A1659: 1656 | B1659: 5 | C1659: 2 | D1659: 0 | E1659: =R[-9]C -> 81 | F1659: =R[-9]C -> 90 | G1659: 4 | H1659: 20000 | I1659: 110003 | J1659: 4 | K1659: [{5,10},{6,15},{13,10},{14,5},{15,10},{16,5},{20,1},{27,10},{28,10}] | L1659: =R[-1]C -> [{5,1113},{6,1113},{13,18},{14,37},{15,18},{16,37},{20,3},{27,18},{28,18}] | M1659: =R[-1]C -> [{0,1,[1,30]},{1,2,[11,40]},{2,5,[21,50]},{5,10,[31,60]},{10,20,[41,60]},{30,20,[51,70]},{50,10,[61,80]},{70,5,[71,80]},{100,2,[81,90]},{150,1,[91,100]}]
A1660: 1657 | B1660: 6 | C1660: 2 | D1660: 0 | E1660: =R[-9]C -> 1 | F1660: =R[-9]C -> 10 | G1660: 5 | H1660: 20000 | I1660: 110003 | J1660: 5 | K1660: [{5,10},{6,15},{13,10},{14,5},{15,10},{16,5},{20,1},{27,10},{28,10}] | L1660: =R[-1]C -> [{5,1113},{6,1113},{13,18},{14,37},{15,18},{16,37},{20,3},{27,18},{28,18}] | M1660: =R[-1]C -> [{0,1,[1,30]},{1,2,[11,40]},{2,5,[21,50]},{5,10,[31,60]},{10,20,[41,60]},{30,20,[51,70]},{50,10,[61,80]},{70,5,[71,80]},{100,2,[81,90]},{150,1,[91,100]}]
A1661: 1658 | B1661: 6 | C1661: 2 | D1661: 0 | E1661: =R[-9]C -> 11 | F1661: =R[-9]C -> 20 | G1661: 5 | H1661: 20000 | I1661: 110003 | J1661: 5 | K1661: [{5,10},{6,15},{13,10},{14,5},{15,10},{16,5},{20,1},{27,10},{28,10}] | L1661: =R[-1]C -> [{5,1113},{6,1113},{13,18},{14,37},{15,18},{16,37},{20,3},{27,18},{28,18}] | M1661: =R[-1]C -> [{0,1,[1,30]},{1,2,[11,40]},{2,5,[21,50]},{5,10,[31,60]},{10,20,[41,60]},{30,20,[51,70]},{50,10,[61,80]},{70,5,[71,80]},{100,2,[81,90]},{150,1,[91,100]}]
A1662: 1659 | B1662: 6 | C1662: 2 | D1662: 0 | E1662: =R[-9]C -> 21 | F1662: =R[-9]C -> 30 | G1662: 5 | H1662: 20000 | I1662: 110003 | J1662: 5 | K1662: [{5,10},{6,15},{13,10},{14,5},{15,10},{16,5},{20,1},{27,10},{28,10}] | L1662: =R[-1]C -> [{5,1113},{6,1113},{13,18},{14,37},{15,18},{16,37},{20,3},{27,18},{28,18}] | M1662: =R[-1]C -> [{0,1,[1,30]},{1,2,[11,40]},{2,5,[21,50]},{5,10,[31,60]},{10,20,[41,60]},{30,20,[51,70]},{50,10,[61,80]},{70,5,[71,80]},{100,2,[81,90]},{150,1,[91,100]}]
A1663: 1660 | B1663: 6 | C1663: 2 | D1663: 0 | E1663: =R[-9]C -> 31 | F1663: =R[-9]C -> 40 | G1663: 5 | H1663: 20000 | I1663: 110003 | J1663: 5 | K1663: [{5,10},{6,15},{13,10},{14,5},{15,10},{16,5},{20,1},{27,10},{28,10}] | L1663: =R[-1]C -> [{5,1113},{6,1113},{13,18},{14,37},{15,18},{16,37},{20,3},{27,18},{28,18}] | M1663: =R[-1]C -> [{0,1,[1,30]},{1,2,[11,40]},{2,5,[21,50]},{5,10,[31,60]},{10,20,[41,60]},{30,20,[51,70]},{50,10,[61,80]},{70,5,[71,80]},{100,2,[81,90]},{150,1,[91,100]}]
A1664: 1661 | B1664: 6 | C1664: 2 | D1664: 0 | E1664: =R[-9]C -> 41 | F1664: =R[-9]C -> 50 | G1664: 5 | H1664: 20000 | I1664: 110003 | J1664: 5 | K1664: [{5,10},{6,15},{13,10},{14,5},{15,10},{16,5},{20,1},{27,10},{28,10}] | L1664: =R[-1]C -> [{5,1113},{6,1113},{13,18},{14,37},{15,18},{16,37},{20,3},{27,18},{28,18}] | M1664: =R[-1]C -> [{0,1,[1,30]},{1,2,[11,40]},{2,5,[21,50]},{5,10,[31,60]},{10,20,[41,60]},{30,20,[51,70]},{50,10,[61,80]},{70,5,[71,80]},{100,2,[81,90]},{150,1,[91,100]}]
A1665: 1662 | B1665: 6 | C1665: 2 | D1665: 0 | E1665: =R[-9]C -> 51 | F1665: =R[-9]C -> 60 | G1665: 5 | H1665: 20000 | I1665: 110003 | J1665: 5 | K1665: [{5,10},{6,15},{13,10},{14,5},{15,10},{16,5},{20,1},{27,10},{28,10}] | L1665: =R[-1]C -> [{5,1113},{6,1113},{13,18},{14,37},{15,18},{16,37},{20,3},{27,18},{28,18}] | M1665: =R[-1]C -> [{0,1,[1,30]},{1,2,[11,40]},{2,5,[21,50]},{5,10,[31,60]},{10,20,[41,60]},{30,20,[51,70]},{50,10,[61,80]},{70,5,[71,80]},{100,2,[81,90]},{150,1,[91,100]}]
A1666: 1663 | B1666: 6 | C1666: 2 | D1666: 0 | E1666: =R[-9]C -> 61 | F1666: =R[-9]C -> 70 | G1666: 5 | H1666: 20000 | I1666: 110003 | J1666: 5 | K1666: [{5,10},{6,15},{13,10},{14,5},{15,10},{16,5},{20,1},{27,10},{28,10}] | L1666: =R[-1]C -> [{5,1113},{6,1113},{13,18},{14,37},{15,18},{16,37},{20,3},{27,18},{28,18}] | M1666: =R[-1]C -> [{0,1,[1,30]},{1,2,[11,40]},{2,5,[21,50]},{5,10,[31,60]},{10,20,[41,60]},{30,20,[51,70]},{50,10,[61,80]},{70,5,[71,80]},{100,2,[81,90]},{150,1,[91,100]}]
A1667: 1664 | B1667: 6 | C1667: 2 | D1667: 0 | E1667: =R[-9]C -> 71 | F1667: =R[-9]C -> 80 | G1667: 5 | H1667: 20000 | I1667: 110003 | J1667: 5 | K1667: [{5,10},{6,15},{13,10},{14,5},{15,10},{16,5},{20,1},{27,10},{28,10}] | L1667: =R[-1]C -> [{5,1113},{6,1113},{13,18},{14,37},{15,18},{16,37},{20,3},{27,18},{28,18}] | M1667: =R[-1]C -> [{0,1,[1,30]},{1,2,[11,40]},{2,5,[21,50]},{5,10,[31,60]},{10,20,[41,60]},{30,20,[51,70]},{50,10,[61,80]},{70,5,[71,80]},{100,2,[81,90]},{150,1,[91,100]}]
A1668: 1665 | B1668: 6 | C1668: 2 | D1668: 0 | E1668: =R[-9]C -> 81 | F1668: =R[-9]C -> 90 | G1668: 5 | H1668: 20000 | I1668: 110003 | J1668: 5 | K1668: [{5,10},{6,15},{13,10},{14,5},{15,10},{16,5},{20,1},{27,10},{28,10}] | L1668: =R[-1]C -> [{5,1113},{6,1113},{13,18},{14,37},{15,18},{16,37},{20,3},{27,18},{28,18}] | M1668: =R[-1]C -> [{0,1,[1,30]},{1,2,[11,40]},{2,5,[21,50]},{5,10,[31,60]},{10,20,[41,60]},{30,20,[51,70]},{50,10,[61,80]},{70,5,[71,80]},{100,2,[81,90]},{150,1,[91,100]}]
A1669: 1666 | B1669: 2 | C1669: 3 | D1669: 0 | E1669: =R[-18]C -> 1 | F1669: =R[-18]C -> 10 | G1669: 1 | H1669: 5000 | I1669: 110003 | J1669: 1 | K1669: [{5,10},{6,15},{13,10},{14,5},{15,10},{16,5},{20,1},{27,10},{28,10}] | L1669: =R[-1]C -> [{5,1113},{6,1113},{13,18},{14,37},{15,18},{16,37},{20,3},{27,18},{28,18}] | M1669: =R[-1]C -> [{0,1,[1,30]},{1,2,[11,40]},{2,5,[21,50]},{5,10,[31,60]},{10,20,[41,60]},{30,20,[51,70]},{50,10,[61,80]},{70,5,[71,80]},{100,2,[81,90]},{150,1,[91,100]}]
A1670: 1667 | B1670: 2 | C1670: 3 | D1670: 0 | E1670: =R[-18]C -> 11 | F1670: =R[-18]C -> 20 | G1670: 1 | H1670: 5000 | I1670: 110003 | J1670: 1 | K1670: [{5,10},{6,15},{13,10},{14,5},{15,10},{16,5},{20,1},{27,10},{28,10}] | L1670: =R[-1]C -> [{5,1113},{6,1113},{13,18},{14,37},{15,18},{16,37},{20,3},{27,18},{28,18}] | M1670: =R[-1]C -> [{0,1,[1,30]},{1,2,[11,40]},{2,5,[21,50]},{5,10,[31,60]},{10,20,[41,60]},{30,20,[51,70]},{50,10,[61,80]},{70,5,[71,80]},{100,2,[81,90]},{150,1,[91,100]}]
A1671: 1668 | B1671: 2 | C1671: 3 | D1671: 0 | E1671: =R[-18]C -> 21 | F1671: =R[-18]C -> 30 | G1671: 1 | H1671: 5000 | I1671: 110003 | J1671: 1 | K1671: [{5,10},{6,15},{13,10},{14,5},{15,10},{16,5},{20,1},{27,10},{28,10}] | L1671: =R[-1]C -> [{5,1113},{6,1113},{13,18},{14,37},{15,18},{16,37},{20,3},{27,18},{28,18}] | M1671: =R[-1]C -> [{0,1,[1,30]},{1,2,[11,40]},{2,5,[21,50]},{5,10,[31,60]},{10,20,[41,60]},{30,20,[51,70]},{50,10,[61,80]},{70,5,[71,80]},{100,2,[81,90]},{150,1,[91,100]}]
A1672: 1669 | B1672: 2 | C1672: 3 | D1672: 0 | E1672: =R[-18]C -> 31 | F1672: =R[-18]C -> 40 | G1672: 1 | H1672: 5000 | I1672: 110003 | J1672: 1 | K1672: [{5,10},{6,15},{13,10},{14,5},{15,10},{16,5},{20,1},{27,10},{28,10}] | L1672: =R[-1]C -> [{5,1113},{6,1113},{13,18},{14,37},{15,18},{16,37},{20,3},{27,18},{28,18}] | M1672: =R[-1]C -> [{0,1,[1,30]},{1,2,[11,40]},{2,5,[21,50]},{5,10,[31,60]},{10,20,[41,60]},{30,20,[51,70]},{50,10,[61,80]},{70,5,[71,80]},{100,2,[81,90]},{150,1,[91,100]}]
A1673: 1670 | B1673: 2 | C1673: 3 | D1673: 0 | E1673: =R[-18]C -> 41 | F1673: =R[-18]C -> 50 | G1673: 1 | H1673: 5000 | I1673: 110003 | J1673: 1 | K1673: [{5,10},{6,15},{13,10},{14,5},{15,10},{16,5},{20,1},{27,10},{28,10}] | L1673: =R[-1]C -> [{5,1113},{6,1113},{13,18},{14,37},{15,18},{16,37},{20,3},{27,18},{28,18}] | M1673: =R[-1]C -> [{0,1,[1,30]},{1,2,[11,40]},{2,5,[21,50]},{5,10,[31,60]},{10,20,[41,60]},{30,20,[51,70]},{50,10,[61,80]},{70,5,[71,80]},{100,2,[81,90]},{150,1,[91,100]}]
A1674: 1671 | B1674: 2 | C1674: 3 | D1674: 0 | E1674: =R[-18]C -> 51 | F1674: =R[-18]C -> 60 | G1674: 1 | H1674: 5000 | I1674: 110003 | J1674: 1 | K1674: [{5,10},{6,15},{13,10},{14,5},{15,10},{16,5},{20,1},{27,10},{28,10}] | L1674: =R[-1]C -> [{5,1113},{6,1113},{13,18},{14,37},{15,18},{16,37},{20,3},{27,18},{28,18}] | M1674: =R[-1]C -> [{0,1,[1,30]},{1,2,[11,40]},{2,5,[21,50]},{5,10,[31,60]},{10,20,[41,60]},{30,20,[51,70]},{50,10,[61,80]},{70,5,[71,80]},{100,2,[81,90]},{150,1,[91,100]}]
A1675: 1672 | B1675: 2 | C1675: 3 | D1675: 0 | E1675: =R[-18]C -> 61 | F1675: =R[-18]C -> 70 | G1675: 1 | H1675: 5000 | I1675: 110003 | J1675: 1 | K1675: [{5,10},{6,15},{13,10},{14,5},{15,10},{16,5},{20,1},{27,10},{28,10}] | L1675: =R[-1]C -> [{5,1113},{6,1113},{13,18},{14,37},{15,18},{16,37},{20,3},{27,18},{28,18}] | M1675: =R[-1]C -> [{0,1,[1,30]},{1,2,[11,40]},{2,5,[21,50]},{5,10,[31,60]},{10,20,[41,60]},{30,20,[51,70]},{50,10,[61,80]},{70,5,[71,80]},{100,2,[81,90]},{150,1,[91,100]}]
A1676: 1673 | B1676: 2 | C1676: 3 | D1676: 0 | E1676: =R[-18]C -> 71 | F1676: =R[-18]C -> 80 | G1676: 1 | H1676: 5000 | I1676: 110003 | J1676: 1 | K1676: [{5,10},{6,15},{13,10},{14,5},{15,10},{16,5},{20,1},{27,10},{28,10}] | L1676: =R[-1]C -> [{5,1113},{6,1113},{13,18},{14,37},{15,18},{16,37},{20,3},{27,18},{28,18}] | M1676: =R[-1]C -> [{0,1,[1,30]},{1,2,[11,40]},{2,5,[21,50]},{5,10,[31,60]},{10,20,[41,60]},{30,20,[51,70]},{50,10,[61,80]},{70,5,[71,80]},{100,2,[81,90]},{150,1,[91,100]}]
A1677: 1674 | B1677: 2 | C1677: 3 | D1677: 0 | E1677: =R[-18]C -> 81 | F1677: =R[-18]C -> 90 | G1677: 1 | H1677: 5000 | I1677: 110003 | J1677: 1 | K1677: [{5,10},{6,15},{13,10},{14,5},{15,10},{16,5},{20,1},{27,10},{28,10}] | L1677: =R[-1]C -> [{5,1113},{6,1113},{13,18},{14,37},{15,18},{16,37},{20,3},{27,18},{28,18}] | M1677: =R[-1]C -> [{0,1,[1,30]},{1,2,[11,40]},{2,5,[21,50]},{5,10,[31,60]},{10,20,[41,60]},{30,20,[51,70]},{50,10,[61,80]},{70,5,[71,80]},{100,2,[81,90]},{150,1,[91,100]}]
A1678: 1675 | B1678: 3 | C1678: 3 | D1678: 0 | E1678: =R[-9]C -> 1 | F1678: =R[-9]C -> 10 | G1678: 2 | H1678: 10000 | I1678: 110003 | J1678: 2 | K1678: [{5,10},{6,15},{13,10},{14,5},{15,10},{16,5},{20,1},{27,10},{28,10}] | L1678: =R[-1]C -> [{5,1113},{6,1113},{13,18},{14,37},{15,18},{16,37},{20,3},{27,18},{28,18}] | M1678: =R[-1]C -> [{0,1,[1,30]},{1,2,[11,40]},{2,5,[21,50]},{5,10,[31,60]},{10,20,[41,60]},{30,20,[51,70]},{50,10,[61,80]},{70,5,[71,80]},{100,2,[81,90]},{150,1,[91,100]}]
A1679: 1676 | B1679: 3 | C1679: 3 | D1679: 0 | E1679: =R[-9]C -> 11 | F1679: =R[-9]C -> 20 | G1679: 2 | H1679: 10000 | I1679: 110003 | J1679: 2 | K1679: [{5,10},{6,15},{13,10},{14,5},{15,10},{16,5},{20,1},{27,10},{28,10}] | L1679: =R[-1]C -> [{5,1113},{6,1113},{13,18},{14,37},{15,18},{16,37},{20,3},{27,18},{28,18}] | M1679: =R[-1]C -> [{0,1,[1,30]},{1,2,[11,40]},{2,5,[21,50]},{5,10,[31,60]},{10,20,[41,60]},{30,20,[51,70]},{50,10,[61,80]},{70,5,[71,80]},{100,2,[81,90]},{150,1,[91,100]}]
A1680: 1677 | B1680: 3 | C1680: 3 | D1680: 0 | E1680: =R[-9]C -> 21 | F1680: =R[-9]C -> 30 | G1680: 2 | H1680: 10000 | I1680: 110003 | J1680: 2 | K1680: [{5,10},{6,15},{13,10},{14,5},{15,10},{16,5},{20,1},{27,10},{28,10}] | L1680: =R[-1]C -> [{5,1113},{6,1113},{13,18},{14,37},{15,18},{16,37},{20,3},{27,18},{28,18}] | M1680: =R[-1]C -> [{0,1,[1,30]},{1,2,[11,40]},{2,5,[21,50]},{5,10,[31,60]},{10,20,[41,60]},{30,20,[51,70]},{50,10,[61,80]},{70,5,[71,80]},{100,2,[81,90]},{150,1,[91,100]}]
A1681: 1678 | B1681: 3 | C1681: 3 | D1681: 0 | E1681: =R[-9]C -> 31 | F1681: =R[-9]C -> 40 | G1681: 2 | H1681: 10000 | I1681: 110003 | J1681: 2 | K1681: [{5,10},{6,15},{13,10},{14,5},{15,10},{16,5},{20,1},{27,10},{28,10}] | L1681: =R[-1]C -> [{5,1113},{6,1113},{13,18},{14,37},{15,18},{16,37},{20,3},{27,18},{28,18}] | M1681: =R[-1]C -> [{0,1,[1,30]},{1,2,[11,40]},{2,5,[21,50]},{5,10,[31,60]},{10,20,[41,60]},{30,20,[51,70]},{50,10,[61,80]},{70,5,[71,80]},{100,2,[81,90]},{150,1,[91,100]}]
A1682: 1679 | B1682: 3 | C1682: 3 | D1682: 0 | E1682: =R[-9]C -> 41 | F1682: =R[-9]C -> 50 | G1682: 2 | H1682: 10000 | I1682: 110003 | J1682: 2 | K1682: [{5,10},{6,15},{13,10},{14,5},{15,10},{16,5},{20,1},{27,10},{28,10}] | L1682: =R[-1]C -> [{5,1113},{6,1113},{13,18},{14,37},{15,18},{16,37},{20,3},{27,18},{28,18}] | M1682: =R[-1]C -> [{0,1,[1,30]},{1,2,[11,40]},{2,5,[21,50]},{5,10,[31,60]},{10,20,[41,60]},{30,20,[51,70]},{50,10,[61,80]},{70,5,[71,80]},{100,2,[81,90]},{150,1,[91,100]}]
A1683: 1680 | B1683: 3 | C1683: 3 | D1683: 0 | E1683: =R[-9]C -> 51 | F1683: =R[-9]C -> 60 | G1683: 2 | H1683: 10000 | I1683: 110003 | J1683: 2 | K1683: [{5,10},{6,15},{13,10},{14,5},{15,10},{16,5},{20,1},{27,10},{28,10}] | L1683: =R[-1]C -> [{5,1113},{6,1113},{13,18},{14,37},{15,18},{16,37},{20,3},{27,18},{28,18}] | M1683: =R[-1]C -> [{0,1,[1,30]},{1,2,[11,40]},{2,5,[21,50]},{5,10,[31,60]},{10,20,[41,60]},{30,20,[51,70]},{50,10,[61,80]},{70,5,[71,80]},{100,2,[81,90]},{150,1,[91,100]}]
A1684: 1681 | B1684: 3 | C1684: 3 | D1684: 0 | E1684: =R[-9]C -> 61 | F1684: =R[-9]C -> 70 | G1684: 2 | H1684: 10000 | I1684: 110003 | J1684: 2 | K1684: [{5,10},{6,15},{13,10},{14,5},{15,10},{16,5},{20,1},{27,10},{28,10}] | L1684: =R[-1]C -> [{5,1113},{6,1113},{13,18},{14,37},{15,18},{16,37},{20,3},{27,18},{28,18}] | M1684: =R[-1]C -> [{0,1,[1,30]},{1,2,[11,40]},{2,5,[21,50]},{5,10,[31,60]},{10,20,[41,60]},{30,20,[51,70]},{50,10,[61,80]},{70,5,[71,80]},{100,2,[81,90]},{150,1,[91,100]}]
A1685: 1682 | B1685: 3 | C1685: 3 | D1685: 0 | E1685: =R[-9]C -> 71 | F1685: =R[-9]C -> 80 | G1685: 2 | H1685: 10000 | I1685: 110003 | J1685: 2 | K1685: [{5,10},{6,15},{13,10},{14,5},{15,10},{16,5},{20,1},{27,10},{28,10}] | L1685: =R[-1]C -> [{5,1113},{6,1113},{13,18},{14,37},{15,18},{16,37},{20,3},{27,18},{28,18}] | M1685: =R[-1]C -> [{0,1,[1,30]},{1,2,[11,40]},{2,5,[21,50]},{5,10,[31,60]},{10,20,[41,60]},{30,20,[51,70]},{50,10,[61,80]},{70,5,[71,80]},{100,2,[81,90]},{150,1,[91,100]}]
A1686: 1683 | B1686: 3 | C1686: 3 | D1686: 0 | E1686: =R[-9]C -> 81 | F1686: =R[-9]C -> 90 | G1686: 2 | H1686: 10000 | I1686: 110003 | J1686: 2 | K1686: [{5,10},{6,15},{13,10},{14,5},{15,10},{16,5},{20,1},{27,10},{28,10}] | L1686: =R[-1]C -> [{5,1113},{6,1113},{13,18},{14,37},{15,18},{16,37},{20,3},{27,18},{28,18}] | M1686: =R[-1]C -> [{0,1,[1,30]},{1,2,[11,40]},{2,5,[21,50]},{5,10,[31,60]},{10,20,[41,60]},{30,20,[51,70]},{50,10,[61,80]},{70,5,[71,80]},{100,2,[81,90]},{150,1,[91,100]}]
A1687: 1684 | B1687: 4 | C1687: 3 | D1687: 0 | E1687: =R[-9]C -> 1 | F1687: =R[-9]C -> 10 | G1687: 3 | H1687: 15000 | I1687: 110003 | J1687: 3 | K1687: [{5,10},{6,15},{13,10},{14,5},{15,10},{16,5},{20,1},{27,10},{28,10}] | L1687: =R[-1]C -> [{5,1113},{6,1113},{13,18},{14,37},{15,18},{16,37},{20,3},{27,18},{28,18}] | M1687: =R[-1]C -> [{0,1,[1,30]},{1,2,[11,40]},{2,5,[21,50]},{5,10,[31,60]},{10,20,[41,60]},{30,20,[51,70]},{50,10,[61,80]},{70,5,[71,80]},{100,2,[81,90]},{150,1,[91,100]}]
A1688: 1685 | B1688: 4 | C1688: 3 | D1688: 0 | E1688: =R[-9]C -> 11 | F1688: =R[-9]C -> 20 | G1688: 3 | H1688: 15000 | I1688: 110003 | J1688: 3 | K1688: [{5,10},{6,15},{13,10},{14,5},{15,10},{16,5},{20,1},{27,10},{28,10}] | L1688: =R[-1]C -> [{5,1113},{6,1113},{13,18},{14,37},{15,18},{16,37},{20,3},{27,18},{28,18}] | M1688: =R[-1]C -> [{0,1,[1,30]},{1,2,[11,40]},{2,5,[21,50]},{5,10,[31,60]},{10,20,[41,60]},{30,20,[51,70]},{50,10,[61,80]},{70,5,[71,80]},{100,2,[81,90]},{150,1,[91,100]}]
A1689: 1686 | B1689: 4 | C1689: 3 | D1689: 0 | E1689: =R[-9]C -> 21 | F1689: =R[-9]C -> 30 | G1689: 3 | H1689: 15000 | I1689: 110003 | J1689: 3 | K1689: [{5,10},{6,15},{13,10},{14,5},{15,10},{16,5},{20,1},{27,10},{28,10}] | L1689: =R[-1]C -> [{5,1113},{6,1113},{13,18},{14,37},{15,18},{16,37},{20,3},{27,18},{28,18}] | M1689: =R[-1]C -> [{0,1,[1,30]},{1,2,[11,40]},{2,5,[21,50]},{5,10,[31,60]},{10,20,[41,60]},{30,20,[51,70]},{50,10,[61,80]},{70,5,[71,80]},{100,2,[81,90]},{150,1,[91,100]}]
A1690: 1687 | B1690: 4 | C1690: 3 | D1690: 0 | E1690: =R[-9]C -> 31 | F1690: =R[-9]C -> 40 | G1690: 3 | H1690: 15000 | I1690: 110003 | J1690: 3 | K1690: [{5,10},{6,15},{13,10},{14,5},{15,10},{16,5},{20,1},{27,10},{28,10}] | L1690: =R[-1]C -> [{5,1113},{6,1113},{13,18},{14,37},{15,18},{16,37},{20,3},{27,18},{28,18}] | M1690: =R[-1]C -> [{0,1,[1,30]},{1,2,[11,40]},{2,5,[21,50]},{5,10,[31,60]},{10,20,[41,60]},{30,20,[51,70]},{50,10,[61,80]},{70,5,[71,80]},{100,2,[81,90]},{150,1,[91,100]}]
A1691: 1688 | B1691: 4 | C1691: 3 | D1691: 0 | E1691: =R[-9]C -> 41 | F1691: =R[-9]C -> 50 | G1691: 3 | H1691: 15000 | I1691: 110003 | J1691: 3 | K1691: [{5,10},{6,15},{13,10},{14,5},{15,10},{16,5},{20,1},{27,10},{28,10}] | L1691: =R[-1]C -> [{5,1113},{6,1113},{13,18},{14,37},{15,18},{16,37},{20,3},{27,18},{28,18}] | M1691: =R[-1]C -> [{0,1,[1,30]},{1,2,[11,40]},{2,5,[21,50]},{5,10,[31,60]},{10,20,[41,60]},{30,20,[51,70]},{50,10,[61,80]},{70,5,[71,80]},{100,2,[81,90]},{150,1,[91,100]}]
A1692: 1689 | B1692: 4 | C1692: 3 | D1692: 0 | E1692: =R[-9]C -> 51 | F1692: =R[-9]C -> 60 | G1692: 3 | H1692: 15000 | I1692: 110003 | J1692: 3 | K1692: [{5,10},{6,15},{13,10},{14,5},{15,10},{16,5},{20,1},{27,10},{28,10}] | L1692: =R[-1]C -> [{5,1113},{6,1113},{13,18},{14,37},{15,18},{16,37},{20,3},{27,18},{28,18}] | M1692: =R[-1]C -> [{0,1,[1,30]},{1,2,[11,40]},{2,5,[21,50]},{5,10,[31,60]},{10,20,[41,60]},{30,20,[51,70]},{50,10,[61,80]},{70,5,[71,80]},{100,2,[81,90]},{150,1,[91,100]}]
A1693: 1690 | B1693: 4 | C1693: 3 | D1693: 0 | E1693: =R[-9]C -> 61 | F1693: =R[-9]C -> 70 | G1693: 3 | H1693: 15000 | I1693: 110003 | J1693: 3 | K1693: [{5,10},{6,15},{13,10},{14,5},{15,10},{16,5},{20,1},{27,10},{28,10}] | L1693: =R[-1]C -> [{5,1113},{6,1113},{13,18},{14,37},{15,18},{16,37},{20,3},{27,18},{28,18}] | M1693: =R[-1]C -> [{0,1,[1,30]},{1,2,[11,40]},{2,5,[21,50]},{5,10,[31,60]},{10,20,[41,60]},{30,20,[51,70]},{50,10,[61,80]},{70,5,[71,80]},{100,2,[81,90]},{150,1,[91,100]}]
A1694: 1691 | B1694: 4 | C1694: 3 | D1694: 0 | E1694: =R[-9]C -> 71 | F1694: =R[-9]C -> 80 | G1694: 3 | H1694: 15000 | I1694: 110003 | J1694: 3 | K1694: [{5,10},{6,15},{13,10},{14,5},{15,10},{16,5},{20,1},{27,10},{28,10}] | L1694: =R[-1]C -> [{5,1113},{6,1113},{13,18},{14,37},{15,18},{16,37},{20,3},{27,18},{28,18}] | M1694: =R[-1]C -> [{0,1,[1,30]},{1,2,[11,40]},{2,5,[21,50]},{5,10,[31,60]},{10,20,[41,60]},{30,20,[51,70]},{50,10,[61,80]},{70,5,[71,80]},{100,2,[81,90]},{150,1,[91,100]}]
A1695: 1692 | B1695: 4 | C1695: 3 | D1695: 0 | E1695: =R[-9]C -> 81 | F1695: =R[-9]C -> 90 | G1695: 3 | H1695: 15000 | I1695: 110003 | J1695: 3 | K1695: [{5,10},{6,15},{13,10},{14,5},{15,10},{16,5},{20,1},{27,10},{28,10}] | L1695: =R[-1]C -> [{5,1113},{6,1113},{13,18},{14,37},{15,18},{16,37},{20,3},{27,18},{28,18}] | M1695: =R[-1]C -> [{0,1,[1,30]},{1,2,[11,40]},{2,5,[21,50]},{5,10,[31,60]},{10,20,[41,60]},{30,20,[51,70]},{50,10,[61,80]},{70,5,[71,80]},{100,2,[81,90]},{150,1,[91,100]}]
A1696: 1693 | B1696: 5 | C1696: 3 | D1696: 0 | E1696: =R[-9]C -> 1 | F1696: =R[-9]C -> 10 | G1696: 4 | H1696: 20000 | I1696: 110003 | J1696: 4 | K1696: [{5,10},{6,15},{13,10},{14,5},{15,10},{16,5},{20,1},{27,10},{28,10}] | L1696: =R[-1]C -> [{5,1113},{6,1113},{13,18},{14,37},{15,18},{16,37},{20,3},{27,18},{28,18}] | M1696: =R[-1]C -> [{0,1,[1,30]},{1,2,[11,40]},{2,5,[21,50]},{5,10,[31,60]},{10,20,[41,60]},{30,20,[51,70]},{50,10,[61,80]},{70,5,[71,80]},{100,2,[81,90]},{150,1,[91,100]}]
A1697: 1694 | B1697: 5 | C1697: 3 | D1697: 0 | E1697: =R[-9]C -> 11 | F1697: =R[-9]C -> 20 | G1697: 4 | H1697: 20000 | I1697: 110003 | J1697: 4 | K1697: [{5,10},{6,15},{13,10},{14,5},{15,10},{16,5},{20,1},{27,10},{28,10}] | L1697: =R[-1]C -> [{5,1113},{6,1113},{13,18},{14,37},{15,18},{16,37},{20,3},{27,18},{28,18}] | M1697: =R[-1]C -> [{0,1,[1,30]},{1,2,[11,40]},{2,5,[21,50]},{5,10,[31,60]},{10,20,[41,60]},{30,20,[51,70]},{50,10,[61,80]},{70,5,[71,80]},{100,2,[81,90]},{150,1,[91,100]}]
A1698: 1695 | B1698: 5 | C1698: 3 | D1698: 0 | E1698: =R[-9]C -> 21 | F1698: =R[-9]C -> 30 | G1698: 4 | H1698: 20000 | I1698: 110003 | J1698: 4 | K1698: [{5,10},{6,15},{13,10},{14,5},{15,10},{16,5},{20,1},{27,10},{28,10}] | L1698: =R[-1]C -> [{5,1113},{6,1113},{13,18},{14,37},{15,18},{16,37},{20,3},{27,18},{28,18}] | M1698: =R[-1]C -> [{0,1,[1,30]},{1,2,[11,40]},{2,5,[21,50]},{5,10,[31,60]},{10,20,[41,60]},{30,20,[51,70]},{50,10,[61,80]},{70,5,[71,80]},{100,2,[81,90]},{150,1,[91,100]}]
A1699: 1696 | B1699: 5 | C1699: 3 | D1699: 0 | E1699: =R[-9]C -> 31 | F1699: =R[-9]C -> 40 | G1699: 4 | H1699: 20000 | I1699: 110003 | J1699: 4 | K1699: [{5,10},{6,15},{13,10},{14,5},{15,10},{16,5},{20,1},{27,10},{28,10}] | L1699: =R[-1]C -> [{5,1113},{6,1113},{13,18},{14,37},{15,18},{16,37},{20,3},{27,18},{28,18}] | M1699: =R[-1]C -> [{0,1,[1,30]},{1,2,[11,40]},{2,5,[21,50]},{5,10,[31,60]},{10,20,[41,60]},{30,20,[51,70]},{50,10,[61,80]},{70,5,[71,80]},{100,2,[81,90]},{150,1,[91,100]}]
A1700: 1697 | B1700: 5 | C1700: 3 | D1700: 0 | E1700: =R[-9]C -> 41 | F1700: =R[-9]C -> 50 | G1700: 4 | H1700: 20000 | I1700: 110003 | J1700: 4 | K1700: [{5,10},{6,15},{13,10},{14,5},{15,10},{16,5},{20,1},{27,10},{28,10}] | L1700: =R[-1]C -> [{5,1113},{6,1113},{13,18},{14,37},{15,18},{16,37},{20,3},{27,18},{28,18}] | M1700: =R[-1]C -> [{0,1,[1,30]},{1,2,[11,40]},{2,5,[21,50]},{5,10,[31,60]},{10,20,[41,60]},{30,20,[51,70]},{50,10,[61,80]},{70,5,[71,80]},{100,2,[81,90]},{150,1,[91,100]}]
A1701: 1698 | B1701: 5 | C1701: 3 | D1701: 0 | E1701: =R[-9]C -> 51 | F1701: =R[-9]C -> 60 | G1701: 4 | H1701: 20000 | I1701: 110003 | J1701: 4 | K1701: [{5,10},{6,15},{13,10},{14,5},{15,10},{16,5},{20,1},{27,10},{28,10}] | L1701: =R[-1]C -> [{5,1113},{6,1113},{13,18},{14,37},{15,18},{16,37},{20,3},{27,18},{28,18}] | M1701: =R[-1]C -> [{0,1,[1,30]},{1,2,[11,40]},{2,5,[21,50]},{5,10,[31,60]},{10,20,[41,60]},{30,20,[51,70]},{50,10,[61,80]},{70,5,[71,80]},{100,2,[81,90]},{150,1,[91,100]}]
A1702: 1699 | B1702: 5 | C1702: 3 | D1702: 0 | E1702: =R[-9]C -> 61 | F1702: =R[-9]C -> 70 | G1702: 4 | H1702: 20000 | I1702: 110003 | J1702: 4 | K1702: [{5,10},{6,15},{13,10},{14,5},{15,10},{16,5},{20,1},{27,10},{28,10}] | L1702: =R[-1]C -> [{5,1113},{6,1113},{13,18},{14,37},{15,18},{16,37},{20,3},{27,18},{28,18}] | M1702: =R[-1]C -> [{0,1,[1,30]},{1,2,[11,40]},{2,5,[21,50]},{5,10,[31,60]},{10,20,[41,60]},{30,20,[51,70]},{50,10,[61,80]},{70,5,[71,80]},{100,2,[81,90]},{150,1,[91,100]}]
A1703: 1700 | B1703: 5 | C1703: 3 | D1703: 0 | E1703: =R[-9]C -> 71 | F1703: =R[-9]C -> 80 | G1703: 4 | H1703: 20000 | I1703: 110003 | J1703: 4 | K1703: [{5,10},{6,15},{13,10},{14,5},{15,10},{16,5},{20,1},{27,10},{28,10}] | L1703: =R[-1]C -> [{5,1113},{6,1113},{13,18},{14,37},{15,18},{16,37},{20,3},{27,18},{28,18}] | M1703: =R[-1]C -> [{0,1,[1,30]},{1,2,[11,40]},{2,5,[21,50]},{5,10,[31,60]},{10,20,[41,60]},{30,20,[51,70]},{50,10,[61,80]},{70,5,[71,80]},{100,2,[81,90]},{150,1,[91,100]}]
A1704: 1701 | B1704: 5 | C1704: 3 | D1704: 0 | E1704: =R[-9]C -> 81 | F1704: =R[-9]C -> 90 | G1704: 4 | H1704: 20000 | I1704: 110003 | J1704: 4 | K1704: [{5,10},{6,15},{13,10},{14,5},{15,10},{16,5},{20,1},{27,10},{28,10}] | L1704: =R[-1]C -> [{5,1113},{6,1113},{13,18},{14,37},{15,18},{16,37},{20,3},{27,18},{28,18}] | M1704: =R[-1]C -> [{0,1,[1,30]},{1,2,[11,40]},{2,5,[21,50]},{5,10,[31,60]},{10,20,[41,60]},{30,20,[51,70]},{50,10,[61,80]},{70,5,[71,80]},{100,2,[81,90]},{150,1,[91,100]}]
A1705: 1702 | B1705: 6 | C1705: 3 | D1705: 0 | E1705: =R[-9]C -> 1 | F1705: =R[-9]C -> 10 | G1705: 5 | H1705: 20000 | I1705: 110003 | J1705: 5 | K1705: [{5,10},{6,15},{13,10},{14,5},{15,10},{16,5},{20,1},{27,10},{28,10}] | L1705: =R[-1]C -> [{5,1113},{6,1113},{13,18},{14,37},{15,18},{16,37},{20,3},{27,18},{28,18}] | M1705: =R[-1]C -> [{0,1,[1,30]},{1,2,[11,40]},{2,5,[21,50]},{5,10,[31,60]},{10,20,[41,60]},{30,20,[51,70]},{50,10,[61,80]},{70,5,[71,80]},{100,2,[81,90]},{150,1,[91,100]}]
A1706: 1703 | B1706: 6 | C1706: 3 | D1706: 0 | E1706: =R[-9]C -> 11 | F1706: =R[-9]C -> 20 | G1706: 5 | H1706: 20000 | I1706: 110003 | J1706: 5 | K1706: [{5,10},{6,15},{13,10},{14,5},{15,10},{16,5},{20,1},{27,10},{28,10}] | L1706: =R[-1]C -> [{5,1113},{6,1113},{13,18},{14,37},{15,18},{16,37},{20,3},{27,18},{28,18}] | M1706: =R[-1]C -> [{0,1,[1,30]},{1,2,[11,40]},{2,5,[21,50]},{5,10,[31,60]},{10,20,[41,60]},{30,20,[51,70]},{50,10,[61,80]},{70,5,[71,80]},{100,2,[81,90]},{150,1,[91,100]}]
A1707: 1704 | B1707: 6 | C1707: 3 | D1707: 0 | E1707: =R[-9]C -> 21 | F1707: =R[-9]C -> 30 | G1707: 5 | H1707: 20000 | I1707: 110003 | J1707: 5 | K1707: [{5,10},{6,15},{13,10},{14,5},{15,10},{16,5},{20,1},{27,10},{28,10}] | L1707: =R[-1]C -> [{5,1113},{6,1113},{13,18},{14,37},{15,18},{16,37},{20,3},{27,18},{28,18}] | M1707: =R[-1]C -> [{0,1,[1,30]},{1,2,[11,40]},{2,5,[21,50]},{5,10,[31,60]},{10,20,[41,60]},{30,20,[51,70]},{50,10,[61,80]},{70,5,[71,80]},{100,2,[81,90]},{150,1,[91,100]}]
A1708: 1705 | B1708: 6 | C1708: 3 | D1708: 0 | E1708: =R[-9]C -> 31 | F1708: =R[-9]C -> 40 | G1708: 5 | H1708: 20000 | I1708: 110003 | J1708: 5 | K1708: [{5,10},{6,15},{13,10},{14,5},{15,10},{16,5},{20,1},{27,10},{28,10}] | L1708: =R[-1]C -> [{5,1113},{6,1113},{13,18},{14,37},{15,18},{16,37},{20,3},{27,18},{28,18}] | M1708: =R[-1]C -> [{0,1,[1,30]},{1,2,[11,40]},{2,5,[21,50]},{5,10,[31,60]},{10,20,[41,60]},{30,20,[51,70]},{50,10,[61,80]},{70,5,[71,80]},{100,2,[81,90]},{150,1,[91,100]}]
A1709: 1706 | B1709: 6 | C1709: 3 | D1709: 0 | E1709: =R[-9]C -> 41 | F1709: =R[-9]C -> 50 | G1709: 5 | H1709: 20000 | I1709: 110003 | J1709: 5 | K1709: [{5,10},{6,15},{13,10},{14,5},{15,10},{16,5},{20,1},{27,10},{28,10}] | L1709: =R[-1]C -> [{5,1113},{6,1113},{13,18},{14,37},{15,18},{16,37},{20,3},{27,18},{28,18}] | M1709: =R[-1]C -> [{0,1,[1,30]},{1,2,[11,40]},{2,5,[21,50]},{5,10,[31,60]},{10,20,[41,60]},{30,20,[51,70]},{50,10,[61,80]},{70,5,[71,80]},{100,2,[81,90]},{150,1,[91,100]}]
A1710: 1707 | B1710: 6 | C1710: 3 | D1710: 0 | E1710: =R[-9]C -> 51 | F1710: =R[-9]C -> 60 | G1710: 5 | H1710: 20000 | I1710: 110003 | J1710: 5 | K1710: [{5,10},{6,15},{13,10},{14,5},{15,10},{16,5},{20,1},{27,10},{28,10}] | L1710: =R[-1]C -> [{5,1113},{6,1113},{13,18},{14,37},{15,18},{16,37},{20,3},{27,18},{28,18}] | M1710: =R[-1]C -> [{0,1,[1,30]},{1,2,[11,40]},{2,5,[21,50]},{5,10,[31,60]},{10,20,[41,60]},{30,20,[51,70]},{50,10,[61,80]},{70,5,[71,80]},{100,2,[81,90]},{150,1,[91,100]}]
A1711: 1708 | B1711: 6 | C1711: 3 | D1711: 0 | E1711: =R[-9]C -> 61 | F1711: =R[-9]C -> 70 | G1711: 5 | H1711: 20000 | I1711: 110003 | J1711: 5 | K1711: [{5,10},{6,15},{13,10},{14,5},{15,10},{16,5},{20,1},{27,10},{28,10}] | L1711: =R[-1]C -> [{5,1113},{6,1113},{13,18},{14,37},{15,18},{16,37},{20,3},{27,18},{28,18}] | M1711: =R[-1]C -> [{0,1,[1,30]},{1,2,[11,40]},{2,5,[21,50]},{5,10,[31,60]},{10,20,[41,60]},{30,20,[51,70]},{50,10,[61,80]},{70,5,[71,80]},{100,2,[81,90]},{150,1,[91,100]}]
A1712: 1709 | B1712: 6 | C1712: 3 | D1712: 0 | E1712: =R[-9]C -> 71 | F1712: =R[-9]C -> 80 | G1712: 5 | H1712: 20000 | I1712: 110003 | J1712: 5 | K1712: [{5,10},{6,15},{13,10},{14,5},{15,10},{16,5},{20,1},{27,10},{28,10}] | L1712: =R[-1]C -> [{5,1113},{6,1113},{13,18},{14,37},{15,18},{16,37},{20,3},{27,18},{28,18}] | M1712: =R[-1]C -> [{0,1,[1,30]},{1,2,[11,40]},{2,5,[21,50]},{5,10,[31,60]},{10,20,[41,60]},{30,20,[51,70]},{50,10,[61,80]},{70,5,[71,80]},{100,2,[81,90]},{150,1,[91,100]}]
A1713: 1710 | B1713: 6 | C1713: 3 | D1713: 0 | E1713: =R[-9]C -> 81 | F1713: =R[-9]C -> 90 | G1713: 5 | H1713: 20000 | I1713: 110003 | J1713: 5 | K1713: [{5,10},{6,15},{13,10},{14,5},{15,10},{16,5},{20,1},{27,10},{28,10}] | L1713: =R[-1]C -> [{5,1113},{6,1113},{13,18},{14,37},{15,18},{16,37},{20,3},{27,18},{28,18}] | M1713: =R[-1]C -> [{0,1,[1,30]},{1,2,[11,40]},{2,5,[21,50]},{5,10,[31,60]},{10,20,[41,60]},{30,20,[51,70]},{50,10,[61,80]},{70,5,[71,80]},{100,2,[81,90]},{150,1,[91,100]}]
A1714: 1711 | B1714: 2 | C1714: 8 | D1714: 0 | E1714: =R[-18]C -> 1 | F1714: =R[-18]C -> 10 | G1714: 1 | H1714: 5000 | I1714: 110003 | J1714: 1 | K1714: [{5,10},{6,15},{13,10},{14,5},{15,10},{16,5},{20,1},{27,10},{28,10}] | L1714: =R[-1]C -> [{5,1113},{6,1113},{13,18},{14,37},{15,18},{16,37},{20,3},{27,18},{28,18}] | M1714: =R[-1]C -> [{0,1,[1,30]},{1,2,[11,40]},{2,5,[21,50]},{5,10,[31,60]},{10,20,[41,60]},{30,20,[51,70]},{50,10,[61,80]},{70,5,[71,80]},{100,2,[81,90]},{150,1,[91,100]}]
A1715: 1712 | B1715: 2 | C1715: 8 | D1715: 0 | E1715: =R[-18]C -> 11 | F1715: =R[-18]C -> 20 | G1715: 1 | H1715: 5000 | I1715: 110003 | J1715: 1 | K1715: [{5,10},{6,15},{13,10},{14,5},{15,10},{16,5},{20,1},{27,10},{28,10}] | L1715: =R[-1]C -> [{5,1113},{6,1113},{13,18},{14,37},{15,18},{16,37},{20,3},{27,18},{28,18}] | M1715: =R[-1]C -> [{0,1,[1,30]},{1,2,[11,40]},{2,5,[21,50]},{5,10,[31,60]},{10,20,[41,60]},{30,20,[51,70]},{50,10,[61,80]},{70,5,[71,80]},{100,2,[81,90]},{150,1,[91,100]}]
A1716: 1713 | B1716: 2 | C1716: 8 | D1716: 0 | E1716: =R[-18]C -> 21 | F1716: =R[-18]C -> 30 | G1716: 1 | H1716: 5000 | I1716: 110003 | J1716: 1 | K1716: [{5,10},{6,15},{13,10},{14,5},{15,10},{16,5},{20,1},{27,10},{28,10}] | L1716: =R[-1]C -> [{5,1113},{6,1113},{13,18},{14,37},{15,18},{16,37},{20,3},{27,18},{28,18}] | M1716: =R[-1]C -> [{0,1,[1,30]},{1,2,[11,40]},{2,5,[21,50]},{5,10,[31,60]},{10,20,[41,60]},{30,20,[51,70]},{50,10,[61,80]},{70,5,[71,80]},{100,2,[81,90]},{150,1,[91,100]}]
A1717: 1714 | B1717: 2 | C1717: 8 | D1717: 0 | E1717: =R[-18]C -> 31 | F1717: =R[-18]C -> 40 | G1717: 1 | H1717: 5000 | I1717: 110003 | J1717: 1 | K1717: [{5,10},{6,15},{13,10},{14,5},{15,10},{16,5},{20,1},{27,10},{28,10}] | L1717: =R[-1]C -> [{5,1113},{6,1113},{13,18},{14,37},{15,18},{16,37},{20,3},{27,18},{28,18}] | M1717: =R[-1]C -> [{0,1,[1,30]},{1,2,[11,40]},{2,5,[21,50]},{5,10,[31,60]},{10,20,[41,60]},{30,20,[51,70]},{50,10,[61,80]},{70,5,[71,80]},{100,2,[81,90]},{150,1,[91,100]}]
A1718: 1715 | B1718: 2 | C1718: 8 | D1718: 0 | E1718: =R[-18]C -> 41 | F1718: =R[-18]C -> 50 | G1718: 1 | H1718: 5000 | I1718: 110003 | J1718: 1 | K1718: [{5,10},{6,15},{13,10},{14,5},{15,10},{16,5},{20,1},{27,10},{28,10}] | L1718: =R[-1]C -> [{5,1113},{6,1113},{13,18},{14,37},{15,18},{16,37},{20,3},{27,18},{28,18}] | M1718: =R[-1]C -> [{0,1,[1,30]},{1,2,[11,40]},{2,5,[21,50]},{5,10,[31,60]},{10,20,[41,60]},{30,20,[51,70]},{50,10,[61,80]},{70,5,[71,80]},{100,2,[81,90]},{150,1,[91,100]}]
A1719: 1716 | B1719: 2 | C1719: 8 | D1719: 0 | E1719: =R[-18]C -> 51 | F1719: =R[-18]C -> 60 | G1719: 1 | H1719: 5000 | I1719: 110003 | J1719: 1 | K1719: [{5,10},{6,15},{13,10},{14,5},{15,10},{16,5},{20,1},{27,10},{28,10}] | L1719: =R[-1]C -> [{5,1113},{6,1113},{13,18},{14,37},{15,18},{16,37},{20,3},{27,18},{28,18}] | M1719: =R[-1]C -> [{0,1,[1,30]},{1,2,[11,40]},{2,5,[21,50]},{5,10,[31,60]},{10,20,[41,60]},{30,20,[51,70]},{50,10,[61,80]},{70,5,[71,80]},{100,2,[81,90]},{150,1,[91,100]}]
A1720: 1717 | B1720: 2 | C1720: 8 | D1720: 0 | E1720: =R[-18]C -> 61 | F1720: =R[-18]C -> 70 | G1720: 1 | H1720: 5000 | I1720: 110003 | J1720: 1 | K1720: [{5,10},{6,15},{13,10},{14,5},{15,10},{16,5},{20,1},{27,10},{28,10}] | L1720: =R[-1]C -> [{5,1113},{6,1113},{13,18},{14,37},{15,18},{16,37},{20,3},{27,18},{28,18}] | M1720: =R[-1]C -> [{0,1,[1,30]},{1,2,[11,40]},{2,5,[21,50]},{5,10,[31,60]},{10,20,[41,60]},{30,20,[51,70]},{50,10,[61,80]},{70,5,[71,80]},{100,2,[81,90]},{150,1,[91,100]}]
A1721: 1718 | B1721: 2 | C1721: 8 | D1721: 0 | E1721: =R[-18]C -> 71 | F1721: =R[-18]C -> 80 | G1721: 1 | H1721: 5000 | I1721: 110003 | J1721: 1 | K1721: [{5,10},{6,15},{13,10},{14,5},{15,10},{16,5},{20,1},{27,10},{28,10}] | L1721: =R[-1]C -> [{5,1113},{6,1113},{13,18},{14,37},{15,18},{16,37},{20,3},{27,18},{28,18}] | M1721: =R[-1]C -> [{0,1,[1,30]},{1,2,[11,40]},{2,5,[21,50]},{5,10,[31,60]},{10,20,[41,60]},{30,20,[51,70]},{50,10,[61,80]},{70,5,[71,80]},{100,2,[81,90]},{150,1,[91,100]}]
A1722: 1719 | B1722: 2 | C1722: 8 | D1722: 0 | E1722: =R[-18]C -> 81 | F1722: =R[-18]C -> 90 | G1722: 1 | H1722: 5000 | I1722: 110003 | J1722: 1 | K1722: [{5,10},{6,15},{13,10},{14,5},{15,10},{16,5},{20,1},{27,10},{28,10}] | L1722: =R[-1]C -> [{5,1113},{6,1113},{13,18},{14,37},{15,18},{16,37},{20,3},{27,18},{28,18}] | M1722: =R[-1]C -> [{0,1,[1,30]},{1,2,[11,40]},{2,5,[21,50]},{5,10,[31,60]},{10,20,[41,60]},{30,20,[51,70]},{50,10,[61,80]},{70,5,[71,80]},{100,2,[81,90]},{150,1,[91,100]}]
A1723: 1720 | B1723: 3 | C1723: 8 | D1723: 0 | E1723: =R[-9]C -> 1 | F1723: =R[-9]C -> 10 | G1723: 2 | H1723: 10000 | I1723: 110003 | J1723: 2 | K1723: [{5,10},{6,15},{13,10},{14,5},{15,10},{16,5},{20,1},{27,10},{28,10}] | L1723: =R[-1]C -> [{5,1113},{6,1113},{13,18},{14,37},{15,18},{16,37},{20,3},{27,18},{28,18}] | M1723: =R[-1]C -> [{0,1,[1,30]},{1,2,[11,40]},{2,5,[21,50]},{5,10,[31,60]},{10,20,[41,60]},{30,20,[51,70]},{50,10,[61,80]},{70,5,[71,80]},{100,2,[81,90]},{150,1,[91,100]}]
A1724: 1721 | B1724: 3 | C1724: 8 | D1724: 0 | E1724: =R[-9]C -> 11 | F1724: =R[-9]C -> 20 | G1724: 2 | H1724: 10000 | I1724: 110003 | J1724: 2 | K1724: [{5,10},{6,15},{13,10},{14,5},{15,10},{16,5},{20,1},{27,10},{28,10}] | L1724: =R[-1]C -> [{5,1113},{6,1113},{13,18},{14,37},{15,18},{16,37},{20,3},{27,18},{28,18}] | M1724: =R[-1]C -> [{0,1,[1,30]},{1,2,[11,40]},{2,5,[21,50]},{5,10,[31,60]},{10,20,[41,60]},{30,20,[51,70]},{50,10,[61,80]},{70,5,[71,80]},{100,2,[81,90]},{150,1,[91,100]}]
A1725: 1722 | B1725: 3 | C1725: 8 | D1725: 0 | E1725: =R[-9]C -> 21 | F1725: =R[-9]C -> 30 | G1725: 2 | H1725: 10000 | I1725: 110003 | J1725: 2 | K1725: [{5,10},{6,15},{13,10},{14,5},{15,10},{16,5},{20,1},{27,10},{28,10}] | L1725: =R[-1]C -> [{5,1113},{6,1113},{13,18},{14,37},{15,18},{16,37},{20,3},{27,18},{28,18}] | M1725: =R[-1]C -> [{0,1,[1,30]},{1,2,[11,40]},{2,5,[21,50]},{5,10,[31,60]},{10,20,[41,60]},{30,20,[51,70]},{50,10,[61,80]},{70,5,[71,80]},{100,2,[81,90]},{150,1,[91,100]}]
A1726: 1723 | B1726: 3 | C1726: 8 | D1726: 0 | E1726: =R[-9]C -> 31 | F1726: =R[-9]C -> 40 | G1726: 2 | H1726: 10000 | I1726: 110003 | J1726: 2 | K1726: [{5,10},{6,15},{13,10},{14,5},{15,10},{16,5},{20,1},{27,10},{28,10}] | L1726: =R[-1]C -> [{5,1113},{6,1113},{13,18},{14,37},{15,18},{16,37},{20,3},{27,18},{28,18}] | M1726: =R[-1]C -> [{0,1,[1,30]},{1,2,[11,40]},{2,5,[21,50]},{5,10,[31,60]},{10,20,[41,60]},{30,20,[51,70]},{50,10,[61,80]},{70,5,[71,80]},{100,2,[81,90]},{150,1,[91,100]}]
A1727: 1724 | B1727: 3 | C1727: 8 | D1727: 0 | E1727: =R[-9]C -> 41 | F1727: =R[-9]C -> 50 | G1727: 2 | H1727: 10000 | I1727: 110003 | J1727: 2 | K1727: [{5,10},{6,15},{13,10},{14,5},{15,10},{16,5},{20,1},{27,10},{28,10}] | L1727: =R[-1]C -> [{5,1113},{6,1113},{13,18},{14,37},{15,18},{16,37},{20,3},{27,18},{28,18}] | M1727: =R[-1]C -> [{0,1,[1,30]},{1,2,[11,40]},{2,5,[21,50]},{5,10,[31,60]},{10,20,[41,60]},{30,20,[51,70]},{50,10,[61,80]},{70,5,[71,80]},{100,2,[81,90]},{150,1,[91,100]}]
A1728: 1725 | B1728: 3 | C1728: 8 | D1728: 0 | E1728: =R[-9]C -> 51 | F1728: =R[-9]C -> 60 | G1728: 2 | H1728: 10000 | I1728: 110003 | J1728: 2 | K1728: [{5,10},{6,15},{13,10},{14,5},{15,10},{16,5},{20,1},{27,10},{28,10}] | L1728: =R[-1]C -> [{5,1113},{6,1113},{13,18},{14,37},{15,18},{16,37},{20,3},{27,18},{28,18}] | M1728: =R[-1]C -> [{0,1,[1,30]},{1,2,[11,40]},{2,5,[21,50]},{5,10,[31,60]},{10,20,[41,60]},{30,20,[51,70]},{50,10,[61,80]},{70,5,[71,80]},{100,2,[81,90]},{150,1,[91,100]}]
A1729: 1726 | B1729: 3 | C1729: 8 | D1729: 0 | E1729: =R[-9]C -> 61 | F1729: =R[-9]C -> 70 | G1729: 2 | H1729: 10000 | I1729: 110003 | J1729: 2 | K1729: [{5,10},{6,15},{13,10},{14,5},{15,10},{16,5},{20,1},{27,10},{28,10}] | L1729: =R[-1]C -> [{5,1113},{6,1113},{13,18},{14,37},{15,18},{16,37},{20,3},{27,18},{28,18}] | M1729: =R[-1]C -> [{0,1,[1,30]},{1,2,[11,40]},{2,5,[21,50]},{5,10,[31,60]},{10,20,[41,60]},{30,20,[51,70]},{50,10,[61,80]},{70,5,[71,80]},{100,2,[81,90]},{150,1,[91,100]}]
A1730: 1727 | B1730: 3 | C1730: 8 | D1730: 0 | E1730: =R[-9]C -> 71 | F1730: =R[-9]C -> 80 | G1730: 2 | H1730: 10000 | I1730: 110003 | J1730: 2 | K1730: [{5,10},{6,15},{13,10},{14,5},{15,10},{16,5},{20,1},{27,10},{28,10}] | L1730: =R[-1]C -> [{5,1113},{6,1113},{13,18},{14,37},{15,18},{16,37},{20,3},{27,18},{28,18}] | M1730: =R[-1]C -> [{0,1,[1,30]},{1,2,[11,40]},{2,5,[21,50]},{5,10,[31,60]},{10,20,[41,60]},{30,20,[51,70]},{50,10,[61,80]},{70,5,[71,80]},{100,2,[81,90]},{150,1,[91,100]}]
A1731: 1728 | B1731: 3 | C1731: 8 | D1731: 0 | E1731: =R[-9]C -> 81 | F1731: =R[-9]C -> 90 | G1731: 2 | H1731: 10000 | I1731: 110003 | J1731: 2 | K1731: [{5,10},{6,15},{13,10},{14,5},{15,10},{16,5},{20,1},{27,10},{28,10}] | L1731: =R[-1]C -> [{5,1113},{6,1113},{13,18},{14,37},{15,18},{16,37},{20,3},{27,18},{28,18}] | M1731: =R[-1]C -> [{0,1,[1,30]},{1,2,[11,40]},{2,5,[21,50]},{5,10,[31,60]},{10,20,[41,60]},{30,20,[51,70]},{50,10,[61,80]},{70,5,[71,80]},{100,2,[81,90]},{150,1,[91,100]}]
A1732: 1729 | B1732: 4 | C1732: 8 | D1732: 0 | E1732: =R[-9]C -> 1 | F1732: =R[-9]C -> 10 | G1732: 3 | H1732: 15000 | I1732: 110003 | J1732: 3 | K1732: [{5,10},{6,15},{13,10},{14,5},{15,10},{16,5},{20,1},{27,10},{28,10}] | L1732: =R[-1]C -> [{5,1113},{6,1113},{13,18},{14,37},{15,18},{16,37},{20,3},{27,18},{28,18}] | M1732: =R[-1]C -> [{0,1,[1,30]},{1,2,[11,40]},{2,5,[21,50]},{5,10,[31,60]},{10,20,[41,60]},{30,20,[51,70]},{50,10,[61,80]},{70,5,[71,80]},{100,2,[81,90]},{150,1,[91,100]}]
A1733: 1730 | B1733: 4 | C1733: 8 | D1733: 0 | E1733: =R[-9]C -> 11 | F1733: =R[-9]C -> 20 | G1733: 3 | H1733: 15000 | I1733: 110003 | J1733: 3 | K1733: [{5,10},{6,15},{13,10},{14,5},{15,10},{16,5},{20,1},{27,10},{28,10}] | L1733: =R[-1]C -> [{5,1113},{6,1113},{13,18},{14,37},{15,18},{16,37},{20,3},{27,18},{28,18}] | M1733: =R[-1]C -> [{0,1,[1,30]},{1,2,[11,40]},{2,5,[21,50]},{5,10,[31,60]},{10,20,[41,60]},{30,20,[51,70]},{50,10,[61,80]},{70,5,[71,80]},{100,2,[81,90]},{150,1,[91,100]}]
A1734: 1731 | B1734: 4 | C1734: 8 | D1734: 0 | E1734: =R[-9]C -> 21 | F1734: =R[-9]C -> 30 | G1734: 3 | H1734: 15000 | I1734: 110003 | J1734: 3 | K1734: [{5,10},{6,15},{13,10},{14,5},{15,10},{16,5},{20,1},{27,10},{28,10}] | L1734: =R[-1]C -> [{5,1113},{6,1113},{13,18},{14,37},{15,18},{16,37},{20,3},{27,18},{28,18}] | M1734: =R[-1]C -> [{0,1,[1,30]},{1,2,[11,40]},{2,5,[21,50]},{5,10,[31,60]},{10,20,[41,60]},{30,20,[51,70]},{50,10,[61,80]},{70,5,[71,80]},{100,2,[81,90]},{150,1,[91,100]}]
A1735: 1732 | B1735: 4 | C1735: 8 | D1735: 0 | E1735: =R[-9]C -> 31 | F1735: =R[-9]C -> 40 | G1735: 3 | H1735: 15000 | I1735: 110003 | J1735: 3 | K1735: [{5,10},{6,15},{13,10},{14,5},{15,10},{16,5},{20,1},{27,10},{28,10}] | L1735: =R[-1]C -> [{5,1113},{6,1113},{13,18},{14,37},{15,18},{16,37},{20,3},{27,18},{28,18}] | M1735: =R[-1]C -> [{0,1,[1,30]},{1,2,[11,40]},{2,5,[21,50]},{5,10,[31,60]},{10,20,[41,60]},{30,20,[51,70]},{50,10,[61,80]},{70,5,[71,80]},{100,2,[81,90]},{150,1,[91,100]}]
A1736: 1733 | B1736: 4 | C1736: 8 | D1736: 0 | E1736: =R[-9]C -> 41 | F1736: =R[-9]C -> 50 | G1736: 3 | H1736: 15000 | I1736: 110003 | J1736: 3 | K1736: [{5,10},{6,15},{13,10},{14,5},{15,10},{16,5},{20,1},{27,10},{28,10}] | L1736: =R[-1]C -> [{5,1113},{6,1113},{13,18},{14,37},{15,18},{16,37},{20,3},{27,18},{28,18}] | M1736: =R[-1]C -> [{0,1,[1,30]},{1,2,[11,40]},{2,5,[21,50]},{5,10,[31,60]},{10,20,[41,60]},{30,20,[51,70]},{50,10,[61,80]},{70,5,[71,80]},{100,2,[81,90]},{150,1,[91,100]}]
A1737: 1734 | B1737: 4 | C1737: 8 | D1737: 0 | E1737: =R[-9]C -> 51 | F1737: =R[-9]C -> 60 | G1737: 3 | H1737: 15000 | I1737: 110003 | J1737: 3 | K1737: [{5,10},{6,15},{13,10},{14,5},{15,10},{16,5},{20,1},{27,10},{28,10}] | L1737: =R[-1]C -> [{5,1113},{6,1113},{13,18},{14,37},{15,18},{16,37},{20,3},{27,18},{28,18}] | M1737: =R[-1]C -> [{0,1,[1,30]},{1,2,[11,40]},{2,5,[21,50]},{5,10,[31,60]},{10,20,[41,60]},{30,20,[51,70]},{50,10,[61,80]},{70,5,[71,80]},{100,2,[81,90]},{150,1,[91,100]}]
A1738: 1735 | B1738: 4 | C1738: 8 | D1738: 0 | E1738: =R[-9]C -> 61 | F1738: =R[-9]C -> 70 | G1738: 3 | H1738: 15000 | I1738: 110003 | J1738: 3 | K1738: [{5,10},{6,15},{13,10},{14,5},{15,10},{16,5},{20,1},{27,10},{28,10}] | L1738: =R[-1]C -> [{5,1113},{6,1113},{13,18},{14,37},{15,18},{16,37},{20,3},{27,18},{28,18}] | M1738: =R[-1]C -> [{0,1,[1,30]},{1,2,[11,40]},{2,5,[21,50]},{5,10,[31,60]},{10,20,[41,60]},{30,20,[51,70]},{50,10,[61,80]},{70,5,[71,80]},{100,2,[81,90]},{150,1,[91,100]}]
A1739: 1736 | B1739: 4 | C1739: 8 | D1739: 0 | E1739: =R[-9]C -> 71 | F1739: =R[-9]C -> 80 | G1739: 3 | H1739: 15000 | I1739: 110003 | J1739: 3 | K1739: [{5,10},{6,15},{13,10},{14,5},{15,10},{16,5},{20,1},{27,10},{28,10}] | L1739: =R[-1]C -> [{5,1113},{6,1113},{13,18},{14,37},{15,18},{16,37},{20,3},{27,18},{28,18}] | M1739: =R[-1]C -> [{0,1,[1,30]},{1,2,[11,40]},{2,5,[21,50]},{5,10,[31,60]},{10,20,[41,60]},{30,20,[51,70]},{50,10,[61,80]},{70,5,[71,80]},{100,2,[81,90]},{150,1,[91,100]}]
A1740: 1737 | B1740: 4 | C1740: 8 | D1740: 0 | E1740: =R[-9]C -> 81 | F1740: =R[-9]C -> 90 | G1740: 3 | H1740: 15000 | I1740: 110003 | J1740: 3 | K1740: [{5,10},{6,15},{13,10},{14,5},{15,10},{16,5},{20,1},{27,10},{28,10}] | L1740: =R[-1]C -> [{5,1113},{6,1113},{13,18},{14,37},{15,18},{16,37},{20,3},{27,18},{28,18}] | M1740: =R[-1]C -> [{0,1,[1,30]},{1,2,[11,40]},{2,5,[21,50]},{5,10,[31,60]},{10,20,[41,60]},{30,20,[51,70]},{50,10,[61,80]},{70,5,[71,80]},{100,2,[81,90]},{150,1,[91,100]}]
A1741: 1738 | B1741: 5 | C1741: 8 | D1741: 0 | E1741: =R[-9]C -> 1 | F1741: =R[-9]C -> 10 | G1741: 4 | H1741: 20000 | I1741: 110003 | J1741: 4 | K1741: [{5,10},{6,15},{13,10},{14,5},{15,10},{16,5},{20,1},{27,10},{28,10}] | L1741: =R[-1]C -> [{5,1113},{6,1113},{13,18},{14,37},{15,18},{16,37},{20,3},{27,18},{28,18}] | M1741: =R[-1]C -> [{0,1,[1,30]},{1,2,[11,40]},{2,5,[21,50]},{5,10,[31,60]},{10,20,[41,60]},{30,20,[51,70]},{50,10,[61,80]},{70,5,[71,80]},{100,2,[81,90]},{150,1,[91,100]}]
A1742: 1739 | B1742: 5 | C1742: 8 | D1742: 0 | E1742: =R[-9]C -> 11 | F1742: =R[-9]C -> 20 | G1742: 4 | H1742: 20000 | I1742: 110003 | J1742: 4 | K1742: [{5,10},{6,15},{13,10},{14,5},{15,10},{16,5},{20,1},{27,10},{28,10}] | L1742: =R[-1]C -> [{5,1113},{6,1113},{13,18},{14,37},{15,18},{16,37},{20,3},{27,18},{28,18}] | M1742: =R[-1]C -> [{0,1,[1,30]},{1,2,[11,40]},{2,5,[21,50]},{5,10,[31,60]},{10,20,[41,60]},{30,20,[51,70]},{50,10,[61,80]},{70,5,[71,80]},{100,2,[81,90]},{150,1,[91,100]}]
A1743: 1740 | B1743: 5 | C1743: 8 | D1743: 0 | E1743: =R[-9]C -> 21 | F1743: =R[-9]C -> 30 | G1743: 4 | H1743: 20000 | I1743: 110003 | J1743: 4 | K1743: [{5,10},{6,15},{13,10},{14,5},{15,10},{16,5},{20,1},{27,10},{28,10}] | L1743: =R[-1]C -> [{5,1113},{6,1113},{13,18},{14,37},{15,18},{16,37},{20,3},{27,18},{28,18}] | M1743: =R[-1]C -> [{0,1,[1,30]},{1,2,[11,40]},{2,5,[21,50]},{5,10,[31,60]},{10,20,[41,60]},{30,20,[51,70]},{50,10,[61,80]},{70,5,[71,80]},{100,2,[81,90]},{150,1,[91,100]}]
A1744: 1741 | B1744: 5 | C1744: 8 | D1744: 0 | E1744: =R[-9]C -> 31 | F1744: =R[-9]C -> 40 | G1744: 4 | H1744: 20000 | I1744: 110003 | J1744: 4 | K1744: [{5,10},{6,15},{13,10},{14,5},{15,10},{16,5},{20,1},{27,10},{28,10}] | L1744: =R[-1]C -> [{5,1113},{6,1113},{13,18},{14,37},{15,18},{16,37},{20,3},{27,18},{28,18}] | M1744: =R[-1]C -> [{0,1,[1,30]},{1,2,[11,40]},{2,5,[21,50]},{5,10,[31,60]},{10,20,[41,60]},{30,20,[51,70]},{50,10,[61,80]},{70,5,[71,80]},{100,2,[81,90]},{150,1,[91,100]}]
A1745: 1742 | B1745: 5 | C1745: 8 | D1745: 0 | E1745: =R[-9]C -> 41 | F1745: =R[-9]C -> 50 | G1745: 4 | H1745: 20000 | I1745: 110003 | J1745: 4 | K1745: [{5,10},{6,15},{13,10},{14,5},{15,10},{16,5},{20,1},{27,10},{28,10}] | L1745: =R[-1]C -> [{5,1113},{6,1113},{13,18},{14,37},{15,18},{16,37},{20,3},{27,18},{28,18}] | M1745: =R[-1]C -> [{0,1,[1,30]},{1,2,[11,40]},{2,5,[21,50]},{5,10,[31,60]},{10,20,[41,60]},{30,20,[51,70]},{50,10,[61,80]},{70,5,[71,80]},{100,2,[81,90]},{150,1,[91,100]}]
A1746: 1743 | B1746: 5 | C1746: 8 | D1746: 0 | E1746: =R[-9]C -> 51 | F1746: =R[-9]C -> 60 | G1746: 4 | H1746: 20000 | I1746: 110003 | J1746: 4 | K1746: [{5,10},{6,15},{13,10},{14,5},{15,10},{16,5},{20,1},{27,10},{28,10}] | L1746: =R[-1]C -> [{5,1113},{6,1113},{13,18},{14,37},{15,18},{16,37},{20,3},{27,18},{28,18}] | M1746: =R[-1]C -> [{0,1,[1,30]},{1,2,[11,40]},{2,5,[21,50]},{5,10,[31,60]},{10,20,[41,60]},{30,20,[51,70]},{50,10,[61,80]},{70,5,[71,80]},{100,2,[81,90]},{150,1,[91,100]}]
A1747: 1744 | B1747: 5 | C1747: 8 | D1747: 0 | E1747: =R[-9]C -> 61 | F1747: =R[-9]C -> 70 | G1747: 4 | H1747: 20000 | I1747: 110003 | J1747: 4 | K1747: [{5,10},{6,15},{13,10},{14,5},{15,10},{16,5},{20,1},{27,10},{28,10}] | L1747: =R[-1]C -> [{5,1113},{6,1113},{13,18},{14,37},{15,18},{16,37},{20,3},{27,18},{28,18}] | M1747: =R[-1]C -> [{0,1,[1,30]},{1,2,[11,40]},{2,5,[21,50]},{5,10,[31,60]},{10,20,[41,60]},{30,20,[51,70]},{50,10,[61,80]},{70,5,[71,80]},{100,2,[81,90]},{150,1,[91,100]}]
A1748: 1745 | B1748: 5 | C1748: 8 | D1748: 0 | E1748: =R[-9]C -> 71 | F1748: =R[-9]C -> 80 | G1748: 4 | H1748: 20000 | I1748: 110003 | J1748: 4 | K1748: [{5,10},{6,15},{13,10},{14,5},{15,10},{16,5},{20,1},{27,10},{28,10}] | L1748: =R[-1]C -> [{5,1113},{6,1113},{13,18},{14,37},{15,18},{16,37},{20,3},{27,18},{28,18}] | M1748: =R[-1]C -> [{0,1,[1,30]},{1,2,[11,40]},{2,5,[21,50]},{5,10,[31,60]},{10,20,[41,60]},{30,20,[51,70]},{50,10,[61,80]},{70,5,[71,80]},{100,2,[81,90]},{150,1,[91,100]}]
A1749: 1746 | B1749: 6 | C1749: 8 | D1749: 0 | E1749: =R[-9]C -> 81 | F1749: =R[-9]C -> 90 | G1749: 4 | H1749: 20000 | I1749: 110003 | J1749: 4 | K1749: [{5,10},{6,15},{13,10},{14,5},{15,10},{16,5},{20,1},{27,10},{28,10}] | L1749: =R[-1]C -> [{5,1113},{6,1113},{13,18},{14,37},{15,18},{16,37},{20,3},{27,18},{28,18}] | M1749: =R[-1]C -> [{0,1,[1,30]},{1,2,[11,40]},{2,5,[21,50]},{5,10,[31,60]},{10,20,[41,60]},{30,20,[51,70]},{50,10,[61,80]},{70,5,[71,80]},{100,2,[81,90]},{150,1,[91,100]}]
A1750: 1747 | B1750: 6 | C1750: 8 | D1750: 0 | E1750: =R[-9]C -> 1 | F1750: =R[-9]C -> 10 | G1750: 5 | H1750: 20000 | I1750: 110003 | J1750: 5 | K1750: [{5,10},{6,15},{13,10},{14,5},{15,10},{16,5},{20,1},{27,10},{28,10}] | L1750: =R[-1]C -> [{5,1113},{6,1113},{13,18},{14,37},{15,18},{16,37},{20,3},{27,18},{28,18}] | M1750: =R[-1]C -> [{0,1,[1,30]},{1,2,[11,40]},{2,5,[21,50]},{5,10,[31,60]},{10,20,[41,60]},{30,20,[51,70]},{50,10,[61,80]},{70,5,[71,80]},{100,2,[81,90]},{150,1,[91,100]}]
A1751: 1748 | B1751: 6 | C1751: 8 | D1751: 0 | E1751: =R[-9]C -> 11 | F1751: =R[-9]C -> 20 | G1751: 5 | H1751: 20000 | I1751: 110003 | J1751: 5 | K1751: [{5,10},{6,15},{13,10},{14,5},{15,10},{16,5},{20,1},{27,10},{28,10}] | L1751: =R[-1]C -> [{5,1113},{6,1113},{13,18},{14,37},{15,18},{16,37},{20,3},{27,18},{28,18}] | M1751: =R[-1]C -> [{0,1,[1,30]},{1,2,[11,40]},{2,5,[21,50]},{5,10,[31,60]},{10,20,[41,60]},{30,20,[51,70]},{50,10,[61,80]},{70,5,[71,80]},{100,2,[81,90]},{150,1,[91,100]}]
A1752: 1749 | B1752: 6 | C1752: 8 | D1752: 0 | E1752: =R[-9]C -> 21 | F1752: =R[-9]C -> 30 | G1752: 5 | H1752: 20000 | I1752: 110003 | J1752: 5 | K1752: [{5,10},{6,15},{13,10},{14,5},{15,10},{16,5},{20,1},{27,10},{28,10}] | L1752: =R[-1]C -> [{5,1113},{6,1113},{13,18},{14,37},{15,18},{16,37},{20,3},{27,18},{28,18}] | M1752: =R[-1]C -> [{0,1,[1,30]},{1,2,[11,40]},{2,5,[21,50]},{5,10,[31,60]},{10,20,[41,60]},{30,20,[51,70]},{50,10,[61,80]},{70,5,[71,80]},{100,2,[81,90]},{150,1,[91,100]}]
A1753: 1750 | B1753: 6 | C1753: 8 | D1753: 0 | E1753: =R[-9]C -> 31 | F1753: =R[-9]C -> 40 | G1753: 5 | H1753: 20000 | I1753: 110003 | J1753: 5 | K1753: [{5,10},{6,15},{13,10},{14,5},{15,10},{16,5},{20,1},{27,10},{28,10}] | L1753: =R[-1]C -> [{5,1113},{6,1113},{13,18},{14,37},{15,18},{16,37},{20,3},{27,18},{28,18}] | M1753: =R[-1]C -> [{0,1,[1,30]},{1,2,[11,40]},{2,5,[21,50]},{5,10,[31,60]},{10,20,[41,60]},{30,20,[51,70]},{50,10,[61,80]},{70,5,[71,80]},{100,2,[81,90]},{150,1,[91,100]}]
A1754: 1751 | B1754: 6 | C1754: 8 | D1754: 0 | E1754: =R[-9]C -> 41 | F1754: =R[-9]C -> 50 | G1754: 5 | H1754: 20000 | I1754: 110003 | J1754: 5 | K1754: [{5,10},{6,15},{13,10},{14,5},{15,10},{16,5},{20,1},{27,10},{28,10}] | L1754: =R[-1]C -> [{5,1113},{6,1113},{13,18},{14,37},{15,18},{16,37},{20,3},{27,18},{28,18}] | M1754: =R[-1]C -> [{0,1,[1,30]},{1,2,[11,40]},{2,5,[21,50]},{5,10,[31,60]},{10,20,[41,60]},{30,20,[51,70]},{50,10,[61,80]},{70,5,[71,80]},{100,2,[81,90]},{150,1,[91,100]}]
A1755: 1752 | B1755: 6 | C1755: 8 | D1755: 0 | E1755: =R[-9]C -> 51 | F1755: =R[-9]C -> 60 | G1755: 5 | H1755: 20000 | I1755: 110003 | J1755: 5 | K1755: [{5,10},{6,15},{13,10},{14,5},{15,10},{16,5},{20,1},{27,10},{28,10}] | L1755: =R[-1]C -> [{5,1113},{6,1113},{13,18},{14,37},{15,18},{16,37},{20,3},{27,18},{28,18}] | M1755: =R[-1]C -> [{0,1,[1,30]},{1,2,[11,40]},{2,5,[21,50]},{5,10,[31,60]},{10,20,[41,60]},{30,20,[51,70]},{50,10,[61,80]},{70,5,[71,80]},{100,2,[81,90]},{150,1,[91,100]}]
A1756: 1753 | B1756: 6 | C1756: 8 | D1756: 0 | E1756: =R[-9]C -> 61 | F1756: =R[-9]C -> 70 | G1756: 5 | H1756: 20000 | I1756: 110003 | J1756: 5 | K1756: [{5,10},{6,15},{13,10},{14,5},{15,10},{16,5},{20,1},{27,10},{28,10}] | L1756: =R[-1]C -> [{5,1113},{6,1113},{13,18},{14,37},{15,18},{16,37},{20,3},{27,18},{28,18}] | M1756: =R[-1]C -> [{0,1,[1,30]},{1,2,[11,40]},{2,5,[21,50]},{5,10,[31,60]},{10,20,[41,60]},{30,20,[51,70]},{50,10,[61,80]},{70,5,[71,80]},{100,2,[81,90]},{150,1,[91,100]}]
A1757: 1754 | B1757: 6 | C1757: 8 | D1757: 0 | E1757: =R[-17]C -> 81 | F1757: =R[-17]C -> 90 | G1757: 5 | H1757: 20000 | I1757: 110003 | J1757: 5 | K1757: [{5,10},{6,15},{13,10},{14,5},{15,10},{16,5},{20,1},{27,10},{28,10}] | L1757: =R[-1]C -> [{5,1113},{6,1113},{13,18},{14,37},{15,18},{16,37},{20,3},{27,18},{28,18}] | M1757: =R[-1]C -> [{0,1,[1,30]},{1,2,[11,40]},{2,5,[21,50]},{5,10,[31,60]},{10,20,[41,60]},{30,20,[51,70]},{50,10,[61,80]},{70,5,[71,80]},{100,2,[81,90]},{150,1,[91,100]}]
A1758: 1755 | B1758: 2 | C1758: 10 | D1758: 0 | E1758: =R[-17]C -> 1 | F1758: =R[-17]C -> 10 | G1758: 1 | H1758: 5000 | I1758: 110003 | J1758: 1 | K1758: [{5,10},{6,15},{13,10},{14,5},{15,10},{16,5},{20,1},{27,10},{28,10}] | L1758: =R[-1]C -> [{5,1113},{6,1113},{13,18},{14,37},{15,18},{16,37},{20,3},{27,18},{28,18}] | M1758: =R[-1]C -> [{0,1,[1,30]},{1,2,[11,40]},{2,5,[21,50]},{5,10,[31,60]},{10,20,[41,60]},{30,20,[51,70]},{50,10,[61,80]},{70,5,[71,80]},{100,2,[81,90]},{150,1,[91,100]}]
A1759: 1756 | B1759: 2 | C1759: 10 | D1759: 0 | E1759: =R[-17]C -> 11 | F1759: =R[-17]C -> 20 | G1759: 1 | H1759: 5000 | I1759: 110003 | J1759: 1 | K1759: [{5,10},{6,15},{13,10},{14,5},{15,10},{16,5},{20,1},{27,10},{28,10}] | L1759: =R[-1]C -> [{5,1113},{6,1113},{13,18},{14,37},{15,18},{16,37},{20,3},{27,18},{28,18}] | M1759: =R[-1]C -> [{0,1,[1,30]},{1,2,[11,40]},{2,5,[21,50]},{5,10,[31,60]},{10,20,[41,60]},{30,20,[51,70]},{50,10,[61,80]},{70,5,[71,80]},{100,2,[81,90]},{150,1,[91,100]}]
A1760: 1757 | B1760: 2 | C1760: 10 | D1760: 0 | E1760: =R[-17]C -> 21 | F1760: =R[-17]C -> 30 | G1760: 1 | H1760: 5000 | I1760: 110003 | J1760: 1 | K1760: [{5,10},{6,15},{13,10},{14,5},{15,10},{16,5},{20,1},{27,10},{28,10}] | L1760: =R[-1]C -> [{5,1113},{6,1113},{13,18},{14,37},{15,18},{16,37},{20,3},{27,18},{28,18}] | M1760: =R[-1]C -> [{0,1,[1,30]},{1,2,[11,40]},{2,5,[21,50]},{5,10,[31,60]},{10,20,[41,60]},{30,20,[51,70]},{50,10,[61,80]},{70,5,[71,80]},{100,2,[81,90]},{150,1,[91,100]}]
A1761: 1758 | B1761: 2 | C1761: 10 | D1761: 0 | E1761: =R[-17]C -> 31 | F1761: =R[-17]C -> 40 | G1761: 1 | H1761: 5000 | I1761: 110003 | J1761: 1 | K1761: [{5,10},{6,15},{13,10},{14,5},{15,10},{16,5},{20,1},{27,10},{28,10}] | L1761: =R[-1]C -> [{5,1113},{6,1113},{13,18},{14,37},{15,18},{16,37},{20,3},{27,18},{28,18}] | M1761: =R[-1]C -> [{0,1,[1,30]},{1,2,[11,40]},{2,5,[21,50]},{5,10,[31,60]},{10,20,[41,60]},{30,20,[51,70]},{50,10,[61,80]},{70,5,[71,80]},{100,2,[81,90]},{150,1,[91,100]}]
A1762: 1759 | B1762: 2 | C1762: 10 | D1762: 0 | E1762: =R[-17]C -> 41 | F1762: =R[-17]C -> 50 | G1762: 1 | H1762: 5000 | I1762: 110003 | J1762: 1 | K1762: [{5,10},{6,15},{13,10},{14,5},{15,10},{16,5},{20,1},{27,10},{28,10}] | L1762: =R[-1]C -> [{5,1113},{6,1113},{13,18},{14,37},{15,18},{16,37},{20,3},{27,18},{28,18}] | M1762: =R[-1]C -> [{0,1,[1,30]},{1,2,[11,40]},{2,5,[21,50]},{5,10,[31,60]},{10,20,[41,60]},{30,20,[51,70]},{50,10,[61,80]},{70,5,[71,80]},{100,2,[81,90]},{150,1,[91,100]}]
A1763: 1760 | B1763: 2 | C1763: 10 | D1763: 0 | E1763: =R[-17]C -> 51 | F1763: =R[-17]C -> 60 | G1763: 1 | H1763: 5000 | I1763: 110003 | J1763: 1 | K1763: [{5,10},{6,15},{13,10},{14,5},{15,10},{16,5},{20,1},{27,10},{28,10}] | L1763: =R[-1]C -> [{5,1113},{6,1113},{13,18},{14,37},{15,18},{16,37},{20,3},{27,18},{28,18}] | M1763: =R[-1]C -> [{0,1,[1,30]},{1,2,[11,40]},{2,5,[21,50]},{5,10,[31,60]},{10,20,[41,60]},{30,20,[51,70]},{50,10,[61,80]},{70,5,[71,80]},{100,2,[81,90]},{150,1,[91,100]}]
A1764: 1761 | B1764: 2 | C1764: 10 | D1764: 0 | E1764: =R[-17]C -> 61 | F1764: =R[-17]C -> 70 | G1764: 1 | H1764: 5000 | I1764: 110003 | J1764: 1 | K1764: [{5,10},{6,15},{13,10},{14,5},{15,10},{16,5},{20,1},{27,10},{28,10}] | L1764: =R[-1]C -> [{5,1113},{6,1113},{13,18},{14,37},{15,18},{16,37},{20,3},{27,18},{28,18}] | M1764: =R[-1]C -> [{0,1,[1,30]},{1,2,[11,40]},{2,5,[21,50]},{5,10,[31,60]},{10,20,[41,60]},{30,20,[51,70]},{50,10,[61,80]},{70,5,[71,80]},{100,2,[81,90]},{150,1,[91,100]}]
A1765: 1762 | B1765: 2 | C1765: 10 | D1765: 0 | E1765: =R[-17]C -> 71 | F1765: =R[-17]C -> 80 | G1765: 1 | H1765: 5000 | I1765: 110003 | J1765: 1 | K1765: [{5,10},{6,15},{13,10},{14,5},{15,10},{16,5},{20,1},{27,10},{28,10}] | L1765: =R[-1]C -> [{5,1113},{6,1113},{13,18},{14,37},{15,18},{16,37},{20,3},{27,18},{28,18}] | M1765: =R[-1]C -> [{0,1,[1,30]},{1,2,[11,40]},{2,5,[21,50]},{5,10,[31,60]},{10,20,[41,60]},{30,20,[51,70]},{50,10,[61,80]},{70,5,[71,80]},{100,2,[81,90]},{150,1,[91,100]}]
A1766: 1763 | B1766: 2 | C1766: 10 | D1766: 0 | E1766: =R[-9]C -> 81 | F1766: =R[-9]C -> 90 | G1766: 1 | H1766: 5000 | I1766: 110003 | J1766: 1 | K1766: [{5,10},{6,15},{13,10},{14,5},{15,10},{16,5},{20,1},{27,10},{28,10}] | L1766: =R[-1]C -> [{5,1113},{6,1113},{13,18},{14,37},{15,18},{16,37},{20,3},{27,18},{28,18}] | M1766: =R[-1]C -> [{0,1,[1,30]},{1,2,[11,40]},{2,5,[21,50]},{5,10,[31,60]},{10,20,[41,60]},{30,20,[51,70]},{50,10,[61,80]},{70,5,[71,80]},{100,2,[81,90]},{150,1,[91,100]}]
A1767: 1764 | B1767: 3 | C1767: 10 | D1767: 0 | E1767: =R[-9]C -> 1 | F1767: =R[-9]C -> 10 | G1767: 2 | H1767: 10000 | I1767: 110003 | J1767: 2 | K1767: [{5,10},{6,15},{13,10},{14,5},{15,10},{16,5},{20,1},{27,10},{28,10}] | L1767: =R[-1]C -> [{5,1113},{6,1113},{13,18},{14,37},{15,18},{16,37},{20,3},{27,18},{28,18}] | M1767: =R[-1]C -> [{0,1,[1,30]},{1,2,[11,40]},{2,5,[21,50]},{5,10,[31,60]},{10,20,[41,60]},{30,20,[51,70]},{50,10,[61,80]},{70,5,[71,80]},{100,2,[81,90]},{150,1,[91,100]}]
A1768: 1765 | B1768: 3 | C1768: 10 | D1768: 0 | E1768: =R[-9]C -> 11 | F1768: =R[-9]C -> 20 | G1768: 2 | H1768: 10000 | I1768: 110003 | J1768: 2 | K1768: [{5,10},{6,15},{13,10},{14,5},{15,10},{16,5},{20,1},{27,10},{28,10}] | L1768: =R[-1]C -> [{5,1113},{6,1113},{13,18},{14,37},{15,18},{16,37},{20,3},{27,18},{28,18}] | M1768: =R[-1]C -> [{0,1,[1,30]},{1,2,[11,40]},{2,5,[21,50]},{5,10,[31,60]},{10,20,[41,60]},{30,20,[51,70]},{50,10,[61,80]},{70,5,[71,80]},{100,2,[81,90]},{150,1,[91,100]}]
A1769: 1766 | B1769: 3 | C1769: 10 | D1769: 0 | E1769: =R[-9]C -> 21 | F1769: =R[-9]C -> 30 | G1769: 2 | H1769: 10000 | I1769: 110003 | J1769: 2 | K1769: [{5,10},{6,15},{13,10},{14,5},{15,10},{16,5},{20,1},{27,10},{28,10}] | L1769: =R[-1]C -> [{5,1113},{6,1113},{13,18},{14,37},{15,18},{16,37},{20,3},{27,18},{28,18}] | M1769: =R[-1]C -> [{0,1,[1,30]},{1,2,[11,40]},{2,5,[21,50]},{5,10,[31,60]},{10,20,[41,60]},{30,20,[51,70]},{50,10,[61,80]},{70,5,[71,80]},{100,2,[81,90]},{150,1,[91,100]}]
A1770: 1767 | B1770: 3 | C1770: 10 | D1770: 0 | E1770: =R[-9]C -> 31 | F1770: =R[-9]C -> 40 | G1770: 2 | H1770: 10000 | I1770: 110003 | J1770: 2 | K1770: [{5,10},{6,15},{13,10},{14,5},{15,10},{16,5},{20,1},{27,10},{28,10}] | L1770: =R[-1]C -> [{5,1113},{6,1113},{13,18},{14,37},{15,18},{16,37},{20,3},{27,18},{28,18}] | M1770: =R[-1]C -> [{0,1,[1,30]},{1,2,[11,40]},{2,5,[21,50]},{5,10,[31,60]},{10,20,[41,60]},{30,20,[51,70]},{50,10,[61,80]},{70,5,[71,80]},{100,2,[81,90]},{150,1,[91,100]}]
A1771: 1768 | B1771: 3 | C1771: 10 | D1771: 0 | E1771: =R[-9]C -> 41 | F1771: =R[-9]C -> 50 | G1771: 2 | H1771: 10000 | I1771: 110003 | J1771: 2 | K1771: [{5,10},{6,15},{13,10},{14,5},{15,10},{16,5},{20,1},{27,10},{28,10}] | L1771: =R[-1]C -> [{5,1113},{6,1113},{13,18},{14,37},{15,18},{16,37},{20,3},{27,18},{28,18}] | M1771: =R[-1]C -> [{0,1,[1,30]},{1,2,[11,40]},{2,5,[21,50]},{5,10,[31,60]},{10,20,[41,60]},{30,20,[51,70]},{50,10,[61,80]},{70,5,[71,80]},{100,2,[81,90]},{150,1,[91,100]}]
A1772: 1769 | B1772: 3 | C1772: 10 | D1772: 0 | E1772: =R[-9]C -> 51 | F1772: =R[-9]C -> 60 | G1772: 2 | H1772: 10000 | I1772: 110003 | J1772: 2 | K1772: [{5,10},{6,15},{13,10},{14,5},{15,10},{16,5},{20,1},{27,10},{28,10}] | L1772: =R[-1]C -> [{5,1113},{6,1113},{13,18},{14,37},{15,18},{16,37},{20,3},{27,18},{28,18}] | M1772: =R[-1]C -> [{0,1,[1,30]},{1,2,[11,40]},{2,5,[21,50]},{5,10,[31,60]},{10,20,[41,60]},{30,20,[51,70]},{50,10,[61,80]},{70,5,[71,80]},{100,2,[81,90]},{150,1,[91,100]}]
A1773: 1770 | B1773: 3 | C1773: 10 | D1773: 0 | E1773: =R[-9]C -> 61 | F1773: =R[-9]C -> 70 | G1773: 2 | H1773: 10000 | I1773: 110003 | J1773: 2 | K1773: [{5,10},{6,15},{13,10},{14,5},{15,10},{16,5},{20,1},{27,10},{28,10}] | L1773: =R[-1]C -> [{5,1113},{6,1113},{13,18},{14,37},{15,18},{16,37},{20,3},{27,18},{28,18}] | M1773: =R[-1]C -> [{0,1,[1,30]},{1,2,[11,40]},{2,5,[21,50]},{5,10,[31,60]},{10,20,[41,60]},{30,20,[51,70]},{50,10,[61,80]},{70,5,[71,80]},{100,2,[81,90]},{150,1,[91,100]}]
A1774: 1771 | B1774: 3 | C1774: 10 | D1774: 0 | E1774: =R[-9]C -> 71 | F1774: =R[-9]C -> 80 | G1774: 2 | H1774: 10000 | I1774: 110003 | J1774: 2 | K1774: [{5,10},{6,15},{13,10},{14,5},{15,10},{16,5},{20,1},{27,10},{28,10}] | L1774: =R[-1]C -> [{5,1113},{6,1113},{13,18},{14,37},{15,18},{16,37},{20,3},{27,18},{28,18}] | M1774: =R[-1]C -> [{0,1,[1,30]},{1,2,[11,40]},{2,5,[21,50]},{5,10,[31,60]},{10,20,[41,60]},{30,20,[51,70]},{50,10,[61,80]},{70,5,[71,80]},{100,2,[81,90]},{150,1,[91,100]}]
A1775: 1772 | B1775: 3 | C1775: 10 | D1775: 0 | E1775: =R[-9]C -> 81 | F1775: =R[-9]C -> 90 | G1775: 2 | H1775: 10000 | I1775: 110003 | J1775: 2 | K1775: [{5,10},{6,15},{13,10},{14,5},{15,10},{16,5},{20,1},{27,10},{28,10}] | L1775: =R[-1]C -> [{5,1113},{6,1113},{13,18},{14,37},{15,18},{16,37},{20,3},{27,18},{28,18}] | M1775: =R[-1]C -> [{0,1,[1,30]},{1,2,[11,40]},{2,5,[21,50]},{5,10,[31,60]},{10,20,[41,60]},{30,20,[51,70]},{50,10,[61,80]},{70,5,[71,80]},{100,2,[81,90]},{150,1,[91,100]}]
A1776: 1773 | B1776: 4 | C1776: 10 | D1776: 0 | E1776: =R[-9]C -> 1 | F1776: =R[-9]C -> 10 | G1776: 3 | H1776: 15000 | I1776: 110003 | J1776: 3 | K1776: [{5,10},{6,15},{13,10},{14,5},{15,10},{16,5},{20,1},{27,10},{28,10}] | L1776: =R[-1]C -> [{5,1113},{6,1113},{13,18},{14,37},{15,18},{16,37},{20,3},{27,18},{28,18}] | M1776: =R[-1]C -> [{0,1,[1,30]},{1,2,[11,40]},{2,5,[21,50]},{5,10,[31,60]},{10,20,[41,60]},{30,20,[51,70]},{50,10,[61,80]},{70,5,[71,80]},{100,2,[81,90]},{150,1,[91,100]}]
A1777: 1774 | B1777: 4 | C1777: 10 | D1777: 0 | E1777: =R[-9]C -> 11 | F1777: =R[-9]C -> 20 | G1777: 3 | H1777: 15000 | I1777: 110003 | J1777: 3 | K1777: [{5,10},{6,15},{13,10},{14,5},{15,10},{16,5},{20,1},{27,10},{28,10}] | L1777: =R[-1]C -> [{5,1113},{6,1113},{13,18},{14,37},{15,18},{16,37},{20,3},{27,18},{28,18}] | M1777: =R[-1]C -> [{0,1,[1,30]},{1,2,[11,40]},{2,5,[21,50]},{5,10,[31,60]},{10,20,[41,60]},{30,20,[51,70]},{50,10,[61,80]},{70,5,[71,80]},{100,2,[81,90]},{150,1,[91,100]}]
A1778: 1775 | B1778: 4 | C1778: 10 | D1778: 0 | E1778: =R[-9]C -> 21 | F1778: =R[-9]C -> 30 | G1778: 3 | H1778: 15000 | I1778: 110003 | J1778: 3 | K1778: [{5,10},{6,15},{13,10},{14,5},{15,10},{16,5},{20,1},{27,10},{28,10}] | L1778: =R[-1]C -> [{5,1113},{6,1113},{13,18},{14,37},{15,18},{16,37},{20,3},{27,18},{28,18}] | M1778: =R[-1]C -> [{0,1,[1,30]},{1,2,[11,40]},{2,5,[21,50]},{5,10,[31,60]},{10,20,[41,60]},{30,20,[51,70]},{50,10,[61,80]},{70,5,[71,80]},{100,2,[81,90]},{150,1,[91,100]}]
A1779: 1776 | B1779: 4 | C1779: 10 | D1779: 0 | E1779: =R[-9]C -> 31 | F1779: =R[-9]C -> 40 | G1779: 3 | H1779: 15000 | I1779: 110003 | J1779: 3 | K1779: [{5,10},{6,15},{13,10},{14,5},{15,10},{16,5},{20,1},{27,10},{28,10}] | L1779: =R[-1]C -> [{5,1113},{6,1113},{13,18},{14,37},{15,18},{16,37},{20,3},{27,18},{28,18}] | M1779: =R[-1]C -> [{0,1,[1,30]},{1,2,[11,40]},{2,5,[21,50]},{5,10,[31,60]},{10,20,[41,60]},{30,20,[51,70]},{50,10,[61,80]},{70,5,[71,80]},{100,2,[81,90]},{150,1,[91,100]}]
A1780: 1777 | B1780: 4 | C1780: 10 | D1780: 0 | E1780: =R[-9]C -> 41 | F1780: =R[-9]C -> 50 | G1780: 3 | H1780: 15000 | I1780: 110003 | J1780: 3 | K1780: [{5,10},{6,15},{13,10},{14,5},{15,10},{16,5},{20,1},{27,10},{28,10}] | L1780: =R[-1]C -> [{5,1113},{6,1113},{13,18},{14,37},{15,18},{16,37},{20,3},{27,18},{28,18}] | M1780: =R[-1]C -> [{0,1,[1,30]},{1,2,[11,40]},{2,5,[21,50]},{5,10,[31,60]},{10,20,[41,60]},{30,20,[51,70]},{50,10,[61,80]},{70,5,[71,80]},{100,2,[81,90]},{150,1,[91,100]}]
A1781: 1778 | B1781: 4 | C1781: 10 | D1781: 0 | E1781: =R[-9]C -> 51 | F1781: =R[-9]C -> 60 | G1781: 3 | H1781: 15000 | I1781: 110003 | J1781: 3 | K1781: [{5,10},{6,15},{13,10},{14,5},{15,10},{16,5},{20,1},{27,10},{28,10}] | L1781: =R[-1]C -> [{5,1113},{6,1113},{13,18},{14,37},{15,18},{16,37},{20,3},{27,18},{28,18}] | M1781: =R[-1]C -> [{0,1,[1,30]},{1,2,[11,40]},{2,5,[21,50]},{5,10,[31,60]},{10,20,[41,60]},{30,20,[51,70]},{50,10,[61,80]},{70,5,[71,80]},{100,2,[81,90]},{150,1,[91,100]}]
A1782: 1779 | B1782: 4 | C1782: 10 | D1782: 0 | E1782: =R[-9]C -> 61 | F1782: =R[-9]C -> 70 | G1782: 3 | H1782: 15000 | I1782: 110003 | J1782: 3 | K1782: [{5,10},{6,15},{13,10},{14,5},{15,10},{16,5},{20,1},{27,10},{28,10}] | L1782: =R[-1]C -> [{5,1113},{6,1113},{13,18},{14,37},{15,18},{16,37},{20,3},{27,18},{28,18}] | M1782: =R[-1]C -> [{0,1,[1,30]},{1,2,[11,40]},{2,5,[21,50]},{5,10,[31,60]},{10,20,[41,60]},{30,20,[51,70]},{50,10,[61,80]},{70,5,[71,80]},{100,2,[81,90]},{150,1,[91,100]}]
A1783: 1780 | B1783: 4 | C1783: 10 | D1783: 0 | E1783: =R[-9]C -> 71 | F1783: =R[-9]C -> 80 | G1783: 3 | H1783: 15000 | I1783: 110003 | J1783: 3 | K1783: [{5,10},{6,15},{13,10},{14,5},{15,10},{16,5},{20,1},{27,10},{28,10}] | L1783: =R[-1]C -> [{5,1113},{6,1113},{13,18},{14,37},{15,18},{16,37},{20,3},{27,18},{28,18}] | M1783: =R[-1]C -> [{0,1,[1,30]},{1,2,[11,40]},{2,5,[21,50]},{5,10,[31,60]},{10,20,[41,60]},{30,20,[51,70]},{50,10,[61,80]},{70,5,[71,80]},{100,2,[81,90]},{150,1,[91,100]}]
A1784: 1781 | B1784: 4 | C1784: 10 | D1784: 0 | E1784: =R[-9]C -> 81 | F1784: =R[-9]C -> 90 | G1784: 3 | H1784: 15000 | I1784: 110003 | J1784: 3 | K1784: [{5,10},{6,15},{13,10},{14,5},{15,10},{16,5},{20,1},{27,10},{28,10}] | L1784: =R[-1]C -> [{5,1113},{6,1113},{13,18},{14,37},{15,18},{16,37},{20,3},{27,18},{28,18}] | M1784: =R[-1]C -> [{0,1,[1,30]},{1,2,[11,40]},{2,5,[21,50]},{5,10,[31,60]},{10,20,[41,60]},{30,20,[51,70]},{50,10,[61,80]},{70,5,[71,80]},{100,2,[81,90]},{150,1,[91,100]}]
A1785: 1782 | B1785: 5 | C1785: 10 | D1785: 0 | E1785: =R[-9]C -> 1 | F1785: =R[-9]C -> 10 | G1785: 4 | H1785: 20000 | I1785: 110003 | J1785: 4 | K1785: [{5,10},{6,15},{13,10},{14,5},{15,10},{16,5},{20,1},{27,10},{28,10}] | L1785: =R[-1]C -> [{5,1113},{6,1113},{13,18},{14,37},{15,18},{16,37},{20,3},{27,18},{28,18}] | M1785: =R[-1]C -> [{0,1,[1,30]},{1,2,[11,40]},{2,5,[21,50]},{5,10,[31,60]},{10,20,[41,60]},{30,20,[51,70]},{50,10,[61,80]},{70,5,[71,80]},{100,2,[81,90]},{150,1,[91,100]}]
A1786: 1783 | B1786: 5 | C1786: 10 | D1786: 0 | E1786: =R[-9]C -> 11 | F1786: =R[-9]C -> 20 | G1786: 4 | H1786: 20000 | I1786: 110003 | J1786: 4 | K1786: [{5,10},{6,15},{13,10},{14,5},{15,10},{16,5},{20,1},{27,10},{28,10}] | L1786: =R[-1]C -> [{5,1113},{6,1113},{13,18},{14,37},{15,18},{16,37},{20,3},{27,18},{28,18}] | M1786: =R[-1]C -> [{0,1,[1,30]},{1,2,[11,40]},{2,5,[21,50]},{5,10,[31,60]},{10,20,[41,60]},{30,20,[51,70]},{50,10,[61,80]},{70,5,[71,80]},{100,2,[81,90]},{150,1,[91,100]}]
A1787: 1784 | B1787: 5 | C1787: 10 | D1787: 0 | E1787: =R[-9]C -> 21 | F1787: =R[-9]C -> 30 | G1787: 4 | H1787: 20000 | I1787: 110003 | J1787: 4 | K1787: [{5,10},{6,15},{13,10},{14,5},{15,10},{16,5},{20,1},{27,10},{28,10}] | L1787: =R[-1]C -> [{5,1113},{6,1113},{13,18},{14,37},{15,18},{16,37},{20,3},{27,18},{28,18}] | M1787: =R[-1]C -> [{0,1,[1,30]},{1,2,[11,40]},{2,5,[21,50]},{5,10,[31,60]},{10,20,[41,60]},{30,20,[51,70]},{50,10,[61,80]},{70,5,[71,80]},{100,2,[81,90]},{150,1,[91,100]}]
A1788: 1785 | B1788: 5 | C1788: 10 | D1788: 0 | E1788: =R[-9]C -> 31 | F1788: =R[-9]C -> 40 | G1788: 4 | H1788: 20000 | I1788: 110003 | J1788: 4 | K1788: [{5,10},{6,15},{13,10},{14,5},{15,10},{16,5},{20,1},{27,10},{28,10}] | L1788: =R[-1]C -> [{5,1113},{6,1113},{13,18},{14,37},{15,18},{16,37},{20,3},{27,18},{28,18}] | M1788: =R[-1]C -> [{0,1,[1,30]},{1,2,[11,40]},{2,5,[21,50]},{5,10,[31,60]},{10,20,[41,60]},{30,20,[51,70]},{50,10,[61,80]},{70,5,[71,80]},{100,2,[81,90]},{150,1,[91,100]}]
A1789: 1786 | B1789: 5 | C1789: 10 | D1789: 0 | E1789: =R[-9]C -> 41 | F1789: =R[-9]C -> 50 | G1789: 4 | H1789: 20000 | I1789: 110003 | J1789: 4 | K1789: [{5,10},{6,15},{13,10},{14,5},{15,10},{16,5},{20,1},{27,10},{28,10}] | L1789: =R[-1]C -> [{5,1113},{6,1113},{13,18},{14,37},{15,18},{16,37},{20,3},{27,18},{28,18}] | M1789: =R[-1]C -> [{0,1,[1,30]},{1,2,[11,40]},{2,5,[21,50]},{5,10,[31,60]},{10,20,[41,60]},{30,20,[51,70]},{50,10,[61,80]},{70,5,[71,80]},{100,2,[81,90]},{150,1,[91,100]}]
A1790: 1787 | B1790: 5 | C1790: 10 | D1790: 0 | E1790: =R[-9]C -> 51 | F1790: =R[-9]C -> 60 | G1790: 4 | H1790: 20000 | I1790: 110003 | J1790: 4 | K1790: [{5,10},{6,15},{13,10},{14,5},{15,10},{16,5},{20,1},{27,10},{28,10}] | L1790: =R[-1]C -> [{5,1113},{6,1113},{13,18},{14,37},{15,18},{16,37},{20,3},{27,18},{28,18}] | M1790: =R[-1]C -> [{0,1,[1,30]},{1,2,[11,40]},{2,5,[21,50]},{5,10,[31,60]},{10,20,[41,60]},{30,20,[51,70]},{50,10,[61,80]},{70,5,[71,80]},{100,2,[81,90]},{150,1,[91,100]}]
A1791: 1788 | B1791: 5 | C1791: 10 | D1791: 0 | E1791: =R[-9]C -> 61 | F1791: =R[-9]C -> 70 | G1791: 4 | H1791: 20000 | I1791: 110003 | J1791: 4 | K1791: [{5,10},{6,15},{13,10},{14,5},{15,10},{16,5},{20,1},{27,10},{28,10}] | L1791: =R[-1]C -> [{5,1113},{6,1113},{13,18},{14,37},{15,18},{16,37},{20,3},{27,18},{28,18}] | M1791: =R[-1]C -> [{0,1,[1,30]},{1,2,[11,40]},{2,5,[21,50]},{5,10,[31,60]},{10,20,[41,60]},{30,20,[51,70]},{50,10,[61,80]},{70,5,[71,80]},{100,2,[81,90]},{150,1,[91,100]}]
A1792: 1789 | B1792: 5 | C1792: 10 | D1792: 0 | E1792: =R[-9]C -> 71 | F1792: =R[-9]C -> 80 | G1792: 4 | H1792: 20000 | I1792: 110003 | J1792: 4 | K1792: [{5,10},{6,15},{13,10},{14,5},{15,10},{16,5},{20,1},{27,10},{28,10}] | L1792: =R[-1]C -> [{5,1113},{6,1113},{13,18},{14,37},{15,18},{16,37},{20,3},{27,18},{28,18}] | M1792: =R[-1]C -> [{0,1,[1,30]},{1,2,[11,40]},{2,5,[21,50]},{5,10,[31,60]},{10,20,[41,60]},{30,20,[51,70]},{50,10,[61,80]},{70,5,[71,80]},{100,2,[81,90]},{150,1,[91,100]}]
A1793: 1790 | B1793: 5 | C1793: 10 | D1793: 0 | E1793: =R[-9]C -> 81 | F1793: =R[-9]C -> 90 | G1793: 4 | H1793: 20000 | I1793: 110003 | J1793: 4 | K1793: [{5,10},{6,15},{13,10},{14,5},{15,10},{16,5},{20,1},{27,10},{28,10}] | L1793: =R[-1]C -> [{5,1113},{6,1113},{13,18},{14,37},{15,18},{16,37},{20,3},{27,18},{28,18}] | M1793: =R[-1]C -> [{0,1,[1,30]},{1,2,[11,40]},{2,5,[21,50]},{5,10,[31,60]},{10,20,[41,60]},{30,20,[51,70]},{50,10,[61,80]},{70,5,[71,80]},{100,2,[81,90]},{150,1,[91,100]}]
A1794: 1791 | B1794: 6 | C1794: 10 | D1794: 0 | E1794: =R[-9]C -> 1 | F1794: =R[-9]C -> 10 | G1794: 5 | H1794: 20000 | I1794: 110003 | J1794: 5 | K1794: [{5,10},{6,15},{13,10},{14,5},{15,10},{16,5},{20,1},{27,10},{28,10}] | L1794: =R[-1]C -> [{5,1113},{6,1113},{13,18},{14,37},{15,18},{16,37},{20,3},{27,18},{28,18}] | M1794: =R[-1]C -> [{0,1,[1,30]},{1,2,[11,40]},{2,5,[21,50]},{5,10,[31,60]},{10,20,[41,60]},{30,20,[51,70]},{50,10,[61,80]},{70,5,[71,80]},{100,2,[81,90]},{150,1,[91,100]}]
A1795: 1792 | B1795: 6 | C1795: 10 | D1795: 0 | E1795: =R[-9]C -> 11 | F1795: =R[-9]C -> 20 | G1795: 5 | H1795: 20000 | I1795: 110003 | J1795: 5 | K1795: [{5,10},{6,15},{13,10},{14,5},{15,10},{16,5},{20,1},{27,10},{28,10}] | L1795: =R[-1]C -> [{5,1113},{6,1113},{13,18},{14,37},{15,18},{16,37},{20,3},{27,18},{28,18}] | M1795: =R[-1]C -> [{0,1,[1,30]},{1,2,[11,40]},{2,5,[21,50]},{5,10,[31,60]},{10,20,[41,60]},{30,20,[51,70]},{50,10,[61,80]},{70,5,[71,80]},{100,2,[81,90]},{150,1,[91,100]}]
A1796: 1793 | B1796: 6 | C1796: 10 | D1796: 0 | E1796: =R[-9]C -> 21 | F1796: =R[-9]C -> 30 | G1796: 5 | H1796: 20000 | I1796: 110003 | J1796: 5 | K1796: [{5,10},{6,15},{13,10},{14,5},{15,10},{16,5},{20,1},{27,10},{28,10}] | L1796: =R[-1]C -> [{5,1113},{6,1113},{13,18},{14,37},{15,18},{16,37},{20,3},{27,18},{28,18}] | M1796: =R[-1]C -> [{0,1,[1,30]},{1,2,[11,40]},{2,5,[21,50]},{5,10,[31,60]},{10,20,[41,60]},{30,20,[51,70]},{50,10,[61,80]},{70,5,[71,80]},{100,2,[81,90]},{150,1,[91,100]}]
A1797: 1794 | B1797: 6 | C1797: 10 | D1797: 0 | E1797: =R[-9]C -> 31 | F1797: =R[-9]C -> 40 | G1797: 5 | H1797: 20000 | I1797: 110003 | J1797: 5 | K1797: [{5,10},{6,15},{13,10},{14,5},{15,10},{16,5},{20,1},{27,10},{28,10}] | L1797: =R[-1]C -> [{5,1113},{6,1113},{13,18},{14,37},{15,18},{16,37},{20,3},{27,18},{28,18}] | M1797: =R[-1]C -> [{0,1,[1,30]},{1,2,[11,40]},{2,5,[21,50]},{5,10,[31,60]},{10,20,[41,60]},{30,20,[51,70]},{50,10,[61,80]},{70,5,[71,80]},{100,2,[81,90]},{150,1,[91,100]}]
A1798: 1795 | B1798: 6 | C1798: 10 | D1798: 0 | E1798: =R[-9]C -> 41 | F1798: =R[-9]C -> 50 | G1798: 5 | H1798: 20000 | I1798: 110003 | J1798: 5 | K1798: [{5,10},{6,15},{13,10},{14,5},{15,10},{16,5},{20,1},{27,10},{28,10}] | L1798: =R[-1]C -> [{5,1113},{6,1113},{13,18},{14,37},{15,18},{16,37},{20,3},{27,18},{28,18}] | M1798: =R[-1]C -> [{0,1,[1,30]},{1,2,[11,40]},{2,5,[21,50]},{5,10,[31,60]},{10,20,[41,60]},{30,20,[51,70]},{50,10,[61,80]},{70,5,[71,80]},{100,2,[81,90]},{150,1,[91,100]}]
A1799: 1796 | B1799: 6 | C1799: 10 | D1799: 0 | E1799: =R[-9]C -> 51 | F1799: =R[-9]C -> 60 | G1799: 5 | H1799: 20000 | I1799: 110003 | J1799: 5 | K1799: [{5,10},{6,15},{13,10},{14,5},{15,10},{16,5},{20,1},{27,10},{28,10}] | L1799: =R[-1]C -> [{5,1113},{6,1113},{13,18},{14,37},{15,18},{16,37},{20,3},{27,18},{28,18}] | M1799: =R[-1]C -> [{0,1,[1,30]},{1,2,[11,40]},{2,5,[21,50]},{5,10,[31,60]},{10,20,[41,60]},{30,20,[51,70]},{50,10,[61,80]},{70,5,[71,80]},{100,2,[81,90]},{150,1,[91,100]}]
A1800: 1797 | B1800: 6 | C1800: 10 | D1800: 0 | E1800: =R[-9]C -> 61 | F1800: =R[-9]C -> 70 | G1800: 5 | H1800: 20000 | I1800: 110003 | J1800: 5 | K1800: [{5,10},{6,15},{13,10},{14,5},{15,10},{16,5},{20,1},{27,10},{28,10}] | L1800: =R[-1]C -> [{5,1113},{6,1113},{13,18},{14,37},{15,18},{16,37},{20,3},{27,18},{28,18}] | M1800: =R[-1]C -> [{0,1,[1,30]},{1,2,[11,40]},{2,5,[21,50]},{5,10,[31,60]},{10,20,[41,60]},{30,20,[51,70]},{50,10,[61,80]},{70,5,[71,80]},{100,2,[81,90]},{150,1,[91,100]}]
A1801: 1798 | B1801: 6 | C1801: 10 | D1801: 0 | E1801: =R[-9]C -> 71 | F1801: =R[-9]C -> 80 | G1801: 5 | H1801: 20000 | I1801: 110003 | J1801: 5 | K1801: [{5,10},{6,15},{13,10},{14,5},{15,10},{16,5},{20,1},{27,10},{28,10}] | L1801: =R[-1]C -> [{5,1113},{6,1113},{13,18},{14,37},{15,18},{16,37},{20,3},{27,18},{28,18}] | M1801: =R[-1]C -> [{0,1,[1,30]},{1,2,[11,40]},{2,5,[21,50]},{5,10,[31,60]},{10,20,[41,60]},{30,20,[51,70]},{50,10,[61,80]},{70,5,[71,80]},{100,2,[81,90]},{150,1,[91,100]}]
A1802: 1799 | B1802: 6 | C1802: 10 | D1802: 0 | E1802: =R[-9]C -> 81 | F1802: =R[-9]C -> 90 | G1802: 5 | H1802: 20000 | I1802: 110003 | J1802: 5 | K1802: [{5,10},{6,15},{13,10},{14,5},{15,10},{16,5},{20,1},{27,10},{28,10}] | L1802: =R[-1]C -> [{5,1113},{6,1113},{13,18},{14,37},{15,18},{16,37},{20,3},{27,18},{28,18}] | M1802: =R[-1]C -> [{0,1,[1,30]},{1,2,[11,40]},{2,5,[21,50]},{5,10,[31,60]},{10,20,[41,60]},{30,20,[51,70]},{50,10,[61,80]},{70,5,[71,80]},{100,2,[81,90]},{150,1,[91,100]}]
A1803: 1800 | B1803: 2 | C1803: 21 | D1803: 0 | E1803: =R[-18]C -> 1 | F1803: =R[-18]C -> 10 | G1803: 1 | H1803: 5000 | I1803: 110003 | J1803: 1 | K1803: =配置模型!R[-1788]C[12] -> [{7,3},{8,3},{9,3},{10,3},{11,3},{12,3},{17,10},{18,8},{19,1},{23,4},{24,10}] | L1803: =配置模型!R[-1755]C[1] -> [{7,27},{8,55},{9,27},{10,55},{11,27},{12,55},{17,18},{18,110},{19,3},{23,37},{24,37}] | M1803: =R[-10]C -> [{0,1,[1,30]},{1,2,[11,40]},{2,5,[21,50]},{5,10,[31,60]},{10,20,[41,60]},{30,20,[51,70]},{50,10,[61,80]},{70,5,[71,80]},{100,2,[81,90]},{150,1,[91,100]}]
A1804: 1801 | B1804: 2 | C1804: 21 | D1804: 0 | E1804: =R[-18]C -> 11 | F1804: =R[-18]C -> 20 | G1804: 1 | H1804: 5000 | I1804: 110003 | J1804: 1 | K1804: =R[-1]C -> [{7,3},{8,3},{9,3},{10,3},{11,3},{12,3},{17,10},{18,8},{19,1},{23,4},{24,10}] | L1804: =R[-1]C -> [{7,27},{8,55},{9,27},{10,55},{11,27},{12,55},{17,18},{18,110},{19,3},{23,37},{24,37}] | M1804: =R[-1]C -> [{0,1,[1,30]},{1,2,[11,40]},{2,5,[21,50]},{5,10,[31,60]},{10,20,[41,60]},{30,20,[51,70]},{50,10,[61,80]},{70,5,[71,80]},{100,2,[81,90]},{150,1,[91,100]}]
A1805: 1802 | B1805: 2 | C1805: 21 | D1805: 0 | E1805: =R[-18]C -> 21 | F1805: =R[-18]C -> 30 | G1805: 1 | H1805: 5000 | I1805: 110003 | J1805: 1 | K1805: =R[-1]C -> [{7,3},{8,3},{9,3},{10,3},{11,3},{12,3},{17,10},{18,8},{19,1},{23,4},{24,10}] | L1805: =R[-1]C -> [{7,27},{8,55},{9,27},{10,55},{11,27},{12,55},{17,18},{18,110},{19,3},{23,37},{24,37}] | M1805: =R[-1]C -> [{0,1,[1,30]},{1,2,[11,40]},{2,5,[21,50]},{5,10,[31,60]},{10,20,[41,60]},{30,20,[51,70]},{50,10,[61,80]},{70,5,[71,80]},{100,2,[81,90]},{150,1,[91,100]}]
A1806: 1803 | B1806: 2 | C1806: 21 | D1806: 0 | E1806: =R[-18]C -> 31 | F1806: =R[-18]C -> 40 | G1806: 1 | H1806: 5000 | I1806: 110003 | J1806: 1 | K1806: =R[-1]C -> [{7,3},{8,3},{9,3},{10,3},{11,3},{12,3},{17,10},{18,8},{19,1},{23,4},{24,10}] | L1806: =R[-1]C -> [{7,27},{8,55},{9,27},{10,55},{11,27},{12,55},{17,18},{18,110},{19,3},{23,37},{24,37}] | M1806: =R[-1]C -> [{0,1,[1,30]},{1,2,[11,40]},{2,5,[21,50]},{5,10,[31,60]},{10,20,[41,60]},{30,20,[51,70]},{50,10,[61,80]},{70,5,[71,80]},{100,2,[81,90]},{150,1,[91,100]}]
A1807: 1804 | B1807: 2 | C1807: 21 | D1807: 0 | E1807: =R[-18]C -> 41 | F1807: =R[-18]C -> 50 | G1807: 1 | H1807: 5000 | I1807: 110003 | J1807: 1 | K1807: =R[-1]C -> [{7,3},{8,3},{9,3},{10,3},{11,3},{12,3},{17,10},{18,8},{19,1},{23,4},{24,10}] | L1807: =R[-1]C -> [{7,27},{8,55},{9,27},{10,55},{11,27},{12,55},{17,18},{18,110},{19,3},{23,37},{24,37}] | M1807: =R[-1]C -> [{0,1,[1,30]},{1,2,[11,40]},{2,5,[21,50]},{5,10,[31,60]},{10,20,[41,60]},{30,20,[51,70]},{50,10,[61,80]},{70,5,[71,80]},{100,2,[81,90]},{150,1,[91,100]}]
A1808: 1805 | B1808: 2 | C1808: 21 | D1808: 0 | E1808: =R[-18]C -> 51 | F1808: =R[-18]C -> 60 | G1808: 1 | H1808: 5000 | I1808: 110003 | J1808: 1 | K1808: =R[-1]C -> [{7,3},{8,3},{9,3},{10,3},{11,3},{12,3},{17,10},{18,8},{19,1},{23,4},{24,10}] | L1808: =R[-1]C -> [{7,27},{8,55},{9,27},{10,55},{11,27},{12,55},{17,18},{18,110},{19,3},{23,37},{24,37}] | M1808: =R[-1]C -> [{0,1,[1,30]},{1,2,[11,40]},{2,5,[21,50]},{5,10,[31,60]},{10,20,[41,60]},{30,20,[51,70]},{50,10,[61,80]},{70,5,[71,80]},{100,2,[81,90]},{150,1,[91,100]}]
A1809: 1806 | B1809: 2 | C1809: 21 | D1809: 0 | E1809: =R[-18]C -> 61 | F1809: =R[-18]C -> 70 | G1809: 1 | H1809: 5000 | I1809: 110003 | J1809: 1 | K1809: =R[-1]C -> [{7,3},{8,3},{9,3},{10,3},{11,3},{12,3},{17,10},{18,8},{19,1},{23,4},{24,10}] | L1809: =R[-1]C -> [{7,27},{8,55},{9,27},{10,55},{11,27},{12,55},{17,18},{18,110},{19,3},{23,37},{24,37}] | M1809: =R[-1]C -> [{0,1,[1,30]},{1,2,[11,40]},{2,5,[21,50]},{5,10,[31,60]},{10,20,[41,60]},{30,20,[51,70]},{50,10,[61,80]},{70,5,[71,80]},{100,2,[81,90]},{150,1,[91,100]}]
A1810: 1807 | B1810: 2 | C1810: 21 | D1810: 0 | E1810: =R[-18]C -> 71 | F1810: =R[-18]C -> 80 | G1810: 1 | H1810: 5000 | I1810: 110003 | J1810: 1 | K1810: =R[-1]C -> [{7,3},{8,3},{9,3},{10,3},{11,3},{12,3},{17,10},{18,8},{19,1},{23,4},{24,10}] | L1810: =R[-1]C -> [{7,27},{8,55},{9,27},{10,55},{11,27},{12,55},{17,18},{18,110},{19,3},{23,37},{24,37}] | M1810: =R[-1]C -> [{0,1,[1,30]},{1,2,[11,40]},{2,5,[21,50]},{5,10,[31,60]},{10,20,[41,60]},{30,20,[51,70]},{50,10,[61,80]},{70,5,[71,80]},{100,2,[81,90]},{150,1,[91,100]}]
A1811: 1808 | B1811: 2 | C1811: 21 | D1811: 0 | E1811: =R[-18]C -> 81 | F1811: =R[-18]C -> 90 | G1811: 1 | H1811: 5000 | I1811: 110003 | J1811: 1 | K1811: =R[-1]C -> [{7,3},{8,3},{9,3},{10,3},{11,3},{12,3},{17,10},{18,8},{19,1},{23,4},{24,10}] | L1811: =R[-1]C -> [{7,27},{8,55},{9,27},{10,55},{11,27},{12,55},{17,18},{18,110},{19,3},{23,37},{24,37}] | M1811: =R[-1]C -> [{0,1,[1,30]},{1,2,[11,40]},{2,5,[21,50]},{5,10,[31,60]},{10,20,[41,60]},{30,20,[51,70]},{50,10,[61,80]},{70,5,[71,80]},{100,2,[81,90]},{150,1,[91,100]}]
A1812: 1809 | B1812: 3 | C1812: 21 | D1812: 0 | E1812: =R[-9]C -> 1 | F1812: =R[-9]C -> 10 | G1812: 2 | H1812: 10000 | I1812: 110003 | J1812: 2 | K1812: =R[-1]C -> [{7,3},{8,3},{9,3},{10,3},{11,3},{12,3},{17,10},{18,8},{19,1},{23,4},{24,10}] | L1812: =R[-1]C -> [{7,27},{8,55},{9,27},{10,55},{11,27},{12,55},{17,18},{18,110},{19,3},{23,37},{24,37}] | M1812: =R[-1]C -> [{0,1,[1,30]},{1,2,[11,40]},{2,5,[21,50]},{5,10,[31,60]},{10,20,[41,60]},{30,20,[51,70]},{50,10,[61,80]},{70,5,[71,80]},{100,2,[81,90]},{150,1,[91,100]}]
A1813: 1810 | B1813: 3 | C1813: 21 | D1813: 0 | E1813: =R[-9]C -> 11 | F1813: =R[-9]C -> 20 | G1813: 2 | H1813: 10000 | I1813: 110003 | J1813: 2 | K1813: =R[-1]C -> [{7,3},{8,3},{9,3},{10,3},{11,3},{12,3},{17,10},{18,8},{19,1},{23,4},{24,10}] | L1813: =R[-1]C -> [{7,27},{8,55},{9,27},{10,55},{11,27},{12,55},{17,18},{18,110},{19,3},{23,37},{24,37}] | M1813: =R[-1]C -> [{0,1,[1,30]},{1,2,[11,40]},{2,5,[21,50]},{5,10,[31,60]},{10,20,[41,60]},{30,20,[51,70]},{50,10,[61,80]},{70,5,[71,80]},{100,2,[81,90]},{150,1,[91,100]}]
A1814: 1811 | B1814: 3 | C1814: 21 | D1814: 0 | E1814: =R[-9]C -> 21 | F1814: =R[-9]C -> 30 | G1814: 2 | H1814: 10000 | I1814: 110003 | J1814: 2 | K1814: =R[-1]C -> [{7,3},{8,3},{9,3},{10,3},{11,3},{12,3},{17,10},{18,8},{19,1},{23,4},{24,10}] | L1814: =R[-1]C -> [{7,27},{8,55},{9,27},{10,55},{11,27},{12,55},{17,18},{18,110},{19,3},{23,37},{24,37}] | M1814: =R[-1]C -> [{0,1,[1,30]},{1,2,[11,40]},{2,5,[21,50]},{5,10,[31,60]},{10,20,[41,60]},{30,20,[51,70]},{50,10,[61,80]},{70,5,[71,80]},{100,2,[81,90]},{150,1,[91,100]}]
A1815: 1812 | B1815: 3 | C1815: 21 | D1815: 0 | E1815: =R[-9]C -> 31 | F1815: =R[-9]C -> 40 | G1815: 2 | H1815: 10000 | I1815: 110003 | J1815: 2 | K1815: =R[-1]C -> [{7,3},{8,3},{9,3},{10,3},{11,3},{12,3},{17,10},{18,8},{19,1},{23,4},{24,10}] | L1815: =R[-1]C -> [{7,27},{8,55},{9,27},{10,55},{11,27},{12,55},{17,18},{18,110},{19,3},{23,37},{24,37}] | M1815: =R[-1]C -> [{0,1,[1,30]},{1,2,[11,40]},{2,5,[21,50]},{5,10,[31,60]},{10,20,[41,60]},{30,20,[51,70]},{50,10,[61,80]},{70,5,[71,80]},{100,2,[81,90]},{150,1,[91,100]}]
A1816: 1813 | B1816: 3 | C1816: 21 | D1816: 0 | E1816: =R[-9]C -> 41 | F1816: =R[-9]C -> 50 | G1816: 2 | H1816: 10000 | I1816: 110003 | J1816: 2 | K1816: =R[-1]C -> [{7,3},{8,3},{9,3},{10,3},{11,3},{12,3},{17,10},{18,8},{19,1},{23,4},{24,10}] | L1816: =R[-1]C -> [{7,27},{8,55},{9,27},{10,55},{11,27},{12,55},{17,18},{18,110},{19,3},{23,37},{24,37}] | M1816: =R[-1]C -> [{0,1,[1,30]},{1,2,[11,40]},{2,5,[21,50]},{5,10,[31,60]},{10,20,[41,60]},{30,20,[51,70]},{50,10,[61,80]},{70,5,[71,80]},{100,2,[81,90]},{150,1,[91,100]}]
A1817: 1814 | B1817: 3 | C1817: 21 | D1817: 0 | E1817: =R[-9]C -> 51 | F1817: =R[-9]C -> 60 | G1817: 2 | H1817: 10000 | I1817: 110003 | J1817: 2 | K1817: =R[-1]C -> [{7,3},{8,3},{9,3},{10,3},{11,3},{12,3},{17,10},{18,8},{19,1},{23,4},{24,10}] | L1817: =R[-1]C -> [{7,27},{8,55},{9,27},{10,55},{11,27},{12,55},{17,18},{18,110},{19,3},{23,37},{24,37}] | M1817: =R[-1]C -> [{0,1,[1,30]},{1,2,[11,40]},{2,5,[21,50]},{5,10,[31,60]},{10,20,[41,60]},{30,20,[51,70]},{50,10,[61,80]},{70,5,[71,80]},{100,2,[81,90]},{150,1,[91,100]}]
A1818: 1815 | B1818: 3 | C1818: 21 | D1818: 0 | E1818: =R[-9]C -> 61 | F1818: =R[-9]C -> 70 | G1818: 2 | H1818: 10000 | I1818: 110003 | J1818: 2 | K1818: =R[-1]C -> [{7,3},{8,3},{9,3},{10,3},{11,3},{12,3},{17,10},{18,8},{19,1},{23,4},{24,10}] | L1818: =R[-1]C -> [{7,27},{8,55},{9,27},{10,55},{11,27},{12,55},{17,18},{18,110},{19,3},{23,37},{24,37}] | M1818: =R[-1]C -> [{0,1,[1,30]},{1,2,[11,40]},{2,5,[21,50]},{5,10,[31,60]},{10,20,[41,60]},{30,20,[51,70]},{50,10,[61,80]},{70,5,[71,80]},{100,2,[81,90]},{150,1,[91,100]}]
A1819: 1816 | B1819: 3 | C1819: 21 | D1819: 0 | E1819: =R[-9]C -> 71 | F1819: =R[-9]C -> 80 | G1819: 2 | H1819: 10000 | I1819: 110003 | J1819: 2 | K1819: =R[-1]C -> [{7,3},{8,3},{9,3},{10,3},{11,3},{12,3},{17,10},{18,8},{19,1},{23,4},{24,10}] | L1819: =R[-1]C -> [{7,27},{8,55},{9,27},{10,55},{11,27},{12,55},{17,18},{18,110},{19,3},{23,37},{24,37}] | M1819: =R[-1]C -> [{0,1,[1,30]},{1,2,[11,40]},{2,5,[21,50]},{5,10,[31,60]},{10,20,[41,60]},{30,20,[51,70]},{50,10,[61,80]},{70,5,[71,80]},{100,2,[81,90]},{150,1,[91,100]}]
A1820: 1817 | B1820: 3 | C1820: 21 | D1820: 0 | E1820: =R[-9]C -> 81 | F1820: =R[-9]C -> 90 | G1820: 2 | H1820: 10000 | I1820: 110003 | J1820: 2 | K1820: =R[-1]C -> [{7,3},{8,3},{9,3},{10,3},{11,3},{12,3},{17,10},{18,8},{19,1},{23,4},{24,10}] | L1820: =R[-1]C -> [{7,27},{8,55},{9,27},{10,55},{11,27},{12,55},{17,18},{18,110},{19,3},{23,37},{24,37}] | M1820: =R[-1]C -> [{0,1,[1,30]},{1,2,[11,40]},{2,5,[21,50]},{5,10,[31,60]},{10,20,[41,60]},{30,20,[51,70]},{50,10,[61,80]},{70,5,[71,80]},{100,2,[81,90]},{150,1,[91,100]}]
A1821: 1818 | B1821: 4 | C1821: 21 | D1821: 0 | E1821: =R[-9]C -> 1 | F1821: =R[-9]C -> 10 | G1821: 3 | H1821: 15000 | I1821: 110003 | J1821: 3 | K1821: =R[-1]C -> [{7,3},{8,3},{9,3},{10,3},{11,3},{12,3},{17,10},{18,8},{19,1},{23,4},{24,10}] | L1821: =R[-1]C -> [{7,27},{8,55},{9,27},{10,55},{11,27},{12,55},{17,18},{18,110},{19,3},{23,37},{24,37}] | M1821: =R[-1]C -> [{0,1,[1,30]},{1,2,[11,40]},{2,5,[21,50]},{5,10,[31,60]},{10,20,[41,60]},{30,20,[51,70]},{50,10,[61,80]},{70,5,[71,80]},{100,2,[81,90]},{150,1,[91,100]}]
A1822: 1819 | B1822: 4 | C1822: 21 | D1822: 0 | E1822: =R[-9]C -> 11 | F1822: =R[-9]C -> 20 | G1822: 3 | H1822: 15000 | I1822: 110003 | J1822: 3 | K1822: =R[-1]C -> [{7,3},{8,3},{9,3},{10,3},{11,3},{12,3},{17,10},{18,8},{19,1},{23,4},{24,10}] | L1822: =R[-1]C -> [{7,27},{8,55},{9,27},{10,55},{11,27},{12,55},{17,18},{18,110},{19,3},{23,37},{24,37}] | M1822: =R[-1]C -> [{0,1,[1,30]},{1,2,[11,40]},{2,5,[21,50]},{5,10,[31,60]},{10,20,[41,60]},{30,20,[51,70]},{50,10,[61,80]},{70,5,[71,80]},{100,2,[81,90]},{150,1,[91,100]}]
A1823: 1820 | B1823: 4 | C1823: 21 | D1823: 0 | E1823: =R[-9]C -> 21 | F1823: =R[-9]C -> 30 | G1823: 3 | H1823: 15000 | I1823: 110003 | J1823: 3 | K1823: =R[-1]C -> [{7,3},{8,3},{9,3},{10,3},{11,3},{12,3},{17,10},{18,8},{19,1},{23,4},{24,10}] | L1823: =R[-1]C -> [{7,27},{8,55},{9,27},{10,55},{11,27},{12,55},{17,18},{18,110},{19,3},{23,37},{24,37}] | M1823: =R[-1]C -> [{0,1,[1,30]},{1,2,[11,40]},{2,5,[21,50]},{5,10,[31,60]},{10,20,[41,60]},{30,20,[51,70]},{50,10,[61,80]},{70,5,[71,80]},{100,2,[81,90]},{150,1,[91,100]}]
A1824: 1821 | B1824: 4 | C1824: 21 | D1824: 0 | E1824: =R[-9]C -> 31 | F1824: =R[-9]C -> 40 | G1824: 3 | H1824: 15000 | I1824: 110003 | J1824: 3 | K1824: =R[-1]C -> [{7,3},{8,3},{9,3},{10,3},{11,3},{12,3},{17,10},{18,8},{19,1},{23,4},{24,10}] | L1824: =R[-1]C -> [{7,27},{8,55},{9,27},{10,55},{11,27},{12,55},{17,18},{18,110},{19,3},{23,37},{24,37}] | M1824: =R[-1]C -> [{0,1,[1,30]},{1,2,[11,40]},{2,5,[21,50]},{5,10,[31,60]},{10,20,[41,60]},{30,20,[51,70]},{50,10,[61,80]},{70,5,[71,80]},{100,2,[81,90]},{150,1,[91,100]}]
A1825: 1822 | B1825: 4 | C1825: 21 | D1825: 0 | E1825: =R[-9]C -> 41 | F1825: =R[-9]C -> 50 | G1825: 3 | H1825: 15000 | I1825: 110003 | J1825: 3 | K1825: =R[-1]C -> [{7,3},{8,3},{9,3},{10,3},{11,3},{12,3},{17,10},{18,8},{19,1},{23,4},{24,10}] | L1825: =R[-1]C -> [{7,27},{8,55},{9,27},{10,55},{11,27},{12,55},{17,18},{18,110},{19,3},{23,37},{24,37}] | M1825: =R[-1]C -> [{0,1,[1,30]},{1,2,[11,40]},{2,5,[21,50]},{5,10,[31,60]},{10,20,[41,60]},{30,20,[51,70]},{50,10,[61,80]},{70,5,[71,80]},{100,2,[81,90]},{150,1,[91,100]}]
A1826: 1823 | B1826: 4 | C1826: 21 | D1826: 0 | E1826: =R[-9]C -> 51 | F1826: =R[-9]C -> 60 | G1826: 3 | H1826: 15000 | I1826: 110003 | J1826: 3 | K1826: =R[-1]C -> [{7,3},{8,3},{9,3},{10,3},{11,3},{12,3},{17,10},{18,8},{19,1},{23,4},{24,10}] | L1826: =R[-1]C -> [{7,27},{8,55},{9,27},{10,55},{11,27},{12,55},{17,18},{18,110},{19,3},{23,37},{24,37}] | M1826: =R[-1]C -> [{0,1,[1,30]},{1,2,[11,40]},{2,5,[21,50]},{5,10,[31,60]},{10,20,[41,60]},{30,20,[51,70]},{50,10,[61,80]},{70,5,[71,80]},{100,2,[81,90]},{150,1,[91,100]}]
A1827: 1824 | B1827: 4 | C1827: 21 | D1827: 0 | E1827: =R[-9]C -> 61 | F1827: =R[-9]C -> 70 | G1827: 3 | H1827: 15000 | I1827: 110003 | J1827: 3 | K1827: =R[-1]C -> [{7,3},{8,3},{9,3},{10,3},{11,3},{12,3},{17,10},{18,8},{19,1},{23,4},{24,10}] | L1827: =R[-1]C -> [{7,27},{8,55},{9,27},{10,55},{11,27},{12,55},{17,18},{18,110},{19,3},{23,37},{24,37}] | M1827: =R[-1]C -> [{0,1,[1,30]},{1,2,[11,40]},{2,5,[21,50]},{5,10,[31,60]},{10,20,[41,60]},{30,20,[51,70]},{50,10,[61,80]},{70,5,[71,80]},{100,2,[81,90]},{150,1,[91,100]}]
A1828: 1825 | B1828: 4 | C1828: 21 | D1828: 0 | E1828: =R[-9]C -> 71 | F1828: =R[-9]C -> 80 | G1828: 3 | H1828: 15000 | I1828: 110003 | J1828: 3 | K1828: =R[-1]C -> [{7,3},{8,3},{9,3},{10,3},{11,3},{12,3},{17,10},{18,8},{19,1},{23,4},{24,10}] | L1828: =R[-1]C -> [{7,27},{8,55},{9,27},{10,55},{11,27},{12,55},{17,18},{18,110},{19,3},{23,37},{24,37}] | M1828: =R[-1]C -> [{0,1,[1,30]},{1,2,[11,40]},{2,5,[21,50]},{5,10,[31,60]},{10,20,[41,60]},{30,20,[51,70]},{50,10,[61,80]},{70,5,[71,80]},{100,2,[81,90]},{150,1,[91,100]}]
A1829: 1826 | B1829: 4 | C1829: 21 | D1829: 0 | E1829: =R[-9]C -> 81 | F1829: =R[-9]C -> 90 | G1829: 3 | H1829: 15000 | I1829: 110003 | J1829: 3 | K1829: =R[-1]C -> [{7,3},{8,3},{9,3},{10,3},{11,3},{12,3},{17,10},{18,8},{19,1},{23,4},{24,10}] | L1829: =R[-1]C -> [{7,27},{8,55},{9,27},{10,55},{11,27},{12,55},{17,18},{18,110},{19,3},{23,37},{24,37}] | M1829: =R[-1]C -> [{0,1,[1,30]},{1,2,[11,40]},{2,5,[21,50]},{5,10,[31,60]},{10,20,[41,60]},{30,20,[51,70]},{50,10,[61,80]},{70,5,[71,80]},{100,2,[81,90]},{150,1,[91,100]}]
A1830: 1827 | B1830: 5 | C1830: 21 | D1830: 0 | E1830: =R[-9]C -> 1 | F1830: =R[-9]C -> 10 | G1830: 4 | H1830: 20000 | I1830: 110003 | J1830: 4 | K1830: =R[-1]C -> [{7,3},{8,3},{9,3},{10,3},{11,3},{12,3},{17,10},{18,8},{19,1},{23,4},{24,10}] | L1830: =R[-1]C -> [{7,27},{8,55},{9,27},{10,55},{11,27},{12,55},{17,18},{18,110},{19,3},{23,37},{24,37}] | M1830: =R[-1]C -> [{0,1,[1,30]},{1,2,[11,40]},{2,5,[21,50]},{5,10,[31,60]},{10,20,[41,60]},{30,20,[51,70]},{50,10,[61,80]},{70,5,[71,80]},{100,2,[81,90]},{150,1,[91,100]}]
A1831: 1828 | B1831: 5 | C1831: 21 | D1831: 0 | E1831: =R[-9]C -> 11 | F1831: =R[-9]C -> 20 | G1831: 4 | H1831: 20000 | I1831: 110003 | J1831: 4 | K1831: =R[-1]C -> [{7,3},{8,3},{9,3},{10,3},{11,3},{12,3},{17,10},{18,8},{19,1},{23,4},{24,10}] | L1831: =R[-1]C -> [{7,27},{8,55},{9,27},{10,55},{11,27},{12,55},{17,18},{18,110},{19,3},{23,37},{24,37}] | M1831: =R[-1]C -> [{0,1,[1,30]},{1,2,[11,40]},{2,5,[21,50]},{5,10,[31,60]},{10,20,[41,60]},{30,20,[51,70]},{50,10,[61,80]},{70,5,[71,80]},{100,2,[81,90]},{150,1,[91,100]}]
A1832: 1829 | B1832: 5 | C1832: 21 | D1832: 0 | E1832: =R[-9]C -> 21 | F1832: =R[-9]C -> 30 | G1832: 4 | H1832: 20000 | I1832: 110003 | J1832: 4 | K1832: =R[-1]C -> [{7,3},{8,3},{9,3},{10,3},{11,3},{12,3},{17,10},{18,8},{19,1},{23,4},{24,10}] | L1832: =R[-1]C -> [{7,27},{8,55},{9,27},{10,55},{11,27},{12,55},{17,18},{18,110},{19,3},{23,37},{24,37}] | M1832: =R[-1]C -> [{0,1,[1,30]},{1,2,[11,40]},{2,5,[21,50]},{5,10,[31,60]},{10,20,[41,60]},{30,20,[51,70]},{50,10,[61,80]},{70,5,[71,80]},{100,2,[81,90]},{150,1,[91,100]}]
A1833: 1830 | B1833: 5 | C1833: 21 | D1833: 0 | E1833: =R[-9]C -> 31 | F1833: =R[-9]C -> 40 | G1833: 4 | H1833: 20000 | I1833: 110003 | J1833: 4 | K1833: =R[-1]C -> [{7,3},{8,3},{9,3},{10,3},{11,3},{12,3},{17,10},{18,8},{19,1},{23,4},{24,10}] | L1833: =R[-1]C -> [{7,27},{8,55},{9,27},{10,55},{11,27},{12,55},{17,18},{18,110},{19,3},{23,37},{24,37}] | M1833: =R[-1]C -> [{0,1,[1,30]},{1,2,[11,40]},{2,5,[21,50]},{5,10,[31,60]},{10,20,[41,60]},{30,20,[51,70]},{50,10,[61,80]},{70,5,[71,80]},{100,2,[81,90]},{150,1,[91,100]}]
A1834: 1831 | B1834: 5 | C1834: 21 | D1834: 0 | E1834: =R[-9]C -> 41 | F1834: =R[-9]C -> 50 | G1834: 4 | H1834: 20000 | I1834: 110003 | J1834: 4 | K1834: =R[-1]C -> [{7,3},{8,3},{9,3},{10,3},{11,3},{12,3},{17,10},{18,8},{19,1},{23,4},{24,10}] | L1834: =R[-1]C -> [{7,27},{8,55},{9,27},{10,55},{11,27},{12,55},{17,18},{18,110},{19,3},{23,37},{24,37}] | M1834: =R[-1]C -> [{0,1,[1,30]},{1,2,[11,40]},{2,5,[21,50]},{5,10,[31,60]},{10,20,[41,60]},{30,20,[51,70]},{50,10,[61,80]},{70,5,[71,80]},{100,2,[81,90]},{150,1,[91,100]}]
A1835: 1832 | B1835: 5 | C1835: 21 | D1835: 0 | E1835: =R[-9]C -> 51 | F1835: =R[-9]C -> 60 | G1835: 4 | H1835: 20000 | I1835: 110003 | J1835: 4 | K1835: =R[-1]C -> [{7,3},{8,3},{9,3},{10,3},{11,3},{12,3},{17,10},{18,8},{19,1},{23,4},{24,10}] | L1835: =R[-1]C -> [{7,27},{8,55},{9,27},{10,55},{11,27},{12,55},{17,18},{18,110},{19,3},{23,37},{24,37}] | M1835: =R[-1]C -> [{0,1,[1,30]},{1,2,[11,40]},{2,5,[21,50]},{5,10,[31,60]},{10,20,[41,60]},{30,20,[51,70]},{50,10,[61,80]},{70,5,[71,80]},{100,2,[81,90]},{150,1,[91,100]}]
A1836: 1833 | B1836: 5 | C1836: 21 | D1836: 0 | E1836: =R[-9]C -> 61 | F1836: =R[-9]C -> 70 | G1836: 4 | H1836: 20000 | I1836: 110003 | J1836: 4 | K1836: =R[-1]C -> [{7,3},{8,3},{9,3},{10,3},{11,3},{12,3},{17,10},{18,8},{19,1},{23,4},{24,10}] | L1836: =R[-1]C -> [{7,27},{8,55},{9,27},{10,55},{11,27},{12,55},{17,18},{18,110},{19,3},{23,37},{24,37}] | M1836: =R[-1]C -> [{0,1,[1,30]},{1,2,[11,40]},{2,5,[21,50]},{5,10,[31,60]},{10,20,[41,60]},{30,20,[51,70]},{50,10,[61,80]},{70,5,[71,80]},{100,2,[81,90]},{150,1,[91,100]}]
A1837: 1834 | B1837: 5 | C1837: 21 | D1837: 0 | E1837: =R[-9]C -> 71 | F1837: =R[-9]C -> 80 | G1837: 4 | H1837: 20000 | I1837: 110003 | J1837: 4 | K1837: =R[-1]C -> [{7,3},{8,3},{9,3},{10,3},{11,3},{12,3},{17,10},{18,8},{19,1},{23,4},{24,10}] | L1837: =R[-1]C -> [{7,27},{8,55},{9,27},{10,55},{11,27},{12,55},{17,18},{18,110},{19,3},{23,37},{24,37}] | M1837: =R[-1]C -> [{0,1,[1,30]},{1,2,[11,40]},{2,5,[21,50]},{5,10,[31,60]},{10,20,[41,60]},{30,20,[51,70]},{50,10,[61,80]},{70,5,[71,80]},{100,2,[81,90]},{150,1,[91,100]}]
A1838: 1835 | B1838: 5 | C1838: 21 | D1838: 0 | E1838: =R[-9]C -> 81 | F1838: =R[-9]C -> 90 | G1838: 4 | H1838: 20000 | I1838: 110003 | J1838: 4 | K1838: =R[-1]C -> [{7,3},{8,3},{9,3},{10,3},{11,3},{12,3},{17,10},{18,8},{19,1},{23,4},{24,10}] | L1838: =R[-1]C -> [{7,27},{8,55},{9,27},{10,55},{11,27},{12,55},{17,18},{18,110},{19,3},{23,37},{24,37}] | M1838: =R[-1]C -> [{0,1,[1,30]},{1,2,[11,40]},{2,5,[21,50]},{5,10,[31,60]},{10,20,[41,60]},{30,20,[51,70]},{50,10,[61,80]},{70,5,[71,80]},{100,2,[81,90]},{150,1,[91,100]}]
A1839: 1836 | B1839: 6 | C1839: 21 | D1839: 0 | E1839: =R[-9]C -> 1 | F1839: =R[-9]C -> 10 | G1839: 5 | H1839: 20000 | I1839: 110003 | J1839: 5 | K1839: =R[-1]C -> [{7,3},{8,3},{9,3},{10,3},{11,3},{12,3},{17,10},{18,8},{19,1},{23,4},{24,10}] | L1839: =R[-1]C -> [{7,27},{8,55},{9,27},{10,55},{11,27},{12,55},{17,18},{18,110},{19,3},{23,37},{24,37}] | M1839: =R[-1]C -> [{0,1,[1,30]},{1,2,[11,40]},{2,5,[21,50]},{5,10,[31,60]},{10,20,[41,60]},{30,20,[51,70]},{50,10,[61,80]},{70,5,[71,80]},{100,2,[81,90]},{150,1,[91,100]}]
A1840: 1837 | B1840: 6 | C1840: 21 | D1840: 0 | E1840: =R[-9]C -> 11 | F1840: =R[-9]C -> 20 | G1840: 5 | H1840: 20000 | I1840: 110003 | J1840: 5 | K1840: =R[-1]C -> [{7,3},{8,3},{9,3},{10,3},{11,3},{12,3},{17,10},{18,8},{19,1},{23,4},{24,10}] | L1840: =R[-1]C -> [{7,27},{8,55},{9,27},{10,55},{11,27},{12,55},{17,18},{18,110},{19,3},{23,37},{24,37}] | M1840: =R[-1]C -> [{0,1,[1,30]},{1,2,[11,40]},{2,5,[21,50]},{5,10,[31,60]},{10,20,[41,60]},{30,20,[51,70]},{50,10,[61,80]},{70,5,[71,80]},{100,2,[81,90]},{150,1,[91,100]}]
A1841: 1838 | B1841: 6 | C1841: 21 | D1841: 0 | E1841: =R[-9]C -> 21 | F1841: =R[-9]C -> 30 | G1841: 5 | H1841: 20000 | I1841: 110003 | J1841: 5 | K1841: =R[-1]C -> [{7,3},{8,3},{9,3},{10,3},{11,3},{12,3},{17,10},{18,8},{19,1},{23,4},{24,10}] | L1841: =R[-1]C -> [{7,27},{8,55},{9,27},{10,55},{11,27},{12,55},{17,18},{18,110},{19,3},{23,37},{24,37}] | M1841: =R[-1]C -> [{0,1,[1,30]},{1,2,[11,40]},{2,5,[21,50]},{5,10,[31,60]},{10,20,[41,60]},{30,20,[51,70]},{50,10,[61,80]},{70,5,[71,80]},{100,2,[81,90]},{150,1,[91,100]}]
A1842: 1839 | B1842: 6 | C1842: 21 | D1842: 0 | E1842: =R[-9]C -> 31 | F1842: =R[-9]C -> 40 | G1842: 5 | H1842: 20000 | I1842: 110003 | J1842: 5 | K1842: =R[-1]C -> [{7,3},{8,3},{9,3},{10,3},{11,3},{12,3},{17,10},{18,8},{19,1},{23,4},{24,10}] | L1842: =R[-1]C -> [{7,27},{8,55},{9,27},{10,55},{11,27},{12,55},{17,18},{18,110},{19,3},{23,37},{24,37}] | M1842: =R[-1]C -> [{0,1,[1,30]},{1,2,[11,40]},{2,5,[21,50]},{5,10,[31,60]},{10,20,[41,60]},{30,20,[51,70]},{50,10,[61,80]},{70,5,[71,80]},{100,2,[81,90]},{150,1,[91,100]}]
A1843: 1840 | B1843: 6 | C1843: 21 | D1843: 0 | E1843: =R[-9]C -> 41 | F1843: =R[-9]C -> 50 | G1843: 5 | H1843: 20000 | I1843: 110003 | J1843: 5 | K1843: =R[-1]C -> [{7,3},{8,3},{9,3},{10,3},{11,3},{12,3},{17,10},{18,8},{19,1},{23,4},{24,10}] | L1843: =R[-1]C -> [{7,27},{8,55},{9,27},{10,55},{11,27},{12,55},{17,18},{18,110},{19,3},{23,37},{24,37}] | M1843: =R[-1]C -> [{0,1,[1,30]},{1,2,[11,40]},{2,5,[21,50]},{5,10,[31,60]},{10,20,[41,60]},{30,20,[51,70]},{50,10,[61,80]},{70,5,[71,80]},{100,2,[81,90]},{150,1,[91,100]}]
A1844: 1841 | B1844: 6 | C1844: 21 | D1844: 0 | E1844: =R[-9]C -> 51 | F1844: =R[-9]C -> 60 | G1844: 5 | H1844: 20000 | I1844: 110003 | J1844: 5 | K1844: =R[-1]C -> [{7,3},{8,3},{9,3},{10,3},{11,3},{12,3},{17,10},{18,8},{19,1},{23,4},{24,10}] | L1844: =R[-1]C -> [{7,27},{8,55},{9,27},{10,55},{11,27},{12,55},{17,18},{18,110},{19,3},{23,37},{24,37}] | M1844: =R[-1]C -> [{0,1,[1,30]},{1,2,[11,40]},{2,5,[21,50]},{5,10,[31,60]},{10,20,[41,60]},{30,20,[51,70]},{50,10,[61,80]},{70,5,[71,80]},{100,2,[81,90]},{150,1,[91,100]}]
A1845: 1842 | B1845: 6 | C1845: 21 | D1845: 0 | E1845: =R[-9]C -> 61 | F1845: =R[-9]C -> 70 | G1845: 5 | H1845: 20000 | I1845: 110003 | J1845: 5 | K1845: =R[-1]C -> [{7,3},{8,3},{9,3},{10,3},{11,3},{12,3},{17,10},{18,8},{19,1},{23,4},{24,10}] | L1845: =R[-1]C -> [{7,27},{8,55},{9,27},{10,55},{11,27},{12,55},{17,18},{18,110},{19,3},{23,37},{24,37}] | M1845: =R[-1]C -> [{0,1,[1,30]},{1,2,[11,40]},{2,5,[21,50]},{5,10,[31,60]},{10,20,[41,60]},{30,20,[51,70]},{50,10,[61,80]},{70,5,[71,80]},{100,2,[81,90]},{150,1,[91,100]}]
A1846: 1843 | B1846: 6 | C1846: 21 | D1846: 0 | E1846: =R[-9]C -> 71 | F1846: =R[-9]C -> 80 | G1846: 5 | H1846: 20000 | I1846: 110003 | J1846: 5 | K1846: =R[-1]C -> [{7,3},{8,3},{9,3},{10,3},{11,3},{12,3},{17,10},{18,8},{19,1},{23,4},{24,10}] | L1846: =R[-1]C -> [{7,27},{8,55},{9,27},{10,55},{11,27},{12,55},{17,18},{18,110},{19,3},{23,37},{24,37}] | M1846: =R[-1]C -> [{0,1,[1,30]},{1,2,[11,40]},{2,5,[21,50]},{5,10,[31,60]},{10,20,[41,60]},{30,20,[51,70]},{50,10,[61,80]},{70,5,[71,80]},{100,2,[81,90]},{150,1,[91,100]}]
A1847: 1844 | B1847: 6 | C1847: 21 | D1847: 0 | E1847: =R[-9]C -> 81 | F1847: =R[-9]C -> 90 | G1847: 5 | H1847: 20000 | I1847: 110003 | J1847: 5 | K1847: =R[-1]C -> [{7,3},{8,3},{9,3},{10,3},{11,3},{12,3},{17,10},{18,8},{19,1},{23,4},{24,10}] | L1847: =R[-1]C -> [{7,27},{8,55},{9,27},{10,55},{11,27},{12,55},{17,18},{18,110},{19,3},{23,37},{24,37}] | M1847: =R[-1]C -> [{0,1,[1,30]},{1,2,[11,40]},{2,5,[21,50]},{5,10,[31,60]},{10,20,[41,60]},{30,20,[51,70]},{50,10,[61,80]},{70,5,[71,80]},{100,2,[81,90]},{150,1,[91,100]}]
A1848: 1845 | B1848: 2 | C1848: 29 | D1848: 0 | E1848: =R[-18]C -> 1 | F1848: =R[-18]C -> 10 | G1848: 1 | H1848: 5000 | I1848: 110003 | J1848: 1 | K1848: =R[-1]C -> [{7,3},{8,3},{9,3},{10,3},{11,3},{12,3},{17,10},{18,8},{19,1},{23,4},{24,10}] | L1848: =R[-1]C -> [{7,27},{8,55},{9,27},{10,55},{11,27},{12,55},{17,18},{18,110},{19,3},{23,37},{24,37}] | M1848: =R[-1]C -> [{0,1,[1,30]},{1,2,[11,40]},{2,5,[21,50]},{5,10,[31,60]},{10,20,[41,60]},{30,20,[51,70]},{50,10,[61,80]},{70,5,[71,80]},{100,2,[81,90]},{150,1,[91,100]}]
A1849: 1846 | B1849: 2 | C1849: 29 | D1849: 0 | E1849: =R[-18]C -> 11 | F1849: =R[-18]C -> 20 | G1849: 1 | H1849: 5000 | I1849: 110003 | J1849: 1 | K1849: =R[-1]C -> [{7,3},{8,3},{9,3},{10,3},{11,3},{12,3},{17,10},{18,8},{19,1},{23,4},{24,10}] | L1849: =R[-1]C -> [{7,27},{8,55},{9,27},{10,55},{11,27},{12,55},{17,18},{18,110},{19,3},{23,37},{24,37}] | M1849: =R[-1]C -> [{0,1,[1,30]},{1,2,[11,40]},{2,5,[21,50]},{5,10,[31,60]},{10,20,[41,60]},{30,20,[51,70]},{50,10,[61,80]},{70,5,[71,80]},{100,2,[81,90]},{150,1,[91,100]}]
A1850: 1847 | B1850: 2 | C1850: 29 | D1850: 0 | E1850: =R[-18]C -> 21 | F1850: =R[-18]C -> 30 | G1850: 1 | H1850: 5000 | I1850: 110003 | J1850: 1 | K1850: =R[-1]C -> [{7,3},{8,3},{9,3},{10,3},{11,3},{12,3},{17,10},{18,8},{19,1},{23,4},{24,10}] | L1850: =R[-1]C -> [{7,27},{8,55},{9,27},{10,55},{11,27},{12,55},{17,18},{18,110},{19,3},{23,37},{24,37}] | M1850: =R[-1]C -> [{0,1,[1,30]},{1,2,[11,40]},{2,5,[21,50]},{5,10,[31,60]},{10,20,[41,60]},{30,20,[51,70]},{50,10,[61,80]},{70,5,[71,80]},{100,2,[81,90]},{150,1,[91,100]}]
A1851: 1848 | B1851: 2 | C1851: 29 | D1851: 0 | E1851: =R[-18]C -> 31 | F1851: =R[-18]C -> 40 | G1851: 1 | H1851: 5000 | I1851: 110003 | J1851: 1 | K1851: =R[-1]C -> [{7,3},{8,3},{9,3},{10,3},{11,3},{12,3},{17,10},{18,8},{19,1},{23,4},{24,10}] | L1851: =R[-1]C -> [{7,27},{8,55},{9,27},{10,55},{11,27},{12,55},{17,18},{18,110},{19,3},{23,37},{24,37}] | M1851: =R[-1]C -> [{0,1,[1,30]},{1,2,[11,40]},{2,5,[21,50]},{5,10,[31,60]},{10,20,[41,60]},{30,20,[51,70]},{50,10,[61,80]},{70,5,[71,80]},{100,2,[81,90]},{150,1,[91,100]}]
A1852: 1849 | B1852: 2 | C1852: 29 | D1852: 0 | E1852: =R[-18]C -> 41 | F1852: =R[-18]C -> 50 | G1852: 1 | H1852: 5000 | I1852: 110003 | J1852: 1 | K1852: =R[-1]C -> [{7,3},{8,3},{9,3},{10,3},{11,3},{12,3},{17,10},{18,8},{19,1},{23,4},{24,10}] | L1852: =R[-1]C -> [{7,27},{8,55},{9,27},{10,55},{11,27},{12,55},{17,18},{18,110},{19,3},{23,37},{24,37}] | M1852: =R[-1]C -> [{0,1,[1,30]},{1,2,[11,40]},{2,5,[21,50]},{5,10,[31,60]},{10,20,[41,60]},{30,20,[51,70]},{50,10,[61,80]},{70,5,[71,80]},{100,2,[81,90]},{150,1,[91,100]}]
A1853: 1850 | B1853: 2 | C1853: 29 | D1853: 0 | E1853: =R[-18]C -> 51 | F1853: =R[-18]C -> 60 | G1853: 1 | H1853: 5000 | I1853: 110003 | J1853: 1 | K1853: =R[-1]C -> [{7,3},{8,3},{9,3},{10,3},{11,3},{12,3},{17,10},{18,8},{19,1},{23,4},{24,10}] | L1853: =R[-1]C -> [{7,27},{8,55},{9,27},{10,55},{11,27},{12,55},{17,18},{18,110},{19,3},{23,37},{24,37}] | M1853: =R[-1]C -> [{0,1,[1,30]},{1,2,[11,40]},{2,5,[21,50]},{5,10,[31,60]},{10,20,[41,60]},{30,20,[51,70]},{50,10,[61,80]},{70,5,[71,80]},{100,2,[81,90]},{150,1,[91,100]}]
A1854: 1851 | B1854: 2 | C1854: 29 | D1854: 0 | E1854: =R[-18]C -> 61 | F1854: =R[-18]C -> 70 | G1854: 1 | H1854: 5000 | I1854: 110003 | J1854: 1 | K1854: =R[-1]C -> [{7,3},{8,3},{9,3},{10,3},{11,3},{12,3},{17,10},{18,8},{19,1},{23,4},{24,10}] | L1854: =R[-1]C -> [{7,27},{8,55},{9,27},{10,55},{11,27},{12,55},{17,18},{18,110},{19,3},{23,37},{24,37}] | M1854: =R[-1]C -> [{0,1,[1,30]},{1,2,[11,40]},{2,5,[21,50]},{5,10,[31,60]},{10,20,[41,60]},{30,20,[51,70]},{50,10,[61,80]},{70,5,[71,80]},{100,2,[81,90]},{150,1,[91,100]}]
A1855: 1852 | B1855: 2 | C1855: 29 | D1855: 0 | E1855: =R[-18]C -> 71 | F1855: =R[-18]C -> 80 | G1855: 1 | H1855: 5000 | I1855: 110003 | J1855: 1 | K1855: =R[-1]C -> [{7,3},{8,3},{9,3},{10,3},{11,3},{12,3},{17,10},{18,8},{19,1},{23,4},{24,10}] | L1855: =R[-1]C -> [{7,27},{8,55},{9,27},{10,55},{11,27},{12,55},{17,18},{18,110},{19,3},{23,37},{24,37}] | M1855: =R[-1]C -> [{0,1,[1,30]},{1,2,[11,40]},{2,5,[21,50]},{5,10,[31,60]},{10,20,[41,60]},{30,20,[51,70]},{50,10,[61,80]},{70,5,[71,80]},{100,2,[81,90]},{150,1,[91,100]}]
A1856: 1853 | B1856: 2 | C1856: 29 | D1856: 0 | E1856: =R[-18]C -> 81 | F1856: =R[-18]C -> 90 | G1856: 1 | H1856: 5000 | I1856: 110003 | J1856: 1 | K1856: =R[-1]C -> [{7,3},{8,3},{9,3},{10,3},{11,3},{12,3},{17,10},{18,8},{19,1},{23,4},{24,10}] | L1856: =R[-1]C -> [{7,27},{8,55},{9,27},{10,55},{11,27},{12,55},{17,18},{18,110},{19,3},{23,37},{24,37}] | M1856: =R[-1]C -> [{0,1,[1,30]},{1,2,[11,40]},{2,5,[21,50]},{5,10,[31,60]},{10,20,[41,60]},{30,20,[51,70]},{50,10,[61,80]},{70,5,[71,80]},{100,2,[81,90]},{150,1,[91,100]}]
A1857: 1854 | B1857: 3 | C1857: 29 | D1857: 0 | E1857: =R[-9]C -> 1 | F1857: =R[-9]C -> 10 | G1857: 2 | H1857: 10000 | I1857: 110003 | J1857: 2 | K1857: =R[-1]C -> [{7,3},{8,3},{9,3},{10,3},{11,3},{12,3},{17,10},{18,8},{19,1},{23,4},{24,10}] | L1857: =R[-1]C -> [{7,27},{8,55},{9,27},{10,55},{11,27},{12,55},{17,18},{18,110},{19,3},{23,37},{24,37}] | M1857: =R[-1]C -> [{0,1,[1,30]},{1,2,[11,40]},{2,5,[21,50]},{5,10,[31,60]},{10,20,[41,60]},{30,20,[51,70]},{50,10,[61,80]},{70,5,[71,80]},{100,2,[81,90]},{150,1,[91,100]}]
A1858: 1855 | B1858: 3 | C1858: 29 | D1858: 0 | E1858: =R[-9]C -> 11 | F1858: =R[-9]C -> 20 | G1858: 2 | H1858: 10000 | I1858: 110003 | J1858: 2 | K1858: =R[-1]C -> [{7,3},{8,3},{9,3},{10,3},{11,3},{12,3},{17,10},{18,8},{19,1},{23,4},{24,10}] | L1858: =R[-1]C -> [{7,27},{8,55},{9,27},{10,55},{11,27},{12,55},{17,18},{18,110},{19,3},{23,37},{24,37}] | M1858: =R[-1]C -> [{0,1,[1,30]},{1,2,[11,40]},{2,5,[21,50]},{5,10,[31,60]},{10,20,[41,60]},{30,20,[51,70]},{50,10,[61,80]},{70,5,[71,80]},{100,2,[81,90]},{150,1,[91,100]}]
A1859: 1856 | B1859: 3 | C1859: 29 | D1859: 0 | E1859: =R[-9]C -> 21 | F1859: =R[-9]C -> 30 | G1859: 2 | H1859: 10000 | I1859: 110003 | J1859: 2 | K1859: =R[-1]C -> [{7,3},{8,3},{9,3},{10,3},{11,3},{12,3},{17,10},{18,8},{19,1},{23,4},{24,10}] | L1859: =R[-1]C -> [{7,27},{8,55},{9,27},{10,55},{11,27},{12,55},{17,18},{18,110},{19,3},{23,37},{24,37}] | M1859: =R[-1]C -> [{0,1,[1,30]},{1,2,[11,40]},{2,5,[21,50]},{5,10,[31,60]},{10,20,[41,60]},{30,20,[51,70]},{50,10,[61,80]},{70,5,[71,80]},{100,2,[81,90]},{150,1,[91,100]}]
A1860: 1857 | B1860: 3 | C1860: 29 | D1860: 0 | E1860: =R[-9]C -> 31 | F1860: =R[-9]C -> 40 | G1860: 2 | H1860: 10000 | I1860: 110003 | J1860: 2 | K1860: =R[-1]C -> [{7,3},{8,3},{9,3},{10,3},{11,3},{12,3},{17,10},{18,8},{19,1},{23,4},{24,10}] | L1860: =R[-1]C -> [{7,27},{8,55},{9,27},{10,55},{11,27},{12,55},{17,18},{18,110},{19,3},{23,37},{24,37}] | M1860: =R[-1]C -> [{0,1,[1,30]},{1,2,[11,40]},{2,5,[21,50]},{5,10,[31,60]},{10,20,[41,60]},{30,20,[51,70]},{50,10,[61,80]},{70,5,[71,80]},{100,2,[81,90]},{150,1,[91,100]}]
A1861: 1858 | B1861: 3 | C1861: 29 | D1861: 0 | E1861: =R[-9]C -> 41 | F1861: =R[-9]C -> 50 | G1861: 2 | H1861: 10000 | I1861: 110003 | J1861: 2 | K1861: =R[-1]C -> [{7,3},{8,3},{9,3},{10,3},{11,3},{12,3},{17,10},{18,8},{19,1},{23,4},{24,10}] | L1861: =R[-1]C -> [{7,27},{8,55},{9,27},{10,55},{11,27},{12,55},{17,18},{18,110},{19,3},{23,37},{24,37}] | M1861: =R[-1]C -> [{0,1,[1,30]},{1,2,[11,40]},{2,5,[21,50]},{5,10,[31,60]},{10,20,[41,60]},{30,20,[51,70]},{50,10,[61,80]},{70,5,[71,80]},{100,2,[81,90]},{150,1,[91,100]}]
A1862: 1859 | B1862: 3 | C1862: 29 | D1862: 0 | E1862: =R[-9]C -> 51 | F1862: =R[-9]C -> 60 | G1862: 2 | H1862: 10000 | I1862: 110003 | J1862: 2 | K1862: =R[-1]C -> [{7,3},{8,3},{9,3},{10,3},{11,3},{12,3},{17,10},{18,8},{19,1},{23,4},{24,10}] | L1862: =R[-1]C -> [{7,27},{8,55},{9,27},{10,55},{11,27},{12,55},{17,18},{18,110},{19,3},{23,37},{24,37}] | M1862: =R[-1]C -> [{0,1,[1,30]},{1,2,[11,40]},{2,5,[21,50]},{5,10,[31,60]},{10,20,[41,60]},{30,20,[51,70]},{50,10,[61,80]},{70,5,[71,80]},{100,2,[81,90]},{150,1,[91,100]}]
A1863: 1860 | B1863: 3 | C1863: 29 | D1863: 0 | E1863: =R[-9]C -> 61 | F1863: =R[-9]C -> 70 | G1863: 2 | H1863: 10000 | I1863: 110003 | J1863: 2 | K1863: =R[-1]C -> [{7,3},{8,3},{9,3},{10,3},{11,3},{12,3},{17,10},{18,8},{19,1},{23,4},{24,10}] | L1863: =R[-1]C -> [{7,27},{8,55},{9,27},{10,55},{11,27},{12,55},{17,18},{18,110},{19,3},{23,37},{24,37}] | M1863: =R[-1]C -> [{0,1,[1,30]},{1,2,[11,40]},{2,5,[21,50]},{5,10,[31,60]},{10,20,[41,60]},{30,20,[51,70]},{50,10,[61,80]},{70,5,[71,80]},{100,2,[81,90]},{150,1,[91,100]}]
A1864: 1861 | B1864: 3 | C1864: 29 | D1864: 0 | E1864: =R[-9]C -> 71 | F1864: =R[-9]C -> 80 | G1864: 2 | H1864: 10000 | I1864: 110003 | J1864: 2 | K1864: =R[-1]C -> [{7,3},{8,3},{9,3},{10,3},{11,3},{12,3},{17,10},{18,8},{19,1},{23,4},{24,10}] | L1864: =R[-1]C -> [{7,27},{8,55},{9,27},{10,55},{11,27},{12,55},{17,18},{18,110},{19,3},{23,37},{24,37}] | M1864: =R[-1]C -> [{0,1,[1,30]},{1,2,[11,40]},{2,5,[21,50]},{5,10,[31,60]},{10,20,[41,60]},{30,20,[51,70]},{50,10,[61,80]},{70,5,[71,80]},{100,2,[81,90]},{150,1,[91,100]}]
A1865: 1862 | B1865: 3 | C1865: 29 | D1865: 0 | E1865: =R[-9]C -> 81 | F1865: =R[-9]C -> 90 | G1865: 2 | H1865: 10000 | I1865: 110003 | J1865: 2 | K1865: =R[-1]C -> [{7,3},{8,3},{9,3},{10,3},{11,3},{12,3},{17,10},{18,8},{19,1},{23,4},{24,10}] | L1865: =R[-1]C -> [{7,27},{8,55},{9,27},{10,55},{11,27},{12,55},{17,18},{18,110},{19,3},{23,37},{24,37}] | M1865: =R[-1]C -> [{0,1,[1,30]},{1,2,[11,40]},{2,5,[21,50]},{5,10,[31,60]},{10,20,[41,60]},{30,20,[51,70]},{50,10,[61,80]},{70,5,[71,80]},{100,2,[81,90]},{150,1,[91,100]}]
A1866: 1863 | B1866: 4 | C1866: 29 | D1866: 0 | E1866: =R[-9]C -> 1 | F1866: =R[-9]C -> 10 | G1866: 3 | H1866: 15000 | I1866: 110003 | J1866: 3 | K1866: =R[-1]C -> [{7,3},{8,3},{9,3},{10,3},{11,3},{12,3},{17,10},{18,8},{19,1},{23,4},{24,10}] | L1866: =R[-1]C -> [{7,27},{8,55},{9,27},{10,55},{11,27},{12,55},{17,18},{18,110},{19,3},{23,37},{24,37}] | M1866: =R[-1]C -> [{0,1,[1,30]},{1,2,[11,40]},{2,5,[21,50]},{5,10,[31,60]},{10,20,[41,60]},{30,20,[51,70]},{50,10,[61,80]},{70,5,[71,80]},{100,2,[81,90]},{150,1,[91,100]}]
A1867: 1864 | B1867: 4 | C1867: 29 | D1867: 0 | E1867: =R[-9]C -> 11 | F1867: =R[-9]C -> 20 | G1867: 3 | H1867: 15000 | I1867: 110003 | J1867: 3 | K1867: =R[-1]C -> [{7,3},{8,3},{9,3},{10,3},{11,3},{12,3},{17,10},{18,8},{19,1},{23,4},{24,10}] | L1867: =R[-1]C -> [{7,27},{8,55},{9,27},{10,55},{11,27},{12,55},{17,18},{18,110},{19,3},{23,37},{24,37}] | M1867: =R[-1]C -> [{0,1,[1,30]},{1,2,[11,40]},{2,5,[21,50]},{5,10,[31,60]},{10,20,[41,60]},{30,20,[51,70]},{50,10,[61,80]},{70,5,[71,80]},{100,2,[81,90]},{150,1,[91,100]}]
A1868: 1865 | B1868: 4 | C1868: 29 | D1868: 0 | E1868: =R[-9]C -> 21 | F1868: =R[-9]C -> 30 | G1868: 3 | H1868: 15000 | I1868: 110003 | J1868: 3 | K1868: =R[-1]C -> [{7,3},{8,3},{9,3},{10,3},{11,3},{12,3},{17,10},{18,8},{19,1},{23,4},{24,10}] | L1868: =R[-1]C -> [{7,27},{8,55},{9,27},{10,55},{11,27},{12,55},{17,18},{18,110},{19,3},{23,37},{24,37}] | M1868: =R[-1]C -> [{0,1,[1,30]},{1,2,[11,40]},{2,5,[21,50]},{5,10,[31,60]},{10,20,[41,60]},{30,20,[51,70]},{50,10,[61,80]},{70,5,[71,80]},{100,2,[81,90]},{150,1,[91,100]}]
A1869: 1866 | B1869: 4 | C1869: 29 | D1869: 0 | E1869: =R[-9]C -> 31 | F1869: =R[-9]C -> 40 | G1869: 3 | H1869: 15000 | I1869: 110003 | J1869: 3 | K1869: =R[-1]C -> [{7,3},{8,3},{9,3},{10,3},{11,3},{12,3},{17,10},{18,8},{19,1},{23,4},{24,10}] | L1869: =R[-1]C -> [{7,27},{8,55},{9,27},{10,55},{11,27},{12,55},{17,18},{18,110},{19,3},{23,37},{24,37}] | M1869: =R[-1]C -> [{0,1,[1,30]},{1,2,[11,40]},{2,5,[21,50]},{5,10,[31,60]},{10,20,[41,60]},{30,20,[51,70]},{50,10,[61,80]},{70,5,[71,80]},{100,2,[81,90]},{150,1,[91,100]}]
A1870: 1867 | B1870: 4 | C1870: 29 | D1870: 0 | E1870: =R[-9]C -> 41 | F1870: =R[-9]C -> 50 | G1870: 3 | H1870: 15000 | I1870: 110003 | J1870: 3 | K1870: =R[-1]C -> [{7,3},{8,3},{9,3},{10,3},{11,3},{12,3},{17,10},{18,8},{19,1},{23,4},{24,10}] | L1870: =R[-1]C -> [{7,27},{8,55},{9,27},{10,55},{11,27},{12,55},{17,18},{18,110},{19,3},{23,37},{24,37}] | M1870: =R[-1]C -> [{0,1,[1,30]},{1,2,[11,40]},{2,5,[21,50]},{5,10,[31,60]},{10,20,[41,60]},{30,20,[51,70]},{50,10,[61,80]},{70,5,[71,80]},{100,2,[81,90]},{150,1,[91,100]}]
A1871: 1868 | B1871: 4 | C1871: 29 | D1871: 0 | E1871: =R[-9]C -> 51 | F1871: =R[-9]C -> 60 | G1871: 3 | H1871: 15000 | I1871: 110003 | J1871: 3 | K1871: =R[-1]C -> [{7,3},{8,3},{9,3},{10,3},{11,3},{12,3},{17,10},{18,8},{19,1},{23,4},{24,10}] | L1871: =R[-1]C -> [{7,27},{8,55},{9,27},{10,55},{11,27},{12,55},{17,18},{18,110},{19,3},{23,37},{24,37}] | M1871: =R[-1]C -> [{0,1,[1,30]},{1,2,[11,40]},{2,5,[21,50]},{5,10,[31,60]},{10,20,[41,60]},{30,20,[51,70]},{50,10,[61,80]},{70,5,[71,80]},{100,2,[81,90]},{150,1,[91,100]}]
A1872: 1869 | B1872: 4 | C1872: 29 | D1872: 0 | E1872: =R[-9]C -> 61 | F1872: =R[-9]C -> 70 | G1872: 3 | H1872: 15000 | I1872: 110003 | J1872: 3 | K1872: =R[-1]C -> [{7,3},{8,3},{9,3},{10,3},{11,3},{12,3},{17,10},{18,8},{19,1},{23,4},{24,10}] | L1872: =R[-1]C -> [{7,27},{8,55},{9,27},{10,55},{11,27},{12,55},{17,18},{18,110},{19,3},{23,37},{24,37}] | M1872: =R[-1]C -> [{0,1,[1,30]},{1,2,[11,40]},{2,5,[21,50]},{5,10,[31,60]},{10,20,[41,60]},{30,20,[51,70]},{50,10,[61,80]},{70,5,[71,80]},{100,2,[81,90]},{150,1,[91,100]}]
A1873: 1870 | B1873: 4 | C1873: 29 | D1873: 0 | E1873: =R[-9]C -> 71 | F1873: =R[-9]C -> 80 | G1873: 3 | H1873: 15000 | I1873: 110003 | J1873: 3 | K1873: =R[-1]C -> [{7,3},{8,3},{9,3},{10,3},{11,3},{12,3},{17,10},{18,8},{19,1},{23,4},{24,10}] | L1873: =R[-1]C -> [{7,27},{8,55},{9,27},{10,55},{11,27},{12,55},{17,18},{18,110},{19,3},{23,37},{24,37}] | M1873: =R[-1]C -> [{0,1,[1,30]},{1,2,[11,40]},{2,5,[21,50]},{5,10,[31,60]},{10,20,[41,60]},{30,20,[51,70]},{50,10,[61,80]},{70,5,[71,80]},{100,2,[81,90]},{150,1,[91,100]}]
A1874: 1871 | B1874: 4 | C1874: 29 | D1874: 0 | E1874: =R[-9]C -> 81 | F1874: =R[-9]C -> 90 | G1874: 3 | H1874: 15000 | I1874: 110003 | J1874: 3 | K1874: =R[-1]C -> [{7,3},{8,3},{9,3},{10,3},{11,3},{12,3},{17,10},{18,8},{19,1},{23,4},{24,10}] | L1874: =R[-1]C -> [{7,27},{8,55},{9,27},{10,55},{11,27},{12,55},{17,18},{18,110},{19,3},{23,37},{24,37}] | M1874: =R[-1]C -> [{0,1,[1,30]},{1,2,[11,40]},{2,5,[21,50]},{5,10,[31,60]},{10,20,[41,60]},{30,20,[51,70]},{50,10,[61,80]},{70,5,[71,80]},{100,2,[81,90]},{150,1,[91,100]}]
A1875: 1872 | B1875: 5 | C1875: 29 | D1875: 0 | E1875: =R[-9]C -> 1 | F1875: =R[-9]C -> 10 | G1875: 4 | H1875: 20000 | I1875: 110003 | J1875: 4 | K1875: =R[-1]C -> [{7,3},{8,3},{9,3},{10,3},{11,3},{12,3},{17,10},{18,8},{19,1},{23,4},{24,10}] | L1875: =R[-1]C -> [{7,27},{8,55},{9,27},{10,55},{11,27},{12,55},{17,18},{18,110},{19,3},{23,37},{24,37}] | M1875: =R[-1]C -> [{0,1,[1,30]},{1,2,[11,40]},{2,5,[21,50]},{5,10,[31,60]},{10,20,[41,60]},{30,20,[51,70]},{50,10,[61,80]},{70,5,[71,80]},{100,2,[81,90]},{150,1,[91,100]}]
A1876: 1873 | B1876: 5 | C1876: 29 | D1876: 0 | E1876: =R[-9]C -> 11 | F1876: =R[-9]C -> 20 | G1876: 4 | H1876: 20000 | I1876: 110003 | J1876: 4 | K1876: =R[-1]C -> [{7,3},{8,3},{9,3},{10,3},{11,3},{12,3},{17,10},{18,8},{19,1},{23,4},{24,10}] | L1876: =R[-1]C -> [{7,27},{8,55},{9,27},{10,55},{11,27},{12,55},{17,18},{18,110},{19,3},{23,37},{24,37}] | M1876: =R[-1]C -> [{0,1,[1,30]},{1,2,[11,40]},{2,5,[21,50]},{5,10,[31,60]},{10,20,[41,60]},{30,20,[51,70]},{50,10,[61,80]},{70,5,[71,80]},{100,2,[81,90]},{150,1,[91,100]}]
A1877: 1874 | B1877: 5 | C1877: 29 | D1877: 0 | E1877: =R[-9]C -> 21 | F1877: =R[-9]C -> 30 | G1877: 4 | H1877: 20000 | I1877: 110003 | J1877: 4 | K1877: =R[-1]C -> [{7,3},{8,3},{9,3},{10,3},{11,3},{12,3},{17,10},{18,8},{19,1},{23,4},{24,10}] | L1877: =R[-1]C -> [{7,27},{8,55},{9,27},{10,55},{11,27},{12,55},{17,18},{18,110},{19,3},{23,37},{24,37}] | M1877: =R[-1]C -> [{0,1,[1,30]},{1,2,[11,40]},{2,5,[21,50]},{5,10,[31,60]},{10,20,[41,60]},{30,20,[51,70]},{50,10,[61,80]},{70,5,[71,80]},{100,2,[81,90]},{150,1,[91,100]}]
A1878: 1875 | B1878: 5 | C1878: 29 | D1878: 0 | E1878: =R[-9]C -> 31 | F1878: =R[-9]C -> 40 | G1878: 4 | H1878: 20000 | I1878: 110003 | J1878: 4 | K1878: =R[-1]C -> [{7,3},{8,3},{9,3},{10,3},{11,3},{12,3},{17,10},{18,8},{19,1},{23,4},{24,10}] | L1878: =R[-1]C -> [{7,27},{8,55},{9,27},{10,55},{11,27},{12,55},{17,18},{18,110},{19,3},{23,37},{24,37}] | M1878: =R[-1]C -> [{0,1,[1,30]},{1,2,[11,40]},{2,5,[21,50]},{5,10,[31,60]},{10,20,[41,60]},{30,20,[51,70]},{50,10,[61,80]},{70,5,[71,80]},{100,2,[81,90]},{150,1,[91,100]}]
A1879: 1876 | B1879: 5 | C1879: 29 | D1879: 0 | E1879: =R[-9]C -> 41 | F1879: =R[-9]C -> 50 | G1879: 4 | H1879: 20000 | I1879: 110003 | J1879: 4 | K1879: =R[-1]C -> [{7,3},{8,3},{9,3},{10,3},{11,3},{12,3},{17,10},{18,8},{19,1},{23,4},{24,10}] | L1879: =R[-1]C -> [{7,27},{8,55},{9,27},{10,55},{11,27},{12,55},{17,18},{18,110},{19,3},{23,37},{24,37}] | M1879: =R[-1]C -> [{0,1,[1,30]},{1,2,[11,40]},{2,5,[21,50]},{5,10,[31,60]},{10,20,[41,60]},{30,20,[51,70]},{50,10,[61,80]},{70,5,[71,80]},{100,2,[81,90]},{150,1,[91,100]}]
A1880: 1877 | B1880: 5 | C1880: 29 | D1880: 0 | E1880: =R[-9]C -> 51 | F1880: =R[-9]C -> 60 | G1880: 4 | H1880: 20000 | I1880: 110003 | J1880: 4 | K1880: =R[-1]C -> [{7,3},{8,3},{9,3},{10,3},{11,3},{12,3},{17,10},{18,8},{19,1},{23,4},{24,10}] | L1880: =R[-1]C -> [{7,27},{8,55},{9,27},{10,55},{11,27},{12,55},{17,18},{18,110},{19,3},{23,37},{24,37}] | M1880: =R[-1]C -> [{0,1,[1,30]},{1,2,[11,40]},{2,5,[21,50]},{5,10,[31,60]},{10,20,[41,60]},{30,20,[51,70]},{50,10,[61,80]},{70,5,[71,80]},{100,2,[81,90]},{150,1,[91,100]}]
A1881: 1878 | B1881: 5 | C1881: 29 | D1881: 0 | E1881: =R[-9]C -> 61 | F1881: =R[-9]C -> 70 | G1881: 4 | H1881: 20000 | I1881: 110003 | J1881: 4 | K1881: =R[-1]C -> [{7,3},{8,3},{9,3},{10,3},{11,3},{12,3},{17,10},{18,8},{19,1},{23,4},{24,10}] | L1881: =R[-1]C -> [{7,27},{8,55},{9,27},{10,55},{11,27},{12,55},{17,18},{18,110},{19,3},{23,37},{24,37}] | M1881: =R[-1]C -> [{0,1,[1,30]},{1,2,[11,40]},{2,5,[21,50]},{5,10,[31,60]},{10,20,[41,60]},{30,20,[51,70]},{50,10,[61,80]},{70,5,[71,80]},{100,2,[81,90]},{150,1,[91,100]}]
A1882: 1879 | B1882: 5 | C1882: 29 | D1882: 0 | E1882: =R[-9]C -> 71 | F1882: =R[-9]C -> 80 | G1882: 4 | H1882: 20000 | I1882: 110003 | J1882: 4 | K1882: =R[-1]C -> [{7,3},{8,3},{9,3},{10,3},{11,3},{12,3},{17,10},{18,8},{19,1},{23,4},{24,10}] | L1882: =R[-1]C -> [{7,27},{8,55},{9,27},{10,55},{11,27},{12,55},{17,18},{18,110},{19,3},{23,37},{24,37}] | M1882: =R[-1]C -> [{0,1,[1,30]},{1,2,[11,40]},{2,5,[21,50]},{5,10,[31,60]},{10,20,[41,60]},{30,20,[51,70]},{50,10,[61,80]},{70,5,[71,80]},{100,2,[81,90]},{150,1,[91,100]}]
A1883: 1880 | B1883: 5 | C1883: 29 | D1883: 0 | E1883: =R[-9]C -> 81 | F1883: =R[-9]C -> 90 | G1883: 4 | H1883: 20000 | I1883: 110003 | J1883: 4 | K1883: =R[-1]C -> [{7,3},{8,3},{9,3},{10,3},{11,3},{12,3},{17,10},{18,8},{19,1},{23,4},{24,10}] | L1883: =R[-1]C -> [{7,27},{8,55},{9,27},{10,55},{11,27},{12,55},{17,18},{18,110},{19,3},{23,37},{24,37}] | M1883: =R[-1]C -> [{0,1,[1,30]},{1,2,[11,40]},{2,5,[21,50]},{5,10,[31,60]},{10,20,[41,60]},{30,20,[51,70]},{50,10,[61,80]},{70,5,[71,80]},{100,2,[81,90]},{150,1,[91,100]}]
A1884: 1881 | B1884: 6 | C1884: 29 | D1884: 0 | E1884: =R[-9]C -> 1 | F1884: =R[-9]C -> 10 | G1884: 5 | H1884: 20000 | I1884: 110003 | J1884: 5 | K1884: =R[-1]C -> [{7,3},{8,3},{9,3},{10,3},{11,3},{12,3},{17,10},{18,8},{19,1},{23,4},{24,10}] | L1884: =R[-1]C -> [{7,27},{8,55},{9,27},{10,55},{11,27},{12,55},{17,18},{18,110},{19,3},{23,37},{24,37}] | M1884: =R[-1]C -> [{0,1,[1,30]},{1,2,[11,40]},{2,5,[21,50]},{5,10,[31,60]},{10,20,[41,60]},{30,20,[51,70]},{50,10,[61,80]},{70,5,[71,80]},{100,2,[81,90]},{150,1,[91,100]}]
A1885: 1882 | B1885: 6 | C1885: 29 | D1885: 0 | E1885: =R[-9]C -> 11 | F1885: =R[-9]C -> 20 | G1885: 5 | H1885: 20000 | I1885: 110003 | J1885: 5 | K1885: =R[-1]C -> [{7,3},{8,3},{9,3},{10,3},{11,3},{12,3},{17,10},{18,8},{19,1},{23,4},{24,10}] | L1885: =R[-1]C -> [{7,27},{8,55},{9,27},{10,55},{11,27},{12,55},{17,18},{18,110},{19,3},{23,37},{24,37}] | M1885: =R[-1]C -> [{0,1,[1,30]},{1,2,[11,40]},{2,5,[21,50]},{5,10,[31,60]},{10,20,[41,60]},{30,20,[51,70]},{50,10,[61,80]},{70,5,[71,80]},{100,2,[81,90]},{150,1,[91,100]}]
A1886: 1883 | B1886: 6 | C1886: 29 | D1886: 0 | E1886: =R[-9]C -> 21 | F1886: =R[-9]C -> 30 | G1886: 5 | H1886: 20000 | I1886: 110003 | J1886: 5 | K1886: =R[-1]C -> [{7,3},{8,3},{9,3},{10,3},{11,3},{12,3},{17,10},{18,8},{19,1},{23,4},{24,10}] | L1886: =R[-1]C -> [{7,27},{8,55},{9,27},{10,55},{11,27},{12,55},{17,18},{18,110},{19,3},{23,37},{24,37}] | M1886: =R[-1]C -> [{0,1,[1,30]},{1,2,[11,40]},{2,5,[21,50]},{5,10,[31,60]},{10,20,[41,60]},{30,20,[51,70]},{50,10,[61,80]},{70,5,[71,80]},{100,2,[81,90]},{150,1,[91,100]}]
A1887: 1884 | B1887: 6 | C1887: 29 | D1887: 0 | E1887: =R[-9]C -> 31 | F1887: =R[-9]C -> 40 | G1887: 5 | H1887: 20000 | I1887: 110003 | J1887: 5 | K1887: =R[-1]C -> [{7,3},{8,3},{9,3},{10,3},{11,3},{12,3},{17,10},{18,8},{19,1},{23,4},{24,10}] | L1887: =R[-1]C -> [{7,27},{8,55},{9,27},{10,55},{11,27},{12,55},{17,18},{18,110},{19,3},{23,37},{24,37}] | M1887: =R[-1]C -> [{0,1,[1,30]},{1,2,[11,40]},{2,5,[21,50]},{5,10,[31,60]},{10,20,[41,60]},{30,20,[51,70]},{50,10,[61,80]},{70,5,[71,80]},{100,2,[81,90]},{150,1,[91,100]}]
A1888: 1885 | B1888: 6 | C1888: 29 | D1888: 0 | E1888: =R[-9]C -> 41 | F1888: =R[-9]C -> 50 | G1888: 5 | H1888: 20000 | I1888: 110003 | J1888: 5 | K1888: =R[-1]C -> [{7,3},{8,3},{9,3},{10,3},{11,3},{12,3},{17,10},{18,8},{19,1},{23,4},{24,10}] | L1888: =R[-1]C -> [{7,27},{8,55},{9,27},{10,55},{11,27},{12,55},{17,18},{18,110},{19,3},{23,37},{24,37}] | M1888: =R[-1]C -> [{0,1,[1,30]},{1,2,[11,40]},{2,5,[21,50]},{5,10,[31,60]},{10,20,[41,60]},{30,20,[51,70]},{50,10,[61,80]},{70,5,[71,80]},{100,2,[81,90]},{150,1,[91,100]}]
A1889: 1886 | B1889: 6 | C1889: 29 | D1889: 0 | E1889: =R[-9]C -> 51 | F1889: =R[-9]C -> 60 | G1889: 5 | H1889: 20000 | I1889: 110003 | J1889: 5 | K1889: =R[-1]C -> [{7,3},{8,3},{9,3},{10,3},{11,3},{12,3},{17,10},{18,8},{19,1},{23,4},{24,10}] | L1889: =R[-1]C -> [{7,27},{8,55},{9,27},{10,55},{11,27},{12,55},{17,18},{18,110},{19,3},{23,37},{24,37}] | M1889: =R[-1]C -> [{0,1,[1,30]},{1,2,[11,40]},{2,5,[21,50]},{5,10,[31,60]},{10,20,[41,60]},{30,20,[51,70]},{50,10,[61,80]},{70,5,[71,80]},{100,2,[81,90]},{150,1,[91,100]}]
A1890: 1887 | B1890: 6 | C1890: 29 | D1890: 0 | E1890: =R[-9]C -> 61 | F1890: =R[-9]C -> 70 | G1890: 5 | H1890: 20000 | I1890: 110003 | J1890: 5 | K1890: =R[-1]C -> [{7,3},{8,3},{9,3},{10,3},{11,3},{12,3},{17,10},{18,8},{19,1},{23,4},{24,10}] | L1890: =R[-1]C -> [{7,27},{8,55},{9,27},{10,55},{11,27},{12,55},{17,18},{18,110},{19,3},{23,37},{24,37}] | M1890: =R[-1]C -> [{0,1,[1,30]},{1,2,[11,40]},{2,5,[21,50]},{5,10,[31,60]},{10,20,[41,60]},{30,20,[51,70]},{50,10,[61,80]},{70,5,[71,80]},{100,2,[81,90]},{150,1,[91,100]}]
A1891: 1888 | B1891: 6 | C1891: 29 | D1891: 0 | E1891: =R[-9]C -> 71 | F1891: =R[-9]C -> 80 | G1891: 5 | H1891: 20000 | I1891: 110003 | J1891: 5 | K1891: =R[-1]C -> [{7,3},{8,3},{9,3},{10,3},{11,3},{12,3},{17,10},{18,8},{19,1},{23,4},{24,10}] | L1891: =R[-1]C -> [{7,27},{8,55},{9,27},{10,55},{11,27},{12,55},{17,18},{18,110},{19,3},{23,37},{24,37}] | M1891: =R[-1]C -> [{0,1,[1,30]},{1,2,[11,40]},{2,5,[21,50]},{5,10,[31,60]},{10,20,[41,60]},{30,20,[51,70]},{50,10,[61,80]},{70,5,[71,80]},{100,2,[81,90]},{150,1,[91,100]}]
A1892: 1889 | B1892: 6 | C1892: 29 | D1892: 0 | E1892: =R[-9]C -> 81 | F1892: =R[-9]C -> 90 | G1892: 5 | H1892: 20000 | I1892: 110003 | J1892: 5 | K1892: =R[-1]C -> [{7,3},{8,3},{9,3},{10,3},{11,3},{12,3},{17,10},{18,8},{19,1},{23,4},{24,10}] | L1892: =R[-1]C -> [{7,27},{8,55},{9,27},{10,55},{11,27},{12,55},{17,18},{18,110},{19,3},{23,37},{24,37}] | M1892: =R[-1]C -> [{0,1,[1,30]},{1,2,[11,40]},{2,5,[21,50]},{5,10,[31,60]},{10,20,[41,60]},{30,20,[51,70]},{50,10,[61,80]},{70,5,[71,80]},{100,2,[81,90]},{150,1,[91,100]}]
A1893: 1890 | B1893: 2 | C1893: 24 | D1893: 0 | E1893: =R[-18]C -> 1 | F1893: =R[-18]C -> 10 | G1893: 1 | H1893: 5000 | I1893: 110003 | J1893: 1 | K1893: =配置模型!R[-1814]C[-6] -> [{5,8},{6,15},{13,10},{14,8},{15,10},{16,8},{20,1},{27,10},{28,10}] | L1893: =配置模型!R[-1780]C[-1] -> [{5,1113},{6,1113},{13,18},{14,37},{15,18},{16,37},{20,3},{27,18},{28,18}] | M1893: =R[-10]C -> [{0,1,[1,30]},{1,2,[11,40]},{2,5,[21,50]},{5,10,[31,60]},{10,20,[41,60]},{30,20,[51,70]},{50,10,[61,80]},{70,5,[71,80]},{100,2,[81,90]},{150,1,[91,100]}]
A1894: 1891 | B1894: 2 | C1894: 24 | D1894: 0 | E1894: =R[-18]C -> 11 | F1894: =R[-18]C -> 20 | G1894: 1 | H1894: 5000 | I1894: 110003 | J1894: 1 | K1894: =R[-1]C -> [{5,8},{6,15},{13,10},{14,8},{15,10},{16,8},{20,1},{27,10},{28,10}] | L1894: =R[-1]C -> [{5,1113},{6,1113},{13,18},{14,37},{15,18},{16,37},{20,3},{27,18},{28,18}] | M1894: =R[-1]C -> [{0,1,[1,30]},{1,2,[11,40]},{2,5,[21,50]},{5,10,[31,60]},{10,20,[41,60]},{30,20,[51,70]},{50,10,[61,80]},{70,5,[71,80]},{100,2,[81,90]},{150,1,[91,100]}]
A1895: 1892 | B1895: 2 | C1895: 24 | D1895: 0 | E1895: =R[-18]C -> 21 | F1895: =R[-18]C -> 30 | G1895: 1 | H1895: 5000 | I1895: 110003 | J1895: 1 | K1895: =R[-1]C -> [{5,8},{6,15},{13,10},{14,8},{15,10},{16,8},{20,1},{27,10},{28,10}] | L1895: =R[-1]C -> [{5,1113},{6,1113},{13,18},{14,37},{15,18},{16,37},{20,3},{27,18},{28,18}] | M1895: =R[-1]C -> [{0,1,[1,30]},{1,2,[11,40]},{2,5,[21,50]},{5,10,[31,60]},{10,20,[41,60]},{30,20,[51,70]},{50,10,[61,80]},{70,5,[71,80]},{100,2,[81,90]},{150,1,[91,100]}]
A1896: 1893 | B1896: 2 | C1896: 24 | D1896: 0 | E1896: =R[-18]C -> 31 | F1896: =R[-18]C -> 40 | G1896: 1 | H1896: 5000 | I1896: 110003 | J1896: 1 | K1896: =R[-1]C -> [{5,8},{6,15},{13,10},{14,8},{15,10},{16,8},{20,1},{27,10},{28,10}] | L1896: =R[-1]C -> [{5,1113},{6,1113},{13,18},{14,37},{15,18},{16,37},{20,3},{27,18},{28,18}] | M1896: =R[-1]C -> [{0,1,[1,30]},{1,2,[11,40]},{2,5,[21,50]},{5,10,[31,60]},{10,20,[41,60]},{30,20,[51,70]},{50,10,[61,80]},{70,5,[71,80]},{100,2,[81,90]},{150,1,[91,100]}]
A1897: 1894 | B1897: 2 | C1897: 24 | D1897: 0 | E1897: =R[-18]C -> 41 | F1897: =R[-18]C -> 50 | G1897: 1 | H1897: 5000 | I1897: 110003 | J1897: 1 | K1897: =R[-1]C -> [{5,8},{6,15},{13,10},{14,8},{15,10},{16,8},{20,1},{27,10},{28,10}] | L1897: =R[-1]C -> [{5,1113},{6,1113},{13,18},{14,37},{15,18},{16,37},{20,3},{27,18},{28,18}] | M1897: =R[-1]C -> [{0,1,[1,30]},{1,2,[11,40]},{2,5,[21,50]},{5,10,[31,60]},{10,20,[41,60]},{30,20,[51,70]},{50,10,[61,80]},{70,5,[71,80]},{100,2,[81,90]},{150,1,[91,100]}]
A1898: 1895 | B1898: 2 | C1898: 24 | D1898: 0 | E1898: =R[-18]C -> 51 | F1898: =R[-18]C -> 60 | G1898: 1 | H1898: 5000 | I1898: 110003 | J1898: 1 | K1898: =R[-1]C -> [{5,8},{6,15},{13,10},{14,8},{15,10},{16,8},{20,1},{27,10},{28,10}] | L1898: =R[-1]C -> [{5,1113},{6,1113},{13,18},{14,37},{15,18},{16,37},{20,3},{27,18},{28,18}] | M1898: =R[-1]C -> [{0,1,[1,30]},{1,2,[11,40]},{2,5,[21,50]},{5,10,[31,60]},{10,20,[41,60]},{30,20,[51,70]},{50,10,[61,80]},{70,5,[71,80]},{100,2,[81,90]},{150,1,[91,100]}]
A1899: 1896 | B1899: 2 | C1899: 24 | D1899: 0 | E1899: =R[-18]C -> 61 | F1899: =R[-18]C -> 70 | G1899: 1 | H1899: 5000 | I1899: 110003 | J1899: 1 | K1899: =R[-1]C -> [{5,8},{6,15},{13,10},{14,8},{15,10},{16,8},{20,1},{27,10},{28,10}] | L1899: =R[-1]C -> [{5,1113},{6,1113},{13,18},{14,37},{15,18},{16,37},{20,3},{27,18},{28,18}] | M1899: =R[-1]C -> [{0,1,[1,30]},{1,2,[11,40]},{2,5,[21,50]},{5,10,[31,60]},{10,20,[41,60]},{30,20,[51,70]},{50,10,[61,80]},{70,5,[71,80]},{100,2,[81,90]},{150,1,[91,100]}]
A1900: 1897 | B1900: 2 | C1900: 24 | D1900: 0 | E1900: =R[-18]C -> 71 | F1900: =R[-18]C -> 80 | G1900: 1 | H1900: 5000 | I1900: 110003 | J1900: 1 | K1900: =R[-1]C -> [{5,8},{6,15},{13,10},{14,8},{15,10},{16,8},{20,1},{27,10},{28,10}] | L1900: =R[-1]C -> [{5,1113},{6,1113},{13,18},{14,37},{15,18},{16,37},{20,3},{27,18},{28,18}] | M1900: =R[-1]C -> [{0,1,[1,30]},{1,2,[11,40]},{2,5,[21,50]},{5,10,[31,60]},{10,20,[41,60]},{30,20,[51,70]},{50,10,[61,80]},{70,5,[71,80]},{100,2,[81,90]},{150,1,[91,100]}]
A1901: 1898 | B1901: 2 | C1901: 24 | D1901: 0 | E1901: =R[-18]C -> 81 | F1901: =R[-18]C -> 90 | G1901: 1 | H1901: 5000 | I1901: 110003 | J1901: 1 | K1901: =R[-1]C -> [{5,8},{6,15},{13,10},{14,8},{15,10},{16,8},{20,1},{27,10},{28,10}] | L1901: =R[-1]C -> [{5,1113},{6,1113},{13,18},{14,37},{15,18},{16,37},{20,3},{27,18},{28,18}] | M1901: =R[-1]C -> [{0,1,[1,30]},{1,2,[11,40]},{2,5,[21,50]},{5,10,[31,60]},{10,20,[41,60]},{30,20,[51,70]},{50,10,[61,80]},{70,5,[71,80]},{100,2,[81,90]},{150,1,[91,100]}]
A1902: 1899 | B1902: 3 | C1902: 24 | D1902: 0 | E1902: =R[-9]C -> 1 | F1902: =R[-9]C -> 10 | G1902: 2 | H1902: 10000 | I1902: 110003 | J1902: 2 | K1902: =R[-1]C -> [{5,8},{6,15},{13,10},{14,8},{15,10},{16,8},{20,1},{27,10},{28,10}] | L1902: =R[-1]C -> [{5,1113},{6,1113},{13,18},{14,37},{15,18},{16,37},{20,3},{27,18},{28,18}] | M1902: =R[-1]C -> [{0,1,[1,30]},{1,2,[11,40]},{2,5,[21,50]},{5,10,[31,60]},{10,20,[41,60]},{30,20,[51,70]},{50,10,[61,80]},{70,5,[71,80]},{100,2,[81,90]},{150,1,[91,100]}]
A1903: 1900 | B1903: 3 | C1903: 24 | D1903: 0 | E1903: =R[-9]C -> 11 | F1903: =R[-9]C -> 20 | G1903: 2 | H1903: 10000 | I1903: 110003 | J1903: 2 | K1903: =R[-1]C -> [{5,8},{6,15},{13,10},{14,8},{15,10},{16,8},{20,1},{27,10},{28,10}] | L1903: =R[-1]C -> [{5,1113},{6,1113},{13,18},{14,37},{15,18},{16,37},{20,3},{27,18},{28,18}] | M1903: =R[-1]C -> [{0,1,[1,30]},{1,2,[11,40]},{2,5,[21,50]},{5,10,[31,60]},{10,20,[41,60]},{30,20,[51,70]},{50,10,[61,80]},{70,5,[71,80]},{100,2,[81,90]},{150,1,[91,100]}]
A1904: 1901 | B1904: 3 | C1904: 24 | D1904: 0 | E1904: =R[-9]C -> 21 | F1904: =R[-9]C -> 30 | G1904: 2 | H1904: 10000 | I1904: 110003 | J1904: 2 | K1904: =R[-1]C -> [{5,8},{6,15},{13,10},{14,8},{15,10},{16,8},{20,1},{27,10},{28,10}] | L1904: =R[-1]C -> [{5,1113},{6,1113},{13,18},{14,37},{15,18},{16,37},{20,3},{27,18},{28,18}] | M1904: =R[-1]C -> [{0,1,[1,30]},{1,2,[11,40]},{2,5,[21,50]},{5,10,[31,60]},{10,20,[41,60]},{30,20,[51,70]},{50,10,[61,80]},{70,5,[71,80]},{100,2,[81,90]},{150,1,[91,100]}]
A1905: 1902 | B1905: 3 | C1905: 24 | D1905: 0 | E1905: =R[-9]C -> 31 | F1905: =R[-9]C -> 40 | G1905: 2 | H1905: 10000 | I1905: 110003 | J1905: 2 | K1905: =R[-1]C -> [{5,8},{6,15},{13,10},{14,8},{15,10},{16,8},{20,1},{27,10},{28,10}] | L1905: =R[-1]C -> [{5,1113},{6,1113},{13,18},{14,37},{15,18},{16,37},{20,3},{27,18},{28,18}] | M1905: =R[-1]C -> [{0,1,[1,30]},{1,2,[11,40]},{2,5,[21,50]},{5,10,[31,60]},{10,20,[41,60]},{30,20,[51,70]},{50,10,[61,80]},{70,5,[71,80]},{100,2,[81,90]},{150,1,[91,100]}]
A1906: 1903 | B1906: 3 | C1906: 24 | D1906: 0 | E1906: =R[-9]C -> 41 | F1906: =R[-9]C -> 50 | G1906: 2 | H1906: 10000 | I1906: 110003 | J1906: 2 | K1906: =R[-1]C -> [{5,8},{6,15},{13,10},{14,8},{15,10},{16,8},{20,1},{27,10},{28,10}] | L1906: =R[-1]C -> [{5,1113},{6,1113},{13,18},{14,37},{15,18},{16,37},{20,3},{27,18},{28,18}] | M1906: =R[-1]C -> [{0,1,[1,30]},{1,2,[11,40]},{2,5,[21,50]},{5,10,[31,60]},{10,20,[41,60]},{30,20,[51,70]},{50,10,[61,80]},{70,5,[71,80]},{100,2,[81,90]},{150,1,[91,100]}]
A1907: 1904 | B1907: 3 | C1907: 24 | D1907: 0 | E1907: =R[-9]C -> 51 | F1907: =R[-9]C -> 60 | G1907: 2 | H1907: 10000 | I1907: 110003 | J1907: 2 | K1907: =R[-1]C -> [{5,8},{6,15},{13,10},{14,8},{15,10},{16,8},{20,1},{27,10},{28,10}] | L1907: =R[-1]C -> [{5,1113},{6,1113},{13,18},{14,37},{15,18},{16,37},{20,3},{27,18},{28,18}] | M1907: =R[-1]C -> [{0,1,[1,30]},{1,2,[11,40]},{2,5,[21,50]},{5,10,[31,60]},{10,20,[41,60]},{30,20,[51,70]},{50,10,[61,80]},{70,5,[71,80]},{100,2,[81,90]},{150,1,[91,100]}]
A1908: 1905 | B1908: 3 | C1908: 24 | D1908: 0 | E1908: =R[-9]C -> 61 | F1908: =R[-9]C -> 70 | G1908: 2 | H1908: 10000 | I1908: 110003 | J1908: 2 | K1908: =R[-1]C -> [{5,8},{6,15},{13,10},{14,8},{15,10},{16,8},{20,1},{27,10},{28,10}] | L1908: =R[-1]C -> [{5,1113},{6,1113},{13,18},{14,37},{15,18},{16,37},{20,3},{27,18},{28,18}] | M1908: =R[-1]C -> [{0,1,[1,30]},{1,2,[11,40]},{2,5,[21,50]},{5,10,[31,60]},{10,20,[41,60]},{30,20,[51,70]},{50,10,[61,80]},{70,5,[71,80]},{100,2,[81,90]},{150,1,[91,100]}]
A1909: 1906 | B1909: 3 | C1909: 24 | D1909: 0 | E1909: =R[-9]C -> 71 | F1909: =R[-9]C -> 80 | G1909: 2 | H1909: 10000 | I1909: 110003 | J1909: 2 | K1909: =R[-1]C -> [{5,8},{6,15},{13,10},{14,8},{15,10},{16,8},{20,1},{27,10},{28,10}] | L1909: =R[-1]C -> [{5,1113},{6,1113},{13,18},{14,37},{15,18},{16,37},{20,3},{27,18},{28,18}] | M1909: =R[-1]C -> [{0,1,[1,30]},{1,2,[11,40]},{2,5,[21,50]},{5,10,[31,60]},{10,20,[41,60]},{30,20,[51,70]},{50,10,[61,80]},{70,5,[71,80]},{100,2,[81,90]},{150,1,[91,100]}]
A1910: 1907 | B1910: 3 | C1910: 24 | D1910: 0 | E1910: =R[-9]C -> 81 | F1910: =R[-9]C -> 90 | G1910: 2 | H1910: 10000 | I1910: 110003 | J1910: 2 | K1910: =R[-1]C -> [{5,8},{6,15},{13,10},{14,8},{15,10},{16,8},{20,1},{27,10},{28,10}] | L1910: =R[-1]C -> [{5,1113},{6,1113},{13,18},{14,37},{15,18},{16,37},{20,3},{27,18},{28,18}] | M1910: =R[-1]C -> [{0,1,[1,30]},{1,2,[11,40]},{2,5,[21,50]},{5,10,[31,60]},{10,20,[41,60]},{30,20,[51,70]},{50,10,[61,80]},{70,5,[71,80]},{100,2,[81,90]},{150,1,[91,100]}]
A1911: 1908 | B1911: 4 | C1911: 24 | D1911: 0 | E1911: =R[-9]C -> 1 | F1911: =R[-9]C -> 10 | G1911: 3 | H1911: 15000 | I1911: 110003 | J1911: 3 | K1911: =R[-1]C -> [{5,8},{6,15},{13,10},{14,8},{15,10},{16,8},{20,1},{27,10},{28,10}] | L1911: =R[-1]C -> [{5,1113},{6,1113},{13,18},{14,37},{15,18},{16,37},{20,3},{27,18},{28,18}] | M1911: =R[-1]C -> [{0,1,[1,30]},{1,2,[11,40]},{2,5,[21,50]},{5,10,[31,60]},{10,20,[41,60]},{30,20,[51,70]},{50,10,[61,80]},{70,5,[71,80]},{100,2,[81,90]},{150,1,[91,100]}]
A1912: 1909 | B1912: 4 | C1912: 24 | D1912: 0 | E1912: =R[-9]C -> 11 | F1912: =R[-9]C -> 20 | G1912: 3 | H1912: 15000 | I1912: 110003 | J1912: 3 | K1912: =R[-1]C -> [{5,8},{6,15},{13,10},{14,8},{15,10},{16,8},{20,1},{27,10},{28,10}] | L1912: =R[-1]C -> [{5,1113},{6,1113},{13,18},{14,37},{15,18},{16,37},{20,3},{27,18},{28,18}] | M1912: =R[-1]C -> [{0,1,[1,30]},{1,2,[11,40]},{2,5,[21,50]},{5,10,[31,60]},{10,20,[41,60]},{30,20,[51,70]},{50,10,[61,80]},{70,5,[71,80]},{100,2,[81,90]},{150,1,[91,100]}]
A1913: 1910 | B1913: 4 | C1913: 24 | D1913: 0 | E1913: =R[-9]C -> 21 | F1913: =R[-9]C -> 30 | G1913: 3 | H1913: 15000 | I1913: 110003 | J1913: 3 | K1913: =R[-1]C -> [{5,8},{6,15},{13,10},{14,8},{15,10},{16,8},{20,1},{27,10},{28,10}] | L1913: =R[-1]C -> [{5,1113},{6,1113},{13,18},{14,37},{15,18},{16,37},{20,3},{27,18},{28,18}] | M1913: =R[-1]C -> [{0,1,[1,30]},{1,2,[11,40]},{2,5,[21,50]},{5,10,[31,60]},{10,20,[41,60]},{30,20,[51,70]},{50,10,[61,80]},{70,5,[71,80]},{100,2,[81,90]},{150,1,[91,100]}]
A1914: 1911 | B1914: 4 | C1914: 24 | D1914: 0 | E1914: =R[-9]C -> 31 | F1914: =R[-9]C -> 40 | G1914: 3 | H1914: 15000 | I1914: 110003 | J1914: 3 | K1914: =R[-1]C -> [{5,8},{6,15},{13,10},{14,8},{15,10},{16,8},{20,1},{27,10},{28,10}] | L1914: =R[-1]C -> [{5,1113},{6,1113},{13,18},{14,37},{15,18},{16,37},{20,3},{27,18},{28,18}] | M1914: =R[-1]C -> [{0,1,[1,30]},{1,2,[11,40]},{2,5,[21,50]},{5,10,[31,60]},{10,20,[41,60]},{30,20,[51,70]},{50,10,[61,80]},{70,5,[71,80]},{100,2,[81,90]},{150,1,[91,100]}]
A1915: 1912 | B1915: 4 | C1915: 24 | D1915: 0 | E1915: =R[-9]C -> 41 | F1915: =R[-9]C -> 50 | G1915: 3 | H1915: 15000 | I1915: 110003 | J1915: 3 | K1915: =R[-1]C -> [{5,8},{6,15},{13,10},{14,8},{15,10},{16,8},{20,1},{27,10},{28,10}] | L1915: =R[-1]C -> [{5,1113},{6,1113},{13,18},{14,37},{15,18},{16,37},{20,3},{27,18},{28,18}] | M1915: =R[-1]C -> [{0,1,[1,30]},{1,2,[11,40]},{2,5,[21,50]},{5,10,[31,60]},{10,20,[41,60]},{30,20,[51,70]},{50,10,[61,80]},{70,5,[71,80]},{100,2,[81,90]},{150,1,[91,100]}]
A1916: 1913 | B1916: 4 | C1916: 24 | D1916: 0 | E1916: =R[-9]C -> 51 | F1916: =R[-9]C -> 60 | G1916: 3 | H1916: 15000 | I1916: 110003 | J1916: 3 | K1916: =R[-1]C -> [{5,8},{6,15},{13,10},{14,8},{15,10},{16,8},{20,1},{27,10},{28,10}] | L1916: =R[-1]C -> [{5,1113},{6,1113},{13,18},{14,37},{15,18},{16,37},{20,3},{27,18},{28,18}] | M1916: =R[-1]C -> [{0,1,[1,30]},{1,2,[11,40]},{2,5,[21,50]},{5,10,[31,60]},{10,20,[41,60]},{30,20,[51,70]},{50,10,[61,80]},{70,5,[71,80]},{100,2,[81,90]},{150,1,[91,100]}]
A1917: 1914 | B1917: 4 | C1917: 24 | D1917: 0 | E1917: =R[-9]C -> 61 | F1917: =R[-9]C -> 70 | G1917: 3 | H1917: 15000 | I1917: 110003 | J1917: 3 | K1917: =R[-1]C -> [{5,8},{6,15},{13,10},{14,8},{15,10},{16,8},{20,1},{27,10},{28,10}] | L1917: =R[-1]C -> [{5,1113},{6,1113},{13,18},{14,37},{15,18},{16,37},{20,3},{27,18},{28,18}] | M1917: =R[-1]C -> [{0,1,[1,30]},{1,2,[11,40]},{2,5,[21,50]},{5,10,[31,60]},{10,20,[41,60]},{30,20,[51,70]},{50,10,[61,80]},{70,5,[71,80]},{100,2,[81,90]},{150,1,[91,100]}]
A1918: 1915 | B1918: 4 | C1918: 24 | D1918: 0 | E1918: =R[-9]C -> 71 | F1918: =R[-9]C -> 80 | G1918: 3 | H1918: 15000 | I1918: 110003 | J1918: 3 | K1918: =R[-1]C -> [{5,8},{6,15},{13,10},{14,8},{15,10},{16,8},{20,1},{27,10},{28,10}] | L1918: =R[-1]C -> [{5,1113},{6,1113},{13,18},{14,37},{15,18},{16,37},{20,3},{27,18},{28,18}] | M1918: =R[-1]C -> [{0,1,[1,30]},{1,2,[11,40]},{2,5,[21,50]},{5,10,[31,60]},{10,20,[41,60]},{30,20,[51,70]},{50,10,[61,80]},{70,5,[71,80]},{100,2,[81,90]},{150,1,[91,100]}]
A1919: 1916 | B1919: 4 | C1919: 24 | D1919: 0 | E1919: =R[-9]C -> 81 | F1919: =R[-9]C -> 90 | G1919: 3 | H1919: 15000 | I1919: 110003 | J1919: 3 | K1919: =R[-1]C -> [{5,8},{6,15},{13,10},{14,8},{15,10},{16,8},{20,1},{27,10},{28,10}] | L1919: =R[-1]C -> [{5,1113},{6,1113},{13,18},{14,37},{15,18},{16,37},{20,3},{27,18},{28,18}] | M1919: =R[-1]C -> [{0,1,[1,30]},{1,2,[11,40]},{2,5,[21,50]},{5,10,[31,60]},{10,20,[41,60]},{30,20,[51,70]},{50,10,[61,80]},{70,5,[71,80]},{100,2,[81,90]},{150,1,[91,100]}]
A1920: 1917 | B1920: 5 | C1920: 24 | D1920: 0 | E1920: =R[-9]C -> 1 | F1920: =R[-9]C -> 10 | G1920: 4 | H1920: 20000 | I1920: 110003 | J1920: 4 | K1920: =R[-1]C -> [{5,8},{6,15},{13,10},{14,8},{15,10},{16,8},{20,1},{27,10},{28,10}] | L1920: =R[-1]C -> [{5,1113},{6,1113},{13,18},{14,37},{15,18},{16,37},{20,3},{27,18},{28,18}] | M1920: =R[-1]C -> [{0,1,[1,30]},{1,2,[11,40]},{2,5,[21,50]},{5,10,[31,60]},{10,20,[41,60]},{30,20,[51,70]},{50,10,[61,80]},{70,5,[71,80]},{100,2,[81,90]},{150,1,[91,100]}]
A1921: 1918 | B1921: 5 | C1921: 24 | D1921: 0 | E1921: =R[-9]C -> 11 | F1921: =R[-9]C -> 20 | G1921: 4 | H1921: 20000 | I1921: 110003 | J1921: 4 | K1921: =R[-1]C -> [{5,8},{6,15},{13,10},{14,8},{15,10},{16,8},{20,1},{27,10},{28,10}] | L1921: =R[-1]C -> [{5,1113},{6,1113},{13,18},{14,37},{15,18},{16,37},{20,3},{27,18},{28,18}] | M1921: =R[-1]C -> [{0,1,[1,30]},{1,2,[11,40]},{2,5,[21,50]},{5,10,[31,60]},{10,20,[41,60]},{30,20,[51,70]},{50,10,[61,80]},{70,5,[71,80]},{100,2,[81,90]},{150,1,[91,100]}]
A1922: 1919 | B1922: 5 | C1922: 24 | D1922: 0 | E1922: =R[-9]C -> 21 | F1922: =R[-9]C -> 30 | G1922: 4 | H1922: 20000 | I1922: 110003 | J1922: 4 | K1922: =R[-1]C -> [{5,8},{6,15},{13,10},{14,8},{15,10},{16,8},{20,1},{27,10},{28,10}] | L1922: =R[-1]C -> [{5,1113},{6,1113},{13,18},{14,37},{15,18},{16,37},{20,3},{27,18},{28,18}] | M1922: =R[-1]C -> [{0,1,[1,30]},{1,2,[11,40]},{2,5,[21,50]},{5,10,[31,60]},{10,20,[41,60]},{30,20,[51,70]},{50,10,[61,80]},{70,5,[71,80]},{100,2,[81,90]},{150,1,[91,100]}]
A1923: 1920 | B1923: 5 | C1923: 24 | D1923: 0 | E1923: =R[-9]C -> 31 | F1923: =R[-9]C -> 40 | G1923: 4 | H1923: 20000 | I1923: 110003 | J1923: 4 | K1923: =R[-1]C -> [{5,8},{6,15},{13,10},{14,8},{15,10},{16,8},{20,1},{27,10},{28,10}] | L1923: =R[-1]C -> [{5,1113},{6,1113},{13,18},{14,37},{15,18},{16,37},{20,3},{27,18},{28,18}] | M1923: =R[-1]C -> [{0,1,[1,30]},{1,2,[11,40]},{2,5,[21,50]},{5,10,[31,60]},{10,20,[41,60]},{30,20,[51,70]},{50,10,[61,80]},{70,5,[71,80]},{100,2,[81,90]},{150,1,[91,100]}]
A1924: 1921 | B1924: 5 | C1924: 24 | D1924: 0 | E1924: =R[-9]C -> 41 | F1924: =R[-9]C -> 50 | G1924: 4 | H1924: 20000 | I1924: 110003 | J1924: 4 | K1924: =R[-1]C -> [{5,8},{6,15},{13,10},{14,8},{15,10},{16,8},{20,1},{27,10},{28,10}] | L1924: =R[-1]C -> [{5,1113},{6,1113},{13,18},{14,37},{15,18},{16,37},{20,3},{27,18},{28,18}] | M1924: =R[-1]C -> [{0,1,[1,30]},{1,2,[11,40]},{2,5,[21,50]},{5,10,[31,60]},{10,20,[41,60]},{30,20,[51,70]},{50,10,[61,80]},{70,5,[71,80]},{100,2,[81,90]},{150,1,[91,100]}]
A1925: 1922 | B1925: 5 | C1925: 24 | D1925: 0 | E1925: =R[-9]C -> 51 | F1925: =R[-9]C -> 60 | G1925: 4 | H1925: 20000 | I1925: 110003 | J1925: 4 | K1925: =R[-1]C -> [{5,8},{6,15},{13,10},{14,8},{15,10},{16,8},{20,1},{27,10},{28,10}] | L1925: =R[-1]C -> [{5,1113},{6,1113},{13,18},{14,37},{15,18},{16,37},{20,3},{27,18},{28,18}] | M1925: =R[-1]C -> [{0,1,[1,30]},{1,2,[11,40]},{2,5,[21,50]},{5,10,[31,60]},{10,20,[41,60]},{30,20,[51,70]},{50,10,[61,80]},{70,5,[71,80]},{100,2,[81,90]},{150,1,[91,100]}]
A1926: 1923 | B1926: 5 | C1926: 24 | D1926: 0 | E1926: =R[-9]C -> 61 | F1926: =R[-9]C -> 70 | G1926: 4 | H1926: 20000 | I1926: 110003 | J1926: 4 | K1926: =R[-1]C -> [{5,8},{6,15},{13,10},{14,8},{15,10},{16,8},{20,1},{27,10},{28,10}] | L1926: =R[-1]C -> [{5,1113},{6,1113},{13,18},{14,37},{15,18},{16,37},{20,3},{27,18},{28,18}] | M1926: =R[-1]C -> [{0,1,[1,30]},{1,2,[11,40]},{2,5,[21,50]},{5,10,[31,60]},{10,20,[41,60]},{30,20,[51,70]},{50,10,[61,80]},{70,5,[71,80]},{100,2,[81,90]},{150,1,[91,100]}]
A1927: 1924 | B1927: 5 | C1927: 24 | D1927: 0 | E1927: =R[-9]C -> 71 | F1927: =R[-9]C -> 80 | G1927: 4 | H1927: 20000 | I1927: 110003 | J1927: 4 | K1927: =R[-1]C -> [{5,8},{6,15},{13,10},{14,8},{15,10},{16,8},{20,1},{27,10},{28,10}] | L1927: =R[-1]C -> [{5,1113},{6,1113},{13,18},{14,37},{15,18},{16,37},{20,3},{27,18},{28,18}] | M1927: =R[-1]C -> [{0,1,[1,30]},{1,2,[11,40]},{2,5,[21,50]},{5,10,[31,60]},{10,20,[41,60]},{30,20,[51,70]},{50,10,[61,80]},{70,5,[71,80]},{100,2,[81,90]},{150,1,[91,100]}]
A1928: 1925 | B1928: 5 | C1928: 24 | D1928: 0 | E1928: =R[-9]C -> 81 | F1928: =R[-9]C -> 90 | G1928: 4 | H1928: 20000 | I1928: 110003 | J1928: 4 | K1928: =R[-1]C -> [{5,8},{6,15},{13,10},{14,8},{15,10},{16,8},{20,1},{27,10},{28,10}] | L1928: =R[-1]C -> [{5,1113},{6,1113},{13,18},{14,37},{15,18},{16,37},{20,3},{27,18},{28,18}] | M1928: =R[-1]C -> [{0,1,[1,30]},{1,2,[11,40]},{2,5,[21,50]},{5,10,[31,60]},{10,20,[41,60]},{30,20,[51,70]},{50,10,[61,80]},{70,5,[71,80]},{100,2,[81,90]},{150,1,[91,100]}]
A1929: 1926 | B1929: 6 | C1929: 24 | D1929: 0 | E1929: =R[-9]C -> 1 | F1929: =R[-9]C -> 10 | G1929: 5 | H1929: 20000 | I1929: 110003 | J1929: 5 | K1929: =R[-1]C -> [{5,8},{6,15},{13,10},{14,8},{15,10},{16,8},{20,1},{27,10},{28,10}] | L1929: =R[-1]C -> [{5,1113},{6,1113},{13,18},{14,37},{15,18},{16,37},{20,3},{27,18},{28,18}] | M1929: =R[-1]C -> [{0,1,[1,30]},{1,2,[11,40]},{2,5,[21,50]},{5,10,[31,60]},{10,20,[41,60]},{30,20,[51,70]},{50,10,[61,80]},{70,5,[71,80]},{100,2,[81,90]},{150,1,[91,100]}]
A1930: 1927 | B1930: 6 | C1930: 24 | D1930: 0 | E1930: =R[-9]C -> 11 | F1930: =R[-9]C -> 20 | G1930: 5 | H1930: 20000 | I1930: 110003 | J1930: 5 | K1930: =R[-1]C -> [{5,8},{6,15},{13,10},{14,8},{15,10},{16,8},{20,1},{27,10},{28,10}] | L1930: =R[-1]C -> [{5,1113},{6,1113},{13,18},{14,37},{15,18},{16,37},{20,3},{27,18},{28,18}] | M1930: =R[-1]C -> [{0,1,[1,30]},{1,2,[11,40]},{2,5,[21,50]},{5,10,[31,60]},{10,20,[41,60]},{30,20,[51,70]},{50,10,[61,80]},{70,5,[71,80]},{100,2,[81,90]},{150,1,[91,100]}]
A1931: 1928 | B1931: 6 | C1931: 24 | D1931: 0 | E1931: =R[-9]C -> 21 | F1931: =R[-9]C -> 30 | G1931: 5 | H1931: 20000 | I1931: 110003 | J1931: 5 | K1931: =R[-1]C -> [{5,8},{6,15},{13,10},{14,8},{15,10},{16,8},{20,1},{27,10},{28,10}] | L1931: =R[-1]C -> [{5,1113},{6,1113},{13,18},{14,37},{15,18},{16,37},{20,3},{27,18},{28,18}] | M1931: =R[-1]C -> [{0,1,[1,30]},{1,2,[11,40]},{2,5,[21,50]},{5,10,[31,60]},{10,20,[41,60]},{30,20,[51,70]},{50,10,[61,80]},{70,5,[71,80]},{100,2,[81,90]},{150,1,[91,100]}]
A1932: 1929 | B1932: 6 | C1932: 24 | D1932: 0 | E1932: =R[-9]C -> 31 | F1932: =R[-9]C -> 40 | G1932: 5 | H1932: 20000 | I1932: 110003 | J1932: 5 | K1932: =R[-1]C -> [{5,8},{6,15},{13,10},{14,8},{15,10},{16,8},{20,1},{27,10},{28,10}] | L1932: =R[-1]C -> [{5,1113},{6,1113},{13,18},{14,37},{15,18},{16,37},{20,3},{27,18},{28,18}] | M1932: =R[-1]C -> [{0,1,[1,30]},{1,2,[11,40]},{2,5,[21,50]},{5,10,[31,60]},{10,20,[41,60]},{30,20,[51,70]},{50,10,[61,80]},{70,5,[71,80]},{100,2,[81,90]},{150,1,[91,100]}]
A1933: 1930 | B1933: 6 | C1933: 24 | D1933: 0 | E1933: =R[-9]C -> 41 | F1933: =R[-9]C -> 50 | G1933: 5 | H1933: 20000 | I1933: 110003 | J1933: 5 | K1933: =R[-1]C -> [{5,8},{6,15},{13,10},{14,8},{15,10},{16,8},{20,1},{27,10},{28,10}] | L1933: =R[-1]C -> [{5,1113},{6,1113},{13,18},{14,37},{15,18},{16,37},{20,3},{27,18},{28,18}] | M1933: =R[-1]C -> [{0,1,[1,30]},{1,2,[11,40]},{2,5,[21,50]},{5,10,[31,60]},{10,20,[41,60]},{30,20,[51,70]},{50,10,[61,80]},{70,5,[71,80]},{100,2,[81,90]},{150,1,[91,100]}]
A1934: 1931 | B1934: 6 | C1934: 24 | D1934: 0 | E1934: =R[-9]C -> 51 | F1934: =R[-9]C -> 60 | G1934: 5 | H1934: 20000 | I1934: 110003 | J1934: 5 | K1934: =R[-1]C -> [{5,8},{6,15},{13,10},{14,8},{15,10},{16,8},{20,1},{27,10},{28,10}] | L1934: =R[-1]C -> [{5,1113},{6,1113},{13,18},{14,37},{15,18},{16,37},{20,3},{27,18},{28,18}] | M1934: =R[-1]C -> [{0,1,[1,30]},{1,2,[11,40]},{2,5,[21,50]},{5,10,[31,60]},{10,20,[41,60]},{30,20,[51,70]},{50,10,[61,80]},{70,5,[71,80]},{100,2,[81,90]},{150,1,[91,100]}]
A1935: 1932 | B1935: 6 | C1935: 24 | D1935: 0 | E1935: =R[-9]C -> 61 | F1935: =R[-9]C -> 70 | G1935: 5 | H1935: 20000 | I1935: 110003 | J1935: 5 | K1935: =R[-1]C -> [{5,8},{6,15},{13,10},{14,8},{15,10},{16,8},{20,1},{27,10},{28,10}] | L1935: =R[-1]C -> [{5,1113},{6,1113},{13,18},{14,37},{15,18},{16,37},{20,3},{27,18},{28,18}] | M1935: =R[-1]C -> [{0,1,[1,30]},{1,2,[11,40]},{2,5,[21,50]},{5,10,[31,60]},{10,20,[41,60]},{30,20,[51,70]},{50,10,[61,80]},{70,5,[71,80]},{100,2,[81,90]},{150,1,[91,100]}]
A1936: 1933 | B1936: 6 | C1936: 24 | D1936: 0 | E1936: =R[-9]C -> 71 | F1936: =R[-9]C -> 80 | G1936: 5 | H1936: 20000 | I1936: 110003 | J1936: 5 | K1936: =R[-1]C -> [{5,8},{6,15},{13,10},{14,8},{15,10},{16,8},{20,1},{27,10},{28,10}] | L1936: =R[-1]C -> [{5,1113},{6,1113},{13,18},{14,37},{15,18},{16,37},{20,3},{27,18},{28,18}] | M1936: =R[-1]C -> [{0,1,[1,30]},{1,2,[11,40]},{2,5,[21,50]},{5,10,[31,60]},{10,20,[41,60]},{30,20,[51,70]},{50,10,[61,80]},{70,5,[71,80]},{100,2,[81,90]},{150,1,[91,100]}]
A1937: 1934 | B1937: 6 | C1937: 24 | D1937: 0 | E1937: =R[-9]C -> 81 | F1937: =R[-9]C -> 90 | G1937: 5 | H1937: 20000 | I1937: 110003 | J1937: 5 | K1937: =R[-1]C -> [{5,8},{6,15},{13,10},{14,8},{15,10},{16,8},{20,1},{27,10},{28,10}] | L1937: =R[-1]C -> [{5,1113},{6,1113},{13,18},{14,37},{15,18},{16,37},{20,3},{27,18},{28,18}] | M1937: =R[-1]C -> [{0,1,[1,30]},{1,2,[11,40]},{2,5,[21,50]},{5,10,[31,60]},{10,20,[41,60]},{30,20,[51,70]},{50,10,[61,80]},{70,5,[71,80]},{100,2,[81,90]},{150,1,[91,100]}]
A1938: 1935 | B1938: 2 | C1938: 25 | D1938: 0 | E1938: =R[-18]C -> 1 | F1938: =R[-18]C -> 10 | G1938: 1 | H1938: 5000 | I1938: 110003 | J1938: 1 | K1938: =R[-1]C -> [{5,8},{6,15},{13,10},{14,8},{15,10},{16,8},{20,1},{27,10},{28,10}] | L1938: =R[-1]C -> [{5,1113},{6,1113},{13,18},{14,37},{15,18},{16,37},{20,3},{27,18},{28,18}] | M1938: =R[-1]C -> [{0,1,[1,30]},{1,2,[11,40]},{2,5,[21,50]},{5,10,[31,60]},{10,20,[41,60]},{30,20,[51,70]},{50,10,[61,80]},{70,5,[71,80]},{100,2,[81,90]},{150,1,[91,100]}]
A1939: 1936 | B1939: 2 | C1939: 25 | D1939: 0 | E1939: =R[-18]C -> 11 | F1939: =R[-18]C -> 20 | G1939: 1 | H1939: 5000 | I1939: 110003 | J1939: 1 | K1939: =R[-1]C -> [{5,8},{6,15},{13,10},{14,8},{15,10},{16,8},{20,1},{27,10},{28,10}] | L1939: =R[-1]C -> [{5,1113},{6,1113},{13,18},{14,37},{15,18},{16,37},{20,3},{27,18},{28,18}] | M1939: =R[-1]C -> [{0,1,[1,30]},{1,2,[11,40]},{2,5,[21,50]},{5,10,[31,60]},{10,20,[41,60]},{30,20,[51,70]},{50,10,[61,80]},{70,5,[71,80]},{100,2,[81,90]},{150,1,[91,100]}]
A1940: 1937 | B1940: 2 | C1940: 25 | D1940: 0 | E1940: =R[-18]C -> 21 | F1940: =R[-18]C -> 30 | G1940: 1 | H1940: 5000 | I1940: 110003 | J1940: 1 | K1940: =R[-1]C -> [{5,8},{6,15},{13,10},{14,8},{15,10},{16,8},{20,1},{27,10},{28,10}] | L1940: =R[-1]C -> [{5,1113},{6,1113},{13,18},{14,37},{15,18},{16,37},{20,3},{27,18},{28,18}] | M1940: =R[-1]C -> [{0,1,[1,30]},{1,2,[11,40]},{2,5,[21,50]},{5,10,[31,60]},{10,20,[41,60]},{30,20,[51,70]},{50,10,[61,80]},{70,5,[71,80]},{100,2,[81,90]},{150,1,[91,100]}]
A1941: 1938 | B1941: 2 | C1941: 25 | D1941: 0 | E1941: =R[-18]C -> 31 | F1941: =R[-18]C -> 40 | G1941: 1 | H1941: 5000 | I1941: 110003 | J1941: 1 | K1941: =R[-1]C -> [{5,8},{6,15},{13,10},{14,8},{15,10},{16,8},{20,1},{27,10},{28,10}] | L1941: =R[-1]C -> [{5,1113},{6,1113},{13,18},{14,37},{15,18},{16,37},{20,3},{27,18},{28,18}] | M1941: =R[-1]C -> [{0,1,[1,30]},{1,2,[11,40]},{2,5,[21,50]},{5,10,[31,60]},{10,20,[41,60]},{30,20,[51,70]},{50,10,[61,80]},{70,5,[71,80]},{100,2,[81,90]},{150,1,[91,100]}]
A1942: 1939 | B1942: 2 | C1942: 25 | D1942: 0 | E1942: =R[-18]C -> 41 | F1942: =R[-18]C -> 50 | G1942: 1 | H1942: 5000 | I1942: 110003 | J1942: 1 | K1942: =R[-1]C -> [{5,8},{6,15},{13,10},{14,8},{15,10},{16,8},{20,1},{27,10},{28,10}] | L1942: =R[-1]C -> [{5,1113},{6,1113},{13,18},{14,37},{15,18},{16,37},{20,3},{27,18},{28,18}] | M1942: =R[-1]C -> [{0,1,[1,30]},{1,2,[11,40]},{2,5,[21,50]},{5,10,[31,60]},{10,20,[41,60]},{30,20,[51,70]},{50,10,[61,80]},{70,5,[71,80]},{100,2,[81,90]},{150,1,[91,100]}]
A1943: 1940 | B1943: 2 | C1943: 25 | D1943: 0 | E1943: =R[-18]C -> 51 | F1943: =R[-18]C -> 60 | G1943: 1 | H1943: 5000 | I1943: 110003 | J1943: 1 | K1943: =R[-1]C -> [{5,8},{6,15},{13,10},{14,8},{15,10},{16,8},{20,1},{27,10},{28,10}] | L1943: =R[-1]C -> [{5,1113},{6,1113},{13,18},{14,37},{15,18},{16,37},{20,3},{27,18},{28,18}] | M1943: =R[-1]C -> [{0,1,[1,30]},{1,2,[11,40]},{2,5,[21,50]},{5,10,[31,60]},{10,20,[41,60]},{30,20,[51,70]},{50,10,[61,80]},{70,5,[71,80]},{100,2,[81,90]},{150,1,[91,100]}]
A1944: 1941 | B1944: 2 | C1944: 25 | D1944: 0 | E1944: =R[-18]C -> 61 | F1944: =R[-18]C -> 70 | G1944: 1 | H1944: 5000 | I1944: 110003 | J1944: 1 | K1944: =R[-1]C -> [{5,8},{6,15},{13,10},{14,8},{15,10},{16,8},{20,1},{27,10},{28,10}] | L1944: =R[-1]C -> [{5,1113},{6,1113},{13,18},{14,37},{15,18},{16,37},{20,3},{27,18},{28,18}] | M1944: =R[-1]C -> [{0,1,[1,30]},{1,2,[11,40]},{2,5,[21,50]},{5,10,[31,60]},{10,20,[41,60]},{30,20,[51,70]},{50,10,[61,80]},{70,5,[71,80]},{100,2,[81,90]},{150,1,[91,100]}]
A1945: 1942 | B1945: 2 | C1945: 25 | D1945: 0 | E1945: =R[-18]C -> 71 | F1945: =R[-18]C -> 80 | G1945: 1 | H1945: 5000 | I1945: 110003 | J1945: 1 | K1945: =R[-1]C -> [{5,8},{6,15},{13,10},{14,8},{15,10},{16,8},{20,1},{27,10},{28,10}] | L1945: =R[-1]C -> [{5,1113},{6,1113},{13,18},{14,37},{15,18},{16,37},{20,3},{27,18},{28,18}] | M1945: =R[-1]C -> [{0,1,[1,30]},{1,2,[11,40]},{2,5,[21,50]},{5,10,[31,60]},{10,20,[41,60]},{30,20,[51,70]},{50,10,[61,80]},{70,5,[71,80]},{100,2,[81,90]},{150,1,[91,100]}]
A1946: 1943 | B1946: 2 | C1946: 25 | D1946: 0 | E1946: =R[-18]C -> 81 | F1946: =R[-18]C -> 90 | G1946: 1 | H1946: 5000 | I1946: 110003 | J1946: 1 | K1946: =R[-1]C -> [{5,8},{6,15},{13,10},{14,8},{15,10},{16,8},{20,1},{27,10},{28,10}] | L1946: =R[-1]C -> [{5,1113},{6,1113},{13,18},{14,37},{15,18},{16,37},{20,3},{27,18},{28,18}] | M1946: =R[-1]C -> [{0,1,[1,30]},{1,2,[11,40]},{2,5,[21,50]},{5,10,[31,60]},{10,20,[41,60]},{30,20,[51,70]},{50,10,[61,80]},{70,5,[71,80]},{100,2,[81,90]},{150,1,[91,100]}]
A1947: 1944 | B1947: 3 | C1947: 25 | D1947: 0 | E1947: =R[-9]C -> 1 | F1947: =R[-9]C -> 10 | G1947: 2 | H1947: 10000 | I1947: 110003 | J1947: 2 | K1947: =R[-1]C -> [{5,8},{6,15},{13,10},{14,8},{15,10},{16,8},{20,1},{27,10},{28,10}] | L1947: =R[-1]C -> [{5,1113},{6,1113},{13,18},{14,37},{15,18},{16,37},{20,3},{27,18},{28,18}] | M1947: =R[-1]C -> [{0,1,[1,30]},{1,2,[11,40]},{2,5,[21,50]},{5,10,[31,60]},{10,20,[41,60]},{30,20,[51,70]},{50,10,[61,80]},{70,5,[71,80]},{100,2,[81,90]},{150,1,[91,100]}]
A1948: 1945 | B1948: 3 | C1948: 25 | D1948: 0 | E1948: =R[-9]C -> 11 | F1948: =R[-9]C -> 20 | G1948: 2 | H1948: 10000 | I1948: 110003 | J1948: 2 | K1948: =R[-1]C -> [{5,8},{6,15},{13,10},{14,8},{15,10},{16,8},{20,1},{27,10},{28,10}] | L1948: =R[-1]C -> [{5,1113},{6,1113},{13,18},{14,37},{15,18},{16,37},{20,3},{27,18},{28,18}] | M1948: =R[-1]C -> [{0,1,[1,30]},{1,2,[11,40]},{2,5,[21,50]},{5,10,[31,60]},{10,20,[41,60]},{30,20,[51,70]},{50,10,[61,80]},{70,5,[71,80]},{100,2,[81,90]},{150,1,[91,100]}]
A1949: 1946 | B1949: 3 | C1949: 25 | D1949: 0 | E1949: =R[-9]C -> 21 | F1949: =R[-9]C -> 30 | G1949: 2 | H1949: 10000 | I1949: 110003 | J1949: 2 | K1949: =R[-1]C -> [{5,8},{6,15},{13,10},{14,8},{15,10},{16,8},{20,1},{27,10},{28,10}] | L1949: =R[-1]C -> [{5,1113},{6,1113},{13,18},{14,37},{15,18},{16,37},{20,3},{27,18},{28,18}] | M1949: =R[-1]C -> [{0,1,[1,30]},{1,2,[11,40]},{2,5,[21,50]},{5,10,[31,60]},{10,20,[41,60]},{30,20,[51,70]},{50,10,[61,80]},{70,5,[71,80]},{100,2,[81,90]},{150,1,[91,100]}]
A1950: 1947 | B1950: 3 | C1950: 25 | D1950: 0 | E1950: =R[-9]C -> 31 | F1950: =R[-9]C -> 40 | G1950: 2 | H1950: 10000 | I1950: 110003 | J1950: 2 | K1950: =R[-1]C -> [{5,8},{6,15},{13,10},{14,8},{15,10},{16,8},{20,1},{27,10},{28,10}] | L1950: =R[-1]C -> [{5,1113},{6,1113},{13,18},{14,37},{15,18},{16,37},{20,3},{27,18},{28,18}] | M1950: =R[-1]C -> [{0,1,[1,30]},{1,2,[11,40]},{2,5,[21,50]},{5,10,[31,60]},{10,20,[41,60]},{30,20,[51,70]},{50,10,[61,80]},{70,5,[71,80]},{100,2,[81,90]},{150,1,[91,100]}]
A1951: 1948 | B1951: 3 | C1951: 25 | D1951: 0 | E1951: =R[-9]C -> 41 | F1951: =R[-9]C -> 50 | G1951: 2 | H1951: 10000 | I1951: 110003 | J1951: 2 | K1951: =R[-1]C -> [{5,8},{6,15},{13,10},{14,8},{15,10},{16,8},{20,1},{27,10},{28,10}] | L1951: =R[-1]C -> [{5,1113},{6,1113},{13,18},{14,37},{15,18},{16,37},{20,3},{27,18},{28,18}] | M1951: =R[-1]C -> [{0,1,[1,30]},{1,2,[11,40]},{2,5,[21,50]},{5,10,[31,60]},{10,20,[41,60]},{30,20,[51,70]},{50,10,[61,80]},{70,5,[71,80]},{100,2,[81,90]},{150,1,[91,100]}]
A1952: 1949 | B1952: 3 | C1952: 25 | D1952: 0 | E1952: =R[-9]C -> 51 | F1952: =R[-9]C -> 60 | G1952: 2 | H1952: 10000 | I1952: 110003 | J1952: 2 | K1952: =R[-1]C -> [{5,8},{6,15},{13,10},{14,8},{15,10},{16,8},{20,1},{27,10},{28,10}] | L1952: =R[-1]C -> [{5,1113},{6,1113},{13,18},{14,37},{15,18},{16,37},{20,3},{27,18},{28,18}] | M1952: =R[-1]C -> [{0,1,[1,30]},{1,2,[11,40]},{2,5,[21,50]},{5,10,[31,60]},{10,20,[41,60]},{30,20,[51,70]},{50,10,[61,80]},{70,5,[71,80]},{100,2,[81,90]},{150,1,[91,100]}]
A1953: 1950 | B1953: 3 | C1953: 25 | D1953: 0 | E1953: =R[-9]C -> 61 | F1953: =R[-9]C -> 70 | G1953: 2 | H1953: 10000 | I1953: 110003 | J1953: 2 | K1953: =R[-1]C -> [{5,8},{6,15},{13,10},{14,8},{15,10},{16,8},{20,1},{27,10},{28,10}] | L1953: =R[-1]C -> [{5,1113},{6,1113},{13,18},{14,37},{15,18},{16,37},{20,3},{27,18},{28,18}] | M1953: =R[-1]C -> [{0,1,[1,30]},{1,2,[11,40]},{2,5,[21,50]},{5,10,[31,60]},{10,20,[41,60]},{30,20,[51,70]},{50,10,[61,80]},{70,5,[71,80]},{100,2,[81,90]},{150,1,[91,100]}]
A1954: 1951 | B1954: 3 | C1954: 25 | D1954: 0 | E1954: =R[-9]C -> 71 | F1954: =R[-9]C -> 80 | G1954: 2 | H1954: 10000 | I1954: 110003 | J1954: 2 | K1954: =R[-1]C -> [{5,8},{6,15},{13,10},{14,8},{15,10},{16,8},{20,1},{27,10},{28,10}] | L1954: =R[-1]C -> [{5,1113},{6,1113},{13,18},{14,37},{15,18},{16,37},{20,3},{27,18},{28,18}] | M1954: =R[-1]C -> [{0,1,[1,30]},{1,2,[11,40]},{2,5,[21,50]},{5,10,[31,60]},{10,20,[41,60]},{30,20,[51,70]},{50,10,[61,80]},{70,5,[71,80]},{100,2,[81,90]},{150,1,[91,100]}]
A1955: 1952 | B1955: 3 | C1955: 25 | D1955: 0 | E1955: =R[-9]C -> 81 | F1955: =R[-9]C -> 90 | G1955: 2 | H1955: 10000 | I1955: 110003 | J1955: 2 | K1955: =R[-1]C -> [{5,8},{6,15},{13,10},{14,8},{15,10},{16,8},{20,1},{27,10},{28,10}] | L1955: =R[-1]C -> [{5,1113},{6,1113},{13,18},{14,37},{15,18},{16,37},{20,3},{27,18},{28,18}] | M1955: =R[-1]C -> [{0,1,[1,30]},{1,2,[11,40]},{2,5,[21,50]},{5,10,[31,60]},{10,20,[41,60]},{30,20,[51,70]},{50,10,[61,80]},{70,5,[71,80]},{100,2,[81,90]},{150,1,[91,100]}]
A1956: 1953 | B1956: 4 | C1956: 25 | D1956: 0 | E1956: =R[-9]C -> 1 | F1956: =R[-9]C -> 10 | G1956: 3 | H1956: 15000 | I1956: 110003 | J1956: 3 | K1956: =R[-1]C -> [{5,8},{6,15},{13,10},{14,8},{15,10},{16,8},{20,1},{27,10},{28,10}] | L1956: =R[-1]C -> [{5,1113},{6,1113},{13,18},{14,37},{15,18},{16,37},{20,3},{27,18},{28,18}] | M1956: =R[-1]C -> [{0,1,[1,30]},{1,2,[11,40]},{2,5,[21,50]},{5,10,[31,60]},{10,20,[41,60]},{30,20,[51,70]},{50,10,[61,80]},{70,5,[71,80]},{100,2,[81,90]},{150,1,[91,100]}]
A1957: 1954 | B1957: 4 | C1957: 25 | D1957: 0 | E1957: =R[-9]C -> 11 | F1957: =R[-9]C -> 20 | G1957: 3 | H1957: 15000 | I1957: 110003 | J1957: 3 | K1957: =R[-1]C -> [{5,8},{6,15},{13,10},{14,8},{15,10},{16,8},{20,1},{27,10},{28,10}] | L1957: =R[-1]C -> [{5,1113},{6,1113},{13,18},{14,37},{15,18},{16,37},{20,3},{27,18},{28,18}] | M1957: =R[-1]C -> [{0,1,[1,30]},{1,2,[11,40]},{2,5,[21,50]},{5,10,[31,60]},{10,20,[41,60]},{30,20,[51,70]},{50,10,[61,80]},{70,5,[71,80]},{100,2,[81,90]},{150,1,[91,100]}]
A1958: 1955 | B1958: 4 | C1958: 25 | D1958: 0 | E1958: =R[-9]C -> 21 | F1958: =R[-9]C -> 30 | G1958: 3 | H1958: 15000 | I1958: 110003 | J1958: 3 | K1958: =R[-1]C -> [{5,8},{6,15},{13,10},{14,8},{15,10},{16,8},{20,1},{27,10},{28,10}] | L1958: =R[-1]C -> [{5,1113},{6,1113},{13,18},{14,37},{15,18},{16,37},{20,3},{27,18},{28,18}] | M1958: =R[-1]C -> [{0,1,[1,30]},{1,2,[11,40]},{2,5,[21,50]},{5,10,[31,60]},{10,20,[41,60]},{30,20,[51,70]},{50,10,[61,80]},{70,5,[71,80]},{100,2,[81,90]},{150,1,[91,100]}]
A1959: 1956 | B1959: 4 | C1959: 25 | D1959: 0 | E1959: =R[-9]C -> 31 | F1959: =R[-9]C -> 40 | G1959: 3 | H1959: 15000 | I1959: 110003 | J1959: 3 | K1959: =R[-1]C -> [{5,8},{6,15},{13,10},{14,8},{15,10},{16,8},{20,1},{27,10},{28,10}] | L1959: =R[-1]C -> [{5,1113},{6,1113},{13,18},{14,37},{15,18},{16,37},{20,3},{27,18},{28,18}] | M1959: =R[-1]C -> [{0,1,[1,30]},{1,2,[11,40]},{2,5,[21,50]},{5,10,[31,60]},{10,20,[41,60]},{30,20,[51,70]},{50,10,[61,80]},{70,5,[71,80]},{100,2,[81,90]},{150,1,[91,100]}]
A1960: 1957 | B1960: 4 | C1960: 25 | D1960: 0 | E1960: =R[-9]C -> 41 | F1960: =R[-9]C -> 50 | G1960: 3 | H1960: 15000 | I1960: 110003 | J1960: 3 | K1960: =R[-1]C -> [{5,8},{6,15},{13,10},{14,8},{15,10},{16,8},{20,1},{27,10},{28,10}] | L1960: =R[-1]C -> [{5,1113},{6,1113},{13,18},{14,37},{15,18},{16,37},{20,3},{27,18},{28,18}] | M1960: =R[-1]C -> [{0,1,[1,30]},{1,2,[11,40]},{2,5,[21,50]},{5,10,[31,60]},{10,20,[41,60]},{30,20,[51,70]},{50,10,[61,80]},{70,5,[71,80]},{100,2,[81,90]},{150,1,[91,100]}]
A1961: 1958 | B1961: 4 | C1961: 25 | D1961: 0 | E1961: =R[-9]C -> 51 | F1961: =R[-9]C -> 60 | G1961: 3 | H1961: 15000 | I1961: 110003 | J1961: 3 | K1961: =R[-1]C -> [{5,8},{6,15},{13,10},{14,8},{15,10},{16,8},{20,1},{27,10},{28,10}] | L1961: =R[-1]C -> [{5,1113},{6,1113},{13,18},{14,37},{15,18},{16,37},{20,3},{27,18},{28,18}] | M1961: =R[-1]C -> [{0,1,[1,30]},{1,2,[11,40]},{2,5,[21,50]},{5,10,[31,60]},{10,20,[41,60]},{30,20,[51,70]},{50,10,[61,80]},{70,5,[71,80]},{100,2,[81,90]},{150,1,[91,100]}]
A1962: 1959 | B1962: 4 | C1962: 25 | D1962: 0 | E1962: =R[-9]C -> 61 | F1962: =R[-9]C -> 70 | G1962: 3 | H1962: 15000 | I1962: 110003 | J1962: 3 | K1962: =R[-1]C -> [{5,8},{6,15},{13,10},{14,8},{15,10},{16,8},{20,1},{27,10},{28,10}] | L1962: =R[-1]C -> [{5,1113},{6,1113},{13,18},{14,37},{15,18},{16,37},{20,3},{27,18},{28,18}] | M1962: =R[-1]C -> [{0,1,[1,30]},{1,2,[11,40]},{2,5,[21,50]},{5,10,[31,60]},{10,20,[41,60]},{30,20,[51,70]},{50,10,[61,80]},{70,5,[71,80]},{100,2,[81,90]},{150,1,[91,100]}]
A1963: 1960 | B1963: 4 | C1963: 25 | D1963: 0 | E1963: =R[-9]C -> 71 | F1963: =R[-9]C -> 80 | G1963: 3 | H1963: 15000 | I1963: 110003 | J1963: 3 | K1963: =R[-1]C -> [{5,8},{6,15},{13,10},{14,8},{15,10},{16,8},{20,1},{27,10},{28,10}] | L1963: =R[-1]C -> [{5,1113},{6,1113},{13,18},{14,37},{15,18},{16,37},{20,3},{27,18},{28,18}] | M1963: =R[-1]C -> [{0,1,[1,30]},{1,2,[11,40]},{2,5,[21,50]},{5,10,[31,60]},{10,20,[41,60]},{30,20,[51,70]},{50,10,[61,80]},{70,5,[71,80]},{100,2,[81,90]},{150,1,[91,100]}]
A1964: 1961 | B1964: 4 | C1964: 25 | D1964: 0 | E1964: =R[-9]C -> 81 | F1964: =R[-9]C -> 90 | G1964: 3 | H1964: 15000 | I1964: 110003 | J1964: 3 | K1964: =R[-1]C -> [{5,8},{6,15},{13,10},{14,8},{15,10},{16,8},{20,1},{27,10},{28,10}] | L1964: =R[-1]C -> [{5,1113},{6,1113},{13,18},{14,37},{15,18},{16,37},{20,3},{27,18},{28,18}] | M1964: =R[-1]C -> [{0,1,[1,30]},{1,2,[11,40]},{2,5,[21,50]},{5,10,[31,60]},{10,20,[41,60]},{30,20,[51,70]},{50,10,[61,80]},{70,5,[71,80]},{100,2,[81,90]},{150,1,[91,100]}]
A1965: 1962 | B1965: 5 | C1965: 25 | D1965: 0 | E1965: =R[-9]C -> 1 | F1965: =R[-9]C -> 10 | G1965: 4 | H1965: 20000 | I1965: 110003 | J1965: 4 | K1965: =R[-1]C -> [{5,8},{6,15},{13,10},{14,8},{15,10},{16,8},{20,1},{27,10},{28,10}] | L1965: =R[-1]C -> [{5,1113},{6,1113},{13,18},{14,37},{15,18},{16,37},{20,3},{27,18},{28,18}] | M1965: =R[-1]C -> [{0,1,[1,30]},{1,2,[11,40]},{2,5,[21,50]},{5,10,[31,60]},{10,20,[41,60]},{30,20,[51,70]},{50,10,[61,80]},{70,5,[71,80]},{100,2,[81,90]},{150,1,[91,100]}]
A1966: 1963 | B1966: 5 | C1966: 25 | D1966: 0 | E1966: =R[-9]C -> 11 | F1966: =R[-9]C -> 20 | G1966: 4 | H1966: 20000 | I1966: 110003 | J1966: 4 | K1966: =R[-1]C -> [{5,8},{6,15},{13,10},{14,8},{15,10},{16,8},{20,1},{27,10},{28,10}] | L1966: =R[-1]C -> [{5,1113},{6,1113},{13,18},{14,37},{15,18},{16,37},{20,3},{27,18},{28,18}] | M1966: =R[-1]C -> [{0,1,[1,30]},{1,2,[11,40]},{2,5,[21,50]},{5,10,[31,60]},{10,20,[41,60]},{30,20,[51,70]},{50,10,[61,80]},{70,5,[71,80]},{100,2,[81,90]},{150,1,[91,100]}]
A1967: 1964 | B1967: 5 | C1967: 25 | D1967: 0 | E1967: =R[-9]C -> 21 | F1967: =R[-9]C -> 30 | G1967: 4 | H1967: 20000 | I1967: 110003 | J1967: 4 | K1967: =R[-1]C -> [{5,8},{6,15},{13,10},{14,8},{15,10},{16,8},{20,1},{27,10},{28,10}] | L1967: =R[-1]C -> [{5,1113},{6,1113},{13,18},{14,37},{15,18},{16,37},{20,3},{27,18},{28,18}] | M1967: =R[-1]C -> [{0,1,[1,30]},{1,2,[11,40]},{2,5,[21,50]},{5,10,[31,60]},{10,20,[41,60]},{30,20,[51,70]},{50,10,[61,80]},{70,5,[71,80]},{100,2,[81,90]},{150,1,[91,100]}]
A1968: 1965 | B1968: 5 | C1968: 25 | D1968: 0 | E1968: =R[-9]C -> 31 | F1968: =R[-9]C -> 40 | G1968: 4 | H1968: 20000 | I1968: 110003 | J1968: 4 | K1968: =R[-1]C -> [{5,8},{6,15},{13,10},{14,8},{15,10},{16,8},{20,1},{27,10},{28,10}] | L1968: =R[-1]C -> [{5,1113},{6,1113},{13,18},{14,37},{15,18},{16,37},{20,3},{27,18},{28,18}] | M1968: =R[-1]C -> [{0,1,[1,30]},{1,2,[11,40]},{2,5,[21,50]},{5,10,[31,60]},{10,20,[41,60]},{30,20,[51,70]},{50,10,[61,80]},{70,5,[71,80]},{100,2,[81,90]},{150,1,[91,100]}]
A1969: 1966 | B1969: 5 | C1969: 25 | D1969: 0 | E1969: =R[-9]C -> 41 | F1969: =R[-9]C -> 50 | G1969: 4 | H1969: 20000 | I1969: 110003 | J1969: 4 | K1969: =R[-1]C -> [{5,8},{6,15},{13,10},{14,8},{15,10},{16,8},{20,1},{27,10},{28,10}] | L1969: =R[-1]C -> [{5,1113},{6,1113},{13,18},{14,37},{15,18},{16,37},{20,3},{27,18},{28,18}] | M1969: =R[-1]C -> [{0,1,[1,30]},{1,2,[11,40]},{2,5,[21,50]},{5,10,[31,60]},{10,20,[41,60]},{30,20,[51,70]},{50,10,[61,80]},{70,5,[71,80]},{100,2,[81,90]},{150,1,[91,100]}]
A1970: 1967 | B1970: 5 | C1970: 25 | D1970: 0 | E1970: =R[-9]C -> 51 | F1970: =R[-9]C -> 60 | G1970: 4 | H1970: 20000 | I1970: 110003 | J1970: 4 | K1970: =R[-1]C -> [{5,8},{6,15},{13,10},{14,8},{15,10},{16,8},{20,1},{27,10},{28,10}] | L1970: =R[-1]C -> [{5,1113},{6,1113},{13,18},{14,37},{15,18},{16,37},{20,3},{27,18},{28,18}] | M1970: =R[-1]C -> [{0,1,[1,30]},{1,2,[11,40]},{2,5,[21,50]},{5,10,[31,60]},{10,20,[41,60]},{30,20,[51,70]},{50,10,[61,80]},{70,5,[71,80]},{100,2,[81,90]},{150,1,[91,100]}]
A1971: 1968 | B1971: 5 | C1971: 25 | D1971: 0 | E1971: =R[-9]C -> 61 | F1971: =R[-9]C -> 70 | G1971: 4 | H1971: 20000 | I1971: 110003 | J1971: 4 | K1971: =R[-1]C -> [{5,8},{6,15},{13,10},{14,8},{15,10},{16,8},{20,1},{27,10},{28,10}] | L1971: =R[-1]C -> [{5,1113},{6,1113},{13,18},{14,37},{15,18},{16,37},{20,3},{27,18},{28,18}] | M1971: =R[-1]C -> [{0,1,[1,30]},{1,2,[11,40]},{2,5,[21,50]},{5,10,[31,60]},{10,20,[41,60]},{30,20,[51,70]},{50,10,[61,80]},{70,5,[71,80]},{100,2,[81,90]},{150,1,[91,100]}]
A1972: 1969 | B1972: 5 | C1972: 25 | D1972: 0 | E1972: =R[-9]C -> 71 | F1972: =R[-9]C -> 80 | G1972: 4 | H1972: 20000 | I1972: 110003 | J1972: 4 | K1972: =R[-1]C -> [{5,8},{6,15},{13,10},{14,8},{15,10},{16,8},{20,1},{27,10},{28,10}] | L1972: =R[-1]C -> [{5,1113},{6,1113},{13,18},{14,37},{15,18},{16,37},{20,3},{27,18},{28,18}] | M1972: =R[-1]C -> [{0,1,[1,30]},{1,2,[11,40]},{2,5,[21,50]},{5,10,[31,60]},{10,20,[41,60]},{30,20,[51,70]},{50,10,[61,80]},{70,5,[71,80]},{100,2,[81,90]},{150,1,[91,100]}]
A1973: 1970 | B1973: 5 | C1973: 25 | D1973: 0 | E1973: =R[-9]C -> 81 | F1973: =R[-9]C -> 90 | G1973: 4 | H1973: 20000 | I1973: 110003 | J1973: 4 | K1973: =R[-1]C -> [{5,8},{6,15},{13,10},{14,8},{15,10},{16,8},{20,1},{27,10},{28,10}] | L1973: =R[-1]C -> [{5,1113},{6,1113},{13,18},{14,37},{15,18},{16,37},{20,3},{27,18},{28,18}] | M1973: =R[-1]C -> [{0,1,[1,30]},{1,2,[11,40]},{2,5,[21,50]},{5,10,[31,60]},{10,20,[41,60]},{30,20,[51,70]},{50,10,[61,80]},{70,5,[71,80]},{100,2,[81,90]},{150,1,[91,100]}]
A1974: 1971 | B1974: 6 | C1974: 25 | D1974: 0 | E1974: =R[-9]C -> 1 | F1974: =R[-9]C -> 10 | G1974: 5 | H1974: 20000 | I1974: 110003 | J1974: 5 | K1974: =R[-1]C -> [{5,8},{6,15},{13,10},{14,8},{15,10},{16,8},{20,1},{27,10},{28,10}] | L1974: =R[-1]C -> [{5,1113},{6,1113},{13,18},{14,37},{15,18},{16,37},{20,3},{27,18},{28,18}] | M1974: =R[-1]C -> [{0,1,[1,30]},{1,2,[11,40]},{2,5,[21,50]},{5,10,[31,60]},{10,20,[41,60]},{30,20,[51,70]},{50,10,[61,80]},{70,5,[71,80]},{100,2,[81,90]},{150,1,[91,100]}]
A1975: 1972 | B1975: 6 | C1975: 25 | D1975: 0 | E1975: =R[-9]C -> 11 | F1975: =R[-9]C -> 20 | G1975: 5 | H1975: 20000 | I1975: 110003 | J1975: 5 | K1975: =R[-1]C -> [{5,8},{6,15},{13,10},{14,8},{15,10},{16,8},{20,1},{27,10},{28,10}] | L1975: =R[-1]C -> [{5,1113},{6,1113},{13,18},{14,37},{15,18},{16,37},{20,3},{27,18},{28,18}] | M1975: =R[-1]C -> [{0,1,[1,30]},{1,2,[11,40]},{2,5,[21,50]},{5,10,[31,60]},{10,20,[41,60]},{30,20,[51,70]},{50,10,[61,80]},{70,5,[71,80]},{100,2,[81,90]},{150,1,[91,100]}]
A1976: 1973 | B1976: 6 | C1976: 25 | D1976: 0 | E1976: =R[-9]C -> 21 | F1976: =R[-9]C -> 30 | G1976: 5 | H1976: 20000 | I1976: 110003 | J1976: 5 | K1976: =R[-1]C -> [{5,8},{6,15},{13,10},{14,8},{15,10},{16,8},{20,1},{27,10},{28,10}] | L1976: =R[-1]C -> [{5,1113},{6,1113},{13,18},{14,37},{15,18},{16,37},{20,3},{27,18},{28,18}] | M1976: =R[-1]C -> [{0,1,[1,30]},{1,2,[11,40]},{2,5,[21,50]},{5,10,[31,60]},{10,20,[41,60]},{30,20,[51,70]},{50,10,[61,80]},{70,5,[71,80]},{100,2,[81,90]},{150,1,[91,100]}]
A1977: 1974 | B1977: 6 | C1977: 25 | D1977: 0 | E1977: =R[-9]C -> 31 | F1977: =R[-9]C -> 40 | G1977: 5 | H1977: 20000 | I1977: 110003 | J1977: 5 | K1977: =R[-1]C -> [{5,8},{6,15},{13,10},{14,8},{15,10},{16,8},{20,1},{27,10},{28,10}] | L1977: =R[-1]C -> [{5,1113},{6,1113},{13,18},{14,37},{15,18},{16,37},{20,3},{27,18},{28,18}] | M1977: =R[-1]C -> [{0,1,[1,30]},{1,2,[11,40]},{2,5,[21,50]},{5,10,[31,60]},{10,20,[41,60]},{30,20,[51,70]},{50,10,[61,80]},{70,5,[71,80]},{100,2,[81,90]},{150,1,[91,100]}]
A1978: 1975 | B1978: 6 | C1978: 25 | D1978: 0 | E1978: =R[-9]C -> 41 | F1978: =R[-9]C -> 50 | G1978: 5 | H1978: 20000 | I1978: 110003 | J1978: 5 | K1978: =R[-1]C -> [{5,8},{6,15},{13,10},{14,8},{15,10},{16,8},{20,1},{27,10},{28,10}] | L1978: =R[-1]C -> [{5,1113},{6,1113},{13,18},{14,37},{15,18},{16,37},{20,3},{27,18},{28,18}] | M1978: =R[-1]C -> [{0,1,[1,30]},{1,2,[11,40]},{2,5,[21,50]},{5,10,[31,60]},{10,20,[41,60]},{30,20,[51,70]},{50,10,[61,80]},{70,5,[71,80]},{100,2,[81,90]},{150,1,[91,100]}]
A1979: 1976 | B1979: 6 | C1979: 25 | D1979: 0 | E1979: =R[-9]C -> 51 | F1979: =R[-9]C -> 60 | G1979: 5 | H1979: 20000 | I1979: 110003 | J1979: 5 | K1979: =R[-1]C -> [{5,8},{6,15},{13,10},{14,8},{15,10},{16,8},{20,1},{27,10},{28,10}] | L1979: =R[-1]C -> [{5,1113},{6,1113},{13,18},{14,37},{15,18},{16,37},{20,3},{27,18},{28,18}] | M1979: =R[-1]C -> [{0,1,[1,30]},{1,2,[11,40]},{2,5,[21,50]},{5,10,[31,60]},{10,20,[41,60]},{30,20,[51,70]},{50,10,[61,80]},{70,5,[71,80]},{100,2,[81,90]},{150,1,[91,100]}]
A1980: 1977 | B1980: 6 | C1980: 25 | D1980: 0 | E1980: =R[-9]C -> 61 | F1980: =R[-9]C -> 70 | G1980: 5 | H1980: 20000 | I1980: 110003 | J1980: 5 | K1980: =R[-1]C -> [{5,8},{6,15},{13,10},{14,8},{15,10},{16,8},{20,1},{27,10},{28,10}] | L1980: =R[-1]C -> [{5,1113},{6,1113},{13,18},{14,37},{15,18},{16,37},{20,3},{27,18},{28,18}] | M1980: =R[-1]C -> [{0,1,[1,30]},{1,2,[11,40]},{2,5,[21,50]},{5,10,[31,60]},{10,20,[41,60]},{30,20,[51,70]},{50,10,[61,80]},{70,5,[71,80]},{100,2,[81,90]},{150,1,[91,100]}]
A1981: 1978 | B1981: 6 | C1981: 25 | D1981: 0 | E1981: =R[-9]C -> 71 | F1981: =R[-9]C -> 80 | G1981: 5 | H1981: 20000 | I1981: 110003 | J1981: 5 | K1981: =R[-1]C -> [{5,8},{6,15},{13,10},{14,8},{15,10},{16,8},{20,1},{27,10},{28,10}] | L1981: =R[-1]C -> [{5,1113},{6,1113},{13,18},{14,37},{15,18},{16,37},{20,3},{27,18},{28,18}] | M1981: =R[-1]C -> [{0,1,[1,30]},{1,2,[11,40]},{2,5,[21,50]},{5,10,[31,60]},{10,20,[41,60]},{30,20,[51,70]},{50,10,[61,80]},{70,5,[71,80]},{100,2,[81,90]},{150,1,[91,100]}]
A1982: 1979 | B1982: 6 | C1982: 25 | D1982: 0 | E1982: =R[-9]C -> 81 | F1982: =R[-9]C -> 90 | G1982: 5 | H1982: 20000 | I1982: 110003 | J1982: 5 | K1982: =R[-1]C -> [{5,8},{6,15},{13,10},{14,8},{15,10},{16,8},{20,1},{27,10},{28,10}] | L1982: =R[-1]C -> [{5,1113},{6,1113},{13,18},{14,37},{15,18},{16,37},{20,3},{27,18},{28,18}] | M1982: =R[-1]C -> [{0,1,[1,30]},{1,2,[11,40]},{2,5,[21,50]},{5,10,[31,60]},{10,20,[41,60]},{30,20,[51,70]},{50,10,[61,80]},{70,5,[71,80]},{100,2,[81,90]},{150,1,[91,100]}]
A1983: 1980 | B1983: 2 | C1983: 28 | D1983: 0 | E1983: =R[-18]C -> 1 | F1983: =R[-18]C -> 10 | G1983: 1 | H1983: 5000 | I1983: 110003 | J1983: 1 | K1983: =R[-1]C -> [{5,8},{6,15},{13,10},{14,8},{15,10},{16,8},{20,1},{27,10},{28,10}] | L1983: =R[-1]C -> [{5,1113},{6,1113},{13,18},{14,37},{15,18},{16,37},{20,3},{27,18},{28,18}] | M1983: =R[-1]C -> [{0,1,[1,30]},{1,2,[11,40]},{2,5,[21,50]},{5,10,[31,60]},{10,20,[41,60]},{30,20,[51,70]},{50,10,[61,80]},{70,5,[71,80]},{100,2,[81,90]},{150,1,[91,100]}]
A1984: 1981 | B1984: 2 | C1984: 28 | D1984: 0 | E1984: =R[-18]C -> 11 | F1984: =R[-18]C -> 20 | G1984: 1 | H1984: 5000 | I1984: 110003 | J1984: 1 | K1984: =R[-1]C -> [{5,8},{6,15},{13,10},{14,8},{15,10},{16,8},{20,1},{27,10},{28,10}] | L1984: =R[-1]C -> [{5,1113},{6,1113},{13,18},{14,37},{15,18},{16,37},{20,3},{27,18},{28,18}] | M1984: =R[-1]C -> [{0,1,[1,30]},{1,2,[11,40]},{2,5,[21,50]},{5,10,[31,60]},{10,20,[41,60]},{30,20,[51,70]},{50,10,[61,80]},{70,5,[71,80]},{100,2,[81,90]},{150,1,[91,100]}]
A1985: 1982 | B1985: 2 | C1985: 28 | D1985: 0 | E1985: =R[-18]C -> 21 | F1985: =R[-18]C -> 30 | G1985: 1 | H1985: 5000 | I1985: 110003 | J1985: 1 | K1985: =R[-1]C -> [{5,8},{6,15},{13,10},{14,8},{15,10},{16,8},{20,1},{27,10},{28,10}] | L1985: =R[-1]C -> [{5,1113},{6,1113},{13,18},{14,37},{15,18},{16,37},{20,3},{27,18},{28,18}] | M1985: =R[-1]C -> [{0,1,[1,30]},{1,2,[11,40]},{2,5,[21,50]},{5,10,[31,60]},{10,20,[41,60]},{30,20,[51,70]},{50,10,[61,80]},{70,5,[71,80]},{100,2,[81,90]},{150,1,[91,100]}]
A1986: 1983 | B1986: 2 | C1986: 28 | D1986: 0 | E1986: =R[-18]C -> 31 | F1986: =R[-18]C -> 40 | G1986: 1 | H1986: 5000 | I1986: 110003 | J1986: 1 | K1986: =R[-1]C -> [{5,8},{6,15},{13,10},{14,8},{15,10},{16,8},{20,1},{27,10},{28,10}] | L1986: =R[-1]C -> [{5,1113},{6,1113},{13,18},{14,37},{15,18},{16,37},{20,3},{27,18},{28,18}] | M1986: =R[-1]C -> [{0,1,[1,30]},{1,2,[11,40]},{2,5,[21,50]},{5,10,[31,60]},{10,20,[41,60]},{30,20,[51,70]},{50,10,[61,80]},{70,5,[71,80]},{100,2,[81,90]},{150,1,[91,100]}]
A1987: 1984 | B1987: 2 | C1987: 28 | D1987: 0 | E1987: =R[-18]C -> 41 | F1987: =R[-18]C -> 50 | G1987: 1 | H1987: 5000 | I1987: 110003 | J1987: 1 | K1987: =R[-1]C -> [{5,8},{6,15},{13,10},{14,8},{15,10},{16,8},{20,1},{27,10},{28,10}] | L1987: =R[-1]C -> [{5,1113},{6,1113},{13,18},{14,37},{15,18},{16,37},{20,3},{27,18},{28,18}] | M1987: =R[-1]C -> [{0,1,[1,30]},{1,2,[11,40]},{2,5,[21,50]},{5,10,[31,60]},{10,20,[41,60]},{30,20,[51,70]},{50,10,[61,80]},{70,5,[71,80]},{100,2,[81,90]},{150,1,[91,100]}]
A1988: 1985 | B1988: 2 | C1988: 28 | D1988: 0 | E1988: =R[-18]C -> 51 | F1988: =R[-18]C -> 60 | G1988: 1 | H1988: 5000 | I1988: 110003 | J1988: 1 | K1988: =R[-1]C -> [{5,8},{6,15},{13,10},{14,8},{15,10},{16,8},{20,1},{27,10},{28,10}] | L1988: =R[-1]C -> [{5,1113},{6,1113},{13,18},{14,37},{15,18},{16,37},{20,3},{27,18},{28,18}] | M1988: =R[-1]C -> [{0,1,[1,30]},{1,2,[11,40]},{2,5,[21,50]},{5,10,[31,60]},{10,20,[41,60]},{30,20,[51,70]},{50,10,[61,80]},{70,5,[71,80]},{100,2,[81,90]},{150,1,[91,100]}]
A1989: 1986 | B1989: 2 | C1989: 28 | D1989: 0 | E1989: =R[-18]C -> 61 | F1989: =R[-18]C -> 70 | G1989: 1 | H1989: 5000 | I1989: 110003 | J1989: 1 | K1989: =R[-1]C -> [{5,8},{6,15},{13,10},{14,8},{15,10},{16,8},{20,1},{27,10},{28,10}] | L1989: =R[-1]C -> [{5,1113},{6,1113},{13,18},{14,37},{15,18},{16,37},{20,3},{27,18},{28,18}] | M1989: =R[-1]C -> [{0,1,[1,30]},{1,2,[11,40]},{2,5,[21,50]},{5,10,[31,60]},{10,20,[41,60]},{30,20,[51,70]},{50,10,[61,80]},{70,5,[71,80]},{100,2,[81,90]},{150,1,[91,100]}]
A1990: 1987 | B1990: 2 | C1990: 28 | D1990: 0 | E1990: =R[-18]C -> 71 | F1990: =R[-18]C -> 80 | G1990: 1 | H1990: 5000 | I1990: 110003 | J1990: 1 | K1990: =R[-1]C -> [{5,8},{6,15},{13,10},{14,8},{15,10},{16,8},{20,1},{27,10},{28,10}] | L1990: =R[-1]C -> [{5,1113},{6,1113},{13,18},{14,37},{15,18},{16,37},{20,3},{27,18},{28,18}] | M1990: =R[-1]C -> [{0,1,[1,30]},{1,2,[11,40]},{2,5,[21,50]},{5,10,[31,60]},{10,20,[41,60]},{30,20,[51,70]},{50,10,[61,80]},{70,5,[71,80]},{100,2,[81,90]},{150,1,[91,100]}]
A1991: 1988 | B1991: 2 | C1991: 28 | D1991: 0 | E1991: =R[-18]C -> 81 | F1991: =R[-18]C -> 90 | G1991: 1 | H1991: 5000 | I1991: 110003 | J1991: 1 | K1991: =R[-1]C -> [{5,8},{6,15},{13,10},{14,8},{15,10},{16,8},{20,1},{27,10},{28,10}] | L1991: =R[-1]C -> [{5,1113},{6,1113},{13,18},{14,37},{15,18},{16,37},{20,3},{27,18},{28,18}] | M1991: =R[-1]C -> [{0,1,[1,30]},{1,2,[11,40]},{2,5,[21,50]},{5,10,[31,60]},{10,20,[41,60]},{30,20,[51,70]},{50,10,[61,80]},{70,5,[71,80]},{100,2,[81,90]},{150,1,[91,100]}]
A1992: 1989 | B1992: 3 | C1992: 28 | D1992: 0 | E1992: =R[-9]C -> 1 | F1992: =R[-9]C -> 10 | G1992: 2 | H1992: 10000 | I1992: 110003 | J1992: 2 | K1992: =R[-1]C -> [{5,8},{6,15},{13,10},{14,8},{15,10},{16,8},{20,1},{27,10},{28,10}] | L1992: =R[-1]C -> [{5,1113},{6,1113},{13,18},{14,37},{15,18},{16,37},{20,3},{27,18},{28,18}] | M1992: =R[-1]C -> [{0,1,[1,30]},{1,2,[11,40]},{2,5,[21,50]},{5,10,[31,60]},{10,20,[41,60]},{30,20,[51,70]},{50,10,[61,80]},{70,5,[71,80]},{100,2,[81,90]},{150,1,[91,100]}]
A1993: 1990 | B1993: 3 | C1993: 28 | D1993: 0 | E1993: =R[-9]C -> 11 | F1993: =R[-9]C -> 20 | G1993: 2 | H1993: 10000 | I1993: 110003 | J1993: 2 | K1993: =R[-1]C -> [{5,8},{6,15},{13,10},{14,8},{15,10},{16,8},{20,1},{27,10},{28,10}] | L1993: =R[-1]C -> [{5,1113},{6,1113},{13,18},{14,37},{15,18},{16,37},{20,3},{27,18},{28,18}] | M1993: =R[-1]C -> [{0,1,[1,30]},{1,2,[11,40]},{2,5,[21,50]},{5,10,[31,60]},{10,20,[41,60]},{30,20,[51,70]},{50,10,[61,80]},{70,5,[71,80]},{100,2,[81,90]},{150,1,[91,100]}]
A1994: 1991 | B1994: 3 | C1994: 28 | D1994: 0 | E1994: =R[-9]C -> 21 | F1994: =R[-9]C -> 30 | G1994: 2 | H1994: 10000 | I1994: 110003 | J1994: 2 | K1994: =R[-1]C -> [{5,8},{6,15},{13,10},{14,8},{15,10},{16,8},{20,1},{27,10},{28,10}] | L1994: =R[-1]C -> [{5,1113},{6,1113},{13,18},{14,37},{15,18},{16,37},{20,3},{27,18},{28,18}] | M1994: =R[-1]C -> [{0,1,[1,30]},{1,2,[11,40]},{2,5,[21,50]},{5,10,[31,60]},{10,20,[41,60]},{30,20,[51,70]},{50,10,[61,80]},{70,5,[71,80]},{100,2,[81,90]},{150,1,[91,100]}]
A1995: 1992 | B1995: 3 | C1995: 28 | D1995: 0 | E1995: =R[-9]C -> 31 | F1995: =R[-9]C -> 40 | G1995: 2 | H1995: 10000 | I1995: 110003 | J1995: 2 | K1995: =R[-1]C -> [{5,8},{6,15},{13,10},{14,8},{15,10},{16,8},{20,1},{27,10},{28,10}] | L1995: =R[-1]C -> [{5,1113},{6,1113},{13,18},{14,37},{15,18},{16,37},{20,3},{27,18},{28,18}] | M1995: =R[-1]C -> [{0,1,[1,30]},{1,2,[11,40]},{2,5,[21,50]},{5,10,[31,60]},{10,20,[41,60]},{30,20,[51,70]},{50,10,[61,80]},{70,5,[71,80]},{100,2,[81,90]},{150,1,[91,100]}]
A1996: 1993 | B1996: 3 | C1996: 28 | D1996: 0 | E1996: =R[-9]C -> 41 | F1996: =R[-9]C -> 50 | G1996: 2 | H1996: 10000 | I1996: 110003 | J1996: 2 | K1996: =R[-1]C -> [{5,8},{6,15},{13,10},{14,8},{15,10},{16,8},{20,1},{27,10},{28,10}] | L1996: =R[-1]C -> [{5,1113},{6,1113},{13,18},{14,37},{15,18},{16,37},{20,3},{27,18},{28,18}] | M1996: =R[-1]C -> [{0,1,[1,30]},{1,2,[11,40]},{2,5,[21,50]},{5,10,[31,60]},{10,20,[41,60]},{30,20,[51,70]},{50,10,[61,80]},{70,5,[71,80]},{100,2,[81,90]},{150,1,[91,100]}]
A1997: 1994 | B1997: 3 | C1997: 28 | D1997: 0 | E1997: =R[-9]C -> 51 | F1997: =R[-9]C -> 60 | G1997: 2 | H1997: 10000 | I1997: 110003 | J1997: 2 | K1997: =R[-1]C -> [{5,8},{6,15},{13,10},{14,8},{15,10},{16,8},{20,1},{27,10},{28,10}] | L1997: =R[-1]C -> [{5,1113},{6,1113},{13,18},{14,37},{15,18},{16,37},{20,3},{27,18},{28,18}] | M1997: =R[-1]C -> [{0,1,[1,30]},{1,2,[11,40]},{2,5,[21,50]},{5,10,[31,60]},{10,20,[41,60]},{30,20,[51,70]},{50,10,[61,80]},{70,5,[71,80]},{100,2,[81,90]},{150,1,[91,100]}]
A1998: 1995 | B1998: 3 | C1998: 28 | D1998: 0 | E1998: =R[-9]C -> 61 | F1998: =R[-9]C -> 70 | G1998: 2 | H1998: 10000 | I1998: 110003 | J1998: 2 | K1998: =R[-1]C -> [{5,8},{6,15},{13,10},{14,8},{15,10},{16,8},{20,1},{27,10},{28,10}] | L1998: =R[-1]C -> [{5,1113},{6,1113},{13,18},{14,37},{15,18},{16,37},{20,3},{27,18},{28,18}] | M1998: =R[-1]C -> [{0,1,[1,30]},{1,2,[11,40]},{2,5,[21,50]},{5,10,[31,60]},{10,20,[41,60]},{30,20,[51,70]},{50,10,[61,80]},{70,5,[71,80]},{100,2,[81,90]},{150,1,[91,100]}]
A1999: 1996 | B1999: 3 | C1999: 28 | D1999: 0 | E1999: =R[-9]C -> 71 | F1999: =R[-9]C -> 80 | G1999: 2 | H1999: 10000 | I1999: 110003 | J1999: 2 | K1999: =R[-1]C -> [{5,8},{6,15},{13,10},{14,8},{15,10},{16,8},{20,1},{27,10},{28,10}] | L1999: =R[-1]C -> [{5,1113},{6,1113},{13,18},{14,37},{15,18},{16,37},{20,3},{27,18},{28,18}] | M1999: =R[-1]C -> [{0,1,[1,30]},{1,2,[11,40]},{2,5,[21,50]},{5,10,[31,60]},{10,20,[41,60]},{30,20,[51,70]},{50,10,[61,80]},{70,5,[71,80]},{100,2,[81,90]},{150,1,[91,100]}]
A2000: 1997 | B2000: 3 | C2000: 28 | D2000: 0 | E2000: =R[-9]C -> 81 | F2000: =R[-9]C -> 90 | G2000: 2 | H2000: 10000 | I2000: 110003 | J2000: 2 | K2000: =R[-1]C -> [{5,8},{6,15},{13,10},{14,8},{15,10},{16,8},{20,1},{27,10},{28,10}] | L2000: =R[-1]C -> [{5,1113},{6,1113},{13,18},{14,37},{15,18},{16,37},{20,3},{27,18},{28,18}] | M2000: =R[-1]C -> [{0,1,[1,30]},{1,2,[11,40]},{2,5,[21,50]},{5,10,[31,60]},{10,20,[41,60]},{30,20,[51,70]},{50,10,[61,80]},{70,5,[71,80]},{100,2,[81,90]},{150,1,[91,100]}]
A2001: 1998 | B2001: 4 | C2001: 28 | D2001: 0 | E2001: =R[-9]C -> 1 | F2001: =R[-9]C -> 10 | G2001: 3 | H2001: 15000 | I2001: 110003 | J2001: 3 | K2001: =R[-1]C -> [{5,8},{6,15},{13,10},{14,8},{15,10},{16,8},{20,1},{27,10},{28,10}] | L2001: =R[-1]C -> [{5,1113},{6,1113},{13,18},{14,37},{15,18},{16,37},{20,3},{27,18},{28,18}] | M2001: =R[-1]C -> [{0,1,[1,30]},{1,2,[11,40]},{2,5,[21,50]},{5,10,[31,60]},{10,20,[41,60]},{30,20,[51,70]},{50,10,[61,80]},{70,5,[71,80]},{100,2,[81,90]},{150,1,[91,100]}]
A2002: 1999 | B2002: 4 | C2002: 28 | D2002: 0 | E2002: =R[-9]C -> 11 | F2002: =R[-9]C -> 20 | G2002: 3 | H2002: 15000 | I2002: 110003 | J2002: 3 | K2002: =R[-1]C -> [{5,8},{6,15},{13,10},{14,8},{15,10},{16,8},{20,1},{27,10},{28,10}] | L2002: =R[-1]C -> [{5,1113},{6,1113},{13,18},{14,37},{15,18},{16,37},{20,3},{27,18},{28,18}] | M2002: =R[-1]C -> [{0,1,[1,30]},{1,2,[11,40]},{2,5,[21,50]},{5,10,[31,60]},{10,20,[41,60]},{30,20,[51,70]},{50,10,[61,80]},{70,5,[71,80]},{100,2,[81,90]},{150,1,[91,100]}]
A2003: 2000 | B2003: 4 | C2003: 28 | D2003: 0 | E2003: =R[-9]C -> 21 | F2003: =R[-9]C -> 30 | G2003: 3 | H2003: 15000 | I2003: 110003 | J2003: 3 | K2003: =R[-1]C -> [{5,8},{6,15},{13,10},{14,8},{15,10},{16,8},{20,1},{27,10},{28,10}] | L2003: =R[-1]C -> [{5,1113},{6,1113},{13,18},{14,37},{15,18},{16,37},{20,3},{27,18},{28,18}] | M2003: =R[-1]C -> [{0,1,[1,30]},{1,2,[11,40]},{2,5,[21,50]},{5,10,[31,60]},{10,20,[41,60]},{30,20,[51,70]},{50,10,[61,80]},{70,5,[71,80]},{100,2,[81,90]},{150,1,[91,100]}]
A2004: 2001 | B2004: 4 | C2004: 28 | D2004: 0 | E2004: =R[-9]C -> 31 | F2004: =R[-9]C -> 40 | G2004: 3 | H2004: 15000 | I2004: 110003 | J2004: 3 | K2004: =R[-1]C -> [{5,8},{6,15},{13,10},{14,8},{15,10},{16,8},{20,1},{27,10},{28,10}] | L2004: =R[-1]C -> [{5,1113},{6,1113},{13,18},{14,37},{15,18},{16,37},{20,3},{27,18},{28,18}] | M2004: =R[-1]C -> [{0,1,[1,30]},{1,2,[11,40]},{2,5,[21,50]},{5,10,[31,60]},{10,20,[41,60]},{30,20,[51,70]},{50,10,[61,80]},{70,5,[71,80]},{100,2,[81,90]},{150,1,[91,100]}]
A2005: 2002 | B2005: 4 | C2005: 28 | D2005: 0 | E2005: =R[-9]C -> 41 | F2005: =R[-9]C -> 50 | G2005: 3 | H2005: 15000 | I2005: 110003 | J2005: 3 | K2005: =R[-1]C -> [{5,8},{6,15},{13,10},{14,8},{15,10},{16,8},{20,1},{27,10},{28,10}] | L2005: =R[-1]C -> [{5,1113},{6,1113},{13,18},{14,37},{15,18},{16,37},{20,3},{27,18},{28,18}] | M2005: =R[-1]C -> [{0,1,[1,30]},{1,2,[11,40]},{2,5,[21,50]},{5,10,[31,60]},{10,20,[41,60]},{30,20,[51,70]},{50,10,[61,80]},{70,5,[71,80]},{100,2,[81,90]},{150,1,[91,100]}]
A2006: 2003 | B2006: 4 | C2006: 28 | D2006: 0 | E2006: =R[-9]C -> 51 | F2006: =R[-9]C -> 60 | G2006: 3 | H2006: 15000 | I2006: 110003 | J2006: 3 | K2006: =R[-1]C -> [{5,8},{6,15},{13,10},{14,8},{15,10},{16,8},{20,1},{27,10},{28,10}] | L2006: =R[-1]C -> [{5,1113},{6,1113},{13,18},{14,37},{15,18},{16,37},{20,3},{27,18},{28,18}] | M2006: =R[-1]C -> [{0,1,[1,30]},{1,2,[11,40]},{2,5,[21,50]},{5,10,[31,60]},{10,20,[41,60]},{30,20,[51,70]},{50,10,[61,80]},{70,5,[71,80]},{100,2,[81,90]},{150,1,[91,100]}]
A2007: 2004 | B2007: 4 | C2007: 28 | D2007: 0 | E2007: =R[-9]C -> 61 | F2007: =R[-9]C -> 70 | G2007: 3 | H2007: 15000 | I2007: 110003 | J2007: 3 | K2007: =R[-1]C -> [{5,8},{6,15},{13,10},{14,8},{15,10},{16,8},{20,1},{27,10},{28,10}] | L2007: =R[-1]C -> [{5,1113},{6,1113},{13,18},{14,37},{15,18},{16,37},{20,3},{27,18},{28,18}] | M2007: =R[-1]C -> [{0,1,[1,30]},{1,2,[11,40]},{2,5,[21,50]},{5,10,[31,60]},{10,20,[41,60]},{30,20,[51,70]},{50,10,[61,80]},{70,5,[71,80]},{100,2,[81,90]},{150,1,[91,100]}]
A2008: 2005 | B2008: 4 | C2008: 28 | D2008: 0 | E2008: =R[-9]C -> 71 | F2008: =R[-9]C -> 80 | G2008: 3 | H2008: 15000 | I2008: 110003 | J2008: 3 | K2008: =R[-1]C -> [{5,8},{6,15},{13,10},{14,8},{15,10},{16,8},{20,1},{27,10},{28,10}] | L2008: =R[-1]C -> [{5,1113},{6,1113},{13,18},{14,37},{15,18},{16,37},{20,3},{27,18},{28,18}] | M2008: =R[-1]C -> [{0,1,[1,30]},{1,2,[11,40]},{2,5,[21,50]},{5,10,[31,60]},{10,20,[41,60]},{30,20,[51,70]},{50,10,[61,80]},{70,5,[71,80]},{100,2,[81,90]},{150,1,[91,100]}]
A2009: 2006 | B2009: 4 | C2009: 28 | D2009: 0 | E2009: =R[-9]C -> 81 | F2009: =R[-9]C -> 90 | G2009: 3 | H2009: 15000 | I2009: 110003 | J2009: 3 | K2009: =R[-1]C -> [{5,8},{6,15},{13,10},{14,8},{15,10},{16,8},{20,1},{27,10},{28,10}] | L2009: =R[-1]C -> [{5,1113},{6,1113},{13,18},{14,37},{15,18},{16,37},{20,3},{27,18},{28,18}] | M2009: =R[-1]C -> [{0,1,[1,30]},{1,2,[11,40]},{2,5,[21,50]},{5,10,[31,60]},{10,20,[41,60]},{30,20,[51,70]},{50,10,[61,80]},{70,5,[71,80]},{100,2,[81,90]},{150,1,[91,100]}]
A2010: 2007 | B2010: 5 | C2010: 28 | D2010: 0 | E2010: =R[-9]C -> 1 | F2010: =R[-9]C -> 10 | G2010: 4 | H2010: 20000 | I2010: 110003 | J2010: 4 | K2010: =R[-1]C -> [{5,8},{6,15},{13,10},{14,8},{15,10},{16,8},{20,1},{27,10},{28,10}] | L2010: =R[-1]C -> [{5,1113},{6,1113},{13,18},{14,37},{15,18},{16,37},{20,3},{27,18},{28,18}] | M2010: =R[-1]C -> [{0,1,[1,30]},{1,2,[11,40]},{2,5,[21,50]},{5,10,[31,60]},{10,20,[41,60]},{30,20,[51,70]},{50,10,[61,80]},{70,5,[71,80]},{100,2,[81,90]},{150,1,[91,100]}]
A2011: 2008 | B2011: 5 | C2011: 28 | D2011: 0 | E2011: =R[-9]C -> 11 | F2011: =R[-9]C -> 20 | G2011: 4 | H2011: 20000 | I2011: 110003 | J2011: 4 | K2011: =R[-1]C -> [{5,8},{6,15},{13,10},{14,8},{15,10},{16,8},{20,1},{27,10},{28,10}] | L2011: =R[-1]C -> [{5,1113},{6,1113},{13,18},{14,37},{15,18},{16,37},{20,3},{27,18},{28,18}] | M2011: =R[-1]C -> [{0,1,[1,30]},{1,2,[11,40]},{2,5,[21,50]},{5,10,[31,60]},{10,20,[41,60]},{30,20,[51,70]},{50,10,[61,80]},{70,5,[71,80]},{100,2,[81,90]},{150,1,[91,100]}]
A2012: 2009 | B2012: 5 | C2012: 28 | D2012: 0 | E2012: =R[-9]C -> 21 | F2012: =R[-9]C -> 30 | G2012: 4 | H2012: 20000 | I2012: 110003 | J2012: 4 | K2012: =R[-1]C -> [{5,8},{6,15},{13,10},{14,8},{15,10},{16,8},{20,1},{27,10},{28,10}] | L2012: =R[-1]C -> [{5,1113},{6,1113},{13,18},{14,37},{15,18},{16,37},{20,3},{27,18},{28,18}] | M2012: =R[-1]C -> [{0,1,[1,30]},{1,2,[11,40]},{2,5,[21,50]},{5,10,[31,60]},{10,20,[41,60]},{30,20,[51,70]},{50,10,[61,80]},{70,5,[71,80]},{100,2,[81,90]},{150,1,[91,100]}]
A2013: 2010 | B2013: 5 | C2013: 28 | D2013: 0 | E2013: =R[-9]C -> 31 | F2013: =R[-9]C -> 40 | G2013: 4 | H2013: 20000 | I2013: 110003 | J2013: 4 | K2013: =R[-1]C -> [{5,8},{6,15},{13,10},{14,8},{15,10},{16,8},{20,1},{27,10},{28,10}] | L2013: =R[-1]C -> [{5,1113},{6,1113},{13,18},{14,37},{15,18},{16,37},{20,3},{27,18},{28,18}] | M2013: =R[-1]C -> [{0,1,[1,30]},{1,2,[11,40]},{2,5,[21,50]},{5,10,[31,60]},{10,20,[41,60]},{30,20,[51,70]},{50,10,[61,80]},{70,5,[71,80]},{100,2,[81,90]},{150,1,[91,100]}]
A2014: 2011 | B2014: 5 | C2014: 28 | D2014: 0 | E2014: =R[-9]C -> 41 | F2014: =R[-9]C -> 50 | G2014: 4 | H2014: 20000 | I2014: 110003 | J2014: 4 | K2014: =R[-1]C -> [{5,8},{6,15},{13,10},{14,8},{15,10},{16,8},{20,1},{27,10},{28,10}] | L2014: =R[-1]C -> [{5,1113},{6,1113},{13,18},{14,37},{15,18},{16,37},{20,3},{27,18},{28,18}] | M2014: =R[-1]C -> [{0,1,[1,30]},{1,2,[11,40]},{2,5,[21,50]},{5,10,[31,60]},{10,20,[41,60]},{30,20,[51,70]},{50,10,[61,80]},{70,5,[71,80]},{100,2,[81,90]},{150,1,[91,100]}]
A2015: 2012 | B2015: 5 | C2015: 28 | D2015: 0 | E2015: =R[-9]C -> 51 | F2015: =R[-9]C -> 60 | G2015: 4 | H2015: 20000 | I2015: 110003 | J2015: 4 | K2015: =R[-1]C -> [{5,8},{6,15},{13,10},{14,8},{15,10},{16,8},{20,1},{27,10},{28,10}] | L2015: =R[-1]C -> [{5,1113},{6,1113},{13,18},{14,37},{15,18},{16,37},{20,3},{27,18},{28,18}] | M2015: =R[-1]C -> [{0,1,[1,30]},{1,2,[11,40]},{2,5,[21,50]},{5,10,[31,60]},{10,20,[41,60]},{30,20,[51,70]},{50,10,[61,80]},{70,5,[71,80]},{100,2,[81,90]},{150,1,[91,100]}]
A2016: 2013 | B2016: 5 | C2016: 28 | D2016: 0 | E2016: =R[-9]C -> 61 | F2016: =R[-9]C -> 70 | G2016: 4 | H2016: 20000 | I2016: 110003 | J2016: 4 | K2016: =R[-1]C -> [{5,8},{6,15},{13,10},{14,8},{15,10},{16,8},{20,1},{27,10},{28,10}] | L2016: =R[-1]C -> [{5,1113},{6,1113},{13,18},{14,37},{15,18},{16,37},{20,3},{27,18},{28,18}] | M2016: =R[-1]C -> [{0,1,[1,30]},{1,2,[11,40]},{2,5,[21,50]},{5,10,[31,60]},{10,20,[41,60]},{30,20,[51,70]},{50,10,[61,80]},{70,5,[71,80]},{100,2,[81,90]},{150,1,[91,100]}]
A2017: 2014 | B2017: 5 | C2017: 28 | D2017: 0 | E2017: =R[-9]C -> 71 | F2017: =R[-9]C -> 80 | G2017: 4 | H2017: 20000 | I2017: 110003 | J2017: 4 | K2017: =R[-1]C -> [{5,8},{6,15},{13,10},{14,8},{15,10},{16,8},{20,1},{27,10},{28,10}] | L2017: =R[-1]C -> [{5,1113},{6,1113},{13,18},{14,37},{15,18},{16,37},{20,3},{27,18},{28,18}] | M2017: =R[-1]C -> [{0,1,[1,30]},{1,2,[11,40]},{2,5,[21,50]},{5,10,[31,60]},{10,20,[41,60]},{30,20,[51,70]},{50,10,[61,80]},{70,5,[71,80]},{100,2,[81,90]},{150,1,[91,100]}]
A2018: 2015 | B2018: 5 | C2018: 28 | D2018: 0 | E2018: =R[-9]C -> 81 | F2018: =R[-9]C -> 90 | G2018: 4 | H2018: 20000 | I2018: 110003 | J2018: 4 | K2018: =R[-1]C -> [{5,8},{6,15},{13,10},{14,8},{15,10},{16,8},{20,1},{27,10},{28,10}] | L2018: =R[-1]C -> [{5,1113},{6,1113},{13,18},{14,37},{15,18},{16,37},{20,3},{27,18},{28,18}] | M2018: =R[-1]C -> [{0,1,[1,30]},{1,2,[11,40]},{2,5,[21,50]},{5,10,[31,60]},{10,20,[41,60]},{30,20,[51,70]},{50,10,[61,80]},{70,5,[71,80]},{100,2,[81,90]},{150,1,[91,100]}]
A2019: 2016 | B2019: 6 | C2019: 28 | D2019: 0 | E2019: =R[-9]C -> 1 | F2019: =R[-9]C -> 10 | G2019: 5 | H2019: 20000 | I2019: 110003 | J2019: 5 | K2019: =R[-1]C -> [{5,8},{6,15},{13,10},{14,8},{15,10},{16,8},{20,1},{27,10},{28,10}] | L2019: =R[-1]C -> [{5,1113},{6,1113},{13,18},{14,37},{15,18},{16,37},{20,3},{27,18},{28,18}] | M2019: =R[-1]C -> [{0,1,[1,30]},{1,2,[11,40]},{2,5,[21,50]},{5,10,[31,60]},{10,20,[41,60]},{30,20,[51,70]},{50,10,[61,80]},{70,5,[71,80]},{100,2,[81,90]},{150,1,[91,100]}]
A2020: 2017 | B2020: 6 | C2020: 28 | D2020: 0 | E2020: =R[-9]C -> 11 | F2020: =R[-9]C -> 20 | G2020: 5 | H2020: 20000 | I2020: 110003 | J2020: 5 | K2020: =R[-1]C -> [{5,8},{6,15},{13,10},{14,8},{15,10},{16,8},{20,1},{27,10},{28,10}] | L2020: =R[-1]C -> [{5,1113},{6,1113},{13,18},{14,37},{15,18},{16,37},{20,3},{27,18},{28,18}] | M2020: =R[-1]C -> [{0,1,[1,30]},{1,2,[11,40]},{2,5,[21,50]},{5,10,[31,60]},{10,20,[41,60]},{30,20,[51,70]},{50,10,[61,80]},{70,5,[71,80]},{100,2,[81,90]},{150,1,[91,100]}]
A2021: 2018 | B2021: 6 | C2021: 28 | D2021: 0 | E2021: =R[-9]C -> 21 | F2021: =R[-9]C -> 30 | G2021: 5 | H2021: 20000 | I2021: 110003 | J2021: 5 | K2021: =R[-1]C -> [{5,8},{6,15},{13,10},{14,8},{15,10},{16,8},{20,1},{27,10},{28,10}] | L2021: =R[-1]C -> [{5,1113},{6,1113},{13,18},{14,37},{15,18},{16,37},{20,3},{27,18},{28,18}] | M2021: =R[-1]C -> [{0,1,[1,30]},{1,2,[11,40]},{2,5,[21,50]},{5,10,[31,60]},{10,20,[41,60]},{30,20,[51,70]},{50,10,[61,80]},{70,5,[71,80]},{100,2,[81,90]},{150,1,[91,100]}]
A2022: 2019 | B2022: 6 | C2022: 28 | D2022: 0 | E2022: =R[-9]C -> 31 | F2022: =R[-9]C -> 40 | G2022: 5 | H2022: 20000 | I2022: 110003 | J2022: 5 | K2022: =R[-1]C -> [{5,8},{6,15},{13,10},{14,8},{15,10},{16,8},{20,1},{27,10},{28,10}] | L2022: =R[-1]C -> [{5,1113},{6,1113},{13,18},{14,37},{15,18},{16,37},{20,3},{27,18},{28,18}] | M2022: =R[-1]C -> [{0,1,[1,30]},{1,2,[11,40]},{2,5,[21,50]},{5,10,[31,60]},{10,20,[41,60]},{30,20,[51,70]},{50,10,[61,80]},{70,5,[71,80]},{100,2,[81,90]},{150,1,[91,100]}]
A2023: 2020 | B2023: 6 | C2023: 28 | D2023: 0 | E2023: =R[-9]C -> 41 | F2023: =R[-9]C -> 50 | G2023: 5 | H2023: 20000 | I2023: 110003 | J2023: 5 | K2023: =R[-1]C -> [{5,8},{6,15},{13,10},{14,8},{15,10},{16,8},{20,1},{27,10},{28,10}] | L2023: =R[-1]C -> [{5,1113},{6,1113},{13,18},{14,37},{15,18},{16,37},{20,3},{27,18},{28,18}] | M2023: =R[-1]C -> [{0,1,[1,30]},{1,2,[11,40]},{2,5,[21,50]},{5,10,[31,60]},{10,20,[41,60]},{30,20,[51,70]},{50,10,[61,80]},{70,5,[71,80]},{100,2,[81,90]},{150,1,[91,100]}]
A2024: 2021 | B2024: 6 | C2024: 28 | D2024: 0 | E2024: =R[-9]C -> 51 | F2024: =R[-9]C -> 60 | G2024: 5 | H2024: 20000 | I2024: 110003 | J2024: 5 | K2024: =R[-1]C -> [{5,8},{6,15},{13,10},{14,8},{15,10},{16,8},{20,1},{27,10},{28,10}] | L2024: =R[-1]C -> [{5,1113},{6,1113},{13,18},{14,37},{15,18},{16,37},{20,3},{27,18},{28,18}] | M2024: =R[-1]C -> [{0,1,[1,30]},{1,2,[11,40]},{2,5,[21,50]},{5,10,[31,60]},{10,20,[41,60]},{30,20,[51,70]},{50,10,[61,80]},{70,5,[71,80]},{100,2,[81,90]},{150,1,[91,100]}]
A2025: 2022 | B2025: 6 | C2025: 28 | D2025: 0 | E2025: =R[-9]C -> 61 | F2025: =R[-9]C -> 70 | G2025: 5 | H2025: 20000 | I2025: 110003 | J2025: 5 | K2025: =R[-1]C -> [{5,8},{6,15},{13,10},{14,8},{15,10},{16,8},{20,1},{27,10},{28,10}] | L2025: =R[-1]C -> [{5,1113},{6,1113},{13,18},{14,37},{15,18},{16,37},{20,3},{27,18},{28,18}] | M2025: =R[-1]C -> [{0,1,[1,30]},{1,2,[11,40]},{2,5,[21,50]},{5,10,[31,60]},{10,20,[41,60]},{30,20,[51,70]},{50,10,[61,80]},{70,5,[71,80]},{100,2,[81,90]},{150,1,[91,100]}]
A2026: 2023 | B2026: 6 | C2026: 28 | D2026: 0 | E2026: =R[-9]C -> 71 | F2026: =R[-9]C -> 80 | G2026: 5 | H2026: 20000 | I2026: 110003 | J2026: 5 | K2026: =R[-1]C -> [{5,8},{6,15},{13,10},{14,8},{15,10},{16,8},{20,1},{27,10},{28,10}] | L2026: =R[-1]C -> [{5,1113},{6,1113},{13,18},{14,37},{15,18},{16,37},{20,3},{27,18},{28,18}] | M2026: =R[-1]C -> [{0,1,[1,30]},{1,2,[11,40]},{2,5,[21,50]},{5,10,[31,60]},{10,20,[41,60]},{30,20,[51,70]},{50,10,[61,80]},{70,5,[71,80]},{100,2,[81,90]},{150,1,[91,100]}]
A2027: 2024 | B2027: 6 | C2027: 28 | D2027: 0 | E2027: =R[-9]C -> 81 | F2027: =R[-9]C -> 90 | G2027: 5 | H2027: 20000 | I2027: 110003 | J2027: 5 | K2027: =R[-1]C -> [{5,8},{6,15},{13,10},{14,8},{15,10},{16,8},{20,1},{27,10},{28,10}] | L2027: =R[-1]C -> [{5,1113},{6,1113},{13,18},{14,37},{15,18},{16,37},{20,3},{27,18},{28,18}] | M2027: =R[-1]C -> [{0,1,[1,30]},{1,2,[11,40]},{2,5,[21,50]},{5,10,[31,60]},{10,20,[41,60]},{30,20,[51,70]},{50,10,[61,80]},{70,5,[71,80]},{100,2,[81,90]},{150,1,[91,100]}]
A2028: 2025 | B2028: 2 | C2028: 23 | D2028: 0 | E2028: =R[-18]C -> 1 | F2028: =R[-18]C -> 10 | G2028: 1 | H2028: 5000 | I2028: 110003 | J2028: 1 | K2028: =R[-1]C -> [{5,8},{6,15},{13,10},{14,8},{15,10},{16,8},{20,1},{27,10},{28,10}] | L2028: =R[-1]C -> [{5,1113},{6,1113},{13,18},{14,37},{15,18},{16,37},{20,3},{27,18},{28,18}] | M2028: =R[-1]C -> [{0,1,[1,30]},{1,2,[11,40]},{2,5,[21,50]},{5,10,[31,60]},{10,20,[41,60]},{30,20,[51,70]},{50,10,[61,80]},{70,5,[71,80]},{100,2,[81,90]},{150,1,[91,100]}]
A2029: 2026 | B2029: 2 | C2029: 23 | D2029: 0 | E2029: =R[-18]C -> 11 | F2029: =R[-18]C -> 20 | G2029: 1 | H2029: 5000 | I2029: 110003 | J2029: 1 | K2029: =R[-1]C -> [{5,8},{6,15},{13,10},{14,8},{15,10},{16,8},{20,1},{27,10},{28,10}] | L2029: =R[-1]C -> [{5,1113},{6,1113},{13,18},{14,37},{15,18},{16,37},{20,3},{27,18},{28,18}] | M2029: =R[-1]C -> [{0,1,[1,30]},{1,2,[11,40]},{2,5,[21,50]},{5,10,[31,60]},{10,20,[41,60]},{30,20,[51,70]},{50,10,[61,80]},{70,5,[71,80]},{100,2,[81,90]},{150,1,[91,100]}]
A2030: 2027 | B2030: 2 | C2030: 23 | D2030: 0 | E2030: =R[-18]C -> 21 | F2030: =R[-18]C -> 30 | G2030: 1 | H2030: 5000 | I2030: 110003 | J2030: 1 | K2030: =R[-1]C -> [{5,8},{6,15},{13,10},{14,8},{15,10},{16,8},{20,1},{27,10},{28,10}] | L2030: =R[-1]C -> [{5,1113},{6,1113},{13,18},{14,37},{15,18},{16,37},{20,3},{27,18},{28,18}] | M2030: =R[-1]C -> [{0,1,[1,30]},{1,2,[11,40]},{2,5,[21,50]},{5,10,[31,60]},{10,20,[41,60]},{30,20,[51,70]},{50,10,[61,80]},{70,5,[71,80]},{100,2,[81,90]},{150,1,[91,100]}]
A2031: 2028 | B2031: 2 | C2031: 23 | D2031: 0 | E2031: =R[-18]C -> 31 | F2031: =R[-18]C -> 40 | G2031: 1 | H2031: 5000 | I2031: 110003 | J2031: 1 | K2031: =R[-1]C -> [{5,8},{6,15},{13,10},{14,8},{15,10},{16,8},{20,1},{27,10},{28,10}] | L2031: =R[-1]C -> [{5,1113},{6,1113},{13,18},{14,37},{15,18},{16,37},{20,3},{27,18},{28,18}] | M2031: =R[-1]C -> [{0,1,[1,30]},{1,2,[11,40]},{2,5,[21,50]},{5,10,[31,60]},{10,20,[41,60]},{30,20,[51,70]},{50,10,[61,80]},{70,5,[71,80]},{100,2,[81,90]},{150,1,[91,100]}]
A2032: 2029 | B2032: 2 | C2032: 23 | D2032: 0 | E2032: =R[-18]C -> 41 | F2032: =R[-18]C -> 50 | G2032: 1 | H2032: 5000 | I2032: 110003 | J2032: 1 | K2032: =R[-1]C -> [{5,8},{6,15},{13,10},{14,8},{15,10},{16,8},{20,1},{27,10},{28,10}] | L2032: =R[-1]C -> [{5,1113},{6,1113},{13,18},{14,37},{15,18},{16,37},{20,3},{27,18},{28,18}] | M2032: =R[-1]C -> [{0,1,[1,30]},{1,2,[11,40]},{2,5,[21,50]},{5,10,[31,60]},{10,20,[41,60]},{30,20,[51,70]},{50,10,[61,80]},{70,5,[71,80]},{100,2,[81,90]},{150,1,[91,100]}]
A2033: 2030 | B2033: 2 | C2033: 23 | D2033: 0 | E2033: =R[-18]C -> 51 | F2033: =R[-18]C -> 60 | G2033: 1 | H2033: 5000 | I2033: 110003 | J2033: 1 | K2033: =R[-1]C -> [{5,8},{6,15},{13,10},{14,8},{15,10},{16,8},{20,1},{27,10},{28,10}] | L2033: =R[-1]C -> [{5,1113},{6,1113},{13,18},{14,37},{15,18},{16,37},{20,3},{27,18},{28,18}] | M2033: =R[-1]C -> [{0,1,[1,30]},{1,2,[11,40]},{2,5,[21,50]},{5,10,[31,60]},{10,20,[41,60]},{30,20,[51,70]},{50,10,[61,80]},{70,5,[71,80]},{100,2,[81,90]},{150,1,[91,100]}]
A2034: 2031 | B2034: 2 | C2034: 23 | D2034: 0 | E2034: =R[-18]C -> 61 | F2034: =R[-18]C -> 70 | G2034: 1 | H2034: 5000 | I2034: 110003 | J2034: 1 | K2034: =R[-1]C -> [{5,8},{6,15},{13,10},{14,8},{15,10},{16,8},{20,1},{27,10},{28,10}] | L2034: =R[-1]C -> [{5,1113},{6,1113},{13,18},{14,37},{15,18},{16,37},{20,3},{27,18},{28,18}] | M2034: =R[-1]C -> [{0,1,[1,30]},{1,2,[11,40]},{2,5,[21,50]},{5,10,[31,60]},{10,20,[41,60]},{30,20,[51,70]},{50,10,[61,80]},{70,5,[71,80]},{100,2,[81,90]},{150,1,[91,100]}]
A2035: 2032 | B2035: 2 | C2035: 23 | D2035: 0 | E2035: =R[-18]C -> 71 | F2035: =R[-18]C -> 80 | G2035: 1 | H2035: 5000 | I2035: 110003 | J2035: 1 | K2035: =R[-1]C -> [{5,8},{6,15},{13,10},{14,8},{15,10},{16,8},{20,1},{27,10},{28,10}] | L2035: =R[-1]C -> [{5,1113},{6,1113},{13,18},{14,37},{15,18},{16,37},{20,3},{27,18},{28,18}] | M2035: =R[-1]C -> [{0,1,[1,30]},{1,2,[11,40]},{2,5,[21,50]},{5,10,[31,60]},{10,20,[41,60]},{30,20,[51,70]},{50,10,[61,80]},{70,5,[71,80]},{100,2,[81,90]},{150,1,[91,100]}]
A2036: 2033 | B2036: 2 | C2036: 23 | D2036: 0 | E2036: =R[-18]C -> 81 | F2036: =R[-18]C -> 90 | G2036: 1 | H2036: 5000 | I2036: 110003 | J2036: 1 | K2036: =R[-1]C -> [{5,8},{6,15},{13,10},{14,8},{15,10},{16,8},{20,1},{27,10},{28,10}] | L2036: =R[-1]C -> [{5,1113},{6,1113},{13,18},{14,37},{15,18},{16,37},{20,3},{27,18},{28,18}] | M2036: =R[-1]C -> [{0,1,[1,30]},{1,2,[11,40]},{2,5,[21,50]},{5,10,[31,60]},{10,20,[41,60]},{30,20,[51,70]},{50,10,[61,80]},{70,5,[71,80]},{100,2,[81,90]},{150,1,[91,100]}]
A2037: 2034 | B2037: 3 | C2037: 23 | D2037: 0 | E2037: =R[-9]C -> 1 | F2037: =R[-9]C -> 10 | G2037: 2 | H2037: 10000 | I2037: 110003 | J2037: 2 | K2037: =R[-1]C -> [{5,8},{6,15},{13,10},{14,8},{15,10},{16,8},{20,1},{27,10},{28,10}] | L2037: =R[-1]C -> [{5,1113},{6,1113},{13,18},{14,37},{15,18},{16,37},{20,3},{27,18},{28,18}] | M2037: =R[-1]C -> [{0,1,[1,30]},{1,2,[11,40]},{2,5,[21,50]},{5,10,[31,60]},{10,20,[41,60]},{30,20,[51,70]},{50,10,[61,80]},{70,5,[71,80]},{100,2,[81,90]},{150,1,[91,100]}]
A2038: 2035 | B2038: 3 | C2038: 23 | D2038: 0 | E2038: =R[-9]C -> 11 | F2038: =R[-9]C -> 20 | G2038: 2 | H2038: 10000 | I2038: 110003 | J2038: 2 | K2038: =R[-1]C -> [{5,8},{6,15},{13,10},{14,8},{15,10},{16,8},{20,1},{27,10},{28,10}] | L2038: =R[-1]C -> [{5,1113},{6,1113},{13,18},{14,37},{15,18},{16,37},{20,3},{27,18},{28,18}] | M2038: =R[-1]C -> [{0,1,[1,30]},{1,2,[11,40]},{2,5,[21,50]},{5,10,[31,60]},{10,20,[41,60]},{30,20,[51,70]},{50,10,[61,80]},{70,5,[71,80]},{100,2,[81,90]},{150,1,[91,100]}]
A2039: 2036 | B2039: 3 | C2039: 23 | D2039: 0 | E2039: =R[-9]C -> 21 | F2039: =R[-9]C -> 30 | G2039: 2 | H2039: 10000 | I2039: 110003 | J2039: 2 | K2039: =R[-1]C -> [{5,8},{6,15},{13,10},{14,8},{15,10},{16,8},{20,1},{27,10},{28,10}] | L2039: =R[-1]C -> [{5,1113},{6,1113},{13,18},{14,37},{15,18},{16,37},{20,3},{27,18},{28,18}] | M2039: =R[-1]C -> [{0,1,[1,30]},{1,2,[11,40]},{2,5,[21,50]},{5,10,[31,60]},{10,20,[41,60]},{30,20,[51,70]},{50,10,[61,80]},{70,5,[71,80]},{100,2,[81,90]},{150,1,[91,100]}]
A2040: 2037 | B2040: 3 | C2040: 23 | D2040: 0 | E2040: =R[-9]C -> 31 | F2040: =R[-9]C -> 40 | G2040: 2 | H2040: 10000 | I2040: 110003 | J2040: 2 | K2040: =R[-1]C -> [{5,8},{6,15},{13,10},{14,8},{15,10},{16,8},{20,1},{27,10},{28,10}] | L2040: =R[-1]C -> [{5,1113},{6,1113},{13,18},{14,37},{15,18},{16,37},{20,3},{27,18},{28,18}] | M2040: =R[-1]C -> [{0,1,[1,30]},{1,2,[11,40]},{2,5,[21,50]},{5,10,[31,60]},{10,20,[41,60]},{30,20,[51,70]},{50,10,[61,80]},{70,5,[71,80]},{100,2,[81,90]},{150,1,[91,100]}]
A2041: 2038 | B2041: 3 | C2041: 23 | D2041: 0 | E2041: =R[-9]C -> 41 | F2041: =R[-9]C -> 50 | G2041: 2 | H2041: 10000 | I2041: 110003 | J2041: 2 | K2041: =R[-1]C -> [{5,8},{6,15},{13,10},{14,8},{15,10},{16,8},{20,1},{27,10},{28,10}] | L2041: =R[-1]C -> [{5,1113},{6,1113},{13,18},{14,37},{15,18},{16,37},{20,3},{27,18},{28,18}] | M2041: =R[-1]C -> [{0,1,[1,30]},{1,2,[11,40]},{2,5,[21,50]},{5,10,[31,60]},{10,20,[41,60]},{30,20,[51,70]},{50,10,[61,80]},{70,5,[71,80]},{100,2,[81,90]},{150,1,[91,100]}]
A2042: 2039 | B2042: 3 | C2042: 23 | D2042: 0 | E2042: =R[-9]C -> 51 | F2042: =R[-9]C -> 60 | G2042: 2 | H2042: 10000 | I2042: 110003 | J2042: 2 | K2042: =R[-1]C -> [{5,8},{6,15},{13,10},{14,8},{15,10},{16,8},{20,1},{27,10},{28,10}] | L2042: =R[-1]C -> [{5,1113},{6,1113},{13,18},{14,37},{15,18},{16,37},{20,3},{27,18},{28,18}] | M2042: =R[-1]C -> [{0,1,[1,30]},{1,2,[11,40]},{2,5,[21,50]},{5,10,[31,60]},{10,20,[41,60]},{30,20,[51,70]},{50,10,[61,80]},{70,5,[71,80]},{100,2,[81,90]},{150,1,[91,100]}]
A2043: 2040 | B2043: 3 | C2043: 23 | D2043: 0 | E2043: =R[-9]C -> 61 | F2043: =R[-9]C -> 70 | G2043: 2 | H2043: 10000 | I2043: 110003 | J2043: 2 | K2043: =R[-1]C -> [{5,8},{6,15},{13,10},{14,8},{15,10},{16,8},{20,1},{27,10},{28,10}] | L2043: =R[-1]C -> [{5,1113},{6,1113},{13,18},{14,37},{15,18},{16,37},{20,3},{27,18},{28,18}] | M2043: =R[-1]C -> [{0,1,[1,30]},{1,2,[11,40]},{2,5,[21,50]},{5,10,[31,60]},{10,20,[41,60]},{30,20,[51,70]},{50,10,[61,80]},{70,5,[71,80]},{100,2,[81,90]},{150,1,[91,100]}]
A2044: 2041 | B2044: 3 | C2044: 23 | D2044: 0 | E2044: =R[-9]C -> 71 | F2044: =R[-9]C -> 80 | G2044: 2 | H2044: 10000 | I2044: 110003 | J2044: 2 | K2044: =R[-1]C -> [{5,8},{6,15},{13,10},{14,8},{15,10},{16,8},{20,1},{27,10},{28,10}] | L2044: =R[-1]C -> [{5,1113},{6,1113},{13,18},{14,37},{15,18},{16,37},{20,3},{27,18},{28,18}] | M2044: =R[-1]C -> [{0,1,[1,30]},{1,2,[11,40]},{2,5,[21,50]},{5,10,[31,60]},{10,20,[41,60]},{30,20,[51,70]},{50,10,[61,80]},{70,5,[71,80]},{100,2,[81,90]},{150,1,[91,100]}]
A2045: 2042 | B2045: 3 | C2045: 23 | D2045: 0 | E2045: =R[-9]C -> 81 | F2045: =R[-9]C -> 90 | G2045: 2 | H2045: 10000 | I2045: 110003 | J2045: 2 | K2045: =R[-1]C -> [{5,8},{6,15},{13,10},{14,8},{15,10},{16,8},{20,1},{27,10},{28,10}] | L2045: =R[-1]C -> [{5,1113},{6,1113},{13,18},{14,37},{15,18},{16,37},{20,3},{27,18},{28,18}] | M2045: =R[-1]C -> [{0,1,[1,30]},{1,2,[11,40]},{2,5,[21,50]},{5,10,[31,60]},{10,20,[41,60]},{30,20,[51,70]},{50,10,[61,80]},{70,5,[71,80]},{100,2,[81,90]},{150,1,[91,100]}]
A2046: 2043 | B2046: 4 | C2046: 23 | D2046: 0 | E2046: =R[-9]C -> 1 | F2046: =R[-9]C -> 10 | G2046: 3 | H2046: 15000 | I2046: 110003 | J2046: 3 | K2046: =R[-1]C -> [{5,8},{6,15},{13,10},{14,8},{15,10},{16,8},{20,1},{27,10},{28,10}] | L2046: =R[-1]C -> [{5,1113},{6,1113},{13,18},{14,37},{15,18},{16,37},{20,3},{27,18},{28,18}] | M2046: =R[-1]C -> [{0,1,[1,30]},{1,2,[11,40]},{2,5,[21,50]},{5,10,[31,60]},{10,20,[41,60]},{30,20,[51,70]},{50,10,[61,80]},{70,5,[71,80]},{100,2,[81,90]},{150,1,[91,100]}]
A2047: 2044 | B2047: 4 | C2047: 23 | D2047: 0 | E2047: =R[-9]C -> 11 | F2047: =R[-9]C -> 20 | G2047: 3 | H2047: 15000 | I2047: 110003 | J2047: 3 | K2047: =R[-1]C -> [{5,8},{6,15},{13,10},{14,8},{15,10},{16,8},{20,1},{27,10},{28,10}] | L2047: =R[-1]C -> [{5,1113},{6,1113},{13,18},{14,37},{15,18},{16,37},{20,3},{27,18},{28,18}] | M2047: =R[-1]C -> [{0,1,[1,30]},{1,2,[11,40]},{2,5,[21,50]},{5,10,[31,60]},{10,20,[41,60]},{30,20,[51,70]},{50,10,[61,80]},{70,5,[71,80]},{100,2,[81,90]},{150,1,[91,100]}]
A2048: 2045 | B2048: 4 | C2048: 23 | D2048: 0 | E2048: =R[-9]C -> 21 | F2048: =R[-9]C -> 30 | G2048: 3 | H2048: 15000 | I2048: 110003 | J2048: 3 | K2048: =R[-1]C -> [{5,8},{6,15},{13,10},{14,8},{15,10},{16,8},{20,1},{27,10},{28,10}] | L2048: =R[-1]C -> [{5,1113},{6,1113},{13,18},{14,37},{15,18},{16,37},{20,3},{27,18},{28,18}] | M2048: =R[-1]C -> [{0,1,[1,30]},{1,2,[11,40]},{2,5,[21,50]},{5,10,[31,60]},{10,20,[41,60]},{30,20,[51,70]},{50,10,[61,80]},{70,5,[71,80]},{100,2,[81,90]},{150,1,[91,100]}]
A2049: 2046 | B2049: 4 | C2049: 23 | D2049: 0 | E2049: =R[-9]C -> 31 | F2049: =R[-9]C -> 40 | G2049: 3 | H2049: 15000 | I2049: 110003 | J2049: 3 | K2049: =R[-1]C -> [{5,8},{6,15},{13,10},{14,8},{15,10},{16,8},{20,1},{27,10},{28,10}] | L2049: =R[-1]C -> [{5,1113},{6,1113},{13,18},{14,37},{15,18},{16,37},{20,3},{27,18},{28,18}] | M2049: =R[-1]C -> [{0,1,[1,30]},{1,2,[11,40]},{2,5,[21,50]},{5,10,[31,60]},{10,20,[41,60]},{30,20,[51,70]},{50,10,[61,80]},{70,5,[71,80]},{100,2,[81,90]},{150,1,[91,100]}]
A2050: 2047 | B2050: 4 | C2050: 23 | D2050: 0 | E2050: =R[-9]C -> 41 | F2050: =R[-9]C -> 50 | G2050: 3 | H2050: 15000 | I2050: 110003 | J2050: 3 | K2050: =R[-1]C -> [{5,8},{6,15},{13,10},{14,8},{15,10},{16,8},{20,1},{27,10},{28,10}] | L2050: =R[-1]C -> [{5,1113},{6,1113},{13,18},{14,37},{15,18},{16,37},{20,3},{27,18},{28,18}] | M2050: =R[-1]C -> [{0,1,[1,30]},{1,2,[11,40]},{2,5,[21,50]},{5,10,[31,60]},{10,20,[41,60]},{30,20,[51,70]},{50,10,[61,80]},{70,5,[71,80]},{100,2,[81,90]},{150,1,[91,100]}]
A2051: 2048 | B2051: 4 | C2051: 23 | D2051: 0 | E2051: =R[-9]C -> 51 | F2051: =R[-9]C -> 60 | G2051: 3 | H2051: 15000 | I2051: 110003 | J2051: 3 | K2051: =R[-1]C -> [{5,8},{6,15},{13,10},{14,8},{15,10},{16,8},{20,1},{27,10},{28,10}] | L2051: =R[-1]C -> [{5,1113},{6,1113},{13,18},{14,37},{15,18},{16,37},{20,3},{27,18},{28,18}] | M2051: =R[-1]C -> [{0,1,[1,30]},{1,2,[11,40]},{2,5,[21,50]},{5,10,[31,60]},{10,20,[41,60]},{30,20,[51,70]},{50,10,[61,80]},{70,5,[71,80]},{100,2,[81,90]},{150,1,[91,100]}]
A2052: 2049 | B2052: 4 | C2052: 23 | D2052: 0 | E2052: =R[-9]C -> 61 | F2052: =R[-9]C -> 70 | G2052: 3 | H2052: 15000 | I2052: 110003 | J2052: 3 | K2052: =R[-1]C -> [{5,8},{6,15},{13,10},{14,8},{15,10},{16,8},{20,1},{27,10},{28,10}] | L2052: =R[-1]C -> [{5,1113},{6,1113},{13,18},{14,37},{15,18},{16,37},{20,3},{27,18},{28,18}] | M2052: =R[-1]C -> [{0,1,[1,30]},{1,2,[11,40]},{2,5,[21,50]},{5,10,[31,60]},{10,20,[41,60]},{30,20,[51,70]},{50,10,[61,80]},{70,5,[71,80]},{100,2,[81,90]},{150,1,[91,100]}]
A2053: 2050 | B2053: 4 | C2053: 23 | D2053: 0 | E2053: =R[-9]C -> 71 | F2053: =R[-9]C -> 80 | G2053: 3 | H2053: 15000 | I2053: 110003 | J2053: 3 | K2053: =R[-1]C -> [{5,8},{6,15},{13,10},{14,8},{15,10},{16,8},{20,1},{27,10},{28,10}] | L2053: =R[-1]C -> [{5,1113},{6,1113},{13,18},{14,37},{15,18},{16,37},{20,3},{27,18},{28,18}] | M2053: =R[-1]C -> [{0,1,[1,30]},{1,2,[11,40]},{2,5,[21,50]},{5,10,[31,60]},{10,20,[41,60]},{30,20,[51,70]},{50,10,[61,80]},{70,5,[71,80]},{100,2,[81,90]},{150,1,[91,100]}]
A2054: 2051 | B2054: 4 | C2054: 23 | D2054: 0 | E2054: =R[-9]C -> 81 | F2054: =R[-9]C -> 90 | G2054: 3 | H2054: 15000 | I2054: 110003 | J2054: 3 | K2054: =R[-1]C -> [{5,8},{6,15},{13,10},{14,8},{15,10},{16,8},{20,1},{27,10},{28,10}] | L2054: =R[-1]C -> [{5,1113},{6,1113},{13,18},{14,37},{15,18},{16,37},{20,3},{27,18},{28,18}] | M2054: =R[-1]C -> [{0,1,[1,30]},{1,2,[11,40]},{2,5,[21,50]},{5,10,[31,60]},{10,20,[41,60]},{30,20,[51,70]},{50,10,[61,80]},{70,5,[71,80]},{100,2,[81,90]},{150,1,[91,100]}]
A2055: 2052 | B2055: 5 | C2055: 23 | D2055: 0 | E2055: =R[-9]C -> 1 | F2055: =R[-9]C -> 10 | G2055: 4 | H2055: 20000 | I2055: 110003 | J2055: 4 | K2055: =R[-1]C -> [{5,8},{6,15},{13,10},{14,8},{15,10},{16,8},{20,1},{27,10},{28,10}] | L2055: =R[-1]C -> [{5,1113},{6,1113},{13,18},{14,37},{15,18},{16,37},{20,3},{27,18},{28,18}] | M2055: =R[-1]C -> [{0,1,[1,30]},{1,2,[11,40]},{2,5,[21,50]},{5,10,[31,60]},{10,20,[41,60]},{30,20,[51,70]},{50,10,[61,80]},{70,5,[71,80]},{100,2,[81,90]},{150,1,[91,100]}]
A2056: 2053 | B2056: 5 | C2056: 23 | D2056: 0 | E2056: =R[-9]C -> 11 | F2056: =R[-9]C -> 20 | G2056: 4 | H2056: 20000 | I2056: 110003 | J2056: 4 | K2056: =R[-1]C -> [{5,8},{6,15},{13,10},{14,8},{15,10},{16,8},{20,1},{27,10},{28,10}] | L2056: =R[-1]C -> [{5,1113},{6,1113},{13,18},{14,37},{15,18},{16,37},{20,3},{27,18},{28,18}] | M2056: =R[-1]C -> [{0,1,[1,30]},{1,2,[11,40]},{2,5,[21,50]},{5,10,[31,60]},{10,20,[41,60]},{30,20,[51,70]},{50,10,[61,80]},{70,5,[71,80]},{100,2,[81,90]},{150,1,[91,100]}]
A2057: 2054 | B2057: 5 | C2057: 23 | D2057: 0 | E2057: =R[-9]C -> 21 | F2057: =R[-9]C -> 30 | G2057: 4 | H2057: 20000 | I2057: 110003 | J2057: 4 | K2057: =R[-1]C -> [{5,8},{6,15},{13,10},{14,8},{15,10},{16,8},{20,1},{27,10},{28,10}] | L2057: =R[-1]C -> [{5,1113},{6,1113},{13,18},{14,37},{15,18},{16,37},{20,3},{27,18},{28,18}] | M2057: =R[-1]C -> [{0,1,[1,30]},{1,2,[11,40]},{2,5,[21,50]},{5,10,[31,60]},{10,20,[41,60]},{30,20,[51,70]},{50,10,[61,80]},{70,5,[71,80]},{100,2,[81,90]},{150,1,[91,100]}]
A2058: 2055 | B2058: 5 | C2058: 23 | D2058: 0 | E2058: =R[-9]C -> 31 | F2058: =R[-9]C -> 40 | G2058: 4 | H2058: 20000 | I2058: 110003 | J2058: 4 | K2058: =R[-1]C -> [{5,8},{6,15},{13,10},{14,8},{15,10},{16,8},{20,1},{27,10},{28,10}] | L2058: =R[-1]C -> [{5,1113},{6,1113},{13,18},{14,37},{15,18},{16,37},{20,3},{27,18},{28,18}] | M2058: =R[-1]C -> [{0,1,[1,30]},{1,2,[11,40]},{2,5,[21,50]},{5,10,[31,60]},{10,20,[41,60]},{30,20,[51,70]},{50,10,[61,80]},{70,5,[71,80]},{100,2,[81,90]},{150,1,[91,100]}]
A2059: 2056 | B2059: 5 | C2059: 23 | D2059: 0 | E2059: =R[-9]C -> 41 | F2059: =R[-9]C -> 50 | G2059: 4 | H2059: 20000 | I2059: 110003 | J2059: 4 | K2059: =R[-1]C -> [{5,8},{6,15},{13,10},{14,8},{15,10},{16,8},{20,1},{27,10},{28,10}] | L2059: =R[-1]C -> [{5,1113},{6,1113},{13,18},{14,37},{15,18},{16,37},{20,3},{27,18},{28,18}] | M2059: =R[-1]C -> [{0,1,[1,30]},{1,2,[11,40]},{2,5,[21,50]},{5,10,[31,60]},{10,20,[41,60]},{30,20,[51,70]},{50,10,[61,80]},{70,5,[71,80]},{100,2,[81,90]},{150,1,[91,100]}]
A2060: 2057 | B2060: 5 | C2060: 23 | D2060: 0 | E2060: =R[-9]C -> 51 | F2060: =R[-9]C -> 60 | G2060: 4 | H2060: 20000 | I2060: 110003 | J2060: 4 | K2060: =R[-1]C -> [{5,8},{6,15},{13,10},{14,8},{15,10},{16,8},{20,1},{27,10},{28,10}] | L2060: =R[-1]C -> [{5,1113},{6,1113},{13,18},{14,37},{15,18},{16,37},{20,3},{27,18},{28,18}] | M2060: =R[-1]C -> [{0,1,[1,30]},{1,2,[11,40]},{2,5,[21,50]},{5,10,[31,60]},{10,20,[41,60]},{30,20,[51,70]},{50,10,[61,80]},{70,5,[71,80]},{100,2,[81,90]},{150,1,[91,100]}]
A2061: 2058 | B2061: 5 | C2061: 23 | D2061: 0 | E2061: =R[-9]C -> 61 | F2061: =R[-9]C -> 70 | G2061: 4 | H2061: 20000 | I2061: 110003 | J2061: 4 | K2061: =R[-1]C -> [{5,8},{6,15},{13,10},{14,8},{15,10},{16,8},{20,1},{27,10},{28,10}] | L2061: =R[-1]C -> [{5,1113},{6,1113},{13,18},{14,37},{15,18},{16,37},{20,3},{27,18},{28,18}] | M2061: =R[-1]C -> [{0,1,[1,30]},{1,2,[11,40]},{2,5,[21,50]},{5,10,[31,60]},{10,20,[41,60]},{30,20,[51,70]},{50,10,[61,80]},{70,5,[71,80]},{100,2,[81,90]},{150,1,[91,100]}]
A2062: 2059 | B2062: 5 | C2062: 23 | D2062: 0 | E2062: =R[-9]C -> 71 | F2062: =R[-9]C -> 80 | G2062: 4 | H2062: 20000 | I2062: 110003 | J2062: 4 | K2062: =R[-1]C -> [{5,8},{6,15},{13,10},{14,8},{15,10},{16,8},{20,1},{27,10},{28,10}] | L2062: =R[-1]C -> [{5,1113},{6,1113},{13,18},{14,37},{15,18},{16,37},{20,3},{27,18},{28,18}] | M2062: =R[-1]C -> [{0,1,[1,30]},{1,2,[11,40]},{2,5,[21,50]},{5,10,[31,60]},{10,20,[41,60]},{30,20,[51,70]},{50,10,[61,80]},{70,5,[71,80]},{100,2,[81,90]},{150,1,[91,100]}]
A2063: 2060 | B2063: 5 | C2063: 23 | D2063: 0 | E2063: =R[-9]C -> 81 | F2063: =R[-9]C -> 90 | G2063: 4 | H2063: 20000 | I2063: 110003 | J2063: 4 | K2063: =R[-1]C -> [{5,8},{6,15},{13,10},{14,8},{15,10},{16,8},{20,1},{27,10},{28,10}] | L2063: =R[-1]C -> [{5,1113},{6,1113},{13,18},{14,37},{15,18},{16,37},{20,3},{27,18},{28,18}] | M2063: =R[-1]C -> [{0,1,[1,30]},{1,2,[11,40]},{2,5,[21,50]},{5,10,[31,60]},{10,20,[41,60]},{30,20,[51,70]},{50,10,[61,80]},{70,5,[71,80]},{100,2,[81,90]},{150,1,[91,100]}]
A2064: 2061 | B2064: 6 | C2064: 23 | D2064: 0 | E2064: =R[-9]C -> 1 | F2064: =R[-9]C -> 10 | G2064: 5 | H2064: 20000 | I2064: 110003 | J2064: 5 | K2064: =R[-1]C -> [{5,8},{6,15},{13,10},{14,8},{15,10},{16,8},{20,1},{27,10},{28,10}] | L2064: =R[-1]C -> [{5,1113},{6,1113},{13,18},{14,37},{15,18},{16,37},{20,3},{27,18},{28,18}] | M2064: =R[-1]C -> [{0,1,[1,30]},{1,2,[11,40]},{2,5,[21,50]},{5,10,[31,60]},{10,20,[41,60]},{30,20,[51,70]},{50,10,[61,80]},{70,5,[71,80]},{100,2,[81,90]},{150,1,[91,100]}]
A2065: 2062 | B2065: 6 | C2065: 23 | D2065: 0 | E2065: =R[-9]C -> 11 | F2065: =R[-9]C -> 20 | G2065: 5 | H2065: 20000 | I2065: 110003 | J2065: 5 | K2065: =R[-1]C -> [{5,8},{6,15},{13,10},{14,8},{15,10},{16,8},{20,1},{27,10},{28,10}] | L2065: =R[-1]C -> [{5,1113},{6,1113},{13,18},{14,37},{15,18},{16,37},{20,3},{27,18},{28,18}] | M2065: =R[-1]C -> [{0,1,[1,30]},{1,2,[11,40]},{2,5,[21,50]},{5,10,[31,60]},{10,20,[41,60]},{30,20,[51,70]},{50,10,[61,80]},{70,5,[71,80]},{100,2,[81,90]},{150,1,[91,100]}]
A2066: 2063 | B2066: 6 | C2066: 23 | D2066: 0 | E2066: =R[-9]C -> 21 | F2066: =R[-9]C -> 30 | G2066: 5 | H2066: 20000 | I2066: 110003 | J2066: 5 | K2066: =R[-1]C -> [{5,8},{6,15},{13,10},{14,8},{15,10},{16,8},{20,1},{27,10},{28,10}] | L2066: =R[-1]C -> [{5,1113},{6,1113},{13,18},{14,37},{15,18},{16,37},{20,3},{27,18},{28,18}] | M2066: =R[-1]C -> [{0,1,[1,30]},{1,2,[11,40]},{2,5,[21,50]},{5,10,[31,60]},{10,20,[41,60]},{30,20,[51,70]},{50,10,[61,80]},{70,5,[71,80]},{100,2,[81,90]},{150,1,[91,100]}]
A2067: 2064 | B2067: 6 | C2067: 23 | D2067: 0 | E2067: =R[-9]C -> 31 | F2067: =R[-9]C -> 40 | G2067: 5 | H2067: 20000 | I2067: 110003 | J2067: 5 | K2067: =R[-1]C -> [{5,8},{6,15},{13,10},{14,8},{15,10},{16,8},{20,1},{27,10},{28,10}] | L2067: =R[-1]C -> [{5,1113},{6,1113},{13,18},{14,37},{15,18},{16,37},{20,3},{27,18},{28,18}] | M2067: =R[-1]C -> [{0,1,[1,30]},{1,2,[11,40]},{2,5,[21,50]},{5,10,[31,60]},{10,20,[41,60]},{30,20,[51,70]},{50,10,[61,80]},{70,5,[71,80]},{100,2,[81,90]},{150,1,[91,100]}]
A2068: 2065 | B2068: 6 | C2068: 23 | D2068: 0 | E2068: =R[-9]C -> 41 | F2068: =R[-9]C -> 50 | G2068: 5 | H2068: 20000 | I2068: 110003 | J2068: 5 | K2068: =R[-1]C -> [{5,8},{6,15},{13,10},{14,8},{15,10},{16,8},{20,1},{27,10},{28,10}] | L2068: =R[-1]C -> [{5,1113},{6,1113},{13,18},{14,37},{15,18},{16,37},{20,3},{27,18},{28,18}] | M2068: =R[-1]C -> [{0,1,[1,30]},{1,2,[11,40]},{2,5,[21,50]},{5,10,[31,60]},{10,20,[41,60]},{30,20,[51,70]},{50,10,[61,80]},{70,5,[71,80]},{100,2,[81,90]},{150,1,[91,100]}]
A2069: 2066 | B2069: 6 | C2069: 23 | D2069: 0 | E2069: =R[-9]C -> 51 | F2069: =R[-9]C -> 60 | G2069: 5 | H2069: 20000 | I2069: 110003 | J2069: 5 | K2069: =R[-1]C -> [{5,8},{6,15},{13,10},{14,8},{15,10},{16,8},{20,1},{27,10},{28,10}] | L2069: =R[-1]C -> [{5,1113},{6,1113},{13,18},{14,37},{15,18},{16,37},{20,3},{27,18},{28,18}] | M2069: =R[-1]C -> [{0,1,[1,30]},{1,2,[11,40]},{2,5,[21,50]},{5,10,[31,60]},{10,20,[41,60]},{30,20,[51,70]},{50,10,[61,80]},{70,5,[71,80]},{100,2,[81,90]},{150,1,[91,100]}]
A2070: 2067 | B2070: 6 | C2070: 23 | D2070: 0 | E2070: =R[-9]C -> 61 | F2070: =R[-9]C -> 70 | G2070: 5 | H2070: 20000 | I2070: 110003 | J2070: 5 | K2070: =R[-1]C -> [{5,8},{6,15},{13,10},{14,8},{15,10},{16,8},{20,1},{27,10},{28,10}] | L2070: =R[-1]C -> [{5,1113},{6,1113},{13,18},{14,37},{15,18},{16,37},{20,3},{27,18},{28,18}] | M2070: =R[-1]C -> [{0,1,[1,30]},{1,2,[11,40]},{2,5,[21,50]},{5,10,[31,60]},{10,20,[41,60]},{30,20,[51,70]},{50,10,[61,80]},{70,5,[71,80]},{100,2,[81,90]},{150,1,[91,100]}]
A2071: 2068 | B2071: 6 | C2071: 23 | D2071: 0 | E2071: =R[-9]C -> 71 | F2071: =R[-9]C -> 80 | G2071: 5 | H2071: 20000 | I2071: 110003 | J2071: 5 | K2071: =R[-1]C -> [{5,8},{6,15},{13,10},{14,8},{15,10},{16,8},{20,1},{27,10},{28,10}] | L2071: =R[-1]C -> [{5,1113},{6,1113},{13,18},{14,37},{15,18},{16,37},{20,3},{27,18},{28,18}] | M2071: =R[-1]C -> [{0,1,[1,30]},{1,2,[11,40]},{2,5,[21,50]},{5,10,[31,60]},{10,20,[41,60]},{30,20,[51,70]},{50,10,[61,80]},{70,5,[71,80]},{100,2,[81,90]},{150,1,[91,100]}]
A2072: 2069 | B2072: 6 | C2072: 23 | D2072: 0 | E2072: =R[-9]C -> 81 | F2072: =R[-9]C -> 90 | G2072: 5 | H2072: 20000 | I2072: 110003 | J2072: 5 | K2072: =R[-1]C -> [{5,8},{6,15},{13,10},{14,8},{15,10},{16,8},{20,1},{27,10},{28,10}] | L2072: =R[-1]C -> [{5,1113},{6,1113},{13,18},{14,37},{15,18},{16,37},{20,3},{27,18},{28,18}] | M2072: =R[-1]C -> [{0,1,[1,30]},{1,2,[11,40]},{2,5,[21,50]},{5,10,[31,60]},{10,20,[41,60]},{30,20,[51,70]},{50,10,[61,80]},{70,5,[71,80]},{100,2,[81,90]},{150,1,[91,100]}]
A2073: 2070 | B2073: 2 | C2073: 26 | D2073: 0 | E2073: =R[-18]C -> 1 | F2073: =R[-18]C -> 10 | G2073: 1 | H2073: 5000 | I2073: 110003 | J2073: 1 | K2073: =R[-1]C -> [{5,8},{6,15},{13,10},{14,8},{15,10},{16,8},{20,1},{27,10},{28,10}] | L2073: =R[-1]C -> [{5,1113},{6,1113},{13,18},{14,37},{15,18},{16,37},{20,3},{27,18},{28,18}] | M2073: =R[-1]C -> [{0,1,[1,30]},{1,2,[11,40]},{2,5,[21,50]},{5,10,[31,60]},{10,20,[41,60]},{30,20,[51,70]},{50,10,[61,80]},{70,5,[71,80]},{100,2,[81,90]},{150,1,[91,100]}]
A2074: 2071 | B2074: 2 | C2074: 26 | D2074: 0 | E2074: =R[-18]C -> 11 | F2074: =R[-18]C -> 20 | G2074: 1 | H2074: 5000 | I2074: 110003 | J2074: 1 | K2074: =R[-1]C -> [{5,8},{6,15},{13,10},{14,8},{15,10},{16,8},{20,1},{27,10},{28,10}] | L2074: =R[-1]C -> [{5,1113},{6,1113},{13,18},{14,37},{15,18},{16,37},{20,3},{27,18},{28,18}] | M2074: =R[-1]C -> [{0,1,[1,30]},{1,2,[11,40]},{2,5,[21,50]},{5,10,[31,60]},{10,20,[41,60]},{30,20,[51,70]},{50,10,[61,80]},{70,5,[71,80]},{100,2,[81,90]},{150,1,[91,100]}]
A2075: 2072 | B2075: 2 | C2075: 26 | D2075: 0 | E2075: =R[-18]C -> 21 | F2075: =R[-18]C -> 30 | G2075: 1 | H2075: 5000 | I2075: 110003 | J2075: 1 | K2075: =R[-1]C -> [{5,8},{6,15},{13,10},{14,8},{15,10},{16,8},{20,1},{27,10},{28,10}] | L2075: =R[-1]C -> [{5,1113},{6,1113},{13,18},{14,37},{15,18},{16,37},{20,3},{27,18},{28,18}] | M2075: =R[-1]C -> [{0,1,[1,30]},{1,2,[11,40]},{2,5,[21,50]},{5,10,[31,60]},{10,20,[41,60]},{30,20,[51,70]},{50,10,[61,80]},{70,5,[71,80]},{100,2,[81,90]},{150,1,[91,100]}]
A2076: 2073 | B2076: 2 | C2076: 26 | D2076: 0 | E2076: =R[-18]C -> 31 | F2076: =R[-18]C -> 40 | G2076: 1 | H2076: 5000 | I2076: 110003 | J2076: 1 | K2076: =R[-1]C -> [{5,8},{6,15},{13,10},{14,8},{15,10},{16,8},{20,1},{27,10},{28,10}] | L2076: =R[-1]C -> [{5,1113},{6,1113},{13,18},{14,37},{15,18},{16,37},{20,3},{27,18},{28,18}] | M2076: =R[-1]C -> [{0,1,[1,30]},{1,2,[11,40]},{2,5,[21,50]},{5,10,[31,60]},{10,20,[41,60]},{30,20,[51,70]},{50,10,[61,80]},{70,5,[71,80]},{100,2,[81,90]},{150,1,[91,100]}]
A2077: 2074 | B2077: 2 | C2077: 26 | D2077: 0 | E2077: =R[-18]C -> 41 | F2077: =R[-18]C -> 50 | G2077: 1 | H2077: 5000 | I2077: 110003 | J2077: 1 | K2077: =R[-1]C -> [{5,8},{6,15},{13,10},{14,8},{15,10},{16,8},{20,1},{27,10},{28,10}] | L2077: =R[-1]C -> [{5,1113},{6,1113},{13,18},{14,37},{15,18},{16,37},{20,3},{27,18},{28,18}] | M2077: =R[-1]C -> [{0,1,[1,30]},{1,2,[11,40]},{2,5,[21,50]},{5,10,[31,60]},{10,20,[41,60]},{30,20,[51,70]},{50,10,[61,80]},{70,5,[71,80]},{100,2,[81,90]},{150,1,[91,100]}]
A2078: 2075 | B2078: 2 | C2078: 26 | D2078: 0 | E2078: =R[-18]C -> 51 | F2078: =R[-18]C -> 60 | G2078: 1 | H2078: 5000 | I2078: 110003 | J2078: 1 | K2078: =R[-1]C -> [{5,8},{6,15},{13,10},{14,8},{15,10},{16,8},{20,1},{27,10},{28,10}] | L2078: =R[-1]C -> [{5,1113},{6,1113},{13,18},{14,37},{15,18},{16,37},{20,3},{27,18},{28,18}] | M2078: =R[-1]C -> [{0,1,[1,30]},{1,2,[11,40]},{2,5,[21,50]},{5,10,[31,60]},{10,20,[41,60]},{30,20,[51,70]},{50,10,[61,80]},{70,5,[71,80]},{100,2,[81,90]},{150,1,[91,100]}]
A2079: 2076 | B2079: 2 | C2079: 26 | D2079: 0 | E2079: =R[-18]C -> 61 | F2079: =R[-18]C -> 70 | G2079: 1 | H2079: 5000 | I2079: 110003 | J2079: 1 | K2079: =R[-1]C -> [{5,8},{6,15},{13,10},{14,8},{15,10},{16,8},{20,1},{27,10},{28,10}] | L2079: =R[-1]C -> [{5,1113},{6,1113},{13,18},{14,37},{15,18},{16,37},{20,3},{27,18},{28,18}] | M2079: =R[-1]C -> [{0,1,[1,30]},{1,2,[11,40]},{2,5,[21,50]},{5,10,[31,60]},{10,20,[41,60]},{30,20,[51,70]},{50,10,[61,80]},{70,5,[71,80]},{100,2,[81,90]},{150,1,[91,100]}]
A2080: 2077 | B2080: 2 | C2080: 26 | D2080: 0 | E2080: =R[-18]C -> 71 | F2080: =R[-18]C -> 80 | G2080: 1 | H2080: 5000 | I2080: 110003 | J2080: 1 | K2080: =R[-1]C -> [{5,8},{6,15},{13,10},{14,8},{15,10},{16,8},{20,1},{27,10},{28,10}] | L2080: =R[-1]C -> [{5,1113},{6,1113},{13,18},{14,37},{15,18},{16,37},{20,3},{27,18},{28,18}] | M2080: =R[-1]C -> [{0,1,[1,30]},{1,2,[11,40]},{2,5,[21,50]},{5,10,[31,60]},{10,20,[41,60]},{30,20,[51,70]},{50,10,[61,80]},{70,5,[71,80]},{100,2,[81,90]},{150,1,[91,100]}]
A2081: 2078 | B2081: 2 | C2081: 26 | D2081: 0 | E2081: =R[-18]C -> 81 | F2081: =R[-18]C -> 90 | G2081: 1 | H2081: 5000 | I2081: 110003 | J2081: 1 | K2081: =R[-1]C -> [{5,8},{6,15},{13,10},{14,8},{15,10},{16,8},{20,1},{27,10},{28,10}] | L2081: =R[-1]C -> [{5,1113},{6,1113},{13,18},{14,37},{15,18},{16,37},{20,3},{27,18},{28,18}] | M2081: =R[-1]C -> [{0,1,[1,30]},{1,2,[11,40]},{2,5,[21,50]},{5,10,[31,60]},{10,20,[41,60]},{30,20,[51,70]},{50,10,[61,80]},{70,5,[71,80]},{100,2,[81,90]},{150,1,[91,100]}]
A2082: 2079 | B2082: 3 | C2082: 26 | D2082: 0 | E2082: =R[-9]C -> 1 | F2082: =R[-9]C -> 10 | G2082: 2 | H2082: 10000 | I2082: 110003 | J2082: 2 | K2082: =R[-1]C -> [{5,8},{6,15},{13,10},{14,8},{15,10},{16,8},{20,1},{27,10},{28,10}] | L2082: =R[-1]C -> [{5,1113},{6,1113},{13,18},{14,37},{15,18},{16,37},{20,3},{27,18},{28,18}] | M2082: =R[-1]C -> [{0,1,[1,30]},{1,2,[11,40]},{2,5,[21,50]},{5,10,[31,60]},{10,20,[41,60]},{30,20,[51,70]},{50,10,[61,80]},{70,5,[71,80]},{100,2,[81,90]},{150,1,[91,100]}]
A2083: 2080 | B2083: 3 | C2083: 26 | D2083: 0 | E2083: =R[-9]C -> 11 | F2083: =R[-9]C -> 20 | G2083: 2 | H2083: 10000 | I2083: 110003 | J2083: 2 | K2083: =R[-1]C -> [{5,8},{6,15},{13,10},{14,8},{15,10},{16,8},{20,1},{27,10},{28,10}] | L2083: =R[-1]C -> [{5,1113},{6,1113},{13,18},{14,37},{15,18},{16,37},{20,3},{27,18},{28,18}] | M2083: =R[-1]C -> [{0,1,[1,30]},{1,2,[11,40]},{2,5,[21,50]},{5,10,[31,60]},{10,20,[41,60]},{30,20,[51,70]},{50,10,[61,80]},{70,5,[71,80]},{100,2,[81,90]},{150,1,[91,100]}]
A2084: 2081 | B2084: 3 | C2084: 26 | D2084: 0 | E2084: =R[-9]C -> 21 | F2084: =R[-9]C -> 30 | G2084: 2 | H2084: 10000 | I2084: 110003 | J2084: 2 | K2084: =R[-1]C -> [{5,8},{6,15},{13,10},{14,8},{15,10},{16,8},{20,1},{27,10},{28,10}] | L2084: =R[-1]C -> [{5,1113},{6,1113},{13,18},{14,37},{15,18},{16,37},{20,3},{27,18},{28,18}] | M2084: =R[-1]C -> [{0,1,[1,30]},{1,2,[11,40]},{2,5,[21,50]},{5,10,[31,60]},{10,20,[41,60]},{30,20,[51,70]},{50,10,[61,80]},{70,5,[71,80]},{100,2,[81,90]},{150,1,[91,100]}]
A2085: 2082 | B2085: 3 | C2085: 26 | D2085: 0 | E2085: =R[-9]C -> 31 | F2085: =R[-9]C -> 40 | G2085: 2 | H2085: 10000 | I2085: 110003 | J2085: 2 | K2085: =R[-1]C -> [{5,8},{6,15},{13,10},{14,8},{15,10},{16,8},{20,1},{27,10},{28,10}] | L2085: =R[-1]C -> [{5,1113},{6,1113},{13,18},{14,37},{15,18},{16,37},{20,3},{27,18},{28,18}] | M2085: =R[-1]C -> [{0,1,[1,30]},{1,2,[11,40]},{2,5,[21,50]},{5,10,[31,60]},{10,20,[41,60]},{30,20,[51,70]},{50,10,[61,80]},{70,5,[71,80]},{100,2,[81,90]},{150,1,[91,100]}]
A2086: 2083 | B2086: 3 | C2086: 26 | D2086: 0 | E2086: =R[-9]C -> 41 | F2086: =R[-9]C -> 50 | G2086: 2 | H2086: 10000 | I2086: 110003 | J2086: 2 | K2086: =R[-1]C -> [{5,8},{6,15},{13,10},{14,8},{15,10},{16,8},{20,1},{27,10},{28,10}] | L2086: =R[-1]C -> [{5,1113},{6,1113},{13,18},{14,37},{15,18},{16,37},{20,3},{27,18},{28,18}] | M2086: =R[-1]C -> [{0,1,[1,30]},{1,2,[11,40]},{2,5,[21,50]},{5,10,[31,60]},{10,20,[41,60]},{30,20,[51,70]},{50,10,[61,80]},{70,5,[71,80]},{100,2,[81,90]},{150,1,[91,100]}]
A2087: 2084 | B2087: 3 | C2087: 26 | D2087: 0 | E2087: =R[-9]C -> 51 | F2087: =R[-9]C -> 60 | G2087: 2 | H2087: 10000 | I2087: 110003 | J2087: 2 | K2087: =R[-1]C -> [{5,8},{6,15},{13,10},{14,8},{15,10},{16,8},{20,1},{27,10},{28,10}] | L2087: =R[-1]C -> [{5,1113},{6,1113},{13,18},{14,37},{15,18},{16,37},{20,3},{27,18},{28,18}] | M2087: =R[-1]C -> [{0,1,[1,30]},{1,2,[11,40]},{2,5,[21,50]},{5,10,[31,60]},{10,20,[41,60]},{30,20,[51,70]},{50,10,[61,80]},{70,5,[71,80]},{100,2,[81,90]},{150,1,[91,100]}]
A2088: 2085 | B2088: 3 | C2088: 26 | D2088: 0 | E2088: =R[-9]C -> 61 | F2088: =R[-9]C -> 70 | G2088: 2 | H2088: 10000 | I2088: 110003 | J2088: 2 | K2088: =R[-1]C -> [{5,8},{6,15},{13,10},{14,8},{15,10},{16,8},{20,1},{27,10},{28,10}] | L2088: =R[-1]C -> [{5,1113},{6,1113},{13,18},{14,37},{15,18},{16,37},{20,3},{27,18},{28,18}] | M2088: =R[-1]C -> [{0,1,[1,30]},{1,2,[11,40]},{2,5,[21,50]},{5,10,[31,60]},{10,20,[41,60]},{30,20,[51,70]},{50,10,[61,80]},{70,5,[71,80]},{100,2,[81,90]},{150,1,[91,100]}]
A2089: 2086 | B2089: 3 | C2089: 26 | D2089: 0 | E2089: =R[-9]C -> 71 | F2089: =R[-9]C -> 80 | G2089: 2 | H2089: 10000 | I2089: 110003 | J2089: 2 | K2089: =R[-1]C -> [{5,8},{6,15},{13,10},{14,8},{15,10},{16,8},{20,1},{27,10},{28,10}] | L2089: =R[-1]C -> [{5,1113},{6,1113},{13,18},{14,37},{15,18},{16,37},{20,3},{27,18},{28,18}] | M2089: =R[-1]C -> [{0,1,[1,30]},{1,2,[11,40]},{2,5,[21,50]},{5,10,[31,60]},{10,20,[41,60]},{30,20,[51,70]},{50,10,[61,80]},{70,5,[71,80]},{100,2,[81,90]},{150,1,[91,100]}]
A2090: 2087 | B2090: 3 | C2090: 26 | D2090: 0 | E2090: =R[-9]C -> 81 | F2090: =R[-9]C -> 90 | G2090: 2 | H2090: 10000 | I2090: 110003 | J2090: 2 | K2090: =R[-1]C -> [{5,8},{6,15},{13,10},{14,8},{15,10},{16,8},{20,1},{27,10},{28,10}] | L2090: =R[-1]C -> [{5,1113},{6,1113},{13,18},{14,37},{15,18},{16,37},{20,3},{27,18},{28,18}] | M2090: =R[-1]C -> [{0,1,[1,30]},{1,2,[11,40]},{2,5,[21,50]},{5,10,[31,60]},{10,20,[41,60]},{30,20,[51,70]},{50,10,[61,80]},{70,5,[71,80]},{100,2,[81,90]},{150,1,[91,100]}]
A2091: 2088 | B2091: 4 | C2091: 26 | D2091: 0 | E2091: =R[-9]C -> 1 | F2091: =R[-9]C -> 10 | G2091: 3 | H2091: 15000 | I2091: 110003 | J2091: 3 | K2091: =R[-1]C -> [{5,8},{6,15},{13,10},{14,8},{15,10},{16,8},{20,1},{27,10},{28,10}] | L2091: =R[-1]C -> [{5,1113},{6,1113},{13,18},{14,37},{15,18},{16,37},{20,3},{27,18},{28,18}] | M2091: =R[-1]C -> [{0,1,[1,30]},{1,2,[11,40]},{2,5,[21,50]},{5,10,[31,60]},{10,20,[41,60]},{30,20,[51,70]},{50,10,[61,80]},{70,5,[71,80]},{100,2,[81,90]},{150,1,[91,100]}]
A2092: 2089 | B2092: 4 | C2092: 26 | D2092: 0 | E2092: =R[-9]C -> 11 | F2092: =R[-9]C -> 20 | G2092: 3 | H2092: 15000 | I2092: 110003 | J2092: 3 | K2092: =R[-1]C -> [{5,8},{6,15},{13,10},{14,8},{15,10},{16,8},{20,1},{27,10},{28,10}] | L2092: =R[-1]C -> [{5,1113},{6,1113},{13,18},{14,37},{15,18},{16,37},{20,3},{27,18},{28,18}] | M2092: =R[-1]C -> [{0,1,[1,30]},{1,2,[11,40]},{2,5,[21,50]},{5,10,[31,60]},{10,20,[41,60]},{30,20,[51,70]},{50,10,[61,80]},{70,5,[71,80]},{100,2,[81,90]},{150,1,[91,100]}]
A2093: 2090 | B2093: 4 | C2093: 26 | D2093: 0 | E2093: =R[-9]C -> 21 | F2093: =R[-9]C -> 30 | G2093: 3 | H2093: 15000 | I2093: 110003 | J2093: 3 | K2093: =R[-1]C -> [{5,8},{6,15},{13,10},{14,8},{15,10},{16,8},{20,1},{27,10},{28,10}] | L2093: =R[-1]C -> [{5,1113},{6,1113},{13,18},{14,37},{15,18},{16,37},{20,3},{27,18},{28,18}] | M2093: =R[-1]C -> [{0,1,[1,30]},{1,2,[11,40]},{2,5,[21,50]},{5,10,[31,60]},{10,20,[41,60]},{30,20,[51,70]},{50,10,[61,80]},{70,5,[71,80]},{100,2,[81,90]},{150,1,[91,100]}]
A2094: 2091 | B2094: 4 | C2094: 26 | D2094: 0 | E2094: =R[-9]C -> 31 | F2094: =R[-9]C -> 40 | G2094: 3 | H2094: 15000 | I2094: 110003 | J2094: 3 | K2094: =R[-1]C -> [{5,8},{6,15},{13,10},{14,8},{15,10},{16,8},{20,1},{27,10},{28,10}] | L2094: =R[-1]C -> [{5,1113},{6,1113},{13,18},{14,37},{15,18},{16,37},{20,3},{27,18},{28,18}] | M2094: =R[-1]C -> [{0,1,[1,30]},{1,2,[11,40]},{2,5,[21,50]},{5,10,[31,60]},{10,20,[41,60]},{30,20,[51,70]},{50,10,[61,80]},{70,5,[71,80]},{100,2,[81,90]},{150,1,[91,100]}]
A2095: 2092 | B2095: 4 | C2095: 26 | D2095: 0 | E2095: =R[-9]C -> 41 | F2095: =R[-9]C -> 50 | G2095: 3 | H2095: 15000 | I2095: 110003 | J2095: 3 | K2095: =R[-1]C -> [{5,8},{6,15},{13,10},{14,8},{15,10},{16,8},{20,1},{27,10},{28,10}] | L2095: =R[-1]C -> [{5,1113},{6,1113},{13,18},{14,37},{15,18},{16,37},{20,3},{27,18},{28,18}] | M2095: =R[-1]C -> [{0,1,[1,30]},{1,2,[11,40]},{2,5,[21,50]},{5,10,[31,60]},{10,20,[41,60]},{30,20,[51,70]},{50,10,[61,80]},{70,5,[71,80]},{100,2,[81,90]},{150,1,[91,100]}]
A2096: 2093 | B2096: 4 | C2096: 26 | D2096: 0 | E2096: =R[-9]C -> 51 | F2096: =R[-9]C -> 60 | G2096: 3 | H2096: 15000 | I2096: 110003 | J2096: 3 | K2096: =R[-1]C -> [{5,8},{6,15},{13,10},{14,8},{15,10},{16,8},{20,1},{27,10},{28,10}] | L2096: =R[-1]C -> [{5,1113},{6,1113},{13,18},{14,37},{15,18},{16,37},{20,3},{27,18},{28,18}] | M2096: =R[-1]C -> [{0,1,[1,30]},{1,2,[11,40]},{2,5,[21,50]},{5,10,[31,60]},{10,20,[41,60]},{30,20,[51,70]},{50,10,[61,80]},{70,5,[71,80]},{100,2,[81,90]},{150,1,[91,100]}]
A2097: 2094 | B2097: 4 | C2097: 26 | D2097: 0 | E2097: =R[-9]C -> 61 | F2097: =R[-9]C -> 70 | G2097: 3 | H2097: 15000 | I2097: 110003 | J2097: 3 | K2097: =R[-1]C -> [{5,8},{6,15},{13,10},{14,8},{15,10},{16,8},{20,1},{27,10},{28,10}] | L2097: =R[-1]C -> [{5,1113},{6,1113},{13,18},{14,37},{15,18},{16,37},{20,3},{27,18},{28,18}] | M2097: =R[-1]C -> [{0,1,[1,30]},{1,2,[11,40]},{2,5,[21,50]},{5,10,[31,60]},{10,20,[41,60]},{30,20,[51,70]},{50,10,[61,80]},{70,5,[71,80]},{100,2,[81,90]},{150,1,[91,100]}]
A2098: 2095 | B2098: 4 | C2098: 26 | D2098: 0 | E2098: =R[-9]C -> 71 | F2098: =R[-9]C -> 80 | G2098: 3 | H2098: 15000 | I2098: 110003 | J2098: 3 | K2098: =R[-1]C -> [{5,8},{6,15},{13,10},{14,8},{15,10},{16,8},{20,1},{27,10},{28,10}] | L2098: =R[-1]C -> [{5,1113},{6,1113},{13,18},{14,37},{15,18},{16,37},{20,3},{27,18},{28,18}] | M2098: =R[-1]C -> [{0,1,[1,30]},{1,2,[11,40]},{2,5,[21,50]},{5,10,[31,60]},{10,20,[41,60]},{30,20,[51,70]},{50,10,[61,80]},{70,5,[71,80]},{100,2,[81,90]},{150,1,[91,100]}]
A2099: 2096 | B2099: 4 | C2099: 26 | D2099: 0 | E2099: =R[-9]C -> 81 | F2099: =R[-9]C -> 90 | G2099: 3 | H2099: 15000 | I2099: 110003 | J2099: 3 | K2099: =R[-1]C -> [{5,8},{6,15},{13,10},{14,8},{15,10},{16,8},{20,1},{27,10},{28,10}] | L2099: =R[-1]C -> [{5,1113},{6,1113},{13,18},{14,37},{15,18},{16,37},{20,3},{27,18},{28,18}] | M2099: =R[-1]C -> [{0,1,[1,30]},{1,2,[11,40]},{2,5,[21,50]},{5,10,[31,60]},{10,20,[41,60]},{30,20,[51,70]},{50,10,[61,80]},{70,5,[71,80]},{100,2,[81,90]},{150,1,[91,100]}]
A2100: 2097 | B2100: 5 | C2100: 26 | D2100: 0 | E2100: =R[-9]C -> 1 | F2100: =R[-9]C -> 10 | G2100: 4 | H2100: 20000 | I2100: 110003 | J2100: 4 | K2100: =R[-1]C -> [{5,8},{6,15},{13,10},{14,8},{15,10},{16,8},{20,1},{27,10},{28,10}] | L2100: =R[-1]C -> [{5,1113},{6,1113},{13,18},{14,37},{15,18},{16,37},{20,3},{27,18},{28,18}] | M2100: =R[-1]C -> [{0,1,[1,30]},{1,2,[11,40]},{2,5,[21,50]},{5,10,[31,60]},{10,20,[41,60]},{30,20,[51,70]},{50,10,[61,80]},{70,5,[71,80]},{100,2,[81,90]},{150,1,[91,100]}]
A2101: 2098 | B2101: 5 | C2101: 26 | D2101: 0 | E2101: =R[-9]C -> 11 | F2101: =R[-9]C -> 20 | G2101: 4 | H2101: 20000 | I2101: 110003 | J2101: 4 | K2101: =R[-1]C -> [{5,8},{6,15},{13,10},{14,8},{15,10},{16,8},{20,1},{27,10},{28,10}] | L2101: =R[-1]C -> [{5,1113},{6,1113},{13,18},{14,37},{15,18},{16,37},{20,3},{27,18},{28,18}] | M2101: =R[-1]C -> [{0,1,[1,30]},{1,2,[11,40]},{2,5,[21,50]},{5,10,[31,60]},{10,20,[41,60]},{30,20,[51,70]},{50,10,[61,80]},{70,5,[71,80]},{100,2,[81,90]},{150,1,[91,100]}]
A2102: 2099 | B2102: 5 | C2102: 26 | D2102: 0 | E2102: =R[-9]C -> 21 | F2102: =R[-9]C -> 30 | G2102: 4 | H2102: 20000 | I2102: 110003 | J2102: 4 | K2102: =R[-1]C -> [{5,8},{6,15},{13,10},{14,8},{15,10},{16,8},{20,1},{27,10},{28,10}] | L2102: =R[-1]C -> [{5,1113},{6,1113},{13,18},{14,37},{15,18},{16,37},{20,3},{27,18},{28,18}] | M2102: =R[-1]C -> [{0,1,[1,30]},{1,2,[11,40]},{2,5,[21,50]},{5,10,[31,60]},{10,20,[41,60]},{30,20,[51,70]},{50,10,[61,80]},{70,5,[71,80]},{100,2,[81,90]},{150,1,[91,100]}]
A2103: 2100 | B2103: 5 | C2103: 26 | D2103: 0 | E2103: =R[-9]C -> 31 | F2103: =R[-9]C -> 40 | G2103: 4 | H2103: 20000 | I2103: 110003 | J2103: 4 | K2103: =R[-1]C -> [{5,8},{6,15},{13,10},{14,8},{15,10},{16,8},{20,1},{27,10},{28,10}] | L2103: =R[-1]C -> [{5,1113},{6,1113},{13,18},{14,37},{15,18},{16,37},{20,3},{27,18},{28,18}] | M2103: =R[-1]C -> [{0,1,[1,30]},{1,2,[11,40]},{2,5,[21,50]},{5,10,[31,60]},{10,20,[41,60]},{30,20,[51,70]},{50,10,[61,80]},{70,5,[71,80]},{100,2,[81,90]},{150,1,[91,100]}]
A2104: 2101 | B2104: 5 | C2104: 26 | D2104: 0 | E2104: =R[-9]C -> 41 | F2104: =R[-9]C -> 50 | G2104: 4 | H2104: 20000 | I2104: 110003 | J2104: 4 | K2104: =R[-1]C -> [{5,8},{6,15},{13,10},{14,8},{15,10},{16,8},{20,1},{27,10},{28,10}] | L2104: =R[-1]C -> [{5,1113},{6,1113},{13,18},{14,37},{15,18},{16,37},{20,3},{27,18},{28,18}] | M2104: =R[-1]C -> [{0,1,[1,30]},{1,2,[11,40]},{2,5,[21,50]},{5,10,[31,60]},{10,20,[41,60]},{30,20,[51,70]},{50,10,[61,80]},{70,5,[71,80]},{100,2,[81,90]},{150,1,[91,100]}]
A2105: 2102 | B2105: 5 | C2105: 26 | D2105: 0 | E2105: =R[-9]C -> 51 | F2105: =R[-9]C -> 60 | G2105: 4 | H2105: 20000 | I2105: 110003 | J2105: 4 | K2105: =R[-1]C -> [{5,8},{6,15},{13,10},{14,8},{15,10},{16,8},{20,1},{27,10},{28,10}] | L2105: =R[-1]C -> [{5,1113},{6,1113},{13,18},{14,37},{15,18},{16,37},{20,3},{27,18},{28,18}] | M2105: =R[-1]C -> [{0,1,[1,30]},{1,2,[11,40]},{2,5,[21,50]},{5,10,[31,60]},{10,20,[41,60]},{30,20,[51,70]},{50,10,[61,80]},{70,5,[71,80]},{100,2,[81,90]},{150,1,[91,100]}]
A2106: 2103 | B2106: 5 | C2106: 26 | D2106: 0 | E2106: =R[-9]C -> 61 | F2106: =R[-9]C -> 70 | G2106: 4 | H2106: 20000 | I2106: 110003 | J2106: 4 | K2106: =R[-1]C -> [{5,8},{6,15},{13,10},{14,8},{15,10},{16,8},{20,1},{27,10},{28,10}] | L2106: =R[-1]C -> [{5,1113},{6,1113},{13,18},{14,37},{15,18},{16,37},{20,3},{27,18},{28,18}] | M2106: =R[-1]C -> [{0,1,[1,30]},{1,2,[11,40]},{2,5,[21,50]},{5,10,[31,60]},{10,20,[41,60]},{30,20,[51,70]},{50,10,[61,80]},{70,5,[71,80]},{100,2,[81,90]},{150,1,[91,100]}]
A2107: 2104 | B2107: 5 | C2107: 26 | D2107: 0 | E2107: =R[-9]C -> 71 | F2107: =R[-9]C -> 80 | G2107: 4 | H2107: 20000 | I2107: 110003 | J2107: 4 | K2107: =R[-1]C -> [{5,8},{6,15},{13,10},{14,8},{15,10},{16,8},{20,1},{27,10},{28,10}] | L2107: =R[-1]C -> [{5,1113},{6,1113},{13,18},{14,37},{15,18},{16,37},{20,3},{27,18},{28,18}] | M2107: =R[-1]C -> [{0,1,[1,30]},{1,2,[11,40]},{2,5,[21,50]},{5,10,[31,60]},{10,20,[41,60]},{30,20,[51,70]},{50,10,[61,80]},{70,5,[71,80]},{100,2,[81,90]},{150,1,[91,100]}]
A2108: 2105 | B2108: 5 | C2108: 26 | D2108: 0 | E2108: =R[-9]C -> 81 | F2108: =R[-9]C -> 90 | G2108: 4 | H2108: 20000 | I2108: 110003 | J2108: 4 | K2108: =R[-1]C -> [{5,8},{6,15},{13,10},{14,8},{15,10},{16,8},{20,1},{27,10},{28,10}] | L2108: =R[-1]C -> [{5,1113},{6,1113},{13,18},{14,37},{15,18},{16,37},{20,3},{27,18},{28,18}] | M2108: =R[-1]C -> [{0,1,[1,30]},{1,2,[11,40]},{2,5,[21,50]},{5,10,[31,60]},{10,20,[41,60]},{30,20,[51,70]},{50,10,[61,80]},{70,5,[71,80]},{100,2,[81,90]},{150,1,[91,100]}]
A2109: 2106 | B2109: 6 | C2109: 26 | D2109: 0 | E2109: =R[-9]C -> 1 | F2109: =R[-9]C -> 10 | G2109: 5 | H2109: 20000 | I2109: 110003 | J2109: 5 | K2109: =R[-1]C -> [{5,8},{6,15},{13,10},{14,8},{15,10},{16,8},{20,1},{27,10},{28,10}] | L2109: =R[-1]C -> [{5,1113},{6,1113},{13,18},{14,37},{15,18},{16,37},{20,3},{27,18},{28,18}] | M2109: =R[-1]C -> [{0,1,[1,30]},{1,2,[11,40]},{2,5,[21,50]},{5,10,[31,60]},{10,20,[41,60]},{30,20,[51,70]},{50,10,[61,80]},{70,5,[71,80]},{100,2,[81,90]},{150,1,[91,100]}]
A2110: 2107 | B2110: 6 | C2110: 26 | D2110: 0 | E2110: =R[-9]C -> 11 | F2110: =R[-9]C -> 20 | G2110: 5 | H2110: 20000 | I2110: 110003 | J2110: 5 | K2110: =R[-1]C -> [{5,8},{6,15},{13,10},{14,8},{15,10},{16,8},{20,1},{27,10},{28,10}] | L2110: =R[-1]C -> [{5,1113},{6,1113},{13,18},{14,37},{15,18},{16,37},{20,3},{27,18},{28,18}] | M2110: =R[-1]C -> [{0,1,[1,30]},{1,2,[11,40]},{2,5,[21,50]},{5,10,[31,60]},{10,20,[41,60]},{30,20,[51,70]},{50,10,[61,80]},{70,5,[71,80]},{100,2,[81,90]},{150,1,[91,100]}]
A2111: 2108 | B2111: 6 | C2111: 26 | D2111: 0 | E2111: =R[-9]C -> 21 | F2111: =R[-9]C -> 30 | G2111: 5 | H2111: 20000 | I2111: 110003 | J2111: 5 | K2111: =R[-1]C -> [{5,8},{6,15},{13,10},{14,8},{15,10},{16,8},{20,1},{27,10},{28,10}] | L2111: =R[-1]C -> [{5,1113},{6,1113},{13,18},{14,37},{15,18},{16,37},{20,3},{27,18},{28,18}] | M2111: =R[-1]C -> [{0,1,[1,30]},{1,2,[11,40]},{2,5,[21,50]},{5,10,[31,60]},{10,20,[41,60]},{30,20,[51,70]},{50,10,[61,80]},{70,5,[71,80]},{100,2,[81,90]},{150,1,[91,100]}]
A2112: 2109 | B2112: 6 | C2112: 26 | D2112: 0 | E2112: =R[-9]C -> 31 | F2112: =R[-9]C -> 40 | G2112: 5 | H2112: 20000 | I2112: 110003 | J2112: 5 | K2112: =R[-1]C -> [{5,8},{6,15},{13,10},{14,8},{15,10},{16,8},{20,1},{27,10},{28,10}] | L2112: =R[-1]C -> [{5,1113},{6,1113},{13,18},{14,37},{15,18},{16,37},{20,3},{27,18},{28,18}] | M2112: =R[-1]C -> [{0,1,[1,30]},{1,2,[11,40]},{2,5,[21,50]},{5,10,[31,60]},{10,20,[41,60]},{30,20,[51,70]},{50,10,[61,80]},{70,5,[71,80]},{100,2,[81,90]},{150,1,[91,100]}]
A2113: 2110 | B2113: 6 | C2113: 26 | D2113: 0 | E2113: =R[-9]C -> 41 | F2113: =R[-9]C -> 50 | G2113: 5 | H2113: 20000 | I2113: 110003 | J2113: 5 | K2113: =R[-1]C -> [{5,8},{6,15},{13,10},{14,8},{15,10},{16,8},{20,1},{27,10},{28,10}] | L2113: =R[-1]C -> [{5,1113},{6,1113},{13,18},{14,37},{15,18},{16,37},{20,3},{27,18},{28,18}] | M2113: =R[-1]C -> [{0,1,[1,30]},{1,2,[11,40]},{2,5,[21,50]},{5,10,[31,60]},{10,20,[41,60]},{30,20,[51,70]},{50,10,[61,80]},{70,5,[71,80]},{100,2,[81,90]},{150,1,[91,100]}]
A2114: 2111 | B2114: 6 | C2114: 26 | D2114: 0 | E2114: =R[-9]C -> 51 | F2114: =R[-9]C -> 60 | G2114: 5 | H2114: 20000 | I2114: 110003 | J2114: 5 | K2114: =R[-1]C -> [{5,8},{6,15},{13,10},{14,8},{15,10},{16,8},{20,1},{27,10},{28,10}] | L2114: =R[-1]C -> [{5,1113},{6,1113},{13,18},{14,37},{15,18},{16,37},{20,3},{27,18},{28,18}] | M2114: =R[-1]C -> [{0,1,[1,30]},{1,2,[11,40]},{2,5,[21,50]},{5,10,[31,60]},{10,20,[41,60]},{30,20,[51,70]},{50,10,[61,80]},{70,5,[71,80]},{100,2,[81,90]},{150,1,[91,100]}]
A2115: 2112 | B2115: 6 | C2115: 26 | D2115: 0 | E2115: =R[-9]C -> 61 | F2115: =R[-9]C -> 70 | G2115: 5 | H2115: 20000 | I2115: 110003 | J2115: 5 | K2115: =R[-1]C -> [{5,8},{6,15},{13,10},{14,8},{15,10},{16,8},{20,1},{27,10},{28,10}] | L2115: =R[-1]C -> [{5,1113},{6,1113},{13,18},{14,37},{15,18},{16,37},{20,3},{27,18},{28,18}] | M2115: =R[-1]C -> [{0,1,[1,30]},{1,2,[11,40]},{2,5,[21,50]},{5,10,[31,60]},{10,20,[41,60]},{30,20,[51,70]},{50,10,[61,80]},{70,5,[71,80]},{100,2,[81,90]},{150,1,[91,100]}]
A2116: 2113 | B2116: 6 | C2116: 26 | D2116: 0 | E2116: =R[-9]C -> 71 | F2116: =R[-9]C -> 80 | G2116: 5 | H2116: 20000 | I2116: 110003 | J2116: 5 | K2116: =R[-1]C -> [{5,8},{6,15},{13,10},{14,8},{15,10},{16,8},{20,1},{27,10},{28,10}] | L2116: =R[-1]C -> [{5,1113},{6,1113},{13,18},{14,37},{15,18},{16,37},{20,3},{27,18},{28,18}] | M2116: =R[-1]C -> [{0,1,[1,30]},{1,2,[11,40]},{2,5,[21,50]},{5,10,[31,60]},{10,20,[41,60]},{30,20,[51,70]},{50,10,[61,80]},{70,5,[71,80]},{100,2,[81,90]},{150,1,[91,100]}]
A2117: 2114 | B2117: 6 | C2117: 26 | D2117: 0 | E2117: =R[-9]C -> 81 | F2117: =R[-9]C -> 90 | G2117: 5 | H2117: 20000 | I2117: 110003 | J2117: 5 | K2117: =R[-1]C -> [{5,8},{6,15},{13,10},{14,8},{15,10},{16,8},{20,1},{27,10},{28,10}] | L2117: =R[-1]C -> [{5,1113},{6,1113},{13,18},{14,37},{15,18},{16,37},{20,3},{27,18},{28,18}] | M2117: =R[-1]C -> [{0,1,[1,30]},{1,2,[11,40]},{2,5,[21,50]},{5,10,[31,60]},{10,20,[41,60]},{30,20,[51,70]},{50,10,[61,80]},{70,5,[71,80]},{100,2,[81,90]},{150,1,[91,100]}]
A2118: 2070 | B2118: 2 | C2118: 22 | D2118: 0 | E2118: =R[-18]C -> 1 | F2118: =R[-18]C -> 10 | G2118: 1 | H2118: 5000 | I2118: 110003 | J2118: 1 | K2118: =R[-1]C -> [{5,8},{6,15},{13,10},{14,8},{15,10},{16,8},{20,1},{27,10},{28,10}] | L2118: =R[-1]C -> [{5,1113},{6,1113},{13,18},{14,37},{15,18},{16,37},{20,3},{27,18},{28,18}] | M2118: =R[-1]C -> [{0,1,[1,30]},{1,2,[11,40]},{2,5,[21,50]},{5,10,[31,60]},{10,20,[41,60]},{30,20,[51,70]},{50,10,[61,80]},{70,5,[71,80]},{100,2,[81,90]},{150,1,[91,100]}]
A2119: 2071 | B2119: 2 | C2119: 22 | D2119: 0 | E2119: =R[-18]C -> 11 | F2119: =R[-18]C -> 20 | G2119: 1 | H2119: 5000 | I2119: 110003 | J2119: 1 | K2119: =R[-1]C -> [{5,8},{6,15},{13,10},{14,8},{15,10},{16,8},{20,1},{27,10},{28,10}] | L2119: =R[-1]C -> [{5,1113},{6,1113},{13,18},{14,37},{15,18},{16,37},{20,3},{27,18},{28,18}] | M2119: =R[-1]C -> [{0,1,[1,30]},{1,2,[11,40]},{2,5,[21,50]},{5,10,[31,60]},{10,20,[41,60]},{30,20,[51,70]},{50,10,[61,80]},{70,5,[71,80]},{100,2,[81,90]},{150,1,[91,100]}]
A2120: 2072 | B2120: 2 | C2120: 22 | D2120: 0 | E2120: =R[-18]C -> 21 | F2120: =R[-18]C -> 30 | G2120: 1 | H2120: 5000 | I2120: 110003 | J2120: 1 | K2120: =R[-1]C -> [{5,8},{6,15},{13,10},{14,8},{15,10},{16,8},{20,1},{27,10},{28,10}] | L2120: =R[-1]C -> [{5,1113},{6,1113},{13,18},{14,37},{15,18},{16,37},{20,3},{27,18},{28,18}] | M2120: =R[-1]C -> [{0,1,[1,30]},{1,2,[11,40]},{2,5,[21,50]},{5,10,[31,60]},{10,20,[41,60]},{30,20,[51,70]},{50,10,[61,80]},{70,5,[71,80]},{100,2,[81,90]},{150,1,[91,100]}]
A2121: 2073 | B2121: 2 | C2121: 22 | D2121: 0 | E2121: =R[-18]C -> 31 | F2121: =R[-18]C -> 40 | G2121: 1 | H2121: 5000 | I2121: 110003 | J2121: 1 | K2121: =R[-1]C -> [{5,8},{6,15},{13,10},{14,8},{15,10},{16,8},{20,1},{27,10},{28,10}] | L2121: =R[-1]C -> [{5,1113},{6,1113},{13,18},{14,37},{15,18},{16,37},{20,3},{27,18},{28,18}] | M2121: =R[-1]C -> [{0,1,[1,30]},{1,2,[11,40]},{2,5,[21,50]},{5,10,[31,60]},{10,20,[41,60]},{30,20,[51,70]},{50,10,[61,80]},{70,5,[71,80]},{100,2,[81,90]},{150,1,[91,100]}]
A2122: 2074 | B2122: 2 | C2122: 22 | D2122: 0 | E2122: =R[-18]C -> 41 | F2122: =R[-18]C -> 50 | G2122: 1 | H2122: 5000 | I2122: 110003 | J2122: 1 | K2122: =R[-1]C -> [{5,8},{6,15},{13,10},{14,8},{15,10},{16,8},{20,1},{27,10},{28,10}] | L2122: =R[-1]C -> [{5,1113},{6,1113},{13,18},{14,37},{15,18},{16,37},{20,3},{27,18},{28,18}] | M2122: =R[-1]C -> [{0,1,[1,30]},{1,2,[11,40]},{2,5,[21,50]},{5,10,[31,60]},{10,20,[41,60]},{30,20,[51,70]},{50,10,[61,80]},{70,5,[71,80]},{100,2,[81,90]},{150,1,[91,100]}]
A2123: 2075 | B2123: 2 | C2123: 22 | D2123: 0 | E2123: =R[-18]C -> 51 | F2123: =R[-18]C -> 60 | G2123: 1 | H2123: 5000 | I2123: 110003 | J2123: 1 | K2123: =R[-1]C -> [{5,8},{6,15},{13,10},{14,8},{15,10},{16,8},{20,1},{27,10},{28,10}] | L2123: =R[-1]C -> [{5,1113},{6,1113},{13,18},{14,37},{15,18},{16,37},{20,3},{27,18},{28,18}] | M2123: =R[-1]C -> [{0,1,[1,30]},{1,2,[11,40]},{2,5,[21,50]},{5,10,[31,60]},{10,20,[41,60]},{30,20,[51,70]},{50,10,[61,80]},{70,5,[71,80]},{100,2,[81,90]},{150,1,[91,100]}]
A2124: 2076 | B2124: 2 | C2124: 22 | D2124: 0 | E2124: =R[-18]C -> 61 | F2124: =R[-18]C -> 70 | G2124: 1 | H2124: 5000 | I2124: 110003 | J2124: 1 | K2124: =R[-1]C -> [{5,8},{6,15},{13,10},{14,8},{15,10},{16,8},{20,1},{27,10},{28,10}] | L2124: =R[-1]C -> [{5,1113},{6,1113},{13,18},{14,37},{15,18},{16,37},{20,3},{27,18},{28,18}] | M2124: =R[-1]C -> [{0,1,[1,30]},{1,2,[11,40]},{2,5,[21,50]},{5,10,[31,60]},{10,20,[41,60]},{30,20,[51,70]},{50,10,[61,80]},{70,5,[71,80]},{100,2,[81,90]},{150,1,[91,100]}]
A2125: 2077 | B2125: 2 | C2125: 22 | D2125: 0 | E2125: =R[-18]C -> 71 | F2125: =R[-18]C -> 80 | G2125: 1 | H2125: 5000 | I2125: 110003 | J2125: 1 | K2125: =R[-1]C -> [{5,8},{6,15},{13,10},{14,8},{15,10},{16,8},{20,1},{27,10},{28,10}] | L2125: =R[-1]C -> [{5,1113},{6,1113},{13,18},{14,37},{15,18},{16,37},{20,3},{27,18},{28,18}] | M2125: =R[-1]C -> [{0,1,[1,30]},{1,2,[11,40]},{2,5,[21,50]},{5,10,[31,60]},{10,20,[41,60]},{30,20,[51,70]},{50,10,[61,80]},{70,5,[71,80]},{100,2,[81,90]},{150,1,[91,100]}]
A2126: 2078 | B2126: 2 | C2126: 22 | D2126: 0 | E2126: =R[-18]C -> 81 | F2126: =R[-18]C -> 90 | G2126: 1 | H2126: 5000 | I2126: 110003 | J2126: 1 | K2126: =R[-1]C -> [{5,8},{6,15},{13,10},{14,8},{15,10},{16,8},{20,1},{27,10},{28,10}] | L2126: =R[-1]C -> [{5,1113},{6,1113},{13,18},{14,37},{15,18},{16,37},{20,3},{27,18},{28,18}] | M2126: =R[-1]C -> [{0,1,[1,30]},{1,2,[11,40]},{2,5,[21,50]},{5,10,[31,60]},{10,20,[41,60]},{30,20,[51,70]},{50,10,[61,80]},{70,5,[71,80]},{100,2,[81,90]},{150,1,[91,100]}]
A2127: 2079 | B2127: 3 | C2127: 22 | D2127: 0 | E2127: =R[-9]C -> 1 | F2127: =R[-9]C -> 10 | G2127: 2 | H2127: 10000 | I2127: 110003 | J2127: 2 | K2127: =R[-1]C -> [{5,8},{6,15},{13,10},{14,8},{15,10},{16,8},{20,1},{27,10},{28,10}] | L2127: =R[-1]C -> [{5,1113},{6,1113},{13,18},{14,37},{15,18},{16,37},{20,3},{27,18},{28,18}] | M2127: =R[-1]C -> [{0,1,[1,30]},{1,2,[11,40]},{2,5,[21,50]},{5,10,[31,60]},{10,20,[41,60]},{30,20,[51,70]},{50,10,[61,80]},{70,5,[71,80]},{100,2,[81,90]},{150,1,[91,100]}]
A2128: 2080 | B2128: 3 | C2128: 22 | D2128: 0 | E2128: =R[-9]C -> 11 | F2128: =R[-9]C -> 20 | G2128: 2 | H2128: 10000 | I2128: 110003 | J2128: 2 | K2128: =R[-1]C -> [{5,8},{6,15},{13,10},{14,8},{15,10},{16,8},{20,1},{27,10},{28,10}] | L2128: =R[-1]C -> [{5,1113},{6,1113},{13,18},{14,37},{15,18},{16,37},{20,3},{27,18},{28,18}] | M2128: =R[-1]C -> [{0,1,[1,30]},{1,2,[11,40]},{2,5,[21,50]},{5,10,[31,60]},{10,20,[41,60]},{30,20,[51,70]},{50,10,[61,80]},{70,5,[71,80]},{100,2,[81,90]},{150,1,[91,100]}]
A2129: 2081 | B2129: 3 | C2129: 22 | D2129: 0 | E2129: =R[-9]C -> 21 | F2129: =R[-9]C -> 30 | G2129: 2 | H2129: 10000 | I2129: 110003 | J2129: 2 | K2129: =R[-1]C -> [{5,8},{6,15},{13,10},{14,8},{15,10},{16,8},{20,1},{27,10},{28,10}] | L2129: =R[-1]C -> [{5,1113},{6,1113},{13,18},{14,37},{15,18},{16,37},{20,3},{27,18},{28,18}] | M2129: =R[-1]C -> [{0,1,[1,30]},{1,2,[11,40]},{2,5,[21,50]},{5,10,[31,60]},{10,20,[41,60]},{30,20,[51,70]},{50,10,[61,80]},{70,5,[71,80]},{100,2,[81,90]},{150,1,[91,100]}]
A2130: 2082 | B2130: 3 | C2130: 22 | D2130: 0 | E2130: =R[-9]C -> 31 | F2130: =R[-9]C -> 40 | G2130: 2 | H2130: 10000 | I2130: 110003 | J2130: 2 | K2130: =R[-1]C -> [{5,8},{6,15},{13,10},{14,8},{15,10},{16,8},{20,1},{27,10},{28,10}] | L2130: =R[-1]C -> [{5,1113},{6,1113},{13,18},{14,37},{15,18},{16,37},{20,3},{27,18},{28,18}] | M2130: =R[-1]C -> [{0,1,[1,30]},{1,2,[11,40]},{2,5,[21,50]},{5,10,[31,60]},{10,20,[41,60]},{30,20,[51,70]},{50,10,[61,80]},{70,5,[71,80]},{100,2,[81,90]},{150,1,[91,100]}]
A2131: 2083 | B2131: 3 | C2131: 22 | D2131: 0 | E2131: =R[-9]C -> 41 | F2131: =R[-9]C -> 50 | G2131: 2 | H2131: 10000 | I2131: 110003 | J2131: 2 | K2131: =R[-1]C -> [{5,8},{6,15},{13,10},{14,8},{15,10},{16,8},{20,1},{27,10},{28,10}] | L2131: =R[-1]C -> [{5,1113},{6,1113},{13,18},{14,37},{15,18},{16,37},{20,3},{27,18},{28,18}] | M2131: =R[-1]C -> [{0,1,[1,30]},{1,2,[11,40]},{2,5,[21,50]},{5,10,[31,60]},{10,20,[41,60]},{30,20,[51,70]},{50,10,[61,80]},{70,5,[71,80]},{100,2,[81,90]},{150,1,[91,100]}]
A2132: 2084 | B2132: 3 | C2132: 22 | D2132: 0 | E2132: =R[-9]C -> 51 | F2132: =R[-9]C -> 60 | G2132: 2 | H2132: 10000 | I2132: 110003 | J2132: 2 | K2132: =R[-1]C -> [{5,8},{6,15},{13,10},{14,8},{15,10},{16,8},{20,1},{27,10},{28,10}] | L2132: =R[-1]C -> [{5,1113},{6,1113},{13,18},{14,37},{15,18},{16,37},{20,3},{27,18},{28,18}] | M2132: =R[-1]C -> [{0,1,[1,30]},{1,2,[11,40]},{2,5,[21,50]},{5,10,[31,60]},{10,20,[41,60]},{30,20,[51,70]},{50,10,[61,80]},{70,5,[71,80]},{100,2,[81,90]},{150,1,[91,100]}]
A2133: 2085 | B2133: 3 | C2133: 22 | D2133: 0 | E2133: =R[-9]C -> 61 | F2133: =R[-9]C -> 70 | G2133: 2 | H2133: 10000 | I2133: 110003 | J2133: 2 | K2133: =R[-1]C -> [{5,8},{6,15},{13,10},{14,8},{15,10},{16,8},{20,1},{27,10},{28,10}] | L2133: =R[-1]C -> [{5,1113},{6,1113},{13,18},{14,37},{15,18},{16,37},{20,3},{27,18},{28,18}] | M2133: =R[-1]C -> [{0,1,[1,30]},{1,2,[11,40]},{2,5,[21,50]},{5,10,[31,60]},{10,20,[41,60]},{30,20,[51,70]},{50,10,[61,80]},{70,5,[71,80]},{100,2,[81,90]},{150,1,[91,100]}]
A2134: 2086 | B2134: 3 | C2134: 22 | D2134: 0 | E2134: =R[-9]C -> 71 | F2134: =R[-9]C -> 80 | G2134: 2 | H2134: 10000 | I2134: 110003 | J2134: 2 | K2134: =R[-1]C -> [{5,8},{6,15},{13,10},{14,8},{15,10},{16,8},{20,1},{27,10},{28,10}] | L2134: =R[-1]C -> [{5,1113},{6,1113},{13,18},{14,37},{15,18},{16,37},{20,3},{27,18},{28,18}] | M2134: =R[-1]C -> [{0,1,[1,30]},{1,2,[11,40]},{2,5,[21,50]},{5,10,[31,60]},{10,20,[41,60]},{30,20,[51,70]},{50,10,[61,80]},{70,5,[71,80]},{100,2,[81,90]},{150,1,[91,100]}]
A2135: 2087 | B2135: 3 | C2135: 22 | D2135: 0 | E2135: =R[-9]C -> 81 | F2135: =R[-9]C -> 90 | G2135: 2 | H2135: 10000 | I2135: 110003 | J2135: 2 | K2135: =R[-1]C -> [{5,8},{6,15},{13,10},{14,8},{15,10},{16,8},{20,1},{27,10},{28,10}] | L2135: =R[-1]C -> [{5,1113},{6,1113},{13,18},{14,37},{15,18},{16,37},{20,3},{27,18},{28,18}] | M2135: =R[-1]C -> [{0,1,[1,30]},{1,2,[11,40]},{2,5,[21,50]},{5,10,[31,60]},{10,20,[41,60]},{30,20,[51,70]},{50,10,[61,80]},{70,5,[71,80]},{100,2,[81,90]},{150,1,[91,100]}]
A2136: 2088 | B2136: 4 | C2136: 22 | D2136: 0 | E2136: =R[-9]C -> 1 | F2136: =R[-9]C -> 10 | G2136: 3 | H2136: 15000 | I2136: 110003 | J2136: 3 | K2136: =R[-1]C -> [{5,8},{6,15},{13,10},{14,8},{15,10},{16,8},{20,1},{27,10},{28,10}] | L2136: =R[-1]C -> [{5,1113},{6,1113},{13,18},{14,37},{15,18},{16,37},{20,3},{27,18},{28,18}] | M2136: =R[-1]C -> [{0,1,[1,30]},{1,2,[11,40]},{2,5,[21,50]},{5,10,[31,60]},{10,20,[41,60]},{30,20,[51,70]},{50,10,[61,80]},{70,5,[71,80]},{100,2,[81,90]},{150,1,[91,100]}]
A2137: 2089 | B2137: 4 | C2137: 22 | D2137: 0 | E2137: =R[-9]C -> 11 | F2137: =R[-9]C -> 20 | G2137: 3 | H2137: 15000 | I2137: 110003 | J2137: 3 | K2137: =R[-1]C -> [{5,8},{6,15},{13,10},{14,8},{15,10},{16,8},{20,1},{27,10},{28,10}] | L2137: =R[-1]C -> [{5,1113},{6,1113},{13,18},{14,37},{15,18},{16,37},{20,3},{27,18},{28,18}] | M2137: =R[-1]C -> [{0,1,[1,30]},{1,2,[11,40]},{2,5,[21,50]},{5,10,[31,60]},{10,20,[41,60]},{30,20,[51,70]},{50,10,[61,80]},{70,5,[71,80]},{100,2,[81,90]},{150,1,[91,100]}]
A2138: 2090 | B2138: 4 | C2138: 22 | D2138: 0 | E2138: =R[-9]C -> 21 | F2138: =R[-9]C -> 30 | G2138: 3 | H2138: 15000 | I2138: 110003 | J2138: 3 | K2138: =R[-1]C -> [{5,8},{6,15},{13,10},{14,8},{15,10},{16,8},{20,1},{27,10},{28,10}] | L2138: =R[-1]C -> [{5,1113},{6,1113},{13,18},{14,37},{15,18},{16,37},{20,3},{27,18},{28,18}] | M2138: =R[-1]C -> [{0,1,[1,30]},{1,2,[11,40]},{2,5,[21,50]},{5,10,[31,60]},{10,20,[41,60]},{30,20,[51,70]},{50,10,[61,80]},{70,5,[71,80]},{100,2,[81,90]},{150,1,[91,100]}]
A2139: 2091 | B2139: 4 | C2139: 22 | D2139: 0 | E2139: =R[-9]C -> 31 | F2139: =R[-9]C -> 40 | G2139: 3 | H2139: 15000 | I2139: 110003 | J2139: 3 | K2139: =R[-1]C -> [{5,8},{6,15},{13,10},{14,8},{15,10},{16,8},{20,1},{27,10},{28,10}] | L2139: =R[-1]C -> [{5,1113},{6,1113},{13,18},{14,37},{15,18},{16,37},{20,3},{27,18},{28,18}] | M2139: =R[-1]C -> [{0,1,[1,30]},{1,2,[11,40]},{2,5,[21,50]},{5,10,[31,60]},{10,20,[41,60]},{30,20,[51,70]},{50,10,[61,80]},{70,5,[71,80]},{100,2,[81,90]},{150,1,[91,100]}]
A2140: 2092 | B2140: 4 | C2140: 22 | D2140: 0 | E2140: =R[-9]C -> 41 | F2140: =R[-9]C -> 50 | G2140: 3 | H2140: 15000 | I2140: 110003 | J2140: 3 | K2140: =R[-1]C -> [{5,8},{6,15},{13,10},{14,8},{15,10},{16,8},{20,1},{27,10},{28,10}] | L2140: =R[-1]C -> [{5,1113},{6,1113},{13,18},{14,37},{15,18},{16,37},{20,3},{27,18},{28,18}] | M2140: =R[-1]C -> [{0,1,[1,30]},{1,2,[11,40]},{2,5,[21,50]},{5,10,[31,60]},{10,20,[41,60]},{30,20,[51,70]},{50,10,[61,80]},{70,5,[71,80]},{100,2,[81,90]},{150,1,[91,100]}]
A2141: 2093 | B2141: 4 | C2141: 22 | D2141: 0 | E2141: =R[-9]C -> 51 | F2141: =R[-9]C -> 60 | G2141: 3 | H2141: 15000 | I2141: 110003 | J2141: 3 | K2141: =R[-1]C -> [{5,8},{6,15},{13,10},{14,8},{15,10},{16,8},{20,1},{27,10},{28,10}] | L2141: =R[-1]C -> [{5,1113},{6,1113},{13,18},{14,37},{15,18},{16,37},{20,3},{27,18},{28,18}] | M2141: =R[-1]C -> [{0,1,[1,30]},{1,2,[11,40]},{2,5,[21,50]},{5,10,[31,60]},{10,20,[41,60]},{30,20,[51,70]},{50,10,[61,80]},{70,5,[71,80]},{100,2,[81,90]},{150,1,[91,100]}]
A2142: 2094 | B2142: 4 | C2142: 22 | D2142: 0 | E2142: =R[-9]C -> 61 | F2142: =R[-9]C -> 70 | G2142: 3 | H2142: 15000 | I2142: 110003 | J2142: 3 | K2142: =R[-1]C -> [{5,8},{6,15},{13,10},{14,8},{15,10},{16,8},{20,1},{27,10},{28,10}] | L2142: =R[-1]C -> [{5,1113},{6,1113},{13,18},{14,37},{15,18},{16,37},{20,3},{27,18},{28,18}] | M2142: =R[-1]C -> [{0,1,[1,30]},{1,2,[11,40]},{2,5,[21,50]},{5,10,[31,60]},{10,20,[41,60]},{30,20,[51,70]},{50,10,[61,80]},{70,5,[71,80]},{100,2,[81,90]},{150,1,[91,100]}]
A2143: 2095 | B2143: 4 | C2143: 22 | D2143: 0 | E2143: =R[-9]C -> 71 | F2143: =R[-9]C -> 80 | G2143: 3 | H2143: 15000 | I2143: 110003 | J2143: 3 | K2143: =R[-1]C -> [{5,8},{6,15},{13,10},{14,8},{15,10},{16,8},{20,1},{27,10},{28,10}] | L2143: =R[-1]C -> [{5,1113},{6,1113},{13,18},{14,37},{15,18},{16,37},{20,3},{27,18},{28,18}] | M2143: =R[-1]C -> [{0,1,[1,30]},{1,2,[11,40]},{2,5,[21,50]},{5,10,[31,60]},{10,20,[41,60]},{30,20,[51,70]},{50,10,[61,80]},{70,5,[71,80]},{100,2,[81,90]},{150,1,[91,100]}]
A2144: 2096 | B2144: 4 | C2144: 22 | D2144: 0 | E2144: =R[-9]C -> 81 | F2144: =R[-9]C -> 90 | G2144: 3 | H2144: 15000 | I2144: 110003 | J2144: 3 | K2144: =R[-1]C -> [{5,8},{6,15},{13,10},{14,8},{15,10},{16,8},{20,1},{27,10},{28,10}] | L2144: =R[-1]C -> [{5,1113},{6,1113},{13,18},{14,37},{15,18},{16,37},{20,3},{27,18},{28,18}] | M2144: =R[-1]C -> [{0,1,[1,30]},{1,2,[11,40]},{2,5,[21,50]},{5,10,[31,60]},{10,20,[41,60]},{30,20,[51,70]},{50,10,[61,80]},{70,5,[71,80]},{100,2,[81,90]},{150,1,[91,100]}]
A2145: 2097 | B2145: 5 | C2145: 22 | D2145: 0 | E2145: =R[-9]C -> 1 | F2145: =R[-9]C -> 10 | G2145: 4 | H2145: 20000 | I2145: 110003 | J2145: 4 | K2145: =R[-1]C -> [{5,8},{6,15},{13,10},{14,8},{15,10},{16,8},{20,1},{27,10},{28,10}] | L2145: =R[-1]C -> [{5,1113},{6,1113},{13,18},{14,37},{15,18},{16,37},{20,3},{27,18},{28,18}] | M2145: =R[-1]C -> [{0,1,[1,30]},{1,2,[11,40]},{2,5,[21,50]},{5,10,[31,60]},{10,20,[41,60]},{30,20,[51,70]},{50,10,[61,80]},{70,5,[71,80]},{100,2,[81,90]},{150,1,[91,100]}]
A2146: 2098 | B2146: 5 | C2146: 22 | D2146: 0 | E2146: =R[-9]C -> 11 | F2146: =R[-9]C -> 20 | G2146: 4 | H2146: 20000 | I2146: 110003 | J2146: 4 | K2146: =R[-1]C -> [{5,8},{6,15},{13,10},{14,8},{15,10},{16,8},{20,1},{27,10},{28,10}] | L2146: =R[-1]C -> [{5,1113},{6,1113},{13,18},{14,37},{15,18},{16,37},{20,3},{27,18},{28,18}] | M2146: =R[-1]C -> [{0,1,[1,30]},{1,2,[11,40]},{2,5,[21,50]},{5,10,[31,60]},{10,20,[41,60]},{30,20,[51,70]},{50,10,[61,80]},{70,5,[71,80]},{100,2,[81,90]},{150,1,[91,100]}]
A2147: 2099 | B2147: 5 | C2147: 22 | D2147: 0 | E2147: =R[-9]C -> 21 | F2147: =R[-9]C -> 30 | G2147: 4 | H2147: 20000 | I2147: 110003 | J2147: 4 | K2147: =R[-1]C -> [{5,8},{6,15},{13,10},{14,8},{15,10},{16,8},{20,1},{27,10},{28,10}] | L2147: =R[-1]C -> [{5,1113},{6,1113},{13,18},{14,37},{15,18},{16,37},{20,3},{27,18},{28,18}] | M2147: =R[-1]C -> [{0,1,[1,30]},{1,2,[11,40]},{2,5,[21,50]},{5,10,[31,60]},{10,20,[41,60]},{30,20,[51,70]},{50,10,[61,80]},{70,5,[71,80]},{100,2,[81,90]},{150,1,[91,100]}]
A2148: 2100 | B2148: 5 | C2148: 22 | D2148: 0 | E2148: =R[-9]C -> 31 | F2148: =R[-9]C -> 40 | G2148: 4 | H2148: 20000 | I2148: 110003 | J2148: 4 | K2148: =R[-1]C -> [{5,8},{6,15},{13,10},{14,8},{15,10},{16,8},{20,1},{27,10},{28,10}] | L2148: =R[-1]C -> [{5,1113},{6,1113},{13,18},{14,37},{15,18},{16,37},{20,3},{27,18},{28,18}] | M2148: =R[-1]C -> [{0,1,[1,30]},{1,2,[11,40]},{2,5,[21,50]},{5,10,[31,60]},{10,20,[41,60]},{30,20,[51,70]},{50,10,[61,80]},{70,5,[71,80]},{100,2,[81,90]},{150,1,[91,100]}]
A2149: 2101 | B2149: 5 | C2149: 22 | D2149: 0 | E2149: =R[-9]C -> 41 | F2149: =R[-9]C -> 50 | G2149: 4 | H2149: 20000 | I2149: 110003 | J2149: 4 | K2149: =R[-1]C -> [{5,8},{6,15},{13,10},{14,8},{15,10},{16,8},{20,1},{27,10},{28,10}] | L2149: =R[-1]C -> [{5,1113},{6,1113},{13,18},{14,37},{15,18},{16,37},{20,3},{27,18},{28,18}] | M2149: =R[-1]C -> [{0,1,[1,30]},{1,2,[11,40]},{2,5,[21,50]},{5,10,[31,60]},{10,20,[41,60]},{30,20,[51,70]},{50,10,[61,80]},{70,5,[71,80]},{100,2,[81,90]},{150,1,[91,100]}]
A2150: 2102 | B2150: 5 | C2150: 22 | D2150: 0 | E2150: =R[-9]C -> 51 | F2150: =R[-9]C -> 60 | G2150: 4 | H2150: 20000 | I2150: 110003 | J2150: 4 | K2150: =R[-1]C -> [{5,8},{6,15},{13,10},{14,8},{15,10},{16,8},{20,1},{27,10},{28,10}] | L2150: =R[-1]C -> [{5,1113},{6,1113},{13,18},{14,37},{15,18},{16,37},{20,3},{27,18},{28,18}] | M2150: =R[-1]C -> [{0,1,[1,30]},{1,2,[11,40]},{2,5,[21,50]},{5,10,[31,60]},{10,20,[41,60]},{30,20,[51,70]},{50,10,[61,80]},{70,5,[71,80]},{100,2,[81,90]},{150,1,[91,100]}]
A2151: 2103 | B2151: 5 | C2151: 22 | D2151: 0 | E2151: =R[-9]C -> 61 | F2151: =R[-9]C -> 70 | G2151: 4 | H2151: 20000 | I2151: 110003 | J2151: 4 | K2151: =R[-1]C -> [{5,8},{6,15},{13,10},{14,8},{15,10},{16,8},{20,1},{27,10},{28,10}] | L2151: =R[-1]C -> [{5,1113},{6,1113},{13,18},{14,37},{15,18},{16,37},{20,3},{27,18},{28,18}] | M2151: =R[-1]C -> [{0,1,[1,30]},{1,2,[11,40]},{2,5,[21,50]},{5,10,[31,60]},{10,20,[41,60]},{30,20,[51,70]},{50,10,[61,80]},{70,5,[71,80]},{100,2,[81,90]},{150,1,[91,100]}]
A2152: 2104 | B2152: 5 | C2152: 22 | D2152: 0 | E2152: =R[-9]C -> 71 | F2152: =R[-9]C -> 80 | G2152: 4 | H2152: 20000 | I2152: 110003 | J2152: 4 | K2152: =R[-1]C -> [{5,8},{6,15},{13,10},{14,8},{15,10},{16,8},{20,1},{27,10},{28,10}] | L2152: =R[-1]C -> [{5,1113},{6,1113},{13,18},{14,37},{15,18},{16,37},{20,3},{27,18},{28,18}] | M2152: =R[-1]C -> [{0,1,[1,30]},{1,2,[11,40]},{2,5,[21,50]},{5,10,[31,60]},{10,20,[41,60]},{30,20,[51,70]},{50,10,[61,80]},{70,5,[71,80]},{100,2,[81,90]},{150,1,[91,100]}]
A2153: 2105 | B2153: 5 | C2153: 22 | D2153: 0 | E2153: =R[-9]C -> 81 | F2153: =R[-9]C -> 90 | G2153: 4 | H2153: 20000 | I2153: 110003 | J2153: 4 | K2153: =R[-1]C -> [{5,8},{6,15},{13,10},{14,8},{15,10},{16,8},{20,1},{27,10},{28,10}] | L2153: =R[-1]C -> [{5,1113},{6,1113},{13,18},{14,37},{15,18},{16,37},{20,3},{27,18},{28,18}] | M2153: =R[-1]C -> [{0,1,[1,30]},{1,2,[11,40]},{2,5,[21,50]},{5,10,[31,60]},{10,20,[41,60]},{30,20,[51,70]},{50,10,[61,80]},{70,5,[71,80]},{100,2,[81,90]},{150,1,[91,100]}]
A2154: 2106 | B2154: 6 | C2154: 22 | D2154: 0 | E2154: =R[-9]C -> 1 | F2154: =R[-9]C -> 10 | G2154: 5 | H2154: 20000 | I2154: 110003 | J2154: 5 | K2154: =R[-1]C -> [{5,8},{6,15},{13,10},{14,8},{15,10},{16,8},{20,1},{27,10},{28,10}] | L2154: =R[-1]C -> [{5,1113},{6,1113},{13,18},{14,37},{15,18},{16,37},{20,3},{27,18},{28,18}] | M2154: =R[-1]C -> [{0,1,[1,30]},{1,2,[11,40]},{2,5,[21,50]},{5,10,[31,60]},{10,20,[41,60]},{30,20,[51,70]},{50,10,[61,80]},{70,5,[71,80]},{100,2,[81,90]},{150,1,[91,100]}]
A2155: 2107 | B2155: 6 | C2155: 22 | D2155: 0 | E2155: =R[-9]C -> 11 | F2155: =R[-9]C -> 20 | G2155: 5 | H2155: 20000 | I2155: 110003 | J2155: 5 | K2155: =R[-1]C -> [{5,8},{6,15},{13,10},{14,8},{15,10},{16,8},{20,1},{27,10},{28,10}] | L2155: =R[-1]C -> [{5,1113},{6,1113},{13,18},{14,37},{15,18},{16,37},{20,3},{27,18},{28,18}] | M2155: =R[-1]C -> [{0,1,[1,30]},{1,2,[11,40]},{2,5,[21,50]},{5,10,[31,60]},{10,20,[41,60]},{30,20,[51,70]},{50,10,[61,80]},{70,5,[71,80]},{100,2,[81,90]},{150,1,[91,100]}]
A2156: 2108 | B2156: 6 | C2156: 22 | D2156: 0 | E2156: =R[-9]C -> 21 | F2156: =R[-9]C -> 30 | G2156: 5 | H2156: 20000 | I2156: 110003 | J2156: 5 | K2156: =R[-1]C -> [{5,8},{6,15},{13,10},{14,8},{15,10},{16,8},{20,1},{27,10},{28,10}] | L2156: =R[-1]C -> [{5,1113},{6,1113},{13,18},{14,37},{15,18},{16,37},{20,3},{27,18},{28,18}] | M2156: =R[-1]C -> [{0,1,[1,30]},{1,2,[11,40]},{2,5,[21,50]},{5,10,[31,60]},{10,20,[41,60]},{30,20,[51,70]},{50,10,[61,80]},{70,5,[71,80]},{100,2,[81,90]},{150,1,[91,100]}]
A2157: 2109 | B2157: 6 | C2157: 22 | D2157: 0 | E2157: =R[-9]C -> 31 | F2157: =R[-9]C -> 40 | G2157: 5 | H2157: 20000 | I2157: 110003 | J2157: 5 | K2157: =R[-1]C -> [{5,8},{6,15},{13,10},{14,8},{15,10},{16,8},{20,1},{27,10},{28,10}] | L2157: =R[-1]C -> [{5,1113},{6,1113},{13,18},{14,37},{15,18},{16,37},{20,3},{27,18},{28,18}] | M2157: =R[-1]C -> [{0,1,[1,30]},{1,2,[11,40]},{2,5,[21,50]},{5,10,[31,60]},{10,20,[41,60]},{30,20,[51,70]},{50,10,[61,80]},{70,5,[71,80]},{100,2,[81,90]},{150,1,[91,100]}]
A2158: 2110 | B2158: 6 | C2158: 22 | D2158: 0 | E2158: =R[-9]C -> 41 | F2158: =R[-9]C -> 50 | G2158: 5 | H2158: 20000 | I2158: 110003 | J2158: 5 | K2158: =R[-1]C -> [{5,8},{6,15},{13,10},{14,8},{15,10},{16,8},{20,1},{27,10},{28,10}] | L2158: =R[-1]C -> [{5,1113},{6,1113},{13,18},{14,37},{15,18},{16,37},{20,3},{27,18},{28,18}] | M2158: =R[-1]C -> [{0,1,[1,30]},{1,2,[11,40]},{2,5,[21,50]},{5,10,[31,60]},{10,20,[41,60]},{30,20,[51,70]},{50,10,[61,80]},{70,5,[71,80]},{100,2,[81,90]},{150,1,[91,100]}]
A2159: 2111 | B2159: 6 | C2159: 22 | D2159: 0 | E2159: =R[-9]C -> 51 | F2159: =R[-9]C -> 60 | G2159: 5 | H2159: 20000 | I2159: 110003 | J2159: 5 | K2159: =R[-1]C -> [{5,8},{6,15},{13,10},{14,8},{15,10},{16,8},{20,1},{27,10},{28,10}] | L2159: =R[-1]C -> [{5,1113},{6,1113},{13,18},{14,37},{15,18},{16,37},{20,3},{27,18},{28,18}] | M2159: =R[-1]C -> [{0,1,[1,30]},{1,2,[11,40]},{2,5,[21,50]},{5,10,[31,60]},{10,20,[41,60]},{30,20,[51,70]},{50,10,[61,80]},{70,5,[71,80]},{100,2,[81,90]},{150,1,[91,100]}]
A2160: 2112 | B2160: 6 | C2160: 22 | D2160: 0 | E2160: =R[-9]C -> 61 | F2160: =R[-9]C -> 70 | G2160: 5 | H2160: 20000 | I2160: 110003 | J2160: 5 | K2160: =R[-1]C -> [{5,8},{6,15},{13,10},{14,8},{15,10},{16,8},{20,1},{27,10},{28,10}] | L2160: =R[-1]C -> [{5,1113},{6,1113},{13,18},{14,37},{15,18},{16,37},{20,3},{27,18},{28,18}] | M2160: =R[-1]C -> [{0,1,[1,30]},{1,2,[11,40]},{2,5,[21,50]},{5,10,[31,60]},{10,20,[41,60]},{30,20,[51,70]},{50,10,[61,80]},{70,5,[71,80]},{100,2,[81,90]},{150,1,[91,100]}]
A2161: 2113 | B2161: 6 | C2161: 22 | D2161: 0 | E2161: =R[-9]C -> 71 | F2161: =R[-9]C -> 80 | G2161: 5 | H2161: 20000 | I2161: 110003 | J2161: 5 | K2161: =R[-1]C -> [{5,8},{6,15},{13,10},{14,8},{15,10},{16,8},{20,1},{27,10},{28,10}] | L2161: =R[-1]C -> [{5,1113},{6,1113},{13,18},{14,37},{15,18},{16,37},{20,3},{27,18},{28,18}] | M2161: =R[-1]C -> [{0,1,[1,30]},{1,2,[11,40]},{2,5,[21,50]},{5,10,[31,60]},{10,20,[41,60]},{30,20,[51,70]},{50,10,[61,80]},{70,5,[71,80]},{100,2,[81,90]},{150,1,[91,100]}]
A2162: 2114 | B2162: 6 | C2162: 22 | D2162: 0 | E2162: =R[-9]C -> 81 | F2162: =R[-9]C -> 90 | G2162: 5 | H2162: 20000 | I2162: 110003 | J2162: 5 | K2162: =R[-1]C -> [{5,8},{6,15},{13,10},{14,8},{15,10},{16,8},{20,1},{27,10},{28,10}] | L2162: =R[-1]C -> [{5,1113},{6,1113},{13,18},{14,37},{15,18},{16,37},{20,3},{27,18},{28,18}] | M2162: =R[-1]C -> [{0,1,[1,30]},{1,2,[11,40]},{2,5,[21,50]},{5,10,[31,60]},{10,20,[41,60]},{30,20,[51,70]},{50,10,[61,80]},{70,5,[71,80]},{100,2,[81,90]},{150,1,[91,100]}]
A2163: 2115 | B2163: 2 | C2163: 27 | D2163: 0 | E2163: =R[-63]C -> 1 | F2163: =R[-63]C -> 10 | G2163: 1 | H2163: 5000 | I2163: 110003 | J2163: 1 | K2163: =配置模型!R[-2148]C[12] -> [{7,3},{8,3},{9,3},{10,3},{11,3},{12,3},{17,10},{18,8},{19,1},{23,4},{24,10}] | L2163: =配置模型!R[-2115]C[1] -> [{7,27},{8,55},{9,27},{10,55},{11,27},{12,55},{17,18},{18,110},{19,3},{23,37},{24,37}] | M2163: =R[-55]C -> [{0,1,[1,30]},{1,2,[11,40]},{2,5,[21,50]},{5,10,[31,60]},{10,20,[41,60]},{30,20,[51,70]},{50,10,[61,80]},{70,5,[71,80]},{100,2,[81,90]},{150,1,[91,100]}]
A2164: 2116 | B2164: 2 | C2164: 27 | D2164: 0 | E2164: =R[-63]C -> 11 | F2164: =R[-63]C -> 20 | G2164: 1 | H2164: 5000 | I2164: 110003 | J2164: 1 | K2164: =R[-1]C -> [{7,3},{8,3},{9,3},{10,3},{11,3},{12,3},{17,10},{18,8},{19,1},{23,4},{24,10}] | L2164: =R[-1]C -> [{7,27},{8,55},{9,27},{10,55},{11,27},{12,55},{17,18},{18,110},{19,3},{23,37},{24,37}] | M2164: =R[-1]C -> [{0,1,[1,30]},{1,2,[11,40]},{2,5,[21,50]},{5,10,[31,60]},{10,20,[41,60]},{30,20,[51,70]},{50,10,[61,80]},{70,5,[71,80]},{100,2,[81,90]},{150,1,[91,100]}]
A2165: 2117 | B2165: 2 | C2165: 27 | D2165: 0 | E2165: =R[-63]C -> 21 | F2165: =R[-63]C -> 30 | G2165: 1 | H2165: 5000 | I2165: 110003 | J2165: 1 | K2165: =R[-1]C -> [{7,3},{8,3},{9,3},{10,3},{11,3},{12,3},{17,10},{18,8},{19,1},{23,4},{24,10}] | L2165: =R[-1]C -> [{7,27},{8,55},{9,27},{10,55},{11,27},{12,55},{17,18},{18,110},{19,3},{23,37},{24,37}] | M2165: =R[-1]C -> [{0,1,[1,30]},{1,2,[11,40]},{2,5,[21,50]},{5,10,[31,60]},{10,20,[41,60]},{30,20,[51,70]},{50,10,[61,80]},{70,5,[71,80]},{100,2,[81,90]},{150,1,[91,100]}]
A2166: 2118 | B2166: 2 | C2166: 27 | D2166: 0 | E2166: =R[-63]C -> 31 | F2166: =R[-63]C -> 40 | G2166: 1 | H2166: 5000 | I2166: 110003 | J2166: 1 | K2166: =R[-1]C -> [{7,3},{8,3},{9,3},{10,3},{11,3},{12,3},{17,10},{18,8},{19,1},{23,4},{24,10}] | L2166: =R[-1]C -> [{7,27},{8,55},{9,27},{10,55},{11,27},{12,55},{17,18},{18,110},{19,3},{23,37},{24,37}] | M2166: =R[-1]C -> [{0,1,[1,30]},{1,2,[11,40]},{2,5,[21,50]},{5,10,[31,60]},{10,20,[41,60]},{30,20,[51,70]},{50,10,[61,80]},{70,5,[71,80]},{100,2,[81,90]},{150,1,[91,100]}]
A2167: 2119 | B2167: 2 | C2167: 27 | D2167: 0 | E2167: =R[-63]C -> 41 | F2167: =R[-63]C -> 50 | G2167: 1 | H2167: 5000 | I2167: 110003 | J2167: 1 | K2167: =R[-1]C -> [{7,3},{8,3},{9,3},{10,3},{11,3},{12,3},{17,10},{18,8},{19,1},{23,4},{24,10}] | L2167: =R[-1]C -> [{7,27},{8,55},{9,27},{10,55},{11,27},{12,55},{17,18},{18,110},{19,3},{23,37},{24,37}] | M2167: =R[-1]C -> [{0,1,[1,30]},{1,2,[11,40]},{2,5,[21,50]},{5,10,[31,60]},{10,20,[41,60]},{30,20,[51,70]},{50,10,[61,80]},{70,5,[71,80]},{100,2,[81,90]},{150,1,[91,100]}]
A2168: 2120 | B2168: 2 | C2168: 27 | D2168: 0 | E2168: =R[-63]C -> 51 | F2168: =R[-63]C -> 60 | G2168: 1 | H2168: 5000 | I2168: 110003 | J2168: 1 | K2168: =R[-1]C -> [{7,3},{8,3},{9,3},{10,3},{11,3},{12,3},{17,10},{18,8},{19,1},{23,4},{24,10}] | L2168: =R[-1]C -> [{7,27},{8,55},{9,27},{10,55},{11,27},{12,55},{17,18},{18,110},{19,3},{23,37},{24,37}] | M2168: =R[-1]C -> [{0,1,[1,30]},{1,2,[11,40]},{2,5,[21,50]},{5,10,[31,60]},{10,20,[41,60]},{30,20,[51,70]},{50,10,[61,80]},{70,5,[71,80]},{100,2,[81,90]},{150,1,[91,100]}]
A2169: 2121 | B2169: 2 | C2169: 27 | D2169: 0 | E2169: =R[-63]C -> 61 | F2169: =R[-63]C -> 70 | G2169: 1 | H2169: 5000 | I2169: 110003 | J2169: 1 | K2169: =R[-1]C -> [{7,3},{8,3},{9,3},{10,3},{11,3},{12,3},{17,10},{18,8},{19,1},{23,4},{24,10}] | L2169: =R[-1]C -> [{7,27},{8,55},{9,27},{10,55},{11,27},{12,55},{17,18},{18,110},{19,3},{23,37},{24,37}] | M2169: =R[-1]C -> [{0,1,[1,30]},{1,2,[11,40]},{2,5,[21,50]},{5,10,[31,60]},{10,20,[41,60]},{30,20,[51,70]},{50,10,[61,80]},{70,5,[71,80]},{100,2,[81,90]},{150,1,[91,100]}]
A2170: 2122 | B2170: 2 | C2170: 27 | D2170: 0 | E2170: =R[-63]C -> 71 | F2170: =R[-63]C -> 80 | G2170: 1 | H2170: 5000 | I2170: 110003 | J2170: 1 | K2170: =R[-1]C -> [{7,3},{8,3},{9,3},{10,3},{11,3},{12,3},{17,10},{18,8},{19,1},{23,4},{24,10}] | L2170: =R[-1]C -> [{7,27},{8,55},{9,27},{10,55},{11,27},{12,55},{17,18},{18,110},{19,3},{23,37},{24,37}] | M2170: =R[-1]C -> [{0,1,[1,30]},{1,2,[11,40]},{2,5,[21,50]},{5,10,[31,60]},{10,20,[41,60]},{30,20,[51,70]},{50,10,[61,80]},{70,5,[71,80]},{100,2,[81,90]},{150,1,[91,100]}]
A2171: 2123 | B2171: 2 | C2171: 27 | D2171: 0 | E2171: =R[-63]C -> 81 | F2171: =R[-63]C -> 90 | G2171: 1 | H2171: 5000 | I2171: 110003 | J2171: 1 | K2171: =R[-1]C -> [{7,3},{8,3},{9,3},{10,3},{11,3},{12,3},{17,10},{18,8},{19,1},{23,4},{24,10}] | L2171: =R[-1]C -> [{7,27},{8,55},{9,27},{10,55},{11,27},{12,55},{17,18},{18,110},{19,3},{23,37},{24,37}] | M2171: =R[-1]C -> [{0,1,[1,30]},{1,2,[11,40]},{2,5,[21,50]},{5,10,[31,60]},{10,20,[41,60]},{30,20,[51,70]},{50,10,[61,80]},{70,5,[71,80]},{100,2,[81,90]},{150,1,[91,100]}]
A2172: 2124 | B2172: 3 | C2172: 27 | D2172: 0 | E2172: =R[-9]C -> 1 | F2172: =R[-9]C -> 10 | G2172: 2 | H2172: 10000 | I2172: 110003 | J2172: 2 | K2172: =R[-1]C -> [{7,3},{8,3},{9,3},{10,3},{11,3},{12,3},{17,10},{18,8},{19,1},{23,4},{24,10}] | L2172: =R[-1]C -> [{7,27},{8,55},{9,27},{10,55},{11,27},{12,55},{17,18},{18,110},{19,3},{23,37},{24,37}] | M2172: =R[-1]C -> [{0,1,[1,30]},{1,2,[11,40]},{2,5,[21,50]},{5,10,[31,60]},{10,20,[41,60]},{30,20,[51,70]},{50,10,[61,80]},{70,5,[71,80]},{100,2,[81,90]},{150,1,[91,100]}]
A2173: 2125 | B2173: 3 | C2173: 27 | D2173: 0 | E2173: =R[-9]C -> 11 | F2173: =R[-9]C -> 20 | G2173: 2 | H2173: 10000 | I2173: 110003 | J2173: 2 | K2173: =R[-1]C -> [{7,3},{8,3},{9,3},{10,3},{11,3},{12,3},{17,10},{18,8},{19,1},{23,4},{24,10}] | L2173: =R[-1]C -> [{7,27},{8,55},{9,27},{10,55},{11,27},{12,55},{17,18},{18,110},{19,3},{23,37},{24,37}] | M2173: =R[-1]C -> [{0,1,[1,30]},{1,2,[11,40]},{2,5,[21,50]},{5,10,[31,60]},{10,20,[41,60]},{30,20,[51,70]},{50,10,[61,80]},{70,5,[71,80]},{100,2,[81,90]},{150,1,[91,100]}]
A2174: 2126 | B2174: 3 | C2174: 27 | D2174: 0 | E2174: =R[-9]C -> 21 | F2174: =R[-9]C -> 30 | G2174: 2 | H2174: 10000 | I2174: 110003 | J2174: 2 | K2174: =R[-1]C -> [{7,3},{8,3},{9,3},{10,3},{11,3},{12,3},{17,10},{18,8},{19,1},{23,4},{24,10}] | L2174: =R[-1]C -> [{7,27},{8,55},{9,27},{10,55},{11,27},{12,55},{17,18},{18,110},{19,3},{23,37},{24,37}] | M2174: =R[-1]C -> [{0,1,[1,30]},{1,2,[11,40]},{2,5,[21,50]},{5,10,[31,60]},{10,20,[41,60]},{30,20,[51,70]},{50,10,[61,80]},{70,5,[71,80]},{100,2,[81,90]},{150,1,[91,100]}]
A2175: 2127 | B2175: 3 | C2175: 27 | D2175: 0 | E2175: =R[-9]C -> 31 | F2175: =R[-9]C -> 40 | G2175: 2 | H2175: 10000 | I2175: 110003 | J2175: 2 | K2175: =R[-1]C -> [{7,3},{8,3},{9,3},{10,3},{11,3},{12,3},{17,10},{18,8},{19,1},{23,4},{24,10}] | L2175: =R[-1]C -> [{7,27},{8,55},{9,27},{10,55},{11,27},{12,55},{17,18},{18,110},{19,3},{23,37},{24,37}] | M2175: =R[-1]C -> [{0,1,[1,30]},{1,2,[11,40]},{2,5,[21,50]},{5,10,[31,60]},{10,20,[41,60]},{30,20,[51,70]},{50,10,[61,80]},{70,5,[71,80]},{100,2,[81,90]},{150,1,[91,100]}]
A2176: 2128 | B2176: 3 | C2176: 27 | D2176: 0 | E2176: =R[-9]C -> 41 | F2176: =R[-9]C -> 50 | G2176: 2 | H2176: 10000 | I2176: 110003 | J2176: 2 | K2176: =R[-1]C -> [{7,3},{8,3},{9,3},{10,3},{11,3},{12,3},{17,10},{18,8},{19,1},{23,4},{24,10}] | L2176: =R[-1]C -> [{7,27},{8,55},{9,27},{10,55},{11,27},{12,55},{17,18},{18,110},{19,3},{23,37},{24,37}] | M2176: =R[-1]C -> [{0,1,[1,30]},{1,2,[11,40]},{2,5,[21,50]},{5,10,[31,60]},{10,20,[41,60]},{30,20,[51,70]},{50,10,[61,80]},{70,5,[71,80]},{100,2,[81,90]},{150,1,[91,100]}]
A2177: 2129 | B2177: 3 | C2177: 27 | D2177: 0 | E2177: =R[-9]C -> 51 | F2177: =R[-9]C -> 60 | G2177: 2 | H2177: 10000 | I2177: 110003 | J2177: 2 | K2177: =R[-1]C -> [{7,3},{8,3},{9,3},{10,3},{11,3},{12,3},{17,10},{18,8},{19,1},{23,4},{24,10}] | L2177: =R[-1]C -> [{7,27},{8,55},{9,27},{10,55},{11,27},{12,55},{17,18},{18,110},{19,3},{23,37},{24,37}] | M2177: =R[-1]C -> [{0,1,[1,30]},{1,2,[11,40]},{2,5,[21,50]},{5,10,[31,60]},{10,20,[41,60]},{30,20,[51,70]},{50,10,[61,80]},{70,5,[71,80]},{100,2,[81,90]},{150,1,[91,100]}]
A2178: 2130 | B2178: 3 | C2178: 27 | D2178: 0 | E2178: =R[-9]C -> 61 | F2178: =R[-9]C -> 70 | G2178: 2 | H2178: 10000 | I2178: 110003 | J2178: 2 | K2178: =R[-1]C -> [{7,3},{8,3},{9,3},{10,3},{11,3},{12,3},{17,10},{18,8},{19,1},{23,4},{24,10}] | L2178: =R[-1]C -> [{7,27},{8,55},{9,27},{10,55},{11,27},{12,55},{17,18},{18,110},{19,3},{23,37},{24,37}] | M2178: =R[-1]C -> [{0,1,[1,30]},{1,2,[11,40]},{2,5,[21,50]},{5,10,[31,60]},{10,20,[41,60]},{30,20,[51,70]},{50,10,[61,80]},{70,5,[71,80]},{100,2,[81,90]},{150,1,[91,100]}]
A2179: 2131 | B2179: 3 | C2179: 27 | D2179: 0 | E2179: =R[-9]C -> 71 | F2179: =R[-9]C -> 80 | G2179: 2 | H2179: 10000 | I2179: 110003 | J2179: 2 | K2179: =R[-1]C -> [{7,3},{8,3},{9,3},{10,3},{11,3},{12,3},{17,10},{18,8},{19,1},{23,4},{24,10}] | L2179: =R[-1]C -> [{7,27},{8,55},{9,27},{10,55},{11,27},{12,55},{17,18},{18,110},{19,3},{23,37},{24,37}] | M2179: =R[-1]C -> [{0,1,[1,30]},{1,2,[11,40]},{2,5,[21,50]},{5,10,[31,60]},{10,20,[41,60]},{30,20,[51,70]},{50,10,[61,80]},{70,5,[71,80]},{100,2,[81,90]},{150,1,[91,100]}]
A2180: 2132 | B2180: 3 | C2180: 27 | D2180: 0 | E2180: =R[-9]C -> 81 | F2180: =R[-9]C -> 90 | G2180: 2 | H2180: 10000 | I2180: 110003 | J2180: 2 | K2180: =R[-1]C -> [{7,3},{8,3},{9,3},{10,3},{11,3},{12,3},{17,10},{18,8},{19,1},{23,4},{24,10}] | L2180: =R[-1]C -> [{7,27},{8,55},{9,27},{10,55},{11,27},{12,55},{17,18},{18,110},{19,3},{23,37},{24,37}] | M2180: =R[-1]C -> [{0,1,[1,30]},{1,2,[11,40]},{2,5,[21,50]},{5,10,[31,60]},{10,20,[41,60]},{30,20,[51,70]},{50,10,[61,80]},{70,5,[71,80]},{100,2,[81,90]},{150,1,[91,100]}]
A2181: 2133 | B2181: 4 | C2181: 27 | D2181: 0 | E2181: =R[-9]C -> 1 | F2181: =R[-9]C -> 10 | G2181: 3 | H2181: 15000 | I2181: 110003 | J2181: 3 | K2181: =R[-1]C -> [{7,3},{8,3},{9,3},{10,3},{11,3},{12,3},{17,10},{18,8},{19,1},{23,4},{24,10}] | L2181: =R[-1]C -> [{7,27},{8,55},{9,27},{10,55},{11,27},{12,55},{17,18},{18,110},{19,3},{23,37},{24,37}] | M2181: =R[-1]C -> [{0,1,[1,30]},{1,2,[11,40]},{2,5,[21,50]},{5,10,[31,60]},{10,20,[41,60]},{30,20,[51,70]},{50,10,[61,80]},{70,5,[71,80]},{100,2,[81,90]},{150,1,[91,100]}]
A2182: 2134 | B2182: 4 | C2182: 27 | D2182: 0 | E2182: =R[-9]C -> 11 | F2182: =R[-9]C -> 20 | G2182: 3 | H2182: 15000 | I2182: 110003 | J2182: 3 | K2182: =R[-1]C -> [{7,3},{8,3},{9,3},{10,3},{11,3},{12,3},{17,10},{18,8},{19,1},{23,4},{24,10}] | L2182: =R[-1]C -> [{7,27},{8,55},{9,27},{10,55},{11,27},{12,55},{17,18},{18,110},{19,3},{23,37},{24,37}] | M2182: =R[-1]C -> [{0,1,[1,30]},{1,2,[11,40]},{2,5,[21,50]},{5,10,[31,60]},{10,20,[41,60]},{30,20,[51,70]},{50,10,[61,80]},{70,5,[71,80]},{100,2,[81,90]},{150,1,[91,100]}]
A2183: 2135 | B2183: 4 | C2183: 27 | D2183: 0 | E2183: =R[-9]C -> 21 | F2183: =R[-9]C -> 30 | G2183: 3 | H2183: 15000 | I2183: 110003 | J2183: 3 | K2183: =R[-1]C -> [{7,3},{8,3},{9,3},{10,3},{11,3},{12,3},{17,10},{18,8},{19,1},{23,4},{24,10}] | L2183: =R[-1]C -> [{7,27},{8,55},{9,27},{10,55},{11,27},{12,55},{17,18},{18,110},{19,3},{23,37},{24,37}] | M2183: =R[-1]C -> [{0,1,[1,30]},{1,2,[11,40]},{2,5,[21,50]},{5,10,[31,60]},{10,20,[41,60]},{30,20,[51,70]},{50,10,[61,80]},{70,5,[71,80]},{100,2,[81,90]},{150,1,[91,100]}]
A2184: 2136 | B2184: 4 | C2184: 27 | D2184: 0 | E2184: =R[-9]C -> 31 | F2184: =R[-9]C -> 40 | G2184: 3 | H2184: 15000 | I2184: 110003 | J2184: 3 | K2184: =R[-1]C -> [{7,3},{8,3},{9,3},{10,3},{11,3},{12,3},{17,10},{18,8},{19,1},{23,4},{24,10}] | L2184: =R[-1]C -> [{7,27},{8,55},{9,27},{10,55},{11,27},{12,55},{17,18},{18,110},{19,3},{23,37},{24,37}] | M2184: =R[-1]C -> [{0,1,[1,30]},{1,2,[11,40]},{2,5,[21,50]},{5,10,[31,60]},{10,20,[41,60]},{30,20,[51,70]},{50,10,[61,80]},{70,5,[71,80]},{100,2,[81,90]},{150,1,[91,100]}]
A2185: 2137 | B2185: 4 | C2185: 27 | D2185: 0 | E2185: =R[-9]C -> 41 | F2185: =R[-9]C -> 50 | G2185: 3 | H2185: 15000 | I2185: 110003 | J2185: 3 | K2185: =R[-1]C -> [{7,3},{8,3},{9,3},{10,3},{11,3},{12,3},{17,10},{18,8},{19,1},{23,4},{24,10}] | L2185: =R[-1]C -> [{7,27},{8,55},{9,27},{10,55},{11,27},{12,55},{17,18},{18,110},{19,3},{23,37},{24,37}] | M2185: =R[-1]C -> [{0,1,[1,30]},{1,2,[11,40]},{2,5,[21,50]},{5,10,[31,60]},{10,20,[41,60]},{30,20,[51,70]},{50,10,[61,80]},{70,5,[71,80]},{100,2,[81,90]},{150,1,[91,100]}]
A2186: 2138 | B2186: 4 | C2186: 27 | D2186: 0 | E2186: =R[-9]C -> 51 | F2186: =R[-9]C -> 60 | G2186: 3 | H2186: 15000 | I2186: 110003 | J2186: 3 | K2186: =R[-1]C -> [{7,3},{8,3},{9,3},{10,3},{11,3},{12,3},{17,10},{18,8},{19,1},{23,4},{24,10}] | L2186: =R[-1]C -> [{7,27},{8,55},{9,27},{10,55},{11,27},{12,55},{17,18},{18,110},{19,3},{23,37},{24,37}] | M2186: =R[-1]C -> [{0,1,[1,30]},{1,2,[11,40]},{2,5,[21,50]},{5,10,[31,60]},{10,20,[41,60]},{30,20,[51,70]},{50,10,[61,80]},{70,5,[71,80]},{100,2,[81,90]},{150,1,[91,100]}]
A2187: 2139 | B2187: 4 | C2187: 27 | D2187: 0 | E2187: =R[-9]C -> 61 | F2187: =R[-9]C -> 70 | G2187: 3 | H2187: 15000 | I2187: 110003 | J2187: 3 | K2187: =R[-1]C -> [{7,3},{8,3},{9,3},{10,3},{11,3},{12,3},{17,10},{18,8},{19,1},{23,4},{24,10}] | L2187: =R[-1]C -> [{7,27},{8,55},{9,27},{10,55},{11,27},{12,55},{17,18},{18,110},{19,3},{23,37},{24,37}] | M2187: =R[-1]C -> [{0,1,[1,30]},{1,2,[11,40]},{2,5,[21,50]},{5,10,[31,60]},{10,20,[41,60]},{30,20,[51,70]},{50,10,[61,80]},{70,5,[71,80]},{100,2,[81,90]},{150,1,[91,100]}]
A2188: 2140 | B2188: 4 | C2188: 27 | D2188: 0 | E2188: =R[-9]C -> 71 | F2188: =R[-9]C -> 80 | G2188: 3 | H2188: 15000 | I2188: 110003 | J2188: 3 | K2188: =R[-1]C -> [{7,3},{8,3},{9,3},{10,3},{11,3},{12,3},{17,10},{18,8},{19,1},{23,4},{24,10}] | L2188: =R[-1]C -> [{7,27},{8,55},{9,27},{10,55},{11,27},{12,55},{17,18},{18,110},{19,3},{23,37},{24,37}] | M2188: =R[-1]C -> [{0,1,[1,30]},{1,2,[11,40]},{2,5,[21,50]},{5,10,[31,60]},{10,20,[41,60]},{30,20,[51,70]},{50,10,[61,80]},{70,5,[71,80]},{100,2,[81,90]},{150,1,[91,100]}]
A2189: 2141 | B2189: 4 | C2189: 27 | D2189: 0 | E2189: =R[-9]C -> 81 | F2189: =R[-9]C -> 90 | G2189: 3 | H2189: 15000 | I2189: 110003 | J2189: 3 | K2189: =R[-1]C -> [{7,3},{8,3},{9,3},{10,3},{11,3},{12,3},{17,10},{18,8},{19,1},{23,4},{24,10}] | L2189: =R[-1]C -> [{7,27},{8,55},{9,27},{10,55},{11,27},{12,55},{17,18},{18,110},{19,3},{23,37},{24,37}] | M2189: =R[-1]C -> [{0,1,[1,30]},{1,2,[11,40]},{2,5,[21,50]},{5,10,[31,60]},{10,20,[41,60]},{30,20,[51,70]},{50,10,[61,80]},{70,5,[71,80]},{100,2,[81,90]},{150,1,[91,100]}]
A2190: 2142 | B2190: 5 | C2190: 27 | D2190: 0 | E2190: =R[-9]C -> 1 | F2190: =R[-9]C -> 10 | G2190: 4 | H2190: 20000 | I2190: 110003 | J2190: 4 | K2190: =R[-1]C -> [{7,3},{8,3},{9,3},{10,3},{11,3},{12,3},{17,10},{18,8},{19,1},{23,4},{24,10}] | L2190: =R[-1]C -> [{7,27},{8,55},{9,27},{10,55},{11,27},{12,55},{17,18},{18,110},{19,3},{23,37},{24,37}] | M2190: =R[-1]C -> [{0,1,[1,30]},{1,2,[11,40]},{2,5,[21,50]},{5,10,[31,60]},{10,20,[41,60]},{30,20,[51,70]},{50,10,[61,80]},{70,5,[71,80]},{100,2,[81,90]},{150,1,[91,100]}]
A2191: 2143 | B2191: 5 | C2191: 27 | D2191: 0 | E2191: =R[-9]C -> 11 | F2191: =R[-9]C -> 20 | G2191: 4 | H2191: 20000 | I2191: 110003 | J2191: 4 | K2191: =R[-1]C -> [{7,3},{8,3},{9,3},{10,3},{11,3},{12,3},{17,10},{18,8},{19,1},{23,4},{24,10}] | L2191: =R[-1]C -> [{7,27},{8,55},{9,27},{10,55},{11,27},{12,55},{17,18},{18,110},{19,3},{23,37},{24,37}] | M2191: =R[-1]C -> [{0,1,[1,30]},{1,2,[11,40]},{2,5,[21,50]},{5,10,[31,60]},{10,20,[41,60]},{30,20,[51,70]},{50,10,[61,80]},{70,5,[71,80]},{100,2,[81,90]},{150,1,[91,100]}]
A2192: 2144 | B2192: 5 | C2192: 27 | D2192: 0 | E2192: =R[-9]C -> 21 | F2192: =R[-9]C -> 30 | G2192: 4 | H2192: 20000 | I2192: 110003 | J2192: 4 | K2192: =R[-1]C -> [{7,3},{8,3},{9,3},{10,3},{11,3},{12,3},{17,10},{18,8},{19,1},{23,4},{24,10}] | L2192: =R[-1]C -> [{7,27},{8,55},{9,27},{10,55},{11,27},{12,55},{17,18},{18,110},{19,3},{23,37},{24,37}] | M2192: =R[-1]C -> [{0,1,[1,30]},{1,2,[11,40]},{2,5,[21,50]},{5,10,[31,60]},{10,20,[41,60]},{30,20,[51,70]},{50,10,[61,80]},{70,5,[71,80]},{100,2,[81,90]},{150,1,[91,100]}]
A2193: 2145 | B2193: 5 | C2193: 27 | D2193: 0 | E2193: =R[-9]C -> 31 | F2193: =R[-9]C -> 40 | G2193: 4 | H2193: 20000 | I2193: 110003 | J2193: 4 | K2193: =R[-1]C -> [{7,3},{8,3},{9,3},{10,3},{11,3},{12,3},{17,10},{18,8},{19,1},{23,4},{24,10}] | L2193: =R[-1]C -> [{7,27},{8,55},{9,27},{10,55},{11,27},{12,55},{17,18},{18,110},{19,3},{23,37},{24,37}] | M2193: =R[-1]C -> [{0,1,[1,30]},{1,2,[11,40]},{2,5,[21,50]},{5,10,[31,60]},{10,20,[41,60]},{30,20,[51,70]},{50,10,[61,80]},{70,5,[71,80]},{100,2,[81,90]},{150,1,[91,100]}]
A2194: 2146 | B2194: 5 | C2194: 27 | D2194: 0 | E2194: =R[-9]C -> 41 | F2194: =R[-9]C -> 50 | G2194: 4 | H2194: 20000 | I2194: 110003 | J2194: 4 | K2194: =R[-1]C -> [{7,3},{8,3},{9,3},{10,3},{11,3},{12,3},{17,10},{18,8},{19,1},{23,4},{24,10}] | L2194: =R[-1]C -> [{7,27},{8,55},{9,27},{10,55},{11,27},{12,55},{17,18},{18,110},{19,3},{23,37},{24,37}] | M2194: =R[-1]C -> [{0,1,[1,30]},{1,2,[11,40]},{2,5,[21,50]},{5,10,[31,60]},{10,20,[41,60]},{30,20,[51,70]},{50,10,[61,80]},{70,5,[71,80]},{100,2,[81,90]},{150,1,[91,100]}]
A2195: 2147 | B2195: 5 | C2195: 27 | D2195: 0 | E2195: =R[-9]C -> 51 | F2195: =R[-9]C -> 60 | G2195: 4 | H2195: 20000 | I2195: 110003 | J2195: 4 | K2195: =R[-1]C -> [{7,3},{8,3},{9,3},{10,3},{11,3},{12,3},{17,10},{18,8},{19,1},{23,4},{24,10}] | L2195: =R[-1]C -> [{7,27},{8,55},{9,27},{10,55},{11,27},{12,55},{17,18},{18,110},{19,3},{23,37},{24,37}] | M2195: =R[-1]C -> [{0,1,[1,30]},{1,2,[11,40]},{2,5,[21,50]},{5,10,[31,60]},{10,20,[41,60]},{30,20,[51,70]},{50,10,[61,80]},{70,5,[71,80]},{100,2,[81,90]},{150,1,[91,100]}]
A2196: 2148 | B2196: 5 | C2196: 27 | D2196: 0 | E2196: =R[-9]C -> 61 | F2196: =R[-9]C -> 70 | G2196: 4 | H2196: 20000 | I2196: 110003 | J2196: 4 | K2196: =R[-1]C -> [{7,3},{8,3},{9,3},{10,3},{11,3},{12,3},{17,10},{18,8},{19,1},{23,4},{24,10}] | L2196: =R[-1]C -> [{7,27},{8,55},{9,27},{10,55},{11,27},{12,55},{17,18},{18,110},{19,3},{23,37},{24,37}] | M2196: =R[-1]C -> [{0,1,[1,30]},{1,2,[11,40]},{2,5,[21,50]},{5,10,[31,60]},{10,20,[41,60]},{30,20,[51,70]},{50,10,[61,80]},{70,5,[71,80]},{100,2,[81,90]},{150,1,[91,100]}]
A2197: 2149 | B2197: 5 | C2197: 27 | D2197: 0 | E2197: =R[-9]C -> 71 | F2197: =R[-9]C -> 80 | G2197: 4 | H2197: 20000 | I2197: 110003 | J2197: 4 | K2197: =R[-1]C -> [{7,3},{8,3},{9,3},{10,3},{11,3},{12,3},{17,10},{18,8},{19,1},{23,4},{24,10}] | L2197: =R[-1]C -> [{7,27},{8,55},{9,27},{10,55},{11,27},{12,55},{17,18},{18,110},{19,3},{23,37},{24,37}] | M2197: =R[-1]C -> [{0,1,[1,30]},{1,2,[11,40]},{2,5,[21,50]},{5,10,[31,60]},{10,20,[41,60]},{30,20,[51,70]},{50,10,[61,80]},{70,5,[71,80]},{100,2,[81,90]},{150,1,[91,100]}]
A2198: 2150 | B2198: 5 | C2198: 27 | D2198: 0 | E2198: =R[-9]C -> 81 | F2198: =R[-9]C -> 90 | G2198: 4 | H2198: 20000 | I2198: 110003 | J2198: 4 | K2198: =R[-1]C -> [{7,3},{8,3},{9,3},{10,3},{11,3},{12,3},{17,10},{18,8},{19,1},{23,4},{24,10}] | L2198: =R[-1]C -> [{7,27},{8,55},{9,27},{10,55},{11,27},{12,55},{17,18},{18,110},{19,3},{23,37},{24,37}] | M2198: =R[-1]C -> [{0,1,[1,30]},{1,2,[11,40]},{2,5,[21,50]},{5,10,[31,60]},{10,20,[41,60]},{30,20,[51,70]},{50,10,[61,80]},{70,5,[71,80]},{100,2,[81,90]},{150,1,[91,100]}]
A2199: 2151 | B2199: 6 | C2199: 27 | D2199: 0 | E2199: =R[-9]C -> 1 | F2199: =R[-9]C -> 10 | G2199: 5 | H2199: 20000 | I2199: 110003 | J2199: 5 | K2199: =R[-1]C -> [{7,3},{8,3},{9,3},{10,3},{11,3},{12,3},{17,10},{18,8},{19,1},{23,4},{24,10}] | L2199: =R[-1]C -> [{7,27},{8,55},{9,27},{10,55},{11,27},{12,55},{17,18},{18,110},{19,3},{23,37},{24,37}] | M2199: =R[-1]C -> [{0,1,[1,30]},{1,2,[11,40]},{2,5,[21,50]},{5,10,[31,60]},{10,20,[41,60]},{30,20,[51,70]},{50,10,[61,80]},{70,5,[71,80]},{100,2,[81,90]},{150,1,[91,100]}]
A2200: 2152 | B2200: 6 | C2200: 27 | D2200: 0 | E2200: =R[-9]C -> 11 | F2200: =R[-9]C -> 20 | G2200: 5 | H2200: 20000 | I2200: 110003 | J2200: 5 | K2200: =R[-1]C -> [{7,3},{8,3},{9,3},{10,3},{11,3},{12,3},{17,10},{18,8},{19,1},{23,4},{24,10}] | L2200: =R[-1]C -> [{7,27},{8,55},{9,27},{10,55},{11,27},{12,55},{17,18},{18,110},{19,3},{23,37},{24,37}] | M2200: =R[-1]C -> [{0,1,[1,30]},{1,2,[11,40]},{2,5,[21,50]},{5,10,[31,60]},{10,20,[41,60]},{30,20,[51,70]},{50,10,[61,80]},{70,5,[71,80]},{100,2,[81,90]},{150,1,[91,100]}]
A2201: 2153 | B2201: 6 | C2201: 27 | D2201: 0 | E2201: =R[-9]C -> 21 | F2201: =R[-9]C -> 30 | G2201: 5 | H2201: 20000 | I2201: 110003 | J2201: 5 | K2201: =R[-1]C -> [{7,3},{8,3},{9,3},{10,3},{11,3},{12,3},{17,10},{18,8},{19,1},{23,4},{24,10}] | L2201: =R[-1]C -> [{7,27},{8,55},{9,27},{10,55},{11,27},{12,55},{17,18},{18,110},{19,3},{23,37},{24,37}] | M2201: =R[-1]C -> [{0,1,[1,30]},{1,2,[11,40]},{2,5,[21,50]},{5,10,[31,60]},{10,20,[41,60]},{30,20,[51,70]},{50,10,[61,80]},{70,5,[71,80]},{100,2,[81,90]},{150,1,[91,100]}]
A2202: 2154 | B2202: 6 | C2202: 27 | D2202: 0 | E2202: =R[-9]C -> 31 | F2202: =R[-9]C -> 40 | G2202: 5 | H2202: 20000 | I2202: 110003 | J2202: 5 | K2202: =R[-1]C -> [{7,3},{8,3},{9,3},{10,3},{11,3},{12,3},{17,10},{18,8},{19,1},{23,4},{24,10}] | L2202: =R[-1]C -> [{7,27},{8,55},{9,27},{10,55},{11,27},{12,55},{17,18},{18,110},{19,3},{23,37},{24,37}] | M2202: =R[-1]C -> [{0,1,[1,30]},{1,2,[11,40]},{2,5,[21,50]},{5,10,[31,60]},{10,20,[41,60]},{30,20,[51,70]},{50,10,[61,80]},{70,5,[71,80]},{100,2,[81,90]},{150,1,[91,100]}]
A2203: 2155 | B2203: 6 | C2203: 27 | D2203: 0 | E2203: =R[-9]C -> 41 | F2203: =R[-9]C -> 50 | G2203: 5 | H2203: 20000 | I2203: 110003 | J2203: 5 | K2203: =R[-1]C -> [{7,3},{8,3},{9,3},{10,3},{11,3},{12,3},{17,10},{18,8},{19,1},{23,4},{24,10}] | L2203: =R[-1]C -> [{7,27},{8,55},{9,27},{10,55},{11,27},{12,55},{17,18},{18,110},{19,3},{23,37},{24,37}] | M2203: =R[-1]C -> [{0,1,[1,30]},{1,2,[11,40]},{2,5,[21,50]},{5,10,[31,60]},{10,20,[41,60]},{30,20,[51,70]},{50,10,[61,80]},{70,5,[71,80]},{100,2,[81,90]},{150,1,[91,100]}]
A2204: 2156 | B2204: 6 | C2204: 27 | D2204: 0 | E2204: =R[-9]C -> 51 | F2204: =R[-9]C -> 60 | G2204: 5 | H2204: 20000 | I2204: 110003 | J2204: 5 | K2204: =R[-1]C -> [{7,3},{8,3},{9,3},{10,3},{11,3},{12,3},{17,10},{18,8},{19,1},{23,4},{24,10}] | L2204: =R[-1]C -> [{7,27},{8,55},{9,27},{10,55},{11,27},{12,55},{17,18},{18,110},{19,3},{23,37},{24,37}] | M2204: =R[-1]C -> [{0,1,[1,30]},{1,2,[11,40]},{2,5,[21,50]},{5,10,[31,60]},{10,20,[41,60]},{30,20,[51,70]},{50,10,[61,80]},{70,5,[71,80]},{100,2,[81,90]},{150,1,[91,100]}]
A2205: 2157 | B2205: 6 | C2205: 27 | D2205: 0 | E2205: =R[-9]C -> 61 | F2205: =R[-9]C -> 70 | G2205: 5 | H2205: 20000 | I2205: 110003 | J2205: 5 | K2205: =R[-1]C -> [{7,3},{8,3},{9,3},{10,3},{11,3},{12,3},{17,10},{18,8},{19,1},{23,4},{24,10}] | L2205: =R[-1]C -> [{7,27},{8,55},{9,27},{10,55},{11,27},{12,55},{17,18},{18,110},{19,3},{23,37},{24,37}] | M2205: =R[-1]C -> [{0,1,[1,30]},{1,2,[11,40]},{2,5,[21,50]},{5,10,[31,60]},{10,20,[41,60]},{30,20,[51,70]},{50,10,[61,80]},{70,5,[71,80]},{100,2,[81,90]},{150,1,[91,100]}]
A2206: 2158 | B2206: 6 | C2206: 27 | D2206: 0 | E2206: =R[-9]C -> 71 | F2206: =R[-9]C -> 80 | G2206: 5 | H2206: 20000 | I2206: 110003 | J2206: 5 | K2206: =R[-1]C -> [{7,3},{8,3},{9,3},{10,3},{11,3},{12,3},{17,10},{18,8},{19,1},{23,4},{24,10}] | L2206: =R[-1]C -> [{7,27},{8,55},{9,27},{10,55},{11,27},{12,55},{17,18},{18,110},{19,3},{23,37},{24,37}] | M2206: =R[-1]C -> [{0,1,[1,30]},{1,2,[11,40]},{2,5,[21,50]},{5,10,[31,60]},{10,20,[41,60]},{30,20,[51,70]},{50,10,[61,80]},{70,5,[71,80]},{100,2,[81,90]},{150,1,[91,100]}]
A2207: 2159 | B2207: 6 | C2207: 27 | D2207: 0 | E2207: =R[-9]C -> 81 | F2207: =R[-9]C -> 90 | G2207: 5 | H2207: 20000 | I2207: 110003 | J2207: 5 | K2207: =R[-1]C -> [{7,3},{8,3},{9,3},{10,3},{11,3},{12,3},{17,10},{18,8},{19,1},{23,4},{24,10}] | L2207: =R[-1]C -> [{7,27},{8,55},{9,27},{10,55},{11,27},{12,55},{17,18},{18,110},{19,3},{23,37},{24,37}] | M2207: =R[-1]C -> [{0,1,[1,30]},{1,2,[11,40]},{2,5,[21,50]},{5,10,[31,60]},{10,20,[41,60]},{30,20,[51,70]},{50,10,[61,80]},{70,5,[71,80]},{100,2,[81,90]},{150,1,[91,100]}]
A2208: 2160 | B2208: 2 | C2208: 1 | D2208: 1000 | E2208: 91 | F2208: 100 | G2208: 1 | H2208: 5000 | I2208: 110003 | J2208: 1 | K2208: [{7,6},{8,4},{9,0},{10,0},{11,0},{12,0},{17,10},{18,8},{19,1},{23,4},{24,10}] | L2208: [{7,27},{8,55},{9,27},{10,55},{11,27},{12,55},{17,18},{18,110},{19,3},{23,37},{24,37}] | M2208: [{0,1,[1,30]},{1,2,[11,40]},{2,5,[21,50]},{5,10,[31,60]},{10,20,[41,60]},{30,20,[51,70]},{50,10,[61,80]},{70,5,[71,80]},{100,2,[81,90]},{150,1,[91,100]}]
A2209: 2161 | B2209: 3 | C2209: 1 | D2209: 1000 | E2209: 91 | F2209: 100 | G2209: 2 | H2209: 10000 | I2209: 110003 | J2209: 2 | K2209: [{7,6},{8,4},{9,0},{10,0},{11,0},{12,0},{17,10},{18,8},{19,1},{23,4},{24,10}] | L2209: [{7,27},{8,55},{9,27},{10,55},{11,27},{12,55},{17,18},{18,110},{19,3},{23,37},{24,37}] | M2209: [{0,1,[1,30]},{1,2,[11,40]},{2,5,[21,50]},{5,10,[31,60]},{10,20,[41,60]},{30,20,[51,70]},{50,10,[61,80]},{70,5,[71,80]},{100,2,[81,90]},{150,1,[91,100]}]
A2210: 2162 | B2210: 4 | C2210: 1 | D2210: 1000 | E2210: 91 | F2210: 100 | G2210: 3 | H2210: 15000 | I2210: 110003 | J2210: 3 | K2210: [{7,6},{8,4},{9,0},{10,0},{11,0},{12,0},{17,10},{18,8},{19,1},{23,4},{24,10}] | L2210: [{7,27},{8,55},{9,27},{10,55},{11,27},{12,55},{17,18},{18,110},{19,3},{23,37},{24,37}] | M2210: [{0,1,[1,30]},{1,2,[11,40]},{2,5,[21,50]},{5,10,[31,60]},{10,20,[41,60]},{30,20,[51,70]},{50,10,[61,80]},{70,5,[71,80]},{100,2,[81,90]},{150,1,[91,100]}]
A2211: 2163 | B2211: 5 | C2211: 1 | D2211: 1000 | E2211: 91 | F2211: 100 | G2211: 4 | H2211: 20000 | I2211: 110003 | J2211: 4 | K2211: [{7,6},{8,4},{9,0},{10,0},{11,0},{12,0},{17,10},{18,8},{19,1},{23,4},{24,10}] | L2211: [{7,27},{8,55},{9,27},{10,55},{11,27},{12,55},{17,18},{18,110},{19,3},{23,37},{24,37}] | M2211: [{0,1,[1,30]},{1,2,[11,40]},{2,5,[21,50]},{5,10,[31,60]},{10,20,[41,60]},{30,20,[51,70]},{50,10,[61,80]},{70,5,[71,80]},{100,2,[81,90]},{150,1,[91,100]}]
A2212: 2164 | B2212: 6 | C2212: 1 | D2212: 1000 | E2212: 91 | F2212: 100 | G2212: 5 | H2212: 20000 | I2212: 110003 | J2212: 5 | K2212: [{7,6},{8,4},{9,0},{10,0},{11,0},{12,0},{17,10},{18,8},{19,1},{23,4},{24,10}] | L2212: [{7,27},{8,55},{9,27},{10,55},{11,27},{12,55},{17,18},{18,110},{19,3},{23,37},{24,37}] | M2212: [{0,1,[1,30]},{1,2,[11,40]},{2,5,[21,50]},{5,10,[31,60]},{10,20,[41,60]},{30,20,[51,70]},{50,10,[61,80]},{70,5,[71,80]},{100,2,[81,90]},{150,1,[91,100]}]
A2213: 2165 | B2213: 2 | C2213: 4 | D2213: 1000 | E2213: 91 | F2213: 100 | G2213: 1 | H2213: 5000 | I2213: 110003 | J2213: 1 | K2213: [{7,6},{8,4},{9,0},{10,0},{11,0},{12,0},{17,10},{18,8},{19,1},{23,4},{24,10}] | L2213: [{7,27},{8,55},{9,27},{10,55},{11,27},{12,55},{17,18},{18,110},{19,3},{23,37},{24,37}] | M2213: [{0,1,[1,30]},{1,2,[11,40]},{2,5,[21,50]},{5,10,[31,60]},{10,20,[41,60]},{30,20,[51,70]},{50,10,[61,80]},{70,5,[71,80]},{100,2,[81,90]},{150,1,[91,100]}]
A2214: 2166 | B2214: 3 | C2214: 4 | D2214: 1000 | E2214: 91 | F2214: 100 | G2214: 2 | H2214: 10000 | I2214: 110003 | J2214: 2 | K2214: [{7,6},{8,4},{9,0},{10,0},{11,0},{12,0},{17,10},{18,8},{19,1},{23,4},{24,10}] | L2214: [{7,27},{8,55},{9,27},{10,55},{11,27},{12,55},{17,18},{18,110},{19,3},{23,37},{24,37}] | M2214: [{0,1,[1,30]},{1,2,[11,40]},{2,5,[21,50]},{5,10,[31,60]},{10,20,[41,60]},{30,20,[51,70]},{50,10,[61,80]},{70,5,[71,80]},{100,2,[81,90]},{150,1,[91,100]}]
A2215: 2167 | B2215: 4 | C2215: 4 | D2215: 1000 | E2215: 91 | F2215: 100 | G2215: 3 | H2215: 15000 | I2215: 110003 | J2215: 3 | K2215: [{7,6},{8,4},{9,0},{10,0},{11,0},{12,0},{17,10},{18,8},{19,1},{23,4},{24,10}] | L2215: [{7,27},{8,55},{9,27},{10,55},{11,27},{12,55},{17,18},{18,110},{19,3},{23,37},{24,37}] | M2215: [{0,1,[1,30]},{1,2,[11,40]},{2,5,[21,50]},{5,10,[31,60]},{10,20,[41,60]},{30,20,[51,70]},{50,10,[61,80]},{70,5,[71,80]},{100,2,[81,90]},{150,1,[91,100]}]
A2216: 2168 | B2216: 5 | C2216: 4 | D2216: 1000 | E2216: 91 | F2216: 100 | G2216: 4 | H2216: 20000 | I2216: 110003 | J2216: 4 | K2216: [{7,6},{8,4},{9,0},{10,0},{11,0},{12,0},{17,10},{18,8},{19,1},{23,4},{24,10}] | L2216: [{7,27},{8,55},{9,27},{10,55},{11,27},{12,55},{17,18},{18,110},{19,3},{23,37},{24,37}] | M2216: [{0,1,[1,30]},{1,2,[11,40]},{2,5,[21,50]},{5,10,[31,60]},{10,20,[41,60]},{30,20,[51,70]},{50,10,[61,80]},{70,5,[71,80]},{100,2,[81,90]},{150,1,[91,100]}]
A2217: 2169 | B2217: 6 | C2217: 4 | D2217: 1000 | E2217: 91 | F2217: 100 | G2217: 5 | H2217: 20000 | I2217: 110003 | J2217: 5 | K2217: [{7,6},{8,4},{9,0},{10,0},{11,0},{12,0},{17,10},{18,8},{19,1},{23,4},{24,10}] | L2217: [{7,27},{8,55},{9,27},{10,55},{11,27},{12,55},{17,18},{18,110},{19,3},{23,37},{24,37}] | M2217: [{0,1,[1,30]},{1,2,[11,40]},{2,5,[21,50]},{5,10,[31,60]},{10,20,[41,60]},{30,20,[51,70]},{50,10,[61,80]},{70,5,[71,80]},{100,2,[81,90]},{150,1,[91,100]}]
A2218: 2170 | B2218: 2 | C2218: 6 | D2218: 1000 | E2218: 91 | F2218: 100 | G2218: 1 | H2218: 5000 | I2218: 110003 | J2218: 1 | K2218: [{7,6},{8,4},{9,0},{10,0},{11,0},{12,0},{17,10},{18,8},{19,1},{23,4},{24,10}] | L2218: [{7,27},{8,55},{9,27},{10,55},{11,27},{12,55},{17,18},{18,110},{19,3},{23,37},{24,37}] | M2218: [{0,1,[1,30]},{1,2,[11,40]},{2,5,[21,50]},{5,10,[31,60]},{10,20,[41,60]},{30,20,[51,70]},{50,10,[61,80]},{70,5,[71,80]},{100,2,[81,90]},{150,1,[91,100]}]
A2219: 2171 | B2219: 3 | C2219: 6 | D2219: 1000 | E2219: 91 | F2219: 100 | G2219: 2 | H2219: 10000 | I2219: 110003 | J2219: 2 | K2219: [{7,6},{8,4},{9,0},{10,0},{11,0},{12,0},{17,10},{18,8},{19,1},{23,4},{24,10}] | L2219: [{7,27},{8,55},{9,27},{10,55},{11,27},{12,55},{17,18},{18,110},{19,3},{23,37},{24,37}] | M2219: [{0,1,[1,30]},{1,2,[11,40]},{2,5,[21,50]},{5,10,[31,60]},{10,20,[41,60]},{30,20,[51,70]},{50,10,[61,80]},{70,5,[71,80]},{100,2,[81,90]},{150,1,[91,100]}]
A2220: 2172 | B2220: 4 | C2220: 6 | D2220: 1000 | E2220: 91 | F2220: 100 | G2220: 3 | H2220: 15000 | I2220: 110003 | J2220: 3 | K2220: [{7,6},{8,4},{9,0},{10,0},{11,0},{12,0},{17,10},{18,8},{19,1},{23,4},{24,10}] | L2220: [{7,27},{8,55},{9,27},{10,55},{11,27},{12,55},{17,18},{18,110},{19,3},{23,37},{24,37}] | M2220: [{0,1,[1,30]},{1,2,[11,40]},{2,5,[21,50]},{5,10,[31,60]},{10,20,[41,60]},{30,20,[51,70]},{50,10,[61,80]},{70,5,[71,80]},{100,2,[81,90]},{150,1,[91,100]}]
A2221: 2173 | B2221: 5 | C2221: 6 | D2221: 1000 | E2221: 91 | F2221: 100 | G2221: 4 | H2221: 20000 | I2221: 110003 | J2221: 4 | K2221: [{7,6},{8,4},{9,0},{10,0},{11,0},{12,0},{17,10},{18,8},{19,1},{23,4},{24,10}] | L2221: [{7,27},{8,55},{9,27},{10,55},{11,27},{12,55},{17,18},{18,110},{19,3},{23,37},{24,37}] | M2221: [{0,1,[1,30]},{1,2,[11,40]},{2,5,[21,50]},{5,10,[31,60]},{10,20,[41,60]},{30,20,[51,70]},{50,10,[61,80]},{70,5,[71,80]},{100,2,[81,90]},{150,1,[91,100]}]
A2222: 2174 | B2222: 6 | C2222: 6 | D2222: 1000 | E2222: 91 | F2222: 100 | G2222: 5 | H2222: 20000 | I2222: 110003 | J2222: 5 | K2222: [{7,6},{8,4},{9,0},{10,0},{11,0},{12,0},{17,10},{18,8},{19,1},{23,4},{24,10}] | L2222: [{7,27},{8,55},{9,27},{10,55},{11,27},{12,55},{17,18},{18,110},{19,3},{23,37},{24,37}] | M2222: [{0,1,[1,30]},{1,2,[11,40]},{2,5,[21,50]},{5,10,[31,60]},{10,20,[41,60]},{30,20,[51,70]},{50,10,[61,80]},{70,5,[71,80]},{100,2,[81,90]},{150,1,[91,100]}]
A2223: 2175 | B2223: 2 | C2223: 7 | D2223: 1000 | E2223: 91 | F2223: 100 | G2223: 1 | H2223: 5000 | I2223: 110003 | J2223: 1 | K2223: [{7,6},{8,4},{9,0},{10,0},{11,0},{12,0},{17,10},{18,8},{19,1},{23,4},{24,10}] | L2223: [{7,27},{8,55},{9,27},{10,55},{11,27},{12,55},{17,18},{18,110},{19,3},{23,37},{24,37}] | M2223: [{0,1,[1,30]},{1,2,[11,40]},{2,5,[21,50]},{5,10,[31,60]},{10,20,[41,60]},{30,20,[51,70]},{50,10,[61,80]},{70,5,[71,80]},{100,2,[81,90]},{150,1,[91,100]}]
A2224: 2176 | B2224: 3 | C2224: 7 | D2224: 1000 | E2224: 91 | F2224: 100 | G2224: 2 | H2224: 10000 | I2224: 110003 | J2224: 2 | K2224: [{7,6},{8,4},{9,0},{10,0},{11,0},{12,0},{17,10},{18,8},{19,1},{23,4},{24,10}] | L2224: [{7,27},{8,55},{9,27},{10,55},{11,27},{12,55},{17,18},{18,110},{19,3},{23,37},{24,37}] | M2224: [{0,1,[1,30]},{1,2,[11,40]},{2,5,[21,50]},{5,10,[31,60]},{10,20,[41,60]},{30,20,[51,70]},{50,10,[61,80]},{70,5,[71,80]},{100,2,[81,90]},{150,1,[91,100]}]
A2225: 2177 | B2225: 4 | C2225: 7 | D2225: 1000 | E2225: 91 | F2225: 100 | G2225: 3 | H2225: 15000 | I2225: 110003 | J2225: 3 | K2225: [{7,6},{8,4},{9,0},{10,0},{11,0},{12,0},{17,10},{18,8},{19,1},{23,4},{24,10}] | L2225: [{7,27},{8,55},{9,27},{10,55},{11,27},{12,55},{17,18},{18,110},{19,3},{23,37},{24,37}] | M2225: [{0,1,[1,30]},{1,2,[11,40]},{2,5,[21,50]},{5,10,[31,60]},{10,20,[41,60]},{30,20,[51,70]},{50,10,[61,80]},{70,5,[71,80]},{100,2,[81,90]},{150,1,[91,100]}]
A2226: 2178 | B2226: 5 | C2226: 7 | D2226: 1000 | E2226: 91 | F2226: 100 | G2226: 4 | H2226: 20000 | I2226: 110003 | J2226: 4 | K2226: [{7,6},{8,4},{9,0},{10,0},{11,0},{12,0},{17,10},{18,8},{19,1},{23,4},{24,10}] | L2226: [{7,27},{8,55},{9,27},{10,55},{11,27},{12,55},{17,18},{18,110},{19,3},{23,37},{24,37}] | M2226: [{0,1,[1,30]},{1,2,[11,40]},{2,5,[21,50]},{5,10,[31,60]},{10,20,[41,60]},{30,20,[51,70]},{50,10,[61,80]},{70,5,[71,80]},{100,2,[81,90]},{150,1,[91,100]}]
A2227: 2179 | B2227: 6 | C2227: 7 | D2227: 1000 | E2227: 91 | F2227: 100 | G2227: 5 | H2227: 20000 | I2227: 110003 | J2227: 5 | K2227: [{7,6},{8,4},{9,0},{10,0},{11,0},{12,0},{17,10},{18,8},{19,1},{23,4},{24,10}] | L2227: [{7,27},{8,55},{9,27},{10,55},{11,27},{12,55},{17,18},{18,110},{19,3},{23,37},{24,37}] | M2227: [{0,1,[1,30]},{1,2,[11,40]},{2,5,[21,50]},{5,10,[31,60]},{10,20,[41,60]},{30,20,[51,70]},{50,10,[61,80]},{70,5,[71,80]},{100,2,[81,90]},{150,1,[91,100]}]
A2228: 2180 | B2228: 2 | C2228: 1 | D2228: 2000 | E2228: 91 | F2228: 100 | G2228: 1 | H2228: 5000 | I2228: 110003 | J2228: 1 | K2228: [{7,0},{8,0},{9,6},{10,4},{11,0},{12,0},{17,10},{18,8},{19,1},{23,4},{24,10}] | L2228: [{7,27},{8,55},{9,27},{10,55},{11,27},{12,55},{17,18},{18,110},{19,3},{23,37},{24,37}] | M2228: [{0,1,[1,30]},{1,2,[11,40]},{2,5,[21,50]},{5,10,[31,60]},{10,20,[41,60]},{30,20,[51,70]},{50,10,[61,80]},{70,5,[71,80]},{100,2,[81,90]},{150,1,[91,100]}]
A2229: 2181 | B2229: 3 | C2229: 1 | D2229: 2000 | E2229: 91 | F2229: 100 | G2229: 2 | H2229: 10000 | I2229: 110003 | J2229: 2 | K2229: [{7,0},{8,0},{9,6},{10,4},{11,0},{12,0},{17,10},{18,8},{19,1},{23,4},{24,10}] | L2229: [{7,27},{8,55},{9,27},{10,55},{11,27},{12,55},{17,18},{18,110},{19,3},{23,37},{24,37}] | M2229: [{0,1,[1,30]},{1,2,[11,40]},{2,5,[21,50]},{5,10,[31,60]},{10,20,[41,60]},{30,20,[51,70]},{50,10,[61,80]},{70,5,[71,80]},{100,2,[81,90]},{150,1,[91,100]}]
A2230: 2182 | B2230: 4 | C2230: 1 | D2230: 2000 | E2230: 91 | F2230: 100 | G2230: 3 | H2230: 15000 | I2230: 110003 | J2230: 3 | K2230: [{7,0},{8,0},{9,6},{10,4},{11,0},{12,0},{17,10},{18,8},{19,1},{23,4},{24,10}] | L2230: [{7,27},{8,55},{9,27},{10,55},{11,27},{12,55},{17,18},{18,110},{19,3},{23,37},{24,37}] | M2230: [{0,1,[1,30]},{1,2,[11,40]},{2,5,[21,50]},{5,10,[31,60]},{10,20,[41,60]},{30,20,[51,70]},{50,10,[61,80]},{70,5,[71,80]},{100,2,[81,90]},{150,1,[91,100]}]
A2231: 2183 | B2231: 5 | C2231: 1 | D2231: 2000 | E2231: 91 | F2231: 100 | G2231: 4 | H2231: 20000 | I2231: 110003 | J2231: 4 | K2231: [{7,0},{8,0},{9,6},{10,4},{11,0},{12,0},{17,10},{18,8},{19,1},{23,4},{24,10}] | L2231: [{7,27},{8,55},{9,27},{10,55},{11,27},{12,55},{17,18},{18,110},{19,3},{23,37},{24,37}] | M2231: [{0,1,[1,30]},{1,2,[11,40]},{2,5,[21,50]},{5,10,[31,60]},{10,20,[41,60]},{30,20,[51,70]},{50,10,[61,80]},{70,5,[71,80]},{100,2,[81,90]},{150,1,[91,100]}]
A2232: 2184 | B2232: 6 | C2232: 1 | D2232: 2000 | E2232: 91 | F2232: 100 | G2232: 5 | H2232: 20000 | I2232: 110003 | J2232: 5 | K2232: [{7,0},{8,0},{9,6},{10,4},{11,0},{12,0},{17,10},{18,8},{19,1},{23,4},{24,10}] | L2232: [{7,27},{8,55},{9,27},{10,55},{11,27},{12,55},{17,18},{18,110},{19,3},{23,37},{24,37}] | M2232: [{0,1,[1,30]},{1,2,[11,40]},{2,5,[21,50]},{5,10,[31,60]},{10,20,[41,60]},{30,20,[51,70]},{50,10,[61,80]},{70,5,[71,80]},{100,2,[81,90]},{150,1,[91,100]}]
A2233: 2185 | B2233: 2 | C2233: 4 | D2233: 2000 | E2233: 91 | F2233: 100 | G2233: 1 | H2233: 5000 | I2233: 110003 | J2233: 1 | K2233: [{7,0},{8,0},{9,6},{10,4},{11,0},{12,0},{17,10},{18,8},{19,1},{23,4},{24,10}] | L2233: [{7,27},{8,55},{9,27},{10,55},{11,27},{12,55},{17,18},{18,110},{19,3},{23,37},{24,37}] | M2233: [{0,1,[1,30]},{1,2,[11,40]},{2,5,[21,50]},{5,10,[31,60]},{10,20,[41,60]},{30,20,[51,70]},{50,10,[61,80]},{70,5,[71,80]},{100,2,[81,90]},{150,1,[91,100]}]
A2234: 2186 | B2234: 3 | C2234: 4 | D2234: 2000 | E2234: 91 | F2234: 100 | G2234: 2 | H2234: 10000 | I2234: 110003 | J2234: 2 | K2234: [{7,0},{8,0},{9,6},{10,4},{11,0},{12,0},{17,10},{18,8},{19,1},{23,4},{24,10}] | L2234: [{7,27},{8,55},{9,27},{10,55},{11,27},{12,55},{17,18},{18,110},{19,3},{23,37},{24,37}] | M2234: [{0,1,[1,30]},{1,2,[11,40]},{2,5,[21,50]},{5,10,[31,60]},{10,20,[41,60]},{30,20,[51,70]},{50,10,[61,80]},{70,5,[71,80]},{100,2,[81,90]},{150,1,[91,100]}]
A2235: 2187 | B2235: 4 | C2235: 4 | D2235: 2000 | E2235: 91 | F2235: 100 | G2235: 3 | H2235: 15000 | I2235: 110003 | J2235: 3 | K2235: [{7,0},{8,0},{9,6},{10,4},{11,0},{12,0},{17,10},{18,8},{19,1},{23,4},{24,10}] | L2235: [{7,27},{8,55},{9,27},{10,55},{11,27},{12,55},{17,18},{18,110},{19,3},{23,37},{24,37}] | M2235: [{0,1,[1,30]},{1,2,[11,40]},{2,5,[21,50]},{5,10,[31,60]},{10,20,[41,60]},{30,20,[51,70]},{50,10,[61,80]},{70,5,[71,80]},{100,2,[81,90]},{150,1,[91,100]}]
A2236: 2188 | B2236: 5 | C2236: 4 | D2236: 2000 | E2236: 91 | F2236: 100 | G2236: 4 | H2236: 20000 | I2236: 110003 | J2236: 4 | K2236: [{7,0},{8,0},{9,6},{10,4},{11,0},{12,0},{17,10},{18,8},{19,1},{23,4},{24,10}] | L2236: [{7,27},{8,55},{9,27},{10,55},{11,27},{12,55},{17,18},{18,110},{19,3},{23,37},{24,37}] | M2236: [{0,1,[1,30]},{1,2,[11,40]},{2,5,[21,50]},{5,10,[31,60]},{10,20,[41,60]},{30,20,[51,70]},{50,10,[61,80]},{70,5,[71,80]},{100,2,[81,90]},{150,1,[91,100]}]
A2237: 2189 | B2237: 6 | C2237: 4 | D2237: 2000 | E2237: 91 | F2237: 100 | G2237: 5 | H2237: 20000 | I2237: 110003 | J2237: 5 | K2237: [{7,0},{8,0},{9,6},{10,4},{11,0},{12,0},{17,10},{18,8},{19,1},{23,4},{24,10}] | L2237: [{7,27},{8,55},{9,27},{10,55},{11,27},{12,55},{17,18},{18,110},{19,3},{23,37},{24,37}] | M2237: [{0,1,[1,30]},{1,2,[11,40]},{2,5,[21,50]},{5,10,[31,60]},{10,20,[41,60]},{30,20,[51,70]},{50,10,[61,80]},{70,5,[71,80]},{100,2,[81,90]},{150,1,[91,100]}]
A2238: 2190 | B2238: 2 | C2238: 6 | D2238: 2000 | E2238: 91 | F2238: 100 | G2238: 1 | H2238: 5000 | I2238: 110003 | J2238: 1 | K2238: [{7,0},{8,0},{9,6},{10,4},{11,0},{12,0},{17,10},{18,8},{19,1},{23,4},{24,10}] | L2238: [{7,27},{8,55},{9,27},{10,55},{11,27},{12,55},{17,18},{18,110},{19,3},{23,37},{24,37}] | M2238: [{0,1,[1,30]},{1,2,[11,40]},{2,5,[21,50]},{5,10,[31,60]},{10,20,[41,60]},{30,20,[51,70]},{50,10,[61,80]},{70,5,[71,80]},{100,2,[81,90]},{150,1,[91,100]}]
A2239: 2191 | B2239: 3 | C2239: 6 | D2239: 2000 | E2239: 91 | F2239: 100 | G2239: 2 | H2239: 10000 | I2239: 110003 | J2239: 2 | K2239: [{7,0},{8,0},{9,6},{10,4},{11,0},{12,0},{17,10},{18,8},{19,1},{23,4},{24,10}] | L2239: [{7,27},{8,55},{9,27},{10,55},{11,27},{12,55},{17,18},{18,110},{19,3},{23,37},{24,37}] | M2239: [{0,1,[1,30]},{1,2,[11,40]},{2,5,[21,50]},{5,10,[31,60]},{10,20,[41,60]},{30,20,[51,70]},{50,10,[61,80]},{70,5,[71,80]},{100,2,[81,90]},{150,1,[91,100]}]
A2240: 2192 | B2240: 4 | C2240: 6 | D2240: 2000 | E2240: 91 | F2240: 100 | G2240: 3 | H2240: 15000 | I2240: 110003 | J2240: 3 | K2240: [{7,0},{8,0},{9,6},{10,4},{11,0},{12,0},{17,10},{18,8},{19,1},{23,4},{24,10}] | L2240: [{7,27},{8,55},{9,27},{10,55},{11,27},{12,55},{17,18},{18,110},{19,3},{23,37},{24,37}] | M2240: [{0,1,[1,30]},{1,2,[11,40]},{2,5,[21,50]},{5,10,[31,60]},{10,20,[41,60]},{30,20,[51,70]},{50,10,[61,80]},{70,5,[71,80]},{100,2,[81,90]},{150,1,[91,100]}]
A2241: 2193 | B2241: 5 | C2241: 6 | D2241: 2000 | E2241: 91 | F2241: 100 | G2241: 4 | H2241: 20000 | I2241: 110003 | J2241: 4 | K2241: [{7,0},{8,0},{9,6},{10,4},{11,0},{12,0},{17,10},{18,8},{19,1},{23,4},{24,10}] | L2241: [{7,27},{8,55},{9,27},{10,55},{11,27},{12,55},{17,18},{18,110},{19,3},{23,37},{24,37}] | M2241: [{0,1,[1,30]},{1,2,[11,40]},{2,5,[21,50]},{5,10,[31,60]},{10,20,[41,60]},{30,20,[51,70]},{50,10,[61,80]},{70,5,[71,80]},{100,2,[81,90]},{150,1,[91,100]}]
A2242: 2194 | B2242: 6 | C2242: 6 | D2242: 2000 | E2242: 91 | F2242: 100 | G2242: 5 | H2242: 20000 | I2242: 110003 | J2242: 5 | K2242: [{7,0},{8,0},{9,6},{10,4},{11,0},{12,0},{17,10},{18,8},{19,1},{23,4},{24,10}] | L2242: [{7,27},{8,55},{9,27},{10,55},{11,27},{12,55},{17,18},{18,110},{19,3},{23,37},{24,37}] | M2242: [{0,1,[1,30]},{1,2,[11,40]},{2,5,[21,50]},{5,10,[31,60]},{10,20,[41,60]},{30,20,[51,70]},{50,10,[61,80]},{70,5,[71,80]},{100,2,[81,90]},{150,1,[91,100]}]
A2243: 2195 | B2243: 2 | C2243: 7 | D2243: 2000 | E2243: 91 | F2243: 100 | G2243: 1 | H2243: 5000 | I2243: 110003 | J2243: 1 | K2243: [{7,0},{8,0},{9,6},{10,4},{11,0},{12,0},{17,10},{18,8},{19,1},{23,4},{24,10}] | L2243: [{7,27},{8,55},{9,27},{10,55},{11,27},{12,55},{17,18},{18,110},{19,3},{23,37},{24,37}] | M2243: [{0,1,[1,30]},{1,2,[11,40]},{2,5,[21,50]},{5,10,[31,60]},{10,20,[41,60]},{30,20,[51,70]},{50,10,[61,80]},{70,5,[71,80]},{100,2,[81,90]},{150,1,[91,100]}]
A2244: 2196 | B2244: 3 | C2244: 7 | D2244: 2000 | E2244: 91 | F2244: 100 | G2244: 2 | H2244: 10000 | I2244: 110003 | J2244: 2 | K2244: [{7,0},{8,0},{9,6},{10,4},{11,0},{12,0},{17,10},{18,8},{19,1},{23,4},{24,10}] | L2244: [{7,27},{8,55},{9,27},{10,55},{11,27},{12,55},{17,18},{18,110},{19,3},{23,37},{24,37}] | M2244: [{0,1,[1,30]},{1,2,[11,40]},{2,5,[21,50]},{5,10,[31,60]},{10,20,[41,60]},{30,20,[51,70]},{50,10,[61,80]},{70,5,[71,80]},{100,2,[81,90]},{150,1,[91,100]}]
A2245: 2197 | B2245: 4 | C2245: 7 | D2245: 2000 | E2245: 91 | F2245: 100 | G2245: 3 | H2245: 15000 | I2245: 110003 | J2245: 3 | K2245: [{7,0},{8,0},{9,6},{10,4},{11,0},{12,0},{17,10},{18,8},{19,1},{23,4},{24,10}] | L2245: [{7,27},{8,55},{9,27},{10,55},{11,27},{12,55},{17,18},{18,110},{19,3},{23,37},{24,37}] | M2245: [{0,1,[1,30]},{1,2,[11,40]},{2,5,[21,50]},{5,10,[31,60]},{10,20,[41,60]},{30,20,[51,70]},{50,10,[61,80]},{70,5,[71,80]},{100,2,[81,90]},{150,1,[91,100]}]
A2246: 2198 | B2246: 5 | C2246: 7 | D2246: 2000 | E2246: 91 | F2246: 100 | G2246: 4 | H2246: 20000 | I2246: 110003 | J2246: 4 | K2246: [{7,0},{8,0},{9,6},{10,4},{11,0},{12,0},{17,10},{18,8},{19,1},{23,4},{24,10}] | L2246: [{7,27},{8,55},{9,27},{10,55},{11,27},{12,55},{17,18},{18,110},{19,3},{23,37},{24,37}] | M2246: [{0,1,[1,30]},{1,2,[11,40]},{2,5,[21,50]},{5,10,[31,60]},{10,20,[41,60]},{30,20,[51,70]},{50,10,[61,80]},{70,5,[71,80]},{100,2,[81,90]},{150,1,[91,100]}]
A2247: 2199 | B2247: 6 | C2247: 7 | D2247: 2000 | E2247: 91 | F2247: 100 | G2247: 5 | H2247: 20000 | I2247: 110003 | J2247: 5 | K2247: [{7,0},{8,0},{9,6},{10,4},{11,0},{12,0},{17,10},{18,8},{19,1},{23,4},{24,10}] | L2247: [{7,27},{8,55},{9,27},{10,55},{11,27},{12,55},{17,18},{18,110},{19,3},{23,37},{24,37}] | M2247: [{0,1,[1,30]},{1,2,[11,40]},{2,5,[21,50]},{5,10,[31,60]},{10,20,[41,60]},{30,20,[51,70]},{50,10,[61,80]},{70,5,[71,80]},{100,2,[81,90]},{150,1,[91,100]}]
A2248: 2200 | B2248: 2 | C2248: 1 | D2248: 3000 | E2248: 91 | F2248: 100 | G2248: 1 | H2248: 5000 | I2248: 110003 | J2248: 1 | K2248: [{7,0},{8,0},{9,0},{10,0},{11,6},{12,4},{17,10},{18,8},{19,1},{23,4},{24,10}] | L2248: [{7,27},{8,55},{9,27},{10,55},{11,27},{12,55},{17,18},{18,110},{19,3},{23,37},{24,37}] | M2248: [{0,1,[1,30]},{1,2,[11,40]},{2,5,[21,50]},{5,10,[31,60]},{10,20,[41,60]},{30,20,[51,70]},{50,10,[61,80]},{70,5,[71,80]},{100,2,[81,90]},{150,1,[91,100]}]
A2249: 2201 | B2249: 3 | C2249: 1 | D2249: 3000 | E2249: 91 | F2249: 100 | G2249: 2 | H2249: 10000 | I2249: 110003 | J2249: 2 | K2249: [{7,0},{8,0},{9,0},{10,0},{11,6},{12,4},{17,10},{18,8},{19,1},{23,4},{24,10}] | L2249: [{7,27},{8,55},{9,27},{10,55},{11,27},{12,55},{17,18},{18,110},{19,3},{23,37},{24,37}] | M2249: [{0,1,[1,30]},{1,2,[11,40]},{2,5,[21,50]},{5,10,[31,60]},{10,20,[41,60]},{30,20,[51,70]},{50,10,[61,80]},{70,5,[71,80]},{100,2,[81,90]},{150,1,[91,100]}]
A2250: 2202 | B2250: 4 | C2250: 1 | D2250: 3000 | E2250: 91 | F2250: 100 | G2250: 3 | H2250: 15000 | I2250: 110003 | J2250: 3 | K2250: [{7,0},{8,0},{9,0},{10,0},{11,6},{12,4},{17,10},{18,8},{19,1},{23,4},{24,10}] | L2250: [{7,27},{8,55},{9,27},{10,55},{11,27},{12,55},{17,18},{18,110},{19,3},{23,37},{24,37}] | M2250: [{0,1,[1,30]},{1,2,[11,40]},{2,5,[21,50]},{5,10,[31,60]},{10,20,[41,60]},{30,20,[51,70]},{50,10,[61,80]},{70,5,[71,80]},{100,2,[81,90]},{150,1,[91,100]}]
A2251: 2203 | B2251: 5 | C2251: 1 | D2251: 3000 | E2251: 91 | F2251: 100 | G2251: 4 | H2251: 20000 | I2251: 110003 | J2251: 4 | K2251: [{7,0},{8,0},{9,0},{10,0},{11,6},{12,4},{17,10},{18,8},{19,1},{23,4},{24,10}] | L2251: [{7,27},{8,55},{9,27},{10,55},{11,27},{12,55},{17,18},{18,110},{19,3},{23,37},{24,37}] | M2251: [{0,1,[1,30]},{1,2,[11,40]},{2,5,[21,50]},{5,10,[31,60]},{10,20,[41,60]},{30,20,[51,70]},{50,10,[61,80]},{70,5,[71,80]},{100,2,[81,90]},{150,1,[91,100]}]
A2252: 2204 | B2252: 6 | C2252: 1 | D2252: 3000 | E2252: 91 | F2252: 100 | G2252: 5 | H2252: 20000 | I2252: 110003 | J2252: 5 | K2252: [{7,0},{8,0},{9,0},{10,0},{11,6},{12,4},{17,10},{18,8},{19,1},{23,4},{24,10}] | L2252: [{7,27},{8,55},{9,27},{10,55},{11,27},{12,55},{17,18},{18,110},{19,3},{23,37},{24,37}] | M2252: [{0,1,[1,30]},{1,2,[11,40]},{2,5,[21,50]},{5,10,[31,60]},{10,20,[41,60]},{30,20,[51,70]},{50,10,[61,80]},{70,5,[71,80]},{100,2,[81,90]},{150,1,[91,100]}]
A2253: 2205 | B2253: 2 | C2253: 4 | D2253: 3000 | E2253: 91 | F2253: 100 | G2253: 1 | H2253: 5000 | I2253: 110003 | J2253: 1 | K2253: [{7,0},{8,0},{9,0},{10,0},{11,6},{12,4},{17,10},{18,8},{19,1},{23,4},{24,10}] | L2253: [{7,27},{8,55},{9,27},{10,55},{11,27},{12,55},{17,18},{18,110},{19,3},{23,37},{24,37}] | M2253: [{0,1,[1,30]},{1,2,[11,40]},{2,5,[21,50]},{5,10,[31,60]},{10,20,[41,60]},{30,20,[51,70]},{50,10,[61,80]},{70,5,[71,80]},{100,2,[81,90]},{150,1,[91,100]}]
A2254: 2206 | B2254: 3 | C2254: 4 | D2254: 3000 | E2254: 91 | F2254: 100 | G2254: 2 | H2254: 10000 | I2254: 110003 | J2254: 2 | K2254: [{7,0},{8,0},{9,0},{10,0},{11,6},{12,4},{17,10},{18,8},{19,1},{23,4},{24,10}] | L2254: [{7,27},{8,55},{9,27},{10,55},{11,27},{12,55},{17,18},{18,110},{19,3},{23,37},{24,37}] | M2254: [{0,1,[1,30]},{1,2,[11,40]},{2,5,[21,50]},{5,10,[31,60]},{10,20,[41,60]},{30,20,[51,70]},{50,10,[61,80]},{70,5,[71,80]},{100,2,[81,90]},{150,1,[91,100]}]
A2255: 2207 | B2255: 4 | C2255: 4 | D2255: 3000 | E2255: 91 | F2255: 100 | G2255: 3 | H2255: 15000 | I2255: 110003 | J2255: 3 | K2255: [{7,0},{8,0},{9,0},{10,0},{11,6},{12,4},{17,10},{18,8},{19,1},{23,4},{24,10}] | L2255: [{7,27},{8,55},{9,27},{10,55},{11,27},{12,55},{17,18},{18,110},{19,3},{23,37},{24,37}] | M2255: [{0,1,[1,30]},{1,2,[11,40]},{2,5,[21,50]},{5,10,[31,60]},{10,20,[41,60]},{30,20,[51,70]},{50,10,[61,80]},{70,5,[71,80]},{100,2,[81,90]},{150,1,[91,100]}]
A2256: 2208 | B2256: 5 | C2256: 4 | D2256: 3000 | E2256: 91 | F2256: 100 | G2256: 4 | H2256: 20000 | I2256: 110003 | J2256: 4 | K2256: [{7,0},{8,0},{9,0},{10,0},{11,6},{12,4},{17,10},{18,8},{19,1},{23,4},{24,10}] | L2256: [{7,27},{8,55},{9,27},{10,55},{11,27},{12,55},{17,18},{18,110},{19,3},{23,37},{24,37}] | M2256: [{0,1,[1,30]},{1,2,[11,40]},{2,5,[21,50]},{5,10,[31,60]},{10,20,[41,60]},{30,20,[51,70]},{50,10,[61,80]},{70,5,[71,80]},{100,2,[81,90]},{150,1,[91,100]}]
A2257: 2209 | B2257: 6 | C2257: 4 | D2257: 3000 | E2257: 91 | F2257: 100 | G2257: 5 | H2257: 20000 | I2257: 110003 | J2257: 5 | K2257: [{7,0},{8,0},{9,0},{10,0},{11,6},{12,4},{17,10},{18,8},{19,1},{23,4},{24,10}] | L2257: [{7,27},{8,55},{9,27},{10,55},{11,27},{12,55},{17,18},{18,110},{19,3},{23,37},{24,37}] | M2257: [{0,1,[1,30]},{1,2,[11,40]},{2,5,[21,50]},{5,10,[31,60]},{10,20,[41,60]},{30,20,[51,70]},{50,10,[61,80]},{70,5,[71,80]},{100,2,[81,90]},{150,1,[91,100]}]
A2258: 2210 | B2258: 2 | C2258: 6 | D2258: 3000 | E2258: 91 | F2258: 100 | G2258: 1 | H2258: 5000 | I2258: 110003 | J2258: 1 | K2258: [{7,0},{8,0},{9,0},{10,0},{11,6},{12,4},{17,10},{18,8},{19,1},{23,4},{24,10}] | L2258: [{7,27},{8,55},{9,27},{10,55},{11,27},{12,55},{17,18},{18,110},{19,3},{23,37},{24,37}] | M2258: [{0,1,[1,30]},{1,2,[11,40]},{2,5,[21,50]},{5,10,[31,60]},{10,20,[41,60]},{30,20,[51,70]},{50,10,[61,80]},{70,5,[71,80]},{100,2,[81,90]},{150,1,[91,100]}]
A2259: 2211 | B2259: 3 | C2259: 6 | D2259: 3000 | E2259: 91 | F2259: 100 | G2259: 2 | H2259: 10000 | I2259: 110003 | J2259: 2 | K2259: [{7,0},{8,0},{9,0},{10,0},{11,6},{12,4},{17,10},{18,8},{19,1},{23,4},{24,10}] | L2259: [{7,27},{8,55},{9,27},{10,55},{11,27},{12,55},{17,18},{18,110},{19,3},{23,37},{24,37}] | M2259: [{0,1,[1,30]},{1,2,[11,40]},{2,5,[21,50]},{5,10,[31,60]},{10,20,[41,60]},{30,20,[51,70]},{50,10,[61,80]},{70,5,[71,80]},{100,2,[81,90]},{150,1,[91,100]}]
A2260: 2212 | B2260: 4 | C2260: 6 | D2260: 3000 | E2260: 91 | F2260: 100 | G2260: 3 | H2260: 15000 | I2260: 110003 | J2260: 3 | K2260: [{7,0},{8,0},{9,0},{10,0},{11,6},{12,4},{17,10},{18,8},{19,1},{23,4},{24,10}] | L2260: [{7,27},{8,55},{9,27},{10,55},{11,27},{12,55},{17,18},{18,110},{19,3},{23,37},{24,37}] | M2260: [{0,1,[1,30]},{1,2,[11,40]},{2,5,[21,50]},{5,10,[31,60]},{10,20,[41,60]},{30,20,[51,70]},{50,10,[61,80]},{70,5,[71,80]},{100,2,[81,90]},{150,1,[91,100]}]
A2261: 2213 | B2261: 5 | C2261: 6 | D2261: 3000 | E2261: 91 | F2261: 100 | G2261: 4 | H2261: 20000 | I2261: 110003 | J2261: 4 | K2261: [{7,0},{8,0},{9,0},{10,0},{11,6},{12,4},{17,10},{18,8},{19,1},{23,4},{24,10}] | L2261: [{7,27},{8,55},{9,27},{10,55},{11,27},{12,55},{17,18},{18,110},{19,3},{23,37},{24,37}] | M2261: [{0,1,[1,30]},{1,2,[11,40]},{2,5,[21,50]},{5,10,[31,60]},{10,20,[41,60]},{30,20,[51,70]},{50,10,[61,80]},{70,5,[71,80]},{100,2,[81,90]},{150,1,[91,100]}]
A2262: 2214 | B2262: 6 | C2262: 6 | D2262: 3000 | E2262: 91 | F2262: 100 | G2262: 5 | H2262: 20000 | I2262: 110003 | J2262: 5 | K2262: [{7,0},{8,0},{9,0},{10,0},{11,6},{12,4},{17,10},{18,8},{19,1},{23,4},{24,10}] | L2262: [{7,27},{8,55},{9,27},{10,55},{11,27},{12,55},{17,18},{18,110},{19,3},{23,37},{24,37}] | M2262: [{0,1,[1,30]},{1,2,[11,40]},{2,5,[21,50]},{5,10,[31,60]},{10,20,[41,60]},{30,20,[51,70]},{50,10,[61,80]},{70,5,[71,80]},{100,2,[81,90]},{150,1,[91,100]}]
A2263: 2215 | B2263: 2 | C2263: 7 | D2263: 3000 | E2263: 91 | F2263: 100 | G2263: 1 | H2263: 5000 | I2263: 110003 | J2263: 1 | K2263: [{7,0},{8,0},{9,0},{10,0},{11,6},{12,4},{17,10},{18,8},{19,1},{23,4},{24,10}] | L2263: [{7,27},{8,55},{9,27},{10,55},{11,27},{12,55},{17,18},{18,110},{19,3},{23,37},{24,37}] | M2263: [{0,1,[1,30]},{1,2,[11,40]},{2,5,[21,50]},{5,10,[31,60]},{10,20,[41,60]},{30,20,[51,70]},{50,10,[61,80]},{70,5,[71,80]},{100,2,[81,90]},{150,1,[91,100]}]
A2264: 2216 | B2264: 3 | C2264: 7 | D2264: 3000 | E2264: 91 | F2264: 100 | G2264: 2 | H2264: 10000 | I2264: 110003 | J2264: 2 | K2264: [{7,0},{8,0},{9,0},{10,0},{11,6},{12,4},{17,10},{18,8},{19,1},{23,4},{24,10}] | L2264: [{7,27},{8,55},{9,27},{10,55},{11,27},{12,55},{17,18},{18,110},{19,3},{23,37},{24,37}] | M2264: [{0,1,[1,30]},{1,2,[11,40]},{2,5,[21,50]},{5,10,[31,60]},{10,20,[41,60]},{30,20,[51,70]},{50,10,[61,80]},{70,5,[71,80]},{100,2,[81,90]},{150,1,[91,100]}]
A2265: 2217 | B2265: 4 | C2265: 7 | D2265: 3000 | E2265: 91 | F2265: 100 | G2265: 3 | H2265: 15000 | I2265: 110003 | J2265: 3 | K2265: [{7,0},{8,0},{9,0},{10,0},{11,6},{12,4},{17,10},{18,8},{19,1},{23,4},{24,10}] | L2265: [{7,27},{8,55},{9,27},{10,55},{11,27},{12,55},{17,18},{18,110},{19,3},{23,37},{24,37}] | M2265: [{0,1,[1,30]},{1,2,[11,40]},{2,5,[21,50]},{5,10,[31,60]},{10,20,[41,60]},{30,20,[51,70]},{50,10,[61,80]},{70,5,[71,80]},{100,2,[81,90]},{150,1,[91,100]}]
A2266: 2218 | B2266: 5 | C2266: 7 | D2266: 3000 | E2266: 91 | F2266: 100 | G2266: 4 | H2266: 20000 | I2266: 110003 | J2266: 4 | K2266: [{7,0},{8,0},{9,0},{10,0},{11,6},{12,4},{17,10},{18,8},{19,1},{23,4},{24,10}] | L2266: [{7,27},{8,55},{9,27},{10,55},{11,27},{12,55},{17,18},{18,110},{19,3},{23,37},{24,37}] | M2266: [{0,1,[1,30]},{1,2,[11,40]},{2,5,[21,50]},{5,10,[31,60]},{10,20,[41,60]},{30,20,[51,70]},{50,10,[61,80]},{70,5,[71,80]},{100,2,[81,90]},{150,1,[91,100]}]
A2267: 2219 | B2267: 6 | C2267: 7 | D2267: 3000 | E2267: 91 | F2267: 100 | G2267: 5 | H2267: 20000 | I2267: 110003 | J2267: 5 | K2267: [{7,0},{8,0},{9,0},{10,0},{11,6},{12,4},{17,10},{18,8},{19,1},{23,4},{24,10}] | L2267: [{7,27},{8,55},{9,27},{10,55},{11,27},{12,55},{17,18},{18,110},{19,3},{23,37},{24,37}] | M2267: [{0,1,[1,30]},{1,2,[11,40]},{2,5,[21,50]},{5,10,[31,60]},{10,20,[41,60]},{30,20,[51,70]},{50,10,[61,80]},{70,5,[71,80]},{100,2,[81,90]},{150,1,[91,100]}]
A2268: 2220 | B2268: 2 | C2268: 1 | D2268: 0 | E2268: 91 | F2268: 100 | G2268: 1 | H2268: 5000 | I2268: 110003 | J2268: 1 | K2268: [{7,3},{8,3},{9,3},{10,3},{11,3},{12,3},{17,10},{18,8},{19,1},{23,4},{24,10}] | L2268: [{7,27},{8,55},{9,27},{10,55},{11,27},{12,55},{17,18},{18,110},{19,3},{23,37},{24,37}] | M2268: [{0,1,[1,30]},{1,2,[11,40]},{2,5,[21,50]},{5,10,[31,60]},{10,20,[41,60]},{30,20,[51,70]},{50,10,[61,80]},{70,5,[71,80]},{100,2,[81,90]},{150,1,[91,100]}]
A2269: 2221 | B2269: 3 | C2269: 1 | D2269: 0 | E2269: 91 | F2269: 100 | G2269: 2 | H2269: 10000 | I2269: 110003 | J2269: 2 | K2269: [{7,3},{8,3},{9,3},{10,3},{11,3},{12,3},{17,10},{18,8},{19,1},{23,4},{24,10}] | L2269: [{7,27},{8,55},{9,27},{10,55},{11,27},{12,55},{17,18},{18,110},{19,3},{23,37},{24,37}] | M2269: [{0,1,[1,30]},{1,2,[11,40]},{2,5,[21,50]},{5,10,[31,60]},{10,20,[41,60]},{30,20,[51,70]},{50,10,[61,80]},{70,5,[71,80]},{100,2,[81,90]},{150,1,[91,100]}]
A2270: 2222 | B2270: 4 | C2270: 1 | D2270: 0 | E2270: 91 | F2270: 100 | G2270: 3 | H2270: 15000 | I2270: 110003 | J2270: 3 | K2270: [{7,3},{8,3},{9,3},{10,3},{11,3},{12,3},{17,10},{18,8},{19,1},{23,4},{24,10}] | L2270: [{7,27},{8,55},{9,27},{10,55},{11,27},{12,55},{17,18},{18,110},{19,3},{23,37},{24,37}] | M2270: [{0,1,[1,30]},{1,2,[11,40]},{2,5,[21,50]},{5,10,[31,60]},{10,20,[41,60]},{30,20,[51,70]},{50,10,[61,80]},{70,5,[71,80]},{100,2,[81,90]},{150,1,[91,100]}]
A2271: 2223 | B2271: 5 | C2271: 1 | D2271: 0 | E2271: 91 | F2271: 100 | G2271: 4 | H2271: 20000 | I2271: 110003 | J2271: 4 | K2271: [{7,3},{8,3},{9,3},{10,3},{11,3},{12,3},{17,10},{18,8},{19,1},{23,4},{24,10}] | L2271: [{7,27},{8,55},{9,27},{10,55},{11,27},{12,55},{17,18},{18,110},{19,3},{23,37},{24,37}] | M2271: [{0,1,[1,30]},{1,2,[11,40]},{2,5,[21,50]},{5,10,[31,60]},{10,20,[41,60]},{30,20,[51,70]},{50,10,[61,80]},{70,5,[71,80]},{100,2,[81,90]},{150,1,[91,100]}]
A2272: 2224 | B2272: 6 | C2272: 1 | D2272: 0 | E2272: 91 | F2272: 100 | G2272: 5 | H2272: 20000 | I2272: 110003 | J2272: 5 | K2272: [{7,3},{8,3},{9,3},{10,3},{11,3},{12,3},{17,10},{18,8},{19,1},{23,4},{24,10}] | L2272: [{7,27},{8,55},{9,27},{10,55},{11,27},{12,55},{17,18},{18,110},{19,3},{23,37},{24,37}] | M2272: [{0,1,[1,30]},{1,2,[11,40]},{2,5,[21,50]},{5,10,[31,60]},{10,20,[41,60]},{30,20,[51,70]},{50,10,[61,80]},{70,5,[71,80]},{100,2,[81,90]},{150,1,[91,100]}]
A2273: 2225 | B2273: 2 | C2273: 4 | D2273: 0 | E2273: 91 | F2273: 100 | G2273: 1 | H2273: 5000 | I2273: 110003 | J2273: 1 | K2273: [{7,3},{8,3},{9,3},{10,3},{11,3},{12,3},{17,10},{18,8},{19,1},{23,4},{24,10}] | L2273: [{7,27},{8,55},{9,27},{10,55},{11,27},{12,55},{17,18},{18,110},{19,3},{23,37},{24,37}] | M2273: [{0,1,[1,30]},{1,2,[11,40]},{2,5,[21,50]},{5,10,[31,60]},{10,20,[41,60]},{30,20,[51,70]},{50,10,[61,80]},{70,5,[71,80]},{100,2,[81,90]},{150,1,[91,100]}]
A2274: 2226 | B2274: 3 | C2274: 4 | D2274: 0 | E2274: 91 | F2274: 100 | G2274: 2 | H2274: 10000 | I2274: 110003 | J2274: 2 | K2274: [{7,3},{8,3},{9,3},{10,3},{11,3},{12,3},{17,10},{18,8},{19,1},{23,4},{24,10}] | L2274: [{7,27},{8,55},{9,27},{10,55},{11,27},{12,55},{17,18},{18,110},{19,3},{23,37},{24,37}] | M2274: [{0,1,[1,30]},{1,2,[11,40]},{2,5,[21,50]},{5,10,[31,60]},{10,20,[41,60]},{30,20,[51,70]},{50,10,[61,80]},{70,5,[71,80]},{100,2,[81,90]},{150,1,[91,100]}]
A2275: 2227 | B2275: 4 | C2275: 4 | D2275: 0 | E2275: 91 | F2275: 100 | G2275: 3 | H2275: 15000 | I2275: 110003 | J2275: 3 | K2275: [{7,3},{8,3},{9,3},{10,3},{11,3},{12,3},{17,10},{18,8},{19,1},{23,4},{24,10}] | L2275: [{7,27},{8,55},{9,27},{10,55},{11,27},{12,55},{17,18},{18,110},{19,3},{23,37},{24,37}] | M2275: [{0,1,[1,30]},{1,2,[11,40]},{2,5,[21,50]},{5,10,[31,60]},{10,20,[41,60]},{30,20,[51,70]},{50,10,[61,80]},{70,5,[71,80]},{100,2,[81,90]},{150,1,[91,100]}]
A2276: 2228 | B2276: 5 | C2276: 4 | D2276: 0 | E2276: 91 | F2276: 100 | G2276: 4 | H2276: 20000 | I2276: 110003 | J2276: 4 | K2276: [{7,3},{8,3},{9,3},{10,3},{11,3},{12,3},{17,10},{18,8},{19,1},{23,4},{24,10}] | L2276: [{7,27},{8,55},{9,27},{10,55},{11,27},{12,55},{17,18},{18,110},{19,3},{23,37},{24,37}] | M2276: [{0,1,[1,30]},{1,2,[11,40]},{2,5,[21,50]},{5,10,[31,60]},{10,20,[41,60]},{30,20,[51,70]},{50,10,[61,80]},{70,5,[71,80]},{100,2,[81,90]},{150,1,[91,100]}]
A2277: 2229 | B2277: 6 | C2277: 4 | D2277: 0 | E2277: 91 | F2277: 100 | G2277: 5 | H2277: 20000 | I2277: 110003 | J2277: 5 | K2277: [{7,3},{8,3},{9,3},{10,3},{11,3},{12,3},{17,10},{18,8},{19,1},{23,4},{24,10}] | L2277: [{7,27},{8,55},{9,27},{10,55},{11,27},{12,55},{17,18},{18,110},{19,3},{23,37},{24,37}] | M2277: [{0,1,[1,30]},{1,2,[11,40]},{2,5,[21,50]},{5,10,[31,60]},{10,20,[41,60]},{30,20,[51,70]},{50,10,[61,80]},{70,5,[71,80]},{100,2,[81,90]},{150,1,[91,100]}]
A2278: 2230 | B2278: 2 | C2278: 6 | D2278: 0 | E2278: 91 | F2278: 100 | G2278: 1 | H2278: 5000 | I2278: 110003 | J2278: 1 | K2278: [{7,3},{8,3},{9,3},{10,3},{11,3},{12,3},{17,10},{18,8},{19,1},{23,4},{24,10}] | L2278: [{7,27},{8,55},{9,27},{10,55},{11,27},{12,55},{17,18},{18,110},{19,3},{23,37},{24,37}] | M2278: [{0,1,[1,30]},{1,2,[11,40]},{2,5,[21,50]},{5,10,[31,60]},{10,20,[41,60]},{30,20,[51,70]},{50,10,[61,80]},{70,5,[71,80]},{100,2,[81,90]},{150,1,[91,100]}]
A2279: 2231 | B2279: 3 | C2279: 6 | D2279: 0 | E2279: 91 | F2279: 100 | G2279: 2 | H2279: 10000 | I2279: 110003 | J2279: 2 | K2279: [{7,3},{8,3},{9,3},{10,3},{11,3},{12,3},{17,10},{18,8},{19,1},{23,4},{24,10}] | L2279: [{7,27},{8,55},{9,27},{10,55},{11,27},{12,55},{17,18},{18,110},{19,3},{23,37},{24,37}] | M2279: [{0,1,[1,30]},{1,2,[11,40]},{2,5,[21,50]},{5,10,[31,60]},{10,20,[41,60]},{30,20,[51,70]},{50,10,[61,80]},{70,5,[71,80]},{100,2,[81,90]},{150,1,[91,100]}]
A2280: 2232 | B2280: 4 | C2280: 6 | D2280: 0 | E2280: 91 | F2280: 100 | G2280: 3 | H2280: 15000 | I2280: 110003 | J2280: 3 | K2280: [{7,3},{8,3},{9,3},{10,3},{11,3},{12,3},{17,10},{18,8},{19,1},{23,4},{24,10}] | L2280: [{7,27},{8,55},{9,27},{10,55},{11,27},{12,55},{17,18},{18,110},{19,3},{23,37},{24,37}] | M2280: [{0,1,[1,30]},{1,2,[11,40]},{2,5,[21,50]},{5,10,[31,60]},{10,20,[41,60]},{30,20,[51,70]},{50,10,[61,80]},{70,5,[71,80]},{100,2,[81,90]},{150,1,[91,100]}]
A2281: 2233 | B2281: 5 | C2281: 6 | D2281: 0 | E2281: 91 | F2281: 100 | G2281: 4 | H2281: 20000 | I2281: 110003 | J2281: 4 | K2281: [{7,3},{8,3},{9,3},{10,3},{11,3},{12,3},{17,10},{18,8},{19,1},{23,4},{24,10}] | L2281: [{7,27},{8,55},{9,27},{10,55},{11,27},{12,55},{17,18},{18,110},{19,3},{23,37},{24,37}] | M2281: [{0,1,[1,30]},{1,2,[11,40]},{2,5,[21,50]},{5,10,[31,60]},{10,20,[41,60]},{30,20,[51,70]},{50,10,[61,80]},{70,5,[71,80]},{100,2,[81,90]},{150,1,[91,100]}]
A2282: 2234 | B2282: 6 | C2282: 6 | D2282: 0 | E2282: 91 | F2282: 100 | G2282: 5 | H2282: 20000 | I2282: 110003 | J2282: 5 | K2282: [{7,3},{8,3},{9,3},{10,3},{11,3},{12,3},{17,10},{18,8},{19,1},{23,4},{24,10}] | L2282: [{7,27},{8,55},{9,27},{10,55},{11,27},{12,55},{17,18},{18,110},{19,3},{23,37},{24,37}] | M2282: [{0,1,[1,30]},{1,2,[11,40]},{2,5,[21,50]},{5,10,[31,60]},{10,20,[41,60]},{30,20,[51,70]},{50,10,[61,80]},{70,5,[71,80]},{100,2,[81,90]},{150,1,[91,100]}]
A2283: 2235 | B2283: 2 | C2283: 7 | D2283: 0 | E2283: 91 | F2283: 100 | G2283: 1 | H2283: 5000 | I2283: 110003 | J2283: 1 | K2283: [{7,3},{8,3},{9,3},{10,3},{11,3},{12,3},{17,10},{18,8},{19,1},{23,4},{24,10}] | L2283: [{7,27},{8,55},{9,27},{10,55},{11,27},{12,55},{17,18},{18,110},{19,3},{23,37},{24,37}] | M2283: [{0,1,[1,30]},{1,2,[11,40]},{2,5,[21,50]},{5,10,[31,60]},{10,20,[41,60]},{30,20,[51,70]},{50,10,[61,80]},{70,5,[71,80]},{100,2,[81,90]},{150,1,[91,100]}]
A2284: 2236 | B2284: 3 | C2284: 7 | D2284: 0 | E2284: 91 | F2284: 100 | G2284: 2 | H2284: 10000 | I2284: 110003 | J2284: 2 | K2284: [{7,3},{8,3},{9,3},{10,3},{11,3},{12,3},{17,10},{18,8},{19,1},{23,4},{24,10}] | L2284: [{7,27},{8,55},{9,27},{10,55},{11,27},{12,55},{17,18},{18,110},{19,3},{23,37},{24,37}] | M2284: [{0,1,[1,30]},{1,2,[11,40]},{2,5,[21,50]},{5,10,[31,60]},{10,20,[41,60]},{30,20,[51,70]},{50,10,[61,80]},{70,5,[71,80]},{100,2,[81,90]},{150,1,[91,100]}]
A2285: 2237 | B2285: 4 | C2285: 7 | D2285: 0 | E2285: 91 | F2285: 100 | G2285: 3 | H2285: 15000 | I2285: 110003 | J2285: 3 | K2285: [{7,3},{8,3},{9,3},{10,3},{11,3},{12,3},{17,10},{18,8},{19,1},{23,4},{24,10}] | L2285: [{7,27},{8,55},{9,27},{10,55},{11,27},{12,55},{17,18},{18,110},{19,3},{23,37},{24,37}] | M2285: [{0,1,[1,30]},{1,2,[11,40]},{2,5,[21,50]},{5,10,[31,60]},{10,20,[41,60]},{30,20,[51,70]},{50,10,[61,80]},{70,5,[71,80]},{100,2,[81,90]},{150,1,[91,100]}]
A2286: 2238 | B2286: 5 | C2286: 7 | D2286: 0 | E2286: 91 | F2286: 100 | G2286: 4 | H2286: 20000 | I2286: 110003 | J2286: 4 | K2286: [{7,3},{8,3},{9,3},{10,3},{11,3},{12,3},{17,10},{18,8},{19,1},{23,4},{24,10}] | L2286: [{7,27},{8,55},{9,27},{10,55},{11,27},{12,55},{17,18},{18,110},{19,3},{23,37},{24,37}] | M2286: [{0,1,[1,30]},{1,2,[11,40]},{2,5,[21,50]},{5,10,[31,60]},{10,20,[41,60]},{30,20,[51,70]},{50,10,[61,80]},{70,5,[71,80]},{100,2,[81,90]},{150,1,[91,100]}]
A2287: 2239 | B2287: 6 | C2287: 7 | D2287: 0 | E2287: 91 | F2287: 100 | G2287: 5 | H2287: 20000 | I2287: 110003 | J2287: 5 | K2287: [{7,3},{8,3},{9,3},{10,3},{11,3},{12,3},{17,10},{18,8},{19,1},{23,4},{24,10}] | L2287: [{7,27},{8,55},{9,27},{10,55},{11,27},{12,55},{17,18},{18,110},{19,3},{23,37},{24,37}] | M2287: [{0,1,[1,30]},{1,2,[11,40]},{2,5,[21,50]},{5,10,[31,60]},{10,20,[41,60]},{30,20,[51,70]},{50,10,[61,80]},{70,5,[71,80]},{100,2,[81,90]},{150,1,[91,100]}]
A2288: 2240 | B2288: 2 | C2288: 1 | D2288: 0 | E2288: 91 | F2288: 100 | G2288: 1 | H2288: 5000 | I2288: 110003 | J2288: 1 | K2288: [{7,3},{8,3},{9,3},{10,3},{11,3},{12,3},{17,10},{18,8},{19,1},{23,4},{24,10}] | L2288: [{7,27},{8,55},{9,27},{10,55},{11,27},{12,55},{17,18},{18,110},{19,3},{23,37},{24,37}] | M2288: [{0,1,[1,30]},{1,2,[11,40]},{2,5,[21,50]},{5,10,[31,60]},{10,20,[41,60]},{30,20,[51,70]},{50,10,[61,80]},{70,5,[71,80]},{100,2,[81,90]},{150,1,[91,100]}]
A2289: 2241 | B2289: 3 | C2289: 1 | D2289: 0 | E2289: 91 | F2289: 100 | G2289: 2 | H2289: 10000 | I2289: 110003 | J2289: 2 | K2289: [{7,3},{8,3},{9,3},{10,3},{11,3},{12,3},{17,10},{18,8},{19,1},{23,4},{24,10}] | L2289: [{7,27},{8,55},{9,27},{10,55},{11,27},{12,55},{17,18},{18,110},{19,3},{23,37},{24,37}] | M2289: [{0,1,[1,30]},{1,2,[11,40]},{2,5,[21,50]},{5,10,[31,60]},{10,20,[41,60]},{30,20,[51,70]},{50,10,[61,80]},{70,5,[71,80]},{100,2,[81,90]},{150,1,[91,100]}]
A2290: 2242 | B2290: 4 | C2290: 1 | D2290: 0 | E2290: 91 | F2290: 100 | G2290: 3 | H2290: 15000 | I2290: 110003 | J2290: 3 | K2290: [{7,3},{8,3},{9,3},{10,3},{11,3},{12,3},{17,10},{18,8},{19,1},{23,4},{24,10}] | L2290: [{7,27},{8,55},{9,27},{10,55},{11,27},{12,55},{17,18},{18,110},{19,3},{23,37},{24,37}] | M2290: [{0,1,[1,30]},{1,2,[11,40]},{2,5,[21,50]},{5,10,[31,60]},{10,20,[41,60]},{30,20,[51,70]},{50,10,[61,80]},{70,5,[71,80]},{100,2,[81,90]},{150,1,[91,100]}]
A2291: 2243 | B2291: 5 | C2291: 1 | D2291: 0 | E2291: 91 | F2291: 100 | G2291: 4 | H2291: 20000 | I2291: 110003 | J2291: 4 | K2291: [{7,3},{8,3},{9,3},{10,3},{11,3},{12,3},{17,10},{18,8},{19,1},{23,4},{24,10}] | L2291: [{7,27},{8,55},{9,27},{10,55},{11,27},{12,55},{17,18},{18,110},{19,3},{23,37},{24,37}] | M2291: [{0,1,[1,30]},{1,2,[11,40]},{2,5,[21,50]},{5,10,[31,60]},{10,20,[41,60]},{30,20,[51,70]},{50,10,[61,80]},{70,5,[71,80]},{100,2,[81,90]},{150,1,[91,100]}]
A2292: 2244 | B2292: 6 | C2292: 1 | D2292: 0 | E2292: 91 | F2292: 100 | G2292: 5 | H2292: 20000 | I2292: 110003 | J2292: 5 | K2292: [{7,3},{8,3},{9,3},{10,3},{11,3},{12,3},{17,10},{18,8},{19,1},{23,4},{24,10}] | L2292: [{7,27},{8,55},{9,27},{10,55},{11,27},{12,55},{17,18},{18,110},{19,3},{23,37},{24,37}] | M2292: [{0,1,[1,30]},{1,2,[11,40]},{2,5,[21,50]},{5,10,[31,60]},{10,20,[41,60]},{30,20,[51,70]},{50,10,[61,80]},{70,5,[71,80]},{100,2,[81,90]},{150,1,[91,100]}]
A2293: 2245 | B2293: 2 | C2293: 4 | D2293: 0 | E2293: 91 | F2293: 100 | G2293: 1 | H2293: 5000 | I2293: 110003 | J2293: 1 | K2293: [{7,3},{8,3},{9,3},{10,3},{11,3},{12,3},{17,10},{18,8},{19,1},{23,4},{24,10}] | L2293: [{7,27},{8,55},{9,27},{10,55},{11,27},{12,55},{17,18},{18,110},{19,3},{23,37},{24,37}] | M2293: [{0,1,[1,30]},{1,2,[11,40]},{2,5,[21,50]},{5,10,[31,60]},{10,20,[41,60]},{30,20,[51,70]},{50,10,[61,80]},{70,5,[71,80]},{100,2,[81,90]},{150,1,[91,100]}]
A2294: 2246 | B2294: 3 | C2294: 4 | D2294: 0 | E2294: 91 | F2294: 100 | G2294: 2 | H2294: 10000 | I2294: 110003 | J2294: 2 | K2294: [{7,3},{8,3},{9,3},{10,3},{11,3},{12,3},{17,10},{18,8},{19,1},{23,4},{24,10}] | L2294: [{7,27},{8,55},{9,27},{10,55},{11,27},{12,55},{17,18},{18,110},{19,3},{23,37},{24,37}] | M2294: [{0,1,[1,30]},{1,2,[11,40]},{2,5,[21,50]},{5,10,[31,60]},{10,20,[41,60]},{30,20,[51,70]},{50,10,[61,80]},{70,5,[71,80]},{100,2,[81,90]},{150,1,[91,100]}]
A2295: 2247 | B2295: 4 | C2295: 4 | D2295: 0 | E2295: 91 | F2295: 100 | G2295: 3 | H2295: 15000 | I2295: 110003 | J2295: 3 | K2295: [{7,3},{8,3},{9,3},{10,3},{11,3},{12,3},{17,10},{18,8},{19,1},{23,4},{24,10}] | L2295: [{7,27},{8,55},{9,27},{10,55},{11,27},{12,55},{17,18},{18,110},{19,3},{23,37},{24,37}] | M2295: [{0,1,[1,30]},{1,2,[11,40]},{2,5,[21,50]},{5,10,[31,60]},{10,20,[41,60]},{30,20,[51,70]},{50,10,[61,80]},{70,5,[71,80]},{100,2,[81,90]},{150,1,[91,100]}]
A2296: 2248 | B2296: 5 | C2296: 4 | D2296: 0 | E2296: 91 | F2296: 100 | G2296: 4 | H2296: 20000 | I2296: 110003 | J2296: 4 | K2296: [{7,3},{8,3},{9,3},{10,3},{11,3},{12,3},{17,10},{18,8},{19,1},{23,4},{24,10}] | L2296: [{7,27},{8,55},{9,27},{10,55},{11,27},{12,55},{17,18},{18,110},{19,3},{23,37},{24,37}] | M2296: [{0,1,[1,30]},{1,2,[11,40]},{2,5,[21,50]},{5,10,[31,60]},{10,20,[41,60]},{30,20,[51,70]},{50,10,[61,80]},{70,5,[71,80]},{100,2,[81,90]},{150,1,[91,100]}]
A2297: 2249 | B2297: 6 | C2297: 4 | D2297: 0 | E2297: 91 | F2297: 100 | G2297: 5 | H2297: 20000 | I2297: 110003 | J2297: 5 | K2297: [{7,3},{8,3},{9,3},{10,3},{11,3},{12,3},{17,10},{18,8},{19,1},{23,4},{24,10}] | L2297: [{7,27},{8,55},{9,27},{10,55},{11,27},{12,55},{17,18},{18,110},{19,3},{23,37},{24,37}] | M2297: [{0,1,[1,30]},{1,2,[11,40]},{2,5,[21,50]},{5,10,[31,60]},{10,20,[41,60]},{30,20,[51,70]},{50,10,[61,80]},{70,5,[71,80]},{100,2,[81,90]},{150,1,[91,100]}]
A2298: 2250 | B2298: 2 | C2298: 6 | D2298: 0 | E2298: 91 | F2298: 100 | G2298: 1 | H2298: 5000 | I2298: 110003 | J2298: 1 | K2298: [{7,3},{8,3},{9,3},{10,3},{11,3},{12,3},{17,10},{18,8},{19,1},{23,4},{24,10}] | L2298: [{7,27},{8,55},{9,27},{10,55},{11,27},{12,55},{17,18},{18,110},{19,3},{23,37},{24,37}] | M2298: [{0,1,[1,30]},{1,2,[11,40]},{2,5,[21,50]},{5,10,[31,60]},{10,20,[41,60]},{30,20,[51,70]},{50,10,[61,80]},{70,5,[71,80]},{100,2,[81,90]},{150,1,[91,100]}]
A2299: 2251 | B2299: 3 | C2299: 6 | D2299: 0 | E2299: 91 | F2299: 100 | G2299: 2 | H2299: 10000 | I2299: 110003 | J2299: 2 | K2299: [{7,3},{8,3},{9,3},{10,3},{11,3},{12,3},{17,10},{18,8},{19,1},{23,4},{24,10}] | L2299: [{7,27},{8,55},{9,27},{10,55},{11,27},{12,55},{17,18},{18,110},{19,3},{23,37},{24,37}] | M2299: [{0,1,[1,30]},{1,2,[11,40]},{2,5,[21,50]},{5,10,[31,60]},{10,20,[41,60]},{30,20,[51,70]},{50,10,[61,80]},{70,5,[71,80]},{100,2,[81,90]},{150,1,[91,100]}]
A2300: 2252 | B2300: 4 | C2300: 6 | D2300: 0 | E2300: 91 | F2300: 100 | G2300: 3 | H2300: 15000 | I2300: 110003 | J2300: 3 | K2300: [{7,3},{8,3},{9,3},{10,3},{11,3},{12,3},{17,10},{18,8},{19,1},{23,4},{24,10}] | L2300: [{7,27},{8,55},{9,27},{10,55},{11,27},{12,55},{17,18},{18,110},{19,3},{23,37},{24,37}] | M2300: [{0,1,[1,30]},{1,2,[11,40]},{2,5,[21,50]},{5,10,[31,60]},{10,20,[41,60]},{30,20,[51,70]},{50,10,[61,80]},{70,5,[71,80]},{100,2,[81,90]},{150,1,[91,100]}]
A2301: 2253 | B2301: 5 | C2301: 6 | D2301: 0 | E2301: 91 | F2301: 100 | G2301: 4 | H2301: 20000 | I2301: 110003 | J2301: 4 | K2301: [{7,3},{8,3},{9,3},{10,3},{11,3},{12,3},{17,10},{18,8},{19,1},{23,4},{24,10}] | L2301: [{7,27},{8,55},{9,27},{10,55},{11,27},{12,55},{17,18},{18,110},{19,3},{23,37},{24,37}] | M2301: [{0,1,[1,30]},{1,2,[11,40]},{2,5,[21,50]},{5,10,[31,60]},{10,20,[41,60]},{30,20,[51,70]},{50,10,[61,80]},{70,5,[71,80]},{100,2,[81,90]},{150,1,[91,100]}]
A2302: 2254 | B2302: 6 | C2302: 6 | D2302: 0 | E2302: 91 | F2302: 100 | G2302: 5 | H2302: 20000 | I2302: 110003 | J2302: 5 | K2302: [{7,3},{8,3},{9,3},{10,3},{11,3},{12,3},{17,10},{18,8},{19,1},{23,4},{24,10}] | L2302: [{7,27},{8,55},{9,27},{10,55},{11,27},{12,55},{17,18},{18,110},{19,3},{23,37},{24,37}] | M2302: [{0,1,[1,30]},{1,2,[11,40]},{2,5,[21,50]},{5,10,[31,60]},{10,20,[41,60]},{30,20,[51,70]},{50,10,[61,80]},{70,5,[71,80]},{100,2,[81,90]},{150,1,[91,100]}]
A2303: 2255 | B2303: 2 | C2303: 7 | D2303: 0 | E2303: 91 | F2303: 100 | G2303: 1 | H2303: 5000 | I2303: 110003 | J2303: 1 | K2303: [{7,3},{8,3},{9,3},{10,3},{11,3},{12,3},{17,10},{18,8},{19,1},{23,4},{24,10}] | L2303: [{7,27},{8,55},{9,27},{10,55},{11,27},{12,55},{17,18},{18,110},{19,3},{23,37},{24,37}] | M2303: [{0,1,[1,30]},{1,2,[11,40]},{2,5,[21,50]},{5,10,[31,60]},{10,20,[41,60]},{30,20,[51,70]},{50,10,[61,80]},{70,5,[71,80]},{100,2,[81,90]},{150,1,[91,100]}]
A2304: 2256 | B2304: 3 | C2304: 7 | D2304: 0 | E2304: 91 | F2304: 100 | G2304: 2 | H2304: 10000 | I2304: 110003 | J2304: 2 | K2304: [{7,3},{8,3},{9,3},{10,3},{11,3},{12,3},{17,10},{18,8},{19,1},{23,4},{24,10}] | L2304: [{7,27},{8,55},{9,27},{10,55},{11,27},{12,55},{17,18},{18,110},{19,3},{23,37},{24,37}] | M2304: [{0,1,[1,30]},{1,2,[11,40]},{2,5,[21,50]},{5,10,[31,60]},{10,20,[41,60]},{30,20,[51,70]},{50,10,[61,80]},{70,5,[71,80]},{100,2,[81,90]},{150,1,[91,100]}]
A2305: 2257 | B2305: 4 | C2305: 7 | D2305: 0 | E2305: 91 | F2305: 100 | G2305: 3 | H2305: 15000 | I2305: 110003 | J2305: 3 | K2305: [{7,3},{8,3},{9,3},{10,3},{11,3},{12,3},{17,10},{18,8},{19,1},{23,4},{24,10}] | L2305: [{7,27},{8,55},{9,27},{10,55},{11,27},{12,55},{17,18},{18,110},{19,3},{23,37},{24,37}] | M2305: [{0,1,[1,30]},{1,2,[11,40]},{2,5,[21,50]},{5,10,[31,60]},{10,20,[41,60]},{30,20,[51,70]},{50,10,[61,80]},{70,5,[71,80]},{100,2,[81,90]},{150,1,[91,100]}]
A2306: 2258 | B2306: 5 | C2306: 7 | D2306: 0 | E2306: 91 | F2306: 100 | G2306: 4 | H2306: 20000 | I2306: 110003 | J2306: 4 | K2306: [{7,3},{8,3},{9,3},{10,3},{11,3},{12,3},{17,10},{18,8},{19,1},{23,4},{24,10}] | L2306: [{7,27},{8,55},{9,27},{10,55},{11,27},{12,55},{17,18},{18,110},{19,3},{23,37},{24,37}] | M2306: [{0,1,[1,30]},{1,2,[11,40]},{2,5,[21,50]},{5,10,[31,60]},{10,20,[41,60]},{30,20,[51,70]},{50,10,[61,80]},{70,5,[71,80]},{100,2,[81,90]},{150,1,[91,100]}]
A2307: 2259 | B2307: 6 | C2307: 7 | D2307: 0 | E2307: 91 | F2307: 100 | G2307: 5 | H2307: 20000 | I2307: 110003 | J2307: 5 | K2307: [{7,3},{8,3},{9,3},{10,3},{11,3},{12,3},{17,10},{18,8},{19,1},{23,4},{24,10}] | L2307: [{7,27},{8,55},{9,27},{10,55},{11,27},{12,55},{17,18},{18,110},{19,3},{23,37},{24,37}] | M2307: [{0,1,[1,30]},{1,2,[11,40]},{2,5,[21,50]},{5,10,[31,60]},{10,20,[41,60]},{30,20,[51,70]},{50,10,[61,80]},{70,5,[71,80]},{100,2,[81,90]},{150,1,[91,100]}]
A2308: 2260 | B2308: 2 | C2308: 1 | D2308: 0 | E2308: 91 | F2308: 100 | G2308: 1 | H2308: 5000 | I2308: 110003 | J2308: 1 | K2308: [{7,3},{8,3},{9,3},{10,3},{11,3},{12,3},{17,10},{18,8},{19,1},{23,4},{24,10}] | L2308: [{7,27},{8,55},{9,27},{10,55},{11,27},{12,55},{17,18},{18,110},{19,3},{23,37},{24,37}] | M2308: [{0,1,[1,30]},{1,2,[11,40]},{2,5,[21,50]},{5,10,[31,60]},{10,20,[41,60]},{30,20,[51,70]},{50,10,[61,80]},{70,5,[71,80]},{100,2,[81,90]},{150,1,[91,100]}]
A2309: 2261 | B2309: 3 | C2309: 1 | D2309: 0 | E2309: 91 | F2309: 100 | G2309: 2 | H2309: 10000 | I2309: 110003 | J2309: 2 | K2309: [{7,3},{8,3},{9,3},{10,3},{11,3},{12,3},{17,10},{18,8},{19,1},{23,4},{24,10}] | L2309: [{7,27},{8,55},{9,27},{10,55},{11,27},{12,55},{17,18},{18,110},{19,3},{23,37},{24,37}] | M2309: [{0,1,[1,30]},{1,2,[11,40]},{2,5,[21,50]},{5,10,[31,60]},{10,20,[41,60]},{30,20,[51,70]},{50,10,[61,80]},{70,5,[71,80]},{100,2,[81,90]},{150,1,[91,100]}]
A2310: 2262 | B2310: 4 | C2310: 1 | D2310: 0 | E2310: 91 | F2310: 100 | G2310: 3 | H2310: 15000 | I2310: 110003 | J2310: 3 | K2310: [{7,3},{8,3},{9,3},{10,3},{11,3},{12,3},{17,10},{18,8},{19,1},{23,4},{24,10}] | L2310: [{7,27},{8,55},{9,27},{10,55},{11,27},{12,55},{17,18},{18,110},{19,3},{23,37},{24,37}] | M2310: [{0,1,[1,30]},{1,2,[11,40]},{2,5,[21,50]},{5,10,[31,60]},{10,20,[41,60]},{30,20,[51,70]},{50,10,[61,80]},{70,5,[71,80]},{100,2,[81,90]},{150,1,[91,100]}]
A2311: 2263 | B2311: 5 | C2311: 1 | D2311: 0 | E2311: 91 | F2311: 100 | G2311: 4 | H2311: 20000 | I2311: 110003 | J2311: 4 | K2311: [{7,3},{8,3},{9,3},{10,3},{11,3},{12,3},{17,10},{18,8},{19,1},{23,4},{24,10}] | L2311: [{7,27},{8,55},{9,27},{10,55},{11,27},{12,55},{17,18},{18,110},{19,3},{23,37},{24,37}] | M2311: [{0,1,[1,30]},{1,2,[11,40]},{2,5,[21,50]},{5,10,[31,60]},{10,20,[41,60]},{30,20,[51,70]},{50,10,[61,80]},{70,5,[71,80]},{100,2,[81,90]},{150,1,[91,100]}]
A2312: 2264 | B2312: 6 | C2312: 1 | D2312: 0 | E2312: 91 | F2312: 100 | G2312: 5 | H2312: 20000 | I2312: 110003 | J2312: 5 | K2312: [{7,3},{8,3},{9,3},{10,3},{11,3},{12,3},{17,10},{18,8},{19,1},{23,4},{24,10}] | L2312: [{7,27},{8,55},{9,27},{10,55},{11,27},{12,55},{17,18},{18,110},{19,3},{23,37},{24,37}] | M2312: [{0,1,[1,30]},{1,2,[11,40]},{2,5,[21,50]},{5,10,[31,60]},{10,20,[41,60]},{30,20,[51,70]},{50,10,[61,80]},{70,5,[71,80]},{100,2,[81,90]},{150,1,[91,100]}]
A2313: 2265 | B2313: 2 | C2313: 4 | D2313: 0 | E2313: 91 | F2313: 100 | G2313: 1 | H2313: 5000 | I2313: 110003 | J2313: 1 | K2313: [{7,3},{8,3},{9,3},{10,3},{11,3},{12,3},{17,10},{18,8},{19,1},{23,4},{24,10}] | L2313: [{7,27},{8,55},{9,27},{10,55},{11,27},{12,55},{17,18},{18,110},{19,3},{23,37},{24,37}] | M2313: [{0,1,[1,30]},{1,2,[11,40]},{2,5,[21,50]},{5,10,[31,60]},{10,20,[41,60]},{30,20,[51,70]},{50,10,[61,80]},{70,5,[71,80]},{100,2,[81,90]},{150,1,[91,100]}]
A2314: 2266 | B2314: 3 | C2314: 4 | D2314: 0 | E2314: 91 | F2314: 100 | G2314: 2 | H2314: 10000 | I2314: 110003 | J2314: 2 | K2314: [{7,3},{8,3},{9,3},{10,3},{11,3},{12,3},{17,10},{18,8},{19,1},{23,4},{24,10}] | L2314: [{7,27},{8,55},{9,27},{10,55},{11,27},{12,55},{17,18},{18,110},{19,3},{23,37},{24,37}] | M2314: [{0,1,[1,30]},{1,2,[11,40]},{2,5,[21,50]},{5,10,[31,60]},{10,20,[41,60]},{30,20,[51,70]},{50,10,[61,80]},{70,5,[71,80]},{100,2,[81,90]},{150,1,[91,100]}]
A2315: 2267 | B2315: 4 | C2315: 4 | D2315: 0 | E2315: 91 | F2315: 100 | G2315: 3 | H2315: 15000 | I2315: 110003 | J2315: 3 | K2315: [{7,3},{8,3},{9,3},{10,3},{11,3},{12,3},{17,10},{18,8},{19,1},{23,4},{24,10}] | L2315: [{7,27},{8,55},{9,27},{10,55},{11,27},{12,55},{17,18},{18,110},{19,3},{23,37},{24,37}] | M2315: [{0,1,[1,30]},{1,2,[11,40]},{2,5,[21,50]},{5,10,[31,60]},{10,20,[41,60]},{30,20,[51,70]},{50,10,[61,80]},{70,5,[71,80]},{100,2,[81,90]},{150,1,[91,100]}]
A2316: 2268 | B2316: 5 | C2316: 4 | D2316: 0 | E2316: 91 | F2316: 100 | G2316: 4 | H2316: 20000 | I2316: 110003 | J2316: 4 | K2316: [{7,3},{8,3},{9,3},{10,3},{11,3},{12,3},{17,10},{18,8},{19,1},{23,4},{24,10}] | L2316: [{7,27},{8,55},{9,27},{10,55},{11,27},{12,55},{17,18},{18,110},{19,3},{23,37},{24,37}] | M2316: [{0,1,[1,30]},{1,2,[11,40]},{2,5,[21,50]},{5,10,[31,60]},{10,20,[41,60]},{30,20,[51,70]},{50,10,[61,80]},{70,5,[71,80]},{100,2,[81,90]},{150,1,[91,100]}]
A2317: 2269 | B2317: 6 | C2317: 4 | D2317: 0 | E2317: 91 | F2317: 100 | G2317: 5 | H2317: 20000 | I2317: 110003 | J2317: 5 | K2317: [{7,3},{8,3},{9,3},{10,3},{11,3},{12,3},{17,10},{18,8},{19,1},{23,4},{24,10}] | L2317: [{7,27},{8,55},{9,27},{10,55},{11,27},{12,55},{17,18},{18,110},{19,3},{23,37},{24,37}] | M2317: [{0,1,[1,30]},{1,2,[11,40]},{2,5,[21,50]},{5,10,[31,60]},{10,20,[41,60]},{30,20,[51,70]},{50,10,[61,80]},{70,5,[71,80]},{100,2,[81,90]},{150,1,[91,100]}]
A2318: 2270 | B2318: 2 | C2318: 6 | D2318: 0 | E2318: 91 | F2318: 100 | G2318: 1 | H2318: 5000 | I2318: 110003 | J2318: 1 | K2318: [{7,3},{8,3},{9,3},{10,3},{11,3},{12,3},{17,10},{18,8},{19,1},{23,4},{24,10}] | L2318: [{7,27},{8,55},{9,27},{10,55},{11,27},{12,55},{17,18},{18,110},{19,3},{23,37},{24,37}] | M2318: [{0,1,[1,30]},{1,2,[11,40]},{2,5,[21,50]},{5,10,[31,60]},{10,20,[41,60]},{30,20,[51,70]},{50,10,[61,80]},{70,5,[71,80]},{100,2,[81,90]},{150,1,[91,100]}]
A2319: 2271 | B2319: 3 | C2319: 6 | D2319: 0 | E2319: 91 | F2319: 100 | G2319: 2 | H2319: 10000 | I2319: 110003 | J2319: 2 | K2319: [{7,3},{8,3},{9,3},{10,3},{11,3},{12,3},{17,10},{18,8},{19,1},{23,4},{24,10}] | L2319: [{7,27},{8,55},{9,27},{10,55},{11,27},{12,55},{17,18},{18,110},{19,3},{23,37},{24,37}] | M2319: [{0,1,[1,30]},{1,2,[11,40]},{2,5,[21,50]},{5,10,[31,60]},{10,20,[41,60]},{30,20,[51,70]},{50,10,[61,80]},{70,5,[71,80]},{100,2,[81,90]},{150,1,[91,100]}]
A2320: 2272 | B2320: 4 | C2320: 6 | D2320: 0 | E2320: 91 | F2320: 100 | G2320: 3 | H2320: 15000 | I2320: 110003 | J2320: 3 | K2320: [{7,3},{8,3},{9,3},{10,3},{11,3},{12,3},{17,10},{18,8},{19,1},{23,4},{24,10}] | L2320: [{7,27},{8,55},{9,27},{10,55},{11,27},{12,55},{17,18},{18,110},{19,3},{23,37},{24,37}] | M2320: [{0,1,[1,30]},{1,2,[11,40]},{2,5,[21,50]},{5,10,[31,60]},{10,20,[41,60]},{30,20,[51,70]},{50,10,[61,80]},{70,5,[71,80]},{100,2,[81,90]},{150,1,[91,100]}]
A2321: 2273 | B2321: 5 | C2321: 6 | D2321: 0 | E2321: 91 | F2321: 100 | G2321: 4 | H2321: 20000 | I2321: 110003 | J2321: 4 | K2321: [{7,3},{8,3},{9,3},{10,3},{11,3},{12,3},{17,10},{18,8},{19,1},{23,4},{24,10}] | L2321: [{7,27},{8,55},{9,27},{10,55},{11,27},{12,55},{17,18},{18,110},{19,3},{23,37},{24,37}] | M2321: [{0,1,[1,30]},{1,2,[11,40]},{2,5,[21,50]},{5,10,[31,60]},{10,20,[41,60]},{30,20,[51,70]},{50,10,[61,80]},{70,5,[71,80]},{100,2,[81,90]},{150,1,[91,100]}]
A2322: 2274 | B2322: 6 | C2322: 6 | D2322: 0 | E2322: 91 | F2322: 100 | G2322: 5 | H2322: 20000 | I2322: 110003 | J2322: 5 | K2322: [{7,3},{8,3},{9,3},{10,3},{11,3},{12,3},{17,10},{18,8},{19,1},{23,4},{24,10}] | L2322: [{7,27},{8,55},{9,27},{10,55},{11,27},{12,55},{17,18},{18,110},{19,3},{23,37},{24,37}] | M2322: [{0,1,[1,30]},{1,2,[11,40]},{2,5,[21,50]},{5,10,[31,60]},{10,20,[41,60]},{30,20,[51,70]},{50,10,[61,80]},{70,5,[71,80]},{100,2,[81,90]},{150,1,[91,100]}]
A2323: 2275 | B2323: 2 | C2323: 7 | D2323: 0 | E2323: 91 | F2323: 100 | G2323: 1 | H2323: 5000 | I2323: 110003 | J2323: 1 | K2323: [{7,3},{8,3},{9,3},{10,3},{11,3},{12,3},{17,10},{18,8},{19,1},{23,4},{24,10}] | L2323: [{7,27},{8,55},{9,27},{10,55},{11,27},{12,55},{17,18},{18,110},{19,3},{23,37},{24,37}] | M2323: [{0,1,[1,30]},{1,2,[11,40]},{2,5,[21,50]},{5,10,[31,60]},{10,20,[41,60]},{30,20,[51,70]},{50,10,[61,80]},{70,5,[71,80]},{100,2,[81,90]},{150,1,[91,100]}]
A2324: 2276 | B2324: 3 | C2324: 7 | D2324: 0 | E2324: 91 | F2324: 100 | G2324: 2 | H2324: 10000 | I2324: 110003 | J2324: 2 | K2324: [{7,3},{8,3},{9,3},{10,3},{11,3},{12,3},{17,10},{18,8},{19,1},{23,4},{24,10}] | L2324: [{7,27},{8,55},{9,27},{10,55},{11,27},{12,55},{17,18},{18,110},{19,3},{23,37},{24,37}] | M2324: [{0,1,[1,30]},{1,2,[11,40]},{2,5,[21,50]},{5,10,[31,60]},{10,20,[41,60]},{30,20,[51,70]},{50,10,[61,80]},{70,5,[71,80]},{100,2,[81,90]},{150,1,[91,100]}]
A2325: 2277 | B2325: 4 | C2325: 7 | D2325: 0 | E2325: 91 | F2325: 100 | G2325: 3 | H2325: 15000 | I2325: 110003 | J2325: 3 | K2325: [{7,3},{8,3},{9,3},{10,3},{11,3},{12,3},{17,10},{18,8},{19,1},{23,4},{24,10}] | L2325: [{7,27},{8,55},{9,27},{10,55},{11,27},{12,55},{17,18},{18,110},{19,3},{23,37},{24,37}] | M2325: [{0,1,[1,30]},{1,2,[11,40]},{2,5,[21,50]},{5,10,[31,60]},{10,20,[41,60]},{30,20,[51,70]},{50,10,[61,80]},{70,5,[71,80]},{100,2,[81,90]},{150,1,[91,100]}]
A2326: 2278 | B2326: 5 | C2326: 7 | D2326: 0 | E2326: 91 | F2326: 100 | G2326: 4 | H2326: 20000 | I2326: 110003 | J2326: 4 | K2326: [{7,3},{8,3},{9,3},{10,3},{11,3},{12,3},{17,10},{18,8},{19,1},{23,4},{24,10}] | L2326: [{7,27},{8,55},{9,27},{10,55},{11,27},{12,55},{17,18},{18,110},{19,3},{23,37},{24,37}] | M2326: [{0,1,[1,30]},{1,2,[11,40]},{2,5,[21,50]},{5,10,[31,60]},{10,20,[41,60]},{30,20,[51,70]},{50,10,[61,80]},{70,5,[71,80]},{100,2,[81,90]},{150,1,[91,100]}]
A2327: 2279 | B2327: 6 | C2327: 7 | D2327: 0 | E2327: 91 | F2327: 100 | G2327: 5 | H2327: 20000 | I2327: 110003 | J2327: 5 | K2327: [{7,3},{8,3},{9,3},{10,3},{11,3},{12,3},{17,10},{18,8},{19,1},{23,4},{24,10}] | L2327: [{7,27},{8,55},{9,27},{10,55},{11,27},{12,55},{17,18},{18,110},{19,3},{23,37},{24,37}] | M2327: [{0,1,[1,30]},{1,2,[11,40]},{2,5,[21,50]},{5,10,[31,60]},{10,20,[41,60]},{30,20,[51,70]},{50,10,[61,80]},{70,5,[71,80]},{100,2,[81,90]},{150,1,[91,100]}]
A2328: 2280 | B2328: 2 | C2328: 2 | D2328: 1000 | E2328: 91 | F2328: 100 | G2328: 1 | H2328: 5000 | I2328: 110003 | J2328: 1 | K2328: [{5,10},{6,15},{13,10},{14,5},{15,10},{16,5},{20,1},{27,10},{28,10}] | L2328: [{5,1113},{6,1113},{13,18},{14,37},{15,18},{16,37},{20,3},{27,18},{28,18}] | M2328: [{0,1,[1,30]},{1,2,[11,40]},{2,5,[21,50]},{5,10,[31,60]},{10,20,[41,60]},{30,20,[51,70]},{50,10,[61,80]},{70,5,[71,80]},{100,2,[81,90]},{150,1,[91,100]}]
A2329: 2281 | B2329: 3 | C2329: 2 | D2329: 1000 | E2329: 91 | F2329: 100 | G2329: 2 | H2329: 10000 | I2329: 110003 | J2329: 2 | K2329: [{5,10},{6,15},{13,10},{14,5},{15,10},{16,5},{20,1},{27,10},{28,10}] | L2329: [{5,1113},{6,1113},{13,18},{14,37},{15,18},{16,37},{20,3},{27,18},{28,18}] | M2329: [{0,1,[1,30]},{1,2,[11,40]},{2,5,[21,50]},{5,10,[31,60]},{10,20,[41,60]},{30,20,[51,70]},{50,10,[61,80]},{70,5,[71,80]},{100,2,[81,90]},{150,1,[91,100]}]
A2330: 2282 | B2330: 4 | C2330: 2 | D2330: 1000 | E2330: 91 | F2330: 100 | G2330: 3 | H2330: 15000 | I2330: 110003 | J2330: 3 | K2330: [{5,10},{6,15},{13,10},{14,5},{15,10},{16,5},{20,1},{27,10},{28,10}] | L2330: [{5,1113},{6,1113},{13,18},{14,37},{15,18},{16,37},{20,3},{27,18},{28,18}] | M2330: [{0,1,[1,30]},{1,2,[11,40]},{2,5,[21,50]},{5,10,[31,60]},{10,20,[41,60]},{30,20,[51,70]},{50,10,[61,80]},{70,5,[71,80]},{100,2,[81,90]},{150,1,[91,100]}]
A2331: 2283 | B2331: 5 | C2331: 2 | D2331: 1000 | E2331: 91 | F2331: 100 | G2331: 4 | H2331: 20000 | I2331: 110003 | J2331: 4 | K2331: [{5,10},{6,15},{13,10},{14,5},{15,10},{16,5},{20,1},{27,10},{28,10}] | L2331: [{5,1113},{6,1113},{13,18},{14,37},{15,18},{16,37},{20,3},{27,18},{28,18}] | M2331: [{0,1,[1,30]},{1,2,[11,40]},{2,5,[21,50]},{5,10,[31,60]},{10,20,[41,60]},{30,20,[51,70]},{50,10,[61,80]},{70,5,[71,80]},{100,2,[81,90]},{150,1,[91,100]}]
A2332: 2284 | B2332: 6 | C2332: 2 | D2332: 1000 | E2332: 91 | F2332: 100 | G2332: 5 | H2332: 20000 | I2332: 110003 | J2332: 5 | K2332: [{5,10},{6,15},{13,10},{14,5},{15,10},{16,5},{20,1},{27,10},{28,10}] | L2332: [{5,1113},{6,1113},{13,18},{14,37},{15,18},{16,37},{20,3},{27,18},{28,18}] | M2332: [{0,1,[1,30]},{1,2,[11,40]},{2,5,[21,50]},{5,10,[31,60]},{10,20,[41,60]},{30,20,[51,70]},{50,10,[61,80]},{70,5,[71,80]},{100,2,[81,90]},{150,1,[91,100]}]
A2333: 2285 | B2333: 2 | C2333: 3 | D2333: 1000 | E2333: 91 | F2333: 100 | G2333: 1 | H2333: 5000 | I2333: 110003 | J2333: 1 | K2333: [{5,10},{6,15},{13,10},{14,5},{15,10},{16,5},{20,1},{27,10},{28,10}] | L2333: [{5,1113},{6,1113},{13,18},{14,37},{15,18},{16,37},{20,3},{27,18},{28,18}] | M2333: [{0,1,[1,30]},{1,2,[11,40]},{2,5,[21,50]},{5,10,[31,60]},{10,20,[41,60]},{30,20,[51,70]},{50,10,[61,80]},{70,5,[71,80]},{100,2,[81,90]},{150,1,[91,100]}]
A2334: 2286 | B2334: 3 | C2334: 3 | D2334: 1000 | E2334: 91 | F2334: 100 | G2334: 2 | H2334: 10000 | I2334: 110003 | J2334: 2 | K2334: [{5,10},{6,15},{13,10},{14,5},{15,10},{16,5},{20,1},{27,10},{28,10}] | L2334: [{5,1113},{6,1113},{13,18},{14,37},{15,18},{16,37},{20,3},{27,18},{28,18}] | M2334: [{0,1,[1,30]},{1,2,[11,40]},{2,5,[21,50]},{5,10,[31,60]},{10,20,[41,60]},{30,20,[51,70]},{50,10,[61,80]},{70,5,[71,80]},{100,2,[81,90]},{150,1,[91,100]}]
A2335: 2287 | B2335: 4 | C2335: 3 | D2335: 1000 | E2335: 91 | F2335: 100 | G2335: 3 | H2335: 15000 | I2335: 110003 | J2335: 3 | K2335: [{5,10},{6,15},{13,10},{14,5},{15,10},{16,5},{20,1},{27,10},{28,10}] | L2335: [{5,1113},{6,1113},{13,18},{14,37},{15,18},{16,37},{20,3},{27,18},{28,18}] | M2335: [{0,1,[1,30]},{1,2,[11,40]},{2,5,[21,50]},{5,10,[31,60]},{10,20,[41,60]},{30,20,[51,70]},{50,10,[61,80]},{70,5,[71,80]},{100,2,[81,90]},{150,1,[91,100]}]
A2336: 2288 | B2336: 5 | C2336: 3 | D2336: 1000 | E2336: 91 | F2336: 100 | G2336: 4 | H2336: 20000 | I2336: 110003 | J2336: 4 | K2336: [{5,10},{6,15},{13,10},{14,5},{15,10},{16,5},{20,1},{27,10},{28,10}] | L2336: [{5,1113},{6,1113},{13,18},{14,37},{15,18},{16,37},{20,3},{27,18},{28,18}] | M2336: [{0,1,[1,30]},{1,2,[11,40]},{2,5,[21,50]},{5,10,[31,60]},{10,20,[41,60]},{30,20,[51,70]},{50,10,[61,80]},{70,5,[71,80]},{100,2,[81,90]},{150,1,[91,100]}]
A2337: 2289 | B2337: 6 | C2337: 3 | D2337: 1000 | E2337: 91 | F2337: 100 | G2337: 5 | H2337: 20000 | I2337: 110003 | J2337: 5 | K2337: [{5,10},{6,15},{13,10},{14,5},{15,10},{16,5},{20,1},{27,10},{28,10}] | L2337: [{5,1113},{6,1113},{13,18},{14,37},{15,18},{16,37},{20,3},{27,18},{28,18}] | M2337: [{0,1,[1,30]},{1,2,[11,40]},{2,5,[21,50]},{5,10,[31,60]},{10,20,[41,60]},{30,20,[51,70]},{50,10,[61,80]},{70,5,[71,80]},{100,2,[81,90]},{150,1,[91,100]}]
A2338: 2290 | B2338: 2 | C2338: 8 | D2338: 1000 | E2338: 91 | F2338: 100 | G2338: 1 | H2338: 5000 | I2338: 110003 | J2338: 1 | K2338: [{5,10},{6,15},{13,10},{14,5},{15,10},{16,5},{20,1},{27,10},{28,10}] | L2338: [{5,1113},{6,1113},{13,18},{14,37},{15,18},{16,37},{20,3},{27,18},{28,18}] | M2338: [{0,1,[1,30]},{1,2,[11,40]},{2,5,[21,50]},{5,10,[31,60]},{10,20,[41,60]},{30,20,[51,70]},{50,10,[61,80]},{70,5,[71,80]},{100,2,[81,90]},{150,1,[91,100]}]
A2339: 2291 | B2339: 3 | C2339: 8 | D2339: 1000 | E2339: 91 | F2339: 100 | G2339: 2 | H2339: 10000 | I2339: 110003 | J2339: 2 | K2339: [{5,10},{6,15},{13,10},{14,5},{15,10},{16,5},{20,1},{27,10},{28,10}] | L2339: [{5,1113},{6,1113},{13,18},{14,37},{15,18},{16,37},{20,3},{27,18},{28,18}] | M2339: [{0,1,[1,30]},{1,2,[11,40]},{2,5,[21,50]},{5,10,[31,60]},{10,20,[41,60]},{30,20,[51,70]},{50,10,[61,80]},{70,5,[71,80]},{100,2,[81,90]},{150,1,[91,100]}]
A2340: 2292 | B2340: 4 | C2340: 8 | D2340: 1000 | E2340: 91 | F2340: 100 | G2340: 3 | H2340: 15000 | I2340: 110003 | J2340: 3 | K2340: [{5,10},{6,15},{13,10},{14,5},{15,10},{16,5},{20,1},{27,10},{28,10}] | L2340: [{5,1113},{6,1113},{13,18},{14,37},{15,18},{16,37},{20,3},{27,18},{28,18}] | M2340: [{0,1,[1,30]},{1,2,[11,40]},{2,5,[21,50]},{5,10,[31,60]},{10,20,[41,60]},{30,20,[51,70]},{50,10,[61,80]},{70,5,[71,80]},{100,2,[81,90]},{150,1,[91,100]}]
A2341: 2293 | B2341: 5 | C2341: 8 | D2341: 1000 | E2341: 91 | F2341: 100 | G2341: 4 | H2341: 20000 | I2341: 110003 | J2341: 4 | K2341: [{5,10},{6,15},{13,10},{14,5},{15,10},{16,5},{20,1},{27,10},{28,10}] | L2341: [{5,1113},{6,1113},{13,18},{14,37},{15,18},{16,37},{20,3},{27,18},{28,18}] | M2341: [{0,1,[1,30]},{1,2,[11,40]},{2,5,[21,50]},{5,10,[31,60]},{10,20,[41,60]},{30,20,[51,70]},{50,10,[61,80]},{70,5,[71,80]},{100,2,[81,90]},{150,1,[91,100]}]
A2342: 2294 | B2342: 6 | C2342: 8 | D2342: 1000 | E2342: 91 | F2342: 100 | G2342: 5 | H2342: 20000 | I2342: 110003 | J2342: 5 | K2342: [{5,10},{6,15},{13,10},{14,5},{15,10},{16,5},{20,1},{27,10},{28,10}] | L2342: [{5,1113},{6,1113},{13,18},{14,37},{15,18},{16,37},{20,3},{27,18},{28,18}] | M2342: [{0,1,[1,30]},{1,2,[11,40]},{2,5,[21,50]},{5,10,[31,60]},{10,20,[41,60]},{30,20,[51,70]},{50,10,[61,80]},{70,5,[71,80]},{100,2,[81,90]},{150,1,[91,100]}]
A2343: 2295 | B2343: 2 | C2343: 10 | D2343: 1000 | E2343: 91 | F2343: 100 | G2343: 1 | H2343: 5000 | I2343: 110003 | J2343: 1 | K2343: [{5,10},{6,15},{13,10},{14,5},{15,10},{16,5},{20,1},{27,10},{28,10}] | L2343: [{5,1113},{6,1113},{13,18},{14,37},{15,18},{16,37},{20,3},{27,18},{28,18}] | M2343: [{0,1,[1,30]},{1,2,[11,40]},{2,5,[21,50]},{5,10,[31,60]},{10,20,[41,60]},{30,20,[51,70]},{50,10,[61,80]},{70,5,[71,80]},{100,2,[81,90]},{150,1,[91,100]}]
A2344: 2296 | B2344: 3 | C2344: 10 | D2344: 1000 | E2344: 91 | F2344: 100 | G2344: 2 | H2344: 10000 | I2344: 110003 | J2344: 2 | K2344: [{5,10},{6,15},{13,10},{14,5},{15,10},{16,5},{20,1},{27,10},{28,10}] | L2344: [{5,1113},{6,1113},{13,18},{14,37},{15,18},{16,37},{20,3},{27,18},{28,18}] | M2344: [{0,1,[1,30]},{1,2,[11,40]},{2,5,[21,50]},{5,10,[31,60]},{10,20,[41,60]},{30,20,[51,70]},{50,10,[61,80]},{70,5,[71,80]},{100,2,[81,90]},{150,1,[91,100]}]
A2345: 2297 | B2345: 4 | C2345: 10 | D2345: 1000 | E2345: 91 | F2345: 100 | G2345: 3 | H2345: 15000 | I2345: 110003 | J2345: 3 | K2345: [{5,10},{6,15},{13,10},{14,5},{15,10},{16,5},{20,1},{27,10},{28,10}] | L2345: [{5,1113},{6,1113},{13,18},{14,37},{15,18},{16,37},{20,3},{27,18},{28,18}] | M2345: [{0,1,[1,30]},{1,2,[11,40]},{2,5,[21,50]},{5,10,[31,60]},{10,20,[41,60]},{30,20,[51,70]},{50,10,[61,80]},{70,5,[71,80]},{100,2,[81,90]},{150,1,[91,100]}]
A2346: 2298 | B2346: 5 | C2346: 10 | D2346: 1000 | E2346: 91 | F2346: 100 | G2346: 4 | H2346: 20000 | I2346: 110003 | J2346: 4 | K2346: [{5,10},{6,15},{13,10},{14,5},{15,10},{16,5},{20,1},{27,10},{28,10}] | L2346: [{5,1113},{6,1113},{13,18},{14,37},{15,18},{16,37},{20,3},{27,18},{28,18}] | M2346: [{0,1,[1,30]},{1,2,[11,40]},{2,5,[21,50]},{5,10,[31,60]},{10,20,[41,60]},{30,20,[51,70]},{50,10,[61,80]},{70,5,[71,80]},{100,2,[81,90]},{150,1,[91,100]}]
A2347: 2299 | B2347: 6 | C2347: 10 | D2347: 1000 | E2347: 91 | F2347: 100 | G2347: 5 | H2347: 20000 | I2347: 110003 | J2347: 5 | K2347: [{5,10},{6,15},{13,10},{14,5},{15,10},{16,5},{20,1},{27,10},{28,10}] | L2347: [{5,1113},{6,1113},{13,18},{14,37},{15,18},{16,37},{20,3},{27,18},{28,18}] | M2347: [{0,1,[1,30]},{1,2,[11,40]},{2,5,[21,50]},{5,10,[31,60]},{10,20,[41,60]},{30,20,[51,70]},{50,10,[61,80]},{70,5,[71,80]},{100,2,[81,90]},{150,1,[91,100]}]
A2348: 2300 | B2348: 2 | C2348: 2 | D2348: 2000 | E2348: 91 | F2348: 100 | G2348: 1 | H2348: 5000 | I2348: 110003 | J2348: 1 | K2348: [{5,10},{6,15},{13,10},{14,5},{15,10},{16,5},{20,1},{27,10},{28,10}] | L2348: [{5,1113},{6,1113},{13,18},{14,37},{15,18},{16,37},{20,3},{27,18},{28,18}] | M2348: [{0,1,[1,30]},{1,2,[11,40]},{2,5,[21,50]},{5,10,[31,60]},{10,20,[41,60]},{30,20,[51,70]},{50,10,[61,80]},{70,5,[71,80]},{100,2,[81,90]},{150,1,[91,100]}]
A2349: 2301 | B2349: 3 | C2349: 2 | D2349: 2000 | E2349: 91 | F2349: 100 | G2349: 2 | H2349: 10000 | I2349: 110003 | J2349: 2 | K2349: [{5,10},{6,15},{13,10},{14,5},{15,10},{16,5},{20,1},{27,10},{28,10}] | L2349: [{5,1113},{6,1113},{13,18},{14,37},{15,18},{16,37},{20,3},{27,18},{28,18}] | M2349: [{0,1,[1,30]},{1,2,[11,40]},{2,5,[21,50]},{5,10,[31,60]},{10,20,[41,60]},{30,20,[51,70]},{50,10,[61,80]},{70,5,[71,80]},{100,2,[81,90]},{150,1,[91,100]}]
A2350: 2302 | B2350: 4 | C2350: 2 | D2350: 2000 | E2350: 91 | F2350: 100 | G2350: 3 | H2350: 15000 | I2350: 110003 | J2350: 3 | K2350: [{5,10},{6,15},{13,10},{14,5},{15,10},{16,5},{20,1},{27,10},{28,10}] | L2350: [{5,1113},{6,1113},{13,18},{14,37},{15,18},{16,37},{20,3},{27,18},{28,18}] | M2350: [{0,1,[1,30]},{1,2,[11,40]},{2,5,[21,50]},{5,10,[31,60]},{10,20,[41,60]},{30,20,[51,70]},{50,10,[61,80]},{70,5,[71,80]},{100,2,[81,90]},{150,1,[91,100]}]
A2351: 2303 | B2351: 5 | C2351: 2 | D2351: 2000 | E2351: 91 | F2351: 100 | G2351: 4 | H2351: 20000 | I2351: 110003 | J2351: 4 | K2351: [{5,10},{6,15},{13,10},{14,5},{15,10},{16,5},{20,1},{27,10},{28,10}] | L2351: [{5,1113},{6,1113},{13,18},{14,37},{15,18},{16,37},{20,3},{27,18},{28,18}] | M2351: [{0,1,[1,30]},{1,2,[11,40]},{2,5,[21,50]},{5,10,[31,60]},{10,20,[41,60]},{30,20,[51,70]},{50,10,[61,80]},{70,5,[71,80]},{100,2,[81,90]},{150,1,[91,100]}]
A2352: 2304 | B2352: 6 | C2352: 2 | D2352: 2000 | E2352: 91 | F2352: 100 | G2352: 5 | H2352: 20000 | I2352: 110003 | J2352: 5 | K2352: [{5,10},{6,15},{13,10},{14,5},{15,10},{16,5},{20,1},{27,10},{28,10}] | L2352: [{5,1113},{6,1113},{13,18},{14,37},{15,18},{16,37},{20,3},{27,18},{28,18}] | M2352: [{0,1,[1,30]},{1,2,[11,40]},{2,5,[21,50]},{5,10,[31,60]},{10,20,[41,60]},{30,20,[51,70]},{50,10,[61,80]},{70,5,[71,80]},{100,2,[81,90]},{150,1,[91,100]}]
A2353: 2305 | B2353: 2 | C2353: 3 | D2353: 2000 | E2353: 91 | F2353: 100 | G2353: 1 | H2353: 5000 | I2353: 110003 | J2353: 1 | K2353: [{5,10},{6,15},{13,10},{14,5},{15,10},{16,5},{20,1},{27,10},{28,10}] | L2353: [{5,1113},{6,1113},{13,18},{14,37},{15,18},{16,37},{20,3},{27,18},{28,18}] | M2353: [{0,1,[1,30]},{1,2,[11,40]},{2,5,[21,50]},{5,10,[31,60]},{10,20,[41,60]},{30,20,[51,70]},{50,10,[61,80]},{70,5,[71,80]},{100,2,[81,90]},{150,1,[91,100]}]
A2354: 2306 | B2354: 3 | C2354: 3 | D2354: 2000 | E2354: 91 | F2354: 100 | G2354: 2 | H2354: 10000 | I2354: 110003 | J2354: 2 | K2354: [{5,10},{6,15},{13,10},{14,5},{15,10},{16,5},{20,1},{27,10},{28,10}] | L2354: [{5,1113},{6,1113},{13,18},{14,37},{15,18},{16,37},{20,3},{27,18},{28,18}] | M2354: [{0,1,[1,30]},{1,2,[11,40]},{2,5,[21,50]},{5,10,[31,60]},{10,20,[41,60]},{30,20,[51,70]},{50,10,[61,80]},{70,5,[71,80]},{100,2,[81,90]},{150,1,[91,100]}]
A2355: 2307 | B2355: 4 | C2355: 3 | D2355: 2000 | E2355: 91 | F2355: 100 | G2355: 3 | H2355: 15000 | I2355: 110003 | J2355: 3 | K2355: [{5,10},{6,15},{13,10},{14,5},{15,10},{16,5},{20,1},{27,10},{28,10}] | L2355: [{5,1113},{6,1113},{13,18},{14,37},{15,18},{16,37},{20,3},{27,18},{28,18}] | M2355: [{0,1,[1,30]},{1,2,[11,40]},{2,5,[21,50]},{5,10,[31,60]},{10,20,[41,60]},{30,20,[51,70]},{50,10,[61,80]},{70,5,[71,80]},{100,2,[81,90]},{150,1,[91,100]}]
A2356: 2308 | B2356: 5 | C2356: 3 | D2356: 2000 | E2356: 91 | F2356: 100 | G2356: 4 | H2356: 20000 | I2356: 110003 | J2356: 4 | K2356: [{5,10},{6,15},{13,10},{14,5},{15,10},{16,5},{20,1},{27,10},{28,10}] | L2356: [{5,1113},{6,1113},{13,18},{14,37},{15,18},{16,37},{20,3},{27,18},{28,18}] | M2356: [{0,1,[1,30]},{1,2,[11,40]},{2,5,[21,50]},{5,10,[31,60]},{10,20,[41,60]},{30,20,[51,70]},{50,10,[61,80]},{70,5,[71,80]},{100,2,[81,90]},{150,1,[91,100]}]
A2357: 2309 | B2357: 6 | C2357: 3 | D2357: 2000 | E2357: 91 | F2357: 100 | G2357: 5 | H2357: 20000 | I2357: 110003 | J2357: 5 | K2357: [{5,10},{6,15},{13,10},{14,5},{15,10},{16,5},{20,1},{27,10},{28,10}] | L2357: [{5,1113},{6,1113},{13,18},{14,37},{15,18},{16,37},{20,3},{27,18},{28,18}] | M2357: [{0,1,[1,30]},{1,2,[11,40]},{2,5,[21,50]},{5,10,[31,60]},{10,20,[41,60]},{30,20,[51,70]},{50,10,[61,80]},{70,5,[71,80]},{100,2,[81,90]},{150,1,[91,100]}]
A2358: 2310 | B2358: 2 | C2358: 8 | D2358: 2000 | E2358: 91 | F2358: 100 | G2358: 1 | H2358: 5000 | I2358: 110003 | J2358: 1 | K2358: [{5,10},{6,15},{13,10},{14,5},{15,10},{16,5},{20,1},{27,10},{28,10}] | L2358: [{5,1113},{6,1113},{13,18},{14,37},{15,18},{16,37},{20,3},{27,18},{28,18}] | M2358: [{0,1,[1,30]},{1,2,[11,40]},{2,5,[21,50]},{5,10,[31,60]},{10,20,[41,60]},{30,20,[51,70]},{50,10,[61,80]},{70,5,[71,80]},{100,2,[81,90]},{150,1,[91,100]}]
A2359: 2311 | B2359: 3 | C2359: 8 | D2359: 2000 | E2359: 91 | F2359: 100 | G2359: 2 | H2359: 10000 | I2359: 110003 | J2359: 2 | K2359: [{5,10},{6,15},{13,10},{14,5},{15,10},{16,5},{20,1},{27,10},{28,10}] | L2359: [{5,1113},{6,1113},{13,18},{14,37},{15,18},{16,37},{20,3},{27,18},{28,18}] | M2359: [{0,1,[1,30]},{1,2,[11,40]},{2,5,[21,50]},{5,10,[31,60]},{10,20,[41,60]},{30,20,[51,70]},{50,10,[61,80]},{70,5,[71,80]},{100,2,[81,90]},{150,1,[91,100]}]
A2360: 2312 | B2360: 4 | C2360: 8 | D2360: 2000 | E2360: 91 | F2360: 100 | G2360: 3 | H2360: 15000 | I2360: 110003 | J2360: 3 | K2360: [{5,10},{6,15},{13,10},{14,5},{15,10},{16,5},{20,1},{27,10},{28,10}] | L2360: [{5,1113},{6,1113},{13,18},{14,37},{15,18},{16,37},{20,3},{27,18},{28,18}] | M2360: [{0,1,[1,30]},{1,2,[11,40]},{2,5,[21,50]},{5,10,[31,60]},{10,20,[41,60]},{30,20,[51,70]},{50,10,[61,80]},{70,5,[71,80]},{100,2,[81,90]},{150,1,[91,100]}]
A2361: 2313 | B2361: 5 | C2361: 8 | D2361: 2000 | E2361: 91 | F2361: 100 | G2361: 4 | H2361: 20000 | I2361: 110003 | J2361: 4 | K2361: [{5,10},{6,15},{13,10},{14,5},{15,10},{16,5},{20,1},{27,10},{28,10}] | L2361: [{5,1113},{6,1113},{13,18},{14,37},{15,18},{16,37},{20,3},{27,18},{28,18}] | M2361: [{0,1,[1,30]},{1,2,[11,40]},{2,5,[21,50]},{5,10,[31,60]},{10,20,[41,60]},{30,20,[51,70]},{50,10,[61,80]},{70,5,[71,80]},{100,2,[81,90]},{150,1,[91,100]}]
A2362: 2314 | B2362: 6 | C2362: 8 | D2362: 2000 | E2362: 91 | F2362: 100 | G2362: 5 | H2362: 20000 | I2362: 110003 | J2362: 5 | K2362: [{5,10},{6,15},{13,10},{14,5},{15,10},{16,5},{20,1},{27,10},{28,10}] | L2362: [{5,1113},{6,1113},{13,18},{14,37},{15,18},{16,37},{20,3},{27,18},{28,18}] | M2362: [{0,1,[1,30]},{1,2,[11,40]},{2,5,[21,50]},{5,10,[31,60]},{10,20,[41,60]},{30,20,[51,70]},{50,10,[61,80]},{70,5,[71,80]},{100,2,[81,90]},{150,1,[91,100]}]
A2363: 2315 | B2363: 2 | C2363: 10 | D2363: 2000 | E2363: 91 | F2363: 100 | G2363: 1 | H2363: 5000 | I2363: 110003 | J2363: 1 | K2363: [{5,10},{6,15},{13,10},{14,5},{15,10},{16,5},{20,1},{27,10},{28,10}] | L2363: [{5,1113},{6,1113},{13,18},{14,37},{15,18},{16,37},{20,3},{27,18},{28,18}] | M2363: [{0,1,[1,30]},{1,2,[11,40]},{2,5,[21,50]},{5,10,[31,60]},{10,20,[41,60]},{30,20,[51,70]},{50,10,[61,80]},{70,5,[71,80]},{100,2,[81,90]},{150,1,[91,100]}]
A2364: 2316 | B2364: 3 | C2364: 10 | D2364: 2000 | E2364: 91 | F2364: 100 | G2364: 2 | H2364: 10000 | I2364: 110003 | J2364: 2 | K2364: [{5,10},{6,15},{13,10},{14,5},{15,10},{16,5},{20,1},{27,10},{28,10}] | L2364: [{5,1113},{6,1113},{13,18},{14,37},{15,18},{16,37},{20,3},{27,18},{28,18}] | M2364: [{0,1,[1,30]},{1,2,[11,40]},{2,5,[21,50]},{5,10,[31,60]},{10,20,[41,60]},{30,20,[51,70]},{50,10,[61,80]},{70,5,[71,80]},{100,2,[81,90]},{150,1,[91,100]}]
A2365: 2317 | B2365: 4 | C2365: 10 | D2365: 2000 | E2365: 91 | F2365: 100 | G2365: 3 | H2365: 15000 | I2365: 110003 | J2365: 3 | K2365: [{5,10},{6,15},{13,10},{14,5},{15,10},{16,5},{20,1},{27,10},{28,10}] | L2365: [{5,1113},{6,1113},{13,18},{14,37},{15,18},{16,37},{20,3},{27,18},{28,18}] | M2365: [{0,1,[1,30]},{1,2,[11,40]},{2,5,[21,50]},{5,10,[31,60]},{10,20,[41,60]},{30,20,[51,70]},{50,10,[61,80]},{70,5,[71,80]},{100,2,[81,90]},{150,1,[91,100]}]
A2366: 2318 | B2366: 5 | C2366: 10 | D2366: 2000 | E2366: 91 | F2366: 100 | G2366: 4 | H2366: 20000 | I2366: 110003 | J2366: 4 | K2366: [{5,10},{6,15},{13,10},{14,5},{15,10},{16,5},{20,1},{27,10},{28,10}] | L2366: [{5,1113},{6,1113},{13,18},{14,37},{15,18},{16,37},{20,3},{27,18},{28,18}] | M2366: [{0,1,[1,30]},{1,2,[11,40]},{2,5,[21,50]},{5,10,[31,60]},{10,20,[41,60]},{30,20,[51,70]},{50,10,[61,80]},{70,5,[71,80]},{100,2,[81,90]},{150,1,[91,100]}]
A2367: 2319 | B2367: 6 | C2367: 10 | D2367: 2000 | E2367: 91 | F2367: 100 | G2367: 5 | H2367: 20000 | I2367: 110003 | J2367: 5 | K2367: [{5,10},{6,15},{13,10},{14,5},{15,10},{16,5},{20,1},{27,10},{28,10}] | L2367: [{5,1113},{6,1113},{13,18},{14,37},{15,18},{16,37},{20,3},{27,18},{28,18}] | M2367: [{0,1,[1,30]},{1,2,[11,40]},{2,5,[21,50]},{5,10,[31,60]},{10,20,[41,60]},{30,20,[51,70]},{50,10,[61,80]},{70,5,[71,80]},{100,2,[81,90]},{150,1,[91,100]}]
A2368: 2320 | B2368: 2 | C2368: 2 | D2368: 3000 | E2368: 91 | F2368: 100 | G2368: 1 | H2368: 5000 | I2368: 110003 | J2368: 1 | K2368: [{5,10},{6,15},{13,10},{14,5},{15,10},{16,5},{20,1},{27,10},{28,10}] | L2368: [{5,1113},{6,1113},{13,18},{14,37},{15,18},{16,37},{20,3},{27,18},{28,18}] | M2368: [{0,1,[1,30]},{1,2,[11,40]},{2,5,[21,50]},{5,10,[31,60]},{10,20,[41,60]},{30,20,[51,70]},{50,10,[61,80]},{70,5,[71,80]},{100,2,[81,90]},{150,1,[91,100]}]
A2369: 2321 | B2369: 3 | C2369: 2 | D2369: 3000 | E2369: 91 | F2369: 100 | G2369: 2 | H2369: 10000 | I2369: 110003 | J2369: 2 | K2369: [{5,10},{6,15},{13,10},{14,5},{15,10},{16,5},{20,1},{27,10},{28,10}] | L2369: [{5,1113},{6,1113},{13,18},{14,37},{15,18},{16,37},{20,3},{27,18},{28,18}] | M2369: [{0,1,[1,30]},{1,2,[11,40]},{2,5,[21,50]},{5,10,[31,60]},{10,20,[41,60]},{30,20,[51,70]},{50,10,[61,80]},{70,5,[71,80]},{100,2,[81,90]},{150,1,[91,100]}]
A2370: 2322 | B2370: 4 | C2370: 2 | D2370: 3000 | E2370: 91 | F2370: 100 | G2370: 3 | H2370: 15000 | I2370: 110003 | J2370: 3 | K2370: [{5,10},{6,15},{13,10},{14,5},{15,10},{16,5},{20,1},{27,10},{28,10}] | L2370: [{5,1113},{6,1113},{13,18},{14,37},{15,18},{16,37},{20,3},{27,18},{28,18}] | M2370: [{0,1,[1,30]},{1,2,[11,40]},{2,5,[21,50]},{5,10,[31,60]},{10,20,[41,60]},{30,20,[51,70]},{50,10,[61,80]},{70,5,[71,80]},{100,2,[81,90]},{150,1,[91,100]}]
A2371: 2323 | B2371: 5 | C2371: 2 | D2371: 3000 | E2371: 91 | F2371: 100 | G2371: 4 | H2371: 20000 | I2371: 110003 | J2371: 4 | K2371: [{5,10},{6,15},{13,10},{14,5},{15,10},{16,5},{20,1},{27,10},{28,10}] | L2371: [{5,1113},{6,1113},{13,18},{14,37},{15,18},{16,37},{20,3},{27,18},{28,18}] | M2371: [{0,1,[1,30]},{1,2,[11,40]},{2,5,[21,50]},{5,10,[31,60]},{10,20,[41,60]},{30,20,[51,70]},{50,10,[61,80]},{70,5,[71,80]},{100,2,[81,90]},{150,1,[91,100]}]
A2372: 2324 | B2372: 6 | C2372: 2 | D2372: 3000 | E2372: 91 | F2372: 100 | G2372: 5 | H2372: 20000 | I2372: 110003 | J2372: 5 | K2372: [{5,10},{6,15},{13,10},{14,5},{15,10},{16,5},{20,1},{27,10},{28,10}] | L2372: [{5,1113},{6,1113},{13,18},{14,37},{15,18},{16,37},{20,3},{27,18},{28,18}] | M2372: [{0,1,[1,30]},{1,2,[11,40]},{2,5,[21,50]},{5,10,[31,60]},{10,20,[41,60]},{30,20,[51,70]},{50,10,[61,80]},{70,5,[71,80]},{100,2,[81,90]},{150,1,[91,100]}]
A2373: 2325 | B2373: 2 | C2373: 3 | D2373: 3000 | E2373: 91 | F2373: 100 | G2373: 1 | H2373: 5000 | I2373: 110003 | J2373: 1 | K2373: [{5,10},{6,15},{13,10},{14,5},{15,10},{16,5},{20,1},{27,10},{28,10}] | L2373: [{5,1113},{6,1113},{13,18},{14,37},{15,18},{16,37},{20,3},{27,18},{28,18}] | M2373: [{0,1,[1,30]},{1,2,[11,40]},{2,5,[21,50]},{5,10,[31,60]},{10,20,[41,60]},{30,20,[51,70]},{50,10,[61,80]},{70,5,[71,80]},{100,2,[81,90]},{150,1,[91,100]}]
A2374: 2326 | B2374: 3 | C2374: 3 | D2374: 3000 | E2374: 91 | F2374: 100 | G2374: 2 | H2374: 10000 | I2374: 110003 | J2374: 2 | K2374: [{5,10},{6,15},{13,10},{14,5},{15,10},{16,5},{20,1},{27,10},{28,10}] | L2374: [{5,1113},{6,1113},{13,18},{14,37},{15,18},{16,37},{20,3},{27,18},{28,18}] | M2374: [{0,1,[1,30]},{1,2,[11,40]},{2,5,[21,50]},{5,10,[31,60]},{10,20,[41,60]},{30,20,[51,70]},{50,10,[61,80]},{70,5,[71,80]},{100,2,[81,90]},{150,1,[91,100]}]
A2375: 2327 | B2375: 4 | C2375: 3 | D2375: 3000 | E2375: 91 | F2375: 100 | G2375: 3 | H2375: 15000 | I2375: 110003 | J2375: 3 | K2375: [{5,10},{6,15},{13,10},{14,5},{15,10},{16,5},{20,1},{27,10},{28,10}] | L2375: [{5,1113},{6,1113},{13,18},{14,37},{15,18},{16,37},{20,3},{27,18},{28,18}] | M2375: [{0,1,[1,30]},{1,2,[11,40]},{2,5,[21,50]},{5,10,[31,60]},{10,20,[41,60]},{30,20,[51,70]},{50,10,[61,80]},{70,5,[71,80]},{100,2,[81,90]},{150,1,[91,100]}]
A2376: 2328 | B2376: 5 | C2376: 3 | D2376: 3000 | E2376: 91 | F2376: 100 | G2376: 4 | H2376: 20000 | I2376: 110003 | J2376: 4 | K2376: [{5,10},{6,15},{13,10},{14,5},{15,10},{16,5},{20,1},{27,10},{28,10}] | L2376: [{5,1113},{6,1113},{13,18},{14,37},{15,18},{16,37},{20,3},{27,18},{28,18}] | M2376: [{0,1,[1,30]},{1,2,[11,40]},{2,5,[21,50]},{5,10,[31,60]},{10,20,[41,60]},{30,20,[51,70]},{50,10,[61,80]},{70,5,[71,80]},{100,2,[81,90]},{150,1,[91,100]}]
A2377: 2329 | B2377: 6 | C2377: 3 | D2377: 3000 | E2377: 91 | F2377: 100 | G2377: 5 | H2377: 20000 | I2377: 110003 | J2377: 5 | K2377: [{5,10},{6,15},{13,10},{14,5},{15,10},{16,5},{20,1},{27,10},{28,10}] | L2377: [{5,1113},{6,1113},{13,18},{14,37},{15,18},{16,37},{20,3},{27,18},{28,18}] | M2377: [{0,1,[1,30]},{1,2,[11,40]},{2,5,[21,50]},{5,10,[31,60]},{10,20,[41,60]},{30,20,[51,70]},{50,10,[61,80]},{70,5,[71,80]},{100,2,[81,90]},{150,1,[91,100]}]
A2378: 2330 | B2378: 2 | C2378: 8 | D2378: 3000 | E2378: 91 | F2378: 100 | G2378: 1 | H2378: 5000 | I2378: 110003 | J2378: 1 | K2378: [{5,10},{6,15},{13,10},{14,5},{15,10},{16,5},{20,1},{27,10},{28,10}] | L2378: [{5,1113},{6,1113},{13,18},{14,37},{15,18},{16,37},{20,3},{27,18},{28,18}] | M2378: [{0,1,[1,30]},{1,2,[11,40]},{2,5,[21,50]},{5,10,[31,60]},{10,20,[41,60]},{30,20,[51,70]},{50,10,[61,80]},{70,5,[71,80]},{100,2,[81,90]},{150,1,[91,100]}]
A2379: 2331 | B2379: 3 | C2379: 8 | D2379: 3000 | E2379: 91 | F2379: 100 | G2379: 2 | H2379: 10000 | I2379: 110003 | J2379: 2 | K2379: [{5,10},{6,15},{13,10},{14,5},{15,10},{16,5},{20,1},{27,10},{28,10}] | L2379: [{5,1113},{6,1113},{13,18},{14,37},{15,18},{16,37},{20,3},{27,18},{28,18}] | M2379: [{0,1,[1,30]},{1,2,[11,40]},{2,5,[21,50]},{5,10,[31,60]},{10,20,[41,60]},{30,20,[51,70]},{50,10,[61,80]},{70,5,[71,80]},{100,2,[81,90]},{150,1,[91,100]}]
A2380: 2332 | B2380: 4 | C2380: 8 | D2380: 3000 | E2380: 91 | F2380: 100 | G2380: 3 | H2380: 15000 | I2380: 110003 | J2380: 3 | K2380: [{5,10},{6,15},{13,10},{14,5},{15,10},{16,5},{20,1},{27,10},{28,10}] | L2380: [{5,1113},{6,1113},{13,18},{14,37},{15,18},{16,37},{20,3},{27,18},{28,18}] | M2380: [{0,1,[1,30]},{1,2,[11,40]},{2,5,[21,50]},{5,10,[31,60]},{10,20,[41,60]},{30,20,[51,70]},{50,10,[61,80]},{70,5,[71,80]},{100,2,[81,90]},{150,1,[91,100]}]
A2381: 2333 | B2381: 5 | C2381: 8 | D2381: 3000 | E2381: 91 | F2381: 100 | G2381: 4 | H2381: 20000 | I2381: 110003 | J2381: 4 | K2381: [{5,10},{6,15},{13,10},{14,5},{15,10},{16,5},{20,1},{27,10},{28,10}] | L2381: [{5,1113},{6,1113},{13,18},{14,37},{15,18},{16,37},{20,3},{27,18},{28,18}] | M2381: [{0,1,[1,30]},{1,2,[11,40]},{2,5,[21,50]},{5,10,[31,60]},{10,20,[41,60]},{30,20,[51,70]},{50,10,[61,80]},{70,5,[71,80]},{100,2,[81,90]},{150,1,[91,100]}]
A2382: 2334 | B2382: 6 | C2382: 8 | D2382: 3000 | E2382: 91 | F2382: 100 | G2382: 5 | H2382: 20000 | I2382: 110003 | J2382: 5 | K2382: [{5,10},{6,15},{13,10},{14,5},{15,10},{16,5},{20,1},{27,10},{28,10}] | L2382: [{5,1113},{6,1113},{13,18},{14,37},{15,18},{16,37},{20,3},{27,18},{28,18}] | M2382: [{0,1,[1,30]},{1,2,[11,40]},{2,5,[21,50]},{5,10,[31,60]},{10,20,[41,60]},{30,20,[51,70]},{50,10,[61,80]},{70,5,[71,80]},{100,2,[81,90]},{150,1,[91,100]}]
A2383: 2335 | B2383: 2 | C2383: 10 | D2383: 3000 | E2383: 91 | F2383: 100 | G2383: 1 | H2383: 5000 | I2383: 110003 | J2383: 1 | K2383: [{5,10},{6,15},{13,10},{14,5},{15,10},{16,5},{20,1},{27,10},{28,10}] | L2383: [{5,1113},{6,1113},{13,18},{14,37},{15,18},{16,37},{20,3},{27,18},{28,18}] | M2383: [{0,1,[1,30]},{1,2,[11,40]},{2,5,[21,50]},{5,10,[31,60]},{10,20,[41,60]},{30,20,[51,70]},{50,10,[61,80]},{70,5,[71,80]},{100,2,[81,90]},{150,1,[91,100]}]
A2384: 2336 | B2384: 3 | C2384: 10 | D2384: 3000 | E2384: 91 | F2384: 100 | G2384: 2 | H2384: 10000 | I2384: 110003 | J2384: 2 | K2384: [{5,10},{6,15},{13,10},{14,5},{15,10},{16,5},{20,1},{27,10},{28,10}] | L2384: [{5,1113},{6,1113},{13,18},{14,37},{15,18},{16,37},{20,3},{27,18},{28,18}] | M2384: [{0,1,[1,30]},{1,2,[11,40]},{2,5,[21,50]},{5,10,[31,60]},{10,20,[41,60]},{30,20,[51,70]},{50,10,[61,80]},{70,5,[71,80]},{100,2,[81,90]},{150,1,[91,100]}]
A2385: 2337 | B2385: 4 | C2385: 10 | D2385: 3000 | E2385: 91 | F2385: 100 | G2385: 3 | H2385: 15000 | I2385: 110003 | J2385: 3 | K2385: [{5,10},{6,15},{13,10},{14,5},{15,10},{16,5},{20,1},{27,10},{28,10}] | L2385: [{5,1113},{6,1113},{13,18},{14,37},{15,18},{16,37},{20,3},{27,18},{28,18}] | M2385: [{0,1,[1,30]},{1,2,[11,40]},{2,5,[21,50]},{5,10,[31,60]},{10,20,[41,60]},{30,20,[51,70]},{50,10,[61,80]},{70,5,[71,80]},{100,2,[81,90]},{150,1,[91,100]}]
A2386: 2338 | B2386: 5 | C2386: 10 | D2386: 3000 | E2386: 91 | F2386: 100 | G2386: 4 | H2386: 20000 | I2386: 110003 | J2386: 4 | K2386: [{5,10},{6,15},{13,10},{14,5},{15,10},{16,5},{20,1},{27,10},{28,10}] | L2386: [{5,1113},{6,1113},{13,18},{14,37},{15,18},{16,37},{20,3},{27,18},{28,18}] | M2386: [{0,1,[1,30]},{1,2,[11,40]},{2,5,[21,50]},{5,10,[31,60]},{10,20,[41,60]},{30,20,[51,70]},{50,10,[61,80]},{70,5,[71,80]},{100,2,[81,90]},{150,1,[91,100]}]
A2387: 2339 | B2387: 6 | C2387: 10 | D2387: 3000 | E2387: 91 | F2387: 100 | G2387: 5 | H2387: 20000 | I2387: 110003 | J2387: 5 | K2387: [{5,10},{6,15},{13,10},{14,5},{15,10},{16,5},{20,1},{27,10},{28,10}] | L2387: [{5,1113},{6,1113},{13,18},{14,37},{15,18},{16,37},{20,3},{27,18},{28,18}] | M2387: [{0,1,[1,30]},{1,2,[11,40]},{2,5,[21,50]},{5,10,[31,60]},{10,20,[41,60]},{30,20,[51,70]},{50,10,[61,80]},{70,5,[71,80]},{100,2,[81,90]},{150,1,[91,100]}]
A2388: 2340 | B2388: 2 | C2388: 2 | D2388: 0 | E2388: 91 | F2388: 100 | G2388: 1 | H2388: 5000 | I2388: 110003 | J2388: 1 | K2388: [{5,10},{6,15},{13,10},{14,5},{15,10},{16,5},{20,1},{27,10},{28,10}] | L2388: [{5,1113},{6,1113},{13,18},{14,37},{15,18},{16,37},{20,3},{27,18},{28,18}] | M2388: [{0,1,[1,30]},{1,2,[11,40]},{2,5,[21,50]},{5,10,[31,60]},{10,20,[41,60]},{30,20,[51,70]},{50,10,[61,80]},{70,5,[71,80]},{100,2,[81,90]},{150,1,[91,100]}]
A2389: 2341 | B2389: 3 | C2389: 2 | D2389: 0 | E2389: 91 | F2389: 100 | G2389: 2 | H2389: 10000 | I2389: 110003 | J2389: 2 | K2389: [{5,10},{6,15},{13,10},{14,5},{15,10},{16,5},{20,1},{27,10},{28,10}] | L2389: [{5,1113},{6,1113},{13,18},{14,37},{15,18},{16,37},{20,3},{27,18},{28,18}] | M2389: [{0,1,[1,30]},{1,2,[11,40]},{2,5,[21,50]},{5,10,[31,60]},{10,20,[41,60]},{30,20,[51,70]},{50,10,[61,80]},{70,5,[71,80]},{100,2,[81,90]},{150,1,[91,100]}]
A2390: 2342 | B2390: 4 | C2390: 2 | D2390: 0 | E2390: 91 | F2390: 100 | G2390: 3 | H2390: 15000 | I2390: 110003 | J2390: 3 | K2390: [{5,10},{6,15},{13,10},{14,5},{15,10},{16,5},{20,1},{27,10},{28,10}] | L2390: [{5,1113},{6,1113},{13,18},{14,37},{15,18},{16,37},{20,3},{27,18},{28,18}] | M2390: [{0,1,[1,30]},{1,2,[11,40]},{2,5,[21,50]},{5,10,[31,60]},{10,20,[41,60]},{30,20,[51,70]},{50,10,[61,80]},{70,5,[71,80]},{100,2,[81,90]},{150,1,[91,100]}]
A2391: 2343 | B2391: 5 | C2391: 2 | D2391: 0 | E2391: 91 | F2391: 100 | G2391: 4 | H2391: 20000 | I2391: 110003 | J2391: 4 | K2391: [{5,10},{6,15},{13,10},{14,5},{15,10},{16,5},{20,1},{27,10},{28,10}] | L2391: [{5,1113},{6,1113},{13,18},{14,37},{15,18},{16,37},{20,3},{27,18},{28,18}] | M2391: [{0,1,[1,30]},{1,2,[11,40]},{2,5,[21,50]},{5,10,[31,60]},{10,20,[41,60]},{30,20,[51,70]},{50,10,[61,80]},{70,5,[71,80]},{100,2,[81,90]},{150,1,[91,100]}]
A2392: 2344 | B2392: 6 | C2392: 2 | D2392: 0 | E2392: 91 | F2392: 100 | G2392: 5 | H2392: 20000 | I2392: 110003 | J2392: 5 | K2392: [{5,10},{6,15},{13,10},{14,5},{15,10},{16,5},{20,1},{27,10},{28,10}] | L2392: [{5,1113},{6,1113},{13,18},{14,37},{15,18},{16,37},{20,3},{27,18},{28,18}] | M2392: [{0,1,[1,30]},{1,2,[11,40]},{2,5,[21,50]},{5,10,[31,60]},{10,20,[41,60]},{30,20,[51,70]},{50,10,[61,80]},{70,5,[71,80]},{100,2,[81,90]},{150,1,[91,100]}]
A2393: 2345 | B2393: 2 | C2393: 3 | D2393: 0 | E2393: 91 | F2393: 100 | G2393: 1 | H2393: 5000 | I2393: 110003 | J2393: 1 | K2393: [{5,10},{6,15},{13,10},{14,5},{15,10},{16,5},{20,1},{27,10},{28,10}] | L2393: [{5,1113},{6,1113},{13,18},{14,37},{15,18},{16,37},{20,3},{27,18},{28,18}] | M2393: [{0,1,[1,30]},{1,2,[11,40]},{2,5,[21,50]},{5,10,[31,60]},{10,20,[41,60]},{30,20,[51,70]},{50,10,[61,80]},{70,5,[71,80]},{100,2,[81,90]},{150,1,[91,100]}]
A2394: 2346 | B2394: 3 | C2394: 3 | D2394: 0 | E2394: 91 | F2394: 100 | G2394: 2 | H2394: 10000 | I2394: 110003 | J2394: 2 | K2394: [{5,10},{6,15},{13,10},{14,5},{15,10},{16,5},{20,1},{27,10},{28,10}] | L2394: [{5,1113},{6,1113},{13,18},{14,37},{15,18},{16,37},{20,3},{27,18},{28,18}] | M2394: [{0,1,[1,30]},{1,2,[11,40]},{2,5,[21,50]},{5,10,[31,60]},{10,20,[41,60]},{30,20,[51,70]},{50,10,[61,80]},{70,5,[71,80]},{100,2,[81,90]},{150,1,[91,100]}]
A2395: 2347 | B2395: 4 | C2395: 3 | D2395: 0 | E2395: 91 | F2395: 100 | G2395: 3 | H2395: 15000 | I2395: 110003 | J2395: 3 | K2395: [{5,10},{6,15},{13,10},{14,5},{15,10},{16,5},{20,1},{27,10},{28,10}] | L2395: [{5,1113},{6,1113},{13,18},{14,37},{15,18},{16,37},{20,3},{27,18},{28,18}] | M2395: [{0,1,[1,30]},{1,2,[11,40]},{2,5,[21,50]},{5,10,[31,60]},{10,20,[41,60]},{30,20,[51,70]},{50,10,[61,80]},{70,5,[71,80]},{100,2,[81,90]},{150,1,[91,100]}]
A2396: 2348 | B2396: 5 | C2396: 3 | D2396: 0 | E2396: 91 | F2396: 100 | G2396: 4 | H2396: 20000 | I2396: 110003 | J2396: 4 | K2396: [{5,10},{6,15},{13,10},{14,5},{15,10},{16,5},{20,1},{27,10},{28,10}] | L2396: [{5,1113},{6,1113},{13,18},{14,37},{15,18},{16,37},{20,3},{27,18},{28,18}] | M2396: [{0,1,[1,30]},{1,2,[11,40]},{2,5,[21,50]},{5,10,[31,60]},{10,20,[41,60]},{30,20,[51,70]},{50,10,[61,80]},{70,5,[71,80]},{100,2,[81,90]},{150,1,[91,100]}]
A2397: 2349 | B2397: 6 | C2397: 3 | D2397: 0 | E2397: 91 | F2397: 100 | G2397: 5 | H2397: 20000 | I2397: 110003 | J2397: 5 | K2397: [{5,10},{6,15},{13,10},{14,5},{15,10},{16,5},{20,1},{27,10},{28,10}] | L2397: [{5,1113},{6,1113},{13,18},{14,37},{15,18},{16,37},{20,3},{27,18},{28,18}] | M2397: [{0,1,[1,30]},{1,2,[11,40]},{2,5,[21,50]},{5,10,[31,60]},{10,20,[41,60]},{30,20,[51,70]},{50,10,[61,80]},{70,5,[71,80]},{100,2,[81,90]},{150,1,[91,100]}]
A2398: 2350 | B2398: 2 | C2398: 8 | D2398: 0 | E2398: 91 | F2398: 100 | G2398: 1 | H2398: 5000 | I2398: 110003 | J2398: 1 | K2398: [{5,10},{6,15},{13,10},{14,5},{15,10},{16,5},{20,1},{27,10},{28,10}] | L2398: [{5,1113},{6,1113},{13,18},{14,37},{15,18},{16,37},{20,3},{27,18},{28,18}] | M2398: [{0,1,[1,30]},{1,2,[11,40]},{2,5,[21,50]},{5,10,[31,60]},{10,20,[41,60]},{30,20,[51,70]},{50,10,[61,80]},{70,5,[71,80]},{100,2,[81,90]},{150,1,[91,100]}]
A2399: 2351 | B2399: 3 | C2399: 8 | D2399: 0 | E2399: 91 | F2399: 100 | G2399: 2 | H2399: 10000 | I2399: 110003 | J2399: 2 | K2399: [{5,10},{6,15},{13,10},{14,5},{15,10},{16,5},{20,1},{27,10},{28,10}] | L2399: [{5,1113},{6,1113},{13,18},{14,37},{15,18},{16,37},{20,3},{27,18},{28,18}] | M2399: [{0,1,[1,30]},{1,2,[11,40]},{2,5,[21,50]},{5,10,[31,60]},{10,20,[41,60]},{30,20,[51,70]},{50,10,[61,80]},{70,5,[71,80]},{100,2,[81,90]},{150,1,[91,100]}]
A2400: 2352 | B2400: 4 | C2400: 8 | D2400: 0 | E2400: 91 | F2400: 100 | G2400: 3 | H2400: 15000 | I2400: 110003 | J2400: 3 | K2400: [{5,10},{6,15},{13,10},{14,5},{15,10},{16,5},{20,1},{27,10},{28,10}] | L2400: [{5,1113},{6,1113},{13,18},{14,37},{15,18},{16,37},{20,3},{27,18},{28,18}] | M2400: [{0,1,[1,30]},{1,2,[11,40]},{2,5,[21,50]},{5,10,[31,60]},{10,20,[41,60]},{30,20,[51,70]},{50,10,[61,80]},{70,5,[71,80]},{100,2,[81,90]},{150,1,[91,100]}]
A2401: 2353 | B2401: 6 | C2401: 8 | D2401: 0 | E2401: 91 | F2401: 100 | G2401: 4 | H2401: 20000 | I2401: 110003 | J2401: 4 | K2401: [{5,10},{6,15},{13,10},{14,5},{15,10},{16,5},{20,1},{27,10},{28,10}] | L2401: [{5,1113},{6,1113},{13,18},{14,37},{15,18},{16,37},{20,3},{27,18},{28,18}] | M2401: [{0,1,[1,30]},{1,2,[11,40]},{2,5,[21,50]},{5,10,[31,60]},{10,20,[41,60]},{30,20,[51,70]},{50,10,[61,80]},{70,5,[71,80]},{100,2,[81,90]},{150,1,[91,100]}]
A2402: 2354 | B2402: 6 | C2402: 8 | D2402: 0 | E2402: 91 | F2402: 100 | G2402: 5 | H2402: 20000 | I2402: 110003 | J2402: 5 | K2402: [{5,10},{6,15},{13,10},{14,5},{15,10},{16,5},{20,1},{27,10},{28,10}] | L2402: [{5,1113},{6,1113},{13,18},{14,37},{15,18},{16,37},{20,3},{27,18},{28,18}] | M2402: [{0,1,[1,30]},{1,2,[11,40]},{2,5,[21,50]},{5,10,[31,60]},{10,20,[41,60]},{30,20,[51,70]},{50,10,[61,80]},{70,5,[71,80]},{100,2,[81,90]},{150,1,[91,100]}]
A2403: 2355 | B2403: 2 | C2403: 10 | D2403: 0 | E2403: 91 | F2403: 100 | G2403: 1 | H2403: 5000 | I2403: 110003 | J2403: 1 | K2403: [{5,10},{6,15},{13,10},{14,5},{15,10},{16,5},{20,1},{27,10},{28,10}] | L2403: [{5,1113},{6,1113},{13,18},{14,37},{15,18},{16,37},{20,3},{27,18},{28,18}] | M2403: [{0,1,[1,30]},{1,2,[11,40]},{2,5,[21,50]},{5,10,[31,60]},{10,20,[41,60]},{30,20,[51,70]},{50,10,[61,80]},{70,5,[71,80]},{100,2,[81,90]},{150,1,[91,100]}]
A2404: 2356 | B2404: 3 | C2404: 10 | D2404: 0 | E2404: 91 | F2404: 100 | G2404: 2 | H2404: 10000 | I2404: 110003 | J2404: 2 | K2404: [{5,10},{6,15},{13,10},{14,5},{15,10},{16,5},{20,1},{27,10},{28,10}] | L2404: [{5,1113},{6,1113},{13,18},{14,37},{15,18},{16,37},{20,3},{27,18},{28,18}] | M2404: [{0,1,[1,30]},{1,2,[11,40]},{2,5,[21,50]},{5,10,[31,60]},{10,20,[41,60]},{30,20,[51,70]},{50,10,[61,80]},{70,5,[71,80]},{100,2,[81,90]},{150,1,[91,100]}]
A2405: 2357 | B2405: 4 | C2405: 10 | D2405: 0 | E2405: 91 | F2405: 100 | G2405: 3 | H2405: 15000 | I2405: 110003 | J2405: 3 | K2405: [{5,10},{6,15},{13,10},{14,5},{15,10},{16,5},{20,1},{27,10},{28,10}] | L2405: [{5,1113},{6,1113},{13,18},{14,37},{15,18},{16,37},{20,3},{27,18},{28,18}] | M2405: [{0,1,[1,30]},{1,2,[11,40]},{2,5,[21,50]},{5,10,[31,60]},{10,20,[41,60]},{30,20,[51,70]},{50,10,[61,80]},{70,5,[71,80]},{100,2,[81,90]},{150,1,[91,100]}]
A2406: 2358 | B2406: 5 | C2406: 10 | D2406: 0 | E2406: 91 | F2406: 100 | G2406: 4 | H2406: 20000 | I2406: 110003 | J2406: 4 | K2406: [{5,10},{6,15},{13,10},{14,5},{15,10},{16,5},{20,1},{27,10},{28,10}] | L2406: [{5,1113},{6,1113},{13,18},{14,37},{15,18},{16,37},{20,3},{27,18},{28,18}] | M2406: [{0,1,[1,30]},{1,2,[11,40]},{2,5,[21,50]},{5,10,[31,60]},{10,20,[41,60]},{30,20,[51,70]},{50,10,[61,80]},{70,5,[71,80]},{100,2,[81,90]},{150,1,[91,100]}]
A2407: 2359 | B2407: 6 | C2407: 10 | D2407: 0 | E2407: 91 | F2407: 100 | G2407: 5 | H2407: 20000 | I2407: 110003 | J2407: 5 | K2407: [{5,10},{6,15},{13,10},{14,5},{15,10},{16,5},{20,1},{27,10},{28,10}] | L2407: [{5,1113},{6,1113},{13,18},{14,37},{15,18},{16,37},{20,3},{27,18},{28,18}] | M2407: [{0,1,[1,30]},{1,2,[11,40]},{2,5,[21,50]},{5,10,[31,60]},{10,20,[41,60]},{30,20,[51,70]},{50,10,[61,80]},{70,5,[71,80]},{100,2,[81,90]},{150,1,[91,100]}]
A2408: 2360 | B2408: 2 | C2408: 21 | D2408: 0 | E2408: 91 | F2408: 100 | G2408: 1 | H2408: 5000 | I2408: 110003 | J2408: 1 | K2408: [{7,3},{8,3},{9,3},{10,3},{11,3},{12,3},{17,10},{18,8},{19,1},{23,4},{24,10}] | L2408: [{7,27},{8,55},{9,27},{10,55},{11,27},{12,55},{17,18},{18,110},{19,3},{23,37},{24,37}] | M2408: [{0,1,[1,30]},{1,2,[11,40]},{2,5,[21,50]},{5,10,[31,60]},{10,20,[41,60]},{30,20,[51,70]},{50,10,[61,80]},{70,5,[71,80]},{100,2,[81,90]},{150,1,[91,100]}]
A2409: 2361 | B2409: 3 | C2409: 21 | D2409: 0 | E2409: 91 | F2409: 100 | G2409: 2 | H2409: 10000 | I2409: 110003 | J2409: 2 | K2409: [{7,3},{8,3},{9,3},{10,3},{11,3},{12,3},{17,10},{18,8},{19,1},{23,4},{24,10}] | L2409: [{7,27},{8,55},{9,27},{10,55},{11,27},{12,55},{17,18},{18,110},{19,3},{23,37},{24,37}] | M2409: [{0,1,[1,30]},{1,2,[11,40]},{2,5,[21,50]},{5,10,[31,60]},{10,20,[41,60]},{30,20,[51,70]},{50,10,[61,80]},{70,5,[71,80]},{100,2,[81,90]},{150,1,[91,100]}]
A2410: 2362 | B2410: 4 | C2410: 21 | D2410: 0 | E2410: 91 | F2410: 100 | G2410: 3 | H2410: 15000 | I2410: 110003 | J2410: 3 | K2410: [{7,3},{8,3},{9,3},{10,3},{11,3},{12,3},{17,10},{18,8},{19,1},{23,4},{24,10}] | L2410: [{7,27},{8,55},{9,27},{10,55},{11,27},{12,55},{17,18},{18,110},{19,3},{23,37},{24,37}] | M2410: [{0,1,[1,30]},{1,2,[11,40]},{2,5,[21,50]},{5,10,[31,60]},{10,20,[41,60]},{30,20,[51,70]},{50,10,[61,80]},{70,5,[71,80]},{100,2,[81,90]},{150,1,[91,100]}]
A2411: 2363 | B2411: 5 | C2411: 21 | D2411: 0 | E2411: 91 | F2411: 100 | G2411: 4 | H2411: 20000 | I2411: 110003 | J2411: 4 | K2411: [{7,3},{8,3},{9,3},{10,3},{11,3},{12,3},{17,10},{18,8},{19,1},{23,4},{24,10}] | L2411: [{7,27},{8,55},{9,27},{10,55},{11,27},{12,55},{17,18},{18,110},{19,3},{23,37},{24,37}] | M2411: [{0,1,[1,30]},{1,2,[11,40]},{2,5,[21,50]},{5,10,[31,60]},{10,20,[41,60]},{30,20,[51,70]},{50,10,[61,80]},{70,5,[71,80]},{100,2,[81,90]},{150,1,[91,100]}]
A2412: 2364 | B2412: 6 | C2412: 21 | D2412: 0 | E2412: 91 | F2412: 100 | G2412: 5 | H2412: 20000 | I2412: 110003 | J2412: 5 | K2412: [{7,3},{8,3},{9,3},{10,3},{11,3},{12,3},{17,10},{18,8},{19,1},{23,4},{24,10}] | L2412: [{7,27},{8,55},{9,27},{10,55},{11,27},{12,55},{17,18},{18,110},{19,3},{23,37},{24,37}] | M2412: [{0,1,[1,30]},{1,2,[11,40]},{2,5,[21,50]},{5,10,[31,60]},{10,20,[41,60]},{30,20,[51,70]},{50,10,[61,80]},{70,5,[71,80]},{100,2,[81,90]},{150,1,[91,100]}]
A2413: 2365 | B2413: 2 | C2413: 29 | D2413: 0 | E2413: 91 | F2413: 100 | G2413: 1 | H2413: 5000 | I2413: 110003 | J2413: 1 | K2413: [{7,3},{8,3},{9,3},{10,3},{11,3},{12,3},{17,10},{18,8},{19,1},{23,4},{24,10}] | L2413: [{7,27},{8,55},{9,27},{10,55},{11,27},{12,55},{17,18},{18,110},{19,3},{23,37},{24,37}] | M2413: [{0,1,[1,30]},{1,2,[11,40]},{2,5,[21,50]},{5,10,[31,60]},{10,20,[41,60]},{30,20,[51,70]},{50,10,[61,80]},{70,5,[71,80]},{100,2,[81,90]},{150,1,[91,100]}]
A2414: 2366 | B2414: 3 | C2414: 29 | D2414: 0 | E2414: 91 | F2414: 100 | G2414: 2 | H2414: 10000 | I2414: 110003 | J2414: 2 | K2414: [{7,3},{8,3},{9,3},{10,3},{11,3},{12,3},{17,10},{18,8},{19,1},{23,4},{24,10}] | L2414: [{7,27},{8,55},{9,27},{10,55},{11,27},{12,55},{17,18},{18,110},{19,3},{23,37},{24,37}] | M2414: [{0,1,[1,30]},{1,2,[11,40]},{2,5,[21,50]},{5,10,[31,60]},{10,20,[41,60]},{30,20,[51,70]},{50,10,[61,80]},{70,5,[71,80]},{100,2,[81,90]},{150,1,[91,100]}]
A2415: 2367 | B2415: 4 | C2415: 29 | D2415: 0 | E2415: 91 | F2415: 100 | G2415: 3 | H2415: 15000 | I2415: 110003 | J2415: 3 | K2415: [{7,3},{8,3},{9,3},{10,3},{11,3},{12,3},{17,10},{18,8},{19,1},{23,4},{24,10}] | L2415: [{7,27},{8,55},{9,27},{10,55},{11,27},{12,55},{17,18},{18,110},{19,3},{23,37},{24,37}] | M2415: [{0,1,[1,30]},{1,2,[11,40]},{2,5,[21,50]},{5,10,[31,60]},{10,20,[41,60]},{30,20,[51,70]},{50,10,[61,80]},{70,5,[71,80]},{100,2,[81,90]},{150,1,[91,100]}]
A2416: 2368 | B2416: 5 | C2416: 29 | D2416: 0 | E2416: 91 | F2416: 100 | G2416: 4 | H2416: 20000 | I2416: 110003 | J2416: 4 | K2416: [{7,3},{8,3},{9,3},{10,3},{11,3},{12,3},{17,10},{18,8},{19,1},{23,4},{24,10}] | L2416: [{7,27},{8,55},{9,27},{10,55},{11,27},{12,55},{17,18},{18,110},{19,3},{23,37},{24,37}] | M2416: [{0,1,[1,30]},{1,2,[11,40]},{2,5,[21,50]},{5,10,[31,60]},{10,20,[41,60]},{30,20,[51,70]},{50,10,[61,80]},{70,5,[71,80]},{100,2,[81,90]},{150,1,[91,100]}]
A2417: 2369 | B2417: 6 | C2417: 29 | D2417: 0 | E2417: 91 | F2417: 100 | G2417: 5 | H2417: 20000 | I2417: 110003 | J2417: 5 | K2417: [{7,3},{8,3},{9,3},{10,3},{11,3},{12,3},{17,10},{18,8},{19,1},{23,4},{24,10}] | L2417: [{7,27},{8,55},{9,27},{10,55},{11,27},{12,55},{17,18},{18,110},{19,3},{23,37},{24,37}] | M2417: [{0,1,[1,30]},{1,2,[11,40]},{2,5,[21,50]},{5,10,[31,60]},{10,20,[41,60]},{30,20,[51,70]},{50,10,[61,80]},{70,5,[71,80]},{100,2,[81,90]},{150,1,[91,100]}]
A2418: 2370 | B2418: 2 | C2418: 24 | D2418: 0 | E2418: 91 | F2418: 100 | G2418: 1 | H2418: 5000 | I2418: 110003 | J2418: 1 | K2418: [{5,8},{6,15},{13,10},{14,8},{15,10},{16,8},{20,1},{27,10},{28,10}] | L2418: [{5,1113},{6,1113},{13,18},{14,37},{15,18},{16,37},{20,3},{27,18},{28,18}] | M2418: [{0,1,[1,30]},{1,2,[11,40]},{2,5,[21,50]},{5,10,[31,60]},{10,20,[41,60]},{30,20,[51,70]},{50,10,[61,80]},{70,5,[71,80]},{100,2,[81,90]},{150,1,[91,100]}]
A2419: 2371 | B2419: 3 | C2419: 24 | D2419: 0 | E2419: 91 | F2419: 100 | G2419: 2 | H2419: 10000 | I2419: 110003 | J2419: 2 | K2419: [{5,8},{6,15},{13,10},{14,8},{15,10},{16,8},{20,1},{27,10},{28,10}] | L2419: [{5,1113},{6,1113},{13,18},{14,37},{15,18},{16,37},{20,3},{27,18},{28,18}] | M2419: [{0,1,[1,30]},{1,2,[11,40]},{2,5,[21,50]},{5,10,[31,60]},{10,20,[41,60]},{30,20,[51,70]},{50,10,[61,80]},{70,5,[71,80]},{100,2,[81,90]},{150,1,[91,100]}]
A2420: 2372 | B2420: 4 | C2420: 24 | D2420: 0 | E2420: 91 | F2420: 100 | G2420: 3 | H2420: 15000 | I2420: 110003 | J2420: 3 | K2420: [{5,8},{6,15},{13,10},{14,8},{15,10},{16,8},{20,1},{27,10},{28,10}] | L2420: [{5,1113},{6,1113},{13,18},{14,37},{15,18},{16,37},{20,3},{27,18},{28,18}] | M2420: [{0,1,[1,30]},{1,2,[11,40]},{2,5,[21,50]},{5,10,[31,60]},{10,20,[41,60]},{30,20,[51,70]},{50,10,[61,80]},{70,5,[71,80]},{100,2,[81,90]},{150,1,[91,100]}]
A2421: 2373 | B2421: 5 | C2421: 24 | D2421: 0 | E2421: 91 | F2421: 100 | G2421: 4 | H2421: 20000 | I2421: 110003 | J2421: 4 | K2421: [{5,8},{6,15},{13,10},{14,8},{15,10},{16,8},{20,1},{27,10},{28,10}] | L2421: [{5,1113},{6,1113},{13,18},{14,37},{15,18},{16,37},{20,3},{27,18},{28,18}] | M2421: [{0,1,[1,30]},{1,2,[11,40]},{2,5,[21,50]},{5,10,[31,60]},{10,20,[41,60]},{30,20,[51,70]},{50,10,[61,80]},{70,5,[71,80]},{100,2,[81,90]},{150,1,[91,100]}]
A2422: 2374 | B2422: 6 | C2422: 24 | D2422: 0 | E2422: 91 | F2422: 100 | G2422: 5 | H2422: 20000 | I2422: 110003 | J2422: 5 | K2422: [{5,8},{6,15},{13,10},{14,8},{15,10},{16,8},{20,1},{27,10},{28,10}] | L2422: [{5,1113},{6,1113},{13,18},{14,37},{15,18},{16,37},{20,3},{27,18},{28,18}] | M2422: [{0,1,[1,30]},{1,2,[11,40]},{2,5,[21,50]},{5,10,[31,60]},{10,20,[41,60]},{30,20,[51,70]},{50,10,[61,80]},{70,5,[71,80]},{100,2,[81,90]},{150,1,[91,100]}]
A2423: 2375 | B2423: 2 | C2423: 25 | D2423: 0 | E2423: 91 | F2423: 100 | G2423: 1 | H2423: 5000 | I2423: 110003 | J2423: 1 | K2423: [{5,8},{6,15},{13,10},{14,8},{15,10},{16,8},{20,1},{27,10},{28,10}] | L2423: [{5,1113},{6,1113},{13,18},{14,37},{15,18},{16,37},{20,3},{27,18},{28,18}] | M2423: [{0,1,[1,30]},{1,2,[11,40]},{2,5,[21,50]},{5,10,[31,60]},{10,20,[41,60]},{30,20,[51,70]},{50,10,[61,80]},{70,5,[71,80]},{100,2,[81,90]},{150,1,[91,100]}]
A2424: 2376 | B2424: 3 | C2424: 25 | D2424: 0 | E2424: 91 | F2424: 100 | G2424: 2 | H2424: 10000 | I2424: 110003 | J2424: 2 | K2424: [{5,8},{6,15},{13,10},{14,8},{15,10},{16,8},{20,1},{27,10},{28,10}] | L2424: [{5,1113},{6,1113},{13,18},{14,37},{15,18},{16,37},{20,3},{27,18},{28,18}] | M2424: [{0,1,[1,30]},{1,2,[11,40]},{2,5,[21,50]},{5,10,[31,60]},{10,20,[41,60]},{30,20,[51,70]},{50,10,[61,80]},{70,5,[71,80]},{100,2,[81,90]},{150,1,[91,100]}]
A2425: 2377 | B2425: 4 | C2425: 25 | D2425: 0 | E2425: 91 | F2425: 100 | G2425: 3 | H2425: 15000 | I2425: 110003 | J2425: 3 | K2425: [{5,8},{6,15},{13,10},{14,8},{15,10},{16,8},{20,1},{27,10},{28,10}] | L2425: [{5,1113},{6,1113},{13,18},{14,37},{15,18},{16,37},{20,3},{27,18},{28,18}] | M2425: [{0,1,[1,30]},{1,2,[11,40]},{2,5,[21,50]},{5,10,[31,60]},{10,20,[41,60]},{30,20,[51,70]},{50,10,[61,80]},{70,5,[71,80]},{100,2,[81,90]},{150,1,[91,100]}]
A2426: 2378 | B2426: 5 | C2426: 25 | D2426: 0 | E2426: 91 | F2426: 100 | G2426: 4 | H2426: 20000 | I2426: 110003 | J2426: 4 | K2426: [{5,8},{6,15},{13,10},{14,8},{15,10},{16,8},{20,1},{27,10},{28,10}] | L2426: [{5,1113},{6,1113},{13,18},{14,37},{15,18},{16,37},{20,3},{27,18},{28,18}] | M2426: [{0,1,[1,30]},{1,2,[11,40]},{2,5,[21,50]},{5,10,[31,60]},{10,20,[41,60]},{30,20,[51,70]},{50,10,[61,80]},{70,5,[71,80]},{100,2,[81,90]},{150,1,[91,100]}]
A2427: 2379 | B2427: 6 | C2427: 25 | D2427: 0 | E2427: 91 | F2427: 100 | G2427: 5 | H2427: 20000 | I2427: 110003 | J2427: 5 | K2427: [{5,8},{6,15},{13,10},{14,8},{15,10},{16,8},{20,1},{27,10},{28,10}] | L2427: [{5,1113},{6,1113},{13,18},{14,37},{15,18},{16,37},{20,3},{27,18},{28,18}] | M2427: [{0,1,[1,30]},{1,2,[11,40]},{2,5,[21,50]},{5,10,[31,60]},{10,20,[41,60]},{30,20,[51,70]},{50,10,[61,80]},{70,5,[71,80]},{100,2,[81,90]},{150,1,[91,100]}]
A2428: 2380 | B2428: 2 | C2428: 28 | D2428: 0 | E2428: 91 | F2428: 100 | G2428: 1 | H2428: 5000 | I2428: 110003 | J2428: 1 | K2428: [{5,8},{6,15},{13,10},{14,8},{15,10},{16,8},{20,1},{27,10},{28,10}] | L2428: [{5,1113},{6,1113},{13,18},{14,37},{15,18},{16,37},{20,3},{27,18},{28,18}] | M2428: [{0,1,[1,30]},{1,2,[11,40]},{2,5,[21,50]},{5,10,[31,60]},{10,20,[41,60]},{30,20,[51,70]},{50,10,[61,80]},{70,5,[71,80]},{100,2,[81,90]},{150,1,[91,100]}]
A2429: 2381 | B2429: 3 | C2429: 28 | D2429: 0 | E2429: 91 | F2429: 100 | G2429: 2 | H2429: 10000 | I2429: 110003 | J2429: 2 | K2429: [{5,8},{6,15},{13,10},{14,8},{15,10},{16,8},{20,1},{27,10},{28,10}] | L2429: [{5,1113},{6,1113},{13,18},{14,37},{15,18},{16,37},{20,3},{27,18},{28,18}] | M2429: [{0,1,[1,30]},{1,2,[11,40]},{2,5,[21,50]},{5,10,[31,60]},{10,20,[41,60]},{30,20,[51,70]},{50,10,[61,80]},{70,5,[71,80]},{100,2,[81,90]},{150,1,[91,100]}]
A2430: 2382 | B2430: 4 | C2430: 28 | D2430: 0 | E2430: 91 | F2430: 100 | G2430: 3 | H2430: 15000 | I2430: 110003 | J2430: 3 | K2430: [{5,8},{6,15},{13,10},{14,8},{15,10},{16,8},{20,1},{27,10},{28,10}] | L2430: [{5,1113},{6,1113},{13,18},{14,37},{15,18},{16,37},{20,3},{27,18},{28,18}] | M2430: [{0,1,[1,30]},{1,2,[11,40]},{2,5,[21,50]},{5,10,[31,60]},{10,20,[41,60]},{30,20,[51,70]},{50,10,[61,80]},{70,5,[71,80]},{100,2,[81,90]},{150,1,[91,100]}]
A2431: 2383 | B2431: 5 | C2431: 28 | D2431: 0 | E2431: 91 | F2431: 100 | G2431: 4 | H2431: 20000 | I2431: 110003 | J2431: 4 | K2431: [{5,8},{6,15},{13,10},{14,8},{15,10},{16,8},{20,1},{27,10},{28,10}] | L2431: [{5,1113},{6,1113},{13,18},{14,37},{15,18},{16,37},{20,3},{27,18},{28,18}] | M2431: [{0,1,[1,30]},{1,2,[11,40]},{2,5,[21,50]},{5,10,[31,60]},{10,20,[41,60]},{30,20,[51,70]},{50,10,[61,80]},{70,5,[71,80]},{100,2,[81,90]},{150,1,[91,100]}]
A2432: 2384 | B2432: 6 | C2432: 28 | D2432: 0 | E2432: 91 | F2432: 100 | G2432: 5 | H2432: 20000 | I2432: 110003 | J2432: 5 | K2432: [{5,8},{6,15},{13,10},{14,8},{15,10},{16,8},{20,1},{27,10},{28,10}] | L2432: [{5,1113},{6,1113},{13,18},{14,37},{15,18},{16,37},{20,3},{27,18},{28,18}] | M2432: [{0,1,[1,30]},{1,2,[11,40]},{2,5,[21,50]},{5,10,[31,60]},{10,20,[41,60]},{30,20,[51,70]},{50,10,[61,80]},{70,5,[71,80]},{100,2,[81,90]},{150,1,[91,100]}]
A2433: 2385 | B2433: 2 | C2433: 23 | D2433: 0 | E2433: 91 | F2433: 100 | G2433: 1 | H2433: 5000 | I2433: 110003 | J2433: 1 | K2433: [{5,8},{6,15},{13,10},{14,8},{15,10},{16,8},{20,1},{27,10},{28,10}] | L2433: [{5,1113},{6,1113},{13,18},{14,37},{15,18},{16,37},{20,3},{27,18},{28,18}] | M2433: [{0,1,[1,30]},{1,2,[11,40]},{2,5,[21,50]},{5,10,[31,60]},{10,20,[41,60]},{30,20,[51,70]},{50,10,[61,80]},{70,5,[71,80]},{100,2,[81,90]},{150,1,[91,100]}]
A2434: 2386 | B2434: 3 | C2434: 23 | D2434: 0 | E2434: 91 | F2434: 100 | G2434: 2 | H2434: 10000 | I2434: 110003 | J2434: 2 | K2434: [{5,8},{6,15},{13,10},{14,8},{15,10},{16,8},{20,1},{27,10},{28,10}] | L2434: [{5,1113},{6,1113},{13,18},{14,37},{15,18},{16,37},{20,3},{27,18},{28,18}] | M2434: [{0,1,[1,30]},{1,2,[11,40]},{2,5,[21,50]},{5,10,[31,60]},{10,20,[41,60]},{30,20,[51,70]},{50,10,[61,80]},{70,5,[71,80]},{100,2,[81,90]},{150,1,[91,100]}]
A2435: 2387 | B2435: 4 | C2435: 23 | D2435: 0 | E2435: 91 | F2435: 100 | G2435: 3 | H2435: 15000 | I2435: 110003 | J2435: 3 | K2435: [{5,8},{6,15},{13,10},{14,8},{15,10},{16,8},{20,1},{27,10},{28,10}] | L2435: [{5,1113},{6,1113},{13,18},{14,37},{15,18},{16,37},{20,3},{27,18},{28,18}] | M2435: [{0,1,[1,30]},{1,2,[11,40]},{2,5,[21,50]},{5,10,[31,60]},{10,20,[41,60]},{30,20,[51,70]},{50,10,[61,80]},{70,5,[71,80]},{100,2,[81,90]},{150,1,[91,100]}]
A2436: 2388 | B2436: 5 | C2436: 23 | D2436: 0 | E2436: 91 | F2436: 100 | G2436: 4 | H2436: 20000 | I2436: 110003 | J2436: 4 | K2436: [{5,8},{6,15},{13,10},{14,8},{15,10},{16,8},{20,1},{27,10},{28,10}] | L2436: [{5,1113},{6,1113},{13,18},{14,37},{15,18},{16,37},{20,3},{27,18},{28,18}] | M2436: [{0,1,[1,30]},{1,2,[11,40]},{2,5,[21,50]},{5,10,[31,60]},{10,20,[41,60]},{30,20,[51,70]},{50,10,[61,80]},{70,5,[71,80]},{100,2,[81,90]},{150,1,[91,100]}]
A2437: 2389 | B2437: 6 | C2437: 23 | D2437: 0 | E2437: 91 | F2437: 100 | G2437: 5 | H2437: 20000 | I2437: 110003 | J2437: 5 | K2437: [{5,8},{6,15},{13,10},{14,8},{15,10},{16,8},{20,1},{27,10},{28,10}] | L2437: [{5,1113},{6,1113},{13,18},{14,37},{15,18},{16,37},{20,3},{27,18},{28,18}] | M2437: [{0,1,[1,30]},{1,2,[11,40]},{2,5,[21,50]},{5,10,[31,60]},{10,20,[41,60]},{30,20,[51,70]},{50,10,[61,80]},{70,5,[71,80]},{100,2,[81,90]},{150,1,[91,100]}]
A2438: 2390 | B2438: 2 | C2438: 26 | D2438: 0 | E2438: 91 | F2438: 100 | G2438: 1 | H2438: 5000 | I2438: 110003 | J2438: 1 | K2438: [{5,8},{6,15},{13,10},{14,8},{15,10},{16,8},{20,1},{27,10},{28,10}] | L2438: [{5,1113},{6,1113},{13,18},{14,37},{15,18},{16,37},{20,3},{27,18},{28,18}] | M2438: [{0,1,[1,30]},{1,2,[11,40]},{2,5,[21,50]},{5,10,[31,60]},{10,20,[41,60]},{30,20,[51,70]},{50,10,[61,80]},{70,5,[71,80]},{100,2,[81,90]},{150,1,[91,100]}]
A2439: 2391 | B2439: 3 | C2439: 26 | D2439: 0 | E2439: 91 | F2439: 100 | G2439: 2 | H2439: 10000 | I2439: 110003 | J2439: 2 | K2439: [{5,8},{6,15},{13,10},{14,8},{15,10},{16,8},{20,1},{27,10},{28,10}] | L2439: [{5,1113},{6,1113},{13,18},{14,37},{15,18},{16,37},{20,3},{27,18},{28,18}] | M2439: [{0,1,[1,30]},{1,2,[11,40]},{2,5,[21,50]},{5,10,[31,60]},{10,20,[41,60]},{30,20,[51,70]},{50,10,[61,80]},{70,5,[71,80]},{100,2,[81,90]},{150,1,[91,100]}]
A2440: 2392 | B2440: 4 | C2440: 26 | D2440: 0 | E2440: 91 | F2440: 100 | G2440: 3 | H2440: 15000 | I2440: 110003 | J2440: 3 | K2440: [{5,8},{6,15},{13,10},{14,8},{15,10},{16,8},{20,1},{27,10},{28,10}] | L2440: [{5,1113},{6,1113},{13,18},{14,37},{15,18},{16,37},{20,3},{27,18},{28,18}] | M2440: [{0,1,[1,30]},{1,2,[11,40]},{2,5,[21,50]},{5,10,[31,60]},{10,20,[41,60]},{30,20,[51,70]},{50,10,[61,80]},{70,5,[71,80]},{100,2,[81,90]},{150,1,[91,100]}]
A2441: 2393 | B2441: 5 | C2441: 26 | D2441: 0 | E2441: 91 | F2441: 100 | G2441: 4 | H2441: 20000 | I2441: 110003 | J2441: 4 | K2441: [{5,8},{6,15},{13,10},{14,8},{15,10},{16,8},{20,1},{27,10},{28,10}] | L2441: [{5,1113},{6,1113},{13,18},{14,37},{15,18},{16,37},{20,3},{27,18},{28,18}] | M2441: [{0,1,[1,30]},{1,2,[11,40]},{2,5,[21,50]},{5,10,[31,60]},{10,20,[41,60]},{30,20,[51,70]},{50,10,[61,80]},{70,5,[71,80]},{100,2,[81,90]},{150,1,[91,100]}]
A2442: 2394 | B2442: 6 | C2442: 26 | D2442: 0 | E2442: 91 | F2442: 100 | G2442: 5 | H2442: 20000 | I2442: 110003 | J2442: 5 | K2442: [{5,8},{6,15},{13,10},{14,8},{15,10},{16,8},{20,1},{27,10},{28,10}] | L2442: [{5,1113},{6,1113},{13,18},{14,37},{15,18},{16,37},{20,3},{27,18},{28,18}] | M2442: [{0,1,[1,30]},{1,2,[11,40]},{2,5,[21,50]},{5,10,[31,60]},{10,20,[41,60]},{30,20,[51,70]},{50,10,[61,80]},{70,5,[71,80]},{100,2,[81,90]},{150,1,[91,100]}]
A2443: 2395 | B2443: 2 | C2443: 22 | D2443: 0 | E2443: 91 | F2443: 100 | G2443: 1 | H2443: 5000 | I2443: 110003 | J2443: 1 | K2443: [{5,8},{6,15},{13,10},{14,8},{15,10},{16,8},{20,1},{27,10},{28,10}] | L2443: [{5,1113},{6,1113},{13,18},{14,37},{15,18},{16,37},{20,3},{27,18},{28,18}] | M2443: [{0,1,[1,30]},{1,2,[11,40]},{2,5,[21,50]},{5,10,[31,60]},{10,20,[41,60]},{30,20,[51,70]},{50,10,[61,80]},{70,5,[71,80]},{100,2,[81,90]},{150,1,[91,100]}]
A2444: 2396 | B2444: 3 | C2444: 22 | D2444: 0 | E2444: 91 | F2444: 100 | G2444: 2 | H2444: 10000 | I2444: 110003 | J2444: 2 | K2444: [{5,8},{6,15},{13,10},{14,8},{15,10},{16,8},{20,1},{27,10},{28,10}] | L2444: [{5,1113},{6,1113},{13,18},{14,37},{15,18},{16,37},{20,3},{27,18},{28,18}] | M2444: [{0,1,[1,30]},{1,2,[11,40]},{2,5,[21,50]},{5,10,[31,60]},{10,20,[41,60]},{30,20,[51,70]},{50,10,[61,80]},{70,5,[71,80]},{100,2,[81,90]},{150,1,[91,100]}]
A2445: 2397 | B2445: 4 | C2445: 22 | D2445: 0 | E2445: 91 | F2445: 100 | G2445: 3 | H2445: 15000 | I2445: 110003 | J2445: 3 | K2445: [{5,8},{6,15},{13,10},{14,8},{15,10},{16,8},{20,1},{27,10},{28,10}] | L2445: [{5,1113},{6,1113},{13,18},{14,37},{15,18},{16,37},{20,3},{27,18},{28,18}] | M2445: [{0,1,[1,30]},{1,2,[11,40]},{2,5,[21,50]},{5,10,[31,60]},{10,20,[41,60]},{30,20,[51,70]},{50,10,[61,80]},{70,5,[71,80]},{100,2,[81,90]},{150,1,[91,100]}]
A2446: 2398 | B2446: 5 | C2446: 22 | D2446: 0 | E2446: 91 | F2446: 100 | G2446: 4 | H2446: 20000 | I2446: 110003 | J2446: 4 | K2446: [{5,8},{6,15},{13,10},{14,8},{15,10},{16,8},{20,1},{27,10},{28,10}] | L2446: [{5,1113},{6,1113},{13,18},{14,37},{15,18},{16,37},{20,3},{27,18},{28,18}] | M2446: [{0,1,[1,30]},{1,2,[11,40]},{2,5,[21,50]},{5,10,[31,60]},{10,20,[41,60]},{30,20,[51,70]},{50,10,[61,80]},{70,5,[71,80]},{100,2,[81,90]},{150,1,[91,100]}]
A2447: 2399 | B2447: 6 | C2447: 22 | D2447: 0 | E2447: 91 | F2447: 100 | G2447: 5 | H2447: 20000 | I2447: 110003 | J2447: 5 | K2447: [{5,8},{6,15},{13,10},{14,8},{15,10},{16,8},{20,1},{27,10},{28,10}] | L2447: [{5,1113},{6,1113},{13,18},{14,37},{15,18},{16,37},{20,3},{27,18},{28,18}] | M2447: [{0,1,[1,30]},{1,2,[11,40]},{2,5,[21,50]},{5,10,[31,60]},{10,20,[41,60]},{30,20,[51,70]},{50,10,[61,80]},{70,5,[71,80]},{100,2,[81,90]},{150,1,[91,100]}]
A2448: 2400 | B2448: 2 | C2448: 27 | D2448: 0 | E2448: 91 | F2448: 100 | G2448: 1 | H2448: 5000 | I2448: 110003 | J2448: 1 | K2448: [{7,3},{8,3},{9,3},{10,3},{11,3},{12,3},{17,10},{18,8},{19,1},{23,4},{24,10}] | L2448: [{7,27},{8,55},{9,27},{10,55},{11,27},{12,55},{17,18},{18,110},{19,3},{23,37},{24,37}] | M2448: [{0,1,[1,30]},{1,2,[11,40]},{2,5,[21,50]},{5,10,[31,60]},{10,20,[41,60]},{30,20,[51,70]},{50,10,[61,80]},{70,5,[71,80]},{100,2,[81,90]},{150,1,[91,100]}]
A2449: 2401 | B2449: 3 | C2449: 27 | D2449: 0 | E2449: 91 | F2449: 100 | G2449: 2 | H2449: 10000 | I2449: 110003 | J2449: 2 | K2449: [{7,3},{8,3},{9,3},{10,3},{11,3},{12,3},{17,10},{18,8},{19,1},{23,4},{24,10}] | L2449: [{7,27},{8,55},{9,27},{10,55},{11,27},{12,55},{17,18},{18,110},{19,3},{23,37},{24,37}] | M2449: [{0,1,[1,30]},{1,2,[11,40]},{2,5,[21,50]},{5,10,[31,60]},{10,20,[41,60]},{30,20,[51,70]},{50,10,[61,80]},{70,5,[71,80]},{100,2,[81,90]},{150,1,[91,100]}]
A2450: 2402 | B2450: 4 | C2450: 27 | D2450: 0 | E2450: 91 | F2450: 100 | G2450: 3 | H2450: 15000 | I2450: 110003 | J2450: 3 | K2450: [{7,3},{8,3},{9,3},{10,3},{11,3},{12,3},{17,10},{18,8},{19,1},{23,4},{24,10}] | L2450: [{7,27},{8,55},{9,27},{10,55},{11,27},{12,55},{17,18},{18,110},{19,3},{23,37},{24,37}] | M2450: [{0,1,[1,30]},{1,2,[11,40]},{2,5,[21,50]},{5,10,[31,60]},{10,20,[41,60]},{30,20,[51,70]},{50,10,[61,80]},{70,5,[71,80]},{100,2,[81,90]},{150,1,[91,100]}]
A2451: 2403 | B2451: 5 | C2451: 27 | D2451: 0 | E2451: 91 | F2451: 100 | G2451: 4 | H2451: 20000 | I2451: 110003 | J2451: 4 | K2451: [{7,3},{8,3},{9,3},{10,3},{11,3},{12,3},{17,10},{18,8},{19,1},{23,4},{24,10}] | L2451: [{7,27},{8,55},{9,27},{10,55},{11,27},{12,55},{17,18},{18,110},{19,3},{23,37},{24,37}] | M2451: [{0,1,[1,30]},{1,2,[11,40]},{2,5,[21,50]},{5,10,[31,60]},{10,20,[41,60]},{30,20,[51,70]},{50,10,[61,80]},{70,5,[71,80]},{100,2,[81,90]},{150,1,[91,100]}]
A2452: 2404 | B2452: 6 | C2452: 27 | D2452: 0 | E2452: 91 | F2452: 100 | G2452: 5 | H2452: 20000 | I2452: 110003 | J2452: 5 | K2452: [{7,3},{8,3},{9,3},{10,3},{11,3},{12,3},{17,10},{18,8},{19,1},{23,4},{24,10}] | L2452: [{7,27},{8,55},{9,27},{10,55},{11,27},{12,55},{17,18},{18,110},{19,3},{23,37},{24,37}] | M2452: [{0,1,[1,30]},{1,2,[11,40]},{2,5,[21,50]},{5,10,[31,60]},{10,20,[41,60]},{30,20,[51,70]},{50,10,[61,80]},{70,5,[71,80]},{100,2,[81,90]},{150,1,[91,100]}]

Sheet: 配置模型
A1: 攻击属性
A2: 战士洗练属性 | B2: 属性ID | C2: 刷新权重 | G2: 法师洗练属性 | H2: 属性ID | I2: 刷新权重 | M2: 道士洗练属性 | N2: 属性ID | O2: 刷新权重 | S2: 无职业洗练属性 | T2: 属性ID | U2: 刷新权重
A3: 最小物攻 | B3: 7 | C3: 6 | D3: ="{"&RC[-2]&","&RC[-1]&"}," -> {7,6}, | E3: =RC[-1] -> {7,6}, | G3: 最小物攻 | H3: 7 | I3: 0 | J3: ="{"&RC[-2]&","&RC[-1]&"}," -> {7,0}, | K3: =RC[-1] -> {7,0}, | M3: 最小物攻 | N3: 7 | O3: 0 | P3: ="{"&RC[-2]&","&RC[-1]&"}," -> {7,0}, | Q3: =RC[-1] -> {7,0}, | S3: 最小物攻 | T3: 7 | U3: 3 | V3: ="{"&RC[-2]&","&RC[-1]&"}," -> {7,3}, | W3: =RC[-1] -> {7,3},
A4: 最大物攻 | B4: 8 | C4: 4 | D4: ="{"&RC[-2]&","&RC[-1]&"}," -> {8,4}, | E4: =R[-1]C&RC[-1] -> {7,6},{8,4}, | G4: 最大物攻 | H4: 8 | I4: 0 | J4: ="{"&RC[-2]&","&RC[-1]&"}," -> {8,0}, | K4: =R[-1]C&RC[-1] -> {7,0},{8,0}, | M4: 最大物攻 | N4: 8 | O4: 0 | P4: ="{"&RC[-2]&","&RC[-1]&"}," -> {8,0}, | Q4: =R[-1]C&RC[-1] -> {7,0},{8,0}, | S4: 最大物攻 | T4: 8 | U4: 3 | V4: ="{"&RC[-2]&","&RC[-1]&"}," -> {8,3}, | W4: =R[-1]C&RC[-1] -> {7,3},{8,3},
A5: 最小法攻 | B5: 9 | C5: 0 | D5: ="{"&RC[-2]&","&RC[-1]&"}," -> {9,0}, | E5: =R[-1]C&RC[-1] -> {7,6},{8,4},{9,0}, | G5: 最小法攻 | H5: 9 | I5: 6 | J5: ="{"&RC[-2]&","&RC[-1]&"}," -> {9,6}, | K5: =R[-1]C&RC[-1] -> {7,0},{8,0},{9,6}, | M5: 最小法攻 | N5: 9 | O5: 0 | P5: ="{"&RC[-2]&","&RC[-1]&"}," -> {9,0}, | Q5: =R[-1]C&RC[-1] -> {7,0},{8,0},{9,0}, | S5: 最小法攻 | T5: 9 | U5: 3 | V5: ="{"&RC[-2]&","&RC[-1]&"}," -> {9,3}, | W5: =R[-1]C&RC[-1] -> {7,3},{8,3},{9,3},
A6: 最大法攻 | B6: 10 | C6: 0 | D6: ="{"&RC[-2]&","&RC[-1]&"}," -> {10,0}, | E6: =R[-1]C&RC[-1] -> {7,6},{8,4},{9,0},{10,0}, | G6: 最大法攻 | H6: 10 | I6: 4 | J6: ="{"&RC[-2]&","&RC[-1]&"}," -> {10,4}, | K6: =R[-1]C&RC[-1] -> {7,0},{8,0},{9,6},{10,4}, | M6: 最大法攻 | N6: 10 | O6: 0 | P6: ="{"&RC[-2]&","&RC[-1]&"}," -> {10,0}, | Q6: =R[-1]C&RC[-1] -> {7,0},{8,0},{9,0},{10,0}, | S6: 最大法攻 | T6: 10 | U6: 3 | V6: ="{"&RC[-2]&","&RC[-1]&"}," -> {10,3}, | W6: =R[-1]C&RC[-1] -> {7,3},{8,3},{9,3},{10,3},
A7: 最小道攻 | B7: 11 | C7: 0 | D7: ="{"&RC[-2]&","&RC[-1]&"}," -> {11,0}, | E7: =R[-1]C&RC[-1] -> {7,6},{8,4},{9,0},{10,0},{11,0}, | G7: 最小道攻 | H7: 11 | I7: 0 | J7: ="{"&RC[-2]&","&RC[-1]&"}," -> {11,0}, | K7: =R[-1]C&RC[-1] -> {7,0},{8,0},{9,6},{10,4},{11,0}, | M7: 最小道攻 | N7: 11 | O7: 6 | P7: ="{"&RC[-2]&","&RC[-1]&"}," -> {11,6}, | Q7: =R[-1]C&RC[-1] -> {7,0},{8,0},{9,0},{10,0},{11,6}, | S7: 最小道攻 | T7: 11 | U7: 3 | V7: ="{"&RC[-2]&","&RC[-1]&"}," -> {11,3}, | W7: =R[-1]C&RC[-1] -> {7,3},{8,3},{9,3},{10,3},{11,3},
A8: 最大道攻 | B8: 12 | C8: 0 | D8: ="{"&RC[-2]&","&RC[-1]&"}," -> {12,0}, | E8: =R[-1]C&RC[-1] -> {7,6},{8,4},{9,0},{10,0},{11,0},{12,0}, | G8: 最大道攻 | H8: 12 | I8: 0 | J8: ="{"&RC[-2]&","&RC[-1]&"}," -> {12,0}, | K8: =R[-1]C&RC[-1] -> {7,0},{8,0},{9,6},{10,4},{11,0},{12,0}, | M8: 最大道攻 | N8: 12 | O8: 4 | P8: ="{"&RC[-2]&","&RC[-1]&"}," -> {12,4}, | Q8: =R[-1]C&RC[-1] -> {7,0},{8,0},{9,0},{10,0},{11,6},{12,4}, | S8: 最大道攻 | T8: 12 | U8: 3 | V8: ="{"&RC[-2]&","&RC[-1]&"}," -> {12,3}, | W8: =R[-1]C&RC[-1] -> {7,3},{8,3},{9,3},{10,3},{11,3},{12,3},
A9: 暴击 | B9: 17 | C9: 10 | D9: ="{"&RC[-2]&","&RC[-1]&"}," -> {17,10}, | E9: =R[-1]C&RC[-1] -> {7,6},{8,4},{9,0},{10,0},{11,0},{12,0},{17,10}, | G9: 暴击 | H9: 17 | I9: 10 | J9: ="{"&RC[-2]&","&RC[-1]&"}," -> {17,10}, | K9: =R[-1]C&RC[-1] -> {7,0},{8,0},{9,6},{10,4},{11,0},{12,0},{17,10}, | M9: 暴击 | N9: 17 | O9: 10 | P9: ="{"&RC[-2]&","&RC[-1]&"}," -> {17,10}, | Q9: =R[-1]C&RC[-1] -> {7,0},{8,0},{9,0},{10,0},{11,6},{12,4},{17,10}, | S9: 暴击 | T9: 17 | U9: 10 | V9: ="{"&RC[-2]&","&RC[-1]&"}," -> {17,10}, | W9: =R[-1]C&RC[-1] -> {7,3},{8,3},{9,3},{10,3},{11,3},{12,3},{17,10},
A10: 暴击力 | B10: 18 | C10: 8 | D10: ="{"&RC[-2]&","&RC[-1]&"}," -> {18,8}, | E10: =R[-1]C&RC[-1] -> {7,6},{8,4},{9,0},{10,0},{11,0},{12,0},{17,10},{18,8}, | G10: 暴击力 | H10: 18 | I10: 8 | J10: ="{"&RC[-2]&","&RC[-1]&"}," -> {18,8}, | K10: =R[-1]C&RC[-1] -> {7,0},{8,0},{9,6},{10,4},{11,0},{12,0},{17,10},{18,8}, | M10: 暴击力 | N10: 18 | O10: 8 | P10: ="{"&RC[-2]&","&RC[-1]&"}," -> {18,8}, | Q10: =R[-1]C&RC[-1] -> {7,0},{8,0},{9,0},{10,0},{11,6},{12,4},{17,10},{18,8}, | S10: 暴击力 | T10: 18 | U10: 8 | V10: ="{"&RC[-2]&","&RC[-1]&"}," -> {18,8}, | W10: =R[-1]C&RC[-1] -> {7,3},{8,3},{9,3},{10,3},{11,3},{12,3},{17,10},{18,8},
A11: 精准 | B11: 19 | C11: 1 | D11: ="{"&RC[-2]&","&RC[-1]&"}," -> {19,1}, | E11: =R[-1]C&RC[-1] -> {7,6},{8,4},{9,0},{10,0},{11,0},{12,0},{17,10},{18,8},{19,1}, | G11: 精准 | H11: 19 | I11: 1 | J11: ="{"&RC[-2]&","&RC[-1]&"}," -> {19,1}, | K11: =R[-1]C&RC[-1] -> {7,0},{8,0},{9,6},{10,4},{11,0},{12,0},{17,10},{18,8},{19,1}, | M11: 精准 | N11: 19 | O11: 1 | P11: ="{"&RC[-2]&","&RC[-1]&"}," -> {19,1}, | Q11: =R[-1]C&RC[-1] -> {7,0},{8,0},{9,0},{10,0},{11,6},{12,4},{17,10},{18,8},{19,1}, | S11: 精准 | T11: 19 | U11: 1 | V11: ="{"&RC[-2]&","&RC[-1]&"}," -> {19,1}, | W11: =R[-1]C&RC[-1] -> {7,3},{8,3},{9,3},{10,3},{11,3},{12,3},{17,10},{18,8},{19,1},
A12: 神圣 | B12: 23 | C12: 4 | D12: ="{"&RC[-2]&","&RC[-1]&"}," -> {23,4}, | E12: =R[-1]C&RC[-1] -> {7,6},{8,4},{9,0},{10,0},{11,0},{12,0},{17,10},{18,8},{19,1},{23,4}, | G12: 神圣 | H12: 23 | I12: 4 | J12: ="{"&RC[-2]&","&RC[-1]&"}," -> {23,4}, | K12: =R[-1]C&RC[-1] -> {7,0},{8,0},{9,6},{10,4},{11,0},{12,0},{17,10},{18,8},{19,1},{23,4}, | M12: 神圣 | N12: 23 | O12: 4 | P12: ="{"&RC[-2]&","&RC[-1]&"}," -> {23,4}, | Q12: =R[-1]C&RC[-1] -> {7,0},{8,0},{9,0},{10,0},{11,6},{12,4},{17,10},{18,8},{19,1},{23,4}, | S12: 神圣 | T12: 23 | U12: 4 | V12: ="{"&RC[-2]&","&RC[-1]&"}," -> {23,4}, | W12: =R[-1]C&RC[-1] -> {7,3},{8,3},{9,3},{10,3},{11,3},{12,3},{17,10},{18,8},{19,1},{23,4},
A13: 技能伤害追加 | B13: 24 | C13: 10 | D13: ="{"&RC[-2]&","&RC[-1]&"}" -> {24,10} | E13: =R[-1]C&RC[-1] -> {7,6},{8,4},{9,0},{10,0},{11,0},{12,0},{17,10},{18,8},{19,1},{23,4},{24,10} | G13: 技能伤害追加 | H13: 24 | I13: 10 | J13: ="{"&RC[-2]&","&RC[-1]&"}" -> {24,10} | K13: =R[-1]C&RC[-1] -> {7,0},{8,0},{9,6},{10,4},{11,0},{12,0},{17,10},{18,8},{19,1},{23,4},{24,10} | M13: 技能伤害追加 | N13: 24 | O13: 10 | P13: ="{"&RC[-2]&","&RC[-1]&"}" -> {24,10} | Q13: =R[-1]C&RC[-1] -> {7,0},{8,0},{9,0},{10,0},{11,6},{12,4},{17,10},{18,8},{19,1},{23,4},{24,10} | S13: 技能伤害追加 | T13: 24 | U13: 10 | V13: ="{"&RC[-2]&","&RC[-1]&"}" -> {24,10} | W13: =R[-1]C&RC[-1] -> {7,3},{8,3},{9,3},{10,3},{11,3},{12,3},{17,10},{18,8},{19,1},{23,4},{24,10}
E15: ="["&R[-2]C&"]" -> [{7,6},{8,4},{9,0},{10,0},{11,0},{12,0},{17,10},{18,8},{19,1},{23,4},{24,10}] | K15: ="["&R[-2]C&"]" -> [{7,0},{8,0},{9,6},{10,4},{11,0},{12,0},{17,10},{18,8},{19,1},{23,4},{24,10}] | Q15: ="["&R[-2]C&"]" -> [{7,0},{8,0},{9,0},{10,0},{11,6},{12,4},{17,10},{18,8},{19,1},{23,4},{24,10}] | W15: ="["&R[-2]C&"]" -> [{7,3},{8,3},{9,3},{10,3},{11,3},{12,3},{17,10},{18,8},{19,1},{23,4},{24,10}]
B18: =VLOOKUP(R[1]C,R2C1:R13C2,2,0) -> 7 | C18: =VLOOKUP(R[1]C,R2C1:R13C2,2,0) -> 8 | D18: =VLOOKUP(R[1]C,R2C1:R13C2,2,0) -> 9 | E18: =VLOOKUP(R[1]C,R2C1:R13C2,2,0) -> 10 | F18: =VLOOKUP(R[1]C,R2C1:R13C2,2,0) -> 11 | G18: =VLOOKUP(R[1]C,R2C1:R13C2,2,0) -> 12 | H18: =VLOOKUP(R[1]C,R2C1:R13C2,2,0) -> 17 | I18: =VLOOKUP(R[1]C,R2C1:R13C2,2,0) -> 18 | J18: =VLOOKUP(R[1]C,R2C1:R13C2,2,0) -> 19 | K18: =VLOOKUP(R[1]C,R2C1:R13C2,2,0) -> 23 | L18: =VLOOKUP(R[1]C,R2C1:R13C2,2,0) -> 24
A19: 等级 | B19: 最小物攻 | C19: 最大物攻 | D19: 最小法攻 | E19: 最大法攻 | F19: 最小道攻 | G19: 最大道攻 | H19: 暴击 | I19: 暴击力 | J19: 精准 | K19: 神圣 | L19: 技能伤害追加
A20: 20 | B20: 6 | C20: 12 | D20: 6 | E20: 12 | F20: 6 | G20: 12 | H20: 4 | I20: =RC[2]*3 -> 24 | J20: 3 | K20: 8 | L20: 8
A21: 30 | B21: 6 | C21: 13 | D21: 6 | E21: 13 | F21: 6 | G21: 13 | H21: 4 | I21: =RC[2]*3 -> 27 | J21: 3 | K21: 9 | L21: 9
A22: 40 | B22: 9 | C22: 18 | D22: 9 | E22: 18 | F22: 9 | G22: 18 | H22: 6 | I22: =RC[2]*3 -> 36 | J22: 3 | K22: 12 | L22: 12 | N22: =2*6 -> 12
A23: 50 | B23: 11 | C23: 22 | D23: 11 | E23: 22 | F23: 11 | G23: 22 | H23: 7 | I23: =RC[2]*3 -> 45 | J23: 3 | K23: 15 | L23: 15 | M23: 暴击（一般） | N23: =18*6 -> 108 | O23: 0.13
A24: 60 | B24: 18 | C24: 36 | D24: 18 | E24: 36 | F24: 18 | G24: 36 | H24: 12 | I24: =RC[2]*3 -> 72 | J24: 3 | K24: 24 | L24: 24 | M24: 暴击（中等） | N24: 200 | O24: 0.22
A25: 70 | B25: 27 | C25: 55 | D25: 27 | E25: 55 | F25: 27 | G25: 55 | H25: 18 | I25: 110 | J25: 3 | K25: 37 | L25: 37 | M25: 暴击（最大） | N25: 400 | O25: 0.36
A26: 80 | B26: 39 | C26: 78 | D26: 39 | E26: 78 | F26: 39 | G26: 78 | H26: 26 | I26: =RC[2]*3 -> 168 | J26: 3 | K26: 56 | L26: 56
A27: 90 | B27: 54 | C27: 108 | D27: 54 | E27: 108 | F27: 54 | G27: 108 | H27: 36 | I27: =RC[2]*3 -> 243 | J27: 3 | K27: 81 | L27: 81
A28: 100 | B28: 75 | C28: 150 | D28: 75 | E28: 150 | F28: 75 | G28: 150 | H28: 50 | I28: =RC[2]*3 -> 345 | J28: 3 | K28: 115 | L28: 115
W29: 7.4404761904761892E-3 | X29: 7.4404761904761892E-3
A31: 属性最大值配置
A32: 等级
A33: 20 | B33: ="{"&R18C&","&R[-13]C&"}," -> {7,6}, | C33: ="{"&R18C&","&R[-13]C&"}," -> {8,12}, | D33: ="{"&R18C&","&R[-13]C&"}," -> {9,6}, | E33: ="{"&R18C&","&R[-13]C&"}," -> {10,12}, | F33: ="{"&R18C&","&R[-13]C&"}," -> {11,6}, | G33: ="{"&R18C&","&R[-13]C&"}," -> {12,12}, | H33: ="{"&R18C&","&R[-13]C&"}," -> {17,4}, | I33: ="{"&R18C&","&R[-13]C&"}," -> {18,24}, | J33: ="{"&R18C&","&R[-13]C&"}," -> {19,3}, | K33: ="{"&R18C&","&R[-13]C&"}," -> {23,8}, | L33: ="{"&R18C&","&R[-13]C&"}" -> {24,8}
A34: 30 | B34: ="{"&R18C&","&R[-13]C&"}," -> {7,6}, | C34: ="{"&R18C&","&R[-13]C&"}," -> {8,13}, | D34: ="{"&R18C&","&R[-13]C&"}," -> {9,6}, | E34: ="{"&R18C&","&R[-13]C&"}," -> {10,13}, | F34: ="{"&R18C&","&R[-13]C&"}," -> {11,6}, | G34: ="{"&R18C&","&R[-13]C&"}," -> {12,13}, | H34: ="{"&R18C&","&R[-13]C&"}," -> {17,4}, | I34: ="{"&R18C&","&R[-13]C&"}," -> {18,27}, | J34: ="{"&R18C&","&R[-13]C&"}," -> {19,3}, | K34: ="{"&R18C&","&R[-13]C&"}," -> {23,9}, | L34: ="{"&R18C&","&R[-13]C&"}" -> {24,9}
A35: 40 | B35: ="{"&R18C&","&R[-13]C&"}," -> {7,9}, | C35: ="{"&R18C&","&R[-13]C&"}," -> {8,18}, | D35: ="{"&R18C&","&R[-13]C&"}," -> {9,9}, | E35: ="{"&R18C&","&R[-13]C&"}," -> {10,18}, | F35: ="{"&R18C&","&R[-13]C&"}," -> {11,9}, | G35: ="{"&R18C&","&R[-13]C&"}," -> {12,18}, | H35: ="{"&R18C&","&R[-13]C&"}," -> {17,6}, | I35: ="{"&R18C&","&R[-13]C&"}," -> {18,36}, | J35: ="{"&R18C&","&R[-13]C&"}," -> {19,3}, | K35: ="{"&R18C&","&R[-13]C&"}," -> {23,12}, | L35: ="{"&R18C&","&R[-13]C&"}" -> {24,12}
A36: 50 | B36: ="{"&R18C&","&R[-13]C&"}," -> {7,11}, | C36: ="{"&R18C&","&R[-13]C&"}," -> {8,22}, | D36: ="{"&R18C&","&R[-13]C&"}," -> {9,11}, | E36: ="{"&R18C&","&R[-13]C&"}," -> {10,22}, | F36: ="{"&R18C&","&R[-13]C&"}," -> {11,11}, | G36: ="{"&R18C&","&R[-13]C&"}," -> {12,22}, | H36: ="{"&R18C&","&R[-13]C&"}," -> {17,7}, | I36: ="{"&R18C&","&R[-13]C&"}," -> {18,45}, | J36: ="{"&R18C&","&R[-13]C&"}," -> {19,3}, | K36: ="{"&R18C&","&R[-13]C&"}," -> {23,15}, | L36: ="{"&R18C&","&R[-13]C&"}" -> {24,15}
A37: 60 | B37: ="{"&R18C&","&R[-13]C&"}," -> {7,18}, | C37: ="{"&R18C&","&R[-13]C&"}," -> {8,36}, | D37: ="{"&R18C&","&R[-13]C&"}," -> {9,18}, | E37: ="{"&R18C&","&R[-13]C&"}," -> {10,36}, | F37: ="{"&R18C&","&R[-13]C&"}," -> {11,18}, | G37: ="{"&R18C&","&R[-13]C&"}," -> {12,36}, | H37: ="{"&R18C&","&R[-13]C&"}," -> {17,12}, | I37: ="{"&R18C&","&R[-13]C&"}," -> {18,72}, | J37: ="{"&R18C&","&R[-13]C&"}," -> {19,3}, | K37: ="{"&R18C&","&R[-13]C&"}," -> {23,24}, | L37: ="{"&R18C&","&R[-13]C&"}" -> {24,24}
A38: 70 | B38: ="{"&R18C&","&R[-13]C&"}," -> {7,27}, | C38: ="{"&R18C&","&R[-13]C&"}," -> {8,55}, | D38: ="{"&R18C&","&R[-13]C&"}," -> {9,27}, | E38: ="{"&R18C&","&R[-13]C&"}," -> {10,55}, | F38: ="{"&R18C&","&R[-13]C&"}," -> {11,27}, | G38: ="{"&R18C&","&R[-13]C&"}," -> {12,55}, | H38: ="{"&R18C&","&R[-13]C&"}," -> {17,18}, | I38: ="{"&R18C&","&R[-13]C&"}," -> {18,110}, | J38: ="{"&R18C&","&R[-13]C&"}," -> {19,3}, | K38: ="{"&R18C&","&R[-13]C&"}," -> {23,37}, | L38: ="{"&R18C&","&R[-13]C&"}" -> {24,37}
A39: 80 | B39: ="{"&R18C&","&R[-13]C&"}," -> {7,39}, | C39: ="{"&R18C&","&R[-13]C&"}," -> {8,78}, | D39: ="{"&R18C&","&R[-13]C&"}," -> {9,39}, | E39: ="{"&R18C&","&R[-13]C&"}," -> {10,78}, | F39: ="{"&R18C&","&R[-13]C&"}," -> {11,39}, | G39: ="{"&R18C&","&R[-13]C&"}," -> {12,78}, | H39: ="{"&R18C&","&R[-13]C&"}," -> {17,26}, | I39: ="{"&R18C&","&R[-13]C&"}," -> {18,168}, | J39: ="{"&R18C&","&R[-13]C&"}," -> {19,3}, | K39: ="{"&R18C&","&R[-13]C&"}," -> {23,56}, | L39: ="{"&R18C&","&R[-13]C&"}" -> {24,56}
A40: 90 | B40: ="{"&R18C&","&R[-13]C&"}," -> {7,54}, | C40: ="{"&R18C&","&R[-13]C&"}," -> {8,108}, | D40: ="{"&R18C&","&R[-13]C&"}," -> {9,54}, | E40: ="{"&R18C&","&R[-13]C&"}," -> {10,108}, | F40: ="{"&R18C&","&R[-13]C&"}," -> {11,54}, | G40: ="{"&R18C&","&R[-13]C&"}," -> {12,108}, | H40: ="{"&R18C&","&R[-13]C&"}," -> {17,36}, | I40: ="{"&R18C&","&R[-13]C&"}," -> {18,243}, | J40: ="{"&R18C&","&R[-13]C&"}," -> {19,3}, | K40: ="{"&R18C&","&R[-13]C&"}," -> {23,81}, | L40: ="{"&R18C&","&R[-13]C&"}" -> {24,81}
A41: 100 | B41: ="{"&R18C&","&R[-13]C&"}," -> {7,75}, | C41: ="{"&R18C&","&R[-13]C&"}," -> {8,150}, | D41: ="{"&R18C&","&R[-13]C&"}," -> {9,75}, | E41: ="{"&R18C&","&R[-13]C&"}," -> {10,150}, | F41: ="{"&R18C&","&R[-13]C&"}," -> {11,75}, | G41: ="{"&R18C&","&R[-13]C&"}," -> {12,150}, | H41: ="{"&R18C&","&R[-13]C&"}," -> {17,50}, | I41: ="{"&R18C&","&R[-13]C&"}," -> {18,345}, | J41: ="{"&R18C&","&R[-13]C&"}," -> {19,3}, | K41: ="{"&R18C&","&R[-13]C&"}," -> {23,115}, | L41: ="{"&R18C&","&R[-13]C&"}" -> {24,115}
A43: 20 | B43: =R[-10]C -> {7,6}, | C43: =RC[-1]&R[-10]C -> {7,6},{8,12}, | D43: =RC[-1]&R[-10]C -> {7,6},{8,12},{9,6}, | E43: =RC[-1]&R[-10]C -> {7,6},{8,12},{9,6},{10,12}, | F43: =RC[-1]&R[-10]C -> {7,6},{8,12},{9,6},{10,12},{11,6}, | G43: =RC[-1]&R[-10]C -> {7,6},{8,12},{9,6},{10,12},{11,6},{12,12}, | H43: =RC[-1]&R[-10]C -> {7,6},{8,12},{9,6},{10,12},{11,6},{12,12},{17,4}, | I43: =RC[-1]&R[-10]C -> {7,6},{8,12},{9,6},{10,12},{11,6},{12,12},{17,4},{18,24}, | J43: =RC[-1]&R[-10]C -> {7,6},{8,12},{9,6},{10,12},{11,6},{12,12},{17,4},{18,24},{19,3}, | K43: =RC[-1]&R[-10]C -> {7,6},{8,12},{9,6},{10,12},{11,6},{12,12},{17,4},{18,24},{19,3},{23,8}, | L43: =RC[-1]&R[-10]C -> {7,6},{8,12},{9,6},{10,12},{11,6},{12,12},{17,4},{18,24},{19,3},{23,8},{24,8} | M43: ="["&RC[-1]&"]" -> [{7,6},{8,12},{9,6},{10,12},{11,6},{12,12},{17,4},{18,24},{19,3},{23,8},{24,8}]
A44: 30 | B44: =R[-10]C -> {7,6}, | C44: =RC[-1]&R[-10]C -> {7,6},{8,13}, | D44: =RC[-1]&R[-10]C -> {7,6},{8,13},{9,6}, | E44: =RC[-1]&R[-10]C -> {7,6},{8,13},{9,6},{10,13}, | F44: =RC[-1]&R[-10]C -> {7,6},{8,13},{9,6},{10,13},{11,6}, | G44: =RC[-1]&R[-10]C -> {7,6},{8,13},{9,6},{10,13},{11,6},{12,13}, | H44: =RC[-1]&R[-10]C -> {7,6},{8,13},{9,6},{10,13},{11,6},{12,13},{17,4}, | I44: =RC[-1]&R[-10]C -> {7,6},{8,13},{9,6},{10,13},{11,6},{12,13},{17,4},{18,27}, | J44: =RC[-1]&R[-10]C -> {7,6},{8,13},{9,6},{10,13},{11,6},{12,13},{17,4},{18,27},{19,3}, | K44: =RC[-1]&R[-10]C -> {7,6},{8,13},{9,6},{10,13},{11,6},{12,13},{17,4},{18,27},{19,3},{23,9}, | L44: =RC[-1]&R[-10]C -> {7,6},{8,13},{9,6},{10,13},{11,6},{12,13},{17,4},{18,27},{19,3},{23,9},{24,9} | M44: ="["&RC[-1]&"]" -> [{7,6},{8,13},{9,6},{10,13},{11,6},{12,13},{17,4},{18,27},{19,3},{23,9},{24,9}]
A45: 40 | B45: =R[-10]C -> {7,9}, | C45: =RC[-1]&R[-10]C -> {7,9},{8,18}, | D45: =RC[-1]&R[-10]C -> {7,9},{8,18},{9,9}, | E45: =RC[-1]&R[-10]C -> {7,9},{8,18},{9,9},{10,18}, | F45: =RC[-1]&R[-10]C -> {7,9},{8,18},{9,9},{10,18},{11,9}, | G45: =RC[-1]&R[-10]C -> {7,9},{8,18},{9,9},{10,18},{11,9},{12,18}, | H45: =RC[-1]&R[-10]C -> {7,9},{8,18},{9,9},{10,18},{11,9},{12,18},{17,6}, | I45: =RC[-1]&R[-10]C -> {7,9},{8,18},{9,9},{10,18},{11,9},{12,18},{17,6},{18,36}, | J45: =RC[-1]&R[-10]C -> {7,9},{8,18},{9,9},{10,18},{11,9},{12,18},{17,6},{18,36},{19,3}, | K45: =RC[-1]&R[-10]C -> {7,9},{8,18},{9,9},{10,18},{11,9},{12,18},{17,6},{18,36},{19,3},{23,12}, | L45: =RC[-1]&R[-10]C -> {7,9},{8,18},{9,9},{10,18},{11,9},{12,18},{17,6},{18,36},{19,3},{23,12},{24,12} | M45: ="["&RC[-1]&"]" -> [{7,9},{8,18},{9,9},{10,18},{11,9},{12,18},{17,6},{18,36},{19,3},{23,12},{24,12}]
A46: 50 | B46: =R[-10]C -> {7,11}, | C46: =RC[-1]&R[-10]C -> {7,11},{8,22}, | D46: =RC[-1]&R[-10]C -> {7,11},{8,22},{9,11}, | E46: =RC[-1]&R[-10]C -> {7,11},{8,22},{9,11},{10,22}, | F46: =RC[-1]&R[-10]C -> {7,11},{8,22},{9,11},{10,22},{11,11}, | G46: =RC[-1]&R[-10]C -> {7,11},{8,22},{9,11},{10,22},{11,11},{12,22}, | H46: =RC[-1]&R[-10]C -> {7,11},{8,22},{9,11},{10,22},{11,11},{12,22},{17,7}, | I46: =RC[-1]&R[-10]C -> {7,11},{8,22},{9,11},{10,22},{11,11},{12,22},{17,7},{18,45}, | J46: =RC[-1]&R[-10]C -> {7,11},{8,22},{9,11},{10,22},{11,11},{12,22},{17,7},{18,45},{19,3}, | K46: =RC[-1]&R[-10]C -> {7,11},{8,22},{9,11},{10,22},{11,11},{12,22},{17,7},{18,45},{19,3},{23,15}, | L46: =RC[-1]&R[-10]C -> {7,11},{8,22},{9,11},{10,22},{11,11},{12,22},{17,7},{18,45},{19,3},{23,15},{24,15} | M46: ="["&RC[-1]&"]" -> [{7,11},{8,22},{9,11},{10,22},{11,11},{12,22},{17,7},{18,45},{19,3},{23,15},{24,15}]
A47: 60 | B47: =R[-10]C -> {7,18}, | C47: =RC[-1]&R[-10]C -> {7,18},{8,36}, | D47: =RC[-1]&R[-10]C -> {7,18},{8,36},{9,18}, | E47: =RC[-1]&R[-10]C -> {7,18},{8,36},{9,18},{10,36}, | F47: =RC[-1]&R[-10]C -> {7,18},{8,36},{9,18},{10,36},{11,18}, | G47: =RC[-1]&R[-10]C -> {7,18},{8,36},{9,18},{10,36},{11,18},{12,36}, | H47: =RC[-1]&R[-10]C -> {7,18},{8,36},{9,18},{10,36},{11,18},{12,36},{17,12}, | I47: =RC[-1]&R[-10]C -> {7,18},{8,36},{9,18},{10,36},{11,18},{12,36},{17,12},{18,72}, | J47: =RC[-1]&R[-10]C -> {7,18},{8,36},{9,18},{10,36},{11,18},{12,36},{17,12},{18,72},{19,3}, | K47: =RC[-1]&R[-10]C -> {7,18},{8,36},{9,18},{10,36},{11,18},{12,36},{17,12},{18,72},{19,3},{23,24}, | L47: =RC[-1]&R[-10]C -> {7,18},{8,36},{9,18},{10,36},{11,18},{12,36},{17,12},{18,72},{19,3},{23,24},{24,24} | M47: ="["&RC[-1]&"]" -> [{7,18},{8,36},{9,18},{10,36},{11,18},{12,36},{17,12},{18,72},{19,3},{23,24},{24,24}]
A48: 70 | B48: =R[-10]C -> {7,27}, | C48: =RC[-1]&R[-10]C -> {7,27},{8,55}, | D48: =RC[-1]&R[-10]C -> {7,27},{8,55},{9,27}, | E48: =RC[-1]&R[-10]C -> {7,27},{8,55},{9,27},{10,55}, | F48: =RC[-1]&R[-10]C -> {7,27},{8,55},{9,27},{10,55},{11,27}, | G48: =RC[-1]&R[-10]C -> {7,27},{8,55},{9,27},{10,55},{11,27},{12,55}, | H48: =RC[-1]&R[-10]C -> {7,27},{8,55},{9,27},{10,55},{11,27},{12,55},{17,18}, | I48: =RC[-1]&R[-10]C -> {7,27},{8,55},{9,27},{10,55},{11,27},{12,55},{17,18},{18,110}, | J48: =RC[-1]&R[-10]C -> {7,27},{8,55},{9,27},{10,55},{11,27},{12,55},{17,18},{18,110},{19,3}, | K48: =RC[-1]&R[-10]C -> {7,27},{8,55},{9,27},{10,55},{11,27},{12,55},{17,18},{18,110},{19,3},{23,37}, | L48: =RC[-1]&R[-10]C -> {7,27},{8,55},{9,27},{10,55},{11,27},{12,55},{17,18},{18,110},{19,3},{23,37},{24,37} | M48: ="["&RC[-1]&"]" -> [{7,27},{8,55},{9,27},{10,55},{11,27},{12,55},{17,18},{18,110},{19,3},{23,37},{24,37}]
A49: 80 | B49: =R[-10]C -> {7,39}, | C49: =RC[-1]&R[-10]C -> {7,39},{8,78}, | D49: =RC[-1]&R[-10]C -> {7,39},{8,78},{9,39}, | E49: =RC[-1]&R[-10]C -> {7,39},{8,78},{9,39},{10,78}, | F49: =RC[-1]&R[-10]C -> {7,39},{8,78},{9,39},{10,78},{11,39}, | G49: =RC[-1]&R[-10]C -> {7,39},{8,78},{9,39},{10,78},{11,39},{12,78}, | H49: =RC[-1]&R[-10]C -> {7,39},{8,78},{9,39},{10,78},{11,39},{12,78},{17,26}, | I49: =RC[-1]&R[-10]C -> {7,39},{8,78},{9,39},{10,78},{11,39},{12,78},{17,26},{18,168}, | J49: =RC[-1]&R[-10]C -> {7,39},{8,78},{9,39},{10,78},{11,39},{12,78},{17,26},{18,168},{19,3}, | K49: =RC[-1]&R[-10]C -> {7,39},{8,78},{9,39},{10,78},{11,39},{12,78},{17,26},{18,168},{19,3},{23,56}, | L49: =RC[-1]&R[-10]C -> {7,39},{8,78},{9,39},{10,78},{11,39},{12,78},{17,26},{18,168},{19,3},{23,56},{24,56} | M49: ="["&RC[-1]&"]" -> [{7,39},{8,78},{9,39},{10,78},{11,39},{12,78},{17,26},{18,168},{19,3},{23,56},{24,56}]
A50: 90 | B50: =R[-10]C -> {7,54}, | C50: =RC[-1]&R[-10]C -> {7,54},{8,108}, | D50: =RC[-1]&R[-10]C -> {7,54},{8,108},{9,54}, | E50: =RC[-1]&R[-10]C -> {7,54},{8,108},{9,54},{10,108}, | F50: =RC[-1]&R[-10]C -> {7,54},{8,108},{9,54},{10,108},{11,54}, | G50: =RC[-1]&R[-10]C -> {7,54},{8,108},{9,54},{10,108},{11,54},{12,108}, | H50: =RC[-1]&R[-10]C -> {7,54},{8,108},{9,54},{10,108},{11,54},{12,108},{17,36}, | I50: =RC[-1]&R[-10]C -> {7,54},{8,108},{9,54},{10,108},{11,54},{12,108},{17,36},{18,243}, | J50: =RC[-1]&R[-10]C -> {7,54},{8,108},{9,54},{10,108},{11,54},{12,108},{17,36},{18,243},{19,3}, | K50: =RC[-1]&R[-10]C -> {7,54},{8,108},{9,54},{10,108},{11,54},{12,108},{17,36},{18,243},{19,3},{23,81}, | L50: =RC[-1]&R[-10]C -> {7,54},{8,108},{9,54},{10,108},{11,54},{12,108},{17,36},{18,243},{19,3},{23,81},{24,81} | M50: ="["&RC[-1]&"]" -> [{7,54},{8,108},{9,54},{10,108},{11,54},{12,108},{17,36},{18,243},{19,3},{23,81},{24,81}]
A51: 100 | B51: =R[-10]C -> {7,75}, | C51: =RC[-1]&R[-10]C -> {7,75},{8,150}, | D51: =RC[-1]&R[-10]C -> {7,75},{8,150},{9,75}, | E51: =RC[-1]&R[-10]C -> {7,75},{8,150},{9,75},{10,150}, | F51: =RC[-1]&R[-10]C -> {7,75},{8,150},{9,75},{10,150},{11,75}, | G51: =RC[-1]&R[-10]C -> {7,75},{8,150},{9,75},{10,150},{11,75},{12,150}, | H51: =RC[-1]&R[-10]C -> {7,75},{8,150},{9,75},{10,150},{11,75},{12,150},{17,50}, | I51: =RC[-1]&R[-10]C -> {7,75},{8,150},{9,75},{10,150},{11,75},{12,150},{17,50},{18,345}, | J51: =RC[-1]&R[-10]C -> {7,75},{8,150},{9,75},{10,150},{11,75},{12,150},{17,50},{18,345},{19,3}, | K51: =RC[-1]&R[-10]C -> {7,75},{8,150},{9,75},{10,150},{11,75},{12,150},{17,50},{18,345},{19,3},{23,115}, | L51: =RC[-1]&R[-10]C -> {7,75},{8,150},{9,75},{10,150},{11,75},{12,150},{17,50},{18,345},{19,3},{23,115},{24,115} | M51: ="["&RC[-1]&"]" -> [{7,75},{8,150},{9,75},{10,150},{11,75},{12,150},{17,50},{18,345},{19,3},{23,115},{24,115}]
A54: 洗练次数 | B54: 权重 | C54: 属性百分比下限 | D54: 属性百分比上限
A55: 0 | B55: 1 | C55: 1 | D55: 30 | E55: ="{"&RC[-4]&","&RC[-3]&",["&RC[-2]&","&RC[-1]&"]}," -> {0,1,[1,30]}, | F55: =RC[-1] -> {0,1,[1,30]},
A56: 1 | B56: 2 | C56: =R[-1]C+10 -> 11 | D56: =R[-1]C+10 -> 40 | E56: ="{"&RC[-4]&","&RC[-3]&",["&RC[-2]&","&RC[-1]&"]}," -> {1,2,[11,40]}, | F56: =R[-1]C&RC[-1] -> {0,1,[1,30]},{1,2,[11,40]},
A57: 2 | B57: 5 | C57: =R[-1]C+10 -> 21 | D57: =R[-1]C+10 -> 50 | E57: ="{"&RC[-4]&","&RC[-3]&",["&RC[-2]&","&RC[-1]&"]}," -> {2,5,[21,50]}, | F57: =R[-1]C&RC[-1] -> {0,1,[1,30]},{1,2,[11,40]},{2,5,[21,50]},
A58: 5 | B58: 10 | C58: =R[-1]C+10 -> 31 | D58: =R[-1]C+10 -> 60 | E58: ="{"&RC[-4]&","&RC[-3]&",["&RC[-2]&","&RC[-1]&"]}," -> {5,10,[31,60]}, | F58: =R[-1]C&RC[-1] -> {0,1,[1,30]},{1,2,[11,40]},{2,5,[21,50]},{5,10,[31,60]},
A59: 10 | B59: 20 | C59: =R[-1]C+10 -> 41 | D59: 60 | E59: ="{"&RC[-4]&","&RC[-3]&",["&RC[-2]&","&RC[-1]&"]}," -> {10,20,[41,60]}, | F59: =R[-1]C&RC[-1] -> {0,1,[1,30]},{1,2,[11,40]},{2,5,[21,50]},{5,10,[31,60]},{10,20,[41,60]},
A60: 30 | B60: 20 | C60: =R[-1]C+10 -> 51 | D60: 70 | E60: ="{"&RC[-4]&","&RC[-3]&",["&RC[-2]&","&RC[-1]&"]}," -> {30,20,[51,70]}, | F60: =R[-1]C&RC[-1] -> {0,1,[1,30]},{1,2,[11,40]},{2,5,[21,50]},{5,10,[31,60]},{10,20,[41,60]},{30,20,[51,70]},
A61: 50 | B61: 10 | C61: =R[-1]C+10 -> 61 | D61: =R[-1]C+10 -> 80 | E61: ="{"&RC[-4]&","&RC[-3]&",["&RC[-2]&","&RC[-1]&"]}," -> {50,10,[61,80]}, | F61: =R[-1]C&RC[-1] -> {0,1,[1,30]},{1,2,[11,40]},{2,5,[21,50]},{5,10,[31,60]},{10,20,[41,60]},{30,20,[51,70]},{50,10,[61,80]},
A62: 70 | B62: 5 | C62: =R[-1]C+10 -> 71 | D62: 80 | E62: ="{"&RC[-4]&","&RC[-3]&",["&RC[-2]&","&RC[-1]&"]}," -> {70,5,[71,80]}, | F62: =R[-1]C&RC[-1] -> {0,1,[1,30]},{1,2,[11,40]},{2,5,[21,50]},{5,10,[31,60]},{10,20,[41,60]},{30,20,[51,70]},{50,10,[61,80]},{70,5,[71,80]},
A63: 100 | B63: 2 | C63: =R[-1]C+10 -> 81 | D63: 90 | E63: ="{"&RC[-4]&","&RC[-3]&",["&RC[-2]&","&RC[-1]&"]}," -> {100,2,[81,90]}, | F63: =R[-1]C&RC[-1] -> {0,1,[1,30]},{1,2,[11,40]},{2,5,[21,50]},{5,10,[31,60]},{10,20,[41,60]},{30,20,[51,70]},{50,10,[61,80]},{70,5,[71,80]},{100,2,[81,90]},
A64: 150 | B64: 1 | C64: =R[-1]C+10 -> 91 | D64: 100 | E64: ="{"&RC[-4]&","&RC[-3]&",["&RC[-2]&","&RC[-1]&"]}" -> {150,1,[91,100]} | F64: =R[-1]C&RC[-1] -> {0,1,[1,30]},{1,2,[11,40]},{2,5,[21,50]},{5,10,[31,60]},{10,20,[41,60]},{30,20,[51,70]},{50,10,[61,80]},{70,5,[71,80]},{100,2,[81,90]},{150,1,[91,100]} | G64: ="["&RC[-1]&"]" -> [{0,1,[1,30]},{1,2,[11,40]},{2,5,[21,50]},{5,10,[31,60]},{10,20,[41,60]},{30,20,[51,70]},{50,10,[61,80]},{70,5,[71,80]},{100,2,[81,90]},{150,1,[91,100]}]
A67: 防御属性
A68: 洗练属性 | B68: 属性ID | C68: 刷新权重
A69: 生命 | B69: 5 | C69: 8 | D69: ="{"&RC[-2]&","&RC[-1]&"}," -> {5,8}, | E69: =RC[-1] -> {5,8},
A70: 魔法 | B70: 6 | C70: 15 | D70: ="{"&RC[-2]&","&RC[-1]&"}," -> {6,15}, | E70: =R[-1]C&RC[-1] -> {5,8},{6,15}, | H70: 原权重 | I70: 76
A71: 最小物防 | B71: 13 | C71: 10 | D71: ="{"&RC[-2]&","&RC[-1]&"}," -> {13,10}, | E71: =R[-1]C&RC[-1] -> {5,8},{6,15},{13,10},
A72: 最大物防 | B72: 14 | C72: 8 | D72: ="{"&RC[-2]&","&RC[-1]&"}," -> {14,8}, | E72: =R[-1]C&RC[-1] -> {5,8},{6,15},{13,10},{14,8},
A73: 最小法防 | B73: 15 | C73: 10 | D73: ="{"&RC[-2]&","&RC[-1]&"}," -> {15,10}, | E73: =R[-1]C&RC[-1] -> {5,8},{6,15},{13,10},{14,8},{15,10},
A74: 最大法防 | B74: 16 | C74: 8 | D74: ="{"&RC[-2]&","&RC[-1]&"}," -> {16,8}, | E74: =R[-1]C&RC[-1] -> {5,8},{6,15},{13,10},{14,8},{15,10},{16,8},
A75: 敏捷 | B75: 20 | C75: 1 | D75: ="{"&RC[-2]&","&RC[-1]&"}," -> {20,1}, | E75: =R[-1]C&RC[-1] -> {5,8},{6,15},{13,10},{14,8},{15,10},{16,8},{20,1},
A76: 生命恢复 | B76: 27 | C76: 10 | D76: ="{"&RC[-2]&","&RC[-1]&"}," -> {27,10}, | E76: =R[-1]C&RC[-1] -> {5,8},{6,15},{13,10},{14,8},{15,10},{16,8},{20,1},{27,10},
A77: 魔法恢复 | B77: 28 | C77: 10 | D77: ="{"&RC[-2]&","&RC[-1]&"}" -> {28,10} | E77: =R[-1]C&RC[-1] -> {5,8},{6,15},{13,10},{14,8},{15,10},{16,8},{20,1},{27,10},{28,10}
E79: ="["&R[-2]C&"]" -> [{5,8},{6,15},{13,10},{14,8},{15,10},{16,8},{20,1},{27,10},{28,10}]
B82: =VLOOKUP(R[1]C,R68C1:R77C2,2,0) -> 5 | C82: =VLOOKUP(R[1]C,R68C1:R77C2,2,0) -> 6 | D82: =VLOOKUP(R[1]C,R68C1:R77C2,2,0) -> 13 | E82: =VLOOKUP(R[1]C,R68C1:R77C2,2,0) -> 14 | F82: =VLOOKUP(R[1]C,R68C1:R77C2,2,0) -> 15 | G82: =VLOOKUP(R[1]C,R68C1:R77C2,2,0) -> 16 | H82: =VLOOKUP(R[1]C,R68C1:R77C2,2,0) -> 20 | I82: =VLOOKUP(R[1]C,R68C1:R77C2,2,0) -> 27 | J82: =VLOOKUP(R[1]C,R68C1:R77C2,2,0) -> 28
A83: 等级 | B83: 生命 | C83: 魔法 | D83: 最小物防 | E83: 最大物防 | F83: 最小法防 | G83: 最大法防 | H83: 敏捷 | I83: 生命恢复 | J83: 魔法恢复
A84: 20 | B84: 60 | C84: 60 | D84: 1 | E84: 2 | F84: 1 | G84: 2 | H84: 3 | I84: =INT(RC[3]*10000) -> 3 | J84: =INT(RC[3]*10000) -> 3 | L84: 3.5714285714285714E-4 | M84: 3.5714285714285714E-4
A85: 30 | B85: 135 | C85: 135 | D85: 2 | E85: 4 | F85: 2 | G85: 4 | H85: 3 | I85: =INT(RC[3]*10000) -> 5 | J85: =INT(RC[3]*10000) -> 5 | L85: 5.3571428571428574E-4 | M85: 5.3571428571428574E-4
A86: 40 | B86: 276 | C86: 276 | D86: 4 | E86: 9 | F86: 4 | G86: 9 | H86: 3 | I86: =INT(RC[3]*10000) -> 8 | J86: =INT(RC[3]*10000) -> 8 | L86: 8.2142857142857137E-4 | M86: 8.2142857142857137E-4
A87: 50 | B87: 450 | C87: 450 | D87: 7 | E87: 15 | F87: 7 | G87: 15 | H87: 3 | I87: =INT(RC[3]*10000) -> 10 | J87: =INT(RC[3]*10000) -> 10 | L87: 1.0714285714285715E-3 | M87: 1.0714285714285715E-3
A88: 60 | B88: 720 | C88: 720 | D88: 12 | E88: 24 | F88: 12 | G88: 24 | H88: 3 | I88: =INT(RC[3]*10000) -> 14 | J88: =INT(RC[3]*10000) -> 14 | L88: 1.4285714285714286E-3 | M88: 1.4285714285714286E-3
A89: 70 | B89: 1113 | C89: 1113 | D89: 18 | E89: 37 | F89: 18 | G89: 37 | H89: 3 | I89: =INT(RC[3]*10000) -> 18 | J89: =INT(RC[3]*10000) -> 18 | L89: 1.8928571428571427E-3 | M89: 1.8928571428571427E-3
A90: 80 | B90: 1560 | C90: 1560 | D90: 26 | E90: 52 | F90: 26 | G90: 52 | H90: 3 | I90: =INT(RC[3]*10000) -> 23 | J90: =INT(RC[3]*10000) -> 23 | L90: 2.3214285714285715E-3 | M90: 2.3214285714285715E-3
A91: 90 | B91: 2160 | C91: 2160 | D91: 36 | E91: 72 | F91: 36 | G91: 72 | H91: 3 | I91: =INT(RC[3]*10000) -> 28 | J91: =INT(RC[3]*10000) -> 28 | L91: 2.8571428571428571E-3 | M91: 2.8571428571428571E-3
A92: 100 | B92: 3000 | C92: 3000 | D92: 50 | E92: 100 | F92: 50 | G92: 100 | H92: 3 | I92: =INT(RC[3]*10000) -> 35 | J92: =INT(RC[3]*10000) -> 35 | L92: 3.5714285714285713E-3 | M92: 3.5714285714285713E-3
W93: 7.4404761904761892E-3 | X93: 7.4404761904761892E-3
A95: 属性最大值配置
A96: 等级
A97: 20 | B97: ="{"&R82C&","&R[-13]C&"}," -> {5,60}, | C97: ="{"&R82C&","&R[-13]C&"}," -> {6,60}, | D97: ="{"&R82C&","&R[-13]C&"}," -> {13,1}, | E97: ="{"&R82C&","&R[-13]C&"}," -> {14,2}, | F97: ="{"&R82C&","&R[-13]C&"}," -> {15,1}, | G97: ="{"&R82C&","&R[-13]C&"}," -> {16,2}, | H97: ="{"&R82C&","&R[-13]C&"}," -> {20,3}, | I97: ="{"&R82C&","&R[-13]C&"}," -> {27,3}, | J97: ="{"&R82C&","&R[-13]C&"}" -> {28,3}
A98: 30 | B98: ="{"&R82C&","&R[-13]C&"}," -> {5,135}, | C98: ="{"&R82C&","&R[-13]C&"}," -> {6,135}, | D98: ="{"&R82C&","&R[-13]C&"}," -> {13,2}, | E98: ="{"&R82C&","&R[-13]C&"}," -> {14,4}, | F98: ="{"&R82C&","&R[-13]C&"}," -> {15,2}, | G98: ="{"&R82C&","&R[-13]C&"}," -> {16,4}, | H98: ="{"&R82C&","&R[-13]C&"}," -> {20,3}, | I98: ="{"&R82C&","&R[-13]C&"}," -> {27,5}, | J98: ="{"&R82C&","&R[-13]C&"}" -> {28,5}
A99: 40 | B99: ="{"&R82C&","&R[-13]C&"}," -> {5,276}, | C99: ="{"&R82C&","&R[-13]C&"}," -> {6,276}, | D99: ="{"&R82C&","&R[-13]C&"}," -> {13,4}, | E99: ="{"&R82C&","&R[-13]C&"}," -> {14,9}, | F99: ="{"&R82C&","&R[-13]C&"}," -> {15,4}, | G99: ="{"&R82C&","&R[-13]C&"}," -> {16,9}, | H99: ="{"&R82C&","&R[-13]C&"}," -> {20,3}, | I99: ="{"&R82C&","&R[-13]C&"}," -> {27,8}, | J99: ="{"&R82C&","&R[-13]C&"}" -> {28,8}
A100: 50 | B100: ="{"&R82C&","&R[-13]C&"}," -> {5,450}, | C100: ="{"&R82C&","&R[-13]C&"}," -> {6,450}, | D100: ="{"&R82C&","&R[-13]C&"}," -> {13,7}, | E100: ="{"&R82C&","&R[-13]C&"}," -> {14,15}, | F100: ="{"&R82C&","&R[-13]C&"}," -> {15,7}, | G100: ="{"&R82C&","&R[-13]C&"}," -> {16,15}, | H100: ="{"&R82C&","&R[-13]C&"}," -> {20,3}, | I100: ="{"&R82C&","&R[-13]C&"}," -> {27,10}, | J100: ="{"&R82C&","&R[-13]C&"}" -> {28,10}
A101: 60 | B101: ="{"&R82C&","&R[-13]C&"}," -> {5,720}, | C101: ="{"&R82C&","&R[-13]C&"}," -> {6,720}, | D101: ="{"&R82C&","&R[-13]C&"}," -> {13,12}, | E101: ="{"&R82C&","&R[-13]C&"}," -> {14,24}, | F101: ="{"&R82C&","&R[-13]C&"}," -> {15,12}, | G101: ="{"&R82C&","&R[-13]C&"}," -> {16,24}, | H101: ="{"&R82C&","&R[-13]C&"}," -> {20,3}, | I101: ="{"&R82C&","&R[-13]C&"}," -> {27,14}, | J101: ="{"&R82C&","&R[-13]C&"}" -> {28,14}
A102: 70 | B102: ="{"&R82C&","&R[-13]C&"}," -> {5,1113}, | C102: ="{"&R82C&","&R[-13]C&"}," -> {6,1113}, | D102: ="{"&R82C&","&R[-13]C&"}," -> {13,18}, | E102: ="{"&R82C&","&R[-13]C&"}," -> {14,37}, | F102: ="{"&R82C&","&R[-13]C&"}," -> {15,18}, | G102: ="{"&R82C&","&R[-13]C&"}," -> {16,37}, | H102: ="{"&R82C&","&R[-13]C&"}," -> {20,3}, | I102: ="{"&R82C&","&R[-13]C&"}," -> {27,18}, | J102: ="{"&R82C&","&R[-13]C&"}" -> {28,18}
A103: 80 | B103: ="{"&R82C&","&R[-13]C&"}," -> {5,1560}, | C103: ="{"&R82C&","&R[-13]C&"}," -> {6,1560}, | D103: ="{"&R82C&","&R[-13]C&"}," -> {13,26}, | E103: ="{"&R82C&","&R[-13]C&"}," -> {14,52}, | F103: ="{"&R82C&","&R[-13]C&"}," -> {15,26}, | G103: ="{"&R82C&","&R[-13]C&"}," -> {16,52}, | H103: ="{"&R82C&","&R[-13]C&"}," -> {20,3}, | I103: ="{"&R82C&","&R[-13]C&"}," -> {27,23}, | J103: ="{"&R82C&","&R[-13]C&"}" -> {28,23}
A104: 90 | B104: ="{"&R82C&","&R[-13]C&"}," -> {5,2160}, | C104: ="{"&R82C&","&R[-13]C&"}," -> {6,2160}, | D104: ="{"&R82C&","&R[-13]C&"}," -> {13,36}, | E104: ="{"&R82C&","&R[-13]C&"}," -> {14,72}, | F104: ="{"&R82C&","&R[-13]C&"}," -> {15,36}, | G104: ="{"&R82C&","&R[-13]C&"}," -> {16,72}, | H104: ="{"&R82C&","&R[-13]C&"}," -> {20,3}, | I104: ="{"&R82C&","&R[-13]C&"}," -> {27,28}, | J104: ="{"&R82C&","&R[-13]C&"}" -> {28,28}
A105: 100 | B105: ="{"&R82C&","&R[-13]C&"}," -> {5,3000}, | C105: ="{"&R82C&","&R[-13]C&"}," -> {6,3000}, | D105: ="{"&R82C&","&R[-13]C&"}," -> {13,50}, | E105: ="{"&R82C&","&R[-13]C&"}," -> {14,100}, | F105: ="{"&R82C&","&R[-13]C&"}," -> {15,50}, | G105: ="{"&R82C&","&R[-13]C&"}," -> {16,100}, | H105: ="{"&R82C&","&R[-13]C&"}," -> {20,3}, | I105: ="{"&R82C&","&R[-13]C&"}," -> {27,35}, | J105: ="{"&R82C&","&R[-13]C&"}" -> {28,35}
A108: 20 | B108: =R[-11]C -> {5,60}, | C108: =RC[-1]&R[-11]C -> {5,60},{6,60}, | D108: =RC[-1]&R[-11]C -> {5,60},{6,60},{13,1}, | E108: =RC[-1]&R[-11]C -> {5,60},{6,60},{13,1},{14,2}, | F108: =RC[-1]&R[-11]C -> {5,60},{6,60},{13,1},{14,2},{15,1}, | G108: =RC[-1]&R[-11]C -> {5,60},{6,60},{13,1},{14,2},{15,1},{16,2}, | H108: =RC[-1]&R[-11]C -> {5,60},{6,60},{13,1},{14,2},{15,1},{16,2},{20,3}, | I108: =RC[-1]&R[-11]C -> {5,60},{6,60},{13,1},{14,2},{15,1},{16,2},{20,3},{27,3}, | J108: =RC[-1]&R[-11]C -> {5,60},{6,60},{13,1},{14,2},{15,1},{16,2},{20,3},{27,3},{28,3} | K108: ="["&RC[-1]&"]" -> [{5,60},{6,60},{13,1},{14,2},{15,1},{16,2},{20,3},{27,3},{28,3}]
A109: 30 | B109: =R[-11]C -> {5,135}, | C109: =RC[-1]&R[-11]C -> {5,135},{6,135}, | D109: =RC[-1]&R[-11]C -> {5,135},{6,135},{13,2}, | E109: =RC[-1]&R[-11]C -> {5,135},{6,135},{13,2},{14,4}, | F109: =RC[-1]&R[-11]C -> {5,135},{6,135},{13,2},{14,4},{15,2}, | G109: =RC[-1]&R[-11]C -> {5,135},{6,135},{13,2},{14,4},{15,2},{16,4}, | H109: =RC[-1]&R[-11]C -> {5,135},{6,135},{13,2},{14,4},{15,2},{16,4},{20,3}, | I109: =RC[-1]&R[-11]C -> {5,135},{6,135},{13,2},{14,4},{15,2},{16,4},{20,3},{27,5}, | J109: =RC[-1]&R[-11]C -> {5,135},{6,135},{13,2},{14,4},{15,2},{16,4},{20,3},{27,5},{28,5} | K109: ="["&RC[-1]&"]" -> [{5,135},{6,135},{13,2},{14,4},{15,2},{16,4},{20,3},{27,5},{28,5}]
A110: 40 | B110: =R[-11]C -> {5,276}, | C110: =RC[-1]&R[-11]C -> {5,276},{6,276}, | D110: =RC[-1]&R[-11]C -> {5,276},{6,276},{13,4}, | E110: =RC[-1]&R[-11]C -> {5,276},{6,276},{13,4},{14,9}, | F110: =RC[-1]&R[-11]C -> {5,276},{6,276},{13,4},{14,9},{15,4}, | G110: =RC[-1]&R[-11]C -> {5,276},{6,276},{13,4},{14,9},{15,4},{16,9}, | H110: =RC[-1]&R[-11]C -> {5,276},{6,276},{13,4},{14,9},{15,4},{16,9},{20,3}, | I110: =RC[-1]&R[-11]C -> {5,276},{6,276},{13,4},{14,9},{15,4},{16,9},{20,3},{27,8}, | J110: =RC[-1]&R[-11]C -> {5,276},{6,276},{13,4},{14,9},{15,4},{16,9},{20,3},{27,8},{28,8} | K110: ="["&RC[-1]&"]" -> [{5,276},{6,276},{13,4},{14,9},{15,4},{16,9},{20,3},{27,8},{28,8}]
A111: 50 | B111: =R[-11]C -> {5,450}, | C111: =RC[-1]&R[-11]C -> {5,450},{6,450}, | D111: =RC[-1]&R[-11]C -> {5,450},{6,450},{13,7}, | E111: =RC[-1]&R[-11]C -> {5,450},{6,450},{13,7},{14,15}, | F111: =RC[-1]&R[-11]C -> {5,450},{6,450},{13,7},{14,15},{15,7}, | G111: =RC[-1]&R[-11]C -> {5,450},{6,450},{13,7},{14,15},{15,7},{16,15}, | H111: =RC[-1]&R[-11]C -> {5,450},{6,450},{13,7},{14,15},{15,7},{16,15},{20,3}, | I111: =RC[-1]&R[-11]C -> {5,450},{6,450},{13,7},{14,15},{15,7},{16,15},{20,3},{27,10}, | J111: =RC[-1]&R[-11]C -> {5,450},{6,450},{13,7},{14,15},{15,7},{16,15},{20,3},{27,10},{28,10} | K111: ="["&RC[-1]&"]" -> [{5,450},{6,450},{13,7},{14,15},{15,7},{16,15},{20,3},{27,10},{28,10}]
A112: 60 | B112: =R[-11]C -> {5,720}, | C112: =RC[-1]&R[-11]C -> {5,720},{6,720}, | D112: =RC[-1]&R[-11]C -> {5,720},{6,720},{13,12}, | E112: =RC[-1]&R[-11]C -> {5,720},{6,720},{13,12},{14,24}, | F112: =RC[-1]&R[-11]C -> {5,720},{6,720},{13,12},{14,24},{15,12}, | G112: =RC[-1]&R[-11]C -> {5,720},{6,720},{13,12},{14,24},{15,12},{16,24}, | H112: =RC[-1]&R[-11]C -> {5,720},{6,720},{13,12},{14,24},{15,12},{16,24},{20,3}, | I112: =RC[-1]&R[-11]C -> {5,720},{6,720},{13,12},{14,24},{15,12},{16,24},{20,3},{27,14}, | J112: =RC[-1]&R[-11]C -> {5,720},{6,720},{13,12},{14,24},{15,12},{16,24},{20,3},{27,14},{28,14} | K112: ="["&RC[-1]&"]" -> [{5,720},{6,720},{13,12},{14,24},{15,12},{16,24},{20,3},{27,14},{28,14}]
A113: 70 | B113: =R[-11]C -> {5,1113}, | C113: =RC[-1]&R[-11]C -> {5,1113},{6,1113}, | D113: =RC[-1]&R[-11]C -> {5,1113},{6,1113},{13,18}, | E113: =RC[-1]&R[-11]C -> {5,1113},{6,1113},{13,18},{14,37}, | F113: =RC[-1]&R[-11]C -> {5,1113},{6,1113},{13,18},{14,37},{15,18}, | G113: =RC[-1]&R[-11]C -> {5,1113},{6,1113},{13,18},{14,37},{15,18},{16,37}, | H113: =RC[-1]&R[-11]C -> {5,1113},{6,1113},{13,18},{14,37},{15,18},{16,37},{20,3}, | I113: =RC[-1]&R[-11]C -> {5,1113},{6,1113},{13,18},{14,37},{15,18},{16,37},{20,3},{27,18}, | J113: =RC[-1]&R[-11]C -> {5,1113},{6,1113},{13,18},{14,37},{15,18},{16,37},{20,3},{27,18},{28,18} | K113: ="["&RC[-1]&"]" -> [{5,1113},{6,1113},{13,18},{14,37},{15,18},{16,37},{20,3},{27,18},{28,18}]
A114: 80 | B114: =R[-11]C -> {5,1560}, | C114: =RC[-1]&R[-11]C -> {5,1560},{6,1560}, | D114: =RC[-1]&R[-11]C -> {5,1560},{6,1560},{13,26}, | E114: =RC[-1]&R[-11]C -> {5,1560},{6,1560},{13,26},{14,52}, | F114: =RC[-1]&R[-11]C -> {5,1560},{6,1560},{13,26},{14,52},{15,26}, | G114: =RC[-1]&R[-11]C -> {5,1560},{6,1560},{13,26},{14,52},{15,26},{16,52}, | H114: =RC[-1]&R[-11]C -> {5,1560},{6,1560},{13,26},{14,52},{15,26},{16,52},{20,3}, | I114: =RC[-1]&R[-11]C -> {5,1560},{6,1560},{13,26},{14,52},{15,26},{16,52},{20,3},{27,23}, | J114: =RC[-1]&R[-11]C -> {5,1560},{6,1560},{13,26},{14,52},{15,26},{16,52},{20,3},{27,23},{28,23} | K114: ="["&RC[-1]&"]" -> [{5,1560},{6,1560},{13,26},{14,52},{15,26},{16,52},{20,3},{27,23},{28,23}]
A115: 90 | B115: =R[-11]C -> {5,2160}, | C115: =RC[-1]&R[-11]C -> {5,2160},{6,2160}, | D115: =RC[-1]&R[-11]C -> {5,2160},{6,2160},{13,36}, | E115: =RC[-1]&R[-11]C -> {5,2160},{6,2160},{13,36},{14,72}, | F115: =RC[-1]&R[-11]C -> {5,2160},{6,2160},{13,36},{14,72},{15,36}, | G115: =RC[-1]&R[-11]C -> {5,2160},{6,2160},{13,36},{14,72},{15,36},{16,72}, | H115: =RC[-1]&R[-11]C -> {5,2160},{6,2160},{13,36},{14,72},{15,36},{16,72},{20,3}, | I115: =RC[-1]&R[-11]C -> {5,2160},{6,2160},{13,36},{14,72},{15,36},{16,72},{20,3},{27,28}, | J115: =RC[-1]&R[-11]C -> {5,2160},{6,2160},{13,36},{14,72},{15,36},{16,72},{20,3},{27,28},{28,28} | K115: ="["&RC[-1]&"]" -> [{5,2160},{6,2160},{13,36},{14,72},{15,36},{16,72},{20,3},{27,28},{28,28}]
A116: 100 | B116: =R[-11]C -> {5,3000}, | C116: =RC[-1]&R[-11]C -> {5,3000},{6,3000}, | D116: =RC[-1]&R[-11]C -> {5,3000},{6,3000},{13,50}, | E116: =RC[-1]&R[-11]C -> {5,3000},{6,3000},{13,50},{14,100}, | F116: =RC[-1]&R[-11]C -> {5,3000},{6,3000},{13,50},{14,100},{15,50}, | G116: =RC[-1]&R[-11]C -> {5,3000},{6,3000},{13,50},{14,100},{15,50},{16,100}, | H116: =RC[-1]&R[-11]C -> {5,3000},{6,3000},{13,50},{14,100},{15,50},{16,100},{20,3}, | I116: =RC[-1]&R[-11]C -> {5,3000},{6,3000},{13,50},{14,100},{15,50},{16,100},{20,3},{27,35}, | J116: =RC[-1]&R[-11]C -> {5,3000},{6,3000},{13,50},{14,100},{15,50},{16,100},{20,3},{27,35},{28,35} | K116: ="["&RC[-1]&"]" -> [{5,3000},{6,3000},{13,50},{14,100},{15,50},{16,100},{20,3},{27,35},{28,35}]
A120: 洗练次数 | B120: 权重 | C120: 属性百分比下限 | D120: 属性百分比上限
A121: 0 | B121: 1 | C121: 1 | D121: 10 | E121: ="{"&RC[-4]&","&RC[-3]&",["&RC[-2]&","&RC[-1]&"]}," -> {0,1,[1,10]}, | F121: =RC[-1] -> {0,1,[1,10]},
A122: 1 | B122: 5 | C122: =R[-1]C+10 -> 11 | D122: =R[-1]C+10 -> 20 | E122: ="{"&RC[-4]&","&RC[-3]&",["&RC[-2]&","&RC[-1]&"]}," -> {1,5,[11,20]}, | F122: =R[-1]C&RC[-1] -> {0,1,[1,10]},{1,5,[11,20]},
A123: 2 | B123: 10 | C123: =R[-1]C+10 -> 21 | D123: =R[-1]C+10 -> 30 | E123: ="{"&RC[-4]&","&RC[-3]&",["&RC[-2]&","&RC[-1]&"]}," -> {2,10,[21,30]}, | F123: =R[-1]C&RC[-1] -> {0,1,[1,10]},{1,5,[11,20]},{2,10,[21,30]},
A124: 3 | B124: 20 | C124: =R[-1]C+10 -> 31 | D124: =R[-1]C+10 -> 40 | E124: ="{"&RC[-4]&","&RC[-3]&",["&RC[-2]&","&RC[-1]&"]}," -> {3,20,[31,40]}, | F124: =R[-1]C&RC[-1] -> {0,1,[1,10]},{1,5,[11,20]},{2,10,[21,30]},{3,20,[31,40]},
A125: 20 | B125: 25 | C125: =R[-1]C+10 -> 41 | D125: =R[-1]C+10 -> 50 | E125: ="{"&RC[-4]&","&RC[-3]&",["&RC[-2]&","&RC[-1]&"]}," -> {20,25,[41,50]}, | F125: =R[-1]C&RC[-1] -> {0,1,[1,10]},{1,5,[11,20]},{2,10,[21,30]},{3,20,[31,40]},{20,25,[41,50]},
A126: 50 | B126: 20 | C126: =R[-1]C+10 -> 51 | D126: =R[-1]C+10 -> 60 | E126: ="{"&RC[-4]&","&RC[-3]&",["&RC[-2]&","&RC[-1]&"]}," -> {50,20,[51,60]}, | F126: =R[-1]C&RC[-1] -> {0,1,[1,10]},{1,5,[11,20]},{2,10,[21,30]},{3,20,[31,40]},{20,25,[41,50]},{50,20,[51,60]},
A127: 70 | B127: 10 | C127: =R[-1]C+10 -> 61 | D127: =R[-1]C+10 -> 70 | E127: ="{"&RC[-4]&","&RC[-3]&",["&RC[-2]&","&RC[-1]&"]}," -> {70,10,[61,70]}, | F127: =R[-1]C&RC[-1] -> {0,1,[1,10]},{1,5,[11,20]},{2,10,[21,30]},{3,20,[31,40]},{20,25,[41,50]},{50,20,[51,60]},{70,10,[61,70]},
A128: 100 | B128: 5 | C128: =R[-1]C+10 -> 71 | D128: =R[-1]C+10 -> 80 | E128: ="{"&RC[-4]&","&RC[-3]&",["&RC[-2]&","&RC[-1]&"]}," -> {100,5,[71,80]}, | F128: =R[-1]C&RC[-1] -> {0,1,[1,10]},{1,5,[11,20]},{2,10,[21,30]},{3,20,[31,40]},{20,25,[41,50]},{50,20,[51,60]},{70,10,[61,70]},{100,5,[71,80]},
A129: 150 | B129: 3 | C129: =R[-1]C+10 -> 81 | D129: =R[-1]C+10 -> 90 | E129: ="{"&RC[-4]&","&RC[-3]&",["&RC[-2]&","&RC[-1]&"]}," -> {150,3,[81,90]}, | F129: =R[-1]C&RC[-1] -> {0,1,[1,10]},{1,5,[11,20]},{2,10,[21,30]},{3,20,[31,40]},{20,25,[41,50]},{50,20,[51,60]},{70,10,[61,70]},{100,5,[71,80]},{150,3,[81,90]},
A130: 250 | B130: 1 | C130: =R[-1]C+10 -> 91 | D130: =R[-1]C+10 -> 100 | E130: ="{"&RC[-4]&","&RC[-3]&",["&RC[-2]&","&RC[-1]&"]}" -> {250,1,[91,100]} | F130: =R[-1]C&RC[-1] -> {0,1,[1,10]},{1,5,[11,20]},{2,10,[21,30]},{3,20,[31,40]},{20,25,[41,50]},{50,20,[51,60]},{70,10,[61,70]},{100,5,[71,80]},{150,3,[81,90]},{250,1,[91,100]} | G130: ="["&RC[-1]&"]" -> [{0,1,[1,10]},{1,5,[11,20]},{2,10,[21,30]},{3,20,[31,40]},{20,25,[41,50]},{50,20,[51,60]},{70,10,[61,70]},{100,5,[71,80]},{150,3,[81,90]},{250,1,[91,100]}]

Sheet: 子类型
B3: 子类型
B4: 武器 | C4: 1
B5: 衣服 | C5: 2
B6: 头盔 | C6: 3
B7: 项链 | C7: 4
B8: 勋章 | C8: 5
B9: 手镯 | C9: 6
B10: 戒指 | C10: 7
B11: 腰带 | C11: 8
B12: 裤子 | C12: 9
B13: 鞋子 | C13: 10
B14: 翅膀 | C14: 13
B15: 宠物 | C15: 14