Sheet: 配置
A2: no_baptize
A3: 不可洗炼部位ID
A4: 5
A5: 13
A6: 15
A7: 101
A8: 102
A9: 103

Sheet: 配置模型
B2: 7 | C2: 8 | D2: 9 | E2: 10 | F2: 11 | G2: 12 | H2: 17 | I2: 18 | J2: 19 | K2: 23 | L2: 24 | M2: 5 | N2: 6 | O2: 13 | P2: 14 | Q2: 15 | R2: 16 | S2: 20 | T2: 27 | U2: 28
A3: 等级 | B3: 最小物攻 | C3: 最大物攻 | D3: 最小法攻 | E3: 最大法攻 | F3: 最小道攻 | G3: 最大道攻 | H3: 暴击 | I3: 暴击力 | J3: 精准 | K3: 神圣 | L3: 技能伤害追加 | M3: 生命 | N3: 魔法 | O3: 最小物防 | P3: 最大物防 | Q3: 最小法防 | R3: 最大法防 | S3: 敏捷 | T3: 生命恢复 | U3: 魔法恢复
A4: 20 | B4: 6 | C4: 12 | D4: 6 | E4: 12 | F4: 6 | G4: 12 | H4: 4 | I4: =RC[2]*3 -> 24 | J4: 3 | K4: 8 | L4: 8 | M4: 60 | N4: 60 | O4: 1 | P4: 2 | Q4: 1 | R4: 2 | S4: 3 | T4: 3 | U4: 3
A5: 30 | B5: 6 | C5: 13 | D5: 6 | E5: 13 | F5: 6 | G5: 13 | H5: 4 | I5: =RC[2]*3 -> 27 | J5: 3 | K5: 9 | L5: 9 | M5: 135 | N5: 135 | O5: 2 | P5: 4 | Q5: 2 | R5: 4 | S5: 3 | T5: 5 | U5: 5
A6: 40 | B6: 9 | C6: 18 | D6: 9 | E6: 18 | F6: 9 | G6: 18 | H6: 6 | I6: =RC[2]*3 -> 36 | J6: 3 | K6: 12 | L6: 12 | M6: 276 | N6: 276 | O6: 4 | P6: 9 | Q6: 4 | R6: 9 | S6: 3 | T6: 8 | U6: 8
A7: 50 | B7: 11 | C7: 22 | D7: 11 | E7: 22 | F7: 11 | G7: 22 | H7: 7 | I7: =RC[2]*3 -> 45 | J7: 3 | K7: 15 | L7: 15 | M7: 450 | N7: 450 | O7: 7 | P7: 15 | Q7: 7 | R7: 15 | S7: 3 | T7: 10 | U7: 10
A8: 60 | B8: 18 | C8: 36 | D8: 18 | E8: 36 | F8: 18 | G8: 36 | H8: 12 | I8: =RC[2]*3 -> 72 | J8: 3 | K8: 24 | L8: 24 | M8: 720 | N8: 720 | O8: 12 | P8: 24 | Q8: 12 | R8: 24 | S8: 3 | T8: 14 | U8: 14
A9: 70 | B9: 27 | C9: 55 | D9: 27 | E9: 55 | F9: 27 | G9: 55 | H9: 18 | I9: 110 | J9: 3 | K9: 37 | L9: 37 | M9: 1113 | N9: 1113 | O9: 18 | P9: 37 | Q9: 18 | R9: 37 | S9: 3 | T9: 18 | U9: 18
A10: 80 | B10: 39 | C10: 78 | D10: 39 | E10: 78 | F10: 39 | G10: 78 | H10: 26 | I10: =RC[2]*3 -> 168 | J10: 3 | K10: 56 | L10: 56 | M10: 1560 | N10: 1560 | O10: 26 | P10: 52 | Q10: 26 | R10: 52 | S10: 3 | T10: 23 | U10: 23
A11: 90 | B11: 54 | C11: 108 | D11: 54 | E11: 108 | F11: 54 | G11: 108 | H11: 36 | I11: =RC[2]*3 -> 243 | J11: 3 | K11: 81 | L11: 81 | M11: 2160 | N11: 2160 | O11: 36 | P11: 72 | Q11: 36 | R11: 72 | S11: 3 | T11: 28 | U11: 28
A12: 100 | B12: 75 | C12: 150 | D12: 75 | E12: 150 | F12: 75 | G12: 150 | H12: 50 | I12: =RC[2]*3 -> 345 | J12: 3 | K12: 115 | L12: 115 | M12: 3000 | N12: 3000 | O12: 50 | P12: 100 | Q12: 50 | R12: 100 | S12: 3 | T12: 35 | U12: 35

Sheet: 子类型
B2: 5 | C2: 血量上限 | D2: hp
B3: 6 | C3: 魔法上限, | D3: mp
B4: 7 | C4: 最小物理攻击, | D4: min_ac
B5: 8 | C5: 最大物理攻击, | D5: max_ac
B6: 9 | C6: 最小魔法攻击, | D6: min_mac
B7: 10 | C7: 最大魔法攻击, | D7: max_mac
B8: 11 | C8: 最小道术攻击, | D8: min_sc
B9: 12 | C9: 最大道术攻击, | D9: max_sc
B10: 13 | C10: 最小物防, | D10: min_def
B11: 14 | C11: 最大物防, | D11: max_def
B12: 15 | C12: 最小魔防, | D12: min_res
B13: 16 | C13: 最大魔防, | D13: max_res
B14: 17 | C14: 暴击, | D14: crit
B15: 18 | C15: 暴击伤害, | D15: crit_att
B16: 19 | C16: 准确, | D16: hit
B17: 20 | C17: 敏捷, | D17: dodge
B18: 21 | C18: 伤害加深, | D18: damage_deepen
B19: 22 | C19: 伤害减免,g | D19: damage_reduction
B20: 23 | C20: 神圣, | D20: holy
B21: 24 | C21: 技能伤害追加, | D21: skill_add
B22: 25 | C22: 魔法命中, | D22: m_hit
B23: 26 | C23: 魔法闪避, | D23: m_dodge
B24: 27 | C24: 生命恢复, | D24: hp_recover
B25: 28 | C25: 魔法恢复, | D25: mp_recover
B26: 29 | C26: 死亡恢复, | D26: resurgence
B27: 30 | C27: 伤害抵消 | D27: damage_offset
B28: 38 | C28: 血量百分比加成
B29: 39 | C29: 魔法百分比加成
B30: 40 | C30: 最小物理攻击百分比加成
B31: 41 | C31: 最大物理攻击百分比加成
B32: 42 | C32: 最小魔法攻击百分比加成
B33: 43 | C33: 最大魔法攻击百分比加成
B34: 44 | C34: 最小道术攻击百分比加成
B35: 45 | C35: 最大道术攻击百分比加成
B36: 46 | C36: 最小物防百分比加成
B37: 47 | C37: 最大物防百分比加成
B38: 48 | C38: 最小魔防百分比加成
B39: 49 | C39: 最大魔防百分比加成
B40: 50 | C40: 暴击百分比加成
B41: 51 | C41: 暴击伤害百分比加成
B42: 52 | C42: 准确百分比加成
B43: 53 | C43: 敏捷百分比加成
B44: 54 | C44: 伤害加深百分比加成
B45: 55 | C45: 伤害减免百分比加成
B46: 56 | C46: 神圣百分比加成
B47: 57 | C47: 技能伤害追加百分比加成
B48: 58 | C48: 魔法命中百分比加成
B49: 59 | C49: 魔法闪避百分比加成
B50: 60 | C50: 生命恢复百分比加成
B51: 61 | C51: 魔法恢复百分比加成
B52: 62 | C52: 死亡恢复百分比加成
B53: 63 | C53: 伤害减免百分比加成
B54: 68 | C54: 金币加成百分比
B55: 69 | C55: 经验加成百分比