Sheet: 套装属性
A1: id | B1: id_qian
A2: id | B2: id_qian
A3: 后端部位ID | B3: 前端部位ID | C3: 部位名字
A4: 1 | B4: ="["&RC[5]&"]" -> [1] | C4: 武器 | E4: 801 | G4: =RC[-2]-800 -> 1
A5: 2 | B5: ="["&RC[5]&"]" -> [2] | C5: 衣服 | E5: 802 | G5: =RC[-2]-800 -> 2
A6: 3 | B6: ="["&RC[5]&"]" -> [3] | C6: 头盔 | E6: 803 | G6: =RC[-2]-800 -> 3
A7: 4 | B7: ="["&RC[5]&"]" -> [4] | C7: 项链 | E7: 804 | G7: =RC[-2]-800 -> 4
A8: 5 | B8: ="["&RC[5]&"]" -> [5] | C8: 勋章 | E8: 805 | G8: =RC[-2]-800 -> 5
A9: 6 | B9: [6,11] | C9: 手镯 | E9: 806 | F9: 811 | G9: =RC[-2]-800 -> 6
A10: 7 | B10: [7,12] | C10: 戒指 | E10: 807 | F10: 812 | G10: =RC[-2]-800 -> 7
A11: 8 | B11: ="["&RC[5]&"]" -> [8] | C11: 腰带 | E11: 808 | G11: =RC[-2]-800 -> 8
A12: 9 | B12: ="["&RC[5]&"]" -> [9] | C12: 裤子 | E12: 809 | G12: =RC[-2]-800 -> 9
A13: 10 | B13: ="["&RC[5]&"]" -> [10] | C13: 鞋子 | E13: 810 | G13: =RC[-2]-800 -> 10
A14: 13 | B14: ="["&RC[5]&"]" -> [13] | C14: 翅膀 | E14: 813 | G14: =RC[-2]-800 -> 13
A15: 14 | B15: ="["&RC[5]&"]" -> [14] | C15: 宠物 | E15: 814 | G15: =RC[-2]-800 -> 14
A16: 15 | B16: ="["&RC[5]&"]" -> [15] | C16: 坐骑 | E16: 815 | G16: =RC[-2]-800 -> 15
A17: 21 | B17: ="["&RC[5]&"]" -> [21] | C17: 特武 | E17: 821 | G17: =RC[-2]-800 -> 21
A18: 22 | B18: ="["&RC[5]&"]" -> [22] | C18: 特甲 | E18: 822 | G18: =RC[-2]-800 -> 22
A19: 23 | B19: ="["&RC[5]&"]" -> [23] | C19: 护符 | E19: 823 | G19: =RC[-2]-800 -> 23
A20: 24 | B20: ="["&RC[5]&"]" -> [24] | C20: 护腿 | E20: 824 | G20: =RC[-2]-800 -> 24
A21: 25 | B21: ="["&RC[5]&"]" -> [25] | C21: 面具 | E21: 825 | G21: =RC[-2]-800 -> 25
A22: 26 | B22: ="["&RC[5]&"]" -> [26] | C22: 头巾 | E22: 826 | G22: =RC[-2]-800 -> 26
A23: 27 | B23: ="["&RC[5]&"]" -> [27] | C23: 耳环 | E23: 827 | G23: =RC[-2]-800 -> 27
A24: 28 | B24: ="["&RC[5]&"]" -> [28] | C24: 护肩 | E24: 828 | G24: =RC[-2]-800 -> 28
A25: 29 | B25: [29,30] | C25: 特戒 | E25: 829 | F25: 830 | G25: =RC[-2]-800 -> 29