Sheet: 每日签到
A1: key | B1: year | C1: month | D1: count | E1: reward | F1: is_double | G1: vip_double
A2: key | B2: year | C2: month | D2: count | E2: reward | F2: is_double | G2: vip_double
A3: key | B3: 年 | C3: 月 | D3: 次 | E3: 奖励 | F3: 是否翻倍 | G3: vip翻倍等级
A4: 1 | B4: 2016 | C4: 2 | D4: 1 | E4: [] | F4: 0 | G4: 0
A5: 2 | B5: 2016 | C5: 2 | D5: 2 | E5: [{110050,1,1},{110045,1,200},{110148,1,1},{110127,1,50}] | F5: 1 | G5: 1
A6: 3 | B6: 2016 | C6: 2 | D6: 3 | E6: [] | F6: =R[-2]C -> 0 | G6: 0
A7: 4 | B7: 2016 | C7: 2 | D7: 4 | E7: [] | F7: =R[-2]C -> 1 | G7: 1
A8: 5 | B8: 2016 | C8: 2 | D8: 5 | E8: [{110050,1,1},{110045,1,300},{110148,1,1},{110127,1,100}] | F8: =R[-2]C -> 0 | G8: 0
A9: 6 | B9: 2016 | C9: 2 | D9: 6 | E9: [] | F9: =R[-2]C -> 1 | G9: 2
A10: 7 | B10: 2016 | C10: 2 | D10: 7 | E10: [] | F10: =R[-2]C -> 0 | G10: 0
A11: 8 | B11: 2016 | C11: 2 | D11: 8 | E11: [] | F11: =R[-2]C -> 1 | G11: 2
A12: 9 | B12: 2016 | C12: 2 | D12: 9 | E12: [] | F12: =R[-2]C -> 0 | G12: 0
A13: 10 | B13: 2016 | C13: 2 | D13: 10 | E13: [{110050,1,1},{110045,1,400},{110148,1,1},{110127,1,150}] | F13: =R[-2]C -> 1 | G13: 3
A14: 11 | B14: 2016 | C14: 2 | D14: 11 | E14: [] | F14: =R[-2]C -> 0 | G14: 0
A15: 12 | B15: 2016 | C15: 2 | D15: 12 | E15: [] | F15: =R[-2]C -> 1 | G15: 4
A16: 13 | B16: 2016 | C16: 2 | D16: 13 | E16: [] | F16: =R[-2]C -> 0 | G16: 0
A17: 14 | B17: 2016 | C17: 2 | D17: 14 | E17: [] | F17: =R[-2]C -> 1 | G17: 5
A18: 15 | B18: 2016 | C18: 2 | D18: 15 | E18: [] | F18: =R[-2]C -> 0 | G18: 0
A19: 16 | B19: 2016 | C19: 2 | D19: 16 | E19: [] | F19: =R[-2]C -> 1 | G19: 6
A20: 17 | B20: 2016 | C20: 2 | D20: 17 | E20: [{110050,1,1},{110045,1,500},{110148,1,2},{110127,1,200}] | F20: =R[-2]C -> 0 | G20: 0
A21: 18 | B21: 2016 | C21: 2 | D21: 18 | E21: [] | F21: =R[-2]C -> 1 | G21: 7
A22: 19 | B22: 2016 | C22: 2 | D22: 19 | E22: [] | F22: =R[-2]C -> 0 | G22: 0
A23: 20 | B23: 2016 | C23: 2 | D23: 20 | E23: [] | F23: =R[-2]C -> 1 | G23: 8
A24: 21 | B24: 2016 | C24: 2 | D24: 21 | E24: [] | F24: =R[-2]C -> 0 | G24: 0
A25: 22 | B25: 2016 | C25: 2 | D25: 22 | E25: [] | F25: =R[-2]C -> 1 | G25: 9
A26: 23 | B26: 2016 | C26: 2 | D26: 23 | E26: [] | F26: =R[-2]C -> 0 | G26: 0
A27: 24 | B27: 2016 | C27: 2 | D27: 24 | E27: [] | F27: =R[-2]C -> 1 | G27: 10
A28: 25 | B28: 2016 | C28: 2 | D28: 25 | E28: [] | F28: =R[-2]C -> 0 | G28: 0
A29: 26 | B29: 2016 | C29: 2 | D29: 26 | E29: [{110050,1,1},{110045,1,600},{110149,1,1},{110140,1,10}] | F29: =R[-2]C -> 1 | G29: 11
A30: 27 | B30: 2016 | C30: 2 | D30: 27 | E30: [] | F30: =R[-2]C -> 0 | G30: 0
A31: 28 | B31: 2016 | C31: 2 | D31: 28 | E31: [] | F31: =R[-2]C -> 1 | G31: 12
A32: 29 | B32: 2016 | C32: 2 | D32: 29 | E32: [] | F32: =R[-2]C -> 0 | G32: 0
A33: 30 | B33: 2016 | C33: 3 | D33: 1 | E33: [] | F33: 0 | G33: 0
A34: 31 | B34: 2016 | C34: 3 | D34: 2 | E34: [{110050,1,1},{110045,1,200},{110148,1,1},{110127,1,50}] | F34: 1 | G34: 1
A35: 32 | B35: 2016 | C35: 3 | D35: 3 | E35: [] | F35: =R[-2]C -> 0 | G35: 0
A36: 33 | B36: 2016 | C36: 3 | D36: 4 | E36: [] | F36: =R[-2]C -> 1 | G36: 1
A37: 34 | B37: 2016 | C37: 3 | D37: 5 | E37: [{110050,1,1},{110045,1,300},{110148,1,1},{110127,1,100}] | F37: =R[-2]C -> 0 | G37: 0
A38: 35 | B38: 2016 | C38: 3 | D38: 6 | E38: [] | F38: =R[-2]C -> 1 | G38: 2
A39: 36 | B39: 2016 | C39: 3 | D39: 7 | E39: [] | F39: =R[-2]C -> 0 | G39: 0
A40: 37 | B40: 2016 | C40: 3 | D40: 8 | E40: [] | F40: =R[-2]C -> 1 | G40: 2
A41: 38 | B41: 2016 | C41: 3 | D41: 9 | E41: [] | F41: =R[-2]C -> 0 | G41: 0
A42: 39 | B42: 2016 | C42: 3 | D42: 10 | E42: [{110050,1,1},{110045,1,400},{110148,1,1},{110127,1,150}] | F42: =R[-2]C -> 1 | G42: 3
A43: 40 | B43: 2016 | C43: 3 | D43: 11 | E43: [] | F43: =R[-2]C -> 0 | G43: 0
A44: 41 | B44: 2016 | C44: 3 | D44: 12 | E44: [] | F44: =R[-2]C -> 1 | G44: 4
A45: 42 | B45: 2016 | C45: 3 | D45: 13 | E45: [] | F45: =R[-2]C -> 0 | G45: 0
A46: 43 | B46: 2016 | C46: 3 | D46: 14 | E46: [] | F46: =R[-2]C -> 1 | G46: 5
A47: 44 | B47: 2016 | C47: 3 | D47: 15 | E47: [] | F47: =R[-2]C -> 0 | G47: 0
A48: 45 | B48: 2016 | C48: 3 | D48: 16 | E48: [] | F48: =R[-2]C -> 1 | G48: 6
A49: 46 | B49: 2016 | C49: 3 | D49: 17 | E49: [{110050,1,1},{110045,1,500},{110148,1,2},{110127,1,200}] | F49: =R[-2]C -> 0 | G49: 0
A50: 47 | B50: 2016 | C50: 3 | D50: 18 | E50: [] | F50: =R[-2]C -> 1 | G50: 7
A51: 48 | B51: 2016 | C51: 3 | D51: 19 | E51: [] | F51: =R[-2]C -> 0 | G51: 0
A52: 49 | B52: 2016 | C52: 3 | D52: 20 | E52: [] | F52: =R[-2]C -> 1 | G52: 8
A53: 50 | B53: 2016 | C53: 3 | D53: 21 | E53: [] | F53: =R[-2]C -> 0 | G53: 0
A54: 51 | B54: 2016 | C54: 3 | D54: 22 | E54: [] | F54: =R[-2]C -> 1 | G54: 9
A55: 52 | B55: 2016 | C55: 3 | D55: 23 | E55: [] | F55: =R[-2]C -> 0 | G55: 0
A56: 53 | B56: 2016 | C56: 3 | D56: 24 | E56: [] | F56: =R[-2]C -> 1 | G56: 10
A57: 54 | B57: 2016 | C57: 3 | D57: 25 | E57: [] | F57: =R[-2]C -> 0 | G57: 0
A58: 55 | B58: 2016 | C58: 3 | D58: 26 | E58: [{110050,1,1},{110045,1,600},{110149,1,1},{110140,1,10}] | F58: =R[-2]C -> 1 | G58: 11
A59: 56 | B59: 2016 | C59: 3 | D59: 27 | E59: [] | F59: =R[-2]C -> 0 | G59: 0
A60: 57 | B60: 2016 | C60: 3 | D60: 28 | E60: [] | F60: =R[-2]C -> 1 | G60: 12
A61: 58 | B61: 2016 | C61: 3 | D61: 29 | E61: [] | F61: =R[-2]C -> 0 | G61: 0
A62: 59 | B62: 2016 | C62: 3 | D62: 30 | E62: [] | F62: =R[-2]C -> 1 | G62: 12
A63: 60 | B63: 2016 | C63: 3 | D63: 31 | E63: [] | F63: =R[-2]C -> 0 | G63: 0
A64: 61 | B64: 2016 | C64: 4 | D64: 1 | E64: [] | F64: 0 | G64: 0
A65: 62 | B65: 2016 | C65: 4 | D65: 2 | E65: [{110050,1,1},{110045,1,200},{110148,1,1},{110127,1,50}] | F65: 1 | G65: 1
A66: 63 | B66: 2016 | C66: 4 | D66: 3 | E66: [] | F66: =R[-2]C -> 0 | G66: 0
A67: 64 | B67: 2016 | C67: 4 | D67: 4 | E67: [] | F67: =R[-2]C -> 1 | G67: 1
A68: 65 | B68: 2016 | C68: 4 | D68: 5 | E68: [{110050,1,1},{110045,1,300},{110148,1,1},{110127,1,100}] | F68: =R[-2]C -> 0 | G68: 0
A69: 66 | B69: 2016 | C69: 4 | D69: 6 | E69: [] | F69: =R[-2]C -> 1 | G69: 2
A70: 67 | B70: 2016 | C70: 4 | D70: 7 | E70: [] | F70: =R[-2]C -> 0 | G70: 0
A71: 68 | B71: 2016 | C71: 4 | D71: 8 | E71: [] | F71: =R[-2]C -> 1 | G71: 2
A72: 69 | B72: 2016 | C72: 4 | D72: 9 | E72: [] | F72: =R[-2]C -> 0 | G72: 0
A73: 70 | B73: 2016 | C73: 4 | D73: 10 | E73: [{110050,1,1},{110045,1,400},{110148,1,1},{110127,1,150}] | F73: =R[-2]C -> 1 | G73: 3
A74: 71 | B74: 2016 | C74: 4 | D74: 11 | E74: [] | F74: =R[-2]C -> 0 | G74: 0
A75: 72 | B75: 2016 | C75: 4 | D75: 12 | E75: [] | F75: =R[-2]C -> 1 | G75: 4
A76: 73 | B76: 2016 | C76: 4 | D76: 13 | E76: [] | F76: =R[-2]C -> 0 | G76: 0
A77: 74 | B77: 2016 | C77: 4 | D77: 14 | E77: [] | F77: =R[-2]C -> 1 | G77: 5
A78: 75 | B78: 2016 | C78: 4 | D78: 15 | E78: [] | F78: =R[-2]C -> 0 | G78: 0
A79: 76 | B79: 2016 | C79: 4 | D79: 16 | E79: [] | F79: =R[-2]C -> 1 | G79: 6
A80: 77 | B80: 2016 | C80: 4 | D80: 17 | E80: [{110050,1,1},{110045,1,500},{110148,1,2},{110127,1,200}] | F80: =R[-2]C -> 0 | G80: 0
A81: 78 | B81: 2016 | C81: 4 | D81: 18 | E81: [] | F81: =R[-2]C -> 1 | G81: 7
A82: 79 | B82: 2016 | C82: 4 | D82: 19 | E82: [] | F82: =R[-2]C -> 0 | G82: 0
A83: 80 | B83: 2016 | C83: 4 | D83: 20 | E83: [] | F83: =R[-2]C -> 1 | G83: 8
A84: 81 | B84: 2016 | C84: 4 | D84: 21 | E84: [] | F84: =R[-2]C -> 0 | G84: 0
A85: 82 | B85: 2016 | C85: 4 | D85: 22 | E85: [] | F85: =R[-2]C -> 1 | G85: 9
A86: 83 | B86: 2016 | C86: 4 | D86: 23 | E86: [] | F86: =R[-2]C -> 0 | G86: 0
A87: 84 | B87: 2016 | C87: 4 | D87: 24 | E87: [] | F87: =R[-2]C -> 1 | G87: 10
A88: 85 | B88: 2016 | C88: 4 | D88: 25 | E88: [] | F88: =R[-2]C -> 0 | G88: 0
A89: 86 | B89: 2016 | C89: 4 | D89: 26 | E89: [{110050,1,1},{110045,1,600},{110149,1,1},{110140,1,10}] | F89: =R[-2]C -> 1 | G89: 11
A90: 87 | B90: 2016 | C90: 4 | D90: 27 | E90: [] | F90: =R[-2]C -> 0 | G90: 0
A91: 88 | B91: 2016 | C91: 4 | D91: 28 | E91: [] | F91: =R[-2]C -> 1 | G91: 12
A92: 89 | B92: 2016 | C92: 4 | D92: 29 | E92: [] | F92: =R[-2]C -> 0 | G92: 0
A93: 90 | B93: 2016 | C93: 4 | D93: 30 | E93: [] | F93: =R[-2]C -> 1 | G93: 12
A94: 91 | B94: 2016 | C94: 5 | D94: 1 | E94: [] | F94: 0 | G94: 0
A95: 92 | B95: 2016 | C95: 5 | D95: 2 | E95: [{110050,1,1},{110045,1,200},{110148,1,1},{110127,1,50}] | F95: 1 | G95: 1
A96: 93 | B96: 2016 | C96: 5 | D96: 3 | E96: [] | F96: =R[-2]C -> 0 | G96: 0
A97: 94 | B97: 2016 | C97: 5 | D97: 4 | E97: [] | F97: =R[-2]C -> 1 | G97: 1
A98: 95 | B98: 2016 | C98: 5 | D98: 5 | E98: [{110050,1,1},{110045,1,300},{110148,1,1},{110127,1,100}] | F98: =R[-2]C -> 0 | G98: 0
A99: 96 | B99: 2016 | C99: 5 | D99: 6 | E99: [] | F99: =R[-2]C -> 1 | G99: 2
A100: 97 | B100: 2016 | C100: 5 | D100: 7 | E100: [] | F100: =R[-2]C -> 0 | G100: 0
A101: 98 | B101: 2016 | C101: 5 | D101: 8 | E101: [] | F101: =R[-2]C -> 1 | G101: 2
A102: 99 | B102: 2016 | C102: 5 | D102: 9 | E102: [] | F102: =R[-2]C -> 0 | G102: 0
A103: 100 | B103: 2016 | C103: 5 | D103: 10 | E103: [{110050,1,1},{110045,1,400},{110148,1,1},{110127,1,150}] | F103: =R[-2]C -> 1 | G103: 3
A104: 101 | B104: 2016 | C104: 5 | D104: 11 | E104: [] | F104: =R[-2]C -> 0 | G104: 0
A105: 102 | B105: 2016 | C105: 5 | D105: 12 | E105: [] | F105: =R[-2]C -> 1 | G105: 4
A106: 103 | B106: 2016 | C106: 5 | D106: 13 | E106: [] | F106: =R[-2]C -> 0 | G106: 0
A107: 104 | B107: 2016 | C107: 5 | D107: 14 | E107: [] | F107: =R[-2]C -> 1 | G107: 5
A108: 105 | B108: 2016 | C108: 5 | D108: 15 | E108: [] | F108: =R[-2]C -> 0 | G108: 0
A109: 106 | B109: 2016 | C109: 5 | D109: 16 | E109: [] | F109: =R[-2]C -> 1 | G109: 6
A110: 107 | B110: 2016 | C110: 5 | D110: 17 | E110: [{110050,1,1},{110045,1,500},{110148,1,2},{110127,1,200}] | F110: =R[-2]C -> 0 | G110: 0
A111: 108 | B111: 2016 | C111: 5 | D111: 18 | E111: [] | F111: =R[-2]C -> 1 | G111: 7
A112: 109 | B112: 2016 | C112: 5 | D112: 19 | E112: [] | F112: =R[-2]C -> 0 | G112: 0
A113: 110 | B113: 2016 | C113: 5 | D113: 20 | E113: [] | F113: =R[-2]C -> 1 | G113: 8
A114: 111 | B114: 2016 | C114: 5 | D114: 21 | E114: [] | F114: =R[-2]C -> 0 | G114: 0
A115: 112 | B115: 2016 | C115: 5 | D115: 22 | E115: [] | F115: =R[-2]C -> 1 | G115: 9
A116: 113 | B116: 2016 | C116: 5 | D116: 23 | E116: [] | F116: =R[-2]C -> 0 | G116: 0
A117: 114 | B117: 2016 | C117: 5 | D117: 24 | E117: [] | F117: =R[-2]C -> 1 | G117: 10
A118: 115 | B118: 2016 | C118: 5 | D118: 25 | E118: [] | F118: =R[-2]C -> 0 | G118: 0
A119: 116 | B119: 2016 | C119: 5 | D119: 26 | E119: [{110050,1,1},{110045,1,600},{110149,1,1},{110140,1,10}] | F119: =R[-2]C -> 1 | G119: 11
A120: 117 | B120: 2016 | C120: 5 | D120: 27 | E120: [] | F120: =R[-2]C -> 0 | G120: 0
A121: 118 | B121: 2016 | C121: 5 | D121: 28 | E121: [] | F121: =R[-2]C -> 1 | G121: 12
A122: 119 | B122: 2016 | C122: 5 | D122: 29 | E122: [] | F122: =R[-2]C -> 0 | G122: 0
A123: 120 | B123: 2016 | C123: 5 | D123: 30 | E123: [] | F123: =R[-2]C -> 1 | G123: 12
A124: 121 | B124: 2016 | C124: 5 | D124: 31 | E124: [] | F124: =R[-2]C -> 0 | G124: 0
A125: 122 | B125: 2016 | C125: 6 | D125: 1 | E125: [] | F125: 0 | G125: 0
A126: 123 | B126: 2016 | C126: 6 | D126: 2 | E126: [{110050,1,1},{110045,1,200},{110148,1,1},{110127,1,50}] | F126: 1 | G126: 1
A127: 124 | B127: 2016 | C127: 6 | D127: 3 | E127: [] | F127: =R[-2]C -> 0 | G127: 0
A128: 125 | B128: 2016 | C128: 6 | D128: 4 | E128: [] | F128: =R[-2]C -> 1 | G128: 1
A129: 126 | B129: 2016 | C129: 6 | D129: 5 | E129: [{110050,1,1},{110045,1,300},{110148,1,1},{110127,1,100}] | F129: =R[-2]C -> 0 | G129: 0
A130: 127 | B130: 2016 | C130: 6 | D130: 6 | E130: [] | F130: =R[-2]C -> 1 | G130: 2
A131: 128 | B131: 2016 | C131: 6 | D131: 7 | E131: [] | F131: =R[-2]C -> 0 | G131: 0
A132: 129 | B132: 2016 | C132: 6 | D132: 8 | E132: [] | F132: =R[-2]C -> 1 | G132: 2
A133: 130 | B133: 2016 | C133: 6 | D133: 9 | E133: [] | F133: =R[-2]C -> 0 | G133: 0
A134: 131 | B134: 2016 | C134: 6 | D134: 10 | E134: [{110050,1,1},{110045,1,400},{110148,1,1},{110127,1,150}] | F134: =R[-2]C -> 1 | G134: 3
A135: 132 | B135: 2016 | C135: 6 | D135: 11 | E135: [] | F135: =R[-2]C -> 0 | G135: 0
A136: 133 | B136: 2016 | C136: 6 | D136: 12 | E136: [] | F136: =R[-2]C -> 1 | G136: 4
A137: 134 | B137: 2016 | C137: 6 | D137: 13 | E137: [] | F137: =R[-2]C -> 0 | G137: 0
A138: 135 | B138: 2016 | C138: 6 | D138: 14 | E138: [] | F138: =R[-2]C -> 1 | G138: 5
A139: 136 | B139: 2016 | C139: 6 | D139: 15 | E139: [] | F139: =R[-2]C -> 0 | G139: 0
A140: 137 | B140: 2016 | C140: 6 | D140: 16 | E140: [] | F140: =R[-2]C -> 1 | G140: 6
A141: 138 | B141: 2016 | C141: 6 | D141: 17 | E141: [{110050,1,1},{110045,1,500},{110148,1,2},{110127,1,200}] | F141: =R[-2]C -> 0 | G141: 0
A142: 139 | B142: 2016 | C142: 6 | D142: 18 | E142: [] | F142: =R[-2]C -> 1 | G142: 7
A143: 140 | B143: 2016 | C143: 6 | D143: 19 | E143: [] | F143: =R[-2]C -> 0 | G143: 0
A144: 141 | B144: 2016 | C144: 6 | D144: 20 | E144: [] | F144: =R[-2]C -> 1 | G144: 8
A145: 142 | B145: 2016 | C145: 6 | D145: 21 | E145: [] | F145: =R[-2]C -> 0 | G145: 0
A146: 143 | B146: 2016 | C146: 6 | D146: 22 | E146: [] | F146: =R[-2]C -> 1 | G146: 9
A147: 144 | B147: 2016 | C147: 6 | D147: 23 | E147: [] | F147: =R[-2]C -> 0 | G147: 0
A148: 145 | B148: 2016 | C148: 6 | D148: 24 | E148: [] | F148: =R[-2]C -> 1 | G148: 10
A149: 146 | B149: 2016 | C149: 6 | D149: 25 | E149: [] | F149: =R[-2]C -> 0 | G149: 0
A150: 147 | B150: 2016 | C150: 6 | D150: 26 | E150: [{110050,1,1},{110045,1,600},{110149,1,1},{110140,1,10}] | F150: =R[-2]C -> 1 | G150: 11
A151: 148 | B151: 2016 | C151: 6 | D151: 27 | E151: [] | F151: =R[-2]C -> 0 | G151: 0
A152: 149 | B152: 2016 | C152: 6 | D152: 28 | E152: [] | F152: =R[-2]C -> 1 | G152: 12
A153: 150 | B153: 2016 | C153: 6 | D153: 29 | E153: [] | F153: =R[-2]C -> 0 | G153: 0
A154: 151 | B154: 2016 | C154: 6 | D154: 30 | E154: [] | F154: =R[-2]C -> 1 | G154: 12
A155: 152 | B155: 2016 | C155: 7 | D155: 1 | E155: [] | F155: 0 | G155: 0
A156: 153 | B156: 2016 | C156: 7 | D156: 2 | E156: [{110050,1,1},{110045,1,200},{110148,1,1},{110127,1,50}] | F156: 1 | G156: 1
A157: 154 | B157: 2016 | C157: 7 | D157: 3 | E157: [] | F157: =R[-2]C -> 0 | G157: 0
A158: 155 | B158: 2016 | C158: 7 | D158: 4 | E158: [] | F158: =R[-2]C -> 1 | G158: 1
A159: 156 | B159: 2016 | C159: 7 | D159: 5 | E159: [{110050,1,1},{110045,1,300},{110148,1,1},{110127,1,100}] | F159: =R[-2]C -> 0 | G159: 0
A160: 157 | B160: 2016 | C160: 7 | D160: 6 | E160: [] | F160: =R[-2]C -> 1 | G160: 2
A161: 158 | B161: 2016 | C161: 7 | D161: 7 | E161: [] | F161: =R[-2]C -> 0 | G161: 0
A162: 159 | B162: 2016 | C162: 7 | D162: 8 | E162: [] | F162: =R[-2]C -> 1 | G162: 2
A163: 160 | B163: 2016 | C163: 7 | D163: 9 | E163: [] | F163: =R[-2]C -> 0 | G163: 0
A164: 161 | B164: 2016 | C164: 7 | D164: 10 | E164: [{110050,1,1},{110045,1,400},{110148,1,1},{110127,1,150}] | F164: =R[-2]C -> 1 | G164: 3
A165: 162 | B165: 2016 | C165: 7 | D165: 11 | E165: [] | F165: =R[-2]C -> 0 | G165: 0
A166: 163 | B166: 2016 | C166: 7 | D166: 12 | E166: [] | F166: =R[-2]C -> 1 | G166: 4
A167: 164 | B167: 2016 | C167: 7 | D167: 13 | E167: [] | F167: =R[-2]C -> 0 | G167: 0
A168: 165 | B168: 2016 | C168: 7 | D168: 14 | E168: [] | F168: =R[-2]C -> 1 | G168: 5
A169: 166 | B169: 2016 | C169: 7 | D169: 15 | E169: [] | F169: =R[-2]C -> 0 | G169: 0
A170: 167 | B170: 2016 | C170: 7 | D170: 16 | E170: [] | F170: =R[-2]C -> 1 | G170: 6
A171: 168 | B171: 2016 | C171: 7 | D171: 17 | E171: [{110050,1,1},{110045,1,500},{110148,1,2},{110127,1,200}] | F171: =R[-2]C -> 0 | G171: 0
A172: 169 | B172: 2016 | C172: 7 | D172: 18 | E172: [] | F172: =R[-2]C -> 1 | G172: 7
A173: 170 | B173: 2016 | C173: 7 | D173: 19 | E173: [] | F173: =R[-2]C -> 0 | G173: 0
A174: 171 | B174: 2016 | C174: 7 | D174: 20 | E174: [] | F174: =R[-2]C -> 1 | G174: 8
A175: 172 | B175: 2016 | C175: 7 | D175: 21 | E175: [] | F175: =R[-2]C -> 0 | G175: 0
A176: 173 | B176: 2016 | C176: 7 | D176: 22 | E176: [] | F176: =R[-2]C -> 1 | G176: 9
A177: 174 | B177: 2016 | C177: 7 | D177: 23 | E177: [] | F177: =R[-2]C -> 0 | G177: 0
A178: 175 | B178: 2016 | C178: 7 | D178: 24 | E178: [] | F178: =R[-2]C -> 1 | G178: 10
A179: 176 | B179: 2016 | C179: 7 | D179: 25 | E179: [] | F179: =R[-2]C -> 0 | G179: 0
A180: 177 | B180: 2016 | C180: 7 | D180: 26 | E180: [{110050,1,1},{110045,1,600},{110149,1,1},{110140,1,10}] | F180: =R[-2]C -> 1 | G180: 11
A181: 178 | B181: 2016 | C181: 7 | D181: 27 | E181: [] | F181: =R[-2]C -> 0 | G181: 0
A182: 179 | B182: 2016 | C182: 7 | D182: 28 | E182: [] | F182: =R[-2]C -> 1 | G182: 12
A183: 180 | B183: 2016 | C183: 7 | D183: 29 | E183: [] | F183: =R[-2]C -> 0 | G183: 0
A184: 181 | B184: 2016 | C184: 7 | D184: 30 | E184: [] | F184: =R[-2]C -> 1 | G184: 12
A185: 182 | B185: 2016 | C185: 7 | D185: 31 | E185: [] | F185: =R[-2]C -> 0 | G185: 0
A186: 183 | B186: 2016 | C186: 8 | D186: 1 | E186: [] | F186: 0 | G186: 0
A187: 184 | B187: 2016 | C187: 8 | D187: 2 | E187: [{110050,1,1},{110045,1,200},{110148,1,1},{110127,1,50}] | F187: 1 | G187: 1
A188: 185 | B188: 2016 | C188: 8 | D188: 3 | E188: [] | F188: =R[-2]C -> 0 | G188: 0
A189: 186 | B189: 2016 | C189: 8 | D189: 4 | E189: [] | F189: =R[-2]C -> 1 | G189: 1
A190: 187 | B190: 2016 | C190: 8 | D190: 5 | E190: [{110050,1,1},{110045,1,300},{110148,1,1},{110127,1,100}] | F190: =R[-2]C -> 0 | G190: 0
A191: 188 | B191: 2016 | C191: 8 | D191: 6 | E191: [] | F191: =R[-2]C -> 1 | G191: 2
A192: 189 | B192: 2016 | C192: 8 | D192: 7 | E192: [] | F192: =R[-2]C -> 0 | G192: 0
A193: 190 | B193: 2016 | C193: 8 | D193: 8 | E193: [] | F193: =R[-2]C -> 1 | G193: 2
A194: 191 | B194: 2016 | C194: 8 | D194: 9 | E194: [] | F194: =R[-2]C -> 0 | G194: 0
A195: 192 | B195: 2016 | C195: 8 | D195: 10 | E195: [{110050,1,1},{110045,1,400},{110148,1,1},{110127,1,150}] | F195: =R[-2]C -> 1 | G195: 3
A196: 193 | B196: 2016 | C196: 8 | D196: 11 | E196: [] | F196: =R[-2]C -> 0 | G196: 0
A197: 194 | B197: 2016 | C197: 8 | D197: 12 | E197: [] | F197: =R[-2]C -> 1 | G197: 4
A198: 195 | B198: 2016 | C198: 8 | D198: 13 | E198: [] | F198: =R[-2]C -> 0 | G198: 0
A199: 196 | B199: 2016 | C199: 8 | D199: 14 | E199: [] | F199: =R[-2]C -> 1 | G199: 5
A200: 197 | B200: 2016 | C200: 8 | D200: 15 | E200: [] | F200: =R[-2]C -> 0 | G200: 0
A201: 198 | B201: 2016 | C201: 8 | D201: 16 | E201: [] | F201: =R[-2]C -> 1 | G201: 6
A202: 199 | B202: 2016 | C202: 8 | D202: 17 | E202: [{110050,1,1},{110045,1,500},{110148,1,2},{110127,1,200}] | F202: =R[-2]C -> 0 | G202: 0
A203: 200 | B203: 2016 | C203: 8 | D203: 18 | E203: [] | F203: =R[-2]C -> 1 | G203: 7
A204: 201 | B204: 2016 | C204: 8 | D204: 19 | E204: [] | F204: =R[-2]C -> 0 | G204: 0
A205: 202 | B205: 2016 | C205: 8 | D205: 20 | E205: [] | F205: =R[-2]C -> 1 | G205: 8
A206: 203 | B206: 2016 | C206: 8 | D206: 21 | E206: [] | F206: =R[-2]C -> 0 | G206: 0
A207: 204 | B207: 2016 | C207: 8 | D207: 22 | E207: [] | F207: =R[-2]C -> 1 | G207: 9
A208: 205 | B208: 2016 | C208: 8 | D208: 23 | E208: [] | F208: =R[-2]C -> 0 | G208: 0
A209: 206 | B209: 2016 | C209: 8 | D209: 24 | E209: [] | F209: =R[-2]C -> 1 | G209: 10
A210: 207 | B210: 2016 | C210: 8 | D210: 25 | E210: [] | F210: =R[-2]C -> 0 | G210: 0
A211: 208 | B211: 2016 | C211: 8 | D211: 26 | E211: [{110050,1,1},{110045,1,600},{110149,1,1},{110140,1,10}] | F211: =R[-2]C -> 1 | G211: 11
A212: 209 | B212: 2016 | C212: 8 | D212: 27 | E212: [] | F212: =R[-2]C -> 0 | G212: 0
A213: 210 | B213: 2016 | C213: 8 | D213: 28 | E213: [] | F213: =R[-2]C -> 1 | G213: 12
A214: 211 | B214: 2016 | C214: 8 | D214: 29 | E214: [] | F214: =R[-2]C -> 0 | G214: 0
A215: 212 | B215: 2016 | C215: 8 | D215: 30 | E215: [] | F215: =R[-2]C -> 1 | G215: 12
A216: 213 | B216: 2016 | C216: 8 | D216: 31 | E216: [] | F216: =R[-2]C -> 0 | G216: 0
A217: 214 | B217: 2016 | C217: 9 | D217: 1 | E217: [] | F217: 0 | G217: 0
A218: 215 | B218: 2016 | C218: 9 | D218: 2 | E218: [{110050,1,1},{110045,1,200},{110148,1,1},{110127,1,50}] | F218: 1 | G218: 1
A219: 216 | B219: 2016 | C219: 9 | D219: 3 | E219: [] | F219: =R[-2]C -> 0 | G219: 0
A220: 217 | B220: 2016 | C220: 9 | D220: 4 | E220: [] | F220: =R[-2]C -> 1 | G220: 1
A221: 218 | B221: 2016 | C221: 9 | D221: 5 | E221: [{110050,1,1},{110045,1,300},{110148,1,1},{110127,1,100}] | F221: =R[-2]C -> 0 | G221: 0
A222: 219 | B222: 2016 | C222: 9 | D222: 6 | E222: [] | F222: =R[-2]C -> 1 | G222: 2
A223: 220 | B223: 2016 | C223: 9 | D223: 7 | E223: [] | F223: =R[-2]C -> 0 | G223: 0
A224: 221 | B224: 2016 | C224: 9 | D224: 8 | E224: [] | F224: =R[-2]C -> 1 | G224: 2
A225: 222 | B225: 2016 | C225: 9 | D225: 9 | E225: [] | F225: =R[-2]C -> 0 | G225: 0
A226: 223 | B226: 2016 | C226: 9 | D226: 10 | E226: [{110050,1,1},{110045,1,400},{110148,1,1},{110127,1,150}] | F226: =R[-2]C -> 1 | G226: 3
A227: 224 | B227: 2016 | C227: 9 | D227: 11 | E227: [] | F227: =R[-2]C -> 0 | G227: 0
A228: 225 | B228: 2016 | C228: 9 | D228: 12 | E228: [] | F228: =R[-2]C -> 1 | G228: 4
A229: 226 | B229: 2016 | C229: 9 | D229: 13 | E229: [] | F229: =R[-2]C -> 0 | G229: 0
A230: 227 | B230: 2016 | C230: 9 | D230: 14 | E230: [] | F230: =R[-2]C -> 1 | G230: 5
A231: 228 | B231: 2016 | C231: 9 | D231: 15 | E231: [] | F231: =R[-2]C -> 0 | G231: 0
A232: 229 | B232: 2016 | C232: 9 | D232: 16 | E232: [] | F232: =R[-2]C -> 1 | G232: 6
A233: 230 | B233: 2016 | C233: 9 | D233: 17 | E233: [{110050,1,1},{110045,1,500},{110148,1,2},{110127,1,200}] | F233: =R[-2]C -> 0 | G233: 0
A234: 231 | B234: 2016 | C234: 9 | D234: 18 | E234: [] | F234: =R[-2]C -> 1 | G234: 7
A235: 232 | B235: 2016 | C235: 9 | D235: 19 | E235: [] | F235: =R[-2]C -> 0 | G235: 0
A236: 233 | B236: 2016 | C236: 9 | D236: 20 | E236: [] | F236: =R[-2]C -> 1 | G236: 8
A237: 234 | B237: 2016 | C237: 9 | D237: 21 | E237: [] | F237: =R[-2]C -> 0 | G237: 0
A238: 235 | B238: 2016 | C238: 9 | D238: 22 | E238: [] | F238: =R[-2]C -> 1 | G238: 9
A239: 236 | B239: 2016 | C239: 9 | D239: 23 | E239: [] | F239: =R[-2]C -> 0 | G239: 0
A240: 237 | B240: 2016 | C240: 9 | D240: 24 | E240: [] | F240: =R[-2]C -> 1 | G240: 10
A241: 238 | B241: 2016 | C241: 9 | D241: 25 | E241: [] | F241: =R[-2]C -> 0 | G241: 0
A242: 239 | B242: 2016 | C242: 9 | D242: 26 | E242: [{110050,1,1},{110045,1,600},{110149,1,1},{110140,1,10}] | F242: =R[-2]C -> 1 | G242: 11
A243: 240 | B243: 2016 | C243: 9 | D243: 27 | E243: [] | F243: =R[-2]C -> 0 | G243: 0
A244: 241 | B244: 2016 | C244: 9 | D244: 28 | E244: [] | F244: =R[-2]C -> 1 | G244: 12
A245: 242 | B245: 2016 | C245: 9 | D245: 29 | E245: [] | F245: =R[-2]C -> 0 | G245: 0
A246: 243 | B246: 2016 | C246: 9 | D246: 30 | E246: [] | F246: =R[-2]C -> 1 | G246: 12
A247: 244 | B247: 2016 | C247: 10 | D247: 1 | E247: [] | F247: 0 | G247: 0
A248: 245 | B248: 2016 | C248: 10 | D248: 2 | E248: [{110050,1,1},{110045,1,200},{110148,1,1},{110127,1,50}] | F248: 1 | G248: 1
A249: 246 | B249: 2016 | C249: 10 | D249: 3 | E249: [] | F249: =R[-2]C -> 0 | G249: 0
A250: 247 | B250: 2016 | C250: 10 | D250: 4 | E250: [] | F250: =R[-2]C -> 1 | G250: 1
A251: 248 | B251: 2016 | C251: 10 | D251: 5 | E251: [{110050,1,1},{110045,1,300},{110148,1,1},{110127,1,100}] | F251: =R[-2]C -> 0 | G251: 0
A252: 249 | B252: 2016 | C252: 10 | D252: 6 | E252: [] | F252: =R[-2]C -> 1 | G252: 2
A253: 250 | B253: 2016 | C253: 10 | D253: 7 | E253: [] | F253: =R[-2]C -> 0 | G253: 0
A254: 251 | B254: 2016 | C254: 10 | D254: 8 | E254: [] | F254: =R[-2]C -> 1 | G254: 2
A255: 252 | B255: 2016 | C255: 10 | D255: 9 | E255: [] | F255: =R[-2]C -> 0 | G255: 0
A256: 253 | B256: 2016 | C256: 10 | D256: 10 | E256: [{110050,1,1},{110045,1,400},{110148,1,1},{110127,1,150}] | F256: =R[-2]C -> 1 | G256: 3
A257: 254 | B257: 2016 | C257: 10 | D257: 11 | E257: [] | F257: =R[-2]C -> 0 | G257: 0
A258: 255 | B258: 2016 | C258: 10 | D258: 12 | E258: [] | F258: =R[-2]C -> 1 | G258: 4
A259: 256 | B259: 2016 | C259: 10 | D259: 13 | E259: [] | F259: =R[-2]C -> 0 | G259: 0
A260: 257 | B260: 2016 | C260: 10 | D260: 14 | E260: [] | F260: =R[-2]C -> 1 | G260: 5
A261: 258 | B261: 2016 | C261: 10 | D261: 15 | E261: [] | F261: =R[-2]C -> 0 | G261: 0
A262: 259 | B262: 2016 | C262: 10 | D262: 16 | E262: [] | F262: =R[-2]C -> 1 | G262: 6
A263: 260 | B263: 2016 | C263: 10 | D263: 17 | E263: [{110050,1,1},{110045,1,500},{110148,1,2},{110127,1,200}] | F263: =R[-2]C -> 0 | G263: 0
A264: 261 | B264: 2016 | C264: 10 | D264: 18 | E264: [] | F264: =R[-2]C -> 1 | G264: 7
A265: 262 | B265: 2016 | C265: 10 | D265: 19 | E265: [] | F265: =R[-2]C -> 0 | G265: 0
A266: 263 | B266: 2016 | C266: 10 | D266: 20 | E266: [] | F266: =R[-2]C -> 1 | G266: 8
A267: 264 | B267: 2016 | C267: 10 | D267: 21 | E267: [] | F267: =R[-2]C -> 0 | G267: 0
A268: 265 | B268: 2016 | C268: 10 | D268: 22 | E268: [] | F268: =R[-2]C -> 1 | G268: 9
A269: 266 | B269: 2016 | C269: 10 | D269: 23 | E269: [] | F269: =R[-2]C -> 0 | G269: 0
A270: 267 | B270: 2016 | C270: 10 | D270: 24 | E270: [] | F270: =R[-2]C -> 1 | G270: 10
A271: 268 | B271: 2016 | C271: 10 | D271: 25 | E271: [] | F271: =R[-2]C -> 0 | G271: 0
A272: 269 | B272: 2016 | C272: 10 | D272: 26 | E272: [{110050,1,1},{110045,1,600},{110149,1,1},{110140,1,10}] | F272: =R[-2]C -> 1 | G272: 11
A273: 270 | B273: 2016 | C273: 10 | D273: 27 | E273: [] | F273: =R[-2]C -> 0 | G273: 0
A274: 271 | B274: 2016 | C274: 10 | D274: 28 | E274: [] | F274: =R[-2]C -> 1 | G274: 12
A275: 272 | B275: 2016 | C275: 10 | D275: 29 | E275: [] | F275: =R[-2]C -> 0 | G275: 0
A276: 273 | B276: 2016 | C276: 10 | D276: 30 | E276: [] | F276: =R[-2]C -> 1 | G276: 12
A277: 274 | B277: 2016 | C277: 10 | D277: 31 | E277: [] | F277: =R[-2]C -> 0 | G277: 0
A278: 275 | B278: 2016 | C278: 11 | D278: 1 | E278: [] | F278: 0 | G278: 0
A279: 276 | B279: 2016 | C279: 11 | D279: 2 | E279: [{110050,1,1},{110045,1,200},{110148,1,1},{110127,1,50}] | F279: 1 | G279: 1
A280: 277 | B280: 2016 | C280: 11 | D280: 3 | E280: [] | F280: =R[-2]C -> 0 | G280: 0
A281: 278 | B281: 2016 | C281: 11 | D281: 4 | E281: [] | F281: =R[-2]C -> 1 | G281: 1
A282: 279 | B282: 2016 | C282: 11 | D282: 5 | E282: [{110050,1,1},{110045,1,300},{110148,1,1},{110127,1,100}] | F282: =R[-2]C -> 0 | G282: 0
A283: 280 | B283: 2016 | C283: 11 | D283: 6 | E283: [] | F283: =R[-2]C -> 1 | G283: 2
A284: 281 | B284: 2016 | C284: 11 | D284: 7 | E284: [] | F284: =R[-2]C -> 0 | G284: 0
A285: 282 | B285: 2016 | C285: 11 | D285: 8 | E285: [] | F285: =R[-2]C -> 1 | G285: 2
A286: 283 | B286: 2016 | C286: 11 | D286: 9 | E286: [] | F286: =R[-2]C -> 0 | G286: 0
A287: 284 | B287: 2016 | C287: 11 | D287: 10 | E287: [{110050,1,1},{110045,1,400},{110148,1,1},{110127,1,150}] | F287: =R[-2]C -> 1 | G287: 3
A288: 285 | B288: 2016 | C288: 11 | D288: 11 | E288: [] | F288: =R[-2]C -> 0 | G288: 0
A289: 286 | B289: 2016 | C289: 11 | D289: 12 | E289: [] | F289: =R[-2]C -> 1 | G289: 4
A290: 287 | B290: 2016 | C290: 11 | D290: 13 | E290: [] | F290: =R[-2]C -> 0 | G290: 0
A291: 288 | B291: 2016 | C291: 11 | D291: 14 | E291: [] | F291: =R[-2]C -> 1 | G291: 5
A292: 289 | B292: 2016 | C292: 11 | D292: 15 | E292: [] | F292: =R[-2]C -> 0 | G292: 0
A293: 290 | B293: 2016 | C293: 11 | D293: 16 | E293: [] | F293: =R[-2]C -> 1 | G293: 6
A294: 291 | B294: 2016 | C294: 11 | D294: 17 | E294: [{110050,1,1},{110045,1,500},{110148,1,2},{110127,1,200}] | F294: =R[-2]C -> 0 | G294: 0
A295: 292 | B295: 2016 | C295: 11 | D295: 18 | E295: [] | F295: =R[-2]C -> 1 | G295: 7
A296: 293 | B296: 2016 | C296: 11 | D296: 19 | E296: [] | F296: =R[-2]C -> 0 | G296: 0
A297: 294 | B297: 2016 | C297: 11 | D297: 20 | E297: [] | F297: =R[-2]C -> 1 | G297: 8
A298: 295 | B298: 2016 | C298: 11 | D298: 21 | E298: [] | F298: =R[-2]C -> 0 | G298: 0
A299: 296 | B299: 2016 | C299: 11 | D299: 22 | E299: [] | F299: =R[-2]C -> 1 | G299: 9
A300: 297 | B300: 2016 | C300: 11 | D300: 23 | E300: [] | F300: =R[-2]C -> 0 | G300: 0
A301: 298 | B301: 2016 | C301: 11 | D301: 24 | E301: [] | F301: =R[-2]C -> 1 | G301: 10
A302: 299 | B302: 2016 | C302: 11 | D302: 25 | E302: [] | F302: =R[-2]C -> 0 | G302: 0
A303: 300 | B303: 2016 | C303: 11 | D303: 26 | E303: [{110050,1,1},{110045,1,600},{110149,1,1},{110140,1,10}] | F303: =R[-2]C -> 1 | G303: 11
A304: 301 | B304: 2016 | C304: 11 | D304: 27 | E304: [] | F304: =R[-2]C -> 0 | G304: 0
A305: 302 | B305: 2016 | C305: 11 | D305: 28 | E305: [] | F305: =R[-2]C -> 1 | G305: 12
A306: 303 | B306: 2016 | C306: 11 | D306: 29 | E306: [] | F306: =R[-2]C -> 0 | G306: 0
A307: 304 | B307: 2016 | C307: 11 | D307: 30 | E307: [] | F307: =R[-2]C -> 1 | G307: 12
A308: 305 | B308: 2016 | C308: 12 | D308: 1 | E308: [] | F308: 0 | G308: 0
A309: 306 | B309: 2016 | C309: 12 | D309: 2 | E309: [{110050,1,1},{110045,1,200},{110148,1,1},{110127,1,50}] | F309: 1 | G309: 1
A310: 307 | B310: 2016 | C310: 12 | D310: 3 | E310: [] | F310: =R[-2]C -> 0 | G310: 0
A311: 308 | B311: 2016 | C311: 12 | D311: 4 | E311: [] | F311: =R[-2]C -> 1 | G311: 1
A312: 309 | B312: 2016 | C312: 12 | D312: 5 | E312: [{110050,1,1},{110045,1,300},{110148,1,1},{110127,1,100}] | F312: =R[-2]C -> 0 | G312: 0
A313: 310 | B313: 2016 | C313: 12 | D313: 6 | E313: [] | F313: =R[-2]C -> 1 | G313: 2
A314: 311 | B314: 2016 | C314: 12 | D314: 7 | E314: [] | F314: =R[-2]C -> 0 | G314: 0
A315: 312 | B315: 2016 | C315: 12 | D315: 8 | E315: [] | F315: =R[-2]C -> 1 | G315: 2
A316: 313 | B316: 2016 | C316: 12 | D316: 9 | E316: [] | F316: =R[-2]C -> 0 | G316: 0
A317: 314 | B317: 2016 | C317: 12 | D317: 10 | E317: [{110050,1,1},{110045,1,400},{110148,1,1},{110127,1,150}] | F317: =R[-2]C -> 1 | G317: 3
A318: 315 | B318: 2016 | C318: 12 | D318: 11 | E318: [] | F318: =R[-2]C -> 0 | G318: 0
A319: 316 | B319: 2016 | C319: 12 | D319: 12 | E319: [] | F319: =R[-2]C -> 1 | G319: 4
A320: 317 | B320: 2016 | C320: 12 | D320: 13 | E320: [] | F320: =R[-2]C -> 0 | G320: 0
A321: 318 | B321: 2016 | C321: 12 | D321: 14 | E321: [] | F321: =R[-2]C -> 1 | G321: 5
A322: 319 | B322: 2016 | C322: 12 | D322: 15 | E322: [] | F322: =R[-2]C -> 0 | G322: 0
A323: 320 | B323: 2016 | C323: 12 | D323: 16 | E323: [] | F323: =R[-2]C -> 1 | G323: 6
A324: 321 | B324: 2016 | C324: 12 | D324: 17 | E324: [{110050,1,1},{110045,1,500},{110148,1,2},{110127,1,200}] | F324: =R[-2]C -> 0 | G324: 0
A325: 322 | B325: 2016 | C325: 12 | D325: 18 | E325: [] | F325: =R[-2]C -> 1 | G325: 7
A326: 323 | B326: 2016 | C326: 12 | D326: 19 | E326: [] | F326: =R[-2]C -> 0 | G326: 0
A327: 324 | B327: 2016 | C327: 12 | D327: 20 | E327: [] | F327: =R[-2]C -> 1 | G327: 8
A328: 325 | B328: 2016 | C328: 12 | D328: 21 | E328: [] | F328: =R[-2]C -> 0 | G328: 0
A329: 326 | B329: 2016 | C329: 12 | D329: 22 | E329: [] | F329: =R[-2]C -> 1 | G329: 9
A330: 327 | B330: 2016 | C330: 12 | D330: 23 | E330: [] | F330: =R[-2]C -> 0 | G330: 0
A331: 328 | B331: 2016 | C331: 12 | D331: 24 | E331: [] | F331: =R[-2]C -> 1 | G331: 10
A332: 329 | B332: 2016 | C332: 12 | D332: 25 | E332: [] | F332: =R[-2]C -> 0 | G332: 0
A333: 330 | B333: 2016 | C333: 12 | D333: 26 | E333: [{110050,1,1},{110045,1,600},{110149,1,1},{110140,1,10}] | F333: =R[-2]C -> 1 | G333: 11
A334: 331 | B334: 2016 | C334: 12 | D334: 27 | E334: [] | F334: =R[-2]C -> 0 | G334: 0
A335: 332 | B335: 2016 | C335: 12 | D335: 28 | E335: [] | F335: =R[-2]C -> 1 | G335: 12
A336: 333 | B336: 2016 | C336: 12 | D336: 29 | E336: [] | F336: =R[-2]C -> 0 | G336: 0
A337: 334 | B337: 2016 | C337: 12 | D337: 30 | E337: [] | F337: =R[-2]C -> 1 | G337: 12
A338: 335 | B338: 2016 | C338: 12 | D338: 31 | E338: [] | F338: =R[-2]C -> 0 | G338: 0
A339: 336 | B339: 2017 | C339: 1 | D339: 1 | E339: [] | F339: 0 | G339: 0
A340: 337 | B340: 2017 | C340: 1 | D340: 2 | E340: [{110009,1,500000},{110045,1,100},{110148,1,1},{110127,1,30}] | F340: 0 | G340: 0
A341: 338 | B341: 2017 | C341: 1 | D341: 3 | E341: [] | F341: 0 | G341: 0
A342: 339 | B342: 2017 | C342: 1 | D342: 4 | E342: [] | F342: 0 | G342: 0
A343: 340 | B343: 2017 | C343: 1 | D343: 5 | E343: [{110009,1,500000},{110045,1,150},{110148,1,1},{110127,1,60}] | F343: 0 | G343: 0
A344: 341 | B344: 2017 | C344: 1 | D344: 6 | E344: [] | F344: 0 | G344: 0
A345: 342 | B345: 2017 | C345: 1 | D345: 7 | E345: [] | F345: 0 | G345: 0
A346: 343 | B346: 2017 | C346: 1 | D346: 8 | E346: [] | F346: 0 | G346: 0
A347: 344 | B347: 2017 | C347: 1 | D347: 9 | E347: [] | F347: 0 | G347: 0
A348: 345 | B348: 2017 | C348: 1 | D348: 10 | E348: [{110009,1,500000},{110045,1,200},{110148,1,1},{110127,1,90}] | F348: 0 | G348: 0
A349: 346 | B349: 2017 | C349: 1 | D349: 11 | E349: [] | F349: 0 | G349: 0
A350: 347 | B350: 2017 | C350: 1 | D350: 12 | E350: [] | F350: 0 | G350: 0
A351: 348 | B351: 2017 | C351: 1 | D351: 13 | E351: [] | F351: 0 | G351: 0
A352: 349 | B352: 2017 | C352: 1 | D352: 14 | E352: [] | F352: 0 | G352: 0
A353: 350 | B353: 2017 | C353: 1 | D353: 15 | E353: [] | F353: 0 | G353: 0
A354: 351 | B354: 2017 | C354: 1 | D354: 16 | E354: [] | F354: 0 | G354: 0
A355: 352 | B355: 2017 | C355: 1 | D355: 17 | E355: [{110009,1,500000},{110045,1,250},{110148,1,2},{110127,1,120}] | F355: 0 | G355: 0
A356: 353 | B356: 2017 | C356: 1 | D356: 18 | E356: [] | F356: 0 | G356: 0
A357: 354 | B357: 2017 | C357: 1 | D357: 19 | E357: [] | F357: 0 | G357: 0
A358: 355 | B358: 2017 | C358: 1 | D358: 20 | E358: [] | F358: 0 | G358: 0
A359: 356 | B359: 2017 | C359: 1 | D359: 21 | E359: [] | F359: 0 | G359: 0
A360: 357 | B360: 2017 | C360: 1 | D360: 22 | E360: [] | F360: 0 | G360: 0
A361: 358 | B361: 2017 | C361: 1 | D361: 23 | E361: [] | F361: 0 | G361: 0
A362: 359 | B362: 2017 | C362: 1 | D362: 24 | E362: [] | F362: 0 | G362: 0
A363: 360 | B363: 2017 | C363: 1 | D363: 25 | E363: [] | F363: 0 | G363: 0
A364: 361 | B364: 2017 | C364: 1 | D364: 26 | E364: [{110009,1,500000},{110045,1,300},{110149,1,1},{110140,1,10}] | F364: 0 | G364: 0
A365: 362 | B365: 2017 | C365: 1 | D365: 27 | E365: [] | F365: 0 | G365: 0
A366: 363 | B366: 2017 | C366: 1 | D366: 28 | E366: [] | F366: 0 | G366: 0
A367: 364 | B367: 2017 | C367: 1 | D367: 29 | E367: [] | F367: 0 | G367: 0
A368: 365 | B368: 2017 | C368: 1 | D368: 30 | E368: [] | F368: 0 | G368: 0
A369: 366 | B369: 2017 | C369: 1 | D369: 31 | E369: [] | F369: 0 | G369: 0
A370: 367 | B370: 2017 | C370: 2 | D370: 1 | E370: [] | F370: 0 | G370: 0
A371: 368 | B371: 2017 | C371: 2 | D371: 2 | E371: [{110009,1,500000},{110045,1,100},{110148,1,1},{110127,1,30}] | F371: 0 | G371: 0
A372: 369 | B372: 2017 | C372: 2 | D372: 3 | E372: [] | F372: 0 | G372: 0
A373: 370 | B373: 2017 | C373: 2 | D373: 4 | E373: [] | F373: 0 | G373: 0
A374: 371 | B374: 2017 | C374: 2 | D374: 5 | E374: [{110009,1,500000},{110045,1,150},{110148,1,1},{110127,1,60}] | F374: 0 | G374: 0
A375: 372 | B375: 2017 | C375: 2 | D375: 6 | E375: [] | F375: 0 | G375: 0
A376: 373 | B376: 2017 | C376: 2 | D376: 7 | E376: [] | F376: 0 | G376: 0
A377: 374 | B377: 2017 | C377: 2 | D377: 8 | E377: [] | F377: 0 | G377: 0
A378: 375 | B378: 2017 | C378: 2 | D378: 9 | E378: [] | F378: 0 | G378: 0
A379: 376 | B379: 2017 | C379: 2 | D379: 10 | E379: [{110009,1,500000},{110045,1,200},{110148,1,1},{110127,1,90}] | F379: 0 | G379: 0
A380: 377 | B380: 2017 | C380: 2 | D380: 11 | E380: [] | F380: 0 | G380: 0
A381: 378 | B381: 2017 | C381: 2 | D381: 12 | E381: [] | F381: 0 | G381: 0
A382: 379 | B382: 2017 | C382: 2 | D382: 13 | E382: [] | F382: 0 | G382: 0
A383: 380 | B383: 2017 | C383: 2 | D383: 14 | E383: [] | F383: 0 | G383: 0
A384: 381 | B384: 2017 | C384: 2 | D384: 15 | E384: [] | F384: 0 | G384: 0
A385: 382 | B385: 2017 | C385: 2 | D385: 16 | E385: [] | F385: 0 | G385: 0
A386: 383 | B386: 2017 | C386: 2 | D386: 17 | E386: [{110009,1,500000},{110045,1,250},{110148,1,2},{110127,1,120}] | F386: 0 | G386: 0
A387: 384 | B387: 2017 | C387: 2 | D387: 18 | E387: [] | F387: 0 | G387: 0
A388: 385 | B388: 2017 | C388: 2 | D388: 19 | E388: [] | F388: 0 | G388: 0
A389: 386 | B389: 2017 | C389: 2 | D389: 20 | E389: [] | F389: 0 | G389: 0
A390: 387 | B390: 2017 | C390: 2 | D390: 21 | E390: [] | F390: 0 | G390: 0
A391: 388 | B391: 2017 | C391: 2 | D391: 22 | E391: [] | F391: 0 | G391: 0
A392: 389 | B392: 2017 | C392: 2 | D392: 23 | E392: [] | F392: 0 | G392: 0
A393: 390 | B393: 2017 | C393: 2 | D393: 24 | E393: [] | F393: 0 | G393: 0
A394: 391 | B394: 2017 | C394: 2 | D394: 25 | E394: [] | F394: 0 | G394: 0
A395: 392 | B395: 2017 | C395: 2 | D395: 26 | E395: [{110009,1,500000},{110045,1,300},{110149,1,1},{110140,1,10}] | F395: 0 | G395: 0
A396: 393 | B396: 2017 | C396: 2 | D396: 27 | E396: [] | F396: 0 | G396: 0
A397: 394 | B397: 2017 | C397: 2 | D397: 28 | E397: [] | F397: 0 | G397: 0
A398: 395 | B398: 2017 | C398: 3 | D398: 1 | E398: [] | F398: 0 | G398: 0
A399: 396 | B399: 2017 | C399: 3 | D399: 2 | E399: [{110009,1,500000},{110045,1,100},{110148,1,1},{110127,1,30}] | F399: 0 | G399: 0
A400: 397 | B400: 2017 | C400: 3 | D400: 3 | E400: [] | F400: 0 | G400: 0
A401: 398 | B401: 2017 | C401: 3 | D401: 4 | E401: [] | F401: 0 | G401: 0
A402: 399 | B402: 2017 | C402: 3 | D402: 5 | E402: [{110009,1,500000},{110045,1,150},{110148,1,1},{110127,1,60}] | F402: 0 | G402: 0
A403: 400 | B403: 2017 | C403: 3 | D403: 6 | E403: [] | F403: 0 | G403: 0
A404: 401 | B404: 2017 | C404: 3 | D404: 7 | E404: [] | F404: 0 | G404: 0
A405: 402 | B405: 2017 | C405: 3 | D405: 8 | E405: [] | F405: 0 | G405: 0
A406: 403 | B406: 2017 | C406: 3 | D406: 9 | E406: [] | F406: 0 | G406: 0
A407: 404 | B407: 2017 | C407: 3 | D407: 10 | E407: [{110009,1,500000},{110045,1,200},{110148,1,1},{110127,1,90}] | F407: 0 | G407: 0
A408: 405 | B408: 2017 | C408: 3 | D408: 11 | E408: [] | F408: 0 | G408: 0
A409: 406 | B409: 2017 | C409: 3 | D409: 12 | E409: [] | F409: 0 | G409: 0
A410: 407 | B410: 2017 | C410: 3 | D410: 13 | E410: [] | F410: 0 | G410: 0
A411: 408 | B411: 2017 | C411: 3 | D411: 14 | E411: [] | F411: 0 | G411: 0
A412: 409 | B412: 2017 | C412: 3 | D412: 15 | E412: [] | F412: 0 | G412: 0
A413: 410 | B413: 2017 | C413: 3 | D413: 16 | E413: [] | F413: 0 | G413: 0
A414: 411 | B414: 2017 | C414: 3 | D414: 17 | E414: [{110009,1,500000},{110045,1,250},{110148,1,2},{110127,1,120}] | F414: 0 | G414: 0
A415: 412 | B415: 2017 | C415: 3 | D415: 18 | E415: [] | F415: 0 | G415: 0
A416: 413 | B416: 2017 | C416: 3 | D416: 19 | E416: [] | F416: 0 | G416: 0
A417: 414 | B417: 2017 | C417: 3 | D417: 20 | E417: [] | F417: 0 | G417: 0
A418: 415 | B418: 2017 | C418: 3 | D418: 21 | E418: [] | F418: 0 | G418: 0
A419: 416 | B419: 2017 | C419: 3 | D419: 22 | E419: [] | F419: 0 | G419: 0
A420: 417 | B420: 2017 | C420: 3 | D420: 23 | E420: [] | F420: 0 | G420: 0
A421: 418 | B421: 2017 | C421: 3 | D421: 24 | E421: [] | F421: 0 | G421: 0
A422: 419 | B422: 2017 | C422: 3 | D422: 25 | E422: [] | F422: 0 | G422: 0
A423: 420 | B423: 2017 | C423: 3 | D423: 26 | E423: [{110009,1,500000},{110045,1,300},{110149,1,1},{110140,1,10}] | F423: 0 | G423: 0
A424: 421 | B424: 2017 | C424: 3 | D424: 27 | E424: [] | F424: 0 | G424: 0
A425: 422 | B425: 2017 | C425: 3 | D425: 28 | E425: [] | F425: 0 | G425: 0
A426: 423 | B426: 2017 | C426: 3 | D426: 29 | E426: [] | F426: 0 | G426: 0
A427: 424 | B427: 2017 | C427: 3 | D427: 30 | E427: [] | F427: 0 | G427: 0
A428: 425 | B428: 2017 | C428: 3 | D428: 31 | E428: [] | F428: 0 | G428: 0
A429: 426 | B429: 2017 | C429: 4 | D429: 1 | E429: [] | F429: 0 | G429: 0
A430: 427 | B430: 2017 | C430: 4 | D430: 2 | E430: [{110009,1,500000},{110045,1,100},{110148,1,1},{110127,1,30}] | F430: 0 | G430: 0
A431: 428 | B431: 2017 | C431: 4 | D431: 3 | E431: [] | F431: 0 | G431: 0
A432: 429 | B432: 2017 | C432: 4 | D432: 4 | E432: [] | F432: 0 | G432: 0
A433: 430 | B433: 2017 | C433: 4 | D433: 5 | E433: [{110009,1,500000},{110045,1,150},{110148,1,1},{110127,1,60}] | F433: 0 | G433: 0
A434: 431 | B434: 2017 | C434: 4 | D434: 6 | E434: [] | F434: 0 | G434: 0
A435: 432 | B435: 2017 | C435: 4 | D435: 7 | E435: [] | F435: 0 | G435: 0
A436: 433 | B436: 2017 | C436: 4 | D436: 8 | E436: [] | F436: 0 | G436: 0
A437: 434 | B437: 2017 | C437: 4 | D437: 9 | E437: [] | F437: 0 | G437: 0
A438: 435 | B438: 2017 | C438: 4 | D438: 10 | E438: [{110009,1,500000},{110045,1,200},{110148,1,1},{110127,1,90}] | F438: 0 | G438: 0
A439: 436 | B439: 2017 | C439: 4 | D439: 11 | E439: [] | F439: 0 | G439: 0
A440: 437 | B440: 2017 | C440: 4 | D440: 12 | E440: [] | F440: 0 | G440: 0
A441: 438 | B441: 2017 | C441: 4 | D441: 13 | E441: [] | F441: 0 | G441: 0
A442: 439 | B442: 2017 | C442: 4 | D442: 14 | E442: [] | F442: 0 | G442: 0
A443: 440 | B443: 2017 | C443: 4 | D443: 15 | E443: [] | F443: 0 | G443: 0
A444: 441 | B444: 2017 | C444: 4 | D444: 16 | E444: [] | F444: 0 | G444: 0
A445: 442 | B445: 2017 | C445: 4 | D445: 17 | E445: [{110009,1,500000},{110045,1,250},{110148,1,2},{110127,1,120}] | F445: 0 | G445: 0
A446: 443 | B446: 2017 | C446: 4 | D446: 18 | E446: [] | F446: 0 | G446: 0
A447: 444 | B447: 2017 | C447: 4 | D447: 19 | E447: [] | F447: 0 | G447: 0
A448: 445 | B448: 2017 | C448: 4 | D448: 20 | E448: [] | F448: 0 | G448: 0
A449: 446 | B449: 2017 | C449: 4 | D449: 21 | E449: [] | F449: 0 | G449: 0
A450: 447 | B450: 2017 | C450: 4 | D450: 22 | E450: [] | F450: 0 | G450: 0
A451: 448 | B451: 2017 | C451: 4 | D451: 23 | E451: [] | F451: 0 | G451: 0
A452: 449 | B452: 2017 | C452: 4 | D452: 24 | E452: [] | F452: 0 | G452: 0
A453: 450 | B453: 2017 | C453: 4 | D453: 25 | E453: [] | F453: 0 | G453: 0
A454: 451 | B454: 2017 | C454: 4 | D454: 26 | E454: [{110009,1,500000},{110045,1,300},{110149,1,1},{110140,1,10}] | F454: 0 | G454: 0
A455: 452 | B455: 2017 | C455: 4 | D455: 27 | E455: [] | F455: 0 | G455: 0
A456: 453 | B456: 2017 | C456: 4 | D456: 28 | E456: [] | F456: 0 | G456: 0
A457: 454 | B457: 2017 | C457: 4 | D457: 29 | E457: [] | F457: 0 | G457: 0
A458: 455 | B458: 2017 | C458: 4 | D458: 30 | E458: [] | F458: 0 | G458: 0
A459: 456 | B459: 2017 | C459: 5 | D459: 1 | E459: [] | F459: 0 | G459: 0
A460: 457 | B460: 2017 | C460: 5 | D460: 2 | E460: [{110009,1,500000},{110045,1,100},{110148,1,1},{110127,1,30}] | F460: 0 | G460: 0
A461: 458 | B461: 2017 | C461: 5 | D461: 3 | E461: [] | F461: 0 | G461: 0
A462: 459 | B462: 2017 | C462: 5 | D462: 4 | E462: [] | F462: 0 | G462: 0
A463: 460 | B463: 2017 | C463: 5 | D463: 5 | E463: [{110009,1,500000},{110045,1,150},{110148,1,1},{110127,1,60}] | F463: 0 | G463: 0
A464: 461 | B464: 2017 | C464: 5 | D464: 6 | E464: [] | F464: 0 | G464: 0
A465: 462 | B465: 2017 | C465: 5 | D465: 7 | E465: [] | F465: 0 | G465: 0
A466: 463 | B466: 2017 | C466: 5 | D466: 8 | E466: [] | F466: 0 | G466: 0
A467: 464 | B467: 2017 | C467: 5 | D467: 9 | E467: [] | F467: 0 | G467: 0
A468: 465 | B468: 2017 | C468: 5 | D468: 10 | E468: [{110009,1,500000},{110045,1,200},{110148,1,1},{110127,1,90}] | F468: 0 | G468: 0
A469: 466 | B469: 2017 | C469: 5 | D469: 11 | E469: [] | F469: 0 | G469: 0
A470: 467 | B470: 2017 | C470: 5 | D470: 12 | E470: [] | F470: 0 | G470: 0
A471: 468 | B471: 2017 | C471: 5 | D471: 13 | E471: [] | F471: 0 | G471: 0
A472: 469 | B472: 2017 | C472: 5 | D472: 14 | E472: [] | F472: 0 | G472: 0
A473: 470 | B473: 2017 | C473: 5 | D473: 15 | E473: [] | F473: 0 | G473: 0
A474: 471 | B474: 2017 | C474: 5 | D474: 16 | E474: [] | F474: 0 | G474: 0
A475: 472 | B475: 2017 | C475: 5 | D475: 17 | E475: [{110009,1,500000},{110045,1,250},{110148,1,2},{110127,1,120}] | F475: 0 | G475: 0
A476: 473 | B476: 2017 | C476: 5 | D476: 18 | E476: [] | F476: 0 | G476: 0
A477: 474 | B477: 2017 | C477: 5 | D477: 19 | E477: [] | F477: 0 | G477: 0
A478: 475 | B478: 2017 | C478: 5 | D478: 20 | E478: [] | F478: 0 | G478: 0
A479: 476 | B479: 2017 | C479: 5 | D479: 21 | E479: [] | F479: 0 | G479: 0
A480: 477 | B480: 2017 | C480: 5 | D480: 22 | E480: [] | F480: 0 | G480: 0
A481: 478 | B481: 2017 | C481: 5 | D481: 23 | E481: [] | F481: 0 | G481: 0
A482: 479 | B482: 2017 | C482: 5 | D482: 24 | E482: [] | F482: 0 | G482: 0
A483: 480 | B483: 2017 | C483: 5 | D483: 25 | E483: [] | F483: 0 | G483: 0
A484: 481 | B484: 2017 | C484: 5 | D484: 26 | E484: [{110009,1,500000},{110045,1,300},{110149,1,1},{110140,1,10}] | F484: 0 | G484: 0
A485: 482 | B485: 2017 | C485: 5 | D485: 27 | E485: [] | F485: 0 | G485: 0
A486: 483 | B486: 2017 | C486: 5 | D486: 28 | E486: [] | F486: 0 | G486: 0
A487: 484 | B487: 2017 | C487: 5 | D487: 29 | E487: [] | F487: 0 | G487: 0
A488: 485 | B488: 2017 | C488: 5 | D488: 30 | E488: [] | F488: 0 | G488: 0
A489: 486 | B489: 2017 | C489: 5 | D489: 31 | E489: [] | F489: 0 | G489: 0
A490: 487 | B490: 2017 | C490: 6 | D490: 1 | E490: [] | F490: 0 | G490: 0
A491: 488 | B491: 2017 | C491: 6 | D491: 2 | E491: [{110009,1,500000},{110045,1,100},{110148,1,1},{110127,1,30}] | F491: 0 | G491: 0
A492: 489 | B492: 2017 | C492: 6 | D492: 3 | E492: [] | F492: 0 | G492: 0
A493: 490 | B493: 2017 | C493: 6 | D493: 4 | E493: [] | F493: 0 | G493: 0
A494: 491 | B494: 2017 | C494: 6 | D494: 5 | E494: [{110009,1,500000},{110045,1,150},{110148,1,1},{110127,1,60}] | F494: 0 | G494: 0
A495: 492 | B495: 2017 | C495: 6 | D495: 6 | E495: [] | F495: 0 | G495: 0
A496: 493 | B496: 2017 | C496: 6 | D496: 7 | E496: [] | F496: 0 | G496: 0
A497: 494 | B497: 2017 | C497: 6 | D497: 8 | E497: [] | F497: 0 | G497: 0
A498: 495 | B498: 2017 | C498: 6 | D498: 9 | E498: [] | F498: 0 | G498: 0
A499: 496 | B499: 2017 | C499: 6 | D499: 10 | E499: [{110009,1,500000},{110045,1,200},{110148,1,1},{110127,1,90}] | F499: 0 | G499: 0
A500: 497 | B500: 2017 | C500: 6 | D500: 11 | E500: [] | F500: 0 | G500: 0
A501: 498 | B501: 2017 | C501: 6 | D501: 12 | E501: [] | F501: 0 | G501: 0
A502: 499 | B502: 2017 | C502: 6 | D502: 13 | E502: [] | F502: 0 | G502: 0
A503: 500 | B503: 2017 | C503: 6 | D503: 14 | E503: [] | F503: 0 | G503: 0
A504: 501 | B504: 2017 | C504: 6 | D504: 15 | E504: [] | F504: 0 | G504: 0
A505: 502 | B505: 2017 | C505: 6 | D505: 16 | E505: [] | F505: 0 | G505: 0
A506: 503 | B506: 2017 | C506: 6 | D506: 17 | E506: [{110009,1,500000},{110045,1,250},{110148,1,2},{110127,1,120}] | F506: 0 | G506: 0
A507: 504 | B507: 2017 | C507: 6 | D507: 18 | E507: [] | F507: 0 | G507: 0
A508: 505 | B508: 2017 | C508: 6 | D508: 19 | E508: [] | F508: 0 | G508: 0
A509: 506 | B509: 2017 | C509: 6 | D509: 20 | E509: [] | F509: 0 | G509: 0
A510: 507 | B510: 2017 | C510: 6 | D510: 21 | E510: [] | F510: 0 | G510: 0
A511: 508 | B511: 2017 | C511: 6 | D511: 22 | E511: [] | F511: 0 | G511: 0
A512: 509 | B512: 2017 | C512: 6 | D512: 23 | E512: [] | F512: 0 | G512: 0
A513: 510 | B513: 2017 | C513: 6 | D513: 24 | E513: [] | F513: 0 | G513: 0
A514: 511 | B514: 2017 | C514: 6 | D514: 25 | E514: [] | F514: 0 | G514: 0
A515: 512 | B515: 2017 | C515: 6 | D515: 26 | E515: [{110009,1,500000},{110045,1,300},{110149,1,1},{110140,1,10}] | F515: 0 | G515: 0
A516: 513 | B516: 2017 | C516: 6 | D516: 27 | E516: [] | F516: 0 | G516: 0
A517: 514 | B517: 2017 | C517: 6 | D517: 28 | E517: [] | F517: 0 | G517: 0
A518: 515 | B518: 2017 | C518: 6 | D518: 29 | E518: [] | F518: 0 | G518: 0
A519: 516 | B519: 2017 | C519: 6 | D519: 30 | E519: [] | F519: 0 | G519: 0
A520: 517 | B520: 2017 | C520: 7 | D520: 1 | E520: [] | F520: 0 | G520: 0
A521: 518 | B521: 2017 | C521: 7 | D521: 2 | E521: [{110009,1,500000},{110045,1,100},{110148,1,1},{110127,1,30}] | F521: 0 | G521: 0
A522: 519 | B522: 2017 | C522: 7 | D522: 3 | E522: [] | F522: 0 | G522: 0
A523: 520 | B523: 2017 | C523: 7 | D523: 4 | E523: [] | F523: 0 | G523: 0
A524: 521 | B524: 2017 | C524: 7 | D524: 5 | E524: [{110009,1,500000},{110045,1,150},{110148,1,1},{110127,1,60}] | F524: 0 | G524: 0
A525: 522 | B525: 2017 | C525: 7 | D525: 6 | E525: [] | F525: 0 | G525: 0
A526: 523 | B526: 2017 | C526: 7 | D526: 7 | E526: [] | F526: 0 | G526: 0
A527: 524 | B527: 2017 | C527: 7 | D527: 8 | E527: [] | F527: 0 | G527: 0
A528: 525 | B528: 2017 | C528: 7 | D528: 9 | E528: [] | F528: 0 | G528: 0
A529: 526 | B529: 2017 | C529: 7 | D529: 10 | E529: [{110009,1,500000},{110045,1,200},{110148,1,1},{110127,1,90}] | F529: 0 | G529: 0
A530: 527 | B530: 2017 | C530: 7 | D530: 11 | E530: [] | F530: 0 | G530: 0
A531: 528 | B531: 2017 | C531: 7 | D531: 12 | E531: [] | F531: 0 | G531: 0
A532: 529 | B532: 2017 | C532: 7 | D532: 13 | E532: [] | F532: 0 | G532: 0
A533: 530 | B533: 2017 | C533: 7 | D533: 14 | E533: [] | F533: 0 | G533: 0
A534: 531 | B534: 2017 | C534: 7 | D534: 15 | E534: [] | F534: 0 | G534: 0
A535: 532 | B535: 2017 | C535: 7 | D535: 16 | E535: [] | F535: 0 | G535: 0
A536: 533 | B536: 2017 | C536: 7 | D536: 17 | E536: [{110009,1,500000},{110045,1,250},{110148,1,2},{110127,1,120}] | F536: 0 | G536: 0
A537: 534 | B537: 2017 | C537: 7 | D537: 18 | E537: [] | F537: 0 | G537: 0
A538: 535 | B538: 2017 | C538: 7 | D538: 19 | E538: [] | F538: 0 | G538: 0
A539: 536 | B539: 2017 | C539: 7 | D539: 20 | E539: [] | F539: 0 | G539: 0
A540: 537 | B540: 2017 | C540: 7 | D540: 21 | E540: [] | F540: 0 | G540: 0
A541: 538 | B541: 2017 | C541: 7 | D541: 22 | E541: [] | F541: 0 | G541: 0
A542: 539 | B542: 2017 | C542: 7 | D542: 23 | E542: [] | F542: 0 | G542: 0
A543: 540 | B543: 2017 | C543: 7 | D543: 24 | E543: [] | F543: 0 | G543: 0
A544: 541 | B544: 2017 | C544: 7 | D544: 25 | E544: [] | F544: 0 | G544: 0
A545: 542 | B545: 2017 | C545: 7 | D545: 26 | E545: [{110009,1,500000},{110045,1,300},{110149,1,1},{110140,1,10}] | F545: 0 | G545: 0
A546: 543 | B546: 2017 | C546: 7 | D546: 27 | E546: [] | F546: 0 | G546: 0
A547: 544 | B547: 2017 | C547: 7 | D547: 28 | E547: [] | F547: 0 | G547: 0
A548: 545 | B548: 2017 | C548: 7 | D548: 29 | E548: [] | F548: 0 | G548: 0
A549: 546 | B549: 2017 | C549: 7 | D549: 30 | E549: [] | F549: 0 | G549: 0
A550: 547 | B550: 2017 | C550: 7 | D550: 31 | E550: [] | F550: 0 | G550: 0
A551: 548 | B551: 2017 | C551: 8 | D551: 1 | E551: [] | F551: 0 | G551: 0
A552: 549 | B552: 2017 | C552: 8 | D552: 2 | E552: [{110009,1,500000},{110045,1,100},{110148,1,1},{110127,1,30}] | F552: 0 | G552: 0
A553: 550 | B553: 2017 | C553: 8 | D553: 3 | E553: [] | F553: 0 | G553: 0
A554: 551 | B554: 2017 | C554: 8 | D554: 4 | E554: [] | F554: 0 | G554: 0
A555: 552 | B555: 2017 | C555: 8 | D555: 5 | E555: [{110009,1,500000},{110045,1,150},{110148,1,1},{110127,1,60}] | F555: 0 | G555: 0
A556: 553 | B556: 2017 | C556: 8 | D556: 6 | E556: [] | F556: 0 | G556: 0
A557: 554 | B557: 2017 | C557: 8 | D557: 7 | E557: [] | F557: 0 | G557: 0
A558: 555 | B558: 2017 | C558: 8 | D558: 8 | E558: [] | F558: 0 | G558: 0
A559: 556 | B559: 2017 | C559: 8 | D559: 9 | E559: [] | F559: 0 | G559: 0
A560: 557 | B560: 2017 | C560: 8 | D560: 10 | E560: [{110009,1,500000},{110045,1,200},{110148,1,1},{110127,1,90}] | F560: 0 | G560: 0
A561: 558 | B561: 2017 | C561: 8 | D561: 11 | E561: [] | F561: 0 | G561: 0
A562: 559 | B562: 2017 | C562: 8 | D562: 12 | E562: [] | F562: 0 | G562: 0
A563: 560 | B563: 2017 | C563: 8 | D563: 13 | E563: [] | F563: 0 | G563: 0
A564: 561 | B564: 2017 | C564: 8 | D564: 14 | E564: [] | F564: 0 | G564: 0
A565: 562 | B565: 2017 | C565: 8 | D565: 15 | E565: [] | F565: 0 | G565: 0
A566: 563 | B566: 2017 | C566: 8 | D566: 16 | E566: [] | F566: 0 | G566: 0
A567: 564 | B567: 2017 | C567: 8 | D567: 17 | E567: [{110009,1,500000},{110045,1,250},{110148,1,2},{110127,1,120}] | F567: 0 | G567: 0
A568: 565 | B568: 2017 | C568: 8 | D568: 18 | E568: [] | F568: 0 | G568: 0
A569: 566 | B569: 2017 | C569: 8 | D569: 19 | E569: [] | F569: 0 | G569: 0
A570: 567 | B570: 2017 | C570: 8 | D570: 20 | E570: [] | F570: 0 | G570: 0
A571: 568 | B571: 2017 | C571: 8 | D571: 21 | E571: [] | F571: 0 | G571: 0
A572: 569 | B572: 2017 | C572: 8 | D572: 22 | E572: [] | F572: 0 | G572: 0
A573: 570 | B573: 2017 | C573: 8 | D573: 23 | E573: [] | F573: 0 | G573: 0
A574: 571 | B574: 2017 | C574: 8 | D574: 24 | E574: [] | F574: 0 | G574: 0
A575: 572 | B575: 2017 | C575: 8 | D575: 25 | E575: [] | F575: 0 | G575: 0
A576: 573 | B576: 2017 | C576: 8 | D576: 26 | E576: [{110009,1,500000},{110045,1,300},{110149,1,1},{110140,1,10}] | F576: 0 | G576: 0
A577: 574 | B577: 2017 | C577: 8 | D577: 27 | E577: [] | F577: 0 | G577: 0
A578: 575 | B578: 2017 | C578: 8 | D578: 28 | E578: [] | F578: 0 | G578: 0
A579: 576 | B579: 2017 | C579: 8 | D579: 29 | E579: [] | F579: 0 | G579: 0
A580: 577 | B580: 2017 | C580: 8 | D580: 30 | E580: [] | F580: 0 | G580: 0
A581: 578 | B581: 2017 | C581: 8 | D581: 31 | E581: [] | F581: 0 | G581: 0
A582: 579 | B582: 2017 | C582: 9 | D582: 1 | E582: [] | F582: 0 | G582: 0
A583: 580 | B583: 2017 | C583: 9 | D583: 2 | E583: [{110009,1,500000},{110045,1,100},{110148,1,1},{110127,1,30}] | F583: 0 | G583: 0
A584: 581 | B584: 2017 | C584: 9 | D584: 3 | E584: [] | F584: 0 | G584: 0
A585: 582 | B585: 2017 | C585: 9 | D585: 4 | E585: [] | F585: 0 | G585: 0
A586: 583 | B586: 2017 | C586: 9 | D586: 5 | E586: [{110009,1,500000},{110045,1,150},{110148,1,1},{110127,1,60}] | F586: 0 | G586: 0
A587: 584 | B587: 2017 | C587: 9 | D587: 6 | E587: [] | F587: 0 | G587: 0
A588: 585 | B588: 2017 | C588: 9 | D588: 7 | E588: [] | F588: 0 | G588: 0
A589: 586 | B589: 2017 | C589: 9 | D589: 8 | E589: [] | F589: 0 | G589: 0
A590: 587 | B590: 2017 | C590: 9 | D590: 9 | E590: [] | F590: 0 | G590: 0
A591: 588 | B591: 2017 | C591: 9 | D591: 10 | E591: [{110009,1,500000},{110045,1,200},{110148,1,1},{110127,1,90}] | F591: 0 | G591: 0
A592: 589 | B592: 2017 | C592: 9 | D592: 11 | E592: [] | F592: 0 | G592: 0
A593: 590 | B593: 2017 | C593: 9 | D593: 12 | E593: [] | F593: 0 | G593: 0
A594: 591 | B594: 2017 | C594: 9 | D594: 13 | E594: [] | F594: 0 | G594: 0
A595: 592 | B595: 2017 | C595: 9 | D595: 14 | E595: [] | F595: 0 | G595: 0
A596: 593 | B596: 2017 | C596: 9 | D596: 15 | E596: [] | F596: 0 | G596: 0
A597: 594 | B597: 2017 | C597: 9 | D597: 16 | E597: [] | F597: 0 | G597: 0
A598: 595 | B598: 2017 | C598: 9 | D598: 17 | E598: [{110009,1,500000},{110045,1,250},{110148,1,2},{110127,1,120}] | F598: 0 | G598: 0
A599: 596 | B599: 2017 | C599: 9 | D599: 18 | E599: [] | F599: 0 | G599: 0
A600: 597 | B600: 2017 | C600: 9 | D600: 19 | E600: [] | F600: 0 | G600: 0
A601: 598 | B601: 2017 | C601: 9 | D601: 20 | E601: [] | F601: 0 | G601: 0
A602: 599 | B602: 2017 | C602: 9 | D602: 21 | E602: [] | F602: 0 | G602: 0
A603: 600 | B603: 2017 | C603: 9 | D603: 22 | E603: [] | F603: 0 | G603: 0
A604: 601 | B604: 2017 | C604: 9 | D604: 23 | E604: [] | F604: 0 | G604: 0
A605: 602 | B605: 2017 | C605: 9 | D605: 24 | E605: [] | F605: 0 | G605: 0
A606: 603 | B606: 2017 | C606: 9 | D606: 25 | E606: [] | F606: 0 | G606: 0
A607: 604 | B607: 2017 | C607: 9 | D607: 26 | E607: [{110009,1,500000},{110045,1,300},{110149,1,1},{110140,1,10}] | F607: 0 | G607: 0
A608: 605 | B608: 2017 | C608: 9 | D608: 27 | E608: [] | F608: 0 | G608: 0
A609: 606 | B609: 2017 | C609: 9 | D609: 28 | E609: [] | F609: 0 | G609: 0
A610: 607 | B610: 2017 | C610: 9 | D610: 29 | E610: [] | F610: 0 | G610: 0
A611: 608 | B611: 2017 | C611: 9 | D611: 30 | E611: [] | F611: 0 | G611: 0
A612: 609 | B612: 2017 | C612: 10 | D612: 1 | E612: [] | F612: 0 | G612: 0
A613: 610 | B613: 2017 | C613: 10 | D613: 2 | E613: [{110009,1,500000},{110045,1,100},{110148,1,1},{110127,1,30}] | F613: 0 | G613: 0
A614: 611 | B614: 2017 | C614: 10 | D614: 3 | E614: [] | F614: 0 | G614: 0
A615: 612 | B615: 2017 | C615: 10 | D615: 4 | E615: [] | F615: 0 | G615: 0
A616: 613 | B616: 2017 | C616: 10 | D616: 5 | E616: [{110009,1,500000},{110045,1,150},{110148,1,1},{110127,1,60}] | F616: 0 | G616: 0
A617: 614 | B617: 2017 | C617: 10 | D617: 6 | E617: [] | F617: 0 | G617: 0
A618: 615 | B618: 2017 | C618: 10 | D618: 7 | E618: [] | F618: 0 | G618: 0
A619: 616 | B619: 2017 | C619: 10 | D619: 8 | E619: [] | F619: 0 | G619: 0
A620: 617 | B620: 2017 | C620: 10 | D620: 9 | E620: [] | F620: 0 | G620: 0
A621: 618 | B621: 2017 | C621: 10 | D621: 10 | E621: [{110009,1,500000},{110045,1,200},{110148,1,1},{110127,1,90}] | F621: 0 | G621: 0
A622: 619 | B622: 2017 | C622: 10 | D622: 11 | E622: [] | F622: 0 | G622: 0
A623: 620 | B623: 2017 | C623: 10 | D623: 12 | E623: [] | F623: 0 | G623: 0
A624: 621 | B624: 2017 | C624: 10 | D624: 13 | E624: [] | F624: 0 | G624: 0
A625: 622 | B625: 2017 | C625: 10 | D625: 14 | E625: [] | F625: 0 | G625: 0
A626: 623 | B626: 2017 | C626: 10 | D626: 15 | E626: [] | F626: 0 | G626: 0
A627: 624 | B627: 2017 | C627: 10 | D627: 16 | E627: [] | F627: 0 | G627: 0
A628: 625 | B628: 2017 | C628: 10 | D628: 17 | E628: [{110009,1,500000},{110045,1,250},{110148,1,2},{110127,1,120}] | F628: 0 | G628: 0
A629: 626 | B629: 2017 | C629: 10 | D629: 18 | E629: [] | F629: 0 | G629: 0
A630: 627 | B630: 2017 | C630: 10 | D630: 19 | E630: [] | F630: 0 | G630: 0
A631: 628 | B631: 2017 | C631: 10 | D631: 20 | E631: [] | F631: 0 | G631: 0
A632: 629 | B632: 2017 | C632: 10 | D632: 21 | E632: [] | F632: 0 | G632: 0
A633: 630 | B633: 2017 | C633: 10 | D633: 22 | E633: [] | F633: 0 | G633: 0
A634: 631 | B634: 2017 | C634: 10 | D634: 23 | E634: [] | F634: 0 | G634: 0
A635: 632 | B635: 2017 | C635: 10 | D635: 24 | E635: [] | F635: 0 | G635: 0
A636: 633 | B636: 2017 | C636: 10 | D636: 25 | E636: [] | F636: 0 | G636: 0
A637: 634 | B637: 2017 | C637: 10 | D637: 26 | E637: [{110009,1,500000},{110045,1,300},{110149,1,1},{110140,1,10}] | F637: 0 | G637: 0
A638: 635 | B638: 2017 | C638: 10 | D638: 27 | E638: [] | F638: 0 | G638: 0
A639: 636 | B639: 2017 | C639: 10 | D639: 28 | E639: [] | F639: 0 | G639: 0
A640: 637 | B640: 2017 | C640: 10 | D640: 29 | E640: [] | F640: 0 | G640: 0
A641: 638 | B641: 2017 | C641: 10 | D641: 30 | E641: [] | F641: 0 | G641: 0
A642: 639 | B642: 2017 | C642: 10 | D642: 31 | E642: [] | F642: 0 | G642: 0
A643: 640 | B643: 2017 | C643: 11 | D643: 1 | E643: [] | F643: 0 | G643: 0
A644: 641 | B644: 2017 | C644: 11 | D644: 2 | E644: [{110009,1,500000},{110045,1,100},{110148,1,1},{110127,1,30}] | F644: 0 | G644: 0
A645: 642 | B645: 2017 | C645: 11 | D645: 3 | E645: [] | F645: 0 | G645: 0
A646: 643 | B646: 2017 | C646: 11 | D646: 4 | E646: [] | F646: 0 | G646: 0
A647: 644 | B647: 2017 | C647: 11 | D647: 5 | E647: [{110009,1,500000},{110045,1,150},{110148,1,1},{110127,1,60}] | F647: 0 | G647: 0
A648: 645 | B648: 2017 | C648: 11 | D648: 6 | E648: [] | F648: 0 | G648: 0
A649: 646 | B649: 2017 | C649: 11 | D649: 7 | E649: [] | F649: 0 | G649: 0
A650: 647 | B650: 2017 | C650: 11 | D650: 8 | E650: [] | F650: 0 | G650: 0
A651: 648 | B651: 2017 | C651: 11 | D651: 9 | E651: [] | F651: 0 | G651: 0
A652: 649 | B652: 2017 | C652: 11 | D652: 10 | E652: [{110009,1,500000},{110045,1,200},{110148,1,1},{110127,1,90}] | F652: 0 | G652: 0
A653: 650 | B653: 2017 | C653: 11 | D653: 11 | E653: [] | F653: 0 | G653: 0
A654: 651 | B654: 2017 | C654: 11 | D654: 12 | E654: [] | F654: 0 | G654: 0
A655: 652 | B655: 2017 | C655: 11 | D655: 13 | E655: [] | F655: 0 | G655: 0
A656: 653 | B656: 2017 | C656: 11 | D656: 14 | E656: [] | F656: 0 | G656: 0
A657: 654 | B657: 2017 | C657: 11 | D657: 15 | E657: [] | F657: 0 | G657: 0
A658: 655 | B658: 2017 | C658: 11 | D658: 16 | E658: [] | F658: 0 | G658: 0
A659: 656 | B659: 2017 | C659: 11 | D659: 17 | E659: [{110009,1,500000},{110045,1,250},{110148,1,2},{110127,1,120}] | F659: 0 | G659: 0
A660: 657 | B660: 2017 | C660: 11 | D660: 18 | E660: [] | F660: 0 | G660: 0
A661: 658 | B661: 2017 | C661: 11 | D661: 19 | E661: [] | F661: 0 | G661: 0
A662: 659 | B662: 2017 | C662: 11 | D662: 20 | E662: [] | F662: 0 | G662: 0
A663: 660 | B663: 2017 | C663: 11 | D663: 21 | E663: [] | F663: 0 | G663: 0
A664: 661 | B664: 2017 | C664: 11 | D664: 22 | E664: [] | F664: 0 | G664: 0
A665: 662 | B665: 2017 | C665: 11 | D665: 23 | E665: [] | F665: 0 | G665: 0
A666: 663 | B666: 2017 | C666: 11 | D666: 24 | E666: [] | F666: 0 | G666: 0
A667: 664 | B667: 2017 | C667: 11 | D667: 25 | E667: [] | F667: 0 | G667: 0
A668: 665 | B668: 2017 | C668: 11 | D668: 26 | E668: [{110009,1,500000},{110045,1,300},{110149,1,1},{110140,1,10}] | F668: 0 | G668: 0
A669: 666 | B669: 2017 | C669: 11 | D669: 27 | E669: [] | F669: 0 | G669: 0
A670: 667 | B670: 2017 | C670: 11 | D670: 28 | E670: [] | F670: 0 | G670: 0
A671: 668 | B671: 2017 | C671: 11 | D671: 29 | E671: [] | F671: 0 | G671: 0
A672: 669 | B672: 2017 | C672: 11 | D672: 30 | E672: [] | F672: 0 | G672: 0
A673: 670 | B673: 2017 | C673: 12 | D673: 1 | E673: [] | F673: 0 | G673: 0
A674: 671 | B674: 2017 | C674: 12 | D674: 2 | E674: [{110009,1,500000},{110045,1,100},{110148,1,1},{110127,1,30}] | F674: 0 | G674: 0
A675: 672 | B675: 2017 | C675: 12 | D675: 3 | E675: [] | F675: 0 | G675: 0
A676: 673 | B676: 2017 | C676: 12 | D676: 4 | E676: [] | F676: 0 | G676: 0
A677: 674 | B677: 2017 | C677: 12 | D677: 5 | E677: [{110009,1,500000},{110045,1,150},{110148,1,1},{110127,1,60}] | F677: 0 | G677: 0
A678: 675 | B678: 2017 | C678: 12 | D678: 6 | E678: [] | F678: 0 | G678: 0
A679: 676 | B679: 2017 | C679: 12 | D679: 7 | E679: [] | F679: 0 | G679: 0
A680: 677 | B680: 2017 | C680: 12 | D680: 8 | E680: [] | F680: 0 | G680: 0
A681: 678 | B681: 2017 | C681: 12 | D681: 9 | E681: [] | F681: 0 | G681: 0
A682: 679 | B682: 2017 | C682: 12 | D682: 10 | E682: [{110009,1,500000},{110045,1,200},{110148,1,1},{110127,1,90}] | F682: 0 | G682: 0
A683: 680 | B683: 2017 | C683: 12 | D683: 11 | E683: [] | F683: 0 | G683: 0
A684: 681 | B684: 2017 | C684: 12 | D684: 12 | E684: [] | F684: 0 | G684: 0
A685: 682 | B685: 2017 | C685: 12 | D685: 13 | E685: [] | F685: 0 | G685: 0
A686: 683 | B686: 2017 | C686: 12 | D686: 14 | E686: [] | F686: 0 | G686: 0
A687: 684 | B687: 2017 | C687: 12 | D687: 15 | E687: [] | F687: 0 | G687: 0
A688: 685 | B688: 2017 | C688: 12 | D688: 16 | E688: [] | F688: 0 | G688: 0
A689: 686 | B689: 2017 | C689: 12 | D689: 17 | E689: [{110009,1,500000},{110045,1,250},{110148,1,2},{110127,1,120}] | F689: 0 | G689: 0
A690: 687 | B690: 2017 | C690: 12 | D690: 18 | E690: [] | F690: 0 | G690: 0
A691: 688 | B691: 2017 | C691: 12 | D691: 19 | E691: [] | F691: 0 | G691: 0
A692: 689 | B692: 2017 | C692: 12 | D692: 20 | E692: [] | F692: 0 | G692: 0
A693: 690 | B693: 2017 | C693: 12 | D693: 21 | E693: [] | F693: 0 | G693: 0
A694: 691 | B694: 2017 | C694: 12 | D694: 22 | E694: [] | F694: 0 | G694: 0
A695: 692 | B695: 2017 | C695: 12 | D695: 23 | E695: [] | F695: 0 | G695: 0
A696: 693 | B696: 2017 | C696: 12 | D696: 24 | E696: [] | F696: 0 | G696: 0
A697: 694 | B697: 2017 | C697: 12 | D697: 25 | E697: [] | F697: 0 | G697: 0
A698: 695 | B698: 2017 | C698: 12 | D698: 26 | E698: [{110009,1,500000},{110045,1,300},{110149,1,1},{110140,1,10}] | F698: 0 | G698: 0
A699: 696 | B699: 2017 | C699: 12 | D699: 27 | E699: [] | F699: 0 | G699: 0
A700: 697 | B700: 2017 | C700: 12 | D700: 28 | E700: [] | F700: 0 | G700: 0
A701: 698 | B701: 2017 | C701: 12 | D701: 29 | E701: [] | F701: 0 | G701: 0
A702: 699 | B702: 2017 | C702: 12 | D702: 30 | E702: [] | F702: 0 | G702: 0
A703: 700 | B703: 2017 | C703: 12 | D703: 31 | E703: [] | F703: 0 | G703: 0
A704: 701 | B704: 2018 | C704: 1 | D704: 1 | E704: [] | F704: 0 | G704: 0
A705: 702 | B705: 2018 | C705: 1 | D705: 2 | E705: [{110009,1,500000},{110045,1,100},{110148,1,1},{110127,1,30}] | F705: 0 | G705: 0
A706: 703 | B706: 2018 | C706: 1 | D706: 3 | E706: [] | F706: 0 | G706: 0
A707: 704 | B707: 2018 | C707: 1 | D707: 4 | E707: [] | F707: 0 | G707: 0
A708: 705 | B708: 2018 | C708: 1 | D708: 5 | E708: [{110009,1,500000},{110045,1,150},{110148,1,1},{110127,1,60}] | F708: 0 | G708: 0
A709: 706 | B709: 2018 | C709: 1 | D709: 6 | E709: [] | F709: 0 | G709: 0
A710: 707 | B710: 2018 | C710: 1 | D710: 7 | E710: [] | F710: 0 | G710: 0
A711: 708 | B711: 2018 | C711: 1 | D711: 8 | E711: [] | F711: 0 | G711: 0
A712: 709 | B712: 2018 | C712: 1 | D712: 9 | E712: [] | F712: 0 | G712: 0
A713: 710 | B713: 2018 | C713: 1 | D713: 10 | E713: [{110009,1,500000},{110045,1,200},{110148,1,1},{110127,1,90}] | F713: 0 | G713: 0
A714: 711 | B714: 2018 | C714: 1 | D714: 11 | E714: [] | F714: 0 | G714: 0
A715: 712 | B715: 2018 | C715: 1 | D715: 12 | E715: [] | F715: 0 | G715: 0
A716: 713 | B716: 2018 | C716: 1 | D716: 13 | E716: [] | F716: 0 | G716: 0
A717: 714 | B717: 2018 | C717: 1 | D717: 14 | E717: [] | F717: 0 | G717: 0
A718: 715 | B718: 2018 | C718: 1 | D718: 15 | E718: [] | F718: 0 | G718: 0
A719: 716 | B719: 2018 | C719: 1 | D719: 16 | E719: [] | F719: 0 | G719: 0
A720: 717 | B720: 2018 | C720: 1 | D720: 17 | E720: [{110009,1,500000},{110045,1,250},{110148,1,2},{110127,1,120}] | F720: 0 | G720: 0
A721: 718 | B721: 2018 | C721: 1 | D721: 18 | E721: [] | F721: 0 | G721: 0
A722: 719 | B722: 2018 | C722: 1 | D722: 19 | E722: [] | F722: 0 | G722: 0
A723: 720 | B723: 2018 | C723: 1 | D723: 20 | E723: [] | F723: 0 | G723: 0
A724: 721 | B724: 2018 | C724: 1 | D724: 21 | E724: [] | F724: 0 | G724: 0
A725: 722 | B725: 2018 | C725: 1 | D725: 22 | E725: [] | F725: 0 | G725: 0
A726: 723 | B726: 2018 | C726: 1 | D726: 23 | E726: [] | F726: 0 | G726: 0
A727: 724 | B727: 2018 | C727: 1 | D727: 24 | E727: [] | F727: 0 | G727: 0
A728: 725 | B728: 2018 | C728: 1 | D728: 25 | E728: [] | F728: 0 | G728: 0
A729: 726 | B729: 2018 | C729: 1 | D729: 26 | E729: [{110009,1,500000},{110045,1,300},{110149,1,1},{110140,1,10}] | F729: 0 | G729: 0
A730: 727 | B730: 2018 | C730: 1 | D730: 27 | E730: [] | F730: 0 | G730: 0
A731: 728 | B731: 2018 | C731: 1 | D731: 28 | E731: [] | F731: 0 | G731: 0
A732: 729 | B732: 2018 | C732: 1 | D732: 29 | E732: [] | F732: 0 | G732: 0
A733: 730 | B733: 2018 | C733: 1 | D733: 30 | E733: [] | F733: 0 | G733: 0
A734: 731 | B734: 2018 | C734: 1 | D734: 31 | E734: [] | F734: 0 | G734: 0
A735: 732 | B735: 2018 | C735: 2 | D735: 1 | E735: [] | F735: 0 | G735: 0
A736: 733 | B736: 2018 | C736: 2 | D736: 2 | E736: [{110009,1,500000},{110045,1,100},{110148,1,1},{110127,1,30}] | F736: 0 | G736: 0
A737: 734 | B737: 2018 | C737: 2 | D737: 3 | E737: [] | F737: 0 | G737: 0
A738: 735 | B738: 2018 | C738: 2 | D738: 4 | E738: [] | F738: 0 | G738: 0
A739: 736 | B739: 2018 | C739: 2 | D739: 5 | E739: [{110009,1,500000},{110045,1,150},{110148,1,1},{110127,1,60}] | F739: 0 | G739: 0
A740: 737 | B740: 2018 | C740: 2 | D740: 6 | E740: [] | F740: 0 | G740: 0
A741: 738 | B741: 2018 | C741: 2 | D741: 7 | E741: [] | F741: 0 | G741: 0
A742: 739 | B742: 2018 | C742: 2 | D742: 8 | E742: [] | F742: 0 | G742: 0
A743: 740 | B743: 2018 | C743: 2 | D743: 9 | E743: [] | F743: 0 | G743: 0
A744: 741 | B744: 2018 | C744: 2 | D744: 10 | E744: [{110009,1,500000},{110045,1,200},{110148,1,1},{110127,1,90}] | F744: 0 | G744: 0
A745: 742 | B745: 2018 | C745: 2 | D745: 11 | E745: [] | F745: 0 | G745: 0
A746: 743 | B746: 2018 | C746: 2 | D746: 12 | E746: [] | F746: 0 | G746: 0
A747: 744 | B747: 2018 | C747: 2 | D747: 13 | E747: [] | F747: 0 | G747: 0
A748: 745 | B748: 2018 | C748: 2 | D748: 14 | E748: [] | F748: 0 | G748: 0
A749: 746 | B749: 2018 | C749: 2 | D749: 15 | E749: [] | F749: 0 | G749: 0
A750: 747 | B750: 2018 | C750: 2 | D750: 16 | E750: [] | F750: 0 | G750: 0
A751: 748 | B751: 2018 | C751: 2 | D751: 17 | E751: [{110009,1,500000},{110045,1,250},{110148,1,2},{110127,1,120}] | F751: 0 | G751: 0
A752: 749 | B752: 2018 | C752: 2 | D752: 18 | E752: [] | F752: 0 | G752: 0
A753: 750 | B753: 2018 | C753: 2 | D753: 19 | E753: [] | F753: 0 | G753: 0
A754: 751 | B754: 2018 | C754: 2 | D754: 20 | E754: [] | F754: 0 | G754: 0
A755: 752 | B755: 2018 | C755: 2 | D755: 21 | E755: [] | F755: 0 | G755: 0
A756: 753 | B756: 2018 | C756: 2 | D756: 22 | E756: [] | F756: 0 | G756: 0
A757: 754 | B757: 2018 | C757: 2 | D757: 23 | E757: [] | F757: 0 | G757: 0
A758: 755 | B758: 2018 | C758: 2 | D758: 24 | E758: [] | F758: 0 | G758: 0
A759: 756 | B759: 2018 | C759: 2 | D759: 25 | E759: [] | F759: 0 | G759: 0
A760: 757 | B760: 2018 | C760: 2 | D760: 26 | E760: [{110009,1,500000},{110045,1,300},{110149,1,1},{110140,1,10}] | F760: 0 | G760: 0
A761: 758 | B761: 2018 | C761: 2 | D761: 27 | E761: [] | F761: 0 | G761: 0
A762: 759 | B762: 2018 | C762: 2 | D762: 28 | E762: [] | F762: 0 | G762: 0
A763: 760 | B763: 2018 | C763: 3 | D763: 1 | E763: [] | F763: 0 | G763: 0
A764: 761 | B764: 2018 | C764: 3 | D764: 2 | E764: [{110009,1,500000},{110045,1,100},{110148,1,1},{110127,1,30}] | F764: 0 | G764: 0
A765: 762 | B765: 2018 | C765: 3 | D765: 3 | E765: [] | F765: 0 | G765: 0
A766: 763 | B766: 2018 | C766: 3 | D766: 4 | E766: [] | F766: 0 | G766: 0
A767: 764 | B767: 2018 | C767: 3 | D767: 5 | E767: [{110009,1,500000},{110045,1,150},{110148,1,1},{110127,1,60}] | F767: 0 | G767: 0
A768: 765 | B768: 2018 | C768: 3 | D768: 6 | E768: [] | F768: 0 | G768: 0
A769: 766 | B769: 2018 | C769: 3 | D769: 7 | E769: [] | F769: 0 | G769: 0
A770: 767 | B770: 2018 | C770: 3 | D770: 8 | E770: [] | F770: 0 | G770: 0
A771: 768 | B771: 2018 | C771: 3 | D771: 9 | E771: [] | F771: 0 | G771: 0
A772: 769 | B772: 2018 | C772: 3 | D772: 10 | E772: [{110009,1,500000},{110045,1,200},{110148,1,1},{110127,1,90}] | F772: 0 | G772: 0
A773: 770 | B773: 2018 | C773: 3 | D773: 11 | E773: [] | F773: 0 | G773: 0
A774: 771 | B774: 2018 | C774: 3 | D774: 12 | E774: [] | F774: 0 | G774: 0
A775: 772 | B775: 2018 | C775: 3 | D775: 13 | E775: [] | F775: 0 | G775: 0
A776: 773 | B776: 2018 | C776: 3 | D776: 14 | E776: [] | F776: 0 | G776: 0
A777: 774 | B777: 2018 | C777: 3 | D777: 15 | E777: [] | F777: 0 | G777: 0
A778: 775 | B778: 2018 | C778: 3 | D778: 16 | E778: [] | F778: 0 | G778: 0
A779: 776 | B779: 2018 | C779: 3 | D779: 17 | E779: [{110009,1,500000},{110045,1,250},{110148,1,2},{110127,1,120}] | F779: 0 | G779: 0
A780: 777 | B780: 2018 | C780: 3 | D780: 18 | E780: [] | F780: 0 | G780: 0
A781: 778 | B781: 2018 | C781: 3 | D781: 19 | E781: [] | F781: 0 | G781: 0
A782: 779 | B782: 2018 | C782: 3 | D782: 20 | E782: [] | F782: 0 | G782: 0
A783: 780 | B783: 2018 | C783: 3 | D783: 21 | E783: [] | F783: 0 | G783: 0
A784: 781 | B784: 2018 | C784: 3 | D784: 22 | E784: [] | F784: 0 | G784: 0
A785: 782 | B785: 2018 | C785: 3 | D785: 23 | E785: [] | F785: 0 | G785: 0
A786: 783 | B786: 2018 | C786: 3 | D786: 24 | E786: [] | F786: 0 | G786: 0
A787: 784 | B787: 2018 | C787: 3 | D787: 25 | E787: [] | F787: 0 | G787: 0
A788: 785 | B788: 2018 | C788: 3 | D788: 26 | E788: [{110009,1,500000},{110045,1,300},{110149,1,1},{110140,1,10}] | F788: 0 | G788: 0
A789: 786 | B789: 2018 | C789: 3 | D789: 27 | E789: [] | F789: 0 | G789: 0
A790: 787 | B790: 2018 | C790: 3 | D790: 28 | E790: [] | F790: 0 | G790: 0
A791: 788 | B791: 2018 | C791: 3 | D791: 29 | E791: [] | F791: 0 | G791: 0
A792: 789 | B792: 2018 | C792: 3 | D792: 30 | E792: [] | F792: 0 | G792: 0
A793: 790 | B793: 2018 | C793: 3 | D793: 31 | E793: [] | F793: 0 | G793: 0
A794: 791 | B794: 2018 | C794: 4 | D794: 1 | E794: [] | F794: 0 | G794: 0
A795: 792 | B795: 2018 | C795: 4 | D795: 2 | E795: [{110009,1,500000},{110045,1,100},{110148,1,1},{110127,1,30}] | F795: 0 | G795: 0
A796: 793 | B796: 2018 | C796: 4 | D796: 3 | E796: [] | F796: 0 | G796: 0
A797: 794 | B797: 2018 | C797: 4 | D797: 4 | E797: [] | F797: 0 | G797: 0
A798: 795 | B798: 2018 | C798: 4 | D798: 5 | E798: [{110009,1,500000},{110045,1,150},{110148,1,1},{110127,1,60}] | F798: 0 | G798: 0
A799: 796 | B799: 2018 | C799: 4 | D799: 6 | E799: [] | F799: 0 | G799: 0
A800: 797 | B800: 2018 | C800: 4 | D800: 7 | E800: [] | F800: 0 | G800: 0
A801: 798 | B801: 2018 | C801: 4 | D801: 8 | E801: [] | F801: 0 | G801: 0
A802: 799 | B802: 2018 | C802: 4 | D802: 9 | E802: [] | F802: 0 | G802: 0
A803: 800 | B803: 2018 | C803: 4 | D803: 10 | E803: [{110009,1,500000},{110045,1,200},{110148,1,1},{110127,1,90}] | F803: 0 | G803: 0
A804: 801 | B804: 2018 | C804: 4 | D804: 11 | E804: [] | F804: 0 | G804: 0
A805: 802 | B805: 2018 | C805: 4 | D805: 12 | E805: [] | F805: 0 | G805: 0
A806: 803 | B806: 2018 | C806: 4 | D806: 13 | E806: [] | F806: 0 | G806: 0
A807: 804 | B807: 2018 | C807: 4 | D807: 14 | E807: [] | F807: 0 | G807: 0
A808: 805 | B808: 2018 | C808: 4 | D808: 15 | E808: [] | F808: 0 | G808: 0
A809: 806 | B809: 2018 | C809: 4 | D809: 16 | E809: [] | F809: 0 | G809: 0
A810: 807 | B810: 2018 | C810: 4 | D810: 17 | E810: [{110009,1,500000},{110045,1,250},{110148,1,2},{110127,1,120}] | F810: 0 | G810: 0
A811: 808 | B811: 2018 | C811: 4 | D811: 18 | E811: [] | F811: 0 | G811: 0
A812: 809 | B812: 2018 | C812: 4 | D812: 19 | E812: [] | F812: 0 | G812: 0
A813: 810 | B813: 2018 | C813: 4 | D813: 20 | E813: [] | F813: 0 | G813: 0
A814: 811 | B814: 2018 | C814: 4 | D814: 21 | E814: [] | F814: 0 | G814: 0
A815: 812 | B815: 2018 | C815: 4 | D815: 22 | E815: [] | F815: 0 | G815: 0
A816: 813 | B816: 2018 | C816: 4 | D816: 23 | E816: [] | F816: 0 | G816: 0
A817: 814 | B817: 2018 | C817: 4 | D817: 24 | E817: [] | F817: 0 | G817: 0
A818: 815 | B818: 2018 | C818: 4 | D818: 25 | E818: [] | F818: 0 | G818: 0
A819: 816 | B819: 2018 | C819: 4 | D819: 26 | E819: [{110009,1,500000},{110045,1,300},{110149,1,1},{110140,1,10}] | F819: 0 | G819: 0
A820: 817 | B820: 2018 | C820: 4 | D820: 27 | E820: [] | F820: 0 | G820: 0
A821: 818 | B821: 2018 | C821: 4 | D821: 28 | E821: [] | F821: 0 | G821: 0
A822: 819 | B822: 2018 | C822: 4 | D822: 29 | E822: [] | F822: 0 | G822: 0
A823: 820 | B823: 2018 | C823: 4 | D823: 30 | E823: [] | F823: 0 | G823: 0
A824: 821 | B824: 2018 | C824: 5 | D824: 1 | E824: [] | F824: 0 | G824: 0
A825: 822 | B825: 2018 | C825: 5 | D825: 2 | E825: [{110009,1,500000},{110045,1,100},{110148,1,1},{110127,1,30}] | F825: 0 | G825: 0
A826: 823 | B826: 2018 | C826: 5 | D826: 3 | E826: [] | F826: 0 | G826: 0
A827: 824 | B827: 2018 | C827: 5 | D827: 4 | E827: [] | F827: 0 | G827: 0
A828: 825 | B828: 2018 | C828: 5 | D828: 5 | E828: [{110009,1,500000},{110045,1,150},{110148,1,1},{110127,1,60}] | F828: 0 | G828: 0
A829: 826 | B829: 2018 | C829: 5 | D829: 6 | E829: [] | F829: 0 | G829: 0
A830: 827 | B830: 2018 | C830: 5 | D830: 7 | E830: [] | F830: 0 | G830: 0
A831: 828 | B831: 2018 | C831: 5 | D831: 8 | E831: [] | F831: 0 | G831: 0
A832: 829 | B832: 2018 | C832: 5 | D832: 9 | E832: [] | F832: 0 | G832: 0
A833: 830 | B833: 2018 | C833: 5 | D833: 10 | E833: [{110009,1,500000},{110045,1,200},{110148,1,1},{110127,1,90}] | F833: 0 | G833: 0
A834: 831 | B834: 2018 | C834: 5 | D834: 11 | E834: [] | F834: 0 | G834: 0
A835: 832 | B835: 2018 | C835: 5 | D835: 12 | E835: [] | F835: 0 | G835: 0
A836: 833 | B836: 2018 | C836: 5 | D836: 13 | E836: [] | F836: 0 | G836: 0
A837: 834 | B837: 2018 | C837: 5 | D837: 14 | E837: [] | F837: 0 | G837: 0
A838: 835 | B838: 2018 | C838: 5 | D838: 15 | E838: [] | F838: 0 | G838: 0
A839: 836 | B839: 2018 | C839: 5 | D839: 16 | E839: [] | F839: 0 | G839: 0
A840: 837 | B840: 2018 | C840: 5 | D840: 17 | E840: [{110009,1,500000},{110045,1,250},{110148,1,2},{110127,1,120}] | F840: 0 | G840: 0
A841: 838 | B841: 2018 | C841: 5 | D841: 18 | E841: [] | F841: 0 | G841: 0
A842: 839 | B842: 2018 | C842: 5 | D842: 19 | E842: [] | F842: 0 | G842: 0
A843: 840 | B843: 2018 | C843: 5 | D843: 20 | E843: [] | F843: 0 | G843: 0
A844: 841 | B844: 2018 | C844: 5 | D844: 21 | E844: [] | F844: 0 | G844: 0
A845: 842 | B845: 2018 | C845: 5 | D845: 22 | E845: [] | F845: 0 | G845: 0
A846: 843 | B846: 2018 | C846: 5 | D846: 23 | E846: [] | F846: 0 | G846: 0
A847: 844 | B847: 2018 | C847: 5 | D847: 24 | E847: [] | F847: 0 | G847: 0
A848: 845 | B848: 2018 | C848: 5 | D848: 25 | E848: [] | F848: 0 | G848: 0
A849: 846 | B849: 2018 | C849: 5 | D849: 26 | E849: [{110009,1,500000},{110045,1,300},{110149,1,1},{110140,1,10}] | F849: 0 | G849: 0
A850: 847 | B850: 2018 | C850: 5 | D850: 27 | E850: [] | F850: 0 | G850: 0
A851: 848 | B851: 2018 | C851: 5 | D851: 28 | E851: [] | F851: 0 | G851: 0
A852: 849 | B852: 2018 | C852: 5 | D852: 29 | E852: [] | F852: 0 | G852: 0
A853: 850 | B853: 2018 | C853: 5 | D853: 30 | E853: [] | F853: 0 | G853: 0
A854: 851 | B854: 2018 | C854: 5 | D854: 31 | E854: [] | F854: 0 | G854: 0
A855: 852 | B855: 2018 | C855: 6 | D855: 1 | E855: [] | F855: 0 | G855: 0
A856: 853 | B856: 2018 | C856: 6 | D856: 2 | E856: [{110009,1,500000},{110045,1,100},{110148,1,1},{110127,1,30}] | F856: 0 | G856: 0
A857: 854 | B857: 2018 | C857: 6 | D857: 3 | E857: [] | F857: 0 | G857: 0
A858: 855 | B858: 2018 | C858: 6 | D858: 4 | E858: [] | F858: 0 | G858: 0
A859: 856 | B859: 2018 | C859: 6 | D859: 5 | E859: [{110009,1,500000},{110045,1,150},{110148,1,1},{110127,1,60}] | F859: 0 | G859: 0
A860: 857 | B860: 2018 | C860: 6 | D860: 6 | E860: [] | F860: 0 | G860: 0
A861: 858 | B861: 2018 | C861: 6 | D861: 7 | E861: [] | F861: 0 | G861: 0
A862: 859 | B862: 2018 | C862: 6 | D862: 8 | E862: [] | F862: 0 | G862: 0
A863: 860 | B863: 2018 | C863: 6 | D863: 9 | E863: [] | F863: 0 | G863: 0
A864: 861 | B864: 2018 | C864: 6 | D864: 10 | E864: [{110009,1,500000},{110045,1,200},{110148,1,1},{110127,1,90}] | F864: 0 | G864: 0
A865: 862 | B865: 2018 | C865: 6 | D865: 11 | E865: [] | F865: 0 | G865: 0
A866: 863 | B866: 2018 | C866: 6 | D866: 12 | E866: [] | F866: 0 | G866: 0
A867: 864 | B867: 2018 | C867: 6 | D867: 13 | E867: [] | F867: 0 | G867: 0
A868: 865 | B868: 2018 | C868: 6 | D868: 14 | E868: [] | F868: 0 | G868: 0
A869: 866 | B869: 2018 | C869: 6 | D869: 15 | E869: [] | F869: 0 | G869: 0
A870: 867 | B870: 2018 | C870: 6 | D870: 16 | E870: [] | F870: 0 | G870: 0
A871: 868 | B871: 2018 | C871: 6 | D871: 17 | E871: [{110009,1,500000},{110045,1,250},{110148,1,2},{110127,1,120}] | F871: 0 | G871: 0
A872: 869 | B872: 2018 | C872: 6 | D872: 18 | E872: [] | F872: 0 | G872: 0
A873: 870 | B873: 2018 | C873: 6 | D873: 19 | E873: [] | F873: 0 | G873: 0
A874: 871 | B874: 2018 | C874: 6 | D874: 20 | E874: [] | F874: 0 | G874: 0
A875: 872 | B875: 2018 | C875: 6 | D875: 21 | E875: [] | F875: 0 | G875: 0
A876: 873 | B876: 2018 | C876: 6 | D876: 22 | E876: [] | F876: 0 | G876: 0
A877: 874 | B877: 2018 | C877: 6 | D877: 23 | E877: [] | F877: 0 | G877: 0
A878: 875 | B878: 2018 | C878: 6 | D878: 24 | E878: [] | F878: 0 | G878: 0
A879: 876 | B879: 2018 | C879: 6 | D879: 25 | E879: [] | F879: 0 | G879: 0
A880: 877 | B880: 2018 | C880: 6 | D880: 26 | E880: [{110009,1,500000},{110045,1,300},{110149,1,1},{110140,1,10}] | F880: 0 | G880: 0
A881: 878 | B881: 2018 | C881: 6 | D881: 27 | E881: [] | F881: 0 | G881: 0
A882: 879 | B882: 2018 | C882: 6 | D882: 28 | E882: [] | F882: 0 | G882: 0
A883: 880 | B883: 2018 | C883: 6 | D883: 29 | E883: [] | F883: 0 | G883: 0
A884: 881 | B884: 2018 | C884: 6 | D884: 30 | E884: [] | F884: 0 | G884: 0
A885: 882 | B885: 2018 | C885: 7 | D885: 1 | E885: [] | F885: 0 | G885: 0
A886: 883 | B886: 2018 | C886: 7 | D886: 2 | E886: [{110009,1,500000},{110045,1,100},{110148,1,1},{110127,1,30}] | F886: 0 | G886: 0
A887: 884 | B887: 2018 | C887: 7 | D887: 3 | E887: [] | F887: 0 | G887: 0
A888: 885 | B888: 2018 | C888: 7 | D888: 4 | E888: [] | F888: 0 | G888: 0
A889: 886 | B889: 2018 | C889: 7 | D889: 5 | E889: [{110009,1,500000},{110045,1,150},{110148,1,1},{110127,1,60}] | F889: 0 | G889: 0
A890: 887 | B890: 2018 | C890: 7 | D890: 6 | E890: [] | F890: 0 | G890: 0
A891: 888 | B891: 2018 | C891: 7 | D891: 7 | E891: [] | F891: 0 | G891: 0
A892: 889 | B892: 2018 | C892: 7 | D892: 8 | E892: [] | F892: 0 | G892: 0
A893: 890 | B893: 2018 | C893: 7 | D893: 9 | E893: [] | F893: 0 | G893: 0
A894: 891 | B894: 2018 | C894: 7 | D894: 10 | E894: [{110009,1,500000},{110045,1,200},{110148,1,1},{110127,1,90}] | F894: 0 | G894: 0
A895: 892 | B895: 2018 | C895: 7 | D895: 11 | E895: [] | F895: 0 | G895: 0
A896: 893 | B896: 2018 | C896: 7 | D896: 12 | E896: [] | F896: 0 | G896: 0
A897: 894 | B897: 2018 | C897: 7 | D897: 13 | E897: [] | F897: 0 | G897: 0
A898: 895 | B898: 2018 | C898: 7 | D898: 14 | E898: [] | F898: 0 | G898: 0
A899: 896 | B899: 2018 | C899: 7 | D899: 15 | E899: [] | F899: 0 | G899: 0
A900: 897 | B900: 2018 | C900: 7 | D900: 16 | E900: [] | F900: 0 | G900: 0
A901: 898 | B901: 2018 | C901: 7 | D901: 17 | E901: [{110009,1,500000},{110045,1,250},{110148,1,2},{110127,1,120}] | F901: 0 | G901: 0
A902: 899 | B902: 2018 | C902: 7 | D902: 18 | E902: [] | F902: 0 | G902: 0
A903: 900 | B903: 2018 | C903: 7 | D903: 19 | E903: [] | F903: 0 | G903: 0
A904: 901 | B904: 2018 | C904: 7 | D904: 20 | E904: [] | F904: 0 | G904: 0
A905: 902 | B905: 2018 | C905: 7 | D905: 21 | E905: [] | F905: 0 | G905: 0
A906: 903 | B906: 2018 | C906: 7 | D906: 22 | E906: [] | F906: 0 | G906: 0
A907: 904 | B907: 2018 | C907: 7 | D907: 23 | E907: [] | F907: 0 | G907: 0
A908: 905 | B908: 2018 | C908: 7 | D908: 24 | E908: [] | F908: 0 | G908: 0
A909: 906 | B909: 2018 | C909: 7 | D909: 25 | E909: [] | F909: 0 | G909: 0
A910: 907 | B910: 2018 | C910: 7 | D910: 26 | E910: [{110009,1,500000},{110045,1,300},{110149,1,1},{110140,1,10}] | F910: 0 | G910: 0
A911: 908 | B911: 2018 | C911: 7 | D911: 27 | E911: [] | F911: 0 | G911: 0
A912: 909 | B912: 2018 | C912: 7 | D912: 28 | E912: [] | F912: 0 | G912: 0
A913: 910 | B913: 2018 | C913: 7 | D913: 29 | E913: [] | F913: 0 | G913: 0
A914: 911 | B914: 2018 | C914: 7 | D914: 30 | E914: [] | F914: 0 | G914: 0
A915: 912 | B915: 2018 | C915: 7 | D915: 31 | E915: [] | F915: 0 | G915: 0
A916: 913 | B916: 2018 | C916: 8 | D916: 1 | E916: [] | F916: 0 | G916: 0
A917: 914 | B917: 2018 | C917: 8 | D917: 2 | E917: [{110009,1,500000},{110045,1,100},{110148,1,1},{110127,1,30}] | F917: 0 | G917: 0
A918: 915 | B918: 2018 | C918: 8 | D918: 3 | E918: [] | F918: 0 | G918: 0
A919: 916 | B919: 2018 | C919: 8 | D919: 4 | E919: [] | F919: 0 | G919: 0
A920: 917 | B920: 2018 | C920: 8 | D920: 5 | E920: [{110009,1,500000},{110045,1,150},{110148,1,1},{110127,1,60}] | F920: 0 | G920: 0
A921: 918 | B921: 2018 | C921: 8 | D921: 6 | E921: [] | F921: 0 | G921: 0
A922: 919 | B922: 2018 | C922: 8 | D922: 7 | E922: [] | F922: 0 | G922: 0
A923: 920 | B923: 2018 | C923: 8 | D923: 8 | E923: [] | F923: 0 | G923: 0
A924: 921 | B924: 2018 | C924: 8 | D924: 9 | E924: [] | F924: 0 | G924: 0
A925: 922 | B925: 2018 | C925: 8 | D925: 10 | E925: [{110009,1,500000},{110045,1,200},{110148,1,1},{110127,1,90}] | F925: 0 | G925: 0
A926: 923 | B926: 2018 | C926: 8 | D926: 11 | E926: [] | F926: 0 | G926: 0
A927: 924 | B927: 2018 | C927: 8 | D927: 12 | E927: [] | F927: 0 | G927: 0
A928: 925 | B928: 2018 | C928: 8 | D928: 13 | E928: [] | F928: 0 | G928: 0
A929: 926 | B929: 2018 | C929: 8 | D929: 14 | E929: [] | F929: 0 | G929: 0
A930: 927 | B930: 2018 | C930: 8 | D930: 15 | E930: [] | F930: 0 | G930: 0
A931: 928 | B931: 2018 | C931: 8 | D931: 16 | E931: [] | F931: 0 | G931: 0
A932: 929 | B932: 2018 | C932: 8 | D932: 17 | E932: [{110009,1,500000},{110045,1,250},{110148,1,2},{110127,1,120}] | F932: 0 | G932: 0
A933: 930 | B933: 2018 | C933: 8 | D933: 18 | E933: [] | F933: 0 | G933: 0
A934: 931 | B934: 2018 | C934: 8 | D934: 19 | E934: [] | F934: 0 | G934: 0
A935: 932 | B935: 2018 | C935: 8 | D935: 20 | E935: [] | F935: 0 | G935: 0
A936: 933 | B936: 2018 | C936: 8 | D936: 21 | E936: [] | F936: 0 | G936: 0
A937: 934 | B937: 2018 | C937: 8 | D937: 22 | E937: [] | F937: 0 | G937: 0
A938: 935 | B938: 2018 | C938: 8 | D938: 23 | E938: [] | F938: 0 | G938: 0
A939: 936 | B939: 2018 | C939: 8 | D939: 24 | E939: [] | F939: 0 | G939: 0
A940: 937 | B940: 2018 | C940: 8 | D940: 25 | E940: [] | F940: 0 | G940: 0
A941: 938 | B941: 2018 | C941: 8 | D941: 26 | E941: [{110009,1,500000},{110045,1,300},{110149,1,1},{110140,1,10}] | F941: 0 | G941: 0
A942: 939 | B942: 2018 | C942: 8 | D942: 27 | E942: [] | F942: 0 | G942: 0
A943: 940 | B943: 2018 | C943: 8 | D943: 28 | E943: [] | F943: 0 | G943: 0
A944: 941 | B944: 2018 | C944: 8 | D944: 29 | E944: [] | F944: 0 | G944: 0
A945: 942 | B945: 2018 | C945: 8 | D945: 30 | E945: [] | F945: 0 | G945: 0
A946: 943 | B946: 2018 | C946: 8 | D946: 31 | E946: [] | F946: 0 | G946: 0
A947: 944 | B947: 2018 | C947: 9 | D947: 1 | E947: [] | F947: 0 | G947: 0
A948: 945 | B948: 2018 | C948: 9 | D948: 2 | E948: [{110009,1,500000},{110045,1,100},{110148,1,1},{110127,1,30}] | F948: 0 | G948: 0
A949: 946 | B949: 2018 | C949: 9 | D949: 3 | E949: [] | F949: 0 | G949: 0
A950: 947 | B950: 2018 | C950: 9 | D950: 4 | E950: [] | F950: 0 | G950: 0
A951: 948 | B951: 2018 | C951: 9 | D951: 5 | E951: [{110009,1,500000},{110045,1,150},{110148,1,1},{110127,1,60}] | F951: 0 | G951: 0
A952: 949 | B952: 2018 | C952: 9 | D952: 6 | E952: [] | F952: 0 | G952: 0
A953: 950 | B953: 2018 | C953: 9 | D953: 7 | E953: [] | F953: 0 | G953: 0
A954: 951 | B954: 2018 | C954: 9 | D954: 8 | E954: [] | F954: 0 | G954: 0
A955: 952 | B955: 2018 | C955: 9 | D955: 9 | E955: [] | F955: 0 | G955: 0
A956: 953 | B956: 2018 | C956: 9 | D956: 10 | E956: [{110009,1,500000},{110045,1,200},{110148,1,1},{110127,1,90}] | F956: 0 | G956: 0
A957: 954 | B957: 2018 | C957: 9 | D957: 11 | E957: [] | F957: 0 | G957: 0
A958: 955 | B958: 2018 | C958: 9 | D958: 12 | E958: [] | F958: 0 | G958: 0
A959: 956 | B959: 2018 | C959: 9 | D959: 13 | E959: [] | F959: 0 | G959: 0
A960: 957 | B960: 2018 | C960: 9 | D960: 14 | E960: [] | F960: 0 | G960: 0
A961: 958 | B961: 2018 | C961: 9 | D961: 15 | E961: [] | F961: 0 | G961: 0
A962: 959 | B962: 2018 | C962: 9 | D962: 16 | E962: [] | F962: 0 | G962: 0
A963: 960 | B963: 2018 | C963: 9 | D963: 17 | E963: [{110009,1,500000},{110045,1,250},{110148,1,2},{110127,1,120}] | F963: 0 | G963: 0
A964: 961 | B964: 2018 | C964: 9 | D964: 18 | E964: [] | F964: 0 | G964: 0
A965: 962 | B965: 2018 | C965: 9 | D965: 19 | E965: [] | F965: 0 | G965: 0
A966: 963 | B966: 2018 | C966: 9 | D966: 20 | E966: [] | F966: 0 | G966: 0
A967: 964 | B967: 2018 | C967: 9 | D967: 21 | E967: [] | F967: 0 | G967: 0
A968: 965 | B968: 2018 | C968: 9 | D968: 22 | E968: [] | F968: 0 | G968: 0
A969: 966 | B969: 2018 | C969: 9 | D969: 23 | E969: [] | F969: 0 | G969: 0
A970: 967 | B970: 2018 | C970: 9 | D970: 24 | E970: [] | F970: 0 | G970: 0
A971: 968 | B971: 2018 | C971: 9 | D971: 25 | E971: [] | F971: 0 | G971: 0
A972: 969 | B972: 2018 | C972: 9 | D972: 26 | E972: [{110009,1,500000},{110045,1,300},{110149,1,1},{110140,1,10}] | F972: 0 | G972: 0
A973: 970 | B973: 2018 | C973: 9 | D973: 27 | E973: [] | F973: 0 | G973: 0
A974: 971 | B974: 2018 | C974: 9 | D974: 28 | E974: [] | F974: 0 | G974: 0
A975: 972 | B975: 2018 | C975: 9 | D975: 29 | E975: [] | F975: 0 | G975: 0
A976: 973 | B976: 2018 | C976: 9 | D976: 30 | E976: [] | F976: 0 | G976: 0
A977: 974 | B977: 2018 | C977: 10 | D977: 1 | E977: [] | F977: 0 | G977: 0
A978: 975 | B978: 2018 | C978: 10 | D978: 2 | E978: [{110009,1,500000},{110045,1,100},{110148,1,1},{110127,1,30}] | F978: 0 | G978: 0
A979: 976 | B979: 2018 | C979: 10 | D979: 3 | E979: [] | F979: 0 | G979: 0
A980: 977 | B980: 2018 | C980: 10 | D980: 4 | E980: [] | F980: 0 | G980: 0
A981: 978 | B981: 2018 | C981: 10 | D981: 5 | E981: [{110009,1,500000},{110045,1,150},{110148,1,1},{110127,1,60}] | F981: 0 | G981: 0
A982: 979 | B982: 2018 | C982: 10 | D982: 6 | E982: [] | F982: 0 | G982: 0
A983: 980 | B983: 2018 | C983: 10 | D983: 7 | E983: [] | F983: 0 | G983: 0
A984: 981 | B984: 2018 | C984: 10 | D984: 8 | E984: [] | F984: 0 | G984: 0
A985: 982 | B985: 2018 | C985: 10 | D985: 9 | E985: [] | F985: 0 | G985: 0
A986: 983 | B986: 2018 | C986: 10 | D986: 10 | E986: [{110009,1,500000},{110045,1,200},{110148,1,1},{110127,1,90}] | F986: 0 | G986: 0
A987: 984 | B987: 2018 | C987: 10 | D987: 11 | E987: [] | F987: 0 | G987: 0
A988: 985 | B988: 2018 | C988: 10 | D988: 12 | E988: [] | F988: 0 | G988: 0
A989: 986 | B989: 2018 | C989: 10 | D989: 13 | E989: [] | F989: 0 | G989: 0
A990: 987 | B990: 2018 | C990: 10 | D990: 14 | E990: [] | F990: 0 | G990: 0
A991: 988 | B991: 2018 | C991: 10 | D991: 15 | E991: [] | F991: 0 | G991: 0
A992: 989 | B992: 2018 | C992: 10 | D992: 16 | E992: [] | F992: 0 | G992: 0
A993: 990 | B993: 2018 | C993: 10 | D993: 17 | E993: [{110009,1,500000},{110045,1,250},{110148,1,2},{110127,1,120}] | F993: 0 | G993: 0
A994: 991 | B994: 2018 | C994: 10 | D994: 18 | E994: [] | F994: 0 | G994: 0
A995: 992 | B995: 2018 | C995: 10 | D995: 19 | E995: [] | F995: 0 | G995: 0
A996: 993 | B996: 2018 | C996: 10 | D996: 20 | E996: [] | F996: 0 | G996: 0
A997: 994 | B997: 2018 | C997: 10 | D997: 21 | E997: [] | F997: 0 | G997: 0
A998: 995 | B998: 2018 | C998: 10 | D998: 22 | E998: [] | F998: 0 | G998: 0
A999: 996 | B999: 2018 | C999: 10 | D999: 23 | E999: [] | F999: 0 | G999: 0
A1000: 997 | B1000: 2018 | C1000: 10 | D1000: 24 | E1000: [] | F1000: 0 | G1000: 0
A1001: 998 | B1001: 2018 | C1001: 10 | D1001: 25 | E1001: [] | F1001: 0 | G1001: 0
A1002: 999 | B1002: 2018 | C1002: 10 | D1002: 26 | E1002: [{110009,1,500000},{110045,1,300},{110149,1,1},{110140,1,10}] | F1002: 0 | G1002: 0
A1003: 1000 | B1003: 2018 | C1003: 10 | D1003: 27 | E1003: [] | F1003: 0 | G1003: 0
A1004: 1001 | B1004: 2018 | C1004: 10 | D1004: 28 | E1004: [] | F1004: 0 | G1004: 0
A1005: 1002 | B1005: 2018 | C1005: 10 | D1005: 29 | E1005: [] | F1005: 0 | G1005: 0
A1006: 1003 | B1006: 2018 | C1006: 10 | D1006: 30 | E1006: [] | F1006: 0 | G1006: 0
A1007: 1004 | B1007: 2018 | C1007: 10 | D1007: 31 | E1007: [] | F1007: 0 | G1007: 0
A1008: 1005 | B1008: 2018 | C1008: 11 | D1008: 1 | E1008: [] | F1008: 0 | G1008: 0
A1009: 1006 | B1009: 2018 | C1009: 11 | D1009: 2 | E1009: [{110009,1,500000},{110045,1,100},{110148,1,1},{110127,1,30}] | F1009: 0 | G1009: 0
A1010: 1007 | B1010: 2018 | C1010: 11 | D1010: 3 | E1010: [] | F1010: 0 | G1010: 0
A1011: 1008 | B1011: 2018 | C1011: 11 | D1011: 4 | E1011: [] | F1011: 0 | G1011: 0
A1012: 1009 | B1012: 2018 | C1012: 11 | D1012: 5 | E1012: [{110009,1,500000},{110045,1,150},{110148,1,1},{110127,1,60}] | F1012: 0 | G1012: 0
A1013: 1010 | B1013: 2018 | C1013: 11 | D1013: 6 | E1013: [] | F1013: 0 | G1013: 0
A1014: 1011 | B1014: 2018 | C1014: 11 | D1014: 7 | E1014: [] | F1014: 0 | G1014: 0
A1015: 1012 | B1015: 2018 | C1015: 11 | D1015: 8 | E1015: [] | F1015: 0 | G1015: 0
A1016: 1013 | B1016: 2018 | C1016: 11 | D1016: 9 | E1016: [] | F1016: 0 | G1016: 0
A1017: 1014 | B1017: 2018 | C1017: 11 | D1017: 10 | E1017: [{110009,1,500000},{110045,1,200},{110148,1,1},{110127,1,90}] | F1017: 0 | G1017: 0
A1018: 1015 | B1018: 2018 | C1018: 11 | D1018: 11 | E1018: [] | F1018: 0 | G1018: 0
A1019: 1016 | B1019: 2018 | C1019: 11 | D1019: 12 | E1019: [] | F1019: 0 | G1019: 0
A1020: 1017 | B1020: 2018 | C1020: 11 | D1020: 13 | E1020: [] | F1020: 0 | G1020: 0
A1021: 1018 | B1021: 2018 | C1021: 11 | D1021: 14 | E1021: [] | F1021: 0 | G1021: 0
A1022: 1019 | B1022: 2018 | C1022: 11 | D1022: 15 | E1022: [] | F1022: 0 | G1022: 0
A1023: 1020 | B1023: 2018 | C1023: 11 | D1023: 16 | E1023: [] | F1023: 0 | G1023: 0
A1024: 1021 | B1024: 2018 | C1024: 11 | D1024: 17 | E1024: [{110009,1,500000},{110045,1,250},{110148,1,2},{110127,1,120}] | F1024: 0 | G1024: 0
A1025: 1022 | B1025: 2018 | C1025: 11 | D1025: 18 | E1025: [] | F1025: 0 | G1025: 0
A1026: 1023 | B1026: 2018 | C1026: 11 | D1026: 19 | E1026: [] | F1026: 0 | G1026: 0
A1027: 1024 | B1027: 2018 | C1027: 11 | D1027: 20 | E1027: [] | F1027: 0 | G1027: 0
A1028: 1025 | B1028: 2018 | C1028: 11 | D1028: 21 | E1028: [] | F1028: 0 | G1028: 0
A1029: 1026 | B1029: 2018 | C1029: 11 | D1029: 22 | E1029: [] | F1029: 0 | G1029: 0
A1030: 1027 | B1030: 2018 | C1030: 11 | D1030: 23 | E1030: [] | F1030: 0 | G1030: 0
A1031: 1028 | B1031: 2018 | C1031: 11 | D1031: 24 | E1031: [] | F1031: 0 | G1031: 0
A1032: 1029 | B1032: 2018 | C1032: 11 | D1032: 25 | E1032: [] | F1032: 0 | G1032: 0
A1033: 1030 | B1033: 2018 | C1033: 11 | D1033: 26 | E1033: [{110009,1,500000},{110045,1,300},{110149,1,1},{110140,1,10}] | F1033: 0 | G1033: 0
A1034: 1031 | B1034: 2018 | C1034: 11 | D1034: 27 | E1034: [] | F1034: 0 | G1034: 0
A1035: 1032 | B1035: 2018 | C1035: 11 | D1035: 28 | E1035: [] | F1035: 0 | G1035: 0
A1036: 1033 | B1036: 2018 | C1036: 11 | D1036: 29 | E1036: [] | F1036: 0 | G1036: 0
A1037: 1034 | B1037: 2018 | C1037: 11 | D1037: 30 | E1037: [] | F1037: 0 | G1037: 0
A1038: 1035 | B1038: 2018 | C1038: 12 | D1038: 1 | E1038: [] | F1038: 0 | G1038: 0
A1039: 1036 | B1039: 2018 | C1039: 12 | D1039: 2 | E1039: [{110009,1,500000},{110045,1,100},{110148,1,1},{110127,1,30}] | F1039: 0 | G1039: 0
A1040: 1037 | B1040: 2018 | C1040: 12 | D1040: 3 | E1040: [] | F1040: 0 | G1040: 0
A1041: 1038 | B1041: 2018 | C1041: 12 | D1041: 4 | E1041: [] | F1041: 0 | G1041: 0
A1042: 1039 | B1042: 2018 | C1042: 12 | D1042: 5 | E1042: [{110009,1,500000},{110045,1,150},{110148,1,1},{110127,1,60}] | F1042: 0 | G1042: 0
A1043: 1040 | B1043: 2018 | C1043: 12 | D1043: 6 | E1043: [] | F1043: 0 | G1043: 0
A1044: 1041 | B1044: 2018 | C1044: 12 | D1044: 7 | E1044: [] | F1044: 0 | G1044: 0
A1045: 1042 | B1045: 2018 | C1045: 12 | D1045: 8 | E1045: [] | F1045: 0 | G1045: 0
A1046: 1043 | B1046: 2018 | C1046: 12 | D1046: 9 | E1046: [] | F1046: 0 | G1046: 0
A1047: 1044 | B1047: 2018 | C1047: 12 | D1047: 10 | E1047: [{110009,1,500000},{110045,1,200},{110148,1,1},{110127,1,90}] | F1047: 0 | G1047: 0
A1048: 1045 | B1048: 2018 | C1048: 12 | D1048: 11 | E1048: [] | F1048: 0 | G1048: 0
A1049: 1046 | B1049: 2018 | C1049: 12 | D1049: 12 | E1049: [] | F1049: 0 | G1049: 0
A1050: 1047 | B1050: 2018 | C1050: 12 | D1050: 13 | E1050: [] | F1050: 0 | G1050: 0
A1051: 1048 | B1051: 2018 | C1051: 12 | D1051: 14 | E1051: [] | F1051: 0 | G1051: 0
A1052: 1049 | B1052: 2018 | C1052: 12 | D1052: 15 | E1052: [] | F1052: 0 | G1052: 0
A1053: 1050 | B1053: 2018 | C1053: 12 | D1053: 16 | E1053: [] | F1053: 0 | G1053: 0
A1054: 1051 | B1054: 2018 | C1054: 12 | D1054: 17 | E1054: [{110009,1,500000},{110045,1,250},{110148,1,2},{110127,1,120}] | F1054: 0 | G1054: 0
A1055: 1052 | B1055: 2018 | C1055: 12 | D1055: 18 | E1055: [] | F1055: 0 | G1055: 0
A1056: 1053 | B1056: 2018 | C1056: 12 | D1056: 19 | E1056: [] | F1056: 0 | G1056: 0
A1057: 1054 | B1057: 2018 | C1057: 12 | D1057: 20 | E1057: [] | F1057: 0 | G1057: 0
A1058: 1055 | B1058: 2018 | C1058: 12 | D1058: 21 | E1058: [] | F1058: 0 | G1058: 0
A1059: 1056 | B1059: 2018 | C1059: 12 | D1059: 22 | E1059: [] | F1059: 0 | G1059: 0
A1060: 1057 | B1060: 2018 | C1060: 12 | D1060: 23 | E1060: [] | F1060: 0 | G1060: 0
A1061: 1058 | B1061: 2018 | C1061: 12 | D1061: 24 | E1061: [] | F1061: 0 | G1061: 0
A1062: 1059 | B1062: 2018 | C1062: 12 | D1062: 25 | E1062: [] | F1062: 0 | G1062: 0
A1063: 1060 | B1063: 2018 | C1063: 12 | D1063: 26 | E1063: [{110009,1,500000},{110045,1,300},{110149,1,1},{110140,1,10}] | F1063: 0 | G1063: 0
A1064: 1061 | B1064: 2018 | C1064: 12 | D1064: 27 | E1064: [] | F1064: 0 | G1064: 0
A1065: 1062 | B1065: 2018 | C1065: 12 | D1065: 28 | E1065: [] | F1065: 0 | G1065: 0
A1066: 1063 | B1066: 2018 | C1066: 12 | D1066: 29 | E1066: [] | F1066: 0 | G1066: 0
A1067: 1064 | B1067: 2018 | C1067: 12 | D1067: 30 | E1067: [] | F1067: 0 | G1067: 0
A1068: 1065 | B1068: 2018 | C1068: 12 | D1068: 31 | E1068: [] | F1068: 0 | G1068: 0

Sheet: 工作表2
A1: name | B1: id
A2: name | B2: id
A3: 道具名称 | B3: 道具id
A4: 八荒 | B4: 200000
A5: 轻盔 | B5: 200001
A6: 珊瑚戒指 | B6: 200002
A7: 魔力手镯 | B7: 200003
A8: 恶魔项链 | B8: 200006
A9: 炼狱 | B9: 200010
A10: 绿色项链 | B10: 200011
A11: 战神盔甲 | B11: 200012
A12: 力量戒指 | B12: 200013
A13: 战士头盔 | B13: 200015
A14: 阎罗手镯 | B14: 200016
A15: 战士腰带 | B15: 200017
A16: 战士鞋子 | B16: 200019
A17: 裁决 | B17: 200020
A18: 圣战战甲 | B18: 200021
A19: 圣战项链 | B19: 200022
A20: 圣战戒指 | B20: 200023
A21: 圣战头盔 | B21: 200025
A22: 圣战手镯 | B22: 200026
A23: 圣战腰带 | B23: 200027
A24: 圣战鞋子 | B24: 200029
A25: 开天 | B25: 200030
A26: 雷霆战甲 | B26: 200031
A27: 雷霆项链 | B27: 200032
A28: 雷霆戒指 | B28: 200033
A29: 雷霆头盔 | B29: 200035
A30: 雷霆护腕 | B30: 200036
A31: 雷霆腰带 | B31: 200037
A32: 雷霆战靴 | B32: 200039
A33: 开天（沙） | B33: 200040
A34: 雷霆战甲（沙） | B34: 200041
A35: 雷霆项链（沙） | B35: 200042
A36: 雷霆戒指（沙） | B36: 200043
A37: 雷霆头盔（沙） | B37: 200045
A38: 雷霆护腕（沙） | B38: 200046
A39: 雷霆腰带（沙） | B39: 200047
A40: 雷霆战靴（沙） | B40: 200049
A41: 魅影 | B41: 200050
A42: 武尊衣服 | B42: 200051
A43: 武尊头盔 | B43: 200052
A44: 武尊项链 | B44: 200053
A45: 武尊手镯 | B45: 200055
A46: 武尊戒指 | B46: 200056
A47: 武尊腰带 | B47: 200057
A48: 武尊鞋子 | B48: 200059
A49: 混沌 | B49: 200060
A50: 白虎衣服 | B50: 200061
A51: 白虎头盔 | B51: 200062
A52: 白虎项链 | B52: 200063
A53: 白虎手镯 | B53: 200065
A54: 白虎戒指 | B54: 200066
A55: 白虎腰带 | B55: 200067
A56: 白虎鞋子 | B56: 200069
A57: 圣武战刃 | B57: 200070
A58: 圣武衣服 | B58: 200071
A59: 圣武头盔 | B59: 200072
A60: 圣武项链 | B60: 200073
A61: 圣武手镯 | B61: 200075
A62: 圣武戒指 | B62: 200076
A63: 圣武腰带 | B63: 200077
A64: 圣武鞋子 | B64: 200079
A65: 神威战刃 | B65: 200080
A66: 神威战衣服 | B66: 200081
A67: 神威战头盔 | B67: 200082
A68: 神威战项链 | B68: 200083
A69: 神威战手镯 | B69: 200085
A70: 神威战戒指 | B70: 200086
A71: 神威战腰带 | B71: 200087
A72: 神威战鞋子 | B72: 200089
A73: 海魂 | B73: 201000
A74: 轻盔 | B74: 201001
A75: 金戒指 | B75: 201002
A76: 魔法手镯 | B76: 201003
A77: 放大镜 | B77: 201006
A78: 魔杖 | B78: 201010
A79: 恶魔铃铛 | B79: 201011
A80: 恶魔长袍 | B80: 201012
A81: 紫碧螺 | B81: 201013
A82: 法师头盔 | B82: 201015
A83: 龙之手镯 | B83: 201016
A84: 法师腰带 | B84: 201017
A85: 法师鞋子 | B85: 201019
A86: 骨玉 | B86: 201020
A87: 法神披风 | B87: 201021
A88: 法神项链 | B88: 201022
A89: 法神戒指 | B89: 201023
A90: 法神头盔 | B90: 201025
A91: 法神手镯 | B91: 201026
A92: 法神腰带 | B92: 201027
A93: 法神鞋子 | B93: 201029
A94: 震天 | B94: 201030
A95: 烈焰法袍 | B95: 201031
A96: 烈焰魔链 | B96: 201032
A97: 烈焰魔指 | B97: 201033
A98: 烈焰头盔 | B98: 201035
A99: 烈焰护腕 | B99: 201036
A100: 烈焰腰带 | B100: 201037
A101: 烈焰魔靴 | B101: 201039
A102: 震天（沙） | B102: 201040
A103: 烈焰法袍（沙） | B103: 201041
A104: 烈焰魔链（沙） | B104: 201042
A105: 烈焰魔指（沙） | B105: 201043
A106: 烈焰头盔（沙） | B106: 201045
A107: 烈焰护腕（沙） | B107: 201046
A108: 烈焰腰带（沙） | B108: 201047
A109: 烈焰魔靴（沙） | B109: 201049
A110: 震天 | B110: 201050
A111: 震天衣服 | B111: 201051
A112: 震天头盔 | B112: 201052
A113: 震天项链 | B113: 201053
A114: 震天手镯 | B114: 201055
A115: 震天戒指 | B115: 201056
A116: 震天腰带 | B116: 201057
A117: 震天鞋子 | B117: 201059
A118: 狂龙 | B118: 201060
A119: 朱雀衣服 | B119: 201061
A120: 朱雀头盔 | B120: 201062
A121: 朱雀项链 | B121: 201063
A122: 朱雀手镯 | B122: 201065
A123: 朱雀戒指 | B123: 201066
A124: 朱雀腰带 | B124: 201067
A125: 朱雀鞋子 | B125: 201069
A126: 轮回 | B126: 201070
A127: 圣魔衣服 | B127: 201071
A128: 圣魔头盔 | B128: 201072
A129: 圣魔项链 | B129: 201073
A130: 圣魔手镯 | B130: 201075
A131: 圣魔戒指 | B131: 201076
A132: 圣魔腰带 | B132: 201077
A133: 圣魔鞋子 | B133: 201079
A134: 神威法杖 | B134: 201080
A135: 神威法衣服 | B135: 201081
A136: 神威法头盔 | B136: 201082
A137: 神威法项链 | B137: 201083
A138: 神威法手镯 | B138: 201085
A139: 神威法戒指 | B139: 201086
A140: 神威法腰带 | B140: 201087
A141: 神威法鞋子 | B141: 201089
A142: 半月 | B142: 202000
A143: 轻盔 | B143: 202001
A144: 铂金戒指 | B144: 202002
A145: 三眼手镯 | B145: 202003
A146: 凤凰明珠 | B146: 202006
A147: 银蛇 | B147: 202010
A148: 天珠道链 | B148: 202011
A149: 灵魂道袍 | B149: 202012
A150: 泰坦戒指 | B150: 202013
A151: 道士头盔 | B151: 202015
A152: 幽灵手镯 | B152: 202016
A153: 道士腰带 | B153: 202017
A154: 道士鞋子 | B154: 202019
A155: 龙纹 | B155: 202020
A156: 天尊道袍 | B156: 202021
A157: 天尊项链 | B157: 202022
A158: 天尊戒指 | B158: 202023
A159: 天尊头盔 | B159: 202025
A160: 天尊手镯 | B160: 202026
A161: 天尊腰带 | B161: 202027
A162: 天尊鞋子 | B162: 202029
A163: 玄天 | B163: 202030
A164: 光芒道袍 | B164: 202031
A165: 光芒道链 | B165: 202032
A166: 光芒道戒 | B166: 202033
A167: 光芒头盔 | B167: 202035
A168: 光芒护腕 | B168: 202036
A169: 光芒腰带 | B169: 202037
A170: 光芒道靴 | B170: 202039
A171: 玄天（沙） | B171: 202040
A172: 光芒道袍（沙） | B172: 202041
A173: 光芒道链（沙） | B173: 202042
A174: 光芒道戒（沙） | B174: 202043
A175: 光芒头盔（沙） | B175: 202045
A176: 光芒护腕（沙） | B176: 202046
A177: 光芒腰带（沙） | B177: 202047
A178: 光芒道靴（沙） | B178: 202049
A179: 玄天 | B179: 202050
A180: 玄天衣服 | B180: 202051
A181: 玄天头盔 | B181: 202052
A182: 玄天项链 | B182: 202053
A183: 玄天手镯 | B183: 202055
A184: 玄天戒指 | B184: 202056
A185: 玄天腰带 | B185: 202057
A186: 玄天鞋子 | B186: 202059
A187: 天蛇 | B187: 202060
A188: 青龙衣服 | B188: 202061
A189: 青龙头盔 | B189: 202062
A190: 青龙项链 | B190: 202063
A191: 青龙手镯 | B191: 202065
A192: 青龙戒指 | B192: 202066
A193: 青龙腰带 | B193: 202067
A194: 青龙鞋子 | B194: 202069
A195: 太虚 | B195: 202070
A196: 圣魂衣服 | B196: 202071
A197: 圣魂头盔 | B197: 202072
A198: 圣魂项链 | B198: 202073
A199: 圣魂手镯 | B199: 202075
A200: 圣魂戒指 | B200: 202076
A201: 圣魂腰带 | B201: 202077
A202: 圣魂鞋子 | B202: 202079
A203: 神威道剑 | B203: 202080
A204: 神威道衣服 | B204: 202081
A205: 神威道头盔 | B205: 202082
A206: 神威道项链 | B206: 202083
A207: 神威道手镯 | B207: 202085
A208: 神威道戒指 | B208: 202086
A209: 神威道腰带 | B209: 202087
A210: 神威道鞋子 | B210: 202089
A211: 1级翅膀 | B211: 303000
A212: 2级翅膀 | B212: 303001
A213: 3级翅膀 | B213: 303002
A214: 4级翅膀 | B214: 303003
A215: 5级翅膀 | B215: 303004
A216: 6级翅膀 | B216: 303005
A217: 7级翅膀 | B217: 303006
A218: 8级翅膀 | B218: 303007
A219: 9级翅膀 | B219: 303008
A220: 10级翅膀 | B220: 303009
A221: 1级宠物 | B221: 304000
A222: 2级宠物 | B222: 304001
A223: 3级宠物 | B223: 304002
A224: 4级宠物 | B224: 304003
A225: 5级宠物 | B225: 304004
A226: 6级宠物 | B226: 304005
A227: 7级宠物 | B227: 304006
A228: 8级宠物 | B228: 304007
A229: 9级宠物 | B229: 304008
A230: 10级宠物 | B230: 304009
A231: 麻痹戒指 | B231: 305000
A232: 护身戒指 | B232: 305001
A233: 复活戒指 | B233: 305002
A234: 怒斩 | B234: 305003
A235: 龙牙 | B235: 305004
A236: 逍遥扇 | B236: 305005
A237: 1阶青铜勋章 | B237: 306000
A238: 2阶青铜勋章 | B238: 306001
A239: 3阶青铜勋章 | B239: 306002
A240: 4阶青铜勋章 | B240: 306003
A241: 5阶青铜勋章 | B241: 306004
A242: 6阶青铜勋章 | B242: 306005
A243: 7阶青铜勋章 | B243: 306006
A244: 8阶青铜勋章 | B244: 306007
A245: 9阶青铜勋章 | B245: 306008
A246: 1阶生铁勋章 | B246: 306009
A247: 2阶生铁勋章 | B247: 306010
A248: 3阶生铁勋章 | B248: 306011
A249: 4阶生铁勋章 | B249: 306012
A250: 5阶生铁勋章 | B250: 306013
A251: 6阶生铁勋章 | B251: 306014
A252: 7阶生铁勋章 | B252: 306015
A253: 8阶生铁勋章 | B253: 306016
A254: 9阶生铁勋章 | B254: 306017
A255: 1阶黑铁勋章 | B255: 306018
A256: 2阶黑铁勋章 | B256: 306019
A257: 3阶黑铁勋章 | B257: 306020
A258: 4阶黑铁勋章 | B258: 306021
A259: 5阶黑铁勋章 | B259: 306022
A260: 6阶黑铁勋章 | B260: 306023
A261: 7阶黑铁勋章 | B261: 306024
A262: 8阶黑铁勋章 | B262: 306025
A263: 9阶黑铁勋章 | B263: 306026
A264: 1阶白银勋章 | B264: 306027
A265: 2阶白银勋章 | B265: 306028
A266: 3阶白银勋章 | B266: 306029
A267: 4阶白银勋章 | B267: 306030
A268: 5阶白银勋章 | B268: 306031
A269: 6阶白银勋章 | B269: 306032
A270: 7阶白银勋章 | B270: 306033
A271: 8阶白银勋章 | B271: 306034
A272: 9阶白银勋章 | B272: 306035
A273: 1阶黄金勋章 | B273: 306036
A274: 2阶黄金勋章 | B274: 306037
A275: 3阶黄金勋章 | B275: 306038
A276: 4阶黄金勋章 | B276: 306039
A277: 5阶黄金勋章 | B277: 306040
A278: 6阶黄金勋章 | B278: 306041
A279: 7阶黄金勋章 | B279: 306042
A280: 8阶黄金勋章 | B280: 306043
A281: 9阶黄金勋章 | B281: 306044
A282: 1阶白金勋章 | B282: 306045
A283: 2阶白金勋章 | B283: 306046
A284: 3阶白金勋章 | B284: 306047
A285: 4阶白金勋章 | B285: 306048
A286: 5阶白金勋章 | B286: 306049
A287: 6阶白金勋章 | B287: 306050
A288: 7阶白金勋章 | B288: 306051
A289: 8阶白金勋章 | B289: 306052
A290: 9阶白金勋章 | B290: 306053
A291: 1阶紫金勋章 | B291: 306054
A292: 2阶紫金勋章 | B292: 306055
A293: 3阶紫金勋章 | B293: 306056
A294: 4阶紫金勋章 | B294: 306057
A295: 5阶紫金勋章 | B295: 306058
A296: 6阶紫金勋章 | B296: 306059
A297: 7阶紫金勋章 | B297: 306060
A298: 8阶紫金勋章 | B298: 306061
A299: 9阶紫金勋章 | B299: 306062
A300: 1阶赤金勋章 | B300: 306063
A301: 2阶赤金勋章 | B301: 306064
A302: 3阶赤金勋章 | B302: 306065
A303: 4阶赤金勋章 | B303: 306066
A304: 5阶赤金勋章 | B304: 306067
A305: 6阶赤金勋章 | B305: 306068
A306: 7阶赤金勋章 | B306: 306069
A307: 8阶赤金勋章 | B307: 306070
A308: 9阶赤金勋章 | B308: 306071
A309: 1阶钻石勋章 | B309: 306072
A310: 2阶钻石勋章 | B310: 306073
A311: 3阶钻石勋章 | B311: 306074
A312: 4阶钻石勋章 | B312: 306075
A313: 5阶钻石勋章 | B313: 306076
A314: 6阶钻石勋章 | B314: 306077
A315: 7阶钻石勋章 | B315: 306078
A316: 8阶钻石勋章 | B316: 306079
A317: 9阶钻石勋章 | B317: 306080
A318: 1阶青铜勋章 | B318: 306200
A319: 2阶青铜勋章 | B319: 306201
A320: 3阶青铜勋章 | B320: 306202
A321: 4阶青铜勋章 | B321: 306203
A322: 5阶青铜勋章 | B322: 306204
A323: 6阶青铜勋章 | B323: 306205
A324: 7阶青铜勋章 | B324: 306206
A325: 8阶青铜勋章 | B325: 306207
A326: 9阶青铜勋章 | B326: 306208
A327: 1阶生铁勋章 | B327: 306209
A328: 2阶生铁勋章 | B328: 306210
A329: 3阶生铁勋章 | B329: 306211
A330: 4阶生铁勋章 | B330: 306212
A331: 5阶生铁勋章 | B331: 306213
A332: 6阶生铁勋章 | B332: 306214
A333: 7阶生铁勋章 | B333: 306215
A334: 8阶生铁勋章 | B334: 306216
A335: 9阶生铁勋章 | B335: 306217
A336: 1阶黑铁勋章 | B336: 306218
A337: 2阶黑铁勋章 | B337: 306219
A338: 3阶黑铁勋章 | B338: 306220
A339: 4阶黑铁勋章 | B339: 306221
A340: 5阶黑铁勋章 | B340: 306222
A341: 6阶黑铁勋章 | B341: 306223
A342: 7阶黑铁勋章 | B342: 306224
A343: 8阶黑铁勋章 | B343: 306225
A344: 9阶黑铁勋章 | B344: 306226
A345: 1阶白银勋章 | B345: 306227
A346: 2阶白银勋章 | B346: 306228
A347: 3阶白银勋章 | B347: 306229
A348: 4阶白银勋章 | B348: 306230
A349: 5阶白银勋章 | B349: 306231
A350: 6阶白银勋章 | B350: 306232
A351: 7阶白银勋章 | B351: 306233
A352: 8阶白银勋章 | B352: 306234
A353: 9阶白银勋章 | B353: 306235
A354: 1阶黄金勋章 | B354: 306236
A355: 2阶黄金勋章 | B355: 306237
A356: 3阶黄金勋章 | B356: 306238
A357: 4阶黄金勋章 | B357: 306239
A358: 5阶黄金勋章 | B358: 306240
A359: 6阶黄金勋章 | B359: 306241
A360: 7阶黄金勋章 | B360: 306242
A361: 8阶黄金勋章 | B361: 306243
A362: 9阶黄金勋章 | B362: 306244
A363: 1阶白金勋章 | B363: 306245
A364: 2阶白金勋章 | B364: 306246
A365: 3阶白金勋章 | B365: 306247
A366: 4阶白金勋章 | B366: 306248
A367: 5阶白金勋章 | B367: 306249
A368: 6阶白金勋章 | B368: 306250
A369: 7阶白金勋章 | B369: 306251
A370: 8阶白金勋章 | B370: 306252
A371: 9阶白金勋章 | B371: 306253
A372: 1阶紫金勋章 | B372: 306254
A373: 2阶紫金勋章 | B373: 306255
A374: 3阶紫金勋章 | B374: 306256
A375: 4阶紫金勋章 | B375: 306257
A376: 5阶紫金勋章 | B376: 306258
A377: 6阶紫金勋章 | B377: 306259
A378: 7阶紫金勋章 | B378: 306260
A379: 8阶紫金勋章 | B379: 306261
A380: 9阶紫金勋章 | B380: 306262
A381: 1阶赤金勋章 | B381: 306263
A382: 2阶赤金勋章 | B382: 306264
A383: 3阶赤金勋章 | B383: 306265
A384: 4阶赤金勋章 | B384: 306266
A385: 5阶赤金勋章 | B385: 306267
A386: 6阶赤金勋章 | B386: 306268
A387: 7阶赤金勋章 | B387: 306269
A388: 8阶赤金勋章 | B388: 306270
A389: 9阶赤金勋章 | B389: 306271
A390: 1阶钻石勋章 | B390: 306272
A391: 2阶钻石勋章 | B391: 306273
A392: 3阶钻石勋章 | B392: 306274
A393: 4阶钻石勋章 | B393: 306275
A394: 5阶钻石勋章 | B394: 306276
A395: 6阶钻石勋章 | B395: 306277
A396: 7阶钻石勋章 | B396: 306278
A397: 8阶钻石勋章 | B397: 306279
A398: 9阶钻石勋章 | B398: 306280
A399: 1阶青铜勋章 | B399: 306400
A400: 2阶青铜勋章 | B400: 306401
A401: 3阶青铜勋章 | B401: 306402
A402: 4阶青铜勋章 | B402: 306403
A403: 5阶青铜勋章 | B403: 306404
A404: 6阶青铜勋章 | B404: 306405
A405: 7阶青铜勋章 | B405: 306406
A406: 8阶青铜勋章 | B406: 306407
A407: 9阶青铜勋章 | B407: 306408
A408: 1阶生铁勋章 | B408: 306409
A409: 2阶生铁勋章 | B409: 306410
A410: 3阶生铁勋章 | B410: 306411
A411: 4阶生铁勋章 | B411: 306412
A412: 5阶生铁勋章 | B412: 306413
A413: 6阶生铁勋章 | B413: 306414
A414: 7阶生铁勋章 | B414: 306415
A415: 8阶生铁勋章 | B415: 306416
A416: 9阶生铁勋章 | B416: 306417
A417: 1阶黑铁勋章 | B417: 306418
A418: 2阶黑铁勋章 | B418: 306419
A419: 3阶黑铁勋章 | B419: 306420
A420: 4阶黑铁勋章 | B420: 306421
A421: 5阶黑铁勋章 | B421: 306422
A422: 6阶黑铁勋章 | B422: 306423
A423: 7阶黑铁勋章 | B423: 306424
A424: 8阶黑铁勋章 | B424: 306425
A425: 9阶黑铁勋章 | B425: 306426
A426: 1阶白银勋章 | B426: 306427
A427: 2阶白银勋章 | B427: 306428
A428: 3阶白银勋章 | B428: 306429
A429: 4阶白银勋章 | B429: 306430
A430: 5阶白银勋章 | B430: 306431
A431: 6阶白银勋章 | B431: 306432
A432: 7阶白银勋章 | B432: 306433
A433: 8阶白银勋章 | B433: 306434
A434: 9阶白银勋章 | B434: 306435
A435: 1阶黄金勋章 | B435: 306436
A436: 2阶黄金勋章 | B436: 306437
A437: 3阶黄金勋章 | B437: 306438
A438: 4阶黄金勋章 | B438: 306439
A439: 5阶黄金勋章 | B439: 306440
A440: 6阶黄金勋章 | B440: 306441
A441: 7阶黄金勋章 | B441: 306442
A442: 8阶黄金勋章 | B442: 306443
A443: 9阶黄金勋章 | B443: 306444
A444: 1阶白金勋章 | B444: 306445
A445: 2阶白金勋章 | B445: 306446
A446: 3阶白金勋章 | B446: 306447
A447: 4阶白金勋章 | B447: 306448
A448: 5阶白金勋章 | B448: 306449
A449: 6阶白金勋章 | B449: 306450
A450: 7阶白金勋章 | B450: 306451
A451: 8阶白金勋章 | B451: 306452
A452: 9阶白金勋章 | B452: 306453
A453: 1阶紫金勋章 | B453: 306454
A454: 2阶紫金勋章 | B454: 306455
A455: 3阶紫金勋章 | B455: 306456
A456: 4阶紫金勋章 | B456: 306457
A457: 5阶紫金勋章 | B457: 306458
A458: 6阶紫金勋章 | B458: 306459
A459: 7阶紫金勋章 | B459: 306460
A460: 8阶紫金勋章 | B460: 306461
A461: 9阶紫金勋章 | B461: 306462
A462: 1阶赤金勋章 | B462: 306463
A463: 2阶赤金勋章 | B463: 306464
A464: 3阶赤金勋章 | B464: 306465
A465: 4阶赤金勋章 | B465: 306466
A466: 5阶赤金勋章 | B466: 306467
A467: 6阶赤金勋章 | B467: 306468
A468: 7阶赤金勋章 | B468: 306469
A469: 8阶赤金勋章 | B469: 306470
A470: 9阶赤金勋章 | B470: 306471
A471: 1阶钻石勋章 | B471: 306472
A472: 2阶钻石勋章 | B472: 306473
A473: 3阶钻石勋章 | B473: 306474
A474: 4阶钻石勋章 | B474: 306475
A475: 5阶钻石勋章 | B475: 306476
A476: 6阶钻石勋章 | B476: 306477
A477: 7阶钻石勋章 | B477: 306478
A478: 8阶钻石勋章 | B478: 306479
A479: 9阶钻石勋章 | B479: 306480
A480: 战羽翼（1阶1星） | B480: 307000
A481: 战羽翼（1阶2星） | B481: 307001
A482: 战羽翼（1阶3星） | B482: 307002
A483: 战羽翼（1阶4星） | B483: 307003
A484: 战羽翼（1阶5星） | B484: 307004
A485: 战羽翼（1阶6星） | B485: 307005
A486: 战羽翼（1阶7星） | B486: 307006
A487: 战羽翼（1阶8星） | B487: 307007
A488: 战羽翼（1阶9星） | B488: 307008
A489: 战羽翼（1阶10星） | B489: 307009
A490: 战羽翼（2阶1星） | B490: 307010
A491: 战羽翼（2阶2星） | B491: 307011
A492: 战羽翼（2阶3星） | B492: 307012
A493: 战羽翼（2阶4星） | B493: 307013
A494: 战羽翼（2阶5星） | B494: 307014
A495: 战羽翼（2阶6星） | B495: 307015
A496: 战羽翼（2阶7星） | B496: 307016
A497: 战羽翼（2阶8星） | B497: 307017
A498: 战羽翼（2阶9星） | B498: 307018
A499: 战羽翼（2阶10星） | B499: 307019
A500: 战羽翼（3阶1星） | B500: 307020
A501: 战羽翼（3阶2星） | B501: 307021
A502: 战羽翼（3阶3星） | B502: 307022
A503: 战羽翼（3阶4星） | B503: 307023
A504: 战羽翼（3阶5星） | B504: 307024
A505: 战羽翼（3阶6星） | B505: 307025
A506: 战羽翼（3阶7星） | B506: 307026
A507: 战羽翼（3阶8星） | B507: 307027
A508: 战羽翼（3阶9星） | B508: 307028
A509: 战羽翼（3阶10星） | B509: 307029
A510: 战羽翼（4阶1星） | B510: 307030
A511: 战羽翼（4阶2星） | B511: 307031
A512: 战羽翼（4阶3星） | B512: 307032
A513: 战羽翼（4阶4星） | B513: 307033
A514: 战羽翼（4阶5星） | B514: 307034
A515: 战羽翼（4阶6星） | B515: 307035
A516: 战羽翼（4阶7星） | B516: 307036
A517: 战羽翼（4阶8星） | B517: 307037
A518: 战羽翼（4阶9星） | B518: 307038
A519: 战羽翼（4阶10星） | B519: 307039
A520: 战羽翼（5阶1星） | B520: 307040
A521: 战羽翼（5阶2星） | B521: 307041
A522: 战羽翼（5阶3星） | B522: 307042
A523: 战羽翼（5阶4星） | B523: 307043
A524: 战羽翼（5阶5星） | B524: 307044
A525: 战羽翼（5阶6星） | B525: 307045
A526: 战羽翼（5阶7星） | B526: 307046
A527: 战羽翼（5阶8星） | B527: 307047
A528: 战羽翼（5阶9星） | B528: 307048
A529: 战羽翼（5阶10星） | B529: 307049
A530: 法羽翼（1阶1星） | B530: 307200
A531: 法羽翼（1阶2星） | B531: 307201
A532: 法羽翼（1阶3星） | B532: 307202
A533: 法羽翼（1阶4星） | B533: 307203
A534: 法羽翼（1阶5星） | B534: 307204
A535: 法羽翼（1阶6星） | B535: 307205
A536: 法羽翼（1阶7星） | B536: 307206
A537: 法羽翼（1阶8星） | B537: 307207
A538: 法羽翼（1阶9星） | B538: 307208
A539: 法羽翼（1阶10星） | B539: 307209
A540: 法羽翼（2阶1星） | B540: 307210
A541: 法羽翼（2阶2星） | B541: 307211
A542: 法羽翼（2阶3星） | B542: 307212
A543: 法羽翼（2阶4星） | B543: 307213
A544: 法羽翼（2阶5星） | B544: 307214
A545: 法羽翼（2阶6星） | B545: 307215
A546: 法羽翼（2阶7星） | B546: 307216
A547: 法羽翼（2阶8星） | B547: 307217
A548: 法羽翼（2阶9星） | B548: 307218
A549: 法羽翼（2阶10星） | B549: 307219
A550: 法羽翼（3阶1星） | B550: 307220
A551: 法羽翼（3阶2星） | B551: 307221
A552: 法羽翼（3阶3星） | B552: 307222
A553: 法羽翼（3阶4星） | B553: 307223
A554: 法羽翼（3阶5星） | B554: 307224
A555: 法羽翼（3阶6星） | B555: 307225
A556: 法羽翼（3阶7星） | B556: 307226
A557: 法羽翼（3阶8星） | B557: 307227
A558: 法羽翼（3阶9星） | B558: 307228
A559: 法羽翼（3阶10星） | B559: 307229
A560: 法羽翼（4阶1星） | B560: 307230
A561: 法羽翼（4阶2星） | B561: 307231
A562: 法羽翼（4阶3星） | B562: 307232
A563: 法羽翼（4阶4星） | B563: 307233
A564: 法羽翼（4阶5星） | B564: 307234
A565: 法羽翼（4阶6星） | B565: 307235
A566: 法羽翼（4阶7星） | B566: 307236
A567: 法羽翼（4阶8星） | B567: 307237
A568: 法羽翼（4阶9星） | B568: 307238
A569: 法羽翼（4阶10星） | B569: 307239
A570: 法羽翼（5阶1星） | B570: 307240
A571: 法羽翼（5阶2星） | B571: 307241
A572: 法羽翼（5阶3星） | B572: 307242
A573: 法羽翼（5阶4星） | B573: 307243
A574: 法羽翼（5阶5星） | B574: 307244
A575: 法羽翼（5阶6星） | B575: 307245
A576: 法羽翼（5阶7星） | B576: 307246
A577: 法羽翼（5阶8星） | B577: 307247
A578: 法羽翼（5阶9星） | B578: 307248
A579: 法羽翼（5阶10星） | B579: 307249
A580: 道羽翼（1阶1星） | B580: 307400
A581: 道羽翼（1阶2星） | B581: 307401
A582: 道羽翼（1阶3星） | B582: 307402
A583: 道羽翼（1阶4星） | B583: 307403
A584: 道羽翼（1阶5星） | B584: 307404
A585: 道羽翼（1阶6星） | B585: 307405
A586: 道羽翼（1阶7星） | B586: 307406
A587: 道羽翼（1阶8星） | B587: 307407
A588: 道羽翼（1阶9星） | B588: 307408
A589: 道羽翼（1阶10星） | B589: 307409
A590: 道羽翼（2阶1星） | B590: 307410
A591: 道羽翼（2阶2星） | B591: 307411
A592: 道羽翼（2阶3星） | B592: 307412
A593: 道羽翼（2阶4星） | B593: 307413
A594: 道羽翼（2阶5星） | B594: 307414
A595: 道羽翼（2阶6星） | B595: 307415
A596: 道羽翼（2阶7星） | B596: 307416
A597: 道羽翼（2阶8星） | B597: 307417
A598: 道羽翼（2阶9星） | B598: 307418
A599: 道羽翼（2阶10星） | B599: 307419
A600: 道羽翼（3阶1星） | B600: 307420
A601: 道羽翼（3阶2星） | B601: 307421
A602: 道羽翼（3阶3星） | B602: 307422
A603: 道羽翼（3阶4星） | B603: 307423
A604: 道羽翼（3阶5星） | B604: 307424
A605: 道羽翼（3阶6星） | B605: 307425
A606: 道羽翼（3阶7星） | B606: 307426
A607: 道羽翼（3阶8星） | B607: 307427
A608: 道羽翼（3阶9星） | B608: 307428
A609: 道羽翼（3阶10星） | B609: 307429
A610: 道羽翼（4阶1星） | B610: 307430
A611: 道羽翼（4阶2星） | B611: 307431
A612: 道羽翼（4阶3星） | B612: 307432
A613: 道羽翼（4阶4星） | B613: 307433
A614: 道羽翼（4阶5星） | B614: 307434
A615: 道羽翼（4阶6星） | B615: 307435
A616: 道羽翼（4阶7星） | B616: 307436
A617: 道羽翼（4阶8星） | B617: 307437
A618: 道羽翼（4阶9星） | B618: 307438
A619: 道羽翼（4阶10星） | B619: 307439
A620: 道羽翼（5阶1星） | B620: 307440
A621: 道羽翼（5阶2星） | B621: 307441
A622: 道羽翼（5阶3星） | B622: 307442
A623: 道羽翼（5阶4星） | B623: 307443
A624: 道羽翼（5阶5星） | B624: 307444
A625: 道羽翼（5阶6星） | B625: 307445
A626: 道羽翼（5阶7星） | B626: 307446
A627: 道羽翼（5阶8星） | B627: 307447
A628: 道羽翼（5阶9星） | B628: 307448
A629: 道羽翼（5阶10星） | B629: 307449
A630: 攻击宝石lv1 | B630: 100001
A631: 攻击宝石lv2 | B631: 100002
A632: 攻击宝石lv3 | B632: 100003
A633: 攻击宝石lv4 | B633: 100004
A634: 攻击宝石lv5 | B634: 100005
A635: 攻击宝石lv6 | B635: 100006
A636: 攻击宝石lv7 | B636: 100007
A637: 攻击宝石lv8 | B637: 100008
A638: 攻击宝石lv9 | B638: 100009
A639: 攻击宝石lv10 | B639: 100010
A640: 物防宝石lv1 | B640: 100101
A641: 物防宝石lv2 | B641: 100102
A642: 物防宝石lv3 | B642: 100103
A643: 物防宝石lv4 | B643: 100104
A644: 物防宝石lv5 | B644: 100105
A645: 物防宝石lv6 | B645: 100106
A646: 物防宝石lv7 | B646: 100107
A647: 物防宝石lv8 | B647: 100108
A648: 物防宝石lv9 | B648: 100109
A649: 物防宝石lv10 | B649: 100110
A650: 魔防宝石lv1 | B650: 100201
A651: 魔防宝石lv2 | B651: 100202
A652: 魔防宝石lv3 | B652: 100203
A653: 魔防宝石lv4 | B653: 100204
A654: 魔防宝石lv5 | B654: 100205
A655: 魔防宝石lv6 | B655: 100206
A656: 魔防宝石lv7 | B656: 100207
A657: 魔防宝石lv8 | B657: 100208
A658: 魔防宝石lv9 | B658: 100209
A659: 魔防宝石lv10 | B659: 100210
A660: 生命宝石lv1 | B660: 100301
A661: 生命宝石lv2 | B661: 100302
A662: 生命宝石lv3 | B662: 100303
A663: 生命宝石lv4 | B663: 100304
A664: 生命宝石lv5 | B664: 100305
A665: 生命宝石lv6 | B665: 100306
A666: 生命宝石lv7 | B666: 100307
A667: 生命宝石lv8 | B667: 100308
A668: 生命宝石lv9 | B668: 100309
A669: 生命宝石lv10 | B669: 100310
A670: 小经验丹 | B670: 110000
A671: 大经验丹 | B671: 110001
A672: 强化石（废） | B672: 110002
A673: 洗炼石 | B673: 110003
A674: 金创药(小量) | B674: 110004
A675: 魔法药（小量） | B675: 110005
A676: 太阳水 | B676: 110006
A677: 超级太阳水 | B677: 110007
A678: 元宝 | B678: 110008
A679: 金币 | B679: 110009
A680: 普通武装碎片 | B680: 110010
A681: 普通防具碎片 | B681: 110011
A682: 普通首饰碎片 | B682: 110012
A683: 精炼武装碎片 | B683: 110013
A684: 精炼防具碎片 | B684: 110014
A685: 精炼首饰碎片 | B685: 110015
A686: 极致武装碎片 | B686: 110016
A687: 极致防具碎片 | B687: 110017
A688: 极致首饰碎片 | B688: 110018
A689: 攻杀剑法 | B689: 110019
A690: 刺杀剑法 | B690: 110020
A691: 半月剑法 | B691: 110021
A692: 野蛮冲撞 | B692: 110022
A693: 烈火剑法 | B693: 110023
A694: 狂风斩 | B694: 110024
A695: 逐日剑法 | B695: 110025
A696: 灵魂火符 | B696: 110026
A697: 施毒术 | B697: 110027
A698: 治疗术 | B698: 110028
A699: 隐身术 | B699: 110029
A700: 战甲术 | B700: 110030
A701: 召唤神兽 | B701: 110031
A702: 嗜血术 | B702: 110032
A703: 雷电术 | B703: 110033
A704: 火墙 | B704: 110034
A705: 魔法盾 | B705: 110035
A706: 地狱雷光 | B706: 110036
A707: 疾光电影 | B707: 110037
A708: 冰咆哮 | B708: 110038
A709: 抗拒火环 | B709: 110039
A710: 流星火雨 | B710: 110040
A711: 2级技能秘籍 | B711: 110041
A712: 3级技能秘籍 | B712: 110042
A713: 4级技能秘籍 | B713: 110043
A714: 5级技能秘籍 | B714: 110044
A715: 礼券 | B715: 110045
A716: 20级装备礼包 | B716: 110046
A717: 金币礼包 | B717: 110047
A718: 沃玛号角 | B718: 110048
A719: 祝福油 | B719: 110049
A720: 金条 | B720: 110050
A721: 元宝 | B721: 110051
A722: 礼券 | B722: 110052
A723: BOSS挑战卷轴 | B723: 110053
A724: 复活丹 | B724: 110054
A725: 洗罪丹 | B725: 110055
A726: 天山雪莲 | B726: 110056
A727: 经验 | B727: 110057
A728: 副本卷轴 | B728: 110058
A729: 声望 | B729: 110059
A730: 50级极品武器 | B730: 110060
A731: 20级经验丹 | B731: 110061
A732: 30级经验丹 | B732: 110062
A733: 40级经验丹 | B733: 110063
A734: 50级经验丹 | B734: 110064
A735: 功勋 | B735: 110065
A736: 召唤骷髅 | B736: 110066
A737: 诱惑之光 | B737: 110067
A738: 100熟练丹 | B738: 110068
A739: 1000熟练丹 | B739: 110069
A740: 3000熟练丹 | B740: 110070
A741: 劣质强化石 | B741: 110071
A742: 普通强化石 | B742: 110072
A743: 优质强化石 | B743: 110073
A744: 精致强化石 | B744: 110074
A745: 完美强化石 | B745: 110075
A746: 超级金创药 | B746: 110076
A747: 超级魔法药 | B747: 110077
A748: 小飞鞋 | B748: 110078
A749: 黑铁矿+1 | B749: 110079
A750: 黑铁矿+2 | B750: 110080
A751: 黑铁矿+3 | B751: 110081
A752: 黑铁矿+4 | B752: 110082
A753: 黑铁矿+5 | B753: 110083
A754: 黑铁矿+6 | B754: 110084
A755: 黑铁矿+7 | B755: 110085
A756: 黑铁矿+8 | B756: 110086
A757: 黑铁矿+9 | B757: 110087
A758: 黑铁矿+10 | B758: 110088
A759: 紫水晶+1 | B759: 110089
A760: 紫水晶+2 | B760: 110090
A761: 紫水晶+3 | B761: 110091
A762: 紫水晶+4 | B762: 110092
A763: 紫水晶+5 | B763: 110093
A764: 紫水晶+6 | B764: 110094
A765: 紫水晶+7 | B765: 110095
A766: 紫水晶+8 | B766: 110096
A767: 紫水晶+9 | B767: 110097
A768: 紫水晶+10 | B768: 110098
A769: 玄冰铁+1 | B769: 110099
A770: 玄冰铁+2 | B770: 110100
A771: 玄冰铁+3 | B771: 110101
A772: 玄冰铁+4 | B772: 110102
A773: 玄冰铁+5 | B773: 110103
A774: 玄冰铁+6 | B774: 110104
A775: 玄冰铁+7 | B775: 110105
A776: 玄冰铁+8 | B776: 110106
A777: 玄冰铁+9 | B777: 110107
A778: 玄冰铁+10 | B778: 110108
A779: 金刚石 | B779: 110109
A780: 累积登录1天礼包 | B780: 110110
A781: 累积登录2天礼包 | B781: 110111
A782: 累积登录3天礼包 | B782: 110112
A783: 累积登录4天礼包 | B783: 110113
A784: 累积登录5天礼包 | B784: 110114
A785: 累积登录6天礼包 | B785: 110115
A786: 累积登录7天礼包 | B786: 110116
A787: 累计在线1分钟 | B787: 110117
A788: 累计在线5分钟 | B788: 110118
A789: 累计在线15分钟 | B789: 110119
A790: 累计在线30分钟 | B790: 110120
A791: 累计在线60分钟 | B791: 110121
A792: 累计在线120分钟 | B792: 110122
A793: 首充礼包 | B793: 110123
A794: 战神武器箱(战) | B794: 110124
A795: 法神武器箱(法) | B795: 110125
A796: 天尊武器箱(道) | B796: 110126
A797: 羽毛 | B797: 110127