Sheet: 锻造消耗表
A1: key | B1: use_smelt
A2: key | B2: use_smelt
A3: {神器星级,等级,品质} | B3: 需要消耗的熔炼值 | D3: 是否神器 | E3: 等级 | F3: 品质 | G3: 熔炼值
A4: ="{"&RC[3]&","&RC[4]&","&RC[5]&"}" -> {0,10,1} | B4: 50 | D4: 0 | E4: 10 | F4: 1 | G4: 20
A5: ="{"&RC[3]&","&RC[4]&","&RC[5]&"}" -> {0,20,1} | B5: 50 | D5: 0 | E5: 20 | F5: 1 | G5: 20
A6: ="{"&RC[3]&","&RC[4]&","&RC[5]&"}" -> {0,30,1} | B6: 50 | D6: 0 | E6: 30 | F6: 1 | G6: 20
A7: ="{"&RC[3]&","&RC[4]&","&RC[5]&"}" -> {0,40,1} | B7: 50 | D7: 0 | E7: 40 | F7: 1 | G7: 20
A8: ="{"&RC[3]&","&RC[4]&","&RC[5]&"}" -> {0,50,1} | B8: 50 | D8: 0 | E8: 50 | F8: 1 | G8: 20
A9: ="{"&RC[3]&","&RC[4]&","&RC[5]&"}" -> {0,60,1} | B9: 50 | D9: 0 | E9: 60 | F9: 1 | G9: 20
A10: ="{"&RC[3]&","&RC[4]&","&RC[5]&"}" -> {0,70,1} | B10: 50 | D10: 0 | E10: 70 | F10: 1 | G10: 20
A11: ="{"&RC[3]&","&RC[4]&","&RC[5]&"}" -> {0,80,1} | B11: 50 | D11: 0 | E11: 80 | F11: 1 | G11: 20
A12: ="{"&RC[3]&","&RC[4]&","&RC[5]&"}" -> {0,90,1} | B12: 50 | D12: 0 | E12: 90 | F12: 1 | G12: 20
A13: ="{"&RC[3]&","&RC[4]&","&RC[5]&"}" -> {0,100,1} | B13: 50 | D13: 0 | E13: 100 | F13: 1 | G13: 20
A14: ="{"&RC[3]&","&RC[4]&","&RC[5]&"}" -> {0,10,2} | B14: 100 | D14: 0 | E14: 10 | F14: =R[-10]C+1 -> 2 | G14: 100
A15: ="{"&RC[3]&","&RC[4]&","&RC[5]&"}" -> {0,20,2} | B15: 100 | D15: 0 | E15: 20 | F15: =R[-10]C+1 -> 2 | G15: 100
A16: ="{"&RC[3]&","&RC[4]&","&RC[5]&"}" -> {0,30,2} | B16: 100 | D16: 0 | E16: 30 | F16: =R[-10]C+1 -> 2 | G16: 100
A17: ="{"&RC[3]&","&RC[4]&","&RC[5]&"}" -> {0,40,2} | B17: 100 | D17: 0 | E17: 40 | F17: =R[-10]C+1 -> 2 | G17: 100
A18: ="{"&RC[3]&","&RC[4]&","&RC[5]&"}" -> {0,50,2} | B18: 100 | D18: 0 | E18: 50 | F18: =R[-10]C+1 -> 2 | G18: 100
A19: ="{"&RC[3]&","&RC[4]&","&RC[5]&"}" -> {0,60,2} | B19: 100 | D19: 0 | E19: 60 | F19: =R[-10]C+1 -> 2 | G19: 100
A20: ="{"&RC[3]&","&RC[4]&","&RC[5]&"}" -> {0,70,2} | B20: 100 | D20: 0 | E20: 70 | F20: =R[-10]C+1 -> 2 | G20: 100
A21: ="{"&RC[3]&","&RC[4]&","&RC[5]&"}" -> {0,80,2} | B21: 100 | D21: 0 | E21: 80 | F21: =R[-10]C+1 -> 2 | G21: 100
A22: ="{"&RC[3]&","&RC[4]&","&RC[5]&"}" -> {0,90,2} | B22: 100 | D22: 0 | E22: 90 | F22: =R[-10]C+1 -> 2 | G22: 100
A23: ="{"&RC[3]&","&RC[4]&","&RC[5]&"}" -> {0,100,2} | B23: 100 | D23: 0 | E23: 100 | F23: =R[-10]C+1 -> 2 | G23: 100
A24: ="{"&RC[3]&","&RC[4]&","&RC[5]&"}" -> {0,10,3} | B24: 200 | D24: 0 | E24: 10 | F24: =R[-10]C+1 -> 3 | G24: 200
A25: ="{"&RC[3]&","&RC[4]&","&RC[5]&"}" -> {0,20,3} | B25: 200 | D25: 0 | E25: 20 | F25: =R[-10]C+1 -> 3 | G25: 200
A26: ="{"&RC[3]&","&RC[4]&","&RC[5]&"}" -> {0,30,3} | B26: 200 | D26: 0 | E26: 30 | F26: =R[-10]C+1 -> 3 | G26: 200
A27: ="{"&RC[3]&","&RC[4]&","&RC[5]&"}" -> {0,40,3} | B27: 200 | D27: 0 | E27: 40 | F27: =R[-10]C+1 -> 3 | G27: 200
A28: ="{"&RC[3]&","&RC[4]&","&RC[5]&"}" -> {0,50,3} | B28: 200 | D28: 0 | E28: 50 | F28: =R[-10]C+1 -> 3 | G28: 200
A29: ="{"&RC[3]&","&RC[4]&","&RC[5]&"}" -> {0,60,3} | B29: 200 | D29: 0 | E29: 60 | F29: =R[-10]C+1 -> 3 | G29: 200
A30: ="{"&RC[3]&","&RC[4]&","&RC[5]&"}" -> {0,70,3} | B30: 200 | D30: 0 | E30: 70 | F30: =R[-10]C+1 -> 3 | G30: 200
A31: ="{"&RC[3]&","&RC[4]&","&RC[5]&"}" -> {0,80,3} | B31: 200 | D31: 0 | E31: 80 | F31: =R[-10]C+1 -> 3 | G31: 200
A32: ="{"&RC[3]&","&RC[4]&","&RC[5]&"}" -> {0,90,3} | B32: 200 | D32: 0 | E32: 90 | F32: =R[-10]C+1 -> 3 | G32: 200
A33: ="{"&RC[3]&","&RC[4]&","&RC[5]&"}" -> {0,100,3} | B33: 200 | D33: 0 | E33: 100 | F33: =R[-10]C+1 -> 3 | G33: 200
A34: ="{"&RC[3]&","&RC[4]&","&RC[5]&"}" -> {0,10,4} | B34: 2000 | D34: 0 | E34: 10 | F34: =R[-10]C+1 -> 4 | G34: 2000
A35: ="{"&RC[3]&","&RC[4]&","&RC[5]&"}" -> {0,20,4} | B35: 2000 | D35: 0 | E35: 20 | F35: =R[-10]C+1 -> 4 | G35: 2000
A36: ="{"&RC[3]&","&RC[4]&","&RC[5]&"}" -> {0,30,4} | B36: 2000 | D36: 0 | E36: 30 | F36: =R[-10]C+1 -> 4 | G36: 2000
A37: ="{"&RC[3]&","&RC[4]&","&RC[5]&"}" -> {0,40,4} | B37: 2000 | D37: 0 | E37: 40 | F37: =R[-10]C+1 -> 4 | G37: 2000
A38: ="{"&RC[3]&","&RC[4]&","&RC[5]&"}" -> {0,50,4} | B38: 2000 | D38: 0 | E38: 50 | F38: =R[-10]C+1 -> 4 | G38: 2000
A39: ="{"&RC[3]&","&RC[4]&","&RC[5]&"}" -> {0,60,4} | B39: 2000 | D39: 0 | E39: 60 | F39: =R[-10]C+1 -> 4 | G39: 2000
A40: ="{"&RC[3]&","&RC[4]&","&RC[5]&"}" -> {0,70,4} | B40: 2000 | D40: 0 | E40: 70 | F40: =R[-10]C+1 -> 4 | G40: 2000
A41: ="{"&RC[3]&","&RC[4]&","&RC[5]&"}" -> {0,80,4} | B41: 2000 | D41: 0 | E41: 80 | F41: =R[-10]C+1 -> 4 | G41: 2000
A42: ="{"&RC[3]&","&RC[4]&","&RC[5]&"}" -> {0,90,4} | B42: 2000 | D42: 0 | E42: 90 | F42: =R[-10]C+1 -> 4 | G42: 2000
A43: ="{"&RC[3]&","&RC[4]&","&RC[5]&"}" -> {0,100,4} | B43: 2000 | D43: 0 | E43: 100 | F43: =R[-10]C+1 -> 4 | G43: 2000
A44: ="{"&RC[3]&","&RC[4]&","&RC[5]&"}" -> {0,10,5} | B44: 5000 | D44: 0 | E44: 10 | F44: =R[-10]C+1 -> 5 | G44: 10000
A45: ="{"&RC[3]&","&RC[4]&","&RC[5]&"}" -> {0,20,5} | B45: 5000 | D45: 0 | E45: 20 | F45: =R[-10]C+1 -> 5 | G45: 10000
A46: ="{"&RC[3]&","&RC[4]&","&RC[5]&"}" -> {0,30,5} | B46: 5000 | D46: 0 | E46: 30 | F46: =R[-10]C+1 -> 5 | G46: 10000
A47: ="{"&RC[3]&","&RC[4]&","&RC[5]&"}" -> {0,40,5} | B47: 5000 | D47: 0 | E47: 40 | F47: =R[-10]C+1 -> 5 | G47: 10000
A48: ="{"&RC[3]&","&RC[4]&","&RC[5]&"}" -> {0,50,5} | B48: 5000 | D48: 0 | E48: 50 | F48: =R[-10]C+1 -> 5 | G48: 10000
A49: ="{"&RC[3]&","&RC[4]&","&RC[5]&"}" -> {0,60,5} | B49: 5000 | D49: 0 | E49: 60 | F49: =R[-10]C+1 -> 5 | G49: 10000
A50: ="{"&RC[3]&","&RC[4]&","&RC[5]&"}" -> {0,70,5} | B50: 5000 | D50: 0 | E50: 70 | F50: =R[-10]C+1 -> 5 | G50: 10000
A51: ="{"&RC[3]&","&RC[4]&","&RC[5]&"}" -> {0,80,5} | B51: 5000 | D51: 0 | E51: 80 | F51: =R[-10]C+1 -> 5 | G51: 10000
A52: ="{"&RC[3]&","&RC[4]&","&RC[5]&"}" -> {0,90,5} | B52: 5000 | D52: 0 | E52: 90 | F52: =R[-10]C+1 -> 5 | G52: 10000
A53: ="{"&RC[3]&","&RC[4]&","&RC[5]&"}" -> {0,100,5} | B53: 5000 | D53: 0 | E53: 100 | F53: =R[-10]C+1 -> 5 | G53: 10000
A54: ="{"&RC[3]&","&RC[4]&","&RC[5]&"}" -> {1,10,1} | B54: 1000 | D54: 1 | E54: 10 | F54: 1 | G54: 20
A55: ="{"&RC[3]&","&RC[4]&","&RC[5]&"}" -> {1,20,1} | B55: 1000 | D55: 1 | E55: 20 | F55: 1 | G55: 20
A56: ="{"&RC[3]&","&RC[4]&","&RC[5]&"}" -> {1,30,1} | B56: 1000 | D56: 1 | E56: 30 | F56: 1 | G56: 20
A57: ="{"&RC[3]&","&RC[4]&","&RC[5]&"}" -> {1,40,1} | B57: 1000 | D57: 1 | E57: 40 | F57: 1 | G57: 20
A58: ="{"&RC[3]&","&RC[4]&","&RC[5]&"}" -> {1,50,1} | B58: 1000 | D58: 1 | E58: 50 | F58: 1 | G58: 20
A59: ="{"&RC[3]&","&RC[4]&","&RC[5]&"}" -> {1,60,1} | B59: 1000 | D59: 1 | E59: 60 | F59: 1 | G59: 20
A60: ="{"&RC[3]&","&RC[4]&","&RC[5]&"}" -> {1,70,1} | B60: 1000 | D60: 1 | E60: 70 | F60: 1 | G60: 20
A61: ="{"&RC[3]&","&RC[4]&","&RC[5]&"}" -> {1,80,1} | B61: 1000 | D61: 1 | E61: 80 | F61: 1 | G61: 20
A62: ="{"&RC[3]&","&RC[4]&","&RC[5]&"}" -> {1,90,1} | B62: 1000 | D62: 1 | E62: 90 | F62: 1 | G62: 20
A63: ="{"&RC[3]&","&RC[4]&","&RC[5]&"}" -> {1,100,1} | B63: 1000 | D63: 1 | E63: 100 | F63: 1 | G63: 20
A64: ="{"&RC[3]&","&RC[4]&","&RC[5]&"}" -> {1,10,2} | B64: 2000 | D64: 1 | E64: 10 | F64: =R[-10]C+1 -> 2 | G64: 100
A65: ="{"&RC[3]&","&RC[4]&","&RC[5]&"}" -> {1,20,2} | B65: 2000 | D65: 1 | E65: 20 | F65: =R[-10]C+1 -> 2 | G65: 100
A66: ="{"&RC[3]&","&RC[4]&","&RC[5]&"}" -> {1,30,2} | B66: 2000 | D66: 1 | E66: 30 | F66: =R[-10]C+1 -> 2 | G66: 100
A67: ="{"&RC[3]&","&RC[4]&","&RC[5]&"}" -> {1,40,2} | B67: 2000 | D67: 1 | E67: 40 | F67: =R[-10]C+1 -> 2 | G67: 100
A68: ="{"&RC[3]&","&RC[4]&","&RC[5]&"}" -> {1,50,2} | B68: 2000 | D68: 1 | E68: 50 | F68: =R[-10]C+1 -> 2 | G68: 100
A69: ="{"&RC[3]&","&RC[4]&","&RC[5]&"}" -> {1,60,2} | B69: 2000 | D69: 1 | E69: 60 | F69: =R[-10]C+1 -> 2 | G69: 100
A70: ="{"&RC[3]&","&RC[4]&","&RC[5]&"}" -> {1,70,2} | B70: 2000 | D70: 1 | E70: 70 | F70: =R[-10]C+1 -> 2 | G70: 100
A71: ="{"&RC[3]&","&RC[4]&","&RC[5]&"}" -> {1,80,2} | B71: 2000 | D71: 1 | E71: 80 | F71: =R[-10]C+1 -> 2 | G71: 100
A72: ="{"&RC[3]&","&RC[4]&","&RC[5]&"}" -> {1,90,2} | B72: 2000 | D72: 1 | E72: 90 | F72: =R[-10]C+1 -> 2 | G72: 100
A73: ="{"&RC[3]&","&RC[4]&","&RC[5]&"}" -> {1,100,2} | B73: 2000 | D73: 1 | E73: 100 | F73: =R[-10]C+1 -> 2 | G73: 100
A74: ="{"&RC[3]&","&RC[4]&","&RC[5]&"}" -> {1,10,3} | B74: 3000 | D74: 1 | E74: 10 | F74: =R[-10]C+1 -> 3 | G74: 200
A75: ="{"&RC[3]&","&RC[4]&","&RC[5]&"}" -> {1,20,3} | B75: 3000 | D75: 1 | E75: 20 | F75: =R[-10]C+1 -> 3 | G75: 200
A76: ="{"&RC[3]&","&RC[4]&","&RC[5]&"}" -> {1,30,3} | B76: 3000 | D76: 1 | E76: 30 | F76: =R[-10]C+1 -> 3 | G76: 200
A77: ="{"&RC[3]&","&RC[4]&","&RC[5]&"}" -> {1,40,3} | B77: 3000 | D77: 1 | E77: 40 | F77: =R[-10]C+1 -> 3 | G77: 200
A78: ="{"&RC[3]&","&RC[4]&","&RC[5]&"}" -> {1,50,3} | B78: 3000 | D78: 1 | E78: 50 | F78: =R[-10]C+1 -> 3 | G78: 200
A79: ="{"&RC[3]&","&RC[4]&","&RC[5]&"}" -> {1,60,3} | B79: 3000 | D79: 1 | E79: 60 | F79: =R[-10]C+1 -> 3 | G79: 200
A80: ="{"&RC[3]&","&RC[4]&","&RC[5]&"}" -> {1,70,3} | B80: 3000 | D80: 1 | E80: 70 | F80: =R[-10]C+1 -> 3 | G80: 200
A81: ="{"&RC[3]&","&RC[4]&","&RC[5]&"}" -> {1,80,3} | B81: 3000 | D81: 1 | E81: 80 | F81: =R[-10]C+1 -> 3 | G81: 200
A82: ="{"&RC[3]&","&RC[4]&","&RC[5]&"}" -> {1,90,3} | B82: 3000 | D82: 1 | E82: 90 | F82: =R[-10]C+1 -> 3 | G82: 200
A83: ="{"&RC[3]&","&RC[4]&","&RC[5]&"}" -> {1,100,3} | B83: 3000 | D83: 1 | E83: 100 | F83: =R[-10]C+1 -> 3 | G83: 200
A84: ="{"&RC[3]&","&RC[4]&","&RC[5]&"}" -> {1,10,4} | B84: 5000 | D84: 1 | E84: 10 | F84: =R[-10]C+1 -> 4 | G84: 2000
A85: ="{"&RC[3]&","&RC[4]&","&RC[5]&"}" -> {1,20,4} | B85: 5000 | D85: 1 | E85: 20 | F85: =R[-10]C+1 -> 4 | G85: 2000
A86: ="{"&RC[3]&","&RC[4]&","&RC[5]&"}" -> {1,30,4} | B86: 5000 | D86: 1 | E86: 30 | F86: =R[-10]C+1 -> 4 | G86: 2000
A87: ="{"&RC[3]&","&RC[4]&","&RC[5]&"}" -> {1,40,4} | B87: 5000 | D87: 1 | E87: 40 | F87: =R[-10]C+1 -> 4 | G87: 2000
A88: ="{"&RC[3]&","&RC[4]&","&RC[5]&"}" -> {1,50,4} | B88: 5000 | D88: 1 | E88: 50 | F88: =R[-10]C+1 -> 4 | G88: 2000
A89: ="{"&RC[3]&","&RC[4]&","&RC[5]&"}" -> {1,60,4} | B89: 5000 | D89: 1 | E89: 60 | F89: =R[-10]C+1 -> 4 | G89: 2000
A90: ="{"&RC[3]&","&RC[4]&","&RC[5]&"}" -> {1,70,4} | B90: 5000 | D90: 1 | E90: 70 | F90: =R[-10]C+1 -> 4 | G90: 2000
A91: ="{"&RC[3]&","&RC[4]&","&RC[5]&"}" -> {1,80,4} | B91: 5000 | D91: 1 | E91: 80 | F91: =R[-10]C+1 -> 4 | G91: 2000
A92: ="{"&RC[3]&","&RC[4]&","&RC[5]&"}" -> {1,90,4} | B92: 5000 | D92: 1 | E92: 90 | F92: =R[-10]C+1 -> 4 | G92: 2000
A93: ="{"&RC[3]&","&RC[4]&","&RC[5]&"}" -> {1,100,4} | B93: 5000 | D93: 1 | E93: 100 | F93: =R[-10]C+1 -> 4 | G93: 2000
A94: ="{"&RC[3]&","&RC[4]&","&RC[5]&"}" -> {1,10,5} | B94: 10000 | D94: 1 | E94: 10 | F94: =R[-10]C+1 -> 5 | G94: 10000
A95: ="{"&RC[3]&","&RC[4]&","&RC[5]&"}" -> {1,20,5} | B95: 10000 | D95: 1 | E95: 20 | F95: =R[-10]C+1 -> 5 | G95: 10000
A96: ="{"&RC[3]&","&RC[4]&","&RC[5]&"}" -> {1,30,5} | B96: 10000 | D96: 1 | E96: 30 | F96: =R[-10]C+1 -> 5 | G96: 10000
A97: ="{"&RC[3]&","&RC[4]&","&RC[5]&"}" -> {1,40,5} | B97: 10000 | D97: 1 | E97: 40 | F97: =R[-10]C+1 -> 5 | G97: 10000
A98: ="{"&RC[3]&","&RC[4]&","&RC[5]&"}" -> {1,50,5} | B98: 10000 | D98: 1 | E98: 50 | F98: =R[-10]C+1 -> 5 | G98: 10000
A99: ="{"&RC[3]&","&RC[4]&","&RC[5]&"}" -> {1,60,5} | B99: 10000 | D99: 1 | E99: 60 | F99: =R[-10]C+1 -> 5 | G99: 10000
A100: ="{"&RC[3]&","&RC[4]&","&RC[5]&"}" -> {1,70,5} | B100: 10000 | D100: 1 | E100: 70 | F100: =R[-10]C+1 -> 5 | G100: 10000
A101: ="{"&RC[3]&","&RC[4]&","&RC[5]&"}" -> {1,80,5} | B101: 10000 | D101: 1 | E101: 80 | F101: =R[-10]C+1 -> 5 | G101: 10000
A102: ="{"&RC[3]&","&RC[4]&","&RC[5]&"}" -> {1,90,5} | B102: 10000 | D102: 1 | E102: 90 | F102: =R[-10]C+1 -> 5 | G102: 10000
A103: ="{"&RC[3]&","&RC[4]&","&RC[5]&"}" -> {1,100,5} | B103: 10000 | D103: 1 | E103: 100 | F103: =R[-10]C+1 -> 5 | G103: 10000