Sheet: 行会商店
A1: key | C1: goods_id | D1: need_contribution | E1: limit_lv | F1: limit_guild_lv | G1: limit_count
A2: key | C2: goods_id | D2: need_contribution | E2: limit_lv | F2: limit_guild_lv | G2: limit_count | H2: order
A3: 商品id | B3: 描述 | C3: 物品id | D3: 需要贡献值 | E3: 等级限制 | F3: 行会等级限制 | G3: 购买次数限制 | H3: 排序ID | J3: 元宝 | K3: 铜钱 | L3: 个人贡献 | N3: 物品 | O3: 元宝
A4: 101 | B4: 黑铁矿+1 | C4: 110079 | D4: 2 | E4: 45 | F4: 1 | G4: 0 | H4: 1 | J4: =RC[5]/RC[4]*RC[1] -> 2.5 | K4: 50000 | L4: 100 | N4: 1000000 | O4: 50 | Q4: 贡献/个
A5: 102 | B5: 洗炼石 | C5: 110003 | D5: 100 | E5: 45 | F5: 1 | G5: 20 | H5: 2 | J5: 10 | L5: 200 | N5: 黑铁矿+1 | O5: 0.1 | P5: =50/RC[-1] -> 500 | Q5: =1000/RC[-1] -> 2
A6: 103 | B6: 祝福油 | C6: 110049 | D6: 200 | E6: 45 | F6: 1 | G6: 20 | H6: 3 | J6: 50 | L6: 1000 | N6: 洗炼石 | O6: 5 | P6: =50/RC[-1] -> 10 | Q6: =1000/RC[-1] -> 100
A7: 104 | B7: 小飞鞋 | C7: 110078 | D7: 20 | E7: 45 | F7: 1 | G7: 0 | H7: 4 | N7: 祝福油 | O7: 10 | P7: =50/RC[-1] -> 5 | Q7: =1000/RC[-1] -> 200
A8: 105 | B8: 太阳水 | C8: 110006 | D8: 3 | E8: 45 | F8: 1 | G8: 0 | H8: 5 | N8: 小飞鞋 | O8: 1 | P8: =50/RC[-1] -> 50 | Q8: =1000/RC[-1] -> 20
A9: 106 | B9: 赤月碎片 | C9: 110010 | D9: 25 | E9: 50 | F9: 2 | G9: 0 | H9: 6 | N9: 太阳水 | O9: 3000 | P9: =1000000/RC[-1] -> 333.33333333333331 | Q9: =1000/RC[-1] -> 3
A10: 107 | B10: 黑铁矿+5 | C10: 110083 | D10: 60 | E10: 50 | F10: 2 | G10: 0 | H10: 7 | N10: 赤月碎片 | O10: 1.2 | P10: =50/RC[-1] -> 41.666666666666671 | Q10: =1000/RC[-1] -> 23.999999999999996
A11: 108 | B11: 龙之碎片 | C11: 110013 | D11: 1000 | E11: 55 | F11: 3 | G11: 0 | H11: 8 | N11: 黑铁矿+5 | O11: 3 | P11: =50/RC[-1] -> 16.666666666666668 | Q11: =1000/RC[-1] -> 59.999999999999993
A12: 109 | B12: 黑铁矿+8 | C12: 110086 | D12: 400 | E12: 55 | F12: 3 | G12: 0 | H12: 9 | N12: 龙之碎片 | O12: 50 | P12: =50/RC[-1] -> 1 | Q12: =1000/RC[-1] -> 1000
A13: 110 | B13: 玄冰铁+1 | C13: 110089 | D13: 60 | E13: 60 | F13: 4 | G13: 0 | H13: 10 | K13: =100000/3000 -> 33.333333333333336 | N13: 黑铁矿+8 | O13: 20 | P13: =50/RC[-1] -> 2.5 | Q13: =1000/RC[-1] -> 400
A14: 111 | B14: 至尊碎片 | C14: 110016 | D14: 2000 | E14: 70 | F14: 5 | G14: 0 | H14: 11 | K14: =100/R[-1]C -> 3 | N14: 玄冰铁+1 | O14: 10 | P14: =50/RC[-1] -> 5 | Q14: =1000/RC[-1] -> 200
A15: 112 | B15: 玄冰铁+3 | C15: 110091 | D15: 800 | E15: 70 | F15: 5 | G15: 0 | H15: 12 | N15: 至尊碎片 | O15: 100 | P15: =50/RC[-1] -> 0.5 | Q15: =1000/RC[-1] -> 2000
N16: 玄冰铁+3 | O16: 40 | P16: =50/RC[-1] -> 1.25 | Q16: =1000/RC[-1] -> 800