Sheet: 挂机场景
A1: scene_id | B1: name | C1: map_id | D1: chapter | E1: stage | F1: min_round_time | G1: min_monster_num | H1: max_monster_num | I1: monster_list | J1: per_exp | K1: per_coin | L1: per_drop | N1: first_prize | P1: boss_id | R1: limit_time | S1: star_3_time | T1: star_2_time | U1: star_1_time | V1: hook_factor | AA1: monster_drop | AB1: boss_drop
A2: id | B2: name | C2: mapId | D2: chapter | E2: stage | G2: minNum | H2: maxNum | I2: monster | M2: dec | N2: firstPrize | P2: bossId | Q2: headid | R2: limitTime | S2: star3time | T2: star2time | U2: star1time | V2: hook_factor | W2: music | X2: drop | Y2: exp | Z2: coin | AC2: power
A3: 场景id | B3: 地图名称 | C3: 地图id | D3: 章节 | E3: 关卡 | F3: 最短回合时间 | G3: 最少刷怪数 | H3: 最大刷怪数 | I3: 怪物列表 | J3: 每个怪物掉落经验 | K3: 每个怪物掉落金币 | L3: 每个怪物掉落物品数量 | M3: 地图描述 | N3: 通关奖励 | O3: 复活点 | P3: boss_id | Q3: 头像id | R3: boss限制时间 | S3: 3星时间 | T3: 2星时间 | U3: 1星时间 | V3: 挂机参数 | W3: 场景音乐 | X3: 掉落展示 | Y3: 经验／小时 | Z3: 铜钱／小时 | AA3: 普通掉落 | AB3: boss掉落 | AC3: 战斗力
A4: 10001 | B4: 第1关 | C4: 10101 | D4: 1 | E4: 1 | F4: 30 | G4: 10 | H4: 10 | I4: [{6001, 100}] | J4: 30 | K4: 0 | L4: 2 | N4: [{110009, 10000}, {110079,2}] | O4: {20,10} | P4: 6201 | Q4: 6042 | R4: 60 | S4: 20 | T4: 40 | U4: 60 | V4: 30 | W4: yewai | X4: [{200000,1},{201000,1},{202000,1}] | Y4: =RC[-15]*3600/RC[-19]*RC[-17] -> 36000 | Z4: =RC[-15]*3600/RC[-20]*RC[-18] -> 0 | AA4: =小怪掉落!R[27]C[-19] -> [{0,[{0,9995},{1,5}],[{200000,1,1,100},{200001,1,1,100},{200002,1,1,100},{200003,1,1,100},{200006,1,1,100},{201000,1,1,100},{201001,1,1,100},{201002,1,1,100},{201003,1,1,100},{201006,1,1,100},{202000,1,1,100},{202001,1,1,100},{202002,1,1,100},{202003,1,1,100},{202006,1,1,100},{110079,1,1,0},{110003,1,1,0},{110004,1,1,100},{110005,1,1,100},{110010,1,1,0},{110011,1,1,0},{110012,1,1,0},{110009,1,1,100}]}] | AB4: =BOSS掉落!R[33]C[-20] -> [{0,[{1,100}],[{200000,1,1,100},{200001,1,1,100},{200002,1,1,100},{200003,1,1,100},{200006,1,1,100},{201000,1,1,100},{201001,1,1,100},{201002,1,1,100},{201003,1,1,100},{201006,1,1,100},{202000,1,1,100},{202001,1,1,100},{202002,1,1,100},{202003,1,1,100},{202006,1,1,100}]},{0,[{3,100}],[{110079,1,2,3},{110003,1,2,1},{110004,1,1,3},{110005,1,1,3},{110010,1,1,0},{110011,1,1,0},{110012,1,1,0}]},{0,[{10,100}],[{110009,1,1000,1}]}] | AC4: 1592
A5: 10002 | B5: 第2关 | C5: 10101 | D5: 1 | E5: 2 | F5: 30 | G5: 10 | H5: 10 | I5: [{6002, 100}] | J5: 31 | K5: 0 | L5: 2 | N5: [{110009, 10000}, {110079,3}] | O5: {20,10} | P5: 6202 | Q5: 6042 | R5: 60 | S5: 20 | T5: 40 | U5: 60 | V5: 189 | W5: dongxue | X5: [{200000,1},{201000,1},{202000,1}] | Y5: =RC[-15]*3600/RC[-19]*RC[-17] -> 37200 | Z5: =RC[-15]*3600/RC[-20]*RC[-18] -> 0 | AA5: =R[-1]C -> [{0,[{0,9995},{1,5}],[{200000,1,1,100},{200001,1,1,100},{200002,1,1,100},{200003,1,1,100},{200006,1,1,100},{201000,1,1,100},{201001,1,1,100},{201002,1,1,100},{201003,1,1,100},{201006,1,1,100},{202000,1,1,100},{202001,1,1,100},{202002,1,1,100},{202003,1,1,100},{202006,1,1,100},{110079,1,1,0},{110003,1,1,0},{110004,1,1,100},{110005,1,1,100},{110010,1,1,0},{110011,1,1,0},{110012,1,1,0},{110009,1,1,100}]}] | AB5: =R[-1]C -> [{0,[{1,100}],[{200000,1,1,100},{200001,1,1,100},{200002,1,1,100},{200003,1,1,100},{200006,1,1,100},{201000,1,1,100},{201001,1,1,100},{201002,1,1,100},{201003,1,1,100},{201006,1,1,100},{202000,1,1,100},{202001,1,1,100},{202002,1,1,100},{202003,1,1,100},{202006,1,1,100}]},{0,[{3,100}],[{110079,1,2,3},{110003,1,2,1},{110004,1,1,3},{110005,1,1,3},{110010,1,1,0},{110011,1,1,0},{110012,1,1,0}]},{0,[{10,100}],[{110009,1,1000,1}]}] | AC5: 1631
A6: 10003 | B6: 第3关 | C6: 10101 | D6: 1 | E6: 3 | F6: 30 | G6: 10 | H6: 10 | I6: [{6003, 100}] | J6: 32 | K6: 0 | L6: 2 | N6: [{110009, 10000}, {110079,4}] | O6: {20,10} | P6: 6203 | Q6: 6042 | R6: 60 | S6: 20 | T6: 40 | U6: 60 | V6: 292 | W6: shabake | X6: [{200000,1},{201000,1},{202000,1}] | Y6: =RC[-15]*3600/RC[-19]*RC[-17] -> 38400 | Z6: =RC[-15]*3600/RC[-20]*RC[-18] -> 0 | AA6: =R[-1]C -> [{0,[{0,9995},{1,5}],[{200000,1,1,100},{200001,1,1,100},{200002,1,1,100},{200003,1,1,100},{200006,1,1,100},{201000,1,1,100},{201001,1,1,100},{201002,1,1,100},{201003,1,1,100},{201006,1,1,100},{202000,1,1,100},{202001,1,1,100},{202002,1,1,100},{202003,1,1,100},{202006,1,1,100},{110079,1,1,0},{110003,1,1,0},{110004,1,1,100},{110005,1,1,100},{110010,1,1,0},{110011,1,1,0},{110012,1,1,0},{110009,1,1,100}]}] | AB6: =R[-1]C -> [{0,[{1,100}],[{200000,1,1,100},{200001,1,1,100},{200002,1,1,100},{200003,1,1,100},{200006,1,1,100},{201000,1,1,100},{201001,1,1,100},{201002,1,1,100},{201003,1,1,100},{201006,1,1,100},{202000,1,1,100},{202001,1,1,100},{202002,1,1,100},{202003,1,1,100},{202006,1,1,100}]},{0,[{3,100}],[{110079,1,2,3},{110003,1,2,1},{110004,1,1,3},{110005,1,1,3},{110010,1,1,0},{110011,1,1,0},{110012,1,1,0}]},{0,[{10,100}],[{110009,1,1000,1}]}] | AC6: 1754
A7: 10004 | B7: 第4关 | C7: 10101 | D7: 1 | E7: 4 | F7: 30 | G7: 10 | H7: 10 | I7: [{6004, 100}] | J7: 45 | K7: 0 | L7: 2 | N7: [{110009, 10000}, {110079,5}] | O7: {20,10} | P7: 6204 | Q7: 6042 | R7: 60 | S7: 20 | T7: 40 | U7: 60 | V7: 301 | W7: jingjichang | X7: [{200000,1},{201000,1},{202000,1}] | Y7: =RC[-15]*3600/RC[-19]*RC[-17] -> 54000 | Z7: =RC[-15]*3600/RC[-20]*RC[-18] -> 0 | AA7: =R[-1]C -> [{0,[{0,9995},{1,5}],[{200000,1,1,100},{200001,1,1,100},{200002,1,1,100},{200003,1,1,100},{200006,1,1,100},{201000,1,1,100},{201001,1,1,100},{201002,1,1,100},{201003,1,1,100},{201006,1,1,100},{202000,1,1,100},{202001,1,1,100},{202002,1,1,100},{202003,1,1,100},{202006,1,1,100},{110079,1,1,0},{110003,1,1,0},{110004,1,1,100},{110005,1,1,100},{110010,1,1,0},{110011,1,1,0},{110012,1,1,0},{110009,1,1,100}]}] | AB7: =R[-1]C -> [{0,[{1,100}],[{200000,1,1,100},{200001,1,1,100},{200002,1,1,100},{200003,1,1,100},{200006,1,1,100},{201000,1,1,100},{201001,1,1,100},{201002,1,1,100},{201003,1,1,100},{201006,1,1,100},{202000,1,1,100},{202001,1,1,100},{202002,1,1,100},{202003,1,1,100},{202006,1,1,100}]},{0,[{3,100}],[{110079,1,2,3},{110003,1,2,1},{110004,1,1,3},{110005,1,1,3},{110010,1,1,0},{110011,1,1,0},{110012,1,1,0}]},{0,[{10,100}],[{110009,1,1000,1}]}] | AC7: 1795
A8: 10005 | B8: 第5关 | C8: 10101 | D8: 1 | E8: 5 | F8: 30 | G8: 10 | H8: 10 | I8: [{6005, 100}] | J8: 46 | K8: 0 | L8: 2 | N8: [{110009, 10000}, {110079,6}] | O8: {20,10} | P8: 6205 | Q8: 6042 | R8: 60 | S8: 20 | T8: 40 | U8: 60 | V8: 310 | W8: yewai | X8: [{200000,1},{201000,1},{202000,1}] | Y8: =RC[-15]*3600/RC[-19]*RC[-17] -> 55200 | Z8: =RC[-15]*3600/RC[-20]*RC[-18] -> 0 | AA8: =R[-1]C -> [{0,[{0,9995},{1,5}],[{200000,1,1,100},{200001,1,1,100},{200002,1,1,100},{200003,1,1,100},{200006,1,1,100},{201000,1,1,100},{201001,1,1,100},{201002,1,1,100},{201003,1,1,100},{201006,1,1,100},{202000,1,1,100},{202001,1,1,100},{202002,1,1,100},{202003,1,1,100},{202006,1,1,100},{110079,1,1,0},{110003,1,1,0},{110004,1,1,100},{110005,1,1,100},{110010,1,1,0},{110011,1,1,0},{110012,1,1,0},{110009,1,1,100}]}] | AB8: =R[-1]C -> [{0,[{1,100}],[{200000,1,1,100},{200001,1,1,100},{200002,1,1,100},{200003,1,1,100},{200006,1,1,100},{201000,1,1,100},{201001,1,1,100},{201002,1,1,100},{201003,1,1,100},{201006,1,1,100},{202000,1,1,100},{202001,1,1,100},{202002,1,1,100},{202003,1,1,100},{202006,1,1,100}]},{0,[{3,100}],[{110079,1,2,3},{110003,1,2,1},{110004,1,1,3},{110005,1,1,3},{110010,1,1,0},{110011,1,1,0},{110012,1,1,0}]},{0,[{10,100}],[{110009,1,1000,1}]}] | AC8: 1956
A9: 10006 | B9: 第6关 | C9: 10101 | D9: =R[-5]C+1 -> 2 | E9: =R[-5]C -> 1 | F9: 30 | G9: 10 | H9: 10 | I9: [{6006, 100}] | J9: 47 | K9: 0 | L9: 2 | N9: [{110009, 10000}, {110079,7}] | O9: {20,10} | P9: 6206 | Q9: 7007 | R9: 60 | S9: 20 | T9: 40 | U9: 60 | V9: 447 | W9: yewai | X9: [{200000,1},{201000,1},{202000,1}] | Y9: =RC[-15]*3600/RC[-19]*RC[-17] -> 56400 | Z9: =RC[-15]*3600/RC[-20]*RC[-18] -> 0 | AA9: =小怪掉落!R[32]C[-10] -> [{0,[{0,9995},{1,5}],[{200000,1,1,60},{200001,1,1,60},{200002,1,1,60},{200003,1,1,60},{200006,1,1,60},{200010,1,1,0},{200011,1,1,0},{200012,1,1,0},{201000,1,1,60},{201001,1,1,60},{201002,1,1,60},{201003,1,1,60},{201006,1,1,60},{201010,1,1,0},{201011,1,1,0},{201012,1,1,0},{202000,1,1,60},{202001,1,1,60},{202002,1,1,60},{202003,1,1,60},{202006,1,1,60},{202010,1,1,0},{202011,1,1,0},{202012,1,1,0},{110079,1,1,0},{110003,1,1,0},{110004,1,1,100},{110005,1,1,100},{110010,1,1,0},{110011,1,1,0},{110012,1,1,0},{110009,1,2,100}]}] | AB9: =BOSS掉落!R[37]C[-11] -> [{0,[{1,100}],[{200000,1,1,60},{200001,1,1,60},{200002,1,1,60},{200003,1,1,60},{200006,1,1,60},{200010,1,1,5},{200011,1,1,5},{200012,1,1,5},{201000,1,1,60},{201001,1,1,60},{201002,1,1,60},{201003,1,1,60},{201006,1,1,60},{201010,1,1,5},{201011,1,1,5},{201012,1,1,5},{202000,1,1,60},{202001,1,1,60},{202002,1,1,60},{202003,1,1,60},{202006,1,1,60},{202010,1,1,5},{202011,1,1,5},{202012,1,1,5}]},{0,[{3,100}],[{110079,1,2,3},{110003,1,2,1},{110004,1,1,3},{110005,1,1,3},{110010,1,1,0},{110011,1,1,0},{110012,1,1,0}]},{0,[{10,100}],[{110009,1,1000,1}]}] | AC9: 2007
A10: 10007 | B10: 第7关 | C10: 10101 | D10: =R[-5]C+1 -> 2 | E10: =R[-5]C -> 2 | F10: 30 | G10: 10 | H10: 10 | I10: [{6007, 100}] | J10: 48 | K10: 0 | L10: 2 | N10: [{110009, 10000}, {110079,8}] | O10: {20,10} | P10: 6207 | Q10: 7007 | R10: 60 | S10: 20 | T10: 40 | U10: 60 | V10: 456 | W10: yewai | X10: [{200000,1},{201000,1},{202000,1}] | Y10: =RC[-15]*3600/RC[-19]*RC[-17] -> 57600 | Z10: =RC[-15]*3600/RC[-20]*RC[-18] -> 0 | AA10: =R[-1]C -> [{0,[{0,9995},{1,5}],[{200000,1,1,60},{200001,1,1,60},{200002,1,1,60},{200003,1,1,60},{200006,1,1,60},{200010,1,1,0},{200011,1,1,0},{200012,1,1,0},{201000,1,1,60},{201001,1,1,60},{201002,1,1,60},{201003,1,1,60},{201006,1,1,60},{201010,1,1,0},{201011,1,1,0},{201012,1,1,0},{202000,1,1,60},{202001,1,1,60},{202002,1,1,60},{202003,1,1,60},{202006,1,1,60},{202010,1,1,0},{202011,1,1,0},{202012,1,1,0},{110079,1,1,0},{110003,1,1,0},{110004,1,1,100},{110005,1,1,100},{110010,1,1,0},{110011,1,1,0},{110012,1,1,0},{110009,1,2,100}]}] | AB10: =R[-1]C -> [{0,[{1,100}],[{200000,1,1,60},{200001,1,1,60},{200002,1,1,60},{200003,1,1,60},{200006,1,1,60},{200010,1,1,5},{200011,1,1,5},{200012,1,1,5},{201000,1,1,60},{201001,1,1,60},{201002,1,1,60},{201003,1,1,60},{201006,1,1,60},{201010,1,1,5},{201011,1,1,5},{201012,1,1,5},{202000,1,1,60},{202001,1,1,60},{202002,1,1,60},{202003,1,1,60},{202006,1,1,60},{202010,1,1,5},{202011,1,1,5},{202012,1,1,5}]},{0,[{3,100}],[{110079,1,2,3},{110003,1,2,1},{110004,1,1,3},{110005,1,1,3},{110010,1,1,0},{110011,1,1,0},{110012,1,1,0}]},{0,[{10,100}],[{110009,1,1000,1}]}] | AC10: 2143
A11: 10008 | B11: 第8关 | C11: 10101 | D11: =R[-5]C+1 -> 2 | E11: =R[-5]C -> 3 | F11: 30 | G11: 10 | H11: 10 | I11: [{6008, 100}] | J11: 49 | K11: 0 | L11: 2 | N11: [{110009, 10000}, {110079,9}] | O11: {20,10} | P11: 6208 | Q11: 7007 | R11: 60 | S11: 20 | T11: 40 | U11: 60 | V11: 468 | W11: yewai | X11: [{200010,1},{201010,1},{202010,1}] | Y11: =RC[-15]*3600/RC[-19]*RC[-17] -> 58800 | Z11: =RC[-15]*3600/RC[-20]*RC[-18] -> 0 | AA11: =R[-1]C -> [{0,[{0,9995},{1,5}],[{200000,1,1,60},{200001,1,1,60},{200002,1,1,60},{200003,1,1,60},{200006,1,1,60},{200010,1,1,0},{200011,1,1,0},{200012,1,1,0},{201000,1,1,60},{201001,1,1,60},{201002,1,1,60},{201003,1,1,60},{201006,1,1,60},{201010,1,1,0},{201011,1,1,0},{201012,1,1,0},{202000,1,1,60},{202001,1,1,60},{202002,1,1,60},{202003,1,1,60},{202006,1,1,60},{202010,1,1,0},{202011,1,1,0},{202012,1,1,0},{110079,1,1,0},{110003,1,1,0},{110004,1,1,100},{110005,1,1,100},{110010,1,1,0},{110011,1,1,0},{110012,1,1,0},{110009,1,2,100}]}] | AB11: =R[-1]C -> [{0,[{1,100}],[{200000,1,1,60},{200001,1,1,60},{200002,1,1,60},{200003,1,1,60},{200006,1,1,60},{200010,1,1,5},{200011,1,1,5},{200012,1,1,5},{201000,1,1,60},{201001,1,1,60},{201002,1,1,60},{201003,1,1,60},{201006,1,1,60},{201010,1,1,5},{201011,1,1,5},{201012,1,1,5},{202000,1,1,60},{202001,1,1,60},{202002,1,1,60},{202003,1,1,60},{202006,1,1,60},{202010,1,1,5},{202011,1,1,5},{202012,1,1,5}]},{0,[{3,100}],[{110079,1,2,3},{110003,1,2,1},{110004,1,1,3},{110005,1,1,3},{110010,1,1,0},{110011,1,1,0},{110012,1,1,0}]},{0,[{10,100}],[{110009,1,1000,1}]}] | AC11: 2210
A12: 10009 | B12: 第9关 | C12: 10101 | D12: =R[-5]C+1 -> 2 | E12: =R[-5]C -> 4 | F12: 30 | G12: 10 | H12: 10 | I12: [{6009, 100}] | J12: 50 | K12: 0 | L12: 2 | N12: [{110009, 10000}, {110079,10}] | O12: {20,10} | P12: 6209 | Q12: 7007 | R12: 60 | S12: 20 | T12: 40 | U12: 60 | V12: 477 | W12: yewai | X12: [{200010,1},{201010,1},{202010,1}] | Y12: =RC[-15]*3600/RC[-19]*RC[-17] -> 60000 | Z12: =RC[-15]*3600/RC[-20]*RC[-18] -> 0 | AA12: =R[-1]C -> [{0,[{0,9995},{1,5}],[{200000,1,1,60},{200001,1,1,60},{200002,1,1,60},{200003,1,1,60},{200006,1,1,60},{200010,1,1,0},{200011,1,1,0},{200012,1,1,0},{201000,1,1,60},{201001,1,1,60},{201002,1,1,60},{201003,1,1,60},{201006,1,1,60},{201010,1,1,0},{201011,1,1,0},{201012,1,1,0},{202000,1,1,60},{202001,1,1,60},{202002,1,1,60},{202003,1,1,60},{202006,1,1,60},{202010,1,1,0},{202011,1,1,0},{202012,1,1,0},{110079,1,1,0},{110003,1,1,0},{110004,1,1,100},{110005,1,1,100},{110010,1,1,0},{110011,1,1,0},{110012,1,1,0},{110009,1,2,100}]}] | AB12: =R[-1]C -> [{0,[{1,100}],[{200000,1,1,60},{200001,1,1,60},{200002,1,1,60},{200003,1,1,60},{200006,1,1,60},{200010,1,1,5},{200011,1,1,5},{200012,1,1,5},{201000,1,1,60},{201001,1,1,60},{201002,1,1,60},{201003,1,1,60},{201006,1,1,60},{201010,1,1,5},{201011,1,1,5},{201012,1,1,5},{202000,1,1,60},{202001,1,1,60},{202002,1,1,60},{202003,1,1,60},{202006,1,1,60},{202010,1,1,5},{202011,1,1,5},{202012,1,1,5}]},{0,[{3,100}],[{110079,1,2,3},{110003,1,2,1},{110004,1,1,3},{110005,1,1,3},{110010,1,1,0},{110011,1,1,0},{110012,1,1,0}]},{0,[{10,100}],[{110009,1,1000,1}]}] | AC12: 2258
A13: 10010 | B13: 第10关 | C13: 10101 | D13: =R[-5]C+1 -> 2 | E13: =R[-5]C -> 5 | F13: 30 | G13: 10 | H13: 10 | I13: [{6010, 100}] | J13: 51 | K13: 0 | L13: 2 | N13: [{110009, 10000}, {110079,11}] | O13: {20,10} | P13: 6210 | Q13: 7007 | R13: 60 | S13: 20 | T13: 40 | U13: 60 | V13: 567 | W13: yewai | X13: [{200010,1},{201010,1},{202010,1}] | Y13: =RC[-15]*3600/RC[-19]*RC[-17] -> 61200 | Z13: =RC[-15]*3600/RC[-20]*RC[-18] -> 0 | AA13: =R[-1]C -> [{0,[{0,9995},{1,5}],[{200000,1,1,60},{200001,1,1,60},{200002,1,1,60},{200003,1,1,60},{200006,1,1,60},{200010,1,1,0},{200011,1,1,0},{200012,1,1,0},{201000,1,1,60},{201001,1,1,60},{201002,1,1,60},{201003,1,1,60},{201006,1,1,60},{201010,1,1,0},{201011,1,1,0},{201012,1,1,0},{202000,1,1,60},{202001,1,1,60},{202002,1,1,60},{202003,1,1,60},{202006,1,1,60},{202010,1,1,0},{202011,1,1,0},{202012,1,1,0},{110079,1,1,0},{110003,1,1,0},{110004,1,1,100},{110005,1,1,100},{110010,1,1,0},{110011,1,1,0},{110012,1,1,0},{110009,1,2,100}]}] | AB13: =R[-1]C -> [{0,[{1,100}],[{200000,1,1,60},{200001,1,1,60},{200002,1,1,60},{200003,1,1,60},{200006,1,1,60},{200010,1,1,5},{200011,1,1,5},{200012,1,1,5},{201000,1,1,60},{201001,1,1,60},{201002,1,1,60},{201003,1,1,60},{201006,1,1,60},{201010,1,1,5},{201011,1,1,5},{201012,1,1,5},{202000,1,1,60},{202001,1,1,60},{202002,1,1,60},{202003,1,1,60},{202006,1,1,60},{202010,1,1,5},{202011,1,1,5},{202012,1,1,5}]},{0,[{3,100}],[{110079,1,2,3},{110003,1,2,1},{110004,1,1,3},{110005,1,1,3},{110010,1,1,0},{110011,1,1,0},{110012,1,1,0}]},{0,[{10,100}],[{110009,1,1000,1}]}] | AC13: 2309
A14: 10011 | B14: 第11关 | C14: 10102 | D14: =R[-5]C+1 -> 3 | E14: =R[-5]C -> 1 | F14: 30 | G14: 10 | H14: 10 | I14: [{6011, 100}] | J14: 52 | K14: 0 | L14: 2 | N14: [{110009, 10000}, {110079,12}] | O14: {20,10} | P14: 6211 | Q14: 7009 | R14: 60 | S14: 20 | T14: 40 | U14: 60 | V14: 1050 | W14: yewai | X14: [{200010,1},{201010,1},{202010,1}] | Y14: =RC[-15]*3600/RC[-19]*RC[-17] -> 62400 | Z14: =RC[-15]*3600/RC[-20]*RC[-18] -> 0 | AA14: =小怪掉落!R[42]C[-1] -> [{0,[{0,9995},{1,5}],[{200000,1,1,70},{200001,1,1,70},{200002,1,1,70},{200003,1,1,70},{200006,1,1,70},{200010,1,1,1},{200011,1,1,1},{200012,1,1,1},{200013,1,1,1},{200015,1,1,1},{200016,1,1,1},{200017,1,1,1},{200019,1,1,1},{201000,1,1,70},{201001,1,1,70},{201002,1,1,70},{201003,1,1,70},{201006,1,1,70},{201010,1,1,1},{201011,1,1,1},{201012,1,1,1},{201013,1,1,1},{201015,1,1,1},{201016,1,1,1},{201017,1,1,1},{201019,1,1,1},{202000,1,1,70},{202001,1,1,30},{202002,1,1,30},{202003,1,1,30},{202006,1,1,30},{202010,1,1,1},{202011,1,1,1},{202012,1,1,1},{202013,1,1,1},{202015,1,1,1},{202016,1,1,1},{202017,1,1,1},{202019,1,1,1},{110079,1,1,0},{110003,1,1,0},{110004,1,1,100},{110005,1,1,100},{110010,1,1,0},{110011,1,1,0},{110012,1,1,0},{110009,1,3,100}]}] | AB14: =BOSS掉落!R[47]C[-2] -> [{0,[{1,100}],[{200000,1,1,70},{200001,1,1,70},{200002,1,1,70},{200003,1,1,70},{200006,1,1,70},{200010,1,1,12},{200011,1,1,12},{200012,1,1,12},{200013,1,1,12},{200015,1,1,12},{200016,1,1,12},{200017,1,1,12},{200019,1,1,12},{201000,1,1,70},{201001,1,1,70},{201002,1,1,70},{201003,1,1,70},{201006,1,1,70},{201010,1,1,12},{201011,1,1,12},{201012,1,1,12},{201013,1,1,12},{201015,1,1,12},{201016,1,1,12},{201017,1,1,12},{201019,1,1,12},{202000,1,1,70},{202001,1,1,70},{202002,1,1,70},{202003,1,1,70},{202006,1,1,70},{202010,1,1,12},{202011,1,1,12},{202012,1,1,12},{202013,1,1,12},{202015,1,1,12},{202016,1,1,12},{202017,1,1,12},{202019,1,1,12}]},{0,[{3,100}],[{110079,1,2,3},{110003,1,2,1},{110004,1,1,3},{110005,1,1,3},{110010,1,1,0},{110011,1,1,0},{110012,1,1,0}]},{0,[{10,100}],[{110009,1,1000,1}]}] | AC14: 2742
A15: 10012 | B15: 第12关 | C15: 10102 | D15: =R[-5]C+1 -> 3 | E15: =R[-5]C -> 2 | F15: 30 | G15: 10 | H15: 10 | I15: [{6012, 100}] | J15: 53 | K15: 0 | L15: 2 | N15: [{110009, 10000}, {110079,13}] | O15: {20,10} | P15: 6212 | Q15: 7009 | R15: 60 | S15: 20 | T15: 40 | U15: 60 | V15: 1320 | W15: yewai | X15: [{200010,1},{201010,1},{202010,1}] | Y15: =RC[-15]*3600/RC[-19]*RC[-17] -> 63600 | Z15: =RC[-15]*3600/RC[-20]*RC[-18] -> 0 | AA15: =R[-1]C -> [{0,[{0,9995},{1,5}],[{200000,1,1,70},{200001,1,1,70},{200002,1,1,70},{200003,1,1,70},{200006,1,1,70},{200010,1,1,1},{200011,1,1,1},{200012,1,1,1},{200013,1,1,1},{200015,1,1,1},{200016,1,1,1},{200017,1,1,1},{200019,1,1,1},{201000,1,1,70},{201001,1,1,70},{201002,1,1,70},{201003,1,1,70},{201006,1,1,70},{201010,1,1,1},{201011,1,1,1},{201012,1,1,1},{201013,1,1,1},{201015,1,1,1},{201016,1,1,1},{201017,1,1,1},{201019,1,1,1},{202000,1,1,70},{202001,1,1,30},{202002,1,1,30},{202003,1,1,30},{202006,1,1,30},{202010,1,1,1},{202011,1,1,1},{202012,1,1,1},{202013,1,1,1},{202015,1,1,1},{202016,1,1,1},{202017,1,1,1},{202019,1,1,1},{110079,1,1,0},{110003,1,1,0},{110004,1,1,100},{110005,1,1,100},{110010,1,1,0},{110011,1,1,0},{110012,1,1,0},{110009,1,3,100}]}] | AB15: =R[-1]C -> [{0,[{1,100}],[{200000,1,1,70},{200001,1,1,70},{200002,1,1,70},{200003,1,1,70},{200006,1,1,70},{200010,1,1,12},{200011,1,1,12},{200012,1,1,12},{200013,1,1,12},{200015,1,1,12},{200016,1,1,12},{200017,1,1,12},{200019,1,1,12},{201000,1,1,70},{201001,1,1,70},{201002,1,1,70},{201003,1,1,70},{201006,1,1,70},{201010,1,1,12},{201011,1,1,12},{201012,1,1,12},{201013,1,1,12},{201015,1,1,12},{201016,1,1,12},{201017,1,1,12},{201019,1,1,12},{202000,1,1,70},{202001,1,1,70},{202002,1,1,70},{202003,1,1,70},{202006,1,1,70},{202010,1,1,12},{202011,1,1,12},{202012,1,1,12},{202013,1,1,12},{202015,1,1,12},{202016,1,1,12},{202017,1,1,12},{202019,1,1,12}]},{0,[{3,100}],[{110079,1,2,3},{110003,1,2,1},{110004,1,1,3},{110005,1,1,3},{110010,1,1,0},{110011,1,1,0},{110012,1,1,0}]},{0,[{10,100}],[{110009,1,1000,1}]}] | AC15: 2793
A16: 10013 | B16: 第13关 | C16: 10102 | D16: =R[-5]C+1 -> 3 | E16: =R[-5]C -> 3 | F16: 30 | G16: 10 | H16: 10 | I16: [{6013, 100}] | J16: 54 | K16: 0 | L16: 2 | N16: [{110009, 10000}, {110079,14}] | O16: {20,10} | P16: 6213 | Q16: 7009 | R16: 60 | S16: 20 | T16: 40 | U16: 60 | V16: 1347 | W16: yewai | X16: [{200010,1},{201010,1},{202010,1}] | Y16: =RC[-15]*3600/RC[-19]*RC[-17] -> 64800 | Z16: =RC[-15]*3600/RC[-20]*RC[-18] -> 0 | AA16: =R[-1]C -> [{0,[{0,9995},{1,5}],[{200000,1,1,70},{200001,1,1,70},{200002,1,1,70},{200003,1,1,70},{200006,1,1,70},{200010,1,1,1},{200011,1,1,1},{200012,1,1,1},{200013,1,1,1},{200015,1,1,1},{200016,1,1,1},{200017,1,1,1},{200019,1,1,1},{201000,1,1,70},{201001,1,1,70},{201002,1,1,70},{201003,1,1,70},{201006,1,1,70},{201010,1,1,1},{201011,1,1,1},{201012,1,1,1},{201013,1,1,1},{201015,1,1,1},{201016,1,1,1},{201017,1,1,1},{201019,1,1,1},{202000,1,1,70},{202001,1,1,30},{202002,1,1,30},{202003,1,1,30},{202006,1,1,30},{202010,1,1,1},{202011,1,1,1},{202012,1,1,1},{202013,1,1,1},{202015,1,1,1},{202016,1,1,1},{202017,1,1,1},{202019,1,1,1},{110079,1,1,0},{110003,1,1,0},{110004,1,1,100},{110005,1,1,100},{110010,1,1,0},{110011,1,1,0},{110012,1,1,0},{110009,1,3,100}]}] | AB16: =R[-1]C -> [{0,[{1,100}],[{200000,1,1,70},{200001,1,1,70},{200002,1,1,70},{200003,1,1,70},{200006,1,1,70},{200010,1,1,12},{200011,1,1,12},{200012,1,1,12},{200013,1,1,12},{200015,1,1,12},{200016,1,1,12},{200017,1,1,12},{200019,1,1,12},{201000,1,1,70},{201001,1,1,70},{201002,1,1,70},{201003,1,1,70},{201006,1,1,70},{201010,1,1,12},{201011,1,1,12},{201012,1,1,12},{201013,1,1,12},{201015,1,1,12},{201016,1,1,12},{201017,1,1,12},{201019,1,1,12},{202000,1,1,70},{202001,1,1,70},{202002,1,1,70},{202003,1,1,70},{202006,1,1,70},{202010,1,1,12},{202011,1,1,12},{202012,1,1,12},{202013,1,1,12},{202015,1,1,12},{202016,1,1,12},{202017,1,1,12},{202019,1,1,12}]},{0,[{3,100}],[{110079,1,2,3},{110003,1,2,1},{110004,1,1,3},{110005,1,1,3},{110010,1,1,0},{110011,1,1,0},{110012,1,1,0}]},{0,[{10,100}],[{110009,1,1000,1}]}] | AC16: 2929
A17: 10014 | B17: 第14关 | C17: 10102 | D17: =R[-5]C+1 -> 3 | E17: =R[-5]C -> 4 | F17: 30 | G17: 10 | H17: 10 | I17: [{6014, 100}] | J17: 55 | K17: 0 | L17: 2 | N17: [{110009, 10000}, {110079,15}] | O17: {20,10} | P17: 6214 | Q17: 7009 | R17: 60 | S17: 20 | T17: 40 | U17: 60 | V17: 1372 | W17: yewai | X17: [{200010,1},{201010,1},{202010,1}] | Y17: =RC[-15]*3600/RC[-19]*RC[-17] -> 66000 | Z17: =RC[-15]*3600/RC[-20]*RC[-18] -> 0 | AA17: =R[-1]C -> [{0,[{0,9995},{1,5}],[{200000,1,1,70},{200001,1,1,70},{200002,1,1,70},{200003,1,1,70},{200006,1,1,70},{200010,1,1,1},{200011,1,1,1},{200012,1,1,1},{200013,1,1,1},{200015,1,1,1},{200016,1,1,1},{200017,1,1,1},{200019,1,1,1},{201000,1,1,70},{201001,1,1,70},{201002,1,1,70},{201003,1,1,70},{201006,1,1,70},{201010,1,1,1},{201011,1,1,1},{201012,1,1,1},{201013,1,1,1},{201015,1,1,1},{201016,1,1,1},{201017,1,1,1},{201019,1,1,1},{202000,1,1,70},{202001,1,1,30},{202002,1,1,30},{202003,1,1,30},{202006,1,1,30},{202010,1,1,1},{202011,1,1,1},{202012,1,1,1},{202013,1,1,1},{202015,1,1,1},{202016,1,1,1},{202017,1,1,1},{202019,1,1,1},{110079,1,1,0},{110003,1,1,0},{110004,1,1,100},{110005,1,1,100},{110010,1,1,0},{110011,1,1,0},{110012,1,1,0},{110009,1,3,100}]}] | AB17: =R[-1]C -> [{0,[{1,100}],[{200000,1,1,70},{200001,1,1,70},{200002,1,1,70},{200003,1,1,70},{200006,1,1,70},{200010,1,1,12},{200011,1,1,12},{200012,1,1,12},{200013,1,1,12},{200015,1,1,12},{200016,1,1,12},{200017,1,1,12},{200019,1,1,12},{201000,1,1,70},{201001,1,1,70},{201002,1,1,70},{201003,1,1,70},{201006,1,1,70},{201010,1,1,12},{201011,1,1,12},{201012,1,1,12},{201013,1,1,12},{201015,1,1,12},{201016,1,1,12},{201017,1,1,12},{201019,1,1,12},{202000,1,1,70},{202001,1,1,70},{202002,1,1,70},{202003,1,1,70},{202006,1,1,70},{202010,1,1,12},{202011,1,1,12},{202012,1,1,12},{202013,1,1,12},{202015,1,1,12},{202016,1,1,12},{202017,1,1,12},{202019,1,1,12}]},{0,[{3,100}],[{110079,1,2,3},{110003,1,2,1},{110004,1,1,3},{110005,1,1,3},{110010,1,1,0},{110011,1,1,0},{110012,1,1,0}]},{0,[{10,100}],[{110009,1,1000,1}]}] | AC17: 2983
A18: 10015 | B18: 第15关 | C18: 10102 | D18: =R[-5]C+1 -> 3 | E18: =R[-5]C -> 5 | F18: 30 | G18: 10 | H18: 10 | I18: [{6015, 100}] | J18: 56 | K18: 0 | L18: 2 | N18: [{110009, 10000}, {110079,16}] | O18: {20,10} | P18: 6215 | Q18: 7009 | R18: 60 | S18: 20 | T18: 40 | U18: 60 | V18: 1398 | W18: yewai | X18: [{200010,1},{201010,1},{202010,1}] | Y18: =RC[-15]*3600/RC[-19]*RC[-17] -> 67200 | Z18: =RC[-15]*3600/RC[-20]*RC[-18] -> 0 | AA18: =R[-1]C -> [{0,[{0,9995},{1,5}],[{200000,1,1,70},{200001,1,1,70},{200002,1,1,70},{200003,1,1,70},{200006,1,1,70},{200010,1,1,1},{200011,1,1,1},{200012,1,1,1},{200013,1,1,1},{200015,1,1,1},{200016,1,1,1},{200017,1,1,1},{200019,1,1,1},{201000,1,1,70},{201001,1,1,70},{201002,1,1,70},{201003,1,1,70},{201006,1,1,70},{201010,1,1,1},{201011,1,1,1},{201012,1,1,1},{201013,1,1,1},{201015,1,1,1},{201016,1,1,1},{201017,1,1,1},{201019,1,1,1},{202000,1,1,70},{202001,1,1,30},{202002,1,1,30},{202003,1,1,30},{202006,1,1,30},{202010,1,1,1},{202011,1,1,1},{202012,1,1,1},{202013,1,1,1},{202015,1,1,1},{202016,1,1,1},{202017,1,1,1},{202019,1,1,1},{110079,1,1,0},{110003,1,1,0},{110004,1,1,100},{110005,1,1,100},{110010,1,1,0},{110011,1,1,0},{110012,1,1,0},{110009,1,3,100}]}] | AB18: =R[-1]C -> [{0,[{1,100}],[{200000,1,1,70},{200001,1,1,70},{200002,1,1,70},{200003,1,1,70},{200006,1,1,70},{200010,1,1,12},{200011,1,1,12},{200012,1,1,12},{200013,1,1,12},{200015,1,1,12},{200016,1,1,12},{200017,1,1,12},{200019,1,1,12},{201000,1,1,70},{201001,1,1,70},{201002,1,1,70},{201003,1,1,70},{201006,1,1,70},{201010,1,1,12},{201011,1,1,12},{201012,1,1,12},{201013,1,1,12},{201015,1,1,12},{201016,1,1,12},{201017,1,1,12},{201019,1,1,12},{202000,1,1,70},{202001,1,1,70},{202002,1,1,70},{202003,1,1,70},{202006,1,1,70},{202010,1,1,12},{202011,1,1,12},{202012,1,1,12},{202013,1,1,12},{202015,1,1,12},{202016,1,1,12},{202017,1,1,12},{202019,1,1,12}]},{0,[{3,100}],[{110079,1,2,3},{110003,1,2,1},{110004,1,1,3},{110005,1,1,3},{110010,1,1,0},{110011,1,1,0},{110012,1,1,0}]},{0,[{10,100}],[{110009,1,1000,1}]}] | AC18: 3049
A19: 10016 | B19: 第16关 | C19: 10201 | D19: =R[-5]C+1 -> 4 | E19: =R[-5]C -> 1 | F19: 30 | G19: 10 | H19: 10 | I19: [{6016, 100}] | J19: 57 | K19: 0 | L19: 2 | N19: [{110009, 10000}, {110079,17}] | O19: {20,10} | P19: 6216 | Q19: 7009 | R19: 60 | S19: 20 | T19: 40 | U19: 60 | V19: 2128 | W19: yewai | X19: [{200020,1},{201020,1},{202020,1}] | Y19: =RC[-15]*3600/RC[-19]*RC[-17] -> 68400 | Z19: =RC[-15]*3600/RC[-20]*RC[-18] -> 0 | AA19: =小怪掉落!R[37]C[8] -> [{0,[{0,9995},{1,5}],[{200000,1,1,70},{200001,1,1,70},{200002,1,1,70},{200003,1,1,70},{200006,1,1,70},{200010,1,1,1},{200011,1,1,1},{200012,1,1,1},{200013,1,1,1},{200015,1,1,1},{200016,1,1,1},{200017,1,1,1},{200019,1,1,1},{201000,1,1,70},{201001,1,1,70},{201002,1,1,70},{201003,1,1,70},{201006,1,1,70},{201010,1,1,1},{201011,1,1,1},{201012,1,1,1},{201013,1,1,1},{201015,1,1,1},{201016,1,1,1},{201017,1,1,1},{201019,1,1,1},{202000,1,1,70},{202001,1,1,30},{202002,1,1,30},{202003,1,1,30},{202006,1,1,30},{202010,1,1,1},{202011,1,1,1},{202012,1,1,1},{202013,1,1,1},{202015,1,1,1},{202016,1,1,1},{202017,1,1,1},{202019,1,1,1},{110079,1,1,0},{110003,1,1,0},{110004,1,1,100},{110005,1,1,100},{110010,1,1,0},{110011,1,1,0},{110012,1,1,0},{110009,1,4,100}]}] | AB19: =BOSS掉落!R[42]C[7] -> [{0,[{1,100}],[{200000,1,1,70},{200001,1,1,70},{200002,1,1,70},{200003,1,1,70},{200006,1,1,70},{200010,1,1,12},{200011,1,1,12},{200012,1,1,12},{200013,1,1,12},{200015,1,1,12},{200016,1,1,12},{200017,1,1,12},{200019,1,1,12},{201000,1,1,70},{201001,1,1,70},{201002,1,1,70},{201003,1,1,70},{201006,1,1,70},{201010,1,1,12},{201011,1,1,12},{201012,1,1,12},{201013,1,1,12},{201015,1,1,12},{201016,1,1,12},{201017,1,1,12},{201019,1,1,12},{202000,1,1,70},{202001,1,1,70},{202002,1,1,70},{202003,1,1,70},{202006,1,1,70},{202010,1,1,12},{202011,1,1,12},{202012,1,1,12},{202013,1,1,12},{202015,1,1,12},{202016,1,1,12},{202017,1,1,12},{202019,1,1,12}]},{0,[{3,100}],[{110079,1,2,3},{110003,1,2,1},{110004,1,1,3},{110005,1,1,3},{110010,1,1,0},{110011,1,1,0},{110012,1,1,0}]},{0,[{10,100}],[{110009,1,1000,1}]}] | AC19: 3115
A20: 10017 | B20: 第17关 | C20: 10201 | D20: =R[-5]C+1 -> 4 | E20: =R[-5]C -> 2 | F20: 30 | G20: 10 | H20: 10 | I20: [{6017, 100}] | J20: 58 | K20: 0 | L20: 2 | N20: [{110009, 10000}, {110079,18}] | O20: {20,10} | P20: 6217 | Q20: 7009 | R20: 60 | S20: 20 | T20: 40 | U20: 60 | V20: 2164 | W20: yewai | X20: [{200020,1},{201020,1},{202020,1}] | Y20: =RC[-15]*3600/RC[-19]*RC[-17] -> 69600 | Z20: =RC[-15]*3600/RC[-20]*RC[-18] -> 0 | AA20: =R[-1]C -> [{0,[{0,9995},{1,5}],[{200000,1,1,70},{200001,1,1,70},{200002,1,1,70},{200003,1,1,70},{200006,1,1,70},{200010,1,1,1},{200011,1,1,1},{200012,1,1,1},{200013,1,1,1},{200015,1,1,1},{200016,1,1,1},{200017,1,1,1},{200019,1,1,1},{201000,1,1,70},{201001,1,1,70},{201002,1,1,70},{201003,1,1,70},{201006,1,1,70},{201010,1,1,1},{201011,1,1,1},{201012,1,1,1},{201013,1,1,1},{201015,1,1,1},{201016,1,1,1},{201017,1,1,1},{201019,1,1,1},{202000,1,1,70},{202001,1,1,30},{202002,1,1,30},{202003,1,1,30},{202006,1,1,30},{202010,1,1,1},{202011,1,1,1},{202012,1,1,1},{202013,1,1,1},{202015,1,1,1},{202016,1,1,1},{202017,1,1,1},{202019,1,1,1},{110079,1,1,0},{110003,1,1,0},{110004,1,1,100},{110005,1,1,100},{110010,1,1,0},{110011,1,1,0},{110012,1,1,0},{110009,1,4,100}]}] | AB20: =R[-1]C -> [{0,[{1,100}],[{200000,1,1,70},{200001,1,1,70},{200002,1,1,70},{200003,1,1,70},{200006,1,1,70},{200010,1,1,12},{200011,1,1,12},{200012,1,1,12},{200013,1,1,12},{200015,1,1,12},{200016,1,1,12},{200017,1,1,12},{200019,1,1,12},{201000,1,1,70},{201001,1,1,70},{201002,1,1,70},{201003,1,1,70},{201006,1,1,70},{201010,1,1,12},{201011,1,1,12},{201012,1,1,12},{201013,1,1,12},{201015,1,1,12},{201016,1,1,12},{201017,1,1,12},{201019,1,1,12},{202000,1,1,70},{202001,1,1,70},{202002,1,1,70},{202003,1,1,70},{202006,1,1,70},{202010,1,1,12},{202011,1,1,12},{202012,1,1,12},{202013,1,1,12},{202015,1,1,12},{202016,1,1,12},{202017,1,1,12},{202019,1,1,12}]},{0,[{3,100}],[{110079,1,2,3},{110003,1,2,1},{110004,1,1,3},{110005,1,1,3},{110010,1,1,0},{110011,1,1,0},{110012,1,1,0}]},{0,[{10,100}],[{110009,1,1000,1}]}] | AC20: 3235
A21: 10018 | B21: 第18关 | C21: 10201 | D21: =R[-5]C+1 -> 4 | E21: =R[-5]C -> 3 | F21: 30 | G21: 10 | H21: 10 | I21: [{6018, 100}] | J21: 59 | K21: 0 | L21: 2 | N21: [{110009, 10000}, {110079,19}] | O21: {20,10} | P21: 6218 | Q21: 7009 | R21: 60 | S21: 20 | T21: 40 | U21: 60 | V21: 2200 | W21: yewai | X21: [{200020,1},{201020,1},{202020,1}] | Y21: =RC[-15]*3600/RC[-19]*RC[-17] -> 70800 | Z21: =RC[-15]*3600/RC[-20]*RC[-18] -> 0 | AA21: =R[-1]C -> [{0,[{0,9995},{1,5}],[{200000,1,1,70},{200001,1,1,70},{200002,1,1,70},{200003,1,1,70},{200006,1,1,70},{200010,1,1,1},{200011,1,1,1},{200012,1,1,1},{200013,1,1,1},{200015,1,1,1},{200016,1,1,1},{200017,1,1,1},{200019,1,1,1},{201000,1,1,70},{201001,1,1,70},{201002,1,1,70},{201003,1,1,70},{201006,1,1,70},{201010,1,1,1},{201011,1,1,1},{201012,1,1,1},{201013,1,1,1},{201015,1,1,1},{201016,1,1,1},{201017,1,1,1},{201019,1,1,1},{202000,1,1,70},{202001,1,1,30},{202002,1,1,30},{202003,1,1,30},{202006,1,1,30},{202010,1,1,1},{202011,1,1,1},{202012,1,1,1},{202013,1,1,1},{202015,1,1,1},{202016,1,1,1},{202017,1,1,1},{202019,1,1,1},{110079,1,1,0},{110003,1,1,0},{110004,1,1,100},{110005,1,1,100},{110010,1,1,0},{110011,1,1,0},{110012,1,1,0},{110009,1,4,100}]}] | AB21: =R[-1]C -> [{0,[{1,100}],[{200000,1,1,70},{200001,1,1,70},{200002,1,1,70},{200003,1,1,70},{200006,1,1,70},{200010,1,1,12},{200011,1,1,12},{200012,1,1,12},{200013,1,1,12},{200015,1,1,12},{200016,1,1,12},{200017,1,1,12},{200019,1,1,12},{201000,1,1,70},{201001,1,1,70},{201002,1,1,70},{201003,1,1,70},{201006,1,1,70},{201010,1,1,12},{201011,1,1,12},{201012,1,1,12},{201013,1,1,12},{201015,1,1,12},{201016,1,1,12},{201017,1,1,12},{201019,1,1,12},{202000,1,1,70},{202001,1,1,70},{202002,1,1,70},{202003,1,1,70},{202006,1,1,70},{202010,1,1,12},{202011,1,1,12},{202012,1,1,12},{202013,1,1,12},{202015,1,1,12},{202016,1,1,12},{202017,1,1,12},{202019,1,1,12}]},{0,[{3,100}],[{110079,1,2,3},{110003,1,2,1},{110004,1,1,3},{110005,1,1,3},{110010,1,1,0},{110011,1,1,0},{110012,1,1,0}]},{0,[{10,100}],[{110009,1,1000,1}]}] | AC21: 3301
A22: 10019 | B22: 第19关 | C22: 10201 | D22: =R[-5]C+1 -> 4 | E22: =R[-5]C -> 4 | F22: 30 | G22: 10 | H22: 10 | I22: [{6019, 100}] | J22: 60 | K22: 0 | L22: 2 | N22: [{110009, 10000}, {110079,20}] | O22: {20,10} | P22: 6219 | Q22: 7009 | R22: 60 | S22: 20 | T22: 40 | U22: 60 | V22: 2236 | W22: yewai | X22: [{200020,1},{201020,1},{202020,1}] | Y22: =RC[-15]*3600/RC[-19]*RC[-17] -> 72000 | Z22: =RC[-15]*3600/RC[-20]*RC[-18] -> 0 | AA22: =R[-1]C -> [{0,[{0,9995},{1,5}],[{200000,1,1,70},{200001,1,1,70},{200002,1,1,70},{200003,1,1,70},{200006,1,1,70},{200010,1,1,1},{200011,1,1,1},{200012,1,1,1},{200013,1,1,1},{200015,1,1,1},{200016,1,1,1},{200017,1,1,1},{200019,1,1,1},{201000,1,1,70},{201001,1,1,70},{201002,1,1,70},{201003,1,1,70},{201006,1,1,70},{201010,1,1,1},{201011,1,1,1},{201012,1,1,1},{201013,1,1,1},{201015,1,1,1},{201016,1,1,1},{201017,1,1,1},{201019,1,1,1},{202000,1,1,70},{202001,1,1,30},{202002,1,1,30},{202003,1,1,30},{202006,1,1,30},{202010,1,1,1},{202011,1,1,1},{202012,1,1,1},{202013,1,1,1},{202015,1,1,1},{202016,1,1,1},{202017,1,1,1},{202019,1,1,1},{110079,1,1,0},{110003,1,1,0},{110004,1,1,100},{110005,1,1,100},{110010,1,1,0},{110011,1,1,0},{110012,1,1,0},{110009,1,4,100}]}] | AB22: =R[-1]C -> [{0,[{1,100}],[{200000,1,1,70},{200001,1,1,70},{200002,1,1,70},{200003,1,1,70},{200006,1,1,70},{200010,1,1,12},{200011,1,1,12},{200012,1,1,12},{200013,1,1,12},{200015,1,1,12},{200016,1,1,12},{200017,1,1,12},{200019,1,1,12},{201000,1,1,70},{201001,1,1,70},{201002,1,1,70},{201003,1,1,70},{201006,1,1,70},{201010,1,1,12},{201011,1,1,12},{201012,1,1,12},{201013,1,1,12},{201015,1,1,12},{201016,1,1,12},{201017,1,1,12},{201019,1,1,12},{202000,1,1,70},{202001,1,1,70},{202002,1,1,70},{202003,1,1,70},{202006,1,1,70},{202010,1,1,12},{202011,1,1,12},{202012,1,1,12},{202013,1,1,12},{202015,1,1,12},{202016,1,1,12},{202017,1,1,12},{202019,1,1,12}]},{0,[{3,100}],[{110079,1,2,3},{110003,1,2,1},{110004,1,1,3},{110005,1,1,3},{110010,1,1,0},{110011,1,1,0},{110012,1,1,0}]},{0,[{10,100}],[{110009,1,1000,1}]}] | AC22: 3410
A23: 10020 | B23: 第20关 | C23: 10201 | D23: =R[-5]C+1 -> 4 | E23: =R[-5]C -> 5 | F23: 30 | G23: 10 | H23: 10 | I23: [{6020, 100}] | J23: 61 | K23: 0 | L23: 2 | N23: [{110009, 10000}, {110079,21}] | O23: {20,10} | P23: 6220 | Q23: 7009 | R23: 60 | S23: 20 | T23: 40 | U23: 60 | V23: 2419 | W23: yewai | X23: [{200020,1},{201020,1},{202020,1}] | Y23: =RC[-15]*3600/RC[-19]*RC[-17] -> 73200 | Z23: =RC[-15]*3600/RC[-20]*RC[-18] -> 0 | AA23: =R[-1]C -> [{0,[{0,9995},{1,5}],[{200000,1,1,70},{200001,1,1,70},{200002,1,1,70},{200003,1,1,70},{200006,1,1,70},{200010,1,1,1},{200011,1,1,1},{200012,1,1,1},{200013,1,1,1},{200015,1,1,1},{200016,1,1,1},{200017,1,1,1},{200019,1,1,1},{201000,1,1,70},{201001,1,1,70},{201002,1,1,70},{201003,1,1,70},{201006,1,1,70},{201010,1,1,1},{201011,1,1,1},{201012,1,1,1},{201013,1,1,1},{201015,1,1,1},{201016,1,1,1},{201017,1,1,1},{201019,1,1,1},{202000,1,1,70},{202001,1,1,30},{202002,1,1,30},{202003,1,1,30},{202006,1,1,30},{202010,1,1,1},{202011,1,1,1},{202012,1,1,1},{202013,1,1,1},{202015,1,1,1},{202016,1,1,1},{202017,1,1,1},{202019,1,1,1},{110079,1,1,0},{110003,1,1,0},{110004,1,1,100},{110005,1,1,100},{110010,1,1,0},{110011,1,1,0},{110012,1,1,0},{110009,1,4,100}]}] | AB23: =R[-1]C -> [{0,[{1,100}],[{200000,1,1,70},{200001,1,1,70},{200002,1,1,70},{200003,1,1,70},{200006,1,1,70},{200010,1,1,12},{200011,1,1,12},{200012,1,1,12},{200013,1,1,12},{200015,1,1,12},{200016,1,1,12},{200017,1,1,12},{200019,1,1,12},{201000,1,1,70},{201001,1,1,70},{201002,1,1,70},{201003,1,1,70},{201006,1,1,70},{201010,1,1,12},{201011,1,1,12},{201012,1,1,12},{201013,1,1,12},{201015,1,1,12},{201016,1,1,12},{201017,1,1,12},{201019,1,1,12},{202000,1,1,70},{202001,1,1,70},{202002,1,1,70},{202003,1,1,70},{202006,1,1,70},{202010,1,1,12},{202011,1,1,12},{202012,1,1,12},{202013,1,1,12},{202015,1,1,12},{202016,1,1,12},{202017,1,1,12},{202019,1,1,12}]},{0,[{3,100}],[{110079,1,2,3},{110003,1,2,1},{110004,1,1,3},{110005,1,1,3},{110010,1,1,0},{110011,1,1,0},{110012,1,1,0}]},{0,[{10,100}],[{110009,1,1000,1}]}] | AC23: 3476
A24: 10021 | B24: 第21关 | C24: 10202 | D24: =R[-5]C+1 -> 5 | E24: =R[-5]C -> 1 | F24: 30 | G24: 10 | H24: 10 | I24: [{6021, 100}] | J24: 62 | K24: 0 | L24: 2 | N24: [{110009, 10000}, {110079,22}] | O24: {20,10} | P24: 6221 | Q24: 6046 | R24: 60 | S24: 20 | T24: 40 | U24: 60 | V24: 3658 | W24: yewai | X24: [{200030,1},{201030,1},{202030,1}] | Y24: =RC[-15]*3600/RC[-19]*RC[-17] -> 74400 | Z24: =RC[-15]*3600/RC[-20]*RC[-18] -> 0 | AA24: =小怪掉落!R[32]C[17] -> [{0,[{0,9995},{1,5}],[{200000,1,1,70},{200001,1,1,70},{200002,1,1,70},{200003,1,1,70},{200006,1,1,70},{200010,1,1,1},{200011,1,1,1},{200012,1,1,1},{200013,1,1,1},{200015,1,1,1},{200016,1,1,1},{200017,1,1,1},{200019,1,1,1},{201000,1,1,70},{201001,1,1,70},{201002,1,1,70},{201003,1,1,70},{201006,1,1,70},{201010,1,1,1},{201011,1,1,1},{201012,1,1,1},{201013,1,1,1},{201015,1,1,1},{201016,1,1,1},{201017,1,1,1},{201019,1,1,1},{202000,1,1,70},{202001,1,1,30},{202002,1,1,30},{202003,1,1,30},{202006,1,1,30},{202010,1,1,1},{202011,1,1,1},{202012,1,1,1},{202013,1,1,1},{202015,1,1,1},{202016,1,1,1},{202017,1,1,1},{202019,1,1,1},{110079,1,1,0},{110003,1,1,0},{110004,1,1,100},{110005,1,1,100},{110010,1,1,0},{110011,1,1,0},{110012,1,1,0},{110009,1,5,100}]}] | AB24: =BOSS掉落!R[37]C[16] -> [{0,[{1,100}],[{200000,1,1,70},{200001,1,1,70},{200002,1,1,70},{200003,1,1,70},{200006,1,1,70},{200010,1,1,12},{200011,1,1,12},{200012,1,1,12},{200013,1,1,12},{200015,1,1,12},{200016,1,1,12},{200017,1,1,12},{200019,1,1,12},{201000,1,1,70},{201001,1,1,70},{201002,1,1,70},{201003,1,1,70},{201006,1,1,70},{201010,1,1,12},{201011,1,1,12},{201012,1,1,12},{201013,1,1,12},{201015,1,1,12},{201016,1,1,12},{201017,1,1,12},{201019,1,1,12},{202000,1,1,70},{202001,1,1,70},{202002,1,1,70},{202003,1,1,70},{202006,1,1,70},{202010,1,1,12},{202011,1,1,12},{202012,1,1,12},{202013,1,1,12},{202015,1,1,12},{202016,1,1,12},{202017,1,1,12},{202019,1,1,12}]},{0,[{3,100}],[{110079,1,2,3},{110003,1,2,1},{110004,1,1,3},{110005,1,1,3},{110010,1,1,0},{110011,1,1,0},{110012,1,1,0}]},{0,[{10,100}],[{110009,1,1000,1}]}] | AC24: 3547
A25: 10022 | B25: 第22关 | C25: 10202 | D25: =R[-5]C+1 -> 5 | E25: =R[-5]C -> 2 | F25: 30 | G25: 10 | H25: 10 | I25: [{6022, 100}] | J25: 63 | K25: 0 | L25: 2 | N25: [{110009, 10000}, {110079,23}] | O25: {20,10} | P25: 6222 | Q25: 6046 | R25: 60 | S25: 20 | T25: 40 | U25: 60 | V25: 3999 | W25: yewai | X25: [{200030,1},{201030,1},{202030,1}] | Y25: =RC[-15]*3600/RC[-19]*RC[-17] -> 75600 | Z25: =RC[-15]*3600/RC[-20]*RC[-18] -> 0 | AA25: =R[-1]C -> [{0,[{0,9995},{1,5}],[{200000,1,1,70},{200001,1,1,70},{200002,1,1,70},{200003,1,1,70},{200006,1,1,70},{200010,1,1,1},{200011,1,1,1},{200012,1,1,1},{200013,1,1,1},{200015,1,1,1},{200016,1,1,1},{200017,1,1,1},{200019,1,1,1},{201000,1,1,70},{201001,1,1,70},{201002,1,1,70},{201003,1,1,70},{201006,1,1,70},{201010,1,1,1},{201011,1,1,1},{201012,1,1,1},{201013,1,1,1},{201015,1,1,1},{201016,1,1,1},{201017,1,1,1},{201019,1,1,1},{202000,1,1,70},{202001,1,1,30},{202002,1,1,30},{202003,1,1,30},{202006,1,1,30},{202010,1,1,1},{202011,1,1,1},{202012,1,1,1},{202013,1,1,1},{202015,1,1,1},{202016,1,1,1},{202017,1,1,1},{202019,1,1,1},{110079,1,1,0},{110003,1,1,0},{110004,1,1,100},{110005,1,1,100},{110010,1,1,0},{110011,1,1,0},{110012,1,1,0},{110009,1,5,100}]}] | AB25: =R[-1]C -> [{0,[{1,100}],[{200000,1,1,70},{200001,1,1,70},{200002,1,1,70},{200003,1,1,70},{200006,1,1,70},{200010,1,1,12},{200011,1,1,12},{200012,1,1,12},{200013,1,1,12},{200015,1,1,12},{200016,1,1,12},{200017,1,1,12},{200019,1,1,12},{201000,1,1,70},{201001,1,1,70},{201002,1,1,70},{201003,1,1,70},{201006,1,1,70},{201010,1,1,12},{201011,1,1,12},{201012,1,1,12},{201013,1,1,12},{201015,1,1,12},{201016,1,1,12},{201017,1,1,12},{201019,1,1,12},{202000,1,1,70},{202001,1,1,70},{202002,1,1,70},{202003,1,1,70},{202006,1,1,70},{202010,1,1,12},{202011,1,1,12},{202012,1,1,12},{202013,1,1,12},{202015,1,1,12},{202016,1,1,12},{202017,1,1,12},{202019,1,1,12}]},{0,[{3,100}],[{110079,1,2,3},{110003,1,2,1},{110004,1,1,3},{110005,1,1,3},{110010,1,1,0},{110011,1,1,0},{110012,1,1,0}]},{0,[{10,100}],[{110009,1,1000,1}]}] | AC25: 3641
A26: 10023 | B26: 第23关 | C26: 10202 | D26: =R[-5]C+1 -> 5 | E26: =R[-5]C -> 3 | F26: 30 | G26: 10 | H26: 10 | I26: [{6023, 100}] | J26: 64 | K26: 0 | L26: 2 | N26: [{110009, 10000}, {110079,24}] | O26: {20,10} | P26: 6223 | Q26: 6046 | R26: 60 | S26: 20 | T26: 40 | U26: 60 | V26: 4029 | W26: yewai | X26: [{200030,1},{201030,1},{202030,1}] | Y26: =RC[-15]*3600/RC[-19]*RC[-17] -> 76800 | Z26: =RC[-15]*3600/RC[-20]*RC[-18] -> 0 | AA26: =R[-1]C -> [{0,[{0,9995},{1,5}],[{200000,1,1,70},{200001,1,1,70},{200002,1,1,70},{200003,1,1,70},{200006,1,1,70},{200010,1,1,1},{200011,1,1,1},{200012,1,1,1},{200013,1,1,1},{200015,1,1,1},{200016,1,1,1},{200017,1,1,1},{200019,1,1,1},{201000,1,1,70},{201001,1,1,70},{201002,1,1,70},{201003,1,1,70},{201006,1,1,70},{201010,1,1,1},{201011,1,1,1},{201012,1,1,1},{201013,1,1,1},{201015,1,1,1},{201016,1,1,1},{201017,1,1,1},{201019,1,1,1},{202000,1,1,70},{202001,1,1,30},{202002,1,1,30},{202003,1,1,30},{202006,1,1,30},{202010,1,1,1},{202011,1,1,1},{202012,1,1,1},{202013,1,1,1},{202015,1,1,1},{202016,1,1,1},{202017,1,1,1},{202019,1,1,1},{110079,1,1,0},{110003,1,1,0},{110004,1,1,100},{110005,1,1,100},{110010,1,1,0},{110011,1,1,0},{110012,1,1,0},{110009,1,5,100}]}] | AB26: =R[-1]C -> [{0,[{1,100}],[{200000,1,1,70},{200001,1,1,70},{200002,1,1,70},{200003,1,1,70},{200006,1,1,70},{200010,1,1,12},{200011,1,1,12},{200012,1,1,12},{200013,1,1,12},{200015,1,1,12},{200016,1,1,12},{200017,1,1,12},{200019,1,1,12},{201000,1,1,70},{201001,1,1,70},{201002,1,1,70},{201003,1,1,70},{201006,1,1,70},{201010,1,1,12},{201011,1,1,12},{201012,1,1,12},{201013,1,1,12},{201015,1,1,12},{201016,1,1,12},{201017,1,1,12},{201019,1,1,12},{202000,1,1,70},{202001,1,1,70},{202002,1,1,70},{202003,1,1,70},{202006,1,1,70},{202010,1,1,12},{202011,1,1,12},{202012,1,1,12},{202013,1,1,12},{202015,1,1,12},{202016,1,1,12},{202017,1,1,12},{202019,1,1,12}]},{0,[{3,100}],[{110079,1,2,3},{110003,1,2,1},{110004,1,1,3},{110005,1,1,3},{110010,1,1,0},{110011,1,1,0},{110012,1,1,0}]},{0,[{10,100}],[{110009,1,1000,1}]}] | AC26: 3715
A27: 10024 | B27: 第24关 | C27: 10202 | D27: =R[-5]C+1 -> 5 | E27: =R[-5]C -> 4 | F27: 30 | G27: 10 | H27: 10 | I27: [{6024, 100}] | J27: 65 | K27: 0 | L27: 2 | N27: [{110009, 10000}, {110079,25}] | O27: {20,10} | P27: 6224 | Q27: 6046 | R27: 60 | S27: 20 | T27: 40 | U27: 60 | V27: 4059 | W27: yewai | X27: [{200030,1},{201030,1},{202030,1}] | Y27: =RC[-15]*3600/RC[-19]*RC[-17] -> 78000 | Z27: =RC[-15]*3600/RC[-20]*RC[-18] -> 0 | AA27: =R[-1]C -> [{0,[{0,9995},{1,5}],[{200000,1,1,70},{200001,1,1,70},{200002,1,1,70},{200003,1,1,70},{200006,1,1,70},{200010,1,1,1},{200011,1,1,1},{200012,1,1,1},{200013,1,1,1},{200015,1,1,1},{200016,1,1,1},{200017,1,1,1},{200019,1,1,1},{201000,1,1,70},{201001,1,1,70},{201002,1,1,70},{201003,1,1,70},{201006,1,1,70},{201010,1,1,1},{201011,1,1,1},{201012,1,1,1},{201013,1,1,1},{201015,1,1,1},{201016,1,1,1},{201017,1,1,1},{201019,1,1,1},{202000,1,1,70},{202001,1,1,30},{202002,1,1,30},{202003,1,1,30},{202006,1,1,30},{202010,1,1,1},{202011,1,1,1},{202012,1,1,1},{202013,1,1,1},{202015,1,1,1},{202016,1,1,1},{202017,1,1,1},{202019,1,1,1},{110079,1,1,0},{110003,1,1,0},{110004,1,1,100},{110005,1,1,100},{110010,1,1,0},{110011,1,1,0},{110012,1,1,0},{110009,1,5,100}]}] | AB27: =R[-1]C -> [{0,[{1,100}],[{200000,1,1,70},{200001,1,1,70},{200002,1,1,70},{200003,1,1,70},{200006,1,1,70},{200010,1,1,12},{200011,1,1,12},{200012,1,1,12},{200013,1,1,12},{200015,1,1,12},{200016,1,1,12},{200017,1,1,12},{200019,1,1,12},{201000,1,1,70},{201001,1,1,70},{201002,1,1,70},{201003,1,1,70},{201006,1,1,70},{201010,1,1,12},{201011,1,1,12},{201012,1,1,12},{201013,1,1,12},{201015,1,1,12},{201016,1,1,12},{201017,1,1,12},{201019,1,1,12},{202000,1,1,70},{202001,1,1,70},{202002,1,1,70},{202003,1,1,70},{202006,1,1,70},{202010,1,1,12},{202011,1,1,12},{202012,1,1,12},{202013,1,1,12},{202015,1,1,12},{202016,1,1,12},{202017,1,1,12},{202019,1,1,12}]},{0,[{3,100}],[{110079,1,2,3},{110003,1,2,1},{110004,1,1,3},{110005,1,1,3},{110010,1,1,0},{110011,1,1,0},{110012,1,1,0}]},{0,[{10,100}],[{110009,1,1000,1}]}] | AC27: 3786
A28: 10025 | B28: 第25关 | C28: 10202 | D28: =R[-5]C+1 -> 5 | E28: =R[-5]C -> 5 | F28: 30 | G28: 10 | H28: 10 | I28: [{6025, 100}] | J28: 66 | K28: 0 | L28: 2 | N28: [{110009, 10000}, {110079,26}] | O28: {20,10} | P28: 6225 | Q28: 6046 | R28: 60 | S28: 20 | T28: 40 | U28: 60 | V28: 4087 | W28: yewai | X28: [{200030,1},{201030,1},{202030,1}] | Y28: =RC[-15]*3600/RC[-19]*RC[-17] -> 79200 | Z28: =RC[-15]*3600/RC[-20]*RC[-18] -> 0 | AA28: =R[-1]C -> [{0,[{0,9995},{1,5}],[{200000,1,1,70},{200001,1,1,70},{200002,1,1,70},{200003,1,1,70},{200006,1,1,70},{200010,1,1,1},{200011,1,1,1},{200012,1,1,1},{200013,1,1,1},{200015,1,1,1},{200016,1,1,1},{200017,1,1,1},{200019,1,1,1},{201000,1,1,70},{201001,1,1,70},{201002,1,1,70},{201003,1,1,70},{201006,1,1,70},{201010,1,1,1},{201011,1,1,1},{201012,1,1,1},{201013,1,1,1},{201015,1,1,1},{201016,1,1,1},{201017,1,1,1},{201019,1,1,1},{202000,1,1,70},{202001,1,1,30},{202002,1,1,30},{202003,1,1,30},{202006,1,1,30},{202010,1,1,1},{202011,1,1,1},{202012,1,1,1},{202013,1,1,1},{202015,1,1,1},{202016,1,1,1},{202017,1,1,1},{202019,1,1,1},{110079,1,1,0},{110003,1,1,0},{110004,1,1,100},{110005,1,1,100},{110010,1,1,0},{110011,1,1,0},{110012,1,1,0},{110009,1,5,100}]}] | AB28: =R[-1]C -> [{0,[{1,100}],[{200000,1,1,70},{200001,1,1,70},{200002,1,1,70},{200003,1,1,70},{200006,1,1,70},{200010,1,1,12},{200011,1,1,12},{200012,1,1,12},{200013,1,1,12},{200015,1,1,12},{200016,1,1,12},{200017,1,1,12},{200019,1,1,12},{201000,1,1,70},{201001,1,1,70},{201002,1,1,70},{201003,1,1,70},{201006,1,1,70},{201010,1,1,12},{201011,1,1,12},{201012,1,1,12},{201013,1,1,12},{201015,1,1,12},{201016,1,1,12},{201017,1,1,12},{201019,1,1,12},{202000,1,1,70},{202001,1,1,70},{202002,1,1,70},{202003,1,1,70},{202006,1,1,70},{202010,1,1,12},{202011,1,1,12},{202012,1,1,12},{202013,1,1,12},{202015,1,1,12},{202016,1,1,12},{202017,1,1,12},{202019,1,1,12}]},{0,[{3,100}],[{110079,1,2,3},{110003,1,2,1},{110004,1,1,3},{110005,1,1,3},{110010,1,1,0},{110011,1,1,0},{110012,1,1,0}]},{0,[{10,100}],[{110009,1,1000,1}]}] | AC28: 3885
A29: 10026 | B29: 第26关 | C29: 10301 | D29: =R[-5]C+1 -> 6 | E29: =R[-5]C -> 1 | F29: 30 | G29: 10 | H29: 10 | I29: [{6026, 100}] | J29: 67 | K29: 0 | L29: 2 | N29: [{110009, 10000}, {110079,27}] | O29: {20,10} | P29: 6226 | Q29: 6046 | R29: 60 | S29: 20 | T29: 40 | U29: 60 | V29: 5571 | W29: yewai | X29: [{200030,1},{201030,1},{202030,1}] | Y29: =RC[-15]*3600/RC[-19]*RC[-17] -> 80400 | Z29: =RC[-15]*3600/RC[-20]*RC[-18] -> 0 | AA29: =R[-1]C -> [{0,[{0,9995},{1,5}],[{200000,1,1,70},{200001,1,1,70},{200002,1,1,70},{200003,1,1,70},{200006,1,1,70},{200010,1,1,1},{200011,1,1,1},{200012,1,1,1},{200013,1,1,1},{200015,1,1,1},{200016,1,1,1},{200017,1,1,1},{200019,1,1,1},{201000,1,1,70},{201001,1,1,70},{201002,1,1,70},{201003,1,1,70},{201006,1,1,70},{201010,1,1,1},{201011,1,1,1},{201012,1,1,1},{201013,1,1,1},{201015,1,1,1},{201016,1,1,1},{201017,1,1,1},{201019,1,1,1},{202000,1,1,70},{202001,1,1,30},{202002,1,1,30},{202003,1,1,30},{202006,1,1,30},{202010,1,1,1},{202011,1,1,1},{202012,1,1,1},{202013,1,1,1},{202015,1,1,1},{202016,1,1,1},{202017,1,1,1},{202019,1,1,1},{110079,1,1,0},{110003,1,1,0},{110004,1,1,100},{110005,1,1,100},{110010,1,1,0},{110011,1,1,0},{110012,1,1,0},{110009,1,5,100}]}] | AB29: =R[-1]C -> [{0,[{1,100}],[{200000,1,1,70},{200001,1,1,70},{200002,1,1,70},{200003,1,1,70},{200006,1,1,70},{200010,1,1,12},{200011,1,1,12},{200012,1,1,12},{200013,1,1,12},{200015,1,1,12},{200016,1,1,12},{200017,1,1,12},{200019,1,1,12},{201000,1,1,70},{201001,1,1,70},{201002,1,1,70},{201003,1,1,70},{201006,1,1,70},{201010,1,1,12},{201011,1,1,12},{201012,1,1,12},{201013,1,1,12},{201015,1,1,12},{201016,1,1,12},{201017,1,1,12},{201019,1,1,12},{202000,1,1,70},{202001,1,1,70},{202002,1,1,70},{202003,1,1,70},{202006,1,1,70},{202010,1,1,12},{202011,1,1,12},{202012,1,1,12},{202013,1,1,12},{202015,1,1,12},{202016,1,1,12},{202017,1,1,12},{202019,1,1,12}]},{0,[{3,100}],[{110079,1,2,3},{110003,1,2,1},{110004,1,1,3},{110005,1,1,3},{110010,1,1,0},{110011,1,1,0},{110012,1,1,0}]},{0,[{10,100}],[{110009,1,1000,1}]}] | AC29: 4357
A30: 10027 | B30: 第27关 | C30: 10301 | D30: =R[-5]C+1 -> 6 | E30: =R[-5]C -> 2 | F30: 30 | G30: 10 | H30: 10 | I30: [{6027, 100}] | J30: 68 | K30: 0 | L30: 2 | N30: [{110009, 10000}, {110079,28}] | O30: {20,10} | P30: 6227 | Q30: 6046 | R30: 60 | S30: 20 | T30: 40 | U30: 60 | V30: 5607 | W30: yewai | X30: [{200030,1},{201030,1},{202030,1}] | Y30: =RC[-15]*3600/RC[-19]*RC[-17] -> 81600 | Z30: =RC[-15]*3600/RC[-20]*RC[-18] -> 0 | AA30: =R[-1]C -> [{0,[{0,9995},{1,5}],[{200000,1,1,70},{200001,1,1,70},{200002,1,1,70},{200003,1,1,70},{200006,1,1,70},{200010,1,1,1},{200011,1,1,1},{200012,1,1,1},{200013,1,1,1},{200015,1,1,1},{200016,1,1,1},{200017,1,1,1},{200019,1,1,1},{201000,1,1,70},{201001,1,1,70},{201002,1,1,70},{201003,1,1,70},{201006,1,1,70},{201010,1,1,1},{201011,1,1,1},{201012,1,1,1},{201013,1,1,1},{201015,1,1,1},{201016,1,1,1},{201017,1,1,1},{201019,1,1,1},{202000,1,1,70},{202001,1,1,30},{202002,1,1,30},{202003,1,1,30},{202006,1,1,30},{202010,1,1,1},{202011,1,1,1},{202012,1,1,1},{202013,1,1,1},{202015,1,1,1},{202016,1,1,1},{202017,1,1,1},{202019,1,1,1},{110079,1,1,0},{110003,1,1,0},{110004,1,1,100},{110005,1,1,100},{110010,1,1,0},{110011,1,1,0},{110012,1,1,0},{110009,1,5,100}]}] | AB30: =R[-1]C -> [{0,[{1,100}],[{200000,1,1,70},{200001,1,1,70},{200002,1,1,70},{200003,1,1,70},{200006,1,1,70},{200010,1,1,12},{200011,1,1,12},{200012,1,1,12},{200013,1,1,12},{200015,1,1,12},{200016,1,1,12},{200017,1,1,12},{200019,1,1,12},{201000,1,1,70},{201001,1,1,70},{201002,1,1,70},{201003,1,1,70},{201006,1,1,70},{201010,1,1,12},{201011,1,1,12},{201012,1,1,12},{201013,1,1,12},{201015,1,1,12},{201016,1,1,12},{201017,1,1,12},{201019,1,1,12},{202000,1,1,70},{202001,1,1,70},{202002,1,1,70},{202003,1,1,70},{202006,1,1,70},{202010,1,1,12},{202011,1,1,12},{202012,1,1,12},{202013,1,1,12},{202015,1,1,12},{202016,1,1,12},{202017,1,1,12},{202019,1,1,12}]},{0,[{3,100}],[{110079,1,2,3},{110003,1,2,1},{110004,1,1,3},{110005,1,1,3},{110010,1,1,0},{110011,1,1,0},{110012,1,1,0}]},{0,[{10,100}],[{110009,1,1000,1}]}] | AC30: 4571
A31: 10028 | B31: 第28关 | C31: 10301 | D31: =R[-5]C+1 -> 6 | E31: =R[-5]C -> 3 | F31: 30 | G31: 10 | H31: 10 | I31: [{6028, 100}] | J31: 69 | K31: 0 | L31: 2 | N31: [{110009, 10000}, {110079,29}] | O31: {20,10} | P31: 6228 | Q31: 6046 | R31: 60 | S31: 20 | T31: 40 | U31: 60 | V31: 5643 | W31: yewai | X31: [{200030,1},{201030,1},{202030,1}] | Y31: =RC[-15]*3600/RC[-19]*RC[-17] -> 82800 | Z31: =RC[-15]*3600/RC[-20]*RC[-18] -> 0 | AA31: =R[-1]C -> [{0,[{0,9995},{1,5}],[{200000,1,1,70},{200001,1,1,70},{200002,1,1,70},{200003,1,1,70},{200006,1,1,70},{200010,1,1,1},{200011,1,1,1},{200012,1,1,1},{200013,1,1,1},{200015,1,1,1},{200016,1,1,1},{200017,1,1,1},{200019,1,1,1},{201000,1,1,70},{201001,1,1,70},{201002,1,1,70},{201003,1,1,70},{201006,1,1,70},{201010,1,1,1},{201011,1,1,1},{201012,1,1,1},{201013,1,1,1},{201015,1,1,1},{201016,1,1,1},{201017,1,1,1},{201019,1,1,1},{202000,1,1,70},{202001,1,1,30},{202002,1,1,30},{202003,1,1,30},{202006,1,1,30},{202010,1,1,1},{202011,1,1,1},{202012,1,1,1},{202013,1,1,1},{202015,1,1,1},{202016,1,1,1},{202017,1,1,1},{202019,1,1,1},{110079,1,1,0},{110003,1,1,0},{110004,1,1,100},{110005,1,1,100},{110010,1,1,0},{110011,1,1,0},{110012,1,1,0},{110009,1,5,100}]}] | AB31: =R[-1]C -> [{0,[{1,100}],[{200000,1,1,70},{200001,1,1,70},{200002,1,1,70},{200003,1,1,70},{200006,1,1,70},{200010,1,1,12},{200011,1,1,12},{200012,1,1,12},{200013,1,1,12},{200015,1,1,12},{200016,1,1,12},{200017,1,1,12},{200019,1,1,12},{201000,1,1,70},{201001,1,1,70},{201002,1,1,70},{201003,1,1,70},{201006,1,1,70},{201010,1,1,12},{201011,1,1,12},{201012,1,1,12},{201013,1,1,12},{201015,1,1,12},{201016,1,1,12},{201017,1,1,12},{201019,1,1,12},{202000,1,1,70},{202001,1,1,70},{202002,1,1,70},{202003,1,1,70},{202006,1,1,70},{202010,1,1,12},{202011,1,1,12},{202012,1,1,12},{202013,1,1,12},{202015,1,1,12},{202016,1,1,12},{202017,1,1,12},{202019,1,1,12}]},{0,[{3,100}],[{110079,1,2,3},{110003,1,2,1},{110004,1,1,3},{110005,1,1,3},{110010,1,1,0},{110011,1,1,0},{110012,1,1,0}]},{0,[{10,100}],[{110009,1,1000,1}]}] | AC31: 4738
A32: 10029 | B32: 第29关 | C32: 10301 | D32: =R[-5]C+1 -> 6 | E32: =R[-5]C -> 4 | F32: 30 | G32: 10 | H32: 10 | I32: [{6029, 100}] | J32: 70 | K32: 0 | L32: 2 | N32: [{110009, 10000}, {110079,30}] | O32: {20,10} | P32: 6229 | Q32: 6046 | R32: 60 | S32: 20 | T32: 40 | U32: 60 | V32: 5677 | W32: yewai | X32: [{200030,1},{201030,1},{202030,1}] | Y32: =RC[-15]*3600/RC[-19]*RC[-17] -> 84000 | Z32: =RC[-15]*3600/RC[-20]*RC[-18] -> 0 | AA32: =R[-1]C -> [{0,[{0,9995},{1,5}],[{200000,1,1,70},{200001,1,1,70},{200002,1,1,70},{200003,1,1,70},{200006,1,1,70},{200010,1,1,1},{200011,1,1,1},{200012,1,1,1},{200013,1,1,1},{200015,1,1,1},{200016,1,1,1},{200017,1,1,1},{200019,1,1,1},{201000,1,1,70},{201001,1,1,70},{201002,1,1,70},{201003,1,1,70},{201006,1,1,70},{201010,1,1,1},{201011,1,1,1},{201012,1,1,1},{201013,1,1,1},{201015,1,1,1},{201016,1,1,1},{201017,1,1,1},{201019,1,1,1},{202000,1,1,70},{202001,1,1,30},{202002,1,1,30},{202003,1,1,30},{202006,1,1,30},{202010,1,1,1},{202011,1,1,1},{202012,1,1,1},{202013,1,1,1},{202015,1,1,1},{202016,1,1,1},{202017,1,1,1},{202019,1,1,1},{110079,1,1,0},{110003,1,1,0},{110004,1,1,100},{110005,1,1,100},{110010,1,1,0},{110011,1,1,0},{110012,1,1,0},{110009,1,5,100}]}] | AB32: =R[-1]C -> [{0,[{1,100}],[{200000,1,1,70},{200001,1,1,70},{200002,1,1,70},{200003,1,1,70},{200006,1,1,70},{200010,1,1,12},{200011,1,1,12},{200012,1,1,12},{200013,1,1,12},{200015,1,1,12},{200016,1,1,12},{200017,1,1,12},{200019,1,1,12},{201000,1,1,70},{201001,1,1,70},{201002,1,1,70},{201003,1,1,70},{201006,1,1,70},{201010,1,1,12},{201011,1,1,12},{201012,1,1,12},{201013,1,1,12},{201015,1,1,12},{201016,1,1,12},{201017,1,1,12},{201019,1,1,12},{202000,1,1,70},{202001,1,1,70},{202002,1,1,70},{202003,1,1,70},{202006,1,1,70},{202010,1,1,12},{202011,1,1,12},{202012,1,1,12},{202013,1,1,12},{202015,1,1,12},{202016,1,1,12},{202017,1,1,12},{202019,1,1,12}]},{0,[{3,100}],[{110079,1,2,3},{110003,1,2,1},{110004,1,1,3},{110005,1,1,3},{110010,1,1,0},{110011,1,1,0},{110012,1,1,0}]},{0,[{10,100}],[{110009,1,1000,1}]}] | AC32: 4965
A33: 10030 | B33: 第30关 | C33: 10301 | D33: =R[-5]C+1 -> 6 | E33: =R[-5]C -> 5 | F33: 30 | G33: 10 | H33: 10 | I33: [{6030, 100}] | J33: 71 | K33: 0 | L33: 2 | N33: [{110009, 10000}, {110079,31}] | O33: {20,10} | P33: 6230 | Q33: 6046 | R33: 60 | S33: 20 | T33: 40 | U33: 60 | V33: 5905 | W33: yewai | X33: [{200030,1},{201030,1},{202030,1}] | Y33: =RC[-15]*3600/RC[-19]*RC[-17] -> 85200 | Z33: =RC[-15]*3600/RC[-20]*RC[-18] -> 0 | AA33: =R[-1]C -> [{0,[{0,9995},{1,5}],[{200000,1,1,70},{200001,1,1,70},{200002,1,1,70},{200003,1,1,70},{200006,1,1,70},{200010,1,1,1},{200011,1,1,1},{200012,1,1,1},{200013,1,1,1},{200015,1,1,1},{200016,1,1,1},{200017,1,1,1},{200019,1,1,1},{201000,1,1,70},{201001,1,1,70},{201002,1,1,70},{201003,1,1,70},{201006,1,1,70},{201010,1,1,1},{201011,1,1,1},{201012,1,1,1},{201013,1,1,1},{201015,1,1,1},{201016,1,1,1},{201017,1,1,1},{201019,1,1,1},{202000,1,1,70},{202001,1,1,30},{202002,1,1,30},{202003,1,1,30},{202006,1,1,30},{202010,1,1,1},{202011,1,1,1},{202012,1,1,1},{202013,1,1,1},{202015,1,1,1},{202016,1,1,1},{202017,1,1,1},{202019,1,1,1},{110079,1,1,0},{110003,1,1,0},{110004,1,1,100},{110005,1,1,100},{110010,1,1,0},{110011,1,1,0},{110012,1,1,0},{110009,1,5,100}]}] | AB33: =R[-1]C -> [{0,[{1,100}],[{200000,1,1,70},{200001,1,1,70},{200002,1,1,70},{200003,1,1,70},{200006,1,1,70},{200010,1,1,12},{200011,1,1,12},{200012,1,1,12},{200013,1,1,12},{200015,1,1,12},{200016,1,1,12},{200017,1,1,12},{200019,1,1,12},{201000,1,1,70},{201001,1,1,70},{201002,1,1,70},{201003,1,1,70},{201006,1,1,70},{201010,1,1,12},{201011,1,1,12},{201012,1,1,12},{201013,1,1,12},{201015,1,1,12},{201016,1,1,12},{201017,1,1,12},{201019,1,1,12},{202000,1,1,70},{202001,1,1,70},{202002,1,1,70},{202003,1,1,70},{202006,1,1,70},{202010,1,1,12},{202011,1,1,12},{202012,1,1,12},{202013,1,1,12},{202015,1,1,12},{202016,1,1,12},{202017,1,1,12},{202019,1,1,12}]},{0,[{3,100}],[{110079,1,2,3},{110003,1,2,1},{110004,1,1,3},{110005,1,1,3},{110010,1,1,0},{110011,1,1,0},{110012,1,1,0}]},{0,[{10,100}],[{110009,1,1000,1}]}] | AC33: 5053
A34: 10031 | B34: 第31关 | C34: 10302 | D34: =R[-5]C+1 -> 7 | E34: =R[-5]C -> 1 | F34: 30 | G34: 10 | H34: 10 | I34: [{6031, 100}] | J34: 72 | K34: 0 | L34: 2 | N34: [{110009, 10000}, {110079,32}] | O34: {20,10} | P34: 6231 | Q34: 6048 | R34: 60 | S34: 20 | T34: 40 | U34: 60 | V34: 8019 | W34: yewai | X34: [{200030,1},{201030,1},{202030,1}] | Y34: =RC[-15]*3600/RC[-19]*RC[-17] -> 86400 | Z34: =RC[-15]*3600/RC[-20]*RC[-18] -> 0 | AA34: =R[-1]C -> [{0,[{0,9995},{1,5}],[{200000,1,1,70},{200001,1,1,70},{200002,1,1,70},{200003,1,1,70},{200006,1,1,70},{200010,1,1,1},{200011,1,1,1},{200012,1,1,1},{200013,1,1,1},{200015,1,1,1},{200016,1,1,1},{200017,1,1,1},{200019,1,1,1},{201000,1,1,70},{201001,1,1,70},{201002,1,1,70},{201003,1,1,70},{201006,1,1,70},{201010,1,1,1},{201011,1,1,1},{201012,1,1,1},{201013,1,1,1},{201015,1,1,1},{201016,1,1,1},{201017,1,1,1},{201019,1,1,1},{202000,1,1,70},{202001,1,1,30},{202002,1,1,30},{202003,1,1,30},{202006,1,1,30},{202010,1,1,1},{202011,1,1,1},{202012,1,1,1},{202013,1,1,1},{202015,1,1,1},{202016,1,1,1},{202017,1,1,1},{202019,1,1,1},{110079,1,1,0},{110003,1,1,0},{110004,1,1,100},{110005,1,1,100},{110010,1,1,0},{110011,1,1,0},{110012,1,1,0},{110009,1,5,100}]}] | AB34: =R[-1]C -> [{0,[{1,100}],[{200000,1,1,70},{200001,1,1,70},{200002,1,1,70},{200003,1,1,70},{200006,1,1,70},{200010,1,1,12},{200011,1,1,12},{200012,1,1,12},{200013,1,1,12},{200015,1,1,12},{200016,1,1,12},{200017,1,1,12},{200019,1,1,12},{201000,1,1,70},{201001,1,1,70},{201002,1,1,70},{201003,1,1,70},{201006,1,1,70},{201010,1,1,12},{201011,1,1,12},{201012,1,1,12},{201013,1,1,12},{201015,1,1,12},{201016,1,1,12},{201017,1,1,12},{201019,1,1,12},{202000,1,1,70},{202001,1,1,70},{202002,1,1,70},{202003,1,1,70},{202006,1,1,70},{202010,1,1,12},{202011,1,1,12},{202012,1,1,12},{202013,1,1,12},{202015,1,1,12},{202016,1,1,12},{202017,1,1,12},{202019,1,1,12}]},{0,[{3,100}],[{110079,1,2,3},{110003,1,2,1},{110004,1,1,3},{110005,1,1,3},{110010,1,1,0},{110011,1,1,0},{110012,1,1,0}]},{0,[{10,100}],[{110009,1,1000,1}]}] | AC34: 5237
A35: 10032 | B35: 第32关 | C35: 10302 | D35: =R[-5]C+1 -> 7 | E35: =R[-5]C -> 2 | F35: 30 | G35: 10 | H35: 10 | I35: [{6032, 100}] | J35: 73 | K35: 0 | L35: 2 | N35: [{110009, 10000}, {110079,33}] | O35: {20,10} | P35: 6232 | Q35: 6048 | R35: 60 | S35: 20 | T35: 40 | U35: 60 | V35: 8442 | W35: yewai | X35: [{200030,1},{201030,1},{202030,1}] | Y35: =RC[-15]*3600/RC[-19]*RC[-17] -> 87600 | Z35: =RC[-15]*3600/RC[-20]*RC[-18] -> 0 | AA35: =R[-1]C -> [{0,[{0,9995},{1,5}],[{200000,1,1,70},{200001,1,1,70},{200002,1,1,70},{200003,1,1,70},{200006,1,1,70},{200010,1,1,1},{200011,1,1,1},{200012,1,1,1},{200013,1,1,1},{200015,1,1,1},{200016,1,1,1},{200017,1,1,1},{200019,1,1,1},{201000,1,1,70},{201001,1,1,70},{201002,1,1,70},{201003,1,1,70},{201006,1,1,70},{201010,1,1,1},{201011,1,1,1},{201012,1,1,1},{201013,1,1,1},{201015,1,1,1},{201016,1,1,1},{201017,1,1,1},{201019,1,1,1},{202000,1,1,70},{202001,1,1,30},{202002,1,1,30},{202003,1,1,30},{202006,1,1,30},{202010,1,1,1},{202011,1,1,1},{202012,1,1,1},{202013,1,1,1},{202015,1,1,1},{202016,1,1,1},{202017,1,1,1},{202019,1,1,1},{110079,1,1,0},{110003,1,1,0},{110004,1,1,100},{110005,1,1,100},{110010,1,1,0},{110011,1,1,0},{110012,1,1,0},{110009,1,5,100}]}] | AB35: =R[-1]C -> [{0,[{1,100}],[{200000,1,1,70},{200001,1,1,70},{200002,1,1,70},{200003,1,1,70},{200006,1,1,70},{200010,1,1,12},{200011,1,1,12},{200012,1,1,12},{200013,1,1,12},{200015,1,1,12},{200016,1,1,12},{200017,1,1,12},{200019,1,1,12},{201000,1,1,70},{201001,1,1,70},{201002,1,1,70},{201003,1,1,70},{201006,1,1,70},{201010,1,1,12},{201011,1,1,12},{201012,1,1,12},{201013,1,1,12},{201015,1,1,12},{201016,1,1,12},{201017,1,1,12},{201019,1,1,12},{202000,1,1,70},{202001,1,1,70},{202002,1,1,70},{202003,1,1,70},{202006,1,1,70},{202010,1,1,12},{202011,1,1,12},{202012,1,1,12},{202013,1,1,12},{202015,1,1,12},{202016,1,1,12},{202017,1,1,12},{202019,1,1,12}]},{0,[{3,100}],[{110079,1,2,3},{110003,1,2,1},{110004,1,1,3},{110005,1,1,3},{110010,1,1,0},{110011,1,1,0},{110012,1,1,0}]},{0,[{10,100}],[{110009,1,1000,1}]}] | AC35: 5326
A36: 10033 | B36: 第33关 | C36: 10302 | D36: =R[-5]C+1 -> 7 | E36: =R[-5]C -> 3 | F36: 30 | G36: 10 | H36: 10 | I36: [{6033, 100}] | J36: 74 | K36: 0 | L36: 2 | N36: [{110009, 10000}, {110079,34}] | O36: {20,10} | P36: 6233 | Q36: 6048 | R36: 60 | S36: 20 | T36: 40 | U36: 60 | V36: 8482 | W36: yewai | X36: [{200030,1},{201030,1},{202030,1}] | Y36: =RC[-15]*3600/RC[-19]*RC[-17] -> 88800 | Z36: =RC[-15]*3600/RC[-20]*RC[-18] -> 0 | AA36: =R[-1]C -> [{0,[{0,9995},{1,5}],[{200000,1,1,70},{200001,1,1,70},{200002,1,1,70},{200003,1,1,70},{200006,1,1,70},{200010,1,1,1},{200011,1,1,1},{200012,1,1,1},{200013,1,1,1},{200015,1,1,1},{200016,1,1,1},{200017,1,1,1},{200019,1,1,1},{201000,1,1,70},{201001,1,1,70},{201002,1,1,70},{201003,1,1,70},{201006,1,1,70},{201010,1,1,1},{201011,1,1,1},{201012,1,1,1},{201013,1,1,1},{201015,1,1,1},{201016,1,1,1},{201017,1,1,1},{201019,1,1,1},{202000,1,1,70},{202001,1,1,30},{202002,1,1,30},{202003,1,1,30},{202006,1,1,30},{202010,1,1,1},{202011,1,1,1},{202012,1,1,1},{202013,1,1,1},{202015,1,1,1},{202016,1,1,1},{202017,1,1,1},{202019,1,1,1},{110079,1,1,0},{110003,1,1,0},{110004,1,1,100},{110005,1,1,100},{110010,1,1,0},{110011,1,1,0},{110012,1,1,0},{110009,1,5,100}]}] | AB36: =R[-1]C -> [{0,[{1,100}],[{200000,1,1,70},{200001,1,1,70},{200002,1,1,70},{200003,1,1,70},{200006,1,1,70},{200010,1,1,12},{200011,1,1,12},{200012,1,1,12},{200013,1,1,12},{200015,1,1,12},{200016,1,1,12},{200017,1,1,12},{200019,1,1,12},{201000,1,1,70},{201001,1,1,70},{201002,1,1,70},{201003,1,1,70},{201006,1,1,70},{201010,1,1,12},{201011,1,1,12},{201012,1,1,12},{201013,1,1,12},{201015,1,1,12},{201016,1,1,12},{201017,1,1,12},{201019,1,1,12},{202000,1,1,70},{202001,1,1,70},{202002,1,1,70},{202003,1,1,70},{202006,1,1,70},{202010,1,1,12},{202011,1,1,12},{202012,1,1,12},{202013,1,1,12},{202015,1,1,12},{202016,1,1,12},{202017,1,1,12},{202019,1,1,12}]},{0,[{3,100}],[{110079,1,2,3},{110003,1,2,1},{110004,1,1,3},{110005,1,1,3},{110010,1,1,0},{110011,1,1,0},{110012,1,1,0}]},{0,[{10,100}],[{110009,1,1000,1}]}] | AC36: 5445
A37: 10034 | B37: 第34关 | C37: 10302 | D37: =R[-5]C+1 -> 7 | E37: =R[-5]C -> 4 | F37: 30 | G37: 10 | H37: 10 | I37: [{6034, 100}] | J37: 75 | K37: 0 | L37: 2 | N37: [{110009, 10000}, {110079,35}] | O37: {20,10} | P37: 6234 | Q37: 6048 | R37: 60 | S37: 20 | T37: 40 | U37: 60 | V37: 8521 | W37: yewai | X37: [{200030,1},{201030,1},{202030,1}] | Y37: =RC[-15]*3600/RC[-19]*RC[-17] -> 90000 | Z37: =RC[-15]*3600/RC[-20]*RC[-18] -> 0 | AA37: =R[-1]C -> [{0,[{0,9995},{1,5}],[{200000,1,1,70},{200001,1,1,70},{200002,1,1,70},{200003,1,1,70},{200006,1,1,70},{200010,1,1,1},{200011,1,1,1},{200012,1,1,1},{200013,1,1,1},{200015,1,1,1},{200016,1,1,1},{200017,1,1,1},{200019,1,1,1},{201000,1,1,70},{201001,1,1,70},{201002,1,1,70},{201003,1,1,70},{201006,1,1,70},{201010,1,1,1},{201011,1,1,1},{201012,1,1,1},{201013,1,1,1},{201015,1,1,1},{201016,1,1,1},{201017,1,1,1},{201019,1,1,1},{202000,1,1,70},{202001,1,1,30},{202002,1,1,30},{202003,1,1,30},{202006,1,1,30},{202010,1,1,1},{202011,1,1,1},{202012,1,1,1},{202013,1,1,1},{202015,1,1,1},{202016,1,1,1},{202017,1,1,1},{202019,1,1,1},{110079,1,1,0},{110003,1,1,0},{110004,1,1,100},{110005,1,1,100},{110010,1,1,0},{110011,1,1,0},{110012,1,1,0},{110009,1,5,100}]}] | AB37: =R[-1]C -> [{0,[{1,100}],[{200000,1,1,70},{200001,1,1,70},{200002,1,1,70},{200003,1,1,70},{200006,1,1,70},{200010,1,1,12},{200011,1,1,12},{200012,1,1,12},{200013,1,1,12},{200015,1,1,12},{200016,1,1,12},{200017,1,1,12},{200019,1,1,12},{201000,1,1,70},{201001,1,1,70},{201002,1,1,70},{201003,1,1,70},{201006,1,1,70},{201010,1,1,12},{201011,1,1,12},{201012,1,1,12},{201013,1,1,12},{201015,1,1,12},{201016,1,1,12},{201017,1,1,12},{201019,1,1,12},{202000,1,1,70},{202001,1,1,70},{202002,1,1,70},{202003,1,1,70},{202006,1,1,70},{202010,1,1,12},{202011,1,1,12},{202012,1,1,12},{202013,1,1,12},{202015,1,1,12},{202016,1,1,12},{202017,1,1,12},{202019,1,1,12}]},{0,[{3,100}],[{110079,1,2,3},{110003,1,2,1},{110004,1,1,3},{110005,1,1,3},{110010,1,1,0},{110011,1,1,0},{110012,1,1,0}]},{0,[{10,100}],[{110009,1,1000,1}]}] | AC37: 5538
A38: 10035 | B38: 第35关 | C38: 10302 | D38: =R[-5]C+1 -> 7 | E38: =R[-5]C -> 5 | F38: 30 | G38: 10 | H38: 10 | I38: [{6035, 100}] | J38: 76 | K38: 0 | L38: 2 | N38: [{110009, 10000}, {110079,36}] | O38: {20,10} | P38: 6235 | Q38: 6048 | R38: 60 | S38: 20 | T38: 40 | U38: 60 | V38: 8562 | W38: yewai | X38: [{200030,1},{201030,1},{202030,1}] | Y38: =RC[-15]*3600/RC[-19]*RC[-17] -> 91200 | Z38: =RC[-15]*3600/RC[-20]*RC[-18] -> 0 | AA38: =R[-1]C -> [{0,[{0,9995},{1,5}],[{200000,1,1,70},{200001,1,1,70},{200002,1,1,70},{200003,1,1,70},{200006,1,1,70},{200010,1,1,1},{200011,1,1,1},{200012,1,1,1},{200013,1,1,1},{200015,1,1,1},{200016,1,1,1},{200017,1,1,1},{200019,1,1,1},{201000,1,1,70},{201001,1,1,70},{201002,1,1,70},{201003,1,1,70},{201006,1,1,70},{201010,1,1,1},{201011,1,1,1},{201012,1,1,1},{201013,1,1,1},{201015,1,1,1},{201016,1,1,1},{201017,1,1,1},{201019,1,1,1},{202000,1,1,70},{202001,1,1,30},{202002,1,1,30},{202003,1,1,30},{202006,1,1,30},{202010,1,1,1},{202011,1,1,1},{202012,1,1,1},{202013,1,1,1},{202015,1,1,1},{202016,1,1,1},{202017,1,1,1},{202019,1,1,1},{110079,1,1,0},{110003,1,1,0},{110004,1,1,100},{110005,1,1,100},{110010,1,1,0},{110011,1,1,0},{110012,1,1,0},{110009,1,5,100}]}] | AB38: =R[-1]C -> [{0,[{1,100}],[{200000,1,1,70},{200001,1,1,70},{200002,1,1,70},{200003,1,1,70},{200006,1,1,70},{200010,1,1,12},{200011,1,1,12},{200012,1,1,12},{200013,1,1,12},{200015,1,1,12},{200016,1,1,12},{200017,1,1,12},{200019,1,1,12},{201000,1,1,70},{201001,1,1,70},{201002,1,1,70},{201003,1,1,70},{201006,1,1,70},{201010,1,1,12},{201011,1,1,12},{201012,1,1,12},{201013,1,1,12},{201015,1,1,12},{201016,1,1,12},{201017,1,1,12},{201019,1,1,12},{202000,1,1,70},{202001,1,1,70},{202002,1,1,70},{202003,1,1,70},{202006,1,1,70},{202010,1,1,12},{202011,1,1,12},{202012,1,1,12},{202013,1,1,12},{202015,1,1,12},{202016,1,1,12},{202017,1,1,12},{202019,1,1,12}]},{0,[{3,100}],[{110079,1,2,3},{110003,1,2,1},{110004,1,1,3},{110005,1,1,3},{110010,1,1,0},{110011,1,1,0},{110012,1,1,0}]},{0,[{10,100}],[{110009,1,1000,1}]}] | AC38: 5831
A39: 10036 | B39: 第36关 | C39: 10401 | D39: =R[-5]C+1 -> 8 | E39: =R[-5]C -> 1 | F39: 30 | G39: 10 | H39: 10 | I39: [{6036, 100}] | J39: 77 | K39: 0 | L39: 2 | N39: [{110009, 10000}, {110079,37}] | O39: {20,10} | P39: 6236 | Q39: 6048 | R39: 60 | S39: 20 | T39: 40 | U39: 60 | V39: 10924 | W39: yewai | X39: [{200030,1},{201030,1},{202030,1}] | Y39: =RC[-15]*3600/RC[-19]*RC[-17] -> 92400 | Z39: =RC[-15]*3600/RC[-20]*RC[-18] -> 0 | AA39: =R[-1]C -> [{0,[{0,9995},{1,5}],[{200000,1,1,70},{200001,1,1,70},{200002,1,1,70},{200003,1,1,70},{200006,1,1,70},{200010,1,1,1},{200011,1,1,1},{200012,1,1,1},{200013,1,1,1},{200015,1,1,1},{200016,1,1,1},{200017,1,1,1},{200019,1,1,1},{201000,1,1,70},{201001,1,1,70},{201002,1,1,70},{201003,1,1,70},{201006,1,1,70},{201010,1,1,1},{201011,1,1,1},{201012,1,1,1},{201013,1,1,1},{201015,1,1,1},{201016,1,1,1},{201017,1,1,1},{201019,1,1,1},{202000,1,1,70},{202001,1,1,30},{202002,1,1,30},{202003,1,1,30},{202006,1,1,30},{202010,1,1,1},{202011,1,1,1},{202012,1,1,1},{202013,1,1,1},{202015,1,1,1},{202016,1,1,1},{202017,1,1,1},{202019,1,1,1},{110079,1,1,0},{110003,1,1,0},{110004,1,1,100},{110005,1,1,100},{110010,1,1,0},{110011,1,1,0},{110012,1,1,0},{110009,1,5,100}]}] | AB39: =R[-1]C -> [{0,[{1,100}],[{200000,1,1,70},{200001,1,1,70},{200002,1,1,70},{200003,1,1,70},{200006,1,1,70},{200010,1,1,12},{200011,1,1,12},{200012,1,1,12},{200013,1,1,12},{200015,1,1,12},{200016,1,1,12},{200017,1,1,12},{200019,1,1,12},{201000,1,1,70},{201001,1,1,70},{201002,1,1,70},{201003,1,1,70},{201006,1,1,70},{201010,1,1,12},{201011,1,1,12},{201012,1,1,12},{201013,1,1,12},{201015,1,1,12},{201016,1,1,12},{201017,1,1,12},{201019,1,1,12},{202000,1,1,70},{202001,1,1,70},{202002,1,1,70},{202003,1,1,70},{202006,1,1,70},{202010,1,1,12},{202011,1,1,12},{202012,1,1,12},{202013,1,1,12},{202015,1,1,12},{202016,1,1,12},{202017,1,1,12},{202019,1,1,12}]},{0,[{3,100}],[{110079,1,2,3},{110003,1,2,1},{110004,1,1,3},{110005,1,1,3},{110010,1,1,0},{110011,1,1,0},{110012,1,1,0}]},{0,[{10,100}],[{110009,1,1000,1}]}] | AC39: 6657
A40: 10037 | B40: 第37关 | C40: 10401 | D40: =R[-5]C+1 -> 8 | E40: =R[-5]C -> 2 | F40: 30 | G40: 10 | H40: 10 | I40: [{6037, 100}] | J40: 78 | K40: 0 | L40: 2 | N40: [{110009, 10000}, {110079,38}] | O40: {20,10} | P40: 6237 | Q40: 6048 | R40: 60 | S40: 20 | T40: 40 | U40: 60 | V40: 10971 | W40: yewai | X40: [{200030,1},{201030,1},{202030,1}] | Y40: =RC[-15]*3600/RC[-19]*RC[-17] -> 93600 | Z40: =RC[-15]*3600/RC[-20]*RC[-18] -> 0 | AA40: =R[-1]C -> [{0,[{0,9995},{1,5}],[{200000,1,1,70},{200001,1,1,70},{200002,1,1,70},{200003,1,1,70},{200006,1,1,70},{200010,1,1,1},{200011,1,1,1},{200012,1,1,1},{200013,1,1,1},{200015,1,1,1},{200016,1,1,1},{200017,1,1,1},{200019,1,1,1},{201000,1,1,70},{201001,1,1,70},{201002,1,1,70},{201003,1,1,70},{201006,1,1,70},{201010,1,1,1},{201011,1,1,1},{201012,1,1,1},{201013,1,1,1},{201015,1,1,1},{201016,1,1,1},{201017,1,1,1},{201019,1,1,1},{202000,1,1,70},{202001,1,1,30},{202002,1,1,30},{202003,1,1,30},{202006,1,1,30},{202010,1,1,1},{202011,1,1,1},{202012,1,1,1},{202013,1,1,1},{202015,1,1,1},{202016,1,1,1},{202017,1,1,1},{202019,1,1,1},{110079,1,1,0},{110003,1,1,0},{110004,1,1,100},{110005,1,1,100},{110010,1,1,0},{110011,1,1,0},{110012,1,1,0},{110009,1,5,100}]}] | AB40: =R[-1]C -> [{0,[{1,100}],[{200000,1,1,70},{200001,1,1,70},{200002,1,1,70},{200003,1,1,70},{200006,1,1,70},{200010,1,1,12},{200011,1,1,12},{200012,1,1,12},{200013,1,1,12},{200015,1,1,12},{200016,1,1,12},{200017,1,1,12},{200019,1,1,12},{201000,1,1,70},{201001,1,1,70},{201002,1,1,70},{201003,1,1,70},{201006,1,1,70},{201010,1,1,12},{201011,1,1,12},{201012,1,1,12},{201013,1,1,12},{201015,1,1,12},{201016,1,1,12},{201017,1,1,12},{201019,1,1,12},{202000,1,1,70},{202001,1,1,70},{202002,1,1,70},{202003,1,1,70},{202006,1,1,70},{202010,1,1,12},{202011,1,1,12},{202012,1,1,12},{202013,1,1,12},{202015,1,1,12},{202016,1,1,12},{202017,1,1,12},{202019,1,1,12}]},{0,[{3,100}],[{110079,1,2,3},{110003,1,2,1},{110004,1,1,3},{110005,1,1,3},{110010,1,1,0},{110011,1,1,0},{110012,1,1,0}]},{0,[{10,100}],[{110009,1,1000,1}]}] | AC40: 6968
A41: 10038 | B41: 第38关 | C41: 10401 | D41: =R[-5]C+1 -> 8 | E41: =R[-5]C -> 3 | F41: 30 | G41: 10 | H41: 10 | I41: [{6038, 100}] | J41: 79 | K41: 0 | L41: 2 | N41: [{110009, 10000}, {110079,39}] | O41: {20,10} | P41: 6238 | Q41: 6048 | R41: 60 | S41: 20 | T41: 40 | U41: 60 | V41: 11016 | W41: yewai | X41: [{200030,1},{201030,1},{202030,1}] | Y41: =RC[-15]*3600/RC[-19]*RC[-17] -> 94800 | Z41: =RC[-15]*3600/RC[-20]*RC[-18] -> 0 | AA41: =R[-1]C -> [{0,[{0,9995},{1,5}],[{200000,1,1,70},{200001,1,1,70},{200002,1,1,70},{200003,1,1,70},{200006,1,1,70},{200010,1,1,1},{200011,1,1,1},{200012,1,1,1},{200013,1,1,1},{200015,1,1,1},{200016,1,1,1},{200017,1,1,1},{200019,1,1,1},{201000,1,1,70},{201001,1,1,70},{201002,1,1,70},{201003,1,1,70},{201006,1,1,70},{201010,1,1,1},{201011,1,1,1},{201012,1,1,1},{201013,1,1,1},{201015,1,1,1},{201016,1,1,1},{201017,1,1,1},{201019,1,1,1},{202000,1,1,70},{202001,1,1,30},{202002,1,1,30},{202003,1,1,30},{202006,1,1,30},{202010,1,1,1},{202011,1,1,1},{202012,1,1,1},{202013,1,1,1},{202015,1,1,1},{202016,1,1,1},{202017,1,1,1},{202019,1,1,1},{110079,1,1,0},{110003,1,1,0},{110004,1,1,100},{110005,1,1,100},{110010,1,1,0},{110011,1,1,0},{110012,1,1,0},{110009,1,5,100}]}] | AB41: =R[-1]C -> [{0,[{1,100}],[{200000,1,1,70},{200001,1,1,70},{200002,1,1,70},{200003,1,1,70},{200006,1,1,70},{200010,1,1,12},{200011,1,1,12},{200012,1,1,12},{200013,1,1,12},{200015,1,1,12},{200016,1,1,12},{200017,1,1,12},{200019,1,1,12},{201000,1,1,70},{201001,1,1,70},{201002,1,1,70},{201003,1,1,70},{201006,1,1,70},{201010,1,1,12},{201011,1,1,12},{201012,1,1,12},{201013,1,1,12},{201015,1,1,12},{201016,1,1,12},{201017,1,1,12},{201019,1,1,12},{202000,1,1,70},{202001,1,1,70},{202002,1,1,70},{202003,1,1,70},{202006,1,1,70},{202010,1,1,12},{202011,1,1,12},{202012,1,1,12},{202013,1,1,12},{202015,1,1,12},{202016,1,1,12},{202017,1,1,12},{202019,1,1,12}]},{0,[{3,100}],[{110079,1,2,3},{110003,1,2,1},{110004,1,1,3},{110005,1,1,3},{110010,1,1,0},{110011,1,1,0},{110012,1,1,0}]},{0,[{10,100}],[{110009,1,1000,1}]}] | AC41: 7194
A42: 10039 | B42: 第39关 | C42: 10401 | D42: =R[-5]C+1 -> 8 | E42: =R[-5]C -> 4 | F42: 30 | G42: 10 | H42: 10 | I42: [{6039, 100}] | J42: 80 | K42: 0 | L42: 2 | N42: [{110009, 10000}, {110079,40}] | O42: {20,10} | P42: 6239 | Q42: 6048 | R42: 60 | S42: 20 | T42: 40 | U42: 60 | V42: 11064 | W42: yewai | X42: [{200030,1},{201030,1},{202030,1}] | Y42: =RC[-15]*3600/RC[-19]*RC[-17] -> 96000 | Z42: =RC[-15]*3600/RC[-20]*RC[-18] -> 0 | AA42: =R[-1]C -> [{0,[{0,9995},{1,5}],[{200000,1,1,70},{200001,1,1,70},{200002,1,1,70},{200003,1,1,70},{200006,1,1,70},{200010,1,1,1},{200011,1,1,1},{200012,1,1,1},{200013,1,1,1},{200015,1,1,1},{200016,1,1,1},{200017,1,1,1},{200019,1,1,1},{201000,1,1,70},{201001,1,1,70},{201002,1,1,70},{201003,1,1,70},{201006,1,1,70},{201010,1,1,1},{201011,1,1,1},{201012,1,1,1},{201013,1,1,1},{201015,1,1,1},{201016,1,1,1},{201017,1,1,1},{201019,1,1,1},{202000,1,1,70},{202001,1,1,30},{202002,1,1,30},{202003,1,1,30},{202006,1,1,30},{202010,1,1,1},{202011,1,1,1},{202012,1,1,1},{202013,1,1,1},{202015,1,1,1},{202016,1,1,1},{202017,1,1,1},{202019,1,1,1},{110079,1,1,0},{110003,1,1,0},{110004,1,1,100},{110005,1,1,100},{110010,1,1,0},{110011,1,1,0},{110012,1,1,0},{110009,1,5,100}]}] | AB42: =R[-1]C -> [{0,[{1,100}],[{200000,1,1,70},{200001,1,1,70},{200002,1,1,70},{200003,1,1,70},{200006,1,1,70},{200010,1,1,12},{200011,1,1,12},{200012,1,1,12},{200013,1,1,12},{200015,1,1,12},{200016,1,1,12},{200017,1,1,12},{200019,1,1,12},{201000,1,1,70},{201001,1,1,70},{201002,1,1,70},{201003,1,1,70},{201006,1,1,70},{201010,1,1,12},{201011,1,1,12},{201012,1,1,12},{201013,1,1,12},{201015,1,1,12},{201016,1,1,12},{201017,1,1,12},{201019,1,1,12},{202000,1,1,70},{202001,1,1,70},{202002,1,1,70},{202003,1,1,70},{202006,1,1,70},{202010,1,1,12},{202011,1,1,12},{202012,1,1,12},{202013,1,1,12},{202015,1,1,12},{202016,1,1,12},{202017,1,1,12},{202019,1,1,12}]},{0,[{3,100}],[{110079,1,2,3},{110003,1,2,1},{110004,1,1,3},{110005,1,1,3},{110010,1,1,0},{110011,1,1,0},{110012,1,1,0}]},{0,[{10,100}],[{110009,1,1000,1}]}] | AC42: 7527
A43: 10040 | B43: 第40关 | C43: 10401 | D43: =R[-5]C+1 -> 8 | E43: =R[-5]C -> 5 | F43: 30 | G43: 10 | H43: 10 | I43: [{6040, 100}] | J43: 81 | K43: 0 | L43: 2 | N43: [{110009, 10000}, {110079,41}] | O43: {20,10} | P43: 6240 | Q43: 6048 | R43: 60 | S43: 20 | T43: 40 | U43: 60 | V43: 11353 | W43: yewai | X43: [{200030,1},{201030,1},{202030,1}] | Y43: =RC[-15]*3600/RC[-19]*RC[-17] -> 97200 | Z43: =RC[-15]*3600/RC[-20]*RC[-18] -> 0 | AA43: =R[-1]C -> [{0,[{0,9995},{1,5}],[{200000,1,1,70},{200001,1,1,70},{200002,1,1,70},{200003,1,1,70},{200006,1,1,70},{200010,1,1,1},{200011,1,1,1},{200012,1,1,1},{200013,1,1,1},{200015,1,1,1},{200016,1,1,1},{200017,1,1,1},{200019,1,1,1},{201000,1,1,70},{201001,1,1,70},{201002,1,1,70},{201003,1,1,70},{201006,1,1,70},{201010,1,1,1},{201011,1,1,1},{201012,1,1,1},{201013,1,1,1},{201015,1,1,1},{201016,1,1,1},{201017,1,1,1},{201019,1,1,1},{202000,1,1,70},{202001,1,1,30},{202002,1,1,30},{202003,1,1,30},{202006,1,1,30},{202010,1,1,1},{202011,1,1,1},{202012,1,1,1},{202013,1,1,1},{202015,1,1,1},{202016,1,1,1},{202017,1,1,1},{202019,1,1,1},{110079,1,1,0},{110003,1,1,0},{110004,1,1,100},{110005,1,1,100},{110010,1,1,0},{110011,1,1,0},{110012,1,1,0},{110009,1,5,100}]}] | AB43: =R[-1]C -> [{0,[{1,100}],[{200000,1,1,70},{200001,1,1,70},{200002,1,1,70},{200003,1,1,70},{200006,1,1,70},{200010,1,1,12},{200011,1,1,12},{200012,1,1,12},{200013,1,1,12},{200015,1,1,12},{200016,1,1,12},{200017,1,1,12},{200019,1,1,12},{201000,1,1,70},{201001,1,1,70},{201002,1,1,70},{201003,1,1,70},{201006,1,1,70},{201010,1,1,12},{201011,1,1,12},{201012,1,1,12},{201013,1,1,12},{201015,1,1,12},{201016,1,1,12},{201017,1,1,12},{201019,1,1,12},{202000,1,1,70},{202001,1,1,70},{202002,1,1,70},{202003,1,1,70},{202006,1,1,70},{202010,1,1,12},{202011,1,1,12},{202012,1,1,12},{202013,1,1,12},{202015,1,1,12},{202016,1,1,12},{202017,1,1,12},{202019,1,1,12}]},{0,[{3,100}],[{110079,1,2,3},{110003,1,2,1},{110004,1,1,3},{110005,1,1,3},{110010,1,1,0},{110011,1,1,0},{110012,1,1,0}]},{0,[{10,100}],[{110009,1,1000,1}]}] | AC43: 7619
A44: 10041 | B44: 第41关 | C44: 10402 | D44: =R[-5]C+1 -> 9 | E44: =R[-5]C -> 1 | F44: 30 | G44: 10 | H44: 10 | I44: [{6041, 100}] | J44: 82 | K44: 0 | L44: 2 | N44: [{110009, 10000}, {110079,42}] | O44: {20,10} | P44: 6241 | Q44: 7008 | R44: 60 | S44: 20 | T44: 40 | U44: 60 | V44: 14463 | W44: yewai | X44: [{200030,1},{201030,1},{202030,1}] | Y44: =RC[-15]*3600/RC[-19]*RC[-17] -> 98400 | Z44: =RC[-15]*3600/RC[-20]*RC[-18] -> 0 | AA44: =R[-1]C -> [{0,[{0,9995},{1,5}],[{200000,1,1,70},{200001,1,1,70},{200002,1,1,70},{200003,1,1,70},{200006,1,1,70},{200010,1,1,1},{200011,1,1,1},{200012,1,1,1},{200013,1,1,1},{200015,1,1,1},{200016,1,1,1},{200017,1,1,1},{200019,1,1,1},{201000,1,1,70},{201001,1,1,70},{201002,1,1,70},{201003,1,1,70},{201006,1,1,70},{201010,1,1,1},{201011,1,1,1},{201012,1,1,1},{201013,1,1,1},{201015,1,1,1},{201016,1,1,1},{201017,1,1,1},{201019,1,1,1},{202000,1,1,70},{202001,1,1,30},{202002,1,1,30},{202003,1,1,30},{202006,1,1,30},{202010,1,1,1},{202011,1,1,1},{202012,1,1,1},{202013,1,1,1},{202015,1,1,1},{202016,1,1,1},{202017,1,1,1},{202019,1,1,1},{110079,1,1,0},{110003,1,1,0},{110004,1,1,100},{110005,1,1,100},{110010,1,1,0},{110011,1,1,0},{110012,1,1,0},{110009,1,5,100}]}] | AB44: =R[-1]C -> [{0,[{1,100}],[{200000,1,1,70},{200001,1,1,70},{200002,1,1,70},{200003,1,1,70},{200006,1,1,70},{200010,1,1,12},{200011,1,1,12},{200012,1,1,12},{200013,1,1,12},{200015,1,1,12},{200016,1,1,12},{200017,1,1,12},{200019,1,1,12},{201000,1,1,70},{201001,1,1,70},{201002,1,1,70},{201003,1,1,70},{201006,1,1,70},{201010,1,1,12},{201011,1,1,12},{201012,1,1,12},{201013,1,1,12},{201015,1,1,12},{201016,1,1,12},{201017,1,1,12},{201019,1,1,12},{202000,1,1,70},{202001,1,1,70},{202002,1,1,70},{202003,1,1,70},{202006,1,1,70},{202010,1,1,12},{202011,1,1,12},{202012,1,1,12},{202013,1,1,12},{202015,1,1,12},{202016,1,1,12},{202017,1,1,12},{202019,1,1,12}]},{0,[{3,100}],[{110079,1,2,3},{110003,1,2,1},{110004,1,1,3},{110005,1,1,3},{110010,1,1,0},{110011,1,1,0},{110012,1,1,0}]},{0,[{10,100}],[{110009,1,1000,1}]}] | AC44: 7883
A45: 10042 | B45: 第42关 | C45: 10402 | D45: =R[-5]C+1 -> 9 | E45: =R[-5]C -> 2 | F45: 30 | G45: 10 | H45: 10 | I45: [{6042, 100}] | J45: 83 | K45: 0 | L45: 2 | N45: [{110009, 10000}, {110079,43}] | O45: {20,10} | P45: 6242 | Q45: 7008 | R45: 60 | S45: 20 | T45: 40 | U45: 60 | V45: 14983 | W45: yewai | X45: [{200030,1},{201030,1},{202030,1}] | Y45: =RC[-15]*3600/RC[-19]*RC[-17] -> 99600 | Z45: =RC[-15]*3600/RC[-20]*RC[-18] -> 0 | AA45: =R[-1]C -> [{0,[{0,9995},{1,5}],[{200000,1,1,70},{200001,1,1,70},{200002,1,1,70},{200003,1,1,70},{200006,1,1,70},{200010,1,1,1},{200011,1,1,1},{200012,1,1,1},{200013,1,1,1},{200015,1,1,1},{200016,1,1,1},{200017,1,1,1},{200019,1,1,1},{201000,1,1,70},{201001,1,1,70},{201002,1,1,70},{201003,1,1,70},{201006,1,1,70},{201010,1,1,1},{201011,1,1,1},{201012,1,1,1},{201013,1,1,1},{201015,1,1,1},{201016,1,1,1},{201017,1,1,1},{201019,1,1,1},{202000,1,1,70},{202001,1,1,30},{202002,1,1,30},{202003,1,1,30},{202006,1,1,30},{202010,1,1,1},{202011,1,1,1},{202012,1,1,1},{202013,1,1,1},{202015,1,1,1},{202016,1,1,1},{202017,1,1,1},{202019,1,1,1},{110079,1,1,0},{110003,1,1,0},{110004,1,1,100},{110005,1,1,100},{110010,1,1,0},{110011,1,1,0},{110012,1,1,0},{110009,1,5,100}]}] | AB45: =R[-1]C -> [{0,[{1,100}],[{200000,1,1,70},{200001,1,1,70},{200002,1,1,70},{200003,1,1,70},{200006,1,1,70},{200010,1,1,12},{200011,1,1,12},{200012,1,1,12},{200013,1,1,12},{200015,1,1,12},{200016,1,1,12},{200017,1,1,12},{200019,1,1,12},{201000,1,1,70},{201001,1,1,70},{201002,1,1,70},{201003,1,1,70},{201006,1,1,70},{201010,1,1,12},{201011,1,1,12},{201012,1,1,12},{201013,1,1,12},{201015,1,1,12},{201016,1,1,12},{201017,1,1,12},{201019,1,1,12},{202000,1,1,70},{202001,1,1,70},{202002,1,1,70},{202003,1,1,70},{202006,1,1,70},{202010,1,1,12},{202011,1,1,12},{202012,1,1,12},{202013,1,1,12},{202015,1,1,12},{202016,1,1,12},{202017,1,1,12},{202019,1,1,12}]},{0,[{3,100}],[{110079,1,2,3},{110003,1,2,1},{110004,1,1,3},{110005,1,1,3},{110010,1,1,0},{110011,1,1,0},{110012,1,1,0}]},{0,[{10,100}],[{110009,1,1000,1}]}] | AC45: 8215
A46: 10043 | B46: 第43关 | C46: 10402 | D46: =R[-5]C+1 -> 9 | E46: =R[-5]C -> 3 | F46: 30 | G46: 10 | H46: 10 | I46: [{6043, 100}] | J46: 84 | K46: 0 | L46: 2 | N46: [{110009, 10000}, {110079,44}] | O46: {20,10} | P46: 6243 | Q46: 7008 | R46: 60 | S46: 20 | T46: 40 | U46: 60 | V46: 15036 | W46: yewai | X46: [{200030,1},{201030,1},{202030,1}] | Y46: =RC[-15]*3600/RC[-19]*RC[-17] -> 100800 | Z46: =RC[-15]*3600/RC[-20]*RC[-18] -> 0 | AA46: =R[-1]C -> [{0,[{0,9995},{1,5}],[{200000,1,1,70},{200001,1,1,70},{200002,1,1,70},{200003,1,1,70},{200006,1,1,70},{200010,1,1,1},{200011,1,1,1},{200012,1,1,1},{200013,1,1,1},{200015,1,1,1},{200016,1,1,1},{200017,1,1,1},{200019,1,1,1},{201000,1,1,70},{201001,1,1,70},{201002,1,1,70},{201003,1,1,70},{201006,1,1,70},{201010,1,1,1},{201011,1,1,1},{201012,1,1,1},{201013,1,1,1},{201015,1,1,1},{201016,1,1,1},{201017,1,1,1},{201019,1,1,1},{202000,1,1,70},{202001,1,1,30},{202002,1,1,30},{202003,1,1,30},{202006,1,1,30},{202010,1,1,1},{202011,1,1,1},{202012,1,1,1},{202013,1,1,1},{202015,1,1,1},{202016,1,1,1},{202017,1,1,1},{202019,1,1,1},{110079,1,1,0},{110003,1,1,0},{110004,1,1,100},{110005,1,1,100},{110010,1,1,0},{110011,1,1,0},{110012,1,1,0},{110009,1,5,100}]}] | AB46: =R[-1]C -> [{0,[{1,100}],[{200000,1,1,70},{200001,1,1,70},{200002,1,1,70},{200003,1,1,70},{200006,1,1,70},{200010,1,1,12},{200011,1,1,12},{200012,1,1,12},{200013,1,1,12},{200015,1,1,12},{200016,1,1,12},{200017,1,1,12},{200019,1,1,12},{201000,1,1,70},{201001,1,1,70},{201002,1,1,70},{201003,1,1,70},{201006,1,1,70},{201010,1,1,12},{201011,1,1,12},{201012,1,1,12},{201013,1,1,12},{201015,1,1,12},{201016,1,1,12},{201017,1,1,12},{201019,1,1,12},{202000,1,1,70},{202001,1,1,70},{202002,1,1,70},{202003,1,1,70},{202006,1,1,70},{202010,1,1,12},{202011,1,1,12},{202012,1,1,12},{202013,1,1,12},{202015,1,1,12},{202016,1,1,12},{202017,1,1,12},{202019,1,1,12}]},{0,[{3,100}],[{110079,1,2,3},{110003,1,2,1},{110004,1,1,3},{110005,1,1,3},{110010,1,1,0},{110011,1,1,0},{110012,1,1,0}]},{0,[{10,100}],[{110009,1,1000,1}]}] | AC46: 8395
A47: 10044 | B47: 第44关 | C47: 10402 | D47: =R[-5]C+1 -> 9 | E47: =R[-5]C -> 4 | F47: 30 | G47: 10 | H47: 10 | I47: [{6044, 100}] | J47: 85 | K47: 0 | L47: 2 | N47: [{110009, 10000}, {110079,45}] | O47: {20,10} | P47: 6244 | Q47: 7008 | R47: 60 | S47: 20 | T47: 40 | U47: 60 | V47: 15091 | W47: yewai | X47: [{200030,1},{201030,1},{202030,1}] | Y47: =RC[-15]*3600/RC[-19]*RC[-17] -> 102000 | Z47: =RC[-15]*3600/RC[-20]*RC[-18] -> 0 | AA47: =R[-1]C -> [{0,[{0,9995},{1,5}],[{200000,1,1,70},{200001,1,1,70},{200002,1,1,70},{200003,1,1,70},{200006,1,1,70},{200010,1,1,1},{200011,1,1,1},{200012,1,1,1},{200013,1,1,1},{200015,1,1,1},{200016,1,1,1},{200017,1,1,1},{200019,1,1,1},{201000,1,1,70},{201001,1,1,70},{201002,1,1,70},{201003,1,1,70},{201006,1,1,70},{201010,1,1,1},{201011,1,1,1},{201012,1,1,1},{201013,1,1,1},{201015,1,1,1},{201016,1,1,1},{201017,1,1,1},{201019,1,1,1},{202000,1,1,70},{202001,1,1,30},{202002,1,1,30},{202003,1,1,30},{202006,1,1,30},{202010,1,1,1},{202011,1,1,1},{202012,1,1,1},{202013,1,1,1},{202015,1,1,1},{202016,1,1,1},{202017,1,1,1},{202019,1,1,1},{110079,1,1,0},{110003,1,1,0},{110004,1,1,100},{110005,1,1,100},{110010,1,1,0},{110011,1,1,0},{110012,1,1,0},{110009,1,5,100}]}] | AB47: =R[-1]C -> [{0,[{1,100}],[{200000,1,1,70},{200001,1,1,70},{200002,1,1,70},{200003,1,1,70},{200006,1,1,70},{200010,1,1,12},{200011,1,1,12},{200012,1,1,12},{200013,1,1,12},{200015,1,1,12},{200016,1,1,12},{200017,1,1,12},{200019,1,1,12},{201000,1,1,70},{201001,1,1,70},{201002,1,1,70},{201003,1,1,70},{201006,1,1,70},{201010,1,1,12},{201011,1,1,12},{201012,1,1,12},{201013,1,1,12},{201015,1,1,12},{201016,1,1,12},{201017,1,1,12},{201019,1,1,12},{202000,1,1,70},{202001,1,1,70},{202002,1,1,70},{202003,1,1,70},{202006,1,1,70},{202010,1,1,12},{202011,1,1,12},{202012,1,1,12},{202013,1,1,12},{202015,1,1,12},{202016,1,1,12},{202017,1,1,12},{202019,1,1,12}]},{0,[{3,100}],[{110079,1,2,3},{110003,1,2,1},{110004,1,1,3},{110005,1,1,3},{110010,1,1,0},{110011,1,1,0},{110012,1,1,0}]},{0,[{10,100}],[{110009,1,1000,1}]}] | AC47: 8576
A48: 10045 | B48: 第45关 | C48: 10402 | D48: =R[-5]C+1 -> 9 | E48: =R[-5]C -> 5 | F48: 30 | G48: 10 | H48: 10 | I48: [{6045, 100}] | J48: 86 | K48: 0 | L48: 2 | N48: [{110009, 10000}, {110079,46}] | O48: {20,10} | P48: 6245 | Q48: 7008 | R48: 60 | S48: 20 | T48: 40 | U48: 60 | V48: 15147 | W48: yewai | X48: [{200030,1},{201030,1},{202030,1}] | Y48: =RC[-15]*3600/RC[-19]*RC[-17] -> 103200 | Z48: =RC[-15]*3600/RC[-20]*RC[-18] -> 0 | AA48: =R[-1]C -> [{0,[{0,9995},{1,5}],[{200000,1,1,70},{200001,1,1,70},{200002,1,1,70},{200003,1,1,70},{200006,1,1,70},{200010,1,1,1},{200011,1,1,1},{200012,1,1,1},{200013,1,1,1},{200015,1,1,1},{200016,1,1,1},{200017,1,1,1},{200019,1,1,1},{201000,1,1,70},{201001,1,1,70},{201002,1,1,70},{201003,1,1,70},{201006,1,1,70},{201010,1,1,1},{201011,1,1,1},{201012,1,1,1},{201013,1,1,1},{201015,1,1,1},{201016,1,1,1},{201017,1,1,1},{201019,1,1,1},{202000,1,1,70},{202001,1,1,30},{202002,1,1,30},{202003,1,1,30},{202006,1,1,30},{202010,1,1,1},{202011,1,1,1},{202012,1,1,1},{202013,1,1,1},{202015,1,1,1},{202016,1,1,1},{202017,1,1,1},{202019,1,1,1},{110079,1,1,0},{110003,1,1,0},{110004,1,1,100},{110005,1,1,100},{110010,1,1,0},{110011,1,1,0},{110012,1,1,0},{110009,1,5,100}]}] | AB48: =R[-1]C -> [{0,[{1,100}],[{200000,1,1,70},{200001,1,1,70},{200002,1,1,70},{200003,1,1,70},{200006,1,1,70},{200010,1,1,12},{200011,1,1,12},{200012,1,1,12},{200013,1,1,12},{200015,1,1,12},{200016,1,1,12},{200017,1,1,12},{200019,1,1,12},{201000,1,1,70},{201001,1,1,70},{201002,1,1,70},{201003,1,1,70},{201006,1,1,70},{201010,1,1,12},{201011,1,1,12},{201012,1,1,12},{201013,1,1,12},{201015,1,1,12},{201016,1,1,12},{201017,1,1,12},{201019,1,1,12},{202000,1,1,70},{202001,1,1,70},{202002,1,1,70},{202003,1,1,70},{202006,1,1,70},{202010,1,1,12},{202011,1,1,12},{202012,1,1,12},{202013,1,1,12},{202015,1,1,12},{202016,1,1,12},{202017,1,1,12},{202019,1,1,12}]},{0,[{3,100}],[{110079,1,2,3},{110003,1,2,1},{110004,1,1,3},{110005,1,1,3},{110010,1,1,0},{110011,1,1,0},{110012,1,1,0}]},{0,[{10,100}],[{110009,1,1000,1}]}] | AC48: 8820
A49: 10046 | B49: 第46关 | C49: 10002 | D49: =R[-5]C+1 -> 10 | E49: =R[-5]C -> 1 | F49: 30 | G49: 10 | H49: 10 | I49: [{6046, 100}] | J49: 87 | K49: 0 | L49: 2 | N49: [{110009, 10000}, {110079,47}] | O49: {20,10} | P49: 6246 | Q49: 7008 | R49: 60 | S49: 20 | T49: 40 | U49: 60 | V49: 18534 | W49: yewai | X49: [{200030,1},{201030,1},{202030,1}] | Y49: =RC[-15]*3600/RC[-19]*RC[-17] -> 104400 | Z49: =RC[-15]*3600/RC[-20]*RC[-18] -> 0 | AA49: =R[-1]C -> [{0,[{0,9995},{1,5}],[{200000,1,1,70},{200001,1,1,70},{200002,1,1,70},{200003,1,1,70},{200006,1,1,70},{200010,1,1,1},{200011,1,1,1},{200012,1,1,1},{200013,1,1,1},{200015,1,1,1},{200016,1,1,1},{200017,1,1,1},{200019,1,1,1},{201000,1,1,70},{201001,1,1,70},{201002,1,1,70},{201003,1,1,70},{201006,1,1,70},{201010,1,1,1},{201011,1,1,1},{201012,1,1,1},{201013,1,1,1},{201015,1,1,1},{201016,1,1,1},{201017,1,1,1},{201019,1,1,1},{202000,1,1,70},{202001,1,1,30},{202002,1,1,30},{202003,1,1,30},{202006,1,1,30},{202010,1,1,1},{202011,1,1,1},{202012,1,1,1},{202013,1,1,1},{202015,1,1,1},{202016,1,1,1},{202017,1,1,1},{202019,1,1,1},{110079,1,1,0},{110003,1,1,0},{110004,1,1,100},{110005,1,1,100},{110010,1,1,0},{110011,1,1,0},{110012,1,1,0},{110009,1,5,100}]}] | AB49: =R[-1]C -> [{0,[{1,100}],[{200000,1,1,70},{200001,1,1,70},{200002,1,1,70},{200003,1,1,70},{200006,1,1,70},{200010,1,1,12},{200011,1,1,12},{200012,1,1,12},{200013,1,1,12},{200015,1,1,12},{200016,1,1,12},{200017,1,1,12},{200019,1,1,12},{201000,1,1,70},{201001,1,1,70},{201002,1,1,70},{201003,1,1,70},{201006,1,1,70},{201010,1,1,12},{201011,1,1,12},{201012,1,1,12},{201013,1,1,12},{201015,1,1,12},{201016,1,1,12},{201017,1,1,12},{201019,1,1,12},{202000,1,1,70},{202001,1,1,70},{202002,1,1,70},{202003,1,1,70},{202006,1,1,70},{202010,1,1,12},{202011,1,1,12},{202012,1,1,12},{202013,1,1,12},{202015,1,1,12},{202016,1,1,12},{202017,1,1,12},{202019,1,1,12}]},{0,[{3,100}],[{110079,1,2,3},{110003,1,2,1},{110004,1,1,3},{110005,1,1,3},{110010,1,1,0},{110011,1,1,0},{110012,1,1,0}]},{0,[{10,100}],[{110009,1,1000,1}]}] | AC49: 9847
A50: 10047 | B50: 第47关 | C50: 10003 | D50: =R[-5]C+1 -> 10 | E50: =R[-5]C -> 2 | F50: 30 | G50: 10 | H50: 10 | I50: [{6047, 100}] | J50: 88 | K50: 0 | L50: 2 | N50: [{110009, 10000}, {110079,48}] | O50: {20,10} | P50: 6247 | Q50: 7008 | R50: 60 | S50: 20 | T50: 40 | U50: 60 | V50: 18595 | W50: yewai | X50: [{200030,1},{201030,1},{202030,1}] | Y50: =RC[-15]*3600/RC[-19]*RC[-17] -> 105600 | Z50: =RC[-15]*3600/RC[-20]*RC[-18] -> 0 | AA50: =R[-1]C -> [{0,[{0,9995},{1,5}],[{200000,1,1,70},{200001,1,1,70},{200002,1,1,70},{200003,1,1,70},{200006,1,1,70},{200010,1,1,1},{200011,1,1,1},{200012,1,1,1},{200013,1,1,1},{200015,1,1,1},{200016,1,1,1},{200017,1,1,1},{200019,1,1,1},{201000,1,1,70},{201001,1,1,70},{201002,1,1,70},{201003,1,1,70},{201006,1,1,70},{201010,1,1,1},{201011,1,1,1},{201012,1,1,1},{201013,1,1,1},{201015,1,1,1},{201016,1,1,1},{201017,1,1,1},{201019,1,1,1},{202000,1,1,70},{202001,1,1,30},{202002,1,1,30},{202003,1,1,30},{202006,1,1,30},{202010,1,1,1},{202011,1,1,1},{202012,1,1,1},{202013,1,1,1},{202015,1,1,1},{202016,1,1,1},{202017,1,1,1},{202019,1,1,1},{110079,1,1,0},{110003,1,1,0},{110004,1,1,100},{110005,1,1,100},{110010,1,1,0},{110011,1,1,0},{110012,1,1,0},{110009,1,5,100}]}] | AB50: =R[-1]C -> [{0,[{1,100}],[{200000,1,1,70},{200001,1,1,70},{200002,1,1,70},{200003,1,1,70},{200006,1,1,70},{200010,1,1,12},{200011,1,1,12},{200012,1,1,12},{200013,1,1,12},{200015,1,1,12},{200016,1,1,12},{200017,1,1,12},{200019,1,1,12},{201000,1,1,70},{201001,1,1,70},{201002,1,1,70},{201003,1,1,70},{201006,1,1,70},{201010,1,1,12},{201011,1,1,12},{201012,1,1,12},{201013,1,1,12},{201015,1,1,12},{201016,1,1,12},{201017,1,1,12},{201019,1,1,12},{202000,1,1,70},{202001,1,1,70},{202002,1,1,70},{202003,1,1,70},{202006,1,1,70},{202010,1,1,12},{202011,1,1,12},{202012,1,1,12},{202013,1,1,12},{202015,1,1,12},{202016,1,1,12},{202017,1,1,12},{202019,1,1,12}]},{0,[{3,100}],[{110079,1,2,3},{110003,1,2,1},{110004,1,1,3},{110005,1,1,3},{110010,1,1,0},{110011,1,1,0},{110012,1,1,0}]},{0,[{10,100}],[{110009,1,1000,1}]}] | AC50: 9974
A51: 10048 | B51: 第48关 | C51: 10004 | D51: =R[-5]C+1 -> 10 | E51: =R[-5]C -> 3 | F51: 30 | G51: 10 | H51: 10 | I51: [{6048, 100}] | J51: 89 | K51: 0 | L51: 2 | N51: [{110009, 10000}, {110079,49}] | O51: {20,10} | P51: 6248 | Q51: 7008 | R51: 60 | S51: 20 | T51: 40 | U51: 60 | V51: 18657 | W51: yewai | X51: [{200030,1},{201030,1},{202030,1}] | Y51: =RC[-15]*3600/RC[-19]*RC[-17] -> 106800 | Z51: =RC[-15]*3600/RC[-20]*RC[-18] -> 0 | AA51: =R[-1]C -> [{0,[{0,9995},{1,5}],[{200000,1,1,70},{200001,1,1,70},{200002,1,1,70},{200003,1,1,70},{200006,1,1,70},{200010,1,1,1},{200011,1,1,1},{200012,1,1,1},{200013,1,1,1},{200015,1,1,1},{200016,1,1,1},{200017,1,1,1},{200019,1,1,1},{201000,1,1,70},{201001,1,1,70},{201002,1,1,70},{201003,1,1,70},{201006,1,1,70},{201010,1,1,1},{201011,1,1,1},{201012,1,1,1},{201013,1,1,1},{201015,1,1,1},{201016,1,1,1},{201017,1,1,1},{201019,1,1,1},{202000,1,1,70},{202001,1,1,30},{202002,1,1,30},{202003,1,1,30},{202006,1,1,30},{202010,1,1,1},{202011,1,1,1},{202012,1,1,1},{202013,1,1,1},{202015,1,1,1},{202016,1,1,1},{202017,1,1,1},{202019,1,1,1},{110079,1,1,0},{110003,1,1,0},{110004,1,1,100},{110005,1,1,100},{110010,1,1,0},{110011,1,1,0},{110012,1,1,0},{110009,1,5,100}]}] | AB51: =R[-1]C -> [{0,[{1,100}],[{200000,1,1,70},{200001,1,1,70},{200002,1,1,70},{200003,1,1,70},{200006,1,1,70},{200010,1,1,12},{200011,1,1,12},{200012,1,1,12},{200013,1,1,12},{200015,1,1,12},{200016,1,1,12},{200017,1,1,12},{200019,1,1,12},{201000,1,1,70},{201001,1,1,70},{201002,1,1,70},{201003,1,1,70},{201006,1,1,70},{201010,1,1,12},{201011,1,1,12},{201012,1,1,12},{201013,1,1,12},{201015,1,1,12},{201016,1,1,12},{201017,1,1,12},{201019,1,1,12},{202000,1,1,70},{202001,1,1,70},{202002,1,1,70},{202003,1,1,70},{202006,1,1,70},{202010,1,1,12},{202011,1,1,12},{202012,1,1,12},{202013,1,1,12},{202015,1,1,12},{202016,1,1,12},{202017,1,1,12},{202019,1,1,12}]},{0,[{3,100}],[{110079,1,2,3},{110003,1,2,1},{110004,1,1,3},{110005,1,1,3},{110010,1,1,0},{110011,1,1,0},{110012,1,1,0}]},{0,[{10,100}],[{110009,1,1000,1}]}] | AC51: 10183
A52: 10049 | B52: 第49关 | C52: 10005 | D52: =R[-5]C+1 -> 10 | E52: =R[-5]C -> 4 | F52: 30 | G52: 10 | H52: 10 | I52: [{6049, 100}] | J52: 90 | K52: 0 | L52: 2 | N52: [{110009, 10000}, {110079,50}] | O52: {20,10} | P52: 6249 | Q52: 7008 | R52: 60 | S52: 20 | T52: 40 | U52: 60 | V52: 18720 | W52: yewai | X52: [{200030,1},{201030,1},{202030,1}] | Y52: =RC[-15]*3600/RC[-19]*RC[-17] -> 108000 | Z52: =RC[-15]*3600/RC[-20]*RC[-18] -> 0 | AA52: =R[-1]C -> [{0,[{0,9995},{1,5}],[{200000,1,1,70},{200001,1,1,70},{200002,1,1,70},{200003,1,1,70},{200006,1,1,70},{200010,1,1,1},{200011,1,1,1},{200012,1,1,1},{200013,1,1,1},{200015,1,1,1},{200016,1,1,1},{200017,1,1,1},{200019,1,1,1},{201000,1,1,70},{201001,1,1,70},{201002,1,1,70},{201003,1,1,70},{201006,1,1,70},{201010,1,1,1},{201011,1,1,1},{201012,1,1,1},{201013,1,1,1},{201015,1,1,1},{201016,1,1,1},{201017,1,1,1},{201019,1,1,1},{202000,1,1,70},{202001,1,1,30},{202002,1,1,30},{202003,1,1,30},{202006,1,1,30},{202010,1,1,1},{202011,1,1,1},{202012,1,1,1},{202013,1,1,1},{202015,1,1,1},{202016,1,1,1},{202017,1,1,1},{202019,1,1,1},{110079,1,1,0},{110003,1,1,0},{110004,1,1,100},{110005,1,1,100},{110010,1,1,0},{110011,1,1,0},{110012,1,1,0},{110009,1,5,100}]}] | AB52: =R[-1]C -> [{0,[{1,100}],[{200000,1,1,70},{200001,1,1,70},{200002,1,1,70},{200003,1,1,70},{200006,1,1,70},{200010,1,1,12},{200011,1,1,12},{200012,1,1,12},{200013,1,1,12},{200015,1,1,12},{200016,1,1,12},{200017,1,1,12},{200019,1,1,12},{201000,1,1,70},{201001,1,1,70},{201002,1,1,70},{201003,1,1,70},{201006,1,1,70},{201010,1,1,12},{201011,1,1,12},{201012,1,1,12},{201013,1,1,12},{201015,1,1,12},{201016,1,1,12},{201017,1,1,12},{201019,1,1,12},{202000,1,1,70},{202001,1,1,70},{202002,1,1,70},{202003,1,1,70},{202006,1,1,70},{202010,1,1,12},{202011,1,1,12},{202012,1,1,12},{202013,1,1,12},{202015,1,1,12},{202016,1,1,12},{202017,1,1,12},{202019,1,1,12}]},{0,[{3,100}],[{110079,1,2,3},{110003,1,2,1},{110004,1,1,3},{110005,1,1,3},{110010,1,1,0},{110011,1,1,0},{110012,1,1,0}]},{0,[{10,100}],[{110009,1,1000,1}]}] | AC52: 10386
A53: 10050 | B53: 第50关 | C53: 10006 | D53: =R[-5]C+1 -> 10 | E53: =R[-5]C -> 5 | F53: 30 | G53: 10 | H53: 10 | I53: [{6050, 100}] | J53: 91 | K53: 0 | L53: 2 | N53: [{110009, 10000}, {110079,51}] | O53: {20,10} | P53: 6250 | Q53: 7008 | R53: 60 | S53: 20 | T53: 40 | U53: 60 | V53: 19104 | W53: yewai | X53: [{200030,1},{201030,1},{202030,1}] | Y53: =RC[-15]*3600/RC[-19]*RC[-17] -> 109200 | Z53: =RC[-15]*3600/RC[-20]*RC[-18] -> 0 | AA53: =R[-1]C -> [{0,[{0,9995},{1,5}],[{200000,1,1,70},{200001,1,1,70},{200002,1,1,70},{200003,1,1,70},{200006,1,1,70},{200010,1,1,1},{200011,1,1,1},{200012,1,1,1},{200013,1,1,1},{200015,1,1,1},{200016,1,1,1},{200017,1,1,1},{200019,1,1,1},{201000,1,1,70},{201001,1,1,70},{201002,1,1,70},{201003,1,1,70},{201006,1,1,70},{201010,1,1,1},{201011,1,1,1},{201012,1,1,1},{201013,1,1,1},{201015,1,1,1},{201016,1,1,1},{201017,1,1,1},{201019,1,1,1},{202000,1,1,70},{202001,1,1,30},{202002,1,1,30},{202003,1,1,30},{202006,1,1,30},{202010,1,1,1},{202011,1,1,1},{202012,1,1,1},{202013,1,1,1},{202015,1,1,1},{202016,1,1,1},{202017,1,1,1},{202019,1,1,1},{110079,1,1,0},{110003,1,1,0},{110004,1,1,100},{110005,1,1,100},{110010,1,1,0},{110011,1,1,0},{110012,1,1,0},{110009,1,5,100}]}] | AB53: =R[-1]C -> [{0,[{1,100}],[{200000,1,1,70},{200001,1,1,70},{200002,1,1,70},{200003,1,1,70},{200006,1,1,70},{200010,1,1,12},{200011,1,1,12},{200012,1,1,12},{200013,1,1,12},{200015,1,1,12},{200016,1,1,12},{200017,1,1,12},{200019,1,1,12},{201000,1,1,70},{201001,1,1,70},{201002,1,1,70},{201003,1,1,70},{201006,1,1,70},{201010,1,1,12},{201011,1,1,12},{201012,1,1,12},{201013,1,1,12},{201015,1,1,12},{201016,1,1,12},{201017,1,1,12},{201019,1,1,12},{202000,1,1,70},{202001,1,1,70},{202002,1,1,70},{202003,1,1,70},{202006,1,1,70},{202010,1,1,12},{202011,1,1,12},{202012,1,1,12},{202013,1,1,12},{202015,1,1,12},{202016,1,1,12},{202017,1,1,12},{202019,1,1,12}]},{0,[{3,100}],[{110079,1,2,3},{110003,1,2,1},{110004,1,1,3},{110005,1,1,3},{110010,1,1,0},{110011,1,1,0},{110012,1,1,0}]},{0,[{10,100}],[{110009,1,1000,1}]}] | AC53: 10577
A54: 10051 | B54: 第51关 | C54: 10002 | D54: =R[-5]C+1 -> 11 | E54: =R[-5]C -> 1 | F54: 30 | G54: 10 | H54: 10 | I54: [{6050, 100}] | J54: 92 | K54: 0 | L54: 2 | N54: [{110009, 10000}, {110079,52}] | O54: {20,10} | P54: 6250 | Q54: 6904 | R54: 60 | S54: 20 | T54: 40 | U54: 60 | V54: 19104 | W54: yewai | X54: [{200030,1},{201030,1},{202030,1}] | Y54: =RC[-15]*3600/RC[-19]*RC[-17] -> 110400 | Z54: =RC[-15]*3600/RC[-20]*RC[-18] -> 0 | AA54: =R[-1]C -> [{0,[{0,9995},{1,5}],[{200000,1,1,70},{200001,1,1,70},{200002,1,1,70},{200003,1,1,70},{200006,1,1,70},{200010,1,1,1},{200011,1,1,1},{200012,1,1,1},{200013,1,1,1},{200015,1,1,1},{200016,1,1,1},{200017,1,1,1},{200019,1,1,1},{201000,1,1,70},{201001,1,1,70},{201002,1,1,70},{201003,1,1,70},{201006,1,1,70},{201010,1,1,1},{201011,1,1,1},{201012,1,1,1},{201013,1,1,1},{201015,1,1,1},{201016,1,1,1},{201017,1,1,1},{201019,1,1,1},{202000,1,1,70},{202001,1,1,30},{202002,1,1,30},{202003,1,1,30},{202006,1,1,30},{202010,1,1,1},{202011,1,1,1},{202012,1,1,1},{202013,1,1,1},{202015,1,1,1},{202016,1,1,1},{202017,1,1,1},{202019,1,1,1},{110079,1,1,0},{110003,1,1,0},{110004,1,1,100},{110005,1,1,100},{110010,1,1,0},{110011,1,1,0},{110012,1,1,0},{110009,1,5,100}]}] | AB54: =R[-1]C -> [{0,[{1,100}],[{200000,1,1,70},{200001,1,1,70},{200002,1,1,70},{200003,1,1,70},{200006,1,1,70},{200010,1,1,12},{200011,1,1,12},{200012,1,1,12},{200013,1,1,12},{200015,1,1,12},{200016,1,1,12},{200017,1,1,12},{200019,1,1,12},{201000,1,1,70},{201001,1,1,70},{201002,1,1,70},{201003,1,1,70},{201006,1,1,70},{201010,1,1,12},{201011,1,1,12},{201012,1,1,12},{201013,1,1,12},{201015,1,1,12},{201016,1,1,12},{201017,1,1,12},{201019,1,1,12},{202000,1,1,70},{202001,1,1,70},{202002,1,1,70},{202003,1,1,70},{202006,1,1,70},{202010,1,1,12},{202011,1,1,12},{202012,1,1,12},{202013,1,1,12},{202015,1,1,12},{202016,1,1,12},{202017,1,1,12},{202019,1,1,12}]},{0,[{3,100}],[{110079,1,2,3},{110003,1,2,1},{110004,1,1,3},{110005,1,1,3},{110010,1,1,0},{110011,1,1,0},{110012,1,1,0}]},{0,[{10,100}],[{110009,1,1000,1}]}] | AC54: 10798
A55: 10052 | B55: 第52关 | C55: 10003 | D55: =R[-5]C+1 -> 11 | E55: =R[-5]C -> 2 | F55: 30 | G55: 10 | H55: 10 | I55: [{6050, 100}] | J55: 93 | K55: 0 | L55: 2 | N55: [{110009, 10000}, {110079,53}] | O55: {20,10} | P55: 6250 | Q55: 6904 | R55: 60 | S55: 20 | T55: 40 | U55: 60 | V55: 19104 | W55: yewai | X55: [{200030,1},{201030,1},{202030,1}] | Y55: =RC[-15]*3600/RC[-19]*RC[-17] -> 111600 | Z55: =RC[-15]*3600/RC[-20]*RC[-18] -> 0 | AA55: =R[-1]C -> [{0,[{0,9995},{1,5}],[{200000,1,1,70},{200001,1,1,70},{200002,1,1,70},{200003,1,1,70},{200006,1,1,70},{200010,1,1,1},{200011,1,1,1},{200012,1,1,1},{200013,1,1,1},{200015,1,1,1},{200016,1,1,1},{200017,1,1,1},{200019,1,1,1},{201000,1,1,70},{201001,1,1,70},{201002,1,1,70},{201003,1,1,70},{201006,1,1,70},{201010,1,1,1},{201011,1,1,1},{201012,1,1,1},{201013,1,1,1},{201015,1,1,1},{201016,1,1,1},{201017,1,1,1},{201019,1,1,1},{202000,1,1,70},{202001,1,1,30},{202002,1,1,30},{202003,1,1,30},{202006,1,1,30},{202010,1,1,1},{202011,1,1,1},{202012,1,1,1},{202013,1,1,1},{202015,1,1,1},{202016,1,1,1},{202017,1,1,1},{202019,1,1,1},{110079,1,1,0},{110003,1,1,0},{110004,1,1,100},{110005,1,1,100},{110010,1,1,0},{110011,1,1,0},{110012,1,1,0},{110009,1,5,100}]}] | AB55: =R[-1]C -> [{0,[{1,100}],[{200000,1,1,70},{200001,1,1,70},{200002,1,1,70},{200003,1,1,70},{200006,1,1,70},{200010,1,1,12},{200011,1,1,12},{200012,1,1,12},{200013,1,1,12},{200015,1,1,12},{200016,1,1,12},{200017,1,1,12},{200019,1,1,12},{201000,1,1,70},{201001,1,1,70},{201002,1,1,70},{201003,1,1,70},{201006,1,1,70},{201010,1,1,12},{201011,1,1,12},{201012,1,1,12},{201013,1,1,12},{201015,1,1,12},{201016,1,1,12},{201017,1,1,12},{201019,1,1,12},{202000,1,1,70},{202001,1,1,70},{202002,1,1,70},{202003,1,1,70},{202006,1,1,70},{202010,1,1,12},{202011,1,1,12},{202012,1,1,12},{202013,1,1,12},{202015,1,1,12},{202016,1,1,12},{202017,1,1,12},{202019,1,1,12}]},{0,[{3,100}],[{110079,1,2,3},{110003,1,2,1},{110004,1,1,3},{110005,1,1,3},{110010,1,1,0},{110011,1,1,0},{110012,1,1,0}]},{0,[{10,100}],[{110009,1,1000,1}]}] | AC55: 10935
A56: 10053 | B56: 第53关 | C56: 10004 | D56: =R[-5]C+1 -> 11 | E56: =R[-5]C -> 3 | F56: 30 | G56: 10 | H56: 10 | I56: [{6050, 100}] | J56: 94 | K56: 0 | L56: 2 | N56: [{110009, 10000}, {110079,54}] | O56: {20,10} | P56: 6250 | Q56: 6904 | R56: 60 | S56: 20 | T56: 40 | U56: 60 | V56: 19104 | W56: yewai | X56: [{200030,1},{201030,1},{202030,1}] | Y56: =RC[-15]*3600/RC[-19]*RC[-17] -> 112800 | Z56: =RC[-15]*3600/RC[-20]*RC[-18] -> 0 | AA56: =R[-1]C -> [{0,[{0,9995},{1,5}],[{200000,1,1,70},{200001,1,1,70},{200002,1,1,70},{200003,1,1,70},{200006,1,1,70},{200010,1,1,1},{200011,1,1,1},{200012,1,1,1},{200013,1,1,1},{200015,1,1,1},{200016,1,1,1},{200017,1,1,1},{200019,1,1,1},{201000,1,1,70},{201001,1,1,70},{201002,1,1,70},{201003,1,1,70},{201006,1,1,70},{201010,1,1,1},{201011,1,1,1},{201012,1,1,1},{201013,1,1,1},{201015,1,1,1},{201016,1,1,1},{201017,1,1,1},{201019,1,1,1},{202000,1,1,70},{202001,1,1,30},{202002,1,1,30},{202003,1,1,30},{202006,1,1,30},{202010,1,1,1},{202011,1,1,1},{202012,1,1,1},{202013,1,1,1},{202015,1,1,1},{202016,1,1,1},{202017,1,1,1},{202019,1,1,1},{110079,1,1,0},{110003,1,1,0},{110004,1,1,100},{110005,1,1,100},{110010,1,1,0},{110011,1,1,0},{110012,1,1,0},{110009,1,5,100}]}] | AB56: =R[-1]C -> [{0,[{1,100}],[{200000,1,1,70},{200001,1,1,70},{200002,1,1,70},{200003,1,1,70},{200006,1,1,70},{200010,1,1,12},{200011,1,1,12},{200012,1,1,12},{200013,1,1,12},{200015,1,1,12},{200016,1,1,12},{200017,1,1,12},{200019,1,1,12},{201000,1,1,70},{201001,1,1,70},{201002,1,1,70},{201003,1,1,70},{201006,1,1,70},{201010,1,1,12},{201011,1,1,12},{201012,1,1,12},{201013,1,1,12},{201015,1,1,12},{201016,1,1,12},{201017,1,1,12},{201019,1,1,12},{202000,1,1,70},{202001,1,1,70},{202002,1,1,70},{202003,1,1,70},{202006,1,1,70},{202010,1,1,12},{202011,1,1,12},{202012,1,1,12},{202013,1,1,12},{202015,1,1,12},{202016,1,1,12},{202017,1,1,12},{202019,1,1,12}]},{0,[{3,100}],[{110079,1,2,3},{110003,1,2,1},{110004,1,1,3},{110005,1,1,3},{110010,1,1,0},{110011,1,1,0},{110012,1,1,0}]},{0,[{10,100}],[{110009,1,1000,1}]}] | AC56: 11172
A57: 10054 | B57: 第54关 | C57: 10005 | D57: =R[-5]C+1 -> 11 | E57: =R[-5]C -> 4 | F57: 30 | G57: 10 | H57: 10 | I57: [{6050, 100}] | J57: 95 | K57: 0 | L57: 2 | N57: [{110009, 10000}, {110079,55}] | O57: {20,10} | P57: 6250 | Q57: 6904 | R57: 60 | S57: 20 | T57: 40 | U57: 60 | V57: 19104 | W57: yewai | X57: [{200030,1},{201030,1},{202030,1}] | Y57: =RC[-15]*3600/RC[-19]*RC[-17] -> 114000 | Z57: =RC[-15]*3600/RC[-20]*RC[-18] -> 0 | AA57: =R[-1]C -> [{0,[{0,9995},{1,5}],[{200000,1,1,70},{200001,1,1,70},{200002,1,1,70},{200003,1,1,70},{200006,1,1,70},{200010,1,1,1},{200011,1,1,1},{200012,1,1,1},{200013,1,1,1},{200015,1,1,1},{200016,1,1,1},{200017,1,1,1},{200019,1,1,1},{201000,1,1,70},{201001,1,1,70},{201002,1,1,70},{201003,1,1,70},{201006,1,1,70},{201010,1,1,1},{201011,1,1,1},{201012,1,1,1},{201013,1,1,1},{201015,1,1,1},{201016,1,1,1},{201017,1,1,1},{201019,1,1,1},{202000,1,1,70},{202001,1,1,30},{202002,1,1,30},{202003,1,1,30},{202006,1,1,30},{202010,1,1,1},{202011,1,1,1},{202012,1,1,1},{202013,1,1,1},{202015,1,1,1},{202016,1,1,1},{202017,1,1,1},{202019,1,1,1},{110079,1,1,0},{110003,1,1,0},{110004,1,1,100},{110005,1,1,100},{110010,1,1,0},{110011,1,1,0},{110012,1,1,0},{110009,1,5,100}]}] | AB57: =R[-1]C -> [{0,[{1,100}],[{200000,1,1,70},{200001,1,1,70},{200002,1,1,70},{200003,1,1,70},{200006,1,1,70},{200010,1,1,12},{200011,1,1,12},{200012,1,1,12},{200013,1,1,12},{200015,1,1,12},{200016,1,1,12},{200017,1,1,12},{200019,1,1,12},{201000,1,1,70},{201001,1,1,70},{201002,1,1,70},{201003,1,1,70},{201006,1,1,70},{201010,1,1,12},{201011,1,1,12},{201012,1,1,12},{201013,1,1,12},{201015,1,1,12},{201016,1,1,12},{201017,1,1,12},{201019,1,1,12},{202000,1,1,70},{202001,1,1,70},{202002,1,1,70},{202003,1,1,70},{202006,1,1,70},{202010,1,1,12},{202011,1,1,12},{202012,1,1,12},{202013,1,1,12},{202015,1,1,12},{202016,1,1,12},{202017,1,1,12},{202019,1,1,12}]},{0,[{3,100}],[{110079,1,2,3},{110003,1,2,1},{110004,1,1,3},{110005,1,1,3},{110010,1,1,0},{110011,1,1,0},{110012,1,1,0}]},{0,[{10,100}],[{110009,1,1000,1}]}] | AC57: 11394
A58: 10055 | B58: 第55关 | C58: 10006 | D58: =R[-5]C+1 -> 11 | E58: =R[-5]C -> 5 | F58: 30 | G58: 10 | H58: 10 | I58: [{6050, 100}] | J58: 96 | K58: 0 | L58: 2 | N58: [{110009, 10000}, {110079,56}] | O58: {20,10} | P58: 6250 | Q58: 6904 | R58: 60 | S58: 20 | T58: 40 | U58: 60 | V58: 19104 | W58: yewai | X58: [{200030,1},{201030,1},{202030,1}] | Y58: =RC[-15]*3600/RC[-19]*RC[-17] -> 115200 | Z58: =RC[-15]*3600/RC[-20]*RC[-18] -> 0 | AA58: =R[-1]C -> [{0,[{0,9995},{1,5}],[{200000,1,1,70},{200001,1,1,70},{200002,1,1,70},{200003,1,1,70},{200006,1,1,70},{200010,1,1,1},{200011,1,1,1},{200012,1,1,1},{200013,1,1,1},{200015,1,1,1},{200016,1,1,1},{200017,1,1,1},{200019,1,1,1},{201000,1,1,70},{201001,1,1,70},{201002,1,1,70},{201003,1,1,70},{201006,1,1,70},{201010,1,1,1},{201011,1,1,1},{201012,1,1,1},{201013,1,1,1},{201015,1,1,1},{201016,1,1,1},{201017,1,1,1},{201019,1,1,1},{202000,1,1,70},{202001,1,1,30},{202002,1,1,30},{202003,1,1,30},{202006,1,1,30},{202010,1,1,1},{202011,1,1,1},{202012,1,1,1},{202013,1,1,1},{202015,1,1,1},{202016,1,1,1},{202017,1,1,1},{202019,1,1,1},{110079,1,1,0},{110003,1,1,0},{110004,1,1,100},{110005,1,1,100},{110010,1,1,0},{110011,1,1,0},{110012,1,1,0},{110009,1,5,100}]}] | AB58: =R[-1]C -> [{0,[{1,100}],[{200000,1,1,70},{200001,1,1,70},{200002,1,1,70},{200003,1,1,70},{200006,1,1,70},{200010,1,1,12},{200011,1,1,12},{200012,1,1,12},{200013,1,1,12},{200015,1,1,12},{200016,1,1,12},{200017,1,1,12},{200019,1,1,12},{201000,1,1,70},{201001,1,1,70},{201002,1,1,70},{201003,1,1,70},{201006,1,1,70},{201010,1,1,12},{201011,1,1,12},{201012,1,1,12},{201013,1,1,12},{201015,1,1,12},{201016,1,1,12},{201017,1,1,12},{201019,1,1,12},{202000,1,1,70},{202001,1,1,70},{202002,1,1,70},{202003,1,1,70},{202006,1,1,70},{202010,1,1,12},{202011,1,1,12},{202012,1,1,12},{202013,1,1,12},{202015,1,1,12},{202016,1,1,12},{202017,1,1,12},{202019,1,1,12}]},{0,[{3,100}],[{110079,1,2,3},{110003,1,2,1},{110004,1,1,3},{110005,1,1,3},{110010,1,1,0},{110011,1,1,0},{110012,1,1,0}]},{0,[{10,100}],[{110009,1,1000,1}]}] | AC58: 11637
A59: 10056 | B59: 第56关 | C59: 10002 | D59: =R[-5]C+1 -> 12 | E59: =R[-5]C -> 1 | F59: 30 | G59: 10 | H59: 10 | I59: [{6050, 100}] | J59: 97 | K59: 0 | L59: 2 | N59: [{110009, 10000}, {110079,57}] | O59: {20,10} | P59: 6250 | Q59: 6904 | R59: 60 | S59: 20 | T59: 40 | U59: 60 | V59: 19104 | W59: yewai | X59: [{200030,1},{201030,1},{202030,1}] | Y59: =RC[-15]*3600/RC[-19]*RC[-17] -> 116400 | Z59: =RC[-15]*3600/RC[-20]*RC[-18] -> 0 | AA59: =R[-1]C -> [{0,[{0,9995},{1,5}],[{200000,1,1,70},{200001,1,1,70},{200002,1,1,70},{200003,1,1,70},{200006,1,1,70},{200010,1,1,1},{200011,1,1,1},{200012,1,1,1},{200013,1,1,1},{200015,1,1,1},{200016,1,1,1},{200017,1,1,1},{200019,1,1,1},{201000,1,1,70},{201001,1,1,70},{201002,1,1,70},{201003,1,1,70},{201006,1,1,70},{201010,1,1,1},{201011,1,1,1},{201012,1,1,1},{201013,1,1,1},{201015,1,1,1},{201016,1,1,1},{201017,1,1,1},{201019,1,1,1},{202000,1,1,70},{202001,1,1,30},{202002,1,1,30},{202003,1,1,30},{202006,1,1,30},{202010,1,1,1},{202011,1,1,1},{202012,1,1,1},{202013,1,1,1},{202015,1,1,1},{202016,1,1,1},{202017,1,1,1},{202019,1,1,1},{110079,1,1,0},{110003,1,1,0},{110004,1,1,100},{110005,1,1,100},{110010,1,1,0},{110011,1,1,0},{110012,1,1,0},{110009,1,5,100}]}] | AB59: =R[-1]C -> [{0,[{1,100}],[{200000,1,1,70},{200001,1,1,70},{200002,1,1,70},{200003,1,1,70},{200006,1,1,70},{200010,1,1,12},{200011,1,1,12},{200012,1,1,12},{200013,1,1,12},{200015,1,1,12},{200016,1,1,12},{200017,1,1,12},{200019,1,1,12},{201000,1,1,70},{201001,1,1,70},{201002,1,1,70},{201003,1,1,70},{201006,1,1,70},{201010,1,1,12},{201011,1,1,12},{201012,1,1,12},{201013,1,1,12},{201015,1,1,12},{201016,1,1,12},{201017,1,1,12},{201019,1,1,12},{202000,1,1,70},{202001,1,1,70},{202002,1,1,70},{202003,1,1,70},{202006,1,1,70},{202010,1,1,12},{202011,1,1,12},{202012,1,1,12},{202013,1,1,12},{202015,1,1,12},{202016,1,1,12},{202017,1,1,12},{202019,1,1,12}]},{0,[{3,100}],[{110079,1,2,3},{110003,1,2,1},{110004,1,1,3},{110005,1,1,3},{110010,1,1,0},{110011,1,1,0},{110012,1,1,0}]},{0,[{10,100}],[{110009,1,1000,1}]}] | AC59: 11864
A60: 10057 | B60: 第57关 | C60: 10003 | D60: =R[-5]C+1 -> 12 | E60: =R[-5]C -> 2 | F60: 30 | G60: 10 | H60: 10 | I60: [{6050, 100}] | J60: 98 | K60: 0 | L60: 2 | N60: [{110009, 10000}, {110079,58}] | O60: {20,10} | P60: 6250 | Q60: 6904 | R60: 60 | S60: 20 | T60: 40 | U60: 60 | V60: 19104 | W60: yewai | X60: [{200030,1},{201030,1},{202030,1}] | Y60: =RC[-15]*3600/RC[-19]*RC[-17] -> 117600 | Z60: =RC[-15]*3600/RC[-20]*RC[-18] -> 0 | AA60: =R[-1]C -> [{0,[{0,9995},{1,5}],[{200000,1,1,70},{200001,1,1,70},{200002,1,1,70},{200003,1,1,70},{200006,1,1,70},{200010,1,1,1},{200011,1,1,1},{200012,1,1,1},{200013,1,1,1},{200015,1,1,1},{200016,1,1,1},{200017,1,1,1},{200019,1,1,1},{201000,1,1,70},{201001,1,1,70},{201002,1,1,70},{201003,1,1,70},{201006,1,1,70},{201010,1,1,1},{201011,1,1,1},{201012,1,1,1},{201013,1,1,1},{201015,1,1,1},{201016,1,1,1},{201017,1,1,1},{201019,1,1,1},{202000,1,1,70},{202001,1,1,30},{202002,1,1,30},{202003,1,1,30},{202006,1,1,30},{202010,1,1,1},{202011,1,1,1},{202012,1,1,1},{202013,1,1,1},{202015,1,1,1},{202016,1,1,1},{202017,1,1,1},{202019,1,1,1},{110079,1,1,0},{110003,1,1,0},{110004,1,1,100},{110005,1,1,100},{110010,1,1,0},{110011,1,1,0},{110012,1,1,0},{110009,1,5,100}]}] | AB60: =R[-1]C -> [{0,[{1,100}],[{200000,1,1,70},{200001,1,1,70},{200002,1,1,70},{200003,1,1,70},{200006,1,1,70},{200010,1,1,12},{200011,1,1,12},{200012,1,1,12},{200013,1,1,12},{200015,1,1,12},{200016,1,1,12},{200017,1,1,12},{200019,1,1,12},{201000,1,1,70},{201001,1,1,70},{201002,1,1,70},{201003,1,1,70},{201006,1,1,70},{201010,1,1,12},{201011,1,1,12},{201012,1,1,12},{201013,1,1,12},{201015,1,1,12},{201016,1,1,12},{201017,1,1,12},{201019,1,1,12},{202000,1,1,70},{202001,1,1,70},{202002,1,1,70},{202003,1,1,70},{202006,1,1,70},{202010,1,1,12},{202011,1,1,12},{202012,1,1,12},{202013,1,1,12},{202015,1,1,12},{202016,1,1,12},{202017,1,1,12},{202019,1,1,12}]},{0,[{3,100}],[{110079,1,2,3},{110003,1,2,1},{110004,1,1,3},{110005,1,1,3},{110010,1,1,0},{110011,1,1,0},{110012,1,1,0}]},{0,[{10,100}],[{110009,1,1000,1}]}] | AC60: 12014
A61: 10058 | B61: 第58关 | C61: 10004 | D61: =R[-5]C+1 -> 12 | E61: =R[-5]C -> 3 | F61: 30 | G61: 10 | H61: 10 | I61: [{6050, 100}] | J61: 99 | K61: 0 | L61: 2 | N61: [{110009, 10000}, {110079,59}] | O61: {20,10} | P61: 6250 | Q61: 6904 | R61: 60 | S61: 20 | T61: 40 | U61: 60 | V61: 19104 | W61: yewai | X61: [{200030,1},{201030,1},{202030,1}] | Y61: =RC[-15]*3600/RC[-19]*RC[-17] -> 118800 | Z61: =RC[-15]*3600/RC[-20]*RC[-18] -> 0 | AA61: =R[-1]C -> [{0,[{0,9995},{1,5}],[{200000,1,1,70},{200001,1,1,70},{200002,1,1,70},{200003,1,1,70},{200006,1,1,70},{200010,1,1,1},{200011,1,1,1},{200012,1,1,1},{200013,1,1,1},{200015,1,1,1},{200016,1,1,1},{200017,1,1,1},{200019,1,1,1},{201000,1,1,70},{201001,1,1,70},{201002,1,1,70},{201003,1,1,70},{201006,1,1,70},{201010,1,1,1},{201011,1,1,1},{201012,1,1,1},{201013,1,1,1},{201015,1,1,1},{201016,1,1,1},{201017,1,1,1},{201019,1,1,1},{202000,1,1,70},{202001,1,1,30},{202002,1,1,30},{202003,1,1,30},{202006,1,1,30},{202010,1,1,1},{202011,1,1,1},{202012,1,1,1},{202013,1,1,1},{202015,1,1,1},{202016,1,1,1},{202017,1,1,1},{202019,1,1,1},{110079,1,1,0},{110003,1,1,0},{110004,1,1,100},{110005,1,1,100},{110010,1,1,0},{110011,1,1,0},{110012,1,1,0},{110009,1,5,100}]}] | AB61: =R[-1]C -> [{0,[{1,100}],[{200000,1,1,70},{200001,1,1,70},{200002,1,1,70},{200003,1,1,70},{200006,1,1,70},{200010,1,1,12},{200011,1,1,12},{200012,1,1,12},{200013,1,1,12},{200015,1,1,12},{200016,1,1,12},{200017,1,1,12},{200019,1,1,12},{201000,1,1,70},{201001,1,1,70},{201002,1,1,70},{201003,1,1,70},{201006,1,1,70},{201010,1,1,12},{201011,1,1,12},{201012,1,1,12},{201013,1,1,12},{201015,1,1,12},{201016,1,1,12},{201017,1,1,12},{201019,1,1,12},{202000,1,1,70},{202001,1,1,70},{202002,1,1,70},{202003,1,1,70},{202006,1,1,70},{202010,1,1,12},{202011,1,1,12},{202012,1,1,12},{202013,1,1,12},{202015,1,1,12},{202016,1,1,12},{202017,1,1,12},{202019,1,1,12}]},{0,[{3,100}],[{110079,1,2,3},{110003,1,2,1},{110004,1,1,3},{110005,1,1,3},{110010,1,1,0},{110011,1,1,0},{110012,1,1,0}]},{0,[{10,100}],[{110009,1,1000,1}]}] | AC61: 12278
A62: 10059 | B62: 第59关 | C62: 10005 | D62: =R[-5]C+1 -> 12 | E62: =R[-5]C -> 4 | F62: 30 | G62: 10 | H62: 10 | I62: [{6050, 100}] | J62: 100 | K62: 0 | L62: 2 | N62: [{110009, 10000}, {110079,60}] | O62: {20,10} | P62: 6250 | Q62: 6904 | R62: 60 | S62: 20 | T62: 40 | U62: 60 | V62: 19104 | W62: yewai | X62: [{200030,1},{201030,1},{202030,1}] | Y62: =RC[-15]*3600/RC[-19]*RC[-17] -> 120000 | Z62: =RC[-15]*3600/RC[-20]*RC[-18] -> 0 | AA62: =R[-1]C -> [{0,[{0,9995},{1,5}],[{200000,1,1,70},{200001,1,1,70},{200002,1,1,70},{200003,1,1,70},{200006,1,1,70},{200010,1,1,1},{200011,1,1,1},{200012,1,1,1},{200013,1,1,1},{200015,1,1,1},{200016,1,1,1},{200017,1,1,1},{200019,1,1,1},{201000,1,1,70},{201001,1,1,70},{201002,1,1,70},{201003,1,1,70},{201006,1,1,70},{201010,1,1,1},{201011,1,1,1},{201012,1,1,1},{201013,1,1,1},{201015,1,1,1},{201016,1,1,1},{201017,1,1,1},{201019,1,1,1},{202000,1,1,70},{202001,1,1,30},{202002,1,1,30},{202003,1,1,30},{202006,1,1,30},{202010,1,1,1},{202011,1,1,1},{202012,1,1,1},{202013,1,1,1},{202015,1,1,1},{202016,1,1,1},{202017,1,1,1},{202019,1,1,1},{110079,1,1,0},{110003,1,1,0},{110004,1,1,100},{110005,1,1,100},{110010,1,1,0},{110011,1,1,0},{110012,1,1,0},{110009,1,5,100}]}] | AB62: =R[-1]C -> [{0,[{1,100}],[{200000,1,1,70},{200001,1,1,70},{200002,1,1,70},{200003,1,1,70},{200006,1,1,70},{200010,1,1,12},{200011,1,1,12},{200012,1,1,12},{200013,1,1,12},{200015,1,1,12},{200016,1,1,12},{200017,1,1,12},{200019,1,1,12},{201000,1,1,70},{201001,1,1,70},{201002,1,1,70},{201003,1,1,70},{201006,1,1,70},{201010,1,1,12},{201011,1,1,12},{201012,1,1,12},{201013,1,1,12},{201015,1,1,12},{201016,1,1,12},{201017,1,1,12},{201019,1,1,12},{202000,1,1,70},{202001,1,1,70},{202002,1,1,70},{202003,1,1,70},{202006,1,1,70},{202010,1,1,12},{202011,1,1,12},{202012,1,1,12},{202013,1,1,12},{202015,1,1,12},{202016,1,1,12},{202017,1,1,12},{202019,1,1,12}]},{0,[{3,100}],[{110079,1,2,3},{110003,1,2,1},{110004,1,1,3},{110005,1,1,3},{110010,1,1,0},{110011,1,1,0},{110012,1,1,0}]},{0,[{10,100}],[{110009,1,1000,1}]}] | AC62: 12487
A63: 10060 | B63: 第60关 | C63: 10006 | D63: =R[-5]C+1 -> 12 | E63: =R[-5]C -> 5 | F63: 30 | G63: 10 | H63: 10 | I63: [{6050, 100}] | J63: 101 | K63: 0 | L63: 2 | N63: [{110009, 10000}, {110079,61}] | O63: {20,10} | P63: 6250 | Q63: 6904 | R63: 60 | S63: 20 | T63: 40 | U63: 60 | V63: 19104 | W63: yewai | X63: [{200030,1},{201030,1},{202030,1}] | Y63: =RC[-15]*3600/RC[-19]*RC[-17] -> 121200 | Z63: =RC[-15]*3600/RC[-20]*RC[-18] -> 0 | AA63: =R[-1]C -> [{0,[{0,9995},{1,5}],[{200000,1,1,70},{200001,1,1,70},{200002,1,1,70},{200003,1,1,70},{200006,1,1,70},{200010,1,1,1},{200011,1,1,1},{200012,1,1,1},{200013,1,1,1},{200015,1,1,1},{200016,1,1,1},{200017,1,1,1},{200019,1,1,1},{201000,1,1,70},{201001,1,1,70},{201002,1,1,70},{201003,1,1,70},{201006,1,1,70},{201010,1,1,1},{201011,1,1,1},{201012,1,1,1},{201013,1,1,1},{201015,1,1,1},{201016,1,1,1},{201017,1,1,1},{201019,1,1,1},{202000,1,1,70},{202001,1,1,30},{202002,1,1,30},{202003,1,1,30},{202006,1,1,30},{202010,1,1,1},{202011,1,1,1},{202012,1,1,1},{202013,1,1,1},{202015,1,1,1},{202016,1,1,1},{202017,1,1,1},{202019,1,1,1},{110079,1,1,0},{110003,1,1,0},{110004,1,1,100},{110005,1,1,100},{110010,1,1,0},{110011,1,1,0},{110012,1,1,0},{110009,1,5,100}]}] | AB63: =R[-1]C -> [{0,[{1,100}],[{200000,1,1,70},{200001,1,1,70},{200002,1,1,70},{200003,1,1,70},{200006,1,1,70},{200010,1,1,12},{200011,1,1,12},{200012,1,1,12},{200013,1,1,12},{200015,1,1,12},{200016,1,1,12},{200017,1,1,12},{200019,1,1,12},{201000,1,1,70},{201001,1,1,70},{201002,1,1,70},{201003,1,1,70},{201006,1,1,70},{201010,1,1,12},{201011,1,1,12},{201012,1,1,12},{201013,1,1,12},{201015,1,1,12},{201016,1,1,12},{201017,1,1,12},{201019,1,1,12},{202000,1,1,70},{202001,1,1,70},{202002,1,1,70},{202003,1,1,70},{202006,1,1,70},{202010,1,1,12},{202011,1,1,12},{202012,1,1,12},{202013,1,1,12},{202015,1,1,12},{202016,1,1,12},{202017,1,1,12},{202019,1,1,12}]},{0,[{3,100}],[{110079,1,2,3},{110003,1,2,1},{110004,1,1,3},{110005,1,1,3},{110010,1,1,0},{110011,1,1,0},{110012,1,1,0}]},{0,[{10,100}],[{110009,1,1000,1}]}] | AC63: 12575
A64: 10061 | B64: 第61关 | C64: 10002 | D64: =R[-5]C+1 -> 13 | E64: =R[-5]C -> 1 | F64: 30 | G64: 10 | H64: 10 | I64: [{6050, 100}] | J64: 102 | K64: 0 | L64: 2 | N64: [{110009, 10000}, {110079,62}] | O64: {20,10} | P64: 6250 | Q64: 7001 | R64: 60 | S64: 20 | T64: 40 | U64: 60 | V64: 19104 | W64: yewai | X64: [{200030,1},{201030,1},{202030,1}] | Y64: =RC[-15]*3600/RC[-19]*RC[-17] -> 122400 | Z64: =RC[-15]*3600/RC[-20]*RC[-18] -> 0 | AA64: =R[-1]C -> [{0,[{0,9995},{1,5}],[{200000,1,1,70},{200001,1,1,70},{200002,1,1,70},{200003,1,1,70},{200006,1,1,70},{200010,1,1,1},{200011,1,1,1},{200012,1,1,1},{200013,1,1,1},{200015,1,1,1},{200016,1,1,1},{200017,1,1,1},{200019,1,1,1},{201000,1,1,70},{201001,1,1,70},{201002,1,1,70},{201003,1,1,70},{201006,1,1,70},{201010,1,1,1},{201011,1,1,1},{201012,1,1,1},{201013,1,1,1},{201015,1,1,1},{201016,1,1,1},{201017,1,1,1},{201019,1,1,1},{202000,1,1,70},{202001,1,1,30},{202002,1,1,30},{202003,1,1,30},{202006,1,1,30},{202010,1,1,1},{202011,1,1,1},{202012,1,1,1},{202013,1,1,1},{202015,1,1,1},{202016,1,1,1},{202017,1,1,1},{202019,1,1,1},{110079,1,1,0},{110003,1,1,0},{110004,1,1,100},{110005,1,1,100},{110010,1,1,0},{110011,1,1,0},{110012,1,1,0},{110009,1,5,100}]}] | AB64: =R[-1]C -> [{0,[{1,100}],[{200000,1,1,70},{200001,1,1,70},{200002,1,1,70},{200003,1,1,70},{200006,1,1,70},{200010,1,1,12},{200011,1,1,12},{200012,1,1,12},{200013,1,1,12},{200015,1,1,12},{200016,1,1,12},{200017,1,1,12},{200019,1,1,12},{201000,1,1,70},{201001,1,1,70},{201002,1,1,70},{201003,1,1,70},{201006,1,1,70},{201010,1,1,12},{201011,1,1,12},{201012,1,1,12},{201013,1,1,12},{201015,1,1,12},{201016,1,1,12},{201017,1,1,12},{201019,1,1,12},{202000,1,1,70},{202001,1,1,70},{202002,1,1,70},{202003,1,1,70},{202006,1,1,70},{202010,1,1,12},{202011,1,1,12},{202012,1,1,12},{202013,1,1,12},{202015,1,1,12},{202016,1,1,12},{202017,1,1,12},{202019,1,1,12}]},{0,[{3,100}],[{110079,1,2,3},{110003,1,2,1},{110004,1,1,3},{110005,1,1,3},{110010,1,1,0},{110011,1,1,0},{110012,1,1,0}]},{0,[{10,100}],[{110009,1,1000,1}]}] | AC64: 12668
A65: 10062 | B65: 第62关 | C65: 10003 | D65: =R[-5]C+1 -> 13 | E65: =R[-5]C -> 2 | F65: 30 | G65: 10 | H65: 10 | I65: [{6050, 100}] | J65: 103 | K65: 0 | L65: 2 | N65: [{110009, 10000}, {110079,63}] | O65: {20,10} | P65: 6250 | Q65: 7001 | R65: 60 | S65: 20 | T65: 40 | U65: 60 | V65: 19104 | W65: yewai | X65: [{200030,1},{201030,1},{202030,1}] | Y65: =RC[-15]*3600/RC[-19]*RC[-17] -> 123600 | Z65: =RC[-15]*3600/RC[-20]*RC[-18] -> 0 | AA65: =R[-1]C -> [{0,[{0,9995},{1,5}],[{200000,1,1,70},{200001,1,1,70},{200002,1,1,70},{200003,1,1,70},{200006,1,1,70},{200010,1,1,1},{200011,1,1,1},{200012,1,1,1},{200013,1,1,1},{200015,1,1,1},{200016,1,1,1},{200017,1,1,1},{200019,1,1,1},{201000,1,1,70},{201001,1,1,70},{201002,1,1,70},{201003,1,1,70},{201006,1,1,70},{201010,1,1,1},{201011,1,1,1},{201012,1,1,1},{201013,1,1,1},{201015,1,1,1},{201016,1,1,1},{201017,1,1,1},{201019,1,1,1},{202000,1,1,70},{202001,1,1,30},{202002,1,1,30},{202003,1,1,30},{202006,1,1,30},{202010,1,1,1},{202011,1,1,1},{202012,1,1,1},{202013,1,1,1},{202015,1,1,1},{202016,1,1,1},{202017,1,1,1},{202019,1,1,1},{110079,1,1,0},{110003,1,1,0},{110004,1,1,100},{110005,1,1,100},{110010,1,1,0},{110011,1,1,0},{110012,1,1,0},{110009,1,5,100}]}] | AB65: =R[-1]C -> [{0,[{1,100}],[{200000,1,1,70},{200001,1,1,70},{200002,1,1,70},{200003,1,1,70},{200006,1,1,70},{200010,1,1,12},{200011,1,1,12},{200012,1,1,12},{200013,1,1,12},{200015,1,1,12},{200016,1,1,12},{200017,1,1,12},{200019,1,1,12},{201000,1,1,70},{201001,1,1,70},{201002,1,1,70},{201003,1,1,70},{201006,1,1,70},{201010,1,1,12},{201011,1,1,12},{201012,1,1,12},{201013,1,1,12},{201015,1,1,12},{201016,1,1,12},{201017,1,1,12},{201019,1,1,12},{202000,1,1,70},{202001,1,1,70},{202002,1,1,70},{202003,1,1,70},{202006,1,1,70},{202010,1,1,12},{202011,1,1,12},{202012,1,1,12},{202013,1,1,12},{202015,1,1,12},{202016,1,1,12},{202017,1,1,12},{202019,1,1,12}]},{0,[{3,100}],[{110079,1,2,3},{110003,1,2,1},{110004,1,1,3},{110005,1,1,3},{110010,1,1,0},{110011,1,1,0},{110012,1,1,0}]},{0,[{10,100}],[{110009,1,1000,1}]}] | AC65: 12762
A66: 10063 | B66: 第63关 | C66: 10004 | D66: =R[-5]C+1 -> 13 | E66: =R[-5]C -> 3 | F66: 30 | G66: 10 | H66: 10 | I66: [{6050, 100}] | J66: 104 | K66: 0 | L66: 2 | N66: [{110009, 10000}, {110079,64}] | O66: {20,10} | P66: 6250 | Q66: 7001 | R66: 60 | S66: 20 | T66: 40 | U66: 60 | V66: 19104 | W66: yewai | X66: [{200030,1},{201030,1},{202030,1}] | Y66: =RC[-15]*3600/RC[-19]*RC[-17] -> 124800 | Z66: =RC[-15]*3600/RC[-20]*RC[-18] -> 0 | AA66: =R[-1]C -> [{0,[{0,9995},{1,5}],[{200000,1,1,70},{200001,1,1,70},{200002,1,1,70},{200003,1,1,70},{200006,1,1,70},{200010,1,1,1},{200011,1,1,1},{200012,1,1,1},{200013,1,1,1},{200015,1,1,1},{200016,1,1,1},{200017,1,1,1},{200019,1,1,1},{201000,1,1,70},{201001,1,1,70},{201002,1,1,70},{201003,1,1,70},{201006,1,1,70},{201010,1,1,1},{201011,1,1,1},{201012,1,1,1},{201013,1,1,1},{201015,1,1,1},{201016,1,1,1},{201017,1,1,1},{201019,1,1,1},{202000,1,1,70},{202001,1,1,30},{202002,1,1,30},{202003,1,1,30},{202006,1,1,30},{202010,1,1,1},{202011,1,1,1},{202012,1,1,1},{202013,1,1,1},{202015,1,1,1},{202016,1,1,1},{202017,1,1,1},{202019,1,1,1},{110079,1,1,0},{110003,1,1,0},{110004,1,1,100},{110005,1,1,100},{110010,1,1,0},{110011,1,1,0},{110012,1,1,0},{110009,1,5,100}]}] | AB66: =R[-1]C -> [{0,[{1,100}],[{200000,1,1,70},{200001,1,1,70},{200002,1,1,70},{200003,1,1,70},{200006,1,1,70},{200010,1,1,12},{200011,1,1,12},{200012,1,1,12},{200013,1,1,12},{200015,1,1,12},{200016,1,1,12},{200017,1,1,12},{200019,1,1,12},{201000,1,1,70},{201001,1,1,70},{201002,1,1,70},{201003,1,1,70},{201006,1,1,70},{201010,1,1,12},{201011,1,1,12},{201012,1,1,12},{201013,1,1,12},{201015,1,1,12},{201016,1,1,12},{201017,1,1,12},{201019,1,1,12},{202000,1,1,70},{202001,1,1,70},{202002,1,1,70},{202003,1,1,70},{202006,1,1,70},{202010,1,1,12},{202011,1,1,12},{202012,1,1,12},{202013,1,1,12},{202015,1,1,12},{202016,1,1,12},{202017,1,1,12},{202019,1,1,12}]},{0,[{3,100}],[{110079,1,2,3},{110003,1,2,1},{110004,1,1,3},{110005,1,1,3},{110010,1,1,0},{110011,1,1,0},{110012,1,1,0}]},{0,[{10,100}],[{110009,1,1000,1}]}] | AC66: 12854
A67: 10064 | B67: 第64关 | C67: 10005 | D67: =R[-5]C+1 -> 13 | E67: =R[-5]C -> 4 | F67: 30 | G67: 10 | H67: 10 | I67: [{6050, 100}] | J67: 105 | K67: 0 | L67: 2 | N67: [{110009, 10000}, {110079,65}] | O67: {20,10} | P67: 6250 | Q67: 7001 | R67: 60 | S67: 20 | T67: 40 | U67: 60 | V67: 19104 | W67: yewai | X67: [{200030,1},{201030,1},{202030,1}] | Y67: =RC[-15]*3600/RC[-19]*RC[-17] -> 126000 | Z67: =RC[-15]*3600/RC[-20]*RC[-18] -> 0 | AA67: =R[-1]C -> [{0,[{0,9995},{1,5}],[{200000,1,1,70},{200001,1,1,70},{200002,1,1,70},{200003,1,1,70},{200006,1,1,70},{200010,1,1,1},{200011,1,1,1},{200012,1,1,1},{200013,1,1,1},{200015,1,1,1},{200016,1,1,1},{200017,1,1,1},{200019,1,1,1},{201000,1,1,70},{201001,1,1,70},{201002,1,1,70},{201003,1,1,70},{201006,1,1,70},{201010,1,1,1},{201011,1,1,1},{201012,1,1,1},{201013,1,1,1},{201015,1,1,1},{201016,1,1,1},{201017,1,1,1},{201019,1,1,1},{202000,1,1,70},{202001,1,1,30},{202002,1,1,30},{202003,1,1,30},{202006,1,1,30},{202010,1,1,1},{202011,1,1,1},{202012,1,1,1},{202013,1,1,1},{202015,1,1,1},{202016,1,1,1},{202017,1,1,1},{202019,1,1,1},{110079,1,1,0},{110003,1,1,0},{110004,1,1,100},{110005,1,1,100},{110010,1,1,0},{110011,1,1,0},{110012,1,1,0},{110009,1,5,100}]}] | AB67: =R[-1]C -> [{0,[{1,100}],[{200000,1,1,70},{200001,1,1,70},{200002,1,1,70},{200003,1,1,70},{200006,1,1,70},{200010,1,1,12},{200011,1,1,12},{200012,1,1,12},{200013,1,1,12},{200015,1,1,12},{200016,1,1,12},{200017,1,1,12},{200019,1,1,12},{201000,1,1,70},{201001,1,1,70},{201002,1,1,70},{201003,1,1,70},{201006,1,1,70},{201010,1,1,12},{201011,1,1,12},{201012,1,1,12},{201013,1,1,12},{201015,1,1,12},{201016,1,1,12},{201017,1,1,12},{201019,1,1,12},{202000,1,1,70},{202001,1,1,70},{202002,1,1,70},{202003,1,1,70},{202006,1,1,70},{202010,1,1,12},{202011,1,1,12},{202012,1,1,12},{202013,1,1,12},{202015,1,1,12},{202016,1,1,12},{202017,1,1,12},{202019,1,1,12}]},{0,[{3,100}],[{110079,1,2,3},{110003,1,2,1},{110004,1,1,3},{110005,1,1,3},{110010,1,1,0},{110011,1,1,0},{110012,1,1,0}]},{0,[{10,100}],[{110009,1,1000,1}]}] | AC67: 12949
A68: 10065 | B68: 第65关 | C68: 10006 | D68: =R[-5]C+1 -> 13 | E68: =R[-5]C -> 5 | F68: 30 | G68: 10 | H68: 10 | I68: [{6050, 100}] | J68: 106 | K68: 0 | L68: 2 | N68: [{110009, 10000}, {110079,66}] | O68: {20,10} | P68: 6250 | Q68: 7001 | R68: 60 | S68: 20 | T68: 40 | U68: 60 | V68: 19104 | W68: yewai | X68: [{200030,1},{201030,1},{202030,1}] | Y68: =RC[-15]*3600/RC[-19]*RC[-17] -> 127200 | Z68: =RC[-15]*3600/RC[-20]*RC[-18] -> 0 | AA68: =R[-1]C -> [{0,[{0,9995},{1,5}],[{200000,1,1,70},{200001,1,1,70},{200002,1,1,70},{200003,1,1,70},{200006,1,1,70},{200010,1,1,1},{200011,1,1,1},{200012,1,1,1},{200013,1,1,1},{200015,1,1,1},{200016,1,1,1},{200017,1,1,1},{200019,1,1,1},{201000,1,1,70},{201001,1,1,70},{201002,1,1,70},{201003,1,1,70},{201006,1,1,70},{201010,1,1,1},{201011,1,1,1},{201012,1,1,1},{201013,1,1,1},{201015,1,1,1},{201016,1,1,1},{201017,1,1,1},{201019,1,1,1},{202000,1,1,70},{202001,1,1,30},{202002,1,1,30},{202003,1,1,30},{202006,1,1,30},{202010,1,1,1},{202011,1,1,1},{202012,1,1,1},{202013,1,1,1},{202015,1,1,1},{202016,1,1,1},{202017,1,1,1},{202019,1,1,1},{110079,1,1,0},{110003,1,1,0},{110004,1,1,100},{110005,1,1,100},{110010,1,1,0},{110011,1,1,0},{110012,1,1,0},{110009,1,5,100}]}] | AB68: =R[-1]C -> [{0,[{1,100}],[{200000,1,1,70},{200001,1,1,70},{200002,1,1,70},{200003,1,1,70},{200006,1,1,70},{200010,1,1,12},{200011,1,1,12},{200012,1,1,12},{200013,1,1,12},{200015,1,1,12},{200016,1,1,12},{200017,1,1,12},{200019,1,1,12},{201000,1,1,70},{201001,1,1,70},{201002,1,1,70},{201003,1,1,70},{201006,1,1,70},{201010,1,1,12},{201011,1,1,12},{201012,1,1,12},{201013,1,1,12},{201015,1,1,12},{201016,1,1,12},{201017,1,1,12},{201019,1,1,12},{202000,1,1,70},{202001,1,1,70},{202002,1,1,70},{202003,1,1,70},{202006,1,1,70},{202010,1,1,12},{202011,1,1,12},{202012,1,1,12},{202013,1,1,12},{202015,1,1,12},{202016,1,1,12},{202017,1,1,12},{202019,1,1,12}]},{0,[{3,100}],[{110079,1,2,3},{110003,1,2,1},{110004,1,1,3},{110005,1,1,3},{110010,1,1,0},{110011,1,1,0},{110012,1,1,0}]},{0,[{10,100}],[{110009,1,1000,1}]}] | AC68: 13044
A69: 10066 | B69: 第66关 | C69: 10002 | D69: =R[-5]C+1 -> 14 | E69: =R[-5]C -> 1 | F69: 30 | G69: 10 | H69: 10 | I69: [{6050, 100}] | J69: 107 | K69: 0 | L69: 2 | N69: [{110009, 10000}, {110079,67}] | O69: {20,10} | P69: 6250 | Q69: 7001 | R69: 60 | S69: 20 | T69: 40 | U69: 60 | V69: 19104 | W69: yewai | X69: [{200030,1},{201030,1},{202030,1}] | Y69: =RC[-15]*3600/RC[-19]*RC[-17] -> 128400 | Z69: =RC[-15]*3600/RC[-20]*RC[-18] -> 0 | AA69: =R[-1]C -> [{0,[{0,9995},{1,5}],[{200000,1,1,70},{200001,1,1,70},{200002,1,1,70},{200003,1,1,70},{200006,1,1,70},{200010,1,1,1},{200011,1,1,1},{200012,1,1,1},{200013,1,1,1},{200015,1,1,1},{200016,1,1,1},{200017,1,1,1},{200019,1,1,1},{201000,1,1,70},{201001,1,1,70},{201002,1,1,70},{201003,1,1,70},{201006,1,1,70},{201010,1,1,1},{201011,1,1,1},{201012,1,1,1},{201013,1,1,1},{201015,1,1,1},{201016,1,1,1},{201017,1,1,1},{201019,1,1,1},{202000,1,1,70},{202001,1,1,30},{202002,1,1,30},{202003,1,1,30},{202006,1,1,30},{202010,1,1,1},{202011,1,1,1},{202012,1,1,1},{202013,1,1,1},{202015,1,1,1},{202016,1,1,1},{202017,1,1,1},{202019,1,1,1},{110079,1,1,0},{110003,1,1,0},{110004,1,1,100},{110005,1,1,100},{110010,1,1,0},{110011,1,1,0},{110012,1,1,0},{110009,1,5,100}]}] | AB69: =R[-1]C -> [{0,[{1,100}],[{200000,1,1,70},{200001,1,1,70},{200002,1,1,70},{200003,1,1,70},{200006,1,1,70},{200010,1,1,12},{200011,1,1,12},{200012,1,1,12},{200013,1,1,12},{200015,1,1,12},{200016,1,1,12},{200017,1,1,12},{200019,1,1,12},{201000,1,1,70},{201001,1,1,70},{201002,1,1,70},{201003,1,1,70},{201006,1,1,70},{201010,1,1,12},{201011,1,1,12},{201012,1,1,12},{201013,1,1,12},{201015,1,1,12},{201016,1,1,12},{201017,1,1,12},{201019,1,1,12},{202000,1,1,70},{202001,1,1,70},{202002,1,1,70},{202003,1,1,70},{202006,1,1,70},{202010,1,1,12},{202011,1,1,12},{202012,1,1,12},{202013,1,1,12},{202015,1,1,12},{202016,1,1,12},{202017,1,1,12},{202019,1,1,12}]},{0,[{3,100}],[{110079,1,2,3},{110003,1,2,1},{110004,1,1,3},{110005,1,1,3},{110010,1,1,0},{110011,1,1,0},{110012,1,1,0}]},{0,[{10,100}],[{110009,1,1000,1}]}] | AC69: 13139
A70: 10067 | B70: 第67关 | C70: 10003 | D70: =R[-5]C+1 -> 14 | E70: =R[-5]C -> 2 | F70: 30 | G70: 10 | H70: 10 | I70: [{6050, 100}] | J70: 108 | K70: 0 | L70: 2 | N70: [{110009, 10000}, {110079,68}] | O70: {20,10} | P70: 6250 | Q70: 7001 | R70: 60 | S70: 20 | T70: 40 | U70: 60 | V70: 19104 | W70: yewai | X70: [{200030,1},{201030,1},{202030,1}] | Y70: =RC[-15]*3600/RC[-19]*RC[-17] -> 129600 | Z70: =RC[-15]*3600/RC[-20]*RC[-18] -> 0 | AA70: =R[-1]C -> [{0,[{0,9995},{1,5}],[{200000,1,1,70},{200001,1,1,70},{200002,1,1,70},{200003,1,1,70},{200006,1,1,70},{200010,1,1,1},{200011,1,1,1},{200012,1,1,1},{200013,1,1,1},{200015,1,1,1},{200016,1,1,1},{200017,1,1,1},{200019,1,1,1},{201000,1,1,70},{201001,1,1,70},{201002,1,1,70},{201003,1,1,70},{201006,1,1,70},{201010,1,1,1},{201011,1,1,1},{201012,1,1,1},{201013,1,1,1},{201015,1,1,1},{201016,1,1,1},{201017,1,1,1},{201019,1,1,1},{202000,1,1,70},{202001,1,1,30},{202002,1,1,30},{202003,1,1,30},{202006,1,1,30},{202010,1,1,1},{202011,1,1,1},{202012,1,1,1},{202013,1,1,1},{202015,1,1,1},{202016,1,1,1},{202017,1,1,1},{202019,1,1,1},{110079,1,1,0},{110003,1,1,0},{110004,1,1,100},{110005,1,1,100},{110010,1,1,0},{110011,1,1,0},{110012,1,1,0},{110009,1,5,100}]}] | AB70: =R[-1]C -> [{0,[{1,100}],[{200000,1,1,70},{200001,1,1,70},{200002,1,1,70},{200003,1,1,70},{200006,1,1,70},{200010,1,1,12},{200011,1,1,12},{200012,1,1,12},{200013,1,1,12},{200015,1,1,12},{200016,1,1,12},{200017,1,1,12},{200019,1,1,12},{201000,1,1,70},{201001,1,1,70},{201002,1,1,70},{201003,1,1,70},{201006,1,1,70},{201010,1,1,12},{201011,1,1,12},{201012,1,1,12},{201013,1,1,12},{201015,1,1,12},{201016,1,1,12},{201017,1,1,12},{201019,1,1,12},{202000,1,1,70},{202001,1,1,70},{202002,1,1,70},{202003,1,1,70},{202006,1,1,70},{202010,1,1,12},{202011,1,1,12},{202012,1,1,12},{202013,1,1,12},{202015,1,1,12},{202016,1,1,12},{202017,1,1,12},{202019,1,1,12}]},{0,[{3,100}],[{110079,1,2,3},{110003,1,2,1},{110004,1,1,3},{110005,1,1,3},{110010,1,1,0},{110011,1,1,0},{110012,1,1,0}]},{0,[{10,100}],[{110009,1,1000,1}]}] | AC70: 13234
A71: 10068 | B71: 第68关 | C71: 10004 | D71: =R[-5]C+1 -> 14 | E71: =R[-5]C -> 3 | F71: 30 | G71: 10 | H71: 10 | I71: [{6050, 100}] | J71: 109 | K71: 0 | L71: 2 | N71: [{110009, 10000}, {110079,69}] | O71: {20,10} | P71: 6250 | Q71: 7001 | R71: 60 | S71: 20 | T71: 40 | U71: 60 | V71: 19104 | W71: yewai | X71: [{200030,1},{201030,1},{202030,1}] | Y71: =RC[-15]*3600/RC[-19]*RC[-17] -> 130800 | Z71: =RC[-15]*3600/RC[-20]*RC[-18] -> 0 | AA71: =R[-1]C -> [{0,[{0,9995},{1,5}],[{200000,1,1,70},{200001,1,1,70},{200002,1,1,70},{200003,1,1,70},{200006,1,1,70},{200010,1,1,1},{200011,1,1,1},{200012,1,1,1},{200013,1,1,1},{200015,1,1,1},{200016,1,1,1},{200017,1,1,1},{200019,1,1,1},{201000,1,1,70},{201001,1,1,70},{201002,1,1,70},{201003,1,1,70},{201006,1,1,70},{201010,1,1,1},{201011,1,1,1},{201012,1,1,1},{201013,1,1,1},{201015,1,1,1},{201016,1,1,1},{201017,1,1,1},{201019,1,1,1},{202000,1,1,70},{202001,1,1,30},{202002,1,1,30},{202003,1,1,30},{202006,1,1,30},{202010,1,1,1},{202011,1,1,1},{202012,1,1,1},{202013,1,1,1},{202015,1,1,1},{202016,1,1,1},{202017,1,1,1},{202019,1,1,1},{110079,1,1,0},{110003,1,1,0},{110004,1,1,100},{110005,1,1,100},{110010,1,1,0},{110011,1,1,0},{110012,1,1,0},{110009,1,5,100}]}] | AB71: =R[-1]C -> [{0,[{1,100}],[{200000,1,1,70},{200001,1,1,70},{200002,1,1,70},{200003,1,1,70},{200006,1,1,70},{200010,1,1,12},{200011,1,1,12},{200012,1,1,12},{200013,1,1,12},{200015,1,1,12},{200016,1,1,12},{200017,1,1,12},{200019,1,1,12},{201000,1,1,70},{201001,1,1,70},{201002,1,1,70},{201003,1,1,70},{201006,1,1,70},{201010,1,1,12},{201011,1,1,12},{201012,1,1,12},{201013,1,1,12},{201015,1,1,12},{201016,1,1,12},{201017,1,1,12},{201019,1,1,12},{202000,1,1,70},{202001,1,1,70},{202002,1,1,70},{202003,1,1,70},{202006,1,1,70},{202010,1,1,12},{202011,1,1,12},{202012,1,1,12},{202013,1,1,12},{202015,1,1,12},{202016,1,1,12},{202017,1,1,12},{202019,1,1,12}]},{0,[{3,100}],[{110079,1,2,3},{110003,1,2,1},{110004,1,1,3},{110005,1,1,3},{110010,1,1,0},{110011,1,1,0},{110012,1,1,0}]},{0,[{10,100}],[{110009,1,1000,1}]}] | AC71: 13329
A72: 10069 | B72: 第69关 | C72: 10005 | D72: =R[-5]C+1 -> 14 | E72: =R[-5]C -> 4 | F72: 30 | G72: 10 | H72: 10 | I72: [{6050, 100}] | J72: 110 | K72: 0 | L72: 2 | N72: [{110009, 10000}, {110079,70}] | O72: {20,10} | P72: 6250 | Q72: 7001 | R72: 60 | S72: 20 | T72: 40 | U72: 60 | V72: 19104 | W72: yewai | X72: [{200030,1},{201030,1},{202030,1}] | Y72: =RC[-15]*3600/RC[-19]*RC[-17] -> 132000 | Z72: =RC[-15]*3600/RC[-20]*RC[-18] -> 0 | AA72: =R[-1]C -> [{0,[{0,9995},{1,5}],[{200000,1,1,70},{200001,1,1,70},{200002,1,1,70},{200003,1,1,70},{200006,1,1,70},{200010,1,1,1},{200011,1,1,1},{200012,1,1,1},{200013,1,1,1},{200015,1,1,1},{200016,1,1,1},{200017,1,1,1},{200019,1,1,1},{201000,1,1,70},{201001,1,1,70},{201002,1,1,70},{201003,1,1,70},{201006,1,1,70},{201010,1,1,1},{201011,1,1,1},{201012,1,1,1},{201013,1,1,1},{201015,1,1,1},{201016,1,1,1},{201017,1,1,1},{201019,1,1,1},{202000,1,1,70},{202001,1,1,30},{202002,1,1,30},{202003,1,1,30},{202006,1,1,30},{202010,1,1,1},{202011,1,1,1},{202012,1,1,1},{202013,1,1,1},{202015,1,1,1},{202016,1,1,1},{202017,1,1,1},{202019,1,1,1},{110079,1,1,0},{110003,1,1,0},{110004,1,1,100},{110005,1,1,100},{110010,1,1,0},{110011,1,1,0},{110012,1,1,0},{110009,1,5,100}]}] | AB72: =R[-1]C -> [{0,[{1,100}],[{200000,1,1,70},{200001,1,1,70},{200002,1,1,70},{200003,1,1,70},{200006,1,1,70},{200010,1,1,12},{200011,1,1,12},{200012,1,1,12},{200013,1,1,12},{200015,1,1,12},{200016,1,1,12},{200017,1,1,12},{200019,1,1,12},{201000,1,1,70},{201001,1,1,70},{201002,1,1,70},{201003,1,1,70},{201006,1,1,70},{201010,1,1,12},{201011,1,1,12},{201012,1,1,12},{201013,1,1,12},{201015,1,1,12},{201016,1,1,12},{201017,1,1,12},{201019,1,1,12},{202000,1,1,70},{202001,1,1,70},{202002,1,1,70},{202003,1,1,70},{202006,1,1,70},{202010,1,1,12},{202011,1,1,12},{202012,1,1,12},{202013,1,1,12},{202015,1,1,12},{202016,1,1,12},{202017,1,1,12},{202019,1,1,12}]},{0,[{3,100}],[{110079,1,2,3},{110003,1,2,1},{110004,1,1,3},{110005,1,1,3},{110010,1,1,0},{110011,1,1,0},{110012,1,1,0}]},{0,[{10,100}],[{110009,1,1000,1}]}] | AC72: 13424
A73: 10070 | B73: 第70关 | C73: 10006 | D73: =R[-5]C+1 -> 14 | E73: =R[-5]C -> 5 | F73: 30 | G73: 10 | H73: 10 | I73: [{6050, 100}] | J73: 111 | K73: 0 | L73: 2 | N73: [{110009, 10000}, {110079,71}] | O73: {20,10} | P73: 6250 | Q73: 7001 | R73: 60 | S73: 20 | T73: 40 | U73: 60 | V73: 19104 | W73: yewai | X73: [{200030,1},{201030,1},{202030,1}] | Y73: =RC[-15]*3600/RC[-19]*RC[-17] -> 133200 | Z73: =RC[-15]*3600/RC[-20]*RC[-18] -> 0 | AA73: =R[-1]C -> [{0,[{0,9995},{1,5}],[{200000,1,1,70},{200001,1,1,70},{200002,1,1,70},{200003,1,1,70},{200006,1,1,70},{200010,1,1,1},{200011,1,1,1},{200012,1,1,1},{200013,1,1,1},{200015,1,1,1},{200016,1,1,1},{200017,1,1,1},{200019,1,1,1},{201000,1,1,70},{201001,1,1,70},{201002,1,1,70},{201003,1,1,70},{201006,1,1,70},{201010,1,1,1},{201011,1,1,1},{201012,1,1,1},{201013,1,1,1},{201015,1,1,1},{201016,1,1,1},{201017,1,1,1},{201019,1,1,1},{202000,1,1,70},{202001,1,1,30},{202002,1,1,30},{202003,1,1,30},{202006,1,1,30},{202010,1,1,1},{202011,1,1,1},{202012,1,1,1},{202013,1,1,1},{202015,1,1,1},{202016,1,1,1},{202017,1,1,1},{202019,1,1,1},{110079,1,1,0},{110003,1,1,0},{110004,1,1,100},{110005,1,1,100},{110010,1,1,0},{110011,1,1,0},{110012,1,1,0},{110009,1,5,100}]}] | AB73: =R[-1]C -> [{0,[{1,100}],[{200000,1,1,70},{200001,1,1,70},{200002,1,1,70},{200003,1,1,70},{200006,1,1,70},{200010,1,1,12},{200011,1,1,12},{200012,1,1,12},{200013,1,1,12},{200015,1,1,12},{200016,1,1,12},{200017,1,1,12},{200019,1,1,12},{201000,1,1,70},{201001,1,1,70},{201002,1,1,70},{201003,1,1,70},{201006,1,1,70},{201010,1,1,12},{201011,1,1,12},{201012,1,1,12},{201013,1,1,12},{201015,1,1,12},{201016,1,1,12},{201017,1,1,12},{201019,1,1,12},{202000,1,1,70},{202001,1,1,70},{202002,1,1,70},{202003,1,1,70},{202006,1,1,70},{202010,1,1,12},{202011,1,1,12},{202012,1,1,12},{202013,1,1,12},{202015,1,1,12},{202016,1,1,12},{202017,1,1,12},{202019,1,1,12}]},{0,[{3,100}],[{110079,1,2,3},{110003,1,2,1},{110004,1,1,3},{110005,1,1,3},{110010,1,1,0},{110011,1,1,0},{110012,1,1,0}]},{0,[{10,100}],[{110009,1,1000,1}]}] | AC73: 13519
A74: 10071 | B74: 第71关 | C74: 10002 | D74: =R[-5]C+1 -> 15 | E74: =R[-5]C -> 1 | F74: 30 | G74: 10 | H74: 10 | I74: [{6050, 100}] | J74: 112 | K74: 0 | L74: 2 | N74: [{110009, 10000}, {110079,72}] | O74: {20,10} | P74: 6250 | Q74: 6019 | R74: 60 | S74: 20 | T74: 40 | U74: 60 | V74: 19104 | W74: yewai | X74: [{200030,1},{201030,1},{202030,1}] | Y74: =RC[-15]*3600/RC[-19]*RC[-17] -> 134400 | Z74: =RC[-15]*3600/RC[-20]*RC[-18] -> 0 | AA74: =R[-1]C -> [{0,[{0,9995},{1,5}],[{200000,1,1,70},{200001,1,1,70},{200002,1,1,70},{200003,1,1,70},{200006,1,1,70},{200010,1,1,1},{200011,1,1,1},{200012,1,1,1},{200013,1,1,1},{200015,1,1,1},{200016,1,1,1},{200017,1,1,1},{200019,1,1,1},{201000,1,1,70},{201001,1,1,70},{201002,1,1,70},{201003,1,1,70},{201006,1,1,70},{201010,1,1,1},{201011,1,1,1},{201012,1,1,1},{201013,1,1,1},{201015,1,1,1},{201016,1,1,1},{201017,1,1,1},{201019,1,1,1},{202000,1,1,70},{202001,1,1,30},{202002,1,1,30},{202003,1,1,30},{202006,1,1,30},{202010,1,1,1},{202011,1,1,1},{202012,1,1,1},{202013,1,1,1},{202015,1,1,1},{202016,1,1,1},{202017,1,1,1},{202019,1,1,1},{110079,1,1,0},{110003,1,1,0},{110004,1,1,100},{110005,1,1,100},{110010,1,1,0},{110011,1,1,0},{110012,1,1,0},{110009,1,5,100}]}] | AB74: =R[-1]C -> [{0,[{1,100}],[{200000,1,1,70},{200001,1,1,70},{200002,1,1,70},{200003,1,1,70},{200006,1,1,70},{200010,1,1,12},{200011,1,1,12},{200012,1,1,12},{200013,1,1,12},{200015,1,1,12},{200016,1,1,12},{200017,1,1,12},{200019,1,1,12},{201000,1,1,70},{201001,1,1,70},{201002,1,1,70},{201003,1,1,70},{201006,1,1,70},{201010,1,1,12},{201011,1,1,12},{201012,1,1,12},{201013,1,1,12},{201015,1,1,12},{201016,1,1,12},{201017,1,1,12},{201019,1,1,12},{202000,1,1,70},{202001,1,1,70},{202002,1,1,70},{202003,1,1,70},{202006,1,1,70},{202010,1,1,12},{202011,1,1,12},{202012,1,1,12},{202013,1,1,12},{202015,1,1,12},{202016,1,1,12},{202017,1,1,12},{202019,1,1,12}]},{0,[{3,100}],[{110079,1,2,3},{110003,1,2,1},{110004,1,1,3},{110005,1,1,3},{110010,1,1,0},{110011,1,1,0},{110012,1,1,0}]},{0,[{10,100}],[{110009,1,1000,1}]}] | AC74: 13614
A75: 10072 | B75: 第72关 | C75: 10003 | D75: =R[-5]C+1 -> 15 | E75: =R[-5]C -> 2 | F75: 30 | G75: 10 | H75: 10 | I75: [{6050, 100}] | J75: 113 | K75: 0 | L75: 2 | N75: [{110009, 10000}, {110079,73}] | O75: {20,10} | P75: 6250 | Q75: 6019 | R75: 60 | S75: 20 | T75: 40 | U75: 60 | V75: 19104 | W75: yewai | X75: [{200030,1},{201030,1},{202030,1}] | Y75: =RC[-15]*3600/RC[-19]*RC[-17] -> 135600 | Z75: =RC[-15]*3600/RC[-20]*RC[-18] -> 0 | AA75: =R[-1]C -> [{0,[{0,9995},{1,5}],[{200000,1,1,70},{200001,1,1,70},{200002,1,1,70},{200003,1,1,70},{200006,1,1,70},{200010,1,1,1},{200011,1,1,1},{200012,1,1,1},{200013,1,1,1},{200015,1,1,1},{200016,1,1,1},{200017,1,1,1},{200019,1,1,1},{201000,1,1,70},{201001,1,1,70},{201002,1,1,70},{201003,1,1,70},{201006,1,1,70},{201010,1,1,1},{201011,1,1,1},{201012,1,1,1},{201013,1,1,1},{201015,1,1,1},{201016,1,1,1},{201017,1,1,1},{201019,1,1,1},{202000,1,1,70},{202001,1,1,30},{202002,1,1,30},{202003,1,1,30},{202006,1,1,30},{202010,1,1,1},{202011,1,1,1},{202012,1,1,1},{202013,1,1,1},{202015,1,1,1},{202016,1,1,1},{202017,1,1,1},{202019,1,1,1},{110079,1,1,0},{110003,1,1,0},{110004,1,1,100},{110005,1,1,100},{110010,1,1,0},{110011,1,1,0},{110012,1,1,0},{110009,1,5,100}]}] | AB75: =R[-1]C -> [{0,[{1,100}],[{200000,1,1,70},{200001,1,1,70},{200002,1,1,70},{200003,1,1,70},{200006,1,1,70},{200010,1,1,12},{200011,1,1,12},{200012,1,1,12},{200013,1,1,12},{200015,1,1,12},{200016,1,1,12},{200017,1,1,12},{200019,1,1,12},{201000,1,1,70},{201001,1,1,70},{201002,1,1,70},{201003,1,1,70},{201006,1,1,70},{201010,1,1,12},{201011,1,1,12},{201012,1,1,12},{201013,1,1,12},{201015,1,1,12},{201016,1,1,12},{201017,1,1,12},{201019,1,1,12},{202000,1,1,70},{202001,1,1,70},{202002,1,1,70},{202003,1,1,70},{202006,1,1,70},{202010,1,1,12},{202011,1,1,12},{202012,1,1,12},{202013,1,1,12},{202015,1,1,12},{202016,1,1,12},{202017,1,1,12},{202019,1,1,12}]},{0,[{3,100}],[{110079,1,2,3},{110003,1,2,1},{110004,1,1,3},{110005,1,1,3},{110010,1,1,0},{110011,1,1,0},{110012,1,1,0}]},{0,[{10,100}],[{110009,1,1000,1}]}] | AC75: 13709
A76: 10073 | B76: 第73关 | C76: 10004 | D76: =R[-5]C+1 -> 15 | E76: =R[-5]C -> 3 | F76: 30 | G76: 10 | H76: 10 | I76: [{6050, 100}] | J76: 114 | K76: 0 | L76: 2 | N76: [{110009, 10000}, {110079,74}] | O76: {20,10} | P76: 6250 | Q76: 6019 | R76: 60 | S76: 20 | T76: 40 | U76: 60 | V76: 19104 | W76: yewai | X76: [{200030,1},{201030,1},{202030,1}] | Y76: =RC[-15]*3600/RC[-19]*RC[-17] -> 136800 | Z76: =RC[-15]*3600/RC[-20]*RC[-18] -> 0 | AA76: =R[-1]C -> [{0,[{0,9995},{1,5}],[{200000,1,1,70},{200001,1,1,70},{200002,1,1,70},{200003,1,1,70},{200006,1,1,70},{200010,1,1,1},{200011,1,1,1},{200012,1,1,1},{200013,1,1,1},{200015,1,1,1},{200016,1,1,1},{200017,1,1,1},{200019,1,1,1},{201000,1,1,70},{201001,1,1,70},{201002,1,1,70},{201003,1,1,70},{201006,1,1,70},{201010,1,1,1},{201011,1,1,1},{201012,1,1,1},{201013,1,1,1},{201015,1,1,1},{201016,1,1,1},{201017,1,1,1},{201019,1,1,1},{202000,1,1,70},{202001,1,1,30},{202002,1,1,30},{202003,1,1,30},{202006,1,1,30},{202010,1,1,1},{202011,1,1,1},{202012,1,1,1},{202013,1,1,1},{202015,1,1,1},{202016,1,1,1},{202017,1,1,1},{202019,1,1,1},{110079,1,1,0},{110003,1,1,0},{110004,1,1,100},{110005,1,1,100},{110010,1,1,0},{110011,1,1,0},{110012,1,1,0},{110009,1,5,100}]}] | AB76: =R[-1]C -> [{0,[{1,100}],[{200000,1,1,70},{200001,1,1,70},{200002,1,1,70},{200003,1,1,70},{200006,1,1,70},{200010,1,1,12},{200011,1,1,12},{200012,1,1,12},{200013,1,1,12},{200015,1,1,12},{200016,1,1,12},{200017,1,1,12},{200019,1,1,12},{201000,1,1,70},{201001,1,1,70},{201002,1,1,70},{201003,1,1,70},{201006,1,1,70},{201010,1,1,12},{201011,1,1,12},{201012,1,1,12},{201013,1,1,12},{201015,1,1,12},{201016,1,1,12},{201017,1,1,12},{201019,1,1,12},{202000,1,1,70},{202001,1,1,70},{202002,1,1,70},{202003,1,1,70},{202006,1,1,70},{202010,1,1,12},{202011,1,1,12},{202012,1,1,12},{202013,1,1,12},{202015,1,1,12},{202016,1,1,12},{202017,1,1,12},{202019,1,1,12}]},{0,[{3,100}],[{110079,1,2,3},{110003,1,2,1},{110004,1,1,3},{110005,1,1,3},{110010,1,1,0},{110011,1,1,0},{110012,1,1,0}]},{0,[{10,100}],[{110009,1,1000,1}]}] | AC76: 13804
A77: 10074 | B77: 第74关 | C77: 10005 | D77: =R[-5]C+1 -> 15 | E77: =R[-5]C -> 4 | F77: 30 | G77: 10 | H77: 10 | I77: [{6050, 100}] | J77: 115 | K77: 0 | L77: 2 | N77: [{110009, 10000}, {110079,75}] | O77: {20,10} | P77: 6250 | Q77: 6019 | R77: 60 | S77: 20 | T77: 40 | U77: 60 | V77: 19104 | W77: yewai | X77: [{200030,1},{201030,1},{202030,1}] | Y77: =RC[-15]*3600/RC[-19]*RC[-17] -> 138000 | Z77: =RC[-15]*3600/RC[-20]*RC[-18] -> 0 | AA77: =R[-1]C -> [{0,[{0,9995},{1,5}],[{200000,1,1,70},{200001,1,1,70},{200002,1,1,70},{200003,1,1,70},{200006,1,1,70},{200010,1,1,1},{200011,1,1,1},{200012,1,1,1},{200013,1,1,1},{200015,1,1,1},{200016,1,1,1},{200017,1,1,1},{200019,1,1,1},{201000,1,1,70},{201001,1,1,70},{201002,1,1,70},{201003,1,1,70},{201006,1,1,70},{201010,1,1,1},{201011,1,1,1},{201012,1,1,1},{201013,1,1,1},{201015,1,1,1},{201016,1,1,1},{201017,1,1,1},{201019,1,1,1},{202000,1,1,70},{202001,1,1,30},{202002,1,1,30},{202003,1,1,30},{202006,1,1,30},{202010,1,1,1},{202011,1,1,1},{202012,1,1,1},{202013,1,1,1},{202015,1,1,1},{202016,1,1,1},{202017,1,1,1},{202019,1,1,1},{110079,1,1,0},{110003,1,1,0},{110004,1,1,100},{110005,1,1,100},{110010,1,1,0},{110011,1,1,0},{110012,1,1,0},{110009,1,5,100}]}] | AB77: =R[-1]C -> [{0,[{1,100}],[{200000,1,1,70},{200001,1,1,70},{200002,1,1,70},{200003,1,1,70},{200006,1,1,70},{200010,1,1,12},{200011,1,1,12},{200012,1,1,12},{200013,1,1,12},{200015,1,1,12},{200016,1,1,12},{200017,1,1,12},{200019,1,1,12},{201000,1,1,70},{201001,1,1,70},{201002,1,1,70},{201003,1,1,70},{201006,1,1,70},{201010,1,1,12},{201011,1,1,12},{201012,1,1,12},{201013,1,1,12},{201015,1,1,12},{201016,1,1,12},{201017,1,1,12},{201019,1,1,12},{202000,1,1,70},{202001,1,1,70},{202002,1,1,70},{202003,1,1,70},{202006,1,1,70},{202010,1,1,12},{202011,1,1,12},{202012,1,1,12},{202013,1,1,12},{202015,1,1,12},{202016,1,1,12},{202017,1,1,12},{202019,1,1,12}]},{0,[{3,100}],[{110079,1,2,3},{110003,1,2,1},{110004,1,1,3},{110005,1,1,3},{110010,1,1,0},{110011,1,1,0},{110012,1,1,0}]},{0,[{10,100}],[{110009,1,1000,1}]}] | AC77: 13899
A78: 10075 | B78: 第75关 | C78: 10006 | D78: =R[-5]C+1 -> 15 | E78: =R[-5]C -> 5 | F78: 30 | G78: 10 | H78: 10 | I78: [{6050, 100}] | J78: 116 | K78: 0 | L78: 2 | N78: [{110009, 10000}, {110079,76}] | O78: {20,10} | P78: 6250 | Q78: 6019 | R78: 60 | S78: 20 | T78: 40 | U78: 60 | V78: 19104 | W78: yewai | X78: [{200030,1},{201030,1},{202030,1}] | Y78: =RC[-15]*3600/RC[-19]*RC[-17] -> 139200 | Z78: =RC[-15]*3600/RC[-20]*RC[-18] -> 0 | AA78: =R[-1]C -> [{0,[{0,9995},{1,5}],[{200000,1,1,70},{200001,1,1,70},{200002,1,1,70},{200003,1,1,70},{200006,1,1,70},{200010,1,1,1},{200011,1,1,1},{200012,1,1,1},{200013,1,1,1},{200015,1,1,1},{200016,1,1,1},{200017,1,1,1},{200019,1,1,1},{201000,1,1,70},{201001,1,1,70},{201002,1,1,70},{201003,1,1,70},{201006,1,1,70},{201010,1,1,1},{201011,1,1,1},{201012,1,1,1},{201013,1,1,1},{201015,1,1,1},{201016,1,1,1},{201017,1,1,1},{201019,1,1,1},{202000,1,1,70},{202001,1,1,30},{202002,1,1,30},{202003,1,1,30},{202006,1,1,30},{202010,1,1,1},{202011,1,1,1},{202012,1,1,1},{202013,1,1,1},{202015,1,1,1},{202016,1,1,1},{202017,1,1,1},{202019,1,1,1},{110079,1,1,0},{110003,1,1,0},{110004,1,1,100},{110005,1,1,100},{110010,1,1,0},{110011,1,1,0},{110012,1,1,0},{110009,1,5,100}]}] | AB78: =R[-1]C -> [{0,[{1,100}],[{200000,1,1,70},{200001,1,1,70},{200002,1,1,70},{200003,1,1,70},{200006,1,1,70},{200010,1,1,12},{200011,1,1,12},{200012,1,1,12},{200013,1,1,12},{200015,1,1,12},{200016,1,1,12},{200017,1,1,12},{200019,1,1,12},{201000,1,1,70},{201001,1,1,70},{201002,1,1,70},{201003,1,1,70},{201006,1,1,70},{201010,1,1,12},{201011,1,1,12},{201012,1,1,12},{201013,1,1,12},{201015,1,1,12},{201016,1,1,12},{201017,1,1,12},{201019,1,1,12},{202000,1,1,70},{202001,1,1,70},{202002,1,1,70},{202003,1,1,70},{202006,1,1,70},{202010,1,1,12},{202011,1,1,12},{202012,1,1,12},{202013,1,1,12},{202015,1,1,12},{202016,1,1,12},{202017,1,1,12},{202019,1,1,12}]},{0,[{3,100}],[{110079,1,2,3},{110003,1,2,1},{110004,1,1,3},{110005,1,1,3},{110010,1,1,0},{110011,1,1,0},{110012,1,1,0}]},{0,[{10,100}],[{110009,1,1000,1}]}] | AC78: 13994
A79: 10076 | B79: 第76关 | C79: 10002 | D79: =R[-5]C+1 -> 16 | E79: =R[-5]C -> 1 | F79: 30 | G79: 10 | H79: 10 | I79: [{6050, 100}] | J79: 117 | K79: 0 | L79: 2 | N79: [{110009, 10000}, {110079,77}] | O79: {20,10} | P79: 6250 | Q79: 6019 | R79: 60 | S79: 20 | T79: 40 | U79: 60 | V79: 19104 | W79: yewai | X79: [{200030,1},{201030,1},{202030,1}] | Y79: =RC[-15]*3600/RC[-19]*RC[-17] -> 140400 | Z79: =RC[-15]*3600/RC[-20]*RC[-18] -> 0 | AA79: =R[-1]C -> [{0,[{0,9995},{1,5}],[{200000,1,1,70},{200001,1,1,70},{200002,1,1,70},{200003,1,1,70},{200006,1,1,70},{200010,1,1,1},{200011,1,1,1},{200012,1,1,1},{200013,1,1,1},{200015,1,1,1},{200016,1,1,1},{200017,1,1,1},{200019,1,1,1},{201000,1,1,70},{201001,1,1,70},{201002,1,1,70},{201003,1,1,70},{201006,1,1,70},{201010,1,1,1},{201011,1,1,1},{201012,1,1,1},{201013,1,1,1},{201015,1,1,1},{201016,1,1,1},{201017,1,1,1},{201019,1,1,1},{202000,1,1,70},{202001,1,1,30},{202002,1,1,30},{202003,1,1,30},{202006,1,1,30},{202010,1,1,1},{202011,1,1,1},{202012,1,1,1},{202013,1,1,1},{202015,1,1,1},{202016,1,1,1},{202017,1,1,1},{202019,1,1,1},{110079,1,1,0},{110003,1,1,0},{110004,1,1,100},{110005,1,1,100},{110010,1,1,0},{110011,1,1,0},{110012,1,1,0},{110009,1,5,100}]}] | AB79: =R[-1]C -> [{0,[{1,100}],[{200000,1,1,70},{200001,1,1,70},{200002,1,1,70},{200003,1,1,70},{200006,1,1,70},{200010,1,1,12},{200011,1,1,12},{200012,1,1,12},{200013,1,1,12},{200015,1,1,12},{200016,1,1,12},{200017,1,1,12},{200019,1,1,12},{201000,1,1,70},{201001,1,1,70},{201002,1,1,70},{201003,1,1,70},{201006,1,1,70},{201010,1,1,12},{201011,1,1,12},{201012,1,1,12},{201013,1,1,12},{201015,1,1,12},{201016,1,1,12},{201017,1,1,12},{201019,1,1,12},{202000,1,1,70},{202001,1,1,70},{202002,1,1,70},{202003,1,1,70},{202006,1,1,70},{202010,1,1,12},{202011,1,1,12},{202012,1,1,12},{202013,1,1,12},{202015,1,1,12},{202016,1,1,12},{202017,1,1,12},{202019,1,1,12}]},{0,[{3,100}],[{110079,1,2,3},{110003,1,2,1},{110004,1,1,3},{110005,1,1,3},{110010,1,1,0},{110011,1,1,0},{110012,1,1,0}]},{0,[{10,100}],[{110009,1,1000,1}]}] | AC79: 14089
A80: 10077 | B80: 第77关 | C80: 10003 | D80: =R[-5]C+1 -> 16 | E80: =R[-5]C -> 2 | F80: 30 | G80: 10 | H80: 10 | I80: [{6050, 100}] | J80: 118 | K80: 0 | L80: 2 | N80: [{110009, 10000}, {110079,78}] | O80: {20,10} | P80: 6250 | Q80: 6019 | R80: 60 | S80: 20 | T80: 40 | U80: 60 | V80: 19104 | W80: yewai | X80: [{200030,1},{201030,1},{202030,1}] | Y80: =RC[-15]*3600/RC[-19]*RC[-17] -> 141600 | Z80: =RC[-15]*3600/RC[-20]*RC[-18] -> 0 | AA80: =R[-1]C -> [{0,[{0,9995},{1,5}],[{200000,1,1,70},{200001,1,1,70},{200002,1,1,70},{200003,1,1,70},{200006,1,1,70},{200010,1,1,1},{200011,1,1,1},{200012,1,1,1},{200013,1,1,1},{200015,1,1,1},{200016,1,1,1},{200017,1,1,1},{200019,1,1,1},{201000,1,1,70},{201001,1,1,70},{201002,1,1,70},{201003,1,1,70},{201006,1,1,70},{201010,1,1,1},{201011,1,1,1},{201012,1,1,1},{201013,1,1,1},{201015,1,1,1},{201016,1,1,1},{201017,1,1,1},{201019,1,1,1},{202000,1,1,70},{202001,1,1,30},{202002,1,1,30},{202003,1,1,30},{202006,1,1,30},{202010,1,1,1},{202011,1,1,1},{202012,1,1,1},{202013,1,1,1},{202015,1,1,1},{202016,1,1,1},{202017,1,1,1},{202019,1,1,1},{110079,1,1,0},{110003,1,1,0},{110004,1,1,100},{110005,1,1,100},{110010,1,1,0},{110011,1,1,0},{110012,1,1,0},{110009,1,5,100}]}] | AB80: =R[-1]C -> [{0,[{1,100}],[{200000,1,1,70},{200001,1,1,70},{200002,1,1,70},{200003,1,1,70},{200006,1,1,70},{200010,1,1,12},{200011,1,1,12},{200012,1,1,12},{200013,1,1,12},{200015,1,1,12},{200016,1,1,12},{200017,1,1,12},{200019,1,1,12},{201000,1,1,70},{201001,1,1,70},{201002,1,1,70},{201003,1,1,70},{201006,1,1,70},{201010,1,1,12},{201011,1,1,12},{201012,1,1,12},{201013,1,1,12},{201015,1,1,12},{201016,1,1,12},{201017,1,1,12},{201019,1,1,12},{202000,1,1,70},{202001,1,1,70},{202002,1,1,70},{202003,1,1,70},{202006,1,1,70},{202010,1,1,12},{202011,1,1,12},{202012,1,1,12},{202013,1,1,12},{202015,1,1,12},{202016,1,1,12},{202017,1,1,12},{202019,1,1,12}]},{0,[{3,100}],[{110079,1,2,3},{110003,1,2,1},{110004,1,1,3},{110005,1,1,3},{110010,1,1,0},{110011,1,1,0},{110012,1,1,0}]},{0,[{10,100}],[{110009,1,1000,1}]}] | AC80: 14184
A81: 10078 | B81: 第78关 | C81: 10004 | D81: =R[-5]C+1 -> 16 | E81: =R[-5]C -> 3 | F81: 30 | G81: 10 | H81: 10 | I81: [{6050, 100}] | J81: 119 | K81: 0 | L81: 2 | N81: [{110009, 10000}, {110079,79}] | O81: {20,10} | P81: 6250 | Q81: 6019 | R81: 60 | S81: 20 | T81: 40 | U81: 60 | V81: 19104 | W81: yewai | X81: [{200030,1},{201030,1},{202030,1}] | Y81: =RC[-15]*3600/RC[-19]*RC[-17] -> 142800 | Z81: =RC[-15]*3600/RC[-20]*RC[-18] -> 0 | AA81: =R[-1]C -> [{0,[{0,9995},{1,5}],[{200000,1,1,70},{200001,1,1,70},{200002,1,1,70},{200003,1,1,70},{200006,1,1,70},{200010,1,1,1},{200011,1,1,1},{200012,1,1,1},{200013,1,1,1},{200015,1,1,1},{200016,1,1,1},{200017,1,1,1},{200019,1,1,1},{201000,1,1,70},{201001,1,1,70},{201002,1,1,70},{201003,1,1,70},{201006,1,1,70},{201010,1,1,1},{201011,1,1,1},{201012,1,1,1},{201013,1,1,1},{201015,1,1,1},{201016,1,1,1},{201017,1,1,1},{201019,1,1,1},{202000,1,1,70},{202001,1,1,30},{202002,1,1,30},{202003,1,1,30},{202006,1,1,30},{202010,1,1,1},{202011,1,1,1},{202012,1,1,1},{202013,1,1,1},{202015,1,1,1},{202016,1,1,1},{202017,1,1,1},{202019,1,1,1},{110079,1,1,0},{110003,1,1,0},{110004,1,1,100},{110005,1,1,100},{110010,1,1,0},{110011,1,1,0},{110012,1,1,0},{110009,1,5,100}]}] | AB81: =R[-1]C -> [{0,[{1,100}],[{200000,1,1,70},{200001,1,1,70},{200002,1,1,70},{200003,1,1,70},{200006,1,1,70},{200010,1,1,12},{200011,1,1,12},{200012,1,1,12},{200013,1,1,12},{200015,1,1,12},{200016,1,1,12},{200017,1,1,12},{200019,1,1,12},{201000,1,1,70},{201001,1,1,70},{201002,1,1,70},{201003,1,1,70},{201006,1,1,70},{201010,1,1,12},{201011,1,1,12},{201012,1,1,12},{201013,1,1,12},{201015,1,1,12},{201016,1,1,12},{201017,1,1,12},{201019,1,1,12},{202000,1,1,70},{202001,1,1,70},{202002,1,1,70},{202003,1,1,70},{202006,1,1,70},{202010,1,1,12},{202011,1,1,12},{202012,1,1,12},{202013,1,1,12},{202015,1,1,12},{202016,1,1,12},{202017,1,1,12},{202019,1,1,12}]},{0,[{3,100}],[{110079,1,2,3},{110003,1,2,1},{110004,1,1,3},{110005,1,1,3},{110010,1,1,0},{110011,1,1,0},{110012,1,1,0}]},{0,[{10,100}],[{110009,1,1000,1}]}] | AC81: 14279
A82: 10079 | B82: 第79关 | C82: 10005 | D82: =R[-5]C+1 -> 16 | E82: =R[-5]C -> 4 | F82: 30 | G82: 10 | H82: 10 | I82: [{6050, 100}] | J82: 120 | K82: 0 | L82: 2 | N82: [{110009, 10000}, {110079,80}] | O82: {20,10} | P82: 6250 | Q82: 6019 | R82: 60 | S82: 20 | T82: 40 | U82: 60 | V82: 19104 | W82: yewai | X82: [{200030,1},{201030,1},{202030,1}] | Y82: =RC[-15]*3600/RC[-19]*RC[-17] -> 144000 | Z82: =RC[-15]*3600/RC[-20]*RC[-18] -> 0 | AA82: =R[-1]C -> [{0,[{0,9995},{1,5}],[{200000,1,1,70},{200001,1,1,70},{200002,1,1,70},{200003,1,1,70},{200006,1,1,70},{200010,1,1,1},{200011,1,1,1},{200012,1,1,1},{200013,1,1,1},{200015,1,1,1},{200016,1,1,1},{200017,1,1,1},{200019,1,1,1},{201000,1,1,70},{201001,1,1,70},{201002,1,1,70},{201003,1,1,70},{201006,1,1,70},{201010,1,1,1},{201011,1,1,1},{201012,1,1,1},{201013,1,1,1},{201015,1,1,1},{201016,1,1,1},{201017,1,1,1},{201019,1,1,1},{202000,1,1,70},{202001,1,1,30},{202002,1,1,30},{202003,1,1,30},{202006,1,1,30},{202010,1,1,1},{202011,1,1,1},{202012,1,1,1},{202013,1,1,1},{202015,1,1,1},{202016,1,1,1},{202017,1,1,1},{202019,1,1,1},{110079,1,1,0},{110003,1,1,0},{110004,1,1,100},{110005,1,1,100},{110010,1,1,0},{110011,1,1,0},{110012,1,1,0},{110009,1,5,100}]}] | AB82: =R[-1]C -> [{0,[{1,100}],[{200000,1,1,70},{200001,1,1,70},{200002,1,1,70},{200003,1,1,70},{200006,1,1,70},{200010,1,1,12},{200011,1,1,12},{200012,1,1,12},{200013,1,1,12},{200015,1,1,12},{200016,1,1,12},{200017,1,1,12},{200019,1,1,12},{201000,1,1,70},{201001,1,1,70},{201002,1,1,70},{201003,1,1,70},{201006,1,1,70},{201010,1,1,12},{201011,1,1,12},{201012,1,1,12},{201013,1,1,12},{201015,1,1,12},{201016,1,1,12},{201017,1,1,12},{201019,1,1,12},{202000,1,1,70},{202001,1,1,70},{202002,1,1,70},{202003,1,1,70},{202006,1,1,70},{202010,1,1,12},{202011,1,1,12},{202012,1,1,12},{202013,1,1,12},{202015,1,1,12},{202016,1,1,12},{202017,1,1,12},{202019,1,1,12}]},{0,[{3,100}],[{110079,1,2,3},{110003,1,2,1},{110004,1,1,3},{110005,1,1,3},{110010,1,1,0},{110011,1,1,0},{110012,1,1,0}]},{0,[{10,100}],[{110009,1,1000,1}]}] | AC82: 14374
A83: 10080 | B83: 第80关 | C83: 10006 | D83: =R[-5]C+1 -> 16 | E83: =R[-5]C -> 5 | F83: 30 | G83: 10 | H83: 10 | I83: [{6050, 100}] | J83: 121 | K83: 0 | L83: 2 | N83: [{110009, 10000}, {110079,81}] | O83: {20,10} | P83: 6250 | Q83: 6019 | R83: 60 | S83: 20 | T83: 40 | U83: 60 | V83: 19104 | W83: yewai | X83: [{200030,1},{201030,1},{202030,1}] | Y83: =RC[-15]*3600/RC[-19]*RC[-17] -> 145200 | Z83: =RC[-15]*3600/RC[-20]*RC[-18] -> 0 | AA83: =R[-1]C -> [{0,[{0,9995},{1,5}],[{200000,1,1,70},{200001,1,1,70},{200002,1,1,70},{200003,1,1,70},{200006,1,1,70},{200010,1,1,1},{200011,1,1,1},{200012,1,1,1},{200013,1,1,1},{200015,1,1,1},{200016,1,1,1},{200017,1,1,1},{200019,1,1,1},{201000,1,1,70},{201001,1,1,70},{201002,1,1,70},{201003,1,1,70},{201006,1,1,70},{201010,1,1,1},{201011,1,1,1},{201012,1,1,1},{201013,1,1,1},{201015,1,1,1},{201016,1,1,1},{201017,1,1,1},{201019,1,1,1},{202000,1,1,70},{202001,1,1,30},{202002,1,1,30},{202003,1,1,30},{202006,1,1,30},{202010,1,1,1},{202011,1,1,1},{202012,1,1,1},{202013,1,1,1},{202015,1,1,1},{202016,1,1,1},{202017,1,1,1},{202019,1,1,1},{110079,1,1,0},{110003,1,1,0},{110004,1,1,100},{110005,1,1,100},{110010,1,1,0},{110011,1,1,0},{110012,1,1,0},{110009,1,5,100}]}] | AB83: =R[-1]C -> [{0,[{1,100}],[{200000,1,1,70},{200001,1,1,70},{200002,1,1,70},{200003,1,1,70},{200006,1,1,70},{200010,1,1,12},{200011,1,1,12},{200012,1,1,12},{200013,1,1,12},{200015,1,1,12},{200016,1,1,12},{200017,1,1,12},{200019,1,1,12},{201000,1,1,70},{201001,1,1,70},{201002,1,1,70},{201003,1,1,70},{201006,1,1,70},{201010,1,1,12},{201011,1,1,12},{201012,1,1,12},{201013,1,1,12},{201015,1,1,12},{201016,1,1,12},{201017,1,1,12},{201019,1,1,12},{202000,1,1,70},{202001,1,1,70},{202002,1,1,70},{202003,1,1,70},{202006,1,1,70},{202010,1,1,12},{202011,1,1,12},{202012,1,1,12},{202013,1,1,12},{202015,1,1,12},{202016,1,1,12},{202017,1,1,12},{202019,1,1,12}]},{0,[{3,100}],[{110079,1,2,3},{110003,1,2,1},{110004,1,1,3},{110005,1,1,3},{110010,1,1,0},{110011,1,1,0},{110012,1,1,0}]},{0,[{10,100}],[{110009,1,1000,1}]}] | AC83: 14469
A84: 10081 | B84: 第81关 | C84: 10002 | D84: =R[-5]C+1 -> 17 | E84: =R[-5]C -> 1 | F84: 30 | G84: 10 | H84: 10 | I84: [{6050, 100}] | J84: 122 | K84: 0 | L84: 2 | N84: [{110009, 10000}, {110079,82}] | O84: {20,10} | P84: 6250 | Q84: 6043 | R84: 60 | S84: 20 | T84: 40 | U84: 60 | V84: 19104 | W84: yewai | X84: [{200030,1},{201030,1},{202030,1}] | Y84: =RC[-15]*3600/RC[-19]*RC[-17] -> 146400 | Z84: =RC[-15]*3600/RC[-20]*RC[-18] -> 0 | AA84: =R[-1]C -> [{0,[{0,9995},{1,5}],[{200000,1,1,70},{200001,1,1,70},{200002,1,1,70},{200003,1,1,70},{200006,1,1,70},{200010,1,1,1},{200011,1,1,1},{200012,1,1,1},{200013,1,1,1},{200015,1,1,1},{200016,1,1,1},{200017,1,1,1},{200019,1,1,1},{201000,1,1,70},{201001,1,1,70},{201002,1,1,70},{201003,1,1,70},{201006,1,1,70},{201010,1,1,1},{201011,1,1,1},{201012,1,1,1},{201013,1,1,1},{201015,1,1,1},{201016,1,1,1},{201017,1,1,1},{201019,1,1,1},{202000,1,1,70},{202001,1,1,30},{202002,1,1,30},{202003,1,1,30},{202006,1,1,30},{202010,1,1,1},{202011,1,1,1},{202012,1,1,1},{202013,1,1,1},{202015,1,1,1},{202016,1,1,1},{202017,1,1,1},{202019,1,1,1},{110079,1,1,0},{110003,1,1,0},{110004,1,1,100},{110005,1,1,100},{110010,1,1,0},{110011,1,1,0},{110012,1,1,0},{110009,1,5,100}]}] | AB84: =R[-1]C -> [{0,[{1,100}],[{200000,1,1,70},{200001,1,1,70},{200002,1,1,70},{200003,1,1,70},{200006,1,1,70},{200010,1,1,12},{200011,1,1,12},{200012,1,1,12},{200013,1,1,12},{200015,1,1,12},{200016,1,1,12},{200017,1,1,12},{200019,1,1,12},{201000,1,1,70},{201001,1,1,70},{201002,1,1,70},{201003,1,1,70},{201006,1,1,70},{201010,1,1,12},{201011,1,1,12},{201012,1,1,12},{201013,1,1,12},{201015,1,1,12},{201016,1,1,12},{201017,1,1,12},{201019,1,1,12},{202000,1,1,70},{202001,1,1,70},{202002,1,1,70},{202003,1,1,70},{202006,1,1,70},{202010,1,1,12},{202011,1,1,12},{202012,1,1,12},{202013,1,1,12},{202015,1,1,12},{202016,1,1,12},{202017,1,1,12},{202019,1,1,12}]},{0,[{3,100}],[{110079,1,2,3},{110003,1,2,1},{110004,1,1,3},{110005,1,1,3},{110010,1,1,0},{110011,1,1,0},{110012,1,1,0}]},{0,[{10,100}],[{110009,1,1000,1}]}] | AC84: 14564
A85: 10082 | B85: 第82关 | C85: 10003 | D85: =R[-5]C+1 -> 17 | E85: =R[-5]C -> 2 | F85: 30 | G85: 10 | H85: 10 | I85: [{6050, 100}] | J85: 123 | K85: 0 | L85: 2 | N85: [{110009, 10000}, {110079,83}] | O85: {20,10} | P85: 6250 | Q85: 6043 | R85: 60 | S85: 20 | T85: 40 | U85: 60 | V85: 19104 | W85: yewai | X85: [{200030,1},{201030,1},{202030,1}] | Y85: =RC[-15]*3600/RC[-19]*RC[-17] -> 147600 | Z85: =RC[-15]*3600/RC[-20]*RC[-18] -> 0 | AA85: =R[-1]C -> [{0,[{0,9995},{1,5}],[{200000,1,1,70},{200001,1,1,70},{200002,1,1,70},{200003,1,1,70},{200006,1,1,70},{200010,1,1,1},{200011,1,1,1},{200012,1,1,1},{200013,1,1,1},{200015,1,1,1},{200016,1,1,1},{200017,1,1,1},{200019,1,1,1},{201000,1,1,70},{201001,1,1,70},{201002,1,1,70},{201003,1,1,70},{201006,1,1,70},{201010,1,1,1},{201011,1,1,1},{201012,1,1,1},{201013,1,1,1},{201015,1,1,1},{201016,1,1,1},{201017,1,1,1},{201019,1,1,1},{202000,1,1,70},{202001,1,1,30},{202002,1,1,30},{202003,1,1,30},{202006,1,1,30},{202010,1,1,1},{202011,1,1,1},{202012,1,1,1},{202013,1,1,1},{202015,1,1,1},{202016,1,1,1},{202017,1,1,1},{202019,1,1,1},{110079,1,1,0},{110003,1,1,0},{110004,1,1,100},{110005,1,1,100},{110010,1,1,0},{110011,1,1,0},{110012,1,1,0},{110009,1,5,100}]}] | AB85: =R[-1]C -> [{0,[{1,100}],[{200000,1,1,70},{200001,1,1,70},{200002,1,1,70},{200003,1,1,70},{200006,1,1,70},{200010,1,1,12},{200011,1,1,12},{200012,1,1,12},{200013,1,1,12},{200015,1,1,12},{200016,1,1,12},{200017,1,1,12},{200019,1,1,12},{201000,1,1,70},{201001,1,1,70},{201002,1,1,70},{201003,1,1,70},{201006,1,1,70},{201010,1,1,12},{201011,1,1,12},{201012,1,1,12},{201013,1,1,12},{201015,1,1,12},{201016,1,1,12},{201017,1,1,12},{201019,1,1,12},{202000,1,1,70},{202001,1,1,70},{202002,1,1,70},{202003,1,1,70},{202006,1,1,70},{202010,1,1,12},{202011,1,1,12},{202012,1,1,12},{202013,1,1,12},{202015,1,1,12},{202016,1,1,12},{202017,1,1,12},{202019,1,1,12}]},{0,[{3,100}],[{110079,1,2,3},{110003,1,2,1},{110004,1,1,3},{110005,1,1,3},{110010,1,1,0},{110011,1,1,0},{110012,1,1,0}]},{0,[{10,100}],[{110009,1,1000,1}]}] | AC85: 14659
A86: 10083 | B86: 第83关 | C86: 10004 | D86: =R[-5]C+1 -> 17 | E86: =R[-5]C -> 3 | F86: 30 | G86: 10 | H86: 10 | I86: [{6050, 100}] | J86: 124 | K86: 0 | L86: 2 | N86: [{110009, 10000}, {110079,84}] | O86: {20,10} | P86: 6250 | Q86: 6043 | R86: 60 | S86: 20 | T86: 40 | U86: 60 | V86: 19104 | W86: yewai | X86: [{200030,1},{201030,1},{202030,1}] | Y86: =RC[-15]*3600/RC[-19]*RC[-17] -> 148800 | Z86: =RC[-15]*3600/RC[-20]*RC[-18] -> 0 | AA86: =R[-1]C -> [{0,[{0,9995},{1,5}],[{200000,1,1,70},{200001,1,1,70},{200002,1,1,70},{200003,1,1,70},{200006,1,1,70},{200010,1,1,1},{200011,1,1,1},{200012,1,1,1},{200013,1,1,1},{200015,1,1,1},{200016,1,1,1},{200017,1,1,1},{200019,1,1,1},{201000,1,1,70},{201001,1,1,70},{201002,1,1,70},{201003,1,1,70},{201006,1,1,70},{201010,1,1,1},{201011,1,1,1},{201012,1,1,1},{201013,1,1,1},{201015,1,1,1},{201016,1,1,1},{201017,1,1,1},{201019,1,1,1},{202000,1,1,70},{202001,1,1,30},{202002,1,1,30},{202003,1,1,30},{202006,1,1,30},{202010,1,1,1},{202011,1,1,1},{202012,1,1,1},{202013,1,1,1},{202015,1,1,1},{202016,1,1,1},{202017,1,1,1},{202019,1,1,1},{110079,1,1,0},{110003,1,1,0},{110004,1,1,100},{110005,1,1,100},{110010,1,1,0},{110011,1,1,0},{110012,1,1,0},{110009,1,5,100}]}] | AB86: =R[-1]C -> [{0,[{1,100}],[{200000,1,1,70},{200001,1,1,70},{200002,1,1,70},{200003,1,1,70},{200006,1,1,70},{200010,1,1,12},{200011,1,1,12},{200012,1,1,12},{200013,1,1,12},{200015,1,1,12},{200016,1,1,12},{200017,1,1,12},{200019,1,1,12},{201000,1,1,70},{201001,1,1,70},{201002,1,1,70},{201003,1,1,70},{201006,1,1,70},{201010,1,1,12},{201011,1,1,12},{201012,1,1,12},{201013,1,1,12},{201015,1,1,12},{201016,1,1,12},{201017,1,1,12},{201019,1,1,12},{202000,1,1,70},{202001,1,1,70},{202002,1,1,70},{202003,1,1,70},{202006,1,1,70},{202010,1,1,12},{202011,1,1,12},{202012,1,1,12},{202013,1,1,12},{202015,1,1,12},{202016,1,1,12},{202017,1,1,12},{202019,1,1,12}]},{0,[{3,100}],[{110079,1,2,3},{110003,1,2,1},{110004,1,1,3},{110005,1,1,3},{110010,1,1,0},{110011,1,1,0},{110012,1,1,0}]},{0,[{10,100}],[{110009,1,1000,1}]}] | AC86: 14754
A87: 10084 | B87: 第84关 | C87: 10005 | D87: =R[-5]C+1 -> 17 | E87: =R[-5]C -> 4 | F87: 30 | G87: 10 | H87: 10 | I87: [{6050, 100}] | J87: 125 | K87: 0 | L87: 2 | N87: [{110009, 10000}, {110079,85}] | O87: {20,10} | P87: 6250 | Q87: 6043 | R87: 60 | S87: 20 | T87: 40 | U87: 60 | V87: 19104 | W87: yewai | X87: [{200030,1},{201030,1},{202030,1}] | Y87: =RC[-15]*3600/RC[-19]*RC[-17] -> 150000 | Z87: =RC[-15]*3600/RC[-20]*RC[-18] -> 0 | AA87: =R[-1]C -> [{0,[{0,9995},{1,5}],[{200000,1,1,70},{200001,1,1,70},{200002,1,1,70},{200003,1,1,70},{200006,1,1,70},{200010,1,1,1},{200011,1,1,1},{200012,1,1,1},{200013,1,1,1},{200015,1,1,1},{200016,1,1,1},{200017,1,1,1},{200019,1,1,1},{201000,1,1,70},{201001,1,1,70},{201002,1,1,70},{201003,1,1,70},{201006,1,1,70},{201010,1,1,1},{201011,1,1,1},{201012,1,1,1},{201013,1,1,1},{201015,1,1,1},{201016,1,1,1},{201017,1,1,1},{201019,1,1,1},{202000,1,1,70},{202001,1,1,30},{202002,1,1,30},{202003,1,1,30},{202006,1,1,30},{202010,1,1,1},{202011,1,1,1},{202012,1,1,1},{202013,1,1,1},{202015,1,1,1},{202016,1,1,1},{202017,1,1,1},{202019,1,1,1},{110079,1,1,0},{110003,1,1,0},{110004,1,1,100},{110005,1,1,100},{110010,1,1,0},{110011,1,1,0},{110012,1,1,0},{110009,1,5,100}]}] | AB87: =R[-1]C -> [{0,[{1,100}],[{200000,1,1,70},{200001,1,1,70},{200002,1,1,70},{200003,1,1,70},{200006,1,1,70},{200010,1,1,12},{200011,1,1,12},{200012,1,1,12},{200013,1,1,12},{200015,1,1,12},{200016,1,1,12},{200017,1,1,12},{200019,1,1,12},{201000,1,1,70},{201001,1,1,70},{201002,1,1,70},{201003,1,1,70},{201006,1,1,70},{201010,1,1,12},{201011,1,1,12},{201012,1,1,12},{201013,1,1,12},{201015,1,1,12},{201016,1,1,12},{201017,1,1,12},{201019,1,1,12},{202000,1,1,70},{202001,1,1,70},{202002,1,1,70},{202003,1,1,70},{202006,1,1,70},{202010,1,1,12},{202011,1,1,12},{202012,1,1,12},{202013,1,1,12},{202015,1,1,12},{202016,1,1,12},{202017,1,1,12},{202019,1,1,12}]},{0,[{3,100}],[{110079,1,2,3},{110003,1,2,1},{110004,1,1,3},{110005,1,1,3},{110010,1,1,0},{110011,1,1,0},{110012,1,1,0}]},{0,[{10,100}],[{110009,1,1000,1}]}] | AC87: 14849
A88: 10085 | B88: 第85关 | C88: 10006 | D88: =R[-5]C+1 -> 17 | E88: =R[-5]C -> 5 | F88: 30 | G88: 10 | H88: 10 | I88: [{6050, 100}] | J88: 126 | K88: 0 | L88: 2 | N88: [{110009, 10000}, {110079,86}] | O88: {20,10} | P88: 6250 | Q88: 6043 | R88: 60 | S88: 20 | T88: 40 | U88: 60 | V88: 19104 | W88: yewai | X88: [{200030,1},{201030,1},{202030,1}] | Y88: =RC[-15]*3600/RC[-19]*RC[-17] -> 151200 | Z88: =RC[-15]*3600/RC[-20]*RC[-18] -> 0 | AA88: =R[-1]C -> [{0,[{0,9995},{1,5}],[{200000,1,1,70},{200001,1,1,70},{200002,1,1,70},{200003,1,1,70},{200006,1,1,70},{200010,1,1,1},{200011,1,1,1},{200012,1,1,1},{200013,1,1,1},{200015,1,1,1},{200016,1,1,1},{200017,1,1,1},{200019,1,1,1},{201000,1,1,70},{201001,1,1,70},{201002,1,1,70},{201003,1,1,70},{201006,1,1,70},{201010,1,1,1},{201011,1,1,1},{201012,1,1,1},{201013,1,1,1},{201015,1,1,1},{201016,1,1,1},{201017,1,1,1},{201019,1,1,1},{202000,1,1,70},{202001,1,1,30},{202002,1,1,30},{202003,1,1,30},{202006,1,1,30},{202010,1,1,1},{202011,1,1,1},{202012,1,1,1},{202013,1,1,1},{202015,1,1,1},{202016,1,1,1},{202017,1,1,1},{202019,1,1,1},{110079,1,1,0},{110003,1,1,0},{110004,1,1,100},{110005,1,1,100},{110010,1,1,0},{110011,1,1,0},{110012,1,1,0},{110009,1,5,100}]}] | AB88: =R[-1]C -> [{0,[{1,100}],[{200000,1,1,70},{200001,1,1,70},{200002,1,1,70},{200003,1,1,70},{200006,1,1,70},{200010,1,1,12},{200011,1,1,12},{200012,1,1,12},{200013,1,1,12},{200015,1,1,12},{200016,1,1,12},{200017,1,1,12},{200019,1,1,12},{201000,1,1,70},{201001,1,1,70},{201002,1,1,70},{201003,1,1,70},{201006,1,1,70},{201010,1,1,12},{201011,1,1,12},{201012,1,1,12},{201013,1,1,12},{201015,1,1,12},{201016,1,1,12},{201017,1,1,12},{201019,1,1,12},{202000,1,1,70},{202001,1,1,70},{202002,1,1,70},{202003,1,1,70},{202006,1,1,70},{202010,1,1,12},{202011,1,1,12},{202012,1,1,12},{202013,1,1,12},{202015,1,1,12},{202016,1,1,12},{202017,1,1,12},{202019,1,1,12}]},{0,[{3,100}],[{110079,1,2,3},{110003,1,2,1},{110004,1,1,3},{110005,1,1,3},{110010,1,1,0},{110011,1,1,0},{110012,1,1,0}]},{0,[{10,100}],[{110009,1,1000,1}]}] | AC88: 14944
A89: 10086 | B89: 第86关 | C89: 10002 | D89: =R[-5]C+1 -> 18 | E89: =R[-5]C -> 1 | F89: 30 | G89: 10 | H89: 10 | I89: [{6050, 100}] | J89: 127 | K89: 0 | L89: 2 | N89: [{110009, 10000}, {110079,87}] | O89: {20,10} | P89: 6250 | Q89: 6043 | R89: 60 | S89: 20 | T89: 40 | U89: 60 | V89: 19104 | W89: yewai | X89: [{200030,1},{201030,1},{202030,1}] | Y89: =RC[-15]*3600/RC[-19]*RC[-17] -> 152400 | Z89: =RC[-15]*3600/RC[-20]*RC[-18] -> 0 | AA89: =R[-1]C -> [{0,[{0,9995},{1,5}],[{200000,1,1,70},{200001,1,1,70},{200002,1,1,70},{200003,1,1,70},{200006,1,1,70},{200010,1,1,1},{200011,1,1,1},{200012,1,1,1},{200013,1,1,1},{200015,1,1,1},{200016,1,1,1},{200017,1,1,1},{200019,1,1,1},{201000,1,1,70},{201001,1,1,70},{201002,1,1,70},{201003,1,1,70},{201006,1,1,70},{201010,1,1,1},{201011,1,1,1},{201012,1,1,1},{201013,1,1,1},{201015,1,1,1},{201016,1,1,1},{201017,1,1,1},{201019,1,1,1},{202000,1,1,70},{202001,1,1,30},{202002,1,1,30},{202003,1,1,30},{202006,1,1,30},{202010,1,1,1},{202011,1,1,1},{202012,1,1,1},{202013,1,1,1},{202015,1,1,1},{202016,1,1,1},{202017,1,1,1},{202019,1,1,1},{110079,1,1,0},{110003,1,1,0},{110004,1,1,100},{110005,1,1,100},{110010,1,1,0},{110011,1,1,0},{110012,1,1,0},{110009,1,5,100}]}] | AB89: =R[-1]C -> [{0,[{1,100}],[{200000,1,1,70},{200001,1,1,70},{200002,1,1,70},{200003,1,1,70},{200006,1,1,70},{200010,1,1,12},{200011,1,1,12},{200012,1,1,12},{200013,1,1,12},{200015,1,1,12},{200016,1,1,12},{200017,1,1,12},{200019,1,1,12},{201000,1,1,70},{201001,1,1,70},{201002,1,1,70},{201003,1,1,70},{201006,1,1,70},{201010,1,1,12},{201011,1,1,12},{201012,1,1,12},{201013,1,1,12},{201015,1,1,12},{201016,1,1,12},{201017,1,1,12},{201019,1,1,12},{202000,1,1,70},{202001,1,1,70},{202002,1,1,70},{202003,1,1,70},{202006,1,1,70},{202010,1,1,12},{202011,1,1,12},{202012,1,1,12},{202013,1,1,12},{202015,1,1,12},{202016,1,1,12},{202017,1,1,12},{202019,1,1,12}]},{0,[{3,100}],[{110079,1,2,3},{110003,1,2,1},{110004,1,1,3},{110005,1,1,3},{110010,1,1,0},{110011,1,1,0},{110012,1,1,0}]},{0,[{10,100}],[{110009,1,1000,1}]}] | AC89: 15039
A90: 10087 | B90: 第87关 | C90: 10003 | D90: =R[-5]C+1 -> 18 | E90: =R[-5]C -> 2 | F90: 30 | G90: 10 | H90: 10 | I90: [{6050, 100}] | J90: 128 | K90: 0 | L90: 2 | N90: [{110009, 10000}, {110079,88}] | O90: {20,10} | P90: 6250 | Q90: 6043 | R90: 60 | S90: 20 | T90: 40 | U90: 60 | V90: 19104 | W90: yewai | X90: [{200030,1},{201030,1},{202030,1}] | Y90: =RC[-15]*3600/RC[-19]*RC[-17] -> 153600 | Z90: =RC[-15]*3600/RC[-20]*RC[-18] -> 0 | AA90: =R[-1]C -> [{0,[{0,9995},{1,5}],[{200000,1,1,70},{200001,1,1,70},{200002,1,1,70},{200003,1,1,70},{200006,1,1,70},{200010,1,1,1},{200011,1,1,1},{200012,1,1,1},{200013,1,1,1},{200015,1,1,1},{200016,1,1,1},{200017,1,1,1},{200019,1,1,1},{201000,1,1,70},{201001,1,1,70},{201002,1,1,70},{201003,1,1,70},{201006,1,1,70},{201010,1,1,1},{201011,1,1,1},{201012,1,1,1},{201013,1,1,1},{201015,1,1,1},{201016,1,1,1},{201017,1,1,1},{201019,1,1,1},{202000,1,1,70},{202001,1,1,30},{202002,1,1,30},{202003,1,1,30},{202006,1,1,30},{202010,1,1,1},{202011,1,1,1},{202012,1,1,1},{202013,1,1,1},{202015,1,1,1},{202016,1,1,1},{202017,1,1,1},{202019,1,1,1},{110079,1,1,0},{110003,1,1,0},{110004,1,1,100},{110005,1,1,100},{110010,1,1,0},{110011,1,1,0},{110012,1,1,0},{110009,1,5,100}]}] | AB90: =R[-1]C -> [{0,[{1,100}],[{200000,1,1,70},{200001,1,1,70},{200002,1,1,70},{200003,1,1,70},{200006,1,1,70},{200010,1,1,12},{200011,1,1,12},{200012,1,1,12},{200013,1,1,12},{200015,1,1,12},{200016,1,1,12},{200017,1,1,12},{200019,1,1,12},{201000,1,1,70},{201001,1,1,70},{201002,1,1,70},{201003,1,1,70},{201006,1,1,70},{201010,1,1,12},{201011,1,1,12},{201012,1,1,12},{201013,1,1,12},{201015,1,1,12},{201016,1,1,12},{201017,1,1,12},{201019,1,1,12},{202000,1,1,70},{202001,1,1,70},{202002,1,1,70},{202003,1,1,70},{202006,1,1,70},{202010,1,1,12},{202011,1,1,12},{202012,1,1,12},{202013,1,1,12},{202015,1,1,12},{202016,1,1,12},{202017,1,1,12},{202019,1,1,12}]},{0,[{3,100}],[{110079,1,2,3},{110003,1,2,1},{110004,1,1,3},{110005,1,1,3},{110010,1,1,0},{110011,1,1,0},{110012,1,1,0}]},{0,[{10,100}],[{110009,1,1000,1}]}] | AC90: 15134
A91: 10088 | B91: 第88关 | C91: 10004 | D91: =R[-5]C+1 -> 18 | E91: =R[-5]C -> 3 | F91: 30 | G91: 10 | H91: 10 | I91: [{6050, 100}] | J91: 129 | K91: 0 | L91: 2 | N91: [{110009, 10000}, {110079,89}] | O91: {20,10} | P91: 6250 | Q91: 6043 | R91: 60 | S91: 20 | T91: 40 | U91: 60 | V91: 19104 | W91: yewai | X91: [{200030,1},{201030,1},{202030,1}] | Y91: =RC[-15]*3600/RC[-19]*RC[-17] -> 154800 | Z91: =RC[-15]*3600/RC[-20]*RC[-18] -> 0 | AA91: =R[-1]C -> [{0,[{0,9995},{1,5}],[{200000,1,1,70},{200001,1,1,70},{200002,1,1,70},{200003,1,1,70},{200006,1,1,70},{200010,1,1,1},{200011,1,1,1},{200012,1,1,1},{200013,1,1,1},{200015,1,1,1},{200016,1,1,1},{200017,1,1,1},{200019,1,1,1},{201000,1,1,70},{201001,1,1,70},{201002,1,1,70},{201003,1,1,70},{201006,1,1,70},{201010,1,1,1},{201011,1,1,1},{201012,1,1,1},{201013,1,1,1},{201015,1,1,1},{201016,1,1,1},{201017,1,1,1},{201019,1,1,1},{202000,1,1,70},{202001,1,1,30},{202002,1,1,30},{202003,1,1,30},{202006,1,1,30},{202010,1,1,1},{202011,1,1,1},{202012,1,1,1},{202013,1,1,1},{202015,1,1,1},{202016,1,1,1},{202017,1,1,1},{202019,1,1,1},{110079,1,1,0},{110003,1,1,0},{110004,1,1,100},{110005,1,1,100},{110010,1,1,0},{110011,1,1,0},{110012,1,1,0},{110009,1,5,100}]}] | AB91: =R[-1]C -> [{0,[{1,100}],[{200000,1,1,70},{200001,1,1,70},{200002,1,1,70},{200003,1,1,70},{200006,1,1,70},{200010,1,1,12},{200011,1,1,12},{200012,1,1,12},{200013,1,1,12},{200015,1,1,12},{200016,1,1,12},{200017,1,1,12},{200019,1,1,12},{201000,1,1,70},{201001,1,1,70},{201002,1,1,70},{201003,1,1,70},{201006,1,1,70},{201010,1,1,12},{201011,1,1,12},{201012,1,1,12},{201013,1,1,12},{201015,1,1,12},{201016,1,1,12},{201017,1,1,12},{201019,1,1,12},{202000,1,1,70},{202001,1,1,70},{202002,1,1,70},{202003,1,1,70},{202006,1,1,70},{202010,1,1,12},{202011,1,1,12},{202012,1,1,12},{202013,1,1,12},{202015,1,1,12},{202016,1,1,12},{202017,1,1,12},{202019,1,1,12}]},{0,[{3,100}],[{110079,1,2,3},{110003,1,2,1},{110004,1,1,3},{110005,1,1,3},{110010,1,1,0},{110011,1,1,0},{110012,1,1,0}]},{0,[{10,100}],[{110009,1,1000,1}]}] | AC91: 15229
A92: 10089 | B92: 第89关 | C92: 10005 | D92: =R[-5]C+1 -> 18 | E92: =R[-5]C -> 4 | F92: 30 | G92: 10 | H92: 10 | I92: [{6050, 100}] | J92: 130 | K92: 0 | L92: 2 | N92: [{110009, 10000}, {110079,90}] | O92: {20,10} | P92: 6250 | Q92: 6043 | R92: 60 | S92: 20 | T92: 40 | U92: 60 | V92: 19104 | W92: yewai | X92: [{200030,1},{201030,1},{202030,1}] | Y92: =RC[-15]*3600/RC[-19]*RC[-17] -> 156000 | Z92: =RC[-15]*3600/RC[-20]*RC[-18] -> 0 | AA92: =R[-1]C -> [{0,[{0,9995},{1,5}],[{200000,1,1,70},{200001,1,1,70},{200002,1,1,70},{200003,1,1,70},{200006,1,1,70},{200010,1,1,1},{200011,1,1,1},{200012,1,1,1},{200013,1,1,1},{200015,1,1,1},{200016,1,1,1},{200017,1,1,1},{200019,1,1,1},{201000,1,1,70},{201001,1,1,70},{201002,1,1,70},{201003,1,1,70},{201006,1,1,70},{201010,1,1,1},{201011,1,1,1},{201012,1,1,1},{201013,1,1,1},{201015,1,1,1},{201016,1,1,1},{201017,1,1,1},{201019,1,1,1},{202000,1,1,70},{202001,1,1,30},{202002,1,1,30},{202003,1,1,30},{202006,1,1,30},{202010,1,1,1},{202011,1,1,1},{202012,1,1,1},{202013,1,1,1},{202015,1,1,1},{202016,1,1,1},{202017,1,1,1},{202019,1,1,1},{110079,1,1,0},{110003,1,1,0},{110004,1,1,100},{110005,1,1,100},{110010,1,1,0},{110011,1,1,0},{110012,1,1,0},{110009,1,5,100}]}] | AB92: =R[-1]C -> [{0,[{1,100}],[{200000,1,1,70},{200001,1,1,70},{200002,1,1,70},{200003,1,1,70},{200006,1,1,70},{200010,1,1,12},{200011,1,1,12},{200012,1,1,12},{200013,1,1,12},{200015,1,1,12},{200016,1,1,12},{200017,1,1,12},{200019,1,1,12},{201000,1,1,70},{201001,1,1,70},{201002,1,1,70},{201003,1,1,70},{201006,1,1,70},{201010,1,1,12},{201011,1,1,12},{201012,1,1,12},{201013,1,1,12},{201015,1,1,12},{201016,1,1,12},{201017,1,1,12},{201019,1,1,12},{202000,1,1,70},{202001,1,1,70},{202002,1,1,70},{202003,1,1,70},{202006,1,1,70},{202010,1,1,12},{202011,1,1,12},{202012,1,1,12},{202013,1,1,12},{202015,1,1,12},{202016,1,1,12},{202017,1,1,12},{202019,1,1,12}]},{0,[{3,100}],[{110079,1,2,3},{110003,1,2,1},{110004,1,1,3},{110005,1,1,3},{110010,1,1,0},{110011,1,1,0},{110012,1,1,0}]},{0,[{10,100}],[{110009,1,1000,1}]}] | AC92: 15324
A93: 10090 | B93: 第90关 | C93: 10006 | D93: =R[-5]C+1 -> 18 | E93: =R[-5]C -> 5 | F93: 30 | G93: 10 | H93: 10 | I93: [{6050, 100}] | J93: 131 | K93: 0 | L93: 2 | N93: [{110009, 10000}, {110079,91}] | O93: {20,10} | P93: 6250 | Q93: 6043 | R93: 60 | S93: 20 | T93: 40 | U93: 60 | V93: 19104 | W93: yewai | X93: [{200030,1},{201030,1},{202030,1}] | Y93: =RC[-15]*3600/RC[-19]*RC[-17] -> 157200 | Z93: =RC[-15]*3600/RC[-20]*RC[-18] -> 0 | AA93: =R[-1]C -> [{0,[{0,9995},{1,5}],[{200000,1,1,70},{200001,1,1,70},{200002,1,1,70},{200003,1,1,70},{200006,1,1,70},{200010,1,1,1},{200011,1,1,1},{200012,1,1,1},{200013,1,1,1},{200015,1,1,1},{200016,1,1,1},{200017,1,1,1},{200019,1,1,1},{201000,1,1,70},{201001,1,1,70},{201002,1,1,70},{201003,1,1,70},{201006,1,1,70},{201010,1,1,1},{201011,1,1,1},{201012,1,1,1},{201013,1,1,1},{201015,1,1,1},{201016,1,1,1},{201017,1,1,1},{201019,1,1,1},{202000,1,1,70},{202001,1,1,30},{202002,1,1,30},{202003,1,1,30},{202006,1,1,30},{202010,1,1,1},{202011,1,1,1},{202012,1,1,1},{202013,1,1,1},{202015,1,1,1},{202016,1,1,1},{202017,1,1,1},{202019,1,1,1},{110079,1,1,0},{110003,1,1,0},{110004,1,1,100},{110005,1,1,100},{110010,1,1,0},{110011,1,1,0},{110012,1,1,0},{110009,1,5,100}]}] | AB93: =R[-1]C -> [{0,[{1,100}],[{200000,1,1,70},{200001,1,1,70},{200002,1,1,70},{200003,1,1,70},{200006,1,1,70},{200010,1,1,12},{200011,1,1,12},{200012,1,1,12},{200013,1,1,12},{200015,1,1,12},{200016,1,1,12},{200017,1,1,12},{200019,1,1,12},{201000,1,1,70},{201001,1,1,70},{201002,1,1,70},{201003,1,1,70},{201006,1,1,70},{201010,1,1,12},{201011,1,1,12},{201012,1,1,12},{201013,1,1,12},{201015,1,1,12},{201016,1,1,12},{201017,1,1,12},{201019,1,1,12},{202000,1,1,70},{202001,1,1,70},{202002,1,1,70},{202003,1,1,70},{202006,1,1,70},{202010,1,1,12},{202011,1,1,12},{202012,1,1,12},{202013,1,1,12},{202015,1,1,12},{202016,1,1,12},{202017,1,1,12},{202019,1,1,12}]},{0,[{3,100}],[{110079,1,2,3},{110003,1,2,1},{110004,1,1,3},{110005,1,1,3},{110010,1,1,0},{110011,1,1,0},{110012,1,1,0}]},{0,[{10,100}],[{110009,1,1000,1}]}] | AC93: 15419
A94: 10091 | B94: 第91关 | C94: 10002 | D94: =R[-5]C+1 -> 19 | E94: =R[-5]C -> 1 | F94: 30 | G94: 10 | H94: 10 | I94: [{6050, 100}] | J94: 132 | K94: 0 | L94: 2 | N94: [{110009, 10000}, {110079,92}] | O94: {20,10} | P94: 6250 | Q94: 6043 | R94: 60 | S94: 20 | T94: 40 | U94: 60 | V94: 19104 | W94: yewai | X94: [{200030,1},{201030,1},{202030,1}] | Y94: =RC[-15]*3600/RC[-19]*RC[-17] -> 158400 | Z94: =RC[-15]*3600/RC[-20]*RC[-18] -> 0 | AA94: =R[-1]C -> [{0,[{0,9995},{1,5}],[{200000,1,1,70},{200001,1,1,70},{200002,1,1,70},{200003,1,1,70},{200006,1,1,70},{200010,1,1,1},{200011,1,1,1},{200012,1,1,1},{200013,1,1,1},{200015,1,1,1},{200016,1,1,1},{200017,1,1,1},{200019,1,1,1},{201000,1,1,70},{201001,1,1,70},{201002,1,1,70},{201003,1,1,70},{201006,1,1,70},{201010,1,1,1},{201011,1,1,1},{201012,1,1,1},{201013,1,1,1},{201015,1,1,1},{201016,1,1,1},{201017,1,1,1},{201019,1,1,1},{202000,1,1,70},{202001,1,1,30},{202002,1,1,30},{202003,1,1,30},{202006,1,1,30},{202010,1,1,1},{202011,1,1,1},{202012,1,1,1},{202013,1,1,1},{202015,1,1,1},{202016,1,1,1},{202017,1,1,1},{202019,1,1,1},{110079,1,1,0},{110003,1,1,0},{110004,1,1,100},{110005,1,1,100},{110010,1,1,0},{110011,1,1,0},{110012,1,1,0},{110009,1,5,100}]}] | AB94: =R[-1]C -> [{0,[{1,100}],[{200000,1,1,70},{200001,1,1,70},{200002,1,1,70},{200003,1,1,70},{200006,1,1,70},{200010,1,1,12},{200011,1,1,12},{200012,1,1,12},{200013,1,1,12},{200015,1,1,12},{200016,1,1,12},{200017,1,1,12},{200019,1,1,12},{201000,1,1,70},{201001,1,1,70},{201002,1,1,70},{201003,1,1,70},{201006,1,1,70},{201010,1,1,12},{201011,1,1,12},{201012,1,1,12},{201013,1,1,12},{201015,1,1,12},{201016,1,1,12},{201017,1,1,12},{201019,1,1,12},{202000,1,1,70},{202001,1,1,70},{202002,1,1,70},{202003,1,1,70},{202006,1,1,70},{202010,1,1,12},{202011,1,1,12},{202012,1,1,12},{202013,1,1,12},{202015,1,1,12},{202016,1,1,12},{202017,1,1,12},{202019,1,1,12}]},{0,[{3,100}],[{110079,1,2,3},{110003,1,2,1},{110004,1,1,3},{110005,1,1,3},{110010,1,1,0},{110011,1,1,0},{110012,1,1,0}]},{0,[{10,100}],[{110009,1,1000,1}]}] | AC94: 15514
A95: 10092 | B95: 第92关 | C95: 10003 | D95: =R[-5]C+1 -> 19 | E95: =R[-5]C -> 2 | F95: 30 | G95: 10 | H95: 10 | I95: [{6050, 100}] | J95: 133 | K95: 0 | L95: 2 | N95: [{110009, 10000}, {110079,93}] | O95: {20,10} | P95: 6250 | Q95: 6043 | R95: 60 | S95: 20 | T95: 40 | U95: 60 | V95: 19104 | W95: yewai | X95: [{200030,1},{201030,1},{202030,1}] | Y95: =RC[-15]*3600/RC[-19]*RC[-17] -> 159600 | Z95: =RC[-15]*3600/RC[-20]*RC[-18] -> 0 | AA95: =R[-1]C -> [{0,[{0,9995},{1,5}],[{200000,1,1,70},{200001,1,1,70},{200002,1,1,70},{200003,1,1,70},{200006,1,1,70},{200010,1,1,1},{200011,1,1,1},{200012,1,1,1},{200013,1,1,1},{200015,1,1,1},{200016,1,1,1},{200017,1,1,1},{200019,1,1,1},{201000,1,1,70},{201001,1,1,70},{201002,1,1,70},{201003,1,1,70},{201006,1,1,70},{201010,1,1,1},{201011,1,1,1},{201012,1,1,1},{201013,1,1,1},{201015,1,1,1},{201016,1,1,1},{201017,1,1,1},{201019,1,1,1},{202000,1,1,70},{202001,1,1,30},{202002,1,1,30},{202003,1,1,30},{202006,1,1,30},{202010,1,1,1},{202011,1,1,1},{202012,1,1,1},{202013,1,1,1},{202015,1,1,1},{202016,1,1,1},{202017,1,1,1},{202019,1,1,1},{110079,1,1,0},{110003,1,1,0},{110004,1,1,100},{110005,1,1,100},{110010,1,1,0},{110011,1,1,0},{110012,1,1,0},{110009,1,5,100}]}] | AB95: =R[-1]C -> [{0,[{1,100}],[{200000,1,1,70},{200001,1,1,70},{200002,1,1,70},{200003,1,1,70},{200006,1,1,70},{200010,1,1,12},{200011,1,1,12},{200012,1,1,12},{200013,1,1,12},{200015,1,1,12},{200016,1,1,12},{200017,1,1,12},{200019,1,1,12},{201000,1,1,70},{201001,1,1,70},{201002,1,1,70},{201003,1,1,70},{201006,1,1,70},{201010,1,1,12},{201011,1,1,12},{201012,1,1,12},{201013,1,1,12},{201015,1,1,12},{201016,1,1,12},{201017,1,1,12},{201019,1,1,12},{202000,1,1,70},{202001,1,1,70},{202002,1,1,70},{202003,1,1,70},{202006,1,1,70},{202010,1,1,12},{202011,1,1,12},{202012,1,1,12},{202013,1,1,12},{202015,1,1,12},{202016,1,1,12},{202017,1,1,12},{202019,1,1,12}]},{0,[{3,100}],[{110079,1,2,3},{110003,1,2,1},{110004,1,1,3},{110005,1,1,3},{110010,1,1,0},{110011,1,1,0},{110012,1,1,0}]},{0,[{10,100}],[{110009,1,1000,1}]}] | AC95: 15609
A96: 10093 | B96: 第93关 | C96: 10004 | D96: =R[-5]C+1 -> 19 | E96: =R[-5]C -> 3 | F96: 30 | G96: 10 | H96: 10 | I96: [{6050, 100}] | J96: 134 | K96: 0 | L96: 2 | N96: [{110009, 10000}, {110079,94}] | O96: {20,10} | P96: 6250 | Q96: 6043 | R96: 60 | S96: 20 | T96: 40 | U96: 60 | V96: 19104 | W96: yewai | X96: [{200030,1},{201030,1},{202030,1}] | Y96: =RC[-15]*3600/RC[-19]*RC[-17] -> 160800 | Z96: =RC[-15]*3600/RC[-20]*RC[-18] -> 0 | AA96: =R[-1]C -> [{0,[{0,9995},{1,5}],[{200000,1,1,70},{200001,1,1,70},{200002,1,1,70},{200003,1,1,70},{200006,1,1,70},{200010,1,1,1},{200011,1,1,1},{200012,1,1,1},{200013,1,1,1},{200015,1,1,1},{200016,1,1,1},{200017,1,1,1},{200019,1,1,1},{201000,1,1,70},{201001,1,1,70},{201002,1,1,70},{201003,1,1,70},{201006,1,1,70},{201010,1,1,1},{201011,1,1,1},{201012,1,1,1},{201013,1,1,1},{201015,1,1,1},{201016,1,1,1},{201017,1,1,1},{201019,1,1,1},{202000,1,1,70},{202001,1,1,30},{202002,1,1,30},{202003,1,1,30},{202006,1,1,30},{202010,1,1,1},{202011,1,1,1},{202012,1,1,1},{202013,1,1,1},{202015,1,1,1},{202016,1,1,1},{202017,1,1,1},{202019,1,1,1},{110079,1,1,0},{110003,1,1,0},{110004,1,1,100},{110005,1,1,100},{110010,1,1,0},{110011,1,1,0},{110012,1,1,0},{110009,1,5,100}]}] | AB96: =R[-1]C -> [{0,[{1,100}],[{200000,1,1,70},{200001,1,1,70},{200002,1,1,70},{200003,1,1,70},{200006,1,1,70},{200010,1,1,12},{200011,1,1,12},{200012,1,1,12},{200013,1,1,12},{200015,1,1,12},{200016,1,1,12},{200017,1,1,12},{200019,1,1,12},{201000,1,1,70},{201001,1,1,70},{201002,1,1,70},{201003,1,1,70},{201006,1,1,70},{201010,1,1,12},{201011,1,1,12},{201012,1,1,12},{201013,1,1,12},{201015,1,1,12},{201016,1,1,12},{201017,1,1,12},{201019,1,1,12},{202000,1,1,70},{202001,1,1,70},{202002,1,1,70},{202003,1,1,70},{202006,1,1,70},{202010,1,1,12},{202011,1,1,12},{202012,1,1,12},{202013,1,1,12},{202015,1,1,12},{202016,1,1,12},{202017,1,1,12},{202019,1,1,12}]},{0,[{3,100}],[{110079,1,2,3},{110003,1,2,1},{110004,1,1,3},{110005,1,1,3},{110010,1,1,0},{110011,1,1,0},{110012,1,1,0}]},{0,[{10,100}],[{110009,1,1000,1}]}] | AC96: 15704
A97: 10094 | B97: 第94关 | C97: 10005 | D97: =R[-5]C+1 -> 19 | E97: =R[-5]C -> 4 | F97: 30 | G97: 10 | H97: 10 | I97: [{6050, 100}] | J97: 135 | K97: 0 | L97: 2 | N97: [{110009, 10000}, {110079,95}] | O97: {20,10} | P97: 6250 | Q97: 6043 | R97: 60 | S97: 20 | T97: 40 | U97: 60 | V97: 19104 | W97: yewai | X97: [{200030,1},{201030,1},{202030,1}] | Y97: =RC[-15]*3600/RC[-19]*RC[-17] -> 162000 | Z97: =RC[-15]*3600/RC[-20]*RC[-18] -> 0 | AA97: =R[-1]C -> [{0,[{0,9995},{1,5}],[{200000,1,1,70},{200001,1,1,70},{200002,1,1,70},{200003,1,1,70},{200006,1,1,70},{200010,1,1,1},{200011,1,1,1},{200012,1,1,1},{200013,1,1,1},{200015,1,1,1},{200016,1,1,1},{200017,1,1,1},{200019,1,1,1},{201000,1,1,70},{201001,1,1,70},{201002,1,1,70},{201003,1,1,70},{201006,1,1,70},{201010,1,1,1},{201011,1,1,1},{201012,1,1,1},{201013,1,1,1},{201015,1,1,1},{201016,1,1,1},{201017,1,1,1},{201019,1,1,1},{202000,1,1,70},{202001,1,1,30},{202002,1,1,30},{202003,1,1,30},{202006,1,1,30},{202010,1,1,1},{202011,1,1,1},{202012,1,1,1},{202013,1,1,1},{202015,1,1,1},{202016,1,1,1},{202017,1,1,1},{202019,1,1,1},{110079,1,1,0},{110003,1,1,0},{110004,1,1,100},{110005,1,1,100},{110010,1,1,0},{110011,1,1,0},{110012,1,1,0},{110009,1,5,100}]}] | AB97: =R[-1]C -> [{0,[{1,100}],[{200000,1,1,70},{200001,1,1,70},{200002,1,1,70},{200003,1,1,70},{200006,1,1,70},{200010,1,1,12},{200011,1,1,12},{200012,1,1,12},{200013,1,1,12},{200015,1,1,12},{200016,1,1,12},{200017,1,1,12},{200019,1,1,12},{201000,1,1,70},{201001,1,1,70},{201002,1,1,70},{201003,1,1,70},{201006,1,1,70},{201010,1,1,12},{201011,1,1,12},{201012,1,1,12},{201013,1,1,12},{201015,1,1,12},{201016,1,1,12},{201017,1,1,12},{201019,1,1,12},{202000,1,1,70},{202001,1,1,70},{202002,1,1,70},{202003,1,1,70},{202006,1,1,70},{202010,1,1,12},{202011,1,1,12},{202012,1,1,12},{202013,1,1,12},{202015,1,1,12},{202016,1,1,12},{202017,1,1,12},{202019,1,1,12}]},{0,[{3,100}],[{110079,1,2,3},{110003,1,2,1},{110004,1,1,3},{110005,1,1,3},{110010,1,1,0},{110011,1,1,0},{110012,1,1,0}]},{0,[{10,100}],[{110009,1,1000,1}]}] | AC97: 15799
A98: 10095 | B98: 第95关 | C98: 10006 | D98: =R[-5]C+1 -> 19 | E98: =R[-5]C -> 5 | F98: 30 | G98: 10 | H98: 10 | I98: [{6050, 100}] | J98: 136 | K98: 0 | L98: 2 | N98: [{110009, 10000}, {110079,96}] | O98: {20,10} | P98: 6250 | Q98: 6043 | R98: 60 | S98: 20 | T98: 40 | U98: 60 | V98: 19104 | W98: yewai | X98: [{200030,1},{201030,1},{202030,1}] | Y98: =RC[-15]*3600/RC[-19]*RC[-17] -> 163200 | Z98: =RC[-15]*3600/RC[-20]*RC[-18] -> 0 | AA98: =R[-1]C -> [{0,[{0,9995},{1,5}],[{200000,1,1,70},{200001,1,1,70},{200002,1,1,70},{200003,1,1,70},{200006,1,1,70},{200010,1,1,1},{200011,1,1,1},{200012,1,1,1},{200013,1,1,1},{200015,1,1,1},{200016,1,1,1},{200017,1,1,1},{200019,1,1,1},{201000,1,1,70},{201001,1,1,70},{201002,1,1,70},{201003,1,1,70},{201006,1,1,70},{201010,1,1,1},{201011,1,1,1},{201012,1,1,1},{201013,1,1,1},{201015,1,1,1},{201016,1,1,1},{201017,1,1,1},{201019,1,1,1},{202000,1,1,70},{202001,1,1,30},{202002,1,1,30},{202003,1,1,30},{202006,1,1,30},{202010,1,1,1},{202011,1,1,1},{202012,1,1,1},{202013,1,1,1},{202015,1,1,1},{202016,1,1,1},{202017,1,1,1},{202019,1,1,1},{110079,1,1,0},{110003,1,1,0},{110004,1,1,100},{110005,1,1,100},{110010,1,1,0},{110011,1,1,0},{110012,1,1,0},{110009,1,5,100}]}] | AB98: =R[-1]C -> [{0,[{1,100}],[{200000,1,1,70},{200001,1,1,70},{200002,1,1,70},{200003,1,1,70},{200006,1,1,70},{200010,1,1,12},{200011,1,1,12},{200012,1,1,12},{200013,1,1,12},{200015,1,1,12},{200016,1,1,12},{200017,1,1,12},{200019,1,1,12},{201000,1,1,70},{201001,1,1,70},{201002,1,1,70},{201003,1,1,70},{201006,1,1,70},{201010,1,1,12},{201011,1,1,12},{201012,1,1,12},{201013,1,1,12},{201015,1,1,12},{201016,1,1,12},{201017,1,1,12},{201019,1,1,12},{202000,1,1,70},{202001,1,1,70},{202002,1,1,70},{202003,1,1,70},{202006,1,1,70},{202010,1,1,12},{202011,1,1,12},{202012,1,1,12},{202013,1,1,12},{202015,1,1,12},{202016,1,1,12},{202017,1,1,12},{202019,1,1,12}]},{0,[{3,100}],[{110079,1,2,3},{110003,1,2,1},{110004,1,1,3},{110005,1,1,3},{110010,1,1,0},{110011,1,1,0},{110012,1,1,0}]},{0,[{10,100}],[{110009,1,1000,1}]}] | AC98: 15894
A99: 10096 | B99: 第96关 | C99: 10002 | D99: =R[-5]C+1 -> 20 | E99: =R[-5]C -> 1 | F99: 30 | G99: 10 | H99: 10 | I99: [{6050, 100}] | J99: 137 | K99: 0 | L99: 2 | N99: [{110009, 10000}, {110079,97}] | O99: {20,10} | P99: 6250 | Q99: 6043 | R99: 60 | S99: 20 | T99: 40 | U99: 60 | V99: 19104 | W99: yewai | X99: [{200030,1},{201030,1},{202030,1}] | Y99: =RC[-15]*3600/RC[-19]*RC[-17] -> 164400 | Z99: =RC[-15]*3600/RC[-20]*RC[-18] -> 0 | AA99: =R[-1]C -> [{0,[{0,9995},{1,5}],[{200000,1,1,70},{200001,1,1,70},{200002,1,1,70},{200003,1,1,70},{200006,1,1,70},{200010,1,1,1},{200011,1,1,1},{200012,1,1,1},{200013,1,1,1},{200015,1,1,1},{200016,1,1,1},{200017,1,1,1},{200019,1,1,1},{201000,1,1,70},{201001,1,1,70},{201002,1,1,70},{201003,1,1,70},{201006,1,1,70},{201010,1,1,1},{201011,1,1,1},{201012,1,1,1},{201013,1,1,1},{201015,1,1,1},{201016,1,1,1},{201017,1,1,1},{201019,1,1,1},{202000,1,1,70},{202001,1,1,30},{202002,1,1,30},{202003,1,1,30},{202006,1,1,30},{202010,1,1,1},{202011,1,1,1},{202012,1,1,1},{202013,1,1,1},{202015,1,1,1},{202016,1,1,1},{202017,1,1,1},{202019,1,1,1},{110079,1,1,0},{110003,1,1,0},{110004,1,1,100},{110005,1,1,100},{110010,1,1,0},{110011,1,1,0},{110012,1,1,0},{110009,1,5,100}]}] | AB99: =R[-1]C -> [{0,[{1,100}],[{200000,1,1,70},{200001,1,1,70},{200002,1,1,70},{200003,1,1,70},{200006,1,1,70},{200010,1,1,12},{200011,1,1,12},{200012,1,1,12},{200013,1,1,12},{200015,1,1,12},{200016,1,1,12},{200017,1,1,12},{200019,1,1,12},{201000,1,1,70},{201001,1,1,70},{201002,1,1,70},{201003,1,1,70},{201006,1,1,70},{201010,1,1,12},{201011,1,1,12},{201012,1,1,12},{201013,1,1,12},{201015,1,1,12},{201016,1,1,12},{201017,1,1,12},{201019,1,1,12},{202000,1,1,70},{202001,1,1,70},{202002,1,1,70},{202003,1,1,70},{202006,1,1,70},{202010,1,1,12},{202011,1,1,12},{202012,1,1,12},{202013,1,1,12},{202015,1,1,12},{202016,1,1,12},{202017,1,1,12},{202019,1,1,12}]},{0,[{3,100}],[{110079,1,2,3},{110003,1,2,1},{110004,1,1,3},{110005,1,1,3},{110010,1,1,0},{110011,1,1,0},{110012,1,1,0}]},{0,[{10,100}],[{110009,1,1000,1}]}] | AC99: 15989
A100: 10097 | B100: 第97关 | C100: 10003 | D100: =R[-5]C+1 -> 20 | E100: =R[-5]C -> 2 | F100: 30 | G100: 10 | H100: 10 | I100: [{6050, 100}] | J100: 138 | K100: 0 | L100: 2 | N100: [{110009, 10000}, {110079,98}] | O100: {20,10} | P100: 6250 | Q100: 6043 | R100: 60 | S100: 20 | T100: 40 | U100: 60 | V100: 19104 | W100: yewai | X100: [{200030,1},{201030,1},{202030,1}] | Y100: =RC[-15]*3600/RC[-19]*RC[-17] -> 165600 | Z100: =RC[-15]*3600/RC[-20]*RC[-18] -> 0 | AA100: =R[-1]C -> [{0,[{0,9995},{1,5}],[{200000,1,1,70},{200001,1,1,70},{200002,1,1,70},{200003,1,1,70},{200006,1,1,70},{200010,1,1,1},{200011,1,1,1},{200012,1,1,1},{200013,1,1,1},{200015,1,1,1},{200016,1,1,1},{200017,1,1,1},{200019,1,1,1},{201000,1,1,70},{201001,1,1,70},{201002,1,1,70},{201003,1,1,70},{201006,1,1,70},{201010,1,1,1},{201011,1,1,1},{201012,1,1,1},{201013,1,1,1},{201015,1,1,1},{201016,1,1,1},{201017,1,1,1},{201019,1,1,1},{202000,1,1,70},{202001,1,1,30},{202002,1,1,30},{202003,1,1,30},{202006,1,1,30},{202010,1,1,1},{202011,1,1,1},{202012,1,1,1},{202013,1,1,1},{202015,1,1,1},{202016,1,1,1},{202017,1,1,1},{202019,1,1,1},{110079,1,1,0},{110003,1,1,0},{110004,1,1,100},{110005,1,1,100},{110010,1,1,0},{110011,1,1,0},{110012,1,1,0},{110009,1,5,100}]}] | AB100: =R[-1]C -> [{0,[{1,100}],[{200000,1,1,70},{200001,1,1,70},{200002,1,1,70},{200003,1,1,70},{200006,1,1,70},{200010,1,1,12},{200011,1,1,12},{200012,1,1,12},{200013,1,1,12},{200015,1,1,12},{200016,1,1,12},{200017,1,1,12},{200019,1,1,12},{201000,1,1,70},{201001,1,1,70},{201002,1,1,70},{201003,1,1,70},{201006,1,1,70},{201010,1,1,12},{201011,1,1,12},{201012,1,1,12},{201013,1,1,12},{201015,1,1,12},{201016,1,1,12},{201017,1,1,12},{201019,1,1,12},{202000,1,1,70},{202001,1,1,70},{202002,1,1,70},{202003,1,1,70},{202006,1,1,70},{202010,1,1,12},{202011,1,1,12},{202012,1,1,12},{202013,1,1,12},{202015,1,1,12},{202016,1,1,12},{202017,1,1,12},{202019,1,1,12}]},{0,[{3,100}],[{110079,1,2,3},{110003,1,2,1},{110004,1,1,3},{110005,1,1,3},{110010,1,1,0},{110011,1,1,0},{110012,1,1,0}]},{0,[{10,100}],[{110009,1,1000,1}]}] | AC100: 16084
A101: 10098 | B101: 第98关 | C101: 10004 | D101: =R[-5]C+1 -> 20 | E101: =R[-5]C -> 3 | F101: 30 | G101: 10 | H101: 10 | I101: [{6050, 100}] | J101: 139 | K101: 0 | L101: 2 | N101: [{110009, 10000}, {110079,99}] | O101: {20,10} | P101: 6250 | Q101: 6043 | R101: 60 | S101: 20 | T101: 40 | U101: 60 | V101: 19104 | W101: yewai | X101: [{200030,1},{201030,1},{202030,1}] | Y101: =RC[-15]*3600/RC[-19]*RC[-17] -> 166800 | Z101: =RC[-15]*3600/RC[-20]*RC[-18] -> 0 | AA101: =R[-1]C -> [{0,[{0,9995},{1,5}],[{200000,1,1,70},{200001,1,1,70},{200002,1,1,70},{200003,1,1,70},{200006,1,1,70},{200010,1,1,1},{200011,1,1,1},{200012,1,1,1},{200013,1,1,1},{200015,1,1,1},{200016,1,1,1},{200017,1,1,1},{200019,1,1,1},{201000,1,1,70},{201001,1,1,70},{201002,1,1,70},{201003,1,1,70},{201006,1,1,70},{201010,1,1,1},{201011,1,1,1},{201012,1,1,1},{201013,1,1,1},{201015,1,1,1},{201016,1,1,1},{201017,1,1,1},{201019,1,1,1},{202000,1,1,70},{202001,1,1,30},{202002,1,1,30},{202003,1,1,30},{202006,1,1,30},{202010,1,1,1},{202011,1,1,1},{202012,1,1,1},{202013,1,1,1},{202015,1,1,1},{202016,1,1,1},{202017,1,1,1},{202019,1,1,1},{110079,1,1,0},{110003,1,1,0},{110004,1,1,100},{110005,1,1,100},{110010,1,1,0},{110011,1,1,0},{110012,1,1,0},{110009,1,5,100}]}] | AB101: =R[-1]C -> [{0,[{1,100}],[{200000,1,1,70},{200001,1,1,70},{200002,1,1,70},{200003,1,1,70},{200006,1,1,70},{200010,1,1,12},{200011,1,1,12},{200012,1,1,12},{200013,1,1,12},{200015,1,1,12},{200016,1,1,12},{200017,1,1,12},{200019,1,1,12},{201000,1,1,70},{201001,1,1,70},{201002,1,1,70},{201003,1,1,70},{201006,1,1,70},{201010,1,1,12},{201011,1,1,12},{201012,1,1,12},{201013,1,1,12},{201015,1,1,12},{201016,1,1,12},{201017,1,1,12},{201019,1,1,12},{202000,1,1,70},{202001,1,1,70},{202002,1,1,70},{202003,1,1,70},{202006,1,1,70},{202010,1,1,12},{202011,1,1,12},{202012,1,1,12},{202013,1,1,12},{202015,1,1,12},{202016,1,1,12},{202017,1,1,12},{202019,1,1,12}]},{0,[{3,100}],[{110079,1,2,3},{110003,1,2,1},{110004,1,1,3},{110005,1,1,3},{110010,1,1,0},{110011,1,1,0},{110012,1,1,0}]},{0,[{10,100}],[{110009,1,1000,1}]}] | AC101: 16179
A102: 10099 | B102: 第99关 | C102: 10005 | D102: =R[-5]C+1 -> 20 | E102: =R[-5]C -> 4 | F102: 30 | G102: 10 | H102: 10 | I102: [{6050, 100}] | J102: 140 | K102: 0 | L102: 2 | N102: [{110009, 10000}, {110079,100}] | O102: {20,10} | P102: 6250 | Q102: 6043 | R102: 60 | S102: 20 | T102: 40 | U102: 60 | V102: 19104 | W102: yewai | X102: [{200030,1},{201030,1},{202030,1}] | Y102: =RC[-15]*3600/RC[-19]*RC[-17] -> 168000 | Z102: =RC[-15]*3600/RC[-20]*RC[-18] -> 0 | AA102: =R[-1]C -> [{0,[{0,9995},{1,5}],[{200000,1,1,70},{200001,1,1,70},{200002,1,1,70},{200003,1,1,70},{200006,1,1,70},{200010,1,1,1},{200011,1,1,1},{200012,1,1,1},{200013,1,1,1},{200015,1,1,1},{200016,1,1,1},{200017,1,1,1},{200019,1,1,1},{201000,1,1,70},{201001,1,1,70},{201002,1,1,70},{201003,1,1,70},{201006,1,1,70},{201010,1,1,1},{201011,1,1,1},{201012,1,1,1},{201013,1,1,1},{201015,1,1,1},{201016,1,1,1},{201017,1,1,1},{201019,1,1,1},{202000,1,1,70},{202001,1,1,30},{202002,1,1,30},{202003,1,1,30},{202006,1,1,30},{202010,1,1,1},{202011,1,1,1},{202012,1,1,1},{202013,1,1,1},{202015,1,1,1},{202016,1,1,1},{202017,1,1,1},{202019,1,1,1},{110079,1,1,0},{110003,1,1,0},{110004,1,1,100},{110005,1,1,100},{110010,1,1,0},{110011,1,1,0},{110012,1,1,0},{110009,1,5,100}]}] | AB102: =R[-1]C -> [{0,[{1,100}],[{200000,1,1,70},{200001,1,1,70},{200002,1,1,70},{200003,1,1,70},{200006,1,1,70},{200010,1,1,12},{200011,1,1,12},{200012,1,1,12},{200013,1,1,12},{200015,1,1,12},{200016,1,1,12},{200017,1,1,12},{200019,1,1,12},{201000,1,1,70},{201001,1,1,70},{201002,1,1,70},{201003,1,1,70},{201006,1,1,70},{201010,1,1,12},{201011,1,1,12},{201012,1,1,12},{201013,1,1,12},{201015,1,1,12},{201016,1,1,12},{201017,1,1,12},{201019,1,1,12},{202000,1,1,70},{202001,1,1,70},{202002,1,1,70},{202003,1,1,70},{202006,1,1,70},{202010,1,1,12},{202011,1,1,12},{202012,1,1,12},{202013,1,1,12},{202015,1,1,12},{202016,1,1,12},{202017,1,1,12},{202019,1,1,12}]},{0,[{3,100}],[{110079,1,2,3},{110003,1,2,1},{110004,1,1,3},{110005,1,1,3},{110010,1,1,0},{110011,1,1,0},{110012,1,1,0}]},{0,[{10,100}],[{110009,1,1000,1}]}] | AC102: 16274
A103: 10100 | B103: 第100关 | C103: 10006 | D103: =R[-5]C+1 -> 20 | E103: =R[-5]C -> 5 | F103: 30 | G103: 10 | H103: 10 | I103: [{6050, 100}] | J103: 141 | K103: 0 | L103: 2 | N103: [{110009, 10000}, {110079,101}] | O103: {20,10} | P103: 6250 | Q103: 6043 | R103: 60 | S103: 20 | T103: 40 | U103: 60 | V103: 19104 | W103: yewai | X103: [{200030,1},{201030,1},{202030,1}] | Y103: =RC[-15]*3600/RC[-19]*RC[-17] -> 169200 | Z103: =RC[-15]*3600/RC[-20]*RC[-18] -> 0 | AA103: =R[-1]C -> [{0,[{0,9995},{1,5}],[{200000,1,1,70},{200001,1,1,70},{200002,1,1,70},{200003,1,1,70},{200006,1,1,70},{200010,1,1,1},{200011,1,1,1},{200012,1,1,1},{200013,1,1,1},{200015,1,1,1},{200016,1,1,1},{200017,1,1,1},{200019,1,1,1},{201000,1,1,70},{201001,1,1,70},{201002,1,1,70},{201003,1,1,70},{201006,1,1,70},{201010,1,1,1},{201011,1,1,1},{201012,1,1,1},{201013,1,1,1},{201015,1,1,1},{201016,1,1,1},{201017,1,1,1},{201019,1,1,1},{202000,1,1,70},{202001,1,1,30},{202002,1,1,30},{202003,1,1,30},{202006,1,1,30},{202010,1,1,1},{202011,1,1,1},{202012,1,1,1},{202013,1,1,1},{202015,1,1,1},{202016,1,1,1},{202017,1,1,1},{202019,1,1,1},{110079,1,1,0},{110003,1,1,0},{110004,1,1,100},{110005,1,1,100},{110010,1,1,0},{110011,1,1,0},{110012,1,1,0},{110009,1,5,100}]}] | AB103: =R[-1]C -> [{0,[{1,100}],[{200000,1,1,70},{200001,1,1,70},{200002,1,1,70},{200003,1,1,70},{200006,1,1,70},{200010,1,1,12},{200011,1,1,12},{200012,1,1,12},{200013,1,1,12},{200015,1,1,12},{200016,1,1,12},{200017,1,1,12},{200019,1,1,12},{201000,1,1,70},{201001,1,1,70},{201002,1,1,70},{201003,1,1,70},{201006,1,1,70},{201010,1,1,12},{201011,1,1,12},{201012,1,1,12},{201013,1,1,12},{201015,1,1,12},{201016,1,1,12},{201017,1,1,12},{201019,1,1,12},{202000,1,1,70},{202001,1,1,70},{202002,1,1,70},{202003,1,1,70},{202006,1,1,70},{202010,1,1,12},{202011,1,1,12},{202012,1,1,12},{202013,1,1,12},{202015,1,1,12},{202016,1,1,12},{202017,1,1,12},{202019,1,1,12}]},{0,[{3,100}],[{110079,1,2,3},{110003,1,2,1},{110004,1,1,3},{110005,1,1,3},{110010,1,1,0},{110011,1,1,0},{110012,1,1,0}]},{0,[{10,100}],[{110009,1,1000,1}]}] | AC103: 16369

Sheet: 说明
A1: 怪物列表元素说明: {怪物id, 概率}
A2: 掉落配置: [{职业限制, [{数量, 概率}, …], [{物品id, 数量, 概率}, …]}, …]

Sheet: 小怪掉落
A1: 挂机小怪：白装、绿装掉落
A2: 10级怪物（1-10级装备掉落） | J2: 20级怪物（1-20级装备掉落） | S2: 30级怪物（11-30级装备掉落） | AB2: 40级怪物（11-30级装备掉落） | AK2: 50级怪物（11-30级装备掉落）
A3: ID | B3: 名称 | C3: 品质 | D3: 是否绑定 | E3: 数量 | F3: 概率 | J3: ID | K3: 名称 | L3: 品质 | M3: 是否绑定 | N3: 数量 | S3: ID | T3: 名称 | U3: 品质 | V3: 是否绑定 | W3: 数量 | AB3: ID | AC3: 名称 | AD3: 品质 | AE3: 是否绑定 | AF3: 数量 | AK3: ID | AL3: 名称 | AM3: 品质 | AN3: 是否绑定 | AO3: 数量
A4: 200000 | B4: 八荒 | C4: 1 | D4: 1 | E4: 1 | F4: 100 | G4: ="{"&RC[-6]&","&RC[-3]&","&RC[-2]&","&RC[-1]&"}," -> {200000,1,1,100}, | H4: =RC[-1] -> {200000,1,1,100}, | J4: 200000 | K4: 八荒 | L4: 1 | M4: 1 | N4: 1 | O4: 60 | P4: ="{"&RC[-6]&","&RC[-3]&","&RC[-2]&","&RC[-1]&"}," -> {200000,1,1,60}, | Q4: =RC[-1] -> {200000,1,1,60}, | S4: 200000 | T4: 八荒 | U4: 1 | V4: 1 | W4: 1 | X4: 70 | Y4: ="{"&RC[-6]&","&RC[-3]&","&RC[-2]&","&RC[-1]&"}," -> {200000,1,1,70}, | Z4: =RC[-1] -> {200000,1,1,70}, | AB4: 200000 | AC4: 八荒 | AD4: 1 | AE4: 1 | AF4: 1 | AG4: 70 | AH4: ="{"&RC[-6]&","&RC[-3]&","&RC[-2]&","&RC[-1]&"}," -> {200000,1,1,70}, | AI4: =RC[-1] -> {200000,1,1,70}, | AK4: 200000 | AL4: 八荒 | AM4: 1 | AN4: 1 | AO4: 1 | AP4: 70 | AQ4: ="{"&RC[-6]&","&RC[-3]&","&RC[-2]&","&RC[-1]&"}," -> {200000,1,1,70}, | AR4: =RC[-1] -> {200000,1,1,70},
A5: 200001 | B5: 轻盔 | C5: 1 | D5: 1 | E5: 1 | F5: 100 | G5: ="{"&RC[-6]&","&RC[-3]&","&RC[-2]&","&RC[-1]&"}," -> {200001,1,1,100}, | H5: =R[-1]C&RC[-1] -> {200000,1,1,100},{200001,1,1,100}, | J5: 200001 | K5: 轻盔 | L5: 1 | M5: 1 | N5: 1 | O5: 60 | P5: ="{"&RC[-6]&","&RC[-3]&","&RC[-2]&","&RC[-1]&"}," -> {200001,1,1,60}, | Q5: =R[-1]C&RC[-1] -> {200000,1,1,60},{200001,1,1,60}, | S5: 200001 | T5: 轻盔 | U5: 1 | V5: 1 | W5: 1 | X5: 70 | Y5: ="{"&RC[-6]&","&RC[-3]&","&RC[-2]&","&RC[-1]&"}," -> {200001,1,1,70}, | Z5: =R[-1]C&RC[-1] -> {200000,1,1,70},{200001,1,1,70}, | AB5: 200001 | AC5: 轻盔 | AD5: 1 | AE5: 1 | AF5: 1 | AG5: 70 | AH5: ="{"&RC[-6]&","&RC[-3]&","&RC[-2]&","&RC[-1]&"}," -> {200001,1,1,70}, | AI5: =R[-1]C&RC[-1] -> {200000,1,1,70},{200001,1,1,70}, | AK5: 200001 | AL5: 轻盔 | AM5: 1 | AN5: 1 | AO5: 1 | AP5: 70 | AQ5: ="{"&RC[-6]&","&RC[-3]&","&RC[-2]&","&RC[-1]&"}," -> {200001,1,1,70}, | AR5: =R[-1]C&RC[-1] -> {200000,1,1,70},{200001,1,1,70},
A6: 200002 | B6: 珊瑚戒指 | C6: 1 | D6: 1 | E6: 1 | F6: 100 | G6: ="{"&RC[-6]&","&RC[-3]&","&RC[-2]&","&RC[-1]&"}," -> {200002,1,1,100}, | H6: =R[-1]C&RC[-1] -> {200000,1,1,100},{200001,1,1,100},{200002,1,1,100}, | J6: 200002 | K6: 珊瑚戒指 | L6: 1 | M6: 1 | N6: 1 | O6: 60 | P6: ="{"&RC[-6]&","&RC[-3]&","&RC[-2]&","&RC[-1]&"}," -> {200002,1,1,60}, | Q6: =R[-1]C&RC[-1] -> {200000,1,1,60},{200001,1,1,60},{200002,1,1,60}, | S6: 200002 | T6: 珊瑚戒指 | U6: 1 | V6: 1 | W6: 1 | X6: 70 | Y6: ="{"&RC[-6]&","&RC[-3]&","&RC[-2]&","&RC[-1]&"}," -> {200002,1,1,70}, | Z6: =R[-1]C&RC[-1] -> {200000,1,1,70},{200001,1,1,70},{200002,1,1,70}, | AB6: 200002 | AC6: 珊瑚戒指 | AD6: 1 | AE6: 1 | AF6: 1 | AG6: 70 | AH6: ="{"&RC[-6]&","&RC[-3]&","&RC[-2]&","&RC[-1]&"}," -> {200002,1,1,70}, | AI6: =R[-1]C&RC[-1] -> {200000,1,1,70},{200001,1,1,70},{200002,1,1,70}, | AK6: 200002 | AL6: 珊瑚戒指 | AM6: 1 | AN6: 1 | AO6: 1 | AP6: 70 | AQ6: ="{"&RC[-6]&","&RC[-3]&","&RC[-2]&","&RC[-1]&"}," -> {200002,1,1,70}, | AR6: =R[-1]C&RC[-1] -> {200000,1,1,70},{200001,1,1,70},{200002,1,1,70},
A7: 200003 | B7: 魔力手镯 | C7: 1 | D7: 1 | E7: 1 | F7: 100 | G7: ="{"&RC[-6]&","&RC[-3]&","&RC[-2]&","&RC[-1]&"}," -> {200003,1,1,100}, | H7: =R[-1]C&RC[-1] -> {200000,1,1,100},{200001,1,1,100},{200002,1,1,100},{200003,1,1,100}, | J7: 200003 | K7: 魔力手镯 | L7: 1 | M7: 1 | N7: 1 | O7: 60 | P7: ="{"&RC[-6]&","&RC[-3]&","&RC[-2]&","&RC[-1]&"}," -> {200003,1,1,60}, | Q7: =R[-1]C&RC[-1] -> {200000,1,1,60},{200001,1,1,60},{200002,1,1,60},{200003,1,1,60}, | S7: 200003 | T7: 魔力手镯 | U7: 1 | V7: 1 | W7: 1 | X7: 70 | Y7: ="{"&RC[-6]&","&RC[-3]&","&RC[-2]&","&RC[-1]&"}," -> {200003,1,1,70}, | Z7: =R[-1]C&RC[-1] -> {200000,1,1,70},{200001,1,1,70},{200002,1,1,70},{200003,1,1,70}, | AB7: 200003 | AC7: 魔力手镯 | AD7: 1 | AE7: 1 | AF7: 1 | AG7: 70 | AH7: ="{"&RC[-6]&","&RC[-3]&","&RC[-2]&","&RC[-1]&"}," -> {200003,1,1,70}, | AI7: =R[-1]C&RC[-1] -> {200000,1,1,70},{200001,1,1,70},{200002,1,1,70},{200003,1,1,70}, | AK7: 200003 | AL7: 魔力手镯 | AM7: 1 | AN7: 1 | AO7: 1 | AP7: 70 | AQ7: ="{"&RC[-6]&","&RC[-3]&","&RC[-2]&","&RC[-1]&"}," -> {200003,1,1,70}, | AR7: =R[-1]C&RC[-1] -> {200000,1,1,70},{200001,1,1,70},{200002,1,1,70},{200003,1,1,70},
A8: 200006 | B8: 恶魔项链 | C8: 1 | D8: 1 | E8: 1 | F8: 100 | G8: ="{"&RC[-6]&","&RC[-3]&","&RC[-2]&","&RC[-1]&"}," -> {200006,1,1,100}, | H8: =R[-1]C&RC[-1] -> {200000,1,1,100},{200001,1,1,100},{200002,1,1,100},{200003,1,1,100},{200006,1,1,100}, | J8: 200006 | K8: 恶魔项链 | L8: 1 | M8: 1 | N8: 1 | O8: 60 | P8: ="{"&RC[-6]&","&RC[-3]&","&RC[-2]&","&RC[-1]&"}," -> {200006,1,1,60}, | Q8: =R[-1]C&RC[-1] -> {200000,1,1,60},{200001,1,1,60},{200002,1,1,60},{200003,1,1,60},{200006,1,1,60}, | S8: 200006 | T8: 恶魔项链 | U8: 1 | V8: 1 | W8: 1 | X8: 70 | Y8: ="{"&RC[-6]&","&RC[-3]&","&RC[-2]&","&RC[-1]&"}," -> {200006,1,1,70}, | Z8: =R[-1]C&RC[-1] -> {200000,1,1,70},{200001,1,1,70},{200002,1,1,70},{200003,1,1,70},{200006,1,1,70}, | AB8: 200006 | AC8: 恶魔项链 | AD8: 1 | AE8: 1 | AF8: 1 | AG8: 70 | AH8: ="{"&RC[-6]&","&RC[-3]&","&RC[-2]&","&RC[-1]&"}," -> {200006,1,1,70}, | AI8: =R[-1]C&RC[-1] -> {200000,1,1,70},{200001,1,1,70},{200002,1,1,70},{200003,1,1,70},{200006,1,1,70}, | AK8: 200006 | AL8: 恶魔项链 | AM8: 1 | AN8: 1 | AO8: 1 | AP8: 70 | AQ8: ="{"&RC[-6]&","&RC[-3]&","&RC[-2]&","&RC[-1]&"}," -> {200006,1,1,70}, | AR8: =R[-1]C&RC[-1] -> {200000,1,1,70},{200001,1,1,70},{200002,1,1,70},{200003,1,1,70},{200006,1,1,70},
A9: 201000 | B9: 海魂 | C9: 1 | D9: 1 | E9: 1 | F9: 100 | G9: ="{"&RC[-6]&","&RC[-3]&","&RC[-2]&","&RC[-1]&"}," -> {201000,1,1,100}, | H9: =R[-1]C&RC[-1] -> {200000,1,1,100},{200001,1,1,100},{200002,1,1,100},{200003,1,1,100},{200006,1,1,100},{201000,1,1,100}, | J9: 200010 | K9: 炼狱 | L9: 1 | M9: 1 | N9: 1 | O9: 0 | P9: ="{"&RC[-6]&","&RC[-3]&","&RC[-2]&","&RC[-1]&"}," -> {200010,1,1,0}, | Q9: =R[-1]C&RC[-1] -> {200000,1,1,60},{200001,1,1,60},{200002,1,1,60},{200003,1,1,60},{200006,1,1,60},{200010,1,1,0}, | S9: 200010 | T9: 炼狱 | U9: 1 | V9: 1 | W9: 1 | X9: 1 | Y9: ="{"&RC[-6]&","&RC[-3]&","&RC[-2]&","&RC[-1]&"}," -> {200010,1,1,1}, | Z9: =R[-1]C&RC[-1] -> {200000,1,1,70},{200001,1,1,70},{200002,1,1,70},{200003,1,1,70},{200006,1,1,70},{200010,1,1,1}, | AB9: 200010 | AC9: 炼狱 | AD9: 1 | AE9: 1 | AF9: 1 | AG9: 1 | AH9: ="{"&RC[-6]&","&RC[-3]&","&RC[-2]&","&RC[-1]&"}," -> {200010,1,1,1}, | AI9: =R[-1]C&RC[-1] -> {200000,1,1,70},{200001,1,1,70},{200002,1,1,70},{200003,1,1,70},{200006,1,1,70},{200010,1,1,1}, | AK9: 200010 | AL9: 炼狱 | AM9: 1 | AN9: 1 | AO9: 1 | AP9: 1 | AQ9: ="{"&RC[-6]&","&RC[-3]&","&RC[-2]&","&RC[-1]&"}," -> {200010,1,1,1}, | AR9: =R[-1]C&RC[-1] -> {200000,1,1,70},{200001,1,1,70},{200002,1,1,70},{200003,1,1,70},{200006,1,1,70},{200010,1,1,1},
A10: 201001 | B10: 轻盔 | C10: 1 | D10: 1 | E10: 1 | F10: 100 | G10: ="{"&RC[-6]&","&RC[-3]&","&RC[-2]&","&RC[-1]&"}," -> {201001,1,1,100}, | H10: =R[-1]C&RC[-1] -> {200000,1,1,100},{200001,1,1,100},{200002,1,1,100},{200003,1,1,100},{200006,1,1,100},{201000,1,1,100},{201001,1,1,100}, | J10: 200011 | K10: 绿色项链 | L10: 1 | M10: 1 | N10: 1 | O10: 0 | P10: ="{"&RC[-6]&","&RC[-3]&","&RC[-2]&","&RC[-1]&"}," -> {200011,1,1,0}, | Q10: =R[-1]C&RC[-1] -> {200000,1,1,60},{200001,1,1,60},{200002,1,1,60},{200003,1,1,60},{200006,1,1,60},{200010,1,1,0},{200011,1,1,0}, | S10: 200011 | T10: 绿色项链 | U10: 1 | V10: 1 | W10: 1 | X10: 1 | Y10: ="{"&RC[-6]&","&RC[-3]&","&RC[-2]&","&RC[-1]&"}," -> {200011,1,1,1}, | Z10: =R[-1]C&RC[-1] -> {200000,1,1,70},{200001,1,1,70},{200002,1,1,70},{200003,1,1,70},{200006,1,1,70},{200010,1,1,1},{200011,1,1,1}, | AB10: 200011 | AC10: 绿色项链 | AD10: 1 | AE10: 1 | AF10: 1 | AG10: 1 | AH10: ="{"&RC[-6]&","&RC[-3]&","&RC[-2]&","&RC[-1]&"}," -> {200011,1,1,1}, | AI10: =R[-1]C&RC[-1] -> {200000,1,1,70},{200001,1,1,70},{200002,1,1,70},{200003,1,1,70},{200006,1,1,70},{200010,1,1,1},{200011,1,1,1}, | AK10: 200011 | AL10: 绿色项链 | AM10: 1 | AN10: 1 | AO10: 1 | AP10: 1 | AQ10: ="{"&RC[-6]&","&RC[-3]&","&RC[-2]&","&RC[-1]&"}," -> {200011,1,1,1}, | AR10: =R[-1]C&RC[-1] -> {200000,1,1,70},{200001,1,1,70},{200002,1,1,70},{200003,1,1,70},{200006,1,1,70},{200010,1,1,1},{200011,1,1,1},
A11: 201002 | B11: 金戒指 | C11: 1 | D11: 1 | E11: 1 | F11: 100 | G11: ="{"&RC[-6]&","&RC[-3]&","&RC[-2]&","&RC[-1]&"}," -> {201002,1,1,100}, | H11: =R[-1]C&RC[-1] -> {200000,1,1,100},{200001,1,1,100},{200002,1,1,100},{200003,1,1,100},{200006,1,1,100},{201000,1,1,100},{201001,1,1,100},{201002,1,1,100}, | J11: 200012 | K11: 战神盔甲 | L11: 1 | M11: 1 | N11: 1 | O11: 0 | P11: ="{"&RC[-6]&","&RC[-3]&","&RC[-2]&","&RC[-1]&"}," -> {200012,1,1,0}, | Q11: =R[-1]C&RC[-1] -> {200000,1,1,60},{200001,1,1,60},{200002,1,1,60},{200003,1,1,60},{200006,1,1,60},{200010,1,1,0},{200011,1,1,0},{200012,1,1,0}, | S11: 200012 | T11: 战神盔甲 | U11: 1 | V11: 1 | W11: 1 | X11: 1 | Y11: ="{"&RC[-6]&","&RC[-3]&","&RC[-2]&","&RC[-1]&"}," -> {200012,1,1,1}, | Z11: =R[-1]C&RC[-1] -> {200000,1,1,70},{200001,1,1,70},{200002,1,1,70},{200003,1,1,70},{200006,1,1,70},{200010,1,1,1},{200011,1,1,1},{200012,1,1,1}, | AB11: 200012 | AC11: 战神盔甲 | AD11: 1 | AE11: 1 | AF11: 1 | AG11: 1 | AH11: ="{"&RC[-6]&","&RC[-3]&","&RC[-2]&","&RC[-1]&"}," -> {200012,1,1,1}, | AI11: =R[-1]C&RC[-1] -> {200000,1,1,70},{200001,1,1,70},{200002,1,1,70},{200003,1,1,70},{200006,1,1,70},{200010,1,1,1},{200011,1,1,1},{200012,1,1,1}, | AK11: 200012 | AL11: 战神盔甲 | AM11: 1 | AN11: 1 | AO11: 1 | AP11: 1 | AQ11: ="{"&RC[-6]&","&RC[-3]&","&RC[-2]&","&RC[-1]&"}," -> {200012,1,1,1}, | AR11: =R[-1]C&RC[-1] -> {200000,1,1,70},{200001,1,1,70},{200002,1,1,70},{200003,1,1,70},{200006,1,1,70},{200010,1,1,1},{200011,1,1,1},{200012,1,1,1},
A12: 201003 | B12: 魔法手镯 | C12: 1 | D12: 1 | E12: 1 | F12: 100 | G12: ="{"&RC[-6]&","&RC[-3]&","&RC[-2]&","&RC[-1]&"}," -> {201003,1,1,100}, | H12: =R[-1]C&RC[-1] -> {200000,1,1,100},{200001,1,1,100},{200002,1,1,100},{200003,1,1,100},{200006,1,1,100},{201000,1,1,100},{201001,1,1,100},{201002,1,1,100},{201003,1,1,100}, | J12: 201000 | K12: 海魂 | L12: 1 | M12: 1 | N12: 1 | O12: 60 | P12: ="{"&RC[-6]&","&RC[-3]&","&RC[-2]&","&RC[-1]&"}," -> {201000,1,1,60}, | Q12: =R[-1]C&RC[-1] -> {200000,1,1,60},{200001,1,1,60},{200002,1,1,60},{200003,1,1,60},{200006,1,1,60},{200010,1,1,0},{200011,1,1,0},{200012,1,1,0},{201000,1,1,60}, | S12: 200013 | T12: 力量戒指 | U12: 1 | V12: 1 | W12: 1 | X12: 1 | Y12: ="{"&RC[-6]&","&RC[-3]&","&RC[-2]&","&RC[-1]&"}," -> {200013,1,1,1}, | Z12: =R[-1]C&RC[-1] -> {200000,1,1,70},{200001,1,1,70},{200002,1,1,70},{200003,1,1,70},{200006,1,1,70},{200010,1,1,1},{200011,1,1,1},{200012,1,1,1},{200013,1,1,1}, | AB12: 200013 | AC12: 力量戒指 | AD12: 1 | AE12: 1 | AF12: 1 | AG12: 1 | AH12: ="{"&RC[-6]&","&RC[-3]&","&RC[-2]&","&RC[-1]&"}," -> {200013,1,1,1}, | AI12: =R[-1]C&RC[-1] -> {200000,1,1,70},{200001,1,1,70},{200002,1,1,70},{200003,1,1,70},{200006,1,1,70},{200010,1,1,1},{200011,1,1,1},{200012,1,1,1},{200013,1,1,1}, | AK12: 200013 | AL12: 力量戒指 | AM12: 1 | AN12: 1 | AO12: 1 | AP12: 1 | AQ12: ="{"&RC[-6]&","&RC[-3]&","&RC[-2]&","&RC[-1]&"}," -> {200013,1,1,1}, | AR12: =R[-1]C&RC[-1] -> {200000,1,1,70},{200001,1,1,70},{200002,1,1,70},{200003,1,1,70},{200006,1,1,70},{200010,1,1,1},{200011,1,1,1},{200012,1,1,1},{200013,1,1,1},
A13: 201006 | B13: 放大镜 | C13: 1 | D13: 1 | E13: 1 | F13: 100 | G13: ="{"&RC[-6]&","&RC[-3]&","&RC[-2]&","&RC[-1]&"}," -> {201006,1,1,100}, | H13: =R[-1]C&RC[-1] -> {200000,1,1,100},{200001,1,1,100},{200002,1,1,100},{200003,1,1,100},{200006,1,1,100},{201000,1,1,100},{201001,1,1,100},{201002,1,1,100},{201003,1,1,100},{201006,1,1,100}, | J13: 201001 | K13: 轻盔 | L13: 1 | M13: 1 | N13: 1 | O13: 60 | P13: ="{"&RC[-6]&","&RC[-3]&","&RC[-2]&","&RC[-1]&"}," -> {201001,1,1,60}, | Q13: =R[-1]C&RC[-1] -> {200000,1,1,60},{200001,1,1,60},{200002,1,1,60},{200003,1,1,60},{200006,1,1,60},{200010,1,1,0},{200011,1,1,0},{200012,1,1,0},{201000,1,1,60},{201001,1,1,60}, | S13: 200015 | T13: 战士头盔 | U13: 1 | V13: 1 | W13: 1 | X13: 1 | Y13: ="{"&RC[-6]&","&RC[-3]&","&RC[-2]&","&RC[-1]&"}," -> {200015,1,1,1}, | Z13: =R[-1]C&RC[-1] -> {200000,1,1,70},{200001,1,1,70},{200002,1,1,70},{200003,1,1,70},{200006,1,1,70},{200010,1,1,1},{200011,1,1,1},{200012,1,1,1},{200013,1,1,1},{200015,1,1,1}, | AB13: 200015 | AC13: 战士头盔 | AD13: 1 | AE13: 1 | AF13: 1 | AG13: 1 | AH13: ="{"&RC[-6]&","&RC[-3]&","&RC[-2]&","&RC[-1]&"}," -> {200015,1,1,1}, | AI13: =R[-1]C&RC[-1] -> {200000,1,1,70},{200001,1,1,70},{200002,1,1,70},{200003,1,1,70},{200006,1,1,70},{200010,1,1,1},{200011,1,1,1},{200012,1,1,1},{200013,1,1,1},{200015,1,1,1}, | AK13: 200015 | AL13: 战士头盔 | AM13: 1 | AN13: 1 | AO13: 1 | AP13: 1 | AQ13: ="{"&RC[-6]&","&RC[-3]&","&RC[-2]&","&RC[-1]&"}," -> {200015,1,1,1}, | AR13: =R[-1]C&RC[-1] -> {200000,1,1,70},{200001,1,1,70},{200002,1,1,70},{200003,1,1,70},{200006,1,1,70},{200010,1,1,1},{200011,1,1,1},{200012,1,1,1},{200013,1,1,1},{200015,1,1,1},
A14: 202000 | B14: 半月 | C14: 1 | D14: 1 | E14: 1 | F14: 100 | G14: ="{"&RC[-6]&","&RC[-3]&","&RC[-2]&","&RC[-1]&"}," -> {202000,1,1,100}, | H14: =R[-1]C&RC[-1] -> {200000,1,1,100},{200001,1,1,100},{200002,1,1,100},{200003,1,1,100},{200006,1,1,100},{201000,1,1,100},{201001,1,1,100},{201002,1,1,100},{201003,1,1,100},{201006,1,1,100},{202000,1,1,100}, | J14: 201002 | K14: 金戒指 | L14: 1 | M14: 1 | N14: 1 | O14: 60 | P14: ="{"&RC[-6]&","&RC[-3]&","&RC[-2]&","&RC[-1]&"}," -> {201002,1,1,60}, | Q14: =R[-1]C&RC[-1] -> {200000,1,1,60},{200001,1,1,60},{200002,1,1,60},{200003,1,1,60},{200006,1,1,60},{200010,1,1,0},{200011,1,1,0},{200012,1,1,0},{201000,1,1,60},{201001,1,1,60},{201002,1,1,60}, | S14: 200016 | T14: 阎罗手镯 | U14: 1 | V14: 1 | W14: 1 | X14: 1 | Y14: ="{"&RC[-6]&","&RC[-3]&","&RC[-2]&","&RC[-1]&"}," -> {200016,1,1,1}, | Z14: =R[-1]C&RC[-1] -> {200000,1,1,70},{200001,1,1,70},{200002,1,1,70},{200003,1,1,70},{200006,1,1,70},{200010,1,1,1},{200011,1,1,1},{200012,1,1,1},{200013,1,1,1},{200015,1,1,1},{200016,1,1,1}, | AB14: 200016 | AC14: 阎罗手镯 | AD14: 1 | AE14: 1 | AF14: 1 | AG14: 1 | AH14: ="{"&RC[-6]&","&RC[-3]&","&RC[-2]&","&RC[-1]&"}," -> {200016,1,1,1}, | AI14: =R[-1]C&RC[-1] -> {200000,1,1,70},{200001,1,1,70},{200002,1,1,70},{200003,1,1,70},{200006,1,1,70},{200010,1,1,1},{200011,1,1,1},{200012,1,1,1},{200013,1,1,1},{200015,1,1,1},{200016,1,1,1}, | AK14: 200016 | AL14: 阎罗手镯 | AM14: 1 | AN14: 1 | AO14: 1 | AP14: 1 | AQ14: ="{"&RC[-6]&","&RC[-3]&","&RC[-2]&","&RC[-1]&"}," -> {200016,1,1,1}, | AR14: =R[-1]C&RC[-1] -> {200000,1,1,70},{200001,1,1,70},{200002,1,1,70},{200003,1,1,70},{200006,1,1,70},{200010,1,1,1},{200011,1,1,1},{200012,1,1,1},{200013,1,1,1},{200015,1,1,1},{200016,1,1,1},
A15: 202001 | B15: 轻盔 | C15: 1 | D15: 1 | E15: 1 | F15: 100 | G15: ="{"&RC[-6]&","&RC[-3]&","&RC[-2]&","&RC[-1]&"}," -> {202001,1,1,100}, | H15: =R[-1]C&RC[-1] -> {200000,1,1,100},{200001,1,1,100},{200002,1,1,100},{200003,1,1,100},{200006,1,1,100},{201000,1,1,100},{201001,1,1,100},{201002,1,1,100},{201003,1,1,100},{201006,1,1,100},{202000,1,1,100},{202001,1,1,100}, | J15: 201003 | K15: 魔法手镯 | L15: 1 | M15: 1 | N15: 1 | O15: 60 | P15: ="{"&RC[-6]&","&RC[-3]&","&RC[-2]&","&RC[-1]&"}," -> {201003,1,1,60}, | Q15: =R[-1]C&RC[-1] -> {200000,1,1,60},{200001,1,1,60},{200002,1,1,60},{200003,1,1,60},{200006,1,1,60},{200010,1,1,0},{200011,1,1,0},{200012,1,1,0},{201000,1,1,60},{201001,1,1,60},{201002,1,1,60},{201003,1,1,60}, | S15: 200017 | T15: 战士腰带 | U15: 1 | V15: 1 | W15: 1 | X15: 1 | Y15: ="{"&RC[-6]&","&RC[-3]&","&RC[-2]&","&RC[-1]&"}," -> {200017,1,1,1}, | Z15: =R[-1]C&RC[-1] -> {200000,1,1,70},{200001,1,1,70},{200002,1,1,70},{200003,1,1,70},{200006,1,1,70},{200010,1,1,1},{200011,1,1,1},{200012,1,1,1},{200013,1,1,1},{200015,1,1,1},{200016,1,1,1},{200017,1,1,1}, | AB15: 200017 | AC15: 战士腰带 | AD15: 1 | AE15: 1 | AF15: 1 | AG15: 1 | AH15: ="{"&RC[-6]&","&RC[-3]&","&RC[-2]&","&RC[-1]&"}," -> {200017,1,1,1}, | AI15: =R[-1]C&RC[-1] -> {200000,1,1,70},{200001,1,1,70},{200002,1,1,70},{200003,1,1,70},{200006,1,1,70},{200010,1,1,1},{200011,1,1,1},{200012,1,1,1},{200013,1,1,1},{200015,1,1,1},{200016,1,1,1},{200017,1,1,1}, | AK15: 200017 | AL15: 战士腰带 | AM15: 1 | AN15: 1 | AO15: 1 | AP15: 1 | AQ15: ="{"&RC[-6]&","&RC[-3]&","&RC[-2]&","&RC[-1]&"}," -> {200017,1,1,1}, | AR15: =R[-1]C&RC[-1] -> {200000,1,1,70},{200001,1,1,70},{200002,1,1,70},{200003,1,1,70},{200006,1,1,70},{200010,1,1,1},{200011,1,1,1},{200012,1,1,1},{200013,1,1,1},{200015,1,1,1},{200016,1,1,1},{200017,1,1,1},
A16: 202002 | B16: 铂金戒指 | C16: 1 | D16: 1 | E16: 1 | F16: 100 | G16: ="{"&RC[-6]&","&RC[-3]&","&RC[-2]&","&RC[-1]&"}," -> {202002,1,1,100}, | H16: =R[-1]C&RC[-1] -> {200000,1,1,100},{200001,1,1,100},{200002,1,1,100},{200003,1,1,100},{200006,1,1,100},{201000,1,1,100},{201001,1,1,100},{201002,1,1,100},{201003,1,1,100},{201006,1,1,100},{202000,1,1,100},{202001,1,1,100},{202002,1,1,100}, | J16: 201006 | K16: 放大镜 | L16: 1 | M16: 1 | N16: 1 | O16: 60 | P16: ="{"&RC[-6]&","&RC[-3]&","&RC[-2]&","&RC[-1]&"}," -> {201006,1,1,60}, | Q16: =R[-1]C&RC[-1] -> {200000,1,1,60},{200001,1,1,60},{200002,1,1,60},{200003,1,1,60},{200006,1,1,60},{200010,1,1,0},{200011,1,1,0},{200012,1,1,0},{201000,1,1,60},{201001,1,1,60},{201002,1,1,60},{201003,1,1,60},{201006,1,1,60}, | S16: 200019 | T16: 战士鞋子 | U16: 1 | V16: 1 | W16: 1 | X16: 1 | Y16: ="{"&RC[-6]&","&RC[-3]&","&RC[-2]&","&RC[-1]&"}," -> {200019,1,1,1}, | Z16: =R[-1]C&RC[-1] -> {200000,1,1,70},{200001,1,1,70},{200002,1,1,70},{200003,1,1,70},{200006,1,1,70},{200010,1,1,1},{200011,1,1,1},{200012,1,1,1},{200013,1,1,1},{200015,1,1,1},{200016,1,1,1},{200017,1,1,1},{200019,1,1,1}, | AB16: 200019 | AC16: 战士鞋子 | AD16: 1 | AE16: 1 | AF16: 1 | AG16: 1 | AH16: ="{"&RC[-6]&","&RC[-3]&","&RC[-2]&","&RC[-1]&"}," -> {200019,1,1,1}, | AI16: =R[-1]C&RC[-1] -> {200000,1,1,70},{200001,1,1,70},{200002,1,1,70},{200003,1,1,70},{200006,1,1,70},{200010,1,1,1},{200011,1,1,1},{200012,1,1,1},{200013,1,1,1},{200015,1,1,1},{200016,1,1,1},{200017,1,1,1},{200019,1,1,1}, | AK16: 200019 | AL16: 战士鞋子 | AM16: 1 | AN16: 1 | AO16: 1 | AP16: 1 | AQ16: ="{"&RC[-6]&","&RC[-3]&","&RC[-2]&","&RC[-1]&"}," -> {200019,1,1,1}, | AR16: =R[-1]C&RC[-1] -> {200000,1,1,70},{200001,1,1,70},{200002,1,1,70},{200003,1,1,70},{200006,1,1,70},{200010,1,1,1},{200011,1,1,1},{200012,1,1,1},{200013,1,1,1},{200015,1,1,1},{200016,1,1,1},{200017,1,1,1},{200019,1,1,1},
A17: 202003 | B17: 三眼手镯 | C17: 1 | D17: 1 | E17: 1 | F17: 100 | G17: ="{"&RC[-6]&","&RC[-3]&","&RC[-2]&","&RC[-1]&"}," -> {202003,1,1,100}, | H17: =R[-1]C&RC[-1] -> {200000,1,1,100},{200001,1,1,100},{200002,1,1,100},{200003,1,1,100},{200006,1,1,100},{201000,1,1,100},{201001,1,1,100},{201002,1,1,100},{201003,1,1,100},{201006,1,1,100},{202000,1,1,100},{202001,1,1,100},{202002,1,1,100},{202003,1,1,100}, | J17: 201010 | K17: 魔杖 | L17: 1 | M17: 1 | N17: 1 | O17: 0 | P17: ="{"&RC[-6]&","&RC[-3]&","&RC[-2]&","&RC[-1]&"}," -> {201010,1,1,0}, | Q17: =R[-1]C&RC[-1] -> {200000,1,1,60},{200001,1,1,60},{200002,1,1,60},{200003,1,1,60},{200006,1,1,60},{200010,1,1,0},{200011,1,1,0},{200012,1,1,0},{201000,1,1,60},{201001,1,1,60},{201002,1,1,60},{201003,1,1,60},{201006,1,1,60},{201010,1,1,0}, | S17: 201000 | T17: 海魂 | U17: 1 | V17: 1 | W17: 1 | X17: 70 | Y17: ="{"&RC[-6]&","&RC[-3]&","&RC[-2]&","&RC[-1]&"}," -> {201000,1,1,70}, | Z17: =R[-1]C&RC[-1] -> {200000,1,1,70},{200001,1,1,70},{200002,1,1,70},{200003,1,1,70},{200006,1,1,70},{200010,1,1,1},{200011,1,1,1},{200012,1,1,1},{200013,1,1,1},{200015,1,1,1},{200016,1,1,1},{200017,1,1,1},{200019,1,1,1},{201000,1,1,70}, | AB17: 201000 | AC17: 海魂 | AD17: 1 | AE17: 1 | AF17: 1 | AG17: 70 | AH17: ="{"&RC[-6]&","&RC[-3]&","&RC[-2]&","&RC[-1]&"}," -> {201000,1,1,70}, | AI17: =R[-1]C&RC[-1] -> {200000,1,1,70},{200001,1,1,70},{200002,1,1,70},{200003,1,1,70},{200006,1,1,70},{200010,1,1,1},{200011,1,1,1},{200012,1,1,1},{200013,1,1,1},{200015,1,1,1},{200016,1,1,1},{200017,1,1,1},{200019,1,1,1},{201000,1,1,70}, | AK17: 201000 | AL17: 海魂 | AM17: 1 | AN17: 1 | AO17: 1 | AP17: 70 | AQ17: ="{"&RC[-6]&","&RC[-3]&","&RC[-2]&","&RC[-1]&"}," -> {201000,1,1,70}, | AR17: =R[-1]C&RC[-1] -> {200000,1,1,70},{200001,1,1,70},{200002,1,1,70},{200003,1,1,70},{200006,1,1,70},{200010,1,1,1},{200011,1,1,1},{200012,1,1,1},{200013,1,1,1},{200015,1,1,1},{200016,1,1,1},{200017,1,1,1},{200019,1,1,1},{201000,1,1,70},
A18: 202006 | B18: 凤凰明珠 | C18: 1 | D18: 1 | E18: 1 | F18: 100 | G18: ="{"&RC[-6]&","&RC[-3]&","&RC[-2]&","&RC[-1]&"}," -> {202006,1,1,100}, | H18: =R[-1]C&RC[-1] -> {200000,1,1,100},{200001,1,1,100},{200002,1,1,100},{200003,1,1,100},{200006,1,1,100},{201000,1,1,100},{201001,1,1,100},{201002,1,1,100},{201003,1,1,100},{201006,1,1,100},{202000,1,1,100},{202001,1,1,100},{202002,1,1,100},{202003,1,1,100},{202006,1,1,100}, | J18: 201011 | K18: 恶魔铃铛 | L18: 1 | M18: 1 | N18: 1 | O18: 0 | P18: ="{"&RC[-6]&","&RC[-3]&","&RC[-2]&","&RC[-1]&"}," -> {201011,1,1,0}, | Q18: =R[-1]C&RC[-1] -> {200000,1,1,60},{200001,1,1,60},{200002,1,1,60},{200003,1,1,60},{200006,1,1,60},{200010,1,1,0},{200011,1,1,0},{200012,1,1,0},{201000,1,1,60},{201001,1,1,60},{201002,1,1,60},{201003,1,1,60},{201006,1,1,60},{201010,1,1,0},{201011,1,1,0}, | S18: 201001 | T18: 轻盔 | U18: 1 | V18: 1 | W18: 1 | X18: 70 | Y18: ="{"&RC[-6]&","&RC[-3]&","&RC[-2]&","&RC[-1]&"}," -> {201001,1,1,70}, | Z18: =R[-1]C&RC[-1] -> {200000,1,1,70},{200001,1,1,70},{200002,1,1,70},{200003,1,1,70},{200006,1,1,70},{200010,1,1,1},{200011,1,1,1},{200012,1,1,1},{200013,1,1,1},{200015,1,1,1},{200016,1,1,1},{200017,1,1,1},{200019,1,1,1},{201000,1,1,70},{201001,1,1,70}, | AB18: 201001 | AC18: 轻盔 | AD18: 1 | AE18: 1 | AF18: 1 | AG18: 70 | AH18: ="{"&RC[-6]&","&RC[-3]&","&RC[-2]&","&RC[-1]&"}," -> {201001,1,1,70}, | AI18: =R[-1]C&RC[-1] -> {200000,1,1,70},{200001,1,1,70},{200002,1,1,70},{200003,1,1,70},{200006,1,1,70},{200010,1,1,1},{200011,1,1,1},{200012,1,1,1},{200013,1,1,1},{200015,1,1,1},{200016,1,1,1},{200017,1,1,1},{200019,1,1,1},{201000,1,1,70},{201001,1,1,70}, | AK18: 201001 | AL18: 轻盔 | AM18: 1 | AN18: 1 | AO18: 1 | AP18: 70 | AQ18: ="{"&RC[-6]&","&RC[-3]&","&RC[-2]&","&RC[-1]&"}," -> {201001,1,1,70}, | AR18: =R[-1]C&RC[-1] -> {200000,1,1,70},{200001,1,1,70},{200002,1,1,70},{200003,1,1,70},{200006,1,1,70},{200010,1,1,1},{200011,1,1,1},{200012,1,1,1},{200013,1,1,1},{200015,1,1,1},{200016,1,1,1},{200017,1,1,1},{200019,1,1,1},{201000,1,1,70},{201001,1,1,70},
A19: 110079 | B19: 黑铁矿+1 | D19: 1 | E19: 1 | F19: 0 | G19: ="{"&RC[-6]&","&RC[-3]&","&RC[-2]&","&RC[-1]&"}," -> {110079,1,1,0}, | H19: =R[-1]C&RC[-1] -> {200000,1,1,100},{200001,1,1,100},{200002,1,1,100},{200003,1,1,100},{200006,1,1,100},{201000,1,1,100},{201001,1,1,100},{201002,1,1,100},{201003,1,1,100},{201006,1,1,100},{202000,1,1,100},{202001,1,1,100},{202002,1,1,100},{202003,1,1,100},{202006,1,1,100},{110079,1,1,0}, | J19: 201012 | K19: 恶魔长袍 | L19: 1 | M19: 1 | N19: 1 | O19: 0 | P19: ="{"&RC[-6]&","&RC[-3]&","&RC[-2]&","&RC[-1]&"}," -> {201012,1,1,0}, | Q19: =R[-1]C&RC[-1] -> {200000,1,1,60},{200001,1,1,60},{200002,1,1,60},{200003,1,1,60},{200006,1,1,60},{200010,1,1,0},{200011,1,1,0},{200012,1,1,0},{201000,1,1,60},{201001,1,1,60},{201002,1,1,60},{201003,1,1,60},{201006,1,1,60},{201010,1,1,0},{201011,1,1,0},{201012,1,1,0}, | S19: 201002 | T19: 金戒指 | U19: 1 | V19: 1 | W19: 1 | X19: 70 | Y19: ="{"&RC[-6]&","&RC[-3]&","&RC[-2]&","&RC[-1]&"}," -> {201002,1,1,70}, | Z19: =R[-1]C&RC[-1] -> {200000,1,1,70},{200001,1,1,70},{200002,1,1,70},{200003,1,1,70},{200006,1,1,70},{200010,1,1,1},{200011,1,1,1},{200012,1,1,1},{200013,1,1,1},{200015,1,1,1},{200016,1,1,1},{200017,1,1,1},{200019,1,1,1},{201000,1,1,70},{201001,1,1,70},{201002,1,1,70}, | AB19: 201002 | AC19: 金戒指 | AD19: 1 | AE19: 1 | AF19: 1 | AG19: 70 | AH19: ="{"&RC[-6]&","&RC[-3]&","&RC[-2]&","&RC[-1]&"}," -> {201002,1,1,70}, | AI19: =R[-1]C&RC[-1] -> {200000,1,1,70},{200001,1,1,70},{200002,1,1,70},{200003,1,1,70},{200006,1,1,70},{200010,1,1,1},{200011,1,1,1},{200012,1,1,1},{200013,1,1,1},{200015,1,1,1},{200016,1,1,1},{200017,1,1,1},{200019,1,1,1},{201000,1,1,70},{201001,1,1,70},{201002,1,1,70}, | AK19: 201002 | AL19: 金戒指 | AM19: 1 | AN19: 1 | AO19: 1 | AP19: 70 | AQ19: ="{"&RC[-6]&","&RC[-3]&","&RC[-2]&","&RC[-1]&"}," -> {201002,1,1,70}, | AR19: =R[-1]C&RC[-1] -> {200000,1,1,70},{200001,1,1,70},{200002,1,1,70},{200003,1,1,70},{200006,1,1,70},{200010,1,1,1},{200011,1,1,1},{200012,1,1,1},{200013,1,1,1},{200015,1,1,1},{200016,1,1,1},{200017,1,1,1},{200019,1,1,1},{201000,1,1,70},{201001,1,1,70},{201002,1,1,70},
A20: 110003 | B20: 洗炼石 | D20: 1 | E20: 1 | F20: 0 | G20: ="{"&RC[-6]&","&RC[-3]&","&RC[-2]&","&RC[-1]&"}," -> {110003,1,1,0}, | H20: =R[-1]C&RC[-1] -> {200000,1,1,100},{200001,1,1,100},{200002,1,1,100},{200003,1,1,100},{200006,1,1,100},{201000,1,1,100},{201001,1,1,100},{201002,1,1,100},{201003,1,1,100},{201006,1,1,100},{202000,1,1,100},{202001,1,1,100},{202002,1,1,100},{202003,1,1,100},{202006,1,1,100},{110079,1,1,0},{110003,1,1,0}, | J20: 202000 | K20: 半月 | L20: 1 | M20: 1 | N20: 1 | O20: 60 | P20: ="{"&RC[-6]&","&RC[-3]&","&RC[-2]&","&RC[-1]&"}," -> {202000,1,1,60}, | Q20: =R[-1]C&RC[-1] -> {200000,1,1,60},{200001,1,1,60},{200002,1,1,60},{200003,1,1,60},{200006,1,1,60},{200010,1,1,0},{200011,1,1,0},{200012,1,1,0},{201000,1,1,60},{201001,1,1,60},{201002,1,1,60},{201003,1,1,60},{201006,1,1,60},{201010,1,1,0},{201011,1,1,0},{201012,1,1,0},{202000,1,1,60}, | S20: 201003 | T20: 魔法手镯 | U20: 1 | V20: 1 | W20: 1 | X20: 70 | Y20: ="{"&RC[-6]&","&RC[-3]&","&RC[-2]&","&RC[-1]&"}," -> {201003,1,1,70}, | Z20: =R[-1]C&RC[-1] -> {200000,1,1,70},{200001,1,1,70},{200002,1,1,70},{200003,1,1,70},{200006,1,1,70},{200010,1,1,1},{200011,1,1,1},{200012,1,1,1},{200013,1,1,1},{200015,1,1,1},{200016,1,1,1},{200017,1,1,1},{200019,1,1,1},{201000,1,1,70},{201001,1,1,70},{201002,1,1,70},{201003,1,1,70}, | AB20: 201003 | AC20: 魔法手镯 | AD20: 1 | AE20: 1 | AF20: 1 | AG20: 70 | AH20: ="{"&RC[-6]&","&RC[-3]&","&RC[-2]&","&RC[-1]&"}," -> {201003,1,1,70}, | AI20: =R[-1]C&RC[-1] -> {200000,1,1,70},{200001,1,1,70},{200002,1,1,70},{200003,1,1,70},{200006,1,1,70},{200010,1,1,1},{200011,1,1,1},{200012,1,1,1},{200013,1,1,1},{200015,1,1,1},{200016,1,1,1},{200017,1,1,1},{200019,1,1,1},{201000,1,1,70},{201001,1,1,70},{201002,1,1,70},{201003,1,1,70}, | AK20: 201003 | AL20: 魔法手镯 | AM20: 1 | AN20: 1 | AO20: 1 | AP20: 70 | AQ20: ="{"&RC[-6]&","&RC[-3]&","&RC[-2]&","&RC[-1]&"}," -> {201003,1,1,70}, | AR20: =R[-1]C&RC[-1] -> {200000,1,1,70},{200001,1,1,70},{200002,1,1,70},{200003,1,1,70},{200006,1,1,70},{200010,1,1,1},{200011,1,1,1},{200012,1,1,1},{200013,1,1,1},{200015,1,1,1},{200016,1,1,1},{200017,1,1,1},{200019,1,1,1},{201000,1,1,70},{201001,1,1,70},{201002,1,1,70},{201003,1,1,70},
A21: 110004 | B21: 红药 | D21: 1 | E21: 1 | F21: 100 | G21: ="{"&RC[-6]&","&RC[-3]&","&RC[-2]&","&RC[-1]&"}," -> {110004,1,1,100}, | H21: =R[-1]C&RC[-1] -> {200000,1,1,100},{200001,1,1,100},{200002,1,1,100},{200003,1,1,100},{200006,1,1,100},{201000,1,1,100},{201001,1,1,100},{201002,1,1,100},{201003,1,1,100},{201006,1,1,100},{202000,1,1,100},{202001,1,1,100},{202002,1,1,100},{202003,1,1,100},{202006,1,1,100},{110079,1,1,0},{110003,1,1,0},{110004,1,1,100}, | J21: 202001 | K21: 轻盔 | L21: 1 | M21: 1 | N21: 1 | O21: 60 | P21: ="{"&RC[-6]&","&RC[-3]&","&RC[-2]&","&RC[-1]&"}," -> {202001,1,1,60}, | Q21: =R[-1]C&RC[-1] -> {200000,1,1,60},{200001,1,1,60},{200002,1,1,60},{200003,1,1,60},{200006,1,1,60},{200010,1,1,0},{200011,1,1,0},{200012,1,1,0},{201000,1,1,60},{201001,1,1,60},{201002,1,1,60},{201003,1,1,60},{201006,1,1,60},{201010,1,1,0},{201011,1,1,0},{201012,1,1,0},{202000,1,1,60},{202001,1,1,60}, | S21: 201006 | T21: 放大镜 | U21: 1 | V21: 1 | W21: 1 | X21: 70 | Y21: ="{"&RC[-6]&","&RC[-3]&","&RC[-2]&","&RC[-1]&"}," -> {201006,1,1,70}, | Z21: =R[-1]C&RC[-1] -> {200000,1,1,70},{200001,1,1,70},{200002,1,1,70},{200003,1,1,70},{200006,1,1,70},{200010,1,1,1},{200011,1,1,1},{200012,1,1,1},{200013,1,1,1},{200015,1,1,1},{200016,1,1,1},{200017,1,1,1},{200019,1,1,1},{201000,1,1,70},{201001,1,1,70},{201002,1,1,70},{201003,1,1,70},{201006,1,1,70}, | AB21: 201006 | AC21: 放大镜 | AD21: 1 | AE21: 1 | AF21: 1 | AG21: 70 | AH21: ="{"&RC[-6]&","&RC[-3]&","&RC[-2]&","&RC[-1]&"}," -> {201006,1,1,70}, | AI21: =R[-1]C&RC[-1] -> {200000,1,1,70},{200001,1,1,70},{200002,1,1,70},{200003,1,1,70},{200006,1,1,70},{200010,1,1,1},{200011,1,1,1},{200012,1,1,1},{200013,1,1,1},{200015,1,1,1},{200016,1,1,1},{200017,1,1,1},{200019,1,1,1},{201000,1,1,70},{201001,1,1,70},{201002,1,1,70},{201003,1,1,70},{201006,1,1,70}, | AK21: 201006 | AL21: 放大镜 | AM21: 1 | AN21: 1 | AO21: 1 | AP21: 70 | AQ21: ="{"&RC[-6]&","&RC[-3]&","&RC[-2]&","&RC[-1]&"}," -> {201006,1,1,70}, | AR21: =R[-1]C&RC[-1] -> {200000,1,1,70},{200001,1,1,70},{200002,1,1,70},{200003,1,1,70},{200006,1,1,70},{200010,1,1,1},{200011,1,1,1},{200012,1,1,1},{200013,1,1,1},{200015,1,1,1},{200016,1,1,1},{200017,1,1,1},{200019,1,1,1},{201000,1,1,70},{201001,1,1,70},{201002,1,1,70},{201003,1,1,70},{201006,1,1,70},
A22: 110005 | B22: 蓝药 | D22: 1 | E22: 1 | F22: 100 | G22: ="{"&RC[-6]&","&RC[-3]&","&RC[-2]&","&RC[-1]&"}," -> {110005,1,1,100}, | H22: =R[-1]C&RC[-1] -> {200000,1,1,100},{200001,1,1,100},{200002,1,1,100},{200003,1,1,100},{200006,1,1,100},{201000,1,1,100},{201001,1,1,100},{201002,1,1,100},{201003,1,1,100},{201006,1,1,100},{202000,1,1,100},{202001,1,1,100},{202002,1,1,100},{202003,1,1,100},{202006,1,1,100},{110079,1,1,0},{110003,1,1,0},{110004,1,1,100},{110005,1,1,100}, | J22: 202002 | K22: 铂金戒指 | L22: 1 | M22: 1 | N22: 1 | O22: 60 | P22: ="{"&RC[-6]&","&RC[-3]&","&RC[-2]&","&RC[-1]&"}," -> {202002,1,1,60}, | Q22: =R[-1]C&RC[-1] -> {200000,1,1,60},{200001,1,1,60},{200002,1,1,60},{200003,1,1,60},{200006,1,1,60},{200010,1,1,0},{200011,1,1,0},{200012,1,1,0},{201000,1,1,60},{201001,1,1,60},{201002,1,1,60},{201003,1,1,60},{201006,1,1,60},{201010,1,1,0},{201011,1,1,0},{201012,1,1,0},{202000,1,1,60},{202001,1,1,60},{202002,1,1,60}, | S22: 201010 | T22: 魔杖 | U22: 1 | V22: 1 | W22: 1 | X22: 1 | Y22: ="{"&RC[-6]&","&RC[-3]&","&RC[-2]&","&RC[-1]&"}," -> {201010,1,1,1}, | Z22: =R[-1]C&RC[-1] -> {200000,1,1,70},{200001,1,1,70},{200002,1,1,70},{200003,1,1,70},{200006,1,1,70},{200010,1,1,1},{200011,1,1,1},{200012,1,1,1},{200013,1,1,1},{200015,1,1,1},{200016,1,1,1},{200017,1,1,1},{200019,1,1,1},{201000,1,1,70},{201001,1,1,70},{201002,1,1,70},{201003,1,1,70},{201006,1,1,70},{201010,1,1,1}, | AB22: 201010 | AC22: 魔杖 | AD22: 1 | AE22: 1 | AF22: 1 | AG22: 1 | AH22: ="{"&RC[-6]&","&RC[-3]&","&RC[-2]&","&RC[-1]&"}," -> {201010,1,1,1}, | AI22: =R[-1]C&RC[-1] -> {200000,1,1,70},{200001,1,1,70},{200002,1,1,70},{200003,1,1,70},{200006,1,1,70},{200010,1,1,1},{200011,1,1,1},{200012,1,1,1},{200013,1,1,1},{200015,1,1,1},{200016,1,1,1},{200017,1,1,1},{200019,1,1,1},{201000,1,1,70},{201001,1,1,70},{201002,1,1,70},{201003,1,1,70},{201006,1,1,70},{201010,1,1,1}, | AK22: 201010 | AL22: 魔杖 | AM22: 1 | AN22: 1 | AO22: 1 | AP22: 1 | AQ22: ="{"&RC[-6]&","&RC[-3]&","&RC[-2]&","&RC[-1]&"}," -> {201010,1,1,1}, | AR22: =R[-1]C&RC[-1] -> {200000,1,1,70},{200001,1,1,70},{200002,1,1,70},{200003,1,1,70},{200006,1,1,70},{200010,1,1,1},{200011,1,1,1},{200012,1,1,1},{200013,1,1,1},{200015,1,1,1},{200016,1,1,1},{200017,1,1,1},{200019,1,1,1},{201000,1,1,70},{201001,1,1,70},{201002,1,1,70},{201003,1,1,70},{201006,1,1,70},{201010,1,1,1},
A23: 110010 | B23: 普通武装碎片 | D23: 1 | E23: 1 | F23: 0 | G23: ="{"&RC[-6]&","&RC[-3]&","&RC[-2]&","&RC[-1]&"}," -> {110010,1,1,0}, | H23: =R[-1]C&RC[-1] -> {200000,1,1,100},{200001,1,1,100},{200002,1,1,100},{200003,1,1,100},{200006,1,1,100},{201000,1,1,100},{201001,1,1,100},{201002,1,1,100},{201003,1,1,100},{201006,1,1,100},{202000,1,1,100},{202001,1,1,100},{202002,1,1,100},{202003,1,1,100},{202006,1,1,100},{110079,1,1,0},{110003,1,1,0},{110004,1,1,100},{110005,1,1,100},{110010,1,1,0}, | J23: 202003 | K23: 三眼手镯 | L23: 1 | M23: 1 | N23: 1 | O23: 60 | P23: ="{"&RC[-6]&","&RC[-3]&","&RC[-2]&","&RC[-1]&"}," -> {202003,1,1,60}, | Q23: =R[-1]C&RC[-1] -> {200000,1,1,60},{200001,1,1,60},{200002,1,1,60},{200003,1,1,60},{200006,1,1,60},{200010,1,1,0},{200011,1,1,0},{200012,1,1,0},{201000,1,1,60},{201001,1,1,60},{201002,1,1,60},{201003,1,1,60},{201006,1,1,60},{201010,1,1,0},{201011,1,1,0},{201012,1,1,0},{202000,1,1,60},{202001,1,1,60},{202002,1,1,60},{202003,1,1,60}, | S23: 201011 | T23: 恶魔铃铛 | U23: 1 | V23: 1 | W23: 1 | X23: 1 | Y23: ="{"&RC[-6]&","&RC[-3]&","&RC[-2]&","&RC[-1]&"}," -> {201011,1,1,1}, | Z23: =R[-1]C&RC[-1] -> {200000,1,1,70},{200001,1,1,70},{200002,1,1,70},{200003,1,1,70},{200006,1,1,70},{200010,1,1,1},{200011,1,1,1},{200012,1,1,1},{200013,1,1,1},{200015,1,1,1},{200016,1,1,1},{200017,1,1,1},{200019,1,1,1},{201000,1,1,70},{201001,1,1,70},{201002,1,1,70},{201003,1,1,70},{201006,1,1,70},{201010,1,1,1},{201011,1,1,1}, | AB23: 201011 | AC23: 恶魔铃铛 | AD23: 1 | AE23: 1 | AF23: 1 | AG23: 1 | AH23: ="{"&RC[-6]&","&RC[-3]&","&RC[-2]&","&RC[-1]&"}," -> {201011,1,1,1}, | AI23: =R[-1]C&RC[-1] -> {200000,1,1,70},{200001,1,1,70},{200002,1,1,70},{200003,1,1,70},{200006,1,1,70},{200010,1,1,1},{200011,1,1,1},{200012,1,1,1},{200013,1,1,1},{200015,1,1,1},{200016,1,1,1},{200017,1,1,1},{200019,1,1,1},{201000,1,1,70},{201001,1,1,70},{201002,1,1,70},{201003,1,1,70},{201006,1,1,70},{201010,1,1,1},{201011,1,1,1}, | AK23: 201011 | AL23: 恶魔铃铛 | AM23: 1 | AN23: 1 | AO23: 1 | AP23: 1 | AQ23: ="{"&RC[-6]&","&RC[-3]&","&RC[-2]&","&RC[-1]&"}," -> {201011,1,1,1}, | AR23: =R[-1]C&RC[-1] -> {200000,1,1,70},{200001,1,1,70},{200002,1,1,70},{200003,1,1,70},{200006,1,1,70},{200010,1,1,1},{200011,1,1,1},{200012,1,1,1},{200013,1,1,1},{200015,1,1,1},{200016,1,1,1},{200017,1,1,1},{200019,1,1,1},{201000,1,1,70},{201001,1,1,70},{201002,1,1,70},{201003,1,1,70},{201006,1,1,70},{201010,1,1,1},{201011,1,1,1},
A24: 110011 | B24: 普通防具碎片 | D24: 1 | E24: 1 | F24: 0 | G24: ="{"&RC[-6]&","&RC[-3]&","&RC[-2]&","&RC[-1]&"}," -> {110011,1,1,0}, | H24: =R[-1]C&RC[-1] -> {200000,1,1,100},{200001,1,1,100},{200002,1,1,100},{200003,1,1,100},{200006,1,1,100},{201000,1,1,100},{201001,1,1,100},{201002,1,1,100},{201003,1,1,100},{201006,1,1,100},{202000,1,1,100},{202001,1,1,100},{202002,1,1,100},{202003,1,1,100},{202006,1,1,100},{110079,1,1,0},{110003,1,1,0},{110004,1,1,100},{110005,1,1,100},{110010,1,1,0},{110011,1,1,0}, | J24: 202006 | K24: 凤凰明珠 | L24: 1 | M24: 1 | N24: 1 | O24: 60 | P24: ="{"&RC[-6]&","&RC[-3]&","&RC[-2]&","&RC[-1]&"}," -> {202006,1,1,60}, | Q24: =R[-1]C&RC[-1] -> {200000,1,1,60},{200001,1,1,60},{200002,1,1,60},{200003,1,1,60},{200006,1,1,60},{200010,1,1,0},{200011,1,1,0},{200012,1,1,0},{201000,1,1,60},{201001,1,1,60},{201002,1,1,60},{201003,1,1,60},{201006,1,1,60},{201010,1,1,0},{201011,1,1,0},{201012,1,1,0},{202000,1,1,60},{202001,1,1,60},{202002,1,1,60},{202003,1,1,60},{202006,1,1,60}, | S24: 201012 | T24: 恶魔长袍 | U24: 1 | V24: 1 | W24: 1 | X24: 1 | Y24: ="{"&RC[-6]&","&RC[-3]&","&RC[-2]&","&RC[-1]&"}," -> {201012,1,1,1}, | Z24: =R[-1]C&RC[-1] -> {200000,1,1,70},{200001,1,1,70},{200002,1,1,70},{200003,1,1,70},{200006,1,1,70},{200010,1,1,1},{200011,1,1,1},{200012,1,1,1},{200013,1,1,1},{200015,1,1,1},{200016,1,1,1},{200017,1,1,1},{200019,1,1,1},{201000,1,1,70},{201001,1,1,70},{201002,1,1,70},{201003,1,1,70},{201006,1,1,70},{201010,1,1,1},{201011,1,1,1},{201012,1,1,1}, | AB24: 201012 | AC24: 恶魔长袍 | AD24: 1 | AE24: 1 | AF24: 1 | AG24: 1 | AH24: ="{"&RC[-6]&","&RC[-3]&","&RC[-2]&","&RC[-1]&"}," -> {201012,1,1,1}, | AI24: =R[-1]C&RC[-1] -> {200000,1,1,70},{200001,1,1,70},{200002,1,1,70},{200003,1,1,70},{200006,1,1,70},{200010,1,1,1},{200011,1,1,1},{200012,1,1,1},{200013,1,1,1},{200015,1,1,1},{200016,1,1,1},{200017,1,1,1},{200019,1,1,1},{201000,1,1,70},{201001,1,1,70},{201002,1,1,70},{201003,1,1,70},{201006,1,1,70},{201010,1,1,1},{201011,1,1,1},{201012,1,1,1}, | AK24: 201012 | AL24: 恶魔长袍 | AM24: 1 | AN24: 1 | AO24: 1 | AP24: 1 | AQ24: ="{"&RC[-6]&","&RC[-3]&","&RC[-2]&","&RC[-1]&"}," -> {201012,1,1,1}, | AR24: =R[-1]C&RC[-1] -> {200000,1,1,70},{200001,1,1,70},{200002,1,1,70},{200003,1,1,70},{200006,1,1,70},{200010,1,1,1},{200011,1,1,1},{200012,1,1,1},{200013,1,1,1},{200015,1,1,1},{200016,1,1,1},{200017,1,1,1},{200019,1,1,1},{201000,1,1,70},{201001,1,1,70},{201002,1,1,70},{201003,1,1,70},{201006,1,1,70},{201010,1,1,1},{201011,1,1,1},{201012,1,1,1},
A25: 110012 | B25: 普通首饰碎片 | D25: 1 | E25: 1 | F25: 0 | G25: ="{"&RC[-6]&","&RC[-3]&","&RC[-2]&","&RC[-1]&"}," -> {110012,1,1,0}, | H25: =R[-1]C&RC[-1] -> {200000,1,1,100},{200001,1,1,100},{200002,1,1,100},{200003,1,1,100},{200006,1,1,100},{201000,1,1,100},{201001,1,1,100},{201002,1,1,100},{201003,1,1,100},{201006,1,1,100},{202000,1,1,100},{202001,1,1,100},{202002,1,1,100},{202003,1,1,100},{202006,1,1,100},{110079,1,1,0},{110003,1,1,0},{110004,1,1,100},{110005,1,1,100},{110010,1,1,0},{110011,1,1,0},{110012,1,1,0}, | J25: 202010 | K25: 银蛇 | L25: 1 | M25: 1 | N25: 1 | O25: 0 | P25: ="{"&RC[-6]&","&RC[-3]&","&RC[-2]&","&RC[-1]&"}," -> {202010,1,1,0}, | Q25: =R[-1]C&RC[-1] -> {200000,1,1,60},{200001,1,1,60},{200002,1,1,60},{200003,1,1,60},{200006,1,1,60},{200010,1,1,0},{200011,1,1,0},{200012,1,1,0},{201000,1,1,60},{201001,1,1,60},{201002,1,1,60},{201003,1,1,60},{201006,1,1,60},{201010,1,1,0},{201011,1,1,0},{201012,1,1,0},{202000,1,1,60},{202001,1,1,60},{202002,1,1,60},{202003,1,1,60},{202006,1,1,60},{202010,1,1,0}, | S25: 201013 | T25: 紫碧螺 | U25: 1 | V25: 1 | W25: 1 | X25: 1 | Y25: ="{"&RC[-6]&","&RC[-3]&","&RC[-2]&","&RC[-1]&"}," -> {201013,1,1,1}, | Z25: =R[-1]C&RC[-1] -> {200000,1,1,70},{200001,1,1,70},{200002,1,1,70},{200003,1,1,70},{200006,1,1,70},{200010,1,1,1},{200011,1,1,1},{200012,1,1,1},{200013,1,1,1},{200015,1,1,1},{200016,1,1,1},{200017,1,1,1},{200019,1,1,1},{201000,1,1,70},{201001,1,1,70},{201002,1,1,70},{201003,1,1,70},{201006,1,1,70},{201010,1,1,1},{201011,1,1,1},{201012,1,1,1},{201013,1,1,1}, | AB25: 201013 | AC25: 紫碧螺 | AD25: 1 | AE25: 1 | AF25: 1 | AG25: 1 | AH25: ="{"&RC[-6]&","&RC[-3]&","&RC[-2]&","&RC[-1]&"}," -> {201013,1,1,1}, | AI25: =R[-1]C&RC[-1] -> {200000,1,1,70},{200001,1,1,70},{200002,1,1,70},{200003,1,1,70},{200006,1,1,70},{200010,1,1,1},{200011,1,1,1},{200012,1,1,1},{200013,1,1,1},{200015,1,1,1},{200016,1,1,1},{200017,1,1,1},{200019,1,1,1},{201000,1,1,70},{201001,1,1,70},{201002,1,1,70},{201003,1,1,70},{201006,1,1,70},{201010,1,1,1},{201011,1,1,1},{201012,1,1,1},{201013,1,1,1}, | AK25: 201013 | AL25: 紫碧螺 | AM25: 1 | AN25: 1 | AO25: 1 | AP25: 1 | AQ25: ="{"&RC[-6]&","&RC[-3]&","&RC[-2]&","&RC[-1]&"}," -> {201013,1,1,1}, | AR25: =R[-1]C&RC[-1] -> {200000,1,1,70},{200001,1,1,70},{200002,1,1,70},{200003,1,1,70},{200006,1,1,70},{200010,1,1,1},{200011,1,1,1},{200012,1,1,1},{200013,1,1,1},{200015,1,1,1},{200016,1,1,1},{200017,1,1,1},{200019,1,1,1},{201000,1,1,70},{201001,1,1,70},{201002,1,1,70},{201003,1,1,70},{201006,1,1,70},{201010,1,1,1},{201011,1,1,1},{201012,1,1,1},{201013,1,1,1},
A26: 110009 | B26: 金币 | D26: 1 | E26: 1 | F26: 100 | G26: ="{"&RC[-6]&","&RC[-3]&","&RC[-2]&","&RC[-1]&"}" -> {110009,1,1,100} | H26: =R[-1]C&RC[-1] -> {200000,1,1,100},{200001,1,1,100},{200002,1,1,100},{200003,1,1,100},{200006,1,1,100},{201000,1,1,100},{201001,1,1,100},{201002,1,1,100},{201003,1,1,100},{201006,1,1,100},{202000,1,1,100},{202001,1,1,100},{202002,1,1,100},{202003,1,1,100},{202006,1,1,100},{110079,1,1,0},{110003,1,1,0},{110004,1,1,100},{110005,1,1,100},{110010,1,1,0},{110011,1,1,0},{110012,1,1,0},{110009,1,1,100} | J26: 202011 | K26: 天珠道链 | L26: 1 | M26: 1 | N26: 1 | O26: 0 | P26: ="{"&RC[-6]&","&RC[-3]&","&RC[-2]&","&RC[-1]&"}," -> {202011,1,1,0}, | Q26: =R[-1]C&RC[-1] -> {200000,1,1,60},{200001,1,1,60},{200002,1,1,60},{200003,1,1,60},{200006,1,1,60},{200010,1,1,0},{200011,1,1,0},{200012,1,1,0},{201000,1,1,60},{201001,1,1,60},{201002,1,1,60},{201003,1,1,60},{201006,1,1,60},{201010,1,1,0},{201011,1,1,0},{201012,1,1,0},{202000,1,1,60},{202001,1,1,60},{202002,1,1,60},{202003,1,1,60},{202006,1,1,60},{202010,1,1,0},{202011,1,1,0}, | S26: 201015 | T26: 法师头盔 | U26: 1 | V26: 1 | W26: 1 | X26: 1 | Y26: ="{"&RC[-6]&","&RC[-3]&","&RC[-2]&","&RC[-1]&"}," -> {201015,1,1,1}, | Z26: =R[-1]C&RC[-1] -> {200000,1,1,70},{200001,1,1,70},{200002,1,1,70},{200003,1,1,70},{200006,1,1,70},{200010,1,1,1},{200011,1,1,1},{200012,1,1,1},{200013,1,1,1},{200015,1,1,1},{200016,1,1,1},{200017,1,1,1},{200019,1,1,1},{201000,1,1,70},{201001,1,1,70},{201002,1,1,70},{201003,1,1,70},{201006,1,1,70},{201010,1,1,1},{201011,1,1,1},{201012,1,1,1},{201013,1,1,1},{201015,1,1,1}, | AB26: 201015 | AC26: 法师头盔 | AD26: 1 | AE26: 1 | AF26: 1 | AG26: 1 | AH26: ="{"&RC[-6]&","&RC[-3]&","&RC[-2]&","&RC[-1]&"}," -> {201015,1,1,1}, | AI26: =R[-1]C&RC[-1] -> {200000,1,1,70},{200001,1,1,70},{200002,1,1,70},{200003,1,1,70},{200006,1,1,70},{200010,1,1,1},{200011,1,1,1},{200012,1,1,1},{200013,1,1,1},{200015,1,1,1},{200016,1,1,1},{200017,1,1,1},{200019,1,1,1},{201000,1,1,70},{201001,1,1,70},{201002,1,1,70},{201003,1,1,70},{201006,1,1,70},{201010,1,1,1},{201011,1,1,1},{201012,1,1,1},{201013,1,1,1},{201015,1,1,1}, | AK26: 201015 | AL26: 法师头盔 | AM26: 1 | AN26: 1 | AO26: 1 | AP26: 1 | AQ26: ="{"&RC[-6]&","&RC[-3]&","&RC[-2]&","&RC[-1]&"}," -> {201015,1,1,1}, | AR26: =R[-1]C&RC[-1] -> {200000,1,1,70},{200001,1,1,70},{200002,1,1,70},{200003,1,1,70},{200006,1,1,70},{200010,1,1,1},{200011,1,1,1},{200012,1,1,1},{200013,1,1,1},{200015,1,1,1},{200016,1,1,1},{200017,1,1,1},{200019,1,1,1},{201000,1,1,70},{201001,1,1,70},{201002,1,1,70},{201003,1,1,70},{201006,1,1,70},{201010,1,1,1},{201011,1,1,1},{201012,1,1,1},{201013,1,1,1},{201015,1,1,1},
A27: 道具掉落 | F27: 掉落数量 | G27: 概率／100 | J27: 202012 | K27: 灵魂道袍 | L27: 1 | M27: 1 | N27: 1 | O27: 0 | P27: ="{"&RC[-6]&","&RC[-3]&","&RC[-2]&","&RC[-1]&"}," -> {202012,1,1,0}, | Q27: =R[-1]C&RC[-1] -> {200000,1,1,60},{200001,1,1,60},{200002,1,1,60},{200003,1,1,60},{200006,1,1,60},{200010,1,1,0},{200011,1,1,0},{200012,1,1,0},{201000,1,1,60},{201001,1,1,60},{201002,1,1,60},{201003,1,1,60},{201006,1,1,60},{201010,1,1,0},{201011,1,1,0},{201012,1,1,0},{202000,1,1,60},{202001,1,1,60},{202002,1,1,60},{202003,1,1,60},{202006,1,1,60},{202010,1,1,0},{202011,1,1,0},{202012,1,1,0}, | S27: 201016 | T27: 龙之手镯 | U27: 1 | V27: 1 | W27: 1 | X27: 1 | Y27: ="{"&RC[-6]&","&RC[-3]&","&RC[-2]&","&RC[-1]&"}," -> {201016,1,1,1}, | Z27: =R[-1]C&RC[-1] -> {200000,1,1,70},{200001,1,1,70},{200002,1,1,70},{200003,1,1,70},{200006,1,1,70},{200010,1,1,1},{200011,1,1,1},{200012,1,1,1},{200013,1,1,1},{200015,1,1,1},{200016,1,1,1},{200017,1,1,1},{200019,1,1,1},{201000,1,1,70},{201001,1,1,70},{201002,1,1,70},{201003,1,1,70},{201006,1,1,70},{201010,1,1,1},{201011,1,1,1},{201012,1,1,1},{201013,1,1,1},{201015,1,1,1},{201016,1,1,1}, | AB27: 201016 | AC27: 龙之手镯 | AD27: 1 | AE27: 1 | AF27: 1 | AG27: 1 | AH27: ="{"&RC[-6]&","&RC[-3]&","&RC[-2]&","&RC[-1]&"}," -> {201016,1,1,1}, | AI27: =R[-1]C&RC[-1] -> {200000,1,1,70},{200001,1,1,70},{200002,1,1,70},{200003,1,1,70},{200006,1,1,70},{200010,1,1,1},{200011,1,1,1},{200012,1,1,1},{200013,1,1,1},{200015,1,1,1},{200016,1,1,1},{200017,1,1,1},{200019,1,1,1},{201000,1,1,70},{201001,1,1,70},{201002,1,1,70},{201003,1,1,70},{201006,1,1,70},{201010,1,1,1},{201011,1,1,1},{201012,1,1,1},{201013,1,1,1},{201015,1,1,1},{201016,1,1,1}, | AK27: 201016 | AL27: 龙之手镯 | AM27: 1 | AN27: 1 | AO27: 1 | AP27: 1 | AQ27: ="{"&RC[-6]&","&RC[-3]&","&RC[-2]&","&RC[-1]&"}," -> {201016,1,1,1}, | AR27: =R[-1]C&RC[-1] -> {200000,1,1,70},{200001,1,1,70},{200002,1,1,70},{200003,1,1,70},{200006,1,1,70},{200010,1,1,1},{200011,1,1,1},{200012,1,1,1},{200013,1,1,1},{200015,1,1,1},{200016,1,1,1},{200017,1,1,1},{200019,1,1,1},{201000,1,1,70},{201001,1,1,70},{201002,1,1,70},{201003,1,1,70},{201006,1,1,70},{201010,1,1,1},{201011,1,1,1},{201012,1,1,1},{201013,1,1,1},{201015,1,1,1},{201016,1,1,1},
F28: 0 | G28: =10000-R[1]C -> 9995 | H28: ="{"&RC[-2]&","&RC[-1]&"}," -> {0,9995}, | J28: 110079 | K28: 黑铁矿+1 | M28: 1 | N28: 1 | O28: 0 | P28: ="{"&RC[-6]&","&RC[-3]&","&RC[-2]&","&RC[-1]&"}," -> {110079,1,1,0}, | Q28: =R[-1]C&RC[-1] -> {200000,1,1,60},{200001,1,1,60},{200002,1,1,60},{200003,1,1,60},{200006,1,1,60},{200010,1,1,0},{200011,1,1,0},{200012,1,1,0},{201000,1,1,60},{201001,1,1,60},{201002,1,1,60},{201003,1,1,60},{201006,1,1,60},{201010,1,1,0},{201011,1,1,0},{201012,1,1,0},{202000,1,1,60},{202001,1,1,60},{202002,1,1,60},{202003,1,1,60},{202006,1,1,60},{202010,1,1,0},{202011,1,1,0},{202012,1,1,0},{110079,1,1,0}, | S28: 201017 | T28: 法师腰带 | U28: 1 | V28: 1 | W28: 1 | X28: 1 | Y28: ="{"&RC[-6]&","&RC[-3]&","&RC[-2]&","&RC[-1]&"}," -> {201017,1,1,1}, | Z28: =R[-1]C&RC[-1] -> {200000,1,1,70},{200001,1,1,70},{200002,1,1,70},{200003,1,1,70},{200006,1,1,70},{200010,1,1,1},{200011,1,1,1},{200012,1,1,1},{200013,1,1,1},{200015,1,1,1},{200016,1,1,1},{200017,1,1,1},{200019,1,1,1},{201000,1,1,70},{201001,1,1,70},{201002,1,1,70},{201003,1,1,70},{201006,1,1,70},{201010,1,1,1},{201011,1,1,1},{201012,1,1,1},{201013,1,1,1},{201015,1,1,1},{201016,1,1,1},{201017,1,1,1}, | AB28: 201017 | AC28: 法师腰带 | AD28: 1 | AE28: 1 | AF28: 1 | AG28: 1 | AH28: ="{"&RC[-6]&","&RC[-3]&","&RC[-2]&","&RC[-1]&"}," -> {201017,1,1,1}, | AI28: =R[-1]C&RC[-1] -> {200000,1,1,70},{200001,1,1,70},{200002,1,1,70},{200003,1,1,70},{200006,1,1,70},{200010,1,1,1},{200011,1,1,1},{200012,1,1,1},{200013,1,1,1},{200015,1,1,1},{200016,1,1,1},{200017,1,1,1},{200019,1,1,1},{201000,1,1,70},{201001,1,1,70},{201002,1,1,70},{201003,1,1,70},{201006,1,1,70},{201010,1,1,1},{201011,1,1,1},{201012,1,1,1},{201013,1,1,1},{201015,1,1,1},{201016,1,1,1},{201017,1,1,1}, | AK28: 201017 | AL28: 法师腰带 | AM28: 1 | AN28: 1 | AO28: 1 | AP28: 1 | AQ28: ="{"&RC[-6]&","&RC[-3]&","&RC[-2]&","&RC[-1]&"}," -> {201017,1,1,1}, | AR28: =R[-1]C&RC[-1] -> {200000,1,1,70},{200001,1,1,70},{200002,1,1,70},{200003,1,1,70},{200006,1,1,70},{200010,1,1,1},{200011,1,1,1},{200012,1,1,1},{200013,1,1,1},{200015,1,1,1},{200016,1,1,1},{200017,1,1,1},{200019,1,1,1},{201000,1,1,70},{201001,1,1,70},{201002,1,1,70},{201003,1,1,70},{201006,1,1,70},{201010,1,1,1},{201011,1,1,1},{201012,1,1,1},{201013,1,1,1},{201015,1,1,1},{201016,1,1,1},{201017,1,1,1},
F29: 1 | G29: 5 | H29: ="{"&RC[-2]&","&RC[-1]&"}" -> {1,5} | J29: 110003 | K29: 洗炼石 | M29: 1 | N29: 1 | O29: 0 | P29: ="{"&RC[-6]&","&RC[-3]&","&RC[-2]&","&RC[-1]&"}," -> {110003,1,1,0}, | Q29: =R[-1]C&RC[-1] -> {200000,1,1,60},{200001,1,1,60},{200002,1,1,60},{200003,1,1,60},{200006,1,1,60},{200010,1,1,0},{200011,1,1,0},{200012,1,1,0},{201000,1,1,60},{201001,1,1,60},{201002,1,1,60},{201003,1,1,60},{201006,1,1,60},{201010,1,1,0},{201011,1,1,0},{201012,1,1,0},{202000,1,1,60},{202001,1,1,60},{202002,1,1,60},{202003,1,1,60},{202006,1,1,60},{202010,1,1,0},{202011,1,1,0},{202012,1,1,0},{110079,1,1,0},{110003,1,1,0}, | S29: 201019 | T29: 法师鞋子 | U29: 1 | V29: 1 | W29: 1 | X29: 1 | Y29: ="{"&RC[-6]&","&RC[-3]&","&RC[-2]&","&RC[-1]&"}," -> {201019,1,1,1}, | Z29: =R[-1]C&RC[-1] -> {200000,1,1,70},{200001,1,1,70},{200002,1,1,70},{200003,1,1,70},{200006,1,1,70},{200010,1,1,1},{200011,1,1,1},{200012,1,1,1},{200013,1,1,1},{200015,1,1,1},{200016,1,1,1},{200017,1,1,1},{200019,1,1,1},{201000,1,1,70},{201001,1,1,70},{201002,1,1,70},{201003,1,1,70},{201006,1,1,70},{201010,1,1,1},{201011,1,1,1},{201012,1,1,1},{201013,1,1,1},{201015,1,1,1},{201016,1,1,1},{201017,1,1,1},{201019,1,1,1}, | AB29: 201019 | AC29: 法师鞋子 | AD29: 1 | AE29: 1 | AF29: 1 | AG29: 1 | AH29: ="{"&RC[-6]&","&RC[-3]&","&RC[-2]&","&RC[-1]&"}," -> {201019,1,1,1}, | AI29: =R[-1]C&RC[-1] -> {200000,1,1,70},{200001,1,1,70},{200002,1,1,70},{200003,1,1,70},{200006,1,1,70},{200010,1,1,1},{200011,1,1,1},{200012,1,1,1},{200013,1,1,1},{200015,1,1,1},{200016,1,1,1},{200017,1,1,1},{200019,1,1,1},{201000,1,1,70},{201001,1,1,70},{201002,1,1,70},{201003,1,1,70},{201006,1,1,70},{201010,1,1,1},{201011,1,1,1},{201012,1,1,1},{201013,1,1,1},{201015,1,1,1},{201016,1,1,1},{201017,1,1,1},{201019,1,1,1}, | AK29: 201019 | AL29: 法师鞋子 | AM29: 1 | AN29: 1 | AO29: 1 | AP29: 1 | AQ29: ="{"&RC[-6]&","&RC[-3]&","&RC[-2]&","&RC[-1]&"}," -> {201019,1,1,1}, | AR29: =R[-1]C&RC[-1] -> {200000,1,1,70},{200001,1,1,70},{200002,1,1,70},{200003,1,1,70},{200006,1,1,70},{200010,1,1,1},{200011,1,1,1},{200012,1,1,1},{200013,1,1,1},{200015,1,1,1},{200016,1,1,1},{200017,1,1,1},{200019,1,1,1},{201000,1,1,70},{201001,1,1,70},{201002,1,1,70},{201003,1,1,70},{201006,1,1,70},{201010,1,1,1},{201011,1,1,1},{201012,1,1,1},{201013,1,1,1},{201015,1,1,1},{201016,1,1,1},{201017,1,1,1},{201019,1,1,1},
J30: 110004 | K30: 红药 | M30: 1 | N30: 1 | O30: 100 | P30: ="{"&RC[-6]&","&RC[-3]&","&RC[-2]&","&RC[-1]&"}," -> {110004,1,1,100}, | Q30: =R[-1]C&RC[-1] -> {200000,1,1,60},{200001,1,1,60},{200002,1,1,60},{200003,1,1,60},{200006,1,1,60},{200010,1,1,0},{200011,1,1,0},{200012,1,1,0},{201000,1,1,60},{201001,1,1,60},{201002,1,1,60},{201003,1,1,60},{201006,1,1,60},{201010,1,1,0},{201011,1,1,0},{201012,1,1,0},{202000,1,1,60},{202001,1,1,60},{202002,1,1,60},{202003,1,1,60},{202006,1,1,60},{202010,1,1,0},{202011,1,1,0},{202012,1,1,0},{110079,1,1,0},{110003,1,1,0},{110004,1,1,100}, | S30: 202000 | T30: 半月 | U30: 1 | V30: 1 | W30: 1 | X30: 70 | Y30: ="{"&RC[-6]&","&RC[-3]&","&RC[-2]&","&RC[-1]&"}," -> {202000,1,1,70}, | Z30: =R[-1]C&RC[-1] -> {200000,1,1,70},{200001,1,1,70},{200002,1,1,70},{200003,1,1,70},{200006,1,1,70},{200010,1,1,1},{200011,1,1,1},{200012,1,1,1},{200013,1,1,1},{200015,1,1,1},{200016,1,1,1},{200017,1,1,1},{200019,1,1,1},{201000,1,1,70},{201001,1,1,70},{201002,1,1,70},{201003,1,1,70},{201006,1,1,70},{201010,1,1,1},{201011,1,1,1},{201012,1,1,1},{201013,1,1,1},{201015,1,1,1},{201016,1,1,1},{201017,1,1,1},{201019,1,1,1},{202000,1,1,70}, | AB30: 202000 | AC30: 半月 | AD30: 1 | AE30: 1 | AF30: 1 | AG30: 70 | AH30: ="{"&RC[-6]&","&RC[-3]&","&RC[-2]&","&RC[-1]&"}," -> {202000,1,1,70}, | AI30: =R[-1]C&RC[-1] -> {200000,1,1,70},{200001,1,1,70},{200002,1,1,70},{200003,1,1,70},{200006,1,1,70},{200010,1,1,1},{200011,1,1,1},{200012,1,1,1},{200013,1,1,1},{200015,1,1,1},{200016,1,1,1},{200017,1,1,1},{200019,1,1,1},{201000,1,1,70},{201001,1,1,70},{201002,1,1,70},{201003,1,1,70},{201006,1,1,70},{201010,1,1,1},{201011,1,1,1},{201012,1,1,1},{201013,1,1,1},{201015,1,1,1},{201016,1,1,1},{201017,1,1,1},{201019,1,1,1},{202000,1,1,70}, | AK30: 202000 | AL30: 半月 | AM30: 1 | AN30: 1 | AO30: 1 | AP30: 70 | AQ30: ="{"&RC[-6]&","&RC[-3]&","&RC[-2]&","&RC[-1]&"}," -> {202000,1,1,70}, | AR30: =R[-1]C&RC[-1] -> {200000,1,1,70},{200001,1,1,70},{200002,1,1,70},{200003,1,1,70},{200006,1,1,70},{200010,1,1,1},{200011,1,1,1},{200012,1,1,1},{200013,1,1,1},{200015,1,1,1},{200016,1,1,1},{200017,1,1,1},{200019,1,1,1},{201000,1,1,70},{201001,1,1,70},{201002,1,1,70},{201003,1,1,70},{201006,1,1,70},{201010,1,1,1},{201011,1,1,1},{201012,1,1,1},{201013,1,1,1},{201015,1,1,1},{201016,1,1,1},{201017,1,1,1},{201019,1,1,1},{202000,1,1,70},
A31: 总掉落 | H31: ="[{0,["&R[-3]C&R[-2]C&"],["&R[-5]C&"]}]" -> [{0,[{0,9995},{1,5}],[{200000,1,1,100},{200001,1,1,100},{200002,1,1,100},{200003,1,1,100},{200006,1,1,100},{201000,1,1,100},{201001,1,1,100},{201002,1,1,100},{201003,1,1,100},{201006,1,1,100},{202000,1,1,100},{202001,1,1,100},{202002,1,1,100},{202003,1,1,100},{202006,1,1,100},{110079,1,1,0},{110003,1,1,0},{110004,1,1,100},{110005,1,1,100},{110010,1,1,0},{110011,1,1,0},{110012,1,1,0},{110009,1,1,100}]}] | J31: 110005 | K31: 蓝药 | M31: 1 | N31: 1 | O31: 100 | P31: ="{"&RC[-6]&","&RC[-3]&","&RC[-2]&","&RC[-1]&"}," -> {110005,1,1,100}, | Q31: =R[-1]C&RC[-1] -> {200000,1,1,60},{200001,1,1,60},{200002,1,1,60},{200003,1,1,60},{200006,1,1,60},{200010,1,1,0},{200011,1,1,0},{200012,1,1,0},{201000,1,1,60},{201001,1,1,60},{201002,1,1,60},{201003,1,1,60},{201006,1,1,60},{201010,1,1,0},{201011,1,1,0},{201012,1,1,0},{202000,1,1,60},{202001,1,1,60},{202002,1,1,60},{202003,1,1,60},{202006,1,1,60},{202010,1,1,0},{202011,1,1,0},{202012,1,1,0},{110079,1,1,0},{110003,1,1,0},{110004,1,1,100},{110005,1,1,100}, | S31: 202001 | T31: 轻盔 | U31: 1 | V31: 1 | W31: 1 | X31: 30 | Y31: ="{"&RC[-6]&","&RC[-3]&","&RC[-2]&","&RC[-1]&"}," -> {202001,1,1,30}, | Z31: =R[-1]C&RC[-1] -> {200000,1,1,70},{200001,1,1,70},{200002,1,1,70},{200003,1,1,70},{200006,1,1,70},{200010,1,1,1},{200011,1,1,1},{200012,1,1,1},{200013,1,1,1},{200015,1,1,1},{200016,1,1,1},{200017,1,1,1},{200019,1,1,1},{201000,1,1,70},{201001,1,1,70},{201002,1,1,70},{201003,1,1,70},{201006,1,1,70},{201010,1,1,1},{201011,1,1,1},{201012,1,1,1},{201013,1,1,1},{201015,1,1,1},{201016,1,1,1},{201017,1,1,1},{201019,1,1,1},{202000,1,1,70},{202001,1,1,30}, | AB31: 202001 | AC31: 轻盔 | AD31: 1 | AE31: 1 | AF31: 1 | AG31: 30 | AH31: ="{"&RC[-6]&","&RC[-3]&","&RC[-2]&","&RC[-1]&"}," -> {202001,1,1,30}, | AI31: =R[-1]C&RC[-1] -> {200000,1,1,70},{200001,1,1,70},{200002,1,1,70},{200003,1,1,70},{200006,1,1,70},{200010,1,1,1},{200011,1,1,1},{200012,1,1,1},{200013,1,1,1},{200015,1,1,1},{200016,1,1,1},{200017,1,1,1},{200019,1,1,1},{201000,1,1,70},{201001,1,1,70},{201002,1,1,70},{201003,1,1,70},{201006,1,1,70},{201010,1,1,1},{201011,1,1,1},{201012,1,1,1},{201013,1,1,1},{201015,1,1,1},{201016,1,1,1},{201017,1,1,1},{201019,1,1,1},{202000,1,1,70},{202001,1,1,30}, | AK31: 202001 | AL31: 轻盔 | AM31: 1 | AN31: 1 | AO31: 1 | AP31: 30 | AQ31: ="{"&RC[-6]&","&RC[-3]&","&RC[-2]&","&RC[-1]&"}," -> {202001,1,1,30}, | AR31: =R[-1]C&RC[-1] -> {200000,1,1,70},{200001,1,1,70},{200002,1,1,70},{200003,1,1,70},{200006,1,1,70},{200010,1,1,1},{200011,1,1,1},{200012,1,1,1},{200013,1,1,1},{200015,1,1,1},{200016,1,1,1},{200017,1,1,1},{200019,1,1,1},{201000,1,1,70},{201001,1,1,70},{201002,1,1,70},{201003,1,1,70},{201006,1,1,70},{201010,1,1,1},{201011,1,1,1},{201012,1,1,1},{201013,1,1,1},{201015,1,1,1},{201016,1,1,1},{201017,1,1,1},{201019,1,1,1},{202000,1,1,70},{202001,1,1,30},
J32: 110010 | K32: 普通武装碎片 | M32: 1 | N32: 1 | O32: 0 | P32: ="{"&RC[-6]&","&RC[-3]&","&RC[-2]&","&RC[-1]&"}," -> {110010,1,1,0}, | Q32: =R[-1]C&RC[-1] -> {200000,1,1,60},{200001,1,1,60},{200002,1,1,60},{200003,1,1,60},{200006,1,1,60},{200010,1,1,0},{200011,1,1,0},{200012,1,1,0},{201000,1,1,60},{201001,1,1,60},{201002,1,1,60},{201003,1,1,60},{201006,1,1,60},{201010,1,1,0},{201011,1,1,0},{201012,1,1,0},{202000,1,1,60},{202001,1,1,60},{202002,1,1,60},{202003,1,1,60},{202006,1,1,60},{202010,1,1,0},{202011,1,1,0},{202012,1,1,0},{110079,1,1,0},{110003,1,1,0},{110004,1,1,100},{110005,1,1,100},{110010,1,1,0}, | S32: 202002 | T32: 铂金戒指 | U32: 1 | V32: 1 | W32: 1 | X32: 30 | Y32: ="{"&RC[-6]&","&RC[-3]&","&RC[-2]&","&RC[-1]&"}," -> {202002,1,1,30}, | Z32: =R[-1]C&RC[-1] -> {200000,1,1,70},{200001,1,1,70},{200002,1,1,70},{200003,1,1,70},{200006,1,1,70},{200010,1,1,1},{200011,1,1,1},{200012,1,1,1},{200013,1,1,1},{200015,1,1,1},{200016,1,1,1},{200017,1,1,1},{200019,1,1,1},{201000,1,1,70},{201001,1,1,70},{201002,1,1,70},{201003,1,1,70},{201006,1,1,70},{201010,1,1,1},{201011,1,1,1},{201012,1,1,1},{201013,1,1,1},{201015,1,1,1},{201016,1,1,1},{201017,1,1,1},{201019,1,1,1},{202000,1,1,70},{202001,1,1,30},{202002,1,1,30}, | AB32: 202002 | AC32: 铂金戒指 | AD32: 1 | AE32: 1 | AF32: 1 | AG32: 30 | AH32: ="{"&RC[-6]&","&RC[-3]&","&RC[-2]&","&RC[-1]&"}," -> {202002,1,1,30}, | AI32: =R[-1]C&RC[-1] -> {200000,1,1,70},{200001,1,1,70},{200002,1,1,70},{200003,1,1,70},{200006,1,1,70},{200010,1,1,1},{200011,1,1,1},{200012,1,1,1},{200013,1,1,1},{200015,1,1,1},{200016,1,1,1},{200017,1,1,1},{200019,1,1,1},{201000,1,1,70},{201001,1,1,70},{201002,1,1,70},{201003,1,1,70},{201006,1,1,70},{201010,1,1,1},{201011,1,1,1},{201012,1,1,1},{201013,1,1,1},{201015,1,1,1},{201016,1,1,1},{201017,1,1,1},{201019,1,1,1},{202000,1,1,70},{202001,1,1,30},{202002,1,1,30}, | AK32: 202002 | AL32: 铂金戒指 | AM32: 1 | AN32: 1 | AO32: 1 | AP32: 30 | AQ32: ="{"&RC[-6]&","&RC[-3]&","&RC[-2]&","&RC[-1]&"}," -> {202002,1,1,30}, | AR32: =R[-1]C&RC[-1] -> {200000,1,1,70},{200001,1,1,70},{200002,1,1,70},{200003,1,1,70},{200006,1,1,70},{200010,1,1,1},{200011,1,1,1},{200012,1,1,1},{200013,1,1,1},{200015,1,1,1},{200016,1,1,1},{200017,1,1,1},{200019,1,1,1},{201000,1,1,70},{201001,1,1,70},{201002,1,1,70},{201003,1,1,70},{201006,1,1,70},{201010,1,1,1},{201011,1,1,1},{201012,1,1,1},{201013,1,1,1},{201015,1,1,1},{201016,1,1,1},{201017,1,1,1},{201019,1,1,1},{202000,1,1,70},{202001,1,1,30},{202002,1,1,30},
B33: 掉落配置: [{职业限制, [{数量, 概率}, …], [{物品id, 是否绑定, 数量, 概率}, …]}, …] | J33: 110011 | K33: 普通防具碎片 | M33: 1 | N33: 1 | O33: 0 | P33: ="{"&RC[-6]&","&RC[-3]&","&RC[-2]&","&RC[-1]&"}," -> {110011,1,1,0}, | Q33: =R[-1]C&RC[-1] -> {200000,1,1,60},{200001,1,1,60},{200002,1,1,60},{200003,1,1,60},{200006,1,1,60},{200010,1,1,0},{200011,1,1,0},{200012,1,1,0},{201000,1,1,60},{201001,1,1,60},{201002,1,1,60},{201003,1,1,60},{201006,1,1,60},{201010,1,1,0},{201011,1,1,0},{201012,1,1,0},{202000,1,1,60},{202001,1,1,60},{202002,1,1,60},{202003,1,1,60},{202006,1,1,60},{202010,1,1,0},{202011,1,1,0},{202012,1,1,0},{110079,1,1,0},{110003,1,1,0},{110004,1,1,100},{110005,1,1,100},{110010,1,1,0},{110011,1,1,0}, | S33: 202003 | T33: 三眼手镯 | U33: 1 | V33: 1 | W33: 1 | X33: 30 | Y33: ="{"&RC[-6]&","&RC[-3]&","&RC[-2]&","&RC[-1]&"}," -> {202003,1,1,30}, | Z33: =R[-1]C&RC[-1] -> {200000,1,1,70},{200001,1,1,70},{200002,1,1,70},{200003,1,1,70},{200006,1,1,70},{200010,1,1,1},{200011,1,1,1},{200012,1,1,1},{200013,1,1,1},{200015,1,1,1},{200016,1,1,1},{200017,1,1,1},{200019,1,1,1},{201000,1,1,70},{201001,1,1,70},{201002,1,1,70},{201003,1,1,70},{201006,1,1,70},{201010,1,1,1},{201011,1,1,1},{201012,1,1,1},{201013,1,1,1},{201015,1,1,1},{201016,1,1,1},{201017,1,1,1},{201019,1,1,1},{202000,1,1,70},{202001,1,1,30},{202002,1,1,30},{202003,1,1,30}, | AB33: 202003 | AC33: 三眼手镯 | AD33: 1 | AE33: 1 | AF33: 1 | AG33: 30 | AH33: ="{"&RC[-6]&","&RC[-3]&","&RC[-2]&","&RC[-1]&"}," -> {202003,1,1,30}, | AI33: =R[-1]C&RC[-1] -> {200000,1,1,70},{200001,1,1,70},{200002,1,1,70},{200003,1,1,70},{200006,1,1,70},{200010,1,1,1},{200011,1,1,1},{200012,1,1,1},{200013,1,1,1},{200015,1,1,1},{200016,1,1,1},{200017,1,1,1},{200019,1,1,1},{201000,1,1,70},{201001,1,1,70},{201002,1,1,70},{201003,1,1,70},{201006,1,1,70},{201010,1,1,1},{201011,1,1,1},{201012,1,1,1},{201013,1,1,1},{201015,1,1,1},{201016,1,1,1},{201017,1,1,1},{201019,1,1,1},{202000,1,1,70},{202001,1,1,30},{202002,1,1,30},{202003,1,1,30}, | AK33: 202003 | AL33: 三眼手镯 | AM33: 1 | AN33: 1 | AO33: 1 | AP33: 30 | AQ33: ="{"&RC[-6]&","&RC[-3]&","&RC[-2]&","&RC[-1]&"}," -> {202003,1,1,30}, | AR33: =R[-1]C&RC[-1] -> {200000,1,1,70},{200001,1,1,70},{200002,1,1,70},{200003,1,1,70},{200006,1,1,70},{200010,1,1,1},{200011,1,1,1},{200012,1,1,1},{200013,1,1,1},{200015,1,1,1},{200016,1,1,1},{200017,1,1,1},{200019,1,1,1},{201000,1,1,70},{201001,1,1,70},{201002,1,1,70},{201003,1,1,70},{201006,1,1,70},{201010,1,1,1},{201011,1,1,1},{201012,1,1,1},{201013,1,1,1},{201015,1,1,1},{201016,1,1,1},{201017,1,1,1},{201019,1,1,1},{202000,1,1,70},{202001,1,1,30},{202002,1,1,30},{202003,1,1,30},
B34: 0非绑定，1绑定 | J34: 110012 | K34: 普通首饰碎片 | M34: 1 | N34: 1 | O34: 0 | P34: ="{"&RC[-6]&","&RC[-3]&","&RC[-2]&","&RC[-1]&"}," -> {110012,1,1,0}, | Q34: =R[-1]C&RC[-1] -> {200000,1,1,60},{200001,1,1,60},{200002,1,1,60},{200003,1,1,60},{200006,1,1,60},{200010,1,1,0},{200011,1,1,0},{200012,1,1,0},{201000,1,1,60},{201001,1,1,60},{201002,1,1,60},{201003,1,1,60},{201006,1,1,60},{201010,1,1,0},{201011,1,1,0},{201012,1,1,0},{202000,1,1,60},{202001,1,1,60},{202002,1,1,60},{202003,1,1,60},{202006,1,1,60},{202010,1,1,0},{202011,1,1,0},{202012,1,1,0},{110079,1,1,0},{110003,1,1,0},{110004,1,1,100},{110005,1,1,100},{110010,1,1,0},{110011,1,1,0},{110012,1,1,0}, | S34: 202006 | T34: 凤凰明珠 | U34: 1 | V34: 1 | W34: 1 | X34: 30 | Y34: ="{"&RC[-6]&","&RC[-3]&","&RC[-2]&","&RC[-1]&"}," -> {202006,1,1,30}, | Z34: =R[-1]C&RC[-1] -> {200000,1,1,70},{200001,1,1,70},{200002,1,1,70},{200003,1,1,70},{200006,1,1,70},{200010,1,1,1},{200011,1,1,1},{200012,1,1,1},{200013,1,1,1},{200015,1,1,1},{200016,1,1,1},{200017,1,1,1},{200019,1,1,1},{201000,1,1,70},{201001,1,1,70},{201002,1,1,70},{201003,1,1,70},{201006,1,1,70},{201010,1,1,1},{201011,1,1,1},{201012,1,1,1},{201013,1,1,1},{201015,1,1,1},{201016,1,1,1},{201017,1,1,1},{201019,1,1,1},{202000,1,1,70},{202001,1,1,30},{202002,1,1,30},{202003,1,1,30},{202006,1,1,30}, | AB34: 202006 | AC34: 凤凰明珠 | AD34: 1 | AE34: 1 | AF34: 1 | AG34: 30 | AH34: ="{"&RC[-6]&","&RC[-3]&","&RC[-2]&","&RC[-1]&"}," -> {202006,1,1,30}, | AI34: =R[-1]C&RC[-1] -> {200000,1,1,70},{200001,1,1,70},{200002,1,1,70},{200003,1,1,70},{200006,1,1,70},{200010,1,1,1},{200011,1,1,1},{200012,1,1,1},{200013,1,1,1},{200015,1,1,1},{200016,1,1,1},{200017,1,1,1},{200019,1,1,1},{201000,1,1,70},{201001,1,1,70},{201002,1,1,70},{201003,1,1,70},{201006,1,1,70},{201010,1,1,1},{201011,1,1,1},{201012,1,1,1},{201013,1,1,1},{201015,1,1,1},{201016,1,1,1},{201017,1,1,1},{201019,1,1,1},{202000,1,1,70},{202001,1,1,30},{202002,1,1,30},{202003,1,1,30},{202006,1,1,30}, | AK34: 202006 | AL34: 凤凰明珠 | AM34: 1 | AN34: 1 | AO34: 1 | AP34: 30 | AQ34: ="{"&RC[-6]&","&RC[-3]&","&RC[-2]&","&RC[-1]&"}," -> {202006,1,1,30}, | AR34: =R[-1]C&RC[-1] -> {200000,1,1,70},{200001,1,1,70},{200002,1,1,70},{200003,1,1,70},{200006,1,1,70},{200010,1,1,1},{200011,1,1,1},{200012,1,1,1},{200013,1,1,1},{200015,1,1,1},{200016,1,1,1},{200017,1,1,1},{200019,1,1,1},{201000,1,1,70},{201001,1,1,70},{201002,1,1,70},{201003,1,1,70},{201006,1,1,70},{201010,1,1,1},{201011,1,1,1},{201012,1,1,1},{201013,1,1,1},{201015,1,1,1},{201016,1,1,1},{201017,1,1,1},{201019,1,1,1},{202000,1,1,70},{202001,1,1,30},{202002,1,1,30},{202003,1,1,30},{202006,1,1,30},
J35: 110009 | K35: 金币 | M35: 1 | N35: 2 | O35: 100 | P35: ="{"&RC[-6]&","&RC[-3]&","&RC[-2]&","&RC[-1]&"}" -> {110009,1,2,100} | Q35: =R[-1]C&RC[-1] -> {200000,1,1,60},{200001,1,1,60},{200002,1,1,60},{200003,1,1,60},{200006,1,1,60},{200010,1,1,0},{200011,1,1,0},{200012,1,1,0},{201000,1,1,60},{201001,1,1,60},{201002,1,1,60},{201003,1,1,60},{201006,1,1,60},{201010,1,1,0},{201011,1,1,0},{201012,1,1,0},{202000,1,1,60},{202001,1,1,60},{202002,1,1,60},{202003,1,1,60},{202006,1,1,60},{202010,1,1,0},{202011,1,1,0},{202012,1,1,0},{110079,1,1,0},{110003,1,1,0},{110004,1,1,100},{110005,1,1,100},{110010,1,1,0},{110011,1,1,0},{110012,1,1,0},{110009,1,2,100} | S35: 202010 | T35: 银蛇 | U35: 1 | V35: 1 | W35: 1 | X35: 1 | Y35: ="{"&RC[-6]&","&RC[-3]&","&RC[-2]&","&RC[-1]&"}," -> {202010,1,1,1}, | Z35: =R[-1]C&RC[-1] -> {200000,1,1,70},{200001,1,1,70},{200002,1,1,70},{200003,1,1,70},{200006,1,1,70},{200010,1,1,1},{200011,1,1,1},{200012,1,1,1},{200013,1,1,1},{200015,1,1,1},{200016,1,1,1},{200017,1,1,1},{200019,1,1,1},{201000,1,1,70},{201001,1,1,70},{201002,1,1,70},{201003,1,1,70},{201006,1,1,70},{201010,1,1,1},{201011,1,1,1},{201012,1,1,1},{201013,1,1,1},{201015,1,1,1},{201016,1,1,1},{201017,1,1,1},{201019,1,1,1},{202000,1,1,70},{202001,1,1,30},{202002,1,1,30},{202003,1,1,30},{202006,1,1,30},{202010,1,1,1}, | AB35: 202010 | AC35: 银蛇 | AD35: 1 | AE35: 1 | AF35: 1 | AG35: 1 | AH35: ="{"&RC[-6]&","&RC[-3]&","&RC[-2]&","&RC[-1]&"}," -> {202010,1,1,1}, | AI35: =R[-1]C&RC[-1] -> {200000,1,1,70},{200001,1,1,70},{200002,1,1,70},{200003,1,1,70},{200006,1,1,70},{200010,1,1,1},{200011,1,1,1},{200012,1,1,1},{200013,1,1,1},{200015,1,1,1},{200016,1,1,1},{200017,1,1,1},{200019,1,1,1},{201000,1,1,70},{201001,1,1,70},{201002,1,1,70},{201003,1,1,70},{201006,1,1,70},{201010,1,1,1},{201011,1,1,1},{201012,1,1,1},{201013,1,1,1},{201015,1,1,1},{201016,1,1,1},{201017,1,1,1},{201019,1,1,1},{202000,1,1,70},{202001,1,1,30},{202002,1,1,30},{202003,1,1,30},{202006,1,1,30},{202010,1,1,1}, | AK35: 202010 | AL35: 银蛇 | AM35: 1 | AN35: 1 | AO35: 1 | AP35: 1 | AQ35: ="{"&RC[-6]&","&RC[-3]&","&RC[-2]&","&RC[-1]&"}," -> {202010,1,1,1}, | AR35: =R[-1]C&RC[-1] -> {200000,1,1,70},{200001,1,1,70},{200002,1,1,70},{200003,1,1,70},{200006,1,1,70},{200010,1,1,1},{200011,1,1,1},{200012,1,1,1},{200013,1,1,1},{200015,1,1,1},{200016,1,1,1},{200017,1,1,1},{200019,1,1,1},{201000,1,1,70},{201001,1,1,70},{201002,1,1,70},{201003,1,1,70},{201006,1,1,70},{201010,1,1,1},{201011,1,1,1},{201012,1,1,1},{201013,1,1,1},{201015,1,1,1},{201016,1,1,1},{201017,1,1,1},{201019,1,1,1},{202000,1,1,70},{202001,1,1,30},{202002,1,1,30},{202003,1,1,30},{202006,1,1,30},{202010,1,1,1},
S36: 202011 | T36: 天珠道链 | U36: 1 | V36: 1 | W36: 1 | X36: 1 | Y36: ="{"&RC[-6]&","&RC[-3]&","&RC[-2]&","&RC[-1]&"}," -> {202011,1,1,1}, | Z36: =R[-1]C&RC[-1] -> {200000,1,1,70},{200001,1,1,70},{200002,1,1,70},{200003,1,1,70},{200006,1,1,70},{200010,1,1,1},{200011,1,1,1},{200012,1,1,1},{200013,1,1,1},{200015,1,1,1},{200016,1,1,1},{200017,1,1,1},{200019,1,1,1},{201000,1,1,70},{201001,1,1,70},{201002,1,1,70},{201003,1,1,70},{201006,1,1,70},{201010,1,1,1},{201011,1,1,1},{201012,1,1,1},{201013,1,1,1},{201015,1,1,1},{201016,1,1,1},{201017,1,1,1},{201019,1,1,1},{202000,1,1,70},{202001,1,1,30},{202002,1,1,30},{202003,1,1,30},{202006,1,1,30},{202010,1,1,1},{202011,1,1,1}, | AB36: 202011 | AC36: 天珠道链 | AD36: 1 | AE36: 1 | AF36: 1 | AG36: 1 | AH36: ="{"&RC[-6]&","&RC[-3]&","&RC[-2]&","&RC[-1]&"}," -> {202011,1,1,1}, | AI36: =R[-1]C&RC[-1] -> {200000,1,1,70},{200001,1,1,70},{200002,1,1,70},{200003,1,1,70},{200006,1,1,70},{200010,1,1,1},{200011,1,1,1},{200012,1,1,1},{200013,1,1,1},{200015,1,1,1},{200016,1,1,1},{200017,1,1,1},{200019,1,1,1},{201000,1,1,70},{201001,1,1,70},{201002,1,1,70},{201003,1,1,70},{201006,1,1,70},{201010,1,1,1},{201011,1,1,1},{201012,1,1,1},{201013,1,1,1},{201015,1,1,1},{201016,1,1,1},{201017,1,1,1},{201019,1,1,1},{202000,1,1,70},{202001,1,1,30},{202002,1,1,30},{202003,1,1,30},{202006,1,1,30},{202010,1,1,1},{202011,1,1,1}, | AK36: 202011 | AL36: 天珠道链 | AM36: 1 | AN36: 1 | AO36: 1 | AP36: 1 | AQ36: ="{"&RC[-6]&","&RC[-3]&","&RC[-2]&","&RC[-1]&"}," -> {202011,1,1,1}, | AR36: =R[-1]C&RC[-1] -> {200000,1,1,70},{200001,1,1,70},{200002,1,1,70},{200003,1,1,70},{200006,1,1,70},{200010,1,1,1},{200011,1,1,1},{200012,1,1,1},{200013,1,1,1},{200015,1,1,1},{200016,1,1,1},{200017,1,1,1},{200019,1,1,1},{201000,1,1,70},{201001,1,1,70},{201002,1,1,70},{201003,1,1,70},{201006,1,1,70},{201010,1,1,1},{201011,1,1,1},{201012,1,1,1},{201013,1,1,1},{201015,1,1,1},{201016,1,1,1},{201017,1,1,1},{201019,1,1,1},{202000,1,1,70},{202001,1,1,30},{202002,1,1,30},{202003,1,1,30},{202006,1,1,30},{202010,1,1,1},{202011,1,1,1},
O37: 掉落数量 | P37: 概率／100 | S37: 202012 | T37: 灵魂道袍 | U37: 1 | V37: 1 | W37: 1 | X37: 1 | Y37: ="{"&RC[-6]&","&RC[-3]&","&RC[-2]&","&RC[-1]&"}," -> {202012,1,1,1}, | Z37: =R[-1]C&RC[-1] -> {200000,1,1,70},{200001,1,1,70},{200002,1,1,70},{200003,1,1,70},{200006,1,1,70},{200010,1,1,1},{200011,1,1,1},{200012,1,1,1},{200013,1,1,1},{200015,1,1,1},{200016,1,1,1},{200017,1,1,1},{200019,1,1,1},{201000,1,1,70},{201001,1,1,70},{201002,1,1,70},{201003,1,1,70},{201006,1,1,70},{201010,1,1,1},{201011,1,1,1},{201012,1,1,1},{201013,1,1,1},{201015,1,1,1},{201016,1,1,1},{201017,1,1,1},{201019,1,1,1},{202000,1,1,70},{202001,1,1,30},{202002,1,1,30},{202003,1,1,30},{202006,1,1,30},{202010,1,1,1},{202011,1,1,1},{202012,1,1,1}, | AB37: 202012 | AC37: 灵魂道袍 | AD37: 1 | AE37: 1 | AF37: 1 | AG37: 1 | AH37: ="{"&RC[-6]&","&RC[-3]&","&RC[-2]&","&RC[-1]&"}," -> {202012,1,1,1}, | AI37: =R[-1]C&RC[-1] -> {200000,1,1,70},{200001,1,1,70},{200002,1,1,70},{200003,1,1,70},{200006,1,1,70},{200010,1,1,1},{200011,1,1,1},{200012,1,1,1},{200013,1,1,1},{200015,1,1,1},{200016,1,1,1},{200017,1,1,1},{200019,1,1,1},{201000,1,1,70},{201001,1,1,70},{201002,1,1,70},{201003,1,1,70},{201006,1,1,70},{201010,1,1,1},{201011,1,1,1},{201012,1,1,1},{201013,1,1,1},{201015,1,1,1},{201016,1,1,1},{201017,1,1,1},{201019,1,1,1},{202000,1,1,70},{202001,1,1,30},{202002,1,1,30},{202003,1,1,30},{202006,1,1,30},{202010,1,1,1},{202011,1,1,1},{202012,1,1,1}, | AK37: 202012 | AL37: 灵魂道袍 | AM37: 1 | AN37: 1 | AO37: 1 | AP37: 1 | AQ37: ="{"&RC[-6]&","&RC[-3]&","&RC[-2]&","&RC[-1]&"}," -> {202012,1,1,1}, | AR37: =R[-1]C&RC[-1] -> {200000,1,1,70},{200001,1,1,70},{200002,1,1,70},{200003,1,1,70},{200006,1,1,70},{200010,1,1,1},{200011,1,1,1},{200012,1,1,1},{200013,1,1,1},{200015,1,1,1},{200016,1,1,1},{200017,1,1,1},{200019,1,1,1},{201000,1,1,70},{201001,1,1,70},{201002,1,1,70},{201003,1,1,70},{201006,1,1,70},{201010,1,1,1},{201011,1,1,1},{201012,1,1,1},{201013,1,1,1},{201015,1,1,1},{201016,1,1,1},{201017,1,1,1},{201019,1,1,1},{202000,1,1,70},{202001,1,1,30},{202002,1,1,30},{202003,1,1,30},{202006,1,1,30},{202010,1,1,1},{202011,1,1,1},{202012,1,1,1},
O38: 0 | P38: =10000-R[1]C -> 9995 | Q38: ="{"&RC[-2]&","&RC[-1]&"}," -> {0,9995}, | S38: 202013 | T38: 泰坦戒指 | U38: 1 | V38: 1 | W38: 1 | X38: 1 | Y38: ="{"&RC[-6]&","&RC[-3]&","&RC[-2]&","&RC[-1]&"}," -> {202013,1,1,1}, | Z38: =R[-1]C&RC[-1] -> {200000,1,1,70},{200001,1,1,70},{200002,1,1,70},{200003,1,1,70},{200006,1,1,70},{200010,1,1,1},{200011,1,1,1},{200012,1,1,1},{200013,1,1,1},{200015,1,1,1},{200016,1,1,1},{200017,1,1,1},{200019,1,1,1},{201000,1,1,70},{201001,1,1,70},{201002,1,1,70},{201003,1,1,70},{201006,1,1,70},{201010,1,1,1},{201011,1,1,1},{201012,1,1,1},{201013,1,1,1},{201015,1,1,1},{201016,1,1,1},{201017,1,1,1},{201019,1,1,1},{202000,1,1,70},{202001,1,1,30},{202002,1,1,30},{202003,1,1,30},{202006,1,1,30},{202010,1,1,1},{202011,1,1,1},{202012,1,1,1},{202013,1,1,1}, | AB38: 202013 | AC38: 泰坦戒指 | AD38: 1 | AE38: 1 | AF38: 1 | AG38: 1 | AH38: ="{"&RC[-6]&","&RC[-3]&","&RC[-2]&","&RC[-1]&"}," -> {202013,1,1,1}, | AI38: =R[-1]C&RC[-1] -> {200000,1,1,70},{200001,1,1,70},{200002,1,1,70},{200003,1,1,70},{200006,1,1,70},{200010,1,1,1},{200011,1,1,1},{200012,1,1,1},{200013,1,1,1},{200015,1,1,1},{200016,1,1,1},{200017,1,1,1},{200019,1,1,1},{201000,1,1,70},{201001,1,1,70},{201002,1,1,70},{201003,1,1,70},{201006,1,1,70},{201010,1,1,1},{201011,1,1,1},{201012,1,1,1},{201013,1,1,1},{201015,1,1,1},{201016,1,1,1},{201017,1,1,1},{201019,1,1,1},{202000,1,1,70},{202001,1,1,30},{202002,1,1,30},{202003,1,1,30},{202006,1,1,30},{202010,1,1,1},{202011,1,1,1},{202012,1,1,1},{202013,1,1,1}, | AK38: 202013 | AL38: 泰坦戒指 | AM38: 1 | AN38: 1 | AO38: 1 | AP38: 1 | AQ38: ="{"&RC[-6]&","&RC[-3]&","&RC[-2]&","&RC[-1]&"}," -> {202013,1,1,1}, | AR38: =R[-1]C&RC[-1] -> {200000,1,1,70},{200001,1,1,70},{200002,1,1,70},{200003,1,1,70},{200006,1,1,70},{200010,1,1,1},{200011,1,1,1},{200012,1,1,1},{200013,1,1,1},{200015,1,1,1},{200016,1,1,1},{200017,1,1,1},{200019,1,1,1},{201000,1,1,70},{201001,1,1,70},{201002,1,1,70},{201003,1,1,70},{201006,1,1,70},{201010,1,1,1},{201011,1,1,1},{201012,1,1,1},{201013,1,1,1},{201015,1,1,1},{201016,1,1,1},{201017,1,1,1},{201019,1,1,1},{202000,1,1,70},{202001,1,1,30},{202002,1,1,30},{202003,1,1,30},{202006,1,1,30},{202010,1,1,1},{202011,1,1,1},{202012,1,1,1},{202013,1,1,1},
K39: BOSS怪掉落 | O39: 1 | P39: 5 | Q39: ="{"&RC[-2]&","&RC[-1]&"}" -> {1,5} | S39: 202015 | T39: 道士头盔 | U39: 1 | V39: 1 | W39: 1 | X39: 1 | Y39: ="{"&RC[-6]&","&RC[-3]&","&RC[-2]&","&RC[-1]&"}," -> {202015,1,1,1}, | Z39: =R[-1]C&RC[-1] -> {200000,1,1,70},{200001,1,1,70},{200002,1,1,70},{200003,1,1,70},{200006,1,1,70},{200010,1,1,1},{200011,1,1,1},{200012,1,1,1},{200013,1,1,1},{200015,1,1,1},{200016,1,1,1},{200017,1,1,1},{200019,1,1,1},{201000,1,1,70},{201001,1,1,70},{201002,1,1,70},{201003,1,1,70},{201006,1,1,70},{201010,1,1,1},{201011,1,1,1},{201012,1,1,1},{201013,1,1,1},{201015,1,1,1},{201016,1,1,1},{201017,1,1,1},{201019,1,1,1},{202000,1,1,70},{202001,1,1,30},{202002,1,1,30},{202003,1,1,30},{202006,1,1,30},{202010,1,1,1},{202011,1,1,1},{202012,1,1,1},{202013,1,1,1},{202015,1,1,1}, | AB39: 202015 | AC39: 道士头盔 | AD39: 1 | AE39: 1 | AF39: 1 | AG39: 1 | AH39: ="{"&RC[-6]&","&RC[-3]&","&RC[-2]&","&RC[-1]&"}," -> {202015,1,1,1}, | AI39: =R[-1]C&RC[-1] -> {200000,1,1,70},{200001,1,1,70},{200002,1,1,70},{200003,1,1,70},{200006,1,1,70},{200010,1,1,1},{200011,1,1,1},{200012,1,1,1},{200013,1,1,1},{200015,1,1,1},{200016,1,1,1},{200017,1,1,1},{200019,1,1,1},{201000,1,1,70},{201001,1,1,70},{201002,1,1,70},{201003,1,1,70},{201006,1,1,70},{201010,1,1,1},{201011,1,1,1},{201012,1,1,1},{201013,1,1,1},{201015,1,1,1},{201016,1,1,1},{201017,1,1,1},{201019,1,1,1},{202000,1,1,70},{202001,1,1,30},{202002,1,1,30},{202003,1,1,30},{202006,1,1,30},{202010,1,1,1},{202011,1,1,1},{202012,1,1,1},{202013,1,1,1},{202015,1,1,1}, | AK39: 202015 | AL39: 道士头盔 | AM39: 1 | AN39: 1 | AO39: 1 | AP39: 1 | AQ39: ="{"&RC[-6]&","&RC[-3]&","&RC[-2]&","&RC[-1]&"}," -> {202015,1,1,1}, | AR39: =R[-1]C&RC[-1] -> {200000,1,1,70},{200001,1,1,70},{200002,1,1,70},{200003,1,1,70},{200006,1,1,70},{200010,1,1,1},{200011,1,1,1},{200012,1,1,1},{200013,1,1,1},{200015,1,1,1},{200016,1,1,1},{200017,1,1,1},{200019,1,1,1},{201000,1,1,70},{201001,1,1,70},{201002,1,1,70},{201003,1,1,70},{201006,1,1,70},{201010,1,1,1},{201011,1,1,1},{201012,1,1,1},{201013,1,1,1},{201015,1,1,1},{201016,1,1,1},{201017,1,1,1},{201019,1,1,1},{202000,1,1,70},{202001,1,1,30},{202002,1,1,30},{202003,1,1,30},{202006,1,1,30},{202010,1,1,1},{202011,1,1,1},{202012,1,1,1},{202013,1,1,1},{202015,1,1,1},
S40: 202016 | T40: 幽灵手镯 | U40: 1 | V40: 1 | W40: 1 | X40: 1 | Y40: ="{"&RC[-6]&","&RC[-3]&","&RC[-2]&","&RC[-1]&"}," -> {202016,1,1,1}, | Z40: =R[-1]C&RC[-1] -> {200000,1,1,70},{200001,1,1,70},{200002,1,1,70},{200003,1,1,70},{200006,1,1,70},{200010,1,1,1},{200011,1,1,1},{200012,1,1,1},{200013,1,1,1},{200015,1,1,1},{200016,1,1,1},{200017,1,1,1},{200019,1,1,1},{201000,1,1,70},{201001,1,1,70},{201002,1,1,70},{201003,1,1,70},{201006,1,1,70},{201010,1,1,1},{201011,1,1,1},{201012,1,1,1},{201013,1,1,1},{201015,1,1,1},{201016,1,1,1},{201017,1,1,1},{201019,1,1,1},{202000,1,1,70},{202001,1,1,30},{202002,1,1,30},{202003,1,1,30},{202006,1,1,30},{202010,1,1,1},{202011,1,1,1},{202012,1,1,1},{202013,1,1,1},{202015,1,1,1},{202016,1,1,1}, | AB40: 202016 | AC40: 幽灵手镯 | AD40: 1 | AE40: 1 | AF40: 1 | AG40: 1 | AH40: ="{"&RC[-6]&","&RC[-3]&","&RC[-2]&","&RC[-1]&"}," -> {202016,1,1,1}, | AI40: =R[-1]C&RC[-1] -> {200000,1,1,70},{200001,1,1,70},{200002,1,1,70},{200003,1,1,70},{200006,1,1,70},{200010,1,1,1},{200011,1,1,1},{200012,1,1,1},{200013,1,1,1},{200015,1,1,1},{200016,1,1,1},{200017,1,1,1},{200019,1,1,1},{201000,1,1,70},{201001,1,1,70},{201002,1,1,70},{201003,1,1,70},{201006,1,1,70},{201010,1,1,1},{201011,1,1,1},{201012,1,1,1},{201013,1,1,1},{201015,1,1,1},{201016,1,1,1},{201017,1,1,1},{201019,1,1,1},{202000,1,1,70},{202001,1,1,30},{202002,1,1,30},{202003,1,1,30},{202006,1,1,30},{202010,1,1,1},{202011,1,1,1},{202012,1,1,1},{202013,1,1,1},{202015,1,1,1},{202016,1,1,1}, | AK40: 202016 | AL40: 幽灵手镯 | AM40: 1 | AN40: 1 | AO40: 1 | AP40: 1 | AQ40: ="{"&RC[-6]&","&RC[-3]&","&RC[-2]&","&RC[-1]&"}," -> {202016,1,1,1}, | AR40: =R[-1]C&RC[-1] -> {200000,1,1,70},{200001,1,1,70},{200002,1,1,70},{200003,1,1,70},{200006,1,1,70},{200010,1,1,1},{200011,1,1,1},{200012,1,1,1},{200013,1,1,1},{200015,1,1,1},{200016,1,1,1},{200017,1,1,1},{200019,1,1,1},{201000,1,1,70},{201001,1,1,70},{201002,1,1,70},{201003,1,1,70},{201006,1,1,70},{201010,1,1,1},{201011,1,1,1},{201012,1,1,1},{201013,1,1,1},{201015,1,1,1},{201016,1,1,1},{201017,1,1,1},{201019,1,1,1},{202000,1,1,70},{202001,1,1,30},{202002,1,1,30},{202003,1,1,30},{202006,1,1,30},{202010,1,1,1},{202011,1,1,1},{202012,1,1,1},{202013,1,1,1},{202015,1,1,1},{202016,1,1,1},
Q41: ="[{0,["&R[-3]C&R[-2]C&"],["&R[-6]C&"]}]" -> [{0,[{0,9995},{1,5}],[{200000,1,1,60},{200001,1,1,60},{200002,1,1,60},{200003,1,1,60},{200006,1,1,60},{200010,1,1,0},{200011,1,1,0},{200012,1,1,0},{201000,1,1,60},{201001,1,1,60},{201002,1,1,60},{201003,1,1,60},{201006,1,1,60},{201010,1,1,0},{201011,1,1,0},{201012,1,1,0},{202000,1,1,60},{202001,1,1,60},{202002,1,1,60},{202003,1,1,60},{202006,1,1,60},{202010,1,1,0},{202011,1,1,0},{202012,1,1,0},{110079,1,1,0},{110003,1,1,0},{110004,1,1,100},{110005,1,1,100},{110010,1,1,0},{110011,1,1,0},{110012,1,1,0},{110009,1,2,100}]}] | S41: 202017 | T41: 道士腰带 | U41: 1 | V41: 1 | W41: 1 | X41: 1 | Y41: ="{"&RC[-6]&","&RC[-3]&","&RC[-2]&","&RC[-1]&"}," -> {202017,1,1,1}, | Z41: =R[-1]C&RC[-1] -> {200000,1,1,70},{200001,1,1,70},{200002,1,1,70},{200003,1,1,70},{200006,1,1,70},{200010,1,1,1},{200011,1,1,1},{200012,1,1,1},{200013,1,1,1},{200015,1,1,1},{200016,1,1,1},{200017,1,1,1},{200019,1,1,1},{201000,1,1,70},{201001,1,1,70},{201002,1,1,70},{201003,1,1,70},{201006,1,1,70},{201010,1,1,1},{201011,1,1,1},{201012,1,1,1},{201013,1,1,1},{201015,1,1,1},{201016,1,1,1},{201017,1,1,1},{201019,1,1,1},{202000,1,1,70},{202001,1,1,30},{202002,1,1,30},{202003,1,1,30},{202006,1,1,30},{202010,1,1,1},{202011,1,1,1},{202012,1,1,1},{202013,1,1,1},{202015,1,1,1},{202016,1,1,1},{202017,1,1,1}, | AB41: 202017 | AC41: 道士腰带 | AD41: 1 | AE41: 1 | AF41: 1 | AG41: 1 | AH41: ="{"&RC[-6]&","&RC[-3]&","&RC[-2]&","&RC[-1]&"}," -> {202017,1,1,1}, | AI41: =R[-1]C&RC[-1] -> {200000,1,1,70},{200001,1,1,70},{200002,1,1,70},{200003,1,1,70},{200006,1,1,70},{200010,1,1,1},{200011,1,1,1},{200012,1,1,1},{200013,1,1,1},{200015,1,1,1},{200016,1,1,1},{200017,1,1,1},{200019,1,1,1},{201000,1,1,70},{201001,1,1,70},{201002,1,1,70},{201003,1,1,70},{201006,1,1,70},{201010,1,1,1},{201011,1,1,1},{201012,1,1,1},{201013,1,1,1},{201015,1,1,1},{201016,1,1,1},{201017,1,1,1},{201019,1,1,1},{202000,1,1,70},{202001,1,1,30},{202002,1,1,30},{202003,1,1,30},{202006,1,1,30},{202010,1,1,1},{202011,1,1,1},{202012,1,1,1},{202013,1,1,1},{202015,1,1,1},{202016,1,1,1},{202017,1,1,1}, | AK41: 202017 | AL41: 道士腰带 | AM41: 1 | AN41: 1 | AO41: 1 | AP41: 1 | AQ41: ="{"&RC[-6]&","&RC[-3]&","&RC[-2]&","&RC[-1]&"}," -> {202017,1,1,1}, | AR41: =R[-1]C&RC[-1] -> {200000,1,1,70},{200001,1,1,70},{200002,1,1,70},{200003,1,1,70},{200006,1,1,70},{200010,1,1,1},{200011,1,1,1},{200012,1,1,1},{200013,1,1,1},{200015,1,1,1},{200016,1,1,1},{200017,1,1,1},{200019,1,1,1},{201000,1,1,70},{201001,1,1,70},{201002,1,1,70},{201003,1,1,70},{201006,1,1,70},{201010,1,1,1},{201011,1,1,1},{201012,1,1,1},{201013,1,1,1},{201015,1,1,1},{201016,1,1,1},{201017,1,1,1},{201019,1,1,1},{202000,1,1,70},{202001,1,1,30},{202002,1,1,30},{202003,1,1,30},{202006,1,1,30},{202010,1,1,1},{202011,1,1,1},{202012,1,1,1},{202013,1,1,1},{202015,1,1,1},{202016,1,1,1},{202017,1,1,1},
S42: 202019 | T42: 道士鞋子 | U42: 1 | V42: 1 | W42: 1 | X42: 1 | Y42: ="{"&RC[-6]&","&RC[-3]&","&RC[-2]&","&RC[-1]&"}," -> {202019,1,1,1}, | Z42: =R[-1]C&RC[-1] -> {200000,1,1,70},{200001,1,1,70},{200002,1,1,70},{200003,1,1,70},{200006,1,1,70},{200010,1,1,1},{200011,1,1,1},{200012,1,1,1},{200013,1,1,1},{200015,1,1,1},{200016,1,1,1},{200017,1,1,1},{200019,1,1,1},{201000,1,1,70},{201001,1,1,70},{201002,1,1,70},{201003,1,1,70},{201006,1,1,70},{201010,1,1,1},{201011,1,1,1},{201012,1,1,1},{201013,1,1,1},{201015,1,1,1},{201016,1,1,1},{201017,1,1,1},{201019,1,1,1},{202000,1,1,70},{202001,1,1,30},{202002,1,1,30},{202003,1,1,30},{202006,1,1,30},{202010,1,1,1},{202011,1,1,1},{202012,1,1,1},{202013,1,1,1},{202015,1,1,1},{202016,1,1,1},{202017,1,1,1},{202019,1,1,1}, | AB42: 202019 | AC42: 道士鞋子 | AD42: 1 | AE42: 1 | AF42: 1 | AG42: 1 | AH42: ="{"&RC[-6]&","&RC[-3]&","&RC[-2]&","&RC[-1]&"}," -> {202019,1,1,1}, | AI42: =R[-1]C&RC[-1] -> {200000,1,1,70},{200001,1,1,70},{200002,1,1,70},{200003,1,1,70},{200006,1,1,70},{200010,1,1,1},{200011,1,1,1},{200012,1,1,1},{200013,1,1,1},{200015,1,1,1},{200016,1,1,1},{200017,1,1,1},{200019,1,1,1},{201000,1,1,70},{201001,1,1,70},{201002,1,1,70},{201003,1,1,70},{201006,1,1,70},{201010,1,1,1},{201011,1,1,1},{201012,1,1,1},{201013,1,1,1},{201015,1,1,1},{201016,1,1,1},{201017,1,1,1},{201019,1,1,1},{202000,1,1,70},{202001,1,1,30},{202002,1,1,30},{202003,1,1,30},{202006,1,1,30},{202010,1,1,1},{202011,1,1,1},{202012,1,1,1},{202013,1,1,1},{202015,1,1,1},{202016,1,1,1},{202017,1,1,1},{202019,1,1,1}, | AK42: 202019 | AL42: 道士鞋子 | AM42: 1 | AN42: 1 | AO42: 1 | AP42: 1 | AQ42: ="{"&RC[-6]&","&RC[-3]&","&RC[-2]&","&RC[-1]&"}," -> {202019,1,1,1}, | AR42: =R[-1]C&RC[-1] -> {200000,1,1,70},{200001,1,1,70},{200002,1,1,70},{200003,1,1,70},{200006,1,1,70},{200010,1,1,1},{200011,1,1,1},{200012,1,1,1},{200013,1,1,1},{200015,1,1,1},{200016,1,1,1},{200017,1,1,1},{200019,1,1,1},{201000,1,1,70},{201001,1,1,70},{201002,1,1,70},{201003,1,1,70},{201006,1,1,70},{201010,1,1,1},{201011,1,1,1},{201012,1,1,1},{201013,1,1,1},{201015,1,1,1},{201016,1,1,1},{201017,1,1,1},{201019,1,1,1},{202000,1,1,70},{202001,1,1,30},{202002,1,1,30},{202003,1,1,30},{202006,1,1,30},{202010,1,1,1},{202011,1,1,1},{202012,1,1,1},{202013,1,1,1},{202015,1,1,1},{202016,1,1,1},{202017,1,1,1},{202019,1,1,1},
S43: 110079 | T43: 黑铁矿+1 | V43: 1 | W43: 1 | X43: 0 | Y43: ="{"&RC[-6]&","&RC[-3]&","&RC[-2]&","&RC[-1]&"}," -> {110079,1,1,0}, | Z43: =R[-1]C&RC[-1] -> {200000,1,1,70},{200001,1,1,70},{200002,1,1,70},{200003,1,1,70},{200006,1,1,70},{200010,1,1,1},{200011,1,1,1},{200012,1,1,1},{200013,1,1,1},{200015,1,1,1},{200016,1,1,1},{200017,1,1,1},{200019,1,1,1},{201000,1,1,70},{201001,1,1,70},{201002,1,1,70},{201003,1,1,70},{201006,1,1,70},{201010,1,1,1},{201011,1,1,1},{201012,1,1,1},{201013,1,1,1},{201015,1,1,1},{201016,1,1,1},{201017,1,1,1},{201019,1,1,1},{202000,1,1,70},{202001,1,1,30},{202002,1,1,30},{202003,1,1,30},{202006,1,1,30},{202010,1,1,1},{202011,1,1,1},{202012,1,1,1},{202013,1,1,1},{202015,1,1,1},{202016,1,1,1},{202017,1,1,1},{202019,1,1,1},{110079,1,1,0}, | AB43: 110079 | AC43: 黑铁矿+1 | AE43: 1 | AF43: 1 | AG43: 0 | AH43: ="{"&RC[-6]&","&RC[-3]&","&RC[-2]&","&RC[-1]&"}," -> {110079,1,1,0}, | AI43: =R[-1]C&RC[-1] -> {200000,1,1,70},{200001,1,1,70},{200002,1,1,70},{200003,1,1,70},{200006,1,1,70},{200010,1,1,1},{200011,1,1,1},{200012,1,1,1},{200013,1,1,1},{200015,1,1,1},{200016,1,1,1},{200017,1,1,1},{200019,1,1,1},{201000,1,1,70},{201001,1,1,70},{201002,1,1,70},{201003,1,1,70},{201006,1,1,70},{201010,1,1,1},{201011,1,1,1},{201012,1,1,1},{201013,1,1,1},{201015,1,1,1},{201016,1,1,1},{201017,1,1,1},{201019,1,1,1},{202000,1,1,70},{202001,1,1,30},{202002,1,1,30},{202003,1,1,30},{202006,1,1,30},{202010,1,1,1},{202011,1,1,1},{202012,1,1,1},{202013,1,1,1},{202015,1,1,1},{202016,1,1,1},{202017,1,1,1},{202019,1,1,1},{110079,1,1,0}, | AK43: 110079 | AL43: 黑铁矿+1 | AN43: 1 | AO43: 1 | AP43: 0 | AQ43: ="{"&RC[-6]&","&RC[-3]&","&RC[-2]&","&RC[-1]&"}," -> {110079,1,1,0}, | AR43: =R[-1]C&RC[-1] -> {200000,1,1,70},{200001,1,1,70},{200002,1,1,70},{200003,1,1,70},{200006,1,1,70},{200010,1,1,1},{200011,1,1,1},{200012,1,1,1},{200013,1,1,1},{200015,1,1,1},{200016,1,1,1},{200017,1,1,1},{200019,1,1,1},{201000,1,1,70},{201001,1,1,70},{201002,1,1,70},{201003,1,1,70},{201006,1,1,70},{201010,1,1,1},{201011,1,1,1},{201012,1,1,1},{201013,1,1,1},{201015,1,1,1},{201016,1,1,1},{201017,1,1,1},{201019,1,1,1},{202000,1,1,70},{202001,1,1,30},{202002,1,1,30},{202003,1,1,30},{202006,1,1,30},{202010,1,1,1},{202011,1,1,1},{202012,1,1,1},{202013,1,1,1},{202015,1,1,1},{202016,1,1,1},{202017,1,1,1},{202019,1,1,1},{110079,1,1,0},
S44: 110003 | T44: 洗炼石 | V44: 1 | W44: 1 | X44: 0 | Y44: ="{"&RC[-6]&","&RC[-3]&","&RC[-2]&","&RC[-1]&"}," -> {110003,1,1,0}, | Z44: =R[-1]C&RC[-1] -> {200000,1,1,70},{200001,1,1,70},{200002,1,1,70},{200003,1,1,70},{200006,1,1,70},{200010,1,1,1},{200011,1,1,1},{200012,1,1,1},{200013,1,1,1},{200015,1,1,1},{200016,1,1,1},{200017,1,1,1},{200019,1,1,1},{201000,1,1,70},{201001,1,1,70},{201002,1,1,70},{201003,1,1,70},{201006,1,1,70},{201010,1,1,1},{201011,1,1,1},{201012,1,1,1},{201013,1,1,1},{201015,1,1,1},{201016,1,1,1},{201017,1,1,1},{201019,1,1,1},{202000,1,1,70},{202001,1,1,30},{202002,1,1,30},{202003,1,1,30},{202006,1,1,30},{202010,1,1,1},{202011,1,1,1},{202012,1,1,1},{202013,1,1,1},{202015,1,1,1},{202016,1,1,1},{202017,1,1,1},{202019,1,1,1},{110079,1,1,0},{110003,1,1,0}, | AB44: 110003 | AC44: 洗炼石 | AE44: 1 | AF44: 1 | AG44: 0 | AH44: ="{"&RC[-6]&","&RC[-3]&","&RC[-2]&","&RC[-1]&"}," -> {110003,1,1,0}, | AI44: =R[-1]C&RC[-1] -> {200000,1,1,70},{200001,1,1,70},{200002,1,1,70},{200003,1,1,70},{200006,1,1,70},{200010,1,1,1},{200011,1,1,1},{200012,1,1,1},{200013,1,1,1},{200015,1,1,1},{200016,1,1,1},{200017,1,1,1},{200019,1,1,1},{201000,1,1,70},{201001,1,1,70},{201002,1,1,70},{201003,1,1,70},{201006,1,1,70},{201010,1,1,1},{201011,1,1,1},{201012,1,1,1},{201013,1,1,1},{201015,1,1,1},{201016,1,1,1},{201017,1,1,1},{201019,1,1,1},{202000,1,1,70},{202001,1,1,30},{202002,1,1,30},{202003,1,1,30},{202006,1,1,30},{202010,1,1,1},{202011,1,1,1},{202012,1,1,1},{202013,1,1,1},{202015,1,1,1},{202016,1,1,1},{202017,1,1,1},{202019,1,1,1},{110079,1,1,0},{110003,1,1,0}, | AK44: 110003 | AL44: 洗炼石 | AN44: 1 | AO44: 1 | AP44: 0 | AQ44: ="{"&RC[-6]&","&RC[-3]&","&RC[-2]&","&RC[-1]&"}," -> {110003,1,1,0}, | AR44: =R[-1]C&RC[-1] -> {200000,1,1,70},{200001,1,1,70},{200002,1,1,70},{200003,1,1,70},{200006,1,1,70},{200010,1,1,1},{200011,1,1,1},{200012,1,1,1},{200013,1,1,1},{200015,1,1,1},{200016,1,1,1},{200017,1,1,1},{200019,1,1,1},{201000,1,1,70},{201001,1,1,70},{201002,1,1,70},{201003,1,1,70},{201006,1,1,70},{201010,1,1,1},{201011,1,1,1},{201012,1,1,1},{201013,1,1,1},{201015,1,1,1},{201016,1,1,1},{201017,1,1,1},{201019,1,1,1},{202000,1,1,70},{202001,1,1,30},{202002,1,1,30},{202003,1,1,30},{202006,1,1,30},{202010,1,1,1},{202011,1,1,1},{202012,1,1,1},{202013,1,1,1},{202015,1,1,1},{202016,1,1,1},{202017,1,1,1},{202019,1,1,1},{110079,1,1,0},{110003,1,1,0},
S45: 110004 | T45: 红药 | V45: 1 | W45: 1 | X45: 100 | Y45: ="{"&RC[-6]&","&RC[-3]&","&RC[-2]&","&RC[-1]&"}," -> {110004,1,1,100}, | Z45: =R[-1]C&RC[-1] -> {200000,1,1,70},{200001,1,1,70},{200002,1,1,70},{200003,1,1,70},{200006,1,1,70},{200010,1,1,1},{200011,1,1,1},{200012,1,1,1},{200013,1,1,1},{200015,1,1,1},{200016,1,1,1},{200017,1,1,1},{200019,1,1,1},{201000,1,1,70},{201001,1,1,70},{201002,1,1,70},{201003,1,1,70},{201006,1,1,70},{201010,1,1,1},{201011,1,1,1},{201012,1,1,1},{201013,1,1,1},{201015,1,1,1},{201016,1,1,1},{201017,1,1,1},{201019,1,1,1},{202000,1,1,70},{202001,1,1,30},{202002,1,1,30},{202003,1,1,30},{202006,1,1,30},{202010,1,1,1},{202011,1,1,1},{202012,1,1,1},{202013,1,1,1},{202015,1,1,1},{202016,1,1,1},{202017,1,1,1},{202019,1,1,1},{110079,1,1,0},{110003,1,1,0},{110004,1,1,100}, | AB45: 110004 | AC45: 红药 | AE45: 1 | AF45: 1 | AG45: 100 | AH45: ="{"&RC[-6]&","&RC[-3]&","&RC[-2]&","&RC[-1]&"}," -> {110004,1,1,100}, | AI45: =R[-1]C&RC[-1] -> {200000,1,1,70},{200001,1,1,70},{200002,1,1,70},{200003,1,1,70},{200006,1,1,70},{200010,1,1,1},{200011,1,1,1},{200012,1,1,1},{200013,1,1,1},{200015,1,1,1},{200016,1,1,1},{200017,1,1,1},{200019,1,1,1},{201000,1,1,70},{201001,1,1,70},{201002,1,1,70},{201003,1,1,70},{201006,1,1,70},{201010,1,1,1},{201011,1,1,1},{201012,1,1,1},{201013,1,1,1},{201015,1,1,1},{201016,1,1,1},{201017,1,1,1},{201019,1,1,1},{202000,1,1,70},{202001,1,1,30},{202002,1,1,30},{202003,1,1,30},{202006,1,1,30},{202010,1,1,1},{202011,1,1,1},{202012,1,1,1},{202013,1,1,1},{202015,1,1,1},{202016,1,1,1},{202017,1,1,1},{202019,1,1,1},{110079,1,1,0},{110003,1,1,0},{110004,1,1,100}, | AK45: 110004 | AL45: 红药 | AN45: 1 | AO45: 1 | AP45: 100 | AQ45: ="{"&RC[-6]&","&RC[-3]&","&RC[-2]&","&RC[-1]&"}," -> {110004,1,1,100}, | AR45: =R[-1]C&RC[-1] -> {200000,1,1,70},{200001,1,1,70},{200002,1,1,70},{200003,1,1,70},{200006,1,1,70},{200010,1,1,1},{200011,1,1,1},{200012,1,1,1},{200013,1,1,1},{200015,1,1,1},{200016,1,1,1},{200017,1,1,1},{200019,1,1,1},{201000,1,1,70},{201001,1,1,70},{201002,1,1,70},{201003,1,1,70},{201006,1,1,70},{201010,1,1,1},{201011,1,1,1},{201012,1,1,1},{201013,1,1,1},{201015,1,1,1},{201016,1,1,1},{201017,1,1,1},{201019,1,1,1},{202000,1,1,70},{202001,1,1,30},{202002,1,1,30},{202003,1,1,30},{202006,1,1,30},{202010,1,1,1},{202011,1,1,1},{202012,1,1,1},{202013,1,1,1},{202015,1,1,1},{202016,1,1,1},{202017,1,1,1},{202019,1,1,1},{110079,1,1,0},{110003,1,1,0},{110004,1,1,100},
S46: 110005 | T46: 蓝药 | V46: 1 | W46: 1 | X46: 100 | Y46: ="{"&RC[-6]&","&RC[-3]&","&RC[-2]&","&RC[-1]&"}," -> {110005,1,1,100}, | Z46: =R[-1]C&RC[-1] -> {200000,1,1,70},{200001,1,1,70},{200002,1,1,70},{200003,1,1,70},{200006,1,1,70},{200010,1,1,1},{200011,1,1,1},{200012,1,1,1},{200013,1,1,1},{200015,1,1,1},{200016,1,1,1},{200017,1,1,1},{200019,1,1,1},{201000,1,1,70},{201001,1,1,70},{201002,1,1,70},{201003,1,1,70},{201006,1,1,70},{201010,1,1,1},{201011,1,1,1},{201012,1,1,1},{201013,1,1,1},{201015,1,1,1},{201016,1,1,1},{201017,1,1,1},{201019,1,1,1},{202000,1,1,70},{202001,1,1,30},{202002,1,1,30},{202003,1,1,30},{202006,1,1,30},{202010,1,1,1},{202011,1,1,1},{202012,1,1,1},{202013,1,1,1},{202015,1,1,1},{202016,1,1,1},{202017,1,1,1},{202019,1,1,1},{110079,1,1,0},{110003,1,1,0},{110004,1,1,100},{110005,1,1,100}, | AB46: 110005 | AC46: 蓝药 | AE46: 1 | AF46: 1 | AG46: 100 | AH46: ="{"&RC[-6]&","&RC[-3]&","&RC[-2]&","&RC[-1]&"}," -> {110005,1,1,100}, | AI46: =R[-1]C&RC[-1] -> {200000,1,1,70},{200001,1,1,70},{200002,1,1,70},{200003,1,1,70},{200006,1,1,70},{200010,1,1,1},{200011,1,1,1},{200012,1,1,1},{200013,1,1,1},{200015,1,1,1},{200016,1,1,1},{200017,1,1,1},{200019,1,1,1},{201000,1,1,70},{201001,1,1,70},{201002,1,1,70},{201003,1,1,70},{201006,1,1,70},{201010,1,1,1},{201011,1,1,1},{201012,1,1,1},{201013,1,1,1},{201015,1,1,1},{201016,1,1,1},{201017,1,1,1},{201019,1,1,1},{202000,1,1,70},{202001,1,1,30},{202002,1,1,30},{202003,1,1,30},{202006,1,1,30},{202010,1,1,1},{202011,1,1,1},{202012,1,1,1},{202013,1,1,1},{202015,1,1,1},{202016,1,1,1},{202017,1,1,1},{202019,1,1,1},{110079,1,1,0},{110003,1,1,0},{110004,1,1,100},{110005,1,1,100}, | AK46: 110005 | AL46: 蓝药 | AN46: 1 | AO46: 1 | AP46: 100 | AQ46: ="{"&RC[-6]&","&RC[-3]&","&RC[-2]&","&RC[-1]&"}," -> {110005,1,1,100}, | AR46: =R[-1]C&RC[-1] -> {200000,1,1,70},{200001,1,1,70},{200002,1,1,70},{200003,1,1,70},{200006,1,1,70},{200010,1,1,1},{200011,1,1,1},{200012,1,1,1},{200013,1,1,1},{200015,1,1,1},{200016,1,1,1},{200017,1,1,1},{200019,1,1,1},{201000,1,1,70},{201001,1,1,70},{201002,1,1,70},{201003,1,1,70},{201006,1,1,70},{201010,1,1,1},{201011,1,1,1},{201012,1,1,1},{201013,1,1,1},{201015,1,1,1},{201016,1,1,1},{201017,1,1,1},{201019,1,1,1},{202000,1,1,70},{202001,1,1,30},{202002,1,1,30},{202003,1,1,30},{202006,1,1,30},{202010,1,1,1},{202011,1,1,1},{202012,1,1,1},{202013,1,1,1},{202015,1,1,1},{202016,1,1,1},{202017,1,1,1},{202019,1,1,1},{110079,1,1,0},{110003,1,1,0},{110004,1,1,100},{110005,1,1,100},
S47: 110010 | T47: 普通武装碎片 | V47: 1 | W47: 1 | X47: 0 | Y47: ="{"&RC[-6]&","&RC[-3]&","&RC[-2]&","&RC[-1]&"}," -> {110010,1,1,0}, | Z47: =R[-1]C&RC[-1] -> {200000,1,1,70},{200001,1,1,70},{200002,1,1,70},{200003,1,1,70},{200006,1,1,70},{200010,1,1,1},{200011,1,1,1},{200012,1,1,1},{200013,1,1,1},{200015,1,1,1},{200016,1,1,1},{200017,1,1,1},{200019,1,1,1},{201000,1,1,70},{201001,1,1,70},{201002,1,1,70},{201003,1,1,70},{201006,1,1,70},{201010,1,1,1},{201011,1,1,1},{201012,1,1,1},{201013,1,1,1},{201015,1,1,1},{201016,1,1,1},{201017,1,1,1},{201019,1,1,1},{202000,1,1,70},{202001,1,1,30},{202002,1,1,30},{202003,1,1,30},{202006,1,1,30},{202010,1,1,1},{202011,1,1,1},{202012,1,1,1},{202013,1,1,1},{202015,1,1,1},{202016,1,1,1},{202017,1,1,1},{202019,1,1,1},{110079,1,1,0},{110003,1,1,0},{110004,1,1,100},{110005,1,1,100},{110010,1,1,0}, | AB47: 110010 | AC47: 普通武装碎片 | AE47: 1 | AF47: 1 | AG47: 0 | AH47: ="{"&RC[-6]&","&RC[-3]&","&RC[-2]&","&RC[-1]&"}," -> {110010,1,1,0}, | AI47: =R[-1]C&RC[-1] -> {200000,1,1,70},{200001,1,1,70},{200002,1,1,70},{200003,1,1,70},{200006,1,1,70},{200010,1,1,1},{200011,1,1,1},{200012,1,1,1},{200013,1,1,1},{200015,1,1,1},{200016,1,1,1},{200017,1,1,1},{200019,1,1,1},{201000,1,1,70},{201001,1,1,70},{201002,1,1,70},{201003,1,1,70},{201006,1,1,70},{201010,1,1,1},{201011,1,1,1},{201012,1,1,1},{201013,1,1,1},{201015,1,1,1},{201016,1,1,1},{201017,1,1,1},{201019,1,1,1},{202000,1,1,70},{202001,1,1,30},{202002,1,1,30},{202003,1,1,30},{202006,1,1,30},{202010,1,1,1},{202011,1,1,1},{202012,1,1,1},{202013,1,1,1},{202015,1,1,1},{202016,1,1,1},{202017,1,1,1},{202019,1,1,1},{110079,1,1,0},{110003,1,1,0},{110004,1,1,100},{110005,1,1,100},{110010,1,1,0}, | AK47: 110010 | AL47: 普通武装碎片 | AN47: 1 | AO47: 1 | AP47: 0 | AQ47: ="{"&RC[-6]&","&RC[-3]&","&RC[-2]&","&RC[-1]&"}," -> {110010,1,1,0}, | AR47: =R[-1]C&RC[-1] -> {200000,1,1,70},{200001,1,1,70},{200002,1,1,70},{200003,1,1,70},{200006,1,1,70},{200010,1,1,1},{200011,1,1,1},{200012,1,1,1},{200013,1,1,1},{200015,1,1,1},{200016,1,1,1},{200017,1,1,1},{200019,1,1,1},{201000,1,1,70},{201001,1,1,70},{201002,1,1,70},{201003,1,1,70},{201006,1,1,70},{201010,1,1,1},{201011,1,1,1},{201012,1,1,1},{201013,1,1,1},{201015,1,1,1},{201016,1,1,1},{201017,1,1,1},{201019,1,1,1},{202000,1,1,70},{202001,1,1,30},{202002,1,1,30},{202003,1,1,30},{202006,1,1,30},{202010,1,1,1},{202011,1,1,1},{202012,1,1,1},{202013,1,1,1},{202015,1,1,1},{202016,1,1,1},{202017,1,1,1},{202019,1,1,1},{110079,1,1,0},{110003,1,1,0},{110004,1,1,100},{110005,1,1,100},{110010,1,1,0},
S48: 110011 | T48: 普通防具碎片 | V48: 1 | W48: 1 | X48: 0 | Y48: ="{"&RC[-6]&","&RC[-3]&","&RC[-2]&","&RC[-1]&"}," -> {110011,1,1,0}, | Z48: =R[-1]C&RC[-1] -> {200000,1,1,70},{200001,1,1,70},{200002,1,1,70},{200003,1,1,70},{200006,1,1,70},{200010,1,1,1},{200011,1,1,1},{200012,1,1,1},{200013,1,1,1},{200015,1,1,1},{200016,1,1,1},{200017,1,1,1},{200019,1,1,1},{201000,1,1,70},{201001,1,1,70},{201002,1,1,70},{201003,1,1,70},{201006,1,1,70},{201010,1,1,1},{201011,1,1,1},{201012,1,1,1},{201013,1,1,1},{201015,1,1,1},{201016,1,1,1},{201017,1,1,1},{201019,1,1,1},{202000,1,1,70},{202001,1,1,30},{202002,1,1,30},{202003,1,1,30},{202006,1,1,30},{202010,1,1,1},{202011,1,1,1},{202012,1,1,1},{202013,1,1,1},{202015,1,1,1},{202016,1,1,1},{202017,1,1,1},{202019,1,1,1},{110079,1,1,0},{110003,1,1,0},{110004,1,1,100},{110005,1,1,100},{110010,1,1,0},{110011,1,1,0}, | AB48: 110011 | AC48: 普通防具碎片 | AE48: 1 | AF48: 1 | AG48: 0 | AH48: ="{"&RC[-6]&","&RC[-3]&","&RC[-2]&","&RC[-1]&"}," -> {110011,1,1,0}, | AI48: =R[-1]C&RC[-1] -> {200000,1,1,70},{200001,1,1,70},{200002,1,1,70},{200003,1,1,70},{200006,1,1,70},{200010,1,1,1},{200011,1,1,1},{200012,1,1,1},{200013,1,1,1},{200015,1,1,1},{200016,1,1,1},{200017,1,1,1},{200019,1,1,1},{201000,1,1,70},{201001,1,1,70},{201002,1,1,70},{201003,1,1,70},{201006,1,1,70},{201010,1,1,1},{201011,1,1,1},{201012,1,1,1},{201013,1,1,1},{201015,1,1,1},{201016,1,1,1},{201017,1,1,1},{201019,1,1,1},{202000,1,1,70},{202001,1,1,30},{202002,1,1,30},{202003,1,1,30},{202006,1,1,30},{202010,1,1,1},{202011,1,1,1},{202012,1,1,1},{202013,1,1,1},{202015,1,1,1},{202016,1,1,1},{202017,1,1,1},{202019,1,1,1},{110079,1,1,0},{110003,1,1,0},{110004,1,1,100},{110005,1,1,100},{110010,1,1,0},{110011,1,1,0}, | AK48: 110011 | AL48: 普通防具碎片 | AN48: 1 | AO48: 1 | AP48: 0 | AQ48: ="{"&RC[-6]&","&RC[-3]&","&RC[-2]&","&RC[-1]&"}," -> {110011,1,1,0}, | AR48: =R[-1]C&RC[-1] -> {200000,1,1,70},{200001,1,1,70},{200002,1,1,70},{200003,1,1,70},{200006,1,1,70},{200010,1,1,1},{200011,1,1,1},{200012,1,1,1},{200013,1,1,1},{200015,1,1,1},{200016,1,1,1},{200017,1,1,1},{200019,1,1,1},{201000,1,1,70},{201001,1,1,70},{201002,1,1,70},{201003,1,1,70},{201006,1,1,70},{201010,1,1,1},{201011,1,1,1},{201012,1,1,1},{201013,1,1,1},{201015,1,1,1},{201016,1,1,1},{201017,1,1,1},{201019,1,1,1},{202000,1,1,70},{202001,1,1,30},{202002,1,1,30},{202003,1,1,30},{202006,1,1,30},{202010,1,1,1},{202011,1,1,1},{202012,1,1,1},{202013,1,1,1},{202015,1,1,1},{202016,1,1,1},{202017,1,1,1},{202019,1,1,1},{110079,1,1,0},{110003,1,1,0},{110004,1,1,100},{110005,1,1,100},{110010,1,1,0},{110011,1,1,0},
S49: 110012 | T49: 普通首饰碎片 | V49: 1 | W49: 1 | X49: 0 | Y49: ="{"&RC[-6]&","&RC[-3]&","&RC[-2]&","&RC[-1]&"}," -> {110012,1,1,0}, | Z49: =R[-1]C&RC[-1] -> {200000,1,1,70},{200001,1,1,70},{200002,1,1,70},{200003,1,1,70},{200006,1,1,70},{200010,1,1,1},{200011,1,1,1},{200012,1,1,1},{200013,1,1,1},{200015,1,1,1},{200016,1,1,1},{200017,1,1,1},{200019,1,1,1},{201000,1,1,70},{201001,1,1,70},{201002,1,1,70},{201003,1,1,70},{201006,1,1,70},{201010,1,1,1},{201011,1,1,1},{201012,1,1,1},{201013,1,1,1},{201015,1,1,1},{201016,1,1,1},{201017,1,1,1},{201019,1,1,1},{202000,1,1,70},{202001,1,1,30},{202002,1,1,30},{202003,1,1,30},{202006,1,1,30},{202010,1,1,1},{202011,1,1,1},{202012,1,1,1},{202013,1,1,1},{202015,1,1,1},{202016,1,1,1},{202017,1,1,1},{202019,1,1,1},{110079,1,1,0},{110003,1,1,0},{110004,1,1,100},{110005,1,1,100},{110010,1,1,0},{110011,1,1,0},{110012,1,1,0}, | AB49: 110012 | AC49: 普通首饰碎片 | AE49: 1 | AF49: 1 | AG49: 0 | AH49: ="{"&RC[-6]&","&RC[-3]&","&RC[-2]&","&RC[-1]&"}," -> {110012,1,1,0}, | AI49: =R[-1]C&RC[-1] -> {200000,1,1,70},{200001,1,1,70},{200002,1,1,70},{200003,1,1,70},{200006,1,1,70},{200010,1,1,1},{200011,1,1,1},{200012,1,1,1},{200013,1,1,1},{200015,1,1,1},{200016,1,1,1},{200017,1,1,1},{200019,1,1,1},{201000,1,1,70},{201001,1,1,70},{201002,1,1,70},{201003,1,1,70},{201006,1,1,70},{201010,1,1,1},{201011,1,1,1},{201012,1,1,1},{201013,1,1,1},{201015,1,1,1},{201016,1,1,1},{201017,1,1,1},{201019,1,1,1},{202000,1,1,70},{202001,1,1,30},{202002,1,1,30},{202003,1,1,30},{202006,1,1,30},{202010,1,1,1},{202011,1,1,1},{202012,1,1,1},{202013,1,1,1},{202015,1,1,1},{202016,1,1,1},{202017,1,1,1},{202019,1,1,1},{110079,1,1,0},{110003,1,1,0},{110004,1,1,100},{110005,1,1,100},{110010,1,1,0},{110011,1,1,0},{110012,1,1,0}, | AK49: 110012 | AL49: 普通首饰碎片 | AN49: 1 | AO49: 1 | AP49: 0 | AQ49: ="{"&RC[-6]&","&RC[-3]&","&RC[-2]&","&RC[-1]&"}," -> {110012,1,1,0}, | AR49: =R[-1]C&RC[-1] -> {200000,1,1,70},{200001,1,1,70},{200002,1,1,70},{200003,1,1,70},{200006,1,1,70},{200010,1,1,1},{200011,1,1,1},{200012,1,1,1},{200013,1,1,1},{200015,1,1,1},{200016,1,1,1},{200017,1,1,1},{200019,1,1,1},{201000,1,1,70},{201001,1,1,70},{201002,1,1,70},{201003,1,1,70},{201006,1,1,70},{201010,1,1,1},{201011,1,1,1},{201012,1,1,1},{201013,1,1,1},{201015,1,1,1},{201016,1,1,1},{201017,1,1,1},{201019,1,1,1},{202000,1,1,70},{202001,1,1,30},{202002,1,1,30},{202003,1,1,30},{202006,1,1,30},{202010,1,1,1},{202011,1,1,1},{202012,1,1,1},{202013,1,1,1},{202015,1,1,1},{202016,1,1,1},{202017,1,1,1},{202019,1,1,1},{110079,1,1,0},{110003,1,1,0},{110004,1,1,100},{110005,1,1,100},{110010,1,1,0},{110011,1,1,0},{110012,1,1,0},
S50: 110009 | T50: 金币 | V50: 1 | W50: 3 | X50: 100 | Y50: ="{"&RC[-6]&","&RC[-3]&","&RC[-2]&","&RC[-1]&"}" -> {110009,1,3,100} | Z50: =R[-1]C&RC[-1] -> {200000,1,1,70},{200001,1,1,70},{200002,1,1,70},{200003,1,1,70},{200006,1,1,70},{200010,1,1,1},{200011,1,1,1},{200012,1,1,1},{200013,1,1,1},{200015,1,1,1},{200016,1,1,1},{200017,1,1,1},{200019,1,1,1},{201000,1,1,70},{201001,1,1,70},{201002,1,1,70},{201003,1,1,70},{201006,1,1,70},{201010,1,1,1},{201011,1,1,1},{201012,1,1,1},{201013,1,1,1},{201015,1,1,1},{201016,1,1,1},{201017,1,1,1},{201019,1,1,1},{202000,1,1,70},{202001,1,1,30},{202002,1,1,30},{202003,1,1,30},{202006,1,1,30},{202010,1,1,1},{202011,1,1,1},{202012,1,1,1},{202013,1,1,1},{202015,1,1,1},{202016,1,1,1},{202017,1,1,1},{202019,1,1,1},{110079,1,1,0},{110003,1,1,0},{110004,1,1,100},{110005,1,1,100},{110010,1,1,0},{110011,1,1,0},{110012,1,1,0},{110009,1,3,100} | AB50: 110009 | AC50: 金币 | AE50: 1 | AF50: 4 | AG50: 100 | AH50: ="{"&RC[-6]&","&RC[-3]&","&RC[-2]&","&RC[-1]&"}" -> {110009,1,4,100} | AI50: =R[-1]C&RC[-1] -> {200000,1,1,70},{200001,1,1,70},{200002,1,1,70},{200003,1,1,70},{200006,1,1,70},{200010,1,1,1},{200011,1,1,1},{200012,1,1,1},{200013,1,1,1},{200015,1,1,1},{200016,1,1,1},{200017,1,1,1},{200019,1,1,1},{201000,1,1,70},{201001,1,1,70},{201002,1,1,70},{201003,1,1,70},{201006,1,1,70},{201010,1,1,1},{201011,1,1,1},{201012,1,1,1},{201013,1,1,1},{201015,1,1,1},{201016,1,1,1},{201017,1,1,1},{201019,1,1,1},{202000,1,1,70},{202001,1,1,30},{202002,1,1,30},{202003,1,1,30},{202006,1,1,30},{202010,1,1,1},{202011,1,1,1},{202012,1,1,1},{202013,1,1,1},{202015,1,1,1},{202016,1,1,1},{202017,1,1,1},{202019,1,1,1},{110079,1,1,0},{110003,1,1,0},{110004,1,1,100},{110005,1,1,100},{110010,1,1,0},{110011,1,1,0},{110012,1,1,0},{110009,1,4,100} | AK50: 110009 | AL50: 金币 | AN50: 1 | AO50: 5 | AP50: 100 | AQ50: ="{"&RC[-6]&","&RC[-3]&","&RC[-2]&","&RC[-1]&"}" -> {110009,1,5,100} | AR50: =R[-1]C&RC[-1] -> {200000,1,1,70},{200001,1,1,70},{200002,1,1,70},{200003,1,1,70},{200006,1,1,70},{200010,1,1,1},{200011,1,1,1},{200012,1,1,1},{200013,1,1,1},{200015,1,1,1},{200016,1,1,1},{200017,1,1,1},{200019,1,1,1},{201000,1,1,70},{201001,1,1,70},{201002,1,1,70},{201003,1,1,70},{201006,1,1,70},{201010,1,1,1},{201011,1,1,1},{201012,1,1,1},{201013,1,1,1},{201015,1,1,1},{201016,1,1,1},{201017,1,1,1},{201019,1,1,1},{202000,1,1,70},{202001,1,1,30},{202002,1,1,30},{202003,1,1,30},{202006,1,1,30},{202010,1,1,1},{202011,1,1,1},{202012,1,1,1},{202013,1,1,1},{202015,1,1,1},{202016,1,1,1},{202017,1,1,1},{202019,1,1,1},{110079,1,1,0},{110003,1,1,0},{110004,1,1,100},{110005,1,1,100},{110010,1,1,0},{110011,1,1,0},{110012,1,1,0},{110009,1,5,100}
X52: 掉落数量 | Y52: 概率／100 | AG52: 掉落数量 | AH52: 概率／100 | AP52: 掉落数量 | AQ52: 概率／100
X53: 0 | Y53: =10000-R[1]C -> 9995 | Z53: ="{"&RC[-2]&","&RC[-1]&"}," -> {0,9995}, | AG53: 0 | AH53: =10000-R[1]C -> 9995 | AI53: ="{"&RC[-2]&","&RC[-1]&"}," -> {0,9995}, | AP53: 0 | AQ53: =10000-R[1]C -> 9995 | AR53: ="{"&RC[-2]&","&RC[-1]&"}," -> {0,9995},
T54: BOSS怪掉落 | X54: 1 | Y54: 5 | Z54: ="{"&RC[-2]&","&RC[-1]&"}" -> {1,5} | AC54: BOSS怪掉落 | AG54: 1 | AH54: 5 | AI54: ="{"&RC[-2]&","&RC[-1]&"}" -> {1,5} | AL54: BOSS怪掉落 | AP54: 1 | AQ54: 5 | AR54: ="{"&RC[-2]&","&RC[-1]&"}" -> {1,5}
Z56: ="[{0,["&R[-3]C&R[-2]C&"],["&R[-6]C&"]}]" -> [{0,[{0,9995},{1,5}],[{200000,1,1,70},{200001,1,1,70},{200002,1,1,70},{200003,1,1,70},{200006,1,1,70},{200010,1,1,1},{200011,1,1,1},{200012,1,1,1},{200013,1,1,1},{200015,1,1,1},{200016,1,1,1},{200017,1,1,1},{200019,1,1,1},{201000,1,1,70},{201001,1,1,70},{201002,1,1,70},{201003,1,1,70},{201006,1,1,70},{201010,1,1,1},{201011,1,1,1},{201012,1,1,1},{201013,1,1,1},{201015,1,1,1},{201016,1,1,1},{201017,1,1,1},{201019,1,1,1},{202000,1,1,70},{202001,1,1,30},{202002,1,1,30},{202003,1,1,30},{202006,1,1,30},{202010,1,1,1},{202011,1,1,1},{202012,1,1,1},{202013,1,1,1},{202015,1,1,1},{202016,1,1,1},{202017,1,1,1},{202019,1,1,1},{110079,1,1,0},{110003,1,1,0},{110004,1,1,100},{110005,1,1,100},{110010,1,1,0},{110011,1,1,0},{110012,1,1,0},{110009,1,3,100}]}] | AI56: ="[{0,["&R[-3]C&R[-2]C&"],["&R[-6]C&"]}]" -> [{0,[{0,9995},{1,5}],[{200000,1,1,70},{200001,1,1,70},{200002,1,1,70},{200003,1,1,70},{200006,1,1,70},{200010,1,1,1},{200011,1,1,1},{200012,1,1,1},{200013,1,1,1},{200015,1,1,1},{200016,1,1,1},{200017,1,1,1},{200019,1,1,1},{201000,1,1,70},{201001,1,1,70},{201002,1,1,70},{201003,1,1,70},{201006,1,1,70},{201010,1,1,1},{201011,1,1,1},{201012,1,1,1},{201013,1,1,1},{201015,1,1,1},{201016,1,1,1},{201017,1,1,1},{201019,1,1,1},{202000,1,1,70},{202001,1,1,30},{202002,1,1,30},{202003,1,1,30},{202006,1,1,30},{202010,1,1,1},{202011,1,1,1},{202012,1,1,1},{202013,1,1,1},{202015,1,1,1},{202016,1,1,1},{202017,1,1,1},{202019,1,1,1},{110079,1,1,0},{110003,1,1,0},{110004,1,1,100},{110005,1,1,100},{110010,1,1,0},{110011,1,1,0},{110012,1,1,0},{110009,1,4,100}]}] | AR56: ="[{0,["&R[-3]C&R[-2]C&"],["&R[-6]C&"]}]" -> [{0,[{0,9995},{1,5}],[{200000,1,1,70},{200001,1,1,70},{200002,1,1,70},{200003,1,1,70},{200006,1,1,70},{200010,1,1,1},{200011,1,1,1},{200012,1,1,1},{200013,1,1,1},{200015,1,1,1},{200016,1,1,1},{200017,1,1,1},{200019,1,1,1},{201000,1,1,70},{201001,1,1,70},{201002,1,1,70},{201003,1,1,70},{201006,1,1,70},{201010,1,1,1},{201011,1,1,1},{201012,1,1,1},{201013,1,1,1},{201015,1,1,1},{201016,1,1,1},{201017,1,1,1},{201019,1,1,1},{202000,1,1,70},{202001,1,1,30},{202002,1,1,30},{202003,1,1,30},{202006,1,1,30},{202010,1,1,1},{202011,1,1,1},{202012,1,1,1},{202013,1,1,1},{202015,1,1,1},{202016,1,1,1},{202017,1,1,1},{202019,1,1,1},{110079,1,1,0},{110003,1,1,0},{110004,1,1,100},{110005,1,1,100},{110010,1,1,0},{110011,1,1,0},{110012,1,1,0},{110009,1,5,100}]}]

Sheet: BOSS掉落
A1: 挂机小怪：白装、绿装掉落
A2: 10级怪物（1-10级装备掉落） | J2: 20级怪物（1-20级装备掉落） | S2: 30级怪物（11-30级装备掉落） | AB2: 40级怪物（11-30级装备掉落） | AK2: 50级怪物（11-30级装备掉落）
A3: ID | B3: 名称 | C3: 品质 | D3: 是否绑定 | E3: 数量 | F3: 概率 | J3: ID | K3: 名称 | L3: 品质 | M3: 是否绑定 | N3: 数量 | S3: ID | T3: 名称 | U3: 品质 | V3: 是否绑定 | W3: 数量 | AB3: ID | AC3: 名称 | AD3: 品质 | AE3: 是否绑定 | AF3: 数量 | AK3: ID | AL3: 名称 | AM3: 品质 | AN3: 是否绑定 | AO3: 数量
A4: 200000 | B4: 八荒 | C4: 1 | D4: 1 | E4: 1 | F4: 100 | G4: ="{"&RC[-6]&","&RC[-3]&","&RC[-2]&","&RC[-1]&"}," -> {200000,1,1,100}, | H4: =RC[-1] -> {200000,1,1,100}, | J4: 200000 | K4: 八荒 | L4: 1 | M4: 1 | N4: 1 | O4: 60 | P4: ="{"&RC[-6]&","&RC[-3]&","&RC[-2]&","&RC[-1]&"}," -> {200000,1,1,60}, | Q4: =RC[-1] -> {200000,1,1,60}, | S4: 200000 | T4: 八荒 | U4: 1 | V4: 1 | W4: 1 | X4: 70 | Y4: ="{"&RC[-6]&","&RC[-3]&","&RC[-2]&","&RC[-1]&"}," -> {200000,1,1,70}, | Z4: =RC[-1] -> {200000,1,1,70}, | AB4: 200000 | AC4: 八荒 | AD4: 1 | AE4: 1 | AF4: 1 | AG4: 70 | AH4: ="{"&RC[-6]&","&RC[-3]&","&RC[-2]&","&RC[-1]&"}," -> {200000,1,1,70}, | AI4: =RC[-1] -> {200000,1,1,70}, | AK4: 200000 | AL4: 八荒 | AM4: 1 | AN4: 1 | AO4: 1 | AP4: 70 | AQ4: ="{"&RC[-6]&","&RC[-3]&","&RC[-2]&","&RC[-1]&"}," -> {200000,1,1,70}, | AR4: =RC[-1] -> {200000,1,1,70},
A5: 200001 | B5: 轻盔 | C5: 1 | D5: 1 | E5: 1 | F5: 100 | G5: ="{"&RC[-6]&","&RC[-3]&","&RC[-2]&","&RC[-1]&"}," -> {200001,1,1,100}, | H5: =R[-1]C&RC[-1] -> {200000,1,1,100},{200001,1,1,100}, | J5: 200001 | K5: 轻盔 | L5: 1 | M5: 1 | N5: 1 | O5: 60 | P5: ="{"&RC[-6]&","&RC[-3]&","&RC[-2]&","&RC[-1]&"}," -> {200001,1,1,60}, | Q5: =R[-1]C&RC[-1] -> {200000,1,1,60},{200001,1,1,60}, | S5: 200001 | T5: 轻盔 | U5: 1 | V5: 1 | W5: 1 | X5: 70 | Y5: ="{"&RC[-6]&","&RC[-3]&","&RC[-2]&","&RC[-1]&"}," -> {200001,1,1,70}, | Z5: =R[-1]C&RC[-1] -> {200000,1,1,70},{200001,1,1,70}, | AB5: 200001 | AC5: 轻盔 | AD5: 1 | AE5: 1 | AF5: 1 | AG5: 70 | AH5: ="{"&RC[-6]&","&RC[-3]&","&RC[-2]&","&RC[-1]&"}," -> {200001,1,1,70}, | AI5: =R[-1]C&RC[-1] -> {200000,1,1,70},{200001,1,1,70}, | AK5: 200001 | AL5: 轻盔 | AM5: 1 | AN5: 1 | AO5: 1 | AP5: 70 | AQ5: ="{"&RC[-6]&","&RC[-3]&","&RC[-2]&","&RC[-1]&"}," -> {200001,1,1,70}, | AR5: =R[-1]C&RC[-1] -> {200000,1,1,70},{200001,1,1,70},
A6: 200002 | B6: 珊瑚戒指 | C6: 1 | D6: 1 | E6: 1 | F6: 100 | G6: ="{"&RC[-6]&","&RC[-3]&","&RC[-2]&","&RC[-1]&"}," -> {200002,1,1,100}, | H6: =R[-1]C&RC[-1] -> {200000,1,1,100},{200001,1,1,100},{200002,1,1,100}, | J6: 200002 | K6: 珊瑚戒指 | L6: 1 | M6: 1 | N6: 1 | O6: 60 | P6: ="{"&RC[-6]&","&RC[-3]&","&RC[-2]&","&RC[-1]&"}," -> {200002,1,1,60}, | Q6: =R[-1]C&RC[-1] -> {200000,1,1,60},{200001,1,1,60},{200002,1,1,60}, | S6: 200002 | T6: 珊瑚戒指 | U6: 1 | V6: 1 | W6: 1 | X6: 70 | Y6: ="{"&RC[-6]&","&RC[-3]&","&RC[-2]&","&RC[-1]&"}," -> {200002,1,1,70}, | Z6: =R[-1]C&RC[-1] -> {200000,1,1,70},{200001,1,1,70},{200002,1,1,70}, | AB6: 200002 | AC6: 珊瑚戒指 | AD6: 1 | AE6: 1 | AF6: 1 | AG6: 70 | AH6: ="{"&RC[-6]&","&RC[-3]&","&RC[-2]&","&RC[-1]&"}," -> {200002,1,1,70}, | AI6: =R[-1]C&RC[-1] -> {200000,1,1,70},{200001,1,1,70},{200002,1,1,70}, | AK6: 200002 | AL6: 珊瑚戒指 | AM6: 1 | AN6: 1 | AO6: 1 | AP6: 70 | AQ6: ="{"&RC[-6]&","&RC[-3]&","&RC[-2]&","&RC[-1]&"}," -> {200002,1,1,70}, | AR6: =R[-1]C&RC[-1] -> {200000,1,1,70},{200001,1,1,70},{200002,1,1,70},
A7: 200003 | B7: 魔力手镯 | C7: 1 | D7: 1 | E7: 1 | F7: 100 | G7: ="{"&RC[-6]&","&RC[-3]&","&RC[-2]&","&RC[-1]&"}," -> {200003,1,1,100}, | H7: =R[-1]C&RC[-1] -> {200000,1,1,100},{200001,1,1,100},{200002,1,1,100},{200003,1,1,100}, | J7: 200003 | K7: 魔力手镯 | L7: 1 | M7: 1 | N7: 1 | O7: 60 | P7: ="{"&RC[-6]&","&RC[-3]&","&RC[-2]&","&RC[-1]&"}," -> {200003,1,1,60}, | Q7: =R[-1]C&RC[-1] -> {200000,1,1,60},{200001,1,1,60},{200002,1,1,60},{200003,1,1,60}, | S7: 200003 | T7: 魔力手镯 | U7: 1 | V7: 1 | W7: 1 | X7: 70 | Y7: ="{"&RC[-6]&","&RC[-3]&","&RC[-2]&","&RC[-1]&"}," -> {200003,1,1,70}, | Z7: =R[-1]C&RC[-1] -> {200000,1,1,70},{200001,1,1,70},{200002,1,1,70},{200003,1,1,70}, | AB7: 200003 | AC7: 魔力手镯 | AD7: 1 | AE7: 1 | AF7: 1 | AG7: 70 | AH7: ="{"&RC[-6]&","&RC[-3]&","&RC[-2]&","&RC[-1]&"}," -> {200003,1,1,70}, | AI7: =R[-1]C&RC[-1] -> {200000,1,1,70},{200001,1,1,70},{200002,1,1,70},{200003,1,1,70}, | AK7: 200003 | AL7: 魔力手镯 | AM7: 1 | AN7: 1 | AO7: 1 | AP7: 70 | AQ7: ="{"&RC[-6]&","&RC[-3]&","&RC[-2]&","&RC[-1]&"}," -> {200003,1,1,70}, | AR7: =R[-1]C&RC[-1] -> {200000,1,1,70},{200001,1,1,70},{200002,1,1,70},{200003,1,1,70},
A8: 200006 | B8: 恶魔项链 | C8: 1 | D8: 1 | E8: 1 | F8: 100 | G8: ="{"&RC[-6]&","&RC[-3]&","&RC[-2]&","&RC[-1]&"}," -> {200006,1,1,100}, | H8: =R[-1]C&RC[-1] -> {200000,1,1,100},{200001,1,1,100},{200002,1,1,100},{200003,1,1,100},{200006,1,1,100}, | J8: 200006 | K8: 恶魔项链 | L8: 1 | M8: 1 | N8: 1 | O8: 60 | P8: ="{"&RC[-6]&","&RC[-3]&","&RC[-2]&","&RC[-1]&"}," -> {200006,1,1,60}, | Q8: =R[-1]C&RC[-1] -> {200000,1,1,60},{200001,1,1,60},{200002,1,1,60},{200003,1,1,60},{200006,1,1,60}, | S8: 200006 | T8: 恶魔项链 | U8: 1 | V8: 1 | W8: 1 | X8: 70 | Y8: ="{"&RC[-6]&","&RC[-3]&","&RC[-2]&","&RC[-1]&"}," -> {200006,1,1,70}, | Z8: =R[-1]C&RC[-1] -> {200000,1,1,70},{200001,1,1,70},{200002,1,1,70},{200003,1,1,70},{200006,1,1,70}, | AB8: 200006 | AC8: 恶魔项链 | AD8: 1 | AE8: 1 | AF8: 1 | AG8: 70 | AH8: ="{"&RC[-6]&","&RC[-3]&","&RC[-2]&","&RC[-1]&"}," -> {200006,1,1,70}, | AI8: =R[-1]C&RC[-1] -> {200000,1,1,70},{200001,1,1,70},{200002,1,1,70},{200003,1,1,70},{200006,1,1,70}, | AK8: 200006 | AL8: 恶魔项链 | AM8: 1 | AN8: 1 | AO8: 1 | AP8: 70 | AQ8: ="{"&RC[-6]&","&RC[-3]&","&RC[-2]&","&RC[-1]&"}," -> {200006,1,1,70}, | AR8: =R[-1]C&RC[-1] -> {200000,1,1,70},{200001,1,1,70},{200002,1,1,70},{200003,1,1,70},{200006,1,1,70},
A9: 201000 | B9: 海魂 | C9: 1 | D9: 1 | E9: 1 | F9: 100 | G9: ="{"&RC[-6]&","&RC[-3]&","&RC[-2]&","&RC[-1]&"}," -> {201000,1,1,100}, | H9: =R[-1]C&RC[-1] -> {200000,1,1,100},{200001,1,1,100},{200002,1,1,100},{200003,1,1,100},{200006,1,1,100},{201000,1,1,100}, | J9: 200010 | K9: 炼狱 | L9: 1 | M9: 1 | N9: 1 | O9: 5 | P9: ="{"&RC[-6]&","&RC[-3]&","&RC[-2]&","&RC[-1]&"}," -> {200010,1,1,5}, | Q9: =R[-1]C&RC[-1] -> {200000,1,1,60},{200001,1,1,60},{200002,1,1,60},{200003,1,1,60},{200006,1,1,60},{200010,1,1,5}, | S9: 200010 | T9: 炼狱 | U9: 1 | V9: 1 | W9: 1 | X9: 12 | Y9: ="{"&RC[-6]&","&RC[-3]&","&RC[-2]&","&RC[-1]&"}," -> {200010,1,1,12}, | Z9: =R[-1]C&RC[-1] -> {200000,1,1,70},{200001,1,1,70},{200002,1,1,70},{200003,1,1,70},{200006,1,1,70},{200010,1,1,12}, | AB9: 200010 | AC9: 炼狱 | AD9: 1 | AE9: 1 | AF9: 1 | AG9: 12 | AH9: ="{"&RC[-6]&","&RC[-3]&","&RC[-2]&","&RC[-1]&"}," -> {200010,1,1,12}, | AI9: =R[-1]C&RC[-1] -> {200000,1,1,70},{200001,1,1,70},{200002,1,1,70},{200003,1,1,70},{200006,1,1,70},{200010,1,1,12}, | AK9: 200010 | AL9: 炼狱 | AM9: 1 | AN9: 1 | AO9: 1 | AP9: 12 | AQ9: ="{"&RC[-6]&","&RC[-3]&","&RC[-2]&","&RC[-1]&"}," -> {200010,1,1,12}, | AR9: =R[-1]C&RC[-1] -> {200000,1,1,70},{200001,1,1,70},{200002,1,1,70},{200003,1,1,70},{200006,1,1,70},{200010,1,1,12},
A10: 201001 | B10: 轻盔 | C10: 1 | D10: 1 | E10: 1 | F10: 100 | G10: ="{"&RC[-6]&","&RC[-3]&","&RC[-2]&","&RC[-1]&"}," -> {201001,1,1,100}, | H10: =R[-1]C&RC[-1] -> {200000,1,1,100},{200001,1,1,100},{200002,1,1,100},{200003,1,1,100},{200006,1,1,100},{201000,1,1,100},{201001,1,1,100}, | J10: 200011 | K10: 绿色项链 | L10: 1 | M10: 1 | N10: 1 | O10: 5 | P10: ="{"&RC[-6]&","&RC[-3]&","&RC[-2]&","&RC[-1]&"}," -> {200011,1,1,5}, | Q10: =R[-1]C&RC[-1] -> {200000,1,1,60},{200001,1,1,60},{200002,1,1,60},{200003,1,1,60},{200006,1,1,60},{200010,1,1,5},{200011,1,1,5}, | S10: 200011 | T10: 绿色项链 | U10: 1 | V10: 1 | W10: 1 | X10: 12 | Y10: ="{"&RC[-6]&","&RC[-3]&","&RC[-2]&","&RC[-1]&"}," -> {200011,1,1,12}, | Z10: =R[-1]C&RC[-1] -> {200000,1,1,70},{200001,1,1,70},{200002,1,1,70},{200003,1,1,70},{200006,1,1,70},{200010,1,1,12},{200011,1,1,12}, | AB10: 200011 | AC10: 绿色项链 | AD10: 1 | AE10: 1 | AF10: 1 | AG10: 12 | AH10: ="{"&RC[-6]&","&RC[-3]&","&RC[-2]&","&RC[-1]&"}," -> {200011,1,1,12}, | AI10: =R[-1]C&RC[-1] -> {200000,1,1,70},{200001,1,1,70},{200002,1,1,70},{200003,1,1,70},{200006,1,1,70},{200010,1,1,12},{200011,1,1,12}, | AK10: 200011 | AL10: 绿色项链 | AM10: 1 | AN10: 1 | AO10: 1 | AP10: 12 | AQ10: ="{"&RC[-6]&","&RC[-3]&","&RC[-2]&","&RC[-1]&"}," -> {200011,1,1,12}, | AR10: =R[-1]C&RC[-1] -> {200000,1,1,70},{200001,1,1,70},{200002,1,1,70},{200003,1,1,70},{200006,1,1,70},{200010,1,1,12},{200011,1,1,12},
A11: 201002 | B11: 金戒指 | C11: 1 | D11: 1 | E11: 1 | F11: 100 | G11: ="{"&RC[-6]&","&RC[-3]&","&RC[-2]&","&RC[-1]&"}," -> {201002,1,1,100}, | H11: =R[-1]C&RC[-1] -> {200000,1,1,100},{200001,1,1,100},{200002,1,1,100},{200003,1,1,100},{200006,1,1,100},{201000,1,1,100},{201001,1,1,100},{201002,1,1,100}, | J11: 200012 | K11: 战神盔甲 | L11: 1 | M11: 1 | N11: 1 | O11: 5 | P11: ="{"&RC[-6]&","&RC[-3]&","&RC[-2]&","&RC[-1]&"}," -> {200012,1,1,5}, | Q11: =R[-1]C&RC[-1] -> {200000,1,1,60},{200001,1,1,60},{200002,1,1,60},{200003,1,1,60},{200006,1,1,60},{200010,1,1,5},{200011,1,1,5},{200012,1,1,5}, | S11: 200012 | T11: 战神盔甲 | U11: 1 | V11: 1 | W11: 1 | X11: 12 | Y11: ="{"&RC[-6]&","&RC[-3]&","&RC[-2]&","&RC[-1]&"}," -> {200012,1,1,12}, | Z11: =R[-1]C&RC[-1] -> {200000,1,1,70},{200001,1,1,70},{200002,1,1,70},{200003,1,1,70},{200006,1,1,70},{200010,1,1,12},{200011,1,1,12},{200012,1,1,12}, | AB11: 200012 | AC11: 战神盔甲 | AD11: 1 | AE11: 1 | AF11: 1 | AG11: 12 | AH11: ="{"&RC[-6]&","&RC[-3]&","&RC[-2]&","&RC[-1]&"}," -> {200012,1,1,12}, | AI11: =R[-1]C&RC[-1] -> {200000,1,1,70},{200001,1,1,70},{200002,1,1,70},{200003,1,1,70},{200006,1,1,70},{200010,1,1,12},{200011,1,1,12},{200012,1,1,12}, | AK11: 200012 | AL11: 战神盔甲 | AM11: 1 | AN11: 1 | AO11: 1 | AP11: 12 | AQ11: ="{"&RC[-6]&","&RC[-3]&","&RC[-2]&","&RC[-1]&"}," -> {200012,1,1,12}, | AR11: =R[-1]C&RC[-1] -> {200000,1,1,70},{200001,1,1,70},{200002,1,1,70},{200003,1,1,70},{200006,1,1,70},{200010,1,1,12},{200011,1,1,12},{200012,1,1,12},
A12: 201003 | B12: 魔法手镯 | C12: 1 | D12: 1 | E12: 1 | F12: 100 | G12: ="{"&RC[-6]&","&RC[-3]&","&RC[-2]&","&RC[-1]&"}," -> {201003,1,1,100}, | H12: =R[-1]C&RC[-1] -> {200000,1,1,100},{200001,1,1,100},{200002,1,1,100},{200003,1,1,100},{200006,1,1,100},{201000,1,1,100},{201001,1,1,100},{201002,1,1,100},{201003,1,1,100}, | J12: 201000 | K12: 海魂 | L12: 1 | M12: 1 | N12: 1 | O12: 60 | P12: ="{"&RC[-6]&","&RC[-3]&","&RC[-2]&","&RC[-1]&"}," -> {201000,1,1,60}, | Q12: =R[-1]C&RC[-1] -> {200000,1,1,60},{200001,1,1,60},{200002,1,1,60},{200003,1,1,60},{200006,1,1,60},{200010,1,1,5},{200011,1,1,5},{200012,1,1,5},{201000,1,1,60}, | S12: 200013 | T12: 力量戒指 | U12: 1 | V12: 1 | W12: 1 | X12: 12 | Y12: ="{"&RC[-6]&","&RC[-3]&","&RC[-2]&","&RC[-1]&"}," -> {200013,1,1,12}, | Z12: =R[-1]C&RC[-1] -> {200000,1,1,70},{200001,1,1,70},{200002,1,1,70},{200003,1,1,70},{200006,1,1,70},{200010,1,1,12},{200011,1,1,12},{200012,1,1,12},{200013,1,1,12}, | AB12: 200013 | AC12: 力量戒指 | AD12: 1 | AE12: 1 | AF12: 1 | AG12: 12 | AH12: ="{"&RC[-6]&","&RC[-3]&","&RC[-2]&","&RC[-1]&"}," -> {200013,1,1,12}, | AI12: =R[-1]C&RC[-1] -> {200000,1,1,70},{200001,1,1,70},{200002,1,1,70},{200003,1,1,70},{200006,1,1,70},{200010,1,1,12},{200011,1,1,12},{200012,1,1,12},{200013,1,1,12}, | AK12: 200013 | AL12: 力量戒指 | AM12: 1 | AN12: 1 | AO12: 1 | AP12: 12 | AQ12: ="{"&RC[-6]&","&RC[-3]&","&RC[-2]&","&RC[-1]&"}," -> {200013,1,1,12}, | AR12: =R[-1]C&RC[-1] -> {200000,1,1,70},{200001,1,1,70},{200002,1,1,70},{200003,1,1,70},{200006,1,1,70},{200010,1,1,12},{200011,1,1,12},{200012,1,1,12},{200013,1,1,12},
A13: 201006 | B13: 放大镜 | C13: 1 | D13: 1 | E13: 1 | F13: 100 | G13: ="{"&RC[-6]&","&RC[-3]&","&RC[-2]&","&RC[-1]&"}," -> {201006,1,1,100}, | H13: =R[-1]C&RC[-1] -> {200000,1,1,100},{200001,1,1,100},{200002,1,1,100},{200003,1,1,100},{200006,1,1,100},{201000,1,1,100},{201001,1,1,100},{201002,1,1,100},{201003,1,1,100},{201006,1,1,100}, | J13: 201001 | K13: 轻盔 | L13: 1 | M13: 1 | N13: 1 | O13: 60 | P13: ="{"&RC[-6]&","&RC[-3]&","&RC[-2]&","&RC[-1]&"}," -> {201001,1,1,60}, | Q13: =R[-1]C&RC[-1] -> {200000,1,1,60},{200001,1,1,60},{200002,1,1,60},{200003,1,1,60},{200006,1,1,60},{200010,1,1,5},{200011,1,1,5},{200012,1,1,5},{201000,1,1,60},{201001,1,1,60}, | S13: 200015 | T13: 战士头盔 | U13: 1 | V13: 1 | W13: 1 | X13: 12 | Y13: ="{"&RC[-6]&","&RC[-3]&","&RC[-2]&","&RC[-1]&"}," -> {200015,1,1,12}, | Z13: =R[-1]C&RC[-1] -> {200000,1,1,70},{200001,1,1,70},{200002,1,1,70},{200003,1,1,70},{200006,1,1,70},{200010,1,1,12},{200011,1,1,12},{200012,1,1,12},{200013,1,1,12},{200015,1,1,12}, | AB13: 200015 | AC13: 战士头盔 | AD13: 1 | AE13: 1 | AF13: 1 | AG13: 12 | AH13: ="{"&RC[-6]&","&RC[-3]&","&RC[-2]&","&RC[-1]&"}," -> {200015,1,1,12}, | AI13: =R[-1]C&RC[-1] -> {200000,1,1,70},{200001,1,1,70},{200002,1,1,70},{200003,1,1,70},{200006,1,1,70},{200010,1,1,12},{200011,1,1,12},{200012,1,1,12},{200013,1,1,12},{200015,1,1,12}, | AK13: 200015 | AL13: 战士头盔 | AM13: 1 | AN13: 1 | AO13: 1 | AP13: 12 | AQ13: ="{"&RC[-6]&","&RC[-3]&","&RC[-2]&","&RC[-1]&"}," -> {200015,1,1,12}, | AR13: =R[-1]C&RC[-1] -> {200000,1,1,70},{200001,1,1,70},{200002,1,1,70},{200003,1,1,70},{200006,1,1,70},{200010,1,1,12},{200011,1,1,12},{200012,1,1,12},{200013,1,1,12},{200015,1,1,12},
A14: 202000 | B14: 半月 | C14: 1 | D14: 1 | E14: 1 | F14: 100 | G14: ="{"&RC[-6]&","&RC[-3]&","&RC[-2]&","&RC[-1]&"}," -> {202000,1,1,100}, | H14: =R[-1]C&RC[-1] -> {200000,1,1,100},{200001,1,1,100},{200002,1,1,100},{200003,1,1,100},{200006,1,1,100},{201000,1,1,100},{201001,1,1,100},{201002,1,1,100},{201003,1,1,100},{201006,1,1,100},{202000,1,1,100}, | J14: 201002 | K14: 金戒指 | L14: 1 | M14: 1 | N14: 1 | O14: 60 | P14: ="{"&RC[-6]&","&RC[-3]&","&RC[-2]&","&RC[-1]&"}," -> {201002,1,1,60}, | Q14: =R[-1]C&RC[-1] -> {200000,1,1,60},{200001,1,1,60},{200002,1,1,60},{200003,1,1,60},{200006,1,1,60},{200010,1,1,5},{200011,1,1,5},{200012,1,1,5},{201000,1,1,60},{201001,1,1,60},{201002,1,1,60}, | S14: 200016 | T14: 阎罗手镯 | U14: 1 | V14: 1 | W14: 1 | X14: 12 | Y14: ="{"&RC[-6]&","&RC[-3]&","&RC[-2]&","&RC[-1]&"}," -> {200016,1,1,12}, | Z14: =R[-1]C&RC[-1] -> {200000,1,1,70},{200001,1,1,70},{200002,1,1,70},{200003,1,1,70},{200006,1,1,70},{200010,1,1,12},{200011,1,1,12},{200012,1,1,12},{200013,1,1,12},{200015,1,1,12},{200016,1,1,12}, | AB14: 200016 | AC14: 阎罗手镯 | AD14: 1 | AE14: 1 | AF14: 1 | AG14: 12 | AH14: ="{"&RC[-6]&","&RC[-3]&","&RC[-2]&","&RC[-1]&"}," -> {200016,1,1,12}, | AI14: =R[-1]C&RC[-1] -> {200000,1,1,70},{200001,1,1,70},{200002,1,1,70},{200003,1,1,70},{200006,1,1,70},{200010,1,1,12},{200011,1,1,12},{200012,1,1,12},{200013,1,1,12},{200015,1,1,12},{200016,1,1,12}, | AK14: 200016 | AL14: 阎罗手镯 | AM14: 1 | AN14: 1 | AO14: 1 | AP14: 12 | AQ14: ="{"&RC[-6]&","&RC[-3]&","&RC[-2]&","&RC[-1]&"}," -> {200016,1,1,12}, | AR14: =R[-1]C&RC[-1] -> {200000,1,1,70},{200001,1,1,70},{200002,1,1,70},{200003,1,1,70},{200006,1,1,70},{200010,1,1,12},{200011,1,1,12},{200012,1,1,12},{200013,1,1,12},{200015,1,1,12},{200016,1,1,12},
A15: 202001 | B15: 轻盔 | C15: 1 | D15: 1 | E15: 1 | F15: 100 | G15: ="{"&RC[-6]&","&RC[-3]&","&RC[-2]&","&RC[-1]&"}," -> {202001,1,1,100}, | H15: =R[-1]C&RC[-1] -> {200000,1,1,100},{200001,1,1,100},{200002,1,1,100},{200003,1,1,100},{200006,1,1,100},{201000,1,1,100},{201001,1,1,100},{201002,1,1,100},{201003,1,1,100},{201006,1,1,100},{202000,1,1,100},{202001,1,1,100}, | J15: 201003 | K15: 魔法手镯 | L15: 1 | M15: 1 | N15: 1 | O15: 60 | P15: ="{"&RC[-6]&","&RC[-3]&","&RC[-2]&","&RC[-1]&"}," -> {201003,1,1,60}, | Q15: =R[-1]C&RC[-1] -> {200000,1,1,60},{200001,1,1,60},{200002,1,1,60},{200003,1,1,60},{200006,1,1,60},{200010,1,1,5},{200011,1,1,5},{200012,1,1,5},{201000,1,1,60},{201001,1,1,60},{201002,1,1,60},{201003,1,1,60}, | S15: 200017 | T15: 战士腰带 | U15: 1 | V15: 1 | W15: 1 | X15: 12 | Y15: ="{"&RC[-6]&","&RC[-3]&","&RC[-2]&","&RC[-1]&"}," -> {200017,1,1,12}, | Z15: =R[-1]C&RC[-1] -> {200000,1,1,70},{200001,1,1,70},{200002,1,1,70},{200003,1,1,70},{200006,1,1,70},{200010,1,1,12},{200011,1,1,12},{200012,1,1,12},{200013,1,1,12},{200015,1,1,12},{200016,1,1,12},{200017,1,1,12}, | AB15: 200017 | AC15: 战士腰带 | AD15: 1 | AE15: 1 | AF15: 1 | AG15: 12 | AH15: ="{"&RC[-6]&","&RC[-3]&","&RC[-2]&","&RC[-1]&"}," -> {200017,1,1,12}, | AI15: =R[-1]C&RC[-1] -> {200000,1,1,70},{200001,1,1,70},{200002,1,1,70},{200003,1,1,70},{200006,1,1,70},{200010,1,1,12},{200011,1,1,12},{200012,1,1,12},{200013,1,1,12},{200015,1,1,12},{200016,1,1,12},{200017,1,1,12}, | AK15: 200017 | AL15: 战士腰带 | AM15: 1 | AN15: 1 | AO15: 1 | AP15: 12 | AQ15: ="{"&RC[-6]&","&RC[-3]&","&RC[-2]&","&RC[-1]&"}," -> {200017,1,1,12}, | AR15: =R[-1]C&RC[-1] -> {200000,1,1,70},{200001,1,1,70},{200002,1,1,70},{200003,1,1,70},{200006,1,1,70},{200010,1,1,12},{200011,1,1,12},{200012,1,1,12},{200013,1,1,12},{200015,1,1,12},{200016,1,1,12},{200017,1,1,12},
A16: 202002 | B16: 铂金戒指 | C16: 1 | D16: 1 | E16: 1 | F16: 100 | G16: ="{"&RC[-6]&","&RC[-3]&","&RC[-2]&","&RC[-1]&"}," -> {202002,1,1,100}, | H16: =R[-1]C&RC[-1] -> {200000,1,1,100},{200001,1,1,100},{200002,1,1,100},{200003,1,1,100},{200006,1,1,100},{201000,1,1,100},{201001,1,1,100},{201002,1,1,100},{201003,1,1,100},{201006,1,1,100},{202000,1,1,100},{202001,1,1,100},{202002,1,1,100}, | J16: 201006 | K16: 放大镜 | L16: 1 | M16: 1 | N16: 1 | O16: 60 | P16: ="{"&RC[-6]&","&RC[-3]&","&RC[-2]&","&RC[-1]&"}," -> {201006,1,1,60}, | Q16: =R[-1]C&RC[-1] -> {200000,1,1,60},{200001,1,1,60},{200002,1,1,60},{200003,1,1,60},{200006,1,1,60},{200010,1,1,5},{200011,1,1,5},{200012,1,1,5},{201000,1,1,60},{201001,1,1,60},{201002,1,1,60},{201003,1,1,60},{201006,1,1,60}, | S16: 200019 | T16: 战士鞋子 | U16: 1 | V16: 1 | W16: 1 | X16: 12 | Y16: ="{"&RC[-6]&","&RC[-3]&","&RC[-2]&","&RC[-1]&"}," -> {200019,1,1,12}, | Z16: =R[-1]C&RC[-1] -> {200000,1,1,70},{200001,1,1,70},{200002,1,1,70},{200003,1,1,70},{200006,1,1,70},{200010,1,1,12},{200011,1,1,12},{200012,1,1,12},{200013,1,1,12},{200015,1,1,12},{200016,1,1,12},{200017,1,1,12},{200019,1,1,12}, | AB16: 200019 | AC16: 战士鞋子 | AD16: 1 | AE16: 1 | AF16: 1 | AG16: 12 | AH16: ="{"&RC[-6]&","&RC[-3]&","&RC[-2]&","&RC[-1]&"}," -> {200019,1,1,12}, | AI16: =R[-1]C&RC[-1] -> {200000,1,1,70},{200001,1,1,70},{200002,1,1,70},{200003,1,1,70},{200006,1,1,70},{200010,1,1,12},{200011,1,1,12},{200012,1,1,12},{200013,1,1,12},{200015,1,1,12},{200016,1,1,12},{200017,1,1,12},{200019,1,1,12}, | AK16: 200019 | AL16: 战士鞋子 | AM16: 1 | AN16: 1 | AO16: 1 | AP16: 12 | AQ16: ="{"&RC[-6]&","&RC[-3]&","&RC[-2]&","&RC[-1]&"}," -> {200019,1,1,12}, | AR16: =R[-1]C&RC[-1] -> {200000,1,1,70},{200001,1,1,70},{200002,1,1,70},{200003,1,1,70},{200006,1,1,70},{200010,1,1,12},{200011,1,1,12},{200012,1,1,12},{200013,1,1,12},{200015,1,1,12},{200016,1,1,12},{200017,1,1,12},{200019,1,1,12},
A17: 202003 | B17: 三眼手镯 | C17: 1 | D17: 1 | E17: 1 | F17: 100 | G17: ="{"&RC[-6]&","&RC[-3]&","&RC[-2]&","&RC[-1]&"}," -> {202003,1,1,100}, | H17: =R[-1]C&RC[-1] -> {200000,1,1,100},{200001,1,1,100},{200002,1,1,100},{200003,1,1,100},{200006,1,1,100},{201000,1,1,100},{201001,1,1,100},{201002,1,1,100},{201003,1,1,100},{201006,1,1,100},{202000,1,1,100},{202001,1,1,100},{202002,1,1,100},{202003,1,1,100}, | J17: 201010 | K17: 魔杖 | L17: 1 | M17: 1 | N17: 1 | O17: 5 | P17: ="{"&RC[-6]&","&RC[-3]&","&RC[-2]&","&RC[-1]&"}," -> {201010,1,1,5}, | Q17: =R[-1]C&RC[-1] -> {200000,1,1,60},{200001,1,1,60},{200002,1,1,60},{200003,1,1,60},{200006,1,1,60},{200010,1,1,5},{200011,1,1,5},{200012,1,1,5},{201000,1,1,60},{201001,1,1,60},{201002,1,1,60},{201003,1,1,60},{201006,1,1,60},{201010,1,1,5}, | S17: 201000 | T17: 海魂 | U17: 1 | V17: 1 | W17: 1 | X17: 70 | Y17: ="{"&RC[-6]&","&RC[-3]&","&RC[-2]&","&RC[-1]&"}," -> {201000,1,1,70}, | Z17: =R[-1]C&RC[-1] -> {200000,1,1,70},{200001,1,1,70},{200002,1,1,70},{200003,1,1,70},{200006,1,1,70},{200010,1,1,12},{200011,1,1,12},{200012,1,1,12},{200013,1,1,12},{200015,1,1,12},{200016,1,1,12},{200017,1,1,12},{200019,1,1,12},{201000,1,1,70}, | AB17: 201000 | AC17: 海魂 | AD17: 1 | AE17: 1 | AF17: 1 | AG17: 70 | AH17: ="{"&RC[-6]&","&RC[-3]&","&RC[-2]&","&RC[-1]&"}," -> {201000,1,1,70}, | AI17: =R[-1]C&RC[-1] -> {200000,1,1,70},{200001,1,1,70},{200002,1,1,70},{200003,1,1,70},{200006,1,1,70},{200010,1,1,12},{200011,1,1,12},{200012,1,1,12},{200013,1,1,12},{200015,1,1,12},{200016,1,1,12},{200017,1,1,12},{200019,1,1,12},{201000,1,1,70}, | AK17: 201000 | AL17: 海魂 | AM17: 1 | AN17: 1 | AO17: 1 | AP17: 70 | AQ17: ="{"&RC[-6]&","&RC[-3]&","&RC[-2]&","&RC[-1]&"}," -> {201000,1,1,70}, | AR17: =R[-1]C&RC[-1] -> {200000,1,1,70},{200001,1,1,70},{200002,1,1,70},{200003,1,1,70},{200006,1,1,70},{200010,1,1,12},{200011,1,1,12},{200012,1,1,12},{200013,1,1,12},{200015,1,1,12},{200016,1,1,12},{200017,1,1,12},{200019,1,1,12},{201000,1,1,70},
A18: 202006 | B18: 凤凰明珠 | C18: 1 | D18: 1 | E18: 1 | F18: 100 | G18: ="{"&RC[-6]&","&RC[-3]&","&RC[-2]&","&RC[-1]&"}" -> {202006,1,1,100} | H18: =R[-1]C&RC[-1] -> {200000,1,1,100},{200001,1,1,100},{200002,1,1,100},{200003,1,1,100},{200006,1,1,100},{201000,1,1,100},{201001,1,1,100},{201002,1,1,100},{201003,1,1,100},{201006,1,1,100},{202000,1,1,100},{202001,1,1,100},{202002,1,1,100},{202003,1,1,100},{202006,1,1,100} | J18: 201011 | K18: 恶魔铃铛 | L18: 1 | M18: 1 | N18: 1 | O18: 5 | P18: ="{"&RC[-6]&","&RC[-3]&","&RC[-2]&","&RC[-1]&"}," -> {201011,1,1,5}, | Q18: =R[-1]C&RC[-1] -> {200000,1,1,60},{200001,1,1,60},{200002,1,1,60},{200003,1,1,60},{200006,1,1,60},{200010,1,1,5},{200011,1,1,5},{200012,1,1,5},{201000,1,1,60},{201001,1,1,60},{201002,1,1,60},{201003,1,1,60},{201006,1,1,60},{201010,1,1,5},{201011,1,1,5}, | S18: 201001 | T18: 轻盔 | U18: 1 | V18: 1 | W18: 1 | X18: 70 | Y18: ="{"&RC[-6]&","&RC[-3]&","&RC[-2]&","&RC[-1]&"}," -> {201001,1,1,70}, | Z18: =R[-1]C&RC[-1] -> {200000,1,1,70},{200001,1,1,70},{200002,1,1,70},{200003,1,1,70},{200006,1,1,70},{200010,1,1,12},{200011,1,1,12},{200012,1,1,12},{200013,1,1,12},{200015,1,1,12},{200016,1,1,12},{200017,1,1,12},{200019,1,1,12},{201000,1,1,70},{201001,1,1,70}, | AB18: 201001 | AC18: 轻盔 | AD18: 1 | AE18: 1 | AF18: 1 | AG18: 70 | AH18: ="{"&RC[-6]&","&RC[-3]&","&RC[-2]&","&RC[-1]&"}," -> {201001,1,1,70}, | AI18: =R[-1]C&RC[-1] -> {200000,1,1,70},{200001,1,1,70},{200002,1,1,70},{200003,1,1,70},{200006,1,1,70},{200010,1,1,12},{200011,1,1,12},{200012,1,1,12},{200013,1,1,12},{200015,1,1,12},{200016,1,1,12},{200017,1,1,12},{200019,1,1,12},{201000,1,1,70},{201001,1,1,70}, | AK18: 201001 | AL18: 轻盔 | AM18: 1 | AN18: 1 | AO18: 1 | AP18: 70 | AQ18: ="{"&RC[-6]&","&RC[-3]&","&RC[-2]&","&RC[-1]&"}," -> {201001,1,1,70}, | AR18: =R[-1]C&RC[-1] -> {200000,1,1,70},{200001,1,1,70},{200002,1,1,70},{200003,1,1,70},{200006,1,1,70},{200010,1,1,12},{200011,1,1,12},{200012,1,1,12},{200013,1,1,12},{200015,1,1,12},{200016,1,1,12},{200017,1,1,12},{200019,1,1,12},{201000,1,1,70},{201001,1,1,70},
J19: 201012 | K19: 恶魔长袍 | L19: 1 | M19: 1 | N19: 1 | O19: 5 | P19: ="{"&RC[-6]&","&RC[-3]&","&RC[-2]&","&RC[-1]&"}," -> {201012,1,1,5}, | Q19: =R[-1]C&RC[-1] -> {200000,1,1,60},{200001,1,1,60},{200002,1,1,60},{200003,1,1,60},{200006,1,1,60},{200010,1,1,5},{200011,1,1,5},{200012,1,1,5},{201000,1,1,60},{201001,1,1,60},{201002,1,1,60},{201003,1,1,60},{201006,1,1,60},{201010,1,1,5},{201011,1,1,5},{201012,1,1,5}, | S19: 201002 | T19: 金戒指 | U19: 1 | V19: 1 | W19: 1 | X19: 70 | Y19: ="{"&RC[-6]&","&RC[-3]&","&RC[-2]&","&RC[-1]&"}," -> {201002,1,1,70}, | Z19: =R[-1]C&RC[-1] -> {200000,1,1,70},{200001,1,1,70},{200002,1,1,70},{200003,1,1,70},{200006,1,1,70},{200010,1,1,12},{200011,1,1,12},{200012,1,1,12},{200013,1,1,12},{200015,1,1,12},{200016,1,1,12},{200017,1,1,12},{200019,1,1,12},{201000,1,1,70},{201001,1,1,70},{201002,1,1,70}, | AB19: 201002 | AC19: 金戒指 | AD19: 1 | AE19: 1 | AF19: 1 | AG19: 70 | AH19: ="{"&RC[-6]&","&RC[-3]&","&RC[-2]&","&RC[-1]&"}," -> {201002,1,1,70}, | AI19: =R[-1]C&RC[-1] -> {200000,1,1,70},{200001,1,1,70},{200002,1,1,70},{200003,1,1,70},{200006,1,1,70},{200010,1,1,12},{200011,1,1,12},{200012,1,1,12},{200013,1,1,12},{200015,1,1,12},{200016,1,1,12},{200017,1,1,12},{200019,1,1,12},{201000,1,1,70},{201001,1,1,70},{201002,1,1,70}, | AK19: 201002 | AL19: 金戒指 | AM19: 1 | AN19: 1 | AO19: 1 | AP19: 70 | AQ19: ="{"&RC[-6]&","&RC[-3]&","&RC[-2]&","&RC[-1]&"}," -> {201002,1,1,70}, | AR19: =R[-1]C&RC[-1] -> {200000,1,1,70},{200001,1,1,70},{200002,1,1,70},{200003,1,1,70},{200006,1,1,70},{200010,1,1,12},{200011,1,1,12},{200012,1,1,12},{200013,1,1,12},{200015,1,1,12},{200016,1,1,12},{200017,1,1,12},{200019,1,1,12},{201000,1,1,70},{201001,1,1,70},{201002,1,1,70},
J20: 202000 | K20: 半月 | L20: 1 | M20: 1 | N20: 1 | O20: 60 | P20: ="{"&RC[-6]&","&RC[-3]&","&RC[-2]&","&RC[-1]&"}," -> {202000,1,1,60}, | Q20: =R[-1]C&RC[-1] -> {200000,1,1,60},{200001,1,1,60},{200002,1,1,60},{200003,1,1,60},{200006,1,1,60},{200010,1,1,5},{200011,1,1,5},{200012,1,1,5},{201000,1,1,60},{201001,1,1,60},{201002,1,1,60},{201003,1,1,60},{201006,1,1,60},{201010,1,1,5},{201011,1,1,5},{201012,1,1,5},{202000,1,1,60}, | S20: 201003 | T20: 魔法手镯 | U20: 1 | V20: 1 | W20: 1 | X20: 70 | Y20: ="{"&RC[-6]&","&RC[-3]&","&RC[-2]&","&RC[-1]&"}," -> {201003,1,1,70}, | Z20: =R[-1]C&RC[-1] -> {200000,1,1,70},{200001,1,1,70},{200002,1,1,70},{200003,1,1,70},{200006,1,1,70},{200010,1,1,12},{200011,1,1,12},{200012,1,1,12},{200013,1,1,12},{200015,1,1,12},{200016,1,1,12},{200017,1,1,12},{200019,1,1,12},{201000,1,1,70},{201001,1,1,70},{201002,1,1,70},{201003,1,1,70}, | AB20: 201003 | AC20: 魔法手镯 | AD20: 1 | AE20: 1 | AF20: 1 | AG20: 70 | AH20: ="{"&RC[-6]&","&RC[-3]&","&RC[-2]&","&RC[-1]&"}," -> {201003,1,1,70}, | AI20: =R[-1]C&RC[-1] -> {200000,1,1,70},{200001,1,1,70},{200002,1,1,70},{200003,1,1,70},{200006,1,1,70},{200010,1,1,12},{200011,1,1,12},{200012,1,1,12},{200013,1,1,12},{200015,1,1,12},{200016,1,1,12},{200017,1,1,12},{200019,1,1,12},{201000,1,1,70},{201001,1,1,70},{201002,1,1,70},{201003,1,1,70}, | AK20: 201003 | AL20: 魔法手镯 | AM20: 1 | AN20: 1 | AO20: 1 | AP20: 70 | AQ20: ="{"&RC[-6]&","&RC[-3]&","&RC[-2]&","&RC[-1]&"}," -> {201003,1,1,70}, | AR20: =R[-1]C&RC[-1] -> {200000,1,1,70},{200001,1,1,70},{200002,1,1,70},{200003,1,1,70},{200006,1,1,70},{200010,1,1,12},{200011,1,1,12},{200012,1,1,12},{200013,1,1,12},{200015,1,1,12},{200016,1,1,12},{200017,1,1,12},{200019,1,1,12},{201000,1,1,70},{201001,1,1,70},{201002,1,1,70},{201003,1,1,70},
A21: 110079 | B21: 黑铁矿+1 | D21: 1 | E21: 2 | F21: 3 | G21: ="{"&RC[-6]&","&RC[-3]&","&RC[-2]&","&RC[-1]&"}," -> {110079,1,2,3}, | H21: =RC[-1] -> {110079,1,2,3}, | J21: 202001 | K21: 轻盔 | L21: 1 | M21: 1 | N21: 1 | O21: 60 | P21: ="{"&RC[-6]&","&RC[-3]&","&RC[-2]&","&RC[-1]&"}," -> {202001,1,1,60}, | Q21: =R[-1]C&RC[-1] -> {200000,1,1,60},{200001,1,1,60},{200002,1,1,60},{200003,1,1,60},{200006,1,1,60},{200010,1,1,5},{200011,1,1,5},{200012,1,1,5},{201000,1,1,60},{201001,1,1,60},{201002,1,1,60},{201003,1,1,60},{201006,1,1,60},{201010,1,1,5},{201011,1,1,5},{201012,1,1,5},{202000,1,1,60},{202001,1,1,60}, | S21: 201006 | T21: 放大镜 | U21: 1 | V21: 1 | W21: 1 | X21: 70 | Y21: ="{"&RC[-6]&","&RC[-3]&","&RC[-2]&","&RC[-1]&"}," -> {201006,1,1,70}, | Z21: =R[-1]C&RC[-1] -> {200000,1,1,70},{200001,1,1,70},{200002,1,1,70},{200003,1,1,70},{200006,1,1,70},{200010,1,1,12},{200011,1,1,12},{200012,1,1,12},{200013,1,1,12},{200015,1,1,12},{200016,1,1,12},{200017,1,1,12},{200019,1,1,12},{201000,1,1,70},{201001,1,1,70},{201002,1,1,70},{201003,1,1,70},{201006,1,1,70}, | AB21: 201006 | AC21: 放大镜 | AD21: 1 | AE21: 1 | AF21: 1 | AG21: 70 | AH21: ="{"&RC[-6]&","&RC[-3]&","&RC[-2]&","&RC[-1]&"}," -> {201006,1,1,70}, | AI21: =R[-1]C&RC[-1] -> {200000,1,1,70},{200001,1,1,70},{200002,1,1,70},{200003,1,1,70},{200006,1,1,70},{200010,1,1,12},{200011,1,1,12},{200012,1,1,12},{200013,1,1,12},{200015,1,1,12},{200016,1,1,12},{200017,1,1,12},{200019,1,1,12},{201000,1,1,70},{201001,1,1,70},{201002,1,1,70},{201003,1,1,70},{201006,1,1,70}, | AK21: 201006 | AL21: 放大镜 | AM21: 1 | AN21: 1 | AO21: 1 | AP21: 70 | AQ21: ="{"&RC[-6]&","&RC[-3]&","&RC[-2]&","&RC[-1]&"}," -> {201006,1,1,70}, | AR21: =R[-1]C&RC[-1] -> {200000,1,1,70},{200001,1,1,70},{200002,1,1,70},{200003,1,1,70},{200006,1,1,70},{200010,1,1,12},{200011,1,1,12},{200012,1,1,12},{200013,1,1,12},{200015,1,1,12},{200016,1,1,12},{200017,1,1,12},{200019,1,1,12},{201000,1,1,70},{201001,1,1,70},{201002,1,1,70},{201003,1,1,70},{201006,1,1,70},
A22: 110003 | B22: 洗炼石 | D22: 1 | E22: 2 | F22: 1 | G22: ="{"&RC[-6]&","&RC[-3]&","&RC[-2]&","&RC[-1]&"}," -> {110003,1,2,1}, | H22: =R[-1]C&RC[-1] -> {110079,1,2,3},{110003,1,2,1}, | J22: 202002 | K22: 铂金戒指 | L22: 1 | M22: 1 | N22: 1 | O22: 60 | P22: ="{"&RC[-6]&","&RC[-3]&","&RC[-2]&","&RC[-1]&"}," -> {202002,1,1,60}, | Q22: =R[-1]C&RC[-1] -> {200000,1,1,60},{200001,1,1,60},{200002,1,1,60},{200003,1,1,60},{200006,1,1,60},{200010,1,1,5},{200011,1,1,5},{200012,1,1,5},{201000,1,1,60},{201001,1,1,60},{201002,1,1,60},{201003,1,1,60},{201006,1,1,60},{201010,1,1,5},{201011,1,1,5},{201012,1,1,5},{202000,1,1,60},{202001,1,1,60},{202002,1,1,60}, | S22: 201010 | T22: 魔杖 | U22: 1 | V22: 1 | W22: 1 | X22: 12 | Y22: ="{"&RC[-6]&","&RC[-3]&","&RC[-2]&","&RC[-1]&"}," -> {201010,1,1,12}, | Z22: =R[-1]C&RC[-1] -> {200000,1,1,70},{200001,1,1,70},{200002,1,1,70},{200003,1,1,70},{200006,1,1,70},{200010,1,1,12},{200011,1,1,12},{200012,1,1,12},{200013,1,1,12},{200015,1,1,12},{200016,1,1,12},{200017,1,1,12},{200019,1,1,12},{201000,1,1,70},{201001,1,1,70},{201002,1,1,70},{201003,1,1,70},{201006,1,1,70},{201010,1,1,12}, | AB22: 201010 | AC22: 魔杖 | AD22: 1 | AE22: 1 | AF22: 1 | AG22: 12 | AH22: ="{"&RC[-6]&","&RC[-3]&","&RC[-2]&","&RC[-1]&"}," -> {201010,1,1,12}, | AI22: =R[-1]C&RC[-1] -> {200000,1,1,70},{200001,1,1,70},{200002,1,1,70},{200003,1,1,70},{200006,1,1,70},{200010,1,1,12},{200011,1,1,12},{200012,1,1,12},{200013,1,1,12},{200015,1,1,12},{200016,1,1,12},{200017,1,1,12},{200019,1,1,12},{201000,1,1,70},{201001,1,1,70},{201002,1,1,70},{201003,1,1,70},{201006,1,1,70},{201010,1,1,12}, | AK22: 201010 | AL22: 魔杖 | AM22: 1 | AN22: 1 | AO22: 1 | AP22: 12 | AQ22: ="{"&RC[-6]&","&RC[-3]&","&RC[-2]&","&RC[-1]&"}," -> {201010,1,1,12}, | AR22: =R[-1]C&RC[-1] -> {200000,1,1,70},{200001,1,1,70},{200002,1,1,70},{200003,1,1,70},{200006,1,1,70},{200010,1,1,12},{200011,1,1,12},{200012,1,1,12},{200013,1,1,12},{200015,1,1,12},{200016,1,1,12},{200017,1,1,12},{200019,1,1,12},{201000,1,1,70},{201001,1,1,70},{201002,1,1,70},{201003,1,1,70},{201006,1,1,70},{201010,1,1,12},
A23: 110004 | B23: 红药 | D23: 1 | E23: 1 | F23: 3 | G23: ="{"&RC[-6]&","&RC[-3]&","&RC[-2]&","&RC[-1]&"}," -> {110004,1,1,3}, | H23: =R[-1]C&RC[-1] -> {110079,1,2,3},{110003,1,2,1},{110004,1,1,3}, | J23: 202003 | K23: 三眼手镯 | L23: 1 | M23: 1 | N23: 1 | O23: 60 | P23: ="{"&RC[-6]&","&RC[-3]&","&RC[-2]&","&RC[-1]&"}," -> {202003,1,1,60}, | Q23: =R[-1]C&RC[-1] -> {200000,1,1,60},{200001,1,1,60},{200002,1,1,60},{200003,1,1,60},{200006,1,1,60},{200010,1,1,5},{200011,1,1,5},{200012,1,1,5},{201000,1,1,60},{201001,1,1,60},{201002,1,1,60},{201003,1,1,60},{201006,1,1,60},{201010,1,1,5},{201011,1,1,5},{201012,1,1,5},{202000,1,1,60},{202001,1,1,60},{202002,1,1,60},{202003,1,1,60}, | S23: 201011 | T23: 恶魔铃铛 | U23: 1 | V23: 1 | W23: 1 | X23: 12 | Y23: ="{"&RC[-6]&","&RC[-3]&","&RC[-2]&","&RC[-1]&"}," -> {201011,1,1,12}, | Z23: =R[-1]C&RC[-1] -> {200000,1,1,70},{200001,1,1,70},{200002,1,1,70},{200003,1,1,70},{200006,1,1,70},{200010,1,1,12},{200011,1,1,12},{200012,1,1,12},{200013,1,1,12},{200015,1,1,12},{200016,1,1,12},{200017,1,1,12},{200019,1,1,12},{201000,1,1,70},{201001,1,1,70},{201002,1,1,70},{201003,1,1,70},{201006,1,1,70},{201010,1,1,12},{201011,1,1,12}, | AB23: 201011 | AC23: 恶魔铃铛 | AD23: 1 | AE23: 1 | AF23: 1 | AG23: 12 | AH23: ="{"&RC[-6]&","&RC[-3]&","&RC[-2]&","&RC[-1]&"}," -> {201011,1,1,12}, | AI23: =R[-1]C&RC[-1] -> {200000,1,1,70},{200001,1,1,70},{200002,1,1,70},{200003,1,1,70},{200006,1,1,70},{200010,1,1,12},{200011,1,1,12},{200012,1,1,12},{200013,1,1,12},{200015,1,1,12},{200016,1,1,12},{200017,1,1,12},{200019,1,1,12},{201000,1,1,70},{201001,1,1,70},{201002,1,1,70},{201003,1,1,70},{201006,1,1,70},{201010,1,1,12},{201011,1,1,12}, | AK23: 201011 | AL23: 恶魔铃铛 | AM23: 1 | AN23: 1 | AO23: 1 | AP23: 12 | AQ23: ="{"&RC[-6]&","&RC[-3]&","&RC[-2]&","&RC[-1]&"}," -> {201011,1,1,12}, | AR23: =R[-1]C&RC[-1] -> {200000,1,1,70},{200001,1,1,70},{200002,1,1,70},{200003,1,1,70},{200006,1,1,70},{200010,1,1,12},{200011,1,1,12},{200012,1,1,12},{200013,1,1,12},{200015,1,1,12},{200016,1,1,12},{200017,1,1,12},{200019,1,1,12},{201000,1,1,70},{201001,1,1,70},{201002,1,1,70},{201003,1,1,70},{201006,1,1,70},{201010,1,1,12},{201011,1,1,12},
A24: 110005 | B24: 蓝药 | D24: 1 | E24: 1 | F24: 3 | G24: ="{"&RC[-6]&","&RC[-3]&","&RC[-2]&","&RC[-1]&"}," -> {110005,1,1,3}, | H24: =R[-1]C&RC[-1] -> {110079,1,2,3},{110003,1,2,1},{110004,1,1,3},{110005,1,1,3}, | J24: 202006 | K24: 凤凰明珠 | L24: 1 | M24: 1 | N24: 1 | O24: 60 | P24: ="{"&RC[-6]&","&RC[-3]&","&RC[-2]&","&RC[-1]&"}," -> {202006,1,1,60}, | Q24: =R[-1]C&RC[-1] -> {200000,1,1,60},{200001,1,1,60},{200002,1,1,60},{200003,1,1,60},{200006,1,1,60},{200010,1,1,5},{200011,1,1,5},{200012,1,1,5},{201000,1,1,60},{201001,1,1,60},{201002,1,1,60},{201003,1,1,60},{201006,1,1,60},{201010,1,1,5},{201011,1,1,5},{201012,1,1,5},{202000,1,1,60},{202001,1,1,60},{202002,1,1,60},{202003,1,1,60},{202006,1,1,60}, | S24: 201012 | T24: 恶魔长袍 | U24: 1 | V24: 1 | W24: 1 | X24: 12 | Y24: ="{"&RC[-6]&","&RC[-3]&","&RC[-2]&","&RC[-1]&"}," -> {201012,1,1,12}, | Z24: =R[-1]C&RC[-1] -> {200000,1,1,70},{200001,1,1,70},{200002,1,1,70},{200003,1,1,70},{200006,1,1,70},{200010,1,1,12},{200011,1,1,12},{200012,1,1,12},{200013,1,1,12},{200015,1,1,12},{200016,1,1,12},{200017,1,1,12},{200019,1,1,12},{201000,1,1,70},{201001,1,1,70},{201002,1,1,70},{201003,1,1,70},{201006,1,1,70},{201010,1,1,12},{201011,1,1,12},{201012,1,1,12}, | AB24: 201012 | AC24: 恶魔长袍 | AD24: 1 | AE24: 1 | AF24: 1 | AG24: 12 | AH24: ="{"&RC[-6]&","&RC[-3]&","&RC[-2]&","&RC[-1]&"}," -> {201012,1,1,12}, | AI24: =R[-1]C&RC[-1] -> {200000,1,1,70},{200001,1,1,70},{200002,1,1,70},{200003,1,1,70},{200006,1,1,70},{200010,1,1,12},{200011,1,1,12},{200012,1,1,12},{200013,1,1,12},{200015,1,1,12},{200016,1,1,12},{200017,1,1,12},{200019,1,1,12},{201000,1,1,70},{201001,1,1,70},{201002,1,1,70},{201003,1,1,70},{201006,1,1,70},{201010,1,1,12},{201011,1,1,12},{201012,1,1,12}, | AK24: 201012 | AL24: 恶魔长袍 | AM24: 1 | AN24: 1 | AO24: 1 | AP24: 12 | AQ24: ="{"&RC[-6]&","&RC[-3]&","&RC[-2]&","&RC[-1]&"}," -> {201012,1,1,12}, | AR24: =R[-1]C&RC[-1] -> {200000,1,1,70},{200001,1,1,70},{200002,1,1,70},{200003,1,1,70},{200006,1,1,70},{200010,1,1,12},{200011,1,1,12},{200012,1,1,12},{200013,1,1,12},{200015,1,1,12},{200016,1,1,12},{200017,1,1,12},{200019,1,1,12},{201000,1,1,70},{201001,1,1,70},{201002,1,1,70},{201003,1,1,70},{201006,1,1,70},{201010,1,1,12},{201011,1,1,12},{201012,1,1,12},
A25: 110010 | B25: 普通武装碎片 | D25: 1 | E25: 1 | F25: 0 | G25: ="{"&RC[-6]&","&RC[-3]&","&RC[-2]&","&RC[-1]&"}," -> {110010,1,1,0}, | H25: =R[-1]C&RC[-1] -> {110079,1,2,3},{110003,1,2,1},{110004,1,1,3},{110005,1,1,3},{110010,1,1,0}, | J25: 202010 | K25: 银蛇 | L25: 1 | M25: 1 | N25: 1 | O25: 5 | P25: ="{"&RC[-6]&","&RC[-3]&","&RC[-2]&","&RC[-1]&"}," -> {202010,1,1,5}, | Q25: =R[-1]C&RC[-1] -> {200000,1,1,60},{200001,1,1,60},{200002,1,1,60},{200003,1,1,60},{200006,1,1,60},{200010,1,1,5},{200011,1,1,5},{200012,1,1,5},{201000,1,1,60},{201001,1,1,60},{201002,1,1,60},{201003,1,1,60},{201006,1,1,60},{201010,1,1,5},{201011,1,1,5},{201012,1,1,5},{202000,1,1,60},{202001,1,1,60},{202002,1,1,60},{202003,1,1,60},{202006,1,1,60},{202010,1,1,5}, | S25: 201013 | T25: 紫碧螺 | U25: 1 | V25: 1 | W25: 1 | X25: 12 | Y25: ="{"&RC[-6]&","&RC[-3]&","&RC[-2]&","&RC[-1]&"}," -> {201013,1,1,12}, | Z25: =R[-1]C&RC[-1] -> {200000,1,1,70},{200001,1,1,70},{200002,1,1,70},{200003,1,1,70},{200006,1,1,70},{200010,1,1,12},{200011,1,1,12},{200012,1,1,12},{200013,1,1,12},{200015,1,1,12},{200016,1,1,12},{200017,1,1,12},{200019,1,1,12},{201000,1,1,70},{201001,1,1,70},{201002,1,1,70},{201003,1,1,70},{201006,1,1,70},{201010,1,1,12},{201011,1,1,12},{201012,1,1,12},{201013,1,1,12}, | AB25: 201013 | AC25: 紫碧螺 | AD25: 1 | AE25: 1 | AF25: 1 | AG25: 12 | AH25: ="{"&RC[-6]&","&RC[-3]&","&RC[-2]&","&RC[-1]&"}," -> {201013,1,1,12}, | AI25: =R[-1]C&RC[-1] -> {200000,1,1,70},{200001,1,1,70},{200002,1,1,70},{200003,1,1,70},{200006,1,1,70},{200010,1,1,12},{200011,1,1,12},{200012,1,1,12},{200013,1,1,12},{200015,1,1,12},{200016,1,1,12},{200017,1,1,12},{200019,1,1,12},{201000,1,1,70},{201001,1,1,70},{201002,1,1,70},{201003,1,1,70},{201006,1,1,70},{201010,1,1,12},{201011,1,1,12},{201012,1,1,12},{201013,1,1,12}, | AK25: 201013 | AL25: 紫碧螺 | AM25: 1 | AN25: 1 | AO25: 1 | AP25: 12 | AQ25: ="{"&RC[-6]&","&RC[-3]&","&RC[-2]&","&RC[-1]&"}," -> {201013,1,1,12}, | AR25: =R[-1]C&RC[-1] -> {200000,1,1,70},{200001,1,1,70},{200002,1,1,70},{200003,1,1,70},{200006,1,1,70},{200010,1,1,12},{200011,1,1,12},{200012,1,1,12},{200013,1,1,12},{200015,1,1,12},{200016,1,1,12},{200017,1,1,12},{200019,1,1,12},{201000,1,1,70},{201001,1,1,70},{201002,1,1,70},{201003,1,1,70},{201006,1,1,70},{201010,1,1,12},{201011,1,1,12},{201012,1,1,12},{201013,1,1,12},
A26: 110011 | B26: 普通防具碎片 | D26: 1 | E26: 1 | F26: 0 | G26: ="{"&RC[-6]&","&RC[-3]&","&RC[-2]&","&RC[-1]&"}," -> {110011,1,1,0}, | H26: =R[-1]C&RC[-1] -> {110079,1,2,3},{110003,1,2,1},{110004,1,1,3},{110005,1,1,3},{110010,1,1,0},{110011,1,1,0}, | J26: 202011 | K26: 天珠道链 | L26: 1 | M26: 1 | N26: 1 | O26: 5 | P26: ="{"&RC[-6]&","&RC[-3]&","&RC[-2]&","&RC[-1]&"}," -> {202011,1,1,5}, | Q26: =R[-1]C&RC[-1] -> {200000,1,1,60},{200001,1,1,60},{200002,1,1,60},{200003,1,1,60},{200006,1,1,60},{200010,1,1,5},{200011,1,1,5},{200012,1,1,5},{201000,1,1,60},{201001,1,1,60},{201002,1,1,60},{201003,1,1,60},{201006,1,1,60},{201010,1,1,5},{201011,1,1,5},{201012,1,1,5},{202000,1,1,60},{202001,1,1,60},{202002,1,1,60},{202003,1,1,60},{202006,1,1,60},{202010,1,1,5},{202011,1,1,5}, | S26: 201015 | T26: 法师头盔 | U26: 1 | V26: 1 | W26: 1 | X26: 12 | Y26: ="{"&RC[-6]&","&RC[-3]&","&RC[-2]&","&RC[-1]&"}," -> {201015,1,1,12}, | Z26: =R[-1]C&RC[-1] -> {200000,1,1,70},{200001,1,1,70},{200002,1,1,70},{200003,1,1,70},{200006,1,1,70},{200010,1,1,12},{200011,1,1,12},{200012,1,1,12},{200013,1,1,12},{200015,1,1,12},{200016,1,1,12},{200017,1,1,12},{200019,1,1,12},{201000,1,1,70},{201001,1,1,70},{201002,1,1,70},{201003,1,1,70},{201006,1,1,70},{201010,1,1,12},{201011,1,1,12},{201012,1,1,12},{201013,1,1,12},{201015,1,1,12}, | AB26: 201015 | AC26: 法师头盔 | AD26: 1 | AE26: 1 | AF26: 1 | AG26: 12 | AH26: ="{"&RC[-6]&","&RC[-3]&","&RC[-2]&","&RC[-1]&"}," -> {201015,1,1,12}, | AI26: =R[-1]C&RC[-1] -> {200000,1,1,70},{200001,1,1,70},{200002,1,1,70},{200003,1,1,70},{200006,1,1,70},{200010,1,1,12},{200011,1,1,12},{200012,1,1,12},{200013,1,1,12},{200015,1,1,12},{200016,1,1,12},{200017,1,1,12},{200019,1,1,12},{201000,1,1,70},{201001,1,1,70},{201002,1,1,70},{201003,1,1,70},{201006,1,1,70},{201010,1,1,12},{201011,1,1,12},{201012,1,1,12},{201013,1,1,12},{201015,1,1,12}, | AK26: 201015 | AL26: 法师头盔 | AM26: 1 | AN26: 1 | AO26: 1 | AP26: 12 | AQ26: ="{"&RC[-6]&","&RC[-3]&","&RC[-2]&","&RC[-1]&"}," -> {201015,1,1,12}, | AR26: =R[-1]C&RC[-1] -> {200000,1,1,70},{200001,1,1,70},{200002,1,1,70},{200003,1,1,70},{200006,1,1,70},{200010,1,1,12},{200011,1,1,12},{200012,1,1,12},{200013,1,1,12},{200015,1,1,12},{200016,1,1,12},{200017,1,1,12},{200019,1,1,12},{201000,1,1,70},{201001,1,1,70},{201002,1,1,70},{201003,1,1,70},{201006,1,1,70},{201010,1,1,12},{201011,1,1,12},{201012,1,1,12},{201013,1,1,12},{201015,1,1,12},
A27: 110012 | B27: 普通首饰碎片 | D27: 1 | E27: 1 | F27: 0 | G27: ="{"&RC[-6]&","&RC[-3]&","&RC[-2]&","&RC[-1]&"}" -> {110012,1,1,0} | H27: =R[-1]C&RC[-1] -> {110079,1,2,3},{110003,1,2,1},{110004,1,1,3},{110005,1,1,3},{110010,1,1,0},{110011,1,1,0},{110012,1,1,0} | J27: 202012 | K27: 灵魂道袍 | L27: 1 | M27: 1 | N27: 1 | O27: 5 | P27: ="{"&RC[-6]&","&RC[-3]&","&RC[-2]&","&RC[-1]&"}" -> {202012,1,1,5} | Q27: =R[-1]C&RC[-1] -> {200000,1,1,60},{200001,1,1,60},{200002,1,1,60},{200003,1,1,60},{200006,1,1,60},{200010,1,1,5},{200011,1,1,5},{200012,1,1,5},{201000,1,1,60},{201001,1,1,60},{201002,1,1,60},{201003,1,1,60},{201006,1,1,60},{201010,1,1,5},{201011,1,1,5},{201012,1,1,5},{202000,1,1,60},{202001,1,1,60},{202002,1,1,60},{202003,1,1,60},{202006,1,1,60},{202010,1,1,5},{202011,1,1,5},{202012,1,1,5} | S27: 201016 | T27: 龙之手镯 | U27: 1 | V27: 1 | W27: 1 | X27: 12 | Y27: ="{"&RC[-6]&","&RC[-3]&","&RC[-2]&","&RC[-1]&"}," -> {201016,1,1,12}, | Z27: =R[-1]C&RC[-1] -> {200000,1,1,70},{200001,1,1,70},{200002,1,1,70},{200003,1,1,70},{200006,1,1,70},{200010,1,1,12},{200011,1,1,12},{200012,1,1,12},{200013,1,1,12},{200015,1,1,12},{200016,1,1,12},{200017,1,1,12},{200019,1,1,12},{201000,1,1,70},{201001,1,1,70},{201002,1,1,70},{201003,1,1,70},{201006,1,1,70},{201010,1,1,12},{201011,1,1,12},{201012,1,1,12},{201013,1,1,12},{201015,1,1,12},{201016,1,1,12}, | AB27: 201016 | AC27: 龙之手镯 | AD27: 1 | AE27: 1 | AF27: 1 | AG27: 12 | AH27: ="{"&RC[-6]&","&RC[-3]&","&RC[-2]&","&RC[-1]&"}," -> {201016,1,1,12}, | AI27: =R[-1]C&RC[-1] -> {200000,1,1,70},{200001,1,1,70},{200002,1,1,70},{200003,1,1,70},{200006,1,1,70},{200010,1,1,12},{200011,1,1,12},{200012,1,1,12},{200013,1,1,12},{200015,1,1,12},{200016,1,1,12},{200017,1,1,12},{200019,1,1,12},{201000,1,1,70},{201001,1,1,70},{201002,1,1,70},{201003,1,1,70},{201006,1,1,70},{201010,1,1,12},{201011,1,1,12},{201012,1,1,12},{201013,1,1,12},{201015,1,1,12},{201016,1,1,12}, | AK27: 201016 | AL27: 龙之手镯 | AM27: 1 | AN27: 1 | AO27: 1 | AP27: 12 | AQ27: ="{"&RC[-6]&","&RC[-3]&","&RC[-2]&","&RC[-1]&"}," -> {201016,1,1,12}, | AR27: =R[-1]C&RC[-1] -> {200000,1,1,70},{200001,1,1,70},{200002,1,1,70},{200003,1,1,70},{200006,1,1,70},{200010,1,1,12},{200011,1,1,12},{200012,1,1,12},{200013,1,1,12},{200015,1,1,12},{200016,1,1,12},{200017,1,1,12},{200019,1,1,12},{201000,1,1,70},{201001,1,1,70},{201002,1,1,70},{201003,1,1,70},{201006,1,1,70},{201010,1,1,12},{201011,1,1,12},{201012,1,1,12},{201013,1,1,12},{201015,1,1,12},{201016,1,1,12},
S28: 201017 | T28: 法师腰带 | U28: 1 | V28: 1 | W28: 1 | X28: 12 | Y28: ="{"&RC[-6]&","&RC[-3]&","&RC[-2]&","&RC[-1]&"}," -> {201017,1,1,12}, | Z28: =R[-1]C&RC[-1] -> {200000,1,1,70},{200001,1,1,70},{200002,1,1,70},{200003,1,1,70},{200006,1,1,70},{200010,1,1,12},{200011,1,1,12},{200012,1,1,12},{200013,1,1,12},{200015,1,1,12},{200016,1,1,12},{200017,1,1,12},{200019,1,1,12},{201000,1,1,70},{201001,1,1,70},{201002,1,1,70},{201003,1,1,70},{201006,1,1,70},{201010,1,1,12},{201011,1,1,12},{201012,1,1,12},{201013,1,1,12},{201015,1,1,12},{201016,1,1,12},{201017,1,1,12}, | AB28: 201017 | AC28: 法师腰带 | AD28: 1 | AE28: 1 | AF28: 1 | AG28: 12 | AH28: ="{"&RC[-6]&","&RC[-3]&","&RC[-2]&","&RC[-1]&"}," -> {201017,1,1,12}, | AI28: =R[-1]C&RC[-1] -> {200000,1,1,70},{200001,1,1,70},{200002,1,1,70},{200003,1,1,70},{200006,1,1,70},{200010,1,1,12},{200011,1,1,12},{200012,1,1,12},{200013,1,1,12},{200015,1,1,12},{200016,1,1,12},{200017,1,1,12},{200019,1,1,12},{201000,1,1,70},{201001,1,1,70},{201002,1,1,70},{201003,1,1,70},{201006,1,1,70},{201010,1,1,12},{201011,1,1,12},{201012,1,1,12},{201013,1,1,12},{201015,1,1,12},{201016,1,1,12},{201017,1,1,12}, | AK28: 201017 | AL28: 法师腰带 | AM28: 1 | AN28: 1 | AO28: 1 | AP28: 12 | AQ28: ="{"&RC[-6]&","&RC[-3]&","&RC[-2]&","&RC[-1]&"}," -> {201017,1,1,12}, | AR28: =R[-1]C&RC[-1] -> {200000,1,1,70},{200001,1,1,70},{200002,1,1,70},{200003,1,1,70},{200006,1,1,70},{200010,1,1,12},{200011,1,1,12},{200012,1,1,12},{200013,1,1,12},{200015,1,1,12},{200016,1,1,12},{200017,1,1,12},{200019,1,1,12},{201000,1,1,70},{201001,1,1,70},{201002,1,1,70},{201003,1,1,70},{201006,1,1,70},{201010,1,1,12},{201011,1,1,12},{201012,1,1,12},{201013,1,1,12},{201015,1,1,12},{201016,1,1,12},{201017,1,1,12},
S29: 201019 | T29: 法师鞋子 | U29: 1 | V29: 1 | W29: 1 | X29: 12 | Y29: ="{"&RC[-6]&","&RC[-3]&","&RC[-2]&","&RC[-1]&"}," -> {201019,1,1,12}, | Z29: =R[-1]C&RC[-1] -> {200000,1,1,70},{200001,1,1,70},{200002,1,1,70},{200003,1,1,70},{200006,1,1,70},{200010,1,1,12},{200011,1,1,12},{200012,1,1,12},{200013,1,1,12},{200015,1,1,12},{200016,1,1,12},{200017,1,1,12},{200019,1,1,12},{201000,1,1,70},{201001,1,1,70},{201002,1,1,70},{201003,1,1,70},{201006,1,1,70},{201010,1,1,12},{201011,1,1,12},{201012,1,1,12},{201013,1,1,12},{201015,1,1,12},{201016,1,1,12},{201017,1,1,12},{201019,1,1,12}, | AB29: 201019 | AC29: 法师鞋子 | AD29: 1 | AE29: 1 | AF29: 1 | AG29: 12 | AH29: ="{"&RC[-6]&","&RC[-3]&","&RC[-2]&","&RC[-1]&"}," -> {201019,1,1,12}, | AI29: =R[-1]C&RC[-1] -> {200000,1,1,70},{200001,1,1,70},{200002,1,1,70},{200003,1,1,70},{200006,1,1,70},{200010,1,1,12},{200011,1,1,12},{200012,1,1,12},{200013,1,1,12},{200015,1,1,12},{200016,1,1,12},{200017,1,1,12},{200019,1,1,12},{201000,1,1,70},{201001,1,1,70},{201002,1,1,70},{201003,1,1,70},{201006,1,1,70},{201010,1,1,12},{201011,1,1,12},{201012,1,1,12},{201013,1,1,12},{201015,1,1,12},{201016,1,1,12},{201017,1,1,12},{201019,1,1,12}, | AK29: 201019 | AL29: 法师鞋子 | AM29: 1 | AN29: 1 | AO29: 1 | AP29: 12 | AQ29: ="{"&RC[-6]&","&RC[-3]&","&RC[-2]&","&RC[-1]&"}," -> {201019,1,1,12}, | AR29: =R[-1]C&RC[-1] -> {200000,1,1,70},{200001,1,1,70},{200002,1,1,70},{200003,1,1,70},{200006,1,1,70},{200010,1,1,12},{200011,1,1,12},{200012,1,1,12},{200013,1,1,12},{200015,1,1,12},{200016,1,1,12},{200017,1,1,12},{200019,1,1,12},{201000,1,1,70},{201001,1,1,70},{201002,1,1,70},{201003,1,1,70},{201006,1,1,70},{201010,1,1,12},{201011,1,1,12},{201012,1,1,12},{201013,1,1,12},{201015,1,1,12},{201016,1,1,12},{201017,1,1,12},{201019,1,1,12},
A30: BOSS怪掉落 | F30: 装备 | G30: 概率／100 | J30: 110079 | K30: 黑铁矿+1 | M30: 1 | N30: 2 | O30: 3 | P30: ="{"&RC[-6]&","&RC[-3]&","&RC[-2]&","&RC[-1]&"}," -> {110079,1,2,3}, | Q30: =RC[-1] -> {110079,1,2,3}, | S30: 202000 | T30: 半月 | U30: 1 | V30: 1 | W30: 1 | X30: 70 | Y30: ="{"&RC[-6]&","&RC[-3]&","&RC[-2]&","&RC[-1]&"}," -> {202000,1,1,70}, | Z30: =R[-1]C&RC[-1] -> {200000,1,1,70},{200001,1,1,70},{200002,1,1,70},{200003,1,1,70},{200006,1,1,70},{200010,1,1,12},{200011,1,1,12},{200012,1,1,12},{200013,1,1,12},{200015,1,1,12},{200016,1,1,12},{200017,1,1,12},{200019,1,1,12},{201000,1,1,70},{201001,1,1,70},{201002,1,1,70},{201003,1,1,70},{201006,1,1,70},{201010,1,1,12},{201011,1,1,12},{201012,1,1,12},{201013,1,1,12},{201015,1,1,12},{201016,1,1,12},{201017,1,1,12},{201019,1,1,12},{202000,1,1,70}, | AB30: 202000 | AC30: 半月 | AD30: 1 | AE30: 1 | AF30: 1 | AG30: 70 | AH30: ="{"&RC[-6]&","&RC[-3]&","&RC[-2]&","&RC[-1]&"}," -> {202000,1,1,70}, | AI30: =R[-1]C&RC[-1] -> {200000,1,1,70},{200001,1,1,70},{200002,1,1,70},{200003,1,1,70},{200006,1,1,70},{200010,1,1,12},{200011,1,1,12},{200012,1,1,12},{200013,1,1,12},{200015,1,1,12},{200016,1,1,12},{200017,1,1,12},{200019,1,1,12},{201000,1,1,70},{201001,1,1,70},{201002,1,1,70},{201003,1,1,70},{201006,1,1,70},{201010,1,1,12},{201011,1,1,12},{201012,1,1,12},{201013,1,1,12},{201015,1,1,12},{201016,1,1,12},{201017,1,1,12},{201019,1,1,12},{202000,1,1,70}, | AK30: 202000 | AL30: 半月 | AM30: 1 | AN30: 1 | AO30: 1 | AP30: 70 | AQ30: ="{"&RC[-6]&","&RC[-3]&","&RC[-2]&","&RC[-1]&"}," -> {202000,1,1,70}, | AR30: =R[-1]C&RC[-1] -> {200000,1,1,70},{200001,1,1,70},{200002,1,1,70},{200003,1,1,70},{200006,1,1,70},{200010,1,1,12},{200011,1,1,12},{200012,1,1,12},{200013,1,1,12},{200015,1,1,12},{200016,1,1,12},{200017,1,1,12},{200019,1,1,12},{201000,1,1,70},{201001,1,1,70},{201002,1,1,70},{201003,1,1,70},{201006,1,1,70},{201010,1,1,12},{201011,1,1,12},{201012,1,1,12},{201013,1,1,12},{201015,1,1,12},{201016,1,1,12},{201017,1,1,12},{201019,1,1,12},{202000,1,1,70},
F31: 1 | G31: 100 | H31: ="{0,[{"&RC[-2]&","&RC[-1]&"}],["&R[-13]C&"]}" -> {0,[{1,100}],[{200000,1,1,100},{200001,1,1,100},{200002,1,1,100},{200003,1,1,100},{200006,1,1,100},{201000,1,1,100},{201001,1,1,100},{201002,1,1,100},{201003,1,1,100},{201006,1,1,100},{202000,1,1,100},{202001,1,1,100},{202002,1,1,100},{202003,1,1,100},{202006,1,1,100}]} | J31: 110003 | K31: 洗炼石 | M31: 1 | N31: 2 | O31: 1 | P31: ="{"&RC[-6]&","&RC[-3]&","&RC[-2]&","&RC[-1]&"}," -> {110003,1,2,1}, | Q31: =R[-1]C&RC[-1] -> {110079,1,2,3},{110003,1,2,1}, | S31: 202001 | T31: 轻盔 | U31: 1 | V31: 1 | W31: 1 | X31: 70 | Y31: ="{"&RC[-6]&","&RC[-3]&","&RC[-2]&","&RC[-1]&"}," -> {202001,1,1,70}, | Z31: =R[-1]C&RC[-1] -> {200000,1,1,70},{200001,1,1,70},{200002,1,1,70},{200003,1,1,70},{200006,1,1,70},{200010,1,1,12},{200011,1,1,12},{200012,1,1,12},{200013,1,1,12},{200015,1,1,12},{200016,1,1,12},{200017,1,1,12},{200019,1,1,12},{201000,1,1,70},{201001,1,1,70},{201002,1,1,70},{201003,1,1,70},{201006,1,1,70},{201010,1,1,12},{201011,1,1,12},{201012,1,1,12},{201013,1,1,12},{201015,1,1,12},{201016,1,1,12},{201017,1,1,12},{201019,1,1,12},{202000,1,1,70},{202001,1,1,70}, | AB31: 202001 | AC31: 轻盔 | AD31: 1 | AE31: 1 | AF31: 1 | AG31: 70 | AH31: ="{"&RC[-6]&","&RC[-3]&","&RC[-2]&","&RC[-1]&"}," -> {202001,1,1,70}, | AI31: =R[-1]C&RC[-1] -> {200000,1,1,70},{200001,1,1,70},{200002,1,1,70},{200003,1,1,70},{200006,1,1,70},{200010,1,1,12},{200011,1,1,12},{200012,1,1,12},{200013,1,1,12},{200015,1,1,12},{200016,1,1,12},{200017,1,1,12},{200019,1,1,12},{201000,1,1,70},{201001,1,1,70},{201002,1,1,70},{201003,1,1,70},{201006,1,1,70},{201010,1,1,12},{201011,1,1,12},{201012,1,1,12},{201013,1,1,12},{201015,1,1,12},{201016,1,1,12},{201017,1,1,12},{201019,1,1,12},{202000,1,1,70},{202001,1,1,70}, | AK31: 202001 | AL31: 轻盔 | AM31: 1 | AN31: 1 | AO31: 1 | AP31: 70 | AQ31: ="{"&RC[-6]&","&RC[-3]&","&RC[-2]&","&RC[-1]&"}," -> {202001,1,1,70}, | AR31: =R[-1]C&RC[-1] -> {200000,1,1,70},{200001,1,1,70},{200002,1,1,70},{200003,1,1,70},{200006,1,1,70},{200010,1,1,12},{200011,1,1,12},{200012,1,1,12},{200013,1,1,12},{200015,1,1,12},{200016,1,1,12},{200017,1,1,12},{200019,1,1,12},{201000,1,1,70},{201001,1,1,70},{201002,1,1,70},{201003,1,1,70},{201006,1,1,70},{201010,1,1,12},{201011,1,1,12},{201012,1,1,12},{201013,1,1,12},{201015,1,1,12},{201016,1,1,12},{201017,1,1,12},{201019,1,1,12},{202000,1,1,70},{202001,1,1,70},
F32: 道具 | G32: 概率／100 | J32: 110004 | K32: 红药 | M32: 1 | N32: 1 | O32: 3 | P32: ="{"&RC[-6]&","&RC[-3]&","&RC[-2]&","&RC[-1]&"}," -> {110004,1,1,3}, | Q32: =R[-1]C&RC[-1] -> {110079,1,2,3},{110003,1,2,1},{110004,1,1,3}, | S32: 202002 | T32: 铂金戒指 | U32: 1 | V32: 1 | W32: 1 | X32: 70 | Y32: ="{"&RC[-6]&","&RC[-3]&","&RC[-2]&","&RC[-1]&"}," -> {202002,1,1,70}, | Z32: =R[-1]C&RC[-1] -> {200000,1,1,70},{200001,1,1,70},{200002,1,1,70},{200003,1,1,70},{200006,1,1,70},{200010,1,1,12},{200011,1,1,12},{200012,1,1,12},{200013,1,1,12},{200015,1,1,12},{200016,1,1,12},{200017,1,1,12},{200019,1,1,12},{201000,1,1,70},{201001,1,1,70},{201002,1,1,70},{201003,1,1,70},{201006,1,1,70},{201010,1,1,12},{201011,1,1,12},{201012,1,1,12},{201013,1,1,12},{201015,1,1,12},{201016,1,1,12},{201017,1,1,12},{201019,1,1,12},{202000,1,1,70},{202001,1,1,70},{202002,1,1,70}, | AB32: 202002 | AC32: 铂金戒指 | AD32: 1 | AE32: 1 | AF32: 1 | AG32: 70 | AH32: ="{"&RC[-6]&","&RC[-3]&","&RC[-2]&","&RC[-1]&"}," -> {202002,1,1,70}, | AI32: =R[-1]C&RC[-1] -> {200000,1,1,70},{200001,1,1,70},{200002,1,1,70},{200003,1,1,70},{200006,1,1,70},{200010,1,1,12},{200011,1,1,12},{200012,1,1,12},{200013,1,1,12},{200015,1,1,12},{200016,1,1,12},{200017,1,1,12},{200019,1,1,12},{201000,1,1,70},{201001,1,1,70},{201002,1,1,70},{201003,1,1,70},{201006,1,1,70},{201010,1,1,12},{201011,1,1,12},{201012,1,1,12},{201013,1,1,12},{201015,1,1,12},{201016,1,1,12},{201017,1,1,12},{201019,1,1,12},{202000,1,1,70},{202001,1,1,70},{202002,1,1,70}, | AK32: 202002 | AL32: 铂金戒指 | AM32: 1 | AN32: 1 | AO32: 1 | AP32: 70 | AQ32: ="{"&RC[-6]&","&RC[-3]&","&RC[-2]&","&RC[-1]&"}," -> {202002,1,1,70}, | AR32: =R[-1]C&RC[-1] -> {200000,1,1,70},{200001,1,1,70},{200002,1,1,70},{200003,1,1,70},{200006,1,1,70},{200010,1,1,12},{200011,1,1,12},{200012,1,1,12},{200013,1,1,12},{200015,1,1,12},{200016,1,1,12},{200017,1,1,12},{200019,1,1,12},{201000,1,1,70},{201001,1,1,70},{201002,1,1,70},{201003,1,1,70},{201006,1,1,70},{201010,1,1,12},{201011,1,1,12},{201012,1,1,12},{201013,1,1,12},{201015,1,1,12},{201016,1,1,12},{201017,1,1,12},{201019,1,1,12},{202000,1,1,70},{202001,1,1,70},{202002,1,1,70},
F33: 3 | G33: 100 | H33: ="{0,[{"&RC[-2]&","&RC[-1]&"}],["&R[-6]C&"]}" -> {0,[{3,100}],[{110079,1,2,3},{110003,1,2,1},{110004,1,1,3},{110005,1,1,3},{110010,1,1,0},{110011,1,1,0},{110012,1,1,0}]} | J33: 110005 | K33: 蓝药 | M33: 1 | N33: 1 | O33: 3 | P33: ="{"&RC[-6]&","&RC[-3]&","&RC[-2]&","&RC[-1]&"}," -> {110005,1,1,3}, | Q33: =R[-1]C&RC[-1] -> {110079,1,2,3},{110003,1,2,1},{110004,1,1,3},{110005,1,1,3}, | S33: 202003 | T33: 三眼手镯 | U33: 1 | V33: 1 | W33: 1 | X33: 70 | Y33: ="{"&RC[-6]&","&RC[-3]&","&RC[-2]&","&RC[-1]&"}," -> {202003,1,1,70}, | Z33: =R[-1]C&RC[-1] -> {200000,1,1,70},{200001,1,1,70},{200002,1,1,70},{200003,1,1,70},{200006,1,1,70},{200010,1,1,12},{200011,1,1,12},{200012,1,1,12},{200013,1,1,12},{200015,1,1,12},{200016,1,1,12},{200017,1,1,12},{200019,1,1,12},{201000,1,1,70},{201001,1,1,70},{201002,1,1,70},{201003,1,1,70},{201006,1,1,70},{201010,1,1,12},{201011,1,1,12},{201012,1,1,12},{201013,1,1,12},{201015,1,1,12},{201016,1,1,12},{201017,1,1,12},{201019,1,1,12},{202000,1,1,70},{202001,1,1,70},{202002,1,1,70},{202003,1,1,70}, | AB33: 202003 | AC33: 三眼手镯 | AD33: 1 | AE33: 1 | AF33: 1 | AG33: 70 | AH33: ="{"&RC[-6]&","&RC[-3]&","&RC[-2]&","&RC[-1]&"}," -> {202003,1,1,70}, | AI33: =R[-1]C&RC[-1] -> {200000,1,1,70},{200001,1,1,70},{200002,1,1,70},{200003,1,1,70},{200006,1,1,70},{200010,1,1,12},{200011,1,1,12},{200012,1,1,12},{200013,1,1,12},{200015,1,1,12},{200016,1,1,12},{200017,1,1,12},{200019,1,1,12},{201000,1,1,70},{201001,1,1,70},{201002,1,1,70},{201003,1,1,70},{201006,1,1,70},{201010,1,1,12},{201011,1,1,12},{201012,1,1,12},{201013,1,1,12},{201015,1,1,12},{201016,1,1,12},{201017,1,1,12},{201019,1,1,12},{202000,1,1,70},{202001,1,1,70},{202002,1,1,70},{202003,1,1,70}, | AK33: 202003 | AL33: 三眼手镯 | AM33: 1 | AN33: 1 | AO33: 1 | AP33: 70 | AQ33: ="{"&RC[-6]&","&RC[-3]&","&RC[-2]&","&RC[-1]&"}," -> {202003,1,1,70}, | AR33: =R[-1]C&RC[-1] -> {200000,1,1,70},{200001,1,1,70},{200002,1,1,70},{200003,1,1,70},{200006,1,1,70},{200010,1,1,12},{200011,1,1,12},{200012,1,1,12},{200013,1,1,12},{200015,1,1,12},{200016,1,1,12},{200017,1,1,12},{200019,1,1,12},{201000,1,1,70},{201001,1,1,70},{201002,1,1,70},{201003,1,1,70},{201006,1,1,70},{201010,1,1,12},{201011,1,1,12},{201012,1,1,12},{201013,1,1,12},{201015,1,1,12},{201016,1,1,12},{201017,1,1,12},{201019,1,1,12},{202000,1,1,70},{202001,1,1,70},{202002,1,1,70},{202003,1,1,70},
F34: 金币 | G34: 概率／100 | J34: 110010 | K34: 普通武装碎片 | M34: 1 | N34: 1 | O34: 0 | P34: ="{"&RC[-6]&","&RC[-3]&","&RC[-2]&","&RC[-1]&"}," -> {110010,1,1,0}, | Q34: =R[-1]C&RC[-1] -> {110079,1,2,3},{110003,1,2,1},{110004,1,1,3},{110005,1,1,3},{110010,1,1,0}, | S34: 202006 | T34: 凤凰明珠 | U34: 1 | V34: 1 | W34: 1 | X34: 70 | Y34: ="{"&RC[-6]&","&RC[-3]&","&RC[-2]&","&RC[-1]&"}," -> {202006,1,1,70}, | Z34: =R[-1]C&RC[-1] -> {200000,1,1,70},{200001,1,1,70},{200002,1,1,70},{200003,1,1,70},{200006,1,1,70},{200010,1,1,12},{200011,1,1,12},{200012,1,1,12},{200013,1,1,12},{200015,1,1,12},{200016,1,1,12},{200017,1,1,12},{200019,1,1,12},{201000,1,1,70},{201001,1,1,70},{201002,1,1,70},{201003,1,1,70},{201006,1,1,70},{201010,1,1,12},{201011,1,1,12},{201012,1,1,12},{201013,1,1,12},{201015,1,1,12},{201016,1,1,12},{201017,1,1,12},{201019,1,1,12},{202000,1,1,70},{202001,1,1,70},{202002,1,1,70},{202003,1,1,70},{202006,1,1,70}, | AB34: 202006 | AC34: 凤凰明珠 | AD34: 1 | AE34: 1 | AF34: 1 | AG34: 70 | AH34: ="{"&RC[-6]&","&RC[-3]&","&RC[-2]&","&RC[-1]&"}," -> {202006,1,1,70}, | AI34: =R[-1]C&RC[-1] -> {200000,1,1,70},{200001,1,1,70},{200002,1,1,70},{200003,1,1,70},{200006,1,1,70},{200010,1,1,12},{200011,1,1,12},{200012,1,1,12},{200013,1,1,12},{200015,1,1,12},{200016,1,1,12},{200017,1,1,12},{200019,1,1,12},{201000,1,1,70},{201001,1,1,70},{201002,1,1,70},{201003,1,1,70},{201006,1,1,70},{201010,1,1,12},{201011,1,1,12},{201012,1,1,12},{201013,1,1,12},{201015,1,1,12},{201016,1,1,12},{201017,1,1,12},{201019,1,1,12},{202000,1,1,70},{202001,1,1,70},{202002,1,1,70},{202003,1,1,70},{202006,1,1,70}, | AK34: 202006 | AL34: 凤凰明珠 | AM34: 1 | AN34: 1 | AO34: 1 | AP34: 70 | AQ34: ="{"&RC[-6]&","&RC[-3]&","&RC[-2]&","&RC[-1]&"}," -> {202006,1,1,70}, | AR34: =R[-1]C&RC[-1] -> {200000,1,1,70},{200001,1,1,70},{200002,1,1,70},{200003,1,1,70},{200006,1,1,70},{200010,1,1,12},{200011,1,1,12},{200012,1,1,12},{200013,1,1,12},{200015,1,1,12},{200016,1,1,12},{200017,1,1,12},{200019,1,1,12},{201000,1,1,70},{201001,1,1,70},{201002,1,1,70},{201003,1,1,70},{201006,1,1,70},{201010,1,1,12},{201011,1,1,12},{201012,1,1,12},{201013,1,1,12},{201015,1,1,12},{201016,1,1,12},{201017,1,1,12},{201019,1,1,12},{202000,1,1,70},{202001,1,1,70},{202002,1,1,70},{202003,1,1,70},{202006,1,1,70},
F35: 7 | G35: 100 | H35: {0,[{10,100}],[{110009,1,1000,1}]} | J35: 110011 | K35: 普通防具碎片 | M35: 1 | N35: 1 | O35: 0 | P35: ="{"&RC[-6]&","&RC[-3]&","&RC[-2]&","&RC[-1]&"}," -> {110011,1,1,0}, | Q35: =R[-1]C&RC[-1] -> {110079,1,2,3},{110003,1,2,1},{110004,1,1,3},{110005,1,1,3},{110010,1,1,0},{110011,1,1,0}, | S35: 202010 | T35: 银蛇 | U35: 1 | V35: 1 | W35: 1 | X35: 12 | Y35: ="{"&RC[-6]&","&RC[-3]&","&RC[-2]&","&RC[-1]&"}," -> {202010,1,1,12}, | Z35: =R[-1]C&RC[-1] -> {200000,1,1,70},{200001,1,1,70},{200002,1,1,70},{200003,1,1,70},{200006,1,1,70},{200010,1,1,12},{200011,1,1,12},{200012,1,1,12},{200013,1,1,12},{200015,1,1,12},{200016,1,1,12},{200017,1,1,12},{200019,1,1,12},{201000,1,1,70},{201001,1,1,70},{201002,1,1,70},{201003,1,1,70},{201006,1,1,70},{201010,1,1,12},{201011,1,1,12},{201012,1,1,12},{201013,1,1,12},{201015,1,1,12},{201016,1,1,12},{201017,1,1,12},{201019,1,1,12},{202000,1,1,70},{202001,1,1,70},{202002,1,1,70},{202003,1,1,70},{202006,1,1,70},{202010,1,1,12}, | AB35: 202010 | AC35: 银蛇 | AD35: 1 | AE35: 1 | AF35: 1 | AG35: 12 | AH35: ="{"&RC[-6]&","&RC[-3]&","&RC[-2]&","&RC[-1]&"}," -> {202010,1,1,12}, | AI35: =R[-1]C&RC[-1] -> {200000,1,1,70},{200001,1,1,70},{200002,1,1,70},{200003,1,1,70},{200006,1,1,70},{200010,1,1,12},{200011,1,1,12},{200012,1,1,12},{200013,1,1,12},{200015,1,1,12},{200016,1,1,12},{200017,1,1,12},{200019,1,1,12},{201000,1,1,70},{201001,1,1,70},{201002,1,1,70},{201003,1,1,70},{201006,1,1,70},{201010,1,1,12},{201011,1,1,12},{201012,1,1,12},{201013,1,1,12},{201015,1,1,12},{201016,1,1,12},{201017,1,1,12},{201019,1,1,12},{202000,1,1,70},{202001,1,1,70},{202002,1,1,70},{202003,1,1,70},{202006,1,1,70},{202010,1,1,12}, | AK35: 202010 | AL35: 银蛇 | AM35: 1 | AN35: 1 | AO35: 1 | AP35: 12 | AQ35: ="{"&RC[-6]&","&RC[-3]&","&RC[-2]&","&RC[-1]&"}," -> {202010,1,1,12}, | AR35: =R[-1]C&RC[-1] -> {200000,1,1,70},{200001,1,1,70},{200002,1,1,70},{200003,1,1,70},{200006,1,1,70},{200010,1,1,12},{200011,1,1,12},{200012,1,1,12},{200013,1,1,12},{200015,1,1,12},{200016,1,1,12},{200017,1,1,12},{200019,1,1,12},{201000,1,1,70},{201001,1,1,70},{201002,1,1,70},{201003,1,1,70},{201006,1,1,70},{201010,1,1,12},{201011,1,1,12},{201012,1,1,12},{201013,1,1,12},{201015,1,1,12},{201016,1,1,12},{201017,1,1,12},{201019,1,1,12},{202000,1,1,70},{202001,1,1,70},{202002,1,1,70},{202003,1,1,70},{202006,1,1,70},{202010,1,1,12},
J36: 110012 | K36: 普通首饰碎片 | M36: 1 | N36: 1 | O36: 0 | P36: ="{"&RC[-6]&","&RC[-3]&","&RC[-2]&","&RC[-1]&"}" -> {110012,1,1,0} | Q36: =R[-1]C&RC[-1] -> {110079,1,2,3},{110003,1,2,1},{110004,1,1,3},{110005,1,1,3},{110010,1,1,0},{110011,1,1,0},{110012,1,1,0} | S36: 202011 | T36: 天珠道链 | U36: 1 | V36: 1 | W36: 1 | X36: 12 | Y36: ="{"&RC[-6]&","&RC[-3]&","&RC[-2]&","&RC[-1]&"}," -> {202011,1,1,12}, | Z36: =R[-1]C&RC[-1] -> {200000,1,1,70},{200001,1,1,70},{200002,1,1,70},{200003,1,1,70},{200006,1,1,70},{200010,1,1,12},{200011,1,1,12},{200012,1,1,12},{200013,1,1,12},{200015,1,1,12},{200016,1,1,12},{200017,1,1,12},{200019,1,1,12},{201000,1,1,70},{201001,1,1,70},{201002,1,1,70},{201003,1,1,70},{201006,1,1,70},{201010,1,1,12},{201011,1,1,12},{201012,1,1,12},{201013,1,1,12},{201015,1,1,12},{201016,1,1,12},{201017,1,1,12},{201019,1,1,12},{202000,1,1,70},{202001,1,1,70},{202002,1,1,70},{202003,1,1,70},{202006,1,1,70},{202010,1,1,12},{202011,1,1,12}, | AB36: 202011 | AC36: 天珠道链 | AD36: 1 | AE36: 1 | AF36: 1 | AG36: 12 | AH36: ="{"&RC[-6]&","&RC[-3]&","&RC[-2]&","&RC[-1]&"}," -> {202011,1,1,12}, | AI36: =R[-1]C&RC[-1] -> {200000,1,1,70},{200001,1,1,70},{200002,1,1,70},{200003,1,1,70},{200006,1,1,70},{200010,1,1,12},{200011,1,1,12},{200012,1,1,12},{200013,1,1,12},{200015,1,1,12},{200016,1,1,12},{200017,1,1,12},{200019,1,1,12},{201000,1,1,70},{201001,1,1,70},{201002,1,1,70},{201003,1,1,70},{201006,1,1,70},{201010,1,1,12},{201011,1,1,12},{201012,1,1,12},{201013,1,1,12},{201015,1,1,12},{201016,1,1,12},{201017,1,1,12},{201019,1,1,12},{202000,1,1,70},{202001,1,1,70},{202002,1,1,70},{202003,1,1,70},{202006,1,1,70},{202010,1,1,12},{202011,1,1,12}, | AK36: 202011 | AL36: 天珠道链 | AM36: 1 | AN36: 1 | AO36: 1 | AP36: 12 | AQ36: ="{"&RC[-6]&","&RC[-3]&","&RC[-2]&","&RC[-1]&"}," -> {202011,1,1,12}, | AR36: =R[-1]C&RC[-1] -> {200000,1,1,70},{200001,1,1,70},{200002,1,1,70},{200003,1,1,70},{200006,1,1,70},{200010,1,1,12},{200011,1,1,12},{200012,1,1,12},{200013,1,1,12},{200015,1,1,12},{200016,1,1,12},{200017,1,1,12},{200019,1,1,12},{201000,1,1,70},{201001,1,1,70},{201002,1,1,70},{201003,1,1,70},{201006,1,1,70},{201010,1,1,12},{201011,1,1,12},{201012,1,1,12},{201013,1,1,12},{201015,1,1,12},{201016,1,1,12},{201017,1,1,12},{201019,1,1,12},{202000,1,1,70},{202001,1,1,70},{202002,1,1,70},{202003,1,1,70},{202006,1,1,70},{202010,1,1,12},{202011,1,1,12},
H37: ="["&R[-6]C&","&R[-4]C&","&R[-2]C&"]" -> [{0,[{1,100}],[{200000,1,1,100},{200001,1,1,100},{200002,1,1,100},{200003,1,1,100},{200006,1,1,100},{201000,1,1,100},{201001,1,1,100},{201002,1,1,100},{201003,1,1,100},{201006,1,1,100},{202000,1,1,100},{202001,1,1,100},{202002,1,1,100},{202003,1,1,100},{202006,1,1,100}]},{0,[{3,100}],[{110079,1,2,3},{110003,1,2,1},{110004,1,1,3},{110005,1,1,3},{110010,1,1,0},{110011,1,1,0},{110012,1,1,0}]},{0,[{10,100}],[{110009,1,1000,1}]}] | S37: 202012 | T37: 灵魂道袍 | U37: 1 | V37: 1 | W37: 1 | X37: 12 | Y37: ="{"&RC[-6]&","&RC[-3]&","&RC[-2]&","&RC[-1]&"}," -> {202012,1,1,12}, | Z37: =R[-1]C&RC[-1] -> {200000,1,1,70},{200001,1,1,70},{200002,1,1,70},{200003,1,1,70},{200006,1,1,70},{200010,1,1,12},{200011,1,1,12},{200012,1,1,12},{200013,1,1,12},{200015,1,1,12},{200016,1,1,12},{200017,1,1,12},{200019,1,1,12},{201000,1,1,70},{201001,1,1,70},{201002,1,1,70},{201003,1,1,70},{201006,1,1,70},{201010,1,1,12},{201011,1,1,12},{201012,1,1,12},{201013,1,1,12},{201015,1,1,12},{201016,1,1,12},{201017,1,1,12},{201019,1,1,12},{202000,1,1,70},{202001,1,1,70},{202002,1,1,70},{202003,1,1,70},{202006,1,1,70},{202010,1,1,12},{202011,1,1,12},{202012,1,1,12}, | AB37: 202012 | AC37: 灵魂道袍 | AD37: 1 | AE37: 1 | AF37: 1 | AG37: 12 | AH37: ="{"&RC[-6]&","&RC[-3]&","&RC[-2]&","&RC[-1]&"}," -> {202012,1,1,12}, | AI37: =R[-1]C&RC[-1] -> {200000,1,1,70},{200001,1,1,70},{200002,1,1,70},{200003,1,1,70},{200006,1,1,70},{200010,1,1,12},{200011,1,1,12},{200012,1,1,12},{200013,1,1,12},{200015,1,1,12},{200016,1,1,12},{200017,1,1,12},{200019,1,1,12},{201000,1,1,70},{201001,1,1,70},{201002,1,1,70},{201003,1,1,70},{201006,1,1,70},{201010,1,1,12},{201011,1,1,12},{201012,1,1,12},{201013,1,1,12},{201015,1,1,12},{201016,1,1,12},{201017,1,1,12},{201019,1,1,12},{202000,1,1,70},{202001,1,1,70},{202002,1,1,70},{202003,1,1,70},{202006,1,1,70},{202010,1,1,12},{202011,1,1,12},{202012,1,1,12}, | AK37: 202012 | AL37: 灵魂道袍 | AM37: 1 | AN37: 1 | AO37: 1 | AP37: 12 | AQ37: ="{"&RC[-6]&","&RC[-3]&","&RC[-2]&","&RC[-1]&"}," -> {202012,1,1,12}, | AR37: =R[-1]C&RC[-1] -> {200000,1,1,70},{200001,1,1,70},{200002,1,1,70},{200003,1,1,70},{200006,1,1,70},{200010,1,1,12},{200011,1,1,12},{200012,1,1,12},{200013,1,1,12},{200015,1,1,12},{200016,1,1,12},{200017,1,1,12},{200019,1,1,12},{201000,1,1,70},{201001,1,1,70},{201002,1,1,70},{201003,1,1,70},{201006,1,1,70},{201010,1,1,12},{201011,1,1,12},{201012,1,1,12},{201013,1,1,12},{201015,1,1,12},{201016,1,1,12},{201017,1,1,12},{201019,1,1,12},{202000,1,1,70},{202001,1,1,70},{202002,1,1,70},{202003,1,1,70},{202006,1,1,70},{202010,1,1,12},{202011,1,1,12},{202012,1,1,12},
S38: 202013 | T38: 泰坦戒指 | U38: 1 | V38: 1 | W38: 1 | X38: 12 | Y38: ="{"&RC[-6]&","&RC[-3]&","&RC[-2]&","&RC[-1]&"}," -> {202013,1,1,12}, | Z38: =R[-1]C&RC[-1] -> {200000,1,1,70},{200001,1,1,70},{200002,1,1,70},{200003,1,1,70},{200006,1,1,70},{200010,1,1,12},{200011,1,1,12},{200012,1,1,12},{200013,1,1,12},{200015,1,1,12},{200016,1,1,12},{200017,1,1,12},{200019,1,1,12},{201000,1,1,70},{201001,1,1,70},{201002,1,1,70},{201003,1,1,70},{201006,1,1,70},{201010,1,1,12},{201011,1,1,12},{201012,1,1,12},{201013,1,1,12},{201015,1,1,12},{201016,1,1,12},{201017,1,1,12},{201019,1,1,12},{202000,1,1,70},{202001,1,1,70},{202002,1,1,70},{202003,1,1,70},{202006,1,1,70},{202010,1,1,12},{202011,1,1,12},{202012,1,1,12},{202013,1,1,12}, | AB38: 202013 | AC38: 泰坦戒指 | AD38: 1 | AE38: 1 | AF38: 1 | AG38: 12 | AH38: ="{"&RC[-6]&","&RC[-3]&","&RC[-2]&","&RC[-1]&"}," -> {202013,1,1,12}, | AI38: =R[-1]C&RC[-1] -> {200000,1,1,70},{200001,1,1,70},{200002,1,1,70},{200003,1,1,70},{200006,1,1,70},{200010,1,1,12},{200011,1,1,12},{200012,1,1,12},{200013,1,1,12},{200015,1,1,12},{200016,1,1,12},{200017,1,1,12},{200019,1,1,12},{201000,1,1,70},{201001,1,1,70},{201002,1,1,70},{201003,1,1,70},{201006,1,1,70},{201010,1,1,12},{201011,1,1,12},{201012,1,1,12},{201013,1,1,12},{201015,1,1,12},{201016,1,1,12},{201017,1,1,12},{201019,1,1,12},{202000,1,1,70},{202001,1,1,70},{202002,1,1,70},{202003,1,1,70},{202006,1,1,70},{202010,1,1,12},{202011,1,1,12},{202012,1,1,12},{202013,1,1,12}, | AK38: 202013 | AL38: 泰坦戒指 | AM38: 1 | AN38: 1 | AO38: 1 | AP38: 12 | AQ38: ="{"&RC[-6]&","&RC[-3]&","&RC[-2]&","&RC[-1]&"}," -> {202013,1,1,12}, | AR38: =R[-1]C&RC[-1] -> {200000,1,1,70},{200001,1,1,70},{200002,1,1,70},{200003,1,1,70},{200006,1,1,70},{200010,1,1,12},{200011,1,1,12},{200012,1,1,12},{200013,1,1,12},{200015,1,1,12},{200016,1,1,12},{200017,1,1,12},{200019,1,1,12},{201000,1,1,70},{201001,1,1,70},{201002,1,1,70},{201003,1,1,70},{201006,1,1,70},{201010,1,1,12},{201011,1,1,12},{201012,1,1,12},{201013,1,1,12},{201015,1,1,12},{201016,1,1,12},{201017,1,1,12},{201019,1,1,12},{202000,1,1,70},{202001,1,1,70},{202002,1,1,70},{202003,1,1,70},{202006,1,1,70},{202010,1,1,12},{202011,1,1,12},{202012,1,1,12},{202013,1,1,12},
J39: BOSS怪掉落 | O39: 装备 | P39: 概率／100 | S39: 202015 | T39: 道士头盔 | U39: 1 | V39: 1 | W39: 1 | X39: 12 | Y39: ="{"&RC[-6]&","&RC[-3]&","&RC[-2]&","&RC[-1]&"}," -> {202015,1,1,12}, | Z39: =R[-1]C&RC[-1] -> {200000,1,1,70},{200001,1,1,70},{200002,1,1,70},{200003,1,1,70},{200006,1,1,70},{200010,1,1,12},{200011,1,1,12},{200012,1,1,12},{200013,1,1,12},{200015,1,1,12},{200016,1,1,12},{200017,1,1,12},{200019,1,1,12},{201000,1,1,70},{201001,1,1,70},{201002,1,1,70},{201003,1,1,70},{201006,1,1,70},{201010,1,1,12},{201011,1,1,12},{201012,1,1,12},{201013,1,1,12},{201015,1,1,12},{201016,1,1,12},{201017,1,1,12},{201019,1,1,12},{202000,1,1,70},{202001,1,1,70},{202002,1,1,70},{202003,1,1,70},{202006,1,1,70},{202010,1,1,12},{202011,1,1,12},{202012,1,1,12},{202013,1,1,12},{202015,1,1,12}, | AB39: 202015 | AC39: 道士头盔 | AD39: 1 | AE39: 1 | AF39: 1 | AG39: 12 | AH39: ="{"&RC[-6]&","&RC[-3]&","&RC[-2]&","&RC[-1]&"}," -> {202015,1,1,12}, | AI39: =R[-1]C&RC[-1] -> {200000,1,1,70},{200001,1,1,70},{200002,1,1,70},{200003,1,1,70},{200006,1,1,70},{200010,1,1,12},{200011,1,1,12},{200012,1,1,12},{200013,1,1,12},{200015,1,1,12},{200016,1,1,12},{200017,1,1,12},{200019,1,1,12},{201000,1,1,70},{201001,1,1,70},{201002,1,1,70},{201003,1,1,70},{201006,1,1,70},{201010,1,1,12},{201011,1,1,12},{201012,1,1,12},{201013,1,1,12},{201015,1,1,12},{201016,1,1,12},{201017,1,1,12},{201019,1,1,12},{202000,1,1,70},{202001,1,1,70},{202002,1,1,70},{202003,1,1,70},{202006,1,1,70},{202010,1,1,12},{202011,1,1,12},{202012,1,1,12},{202013,1,1,12},{202015,1,1,12}, | AK39: 202015 | AL39: 道士头盔 | AM39: 1 | AN39: 1 | AO39: 1 | AP39: 12 | AQ39: ="{"&RC[-6]&","&RC[-3]&","&RC[-2]&","&RC[-1]&"}," -> {202015,1,1,12}, | AR39: =R[-1]C&RC[-1] -> {200000,1,1,70},{200001,1,1,70},{200002,1,1,70},{200003,1,1,70},{200006,1,1,70},{200010,1,1,12},{200011,1,1,12},{200012,1,1,12},{200013,1,1,12},{200015,1,1,12},{200016,1,1,12},{200017,1,1,12},{200019,1,1,12},{201000,1,1,70},{201001,1,1,70},{201002,1,1,70},{201003,1,1,70},{201006,1,1,70},{201010,1,1,12},{201011,1,1,12},{201012,1,1,12},{201013,1,1,12},{201015,1,1,12},{201016,1,1,12},{201017,1,1,12},{201019,1,1,12},{202000,1,1,70},{202001,1,1,70},{202002,1,1,70},{202003,1,1,70},{202006,1,1,70},{202010,1,1,12},{202011,1,1,12},{202012,1,1,12},{202013,1,1,12},{202015,1,1,12},
O40: 1 | P40: 100 | Q40: ="{0,[{"&RC[-2]&","&RC[-1]&"}],["&R[-13]C&"]}" -> {0,[{1,100}],[{200000,1,1,60},{200001,1,1,60},{200002,1,1,60},{200003,1,1,60},{200006,1,1,60},{200010,1,1,5},{200011,1,1,5},{200012,1,1,5},{201000,1,1,60},{201001,1,1,60},{201002,1,1,60},{201003,1,1,60},{201006,1,1,60},{201010,1,1,5},{201011,1,1,5},{201012,1,1,5},{202000,1,1,60},{202001,1,1,60},{202002,1,1,60},{202003,1,1,60},{202006,1,1,60},{202010,1,1,5},{202011,1,1,5},{202012,1,1,5}]} | S40: 202016 | T40: 幽灵手镯 | U40: 1 | V40: 1 | W40: 1 | X40: 12 | Y40: ="{"&RC[-6]&","&RC[-3]&","&RC[-2]&","&RC[-1]&"}," -> {202016,1,1,12}, | Z40: =R[-1]C&RC[-1] -> {200000,1,1,70},{200001,1,1,70},{200002,1,1,70},{200003,1,1,70},{200006,1,1,70},{200010,1,1,12},{200011,1,1,12},{200012,1,1,12},{200013,1,1,12},{200015,1,1,12},{200016,1,1,12},{200017,1,1,12},{200019,1,1,12},{201000,1,1,70},{201001,1,1,70},{201002,1,1,70},{201003,1,1,70},{201006,1,1,70},{201010,1,1,12},{201011,1,1,12},{201012,1,1,12},{201013,1,1,12},{201015,1,1,12},{201016,1,1,12},{201017,1,1,12},{201019,1,1,12},{202000,1,1,70},{202001,1,1,70},{202002,1,1,70},{202003,1,1,70},{202006,1,1,70},{202010,1,1,12},{202011,1,1,12},{202012,1,1,12},{202013,1,1,12},{202015,1,1,12},{202016,1,1,12}, | AB40: 202016 | AC40: 幽灵手镯 | AD40: 1 | AE40: 1 | AF40: 1 | AG40: 12 | AH40: ="{"&RC[-6]&","&RC[-3]&","&RC[-2]&","&RC[-1]&"}," -> {202016,1,1,12}, | AI40: =R[-1]C&RC[-1] -> {200000,1,1,70},{200001,1,1,70},{200002,1,1,70},{200003,1,1,70},{200006,1,1,70},{200010,1,1,12},{200011,1,1,12},{200012,1,1,12},{200013,1,1,12},{200015,1,1,12},{200016,1,1,12},{200017,1,1,12},{200019,1,1,12},{201000,1,1,70},{201001,1,1,70},{201002,1,1,70},{201003,1,1,70},{201006,1,1,70},{201010,1,1,12},{201011,1,1,12},{201012,1,1,12},{201013,1,1,12},{201015,1,1,12},{201016,1,1,12},{201017,1,1,12},{201019,1,1,12},{202000,1,1,70},{202001,1,1,70},{202002,1,1,70},{202003,1,1,70},{202006,1,1,70},{202010,1,1,12},{202011,1,1,12},{202012,1,1,12},{202013,1,1,12},{202015,1,1,12},{202016,1,1,12}, | AK40: 202016 | AL40: 幽灵手镯 | AM40: 1 | AN40: 1 | AO40: 1 | AP40: 12 | AQ40: ="{"&RC[-6]&","&RC[-3]&","&RC[-2]&","&RC[-1]&"}," -> {202016,1,1,12}, | AR40: =R[-1]C&RC[-1] -> {200000,1,1,70},{200001,1,1,70},{200002,1,1,70},{200003,1,1,70},{200006,1,1,70},{200010,1,1,12},{200011,1,1,12},{200012,1,1,12},{200013,1,1,12},{200015,1,1,12},{200016,1,1,12},{200017,1,1,12},{200019,1,1,12},{201000,1,1,70},{201001,1,1,70},{201002,1,1,70},{201003,1,1,70},{201006,1,1,70},{201010,1,1,12},{201011,1,1,12},{201012,1,1,12},{201013,1,1,12},{201015,1,1,12},{201016,1,1,12},{201017,1,1,12},{201019,1,1,12},{202000,1,1,70},{202001,1,1,70},{202002,1,1,70},{202003,1,1,70},{202006,1,1,70},{202010,1,1,12},{202011,1,1,12},{202012,1,1,12},{202013,1,1,12},{202015,1,1,12},{202016,1,1,12},
O41: 道具 | P41: 概率／100 | S41: 202017 | T41: 道士腰带 | U41: 1 | V41: 1 | W41: 1 | X41: 12 | Y41: ="{"&RC[-6]&","&RC[-3]&","&RC[-2]&","&RC[-1]&"}," -> {202017,1,1,12}, | Z41: =R[-1]C&RC[-1] -> {200000,1,1,70},{200001,1,1,70},{200002,1,1,70},{200003,1,1,70},{200006,1,1,70},{200010,1,1,12},{200011,1,1,12},{200012,1,1,12},{200013,1,1,12},{200015,1,1,12},{200016,1,1,12},{200017,1,1,12},{200019,1,1,12},{201000,1,1,70},{201001,1,1,70},{201002,1,1,70},{201003,1,1,70},{201006,1,1,70},{201010,1,1,12},{201011,1,1,12},{201012,1,1,12},{201013,1,1,12},{201015,1,1,12},{201016,1,1,12},{201017,1,1,12},{201019,1,1,12},{202000,1,1,70},{202001,1,1,70},{202002,1,1,70},{202003,1,1,70},{202006,1,1,70},{202010,1,1,12},{202011,1,1,12},{202012,1,1,12},{202013,1,1,12},{202015,1,1,12},{202016,1,1,12},{202017,1,1,12}, | AB41: 202017 | AC41: 道士腰带 | AD41: 1 | AE41: 1 | AF41: 1 | AG41: 12 | AH41: ="{"&RC[-6]&","&RC[-3]&","&RC[-2]&","&RC[-1]&"}," -> {202017,1,1,12}, | AI41: =R[-1]C&RC[-1] -> {200000,1,1,70},{200001,1,1,70},{200002,1,1,70},{200003,1,1,70},{200006,1,1,70},{200010,1,1,12},{200011,1,1,12},{200012,1,1,12},{200013,1,1,12},{200015,1,1,12},{200016,1,1,12},{200017,1,1,12},{200019,1,1,12},{201000,1,1,70},{201001,1,1,70},{201002,1,1,70},{201003,1,1,70},{201006,1,1,70},{201010,1,1,12},{201011,1,1,12},{201012,1,1,12},{201013,1,1,12},{201015,1,1,12},{201016,1,1,12},{201017,1,1,12},{201019,1,1,12},{202000,1,1,70},{202001,1,1,70},{202002,1,1,70},{202003,1,1,70},{202006,1,1,70},{202010,1,1,12},{202011,1,1,12},{202012,1,1,12},{202013,1,1,12},{202015,1,1,12},{202016,1,1,12},{202017,1,1,12}, | AK41: 202017 | AL41: 道士腰带 | AM41: 1 | AN41: 1 | AO41: 1 | AP41: 12 | AQ41: ="{"&RC[-6]&","&RC[-3]&","&RC[-2]&","&RC[-1]&"}," -> {202017,1,1,12}, | AR41: =R[-1]C&RC[-1] -> {200000,1,1,70},{200001,1,1,70},{200002,1,1,70},{200003,1,1,70},{200006,1,1,70},{200010,1,1,12},{200011,1,1,12},{200012,1,1,12},{200013,1,1,12},{200015,1,1,12},{200016,1,1,12},{200017,1,1,12},{200019,1,1,12},{201000,1,1,70},{201001,1,1,70},{201002,1,1,70},{201003,1,1,70},{201006,1,1,70},{201010,1,1,12},{201011,1,1,12},{201012,1,1,12},{201013,1,1,12},{201015,1,1,12},{201016,1,1,12},{201017,1,1,12},{201019,1,1,12},{202000,1,1,70},{202001,1,1,70},{202002,1,1,70},{202003,1,1,70},{202006,1,1,70},{202010,1,1,12},{202011,1,1,12},{202012,1,1,12},{202013,1,1,12},{202015,1,1,12},{202016,1,1,12},{202017,1,1,12},
O42: 3 | P42: 100 | Q42: ="{0,[{"&RC[-2]&","&RC[-1]&"}],["&R[-6]C&"]}" -> {0,[{3,100}],[{110079,1,2,3},{110003,1,2,1},{110004,1,1,3},{110005,1,1,3},{110010,1,1,0},{110011,1,1,0},{110012,1,1,0}]} | S42: 202019 | T42: 道士鞋子 | U42: 1 | V42: 1 | W42: 1 | X42: 12 | Y42: ="{"&RC[-6]&","&RC[-3]&","&RC[-2]&","&RC[-1]&"}" -> {202019,1,1,12} | Z42: =R[-1]C&RC[-1] -> {200000,1,1,70},{200001,1,1,70},{200002,1,1,70},{200003,1,1,70},{200006,1,1,70},{200010,1,1,12},{200011,1,1,12},{200012,1,1,12},{200013,1,1,12},{200015,1,1,12},{200016,1,1,12},{200017,1,1,12},{200019,1,1,12},{201000,1,1,70},{201001,1,1,70},{201002,1,1,70},{201003,1,1,70},{201006,1,1,70},{201010,1,1,12},{201011,1,1,12},{201012,1,1,12},{201013,1,1,12},{201015,1,1,12},{201016,1,1,12},{201017,1,1,12},{201019,1,1,12},{202000,1,1,70},{202001,1,1,70},{202002,1,1,70},{202003,1,1,70},{202006,1,1,70},{202010,1,1,12},{202011,1,1,12},{202012,1,1,12},{202013,1,1,12},{202015,1,1,12},{202016,1,1,12},{202017,1,1,12},{202019,1,1,12} | AB42: 202019 | AC42: 道士鞋子 | AD42: 1 | AE42: 1 | AF42: 1 | AG42: 12 | AH42: ="{"&RC[-6]&","&RC[-3]&","&RC[-2]&","&RC[-1]&"}" -> {202019,1,1,12} | AI42: =R[-1]C&RC[-1] -> {200000,1,1,70},{200001,1,1,70},{200002,1,1,70},{200003,1,1,70},{200006,1,1,70},{200010,1,1,12},{200011,1,1,12},{200012,1,1,12},{200013,1,1,12},{200015,1,1,12},{200016,1,1,12},{200017,1,1,12},{200019,1,1,12},{201000,1,1,70},{201001,1,1,70},{201002,1,1,70},{201003,1,1,70},{201006,1,1,70},{201010,1,1,12},{201011,1,1,12},{201012,1,1,12},{201013,1,1,12},{201015,1,1,12},{201016,1,1,12},{201017,1,1,12},{201019,1,1,12},{202000,1,1,70},{202001,1,1,70},{202002,1,1,70},{202003,1,1,70},{202006,1,1,70},{202010,1,1,12},{202011,1,1,12},{202012,1,1,12},{202013,1,1,12},{202015,1,1,12},{202016,1,1,12},{202017,1,1,12},{202019,1,1,12} | AK42: 202019 | AL42: 道士鞋子 | AM42: 1 | AN42: 1 | AO42: 1 | AP42: 12 | AQ42: ="{"&RC[-6]&","&RC[-3]&","&RC[-2]&","&RC[-1]&"}" -> {202019,1,1,12} | AR42: =R[-1]C&RC[-1] -> {200000,1,1,70},{200001,1,1,70},{200002,1,1,70},{200003,1,1,70},{200006,1,1,70},{200010,1,1,12},{200011,1,1,12},{200012,1,1,12},{200013,1,1,12},{200015,1,1,12},{200016,1,1,12},{200017,1,1,12},{200019,1,1,12},{201000,1,1,70},{201001,1,1,70},{201002,1,1,70},{201003,1,1,70},{201006,1,1,70},{201010,1,1,12},{201011,1,1,12},{201012,1,1,12},{201013,1,1,12},{201015,1,1,12},{201016,1,1,12},{201017,1,1,12},{201019,1,1,12},{202000,1,1,70},{202001,1,1,70},{202002,1,1,70},{202003,1,1,70},{202006,1,1,70},{202010,1,1,12},{202011,1,1,12},{202012,1,1,12},{202013,1,1,12},{202015,1,1,12},{202016,1,1,12},{202017,1,1,12},{202019,1,1,12}
O43: 金币 | P43: 概率／100
O44: 7 | P44: 100 | Q44: {0,[{10,100}],[{110009,1,1000,1}]}
S45: 110079 | T45: 黑铁矿+1 | V45: 1 | W45: 2 | X45: 3 | Y45: ="{"&RC[-6]&","&RC[-3]&","&RC[-2]&","&RC[-1]&"}," -> {110079,1,2,3}, | Z45: =RC[-1] -> {110079,1,2,3}, | AB45: 110079 | AC45: 黑铁矿+1 | AE45: 1 | AF45: 2 | AG45: 3 | AH45: ="{"&RC[-6]&","&RC[-3]&","&RC[-2]&","&RC[-1]&"}," -> {110079,1,2,3}, | AI45: =RC[-1] -> {110079,1,2,3}, | AK45: 110079 | AL45: 黑铁矿+1 | AN45: 1 | AO45: 2 | AP45: 3 | AQ45: ="{"&RC[-6]&","&RC[-3]&","&RC[-2]&","&RC[-1]&"}," -> {110079,1,2,3}, | AR45: =RC[-1] -> {110079,1,2,3},
Q46: ="["&R[-6]C&","&R[-4]C&","&R[-2]C&"]" -> [{0,[{1,100}],[{200000,1,1,60},{200001,1,1,60},{200002,1,1,60},{200003,1,1,60},{200006,1,1,60},{200010,1,1,5},{200011,1,1,5},{200012,1,1,5},{201000,1,1,60},{201001,1,1,60},{201002,1,1,60},{201003,1,1,60},{201006,1,1,60},{201010,1,1,5},{201011,1,1,5},{201012,1,1,5},{202000,1,1,60},{202001,1,1,60},{202002,1,1,60},{202003,1,1,60},{202006,1,1,60},{202010,1,1,5},{202011,1,1,5},{202012,1,1,5}]},{0,[{3,100}],[{110079,1,2,3},{110003,1,2,1},{110004,1,1,3},{110005,1,1,3},{110010,1,1,0},{110011,1,1,0},{110012,1,1,0}]},{0,[{10,100}],[{110009,1,1000,1}]}] | S46: 110003 | T46: 洗炼石 | V46: 1 | W46: 2 | X46: 1 | Y46: ="{"&RC[-6]&","&RC[-3]&","&RC[-2]&","&RC[-1]&"}," -> {110003,1,2,1}, | Z46: =R[-1]C&RC[-1] -> {110079,1,2,3},{110003,1,2,1}, | AB46: 110003 | AC46: 洗炼石 | AE46: 1 | AF46: 2 | AG46: 1 | AH46: ="{"&RC[-6]&","&RC[-3]&","&RC[-2]&","&RC[-1]&"}," -> {110003,1,2,1}, | AI46: =R[-1]C&RC[-1] -> {110079,1,2,3},{110003,1,2,1}, | AK46: 110003 | AL46: 洗炼石 | AN46: 1 | AO46: 2 | AP46: 1 | AQ46: ="{"&RC[-6]&","&RC[-3]&","&RC[-2]&","&RC[-1]&"}," -> {110003,1,2,1}, | AR46: =R[-1]C&RC[-1] -> {110079,1,2,3},{110003,1,2,1},
S47: 110004 | T47: 红药 | V47: 1 | W47: 1 | X47: 3 | Y47: ="{"&RC[-6]&","&RC[-3]&","&RC[-2]&","&RC[-1]&"}," -> {110004,1,1,3}, | Z47: =R[-1]C&RC[-1] -> {110079,1,2,3},{110003,1,2,1},{110004,1,1,3}, | AB47: 110004 | AC47: 红药 | AE47: 1 | AF47: 1 | AG47: 3 | AH47: ="{"&RC[-6]&","&RC[-3]&","&RC[-2]&","&RC[-1]&"}," -> {110004,1,1,3}, | AI47: =R[-1]C&RC[-1] -> {110079,1,2,3},{110003,1,2,1},{110004,1,1,3}, | AK47: 110004 | AL47: 红药 | AN47: 1 | AO47: 1 | AP47: 3 | AQ47: ="{"&RC[-6]&","&RC[-3]&","&RC[-2]&","&RC[-1]&"}," -> {110004,1,1,3}, | AR47: =R[-1]C&RC[-1] -> {110079,1,2,3},{110003,1,2,1},{110004,1,1,3},
S48: 110005 | T48: 蓝药 | V48: 1 | W48: 1 | X48: 3 | Y48: ="{"&RC[-6]&","&RC[-3]&","&RC[-2]&","&RC[-1]&"}," -> {110005,1,1,3}, | Z48: =R[-1]C&RC[-1] -> {110079,1,2,3},{110003,1,2,1},{110004,1,1,3},{110005,1,1,3}, | AB48: 110005 | AC48: 蓝药 | AE48: 1 | AF48: 1 | AG48: 3 | AH48: ="{"&RC[-6]&","&RC[-3]&","&RC[-2]&","&RC[-1]&"}," -> {110005,1,1,3}, | AI48: =R[-1]C&RC[-1] -> {110079,1,2,3},{110003,1,2,1},{110004,1,1,3},{110005,1,1,3}, | AK48: 110005 | AL48: 蓝药 | AN48: 1 | AO48: 1 | AP48: 3 | AQ48: ="{"&RC[-6]&","&RC[-3]&","&RC[-2]&","&RC[-1]&"}," -> {110005,1,1,3}, | AR48: =R[-1]C&RC[-1] -> {110079,1,2,3},{110003,1,2,1},{110004,1,1,3},{110005,1,1,3},
S49: 110010 | T49: 普通武装碎片 | V49: 1 | W49: 1 | X49: 0 | Y49: ="{"&RC[-6]&","&RC[-3]&","&RC[-2]&","&RC[-1]&"}," -> {110010,1,1,0}, | Z49: =R[-1]C&RC[-1] -> {110079,1,2,3},{110003,1,2,1},{110004,1,1,3},{110005,1,1,3},{110010,1,1,0}, | AB49: 110010 | AC49: 普通武装碎片 | AE49: 1 | AF49: 1 | AG49: 0 | AH49: ="{"&RC[-6]&","&RC[-3]&","&RC[-2]&","&RC[-1]&"}," -> {110010,1,1,0}, | AI49: =R[-1]C&RC[-1] -> {110079,1,2,3},{110003,1,2,1},{110004,1,1,3},{110005,1,1,3},{110010,1,1,0}, | AK49: 110010 | AL49: 普通武装碎片 | AN49: 1 | AO49: 1 | AP49: 0 | AQ49: ="{"&RC[-6]&","&RC[-3]&","&RC[-2]&","&RC[-1]&"}," -> {110010,1,1,0}, | AR49: =R[-1]C&RC[-1] -> {110079,1,2,3},{110003,1,2,1},{110004,1,1,3},{110005,1,1,3},{110010,1,1,0},
S50: 110011 | T50: 普通防具碎片 | V50: 1 | W50: 1 | X50: 0 | Y50: ="{"&RC[-6]&","&RC[-3]&","&RC[-2]&","&RC[-1]&"}," -> {110011,1,1,0}, | Z50: =R[-1]C&RC[-1] -> {110079,1,2,3},{110003,1,2,1},{110004,1,1,3},{110005,1,1,3},{110010,1,1,0},{110011,1,1,0}, | AB50: 110011 | AC50: 普通防具碎片 | AE50: 1 | AF50: 1 | AG50: 0 | AH50: ="{"&RC[-6]&","&RC[-3]&","&RC[-2]&","&RC[-1]&"}," -> {110011,1,1,0}, | AI50: =R[-1]C&RC[-1] -> {110079,1,2,3},{110003,1,2,1},{110004,1,1,3},{110005,1,1,3},{110010,1,1,0},{110011,1,1,0}, | AK50: 110011 | AL50: 普通防具碎片 | AN50: 1 | AO50: 1 | AP50: 0 | AQ50: ="{"&RC[-6]&","&RC[-3]&","&RC[-2]&","&RC[-1]&"}," -> {110011,1,1,0}, | AR50: =R[-1]C&RC[-1] -> {110079,1,2,3},{110003,1,2,1},{110004,1,1,3},{110005,1,1,3},{110010,1,1,0},{110011,1,1,0},
S51: 110012 | T51: 普通首饰碎片 | V51: 1 | W51: 1 | X51: 0 | Y51: ="{"&RC[-6]&","&RC[-3]&","&RC[-2]&","&RC[-1]&"}" -> {110012,1,1,0} | Z51: =R[-1]C&RC[-1] -> {110079,1,2,3},{110003,1,2,1},{110004,1,1,3},{110005,1,1,3},{110010,1,1,0},{110011,1,1,0},{110012,1,1,0} | AB51: 110012 | AC51: 普通首饰碎片 | AE51: 1 | AF51: 1 | AG51: 0 | AH51: ="{"&RC[-6]&","&RC[-3]&","&RC[-2]&","&RC[-1]&"}" -> {110012,1,1,0} | AI51: =R[-1]C&RC[-1] -> {110079,1,2,3},{110003,1,2,1},{110004,1,1,3},{110005,1,1,3},{110010,1,1,0},{110011,1,1,0},{110012,1,1,0} | AK51: 110012 | AL51: 普通首饰碎片 | AN51: 1 | AO51: 1 | AP51: 0 | AQ51: ="{"&RC[-6]&","&RC[-3]&","&RC[-2]&","&RC[-1]&"}" -> {110012,1,1,0} | AR51: =R[-1]C&RC[-1] -> {110079,1,2,3},{110003,1,2,1},{110004,1,1,3},{110005,1,1,3},{110010,1,1,0},{110011,1,1,0},{110012,1,1,0}
S54: BOSS怪掉落 | X54: 装备 | Y54: 概率／100 | AB54: BOSS怪掉落 | AG54: 装备 | AH54: 概率／100 | AK54: BOSS怪掉落 | AP54: 装备 | AQ54: 概率／100
X55: 1 | Y55: 100 | Z55: ="{0,[{"&RC[-2]&","&RC[-1]&"}],["&R[-13]C&"]}" -> {0,[{1,100}],[{200000,1,1,70},{200001,1,1,70},{200002,1,1,70},{200003,1,1,70},{200006,1,1,70},{200010,1,1,12},{200011,1,1,12},{200012,1,1,12},{200013,1,1,12},{200015,1,1,12},{200016,1,1,12},{200017,1,1,12},{200019,1,1,12},{201000,1,1,70},{201001,1,1,70},{201002,1,1,70},{201003,1,1,70},{201006,1,1,70},{201010,1,1,12},{201011,1,1,12},{201012,1,1,12},{201013,1,1,12},{201015,1,1,12},{201016,1,1,12},{201017,1,1,12},{201019,1,1,12},{202000,1,1,70},{202001,1,1,70},{202002,1,1,70},{202003,1,1,70},{202006,1,1,70},{202010,1,1,12},{202011,1,1,12},{202012,1,1,12},{202013,1,1,12},{202015,1,1,12},{202016,1,1,12},{202017,1,1,12},{202019,1,1,12}]} | AG55: 1 | AH55: 100 | AI55: ="{0,[{"&RC[-2]&","&RC[-1]&"}],["&R[-13]C&"]}" -> {0,[{1,100}],[{200000,1,1,70},{200001,1,1,70},{200002,1,1,70},{200003,1,1,70},{200006,1,1,70},{200010,1,1,12},{200011,1,1,12},{200012,1,1,12},{200013,1,1,12},{200015,1,1,12},{200016,1,1,12},{200017,1,1,12},{200019,1,1,12},{201000,1,1,70},{201001,1,1,70},{201002,1,1,70},{201003,1,1,70},{201006,1,1,70},{201010,1,1,12},{201011,1,1,12},{201012,1,1,12},{201013,1,1,12},{201015,1,1,12},{201016,1,1,12},{201017,1,1,12},{201019,1,1,12},{202000,1,1,70},{202001,1,1,70},{202002,1,1,70},{202003,1,1,70},{202006,1,1,70},{202010,1,1,12},{202011,1,1,12},{202012,1,1,12},{202013,1,1,12},{202015,1,1,12},{202016,1,1,12},{202017,1,1,12},{202019,1,1,12}]} | AP55: 1 | AQ55: 100 | AR55: ="{0,[{"&RC[-2]&","&RC[-1]&"}],["&R[-13]C&"]}" -> {0,[{1,100}],[{200000,1,1,70},{200001,1,1,70},{200002,1,1,70},{200003,1,1,70},{200006,1,1,70},{200010,1,1,12},{200011,1,1,12},{200012,1,1,12},{200013,1,1,12},{200015,1,1,12},{200016,1,1,12},{200017,1,1,12},{200019,1,1,12},{201000,1,1,70},{201001,1,1,70},{201002,1,1,70},{201003,1,1,70},{201006,1,1,70},{201010,1,1,12},{201011,1,1,12},{201012,1,1,12},{201013,1,1,12},{201015,1,1,12},{201016,1,1,12},{201017,1,1,12},{201019,1,1,12},{202000,1,1,70},{202001,1,1,70},{202002,1,1,70},{202003,1,1,70},{202006,1,1,70},{202010,1,1,12},{202011,1,1,12},{202012,1,1,12},{202013,1,1,12},{202015,1,1,12},{202016,1,1,12},{202017,1,1,12},{202019,1,1,12}]}
X56: 道具 | Y56: 概率／100 | AG56: 道具 | AH56: 概率／100 | AP56: 道具 | AQ56: 概率／100
X57: 3 | Y57: 100 | Z57: ="{0,[{"&RC[-2]&","&RC[-1]&"}],["&R[-6]C&"]}" -> {0,[{3,100}],[{110079,1,2,3},{110003,1,2,1},{110004,1,1,3},{110005,1,1,3},{110010,1,1,0},{110011,1,1,0},{110012,1,1,0}]} | AG57: 3 | AH57: 100 | AI57: ="{0,[{"&RC[-2]&","&RC[-1]&"}],["&R[-6]C&"]}" -> {0,[{3,100}],[{110079,1,2,3},{110003,1,2,1},{110004,1,1,3},{110005,1,1,3},{110010,1,1,0},{110011,1,1,0},{110012,1,1,0}]} | AP57: 3 | AQ57: 100 | AR57: ="{0,[{"&RC[-2]&","&RC[-1]&"}],["&R[-6]C&"]}" -> {0,[{3,100}],[{110079,1,2,3},{110003,1,2,1},{110004,1,1,3},{110005,1,1,3},{110010,1,1,0},{110011,1,1,0},{110012,1,1,0}]}
X58: 金币 | Y58: 概率／100 | AG58: 金币 | AH58: 概率／100 | AP58: 金币 | AQ58: 概率／100
X59: 7 | Y59: 100 | Z59: {0,[{10,100}],[{110009,1,1000,1}]} | AG59: 7 | AH59: 100 | AI59: {0,[{10,100}],[{110009,1,1000,1}]} | AP59: 7 | AQ59: 100 | AR59: {0,[{10,100}],[{110009,1,1000,1}]}
Z61: ="["&R[-6]C&","&R[-4]C&","&R[-2]C&"]" -> [{0,[{1,100}],[{200000,1,1,70},{200001,1,1,70},{200002,1,1,70},{200003,1,1,70},{200006,1,1,70},{200010,1,1,12},{200011,1,1,12},{200012,1,1,12},{200013,1,1,12},{200015,1,1,12},{200016,1,1,12},{200017,1,1,12},{200019,1,1,12},{201000,1,1,70},{201001,1,1,70},{201002,1,1,70},{201003,1,1,70},{201006,1,1,70},{201010,1,1,12},{201011,1,1,12},{201012,1,1,12},{201013,1,1,12},{201015,1,1,12},{201016,1,1,12},{201017,1,1,12},{201019,1,1,12},{202000,1,1,70},{202001,1,1,70},{202002,1,1,70},{202003,1,1,70},{202006,1,1,70},{202010,1,1,12},{202011,1,1,12},{202012,1,1,12},{202013,1,1,12},{202015,1,1,12},{202016,1,1,12},{202017,1,1,12},{202019,1,1,12}]},{0,[{3,100}],[{110079,1,2,3},{110003,1,2,1},{110004,1,1,3},{110005,1,1,3},{110010,1,1,0},{110011,1,1,0},{110012,1,1,0}]},{0,[{10,100}],[{110009,1,1000,1}]}] | AI61: ="["&R[-6]C&","&R[-4]C&","&R[-2]C&"]" -> [{0,[{1,100}],[{200000,1,1,70},{200001,1,1,70},{200002,1,1,70},{200003,1,1,70},{200006,1,1,70},{200010,1,1,12},{200011,1,1,12},{200012,1,1,12},{200013,1,1,12},{200015,1,1,12},{200016,1,1,12},{200017,1,1,12},{200019,1,1,12},{201000,1,1,70},{201001,1,1,70},{201002,1,1,70},{201003,1,1,70},{201006,1,1,70},{201010,1,1,12},{201011,1,1,12},{201012,1,1,12},{201013,1,1,12},{201015,1,1,12},{201016,1,1,12},{201017,1,1,12},{201019,1,1,12},{202000,1,1,70},{202001,1,1,70},{202002,1,1,70},{202003,1,1,70},{202006,1,1,70},{202010,1,1,12},{202011,1,1,12},{202012,1,1,12},{202013,1,1,12},{202015,1,1,12},{202016,1,1,12},{202017,1,1,12},{202019,1,1,12}]},{0,[{3,100}],[{110079,1,2,3},{110003,1,2,1},{110004,1,1,3},{110005,1,1,3},{110010,1,1,0},{110011,1,1,0},{110012,1,1,0}]},{0,[{10,100}],[{110009,1,1000,1}]}] | AR61: ="["&R[-6]C&","&R[-4]C&","&R[-2]C&"]" -> [{0,[{1,100}],[{200000,1,1,70},{200001,1,1,70},{200002,1,1,70},{200003,1,1,70},{200006,1,1,70},{200010,1,1,12},{200011,1,1,12},{200012,1,1,12},{200013,1,1,12},{200015,1,1,12},{200016,1,1,12},{200017,1,1,12},{200019,1,1,12},{201000,1,1,70},{201001,1,1,70},{201002,1,1,70},{201003,1,1,70},{201006,1,1,70},{201010,1,1,12},{201011,1,1,12},{201012,1,1,12},{201013,1,1,12},{201015,1,1,12},{201016,1,1,12},{201017,1,1,12},{201019,1,1,12},{202000,1,1,70},{202001,1,1,70},{202002,1,1,70},{202003,1,1,70},{202006,1,1,70},{202010,1,1,12},{202011,1,1,12},{202012,1,1,12},{202013,1,1,12},{202015,1,1,12},{202016,1,1,12},{202017,1,1,12},{202019,1,1,12}]},{0,[{3,100}],[{110079,1,2,3},{110003,1,2,1},{110004,1,1,3},{110005,1,1,3},{110010,1,1,0},{110011,1,1,0},{110012,1,1,0}]},{0,[{10,100}],[{110009,1,1000,1}]}]

Sheet: 工作表4
A1: 道具id | B1: 道具名称 | C1: 子类型 | D1: 品质 | E1: 等级限制
A2: 200000 | B2: 10级战士武器 | C2: 1 | D2: 1 | E2: 1
A3: 200001 | B3: 10级战士衣服 | C3: 2 | D3: 1 | E3: 2
A4: 200002 | B4: 10级战士头盔 | C4: 3 | D4: 1 | E4: 3
A5: 200003 | B5: 10级战士项链 | C5: 4 | D5: 1 | E5: 4
A6: 200004 | B6: 10级战士勋章 | C6: 5 | D6: 1 | E6: 5
A7: 200005 | B7: 10级战士手镯 | C7: 6 | D7: 1 | E7: 6
A8: 200006 | B8: 10级战士戒指 | C8: 7 | D8: 1 | E8: 7
A9: 200007 | B9: 10级战士腰带 | C9: 8 | D9: 1 | E9: 8
A10: 200008 | B10: 10级战士裤子 | C10: 9 | D10: 1 | E10: 9
A11: 200009 | B11: 10级战士鞋子 | C11: 10 | D11: 1 | E11: 10
A12: 200010 | B12: 20级战士武器 | C12: 1 | D12: 1 | E12: 11
A13: 200011 | B13: 20级战士衣服 | C13: 2 | D13: 1 | E13: 12
A14: 200012 | B14: 20级战士头盔 | C14: 3 | D14: 1 | E14: 13
A15: 200013 | B15: 20级战士项链 | C15: 4 | D15: 1 | E15: 14
A16: 200014 | B16: 20级战士勋章 | C16: 5 | D16: 1 | E16: 15
A17: 200015 | B17: 20级战士手镯 | C17: 6 | D17: 1 | E17: 16
A18: 200016 | B18: 20级战士戒指 | C18: 7 | D18: 1 | E18: 17
A19: 200017 | B19: 20级战士腰带 | C19: 8 | D19: 1 | E19: 18
A20: 200018 | B20: 20级战士裤子 | C20: 9 | D20: 1 | E20: 19
A21: 200019 | B21: 20级战士鞋子 | C21: 10 | D21: 1 | E21: 20
A22: 200020 | B22: 30级战士武器 | C22: 1 | D22: 2 | E22: 21
A23: 200021 | B23: 30级战士衣服 | C23: 2 | D23: 2 | E23: 22
A24: 200022 | B24: 30级战士头盔 | C24: 3 | D24: 2 | E24: 23
A25: 200023 | B25: 30级战士项链 | C25: 4 | D25: 2 | E25: 24
A26: 200024 | B26: 30级战士勋章 | C26: 5 | D26: 2 | E26: 25
A27: 200025 | B27: 30级战士手镯 | C27: 6 | D27: 2 | E27: 26
A28: 200026 | B28: 30级战士戒指 | C28: 7 | D28: 2 | E28: 27
A29: 200027 | B29: 30级战士腰带 | C29: 8 | D29: 2 | E29: 28
A30: 200028 | B30: 30级战士裤子 | C30: 9 | D30: 2 | E30: 29
A31: 200029 | B31: 30级战士鞋子 | C31: 10 | D31: 2 | E31: 30
A32: 200030 | B32: 40级战士武器 | C32: 1 | D32: 3 | E32: 31
A33: 200031 | B33: 40级战士衣服 | C33: 2 | D33: 3 | E33: 32
A34: 200032 | B34: 40级战士头盔 | C34: 3 | D34: 3 | E34: 33
A35: 200033 | B35: 40级战士项链 | C35: 4 | D35: 3 | E35: 34
A36: 200034 | B36: 40级战士勋章 | C36: 5 | D36: 3 | E36: 35
A37: 200035 | B37: 40级战士手镯 | C37: 6 | D37: 3 | E37: 36
A38: 200036 | B38: 40级战士戒指 | C38: 7 | D38: 3 | E38: 37
A39: 200037 | B39: 40级战士腰带 | C39: 8 | D39: 3 | E39: 38
A40: 200038 | B40: 40级战士裤子 | C40: 9 | D40: 3 | E40: 39
A41: 200039 | B41: 40级战士鞋子 | C41: 10 | D41: 3 | E41: 40
A42: 200040 | B42: 50级战士武器 | C42: 1 | D42: 4 | E42: 41
A43: 200041 | B43: 50级战士衣服 | C43: 2 | D43: 4 | E43: 42
A44: 200042 | B44: 50级战士头盔 | C44: 3 | D44: 4 | E44: 43
A45: 200043 | B45: 50级战士项链 | C45: 4 | D45: 4 | E45: 44
A46: 200044 | B46: 50级战士勋章 | C46: 5 | D46: 4 | E46: 45
A47: 200045 | B47: 50级战士手镯 | C47: 6 | D47: 4 | E47: 46
A48: 200046 | B48: 50级战士戒指 | C48: 7 | D48: 4 | E48: 47
A49: 200047 | B49: 50级战士腰带 | C49: 8 | D49: 4 | E49: 48
A50: 200048 | B50: 50级战士裤子 | C50: 9 | D50: 4 | E50: 49
A51: 200049 | B51: 50级战士鞋子 | C51: 10 | D51: 4 | E51: 50
A52: 200050 | B52: 60级战士武器 | C52: 1 | D52: 5 | E52: 51
A53: 200051 | B53: 60级战士衣服 | C53: 2 | D53: 5 | E53: 52
A54: 200052 | B54: 60级战士头盔 | C54: 3 | D54: 5 | E54: 53
A55: 200053 | B55: 60级战士项链 | C55: 4 | D55: 5 | E55: 54
A56: 200054 | B56: 60级战士勋章 | C56: 5 | D56: 5 | E56: 55
A57: 200055 | B57: 60级战士手镯 | C57: 6 | D57: 5 | E57: 56
A58: 200056 | B58: 60级战士戒指 | C58: 7 | D58: 5 | E58: 57
A59: 200057 | B59: 60级战士腰带 | C59: 8 | D59: 5 | E59: 58
A60: 200058 | B60: 60级战士裤子 | C60: 9 | D60: 5 | E60: 59
A61: 200059 | B61: 60级战士鞋子 | C61: 10 | D61: 5 | E61: 60
A62: 200060 | B62: 70级战士武器 | C62: 1 | D62: 5 | E62: 61
A63: 200061 | B63: 70级战士衣服 | C63: 2 | D63: 5 | E63: 62
A64: 200062 | B64: 70级战士头盔 | C64: 3 | D64: 5 | E64: 63
A65: 200063 | B65: 70级战士项链 | C65: 4 | D65: 5 | E65: 64
A66: 200064 | B66: 70级战士勋章 | C66: 5 | D66: 5 | E66: 65
A67: 200065 | B67: 70级战士手镯 | C67: 6 | D67: 5 | E67: 66
A68: 200066 | B68: 70级战士戒指 | C68: 7 | D68: 5 | E68: 67
A69: 200067 | B69: 70级战士腰带 | C69: 8 | D69: 5 | E69: 68
A70: 200068 | B70: 70级战士裤子 | C70: 9 | D70: 5 | E70: 69
A71: 200069 | B71: 70级战士鞋子 | C71: 10 | D71: 5 | E71: 70
A72: 200070 | B72: 80级战士武器 | C72: 1 | D72: 5 | E72: 71
A73: 200071 | B73: 80级战士衣服 | C73: 2 | D73: 5 | E73: 72
A74: 200072 | B74: 80级战士头盔 | C74: 3 | D74: 5 | E74: 73
A75: 200073 | B75: 80级战士项链 | C75: 4 | D75: 5 | E75: 74
A76: 200074 | B76: 80级战士勋章 | C76: 5 | D76: 5 | E76: 75
A77: 200075 | B77: 80级战士手镯 | C77: 6 | D77: 5 | E77: 76
A78: 200076 | B78: 80级战士戒指 | C78: 7 | D78: 5 | E78: 77
A79: 200077 | B79: 80级战士腰带 | C79: 8 | D79: 5 | E79: 78
A80: 200078 | B80: 80级战士裤子 | C80: 9 | D80: 5 | E80: 79
A81: 200079 | B81: 80级战士鞋子 | C81: 10 | D81: 5 | E81: 80
A82: 200080 | B82: 90级战士武器 | C82: 1 | D82: 5 | E82: 81
A83: 200081 | B83: 90级战士衣服 | C83: 2 | D83: 5 | E83: 82
A84: 200082 | B84: 90级战士头盔 | C84: 3 | D84: 5 | E84: 83
A85: 200083 | B85: 90级战士项链 | C85: 4 | D85: 5 | E85: 84
A86: 200084 | B86: 90级战士勋章 | C86: 5 | D86: 5 | E86: 85
A87: 200085 | B87: 90级战士手镯 | C87: 6 | D87: 5 | E87: 86
A88: 200086 | B88: 90级战士戒指 | C88: 7 | D88: 5 | E88: 87
A89: 200087 | B89: 90级战士腰带 | C89: 8 | D89: 5 | E89: 88
A90: 200088 | B90: 90级战士裤子 | C90: 9 | D90: 5 | E90: 89
A91: 200089 | B91: 90级战士鞋子 | C91: 10 | D91: 5 | E91: 90
A92: 200090 | B92: 100级战士武器 | C92: 1 | D92: 5 | E92: 91
A93: 200091 | B93: 100级战士衣服 | C93: 2 | D93: 5 | E93: 92
A94: 200092 | B94: 100级战士头盔 | C94: 3 | D94: 5 | E94: 93
A95: 200093 | B95: 100级战士项链 | C95: 4 | D95: 5 | E95: 94
A96: 200094 | B96: 100级战士勋章 | C96: 5 | D96: 5 | E96: 95
A97: 200095 | B97: 100级战士手镯 | C97: 6 | D97: 5 | E97: 96
A98: 200096 | B98: 100级战士戒指 | C98: 7 | D98: 5 | E98: 97
A99: 200097 | B99: 100级战士腰带 | C99: 8 | D99: 5 | E99: 98
A100: 200098 | B100: 100级战士裤子 | C100: 9 | D100: 5 | E100: 99
A101: 200099 | B101: 100级战士鞋子 | C101: 10 | D101: 5 | E101: 100
A102: 201000 | B102: 10级法师武器 | C102: 1 | D102: 1 | E102: 1
A103: 201001 | B103: 10级法师衣服 | C103: 2 | D103: 1 | E103: 2
A104: 201002 | B104: 10级法师头盔 | C104: 3 | D104: 1 | E104: 3
A105: 201003 | B105: 10级法师项链 | C105: 4 | D105: 1 | E105: 4
A106: 201004 | B106: 10级法师勋章 | C106: 5 | D106: 1 | E106: 5
A107: 201005 | B107: 10级法师手镯 | C107: 6 | D107: 1 | E107: 6
A108: 201006 | B108: 10级法师戒指 | C108: 7 | D108: 1 | E108: 7
A109: 201007 | B109: 10级法师腰带 | C109: 8 | D109: 1 | E109: 8
A110: 201008 | B110: 10级法师裤子 | C110: 9 | D110: 1 | E110: 9
A111: 201009 | B111: 10级法师鞋子 | C111: 10 | D111: 1 | E111: 10
A112: 201010 | B112: 20级法师武器 | C112: 1 | D112: 1 | E112: 11
A113: 201011 | B113: 20级法师衣服 | C113: 2 | D113: 1 | E113: 12
A114: 201012 | B114: 20级法师头盔 | C114: 3 | D114: 1 | E114: 13
A115: 201013 | B115: 20级法师项链 | C115: 4 | D115: 1 | E115: 14
A116: 201014 | B116: 20级法师勋章 | C116: 5 | D116: 1 | E116: 15
A117: 201015 | B117: 20级法师手镯 | C117: 6 | D117: 1 | E117: 16
A118: 201016 | B118: 20级法师戒指 | C118: 7 | D118: 1 | E118: 17
A119: 201017 | B119: 20级法师腰带 | C119: 8 | D119: 1 | E119: 18
A120: 201018 | B120: 20级法师裤子 | C120: 9 | D120: 1 | E120: 19
A121: 201019 | B121: 20级法师鞋子 | C121: 10 | D121: 1 | E121: 20
A122: 201020 | B122: 30级法师武器 | C122: 1 | D122: 2 | E122: 21
A123: 201021 | B123: 30级法师衣服 | C123: 2 | D123: 2 | E123: 22
A124: 201022 | B124: 30级法师头盔 | C124: 3 | D124: 2 | E124: 23
A125: 201023 | B125: 30级法师项链 | C125: 4 | D125: 2 | E125: 24
A126: 201024 | B126: 30级法师勋章 | C126: 5 | D126: 2 | E126: 25
A127: 201025 | B127: 30级法师手镯 | C127: 6 | D127: 2 | E127: 26
A128: 201026 | B128: 30级法师戒指 | C128: 7 | D128: 2 | E128: 27
A129: 201027 | B129: 30级法师腰带 | C129: 8 | D129: 2 | E129: 28
A130: 201028 | B130: 30级法师裤子 | C130: 9 | D130: 2 | E130: 29
A131: 201029 | B131: 30级法师鞋子 | C131: 10 | D131: 2 | E131: 30
A132: 201030 | B132: 40级法师武器 | C132: 1 | D132: 3 | E132: 31
A133: 201031 | B133: 40级法师衣服 | C133: 2 | D133: 3 | E133: 32
A134: 201032 | B134: 40级法师头盔 | C134: 3 | D134: 3 | E134: 33
A135: 201033 | B135: 40级法师项链 | C135: 4 | D135: 3 | E135: 34
A136: 201034 | B136: 40级法师勋章 | C136: 5 | D136: 3 | E136: 35
A137: 201035 | B137: 40级法师手镯 | C137: 6 | D137: 3 | E137: 36
A138: 201036 | B138: 40级法师戒指 | C138: 7 | D138: 3 | E138: 37
A139: 201037 | B139: 40级法师腰带 | C139: 8 | D139: 3 | E139: 38
A140: 201038 | B140: 40级法师裤子 | C140: 9 | D140: 3 | E140: 39
A141: 201039 | B141: 40级法师鞋子 | C141: 10 | D141: 3 | E141: 40
A142: 201040 | B142: 50级法师武器 | C142: 1 | D142: 4 | E142: 41
A143: 201041 | B143: 50级法师衣服 | C143: 2 | D143: 4 | E143: 42
A144: 201042 | B144: 50级法师头盔 | C144: 3 | D144: 4 | E144: 43
A145: 201043 | B145: 50级法师项链 | C145: 4 | D145: 4 | E145: 44
A146: 201044 | B146: 50级法师勋章 | C146: 5 | D146: 4 | E146: 45
A147: 201045 | B147: 50级法师手镯 | C147: 6 | D147: 4 | E147: 46
A148: 201046 | B148: 50级法师戒指 | C148: 7 | D148: 4 | E148: 47
A149: 201047 | B149: 50级法师腰带 | C149: 8 | D149: 4 | E149: 48
A150: 201048 | B150: 50级法师裤子 | C150: 9 | D150: 4 | E150: 49
A151: 201049 | B151: 50级法师鞋子 | C151: 10 | D151: 4 | E151: 50
A152: 201050 | B152: 60级法师武器 | C152: 1 | D152: 5 | E152: 51
A153: 201051 | B153: 60级法师衣服 | C153: 2 | D153: 5 | E153: 52
A154: 201052 | B154: 60级法师头盔 | C154: 3 | D154: 5 | E154: 53
A155: 201053 | B155: 60级法师项链 | C155: 4 | D155: 5 | E155: 54
A156: 201054 | B156: 60级法师勋章 | C156: 5 | D156: 5 | E156: 55
A157: 201055 | B157: 60级法师手镯 | C157: 6 | D157: 5 | E157: 56
A158: 201056 | B158: 60级法师戒指 | C158: 7 | D158: 5 | E158: 57
A159: 201057 | B159: 60级法师腰带 | C159: 8 | D159: 5 | E159: 58
A160: 201058 | B160: 60级法师裤子 | C160: 9 | D160: 5 | E160: 59
A161: 201059 | B161: 60级法师鞋子 | C161: 10 | D161: 5 | E161: 60
A162: 201060 | B162: 70级法师武器 | C162: 1 | D162: 5 | E162: 61
A163: 201061 | B163: 70级法师衣服 | C163: 2 | D163: 5 | E163: 62
A164: 201062 | B164: 70级法师头盔 | C164: 3 | D164: 5 | E164: 63
A165: 201063 | B165: 70级法师项链 | C165: 4 | D165: 5 | E165: 64
A166: 201064 | B166: 70级法师勋章 | C166: 5 | D166: 5 | E166: 65
A167: 201065 | B167: 70级法师手镯 | C167: 6 | D167: 5 | E167: 66
A168: 201066 | B168: 70级法师戒指 | C168: 7 | D168: 5 | E168: 67
A169: 201067 | B169: 70级法师腰带 | C169: 8 | D169: 5 | E169: 68
A170: 201068 | B170: 70级法师裤子 | C170: 9 | D170: 5 | E170: 69
A171: 201069 | B171: 70级法师鞋子 | C171: 10 | D171: 5 | E171: 70
A172: 201070 | B172: 80级法师武器 | C172: 1 | D172: 5 | E172: 71
A173: 201071 | B173: 80级法师衣服 | C173: 2 | D173: 5 | E173: 72
A174: 201072 | B174: 80级法师头盔 | C174: 3 | D174: 5 | E174: 73
A175: 201073 | B175: 80级法师项链 | C175: 4 | D175: 5 | E175: 74
A176: 201074 | B176: 80级法师勋章 | C176: 5 | D176: 5 | E176: 75
A177: 201075 | B177: 80级法师手镯 | C177: 6 | D177: 5 | E177: 76
A178: 201076 | B178: 80级法师戒指 | C178: 7 | D178: 5 | E178: 77
A179: 201077 | B179: 80级法师腰带 | C179: 8 | D179: 5 | E179: 78
A180: 201078 | B180: 80级法师裤子 | C180: 9 | D180: 5 | E180: 79
A181: 201079 | B181: 80级法师鞋子 | C181: 10 | D181: 5 | E181: 80
A182: 201080 | B182: 90级法师武器 | C182: 1 | D182: 5 | E182: 81
A183: 201081 | B183: 90级法师衣服 | C183: 2 | D183: 5 | E183: 82
A184: 201082 | B184: 90级法师头盔 | C184: 3 | D184: 5 | E184: 83
A185: 201083 | B185: 90级法师项链 | C185: 4 | D185: 5 | E185: 84
A186: 201084 | B186: 90级法师勋章 | C186: 5 | D186: 5 | E186: 85
A187: 201085 | B187: 90级法师手镯 | C187: 6 | D187: 5 | E187: 86
A188: 201086 | B188: 90级法师戒指 | C188: 7 | D188: 5 | E188: 87
A189: 201087 | B189: 90级法师腰带 | C189: 8 | D189: 5 | E189: 88
A190: 201088 | B190: 90级法师裤子 | C190: 9 | D190: 5 | E190: 89
A191: 201089 | B191: 90级法师鞋子 | C191: 10 | D191: 5 | E191: 90
A192: 201090 | B192: 100级法师武器 | C192: 1 | D192: 5 | E192: 91
A193: 201091 | B193: 100级法师衣服 | C193: 2 | D193: 5 | E193: 92
A194: 201092 | B194: 100级法师头盔 | C194: 3 | D194: 5 | E194: 93
A195: 201093 | B195: 100级法师项链 | C195: 4 | D195: 5 | E195: 94
A196: 201094 | B196: 100级法师勋章 | C196: 5 | D196: 5 | E196: 95
A197: 201095 | B197: 100级法师手镯 | C197: 6 | D197: 5 | E197: 96
A198: 201096 | B198: 100级法师戒指 | C198: 7 | D198: 5 | E198: 97
A199: 201097 | B199: 100级法师腰带 | C199: 8 | D199: 5 | E199: 98
A200: 201098 | B200: 100级法师裤子 | C200: 9 | D200: 5 | E200: 99
A201: 201099 | B201: 100级法师鞋子 | C201: 10 | D201: 5 | E201: 100
A202: 202000 | B202: 10级道士武器 | C202: 1 | D202: 1 | E202: 1
A203: 202001 | B203: 10级道士衣服 | C203: 2 | D203: 1 | E203: 2
A204: 202002 | B204: 10级道士头盔 | C204: 3 | D204: 1 | E204: 3
A205: 202003 | B205: 10级道士项链 | C205: 4 | D205: 1 | E205: 4
A206: 202004 | B206: 10级道士勋章 | C206: 5 | D206: 1 | E206: 5
A207: 202005 | B207: 10级道士手镯 | C207: 6 | D207: 1 | E207: 6
A208: 202006 | B208: 10级道士戒指 | C208: 7 | D208: 1 | E208: 7
A209: 202007 | B209: 10级道士腰带 | C209: 8 | D209: 1 | E209: 8
A210: 202008 | B210: 10级道士裤子 | C210: 9 | D210: 1 | E210: 9
A211: 202009 | B211: 10级道士鞋子 | C211: 10 | D211: 1 | E211: 10
A212: 202010 | B212: 20级道士武器 | C212: 1 | D212: 1 | E212: 11
A213: 202011 | B213: 20级道士衣服 | C213: 2 | D213: 1 | E213: 12
A214: 202012 | B214: 20级道士头盔 | C214: 3 | D214: 1 | E214: 13
A215: 202013 | B215: 20级道士项链 | C215: 4 | D215: 1 | E215: 14
A216: 202014 | B216: 20级道士勋章 | C216: 5 | D216: 1 | E216: 15
A217: 202015 | B217: 20级道士手镯 | C217: 6 | D217: 1 | E217: 16
A218: 202016 | B218: 20级道士戒指 | C218: 7 | D218: 1 | E218: 17
A219: 202017 | B219: 20级道士腰带 | C219: 8 | D219: 1 | E219: 18
A220: 202018 | B220: 20级道士裤子 | C220: 9 | D220: 1 | E220: 19
A221: 202019 | B221: 20级道士鞋子 | C221: 10 | D221: 1 | E221: 20
A222: 202020 | B222: 30级道士武器 | C222: 1 | D222: 2 | E222: 21
A223: 202021 | B223: 30级道士衣服 | C223: 2 | D223: 2 | E223: 22
A224: 202022 | B224: 30级道士头盔 | C224: 3 | D224: 2 | E224: 23
A225: 202023 | B225: 30级道士项链 | C225: 4 | D225: 2 | E225: 24
A226: 202024 | B226: 30级道士勋章 | C226: 5 | D226: 2 | E226: 25
A227: 202025 | B227: 30级道士手镯 | C227: 6 | D227: 2 | E227: 26
A228: 202026 | B228: 30级道士戒指 | C228: 7 | D228: 2 | E228: 27
A229: 202027 | B229: 30级道士腰带 | C229: 8 | D229: 2 | E229: 28
A230: 202028 | B230: 30级道士裤子 | C230: 9 | D230: 2 | E230: 29
A231: 202029 | B231: 30级道士鞋子 | C231: 10 | D231: 2 | E231: 30
A232: 202030 | B232: 40级道士武器 | C232: 1 | D232: 3 | E232: 31
A233: 202031 | B233: 40级道士衣服 | C233: 2 | D233: 3 | E233: 32
A234: 202032 | B234: 40级道士头盔 | C234: 3 | D234: 3 | E234: 33
A235: 202033 | B235: 40级道士项链 | C235: 4 | D235: 3 | E235: 34
A236: 202034 | B236: 40级道士勋章 | C236: 5 | D236: 3 | E236: 35
A237: 202035 | B237: 40级道士手镯 | C237: 6 | D237: 3 | E237: 36
A238: 202036 | B238: 40级道士戒指 | C238: 7 | D238: 3 | E238: 37
A239: 202037 | B239: 40级道士腰带 | C239: 8 | D239: 3 | E239: 38
A240: 202038 | B240: 40级道士裤子 | C240: 9 | D240: 3 | E240: 39
A241: 202039 | B241: 40级道士鞋子 | C241: 10 | D241: 3 | E241: 40
A242: 202040 | B242: 50级道士武器 | C242: 1 | D242: 4 | E242: 41
A243: 202041 | B243: 50级道士衣服 | C243: 2 | D243: 4 | E243: 42
A244: 202042 | B244: 50级道士头盔 | C244: 3 | D244: 4 | E244: 43
A245: 202043 | B245: 50级道士项链 | C245: 4 | D245: 4 | E245: 44
A246: 202044 | B246: 50级道士勋章 | C246: 5 | D246: 4 | E246: 45
A247: 202045 | B247: 50级道士手镯 | C247: 6 | D247: 4 | E247: 46
A248: 202046 | B248: 50级道士戒指 | C248: 7 | D248: 4 | E248: 47
A249: 202047 | B249: 50级道士腰带 | C249: 8 | D249: 4 | E249: 48
A250: 202048 | B250: 50级道士裤子 | C250: 9 | D250: 4 | E250: 49
A251: 202049 | B251: 50级道士鞋子 | C251: 10 | D251: 4 | E251: 50
A252: 202050 | B252: 60级道士武器 | C252: 1 | D252: 5 | E252: 51
A253: 202051 | B253: 60级道士衣服 | C253: 2 | D253: 5 | E253: 52
A254: 202052 | B254: 60级道士头盔 | C254: 3 | D254: 5 | E254: 53
A255: 202053 | B255: 60级道士项链 | C255: 4 | D255: 5 | E255: 54
A256: 202054 | B256: 60级道士勋章 | C256: 5 | D256: 5 | E256: 55
A257: 202055 | B257: 60级道士手镯 | C257: 6 | D257: 5 | E257: 56
A258: 202056 | B258: 60级道士戒指 | C258: 7 | D258: 5 | E258: 57
A259: 202057 | B259: 60级道士腰带 | C259: 8 | D259: 5 | E259: 58
A260: 202058 | B260: 60级道士裤子 | C260: 9 | D260: 5 | E260: 59
A261: 202059 | B261: 60级道士鞋子 | C261: 10 | D261: 5 | E261: 60
A262: 202060 | B262: 70级道士武器 | C262: 1 | D262: 5 | E262: 61
A263: 202061 | B263: 70级道士衣服 | C263: 2 | D263: 5 | E263: 62
A264: 202062 | B264: 70级道士头盔 | C264: 3 | D264: 5 | E264: 63
A265: 202063 | B265: 70级道士项链 | C265: 4 | D265: 5 | E265: 64
A266: 202064 | B266: 70级道士勋章 | C266: 5 | D266: 5 | E266: 65
A267: 202065 | B267: 70级道士手镯 | C267: 6 | D267: 5 | E267: 66
A268: 202066 | B268: 70级道士戒指 | C268: 7 | D268: 5 | E268: 67
A269: 202067 | B269: 70级道士腰带 | C269: 8 | D269: 5 | E269: 68
A270: 202068 | B270: 70级道士裤子 | C270: 9 | D270: 5 | E270: 69
A271: 202069 | B271: 70级道士鞋子 | C271: 10 | D271: 5 | E271: 70
A272: 202070 | B272: 80级道士武器 | C272: 1 | D272: 5 | E272: 71
A273: 202071 | B273: 80级道士衣服 | C273: 2 | D273: 5 | E273: 72
A274: 202072 | B274: 80级道士头盔 | C274: 3 | D274: 5 | E274: 73
A275: 202073 | B275: 80级道士项链 | C275: 4 | D275: 5 | E275: 74
A276: 202074 | B276: 80级道士勋章 | C276: 5 | D276: 5 | E276: 75
A277: 202075 | B277: 80级道士手镯 | C277: 6 | D277: 5 | E277: 76
A278: 202076 | B278: 80级道士戒指 | C278: 7 | D278: 5 | E278: 77
A279: 202077 | B279: 80级道士腰带 | C279: 8 | D279: 5 | E279: 78
A280: 202078 | B280: 80级道士裤子 | C280: 9 | D280: 5 | E280: 79
A281: 202079 | B281: 80级道士鞋子 | C281: 10 | D281: 5 | E281: 80
A282: 202080 | B282: 90级道士武器 | C282: 1 | D282: 5 | E282: 81
A283: 202081 | B283: 90级道士衣服 | C283: 2 | D283: 5 | E283: 82
A284: 202082 | B284: 90级道士头盔 | C284: 3 | D284: 5 | E284: 83
A285: 202083 | B285: 90级道士项链 | C285: 4 | D285: 5 | E285: 84
A286: 202084 | B286: 90级道士勋章 | C286: 5 | D286: 5 | E286: 85
A287: 202085 | B287: 90级道士手镯 | C287: 6 | D287: 5 | E287: 86
A288: 202086 | B288: 90级道士戒指 | C288: 7 | D288: 5 | E288: 87
A289: 202087 | B289: 90级道士腰带 | C289: 8 | D289: 5 | E289: 88
A290: 202088 | B290: 90级道士裤子 | C290: 9 | D290: 5 | E290: 89
A291: 202089 | B291: 90级道士鞋子 | C291: 10 | D291: 5 | E291: 90
A292: 202090 | B292: 100级道士武器 | C292: 1 | D292: 5 | E292: 91
A293: 202091 | B293: 100级道士衣服 | C293: 2 | D293: 5 | E293: 92
A294: 202092 | B294: 100级道士头盔 | C294: 3 | D294: 5 | E294: 93
A295: 202093 | B295: 100级道士项链 | C295: 4 | D295: 5 | E295: 94
A296: 202094 | B296: 100级道士勋章 | C296: 5 | D296: 5 | E296: 95
A297: 202095 | B297: 100级道士手镯 | C297: 6 | D297: 5 | E297: 96
A298: 202096 | B298: 100级道士戒指 | C298: 7 | D298: 5 | E298: 97
A299: 202097 | B299: 100级道士腰带 | C299: 8 | D299: 5 | E299: 98
A300: 202098 | B300: 100级道士裤子 | C300: 9 | D300: 5 | E300: 99
A301: 202099 | B301: 100级道士鞋子 | C301: 10 | D301: 5 | E301: 100
A302: 303000 | B302: 1级翅膀 | C302: 13 | D302: 1 | E302: 1
A303: 303001 | B303: 2级翅膀 | C303: 13 | D303: 1 | E303: 1
A304: 303002 | B304: 3级翅膀 | C304: 13 | D304: 2 | E304: 1
A305: 303003 | B305: 4级翅膀 | C305: 13 | D305: 2 | E305: 1
A306: 303004 | B306: 5级翅膀 | C306: 13 | D306: 3 | E306: 1
A307: 303005 | B307: 6级翅膀 | C307: 13 | D307: 3 | E307: 1
A308: 303006 | B308: 7级翅膀 | C308: 13 | D308: 4 | E308: 1
A309: 303007 | B309: 8级翅膀 | C309: 13 | D309: 4 | E309: 1
A310: 303008 | B310: 9级翅膀 | C310: 13 | D310: 5 | E310: 1
A311: 303009 | B311: 10级翅膀 | C311: 13 | D311: 5 | E311: 1
A312: 304000 | B312: 1级宠物 | C312: 14 | D312: 1 | E312: 1
A313: 304001 | B313: 2级宠物 | C313: 14 | D313: 1 | E313: 1
A314: 304002 | B314: 3级宠物 | C314: 14 | D314: 2 | E314: 1
A315: 304003 | B315: 4级宠物 | C315: 14 | D315: 2 | E315: 1
A316: 304004 | B316: 5级宠物 | C316: 14 | D316: 3 | E316: 1
A317: 304005 | B317: 6级宠物 | C317: 14 | D317: 3 | E317: 1
A318: 304006 | B318: 7级宠物 | C318: 14 | D318: 4 | E318: 1
A319: 304007 | B319: 8级宠物 | C319: 14 | D319: 4 | E319: 1
A320: 304008 | B320: 9级宠物 | C320: 14 | D320: 5 | E320: 1
A321: 304009 | B321: 10级宠物 | C321: 14 | D321: 5 | E321: 1