Sheet: taskreward
A1: id | B1: group | C1: weights | D1: min_num | E1: day_num | F1: server_num | G1: goods | H1: is_log | I1: name | J1: notice_info | K1: is_notice
A2: id | G2: goods
A3: ID | B3: 组 | C3: 权重 | D3: 玩家保底次数 | E3: 每日限制次数 | F3: 全服达到必出次数 | G3: 奖励物品信息 | H3: 是否保存记录 | I3: 物品名称 | J3: 公告内容 | K3: 是否公告 | R3: 折扣 | S3: 0.67 | T3: =1500*RC[-1] -> 1005
A4: 1 | B4: 1 | C4: 200 | D4: 0 | E4: 0 | F4: 0 | G4: [{110219,0,1}] | H4: 0 | I4: 超级经验丹*1 | K4: 0 | R4: 次数 | S4: =1500/(20/R[-1]C-20) -> 152.272727272727
A5: 2 | B5: 1 | C5: 60 | D5: 0 | E5: 0 | F5: 0 | G5: [{110088,0,1}] | H5: 1 | I5: 黑铁矿+10*1 | K5: 0 | L5: 第一个代表玩家名字，第二个代表物品名字*数量
A6: 3 | B6: 1 | C6: 75 | D6: 0 | E6: 0 | F6: 0 | G6: [{110091,0,1}] | H6: 1 | I6: 玄冰铁+3*1 | K6: 0
A7: 4 | B7: 1 | C7: 150 | D7: 0 | E7: 0 | F7: 0 | G7: [{110160,0,2}] | H7: 0 | I7: 铸魂精华*2 | K7: 0 | S7: =25*79 -> 1975
A8: 5 | B8: 1 | C8: 1 | D8: 100 | E8: 0 | F8: 211 | G8: [{110147,0,1}] | H8: 1 | I8: 超级祝福油*1 | J8: 可喜可贺，~s在幸运大转盘中抽到了~s，令人羡慕不已！ | K8: 1 | S8: 1500
A9: 6 | B9: 1 | C9: 60 | D9: 0 | E9: 0 | F9: 0 | G9: [{110050,0,1}] | H9: 1 | I9: 金砖*1 | K9: 0 | S9: =R[-2]C+R[-1]C -> 3475
A10: 7 | B10: 1 | C10: 150 | D10: 0 | E10: 0 | F10: 0 | G10: [{110193,0,4}] | H10: 0 | I10: 万年雪参*4 | K10: 0 | S10: =R[-1]C/20 -> 173.75
A11: 8 | B11: 1 | C11: 2 | D11: 50 | E11: 0 | F11: 60 | G11: [{110109,0,1}] | H11: 1 | I11: 金刚石*1 | J11: 可喜可贺，~s在幸运大转盘中抽到了~s，令人羡慕不已！ | K11: 1
A12: 9 | B12: 2 | C12: 90 | D12: 0 | E12: 0 | F12: 0 | G12: [{110194,0,2}] | H12: 0 | I12: 疗伤药*2 | K12: 0
A13: 10 | B13: 2 | C13: 75 | D13: 0 | E13: 0 | F13: 0 | G13: [{110160,0,5}] | H13: 1 | I13: 铸魂精华*5 | K13: 0 | R13: 个人保底组数 | S13: 15 | U13: 个人+全服保底组数 | V13: 6
A14: 11 | B14: 2 | C14: 75 | D14: 0 | E14: 0 | F14: 0 | G14: [{110091,0,1}] | H14: 1 | I14: 玄冰铁+3*1 | K14: 0 | R14: 次数 | S14: =R[-1]C*10 -> 150 | U14: 次数 | V14: =R[-1]C*10 -> 60
A15: 12 | B15: 2 | C15: 50 | D15: 0 | E15: 0 | F15: 0 | G15: [{110100,0,1}] | H15: 1 | I15: 紫水晶+2*1 | K15: 0 | R15: 元宝消耗 | S15: =180*R[-2]C -> 2700 | U15: 元宝消耗 | V15: =180*R[-2]C -> 1080
A16: 13 | B16: 2 | C16: 80 | D16: 0 | E16: 0 | F16: 0 | G16: [{110260,0,1}] | H16: 0 | I16: 通灵水晶 | K16: 0 | N16: =100*40 -> 4000 | R16: 普通奖励 | S16: =15*(R[-3]C*10-1) -> 2235 | U16: 普通奖励 | V16: =15*(R[-3]C*10-1) -> 885
A17: 14 | B17: 2 | C17: 1 | D17: 100 | E17: 0 | F17: 131 | G17: [{110147,0,1}] | H17: 1 | I17: 超级祝福油*1 | J17: 可喜可贺，~s在幸运大转盘中抽到了~s，令人羡慕不已！ | K17: 1 | R17: 金刚石 | S17: 1500 | U17: 金刚石 | V17: 1500
A18: 15 | B18: 2 | C18: 2 | D18: 0 | E18: 0 | F18: 20 | G18: [{110109,0,1}] | H18: 1 | I18: 金刚石*1 | J18: 可喜可贺，~s在幸运大转盘中抽到了~s，令人羡慕不已！ | K18: 1 | R18: 总奖励价值 | S18: =R[-2]C+R[-1]C -> 3735 | U18: 总奖励价值 | V18: =R[-2]C+R[-1]C -> 2385
A19: 16 | B19: 2 | C19: 1 | D19: 50 | E19: 0 | F19: 89 | G19: [{110163,0,1}] | H19: 1 | I19: 上古神石*1 | J19: 可喜可贺，~s在幸运大转盘中抽到了~s，令人羡慕不已！ | K19: 1 | R19: 折扣 | S19: =R[-4]C/R[-1]C -> 0.72289156626506 | U19: 折扣 | V19: =R[-4]C/R[-1]C -> 0.452830188679245
A20: 17 | B20: 3 | C20: 90 | D20: 0 | E20: 0 | F20: 0 | G20: [{110194,0,2}] | H20: 0 | I20: 疗伤药*2 | K20: 0
A21: 18 | B21: 3 | C21: 75 | D21: 0 | E21: 0 | F21: 0 | G21: [{110160,0,5}] | H21: 1 | I21: 铸魂精华*5 | K21: 0 | R21: 金刚石实际价格 | S21: =1500*R[-2]C -> 1084.33734939759 | U21: 金刚石实际价格 | V21: =1500*R[-2]C -> 679.245283018868
A22: 19 | B22: 3 | C22: 75 | D22: 0 | E22: 0 | F22: 0 | G22: [{110091,0,1}] | H22: 1 | I22: 玄冰铁+3*1 | K22: 0
A23: 20 | B23: 3 | C23: 50 | D23: 0 | E23: 0 | F23: 0 | G23: [{110100,0,1}] | H23: 1 | I23: 紫水晶+2*1 | K23: 0
A24: 21 | B24: 3 | C24: 80 | D24: 0 | E24: 0 | F24: 0 | G24: [{110260,0,1}] | H24: 0 | I24: 通灵水晶 | K24: 0
A25: 22 | B25: 3 | C25: 1 | D25: 100 | E25: 0 | F25: 131 | G25: [{110147,0,1}] | H25: 1 | I25: 超级祝福油*1 | J25: 可喜可贺，~s在幸运大转盘中抽到了~s，令人羡慕不已！ | K25: 1
A26: 23 | B26: 3 | C26: 2 | D26: 0 | E26: 0 | F26: 20 | G26: [{110109,0,1}] | H26: 1 | I26: 金刚石*1 | J26: 可喜可贺，~s在幸运大转盘中抽到了~s，令人羡慕不已！ | K26: 1
A27: 24 | B27: 3 | C27: 1 | D27: 50 | E27: 0 | F27: 89 | G27: [{110163,0,1}] | H27: 1 | I27: 上古神石*1 | J27: 可喜可贺，~s在幸运大转盘中抽到了~s，令人羡慕不已！ | K27: 1
A28: 25 | B28: 4 | C28: 70 | D28: 0 | E28: 0 | F28: 0 | G28: [{110260,0,2}] | H28: 0 | I28: 通灵水晶*2 | K28: 0
A29: 26 | B29: 4 | C29: 110 | D29: 0 | E29: 0 | F29: 0 | G29: [{110160,0,5}] | H29: 1 | I29: 铸魂精华*5 | K29: 0
A30: 27 | B30: 4 | C30: 95 | D30: 0 | E30: 0 | F30: 0 | G30: [{110091,0,1}] | H30: 1 | I30: 玄冰铁+3*1 | K30: 0
A31: 28 | B31: 4 | C31: 95 | D31: 0 | E31: 0 | F31: 0 | G31: [{110100,0,1}] | H31: 1 | I31: 紫水晶+2*1 | K31: 0
A32: 29 | B32: 4 | C32: 1 | D32: 70 | E32: 0 | F32: 110 | G32: [{110294,0,1}] | H32: 0 | I32: 女娲神石 | J32: 可喜可贺，~s在幸运大转盘中抽到了~s，令人羡慕不已！ | K32: 1
A33: 30 | B33: 4 | C33: 1 | D33: 100 | E33: 0 | F33: 131 | G33: [{110147,0,1}] | H33: 1 | I33: 超级幸运油*1 | J33: 可喜可贺，~s在幸运大转盘中抽到了~s，令人羡慕不已！ | K33: 1
A34: 31 | B34: 4 | C34: 2 | D34: 0 | E34: 0 | F34: 20 | G34: [{110109,0,1}] | H34: 1 | I34: 金刚石*1 | J34: 可喜可贺，~s在幸运大转盘中抽到了~s，令人羡慕不已！ | K34: 1
A35: 32 | B35: 4 | C35: 1 | D35: 50 | E35: 0 | F35: 89 | G35: [{110163,0,1}] | H35: 1 | I35: 上古神石*1 | J35: 可喜可贺，~s在幸运大转盘中抽到了~s，令人羡慕不已！ | K35: 1

Sheet: Sheet3
B2: 组1是开服3天
B3: 组2是
B4: 组3是合服