Sheet: 神皇秘境兑换
A1: id | B1: lv | C1: point | D1: goods
A2: id | B2: lv | C2: point | D2: goods
A3: ID | B3: 兑换等级 | C3: 兑换积分 | D3: 物品ID
A4: 1 | B4: 1 | C4: 5 | D4: ="[{"&RC[1]&",1,"&RC[3]&"}]" -> [{110319,1,1}] | E4: 110319 | F4: 幻金秘钥 | G4: 1 | H4: 1000 | J4: 5 | K4: 5
A5: 2 | B5: 1 | C5: =RC[8] -> 5 | D5: ="[{"&RC[1]&",1,"&RC[3]&"}]" -> [{110304,1,1}] | E5: 110304 | F5: 赤炼魂石 | G5: 1 | H5: 1000 | J5: =RC[-2]/200 -> 5 | K5: 5
A6: 3 | B6: 1 | C6: =RC[8] -> 6 | D6: ="[{"&RC[1]&",1,"&RC[3]&"}]" -> [{110259,1,10}] | E6: 110259 | F6: 通灵神石 | G6: 10 | H6: =120*RC[-1] -> 1200 | J6: =RC[-2]/200 -> 6 | K6: =RC[-1] -> 6
A7: 4 | B7: 1 | C7: =RC[8] -> 15 | D7: ="[{"&RC[1]&",0,"&RC[3]&"}]" -> [{110095,0,6}] | E7: 110095 | F7: 玄冰铁+7 | G7: 6 | H7: =RC[-1]*500 -> 3000 | J7: =RC[-2]/200 -> 15 | K7: =RC[-1] -> 15 | N7: 金刚石 | O7: 上古神石 | U7: 元宝价值 | V7: rmb价值
A8: 5 | B8: 1 | C8: =RC[8] -> 20 | D8: ="[{"&RC[1]&",0,"&RC[3]&"}]" -> [{200061,0,1}] | E8: 200061 | F8: 白虎战甲 | G8: 1 | H8: 18000 | I8: 4200 | J8: =RC[-1]/200 -> 21 | K8: 20 | M8: 白虎战甲 | N8: 14 | P8: =RC[-2]*300 -> 4200 | R8: =RC[-2]+RC[-1] -> 4200 | S8: =RC[-1]/200 -> 21 | T8: 20 | U8: =RC[-1]*200 -> 4000 | V8: =RC[-1]/20 -> 200
A9: 6 | B9: 1 | C9: =RC[8] -> 20 | D9: ="[{"&RC[1]&",0,"&RC[3]&"}]" -> [{202061,0,1}] | E9: 202061 | F9: 青龙道袍 | G9: 1 | H9: 18000 | I9: 4200 | J9: =RC[-1]/200 -> 21 | K9: 20 | M9: 青龙道袍 | N9: 14 | P9: =RC[-2]*300 -> 4200 | R9: =RC[-2]+RC[-1] -> 4200 | S9: =RC[-1]/200 -> 21 | T9: 20 | U9: =RC[-1]*200 -> 4000 | V9: =RC[-1]/20 -> 200
A10: 7 | B10: 1 | C10: =RC[8] -> 20 | D10: ="[{"&RC[1]&",0,"&RC[3]&"}]" -> [{201061,0,1}] | E10: 201061 | F10: 朱雀披风 | G10: 1 | H10: 18000 | I10: 4200 | J10: =RC[-1]/200 -> 21 | K10: 20 | M10: 朱雀披风 | N10: 14 | P10: =RC[-2]*300 -> 4200 | R10: =RC[-2]+RC[-1] -> 4200 | S10: =RC[-1]/200 -> 21 | T10: 20 | U10: =RC[-1]*200 -> 4000 | V10: =RC[-1]/20 -> 200
A11: 8 | B11: 1 | C11: =RC[8] -> 140 | D11: ="[{"&RC[1]&",0,"&RC[3]&"}]" -> [{200071,0,1}] | E11: 200071 | F11: 圣武衣服 | G11: 1 | H11: 27000 | I11: 27200 | J11: =RC[-1]/200 -> 136 | K11: 140 | M11: 圣武衣服 | N11: 24 | O11: 20 | P11: =RC[-2]*300 -> 7200 | Q11: =RC[-2]*1000 -> 20000 | R11: =RC[-2]+RC[-1] -> 27200 | S11: =RC[-1]/200 -> 136 | T11: 140 | U11: =RC[-1]*200 -> 28000 | V11: =RC[-1]/20 -> 1400
A12: 9 | B12: 1 | C12: =RC[8] -> 140 | D12: ="[{"&RC[1]&",0,"&RC[3]&"}]" -> [{202071,0,1}] | E12: 202071 | F12: 圣魂衣服 | G12: 1 | H12: 27000 | I12: 27200 | J12: =RC[-1]/200 -> 136 | K12: 140 | M12: 圣魂衣服 | N12: 24 | O12: 20 | P12: =RC[-2]*300 -> 7200 | Q12: =RC[-2]*1000 -> 20000 | R12: =RC[-2]+RC[-1] -> 27200 | S12: =RC[-1]/200 -> 136 | T12: 140 | U12: =RC[-1]*200 -> 28000 | V12: =RC[-1]/20 -> 1400
A13: 10 | B13: 1 | C13: =RC[8] -> 140 | D13: ="[{"&RC[1]&",0,"&RC[3]&"}]" -> [{201071,0,1}] | E13: 201071 | F13: 圣魔衣服 | G13: 1 | H13: 27000 | I13: 27200 | J13: =RC[-1]/200 -> 136 | K13: 140 | M13: 圣魔衣服 | N13: 24 | O13: 20 | P13: =RC[-2]*300 -> 7200 | Q13: =RC[-2]*1000 -> 20000 | R13: =RC[-2]+RC[-1] -> 27200 | S13: =RC[-1]/200 -> 136 | T13: 140 | U13: =RC[-1]*200 -> 28000 | V13: =RC[-1]/20 -> 1400
A14: 11 | B14: 1 | C14: =RC[8] -> 460 | D14: ="[{"&RC[1]&",0,"&RC[3]&"}]" -> [{200081,0,1}] | E14: 200081 | F14: 主宰战甲 | G14: 1 | H14: 84000 | I14: 92200 | J14: =RC[-1]/200 -> 461 | K14: 460 | M14: 主宰战甲 | N14: =R[-1]C+50 -> 74 | O14: =R[-1]C+50 -> 70 | P14: =RC[-2]*300 -> 22200 | Q14: =RC[-2]*1000 -> 70000 | R14: =RC[-2]+RC[-1] -> 92200 | S14: =RC[-1]/200 -> 461 | T14: 460 | U14: =RC[-1]*200 -> 92000 | V14: =RC[-1]/20 -> 4600
A15: 12 | B15: 1 | C15: =RC[8] -> 460 | D15: ="[{"&RC[1]&",0,"&RC[3]&"}]" -> [{202081,0,1}] | E15: 202081 | F15: 主宰道袍 | G15: 1 | H15: 84000 | I15: 92200 | J15: =RC[-1]/200 -> 461 | K15: 460 | M15: 主宰道袍 | N15: 74 | O15: 70 | P15: =RC[-2]*300 -> 22200 | Q15: =RC[-2]*1000 -> 70000 | R15: =RC[-2]+RC[-1] -> 92200 | S15: =RC[-1]/200 -> 461 | T15: 460 | U15: =RC[-1]*200 -> 92000 | V15: =RC[-1]/20 -> 4600
A16: 13 | B16: 1 | C16: =RC[8] -> 460 | D16: ="[{"&RC[1]&",0,"&RC[3]&"}]" -> [{201081,0,1}] | E16: 201081 | F16: 主宰法衣 | G16: 1 | H16: 84000 | I16: 92200 | J16: =RC[-1]/200 -> 461 | K16: 460 | M16: 主宰法衣 | N16: 74 | O16: 70 | P16: =RC[-2]*300 -> 22200 | Q16: =RC[-2]*1000 -> 70000 | R16: =RC[-2]+RC[-1] -> 92200 | S16: =RC[-1]/200 -> 461 | T16: 460 | U16: =RC[-1]*200 -> 92000 | V16: =RC[-1]/20 -> 4600
A17: 14 | B17: 1 | C17: =RC[8] -> 30 | D17: ="[{"&RC[1]&",0,"&RC[3]&"}]" -> [{200060,0,1}] | E17: 200060 | F17: 混沌 | G17: 1 | H17: 127500 | I17: 6300 | J17: =RC[-1]/200 -> 31.5 | K17: 30 | M17: 混沌 | N17: 21 | P17: =RC[-2]*300 -> 6300 | R17: =RC[-2]+RC[-1] -> 6300 | S17: =RC[-1]/200 -> 31.5 | T17: 30 | U17: =RC[-1]*200 -> 6000 | V17: =RC[-1]/20 -> 300
A18: 15 | B18: 1 | C18: =RC[8] -> 30 | D18: ="[{"&RC[1]&",0,"&RC[3]&"}]" -> [{202060,0,1}] | E18: 202060 | F18: 天蛇 | G18: 1 | H18: 127500 | I18: 6300 | J18: =RC[-1]/200 -> 31.5 | K18: 30 | M18: 天蛇 | N18: 21 | P18: =RC[-2]*300 -> 6300 | R18: =RC[-2]+RC[-1] -> 6300 | S18: =RC[-1]/200 -> 31.5 | T18: 30 | U18: =RC[-1]*200 -> 6000 | V18: =RC[-1]/20 -> 300
A19: 16 | B19: 1 | C19: =RC[8] -> 30 | D19: ="[{"&RC[1]&",0,"&RC[3]&"}]" -> [{201060,0,1}] | E19: 201060 | F19: 狂龙 | G19: 1 | H19: 127500 | I19: 6300 | J19: =RC[-1]/200 -> 31.5 | K19: 30 | M19: 狂龙 | N19: 21 | P19: =RC[-2]*300 -> 6300 | R19: =RC[-2]+RC[-1] -> 6300 | S19: =RC[-1]/200 -> 31.5 | T19: 30 | U19: =RC[-1]*200 -> 6000 | V19: =RC[-1]/20 -> 300
A20: 17 | B20: 1 | C20: =RC[8] -> 210 | D20: ="[{"&RC[1]&",0,"&RC[3]&"}]" -> [{200070,0,1}] | E20: 200070 | F20: 战刃 | G20: 1 | H20: 217500 | I20: 41100 | J20: =RC[-1]/200 -> 205.5 | K20: 210 | M20: 战刃 | N20: =R[-3]C+16 -> 37 | O20: 30 | P20: =RC[-2]*300 -> 11100 | Q20: =RC[-2]*1000 -> 30000 | R20: =RC[-2]+RC[-1] -> 41100 | S20: =RC[-1]/200 -> 205.5 | T20: 210 | U20: =RC[-1]*200 -> 42000 | V20: =RC[-1]/20 -> 2100
A21: 18 | B21: 1 | C21: =RC[8] -> 210 | D21: ="[{"&RC[1]&",0,"&RC[3]&"}]" -> [{202070,0,1}] | E21: 202070 | F21: 太虚 | G21: 1 | H21: 217500 | I21: 41100 | J21: =RC[-1]/200 -> 205.5 | K21: 210 | M21: 太虚 | N21: =R[-1]C -> 37 | O21: =R[-1]C -> 30 | P21: =RC[-2]*300 -> 11100 | Q21: =RC[-2]*1000 -> 30000 | R21: =RC[-2]+RC[-1] -> 41100 | S21: =RC[-1]/200 -> 205.5 | T21: 210 | U21: =RC[-1]*200 -> 42000 | V21: =RC[-1]/20 -> 2100
A22: 19 | B22: 1 | C22: =RC[8] -> 210 | D22: ="[{"&RC[1]&",0,"&RC[3]&"}]" -> [{201070,0,1}] | E22: 201070 | F22: 轮回 | G22: 1 | H22: 217500 | I22: 41100 | J22: =RC[-1]/200 -> 205.5 | K22: 210 | M22: 轮回 | N22: =R[-1]C -> 37 | O22: =R[-1]C -> 30 | P22: =RC[-2]*300 -> 11100 | Q22: =RC[-2]*1000 -> 30000 | R22: =RC[-2]+RC[-1] -> 41100 | S22: =RC[-1]/200 -> 205.5 | T22: 210 | U22: =RC[-1]*200 -> 42000 | V22: =RC[-1]/20 -> 2100
A23: 20 | B23: 1 | C23: =RC[8] -> 700 | D23: ="[{"&RC[1]&",0,"&RC[3]&"}]" -> [{200080,0,1}] | E23: 200080 | F23: 主宰战刃 | G23: 1 | H23: 327000 | I23: 138600 | J23: =RC[-1]/200 -> 693 | K23: 700 | M23: 主宰战刃 | N23: =R[-1]C+75 -> 112 | O23: =R[-1]C+75 -> 105 | P23: =RC[-2]*300 -> 33600 | Q23: =RC[-2]*1000 -> 105000 | R23: =RC[-2]+RC[-1] -> 138600 | S23: =RC[-1]/200 -> 693 | T23: 700 | U23: =RC[-1]*200 -> 140000 | V23: =RC[-1]/20 -> 7000
A24: 21 | B24: 1 | C24: =RC[8] -> 700 | D24: ="[{"&RC[1]&",0,"&RC[3]&"}]" -> [{202080,0,1}] | E24: 202080 | F24: 主宰道剑 | G24: 1 | H24: 327000 | I24: 138600 | J24: =RC[-1]/200 -> 693 | K24: 700 | M24: 主宰道剑 | N24: =R[-1]C -> 112 | O24: =R[-1]C -> 105 | P24: =RC[-2]*300 -> 33600 | Q24: =RC[-2]*1000 -> 105000 | R24: =RC[-2]+RC[-1] -> 138600 | S24: =RC[-1]/200 -> 693 | T24: 700 | U24: =RC[-1]*200 -> 140000 | V24: =RC[-1]/20 -> 7000
A25: 22 | B25: 1 | C25: =RC[8] -> 700 | D25: ="[{"&RC[1]&",0,"&RC[3]&"}]" -> [{201080,0,1}] | E25: 201080 | F25: 主宰法杖 | G25: 1 | H25: 327000 | I25: 138600 | J25: =RC[-1]/200 -> 693 | K25: 700 | M25: 主宰法杖 | N25: =R[-1]C -> 112 | O25: =R[-1]C -> 105 | P25: =RC[-2]*300 -> 33600 | Q25: =RC[-2]*1000 -> 105000 | R25: =RC[-2]+RC[-1] -> 138600 | S25: =RC[-1]/200 -> 693 | T25: 700 | U25: =RC[-1]*200 -> 140000 | V25: =RC[-1]/20 -> 7000
H27: 标准价 | I27: 成本价 | J27: 积分换算 | K27: 最终积分

Sheet: Sheet2
A1: 1积分=200元宝