Sheet: 怪物成长表
A1: monster_id | B1: min_kill_count | C1: max_kill_count | F1: hp | G1: mp | H1: min_ac | I1: max_ac | J1: min_mac | K1: max_mac | L1: min_sc | M1: max_sc | N1: min_def | O1: max_def | P1: min_res | Q1: max_res | R1: crit | S1: crit_att | T1: hit | U1: dodge | V1: drop_list
A2: id | D2: name | F2: hp | G2: mp
A3: 怪物id | B3: 最小击杀次数 | C3: 最大击杀次数 | D3: 怪物名称 | E3: 用途（策划用） | F3: 生命 | G3: 魔法 | H3: 最小物理攻击 | I3: 最大物理攻击 | J3: 最小魔法攻击 | K3: 最大魔法攻击 | L3: 最小道术攻击 | M3: 最大道术攻击 | N3: 最小物防 | O3: 最大物防 | P3: 最小魔防 | Q3: 最大魔防 | R3: 暴击 | S3: 暴击力 | T3: 准确 | U3: 敏捷 | V3: 掉落列表
A4: 7502 | B4: 0 | C4: 2 | D4: 沃玛教主 | E4: 测试 | F4: 1000 | G4: 0 | H4: 0 | I4: 1 | J4: 0 | K4: 1 | L4: 0 | M4: 1 | N4: 0 | O4: 1 | P4: 0 | Q4: 1 | R4: 0 | S4: 0 | T4: 15 | U4: 15 | V4: [{0, [{1,100}],[{200003,1,1,10000}]}] | W4: [{0, [{1,100}],[{200003,1,1,10000}]}, {0, [{1,100}],[{201003,1,1,10000}]}, {0, [{1,100}],[{202003,1,1,10000}]}, {0, [{1,100}],[{200006,1,1,10000}]}, {0, [{1,100}],[{201006,1,1,10000}]}, {0, [{1,100}],[{202006,1,1,10000}]}, {0, [{5,100}],[{110004,1,1,10000},{110005,1,1,10000}]}]
A5: 7502 | B5: 3 | C5: 4 | D5: 沃玛教主 | E5: 测试 | F5: 2000 | G5: 0 | H5: 0 | I5: 2 | J5: 0 | K5: 2 | L5: 0 | M5: 2 | N5: 0 | O5: 2 | P5: 0 | Q5: 2 | R5: 0 | S5: 0 | T5: 15 | U5: 15 | V5: [{0, [{1,100}],[{201003,1,1,10000}]}]
A6: 7502 | B6: 5 | C6: 6 | D6: 沃玛教主 | E6: 测试 | F6: 3000 | G6: 0 | H6: 0 | I6: 3 | J6: 0 | K6: 3 | L6: 0 | M6: 3 | N6: 0 | O6: 3 | P6: 0 | Q6: 3 | R6: 0 | S6: 0 | T6: 15 | U6: 15 | V6: [{0, [{1,100}],[{200003,1,1,10000}]}] | W6: [{0, [{1,100}],[{200003,1,1,10000}]}]
A7: 7502 | B7: 7 | C7: 8 | D7: 沃玛教主 | E7: 测试 | F7: 4000 | G7: 0 | H7: 0 | I7: 4 | J7: 0 | K7: 4 | L7: 0 | M7: 4 | N7: 0 | O7: 4 | P7: 0 | Q7: 4 | R7: 0 | S7: 0 | T7: 15 | U7: 15 | V7: [{0, [{1,100}],[{200003,1,1,10000}]}]
A8: 7502 | B8: 9 | C8: 10 | D8: 沃玛教主 | E8: 测试 | F8: 5000 | G8: 0 | H8: 0 | I8: 5 | J8: 0 | K8: 5 | L8: 0 | M8: 5 | N8: 0 | O8: 5 | P8: 0 | Q8: 5 | R8: 0 | S8: 0 | T8: 15 | U8: 15 | V8: [{0, [{1,100}],[{200003,1,1,10000}]}]
A9: 7502 | B9: 11 | C9: 12 | D9: 沃玛教主 | E9: 测试 | F9: 6000 | G9: 0 | H9: 0 | I9: 6 | J9: 0 | K9: 6 | L9: 0 | M9: 6 | N9: 0 | O9: 6 | P9: 0 | Q9: 6 | R9: 0 | S9: 0 | T9: 15 | U9: 15 | V9: [{0, [{1,100}],[{200003,1,1,10000}]}]
A10: 7502 | B10: 13 | C10: 999999 | D10: 沃玛教主 | E10: 测试 | F10: 7000 | G10: 0 | H10: 0 | I10: 7 | J10: 0 | K10: 7 | L10: 0 | M10: 7 | N10: 0 | O10: 7 | P10: 0 | Q10: 7 | R10: 0 | S10: 0 | T10: 15 | U10: 15 | V10: [{0, [{1,100}],[{200003,1,1,10000}]}]

Sheet: 说明
A1: 怪物id：20000以上为宠物，宠物id规则为 2xxxy, 中间位xxx：表示宠物标识, 末尾y表示宠物等级，宠物最高9级
A2: 技能列表：[{血下限％,血上限％,[{技能1,概率},{技能1,概率}...]}]
A3: 掉落配置: [{职业限制, [{数量, 概率}, …], [{物品id, 是否绑定, 数量, 概率}, …]}, …]
A4: 攻击类型: 1 主动攻击 2 还击 3 不攻击也不还击
A5: 追击范围: 同时也是神兽的被拉回距离
A6: 归属权: 0 无归属权, 1 有归属权
A7: 速度: 每次移动多少格
A8: 巡逻间隔: {100, 500}在两个数字间随机每次的休息间隔，单位为毫秒，最小单位为100毫秒
A9: 追击间隔: 单位为毫秒，最小单位为100毫秒
A14: [{0,[{3,100}],[{200000,1,1,100},{200001,1,1,100},{200002,1,1,100},{200003,1,1,100},{200006,1,1,100},{201000,1,1,100},{201001,1,1,100},{201002,1,1,100},{201003,1,1,100},{201006,1,1,100},{202000,1,1,100},{202001,1,1,100},{202002,1,1,100},{202003,1,1,100},{202006,1,1,100}]},{0,[{2,100}],[{110002,1,2,2},{110003,1,2,2},{110004,1,1,3},{110005,1,1,3},{110010,1,1,1},{110011,1,1,1},{110012,1,1,1}]},{0,[{10,100}],[{110009,1,1000,1}]}]
A18: [{1000, [{1,100}],[{200003,1,1,10000}]},{2000, [{1,100}],[{201003,1,1,10000}]},{3000, [{1,100}],[{202003,1,1,10000}]},{0, [{5,100}],[{110004,1,1,10000},{110005,1,1,10000}]}]
B23: 200003 | C23: 魔力手镯 | D23: 战
B24: 201003 | C24: 魔法手镯 | D24: 法
B25: 202003 | C25: 三眼手镯 | D25: 道
B28: 经验副本 | K28: 金币副本 | T28: 材料副本
B29: BOSS掉落 | K29: BOSS掉落 | T29: BOSS掉落
B30: 200000 | C30: 八荒 | D30: 1 | E30: 1 | F30: 1 | G30: 30 | H30: ="{"&RC[-6]&","&RC[-3]&","&RC[-2]&","&RC[-1]&"}," -> {200000,1,1,30}, | I30: =RC[-1] -> {200000,1,1,30}, | K30: 200000 | L30: 八荒 | M30: 1 | N30: 1 | O30: 1 | P30: 30 | Q30: ="{"&RC[-6]&","&RC[-3]&","&RC[-2]&","&RC[-1]&"}," -> {200000,1,1,30}, | R30: =RC[-1] -> {200000,1,1,30}, | T30: 200000 | U30: 八荒 | V30: 1 | W30: 1 | X30: 1 | Y30: 30 | Z30: ="{"&RC[-6]&","&RC[-3]&","&RC[-2]&","&RC[-1]&"}," -> {200000,1,1,30}, | AA30: =RC[-1] -> {200000,1,1,30},
B31: 200001 | C31: 轻盔 | D31: 1 | E31: 1 | F31: 1 | G31: 30 | H31: ="{"&RC[-6]&","&RC[-3]&","&RC[-2]&","&RC[-1]&"}," -> {200001,1,1,30}, | I31: =R[-1]C&RC[-1] -> {200000,1,1,30},{200001,1,1,30}, | K31: 200001 | L31: 轻盔 | M31: 1 | N31: 1 | O31: 1 | P31: 30 | Q31: ="{"&RC[-6]&","&RC[-3]&","&RC[-2]&","&RC[-1]&"}," -> {200001,1,1,30}, | R31: =R[-1]C&RC[-1] -> {200000,1,1,30},{200001,1,1,30}, | T31: 200001 | U31: 轻盔 | V31: 1 | W31: 1 | X31: 1 | Y31: 30 | Z31: ="{"&RC[-6]&","&RC[-3]&","&RC[-2]&","&RC[-1]&"}," -> {200001,1,1,30}, | AA31: =R[-1]C&RC[-1] -> {200000,1,1,30},{200001,1,1,30},
B32: 200002 | C32: 珊瑚戒指 | D32: 1 | E32: 1 | F32: 1 | G32: 30 | H32: ="{"&RC[-6]&","&RC[-3]&","&RC[-2]&","&RC[-1]&"}," -> {200002,1,1,30}, | I32: =R[-1]C&RC[-1] -> {200000,1,1,30},{200001,1,1,30},{200002,1,1,30}, | K32: 200002 | L32: 珊瑚戒指 | M32: 1 | N32: 1 | O32: 1 | P32: 30 | Q32: ="{"&RC[-6]&","&RC[-3]&","&RC[-2]&","&RC[-1]&"}," -> {200002,1,1,30}, | R32: =R[-1]C&RC[-1] -> {200000,1,1,30},{200001,1,1,30},{200002,1,1,30}, | T32: 200002 | U32: 珊瑚戒指 | V32: 1 | W32: 1 | X32: 1 | Y32: 30 | Z32: ="{"&RC[-6]&","&RC[-3]&","&RC[-2]&","&RC[-1]&"}," -> {200002,1,1,30}, | AA32: =R[-1]C&RC[-1] -> {200000,1,1,30},{200001,1,1,30},{200002,1,1,30},
B33: 200003 | C33: 魔力手镯 | D33: 1 | E33: 1 | F33: 1 | G33: 30 | H33: ="{"&RC[-6]&","&RC[-3]&","&RC[-2]&","&RC[-1]&"}," -> {200003,1,1,30}, | I33: =R[-1]C&RC[-1] -> {200000,1,1,30},{200001,1,1,30},{200002,1,1,30},{200003,1,1,30}, | K33: 200003 | L33: 魔力手镯 | M33: 1 | N33: 1 | O33: 1 | P33: 30 | Q33: ="{"&RC[-6]&","&RC[-3]&","&RC[-2]&","&RC[-1]&"}," -> {200003,1,1,30}, | R33: =R[-1]C&RC[-1] -> {200000,1,1,30},{200001,1,1,30},{200002,1,1,30},{200003,1,1,30}, | T33: 200003 | U33: 魔力手镯 | V33: 1 | W33: 1 | X33: 1 | Y33: 30 | Z33: ="{"&RC[-6]&","&RC[-3]&","&RC[-2]&","&RC[-1]&"}," -> {200003,1,1,30}, | AA33: =R[-1]C&RC[-1] -> {200000,1,1,30},{200001,1,1,30},{200002,1,1,30},{200003,1,1,30},
B34: 200006 | C34: 恶魔项链 | D34: 1 | E34: 1 | F34: 1 | G34: 30 | H34: ="{"&RC[-6]&","&RC[-3]&","&RC[-2]&","&RC[-1]&"}," -> {200006,1,1,30}, | I34: =R[-1]C&RC[-1] -> {200000,1,1,30},{200001,1,1,30},{200002,1,1,30},{200003,1,1,30},{200006,1,1,30}, | K34: 200006 | L34: 恶魔项链 | M34: 1 | N34: 1 | O34: 1 | P34: 30 | Q34: ="{"&RC[-6]&","&RC[-3]&","&RC[-2]&","&RC[-1]&"}," -> {200006,1,1,30}, | R34: =R[-1]C&RC[-1] -> {200000,1,1,30},{200001,1,1,30},{200002,1,1,30},{200003,1,1,30},{200006,1,1,30}, | T34: 200006 | U34: 恶魔项链 | V34: 1 | W34: 1 | X34: 1 | Y34: 30 | Z34: ="{"&RC[-6]&","&RC[-3]&","&RC[-2]&","&RC[-1]&"}," -> {200006,1,1,30}, | AA34: =R[-1]C&RC[-1] -> {200000,1,1,30},{200001,1,1,30},{200002,1,1,30},{200003,1,1,30},{200006,1,1,30},
B35: 200010 | C35: 炼狱 | D35: 1 | E35: 1 | F35: 1 | G35: 5 | H35: ="{"&RC[-6]&","&RC[-3]&","&RC[-2]&","&RC[-1]&"}," -> {200010,1,1,5}, | I35: =R[-1]C&RC[-1] -> {200000,1,1,30},{200001,1,1,30},{200002,1,1,30},{200003,1,1,30},{200006,1,1,30},{200010,1,1,5}, | K35: 200010 | L35: 炼狱 | M35: 1 | N35: 1 | O35: 1 | P35: 5 | Q35: ="{"&RC[-6]&","&RC[-3]&","&RC[-2]&","&RC[-1]&"}," -> {200010,1,1,5}, | R35: =R[-1]C&RC[-1] -> {200000,1,1,30},{200001,1,1,30},{200002,1,1,30},{200003,1,1,30},{200006,1,1,30},{200010,1,1,5}, | T35: 200010 | U35: 炼狱 | V35: 1 | W35: 1 | X35: 1 | Y35: 5 | Z35: ="{"&RC[-6]&","&RC[-3]&","&RC[-2]&","&RC[-1]&"}," -> {200010,1,1,5}, | AA35: =R[-1]C&RC[-1] -> {200000,1,1,30},{200001,1,1,30},{200002,1,1,30},{200003,1,1,30},{200006,1,1,30},{200010,1,1,5},
B36: 200011 | C36: 绿色项链 | D36: 1 | E36: 1 | F36: 1 | G36: 10 | H36: ="{"&RC[-6]&","&RC[-3]&","&RC[-2]&","&RC[-1]&"}," -> {200011,1,1,10}, | I36: =R[-1]C&RC[-1] -> {200000,1,1,30},{200001,1,1,30},{200002,1,1,30},{200003,1,1,30},{200006,1,1,30},{200010,1,1,5},{200011,1,1,10}, | K36: 200011 | L36: 绿色项链 | M36: 1 | N36: 1 | O36: 1 | P36: 10 | Q36: ="{"&RC[-6]&","&RC[-3]&","&RC[-2]&","&RC[-1]&"}," -> {200011,1,1,10}, | R36: =R[-1]C&RC[-1] -> {200000,1,1,30},{200001,1,1,30},{200002,1,1,30},{200003,1,1,30},{200006,1,1,30},{200010,1,1,5},{200011,1,1,10}, | T36: 200011 | U36: 绿色项链 | V36: 1 | W36: 1 | X36: 1 | Y36: 10 | Z36: ="{"&RC[-6]&","&RC[-3]&","&RC[-2]&","&RC[-1]&"}," -> {200011,1,1,10}, | AA36: =R[-1]C&RC[-1] -> {200000,1,1,30},{200001,1,1,30},{200002,1,1,30},{200003,1,1,30},{200006,1,1,30},{200010,1,1,5},{200011,1,1,10},
B37: 200012 | C37: 战神盔甲 | D37: 1 | E37: 1 | F37: 1 | G37: 10 | H37: ="{"&RC[-6]&","&RC[-3]&","&RC[-2]&","&RC[-1]&"}," -> {200012,1,1,10}, | I37: =R[-1]C&RC[-1] -> {200000,1,1,30},{200001,1,1,30},{200002,1,1,30},{200003,1,1,30},{200006,1,1,30},{200010,1,1,5},{200011,1,1,10},{200012,1,1,10}, | K37: 200012 | L37: 战神盔甲 | M37: 1 | N37: 1 | O37: 1 | P37: 10 | Q37: ="{"&RC[-6]&","&RC[-3]&","&RC[-2]&","&RC[-1]&"}," -> {200012,1,1,10}, | R37: =R[-1]C&RC[-1] -> {200000,1,1,30},{200001,1,1,30},{200002,1,1,30},{200003,1,1,30},{200006,1,1,30},{200010,1,1,5},{200011,1,1,10},{200012,1,1,10}, | T37: 200012 | U37: 战神盔甲 | V37: 1 | W37: 1 | X37: 1 | Y37: 10 | Z37: ="{"&RC[-6]&","&RC[-3]&","&RC[-2]&","&RC[-1]&"}," -> {200012,1,1,10}, | AA37: =R[-1]C&RC[-1] -> {200000,1,1,30},{200001,1,1,30},{200002,1,1,30},{200003,1,1,30},{200006,1,1,30},{200010,1,1,5},{200011,1,1,10},{200012,1,1,10},
B38: 201000 | C38: 海魂 | D38: 1 | E38: 1 | F38: 1 | G38: 30 | H38: ="{"&RC[-6]&","&RC[-3]&","&RC[-2]&","&RC[-1]&"}," -> {201000,1,1,30}, | I38: =R[-1]C&RC[-1] -> {200000,1,1,30},{200001,1,1,30},{200002,1,1,30},{200003,1,1,30},{200006,1,1,30},{200010,1,1,5},{200011,1,1,10},{200012,1,1,10},{201000,1,1,30}, | K38: 201000 | L38: 海魂 | M38: 1 | N38: 1 | O38: 1 | P38: 30 | Q38: ="{"&RC[-6]&","&RC[-3]&","&RC[-2]&","&RC[-1]&"}," -> {201000,1,1,30}, | R38: =R[-1]C&RC[-1] -> {200000,1,1,30},{200001,1,1,30},{200002,1,1,30},{200003,1,1,30},{200006,1,1,30},{200010,1,1,5},{200011,1,1,10},{200012,1,1,10},{201000,1,1,30}, | T38: 201000 | U38: 海魂 | V38: 1 | W38: 1 | X38: 1 | Y38: 30 | Z38: ="{"&RC[-6]&","&RC[-3]&","&RC[-2]&","&RC[-1]&"}," -> {201000,1,1,30}, | AA38: =R[-1]C&RC[-1] -> {200000,1,1,30},{200001,1,1,30},{200002,1,1,30},{200003,1,1,30},{200006,1,1,30},{200010,1,1,5},{200011,1,1,10},{200012,1,1,10},{201000,1,1,30},
B39: 201001 | C39: 轻盔 | D39: 1 | E39: 1 | F39: 1 | G39: 30 | H39: ="{"&RC[-6]&","&RC[-3]&","&RC[-2]&","&RC[-1]&"}," -> {201001,1,1,30}, | I39: =R[-1]C&RC[-1] -> {200000,1,1,30},{200001,1,1,30},{200002,1,1,30},{200003,1,1,30},{200006,1,1,30},{200010,1,1,5},{200011,1,1,10},{200012,1,1,10},{201000,1,1,30},{201001,1,1,30}, | K39: 201001 | L39: 轻盔 | M39: 1 | N39: 1 | O39: 1 | P39: 30 | Q39: ="{"&RC[-6]&","&RC[-3]&","&RC[-2]&","&RC[-1]&"}," -> {201001,1,1,30}, | R39: =R[-1]C&RC[-1] -> {200000,1,1,30},{200001,1,1,30},{200002,1,1,30},{200003,1,1,30},{200006,1,1,30},{200010,1,1,5},{200011,1,1,10},{200012,1,1,10},{201000,1,1,30},{201001,1,1,30}, | T39: 201001 | U39: 轻盔 | V39: 1 | W39: 1 | X39: 1 | Y39: 30 | Z39: ="{"&RC[-6]&","&RC[-3]&","&RC[-2]&","&RC[-1]&"}," -> {201001,1,1,30}, | AA39: =R[-1]C&RC[-1] -> {200000,1,1,30},{200001,1,1,30},{200002,1,1,30},{200003,1,1,30},{200006,1,1,30},{200010,1,1,5},{200011,1,1,10},{200012,1,1,10},{201000,1,1,30},{201001,1,1,30},
B40: 201002 | C40: 金戒指 | D40: 1 | E40: 1 | F40: 1 | G40: 30 | H40: ="{"&RC[-6]&","&RC[-3]&","&RC[-2]&","&RC[-1]&"}," -> {201002,1,1,30}, | I40: =R[-1]C&RC[-1] -> {200000,1,1,30},{200001,1,1,30},{200002,1,1,30},{200003,1,1,30},{200006,1,1,30},{200010,1,1,5},{200011,1,1,10},{200012,1,1,10},{201000,1,1,30},{201001,1,1,30},{201002,1,1,30}, | K40: 201002 | L40: 金戒指 | M40: 1 | N40: 1 | O40: 1 | P40: 30 | Q40: ="{"&RC[-6]&","&RC[-3]&","&RC[-2]&","&RC[-1]&"}," -> {201002,1,1,30}, | R40: =R[-1]C&RC[-1] -> {200000,1,1,30},{200001,1,1,30},{200002,1,1,30},{200003,1,1,30},{200006,1,1,30},{200010,1,1,5},{200011,1,1,10},{200012,1,1,10},{201000,1,1,30},{201001,1,1,30},{201002,1,1,30}, | T40: 201002 | U40: 金戒指 | V40: 1 | W40: 1 | X40: 1 | Y40: 30 | Z40: ="{"&RC[-6]&","&RC[-3]&","&RC[-2]&","&RC[-1]&"}," -> {201002,1,1,30}, | AA40: =R[-1]C&RC[-1] -> {200000,1,1,30},{200001,1,1,30},{200002,1,1,30},{200003,1,1,30},{200006,1,1,30},{200010,1,1,5},{200011,1,1,10},{200012,1,1,10},{201000,1,1,30},{201001,1,1,30},{201002,1,1,30},
B41: 201003 | C41: 魔法手镯 | D41: 1 | E41: 1 | F41: 1 | G41: 30 | H41: ="{"&RC[-6]&","&RC[-3]&","&RC[-2]&","&RC[-1]&"}," -> {201003,1,1,30}, | I41: =R[-1]C&RC[-1] -> {200000,1,1,30},{200001,1,1,30},{200002,1,1,30},{200003,1,1,30},{200006,1,1,30},{200010,1,1,5},{200011,1,1,10},{200012,1,1,10},{201000,1,1,30},{201001,1,1,30},{201002,1,1,30},{201003,1,1,30}, | K41: 201003 | L41: 魔法手镯 | M41: 1 | N41: 1 | O41: 1 | P41: 30 | Q41: ="{"&RC[-6]&","&RC[-3]&","&RC[-2]&","&RC[-1]&"}," -> {201003,1,1,30}, | R41: =R[-1]C&RC[-1] -> {200000,1,1,30},{200001,1,1,30},{200002,1,1,30},{200003,1,1,30},{200006,1,1,30},{200010,1,1,5},{200011,1,1,10},{200012,1,1,10},{201000,1,1,30},{201001,1,1,30},{201002,1,1,30},{201003,1,1,30}, | T41: 201003 | U41: 魔法手镯 | V41: 1 | W41: 1 | X41: 1 | Y41: 30 | Z41: ="{"&RC[-6]&","&RC[-3]&","&RC[-2]&","&RC[-1]&"}," -> {201003,1,1,30}, | AA41: =R[-1]C&RC[-1] -> {200000,1,1,30},{200001,1,1,30},{200002,1,1,30},{200003,1,1,30},{200006,1,1,30},{200010,1,1,5},{200011,1,1,10},{200012,1,1,10},{201000,1,1,30},{201001,1,1,30},{201002,1,1,30},{201003,1,1,30},
B42: 201006 | C42: 放大镜 | D42: 1 | E42: 1 | F42: 1 | G42: 30 | H42: ="{"&RC[-6]&","&RC[-3]&","&RC[-2]&","&RC[-1]&"}," -> {201006,1,1,30}, | I42: =R[-1]C&RC[-1] -> {200000,1,1,30},{200001,1,1,30},{200002,1,1,30},{200003,1,1,30},{200006,1,1,30},{200010,1,1,5},{200011,1,1,10},{200012,1,1,10},{201000,1,1,30},{201001,1,1,30},{201002,1,1,30},{201003,1,1,30},{201006,1,1,30}, | K42: 201006 | L42: 放大镜 | M42: 1 | N42: 1 | O42: 1 | P42: 30 | Q42: ="{"&RC[-6]&","&RC[-3]&","&RC[-2]&","&RC[-1]&"}," -> {201006,1,1,30}, | R42: =R[-1]C&RC[-1] -> {200000,1,1,30},{200001,1,1,30},{200002,1,1,30},{200003,1,1,30},{200006,1,1,30},{200010,1,1,5},{200011,1,1,10},{200012,1,1,10},{201000,1,1,30},{201001,1,1,30},{201002,1,1,30},{201003,1,1,30},{201006,1,1,30}, | T42: 201006 | U42: 放大镜 | V42: 1 | W42: 1 | X42: 1 | Y42: 30 | Z42: ="{"&RC[-6]&","&RC[-3]&","&RC[-2]&","&RC[-1]&"}," -> {201006,1,1,30}, | AA42: =R[-1]C&RC[-1] -> {200000,1,1,30},{200001,1,1,30},{200002,1,1,30},{200003,1,1,30},{200006,1,1,30},{200010,1,1,5},{200011,1,1,10},{200012,1,1,10},{201000,1,1,30},{201001,1,1,30},{201002,1,1,30},{201003,1,1,30},{201006,1,1,30},
B43: 201010 | C43: 魔杖 | D43: 1 | E43: 1 | F43: 1 | G43: 5 | H43: ="{"&RC[-6]&","&RC[-3]&","&RC[-2]&","&RC[-1]&"}," -> {201010,1,1,5}, | I43: =R[-1]C&RC[-1] -> {200000,1,1,30},{200001,1,1,30},{200002,1,1,30},{200003,1,1,30},{200006,1,1,30},{200010,1,1,5},{200011,1,1,10},{200012,1,1,10},{201000,1,1,30},{201001,1,1,30},{201002,1,1,30},{201003,1,1,30},{201006,1,1,30},{201010,1,1,5}, | K43: 201010 | L43: 魔杖 | M43: 1 | N43: 1 | O43: 1 | P43: 5 | Q43: ="{"&RC[-6]&","&RC[-3]&","&RC[-2]&","&RC[-1]&"}," -> {201010,1,1,5}, | R43: =R[-1]C&RC[-1] -> {200000,1,1,30},{200001,1,1,30},{200002,1,1,30},{200003,1,1,30},{200006,1,1,30},{200010,1,1,5},{200011,1,1,10},{200012,1,1,10},{201000,1,1,30},{201001,1,1,30},{201002,1,1,30},{201003,1,1,30},{201006,1,1,30},{201010,1,1,5}, | T43: 201010 | U43: 魔杖 | V43: 1 | W43: 1 | X43: 1 | Y43: 5 | Z43: ="{"&RC[-6]&","&RC[-3]&","&RC[-2]&","&RC[-1]&"}," -> {201010,1,1,5}, | AA43: =R[-1]C&RC[-1] -> {200000,1,1,30},{200001,1,1,30},{200002,1,1,30},{200003,1,1,30},{200006,1,1,30},{200010,1,1,5},{200011,1,1,10},{200012,1,1,10},{201000,1,1,30},{201001,1,1,30},{201002,1,1,30},{201003,1,1,30},{201006,1,1,30},{201010,1,1,5},
B44: 201011 | C44: 恶魔铃铛 | D44: 1 | E44: 1 | F44: 1 | G44: 10 | H44: ="{"&RC[-6]&","&RC[-3]&","&RC[-2]&","&RC[-1]&"}," -> {201011,1,1,10}, | I44: =R[-1]C&RC[-1] -> {200000,1,1,30},{200001,1,1,30},{200002,1,1,30},{200003,1,1,30},{200006,1,1,30},{200010,1,1,5},{200011,1,1,10},{200012,1,1,10},{201000,1,1,30},{201001,1,1,30},{201002,1,1,30},{201003,1,1,30},{201006,1,1,30},{201010,1,1,5},{201011,1,1,10}, | K44: 201011 | L44: 恶魔铃铛 | M44: 1 | N44: 1 | O44: 1 | P44: 10 | Q44: ="{"&RC[-6]&","&RC[-3]&","&RC[-2]&","&RC[-1]&"}," -> {201011,1,1,10}, | R44: =R[-1]C&RC[-1] -> {200000,1,1,30},{200001,1,1,30},{200002,1,1,30},{200003,1,1,30},{200006,1,1,30},{200010,1,1,5},{200011,1,1,10},{200012,1,1,10},{201000,1,1,30},{201001,1,1,30},{201002,1,1,30},{201003,1,1,30},{201006,1,1,30},{201010,1,1,5},{201011,1,1,10}, | T44: 201011 | U44: 恶魔铃铛 | V44: 1 | W44: 1 | X44: 1 | Y44: 10 | Z44: ="{"&RC[-6]&","&RC[-3]&","&RC[-2]&","&RC[-1]&"}," -> {201011,1,1,10}, | AA44: =R[-1]C&RC[-1] -> {200000,1,1,30},{200001,1,1,30},{200002,1,1,30},{200003,1,1,30},{200006,1,1,30},{200010,1,1,5},{200011,1,1,10},{200012,1,1,10},{201000,1,1,30},{201001,1,1,30},{201002,1,1,30},{201003,1,1,30},{201006,1,1,30},{201010,1,1,5},{201011,1,1,10},
B45: 201012 | C45: 恶魔长袍 | D45: 1 | E45: 1 | F45: 1 | G45: 10 | H45: ="{"&RC[-6]&","&RC[-3]&","&RC[-2]&","&RC[-1]&"}," -> {201012,1,1,10}, | I45: =R[-1]C&RC[-1] -> {200000,1,1,30},{200001,1,1,30},{200002,1,1,30},{200003,1,1,30},{200006,1,1,30},{200010,1,1,5},{200011,1,1,10},{200012,1,1,10},{201000,1,1,30},{201001,1,1,30},{201002,1,1,30},{201003,1,1,30},{201006,1,1,30},{201010,1,1,5},{201011,1,1,10},{201012,1,1,10}, | K45: 201012 | L45: 恶魔长袍 | M45: 1 | N45: 1 | O45: 1 | P45: 10 | Q45: ="{"&RC[-6]&","&RC[-3]&","&RC[-2]&","&RC[-1]&"}," -> {201012,1,1,10}, | R45: =R[-1]C&RC[-1] -> {200000,1,1,30},{200001,1,1,30},{200002,1,1,30},{200003,1,1,30},{200006,1,1,30},{200010,1,1,5},{200011,1,1,10},{200012,1,1,10},{201000,1,1,30},{201001,1,1,30},{201002,1,1,30},{201003,1,1,30},{201006,1,1,30},{201010,1,1,5},{201011,1,1,10},{201012,1,1,10}, | T45: 201012 | U45: 恶魔长袍 | V45: 1 | W45: 1 | X45: 1 | Y45: 10 | Z45: ="{"&RC[-6]&","&RC[-3]&","&RC[-2]&","&RC[-1]&"}," -> {201012,1,1,10}, | AA45: =R[-1]C&RC[-1] -> {200000,1,1,30},{200001,1,1,30},{200002,1,1,30},{200003,1,1,30},{200006,1,1,30},{200010,1,1,5},{200011,1,1,10},{200012,1,1,10},{201000,1,1,30},{201001,1,1,30},{201002,1,1,30},{201003,1,1,30},{201006,1,1,30},{201010,1,1,5},{201011,1,1,10},{201012,1,1,10},
B46: 202000 | C46: 半月 | D46: 1 | E46: 1 | F46: 1 | G46: 30 | H46: ="{"&RC[-6]&","&RC[-3]&","&RC[-2]&","&RC[-1]&"}," -> {202000,1,1,30}, | I46: =R[-1]C&RC[-1] -> {200000,1,1,30},{200001,1,1,30},{200002,1,1,30},{200003,1,1,30},{200006,1,1,30},{200010,1,1,5},{200011,1,1,10},{200012,1,1,10},{201000,1,1,30},{201001,1,1,30},{201002,1,1,30},{201003,1,1,30},{201006,1,1,30},{201010,1,1,5},{201011,1,1,10},{201012,1,1,10},{202000,1,1,30}, | K46: 202000 | L46: 半月 | M46: 1 | N46: 1 | O46: 1 | P46: 30 | Q46: ="{"&RC[-6]&","&RC[-3]&","&RC[-2]&","&RC[-1]&"}," -> {202000,1,1,30}, | R46: =R[-1]C&RC[-1] -> {200000,1,1,30},{200001,1,1,30},{200002,1,1,30},{200003,1,1,30},{200006,1,1,30},{200010,1,1,5},{200011,1,1,10},{200012,1,1,10},{201000,1,1,30},{201001,1,1,30},{201002,1,1,30},{201003,1,1,30},{201006,1,1,30},{201010,1,1,5},{201011,1,1,10},{201012,1,1,10},{202000,1,1,30}, | T46: 202000 | U46: 半月 | V46: 1 | W46: 1 | X46: 1 | Y46: 30 | Z46: ="{"&RC[-6]&","&RC[-3]&","&RC[-2]&","&RC[-1]&"}," -> {202000,1,1,30}, | AA46: =R[-1]C&RC[-1] -> {200000,1,1,30},{200001,1,1,30},{200002,1,1,30},{200003,1,1,30},{200006,1,1,30},{200010,1,1,5},{200011,1,1,10},{200012,1,1,10},{201000,1,1,30},{201001,1,1,30},{201002,1,1,30},{201003,1,1,30},{201006,1,1,30},{201010,1,1,5},{201011,1,1,10},{201012,1,1,10},{202000,1,1,30},
B47: 202001 | C47: 轻盔 | D47: 1 | E47: 1 | F47: 1 | G47: 30 | H47: ="{"&RC[-6]&","&RC[-3]&","&RC[-2]&","&RC[-1]&"}," -> {202001,1,1,30}, | I47: =R[-1]C&RC[-1] -> {200000,1,1,30},{200001,1,1,30},{200002,1,1,30},{200003,1,1,30},{200006,1,1,30},{200010,1,1,5},{200011,1,1,10},{200012,1,1,10},{201000,1,1,30},{201001,1,1,30},{201002,1,1,30},{201003,1,1,30},{201006,1,1,30},{201010,1,1,5},{201011,1,1,10},{201012,1,1,10},{202000,1,1,30},{202001,1,1,30}, | K47: 202001 | L47: 轻盔 | M47: 1 | N47: 1 | O47: 1 | P47: 30 | Q47: ="{"&RC[-6]&","&RC[-3]&","&RC[-2]&","&RC[-1]&"}," -> {202001,1,1,30}, | R47: =R[-1]C&RC[-1] -> {200000,1,1,30},{200001,1,1,30},{200002,1,1,30},{200003,1,1,30},{200006,1,1,30},{200010,1,1,5},{200011,1,1,10},{200012,1,1,10},{201000,1,1,30},{201001,1,1,30},{201002,1,1,30},{201003,1,1,30},{201006,1,1,30},{201010,1,1,5},{201011,1,1,10},{201012,1,1,10},{202000,1,1,30},{202001,1,1,30}, | T47: 202001 | U47: 轻盔 | V47: 1 | W47: 1 | X47: 1 | Y47: 30 | Z47: ="{"&RC[-6]&","&RC[-3]&","&RC[-2]&","&RC[-1]&"}," -> {202001,1,1,30}, | AA47: =R[-1]C&RC[-1] -> {200000,1,1,30},{200001,1,1,30},{200002,1,1,30},{200003,1,1,30},{200006,1,1,30},{200010,1,1,5},{200011,1,1,10},{200012,1,1,10},{201000,1,1,30},{201001,1,1,30},{201002,1,1,30},{201003,1,1,30},{201006,1,1,30},{201010,1,1,5},{201011,1,1,10},{201012,1,1,10},{202000,1,1,30},{202001,1,1,30},
B48: 202002 | C48: 铂金戒指 | D48: 1 | E48: 1 | F48: 1 | G48: 30 | H48: ="{"&RC[-6]&","&RC[-3]&","&RC[-2]&","&RC[-1]&"}," -> {202002,1,1,30}, | I48: =R[-1]C&RC[-1] -> {200000,1,1,30},{200001,1,1,30},{200002,1,1,30},{200003,1,1,30},{200006,1,1,30},{200010,1,1,5},{200011,1,1,10},{200012,1,1,10},{201000,1,1,30},{201001,1,1,30},{201002,1,1,30},{201003,1,1,30},{201006,1,1,30},{201010,1,1,5},{201011,1,1,10},{201012,1,1,10},{202000,1,1,30},{202001,1,1,30},{202002,1,1,30}, | K48: 202002 | L48: 铂金戒指 | M48: 1 | N48: 1 | O48: 1 | P48: 30 | Q48: ="{"&RC[-6]&","&RC[-3]&","&RC[-2]&","&RC[-1]&"}," -> {202002,1,1,30}, | R48: =R[-1]C&RC[-1] -> {200000,1,1,30},{200001,1,1,30},{200002,1,1,30},{200003,1,1,30},{200006,1,1,30},{200010,1,1,5},{200011,1,1,10},{200012,1,1,10},{201000,1,1,30},{201001,1,1,30},{201002,1,1,30},{201003,1,1,30},{201006,1,1,30},{201010,1,1,5},{201011,1,1,10},{201012,1,1,10},{202000,1,1,30},{202001,1,1,30},{202002,1,1,30}, | T48: 202002 | U48: 铂金戒指 | V48: 1 | W48: 1 | X48: 1 | Y48: 30 | Z48: ="{"&RC[-6]&","&RC[-3]&","&RC[-2]&","&RC[-1]&"}," -> {202002,1,1,30}, | AA48: =R[-1]C&RC[-1] -> {200000,1,1,30},{200001,1,1,30},{200002,1,1,30},{200003,1,1,30},{200006,1,1,30},{200010,1,1,5},{200011,1,1,10},{200012,1,1,10},{201000,1,1,30},{201001,1,1,30},{201002,1,1,30},{201003,1,1,30},{201006,1,1,30},{201010,1,1,5},{201011,1,1,10},{201012,1,1,10},{202000,1,1,30},{202001,1,1,30},{202002,1,1,30},
B49: 202003 | C49: 三眼手镯 | D49: 1 | E49: 1 | F49: 1 | G49: 30 | H49: ="{"&RC[-6]&","&RC[-3]&","&RC[-2]&","&RC[-1]&"}," -> {202003,1,1,30}, | I49: =R[-1]C&RC[-1] -> {200000,1,1,30},{200001,1,1,30},{200002,1,1,30},{200003,1,1,30},{200006,1,1,30},{200010,1,1,5},{200011,1,1,10},{200012,1,1,10},{201000,1,1,30},{201001,1,1,30},{201002,1,1,30},{201003,1,1,30},{201006,1,1,30},{201010,1,1,5},{201011,1,1,10},{201012,1,1,10},{202000,1,1,30},{202001,1,1,30},{202002,1,1,30},{202003,1,1,30}, | K49: 202003 | L49: 三眼手镯 | M49: 1 | N49: 1 | O49: 1 | P49: 30 | Q49: ="{"&RC[-6]&","&RC[-3]&","&RC[-2]&","&RC[-1]&"}," -> {202003,1,1,30}, | R49: =R[-1]C&RC[-1] -> {200000,1,1,30},{200001,1,1,30},{200002,1,1,30},{200003,1,1,30},{200006,1,1,30},{200010,1,1,5},{200011,1,1,10},{200012,1,1,10},{201000,1,1,30},{201001,1,1,30},{201002,1,1,30},{201003,1,1,30},{201006,1,1,30},{201010,1,1,5},{201011,1,1,10},{201012,1,1,10},{202000,1,1,30},{202001,1,1,30},{202002,1,1,30},{202003,1,1,30}, | T49: 202003 | U49: 三眼手镯 | V49: 1 | W49: 1 | X49: 1 | Y49: 30 | Z49: ="{"&RC[-6]&","&RC[-3]&","&RC[-2]&","&RC[-1]&"}," -> {202003,1,1,30}, | AA49: =R[-1]C&RC[-1] -> {200000,1,1,30},{200001,1,1,30},{200002,1,1,30},{200003,1,1,30},{200006,1,1,30},{200010,1,1,5},{200011,1,1,10},{200012,1,1,10},{201000,1,1,30},{201001,1,1,30},{201002,1,1,30},{201003,1,1,30},{201006,1,1,30},{201010,1,1,5},{201011,1,1,10},{201012,1,1,10},{202000,1,1,30},{202001,1,1,30},{202002,1,1,30},{202003,1,1,30},
B50: 202006 | C50: 凤凰明珠 | D50: 1 | E50: 1 | F50: 1 | G50: 30 | H50: ="{"&RC[-6]&","&RC[-3]&","&RC[-2]&","&RC[-1]&"}," -> {202006,1,1,30}, | I50: =R[-1]C&RC[-1] -> {200000,1,1,30},{200001,1,1,30},{200002,1,1,30},{200003,1,1,30},{200006,1,1,30},{200010,1,1,5},{200011,1,1,10},{200012,1,1,10},{201000,1,1,30},{201001,1,1,30},{201002,1,1,30},{201003,1,1,30},{201006,1,1,30},{201010,1,1,5},{201011,1,1,10},{201012,1,1,10},{202000,1,1,30},{202001,1,1,30},{202002,1,1,30},{202003,1,1,30},{202006,1,1,30}, | K50: 202006 | L50: 凤凰明珠 | M50: 1 | N50: 1 | O50: 1 | P50: 30 | Q50: ="{"&RC[-6]&","&RC[-3]&","&RC[-2]&","&RC[-1]&"}," -> {202006,1,1,30}, | R50: =R[-1]C&RC[-1] -> {200000,1,1,30},{200001,1,1,30},{200002,1,1,30},{200003,1,1,30},{200006,1,1,30},{200010,1,1,5},{200011,1,1,10},{200012,1,1,10},{201000,1,1,30},{201001,1,1,30},{201002,1,1,30},{201003,1,1,30},{201006,1,1,30},{201010,1,1,5},{201011,1,1,10},{201012,1,1,10},{202000,1,1,30},{202001,1,1,30},{202002,1,1,30},{202003,1,1,30},{202006,1,1,30}, | T50: 202006 | U50: 凤凰明珠 | V50: 1 | W50: 1 | X50: 1 | Y50: 30 | Z50: ="{"&RC[-6]&","&RC[-3]&","&RC[-2]&","&RC[-1]&"}," -> {202006,1,1,30}, | AA50: =R[-1]C&RC[-1] -> {200000,1,1,30},{200001,1,1,30},{200002,1,1,30},{200003,1,1,30},{200006,1,1,30},{200010,1,1,5},{200011,1,1,10},{200012,1,1,10},{201000,1,1,30},{201001,1,1,30},{201002,1,1,30},{201003,1,1,30},{201006,1,1,30},{201010,1,1,5},{201011,1,1,10},{201012,1,1,10},{202000,1,1,30},{202001,1,1,30},{202002,1,1,30},{202003,1,1,30},{202006,1,1,30},
B51: 202010 | C51: 银蛇 | D51: 1 | E51: 1 | F51: 1 | G51: 5 | H51: ="{"&RC[-6]&","&RC[-3]&","&RC[-2]&","&RC[-1]&"}," -> {202010,1,1,5}, | I51: =R[-1]C&RC[-1] -> {200000,1,1,30},{200001,1,1,30},{200002,1,1,30},{200003,1,1,30},{200006,1,1,30},{200010,1,1,5},{200011,1,1,10},{200012,1,1,10},{201000,1,1,30},{201001,1,1,30},{201002,1,1,30},{201003,1,1,30},{201006,1,1,30},{201010,1,1,5},{201011,1,1,10},{201012,1,1,10},{202000,1,1,30},{202001,1,1,30},{202002,1,1,30},{202003,1,1,30},{202006,1,1,30},{202010,1,1,5}, | K51: 202010 | L51: 银蛇 | M51: 1 | N51: 1 | O51: 1 | P51: 5 | Q51: ="{"&RC[-6]&","&RC[-3]&","&RC[-2]&","&RC[-1]&"}," -> {202010,1,1,5}, | R51: =R[-1]C&RC[-1] -> {200000,1,1,30},{200001,1,1,30},{200002,1,1,30},{200003,1,1,30},{200006,1,1,30},{200010,1,1,5},{200011,1,1,10},{200012,1,1,10},{201000,1,1,30},{201001,1,1,30},{201002,1,1,30},{201003,1,1,30},{201006,1,1,30},{201010,1,1,5},{201011,1,1,10},{201012,1,1,10},{202000,1,1,30},{202001,1,1,30},{202002,1,1,30},{202003,1,1,30},{202006,1,1,30},{202010,1,1,5}, | T51: 202010 | U51: 银蛇 | V51: 1 | W51: 1 | X51: 1 | Y51: 5 | Z51: ="{"&RC[-6]&","&RC[-3]&","&RC[-2]&","&RC[-1]&"}," -> {202010,1,1,5}, | AA51: =R[-1]C&RC[-1] -> {200000,1,1,30},{200001,1,1,30},{200002,1,1,30},{200003,1,1,30},{200006,1,1,30},{200010,1,1,5},{200011,1,1,10},{200012,1,1,10},{201000,1,1,30},{201001,1,1,30},{201002,1,1,30},{201003,1,1,30},{201006,1,1,30},{201010,1,1,5},{201011,1,1,10},{201012,1,1,10},{202000,1,1,30},{202001,1,1,30},{202002,1,1,30},{202003,1,1,30},{202006,1,1,30},{202010,1,1,5},
B52: 202011 | C52: 天珠道链 | D52: 1 | E52: 1 | F52: 1 | G52: 10 | H52: ="{"&RC[-6]&","&RC[-3]&","&RC[-2]&","&RC[-1]&"}," -> {202011,1,1,10}, | I52: =R[-1]C&RC[-1] -> {200000,1,1,30},{200001,1,1,30},{200002,1,1,30},{200003,1,1,30},{200006,1,1,30},{200010,1,1,5},{200011,1,1,10},{200012,1,1,10},{201000,1,1,30},{201001,1,1,30},{201002,1,1,30},{201003,1,1,30},{201006,1,1,30},{201010,1,1,5},{201011,1,1,10},{201012,1,1,10},{202000,1,1,30},{202001,1,1,30},{202002,1,1,30},{202003,1,1,30},{202006,1,1,30},{202010,1,1,5},{202011,1,1,10}, | K52: 202011 | L52: 天珠道链 | M52: 1 | N52: 1 | O52: 1 | P52: 10 | Q52: ="{"&RC[-6]&","&RC[-3]&","&RC[-2]&","&RC[-1]&"}," -> {202011,1,1,10}, | R52: =R[-1]C&RC[-1] -> {200000,1,1,30},{200001,1,1,30},{200002,1,1,30},{200003,1,1,30},{200006,1,1,30},{200010,1,1,5},{200011,1,1,10},{200012,1,1,10},{201000,1,1,30},{201001,1,1,30},{201002,1,1,30},{201003,1,1,30},{201006,1,1,30},{201010,1,1,5},{201011,1,1,10},{201012,1,1,10},{202000,1,1,30},{202001,1,1,30},{202002,1,1,30},{202003,1,1,30},{202006,1,1,30},{202010,1,1,5},{202011,1,1,10}, | T52: 202011 | U52: 天珠道链 | V52: 1 | W52: 1 | X52: 1 | Y52: 10 | Z52: ="{"&RC[-6]&","&RC[-3]&","&RC[-2]&","&RC[-1]&"}," -> {202011,1,1,10}, | AA52: =R[-1]C&RC[-1] -> {200000,1,1,30},{200001,1,1,30},{200002,1,1,30},{200003,1,1,30},{200006,1,1,30},{200010,1,1,5},{200011,1,1,10},{200012,1,1,10},{201000,1,1,30},{201001,1,1,30},{201002,1,1,30},{201003,1,1,30},{201006,1,1,30},{201010,1,1,5},{201011,1,1,10},{201012,1,1,10},{202000,1,1,30},{202001,1,1,30},{202002,1,1,30},{202003,1,1,30},{202006,1,1,30},{202010,1,1,5},{202011,1,1,10},
B53: 202012 | C53: 灵魂道袍 | D53: 1 | E53: 1 | F53: 1 | G53: 10 | H53: ="{"&RC[-6]&","&RC[-3]&","&RC[-2]&","&RC[-1]&"}" -> {202012,1,1,10} | I53: =R[-1]C&RC[-1] -> {200000,1,1,30},{200001,1,1,30},{200002,1,1,30},{200003,1,1,30},{200006,1,1,30},{200010,1,1,5},{200011,1,1,10},{200012,1,1,10},{201000,1,1,30},{201001,1,1,30},{201002,1,1,30},{201003,1,1,30},{201006,1,1,30},{201010,1,1,5},{201011,1,1,10},{201012,1,1,10},{202000,1,1,30},{202001,1,1,30},{202002,1,1,30},{202003,1,1,30},{202006,1,1,30},{202010,1,1,5},{202011,1,1,10},{202012,1,1,10} | K53: 202012 | L53: 灵魂道袍 | M53: 1 | N53: 1 | O53: 1 | P53: 10 | Q53: ="{"&RC[-6]&","&RC[-3]&","&RC[-2]&","&RC[-1]&"}" -> {202012,1,1,10} | R53: =R[-1]C&RC[-1] -> {200000,1,1,30},{200001,1,1,30},{200002,1,1,30},{200003,1,1,30},{200006,1,1,30},{200010,1,1,5},{200011,1,1,10},{200012,1,1,10},{201000,1,1,30},{201001,1,1,30},{201002,1,1,30},{201003,1,1,30},{201006,1,1,30},{201010,1,1,5},{201011,1,1,10},{201012,1,1,10},{202000,1,1,30},{202001,1,1,30},{202002,1,1,30},{202003,1,1,30},{202006,1,1,30},{202010,1,1,5},{202011,1,1,10},{202012,1,1,10} | T53: 202012 | U53: 灵魂道袍 | V53: 1 | W53: 1 | X53: 1 | Y53: 10 | Z53: ="{"&RC[-6]&","&RC[-3]&","&RC[-2]&","&RC[-1]&"}" -> {202012,1,1,10} | AA53: =R[-1]C&RC[-1] -> {200000,1,1,30},{200001,1,1,30},{200002,1,1,30},{200003,1,1,30},{200006,1,1,30},{200010,1,1,5},{200011,1,1,10},{200012,1,1,10},{201000,1,1,30},{201001,1,1,30},{201002,1,1,30},{201003,1,1,30},{201006,1,1,30},{201010,1,1,5},{201011,1,1,10},{201012,1,1,10},{202000,1,1,30},{202001,1,1,30},{202002,1,1,30},{202003,1,1,30},{202006,1,1,30},{202010,1,1,5},{202011,1,1,10},{202012,1,1,10}
B56: 110086 | C56: 黑铁矿+8 | E56: 1 | F56: 2 | G56: 0 | H56: ="{"&RC[-6]&","&RC[-3]&","&RC[-2]&","&RC[-1]&"}," -> {110086,1,2,0}, | I56: =RC[-1] -> {110086,1,2,0}, | K56: 110086 | L56: 黑铁矿+8 | N56: 1 | O56: 2 | P56: 0 | Q56: ="{"&RC[-6]&","&RC[-3]&","&RC[-2]&","&RC[-1]&"}," -> {110086,1,2,0}, | R56: =RC[-1] -> {110086,1,2,0}, | T56: 110079 | U56: 黑铁矿+1 | W56: 1 | X56: 1 | Y56: 10 | Z56: ="{"&RC[-6]&","&RC[-3]&","&RC[-2]&","&RC[-1]&"}," -> {110079,1,1,10}, | AA56: =RC[-1] -> {110079,1,1,10},
B57: 110003 | C57: 洗炼石 | E57: 1 | F57: 2 | G57: 2 | H57: ="{"&RC[-6]&","&RC[-3]&","&RC[-2]&","&RC[-1]&"}," -> {110003,1,2,2}, | I57: =R[-1]C&RC[-1] -> {110086,1,2,0},{110003,1,2,2}, | K57: 110003 | L57: 洗炼石 | N57: 1 | O57: 2 | P57: 2 | Q57: ="{"&RC[-6]&","&RC[-3]&","&RC[-2]&","&RC[-1]&"}," -> {110003,1,2,2}, | R57: =R[-1]C&RC[-1] -> {110086,1,2,0},{110003,1,2,2}, | T57: 110003 | U57: 洗炼石 | W57: 1 | X57: 2 | Y57: 2 | Z57: ="{"&RC[-6]&","&RC[-3]&","&RC[-2]&","&RC[-1]&"}," -> {110003,1,2,2}, | AA57: =R[-1]C&RC[-1] -> {110079,1,1,10},{110003,1,2,2},
B58: 110004 | C58: 红药 | E58: 1 | F58: 1 | G58: 3 | H58: ="{"&RC[-6]&","&RC[-3]&","&RC[-2]&","&RC[-1]&"}," -> {110004,1,1,3}, | I58: =R[-1]C&RC[-1] -> {110086,1,2,0},{110003,1,2,2},{110004,1,1,3}, | K58: 110004 | L58: 红药 | N58: 1 | O58: 1 | P58: 3 | Q58: ="{"&RC[-6]&","&RC[-3]&","&RC[-2]&","&RC[-1]&"}," -> {110004,1,1,3}, | R58: =R[-1]C&RC[-1] -> {110086,1,2,0},{110003,1,2,2},{110004,1,1,3}, | T58: 110004 | U58: 红药 | W58: 1 | X58: 1 | Y58: 0 | Z58: ="{"&RC[-6]&","&RC[-3]&","&RC[-2]&","&RC[-1]&"}," -> {110004,1,1,0}, | AA58: =R[-1]C&RC[-1] -> {110079,1,1,10},{110003,1,2,2},{110004,1,1,0},
B59: 110005 | C59: 蓝药 | E59: 1 | F59: 1 | G59: 3 | H59: ="{"&RC[-6]&","&RC[-3]&","&RC[-2]&","&RC[-1]&"}," -> {110005,1,1,3}, | I59: =R[-1]C&RC[-1] -> {110086,1,2,0},{110003,1,2,2},{110004,1,1,3},{110005,1,1,3}, | K59: 110005 | L59: 蓝药 | N59: 1 | O59: 1 | P59: 3 | Q59: ="{"&RC[-6]&","&RC[-3]&","&RC[-2]&","&RC[-1]&"}," -> {110005,1,1,3}, | R59: =R[-1]C&RC[-1] -> {110086,1,2,0},{110003,1,2,2},{110004,1,1,3},{110005,1,1,3}, | T59: 110005 | U59: 蓝药 | W59: 1 | X59: 1 | Y59: 0 | Z59: ="{"&RC[-6]&","&RC[-3]&","&RC[-2]&","&RC[-1]&"}," -> {110005,1,1,0}, | AA59: =R[-1]C&RC[-1] -> {110079,1,1,10},{110003,1,2,2},{110004,1,1,0},{110005,1,1,0},
B60: 110010 | C60: 普通武装碎片 | E60: 1 | F60: 1 | G60: 0 | H60: ="{"&RC[-6]&","&RC[-3]&","&RC[-2]&","&RC[-1]&"}," -> {110010,1,1,0}, | I60: =R[-1]C&RC[-1] -> {110086,1,2,0},{110003,1,2,2},{110004,1,1,3},{110005,1,1,3},{110010,1,1,0}, | K60: 110010 | L60: 普通武装碎片 | N60: 1 | O60: 1 | P60: 0 | Q60: ="{"&RC[-6]&","&RC[-3]&","&RC[-2]&","&RC[-1]&"}," -> {110010,1,1,0}, | R60: =R[-1]C&RC[-1] -> {110086,1,2,0},{110003,1,2,2},{110004,1,1,3},{110005,1,1,3},{110010,1,1,0}, | T60: 110010 | U60: 普通武装碎片 | W60: 1 | X60: 1 | Y60: 0 | Z60: ="{"&RC[-6]&","&RC[-3]&","&RC[-2]&","&RC[-1]&"}," -> {110010,1,1,0}, | AA60: =R[-1]C&RC[-1] -> {110079,1,1,10},{110003,1,2,2},{110004,1,1,0},{110005,1,1,0},{110010,1,1,0},
B61: 110011 | C61: 普通防具碎片 | E61: 1 | F61: 1 | G61: 0 | H61: ="{"&RC[-6]&","&RC[-3]&","&RC[-2]&","&RC[-1]&"}," -> {110011,1,1,0}, | I61: =R[-1]C&RC[-1] -> {110086,1,2,0},{110003,1,2,2},{110004,1,1,3},{110005,1,1,3},{110010,1,1,0},{110011,1,1,0}, | K61: 110011 | L61: 普通防具碎片 | N61: 1 | O61: 1 | P61: 0 | Q61: ="{"&RC[-6]&","&RC[-3]&","&RC[-2]&","&RC[-1]&"}," -> {110011,1,1,0}, | R61: =R[-1]C&RC[-1] -> {110086,1,2,0},{110003,1,2,2},{110004,1,1,3},{110005,1,1,3},{110010,1,1,0},{110011,1,1,0}, | T61: 110011 | U61: 普通防具碎片 | W61: 1 | X61: 1 | Y61: 0 | Z61: ="{"&RC[-6]&","&RC[-3]&","&RC[-2]&","&RC[-1]&"}," -> {110011,1,1,0}, | AA61: =R[-1]C&RC[-1] -> {110079,1,1,10},{110003,1,2,2},{110004,1,1,0},{110005,1,1,0},{110010,1,1,0},{110011,1,1,0},
B62: 110012 | C62: 普通首饰碎片 | E62: 1 | F62: 1 | G62: 0 | H62: ="{"&RC[-6]&","&RC[-3]&","&RC[-2]&","&RC[-1]&"}" -> {110012,1,1,0} | I62: =R[-1]C&RC[-1] -> {110086,1,2,0},{110003,1,2,2},{110004,1,1,3},{110005,1,1,3},{110010,1,1,0},{110011,1,1,0},{110012,1,1,0} | K62: 110012 | L62: 普通首饰碎片 | N62: 1 | O62: 1 | P62: 0 | Q62: ="{"&RC[-6]&","&RC[-3]&","&RC[-2]&","&RC[-1]&"}" -> {110012,1,1,0} | R62: =R[-1]C&RC[-1] -> {110086,1,2,0},{110003,1,2,2},{110004,1,1,3},{110005,1,1,3},{110010,1,1,0},{110011,1,1,0},{110012,1,1,0} | T62: 110012 | U62: 普通首饰碎片 | W62: 1 | X62: 1 | Y62: 0 | Z62: ="{"&RC[-6]&","&RC[-3]&","&RC[-2]&","&RC[-1]&"}" -> {110012,1,1,0} | AA62: =R[-1]C&RC[-1] -> {110079,1,1,10},{110003,1,2,2},{110004,1,1,0},{110005,1,1,0},{110010,1,1,0},{110011,1,1,0},{110012,1,1,0}
B65: BOSS怪掉落 | G65: 装备 | H65: 概率／100 | K65: BOSS怪掉落 | P65: 装备 | Q65: 概率／100 | T65: BOSS怪掉落 | Y65: 装备 | Z65: 概率／100
G66: 3 | H66: 100 | I66: ="{0,[{"&RC[-2]&","&RC[-1]&"}],["&R[-13]C&"]}" -> {0,[{3,100}],[{200000,1,1,30},{200001,1,1,30},{200002,1,1,30},{200003,1,1,30},{200006,1,1,30},{200010,1,1,5},{200011,1,1,10},{200012,1,1,10},{201000,1,1,30},{201001,1,1,30},{201002,1,1,30},{201003,1,1,30},{201006,1,1,30},{201010,1,1,5},{201011,1,1,10},{201012,1,1,10},{202000,1,1,30},{202001,1,1,30},{202002,1,1,30},{202003,1,1,30},{202006,1,1,30},{202010,1,1,5},{202011,1,1,10},{202012,1,1,10}]} | P66: 2 | Q66: 100 | R66: ="{0,[{"&RC[-2]&","&RC[-1]&"}],["&R[-13]C&"]}" -> {0,[{2,100}],[{200000,1,1,30},{200001,1,1,30},{200002,1,1,30},{200003,1,1,30},{200006,1,1,30},{200010,1,1,5},{200011,1,1,10},{200012,1,1,10},{201000,1,1,30},{201001,1,1,30},{201002,1,1,30},{201003,1,1,30},{201006,1,1,30},{201010,1,1,5},{201011,1,1,10},{201012,1,1,10},{202000,1,1,30},{202001,1,1,30},{202002,1,1,30},{202003,1,1,30},{202006,1,1,30},{202010,1,1,5},{202011,1,1,10},{202012,1,1,10}]} | Y66: 2 | Z66: 100 | AA66: ="{0,[{"&RC[-2]&","&RC[-1]&"}],["&R[-13]C&"]}" -> {0,[{2,100}],[{200000,1,1,30},{200001,1,1,30},{200002,1,1,30},{200003,1,1,30},{200006,1,1,30},{200010,1,1,5},{200011,1,1,10},{200012,1,1,10},{201000,1,1,30},{201001,1,1,30},{201002,1,1,30},{201003,1,1,30},{201006,1,1,30},{201010,1,1,5},{201011,1,1,10},{201012,1,1,10},{202000,1,1,30},{202001,1,1,30},{202002,1,1,30},{202003,1,1,30},{202006,1,1,30},{202010,1,1,5},{202011,1,1,10},{202012,1,1,10}]}
G67: 道具 | H67: 概率／100 | P67: 道具 | Q67: 概率／100 | Y67: 道具 | Z67: 概率／100
G68: 2 | H68: 100 | I68: ="{0,[{"&RC[-2]&","&RC[-1]&"}],["&R[-6]C&"]}" -> {0,[{2,100}],[{110086,1,2,0},{110003,1,2,2},{110004,1,1,3},{110005,1,1,3},{110010,1,1,0},{110011,1,1,0},{110012,1,1,0}]} | P68: 2 | Q68: 100 | R68: ="{0,[{"&RC[-2]&","&RC[-1]&"}],["&R[-6]C&"]}" -> {0,[{2,100}],[{110086,1,2,0},{110003,1,2,2},{110004,1,1,3},{110005,1,1,3},{110010,1,1,0},{110011,1,1,0},{110012,1,1,0}]} | Y68: 10 | Z68: 100 | AA68: ="{0,[{"&RC[-2]&","&RC[-1]&"}],["&R[-6]C&"]}" -> {0,[{10,100}],[{110079,1,1,10},{110003,1,2,2},{110004,1,1,0},{110005,1,1,0},{110010,1,1,0},{110011,1,1,0},{110012,1,1,0}]}
G69: 金币 | H69: 概率／100 | P69: 金币 | Q69: 概率／100 | Y69: 金币 | Z69: 概率／100
G70: 2 | H70: 100 | I70: {0,[{2,100}],[{110009,1,1000,1}]} | P70: 10 | Q70: 1500 | R70: {0,[{10,100}],[{110009,1,1000,1}]} | Y70: 2 | Z70: 1000 | AA70: {0,[{2,100}],[{110009,1,1000,1}]}
I72: ="["&R[-6]C&","&R[-4]C&","&R[-2]C&"]" -> [{0,[{3,100}],[{200000,1,1,30},{200001,1,1,30},{200002,1,1,30},{200003,1,1,30},{200006,1,1,30},{200010,1,1,5},{200011,1,1,10},{200012,1,1,10},{201000,1,1,30},{201001,1,1,30},{201002,1,1,30},{201003,1,1,30},{201006,1,1,30},{201010,1,1,5},{201011,1,1,10},{201012,1,1,10},{202000,1,1,30},{202001,1,1,30},{202002,1,1,30},{202003,1,1,30},{202006,1,1,30},{202010,1,1,5},{202011,1,1,10},{202012,1,1,10}]},{0,[{2,100}],[{110086,1,2,0},{110003,1,2,2},{110004,1,1,3},{110005,1,1,3},{110010,1,1,0},{110011,1,1,0},{110012,1,1,0}]},{0,[{2,100}],[{110009,1,1000,1}]}] | R72: ="["&R[-6]C&","&R[-4]C&","&R[-2]C&"]" -> [{0,[{2,100}],[{200000,1,1,30},{200001,1,1,30},{200002,1,1,30},{200003,1,1,30},{200006,1,1,30},{200010,1,1,5},{200011,1,1,10},{200012,1,1,10},{201000,1,1,30},{201001,1,1,30},{201002,1,1,30},{201003,1,1,30},{201006,1,1,30},{201010,1,1,5},{201011,1,1,10},{201012,1,1,10},{202000,1,1,30},{202001,1,1,30},{202002,1,1,30},{202003,1,1,30},{202006,1,1,30},{202010,1,1,5},{202011,1,1,10},{202012,1,1,10}]},{0,[{2,100}],[{110086,1,2,0},{110003,1,2,2},{110004,1,1,3},{110005,1,1,3},{110010,1,1,0},{110011,1,1,0},{110012,1,1,0}]},{0,[{10,100}],[{110009,1,1000,1}]}] | AA72: ="["&R[-6]C&","&R[-4]C&","&R[-2]C&"]" -> [{0,[{2,100}],[{200000,1,1,30},{200001,1,1,30},{200002,1,1,30},{200003,1,1,30},{200006,1,1,30},{200010,1,1,5},{200011,1,1,10},{200012,1,1,10},{201000,1,1,30},{201001,1,1,30},{201002,1,1,30},{201003,1,1,30},{201006,1,1,30},{201010,1,1,5},{201011,1,1,10},{201012,1,1,10},{202000,1,1,30},{202001,1,1,30},{202002,1,1,30},{202003,1,1,30},{202006,1,1,30},{202010,1,1,5},{202011,1,1,10},{202012,1,1,10}]},{0,[{10,100}],[{110079,1,1,10},{110003,1,2,2},{110004,1,1,0},{110005,1,1,0},{110010,1,1,0},{110011,1,1,0},{110012,1,1,0}]},{0,[{2,100}],[{110009,1,1000,1}]}]
B74: 小怪掉落
B75: 110079 | C75: 黑铁矿+1 | E75: 0 | F75: 1 | G75: 2 | H75: ="{"&RC[-6]&","&RC[-3]&","&RC[-2]&","&RC[-1]&"}," -> {110079,0,1,2}, | I75: =RC[-1] -> {110079,0,1,2},
B76: 110003 | C76: 洗炼石 | E76: 0 | F76: 1 | G76: 2 | H76: ="{"&RC[-6]&","&RC[-3]&","&RC[-2]&","&RC[-1]&"}," -> {110003,0,1,2}, | I76: =R[-1]C&RC[-1] -> {110079,0,1,2},{110003,0,1,2},
B77: 110004 | C77: 红药 | E77: 0 | F77: 1 | G77: 10 | H77: ="{"&RC[-6]&","&RC[-3]&","&RC[-2]&","&RC[-1]&"}," -> {110004,0,1,10}, | I77: =R[-1]C&RC[-1] -> {110079,0,1,2},{110003,0,1,2},{110004,0,1,10},
B78: 110005 | C78: 蓝药 | E78: 0 | F78: 1 | G78: 10 | H78: ="{"&RC[-6]&","&RC[-3]&","&RC[-2]&","&RC[-1]&"}," -> {110005,0,1,10}, | I78: =R[-1]C&RC[-1] -> {110079,0,1,2},{110003,0,1,2},{110004,0,1,10},{110005,0,1,10},
B79: 110010 | C79: 普通武装碎片 | E79: 0 | F79: 1 | G79: 0 | H79: ="{"&RC[-6]&","&RC[-3]&","&RC[-2]&","&RC[-1]&"}," -> {110010,0,1,0}, | I79: =R[-1]C&RC[-1] -> {110079,0,1,2},{110003,0,1,2},{110004,0,1,10},{110005,0,1,10},{110010,0,1,0},
B80: 110011 | C80: 普通防具碎片 | E80: 0 | F80: 1 | G80: 0 | H80: ="{"&RC[-6]&","&RC[-3]&","&RC[-2]&","&RC[-1]&"}," -> {110011,0,1,0}, | I80: =R[-1]C&RC[-1] -> {110079,0,1,2},{110003,0,1,2},{110004,0,1,10},{110005,0,1,10},{110010,0,1,0},{110011,0,1,0},
B81: 110012 | C81: 普通首饰碎片 | E81: 0 | F81: 1 | G81: 0 | H81: ="{"&RC[-6]&","&RC[-3]&","&RC[-2]&","&RC[-1]&"}" -> {110012,0,1,0} | I81: =R[-1]C&RC[-1] -> {110079,0,1,2},{110003,0,1,2},{110004,0,1,10},{110005,0,1,10},{110010,0,1,0},{110011,0,1,0},{110012,0,1,0} | R81: {110009,1,500,1} | AB81: {110079,1,1,1}
B84: BOSS怪掉落 | G84: 掉落数量 | H84: 概率／100 | K84: BOSS怪掉落 | P84: 掉落数量 | Q84: 概率／100 | Z84: 掉落数量 | AA84: 概率／100
G85: 0 | H85: =10000-R[1]C -> 5000 | I85: ="{"&RC[-2]&","&RC[-1]&"}," -> {0,5000}, | P85: 0 | Q85: =10000-R[1]C -> 5000 | R85: ="{"&RC[-2]&","&RC[-1]&"}," -> {0,5000}, | Z85: 0 | AA85: =10000-R[1]C -> 5000 | AB85: ="{"&RC[-2]&","&RC[-1]&"}," -> {0,5000},
G86: 1 | H86: 5000 | I86: ="{"&RC[-2]&","&RC[-1]&"}" -> {1,5000} | P86: 1 | Q86: 5000 | R86: ="{"&RC[-2]&","&RC[-1]&"}" -> {1,5000} | Z86: 1 | AA86: 5000 | AB86: ="{"&RC[-2]&","&RC[-1]&"}" -> {1,5000}
I88: ="[{0,["&R[-3]C&R[-2]C&"],["&R[-7]C&"]}]" -> [{0,[{0,5000},{1,5000}],[{110079,0,1,2},{110003,0,1,2},{110004,0,1,10},{110005,0,1,10},{110010,0,1,0},{110011,0,1,0},{110012,0,1,0}]}] | R88: ="[{0,["&R[-3]C&R[-2]C&"],["&R[-7]C&"]}]" -> [{0,[{0,5000},{1,5000}],[{110009,1,500,1}]}] | AB88: ="[{0,["&R[-3]C&R[-2]C&"],["&R[-7]C&"]}]" -> [{0,[{0,5000},{1,5000}],[{110079,1,1,1}]}]

Sheet: 野外小怪
A1: 打宝精英掉落
A2: 10级怪物（1-10级装备掉落） | J2: 20级怪物（1-20级装备掉落） | S2: 30级怪物（11-30级装备掉落） | AB2: 40级怪物（11-30级装备掉落） | AK2: 50级怪物（11-30级装备掉落）
A3: ID | B3: 名称 | C3: 品质 | D3: 是否绑定 | E3: 数量 | F3: 概率 | J3: ID | K3: 名称 | L3: 品质 | M3: 是否绑定 | N3: 数量 | S3: ID | T3: 名称 | U3: 品质 | V3: 是否绑定 | W3: 数量 | AB3: ID | AC3: 名称 | AD3: 品质 | AE3: 是否绑定 | AF3: 数量 | AK3: ID | AL3: 名称 | AM3: 品质 | AN3: 是否绑定 | AO3: 数量
A4: 200000 | B4: 八荒 | C4: 1 | D4: 0 | E4: 1 | F4: 10 | G4: ="{"&RC[-6]&","&RC[-3]&","&RC[-2]&","&RC[-1]&"}," -> {200000,0,1,10}, | H4: =RC[-1] -> {200000,0,1,10}, | J4: 200000 | K4: 八荒 | L4: 1 | M4: 0 | N4: 1 | O4: 60 | P4: ="{"&RC[-6]&","&RC[-3]&","&RC[-2]&","&RC[-1]&"}," -> {200000,0,1,60}, | Q4: =RC[-1] -> {200000,0,1,60}, | S4: 200000 | T4: 八荒 | U4: 1 | V4: 0 | W4: 1 | X4: 70 | Y4: ="{"&RC[-6]&","&RC[-3]&","&RC[-2]&","&RC[-1]&"}," -> {200000,0,1,70}, | Z4: =RC[-1] -> {200000,0,1,70}, | AB4: 200000 | AC4: 八荒 | AD4: 1 | AE4: 0 | AF4: 1 | AG4: 60 | AH4: ="{"&RC[-6]&","&RC[-3]&","&RC[-2]&","&RC[-1]&"}," -> {200000,0,1,60}, | AI4: =RC[-1] -> {200000,0,1,60}, | AK4: 200000 | AL4: 八荒 | AM4: 1 | AN4: 0 | AO4: 1 | AP4: 50 | AQ4: ="{"&RC[-6]&","&RC[-3]&","&RC[-2]&","&RC[-1]&"}," -> {200000,0,1,50}, | AR4: =RC[-1] -> {200000,0,1,50},
A5: 200001 | B5: 轻盔 | C5: 1 | D5: 0 | E5: 1 | F5: 10 | G5: ="{"&RC[-6]&","&RC[-3]&","&RC[-2]&","&RC[-1]&"}," -> {200001,0,1,10}, | H5: =R[-1]C&RC[-1] -> {200000,0,1,10},{200001,0,1,10}, | J5: 200001 | K5: 轻盔 | L5: 1 | M5: 0 | N5: 1 | O5: 60 | P5: ="{"&RC[-6]&","&RC[-3]&","&RC[-2]&","&RC[-1]&"}," -> {200001,0,1,60}, | Q5: =R[-1]C&RC[-1] -> {200000,0,1,60},{200001,0,1,60}, | S5: 200001 | T5: 轻盔 | U5: 1 | V5: 0 | W5: 1 | X5: 70 | Y5: ="{"&RC[-6]&","&RC[-3]&","&RC[-2]&","&RC[-1]&"}," -> {200001,0,1,70}, | Z5: =R[-1]C&RC[-1] -> {200000,0,1,70},{200001,0,1,70}, | AB5: 200001 | AC5: 轻盔 | AD5: 1 | AE5: 0 | AF5: 1 | AG5: 60 | AH5: ="{"&RC[-6]&","&RC[-3]&","&RC[-2]&","&RC[-1]&"}," -> {200001,0,1,60}, | AI5: =R[-1]C&RC[-1] -> {200000,0,1,60},{200001,0,1,60}, | AK5: 200001 | AL5: 轻盔 | AM5: 1 | AN5: 0 | AO5: 1 | AP5: 50 | AQ5: ="{"&RC[-6]&","&RC[-3]&","&RC[-2]&","&RC[-1]&"}," -> {200001,0,1,50}, | AR5: =R[-1]C&RC[-1] -> {200000,0,1,50},{200001,0,1,50},
A6: 200002 | B6: 珊瑚戒指 | C6: 1 | D6: 0 | E6: 1 | F6: 10 | G6: ="{"&RC[-6]&","&RC[-3]&","&RC[-2]&","&RC[-1]&"}," -> {200002,0,1,10}, | H6: =R[-1]C&RC[-1] -> {200000,0,1,10},{200001,0,1,10},{200002,0,1,10}, | J6: 200002 | K6: 珊瑚戒指 | L6: 1 | M6: 0 | N6: 1 | O6: 60 | P6: ="{"&RC[-6]&","&RC[-3]&","&RC[-2]&","&RC[-1]&"}," -> {200002,0,1,60}, | Q6: =R[-1]C&RC[-1] -> {200000,0,1,60},{200001,0,1,60},{200002,0,1,60}, | S6: 200002 | T6: 珊瑚戒指 | U6: 1 | V6: 0 | W6: 1 | X6: 70 | Y6: ="{"&RC[-6]&","&RC[-3]&","&RC[-2]&","&RC[-1]&"}," -> {200002,0,1,70}, | Z6: =R[-1]C&RC[-1] -> {200000,0,1,70},{200001,0,1,70},{200002,0,1,70}, | AB6: 200002 | AC6: 珊瑚戒指 | AD6: 1 | AE6: 0 | AF6: 1 | AG6: 60 | AH6: ="{"&RC[-6]&","&RC[-3]&","&RC[-2]&","&RC[-1]&"}," -> {200002,0,1,60}, | AI6: =R[-1]C&RC[-1] -> {200000,0,1,60},{200001,0,1,60},{200002,0,1,60}, | AK6: 200002 | AL6: 珊瑚戒指 | AM6: 1 | AN6: 0 | AO6: 1 | AP6: 50 | AQ6: ="{"&RC[-6]&","&RC[-3]&","&RC[-2]&","&RC[-1]&"}," -> {200002,0,1,50}, | AR6: =R[-1]C&RC[-1] -> {200000,0,1,50},{200001,0,1,50},{200002,0,1,50},
A7: 200003 | B7: 魔力手镯 | C7: 1 | D7: 0 | E7: 1 | F7: 10 | G7: ="{"&RC[-6]&","&RC[-3]&","&RC[-2]&","&RC[-1]&"}," -> {200003,0,1,10}, | H7: =R[-1]C&RC[-1] -> {200000,0,1,10},{200001,0,1,10},{200002,0,1,10},{200003,0,1,10}, | J7: 200003 | K7: 魔力手镯 | L7: 1 | M7: 0 | N7: 1 | O7: 60 | P7: ="{"&RC[-6]&","&RC[-3]&","&RC[-2]&","&RC[-1]&"}," -> {200003,0,1,60}, | Q7: =R[-1]C&RC[-1] -> {200000,0,1,60},{200001,0,1,60},{200002,0,1,60},{200003,0,1,60}, | S7: 200003 | T7: 魔力手镯 | U7: 1 | V7: 0 | W7: 1 | X7: 70 | Y7: ="{"&RC[-6]&","&RC[-3]&","&RC[-2]&","&RC[-1]&"}," -> {200003,0,1,70}, | Z7: =R[-1]C&RC[-1] -> {200000,0,1,70},{200001,0,1,70},{200002,0,1,70},{200003,0,1,70}, | AB7: 200003 | AC7: 魔力手镯 | AD7: 1 | AE7: 0 | AF7: 1 | AG7: 60 | AH7: ="{"&RC[-6]&","&RC[-3]&","&RC[-2]&","&RC[-1]&"}," -> {200003,0,1,60}, | AI7: =R[-1]C&RC[-1] -> {200000,0,1,60},{200001,0,1,60},{200002,0,1,60},{200003,0,1,60}, | AK7: 200003 | AL7: 魔力手镯 | AM7: 1 | AN7: 0 | AO7: 1 | AP7: 50 | AQ7: ="{"&RC[-6]&","&RC[-3]&","&RC[-2]&","&RC[-1]&"}," -> {200003,0,1,50}, | AR7: =R[-1]C&RC[-1] -> {200000,0,1,50},{200001,0,1,50},{200002,0,1,50},{200003,0,1,50},
A8: 200006 | B8: 恶魔项链 | C8: 1 | D8: 0 | E8: 1 | F8: 10 | G8: ="{"&RC[-6]&","&RC[-3]&","&RC[-2]&","&RC[-1]&"}," -> {200006,0,1,10}, | H8: =R[-1]C&RC[-1] -> {200000,0,1,10},{200001,0,1,10},{200002,0,1,10},{200003,0,1,10},{200006,0,1,10}, | J8: 200006 | K8: 恶魔项链 | L8: 1 | M8: 0 | N8: 1 | O8: 60 | P8: ="{"&RC[-6]&","&RC[-3]&","&RC[-2]&","&RC[-1]&"}," -> {200006,0,1,60}, | Q8: =R[-1]C&RC[-1] -> {200000,0,1,60},{200001,0,1,60},{200002,0,1,60},{200003,0,1,60},{200006,0,1,60}, | S8: 200006 | T8: 恶魔项链 | U8: 1 | V8: 0 | W8: 1 | X8: 70 | Y8: ="{"&RC[-6]&","&RC[-3]&","&RC[-2]&","&RC[-1]&"}," -> {200006,0,1,70}, | Z8: =R[-1]C&RC[-1] -> {200000,0,1,70},{200001,0,1,70},{200002,0,1,70},{200003,0,1,70},{200006,0,1,70}, | AB8: 200006 | AC8: 恶魔项链 | AD8: 1 | AE8: 0 | AF8: 1 | AG8: 60 | AH8: ="{"&RC[-6]&","&RC[-3]&","&RC[-2]&","&RC[-1]&"}," -> {200006,0,1,60}, | AI8: =R[-1]C&RC[-1] -> {200000,0,1,60},{200001,0,1,60},{200002,0,1,60},{200003,0,1,60},{200006,0,1,60}, | AK8: 200006 | AL8: 恶魔项链 | AM8: 1 | AN8: 0 | AO8: 1 | AP8: 50 | AQ8: ="{"&RC[-6]&","&RC[-3]&","&RC[-2]&","&RC[-1]&"}," -> {200006,0,1,50}, | AR8: =R[-1]C&RC[-1] -> {200000,0,1,50},{200001,0,1,50},{200002,0,1,50},{200003,0,1,50},{200006,0,1,50},
A9: 201000 | B9: 海魂 | C9: 1 | D9: 0 | E9: 1 | F9: 10 | G9: ="{"&RC[-6]&","&RC[-3]&","&RC[-2]&","&RC[-1]&"}," -> {201000,0,1,10}, | H9: =R[-1]C&RC[-1] -> {200000,0,1,10},{200001,0,1,10},{200002,0,1,10},{200003,0,1,10},{200006,0,1,10},{201000,0,1,10}, | J9: 200010 | K9: 炼狱 | L9: 1 | M9: 0 | N9: 1 | O9: 2 | P9: ="{"&RC[-6]&","&RC[-3]&","&RC[-2]&","&RC[-1]&"}," -> {200010,0,1,2}, | Q9: =R[-1]C&RC[-1] -> {200000,0,1,60},{200001,0,1,60},{200002,0,1,60},{200003,0,1,60},{200006,0,1,60},{200010,0,1,2}, | S9: 200010 | T9: 炼狱 | U9: 1 | V9: 0 | W9: 1 | X9: 20 | Y9: ="{"&RC[-6]&","&RC[-3]&","&RC[-2]&","&RC[-1]&"}," -> {200010,0,1,20}, | Z9: =R[-1]C&RC[-1] -> {200000,0,1,70},{200001,0,1,70},{200002,0,1,70},{200003,0,1,70},{200006,0,1,70},{200010,0,1,20}, | AB9: 200010 | AC9: 炼狱 | AD9: 1 | AE9: 0 | AF9: 1 | AG9: 20 | AH9: ="{"&RC[-6]&","&RC[-3]&","&RC[-2]&","&RC[-1]&"}," -> {200010,0,1,20}, | AI9: =R[-1]C&RC[-1] -> {200000,0,1,60},{200001,0,1,60},{200002,0,1,60},{200003,0,1,60},{200006,0,1,60},{200010,0,1,20}, | AK9: 200010 | AL9: 炼狱 | AM9: 1 | AN9: 0 | AO9: 1 | AP9: 30 | AQ9: ="{"&RC[-6]&","&RC[-3]&","&RC[-2]&","&RC[-1]&"}," -> {200010,0,1,30}, | AR9: =R[-1]C&RC[-1] -> {200000,0,1,50},{200001,0,1,50},{200002,0,1,50},{200003,0,1,50},{200006,0,1,50},{200010,0,1,30},
A10: 201001 | B10: 轻盔 | C10: 1 | D10: 0 | E10: 1 | F10: 10 | G10: ="{"&RC[-6]&","&RC[-3]&","&RC[-2]&","&RC[-1]&"}," -> {201001,0,1,10}, | H10: =R[-1]C&RC[-1] -> {200000,0,1,10},{200001,0,1,10},{200002,0,1,10},{200003,0,1,10},{200006,0,1,10},{201000,0,1,10},{201001,0,1,10}, | J10: 200011 | K10: 绿色项链 | L10: 1 | M10: 0 | N10: 1 | O10: 2 | P10: ="{"&RC[-6]&","&RC[-3]&","&RC[-2]&","&RC[-1]&"}," -> {200011,0,1,2}, | Q10: =R[-1]C&RC[-1] -> {200000,0,1,60},{200001,0,1,60},{200002,0,1,60},{200003,0,1,60},{200006,0,1,60},{200010,0,1,2},{200011,0,1,2}, | S10: 200011 | T10: 绿色项链 | U10: 1 | V10: 0 | W10: 1 | X10: 20 | Y10: ="{"&RC[-6]&","&RC[-3]&","&RC[-2]&","&RC[-1]&"}," -> {200011,0,1,20}, | Z10: =R[-1]C&RC[-1] -> {200000,0,1,70},{200001,0,1,70},{200002,0,1,70},{200003,0,1,70},{200006,0,1,70},{200010,0,1,20},{200011,0,1,20}, | AB10: 200011 | AC10: 绿色项链 | AD10: 1 | AE10: 0 | AF10: 1 | AG10: 20 | AH10: ="{"&RC[-6]&","&RC[-3]&","&RC[-2]&","&RC[-1]&"}," -> {200011,0,1,20}, | AI10: =R[-1]C&RC[-1] -> {200000,0,1,60},{200001,0,1,60},{200002,0,1,60},{200003,0,1,60},{200006,0,1,60},{200010,0,1,20},{200011,0,1,20}, | AK10: 200011 | AL10: 绿色项链 | AM10: 1 | AN10: 0 | AO10: 1 | AP10: 30 | AQ10: ="{"&RC[-6]&","&RC[-3]&","&RC[-2]&","&RC[-1]&"}," -> {200011,0,1,30}, | AR10: =R[-1]C&RC[-1] -> {200000,0,1,50},{200001,0,1,50},{200002,0,1,50},{200003,0,1,50},{200006,0,1,50},{200010,0,1,30},{200011,0,1,30},
A11: 201002 | B11: 金戒指 | C11: 1 | D11: 0 | E11: 1 | F11: 10 | G11: ="{"&RC[-6]&","&RC[-3]&","&RC[-2]&","&RC[-1]&"}," -> {201002,0,1,10}, | H11: =R[-1]C&RC[-1] -> {200000,0,1,10},{200001,0,1,10},{200002,0,1,10},{200003,0,1,10},{200006,0,1,10},{201000,0,1,10},{201001,0,1,10},{201002,0,1,10}, | J11: 200012 | K11: 战神盔甲 | L11: 1 | M11: 0 | N11: 1 | O11: 2 | P11: ="{"&RC[-6]&","&RC[-3]&","&RC[-2]&","&RC[-1]&"}," -> {200012,0,1,2}, | Q11: =R[-1]C&RC[-1] -> {200000,0,1,60},{200001,0,1,60},{200002,0,1,60},{200003,0,1,60},{200006,0,1,60},{200010,0,1,2},{200011,0,1,2},{200012,0,1,2}, | S11: 200012 | T11: 战神盔甲 | U11: 1 | V11: 0 | W11: 1 | X11: 20 | Y11: ="{"&RC[-6]&","&RC[-3]&","&RC[-2]&","&RC[-1]&"}," -> {200012,0,1,20}, | Z11: =R[-1]C&RC[-1] -> {200000,0,1,70},{200001,0,1,70},{200002,0,1,70},{200003,0,1,70},{200006,0,1,70},{200010,0,1,20},{200011,0,1,20},{200012,0,1,20}, | AB11: 200012 | AC11: 战神盔甲 | AD11: 1 | AE11: 0 | AF11: 1 | AG11: 20 | AH11: ="{"&RC[-6]&","&RC[-3]&","&RC[-2]&","&RC[-1]&"}," -> {200012,0,1,20}, | AI11: =R[-1]C&RC[-1] -> {200000,0,1,60},{200001,0,1,60},{200002,0,1,60},{200003,0,1,60},{200006,0,1,60},{200010,0,1,20},{200011,0,1,20},{200012,0,1,20}, | AK11: 200012 | AL11: 战神盔甲 | AM11: 1 | AN11: 0 | AO11: 1 | AP11: 30 | AQ11: ="{"&RC[-6]&","&RC[-3]&","&RC[-2]&","&RC[-1]&"}," -> {200012,0,1,30}, | AR11: =R[-1]C&RC[-1] -> {200000,0,1,50},{200001,0,1,50},{200002,0,1,50},{200003,0,1,50},{200006,0,1,50},{200010,0,1,30},{200011,0,1,30},{200012,0,1,30},
A12: 201003 | B12: 魔法手镯 | C12: 1 | D12: 0 | E12: 1 | F12: 10 | G12: ="{"&RC[-6]&","&RC[-3]&","&RC[-2]&","&RC[-1]&"}," -> {201003,0,1,10}, | H12: =R[-1]C&RC[-1] -> {200000,0,1,10},{200001,0,1,10},{200002,0,1,10},{200003,0,1,10},{200006,0,1,10},{201000,0,1,10},{201001,0,1,10},{201002,0,1,10},{201003,0,1,10}, | J12: 201000 | K12: 海魂 | L12: 1 | M12: 0 | N12: 1 | O12: 60 | P12: ="{"&RC[-6]&","&RC[-3]&","&RC[-2]&","&RC[-1]&"}," -> {201000,0,1,60}, | Q12: =R[-1]C&RC[-1] -> {200000,0,1,60},{200001,0,1,60},{200002,0,1,60},{200003,0,1,60},{200006,0,1,60},{200010,0,1,2},{200011,0,1,2},{200012,0,1,2},{201000,0,1,60}, | S12: 200013 | T12: 力量戒指 | U12: 1 | V12: 0 | W12: 1 | X12: 20 | Y12: ="{"&RC[-6]&","&RC[-3]&","&RC[-2]&","&RC[-1]&"}," -> {200013,0,1,20}, | Z12: =R[-1]C&RC[-1] -> {200000,0,1,70},{200001,0,1,70},{200002,0,1,70},{200003,0,1,70},{200006,0,1,70},{200010,0,1,20},{200011,0,1,20},{200012,0,1,20},{200013,0,1,20}, | AB12: 200013 | AC12: 力量戒指 | AD12: 1 | AE12: 0 | AF12: 1 | AG12: 20 | AH12: ="{"&RC[-6]&","&RC[-3]&","&RC[-2]&","&RC[-1]&"}," -> {200013,0,1,20}, | AI12: =R[-1]C&RC[-1] -> {200000,0,1,60},{200001,0,1,60},{200002,0,1,60},{200003,0,1,60},{200006,0,1,60},{200010,0,1,20},{200011,0,1,20},{200012,0,1,20},{200013,0,1,20}, | AK12: 200013 | AL12: 力量戒指 | AM12: 1 | AN12: 0 | AO12: 1 | AP12: 30 | AQ12: ="{"&RC[-6]&","&RC[-3]&","&RC[-2]&","&RC[-1]&"}," -> {200013,0,1,30}, | AR12: =R[-1]C&RC[-1] -> {200000,0,1,50},{200001,0,1,50},{200002,0,1,50},{200003,0,1,50},{200006,0,1,50},{200010,0,1,30},{200011,0,1,30},{200012,0,1,30},{200013,0,1,30},
A13: 201006 | B13: 放大镜 | C13: 1 | D13: 0 | E13: 1 | F13: 10 | G13: ="{"&RC[-6]&","&RC[-3]&","&RC[-2]&","&RC[-1]&"}," -> {201006,0,1,10}, | H13: =R[-1]C&RC[-1] -> {200000,0,1,10},{200001,0,1,10},{200002,0,1,10},{200003,0,1,10},{200006,0,1,10},{201000,0,1,10},{201001,0,1,10},{201002,0,1,10},{201003,0,1,10},{201006,0,1,10}, | J13: 201001 | K13: 轻盔 | L13: 1 | M13: 0 | N13: 1 | O13: 60 | P13: ="{"&RC[-6]&","&RC[-3]&","&RC[-2]&","&RC[-1]&"}," -> {201001,0,1,60}, | Q13: =R[-1]C&RC[-1] -> {200000,0,1,60},{200001,0,1,60},{200002,0,1,60},{200003,0,1,60},{200006,0,1,60},{200010,0,1,2},{200011,0,1,2},{200012,0,1,2},{201000,0,1,60},{201001,0,1,60}, | S13: 200015 | T13: 战士头盔 | U13: 1 | V13: 0 | W13: 1 | X13: 20 | Y13: ="{"&RC[-6]&","&RC[-3]&","&RC[-2]&","&RC[-1]&"}," -> {200015,0,1,20}, | Z13: =R[-1]C&RC[-1] -> {200000,0,1,70},{200001,0,1,70},{200002,0,1,70},{200003,0,1,70},{200006,0,1,70},{200010,0,1,20},{200011,0,1,20},{200012,0,1,20},{200013,0,1,20},{200015,0,1,20}, | AB13: 200015 | AC13: 战士头盔 | AD13: 1 | AE13: 0 | AF13: 1 | AG13: 20 | AH13: ="{"&RC[-6]&","&RC[-3]&","&RC[-2]&","&RC[-1]&"}," -> {200015,0,1,20}, | AI13: =R[-1]C&RC[-1] -> {200000,0,1,60},{200001,0,1,60},{200002,0,1,60},{200003,0,1,60},{200006,0,1,60},{200010,0,1,20},{200011,0,1,20},{200012,0,1,20},{200013,0,1,20},{200015,0,1,20}, | AK13: 200015 | AL13: 战士头盔 | AM13: 1 | AN13: 0 | AO13: 1 | AP13: 30 | AQ13: ="{"&RC[-6]&","&RC[-3]&","&RC[-2]&","&RC[-1]&"}," -> {200015,0,1,30}, | AR13: =R[-1]C&RC[-1] -> {200000,0,1,50},{200001,0,1,50},{200002,0,1,50},{200003,0,1,50},{200006,0,1,50},{200010,0,1,30},{200011,0,1,30},{200012,0,1,30},{200013,0,1,30},{200015,0,1,30},
A14: 202000 | B14: 半月 | C14: 1 | D14: 0 | E14: 1 | F14: 10 | G14: ="{"&RC[-6]&","&RC[-3]&","&RC[-2]&","&RC[-1]&"}," -> {202000,0,1,10}, | H14: =R[-1]C&RC[-1] -> {200000,0,1,10},{200001,0,1,10},{200002,0,1,10},{200003,0,1,10},{200006,0,1,10},{201000,0,1,10},{201001,0,1,10},{201002,0,1,10},{201003,0,1,10},{201006,0,1,10},{202000,0,1,10}, | J14: 201002 | K14: 金戒指 | L14: 1 | M14: 0 | N14: 1 | O14: 60 | P14: ="{"&RC[-6]&","&RC[-3]&","&RC[-2]&","&RC[-1]&"}," -> {201002,0,1,60}, | Q14: =R[-1]C&RC[-1] -> {200000,0,1,60},{200001,0,1,60},{200002,0,1,60},{200003,0,1,60},{200006,0,1,60},{200010,0,1,2},{200011,0,1,2},{200012,0,1,2},{201000,0,1,60},{201001,0,1,60},{201002,0,1,60}, | S14: 200016 | T14: 阎罗手镯 | U14: 1 | V14: 0 | W14: 1 | X14: 20 | Y14: ="{"&RC[-6]&","&RC[-3]&","&RC[-2]&","&RC[-1]&"}," -> {200016,0,1,20}, | Z14: =R[-1]C&RC[-1] -> {200000,0,1,70},{200001,0,1,70},{200002,0,1,70},{200003,0,1,70},{200006,0,1,70},{200010,0,1,20},{200011,0,1,20},{200012,0,1,20},{200013,0,1,20},{200015,0,1,20},{200016,0,1,20}, | AB14: 200016 | AC14: 阎罗手镯 | AD14: 1 | AE14: 0 | AF14: 1 | AG14: 20 | AH14: ="{"&RC[-6]&","&RC[-3]&","&RC[-2]&","&RC[-1]&"}," -> {200016,0,1,20}, | AI14: =R[-1]C&RC[-1] -> {200000,0,1,60},{200001,0,1,60},{200002,0,1,60},{200003,0,1,60},{200006,0,1,60},{200010,0,1,20},{200011,0,1,20},{200012,0,1,20},{200013,0,1,20},{200015,0,1,20},{200016,0,1,20}, | AK14: 200016 | AL14: 阎罗手镯 | AM14: 1 | AN14: 0 | AO14: 1 | AP14: 30 | AQ14: ="{"&RC[-6]&","&RC[-3]&","&RC[-2]&","&RC[-1]&"}," -> {200016,0,1,30}, | AR14: =R[-1]C&RC[-1] -> {200000,0,1,50},{200001,0,1,50},{200002,0,1,50},{200003,0,1,50},{200006,0,1,50},{200010,0,1,30},{200011,0,1,30},{200012,0,1,30},{200013,0,1,30},{200015,0,1,30},{200016,0,1,30},
A15: 202001 | B15: 轻盔 | C15: 1 | D15: 0 | E15: 1 | F15: 10 | G15: ="{"&RC[-6]&","&RC[-3]&","&RC[-2]&","&RC[-1]&"}," -> {202001,0,1,10}, | H15: =R[-1]C&RC[-1] -> {200000,0,1,10},{200001,0,1,10},{200002,0,1,10},{200003,0,1,10},{200006,0,1,10},{201000,0,1,10},{201001,0,1,10},{201002,0,1,10},{201003,0,1,10},{201006,0,1,10},{202000,0,1,10},{202001,0,1,10}, | J15: 201003 | K15: 魔法手镯 | L15: 1 | M15: 0 | N15: 1 | O15: 60 | P15: ="{"&RC[-6]&","&RC[-3]&","&RC[-2]&","&RC[-1]&"}," -> {201003,0,1,60}, | Q15: =R[-1]C&RC[-1] -> {200000,0,1,60},{200001,0,1,60},{200002,0,1,60},{200003,0,1,60},{200006,0,1,60},{200010,0,1,2},{200011,0,1,2},{200012,0,1,2},{201000,0,1,60},{201001,0,1,60},{201002,0,1,60},{201003,0,1,60}, | S15: 200017 | T15: 战士腰带 | U15: 1 | V15: 0 | W15: 1 | X15: 20 | Y15: ="{"&RC[-6]&","&RC[-3]&","&RC[-2]&","&RC[-1]&"}," -> {200017,0,1,20}, | Z15: =R[-1]C&RC[-1] -> {200000,0,1,70},{200001,0,1,70},{200002,0,1,70},{200003,0,1,70},{200006,0,1,70},{200010,0,1,20},{200011,0,1,20},{200012,0,1,20},{200013,0,1,20},{200015,0,1,20},{200016,0,1,20},{200017,0,1,20}, | AB15: 200017 | AC15: 战士腰带 | AD15: 1 | AE15: 0 | AF15: 1 | AG15: 20 | AH15: ="{"&RC[-6]&","&RC[-3]&","&RC[-2]&","&RC[-1]&"}," -> {200017,0,1,20}, | AI15: =R[-1]C&RC[-1] -> {200000,0,1,60},{200001,0,1,60},{200002,0,1,60},{200003,0,1,60},{200006,0,1,60},{200010,0,1,20},{200011,0,1,20},{200012,0,1,20},{200013,0,1,20},{200015,0,1,20},{200016,0,1,20},{200017,0,1,20}, | AK15: 200017 | AL15: 战士腰带 | AM15: 1 | AN15: 0 | AO15: 1 | AP15: 30 | AQ15: ="{"&RC[-6]&","&RC[-3]&","&RC[-2]&","&RC[-1]&"}," -> {200017,0,1,30}, | AR15: =R[-1]C&RC[-1] -> {200000,0,1,50},{200001,0,1,50},{200002,0,1,50},{200003,0,1,50},{200006,0,1,50},{200010,0,1,30},{200011,0,1,30},{200012,0,1,30},{200013,0,1,30},{200015,0,1,30},{200016,0,1,30},{200017,0,1,30},
A16: 202002 | B16: 铂金戒指 | C16: 1 | D16: 0 | E16: 1 | F16: 10 | G16: ="{"&RC[-6]&","&RC[-3]&","&RC[-2]&","&RC[-1]&"}," -> {202002,0,1,10}, | H16: =R[-1]C&RC[-1] -> {200000,0,1,10},{200001,0,1,10},{200002,0,1,10},{200003,0,1,10},{200006,0,1,10},{201000,0,1,10},{201001,0,1,10},{201002,0,1,10},{201003,0,1,10},{201006,0,1,10},{202000,0,1,10},{202001,0,1,10},{202002,0,1,10}, | J16: 201006 | K16: 放大镜 | L16: 1 | M16: 0 | N16: 1 | O16: 60 | P16: ="{"&RC[-6]&","&RC[-3]&","&RC[-2]&","&RC[-1]&"}," -> {201006,0,1,60}, | Q16: =R[-1]C&RC[-1] -> {200000,0,1,60},{200001,0,1,60},{200002,0,1,60},{200003,0,1,60},{200006,0,1,60},{200010,0,1,2},{200011,0,1,2},{200012,0,1,2},{201000,0,1,60},{201001,0,1,60},{201002,0,1,60},{201003,0,1,60},{201006,0,1,60}, | S16: 200019 | T16: 战士鞋子 | U16: 1 | V16: 0 | W16: 1 | X16: 20 | Y16: ="{"&RC[-6]&","&RC[-3]&","&RC[-2]&","&RC[-1]&"}," -> {200019,0,1,20}, | Z16: =R[-1]C&RC[-1] -> {200000,0,1,70},{200001,0,1,70},{200002,0,1,70},{200003,0,1,70},{200006,0,1,70},{200010,0,1,20},{200011,0,1,20},{200012,0,1,20},{200013,0,1,20},{200015,0,1,20},{200016,0,1,20},{200017,0,1,20},{200019,0,1,20}, | AB16: 200019 | AC16: 战士鞋子 | AD16: 1 | AE16: 0 | AF16: 1 | AG16: 20 | AH16: ="{"&RC[-6]&","&RC[-3]&","&RC[-2]&","&RC[-1]&"}," -> {200019,0,1,20}, | AI16: =R[-1]C&RC[-1] -> {200000,0,1,60},{200001,0,1,60},{200002,0,1,60},{200003,0,1,60},{200006,0,1,60},{200010,0,1,20},{200011,0,1,20},{200012,0,1,20},{200013,0,1,20},{200015,0,1,20},{200016,0,1,20},{200017,0,1,20},{200019,0,1,20}, | AK16: 200019 | AL16: 战士鞋子 | AM16: 1 | AN16: 0 | AO16: 1 | AP16: 30 | AQ16: ="{"&RC[-6]&","&RC[-3]&","&RC[-2]&","&RC[-1]&"}," -> {200019,0,1,30}, | AR16: =R[-1]C&RC[-1] -> {200000,0,1,50},{200001,0,1,50},{200002,0,1,50},{200003,0,1,50},{200006,0,1,50},{200010,0,1,30},{200011,0,1,30},{200012,0,1,30},{200013,0,1,30},{200015,0,1,30},{200016,0,1,30},{200017,0,1,30},{200019,0,1,30},
A17: 202003 | B17: 三眼手镯 | C17: 1 | D17: 0 | E17: 1 | F17: 10 | G17: ="{"&RC[-6]&","&RC[-3]&","&RC[-2]&","&RC[-1]&"}," -> {202003,0,1,10}, | H17: =R[-1]C&RC[-1] -> {200000,0,1,10},{200001,0,1,10},{200002,0,1,10},{200003,0,1,10},{200006,0,1,10},{201000,0,1,10},{201001,0,1,10},{201002,0,1,10},{201003,0,1,10},{201006,0,1,10},{202000,0,1,10},{202001,0,1,10},{202002,0,1,10},{202003,0,1,10}, | J17: 201010 | K17: 魔杖 | L17: 1 | M17: 0 | N17: 1 | O17: 2 | P17: ="{"&RC[-6]&","&RC[-3]&","&RC[-2]&","&RC[-1]&"}," -> {201010,0,1,2}, | Q17: =R[-1]C&RC[-1] -> {200000,0,1,60},{200001,0,1,60},{200002,0,1,60},{200003,0,1,60},{200006,0,1,60},{200010,0,1,2},{200011,0,1,2},{200012,0,1,2},{201000,0,1,60},{201001,0,1,60},{201002,0,1,60},{201003,0,1,60},{201006,0,1,60},{201010,0,1,2}, | S17: 201000 | T17: 海魂 | U17: 1 | V17: 0 | W17: 1 | X17: 70 | Y17: ="{"&RC[-6]&","&RC[-3]&","&RC[-2]&","&RC[-1]&"}," -> {201000,0,1,70}, | Z17: =R[-1]C&RC[-1] -> {200000,0,1,70},{200001,0,1,70},{200002,0,1,70},{200003,0,1,70},{200006,0,1,70},{200010,0,1,20},{200011,0,1,20},{200012,0,1,20},{200013,0,1,20},{200015,0,1,20},{200016,0,1,20},{200017,0,1,20},{200019,0,1,20},{201000,0,1,70}, | AB17: 201000 | AC17: 海魂 | AD17: 1 | AE17: 0 | AF17: 1 | AG17: 60 | AH17: ="{"&RC[-6]&","&RC[-3]&","&RC[-2]&","&RC[-1]&"}," -> {201000,0,1,60}, | AI17: =R[-1]C&RC[-1] -> {200000,0,1,60},{200001,0,1,60},{200002,0,1,60},{200003,0,1,60},{200006,0,1,60},{200010,0,1,20},{200011,0,1,20},{200012,0,1,20},{200013,0,1,20},{200015,0,1,20},{200016,0,1,20},{200017,0,1,20},{200019,0,1,20},{201000,0,1,60}, | AK17: 201000 | AL17: 海魂 | AM17: 1 | AN17: 0 | AO17: 1 | AP17: 50 | AQ17: ="{"&RC[-6]&","&RC[-3]&","&RC[-2]&","&RC[-1]&"}," -> {201000,0,1,50}, | AR17: =R[-1]C&RC[-1] -> {200000,0,1,50},{200001,0,1,50},{200002,0,1,50},{200003,0,1,50},{200006,0,1,50},{200010,0,1,30},{200011,0,1,30},{200012,0,1,30},{200013,0,1,30},{200015,0,1,30},{200016,0,1,30},{200017,0,1,30},{200019,0,1,30},{201000,0,1,50},
A18: 202006 | B18: 凤凰明珠 | C18: 1 | D18: 0 | E18: 1 | F18: 10 | G18: ="{"&RC[-6]&","&RC[-3]&","&RC[-2]&","&RC[-1]&"}," -> {202006,0,1,10}, | H18: =R[-1]C&RC[-1] -> {200000,0,1,10},{200001,0,1,10},{200002,0,1,10},{200003,0,1,10},{200006,0,1,10},{201000,0,1,10},{201001,0,1,10},{201002,0,1,10},{201003,0,1,10},{201006,0,1,10},{202000,0,1,10},{202001,0,1,10},{202002,0,1,10},{202003,0,1,10},{202006,0,1,10}, | J18: 201011 | K18: 恶魔铃铛 | L18: 1 | M18: 0 | N18: 1 | O18: 2 | P18: ="{"&RC[-6]&","&RC[-3]&","&RC[-2]&","&RC[-1]&"}," -> {201011,0,1,2}, | Q18: =R[-1]C&RC[-1] -> {200000,0,1,60},{200001,0,1,60},{200002,0,1,60},{200003,0,1,60},{200006,0,1,60},{200010,0,1,2},{200011,0,1,2},{200012,0,1,2},{201000,0,1,60},{201001,0,1,60},{201002,0,1,60},{201003,0,1,60},{201006,0,1,60},{201010,0,1,2},{201011,0,1,2}, | S18: 201001 | T18: 轻盔 | U18: 1 | V18: 0 | W18: 1 | X18: 70 | Y18: ="{"&RC[-6]&","&RC[-3]&","&RC[-2]&","&RC[-1]&"}," -> {201001,0,1,70}, | Z18: =R[-1]C&RC[-1] -> {200000,0,1,70},{200001,0,1,70},{200002,0,1,70},{200003,0,1,70},{200006,0,1,70},{200010,0,1,20},{200011,0,1,20},{200012,0,1,20},{200013,0,1,20},{200015,0,1,20},{200016,0,1,20},{200017,0,1,20},{200019,0,1,20},{201000,0,1,70},{201001,0,1,70}, | AB18: 201001 | AC18: 轻盔 | AD18: 1 | AE18: 0 | AF18: 1 | AG18: 60 | AH18: ="{"&RC[-6]&","&RC[-3]&","&RC[-2]&","&RC[-1]&"}," -> {201001,0,1,60}, | AI18: =R[-1]C&RC[-1] -> {200000,0,1,60},{200001,0,1,60},{200002,0,1,60},{200003,0,1,60},{200006,0,1,60},{200010,0,1,20},{200011,0,1,20},{200012,0,1,20},{200013,0,1,20},{200015,0,1,20},{200016,0,1,20},{200017,0,1,20},{200019,0,1,20},{201000,0,1,60},{201001,0,1,60}, | AK18: 201001 | AL18: 轻盔 | AM18: 1 | AN18: 0 | AO18: 1 | AP18: 50 | AQ18: ="{"&RC[-6]&","&RC[-3]&","&RC[-2]&","&RC[-1]&"}," -> {201001,0,1,50}, | AR18: =R[-1]C&RC[-1] -> {200000,0,1,50},{200001,0,1,50},{200002,0,1,50},{200003,0,1,50},{200006,0,1,50},{200010,0,1,30},{200011,0,1,30},{200012,0,1,30},{200013,0,1,30},{200015,0,1,30},{200016,0,1,30},{200017,0,1,30},{200019,0,1,30},{201000,0,1,50},{201001,0,1,50},
A19: 110002 | B19: 强化石 | D19: 0 | E19: 1 | F19: 0 | G19: ="{"&RC[-6]&","&RC[-3]&","&RC[-2]&","&RC[-1]&"}," -> {110002,0,1,0}, | H19: =R[-1]C&RC[-1] -> {200000,0,1,10},{200001,0,1,10},{200002,0,1,10},{200003,0,1,10},{200006,0,1,10},{201000,0,1,10},{201001,0,1,10},{201002,0,1,10},{201003,0,1,10},{201006,0,1,10},{202000,0,1,10},{202001,0,1,10},{202002,0,1,10},{202003,0,1,10},{202006,0,1,10},{110002,0,1,0}, | J19: 201012 | K19: 恶魔长袍 | L19: 1 | M19: 0 | N19: 1 | O19: 2 | P19: ="{"&RC[-6]&","&RC[-3]&","&RC[-2]&","&RC[-1]&"}," -> {201012,0,1,2}, | Q19: =R[-1]C&RC[-1] -> {200000,0,1,60},{200001,0,1,60},{200002,0,1,60},{200003,0,1,60},{200006,0,1,60},{200010,0,1,2},{200011,0,1,2},{200012,0,1,2},{201000,0,1,60},{201001,0,1,60},{201002,0,1,60},{201003,0,1,60},{201006,0,1,60},{201010,0,1,2},{201011,0,1,2},{201012,0,1,2}, | S19: 201002 | T19: 金戒指 | U19: 1 | V19: 0 | W19: 1 | X19: 70 | Y19: ="{"&RC[-6]&","&RC[-3]&","&RC[-2]&","&RC[-1]&"}," -> {201002,0,1,70}, | Z19: =R[-1]C&RC[-1] -> {200000,0,1,70},{200001,0,1,70},{200002,0,1,70},{200003,0,1,70},{200006,0,1,70},{200010,0,1,20},{200011,0,1,20},{200012,0,1,20},{200013,0,1,20},{200015,0,1,20},{200016,0,1,20},{200017,0,1,20},{200019,0,1,20},{201000,0,1,70},{201001,0,1,70},{201002,0,1,70}, | AB19: 201002 | AC19: 金戒指 | AD19: 1 | AE19: 0 | AF19: 1 | AG19: 60 | AH19: ="{"&RC[-6]&","&RC[-3]&","&RC[-2]&","&RC[-1]&"}," -> {201002,0,1,60}, | AI19: =R[-1]C&RC[-1] -> {200000,0,1,60},{200001,0,1,60},{200002,0,1,60},{200003,0,1,60},{200006,0,1,60},{200010,0,1,20},{200011,0,1,20},{200012,0,1,20},{200013,0,1,20},{200015,0,1,20},{200016,0,1,20},{200017,0,1,20},{200019,0,1,20},{201000,0,1,60},{201001,0,1,60},{201002,0,1,60}, | AK19: 201002 | AL19: 金戒指 | AM19: 1 | AN19: 0 | AO19: 1 | AP19: 50 | AQ19: ="{"&RC[-6]&","&RC[-3]&","&RC[-2]&","&RC[-1]&"}," -> {201002,0,1,50}, | AR19: =R[-1]C&RC[-1] -> {200000,0,1,50},{200001,0,1,50},{200002,0,1,50},{200003,0,1,50},{200006,0,1,50},{200010,0,1,30},{200011,0,1,30},{200012,0,1,30},{200013,0,1,30},{200015,0,1,30},{200016,0,1,30},{200017,0,1,30},{200019,0,1,30},{201000,0,1,50},{201001,0,1,50},{201002,0,1,50},
A20: 110003 | B20: 洗炼石 | D20: 0 | E20: 1 | F20: 0 | G20: ="{"&RC[-6]&","&RC[-3]&","&RC[-2]&","&RC[-1]&"}," -> {110003,0,1,0}, | H20: =R[-1]C&RC[-1] -> {200000,0,1,10},{200001,0,1,10},{200002,0,1,10},{200003,0,1,10},{200006,0,1,10},{201000,0,1,10},{201001,0,1,10},{201002,0,1,10},{201003,0,1,10},{201006,0,1,10},{202000,0,1,10},{202001,0,1,10},{202002,0,1,10},{202003,0,1,10},{202006,0,1,10},{110002,0,1,0},{110003,0,1,0}, | J20: 202000 | K20: 半月 | L20: 1 | M20: 0 | N20: 1 | O20: 60 | P20: ="{"&RC[-6]&","&RC[-3]&","&RC[-2]&","&RC[-1]&"}," -> {202000,0,1,60}, | Q20: =R[-1]C&RC[-1] -> {200000,0,1,60},{200001,0,1,60},{200002,0,1,60},{200003,0,1,60},{200006,0,1,60},{200010,0,1,2},{200011,0,1,2},{200012,0,1,2},{201000,0,1,60},{201001,0,1,60},{201002,0,1,60},{201003,0,1,60},{201006,0,1,60},{201010,0,1,2},{201011,0,1,2},{201012,0,1,2},{202000,0,1,60}, | S20: 201003 | T20: 魔法手镯 | U20: 1 | V20: 0 | W20: 1 | X20: 70 | Y20: ="{"&RC[-6]&","&RC[-3]&","&RC[-2]&","&RC[-1]&"}," -> {201003,0,1,70}, | Z20: =R[-1]C&RC[-1] -> {200000,0,1,70},{200001,0,1,70},{200002,0,1,70},{200003,0,1,70},{200006,0,1,70},{200010,0,1,20},{200011,0,1,20},{200012,0,1,20},{200013,0,1,20},{200015,0,1,20},{200016,0,1,20},{200017,0,1,20},{200019,0,1,20},{201000,0,1,70},{201001,0,1,70},{201002,0,1,70},{201003,0,1,70}, | AB20: 201003 | AC20: 魔法手镯 | AD20: 1 | AE20: 0 | AF20: 1 | AG20: 60 | AH20: ="{"&RC[-6]&","&RC[-3]&","&RC[-2]&","&RC[-1]&"}," -> {201003,0,1,60}, | AI20: =R[-1]C&RC[-1] -> {200000,0,1,60},{200001,0,1,60},{200002,0,1,60},{200003,0,1,60},{200006,0,1,60},{200010,0,1,20},{200011,0,1,20},{200012,0,1,20},{200013,0,1,20},{200015,0,1,20},{200016,0,1,20},{200017,0,1,20},{200019,0,1,20},{201000,0,1,60},{201001,0,1,60},{201002,0,1,60},{201003,0,1,60}, | AK20: 201003 | AL20: 魔法手镯 | AM20: 1 | AN20: 0 | AO20: 1 | AP20: 50 | AQ20: ="{"&RC[-6]&","&RC[-3]&","&RC[-2]&","&RC[-1]&"}," -> {201003,0,1,50}, | AR20: =R[-1]C&RC[-1] -> {200000,0,1,50},{200001,0,1,50},{200002,0,1,50},{200003,0,1,50},{200006,0,1,50},{200010,0,1,30},{200011,0,1,30},{200012,0,1,30},{200013,0,1,30},{200015,0,1,30},{200016,0,1,30},{200017,0,1,30},{200019,0,1,30},{201000,0,1,50},{201001,0,1,50},{201002,0,1,50},{201003,0,1,50},
A21: 110004 | B21: 红药 | D21: 0 | E21: 1 | F21: 200 | G21: ="{"&RC[-6]&","&RC[-3]&","&RC[-2]&","&RC[-1]&"}," -> {110004,0,1,200}, | H21: =R[-1]C&RC[-1] -> {200000,0,1,10},{200001,0,1,10},{200002,0,1,10},{200003,0,1,10},{200006,0,1,10},{201000,0,1,10},{201001,0,1,10},{201002,0,1,10},{201003,0,1,10},{201006,0,1,10},{202000,0,1,10},{202001,0,1,10},{202002,0,1,10},{202003,0,1,10},{202006,0,1,10},{110002,0,1,0},{110003,0,1,0},{110004,0,1,200}, | J21: 202001 | K21: 轻盔 | L21: 1 | M21: 0 | N21: 1 | O21: 60 | P21: ="{"&RC[-6]&","&RC[-3]&","&RC[-2]&","&RC[-1]&"}," -> {202001,0,1,60}, | Q21: =R[-1]C&RC[-1] -> {200000,0,1,60},{200001,0,1,60},{200002,0,1,60},{200003,0,1,60},{200006,0,1,60},{200010,0,1,2},{200011,0,1,2},{200012,0,1,2},{201000,0,1,60},{201001,0,1,60},{201002,0,1,60},{201003,0,1,60},{201006,0,1,60},{201010,0,1,2},{201011,0,1,2},{201012,0,1,2},{202000,0,1,60},{202001,0,1,60}, | S21: 201006 | T21: 放大镜 | U21: 1 | V21: 0 | W21: 1 | X21: 70 | Y21: ="{"&RC[-6]&","&RC[-3]&","&RC[-2]&","&RC[-1]&"}," -> {201006,0,1,70}, | Z21: =R[-1]C&RC[-1] -> {200000,0,1,70},{200001,0,1,70},{200002,0,1,70},{200003,0,1,70},{200006,0,1,70},{200010,0,1,20},{200011,0,1,20},{200012,0,1,20},{200013,0,1,20},{200015,0,1,20},{200016,0,1,20},{200017,0,1,20},{200019,0,1,20},{201000,0,1,70},{201001,0,1,70},{201002,0,1,70},{201003,0,1,70},{201006,0,1,70}, | AB21: 201006 | AC21: 放大镜 | AD21: 1 | AE21: 0 | AF21: 1 | AG21: 60 | AH21: ="{"&RC[-6]&","&RC[-3]&","&RC[-2]&","&RC[-1]&"}," -> {201006,0,1,60}, | AI21: =R[-1]C&RC[-1] -> {200000,0,1,60},{200001,0,1,60},{200002,0,1,60},{200003,0,1,60},{200006,0,1,60},{200010,0,1,20},{200011,0,1,20},{200012,0,1,20},{200013,0,1,20},{200015,0,1,20},{200016,0,1,20},{200017,0,1,20},{200019,0,1,20},{201000,0,1,60},{201001,0,1,60},{201002,0,1,60},{201003,0,1,60},{201006,0,1,60}, | AK21: 201006 | AL21: 放大镜 | AM21: 1 | AN21: 0 | AO21: 1 | AP21: 50 | AQ21: ="{"&RC[-6]&","&RC[-3]&","&RC[-2]&","&RC[-1]&"}," -> {201006,0,1,50}, | AR21: =R[-1]C&RC[-1] -> {200000,0,1,50},{200001,0,1,50},{200002,0,1,50},{200003,0,1,50},{200006,0,1,50},{200010,0,1,30},{200011,0,1,30},{200012,0,1,30},{200013,0,1,30},{200015,0,1,30},{200016,0,1,30},{200017,0,1,30},{200019,0,1,30},{201000,0,1,50},{201001,0,1,50},{201002,0,1,50},{201003,0,1,50},{201006,0,1,50},
A22: 110005 | B22: 蓝药 | D22: 0 | E22: 1 | F22: 200 | G22: ="{"&RC[-6]&","&RC[-3]&","&RC[-2]&","&RC[-1]&"}," -> {110005,0,1,200}, | H22: =R[-1]C&RC[-1] -> {200000,0,1,10},{200001,0,1,10},{200002,0,1,10},{200003,0,1,10},{200006,0,1,10},{201000,0,1,10},{201001,0,1,10},{201002,0,1,10},{201003,0,1,10},{201006,0,1,10},{202000,0,1,10},{202001,0,1,10},{202002,0,1,10},{202003,0,1,10},{202006,0,1,10},{110002,0,1,0},{110003,0,1,0},{110004,0,1,200},{110005,0,1,200}, | J22: 202002 | K22: 铂金戒指 | L22: 1 | M22: 0 | N22: 1 | O22: 60 | P22: ="{"&RC[-6]&","&RC[-3]&","&RC[-2]&","&RC[-1]&"}," -> {202002,0,1,60}, | Q22: =R[-1]C&RC[-1] -> {200000,0,1,60},{200001,0,1,60},{200002,0,1,60},{200003,0,1,60},{200006,0,1,60},{200010,0,1,2},{200011,0,1,2},{200012,0,1,2},{201000,0,1,60},{201001,0,1,60},{201002,0,1,60},{201003,0,1,60},{201006,0,1,60},{201010,0,1,2},{201011,0,1,2},{201012,0,1,2},{202000,0,1,60},{202001,0,1,60},{202002,0,1,60}, | S22: 201010 | T22: 魔杖 | U22: 1 | V22: 0 | W22: 1 | X22: 20 | Y22: ="{"&RC[-6]&","&RC[-3]&","&RC[-2]&","&RC[-1]&"}," -> {201010,0,1,20}, | Z22: =R[-1]C&RC[-1] -> {200000,0,1,70},{200001,0,1,70},{200002,0,1,70},{200003,0,1,70},{200006,0,1,70},{200010,0,1,20},{200011,0,1,20},{200012,0,1,20},{200013,0,1,20},{200015,0,1,20},{200016,0,1,20},{200017,0,1,20},{200019,0,1,20},{201000,0,1,70},{201001,0,1,70},{201002,0,1,70},{201003,0,1,70},{201006,0,1,70},{201010,0,1,20}, | AB22: 201010 | AC22: 魔杖 | AD22: 1 | AE22: 0 | AF22: 1 | AG22: 20 | AH22: ="{"&RC[-6]&","&RC[-3]&","&RC[-2]&","&RC[-1]&"}," -> {201010,0,1,20}, | AI22: =R[-1]C&RC[-1] -> {200000,0,1,60},{200001,0,1,60},{200002,0,1,60},{200003,0,1,60},{200006,0,1,60},{200010,0,1,20},{200011,0,1,20},{200012,0,1,20},{200013,0,1,20},{200015,0,1,20},{200016,0,1,20},{200017,0,1,20},{200019,0,1,20},{201000,0,1,60},{201001,0,1,60},{201002,0,1,60},{201003,0,1,60},{201006,0,1,60},{201010,0,1,20}, | AK22: 201010 | AL22: 魔杖 | AM22: 1 | AN22: 0 | AO22: 1 | AP22: 30 | AQ22: ="{"&RC[-6]&","&RC[-3]&","&RC[-2]&","&RC[-1]&"}," -> {201010,0,1,30}, | AR22: =R[-1]C&RC[-1] -> {200000,0,1,50},{200001,0,1,50},{200002,0,1,50},{200003,0,1,50},{200006,0,1,50},{200010,0,1,30},{200011,0,1,30},{200012,0,1,30},{200013,0,1,30},{200015,0,1,30},{200016,0,1,30},{200017,0,1,30},{200019,0,1,30},{201000,0,1,50},{201001,0,1,50},{201002,0,1,50},{201003,0,1,50},{201006,0,1,50},{201010,0,1,30},
A23: 110010 | B23: 普通武装碎片 | D23: 0 | E23: 1 | F23: 0 | G23: ="{"&RC[-6]&","&RC[-3]&","&RC[-2]&","&RC[-1]&"}," -> {110010,0,1,0}, | H23: =R[-1]C&RC[-1] -> {200000,0,1,10},{200001,0,1,10},{200002,0,1,10},{200003,0,1,10},{200006,0,1,10},{201000,0,1,10},{201001,0,1,10},{201002,0,1,10},{201003,0,1,10},{201006,0,1,10},{202000,0,1,10},{202001,0,1,10},{202002,0,1,10},{202003,0,1,10},{202006,0,1,10},{110002,0,1,0},{110003,0,1,0},{110004,0,1,200},{110005,0,1,200},{110010,0,1,0}, | J23: 202003 | K23: 三眼手镯 | L23: 1 | M23: 0 | N23: 1 | O23: 60 | P23: ="{"&RC[-6]&","&RC[-3]&","&RC[-2]&","&RC[-1]&"}," -> {202003,0,1,60}, | Q23: =R[-1]C&RC[-1] -> {200000,0,1,60},{200001,0,1,60},{200002,0,1,60},{200003,0,1,60},{200006,0,1,60},{200010,0,1,2},{200011,0,1,2},{200012,0,1,2},{201000,0,1,60},{201001,0,1,60},{201002,0,1,60},{201003,0,1,60},{201006,0,1,60},{201010,0,1,2},{201011,0,1,2},{201012,0,1,2},{202000,0,1,60},{202001,0,1,60},{202002,0,1,60},{202003,0,1,60}, | S23: 201011 | T23: 恶魔铃铛 | U23: 1 | V23: 0 | W23: 1 | X23: 20 | Y23: ="{"&RC[-6]&","&RC[-3]&","&RC[-2]&","&RC[-1]&"}," -> {201011,0,1,20}, | Z23: =R[-1]C&RC[-1] -> {200000,0,1,70},{200001,0,1,70},{200002,0,1,70},{200003,0,1,70},{200006,0,1,70},{200010,0,1,20},{200011,0,1,20},{200012,0,1,20},{200013,0,1,20},{200015,0,1,20},{200016,0,1,20},{200017,0,1,20},{200019,0,1,20},{201000,0,1,70},{201001,0,1,70},{201002,0,1,70},{201003,0,1,70},{201006,0,1,70},{201010,0,1,20},{201011,0,1,20}, | AB23: 201011 | AC23: 恶魔铃铛 | AD23: 1 | AE23: 0 | AF23: 1 | AG23: 20 | AH23: ="{"&RC[-6]&","&RC[-3]&","&RC[-2]&","&RC[-1]&"}," -> {201011,0,1,20}, | AI23: =R[-1]C&RC[-1] -> {200000,0,1,60},{200001,0,1,60},{200002,0,1,60},{200003,0,1,60},{200006,0,1,60},{200010,0,1,20},{200011,0,1,20},{200012,0,1,20},{200013,0,1,20},{200015,0,1,20},{200016,0,1,20},{200017,0,1,20},{200019,0,1,20},{201000,0,1,60},{201001,0,1,60},{201002,0,1,60},{201003,0,1,60},{201006,0,1,60},{201010,0,1,20},{201011,0,1,20}, | AK23: 201011 | AL23: 恶魔铃铛 | AM23: 1 | AN23: 0 | AO23: 1 | AP23: 30 | AQ23: ="{"&RC[-6]&","&RC[-3]&","&RC[-2]&","&RC[-1]&"}," -> {201011,0,1,30}, | AR23: =R[-1]C&RC[-1] -> {200000,0,1,50},{200001,0,1,50},{200002,0,1,50},{200003,0,1,50},{200006,0,1,50},{200010,0,1,30},{200011,0,1,30},{200012,0,1,30},{200013,0,1,30},{200015,0,1,30},{200016,0,1,30},{200017,0,1,30},{200019,0,1,30},{201000,0,1,50},{201001,0,1,50},{201002,0,1,50},{201003,0,1,50},{201006,0,1,50},{201010,0,1,30},{201011,0,1,30},
A24: 110011 | B24: 普通防具碎片 | D24: 0 | E24: 1 | F24: 0 | G24: ="{"&RC[-6]&","&RC[-3]&","&RC[-2]&","&RC[-1]&"}," -> {110011,0,1,0}, | H24: =R[-1]C&RC[-1] -> {200000,0,1,10},{200001,0,1,10},{200002,0,1,10},{200003,0,1,10},{200006,0,1,10},{201000,0,1,10},{201001,0,1,10},{201002,0,1,10},{201003,0,1,10},{201006,0,1,10},{202000,0,1,10},{202001,0,1,10},{202002,0,1,10},{202003,0,1,10},{202006,0,1,10},{110002,0,1,0},{110003,0,1,0},{110004,0,1,200},{110005,0,1,200},{110010,0,1,0},{110011,0,1,0}, | J24: 202006 | K24: 凤凰明珠 | L24: 1 | M24: 0 | N24: 1 | O24: 60 | P24: ="{"&RC[-6]&","&RC[-3]&","&RC[-2]&","&RC[-1]&"}," -> {202006,0,1,60}, | Q24: =R[-1]C&RC[-1] -> {200000,0,1,60},{200001,0,1,60},{200002,0,1,60},{200003,0,1,60},{200006,0,1,60},{200010,0,1,2},{200011,0,1,2},{200012,0,1,2},{201000,0,1,60},{201001,0,1,60},{201002,0,1,60},{201003,0,1,60},{201006,0,1,60},{201010,0,1,2},{201011,0,1,2},{201012,0,1,2},{202000,0,1,60},{202001,0,1,60},{202002,0,1,60},{202003,0,1,60},{202006,0,1,60}, | S24: 201012 | T24: 恶魔长袍 | U24: 1 | V24: 0 | W24: 1 | X24: 20 | Y24: ="{"&RC[-6]&","&RC[-3]&","&RC[-2]&","&RC[-1]&"}," -> {201012,0,1,20}, | Z24: =R[-1]C&RC[-1] -> {200000,0,1,70},{200001,0,1,70},{200002,0,1,70},{200003,0,1,70},{200006,0,1,70},{200010,0,1,20},{200011,0,1,20},{200012,0,1,20},{200013,0,1,20},{200015,0,1,20},{200016,0,1,20},{200017,0,1,20},{200019,0,1,20},{201000,0,1,70},{201001,0,1,70},{201002,0,1,70},{201003,0,1,70},{201006,0,1,70},{201010,0,1,20},{201011,0,1,20},{201012,0,1,20}, | AB24: 201012 | AC24: 恶魔长袍 | AD24: 1 | AE24: 0 | AF24: 1 | AG24: 20 | AH24: ="{"&RC[-6]&","&RC[-3]&","&RC[-2]&","&RC[-1]&"}," -> {201012,0,1,20}, | AI24: =R[-1]C&RC[-1] -> {200000,0,1,60},{200001,0,1,60},{200002,0,1,60},{200003,0,1,60},{200006,0,1,60},{200010,0,1,20},{200011,0,1,20},{200012,0,1,20},{200013,0,1,20},{200015,0,1,20},{200016,0,1,20},{200017,0,1,20},{200019,0,1,20},{201000,0,1,60},{201001,0,1,60},{201002,0,1,60},{201003,0,1,60},{201006,0,1,60},{201010,0,1,20},{201011,0,1,20},{201012,0,1,20}, | AK24: 201012 | AL24: 恶魔长袍 | AM24: 1 | AN24: 0 | AO24: 1 | AP24: 30 | AQ24: ="{"&RC[-6]&","&RC[-3]&","&RC[-2]&","&RC[-1]&"}," -> {201012,0,1,30}, | AR24: =R[-1]C&RC[-1] -> {200000,0,1,50},{200001,0,1,50},{200002,0,1,50},{200003,0,1,50},{200006,0,1,50},{200010,0,1,30},{200011,0,1,30},{200012,0,1,30},{200013,0,1,30},{200015,0,1,30},{200016,0,1,30},{200017,0,1,30},{200019,0,1,30},{201000,0,1,50},{201001,0,1,50},{201002,0,1,50},{201003,0,1,50},{201006,0,1,50},{201010,0,1,30},{201011,0,1,30},{201012,0,1,30},
A25: 110012 | B25: 普通首饰碎片 | D25: 0 | E25: 1 | F25: 0 | G25: ="{"&RC[-6]&","&RC[-3]&","&RC[-2]&","&RC[-1]&"}," -> {110012,0,1,0}, | H25: =R[-1]C&RC[-1] -> {200000,0,1,10},{200001,0,1,10},{200002,0,1,10},{200003,0,1,10},{200006,0,1,10},{201000,0,1,10},{201001,0,1,10},{201002,0,1,10},{201003,0,1,10},{201006,0,1,10},{202000,0,1,10},{202001,0,1,10},{202002,0,1,10},{202003,0,1,10},{202006,0,1,10},{110002,0,1,0},{110003,0,1,0},{110004,0,1,200},{110005,0,1,200},{110010,0,1,0},{110011,0,1,0},{110012,0,1,0}, | J25: 202010 | K25: 银蛇 | L25: 1 | M25: 0 | N25: 1 | O25: 2 | P25: ="{"&RC[-6]&","&RC[-3]&","&RC[-2]&","&RC[-1]&"}," -> {202010,0,1,2}, | Q25: =R[-1]C&RC[-1] -> {200000,0,1,60},{200001,0,1,60},{200002,0,1,60},{200003,0,1,60},{200006,0,1,60},{200010,0,1,2},{200011,0,1,2},{200012,0,1,2},{201000,0,1,60},{201001,0,1,60},{201002,0,1,60},{201003,0,1,60},{201006,0,1,60},{201010,0,1,2},{201011,0,1,2},{201012,0,1,2},{202000,0,1,60},{202001,0,1,60},{202002,0,1,60},{202003,0,1,60},{202006,0,1,60},{202010,0,1,2}, | S25: 201013 | T25: 紫碧螺 | U25: 1 | V25: 0 | W25: 1 | X25: 20 | Y25: ="{"&RC[-6]&","&RC[-3]&","&RC[-2]&","&RC[-1]&"}," -> {201013,0,1,20}, | Z25: =R[-1]C&RC[-1] -> {200000,0,1,70},{200001,0,1,70},{200002,0,1,70},{200003,0,1,70},{200006,0,1,70},{200010,0,1,20},{200011,0,1,20},{200012,0,1,20},{200013,0,1,20},{200015,0,1,20},{200016,0,1,20},{200017,0,1,20},{200019,0,1,20},{201000,0,1,70},{201001,0,1,70},{201002,0,1,70},{201003,0,1,70},{201006,0,1,70},{201010,0,1,20},{201011,0,1,20},{201012,0,1,20},{201013,0,1,20}, | AB25: 201013 | AC25: 紫碧螺 | AD25: 1 | AE25: 0 | AF25: 1 | AG25: 20 | AH25: ="{"&RC[-6]&","&RC[-3]&","&RC[-2]&","&RC[-1]&"}," -> {201013,0,1,20}, | AI25: =R[-1]C&RC[-1] -> {200000,0,1,60},{200001,0,1,60},{200002,0,1,60},{200003,0,1,60},{200006,0,1,60},{200010,0,1,20},{200011,0,1,20},{200012,0,1,20},{200013,0,1,20},{200015,0,1,20},{200016,0,1,20},{200017,0,1,20},{200019,0,1,20},{201000,0,1,60},{201001,0,1,60},{201002,0,1,60},{201003,0,1,60},{201006,0,1,60},{201010,0,1,20},{201011,0,1,20},{201012,0,1,20},{201013,0,1,20}, | AK25: 201013 | AL25: 紫碧螺 | AM25: 1 | AN25: 0 | AO25: 1 | AP25: 30 | AQ25: ="{"&RC[-6]&","&RC[-3]&","&RC[-2]&","&RC[-1]&"}," -> {201013,0,1,30}, | AR25: =R[-1]C&RC[-1] -> {200000,0,1,50},{200001,0,1,50},{200002,0,1,50},{200003,0,1,50},{200006,0,1,50},{200010,0,1,30},{200011,0,1,30},{200012,0,1,30},{200013,0,1,30},{200015,0,1,30},{200016,0,1,30},{200017,0,1,30},{200019,0,1,30},{201000,0,1,50},{201001,0,1,50},{201002,0,1,50},{201003,0,1,50},{201006,0,1,50},{201010,0,1,30},{201011,0,1,30},{201012,0,1,30},{201013,0,1,30},
A26: 110009 | B26: 金币 | D26: 0 | E26: 1 | F26: 100 | G26: ="{"&RC[-6]&","&RC[-3]&","&RC[-2]&","&RC[-1]&"}" -> {110009,0,1,100} | H26: =R[-1]C&RC[-1] -> {200000,0,1,10},{200001,0,1,10},{200002,0,1,10},{200003,0,1,10},{200006,0,1,10},{201000,0,1,10},{201001,0,1,10},{201002,0,1,10},{201003,0,1,10},{201006,0,1,10},{202000,0,1,10},{202001,0,1,10},{202002,0,1,10},{202003,0,1,10},{202006,0,1,10},{110002,0,1,0},{110003,0,1,0},{110004,0,1,200},{110005,0,1,200},{110010,0,1,0},{110011,0,1,0},{110012,0,1,0},{110009,0,1,100} | J26: 202011 | K26: 天珠道链 | L26: 1 | M26: 0 | N26: 1 | O26: 2 | P26: ="{"&RC[-6]&","&RC[-3]&","&RC[-2]&","&RC[-1]&"}," -> {202011,0,1,2}, | Q26: =R[-1]C&RC[-1] -> {200000,0,1,60},{200001,0,1,60},{200002,0,1,60},{200003,0,1,60},{200006,0,1,60},{200010,0,1,2},{200011,0,1,2},{200012,0,1,2},{201000,0,1,60},{201001,0,1,60},{201002,0,1,60},{201003,0,1,60},{201006,0,1,60},{201010,0,1,2},{201011,0,1,2},{201012,0,1,2},{202000,0,1,60},{202001,0,1,60},{202002,0,1,60},{202003,0,1,60},{202006,0,1,60},{202010,0,1,2},{202011,0,1,2}, | S26: 201015 | T26: 法师头盔 | U26: 1 | V26: 0 | W26: 1 | X26: 20 | Y26: ="{"&RC[-6]&","&RC[-3]&","&RC[-2]&","&RC[-1]&"}," -> {201015,0,1,20}, | Z26: =R[-1]C&RC[-1] -> {200000,0,1,70},{200001,0,1,70},{200002,0,1,70},{200003,0,1,70},{200006,0,1,70},{200010,0,1,20},{200011,0,1,20},{200012,0,1,20},{200013,0,1,20},{200015,0,1,20},{200016,0,1,20},{200017,0,1,20},{200019,0,1,20},{201000,0,1,70},{201001,0,1,70},{201002,0,1,70},{201003,0,1,70},{201006,0,1,70},{201010,0,1,20},{201011,0,1,20},{201012,0,1,20},{201013,0,1,20},{201015,0,1,20}, | AB26: 201015 | AC26: 法师头盔 | AD26: 1 | AE26: 0 | AF26: 1 | AG26: 20 | AH26: ="{"&RC[-6]&","&RC[-3]&","&RC[-2]&","&RC[-1]&"}," -> {201015,0,1,20}, | AI26: =R[-1]C&RC[-1] -> {200000,0,1,60},{200001,0,1,60},{200002,0,1,60},{200003,0,1,60},{200006,0,1,60},{200010,0,1,20},{200011,0,1,20},{200012,0,1,20},{200013,0,1,20},{200015,0,1,20},{200016,0,1,20},{200017,0,1,20},{200019,0,1,20},{201000,0,1,60},{201001,0,1,60},{201002,0,1,60},{201003,0,1,60},{201006,0,1,60},{201010,0,1,20},{201011,0,1,20},{201012,0,1,20},{201013,0,1,20},{201015,0,1,20}, | AK26: 201015 | AL26: 法师头盔 | AM26: 1 | AN26: 0 | AO26: 1 | AP26: 30 | AQ26: ="{"&RC[-6]&","&RC[-3]&","&RC[-2]&","&RC[-1]&"}," -> {201015,0,1,30}, | AR26: =R[-1]C&RC[-1] -> {200000,0,1,50},{200001,0,1,50},{200002,0,1,50},{200003,0,1,50},{200006,0,1,50},{200010,0,1,30},{200011,0,1,30},{200012,0,1,30},{200013,0,1,30},{200015,0,1,30},{200016,0,1,30},{200017,0,1,30},{200019,0,1,30},{201000,0,1,50},{201001,0,1,50},{201002,0,1,50},{201003,0,1,50},{201006,0,1,50},{201010,0,1,30},{201011,0,1,30},{201012,0,1,30},{201013,0,1,30},{201015,0,1,30},
A27: 道具掉落 | F27: 掉落数量 | G27: 概率／100 | J27: 202012 | K27: 灵魂道袍 | L27: 1 | M27: 0 | N27: 1 | O27: 2 | P27: ="{"&RC[-6]&","&RC[-3]&","&RC[-2]&","&RC[-1]&"}," -> {202012,0,1,2}, | Q27: =R[-1]C&RC[-1] -> {200000,0,1,60},{200001,0,1,60},{200002,0,1,60},{200003,0,1,60},{200006,0,1,60},{200010,0,1,2},{200011,0,1,2},{200012,0,1,2},{201000,0,1,60},{201001,0,1,60},{201002,0,1,60},{201003,0,1,60},{201006,0,1,60},{201010,0,1,2},{201011,0,1,2},{201012,0,1,2},{202000,0,1,60},{202001,0,1,60},{202002,0,1,60},{202003,0,1,60},{202006,0,1,60},{202010,0,1,2},{202011,0,1,2},{202012,0,1,2}, | S27: 201016 | T27: 龙之手镯 | U27: 1 | V27: 0 | W27: 1 | X27: 20 | Y27: ="{"&RC[-6]&","&RC[-3]&","&RC[-2]&","&RC[-1]&"}," -> {201016,0,1,20}, | Z27: =R[-1]C&RC[-1] -> {200000,0,1,70},{200001,0,1,70},{200002,0,1,70},{200003,0,1,70},{200006,0,1,70},{200010,0,1,20},{200011,0,1,20},{200012,0,1,20},{200013,0,1,20},{200015,0,1,20},{200016,0,1,20},{200017,0,1,20},{200019,0,1,20},{201000,0,1,70},{201001,0,1,70},{201002,0,1,70},{201003,0,1,70},{201006,0,1,70},{201010,0,1,20},{201011,0,1,20},{201012,0,1,20},{201013,0,1,20},{201015,0,1,20},{201016,0,1,20}, | AB27: 201016 | AC27: 龙之手镯 | AD27: 1 | AE27: 0 | AF27: 1 | AG27: 20 | AH27: ="{"&RC[-6]&","&RC[-3]&","&RC[-2]&","&RC[-1]&"}," -> {201016,0,1,20}, | AI27: =R[-1]C&RC[-1] -> {200000,0,1,60},{200001,0,1,60},{200002,0,1,60},{200003,0,1,60},{200006,0,1,60},{200010,0,1,20},{200011,0,1,20},{200012,0,1,20},{200013,0,1,20},{200015,0,1,20},{200016,0,1,20},{200017,0,1,20},{200019,0,1,20},{201000,0,1,60},{201001,0,1,60},{201002,0,1,60},{201003,0,1,60},{201006,0,1,60},{201010,0,1,20},{201011,0,1,20},{201012,0,1,20},{201013,0,1,20},{201015,0,1,20},{201016,0,1,20}, | AK27: 201016 | AL27: 龙之手镯 | AM27: 1 | AN27: 0 | AO27: 1 | AP27: 30 | AQ27: ="{"&RC[-6]&","&RC[-3]&","&RC[-2]&","&RC[-1]&"}," -> {201016,0,1,30}, | AR27: =R[-1]C&RC[-1] -> {200000,0,1,50},{200001,0,1,50},{200002,0,1,50},{200003,0,1,50},{200006,0,1,50},{200010,0,1,30},{200011,0,1,30},{200012,0,1,30},{200013,0,1,30},{200015,0,1,30},{200016,0,1,30},{200017,0,1,30},{200019,0,1,30},{201000,0,1,50},{201001,0,1,50},{201002,0,1,50},{201003,0,1,50},{201006,0,1,50},{201010,0,1,30},{201011,0,1,30},{201012,0,1,30},{201013,0,1,30},{201015,0,1,30},{201016,0,1,30},
F28: 0 | G28: =10000-R[1]C -> 9500 | H28: ="{"&RC[-2]&","&RC[-1]&"}," -> {0,9500}, | J28: 110002 | K28: 强化石 | M28: 0 | N28: 1 | O28: 0 | P28: ="{"&RC[-6]&","&RC[-3]&","&RC[-2]&","&RC[-1]&"}," -> {110002,0,1,0}, | Q28: =R[-1]C&RC[-1] -> {200000,0,1,60},{200001,0,1,60},{200002,0,1,60},{200003,0,1,60},{200006,0,1,60},{200010,0,1,2},{200011,0,1,2},{200012,0,1,2},{201000,0,1,60},{201001,0,1,60},{201002,0,1,60},{201003,0,1,60},{201006,0,1,60},{201010,0,1,2},{201011,0,1,2},{201012,0,1,2},{202000,0,1,60},{202001,0,1,60},{202002,0,1,60},{202003,0,1,60},{202006,0,1,60},{202010,0,1,2},{202011,0,1,2},{202012,0,1,2},{110002,0,1,0}, | S28: 201017 | T28: 法师腰带 | U28: 1 | V28: 0 | W28: 1 | X28: 20 | Y28: ="{"&RC[-6]&","&RC[-3]&","&RC[-2]&","&RC[-1]&"}," -> {201017,0,1,20}, | Z28: =R[-1]C&RC[-1] -> {200000,0,1,70},{200001,0,1,70},{200002,0,1,70},{200003,0,1,70},{200006,0,1,70},{200010,0,1,20},{200011,0,1,20},{200012,0,1,20},{200013,0,1,20},{200015,0,1,20},{200016,0,1,20},{200017,0,1,20},{200019,0,1,20},{201000,0,1,70},{201001,0,1,70},{201002,0,1,70},{201003,0,1,70},{201006,0,1,70},{201010,0,1,20},{201011,0,1,20},{201012,0,1,20},{201013,0,1,20},{201015,0,1,20},{201016,0,1,20},{201017,0,1,20}, | AB28: 201017 | AC28: 法师腰带 | AD28: 1 | AE28: 0 | AF28: 1 | AG28: 20 | AH28: ="{"&RC[-6]&","&RC[-3]&","&RC[-2]&","&RC[-1]&"}," -> {201017,0,1,20}, | AI28: =R[-1]C&RC[-1] -> {200000,0,1,60},{200001,0,1,60},{200002,0,1,60},{200003,0,1,60},{200006,0,1,60},{200010,0,1,20},{200011,0,1,20},{200012,0,1,20},{200013,0,1,20},{200015,0,1,20},{200016,0,1,20},{200017,0,1,20},{200019,0,1,20},{201000,0,1,60},{201001,0,1,60},{201002,0,1,60},{201003,0,1,60},{201006,0,1,60},{201010,0,1,20},{201011,0,1,20},{201012,0,1,20},{201013,0,1,20},{201015,0,1,20},{201016,0,1,20},{201017,0,1,20}, | AK28: 201017 | AL28: 法师腰带 | AM28: 1 | AN28: 0 | AO28: 1 | AP28: 30 | AQ28: ="{"&RC[-6]&","&RC[-3]&","&RC[-2]&","&RC[-1]&"}," -> {201017,0,1,30}, | AR28: =R[-1]C&RC[-1] -> {200000,0,1,50},{200001,0,1,50},{200002,0,1,50},{200003,0,1,50},{200006,0,1,50},{200010,0,1,30},{200011,0,1,30},{200012,0,1,30},{200013,0,1,30},{200015,0,1,30},{200016,0,1,30},{200017,0,1,30},{200019,0,1,30},{201000,0,1,50},{201001,0,1,50},{201002,0,1,50},{201003,0,1,50},{201006,0,1,50},{201010,0,1,30},{201011,0,1,30},{201012,0,1,30},{201013,0,1,30},{201015,0,1,30},{201016,0,1,30},{201017,0,1,30},
F29: 1 | G29: 500 | H29: ="{"&RC[-2]&","&RC[-1]&"}" -> {1,500} | J29: 110003 | K29: 洗炼石 | M29: 0 | N29: 1 | O29: 0 | P29: ="{"&RC[-6]&","&RC[-3]&","&RC[-2]&","&RC[-1]&"}," -> {110003,0,1,0}, | Q29: =R[-1]C&RC[-1] -> {200000,0,1,60},{200001,0,1,60},{200002,0,1,60},{200003,0,1,60},{200006,0,1,60},{200010,0,1,2},{200011,0,1,2},{200012,0,1,2},{201000,0,1,60},{201001,0,1,60},{201002,0,1,60},{201003,0,1,60},{201006,0,1,60},{201010,0,1,2},{201011,0,1,2},{201012,0,1,2},{202000,0,1,60},{202001,0,1,60},{202002,0,1,60},{202003,0,1,60},{202006,0,1,60},{202010,0,1,2},{202011,0,1,2},{202012,0,1,2},{110002,0,1,0},{110003,0,1,0}, | S29: 201019 | T29: 法师鞋子 | U29: 1 | V29: 0 | W29: 1 | X29: 20 | Y29: ="{"&RC[-6]&","&RC[-3]&","&RC[-2]&","&RC[-1]&"}," -> {201019,0,1,20}, | Z29: =R[-1]C&RC[-1] -> {200000,0,1,70},{200001,0,1,70},{200002,0,1,70},{200003,0,1,70},{200006,0,1,70},{200010,0,1,20},{200011,0,1,20},{200012,0,1,20},{200013,0,1,20},{200015,0,1,20},{200016,0,1,20},{200017,0,1,20},{200019,0,1,20},{201000,0,1,70},{201001,0,1,70},{201002,0,1,70},{201003,0,1,70},{201006,0,1,70},{201010,0,1,20},{201011,0,1,20},{201012,0,1,20},{201013,0,1,20},{201015,0,1,20},{201016,0,1,20},{201017,0,1,20},{201019,0,1,20}, | AB29: 201019 | AC29: 法师鞋子 | AD29: 1 | AE29: 0 | AF29: 1 | AG29: 20 | AH29: ="{"&RC[-6]&","&RC[-3]&","&RC[-2]&","&RC[-1]&"}," -> {201019,0,1,20}, | AI29: =R[-1]C&RC[-1] -> {200000,0,1,60},{200001,0,1,60},{200002,0,1,60},{200003,0,1,60},{200006,0,1,60},{200010,0,1,20},{200011,0,1,20},{200012,0,1,20},{200013,0,1,20},{200015,0,1,20},{200016,0,1,20},{200017,0,1,20},{200019,0,1,20},{201000,0,1,60},{201001,0,1,60},{201002,0,1,60},{201003,0,1,60},{201006,0,1,60},{201010,0,1,20},{201011,0,1,20},{201012,0,1,20},{201013,0,1,20},{201015,0,1,20},{201016,0,1,20},{201017,0,1,20},{201019,0,1,20}, | AK29: 201019 | AL29: 法师鞋子 | AM29: 1 | AN29: 0 | AO29: 1 | AP29: 30 | AQ29: ="{"&RC[-6]&","&RC[-3]&","&RC[-2]&","&RC[-1]&"}," -> {201019,0,1,30}, | AR29: =R[-1]C&RC[-1] -> {200000,0,1,50},{200001,0,1,50},{200002,0,1,50},{200003,0,1,50},{200006,0,1,50},{200010,0,1,30},{200011,0,1,30},{200012,0,1,30},{200013,0,1,30},{200015,0,1,30},{200016,0,1,30},{200017,0,1,30},{200019,0,1,30},{201000,0,1,50},{201001,0,1,50},{201002,0,1,50},{201003,0,1,50},{201006,0,1,50},{201010,0,1,30},{201011,0,1,30},{201012,0,1,30},{201013,0,1,30},{201015,0,1,30},{201016,0,1,30},{201017,0,1,30},{201019,0,1,30},
J30: 110004 | K30: 红药 | M30: 0 | N30: 1 | O30: 100 | P30: ="{"&RC[-6]&","&RC[-3]&","&RC[-2]&","&RC[-1]&"}," -> {110004,0,1,100}, | Q30: =R[-1]C&RC[-1] -> {200000,0,1,60},{200001,0,1,60},{200002,0,1,60},{200003,0,1,60},{200006,0,1,60},{200010,0,1,2},{200011,0,1,2},{200012,0,1,2},{201000,0,1,60},{201001,0,1,60},{201002,0,1,60},{201003,0,1,60},{201006,0,1,60},{201010,0,1,2},{201011,0,1,2},{201012,0,1,2},{202000,0,1,60},{202001,0,1,60},{202002,0,1,60},{202003,0,1,60},{202006,0,1,60},{202010,0,1,2},{202011,0,1,2},{202012,0,1,2},{110002,0,1,0},{110003,0,1,0},{110004,0,1,100}, | S30: 202000 | T30: 半月 | U30: 1 | V30: 0 | W30: 1 | X30: 70 | Y30: ="{"&RC[-6]&","&RC[-3]&","&RC[-2]&","&RC[-1]&"}," -> {202000,0,1,70}, | Z30: =R[-1]C&RC[-1] -> {200000,0,1,70},{200001,0,1,70},{200002,0,1,70},{200003,0,1,70},{200006,0,1,70},{200010,0,1,20},{200011,0,1,20},{200012,0,1,20},{200013,0,1,20},{200015,0,1,20},{200016,0,1,20},{200017,0,1,20},{200019,0,1,20},{201000,0,1,70},{201001,0,1,70},{201002,0,1,70},{201003,0,1,70},{201006,0,1,70},{201010,0,1,20},{201011,0,1,20},{201012,0,1,20},{201013,0,1,20},{201015,0,1,20},{201016,0,1,20},{201017,0,1,20},{201019,0,1,20},{202000,0,1,70}, | AB30: 202000 | AC30: 半月 | AD30: 1 | AE30: 0 | AF30: 1 | AG30: 60 | AH30: ="{"&RC[-6]&","&RC[-3]&","&RC[-2]&","&RC[-1]&"}," -> {202000,0,1,60}, | AI30: =R[-1]C&RC[-1] -> {200000,0,1,60},{200001,0,1,60},{200002,0,1,60},{200003,0,1,60},{200006,0,1,60},{200010,0,1,20},{200011,0,1,20},{200012,0,1,20},{200013,0,1,20},{200015,0,1,20},{200016,0,1,20},{200017,0,1,20},{200019,0,1,20},{201000,0,1,60},{201001,0,1,60},{201002,0,1,60},{201003,0,1,60},{201006,0,1,60},{201010,0,1,20},{201011,0,1,20},{201012,0,1,20},{201013,0,1,20},{201015,0,1,20},{201016,0,1,20},{201017,0,1,20},{201019,0,1,20},{202000,0,1,60}, | AK30: 202000 | AL30: 半月 | AM30: 1 | AN30: 0 | AO30: 1 | AP30: 50 | AQ30: ="{"&RC[-6]&","&RC[-3]&","&RC[-2]&","&RC[-1]&"}," -> {202000,0,1,50}, | AR30: =R[-1]C&RC[-1] -> {200000,0,1,50},{200001,0,1,50},{200002,0,1,50},{200003,0,1,50},{200006,0,1,50},{200010,0,1,30},{200011,0,1,30},{200012,0,1,30},{200013,0,1,30},{200015,0,1,30},{200016,0,1,30},{200017,0,1,30},{200019,0,1,30},{201000,0,1,50},{201001,0,1,50},{201002,0,1,50},{201003,0,1,50},{201006,0,1,50},{201010,0,1,30},{201011,0,1,30},{201012,0,1,30},{201013,0,1,30},{201015,0,1,30},{201016,0,1,30},{201017,0,1,30},{201019,0,1,30},{202000,0,1,50},
A31: 总掉落 | H31: ="[{0,["&R[-3]C&R[-2]C&"],["&R[-5]C&"]}]" -> [{0,[{0,9500},{1,500}],[{200000,0,1,10},{200001,0,1,10},{200002,0,1,10},{200003,0,1,10},{200006,0,1,10},{201000,0,1,10},{201001,0,1,10},{201002,0,1,10},{201003,0,1,10},{201006,0,1,10},{202000,0,1,10},{202001,0,1,10},{202002,0,1,10},{202003,0,1,10},{202006,0,1,10},{110002,0,1,0},{110003,0,1,0},{110004,0,1,200},{110005,0,1,200},{110010,0,1,0},{110011,0,1,0},{110012,0,1,0},{110009,0,1,100}]}] | J31: 110005 | K31: 蓝药 | M31: 0 | N31: 1 | O31: 100 | P31: ="{"&RC[-6]&","&RC[-3]&","&RC[-2]&","&RC[-1]&"}," -> {110005,0,1,100}, | Q31: =R[-1]C&RC[-1] -> {200000,0,1,60},{200001,0,1,60},{200002,0,1,60},{200003,0,1,60},{200006,0,1,60},{200010,0,1,2},{200011,0,1,2},{200012,0,1,2},{201000,0,1,60},{201001,0,1,60},{201002,0,1,60},{201003,0,1,60},{201006,0,1,60},{201010,0,1,2},{201011,0,1,2},{201012,0,1,2},{202000,0,1,60},{202001,0,1,60},{202002,0,1,60},{202003,0,1,60},{202006,0,1,60},{202010,0,1,2},{202011,0,1,2},{202012,0,1,2},{110002,0,1,0},{110003,0,1,0},{110004,0,1,100},{110005,0,1,100}, | S31: 202001 | T31: 轻盔 | U31: 1 | V31: 0 | W31: 1 | X31: 70 | Y31: ="{"&RC[-6]&","&RC[-3]&","&RC[-2]&","&RC[-1]&"}," -> {202001,0,1,70}, | Z31: =R[-1]C&RC[-1] -> {200000,0,1,70},{200001,0,1,70},{200002,0,1,70},{200003,0,1,70},{200006,0,1,70},{200010,0,1,20},{200011,0,1,20},{200012,0,1,20},{200013,0,1,20},{200015,0,1,20},{200016,0,1,20},{200017,0,1,20},{200019,0,1,20},{201000,0,1,70},{201001,0,1,70},{201002,0,1,70},{201003,0,1,70},{201006,0,1,70},{201010,0,1,20},{201011,0,1,20},{201012,0,1,20},{201013,0,1,20},{201015,0,1,20},{201016,0,1,20},{201017,0,1,20},{201019,0,1,20},{202000,0,1,70},{202001,0,1,70}, | AB31: 202001 | AC31: 轻盔 | AD31: 1 | AE31: 0 | AF31: 1 | AG31: 60 | AH31: ="{"&RC[-6]&","&RC[-3]&","&RC[-2]&","&RC[-1]&"}," -> {202001,0,1,60}, | AI31: =R[-1]C&RC[-1] -> {200000,0,1,60},{200001,0,1,60},{200002,0,1,60},{200003,0,1,60},{200006,0,1,60},{200010,0,1,20},{200011,0,1,20},{200012,0,1,20},{200013,0,1,20},{200015,0,1,20},{200016,0,1,20},{200017,0,1,20},{200019,0,1,20},{201000,0,1,60},{201001,0,1,60},{201002,0,1,60},{201003,0,1,60},{201006,0,1,60},{201010,0,1,20},{201011,0,1,20},{201012,0,1,20},{201013,0,1,20},{201015,0,1,20},{201016,0,1,20},{201017,0,1,20},{201019,0,1,20},{202000,0,1,60},{202001,0,1,60}, | AK31: 202001 | AL31: 轻盔 | AM31: 1 | AN31: 0 | AO31: 1 | AP31: 50 | AQ31: ="{"&RC[-6]&","&RC[-3]&","&RC[-2]&","&RC[-1]&"}," -> {202001,0,1,50}, | AR31: =R[-1]C&RC[-1] -> {200000,0,1,50},{200001,0,1,50},{200002,0,1,50},{200003,0,1,50},{200006,0,1,50},{200010,0,1,30},{200011,0,1,30},{200012,0,1,30},{200013,0,1,30},{200015,0,1,30},{200016,0,1,30},{200017,0,1,30},{200019,0,1,30},{201000,0,1,50},{201001,0,1,50},{201002,0,1,50},{201003,0,1,50},{201006,0,1,50},{201010,0,1,30},{201011,0,1,30},{201012,0,1,30},{201013,0,1,30},{201015,0,1,30},{201016,0,1,30},{201017,0,1,30},{201019,0,1,30},{202000,0,1,50},{202001,0,1,50},
J32: 110010 | K32: 普通武装碎片 | M32: 0 | N32: 1 | O32: 10 | P32: ="{"&RC[-6]&","&RC[-3]&","&RC[-2]&","&RC[-1]&"}," -> {110010,0,1,10}, | Q32: =R[-1]C&RC[-1] -> {200000,0,1,60},{200001,0,1,60},{200002,0,1,60},{200003,0,1,60},{200006,0,1,60},{200010,0,1,2},{200011,0,1,2},{200012,0,1,2},{201000,0,1,60},{201001,0,1,60},{201002,0,1,60},{201003,0,1,60},{201006,0,1,60},{201010,0,1,2},{201011,0,1,2},{201012,0,1,2},{202000,0,1,60},{202001,0,1,60},{202002,0,1,60},{202003,0,1,60},{202006,0,1,60},{202010,0,1,2},{202011,0,1,2},{202012,0,1,2},{110002,0,1,0},{110003,0,1,0},{110004,0,1,100},{110005,0,1,100},{110010,0,1,10}, | S32: 202002 | T32: 铂金戒指 | U32: 1 | V32: 0 | W32: 1 | X32: 70 | Y32: ="{"&RC[-6]&","&RC[-3]&","&RC[-2]&","&RC[-1]&"}," -> {202002,0,1,70}, | Z32: =R[-1]C&RC[-1] -> {200000,0,1,70},{200001,0,1,70},{200002,0,1,70},{200003,0,1,70},{200006,0,1,70},{200010,0,1,20},{200011,0,1,20},{200012,0,1,20},{200013,0,1,20},{200015,0,1,20},{200016,0,1,20},{200017,0,1,20},{200019,0,1,20},{201000,0,1,70},{201001,0,1,70},{201002,0,1,70},{201003,0,1,70},{201006,0,1,70},{201010,0,1,20},{201011,0,1,20},{201012,0,1,20},{201013,0,1,20},{201015,0,1,20},{201016,0,1,20},{201017,0,1,20},{201019,0,1,20},{202000,0,1,70},{202001,0,1,70},{202002,0,1,70}, | AB32: 202002 | AC32: 铂金戒指 | AD32: 1 | AE32: 0 | AF32: 1 | AG32: 60 | AH32: ="{"&RC[-6]&","&RC[-3]&","&RC[-2]&","&RC[-1]&"}," -> {202002,0,1,60}, | AI32: =R[-1]C&RC[-1] -> {200000,0,1,60},{200001,0,1,60},{200002,0,1,60},{200003,0,1,60},{200006,0,1,60},{200010,0,1,20},{200011,0,1,20},{200012,0,1,20},{200013,0,1,20},{200015,0,1,20},{200016,0,1,20},{200017,0,1,20},{200019,0,1,20},{201000,0,1,60},{201001,0,1,60},{201002,0,1,60},{201003,0,1,60},{201006,0,1,60},{201010,0,1,20},{201011,0,1,20},{201012,0,1,20},{201013,0,1,20},{201015,0,1,20},{201016,0,1,20},{201017,0,1,20},{201019,0,1,20},{202000,0,1,60},{202001,0,1,60},{202002,0,1,60}, | AK32: 202002 | AL32: 铂金戒指 | AM32: 1 | AN32: 0 | AO32: 1 | AP32: 50 | AQ32: ="{"&RC[-6]&","&RC[-3]&","&RC[-2]&","&RC[-1]&"}," -> {202002,0,1,50}, | AR32: =R[-1]C&RC[-1] -> {200000,0,1,50},{200001,0,1,50},{200002,0,1,50},{200003,0,1,50},{200006,0,1,50},{200010,0,1,30},{200011,0,1,30},{200012,0,1,30},{200013,0,1,30},{200015,0,1,30},{200016,0,1,30},{200017,0,1,30},{200019,0,1,30},{201000,0,1,50},{201001,0,1,50},{201002,0,1,50},{201003,0,1,50},{201006,0,1,50},{201010,0,1,30},{201011,0,1,30},{201012,0,1,30},{201013,0,1,30},{201015,0,1,30},{201016,0,1,30},{201017,0,1,30},{201019,0,1,30},{202000,0,1,50},{202001,0,1,50},{202002,0,1,50},
B33: 掉落配置: [{职业限制, [{数量, 概率}, …], [{物品id, 是否绑定, 数量, 概率}, …]}, …] | J33: 110011 | K33: 普通防具碎片 | M33: 0 | N33: 1 | O33: 10 | P33: ="{"&RC[-6]&","&RC[-3]&","&RC[-2]&","&RC[-1]&"}," -> {110011,0,1,10}, | Q33: =R[-1]C&RC[-1] -> {200000,0,1,60},{200001,0,1,60},{200002,0,1,60},{200003,0,1,60},{200006,0,1,60},{200010,0,1,2},{200011,0,1,2},{200012,0,1,2},{201000,0,1,60},{201001,0,1,60},{201002,0,1,60},{201003,0,1,60},{201006,0,1,60},{201010,0,1,2},{201011,0,1,2},{201012,0,1,2},{202000,0,1,60},{202001,0,1,60},{202002,0,1,60},{202003,0,1,60},{202006,0,1,60},{202010,0,1,2},{202011,0,1,2},{202012,0,1,2},{110002,0,1,0},{110003,0,1,0},{110004,0,1,100},{110005,0,1,100},{110010,0,1,10},{110011,0,1,10}, | S33: 202003 | T33: 三眼手镯 | U33: 1 | V33: 0 | W33: 1 | X33: 70 | Y33: ="{"&RC[-6]&","&RC[-3]&","&RC[-2]&","&RC[-1]&"}," -> {202003,0,1,70}, | Z33: =R[-1]C&RC[-1] -> {200000,0,1,70},{200001,0,1,70},{200002,0,1,70},{200003,0,1,70},{200006,0,1,70},{200010,0,1,20},{200011,0,1,20},{200012,0,1,20},{200013,0,1,20},{200015,0,1,20},{200016,0,1,20},{200017,0,1,20},{200019,0,1,20},{201000,0,1,70},{201001,0,1,70},{201002,0,1,70},{201003,0,1,70},{201006,0,1,70},{201010,0,1,20},{201011,0,1,20},{201012,0,1,20},{201013,0,1,20},{201015,0,1,20},{201016,0,1,20},{201017,0,1,20},{201019,0,1,20},{202000,0,1,70},{202001,0,1,70},{202002,0,1,70},{202003,0,1,70}, | AB33: 202003 | AC33: 三眼手镯 | AD33: 1 | AE33: 0 | AF33: 1 | AG33: 60 | AH33: ="{"&RC[-6]&","&RC[-3]&","&RC[-2]&","&RC[-1]&"}," -> {202003,0,1,60}, | AI33: =R[-1]C&RC[-1] -> {200000,0,1,60},{200001,0,1,60},{200002,0,1,60},{200003,0,1,60},{200006,0,1,60},{200010,0,1,20},{200011,0,1,20},{200012,0,1,20},{200013,0,1,20},{200015,0,1,20},{200016,0,1,20},{200017,0,1,20},{200019,0,1,20},{201000,0,1,60},{201001,0,1,60},{201002,0,1,60},{201003,0,1,60},{201006,0,1,60},{201010,0,1,20},{201011,0,1,20},{201012,0,1,20},{201013,0,1,20},{201015,0,1,20},{201016,0,1,20},{201017,0,1,20},{201019,0,1,20},{202000,0,1,60},{202001,0,1,60},{202002,0,1,60},{202003,0,1,60}, | AK33: 202003 | AL33: 三眼手镯 | AM33: 1 | AN33: 0 | AO33: 1 | AP33: 50 | AQ33: ="{"&RC[-6]&","&RC[-3]&","&RC[-2]&","&RC[-1]&"}," -> {202003,0,1,50}, | AR33: =R[-1]C&RC[-1] -> {200000,0,1,50},{200001,0,1,50},{200002,0,1,50},{200003,0,1,50},{200006,0,1,50},{200010,0,1,30},{200011,0,1,30},{200012,0,1,30},{200013,0,1,30},{200015,0,1,30},{200016,0,1,30},{200017,0,1,30},{200019,0,1,30},{201000,0,1,50},{201001,0,1,50},{201002,0,1,50},{201003,0,1,50},{201006,0,1,50},{201010,0,1,30},{201011,0,1,30},{201012,0,1,30},{201013,0,1,30},{201015,0,1,30},{201016,0,1,30},{201017,0,1,30},{201019,0,1,30},{202000,0,1,50},{202001,0,1,50},{202002,0,1,50},{202003,0,1,50},
B34: 0非绑定，1绑定 | J34: 110012 | K34: 普通首饰碎片 | M34: 0 | N34: 1 | O34: 10 | P34: ="{"&RC[-6]&","&RC[-3]&","&RC[-2]&","&RC[-1]&"}," -> {110012,0,1,10}, | Q34: =R[-1]C&RC[-1] -> {200000,0,1,60},{200001,0,1,60},{200002,0,1,60},{200003,0,1,60},{200006,0,1,60},{200010,0,1,2},{200011,0,1,2},{200012,0,1,2},{201000,0,1,60},{201001,0,1,60},{201002,0,1,60},{201003,0,1,60},{201006,0,1,60},{201010,0,1,2},{201011,0,1,2},{201012,0,1,2},{202000,0,1,60},{202001,0,1,60},{202002,0,1,60},{202003,0,1,60},{202006,0,1,60},{202010,0,1,2},{202011,0,1,2},{202012,0,1,2},{110002,0,1,0},{110003,0,1,0},{110004,0,1,100},{110005,0,1,100},{110010,0,1,10},{110011,0,1,10},{110012,0,1,10}, | S34: 202006 | T34: 凤凰明珠 | U34: 1 | V34: 0 | W34: 1 | X34: 70 | Y34: ="{"&RC[-6]&","&RC[-3]&","&RC[-2]&","&RC[-1]&"}," -> {202006,0,1,70}, | Z34: =R[-1]C&RC[-1] -> {200000,0,1,70},{200001,0,1,70},{200002,0,1,70},{200003,0,1,70},{200006,0,1,70},{200010,0,1,20},{200011,0,1,20},{200012,0,1,20},{200013,0,1,20},{200015,0,1,20},{200016,0,1,20},{200017,0,1,20},{200019,0,1,20},{201000,0,1,70},{201001,0,1,70},{201002,0,1,70},{201003,0,1,70},{201006,0,1,70},{201010,0,1,20},{201011,0,1,20},{201012,0,1,20},{201013,0,1,20},{201015,0,1,20},{201016,0,1,20},{201017,0,1,20},{201019,0,1,20},{202000,0,1,70},{202001,0,1,70},{202002,0,1,70},{202003,0,1,70},{202006,0,1,70}, | AB34: 202006 | AC34: 凤凰明珠 | AD34: 1 | AE34: 0 | AF34: 1 | AG34: 60 | AH34: ="{"&RC[-6]&","&RC[-3]&","&RC[-2]&","&RC[-1]&"}," -> {202006,0,1,60}, | AI34: =R[-1]C&RC[-1] -> {200000,0,1,60},{200001,0,1,60},{200002,0,1,60},{200003,0,1,60},{200006,0,1,60},{200010,0,1,20},{200011,0,1,20},{200012,0,1,20},{200013,0,1,20},{200015,0,1,20},{200016,0,1,20},{200017,0,1,20},{200019,0,1,20},{201000,0,1,60},{201001,0,1,60},{201002,0,1,60},{201003,0,1,60},{201006,0,1,60},{201010,0,1,20},{201011,0,1,20},{201012,0,1,20},{201013,0,1,20},{201015,0,1,20},{201016,0,1,20},{201017,0,1,20},{201019,0,1,20},{202000,0,1,60},{202001,0,1,60},{202002,0,1,60},{202003,0,1,60},{202006,0,1,60}, | AK34: 202006 | AL34: 凤凰明珠 | AM34: 1 | AN34: 0 | AO34: 1 | AP34: 50 | AQ34: ="{"&RC[-6]&","&RC[-3]&","&RC[-2]&","&RC[-1]&"}," -> {202006,0,1,50}, | AR34: =R[-1]C&RC[-1] -> {200000,0,1,50},{200001,0,1,50},{200002,0,1,50},{200003,0,1,50},{200006,0,1,50},{200010,0,1,30},{200011,0,1,30},{200012,0,1,30},{200013,0,1,30},{200015,0,1,30},{200016,0,1,30},{200017,0,1,30},{200019,0,1,30},{201000,0,1,50},{201001,0,1,50},{201002,0,1,50},{201003,0,1,50},{201006,0,1,50},{201010,0,1,30},{201011,0,1,30},{201012,0,1,30},{201013,0,1,30},{201015,0,1,30},{201016,0,1,30},{201017,0,1,30},{201019,0,1,30},{202000,0,1,50},{202001,0,1,50},{202002,0,1,50},{202003,0,1,50},{202006,0,1,50},
J35: 110009 | K35: 金币 | M35: 0 | N35: 2 | O35: 100 | P35: ="{"&RC[-6]&","&RC[-3]&","&RC[-2]&","&RC[-1]&"}," -> {110009,0,2,100}, | Q35: =R[-1]C&RC[-1] -> {200000,0,1,60},{200001,0,1,60},{200002,0,1,60},{200003,0,1,60},{200006,0,1,60},{200010,0,1,2},{200011,0,1,2},{200012,0,1,2},{201000,0,1,60},{201001,0,1,60},{201002,0,1,60},{201003,0,1,60},{201006,0,1,60},{201010,0,1,2},{201011,0,1,2},{201012,0,1,2},{202000,0,1,60},{202001,0,1,60},{202002,0,1,60},{202003,0,1,60},{202006,0,1,60},{202010,0,1,2},{202011,0,1,2},{202012,0,1,2},{110002,0,1,0},{110003,0,1,0},{110004,0,1,100},{110005,0,1,100},{110010,0,1,10},{110011,0,1,10},{110012,0,1,10},{110009,0,2,100}, | S35: 202010 | T35: 银蛇 | U35: 1 | V35: 0 | W35: 1 | X35: 20 | Y35: ="{"&RC[-6]&","&RC[-3]&","&RC[-2]&","&RC[-1]&"}," -> {202010,0,1,20}, | Z35: =R[-1]C&RC[-1] -> {200000,0,1,70},{200001,0,1,70},{200002,0,1,70},{200003,0,1,70},{200006,0,1,70},{200010,0,1,20},{200011,0,1,20},{200012,0,1,20},{200013,0,1,20},{200015,0,1,20},{200016,0,1,20},{200017,0,1,20},{200019,0,1,20},{201000,0,1,70},{201001,0,1,70},{201002,0,1,70},{201003,0,1,70},{201006,0,1,70},{201010,0,1,20},{201011,0,1,20},{201012,0,1,20},{201013,0,1,20},{201015,0,1,20},{201016,0,1,20},{201017,0,1,20},{201019,0,1,20},{202000,0,1,70},{202001,0,1,70},{202002,0,1,70},{202003,0,1,70},{202006,0,1,70},{202010,0,1,20}, | AB35: 202010 | AC35: 银蛇 | AD35: 1 | AE35: 0 | AF35: 1 | AG35: 20 | AH35: ="{"&RC[-6]&","&RC[-3]&","&RC[-2]&","&RC[-1]&"}," -> {202010,0,1,20}, | AI35: =R[-1]C&RC[-1] -> {200000,0,1,60},{200001,0,1,60},{200002,0,1,60},{200003,0,1,60},{200006,0,1,60},{200010,0,1,20},{200011,0,1,20},{200012,0,1,20},{200013,0,1,20},{200015,0,1,20},{200016,0,1,20},{200017,0,1,20},{200019,0,1,20},{201000,0,1,60},{201001,0,1,60},{201002,0,1,60},{201003,0,1,60},{201006,0,1,60},{201010,0,1,20},{201011,0,1,20},{201012,0,1,20},{201013,0,1,20},{201015,0,1,20},{201016,0,1,20},{201017,0,1,20},{201019,0,1,20},{202000,0,1,60},{202001,0,1,60},{202002,0,1,60},{202003,0,1,60},{202006,0,1,60},{202010,0,1,20}, | AK35: 202010 | AL35: 银蛇 | AM35: 1 | AN35: 0 | AO35: 1 | AP35: 30 | AQ35: ="{"&RC[-6]&","&RC[-3]&","&RC[-2]&","&RC[-1]&"}," -> {202010,0,1,30}, | AR35: =R[-1]C&RC[-1] -> {200000,0,1,50},{200001,0,1,50},{200002,0,1,50},{200003,0,1,50},{200006,0,1,50},{200010,0,1,30},{200011,0,1,30},{200012,0,1,30},{200013,0,1,30},{200015,0,1,30},{200016,0,1,30},{200017,0,1,30},{200019,0,1,30},{201000,0,1,50},{201001,0,1,50},{201002,0,1,50},{201003,0,1,50},{201006,0,1,50},{201010,0,1,30},{201011,0,1,30},{201012,0,1,30},{201013,0,1,30},{201015,0,1,30},{201016,0,1,30},{201017,0,1,30},{201019,0,1,30},{202000,0,1,50},{202001,0,1,50},{202002,0,1,50},{202003,0,1,50},{202006,0,1,50},{202010,0,1,30},
J36: 110023 | K36: 烈火剑法书 | L36: 1 | M36: 0 | N36: 1 | O36: 0 | P36: ="{"&RC[-6]&","&RC[-3]&","&RC[-2]&","&RC[-1]&"}," -> {110023,0,1,0}, | Q36: =R[-1]C&RC[-1] -> {200000,0,1,60},{200001,0,1,60},{200002,0,1,60},{200003,0,1,60},{200006,0,1,60},{200010,0,1,2},{200011,0,1,2},{200012,0,1,2},{201000,0,1,60},{201001,0,1,60},{201002,0,1,60},{201003,0,1,60},{201006,0,1,60},{201010,0,1,2},{201011,0,1,2},{201012,0,1,2},{202000,0,1,60},{202001,0,1,60},{202002,0,1,60},{202003,0,1,60},{202006,0,1,60},{202010,0,1,2},{202011,0,1,2},{202012,0,1,2},{110002,0,1,0},{110003,0,1,0},{110004,0,1,100},{110005,0,1,100},{110010,0,1,10},{110011,0,1,10},{110012,0,1,10},{110009,0,2,100},{110023,0,1,0}, | S36: 202011 | T36: 天珠道链 | U36: 1 | V36: 0 | W36: 1 | X36: 20 | Y36: ="{"&RC[-6]&","&RC[-3]&","&RC[-2]&","&RC[-1]&"}," -> {202011,0,1,20}, | Z36: =R[-1]C&RC[-1] -> {200000,0,1,70},{200001,0,1,70},{200002,0,1,70},{200003,0,1,70},{200006,0,1,70},{200010,0,1,20},{200011,0,1,20},{200012,0,1,20},{200013,0,1,20},{200015,0,1,20},{200016,0,1,20},{200017,0,1,20},{200019,0,1,20},{201000,0,1,70},{201001,0,1,70},{201002,0,1,70},{201003,0,1,70},{201006,0,1,70},{201010,0,1,20},{201011,0,1,20},{201012,0,1,20},{201013,0,1,20},{201015,0,1,20},{201016,0,1,20},{201017,0,1,20},{201019,0,1,20},{202000,0,1,70},{202001,0,1,70},{202002,0,1,70},{202003,0,1,70},{202006,0,1,70},{202010,0,1,20},{202011,0,1,20}, | AB36: 202011 | AC36: 天珠道链 | AD36: 1 | AE36: 0 | AF36: 1 | AG36: 20 | AH36: ="{"&RC[-6]&","&RC[-3]&","&RC[-2]&","&RC[-1]&"}," -> {202011,0,1,20}, | AI36: =R[-1]C&RC[-1] -> {200000,0,1,60},{200001,0,1,60},{200002,0,1,60},{200003,0,1,60},{200006,0,1,60},{200010,0,1,20},{200011,0,1,20},{200012,0,1,20},{200013,0,1,20},{200015,0,1,20},{200016,0,1,20},{200017,0,1,20},{200019,0,1,20},{201000,0,1,60},{201001,0,1,60},{201002,0,1,60},{201003,0,1,60},{201006,0,1,60},{201010,0,1,20},{201011,0,1,20},{201012,0,1,20},{201013,0,1,20},{201015,0,1,20},{201016,0,1,20},{201017,0,1,20},{201019,0,1,20},{202000,0,1,60},{202001,0,1,60},{202002,0,1,60},{202003,0,1,60},{202006,0,1,60},{202010,0,1,20},{202011,0,1,20}, | AK36: 202011 | AL36: 天珠道链 | AM36: 1 | AN36: 0 | AO36: 1 | AP36: 30 | AQ36: ="{"&RC[-6]&","&RC[-3]&","&RC[-2]&","&RC[-1]&"}," -> {202011,0,1,30}, | AR36: =R[-1]C&RC[-1] -> {200000,0,1,50},{200001,0,1,50},{200002,0,1,50},{200003,0,1,50},{200006,0,1,50},{200010,0,1,30},{200011,0,1,30},{200012,0,1,30},{200013,0,1,30},{200015,0,1,30},{200016,0,1,30},{200017,0,1,30},{200019,0,1,30},{201000,0,1,50},{201001,0,1,50},{201002,0,1,50},{201003,0,1,50},{201006,0,1,50},{201010,0,1,30},{201011,0,1,30},{201012,0,1,30},{201013,0,1,30},{201015,0,1,30},{201016,0,1,30},{201017,0,1,30},{201019,0,1,30},{202000,0,1,50},{202001,0,1,50},{202002,0,1,50},{202003,0,1,50},{202006,0,1,50},{202010,0,1,30},{202011,0,1,30},
J37: 110024 | K37: 狂风斩书 | L37: 1 | M37: 0 | N37: 1 | O37: 0 | P37: ="{"&RC[-6]&","&RC[-3]&","&RC[-2]&","&RC[-1]&"}," -> {110024,0,1,0}, | Q37: =R[-1]C&RC[-1] -> {200000,0,1,60},{200001,0,1,60},{200002,0,1,60},{200003,0,1,60},{200006,0,1,60},{200010,0,1,2},{200011,0,1,2},{200012,0,1,2},{201000,0,1,60},{201001,0,1,60},{201002,0,1,60},{201003,0,1,60},{201006,0,1,60},{201010,0,1,2},{201011,0,1,2},{201012,0,1,2},{202000,0,1,60},{202001,0,1,60},{202002,0,1,60},{202003,0,1,60},{202006,0,1,60},{202010,0,1,2},{202011,0,1,2},{202012,0,1,2},{110002,0,1,0},{110003,0,1,0},{110004,0,1,100},{110005,0,1,100},{110010,0,1,10},{110011,0,1,10},{110012,0,1,10},{110009,0,2,100},{110023,0,1,0},{110024,0,1,0}, | S37: 202012 | T37: 灵魂道袍 | U37: 1 | V37: 0 | W37: 1 | X37: 20 | Y37: ="{"&RC[-6]&","&RC[-3]&","&RC[-2]&","&RC[-1]&"}," -> {202012,0,1,20}, | Z37: =R[-1]C&RC[-1] -> {200000,0,1,70},{200001,0,1,70},{200002,0,1,70},{200003,0,1,70},{200006,0,1,70},{200010,0,1,20},{200011,0,1,20},{200012,0,1,20},{200013,0,1,20},{200015,0,1,20},{200016,0,1,20},{200017,0,1,20},{200019,0,1,20},{201000,0,1,70},{201001,0,1,70},{201002,0,1,70},{201003,0,1,70},{201006,0,1,70},{201010,0,1,20},{201011,0,1,20},{201012,0,1,20},{201013,0,1,20},{201015,0,1,20},{201016,0,1,20},{201017,0,1,20},{201019,0,1,20},{202000,0,1,70},{202001,0,1,70},{202002,0,1,70},{202003,0,1,70},{202006,0,1,70},{202010,0,1,20},{202011,0,1,20},{202012,0,1,20}, | AB37: 202012 | AC37: 灵魂道袍 | AD37: 1 | AE37: 0 | AF37: 1 | AG37: 20 | AH37: ="{"&RC[-6]&","&RC[-3]&","&RC[-2]&","&RC[-1]&"}," -> {202012,0,1,20}, | AI37: =R[-1]C&RC[-1] -> {200000,0,1,60},{200001,0,1,60},{200002,0,1,60},{200003,0,1,60},{200006,0,1,60},{200010,0,1,20},{200011,0,1,20},{200012,0,1,20},{200013,0,1,20},{200015,0,1,20},{200016,0,1,20},{200017,0,1,20},{200019,0,1,20},{201000,0,1,60},{201001,0,1,60},{201002,0,1,60},{201003,0,1,60},{201006,0,1,60},{201010,0,1,20},{201011,0,1,20},{201012,0,1,20},{201013,0,1,20},{201015,0,1,20},{201016,0,1,20},{201017,0,1,20},{201019,0,1,20},{202000,0,1,60},{202001,0,1,60},{202002,0,1,60},{202003,0,1,60},{202006,0,1,60},{202010,0,1,20},{202011,0,1,20},{202012,0,1,20}, | AK37: 202012 | AL37: 灵魂道袍 | AM37: 1 | AN37: 0 | AO37: 1 | AP37: 30 | AQ37: ="{"&RC[-6]&","&RC[-3]&","&RC[-2]&","&RC[-1]&"}," -> {202012,0,1,30}, | AR37: =R[-1]C&RC[-1] -> {200000,0,1,50},{200001,0,1,50},{200002,0,1,50},{200003,0,1,50},{200006,0,1,50},{200010,0,1,30},{200011,0,1,30},{200012,0,1,30},{200013,0,1,30},{200015,0,1,30},{200016,0,1,30},{200017,0,1,30},{200019,0,1,30},{201000,0,1,50},{201001,0,1,50},{201002,0,1,50},{201003,0,1,50},{201006,0,1,50},{201010,0,1,30},{201011,0,1,30},{201012,0,1,30},{201013,0,1,30},{201015,0,1,30},{201016,0,1,30},{201017,0,1,30},{201019,0,1,30},{202000,0,1,50},{202001,0,1,50},{202002,0,1,50},{202003,0,1,50},{202006,0,1,50},{202010,0,1,30},{202011,0,1,30},{202012,0,1,30},
J38: 110025 | K38: 逐日剑法书 | L38: 1 | M38: 0 | N38: 1 | O38: 0 | P38: ="{"&RC[-6]&","&RC[-3]&","&RC[-2]&","&RC[-1]&"}," -> {110025,0,1,0}, | Q38: =R[-1]C&RC[-1] -> {200000,0,1,60},{200001,0,1,60},{200002,0,1,60},{200003,0,1,60},{200006,0,1,60},{200010,0,1,2},{200011,0,1,2},{200012,0,1,2},{201000,0,1,60},{201001,0,1,60},{201002,0,1,60},{201003,0,1,60},{201006,0,1,60},{201010,0,1,2},{201011,0,1,2},{201012,0,1,2},{202000,0,1,60},{202001,0,1,60},{202002,0,1,60},{202003,0,1,60},{202006,0,1,60},{202010,0,1,2},{202011,0,1,2},{202012,0,1,2},{110002,0,1,0},{110003,0,1,0},{110004,0,1,100},{110005,0,1,100},{110010,0,1,10},{110011,0,1,10},{110012,0,1,10},{110009,0,2,100},{110023,0,1,0},{110024,0,1,0},{110025,0,1,0}, | S38: 202013 | T38: 泰坦戒指 | U38: 1 | V38: 0 | W38: 1 | X38: 20 | Y38: ="{"&RC[-6]&","&RC[-3]&","&RC[-2]&","&RC[-1]&"}," -> {202013,0,1,20}, | Z38: =R[-1]C&RC[-1] -> {200000,0,1,70},{200001,0,1,70},{200002,0,1,70},{200003,0,1,70},{200006,0,1,70},{200010,0,1,20},{200011,0,1,20},{200012,0,1,20},{200013,0,1,20},{200015,0,1,20},{200016,0,1,20},{200017,0,1,20},{200019,0,1,20},{201000,0,1,70},{201001,0,1,70},{201002,0,1,70},{201003,0,1,70},{201006,0,1,70},{201010,0,1,20},{201011,0,1,20},{201012,0,1,20},{201013,0,1,20},{201015,0,1,20},{201016,0,1,20},{201017,0,1,20},{201019,0,1,20},{202000,0,1,70},{202001,0,1,70},{202002,0,1,70},{202003,0,1,70},{202006,0,1,70},{202010,0,1,20},{202011,0,1,20},{202012,0,1,20},{202013,0,1,20}, | AB38: 202013 | AC38: 泰坦戒指 | AD38: 1 | AE38: 0 | AF38: 1 | AG38: 20 | AH38: ="{"&RC[-6]&","&RC[-3]&","&RC[-2]&","&RC[-1]&"}," -> {202013,0,1,20}, | AI38: =R[-1]C&RC[-1] -> {200000,0,1,60},{200001,0,1,60},{200002,0,1,60},{200003,0,1,60},{200006,0,1,60},{200010,0,1,20},{200011,0,1,20},{200012,0,1,20},{200013,0,1,20},{200015,0,1,20},{200016,0,1,20},{200017,0,1,20},{200019,0,1,20},{201000,0,1,60},{201001,0,1,60},{201002,0,1,60},{201003,0,1,60},{201006,0,1,60},{201010,0,1,20},{201011,0,1,20},{201012,0,1,20},{201013,0,1,20},{201015,0,1,20},{201016,0,1,20},{201017,0,1,20},{201019,0,1,20},{202000,0,1,60},{202001,0,1,60},{202002,0,1,60},{202003,0,1,60},{202006,0,1,60},{202010,0,1,20},{202011,0,1,20},{202012,0,1,20},{202013,0,1,20}, | AK38: 202013 | AL38: 泰坦戒指 | AM38: 1 | AN38: 0 | AO38: 1 | AP38: 30 | AQ38: ="{"&RC[-6]&","&RC[-3]&","&RC[-2]&","&RC[-1]&"}," -> {202013,0,1,30}, | AR38: =R[-1]C&RC[-1] -> {200000,0,1,50},{200001,0,1,50},{200002,0,1,50},{200003,0,1,50},{200006,0,1,50},{200010,0,1,30},{200011,0,1,30},{200012,0,1,30},{200013,0,1,30},{200015,0,1,30},{200016,0,1,30},{200017,0,1,30},{200019,0,1,30},{201000,0,1,50},{201001,0,1,50},{201002,0,1,50},{201003,0,1,50},{201006,0,1,50},{201010,0,1,30},{201011,0,1,30},{201012,0,1,30},{201013,0,1,30},{201015,0,1,30},{201016,0,1,30},{201017,0,1,30},{201019,0,1,30},{202000,0,1,50},{202001,0,1,50},{202002,0,1,50},{202003,0,1,50},{202006,0,1,50},{202010,0,1,30},{202011,0,1,30},{202012,0,1,30},{202013,0,1,30},
J39: 110026 | K39: 灵魂火符书 | L39: 1 | M39: 0 | N39: 1 | O39: 0 | P39: ="{"&RC[-6]&","&RC[-3]&","&RC[-2]&","&RC[-1]&"}," -> {110026,0,1,0}, | Q39: =R[-1]C&RC[-1] -> {200000,0,1,60},{200001,0,1,60},{200002,0,1,60},{200003,0,1,60},{200006,0,1,60},{200010,0,1,2},{200011,0,1,2},{200012,0,1,2},{201000,0,1,60},{201001,0,1,60},{201002,0,1,60},{201003,0,1,60},{201006,0,1,60},{201010,0,1,2},{201011,0,1,2},{201012,0,1,2},{202000,0,1,60},{202001,0,1,60},{202002,0,1,60},{202003,0,1,60},{202006,0,1,60},{202010,0,1,2},{202011,0,1,2},{202012,0,1,2},{110002,0,1,0},{110003,0,1,0},{110004,0,1,100},{110005,0,1,100},{110010,0,1,10},{110011,0,1,10},{110012,0,1,10},{110009,0,2,100},{110023,0,1,0},{110024,0,1,0},{110025,0,1,0},{110026,0,1,0}, | S39: 202015 | T39: 道士头盔 | U39: 1 | V39: 0 | W39: 1 | X39: 20 | Y39: ="{"&RC[-6]&","&RC[-3]&","&RC[-2]&","&RC[-1]&"}," -> {202015,0,1,20}, | Z39: =R[-1]C&RC[-1] -> {200000,0,1,70},{200001,0,1,70},{200002,0,1,70},{200003,0,1,70},{200006,0,1,70},{200010,0,1,20},{200011,0,1,20},{200012,0,1,20},{200013,0,1,20},{200015,0,1,20},{200016,0,1,20},{200017,0,1,20},{200019,0,1,20},{201000,0,1,70},{201001,0,1,70},{201002,0,1,70},{201003,0,1,70},{201006,0,1,70},{201010,0,1,20},{201011,0,1,20},{201012,0,1,20},{201013,0,1,20},{201015,0,1,20},{201016,0,1,20},{201017,0,1,20},{201019,0,1,20},{202000,0,1,70},{202001,0,1,70},{202002,0,1,70},{202003,0,1,70},{202006,0,1,70},{202010,0,1,20},{202011,0,1,20},{202012,0,1,20},{202013,0,1,20},{202015,0,1,20}, | AB39: 202015 | AC39: 道士头盔 | AD39: 1 | AE39: 0 | AF39: 1 | AG39: 20 | AH39: ="{"&RC[-6]&","&RC[-3]&","&RC[-2]&","&RC[-1]&"}," -> {202015,0,1,20}, | AI39: =R[-1]C&RC[-1] -> {200000,0,1,60},{200001,0,1,60},{200002,0,1,60},{200003,0,1,60},{200006,0,1,60},{200010,0,1,20},{200011,0,1,20},{200012,0,1,20},{200013,0,1,20},{200015,0,1,20},{200016,0,1,20},{200017,0,1,20},{200019,0,1,20},{201000,0,1,60},{201001,0,1,60},{201002,0,1,60},{201003,0,1,60},{201006,0,1,60},{201010,0,1,20},{201011,0,1,20},{201012,0,1,20},{201013,0,1,20},{201015,0,1,20},{201016,0,1,20},{201017,0,1,20},{201019,0,1,20},{202000,0,1,60},{202001,0,1,60},{202002,0,1,60},{202003,0,1,60},{202006,0,1,60},{202010,0,1,20},{202011,0,1,20},{202012,0,1,20},{202013,0,1,20},{202015,0,1,20}, | AK39: 202015 | AL39: 道士头盔 | AM39: 1 | AN39: 0 | AO39: 1 | AP39: 30 | AQ39: ="{"&RC[-6]&","&RC[-3]&","&RC[-2]&","&RC[-1]&"}," -> {202015,0,1,30}, | AR39: =R[-1]C&RC[-1] -> {200000,0,1,50},{200001,0,1,50},{200002,0,1,50},{200003,0,1,50},{200006,0,1,50},{200010,0,1,30},{200011,0,1,30},{200012,0,1,30},{200013,0,1,30},{200015,0,1,30},{200016,0,1,30},{200017,0,1,30},{200019,0,1,30},{201000,0,1,50},{201001,0,1,50},{201002,0,1,50},{201003,0,1,50},{201006,0,1,50},{201010,0,1,30},{201011,0,1,30},{201012,0,1,30},{201013,0,1,30},{201015,0,1,30},{201016,0,1,30},{201017,0,1,30},{201019,0,1,30},{202000,0,1,50},{202001,0,1,50},{202002,0,1,50},{202003,0,1,50},{202006,0,1,50},{202010,0,1,30},{202011,0,1,30},{202012,0,1,30},{202013,0,1,30},{202015,0,1,30},
J40: 110030 | K40: 战甲术书 | L40: 1 | M40: 0 | N40: 1 | O40: 0 | P40: ="{"&RC[-6]&","&RC[-3]&","&RC[-2]&","&RC[-1]&"}," -> {110030,0,1,0}, | Q40: =R[-1]C&RC[-1] -> {200000,0,1,60},{200001,0,1,60},{200002,0,1,60},{200003,0,1,60},{200006,0,1,60},{200010,0,1,2},{200011,0,1,2},{200012,0,1,2},{201000,0,1,60},{201001,0,1,60},{201002,0,1,60},{201003,0,1,60},{201006,0,1,60},{201010,0,1,2},{201011,0,1,2},{201012,0,1,2},{202000,0,1,60},{202001,0,1,60},{202002,0,1,60},{202003,0,1,60},{202006,0,1,60},{202010,0,1,2},{202011,0,1,2},{202012,0,1,2},{110002,0,1,0},{110003,0,1,0},{110004,0,1,100},{110005,0,1,100},{110010,0,1,10},{110011,0,1,10},{110012,0,1,10},{110009,0,2,100},{110023,0,1,0},{110024,0,1,0},{110025,0,1,0},{110026,0,1,0},{110030,0,1,0}, | S40: 202016 | T40: 幽灵手镯 | U40: 1 | V40: 0 | W40: 1 | X40: 20 | Y40: ="{"&RC[-6]&","&RC[-3]&","&RC[-2]&","&RC[-1]&"}," -> {202016,0,1,20}, | Z40: =R[-1]C&RC[-1] -> {200000,0,1,70},{200001,0,1,70},{200002,0,1,70},{200003,0,1,70},{200006,0,1,70},{200010,0,1,20},{200011,0,1,20},{200012,0,1,20},{200013,0,1,20},{200015,0,1,20},{200016,0,1,20},{200017,0,1,20},{200019,0,1,20},{201000,0,1,70},{201001,0,1,70},{201002,0,1,70},{201003,0,1,70},{201006,0,1,70},{201010,0,1,20},{201011,0,1,20},{201012,0,1,20},{201013,0,1,20},{201015,0,1,20},{201016,0,1,20},{201017,0,1,20},{201019,0,1,20},{202000,0,1,70},{202001,0,1,70},{202002,0,1,70},{202003,0,1,70},{202006,0,1,70},{202010,0,1,20},{202011,0,1,20},{202012,0,1,20},{202013,0,1,20},{202015,0,1,20},{202016,0,1,20}, | AB40: 202016 | AC40: 幽灵手镯 | AD40: 1 | AE40: 0 | AF40: 1 | AG40: 20 | AH40: ="{"&RC[-6]&","&RC[-3]&","&RC[-2]&","&RC[-1]&"}," -> {202016,0,1,20}, | AI40: =R[-1]C&RC[-1] -> {200000,0,1,60},{200001,0,1,60},{200002,0,1,60},{200003,0,1,60},{200006,0,1,60},{200010,0,1,20},{200011,0,1,20},{200012,0,1,20},{200013,0,1,20},{200015,0,1,20},{200016,0,1,20},{200017,0,1,20},{200019,0,1,20},{201000,0,1,60},{201001,0,1,60},{201002,0,1,60},{201003,0,1,60},{201006,0,1,60},{201010,0,1,20},{201011,0,1,20},{201012,0,1,20},{201013,0,1,20},{201015,0,1,20},{201016,0,1,20},{201017,0,1,20},{201019,0,1,20},{202000,0,1,60},{202001,0,1,60},{202002,0,1,60},{202003,0,1,60},{202006,0,1,60},{202010,0,1,20},{202011,0,1,20},{202012,0,1,20},{202013,0,1,20},{202015,0,1,20},{202016,0,1,20}, | AK40: 202016 | AL40: 幽灵手镯 | AM40: 1 | AN40: 0 | AO40: 1 | AP40: 30 | AQ40: ="{"&RC[-6]&","&RC[-3]&","&RC[-2]&","&RC[-1]&"}," -> {202016,0,1,30}, | AR40: =R[-1]C&RC[-1] -> {200000,0,1,50},{200001,0,1,50},{200002,0,1,50},{200003,0,1,50},{200006,0,1,50},{200010,0,1,30},{200011,0,1,30},{200012,0,1,30},{200013,0,1,30},{200015,0,1,30},{200016,0,1,30},{200017,0,1,30},{200019,0,1,30},{201000,0,1,50},{201001,0,1,50},{201002,0,1,50},{201003,0,1,50},{201006,0,1,50},{201010,0,1,30},{201011,0,1,30},{201012,0,1,30},{201013,0,1,30},{201015,0,1,30},{201016,0,1,30},{201017,0,1,30},{201019,0,1,30},{202000,0,1,50},{202001,0,1,50},{202002,0,1,50},{202003,0,1,50},{202006,0,1,50},{202010,0,1,30},{202011,0,1,30},{202012,0,1,30},{202013,0,1,30},{202015,0,1,30},{202016,0,1,30},
J41: 110031 | K41: 召唤神兽书 | L41: 1 | M41: 0 | N41: 1 | O41: 0 | P41: ="{"&RC[-6]&","&RC[-3]&","&RC[-2]&","&RC[-1]&"}," -> {110031,0,1,0}, | Q41: =R[-1]C&RC[-1] -> {200000,0,1,60},{200001,0,1,60},{200002,0,1,60},{200003,0,1,60},{200006,0,1,60},{200010,0,1,2},{200011,0,1,2},{200012,0,1,2},{201000,0,1,60},{201001,0,1,60},{201002,0,1,60},{201003,0,1,60},{201006,0,1,60},{201010,0,1,2},{201011,0,1,2},{201012,0,1,2},{202000,0,1,60},{202001,0,1,60},{202002,0,1,60},{202003,0,1,60},{202006,0,1,60},{202010,0,1,2},{202011,0,1,2},{202012,0,1,2},{110002,0,1,0},{110003,0,1,0},{110004,0,1,100},{110005,0,1,100},{110010,0,1,10},{110011,0,1,10},{110012,0,1,10},{110009,0,2,100},{110023,0,1,0},{110024,0,1,0},{110025,0,1,0},{110026,0,1,0},{110030,0,1,0},{110031,0,1,0}, | S41: 202017 | T41: 道士腰带 | U41: 1 | V41: 0 | W41: 1 | X41: 20 | Y41: ="{"&RC[-6]&","&RC[-3]&","&RC[-2]&","&RC[-1]&"}," -> {202017,0,1,20}, | Z41: =R[-1]C&RC[-1] -> {200000,0,1,70},{200001,0,1,70},{200002,0,1,70},{200003,0,1,70},{200006,0,1,70},{200010,0,1,20},{200011,0,1,20},{200012,0,1,20},{200013,0,1,20},{200015,0,1,20},{200016,0,1,20},{200017,0,1,20},{200019,0,1,20},{201000,0,1,70},{201001,0,1,70},{201002,0,1,70},{201003,0,1,70},{201006,0,1,70},{201010,0,1,20},{201011,0,1,20},{201012,0,1,20},{201013,0,1,20},{201015,0,1,20},{201016,0,1,20},{201017,0,1,20},{201019,0,1,20},{202000,0,1,70},{202001,0,1,70},{202002,0,1,70},{202003,0,1,70},{202006,0,1,70},{202010,0,1,20},{202011,0,1,20},{202012,0,1,20},{202013,0,1,20},{202015,0,1,20},{202016,0,1,20},{202017,0,1,20}, | AB41: 202017 | AC41: 道士腰带 | AD41: 1 | AE41: 0 | AF41: 1 | AG41: 20 | AH41: ="{"&RC[-6]&","&RC[-3]&","&RC[-2]&","&RC[-1]&"}," -> {202017,0,1,20}, | AI41: =R[-1]C&RC[-1] -> {200000,0,1,60},{200001,0,1,60},{200002,0,1,60},{200003,0,1,60},{200006,0,1,60},{200010,0,1,20},{200011,0,1,20},{200012,0,1,20},{200013,0,1,20},{200015,0,1,20},{200016,0,1,20},{200017,0,1,20},{200019,0,1,20},{201000,0,1,60},{201001,0,1,60},{201002,0,1,60},{201003,0,1,60},{201006,0,1,60},{201010,0,1,20},{201011,0,1,20},{201012,0,1,20},{201013,0,1,20},{201015,0,1,20},{201016,0,1,20},{201017,0,1,20},{201019,0,1,20},{202000,0,1,60},{202001,0,1,60},{202002,0,1,60},{202003,0,1,60},{202006,0,1,60},{202010,0,1,20},{202011,0,1,20},{202012,0,1,20},{202013,0,1,20},{202015,0,1,20},{202016,0,1,20},{202017,0,1,20}, | AK41: 202017 | AL41: 道士腰带 | AM41: 1 | AN41: 0 | AO41: 1 | AP41: 30 | AQ41: ="{"&RC[-6]&","&RC[-3]&","&RC[-2]&","&RC[-1]&"}," -> {202017,0,1,30}, | AR41: =R[-1]C&RC[-1] -> {200000,0,1,50},{200001,0,1,50},{200002,0,1,50},{200003,0,1,50},{200006,0,1,50},{200010,0,1,30},{200011,0,1,30},{200012,0,1,30},{200013,0,1,30},{200015,0,1,30},{200016,0,1,30},{200017,0,1,30},{200019,0,1,30},{201000,0,1,50},{201001,0,1,50},{201002,0,1,50},{201003,0,1,50},{201006,0,1,50},{201010,0,1,30},{201011,0,1,30},{201012,0,1,30},{201013,0,1,30},{201015,0,1,30},{201016,0,1,30},{201017,0,1,30},{201019,0,1,30},{202000,0,1,50},{202001,0,1,50},{202002,0,1,50},{202003,0,1,50},{202006,0,1,50},{202010,0,1,30},{202011,0,1,30},{202012,0,1,30},{202013,0,1,30},{202015,0,1,30},{202016,0,1,30},{202017,0,1,30},
J42: 110032 | K42: 嗜血术书 | L42: 1 | M42: 0 | N42: 1 | O42: 0 | P42: ="{"&RC[-6]&","&RC[-3]&","&RC[-2]&","&RC[-1]&"}," -> {110032,0,1,0}, | Q42: =R[-1]C&RC[-1] -> {200000,0,1,60},{200001,0,1,60},{200002,0,1,60},{200003,0,1,60},{200006,0,1,60},{200010,0,1,2},{200011,0,1,2},{200012,0,1,2},{201000,0,1,60},{201001,0,1,60},{201002,0,1,60},{201003,0,1,60},{201006,0,1,60},{201010,0,1,2},{201011,0,1,2},{201012,0,1,2},{202000,0,1,60},{202001,0,1,60},{202002,0,1,60},{202003,0,1,60},{202006,0,1,60},{202010,0,1,2},{202011,0,1,2},{202012,0,1,2},{110002,0,1,0},{110003,0,1,0},{110004,0,1,100},{110005,0,1,100},{110010,0,1,10},{110011,0,1,10},{110012,0,1,10},{110009,0,2,100},{110023,0,1,0},{110024,0,1,0},{110025,0,1,0},{110026,0,1,0},{110030,0,1,0},{110031,0,1,0},{110032,0,1,0}, | S42: 202019 | T42: 道士鞋子 | U42: 1 | V42: 0 | W42: 1 | X42: 20 | Y42: ="{"&RC[-6]&","&RC[-3]&","&RC[-2]&","&RC[-1]&"}," -> {202019,0,1,20}, | Z42: =R[-1]C&RC[-1] -> {200000,0,1,70},{200001,0,1,70},{200002,0,1,70},{200003,0,1,70},{200006,0,1,70},{200010,0,1,20},{200011,0,1,20},{200012,0,1,20},{200013,0,1,20},{200015,0,1,20},{200016,0,1,20},{200017,0,1,20},{200019,0,1,20},{201000,0,1,70},{201001,0,1,70},{201002,0,1,70},{201003,0,1,70},{201006,0,1,70},{201010,0,1,20},{201011,0,1,20},{201012,0,1,20},{201013,0,1,20},{201015,0,1,20},{201016,0,1,20},{201017,0,1,20},{201019,0,1,20},{202000,0,1,70},{202001,0,1,70},{202002,0,1,70},{202003,0,1,70},{202006,0,1,70},{202010,0,1,20},{202011,0,1,20},{202012,0,1,20},{202013,0,1,20},{202015,0,1,20},{202016,0,1,20},{202017,0,1,20},{202019,0,1,20}, | AB42: 202019 | AC42: 道士鞋子 | AD42: 1 | AE42: 0 | AF42: 1 | AG42: 20 | AH42: ="{"&RC[-6]&","&RC[-3]&","&RC[-2]&","&RC[-1]&"}," -> {202019,0,1,20}, | AI42: =R[-1]C&RC[-1] -> {200000,0,1,60},{200001,0,1,60},{200002,0,1,60},{200003,0,1,60},{200006,0,1,60},{200010,0,1,20},{200011,0,1,20},{200012,0,1,20},{200013,0,1,20},{200015,0,1,20},{200016,0,1,20},{200017,0,1,20},{200019,0,1,20},{201000,0,1,60},{201001,0,1,60},{201002,0,1,60},{201003,0,1,60},{201006,0,1,60},{201010,0,1,20},{201011,0,1,20},{201012,0,1,20},{201013,0,1,20},{201015,0,1,20},{201016,0,1,20},{201017,0,1,20},{201019,0,1,20},{202000,0,1,60},{202001,0,1,60},{202002,0,1,60},{202003,0,1,60},{202006,0,1,60},{202010,0,1,20},{202011,0,1,20},{202012,0,1,20},{202013,0,1,20},{202015,0,1,20},{202016,0,1,20},{202017,0,1,20},{202019,0,1,20}, | AK42: 202019 | AL42: 道士鞋子 | AM42: 1 | AN42: 0 | AO42: 1 | AP42: 30 | AQ42: ="{"&RC[-6]&","&RC[-3]&","&RC[-2]&","&RC[-1]&"}," -> {202019,0,1,30}, | AR42: =R[-1]C&RC[-1] -> {200000,0,1,50},{200001,0,1,50},{200002,0,1,50},{200003,0,1,50},{200006,0,1,50},{200010,0,1,30},{200011,0,1,30},{200012,0,1,30},{200013,0,1,30},{200015,0,1,30},{200016,0,1,30},{200017,0,1,30},{200019,0,1,30},{201000,0,1,50},{201001,0,1,50},{201002,0,1,50},{201003,0,1,50},{201006,0,1,50},{201010,0,1,30},{201011,0,1,30},{201012,0,1,30},{201013,0,1,30},{201015,0,1,30},{201016,0,1,30},{201017,0,1,30},{201019,0,1,30},{202000,0,1,50},{202001,0,1,50},{202002,0,1,50},{202003,0,1,50},{202006,0,1,50},{202010,0,1,30},{202011,0,1,30},{202012,0,1,30},{202013,0,1,30},{202015,0,1,30},{202016,0,1,30},{202017,0,1,30},{202019,0,1,30},
J43: 110033 | K43: 雷电术书 | L43: 1 | M43: 0 | N43: 1 | O43: 0 | P43: ="{"&RC[-6]&","&RC[-3]&","&RC[-2]&","&RC[-1]&"}," -> {110033,0,1,0}, | Q43: =R[-1]C&RC[-1] -> {200000,0,1,60},{200001,0,1,60},{200002,0,1,60},{200003,0,1,60},{200006,0,1,60},{200010,0,1,2},{200011,0,1,2},{200012,0,1,2},{201000,0,1,60},{201001,0,1,60},{201002,0,1,60},{201003,0,1,60},{201006,0,1,60},{201010,0,1,2},{201011,0,1,2},{201012,0,1,2},{202000,0,1,60},{202001,0,1,60},{202002,0,1,60},{202003,0,1,60},{202006,0,1,60},{202010,0,1,2},{202011,0,1,2},{202012,0,1,2},{110002,0,1,0},{110003,0,1,0},{110004,0,1,100},{110005,0,1,100},{110010,0,1,10},{110011,0,1,10},{110012,0,1,10},{110009,0,2,100},{110023,0,1,0},{110024,0,1,0},{110025,0,1,0},{110026,0,1,0},{110030,0,1,0},{110031,0,1,0},{110032,0,1,0},{110033,0,1,0}, | S43: 110002 | T43: 强化石 | V43: 0 | W43: 1 | X43: 0 | Y43: ="{"&RC[-6]&","&RC[-3]&","&RC[-2]&","&RC[-1]&"}," -> {110002,0,1,0}, | Z43: =R[-1]C&RC[-1] -> {200000,0,1,70},{200001,0,1,70},{200002,0,1,70},{200003,0,1,70},{200006,0,1,70},{200010,0,1,20},{200011,0,1,20},{200012,0,1,20},{200013,0,1,20},{200015,0,1,20},{200016,0,1,20},{200017,0,1,20},{200019,0,1,20},{201000,0,1,70},{201001,0,1,70},{201002,0,1,70},{201003,0,1,70},{201006,0,1,70},{201010,0,1,20},{201011,0,1,20},{201012,0,1,20},{201013,0,1,20},{201015,0,1,20},{201016,0,1,20},{201017,0,1,20},{201019,0,1,20},{202000,0,1,70},{202001,0,1,70},{202002,0,1,70},{202003,0,1,70},{202006,0,1,70},{202010,0,1,20},{202011,0,1,20},{202012,0,1,20},{202013,0,1,20},{202015,0,1,20},{202016,0,1,20},{202017,0,1,20},{202019,0,1,20},{110002,0,1,0}, | AB43: 110002 | AC43: 强化石 | AE43: 0 | AF43: 1 | AG43: 0 | AH43: ="{"&RC[-6]&","&RC[-3]&","&RC[-2]&","&RC[-1]&"}," -> {110002,0,1,0}, | AI43: =R[-1]C&RC[-1] -> {200000,0,1,60},{200001,0,1,60},{200002,0,1,60},{200003,0,1,60},{200006,0,1,60},{200010,0,1,20},{200011,0,1,20},{200012,0,1,20},{200013,0,1,20},{200015,0,1,20},{200016,0,1,20},{200017,0,1,20},{200019,0,1,20},{201000,0,1,60},{201001,0,1,60},{201002,0,1,60},{201003,0,1,60},{201006,0,1,60},{201010,0,1,20},{201011,0,1,20},{201012,0,1,20},{201013,0,1,20},{201015,0,1,20},{201016,0,1,20},{201017,0,1,20},{201019,0,1,20},{202000,0,1,60},{202001,0,1,60},{202002,0,1,60},{202003,0,1,60},{202006,0,1,60},{202010,0,1,20},{202011,0,1,20},{202012,0,1,20},{202013,0,1,20},{202015,0,1,20},{202016,0,1,20},{202017,0,1,20},{202019,0,1,20},{110002,0,1,0}, | AK43: 110002 | AL43: 强化石 | AN43: 0 | AO43: 1 | AP43: 0 | AQ43: ="{"&RC[-6]&","&RC[-3]&","&RC[-2]&","&RC[-1]&"}," -> {110002,0,1,0}, | AR43: =R[-1]C&RC[-1] -> {200000,0,1,50},{200001,0,1,50},{200002,0,1,50},{200003,0,1,50},{200006,0,1,50},{200010,0,1,30},{200011,0,1,30},{200012,0,1,30},{200013,0,1,30},{200015,0,1,30},{200016,0,1,30},{200017,0,1,30},{200019,0,1,30},{201000,0,1,50},{201001,0,1,50},{201002,0,1,50},{201003,0,1,50},{201006,0,1,50},{201010,0,1,30},{201011,0,1,30},{201012,0,1,30},{201013,0,1,30},{201015,0,1,30},{201016,0,1,30},{201017,0,1,30},{201019,0,1,30},{202000,0,1,50},{202001,0,1,50},{202002,0,1,50},{202003,0,1,50},{202006,0,1,50},{202010,0,1,30},{202011,0,1,30},{202012,0,1,30},{202013,0,1,30},{202015,0,1,30},{202016,0,1,30},{202017,0,1,30},{202019,0,1,30},{110002,0,1,0},
J44: 110038 | K44: 冰咆哮书 | L44: 1 | M44: 0 | N44: 1 | O44: 0 | P44: ="{"&RC[-6]&","&RC[-3]&","&RC[-2]&","&RC[-1]&"}," -> {110038,0,1,0}, | Q44: =R[-1]C&RC[-1] -> {200000,0,1,60},{200001,0,1,60},{200002,0,1,60},{200003,0,1,60},{200006,0,1,60},{200010,0,1,2},{200011,0,1,2},{200012,0,1,2},{201000,0,1,60},{201001,0,1,60},{201002,0,1,60},{201003,0,1,60},{201006,0,1,60},{201010,0,1,2},{201011,0,1,2},{201012,0,1,2},{202000,0,1,60},{202001,0,1,60},{202002,0,1,60},{202003,0,1,60},{202006,0,1,60},{202010,0,1,2},{202011,0,1,2},{202012,0,1,2},{110002,0,1,0},{110003,0,1,0},{110004,0,1,100},{110005,0,1,100},{110010,0,1,10},{110011,0,1,10},{110012,0,1,10},{110009,0,2,100},{110023,0,1,0},{110024,0,1,0},{110025,0,1,0},{110026,0,1,0},{110030,0,1,0},{110031,0,1,0},{110032,0,1,0},{110033,0,1,0},{110038,0,1,0}, | S44: 110003 | T44: 洗炼石 | V44: 0 | W44: 1 | X44: 0 | Y44: ="{"&RC[-6]&","&RC[-3]&","&RC[-2]&","&RC[-1]&"}," -> {110003,0,1,0}, | Z44: =R[-1]C&RC[-1] -> {200000,0,1,70},{200001,0,1,70},{200002,0,1,70},{200003,0,1,70},{200006,0,1,70},{200010,0,1,20},{200011,0,1,20},{200012,0,1,20},{200013,0,1,20},{200015,0,1,20},{200016,0,1,20},{200017,0,1,20},{200019,0,1,20},{201000,0,1,70},{201001,0,1,70},{201002,0,1,70},{201003,0,1,70},{201006,0,1,70},{201010,0,1,20},{201011,0,1,20},{201012,0,1,20},{201013,0,1,20},{201015,0,1,20},{201016,0,1,20},{201017,0,1,20},{201019,0,1,20},{202000,0,1,70},{202001,0,1,70},{202002,0,1,70},{202003,0,1,70},{202006,0,1,70},{202010,0,1,20},{202011,0,1,20},{202012,0,1,20},{202013,0,1,20},{202015,0,1,20},{202016,0,1,20},{202017,0,1,20},{202019,0,1,20},{110002,0,1,0},{110003,0,1,0}, | AB44: 110003 | AC44: 洗炼石 | AE44: 0 | AF44: 1 | AG44: 0 | AH44: ="{"&RC[-6]&","&RC[-3]&","&RC[-2]&","&RC[-1]&"}," -> {110003,0,1,0}, | AI44: =R[-1]C&RC[-1] -> {200000,0,1,60},{200001,0,1,60},{200002,0,1,60},{200003,0,1,60},{200006,0,1,60},{200010,0,1,20},{200011,0,1,20},{200012,0,1,20},{200013,0,1,20},{200015,0,1,20},{200016,0,1,20},{200017,0,1,20},{200019,0,1,20},{201000,0,1,60},{201001,0,1,60},{201002,0,1,60},{201003,0,1,60},{201006,0,1,60},{201010,0,1,20},{201011,0,1,20},{201012,0,1,20},{201013,0,1,20},{201015,0,1,20},{201016,0,1,20},{201017,0,1,20},{201019,0,1,20},{202000,0,1,60},{202001,0,1,60},{202002,0,1,60},{202003,0,1,60},{202006,0,1,60},{202010,0,1,20},{202011,0,1,20},{202012,0,1,20},{202013,0,1,20},{202015,0,1,20},{202016,0,1,20},{202017,0,1,20},{202019,0,1,20},{110002,0,1,0},{110003,0,1,0}, | AK44: 110003 | AL44: 洗炼石 | AN44: 0 | AO44: 1 | AP44: 0 | AQ44: ="{"&RC[-6]&","&RC[-3]&","&RC[-2]&","&RC[-1]&"}," -> {110003,0,1,0}, | AR44: =R[-1]C&RC[-1] -> {200000,0,1,50},{200001,0,1,50},{200002,0,1,50},{200003,0,1,50},{200006,0,1,50},{200010,0,1,30},{200011,0,1,30},{200012,0,1,30},{200013,0,1,30},{200015,0,1,30},{200016,0,1,30},{200017,0,1,30},{200019,0,1,30},{201000,0,1,50},{201001,0,1,50},{201002,0,1,50},{201003,0,1,50},{201006,0,1,50},{201010,0,1,30},{201011,0,1,30},{201012,0,1,30},{201013,0,1,30},{201015,0,1,30},{201016,0,1,30},{201017,0,1,30},{201019,0,1,30},{202000,0,1,50},{202001,0,1,50},{202002,0,1,50},{202003,0,1,50},{202006,0,1,50},{202010,0,1,30},{202011,0,1,30},{202012,0,1,30},{202013,0,1,30},{202015,0,1,30},{202016,0,1,30},{202017,0,1,30},{202019,0,1,30},{110002,0,1,0},{110003,0,1,0},
J45: 110039 | K45: 抗拒火环书 | L45: 1 | M45: 0 | N45: 1 | O45: 0 | P45: ="{"&RC[-6]&","&RC[-3]&","&RC[-2]&","&RC[-1]&"}," -> {110039,0,1,0}, | Q45: =R[-1]C&RC[-1] -> {200000,0,1,60},{200001,0,1,60},{200002,0,1,60},{200003,0,1,60},{200006,0,1,60},{200010,0,1,2},{200011,0,1,2},{200012,0,1,2},{201000,0,1,60},{201001,0,1,60},{201002,0,1,60},{201003,0,1,60},{201006,0,1,60},{201010,0,1,2},{201011,0,1,2},{201012,0,1,2},{202000,0,1,60},{202001,0,1,60},{202002,0,1,60},{202003,0,1,60},{202006,0,1,60},{202010,0,1,2},{202011,0,1,2},{202012,0,1,2},{110002,0,1,0},{110003,0,1,0},{110004,0,1,100},{110005,0,1,100},{110010,0,1,10},{110011,0,1,10},{110012,0,1,10},{110009,0,2,100},{110023,0,1,0},{110024,0,1,0},{110025,0,1,0},{110026,0,1,0},{110030,0,1,0},{110031,0,1,0},{110032,0,1,0},{110033,0,1,0},{110038,0,1,0},{110039,0,1,0}, | S45: 110004 | T45: 红药 | V45: 0 | W45: 1 | X45: 100 | Y45: ="{"&RC[-6]&","&RC[-3]&","&RC[-2]&","&RC[-1]&"}," -> {110004,0,1,100}, | Z45: =R[-1]C&RC[-1] -> {200000,0,1,70},{200001,0,1,70},{200002,0,1,70},{200003,0,1,70},{200006,0,1,70},{200010,0,1,20},{200011,0,1,20},{200012,0,1,20},{200013,0,1,20},{200015,0,1,20},{200016,0,1,20},{200017,0,1,20},{200019,0,1,20},{201000,0,1,70},{201001,0,1,70},{201002,0,1,70},{201003,0,1,70},{201006,0,1,70},{201010,0,1,20},{201011,0,1,20},{201012,0,1,20},{201013,0,1,20},{201015,0,1,20},{201016,0,1,20},{201017,0,1,20},{201019,0,1,20},{202000,0,1,70},{202001,0,1,70},{202002,0,1,70},{202003,0,1,70},{202006,0,1,70},{202010,0,1,20},{202011,0,1,20},{202012,0,1,20},{202013,0,1,20},{202015,0,1,20},{202016,0,1,20},{202017,0,1,20},{202019,0,1,20},{110002,0,1,0},{110003,0,1,0},{110004,0,1,100}, | AB45: 110004 | AC45: 红药 | AE45: 0 | AF45: 1 | AG45: 100 | AH45: ="{"&RC[-6]&","&RC[-3]&","&RC[-2]&","&RC[-1]&"}," -> {110004,0,1,100}, | AI45: =R[-1]C&RC[-1] -> {200000,0,1,60},{200001,0,1,60},{200002,0,1,60},{200003,0,1,60},{200006,0,1,60},{200010,0,1,20},{200011,0,1,20},{200012,0,1,20},{200013,0,1,20},{200015,0,1,20},{200016,0,1,20},{200017,0,1,20},{200019,0,1,20},{201000,0,1,60},{201001,0,1,60},{201002,0,1,60},{201003,0,1,60},{201006,0,1,60},{201010,0,1,20},{201011,0,1,20},{201012,0,1,20},{201013,0,1,20},{201015,0,1,20},{201016,0,1,20},{201017,0,1,20},{201019,0,1,20},{202000,0,1,60},{202001,0,1,60},{202002,0,1,60},{202003,0,1,60},{202006,0,1,60},{202010,0,1,20},{202011,0,1,20},{202012,0,1,20},{202013,0,1,20},{202015,0,1,20},{202016,0,1,20},{202017,0,1,20},{202019,0,1,20},{110002,0,1,0},{110003,0,1,0},{110004,0,1,100}, | AK45: 110004 | AL45: 红药 | AN45: 0 | AO45: 1 | AP45: 100 | AQ45: ="{"&RC[-6]&","&RC[-3]&","&RC[-2]&","&RC[-1]&"}," -> {110004,0,1,100}, | AR45: =R[-1]C&RC[-1] -> {200000,0,1,50},{200001,0,1,50},{200002,0,1,50},{200003,0,1,50},{200006,0,1,50},{200010,0,1,30},{200011,0,1,30},{200012,0,1,30},{200013,0,1,30},{200015,0,1,30},{200016,0,1,30},{200017,0,1,30},{200019,0,1,30},{201000,0,1,50},{201001,0,1,50},{201002,0,1,50},{201003,0,1,50},{201006,0,1,50},{201010,0,1,30},{201011,0,1,30},{201012,0,1,30},{201013,0,1,30},{201015,0,1,30},{201016,0,1,30},{201017,0,1,30},{201019,0,1,30},{202000,0,1,50},{202001,0,1,50},{202002,0,1,50},{202003,0,1,50},{202006,0,1,50},{202010,0,1,30},{202011,0,1,30},{202012,0,1,30},{202013,0,1,30},{202015,0,1,30},{202016,0,1,30},{202017,0,1,30},{202019,0,1,30},{110002,0,1,0},{110003,0,1,0},{110004,0,1,100},
J46: 110040 | K46: 流星火雨书 | L46: 1 | M46: 0 | N46: 1 | O46: 0 | P46: ="{"&RC[-6]&","&RC[-3]&","&RC[-2]&","&RC[-1]&"}," -> {110040,0,1,0}, | Q46: =R[-1]C&RC[-1] -> {200000,0,1,60},{200001,0,1,60},{200002,0,1,60},{200003,0,1,60},{200006,0,1,60},{200010,0,1,2},{200011,0,1,2},{200012,0,1,2},{201000,0,1,60},{201001,0,1,60},{201002,0,1,60},{201003,0,1,60},{201006,0,1,60},{201010,0,1,2},{201011,0,1,2},{201012,0,1,2},{202000,0,1,60},{202001,0,1,60},{202002,0,1,60},{202003,0,1,60},{202006,0,1,60},{202010,0,1,2},{202011,0,1,2},{202012,0,1,2},{110002,0,1,0},{110003,0,1,0},{110004,0,1,100},{110005,0,1,100},{110010,0,1,10},{110011,0,1,10},{110012,0,1,10},{110009,0,2,100},{110023,0,1,0},{110024,0,1,0},{110025,0,1,0},{110026,0,1,0},{110030,0,1,0},{110031,0,1,0},{110032,0,1,0},{110033,0,1,0},{110038,0,1,0},{110039,0,1,0},{110040,0,1,0}, | S46: 110005 | T46: 蓝药 | V46: 0 | W46: 1 | X46: 100 | Y46: ="{"&RC[-6]&","&RC[-3]&","&RC[-2]&","&RC[-1]&"}," -> {110005,0,1,100}, | Z46: =R[-1]C&RC[-1] -> {200000,0,1,70},{200001,0,1,70},{200002,0,1,70},{200003,0,1,70},{200006,0,1,70},{200010,0,1,20},{200011,0,1,20},{200012,0,1,20},{200013,0,1,20},{200015,0,1,20},{200016,0,1,20},{200017,0,1,20},{200019,0,1,20},{201000,0,1,70},{201001,0,1,70},{201002,0,1,70},{201003,0,1,70},{201006,0,1,70},{201010,0,1,20},{201011,0,1,20},{201012,0,1,20},{201013,0,1,20},{201015,0,1,20},{201016,0,1,20},{201017,0,1,20},{201019,0,1,20},{202000,0,1,70},{202001,0,1,70},{202002,0,1,70},{202003,0,1,70},{202006,0,1,70},{202010,0,1,20},{202011,0,1,20},{202012,0,1,20},{202013,0,1,20},{202015,0,1,20},{202016,0,1,20},{202017,0,1,20},{202019,0,1,20},{110002,0,1,0},{110003,0,1,0},{110004,0,1,100},{110005,0,1,100}, | AB46: 110005 | AC46: 蓝药 | AE46: 0 | AF46: 1 | AG46: 100 | AH46: ="{"&RC[-6]&","&RC[-3]&","&RC[-2]&","&RC[-1]&"}," -> {110005,0,1,100}, | AI46: =R[-1]C&RC[-1] -> {200000,0,1,60},{200001,0,1,60},{200002,0,1,60},{200003,0,1,60},{200006,0,1,60},{200010,0,1,20},{200011,0,1,20},{200012,0,1,20},{200013,0,1,20},{200015,0,1,20},{200016,0,1,20},{200017,0,1,20},{200019,0,1,20},{201000,0,1,60},{201001,0,1,60},{201002,0,1,60},{201003,0,1,60},{201006,0,1,60},{201010,0,1,20},{201011,0,1,20},{201012,0,1,20},{201013,0,1,20},{201015,0,1,20},{201016,0,1,20},{201017,0,1,20},{201019,0,1,20},{202000,0,1,60},{202001,0,1,60},{202002,0,1,60},{202003,0,1,60},{202006,0,1,60},{202010,0,1,20},{202011,0,1,20},{202012,0,1,20},{202013,0,1,20},{202015,0,1,20},{202016,0,1,20},{202017,0,1,20},{202019,0,1,20},{110002,0,1,0},{110003,0,1,0},{110004,0,1,100},{110005,0,1,100}, | AK46: 110005 | AL46: 蓝药 | AN46: 0 | AO46: 1 | AP46: 100 | AQ46: ="{"&RC[-6]&","&RC[-3]&","&RC[-2]&","&RC[-1]&"}," -> {110005,0,1,100}, | AR46: =R[-1]C&RC[-1] -> {200000,0,1,50},{200001,0,1,50},{200002,0,1,50},{200003,0,1,50},{200006,0,1,50},{200010,0,1,30},{200011,0,1,30},{200012,0,1,30},{200013,0,1,30},{200015,0,1,30},{200016,0,1,30},{200017,0,1,30},{200019,0,1,30},{201000,0,1,50},{201001,0,1,50},{201002,0,1,50},{201003,0,1,50},{201006,0,1,50},{201010,0,1,30},{201011,0,1,30},{201012,0,1,30},{201013,0,1,30},{201015,0,1,30},{201016,0,1,30},{201017,0,1,30},{201019,0,1,30},{202000,0,1,50},{202001,0,1,50},{202002,0,1,50},{202003,0,1,50},{202006,0,1,50},{202010,0,1,30},{202011,0,1,30},{202012,0,1,30},{202013,0,1,30},{202015,0,1,30},{202016,0,1,30},{202017,0,1,30},{202019,0,1,30},{110002,0,1,0},{110003,0,1,0},{110004,0,1,100},{110005,0,1,100},
J47: 110067 | K47: 诱惑之光书 | L47: 1 | M47: 0 | N47: 1 | O47: 0 | P47: ="{"&RC[-6]&","&RC[-3]&","&RC[-2]&","&RC[-1]&"}" -> {110067,0,1,0} | Q47: =R[-1]C&RC[-1] -> {200000,0,1,60},{200001,0,1,60},{200002,0,1,60},{200003,0,1,60},{200006,0,1,60},{200010,0,1,2},{200011,0,1,2},{200012,0,1,2},{201000,0,1,60},{201001,0,1,60},{201002,0,1,60},{201003,0,1,60},{201006,0,1,60},{201010,0,1,2},{201011,0,1,2},{201012,0,1,2},{202000,0,1,60},{202001,0,1,60},{202002,0,1,60},{202003,0,1,60},{202006,0,1,60},{202010,0,1,2},{202011,0,1,2},{202012,0,1,2},{110002,0,1,0},{110003,0,1,0},{110004,0,1,100},{110005,0,1,100},{110010,0,1,10},{110011,0,1,10},{110012,0,1,10},{110009,0,2,100},{110023,0,1,0},{110024,0,1,0},{110025,0,1,0},{110026,0,1,0},{110030,0,1,0},{110031,0,1,0},{110032,0,1,0},{110033,0,1,0},{110038,0,1,0},{110039,0,1,0},{110040,0,1,0},{110067,0,1,0} | S47: 110010 | T47: 普通武装碎片 | V47: 0 | W47: 1 | X47: 8 | Y47: ="{"&RC[-6]&","&RC[-3]&","&RC[-2]&","&RC[-1]&"}," -> {110010,0,1,8}, | Z47: =R[-1]C&RC[-1] -> {200000,0,1,70},{200001,0,1,70},{200002,0,1,70},{200003,0,1,70},{200006,0,1,70},{200010,0,1,20},{200011,0,1,20},{200012,0,1,20},{200013,0,1,20},{200015,0,1,20},{200016,0,1,20},{200017,0,1,20},{200019,0,1,20},{201000,0,1,70},{201001,0,1,70},{201002,0,1,70},{201003,0,1,70},{201006,0,1,70},{201010,0,1,20},{201011,0,1,20},{201012,0,1,20},{201013,0,1,20},{201015,0,1,20},{201016,0,1,20},{201017,0,1,20},{201019,0,1,20},{202000,0,1,70},{202001,0,1,70},{202002,0,1,70},{202003,0,1,70},{202006,0,1,70},{202010,0,1,20},{202011,0,1,20},{202012,0,1,20},{202013,0,1,20},{202015,0,1,20},{202016,0,1,20},{202017,0,1,20},{202019,0,1,20},{110002,0,1,0},{110003,0,1,0},{110004,0,1,100},{110005,0,1,100},{110010,0,1,8}, | AB47: 110010 | AC47: 普通武装碎片 | AE47: 0 | AF47: 1 | AG47: 10 | AH47: ="{"&RC[-6]&","&RC[-3]&","&RC[-2]&","&RC[-1]&"}," -> {110010,0,1,10}, | AI47: =R[-1]C&RC[-1] -> {200000,0,1,60},{200001,0,1,60},{200002,0,1,60},{200003,0,1,60},{200006,0,1,60},{200010,0,1,20},{200011,0,1,20},{200012,0,1,20},{200013,0,1,20},{200015,0,1,20},{200016,0,1,20},{200017,0,1,20},{200019,0,1,20},{201000,0,1,60},{201001,0,1,60},{201002,0,1,60},{201003,0,1,60},{201006,0,1,60},{201010,0,1,20},{201011,0,1,20},{201012,0,1,20},{201013,0,1,20},{201015,0,1,20},{201016,0,1,20},{201017,0,1,20},{201019,0,1,20},{202000,0,1,60},{202001,0,1,60},{202002,0,1,60},{202003,0,1,60},{202006,0,1,60},{202010,0,1,20},{202011,0,1,20},{202012,0,1,20},{202013,0,1,20},{202015,0,1,20},{202016,0,1,20},{202017,0,1,20},{202019,0,1,20},{110002,0,1,0},{110003,0,1,0},{110004,0,1,100},{110005,0,1,100},{110010,0,1,10}, | AK47: 110010 | AL47: 普通武装碎片 | AN47: 0 | AO47: 1 | AP47: 10 | AQ47: ="{"&RC[-6]&","&RC[-3]&","&RC[-2]&","&RC[-1]&"}," -> {110010,0,1,10}, | AR47: =R[-1]C&RC[-1] -> {200000,0,1,50},{200001,0,1,50},{200002,0,1,50},{200003,0,1,50},{200006,0,1,50},{200010,0,1,30},{200011,0,1,30},{200012,0,1,30},{200013,0,1,30},{200015,0,1,30},{200016,0,1,30},{200017,0,1,30},{200019,0,1,30},{201000,0,1,50},{201001,0,1,50},{201002,0,1,50},{201003,0,1,50},{201006,0,1,50},{201010,0,1,30},{201011,0,1,30},{201012,0,1,30},{201013,0,1,30},{201015,0,1,30},{201016,0,1,30},{201017,0,1,30},{201019,0,1,30},{202000,0,1,50},{202001,0,1,50},{202002,0,1,50},{202003,0,1,50},{202006,0,1,50},{202010,0,1,30},{202011,0,1,30},{202012,0,1,30},{202013,0,1,30},{202015,0,1,30},{202016,0,1,30},{202017,0,1,30},{202019,0,1,30},{110002,0,1,0},{110003,0,1,0},{110004,0,1,100},{110005,0,1,100},{110010,0,1,10},
S48: 110011 | T48: 普通防具碎片 | V48: 0 | W48: 1 | X48: 15 | Y48: ="{"&RC[-6]&","&RC[-3]&","&RC[-2]&","&RC[-1]&"}," -> {110011,0,1,15}, | Z48: =R[-1]C&RC[-1] -> {200000,0,1,70},{200001,0,1,70},{200002,0,1,70},{200003,0,1,70},{200006,0,1,70},{200010,0,1,20},{200011,0,1,20},{200012,0,1,20},{200013,0,1,20},{200015,0,1,20},{200016,0,1,20},{200017,0,1,20},{200019,0,1,20},{201000,0,1,70},{201001,0,1,70},{201002,0,1,70},{201003,0,1,70},{201006,0,1,70},{201010,0,1,20},{201011,0,1,20},{201012,0,1,20},{201013,0,1,20},{201015,0,1,20},{201016,0,1,20},{201017,0,1,20},{201019,0,1,20},{202000,0,1,70},{202001,0,1,70},{202002,0,1,70},{202003,0,1,70},{202006,0,1,70},{202010,0,1,20},{202011,0,1,20},{202012,0,1,20},{202013,0,1,20},{202015,0,1,20},{202016,0,1,20},{202017,0,1,20},{202019,0,1,20},{110002,0,1,0},{110003,0,1,0},{110004,0,1,100},{110005,0,1,100},{110010,0,1,8},{110011,0,1,15}, | AB48: 110011 | AC48: 普通防具碎片 | AE48: 0 | AF48: 1 | AG48: 20 | AH48: ="{"&RC[-6]&","&RC[-3]&","&RC[-2]&","&RC[-1]&"}," -> {110011,0,1,20}, | AI48: =R[-1]C&RC[-1] -> {200000,0,1,60},{200001,0,1,60},{200002,0,1,60},{200003,0,1,60},{200006,0,1,60},{200010,0,1,20},{200011,0,1,20},{200012,0,1,20},{200013,0,1,20},{200015,0,1,20},{200016,0,1,20},{200017,0,1,20},{200019,0,1,20},{201000,0,1,60},{201001,0,1,60},{201002,0,1,60},{201003,0,1,60},{201006,0,1,60},{201010,0,1,20},{201011,0,1,20},{201012,0,1,20},{201013,0,1,20},{201015,0,1,20},{201016,0,1,20},{201017,0,1,20},{201019,0,1,20},{202000,0,1,60},{202001,0,1,60},{202002,0,1,60},{202003,0,1,60},{202006,0,1,60},{202010,0,1,20},{202011,0,1,20},{202012,0,1,20},{202013,0,1,20},{202015,0,1,20},{202016,0,1,20},{202017,0,1,20},{202019,0,1,20},{110002,0,1,0},{110003,0,1,0},{110004,0,1,100},{110005,0,1,100},{110010,0,1,10},{110011,0,1,20}, | AK48: 110011 | AL48: 普通防具碎片 | AN48: 0 | AO48: 1 | AP48: 20 | AQ48: ="{"&RC[-6]&","&RC[-3]&","&RC[-2]&","&RC[-1]&"}," -> {110011,0,1,20}, | AR48: =R[-1]C&RC[-1] -> {200000,0,1,50},{200001,0,1,50},{200002,0,1,50},{200003,0,1,50},{200006,0,1,50},{200010,0,1,30},{200011,0,1,30},{200012,0,1,30},{200013,0,1,30},{200015,0,1,30},{200016,0,1,30},{200017,0,1,30},{200019,0,1,30},{201000,0,1,50},{201001,0,1,50},{201002,0,1,50},{201003,0,1,50},{201006,0,1,50},{201010,0,1,30},{201011,0,1,30},{201012,0,1,30},{201013,0,1,30},{201015,0,1,30},{201016,0,1,30},{201017,0,1,30},{201019,0,1,30},{202000,0,1,50},{202001,0,1,50},{202002,0,1,50},{202003,0,1,50},{202006,0,1,50},{202010,0,1,30},{202011,0,1,30},{202012,0,1,30},{202013,0,1,30},{202015,0,1,30},{202016,0,1,30},{202017,0,1,30},{202019,0,1,30},{110002,0,1,0},{110003,0,1,0},{110004,0,1,100},{110005,0,1,100},{110010,0,1,10},{110011,0,1,20},
O49: 掉落数量 | P49: 概率／100 | S49: 110012 | T49: 普通首饰碎片 | V49: 0 | W49: 1 | X49: 15 | Y49: ="{"&RC[-6]&","&RC[-3]&","&RC[-2]&","&RC[-1]&"}," -> {110012,0,1,15}, | Z49: =R[-1]C&RC[-1] -> {200000,0,1,70},{200001,0,1,70},{200002,0,1,70},{200003,0,1,70},{200006,0,1,70},{200010,0,1,20},{200011,0,1,20},{200012,0,1,20},{200013,0,1,20},{200015,0,1,20},{200016,0,1,20},{200017,0,1,20},{200019,0,1,20},{201000,0,1,70},{201001,0,1,70},{201002,0,1,70},{201003,0,1,70},{201006,0,1,70},{201010,0,1,20},{201011,0,1,20},{201012,0,1,20},{201013,0,1,20},{201015,0,1,20},{201016,0,1,20},{201017,0,1,20},{201019,0,1,20},{202000,0,1,70},{202001,0,1,70},{202002,0,1,70},{202003,0,1,70},{202006,0,1,70},{202010,0,1,20},{202011,0,1,20},{202012,0,1,20},{202013,0,1,20},{202015,0,1,20},{202016,0,1,20},{202017,0,1,20},{202019,0,1,20},{110002,0,1,0},{110003,0,1,0},{110004,0,1,100},{110005,0,1,100},{110010,0,1,8},{110011,0,1,15},{110012,0,1,15}, | AB49: 110012 | AC49: 普通首饰碎片 | AE49: 0 | AF49: 1 | AG49: 20 | AH49: ="{"&RC[-6]&","&RC[-3]&","&RC[-2]&","&RC[-1]&"}," -> {110012,0,1,20}, | AI49: =R[-1]C&RC[-1] -> {200000,0,1,60},{200001,0,1,60},{200002,0,1,60},{200003,0,1,60},{200006,0,1,60},{200010,0,1,20},{200011,0,1,20},{200012,0,1,20},{200013,0,1,20},{200015,0,1,20},{200016,0,1,20},{200017,0,1,20},{200019,0,1,20},{201000,0,1,60},{201001,0,1,60},{201002,0,1,60},{201003,0,1,60},{201006,0,1,60},{201010,0,1,20},{201011,0,1,20},{201012,0,1,20},{201013,0,1,20},{201015,0,1,20},{201016,0,1,20},{201017,0,1,20},{201019,0,1,20},{202000,0,1,60},{202001,0,1,60},{202002,0,1,60},{202003,0,1,60},{202006,0,1,60},{202010,0,1,20},{202011,0,1,20},{202012,0,1,20},{202013,0,1,20},{202015,0,1,20},{202016,0,1,20},{202017,0,1,20},{202019,0,1,20},{110002,0,1,0},{110003,0,1,0},{110004,0,1,100},{110005,0,1,100},{110010,0,1,10},{110011,0,1,20},{110012,0,1,20}, | AK49: 110012 | AL49: 普通首饰碎片 | AN49: 0 | AO49: 1 | AP49: 20 | AQ49: ="{"&RC[-6]&","&RC[-3]&","&RC[-2]&","&RC[-1]&"}," -> {110012,0,1,20}, | AR49: =R[-1]C&RC[-1] -> {200000,0,1,50},{200001,0,1,50},{200002,0,1,50},{200003,0,1,50},{200006,0,1,50},{200010,0,1,30},{200011,0,1,30},{200012,0,1,30},{200013,0,1,30},{200015,0,1,30},{200016,0,1,30},{200017,0,1,30},{200019,0,1,30},{201000,0,1,50},{201001,0,1,50},{201002,0,1,50},{201003,0,1,50},{201006,0,1,50},{201010,0,1,30},{201011,0,1,30},{201012,0,1,30},{201013,0,1,30},{201015,0,1,30},{201016,0,1,30},{201017,0,1,30},{201019,0,1,30},{202000,0,1,50},{202001,0,1,50},{202002,0,1,50},{202003,0,1,50},{202006,0,1,50},{202010,0,1,30},{202011,0,1,30},{202012,0,1,30},{202013,0,1,30},{202015,0,1,30},{202016,0,1,30},{202017,0,1,30},{202019,0,1,30},{110002,0,1,0},{110003,0,1,0},{110004,0,1,100},{110005,0,1,100},{110010,0,1,10},{110011,0,1,20},{110012,0,1,20},
O50: 0 | P50: =10000-R[1]C -> 9900 | Q50: ="{"&RC[-2]&","&RC[-1]&"}," -> {0,9900}, | S50: 110009 | T50: 金币 | V50: 0 | W50: 3 | X50: 100 | Y50: ="{"&RC[-6]&","&RC[-3]&","&RC[-2]&","&RC[-1]&"}," -> {110009,0,3,100}, | Z50: =R[-1]C&RC[-1] -> {200000,0,1,70},{200001,0,1,70},{200002,0,1,70},{200003,0,1,70},{200006,0,1,70},{200010,0,1,20},{200011,0,1,20},{200012,0,1,20},{200013,0,1,20},{200015,0,1,20},{200016,0,1,20},{200017,0,1,20},{200019,0,1,20},{201000,0,1,70},{201001,0,1,70},{201002,0,1,70},{201003,0,1,70},{201006,0,1,70},{201010,0,1,20},{201011,0,1,20},{201012,0,1,20},{201013,0,1,20},{201015,0,1,20},{201016,0,1,20},{201017,0,1,20},{201019,0,1,20},{202000,0,1,70},{202001,0,1,70},{202002,0,1,70},{202003,0,1,70},{202006,0,1,70},{202010,0,1,20},{202011,0,1,20},{202012,0,1,20},{202013,0,1,20},{202015,0,1,20},{202016,0,1,20},{202017,0,1,20},{202019,0,1,20},{110002,0,1,0},{110003,0,1,0},{110004,0,1,100},{110005,0,1,100},{110010,0,1,8},{110011,0,1,15},{110012,0,1,15},{110009,0,3,100}, | AB50: 110009 | AC50: 金币 | AE50: 0 | AF50: 4 | AG50: 100 | AH50: ="{"&RC[-6]&","&RC[-3]&","&RC[-2]&","&RC[-1]&"}," -> {110009,0,4,100}, | AI50: =R[-1]C&RC[-1] -> {200000,0,1,60},{200001,0,1,60},{200002,0,1,60},{200003,0,1,60},{200006,0,1,60},{200010,0,1,20},{200011,0,1,20},{200012,0,1,20},{200013,0,1,20},{200015,0,1,20},{200016,0,1,20},{200017,0,1,20},{200019,0,1,20},{201000,0,1,60},{201001,0,1,60},{201002,0,1,60},{201003,0,1,60},{201006,0,1,60},{201010,0,1,20},{201011,0,1,20},{201012,0,1,20},{201013,0,1,20},{201015,0,1,20},{201016,0,1,20},{201017,0,1,20},{201019,0,1,20},{202000,0,1,60},{202001,0,1,60},{202002,0,1,60},{202003,0,1,60},{202006,0,1,60},{202010,0,1,20},{202011,0,1,20},{202012,0,1,20},{202013,0,1,20},{202015,0,1,20},{202016,0,1,20},{202017,0,1,20},{202019,0,1,20},{110002,0,1,0},{110003,0,1,0},{110004,0,1,100},{110005,0,1,100},{110010,0,1,10},{110011,0,1,20},{110012,0,1,20},{110009,0,4,100}, | AK50: 110009 | AL50: 金币 | AN50: 0 | AO50: 5 | AP50: 100 | AQ50: ="{"&RC[-6]&","&RC[-3]&","&RC[-2]&","&RC[-1]&"}," -> {110009,0,5,100}, | AR50: =R[-1]C&RC[-1] -> {200000,0,1,50},{200001,0,1,50},{200002,0,1,50},{200003,0,1,50},{200006,0,1,50},{200010,0,1,30},{200011,0,1,30},{200012,0,1,30},{200013,0,1,30},{200015,0,1,30},{200016,0,1,30},{200017,0,1,30},{200019,0,1,30},{201000,0,1,50},{201001,0,1,50},{201002,0,1,50},{201003,0,1,50},{201006,0,1,50},{201010,0,1,30},{201011,0,1,30},{201012,0,1,30},{201013,0,1,30},{201015,0,1,30},{201016,0,1,30},{201017,0,1,30},{201019,0,1,30},{202000,0,1,50},{202001,0,1,50},{202002,0,1,50},{202003,0,1,50},{202006,0,1,50},{202010,0,1,30},{202011,0,1,30},{202012,0,1,30},{202013,0,1,30},{202015,0,1,30},{202016,0,1,30},{202017,0,1,30},{202019,0,1,30},{110002,0,1,0},{110003,0,1,0},{110004,0,1,100},{110005,0,1,100},{110010,0,1,10},{110011,0,1,20},{110012,0,1,20},{110009,0,5,100},
K51: BOSS怪掉落 | O51: 1 | P51: 100 | Q51: ="{"&RC[-2]&","&RC[-1]&"}" -> {1,100} | S51: 110023 | T51: 烈火剑法书 | U51: 1 | V51: 0 | W51: 1 | X51: 0 | Y51: ="{"&RC[-6]&","&RC[-3]&","&RC[-2]&","&RC[-1]&"}," -> {110023,0,1,0}, | Z51: =R[-1]C&RC[-1] -> {200000,0,1,70},{200001,0,1,70},{200002,0,1,70},{200003,0,1,70},{200006,0,1,70},{200010,0,1,20},{200011,0,1,20},{200012,0,1,20},{200013,0,1,20},{200015,0,1,20},{200016,0,1,20},{200017,0,1,20},{200019,0,1,20},{201000,0,1,70},{201001,0,1,70},{201002,0,1,70},{201003,0,1,70},{201006,0,1,70},{201010,0,1,20},{201011,0,1,20},{201012,0,1,20},{201013,0,1,20},{201015,0,1,20},{201016,0,1,20},{201017,0,1,20},{201019,0,1,20},{202000,0,1,70},{202001,0,1,70},{202002,0,1,70},{202003,0,1,70},{202006,0,1,70},{202010,0,1,20},{202011,0,1,20},{202012,0,1,20},{202013,0,1,20},{202015,0,1,20},{202016,0,1,20},{202017,0,1,20},{202019,0,1,20},{110002,0,1,0},{110003,0,1,0},{110004,0,1,100},{110005,0,1,100},{110010,0,1,8},{110011,0,1,15},{110012,0,1,15},{110009,0,3,100},{110023,0,1,0}, | AB51: 110023 | AC51: 烈火剑法书 | AD51: 1 | AE51: 0 | AF51: 1 | AG51: 0 | AH51: ="{"&RC[-6]&","&RC[-3]&","&RC[-2]&","&RC[-1]&"}," -> {110023,0,1,0}, | AI51: =R[-1]C&RC[-1] -> {200000,0,1,60},{200001,0,1,60},{200002,0,1,60},{200003,0,1,60},{200006,0,1,60},{200010,0,1,20},{200011,0,1,20},{200012,0,1,20},{200013,0,1,20},{200015,0,1,20},{200016,0,1,20},{200017,0,1,20},{200019,0,1,20},{201000,0,1,60},{201001,0,1,60},{201002,0,1,60},{201003,0,1,60},{201006,0,1,60},{201010,0,1,20},{201011,0,1,20},{201012,0,1,20},{201013,0,1,20},{201015,0,1,20},{201016,0,1,20},{201017,0,1,20},{201019,0,1,20},{202000,0,1,60},{202001,0,1,60},{202002,0,1,60},{202003,0,1,60},{202006,0,1,60},{202010,0,1,20},{202011,0,1,20},{202012,0,1,20},{202013,0,1,20},{202015,0,1,20},{202016,0,1,20},{202017,0,1,20},{202019,0,1,20},{110002,0,1,0},{110003,0,1,0},{110004,0,1,100},{110005,0,1,100},{110010,0,1,10},{110011,0,1,20},{110012,0,1,20},{110009,0,4,100},{110023,0,1,0}, | AK51: 110023 | AL51: 烈火剑法书 | AM51: 1 | AN51: 0 | AO51: 1 | AP51: 0 | AQ51: ="{"&RC[-6]&","&RC[-3]&","&RC[-2]&","&RC[-1]&"}," -> {110023,0,1,0}, | AR51: =R[-1]C&RC[-1] -> {200000,0,1,50},{200001,0,1,50},{200002,0,1,50},{200003,0,1,50},{200006,0,1,50},{200010,0,1,30},{200011,0,1,30},{200012,0,1,30},{200013,0,1,30},{200015,0,1,30},{200016,0,1,30},{200017,0,1,30},{200019,0,1,30},{201000,0,1,50},{201001,0,1,50},{201002,0,1,50},{201003,0,1,50},{201006,0,1,50},{201010,0,1,30},{201011,0,1,30},{201012,0,1,30},{201013,0,1,30},{201015,0,1,30},{201016,0,1,30},{201017,0,1,30},{201019,0,1,30},{202000,0,1,50},{202001,0,1,50},{202002,0,1,50},{202003,0,1,50},{202006,0,1,50},{202010,0,1,30},{202011,0,1,30},{202012,0,1,30},{202013,0,1,30},{202015,0,1,30},{202016,0,1,30},{202017,0,1,30},{202019,0,1,30},{110002,0,1,0},{110003,0,1,0},{110004,0,1,100},{110005,0,1,100},{110010,0,1,10},{110011,0,1,20},{110012,0,1,20},{110009,0,5,100},{110023,0,1,0},
S52: 110024 | T52: 狂风斩书 | U52: 1 | V52: 0 | W52: 1 | X52: 0 | Y52: ="{"&RC[-6]&","&RC[-3]&","&RC[-2]&","&RC[-1]&"}," -> {110024,0,1,0}, | Z52: =R[-1]C&RC[-1] -> {200000,0,1,70},{200001,0,1,70},{200002,0,1,70},{200003,0,1,70},{200006,0,1,70},{200010,0,1,20},{200011,0,1,20},{200012,0,1,20},{200013,0,1,20},{200015,0,1,20},{200016,0,1,20},{200017,0,1,20},{200019,0,1,20},{201000,0,1,70},{201001,0,1,70},{201002,0,1,70},{201003,0,1,70},{201006,0,1,70},{201010,0,1,20},{201011,0,1,20},{201012,0,1,20},{201013,0,1,20},{201015,0,1,20},{201016,0,1,20},{201017,0,1,20},{201019,0,1,20},{202000,0,1,70},{202001,0,1,70},{202002,0,1,70},{202003,0,1,70},{202006,0,1,70},{202010,0,1,20},{202011,0,1,20},{202012,0,1,20},{202013,0,1,20},{202015,0,1,20},{202016,0,1,20},{202017,0,1,20},{202019,0,1,20},{110002,0,1,0},{110003,0,1,0},{110004,0,1,100},{110005,0,1,100},{110010,0,1,8},{110011,0,1,15},{110012,0,1,15},{110009,0,3,100},{110023,0,1,0},{110024,0,1,0}, | AB52: 110024 | AC52: 狂风斩书 | AD52: 1 | AE52: 0 | AF52: 1 | AG52: 0 | AH52: ="{"&RC[-6]&","&RC[-3]&","&RC[-2]&","&RC[-1]&"}," -> {110024,0,1,0}, | AI52: =R[-1]C&RC[-1] -> {200000,0,1,60},{200001,0,1,60},{200002,0,1,60},{200003,0,1,60},{200006,0,1,60},{200010,0,1,20},{200011,0,1,20},{200012,0,1,20},{200013,0,1,20},{200015,0,1,20},{200016,0,1,20},{200017,0,1,20},{200019,0,1,20},{201000,0,1,60},{201001,0,1,60},{201002,0,1,60},{201003,0,1,60},{201006,0,1,60},{201010,0,1,20},{201011,0,1,20},{201012,0,1,20},{201013,0,1,20},{201015,0,1,20},{201016,0,1,20},{201017,0,1,20},{201019,0,1,20},{202000,0,1,60},{202001,0,1,60},{202002,0,1,60},{202003,0,1,60},{202006,0,1,60},{202010,0,1,20},{202011,0,1,20},{202012,0,1,20},{202013,0,1,20},{202015,0,1,20},{202016,0,1,20},{202017,0,1,20},{202019,0,1,20},{110002,0,1,0},{110003,0,1,0},{110004,0,1,100},{110005,0,1,100},{110010,0,1,10},{110011,0,1,20},{110012,0,1,20},{110009,0,4,100},{110023,0,1,0},{110024,0,1,0}, | AK52: 110024 | AL52: 狂风斩书 | AM52: 1 | AN52: 0 | AO52: 1 | AP52: 0 | AQ52: ="{"&RC[-6]&","&RC[-3]&","&RC[-2]&","&RC[-1]&"}," -> {110024,0,1,0}, | AR52: =R[-1]C&RC[-1] -> {200000,0,1,50},{200001,0,1,50},{200002,0,1,50},{200003,0,1,50},{200006,0,1,50},{200010,0,1,30},{200011,0,1,30},{200012,0,1,30},{200013,0,1,30},{200015,0,1,30},{200016,0,1,30},{200017,0,1,30},{200019,0,1,30},{201000,0,1,50},{201001,0,1,50},{201002,0,1,50},{201003,0,1,50},{201006,0,1,50},{201010,0,1,30},{201011,0,1,30},{201012,0,1,30},{201013,0,1,30},{201015,0,1,30},{201016,0,1,30},{201017,0,1,30},{201019,0,1,30},{202000,0,1,50},{202001,0,1,50},{202002,0,1,50},{202003,0,1,50},{202006,0,1,50},{202010,0,1,30},{202011,0,1,30},{202012,0,1,30},{202013,0,1,30},{202015,0,1,30},{202016,0,1,30},{202017,0,1,30},{202019,0,1,30},{110002,0,1,0},{110003,0,1,0},{110004,0,1,100},{110005,0,1,100},{110010,0,1,10},{110011,0,1,20},{110012,0,1,20},{110009,0,5,100},{110023,0,1,0},{110024,0,1,0},
Q53: ="[{0,["&R[-3]C&R[-2]C&"],["&R[-6]C&"]}]" -> [{0,[{0,9900},{1,100}],[{200000,0,1,60},{200001,0,1,60},{200002,0,1,60},{200003,0,1,60},{200006,0,1,60},{200010,0,1,2},{200011,0,1,2},{200012,0,1,2},{201000,0,1,60},{201001,0,1,60},{201002,0,1,60},{201003,0,1,60},{201006,0,1,60},{201010,0,1,2},{201011,0,1,2},{201012,0,1,2},{202000,0,1,60},{202001,0,1,60},{202002,0,1,60},{202003,0,1,60},{202006,0,1,60},{202010,0,1,2},{202011,0,1,2},{202012,0,1,2},{110002,0,1,0},{110003,0,1,0},{110004,0,1,100},{110005,0,1,100},{110010,0,1,10},{110011,0,1,10},{110012,0,1,10},{110009,0,2,100},{110023,0,1,0},{110024,0,1,0},{110025,0,1,0},{110026,0,1,0},{110030,0,1,0},{110031,0,1,0},{110032,0,1,0},{110033,0,1,0},{110038,0,1,0},{110039,0,1,0},{110040,0,1,0},{110067,0,1,0}]}] | S53: 110025 | T53: 逐日剑法书 | U53: 1 | V53: 0 | W53: 1 | X53: 0 | Y53: ="{"&RC[-6]&","&RC[-3]&","&RC[-2]&","&RC[-1]&"}," -> {110025,0,1,0}, | Z53: =R[-1]C&RC[-1] -> {200000,0,1,70},{200001,0,1,70},{200002,0,1,70},{200003,0,1,70},{200006,0,1,70},{200010,0,1,20},{200011,0,1,20},{200012,0,1,20},{200013,0,1,20},{200015,0,1,20},{200016,0,1,20},{200017,0,1,20},{200019,0,1,20},{201000,0,1,70},{201001,0,1,70},{201002,0,1,70},{201003,0,1,70},{201006,0,1,70},{201010,0,1,20},{201011,0,1,20},{201012,0,1,20},{201013,0,1,20},{201015,0,1,20},{201016,0,1,20},{201017,0,1,20},{201019,0,1,20},{202000,0,1,70},{202001,0,1,70},{202002,0,1,70},{202003,0,1,70},{202006,0,1,70},{202010,0,1,20},{202011,0,1,20},{202012,0,1,20},{202013,0,1,20},{202015,0,1,20},{202016,0,1,20},{202017,0,1,20},{202019,0,1,20},{110002,0,1,0},{110003,0,1,0},{110004,0,1,100},{110005,0,1,100},{110010,0,1,8},{110011,0,1,15},{110012,0,1,15},{110009,0,3,100},{110023,0,1,0},{110024,0,1,0},{110025,0,1,0}, | AB53: 110025 | AC53: 逐日剑法书 | AD53: 1 | AE53: 0 | AF53: 1 | AG53: 0 | AH53: ="{"&RC[-6]&","&RC[-3]&","&RC[-2]&","&RC[-1]&"}," -> {110025,0,1,0}, | AI53: =R[-1]C&RC[-1] -> {200000,0,1,60},{200001,0,1,60},{200002,0,1,60},{200003,0,1,60},{200006,0,1,60},{200010,0,1,20},{200011,0,1,20},{200012,0,1,20},{200013,0,1,20},{200015,0,1,20},{200016,0,1,20},{200017,0,1,20},{200019,0,1,20},{201000,0,1,60},{201001,0,1,60},{201002,0,1,60},{201003,0,1,60},{201006,0,1,60},{201010,0,1,20},{201011,0,1,20},{201012,0,1,20},{201013,0,1,20},{201015,0,1,20},{201016,0,1,20},{201017,0,1,20},{201019,0,1,20},{202000,0,1,60},{202001,0,1,60},{202002,0,1,60},{202003,0,1,60},{202006,0,1,60},{202010,0,1,20},{202011,0,1,20},{202012,0,1,20},{202013,0,1,20},{202015,0,1,20},{202016,0,1,20},{202017,0,1,20},{202019,0,1,20},{110002,0,1,0},{110003,0,1,0},{110004,0,1,100},{110005,0,1,100},{110010,0,1,10},{110011,0,1,20},{110012,0,1,20},{110009,0,4,100},{110023,0,1,0},{110024,0,1,0},{110025,0,1,0}, | AK53: 110025 | AL53: 逐日剑法书 | AM53: 1 | AN53: 0 | AO53: 1 | AP53: 0 | AQ53: ="{"&RC[-6]&","&RC[-3]&","&RC[-2]&","&RC[-1]&"}," -> {110025,0,1,0}, | AR53: =R[-1]C&RC[-1] -> {200000,0,1,50},{200001,0,1,50},{200002,0,1,50},{200003,0,1,50},{200006,0,1,50},{200010,0,1,30},{200011,0,1,30},{200012,0,1,30},{200013,0,1,30},{200015,0,1,30},{200016,0,1,30},{200017,0,1,30},{200019,0,1,30},{201000,0,1,50},{201001,0,1,50},{201002,0,1,50},{201003,0,1,50},{201006,0,1,50},{201010,0,1,30},{201011,0,1,30},{201012,0,1,30},{201013,0,1,30},{201015,0,1,30},{201016,0,1,30},{201017,0,1,30},{201019,0,1,30},{202000,0,1,50},{202001,0,1,50},{202002,0,1,50},{202003,0,1,50},{202006,0,1,50},{202010,0,1,30},{202011,0,1,30},{202012,0,1,30},{202013,0,1,30},{202015,0,1,30},{202016,0,1,30},{202017,0,1,30},{202019,0,1,30},{110002,0,1,0},{110003,0,1,0},{110004,0,1,100},{110005,0,1,100},{110010,0,1,10},{110011,0,1,20},{110012,0,1,20},{110009,0,5,100},{110023,0,1,0},{110024,0,1,0},{110025,0,1,0},
S54: 110026 | T54: 灵魂火符书 | U54: 1 | V54: 0 | W54: 1 | X54: 0 | Y54: ="{"&RC[-6]&","&RC[-3]&","&RC[-2]&","&RC[-1]&"}," -> {110026,0,1,0}, | Z54: =R[-1]C&RC[-1] -> {200000,0,1,70},{200001,0,1,70},{200002,0,1,70},{200003,0,1,70},{200006,0,1,70},{200010,0,1,20},{200011,0,1,20},{200012,0,1,20},{200013,0,1,20},{200015,0,1,20},{200016,0,1,20},{200017,0,1,20},{200019,0,1,20},{201000,0,1,70},{201001,0,1,70},{201002,0,1,70},{201003,0,1,70},{201006,0,1,70},{201010,0,1,20},{201011,0,1,20},{201012,0,1,20},{201013,0,1,20},{201015,0,1,20},{201016,0,1,20},{201017,0,1,20},{201019,0,1,20},{202000,0,1,70},{202001,0,1,70},{202002,0,1,70},{202003,0,1,70},{202006,0,1,70},{202010,0,1,20},{202011,0,1,20},{202012,0,1,20},{202013,0,1,20},{202015,0,1,20},{202016,0,1,20},{202017,0,1,20},{202019,0,1,20},{110002,0,1,0},{110003,0,1,0},{110004,0,1,100},{110005,0,1,100},{110010,0,1,8},{110011,0,1,15},{110012,0,1,15},{110009,0,3,100},{110023,0,1,0},{110024,0,1,0},{110025,0,1,0},{110026,0,1,0}, | AB54: 110026 | AC54: 灵魂火符书 | AD54: 1 | AE54: 0 | AF54: 1 | AG54: 0 | AH54: ="{"&RC[-6]&","&RC[-3]&","&RC[-2]&","&RC[-1]&"}," -> {110026,0,1,0}, | AI54: =R[-1]C&RC[-1] -> {200000,0,1,60},{200001,0,1,60},{200002,0,1,60},{200003,0,1,60},{200006,0,1,60},{200010,0,1,20},{200011,0,1,20},{200012,0,1,20},{200013,0,1,20},{200015,0,1,20},{200016,0,1,20},{200017,0,1,20},{200019,0,1,20},{201000,0,1,60},{201001,0,1,60},{201002,0,1,60},{201003,0,1,60},{201006,0,1,60},{201010,0,1,20},{201011,0,1,20},{201012,0,1,20},{201013,0,1,20},{201015,0,1,20},{201016,0,1,20},{201017,0,1,20},{201019,0,1,20},{202000,0,1,60},{202001,0,1,60},{202002,0,1,60},{202003,0,1,60},{202006,0,1,60},{202010,0,1,20},{202011,0,1,20},{202012,0,1,20},{202013,0,1,20},{202015,0,1,20},{202016,0,1,20},{202017,0,1,20},{202019,0,1,20},{110002,0,1,0},{110003,0,1,0},{110004,0,1,100},{110005,0,1,100},{110010,0,1,10},{110011,0,1,20},{110012,0,1,20},{110009,0,4,100},{110023,0,1,0},{110024,0,1,0},{110025,0,1,0},{110026,0,1,0}, | AK54: 110026 | AL54: 灵魂火符书 | AM54: 1 | AN54: 0 | AO54: 1 | AP54: 0 | AQ54: ="{"&RC[-6]&","&RC[-3]&","&RC[-2]&","&RC[-1]&"}," -> {110026,0,1,0}, | AR54: =R[-1]C&RC[-1] -> {200000,0,1,50},{200001,0,1,50},{200002,0,1,50},{200003,0,1,50},{200006,0,1,50},{200010,0,1,30},{200011,0,1,30},{200012,0,1,30},{200013,0,1,30},{200015,0,1,30},{200016,0,1,30},{200017,0,1,30},{200019,0,1,30},{201000,0,1,50},{201001,0,1,50},{201002,0,1,50},{201003,0,1,50},{201006,0,1,50},{201010,0,1,30},{201011,0,1,30},{201012,0,1,30},{201013,0,1,30},{201015,0,1,30},{201016,0,1,30},{201017,0,1,30},{201019,0,1,30},{202000,0,1,50},{202001,0,1,50},{202002,0,1,50},{202003,0,1,50},{202006,0,1,50},{202010,0,1,30},{202011,0,1,30},{202012,0,1,30},{202013,0,1,30},{202015,0,1,30},{202016,0,1,30},{202017,0,1,30},{202019,0,1,30},{110002,0,1,0},{110003,0,1,0},{110004,0,1,100},{110005,0,1,100},{110010,0,1,10},{110011,0,1,20},{110012,0,1,20},{110009,0,5,100},{110023,0,1,0},{110024,0,1,0},{110025,0,1,0},{110026,0,1,0},
S55: 110030 | T55: 战甲术书 | U55: 1 | V55: 0 | W55: 1 | X55: 0 | Y55: ="{"&RC[-6]&","&RC[-3]&","&RC[-2]&","&RC[-1]&"}," -> {110030,0,1,0}, | Z55: =R[-1]C&RC[-1] -> {200000,0,1,70},{200001,0,1,70},{200002,0,1,70},{200003,0,1,70},{200006,0,1,70},{200010,0,1,20},{200011,0,1,20},{200012,0,1,20},{200013,0,1,20},{200015,0,1,20},{200016,0,1,20},{200017,0,1,20},{200019,0,1,20},{201000,0,1,70},{201001,0,1,70},{201002,0,1,70},{201003,0,1,70},{201006,0,1,70},{201010,0,1,20},{201011,0,1,20},{201012,0,1,20},{201013,0,1,20},{201015,0,1,20},{201016,0,1,20},{201017,0,1,20},{201019,0,1,20},{202000,0,1,70},{202001,0,1,70},{202002,0,1,70},{202003,0,1,70},{202006,0,1,70},{202010,0,1,20},{202011,0,1,20},{202012,0,1,20},{202013,0,1,20},{202015,0,1,20},{202016,0,1,20},{202017,0,1,20},{202019,0,1,20},{110002,0,1,0},{110003,0,1,0},{110004,0,1,100},{110005,0,1,100},{110010,0,1,8},{110011,0,1,15},{110012,0,1,15},{110009,0,3,100},{110023,0,1,0},{110024,0,1,0},{110025,0,1,0},{110026,0,1,0},{110030,0,1,0}, | AB55: 110030 | AC55: 战甲术书 | AD55: 1 | AE55: 0 | AF55: 1 | AG55: 0 | AH55: ="{"&RC[-6]&","&RC[-3]&","&RC[-2]&","&RC[-1]&"}," -> {110030,0,1,0}, | AI55: =R[-1]C&RC[-1] -> {200000,0,1,60},{200001,0,1,60},{200002,0,1,60},{200003,0,1,60},{200006,0,1,60},{200010,0,1,20},{200011,0,1,20},{200012,0,1,20},{200013,0,1,20},{200015,0,1,20},{200016,0,1,20},{200017,0,1,20},{200019,0,1,20},{201000,0,1,60},{201001,0,1,60},{201002,0,1,60},{201003,0,1,60},{201006,0,1,60},{201010,0,1,20},{201011,0,1,20},{201012,0,1,20},{201013,0,1,20},{201015,0,1,20},{201016,0,1,20},{201017,0,1,20},{201019,0,1,20},{202000,0,1,60},{202001,0,1,60},{202002,0,1,60},{202003,0,1,60},{202006,0,1,60},{202010,0,1,20},{202011,0,1,20},{202012,0,1,20},{202013,0,1,20},{202015,0,1,20},{202016,0,1,20},{202017,0,1,20},{202019,0,1,20},{110002,0,1,0},{110003,0,1,0},{110004,0,1,100},{110005,0,1,100},{110010,0,1,10},{110011,0,1,20},{110012,0,1,20},{110009,0,4,100},{110023,0,1,0},{110024,0,1,0},{110025,0,1,0},{110026,0,1,0},{110030,0,1,0}, | AK55: 110030 | AL55: 战甲术书 | AM55: 1 | AN55: 0 | AO55: 1 | AP55: 0 | AQ55: ="{"&RC[-6]&","&RC[-3]&","&RC[-2]&","&RC[-1]&"}," -> {110030,0,1,0}, | AR55: =R[-1]C&RC[-1] -> {200000,0,1,50},{200001,0,1,50},{200002,0,1,50},{200003,0,1,50},{200006,0,1,50},{200010,0,1,30},{200011,0,1,30},{200012,0,1,30},{200013,0,1,30},{200015,0,1,30},{200016,0,1,30},{200017,0,1,30},{200019,0,1,30},{201000,0,1,50},{201001,0,1,50},{201002,0,1,50},{201003,0,1,50},{201006,0,1,50},{201010,0,1,30},{201011,0,1,30},{201012,0,1,30},{201013,0,1,30},{201015,0,1,30},{201016,0,1,30},{201017,0,1,30},{201019,0,1,30},{202000,0,1,50},{202001,0,1,50},{202002,0,1,50},{202003,0,1,50},{202006,0,1,50},{202010,0,1,30},{202011,0,1,30},{202012,0,1,30},{202013,0,1,30},{202015,0,1,30},{202016,0,1,30},{202017,0,1,30},{202019,0,1,30},{110002,0,1,0},{110003,0,1,0},{110004,0,1,100},{110005,0,1,100},{110010,0,1,10},{110011,0,1,20},{110012,0,1,20},{110009,0,5,100},{110023,0,1,0},{110024,0,1,0},{110025,0,1,0},{110026,0,1,0},{110030,0,1,0},
S56: 110031 | T56: 召唤神兽书 | U56: 1 | V56: 0 | W56: 1 | X56: 0 | Y56: ="{"&RC[-6]&","&RC[-3]&","&RC[-2]&","&RC[-1]&"}," -> {110031,0,1,0}, | Z56: =R[-1]C&RC[-1] -> {200000,0,1,70},{200001,0,1,70},{200002,0,1,70},{200003,0,1,70},{200006,0,1,70},{200010,0,1,20},{200011,0,1,20},{200012,0,1,20},{200013,0,1,20},{200015,0,1,20},{200016,0,1,20},{200017,0,1,20},{200019,0,1,20},{201000,0,1,70},{201001,0,1,70},{201002,0,1,70},{201003,0,1,70},{201006,0,1,70},{201010,0,1,20},{201011,0,1,20},{201012,0,1,20},{201013,0,1,20},{201015,0,1,20},{201016,0,1,20},{201017,0,1,20},{201019,0,1,20},{202000,0,1,70},{202001,0,1,70},{202002,0,1,70},{202003,0,1,70},{202006,0,1,70},{202010,0,1,20},{202011,0,1,20},{202012,0,1,20},{202013,0,1,20},{202015,0,1,20},{202016,0,1,20},{202017,0,1,20},{202019,0,1,20},{110002,0,1,0},{110003,0,1,0},{110004,0,1,100},{110005,0,1,100},{110010,0,1,8},{110011,0,1,15},{110012,0,1,15},{110009,0,3,100},{110023,0,1,0},{110024,0,1,0},{110025,0,1,0},{110026,0,1,0},{110030,0,1,0},{110031,0,1,0}, | AB56: 110031 | AC56: 召唤神兽书 | AD56: 1 | AE56: 0 | AF56: 1 | AG56: 0 | AH56: ="{"&RC[-6]&","&RC[-3]&","&RC[-2]&","&RC[-1]&"}," -> {110031,0,1,0}, | AI56: =R[-1]C&RC[-1] -> {200000,0,1,60},{200001,0,1,60},{200002,0,1,60},{200003,0,1,60},{200006,0,1,60},{200010,0,1,20},{200011,0,1,20},{200012,0,1,20},{200013,0,1,20},{200015,0,1,20},{200016,0,1,20},{200017,0,1,20},{200019,0,1,20},{201000,0,1,60},{201001,0,1,60},{201002,0,1,60},{201003,0,1,60},{201006,0,1,60},{201010,0,1,20},{201011,0,1,20},{201012,0,1,20},{201013,0,1,20},{201015,0,1,20},{201016,0,1,20},{201017,0,1,20},{201019,0,1,20},{202000,0,1,60},{202001,0,1,60},{202002,0,1,60},{202003,0,1,60},{202006,0,1,60},{202010,0,1,20},{202011,0,1,20},{202012,0,1,20},{202013,0,1,20},{202015,0,1,20},{202016,0,1,20},{202017,0,1,20},{202019,0,1,20},{110002,0,1,0},{110003,0,1,0},{110004,0,1,100},{110005,0,1,100},{110010,0,1,10},{110011,0,1,20},{110012,0,1,20},{110009,0,4,100},{110023,0,1,0},{110024,0,1,0},{110025,0,1,0},{110026,0,1,0},{110030,0,1,0},{110031,0,1,0}, | AK56: 110031 | AL56: 召唤神兽书 | AM56: 1 | AN56: 0 | AO56: 1 | AP56: 0 | AQ56: ="{"&RC[-6]&","&RC[-3]&","&RC[-2]&","&RC[-1]&"}," -> {110031,0,1,0}, | AR56: =R[-1]C&RC[-1] -> {200000,0,1,50},{200001,0,1,50},{200002,0,1,50},{200003,0,1,50},{200006,0,1,50},{200010,0,1,30},{200011,0,1,30},{200012,0,1,30},{200013,0,1,30},{200015,0,1,30},{200016,0,1,30},{200017,0,1,30},{200019,0,1,30},{201000,0,1,50},{201001,0,1,50},{201002,0,1,50},{201003,0,1,50},{201006,0,1,50},{201010,0,1,30},{201011,0,1,30},{201012,0,1,30},{201013,0,1,30},{201015,0,1,30},{201016,0,1,30},{201017,0,1,30},{201019,0,1,30},{202000,0,1,50},{202001,0,1,50},{202002,0,1,50},{202003,0,1,50},{202006,0,1,50},{202010,0,1,30},{202011,0,1,30},{202012,0,1,30},{202013,0,1,30},{202015,0,1,30},{202016,0,1,30},{202017,0,1,30},{202019,0,1,30},{110002,0,1,0},{110003,0,1,0},{110004,0,1,100},{110005,0,1,100},{110010,0,1,10},{110011,0,1,20},{110012,0,1,20},{110009,0,5,100},{110023,0,1,0},{110024,0,1,0},{110025,0,1,0},{110026,0,1,0},{110030,0,1,0},{110031,0,1,0},
S57: 110032 | T57: 嗜血术书 | U57: 1 | V57: 0 | W57: 1 | X57: 0 | Y57: ="{"&RC[-6]&","&RC[-3]&","&RC[-2]&","&RC[-1]&"}," -> {110032,0,1,0}, | Z57: =R[-1]C&RC[-1] -> {200000,0,1,70},{200001,0,1,70},{200002,0,1,70},{200003,0,1,70},{200006,0,1,70},{200010,0,1,20},{200011,0,1,20},{200012,0,1,20},{200013,0,1,20},{200015,0,1,20},{200016,0,1,20},{200017,0,1,20},{200019,0,1,20},{201000,0,1,70},{201001,0,1,70},{201002,0,1,70},{201003,0,1,70},{201006,0,1,70},{201010,0,1,20},{201011,0,1,20},{201012,0,1,20},{201013,0,1,20},{201015,0,1,20},{201016,0,1,20},{201017,0,1,20},{201019,0,1,20},{202000,0,1,70},{202001,0,1,70},{202002,0,1,70},{202003,0,1,70},{202006,0,1,70},{202010,0,1,20},{202011,0,1,20},{202012,0,1,20},{202013,0,1,20},{202015,0,1,20},{202016,0,1,20},{202017,0,1,20},{202019,0,1,20},{110002,0,1,0},{110003,0,1,0},{110004,0,1,100},{110005,0,1,100},{110010,0,1,8},{110011,0,1,15},{110012,0,1,15},{110009,0,3,100},{110023,0,1,0},{110024,0,1,0},{110025,0,1,0},{110026,0,1,0},{110030,0,1,0},{110031,0,1,0},{110032,0,1,0}, | AB57: 110032 | AC57: 嗜血术书 | AD57: 1 | AE57: 0 | AF57: 1 | AG57: 0 | AH57: ="{"&RC[-6]&","&RC[-3]&","&RC[-2]&","&RC[-1]&"}," -> {110032,0,1,0}, | AI57: =R[-1]C&RC[-1] -> {200000,0,1,60},{200001,0,1,60},{200002,0,1,60},{200003,0,1,60},{200006,0,1,60},{200010,0,1,20},{200011,0,1,20},{200012,0,1,20},{200013,0,1,20},{200015,0,1,20},{200016,0,1,20},{200017,0,1,20},{200019,0,1,20},{201000,0,1,60},{201001,0,1,60},{201002,0,1,60},{201003,0,1,60},{201006,0,1,60},{201010,0,1,20},{201011,0,1,20},{201012,0,1,20},{201013,0,1,20},{201015,0,1,20},{201016,0,1,20},{201017,0,1,20},{201019,0,1,20},{202000,0,1,60},{202001,0,1,60},{202002,0,1,60},{202003,0,1,60},{202006,0,1,60},{202010,0,1,20},{202011,0,1,20},{202012,0,1,20},{202013,0,1,20},{202015,0,1,20},{202016,0,1,20},{202017,0,1,20},{202019,0,1,20},{110002,0,1,0},{110003,0,1,0},{110004,0,1,100},{110005,0,1,100},{110010,0,1,10},{110011,0,1,20},{110012,0,1,20},{110009,0,4,100},{110023,0,1,0},{110024,0,1,0},{110025,0,1,0},{110026,0,1,0},{110030,0,1,0},{110031,0,1,0},{110032,0,1,0}, | AK57: 110032 | AL57: 嗜血术书 | AM57: 1 | AN57: 0 | AO57: 1 | AP57: 0 | AQ57: ="{"&RC[-6]&","&RC[-3]&","&RC[-2]&","&RC[-1]&"}," -> {110032,0,1,0}, | AR57: =R[-1]C&RC[-1] -> {200000,0,1,50},{200001,0,1,50},{200002,0,1,50},{200003,0,1,50},{200006,0,1,50},{200010,0,1,30},{200011,0,1,30},{200012,0,1,30},{200013,0,1,30},{200015,0,1,30},{200016,0,1,30},{200017,0,1,30},{200019,0,1,30},{201000,0,1,50},{201001,0,1,50},{201002,0,1,50},{201003,0,1,50},{201006,0,1,50},{201010,0,1,30},{201011,0,1,30},{201012,0,1,30},{201013,0,1,30},{201015,0,1,30},{201016,0,1,30},{201017,0,1,30},{201019,0,1,30},{202000,0,1,50},{202001,0,1,50},{202002,0,1,50},{202003,0,1,50},{202006,0,1,50},{202010,0,1,30},{202011,0,1,30},{202012,0,1,30},{202013,0,1,30},{202015,0,1,30},{202016,0,1,30},{202017,0,1,30},{202019,0,1,30},{110002,0,1,0},{110003,0,1,0},{110004,0,1,100},{110005,0,1,100},{110010,0,1,10},{110011,0,1,20},{110012,0,1,20},{110009,0,5,100},{110023,0,1,0},{110024,0,1,0},{110025,0,1,0},{110026,0,1,0},{110030,0,1,0},{110031,0,1,0},{110032,0,1,0},
S58: 110033 | T58: 雷电术书 | U58: 1 | V58: 0 | W58: 1 | X58: 0 | Y58: ="{"&RC[-6]&","&RC[-3]&","&RC[-2]&","&RC[-1]&"}," -> {110033,0,1,0}, | Z58: =R[-1]C&RC[-1] -> {200000,0,1,70},{200001,0,1,70},{200002,0,1,70},{200003,0,1,70},{200006,0,1,70},{200010,0,1,20},{200011,0,1,20},{200012,0,1,20},{200013,0,1,20},{200015,0,1,20},{200016,0,1,20},{200017,0,1,20},{200019,0,1,20},{201000,0,1,70},{201001,0,1,70},{201002,0,1,70},{201003,0,1,70},{201006,0,1,70},{201010,0,1,20},{201011,0,1,20},{201012,0,1,20},{201013,0,1,20},{201015,0,1,20},{201016,0,1,20},{201017,0,1,20},{201019,0,1,20},{202000,0,1,70},{202001,0,1,70},{202002,0,1,70},{202003,0,1,70},{202006,0,1,70},{202010,0,1,20},{202011,0,1,20},{202012,0,1,20},{202013,0,1,20},{202015,0,1,20},{202016,0,1,20},{202017,0,1,20},{202019,0,1,20},{110002,0,1,0},{110003,0,1,0},{110004,0,1,100},{110005,0,1,100},{110010,0,1,8},{110011,0,1,15},{110012,0,1,15},{110009,0,3,100},{110023,0,1,0},{110024,0,1,0},{110025,0,1,0},{110026,0,1,0},{110030,0,1,0},{110031,0,1,0},{110032,0,1,0},{110033,0,1,0}, | AB58: 110033 | AC58: 雷电术书 | AD58: 1 | AE58: 0 | AF58: 1 | AG58: 0 | AH58: ="{"&RC[-6]&","&RC[-3]&","&RC[-2]&","&RC[-1]&"}," -> {110033,0,1,0}, | AI58: =R[-1]C&RC[-1] -> {200000,0,1,60},{200001,0,1,60},{200002,0,1,60},{200003,0,1,60},{200006,0,1,60},{200010,0,1,20},{200011,0,1,20},{200012,0,1,20},{200013,0,1,20},{200015,0,1,20},{200016,0,1,20},{200017,0,1,20},{200019,0,1,20},{201000,0,1,60},{201001,0,1,60},{201002,0,1,60},{201003,0,1,60},{201006,0,1,60},{201010,0,1,20},{201011,0,1,20},{201012,0,1,20},{201013,0,1,20},{201015,0,1,20},{201016,0,1,20},{201017,0,1,20},{201019,0,1,20},{202000,0,1,60},{202001,0,1,60},{202002,0,1,60},{202003,0,1,60},{202006,0,1,60},{202010,0,1,20},{202011,0,1,20},{202012,0,1,20},{202013,0,1,20},{202015,0,1,20},{202016,0,1,20},{202017,0,1,20},{202019,0,1,20},{110002,0,1,0},{110003,0,1,0},{110004,0,1,100},{110005,0,1,100},{110010,0,1,10},{110011,0,1,20},{110012,0,1,20},{110009,0,4,100},{110023,0,1,0},{110024,0,1,0},{110025,0,1,0},{110026,0,1,0},{110030,0,1,0},{110031,0,1,0},{110032,0,1,0},{110033,0,1,0}, | AK58: 110033 | AL58: 雷电术书 | AM58: 1 | AN58: 0 | AO58: 1 | AP58: 0 | AQ58: ="{"&RC[-6]&","&RC[-3]&","&RC[-2]&","&RC[-1]&"}," -> {110033,0,1,0}, | AR58: =R[-1]C&RC[-1] -> {200000,0,1,50},{200001,0,1,50},{200002,0,1,50},{200003,0,1,50},{200006,0,1,50},{200010,0,1,30},{200011,0,1,30},{200012,0,1,30},{200013,0,1,30},{200015,0,1,30},{200016,0,1,30},{200017,0,1,30},{200019,0,1,30},{201000,0,1,50},{201001,0,1,50},{201002,0,1,50},{201003,0,1,50},{201006,0,1,50},{201010,0,1,30},{201011,0,1,30},{201012,0,1,30},{201013,0,1,30},{201015,0,1,30},{201016,0,1,30},{201017,0,1,30},{201019,0,1,30},{202000,0,1,50},{202001,0,1,50},{202002,0,1,50},{202003,0,1,50},{202006,0,1,50},{202010,0,1,30},{202011,0,1,30},{202012,0,1,30},{202013,0,1,30},{202015,0,1,30},{202016,0,1,30},{202017,0,1,30},{202019,0,1,30},{110002,0,1,0},{110003,0,1,0},{110004,0,1,100},{110005,0,1,100},{110010,0,1,10},{110011,0,1,20},{110012,0,1,20},{110009,0,5,100},{110023,0,1,0},{110024,0,1,0},{110025,0,1,0},{110026,0,1,0},{110030,0,1,0},{110031,0,1,0},{110032,0,1,0},{110033,0,1,0},
S59: 110038 | T59: 冰咆哮书 | U59: 1 | V59: 0 | W59: 1 | X59: 0 | Y59: ="{"&RC[-6]&","&RC[-3]&","&RC[-2]&","&RC[-1]&"}," -> {110038,0,1,0}, | Z59: =R[-1]C&RC[-1] -> {200000,0,1,70},{200001,0,1,70},{200002,0,1,70},{200003,0,1,70},{200006,0,1,70},{200010,0,1,20},{200011,0,1,20},{200012,0,1,20},{200013,0,1,20},{200015,0,1,20},{200016,0,1,20},{200017,0,1,20},{200019,0,1,20},{201000,0,1,70},{201001,0,1,70},{201002,0,1,70},{201003,0,1,70},{201006,0,1,70},{201010,0,1,20},{201011,0,1,20},{201012,0,1,20},{201013,0,1,20},{201015,0,1,20},{201016,0,1,20},{201017,0,1,20},{201019,0,1,20},{202000,0,1,70},{202001,0,1,70},{202002,0,1,70},{202003,0,1,70},{202006,0,1,70},{202010,0,1,20},{202011,0,1,20},{202012,0,1,20},{202013,0,1,20},{202015,0,1,20},{202016,0,1,20},{202017,0,1,20},{202019,0,1,20},{110002,0,1,0},{110003,0,1,0},{110004,0,1,100},{110005,0,1,100},{110010,0,1,8},{110011,0,1,15},{110012,0,1,15},{110009,0,3,100},{110023,0,1,0},{110024,0,1,0},{110025,0,1,0},{110026,0,1,0},{110030,0,1,0},{110031,0,1,0},{110032,0,1,0},{110033,0,1,0},{110038,0,1,0}, | AB59: 110038 | AC59: 冰咆哮书 | AD59: 1 | AE59: 0 | AF59: 1 | AG59: 0 | AH59: ="{"&RC[-6]&","&RC[-3]&","&RC[-2]&","&RC[-1]&"}," -> {110038,0,1,0}, | AI59: =R[-1]C&RC[-1] -> {200000,0,1,60},{200001,0,1,60},{200002,0,1,60},{200003,0,1,60},{200006,0,1,60},{200010,0,1,20},{200011,0,1,20},{200012,0,1,20},{200013,0,1,20},{200015,0,1,20},{200016,0,1,20},{200017,0,1,20},{200019,0,1,20},{201000,0,1,60},{201001,0,1,60},{201002,0,1,60},{201003,0,1,60},{201006,0,1,60},{201010,0,1,20},{201011,0,1,20},{201012,0,1,20},{201013,0,1,20},{201015,0,1,20},{201016,0,1,20},{201017,0,1,20},{201019,0,1,20},{202000,0,1,60},{202001,0,1,60},{202002,0,1,60},{202003,0,1,60},{202006,0,1,60},{202010,0,1,20},{202011,0,1,20},{202012,0,1,20},{202013,0,1,20},{202015,0,1,20},{202016,0,1,20},{202017,0,1,20},{202019,0,1,20},{110002,0,1,0},{110003,0,1,0},{110004,0,1,100},{110005,0,1,100},{110010,0,1,10},{110011,0,1,20},{110012,0,1,20},{110009,0,4,100},{110023,0,1,0},{110024,0,1,0},{110025,0,1,0},{110026,0,1,0},{110030,0,1,0},{110031,0,1,0},{110032,0,1,0},{110033,0,1,0},{110038,0,1,0}, | AK59: 110038 | AL59: 冰咆哮书 | AM59: 1 | AN59: 0 | AO59: 1 | AP59: 0 | AQ59: ="{"&RC[-6]&","&RC[-3]&","&RC[-2]&","&RC[-1]&"}," -> {110038,0,1,0}, | AR59: =R[-1]C&RC[-1] -> {200000,0,1,50},{200001,0,1,50},{200002,0,1,50},{200003,0,1,50},{200006,0,1,50},{200010,0,1,30},{200011,0,1,30},{200012,0,1,30},{200013,0,1,30},{200015,0,1,30},{200016,0,1,30},{200017,0,1,30},{200019,0,1,30},{201000,0,1,50},{201001,0,1,50},{201002,0,1,50},{201003,0,1,50},{201006,0,1,50},{201010,0,1,30},{201011,0,1,30},{201012,0,1,30},{201013,0,1,30},{201015,0,1,30},{201016,0,1,30},{201017,0,1,30},{201019,0,1,30},{202000,0,1,50},{202001,0,1,50},{202002,0,1,50},{202003,0,1,50},{202006,0,1,50},{202010,0,1,30},{202011,0,1,30},{202012,0,1,30},{202013,0,1,30},{202015,0,1,30},{202016,0,1,30},{202017,0,1,30},{202019,0,1,30},{110002,0,1,0},{110003,0,1,0},{110004,0,1,100},{110005,0,1,100},{110010,0,1,10},{110011,0,1,20},{110012,0,1,20},{110009,0,5,100},{110023,0,1,0},{110024,0,1,0},{110025,0,1,0},{110026,0,1,0},{110030,0,1,0},{110031,0,1,0},{110032,0,1,0},{110033,0,1,0},{110038,0,1,0},
S60: 110039 | T60: 抗拒火环书 | U60: 1 | V60: 0 | W60: 1 | X60: 0 | Y60: ="{"&RC[-6]&","&RC[-3]&","&RC[-2]&","&RC[-1]&"}," -> {110039,0,1,0}, | Z60: =R[-1]C&RC[-1] -> {200000,0,1,70},{200001,0,1,70},{200002,0,1,70},{200003,0,1,70},{200006,0,1,70},{200010,0,1,20},{200011,0,1,20},{200012,0,1,20},{200013,0,1,20},{200015,0,1,20},{200016,0,1,20},{200017,0,1,20},{200019,0,1,20},{201000,0,1,70},{201001,0,1,70},{201002,0,1,70},{201003,0,1,70},{201006,0,1,70},{201010,0,1,20},{201011,0,1,20},{201012,0,1,20},{201013,0,1,20},{201015,0,1,20},{201016,0,1,20},{201017,0,1,20},{201019,0,1,20},{202000,0,1,70},{202001,0,1,70},{202002,0,1,70},{202003,0,1,70},{202006,0,1,70},{202010,0,1,20},{202011,0,1,20},{202012,0,1,20},{202013,0,1,20},{202015,0,1,20},{202016,0,1,20},{202017,0,1,20},{202019,0,1,20},{110002,0,1,0},{110003,0,1,0},{110004,0,1,100},{110005,0,1,100},{110010,0,1,8},{110011,0,1,15},{110012,0,1,15},{110009,0,3,100},{110023,0,1,0},{110024,0,1,0},{110025,0,1,0},{110026,0,1,0},{110030,0,1,0},{110031,0,1,0},{110032,0,1,0},{110033,0,1,0},{110038,0,1,0},{110039,0,1,0}, | AB60: 110039 | AC60: 抗拒火环书 | AD60: 1 | AE60: 0 | AF60: 1 | AG60: 0 | AH60: ="{"&RC[-6]&","&RC[-3]&","&RC[-2]&","&RC[-1]&"}," -> {110039,0,1,0}, | AI60: =R[-1]C&RC[-1] -> {200000,0,1,60},{200001,0,1,60},{200002,0,1,60},{200003,0,1,60},{200006,0,1,60},{200010,0,1,20},{200011,0,1,20},{200012,0,1,20},{200013,0,1,20},{200015,0,1,20},{200016,0,1,20},{200017,0,1,20},{200019,0,1,20},{201000,0,1,60},{201001,0,1,60},{201002,0,1,60},{201003,0,1,60},{201006,0,1,60},{201010,0,1,20},{201011,0,1,20},{201012,0,1,20},{201013,0,1,20},{201015,0,1,20},{201016,0,1,20},{201017,0,1,20},{201019,0,1,20},{202000,0,1,60},{202001,0,1,60},{202002,0,1,60},{202003,0,1,60},{202006,0,1,60},{202010,0,1,20},{202011,0,1,20},{202012,0,1,20},{202013,0,1,20},{202015,0,1,20},{202016,0,1,20},{202017,0,1,20},{202019,0,1,20},{110002,0,1,0},{110003,0,1,0},{110004,0,1,100},{110005,0,1,100},{110010,0,1,10},{110011,0,1,20},{110012,0,1,20},{110009,0,4,100},{110023,0,1,0},{110024,0,1,0},{110025,0,1,0},{110026,0,1,0},{110030,0,1,0},{110031,0,1,0},{110032,0,1,0},{110033,0,1,0},{110038,0,1,0},{110039,0,1,0}, | AK60: 110039 | AL60: 抗拒火环书 | AM60: 1 | AN60: 0 | AO60: 1 | AP60: 0 | AQ60: ="{"&RC[-6]&","&RC[-3]&","&RC[-2]&","&RC[-1]&"}," -> {110039,0,1,0}, | AR60: =R[-1]C&RC[-1] -> {200000,0,1,50},{200001,0,1,50},{200002,0,1,50},{200003,0,1,50},{200006,0,1,50},{200010,0,1,30},{200011,0,1,30},{200012,0,1,30},{200013,0,1,30},{200015,0,1,30},{200016,0,1,30},{200017,0,1,30},{200019,0,1,30},{201000,0,1,50},{201001,0,1,50},{201002,0,1,50},{201003,0,1,50},{201006,0,1,50},{201010,0,1,30},{201011,0,1,30},{201012,0,1,30},{201013,0,1,30},{201015,0,1,30},{201016,0,1,30},{201017,0,1,30},{201019,0,1,30},{202000,0,1,50},{202001,0,1,50},{202002,0,1,50},{202003,0,1,50},{202006,0,1,50},{202010,0,1,30},{202011,0,1,30},{202012,0,1,30},{202013,0,1,30},{202015,0,1,30},{202016,0,1,30},{202017,0,1,30},{202019,0,1,30},{110002,0,1,0},{110003,0,1,0},{110004,0,1,100},{110005,0,1,100},{110010,0,1,10},{110011,0,1,20},{110012,0,1,20},{110009,0,5,100},{110023,0,1,0},{110024,0,1,0},{110025,0,1,0},{110026,0,1,0},{110030,0,1,0},{110031,0,1,0},{110032,0,1,0},{110033,0,1,0},{110038,0,1,0},{110039,0,1,0},
S61: 110040 | T61: 流星火雨书 | U61: 1 | V61: 0 | W61: 1 | X61: 0 | Y61: ="{"&RC[-6]&","&RC[-3]&","&RC[-2]&","&RC[-1]&"}," -> {110040,0,1,0}, | Z61: =R[-1]C&RC[-1] -> {200000,0,1,70},{200001,0,1,70},{200002,0,1,70},{200003,0,1,70},{200006,0,1,70},{200010,0,1,20},{200011,0,1,20},{200012,0,1,20},{200013,0,1,20},{200015,0,1,20},{200016,0,1,20},{200017,0,1,20},{200019,0,1,20},{201000,0,1,70},{201001,0,1,70},{201002,0,1,70},{201003,0,1,70},{201006,0,1,70},{201010,0,1,20},{201011,0,1,20},{201012,0,1,20},{201013,0,1,20},{201015,0,1,20},{201016,0,1,20},{201017,0,1,20},{201019,0,1,20},{202000,0,1,70},{202001,0,1,70},{202002,0,1,70},{202003,0,1,70},{202006,0,1,70},{202010,0,1,20},{202011,0,1,20},{202012,0,1,20},{202013,0,1,20},{202015,0,1,20},{202016,0,1,20},{202017,0,1,20},{202019,0,1,20},{110002,0,1,0},{110003,0,1,0},{110004,0,1,100},{110005,0,1,100},{110010,0,1,8},{110011,0,1,15},{110012,0,1,15},{110009,0,3,100},{110023,0,1,0},{110024,0,1,0},{110025,0,1,0},{110026,0,1,0},{110030,0,1,0},{110031,0,1,0},{110032,0,1,0},{110033,0,1,0},{110038,0,1,0},{110039,0,1,0},{110040,0,1,0}, | AB61: 110040 | AC61: 流星火雨书 | AD61: 1 | AE61: 0 | AF61: 1 | AG61: 0 | AH61: ="{"&RC[-6]&","&RC[-3]&","&RC[-2]&","&RC[-1]&"}," -> {110040,0,1,0}, | AI61: =R[-1]C&RC[-1] -> {200000,0,1,60},{200001,0,1,60},{200002,0,1,60},{200003,0,1,60},{200006,0,1,60},{200010,0,1,20},{200011,0,1,20},{200012,0,1,20},{200013,0,1,20},{200015,0,1,20},{200016,0,1,20},{200017,0,1,20},{200019,0,1,20},{201000,0,1,60},{201001,0,1,60},{201002,0,1,60},{201003,0,1,60},{201006,0,1,60},{201010,0,1,20},{201011,0,1,20},{201012,0,1,20},{201013,0,1,20},{201015,0,1,20},{201016,0,1,20},{201017,0,1,20},{201019,0,1,20},{202000,0,1,60},{202001,0,1,60},{202002,0,1,60},{202003,0,1,60},{202006,0,1,60},{202010,0,1,20},{202011,0,1,20},{202012,0,1,20},{202013,0,1,20},{202015,0,1,20},{202016,0,1,20},{202017,0,1,20},{202019,0,1,20},{110002,0,1,0},{110003,0,1,0},{110004,0,1,100},{110005,0,1,100},{110010,0,1,10},{110011,0,1,20},{110012,0,1,20},{110009,0,4,100},{110023,0,1,0},{110024,0,1,0},{110025,0,1,0},{110026,0,1,0},{110030,0,1,0},{110031,0,1,0},{110032,0,1,0},{110033,0,1,0},{110038,0,1,0},{110039,0,1,0},{110040,0,1,0}, | AK61: 110040 | AL61: 流星火雨书 | AM61: 1 | AN61: 0 | AO61: 1 | AP61: 0 | AQ61: ="{"&RC[-6]&","&RC[-3]&","&RC[-2]&","&RC[-1]&"}," -> {110040,0,1,0}, | AR61: =R[-1]C&RC[-1] -> {200000,0,1,50},{200001,0,1,50},{200002,0,1,50},{200003,0,1,50},{200006,0,1,50},{200010,0,1,30},{200011,0,1,30},{200012,0,1,30},{200013,0,1,30},{200015,0,1,30},{200016,0,1,30},{200017,0,1,30},{200019,0,1,30},{201000,0,1,50},{201001,0,1,50},{201002,0,1,50},{201003,0,1,50},{201006,0,1,50},{201010,0,1,30},{201011,0,1,30},{201012,0,1,30},{201013,0,1,30},{201015,0,1,30},{201016,0,1,30},{201017,0,1,30},{201019,0,1,30},{202000,0,1,50},{202001,0,1,50},{202002,0,1,50},{202003,0,1,50},{202006,0,1,50},{202010,0,1,30},{202011,0,1,30},{202012,0,1,30},{202013,0,1,30},{202015,0,1,30},{202016,0,1,30},{202017,0,1,30},{202019,0,1,30},{110002,0,1,0},{110003,0,1,0},{110004,0,1,100},{110005,0,1,100},{110010,0,1,10},{110011,0,1,20},{110012,0,1,20},{110009,0,5,100},{110023,0,1,0},{110024,0,1,0},{110025,0,1,0},{110026,0,1,0},{110030,0,1,0},{110031,0,1,0},{110032,0,1,0},{110033,0,1,0},{110038,0,1,0},{110039,0,1,0},{110040,0,1,0},
S62: 110067 | T62: 诱惑之光书 | U62: 1 | V62: 0 | W62: 1 | X62: 0 | Y62: ="{"&RC[-6]&","&RC[-3]&","&RC[-2]&","&RC[-1]&"}" -> {110067,0,1,0} | Z62: =R[-1]C&RC[-1] -> {200000,0,1,70},{200001,0,1,70},{200002,0,1,70},{200003,0,1,70},{200006,0,1,70},{200010,0,1,20},{200011,0,1,20},{200012,0,1,20},{200013,0,1,20},{200015,0,1,20},{200016,0,1,20},{200017,0,1,20},{200019,0,1,20},{201000,0,1,70},{201001,0,1,70},{201002,0,1,70},{201003,0,1,70},{201006,0,1,70},{201010,0,1,20},{201011,0,1,20},{201012,0,1,20},{201013,0,1,20},{201015,0,1,20},{201016,0,1,20},{201017,0,1,20},{201019,0,1,20},{202000,0,1,70},{202001,0,1,70},{202002,0,1,70},{202003,0,1,70},{202006,0,1,70},{202010,0,1,20},{202011,0,1,20},{202012,0,1,20},{202013,0,1,20},{202015,0,1,20},{202016,0,1,20},{202017,0,1,20},{202019,0,1,20},{110002,0,1,0},{110003,0,1,0},{110004,0,1,100},{110005,0,1,100},{110010,0,1,8},{110011,0,1,15},{110012,0,1,15},{110009,0,3,100},{110023,0,1,0},{110024,0,1,0},{110025,0,1,0},{110026,0,1,0},{110030,0,1,0},{110031,0,1,0},{110032,0,1,0},{110033,0,1,0},{110038,0,1,0},{110039,0,1,0},{110040,0,1,0},{110067,0,1,0} | AB62: 110067 | AC62: 诱惑之光书 | AD62: 1 | AE62: 0 | AF62: 1 | AG62: 0 | AH62: ="{"&RC[-6]&","&RC[-3]&","&RC[-2]&","&RC[-1]&"}" -> {110067,0,1,0} | AI62: =R[-1]C&RC[-1] -> {200000,0,1,60},{200001,0,1,60},{200002,0,1,60},{200003,0,1,60},{200006,0,1,60},{200010,0,1,20},{200011,0,1,20},{200012,0,1,20},{200013,0,1,20},{200015,0,1,20},{200016,0,1,20},{200017,0,1,20},{200019,0,1,20},{201000,0,1,60},{201001,0,1,60},{201002,0,1,60},{201003,0,1,60},{201006,0,1,60},{201010,0,1,20},{201011,0,1,20},{201012,0,1,20},{201013,0,1,20},{201015,0,1,20},{201016,0,1,20},{201017,0,1,20},{201019,0,1,20},{202000,0,1,60},{202001,0,1,60},{202002,0,1,60},{202003,0,1,60},{202006,0,1,60},{202010,0,1,20},{202011,0,1,20},{202012,0,1,20},{202013,0,1,20},{202015,0,1,20},{202016,0,1,20},{202017,0,1,20},{202019,0,1,20},{110002,0,1,0},{110003,0,1,0},{110004,0,1,100},{110005,0,1,100},{110010,0,1,10},{110011,0,1,20},{110012,0,1,20},{110009,0,4,100},{110023,0,1,0},{110024,0,1,0},{110025,0,1,0},{110026,0,1,0},{110030,0,1,0},{110031,0,1,0},{110032,0,1,0},{110033,0,1,0},{110038,0,1,0},{110039,0,1,0},{110040,0,1,0},{110067,0,1,0} | AK62: 110067 | AL62: 诱惑之光书 | AM62: 1 | AN62: 0 | AO62: 1 | AP62: 0 | AQ62: ="{"&RC[-6]&","&RC[-3]&","&RC[-2]&","&RC[-1]&"}" -> {110067,0,1,0} | AR62: =R[-1]C&RC[-1] -> {200000,0,1,50},{200001,0,1,50},{200002,0,1,50},{200003,0,1,50},{200006,0,1,50},{200010,0,1,30},{200011,0,1,30},{200012,0,1,30},{200013,0,1,30},{200015,0,1,30},{200016,0,1,30},{200017,0,1,30},{200019,0,1,30},{201000,0,1,50},{201001,0,1,50},{201002,0,1,50},{201003,0,1,50},{201006,0,1,50},{201010,0,1,30},{201011,0,1,30},{201012,0,1,30},{201013,0,1,30},{201015,0,1,30},{201016,0,1,30},{201017,0,1,30},{201019,0,1,30},{202000,0,1,50},{202001,0,1,50},{202002,0,1,50},{202003,0,1,50},{202006,0,1,50},{202010,0,1,30},{202011,0,1,30},{202012,0,1,30},{202013,0,1,30},{202015,0,1,30},{202016,0,1,30},{202017,0,1,30},{202019,0,1,30},{110002,0,1,0},{110003,0,1,0},{110004,0,1,100},{110005,0,1,100},{110010,0,1,10},{110011,0,1,20},{110012,0,1,20},{110009,0,5,100},{110023,0,1,0},{110024,0,1,0},{110025,0,1,0},{110026,0,1,0},{110030,0,1,0},{110031,0,1,0},{110032,0,1,0},{110033,0,1,0},{110038,0,1,0},{110039,0,1,0},{110040,0,1,0},{110067,0,1,0}
X64: 掉落数量 | Y64: 概率／100 | AG64: 掉落数量 | AH64: 概率／100 | AP64: 掉落数量 | AQ64: 概率／100
X65: 0 | Y65: =10000-R[1]C -> 9700 | Z65: ="{"&RC[-2]&","&RC[-1]&"}," -> {0,9700}, | AG65: 0 | AH65: =10000-R[1]C -> 9650 | AI65: ="{"&RC[-2]&","&RC[-1]&"}," -> {0,9650}, | AP65: 0 | AQ65: =10000-R[1]C -> 9600 | AR65: ="{"&RC[-2]&","&RC[-1]&"}," -> {0,9600},
T66: BOSS怪掉落 | X66: 1 | Y66: 300 | Z66: ="{"&RC[-2]&","&RC[-1]&"}" -> {1,300} | AC66: BOSS怪掉落 | AG66: 1 | AH66: 350 | AI66: ="{"&RC[-2]&","&RC[-1]&"}" -> {1,350} | AL66: BOSS怪掉落 | AP66: 1 | AQ66: 400 | AR66: ="{"&RC[-2]&","&RC[-1]&"}" -> {1,400}
Z68: ="[{0,["&R[-3]C&R[-2]C&"],["&R[-6]C&"]}]" -> [{0,[{0,9700},{1,300}],[{200000,0,1,70},{200001,0,1,70},{200002,0,1,70},{200003,0,1,70},{200006,0,1,70},{200010,0,1,20},{200011,0,1,20},{200012,0,1,20},{200013,0,1,20},{200015,0,1,20},{200016,0,1,20},{200017,0,1,20},{200019,0,1,20},{201000,0,1,70},{201001,0,1,70},{201002,0,1,70},{201003,0,1,70},{201006,0,1,70},{201010,0,1,20},{201011,0,1,20},{201012,0,1,20},{201013,0,1,20},{201015,0,1,20},{201016,0,1,20},{201017,0,1,20},{201019,0,1,20},{202000,0,1,70},{202001,0,1,70},{202002,0,1,70},{202003,0,1,70},{202006,0,1,70},{202010,0,1,20},{202011,0,1,20},{202012,0,1,20},{202013,0,1,20},{202015,0,1,20},{202016,0,1,20},{202017,0,1,20},{202019,0,1,20},{110002,0,1,0},{110003,0,1,0},{110004,0,1,100},{110005,0,1,100},{110010,0,1,8},{110011,0,1,15},{110012,0,1,15},{110009,0,3,100},{110023,0,1,0},{110024,0,1,0},{110025,0,1,0},{110026,0,1,0},{110030,0,1,0},{110031,0,1,0},{110032,0,1,0},{110033,0,1,0},{110038,0,1,0},{110039,0,1,0},{110040,0,1,0},{110067,0,1,0}]}] | AI68: ="[{0,["&R[-3]C&R[-2]C&"],["&R[-6]C&"]}]" -> [{0,[{0,9650},{1,350}],[{200000,0,1,60},{200001,0,1,60},{200002,0,1,60},{200003,0,1,60},{200006,0,1,60},{200010,0,1,20},{200011,0,1,20},{200012,0,1,20},{200013,0,1,20},{200015,0,1,20},{200016,0,1,20},{200017,0,1,20},{200019,0,1,20},{201000,0,1,60},{201001,0,1,60},{201002,0,1,60},{201003,0,1,60},{201006,0,1,60},{201010,0,1,20},{201011,0,1,20},{201012,0,1,20},{201013,0,1,20},{201015,0,1,20},{201016,0,1,20},{201017,0,1,20},{201019,0,1,20},{202000,0,1,60},{202001,0,1,60},{202002,0,1,60},{202003,0,1,60},{202006,0,1,60},{202010,0,1,20},{202011,0,1,20},{202012,0,1,20},{202013,0,1,20},{202015,0,1,20},{202016,0,1,20},{202017,0,1,20},{202019,0,1,20},{110002,0,1,0},{110003,0,1,0},{110004,0,1,100},{110005,0,1,100},{110010,0,1,10},{110011,0,1,20},{110012,0,1,20},{110009,0,4,100},{110023,0,1,0},{110024,0,1,0},{110025,0,1,0},{110026,0,1,0},{110030,0,1,0},{110031,0,1,0},{110032,0,1,0},{110033,0,1,0},{110038,0,1,0},{110039,0,1,0},{110040,0,1,0},{110067,0,1,0}]}] | AR68: ="[{0,["&R[-3]C&R[-2]C&"],["&R[-6]C&"]}]" -> [{0,[{0,9600},{1,400}],[{200000,0,1,50},{200001,0,1,50},{200002,0,1,50},{200003,0,1,50},{200006,0,1,50},{200010,0,1,30},{200011,0,1,30},{200012,0,1,30},{200013,0,1,30},{200015,0,1,30},{200016,0,1,30},{200017,0,1,30},{200019,0,1,30},{201000,0,1,50},{201001,0,1,50},{201002,0,1,50},{201003,0,1,50},{201006,0,1,50},{201010,0,1,30},{201011,0,1,30},{201012,0,1,30},{201013,0,1,30},{201015,0,1,30},{201016,0,1,30},{201017,0,1,30},{201019,0,1,30},{202000,0,1,50},{202001,0,1,50},{202002,0,1,50},{202003,0,1,50},{202006,0,1,50},{202010,0,1,30},{202011,0,1,30},{202012,0,1,30},{202013,0,1,30},{202015,0,1,30},{202016,0,1,30},{202017,0,1,30},{202019,0,1,30},{110002,0,1,0},{110003,0,1,0},{110004,0,1,100},{110005,0,1,100},{110010,0,1,10},{110011,0,1,20},{110012,0,1,20},{110009,0,5,100},{110023,0,1,0},{110024,0,1,0},{110025,0,1,0},{110026,0,1,0},{110030,0,1,0},{110031,0,1,0},{110032,0,1,0},{110033,0,1,0},{110038,0,1,0},{110039,0,1,0},{110040,0,1,0},{110067,0,1,0}]}]

Sheet: 打宝精英
A1: 打宝精英掉落
A2: 10级怪物（1-10级装备掉落） | J2: 20级怪物（1-20级装备掉落） | S2: 30级怪物（11-30级装备掉落） | AB2: 40级怪物（11-30级装备掉落） | AK2: 50级怪物（11-30级装备掉落）
A3: ID | B3: 名称 | C3: 品质 | D3: 是否绑定 | E3: 数量 | F3: 概率 | J3: ID | K3: 名称 | L3: 品质 | M3: 是否绑定 | N3: 数量 | S3: ID | T3: 名称 | U3: 品质 | V3: 是否绑定 | W3: 数量 | AB3: ID | AC3: 名称 | AD3: 品质 | AE3: 是否绑定 | AF3: 数量 | AK3: ID | AL3: 名称 | AM3: 品质 | AN3: 是否绑定 | AO3: 数量
A4: 200000 | B4: 八荒 | C4: 1 | D4: 0 | E4: 1 | F4: 100 | G4: ="{"&RC[-6]&","&RC[-3]&","&RC[-2]&","&RC[-1]&"}," -> {200000,0,1,100}, | H4: =RC[-1] -> {200000,0,1,100}, | J4: 200000 | K4: 八荒 | L4: 1 | M4: 0 | N4: 1 | O4: 60 | P4: ="{"&RC[-6]&","&RC[-3]&","&RC[-2]&","&RC[-1]&"}," -> {200000,0,1,60}, | Q4: =RC[-1] -> {200000,0,1,60}, | S4: 200000 | T4: 八荒 | U4: 1 | V4: 0 | W4: 1 | X4: 70 | Y4: ="{"&RC[-6]&","&RC[-3]&","&RC[-2]&","&RC[-1]&"}," -> {200000,0,1,70}, | Z4: =RC[-1] -> {200000,0,1,70}, | AB4: 200000 | AC4: 八荒 | AD4: 1 | AE4: 0 | AF4: 1 | AG4: 60 | AH4: ="{"&RC[-6]&","&RC[-3]&","&RC[-2]&","&RC[-1]&"}," -> {200000,0,1,60}, | AI4: =RC[-1] -> {200000,0,1,60}, | AK4: 200000 | AL4: 八荒 | AM4: 1 | AN4: 0 | AO4: 1 | AP4: 50 | AQ4: ="{"&RC[-6]&","&RC[-3]&","&RC[-2]&","&RC[-1]&"}," -> {200000,0,1,50}, | AR4: =RC[-1] -> {200000,0,1,50},
A5: 200001 | B5: 轻盔 | C5: 1 | D5: 0 | E5: 1 | F5: 100 | G5: ="{"&RC[-6]&","&RC[-3]&","&RC[-2]&","&RC[-1]&"}," -> {200001,0,1,100}, | H5: =R[-1]C&RC[-1] -> {200000,0,1,100},{200001,0,1,100}, | J5: 200001 | K5: 轻盔 | L5: 1 | M5: 0 | N5: 1 | O5: 60 | P5: ="{"&RC[-6]&","&RC[-3]&","&RC[-2]&","&RC[-1]&"}," -> {200001,0,1,60}, | Q5: =R[-1]C&RC[-1] -> {200000,0,1,60},{200001,0,1,60}, | S5: 200001 | T5: 轻盔 | U5: 1 | V5: 0 | W5: 1 | X5: 70 | Y5: ="{"&RC[-6]&","&RC[-3]&","&RC[-2]&","&RC[-1]&"}," -> {200001,0,1,70}, | Z5: =R[-1]C&RC[-1] -> {200000,0,1,70},{200001,0,1,70}, | AB5: 200001 | AC5: 轻盔 | AD5: 1 | AE5: 0 | AF5: 1 | AG5: 60 | AH5: ="{"&RC[-6]&","&RC[-3]&","&RC[-2]&","&RC[-1]&"}," -> {200001,0,1,60}, | AI5: =R[-1]C&RC[-1] -> {200000,0,1,60},{200001,0,1,60}, | AK5: 200001 | AL5: 轻盔 | AM5: 1 | AN5: 0 | AO5: 1 | AP5: 50 | AQ5: ="{"&RC[-6]&","&RC[-3]&","&RC[-2]&","&RC[-1]&"}," -> {200001,0,1,50}, | AR5: =R[-1]C&RC[-1] -> {200000,0,1,50},{200001,0,1,50},
A6: 200002 | B6: 珊瑚戒指 | C6: 1 | D6: 0 | E6: 1 | F6: 100 | G6: ="{"&RC[-6]&","&RC[-3]&","&RC[-2]&","&RC[-1]&"}," -> {200002,0,1,100}, | H6: =R[-1]C&RC[-1] -> {200000,0,1,100},{200001,0,1,100},{200002,0,1,100}, | J6: 200002 | K6: 珊瑚戒指 | L6: 1 | M6: 0 | N6: 1 | O6: 60 | P6: ="{"&RC[-6]&","&RC[-3]&","&RC[-2]&","&RC[-1]&"}," -> {200002,0,1,60}, | Q6: =R[-1]C&RC[-1] -> {200000,0,1,60},{200001,0,1,60},{200002,0,1,60}, | S6: 200002 | T6: 珊瑚戒指 | U6: 1 | V6: 0 | W6: 1 | X6: 70 | Y6: ="{"&RC[-6]&","&RC[-3]&","&RC[-2]&","&RC[-1]&"}," -> {200002,0,1,70}, | Z6: =R[-1]C&RC[-1] -> {200000,0,1,70},{200001,0,1,70},{200002,0,1,70}, | AB6: 200002 | AC6: 珊瑚戒指 | AD6: 1 | AE6: 0 | AF6: 1 | AG6: 60 | AH6: ="{"&RC[-6]&","&RC[-3]&","&RC[-2]&","&RC[-1]&"}," -> {200002,0,1,60}, | AI6: =R[-1]C&RC[-1] -> {200000,0,1,60},{200001,0,1,60},{200002,0,1,60}, | AK6: 200002 | AL6: 珊瑚戒指 | AM6: 1 | AN6: 0 | AO6: 1 | AP6: 50 | AQ6: ="{"&RC[-6]&","&RC[-3]&","&RC[-2]&","&RC[-1]&"}," -> {200002,0,1,50}, | AR6: =R[-1]C&RC[-1] -> {200000,0,1,50},{200001,0,1,50},{200002,0,1,50},
A7: 200003 | B7: 魔力手镯 | C7: 1 | D7: 0 | E7: 1 | F7: 100 | G7: ="{"&RC[-6]&","&RC[-3]&","&RC[-2]&","&RC[-1]&"}," -> {200003,0,1,100}, | H7: =R[-1]C&RC[-1] -> {200000,0,1,100},{200001,0,1,100},{200002,0,1,100},{200003,0,1,100}, | J7: 200003 | K7: 魔力手镯 | L7: 1 | M7: 0 | N7: 1 | O7: 60 | P7: ="{"&RC[-6]&","&RC[-3]&","&RC[-2]&","&RC[-1]&"}," -> {200003,0,1,60}, | Q7: =R[-1]C&RC[-1] -> {200000,0,1,60},{200001,0,1,60},{200002,0,1,60},{200003,0,1,60}, | S7: 200003 | T7: 魔力手镯 | U7: 1 | V7: 0 | W7: 1 | X7: 70 | Y7: ="{"&RC[-6]&","&RC[-3]&","&RC[-2]&","&RC[-1]&"}," -> {200003,0,1,70}, | Z7: =R[-1]C&RC[-1] -> {200000,0,1,70},{200001,0,1,70},{200002,0,1,70},{200003,0,1,70}, | AB7: 200003 | AC7: 魔力手镯 | AD7: 1 | AE7: 0 | AF7: 1 | AG7: 60 | AH7: ="{"&RC[-6]&","&RC[-3]&","&RC[-2]&","&RC[-1]&"}," -> {200003,0,1,60}, | AI7: =R[-1]C&RC[-1] -> {200000,0,1,60},{200001,0,1,60},{200002,0,1,60},{200003,0,1,60}, | AK7: 200003 | AL7: 魔力手镯 | AM7: 1 | AN7: 0 | AO7: 1 | AP7: 50 | AQ7: ="{"&RC[-6]&","&RC[-3]&","&RC[-2]&","&RC[-1]&"}," -> {200003,0,1,50}, | AR7: =R[-1]C&RC[-1] -> {200000,0,1,50},{200001,0,1,50},{200002,0,1,50},{200003,0,1,50},
A8: 200006 | B8: 恶魔项链 | C8: 1 | D8: 0 | E8: 1 | F8: 100 | G8: ="{"&RC[-6]&","&RC[-3]&","&RC[-2]&","&RC[-1]&"}," -> {200006,0,1,100}, | H8: =R[-1]C&RC[-1] -> {200000,0,1,100},{200001,0,1,100},{200002,0,1,100},{200003,0,1,100},{200006,0,1,100}, | J8: 200006 | K8: 恶魔项链 | L8: 1 | M8: 0 | N8: 1 | O8: 60 | P8: ="{"&RC[-6]&","&RC[-3]&","&RC[-2]&","&RC[-1]&"}," -> {200006,0,1,60}, | Q8: =R[-1]C&RC[-1] -> {200000,0,1,60},{200001,0,1,60},{200002,0,1,60},{200003,0,1,60},{200006,0,1,60}, | S8: 200006 | T8: 恶魔项链 | U8: 1 | V8: 0 | W8: 1 | X8: 70 | Y8: ="{"&RC[-6]&","&RC[-3]&","&RC[-2]&","&RC[-1]&"}," -> {200006,0,1,70}, | Z8: =R[-1]C&RC[-1] -> {200000,0,1,70},{200001,0,1,70},{200002,0,1,70},{200003,0,1,70},{200006,0,1,70}, | AB8: 200006 | AC8: 恶魔项链 | AD8: 1 | AE8: 0 | AF8: 1 | AG8: 60 | AH8: ="{"&RC[-6]&","&RC[-3]&","&RC[-2]&","&RC[-1]&"}," -> {200006,0,1,60}, | AI8: =R[-1]C&RC[-1] -> {200000,0,1,60},{200001,0,1,60},{200002,0,1,60},{200003,0,1,60},{200006,0,1,60}, | AK8: 200006 | AL8: 恶魔项链 | AM8: 1 | AN8: 0 | AO8: 1 | AP8: 50 | AQ8: ="{"&RC[-6]&","&RC[-3]&","&RC[-2]&","&RC[-1]&"}," -> {200006,0,1,50}, | AR8: =R[-1]C&RC[-1] -> {200000,0,1,50},{200001,0,1,50},{200002,0,1,50},{200003,0,1,50},{200006,0,1,50},
A9: 201000 | B9: 海魂 | C9: 1 | D9: 0 | E9: 1 | F9: 100 | G9: ="{"&RC[-6]&","&RC[-3]&","&RC[-2]&","&RC[-1]&"}," -> {201000,0,1,100}, | H9: =R[-1]C&RC[-1] -> {200000,0,1,100},{200001,0,1,100},{200002,0,1,100},{200003,0,1,100},{200006,0,1,100},{201000,0,1,100}, | J9: 200010 | K9: 炼狱 | L9: 1 | M9: 0 | N9: 1 | O9: 60 | P9: ="{"&RC[-6]&","&RC[-3]&","&RC[-2]&","&RC[-1]&"}," -> {200010,0,1,60}, | Q9: =R[-1]C&RC[-1] -> {200000,0,1,60},{200001,0,1,60},{200002,0,1,60},{200003,0,1,60},{200006,0,1,60},{200010,0,1,60}, | S9: 200010 | T9: 炼狱 | U9: 1 | V9: 0 | W9: 1 | X9: 70 | Y9: ="{"&RC[-6]&","&RC[-3]&","&RC[-2]&","&RC[-1]&"}," -> {200010,0,1,70}, | Z9: =R[-1]C&RC[-1] -> {200000,0,1,70},{200001,0,1,70},{200002,0,1,70},{200003,0,1,70},{200006,0,1,70},{200010,0,1,70}, | AB9: 200010 | AC9: 炼狱 | AD9: 1 | AE9: 0 | AF9: 1 | AG9: 60 | AH9: ="{"&RC[-6]&","&RC[-3]&","&RC[-2]&","&RC[-1]&"}," -> {200010,0,1,60}, | AI9: =R[-1]C&RC[-1] -> {200000,0,1,60},{200001,0,1,60},{200002,0,1,60},{200003,0,1,60},{200006,0,1,60},{200010,0,1,60}, | AK9: 200010 | AL9: 炼狱 | AM9: 1 | AN9: 0 | AO9: 1 | AP9: 50 | AQ9: ="{"&RC[-6]&","&RC[-3]&","&RC[-2]&","&RC[-1]&"}," -> {200010,0,1,50}, | AR9: =R[-1]C&RC[-1] -> {200000,0,1,50},{200001,0,1,50},{200002,0,1,50},{200003,0,1,50},{200006,0,1,50},{200010,0,1,50},
A10: 201001 | B10: 轻盔 | C10: 1 | D10: 0 | E10: 1 | F10: 100 | G10: ="{"&RC[-6]&","&RC[-3]&","&RC[-2]&","&RC[-1]&"}," -> {201001,0,1,100}, | H10: =R[-1]C&RC[-1] -> {200000,0,1,100},{200001,0,1,100},{200002,0,1,100},{200003,0,1,100},{200006,0,1,100},{201000,0,1,100},{201001,0,1,100}, | J10: 200011 | K10: 绿色项链 | L10: 1 | M10: 0 | N10: 1 | O10: 60 | P10: ="{"&RC[-6]&","&RC[-3]&","&RC[-2]&","&RC[-1]&"}," -> {200011,0,1,60}, | Q10: =R[-1]C&RC[-1] -> {200000,0,1,60},{200001,0,1,60},{200002,0,1,60},{200003,0,1,60},{200006,0,1,60},{200010,0,1,60},{200011,0,1,60}, | S10: 200011 | T10: 绿色项链 | U10: 1 | V10: 0 | W10: 1 | X10: 70 | Y10: ="{"&RC[-6]&","&RC[-3]&","&RC[-2]&","&RC[-1]&"}," -> {200011,0,1,70}, | Z10: =R[-1]C&RC[-1] -> {200000,0,1,70},{200001,0,1,70},{200002,0,1,70},{200003,0,1,70},{200006,0,1,70},{200010,0,1,70},{200011,0,1,70}, | AB10: 200011 | AC10: 绿色项链 | AD10: 1 | AE10: 0 | AF10: 1 | AG10: 60 | AH10: ="{"&RC[-6]&","&RC[-3]&","&RC[-2]&","&RC[-1]&"}," -> {200011,0,1,60}, | AI10: =R[-1]C&RC[-1] -> {200000,0,1,60},{200001,0,1,60},{200002,0,1,60},{200003,0,1,60},{200006,0,1,60},{200010,0,1,60},{200011,0,1,60}, | AK10: 200011 | AL10: 绿色项链 | AM10: 1 | AN10: 0 | AO10: 1 | AP10: 50 | AQ10: ="{"&RC[-6]&","&RC[-3]&","&RC[-2]&","&RC[-1]&"}," -> {200011,0,1,50}, | AR10: =R[-1]C&RC[-1] -> {200000,0,1,50},{200001,0,1,50},{200002,0,1,50},{200003,0,1,50},{200006,0,1,50},{200010,0,1,50},{200011,0,1,50},
A11: 201002 | B11: 金戒指 | C11: 1 | D11: 0 | E11: 1 | F11: 100 | G11: ="{"&RC[-6]&","&RC[-3]&","&RC[-2]&","&RC[-1]&"}," -> {201002,0,1,100}, | H11: =R[-1]C&RC[-1] -> {200000,0,1,100},{200001,0,1,100},{200002,0,1,100},{200003,0,1,100},{200006,0,1,100},{201000,0,1,100},{201001,0,1,100},{201002,0,1,100}, | J11: 200012 | K11: 战神盔甲 | L11: 1 | M11: 0 | N11: 1 | O11: 60 | P11: ="{"&RC[-6]&","&RC[-3]&","&RC[-2]&","&RC[-1]&"}," -> {200012,0,1,60}, | Q11: =R[-1]C&RC[-1] -> {200000,0,1,60},{200001,0,1,60},{200002,0,1,60},{200003,0,1,60},{200006,0,1,60},{200010,0,1,60},{200011,0,1,60},{200012,0,1,60}, | S11: 200012 | T11: 战神盔甲 | U11: 1 | V11: 0 | W11: 1 | X11: 70 | Y11: ="{"&RC[-6]&","&RC[-3]&","&RC[-2]&","&RC[-1]&"}," -> {200012,0,1,70}, | Z11: =R[-1]C&RC[-1] -> {200000,0,1,70},{200001,0,1,70},{200002,0,1,70},{200003,0,1,70},{200006,0,1,70},{200010,0,1,70},{200011,0,1,70},{200012,0,1,70}, | AB11: 200012 | AC11: 战神盔甲 | AD11: 1 | AE11: 0 | AF11: 1 | AG11: 60 | AH11: ="{"&RC[-6]&","&RC[-3]&","&RC[-2]&","&RC[-1]&"}," -> {200012,0,1,60}, | AI11: =R[-1]C&RC[-1] -> {200000,0,1,60},{200001,0,1,60},{200002,0,1,60},{200003,0,1,60},{200006,0,1,60},{200010,0,1,60},{200011,0,1,60},{200012,0,1,60}, | AK11: 200012 | AL11: 战神盔甲 | AM11: 1 | AN11: 0 | AO11: 1 | AP11: 50 | AQ11: ="{"&RC[-6]&","&RC[-3]&","&RC[-2]&","&RC[-1]&"}," -> {200012,0,1,50}, | AR11: =R[-1]C&RC[-1] -> {200000,0,1,50},{200001,0,1,50},{200002,0,1,50},{200003,0,1,50},{200006,0,1,50},{200010,0,1,50},{200011,0,1,50},{200012,0,1,50},
A12: 201003 | B12: 魔法手镯 | C12: 1 | D12: 0 | E12: 1 | F12: 100 | G12: ="{"&RC[-6]&","&RC[-3]&","&RC[-2]&","&RC[-1]&"}," -> {201003,0,1,100}, | H12: =R[-1]C&RC[-1] -> {200000,0,1,100},{200001,0,1,100},{200002,0,1,100},{200003,0,1,100},{200006,0,1,100},{201000,0,1,100},{201001,0,1,100},{201002,0,1,100},{201003,0,1,100}, | J12: 201000 | K12: 海魂 | L12: 1 | M12: 0 | N12: 1 | O12: 60 | P12: ="{"&RC[-6]&","&RC[-3]&","&RC[-2]&","&RC[-1]&"}," -> {201000,0,1,60}, | Q12: =R[-1]C&RC[-1] -> {200000,0,1,60},{200001,0,1,60},{200002,0,1,60},{200003,0,1,60},{200006,0,1,60},{200010,0,1,60},{200011,0,1,60},{200012,0,1,60},{201000,0,1,60}, | S12: 200013 | T12: 力量戒指 | U12: 1 | V12: 0 | W12: 1 | X12: 70 | Y12: ="{"&RC[-6]&","&RC[-3]&","&RC[-2]&","&RC[-1]&"}," -> {200013,0,1,70}, | Z12: =R[-1]C&RC[-1] -> {200000,0,1,70},{200001,0,1,70},{200002,0,1,70},{200003,0,1,70},{200006,0,1,70},{200010,0,1,70},{200011,0,1,70},{200012,0,1,70},{200013,0,1,70}, | AB12: 200013 | AC12: 力量戒指 | AD12: 1 | AE12: 0 | AF12: 1 | AG12: 60 | AH12: ="{"&RC[-6]&","&RC[-3]&","&RC[-2]&","&RC[-1]&"}," -> {200013,0,1,60}, | AI12: =R[-1]C&RC[-1] -> {200000,0,1,60},{200001,0,1,60},{200002,0,1,60},{200003,0,1,60},{200006,0,1,60},{200010,0,1,60},{200011,0,1,60},{200012,0,1,60},{200013,0,1,60}, | AK12: 200013 | AL12: 力量戒指 | AM12: 1 | AN12: 0 | AO12: 1 | AP12: 50 | AQ12: ="{"&RC[-6]&","&RC[-3]&","&RC[-2]&","&RC[-1]&"}," -> {200013,0,1,50}, | AR12: =R[-1]C&RC[-1] -> {200000,0,1,50},{200001,0,1,50},{200002,0,1,50},{200003,0,1,50},{200006,0,1,50},{200010,0,1,50},{200011,0,1,50},{200012,0,1,50},{200013,0,1,50},
A13: 201006 | B13: 放大镜 | C13: 1 | D13: 0 | E13: 1 | F13: 100 | G13: ="{"&RC[-6]&","&RC[-3]&","&RC[-2]&","&RC[-1]&"}," -> {201006,0,1,100}, | H13: =R[-1]C&RC[-1] -> {200000,0,1,100},{200001,0,1,100},{200002,0,1,100},{200003,0,1,100},{200006,0,1,100},{201000,0,1,100},{201001,0,1,100},{201002,0,1,100},{201003,0,1,100},{201006,0,1,100}, | J13: 201001 | K13: 轻盔 | L13: 1 | M13: 0 | N13: 1 | O13: 60 | P13: ="{"&RC[-6]&","&RC[-3]&","&RC[-2]&","&RC[-1]&"}," -> {201001,0,1,60}, | Q13: =R[-1]C&RC[-1] -> {200000,0,1,60},{200001,0,1,60},{200002,0,1,60},{200003,0,1,60},{200006,0,1,60},{200010,0,1,60},{200011,0,1,60},{200012,0,1,60},{201000,0,1,60},{201001,0,1,60}, | S13: 200015 | T13: 战士头盔 | U13: 1 | V13: 0 | W13: 1 | X13: 70 | Y13: ="{"&RC[-6]&","&RC[-3]&","&RC[-2]&","&RC[-1]&"}," -> {200015,0,1,70}, | Z13: =R[-1]C&RC[-1] -> {200000,0,1,70},{200001,0,1,70},{200002,0,1,70},{200003,0,1,70},{200006,0,1,70},{200010,0,1,70},{200011,0,1,70},{200012,0,1,70},{200013,0,1,70},{200015,0,1,70}, | AB13: 200015 | AC13: 战士头盔 | AD13: 1 | AE13: 0 | AF13: 1 | AG13: 60 | AH13: ="{"&RC[-6]&","&RC[-3]&","&RC[-2]&","&RC[-1]&"}," -> {200015,0,1,60}, | AI13: =R[-1]C&RC[-1] -> {200000,0,1,60},{200001,0,1,60},{200002,0,1,60},{200003,0,1,60},{200006,0,1,60},{200010,0,1,60},{200011,0,1,60},{200012,0,1,60},{200013,0,1,60},{200015,0,1,60}, | AK13: 200015 | AL13: 战士头盔 | AM13: 1 | AN13: 0 | AO13: 1 | AP13: 50 | AQ13: ="{"&RC[-6]&","&RC[-3]&","&RC[-2]&","&RC[-1]&"}," -> {200015,0,1,50}, | AR13: =R[-1]C&RC[-1] -> {200000,0,1,50},{200001,0,1,50},{200002,0,1,50},{200003,0,1,50},{200006,0,1,50},{200010,0,1,50},{200011,0,1,50},{200012,0,1,50},{200013,0,1,50},{200015,0,1,50},
A14: 202000 | B14: 半月 | C14: 1 | D14: 0 | E14: 1 | F14: 100 | G14: ="{"&RC[-6]&","&RC[-3]&","&RC[-2]&","&RC[-1]&"}," -> {202000,0,1,100}, | H14: =R[-1]C&RC[-1] -> {200000,0,1,100},{200001,0,1,100},{200002,0,1,100},{200003,0,1,100},{200006,0,1,100},{201000,0,1,100},{201001,0,1,100},{201002,0,1,100},{201003,0,1,100},{201006,0,1,100},{202000,0,1,100}, | J14: 201002 | K14: 金戒指 | L14: 1 | M14: 0 | N14: 1 | O14: 60 | P14: ="{"&RC[-6]&","&RC[-3]&","&RC[-2]&","&RC[-1]&"}," -> {201002,0,1,60}, | Q14: =R[-1]C&RC[-1] -> {200000,0,1,60},{200001,0,1,60},{200002,0,1,60},{200003,0,1,60},{200006,0,1,60},{200010,0,1,60},{200011,0,1,60},{200012,0,1,60},{201000,0,1,60},{201001,0,1,60},{201002,0,1,60}, | S14: 200016 | T14: 阎罗手镯 | U14: 1 | V14: 0 | W14: 1 | X14: 70 | Y14: ="{"&RC[-6]&","&RC[-3]&","&RC[-2]&","&RC[-1]&"}," -> {200016,0,1,70}, | Z14: =R[-1]C&RC[-1] -> {200000,0,1,70},{200001,0,1,70},{200002,0,1,70},{200003,0,1,70},{200006,0,1,70},{200010,0,1,70},{200011,0,1,70},{200012,0,1,70},{200013,0,1,70},{200015,0,1,70},{200016,0,1,70}, | AB14: 200016 | AC14: 阎罗手镯 | AD14: 1 | AE14: 0 | AF14: 1 | AG14: 60 | AH14: ="{"&RC[-6]&","&RC[-3]&","&RC[-2]&","&RC[-1]&"}," -> {200016,0,1,60}, | AI14: =R[-1]C&RC[-1] -> {200000,0,1,60},{200001,0,1,60},{200002,0,1,60},{200003,0,1,60},{200006,0,1,60},{200010,0,1,60},{200011,0,1,60},{200012,0,1,60},{200013,0,1,60},{200015,0,1,60},{200016,0,1,60}, | AK14: 200016 | AL14: 阎罗手镯 | AM14: 1 | AN14: 0 | AO14: 1 | AP14: 50 | AQ14: ="{"&RC[-6]&","&RC[-3]&","&RC[-2]&","&RC[-1]&"}," -> {200016,0,1,50}, | AR14: =R[-1]C&RC[-1] -> {200000,0,1,50},{200001,0,1,50},{200002,0,1,50},{200003,0,1,50},{200006,0,1,50},{200010,0,1,50},{200011,0,1,50},{200012,0,1,50},{200013,0,1,50},{200015,0,1,50},{200016,0,1,50},
A15: 202001 | B15: 轻盔 | C15: 1 | D15: 0 | E15: 1 | F15: 100 | G15: ="{"&RC[-6]&","&RC[-3]&","&RC[-2]&","&RC[-1]&"}," -> {202001,0,1,100}, | H15: =R[-1]C&RC[-1] -> {200000,0,1,100},{200001,0,1,100},{200002,0,1,100},{200003,0,1,100},{200006,0,1,100},{201000,0,1,100},{201001,0,1,100},{201002,0,1,100},{201003,0,1,100},{201006,0,1,100},{202000,0,1,100},{202001,0,1,100}, | J15: 201003 | K15: 魔法手镯 | L15: 1 | M15: 0 | N15: 1 | O15: 60 | P15: ="{"&RC[-6]&","&RC[-3]&","&RC[-2]&","&RC[-1]&"}," -> {201003,0,1,60}, | Q15: =R[-1]C&RC[-1] -> {200000,0,1,60},{200001,0,1,60},{200002,0,1,60},{200003,0,1,60},{200006,0,1,60},{200010,0,1,60},{200011,0,1,60},{200012,0,1,60},{201000,0,1,60},{201001,0,1,60},{201002,0,1,60},{201003,0,1,60}, | S15: 200017 | T15: 战士腰带 | U15: 1 | V15: 0 | W15: 1 | X15: 70 | Y15: ="{"&RC[-6]&","&RC[-3]&","&RC[-2]&","&RC[-1]&"}," -> {200017,0,1,70}, | Z15: =R[-1]C&RC[-1] -> {200000,0,1,70},{200001,0,1,70},{200002,0,1,70},{200003,0,1,70},{200006,0,1,70},{200010,0,1,70},{200011,0,1,70},{200012,0,1,70},{200013,0,1,70},{200015,0,1,70},{200016,0,1,70},{200017,0,1,70}, | AB15: 200017 | AC15: 战士腰带 | AD15: 1 | AE15: 0 | AF15: 1 | AG15: 60 | AH15: ="{"&RC[-6]&","&RC[-3]&","&RC[-2]&","&RC[-1]&"}," -> {200017,0,1,60}, | AI15: =R[-1]C&RC[-1] -> {200000,0,1,60},{200001,0,1,60},{200002,0,1,60},{200003,0,1,60},{200006,0,1,60},{200010,0,1,60},{200011,0,1,60},{200012,0,1,60},{200013,0,1,60},{200015,0,1,60},{200016,0,1,60},{200017,0,1,60}, | AK15: 200017 | AL15: 战士腰带 | AM15: 1 | AN15: 0 | AO15: 1 | AP15: 50 | AQ15: ="{"&RC[-6]&","&RC[-3]&","&RC[-2]&","&RC[-1]&"}," -> {200017,0,1,50}, | AR15: =R[-1]C&RC[-1] -> {200000,0,1,50},{200001,0,1,50},{200002,0,1,50},{200003,0,1,50},{200006,0,1,50},{200010,0,1,50},{200011,0,1,50},{200012,0,1,50},{200013,0,1,50},{200015,0,1,50},{200016,0,1,50},{200017,0,1,50},
A16: 202002 | B16: 铂金戒指 | C16: 1 | D16: 0 | E16: 1 | F16: 100 | G16: ="{"&RC[-6]&","&RC[-3]&","&RC[-2]&","&RC[-1]&"}," -> {202002,0,1,100}, | H16: =R[-1]C&RC[-1] -> {200000,0,1,100},{200001,0,1,100},{200002,0,1,100},{200003,0,1,100},{200006,0,1,100},{201000,0,1,100},{201001,0,1,100},{201002,0,1,100},{201003,0,1,100},{201006,0,1,100},{202000,0,1,100},{202001,0,1,100},{202002,0,1,100}, | J16: 201006 | K16: 放大镜 | L16: 1 | M16: 0 | N16: 1 | O16: 60 | P16: ="{"&RC[-6]&","&RC[-3]&","&RC[-2]&","&RC[-1]&"}," -> {201006,0,1,60}, | Q16: =R[-1]C&RC[-1] -> {200000,0,1,60},{200001,0,1,60},{200002,0,1,60},{200003,0,1,60},{200006,0,1,60},{200010,0,1,60},{200011,0,1,60},{200012,0,1,60},{201000,0,1,60},{201001,0,1,60},{201002,0,1,60},{201003,0,1,60},{201006,0,1,60}, | S16: 200019 | T16: 战士鞋子 | U16: 1 | V16: 0 | W16: 1 | X16: 70 | Y16: ="{"&RC[-6]&","&RC[-3]&","&RC[-2]&","&RC[-1]&"}," -> {200019,0,1,70}, | Z16: =R[-1]C&RC[-1] -> {200000,0,1,70},{200001,0,1,70},{200002,0,1,70},{200003,0,1,70},{200006,0,1,70},{200010,0,1,70},{200011,0,1,70},{200012,0,1,70},{200013,0,1,70},{200015,0,1,70},{200016,0,1,70},{200017,0,1,70},{200019,0,1,70}, | AB16: 200019 | AC16: 战士鞋子 | AD16: 1 | AE16: 0 | AF16: 1 | AG16: 60 | AH16: ="{"&RC[-6]&","&RC[-3]&","&RC[-2]&","&RC[-1]&"}," -> {200019,0,1,60}, | AI16: =R[-1]C&RC[-1] -> {200000,0,1,60},{200001,0,1,60},{200002,0,1,60},{200003,0,1,60},{200006,0,1,60},{200010,0,1,60},{200011,0,1,60},{200012,0,1,60},{200013,0,1,60},{200015,0,1,60},{200016,0,1,60},{200017,0,1,60},{200019,0,1,60}, | AK16: 200019 | AL16: 战士鞋子 | AM16: 1 | AN16: 0 | AO16: 1 | AP16: 50 | AQ16: ="{"&RC[-6]&","&RC[-3]&","&RC[-2]&","&RC[-1]&"}," -> {200019,0,1,50}, | AR16: =R[-1]C&RC[-1] -> {200000,0,1,50},{200001,0,1,50},{200002,0,1,50},{200003,0,1,50},{200006,0,1,50},{200010,0,1,50},{200011,0,1,50},{200012,0,1,50},{200013,0,1,50},{200015,0,1,50},{200016,0,1,50},{200017,0,1,50},{200019,0,1,50},
A17: 202003 | B17: 三眼手镯 | C17: 1 | D17: 0 | E17: 1 | F17: 100 | G17: ="{"&RC[-6]&","&RC[-3]&","&RC[-2]&","&RC[-1]&"}," -> {202003,0,1,100}, | H17: =R[-1]C&RC[-1] -> {200000,0,1,100},{200001,0,1,100},{200002,0,1,100},{200003,0,1,100},{200006,0,1,100},{201000,0,1,100},{201001,0,1,100},{201002,0,1,100},{201003,0,1,100},{201006,0,1,100},{202000,0,1,100},{202001,0,1,100},{202002,0,1,100},{202003,0,1,100}, | J17: 201010 | K17: 魔杖 | L17: 1 | M17: 0 | N17: 1 | O17: 60 | P17: ="{"&RC[-6]&","&RC[-3]&","&RC[-2]&","&RC[-1]&"}," -> {201010,0,1,60}, | Q17: =R[-1]C&RC[-1] -> {200000,0,1,60},{200001,0,1,60},{200002,0,1,60},{200003,0,1,60},{200006,0,1,60},{200010,0,1,60},{200011,0,1,60},{200012,0,1,60},{201000,0,1,60},{201001,0,1,60},{201002,0,1,60},{201003,0,1,60},{201006,0,1,60},{201010,0,1,60}, | S17: 201000 | T17: 海魂 | U17: 1 | V17: 0 | W17: 1 | X17: 70 | Y17: ="{"&RC[-6]&","&RC[-3]&","&RC[-2]&","&RC[-1]&"}," -> {201000,0,1,70}, | Z17: =R[-1]C&RC[-1] -> {200000,0,1,70},{200001,0,1,70},{200002,0,1,70},{200003,0,1,70},{200006,0,1,70},{200010,0,1,70},{200011,0,1,70},{200012,0,1,70},{200013,0,1,70},{200015,0,1,70},{200016,0,1,70},{200017,0,1,70},{200019,0,1,70},{201000,0,1,70}, | AB17: 201000 | AC17: 海魂 | AD17: 1 | AE17: 0 | AF17: 1 | AG17: 60 | AH17: ="{"&RC[-6]&","&RC[-3]&","&RC[-2]&","&RC[-1]&"}," -> {201000,0,1,60}, | AI17: =R[-1]C&RC[-1] -> {200000,0,1,60},{200001,0,1,60},{200002,0,1,60},{200003,0,1,60},{200006,0,1,60},{200010,0,1,60},{200011,0,1,60},{200012,0,1,60},{200013,0,1,60},{200015,0,1,60},{200016,0,1,60},{200017,0,1,60},{200019,0,1,60},{201000,0,1,60}, | AK17: 201000 | AL17: 海魂 | AM17: 1 | AN17: 0 | AO17: 1 | AP17: 50 | AQ17: ="{"&RC[-6]&","&RC[-3]&","&RC[-2]&","&RC[-1]&"}," -> {201000,0,1,50}, | AR17: =R[-1]C&RC[-1] -> {200000,0,1,50},{200001,0,1,50},{200002,0,1,50},{200003,0,1,50},{200006,0,1,50},{200010,0,1,50},{200011,0,1,50},{200012,0,1,50},{200013,0,1,50},{200015,0,1,50},{200016,0,1,50},{200017,0,1,50},{200019,0,1,50},{201000,0,1,50},
A18: 202006 | B18: 凤凰明珠 | C18: 1 | D18: 0 | E18: 1 | F18: 100 | G18: ="{"&RC[-6]&","&RC[-3]&","&RC[-2]&","&RC[-1]&"}," -> {202006,0,1,100}, | H18: =R[-1]C&RC[-1] -> {200000,0,1,100},{200001,0,1,100},{200002,0,1,100},{200003,0,1,100},{200006,0,1,100},{201000,0,1,100},{201001,0,1,100},{201002,0,1,100},{201003,0,1,100},{201006,0,1,100},{202000,0,1,100},{202001,0,1,100},{202002,0,1,100},{202003,0,1,100},{202006,0,1,100}, | J18: 201011 | K18: 恶魔铃铛 | L18: 1 | M18: 0 | N18: 1 | O18: 60 | P18: ="{"&RC[-6]&","&RC[-3]&","&RC[-2]&","&RC[-1]&"}," -> {201011,0,1,60}, | Q18: =R[-1]C&RC[-1] -> {200000,0,1,60},{200001,0,1,60},{200002,0,1,60},{200003,0,1,60},{200006,0,1,60},{200010,0,1,60},{200011,0,1,60},{200012,0,1,60},{201000,0,1,60},{201001,0,1,60},{201002,0,1,60},{201003,0,1,60},{201006,0,1,60},{201010,0,1,60},{201011,0,1,60}, | S18: 201001 | T18: 轻盔 | U18: 1 | V18: 0 | W18: 1 | X18: 70 | Y18: ="{"&RC[-6]&","&RC[-3]&","&RC[-2]&","&RC[-1]&"}," -> {201001,0,1,70}, | Z18: =R[-1]C&RC[-1] -> {200000,0,1,70},{200001,0,1,70},{200002,0,1,70},{200003,0,1,70},{200006,0,1,70},{200010,0,1,70},{200011,0,1,70},{200012,0,1,70},{200013,0,1,70},{200015,0,1,70},{200016,0,1,70},{200017,0,1,70},{200019,0,1,70},{201000,0,1,70},{201001,0,1,70}, | AB18: 201001 | AC18: 轻盔 | AD18: 1 | AE18: 0 | AF18: 1 | AG18: 60 | AH18: ="{"&RC[-6]&","&RC[-3]&","&RC[-2]&","&RC[-1]&"}," -> {201001,0,1,60}, | AI18: =R[-1]C&RC[-1] -> {200000,0,1,60},{200001,0,1,60},{200002,0,1,60},{200003,0,1,60},{200006,0,1,60},{200010,0,1,60},{200011,0,1,60},{200012,0,1,60},{200013,0,1,60},{200015,0,1,60},{200016,0,1,60},{200017,0,1,60},{200019,0,1,60},{201000,0,1,60},{201001,0,1,60}, | AK18: 201001 | AL18: 轻盔 | AM18: 1 | AN18: 0 | AO18: 1 | AP18: 50 | AQ18: ="{"&RC[-6]&","&RC[-3]&","&RC[-2]&","&RC[-1]&"}," -> {201001,0,1,50}, | AR18: =R[-1]C&RC[-1] -> {200000,0,1,50},{200001,0,1,50},{200002,0,1,50},{200003,0,1,50},{200006,0,1,50},{200010,0,1,50},{200011,0,1,50},{200012,0,1,50},{200013,0,1,50},{200015,0,1,50},{200016,0,1,50},{200017,0,1,50},{200019,0,1,50},{201000,0,1,50},{201001,0,1,50},
A19: 110002 | B19: 强化石 | D19: 0 | E19: 1 | F19: 0 | G19: ="{"&RC[-6]&","&RC[-3]&","&RC[-2]&","&RC[-1]&"}," -> {110002,0,1,0}, | H19: =R[-1]C&RC[-1] -> {200000,0,1,100},{200001,0,1,100},{200002,0,1,100},{200003,0,1,100},{200006,0,1,100},{201000,0,1,100},{201001,0,1,100},{201002,0,1,100},{201003,0,1,100},{201006,0,1,100},{202000,0,1,100},{202001,0,1,100},{202002,0,1,100},{202003,0,1,100},{202006,0,1,100},{110002,0,1,0}, | J19: 201012 | K19: 恶魔长袍 | L19: 1 | M19: 0 | N19: 1 | O19: 60 | P19: ="{"&RC[-6]&","&RC[-3]&","&RC[-2]&","&RC[-1]&"}," -> {201012,0,1,60}, | Q19: =R[-1]C&RC[-1] -> {200000,0,1,60},{200001,0,1,60},{200002,0,1,60},{200003,0,1,60},{200006,0,1,60},{200010,0,1,60},{200011,0,1,60},{200012,0,1,60},{201000,0,1,60},{201001,0,1,60},{201002,0,1,60},{201003,0,1,60},{201006,0,1,60},{201010,0,1,60},{201011,0,1,60},{201012,0,1,60}, | S19: 201002 | T19: 金戒指 | U19: 1 | V19: 0 | W19: 1 | X19: 70 | Y19: ="{"&RC[-6]&","&RC[-3]&","&RC[-2]&","&RC[-1]&"}," -> {201002,0,1,70}, | Z19: =R[-1]C&RC[-1] -> {200000,0,1,70},{200001,0,1,70},{200002,0,1,70},{200003,0,1,70},{200006,0,1,70},{200010,0,1,70},{200011,0,1,70},{200012,0,1,70},{200013,0,1,70},{200015,0,1,70},{200016,0,1,70},{200017,0,1,70},{200019,0,1,70},{201000,0,1,70},{201001,0,1,70},{201002,0,1,70}, | AB19: 201002 | AC19: 金戒指 | AD19: 1 | AE19: 0 | AF19: 1 | AG19: 60 | AH19: ="{"&RC[-6]&","&RC[-3]&","&RC[-2]&","&RC[-1]&"}," -> {201002,0,1,60}, | AI19: =R[-1]C&RC[-1] -> {200000,0,1,60},{200001,0,1,60},{200002,0,1,60},{200003,0,1,60},{200006,0,1,60},{200010,0,1,60},{200011,0,1,60},{200012,0,1,60},{200013,0,1,60},{200015,0,1,60},{200016,0,1,60},{200017,0,1,60},{200019,0,1,60},{201000,0,1,60},{201001,0,1,60},{201002,0,1,60}, | AK19: 201002 | AL19: 金戒指 | AM19: 1 | AN19: 0 | AO19: 1 | AP19: 50 | AQ19: ="{"&RC[-6]&","&RC[-3]&","&RC[-2]&","&RC[-1]&"}," -> {201002,0,1,50}, | AR19: =R[-1]C&RC[-1] -> {200000,0,1,50},{200001,0,1,50},{200002,0,1,50},{200003,0,1,50},{200006,0,1,50},{200010,0,1,50},{200011,0,1,50},{200012,0,1,50},{200013,0,1,50},{200015,0,1,50},{200016,0,1,50},{200017,0,1,50},{200019,0,1,50},{201000,0,1,50},{201001,0,1,50},{201002,0,1,50},
A20: 110003 | B20: 洗炼石 | D20: 0 | E20: 1 | F20: 0 | G20: ="{"&RC[-6]&","&RC[-3]&","&RC[-2]&","&RC[-1]&"}," -> {110003,0,1,0}, | H20: =R[-1]C&RC[-1] -> {200000,0,1,100},{200001,0,1,100},{200002,0,1,100},{200003,0,1,100},{200006,0,1,100},{201000,0,1,100},{201001,0,1,100},{201002,0,1,100},{201003,0,1,100},{201006,0,1,100},{202000,0,1,100},{202001,0,1,100},{202002,0,1,100},{202003,0,1,100},{202006,0,1,100},{110002,0,1,0},{110003,0,1,0}, | J20: 202000 | K20: 半月 | L20: 1 | M20: 0 | N20: 1 | O20: 60 | P20: ="{"&RC[-6]&","&RC[-3]&","&RC[-2]&","&RC[-1]&"}," -> {202000,0,1,60}, | Q20: =R[-1]C&RC[-1] -> {200000,0,1,60},{200001,0,1,60},{200002,0,1,60},{200003,0,1,60},{200006,0,1,60},{200010,0,1,60},{200011,0,1,60},{200012,0,1,60},{201000,0,1,60},{201001,0,1,60},{201002,0,1,60},{201003,0,1,60},{201006,0,1,60},{201010,0,1,60},{201011,0,1,60},{201012,0,1,60},{202000,0,1,60}, | S20: 201003 | T20: 魔法手镯 | U20: 1 | V20: 0 | W20: 1 | X20: 70 | Y20: ="{"&RC[-6]&","&RC[-3]&","&RC[-2]&","&RC[-1]&"}," -> {201003,0,1,70}, | Z20: =R[-1]C&RC[-1] -> {200000,0,1,70},{200001,0,1,70},{200002,0,1,70},{200003,0,1,70},{200006,0,1,70},{200010,0,1,70},{200011,0,1,70},{200012,0,1,70},{200013,0,1,70},{200015,0,1,70},{200016,0,1,70},{200017,0,1,70},{200019,0,1,70},{201000,0,1,70},{201001,0,1,70},{201002,0,1,70},{201003,0,1,70}, | AB20: 201003 | AC20: 魔法手镯 | AD20: 1 | AE20: 0 | AF20: 1 | AG20: 60 | AH20: ="{"&RC[-6]&","&RC[-3]&","&RC[-2]&","&RC[-1]&"}," -> {201003,0,1,60}, | AI20: =R[-1]C&RC[-1] -> {200000,0,1,60},{200001,0,1,60},{200002,0,1,60},{200003,0,1,60},{200006,0,1,60},{200010,0,1,60},{200011,0,1,60},{200012,0,1,60},{200013,0,1,60},{200015,0,1,60},{200016,0,1,60},{200017,0,1,60},{200019,0,1,60},{201000,0,1,60},{201001,0,1,60},{201002,0,1,60},{201003,0,1,60}, | AK20: 201003 | AL20: 魔法手镯 | AM20: 1 | AN20: 0 | AO20: 1 | AP20: 50 | AQ20: ="{"&RC[-6]&","&RC[-3]&","&RC[-2]&","&RC[-1]&"}," -> {201003,0,1,50}, | AR20: =R[-1]C&RC[-1] -> {200000,0,1,50},{200001,0,1,50},{200002,0,1,50},{200003,0,1,50},{200006,0,1,50},{200010,0,1,50},{200011,0,1,50},{200012,0,1,50},{200013,0,1,50},{200015,0,1,50},{200016,0,1,50},{200017,0,1,50},{200019,0,1,50},{201000,0,1,50},{201001,0,1,50},{201002,0,1,50},{201003,0,1,50},
A21: 110004 | B21: 红药 | D21: 0 | E21: 1 | F21: 100 | G21: ="{"&RC[-6]&","&RC[-3]&","&RC[-2]&","&RC[-1]&"}," -> {110004,0,1,100}, | H21: =R[-1]C&RC[-1] -> {200000,0,1,100},{200001,0,1,100},{200002,0,1,100},{200003,0,1,100},{200006,0,1,100},{201000,0,1,100},{201001,0,1,100},{201002,0,1,100},{201003,0,1,100},{201006,0,1,100},{202000,0,1,100},{202001,0,1,100},{202002,0,1,100},{202003,0,1,100},{202006,0,1,100},{110002,0,1,0},{110003,0,1,0},{110004,0,1,100}, | J21: 202001 | K21: 轻盔 | L21: 1 | M21: 0 | N21: 1 | O21: 60 | P21: ="{"&RC[-6]&","&RC[-3]&","&RC[-2]&","&RC[-1]&"}," -> {202001,0,1,60}, | Q21: =R[-1]C&RC[-1] -> {200000,0,1,60},{200001,0,1,60},{200002,0,1,60},{200003,0,1,60},{200006,0,1,60},{200010,0,1,60},{200011,0,1,60},{200012,0,1,60},{201000,0,1,60},{201001,0,1,60},{201002,0,1,60},{201003,0,1,60},{201006,0,1,60},{201010,0,1,60},{201011,0,1,60},{201012,0,1,60},{202000,0,1,60},{202001,0,1,60}, | S21: 201006 | T21: 放大镜 | U21: 1 | V21: 0 | W21: 1 | X21: 70 | Y21: ="{"&RC[-6]&","&RC[-3]&","&RC[-2]&","&RC[-1]&"}," -> {201006,0,1,70}, | Z21: =R[-1]C&RC[-1] -> {200000,0,1,70},{200001,0,1,70},{200002,0,1,70},{200003,0,1,70},{200006,0,1,70},{200010,0,1,70},{200011,0,1,70},{200012,0,1,70},{200013,0,1,70},{200015,0,1,70},{200016,0,1,70},{200017,0,1,70},{200019,0,1,70},{201000,0,1,70},{201001,0,1,70},{201002,0,1,70},{201003,0,1,70},{201006,0,1,70}, | AB21: 201006 | AC21: 放大镜 | AD21: 1 | AE21: 0 | AF21: 1 | AG21: 60 | AH21: ="{"&RC[-6]&","&RC[-3]&","&RC[-2]&","&RC[-1]&"}," -> {201006,0,1,60}, | AI21: =R[-1]C&RC[-1] -> {200000,0,1,60},{200001,0,1,60},{200002,0,1,60},{200003,0,1,60},{200006,0,1,60},{200010,0,1,60},{200011,0,1,60},{200012,0,1,60},{200013,0,1,60},{200015,0,1,60},{200016,0,1,60},{200017,0,1,60},{200019,0,1,60},{201000,0,1,60},{201001,0,1,60},{201002,0,1,60},{201003,0,1,60},{201006,0,1,60}, | AK21: 201006 | AL21: 放大镜 | AM21: 1 | AN21: 0 | AO21: 1 | AP21: 50 | AQ21: ="{"&RC[-6]&","&RC[-3]&","&RC[-2]&","&RC[-1]&"}," -> {201006,0,1,50}, | AR21: =R[-1]C&RC[-1] -> {200000,0,1,50},{200001,0,1,50},{200002,0,1,50},{200003,0,1,50},{200006,0,1,50},{200010,0,1,50},{200011,0,1,50},{200012,0,1,50},{200013,0,1,50},{200015,0,1,50},{200016,0,1,50},{200017,0,1,50},{200019,0,1,50},{201000,0,1,50},{201001,0,1,50},{201002,0,1,50},{201003,0,1,50},{201006,0,1,50},
A22: 110005 | B22: 蓝药 | D22: 0 | E22: 1 | F22: 100 | G22: ="{"&RC[-6]&","&RC[-3]&","&RC[-2]&","&RC[-1]&"}," -> {110005,0,1,100}, | H22: =R[-1]C&RC[-1] -> {200000,0,1,100},{200001,0,1,100},{200002,0,1,100},{200003,0,1,100},{200006,0,1,100},{201000,0,1,100},{201001,0,1,100},{201002,0,1,100},{201003,0,1,100},{201006,0,1,100},{202000,0,1,100},{202001,0,1,100},{202002,0,1,100},{202003,0,1,100},{202006,0,1,100},{110002,0,1,0},{110003,0,1,0},{110004,0,1,100},{110005,0,1,100}, | J22: 202002 | K22: 铂金戒指 | L22: 1 | M22: 0 | N22: 1 | O22: 60 | P22: ="{"&RC[-6]&","&RC[-3]&","&RC[-2]&","&RC[-1]&"}," -> {202002,0,1,60}, | Q22: =R[-1]C&RC[-1] -> {200000,0,1,60},{200001,0,1,60},{200002,0,1,60},{200003,0,1,60},{200006,0,1,60},{200010,0,1,60},{200011,0,1,60},{200012,0,1,60},{201000,0,1,60},{201001,0,1,60},{201002,0,1,60},{201003,0,1,60},{201006,0,1,60},{201010,0,1,60},{201011,0,1,60},{201012,0,1,60},{202000,0,1,60},{202001,0,1,60},{202002,0,1,60}, | S22: 201010 | T22: 魔杖 | U22: 1 | V22: 0 | W22: 1 | X22: 70 | Y22: ="{"&RC[-6]&","&RC[-3]&","&RC[-2]&","&RC[-1]&"}," -> {201010,0,1,70}, | Z22: =R[-1]C&RC[-1] -> {200000,0,1,70},{200001,0,1,70},{200002,0,1,70},{200003,0,1,70},{200006,0,1,70},{200010,0,1,70},{200011,0,1,70},{200012,0,1,70},{200013,0,1,70},{200015,0,1,70},{200016,0,1,70},{200017,0,1,70},{200019,0,1,70},{201000,0,1,70},{201001,0,1,70},{201002,0,1,70},{201003,0,1,70},{201006,0,1,70},{201010,0,1,70}, | AB22: 201010 | AC22: 魔杖 | AD22: 1 | AE22: 0 | AF22: 1 | AG22: 60 | AH22: ="{"&RC[-6]&","&RC[-3]&","&RC[-2]&","&RC[-1]&"}," -> {201010,0,1,60}, | AI22: =R[-1]C&RC[-1] -> {200000,0,1,60},{200001,0,1,60},{200002,0,1,60},{200003,0,1,60},{200006,0,1,60},{200010,0,1,60},{200011,0,1,60},{200012,0,1,60},{200013,0,1,60},{200015,0,1,60},{200016,0,1,60},{200017,0,1,60},{200019,0,1,60},{201000,0,1,60},{201001,0,1,60},{201002,0,1,60},{201003,0,1,60},{201006,0,1,60},{201010,0,1,60}, | AK22: 201010 | AL22: 魔杖 | AM22: 1 | AN22: 0 | AO22: 1 | AP22: 50 | AQ22: ="{"&RC[-6]&","&RC[-3]&","&RC[-2]&","&RC[-1]&"}," -> {201010,0,1,50}, | AR22: =R[-1]C&RC[-1] -> {200000,0,1,50},{200001,0,1,50},{200002,0,1,50},{200003,0,1,50},{200006,0,1,50},{200010,0,1,50},{200011,0,1,50},{200012,0,1,50},{200013,0,1,50},{200015,0,1,50},{200016,0,1,50},{200017,0,1,50},{200019,0,1,50},{201000,0,1,50},{201001,0,1,50},{201002,0,1,50},{201003,0,1,50},{201006,0,1,50},{201010,0,1,50},
A23: 110010 | B23: 普通武装碎片 | D23: 0 | E23: 1 | F23: 20 | G23: ="{"&RC[-6]&","&RC[-3]&","&RC[-2]&","&RC[-1]&"}," -> {110010,0,1,20}, | H23: =R[-1]C&RC[-1] -> {200000,0,1,100},{200001,0,1,100},{200002,0,1,100},{200003,0,1,100},{200006,0,1,100},{201000,0,1,100},{201001,0,1,100},{201002,0,1,100},{201003,0,1,100},{201006,0,1,100},{202000,0,1,100},{202001,0,1,100},{202002,0,1,100},{202003,0,1,100},{202006,0,1,100},{110002,0,1,0},{110003,0,1,0},{110004,0,1,100},{110005,0,1,100},{110010,0,1,20}, | J23: 202003 | K23: 三眼手镯 | L23: 1 | M23: 0 | N23: 1 | O23: 60 | P23: ="{"&RC[-6]&","&RC[-3]&","&RC[-2]&","&RC[-1]&"}," -> {202003,0,1,60}, | Q23: =R[-1]C&RC[-1] -> {200000,0,1,60},{200001,0,1,60},{200002,0,1,60},{200003,0,1,60},{200006,0,1,60},{200010,0,1,60},{200011,0,1,60},{200012,0,1,60},{201000,0,1,60},{201001,0,1,60},{201002,0,1,60},{201003,0,1,60},{201006,0,1,60},{201010,0,1,60},{201011,0,1,60},{201012,0,1,60},{202000,0,1,60},{202001,0,1,60},{202002,0,1,60},{202003,0,1,60}, | S23: 201011 | T23: 恶魔铃铛 | U23: 1 | V23: 0 | W23: 1 | X23: 70 | Y23: ="{"&RC[-6]&","&RC[-3]&","&RC[-2]&","&RC[-1]&"}," -> {201011,0,1,70}, | Z23: =R[-1]C&RC[-1] -> {200000,0,1,70},{200001,0,1,70},{200002,0,1,70},{200003,0,1,70},{200006,0,1,70},{200010,0,1,70},{200011,0,1,70},{200012,0,1,70},{200013,0,1,70},{200015,0,1,70},{200016,0,1,70},{200017,0,1,70},{200019,0,1,70},{201000,0,1,70},{201001,0,1,70},{201002,0,1,70},{201003,0,1,70},{201006,0,1,70},{201010,0,1,70},{201011,0,1,70}, | AB23: 201011 | AC23: 恶魔铃铛 | AD23: 1 | AE23: 0 | AF23: 1 | AG23: 60 | AH23: ="{"&RC[-6]&","&RC[-3]&","&RC[-2]&","&RC[-1]&"}," -> {201011,0,1,60}, | AI23: =R[-1]C&RC[-1] -> {200000,0,1,60},{200001,0,1,60},{200002,0,1,60},{200003,0,1,60},{200006,0,1,60},{200010,0,1,60},{200011,0,1,60},{200012,0,1,60},{200013,0,1,60},{200015,0,1,60},{200016,0,1,60},{200017,0,1,60},{200019,0,1,60},{201000,0,1,60},{201001,0,1,60},{201002,0,1,60},{201003,0,1,60},{201006,0,1,60},{201010,0,1,60},{201011,0,1,60}, | AK23: 201011 | AL23: 恶魔铃铛 | AM23: 1 | AN23: 0 | AO23: 1 | AP23: 50 | AQ23: ="{"&RC[-6]&","&RC[-3]&","&RC[-2]&","&RC[-1]&"}," -> {201011,0,1,50}, | AR23: =R[-1]C&RC[-1] -> {200000,0,1,50},{200001,0,1,50},{200002,0,1,50},{200003,0,1,50},{200006,0,1,50},{200010,0,1,50},{200011,0,1,50},{200012,0,1,50},{200013,0,1,50},{200015,0,1,50},{200016,0,1,50},{200017,0,1,50},{200019,0,1,50},{201000,0,1,50},{201001,0,1,50},{201002,0,1,50},{201003,0,1,50},{201006,0,1,50},{201010,0,1,50},{201011,0,1,50},
A24: 110011 | B24: 普通防具碎片 | D24: 0 | E24: 1 | F24: 20 | G24: ="{"&RC[-6]&","&RC[-3]&","&RC[-2]&","&RC[-1]&"}," -> {110011,0,1,20}, | H24: =R[-1]C&RC[-1] -> {200000,0,1,100},{200001,0,1,100},{200002,0,1,100},{200003,0,1,100},{200006,0,1,100},{201000,0,1,100},{201001,0,1,100},{201002,0,1,100},{201003,0,1,100},{201006,0,1,100},{202000,0,1,100},{202001,0,1,100},{202002,0,1,100},{202003,0,1,100},{202006,0,1,100},{110002,0,1,0},{110003,0,1,0},{110004,0,1,100},{110005,0,1,100},{110010,0,1,20},{110011,0,1,20}, | J24: 202006 | K24: 凤凰明珠 | L24: 1 | M24: 0 | N24: 1 | O24: 60 | P24: ="{"&RC[-6]&","&RC[-3]&","&RC[-2]&","&RC[-1]&"}," -> {202006,0,1,60}, | Q24: =R[-1]C&RC[-1] -> {200000,0,1,60},{200001,0,1,60},{200002,0,1,60},{200003,0,1,60},{200006,0,1,60},{200010,0,1,60},{200011,0,1,60},{200012,0,1,60},{201000,0,1,60},{201001,0,1,60},{201002,0,1,60},{201003,0,1,60},{201006,0,1,60},{201010,0,1,60},{201011,0,1,60},{201012,0,1,60},{202000,0,1,60},{202001,0,1,60},{202002,0,1,60},{202003,0,1,60},{202006,0,1,60}, | S24: 201012 | T24: 恶魔长袍 | U24: 1 | V24: 0 | W24: 1 | X24: 70 | Y24: ="{"&RC[-6]&","&RC[-3]&","&RC[-2]&","&RC[-1]&"}," -> {201012,0,1,70}, | Z24: =R[-1]C&RC[-1] -> {200000,0,1,70},{200001,0,1,70},{200002,0,1,70},{200003,0,1,70},{200006,0,1,70},{200010,0,1,70},{200011,0,1,70},{200012,0,1,70},{200013,0,1,70},{200015,0,1,70},{200016,0,1,70},{200017,0,1,70},{200019,0,1,70},{201000,0,1,70},{201001,0,1,70},{201002,0,1,70},{201003,0,1,70},{201006,0,1,70},{201010,0,1,70},{201011,0,1,70},{201012,0,1,70}, | AB24: 201012 | AC24: 恶魔长袍 | AD24: 1 | AE24: 0 | AF24: 1 | AG24: 60 | AH24: ="{"&RC[-6]&","&RC[-3]&","&RC[-2]&","&RC[-1]&"}," -> {201012,0,1,60}, | AI24: =R[-1]C&RC[-1] -> {200000,0,1,60},{200001,0,1,60},{200002,0,1,60},{200003,0,1,60},{200006,0,1,60},{200010,0,1,60},{200011,0,1,60},{200012,0,1,60},{200013,0,1,60},{200015,0,1,60},{200016,0,1,60},{200017,0,1,60},{200019,0,1,60},{201000,0,1,60},{201001,0,1,60},{201002,0,1,60},{201003,0,1,60},{201006,0,1,60},{201010,0,1,60},{201011,0,1,60},{201012,0,1,60}, | AK24: 201012 | AL24: 恶魔长袍 | AM24: 1 | AN24: 0 | AO24: 1 | AP24: 50 | AQ24: ="{"&RC[-6]&","&RC[-3]&","&RC[-2]&","&RC[-1]&"}," -> {201012,0,1,50}, | AR24: =R[-1]C&RC[-1] -> {200000,0,1,50},{200001,0,1,50},{200002,0,1,50},{200003,0,1,50},{200006,0,1,50},{200010,0,1,50},{200011,0,1,50},{200012,0,1,50},{200013,0,1,50},{200015,0,1,50},{200016,0,1,50},{200017,0,1,50},{200019,0,1,50},{201000,0,1,50},{201001,0,1,50},{201002,0,1,50},{201003,0,1,50},{201006,0,1,50},{201010,0,1,50},{201011,0,1,50},{201012,0,1,50},
A25: 110012 | B25: 普通首饰碎片 | D25: 0 | E25: 1 | F25: 20 | G25: ="{"&RC[-6]&","&RC[-3]&","&RC[-2]&","&RC[-1]&"}," -> {110012,0,1,20}, | H25: =R[-1]C&RC[-1] -> {200000,0,1,100},{200001,0,1,100},{200002,0,1,100},{200003,0,1,100},{200006,0,1,100},{201000,0,1,100},{201001,0,1,100},{201002,0,1,100},{201003,0,1,100},{201006,0,1,100},{202000,0,1,100},{202001,0,1,100},{202002,0,1,100},{202003,0,1,100},{202006,0,1,100},{110002,0,1,0},{110003,0,1,0},{110004,0,1,100},{110005,0,1,100},{110010,0,1,20},{110011,0,1,20},{110012,0,1,20}, | J25: 202010 | K25: 银蛇 | L25: 1 | M25: 0 | N25: 1 | O25: 60 | P25: ="{"&RC[-6]&","&RC[-3]&","&RC[-2]&","&RC[-1]&"}," -> {202010,0,1,60}, | Q25: =R[-1]C&RC[-1] -> {200000,0,1,60},{200001,0,1,60},{200002,0,1,60},{200003,0,1,60},{200006,0,1,60},{200010,0,1,60},{200011,0,1,60},{200012,0,1,60},{201000,0,1,60},{201001,0,1,60},{201002,0,1,60},{201003,0,1,60},{201006,0,1,60},{201010,0,1,60},{201011,0,1,60},{201012,0,1,60},{202000,0,1,60},{202001,0,1,60},{202002,0,1,60},{202003,0,1,60},{202006,0,1,60},{202010,0,1,60}, | S25: 201013 | T25: 紫碧螺 | U25: 1 | V25: 0 | W25: 1 | X25: 70 | Y25: ="{"&RC[-6]&","&RC[-3]&","&RC[-2]&","&RC[-1]&"}," -> {201013,0,1,70}, | Z25: =R[-1]C&RC[-1] -> {200000,0,1,70},{200001,0,1,70},{200002,0,1,70},{200003,0,1,70},{200006,0,1,70},{200010,0,1,70},{200011,0,1,70},{200012,0,1,70},{200013,0,1,70},{200015,0,1,70},{200016,0,1,70},{200017,0,1,70},{200019,0,1,70},{201000,0,1,70},{201001,0,1,70},{201002,0,1,70},{201003,0,1,70},{201006,0,1,70},{201010,0,1,70},{201011,0,1,70},{201012,0,1,70},{201013,0,1,70}, | AB25: 201013 | AC25: 紫碧螺 | AD25: 1 | AE25: 0 | AF25: 1 | AG25: 60 | AH25: ="{"&RC[-6]&","&RC[-3]&","&RC[-2]&","&RC[-1]&"}," -> {201013,0,1,60}, | AI25: =R[-1]C&RC[-1] -> {200000,0,1,60},{200001,0,1,60},{200002,0,1,60},{200003,0,1,60},{200006,0,1,60},{200010,0,1,60},{200011,0,1,60},{200012,0,1,60},{200013,0,1,60},{200015,0,1,60},{200016,0,1,60},{200017,0,1,60},{200019,0,1,60},{201000,0,1,60},{201001,0,1,60},{201002,0,1,60},{201003,0,1,60},{201006,0,1,60},{201010,0,1,60},{201011,0,1,60},{201012,0,1,60},{201013,0,1,60}, | AK25: 201013 | AL25: 紫碧螺 | AM25: 1 | AN25: 0 | AO25: 1 | AP25: 50 | AQ25: ="{"&RC[-6]&","&RC[-3]&","&RC[-2]&","&RC[-1]&"}," -> {201013,0,1,50}, | AR25: =R[-1]C&RC[-1] -> {200000,0,1,50},{200001,0,1,50},{200002,0,1,50},{200003,0,1,50},{200006,0,1,50},{200010,0,1,50},{200011,0,1,50},{200012,0,1,50},{200013,0,1,50},{200015,0,1,50},{200016,0,1,50},{200017,0,1,50},{200019,0,1,50},{201000,0,1,50},{201001,0,1,50},{201002,0,1,50},{201003,0,1,50},{201006,0,1,50},{201010,0,1,50},{201011,0,1,50},{201012,0,1,50},{201013,0,1,50},
A26: 110009 | B26: 金币 | D26: 0 | E26: 1 | F26: 100 | G26: ="{"&RC[-6]&","&RC[-3]&","&RC[-2]&","&RC[-1]&"}" -> {110009,0,1,100} | H26: =R[-1]C&RC[-1] -> {200000,0,1,100},{200001,0,1,100},{200002,0,1,100},{200003,0,1,100},{200006,0,1,100},{201000,0,1,100},{201001,0,1,100},{201002,0,1,100},{201003,0,1,100},{201006,0,1,100},{202000,0,1,100},{202001,0,1,100},{202002,0,1,100},{202003,0,1,100},{202006,0,1,100},{110002,0,1,0},{110003,0,1,0},{110004,0,1,100},{110005,0,1,100},{110010,0,1,20},{110011,0,1,20},{110012,0,1,20},{110009,0,1,100} | J26: 202011 | K26: 天珠道链 | L26: 1 | M26: 0 | N26: 1 | O26: 60 | P26: ="{"&RC[-6]&","&RC[-3]&","&RC[-2]&","&RC[-1]&"}," -> {202011,0,1,60}, | Q26: =R[-1]C&RC[-1] -> {200000,0,1,60},{200001,0,1,60},{200002,0,1,60},{200003,0,1,60},{200006,0,1,60},{200010,0,1,60},{200011,0,1,60},{200012,0,1,60},{201000,0,1,60},{201001,0,1,60},{201002,0,1,60},{201003,0,1,60},{201006,0,1,60},{201010,0,1,60},{201011,0,1,60},{201012,0,1,60},{202000,0,1,60},{202001,0,1,60},{202002,0,1,60},{202003,0,1,60},{202006,0,1,60},{202010,0,1,60},{202011,0,1,60}, | S26: 201015 | T26: 法师头盔 | U26: 1 | V26: 0 | W26: 1 | X26: 70 | Y26: ="{"&RC[-6]&","&RC[-3]&","&RC[-2]&","&RC[-1]&"}," -> {201015,0,1,70}, | Z26: =R[-1]C&RC[-1] -> {200000,0,1,70},{200001,0,1,70},{200002,0,1,70},{200003,0,1,70},{200006,0,1,70},{200010,0,1,70},{200011,0,1,70},{200012,0,1,70},{200013,0,1,70},{200015,0,1,70},{200016,0,1,70},{200017,0,1,70},{200019,0,1,70},{201000,0,1,70},{201001,0,1,70},{201002,0,1,70},{201003,0,1,70},{201006,0,1,70},{201010,0,1,70},{201011,0,1,70},{201012,0,1,70},{201013,0,1,70},{201015,0,1,70}, | AB26: 201015 | AC26: 法师头盔 | AD26: 1 | AE26: 0 | AF26: 1 | AG26: 60 | AH26: ="{"&RC[-6]&","&RC[-3]&","&RC[-2]&","&RC[-1]&"}," -> {201015,0,1,60}, | AI26: =R[-1]C&RC[-1] -> {200000,0,1,60},{200001,0,1,60},{200002,0,1,60},{200003,0,1,60},{200006,0,1,60},{200010,0,1,60},{200011,0,1,60},{200012,0,1,60},{200013,0,1,60},{200015,0,1,60},{200016,0,1,60},{200017,0,1,60},{200019,0,1,60},{201000,0,1,60},{201001,0,1,60},{201002,0,1,60},{201003,0,1,60},{201006,0,1,60},{201010,0,1,60},{201011,0,1,60},{201012,0,1,60},{201013,0,1,60},{201015,0,1,60}, | AK26: 201015 | AL26: 法师头盔 | AM26: 1 | AN26: 0 | AO26: 1 | AP26: 50 | AQ26: ="{"&RC[-6]&","&RC[-3]&","&RC[-2]&","&RC[-1]&"}," -> {201015,0,1,50}, | AR26: =R[-1]C&RC[-1] -> {200000,0,1,50},{200001,0,1,50},{200002,0,1,50},{200003,0,1,50},{200006,0,1,50},{200010,0,1,50},{200011,0,1,50},{200012,0,1,50},{200013,0,1,50},{200015,0,1,50},{200016,0,1,50},{200017,0,1,50},{200019,0,1,50},{201000,0,1,50},{201001,0,1,50},{201002,0,1,50},{201003,0,1,50},{201006,0,1,50},{201010,0,1,50},{201011,0,1,50},{201012,0,1,50},{201013,0,1,50},{201015,0,1,50},
A27: 道具掉落 | F27: 掉落数量 | G27: 概率／100 | J27: 202012 | K27: 灵魂道袍 | L27: 1 | M27: 0 | N27: 1 | O27: 60 | P27: ="{"&RC[-6]&","&RC[-3]&","&RC[-2]&","&RC[-1]&"}," -> {202012,0,1,60}, | Q27: =R[-1]C&RC[-1] -> {200000,0,1,60},{200001,0,1,60},{200002,0,1,60},{200003,0,1,60},{200006,0,1,60},{200010,0,1,60},{200011,0,1,60},{200012,0,1,60},{201000,0,1,60},{201001,0,1,60},{201002,0,1,60},{201003,0,1,60},{201006,0,1,60},{201010,0,1,60},{201011,0,1,60},{201012,0,1,60},{202000,0,1,60},{202001,0,1,60},{202002,0,1,60},{202003,0,1,60},{202006,0,1,60},{202010,0,1,60},{202011,0,1,60},{202012,0,1,60}, | S27: 201016 | T27: 龙之手镯 | U27: 1 | V27: 0 | W27: 1 | X27: 70 | Y27: ="{"&RC[-6]&","&RC[-3]&","&RC[-2]&","&RC[-1]&"}," -> {201016,0,1,70}, | Z27: =R[-1]C&RC[-1] -> {200000,0,1,70},{200001,0,1,70},{200002,0,1,70},{200003,0,1,70},{200006,0,1,70},{200010,0,1,70},{200011,0,1,70},{200012,0,1,70},{200013,0,1,70},{200015,0,1,70},{200016,0,1,70},{200017,0,1,70},{200019,0,1,70},{201000,0,1,70},{201001,0,1,70},{201002,0,1,70},{201003,0,1,70},{201006,0,1,70},{201010,0,1,70},{201011,0,1,70},{201012,0,1,70},{201013,0,1,70},{201015,0,1,70},{201016,0,1,70}, | AB27: 201016 | AC27: 龙之手镯 | AD27: 1 | AE27: 0 | AF27: 1 | AG27: 60 | AH27: ="{"&RC[-6]&","&RC[-3]&","&RC[-2]&","&RC[-1]&"}," -> {201016,0,1,60}, | AI27: =R[-1]C&RC[-1] -> {200000,0,1,60},{200001,0,1,60},{200002,0,1,60},{200003,0,1,60},{200006,0,1,60},{200010,0,1,60},{200011,0,1,60},{200012,0,1,60},{200013,0,1,60},{200015,0,1,60},{200016,0,1,60},{200017,0,1,60},{200019,0,1,60},{201000,0,1,60},{201001,0,1,60},{201002,0,1,60},{201003,0,1,60},{201006,0,1,60},{201010,0,1,60},{201011,0,1,60},{201012,0,1,60},{201013,0,1,60},{201015,0,1,60},{201016,0,1,60}, | AK27: 201016 | AL27: 龙之手镯 | AM27: 1 | AN27: 0 | AO27: 1 | AP27: 50 | AQ27: ="{"&RC[-6]&","&RC[-3]&","&RC[-2]&","&RC[-1]&"}," -> {201016,0,1,50}, | AR27: =R[-1]C&RC[-1] -> {200000,0,1,50},{200001,0,1,50},{200002,0,1,50},{200003,0,1,50},{200006,0,1,50},{200010,0,1,50},{200011,0,1,50},{200012,0,1,50},{200013,0,1,50},{200015,0,1,50},{200016,0,1,50},{200017,0,1,50},{200019,0,1,50},{201000,0,1,50},{201001,0,1,50},{201002,0,1,50},{201003,0,1,50},{201006,0,1,50},{201010,0,1,50},{201011,0,1,50},{201012,0,1,50},{201013,0,1,50},{201015,0,1,50},{201016,0,1,50},
F28: 0 | G28: =10000-R[1]C -> 5000 | H28: ="{"&RC[-2]&","&RC[-1]&"}," -> {0,5000}, | J28: 110002 | K28: 强化石 | M28: 0 | N28: 1 | O28: 0 | P28: ="{"&RC[-6]&","&RC[-3]&","&RC[-2]&","&RC[-1]&"}," -> {110002,0,1,0}, | Q28: =R[-1]C&RC[-1] -> {200000,0,1,60},{200001,0,1,60},{200002,0,1,60},{200003,0,1,60},{200006,0,1,60},{200010,0,1,60},{200011,0,1,60},{200012,0,1,60},{201000,0,1,60},{201001,0,1,60},{201002,0,1,60},{201003,0,1,60},{201006,0,1,60},{201010,0,1,60},{201011,0,1,60},{201012,0,1,60},{202000,0,1,60},{202001,0,1,60},{202002,0,1,60},{202003,0,1,60},{202006,0,1,60},{202010,0,1,60},{202011,0,1,60},{202012,0,1,60},{110002,0,1,0}, | S28: 201017 | T28: 法师腰带 | U28: 1 | V28: 0 | W28: 1 | X28: 70 | Y28: ="{"&RC[-6]&","&RC[-3]&","&RC[-2]&","&RC[-1]&"}," -> {201017,0,1,70}, | Z28: =R[-1]C&RC[-1] -> {200000,0,1,70},{200001,0,1,70},{200002,0,1,70},{200003,0,1,70},{200006,0,1,70},{200010,0,1,70},{200011,0,1,70},{200012,0,1,70},{200013,0,1,70},{200015,0,1,70},{200016,0,1,70},{200017,0,1,70},{200019,0,1,70},{201000,0,1,70},{201001,0,1,70},{201002,0,1,70},{201003,0,1,70},{201006,0,1,70},{201010,0,1,70},{201011,0,1,70},{201012,0,1,70},{201013,0,1,70},{201015,0,1,70},{201016,0,1,70},{201017,0,1,70}, | AB28: 201017 | AC28: 法师腰带 | AD28: 1 | AE28: 0 | AF28: 1 | AG28: 60 | AH28: ="{"&RC[-6]&","&RC[-3]&","&RC[-2]&","&RC[-1]&"}," -> {201017,0,1,60}, | AI28: =R[-1]C&RC[-1] -> {200000,0,1,60},{200001,0,1,60},{200002,0,1,60},{200003,0,1,60},{200006,0,1,60},{200010,0,1,60},{200011,0,1,60},{200012,0,1,60},{200013,0,1,60},{200015,0,1,60},{200016,0,1,60},{200017,0,1,60},{200019,0,1,60},{201000,0,1,60},{201001,0,1,60},{201002,0,1,60},{201003,0,1,60},{201006,0,1,60},{201010,0,1,60},{201011,0,1,60},{201012,0,1,60},{201013,0,1,60},{201015,0,1,60},{201016,0,1,60},{201017,0,1,60}, | AK28: 201017 | AL28: 法师腰带 | AM28: 1 | AN28: 0 | AO28: 1 | AP28: 50 | AQ28: ="{"&RC[-6]&","&RC[-3]&","&RC[-2]&","&RC[-1]&"}," -> {201017,0,1,50}, | AR28: =R[-1]C&RC[-1] -> {200000,0,1,50},{200001,0,1,50},{200002,0,1,50},{200003,0,1,50},{200006,0,1,50},{200010,0,1,50},{200011,0,1,50},{200012,0,1,50},{200013,0,1,50},{200015,0,1,50},{200016,0,1,50},{200017,0,1,50},{200019,0,1,50},{201000,0,1,50},{201001,0,1,50},{201002,0,1,50},{201003,0,1,50},{201006,0,1,50},{201010,0,1,50},{201011,0,1,50},{201012,0,1,50},{201013,0,1,50},{201015,0,1,50},{201016,0,1,50},{201017,0,1,50},
F29: 1 | G29: 5000 | H29: ="{"&RC[-2]&","&RC[-1]&"}" -> {1,5000} | J29: 110003 | K29: 洗炼石 | M29: 0 | N29: 1 | O29: 0 | P29: ="{"&RC[-6]&","&RC[-3]&","&RC[-2]&","&RC[-1]&"}," -> {110003,0,1,0}, | Q29: =R[-1]C&RC[-1] -> {200000,0,1,60},{200001,0,1,60},{200002,0,1,60},{200003,0,1,60},{200006,0,1,60},{200010,0,1,60},{200011,0,1,60},{200012,0,1,60},{201000,0,1,60},{201001,0,1,60},{201002,0,1,60},{201003,0,1,60},{201006,0,1,60},{201010,0,1,60},{201011,0,1,60},{201012,0,1,60},{202000,0,1,60},{202001,0,1,60},{202002,0,1,60},{202003,0,1,60},{202006,0,1,60},{202010,0,1,60},{202011,0,1,60},{202012,0,1,60},{110002,0,1,0},{110003,0,1,0}, | S29: 201019 | T29: 法师鞋子 | U29: 1 | V29: 0 | W29: 1 | X29: 70 | Y29: ="{"&RC[-6]&","&RC[-3]&","&RC[-2]&","&RC[-1]&"}," -> {201019,0,1,70}, | Z29: =R[-1]C&RC[-1] -> {200000,0,1,70},{200001,0,1,70},{200002,0,1,70},{200003,0,1,70},{200006,0,1,70},{200010,0,1,70},{200011,0,1,70},{200012,0,1,70},{200013,0,1,70},{200015,0,1,70},{200016,0,1,70},{200017,0,1,70},{200019,0,1,70},{201000,0,1,70},{201001,0,1,70},{201002,0,1,70},{201003,0,1,70},{201006,0,1,70},{201010,0,1,70},{201011,0,1,70},{201012,0,1,70},{201013,0,1,70},{201015,0,1,70},{201016,0,1,70},{201017,0,1,70},{201019,0,1,70}, | AB29: 201019 | AC29: 法师鞋子 | AD29: 1 | AE29: 0 | AF29: 1 | AG29: 60 | AH29: ="{"&RC[-6]&","&RC[-3]&","&RC[-2]&","&RC[-1]&"}," -> {201019,0,1,60}, | AI29: =R[-1]C&RC[-1] -> {200000,0,1,60},{200001,0,1,60},{200002,0,1,60},{200003,0,1,60},{200006,0,1,60},{200010,0,1,60},{200011,0,1,60},{200012,0,1,60},{200013,0,1,60},{200015,0,1,60},{200016,0,1,60},{200017,0,1,60},{200019,0,1,60},{201000,0,1,60},{201001,0,1,60},{201002,0,1,60},{201003,0,1,60},{201006,0,1,60},{201010,0,1,60},{201011,0,1,60},{201012,0,1,60},{201013,0,1,60},{201015,0,1,60},{201016,0,1,60},{201017,0,1,60},{201019,0,1,60}, | AK29: 201019 | AL29: 法师鞋子 | AM29: 1 | AN29: 0 | AO29: 1 | AP29: 50 | AQ29: ="{"&RC[-6]&","&RC[-3]&","&RC[-2]&","&RC[-1]&"}," -> {201019,0,1,50}, | AR29: =R[-1]C&RC[-1] -> {200000,0,1,50},{200001,0,1,50},{200002,0,1,50},{200003,0,1,50},{200006,0,1,50},{200010,0,1,50},{200011,0,1,50},{200012,0,1,50},{200013,0,1,50},{200015,0,1,50},{200016,0,1,50},{200017,0,1,50},{200019,0,1,50},{201000,0,1,50},{201001,0,1,50},{201002,0,1,50},{201003,0,1,50},{201006,0,1,50},{201010,0,1,50},{201011,0,1,50},{201012,0,1,50},{201013,0,1,50},{201015,0,1,50},{201016,0,1,50},{201017,0,1,50},{201019,0,1,50},
J30: 110004 | K30: 红药 | M30: 0 | N30: 1 | O30: 100 | P30: ="{"&RC[-6]&","&RC[-3]&","&RC[-2]&","&RC[-1]&"}," -> {110004,0,1,100}, | Q30: =R[-1]C&RC[-1] -> {200000,0,1,60},{200001,0,1,60},{200002,0,1,60},{200003,0,1,60},{200006,0,1,60},{200010,0,1,60},{200011,0,1,60},{200012,0,1,60},{201000,0,1,60},{201001,0,1,60},{201002,0,1,60},{201003,0,1,60},{201006,0,1,60},{201010,0,1,60},{201011,0,1,60},{201012,0,1,60},{202000,0,1,60},{202001,0,1,60},{202002,0,1,60},{202003,0,1,60},{202006,0,1,60},{202010,0,1,60},{202011,0,1,60},{202012,0,1,60},{110002,0,1,0},{110003,0,1,0},{110004,0,1,100}, | S30: 202000 | T30: 半月 | U30: 1 | V30: 0 | W30: 1 | X30: 70 | Y30: ="{"&RC[-6]&","&RC[-3]&","&RC[-2]&","&RC[-1]&"}," -> {202000,0,1,70}, | Z30: =R[-1]C&RC[-1] -> {200000,0,1,70},{200001,0,1,70},{200002,0,1,70},{200003,0,1,70},{200006,0,1,70},{200010,0,1,70},{200011,0,1,70},{200012,0,1,70},{200013,0,1,70},{200015,0,1,70},{200016,0,1,70},{200017,0,1,70},{200019,0,1,70},{201000,0,1,70},{201001,0,1,70},{201002,0,1,70},{201003,0,1,70},{201006,0,1,70},{201010,0,1,70},{201011,0,1,70},{201012,0,1,70},{201013,0,1,70},{201015,0,1,70},{201016,0,1,70},{201017,0,1,70},{201019,0,1,70},{202000,0,1,70}, | AB30: 202000 | AC30: 半月 | AD30: 1 | AE30: 0 | AF30: 1 | AG30: 60 | AH30: ="{"&RC[-6]&","&RC[-3]&","&RC[-2]&","&RC[-1]&"}," -> {202000,0,1,60}, | AI30: =R[-1]C&RC[-1] -> {200000,0,1,60},{200001,0,1,60},{200002,0,1,60},{200003,0,1,60},{200006,0,1,60},{200010,0,1,60},{200011,0,1,60},{200012,0,1,60},{200013,0,1,60},{200015,0,1,60},{200016,0,1,60},{200017,0,1,60},{200019,0,1,60},{201000,0,1,60},{201001,0,1,60},{201002,0,1,60},{201003,0,1,60},{201006,0,1,60},{201010,0,1,60},{201011,0,1,60},{201012,0,1,60},{201013,0,1,60},{201015,0,1,60},{201016,0,1,60},{201017,0,1,60},{201019,0,1,60},{202000,0,1,60}, | AK30: 202000 | AL30: 半月 | AM30: 1 | AN30: 0 | AO30: 1 | AP30: 50 | AQ30: ="{"&RC[-6]&","&RC[-3]&","&RC[-2]&","&RC[-1]&"}," -> {202000,0,1,50}, | AR30: =R[-1]C&RC[-1] -> {200000,0,1,50},{200001,0,1,50},{200002,0,1,50},{200003,0,1,50},{200006,0,1,50},{200010,0,1,50},{200011,0,1,50},{200012,0,1,50},{200013,0,1,50},{200015,0,1,50},{200016,0,1,50},{200017,0,1,50},{200019,0,1,50},{201000,0,1,50},{201001,0,1,50},{201002,0,1,50},{201003,0,1,50},{201006,0,1,50},{201010,0,1,50},{201011,0,1,50},{201012,0,1,50},{201013,0,1,50},{201015,0,1,50},{201016,0,1,50},{201017,0,1,50},{201019,0,1,50},{202000,0,1,50},
A31: 总掉落 | H31: ="[{0,["&R[-3]C&R[-2]C&"],["&R[-5]C&"]}]" -> [{0,[{0,5000},{1,5000}],[{200000,0,1,100},{200001,0,1,100},{200002,0,1,100},{200003,0,1,100},{200006,0,1,100},{201000,0,1,100},{201001,0,1,100},{201002,0,1,100},{201003,0,1,100},{201006,0,1,100},{202000,0,1,100},{202001,0,1,100},{202002,0,1,100},{202003,0,1,100},{202006,0,1,100},{110002,0,1,0},{110003,0,1,0},{110004,0,1,100},{110005,0,1,100},{110010,0,1,20},{110011,0,1,20},{110012,0,1,20},{110009,0,1,100}]}] | J31: 110005 | K31: 蓝药 | M31: 0 | N31: 1 | O31: 100 | P31: ="{"&RC[-6]&","&RC[-3]&","&RC[-2]&","&RC[-1]&"}," -> {110005,0,1,100}, | Q31: =R[-1]C&RC[-1] -> {200000,0,1,60},{200001,0,1,60},{200002,0,1,60},{200003,0,1,60},{200006,0,1,60},{200010,0,1,60},{200011,0,1,60},{200012,0,1,60},{201000,0,1,60},{201001,0,1,60},{201002,0,1,60},{201003,0,1,60},{201006,0,1,60},{201010,0,1,60},{201011,0,1,60},{201012,0,1,60},{202000,0,1,60},{202001,0,1,60},{202002,0,1,60},{202003,0,1,60},{202006,0,1,60},{202010,0,1,60},{202011,0,1,60},{202012,0,1,60},{110002,0,1,0},{110003,0,1,0},{110004,0,1,100},{110005,0,1,100}, | S31: 202001 | T31: 轻盔 | U31: 1 | V31: 0 | W31: 1 | X31: 30 | Y31: ="{"&RC[-6]&","&RC[-3]&","&RC[-2]&","&RC[-1]&"}," -> {202001,0,1,30}, | Z31: =R[-1]C&RC[-1] -> {200000,0,1,70},{200001,0,1,70},{200002,0,1,70},{200003,0,1,70},{200006,0,1,70},{200010,0,1,70},{200011,0,1,70},{200012,0,1,70},{200013,0,1,70},{200015,0,1,70},{200016,0,1,70},{200017,0,1,70},{200019,0,1,70},{201000,0,1,70},{201001,0,1,70},{201002,0,1,70},{201003,0,1,70},{201006,0,1,70},{201010,0,1,70},{201011,0,1,70},{201012,0,1,70},{201013,0,1,70},{201015,0,1,70},{201016,0,1,70},{201017,0,1,70},{201019,0,1,70},{202000,0,1,70},{202001,0,1,30}, | AB31: 202001 | AC31: 轻盔 | AD31: 1 | AE31: 0 | AF31: 1 | AG31: 40 | AH31: ="{"&RC[-6]&","&RC[-3]&","&RC[-2]&","&RC[-1]&"}," -> {202001,0,1,40}, | AI31: =R[-1]C&RC[-1] -> {200000,0,1,60},{200001,0,1,60},{200002,0,1,60},{200003,0,1,60},{200006,0,1,60},{200010,0,1,60},{200011,0,1,60},{200012,0,1,60},{200013,0,1,60},{200015,0,1,60},{200016,0,1,60},{200017,0,1,60},{200019,0,1,60},{201000,0,1,60},{201001,0,1,60},{201002,0,1,60},{201003,0,1,60},{201006,0,1,60},{201010,0,1,60},{201011,0,1,60},{201012,0,1,60},{201013,0,1,60},{201015,0,1,60},{201016,0,1,60},{201017,0,1,60},{201019,0,1,60},{202000,0,1,60},{202001,0,1,40}, | AK31: 202001 | AL31: 轻盔 | AM31: 1 | AN31: 0 | AO31: 1 | AP31: 50 | AQ31: ="{"&RC[-6]&","&RC[-3]&","&RC[-2]&","&RC[-1]&"}," -> {202001,0,1,50}, | AR31: =R[-1]C&RC[-1] -> {200000,0,1,50},{200001,0,1,50},{200002,0,1,50},{200003,0,1,50},{200006,0,1,50},{200010,0,1,50},{200011,0,1,50},{200012,0,1,50},{200013,0,1,50},{200015,0,1,50},{200016,0,1,50},{200017,0,1,50},{200019,0,1,50},{201000,0,1,50},{201001,0,1,50},{201002,0,1,50},{201003,0,1,50},{201006,0,1,50},{201010,0,1,50},{201011,0,1,50},{201012,0,1,50},{201013,0,1,50},{201015,0,1,50},{201016,0,1,50},{201017,0,1,50},{201019,0,1,50},{202000,0,1,50},{202001,0,1,50},
J32: 110010 | K32: 普通武装碎片 | M32: 0 | N32: 1 | O32: 50 | P32: ="{"&RC[-6]&","&RC[-3]&","&RC[-2]&","&RC[-1]&"}," -> {110010,0,1,50}, | Q32: =R[-1]C&RC[-1] -> {200000,0,1,60},{200001,0,1,60},{200002,0,1,60},{200003,0,1,60},{200006,0,1,60},{200010,0,1,60},{200011,0,1,60},{200012,0,1,60},{201000,0,1,60},{201001,0,1,60},{201002,0,1,60},{201003,0,1,60},{201006,0,1,60},{201010,0,1,60},{201011,0,1,60},{201012,0,1,60},{202000,0,1,60},{202001,0,1,60},{202002,0,1,60},{202003,0,1,60},{202006,0,1,60},{202010,0,1,60},{202011,0,1,60},{202012,0,1,60},{110002,0,1,0},{110003,0,1,0},{110004,0,1,100},{110005,0,1,100},{110010,0,1,50}, | S32: 202002 | T32: 铂金戒指 | U32: 1 | V32: 0 | W32: 1 | X32: 30 | Y32: ="{"&RC[-6]&","&RC[-3]&","&RC[-2]&","&RC[-1]&"}," -> {202002,0,1,30}, | Z32: =R[-1]C&RC[-1] -> {200000,0,1,70},{200001,0,1,70},{200002,0,1,70},{200003,0,1,70},{200006,0,1,70},{200010,0,1,70},{200011,0,1,70},{200012,0,1,70},{200013,0,1,70},{200015,0,1,70},{200016,0,1,70},{200017,0,1,70},{200019,0,1,70},{201000,0,1,70},{201001,0,1,70},{201002,0,1,70},{201003,0,1,70},{201006,0,1,70},{201010,0,1,70},{201011,0,1,70},{201012,0,1,70},{201013,0,1,70},{201015,0,1,70},{201016,0,1,70},{201017,0,1,70},{201019,0,1,70},{202000,0,1,70},{202001,0,1,30},{202002,0,1,30}, | AB32: 202002 | AC32: 铂金戒指 | AD32: 1 | AE32: 0 | AF32: 1 | AG32: 40 | AH32: ="{"&RC[-6]&","&RC[-3]&","&RC[-2]&","&RC[-1]&"}," -> {202002,0,1,40}, | AI32: =R[-1]C&RC[-1] -> {200000,0,1,60},{200001,0,1,60},{200002,0,1,60},{200003,0,1,60},{200006,0,1,60},{200010,0,1,60},{200011,0,1,60},{200012,0,1,60},{200013,0,1,60},{200015,0,1,60},{200016,0,1,60},{200017,0,1,60},{200019,0,1,60},{201000,0,1,60},{201001,0,1,60},{201002,0,1,60},{201003,0,1,60},{201006,0,1,60},{201010,0,1,60},{201011,0,1,60},{201012,0,1,60},{201013,0,1,60},{201015,0,1,60},{201016,0,1,60},{201017,0,1,60},{201019,0,1,60},{202000,0,1,60},{202001,0,1,40},{202002,0,1,40}, | AK32: 202002 | AL32: 铂金戒指 | AM32: 1 | AN32: 0 | AO32: 1 | AP32: 50 | AQ32: ="{"&RC[-6]&","&RC[-3]&","&RC[-2]&","&RC[-1]&"}," -> {202002,0,1,50}, | AR32: =R[-1]C&RC[-1] -> {200000,0,1,50},{200001,0,1,50},{200002,0,1,50},{200003,0,1,50},{200006,0,1,50},{200010,0,1,50},{200011,0,1,50},{200012,0,1,50},{200013,0,1,50},{200015,0,1,50},{200016,0,1,50},{200017,0,1,50},{200019,0,1,50},{201000,0,1,50},{201001,0,1,50},{201002,0,1,50},{201003,0,1,50},{201006,0,1,50},{201010,0,1,50},{201011,0,1,50},{201012,0,1,50},{201013,0,1,50},{201015,0,1,50},{201016,0,1,50},{201017,0,1,50},{201019,0,1,50},{202000,0,1,50},{202001,0,1,50},{202002,0,1,50},
B33: 掉落配置: [{职业限制, [{数量, 概率}, …], [{物品id, 是否绑定, 数量, 概率}, …]}, …] | J33: 110011 | K33: 普通防具碎片 | M33: 0 | N33: 1 | O33: 50 | P33: ="{"&RC[-6]&","&RC[-3]&","&RC[-2]&","&RC[-1]&"}," -> {110011,0,1,50}, | Q33: =R[-1]C&RC[-1] -> {200000,0,1,60},{200001,0,1,60},{200002,0,1,60},{200003,0,1,60},{200006,0,1,60},{200010,0,1,60},{200011,0,1,60},{200012,0,1,60},{201000,0,1,60},{201001,0,1,60},{201002,0,1,60},{201003,0,1,60},{201006,0,1,60},{201010,0,1,60},{201011,0,1,60},{201012,0,1,60},{202000,0,1,60},{202001,0,1,60},{202002,0,1,60},{202003,0,1,60},{202006,0,1,60},{202010,0,1,60},{202011,0,1,60},{202012,0,1,60},{110002,0,1,0},{110003,0,1,0},{110004,0,1,100},{110005,0,1,100},{110010,0,1,50},{110011,0,1,50}, | S33: 202003 | T33: 三眼手镯 | U33: 1 | V33: 0 | W33: 1 | X33: 30 | Y33: ="{"&RC[-6]&","&RC[-3]&","&RC[-2]&","&RC[-1]&"}," -> {202003,0,1,30}, | Z33: =R[-1]C&RC[-1] -> {200000,0,1,70},{200001,0,1,70},{200002,0,1,70},{200003,0,1,70},{200006,0,1,70},{200010,0,1,70},{200011,0,1,70},{200012,0,1,70},{200013,0,1,70},{200015,0,1,70},{200016,0,1,70},{200017,0,1,70},{200019,0,1,70},{201000,0,1,70},{201001,0,1,70},{201002,0,1,70},{201003,0,1,70},{201006,0,1,70},{201010,0,1,70},{201011,0,1,70},{201012,0,1,70},{201013,0,1,70},{201015,0,1,70},{201016,0,1,70},{201017,0,1,70},{201019,0,1,70},{202000,0,1,70},{202001,0,1,30},{202002,0,1,30},{202003,0,1,30}, | AB33: 202003 | AC33: 三眼手镯 | AD33: 1 | AE33: 0 | AF33: 1 | AG33: 40 | AH33: ="{"&RC[-6]&","&RC[-3]&","&RC[-2]&","&RC[-1]&"}," -> {202003,0,1,40}, | AI33: =R[-1]C&RC[-1] -> {200000,0,1,60},{200001,0,1,60},{200002,0,1,60},{200003,0,1,60},{200006,0,1,60},{200010,0,1,60},{200011,0,1,60},{200012,0,1,60},{200013,0,1,60},{200015,0,1,60},{200016,0,1,60},{200017,0,1,60},{200019,0,1,60},{201000,0,1,60},{201001,0,1,60},{201002,0,1,60},{201003,0,1,60},{201006,0,1,60},{201010,0,1,60},{201011,0,1,60},{201012,0,1,60},{201013,0,1,60},{201015,0,1,60},{201016,0,1,60},{201017,0,1,60},{201019,0,1,60},{202000,0,1,60},{202001,0,1,40},{202002,0,1,40},{202003,0,1,40}, | AK33: 202003 | AL33: 三眼手镯 | AM33: 1 | AN33: 0 | AO33: 1 | AP33: 50 | AQ33: ="{"&RC[-6]&","&RC[-3]&","&RC[-2]&","&RC[-1]&"}," -> {202003,0,1,50}, | AR33: =R[-1]C&RC[-1] -> {200000,0,1,50},{200001,0,1,50},{200002,0,1,50},{200003,0,1,50},{200006,0,1,50},{200010,0,1,50},{200011,0,1,50},{200012,0,1,50},{200013,0,1,50},{200015,0,1,50},{200016,0,1,50},{200017,0,1,50},{200019,0,1,50},{201000,0,1,50},{201001,0,1,50},{201002,0,1,50},{201003,0,1,50},{201006,0,1,50},{201010,0,1,50},{201011,0,1,50},{201012,0,1,50},{201013,0,1,50},{201015,0,1,50},{201016,0,1,50},{201017,0,1,50},{201019,0,1,50},{202000,0,1,50},{202001,0,1,50},{202002,0,1,50},{202003,0,1,50},
B34: 0非绑定，1绑定 | J34: 110012 | K34: 普通首饰碎片 | M34: 0 | N34: 1 | O34: 50 | P34: ="{"&RC[-6]&","&RC[-3]&","&RC[-2]&","&RC[-1]&"}," -> {110012,0,1,50}, | Q34: =R[-1]C&RC[-1] -> {200000,0,1,60},{200001,0,1,60},{200002,0,1,60},{200003,0,1,60},{200006,0,1,60},{200010,0,1,60},{200011,0,1,60},{200012,0,1,60},{201000,0,1,60},{201001,0,1,60},{201002,0,1,60},{201003,0,1,60},{201006,0,1,60},{201010,0,1,60},{201011,0,1,60},{201012,0,1,60},{202000,0,1,60},{202001,0,1,60},{202002,0,1,60},{202003,0,1,60},{202006,0,1,60},{202010,0,1,60},{202011,0,1,60},{202012,0,1,60},{110002,0,1,0},{110003,0,1,0},{110004,0,1,100},{110005,0,1,100},{110010,0,1,50},{110011,0,1,50},{110012,0,1,50}, | S34: 202006 | T34: 凤凰明珠 | U34: 1 | V34: 0 | W34: 1 | X34: 30 | Y34: ="{"&RC[-6]&","&RC[-3]&","&RC[-2]&","&RC[-1]&"}," -> {202006,0,1,30}, | Z34: =R[-1]C&RC[-1] -> {200000,0,1,70},{200001,0,1,70},{200002,0,1,70},{200003,0,1,70},{200006,0,1,70},{200010,0,1,70},{200011,0,1,70},{200012,0,1,70},{200013,0,1,70},{200015,0,1,70},{200016,0,1,70},{200017,0,1,70},{200019,0,1,70},{201000,0,1,70},{201001,0,1,70},{201002,0,1,70},{201003,0,1,70},{201006,0,1,70},{201010,0,1,70},{201011,0,1,70},{201012,0,1,70},{201013,0,1,70},{201015,0,1,70},{201016,0,1,70},{201017,0,1,70},{201019,0,1,70},{202000,0,1,70},{202001,0,1,30},{202002,0,1,30},{202003,0,1,30},{202006,0,1,30}, | AB34: 202006 | AC34: 凤凰明珠 | AD34: 1 | AE34: 0 | AF34: 1 | AG34: 40 | AH34: ="{"&RC[-6]&","&RC[-3]&","&RC[-2]&","&RC[-1]&"}," -> {202006,0,1,40}, | AI34: =R[-1]C&RC[-1] -> {200000,0,1,60},{200001,0,1,60},{200002,0,1,60},{200003,0,1,60},{200006,0,1,60},{200010,0,1,60},{200011,0,1,60},{200012,0,1,60},{200013,0,1,60},{200015,0,1,60},{200016,0,1,60},{200017,0,1,60},{200019,0,1,60},{201000,0,1,60},{201001,0,1,60},{201002,0,1,60},{201003,0,1,60},{201006,0,1,60},{201010,0,1,60},{201011,0,1,60},{201012,0,1,60},{201013,0,1,60},{201015,0,1,60},{201016,0,1,60},{201017,0,1,60},{201019,0,1,60},{202000,0,1,60},{202001,0,1,40},{202002,0,1,40},{202003,0,1,40},{202006,0,1,40}, | AK34: 202006 | AL34: 凤凰明珠 | AM34: 1 | AN34: 0 | AO34: 1 | AP34: 50 | AQ34: ="{"&RC[-6]&","&RC[-3]&","&RC[-2]&","&RC[-1]&"}," -> {202006,0,1,50}, | AR34: =R[-1]C&RC[-1] -> {200000,0,1,50},{200001,0,1,50},{200002,0,1,50},{200003,0,1,50},{200006,0,1,50},{200010,0,1,50},{200011,0,1,50},{200012,0,1,50},{200013,0,1,50},{200015,0,1,50},{200016,0,1,50},{200017,0,1,50},{200019,0,1,50},{201000,0,1,50},{201001,0,1,50},{201002,0,1,50},{201003,0,1,50},{201006,0,1,50},{201010,0,1,50},{201011,0,1,50},{201012,0,1,50},{201013,0,1,50},{201015,0,1,50},{201016,0,1,50},{201017,0,1,50},{201019,0,1,50},{202000,0,1,50},{202001,0,1,50},{202002,0,1,50},{202003,0,1,50},{202006,0,1,50},
J35: 110009 | K35: 金币 | M35: 0 | N35: 2 | O35: 100 | P35: ="{"&RC[-6]&","&RC[-3]&","&RC[-2]&","&RC[-1]&"}," -> {110009,0,2,100}, | Q35: =R[-1]C&RC[-1] -> {200000,0,1,60},{200001,0,1,60},{200002,0,1,60},{200003,0,1,60},{200006,0,1,60},{200010,0,1,60},{200011,0,1,60},{200012,0,1,60},{201000,0,1,60},{201001,0,1,60},{201002,0,1,60},{201003,0,1,60},{201006,0,1,60},{201010,0,1,60},{201011,0,1,60},{201012,0,1,60},{202000,0,1,60},{202001,0,1,60},{202002,0,1,60},{202003,0,1,60},{202006,0,1,60},{202010,0,1,60},{202011,0,1,60},{202012,0,1,60},{110002,0,1,0},{110003,0,1,0},{110004,0,1,100},{110005,0,1,100},{110010,0,1,50},{110011,0,1,50},{110012,0,1,50},{110009,0,2,100}, | S35: 202010 | T35: 银蛇 | U35: 1 | V35: 0 | W35: 1 | X35: 30 | Y35: ="{"&RC[-6]&","&RC[-3]&","&RC[-2]&","&RC[-1]&"}," -> {202010,0,1,30}, | Z35: =R[-1]C&RC[-1] -> {200000,0,1,70},{200001,0,1,70},{200002,0,1,70},{200003,0,1,70},{200006,0,1,70},{200010,0,1,70},{200011,0,1,70},{200012,0,1,70},{200013,0,1,70},{200015,0,1,70},{200016,0,1,70},{200017,0,1,70},{200019,0,1,70},{201000,0,1,70},{201001,0,1,70},{201002,0,1,70},{201003,0,1,70},{201006,0,1,70},{201010,0,1,70},{201011,0,1,70},{201012,0,1,70},{201013,0,1,70},{201015,0,1,70},{201016,0,1,70},{201017,0,1,70},{201019,0,1,70},{202000,0,1,70},{202001,0,1,30},{202002,0,1,30},{202003,0,1,30},{202006,0,1,30},{202010,0,1,30}, | AB35: 202010 | AC35: 银蛇 | AD35: 1 | AE35: 0 | AF35: 1 | AG35: 40 | AH35: ="{"&RC[-6]&","&RC[-3]&","&RC[-2]&","&RC[-1]&"}," -> {202010,0,1,40}, | AI35: =R[-1]C&RC[-1] -> {200000,0,1,60},{200001,0,1,60},{200002,0,1,60},{200003,0,1,60},{200006,0,1,60},{200010,0,1,60},{200011,0,1,60},{200012,0,1,60},{200013,0,1,60},{200015,0,1,60},{200016,0,1,60},{200017,0,1,60},{200019,0,1,60},{201000,0,1,60},{201001,0,1,60},{201002,0,1,60},{201003,0,1,60},{201006,0,1,60},{201010,0,1,60},{201011,0,1,60},{201012,0,1,60},{201013,0,1,60},{201015,0,1,60},{201016,0,1,60},{201017,0,1,60},{201019,0,1,60},{202000,0,1,60},{202001,0,1,40},{202002,0,1,40},{202003,0,1,40},{202006,0,1,40},{202010,0,1,40}, | AK35: 202010 | AL35: 银蛇 | AM35: 1 | AN35: 0 | AO35: 1 | AP35: 50 | AQ35: ="{"&RC[-6]&","&RC[-3]&","&RC[-2]&","&RC[-1]&"}," -> {202010,0,1,50}, | AR35: =R[-1]C&RC[-1] -> {200000,0,1,50},{200001,0,1,50},{200002,0,1,50},{200003,0,1,50},{200006,0,1,50},{200010,0,1,50},{200011,0,1,50},{200012,0,1,50},{200013,0,1,50},{200015,0,1,50},{200016,0,1,50},{200017,0,1,50},{200019,0,1,50},{201000,0,1,50},{201001,0,1,50},{201002,0,1,50},{201003,0,1,50},{201006,0,1,50},{201010,0,1,50},{201011,0,1,50},{201012,0,1,50},{201013,0,1,50},{201015,0,1,50},{201016,0,1,50},{201017,0,1,50},{201019,0,1,50},{202000,0,1,50},{202001,0,1,50},{202002,0,1,50},{202003,0,1,50},{202006,0,1,50},{202010,0,1,50},
J36: 110023 | K36: 烈火剑法书 | L36: 1 | M36: 0 | N36: 1 | O36: 2 | P36: ="{"&RC[-6]&","&RC[-3]&","&RC[-2]&","&RC[-1]&"}," -> {110023,0,1,2}, | Q36: =R[-1]C&RC[-1] -> {200000,0,1,60},{200001,0,1,60},{200002,0,1,60},{200003,0,1,60},{200006,0,1,60},{200010,0,1,60},{200011,0,1,60},{200012,0,1,60},{201000,0,1,60},{201001,0,1,60},{201002,0,1,60},{201003,0,1,60},{201006,0,1,60},{201010,0,1,60},{201011,0,1,60},{201012,0,1,60},{202000,0,1,60},{202001,0,1,60},{202002,0,1,60},{202003,0,1,60},{202006,0,1,60},{202010,0,1,60},{202011,0,1,60},{202012,0,1,60},{110002,0,1,0},{110003,0,1,0},{110004,0,1,100},{110005,0,1,100},{110010,0,1,50},{110011,0,1,50},{110012,0,1,50},{110009,0,2,100},{110023,0,1,2}, | S36: 202011 | T36: 天珠道链 | U36: 1 | V36: 0 | W36: 1 | X36: 30 | Y36: ="{"&RC[-6]&","&RC[-3]&","&RC[-2]&","&RC[-1]&"}," -> {202011,0,1,30}, | Z36: =R[-1]C&RC[-1] -> {200000,0,1,70},{200001,0,1,70},{200002,0,1,70},{200003,0,1,70},{200006,0,1,70},{200010,0,1,70},{200011,0,1,70},{200012,0,1,70},{200013,0,1,70},{200015,0,1,70},{200016,0,1,70},{200017,0,1,70},{200019,0,1,70},{201000,0,1,70},{201001,0,1,70},{201002,0,1,70},{201003,0,1,70},{201006,0,1,70},{201010,0,1,70},{201011,0,1,70},{201012,0,1,70},{201013,0,1,70},{201015,0,1,70},{201016,0,1,70},{201017,0,1,70},{201019,0,1,70},{202000,0,1,70},{202001,0,1,30},{202002,0,1,30},{202003,0,1,30},{202006,0,1,30},{202010,0,1,30},{202011,0,1,30}, | AB36: 202011 | AC36: 天珠道链 | AD36: 1 | AE36: 0 | AF36: 1 | AG36: 40 | AH36: ="{"&RC[-6]&","&RC[-3]&","&RC[-2]&","&RC[-1]&"}," -> {202011,0,1,40}, | AI36: =R[-1]C&RC[-1] -> {200000,0,1,60},{200001,0,1,60},{200002,0,1,60},{200003,0,1,60},{200006,0,1,60},{200010,0,1,60},{200011,0,1,60},{200012,0,1,60},{200013,0,1,60},{200015,0,1,60},{200016,0,1,60},{200017,0,1,60},{200019,0,1,60},{201000,0,1,60},{201001,0,1,60},{201002,0,1,60},{201003,0,1,60},{201006,0,1,60},{201010,0,1,60},{201011,0,1,60},{201012,0,1,60},{201013,0,1,60},{201015,0,1,60},{201016,0,1,60},{201017,0,1,60},{201019,0,1,60},{202000,0,1,60},{202001,0,1,40},{202002,0,1,40},{202003,0,1,40},{202006,0,1,40},{202010,0,1,40},{202011,0,1,40}, | AK36: 202011 | AL36: 天珠道链 | AM36: 1 | AN36: 0 | AO36: 1 | AP36: 50 | AQ36: ="{"&RC[-6]&","&RC[-3]&","&RC[-2]&","&RC[-1]&"}," -> {202011,0,1,50}, | AR36: =R[-1]C&RC[-1] -> {200000,0,1,50},{200001,0,1,50},{200002,0,1,50},{200003,0,1,50},{200006,0,1,50},{200010,0,1,50},{200011,0,1,50},{200012,0,1,50},{200013,0,1,50},{200015,0,1,50},{200016,0,1,50},{200017,0,1,50},{200019,0,1,50},{201000,0,1,50},{201001,0,1,50},{201002,0,1,50},{201003,0,1,50},{201006,0,1,50},{201010,0,1,50},{201011,0,1,50},{201012,0,1,50},{201013,0,1,50},{201015,0,1,50},{201016,0,1,50},{201017,0,1,50},{201019,0,1,50},{202000,0,1,50},{202001,0,1,50},{202002,0,1,50},{202003,0,1,50},{202006,0,1,50},{202010,0,1,50},{202011,0,1,50},
J37: 110024 | K37: 狂风斩书 | L37: 1 | M37: 0 | N37: 1 | O37: 2 | P37: ="{"&RC[-6]&","&RC[-3]&","&RC[-2]&","&RC[-1]&"}," -> {110024,0,1,2}, | Q37: =R[-1]C&RC[-1] -> {200000,0,1,60},{200001,0,1,60},{200002,0,1,60},{200003,0,1,60},{200006,0,1,60},{200010,0,1,60},{200011,0,1,60},{200012,0,1,60},{201000,0,1,60},{201001,0,1,60},{201002,0,1,60},{201003,0,1,60},{201006,0,1,60},{201010,0,1,60},{201011,0,1,60},{201012,0,1,60},{202000,0,1,60},{202001,0,1,60},{202002,0,1,60},{202003,0,1,60},{202006,0,1,60},{202010,0,1,60},{202011,0,1,60},{202012,0,1,60},{110002,0,1,0},{110003,0,1,0},{110004,0,1,100},{110005,0,1,100},{110010,0,1,50},{110011,0,1,50},{110012,0,1,50},{110009,0,2,100},{110023,0,1,2},{110024,0,1,2}, | S37: 202012 | T37: 灵魂道袍 | U37: 1 | V37: 0 | W37: 1 | X37: 30 | Y37: ="{"&RC[-6]&","&RC[-3]&","&RC[-2]&","&RC[-1]&"}," -> {202012,0,1,30}, | Z37: =R[-1]C&RC[-1] -> {200000,0,1,70},{200001,0,1,70},{200002,0,1,70},{200003,0,1,70},{200006,0,1,70},{200010,0,1,70},{200011,0,1,70},{200012,0,1,70},{200013,0,1,70},{200015,0,1,70},{200016,0,1,70},{200017,0,1,70},{200019,0,1,70},{201000,0,1,70},{201001,0,1,70},{201002,0,1,70},{201003,0,1,70},{201006,0,1,70},{201010,0,1,70},{201011,0,1,70},{201012,0,1,70},{201013,0,1,70},{201015,0,1,70},{201016,0,1,70},{201017,0,1,70},{201019,0,1,70},{202000,0,1,70},{202001,0,1,30},{202002,0,1,30},{202003,0,1,30},{202006,0,1,30},{202010,0,1,30},{202011,0,1,30},{202012,0,1,30}, | AB37: 202012 | AC37: 灵魂道袍 | AD37: 1 | AE37: 0 | AF37: 1 | AG37: 40 | AH37: ="{"&RC[-6]&","&RC[-3]&","&RC[-2]&","&RC[-1]&"}," -> {202012,0,1,40}, | AI37: =R[-1]C&RC[-1] -> {200000,0,1,60},{200001,0,1,60},{200002,0,1,60},{200003,0,1,60},{200006,0,1,60},{200010,0,1,60},{200011,0,1,60},{200012,0,1,60},{200013,0,1,60},{200015,0,1,60},{200016,0,1,60},{200017,0,1,60},{200019,0,1,60},{201000,0,1,60},{201001,0,1,60},{201002,0,1,60},{201003,0,1,60},{201006,0,1,60},{201010,0,1,60},{201011,0,1,60},{201012,0,1,60},{201013,0,1,60},{201015,0,1,60},{201016,0,1,60},{201017,0,1,60},{201019,0,1,60},{202000,0,1,60},{202001,0,1,40},{202002,0,1,40},{202003,0,1,40},{202006,0,1,40},{202010,0,1,40},{202011,0,1,40},{202012,0,1,40}, | AK37: 202012 | AL37: 灵魂道袍 | AM37: 1 | AN37: 0 | AO37: 1 | AP37: 50 | AQ37: ="{"&RC[-6]&","&RC[-3]&","&RC[-2]&","&RC[-1]&"}," -> {202012,0,1,50}, | AR37: =R[-1]C&RC[-1] -> {200000,0,1,50},{200001,0,1,50},{200002,0,1,50},{200003,0,1,50},{200006,0,1,50},{200010,0,1,50},{200011,0,1,50},{200012,0,1,50},{200013,0,1,50},{200015,0,1,50},{200016,0,1,50},{200017,0,1,50},{200019,0,1,50},{201000,0,1,50},{201001,0,1,50},{201002,0,1,50},{201003,0,1,50},{201006,0,1,50},{201010,0,1,50},{201011,0,1,50},{201012,0,1,50},{201013,0,1,50},{201015,0,1,50},{201016,0,1,50},{201017,0,1,50},{201019,0,1,50},{202000,0,1,50},{202001,0,1,50},{202002,0,1,50},{202003,0,1,50},{202006,0,1,50},{202010,0,1,50},{202011,0,1,50},{202012,0,1,50},
J38: 110025 | K38: 逐日剑法书 | L38: 1 | M38: 0 | N38: 1 | O38: 2 | P38: ="{"&RC[-6]&","&RC[-3]&","&RC[-2]&","&RC[-1]&"}," -> {110025,0,1,2}, | Q38: =R[-1]C&RC[-1] -> {200000,0,1,60},{200001,0,1,60},{200002,0,1,60},{200003,0,1,60},{200006,0,1,60},{200010,0,1,60},{200011,0,1,60},{200012,0,1,60},{201000,0,1,60},{201001,0,1,60},{201002,0,1,60},{201003,0,1,60},{201006,0,1,60},{201010,0,1,60},{201011,0,1,60},{201012,0,1,60},{202000,0,1,60},{202001,0,1,60},{202002,0,1,60},{202003,0,1,60},{202006,0,1,60},{202010,0,1,60},{202011,0,1,60},{202012,0,1,60},{110002,0,1,0},{110003,0,1,0},{110004,0,1,100},{110005,0,1,100},{110010,0,1,50},{110011,0,1,50},{110012,0,1,50},{110009,0,2,100},{110023,0,1,2},{110024,0,1,2},{110025,0,1,2}, | S38: 202013 | T38: 泰坦戒指 | U38: 1 | V38: 0 | W38: 1 | X38: 30 | Y38: ="{"&RC[-6]&","&RC[-3]&","&RC[-2]&","&RC[-1]&"}," -> {202013,0,1,30}, | Z38: =R[-1]C&RC[-1] -> {200000,0,1,70},{200001,0,1,70},{200002,0,1,70},{200003,0,1,70},{200006,0,1,70},{200010,0,1,70},{200011,0,1,70},{200012,0,1,70},{200013,0,1,70},{200015,0,1,70},{200016,0,1,70},{200017,0,1,70},{200019,0,1,70},{201000,0,1,70},{201001,0,1,70},{201002,0,1,70},{201003,0,1,70},{201006,0,1,70},{201010,0,1,70},{201011,0,1,70},{201012,0,1,70},{201013,0,1,70},{201015,0,1,70},{201016,0,1,70},{201017,0,1,70},{201019,0,1,70},{202000,0,1,70},{202001,0,1,30},{202002,0,1,30},{202003,0,1,30},{202006,0,1,30},{202010,0,1,30},{202011,0,1,30},{202012,0,1,30},{202013,0,1,30}, | AB38: 202013 | AC38: 泰坦戒指 | AD38: 1 | AE38: 0 | AF38: 1 | AG38: 40 | AH38: ="{"&RC[-6]&","&RC[-3]&","&RC[-2]&","&RC[-1]&"}," -> {202013,0,1,40}, | AI38: =R[-1]C&RC[-1] -> {200000,0,1,60},{200001,0,1,60},{200002,0,1,60},{200003,0,1,60},{200006,0,1,60},{200010,0,1,60},{200011,0,1,60},{200012,0,1,60},{200013,0,1,60},{200015,0,1,60},{200016,0,1,60},{200017,0,1,60},{200019,0,1,60},{201000,0,1,60},{201001,0,1,60},{201002,0,1,60},{201003,0,1,60},{201006,0,1,60},{201010,0,1,60},{201011,0,1,60},{201012,0,1,60},{201013,0,1,60},{201015,0,1,60},{201016,0,1,60},{201017,0,1,60},{201019,0,1,60},{202000,0,1,60},{202001,0,1,40},{202002,0,1,40},{202003,0,1,40},{202006,0,1,40},{202010,0,1,40},{202011,0,1,40},{202012,0,1,40},{202013,0,1,40}, | AK38: 202013 | AL38: 泰坦戒指 | AM38: 1 | AN38: 0 | AO38: 1 | AP38: 50 | AQ38: ="{"&RC[-6]&","&RC[-3]&","&RC[-2]&","&RC[-1]&"}," -> {202013,0,1,50}, | AR38: =R[-1]C&RC[-1] -> {200000,0,1,50},{200001,0,1,50},{200002,0,1,50},{200003,0,1,50},{200006,0,1,50},{200010,0,1,50},{200011,0,1,50},{200012,0,1,50},{200013,0,1,50},{200015,0,1,50},{200016,0,1,50},{200017,0,1,50},{200019,0,1,50},{201000,0,1,50},{201001,0,1,50},{201002,0,1,50},{201003,0,1,50},{201006,0,1,50},{201010,0,1,50},{201011,0,1,50},{201012,0,1,50},{201013,0,1,50},{201015,0,1,50},{201016,0,1,50},{201017,0,1,50},{201019,0,1,50},{202000,0,1,50},{202001,0,1,50},{202002,0,1,50},{202003,0,1,50},{202006,0,1,50},{202010,0,1,50},{202011,0,1,50},{202012,0,1,50},{202013,0,1,50},
J39: 110026 | K39: 灵魂火符书 | L39: 1 | M39: 0 | N39: 1 | O39: 2 | P39: ="{"&RC[-6]&","&RC[-3]&","&RC[-2]&","&RC[-1]&"}," -> {110026,0,1,2}, | Q39: =R[-1]C&RC[-1] -> {200000,0,1,60},{200001,0,1,60},{200002,0,1,60},{200003,0,1,60},{200006,0,1,60},{200010,0,1,60},{200011,0,1,60},{200012,0,1,60},{201000,0,1,60},{201001,0,1,60},{201002,0,1,60},{201003,0,1,60},{201006,0,1,60},{201010,0,1,60},{201011,0,1,60},{201012,0,1,60},{202000,0,1,60},{202001,0,1,60},{202002,0,1,60},{202003,0,1,60},{202006,0,1,60},{202010,0,1,60},{202011,0,1,60},{202012,0,1,60},{110002,0,1,0},{110003,0,1,0},{110004,0,1,100},{110005,0,1,100},{110010,0,1,50},{110011,0,1,50},{110012,0,1,50},{110009,0,2,100},{110023,0,1,2},{110024,0,1,2},{110025,0,1,2},{110026,0,1,2}, | S39: 202015 | T39: 道士头盔 | U39: 1 | V39: 0 | W39: 1 | X39: 30 | Y39: ="{"&RC[-6]&","&RC[-3]&","&RC[-2]&","&RC[-1]&"}," -> {202015,0,1,30}, | Z39: =R[-1]C&RC[-1] -> {200000,0,1,70},{200001,0,1,70},{200002,0,1,70},{200003,0,1,70},{200006,0,1,70},{200010,0,1,70},{200011,0,1,70},{200012,0,1,70},{200013,0,1,70},{200015,0,1,70},{200016,0,1,70},{200017,0,1,70},{200019,0,1,70},{201000,0,1,70},{201001,0,1,70},{201002,0,1,70},{201003,0,1,70},{201006,0,1,70},{201010,0,1,70},{201011,0,1,70},{201012,0,1,70},{201013,0,1,70},{201015,0,1,70},{201016,0,1,70},{201017,0,1,70},{201019,0,1,70},{202000,0,1,70},{202001,0,1,30},{202002,0,1,30},{202003,0,1,30},{202006,0,1,30},{202010,0,1,30},{202011,0,1,30},{202012,0,1,30},{202013,0,1,30},{202015,0,1,30}, | AB39: 202015 | AC39: 道士头盔 | AD39: 1 | AE39: 0 | AF39: 1 | AG39: 40 | AH39: ="{"&RC[-6]&","&RC[-3]&","&RC[-2]&","&RC[-1]&"}," -> {202015,0,1,40}, | AI39: =R[-1]C&RC[-1] -> {200000,0,1,60},{200001,0,1,60},{200002,0,1,60},{200003,0,1,60},{200006,0,1,60},{200010,0,1,60},{200011,0,1,60},{200012,0,1,60},{200013,0,1,60},{200015,0,1,60},{200016,0,1,60},{200017,0,1,60},{200019,0,1,60},{201000,0,1,60},{201001,0,1,60},{201002,0,1,60},{201003,0,1,60},{201006,0,1,60},{201010,0,1,60},{201011,0,1,60},{201012,0,1,60},{201013,0,1,60},{201015,0,1,60},{201016,0,1,60},{201017,0,1,60},{201019,0,1,60},{202000,0,1,60},{202001,0,1,40},{202002,0,1,40},{202003,0,1,40},{202006,0,1,40},{202010,0,1,40},{202011,0,1,40},{202012,0,1,40},{202013,0,1,40},{202015,0,1,40}, | AK39: 202015 | AL39: 道士头盔 | AM39: 1 | AN39: 0 | AO39: 1 | AP39: 50 | AQ39: ="{"&RC[-6]&","&RC[-3]&","&RC[-2]&","&RC[-1]&"}," -> {202015,0,1,50}, | AR39: =R[-1]C&RC[-1] -> {200000,0,1,50},{200001,0,1,50},{200002,0,1,50},{200003,0,1,50},{200006,0,1,50},{200010,0,1,50},{200011,0,1,50},{200012,0,1,50},{200013,0,1,50},{200015,0,1,50},{200016,0,1,50},{200017,0,1,50},{200019,0,1,50},{201000,0,1,50},{201001,0,1,50},{201002,0,1,50},{201003,0,1,50},{201006,0,1,50},{201010,0,1,50},{201011,0,1,50},{201012,0,1,50},{201013,0,1,50},{201015,0,1,50},{201016,0,1,50},{201017,0,1,50},{201019,0,1,50},{202000,0,1,50},{202001,0,1,50},{202002,0,1,50},{202003,0,1,50},{202006,0,1,50},{202010,0,1,50},{202011,0,1,50},{202012,0,1,50},{202013,0,1,50},{202015,0,1,50},
J40: 110030 | K40: 战甲术书 | L40: 1 | M40: 0 | N40: 1 | O40: 2 | P40: ="{"&RC[-6]&","&RC[-3]&","&RC[-2]&","&RC[-1]&"}," -> {110030,0,1,2}, | Q40: =R[-1]C&RC[-1] -> {200000,0,1,60},{200001,0,1,60},{200002,0,1,60},{200003,0,1,60},{200006,0,1,60},{200010,0,1,60},{200011,0,1,60},{200012,0,1,60},{201000,0,1,60},{201001,0,1,60},{201002,0,1,60},{201003,0,1,60},{201006,0,1,60},{201010,0,1,60},{201011,0,1,60},{201012,0,1,60},{202000,0,1,60},{202001,0,1,60},{202002,0,1,60},{202003,0,1,60},{202006,0,1,60},{202010,0,1,60},{202011,0,1,60},{202012,0,1,60},{110002,0,1,0},{110003,0,1,0},{110004,0,1,100},{110005,0,1,100},{110010,0,1,50},{110011,0,1,50},{110012,0,1,50},{110009,0,2,100},{110023,0,1,2},{110024,0,1,2},{110025,0,1,2},{110026,0,1,2},{110030,0,1,2}, | S40: 202016 | T40: 幽灵手镯 | U40: 1 | V40: 0 | W40: 1 | X40: 30 | Y40: ="{"&RC[-6]&","&RC[-3]&","&RC[-2]&","&RC[-1]&"}," -> {202016,0,1,30}, | Z40: =R[-1]C&RC[-1] -> {200000,0,1,70},{200001,0,1,70},{200002,0,1,70},{200003,0,1,70},{200006,0,1,70},{200010,0,1,70},{200011,0,1,70},{200012,0,1,70},{200013,0,1,70},{200015,0,1,70},{200016,0,1,70},{200017,0,1,70},{200019,0,1,70},{201000,0,1,70},{201001,0,1,70},{201002,0,1,70},{201003,0,1,70},{201006,0,1,70},{201010,0,1,70},{201011,0,1,70},{201012,0,1,70},{201013,0,1,70},{201015,0,1,70},{201016,0,1,70},{201017,0,1,70},{201019,0,1,70},{202000,0,1,70},{202001,0,1,30},{202002,0,1,30},{202003,0,1,30},{202006,0,1,30},{202010,0,1,30},{202011,0,1,30},{202012,0,1,30},{202013,0,1,30},{202015,0,1,30},{202016,0,1,30}, | AB40: 202016 | AC40: 幽灵手镯 | AD40: 1 | AE40: 0 | AF40: 1 | AG40: 40 | AH40: ="{"&RC[-6]&","&RC[-3]&","&RC[-2]&","&RC[-1]&"}," -> {202016,0,1,40}, | AI40: =R[-1]C&RC[-1] -> {200000,0,1,60},{200001,0,1,60},{200002,0,1,60},{200003,0,1,60},{200006,0,1,60},{200010,0,1,60},{200011,0,1,60},{200012,0,1,60},{200013,0,1,60},{200015,0,1,60},{200016,0,1,60},{200017,0,1,60},{200019,0,1,60},{201000,0,1,60},{201001,0,1,60},{201002,0,1,60},{201003,0,1,60},{201006,0,1,60},{201010,0,1,60},{201011,0,1,60},{201012,0,1,60},{201013,0,1,60},{201015,0,1,60},{201016,0,1,60},{201017,0,1,60},{201019,0,1,60},{202000,0,1,60},{202001,0,1,40},{202002,0,1,40},{202003,0,1,40},{202006,0,1,40},{202010,0,1,40},{202011,0,1,40},{202012,0,1,40},{202013,0,1,40},{202015,0,1,40},{202016,0,1,40}, | AK40: 202016 | AL40: 幽灵手镯 | AM40: 1 | AN40: 0 | AO40: 1 | AP40: 50 | AQ40: ="{"&RC[-6]&","&RC[-3]&","&RC[-2]&","&RC[-1]&"}," -> {202016,0,1,50}, | AR40: =R[-1]C&RC[-1] -> {200000,0,1,50},{200001,0,1,50},{200002,0,1,50},{200003,0,1,50},{200006,0,1,50},{200010,0,1,50},{200011,0,1,50},{200012,0,1,50},{200013,0,1,50},{200015,0,1,50},{200016,0,1,50},{200017,0,1,50},{200019,0,1,50},{201000,0,1,50},{201001,0,1,50},{201002,0,1,50},{201003,0,1,50},{201006,0,1,50},{201010,0,1,50},{201011,0,1,50},{201012,0,1,50},{201013,0,1,50},{201015,0,1,50},{201016,0,1,50},{201017,0,1,50},{201019,0,1,50},{202000,0,1,50},{202001,0,1,50},{202002,0,1,50},{202003,0,1,50},{202006,0,1,50},{202010,0,1,50},{202011,0,1,50},{202012,0,1,50},{202013,0,1,50},{202015,0,1,50},{202016,0,1,50},
J41: 110031 | K41: 召唤神兽书 | L41: 1 | M41: 0 | N41: 1 | O41: 2 | P41: ="{"&RC[-6]&","&RC[-3]&","&RC[-2]&","&RC[-1]&"}," -> {110031,0,1,2}, | Q41: =R[-1]C&RC[-1] -> {200000,0,1,60},{200001,0,1,60},{200002,0,1,60},{200003,0,1,60},{200006,0,1,60},{200010,0,1,60},{200011,0,1,60},{200012,0,1,60},{201000,0,1,60},{201001,0,1,60},{201002,0,1,60},{201003,0,1,60},{201006,0,1,60},{201010,0,1,60},{201011,0,1,60},{201012,0,1,60},{202000,0,1,60},{202001,0,1,60},{202002,0,1,60},{202003,0,1,60},{202006,0,1,60},{202010,0,1,60},{202011,0,1,60},{202012,0,1,60},{110002,0,1,0},{110003,0,1,0},{110004,0,1,100},{110005,0,1,100},{110010,0,1,50},{110011,0,1,50},{110012,0,1,50},{110009,0,2,100},{110023,0,1,2},{110024,0,1,2},{110025,0,1,2},{110026,0,1,2},{110030,0,1,2},{110031,0,1,2}, | S41: 202017 | T41: 道士腰带 | U41: 1 | V41: 0 | W41: 1 | X41: 30 | Y41: ="{"&RC[-6]&","&RC[-3]&","&RC[-2]&","&RC[-1]&"}," -> {202017,0,1,30}, | Z41: =R[-1]C&RC[-1] -> {200000,0,1,70},{200001,0,1,70},{200002,0,1,70},{200003,0,1,70},{200006,0,1,70},{200010,0,1,70},{200011,0,1,70},{200012,0,1,70},{200013,0,1,70},{200015,0,1,70},{200016,0,1,70},{200017,0,1,70},{200019,0,1,70},{201000,0,1,70},{201001,0,1,70},{201002,0,1,70},{201003,0,1,70},{201006,0,1,70},{201010,0,1,70},{201011,0,1,70},{201012,0,1,70},{201013,0,1,70},{201015,0,1,70},{201016,0,1,70},{201017,0,1,70},{201019,0,1,70},{202000,0,1,70},{202001,0,1,30},{202002,0,1,30},{202003,0,1,30},{202006,0,1,30},{202010,0,1,30},{202011,0,1,30},{202012,0,1,30},{202013,0,1,30},{202015,0,1,30},{202016,0,1,30},{202017,0,1,30}, | AB41: 202017 | AC41: 道士腰带 | AD41: 1 | AE41: 0 | AF41: 1 | AG41: 40 | AH41: ="{"&RC[-6]&","&RC[-3]&","&RC[-2]&","&RC[-1]&"}," -> {202017,0,1,40}, | AI41: =R[-1]C&RC[-1] -> {200000,0,1,60},{200001,0,1,60},{200002,0,1,60},{200003,0,1,60},{200006,0,1,60},{200010,0,1,60},{200011,0,1,60},{200012,0,1,60},{200013,0,1,60},{200015,0,1,60},{200016,0,1,60},{200017,0,1,60},{200019,0,1,60},{201000,0,1,60},{201001,0,1,60},{201002,0,1,60},{201003,0,1,60},{201006,0,1,60},{201010,0,1,60},{201011,0,1,60},{201012,0,1,60},{201013,0,1,60},{201015,0,1,60},{201016,0,1,60},{201017,0,1,60},{201019,0,1,60},{202000,0,1,60},{202001,0,1,40},{202002,0,1,40},{202003,0,1,40},{202006,0,1,40},{202010,0,1,40},{202011,0,1,40},{202012,0,1,40},{202013,0,1,40},{202015,0,1,40},{202016,0,1,40},{202017,0,1,40}, | AK41: 202017 | AL41: 道士腰带 | AM41: 1 | AN41: 0 | AO41: 1 | AP41: 50 | AQ41: ="{"&RC[-6]&","&RC[-3]&","&RC[-2]&","&RC[-1]&"}," -> {202017,0,1,50}, | AR41: =R[-1]C&RC[-1] -> {200000,0,1,50},{200001,0,1,50},{200002,0,1,50},{200003,0,1,50},{200006,0,1,50},{200010,0,1,50},{200011,0,1,50},{200012,0,1,50},{200013,0,1,50},{200015,0,1,50},{200016,0,1,50},{200017,0,1,50},{200019,0,1,50},{201000,0,1,50},{201001,0,1,50},{201002,0,1,50},{201003,0,1,50},{201006,0,1,50},{201010,0,1,50},{201011,0,1,50},{201012,0,1,50},{201013,0,1,50},{201015,0,1,50},{201016,0,1,50},{201017,0,1,50},{201019,0,1,50},{202000,0,1,50},{202001,0,1,50},{202002,0,1,50},{202003,0,1,50},{202006,0,1,50},{202010,0,1,50},{202011,0,1,50},{202012,0,1,50},{202013,0,1,50},{202015,0,1,50},{202016,0,1,50},{202017,0,1,50},
J42: 110032 | K42: 嗜血术书 | L42: 1 | M42: 0 | N42: 1 | O42: 2 | P42: ="{"&RC[-6]&","&RC[-3]&","&RC[-2]&","&RC[-1]&"}," -> {110032,0,1,2}, | Q42: =R[-1]C&RC[-1] -> {200000,0,1,60},{200001,0,1,60},{200002,0,1,60},{200003,0,1,60},{200006,0,1,60},{200010,0,1,60},{200011,0,1,60},{200012,0,1,60},{201000,0,1,60},{201001,0,1,60},{201002,0,1,60},{201003,0,1,60},{201006,0,1,60},{201010,0,1,60},{201011,0,1,60},{201012,0,1,60},{202000,0,1,60},{202001,0,1,60},{202002,0,1,60},{202003,0,1,60},{202006,0,1,60},{202010,0,1,60},{202011,0,1,60},{202012,0,1,60},{110002,0,1,0},{110003,0,1,0},{110004,0,1,100},{110005,0,1,100},{110010,0,1,50},{110011,0,1,50},{110012,0,1,50},{110009,0,2,100},{110023,0,1,2},{110024,0,1,2},{110025,0,1,2},{110026,0,1,2},{110030,0,1,2},{110031,0,1,2},{110032,0,1,2}, | S42: 202019 | T42: 道士鞋子 | U42: 1 | V42: 0 | W42: 1 | X42: 30 | Y42: ="{"&RC[-6]&","&RC[-3]&","&RC[-2]&","&RC[-1]&"}," -> {202019,0,1,30}, | Z42: =R[-1]C&RC[-1] -> {200000,0,1,70},{200001,0,1,70},{200002,0,1,70},{200003,0,1,70},{200006,0,1,70},{200010,0,1,70},{200011,0,1,70},{200012,0,1,70},{200013,0,1,70},{200015,0,1,70},{200016,0,1,70},{200017,0,1,70},{200019,0,1,70},{201000,0,1,70},{201001,0,1,70},{201002,0,1,70},{201003,0,1,70},{201006,0,1,70},{201010,0,1,70},{201011,0,1,70},{201012,0,1,70},{201013,0,1,70},{201015,0,1,70},{201016,0,1,70},{201017,0,1,70},{201019,0,1,70},{202000,0,1,70},{202001,0,1,30},{202002,0,1,30},{202003,0,1,30},{202006,0,1,30},{202010,0,1,30},{202011,0,1,30},{202012,0,1,30},{202013,0,1,30},{202015,0,1,30},{202016,0,1,30},{202017,0,1,30},{202019,0,1,30}, | AB42: 202019 | AC42: 道士鞋子 | AD42: 1 | AE42: 0 | AF42: 1 | AG42: 40 | AH42: ="{"&RC[-6]&","&RC[-3]&","&RC[-2]&","&RC[-1]&"}," -> {202019,0,1,40}, | AI42: =R[-1]C&RC[-1] -> {200000,0,1,60},{200001,0,1,60},{200002,0,1,60},{200003,0,1,60},{200006,0,1,60},{200010,0,1,60},{200011,0,1,60},{200012,0,1,60},{200013,0,1,60},{200015,0,1,60},{200016,0,1,60},{200017,0,1,60},{200019,0,1,60},{201000,0,1,60},{201001,0,1,60},{201002,0,1,60},{201003,0,1,60},{201006,0,1,60},{201010,0,1,60},{201011,0,1,60},{201012,0,1,60},{201013,0,1,60},{201015,0,1,60},{201016,0,1,60},{201017,0,1,60},{201019,0,1,60},{202000,0,1,60},{202001,0,1,40},{202002,0,1,40},{202003,0,1,40},{202006,0,1,40},{202010,0,1,40},{202011,0,1,40},{202012,0,1,40},{202013,0,1,40},{202015,0,1,40},{202016,0,1,40},{202017,0,1,40},{202019,0,1,40}, | AK42: 202019 | AL42: 道士鞋子 | AM42: 1 | AN42: 0 | AO42: 1 | AP42: 50 | AQ42: ="{"&RC[-6]&","&RC[-3]&","&RC[-2]&","&RC[-1]&"}," -> {202019,0,1,50}, | AR42: =R[-1]C&RC[-1] -> {200000,0,1,50},{200001,0,1,50},{200002,0,1,50},{200003,0,1,50},{200006,0,1,50},{200010,0,1,50},{200011,0,1,50},{200012,0,1,50},{200013,0,1,50},{200015,0,1,50},{200016,0,1,50},{200017,0,1,50},{200019,0,1,50},{201000,0,1,50},{201001,0,1,50},{201002,0,1,50},{201003,0,1,50},{201006,0,1,50},{201010,0,1,50},{201011,0,1,50},{201012,0,1,50},{201013,0,1,50},{201015,0,1,50},{201016,0,1,50},{201017,0,1,50},{201019,0,1,50},{202000,0,1,50},{202001,0,1,50},{202002,0,1,50},{202003,0,1,50},{202006,0,1,50},{202010,0,1,50},{202011,0,1,50},{202012,0,1,50},{202013,0,1,50},{202015,0,1,50},{202016,0,1,50},{202017,0,1,50},{202019,0,1,50},
J43: 110033 | K43: 雷电术书 | L43: 1 | M43: 0 | N43: 1 | O43: 2 | P43: ="{"&RC[-6]&","&RC[-3]&","&RC[-2]&","&RC[-1]&"}," -> {110033,0,1,2}, | Q43: =R[-1]C&RC[-1] -> {200000,0,1,60},{200001,0,1,60},{200002,0,1,60},{200003,0,1,60},{200006,0,1,60},{200010,0,1,60},{200011,0,1,60},{200012,0,1,60},{201000,0,1,60},{201001,0,1,60},{201002,0,1,60},{201003,0,1,60},{201006,0,1,60},{201010,0,1,60},{201011,0,1,60},{201012,0,1,60},{202000,0,1,60},{202001,0,1,60},{202002,0,1,60},{202003,0,1,60},{202006,0,1,60},{202010,0,1,60},{202011,0,1,60},{202012,0,1,60},{110002,0,1,0},{110003,0,1,0},{110004,0,1,100},{110005,0,1,100},{110010,0,1,50},{110011,0,1,50},{110012,0,1,50},{110009,0,2,100},{110023,0,1,2},{110024,0,1,2},{110025,0,1,2},{110026,0,1,2},{110030,0,1,2},{110031,0,1,2},{110032,0,1,2},{110033,0,1,2}, | S43: 110002 | T43: 强化石 | V43: 0 | W43: 1 | X43: 0 | Y43: ="{"&RC[-6]&","&RC[-3]&","&RC[-2]&","&RC[-1]&"}," -> {110002,0,1,0}, | Z43: =R[-1]C&RC[-1] -> {200000,0,1,70},{200001,0,1,70},{200002,0,1,70},{200003,0,1,70},{200006,0,1,70},{200010,0,1,70},{200011,0,1,70},{200012,0,1,70},{200013,0,1,70},{200015,0,1,70},{200016,0,1,70},{200017,0,1,70},{200019,0,1,70},{201000,0,1,70},{201001,0,1,70},{201002,0,1,70},{201003,0,1,70},{201006,0,1,70},{201010,0,1,70},{201011,0,1,70},{201012,0,1,70},{201013,0,1,70},{201015,0,1,70},{201016,0,1,70},{201017,0,1,70},{201019,0,1,70},{202000,0,1,70},{202001,0,1,30},{202002,0,1,30},{202003,0,1,30},{202006,0,1,30},{202010,0,1,30},{202011,0,1,30},{202012,0,1,30},{202013,0,1,30},{202015,0,1,30},{202016,0,1,30},{202017,0,1,30},{202019,0,1,30},{110002,0,1,0}, | AB43: 110002 | AC43: 强化石 | AE43: 0 | AF43: 1 | AG43: 0 | AH43: ="{"&RC[-6]&","&RC[-3]&","&RC[-2]&","&RC[-1]&"}," -> {110002,0,1,0}, | AI43: =R[-1]C&RC[-1] -> {200000,0,1,60},{200001,0,1,60},{200002,0,1,60},{200003,0,1,60},{200006,0,1,60},{200010,0,1,60},{200011,0,1,60},{200012,0,1,60},{200013,0,1,60},{200015,0,1,60},{200016,0,1,60},{200017,0,1,60},{200019,0,1,60},{201000,0,1,60},{201001,0,1,60},{201002,0,1,60},{201003,0,1,60},{201006,0,1,60},{201010,0,1,60},{201011,0,1,60},{201012,0,1,60},{201013,0,1,60},{201015,0,1,60},{201016,0,1,60},{201017,0,1,60},{201019,0,1,60},{202000,0,1,60},{202001,0,1,40},{202002,0,1,40},{202003,0,1,40},{202006,0,1,40},{202010,0,1,40},{202011,0,1,40},{202012,0,1,40},{202013,0,1,40},{202015,0,1,40},{202016,0,1,40},{202017,0,1,40},{202019,0,1,40},{110002,0,1,0}, | AK43: 110002 | AL43: 强化石 | AN43: 0 | AO43: 1 | AP43: 0 | AQ43: ="{"&RC[-6]&","&RC[-3]&","&RC[-2]&","&RC[-1]&"}," -> {110002,0,1,0}, | AR43: =R[-1]C&RC[-1] -> {200000,0,1,50},{200001,0,1,50},{200002,0,1,50},{200003,0,1,50},{200006,0,1,50},{200010,0,1,50},{200011,0,1,50},{200012,0,1,50},{200013,0,1,50},{200015,0,1,50},{200016,0,1,50},{200017,0,1,50},{200019,0,1,50},{201000,0,1,50},{201001,0,1,50},{201002,0,1,50},{201003,0,1,50},{201006,0,1,50},{201010,0,1,50},{201011,0,1,50},{201012,0,1,50},{201013,0,1,50},{201015,0,1,50},{201016,0,1,50},{201017,0,1,50},{201019,0,1,50},{202000,0,1,50},{202001,0,1,50},{202002,0,1,50},{202003,0,1,50},{202006,0,1,50},{202010,0,1,50},{202011,0,1,50},{202012,0,1,50},{202013,0,1,50},{202015,0,1,50},{202016,0,1,50},{202017,0,1,50},{202019,0,1,50},{110002,0,1,0},
J44: 110038 | K44: 冰咆哮书 | L44: 1 | M44: 0 | N44: 1 | O44: 2 | P44: ="{"&RC[-6]&","&RC[-3]&","&RC[-2]&","&RC[-1]&"}," -> {110038,0,1,2}, | Q44: =R[-1]C&RC[-1] -> {200000,0,1,60},{200001,0,1,60},{200002,0,1,60},{200003,0,1,60},{200006,0,1,60},{200010,0,1,60},{200011,0,1,60},{200012,0,1,60},{201000,0,1,60},{201001,0,1,60},{201002,0,1,60},{201003,0,1,60},{201006,0,1,60},{201010,0,1,60},{201011,0,1,60},{201012,0,1,60},{202000,0,1,60},{202001,0,1,60},{202002,0,1,60},{202003,0,1,60},{202006,0,1,60},{202010,0,1,60},{202011,0,1,60},{202012,0,1,60},{110002,0,1,0},{110003,0,1,0},{110004,0,1,100},{110005,0,1,100},{110010,0,1,50},{110011,0,1,50},{110012,0,1,50},{110009,0,2,100},{110023,0,1,2},{110024,0,1,2},{110025,0,1,2},{110026,0,1,2},{110030,0,1,2},{110031,0,1,2},{110032,0,1,2},{110033,0,1,2},{110038,0,1,2}, | S44: 110003 | T44: 洗炼石 | V44: 0 | W44: 1 | X44: 0 | Y44: ="{"&RC[-6]&","&RC[-3]&","&RC[-2]&","&RC[-1]&"}," -> {110003,0,1,0}, | Z44: =R[-1]C&RC[-1] -> {200000,0,1,70},{200001,0,1,70},{200002,0,1,70},{200003,0,1,70},{200006,0,1,70},{200010,0,1,70},{200011,0,1,70},{200012,0,1,70},{200013,0,1,70},{200015,0,1,70},{200016,0,1,70},{200017,0,1,70},{200019,0,1,70},{201000,0,1,70},{201001,0,1,70},{201002,0,1,70},{201003,0,1,70},{201006,0,1,70},{201010,0,1,70},{201011,0,1,70},{201012,0,1,70},{201013,0,1,70},{201015,0,1,70},{201016,0,1,70},{201017,0,1,70},{201019,0,1,70},{202000,0,1,70},{202001,0,1,30},{202002,0,1,30},{202003,0,1,30},{202006,0,1,30},{202010,0,1,30},{202011,0,1,30},{202012,0,1,30},{202013,0,1,30},{202015,0,1,30},{202016,0,1,30},{202017,0,1,30},{202019,0,1,30},{110002,0,1,0},{110003,0,1,0}, | AB44: 110003 | AC44: 洗炼石 | AE44: 0 | AF44: 1 | AG44: 0 | AH44: ="{"&RC[-6]&","&RC[-3]&","&RC[-2]&","&RC[-1]&"}," -> {110003,0,1,0}, | AI44: =R[-1]C&RC[-1] -> {200000,0,1,60},{200001,0,1,60},{200002,0,1,60},{200003,0,1,60},{200006,0,1,60},{200010,0,1,60},{200011,0,1,60},{200012,0,1,60},{200013,0,1,60},{200015,0,1,60},{200016,0,1,60},{200017,0,1,60},{200019,0,1,60},{201000,0,1,60},{201001,0,1,60},{201002,0,1,60},{201003,0,1,60},{201006,0,1,60},{201010,0,1,60},{201011,0,1,60},{201012,0,1,60},{201013,0,1,60},{201015,0,1,60},{201016,0,1,60},{201017,0,1,60},{201019,0,1,60},{202000,0,1,60},{202001,0,1,40},{202002,0,1,40},{202003,0,1,40},{202006,0,1,40},{202010,0,1,40},{202011,0,1,40},{202012,0,1,40},{202013,0,1,40},{202015,0,1,40},{202016,0,1,40},{202017,0,1,40},{202019,0,1,40},{110002,0,1,0},{110003,0,1,0}, | AK44: 110003 | AL44: 洗炼石 | AN44: 0 | AO44: 1 | AP44: 0 | AQ44: ="{"&RC[-6]&","&RC[-3]&","&RC[-2]&","&RC[-1]&"}," -> {110003,0,1,0}, | AR44: =R[-1]C&RC[-1] -> {200000,0,1,50},{200001,0,1,50},{200002,0,1,50},{200003,0,1,50},{200006,0,1,50},{200010,0,1,50},{200011,0,1,50},{200012,0,1,50},{200013,0,1,50},{200015,0,1,50},{200016,0,1,50},{200017,0,1,50},{200019,0,1,50},{201000,0,1,50},{201001,0,1,50},{201002,0,1,50},{201003,0,1,50},{201006,0,1,50},{201010,0,1,50},{201011,0,1,50},{201012,0,1,50},{201013,0,1,50},{201015,0,1,50},{201016,0,1,50},{201017,0,1,50},{201019,0,1,50},{202000,0,1,50},{202001,0,1,50},{202002,0,1,50},{202003,0,1,50},{202006,0,1,50},{202010,0,1,50},{202011,0,1,50},{202012,0,1,50},{202013,0,1,50},{202015,0,1,50},{202016,0,1,50},{202017,0,1,50},{202019,0,1,50},{110002,0,1,0},{110003,0,1,0},
J45: 110039 | K45: 抗拒火环书 | L45: 1 | M45: 0 | N45: 1 | O45: 2 | P45: ="{"&RC[-6]&","&RC[-3]&","&RC[-2]&","&RC[-1]&"}," -> {110039,0,1,2}, | Q45: =R[-1]C&RC[-1] -> {200000,0,1,60},{200001,0,1,60},{200002,0,1,60},{200003,0,1,60},{200006,0,1,60},{200010,0,1,60},{200011,0,1,60},{200012,0,1,60},{201000,0,1,60},{201001,0,1,60},{201002,0,1,60},{201003,0,1,60},{201006,0,1,60},{201010,0,1,60},{201011,0,1,60},{201012,0,1,60},{202000,0,1,60},{202001,0,1,60},{202002,0,1,60},{202003,0,1,60},{202006,0,1,60},{202010,0,1,60},{202011,0,1,60},{202012,0,1,60},{110002,0,1,0},{110003,0,1,0},{110004,0,1,100},{110005,0,1,100},{110010,0,1,50},{110011,0,1,50},{110012,0,1,50},{110009,0,2,100},{110023,0,1,2},{110024,0,1,2},{110025,0,1,2},{110026,0,1,2},{110030,0,1,2},{110031,0,1,2},{110032,0,1,2},{110033,0,1,2},{110038,0,1,2},{110039,0,1,2}, | S45: 110004 | T45: 红药 | V45: 0 | W45: 1 | X45: 100 | Y45: ="{"&RC[-6]&","&RC[-3]&","&RC[-2]&","&RC[-1]&"}," -> {110004,0,1,100}, | Z45: =R[-1]C&RC[-1] -> {200000,0,1,70},{200001,0,1,70},{200002,0,1,70},{200003,0,1,70},{200006,0,1,70},{200010,0,1,70},{200011,0,1,70},{200012,0,1,70},{200013,0,1,70},{200015,0,1,70},{200016,0,1,70},{200017,0,1,70},{200019,0,1,70},{201000,0,1,70},{201001,0,1,70},{201002,0,1,70},{201003,0,1,70},{201006,0,1,70},{201010,0,1,70},{201011,0,1,70},{201012,0,1,70},{201013,0,1,70},{201015,0,1,70},{201016,0,1,70},{201017,0,1,70},{201019,0,1,70},{202000,0,1,70},{202001,0,1,30},{202002,0,1,30},{202003,0,1,30},{202006,0,1,30},{202010,0,1,30},{202011,0,1,30},{202012,0,1,30},{202013,0,1,30},{202015,0,1,30},{202016,0,1,30},{202017,0,1,30},{202019,0,1,30},{110002,0,1,0},{110003,0,1,0},{110004,0,1,100}, | AB45: 110004 | AC45: 红药 | AE45: 0 | AF45: 1 | AG45: 100 | AH45: ="{"&RC[-6]&","&RC[-3]&","&RC[-2]&","&RC[-1]&"}," -> {110004,0,1,100}, | AI45: =R[-1]C&RC[-1] -> {200000,0,1,60},{200001,0,1,60},{200002,0,1,60},{200003,0,1,60},{200006,0,1,60},{200010,0,1,60},{200011,0,1,60},{200012,0,1,60},{200013,0,1,60},{200015,0,1,60},{200016,0,1,60},{200017,0,1,60},{200019,0,1,60},{201000,0,1,60},{201001,0,1,60},{201002,0,1,60},{201003,0,1,60},{201006,0,1,60},{201010,0,1,60},{201011,0,1,60},{201012,0,1,60},{201013,0,1,60},{201015,0,1,60},{201016,0,1,60},{201017,0,1,60},{201019,0,1,60},{202000,0,1,60},{202001,0,1,40},{202002,0,1,40},{202003,0,1,40},{202006,0,1,40},{202010,0,1,40},{202011,0,1,40},{202012,0,1,40},{202013,0,1,40},{202015,0,1,40},{202016,0,1,40},{202017,0,1,40},{202019,0,1,40},{110002,0,1,0},{110003,0,1,0},{110004,0,1,100}, | AK45: 110004 | AL45: 红药 | AN45: 0 | AO45: 1 | AP45: 100 | AQ45: ="{"&RC[-6]&","&RC[-3]&","&RC[-2]&","&RC[-1]&"}," -> {110004,0,1,100}, | AR45: =R[-1]C&RC[-1] -> {200000,0,1,50},{200001,0,1,50},{200002,0,1,50},{200003,0,1,50},{200006,0,1,50},{200010,0,1,50},{200011,0,1,50},{200012,0,1,50},{200013,0,1,50},{200015,0,1,50},{200016,0,1,50},{200017,0,1,50},{200019,0,1,50},{201000,0,1,50},{201001,0,1,50},{201002,0,1,50},{201003,0,1,50},{201006,0,1,50},{201010,0,1,50},{201011,0,1,50},{201012,0,1,50},{201013,0,1,50},{201015,0,1,50},{201016,0,1,50},{201017,0,1,50},{201019,0,1,50},{202000,0,1,50},{202001,0,1,50},{202002,0,1,50},{202003,0,1,50},{202006,0,1,50},{202010,0,1,50},{202011,0,1,50},{202012,0,1,50},{202013,0,1,50},{202015,0,1,50},{202016,0,1,50},{202017,0,1,50},{202019,0,1,50},{110002,0,1,0},{110003,0,1,0},{110004,0,1,100},
J46: 110040 | K46: 流星火雨书 | L46: 1 | M46: 0 | N46: 1 | O46: 2 | P46: ="{"&RC[-6]&","&RC[-3]&","&RC[-2]&","&RC[-1]&"}," -> {110040,0,1,2}, | Q46: =R[-1]C&RC[-1] -> {200000,0,1,60},{200001,0,1,60},{200002,0,1,60},{200003,0,1,60},{200006,0,1,60},{200010,0,1,60},{200011,0,1,60},{200012,0,1,60},{201000,0,1,60},{201001,0,1,60},{201002,0,1,60},{201003,0,1,60},{201006,0,1,60},{201010,0,1,60},{201011,0,1,60},{201012,0,1,60},{202000,0,1,60},{202001,0,1,60},{202002,0,1,60},{202003,0,1,60},{202006,0,1,60},{202010,0,1,60},{202011,0,1,60},{202012,0,1,60},{110002,0,1,0},{110003,0,1,0},{110004,0,1,100},{110005,0,1,100},{110010,0,1,50},{110011,0,1,50},{110012,0,1,50},{110009,0,2,100},{110023,0,1,2},{110024,0,1,2},{110025,0,1,2},{110026,0,1,2},{110030,0,1,2},{110031,0,1,2},{110032,0,1,2},{110033,0,1,2},{110038,0,1,2},{110039,0,1,2},{110040,0,1,2}, | S46: 110005 | T46: 蓝药 | V46: 0 | W46: 1 | X46: 100 | Y46: ="{"&RC[-6]&","&RC[-3]&","&RC[-2]&","&RC[-1]&"}," -> {110005,0,1,100}, | Z46: =R[-1]C&RC[-1] -> {200000,0,1,70},{200001,0,1,70},{200002,0,1,70},{200003,0,1,70},{200006,0,1,70},{200010,0,1,70},{200011,0,1,70},{200012,0,1,70},{200013,0,1,70},{200015,0,1,70},{200016,0,1,70},{200017,0,1,70},{200019,0,1,70},{201000,0,1,70},{201001,0,1,70},{201002,0,1,70},{201003,0,1,70},{201006,0,1,70},{201010,0,1,70},{201011,0,1,70},{201012,0,1,70},{201013,0,1,70},{201015,0,1,70},{201016,0,1,70},{201017,0,1,70},{201019,0,1,70},{202000,0,1,70},{202001,0,1,30},{202002,0,1,30},{202003,0,1,30},{202006,0,1,30},{202010,0,1,30},{202011,0,1,30},{202012,0,1,30},{202013,0,1,30},{202015,0,1,30},{202016,0,1,30},{202017,0,1,30},{202019,0,1,30},{110002,0,1,0},{110003,0,1,0},{110004,0,1,100},{110005,0,1,100}, | AB46: 110005 | AC46: 蓝药 | AE46: 0 | AF46: 1 | AG46: 100 | AH46: ="{"&RC[-6]&","&RC[-3]&","&RC[-2]&","&RC[-1]&"}," -> {110005,0,1,100}, | AI46: =R[-1]C&RC[-1] -> {200000,0,1,60},{200001,0,1,60},{200002,0,1,60},{200003,0,1,60},{200006,0,1,60},{200010,0,1,60},{200011,0,1,60},{200012,0,1,60},{200013,0,1,60},{200015,0,1,60},{200016,0,1,60},{200017,0,1,60},{200019,0,1,60},{201000,0,1,60},{201001,0,1,60},{201002,0,1,60},{201003,0,1,60},{201006,0,1,60},{201010,0,1,60},{201011,0,1,60},{201012,0,1,60},{201013,0,1,60},{201015,0,1,60},{201016,0,1,60},{201017,0,1,60},{201019,0,1,60},{202000,0,1,60},{202001,0,1,40},{202002,0,1,40},{202003,0,1,40},{202006,0,1,40},{202010,0,1,40},{202011,0,1,40},{202012,0,1,40},{202013,0,1,40},{202015,0,1,40},{202016,0,1,40},{202017,0,1,40},{202019,0,1,40},{110002,0,1,0},{110003,0,1,0},{110004,0,1,100},{110005,0,1,100}, | AK46: 110005 | AL46: 蓝药 | AN46: 0 | AO46: 1 | AP46: 100 | AQ46: ="{"&RC[-6]&","&RC[-3]&","&RC[-2]&","&RC[-1]&"}," -> {110005,0,1,100}, | AR46: =R[-1]C&RC[-1] -> {200000,0,1,50},{200001,0,1,50},{200002,0,1,50},{200003,0,1,50},{200006,0,1,50},{200010,0,1,50},{200011,0,1,50},{200012,0,1,50},{200013,0,1,50},{200015,0,1,50},{200016,0,1,50},{200017,0,1,50},{200019,0,1,50},{201000,0,1,50},{201001,0,1,50},{201002,0,1,50},{201003,0,1,50},{201006,0,1,50},{201010,0,1,50},{201011,0,1,50},{201012,0,1,50},{201013,0,1,50},{201015,0,1,50},{201016,0,1,50},{201017,0,1,50},{201019,0,1,50},{202000,0,1,50},{202001,0,1,50},{202002,0,1,50},{202003,0,1,50},{202006,0,1,50},{202010,0,1,50},{202011,0,1,50},{202012,0,1,50},{202013,0,1,50},{202015,0,1,50},{202016,0,1,50},{202017,0,1,50},{202019,0,1,50},{110002,0,1,0},{110003,0,1,0},{110004,0,1,100},{110005,0,1,100},
J47: 110067 | K47: 诱惑之光书 | L47: 1 | M47: 0 | N47: 1 | O47: 2 | P47: ="{"&RC[-6]&","&RC[-3]&","&RC[-2]&","&RC[-1]&"}" -> {110067,0,1,2} | Q47: =R[-1]C&RC[-1] -> {200000,0,1,60},{200001,0,1,60},{200002,0,1,60},{200003,0,1,60},{200006,0,1,60},{200010,0,1,60},{200011,0,1,60},{200012,0,1,60},{201000,0,1,60},{201001,0,1,60},{201002,0,1,60},{201003,0,1,60},{201006,0,1,60},{201010,0,1,60},{201011,0,1,60},{201012,0,1,60},{202000,0,1,60},{202001,0,1,60},{202002,0,1,60},{202003,0,1,60},{202006,0,1,60},{202010,0,1,60},{202011,0,1,60},{202012,0,1,60},{110002,0,1,0},{110003,0,1,0},{110004,0,1,100},{110005,0,1,100},{110010,0,1,50},{110011,0,1,50},{110012,0,1,50},{110009,0,2,100},{110023,0,1,2},{110024,0,1,2},{110025,0,1,2},{110026,0,1,2},{110030,0,1,2},{110031,0,1,2},{110032,0,1,2},{110033,0,1,2},{110038,0,1,2},{110039,0,1,2},{110040,0,1,2},{110067,0,1,2} | S47: 110010 | T47: 普通武装碎片 | V47: 0 | W47: 1 | X47: 50 | Y47: ="{"&RC[-6]&","&RC[-3]&","&RC[-2]&","&RC[-1]&"}," -> {110010,0,1,50}, | Z47: =R[-1]C&RC[-1] -> {200000,0,1,70},{200001,0,1,70},{200002,0,1,70},{200003,0,1,70},{200006,0,1,70},{200010,0,1,70},{200011,0,1,70},{200012,0,1,70},{200013,0,1,70},{200015,0,1,70},{200016,0,1,70},{200017,0,1,70},{200019,0,1,70},{201000,0,1,70},{201001,0,1,70},{201002,0,1,70},{201003,0,1,70},{201006,0,1,70},{201010,0,1,70},{201011,0,1,70},{201012,0,1,70},{201013,0,1,70},{201015,0,1,70},{201016,0,1,70},{201017,0,1,70},{201019,0,1,70},{202000,0,1,70},{202001,0,1,30},{202002,0,1,30},{202003,0,1,30},{202006,0,1,30},{202010,0,1,30},{202011,0,1,30},{202012,0,1,30},{202013,0,1,30},{202015,0,1,30},{202016,0,1,30},{202017,0,1,30},{202019,0,1,30},{110002,0,1,0},{110003,0,1,0},{110004,0,1,100},{110005,0,1,100},{110010,0,1,50}, | AB47: 110010 | AC47: 普通武装碎片 | AE47: 0 | AF47: 1 | AG47: 50 | AH47: ="{"&RC[-6]&","&RC[-3]&","&RC[-2]&","&RC[-1]&"}," -> {110010,0,1,50}, | AI47: =R[-1]C&RC[-1] -> {200000,0,1,60},{200001,0,1,60},{200002,0,1,60},{200003,0,1,60},{200006,0,1,60},{200010,0,1,60},{200011,0,1,60},{200012,0,1,60},{200013,0,1,60},{200015,0,1,60},{200016,0,1,60},{200017,0,1,60},{200019,0,1,60},{201000,0,1,60},{201001,0,1,60},{201002,0,1,60},{201003,0,1,60},{201006,0,1,60},{201010,0,1,60},{201011,0,1,60},{201012,0,1,60},{201013,0,1,60},{201015,0,1,60},{201016,0,1,60},{201017,0,1,60},{201019,0,1,60},{202000,0,1,60},{202001,0,1,40},{202002,0,1,40},{202003,0,1,40},{202006,0,1,40},{202010,0,1,40},{202011,0,1,40},{202012,0,1,40},{202013,0,1,40},{202015,0,1,40},{202016,0,1,40},{202017,0,1,40},{202019,0,1,40},{110002,0,1,0},{110003,0,1,0},{110004,0,1,100},{110005,0,1,100},{110010,0,1,50}, | AK47: 110010 | AL47: 普通武装碎片 | AN47: 0 | AO47: 1 | AP47: 50 | AQ47: ="{"&RC[-6]&","&RC[-3]&","&RC[-2]&","&RC[-1]&"}," -> {110010,0,1,50}, | AR47: =R[-1]C&RC[-1] -> {200000,0,1,50},{200001,0,1,50},{200002,0,1,50},{200003,0,1,50},{200006,0,1,50},{200010,0,1,50},{200011,0,1,50},{200012,0,1,50},{200013,0,1,50},{200015,0,1,50},{200016,0,1,50},{200017,0,1,50},{200019,0,1,50},{201000,0,1,50},{201001,0,1,50},{201002,0,1,50},{201003,0,1,50},{201006,0,1,50},{201010,0,1,50},{201011,0,1,50},{201012,0,1,50},{201013,0,1,50},{201015,0,1,50},{201016,0,1,50},{201017,0,1,50},{201019,0,1,50},{202000,0,1,50},{202001,0,1,50},{202002,0,1,50},{202003,0,1,50},{202006,0,1,50},{202010,0,1,50},{202011,0,1,50},{202012,0,1,50},{202013,0,1,50},{202015,0,1,50},{202016,0,1,50},{202017,0,1,50},{202019,0,1,50},{110002,0,1,0},{110003,0,1,0},{110004,0,1,100},{110005,0,1,100},{110010,0,1,50},
S48: 110011 | T48: 普通防具碎片 | V48: 0 | W48: 1 | X48: 50 | Y48: ="{"&RC[-6]&","&RC[-3]&","&RC[-2]&","&RC[-1]&"}," -> {110011,0,1,50}, | Z48: =R[-1]C&RC[-1] -> {200000,0,1,70},{200001,0,1,70},{200002,0,1,70},{200003,0,1,70},{200006,0,1,70},{200010,0,1,70},{200011,0,1,70},{200012,0,1,70},{200013,0,1,70},{200015,0,1,70},{200016,0,1,70},{200017,0,1,70},{200019,0,1,70},{201000,0,1,70},{201001,0,1,70},{201002,0,1,70},{201003,0,1,70},{201006,0,1,70},{201010,0,1,70},{201011,0,1,70},{201012,0,1,70},{201013,0,1,70},{201015,0,1,70},{201016,0,1,70},{201017,0,1,70},{201019,0,1,70},{202000,0,1,70},{202001,0,1,30},{202002,0,1,30},{202003,0,1,30},{202006,0,1,30},{202010,0,1,30},{202011,0,1,30},{202012,0,1,30},{202013,0,1,30},{202015,0,1,30},{202016,0,1,30},{202017,0,1,30},{202019,0,1,30},{110002,0,1,0},{110003,0,1,0},{110004,0,1,100},{110005,0,1,100},{110010,0,1,50},{110011,0,1,50}, | AB48: 110011 | AC48: 普通防具碎片 | AE48: 0 | AF48: 1 | AG48: 50 | AH48: ="{"&RC[-6]&","&RC[-3]&","&RC[-2]&","&RC[-1]&"}," -> {110011,0,1,50}, | AI48: =R[-1]C&RC[-1] -> {200000,0,1,60},{200001,0,1,60},{200002,0,1,60},{200003,0,1,60},{200006,0,1,60},{200010,0,1,60},{200011,0,1,60},{200012,0,1,60},{200013,0,1,60},{200015,0,1,60},{200016,0,1,60},{200017,0,1,60},{200019,0,1,60},{201000,0,1,60},{201001,0,1,60},{201002,0,1,60},{201003,0,1,60},{201006,0,1,60},{201010,0,1,60},{201011,0,1,60},{201012,0,1,60},{201013,0,1,60},{201015,0,1,60},{201016,0,1,60},{201017,0,1,60},{201019,0,1,60},{202000,0,1,60},{202001,0,1,40},{202002,0,1,40},{202003,0,1,40},{202006,0,1,40},{202010,0,1,40},{202011,0,1,40},{202012,0,1,40},{202013,0,1,40},{202015,0,1,40},{202016,0,1,40},{202017,0,1,40},{202019,0,1,40},{110002,0,1,0},{110003,0,1,0},{110004,0,1,100},{110005,0,1,100},{110010,0,1,50},{110011,0,1,50}, | AK48: 110011 | AL48: 普通防具碎片 | AN48: 0 | AO48: 1 | AP48: 50 | AQ48: ="{"&RC[-6]&","&RC[-3]&","&RC[-2]&","&RC[-1]&"}," -> {110011,0,1,50}, | AR48: =R[-1]C&RC[-1] -> {200000,0,1,50},{200001,0,1,50},{200002,0,1,50},{200003,0,1,50},{200006,0,1,50},{200010,0,1,50},{200011,0,1,50},{200012,0,1,50},{200013,0,1,50},{200015,0,1,50},{200016,0,1,50},{200017,0,1,50},{200019,0,1,50},{201000,0,1,50},{201001,0,1,50},{201002,0,1,50},{201003,0,1,50},{201006,0,1,50},{201010,0,1,50},{201011,0,1,50},{201012,0,1,50},{201013,0,1,50},{201015,0,1,50},{201016,0,1,50},{201017,0,1,50},{201019,0,1,50},{202000,0,1,50},{202001,0,1,50},{202002,0,1,50},{202003,0,1,50},{202006,0,1,50},{202010,0,1,50},{202011,0,1,50},{202012,0,1,50},{202013,0,1,50},{202015,0,1,50},{202016,0,1,50},{202017,0,1,50},{202019,0,1,50},{110002,0,1,0},{110003,0,1,0},{110004,0,1,100},{110005,0,1,100},{110010,0,1,50},{110011,0,1,50},
O49: 掉落数量 | P49: 概率／100 | S49: 110012 | T49: 普通首饰碎片 | V49: 0 | W49: 1 | X49: 50 | Y49: ="{"&RC[-6]&","&RC[-3]&","&RC[-2]&","&RC[-1]&"}," -> {110012,0,1,50}, | Z49: =R[-1]C&RC[-1] -> {200000,0,1,70},{200001,0,1,70},{200002,0,1,70},{200003,0,1,70},{200006,0,1,70},{200010,0,1,70},{200011,0,1,70},{200012,0,1,70},{200013,0,1,70},{200015,0,1,70},{200016,0,1,70},{200017,0,1,70},{200019,0,1,70},{201000,0,1,70},{201001,0,1,70},{201002,0,1,70},{201003,0,1,70},{201006,0,1,70},{201010,0,1,70},{201011,0,1,70},{201012,0,1,70},{201013,0,1,70},{201015,0,1,70},{201016,0,1,70},{201017,0,1,70},{201019,0,1,70},{202000,0,1,70},{202001,0,1,30},{202002,0,1,30},{202003,0,1,30},{202006,0,1,30},{202010,0,1,30},{202011,0,1,30},{202012,0,1,30},{202013,0,1,30},{202015,0,1,30},{202016,0,1,30},{202017,0,1,30},{202019,0,1,30},{110002,0,1,0},{110003,0,1,0},{110004,0,1,100},{110005,0,1,100},{110010,0,1,50},{110011,0,1,50},{110012,0,1,50}, | AB49: 110012 | AC49: 普通首饰碎片 | AE49: 0 | AF49: 1 | AG49: 50 | AH49: ="{"&RC[-6]&","&RC[-3]&","&RC[-2]&","&RC[-1]&"}," -> {110012,0,1,50}, | AI49: =R[-1]C&RC[-1] -> {200000,0,1,60},{200001,0,1,60},{200002,0,1,60},{200003,0,1,60},{200006,0,1,60},{200010,0,1,60},{200011,0,1,60},{200012,0,1,60},{200013,0,1,60},{200015,0,1,60},{200016,0,1,60},{200017,0,1,60},{200019,0,1,60},{201000,0,1,60},{201001,0,1,60},{201002,0,1,60},{201003,0,1,60},{201006,0,1,60},{201010,0,1,60},{201011,0,1,60},{201012,0,1,60},{201013,0,1,60},{201015,0,1,60},{201016,0,1,60},{201017,0,1,60},{201019,0,1,60},{202000,0,1,60},{202001,0,1,40},{202002,0,1,40},{202003,0,1,40},{202006,0,1,40},{202010,0,1,40},{202011,0,1,40},{202012,0,1,40},{202013,0,1,40},{202015,0,1,40},{202016,0,1,40},{202017,0,1,40},{202019,0,1,40},{110002,0,1,0},{110003,0,1,0},{110004,0,1,100},{110005,0,1,100},{110010,0,1,50},{110011,0,1,50},{110012,0,1,50}, | AK49: 110012 | AL49: 普通首饰碎片 | AN49: 0 | AO49: 1 | AP49: 50 | AQ49: ="{"&RC[-6]&","&RC[-3]&","&RC[-2]&","&RC[-1]&"}," -> {110012,0,1,50}, | AR49: =R[-1]C&RC[-1] -> {200000,0,1,50},{200001,0,1,50},{200002,0,1,50},{200003,0,1,50},{200006,0,1,50},{200010,0,1,50},{200011,0,1,50},{200012,0,1,50},{200013,0,1,50},{200015,0,1,50},{200016,0,1,50},{200017,0,1,50},{200019,0,1,50},{201000,0,1,50},{201001,0,1,50},{201002,0,1,50},{201003,0,1,50},{201006,0,1,50},{201010,0,1,50},{201011,0,1,50},{201012,0,1,50},{201013,0,1,50},{201015,0,1,50},{201016,0,1,50},{201017,0,1,50},{201019,0,1,50},{202000,0,1,50},{202001,0,1,50},{202002,0,1,50},{202003,0,1,50},{202006,0,1,50},{202010,0,1,50},{202011,0,1,50},{202012,0,1,50},{202013,0,1,50},{202015,0,1,50},{202016,0,1,50},{202017,0,1,50},{202019,0,1,50},{110002,0,1,0},{110003,0,1,0},{110004,0,1,100},{110005,0,1,100},{110010,0,1,50},{110011,0,1,50},{110012,0,1,50},
O50: 0 | P50: =10000-R[1]C -> 5000 | Q50: ="{"&RC[-2]&","&RC[-1]&"}," -> {0,5000}, | S50: 110009 | T50: 金币 | V50: 0 | W50: 3 | X50: 100 | Y50: ="{"&RC[-6]&","&RC[-3]&","&RC[-2]&","&RC[-1]&"}," -> {110009,0,3,100}, | Z50: =R[-1]C&RC[-1] -> {200000,0,1,70},{200001,0,1,70},{200002,0,1,70},{200003,0,1,70},{200006,0,1,70},{200010,0,1,70},{200011,0,1,70},{200012,0,1,70},{200013,0,1,70},{200015,0,1,70},{200016,0,1,70},{200017,0,1,70},{200019,0,1,70},{201000,0,1,70},{201001,0,1,70},{201002,0,1,70},{201003,0,1,70},{201006,0,1,70},{201010,0,1,70},{201011,0,1,70},{201012,0,1,70},{201013,0,1,70},{201015,0,1,70},{201016,0,1,70},{201017,0,1,70},{201019,0,1,70},{202000,0,1,70},{202001,0,1,30},{202002,0,1,30},{202003,0,1,30},{202006,0,1,30},{202010,0,1,30},{202011,0,1,30},{202012,0,1,30},{202013,0,1,30},{202015,0,1,30},{202016,0,1,30},{202017,0,1,30},{202019,0,1,30},{110002,0,1,0},{110003,0,1,0},{110004,0,1,100},{110005,0,1,100},{110010,0,1,50},{110011,0,1,50},{110012,0,1,50},{110009,0,3,100}, | AB50: 110009 | AC50: 金币 | AE50: 0 | AF50: 4 | AG50: 100 | AH50: ="{"&RC[-6]&","&RC[-3]&","&RC[-2]&","&RC[-1]&"}," -> {110009,0,4,100}, | AI50: =R[-1]C&RC[-1] -> {200000,0,1,60},{200001,0,1,60},{200002,0,1,60},{200003,0,1,60},{200006,0,1,60},{200010,0,1,60},{200011,0,1,60},{200012,0,1,60},{200013,0,1,60},{200015,0,1,60},{200016,0,1,60},{200017,0,1,60},{200019,0,1,60},{201000,0,1,60},{201001,0,1,60},{201002,0,1,60},{201003,0,1,60},{201006,0,1,60},{201010,0,1,60},{201011,0,1,60},{201012,0,1,60},{201013,0,1,60},{201015,0,1,60},{201016,0,1,60},{201017,0,1,60},{201019,0,1,60},{202000,0,1,60},{202001,0,1,40},{202002,0,1,40},{202003,0,1,40},{202006,0,1,40},{202010,0,1,40},{202011,0,1,40},{202012,0,1,40},{202013,0,1,40},{202015,0,1,40},{202016,0,1,40},{202017,0,1,40},{202019,0,1,40},{110002,0,1,0},{110003,0,1,0},{110004,0,1,100},{110005,0,1,100},{110010,0,1,50},{110011,0,1,50},{110012,0,1,50},{110009,0,4,100}, | AK50: 110009 | AL50: 金币 | AN50: 0 | AO50: 5 | AP50: 100 | AQ50: ="{"&RC[-6]&","&RC[-3]&","&RC[-2]&","&RC[-1]&"}," -> {110009,0,5,100}, | AR50: =R[-1]C&RC[-1] -> {200000,0,1,50},{200001,0,1,50},{200002,0,1,50},{200003,0,1,50},{200006,0,1,50},{200010,0,1,50},{200011,0,1,50},{200012,0,1,50},{200013,0,1,50},{200015,0,1,50},{200016,0,1,50},{200017,0,1,50},{200019,0,1,50},{201000,0,1,50},{201001,0,1,50},{201002,0,1,50},{201003,0,1,50},{201006,0,1,50},{201010,0,1,50},{201011,0,1,50},{201012,0,1,50},{201013,0,1,50},{201015,0,1,50},{201016,0,1,50},{201017,0,1,50},{201019,0,1,50},{202000,0,1,50},{202001,0,1,50},{202002,0,1,50},{202003,0,1,50},{202006,0,1,50},{202010,0,1,50},{202011,0,1,50},{202012,0,1,50},{202013,0,1,50},{202015,0,1,50},{202016,0,1,50},{202017,0,1,50},{202019,0,1,50},{110002,0,1,0},{110003,0,1,0},{110004,0,1,100},{110005,0,1,100},{110010,0,1,50},{110011,0,1,50},{110012,0,1,50},{110009,0,5,100},
K51: BOSS怪掉落 | O51: 4 | P51: 5000 | Q51: ="{"&RC[-2]&","&RC[-1]&"}" -> {4,5000} | S51: 110023 | T51: 烈火剑法书 | U51: 1 | V51: 0 | W51: 1 | X51: 2 | Y51: ="{"&RC[-6]&","&RC[-3]&","&RC[-2]&","&RC[-1]&"}," -> {110023,0,1,2}, | Z51: =R[-1]C&RC[-1] -> {200000,0,1,70},{200001,0,1,70},{200002,0,1,70},{200003,0,1,70},{200006,0,1,70},{200010,0,1,70},{200011,0,1,70},{200012,0,1,70},{200013,0,1,70},{200015,0,1,70},{200016,0,1,70},{200017,0,1,70},{200019,0,1,70},{201000,0,1,70},{201001,0,1,70},{201002,0,1,70},{201003,0,1,70},{201006,0,1,70},{201010,0,1,70},{201011,0,1,70},{201012,0,1,70},{201013,0,1,70},{201015,0,1,70},{201016,0,1,70},{201017,0,1,70},{201019,0,1,70},{202000,0,1,70},{202001,0,1,30},{202002,0,1,30},{202003,0,1,30},{202006,0,1,30},{202010,0,1,30},{202011,0,1,30},{202012,0,1,30},{202013,0,1,30},{202015,0,1,30},{202016,0,1,30},{202017,0,1,30},{202019,0,1,30},{110002,0,1,0},{110003,0,1,0},{110004,0,1,100},{110005,0,1,100},{110010,0,1,50},{110011,0,1,50},{110012,0,1,50},{110009,0,3,100},{110023,0,1,2}, | AB51: 110023 | AC51: 烈火剑法书 | AD51: 1 | AE51: 0 | AF51: 1 | AG51: 2 | AH51: ="{"&RC[-6]&","&RC[-3]&","&RC[-2]&","&RC[-1]&"}," -> {110023,0,1,2}, | AI51: =R[-1]C&RC[-1] -> {200000,0,1,60},{200001,0,1,60},{200002,0,1,60},{200003,0,1,60},{200006,0,1,60},{200010,0,1,60},{200011,0,1,60},{200012,0,1,60},{200013,0,1,60},{200015,0,1,60},{200016,0,1,60},{200017,0,1,60},{200019,0,1,60},{201000,0,1,60},{201001,0,1,60},{201002,0,1,60},{201003,0,1,60},{201006,0,1,60},{201010,0,1,60},{201011,0,1,60},{201012,0,1,60},{201013,0,1,60},{201015,0,1,60},{201016,0,1,60},{201017,0,1,60},{201019,0,1,60},{202000,0,1,60},{202001,0,1,40},{202002,0,1,40},{202003,0,1,40},{202006,0,1,40},{202010,0,1,40},{202011,0,1,40},{202012,0,1,40},{202013,0,1,40},{202015,0,1,40},{202016,0,1,40},{202017,0,1,40},{202019,0,1,40},{110002,0,1,0},{110003,0,1,0},{110004,0,1,100},{110005,0,1,100},{110010,0,1,50},{110011,0,1,50},{110012,0,1,50},{110009,0,4,100},{110023,0,1,2}, | AK51: 110023 | AL51: 烈火剑法书 | AM51: 1 | AN51: 0 | AO51: 1 | AP51: 2 | AQ51: ="{"&RC[-6]&","&RC[-3]&","&RC[-2]&","&RC[-1]&"}," -> {110023,0,1,2}, | AR51: =R[-1]C&RC[-1] -> {200000,0,1,50},{200001,0,1,50},{200002,0,1,50},{200003,0,1,50},{200006,0,1,50},{200010,0,1,50},{200011,0,1,50},{200012,0,1,50},{200013,0,1,50},{200015,0,1,50},{200016,0,1,50},{200017,0,1,50},{200019,0,1,50},{201000,0,1,50},{201001,0,1,50},{201002,0,1,50},{201003,0,1,50},{201006,0,1,50},{201010,0,1,50},{201011,0,1,50},{201012,0,1,50},{201013,0,1,50},{201015,0,1,50},{201016,0,1,50},{201017,0,1,50},{201019,0,1,50},{202000,0,1,50},{202001,0,1,50},{202002,0,1,50},{202003,0,1,50},{202006,0,1,50},{202010,0,1,50},{202011,0,1,50},{202012,0,1,50},{202013,0,1,50},{202015,0,1,50},{202016,0,1,50},{202017,0,1,50},{202019,0,1,50},{110002,0,1,0},{110003,0,1,0},{110004,0,1,100},{110005,0,1,100},{110010,0,1,50},{110011,0,1,50},{110012,0,1,50},{110009,0,5,100},{110023,0,1,2},
S52: 110024 | T52: 狂风斩书 | U52: 1 | V52: 0 | W52: 1 | X52: 2 | Y52: ="{"&RC[-6]&","&RC[-3]&","&RC[-2]&","&RC[-1]&"}," -> {110024,0,1,2}, | Z52: =R[-1]C&RC[-1] -> {200000,0,1,70},{200001,0,1,70},{200002,0,1,70},{200003,0,1,70},{200006,0,1,70},{200010,0,1,70},{200011,0,1,70},{200012,0,1,70},{200013,0,1,70},{200015,0,1,70},{200016,0,1,70},{200017,0,1,70},{200019,0,1,70},{201000,0,1,70},{201001,0,1,70},{201002,0,1,70},{201003,0,1,70},{201006,0,1,70},{201010,0,1,70},{201011,0,1,70},{201012,0,1,70},{201013,0,1,70},{201015,0,1,70},{201016,0,1,70},{201017,0,1,70},{201019,0,1,70},{202000,0,1,70},{202001,0,1,30},{202002,0,1,30},{202003,0,1,30},{202006,0,1,30},{202010,0,1,30},{202011,0,1,30},{202012,0,1,30},{202013,0,1,30},{202015,0,1,30},{202016,0,1,30},{202017,0,1,30},{202019,0,1,30},{110002,0,1,0},{110003,0,1,0},{110004,0,1,100},{110005,0,1,100},{110010,0,1,50},{110011,0,1,50},{110012,0,1,50},{110009,0,3,100},{110023,0,1,2},{110024,0,1,2}, | AB52: 110024 | AC52: 狂风斩书 | AD52: 1 | AE52: 0 | AF52: 1 | AG52: 2 | AH52: ="{"&RC[-6]&","&RC[-3]&","&RC[-2]&","&RC[-1]&"}," -> {110024,0,1,2}, | AI52: =R[-1]C&RC[-1] -> {200000,0,1,60},{200001,0,1,60},{200002,0,1,60},{200003,0,1,60},{200006,0,1,60},{200010,0,1,60},{200011,0,1,60},{200012,0,1,60},{200013,0,1,60},{200015,0,1,60},{200016,0,1,60},{200017,0,1,60},{200019,0,1,60},{201000,0,1,60},{201001,0,1,60},{201002,0,1,60},{201003,0,1,60},{201006,0,1,60},{201010,0,1,60},{201011,0,1,60},{201012,0,1,60},{201013,0,1,60},{201015,0,1,60},{201016,0,1,60},{201017,0,1,60},{201019,0,1,60},{202000,0,1,60},{202001,0,1,40},{202002,0,1,40},{202003,0,1,40},{202006,0,1,40},{202010,0,1,40},{202011,0,1,40},{202012,0,1,40},{202013,0,1,40},{202015,0,1,40},{202016,0,1,40},{202017,0,1,40},{202019,0,1,40},{110002,0,1,0},{110003,0,1,0},{110004,0,1,100},{110005,0,1,100},{110010,0,1,50},{110011,0,1,50},{110012,0,1,50},{110009,0,4,100},{110023,0,1,2},{110024,0,1,2}, | AK52: 110024 | AL52: 狂风斩书 | AM52: 1 | AN52: 0 | AO52: 1 | AP52: 2 | AQ52: ="{"&RC[-6]&","&RC[-3]&","&RC[-2]&","&RC[-1]&"}," -> {110024,0,1,2}, | AR52: =R[-1]C&RC[-1] -> {200000,0,1,50},{200001,0,1,50},{200002,0,1,50},{200003,0,1,50},{200006,0,1,50},{200010,0,1,50},{200011,0,1,50},{200012,0,1,50},{200013,0,1,50},{200015,0,1,50},{200016,0,1,50},{200017,0,1,50},{200019,0,1,50},{201000,0,1,50},{201001,0,1,50},{201002,0,1,50},{201003,0,1,50},{201006,0,1,50},{201010,0,1,50},{201011,0,1,50},{201012,0,1,50},{201013,0,1,50},{201015,0,1,50},{201016,0,1,50},{201017,0,1,50},{201019,0,1,50},{202000,0,1,50},{202001,0,1,50},{202002,0,1,50},{202003,0,1,50},{202006,0,1,50},{202010,0,1,50},{202011,0,1,50},{202012,0,1,50},{202013,0,1,50},{202015,0,1,50},{202016,0,1,50},{202017,0,1,50},{202019,0,1,50},{110002,0,1,0},{110003,0,1,0},{110004,0,1,100},{110005,0,1,100},{110010,0,1,50},{110011,0,1,50},{110012,0,1,50},{110009,0,5,100},{110023,0,1,2},{110024,0,1,2},
Q53: ="[{0,["&R[-3]C&R[-2]C&"],["&R[-6]C&"]}]" -> [{0,[{0,5000},{4,5000}],[{200000,0,1,60},{200001,0,1,60},{200002,0,1,60},{200003,0,1,60},{200006,0,1,60},{200010,0,1,60},{200011,0,1,60},{200012,0,1,60},{201000,0,1,60},{201001,0,1,60},{201002,0,1,60},{201003,0,1,60},{201006,0,1,60},{201010,0,1,60},{201011,0,1,60},{201012,0,1,60},{202000,0,1,60},{202001,0,1,60},{202002,0,1,60},{202003,0,1,60},{202006,0,1,60},{202010,0,1,60},{202011,0,1,60},{202012,0,1,60},{110002,0,1,0},{110003,0,1,0},{110004,0,1,100},{110005,0,1,100},{110010,0,1,50},{110011,0,1,50},{110012,0,1,50},{110009,0,2,100},{110023,0,1,2},{110024,0,1,2},{110025,0,1,2},{110026,0,1,2},{110030,0,1,2},{110031,0,1,2},{110032,0,1,2},{110033,0,1,2},{110038,0,1,2},{110039,0,1,2},{110040,0,1,2},{110067,0,1,2}]}] | S53: 110025 | T53: 逐日剑法书 | U53: 1 | V53: 0 | W53: 1 | X53: 2 | Y53: ="{"&RC[-6]&","&RC[-3]&","&RC[-2]&","&RC[-1]&"}," -> {110025,0,1,2}, | Z53: =R[-1]C&RC[-1] -> {200000,0,1,70},{200001,0,1,70},{200002,0,1,70},{200003,0,1,70},{200006,0,1,70},{200010,0,1,70},{200011,0,1,70},{200012,0,1,70},{200013,0,1,70},{200015,0,1,70},{200016,0,1,70},{200017,0,1,70},{200019,0,1,70},{201000,0,1,70},{201001,0,1,70},{201002,0,1,70},{201003,0,1,70},{201006,0,1,70},{201010,0,1,70},{201011,0,1,70},{201012,0,1,70},{201013,0,1,70},{201015,0,1,70},{201016,0,1,70},{201017,0,1,70},{201019,0,1,70},{202000,0,1,70},{202001,0,1,30},{202002,0,1,30},{202003,0,1,30},{202006,0,1,30},{202010,0,1,30},{202011,0,1,30},{202012,0,1,30},{202013,0,1,30},{202015,0,1,30},{202016,0,1,30},{202017,0,1,30},{202019,0,1,30},{110002,0,1,0},{110003,0,1,0},{110004,0,1,100},{110005,0,1,100},{110010,0,1,50},{110011,0,1,50},{110012,0,1,50},{110009,0,3,100},{110023,0,1,2},{110024,0,1,2},{110025,0,1,2}, | AB53: 110025 | AC53: 逐日剑法书 | AD53: 1 | AE53: 0 | AF53: 1 | AG53: 2 | AH53: ="{"&RC[-6]&","&RC[-3]&","&RC[-2]&","&RC[-1]&"}," -> {110025,0,1,2}, | AI53: =R[-1]C&RC[-1] -> {200000,0,1,60},{200001,0,1,60},{200002,0,1,60},{200003,0,1,60},{200006,0,1,60},{200010,0,1,60},{200011,0,1,60},{200012,0,1,60},{200013,0,1,60},{200015,0,1,60},{200016,0,1,60},{200017,0,1,60},{200019,0,1,60},{201000,0,1,60},{201001,0,1,60},{201002,0,1,60},{201003,0,1,60},{201006,0,1,60},{201010,0,1,60},{201011,0,1,60},{201012,0,1,60},{201013,0,1,60},{201015,0,1,60},{201016,0,1,60},{201017,0,1,60},{201019,0,1,60},{202000,0,1,60},{202001,0,1,40},{202002,0,1,40},{202003,0,1,40},{202006,0,1,40},{202010,0,1,40},{202011,0,1,40},{202012,0,1,40},{202013,0,1,40},{202015,0,1,40},{202016,0,1,40},{202017,0,1,40},{202019,0,1,40},{110002,0,1,0},{110003,0,1,0},{110004,0,1,100},{110005,0,1,100},{110010,0,1,50},{110011,0,1,50},{110012,0,1,50},{110009,0,4,100},{110023,0,1,2},{110024,0,1,2},{110025,0,1,2}, | AK53: 110025 | AL53: 逐日剑法书 | AM53: 1 | AN53: 0 | AO53: 1 | AP53: 2 | AQ53: ="{"&RC[-6]&","&RC[-3]&","&RC[-2]&","&RC[-1]&"}," -> {110025,0,1,2}, | AR53: =R[-1]C&RC[-1] -> {200000,0,1,50},{200001,0,1,50},{200002,0,1,50},{200003,0,1,50},{200006,0,1,50},{200010,0,1,50},{200011,0,1,50},{200012,0,1,50},{200013,0,1,50},{200015,0,1,50},{200016,0,1,50},{200017,0,1,50},{200019,0,1,50},{201000,0,1,50},{201001,0,1,50},{201002,0,1,50},{201003,0,1,50},{201006,0,1,50},{201010,0,1,50},{201011,0,1,50},{201012,0,1,50},{201013,0,1,50},{201015,0,1,50},{201016,0,1,50},{201017,0,1,50},{201019,0,1,50},{202000,0,1,50},{202001,0,1,50},{202002,0,1,50},{202003,0,1,50},{202006,0,1,50},{202010,0,1,50},{202011,0,1,50},{202012,0,1,50},{202013,0,1,50},{202015,0,1,50},{202016,0,1,50},{202017,0,1,50},{202019,0,1,50},{110002,0,1,0},{110003,0,1,0},{110004,0,1,100},{110005,0,1,100},{110010,0,1,50},{110011,0,1,50},{110012,0,1,50},{110009,0,5,100},{110023,0,1,2},{110024,0,1,2},{110025,0,1,2},
S54: 110026 | T54: 灵魂火符书 | U54: 1 | V54: 0 | W54: 1 | X54: 2 | Y54: ="{"&RC[-6]&","&RC[-3]&","&RC[-2]&","&RC[-1]&"}," -> {110026,0,1,2}, | Z54: =R[-1]C&RC[-1] -> {200000,0,1,70},{200001,0,1,70},{200002,0,1,70},{200003,0,1,70},{200006,0,1,70},{200010,0,1,70},{200011,0,1,70},{200012,0,1,70},{200013,0,1,70},{200015,0,1,70},{200016,0,1,70},{200017,0,1,70},{200019,0,1,70},{201000,0,1,70},{201001,0,1,70},{201002,0,1,70},{201003,0,1,70},{201006,0,1,70},{201010,0,1,70},{201011,0,1,70},{201012,0,1,70},{201013,0,1,70},{201015,0,1,70},{201016,0,1,70},{201017,0,1,70},{201019,0,1,70},{202000,0,1,70},{202001,0,1,30},{202002,0,1,30},{202003,0,1,30},{202006,0,1,30},{202010,0,1,30},{202011,0,1,30},{202012,0,1,30},{202013,0,1,30},{202015,0,1,30},{202016,0,1,30},{202017,0,1,30},{202019,0,1,30},{110002,0,1,0},{110003,0,1,0},{110004,0,1,100},{110005,0,1,100},{110010,0,1,50},{110011,0,1,50},{110012,0,1,50},{110009,0,3,100},{110023,0,1,2},{110024,0,1,2},{110025,0,1,2},{110026,0,1,2}, | AB54: 110026 | AC54: 灵魂火符书 | AD54: 1 | AE54: 0 | AF54: 1 | AG54: 2 | AH54: ="{"&RC[-6]&","&RC[-3]&","&RC[-2]&","&RC[-1]&"}," -> {110026,0,1,2}, | AI54: =R[-1]C&RC[-1] -> {200000,0,1,60},{200001,0,1,60},{200002,0,1,60},{200003,0,1,60},{200006,0,1,60},{200010,0,1,60},{200011,0,1,60},{200012,0,1,60},{200013,0,1,60},{200015,0,1,60},{200016,0,1,60},{200017,0,1,60},{200019,0,1,60},{201000,0,1,60},{201001,0,1,60},{201002,0,1,60},{201003,0,1,60},{201006,0,1,60},{201010,0,1,60},{201011,0,1,60},{201012,0,1,60},{201013,0,1,60},{201015,0,1,60},{201016,0,1,60},{201017,0,1,60},{201019,0,1,60},{202000,0,1,60},{202001,0,1,40},{202002,0,1,40},{202003,0,1,40},{202006,0,1,40},{202010,0,1,40},{202011,0,1,40},{202012,0,1,40},{202013,0,1,40},{202015,0,1,40},{202016,0,1,40},{202017,0,1,40},{202019,0,1,40},{110002,0,1,0},{110003,0,1,0},{110004,0,1,100},{110005,0,1,100},{110010,0,1,50},{110011,0,1,50},{110012,0,1,50},{110009,0,4,100},{110023,0,1,2},{110024,0,1,2},{110025,0,1,2},{110026,0,1,2}, | AK54: 110026 | AL54: 灵魂火符书 | AM54: 1 | AN54: 0 | AO54: 1 | AP54: 2 | AQ54: ="{"&RC[-6]&","&RC[-3]&","&RC[-2]&","&RC[-1]&"}," -> {110026,0,1,2}, | AR54: =R[-1]C&RC[-1] -> {200000,0,1,50},{200001,0,1,50},{200002,0,1,50},{200003,0,1,50},{200006,0,1,50},{200010,0,1,50},{200011,0,1,50},{200012,0,1,50},{200013,0,1,50},{200015,0,1,50},{200016,0,1,50},{200017,0,1,50},{200019,0,1,50},{201000,0,1,50},{201001,0,1,50},{201002,0,1,50},{201003,0,1,50},{201006,0,1,50},{201010,0,1,50},{201011,0,1,50},{201012,0,1,50},{201013,0,1,50},{201015,0,1,50},{201016,0,1,50},{201017,0,1,50},{201019,0,1,50},{202000,0,1,50},{202001,0,1,50},{202002,0,1,50},{202003,0,1,50},{202006,0,1,50},{202010,0,1,50},{202011,0,1,50},{202012,0,1,50},{202013,0,1,50},{202015,0,1,50},{202016,0,1,50},{202017,0,1,50},{202019,0,1,50},{110002,0,1,0},{110003,0,1,0},{110004,0,1,100},{110005,0,1,100},{110010,0,1,50},{110011,0,1,50},{110012,0,1,50},{110009,0,5,100},{110023,0,1,2},{110024,0,1,2},{110025,0,1,2},{110026,0,1,2}, | AT54: =2300/4 -> 575
S55: 110030 | T55: 战甲术书 | U55: 1 | V55: 0 | W55: 1 | X55: 2 | Y55: ="{"&RC[-6]&","&RC[-3]&","&RC[-2]&","&RC[-1]&"}," -> {110030,0,1,2}, | Z55: =R[-1]C&RC[-1] -> {200000,0,1,70},{200001,0,1,70},{200002,0,1,70},{200003,0,1,70},{200006,0,1,70},{200010,0,1,70},{200011,0,1,70},{200012,0,1,70},{200013,0,1,70},{200015,0,1,70},{200016,0,1,70},{200017,0,1,70},{200019,0,1,70},{201000,0,1,70},{201001,0,1,70},{201002,0,1,70},{201003,0,1,70},{201006,0,1,70},{201010,0,1,70},{201011,0,1,70},{201012,0,1,70},{201013,0,1,70},{201015,0,1,70},{201016,0,1,70},{201017,0,1,70},{201019,0,1,70},{202000,0,1,70},{202001,0,1,30},{202002,0,1,30},{202003,0,1,30},{202006,0,1,30},{202010,0,1,30},{202011,0,1,30},{202012,0,1,30},{202013,0,1,30},{202015,0,1,30},{202016,0,1,30},{202017,0,1,30},{202019,0,1,30},{110002,0,1,0},{110003,0,1,0},{110004,0,1,100},{110005,0,1,100},{110010,0,1,50},{110011,0,1,50},{110012,0,1,50},{110009,0,3,100},{110023,0,1,2},{110024,0,1,2},{110025,0,1,2},{110026,0,1,2},{110030,0,1,2}, | AB55: 110030 | AC55: 战甲术书 | AD55: 1 | AE55: 0 | AF55: 1 | AG55: 2 | AH55: ="{"&RC[-6]&","&RC[-3]&","&RC[-2]&","&RC[-1]&"}," -> {110030,0,1,2}, | AI55: =R[-1]C&RC[-1] -> {200000,0,1,60},{200001,0,1,60},{200002,0,1,60},{200003,0,1,60},{200006,0,1,60},{200010,0,1,60},{200011,0,1,60},{200012,0,1,60},{200013,0,1,60},{200015,0,1,60},{200016,0,1,60},{200017,0,1,60},{200019,0,1,60},{201000,0,1,60},{201001,0,1,60},{201002,0,1,60},{201003,0,1,60},{201006,0,1,60},{201010,0,1,60},{201011,0,1,60},{201012,0,1,60},{201013,0,1,60},{201015,0,1,60},{201016,0,1,60},{201017,0,1,60},{201019,0,1,60},{202000,0,1,60},{202001,0,1,40},{202002,0,1,40},{202003,0,1,40},{202006,0,1,40},{202010,0,1,40},{202011,0,1,40},{202012,0,1,40},{202013,0,1,40},{202015,0,1,40},{202016,0,1,40},{202017,0,1,40},{202019,0,1,40},{110002,0,1,0},{110003,0,1,0},{110004,0,1,100},{110005,0,1,100},{110010,0,1,50},{110011,0,1,50},{110012,0,1,50},{110009,0,4,100},{110023,0,1,2},{110024,0,1,2},{110025,0,1,2},{110026,0,1,2},{110030,0,1,2}, | AK55: 110030 | AL55: 战甲术书 | AM55: 1 | AN55: 0 | AO55: 1 | AP55: 2 | AQ55: ="{"&RC[-6]&","&RC[-3]&","&RC[-2]&","&RC[-1]&"}," -> {110030,0,1,2}, | AR55: =R[-1]C&RC[-1] -> {200000,0,1,50},{200001,0,1,50},{200002,0,1,50},{200003,0,1,50},{200006,0,1,50},{200010,0,1,50},{200011,0,1,50},{200012,0,1,50},{200013,0,1,50},{200015,0,1,50},{200016,0,1,50},{200017,0,1,50},{200019,0,1,50},{201000,0,1,50},{201001,0,1,50},{201002,0,1,50},{201003,0,1,50},{201006,0,1,50},{201010,0,1,50},{201011,0,1,50},{201012,0,1,50},{201013,0,1,50},{201015,0,1,50},{201016,0,1,50},{201017,0,1,50},{201019,0,1,50},{202000,0,1,50},{202001,0,1,50},{202002,0,1,50},{202003,0,1,50},{202006,0,1,50},{202010,0,1,50},{202011,0,1,50},{202012,0,1,50},{202013,0,1,50},{202015,0,1,50},{202016,0,1,50},{202017,0,1,50},{202019,0,1,50},{110002,0,1,0},{110003,0,1,0},{110004,0,1,100},{110005,0,1,100},{110010,0,1,50},{110011,0,1,50},{110012,0,1,50},{110009,0,5,100},{110023,0,1,2},{110024,0,1,2},{110025,0,1,2},{110026,0,1,2},{110030,0,1,2},
S56: 110031 | T56: 召唤神兽书 | U56: 1 | V56: 0 | W56: 1 | X56: 2 | Y56: ="{"&RC[-6]&","&RC[-3]&","&RC[-2]&","&RC[-1]&"}," -> {110031,0,1,2}, | Z56: =R[-1]C&RC[-1] -> {200000,0,1,70},{200001,0,1,70},{200002,0,1,70},{200003,0,1,70},{200006,0,1,70},{200010,0,1,70},{200011,0,1,70},{200012,0,1,70},{200013,0,1,70},{200015,0,1,70},{200016,0,1,70},{200017,0,1,70},{200019,0,1,70},{201000,0,1,70},{201001,0,1,70},{201002,0,1,70},{201003,0,1,70},{201006,0,1,70},{201010,0,1,70},{201011,0,1,70},{201012,0,1,70},{201013,0,1,70},{201015,0,1,70},{201016,0,1,70},{201017,0,1,70},{201019,0,1,70},{202000,0,1,70},{202001,0,1,30},{202002,0,1,30},{202003,0,1,30},{202006,0,1,30},{202010,0,1,30},{202011,0,1,30},{202012,0,1,30},{202013,0,1,30},{202015,0,1,30},{202016,0,1,30},{202017,0,1,30},{202019,0,1,30},{110002,0,1,0},{110003,0,1,0},{110004,0,1,100},{110005,0,1,100},{110010,0,1,50},{110011,0,1,50},{110012,0,1,50},{110009,0,3,100},{110023,0,1,2},{110024,0,1,2},{110025,0,1,2},{110026,0,1,2},{110030,0,1,2},{110031,0,1,2}, | AB56: 110031 | AC56: 召唤神兽书 | AD56: 1 | AE56: 0 | AF56: 1 | AG56: 2 | AH56: ="{"&RC[-6]&","&RC[-3]&","&RC[-2]&","&RC[-1]&"}," -> {110031,0,1,2}, | AI56: =R[-1]C&RC[-1] -> {200000,0,1,60},{200001,0,1,60},{200002,0,1,60},{200003,0,1,60},{200006,0,1,60},{200010,0,1,60},{200011,0,1,60},{200012,0,1,60},{200013,0,1,60},{200015,0,1,60},{200016,0,1,60},{200017,0,1,60},{200019,0,1,60},{201000,0,1,60},{201001,0,1,60},{201002,0,1,60},{201003,0,1,60},{201006,0,1,60},{201010,0,1,60},{201011,0,1,60},{201012,0,1,60},{201013,0,1,60},{201015,0,1,60},{201016,0,1,60},{201017,0,1,60},{201019,0,1,60},{202000,0,1,60},{202001,0,1,40},{202002,0,1,40},{202003,0,1,40},{202006,0,1,40},{202010,0,1,40},{202011,0,1,40},{202012,0,1,40},{202013,0,1,40},{202015,0,1,40},{202016,0,1,40},{202017,0,1,40},{202019,0,1,40},{110002,0,1,0},{110003,0,1,0},{110004,0,1,100},{110005,0,1,100},{110010,0,1,50},{110011,0,1,50},{110012,0,1,50},{110009,0,4,100},{110023,0,1,2},{110024,0,1,2},{110025,0,1,2},{110026,0,1,2},{110030,0,1,2},{110031,0,1,2}, | AK56: 110031 | AL56: 召唤神兽书 | AM56: 1 | AN56: 0 | AO56: 1 | AP56: 2 | AQ56: ="{"&RC[-6]&","&RC[-3]&","&RC[-2]&","&RC[-1]&"}," -> {110031,0,1,2}, | AR56: =R[-1]C&RC[-1] -> {200000,0,1,50},{200001,0,1,50},{200002,0,1,50},{200003,0,1,50},{200006,0,1,50},{200010,0,1,50},{200011,0,1,50},{200012,0,1,50},{200013,0,1,50},{200015,0,1,50},{200016,0,1,50},{200017,0,1,50},{200019,0,1,50},{201000,0,1,50},{201001,0,1,50},{201002,0,1,50},{201003,0,1,50},{201006,0,1,50},{201010,0,1,50},{201011,0,1,50},{201012,0,1,50},{201013,0,1,50},{201015,0,1,50},{201016,0,1,50},{201017,0,1,50},{201019,0,1,50},{202000,0,1,50},{202001,0,1,50},{202002,0,1,50},{202003,0,1,50},{202006,0,1,50},{202010,0,1,50},{202011,0,1,50},{202012,0,1,50},{202013,0,1,50},{202015,0,1,50},{202016,0,1,50},{202017,0,1,50},{202019,0,1,50},{110002,0,1,0},{110003,0,1,0},{110004,0,1,100},{110005,0,1,100},{110010,0,1,50},{110011,0,1,50},{110012,0,1,50},{110009,0,5,100},{110023,0,1,2},{110024,0,1,2},{110025,0,1,2},{110026,0,1,2},{110030,0,1,2},{110031,0,1,2},
S57: 110032 | T57: 嗜血术书 | U57: 1 | V57: 0 | W57: 1 | X57: 2 | Y57: ="{"&RC[-6]&","&RC[-3]&","&RC[-2]&","&RC[-1]&"}," -> {110032,0,1,2}, | Z57: =R[-1]C&RC[-1] -> {200000,0,1,70},{200001,0,1,70},{200002,0,1,70},{200003,0,1,70},{200006,0,1,70},{200010,0,1,70},{200011,0,1,70},{200012,0,1,70},{200013,0,1,70},{200015,0,1,70},{200016,0,1,70},{200017,0,1,70},{200019,0,1,70},{201000,0,1,70},{201001,0,1,70},{201002,0,1,70},{201003,0,1,70},{201006,0,1,70},{201010,0,1,70},{201011,0,1,70},{201012,0,1,70},{201013,0,1,70},{201015,0,1,70},{201016,0,1,70},{201017,0,1,70},{201019,0,1,70},{202000,0,1,70},{202001,0,1,30},{202002,0,1,30},{202003,0,1,30},{202006,0,1,30},{202010,0,1,30},{202011,0,1,30},{202012,0,1,30},{202013,0,1,30},{202015,0,1,30},{202016,0,1,30},{202017,0,1,30},{202019,0,1,30},{110002,0,1,0},{110003,0,1,0},{110004,0,1,100},{110005,0,1,100},{110010,0,1,50},{110011,0,1,50},{110012,0,1,50},{110009,0,3,100},{110023,0,1,2},{110024,0,1,2},{110025,0,1,2},{110026,0,1,2},{110030,0,1,2},{110031,0,1,2},{110032,0,1,2}, | AB57: 110032 | AC57: 嗜血术书 | AD57: 1 | AE57: 0 | AF57: 1 | AG57: 2 | AH57: ="{"&RC[-6]&","&RC[-3]&","&RC[-2]&","&RC[-1]&"}," -> {110032,0,1,2}, | AI57: =R[-1]C&RC[-1] -> {200000,0,1,60},{200001,0,1,60},{200002,0,1,60},{200003,0,1,60},{200006,0,1,60},{200010,0,1,60},{200011,0,1,60},{200012,0,1,60},{200013,0,1,60},{200015,0,1,60},{200016,0,1,60},{200017,0,1,60},{200019,0,1,60},{201000,0,1,60},{201001,0,1,60},{201002,0,1,60},{201003,0,1,60},{201006,0,1,60},{201010,0,1,60},{201011,0,1,60},{201012,0,1,60},{201013,0,1,60},{201015,0,1,60},{201016,0,1,60},{201017,0,1,60},{201019,0,1,60},{202000,0,1,60},{202001,0,1,40},{202002,0,1,40},{202003,0,1,40},{202006,0,1,40},{202010,0,1,40},{202011,0,1,40},{202012,0,1,40},{202013,0,1,40},{202015,0,1,40},{202016,0,1,40},{202017,0,1,40},{202019,0,1,40},{110002,0,1,0},{110003,0,1,0},{110004,0,1,100},{110005,0,1,100},{110010,0,1,50},{110011,0,1,50},{110012,0,1,50},{110009,0,4,100},{110023,0,1,2},{110024,0,1,2},{110025,0,1,2},{110026,0,1,2},{110030,0,1,2},{110031,0,1,2},{110032,0,1,2}, | AK57: 110032 | AL57: 嗜血术书 | AM57: 1 | AN57: 0 | AO57: 1 | AP57: 2 | AQ57: ="{"&RC[-6]&","&RC[-3]&","&RC[-2]&","&RC[-1]&"}," -> {110032,0,1,2}, | AR57: =R[-1]C&RC[-1] -> {200000,0,1,50},{200001,0,1,50},{200002,0,1,50},{200003,0,1,50},{200006,0,1,50},{200010,0,1,50},{200011,0,1,50},{200012,0,1,50},{200013,0,1,50},{200015,0,1,50},{200016,0,1,50},{200017,0,1,50},{200019,0,1,50},{201000,0,1,50},{201001,0,1,50},{201002,0,1,50},{201003,0,1,50},{201006,0,1,50},{201010,0,1,50},{201011,0,1,50},{201012,0,1,50},{201013,0,1,50},{201015,0,1,50},{201016,0,1,50},{201017,0,1,50},{201019,0,1,50},{202000,0,1,50},{202001,0,1,50},{202002,0,1,50},{202003,0,1,50},{202006,0,1,50},{202010,0,1,50},{202011,0,1,50},{202012,0,1,50},{202013,0,1,50},{202015,0,1,50},{202016,0,1,50},{202017,0,1,50},{202019,0,1,50},{110002,0,1,0},{110003,0,1,0},{110004,0,1,100},{110005,0,1,100},{110010,0,1,50},{110011,0,1,50},{110012,0,1,50},{110009,0,5,100},{110023,0,1,2},{110024,0,1,2},{110025,0,1,2},{110026,0,1,2},{110030,0,1,2},{110031,0,1,2},{110032,0,1,2},
S58: 110033 | T58: 雷电术书 | U58: 1 | V58: 0 | W58: 1 | X58: 2 | Y58: ="{"&RC[-6]&","&RC[-3]&","&RC[-2]&","&RC[-1]&"}," -> {110033,0,1,2}, | Z58: =R[-1]C&RC[-1] -> {200000,0,1,70},{200001,0,1,70},{200002,0,1,70},{200003,0,1,70},{200006,0,1,70},{200010,0,1,70},{200011,0,1,70},{200012,0,1,70},{200013,0,1,70},{200015,0,1,70},{200016,0,1,70},{200017,0,1,70},{200019,0,1,70},{201000,0,1,70},{201001,0,1,70},{201002,0,1,70},{201003,0,1,70},{201006,0,1,70},{201010,0,1,70},{201011,0,1,70},{201012,0,1,70},{201013,0,1,70},{201015,0,1,70},{201016,0,1,70},{201017,0,1,70},{201019,0,1,70},{202000,0,1,70},{202001,0,1,30},{202002,0,1,30},{202003,0,1,30},{202006,0,1,30},{202010,0,1,30},{202011,0,1,30},{202012,0,1,30},{202013,0,1,30},{202015,0,1,30},{202016,0,1,30},{202017,0,1,30},{202019,0,1,30},{110002,0,1,0},{110003,0,1,0},{110004,0,1,100},{110005,0,1,100},{110010,0,1,50},{110011,0,1,50},{110012,0,1,50},{110009,0,3,100},{110023,0,1,2},{110024,0,1,2},{110025,0,1,2},{110026,0,1,2},{110030,0,1,2},{110031,0,1,2},{110032,0,1,2},{110033,0,1,2}, | AB58: 110033 | AC58: 雷电术书 | AD58: 1 | AE58: 0 | AF58: 1 | AG58: 2 | AH58: ="{"&RC[-6]&","&RC[-3]&","&RC[-2]&","&RC[-1]&"}," -> {110033,0,1,2}, | AI58: =R[-1]C&RC[-1] -> {200000,0,1,60},{200001,0,1,60},{200002,0,1,60},{200003,0,1,60},{200006,0,1,60},{200010,0,1,60},{200011,0,1,60},{200012,0,1,60},{200013,0,1,60},{200015,0,1,60},{200016,0,1,60},{200017,0,1,60},{200019,0,1,60},{201000,0,1,60},{201001,0,1,60},{201002,0,1,60},{201003,0,1,60},{201006,0,1,60},{201010,0,1,60},{201011,0,1,60},{201012,0,1,60},{201013,0,1,60},{201015,0,1,60},{201016,0,1,60},{201017,0,1,60},{201019,0,1,60},{202000,0,1,60},{202001,0,1,40},{202002,0,1,40},{202003,0,1,40},{202006,0,1,40},{202010,0,1,40},{202011,0,1,40},{202012,0,1,40},{202013,0,1,40},{202015,0,1,40},{202016,0,1,40},{202017,0,1,40},{202019,0,1,40},{110002,0,1,0},{110003,0,1,0},{110004,0,1,100},{110005,0,1,100},{110010,0,1,50},{110011,0,1,50},{110012,0,1,50},{110009,0,4,100},{110023,0,1,2},{110024,0,1,2},{110025,0,1,2},{110026,0,1,2},{110030,0,1,2},{110031,0,1,2},{110032,0,1,2},{110033,0,1,2}, | AK58: 110033 | AL58: 雷电术书 | AM58: 1 | AN58: 0 | AO58: 1 | AP58: 2 | AQ58: ="{"&RC[-6]&","&RC[-3]&","&RC[-2]&","&RC[-1]&"}," -> {110033,0,1,2}, | AR58: =R[-1]C&RC[-1] -> {200000,0,1,50},{200001,0,1,50},{200002,0,1,50},{200003,0,1,50},{200006,0,1,50},{200010,0,1,50},{200011,0,1,50},{200012,0,1,50},{200013,0,1,50},{200015,0,1,50},{200016,0,1,50},{200017,0,1,50},{200019,0,1,50},{201000,0,1,50},{201001,0,1,50},{201002,0,1,50},{201003,0,1,50},{201006,0,1,50},{201010,0,1,50},{201011,0,1,50},{201012,0,1,50},{201013,0,1,50},{201015,0,1,50},{201016,0,1,50},{201017,0,1,50},{201019,0,1,50},{202000,0,1,50},{202001,0,1,50},{202002,0,1,50},{202003,0,1,50},{202006,0,1,50},{202010,0,1,50},{202011,0,1,50},{202012,0,1,50},{202013,0,1,50},{202015,0,1,50},{202016,0,1,50},{202017,0,1,50},{202019,0,1,50},{110002,0,1,0},{110003,0,1,0},{110004,0,1,100},{110005,0,1,100},{110010,0,1,50},{110011,0,1,50},{110012,0,1,50},{110009,0,5,100},{110023,0,1,2},{110024,0,1,2},{110025,0,1,2},{110026,0,1,2},{110030,0,1,2},{110031,0,1,2},{110032,0,1,2},{110033,0,1,2},
S59: 110038 | T59: 冰咆哮书 | U59: 1 | V59: 0 | W59: 1 | X59: 2 | Y59: ="{"&RC[-6]&","&RC[-3]&","&RC[-2]&","&RC[-1]&"}," -> {110038,0,1,2}, | Z59: =R[-1]C&RC[-1] -> {200000,0,1,70},{200001,0,1,70},{200002,0,1,70},{200003,0,1,70},{200006,0,1,70},{200010,0,1,70},{200011,0,1,70},{200012,0,1,70},{200013,0,1,70},{200015,0,1,70},{200016,0,1,70},{200017,0,1,70},{200019,0,1,70},{201000,0,1,70},{201001,0,1,70},{201002,0,1,70},{201003,0,1,70},{201006,0,1,70},{201010,0,1,70},{201011,0,1,70},{201012,0,1,70},{201013,0,1,70},{201015,0,1,70},{201016,0,1,70},{201017,0,1,70},{201019,0,1,70},{202000,0,1,70},{202001,0,1,30},{202002,0,1,30},{202003,0,1,30},{202006,0,1,30},{202010,0,1,30},{202011,0,1,30},{202012,0,1,30},{202013,0,1,30},{202015,0,1,30},{202016,0,1,30},{202017,0,1,30},{202019,0,1,30},{110002,0,1,0},{110003,0,1,0},{110004,0,1,100},{110005,0,1,100},{110010,0,1,50},{110011,0,1,50},{110012,0,1,50},{110009,0,3,100},{110023,0,1,2},{110024,0,1,2},{110025,0,1,2},{110026,0,1,2},{110030,0,1,2},{110031,0,1,2},{110032,0,1,2},{110033,0,1,2},{110038,0,1,2}, | AB59: 110038 | AC59: 冰咆哮书 | AD59: 1 | AE59: 0 | AF59: 1 | AG59: 2 | AH59: ="{"&RC[-6]&","&RC[-3]&","&RC[-2]&","&RC[-1]&"}," -> {110038,0,1,2}, | AI59: =R[-1]C&RC[-1] -> {200000,0,1,60},{200001,0,1,60},{200002,0,1,60},{200003,0,1,60},{200006,0,1,60},{200010,0,1,60},{200011,0,1,60},{200012,0,1,60},{200013,0,1,60},{200015,0,1,60},{200016,0,1,60},{200017,0,1,60},{200019,0,1,60},{201000,0,1,60},{201001,0,1,60},{201002,0,1,60},{201003,0,1,60},{201006,0,1,60},{201010,0,1,60},{201011,0,1,60},{201012,0,1,60},{201013,0,1,60},{201015,0,1,60},{201016,0,1,60},{201017,0,1,60},{201019,0,1,60},{202000,0,1,60},{202001,0,1,40},{202002,0,1,40},{202003,0,1,40},{202006,0,1,40},{202010,0,1,40},{202011,0,1,40},{202012,0,1,40},{202013,0,1,40},{202015,0,1,40},{202016,0,1,40},{202017,0,1,40},{202019,0,1,40},{110002,0,1,0},{110003,0,1,0},{110004,0,1,100},{110005,0,1,100},{110010,0,1,50},{110011,0,1,50},{110012,0,1,50},{110009,0,4,100},{110023,0,1,2},{110024,0,1,2},{110025,0,1,2},{110026,0,1,2},{110030,0,1,2},{110031,0,1,2},{110032,0,1,2},{110033,0,1,2},{110038,0,1,2}, | AK59: 110038 | AL59: 冰咆哮书 | AM59: 1 | AN59: 0 | AO59: 1 | AP59: 2 | AQ59: ="{"&RC[-6]&","&RC[-3]&","&RC[-2]&","&RC[-1]&"}," -> {110038,0,1,2}, | AR59: =R[-1]C&RC[-1] -> {200000,0,1,50},{200001,0,1,50},{200002,0,1,50},{200003,0,1,50},{200006,0,1,50},{200010,0,1,50},{200011,0,1,50},{200012,0,1,50},{200013,0,1,50},{200015,0,1,50},{200016,0,1,50},{200017,0,1,50},{200019,0,1,50},{201000,0,1,50},{201001,0,1,50},{201002,0,1,50},{201003,0,1,50},{201006,0,1,50},{201010,0,1,50},{201011,0,1,50},{201012,0,1,50},{201013,0,1,50},{201015,0,1,50},{201016,0,1,50},{201017,0,1,50},{201019,0,1,50},{202000,0,1,50},{202001,0,1,50},{202002,0,1,50},{202003,0,1,50},{202006,0,1,50},{202010,0,1,50},{202011,0,1,50},{202012,0,1,50},{202013,0,1,50},{202015,0,1,50},{202016,0,1,50},{202017,0,1,50},{202019,0,1,50},{110002,0,1,0},{110003,0,1,0},{110004,0,1,100},{110005,0,1,100},{110010,0,1,50},{110011,0,1,50},{110012,0,1,50},{110009,0,5,100},{110023,0,1,2},{110024,0,1,2},{110025,0,1,2},{110026,0,1,2},{110030,0,1,2},{110031,0,1,2},{110032,0,1,2},{110033,0,1,2},{110038,0,1,2},
S60: 110039 | T60: 抗拒火环书 | U60: 1 | V60: 0 | W60: 1 | X60: 2 | Y60: ="{"&RC[-6]&","&RC[-3]&","&RC[-2]&","&RC[-1]&"}," -> {110039,0,1,2}, | Z60: =R[-1]C&RC[-1] -> {200000,0,1,70},{200001,0,1,70},{200002,0,1,70},{200003,0,1,70},{200006,0,1,70},{200010,0,1,70},{200011,0,1,70},{200012,0,1,70},{200013,0,1,70},{200015,0,1,70},{200016,0,1,70},{200017,0,1,70},{200019,0,1,70},{201000,0,1,70},{201001,0,1,70},{201002,0,1,70},{201003,0,1,70},{201006,0,1,70},{201010,0,1,70},{201011,0,1,70},{201012,0,1,70},{201013,0,1,70},{201015,0,1,70},{201016,0,1,70},{201017,0,1,70},{201019,0,1,70},{202000,0,1,70},{202001,0,1,30},{202002,0,1,30},{202003,0,1,30},{202006,0,1,30},{202010,0,1,30},{202011,0,1,30},{202012,0,1,30},{202013,0,1,30},{202015,0,1,30},{202016,0,1,30},{202017,0,1,30},{202019,0,1,30},{110002,0,1,0},{110003,0,1,0},{110004,0,1,100},{110005,0,1,100},{110010,0,1,50},{110011,0,1,50},{110012,0,1,50},{110009,0,3,100},{110023,0,1,2},{110024,0,1,2},{110025,0,1,2},{110026,0,1,2},{110030,0,1,2},{110031,0,1,2},{110032,0,1,2},{110033,0,1,2},{110038,0,1,2},{110039,0,1,2}, | AB60: 110039 | AC60: 抗拒火环书 | AD60: 1 | AE60: 0 | AF60: 1 | AG60: 2 | AH60: ="{"&RC[-6]&","&RC[-3]&","&RC[-2]&","&RC[-1]&"}," -> {110039,0,1,2}, | AI60: =R[-1]C&RC[-1] -> {200000,0,1,60},{200001,0,1,60},{200002,0,1,60},{200003,0,1,60},{200006,0,1,60},{200010,0,1,60},{200011,0,1,60},{200012,0,1,60},{200013,0,1,60},{200015,0,1,60},{200016,0,1,60},{200017,0,1,60},{200019,0,1,60},{201000,0,1,60},{201001,0,1,60},{201002,0,1,60},{201003,0,1,60},{201006,0,1,60},{201010,0,1,60},{201011,0,1,60},{201012,0,1,60},{201013,0,1,60},{201015,0,1,60},{201016,0,1,60},{201017,0,1,60},{201019,0,1,60},{202000,0,1,60},{202001,0,1,40},{202002,0,1,40},{202003,0,1,40},{202006,0,1,40},{202010,0,1,40},{202011,0,1,40},{202012,0,1,40},{202013,0,1,40},{202015,0,1,40},{202016,0,1,40},{202017,0,1,40},{202019,0,1,40},{110002,0,1,0},{110003,0,1,0},{110004,0,1,100},{110005,0,1,100},{110010,0,1,50},{110011,0,1,50},{110012,0,1,50},{110009,0,4,100},{110023,0,1,2},{110024,0,1,2},{110025,0,1,2},{110026,0,1,2},{110030,0,1,2},{110031,0,1,2},{110032,0,1,2},{110033,0,1,2},{110038,0,1,2},{110039,0,1,2}, | AK60: 110039 | AL60: 抗拒火环书 | AM60: 1 | AN60: 0 | AO60: 1 | AP60: 2 | AQ60: ="{"&RC[-6]&","&RC[-3]&","&RC[-2]&","&RC[-1]&"}," -> {110039,0,1,2}, | AR60: =R[-1]C&RC[-1] -> {200000,0,1,50},{200001,0,1,50},{200002,0,1,50},{200003,0,1,50},{200006,0,1,50},{200010,0,1,50},{200011,0,1,50},{200012,0,1,50},{200013,0,1,50},{200015,0,1,50},{200016,0,1,50},{200017,0,1,50},{200019,0,1,50},{201000,0,1,50},{201001,0,1,50},{201002,0,1,50},{201003,0,1,50},{201006,0,1,50},{201010,0,1,50},{201011,0,1,50},{201012,0,1,50},{201013,0,1,50},{201015,0,1,50},{201016,0,1,50},{201017,0,1,50},{201019,0,1,50},{202000,0,1,50},{202001,0,1,50},{202002,0,1,50},{202003,0,1,50},{202006,0,1,50},{202010,0,1,50},{202011,0,1,50},{202012,0,1,50},{202013,0,1,50},{202015,0,1,50},{202016,0,1,50},{202017,0,1,50},{202019,0,1,50},{110002,0,1,0},{110003,0,1,0},{110004,0,1,100},{110005,0,1,100},{110010,0,1,50},{110011,0,1,50},{110012,0,1,50},{110009,0,5,100},{110023,0,1,2},{110024,0,1,2},{110025,0,1,2},{110026,0,1,2},{110030,0,1,2},{110031,0,1,2},{110032,0,1,2},{110033,0,1,2},{110038,0,1,2},{110039,0,1,2},
S61: 110040 | T61: 流星火雨书 | U61: 1 | V61: 0 | W61: 1 | X61: 2 | Y61: ="{"&RC[-6]&","&RC[-3]&","&RC[-2]&","&RC[-1]&"}," -> {110040,0,1,2}, | Z61: =R[-1]C&RC[-1] -> {200000,0,1,70},{200001,0,1,70},{200002,0,1,70},{200003,0,1,70},{200006,0,1,70},{200010,0,1,70},{200011,0,1,70},{200012,0,1,70},{200013,0,1,70},{200015,0,1,70},{200016,0,1,70},{200017,0,1,70},{200019,0,1,70},{201000,0,1,70},{201001,0,1,70},{201002,0,1,70},{201003,0,1,70},{201006,0,1,70},{201010,0,1,70},{201011,0,1,70},{201012,0,1,70},{201013,0,1,70},{201015,0,1,70},{201016,0,1,70},{201017,0,1,70},{201019,0,1,70},{202000,0,1,70},{202001,0,1,30},{202002,0,1,30},{202003,0,1,30},{202006,0,1,30},{202010,0,1,30},{202011,0,1,30},{202012,0,1,30},{202013,0,1,30},{202015,0,1,30},{202016,0,1,30},{202017,0,1,30},{202019,0,1,30},{110002,0,1,0},{110003,0,1,0},{110004,0,1,100},{110005,0,1,100},{110010,0,1,50},{110011,0,1,50},{110012,0,1,50},{110009,0,3,100},{110023,0,1,2},{110024,0,1,2},{110025,0,1,2},{110026,0,1,2},{110030,0,1,2},{110031,0,1,2},{110032,0,1,2},{110033,0,1,2},{110038,0,1,2},{110039,0,1,2},{110040,0,1,2}, | AB61: 110040 | AC61: 流星火雨书 | AD61: 1 | AE61: 0 | AF61: 1 | AG61: 2 | AH61: ="{"&RC[-6]&","&RC[-3]&","&RC[-2]&","&RC[-1]&"}," -> {110040,0,1,2}, | AI61: =R[-1]C&RC[-1] -> {200000,0,1,60},{200001,0,1,60},{200002,0,1,60},{200003,0,1,60},{200006,0,1,60},{200010,0,1,60},{200011,0,1,60},{200012,0,1,60},{200013,0,1,60},{200015,0,1,60},{200016,0,1,60},{200017,0,1,60},{200019,0,1,60},{201000,0,1,60},{201001,0,1,60},{201002,0,1,60},{201003,0,1,60},{201006,0,1,60},{201010,0,1,60},{201011,0,1,60},{201012,0,1,60},{201013,0,1,60},{201015,0,1,60},{201016,0,1,60},{201017,0,1,60},{201019,0,1,60},{202000,0,1,60},{202001,0,1,40},{202002,0,1,40},{202003,0,1,40},{202006,0,1,40},{202010,0,1,40},{202011,0,1,40},{202012,0,1,40},{202013,0,1,40},{202015,0,1,40},{202016,0,1,40},{202017,0,1,40},{202019,0,1,40},{110002,0,1,0},{110003,0,1,0},{110004,0,1,100},{110005,0,1,100},{110010,0,1,50},{110011,0,1,50},{110012,0,1,50},{110009,0,4,100},{110023,0,1,2},{110024,0,1,2},{110025,0,1,2},{110026,0,1,2},{110030,0,1,2},{110031,0,1,2},{110032,0,1,2},{110033,0,1,2},{110038,0,1,2},{110039,0,1,2},{110040,0,1,2}, | AK61: 110040 | AL61: 流星火雨书 | AM61: 1 | AN61: 0 | AO61: 1 | AP61: 2 | AQ61: ="{"&RC[-6]&","&RC[-3]&","&RC[-2]&","&RC[-1]&"}," -> {110040,0,1,2}, | AR61: =R[-1]C&RC[-1] -> {200000,0,1,50},{200001,0,1,50},{200002,0,1,50},{200003,0,1,50},{200006,0,1,50},{200010,0,1,50},{200011,0,1,50},{200012,0,1,50},{200013,0,1,50},{200015,0,1,50},{200016,0,1,50},{200017,0,1,50},{200019,0,1,50},{201000,0,1,50},{201001,0,1,50},{201002,0,1,50},{201003,0,1,50},{201006,0,1,50},{201010,0,1,50},{201011,0,1,50},{201012,0,1,50},{201013,0,1,50},{201015,0,1,50},{201016,0,1,50},{201017,0,1,50},{201019,0,1,50},{202000,0,1,50},{202001,0,1,50},{202002,0,1,50},{202003,0,1,50},{202006,0,1,50},{202010,0,1,50},{202011,0,1,50},{202012,0,1,50},{202013,0,1,50},{202015,0,1,50},{202016,0,1,50},{202017,0,1,50},{202019,0,1,50},{110002,0,1,0},{110003,0,1,0},{110004,0,1,100},{110005,0,1,100},{110010,0,1,50},{110011,0,1,50},{110012,0,1,50},{110009,0,5,100},{110023,0,1,2},{110024,0,1,2},{110025,0,1,2},{110026,0,1,2},{110030,0,1,2},{110031,0,1,2},{110032,0,1,2},{110033,0,1,2},{110038,0,1,2},{110039,0,1,2},{110040,0,1,2},
S62: 110067 | T62: 诱惑之光书 | U62: 1 | V62: 0 | W62: 1 | X62: 2 | Y62: ="{"&RC[-6]&","&RC[-3]&","&RC[-2]&","&RC[-1]&"}" -> {110067,0,1,2} | Z62: =R[-1]C&RC[-1] -> {200000,0,1,70},{200001,0,1,70},{200002,0,1,70},{200003,0,1,70},{200006,0,1,70},{200010,0,1,70},{200011,0,1,70},{200012,0,1,70},{200013,0,1,70},{200015,0,1,70},{200016,0,1,70},{200017,0,1,70},{200019,0,1,70},{201000,0,1,70},{201001,0,1,70},{201002,0,1,70},{201003,0,1,70},{201006,0,1,70},{201010,0,1,70},{201011,0,1,70},{201012,0,1,70},{201013,0,1,70},{201015,0,1,70},{201016,0,1,70},{201017,0,1,70},{201019,0,1,70},{202000,0,1,70},{202001,0,1,30},{202002,0,1,30},{202003,0,1,30},{202006,0,1,30},{202010,0,1,30},{202011,0,1,30},{202012,0,1,30},{202013,0,1,30},{202015,0,1,30},{202016,0,1,30},{202017,0,1,30},{202019,0,1,30},{110002,0,1,0},{110003,0,1,0},{110004,0,1,100},{110005,0,1,100},{110010,0,1,50},{110011,0,1,50},{110012,0,1,50},{110009,0,3,100},{110023,0,1,2},{110024,0,1,2},{110025,0,1,2},{110026,0,1,2},{110030,0,1,2},{110031,0,1,2},{110032,0,1,2},{110033,0,1,2},{110038,0,1,2},{110039,0,1,2},{110040,0,1,2},{110067,0,1,2} | AB62: 110067 | AC62: 诱惑之光书 | AD62: 1 | AE62: 0 | AF62: 1 | AG62: 2 | AH62: ="{"&RC[-6]&","&RC[-3]&","&RC[-2]&","&RC[-1]&"}" -> {110067,0,1,2} | AI62: =R[-1]C&RC[-1] -> {200000,0,1,60},{200001,0,1,60},{200002,0,1,60},{200003,0,1,60},{200006,0,1,60},{200010,0,1,60},{200011,0,1,60},{200012,0,1,60},{200013,0,1,60},{200015,0,1,60},{200016,0,1,60},{200017,0,1,60},{200019,0,1,60},{201000,0,1,60},{201001,0,1,60},{201002,0,1,60},{201003,0,1,60},{201006,0,1,60},{201010,0,1,60},{201011,0,1,60},{201012,0,1,60},{201013,0,1,60},{201015,0,1,60},{201016,0,1,60},{201017,0,1,60},{201019,0,1,60},{202000,0,1,60},{202001,0,1,40},{202002,0,1,40},{202003,0,1,40},{202006,0,1,40},{202010,0,1,40},{202011,0,1,40},{202012,0,1,40},{202013,0,1,40},{202015,0,1,40},{202016,0,1,40},{202017,0,1,40},{202019,0,1,40},{110002,0,1,0},{110003,0,1,0},{110004,0,1,100},{110005,0,1,100},{110010,0,1,50},{110011,0,1,50},{110012,0,1,50},{110009,0,4,100},{110023,0,1,2},{110024,0,1,2},{110025,0,1,2},{110026,0,1,2},{110030,0,1,2},{110031,0,1,2},{110032,0,1,2},{110033,0,1,2},{110038,0,1,2},{110039,0,1,2},{110040,0,1,2},{110067,0,1,2} | AK62: 110067 | AL62: 诱惑之光书 | AM62: 1 | AN62: 0 | AO62: 1 | AP62: 2 | AQ62: ="{"&RC[-6]&","&RC[-3]&","&RC[-2]&","&RC[-1]&"}" -> {110067,0,1,2} | AR62: =R[-1]C&RC[-1] -> {200000,0,1,50},{200001,0,1,50},{200002,0,1,50},{200003,0,1,50},{200006,0,1,50},{200010,0,1,50},{200011,0,1,50},{200012,0,1,50},{200013,0,1,50},{200015,0,1,50},{200016,0,1,50},{200017,0,1,50},{200019,0,1,50},{201000,0,1,50},{201001,0,1,50},{201002,0,1,50},{201003,0,1,50},{201006,0,1,50},{201010,0,1,50},{201011,0,1,50},{201012,0,1,50},{201013,0,1,50},{201015,0,1,50},{201016,0,1,50},{201017,0,1,50},{201019,0,1,50},{202000,0,1,50},{202001,0,1,50},{202002,0,1,50},{202003,0,1,50},{202006,0,1,50},{202010,0,1,50},{202011,0,1,50},{202012,0,1,50},{202013,0,1,50},{202015,0,1,50},{202016,0,1,50},{202017,0,1,50},{202019,0,1,50},{110002,0,1,0},{110003,0,1,0},{110004,0,1,100},{110005,0,1,100},{110010,0,1,50},{110011,0,1,50},{110012,0,1,50},{110009,0,5,100},{110023,0,1,2},{110024,0,1,2},{110025,0,1,2},{110026,0,1,2},{110030,0,1,2},{110031,0,1,2},{110032,0,1,2},{110033,0,1,2},{110038,0,1,2},{110039,0,1,2},{110040,0,1,2},{110067,0,1,2}
X64: 掉落数量 | Y64: 概率／100 | AG64: 掉落数量 | AH64: 概率／100 | AP64: 掉落数量 | AQ64: 概率／100
X65: 0 | Y65: =10000-R[1]C -> 5000 | Z65: ="{"&RC[-2]&","&RC[-1]&"}," -> {0,5000}, | AG65: 0 | AH65: =10000-R[1]C -> 5000 | AI65: ="{"&RC[-2]&","&RC[-1]&"}," -> {0,5000}, | AP65: 0 | AQ65: =10000-R[1]C -> 5000 | AR65: ="{"&RC[-2]&","&RC[-1]&"}," -> {0,5000},
T66: BOSS怪掉落 | X66: 4 | Y66: 5000 | Z66: ="{"&RC[-2]&","&RC[-1]&"}" -> {4,5000} | AC66: BOSS怪掉落 | AG66: 4 | AH66: 5000 | AI66: ="{"&RC[-2]&","&RC[-1]&"}" -> {4,5000} | AL66: BOSS怪掉落 | AP66: 4 | AQ66: 5000 | AR66: ="{"&RC[-2]&","&RC[-1]&"}" -> {4,5000}
Z68: ="[{0,["&R[-3]C&R[-2]C&"],["&R[-6]C&"]}]" -> [{0,[{0,5000},{4,5000}],[{200000,0,1,70},{200001,0,1,70},{200002,0,1,70},{200003,0,1,70},{200006,0,1,70},{200010,0,1,70},{200011,0,1,70},{200012,0,1,70},{200013,0,1,70},{200015,0,1,70},{200016,0,1,70},{200017,0,1,70},{200019,0,1,70},{201000,0,1,70},{201001,0,1,70},{201002,0,1,70},{201003,0,1,70},{201006,0,1,70},{201010,0,1,70},{201011,0,1,70},{201012,0,1,70},{201013,0,1,70},{201015,0,1,70},{201016,0,1,70},{201017,0,1,70},{201019,0,1,70},{202000,0,1,70},{202001,0,1,30},{202002,0,1,30},{202003,0,1,30},{202006,0,1,30},{202010,0,1,30},{202011,0,1,30},{202012,0,1,30},{202013,0,1,30},{202015,0,1,30},{202016,0,1,30},{202017,0,1,30},{202019,0,1,30},{110002,0,1,0},{110003,0,1,0},{110004,0,1,100},{110005,0,1,100},{110010,0,1,50},{110011,0,1,50},{110012,0,1,50},{110009,0,3,100},{110023,0,1,2},{110024,0,1,2},{110025,0,1,2},{110026,0,1,2},{110030,0,1,2},{110031,0,1,2},{110032,0,1,2},{110033,0,1,2},{110038,0,1,2},{110039,0,1,2},{110040,0,1,2},{110067,0,1,2}]}] | AI68: ="[{0,["&R[-3]C&R[-2]C&"],["&R[-6]C&"]}]" -> [{0,[{0,5000},{4,5000}],[{200000,0,1,60},{200001,0,1,60},{200002,0,1,60},{200003,0,1,60},{200006,0,1,60},{200010,0,1,60},{200011,0,1,60},{200012,0,1,60},{200013,0,1,60},{200015,0,1,60},{200016,0,1,60},{200017,0,1,60},{200019,0,1,60},{201000,0,1,60},{201001,0,1,60},{201002,0,1,60},{201003,0,1,60},{201006,0,1,60},{201010,0,1,60},{201011,0,1,60},{201012,0,1,60},{201013,0,1,60},{201015,0,1,60},{201016,0,1,60},{201017,0,1,60},{201019,0,1,60},{202000,0,1,60},{202001,0,1,40},{202002,0,1,40},{202003,0,1,40},{202006,0,1,40},{202010,0,1,40},{202011,0,1,40},{202012,0,1,40},{202013,0,1,40},{202015,0,1,40},{202016,0,1,40},{202017,0,1,40},{202019,0,1,40},{110002,0,1,0},{110003,0,1,0},{110004,0,1,100},{110005,0,1,100},{110010,0,1,50},{110011,0,1,50},{110012,0,1,50},{110009,0,4,100},{110023,0,1,2},{110024,0,1,2},{110025,0,1,2},{110026,0,1,2},{110030,0,1,2},{110031,0,1,2},{110032,0,1,2},{110033,0,1,2},{110038,0,1,2},{110039,0,1,2},{110040,0,1,2},{110067,0,1,2}]}] | AR68: ="[{0,["&R[-3]C&R[-2]C&"],["&R[-6]C&"]}]" -> [{0,[{0,5000},{4,5000}],[{200000,0,1,50},{200001,0,1,50},{200002,0,1,50},{200003,0,1,50},{200006,0,1,50},{200010,0,1,50},{200011,0,1,50},{200012,0,1,50},{200013,0,1,50},{200015,0,1,50},{200016,0,1,50},{200017,0,1,50},{200019,0,1,50},{201000,0,1,50},{201001,0,1,50},{201002,0,1,50},{201003,0,1,50},{201006,0,1,50},{201010,0,1,50},{201011,0,1,50},{201012,0,1,50},{201013,0,1,50},{201015,0,1,50},{201016,0,1,50},{201017,0,1,50},{201019,0,1,50},{202000,0,1,50},{202001,0,1,50},{202002,0,1,50},{202003,0,1,50},{202006,0,1,50},{202010,0,1,50},{202011,0,1,50},{202012,0,1,50},{202013,0,1,50},{202015,0,1,50},{202016,0,1,50},{202017,0,1,50},{202019,0,1,50},{110002,0,1,0},{110003,0,1,0},{110004,0,1,100},{110005,0,1,100},{110010,0,1,50},{110011,0,1,50},{110012,0,1,50},{110009,0,5,100},{110023,0,1,2},{110024,0,1,2},{110025,0,1,2},{110026,0,1,2},{110030,0,1,2},{110031,0,1,2},{110032,0,1,2},{110033,0,1,2},{110038,0,1,2},{110039,0,1,2},{110040,0,1,2},{110067,0,1,2}]}]

Sheet: 打宝BOSS
A1: 打宝BOSS掉落
A2: 15级BOSS（1-10级装备掉落） | J2: 20级BOSS（1-30级装备掉落） | S2: 30级BOSS（1-30级装备掉落） | AB2: 35级BOSS（1-30级装备掉落+首冲武器） | AK2: 40级BOSS（1-35级装备掉落+首冲武器） | AT2: 45级BOSS（15-40级装备掉落） | BC2: 50级BOSS（15-40级装备掉落）
A3: ID | B3: 名称 | C3: 品质 | D3: 是否绑定 | E3: 数量 | F3: 概率 | J3: ID | K3: 名称 | L3: 品质 | M3: 是否绑定 | N3: 数量 | S3: ID | T3: 名称 | U3: 品质 | V3: 是否绑定 | W3: 数量 | AB3: ID | AC3: 名称 | AD3: 品质 | AE3: 是否绑定 | AF3: 数量 | AK3: ID | AL3: 名称 | AM3: 品质 | AN3: 是否绑定 | AO3: 数量 | AT3: ID | AU3: 名称 | AV3: 品质 | AW3: 是否绑定 | AX3: 数量 | BC3: ID | BD3: 名称 | BE3: 品质 | BF3: 是否绑定 | BG3: 数量
A4: 200000 | B4: 八荒 | C4: 1 | D4: 0 | E4: 1 | F4: 100 | G4: ="{"&RC[-6]&","&RC[-3]&","&RC[-2]&","&RC[-1]&"}," -> {200000,0,1,100}, | H4: =RC[-1] -> {200000,0,1,100}, | J4: 200000 | K4: 八荒 | L4: 1 | M4: 0 | N4: 1 | O4: 40 | P4: ="{"&RC[-6]&","&RC[-3]&","&RC[-2]&","&RC[-1]&"}," -> {200000,0,1,40}, | Q4: =RC[-1] -> {200000,0,1,40}, | S4: 200000 | T4: 八荒 | U4: 1 | V4: 0 | W4: 1 | X4: 40 | Y4: ="{"&RC[-6]&","&RC[-3]&","&RC[-2]&","&RC[-1]&"}," -> {200000,0,1,40}, | Z4: =RC[-1] -> {200000,0,1,40}, | AB4: 200000 | AC4: 八荒 | AD4: 1 | AE4: 0 | AF4: 1 | AG4: 40 | AH4: ="{"&RC[-6]&","&RC[-3]&","&RC[-2]&","&RC[-1]&"}," -> {200000,0,1,40}, | AI4: =RC[-1] -> {200000,0,1,40}, | AK4: 200010 | AL4: 炼狱 | AM4: 1 | AN4: 0 | AO4: 1 | AP4: 100 | AQ4: ="{"&RC[-6]&","&RC[-3]&","&RC[-2]&","&RC[-1]&"}," -> {200010,0,1,100}, | AR4: =RC[-1] -> {200010,0,1,100}, | AT4: 200010 | AU4: 炼狱 | AV4: 1 | AW4: 0 | AX4: 1 | AY4: 80 | AZ4: ="{"&RC[-6]&","&RC[-3]&","&RC[-2]&","&RC[-1]&"}," -> {200010,0,1,80}, | BA4: =RC[-1] -> {200010,0,1,80}, | BC4: 200010 | BD4: 炼狱 | BE4: 1 | BF4: 0 | BG4: 1 | BH4: 60 | BI4: ="{"&RC[-6]&","&RC[-3]&","&RC[-2]&","&RC[-1]&"}," -> {200010,0,1,60}, | BJ4: =RC[-1] -> {200010,0,1,60},
A5: 200001 | B5: 轻盔 | C5: 1 | D5: 0 | E5: 1 | F5: 100 | G5: ="{"&RC[-6]&","&RC[-3]&","&RC[-2]&","&RC[-1]&"}," -> {200001,0,1,100}, | H5: =R[-1]C&RC[-1] -> {200000,0,1,100},{200001,0,1,100}, | J5: 200001 | K5: 轻盔 | L5: 1 | M5: 0 | N5: 1 | O5: 40 | P5: ="{"&RC[-6]&","&RC[-3]&","&RC[-2]&","&RC[-1]&"}," -> {200001,0,1,40}, | Q5: =R[-1]C&RC[-1] -> {200000,0,1,40},{200001,0,1,40}, | S5: 200001 | T5: 轻盔 | U5: 1 | V5: 0 | W5: 1 | X5: 40 | Y5: ="{"&RC[-6]&","&RC[-3]&","&RC[-2]&","&RC[-1]&"}," -> {200001,0,1,40}, | Z5: =R[-1]C&RC[-1] -> {200000,0,1,40},{200001,0,1,40}, | AB5: 200001 | AC5: 轻盔 | AD5: 1 | AE5: 0 | AF5: 1 | AG5: 40 | AH5: ="{"&RC[-6]&","&RC[-3]&","&RC[-2]&","&RC[-1]&"}," -> {200001,0,1,40}, | AI5: =R[-1]C&RC[-1] -> {200000,0,1,40},{200001,0,1,40}, | AK5: 200011 | AL5: 绿色项链 | AM5: 1 | AN5: 0 | AO5: 1 | AP5: 100 | AQ5: ="{"&RC[-6]&","&RC[-3]&","&RC[-2]&","&RC[-1]&"}," -> {200011,0,1,100}, | AR5: =R[-1]C&RC[-1] -> {200010,0,1,100},{200011,0,1,100}, | AT5: 200011 | AU5: 绿色项链 | AV5: 1 | AW5: 0 | AX5: 1 | AY5: 80 | AZ5: ="{"&RC[-6]&","&RC[-3]&","&RC[-2]&","&RC[-1]&"}," -> {200011,0,1,80}, | BA5: =R[-1]C&RC[-1] -> {200010,0,1,80},{200011,0,1,80}, | BC5: 200011 | BD5: 绿色项链 | BE5: 1 | BF5: 0 | BG5: 1 | BH5: 60 | BI5: ="{"&RC[-6]&","&RC[-3]&","&RC[-2]&","&RC[-1]&"}," -> {200011,0,1,60}, | BJ5: =R[-1]C&RC[-1] -> {200010,0,1,60},{200011,0,1,60},
A6: 200002 | B6: 珊瑚戒指 | C6: 1 | D6: 0 | E6: 1 | F6: 100 | G6: ="{"&RC[-6]&","&RC[-3]&","&RC[-2]&","&RC[-1]&"}," -> {200002,0,1,100}, | H6: =R[-1]C&RC[-1] -> {200000,0,1,100},{200001,0,1,100},{200002,0,1,100}, | J6: 200002 | K6: 珊瑚戒指 | L6: 1 | M6: 0 | N6: 1 | O6: 40 | P6: ="{"&RC[-6]&","&RC[-3]&","&RC[-2]&","&RC[-1]&"}," -> {200002,0,1,40}, | Q6: =R[-1]C&RC[-1] -> {200000,0,1,40},{200001,0,1,40},{200002,0,1,40}, | S6: 200002 | T6: 珊瑚戒指 | U6: 1 | V6: 0 | W6: 1 | X6: 40 | Y6: ="{"&RC[-6]&","&RC[-3]&","&RC[-2]&","&RC[-1]&"}," -> {200002,0,1,40}, | Z6: =R[-1]C&RC[-1] -> {200000,0,1,40},{200001,0,1,40},{200002,0,1,40}, | AB6: 200002 | AC6: 珊瑚戒指 | AD6: 1 | AE6: 0 | AF6: 1 | AG6: 40 | AH6: ="{"&RC[-6]&","&RC[-3]&","&RC[-2]&","&RC[-1]&"}," -> {200002,0,1,40}, | AI6: =R[-1]C&RC[-1] -> {200000,0,1,40},{200001,0,1,40},{200002,0,1,40}, | AK6: 200012 | AL6: 战神盔甲 | AM6: 1 | AN6: 0 | AO6: 1 | AP6: 100 | AQ6: ="{"&RC[-6]&","&RC[-3]&","&RC[-2]&","&RC[-1]&"}," -> {200012,0,1,100}, | AR6: =R[-1]C&RC[-1] -> {200010,0,1,100},{200011,0,1,100},{200012,0,1,100}, | AT6: 200012 | AU6: 战神盔甲 | AV6: 1 | AW6: 0 | AX6: 1 | AY6: 80 | AZ6: ="{"&RC[-6]&","&RC[-3]&","&RC[-2]&","&RC[-1]&"}," -> {200012,0,1,80}, | BA6: =R[-1]C&RC[-1] -> {200010,0,1,80},{200011,0,1,80},{200012,0,1,80}, | BC6: 200012 | BD6: 战神盔甲 | BE6: 1 | BF6: 0 | BG6: 1 | BH6: 60 | BI6: ="{"&RC[-6]&","&RC[-3]&","&RC[-2]&","&RC[-1]&"}," -> {200012,0,1,60}, | BJ6: =R[-1]C&RC[-1] -> {200010,0,1,60},{200011,0,1,60},{200012,0,1,60},
A7: 200003 | B7: 魔力手镯 | C7: 1 | D7: 0 | E7: 1 | F7: 100 | G7: ="{"&RC[-6]&","&RC[-3]&","&RC[-2]&","&RC[-1]&"}," -> {200003,0,1,100}, | H7: =R[-1]C&RC[-1] -> {200000,0,1,100},{200001,0,1,100},{200002,0,1,100},{200003,0,1,100}, | J7: 200003 | K7: 魔力手镯 | L7: 1 | M7: 0 | N7: 1 | O7: 40 | P7: ="{"&RC[-6]&","&RC[-3]&","&RC[-2]&","&RC[-1]&"}," -> {200003,0,1,40}, | Q7: =R[-1]C&RC[-1] -> {200000,0,1,40},{200001,0,1,40},{200002,0,1,40},{200003,0,1,40}, | S7: 200003 | T7: 魔力手镯 | U7: 1 | V7: 0 | W7: 1 | X7: 40 | Y7: ="{"&RC[-6]&","&RC[-3]&","&RC[-2]&","&RC[-1]&"}," -> {200003,0,1,40}, | Z7: =R[-1]C&RC[-1] -> {200000,0,1,40},{200001,0,1,40},{200002,0,1,40},{200003,0,1,40}, | AB7: 200003 | AC7: 魔力手镯 | AD7: 1 | AE7: 0 | AF7: 1 | AG7: 40 | AH7: ="{"&RC[-6]&","&RC[-3]&","&RC[-2]&","&RC[-1]&"}," -> {200003,0,1,40}, | AI7: =R[-1]C&RC[-1] -> {200000,0,1,40},{200001,0,1,40},{200002,0,1,40},{200003,0,1,40}, | AK7: 200013 | AL7: 力量戒指 | AM7: 1 | AN7: 0 | AO7: 1 | AP7: 100 | AQ7: ="{"&RC[-6]&","&RC[-3]&","&RC[-2]&","&RC[-1]&"}," -> {200013,0,1,100}, | AR7: =R[-1]C&RC[-1] -> {200010,0,1,100},{200011,0,1,100},{200012,0,1,100},{200013,0,1,100}, | AT7: 200013 | AU7: 力量戒指 | AV7: 1 | AW7: 0 | AX7: 1 | AY7: 80 | AZ7: ="{"&RC[-6]&","&RC[-3]&","&RC[-2]&","&RC[-1]&"}," -> {200013,0,1,80}, | BA7: =R[-1]C&RC[-1] -> {200010,0,1,80},{200011,0,1,80},{200012,0,1,80},{200013,0,1,80}, | BC7: 200013 | BD7: 力量戒指 | BE7: 1 | BF7: 0 | BG7: 1 | BH7: 60 | BI7: ="{"&RC[-6]&","&RC[-3]&","&RC[-2]&","&RC[-1]&"}," -> {200013,0,1,60}, | BJ7: =R[-1]C&RC[-1] -> {200010,0,1,60},{200011,0,1,60},{200012,0,1,60},{200013,0,1,60},
A8: 200006 | B8: 恶魔项链 | C8: 1 | D8: 0 | E8: 1 | F8: 100 | G8: ="{"&RC[-6]&","&RC[-3]&","&RC[-2]&","&RC[-1]&"}," -> {200006,0,1,100}, | H8: =R[-1]C&RC[-1] -> {200000,0,1,100},{200001,0,1,100},{200002,0,1,100},{200003,0,1,100},{200006,0,1,100}, | J8: 200006 | K8: 恶魔项链 | L8: 1 | M8: 0 | N8: 1 | O8: 40 | P8: ="{"&RC[-6]&","&RC[-3]&","&RC[-2]&","&RC[-1]&"}," -> {200006,0,1,40}, | Q8: =R[-1]C&RC[-1] -> {200000,0,1,40},{200001,0,1,40},{200002,0,1,40},{200003,0,1,40},{200006,0,1,40}, | S8: 200006 | T8: 恶魔项链 | U8: 1 | V8: 0 | W8: 1 | X8: 40 | Y8: ="{"&RC[-6]&","&RC[-3]&","&RC[-2]&","&RC[-1]&"}," -> {200006,0,1,40}, | Z8: =R[-1]C&RC[-1] -> {200000,0,1,40},{200001,0,1,40},{200002,0,1,40},{200003,0,1,40},{200006,0,1,40}, | AB8: 200006 | AC8: 恶魔项链 | AD8: 1 | AE8: 0 | AF8: 1 | AG8: 40 | AH8: ="{"&RC[-6]&","&RC[-3]&","&RC[-2]&","&RC[-1]&"}," -> {200006,0,1,40}, | AI8: =R[-1]C&RC[-1] -> {200000,0,1,40},{200001,0,1,40},{200002,0,1,40},{200003,0,1,40},{200006,0,1,40}, | AK8: 200015 | AL8: 战士头盔 | AM8: 1 | AN8: 0 | AO8: 1 | AP8: 100 | AQ8: ="{"&RC[-6]&","&RC[-3]&","&RC[-2]&","&RC[-1]&"}," -> {200015,0,1,100}, | AR8: =R[-1]C&RC[-1] -> {200010,0,1,100},{200011,0,1,100},{200012,0,1,100},{200013,0,1,100},{200015,0,1,100}, | AT8: 200015 | AU8: 战士头盔 | AV8: 1 | AW8: 0 | AX8: 1 | AY8: 80 | AZ8: ="{"&RC[-6]&","&RC[-3]&","&RC[-2]&","&RC[-1]&"}," -> {200015,0,1,80}, | BA8: =R[-1]C&RC[-1] -> {200010,0,1,80},{200011,0,1,80},{200012,0,1,80},{200013,0,1,80},{200015,0,1,80}, | BC8: 200015 | BD8: 战士头盔 | BE8: 1 | BF8: 0 | BG8: 1 | BH8: 60 | BI8: ="{"&RC[-6]&","&RC[-3]&","&RC[-2]&","&RC[-1]&"}," -> {200015,0,1,60}, | BJ8: =R[-1]C&RC[-1] -> {200010,0,1,60},{200011,0,1,60},{200012,0,1,60},{200013,0,1,60},{200015,0,1,60},
A9: 201000 | B9: 海魂 | C9: 1 | D9: 0 | E9: 1 | F9: 100 | G9: ="{"&RC[-6]&","&RC[-3]&","&RC[-2]&","&RC[-1]&"}," -> {201000,0,1,100}, | H9: =R[-1]C&RC[-1] -> {200000,0,1,100},{200001,0,1,100},{200002,0,1,100},{200003,0,1,100},{200006,0,1,100},{201000,0,1,100}, | J9: 200010 | K9: 炼狱 | L9: 1 | M9: 0 | N9: 1 | O9: 5 | P9: ="{"&RC[-6]&","&RC[-3]&","&RC[-2]&","&RC[-1]&"}," -> {200010,0,1,5}, | Q9: =R[-1]C&RC[-1] -> {200000,0,1,40},{200001,0,1,40},{200002,0,1,40},{200003,0,1,40},{200006,0,1,40},{200010,0,1,5}, | S9: 200010 | T9: 炼狱 | U9: 1 | V9: 0 | W9: 1 | X9: 5 | Y9: ="{"&RC[-6]&","&RC[-3]&","&RC[-2]&","&RC[-1]&"}," -> {200010,0,1,5}, | Z9: =R[-1]C&RC[-1] -> {200000,0,1,40},{200001,0,1,40},{200002,0,1,40},{200003,0,1,40},{200006,0,1,40},{200010,0,1,5}, | AB9: 200010 | AC9: 炼狱 | AD9: 1 | AE9: 0 | AF9: 1 | AG9: 5 | AH9: ="{"&RC[-6]&","&RC[-3]&","&RC[-2]&","&RC[-1]&"}," -> {200010,0,1,5}, | AI9: =R[-1]C&RC[-1] -> {200000,0,1,40},{200001,0,1,40},{200002,0,1,40},{200003,0,1,40},{200006,0,1,40},{200010,0,1,5}, | AK9: 200016 | AL9: 阎罗手镯 | AM9: 1 | AN9: 0 | AO9: 1 | AP9: 100 | AQ9: ="{"&RC[-6]&","&RC[-3]&","&RC[-2]&","&RC[-1]&"}," -> {200016,0,1,100}, | AR9: =R[-1]C&RC[-1] -> {200010,0,1,100},{200011,0,1,100},{200012,0,1,100},{200013,0,1,100},{200015,0,1,100},{200016,0,1,100}, | AT9: 200016 | AU9: 阎罗手镯 | AV9: 1 | AW9: 0 | AX9: 1 | AY9: 80 | AZ9: ="{"&RC[-6]&","&RC[-3]&","&RC[-2]&","&RC[-1]&"}," -> {200016,0,1,80}, | BA9: =R[-1]C&RC[-1] -> {200010,0,1,80},{200011,0,1,80},{200012,0,1,80},{200013,0,1,80},{200015,0,1,80},{200016,0,1,80}, | BC9: 200016 | BD9: 阎罗手镯 | BE9: 1 | BF9: 0 | BG9: 1 | BH9: 60 | BI9: ="{"&RC[-6]&","&RC[-3]&","&RC[-2]&","&RC[-1]&"}," -> {200016,0,1,60}, | BJ9: =R[-1]C&RC[-1] -> {200010,0,1,60},{200011,0,1,60},{200012,0,1,60},{200013,0,1,60},{200015,0,1,60},{200016,0,1,60},
A10: 201001 | B10: 轻盔 | C10: 1 | D10: 0 | E10: 1 | F10: 100 | G10: ="{"&RC[-6]&","&RC[-3]&","&RC[-2]&","&RC[-1]&"}," -> {201001,0,1,100}, | H10: =R[-1]C&RC[-1] -> {200000,0,1,100},{200001,0,1,100},{200002,0,1,100},{200003,0,1,100},{200006,0,1,100},{201000,0,1,100},{201001,0,1,100}, | J10: 200011 | K10: 绿色项链 | L10: 1 | M10: 0 | N10: 1 | O10: 10 | P10: ="{"&RC[-6]&","&RC[-3]&","&RC[-2]&","&RC[-1]&"}," -> {200011,0,1,10}, | Q10: =R[-1]C&RC[-1] -> {200000,0,1,40},{200001,0,1,40},{200002,0,1,40},{200003,0,1,40},{200006,0,1,40},{200010,0,1,5},{200011,0,1,10}, | S10: 200011 | T10: 绿色项链 | U10: 1 | V10: 0 | W10: 1 | X10: 10 | Y10: ="{"&RC[-6]&","&RC[-3]&","&RC[-2]&","&RC[-1]&"}," -> {200011,0,1,10}, | Z10: =R[-1]C&RC[-1] -> {200000,0,1,40},{200001,0,1,40},{200002,0,1,40},{200003,0,1,40},{200006,0,1,40},{200010,0,1,5},{200011,0,1,10}, | AB10: 200011 | AC10: 绿色项链 | AD10: 1 | AE10: 0 | AF10: 1 | AG10: 10 | AH10: ="{"&RC[-6]&","&RC[-3]&","&RC[-2]&","&RC[-1]&"}," -> {200011,0,1,10}, | AI10: =R[-1]C&RC[-1] -> {200000,0,1,40},{200001,0,1,40},{200002,0,1,40},{200003,0,1,40},{200006,0,1,40},{200010,0,1,5},{200011,0,1,10}, | AK10: 200017 | AL10: 战士腰带 | AM10: 1 | AN10: 0 | AO10: 1 | AP10: 100 | AQ10: ="{"&RC[-6]&","&RC[-3]&","&RC[-2]&","&RC[-1]&"}," -> {200017,0,1,100}, | AR10: =R[-1]C&RC[-1] -> {200010,0,1,100},{200011,0,1,100},{200012,0,1,100},{200013,0,1,100},{200015,0,1,100},{200016,0,1,100},{200017,0,1,100}, | AT10: 200017 | AU10: 战士腰带 | AV10: 1 | AW10: 0 | AX10: 1 | AY10: 80 | AZ10: ="{"&RC[-6]&","&RC[-3]&","&RC[-2]&","&RC[-1]&"}," -> {200017,0,1,80}, | BA10: =R[-1]C&RC[-1] -> {200010,0,1,80},{200011,0,1,80},{200012,0,1,80},{200013,0,1,80},{200015,0,1,80},{200016,0,1,80},{200017,0,1,80}, | BC10: 200017 | BD10: 战士腰带 | BE10: 1 | BF10: 0 | BG10: 1 | BH10: 60 | BI10: ="{"&RC[-6]&","&RC[-3]&","&RC[-2]&","&RC[-1]&"}," -> {200017,0,1,60}, | BJ10: =R[-1]C&RC[-1] -> {200010,0,1,60},{200011,0,1,60},{200012,0,1,60},{200013,0,1,60},{200015,0,1,60},{200016,0,1,60},{200017,0,1,60},
A11: 201002 | B11: 金戒指 | C11: 1 | D11: 0 | E11: 1 | F11: 100 | G11: ="{"&RC[-6]&","&RC[-3]&","&RC[-2]&","&RC[-1]&"}," -> {201002,0,1,100}, | H11: =R[-1]C&RC[-1] -> {200000,0,1,100},{200001,0,1,100},{200002,0,1,100},{200003,0,1,100},{200006,0,1,100},{201000,0,1,100},{201001,0,1,100},{201002,0,1,100}, | J11: 200012 | K11: 战神盔甲 | L11: 1 | M11: 0 | N11: 1 | O11: 10 | P11: ="{"&RC[-6]&","&RC[-3]&","&RC[-2]&","&RC[-1]&"}," -> {200012,0,1,10}, | Q11: =R[-1]C&RC[-1] -> {200000,0,1,40},{200001,0,1,40},{200002,0,1,40},{200003,0,1,40},{200006,0,1,40},{200010,0,1,5},{200011,0,1,10},{200012,0,1,10}, | S11: 200012 | T11: 战神盔甲 | U11: 1 | V11: 0 | W11: 1 | X11: 10 | Y11: ="{"&RC[-6]&","&RC[-3]&","&RC[-2]&","&RC[-1]&"}," -> {200012,0,1,10}, | Z11: =R[-1]C&RC[-1] -> {200000,0,1,40},{200001,0,1,40},{200002,0,1,40},{200003,0,1,40},{200006,0,1,40},{200010,0,1,5},{200011,0,1,10},{200012,0,1,10}, | AB11: 200012 | AC11: 战神盔甲 | AD11: 1 | AE11: 0 | AF11: 1 | AG11: 10 | AH11: ="{"&RC[-6]&","&RC[-3]&","&RC[-2]&","&RC[-1]&"}," -> {200012,0,1,10}, | AI11: =R[-1]C&RC[-1] -> {200000,0,1,40},{200001,0,1,40},{200002,0,1,40},{200003,0,1,40},{200006,0,1,40},{200010,0,1,5},{200011,0,1,10},{200012,0,1,10}, | AK11: 200019 | AL11: 战士鞋子 | AM11: 1 | AN11: 0 | AO11: 1 | AP11: 100 | AQ11: ="{"&RC[-6]&","&RC[-3]&","&RC[-2]&","&RC[-1]&"}," -> {200019,0,1,100}, | AR11: =R[-1]C&RC[-1] -> {200010,0,1,100},{200011,0,1,100},{200012,0,1,100},{200013,0,1,100},{200015,0,1,100},{200016,0,1,100},{200017,0,1,100},{200019,0,1,100}, | AT11: 200019 | AU11: 战士鞋子 | AV11: 1 | AW11: 0 | AX11: 1 | AY11: 80 | AZ11: ="{"&RC[-6]&","&RC[-3]&","&RC[-2]&","&RC[-1]&"}," -> {200019,0,1,80}, | BA11: =R[-1]C&RC[-1] -> {200010,0,1,80},{200011,0,1,80},{200012,0,1,80},{200013,0,1,80},{200015,0,1,80},{200016,0,1,80},{200017,0,1,80},{200019,0,1,80}, | BC11: 200019 | BD11: 战士鞋子 | BE11: 1 | BF11: 0 | BG11: 1 | BH11: 60 | BI11: ="{"&RC[-6]&","&RC[-3]&","&RC[-2]&","&RC[-1]&"}," -> {200019,0,1,60}, | BJ11: =R[-1]C&RC[-1] -> {200010,0,1,60},{200011,0,1,60},{200012,0,1,60},{200013,0,1,60},{200015,0,1,60},{200016,0,1,60},{200017,0,1,60},{200019,0,1,60},
A12: 201003 | B12: 魔法手镯 | C12: 1 | D12: 0 | E12: 1 | F12: 100 | G12: ="{"&RC[-6]&","&RC[-3]&","&RC[-2]&","&RC[-1]&"}," -> {201003,0,1,100}, | H12: =R[-1]C&RC[-1] -> {200000,0,1,100},{200001,0,1,100},{200002,0,1,100},{200003,0,1,100},{200006,0,1,100},{201000,0,1,100},{201001,0,1,100},{201002,0,1,100},{201003,0,1,100}, | J12: 201000 | K12: 海魂 | L12: 1 | M12: 0 | N12: 1 | O12: 40 | P12: ="{"&RC[-6]&","&RC[-3]&","&RC[-2]&","&RC[-1]&"}," -> {201000,0,1,40}, | Q12: =R[-1]C&RC[-1] -> {200000,0,1,40},{200001,0,1,40},{200002,0,1,40},{200003,0,1,40},{200006,0,1,40},{200010,0,1,5},{200011,0,1,10},{200012,0,1,10},{201000,0,1,40}, | S12: 200013 | T12: 力量戒指 | U12: 1 | V12: 0 | W12: 1 | X12: 10 | Y12: ="{"&RC[-6]&","&RC[-3]&","&RC[-2]&","&RC[-1]&"}," -> {200013,0,1,10}, | Z12: =R[-1]C&RC[-1] -> {200000,0,1,40},{200001,0,1,40},{200002,0,1,40},{200003,0,1,40},{200006,0,1,40},{200010,0,1,5},{200011,0,1,10},{200012,0,1,10},{200013,0,1,10}, | AB12: 200013 | AC12: 力量戒指 | AD12: 1 | AE12: 0 | AF12: 1 | AG12: 10 | AH12: ="{"&RC[-6]&","&RC[-3]&","&RC[-2]&","&RC[-1]&"}," -> {200013,0,1,10}, | AI12: =R[-1]C&RC[-1] -> {200000,0,1,40},{200001,0,1,40},{200002,0,1,40},{200003,0,1,40},{200006,0,1,40},{200010,0,1,5},{200011,0,1,10},{200012,0,1,10},{200013,0,1,10}, | AK12: 200020 | AL12: 裁决 | AM12: 1 | AN12: 0 | AO12: 1 | AP12: 1 | AQ12: ="{"&RC[-6]&","&RC[-3]&","&RC[-2]&","&RC[-1]&"}," -> {200020,0,1,1}, | AR12: =R[-1]C&RC[-1] -> {200010,0,1,100},{200011,0,1,100},{200012,0,1,100},{200013,0,1,100},{200015,0,1,100},{200016,0,1,100},{200017,0,1,100},{200019,0,1,100},{200020,0,1,1}, | AT12: 200020 | AU12: 裁决 | AV12: 1 | AW12: 0 | AX12: 1 | AY12: 1 | AZ12: ="{"&RC[-6]&","&RC[-3]&","&RC[-2]&","&RC[-1]&"}," -> {200020,0,1,1}, | BA12: =R[-1]C&RC[-1] -> {200010,0,1,80},{200011,0,1,80},{200012,0,1,80},{200013,0,1,80},{200015,0,1,80},{200016,0,1,80},{200017,0,1,80},{200019,0,1,80},{200020,0,1,1}, | BC12: 200020 | BD12: 裁决 | BE12: 1 | BF12: 0 | BG12: 1 | BH12: 1 | BI12: ="{"&RC[-6]&","&RC[-3]&","&RC[-2]&","&RC[-1]&"}," -> {200020,0,1,1}, | BJ12: =R[-1]C&RC[-1] -> {200010,0,1,60},{200011,0,1,60},{200012,0,1,60},{200013,0,1,60},{200015,0,1,60},{200016,0,1,60},{200017,0,1,60},{200019,0,1,60},{200020,0,1,1},
A13: 201006 | B13: 放大镜 | C13: 1 | D13: 0 | E13: 1 | F13: 100 | G13: ="{"&RC[-6]&","&RC[-3]&","&RC[-2]&","&RC[-1]&"}," -> {201006,0,1,100}, | H13: =R[-1]C&RC[-1] -> {200000,0,1,100},{200001,0,1,100},{200002,0,1,100},{200003,0,1,100},{200006,0,1,100},{201000,0,1,100},{201001,0,1,100},{201002,0,1,100},{201003,0,1,100},{201006,0,1,100}, | J13: 201001 | K13: 轻盔 | L13: 1 | M13: 0 | N13: 1 | O13: 40 | P13: ="{"&RC[-6]&","&RC[-3]&","&RC[-2]&","&RC[-1]&"}," -> {201001,0,1,40}, | Q13: =R[-1]C&RC[-1] -> {200000,0,1,40},{200001,0,1,40},{200002,0,1,40},{200003,0,1,40},{200006,0,1,40},{200010,0,1,5},{200011,0,1,10},{200012,0,1,10},{201000,0,1,40},{201001,0,1,40}, | S13: 200015 | T13: 战士头盔 | U13: 1 | V13: 0 | W13: 1 | X13: 10 | Y13: ="{"&RC[-6]&","&RC[-3]&","&RC[-2]&","&RC[-1]&"}," -> {200015,0,1,10}, | Z13: =R[-1]C&RC[-1] -> {200000,0,1,40},{200001,0,1,40},{200002,0,1,40},{200003,0,1,40},{200006,0,1,40},{200010,0,1,5},{200011,0,1,10},{200012,0,1,10},{200013,0,1,10},{200015,0,1,10}, | AB13: 200015 | AC13: 战士头盔 | AD13: 1 | AE13: 0 | AF13: 1 | AG13: 10 | AH13: ="{"&RC[-6]&","&RC[-3]&","&RC[-2]&","&RC[-1]&"}," -> {200015,0,1,10}, | AI13: =R[-1]C&RC[-1] -> {200000,0,1,40},{200001,0,1,40},{200002,0,1,40},{200003,0,1,40},{200006,0,1,40},{200010,0,1,5},{200011,0,1,10},{200012,0,1,10},{200013,0,1,10},{200015,0,1,10}, | AK13: 200021 | AL13: 圣战战甲 | AM13: 1 | AN13: 0 | AO13: 1 | AP13: 2 | AQ13: ="{"&RC[-6]&","&RC[-3]&","&RC[-2]&","&RC[-1]&"}," -> {200021,0,1,2}, | AR13: =R[-1]C&RC[-1] -> {200010,0,1,100},{200011,0,1,100},{200012,0,1,100},{200013,0,1,100},{200015,0,1,100},{200016,0,1,100},{200017,0,1,100},{200019,0,1,100},{200020,0,1,1},{200021,0,1,2}, | AT13: 200021 | AU13: 圣战战甲 | AV13: 1 | AW13: 0 | AX13: 1 | AY13: 3 | AZ13: ="{"&RC[-6]&","&RC[-3]&","&RC[-2]&","&RC[-1]&"}," -> {200021,0,1,3}, | BA13: =R[-1]C&RC[-1] -> {200010,0,1,80},{200011,0,1,80},{200012,0,1,80},{200013,0,1,80},{200015,0,1,80},{200016,0,1,80},{200017,0,1,80},{200019,0,1,80},{200020,0,1,1},{200021,0,1,3}, | BC13: 200021 | BD13: 圣战战甲 | BE13: 1 | BF13: 0 | BG13: 1 | BH13: 5 | BI13: ="{"&RC[-6]&","&RC[-3]&","&RC[-2]&","&RC[-1]&"}," -> {200021,0,1,5}, | BJ13: =R[-1]C&RC[-1] -> {200010,0,1,60},{200011,0,1,60},{200012,0,1,60},{200013,0,1,60},{200015,0,1,60},{200016,0,1,60},{200017,0,1,60},{200019,0,1,60},{200020,0,1,1},{200021,0,1,5},
A14: 202000 | B14: 半月 | C14: 1 | D14: 0 | E14: 1 | F14: 100 | G14: ="{"&RC[-6]&","&RC[-3]&","&RC[-2]&","&RC[-1]&"}," -> {202000,0,1,100}, | H14: =R[-1]C&RC[-1] -> {200000,0,1,100},{200001,0,1,100},{200002,0,1,100},{200003,0,1,100},{200006,0,1,100},{201000,0,1,100},{201001,0,1,100},{201002,0,1,100},{201003,0,1,100},{201006,0,1,100},{202000,0,1,100}, | J14: 201002 | K14: 金戒指 | L14: 1 | M14: 0 | N14: 1 | O14: 40 | P14: ="{"&RC[-6]&","&RC[-3]&","&RC[-2]&","&RC[-1]&"}," -> {201002,0,1,40}, | Q14: =R[-1]C&RC[-1] -> {200000,0,1,40},{200001,0,1,40},{200002,0,1,40},{200003,0,1,40},{200006,0,1,40},{200010,0,1,5},{200011,0,1,10},{200012,0,1,10},{201000,0,1,40},{201001,0,1,40},{201002,0,1,40}, | S14: 200016 | T14: 阎罗手镯 | U14: 1 | V14: 0 | W14: 1 | X14: 10 | Y14: ="{"&RC[-6]&","&RC[-3]&","&RC[-2]&","&RC[-1]&"}," -> {200016,0,1,10}, | Z14: =R[-1]C&RC[-1] -> {200000,0,1,40},{200001,0,1,40},{200002,0,1,40},{200003,0,1,40},{200006,0,1,40},{200010,0,1,5},{200011,0,1,10},{200012,0,1,10},{200013,0,1,10},{200015,0,1,10},{200016,0,1,10}, | AB14: 200016 | AC14: 阎罗手镯 | AD14: 1 | AE14: 0 | AF14: 1 | AG14: 10 | AH14: ="{"&RC[-6]&","&RC[-3]&","&RC[-2]&","&RC[-1]&"}," -> {200016,0,1,10}, | AI14: =R[-1]C&RC[-1] -> {200000,0,1,40},{200001,0,1,40},{200002,0,1,40},{200003,0,1,40},{200006,0,1,40},{200010,0,1,5},{200011,0,1,10},{200012,0,1,10},{200013,0,1,10},{200015,0,1,10},{200016,0,1,10}, | AK14: 200022 | AL14: 圣战项链 | AM14: 1 | AN14: 0 | AO14: 1 | AP14: 2 | AQ14: ="{"&RC[-6]&","&RC[-3]&","&RC[-2]&","&RC[-1]&"}," -> {200022,0,1,2}, | AR14: =R[-1]C&RC[-1] -> {200010,0,1,100},{200011,0,1,100},{200012,0,1,100},{200013,0,1,100},{200015,0,1,100},{200016,0,1,100},{200017,0,1,100},{200019,0,1,100},{200020,0,1,1},{200021,0,1,2},{200022,0,1,2}, | AT14: 200022 | AU14: 圣战项链 | AV14: 1 | AW14: 0 | AX14: 1 | AY14: 3 | AZ14: ="{"&RC[-6]&","&RC[-3]&","&RC[-2]&","&RC[-1]&"}," -> {200022,0,1,3}, | BA14: =R[-1]C&RC[-1] -> {200010,0,1,80},{200011,0,1,80},{200012,0,1,80},{200013,0,1,80},{200015,0,1,80},{200016,0,1,80},{200017,0,1,80},{200019,0,1,80},{200020,0,1,1},{200021,0,1,3},{200022,0,1,3}, | BC14: 200022 | BD14: 圣战项链 | BE14: 1 | BF14: 0 | BG14: 1 | BH14: 5 | BI14: ="{"&RC[-6]&","&RC[-3]&","&RC[-2]&","&RC[-1]&"}," -> {200022,0,1,5}, | BJ14: =R[-1]C&RC[-1] -> {200010,0,1,60},{200011,0,1,60},{200012,0,1,60},{200013,0,1,60},{200015,0,1,60},{200016,0,1,60},{200017,0,1,60},{200019,0,1,60},{200020,0,1,1},{200021,0,1,5},{200022,0,1,5},
A15: 202001 | B15: 轻盔 | C15: 1 | D15: 0 | E15: 1 | F15: 100 | G15: ="{"&RC[-6]&","&RC[-3]&","&RC[-2]&","&RC[-1]&"}," -> {202001,0,1,100}, | H15: =R[-1]C&RC[-1] -> {200000,0,1,100},{200001,0,1,100},{200002,0,1,100},{200003,0,1,100},{200006,0,1,100},{201000,0,1,100},{201001,0,1,100},{201002,0,1,100},{201003,0,1,100},{201006,0,1,100},{202000,0,1,100},{202001,0,1,100}, | J15: 201003 | K15: 魔法手镯 | L15: 1 | M15: 0 | N15: 1 | O15: 40 | P15: ="{"&RC[-6]&","&RC[-3]&","&RC[-2]&","&RC[-1]&"}," -> {201003,0,1,40}, | Q15: =R[-1]C&RC[-1] -> {200000,0,1,40},{200001,0,1,40},{200002,0,1,40},{200003,0,1,40},{200006,0,1,40},{200010,0,1,5},{200011,0,1,10},{200012,0,1,10},{201000,0,1,40},{201001,0,1,40},{201002,0,1,40},{201003,0,1,40}, | S15: 200017 | T15: 战士腰带 | U15: 1 | V15: 0 | W15: 1 | X15: 10 | Y15: ="{"&RC[-6]&","&RC[-3]&","&RC[-2]&","&RC[-1]&"}," -> {200017,0,1,10}, | Z15: =R[-1]C&RC[-1] -> {200000,0,1,40},{200001,0,1,40},{200002,0,1,40},{200003,0,1,40},{200006,0,1,40},{200010,0,1,5},{200011,0,1,10},{200012,0,1,10},{200013,0,1,10},{200015,0,1,10},{200016,0,1,10},{200017,0,1,10}, | AB15: 200017 | AC15: 战士腰带 | AD15: 1 | AE15: 0 | AF15: 1 | AG15: 10 | AH15: ="{"&RC[-6]&","&RC[-3]&","&RC[-2]&","&RC[-1]&"}," -> {200017,0,1,10}, | AI15: =R[-1]C&RC[-1] -> {200000,0,1,40},{200001,0,1,40},{200002,0,1,40},{200003,0,1,40},{200006,0,1,40},{200010,0,1,5},{200011,0,1,10},{200012,0,1,10},{200013,0,1,10},{200015,0,1,10},{200016,0,1,10},{200017,0,1,10}, | AK15: 200023 | AL15: 圣战戒指 | AM15: 1 | AN15: 0 | AO15: 1 | AP15: 2 | AQ15: ="{"&RC[-6]&","&RC[-3]&","&RC[-2]&","&RC[-1]&"}," -> {200023,0,1,2}, | AR15: =R[-1]C&RC[-1] -> {200010,0,1,100},{200011,0,1,100},{200012,0,1,100},{200013,0,1,100},{200015,0,1,100},{200016,0,1,100},{200017,0,1,100},{200019,0,1,100},{200020,0,1,1},{200021,0,1,2},{200022,0,1,2},{200023,0,1,2}, | AT15: 200023 | AU15: 圣战戒指 | AV15: 1 | AW15: 0 | AX15: 1 | AY15: 3 | AZ15: ="{"&RC[-6]&","&RC[-3]&","&RC[-2]&","&RC[-1]&"}," -> {200023,0,1,3}, | BA15: =R[-1]C&RC[-1] -> {200010,0,1,80},{200011,0,1,80},{200012,0,1,80},{200013,0,1,80},{200015,0,1,80},{200016,0,1,80},{200017,0,1,80},{200019,0,1,80},{200020,0,1,1},{200021,0,1,3},{200022,0,1,3},{200023,0,1,3}, | BC15: 200023 | BD15: 圣战戒指 | BE15: 1 | BF15: 0 | BG15: 1 | BH15: 5 | BI15: ="{"&RC[-6]&","&RC[-3]&","&RC[-2]&","&RC[-1]&"}," -> {200023,0,1,5}, | BJ15: =R[-1]C&RC[-1] -> {200010,0,1,60},{200011,0,1,60},{200012,0,1,60},{200013,0,1,60},{200015,0,1,60},{200016,0,1,60},{200017,0,1,60},{200019,0,1,60},{200020,0,1,1},{200021,0,1,5},{200022,0,1,5},{200023,0,1,5},
A16: 202002 | B16: 铂金戒指 | C16: 1 | D16: 0 | E16: 1 | F16: 100 | G16: ="{"&RC[-6]&","&RC[-3]&","&RC[-2]&","&RC[-1]&"}," -> {202002,0,1,100}, | H16: =R[-1]C&RC[-1] -> {200000,0,1,100},{200001,0,1,100},{200002,0,1,100},{200003,0,1,100},{200006,0,1,100},{201000,0,1,100},{201001,0,1,100},{201002,0,1,100},{201003,0,1,100},{201006,0,1,100},{202000,0,1,100},{202001,0,1,100},{202002,0,1,100}, | J16: 201006 | K16: 放大镜 | L16: 1 | M16: 0 | N16: 1 | O16: 40 | P16: ="{"&RC[-6]&","&RC[-3]&","&RC[-2]&","&RC[-1]&"}," -> {201006,0,1,40}, | Q16: =R[-1]C&RC[-1] -> {200000,0,1,40},{200001,0,1,40},{200002,0,1,40},{200003,0,1,40},{200006,0,1,40},{200010,0,1,5},{200011,0,1,10},{200012,0,1,10},{201000,0,1,40},{201001,0,1,40},{201002,0,1,40},{201003,0,1,40},{201006,0,1,40}, | S16: 200019 | T16: 战士鞋子 | U16: 1 | V16: 0 | W16: 1 | X16: 10 | Y16: ="{"&RC[-6]&","&RC[-3]&","&RC[-2]&","&RC[-1]&"}," -> {200019,0,1,10}, | Z16: =R[-1]C&RC[-1] -> {200000,0,1,40},{200001,0,1,40},{200002,0,1,40},{200003,0,1,40},{200006,0,1,40},{200010,0,1,5},{200011,0,1,10},{200012,0,1,10},{200013,0,1,10},{200015,0,1,10},{200016,0,1,10},{200017,0,1,10},{200019,0,1,10}, | AB16: 200019 | AC16: 战士鞋子 | AD16: 1 | AE16: 0 | AF16: 1 | AG16: 10 | AH16: ="{"&RC[-6]&","&RC[-3]&","&RC[-2]&","&RC[-1]&"}," -> {200019,0,1,10}, | AI16: =R[-1]C&RC[-1] -> {200000,0,1,40},{200001,0,1,40},{200002,0,1,40},{200003,0,1,40},{200006,0,1,40},{200010,0,1,5},{200011,0,1,10},{200012,0,1,10},{200013,0,1,10},{200015,0,1,10},{200016,0,1,10},{200017,0,1,10},{200019,0,1,10}, | AK16: 200025 | AL16: 圣战头盔 | AM16: 1 | AN16: 0 | AO16: 1 | AP16: 2 | AQ16: ="{"&RC[-6]&","&RC[-3]&","&RC[-2]&","&RC[-1]&"}," -> {200025,0,1,2}, | AR16: =R[-1]C&RC[-1] -> {200010,0,1,100},{200011,0,1,100},{200012,0,1,100},{200013,0,1,100},{200015,0,1,100},{200016,0,1,100},{200017,0,1,100},{200019,0,1,100},{200020,0,1,1},{200021,0,1,2},{200022,0,1,2},{200023,0,1,2},{200025,0,1,2}, | AT16: 200025 | AU16: 圣战头盔 | AV16: 1 | AW16: 0 | AX16: 1 | AY16: 3 | AZ16: ="{"&RC[-6]&","&RC[-3]&","&RC[-2]&","&RC[-1]&"}," -> {200025,0,1,3}, | BA16: =R[-1]C&RC[-1] -> {200010,0,1,80},{200011,0,1,80},{200012,0,1,80},{200013,0,1,80},{200015,0,1,80},{200016,0,1,80},{200017,0,1,80},{200019,0,1,80},{200020,0,1,1},{200021,0,1,3},{200022,0,1,3},{200023,0,1,3},{200025,0,1,3}, | BC16: 200025 | BD16: 圣战头盔 | BE16: 1 | BF16: 0 | BG16: 1 | BH16: 5 | BI16: ="{"&RC[-6]&","&RC[-3]&","&RC[-2]&","&RC[-1]&"}," -> {200025,0,1,5}, | BJ16: =R[-1]C&RC[-1] -> {200010,0,1,60},{200011,0,1,60},{200012,0,1,60},{200013,0,1,60},{200015,0,1,60},{200016,0,1,60},{200017,0,1,60},{200019,0,1,60},{200020,0,1,1},{200021,0,1,5},{200022,0,1,5},{200023,0,1,5},{200025,0,1,5},
A17: 202003 | B17: 三眼手镯 | C17: 1 | D17: 0 | E17: 1 | F17: 100 | G17: ="{"&RC[-6]&","&RC[-3]&","&RC[-2]&","&RC[-1]&"}," -> {202003,0,1,100}, | H17: =R[-1]C&RC[-1] -> {200000,0,1,100},{200001,0,1,100},{200002,0,1,100},{200003,0,1,100},{200006,0,1,100},{201000,0,1,100},{201001,0,1,100},{201002,0,1,100},{201003,0,1,100},{201006,0,1,100},{202000,0,1,100},{202001,0,1,100},{202002,0,1,100},{202003,0,1,100}, | J17: 201010 | K17: 魔杖 | L17: 1 | M17: 0 | N17: 1 | O17: 5 | P17: ="{"&RC[-6]&","&RC[-3]&","&RC[-2]&","&RC[-1]&"}," -> {201010,0,1,5}, | Q17: =R[-1]C&RC[-1] -> {200000,0,1,40},{200001,0,1,40},{200002,0,1,40},{200003,0,1,40},{200006,0,1,40},{200010,0,1,5},{200011,0,1,10},{200012,0,1,10},{201000,0,1,40},{201001,0,1,40},{201002,0,1,40},{201003,0,1,40},{201006,0,1,40},{201010,0,1,5}, | S17: 201000 | T17: 海魂 | U17: 1 | V17: 0 | W17: 1 | X17: 40 | Y17: ="{"&RC[-6]&","&RC[-3]&","&RC[-2]&","&RC[-1]&"}," -> {201000,0,1,40}, | Z17: =R[-1]C&RC[-1] -> {200000,0,1,40},{200001,0,1,40},{200002,0,1,40},{200003,0,1,40},{200006,0,1,40},{200010,0,1,5},{200011,0,1,10},{200012,0,1,10},{200013,0,1,10},{200015,0,1,10},{200016,0,1,10},{200017,0,1,10},{200019,0,1,10},{201000,0,1,40}, | AB17: 201000 | AC17: 海魂 | AD17: 1 | AE17: 0 | AF17: 1 | AG17: 40 | AH17: ="{"&RC[-6]&","&RC[-3]&","&RC[-2]&","&RC[-1]&"}," -> {201000,0,1,40}, | AI17: =R[-1]C&RC[-1] -> {200000,0,1,40},{200001,0,1,40},{200002,0,1,40},{200003,0,1,40},{200006,0,1,40},{200010,0,1,5},{200011,0,1,10},{200012,0,1,10},{200013,0,1,10},{200015,0,1,10},{200016,0,1,10},{200017,0,1,10},{200019,0,1,10},{201000,0,1,40}, | AK17: 200026 | AL17: 圣战手镯 | AM17: 1 | AN17: 0 | AO17: 1 | AP17: 2 | AQ17: ="{"&RC[-6]&","&RC[-3]&","&RC[-2]&","&RC[-1]&"}," -> {200026,0,1,2}, | AR17: =R[-1]C&RC[-1] -> {200010,0,1,100},{200011,0,1,100},{200012,0,1,100},{200013,0,1,100},{200015,0,1,100},{200016,0,1,100},{200017,0,1,100},{200019,0,1,100},{200020,0,1,1},{200021,0,1,2},{200022,0,1,2},{200023,0,1,2},{200025,0,1,2},{200026,0,1,2}, | AT17: 200026 | AU17: 圣战手镯 | AV17: 1 | AW17: 0 | AX17: 1 | AY17: 3 | AZ17: ="{"&RC[-6]&","&RC[-3]&","&RC[-2]&","&RC[-1]&"}," -> {200026,0,1,3}, | BA17: =R[-1]C&RC[-1] -> {200010,0,1,80},{200011,0,1,80},{200012,0,1,80},{200013,0,1,80},{200015,0,1,80},{200016,0,1,80},{200017,0,1,80},{200019,0,1,80},{200020,0,1,1},{200021,0,1,3},{200022,0,1,3},{200023,0,1,3},{200025,0,1,3},{200026,0,1,3}, | BC17: 200026 | BD17: 圣战手镯 | BE17: 1 | BF17: 0 | BG17: 1 | BH17: 5 | BI17: ="{"&RC[-6]&","&RC[-3]&","&RC[-2]&","&RC[-1]&"}," -> {200026,0,1,5}, | BJ17: =R[-1]C&RC[-1] -> {200010,0,1,60},{200011,0,1,60},{200012,0,1,60},{200013,0,1,60},{200015,0,1,60},{200016,0,1,60},{200017,0,1,60},{200019,0,1,60},{200020,0,1,1},{200021,0,1,5},{200022,0,1,5},{200023,0,1,5},{200025,0,1,5},{200026,0,1,5},
A18: 202006 | B18: 凤凰明珠 | C18: 1 | D18: 0 | E18: 1 | F18: 100 | G18: ="{"&RC[-6]&","&RC[-3]&","&RC[-2]&","&RC[-1]&"}" -> {202006,0,1,100} | H18: =R[-1]C&RC[-1] -> {200000,0,1,100},{200001,0,1,100},{200002,0,1,100},{200003,0,1,100},{200006,0,1,100},{201000,0,1,100},{201001,0,1,100},{201002,0,1,100},{201003,0,1,100},{201006,0,1,100},{202000,0,1,100},{202001,0,1,100},{202002,0,1,100},{202003,0,1,100},{202006,0,1,100} | J18: 201011 | K18: 恶魔铃铛 | L18: 1 | M18: 0 | N18: 1 | O18: 10 | P18: ="{"&RC[-6]&","&RC[-3]&","&RC[-2]&","&RC[-1]&"}," -> {201011,0,1,10}, | Q18: =R[-1]C&RC[-1] -> {200000,0,1,40},{200001,0,1,40},{200002,0,1,40},{200003,0,1,40},{200006,0,1,40},{200010,0,1,5},{200011,0,1,10},{200012,0,1,10},{201000,0,1,40},{201001,0,1,40},{201002,0,1,40},{201003,0,1,40},{201006,0,1,40},{201010,0,1,5},{201011,0,1,10}, | S18: 201001 | T18: 轻盔 | U18: 1 | V18: 0 | W18: 1 | X18: 40 | Y18: ="{"&RC[-6]&","&RC[-3]&","&RC[-2]&","&RC[-1]&"}," -> {201001,0,1,40}, | Z18: =R[-1]C&RC[-1] -> {200000,0,1,40},{200001,0,1,40},{200002,0,1,40},{200003,0,1,40},{200006,0,1,40},{200010,0,1,5},{200011,0,1,10},{200012,0,1,10},{200013,0,1,10},{200015,0,1,10},{200016,0,1,10},{200017,0,1,10},{200019,0,1,10},{201000,0,1,40},{201001,0,1,40}, | AB18: 201001 | AC18: 轻盔 | AD18: 1 | AE18: 0 | AF18: 1 | AG18: 40 | AH18: ="{"&RC[-6]&","&RC[-3]&","&RC[-2]&","&RC[-1]&"}," -> {201001,0,1,40}, | AI18: =R[-1]C&RC[-1] -> {200000,0,1,40},{200001,0,1,40},{200002,0,1,40},{200003,0,1,40},{200006,0,1,40},{200010,0,1,5},{200011,0,1,10},{200012,0,1,10},{200013,0,1,10},{200015,0,1,10},{200016,0,1,10},{200017,0,1,10},{200019,0,1,10},{201000,0,1,40},{201001,0,1,40}, | AK18: 200027 | AL18: 圣战腰带 | AM18: 1 | AN18: 0 | AO18: 1 | AP18: 2 | AQ18: ="{"&RC[-6]&","&RC[-3]&","&RC[-2]&","&RC[-1]&"}," -> {200027,0,1,2}, | AR18: =R[-1]C&RC[-1] -> {200010,0,1,100},{200011,0,1,100},{200012,0,1,100},{200013,0,1,100},{200015,0,1,100},{200016,0,1,100},{200017,0,1,100},{200019,0,1,100},{200020,0,1,1},{200021,0,1,2},{200022,0,1,2},{200023,0,1,2},{200025,0,1,2},{200026,0,1,2},{200027,0,1,2}, | AT18: 200027 | AU18: 圣战腰带 | AV18: 1 | AW18: 0 | AX18: 1 | AY18: 3 | AZ18: ="{"&RC[-6]&","&RC[-3]&","&RC[-2]&","&RC[-1]&"}," -> {200027,0,1,3}, | BA18: =R[-1]C&RC[-1] -> {200010,0,1,80},{200011,0,1,80},{200012,0,1,80},{200013,0,1,80},{200015,0,1,80},{200016,0,1,80},{200017,0,1,80},{200019,0,1,80},{200020,0,1,1},{200021,0,1,3},{200022,0,1,3},{200023,0,1,3},{200025,0,1,3},{200026,0,1,3},{200027,0,1,3}, | BC18: 200027 | BD18: 圣战腰带 | BE18: 1 | BF18: 0 | BG18: 1 | BH18: 5 | BI18: ="{"&RC[-6]&","&RC[-3]&","&RC[-2]&","&RC[-1]&"}," -> {200027,0,1,5}, | BJ18: =R[-1]C&RC[-1] -> {200010,0,1,60},{200011,0,1,60},{200012,0,1,60},{200013,0,1,60},{200015,0,1,60},{200016,0,1,60},{200017,0,1,60},{200019,0,1,60},{200020,0,1,1},{200021,0,1,5},{200022,0,1,5},{200023,0,1,5},{200025,0,1,5},{200026,0,1,5},{200027,0,1,5},
J19: 201012 | K19: 恶魔长袍 | L19: 1 | M19: 0 | N19: 1 | O19: 10 | P19: ="{"&RC[-6]&","&RC[-3]&","&RC[-2]&","&RC[-1]&"}," -> {201012,0,1,10}, | Q19: =R[-1]C&RC[-1] -> {200000,0,1,40},{200001,0,1,40},{200002,0,1,40},{200003,0,1,40},{200006,0,1,40},{200010,0,1,5},{200011,0,1,10},{200012,0,1,10},{201000,0,1,40},{201001,0,1,40},{201002,0,1,40},{201003,0,1,40},{201006,0,1,40},{201010,0,1,5},{201011,0,1,10},{201012,0,1,10}, | S19: 201002 | T19: 金戒指 | U19: 1 | V19: 0 | W19: 1 | X19: 40 | Y19: ="{"&RC[-6]&","&RC[-3]&","&RC[-2]&","&RC[-1]&"}," -> {201002,0,1,40}, | Z19: =R[-1]C&RC[-1] -> {200000,0,1,40},{200001,0,1,40},{200002,0,1,40},{200003,0,1,40},{200006,0,1,40},{200010,0,1,5},{200011,0,1,10},{200012,0,1,10},{200013,0,1,10},{200015,0,1,10},{200016,0,1,10},{200017,0,1,10},{200019,0,1,10},{201000,0,1,40},{201001,0,1,40},{201002,0,1,40}, | AB19: 201002 | AC19: 金戒指 | AD19: 1 | AE19: 0 | AF19: 1 | AG19: 40 | AH19: ="{"&RC[-6]&","&RC[-3]&","&RC[-2]&","&RC[-1]&"}," -> {201002,0,1,40}, | AI19: =R[-1]C&RC[-1] -> {200000,0,1,40},{200001,0,1,40},{200002,0,1,40},{200003,0,1,40},{200006,0,1,40},{200010,0,1,5},{200011,0,1,10},{200012,0,1,10},{200013,0,1,10},{200015,0,1,10},{200016,0,1,10},{200017,0,1,10},{200019,0,1,10},{201000,0,1,40},{201001,0,1,40},{201002,0,1,40}, | AK19: 200029 | AL19: 圣战鞋子 | AM19: 1 | AN19: 0 | AO19: 1 | AP19: 2 | AQ19: ="{"&RC[-6]&","&RC[-3]&","&RC[-2]&","&RC[-1]&"}," -> {200029,0,1,2}, | AR19: =R[-1]C&RC[-1] -> {200010,0,1,100},{200011,0,1,100},{200012,0,1,100},{200013,0,1,100},{200015,0,1,100},{200016,0,1,100},{200017,0,1,100},{200019,0,1,100},{200020,0,1,1},{200021,0,1,2},{200022,0,1,2},{200023,0,1,2},{200025,0,1,2},{200026,0,1,2},{200027,0,1,2},{200029,0,1,2}, | AT19: 200029 | AU19: 圣战鞋子 | AV19: 1 | AW19: 0 | AX19: 1 | AY19: 3 | AZ19: ="{"&RC[-6]&","&RC[-3]&","&RC[-2]&","&RC[-1]&"}," -> {200029,0,1,3}, | BA19: =R[-1]C&RC[-1] -> {200010,0,1,80},{200011,0,1,80},{200012,0,1,80},{200013,0,1,80},{200015,0,1,80},{200016,0,1,80},{200017,0,1,80},{200019,0,1,80},{200020,0,1,1},{200021,0,1,3},{200022,0,1,3},{200023,0,1,3},{200025,0,1,3},{200026,0,1,3},{200027,0,1,3},{200029,0,1,3}, | BC19: 200029 | BD19: 圣战鞋子 | BE19: 1 | BF19: 0 | BG19: 1 | BH19: 5 | BI19: ="{"&RC[-6]&","&RC[-3]&","&RC[-2]&","&RC[-1]&"}," -> {200029,0,1,5}, | BJ19: =R[-1]C&RC[-1] -> {200010,0,1,60},{200011,0,1,60},{200012,0,1,60},{200013,0,1,60},{200015,0,1,60},{200016,0,1,60},{200017,0,1,60},{200019,0,1,60},{200020,0,1,1},{200021,0,1,5},{200022,0,1,5},{200023,0,1,5},{200025,0,1,5},{200026,0,1,5},{200027,0,1,5},{200029,0,1,5},
J20: 202000 | K20: 半月 | L20: 1 | M20: 0 | N20: 1 | O20: 40 | P20: ="{"&RC[-6]&","&RC[-3]&","&RC[-2]&","&RC[-1]&"}," -> {202000,0,1,40}, | Q20: =R[-1]C&RC[-1] -> {200000,0,1,40},{200001,0,1,40},{200002,0,1,40},{200003,0,1,40},{200006,0,1,40},{200010,0,1,5},{200011,0,1,10},{200012,0,1,10},{201000,0,1,40},{201001,0,1,40},{201002,0,1,40},{201003,0,1,40},{201006,0,1,40},{201010,0,1,5},{201011,0,1,10},{201012,0,1,10},{202000,0,1,40}, | S20: 201003 | T20: 魔法手镯 | U20: 1 | V20: 0 | W20: 1 | X20: 40 | Y20: ="{"&RC[-6]&","&RC[-3]&","&RC[-2]&","&RC[-1]&"}," -> {201003,0,1,40}, | Z20: =R[-1]C&RC[-1] -> {200000,0,1,40},{200001,0,1,40},{200002,0,1,40},{200003,0,1,40},{200006,0,1,40},{200010,0,1,5},{200011,0,1,10},{200012,0,1,10},{200013,0,1,10},{200015,0,1,10},{200016,0,1,10},{200017,0,1,10},{200019,0,1,10},{201000,0,1,40},{201001,0,1,40},{201002,0,1,40},{201003,0,1,40}, | AB20: 201003 | AC20: 魔法手镯 | AD20: 1 | AE20: 0 | AF20: 1 | AG20: 40 | AH20: ="{"&RC[-6]&","&RC[-3]&","&RC[-2]&","&RC[-1]&"}," -> {201003,0,1,40}, | AI20: =R[-1]C&RC[-1] -> {200000,0,1,40},{200001,0,1,40},{200002,0,1,40},{200003,0,1,40},{200006,0,1,40},{200010,0,1,5},{200011,0,1,10},{200012,0,1,10},{200013,0,1,10},{200015,0,1,10},{200016,0,1,10},{200017,0,1,10},{200019,0,1,10},{201000,0,1,40},{201001,0,1,40},{201002,0,1,40},{201003,0,1,40}, | AK20: 201010 | AL20: 魔杖 | AM20: 1 | AN20: 0 | AO20: 1 | AP20: 100 | AQ20: ="{"&RC[-6]&","&RC[-3]&","&RC[-2]&","&RC[-1]&"}," -> {201010,0,1,100}, | AR20: =R[-1]C&RC[-1] -> {200010,0,1,100},{200011,0,1,100},{200012,0,1,100},{200013,0,1,100},{200015,0,1,100},{200016,0,1,100},{200017,0,1,100},{200019,0,1,100},{200020,0,1,1},{200021,0,1,2},{200022,0,1,2},{200023,0,1,2},{200025,0,1,2},{200026,0,1,2},{200027,0,1,2},{200029,0,1,2},{201010,0,1,100}, | AT20: 201010 | AU20: 魔杖 | AV20: 1 | AW20: 0 | AX20: 1 | AY20: 80 | AZ20: ="{"&RC[-6]&","&RC[-3]&","&RC[-2]&","&RC[-1]&"}," -> {201010,0,1,80}, | BA20: =R[-1]C&RC[-1] -> {200010,0,1,80},{200011,0,1,80},{200012,0,1,80},{200013,0,1,80},{200015,0,1,80},{200016,0,1,80},{200017,0,1,80},{200019,0,1,80},{200020,0,1,1},{200021,0,1,3},{200022,0,1,3},{200023,0,1,3},{200025,0,1,3},{200026,0,1,3},{200027,0,1,3},{200029,0,1,3},{201010,0,1,80}, | BC20: 201010 | BD20: 魔杖 | BE20: 1 | BF20: 0 | BG20: 1 | BH20: 60 | BI20: ="{"&RC[-6]&","&RC[-3]&","&RC[-2]&","&RC[-1]&"}," -> {201010,0,1,60}, | BJ20: =R[-1]C&RC[-1] -> {200010,0,1,60},{200011,0,1,60},{200012,0,1,60},{200013,0,1,60},{200015,0,1,60},{200016,0,1,60},{200017,0,1,60},{200019,0,1,60},{200020,0,1,1},{200021,0,1,5},{200022,0,1,5},{200023,0,1,5},{200025,0,1,5},{200026,0,1,5},{200027,0,1,5},{200029,0,1,5},{201010,0,1,60},
A21: 110002 | B21: 强化石 | D21: 0 | E21: 2 | F21: 2 | G21: ="{"&RC[-6]&","&RC[-3]&","&RC[-2]&","&RC[-1]&"}," -> {110002,0,2,2}, | H21: =RC[-1] -> {110002,0,2,2}, | J21: 202001 | K21: 轻盔 | L21: 1 | M21: 0 | N21: 1 | O21: 40 | P21: ="{"&RC[-6]&","&RC[-3]&","&RC[-2]&","&RC[-1]&"}," -> {202001,0,1,40}, | Q21: =R[-1]C&RC[-1] -> {200000,0,1,40},{200001,0,1,40},{200002,0,1,40},{200003,0,1,40},{200006,0,1,40},{200010,0,1,5},{200011,0,1,10},{200012,0,1,10},{201000,0,1,40},{201001,0,1,40},{201002,0,1,40},{201003,0,1,40},{201006,0,1,40},{201010,0,1,5},{201011,0,1,10},{201012,0,1,10},{202000,0,1,40},{202001,0,1,40}, | S21: 201006 | T21: 放大镜 | U21: 1 | V21: 0 | W21: 1 | X21: 40 | Y21: ="{"&RC[-6]&","&RC[-3]&","&RC[-2]&","&RC[-1]&"}," -> {201006,0,1,40}, | Z21: =R[-1]C&RC[-1] -> {200000,0,1,40},{200001,0,1,40},{200002,0,1,40},{200003,0,1,40},{200006,0,1,40},{200010,0,1,5},{200011,0,1,10},{200012,0,1,10},{200013,0,1,10},{200015,0,1,10},{200016,0,1,10},{200017,0,1,10},{200019,0,1,10},{201000,0,1,40},{201001,0,1,40},{201002,0,1,40},{201003,0,1,40},{201006,0,1,40}, | AB21: 201006 | AC21: 放大镜 | AD21: 1 | AE21: 0 | AF21: 1 | AG21: 40 | AH21: ="{"&RC[-6]&","&RC[-3]&","&RC[-2]&","&RC[-1]&"}," -> {201006,0,1,40}, | AI21: =R[-1]C&RC[-1] -> {200000,0,1,40},{200001,0,1,40},{200002,0,1,40},{200003,0,1,40},{200006,0,1,40},{200010,0,1,5},{200011,0,1,10},{200012,0,1,10},{200013,0,1,10},{200015,0,1,10},{200016,0,1,10},{200017,0,1,10},{200019,0,1,10},{201000,0,1,40},{201001,0,1,40},{201002,0,1,40},{201003,0,1,40},{201006,0,1,40}, | AK21: 201011 | AL21: 恶魔铃铛 | AM21: 1 | AN21: 0 | AO21: 1 | AP21: 100 | AQ21: ="{"&RC[-6]&","&RC[-3]&","&RC[-2]&","&RC[-1]&"}," -> {201011,0,1,100}, | AR21: =R[-1]C&RC[-1] -> {200010,0,1,100},{200011,0,1,100},{200012,0,1,100},{200013,0,1,100},{200015,0,1,100},{200016,0,1,100},{200017,0,1,100},{200019,0,1,100},{200020,0,1,1},{200021,0,1,2},{200022,0,1,2},{200023,0,1,2},{200025,0,1,2},{200026,0,1,2},{200027,0,1,2},{200029,0,1,2},{201010,0,1,100},{201011,0,1,100}, | AT21: 201011 | AU21: 恶魔铃铛 | AV21: 1 | AW21: 0 | AX21: 1 | AY21: 80 | AZ21: ="{"&RC[-6]&","&RC[-3]&","&RC[-2]&","&RC[-1]&"}," -> {201011,0,1,80}, | BA21: =R[-1]C&RC[-1] -> {200010,0,1,80},{200011,0,1,80},{200012,0,1,80},{200013,0,1,80},{200015,0,1,80},{200016,0,1,80},{200017,0,1,80},{200019,0,1,80},{200020,0,1,1},{200021,0,1,3},{200022,0,1,3},{200023,0,1,3},{200025,0,1,3},{200026,0,1,3},{200027,0,1,3},{200029,0,1,3},{201010,0,1,80},{201011,0,1,80}, | BC21: 201011 | BD21: 恶魔铃铛 | BE21: 1 | BF21: 0 | BG21: 1 | BH21: 60 | BI21: ="{"&RC[-6]&","&RC[-3]&","&RC[-2]&","&RC[-1]&"}," -> {201011,0,1,60}, | BJ21: =R[-1]C&RC[-1] -> {200010,0,1,60},{200011,0,1,60},{200012,0,1,60},{200013,0,1,60},{200015,0,1,60},{200016,0,1,60},{200017,0,1,60},{200019,0,1,60},{200020,0,1,1},{200021,0,1,5},{200022,0,1,5},{200023,0,1,5},{200025,0,1,5},{200026,0,1,5},{200027,0,1,5},{200029,0,1,5},{201010,0,1,60},{201011,0,1,60},
A22: 110003 | B22: 洗炼石 | D22: 0 | E22: 2 | F22: 2 | G22: ="{"&RC[-6]&","&RC[-3]&","&RC[-2]&","&RC[-1]&"}," -> {110003,0,2,2}, | H22: =R[-1]C&RC[-1] -> {110002,0,2,2},{110003,0,2,2}, | J22: 202002 | K22: 铂金戒指 | L22: 1 | M22: 0 | N22: 1 | O22: 40 | P22: ="{"&RC[-6]&","&RC[-3]&","&RC[-2]&","&RC[-1]&"}," -> {202002,0,1,40}, | Q22: =R[-1]C&RC[-1] -> {200000,0,1,40},{200001,0,1,40},{200002,0,1,40},{200003,0,1,40},{200006,0,1,40},{200010,0,1,5},{200011,0,1,10},{200012,0,1,10},{201000,0,1,40},{201001,0,1,40},{201002,0,1,40},{201003,0,1,40},{201006,0,1,40},{201010,0,1,5},{201011,0,1,10},{201012,0,1,10},{202000,0,1,40},{202001,0,1,40},{202002,0,1,40}, | S22: 201010 | T22: 魔杖 | U22: 1 | V22: 0 | W22: 1 | X22: 5 | Y22: ="{"&RC[-6]&","&RC[-3]&","&RC[-2]&","&RC[-1]&"}," -> {201010,0,1,5}, | Z22: =R[-1]C&RC[-1] -> {200000,0,1,40},{200001,0,1,40},{200002,0,1,40},{200003,0,1,40},{200006,0,1,40},{200010,0,1,5},{200011,0,1,10},{200012,0,1,10},{200013,0,1,10},{200015,0,1,10},{200016,0,1,10},{200017,0,1,10},{200019,0,1,10},{201000,0,1,40},{201001,0,1,40},{201002,0,1,40},{201003,0,1,40},{201006,0,1,40},{201010,0,1,5}, | AB22: 201010 | AC22: 魔杖 | AD22: 1 | AE22: 0 | AF22: 1 | AG22: 5 | AH22: ="{"&RC[-6]&","&RC[-3]&","&RC[-2]&","&RC[-1]&"}," -> {201010,0,1,5}, | AI22: =R[-1]C&RC[-1] -> {200000,0,1,40},{200001,0,1,40},{200002,0,1,40},{200003,0,1,40},{200006,0,1,40},{200010,0,1,5},{200011,0,1,10},{200012,0,1,10},{200013,0,1,10},{200015,0,1,10},{200016,0,1,10},{200017,0,1,10},{200019,0,1,10},{201000,0,1,40},{201001,0,1,40},{201002,0,1,40},{201003,0,1,40},{201006,0,1,40},{201010,0,1,5}, | AK22: 201012 | AL22: 恶魔长袍 | AM22: 1 | AN22: 0 | AO22: 1 | AP22: 100 | AQ22: ="{"&RC[-6]&","&RC[-3]&","&RC[-2]&","&RC[-1]&"}," -> {201012,0,1,100}, | AR22: =R[-1]C&RC[-1] -> {200010,0,1,100},{200011,0,1,100},{200012,0,1,100},{200013,0,1,100},{200015,0,1,100},{200016,0,1,100},{200017,0,1,100},{200019,0,1,100},{200020,0,1,1},{200021,0,1,2},{200022,0,1,2},{200023,0,1,2},{200025,0,1,2},{200026,0,1,2},{200027,0,1,2},{200029,0,1,2},{201010,0,1,100},{201011,0,1,100},{201012,0,1,100}, | AT22: 201012 | AU22: 恶魔长袍 | AV22: 1 | AW22: 0 | AX22: 1 | AY22: 80 | AZ22: ="{"&RC[-6]&","&RC[-3]&","&RC[-2]&","&RC[-1]&"}," -> {201012,0,1,80}, | BA22: =R[-1]C&RC[-1] -> {200010,0,1,80},{200011,0,1,80},{200012,0,1,80},{200013,0,1,80},{200015,0,1,80},{200016,0,1,80},{200017,0,1,80},{200019,0,1,80},{200020,0,1,1},{200021,0,1,3},{200022,0,1,3},{200023,0,1,3},{200025,0,1,3},{200026,0,1,3},{200027,0,1,3},{200029,0,1,3},{201010,0,1,80},{201011,0,1,80},{201012,0,1,80}, | BC22: 201012 | BD22: 恶魔长袍 | BE22: 1 | BF22: 0 | BG22: 1 | BH22: 60 | BI22: ="{"&RC[-6]&","&RC[-3]&","&RC[-2]&","&RC[-1]&"}," -> {201012,0,1,60}, | BJ22: =R[-1]C&RC[-1] -> {200010,0,1,60},{200011,0,1,60},{200012,0,1,60},{200013,0,1,60},{200015,0,1,60},{200016,0,1,60},{200017,0,1,60},{200019,0,1,60},{200020,0,1,1},{200021,0,1,5},{200022,0,1,5},{200023,0,1,5},{200025,0,1,5},{200026,0,1,5},{200027,0,1,5},{200029,0,1,5},{201010,0,1,60},{201011,0,1,60},{201012,0,1,60},
A23: 110004 | B23: 红药 | D23: 0 | E23: 1 | F23: 3 | G23: ="{"&RC[-6]&","&RC[-3]&","&RC[-2]&","&RC[-1]&"}," -> {110004,0,1,3}, | H23: =R[-1]C&RC[-1] -> {110002,0,2,2},{110003,0,2,2},{110004,0,1,3}, | J23: 202003 | K23: 三眼手镯 | L23: 1 | M23: 0 | N23: 1 | O23: 40 | P23: ="{"&RC[-6]&","&RC[-3]&","&RC[-2]&","&RC[-1]&"}," -> {202003,0,1,40}, | Q23: =R[-1]C&RC[-1] -> {200000,0,1,40},{200001,0,1,40},{200002,0,1,40},{200003,0,1,40},{200006,0,1,40},{200010,0,1,5},{200011,0,1,10},{200012,0,1,10},{201000,0,1,40},{201001,0,1,40},{201002,0,1,40},{201003,0,1,40},{201006,0,1,40},{201010,0,1,5},{201011,0,1,10},{201012,0,1,10},{202000,0,1,40},{202001,0,1,40},{202002,0,1,40},{202003,0,1,40}, | S23: 201011 | T23: 恶魔铃铛 | U23: 1 | V23: 0 | W23: 1 | X23: 10 | Y23: ="{"&RC[-6]&","&RC[-3]&","&RC[-2]&","&RC[-1]&"}," -> {201011,0,1,10}, | Z23: =R[-1]C&RC[-1] -> {200000,0,1,40},{200001,0,1,40},{200002,0,1,40},{200003,0,1,40},{200006,0,1,40},{200010,0,1,5},{200011,0,1,10},{200012,0,1,10},{200013,0,1,10},{200015,0,1,10},{200016,0,1,10},{200017,0,1,10},{200019,0,1,10},{201000,0,1,40},{201001,0,1,40},{201002,0,1,40},{201003,0,1,40},{201006,0,1,40},{201010,0,1,5},{201011,0,1,10}, | AB23: 201011 | AC23: 恶魔铃铛 | AD23: 1 | AE23: 0 | AF23: 1 | AG23: 10 | AH23: ="{"&RC[-6]&","&RC[-3]&","&RC[-2]&","&RC[-1]&"}," -> {201011,0,1,10}, | AI23: =R[-1]C&RC[-1] -> {200000,0,1,40},{200001,0,1,40},{200002,0,1,40},{200003,0,1,40},{200006,0,1,40},{200010,0,1,5},{200011,0,1,10},{200012,0,1,10},{200013,0,1,10},{200015,0,1,10},{200016,0,1,10},{200017,0,1,10},{200019,0,1,10},{201000,0,1,40},{201001,0,1,40},{201002,0,1,40},{201003,0,1,40},{201006,0,1,40},{201010,0,1,5},{201011,0,1,10}, | AK23: 201013 | AL23: 紫碧螺 | AM23: 1 | AN23: 0 | AO23: 1 | AP23: 100 | AQ23: ="{"&RC[-6]&","&RC[-3]&","&RC[-2]&","&RC[-1]&"}," -> {201013,0,1,100}, | AR23: =R[-1]C&RC[-1] -> {200010,0,1,100},{200011,0,1,100},{200012,0,1,100},{200013,0,1,100},{200015,0,1,100},{200016,0,1,100},{200017,0,1,100},{200019,0,1,100},{200020,0,1,1},{200021,0,1,2},{200022,0,1,2},{200023,0,1,2},{200025,0,1,2},{200026,0,1,2},{200027,0,1,2},{200029,0,1,2},{201010,0,1,100},{201011,0,1,100},{201012,0,1,100},{201013,0,1,100}, | AT23: 201013 | AU23: 紫碧螺 | AV23: 1 | AW23: 0 | AX23: 1 | AY23: 80 | AZ23: ="{"&RC[-6]&","&RC[-3]&","&RC[-2]&","&RC[-1]&"}," -> {201013,0,1,80}, | BA23: =R[-1]C&RC[-1] -> {200010,0,1,80},{200011,0,1,80},{200012,0,1,80},{200013,0,1,80},{200015,0,1,80},{200016,0,1,80},{200017,0,1,80},{200019,0,1,80},{200020,0,1,1},{200021,0,1,3},{200022,0,1,3},{200023,0,1,3},{200025,0,1,3},{200026,0,1,3},{200027,0,1,3},{200029,0,1,3},{201010,0,1,80},{201011,0,1,80},{201012,0,1,80},{201013,0,1,80}, | BC23: 201013 | BD23: 紫碧螺 | BE23: 1 | BF23: 0 | BG23: 1 | BH23: 60 | BI23: ="{"&RC[-6]&","&RC[-3]&","&RC[-2]&","&RC[-1]&"}," -> {201013,0,1,60}, | BJ23: =R[-1]C&RC[-1] -> {200010,0,1,60},{200011,0,1,60},{200012,0,1,60},{200013,0,1,60},{200015,0,1,60},{200016,0,1,60},{200017,0,1,60},{200019,0,1,60},{200020,0,1,1},{200021,0,1,5},{200022,0,1,5},{200023,0,1,5},{200025,0,1,5},{200026,0,1,5},{200027,0,1,5},{200029,0,1,5},{201010,0,1,60},{201011,0,1,60},{201012,0,1,60},{201013,0,1,60},
A24: 110005 | B24: 蓝药 | D24: 0 | E24: 1 | F24: 3 | G24: ="{"&RC[-6]&","&RC[-3]&","&RC[-2]&","&RC[-1]&"}," -> {110005,0,1,3}, | H24: =R[-1]C&RC[-1] -> {110002,0,2,2},{110003,0,2,2},{110004,0,1,3},{110005,0,1,3}, | J24: 202006 | K24: 凤凰明珠 | L24: 1 | M24: 0 | N24: 1 | O24: 40 | P24: ="{"&RC[-6]&","&RC[-3]&","&RC[-2]&","&RC[-1]&"}," -> {202006,0,1,40}, | Q24: =R[-1]C&RC[-1] -> {200000,0,1,40},{200001,0,1,40},{200002,0,1,40},{200003,0,1,40},{200006,0,1,40},{200010,0,1,5},{200011,0,1,10},{200012,0,1,10},{201000,0,1,40},{201001,0,1,40},{201002,0,1,40},{201003,0,1,40},{201006,0,1,40},{201010,0,1,5},{201011,0,1,10},{201012,0,1,10},{202000,0,1,40},{202001,0,1,40},{202002,0,1,40},{202003,0,1,40},{202006,0,1,40}, | S24: 201012 | T24: 恶魔长袍 | U24: 1 | V24: 0 | W24: 1 | X24: 10 | Y24: ="{"&RC[-6]&","&RC[-3]&","&RC[-2]&","&RC[-1]&"}," -> {201012,0,1,10}, | Z24: =R[-1]C&RC[-1] -> {200000,0,1,40},{200001,0,1,40},{200002,0,1,40},{200003,0,1,40},{200006,0,1,40},{200010,0,1,5},{200011,0,1,10},{200012,0,1,10},{200013,0,1,10},{200015,0,1,10},{200016,0,1,10},{200017,0,1,10},{200019,0,1,10},{201000,0,1,40},{201001,0,1,40},{201002,0,1,40},{201003,0,1,40},{201006,0,1,40},{201010,0,1,5},{201011,0,1,10},{201012,0,1,10}, | AB24: 201012 | AC24: 恶魔长袍 | AD24: 1 | AE24: 0 | AF24: 1 | AG24: 10 | AH24: ="{"&RC[-6]&","&RC[-3]&","&RC[-2]&","&RC[-1]&"}," -> {201012,0,1,10}, | AI24: =R[-1]C&RC[-1] -> {200000,0,1,40},{200001,0,1,40},{200002,0,1,40},{200003,0,1,40},{200006,0,1,40},{200010,0,1,5},{200011,0,1,10},{200012,0,1,10},{200013,0,1,10},{200015,0,1,10},{200016,0,1,10},{200017,0,1,10},{200019,0,1,10},{201000,0,1,40},{201001,0,1,40},{201002,0,1,40},{201003,0,1,40},{201006,0,1,40},{201010,0,1,5},{201011,0,1,10},{201012,0,1,10}, | AK24: 201015 | AL24: 法师头盔 | AM24: 1 | AN24: 0 | AO24: 1 | AP24: 100 | AQ24: ="{"&RC[-6]&","&RC[-3]&","&RC[-2]&","&RC[-1]&"}," -> {201015,0,1,100}, | AR24: =R[-1]C&RC[-1] -> {200010,0,1,100},{200011,0,1,100},{200012,0,1,100},{200013,0,1,100},{200015,0,1,100},{200016,0,1,100},{200017,0,1,100},{200019,0,1,100},{200020,0,1,1},{200021,0,1,2},{200022,0,1,2},{200023,0,1,2},{200025,0,1,2},{200026,0,1,2},{200027,0,1,2},{200029,0,1,2},{201010,0,1,100},{201011,0,1,100},{201012,0,1,100},{201013,0,1,100},{201015,0,1,100}, | AT24: 201015 | AU24: 法师头盔 | AV24: 1 | AW24: 0 | AX24: 1 | AY24: 80 | AZ24: ="{"&RC[-6]&","&RC[-3]&","&RC[-2]&","&RC[-1]&"}," -> {201015,0,1,80}, | BA24: =R[-1]C&RC[-1] -> {200010,0,1,80},{200011,0,1,80},{200012,0,1,80},{200013,0,1,80},{200015,0,1,80},{200016,0,1,80},{200017,0,1,80},{200019,0,1,80},{200020,0,1,1},{200021,0,1,3},{200022,0,1,3},{200023,0,1,3},{200025,0,1,3},{200026,0,1,3},{200027,0,1,3},{200029,0,1,3},{201010,0,1,80},{201011,0,1,80},{201012,0,1,80},{201013,0,1,80},{201015,0,1,80}, | BC24: 201015 | BD24: 法师头盔 | BE24: 1 | BF24: 0 | BG24: 1 | BH24: 60 | BI24: ="{"&RC[-6]&","&RC[-3]&","&RC[-2]&","&RC[-1]&"}," -> {201015,0,1,60}, | BJ24: =R[-1]C&RC[-1] -> {200010,0,1,60},{200011,0,1,60},{200012,0,1,60},{200013,0,1,60},{200015,0,1,60},{200016,0,1,60},{200017,0,1,60},{200019,0,1,60},{200020,0,1,1},{200021,0,1,5},{200022,0,1,5},{200023,0,1,5},{200025,0,1,5},{200026,0,1,5},{200027,0,1,5},{200029,0,1,5},{201010,0,1,60},{201011,0,1,60},{201012,0,1,60},{201013,0,1,60},{201015,0,1,60},
A25: 110010 | B25: 普通武装碎片 | D25: 0 | E25: 1 | F25: 0 | G25: ="{"&RC[-6]&","&RC[-3]&","&RC[-2]&","&RC[-1]&"}," -> {110010,0,1,0}, | H25: =R[-1]C&RC[-1] -> {110002,0,2,2},{110003,0,2,2},{110004,0,1,3},{110005,0,1,3},{110010,0,1,0}, | J25: 202010 | K25: 银蛇 | L25: 1 | M25: 0 | N25: 1 | O25: 5 | P25: ="{"&RC[-6]&","&RC[-3]&","&RC[-2]&","&RC[-1]&"}," -> {202010,0,1,5}, | Q25: =R[-1]C&RC[-1] -> {200000,0,1,40},{200001,0,1,40},{200002,0,1,40},{200003,0,1,40},{200006,0,1,40},{200010,0,1,5},{200011,0,1,10},{200012,0,1,10},{201000,0,1,40},{201001,0,1,40},{201002,0,1,40},{201003,0,1,40},{201006,0,1,40},{201010,0,1,5},{201011,0,1,10},{201012,0,1,10},{202000,0,1,40},{202001,0,1,40},{202002,0,1,40},{202003,0,1,40},{202006,0,1,40},{202010,0,1,5}, | S25: 201013 | T25: 紫碧螺 | U25: 1 | V25: 0 | W25: 1 | X25: 10 | Y25: ="{"&RC[-6]&","&RC[-3]&","&RC[-2]&","&RC[-1]&"}," -> {201013,0,1,10}, | Z25: =R[-1]C&RC[-1] -> {200000,0,1,40},{200001,0,1,40},{200002,0,1,40},{200003,0,1,40},{200006,0,1,40},{200010,0,1,5},{200011,0,1,10},{200012,0,1,10},{200013,0,1,10},{200015,0,1,10},{200016,0,1,10},{200017,0,1,10},{200019,0,1,10},{201000,0,1,40},{201001,0,1,40},{201002,0,1,40},{201003,0,1,40},{201006,0,1,40},{201010,0,1,5},{201011,0,1,10},{201012,0,1,10},{201013,0,1,10}, | AB25: 201013 | AC25: 紫碧螺 | AD25: 1 | AE25: 0 | AF25: 1 | AG25: 10 | AH25: ="{"&RC[-6]&","&RC[-3]&","&RC[-2]&","&RC[-1]&"}," -> {201013,0,1,10}, | AI25: =R[-1]C&RC[-1] -> {200000,0,1,40},{200001,0,1,40},{200002,0,1,40},{200003,0,1,40},{200006,0,1,40},{200010,0,1,5},{200011,0,1,10},{200012,0,1,10},{200013,0,1,10},{200015,0,1,10},{200016,0,1,10},{200017,0,1,10},{200019,0,1,10},{201000,0,1,40},{201001,0,1,40},{201002,0,1,40},{201003,0,1,40},{201006,0,1,40},{201010,0,1,5},{201011,0,1,10},{201012,0,1,10},{201013,0,1,10}, | AK25: 201016 | AL25: 龙之手镯 | AM25: 1 | AN25: 0 | AO25: 1 | AP25: 100 | AQ25: ="{"&RC[-6]&","&RC[-3]&","&RC[-2]&","&RC[-1]&"}," -> {201016,0,1,100}, | AR25: =R[-1]C&RC[-1] -> {200010,0,1,100},{200011,0,1,100},{200012,0,1,100},{200013,0,1,100},{200015,0,1,100},{200016,0,1,100},{200017,0,1,100},{200019,0,1,100},{200020,0,1,1},{200021,0,1,2},{200022,0,1,2},{200023,0,1,2},{200025,0,1,2},{200026,0,1,2},{200027,0,1,2},{200029,0,1,2},{201010,0,1,100},{201011,0,1,100},{201012,0,1,100},{201013,0,1,100},{201015,0,1,100},{201016,0,1,100}, | AT25: 201016 | AU25: 龙之手镯 | AV25: 1 | AW25: 0 | AX25: 1 | AY25: 80 | AZ25: ="{"&RC[-6]&","&RC[-3]&","&RC[-2]&","&RC[-1]&"}," -> {201016,0,1,80}, | BA25: =R[-1]C&RC[-1] -> {200010,0,1,80},{200011,0,1,80},{200012,0,1,80},{200013,0,1,80},{200015,0,1,80},{200016,0,1,80},{200017,0,1,80},{200019,0,1,80},{200020,0,1,1},{200021,0,1,3},{200022,0,1,3},{200023,0,1,3},{200025,0,1,3},{200026,0,1,3},{200027,0,1,3},{200029,0,1,3},{201010,0,1,80},{201011,0,1,80},{201012,0,1,80},{201013,0,1,80},{201015,0,1,80},{201016,0,1,80}, | BC25: 201016 | BD25: 龙之手镯 | BE25: 1 | BF25: 0 | BG25: 1 | BH25: 60 | BI25: ="{"&RC[-6]&","&RC[-3]&","&RC[-2]&","&RC[-1]&"}," -> {201016,0,1,60}, | BJ25: =R[-1]C&RC[-1] -> {200010,0,1,60},{200011,0,1,60},{200012,0,1,60},{200013,0,1,60},{200015,0,1,60},{200016,0,1,60},{200017,0,1,60},{200019,0,1,60},{200020,0,1,1},{200021,0,1,5},{200022,0,1,5},{200023,0,1,5},{200025,0,1,5},{200026,0,1,5},{200027,0,1,5},{200029,0,1,5},{201010,0,1,60},{201011,0,1,60},{201012,0,1,60},{201013,0,1,60},{201015,0,1,60},{201016,0,1,60},
A26: 110011 | B26: 普通防具碎片 | D26: 0 | E26: 1 | F26: 0 | G26: ="{"&RC[-6]&","&RC[-3]&","&RC[-2]&","&RC[-1]&"}," -> {110011,0,1,0}, | H26: =R[-1]C&RC[-1] -> {110002,0,2,2},{110003,0,2,2},{110004,0,1,3},{110005,0,1,3},{110010,0,1,0},{110011,0,1,0}, | J26: 202011 | K26: 天珠道链 | L26: 1 | M26: 0 | N26: 1 | O26: 10 | P26: ="{"&RC[-6]&","&RC[-3]&","&RC[-2]&","&RC[-1]&"}," -> {202011,0,1,10}, | Q26: =R[-1]C&RC[-1] -> {200000,0,1,40},{200001,0,1,40},{200002,0,1,40},{200003,0,1,40},{200006,0,1,40},{200010,0,1,5},{200011,0,1,10},{200012,0,1,10},{201000,0,1,40},{201001,0,1,40},{201002,0,1,40},{201003,0,1,40},{201006,0,1,40},{201010,0,1,5},{201011,0,1,10},{201012,0,1,10},{202000,0,1,40},{202001,0,1,40},{202002,0,1,40},{202003,0,1,40},{202006,0,1,40},{202010,0,1,5},{202011,0,1,10}, | S26: 201015 | T26: 法师头盔 | U26: 1 | V26: 0 | W26: 1 | X26: 10 | Y26: ="{"&RC[-6]&","&RC[-3]&","&RC[-2]&","&RC[-1]&"}," -> {201015,0,1,10}, | Z26: =R[-1]C&RC[-1] -> {200000,0,1,40},{200001,0,1,40},{200002,0,1,40},{200003,0,1,40},{200006,0,1,40},{200010,0,1,5},{200011,0,1,10},{200012,0,1,10},{200013,0,1,10},{200015,0,1,10},{200016,0,1,10},{200017,0,1,10},{200019,0,1,10},{201000,0,1,40},{201001,0,1,40},{201002,0,1,40},{201003,0,1,40},{201006,0,1,40},{201010,0,1,5},{201011,0,1,10},{201012,0,1,10},{201013,0,1,10},{201015,0,1,10}, | AB26: 201015 | AC26: 法师头盔 | AD26: 1 | AE26: 0 | AF26: 1 | AG26: 10 | AH26: ="{"&RC[-6]&","&RC[-3]&","&RC[-2]&","&RC[-1]&"}," -> {201015,0,1,10}, | AI26: =R[-1]C&RC[-1] -> {200000,0,1,40},{200001,0,1,40},{200002,0,1,40},{200003,0,1,40},{200006,0,1,40},{200010,0,1,5},{200011,0,1,10},{200012,0,1,10},{200013,0,1,10},{200015,0,1,10},{200016,0,1,10},{200017,0,1,10},{200019,0,1,10},{201000,0,1,40},{201001,0,1,40},{201002,0,1,40},{201003,0,1,40},{201006,0,1,40},{201010,0,1,5},{201011,0,1,10},{201012,0,1,10},{201013,0,1,10},{201015,0,1,10}, | AK26: 201017 | AL26: 法师腰带 | AM26: 1 | AN26: 0 | AO26: 1 | AP26: 100 | AQ26: ="{"&RC[-6]&","&RC[-3]&","&RC[-2]&","&RC[-1]&"}," -> {201017,0,1,100}, | AR26: =R[-1]C&RC[-1] -> {200010,0,1,100},{200011,0,1,100},{200012,0,1,100},{200013,0,1,100},{200015,0,1,100},{200016,0,1,100},{200017,0,1,100},{200019,0,1,100},{200020,0,1,1},{200021,0,1,2},{200022,0,1,2},{200023,0,1,2},{200025,0,1,2},{200026,0,1,2},{200027,0,1,2},{200029,0,1,2},{201010,0,1,100},{201011,0,1,100},{201012,0,1,100},{201013,0,1,100},{201015,0,1,100},{201016,0,1,100},{201017,0,1,100}, | AT26: 201017 | AU26: 法师腰带 | AV26: 1 | AW26: 0 | AX26: 1 | AY26: 80 | AZ26: ="{"&RC[-6]&","&RC[-3]&","&RC[-2]&","&RC[-1]&"}," -> {201017,0,1,80}, | BA26: =R[-1]C&RC[-1] -> {200010,0,1,80},{200011,0,1,80},{200012,0,1,80},{200013,0,1,80},{200015,0,1,80},{200016,0,1,80},{200017,0,1,80},{200019,0,1,80},{200020,0,1,1},{200021,0,1,3},{200022,0,1,3},{200023,0,1,3},{200025,0,1,3},{200026,0,1,3},{200027,0,1,3},{200029,0,1,3},{201010,0,1,80},{201011,0,1,80},{201012,0,1,80},{201013,0,1,80},{201015,0,1,80},{201016,0,1,80},{201017,0,1,80}, | BC26: 201017 | BD26: 法师腰带 | BE26: 1 | BF26: 0 | BG26: 1 | BH26: 60 | BI26: ="{"&RC[-6]&","&RC[-3]&","&RC[-2]&","&RC[-1]&"}," -> {201017,0,1,60}, | BJ26: =R[-1]C&RC[-1] -> {200010,0,1,60},{200011,0,1,60},{200012,0,1,60},{200013,0,1,60},{200015,0,1,60},{200016,0,1,60},{200017,0,1,60},{200019,0,1,60},{200020,0,1,1},{200021,0,1,5},{200022,0,1,5},{200023,0,1,5},{200025,0,1,5},{200026,0,1,5},{200027,0,1,5},{200029,0,1,5},{201010,0,1,60},{201011,0,1,60},{201012,0,1,60},{201013,0,1,60},{201015,0,1,60},{201016,0,1,60},{201017,0,1,60},
A27: 110012 | B27: 普通首饰碎片 | D27: 0 | E27: 1 | F27: 0 | G27: ="{"&RC[-6]&","&RC[-3]&","&RC[-2]&","&RC[-1]&"}" -> {110012,0,1,0} | H27: =R[-1]C&RC[-1] -> {110002,0,2,2},{110003,0,2,2},{110004,0,1,3},{110005,0,1,3},{110010,0,1,0},{110011,0,1,0},{110012,0,1,0} | J27: 202012 | K27: 灵魂道袍 | L27: 1 | M27: 0 | N27: 1 | O27: 10 | P27: ="{"&RC[-6]&","&RC[-3]&","&RC[-2]&","&RC[-1]&"}" -> {202012,0,1,10} | Q27: =R[-1]C&RC[-1] -> {200000,0,1,40},{200001,0,1,40},{200002,0,1,40},{200003,0,1,40},{200006,0,1,40},{200010,0,1,5},{200011,0,1,10},{200012,0,1,10},{201000,0,1,40},{201001,0,1,40},{201002,0,1,40},{201003,0,1,40},{201006,0,1,40},{201010,0,1,5},{201011,0,1,10},{201012,0,1,10},{202000,0,1,40},{202001,0,1,40},{202002,0,1,40},{202003,0,1,40},{202006,0,1,40},{202010,0,1,5},{202011,0,1,10},{202012,0,1,10} | S27: 201016 | T27: 龙之手镯 | U27: 1 | V27: 0 | W27: 1 | X27: 10 | Y27: ="{"&RC[-6]&","&RC[-3]&","&RC[-2]&","&RC[-1]&"}," -> {201016,0,1,10}, | Z27: =R[-1]C&RC[-1] -> {200000,0,1,40},{200001,0,1,40},{200002,0,1,40},{200003,0,1,40},{200006,0,1,40},{200010,0,1,5},{200011,0,1,10},{200012,0,1,10},{200013,0,1,10},{200015,0,1,10},{200016,0,1,10},{200017,0,1,10},{200019,0,1,10},{201000,0,1,40},{201001,0,1,40},{201002,0,1,40},{201003,0,1,40},{201006,0,1,40},{201010,0,1,5},{201011,0,1,10},{201012,0,1,10},{201013,0,1,10},{201015,0,1,10},{201016,0,1,10}, | AB27: 201016 | AC27: 龙之手镯 | AD27: 1 | AE27: 0 | AF27: 1 | AG27: 10 | AH27: ="{"&RC[-6]&","&RC[-3]&","&RC[-2]&","&RC[-1]&"}," -> {201016,0,1,10}, | AI27: =R[-1]C&RC[-1] -> {200000,0,1,40},{200001,0,1,40},{200002,0,1,40},{200003,0,1,40},{200006,0,1,40},{200010,0,1,5},{200011,0,1,10},{200012,0,1,10},{200013,0,1,10},{200015,0,1,10},{200016,0,1,10},{200017,0,1,10},{200019,0,1,10},{201000,0,1,40},{201001,0,1,40},{201002,0,1,40},{201003,0,1,40},{201006,0,1,40},{201010,0,1,5},{201011,0,1,10},{201012,0,1,10},{201013,0,1,10},{201015,0,1,10},{201016,0,1,10}, | AK27: 201019 | AL27: 法师鞋子 | AM27: 1 | AN27: 0 | AO27: 1 | AP27: 100 | AQ27: ="{"&RC[-6]&","&RC[-3]&","&RC[-2]&","&RC[-1]&"}," -> {201019,0,1,100}, | AR27: =R[-1]C&RC[-1] -> {200010,0,1,100},{200011,0,1,100},{200012,0,1,100},{200013,0,1,100},{200015,0,1,100},{200016,0,1,100},{200017,0,1,100},{200019,0,1,100},{200020,0,1,1},{200021,0,1,2},{200022,0,1,2},{200023,0,1,2},{200025,0,1,2},{200026,0,1,2},{200027,0,1,2},{200029,0,1,2},{201010,0,1,100},{201011,0,1,100},{201012,0,1,100},{201013,0,1,100},{201015,0,1,100},{201016,0,1,100},{201017,0,1,100},{201019,0,1,100}, | AT27: 201019 | AU27: 法师鞋子 | AV27: 1 | AW27: 0 | AX27: 1 | AY27: 80 | AZ27: ="{"&RC[-6]&","&RC[-3]&","&RC[-2]&","&RC[-1]&"}," -> {201019,0,1,80}, | BA27: =R[-1]C&RC[-1] -> {200010,0,1,80},{200011,0,1,80},{200012,0,1,80},{200013,0,1,80},{200015,0,1,80},{200016,0,1,80},{200017,0,1,80},{200019,0,1,80},{200020,0,1,1},{200021,0,1,3},{200022,0,1,3},{200023,0,1,3},{200025,0,1,3},{200026,0,1,3},{200027,0,1,3},{200029,0,1,3},{201010,0,1,80},{201011,0,1,80},{201012,0,1,80},{201013,0,1,80},{201015,0,1,80},{201016,0,1,80},{201017,0,1,80},{201019,0,1,80}, | BC27: 201019 | BD27: 法师鞋子 | BE27: 1 | BF27: 0 | BG27: 1 | BH27: 60 | BI27: ="{"&RC[-6]&","&RC[-3]&","&RC[-2]&","&RC[-1]&"}," -> {201019,0,1,60}, | BJ27: =R[-1]C&RC[-1] -> {200010,0,1,60},{200011,0,1,60},{200012,0,1,60},{200013,0,1,60},{200015,0,1,60},{200016,0,1,60},{200017,0,1,60},{200019,0,1,60},{200020,0,1,1},{200021,0,1,5},{200022,0,1,5},{200023,0,1,5},{200025,0,1,5},{200026,0,1,5},{200027,0,1,5},{200029,0,1,5},{201010,0,1,60},{201011,0,1,60},{201012,0,1,60},{201013,0,1,60},{201015,0,1,60},{201016,0,1,60},{201017,0,1,60},{201019,0,1,60},
S28: 201017 | T28: 法师腰带 | U28: 1 | V28: 0 | W28: 1 | X28: 10 | Y28: ="{"&RC[-6]&","&RC[-3]&","&RC[-2]&","&RC[-1]&"}," -> {201017,0,1,10}, | Z28: =R[-1]C&RC[-1] -> {200000,0,1,40},{200001,0,1,40},{200002,0,1,40},{200003,0,1,40},{200006,0,1,40},{200010,0,1,5},{200011,0,1,10},{200012,0,1,10},{200013,0,1,10},{200015,0,1,10},{200016,0,1,10},{200017,0,1,10},{200019,0,1,10},{201000,0,1,40},{201001,0,1,40},{201002,0,1,40},{201003,0,1,40},{201006,0,1,40},{201010,0,1,5},{201011,0,1,10},{201012,0,1,10},{201013,0,1,10},{201015,0,1,10},{201016,0,1,10},{201017,0,1,10}, | AB28: 201017 | AC28: 法师腰带 | AD28: 1 | AE28: 0 | AF28: 1 | AG28: 10 | AH28: ="{"&RC[-6]&","&RC[-3]&","&RC[-2]&","&RC[-1]&"}," -> {201017,0,1,10}, | AI28: =R[-1]C&RC[-1] -> {200000,0,1,40},{200001,0,1,40},{200002,0,1,40},{200003,0,1,40},{200006,0,1,40},{200010,0,1,5},{200011,0,1,10},{200012,0,1,10},{200013,0,1,10},{200015,0,1,10},{200016,0,1,10},{200017,0,1,10},{200019,0,1,10},{201000,0,1,40},{201001,0,1,40},{201002,0,1,40},{201003,0,1,40},{201006,0,1,40},{201010,0,1,5},{201011,0,1,10},{201012,0,1,10},{201013,0,1,10},{201015,0,1,10},{201016,0,1,10},{201017,0,1,10}, | AK28: 201020 | AL28: 骨玉 | AM28: 1 | AN28: 0 | AO28: 1 | AP28: 1 | AQ28: ="{"&RC[-6]&","&RC[-3]&","&RC[-2]&","&RC[-1]&"}," -> {201020,0,1,1}, | AR28: =R[-1]C&RC[-1] -> {200010,0,1,100},{200011,0,1,100},{200012,0,1,100},{200013,0,1,100},{200015,0,1,100},{200016,0,1,100},{200017,0,1,100},{200019,0,1,100},{200020,0,1,1},{200021,0,1,2},{200022,0,1,2},{200023,0,1,2},{200025,0,1,2},{200026,0,1,2},{200027,0,1,2},{200029,0,1,2},{201010,0,1,100},{201011,0,1,100},{201012,0,1,100},{201013,0,1,100},{201015,0,1,100},{201016,0,1,100},{201017,0,1,100},{201019,0,1,100},{201020,0,1,1}, | AT28: 201020 | AU28: 骨玉 | AV28: 1 | AW28: 0 | AX28: 1 | AY28: 1 | AZ28: ="{"&RC[-6]&","&RC[-3]&","&RC[-2]&","&RC[-1]&"}," -> {201020,0,1,1}, | BA28: =R[-1]C&RC[-1] -> {200010,0,1,80},{200011,0,1,80},{200012,0,1,80},{200013,0,1,80},{200015,0,1,80},{200016,0,1,80},{200017,0,1,80},{200019,0,1,80},{200020,0,1,1},{200021,0,1,3},{200022,0,1,3},{200023,0,1,3},{200025,0,1,3},{200026,0,1,3},{200027,0,1,3},{200029,0,1,3},{201010,0,1,80},{201011,0,1,80},{201012,0,1,80},{201013,0,1,80},{201015,0,1,80},{201016,0,1,80},{201017,0,1,80},{201019,0,1,80},{201020,0,1,1}, | BC28: 201020 | BD28: 骨玉 | BE28: 1 | BF28: 0 | BG28: 1 | BH28: 1 | BI28: ="{"&RC[-6]&","&RC[-3]&","&RC[-2]&","&RC[-1]&"}," -> {201020,0,1,1}, | BJ28: =R[-1]C&RC[-1] -> {200010,0,1,60},{200011,0,1,60},{200012,0,1,60},{200013,0,1,60},{200015,0,1,60},{200016,0,1,60},{200017,0,1,60},{200019,0,1,60},{200020,0,1,1},{200021,0,1,5},{200022,0,1,5},{200023,0,1,5},{200025,0,1,5},{200026,0,1,5},{200027,0,1,5},{200029,0,1,5},{201010,0,1,60},{201011,0,1,60},{201012,0,1,60},{201013,0,1,60},{201015,0,1,60},{201016,0,1,60},{201017,0,1,60},{201019,0,1,60},{201020,0,1,1},
S29: 201019 | T29: 法师鞋子 | U29: 1 | V29: 0 | W29: 1 | X29: 10 | Y29: ="{"&RC[-6]&","&RC[-3]&","&RC[-2]&","&RC[-1]&"}," -> {201019,0,1,10}, | Z29: =R[-1]C&RC[-1] -> {200000,0,1,40},{200001,0,1,40},{200002,0,1,40},{200003,0,1,40},{200006,0,1,40},{200010,0,1,5},{200011,0,1,10},{200012,0,1,10},{200013,0,1,10},{200015,0,1,10},{200016,0,1,10},{200017,0,1,10},{200019,0,1,10},{201000,0,1,40},{201001,0,1,40},{201002,0,1,40},{201003,0,1,40},{201006,0,1,40},{201010,0,1,5},{201011,0,1,10},{201012,0,1,10},{201013,0,1,10},{201015,0,1,10},{201016,0,1,10},{201017,0,1,10},{201019,0,1,10}, | AB29: 201019 | AC29: 法师鞋子 | AD29: 1 | AE29: 0 | AF29: 1 | AG29: 10 | AH29: ="{"&RC[-6]&","&RC[-3]&","&RC[-2]&","&RC[-1]&"}," -> {201019,0,1,10}, | AI29: =R[-1]C&RC[-1] -> {200000,0,1,40},{200001,0,1,40},{200002,0,1,40},{200003,0,1,40},{200006,0,1,40},{200010,0,1,5},{200011,0,1,10},{200012,0,1,10},{200013,0,1,10},{200015,0,1,10},{200016,0,1,10},{200017,0,1,10},{200019,0,1,10},{201000,0,1,40},{201001,0,1,40},{201002,0,1,40},{201003,0,1,40},{201006,0,1,40},{201010,0,1,5},{201011,0,1,10},{201012,0,1,10},{201013,0,1,10},{201015,0,1,10},{201016,0,1,10},{201017,0,1,10},{201019,0,1,10}, | AK29: 201021 | AL29: 法神披风 | AM29: 1 | AN29: 0 | AO29: 1 | AP29: 2 | AQ29: ="{"&RC[-6]&","&RC[-3]&","&RC[-2]&","&RC[-1]&"}," -> {201021,0,1,2}, | AR29: =R[-1]C&RC[-1] -> {200010,0,1,100},{200011,0,1,100},{200012,0,1,100},{200013,0,1,100},{200015,0,1,100},{200016,0,1,100},{200017,0,1,100},{200019,0,1,100},{200020,0,1,1},{200021,0,1,2},{200022,0,1,2},{200023,0,1,2},{200025,0,1,2},{200026,0,1,2},{200027,0,1,2},{200029,0,1,2},{201010,0,1,100},{201011,0,1,100},{201012,0,1,100},{201013,0,1,100},{201015,0,1,100},{201016,0,1,100},{201017,0,1,100},{201019,0,1,100},{201020,0,1,1},{201021,0,1,2}, | AT29: 201021 | AU29: 法神披风 | AV29: 1 | AW29: 0 | AX29: 1 | AY29: 3 | AZ29: ="{"&RC[-6]&","&RC[-3]&","&RC[-2]&","&RC[-1]&"}," -> {201021,0,1,3}, | BA29: =R[-1]C&RC[-1] -> {200010,0,1,80},{200011,0,1,80},{200012,0,1,80},{200013,0,1,80},{200015,0,1,80},{200016,0,1,80},{200017,0,1,80},{200019,0,1,80},{200020,0,1,1},{200021,0,1,3},{200022,0,1,3},{200023,0,1,3},{200025,0,1,3},{200026,0,1,3},{200027,0,1,3},{200029,0,1,3},{201010,0,1,80},{201011,0,1,80},{201012,0,1,80},{201013,0,1,80},{201015,0,1,80},{201016,0,1,80},{201017,0,1,80},{201019,0,1,80},{201020,0,1,1},{201021,0,1,3}, | BC29: 201021 | BD29: 法神披风 | BE29: 1 | BF29: 0 | BG29: 1 | BH29: 5 | BI29: ="{"&RC[-6]&","&RC[-3]&","&RC[-2]&","&RC[-1]&"}," -> {201021,0,1,5}, | BJ29: =R[-1]C&RC[-1] -> {200010,0,1,60},{200011,0,1,60},{200012,0,1,60},{200013,0,1,60},{200015,0,1,60},{200016,0,1,60},{200017,0,1,60},{200019,0,1,60},{200020,0,1,1},{200021,0,1,5},{200022,0,1,5},{200023,0,1,5},{200025,0,1,5},{200026,0,1,5},{200027,0,1,5},{200029,0,1,5},{201010,0,1,60},{201011,0,1,60},{201012,0,1,60},{201013,0,1,60},{201015,0,1,60},{201016,0,1,60},{201017,0,1,60},{201019,0,1,60},{201020,0,1,1},{201021,0,1,5},
A30: BOSS怪掉落 | F30: 装备 | G30: 概率／100 | J30: 110002 | K30: 强化石 | M30: 0 | N30: 2 | O30: 2 | P30: ="{"&RC[-6]&","&RC[-3]&","&RC[-2]&","&RC[-1]&"}," -> {110002,0,2,2}, | Q30: =RC[-1] -> {110002,0,2,2}, | S30: 202000 | T30: 半月 | U30: 1 | V30: 0 | W30: 1 | X30: 40 | Y30: ="{"&RC[-6]&","&RC[-3]&","&RC[-2]&","&RC[-1]&"}," -> {202000,0,1,40}, | Z30: =R[-1]C&RC[-1] -> {200000,0,1,40},{200001,0,1,40},{200002,0,1,40},{200003,0,1,40},{200006,0,1,40},{200010,0,1,5},{200011,0,1,10},{200012,0,1,10},{200013,0,1,10},{200015,0,1,10},{200016,0,1,10},{200017,0,1,10},{200019,0,1,10},{201000,0,1,40},{201001,0,1,40},{201002,0,1,40},{201003,0,1,40},{201006,0,1,40},{201010,0,1,5},{201011,0,1,10},{201012,0,1,10},{201013,0,1,10},{201015,0,1,10},{201016,0,1,10},{201017,0,1,10},{201019,0,1,10},{202000,0,1,40}, | AB30: 202000 | AC30: 半月 | AD30: 1 | AE30: 0 | AF30: 1 | AG30: 40 | AH30: ="{"&RC[-6]&","&RC[-3]&","&RC[-2]&","&RC[-1]&"}," -> {202000,0,1,40}, | AI30: =R[-1]C&RC[-1] -> {200000,0,1,40},{200001,0,1,40},{200002,0,1,40},{200003,0,1,40},{200006,0,1,40},{200010,0,1,5},{200011,0,1,10},{200012,0,1,10},{200013,0,1,10},{200015,0,1,10},{200016,0,1,10},{200017,0,1,10},{200019,0,1,10},{201000,0,1,40},{201001,0,1,40},{201002,0,1,40},{201003,0,1,40},{201006,0,1,40},{201010,0,1,5},{201011,0,1,10},{201012,0,1,10},{201013,0,1,10},{201015,0,1,10},{201016,0,1,10},{201017,0,1,10},{201019,0,1,10},{202000,0,1,40}, | AK30: 201022 | AL30: 法神项链 | AM30: 1 | AN30: 0 | AO30: 1 | AP30: 2 | AQ30: ="{"&RC[-6]&","&RC[-3]&","&RC[-2]&","&RC[-1]&"}," -> {201022,0,1,2}, | AR30: =R[-1]C&RC[-1] -> {200010,0,1,100},{200011,0,1,100},{200012,0,1,100},{200013,0,1,100},{200015,0,1,100},{200016,0,1,100},{200017,0,1,100},{200019,0,1,100},{200020,0,1,1},{200021,0,1,2},{200022,0,1,2},{200023,0,1,2},{200025,0,1,2},{200026,0,1,2},{200027,0,1,2},{200029,0,1,2},{201010,0,1,100},{201011,0,1,100},{201012,0,1,100},{201013,0,1,100},{201015,0,1,100},{201016,0,1,100},{201017,0,1,100},{201019,0,1,100},{201020,0,1,1},{201021,0,1,2},{201022,0,1,2}, | AT30: 201022 | AU30: 法神项链 | AV30: 1 | AW30: 0 | AX30: 1 | AY30: 3 | AZ30: ="{"&RC[-6]&","&RC[-3]&","&RC[-2]&","&RC[-1]&"}," -> {201022,0,1,3}, | BA30: =R[-1]C&RC[-1] -> {200010,0,1,80},{200011,0,1,80},{200012,0,1,80},{200013,0,1,80},{200015,0,1,80},{200016,0,1,80},{200017,0,1,80},{200019,0,1,80},{200020,0,1,1},{200021,0,1,3},{200022,0,1,3},{200023,0,1,3},{200025,0,1,3},{200026,0,1,3},{200027,0,1,3},{200029,0,1,3},{201010,0,1,80},{201011,0,1,80},{201012,0,1,80},{201013,0,1,80},{201015,0,1,80},{201016,0,1,80},{201017,0,1,80},{201019,0,1,80},{201020,0,1,1},{201021,0,1,3},{201022,0,1,3}, | BC30: 201022 | BD30: 法神项链 | BE30: 1 | BF30: 0 | BG30: 1 | BH30: 5 | BI30: ="{"&RC[-6]&","&RC[-3]&","&RC[-2]&","&RC[-1]&"}," -> {201022,0,1,5}, | BJ30: =R[-1]C&RC[-1] -> {200010,0,1,60},{200011,0,1,60},{200012,0,1,60},{200013,0,1,60},{200015,0,1,60},{200016,0,1,60},{200017,0,1,60},{200019,0,1,60},{200020,0,1,1},{200021,0,1,5},{200022,0,1,5},{200023,0,1,5},{200025,0,1,5},{200026,0,1,5},{200027,0,1,5},{200029,0,1,5},{201010,0,1,60},{201011,0,1,60},{201012,0,1,60},{201013,0,1,60},{201015,0,1,60},{201016,0,1,60},{201017,0,1,60},{201019,0,1,60},{201020,0,1,1},{201021,0,1,5},{201022,0,1,5},
F31: 3 | G31: 100 | H31: ="{0,[{"&RC[-2]&","&RC[-1]&"}],["&R[-13]C&"]}" -> {0,[{3,100}],[{200000,0,1,100},{200001,0,1,100},{200002,0,1,100},{200003,0,1,100},{200006,0,1,100},{201000,0,1,100},{201001,0,1,100},{201002,0,1,100},{201003,0,1,100},{201006,0,1,100},{202000,0,1,100},{202001,0,1,100},{202002,0,1,100},{202003,0,1,100},{202006,0,1,100}]} | J31: 110003 | K31: 洗炼石 | M31: 0 | N31: 2 | O31: 2 | P31: ="{"&RC[-6]&","&RC[-3]&","&RC[-2]&","&RC[-1]&"}," -> {110003,0,2,2}, | Q31: =R[-1]C&RC[-1] -> {110002,0,2,2},{110003,0,2,2}, | S31: 202001 | T31: 轻盔 | U31: 1 | V31: 0 | W31: 1 | X31: 40 | Y31: ="{"&RC[-6]&","&RC[-3]&","&RC[-2]&","&RC[-1]&"}," -> {202001,0,1,40}, | Z31: =R[-1]C&RC[-1] -> {200000,0,1,40},{200001,0,1,40},{200002,0,1,40},{200003,0,1,40},{200006,0,1,40},{200010,0,1,5},{200011,0,1,10},{200012,0,1,10},{200013,0,1,10},{200015,0,1,10},{200016,0,1,10},{200017,0,1,10},{200019,0,1,10},{201000,0,1,40},{201001,0,1,40},{201002,0,1,40},{201003,0,1,40},{201006,0,1,40},{201010,0,1,5},{201011,0,1,10},{201012,0,1,10},{201013,0,1,10},{201015,0,1,10},{201016,0,1,10},{201017,0,1,10},{201019,0,1,10},{202000,0,1,40},{202001,0,1,40}, | AB31: 202001 | AC31: 轻盔 | AD31: 1 | AE31: 0 | AF31: 1 | AG31: 40 | AH31: ="{"&RC[-6]&","&RC[-3]&","&RC[-2]&","&RC[-1]&"}," -> {202001,0,1,40}, | AI31: =R[-1]C&RC[-1] -> {200000,0,1,40},{200001,0,1,40},{200002,0,1,40},{200003,0,1,40},{200006,0,1,40},{200010,0,1,5},{200011,0,1,10},{200012,0,1,10},{200013,0,1,10},{200015,0,1,10},{200016,0,1,10},{200017,0,1,10},{200019,0,1,10},{201000,0,1,40},{201001,0,1,40},{201002,0,1,40},{201003,0,1,40},{201006,0,1,40},{201010,0,1,5},{201011,0,1,10},{201012,0,1,10},{201013,0,1,10},{201015,0,1,10},{201016,0,1,10},{201017,0,1,10},{201019,0,1,10},{202000,0,1,40},{202001,0,1,40}, | AK31: 201023 | AL31: 法神戒指 | AM31: 1 | AN31: 0 | AO31: 1 | AP31: 2 | AQ31: ="{"&RC[-6]&","&RC[-3]&","&RC[-2]&","&RC[-1]&"}," -> {201023,0,1,2}, | AR31: =R[-1]C&RC[-1] -> {200010,0,1,100},{200011,0,1,100},{200012,0,1,100},{200013,0,1,100},{200015,0,1,100},{200016,0,1,100},{200017,0,1,100},{200019,0,1,100},{200020,0,1,1},{200021,0,1,2},{200022,0,1,2},{200023,0,1,2},{200025,0,1,2},{200026,0,1,2},{200027,0,1,2},{200029,0,1,2},{201010,0,1,100},{201011,0,1,100},{201012,0,1,100},{201013,0,1,100},{201015,0,1,100},{201016,0,1,100},{201017,0,1,100},{201019,0,1,100},{201020,0,1,1},{201021,0,1,2},{201022,0,1,2},{201023,0,1,2}, | AT31: 201023 | AU31: 法神戒指 | AV31: 1 | AW31: 0 | AX31: 1 | AY31: 3 | AZ31: ="{"&RC[-6]&","&RC[-3]&","&RC[-2]&","&RC[-1]&"}," -> {201023,0,1,3}, | BA31: =R[-1]C&RC[-1] -> {200010,0,1,80},{200011,0,1,80},{200012,0,1,80},{200013,0,1,80},{200015,0,1,80},{200016,0,1,80},{200017,0,1,80},{200019,0,1,80},{200020,0,1,1},{200021,0,1,3},{200022,0,1,3},{200023,0,1,3},{200025,0,1,3},{200026,0,1,3},{200027,0,1,3},{200029,0,1,3},{201010,0,1,80},{201011,0,1,80},{201012,0,1,80},{201013,0,1,80},{201015,0,1,80},{201016,0,1,80},{201017,0,1,80},{201019,0,1,80},{201020,0,1,1},{201021,0,1,3},{201022,0,1,3},{201023,0,1,3}, | BC31: 201023 | BD31: 法神戒指 | BE31: 1 | BF31: 0 | BG31: 1 | BH31: 5 | BI31: ="{"&RC[-6]&","&RC[-3]&","&RC[-2]&","&RC[-1]&"}," -> {201023,0,1,5}, | BJ31: =R[-1]C&RC[-1] -> {200010,0,1,60},{200011,0,1,60},{200012,0,1,60},{200013,0,1,60},{200015,0,1,60},{200016,0,1,60},{200017,0,1,60},{200019,0,1,60},{200020,0,1,1},{200021,0,1,5},{200022,0,1,5},{200023,0,1,5},{200025,0,1,5},{200026,0,1,5},{200027,0,1,5},{200029,0,1,5},{201010,0,1,60},{201011,0,1,60},{201012,0,1,60},{201013,0,1,60},{201015,0,1,60},{201016,0,1,60},{201017,0,1,60},{201019,0,1,60},{201020,0,1,1},{201021,0,1,5},{201022,0,1,5},{201023,0,1,5},
F32: 道具 | G32: 概率／100 | J32: 110004 | K32: 红药 | M32: 0 | N32: 1 | O32: 3 | P32: ="{"&RC[-6]&","&RC[-3]&","&RC[-2]&","&RC[-1]&"}," -> {110004,0,1,3}, | Q32: =R[-1]C&RC[-1] -> {110002,0,2,2},{110003,0,2,2},{110004,0,1,3}, | S32: 202002 | T32: 铂金戒指 | U32: 1 | V32: 0 | W32: 1 | X32: 40 | Y32: ="{"&RC[-6]&","&RC[-3]&","&RC[-2]&","&RC[-1]&"}," -> {202002,0,1,40}, | Z32: =R[-1]C&RC[-1] -> {200000,0,1,40},{200001,0,1,40},{200002,0,1,40},{200003,0,1,40},{200006,0,1,40},{200010,0,1,5},{200011,0,1,10},{200012,0,1,10},{200013,0,1,10},{200015,0,1,10},{200016,0,1,10},{200017,0,1,10},{200019,0,1,10},{201000,0,1,40},{201001,0,1,40},{201002,0,1,40},{201003,0,1,40},{201006,0,1,40},{201010,0,1,5},{201011,0,1,10},{201012,0,1,10},{201013,0,1,10},{201015,0,1,10},{201016,0,1,10},{201017,0,1,10},{201019,0,1,10},{202000,0,1,40},{202001,0,1,40},{202002,0,1,40}, | AB32: 202002 | AC32: 铂金戒指 | AD32: 1 | AE32: 0 | AF32: 1 | AG32: 40 | AH32: ="{"&RC[-6]&","&RC[-3]&","&RC[-2]&","&RC[-1]&"}," -> {202002,0,1,40}, | AI32: =R[-1]C&RC[-1] -> {200000,0,1,40},{200001,0,1,40},{200002,0,1,40},{200003,0,1,40},{200006,0,1,40},{200010,0,1,5},{200011,0,1,10},{200012,0,1,10},{200013,0,1,10},{200015,0,1,10},{200016,0,1,10},{200017,0,1,10},{200019,0,1,10},{201000,0,1,40},{201001,0,1,40},{201002,0,1,40},{201003,0,1,40},{201006,0,1,40},{201010,0,1,5},{201011,0,1,10},{201012,0,1,10},{201013,0,1,10},{201015,0,1,10},{201016,0,1,10},{201017,0,1,10},{201019,0,1,10},{202000,0,1,40},{202001,0,1,40},{202002,0,1,40}, | AK32: 201025 | AL32: 法神头盔 | AM32: 1 | AN32: 0 | AO32: 1 | AP32: 2 | AQ32: ="{"&RC[-6]&","&RC[-3]&","&RC[-2]&","&RC[-1]&"}," -> {201025,0,1,2}, | AR32: =R[-1]C&RC[-1] -> {200010,0,1,100},{200011,0,1,100},{200012,0,1,100},{200013,0,1,100},{200015,0,1,100},{200016,0,1,100},{200017,0,1,100},{200019,0,1,100},{200020,0,1,1},{200021,0,1,2},{200022,0,1,2},{200023,0,1,2},{200025,0,1,2},{200026,0,1,2},{200027,0,1,2},{200029,0,1,2},{201010,0,1,100},{201011,0,1,100},{201012,0,1,100},{201013,0,1,100},{201015,0,1,100},{201016,0,1,100},{201017,0,1,100},{201019,0,1,100},{201020,0,1,1},{201021,0,1,2},{201022,0,1,2},{201023,0,1,2},{201025,0,1,2}, | AT32: 201025 | AU32: 法神头盔 | AV32: 1 | AW32: 0 | AX32: 1 | AY32: 3 | AZ32: ="{"&RC[-6]&","&RC[-3]&","&RC[-2]&","&RC[-1]&"}," -> {201025,0,1,3}, | BA32: =R[-1]C&RC[-1] -> {200010,0,1,80},{200011,0,1,80},{200012,0,1,80},{200013,0,1,80},{200015,0,1,80},{200016,0,1,80},{200017,0,1,80},{200019,0,1,80},{200020,0,1,1},{200021,0,1,3},{200022,0,1,3},{200023,0,1,3},{200025,0,1,3},{200026,0,1,3},{200027,0,1,3},{200029,0,1,3},{201010,0,1,80},{201011,0,1,80},{201012,0,1,80},{201013,0,1,80},{201015,0,1,80},{201016,0,1,80},{201017,0,1,80},{201019,0,1,80},{201020,0,1,1},{201021,0,1,3},{201022,0,1,3},{201023,0,1,3},{201025,0,1,3}, | BC32: 201025 | BD32: 法神头盔 | BE32: 1 | BF32: 0 | BG32: 1 | BH32: 5 | BI32: ="{"&RC[-6]&","&RC[-3]&","&RC[-2]&","&RC[-1]&"}," -> {201025,0,1,5}, | BJ32: =R[-1]C&RC[-1] -> {200010,0,1,60},{200011,0,1,60},{200012,0,1,60},{200013,0,1,60},{200015,0,1,60},{200016,0,1,60},{200017,0,1,60},{200019,0,1,60},{200020,0,1,1},{200021,0,1,5},{200022,0,1,5},{200023,0,1,5},{200025,0,1,5},{200026,0,1,5},{200027,0,1,5},{200029,0,1,5},{201010,0,1,60},{201011,0,1,60},{201012,0,1,60},{201013,0,1,60},{201015,0,1,60},{201016,0,1,60},{201017,0,1,60},{201019,0,1,60},{201020,0,1,1},{201021,0,1,5},{201022,0,1,5},{201023,0,1,5},{201025,0,1,5},
F33: 2 | G33: 100 | H33: ="{0,[{"&RC[-2]&","&RC[-1]&"}],["&R[-6]C&"]}" -> {0,[{2,100}],[{110002,0,2,2},{110003,0,2,2},{110004,0,1,3},{110005,0,1,3},{110010,0,1,0},{110011,0,1,0},{110012,0,1,0}]} | J33: 110005 | K33: 蓝药 | M33: 0 | N33: 1 | O33: 3 | P33: ="{"&RC[-6]&","&RC[-3]&","&RC[-2]&","&RC[-1]&"}," -> {110005,0,1,3}, | Q33: =R[-1]C&RC[-1] -> {110002,0,2,2},{110003,0,2,2},{110004,0,1,3},{110005,0,1,3}, | S33: 202003 | T33: 三眼手镯 | U33: 1 | V33: 0 | W33: 1 | X33: 40 | Y33: ="{"&RC[-6]&","&RC[-3]&","&RC[-2]&","&RC[-1]&"}," -> {202003,0,1,40}, | Z33: =R[-1]C&RC[-1] -> {200000,0,1,40},{200001,0,1,40},{200002,0,1,40},{200003,0,1,40},{200006,0,1,40},{200010,0,1,5},{200011,0,1,10},{200012,0,1,10},{200013,0,1,10},{200015,0,1,10},{200016,0,1,10},{200017,0,1,10},{200019,0,1,10},{201000,0,1,40},{201001,0,1,40},{201002,0,1,40},{201003,0,1,40},{201006,0,1,40},{201010,0,1,5},{201011,0,1,10},{201012,0,1,10},{201013,0,1,10},{201015,0,1,10},{201016,0,1,10},{201017,0,1,10},{201019,0,1,10},{202000,0,1,40},{202001,0,1,40},{202002,0,1,40},{202003,0,1,40}, | AB33: 202003 | AC33: 三眼手镯 | AD33: 1 | AE33: 0 | AF33: 1 | AG33: 40 | AH33: ="{"&RC[-6]&","&RC[-3]&","&RC[-2]&","&RC[-1]&"}," -> {202003,0,1,40}, | AI33: =R[-1]C&RC[-1] -> {200000,0,1,40},{200001,0,1,40},{200002,0,1,40},{200003,0,1,40},{200006,0,1,40},{200010,0,1,5},{200011,0,1,10},{200012,0,1,10},{200013,0,1,10},{200015,0,1,10},{200016,0,1,10},{200017,0,1,10},{200019,0,1,10},{201000,0,1,40},{201001,0,1,40},{201002,0,1,40},{201003,0,1,40},{201006,0,1,40},{201010,0,1,5},{201011,0,1,10},{201012,0,1,10},{201013,0,1,10},{201015,0,1,10},{201016,0,1,10},{201017,0,1,10},{201019,0,1,10},{202000,0,1,40},{202001,0,1,40},{202002,0,1,40},{202003,0,1,40}, | AK33: 201026 | AL33: 法神手镯 | AM33: 1 | AN33: 0 | AO33: 1 | AP33: 2 | AQ33: ="{"&RC[-6]&","&RC[-3]&","&RC[-2]&","&RC[-1]&"}," -> {201026,0,1,2}, | AR33: =R[-1]C&RC[-1] -> {200010,0,1,100},{200011,0,1,100},{200012,0,1,100},{200013,0,1,100},{200015,0,1,100},{200016,0,1,100},{200017,0,1,100},{200019,0,1,100},{200020,0,1,1},{200021,0,1,2},{200022,0,1,2},{200023,0,1,2},{200025,0,1,2},{200026,0,1,2},{200027,0,1,2},{200029,0,1,2},{201010,0,1,100},{201011,0,1,100},{201012,0,1,100},{201013,0,1,100},{201015,0,1,100},{201016,0,1,100},{201017,0,1,100},{201019,0,1,100},{201020,0,1,1},{201021,0,1,2},{201022,0,1,2},{201023,0,1,2},{201025,0,1,2},{201026,0,1,2}, | AT33: 201026 | AU33: 法神手镯 | AV33: 1 | AW33: 0 | AX33: 1 | AY33: 3 | AZ33: ="{"&RC[-6]&","&RC[-3]&","&RC[-2]&","&RC[-1]&"}," -> {201026,0,1,3}, | BA33: =R[-1]C&RC[-1] -> {200010,0,1,80},{200011,0,1,80},{200012,0,1,80},{200013,0,1,80},{200015,0,1,80},{200016,0,1,80},{200017,0,1,80},{200019,0,1,80},{200020,0,1,1},{200021,0,1,3},{200022,0,1,3},{200023,0,1,3},{200025,0,1,3},{200026,0,1,3},{200027,0,1,3},{200029,0,1,3},{201010,0,1,80},{201011,0,1,80},{201012,0,1,80},{201013,0,1,80},{201015,0,1,80},{201016,0,1,80},{201017,0,1,80},{201019,0,1,80},{201020,0,1,1},{201021,0,1,3},{201022,0,1,3},{201023,0,1,3},{201025,0,1,3},{201026,0,1,3}, | BC33: 201026 | BD33: 法神手镯 | BE33: 1 | BF33: 0 | BG33: 1 | BH33: 5 | BI33: ="{"&RC[-6]&","&RC[-3]&","&RC[-2]&","&RC[-1]&"}," -> {201026,0,1,5}, | BJ33: =R[-1]C&RC[-1] -> {200010,0,1,60},{200011,0,1,60},{200012,0,1,60},{200013,0,1,60},{200015,0,1,60},{200016,0,1,60},{200017,0,1,60},{200019,0,1,60},{200020,0,1,1},{200021,0,1,5},{200022,0,1,5},{200023,0,1,5},{200025,0,1,5},{200026,0,1,5},{200027,0,1,5},{200029,0,1,5},{201010,0,1,60},{201011,0,1,60},{201012,0,1,60},{201013,0,1,60},{201015,0,1,60},{201016,0,1,60},{201017,0,1,60},{201019,0,1,60},{201020,0,1,1},{201021,0,1,5},{201022,0,1,5},{201023,0,1,5},{201025,0,1,5},{201026,0,1,5},
F34: 金币 | G34: 概率／100 | J34: 110010 | K34: 普通武装碎片 | M34: 0 | N34: 1 | O34: 0 | P34: ="{"&RC[-6]&","&RC[-3]&","&RC[-2]&","&RC[-1]&"}," -> {110010,0,1,0}, | Q34: =R[-1]C&RC[-1] -> {110002,0,2,2},{110003,0,2,2},{110004,0,1,3},{110005,0,1,3},{110010,0,1,0}, | S34: 202006 | T34: 凤凰明珠 | U34: 1 | V34: 0 | W34: 1 | X34: 40 | Y34: ="{"&RC[-6]&","&RC[-3]&","&RC[-2]&","&RC[-1]&"}," -> {202006,0,1,40}, | Z34: =R[-1]C&RC[-1] -> {200000,0,1,40},{200001,0,1,40},{200002,0,1,40},{200003,0,1,40},{200006,0,1,40},{200010,0,1,5},{200011,0,1,10},{200012,0,1,10},{200013,0,1,10},{200015,0,1,10},{200016,0,1,10},{200017,0,1,10},{200019,0,1,10},{201000,0,1,40},{201001,0,1,40},{201002,0,1,40},{201003,0,1,40},{201006,0,1,40},{201010,0,1,5},{201011,0,1,10},{201012,0,1,10},{201013,0,1,10},{201015,0,1,10},{201016,0,1,10},{201017,0,1,10},{201019,0,1,10},{202000,0,1,40},{202001,0,1,40},{202002,0,1,40},{202003,0,1,40},{202006,0,1,40}, | AB34: 202006 | AC34: 凤凰明珠 | AD34: 1 | AE34: 0 | AF34: 1 | AG34: 40 | AH34: ="{"&RC[-6]&","&RC[-3]&","&RC[-2]&","&RC[-1]&"}," -> {202006,0,1,40}, | AI34: =R[-1]C&RC[-1] -> {200000,0,1,40},{200001,0,1,40},{200002,0,1,40},{200003,0,1,40},{200006,0,1,40},{200010,0,1,5},{200011,0,1,10},{200012,0,1,10},{200013,0,1,10},{200015,0,1,10},{200016,0,1,10},{200017,0,1,10},{200019,0,1,10},{201000,0,1,40},{201001,0,1,40},{201002,0,1,40},{201003,0,1,40},{201006,0,1,40},{201010,0,1,5},{201011,0,1,10},{201012,0,1,10},{201013,0,1,10},{201015,0,1,10},{201016,0,1,10},{201017,0,1,10},{201019,0,1,10},{202000,0,1,40},{202001,0,1,40},{202002,0,1,40},{202003,0,1,40},{202006,0,1,40}, | AK34: 201027 | AL34: 法神腰带 | AM34: 1 | AN34: 0 | AO34: 1 | AP34: 2 | AQ34: ="{"&RC[-6]&","&RC[-3]&","&RC[-2]&","&RC[-1]&"}," -> {201027,0,1,2}, | AR34: =R[-1]C&RC[-1] -> {200010,0,1,100},{200011,0,1,100},{200012,0,1,100},{200013,0,1,100},{200015,0,1,100},{200016,0,1,100},{200017,0,1,100},{200019,0,1,100},{200020,0,1,1},{200021,0,1,2},{200022,0,1,2},{200023,0,1,2},{200025,0,1,2},{200026,0,1,2},{200027,0,1,2},{200029,0,1,2},{201010,0,1,100},{201011,0,1,100},{201012,0,1,100},{201013,0,1,100},{201015,0,1,100},{201016,0,1,100},{201017,0,1,100},{201019,0,1,100},{201020,0,1,1},{201021,0,1,2},{201022,0,1,2},{201023,0,1,2},{201025,0,1,2},{201026,0,1,2},{201027,0,1,2}, | AT34: 201027 | AU34: 法神腰带 | AV34: 1 | AW34: 0 | AX34: 1 | AY34: 3 | AZ34: ="{"&RC[-6]&","&RC[-3]&","&RC[-2]&","&RC[-1]&"}," -> {201027,0,1,3}, | BA34: =R[-1]C&RC[-1] -> {200010,0,1,80},{200011,0,1,80},{200012,0,1,80},{200013,0,1,80},{200015,0,1,80},{200016,0,1,80},{200017,0,1,80},{200019,0,1,80},{200020,0,1,1},{200021,0,1,3},{200022,0,1,3},{200023,0,1,3},{200025,0,1,3},{200026,0,1,3},{200027,0,1,3},{200029,0,1,3},{201010,0,1,80},{201011,0,1,80},{201012,0,1,80},{201013,0,1,80},{201015,0,1,80},{201016,0,1,80},{201017,0,1,80},{201019,0,1,80},{201020,0,1,1},{201021,0,1,3},{201022,0,1,3},{201023,0,1,3},{201025,0,1,3},{201026,0,1,3},{201027,0,1,3}, | BC34: 201027 | BD34: 法神腰带 | BE34: 1 | BF34: 0 | BG34: 1 | BH34: 5 | BI34: ="{"&RC[-6]&","&RC[-3]&","&RC[-2]&","&RC[-1]&"}," -> {201027,0,1,5}, | BJ34: =R[-1]C&RC[-1] -> {200010,0,1,60},{200011,0,1,60},{200012,0,1,60},{200013,0,1,60},{200015,0,1,60},{200016,0,1,60},{200017,0,1,60},{200019,0,1,60},{200020,0,1,1},{200021,0,1,5},{200022,0,1,5},{200023,0,1,5},{200025,0,1,5},{200026,0,1,5},{200027,0,1,5},{200029,0,1,5},{201010,0,1,60},{201011,0,1,60},{201012,0,1,60},{201013,0,1,60},{201015,0,1,60},{201016,0,1,60},{201017,0,1,60},{201019,0,1,60},{201020,0,1,1},{201021,0,1,5},{201022,0,1,5},{201023,0,1,5},{201025,0,1,5},{201026,0,1,5},{201027,0,1,5},
F35: 3 | G35: 100 | H35: {0,[{10,100}],[{110009,1,1000,1}]} | J35: 110011 | K35: 普通防具碎片 | M35: 0 | N35: 1 | O35: 0 | P35: ="{"&RC[-6]&","&RC[-3]&","&RC[-2]&","&RC[-1]&"}," -> {110011,0,1,0}, | Q35: =R[-1]C&RC[-1] -> {110002,0,2,2},{110003,0,2,2},{110004,0,1,3},{110005,0,1,3},{110010,0,1,0},{110011,0,1,0}, | S35: 202010 | T35: 银蛇 | U35: 1 | V35: 0 | W35: 1 | X35: 5 | Y35: ="{"&RC[-6]&","&RC[-3]&","&RC[-2]&","&RC[-1]&"}," -> {202010,0,1,5}, | Z35: =R[-1]C&RC[-1] -> {200000,0,1,40},{200001,0,1,40},{200002,0,1,40},{200003,0,1,40},{200006,0,1,40},{200010,0,1,5},{200011,0,1,10},{200012,0,1,10},{200013,0,1,10},{200015,0,1,10},{200016,0,1,10},{200017,0,1,10},{200019,0,1,10},{201000,0,1,40},{201001,0,1,40},{201002,0,1,40},{201003,0,1,40},{201006,0,1,40},{201010,0,1,5},{201011,0,1,10},{201012,0,1,10},{201013,0,1,10},{201015,0,1,10},{201016,0,1,10},{201017,0,1,10},{201019,0,1,10},{202000,0,1,40},{202001,0,1,40},{202002,0,1,40},{202003,0,1,40},{202006,0,1,40},{202010,0,1,5}, | AB35: 202010 | AC35: 银蛇 | AD35: 1 | AE35: 0 | AF35: 1 | AG35: 5 | AH35: ="{"&RC[-6]&","&RC[-3]&","&RC[-2]&","&RC[-1]&"}," -> {202010,0,1,5}, | AI35: =R[-1]C&RC[-1] -> {200000,0,1,40},{200001,0,1,40},{200002,0,1,40},{200003,0,1,40},{200006,0,1,40},{200010,0,1,5},{200011,0,1,10},{200012,0,1,10},{200013,0,1,10},{200015,0,1,10},{200016,0,1,10},{200017,0,1,10},{200019,0,1,10},{201000,0,1,40},{201001,0,1,40},{201002,0,1,40},{201003,0,1,40},{201006,0,1,40},{201010,0,1,5},{201011,0,1,10},{201012,0,1,10},{201013,0,1,10},{201015,0,1,10},{201016,0,1,10},{201017,0,1,10},{201019,0,1,10},{202000,0,1,40},{202001,0,1,40},{202002,0,1,40},{202003,0,1,40},{202006,0,1,40},{202010,0,1,5}, | AK35: 201029 | AL35: 法神鞋子 | AM35: 1 | AN35: 0 | AO35: 1 | AP35: 2 | AQ35: ="{"&RC[-6]&","&RC[-3]&","&RC[-2]&","&RC[-1]&"}," -> {201029,0,1,2}, | AR35: =R[-1]C&RC[-1] -> {200010,0,1,100},{200011,0,1,100},{200012,0,1,100},{200013,0,1,100},{200015,0,1,100},{200016,0,1,100},{200017,0,1,100},{200019,0,1,100},{200020,0,1,1},{200021,0,1,2},{200022,0,1,2},{200023,0,1,2},{200025,0,1,2},{200026,0,1,2},{200027,0,1,2},{200029,0,1,2},{201010,0,1,100},{201011,0,1,100},{201012,0,1,100},{201013,0,1,100},{201015,0,1,100},{201016,0,1,100},{201017,0,1,100},{201019,0,1,100},{201020,0,1,1},{201021,0,1,2},{201022,0,1,2},{201023,0,1,2},{201025,0,1,2},{201026,0,1,2},{201027,0,1,2},{201029,0,1,2}, | AT35: 201029 | AU35: 法神鞋子 | AV35: 1 | AW35: 0 | AX35: 1 | AY35: 3 | AZ35: ="{"&RC[-6]&","&RC[-3]&","&RC[-2]&","&RC[-1]&"}," -> {201029,0,1,3}, | BA35: =R[-1]C&RC[-1] -> {200010,0,1,80},{200011,0,1,80},{200012,0,1,80},{200013,0,1,80},{200015,0,1,80},{200016,0,1,80},{200017,0,1,80},{200019,0,1,80},{200020,0,1,1},{200021,0,1,3},{200022,0,1,3},{200023,0,1,3},{200025,0,1,3},{200026,0,1,3},{200027,0,1,3},{200029,0,1,3},{201010,0,1,80},{201011,0,1,80},{201012,0,1,80},{201013,0,1,80},{201015,0,1,80},{201016,0,1,80},{201017,0,1,80},{201019,0,1,80},{201020,0,1,1},{201021,0,1,3},{201022,0,1,3},{201023,0,1,3},{201025,0,1,3},{201026,0,1,3},{201027,0,1,3},{201029,0,1,3}, | BC35: 201029 | BD35: 法神鞋子 | BE35: 1 | BF35: 0 | BG35: 1 | BH35: 5 | BI35: ="{"&RC[-6]&","&RC[-3]&","&RC[-2]&","&RC[-1]&"}," -> {201029,0,1,5}, | BJ35: =R[-1]C&RC[-1] -> {200010,0,1,60},{200011,0,1,60},{200012,0,1,60},{200013,0,1,60},{200015,0,1,60},{200016,0,1,60},{200017,0,1,60},{200019,0,1,60},{200020,0,1,1},{200021,0,1,5},{200022,0,1,5},{200023,0,1,5},{200025,0,1,5},{200026,0,1,5},{200027,0,1,5},{200029,0,1,5},{201010,0,1,60},{201011,0,1,60},{201012,0,1,60},{201013,0,1,60},{201015,0,1,60},{201016,0,1,60},{201017,0,1,60},{201019,0,1,60},{201020,0,1,1},{201021,0,1,5},{201022,0,1,5},{201023,0,1,5},{201025,0,1,5},{201026,0,1,5},{201027,0,1,5},{201029,0,1,5},
J36: 110012 | K36: 普通首饰碎片 | M36: 0 | N36: 1 | O36: 0 | P36: ="{"&RC[-6]&","&RC[-3]&","&RC[-2]&","&RC[-1]&"}" -> {110012,0,1,0} | Q36: =R[-1]C&RC[-1] -> {110002,0,2,2},{110003,0,2,2},{110004,0,1,3},{110005,0,1,3},{110010,0,1,0},{110011,0,1,0},{110012,0,1,0} | S36: 202011 | T36: 天珠道链 | U36: 1 | V36: 0 | W36: 1 | X36: 10 | Y36: ="{"&RC[-6]&","&RC[-3]&","&RC[-2]&","&RC[-1]&"}," -> {202011,0,1,10}, | Z36: =R[-1]C&RC[-1] -> {200000,0,1,40},{200001,0,1,40},{200002,0,1,40},{200003,0,1,40},{200006,0,1,40},{200010,0,1,5},{200011,0,1,10},{200012,0,1,10},{200013,0,1,10},{200015,0,1,10},{200016,0,1,10},{200017,0,1,10},{200019,0,1,10},{201000,0,1,40},{201001,0,1,40},{201002,0,1,40},{201003,0,1,40},{201006,0,1,40},{201010,0,1,5},{201011,0,1,10},{201012,0,1,10},{201013,0,1,10},{201015,0,1,10},{201016,0,1,10},{201017,0,1,10},{201019,0,1,10},{202000,0,1,40},{202001,0,1,40},{202002,0,1,40},{202003,0,1,40},{202006,0,1,40},{202010,0,1,5},{202011,0,1,10}, | AB36: 202011 | AC36: 天珠道链 | AD36: 1 | AE36: 0 | AF36: 1 | AG36: 10 | AH36: ="{"&RC[-6]&","&RC[-3]&","&RC[-2]&","&RC[-1]&"}," -> {202011,0,1,10}, | AI36: =R[-1]C&RC[-1] -> {200000,0,1,40},{200001,0,1,40},{200002,0,1,40},{200003,0,1,40},{200006,0,1,40},{200010,0,1,5},{200011,0,1,10},{200012,0,1,10},{200013,0,1,10},{200015,0,1,10},{200016,0,1,10},{200017,0,1,10},{200019,0,1,10},{201000,0,1,40},{201001,0,1,40},{201002,0,1,40},{201003,0,1,40},{201006,0,1,40},{201010,0,1,5},{201011,0,1,10},{201012,0,1,10},{201013,0,1,10},{201015,0,1,10},{201016,0,1,10},{201017,0,1,10},{201019,0,1,10},{202000,0,1,40},{202001,0,1,40},{202002,0,1,40},{202003,0,1,40},{202006,0,1,40},{202010,0,1,5},{202011,0,1,10}, | AK36: 202010 | AL36: 银蛇 | AM36: 1 | AN36: 0 | AO36: 1 | AP36: 100 | AQ36: ="{"&RC[-6]&","&RC[-3]&","&RC[-2]&","&RC[-1]&"}," -> {202010,0,1,100}, | AR36: =R[-1]C&RC[-1] -> {200010,0,1,100},{200011,0,1,100},{200012,0,1,100},{200013,0,1,100},{200015,0,1,100},{200016,0,1,100},{200017,0,1,100},{200019,0,1,100},{200020,0,1,1},{200021,0,1,2},{200022,0,1,2},{200023,0,1,2},{200025,0,1,2},{200026,0,1,2},{200027,0,1,2},{200029,0,1,2},{201010,0,1,100},{201011,0,1,100},{201012,0,1,100},{201013,0,1,100},{201015,0,1,100},{201016,0,1,100},{201017,0,1,100},{201019,0,1,100},{201020,0,1,1},{201021,0,1,2},{201022,0,1,2},{201023,0,1,2},{201025,0,1,2},{201026,0,1,2},{201027,0,1,2},{201029,0,1,2},{202010,0,1,100}, | AT36: 202010 | AU36: 银蛇 | AV36: 1 | AW36: 0 | AX36: 1 | AY36: 80 | AZ36: ="{"&RC[-6]&","&RC[-3]&","&RC[-2]&","&RC[-1]&"}," -> {202010,0,1,80}, | BA36: =R[-1]C&RC[-1] -> {200010,0,1,80},{200011,0,1,80},{200012,0,1,80},{200013,0,1,80},{200015,0,1,80},{200016,0,1,80},{200017,0,1,80},{200019,0,1,80},{200020,0,1,1},{200021,0,1,3},{200022,0,1,3},{200023,0,1,3},{200025,0,1,3},{200026,0,1,3},{200027,0,1,3},{200029,0,1,3},{201010,0,1,80},{201011,0,1,80},{201012,0,1,80},{201013,0,1,80},{201015,0,1,80},{201016,0,1,80},{201017,0,1,80},{201019,0,1,80},{201020,0,1,1},{201021,0,1,3},{201022,0,1,3},{201023,0,1,3},{201025,0,1,3},{201026,0,1,3},{201027,0,1,3},{201029,0,1,3},{202010,0,1,80}, | BC36: 202010 | BD36: 银蛇 | BE36: 1 | BF36: 0 | BG36: 1 | BH36: 60 | BI36: ="{"&RC[-6]&","&RC[-3]&","&RC[-2]&","&RC[-1]&"}," -> {202010,0,1,60}, | BJ36: =R[-1]C&RC[-1] -> {200010,0,1,60},{200011,0,1,60},{200012,0,1,60},{200013,0,1,60},{200015,0,1,60},{200016,0,1,60},{200017,0,1,60},{200019,0,1,60},{200020,0,1,1},{200021,0,1,5},{200022,0,1,5},{200023,0,1,5},{200025,0,1,5},{200026,0,1,5},{200027,0,1,5},{200029,0,1,5},{201010,0,1,60},{201011,0,1,60},{201012,0,1,60},{201013,0,1,60},{201015,0,1,60},{201016,0,1,60},{201017,0,1,60},{201019,0,1,60},{201020,0,1,1},{201021,0,1,5},{201022,0,1,5},{201023,0,1,5},{201025,0,1,5},{201026,0,1,5},{201027,0,1,5},{201029,0,1,5},{202010,0,1,60},
H37: ="["&R[-6]C&","&R[-4]C&","&R[-2]C&"]" -> [{0,[{3,100}],[{200000,0,1,100},{200001,0,1,100},{200002,0,1,100},{200003,0,1,100},{200006,0,1,100},{201000,0,1,100},{201001,0,1,100},{201002,0,1,100},{201003,0,1,100},{201006,0,1,100},{202000,0,1,100},{202001,0,1,100},{202002,0,1,100},{202003,0,1,100},{202006,0,1,100}]},{0,[{2,100}],[{110002,0,2,2},{110003,0,2,2},{110004,0,1,3},{110005,0,1,3},{110010,0,1,0},{110011,0,1,0},{110012,0,1,0}]},{0,[{10,100}],[{110009,1,1000,1}]}] | S37: 202012 | T37: 灵魂道袍 | U37: 1 | V37: 0 | W37: 1 | X37: 10 | Y37: ="{"&RC[-6]&","&RC[-3]&","&RC[-2]&","&RC[-1]&"}," -> {202012,0,1,10}, | Z37: =R[-1]C&RC[-1] -> {200000,0,1,40},{200001,0,1,40},{200002,0,1,40},{200003,0,1,40},{200006,0,1,40},{200010,0,1,5},{200011,0,1,10},{200012,0,1,10},{200013,0,1,10},{200015,0,1,10},{200016,0,1,10},{200017,0,1,10},{200019,0,1,10},{201000,0,1,40},{201001,0,1,40},{201002,0,1,40},{201003,0,1,40},{201006,0,1,40},{201010,0,1,5},{201011,0,1,10},{201012,0,1,10},{201013,0,1,10},{201015,0,1,10},{201016,0,1,10},{201017,0,1,10},{201019,0,1,10},{202000,0,1,40},{202001,0,1,40},{202002,0,1,40},{202003,0,1,40},{202006,0,1,40},{202010,0,1,5},{202011,0,1,10},{202012,0,1,10}, | AB37: 202012 | AC37: 灵魂道袍 | AD37: 1 | AE37: 0 | AF37: 1 | AG37: 10 | AH37: ="{"&RC[-6]&","&RC[-3]&","&RC[-2]&","&RC[-1]&"}," -> {202012,0,1,10}, | AI37: =R[-1]C&RC[-1] -> {200000,0,1,40},{200001,0,1,40},{200002,0,1,40},{200003,0,1,40},{200006,0,1,40},{200010,0,1,5},{200011,0,1,10},{200012,0,1,10},{200013,0,1,10},{200015,0,1,10},{200016,0,1,10},{200017,0,1,10},{200019,0,1,10},{201000,0,1,40},{201001,0,1,40},{201002,0,1,40},{201003,0,1,40},{201006,0,1,40},{201010,0,1,5},{201011,0,1,10},{201012,0,1,10},{201013,0,1,10},{201015,0,1,10},{201016,0,1,10},{201017,0,1,10},{201019,0,1,10},{202000,0,1,40},{202001,0,1,40},{202002,0,1,40},{202003,0,1,40},{202006,0,1,40},{202010,0,1,5},{202011,0,1,10},{202012,0,1,10}, | AK37: 202011 | AL37: 天珠道链 | AM37: 1 | AN37: 0 | AO37: 1 | AP37: 100 | AQ37: ="{"&RC[-6]&","&RC[-3]&","&RC[-2]&","&RC[-1]&"}," -> {202011,0,1,100}, | AR37: =R[-1]C&RC[-1] -> {200010,0,1,100},{200011,0,1,100},{200012,0,1,100},{200013,0,1,100},{200015,0,1,100},{200016,0,1,100},{200017,0,1,100},{200019,0,1,100},{200020,0,1,1},{200021,0,1,2},{200022,0,1,2},{200023,0,1,2},{200025,0,1,2},{200026,0,1,2},{200027,0,1,2},{200029,0,1,2},{201010,0,1,100},{201011,0,1,100},{201012,0,1,100},{201013,0,1,100},{201015,0,1,100},{201016,0,1,100},{201017,0,1,100},{201019,0,1,100},{201020,0,1,1},{201021,0,1,2},{201022,0,1,2},{201023,0,1,2},{201025,0,1,2},{201026,0,1,2},{201027,0,1,2},{201029,0,1,2},{202010,0,1,100},{202011,0,1,100}, | AT37: 202011 | AU37: 天珠道链 | AV37: 1 | AW37: 0 | AX37: 1 | AY37: 80 | AZ37: ="{"&RC[-6]&","&RC[-3]&","&RC[-2]&","&RC[-1]&"}," -> {202011,0,1,80}, | BA37: =R[-1]C&RC[-1] -> {200010,0,1,80},{200011,0,1,80},{200012,0,1,80},{200013,0,1,80},{200015,0,1,80},{200016,0,1,80},{200017,0,1,80},{200019,0,1,80},{200020,0,1,1},{200021,0,1,3},{200022,0,1,3},{200023,0,1,3},{200025,0,1,3},{200026,0,1,3},{200027,0,1,3},{200029,0,1,3},{201010,0,1,80},{201011,0,1,80},{201012,0,1,80},{201013,0,1,80},{201015,0,1,80},{201016,0,1,80},{201017,0,1,80},{201019,0,1,80},{201020,0,1,1},{201021,0,1,3},{201022,0,1,3},{201023,0,1,3},{201025,0,1,3},{201026,0,1,3},{201027,0,1,3},{201029,0,1,3},{202010,0,1,80},{202011,0,1,80}, | BC37: 202011 | BD37: 天珠道链 | BE37: 1 | BF37: 0 | BG37: 1 | BH37: 60 | BI37: ="{"&RC[-6]&","&RC[-3]&","&RC[-2]&","&RC[-1]&"}," -> {202011,0,1,60}, | BJ37: =R[-1]C&RC[-1] -> {200010,0,1,60},{200011,0,1,60},{200012,0,1,60},{200013,0,1,60},{200015,0,1,60},{200016,0,1,60},{200017,0,1,60},{200019,0,1,60},{200020,0,1,1},{200021,0,1,5},{200022,0,1,5},{200023,0,1,5},{200025,0,1,5},{200026,0,1,5},{200027,0,1,5},{200029,0,1,5},{201010,0,1,60},{201011,0,1,60},{201012,0,1,60},{201013,0,1,60},{201015,0,1,60},{201016,0,1,60},{201017,0,1,60},{201019,0,1,60},{201020,0,1,1},{201021,0,1,5},{201022,0,1,5},{201023,0,1,5},{201025,0,1,5},{201026,0,1,5},{201027,0,1,5},{201029,0,1,5},{202010,0,1,60},{202011,0,1,60},
S38: 202013 | T38: 泰坦戒指 | U38: 1 | V38: 0 | W38: 1 | X38: 10 | Y38: ="{"&RC[-6]&","&RC[-3]&","&RC[-2]&","&RC[-1]&"}," -> {202013,0,1,10}, | Z38: =R[-1]C&RC[-1] -> {200000,0,1,40},{200001,0,1,40},{200002,0,1,40},{200003,0,1,40},{200006,0,1,40},{200010,0,1,5},{200011,0,1,10},{200012,0,1,10},{200013,0,1,10},{200015,0,1,10},{200016,0,1,10},{200017,0,1,10},{200019,0,1,10},{201000,0,1,40},{201001,0,1,40},{201002,0,1,40},{201003,0,1,40},{201006,0,1,40},{201010,0,1,5},{201011,0,1,10},{201012,0,1,10},{201013,0,1,10},{201015,0,1,10},{201016,0,1,10},{201017,0,1,10},{201019,0,1,10},{202000,0,1,40},{202001,0,1,40},{202002,0,1,40},{202003,0,1,40},{202006,0,1,40},{202010,0,1,5},{202011,0,1,10},{202012,0,1,10},{202013,0,1,10}, | AB38: 202013 | AC38: 泰坦戒指 | AD38: 1 | AE38: 0 | AF38: 1 | AG38: 10 | AH38: ="{"&RC[-6]&","&RC[-3]&","&RC[-2]&","&RC[-1]&"}," -> {202013,0,1,10}, | AI38: =R[-1]C&RC[-1] -> {200000,0,1,40},{200001,0,1,40},{200002,0,1,40},{200003,0,1,40},{200006,0,1,40},{200010,0,1,5},{200011,0,1,10},{200012,0,1,10},{200013,0,1,10},{200015,0,1,10},{200016,0,1,10},{200017,0,1,10},{200019,0,1,10},{201000,0,1,40},{201001,0,1,40},{201002,0,1,40},{201003,0,1,40},{201006,0,1,40},{201010,0,1,5},{201011,0,1,10},{201012,0,1,10},{201013,0,1,10},{201015,0,1,10},{201016,0,1,10},{201017,0,1,10},{201019,0,1,10},{202000,0,1,40},{202001,0,1,40},{202002,0,1,40},{202003,0,1,40},{202006,0,1,40},{202010,0,1,5},{202011,0,1,10},{202012,0,1,10},{202013,0,1,10}, | AK38: 202012 | AL38: 灵魂道袍 | AM38: 1 | AN38: 0 | AO38: 1 | AP38: 100 | AQ38: ="{"&RC[-6]&","&RC[-3]&","&RC[-2]&","&RC[-1]&"}," -> {202012,0,1,100}, | AR38: =R[-1]C&RC[-1] -> {200010,0,1,100},{200011,0,1,100},{200012,0,1,100},{200013,0,1,100},{200015,0,1,100},{200016,0,1,100},{200017,0,1,100},{200019,0,1,100},{200020,0,1,1},{200021,0,1,2},{200022,0,1,2},{200023,0,1,2},{200025,0,1,2},{200026,0,1,2},{200027,0,1,2},{200029,0,1,2},{201010,0,1,100},{201011,0,1,100},{201012,0,1,100},{201013,0,1,100},{201015,0,1,100},{201016,0,1,100},{201017,0,1,100},{201019,0,1,100},{201020,0,1,1},{201021,0,1,2},{201022,0,1,2},{201023,0,1,2},{201025,0,1,2},{201026,0,1,2},{201027,0,1,2},{201029,0,1,2},{202010,0,1,100},{202011,0,1,100},{202012,0,1,100}, | AT38: 202012 | AU38: 灵魂道袍 | AV38: 1 | AW38: 0 | AX38: 1 | AY38: 80 | AZ38: ="{"&RC[-6]&","&RC[-3]&","&RC[-2]&","&RC[-1]&"}," -> {202012,0,1,80}, | BA38: =R[-1]C&RC[-1] -> {200010,0,1,80},{200011,0,1,80},{200012,0,1,80},{200013,0,1,80},{200015,0,1,80},{200016,0,1,80},{200017,0,1,80},{200019,0,1,80},{200020,0,1,1},{200021,0,1,3},{200022,0,1,3},{200023,0,1,3},{200025,0,1,3},{200026,0,1,3},{200027,0,1,3},{200029,0,1,3},{201010,0,1,80},{201011,0,1,80},{201012,0,1,80},{201013,0,1,80},{201015,0,1,80},{201016,0,1,80},{201017,0,1,80},{201019,0,1,80},{201020,0,1,1},{201021,0,1,3},{201022,0,1,3},{201023,0,1,3},{201025,0,1,3},{201026,0,1,3},{201027,0,1,3},{201029,0,1,3},{202010,0,1,80},{202011,0,1,80},{202012,0,1,80}, | BC38: 202012 | BD38: 灵魂道袍 | BE38: 1 | BF38: 0 | BG38: 1 | BH38: 60 | BI38: ="{"&RC[-6]&","&RC[-3]&","&RC[-2]&","&RC[-1]&"}," -> {202012,0,1,60}, | BJ38: =R[-1]C&RC[-1] -> {200010,0,1,60},{200011,0,1,60},{200012,0,1,60},{200013,0,1,60},{200015,0,1,60},{200016,0,1,60},{200017,0,1,60},{200019,0,1,60},{200020,0,1,1},{200021,0,1,5},{200022,0,1,5},{200023,0,1,5},{200025,0,1,5},{200026,0,1,5},{200027,0,1,5},{200029,0,1,5},{201010,0,1,60},{201011,0,1,60},{201012,0,1,60},{201013,0,1,60},{201015,0,1,60},{201016,0,1,60},{201017,0,1,60},{201019,0,1,60},{201020,0,1,1},{201021,0,1,5},{201022,0,1,5},{201023,0,1,5},{201025,0,1,5},{201026,0,1,5},{201027,0,1,5},{201029,0,1,5},{202010,0,1,60},{202011,0,1,60},{202012,0,1,60},
J39: BOSS怪掉落 | O39: 装备 | P39: 概率／100 | S39: 202015 | T39: 道士头盔 | U39: 1 | V39: 0 | W39: 1 | X39: 10 | Y39: ="{"&RC[-6]&","&RC[-3]&","&RC[-2]&","&RC[-1]&"}," -> {202015,0,1,10}, | Z39: =R[-1]C&RC[-1] -> {200000,0,1,40},{200001,0,1,40},{200002,0,1,40},{200003,0,1,40},{200006,0,1,40},{200010,0,1,5},{200011,0,1,10},{200012,0,1,10},{200013,0,1,10},{200015,0,1,10},{200016,0,1,10},{200017,0,1,10},{200019,0,1,10},{201000,0,1,40},{201001,0,1,40},{201002,0,1,40},{201003,0,1,40},{201006,0,1,40},{201010,0,1,5},{201011,0,1,10},{201012,0,1,10},{201013,0,1,10},{201015,0,1,10},{201016,0,1,10},{201017,0,1,10},{201019,0,1,10},{202000,0,1,40},{202001,0,1,40},{202002,0,1,40},{202003,0,1,40},{202006,0,1,40},{202010,0,1,5},{202011,0,1,10},{202012,0,1,10},{202013,0,1,10},{202015,0,1,10}, | AB39: 202015 | AC39: 道士头盔 | AD39: 1 | AE39: 0 | AF39: 1 | AG39: 10 | AH39: ="{"&RC[-6]&","&RC[-3]&","&RC[-2]&","&RC[-1]&"}," -> {202015,0,1,10}, | AI39: =R[-1]C&RC[-1] -> {200000,0,1,40},{200001,0,1,40},{200002,0,1,40},{200003,0,1,40},{200006,0,1,40},{200010,0,1,5},{200011,0,1,10},{200012,0,1,10},{200013,0,1,10},{200015,0,1,10},{200016,0,1,10},{200017,0,1,10},{200019,0,1,10},{201000,0,1,40},{201001,0,1,40},{201002,0,1,40},{201003,0,1,40},{201006,0,1,40},{201010,0,1,5},{201011,0,1,10},{201012,0,1,10},{201013,0,1,10},{201015,0,1,10},{201016,0,1,10},{201017,0,1,10},{201019,0,1,10},{202000,0,1,40},{202001,0,1,40},{202002,0,1,40},{202003,0,1,40},{202006,0,1,40},{202010,0,1,5},{202011,0,1,10},{202012,0,1,10},{202013,0,1,10},{202015,0,1,10}, | AK39: 202013 | AL39: 泰坦戒指 | AM39: 1 | AN39: 0 | AO39: 1 | AP39: 100 | AQ39: ="{"&RC[-6]&","&RC[-3]&","&RC[-2]&","&RC[-1]&"}," -> {202013,0,1,100}, | AR39: =R[-1]C&RC[-1] -> {200010,0,1,100},{200011,0,1,100},{200012,0,1,100},{200013,0,1,100},{200015,0,1,100},{200016,0,1,100},{200017,0,1,100},{200019,0,1,100},{200020,0,1,1},{200021,0,1,2},{200022,0,1,2},{200023,0,1,2},{200025,0,1,2},{200026,0,1,2},{200027,0,1,2},{200029,0,1,2},{201010,0,1,100},{201011,0,1,100},{201012,0,1,100},{201013,0,1,100},{201015,0,1,100},{201016,0,1,100},{201017,0,1,100},{201019,0,1,100},{201020,0,1,1},{201021,0,1,2},{201022,0,1,2},{201023,0,1,2},{201025,0,1,2},{201026,0,1,2},{201027,0,1,2},{201029,0,1,2},{202010,0,1,100},{202011,0,1,100},{202012,0,1,100},{202013,0,1,100}, | AT39: 202013 | AU39: 泰坦戒指 | AV39: 1 | AW39: 0 | AX39: 1 | AY39: 80 | AZ39: ="{"&RC[-6]&","&RC[-3]&","&RC[-2]&","&RC[-1]&"}," -> {202013,0,1,80}, | BA39: =R[-1]C&RC[-1] -> {200010,0,1,80},{200011,0,1,80},{200012,0,1,80},{200013,0,1,80},{200015,0,1,80},{200016,0,1,80},{200017,0,1,80},{200019,0,1,80},{200020,0,1,1},{200021,0,1,3},{200022,0,1,3},{200023,0,1,3},{200025,0,1,3},{200026,0,1,3},{200027,0,1,3},{200029,0,1,3},{201010,0,1,80},{201011,0,1,80},{201012,0,1,80},{201013,0,1,80},{201015,0,1,80},{201016,0,1,80},{201017,0,1,80},{201019,0,1,80},{201020,0,1,1},{201021,0,1,3},{201022,0,1,3},{201023,0,1,3},{201025,0,1,3},{201026,0,1,3},{201027,0,1,3},{201029,0,1,3},{202010,0,1,80},{202011,0,1,80},{202012,0,1,80},{202013,0,1,80}, | BC39: 202013 | BD39: 泰坦戒指 | BE39: 1 | BF39: 0 | BG39: 1 | BH39: 60 | BI39: ="{"&RC[-6]&","&RC[-3]&","&RC[-2]&","&RC[-1]&"}," -> {202013,0,1,60}, | BJ39: =R[-1]C&RC[-1] -> {200010,0,1,60},{200011,0,1,60},{200012,0,1,60},{200013,0,1,60},{200015,0,1,60},{200016,0,1,60},{200017,0,1,60},{200019,0,1,60},{200020,0,1,1},{200021,0,1,5},{200022,0,1,5},{200023,0,1,5},{200025,0,1,5},{200026,0,1,5},{200027,0,1,5},{200029,0,1,5},{201010,0,1,60},{201011,0,1,60},{201012,0,1,60},{201013,0,1,60},{201015,0,1,60},{201016,0,1,60},{201017,0,1,60},{201019,0,1,60},{201020,0,1,1},{201021,0,1,5},{201022,0,1,5},{201023,0,1,5},{201025,0,1,5},{201026,0,1,5},{201027,0,1,5},{201029,0,1,5},{202010,0,1,60},{202011,0,1,60},{202012,0,1,60},{202013,0,1,60},
O40: 3 | P40: 100 | Q40: ="{0,[{"&RC[-2]&","&RC[-1]&"}],["&R[-13]C&"]}" -> {0,[{3,100}],[{200000,0,1,40},{200001,0,1,40},{200002,0,1,40},{200003,0,1,40},{200006,0,1,40},{200010,0,1,5},{200011,0,1,10},{200012,0,1,10},{201000,0,1,40},{201001,0,1,40},{201002,0,1,40},{201003,0,1,40},{201006,0,1,40},{201010,0,1,5},{201011,0,1,10},{201012,0,1,10},{202000,0,1,40},{202001,0,1,40},{202002,0,1,40},{202003,0,1,40},{202006,0,1,40},{202010,0,1,5},{202011,0,1,10},{202012,0,1,10}]} | S40: 202016 | T40: 幽灵手镯 | U40: 1 | V40: 0 | W40: 1 | X40: 10 | Y40: ="{"&RC[-6]&","&RC[-3]&","&RC[-2]&","&RC[-1]&"}," -> {202016,0,1,10}, | Z40: =R[-1]C&RC[-1] -> {200000,0,1,40},{200001,0,1,40},{200002,0,1,40},{200003,0,1,40},{200006,0,1,40},{200010,0,1,5},{200011,0,1,10},{200012,0,1,10},{200013,0,1,10},{200015,0,1,10},{200016,0,1,10},{200017,0,1,10},{200019,0,1,10},{201000,0,1,40},{201001,0,1,40},{201002,0,1,40},{201003,0,1,40},{201006,0,1,40},{201010,0,1,5},{201011,0,1,10},{201012,0,1,10},{201013,0,1,10},{201015,0,1,10},{201016,0,1,10},{201017,0,1,10},{201019,0,1,10},{202000,0,1,40},{202001,0,1,40},{202002,0,1,40},{202003,0,1,40},{202006,0,1,40},{202010,0,1,5},{202011,0,1,10},{202012,0,1,10},{202013,0,1,10},{202015,0,1,10},{202016,0,1,10}, | AB40: 202016 | AC40: 幽灵手镯 | AD40: 1 | AE40: 0 | AF40: 1 | AG40: 10 | AH40: ="{"&RC[-6]&","&RC[-3]&","&RC[-2]&","&RC[-1]&"}," -> {202016,0,1,10}, | AI40: =R[-1]C&RC[-1] -> {200000,0,1,40},{200001,0,1,40},{200002,0,1,40},{200003,0,1,40},{200006,0,1,40},{200010,0,1,5},{200011,0,1,10},{200012,0,1,10},{200013,0,1,10},{200015,0,1,10},{200016,0,1,10},{200017,0,1,10},{200019,0,1,10},{201000,0,1,40},{201001,0,1,40},{201002,0,1,40},{201003,0,1,40},{201006,0,1,40},{201010,0,1,5},{201011,0,1,10},{201012,0,1,10},{201013,0,1,10},{201015,0,1,10},{201016,0,1,10},{201017,0,1,10},{201019,0,1,10},{202000,0,1,40},{202001,0,1,40},{202002,0,1,40},{202003,0,1,40},{202006,0,1,40},{202010,0,1,5},{202011,0,1,10},{202012,0,1,10},{202013,0,1,10},{202015,0,1,10},{202016,0,1,10}, | AK40: 202015 | AL40: 道士头盔 | AM40: 1 | AN40: 0 | AO40: 1 | AP40: 100 | AQ40: ="{"&RC[-6]&","&RC[-3]&","&RC[-2]&","&RC[-1]&"}," -> {202015,0,1,100}, | AR40: =R[-1]C&RC[-1] -> {200010,0,1,100},{200011,0,1,100},{200012,0,1,100},{200013,0,1,100},{200015,0,1,100},{200016,0,1,100},{200017,0,1,100},{200019,0,1,100},{200020,0,1,1},{200021,0,1,2},{200022,0,1,2},{200023,0,1,2},{200025,0,1,2},{200026,0,1,2},{200027,0,1,2},{200029,0,1,2},{201010,0,1,100},{201011,0,1,100},{201012,0,1,100},{201013,0,1,100},{201015,0,1,100},{201016,0,1,100},{201017,0,1,100},{201019,0,1,100},{201020,0,1,1},{201021,0,1,2},{201022,0,1,2},{201023,0,1,2},{201025,0,1,2},{201026,0,1,2},{201027,0,1,2},{201029,0,1,2},{202010,0,1,100},{202011,0,1,100},{202012,0,1,100},{202013,0,1,100},{202015,0,1,100}, | AT40: 202015 | AU40: 道士头盔 | AV40: 1 | AW40: 0 | AX40: 1 | AY40: 80 | AZ40: ="{"&RC[-6]&","&RC[-3]&","&RC[-2]&","&RC[-1]&"}," -> {202015,0,1,80}, | BA40: =R[-1]C&RC[-1] -> {200010,0,1,80},{200011,0,1,80},{200012,0,1,80},{200013,0,1,80},{200015,0,1,80},{200016,0,1,80},{200017,0,1,80},{200019,0,1,80},{200020,0,1,1},{200021,0,1,3},{200022,0,1,3},{200023,0,1,3},{200025,0,1,3},{200026,0,1,3},{200027,0,1,3},{200029,0,1,3},{201010,0,1,80},{201011,0,1,80},{201012,0,1,80},{201013,0,1,80},{201015,0,1,80},{201016,0,1,80},{201017,0,1,80},{201019,0,1,80},{201020,0,1,1},{201021,0,1,3},{201022,0,1,3},{201023,0,1,3},{201025,0,1,3},{201026,0,1,3},{201027,0,1,3},{201029,0,1,3},{202010,0,1,80},{202011,0,1,80},{202012,0,1,80},{202013,0,1,80},{202015,0,1,80}, | BC40: 202015 | BD40: 道士头盔 | BE40: 1 | BF40: 0 | BG40: 1 | BH40: 60 | BI40: ="{"&RC[-6]&","&RC[-3]&","&RC[-2]&","&RC[-1]&"}," -> {202015,0,1,60}, | BJ40: =R[-1]C&RC[-1] -> {200010,0,1,60},{200011,0,1,60},{200012,0,1,60},{200013,0,1,60},{200015,0,1,60},{200016,0,1,60},{200017,0,1,60},{200019,0,1,60},{200020,0,1,1},{200021,0,1,5},{200022,0,1,5},{200023,0,1,5},{200025,0,1,5},{200026,0,1,5},{200027,0,1,5},{200029,0,1,5},{201010,0,1,60},{201011,0,1,60},{201012,0,1,60},{201013,0,1,60},{201015,0,1,60},{201016,0,1,60},{201017,0,1,60},{201019,0,1,60},{201020,0,1,1},{201021,0,1,5},{201022,0,1,5},{201023,0,1,5},{201025,0,1,5},{201026,0,1,5},{201027,0,1,5},{201029,0,1,5},{202010,0,1,60},{202011,0,1,60},{202012,0,1,60},{202013,0,1,60},{202015,0,1,60},
O41: 道具 | P41: 概率／100 | S41: 202017 | T41: 道士腰带 | U41: 1 | V41: 0 | W41: 1 | X41: 10 | Y41: ="{"&RC[-6]&","&RC[-3]&","&RC[-2]&","&RC[-1]&"}," -> {202017,0,1,10}, | Z41: =R[-1]C&RC[-1] -> {200000,0,1,40},{200001,0,1,40},{200002,0,1,40},{200003,0,1,40},{200006,0,1,40},{200010,0,1,5},{200011,0,1,10},{200012,0,1,10},{200013,0,1,10},{200015,0,1,10},{200016,0,1,10},{200017,0,1,10},{200019,0,1,10},{201000,0,1,40},{201001,0,1,40},{201002,0,1,40},{201003,0,1,40},{201006,0,1,40},{201010,0,1,5},{201011,0,1,10},{201012,0,1,10},{201013,0,1,10},{201015,0,1,10},{201016,0,1,10},{201017,0,1,10},{201019,0,1,10},{202000,0,1,40},{202001,0,1,40},{202002,0,1,40},{202003,0,1,40},{202006,0,1,40},{202010,0,1,5},{202011,0,1,10},{202012,0,1,10},{202013,0,1,10},{202015,0,1,10},{202016,0,1,10},{202017,0,1,10}, | AB41: 202017 | AC41: 道士腰带 | AD41: 1 | AE41: 0 | AF41: 1 | AG41: 10 | AH41: ="{"&RC[-6]&","&RC[-3]&","&RC[-2]&","&RC[-1]&"}," -> {202017,0,1,10}, | AI41: =R[-1]C&RC[-1] -> {200000,0,1,40},{200001,0,1,40},{200002,0,1,40},{200003,0,1,40},{200006,0,1,40},{200010,0,1,5},{200011,0,1,10},{200012,0,1,10},{200013,0,1,10},{200015,0,1,10},{200016,0,1,10},{200017,0,1,10},{200019,0,1,10},{201000,0,1,40},{201001,0,1,40},{201002,0,1,40},{201003,0,1,40},{201006,0,1,40},{201010,0,1,5},{201011,0,1,10},{201012,0,1,10},{201013,0,1,10},{201015,0,1,10},{201016,0,1,10},{201017,0,1,10},{201019,0,1,10},{202000,0,1,40},{202001,0,1,40},{202002,0,1,40},{202003,0,1,40},{202006,0,1,40},{202010,0,1,5},{202011,0,1,10},{202012,0,1,10},{202013,0,1,10},{202015,0,1,10},{202016,0,1,10},{202017,0,1,10}, | AK41: 202016 | AL41: 幽灵手镯 | AM41: 1 | AN41: 0 | AO41: 1 | AP41: 100 | AQ41: ="{"&RC[-6]&","&RC[-3]&","&RC[-2]&","&RC[-1]&"}," -> {202016,0,1,100}, | AR41: =R[-1]C&RC[-1] -> {200010,0,1,100},{200011,0,1,100},{200012,0,1,100},{200013,0,1,100},{200015,0,1,100},{200016,0,1,100},{200017,0,1,100},{200019,0,1,100},{200020,0,1,1},{200021,0,1,2},{200022,0,1,2},{200023,0,1,2},{200025,0,1,2},{200026,0,1,2},{200027,0,1,2},{200029,0,1,2},{201010,0,1,100},{201011,0,1,100},{201012,0,1,100},{201013,0,1,100},{201015,0,1,100},{201016,0,1,100},{201017,0,1,100},{201019,0,1,100},{201020,0,1,1},{201021,0,1,2},{201022,0,1,2},{201023,0,1,2},{201025,0,1,2},{201026,0,1,2},{201027,0,1,2},{201029,0,1,2},{202010,0,1,100},{202011,0,1,100},{202012,0,1,100},{202013,0,1,100},{202015,0,1,100},{202016,0,1,100}, | AT41: 202016 | AU41: 幽灵手镯 | AV41: 1 | AW41: 0 | AX41: 1 | AY41: 80 | AZ41: ="{"&RC[-6]&","&RC[-3]&","&RC[-2]&","&RC[-1]&"}," -> {202016,0,1,80}, | BA41: =R[-1]C&RC[-1] -> {200010,0,1,80},{200011,0,1,80},{200012,0,1,80},{200013,0,1,80},{200015,0,1,80},{200016,0,1,80},{200017,0,1,80},{200019,0,1,80},{200020,0,1,1},{200021,0,1,3},{200022,0,1,3},{200023,0,1,3},{200025,0,1,3},{200026,0,1,3},{200027,0,1,3},{200029,0,1,3},{201010,0,1,80},{201011,0,1,80},{201012,0,1,80},{201013,0,1,80},{201015,0,1,80},{201016,0,1,80},{201017,0,1,80},{201019,0,1,80},{201020,0,1,1},{201021,0,1,3},{201022,0,1,3},{201023,0,1,3},{201025,0,1,3},{201026,0,1,3},{201027,0,1,3},{201029,0,1,3},{202010,0,1,80},{202011,0,1,80},{202012,0,1,80},{202013,0,1,80},{202015,0,1,80},{202016,0,1,80}, | BC41: 202016 | BD41: 幽灵手镯 | BE41: 1 | BF41: 0 | BG41: 1 | BH41: 60 | BI41: ="{"&RC[-6]&","&RC[-3]&","&RC[-2]&","&RC[-1]&"}," -> {202016,0,1,60}, | BJ41: =R[-1]C&RC[-1] -> {200010,0,1,60},{200011,0,1,60},{200012,0,1,60},{200013,0,1,60},{200015,0,1,60},{200016,0,1,60},{200017,0,1,60},{200019,0,1,60},{200020,0,1,1},{200021,0,1,5},{200022,0,1,5},{200023,0,1,5},{200025,0,1,5},{200026,0,1,5},{200027,0,1,5},{200029,0,1,5},{201010,0,1,60},{201011,0,1,60},{201012,0,1,60},{201013,0,1,60},{201015,0,1,60},{201016,0,1,60},{201017,0,1,60},{201019,0,1,60},{201020,0,1,1},{201021,0,1,5},{201022,0,1,5},{201023,0,1,5},{201025,0,1,5},{201026,0,1,5},{201027,0,1,5},{201029,0,1,5},{202010,0,1,60},{202011,0,1,60},{202012,0,1,60},{202013,0,1,60},{202015,0,1,60},{202016,0,1,60},
O42: 2 | P42: 100 | Q42: ="{0,[{"&RC[-2]&","&RC[-1]&"}],["&R[-6]C&"]}" -> {0,[{2,100}],[{110002,0,2,2},{110003,0,2,2},{110004,0,1,3},{110005,0,1,3},{110010,0,1,0},{110011,0,1,0},{110012,0,1,0}]} | S42: 202019 | T42: 道士鞋子 | U42: 1 | V42: 0 | W42: 1 | X42: 10 | Y42: ="{"&RC[-6]&","&RC[-3]&","&RC[-2]&","&RC[-1]&"}" -> {202019,0,1,10} | Z42: =R[-1]C&RC[-1] -> {200000,0,1,40},{200001,0,1,40},{200002,0,1,40},{200003,0,1,40},{200006,0,1,40},{200010,0,1,5},{200011,0,1,10},{200012,0,1,10},{200013,0,1,10},{200015,0,1,10},{200016,0,1,10},{200017,0,1,10},{200019,0,1,10},{201000,0,1,40},{201001,0,1,40},{201002,0,1,40},{201003,0,1,40},{201006,0,1,40},{201010,0,1,5},{201011,0,1,10},{201012,0,1,10},{201013,0,1,10},{201015,0,1,10},{201016,0,1,10},{201017,0,1,10},{201019,0,1,10},{202000,0,1,40},{202001,0,1,40},{202002,0,1,40},{202003,0,1,40},{202006,0,1,40},{202010,0,1,5},{202011,0,1,10},{202012,0,1,10},{202013,0,1,10},{202015,0,1,10},{202016,0,1,10},{202017,0,1,10},{202019,0,1,10} | AB42: 202019 | AC42: 道士鞋子 | AD42: 1 | AE42: 0 | AF42: 1 | AG42: 10 | AH42: ="{"&RC[-6]&","&RC[-3]&","&RC[-2]&","&RC[-1]&"}" -> {202019,0,1,10} | AI42: =R[-1]C&RC[-1] -> {200000,0,1,40},{200001,0,1,40},{200002,0,1,40},{200003,0,1,40},{200006,0,1,40},{200010,0,1,5},{200011,0,1,10},{200012,0,1,10},{200013,0,1,10},{200015,0,1,10},{200016,0,1,10},{200017,0,1,10},{200019,0,1,10},{201000,0,1,40},{201001,0,1,40},{201002,0,1,40},{201003,0,1,40},{201006,0,1,40},{201010,0,1,5},{201011,0,1,10},{201012,0,1,10},{201013,0,1,10},{201015,0,1,10},{201016,0,1,10},{201017,0,1,10},{201019,0,1,10},{202000,0,1,40},{202001,0,1,40},{202002,0,1,40},{202003,0,1,40},{202006,0,1,40},{202010,0,1,5},{202011,0,1,10},{202012,0,1,10},{202013,0,1,10},{202015,0,1,10},{202016,0,1,10},{202017,0,1,10},{202019,0,1,10} | AK42: 202017 | AL42: 道士腰带 | AM42: 1 | AN42: 0 | AO42: 1 | AP42: 100 | AQ42: ="{"&RC[-6]&","&RC[-3]&","&RC[-2]&","&RC[-1]&"}," -> {202017,0,1,100}, | AR42: =R[-1]C&RC[-1] -> {200010,0,1,100},{200011,0,1,100},{200012,0,1,100},{200013,0,1,100},{200015,0,1,100},{200016,0,1,100},{200017,0,1,100},{200019,0,1,100},{200020,0,1,1},{200021,0,1,2},{200022,0,1,2},{200023,0,1,2},{200025,0,1,2},{200026,0,1,2},{200027,0,1,2},{200029,0,1,2},{201010,0,1,100},{201011,0,1,100},{201012,0,1,100},{201013,0,1,100},{201015,0,1,100},{201016,0,1,100},{201017,0,1,100},{201019,0,1,100},{201020,0,1,1},{201021,0,1,2},{201022,0,1,2},{201023,0,1,2},{201025,0,1,2},{201026,0,1,2},{201027,0,1,2},{201029,0,1,2},{202010,0,1,100},{202011,0,1,100},{202012,0,1,100},{202013,0,1,100},{202015,0,1,100},{202016,0,1,100},{202017,0,1,100}, | AT42: 202017 | AU42: 道士腰带 | AV42: 1 | AW42: 0 | AX42: 1 | AY42: 80 | AZ42: ="{"&RC[-6]&","&RC[-3]&","&RC[-2]&","&RC[-1]&"}," -> {202017,0,1,80}, | BA42: =R[-1]C&RC[-1] -> {200010,0,1,80},{200011,0,1,80},{200012,0,1,80},{200013,0,1,80},{200015,0,1,80},{200016,0,1,80},{200017,0,1,80},{200019,0,1,80},{200020,0,1,1},{200021,0,1,3},{200022,0,1,3},{200023,0,1,3},{200025,0,1,3},{200026,0,1,3},{200027,0,1,3},{200029,0,1,3},{201010,0,1,80},{201011,0,1,80},{201012,0,1,80},{201013,0,1,80},{201015,0,1,80},{201016,0,1,80},{201017,0,1,80},{201019,0,1,80},{201020,0,1,1},{201021,0,1,3},{201022,0,1,3},{201023,0,1,3},{201025,0,1,3},{201026,0,1,3},{201027,0,1,3},{201029,0,1,3},{202010,0,1,80},{202011,0,1,80},{202012,0,1,80},{202013,0,1,80},{202015,0,1,80},{202016,0,1,80},{202017,0,1,80}, | BC42: 202017 | BD42: 道士腰带 | BE42: 1 | BF42: 0 | BG42: 1 | BH42: 60 | BI42: ="{"&RC[-6]&","&RC[-3]&","&RC[-2]&","&RC[-1]&"}," -> {202017,0,1,60}, | BJ42: =R[-1]C&RC[-1] -> {200010,0,1,60},{200011,0,1,60},{200012,0,1,60},{200013,0,1,60},{200015,0,1,60},{200016,0,1,60},{200017,0,1,60},{200019,0,1,60},{200020,0,1,1},{200021,0,1,5},{200022,0,1,5},{200023,0,1,5},{200025,0,1,5},{200026,0,1,5},{200027,0,1,5},{200029,0,1,5},{201010,0,1,60},{201011,0,1,60},{201012,0,1,60},{201013,0,1,60},{201015,0,1,60},{201016,0,1,60},{201017,0,1,60},{201019,0,1,60},{201020,0,1,1},{201021,0,1,5},{201022,0,1,5},{201023,0,1,5},{201025,0,1,5},{201026,0,1,5},{201027,0,1,5},{201029,0,1,5},{202010,0,1,60},{202011,0,1,60},{202012,0,1,60},{202013,0,1,60},{202015,0,1,60},{202016,0,1,60},{202017,0,1,60},
O43: 金币 | P43: 概率／100 | AK43: 202019 | AL43: 道士鞋子 | AM43: 1 | AN43: 0 | AO43: 1 | AP43: 100 | AQ43: ="{"&RC[-6]&","&RC[-3]&","&RC[-2]&","&RC[-1]&"}," -> {202019,0,1,100}, | AR43: =R[-1]C&RC[-1] -> {200010,0,1,100},{200011,0,1,100},{200012,0,1,100},{200013,0,1,100},{200015,0,1,100},{200016,0,1,100},{200017,0,1,100},{200019,0,1,100},{200020,0,1,1},{200021,0,1,2},{200022,0,1,2},{200023,0,1,2},{200025,0,1,2},{200026,0,1,2},{200027,0,1,2},{200029,0,1,2},{201010,0,1,100},{201011,0,1,100},{201012,0,1,100},{201013,0,1,100},{201015,0,1,100},{201016,0,1,100},{201017,0,1,100},{201019,0,1,100},{201020,0,1,1},{201021,0,1,2},{201022,0,1,2},{201023,0,1,2},{201025,0,1,2},{201026,0,1,2},{201027,0,1,2},{201029,0,1,2},{202010,0,1,100},{202011,0,1,100},{202012,0,1,100},{202013,0,1,100},{202015,0,1,100},{202016,0,1,100},{202017,0,1,100},{202019,0,1,100}, | AT43: 202019 | AU43: 道士鞋子 | AV43: 1 | AW43: 0 | AX43: 1 | AY43: 80 | AZ43: ="{"&RC[-6]&","&RC[-3]&","&RC[-2]&","&RC[-1]&"}," -> {202019,0,1,80}, | BA43: =R[-1]C&RC[-1] -> {200010,0,1,80},{200011,0,1,80},{200012,0,1,80},{200013,0,1,80},{200015,0,1,80},{200016,0,1,80},{200017,0,1,80},{200019,0,1,80},{200020,0,1,1},{200021,0,1,3},{200022,0,1,3},{200023,0,1,3},{200025,0,1,3},{200026,0,1,3},{200027,0,1,3},{200029,0,1,3},{201010,0,1,80},{201011,0,1,80},{201012,0,1,80},{201013,0,1,80},{201015,0,1,80},{201016,0,1,80},{201017,0,1,80},{201019,0,1,80},{201020,0,1,1},{201021,0,1,3},{201022,0,1,3},{201023,0,1,3},{201025,0,1,3},{201026,0,1,3},{201027,0,1,3},{201029,0,1,3},{202010,0,1,80},{202011,0,1,80},{202012,0,1,80},{202013,0,1,80},{202015,0,1,80},{202016,0,1,80},{202017,0,1,80},{202019,0,1,80}, | BC43: 202019 | BD43: 道士鞋子 | BE43: 1 | BF43: 0 | BG43: 1 | BH43: 60 | BI43: ="{"&RC[-6]&","&RC[-3]&","&RC[-2]&","&RC[-1]&"}," -> {202019,0,1,60}, | BJ43: =R[-1]C&RC[-1] -> {200010,0,1,60},{200011,0,1,60},{200012,0,1,60},{200013,0,1,60},{200015,0,1,60},{200016,0,1,60},{200017,0,1,60},{200019,0,1,60},{200020,0,1,1},{200021,0,1,5},{200022,0,1,5},{200023,0,1,5},{200025,0,1,5},{200026,0,1,5},{200027,0,1,5},{200029,0,1,5},{201010,0,1,60},{201011,0,1,60},{201012,0,1,60},{201013,0,1,60},{201015,0,1,60},{201016,0,1,60},{201017,0,1,60},{201019,0,1,60},{201020,0,1,1},{201021,0,1,5},{201022,0,1,5},{201023,0,1,5},{201025,0,1,5},{201026,0,1,5},{201027,0,1,5},{201029,0,1,5},{202010,0,1,60},{202011,0,1,60},{202012,0,1,60},{202013,0,1,60},{202015,0,1,60},{202016,0,1,60},{202017,0,1,60},{202019,0,1,60},
O44: 3 | P44: 100 | Q44: {0,[{10,100}],[{110009,1,1000,1}]} | AK44: 202020 | AL44: 龙纹 | AM44: 1 | AN44: 0 | AO44: 1 | AP44: 1 | AQ44: ="{"&RC[-6]&","&RC[-3]&","&RC[-2]&","&RC[-1]&"}," -> {202020,0,1,1}, | AR44: =R[-1]C&RC[-1] -> {200010,0,1,100},{200011,0,1,100},{200012,0,1,100},{200013,0,1,100},{200015,0,1,100},{200016,0,1,100},{200017,0,1,100},{200019,0,1,100},{200020,0,1,1},{200021,0,1,2},{200022,0,1,2},{200023,0,1,2},{200025,0,1,2},{200026,0,1,2},{200027,0,1,2},{200029,0,1,2},{201010,0,1,100},{201011,0,1,100},{201012,0,1,100},{201013,0,1,100},{201015,0,1,100},{201016,0,1,100},{201017,0,1,100},{201019,0,1,100},{201020,0,1,1},{201021,0,1,2},{201022,0,1,2},{201023,0,1,2},{201025,0,1,2},{201026,0,1,2},{201027,0,1,2},{201029,0,1,2},{202010,0,1,100},{202011,0,1,100},{202012,0,1,100},{202013,0,1,100},{202015,0,1,100},{202016,0,1,100},{202017,0,1,100},{202019,0,1,100},{202020,0,1,1}, | AT44: 202020 | AU44: 龙纹 | AV44: 1 | AW44: 0 | AX44: 1 | AY44: 1 | AZ44: ="{"&RC[-6]&","&RC[-3]&","&RC[-2]&","&RC[-1]&"}," -> {202020,0,1,1}, | BA44: =R[-1]C&RC[-1] -> {200010,0,1,80},{200011,0,1,80},{200012,0,1,80},{200013,0,1,80},{200015,0,1,80},{200016,0,1,80},{200017,0,1,80},{200019,0,1,80},{200020,0,1,1},{200021,0,1,3},{200022,0,1,3},{200023,0,1,3},{200025,0,1,3},{200026,0,1,3},{200027,0,1,3},{200029,0,1,3},{201010,0,1,80},{201011,0,1,80},{201012,0,1,80},{201013,0,1,80},{201015,0,1,80},{201016,0,1,80},{201017,0,1,80},{201019,0,1,80},{201020,0,1,1},{201021,0,1,3},{201022,0,1,3},{201023,0,1,3},{201025,0,1,3},{201026,0,1,3},{201027,0,1,3},{201029,0,1,3},{202010,0,1,80},{202011,0,1,80},{202012,0,1,80},{202013,0,1,80},{202015,0,1,80},{202016,0,1,80},{202017,0,1,80},{202019,0,1,80},{202020,0,1,1}, | BC44: 202020 | BD44: 龙纹 | BE44: 1 | BF44: 0 | BG44: 1 | BH44: 1 | BI44: ="{"&RC[-6]&","&RC[-3]&","&RC[-2]&","&RC[-1]&"}," -> {202020,0,1,1}, | BJ44: =R[-1]C&RC[-1] -> {200010,0,1,60},{200011,0,1,60},{200012,0,1,60},{200013,0,1,60},{200015,0,1,60},{200016,0,1,60},{200017,0,1,60},{200019,0,1,60},{200020,0,1,1},{200021,0,1,5},{200022,0,1,5},{200023,0,1,5},{200025,0,1,5},{200026,0,1,5},{200027,0,1,5},{200029,0,1,5},{201010,0,1,60},{201011,0,1,60},{201012,0,1,60},{201013,0,1,60},{201015,0,1,60},{201016,0,1,60},{201017,0,1,60},{201019,0,1,60},{201020,0,1,1},{201021,0,1,5},{201022,0,1,5},{201023,0,1,5},{201025,0,1,5},{201026,0,1,5},{201027,0,1,5},{201029,0,1,5},{202010,0,1,60},{202011,0,1,60},{202012,0,1,60},{202013,0,1,60},{202015,0,1,60},{202016,0,1,60},{202017,0,1,60},{202019,0,1,60},{202020,0,1,1},
S45: 110002 | T45: 强化石 | V45: 1 | W45: 2 | X45: 2 | Y45: ="{"&RC[-6]&","&RC[-3]&","&RC[-2]&","&RC[-1]&"}," -> {110002,1,2,2}, | Z45: =RC[-1] -> {110002,1,2,2}, | AB45: 110002 | AC45: 强化石 | AE45: 0 | AF45: 2 | AG45: 2 | AH45: ="{"&RC[-6]&","&RC[-3]&","&RC[-2]&","&RC[-1]&"}," -> {110002,0,2,2}, | AI45: =RC[-1] -> {110002,0,2,2}, | AK45: 202021 | AL45: 天尊道袍 | AM45: 1 | AN45: 0 | AO45: 1 | AP45: 2 | AQ45: ="{"&RC[-6]&","&RC[-3]&","&RC[-2]&","&RC[-1]&"}," -> {202021,0,1,2}, | AR45: =R[-1]C&RC[-1] -> {200010,0,1,100},{200011,0,1,100},{200012,0,1,100},{200013,0,1,100},{200015,0,1,100},{200016,0,1,100},{200017,0,1,100},{200019,0,1,100},{200020,0,1,1},{200021,0,1,2},{200022,0,1,2},{200023,0,1,2},{200025,0,1,2},{200026,0,1,2},{200027,0,1,2},{200029,0,1,2},{201010,0,1,100},{201011,0,1,100},{201012,0,1,100},{201013,0,1,100},{201015,0,1,100},{201016,0,1,100},{201017,0,1,100},{201019,0,1,100},{201020,0,1,1},{201021,0,1,2},{201022,0,1,2},{201023,0,1,2},{201025,0,1,2},{201026,0,1,2},{201027,0,1,2},{201029,0,1,2},{202010,0,1,100},{202011,0,1,100},{202012,0,1,100},{202013,0,1,100},{202015,0,1,100},{202016,0,1,100},{202017,0,1,100},{202019,0,1,100},{202020,0,1,1},{202021,0,1,2}, | AT45: 202021 | AU45: 天尊道袍 | AV45: 1 | AW45: 0 | AX45: 1 | AY45: 3 | AZ45: ="{"&RC[-6]&","&RC[-3]&","&RC[-2]&","&RC[-1]&"}," -> {202021,0,1,3}, | BA45: =R[-1]C&RC[-1] -> {200010,0,1,80},{200011,0,1,80},{200012,0,1,80},{200013,0,1,80},{200015,0,1,80},{200016,0,1,80},{200017,0,1,80},{200019,0,1,80},{200020,0,1,1},{200021,0,1,3},{200022,0,1,3},{200023,0,1,3},{200025,0,1,3},{200026,0,1,3},{200027,0,1,3},{200029,0,1,3},{201010,0,1,80},{201011,0,1,80},{201012,0,1,80},{201013,0,1,80},{201015,0,1,80},{201016,0,1,80},{201017,0,1,80},{201019,0,1,80},{201020,0,1,1},{201021,0,1,3},{201022,0,1,3},{201023,0,1,3},{201025,0,1,3},{201026,0,1,3},{201027,0,1,3},{201029,0,1,3},{202010,0,1,80},{202011,0,1,80},{202012,0,1,80},{202013,0,1,80},{202015,0,1,80},{202016,0,1,80},{202017,0,1,80},{202019,0,1,80},{202020,0,1,1},{202021,0,1,3}, | BC45: 202021 | BD45: 天尊道袍 | BE45: 1 | BF45: 0 | BG45: 1 | BH45: 5 | BI45: ="{"&RC[-6]&","&RC[-3]&","&RC[-2]&","&RC[-1]&"}," -> {202021,0,1,5}, | BJ45: =R[-1]C&RC[-1] -> {200010,0,1,60},{200011,0,1,60},{200012,0,1,60},{200013,0,1,60},{200015,0,1,60},{200016,0,1,60},{200017,0,1,60},{200019,0,1,60},{200020,0,1,1},{200021,0,1,5},{200022,0,1,5},{200023,0,1,5},{200025,0,1,5},{200026,0,1,5},{200027,0,1,5},{200029,0,1,5},{201010,0,1,60},{201011,0,1,60},{201012,0,1,60},{201013,0,1,60},{201015,0,1,60},{201016,0,1,60},{201017,0,1,60},{201019,0,1,60},{201020,0,1,1},{201021,0,1,5},{201022,0,1,5},{201023,0,1,5},{201025,0,1,5},{201026,0,1,5},{201027,0,1,5},{201029,0,1,5},{202010,0,1,60},{202011,0,1,60},{202012,0,1,60},{202013,0,1,60},{202015,0,1,60},{202016,0,1,60},{202017,0,1,60},{202019,0,1,60},{202020,0,1,1},{202021,0,1,5},
Q46: ="["&R[-6]C&","&R[-4]C&","&R[-2]C&"]" -> [{0,[{3,100}],[{200000,0,1,40},{200001,0,1,40},{200002,0,1,40},{200003,0,1,40},{200006,0,1,40},{200010,0,1,5},{200011,0,1,10},{200012,0,1,10},{201000,0,1,40},{201001,0,1,40},{201002,0,1,40},{201003,0,1,40},{201006,0,1,40},{201010,0,1,5},{201011,0,1,10},{201012,0,1,10},{202000,0,1,40},{202001,0,1,40},{202002,0,1,40},{202003,0,1,40},{202006,0,1,40},{202010,0,1,5},{202011,0,1,10},{202012,0,1,10}]},{0,[{2,100}],[{110002,0,2,2},{110003,0,2,2},{110004,0,1,3},{110005,0,1,3},{110010,0,1,0},{110011,0,1,0},{110012,0,1,0}]},{0,[{10,100}],[{110009,1,1000,1}]}] | S46: 110003 | T46: 洗炼石 | V46: 1 | W46: 2 | X46: 2 | Y46: ="{"&RC[-6]&","&RC[-3]&","&RC[-2]&","&RC[-1]&"}," -> {110003,1,2,2}, | Z46: =R[-1]C&RC[-1] -> {110002,1,2,2},{110003,1,2,2}, | AB46: 110003 | AC46: 洗炼石 | AE46: 0 | AF46: 2 | AG46: 2 | AH46: ="{"&RC[-6]&","&RC[-3]&","&RC[-2]&","&RC[-1]&"}," -> {110003,0,2,2}, | AI46: =R[-1]C&RC[-1] -> {110002,0,2,2},{110003,0,2,2}, | AK46: 202022 | AL46: 天尊项链 | AM46: 1 | AN46: 0 | AO46: 1 | AP46: 2 | AQ46: ="{"&RC[-6]&","&RC[-3]&","&RC[-2]&","&RC[-1]&"}," -> {202022,0,1,2}, | AR46: =R[-1]C&RC[-1] -> {200010,0,1,100},{200011,0,1,100},{200012,0,1,100},{200013,0,1,100},{200015,0,1,100},{200016,0,1,100},{200017,0,1,100},{200019,0,1,100},{200020,0,1,1},{200021,0,1,2},{200022,0,1,2},{200023,0,1,2},{200025,0,1,2},{200026,0,1,2},{200027,0,1,2},{200029,0,1,2},{201010,0,1,100},{201011,0,1,100},{201012,0,1,100},{201013,0,1,100},{201015,0,1,100},{201016,0,1,100},{201017,0,1,100},{201019,0,1,100},{201020,0,1,1},{201021,0,1,2},{201022,0,1,2},{201023,0,1,2},{201025,0,1,2},{201026,0,1,2},{201027,0,1,2},{201029,0,1,2},{202010,0,1,100},{202011,0,1,100},{202012,0,1,100},{202013,0,1,100},{202015,0,1,100},{202016,0,1,100},{202017,0,1,100},{202019,0,1,100},{202020,0,1,1},{202021,0,1,2},{202022,0,1,2}, | AT46: 202022 | AU46: 天尊项链 | AV46: 1 | AW46: 0 | AX46: 1 | AY46: 3 | AZ46: ="{"&RC[-6]&","&RC[-3]&","&RC[-2]&","&RC[-1]&"}," -> {202022,0,1,3}, | BA46: =R[-1]C&RC[-1] -> {200010,0,1,80},{200011,0,1,80},{200012,0,1,80},{200013,0,1,80},{200015,0,1,80},{200016,0,1,80},{200017,0,1,80},{200019,0,1,80},{200020,0,1,1},{200021,0,1,3},{200022,0,1,3},{200023,0,1,3},{200025,0,1,3},{200026,0,1,3},{200027,0,1,3},{200029,0,1,3},{201010,0,1,80},{201011,0,1,80},{201012,0,1,80},{201013,0,1,80},{201015,0,1,80},{201016,0,1,80},{201017,0,1,80},{201019,0,1,80},{201020,0,1,1},{201021,0,1,3},{201022,0,1,3},{201023,0,1,3},{201025,0,1,3},{201026,0,1,3},{201027,0,1,3},{201029,0,1,3},{202010,0,1,80},{202011,0,1,80},{202012,0,1,80},{202013,0,1,80},{202015,0,1,80},{202016,0,1,80},{202017,0,1,80},{202019,0,1,80},{202020,0,1,1},{202021,0,1,3},{202022,0,1,3}, | BC46: 202022 | BD46: 天尊项链 | BE46: 1 | BF46: 0 | BG46: 1 | BH46: 5 | BI46: ="{"&RC[-6]&","&RC[-3]&","&RC[-2]&","&RC[-1]&"}," -> {202022,0,1,5}, | BJ46: =R[-1]C&RC[-1] -> {200010,0,1,60},{200011,0,1,60},{200012,0,1,60},{200013,0,1,60},{200015,0,1,60},{200016,0,1,60},{200017,0,1,60},{200019,0,1,60},{200020,0,1,1},{200021,0,1,5},{200022,0,1,5},{200023,0,1,5},{200025,0,1,5},{200026,0,1,5},{200027,0,1,5},{200029,0,1,5},{201010,0,1,60},{201011,0,1,60},{201012,0,1,60},{201013,0,1,60},{201015,0,1,60},{201016,0,1,60},{201017,0,1,60},{201019,0,1,60},{201020,0,1,1},{201021,0,1,5},{201022,0,1,5},{201023,0,1,5},{201025,0,1,5},{201026,0,1,5},{201027,0,1,5},{201029,0,1,5},{202010,0,1,60},{202011,0,1,60},{202012,0,1,60},{202013,0,1,60},{202015,0,1,60},{202016,0,1,60},{202017,0,1,60},{202019,0,1,60},{202020,0,1,1},{202021,0,1,5},{202022,0,1,5},
S47: 110004 | T47: 红药 | V47: 1 | W47: 1 | X47: 3 | Y47: ="{"&RC[-6]&","&RC[-3]&","&RC[-2]&","&RC[-1]&"}," -> {110004,1,1,3}, | Z47: =R[-1]C&RC[-1] -> {110002,1,2,2},{110003,1,2,2},{110004,1,1,3}, | AB47: 110004 | AC47: 红药 | AE47: 0 | AF47: 1 | AG47: 3 | AH47: ="{"&RC[-6]&","&RC[-3]&","&RC[-2]&","&RC[-1]&"}," -> {110004,0,1,3}, | AI47: =R[-1]C&RC[-1] -> {110002,0,2,2},{110003,0,2,2},{110004,0,1,3}, | AK47: 202023 | AL47: 天尊戒指 | AM47: 1 | AN47: 0 | AO47: 1 | AP47: 2 | AQ47: ="{"&RC[-6]&","&RC[-3]&","&RC[-2]&","&RC[-1]&"}," -> {202023,0,1,2}, | AR47: =R[-1]C&RC[-1] -> {200010,0,1,100},{200011,0,1,100},{200012,0,1,100},{200013,0,1,100},{200015,0,1,100},{200016,0,1,100},{200017,0,1,100},{200019,0,1,100},{200020,0,1,1},{200021,0,1,2},{200022,0,1,2},{200023,0,1,2},{200025,0,1,2},{200026,0,1,2},{200027,0,1,2},{200029,0,1,2},{201010,0,1,100},{201011,0,1,100},{201012,0,1,100},{201013,0,1,100},{201015,0,1,100},{201016,0,1,100},{201017,0,1,100},{201019,0,1,100},{201020,0,1,1},{201021,0,1,2},{201022,0,1,2},{201023,0,1,2},{201025,0,1,2},{201026,0,1,2},{201027,0,1,2},{201029,0,1,2},{202010,0,1,100},{202011,0,1,100},{202012,0,1,100},{202013,0,1,100},{202015,0,1,100},{202016,0,1,100},{202017,0,1,100},{202019,0,1,100},{202020,0,1,1},{202021,0,1,2},{202022,0,1,2},{202023,0,1,2}, | AT47: 202023 | AU47: 天尊戒指 | AV47: 1 | AW47: 0 | AX47: 1 | AY47: 3 | AZ47: ="{"&RC[-6]&","&RC[-3]&","&RC[-2]&","&RC[-1]&"}," -> {202023,0,1,3}, | BA47: =R[-1]C&RC[-1] -> {200010,0,1,80},{200011,0,1,80},{200012,0,1,80},{200013,0,1,80},{200015,0,1,80},{200016,0,1,80},{200017,0,1,80},{200019,0,1,80},{200020,0,1,1},{200021,0,1,3},{200022,0,1,3},{200023,0,1,3},{200025,0,1,3},{200026,0,1,3},{200027,0,1,3},{200029,0,1,3},{201010,0,1,80},{201011,0,1,80},{201012,0,1,80},{201013,0,1,80},{201015,0,1,80},{201016,0,1,80},{201017,0,1,80},{201019,0,1,80},{201020,0,1,1},{201021,0,1,3},{201022,0,1,3},{201023,0,1,3},{201025,0,1,3},{201026,0,1,3},{201027,0,1,3},{201029,0,1,3},{202010,0,1,80},{202011,0,1,80},{202012,0,1,80},{202013,0,1,80},{202015,0,1,80},{202016,0,1,80},{202017,0,1,80},{202019,0,1,80},{202020,0,1,1},{202021,0,1,3},{202022,0,1,3},{202023,0,1,3}, | BC47: 202023 | BD47: 天尊戒指 | BE47: 1 | BF47: 0 | BG47: 1 | BH47: 5 | BI47: ="{"&RC[-6]&","&RC[-3]&","&RC[-2]&","&RC[-1]&"}," -> {202023,0,1,5}, | BJ47: =R[-1]C&RC[-1] -> {200010,0,1,60},{200011,0,1,60},{200012,0,1,60},{200013,0,1,60},{200015,0,1,60},{200016,0,1,60},{200017,0,1,60},{200019,0,1,60},{200020,0,1,1},{200021,0,1,5},{200022,0,1,5},{200023,0,1,5},{200025,0,1,5},{200026,0,1,5},{200027,0,1,5},{200029,0,1,5},{201010,0,1,60},{201011,0,1,60},{201012,0,1,60},{201013,0,1,60},{201015,0,1,60},{201016,0,1,60},{201017,0,1,60},{201019,0,1,60},{201020,0,1,1},{201021,0,1,5},{201022,0,1,5},{201023,0,1,5},{201025,0,1,5},{201026,0,1,5},{201027,0,1,5},{201029,0,1,5},{202010,0,1,60},{202011,0,1,60},{202012,0,1,60},{202013,0,1,60},{202015,0,1,60},{202016,0,1,60},{202017,0,1,60},{202019,0,1,60},{202020,0,1,1},{202021,0,1,5},{202022,0,1,5},{202023,0,1,5},
S48: 110005 | T48: 蓝药 | V48: 1 | W48: 1 | X48: 3 | Y48: ="{"&RC[-6]&","&RC[-3]&","&RC[-2]&","&RC[-1]&"}," -> {110005,1,1,3}, | Z48: =R[-1]C&RC[-1] -> {110002,1,2,2},{110003,1,2,2},{110004,1,1,3},{110005,1,1,3}, | AB48: 110005 | AC48: 蓝药 | AE48: 0 | AF48: 1 | AG48: 3 | AH48: ="{"&RC[-6]&","&RC[-3]&","&RC[-2]&","&RC[-1]&"}," -> {110005,0,1,3}, | AI48: =R[-1]C&RC[-1] -> {110002,0,2,2},{110003,0,2,2},{110004,0,1,3},{110005,0,1,3}, | AK48: 202025 | AL48: 天尊头盔 | AM48: 1 | AN48: 0 | AO48: 1 | AP48: 2 | AQ48: ="{"&RC[-6]&","&RC[-3]&","&RC[-2]&","&RC[-1]&"}," -> {202025,0,1,2}, | AR48: =R[-1]C&RC[-1] -> {200010,0,1,100},{200011,0,1,100},{200012,0,1,100},{200013,0,1,100},{200015,0,1,100},{200016,0,1,100},{200017,0,1,100},{200019,0,1,100},{200020,0,1,1},{200021,0,1,2},{200022,0,1,2},{200023,0,1,2},{200025,0,1,2},{200026,0,1,2},{200027,0,1,2},{200029,0,1,2},{201010,0,1,100},{201011,0,1,100},{201012,0,1,100},{201013,0,1,100},{201015,0,1,100},{201016,0,1,100},{201017,0,1,100},{201019,0,1,100},{201020,0,1,1},{201021,0,1,2},{201022,0,1,2},{201023,0,1,2},{201025,0,1,2},{201026,0,1,2},{201027,0,1,2},{201029,0,1,2},{202010,0,1,100},{202011,0,1,100},{202012,0,1,100},{202013,0,1,100},{202015,0,1,100},{202016,0,1,100},{202017,0,1,100},{202019,0,1,100},{202020,0,1,1},{202021,0,1,2},{202022,0,1,2},{202023,0,1,2},{202025,0,1,2}, | AT48: 202025 | AU48: 天尊头盔 | AV48: 1 | AW48: 0 | AX48: 1 | AY48: 3 | AZ48: ="{"&RC[-6]&","&RC[-3]&","&RC[-2]&","&RC[-1]&"}," -> {202025,0,1,3}, | BA48: =R[-1]C&RC[-1] -> {200010,0,1,80},{200011,0,1,80},{200012,0,1,80},{200013,0,1,80},{200015,0,1,80},{200016,0,1,80},{200017,0,1,80},{200019,0,1,80},{200020,0,1,1},{200021,0,1,3},{200022,0,1,3},{200023,0,1,3},{200025,0,1,3},{200026,0,1,3},{200027,0,1,3},{200029,0,1,3},{201010,0,1,80},{201011,0,1,80},{201012,0,1,80},{201013,0,1,80},{201015,0,1,80},{201016,0,1,80},{201017,0,1,80},{201019,0,1,80},{201020,0,1,1},{201021,0,1,3},{201022,0,1,3},{201023,0,1,3},{201025,0,1,3},{201026,0,1,3},{201027,0,1,3},{201029,0,1,3},{202010,0,1,80},{202011,0,1,80},{202012,0,1,80},{202013,0,1,80},{202015,0,1,80},{202016,0,1,80},{202017,0,1,80},{202019,0,1,80},{202020,0,1,1},{202021,0,1,3},{202022,0,1,3},{202023,0,1,3},{202025,0,1,3}, | BC48: 202025 | BD48: 天尊头盔 | BE48: 1 | BF48: 0 | BG48: 1 | BH48: 5 | BI48: ="{"&RC[-6]&","&RC[-3]&","&RC[-2]&","&RC[-1]&"}," -> {202025,0,1,5}, | BJ48: =R[-1]C&RC[-1] -> {200010,0,1,60},{200011,0,1,60},{200012,0,1,60},{200013,0,1,60},{200015,0,1,60},{200016,0,1,60},{200017,0,1,60},{200019,0,1,60},{200020,0,1,1},{200021,0,1,5},{200022,0,1,5},{200023,0,1,5},{200025,0,1,5},{200026,0,1,5},{200027,0,1,5},{200029,0,1,5},{201010,0,1,60},{201011,0,1,60},{201012,0,1,60},{201013,0,1,60},{201015,0,1,60},{201016,0,1,60},{201017,0,1,60},{201019,0,1,60},{201020,0,1,1},{201021,0,1,5},{201022,0,1,5},{201023,0,1,5},{201025,0,1,5},{201026,0,1,5},{201027,0,1,5},{201029,0,1,5},{202010,0,1,60},{202011,0,1,60},{202012,0,1,60},{202013,0,1,60},{202015,0,1,60},{202016,0,1,60},{202017,0,1,60},{202019,0,1,60},{202020,0,1,1},{202021,0,1,5},{202022,0,1,5},{202023,0,1,5},{202025,0,1,5},
S49: 110010 | T49: 普通武装碎片 | V49: 1 | W49: 1 | X49: 0 | Y49: ="{"&RC[-6]&","&RC[-3]&","&RC[-2]&","&RC[-1]&"}," -> {110010,1,1,0}, | Z49: =R[-1]C&RC[-1] -> {110002,1,2,2},{110003,1,2,2},{110004,1,1,3},{110005,1,1,3},{110010,1,1,0}, | AB49: 110010 | AC49: 普通武装碎片 | AE49: 0 | AF49: 1 | AG49: 0 | AH49: ="{"&RC[-6]&","&RC[-3]&","&RC[-2]&","&RC[-1]&"}," -> {110010,0,1,0}, | AI49: =R[-1]C&RC[-1] -> {110002,0,2,2},{110003,0,2,2},{110004,0,1,3},{110005,0,1,3},{110010,0,1,0}, | AK49: 202026 | AL49: 天尊手镯 | AM49: 1 | AN49: 0 | AO49: 1 | AP49: 2 | AQ49: ="{"&RC[-6]&","&RC[-3]&","&RC[-2]&","&RC[-1]&"}," -> {202026,0,1,2}, | AR49: =R[-1]C&RC[-1] -> {200010,0,1,100},{200011,0,1,100},{200012,0,1,100},{200013,0,1,100},{200015,0,1,100},{200016,0,1,100},{200017,0,1,100},{200019,0,1,100},{200020,0,1,1},{200021,0,1,2},{200022,0,1,2},{200023,0,1,2},{200025,0,1,2},{200026,0,1,2},{200027,0,1,2},{200029,0,1,2},{201010,0,1,100},{201011,0,1,100},{201012,0,1,100},{201013,0,1,100},{201015,0,1,100},{201016,0,1,100},{201017,0,1,100},{201019,0,1,100},{201020,0,1,1},{201021,0,1,2},{201022,0,1,2},{201023,0,1,2},{201025,0,1,2},{201026,0,1,2},{201027,0,1,2},{201029,0,1,2},{202010,0,1,100},{202011,0,1,100},{202012,0,1,100},{202013,0,1,100},{202015,0,1,100},{202016,0,1,100},{202017,0,1,100},{202019,0,1,100},{202020,0,1,1},{202021,0,1,2},{202022,0,1,2},{202023,0,1,2},{202025,0,1,2},{202026,0,1,2}, | AT49: 202026 | AU49: 天尊手镯 | AV49: 1 | AW49: 0 | AX49: 1 | AY49: 3 | AZ49: ="{"&RC[-6]&","&RC[-3]&","&RC[-2]&","&RC[-1]&"}," -> {202026,0,1,3}, | BA49: =R[-1]C&RC[-1] -> {200010,0,1,80},{200011,0,1,80},{200012,0,1,80},{200013,0,1,80},{200015,0,1,80},{200016,0,1,80},{200017,0,1,80},{200019,0,1,80},{200020,0,1,1},{200021,0,1,3},{200022,0,1,3},{200023,0,1,3},{200025,0,1,3},{200026,0,1,3},{200027,0,1,3},{200029,0,1,3},{201010,0,1,80},{201011,0,1,80},{201012,0,1,80},{201013,0,1,80},{201015,0,1,80},{201016,0,1,80},{201017,0,1,80},{201019,0,1,80},{201020,0,1,1},{201021,0,1,3},{201022,0,1,3},{201023,0,1,3},{201025,0,1,3},{201026,0,1,3},{201027,0,1,3},{201029,0,1,3},{202010,0,1,80},{202011,0,1,80},{202012,0,1,80},{202013,0,1,80},{202015,0,1,80},{202016,0,1,80},{202017,0,1,80},{202019,0,1,80},{202020,0,1,1},{202021,0,1,3},{202022,0,1,3},{202023,0,1,3},{202025,0,1,3},{202026,0,1,3}, | BC49: 202026 | BD49: 天尊手镯 | BE49: 1 | BF49: 0 | BG49: 1 | BH49: 5 | BI49: ="{"&RC[-6]&","&RC[-3]&","&RC[-2]&","&RC[-1]&"}," -> {202026,0,1,5}, | BJ49: =R[-1]C&RC[-1] -> {200010,0,1,60},{200011,0,1,60},{200012,0,1,60},{200013,0,1,60},{200015,0,1,60},{200016,0,1,60},{200017,0,1,60},{200019,0,1,60},{200020,0,1,1},{200021,0,1,5},{200022,0,1,5},{200023,0,1,5},{200025,0,1,5},{200026,0,1,5},{200027,0,1,5},{200029,0,1,5},{201010,0,1,60},{201011,0,1,60},{201012,0,1,60},{201013,0,1,60},{201015,0,1,60},{201016,0,1,60},{201017,0,1,60},{201019,0,1,60},{201020,0,1,1},{201021,0,1,5},{201022,0,1,5},{201023,0,1,5},{201025,0,1,5},{201026,0,1,5},{201027,0,1,5},{201029,0,1,5},{202010,0,1,60},{202011,0,1,60},{202012,0,1,60},{202013,0,1,60},{202015,0,1,60},{202016,0,1,60},{202017,0,1,60},{202019,0,1,60},{202020,0,1,1},{202021,0,1,5},{202022,0,1,5},{202023,0,1,5},{202025,0,1,5},{202026,0,1,5},
S50: 110011 | T50: 普通防具碎片 | V50: 1 | W50: 1 | X50: 0 | Y50: ="{"&RC[-6]&","&RC[-3]&","&RC[-2]&","&RC[-1]&"}," -> {110011,1,1,0}, | Z50: =R[-1]C&RC[-1] -> {110002,1,2,2},{110003,1,2,2},{110004,1,1,3},{110005,1,1,3},{110010,1,1,0},{110011,1,1,0}, | AB50: 110011 | AC50: 普通防具碎片 | AE50: 0 | AF50: 1 | AG50: 0 | AH50: ="{"&RC[-6]&","&RC[-3]&","&RC[-2]&","&RC[-1]&"}," -> {110011,0,1,0}, | AI50: =R[-1]C&RC[-1] -> {110002,0,2,2},{110003,0,2,2},{110004,0,1,3},{110005,0,1,3},{110010,0,1,0},{110011,0,1,0}, | AK50: 202027 | AL50: 天尊腰带 | AM50: 1 | AN50: 0 | AO50: 1 | AP50: 2 | AQ50: ="{"&RC[-6]&","&RC[-3]&","&RC[-2]&","&RC[-1]&"}," -> {202027,0,1,2}, | AR50: =R[-1]C&RC[-1] -> {200010,0,1,100},{200011,0,1,100},{200012,0,1,100},{200013,0,1,100},{200015,0,1,100},{200016,0,1,100},{200017,0,1,100},{200019,0,1,100},{200020,0,1,1},{200021,0,1,2},{200022,0,1,2},{200023,0,1,2},{200025,0,1,2},{200026,0,1,2},{200027,0,1,2},{200029,0,1,2},{201010,0,1,100},{201011,0,1,100},{201012,0,1,100},{201013,0,1,100},{201015,0,1,100},{201016,0,1,100},{201017,0,1,100},{201019,0,1,100},{201020,0,1,1},{201021,0,1,2},{201022,0,1,2},{201023,0,1,2},{201025,0,1,2},{201026,0,1,2},{201027,0,1,2},{201029,0,1,2},{202010,0,1,100},{202011,0,1,100},{202012,0,1,100},{202013,0,1,100},{202015,0,1,100},{202016,0,1,100},{202017,0,1,100},{202019,0,1,100},{202020,0,1,1},{202021,0,1,2},{202022,0,1,2},{202023,0,1,2},{202025,0,1,2},{202026,0,1,2},{202027,0,1,2}, | AT50: 202027 | AU50: 天尊腰带 | AV50: 1 | AW50: 0 | AX50: 1 | AY50: 3 | AZ50: ="{"&RC[-6]&","&RC[-3]&","&RC[-2]&","&RC[-1]&"}," -> {202027,0,1,3}, | BA50: =R[-1]C&RC[-1] -> {200010,0,1,80},{200011,0,1,80},{200012,0,1,80},{200013,0,1,80},{200015,0,1,80},{200016,0,1,80},{200017,0,1,80},{200019,0,1,80},{200020,0,1,1},{200021,0,1,3},{200022,0,1,3},{200023,0,1,3},{200025,0,1,3},{200026,0,1,3},{200027,0,1,3},{200029,0,1,3},{201010,0,1,80},{201011,0,1,80},{201012,0,1,80},{201013,0,1,80},{201015,0,1,80},{201016,0,1,80},{201017,0,1,80},{201019,0,1,80},{201020,0,1,1},{201021,0,1,3},{201022,0,1,3},{201023,0,1,3},{201025,0,1,3},{201026,0,1,3},{201027,0,1,3},{201029,0,1,3},{202010,0,1,80},{202011,0,1,80},{202012,0,1,80},{202013,0,1,80},{202015,0,1,80},{202016,0,1,80},{202017,0,1,80},{202019,0,1,80},{202020,0,1,1},{202021,0,1,3},{202022,0,1,3},{202023,0,1,3},{202025,0,1,3},{202026,0,1,3},{202027,0,1,3}, | BC50: 202027 | BD50: 天尊腰带 | BE50: 1 | BF50: 0 | BG50: 1 | BH50: 5 | BI50: ="{"&RC[-6]&","&RC[-3]&","&RC[-2]&","&RC[-1]&"}," -> {202027,0,1,5}, | BJ50: =R[-1]C&RC[-1] -> {200010,0,1,60},{200011,0,1,60},{200012,0,1,60},{200013,0,1,60},{200015,0,1,60},{200016,0,1,60},{200017,0,1,60},{200019,0,1,60},{200020,0,1,1},{200021,0,1,5},{200022,0,1,5},{200023,0,1,5},{200025,0,1,5},{200026,0,1,5},{200027,0,1,5},{200029,0,1,5},{201010,0,1,60},{201011,0,1,60},{201012,0,1,60},{201013,0,1,60},{201015,0,1,60},{201016,0,1,60},{201017,0,1,60},{201019,0,1,60},{201020,0,1,1},{201021,0,1,5},{201022,0,1,5},{201023,0,1,5},{201025,0,1,5},{201026,0,1,5},{201027,0,1,5},{201029,0,1,5},{202010,0,1,60},{202011,0,1,60},{202012,0,1,60},{202013,0,1,60},{202015,0,1,60},{202016,0,1,60},{202017,0,1,60},{202019,0,1,60},{202020,0,1,1},{202021,0,1,5},{202022,0,1,5},{202023,0,1,5},{202025,0,1,5},{202026,0,1,5},{202027,0,1,5},
S51: 110012 | T51: 普通首饰碎片 | V51: 1 | W51: 1 | X51: 0 | Y51: ="{"&RC[-6]&","&RC[-3]&","&RC[-2]&","&RC[-1]&"}" -> {110012,1,1,0} | Z51: =R[-1]C&RC[-1] -> {110002,1,2,2},{110003,1,2,2},{110004,1,1,3},{110005,1,1,3},{110010,1,1,0},{110011,1,1,0},{110012,1,1,0} | AB51: 110012 | AC51: 普通首饰碎片 | AE51: 0 | AF51: 1 | AG51: 0 | AH51: ="{"&RC[-6]&","&RC[-3]&","&RC[-2]&","&RC[-1]&"}" -> {110012,0,1,0} | AI51: =R[-1]C&RC[-1] -> {110002,0,2,2},{110003,0,2,2},{110004,0,1,3},{110005,0,1,3},{110010,0,1,0},{110011,0,1,0},{110012,0,1,0} | AK51: 202029 | AL51: 天尊鞋子 | AM51: 1 | AN51: 0 | AO51: 1 | AP51: 2 | AQ51: ="{"&RC[-6]&","&RC[-3]&","&RC[-2]&","&RC[-1]&"}," -> {202029,0,1,2}, | AR51: =R[-1]C&RC[-1] -> {200010,0,1,100},{200011,0,1,100},{200012,0,1,100},{200013,0,1,100},{200015,0,1,100},{200016,0,1,100},{200017,0,1,100},{200019,0,1,100},{200020,0,1,1},{200021,0,1,2},{200022,0,1,2},{200023,0,1,2},{200025,0,1,2},{200026,0,1,2},{200027,0,1,2},{200029,0,1,2},{201010,0,1,100},{201011,0,1,100},{201012,0,1,100},{201013,0,1,100},{201015,0,1,100},{201016,0,1,100},{201017,0,1,100},{201019,0,1,100},{201020,0,1,1},{201021,0,1,2},{201022,0,1,2},{201023,0,1,2},{201025,0,1,2},{201026,0,1,2},{201027,0,1,2},{201029,0,1,2},{202010,0,1,100},{202011,0,1,100},{202012,0,1,100},{202013,0,1,100},{202015,0,1,100},{202016,0,1,100},{202017,0,1,100},{202019,0,1,100},{202020,0,1,1},{202021,0,1,2},{202022,0,1,2},{202023,0,1,2},{202025,0,1,2},{202026,0,1,2},{202027,0,1,2},{202029,0,1,2}, | AT51: 202029 | AU51: 天尊鞋子 | AV51: 1 | AW51: 0 | AX51: 1 | AY51: 3 | AZ51: ="{"&RC[-6]&","&RC[-3]&","&RC[-2]&","&RC[-1]&"}," -> {202029,0,1,3}, | BA51: =R[-1]C&RC[-1] -> {200010,0,1,80},{200011,0,1,80},{200012,0,1,80},{200013,0,1,80},{200015,0,1,80},{200016,0,1,80},{200017,0,1,80},{200019,0,1,80},{200020,0,1,1},{200021,0,1,3},{200022,0,1,3},{200023,0,1,3},{200025,0,1,3},{200026,0,1,3},{200027,0,1,3},{200029,0,1,3},{201010,0,1,80},{201011,0,1,80},{201012,0,1,80},{201013,0,1,80},{201015,0,1,80},{201016,0,1,80},{201017,0,1,80},{201019,0,1,80},{201020,0,1,1},{201021,0,1,3},{201022,0,1,3},{201023,0,1,3},{201025,0,1,3},{201026,0,1,3},{201027,0,1,3},{201029,0,1,3},{202010,0,1,80},{202011,0,1,80},{202012,0,1,80},{202013,0,1,80},{202015,0,1,80},{202016,0,1,80},{202017,0,1,80},{202019,0,1,80},{202020,0,1,1},{202021,0,1,3},{202022,0,1,3},{202023,0,1,3},{202025,0,1,3},{202026,0,1,3},{202027,0,1,3},{202029,0,1,3}, | BC51: 202029 | BD51: 天尊鞋子 | BE51: 1 | BF51: 0 | BG51: 1 | BH51: 5 | BI51: ="{"&RC[-6]&","&RC[-3]&","&RC[-2]&","&RC[-1]&"}," -> {202029,0,1,5}, | BJ51: =R[-1]C&RC[-1] -> {200010,0,1,60},{200011,0,1,60},{200012,0,1,60},{200013,0,1,60},{200015,0,1,60},{200016,0,1,60},{200017,0,1,60},{200019,0,1,60},{200020,0,1,1},{200021,0,1,5},{200022,0,1,5},{200023,0,1,5},{200025,0,1,5},{200026,0,1,5},{200027,0,1,5},{200029,0,1,5},{201010,0,1,60},{201011,0,1,60},{201012,0,1,60},{201013,0,1,60},{201015,0,1,60},{201016,0,1,60},{201017,0,1,60},{201019,0,1,60},{201020,0,1,1},{201021,0,1,5},{201022,0,1,5},{201023,0,1,5},{201025,0,1,5},{201026,0,1,5},{201027,0,1,5},{201029,0,1,5},{202010,0,1,60},{202011,0,1,60},{202012,0,1,60},{202013,0,1,60},{202015,0,1,60},{202016,0,1,60},{202017,0,1,60},{202019,0,1,60},{202020,0,1,1},{202021,0,1,5},{202022,0,1,5},{202023,0,1,5},{202025,0,1,5},{202026,0,1,5},{202027,0,1,5},{202029,0,1,5},
AK52: 305003 | AL52: 怒斩 | AM52: 1 | AN52: 0 | AO52: 1 | AP52: 2 | AQ52: ="{"&RC[-6]&","&RC[-3]&","&RC[-2]&","&RC[-1]&"}," -> {305003,0,1,2}, | AR52: =R[-1]C&RC[-1] -> {200010,0,1,100},{200011,0,1,100},{200012,0,1,100},{200013,0,1,100},{200015,0,1,100},{200016,0,1,100},{200017,0,1,100},{200019,0,1,100},{200020,0,1,1},{200021,0,1,2},{200022,0,1,2},{200023,0,1,2},{200025,0,1,2},{200026,0,1,2},{200027,0,1,2},{200029,0,1,2},{201010,0,1,100},{201011,0,1,100},{201012,0,1,100},{201013,0,1,100},{201015,0,1,100},{201016,0,1,100},{201017,0,1,100},{201019,0,1,100},{201020,0,1,1},{201021,0,1,2},{201022,0,1,2},{201023,0,1,2},{201025,0,1,2},{201026,0,1,2},{201027,0,1,2},{201029,0,1,2},{202010,0,1,100},{202011,0,1,100},{202012,0,1,100},{202013,0,1,100},{202015,0,1,100},{202016,0,1,100},{202017,0,1,100},{202019,0,1,100},{202020,0,1,1},{202021,0,1,2},{202022,0,1,2},{202023,0,1,2},{202025,0,1,2},{202026,0,1,2},{202027,0,1,2},{202029,0,1,2},{305003,0,1,2}, | AT52: 305003 | AU52: 怒斩 | AV52: 1 | AW52: 0 | AX52: 1 | AY52: 2 | AZ52: ="{"&RC[-6]&","&RC[-3]&","&RC[-2]&","&RC[-1]&"}," -> {305003,0,1,2}, | BA52: =R[-1]C&RC[-1] -> {200010,0,1,80},{200011,0,1,80},{200012,0,1,80},{200013,0,1,80},{200015,0,1,80},{200016,0,1,80},{200017,0,1,80},{200019,0,1,80},{200020,0,1,1},{200021,0,1,3},{200022,0,1,3},{200023,0,1,3},{200025,0,1,3},{200026,0,1,3},{200027,0,1,3},{200029,0,1,3},{201010,0,1,80},{201011,0,1,80},{201012,0,1,80},{201013,0,1,80},{201015,0,1,80},{201016,0,1,80},{201017,0,1,80},{201019,0,1,80},{201020,0,1,1},{201021,0,1,3},{201022,0,1,3},{201023,0,1,3},{201025,0,1,3},{201026,0,1,3},{201027,0,1,3},{201029,0,1,3},{202010,0,1,80},{202011,0,1,80},{202012,0,1,80},{202013,0,1,80},{202015,0,1,80},{202016,0,1,80},{202017,0,1,80},{202019,0,1,80},{202020,0,1,1},{202021,0,1,3},{202022,0,1,3},{202023,0,1,3},{202025,0,1,3},{202026,0,1,3},{202027,0,1,3},{202029,0,1,3},{305003,0,1,2}, | BC52: 305003 | BD52: 怒斩 | BE52: 1 | BF52: 0 | BG52: 1 | BH52: 2 | BI52: ="{"&RC[-6]&","&RC[-3]&","&RC[-2]&","&RC[-1]&"}," -> {305003,0,1,2}, | BJ52: =R[-1]C&RC[-1] -> {200010,0,1,60},{200011,0,1,60},{200012,0,1,60},{200013,0,1,60},{200015,0,1,60},{200016,0,1,60},{200017,0,1,60},{200019,0,1,60},{200020,0,1,1},{200021,0,1,5},{200022,0,1,5},{200023,0,1,5},{200025,0,1,5},{200026,0,1,5},{200027,0,1,5},{200029,0,1,5},{201010,0,1,60},{201011,0,1,60},{201012,0,1,60},{201013,0,1,60},{201015,0,1,60},{201016,0,1,60},{201017,0,1,60},{201019,0,1,60},{201020,0,1,1},{201021,0,1,5},{201022,0,1,5},{201023,0,1,5},{201025,0,1,5},{201026,0,1,5},{201027,0,1,5},{201029,0,1,5},{202010,0,1,60},{202011,0,1,60},{202012,0,1,60},{202013,0,1,60},{202015,0,1,60},{202016,0,1,60},{202017,0,1,60},{202019,0,1,60},{202020,0,1,1},{202021,0,1,5},{202022,0,1,5},{202023,0,1,5},{202025,0,1,5},{202026,0,1,5},{202027,0,1,5},{202029,0,1,5},{305003,0,1,2},
AK53: 305004 | AL53: 龙牙 | AM53: 1 | AN53: 0 | AO53: 1 | AP53: 2 | AQ53: ="{"&RC[-6]&","&RC[-3]&","&RC[-2]&","&RC[-1]&"}," -> {305004,0,1,2}, | AR53: =R[-1]C&RC[-1] -> {200010,0,1,100},{200011,0,1,100},{200012,0,1,100},{200013,0,1,100},{200015,0,1,100},{200016,0,1,100},{200017,0,1,100},{200019,0,1,100},{200020,0,1,1},{200021,0,1,2},{200022,0,1,2},{200023,0,1,2},{200025,0,1,2},{200026,0,1,2},{200027,0,1,2},{200029,0,1,2},{201010,0,1,100},{201011,0,1,100},{201012,0,1,100},{201013,0,1,100},{201015,0,1,100},{201016,0,1,100},{201017,0,1,100},{201019,0,1,100},{201020,0,1,1},{201021,0,1,2},{201022,0,1,2},{201023,0,1,2},{201025,0,1,2},{201026,0,1,2},{201027,0,1,2},{201029,0,1,2},{202010,0,1,100},{202011,0,1,100},{202012,0,1,100},{202013,0,1,100},{202015,0,1,100},{202016,0,1,100},{202017,0,1,100},{202019,0,1,100},{202020,0,1,1},{202021,0,1,2},{202022,0,1,2},{202023,0,1,2},{202025,0,1,2},{202026,0,1,2},{202027,0,1,2},{202029,0,1,2},{305003,0,1,2},{305004,0,1,2}, | AT53: 305004 | AU53: 龙牙 | AV53: 1 | AW53: 0 | AX53: 1 | AY53: 2 | AZ53: ="{"&RC[-6]&","&RC[-3]&","&RC[-2]&","&RC[-1]&"}," -> {305004,0,1,2}, | BA53: =R[-1]C&RC[-1] -> {200010,0,1,80},{200011,0,1,80},{200012,0,1,80},{200013,0,1,80},{200015,0,1,80},{200016,0,1,80},{200017,0,1,80},{200019,0,1,80},{200020,0,1,1},{200021,0,1,3},{200022,0,1,3},{200023,0,1,3},{200025,0,1,3},{200026,0,1,3},{200027,0,1,3},{200029,0,1,3},{201010,0,1,80},{201011,0,1,80},{201012,0,1,80},{201013,0,1,80},{201015,0,1,80},{201016,0,1,80},{201017,0,1,80},{201019,0,1,80},{201020,0,1,1},{201021,0,1,3},{201022,0,1,3},{201023,0,1,3},{201025,0,1,3},{201026,0,1,3},{201027,0,1,3},{201029,0,1,3},{202010,0,1,80},{202011,0,1,80},{202012,0,1,80},{202013,0,1,80},{202015,0,1,80},{202016,0,1,80},{202017,0,1,80},{202019,0,1,80},{202020,0,1,1},{202021,0,1,3},{202022,0,1,3},{202023,0,1,3},{202025,0,1,3},{202026,0,1,3},{202027,0,1,3},{202029,0,1,3},{305003,0,1,2},{305004,0,1,2}, | BC53: 305004 | BD53: 龙牙 | BE53: 1 | BF53: 0 | BG53: 1 | BH53: 2 | BI53: ="{"&RC[-6]&","&RC[-3]&","&RC[-2]&","&RC[-1]&"}," -> {305004,0,1,2}, | BJ53: =R[-1]C&RC[-1] -> {200010,0,1,60},{200011,0,1,60},{200012,0,1,60},{200013,0,1,60},{200015,0,1,60},{200016,0,1,60},{200017,0,1,60},{200019,0,1,60},{200020,0,1,1},{200021,0,1,5},{200022,0,1,5},{200023,0,1,5},{200025,0,1,5},{200026,0,1,5},{200027,0,1,5},{200029,0,1,5},{201010,0,1,60},{201011,0,1,60},{201012,0,1,60},{201013,0,1,60},{201015,0,1,60},{201016,0,1,60},{201017,0,1,60},{201019,0,1,60},{201020,0,1,1},{201021,0,1,5},{201022,0,1,5},{201023,0,1,5},{201025,0,1,5},{201026,0,1,5},{201027,0,1,5},{201029,0,1,5},{202010,0,1,60},{202011,0,1,60},{202012,0,1,60},{202013,0,1,60},{202015,0,1,60},{202016,0,1,60},{202017,0,1,60},{202019,0,1,60},{202020,0,1,1},{202021,0,1,5},{202022,0,1,5},{202023,0,1,5},{202025,0,1,5},{202026,0,1,5},{202027,0,1,5},{202029,0,1,5},{305003,0,1,2},{305004,0,1,2},
S54: BOSS怪掉落 | X54: 装备 | Y54: 概率／100 | AB54: BOSS怪掉落 | AG54: 装备 | AH54: 概率／100 | AK54: 305005 | AL54: 逍遥扇 | AM54: 1 | AN54: 0 | AO54: 1 | AP54: 2 | AQ54: ="{"&RC[-6]&","&RC[-3]&","&RC[-2]&","&RC[-1]&"}" -> {305005,0,1,2} | AR54: =R[-1]C&RC[-1] -> {200010,0,1,100},{200011,0,1,100},{200012,0,1,100},{200013,0,1,100},{200015,0,1,100},{200016,0,1,100},{200017,0,1,100},{200019,0,1,100},{200020,0,1,1},{200021,0,1,2},{200022,0,1,2},{200023,0,1,2},{200025,0,1,2},{200026,0,1,2},{200027,0,1,2},{200029,0,1,2},{201010,0,1,100},{201011,0,1,100},{201012,0,1,100},{201013,0,1,100},{201015,0,1,100},{201016,0,1,100},{201017,0,1,100},{201019,0,1,100},{201020,0,1,1},{201021,0,1,2},{201022,0,1,2},{201023,0,1,2},{201025,0,1,2},{201026,0,1,2},{201027,0,1,2},{201029,0,1,2},{202010,0,1,100},{202011,0,1,100},{202012,0,1,100},{202013,0,1,100},{202015,0,1,100},{202016,0,1,100},{202017,0,1,100},{202019,0,1,100},{202020,0,1,1},{202021,0,1,2},{202022,0,1,2},{202023,0,1,2},{202025,0,1,2},{202026,0,1,2},{202027,0,1,2},{202029,0,1,2},{305003,0,1,2},{305004,0,1,2},{305005,0,1,2} | AT54: 305005 | AU54: 逍遥扇 | AV54: 1 | AW54: 0 | AX54: 1 | AY54: 2 | AZ54: ="{"&RC[-6]&","&RC[-3]&","&RC[-2]&","&RC[-1]&"}" -> {305005,0,1,2} | BA54: =R[-1]C&RC[-1] -> {200010,0,1,80},{200011,0,1,80},{200012,0,1,80},{200013,0,1,80},{200015,0,1,80},{200016,0,1,80},{200017,0,1,80},{200019,0,1,80},{200020,0,1,1},{200021,0,1,3},{200022,0,1,3},{200023,0,1,3},{200025,0,1,3},{200026,0,1,3},{200027,0,1,3},{200029,0,1,3},{201010,0,1,80},{201011,0,1,80},{201012,0,1,80},{201013,0,1,80},{201015,0,1,80},{201016,0,1,80},{201017,0,1,80},{201019,0,1,80},{201020,0,1,1},{201021,0,1,3},{201022,0,1,3},{201023,0,1,3},{201025,0,1,3},{201026,0,1,3},{201027,0,1,3},{201029,0,1,3},{202010,0,1,80},{202011,0,1,80},{202012,0,1,80},{202013,0,1,80},{202015,0,1,80},{202016,0,1,80},{202017,0,1,80},{202019,0,1,80},{202020,0,1,1},{202021,0,1,3},{202022,0,1,3},{202023,0,1,3},{202025,0,1,3},{202026,0,1,3},{202027,0,1,3},{202029,0,1,3},{305003,0,1,2},{305004,0,1,2},{305005,0,1,2} | BC54: 305005 | BD54: 逍遥扇 | BE54: 1 | BF54: 0 | BG54: 1 | BH54: 2 | BI54: ="{"&RC[-6]&","&RC[-3]&","&RC[-2]&","&RC[-1]&"}" -> {305005,0,1,2} | BJ54: =R[-1]C&RC[-1] -> {200010,0,1,60},{200011,0,1,60},{200012,0,1,60},{200013,0,1,60},{200015,0,1,60},{200016,0,1,60},{200017,0,1,60},{200019,0,1,60},{200020,0,1,1},{200021,0,1,5},{200022,0,1,5},{200023,0,1,5},{200025,0,1,5},{200026,0,1,5},{200027,0,1,5},{200029,0,1,5},{201010,0,1,60},{201011,0,1,60},{201012,0,1,60},{201013,0,1,60},{201015,0,1,60},{201016,0,1,60},{201017,0,1,60},{201019,0,1,60},{201020,0,1,1},{201021,0,1,5},{201022,0,1,5},{201023,0,1,5},{201025,0,1,5},{201026,0,1,5},{201027,0,1,5},{201029,0,1,5},{202010,0,1,60},{202011,0,1,60},{202012,0,1,60},{202013,0,1,60},{202015,0,1,60},{202016,0,1,60},{202017,0,1,60},{202019,0,1,60},{202020,0,1,1},{202021,0,1,5},{202022,0,1,5},{202023,0,1,5},{202025,0,1,5},{202026,0,1,5},{202027,0,1,5},{202029,0,1,5},{305003,0,1,2},{305004,0,1,2},{305005,0,1,2}
X55: 3 | Y55: 100 | Z55: ="{0,[{"&RC[-2]&","&RC[-1]&"}],["&R[-13]C&"]}" -> {0,[{3,100}],[{200000,0,1,40},{200001,0,1,40},{200002,0,1,40},{200003,0,1,40},{200006,0,1,40},{200010,0,1,5},{200011,0,1,10},{200012,0,1,10},{200013,0,1,10},{200015,0,1,10},{200016,0,1,10},{200017,0,1,10},{200019,0,1,10},{201000,0,1,40},{201001,0,1,40},{201002,0,1,40},{201003,0,1,40},{201006,0,1,40},{201010,0,1,5},{201011,0,1,10},{201012,0,1,10},{201013,0,1,10},{201015,0,1,10},{201016,0,1,10},{201017,0,1,10},{201019,0,1,10},{202000,0,1,40},{202001,0,1,40},{202002,0,1,40},{202003,0,1,40},{202006,0,1,40},{202010,0,1,5},{202011,0,1,10},{202012,0,1,10},{202013,0,1,10},{202015,0,1,10},{202016,0,1,10},{202017,0,1,10},{202019,0,1,10}]} | AG55: 3 | AH55: 100 | AI55: ="{0,[{"&RC[-2]&","&RC[-1]&"}],["&R[-13]C&"]}" -> {0,[{3,100}],[{200000,0,1,40},{200001,0,1,40},{200002,0,1,40},{200003,0,1,40},{200006,0,1,40},{200010,0,1,5},{200011,0,1,10},{200012,0,1,10},{200013,0,1,10},{200015,0,1,10},{200016,0,1,10},{200017,0,1,10},{200019,0,1,10},{201000,0,1,40},{201001,0,1,40},{201002,0,1,40},{201003,0,1,40},{201006,0,1,40},{201010,0,1,5},{201011,0,1,10},{201012,0,1,10},{201013,0,1,10},{201015,0,1,10},{201016,0,1,10},{201017,0,1,10},{201019,0,1,10},{202000,0,1,40},{202001,0,1,40},{202002,0,1,40},{202003,0,1,40},{202006,0,1,40},{202010,0,1,5},{202011,0,1,10},{202012,0,1,10},{202013,0,1,10},{202015,0,1,10},{202016,0,1,10},{202017,0,1,10},{202019,0,1,10}]}
X56: 道具 | Y56: 概率／100 | AG56: 道具 | AH56: 概率／100
X57: 2 | Y57: 100 | Z57: ="{0,[{"&RC[-2]&","&RC[-1]&"}],["&R[-6]C&"]}" -> {0,[{2,100}],[{110002,1,2,2},{110003,1,2,2},{110004,1,1,3},{110005,1,1,3},{110010,1,1,0},{110011,1,1,0},{110012,1,1,0}]} | AG57: 2 | AH57: 100 | AI57: ="{0,[{"&RC[-2]&","&RC[-1]&"}],["&R[-6]C&"]}" -> {0,[{2,100}],[{110002,0,2,2},{110003,0,2,2},{110004,0,1,3},{110005,0,1,3},{110010,0,1,0},{110011,0,1,0},{110012,0,1,0}]} | AK57: 110002 | AL57: 强化石 | AN57: 0 | AO57: 2 | AP57: 2 | AQ57: ="{"&RC[-6]&","&RC[-3]&","&RC[-2]&","&RC[-1]&"}," -> {110002,0,2,2}, | AR57: =RC[-1] -> {110002,0,2,2}, | AT57: 110002 | AU57: 强化石 | AW57: 0 | AX57: 2 | AY57: 2 | AZ57: ="{"&RC[-6]&","&RC[-3]&","&RC[-2]&","&RC[-1]&"}," -> {110002,0,2,2}, | BA57: =RC[-1] -> {110002,0,2,2}, | BC57: 110002 | BD57: 强化石 | BF57: 0 | BG57: 2 | BH57: 2 | BI57: ="{"&RC[-6]&","&RC[-3]&","&RC[-2]&","&RC[-1]&"}," -> {110002,0,2,2}, | BJ57: =RC[-1] -> {110002,0,2,2},
X58: 金币 | Y58: 概率／100 | AG58: 金币 | AH58: 概率／100 | AK58: 110003 | AL58: 洗炼石 | AN58: 0 | AO58: 2 | AP58: 2 | AQ58: ="{"&RC[-6]&","&RC[-3]&","&RC[-2]&","&RC[-1]&"}," -> {110003,0,2,2}, | AR58: =R[-1]C&RC[-1] -> {110002,0,2,2},{110003,0,2,2}, | AT58: 110003 | AU58: 洗炼石 | AW58: 0 | AX58: 2 | AY58: 2 | AZ58: ="{"&RC[-6]&","&RC[-3]&","&RC[-2]&","&RC[-1]&"}," -> {110003,0,2,2}, | BA58: =R[-1]C&RC[-1] -> {110002,0,2,2},{110003,0,2,2}, | BC58: 110003 | BD58: 洗炼石 | BF58: 0 | BG58: 2 | BH58: 2 | BI58: ="{"&RC[-6]&","&RC[-3]&","&RC[-2]&","&RC[-1]&"}," -> {110003,0,2,2}, | BJ58: =R[-1]C&RC[-1] -> {110002,0,2,2},{110003,0,2,2},
X59: 3 | Y59: 100 | Z59: {0,[{10,100}],[{110009,1,1000,1}]} | AG59: 3 | AH59: 100 | AI59: {0,[{10,100}],[{110009,1,1000,1}]} | AK59: 110004 | AL59: 红药 | AN59: 0 | AO59: 1 | AP59: 3 | AQ59: ="{"&RC[-6]&","&RC[-3]&","&RC[-2]&","&RC[-1]&"}," -> {110004,0,1,3}, | AR59: =R[-1]C&RC[-1] -> {110002,0,2,2},{110003,0,2,2},{110004,0,1,3}, | AT59: 110004 | AU59: 红药 | AW59: 0 | AX59: 1 | AY59: 3 | AZ59: ="{"&RC[-6]&","&RC[-3]&","&RC[-2]&","&RC[-1]&"}," -> {110004,0,1,3}, | BA59: =R[-1]C&RC[-1] -> {110002,0,2,2},{110003,0,2,2},{110004,0,1,3}, | BC59: 110004 | BD59: 红药 | BF59: 0 | BG59: 1 | BH59: 3 | BI59: ="{"&RC[-6]&","&RC[-3]&","&RC[-2]&","&RC[-1]&"}," -> {110004,0,1,3}, | BJ59: =R[-1]C&RC[-1] -> {110002,0,2,2},{110003,0,2,2},{110004,0,1,3},
AK60: 110005 | AL60: 蓝药 | AN60: 0 | AO60: 1 | AP60: 3 | AQ60: ="{"&RC[-6]&","&RC[-3]&","&RC[-2]&","&RC[-1]&"}," -> {110005,0,1,3}, | AR60: =R[-1]C&RC[-1] -> {110002,0,2,2},{110003,0,2,2},{110004,0,1,3},{110005,0,1,3}, | AT60: 110005 | AU60: 蓝药 | AW60: 0 | AX60: 1 | AY60: 3 | AZ60: ="{"&RC[-6]&","&RC[-3]&","&RC[-2]&","&RC[-1]&"}," -> {110005,0,1,3}, | BA60: =R[-1]C&RC[-1] -> {110002,0,2,2},{110003,0,2,2},{110004,0,1,3},{110005,0,1,3}, | BC60: 110005 | BD60: 蓝药 | BF60: 0 | BG60: 1 | BH60: 3 | BI60: ="{"&RC[-6]&","&RC[-3]&","&RC[-2]&","&RC[-1]&"}," -> {110005,0,1,3}, | BJ60: =R[-1]C&RC[-1] -> {110002,0,2,2},{110003,0,2,2},{110004,0,1,3},{110005,0,1,3},
Z61: ="["&R[-6]C&","&R[-4]C&","&R[-2]C&"]" -> [{0,[{3,100}],[{200000,0,1,40},{200001,0,1,40},{200002,0,1,40},{200003,0,1,40},{200006,0,1,40},{200010,0,1,5},{200011,0,1,10},{200012,0,1,10},{200013,0,1,10},{200015,0,1,10},{200016,0,1,10},{200017,0,1,10},{200019,0,1,10},{201000,0,1,40},{201001,0,1,40},{201002,0,1,40},{201003,0,1,40},{201006,0,1,40},{201010,0,1,5},{201011,0,1,10},{201012,0,1,10},{201013,0,1,10},{201015,0,1,10},{201016,0,1,10},{201017,0,1,10},{201019,0,1,10},{202000,0,1,40},{202001,0,1,40},{202002,0,1,40},{202003,0,1,40},{202006,0,1,40},{202010,0,1,5},{202011,0,1,10},{202012,0,1,10},{202013,0,1,10},{202015,0,1,10},{202016,0,1,10},{202017,0,1,10},{202019,0,1,10}]},{0,[{2,100}],[{110002,1,2,2},{110003,1,2,2},{110004,1,1,3},{110005,1,1,3},{110010,1,1,0},{110011,1,1,0},{110012,1,1,0}]},{0,[{10,100}],[{110009,1,1000,1}]}] | AI61: ="["&R[-6]C&","&R[-4]C&","&R[-2]C&"]" -> [{0,[{3,100}],[{200000,0,1,40},{200001,0,1,40},{200002,0,1,40},{200003,0,1,40},{200006,0,1,40},{200010,0,1,5},{200011,0,1,10},{200012,0,1,10},{200013,0,1,10},{200015,0,1,10},{200016,0,1,10},{200017,0,1,10},{200019,0,1,10},{201000,0,1,40},{201001,0,1,40},{201002,0,1,40},{201003,0,1,40},{201006,0,1,40},{201010,0,1,5},{201011,0,1,10},{201012,0,1,10},{201013,0,1,10},{201015,0,1,10},{201016,0,1,10},{201017,0,1,10},{201019,0,1,10},{202000,0,1,40},{202001,0,1,40},{202002,0,1,40},{202003,0,1,40},{202006,0,1,40},{202010,0,1,5},{202011,0,1,10},{202012,0,1,10},{202013,0,1,10},{202015,0,1,10},{202016,0,1,10},{202017,0,1,10},{202019,0,1,10}]},{0,[{2,100}],[{110002,0,2,2},{110003,0,2,2},{110004,0,1,3},{110005,0,1,3},{110010,0,1,0},{110011,0,1,0},{110012,0,1,0}]},{0,[{10,100}],[{110009,1,1000,1}]}] | AK61: 110010 | AL61: 普通武装碎片 | AN61: 0 | AO61: 1 | AP61: 0 | AQ61: ="{"&RC[-6]&","&RC[-3]&","&RC[-2]&","&RC[-1]&"}," -> {110010,0,1,0}, | AR61: =R[-1]C&RC[-1] -> {110002,0,2,2},{110003,0,2,2},{110004,0,1,3},{110005,0,1,3},{110010,0,1,0}, | AT61: 110010 | AU61: 普通武装碎片 | AW61: 0 | AX61: 1 | AY61: 0 | AZ61: ="{"&RC[-6]&","&RC[-3]&","&RC[-2]&","&RC[-1]&"}," -> {110010,0,1,0}, | BA61: =R[-1]C&RC[-1] -> {110002,0,2,2},{110003,0,2,2},{110004,0,1,3},{110005,0,1,3},{110010,0,1,0}, | BC61: 110010 | BD61: 普通武装碎片 | BF61: 0 | BG61: 1 | BH61: 0 | BI61: ="{"&RC[-6]&","&RC[-3]&","&RC[-2]&","&RC[-1]&"}," -> {110010,0,1,0}, | BJ61: =R[-1]C&RC[-1] -> {110002,0,2,2},{110003,0,2,2},{110004,0,1,3},{110005,0,1,3},{110010,0,1,0},
AK62: 110011 | AL62: 普通防具碎片 | AN62: 0 | AO62: 1 | AP62: 0 | AQ62: ="{"&RC[-6]&","&RC[-3]&","&RC[-2]&","&RC[-1]&"}," -> {110011,0,1,0}, | AR62: =R[-1]C&RC[-1] -> {110002,0,2,2},{110003,0,2,2},{110004,0,1,3},{110005,0,1,3},{110010,0,1,0},{110011,0,1,0}, | AT62: 110011 | AU62: 普通防具碎片 | AW62: 0 | AX62: 1 | AY62: 0 | AZ62: ="{"&RC[-6]&","&RC[-3]&","&RC[-2]&","&RC[-1]&"}," -> {110011,0,1,0}, | BA62: =R[-1]C&RC[-1] -> {110002,0,2,2},{110003,0,2,2},{110004,0,1,3},{110005,0,1,3},{110010,0,1,0},{110011,0,1,0}, | BC62: 110011 | BD62: 普通防具碎片 | BF62: 0 | BG62: 1 | BH62: 0 | BI62: ="{"&RC[-6]&","&RC[-3]&","&RC[-2]&","&RC[-1]&"}," -> {110011,0,1,0}, | BJ62: =R[-1]C&RC[-1] -> {110002,0,2,2},{110003,0,2,2},{110004,0,1,3},{110005,0,1,3},{110010,0,1,0},{110011,0,1,0},
AK63: 110012 | AL63: 普通首饰碎片 | AN63: 0 | AO63: 1 | AP63: 0 | AQ63: ="{"&RC[-6]&","&RC[-3]&","&RC[-2]&","&RC[-1]&"}" -> {110012,0,1,0} | AR63: =R[-1]C&RC[-1] -> {110002,0,2,2},{110003,0,2,2},{110004,0,1,3},{110005,0,1,3},{110010,0,1,0},{110011,0,1,0},{110012,0,1,0} | AT63: 110012 | AU63: 普通首饰碎片 | AW63: 0 | AX63: 1 | AY63: 0 | AZ63: ="{"&RC[-6]&","&RC[-3]&","&RC[-2]&","&RC[-1]&"}" -> {110012,0,1,0} | BA63: =R[-1]C&RC[-1] -> {110002,0,2,2},{110003,0,2,2},{110004,0,1,3},{110005,0,1,3},{110010,0,1,0},{110011,0,1,0},{110012,0,1,0} | BC63: 110012 | BD63: 普通首饰碎片 | BF63: 0 | BG63: 1 | BH63: 0 | BI63: ="{"&RC[-6]&","&RC[-3]&","&RC[-2]&","&RC[-1]&"}" -> {110012,0,1,0} | BJ63: =R[-1]C&RC[-1] -> {110002,0,2,2},{110003,0,2,2},{110004,0,1,3},{110005,0,1,3},{110010,0,1,0},{110011,0,1,0},{110012,0,1,0}
AK66: BOSS怪掉落 | AP66: 装备 | AQ66: 概率／100 | AT66: BOSS怪掉落 | AY66: 装备 | AZ66: 概率／100 | BC66: BOSS怪掉落 | BH66: 装备 | BI66: 概率／100
AP67: 3 | AQ67: 100 | AR67: ="{0,[{"&RC[-2]&","&RC[-1]&"}],["&R[-13]C&"]}" -> {0,[{3,100}],[{200010,0,1,100},{200011,0,1,100},{200012,0,1,100},{200013,0,1,100},{200015,0,1,100},{200016,0,1,100},{200017,0,1,100},{200019,0,1,100},{200020,0,1,1},{200021,0,1,2},{200022,0,1,2},{200023,0,1,2},{200025,0,1,2},{200026,0,1,2},{200027,0,1,2},{200029,0,1,2},{201010,0,1,100},{201011,0,1,100},{201012,0,1,100},{201013,0,1,100},{201015,0,1,100},{201016,0,1,100},{201017,0,1,100},{201019,0,1,100},{201020,0,1,1},{201021,0,1,2},{201022,0,1,2},{201023,0,1,2},{201025,0,1,2},{201026,0,1,2},{201027,0,1,2},{201029,0,1,2},{202010,0,1,100},{202011,0,1,100},{202012,0,1,100},{202013,0,1,100},{202015,0,1,100},{202016,0,1,100},{202017,0,1,100},{202019,0,1,100},{202020,0,1,1},{202021,0,1,2},{202022,0,1,2},{202023,0,1,2},{202025,0,1,2},{202026,0,1,2},{202027,0,1,2},{202029,0,1,2},{305003,0,1,2},{305004,0,1,2},{305005,0,1,2}]} | AY67: 3 | AZ67: 100 | BA67: ="{0,[{"&RC[-2]&","&RC[-1]&"}],["&R[-13]C&"]}" -> {0,[{3,100}],[{200010,0,1,80},{200011,0,1,80},{200012,0,1,80},{200013,0,1,80},{200015,0,1,80},{200016,0,1,80},{200017,0,1,80},{200019,0,1,80},{200020,0,1,1},{200021,0,1,3},{200022,0,1,3},{200023,0,1,3},{200025,0,1,3},{200026,0,1,3},{200027,0,1,3},{200029,0,1,3},{201010,0,1,80},{201011,0,1,80},{201012,0,1,80},{201013,0,1,80},{201015,0,1,80},{201016,0,1,80},{201017,0,1,80},{201019,0,1,80},{201020,0,1,1},{201021,0,1,3},{201022,0,1,3},{201023,0,1,3},{201025,0,1,3},{201026,0,1,3},{201027,0,1,3},{201029,0,1,3},{202010,0,1,80},{202011,0,1,80},{202012,0,1,80},{202013,0,1,80},{202015,0,1,80},{202016,0,1,80},{202017,0,1,80},{202019,0,1,80},{202020,0,1,1},{202021,0,1,3},{202022,0,1,3},{202023,0,1,3},{202025,0,1,3},{202026,0,1,3},{202027,0,1,3},{202029,0,1,3},{305003,0,1,2},{305004,0,1,2},{305005,0,1,2}]} | BH67: 3 | BI67: 100 | BJ67: ="{0,[{"&RC[-2]&","&RC[-1]&"}],["&R[-13]C&"]}" -> {0,[{3,100}],[{200010,0,1,60},{200011,0,1,60},{200012,0,1,60},{200013,0,1,60},{200015,0,1,60},{200016,0,1,60},{200017,0,1,60},{200019,0,1,60},{200020,0,1,1},{200021,0,1,5},{200022,0,1,5},{200023,0,1,5},{200025,0,1,5},{200026,0,1,5},{200027,0,1,5},{200029,0,1,5},{201010,0,1,60},{201011,0,1,60},{201012,0,1,60},{201013,0,1,60},{201015,0,1,60},{201016,0,1,60},{201017,0,1,60},{201019,0,1,60},{201020,0,1,1},{201021,0,1,5},{201022,0,1,5},{201023,0,1,5},{201025,0,1,5},{201026,0,1,5},{201027,0,1,5},{201029,0,1,5},{202010,0,1,60},{202011,0,1,60},{202012,0,1,60},{202013,0,1,60},{202015,0,1,60},{202016,0,1,60},{202017,0,1,60},{202019,0,1,60},{202020,0,1,1},{202021,0,1,5},{202022,0,1,5},{202023,0,1,5},{202025,0,1,5},{202026,0,1,5},{202027,0,1,5},{202029,0,1,5},{305003,0,1,2},{305004,0,1,2},{305005,0,1,2}]}
AP68: 道具 | AQ68: 概率／100 | AY68: 道具 | AZ68: 概率／100 | BH68: 道具 | BI68: 概率／100
AP69: 2 | AQ69: 100 | AR69: ="{0,[{"&RC[-2]&","&RC[-1]&"}],["&R[-6]C&"]}" -> {0,[{2,100}],[{110002,0,2,2},{110003,0,2,2},{110004,0,1,3},{110005,0,1,3},{110010,0,1,0},{110011,0,1,0},{110012,0,1,0}]} | AY69: 2 | AZ69: 100 | BA69: ="{0,[{"&RC[-2]&","&RC[-1]&"}],["&R[-6]C&"]}" -> {0,[{2,100}],[{110002,0,2,2},{110003,0,2,2},{110004,0,1,3},{110005,0,1,3},{110010,0,1,0},{110011,0,1,0},{110012,0,1,0}]} | BH69: 2 | BI69: 100 | BJ69: ="{0,[{"&RC[-2]&","&RC[-1]&"}],["&R[-6]C&"]}" -> {0,[{2,100}],[{110002,0,2,2},{110003,0,2,2},{110004,0,1,3},{110005,0,1,3},{110010,0,1,0},{110011,0,1,0},{110012,0,1,0}]}
AP70: 金币 | AQ70: 概率／100 | AY70: 金币 | AZ70: 概率／100 | BH70: 金币 | BI70: 概率／100
AP71: 3 | AQ71: 100 | AR71: {0,[{10,100}],[{110009,1,1000,1}]} | AY71: 3 | AZ71: 100 | BA71: {0,[{10,100}],[{110009,1,1000,1}]} | BH71: 3 | BI71: 100 | BJ71: {0,[{10,100}],[{110009,1,1000,1}]}
AR73: ="["&R[-6]C&","&R[-4]C&","&R[-2]C&"]" -> [{0,[{3,100}],[{200010,0,1,100},{200011,0,1,100},{200012,0,1,100},{200013,0,1,100},{200015,0,1,100},{200016,0,1,100},{200017,0,1,100},{200019,0,1,100},{200020,0,1,1},{200021,0,1,2},{200022,0,1,2},{200023,0,1,2},{200025,0,1,2},{200026,0,1,2},{200027,0,1,2},{200029,0,1,2},{201010,0,1,100},{201011,0,1,100},{201012,0,1,100},{201013,0,1,100},{201015,0,1,100},{201016,0,1,100},{201017,0,1,100},{201019,0,1,100},{201020,0,1,1},{201021,0,1,2},{201022,0,1,2},{201023,0,1,2},{201025,0,1,2},{201026,0,1,2},{201027,0,1,2},{201029,0,1,2},{202010,0,1,100},{202011,0,1,100},{202012,0,1,100},{202013,0,1,100},{202015,0,1,100},{202016,0,1,100},{202017,0,1,100},{202019,0,1,100},{202020,0,1,1},{202021,0,1,2},{202022,0,1,2},{202023,0,1,2},{202025,0,1,2},{202026,0,1,2},{202027,0,1,2},{202029,0,1,2},{305003,0,1,2},{305004,0,1,2},{305005,0,1,2}]},{0,[{2,100}],[{110002,0,2,2},{110003,0,2,2},{110004,0,1,3},{110005,0,1,3},{110010,0,1,0},{110011,0,1,0},{110012,0,1,0}]},{0,[{10,100}],[{110009,1,1000,1}]}] | BA73: ="["&R[-6]C&","&R[-4]C&","&R[-2]C&"]" -> [{0,[{3,100}],[{200010,0,1,80},{200011,0,1,80},{200012,0,1,80},{200013,0,1,80},{200015,0,1,80},{200016,0,1,80},{200017,0,1,80},{200019,0,1,80},{200020,0,1,1},{200021,0,1,3},{200022,0,1,3},{200023,0,1,3},{200025,0,1,3},{200026,0,1,3},{200027,0,1,3},{200029,0,1,3},{201010,0,1,80},{201011,0,1,80},{201012,0,1,80},{201013,0,1,80},{201015,0,1,80},{201016,0,1,80},{201017,0,1,80},{201019,0,1,80},{201020,0,1,1},{201021,0,1,3},{201022,0,1,3},{201023,0,1,3},{201025,0,1,3},{201026,0,1,3},{201027,0,1,3},{201029,0,1,3},{202010,0,1,80},{202011,0,1,80},{202012,0,1,80},{202013,0,1,80},{202015,0,1,80},{202016,0,1,80},{202017,0,1,80},{202019,0,1,80},{202020,0,1,1},{202021,0,1,3},{202022,0,1,3},{202023,0,1,3},{202025,0,1,3},{202026,0,1,3},{202027,0,1,3},{202029,0,1,3},{305003,0,1,2},{305004,0,1,2},{305005,0,1,2}]},{0,[{2,100}],[{110002,0,2,2},{110003,0,2,2},{110004,0,1,3},{110005,0,1,3},{110010,0,1,0},{110011,0,1,0},{110012,0,1,0}]},{0,[{10,100}],[{110009,1,1000,1}]}] | BJ73: ="["&R[-6]C&","&R[-4]C&","&R[-2]C&"]" -> [{0,[{3,100}],[{200010,0,1,60},{200011,0,1,60},{200012,0,1,60},{200013,0,1,60},{200015,0,1,60},{200016,0,1,60},{200017,0,1,60},{200019,0,1,60},{200020,0,1,1},{200021,0,1,5},{200022,0,1,5},{200023,0,1,5},{200025,0,1,5},{200026,0,1,5},{200027,0,1,5},{200029,0,1,5},{201010,0,1,60},{201011,0,1,60},{201012,0,1,60},{201013,0,1,60},{201015,0,1,60},{201016,0,1,60},{201017,0,1,60},{201019,0,1,60},{201020,0,1,1},{201021,0,1,5},{201022,0,1,5},{201023,0,1,5},{201025,0,1,5},{201026,0,1,5},{201027,0,1,5},{201029,0,1,5},{202010,0,1,60},{202011,0,1,60},{202012,0,1,60},{202013,0,1,60},{202015,0,1,60},{202016,0,1,60},{202017,0,1,60},{202019,0,1,60},{202020,0,1,1},{202021,0,1,5},{202022,0,1,5},{202023,0,1,5},{202025,0,1,5},{202026,0,1,5},{202027,0,1,5},{202029,0,1,5},{305003,0,1,2},{305004,0,1,2},{305005,0,1,2}]},{0,[{2,100}],[{110002,0,2,2},{110003,0,2,2},{110004,0,1,3},{110005,0,1,3},{110010,0,1,0},{110011,0,1,0},{110012,0,1,0}]},{0,[{10,100}],[{110009,1,1000,1}]}]

Sheet: 世界BOSS
A1: 打宝BOSS掉落
A2: 15级BOSS（1-10级装备掉落） | J2: 20级BOSS（1-30级装备掉落） | S2: 30级BOSS（1-30级装备掉落） | AB2: 35级BOSS（1-30级装备掉落+首冲武器） | AK2: 40级BOSS（1-35级装备掉落+首冲武器） | AT2: 45级BOSS（15-40级装备掉落） | BC2: 50级BOSS（15-40级装备掉落）
A3: ID | B3: 名称 | C3: 品质 | D3: 是否绑定 | E3: 数量 | F3: 概率 | J3: ID | K3: 名称 | L3: 品质 | M3: 是否绑定 | N3: 数量 | S3: ID | T3: 名称 | U3: 品质 | V3: 是否绑定 | W3: 数量 | AB3: ID | AC3: 名称 | AD3: 品质 | AE3: 是否绑定 | AF3: 数量 | AK3: ID | AL3: 名称 | AM3: 品质 | AN3: 是否绑定 | AO3: 数量 | AT3: ID | AU3: 名称 | AV3: 品质 | AW3: 是否绑定 | AX3: 数量 | BC3: ID | BD3: 名称 | BE3: 品质 | BF3: 是否绑定 | BG3: 数量
A4: 200000 | B4: 八荒 | C4: 1 | D4: 0 | E4: 1 | F4: 100 | G4: ="{"&RC[-6]&","&RC[-3]&","&RC[-2]&","&RC[-1]&"}," -> {200000,0,1,100}, | H4: =RC[-1] -> {200000,0,1,100}, | J4: 200000 | K4: 八荒 | L4: 1 | M4: 0 | N4: 1 | O4: 30 | P4: ="{"&RC[-6]&","&RC[-3]&","&RC[-2]&","&RC[-1]&"}," -> {200000,0,1,30}, | Q4: =RC[-1] -> {200000,0,1,30}, | S4: 200000 | T4: 八荒 | U4: 1 | V4: 0 | W4: 1 | X4: 30 | Y4: ="{"&RC[-6]&","&RC[-3]&","&RC[-2]&","&RC[-1]&"}," -> {200000,0,1,30}, | Z4: =RC[-1] -> {200000,0,1,30}, | AB4: 200000 | AC4: 八荒 | AD4: 1 | AE4: 0 | AF4: 1 | AG4: 30 | AH4: ="{"&RC[-6]&","&RC[-3]&","&RC[-2]&","&RC[-1]&"}," -> {200000,0,1,30}, | AI4: =RC[-1] -> {200000,0,1,30}, | AK4: 200010 | AL4: 炼狱 | AM4: 1 | AN4: 0 | AO4: 1 | AP4: 40 | AQ4: ="{"&RC[-6]&","&RC[-3]&","&RC[-2]&","&RC[-1]&"}," -> {200010,0,1,40}, | AR4: =RC[-1] -> {200010,0,1,40}, | AT4: 200010 | AU4: 炼狱 | AV4: 1 | AW4: 0 | AX4: 1 | AY4: 30 | AZ4: ="{"&RC[-6]&","&RC[-3]&","&RC[-2]&","&RC[-1]&"}," -> {200010,0,1,30}, | BA4: =RC[-1] -> {200010,0,1,30}, | BC4: 200010 | BD4: 炼狱 | BE4: 1 | BF4: 0 | BG4: 1 | BH4: 30 | BI4: ="{"&RC[-6]&","&RC[-3]&","&RC[-2]&","&RC[-1]&"}," -> {200010,0,1,30}, | BJ4: =RC[-1] -> {200010,0,1,30},
A5: 200001 | B5: 轻盔 | C5: 1 | D5: 0 | E5: 1 | F5: 100 | G5: ="{"&RC[-6]&","&RC[-3]&","&RC[-2]&","&RC[-1]&"}," -> {200001,0,1,100}, | H5: =R[-1]C&RC[-1] -> {200000,0,1,100},{200001,0,1,100}, | J5: 200001 | K5: 轻盔 | L5: 1 | M5: 0 | N5: 1 | O5: 30 | P5: ="{"&RC[-6]&","&RC[-3]&","&RC[-2]&","&RC[-1]&"}," -> {200001,0,1,30}, | Q5: =R[-1]C&RC[-1] -> {200000,0,1,30},{200001,0,1,30}, | S5: 200001 | T5: 轻盔 | U5: 1 | V5: 0 | W5: 1 | X5: 30 | Y5: ="{"&RC[-6]&","&RC[-3]&","&RC[-2]&","&RC[-1]&"}," -> {200001,0,1,30}, | Z5: =R[-1]C&RC[-1] -> {200000,0,1,30},{200001,0,1,30}, | AB5: 200001 | AC5: 轻盔 | AD5: 1 | AE5: 0 | AF5: 1 | AG5: 30 | AH5: ="{"&RC[-6]&","&RC[-3]&","&RC[-2]&","&RC[-1]&"}," -> {200001,0,1,30}, | AI5: =R[-1]C&RC[-1] -> {200000,0,1,30},{200001,0,1,30}, | AK5: 200011 | AL5: 绿色项链 | AM5: 1 | AN5: 0 | AO5: 1 | AP5: 40 | AQ5: ="{"&RC[-6]&","&RC[-3]&","&RC[-2]&","&RC[-1]&"}," -> {200011,0,1,40}, | AR5: =R[-1]C&RC[-1] -> {200010,0,1,40},{200011,0,1,40}, | AT5: 200011 | AU5: 绿色项链 | AV5: 1 | AW5: 0 | AX5: 1 | AY5: 30 | AZ5: ="{"&RC[-6]&","&RC[-3]&","&RC[-2]&","&RC[-1]&"}," -> {200011,0,1,30}, | BA5: =RC[-1] -> {200011,0,1,30}, | BC5: 200011 | BD5: 绿色项链 | BE5: 1 | BF5: 0 | BG5: 1 | BH5: 30 | BI5: ="{"&RC[-6]&","&RC[-3]&","&RC[-2]&","&RC[-1]&"}," -> {200011,0,1,30}, | BJ5: =RC[-1] -> {200011,0,1,30},
A6: 200002 | B6: 珊瑚戒指 | C6: 1 | D6: 0 | E6: 1 | F6: 100 | G6: ="{"&RC[-6]&","&RC[-3]&","&RC[-2]&","&RC[-1]&"}," -> {200002,0,1,100}, | H6: =R[-1]C&RC[-1] -> {200000,0,1,100},{200001,0,1,100},{200002,0,1,100}, | J6: 200002 | K6: 珊瑚戒指 | L6: 1 | M6: 0 | N6: 1 | O6: 30 | P6: ="{"&RC[-6]&","&RC[-3]&","&RC[-2]&","&RC[-1]&"}," -> {200002,0,1,30}, | Q6: =R[-1]C&RC[-1] -> {200000,0,1,30},{200001,0,1,30},{200002,0,1,30}, | S6: 200002 | T6: 珊瑚戒指 | U6: 1 | V6: 0 | W6: 1 | X6: 30 | Y6: ="{"&RC[-6]&","&RC[-3]&","&RC[-2]&","&RC[-1]&"}," -> {200002,0,1,30}, | Z6: =R[-1]C&RC[-1] -> {200000,0,1,30},{200001,0,1,30},{200002,0,1,30}, | AB6: 200002 | AC6: 珊瑚戒指 | AD6: 1 | AE6: 0 | AF6: 1 | AG6: 30 | AH6: ="{"&RC[-6]&","&RC[-3]&","&RC[-2]&","&RC[-1]&"}," -> {200002,0,1,30}, | AI6: =R[-1]C&RC[-1] -> {200000,0,1,30},{200001,0,1,30},{200002,0,1,30}, | AK6: 200012 | AL6: 战神盔甲 | AM6: 1 | AN6: 0 | AO6: 1 | AP6: 40 | AQ6: ="{"&RC[-6]&","&RC[-3]&","&RC[-2]&","&RC[-1]&"}," -> {200012,0,1,40}, | AR6: =R[-1]C&RC[-1] -> {200010,0,1,40},{200011,0,1,40},{200012,0,1,40}, | AT6: 200012 | AU6: 战神盔甲 | AV6: 1 | AW6: 0 | AX6: 1 | AY6: 30 | AZ6: ="{"&RC[-6]&","&RC[-3]&","&RC[-2]&","&RC[-1]&"}," -> {200012,0,1,30}, | BA6: =RC[-1] -> {200012,0,1,30}, | BC6: 200012 | BD6: 战神盔甲 | BE6: 1 | BF6: 0 | BG6: 1 | BH6: 30 | BI6: ="{"&RC[-6]&","&RC[-3]&","&RC[-2]&","&RC[-1]&"}," -> {200012,0,1,30}, | BJ6: =RC[-1] -> {200012,0,1,30},
A7: 200003 | B7: 魔力手镯 | C7: 1 | D7: 0 | E7: 1 | F7: 100 | G7: ="{"&RC[-6]&","&RC[-3]&","&RC[-2]&","&RC[-1]&"}," -> {200003,0,1,100}, | H7: =R[-1]C&RC[-1] -> {200000,0,1,100},{200001,0,1,100},{200002,0,1,100},{200003,0,1,100}, | J7: 200003 | K7: 魔力手镯 | L7: 1 | M7: 0 | N7: 1 | O7: 30 | P7: ="{"&RC[-6]&","&RC[-3]&","&RC[-2]&","&RC[-1]&"}," -> {200003,0,1,30}, | Q7: =R[-1]C&RC[-1] -> {200000,0,1,30},{200001,0,1,30},{200002,0,1,30},{200003,0,1,30}, | S7: 200003 | T7: 魔力手镯 | U7: 1 | V7: 0 | W7: 1 | X7: 30 | Y7: ="{"&RC[-6]&","&RC[-3]&","&RC[-2]&","&RC[-1]&"}," -> {200003,0,1,30}, | Z7: =R[-1]C&RC[-1] -> {200000,0,1,30},{200001,0,1,30},{200002,0,1,30},{200003,0,1,30}, | AB7: 200003 | AC7: 魔力手镯 | AD7: 1 | AE7: 0 | AF7: 1 | AG7: 30 | AH7: ="{"&RC[-6]&","&RC[-3]&","&RC[-2]&","&RC[-1]&"}," -> {200003,0,1,30}, | AI7: =R[-1]C&RC[-1] -> {200000,0,1,30},{200001,0,1,30},{200002,0,1,30},{200003,0,1,30}, | AK7: 200013 | AL7: 力量戒指 | AM7: 1 | AN7: 0 | AO7: 1 | AP7: 40 | AQ7: ="{"&RC[-6]&","&RC[-3]&","&RC[-2]&","&RC[-1]&"}," -> {200013,0,1,40}, | AR7: =R[-1]C&RC[-1] -> {200010,0,1,40},{200011,0,1,40},{200012,0,1,40},{200013,0,1,40}, | AT7: 200013 | AU7: 力量戒指 | AV7: 1 | AW7: 0 | AX7: 1 | AY7: 30 | AZ7: ="{"&RC[-6]&","&RC[-3]&","&RC[-2]&","&RC[-1]&"}," -> {200013,0,1,30}, | BA7: =RC[-1] -> {200013,0,1,30}, | BC7: 200013 | BD7: 力量戒指 | BE7: 1 | BF7: 0 | BG7: 1 | BH7: 30 | BI7: ="{"&RC[-6]&","&RC[-3]&","&RC[-2]&","&RC[-1]&"}," -> {200013,0,1,30}, | BJ7: =RC[-1] -> {200013,0,1,30},
A8: 200006 | B8: 恶魔项链 | C8: 1 | D8: 0 | E8: 1 | F8: 100 | G8: ="{"&RC[-6]&","&RC[-3]&","&RC[-2]&","&RC[-1]&"}," -> {200006,0,1,100}, | H8: =R[-1]C&RC[-1] -> {200000,0,1,100},{200001,0,1,100},{200002,0,1,100},{200003,0,1,100},{200006,0,1,100}, | J8: 200006 | K8: 恶魔项链 | L8: 1 | M8: 0 | N8: 1 | O8: 30 | P8: ="{"&RC[-6]&","&RC[-3]&","&RC[-2]&","&RC[-1]&"}," -> {200006,0,1,30}, | Q8: =R[-1]C&RC[-1] -> {200000,0,1,30},{200001,0,1,30},{200002,0,1,30},{200003,0,1,30},{200006,0,1,30}, | S8: 200006 | T8: 恶魔项链 | U8: 1 | V8: 0 | W8: 1 | X8: 30 | Y8: ="{"&RC[-6]&","&RC[-3]&","&RC[-2]&","&RC[-1]&"}," -> {200006,0,1,30}, | Z8: =R[-1]C&RC[-1] -> {200000,0,1,30},{200001,0,1,30},{200002,0,1,30},{200003,0,1,30},{200006,0,1,30}, | AB8: 200006 | AC8: 恶魔项链 | AD8: 1 | AE8: 0 | AF8: 1 | AG8: 30 | AH8: ="{"&RC[-6]&","&RC[-3]&","&RC[-2]&","&RC[-1]&"}," -> {200006,0,1,30}, | AI8: =R[-1]C&RC[-1] -> {200000,0,1,30},{200001,0,1,30},{200002,0,1,30},{200003,0,1,30},{200006,0,1,30}, | AK8: 200015 | AL8: 战士头盔 | AM8: 1 | AN8: 0 | AO8: 1 | AP8: 40 | AQ8: ="{"&RC[-6]&","&RC[-3]&","&RC[-2]&","&RC[-1]&"}," -> {200015,0,1,40}, | AR8: =R[-1]C&RC[-1] -> {200010,0,1,40},{200011,0,1,40},{200012,0,1,40},{200013,0,1,40},{200015,0,1,40}, | AT8: 200015 | AU8: 战士头盔 | AV8: 1 | AW8: 0 | AX8: 1 | AY8: 30 | AZ8: ="{"&RC[-6]&","&RC[-3]&","&RC[-2]&","&RC[-1]&"}," -> {200015,0,1,30}, | BA8: =RC[-1] -> {200015,0,1,30}, | BC8: 200015 | BD8: 战士头盔 | BE8: 1 | BF8: 0 | BG8: 1 | BH8: 30 | BI8: ="{"&RC[-6]&","&RC[-3]&","&RC[-2]&","&RC[-1]&"}," -> {200015,0,1,30}, | BJ8: =RC[-1] -> {200015,0,1,30},
A9: 201000 | B9: 海魂 | C9: 1 | D9: 0 | E9: 1 | F9: 100 | G9: ="{"&RC[-6]&","&RC[-3]&","&RC[-2]&","&RC[-1]&"}," -> {201000,0,1,100}, | H9: =R[-1]C&RC[-1] -> {200000,0,1,100},{200001,0,1,100},{200002,0,1,100},{200003,0,1,100},{200006,0,1,100},{201000,0,1,100}, | J9: 200010 | K9: 炼狱 | L9: 1 | M9: 0 | N9: 1 | O9: 5 | P9: ="{"&RC[-6]&","&RC[-3]&","&RC[-2]&","&RC[-1]&"}," -> {200010,0,1,5}, | Q9: =R[-1]C&RC[-1] -> {200000,0,1,30},{200001,0,1,30},{200002,0,1,30},{200003,0,1,30},{200006,0,1,30},{200010,0,1,5}, | S9: 200010 | T9: 炼狱 | U9: 1 | V9: 0 | W9: 1 | X9: 5 | Y9: ="{"&RC[-6]&","&RC[-3]&","&RC[-2]&","&RC[-1]&"}," -> {200010,0,1,5}, | Z9: =R[-1]C&RC[-1] -> {200000,0,1,30},{200001,0,1,30},{200002,0,1,30},{200003,0,1,30},{200006,0,1,30},{200010,0,1,5}, | AB9: 200010 | AC9: 炼狱 | AD9: 1 | AE9: 0 | AF9: 1 | AG9: 5 | AH9: ="{"&RC[-6]&","&RC[-3]&","&RC[-2]&","&RC[-1]&"}," -> {200010,0,1,5}, | AI9: =R[-1]C&RC[-1] -> {200000,0,1,30},{200001,0,1,30},{200002,0,1,30},{200003,0,1,30},{200006,0,1,30},{200010,0,1,5}, | AK9: 200016 | AL9: 阎罗手镯 | AM9: 1 | AN9: 0 | AO9: 1 | AP9: 40 | AQ9: ="{"&RC[-6]&","&RC[-3]&","&RC[-2]&","&RC[-1]&"}," -> {200016,0,1,40}, | AR9: =R[-1]C&RC[-1] -> {200010,0,1,40},{200011,0,1,40},{200012,0,1,40},{200013,0,1,40},{200015,0,1,40},{200016,0,1,40}, | AT9: 200016 | AU9: 阎罗手镯 | AV9: 1 | AW9: 0 | AX9: 1 | AY9: 30 | AZ9: ="{"&RC[-6]&","&RC[-3]&","&RC[-2]&","&RC[-1]&"}," -> {200016,0,1,30}, | BA9: =RC[-1] -> {200016,0,1,30}, | BC9: 200016 | BD9: 阎罗手镯 | BE9: 1 | BF9: 0 | BG9: 1 | BH9: 30 | BI9: ="{"&RC[-6]&","&RC[-3]&","&RC[-2]&","&RC[-1]&"}," -> {200016,0,1,30}, | BJ9: =RC[-1] -> {200016,0,1,30},
A10: 201001 | B10: 轻盔 | C10: 1 | D10: 0 | E10: 1 | F10: 100 | G10: ="{"&RC[-6]&","&RC[-3]&","&RC[-2]&","&RC[-1]&"}," -> {201001,0,1,100}, | H10: =R[-1]C&RC[-1] -> {200000,0,1,100},{200001,0,1,100},{200002,0,1,100},{200003,0,1,100},{200006,0,1,100},{201000,0,1,100},{201001,0,1,100}, | J10: 200011 | K10: 绿色项链 | L10: 1 | M10: 0 | N10: 1 | O10: 10 | P10: ="{"&RC[-6]&","&RC[-3]&","&RC[-2]&","&RC[-1]&"}," -> {200011,0,1,10}, | Q10: =R[-1]C&RC[-1] -> {200000,0,1,30},{200001,0,1,30},{200002,0,1,30},{200003,0,1,30},{200006,0,1,30},{200010,0,1,5},{200011,0,1,10}, | S10: 200011 | T10: 绿色项链 | U10: 1 | V10: 0 | W10: 1 | X10: 10 | Y10: ="{"&RC[-6]&","&RC[-3]&","&RC[-2]&","&RC[-1]&"}," -> {200011,0,1,10}, | Z10: =R[-1]C&RC[-1] -> {200000,0,1,30},{200001,0,1,30},{200002,0,1,30},{200003,0,1,30},{200006,0,1,30},{200010,0,1,5},{200011,0,1,10}, | AB10: 200011 | AC10: 绿色项链 | AD10: 1 | AE10: 0 | AF10: 1 | AG10: 10 | AH10: ="{"&RC[-6]&","&RC[-3]&","&RC[-2]&","&RC[-1]&"}," -> {200011,0,1,10}, | AI10: =R[-1]C&RC[-1] -> {200000,0,1,30},{200001,0,1,30},{200002,0,1,30},{200003,0,1,30},{200006,0,1,30},{200010,0,1,5},{200011,0,1,10}, | AK10: 200017 | AL10: 战士腰带 | AM10: 1 | AN10: 0 | AO10: 1 | AP10: 40 | AQ10: ="{"&RC[-6]&","&RC[-3]&","&RC[-2]&","&RC[-1]&"}," -> {200017,0,1,40}, | AR10: =R[-1]C&RC[-1] -> {200010,0,1,40},{200011,0,1,40},{200012,0,1,40},{200013,0,1,40},{200015,0,1,40},{200016,0,1,40},{200017,0,1,40}, | AT10: 200017 | AU10: 战士腰带 | AV10: 1 | AW10: 0 | AX10: 1 | AY10: 30 | AZ10: ="{"&RC[-6]&","&RC[-3]&","&RC[-2]&","&RC[-1]&"}," -> {200017,0,1,30}, | BA10: =RC[-1] -> {200017,0,1,30}, | BC10: 200017 | BD10: 战士腰带 | BE10: 1 | BF10: 0 | BG10: 1 | BH10: 30 | BI10: ="{"&RC[-6]&","&RC[-3]&","&RC[-2]&","&RC[-1]&"}," -> {200017,0,1,30}, | BJ10: =RC[-1] -> {200017,0,1,30},
A11: 201002 | B11: 金戒指 | C11: 1 | D11: 0 | E11: 1 | F11: 100 | G11: ="{"&RC[-6]&","&RC[-3]&","&RC[-2]&","&RC[-1]&"}," -> {201002,0,1,100}, | H11: =R[-1]C&RC[-1] -> {200000,0,1,100},{200001,0,1,100},{200002,0,1,100},{200003,0,1,100},{200006,0,1,100},{201000,0,1,100},{201001,0,1,100},{201002,0,1,100}, | J11: 200012 | K11: 战神盔甲 | L11: 1 | M11: 0 | N11: 1 | O11: 10 | P11: ="{"&RC[-6]&","&RC[-3]&","&RC[-2]&","&RC[-1]&"}," -> {200012,0,1,10}, | Q11: =R[-1]C&RC[-1] -> {200000,0,1,30},{200001,0,1,30},{200002,0,1,30},{200003,0,1,30},{200006,0,1,30},{200010,0,1,5},{200011,0,1,10},{200012,0,1,10}, | S11: 200012 | T11: 战神盔甲 | U11: 1 | V11: 0 | W11: 1 | X11: 10 | Y11: ="{"&RC[-6]&","&RC[-3]&","&RC[-2]&","&RC[-1]&"}," -> {200012,0,1,10}, | Z11: =R[-1]C&RC[-1] -> {200000,0,1,30},{200001,0,1,30},{200002,0,1,30},{200003,0,1,30},{200006,0,1,30},{200010,0,1,5},{200011,0,1,10},{200012,0,1,10}, | AB11: 200012 | AC11: 战神盔甲 | AD11: 1 | AE11: 0 | AF11: 1 | AG11: 10 | AH11: ="{"&RC[-6]&","&RC[-3]&","&RC[-2]&","&RC[-1]&"}," -> {200012,0,1,10}, | AI11: =R[-1]C&RC[-1] -> {200000,0,1,30},{200001,0,1,30},{200002,0,1,30},{200003,0,1,30},{200006,0,1,30},{200010,0,1,5},{200011,0,1,10},{200012,0,1,10}, | AK11: 200019 | AL11: 战士鞋子 | AM11: 1 | AN11: 0 | AO11: 1 | AP11: 40 | AQ11: ="{"&RC[-6]&","&RC[-3]&","&RC[-2]&","&RC[-1]&"}," -> {200019,0,1,40}, | AR11: =R[-1]C&RC[-1] -> {200010,0,1,40},{200011,0,1,40},{200012,0,1,40},{200013,0,1,40},{200015,0,1,40},{200016,0,1,40},{200017,0,1,40},{200019,0,1,40}, | AT11: 200019 | AU11: 战士鞋子 | AV11: 1 | AW11: 0 | AX11: 1 | AY11: 30 | AZ11: ="{"&RC[-6]&","&RC[-3]&","&RC[-2]&","&RC[-1]&"}," -> {200019,0,1,30}, | BA11: =RC[-1] -> {200019,0,1,30}, | BC11: 200019 | BD11: 战士鞋子 | BE11: 1 | BF11: 0 | BG11: 1 | BH11: 30 | BI11: ="{"&RC[-6]&","&RC[-3]&","&RC[-2]&","&RC[-1]&"}," -> {200019,0,1,30}, | BJ11: =RC[-1] -> {200019,0,1,30},
A12: 201003 | B12: 魔法手镯 | C12: 1 | D12: 0 | E12: 1 | F12: 100 | G12: ="{"&RC[-6]&","&RC[-3]&","&RC[-2]&","&RC[-1]&"}," -> {201003,0,1,100}, | H12: =R[-1]C&RC[-1] -> {200000,0,1,100},{200001,0,1,100},{200002,0,1,100},{200003,0,1,100},{200006,0,1,100},{201000,0,1,100},{201001,0,1,100},{201002,0,1,100},{201003,0,1,100}, | J12: 201000 | K12: 海魂 | L12: 1 | M12: 0 | N12: 1 | O12: 30 | P12: ="{"&RC[-6]&","&RC[-3]&","&RC[-2]&","&RC[-1]&"}," -> {201000,0,1,30}, | Q12: =R[-1]C&RC[-1] -> {200000,0,1,30},{200001,0,1,30},{200002,0,1,30},{200003,0,1,30},{200006,0,1,30},{200010,0,1,5},{200011,0,1,10},{200012,0,1,10},{201000,0,1,30}, | S12: 200013 | T12: 力量戒指 | U12: 1 | V12: 0 | W12: 1 | X12: 10 | Y12: ="{"&RC[-6]&","&RC[-3]&","&RC[-2]&","&RC[-1]&"}," -> {200013,0,1,10}, | Z12: =R[-1]C&RC[-1] -> {200000,0,1,30},{200001,0,1,30},{200002,0,1,30},{200003,0,1,30},{200006,0,1,30},{200010,0,1,5},{200011,0,1,10},{200012,0,1,10},{200013,0,1,10}, | AB12: 200013 | AC12: 力量戒指 | AD12: 1 | AE12: 0 | AF12: 1 | AG12: 10 | AH12: ="{"&RC[-6]&","&RC[-3]&","&RC[-2]&","&RC[-1]&"}," -> {200013,0,1,10}, | AI12: =R[-1]C&RC[-1] -> {200000,0,1,30},{200001,0,1,30},{200002,0,1,30},{200003,0,1,30},{200006,0,1,30},{200010,0,1,5},{200011,0,1,10},{200012,0,1,10},{200013,0,1,10}, | AK12: 200020 | AL12: 裁决 | AM12: 1 | AN12: 0 | AO12: 1 | AP12: 1 | AQ12: ="{"&RC[-6]&","&RC[-3]&","&RC[-2]&","&RC[-1]&"}," -> {200020,0,1,1}, | AR12: =R[-1]C&RC[-1] -> {200010,0,1,40},{200011,0,1,40},{200012,0,1,40},{200013,0,1,40},{200015,0,1,40},{200016,0,1,40},{200017,0,1,40},{200019,0,1,40},{200020,0,1,1}, | AT12: 200020 | AU12: 裁决 | AV12: 1 | AW12: 0 | AX12: 1 | AY12: 1 | AZ12: ="{"&RC[-6]&","&RC[-3]&","&RC[-2]&","&RC[-1]&"}," -> {200020,0,1,1}, | BA12: =RC[-1] -> {200020,0,1,1}, | BC12: 200020 | BD12: 裁决 | BE12: 1 | BF12: 0 | BG12: 1 | BH12: 1 | BI12: ="{"&RC[-6]&","&RC[-3]&","&RC[-2]&","&RC[-1]&"}," -> {200020,0,1,1}, | BJ12: =RC[-1] -> {200020,0,1,1},
A13: 201006 | B13: 放大镜 | C13: 1 | D13: 0 | E13: 1 | F13: 100 | G13: ="{"&RC[-6]&","&RC[-3]&","&RC[-2]&","&RC[-1]&"}," -> {201006,0,1,100}, | H13: =R[-1]C&RC[-1] -> {200000,0,1,100},{200001,0,1,100},{200002,0,1,100},{200003,0,1,100},{200006,0,1,100},{201000,0,1,100},{201001,0,1,100},{201002,0,1,100},{201003,0,1,100},{201006,0,1,100}, | J13: 201001 | K13: 轻盔 | L13: 1 | M13: 0 | N13: 1 | O13: 30 | P13: ="{"&RC[-6]&","&RC[-3]&","&RC[-2]&","&RC[-1]&"}," -> {201001,0,1,30}, | Q13: =R[-1]C&RC[-1] -> {200000,0,1,30},{200001,0,1,30},{200002,0,1,30},{200003,0,1,30},{200006,0,1,30},{200010,0,1,5},{200011,0,1,10},{200012,0,1,10},{201000,0,1,30},{201001,0,1,30}, | S13: 200015 | T13: 战士头盔 | U13: 1 | V13: 0 | W13: 1 | X13: 10 | Y13: ="{"&RC[-6]&","&RC[-3]&","&RC[-2]&","&RC[-1]&"}," -> {200015,0,1,10}, | Z13: =R[-1]C&RC[-1] -> {200000,0,1,30},{200001,0,1,30},{200002,0,1,30},{200003,0,1,30},{200006,0,1,30},{200010,0,1,5},{200011,0,1,10},{200012,0,1,10},{200013,0,1,10},{200015,0,1,10}, | AB13: 200015 | AC13: 战士头盔 | AD13: 1 | AE13: 0 | AF13: 1 | AG13: 10 | AH13: ="{"&RC[-6]&","&RC[-3]&","&RC[-2]&","&RC[-1]&"}," -> {200015,0,1,10}, | AI13: =R[-1]C&RC[-1] -> {200000,0,1,30},{200001,0,1,30},{200002,0,1,30},{200003,0,1,30},{200006,0,1,30},{200010,0,1,5},{200011,0,1,10},{200012,0,1,10},{200013,0,1,10},{200015,0,1,10}, | AK13: 200021 | AL13: 圣战战甲 | AM13: 1 | AN13: 0 | AO13: 1 | AP13: 3 | AQ13: ="{"&RC[-6]&","&RC[-3]&","&RC[-2]&","&RC[-1]&"}," -> {200021,0,1,3}, | AR13: =R[-1]C&RC[-1] -> {200010,0,1,40},{200011,0,1,40},{200012,0,1,40},{200013,0,1,40},{200015,0,1,40},{200016,0,1,40},{200017,0,1,40},{200019,0,1,40},{200020,0,1,1},{200021,0,1,3}, | AT13: 200021 | AU13: 圣战战甲 | AV13: 1 | AW13: 0 | AX13: 1 | AY13: 3 | AZ13: ="{"&RC[-6]&","&RC[-3]&","&RC[-2]&","&RC[-1]&"}," -> {200021,0,1,3}, | BA13: =RC[-1] -> {200021,0,1,3}, | BC13: 200021 | BD13: 圣战战甲 | BE13: 1 | BF13: 0 | BG13: 1 | BH13: 3 | BI13: ="{"&RC[-6]&","&RC[-3]&","&RC[-2]&","&RC[-1]&"}," -> {200021,0,1,3}, | BJ13: =RC[-1] -> {200021,0,1,3},
A14: 202000 | B14: 半月 | C14: 1 | D14: 0 | E14: 1 | F14: 100 | G14: ="{"&RC[-6]&","&RC[-3]&","&RC[-2]&","&RC[-1]&"}," -> {202000,0,1,100}, | H14: =R[-1]C&RC[-1] -> {200000,0,1,100},{200001,0,1,100},{200002,0,1,100},{200003,0,1,100},{200006,0,1,100},{201000,0,1,100},{201001,0,1,100},{201002,0,1,100},{201003,0,1,100},{201006,0,1,100},{202000,0,1,100}, | J14: 201002 | K14: 金戒指 | L14: 1 | M14: 0 | N14: 1 | O14: 30 | P14: ="{"&RC[-6]&","&RC[-3]&","&RC[-2]&","&RC[-1]&"}," -> {201002,0,1,30}, | Q14: =R[-1]C&RC[-1] -> {200000,0,1,30},{200001,0,1,30},{200002,0,1,30},{200003,0,1,30},{200006,0,1,30},{200010,0,1,5},{200011,0,1,10},{200012,0,1,10},{201000,0,1,30},{201001,0,1,30},{201002,0,1,30}, | S14: 200016 | T14: 阎罗手镯 | U14: 1 | V14: 0 | W14: 1 | X14: 10 | Y14: ="{"&RC[-6]&","&RC[-3]&","&RC[-2]&","&RC[-1]&"}," -> {200016,0,1,10}, | Z14: =R[-1]C&RC[-1] -> {200000,0,1,30},{200001,0,1,30},{200002,0,1,30},{200003,0,1,30},{200006,0,1,30},{200010,0,1,5},{200011,0,1,10},{200012,0,1,10},{200013,0,1,10},{200015,0,1,10},{200016,0,1,10}, | AB14: 200016 | AC14: 阎罗手镯 | AD14: 1 | AE14: 0 | AF14: 1 | AG14: 10 | AH14: ="{"&RC[-6]&","&RC[-3]&","&RC[-2]&","&RC[-1]&"}," -> {200016,0,1,10}, | AI14: =R[-1]C&RC[-1] -> {200000,0,1,30},{200001,0,1,30},{200002,0,1,30},{200003,0,1,30},{200006,0,1,30},{200010,0,1,5},{200011,0,1,10},{200012,0,1,10},{200013,0,1,10},{200015,0,1,10},{200016,0,1,10}, | AK14: 200022 | AL14: 圣战项链 | AM14: 1 | AN14: 0 | AO14: 1 | AP14: 10 | AQ14: ="{"&RC[-6]&","&RC[-3]&","&RC[-2]&","&RC[-1]&"}," -> {200022,0,1,10}, | AR14: =R[-1]C&RC[-1] -> {200010,0,1,40},{200011,0,1,40},{200012,0,1,40},{200013,0,1,40},{200015,0,1,40},{200016,0,1,40},{200017,0,1,40},{200019,0,1,40},{200020,0,1,1},{200021,0,1,3},{200022,0,1,10}, | AT14: 200022 | AU14: 圣战项链 | AV14: 1 | AW14: 0 | AX14: 1 | AY14: 10 | AZ14: ="{"&RC[-6]&","&RC[-3]&","&RC[-2]&","&RC[-1]&"}," -> {200022,0,1,10}, | BA14: =RC[-1] -> {200022,0,1,10}, | BC14: 200022 | BD14: 圣战项链 | BE14: 1 | BF14: 0 | BG14: 1 | BH14: 10 | BI14: ="{"&RC[-6]&","&RC[-3]&","&RC[-2]&","&RC[-1]&"}," -> {200022,0,1,10}, | BJ14: =RC[-1] -> {200022,0,1,10},
A15: 202001 | B15: 轻盔 | C15: 1 | D15: 0 | E15: 1 | F15: 100 | G15: ="{"&RC[-6]&","&RC[-3]&","&RC[-2]&","&RC[-1]&"}," -> {202001,0,1,100}, | H15: =R[-1]C&RC[-1] -> {200000,0,1,100},{200001,0,1,100},{200002,0,1,100},{200003,0,1,100},{200006,0,1,100},{201000,0,1,100},{201001,0,1,100},{201002,0,1,100},{201003,0,1,100},{201006,0,1,100},{202000,0,1,100},{202001,0,1,100}, | J15: 201003 | K15: 魔法手镯 | L15: 1 | M15: 0 | N15: 1 | O15: 30 | P15: ="{"&RC[-6]&","&RC[-3]&","&RC[-2]&","&RC[-1]&"}," -> {201003,0,1,30}, | Q15: =R[-1]C&RC[-1] -> {200000,0,1,30},{200001,0,1,30},{200002,0,1,30},{200003,0,1,30},{200006,0,1,30},{200010,0,1,5},{200011,0,1,10},{200012,0,1,10},{201000,0,1,30},{201001,0,1,30},{201002,0,1,30},{201003,0,1,30}, | S15: 200017 | T15: 战士腰带 | U15: 1 | V15: 0 | W15: 1 | X15: 10 | Y15: ="{"&RC[-6]&","&RC[-3]&","&RC[-2]&","&RC[-1]&"}," -> {200017,0,1,10}, | Z15: =R[-1]C&RC[-1] -> {200000,0,1,30},{200001,0,1,30},{200002,0,1,30},{200003,0,1,30},{200006,0,1,30},{200010,0,1,5},{200011,0,1,10},{200012,0,1,10},{200013,0,1,10},{200015,0,1,10},{200016,0,1,10},{200017,0,1,10}, | AB15: 200017 | AC15: 战士腰带 | AD15: 1 | AE15: 0 | AF15: 1 | AG15: 10 | AH15: ="{"&RC[-6]&","&RC[-3]&","&RC[-2]&","&RC[-1]&"}," -> {200017,0,1,10}, | AI15: =R[-1]C&RC[-1] -> {200000,0,1,30},{200001,0,1,30},{200002,0,1,30},{200003,0,1,30},{200006,0,1,30},{200010,0,1,5},{200011,0,1,10},{200012,0,1,10},{200013,0,1,10},{200015,0,1,10},{200016,0,1,10},{200017,0,1,10}, | AK15: 200023 | AL15: 圣战戒指 | AM15: 1 | AN15: 0 | AO15: 1 | AP15: 10 | AQ15: ="{"&RC[-6]&","&RC[-3]&","&RC[-2]&","&RC[-1]&"}," -> {200023,0,1,10}, | AR15: =R[-1]C&RC[-1] -> {200010,0,1,40},{200011,0,1,40},{200012,0,1,40},{200013,0,1,40},{200015,0,1,40},{200016,0,1,40},{200017,0,1,40},{200019,0,1,40},{200020,0,1,1},{200021,0,1,3},{200022,0,1,10},{200023,0,1,10}, | AT15: 200023 | AU15: 圣战戒指 | AV15: 1 | AW15: 0 | AX15: 1 | AY15: 10 | AZ15: ="{"&RC[-6]&","&RC[-3]&","&RC[-2]&","&RC[-1]&"}," -> {200023,0,1,10}, | BA15: =RC[-1] -> {200023,0,1,10}, | BC15: 200023 | BD15: 圣战戒指 | BE15: 1 | BF15: 0 | BG15: 1 | BH15: 10 | BI15: ="{"&RC[-6]&","&RC[-3]&","&RC[-2]&","&RC[-1]&"}," -> {200023,0,1,10}, | BJ15: =RC[-1] -> {200023,0,1,10},
A16: 202002 | B16: 铂金戒指 | C16: 1 | D16: 0 | E16: 1 | F16: 100 | G16: ="{"&RC[-6]&","&RC[-3]&","&RC[-2]&","&RC[-1]&"}," -> {202002,0,1,100}, | H16: =R[-1]C&RC[-1] -> {200000,0,1,100},{200001,0,1,100},{200002,0,1,100},{200003,0,1,100},{200006,0,1,100},{201000,0,1,100},{201001,0,1,100},{201002,0,1,100},{201003,0,1,100},{201006,0,1,100},{202000,0,1,100},{202001,0,1,100},{202002,0,1,100}, | J16: 201006 | K16: 放大镜 | L16: 1 | M16: 0 | N16: 1 | O16: 30 | P16: ="{"&RC[-6]&","&RC[-3]&","&RC[-2]&","&RC[-1]&"}," -> {201006,0,1,30}, | Q16: =R[-1]C&RC[-1] -> {200000,0,1,30},{200001,0,1,30},{200002,0,1,30},{200003,0,1,30},{200006,0,1,30},{200010,0,1,5},{200011,0,1,10},{200012,0,1,10},{201000,0,1,30},{201001,0,1,30},{201002,0,1,30},{201003,0,1,30},{201006,0,1,30}, | S16: 200019 | T16: 战士鞋子 | U16: 1 | V16: 0 | W16: 1 | X16: 10 | Y16: ="{"&RC[-6]&","&RC[-3]&","&RC[-2]&","&RC[-1]&"}," -> {200019,0,1,10}, | Z16: =R[-1]C&RC[-1] -> {200000,0,1,30},{200001,0,1,30},{200002,0,1,30},{200003,0,1,30},{200006,0,1,30},{200010,0,1,5},{200011,0,1,10},{200012,0,1,10},{200013,0,1,10},{200015,0,1,10},{200016,0,1,10},{200017,0,1,10},{200019,0,1,10}, | AB16: 200019 | AC16: 战士鞋子 | AD16: 1 | AE16: 0 | AF16: 1 | AG16: 10 | AH16: ="{"&RC[-6]&","&RC[-3]&","&RC[-2]&","&RC[-1]&"}," -> {200019,0,1,10}, | AI16: =R[-1]C&RC[-1] -> {200000,0,1,30},{200001,0,1,30},{200002,0,1,30},{200003,0,1,30},{200006,0,1,30},{200010,0,1,5},{200011,0,1,10},{200012,0,1,10},{200013,0,1,10},{200015,0,1,10},{200016,0,1,10},{200017,0,1,10},{200019,0,1,10}, | AK16: 200025 | AL16: 圣战头盔 | AM16: 1 | AN16: 0 | AO16: 1 | AP16: 3 | AQ16: ="{"&RC[-6]&","&RC[-3]&","&RC[-2]&","&RC[-1]&"}," -> {200025,0,1,3}, | AR16: =R[-1]C&RC[-1] -> {200010,0,1,40},{200011,0,1,40},{200012,0,1,40},{200013,0,1,40},{200015,0,1,40},{200016,0,1,40},{200017,0,1,40},{200019,0,1,40},{200020,0,1,1},{200021,0,1,3},{200022,0,1,10},{200023,0,1,10},{200025,0,1,3}, | AT16: 200025 | AU16: 圣战头盔 | AV16: 1 | AW16: 0 | AX16: 1 | AY16: 3 | AZ16: ="{"&RC[-6]&","&RC[-3]&","&RC[-2]&","&RC[-1]&"}," -> {200025,0,1,3}, | BA16: =RC[-1] -> {200025,0,1,3}, | BC16: 200025 | BD16: 圣战头盔 | BE16: 1 | BF16: 0 | BG16: 1 | BH16: 3 | BI16: ="{"&RC[-6]&","&RC[-3]&","&RC[-2]&","&RC[-1]&"}," -> {200025,0,1,3}, | BJ16: =RC[-1] -> {200025,0,1,3},
A17: 202003 | B17: 三眼手镯 | C17: 1 | D17: 0 | E17: 1 | F17: 100 | G17: ="{"&RC[-6]&","&RC[-3]&","&RC[-2]&","&RC[-1]&"}," -> {202003,0,1,100}, | H17: =R[-1]C&RC[-1] -> {200000,0,1,100},{200001,0,1,100},{200002,0,1,100},{200003,0,1,100},{200006,0,1,100},{201000,0,1,100},{201001,0,1,100},{201002,0,1,100},{201003,0,1,100},{201006,0,1,100},{202000,0,1,100},{202001,0,1,100},{202002,0,1,100},{202003,0,1,100}, | J17: 201010 | K17: 魔杖 | L17: 1 | M17: 0 | N17: 1 | O17: 5 | P17: ="{"&RC[-6]&","&RC[-3]&","&RC[-2]&","&RC[-1]&"}," -> {201010,0,1,5}, | Q17: =R[-1]C&RC[-1] -> {200000,0,1,30},{200001,0,1,30},{200002,0,1,30},{200003,0,1,30},{200006,0,1,30},{200010,0,1,5},{200011,0,1,10},{200012,0,1,10},{201000,0,1,30},{201001,0,1,30},{201002,0,1,30},{201003,0,1,30},{201006,0,1,30},{201010,0,1,5}, | S17: 201000 | T17: 海魂 | U17: 1 | V17: 0 | W17: 1 | X17: 30 | Y17: ="{"&RC[-6]&","&RC[-3]&","&RC[-2]&","&RC[-1]&"}," -> {201000,0,1,30}, | Z17: =R[-1]C&RC[-1] -> {200000,0,1,30},{200001,0,1,30},{200002,0,1,30},{200003,0,1,30},{200006,0,1,30},{200010,0,1,5},{200011,0,1,10},{200012,0,1,10},{200013,0,1,10},{200015,0,1,10},{200016,0,1,10},{200017,0,1,10},{200019,0,1,10},{201000,0,1,30}, | AB17: 201000 | AC17: 海魂 | AD17: 1 | AE17: 0 | AF17: 1 | AG17: 30 | AH17: ="{"&RC[-6]&","&RC[-3]&","&RC[-2]&","&RC[-1]&"}," -> {201000,0,1,30}, | AI17: =R[-1]C&RC[-1] -> {200000,0,1,30},{200001,0,1,30},{200002,0,1,30},{200003,0,1,30},{200006,0,1,30},{200010,0,1,5},{200011,0,1,10},{200012,0,1,10},{200013,0,1,10},{200015,0,1,10},{200016,0,1,10},{200017,0,1,10},{200019,0,1,10},{201000,0,1,30}, | AK17: 200026 | AL17: 圣战手镯 | AM17: 1 | AN17: 0 | AO17: 1 | AP17: 10 | AQ17: ="{"&RC[-6]&","&RC[-3]&","&RC[-2]&","&RC[-1]&"}," -> {200026,0,1,10}, | AR17: =R[-1]C&RC[-1] -> {200010,0,1,40},{200011,0,1,40},{200012,0,1,40},{200013,0,1,40},{200015,0,1,40},{200016,0,1,40},{200017,0,1,40},{200019,0,1,40},{200020,0,1,1},{200021,0,1,3},{200022,0,1,10},{200023,0,1,10},{200025,0,1,3},{200026,0,1,10}, | AT17: 200026 | AU17: 圣战手镯 | AV17: 1 | AW17: 0 | AX17: 1 | AY17: 10 | AZ17: ="{"&RC[-6]&","&RC[-3]&","&RC[-2]&","&RC[-1]&"}," -> {200026,0,1,10}, | BA17: =RC[-1] -> {200026,0,1,10}, | BC17: 200026 | BD17: 圣战手镯 | BE17: 1 | BF17: 0 | BG17: 1 | BH17: 10 | BI17: ="{"&RC[-6]&","&RC[-3]&","&RC[-2]&","&RC[-1]&"}," -> {200026,0,1,10}, | BJ17: =RC[-1] -> {200026,0,1,10},
A18: 202006 | B18: 凤凰明珠 | C18: 1 | D18: 0 | E18: 1 | F18: 100 | G18: ="{"&RC[-6]&","&RC[-3]&","&RC[-2]&","&RC[-1]&"}" -> {202006,0,1,100} | H18: =R[-1]C&RC[-1] -> {200000,0,1,100},{200001,0,1,100},{200002,0,1,100},{200003,0,1,100},{200006,0,1,100},{201000,0,1,100},{201001,0,1,100},{201002,0,1,100},{201003,0,1,100},{201006,0,1,100},{202000,0,1,100},{202001,0,1,100},{202002,0,1,100},{202003,0,1,100},{202006,0,1,100} | J18: 201011 | K18: 恶魔铃铛 | L18: 1 | M18: 0 | N18: 1 | O18: 10 | P18: ="{"&RC[-6]&","&RC[-3]&","&RC[-2]&","&RC[-1]&"}," -> {201011,0,1,10}, | Q18: =R[-1]C&RC[-1] -> {200000,0,1,30},{200001,0,1,30},{200002,0,1,30},{200003,0,1,30},{200006,0,1,30},{200010,0,1,5},{200011,0,1,10},{200012,0,1,10},{201000,0,1,30},{201001,0,1,30},{201002,0,1,30},{201003,0,1,30},{201006,0,1,30},{201010,0,1,5},{201011,0,1,10}, | S18: 201001 | T18: 轻盔 | U18: 1 | V18: 0 | W18: 1 | X18: 30 | Y18: ="{"&RC[-6]&","&RC[-3]&","&RC[-2]&","&RC[-1]&"}," -> {201001,0,1,30}, | Z18: =R[-1]C&RC[-1] -> {200000,0,1,30},{200001,0,1,30},{200002,0,1,30},{200003,0,1,30},{200006,0,1,30},{200010,0,1,5},{200011,0,1,10},{200012,0,1,10},{200013,0,1,10},{200015,0,1,10},{200016,0,1,10},{200017,0,1,10},{200019,0,1,10},{201000,0,1,30},{201001,0,1,30}, | AB18: 201001 | AC18: 轻盔 | AD18: 1 | AE18: 0 | AF18: 1 | AG18: 30 | AH18: ="{"&RC[-6]&","&RC[-3]&","&RC[-2]&","&RC[-1]&"}," -> {201001,0,1,30}, | AI18: =R[-1]C&RC[-1] -> {200000,0,1,30},{200001,0,1,30},{200002,0,1,30},{200003,0,1,30},{200006,0,1,30},{200010,0,1,5},{200011,0,1,10},{200012,0,1,10},{200013,0,1,10},{200015,0,1,10},{200016,0,1,10},{200017,0,1,10},{200019,0,1,10},{201000,0,1,30},{201001,0,1,30}, | AK18: 200027 | AL18: 圣战腰带 | AM18: 1 | AN18: 0 | AO18: 1 | AP18: 3 | AQ18: ="{"&RC[-6]&","&RC[-3]&","&RC[-2]&","&RC[-1]&"}," -> {200027,0,1,3}, | AR18: =R[-1]C&RC[-1] -> {200010,0,1,40},{200011,0,1,40},{200012,0,1,40},{200013,0,1,40},{200015,0,1,40},{200016,0,1,40},{200017,0,1,40},{200019,0,1,40},{200020,0,1,1},{200021,0,1,3},{200022,0,1,10},{200023,0,1,10},{200025,0,1,3},{200026,0,1,10},{200027,0,1,3}, | AT18: 200027 | AU18: 圣战腰带 | AV18: 1 | AW18: 0 | AX18: 1 | AY18: 3 | AZ18: ="{"&RC[-6]&","&RC[-3]&","&RC[-2]&","&RC[-1]&"}," -> {200027,0,1,3}, | BA18: =RC[-1] -> {200027,0,1,3}, | BC18: 200027 | BD18: 圣战腰带 | BE18: 1 | BF18: 0 | BG18: 1 | BH18: 3 | BI18: ="{"&RC[-6]&","&RC[-3]&","&RC[-2]&","&RC[-1]&"}," -> {200027,0,1,3}, | BJ18: =RC[-1] -> {200027,0,1,3},
J19: 201012 | K19: 恶魔长袍 | L19: 1 | M19: 0 | N19: 1 | O19: 10 | P19: ="{"&RC[-6]&","&RC[-3]&","&RC[-2]&","&RC[-1]&"}," -> {201012,0,1,10}, | Q19: =R[-1]C&RC[-1] -> {200000,0,1,30},{200001,0,1,30},{200002,0,1,30},{200003,0,1,30},{200006,0,1,30},{200010,0,1,5},{200011,0,1,10},{200012,0,1,10},{201000,0,1,30},{201001,0,1,30},{201002,0,1,30},{201003,0,1,30},{201006,0,1,30},{201010,0,1,5},{201011,0,1,10},{201012,0,1,10}, | S19: 201002 | T19: 金戒指 | U19: 1 | V19: 0 | W19: 1 | X19: 30 | Y19: ="{"&RC[-6]&","&RC[-3]&","&RC[-2]&","&RC[-1]&"}," -> {201002,0,1,30}, | Z19: =R[-1]C&RC[-1] -> {200000,0,1,30},{200001,0,1,30},{200002,0,1,30},{200003,0,1,30},{200006,0,1,30},{200010,0,1,5},{200011,0,1,10},{200012,0,1,10},{200013,0,1,10},{200015,0,1,10},{200016,0,1,10},{200017,0,1,10},{200019,0,1,10},{201000,0,1,30},{201001,0,1,30},{201002,0,1,30}, | AB19: 201002 | AC19: 金戒指 | AD19: 1 | AE19: 0 | AF19: 1 | AG19: 30 | AH19: ="{"&RC[-6]&","&RC[-3]&","&RC[-2]&","&RC[-1]&"}," -> {201002,0,1,30}, | AI19: =R[-1]C&RC[-1] -> {200000,0,1,30},{200001,0,1,30},{200002,0,1,30},{200003,0,1,30},{200006,0,1,30},{200010,0,1,5},{200011,0,1,10},{200012,0,1,10},{200013,0,1,10},{200015,0,1,10},{200016,0,1,10},{200017,0,1,10},{200019,0,1,10},{201000,0,1,30},{201001,0,1,30},{201002,0,1,30}, | AK19: 200029 | AL19: 圣战鞋子 | AM19: 1 | AN19: 0 | AO19: 1 | AP19: 3 | AQ19: ="{"&RC[-6]&","&RC[-3]&","&RC[-2]&","&RC[-1]&"}," -> {200029,0,1,3}, | AR19: =R[-1]C&RC[-1] -> {200010,0,1,40},{200011,0,1,40},{200012,0,1,40},{200013,0,1,40},{200015,0,1,40},{200016,0,1,40},{200017,0,1,40},{200019,0,1,40},{200020,0,1,1},{200021,0,1,3},{200022,0,1,10},{200023,0,1,10},{200025,0,1,3},{200026,0,1,10},{200027,0,1,3},{200029,0,1,3}, | AT19: 200029 | AU19: 圣战鞋子 | AV19: 1 | AW19: 0 | AX19: 1 | AY19: 3 | AZ19: ="{"&RC[-6]&","&RC[-3]&","&RC[-2]&","&RC[-1]&"}," -> {200029,0,1,3}, | BA19: =RC[-1] -> {200029,0,1,3}, | BC19: 200029 | BD19: 圣战鞋子 | BE19: 1 | BF19: 0 | BG19: 1 | BH19: 3 | BI19: ="{"&RC[-6]&","&RC[-3]&","&RC[-2]&","&RC[-1]&"}," -> {200029,0,1,3}, | BJ19: =RC[-1] -> {200029,0,1,3},
J20: 202000 | K20: 半月 | L20: 1 | M20: 0 | N20: 1 | O20: 30 | P20: ="{"&RC[-6]&","&RC[-3]&","&RC[-2]&","&RC[-1]&"}," -> {202000,0,1,30}, | Q20: =R[-1]C&RC[-1] -> {200000,0,1,30},{200001,0,1,30},{200002,0,1,30},{200003,0,1,30},{200006,0,1,30},{200010,0,1,5},{200011,0,1,10},{200012,0,1,10},{201000,0,1,30},{201001,0,1,30},{201002,0,1,30},{201003,0,1,30},{201006,0,1,30},{201010,0,1,5},{201011,0,1,10},{201012,0,1,10},{202000,0,1,30}, | S20: 201003 | T20: 魔法手镯 | U20: 1 | V20: 0 | W20: 1 | X20: 30 | Y20: ="{"&RC[-6]&","&RC[-3]&","&RC[-2]&","&RC[-1]&"}," -> {201003,0,1,30}, | Z20: =R[-1]C&RC[-1] -> {200000,0,1,30},{200001,0,1,30},{200002,0,1,30},{200003,0,1,30},{200006,0,1,30},{200010,0,1,5},{200011,0,1,10},{200012,0,1,10},{200013,0,1,10},{200015,0,1,10},{200016,0,1,10},{200017,0,1,10},{200019,0,1,10},{201000,0,1,30},{201001,0,1,30},{201002,0,1,30},{201003,0,1,30}, | AB20: 201003 | AC20: 魔法手镯 | AD20: 1 | AE20: 0 | AF20: 1 | AG20: 30 | AH20: ="{"&RC[-6]&","&RC[-3]&","&RC[-2]&","&RC[-1]&"}," -> {201003,0,1,30}, | AI20: =R[-1]C&RC[-1] -> {200000,0,1,30},{200001,0,1,30},{200002,0,1,30},{200003,0,1,30},{200006,0,1,30},{200010,0,1,5},{200011,0,1,10},{200012,0,1,10},{200013,0,1,10},{200015,0,1,10},{200016,0,1,10},{200017,0,1,10},{200019,0,1,10},{201000,0,1,30},{201001,0,1,30},{201002,0,1,30},{201003,0,1,30}, | AK20: 200030 | AL20: 开天 | AM20: 1 | AN20: 0 | AO20: 1 | AP20: 1 | AQ20: ="{"&RC[-6]&","&RC[-3]&","&RC[-2]&","&RC[-1]&"}," -> {200030,0,1,1}, | AR20: =R[-1]C&RC[-1] -> {200010,0,1,40},{200011,0,1,40},{200012,0,1,40},{200013,0,1,40},{200015,0,1,40},{200016,0,1,40},{200017,0,1,40},{200019,0,1,40},{200020,0,1,1},{200021,0,1,3},{200022,0,1,10},{200023,0,1,10},{200025,0,1,3},{200026,0,1,10},{200027,0,1,3},{200029,0,1,3},{200030,0,1,1}, | AT20: 200030 | AU20: 开天 | AV20: 1 | AW20: 0 | AX20: 1 | AY20: 1 | AZ20: ="{"&RC[-6]&","&RC[-3]&","&RC[-2]&","&RC[-1]&"}," -> {200030,0,1,1}, | BA20: =RC[-1] -> {200030,0,1,1}, | BC20: 200030 | BD20: 开天 | BE20: 1 | BF20: 0 | BG20: 1 | BH20: 1 | BI20: ="{"&RC[-6]&","&RC[-3]&","&RC[-2]&","&RC[-1]&"}," -> {200030,0,1,1}, | BJ20: =RC[-1] -> {200030,0,1,1},
A21: 110083 | B21: 黑铁矿+5 | D21: 0 | E21: 2 | F21: 1 | G21: ="{"&RC[-6]&","&RC[-3]&","&RC[-2]&","&RC[-1]&"}," -> {110083,0,2,1}, | H21: =RC[-1] -> {110083,0,2,1}, | J21: 202001 | K21: 轻盔 | L21: 1 | M21: 0 | N21: 1 | O21: 30 | P21: ="{"&RC[-6]&","&RC[-3]&","&RC[-2]&","&RC[-1]&"}," -> {202001,0,1,30}, | Q21: =R[-1]C&RC[-1] -> {200000,0,1,30},{200001,0,1,30},{200002,0,1,30},{200003,0,1,30},{200006,0,1,30},{200010,0,1,5},{200011,0,1,10},{200012,0,1,10},{201000,0,1,30},{201001,0,1,30},{201002,0,1,30},{201003,0,1,30},{201006,0,1,30},{201010,0,1,5},{201011,0,1,10},{201012,0,1,10},{202000,0,1,30},{202001,0,1,30}, | S21: 201006 | T21: 放大镜 | U21: 1 | V21: 0 | W21: 1 | X21: 30 | Y21: ="{"&RC[-6]&","&RC[-3]&","&RC[-2]&","&RC[-1]&"}," -> {201006,0,1,30}, | Z21: =R[-1]C&RC[-1] -> {200000,0,1,30},{200001,0,1,30},{200002,0,1,30},{200003,0,1,30},{200006,0,1,30},{200010,0,1,5},{200011,0,1,10},{200012,0,1,10},{200013,0,1,10},{200015,0,1,10},{200016,0,1,10},{200017,0,1,10},{200019,0,1,10},{201000,0,1,30},{201001,0,1,30},{201002,0,1,30},{201003,0,1,30},{201006,0,1,30}, | AB21: 201006 | AC21: 放大镜 | AD21: 1 | AE21: 0 | AF21: 1 | AG21: 30 | AH21: ="{"&RC[-6]&","&RC[-3]&","&RC[-2]&","&RC[-1]&"}," -> {201006,0,1,30}, | AI21: =R[-1]C&RC[-1] -> {200000,0,1,30},{200001,0,1,30},{200002,0,1,30},{200003,0,1,30},{200006,0,1,30},{200010,0,1,5},{200011,0,1,10},{200012,0,1,10},{200013,0,1,10},{200015,0,1,10},{200016,0,1,10},{200017,0,1,10},{200019,0,1,10},{201000,0,1,30},{201001,0,1,30},{201002,0,1,30},{201003,0,1,30},{201006,0,1,30}, | AK21: 200031 | AL21: 雷霆战甲 | AM21: 1 | AN21: 0 | AO21: 1 | AP21: 1 | AQ21: ="{"&RC[-6]&","&RC[-3]&","&RC[-2]&","&RC[-1]&"}," -> {200031,0,1,1}, | AR21: =R[-1]C&RC[-1] -> {200010,0,1,40},{200011,0,1,40},{200012,0,1,40},{200013,0,1,40},{200015,0,1,40},{200016,0,1,40},{200017,0,1,40},{200019,0,1,40},{200020,0,1,1},{200021,0,1,3},{200022,0,1,10},{200023,0,1,10},{200025,0,1,3},{200026,0,1,10},{200027,0,1,3},{200029,0,1,3},{200030,0,1,1},{200031,0,1,1}, | AT21: 200031 | AU21: 雷霆战甲 | AV21: 1 | AW21: 0 | AX21: 1 | AY21: 1 | AZ21: ="{"&RC[-6]&","&RC[-3]&","&RC[-2]&","&RC[-1]&"}," -> {200031,0,1,1}, | BA21: =RC[-1] -> {200031,0,1,1}, | BC21: 200031 | BD21: 雷霆战甲 | BE21: 1 | BF21: 0 | BG21: 1 | BH21: 1 | BI21: ="{"&RC[-6]&","&RC[-3]&","&RC[-2]&","&RC[-1]&"}," -> {200031,0,1,1}, | BJ21: =RC[-1] -> {200031,0,1,1},
A22: 110003 | B22: 洗炼石 | D22: 0 | E22: 2 | F22: 2 | G22: ="{"&RC[-6]&","&RC[-3]&","&RC[-2]&","&RC[-1]&"}," -> {110003,0,2,2}, | H22: =R[-1]C&RC[-1] -> {110083,0,2,1},{110003,0,2,2}, | J22: 202002 | K22: 铂金戒指 | L22: 1 | M22: 0 | N22: 1 | O22: 30 | P22: ="{"&RC[-6]&","&RC[-3]&","&RC[-2]&","&RC[-1]&"}," -> {202002,0,1,30}, | Q22: =R[-1]C&RC[-1] -> {200000,0,1,30},{200001,0,1,30},{200002,0,1,30},{200003,0,1,30},{200006,0,1,30},{200010,0,1,5},{200011,0,1,10},{200012,0,1,10},{201000,0,1,30},{201001,0,1,30},{201002,0,1,30},{201003,0,1,30},{201006,0,1,30},{201010,0,1,5},{201011,0,1,10},{201012,0,1,10},{202000,0,1,30},{202001,0,1,30},{202002,0,1,30}, | S22: 201010 | T22: 魔杖 | U22: 1 | V22: 0 | W22: 1 | X22: 5 | Y22: ="{"&RC[-6]&","&RC[-3]&","&RC[-2]&","&RC[-1]&"}," -> {201010,0,1,5}, | Z22: =R[-1]C&RC[-1] -> {200000,0,1,30},{200001,0,1,30},{200002,0,1,30},{200003,0,1,30},{200006,0,1,30},{200010,0,1,5},{200011,0,1,10},{200012,0,1,10},{200013,0,1,10},{200015,0,1,10},{200016,0,1,10},{200017,0,1,10},{200019,0,1,10},{201000,0,1,30},{201001,0,1,30},{201002,0,1,30},{201003,0,1,30},{201006,0,1,30},{201010,0,1,5}, | AB22: 201010 | AC22: 魔杖 | AD22: 1 | AE22: 0 | AF22: 1 | AG22: 5 | AH22: ="{"&RC[-6]&","&RC[-3]&","&RC[-2]&","&RC[-1]&"}," -> {201010,0,1,5}, | AI22: =R[-1]C&RC[-1] -> {200000,0,1,30},{200001,0,1,30},{200002,0,1,30},{200003,0,1,30},{200006,0,1,30},{200010,0,1,5},{200011,0,1,10},{200012,0,1,10},{200013,0,1,10},{200015,0,1,10},{200016,0,1,10},{200017,0,1,10},{200019,0,1,10},{201000,0,1,30},{201001,0,1,30},{201002,0,1,30},{201003,0,1,30},{201006,0,1,30},{201010,0,1,5}, | AK22: 200032 | AL22: 雷霆项链 | AM22: 1 | AN22: 0 | AO22: 1 | AP22: 5 | AQ22: ="{"&RC[-6]&","&RC[-3]&","&RC[-2]&","&RC[-1]&"}," -> {200032,0,1,5}, | AR22: =R[-1]C&RC[-1] -> {200010,0,1,40},{200011,0,1,40},{200012,0,1,40},{200013,0,1,40},{200015,0,1,40},{200016,0,1,40},{200017,0,1,40},{200019,0,1,40},{200020,0,1,1},{200021,0,1,3},{200022,0,1,10},{200023,0,1,10},{200025,0,1,3},{200026,0,1,10},{200027,0,1,3},{200029,0,1,3},{200030,0,1,1},{200031,0,1,1},{200032,0,1,5}, | AT22: 200032 | AU22: 雷霆项链 | AV22: 1 | AW22: 0 | AX22: 1 | AY22: 5 | AZ22: ="{"&RC[-6]&","&RC[-3]&","&RC[-2]&","&RC[-1]&"}," -> {200032,0,1,5}, | BA22: =RC[-1] -> {200032,0,1,5}, | BC22: 200032 | BD22: 雷霆项链 | BE22: 1 | BF22: 0 | BG22: 1 | BH22: 5 | BI22: ="{"&RC[-6]&","&RC[-3]&","&RC[-2]&","&RC[-1]&"}," -> {200032,0,1,5}, | BJ22: =RC[-1] -> {200032,0,1,5},
A23: 110004 | B23: 红药 | D23: 0 | E23: 1 | F23: 3 | G23: ="{"&RC[-6]&","&RC[-3]&","&RC[-2]&","&RC[-1]&"}," -> {110004,0,1,3}, | H23: =R[-1]C&RC[-1] -> {110083,0,2,1},{110003,0,2,2},{110004,0,1,3}, | J23: 202003 | K23: 三眼手镯 | L23: 1 | M23: 0 | N23: 1 | O23: 30 | P23: ="{"&RC[-6]&","&RC[-3]&","&RC[-2]&","&RC[-1]&"}," -> {202003,0,1,30}, | Q23: =R[-1]C&RC[-1] -> {200000,0,1,30},{200001,0,1,30},{200002,0,1,30},{200003,0,1,30},{200006,0,1,30},{200010,0,1,5},{200011,0,1,10},{200012,0,1,10},{201000,0,1,30},{201001,0,1,30},{201002,0,1,30},{201003,0,1,30},{201006,0,1,30},{201010,0,1,5},{201011,0,1,10},{201012,0,1,10},{202000,0,1,30},{202001,0,1,30},{202002,0,1,30},{202003,0,1,30}, | S23: 201011 | T23: 恶魔铃铛 | U23: 1 | V23: 0 | W23: 1 | X23: 10 | Y23: ="{"&RC[-6]&","&RC[-3]&","&RC[-2]&","&RC[-1]&"}," -> {201011,0,1,10}, | Z23: =R[-1]C&RC[-1] -> {200000,0,1,30},{200001,0,1,30},{200002,0,1,30},{200003,0,1,30},{200006,0,1,30},{200010,0,1,5},{200011,0,1,10},{200012,0,1,10},{200013,0,1,10},{200015,0,1,10},{200016,0,1,10},{200017,0,1,10},{200019,0,1,10},{201000,0,1,30},{201001,0,1,30},{201002,0,1,30},{201003,0,1,30},{201006,0,1,30},{201010,0,1,5},{201011,0,1,10}, | AB23: 201011 | AC23: 恶魔铃铛 | AD23: 1 | AE23: 0 | AF23: 1 | AG23: 10 | AH23: ="{"&RC[-6]&","&RC[-3]&","&RC[-2]&","&RC[-1]&"}," -> {201011,0,1,10}, | AI23: =R[-1]C&RC[-1] -> {200000,0,1,30},{200001,0,1,30},{200002,0,1,30},{200003,0,1,30},{200006,0,1,30},{200010,0,1,5},{200011,0,1,10},{200012,0,1,10},{200013,0,1,10},{200015,0,1,10},{200016,0,1,10},{200017,0,1,10},{200019,0,1,10},{201000,0,1,30},{201001,0,1,30},{201002,0,1,30},{201003,0,1,30},{201006,0,1,30},{201010,0,1,5},{201011,0,1,10}, | AK23: 200033 | AL23: 雷霆戒指 | AM23: 1 | AN23: 0 | AO23: 1 | AP23: 5 | AQ23: ="{"&RC[-6]&","&RC[-3]&","&RC[-2]&","&RC[-1]&"}," -> {200033,0,1,5}, | AR23: =R[-1]C&RC[-1] -> {200010,0,1,40},{200011,0,1,40},{200012,0,1,40},{200013,0,1,40},{200015,0,1,40},{200016,0,1,40},{200017,0,1,40},{200019,0,1,40},{200020,0,1,1},{200021,0,1,3},{200022,0,1,10},{200023,0,1,10},{200025,0,1,3},{200026,0,1,10},{200027,0,1,3},{200029,0,1,3},{200030,0,1,1},{200031,0,1,1},{200032,0,1,5},{200033,0,1,5}, | AT23: 200033 | AU23: 雷霆戒指 | AV23: 1 | AW23: 0 | AX23: 1 | AY23: 5 | AZ23: ="{"&RC[-6]&","&RC[-3]&","&RC[-2]&","&RC[-1]&"}," -> {200033,0,1,5}, | BA23: =RC[-1] -> {200033,0,1,5}, | BC23: 200033 | BD23: 雷霆戒指 | BE23: 1 | BF23: 0 | BG23: 1 | BH23: 5 | BI23: ="{"&RC[-6]&","&RC[-3]&","&RC[-2]&","&RC[-1]&"}," -> {200033,0,1,5}, | BJ23: =RC[-1] -> {200033,0,1,5},
A24: 110005 | B24: 蓝药 | D24: 0 | E24: 1 | F24: 3 | G24: ="{"&RC[-6]&","&RC[-3]&","&RC[-2]&","&RC[-1]&"}," -> {110005,0,1,3}, | H24: =R[-1]C&RC[-1] -> {110083,0,2,1},{110003,0,2,2},{110004,0,1,3},{110005,0,1,3}, | J24: 202006 | K24: 凤凰明珠 | L24: 1 | M24: 0 | N24: 1 | O24: 30 | P24: ="{"&RC[-6]&","&RC[-3]&","&RC[-2]&","&RC[-1]&"}," -> {202006,0,1,30}, | Q24: =R[-1]C&RC[-1] -> {200000,0,1,30},{200001,0,1,30},{200002,0,1,30},{200003,0,1,30},{200006,0,1,30},{200010,0,1,5},{200011,0,1,10},{200012,0,1,10},{201000,0,1,30},{201001,0,1,30},{201002,0,1,30},{201003,0,1,30},{201006,0,1,30},{201010,0,1,5},{201011,0,1,10},{201012,0,1,10},{202000,0,1,30},{202001,0,1,30},{202002,0,1,30},{202003,0,1,30},{202006,0,1,30}, | S24: 201012 | T24: 恶魔长袍 | U24: 1 | V24: 0 | W24: 1 | X24: 10 | Y24: ="{"&RC[-6]&","&RC[-3]&","&RC[-2]&","&RC[-1]&"}," -> {201012,0,1,10}, | Z24: =R[-1]C&RC[-1] -> {200000,0,1,30},{200001,0,1,30},{200002,0,1,30},{200003,0,1,30},{200006,0,1,30},{200010,0,1,5},{200011,0,1,10},{200012,0,1,10},{200013,0,1,10},{200015,0,1,10},{200016,0,1,10},{200017,0,1,10},{200019,0,1,10},{201000,0,1,30},{201001,0,1,30},{201002,0,1,30},{201003,0,1,30},{201006,0,1,30},{201010,0,1,5},{201011,0,1,10},{201012,0,1,10}, | AB24: 201012 | AC24: 恶魔长袍 | AD24: 1 | AE24: 0 | AF24: 1 | AG24: 10 | AH24: ="{"&RC[-6]&","&RC[-3]&","&RC[-2]&","&RC[-1]&"}," -> {201012,0,1,10}, | AI24: =R[-1]C&RC[-1] -> {200000,0,1,30},{200001,0,1,30},{200002,0,1,30},{200003,0,1,30},{200006,0,1,30},{200010,0,1,5},{200011,0,1,10},{200012,0,1,10},{200013,0,1,10},{200015,0,1,10},{200016,0,1,10},{200017,0,1,10},{200019,0,1,10},{201000,0,1,30},{201001,0,1,30},{201002,0,1,30},{201003,0,1,30},{201006,0,1,30},{201010,0,1,5},{201011,0,1,10},{201012,0,1,10}, | AK24: 200035 | AL24: 雷霆头盔 | AM24: 1 | AN24: 0 | AO24: 1 | AP24: 1 | AQ24: ="{"&RC[-6]&","&RC[-3]&","&RC[-2]&","&RC[-1]&"}," -> {200035,0,1,1}, | AR24: =R[-1]C&RC[-1] -> {200010,0,1,40},{200011,0,1,40},{200012,0,1,40},{200013,0,1,40},{200015,0,1,40},{200016,0,1,40},{200017,0,1,40},{200019,0,1,40},{200020,0,1,1},{200021,0,1,3},{200022,0,1,10},{200023,0,1,10},{200025,0,1,3},{200026,0,1,10},{200027,0,1,3},{200029,0,1,3},{200030,0,1,1},{200031,0,1,1},{200032,0,1,5},{200033,0,1,5},{200035,0,1,1}, | AT24: 200035 | AU24: 雷霆头盔 | AV24: 1 | AW24: 0 | AX24: 1 | AY24: 1 | AZ24: ="{"&RC[-6]&","&RC[-3]&","&RC[-2]&","&RC[-1]&"}," -> {200035,0,1,1}, | BA24: =RC[-1] -> {200035,0,1,1}, | BC24: 200035 | BD24: 雷霆头盔 | BE24: 1 | BF24: 0 | BG24: 1 | BH24: 1 | BI24: ="{"&RC[-6]&","&RC[-3]&","&RC[-2]&","&RC[-1]&"}," -> {200035,0,1,1}, | BJ24: =RC[-1] -> {200035,0,1,1},
A25: 110010 | B25: 普通武装碎片 | D25: 0 | E25: 1 | F25: 3 | G25: ="{"&RC[-6]&","&RC[-3]&","&RC[-2]&","&RC[-1]&"}," -> {110010,0,1,3}, | H25: =R[-1]C&RC[-1] -> {110083,0,2,1},{110003,0,2,2},{110004,0,1,3},{110005,0,1,3},{110010,0,1,3}, | J25: 202010 | K25: 银蛇 | L25: 1 | M25: 0 | N25: 1 | O25: 5 | P25: ="{"&RC[-6]&","&RC[-3]&","&RC[-2]&","&RC[-1]&"}," -> {202010,0,1,5}, | Q25: =R[-1]C&RC[-1] -> {200000,0,1,30},{200001,0,1,30},{200002,0,1,30},{200003,0,1,30},{200006,0,1,30},{200010,0,1,5},{200011,0,1,10},{200012,0,1,10},{201000,0,1,30},{201001,0,1,30},{201002,0,1,30},{201003,0,1,30},{201006,0,1,30},{201010,0,1,5},{201011,0,1,10},{201012,0,1,10},{202000,0,1,30},{202001,0,1,30},{202002,0,1,30},{202003,0,1,30},{202006,0,1,30},{202010,0,1,5}, | S25: 201013 | T25: 紫碧螺 | U25: 1 | V25: 0 | W25: 1 | X25: 10 | Y25: ="{"&RC[-6]&","&RC[-3]&","&RC[-2]&","&RC[-1]&"}," -> {201013,0,1,10}, | Z25: =R[-1]C&RC[-1] -> {200000,0,1,30},{200001,0,1,30},{200002,0,1,30},{200003,0,1,30},{200006,0,1,30},{200010,0,1,5},{200011,0,1,10},{200012,0,1,10},{200013,0,1,10},{200015,0,1,10},{200016,0,1,10},{200017,0,1,10},{200019,0,1,10},{201000,0,1,30},{201001,0,1,30},{201002,0,1,30},{201003,0,1,30},{201006,0,1,30},{201010,0,1,5},{201011,0,1,10},{201012,0,1,10},{201013,0,1,10}, | AB25: 201013 | AC25: 紫碧螺 | AD25: 1 | AE25: 0 | AF25: 1 | AG25: 10 | AH25: ="{"&RC[-6]&","&RC[-3]&","&RC[-2]&","&RC[-1]&"}," -> {201013,0,1,10}, | AI25: =R[-1]C&RC[-1] -> {200000,0,1,30},{200001,0,1,30},{200002,0,1,30},{200003,0,1,30},{200006,0,1,30},{200010,0,1,5},{200011,0,1,10},{200012,0,1,10},{200013,0,1,10},{200015,0,1,10},{200016,0,1,10},{200017,0,1,10},{200019,0,1,10},{201000,0,1,30},{201001,0,1,30},{201002,0,1,30},{201003,0,1,30},{201006,0,1,30},{201010,0,1,5},{201011,0,1,10},{201012,0,1,10},{201013,0,1,10}, | AK25: 200036 | AL25: 雷霆护腕 | AM25: 1 | AN25: 0 | AO25: 1 | AP25: 5 | AQ25: ="{"&RC[-6]&","&RC[-3]&","&RC[-2]&","&RC[-1]&"}," -> {200036,0,1,5}, | AR25: =R[-1]C&RC[-1] -> {200010,0,1,40},{200011,0,1,40},{200012,0,1,40},{200013,0,1,40},{200015,0,1,40},{200016,0,1,40},{200017,0,1,40},{200019,0,1,40},{200020,0,1,1},{200021,0,1,3},{200022,0,1,10},{200023,0,1,10},{200025,0,1,3},{200026,0,1,10},{200027,0,1,3},{200029,0,1,3},{200030,0,1,1},{200031,0,1,1},{200032,0,1,5},{200033,0,1,5},{200035,0,1,1},{200036,0,1,5}, | AT25: 200036 | AU25: 雷霆护腕 | AV25: 1 | AW25: 0 | AX25: 1 | AY25: 5 | AZ25: ="{"&RC[-6]&","&RC[-3]&","&RC[-2]&","&RC[-1]&"}," -> {200036,0,1,5}, | BA25: =RC[-1] -> {200036,0,1,5}, | BC25: 200036 | BD25: 雷霆护腕 | BE25: 1 | BF25: 0 | BG25: 1 | BH25: 5 | BI25: ="{"&RC[-6]&","&RC[-3]&","&RC[-2]&","&RC[-1]&"}," -> {200036,0,1,5}, | BJ25: =RC[-1] -> {200036,0,1,5},
A26: 110011 | B26: 普通防具碎片 | D26: 0 | E26: 1 | F26: 3 | G26: ="{"&RC[-6]&","&RC[-3]&","&RC[-2]&","&RC[-1]&"}," -> {110011,0,1,3}, | H26: =R[-1]C&RC[-1] -> {110083,0,2,1},{110003,0,2,2},{110004,0,1,3},{110005,0,1,3},{110010,0,1,3},{110011,0,1,3}, | J26: 202011 | K26: 天珠道链 | L26: 1 | M26: 0 | N26: 1 | O26: 10 | P26: ="{"&RC[-6]&","&RC[-3]&","&RC[-2]&","&RC[-1]&"}," -> {202011,0,1,10}, | Q26: =R[-1]C&RC[-1] -> {200000,0,1,30},{200001,0,1,30},{200002,0,1,30},{200003,0,1,30},{200006,0,1,30},{200010,0,1,5},{200011,0,1,10},{200012,0,1,10},{201000,0,1,30},{201001,0,1,30},{201002,0,1,30},{201003,0,1,30},{201006,0,1,30},{201010,0,1,5},{201011,0,1,10},{201012,0,1,10},{202000,0,1,30},{202001,0,1,30},{202002,0,1,30},{202003,0,1,30},{202006,0,1,30},{202010,0,1,5},{202011,0,1,10}, | S26: 201015 | T26: 法师头盔 | U26: 1 | V26: 0 | W26: 1 | X26: 10 | Y26: ="{"&RC[-6]&","&RC[-3]&","&RC[-2]&","&RC[-1]&"}," -> {201015,0,1,10}, | Z26: =R[-1]C&RC[-1] -> {200000,0,1,30},{200001,0,1,30},{200002,0,1,30},{200003,0,1,30},{200006,0,1,30},{200010,0,1,5},{200011,0,1,10},{200012,0,1,10},{200013,0,1,10},{200015,0,1,10},{200016,0,1,10},{200017,0,1,10},{200019,0,1,10},{201000,0,1,30},{201001,0,1,30},{201002,0,1,30},{201003,0,1,30},{201006,0,1,30},{201010,0,1,5},{201011,0,1,10},{201012,0,1,10},{201013,0,1,10},{201015,0,1,10}, | AB26: 201015 | AC26: 法师头盔 | AD26: 1 | AE26: 0 | AF26: 1 | AG26: 10 | AH26: ="{"&RC[-6]&","&RC[-3]&","&RC[-2]&","&RC[-1]&"}," -> {201015,0,1,10}, | AI26: =R[-1]C&RC[-1] -> {200000,0,1,30},{200001,0,1,30},{200002,0,1,30},{200003,0,1,30},{200006,0,1,30},{200010,0,1,5},{200011,0,1,10},{200012,0,1,10},{200013,0,1,10},{200015,0,1,10},{200016,0,1,10},{200017,0,1,10},{200019,0,1,10},{201000,0,1,30},{201001,0,1,30},{201002,0,1,30},{201003,0,1,30},{201006,0,1,30},{201010,0,1,5},{201011,0,1,10},{201012,0,1,10},{201013,0,1,10},{201015,0,1,10}, | AK26: 200037 | AL26: 雷霆腰带 | AM26: 1 | AN26: 0 | AO26: 1 | AP26: 1 | AQ26: ="{"&RC[-6]&","&RC[-3]&","&RC[-2]&","&RC[-1]&"}," -> {200037,0,1,1}, | AR26: =R[-1]C&RC[-1] -> {200010,0,1,40},{200011,0,1,40},{200012,0,1,40},{200013,0,1,40},{200015,0,1,40},{200016,0,1,40},{200017,0,1,40},{200019,0,1,40},{200020,0,1,1},{200021,0,1,3},{200022,0,1,10},{200023,0,1,10},{200025,0,1,3},{200026,0,1,10},{200027,0,1,3},{200029,0,1,3},{200030,0,1,1},{200031,0,1,1},{200032,0,1,5},{200033,0,1,5},{200035,0,1,1},{200036,0,1,5},{200037,0,1,1}, | AT26: 200037 | AU26: 雷霆腰带 | AV26: 1 | AW26: 0 | AX26: 1 | AY26: 1 | AZ26: ="{"&RC[-6]&","&RC[-3]&","&RC[-2]&","&RC[-1]&"}," -> {200037,0,1,1}, | BA26: =RC[-1] -> {200037,0,1,1}, | BC26: 200037 | BD26: 雷霆腰带 | BE26: 1 | BF26: 0 | BG26: 1 | BH26: 1 | BI26: ="{"&RC[-6]&","&RC[-3]&","&RC[-2]&","&RC[-1]&"}," -> {200037,0,1,1}, | BJ26: =RC[-1] -> {200037,0,1,1},
A27: 110012 | B27: 普通首饰碎片 | D27: 0 | E27: 1 | F27: 3 | G27: ="{"&RC[-6]&","&RC[-3]&","&RC[-2]&","&RC[-1]&"}" -> {110012,0,1,3} | H27: =R[-1]C&RC[-1] -> {110083,0,2,1},{110003,0,2,2},{110004,0,1,3},{110005,0,1,3},{110010,0,1,3},{110011,0,1,3},{110012,0,1,3} | J27: 202012 | K27: 灵魂道袍 | L27: 1 | M27: 0 | N27: 1 | O27: 10 | P27: ="{"&RC[-6]&","&RC[-3]&","&RC[-2]&","&RC[-1]&"}" -> {202012,0,1,10} | Q27: =R[-1]C&RC[-1] -> {200000,0,1,30},{200001,0,1,30},{200002,0,1,30},{200003,0,1,30},{200006,0,1,30},{200010,0,1,5},{200011,0,1,10},{200012,0,1,10},{201000,0,1,30},{201001,0,1,30},{201002,0,1,30},{201003,0,1,30},{201006,0,1,30},{201010,0,1,5},{201011,0,1,10},{201012,0,1,10},{202000,0,1,30},{202001,0,1,30},{202002,0,1,30},{202003,0,1,30},{202006,0,1,30},{202010,0,1,5},{202011,0,1,10},{202012,0,1,10} | S27: 201016 | T27: 龙之手镯 | U27: 1 | V27: 0 | W27: 1 | X27: 10 | Y27: ="{"&RC[-6]&","&RC[-3]&","&RC[-2]&","&RC[-1]&"}," -> {201016,0,1,10}, | Z27: =R[-1]C&RC[-1] -> {200000,0,1,30},{200001,0,1,30},{200002,0,1,30},{200003,0,1,30},{200006,0,1,30},{200010,0,1,5},{200011,0,1,10},{200012,0,1,10},{200013,0,1,10},{200015,0,1,10},{200016,0,1,10},{200017,0,1,10},{200019,0,1,10},{201000,0,1,30},{201001,0,1,30},{201002,0,1,30},{201003,0,1,30},{201006,0,1,30},{201010,0,1,5},{201011,0,1,10},{201012,0,1,10},{201013,0,1,10},{201015,0,1,10},{201016,0,1,10}, | AB27: 201016 | AC27: 龙之手镯 | AD27: 1 | AE27: 0 | AF27: 1 | AG27: 10 | AH27: ="{"&RC[-6]&","&RC[-3]&","&RC[-2]&","&RC[-1]&"}," -> {201016,0,1,10}, | AI27: =R[-1]C&RC[-1] -> {200000,0,1,30},{200001,0,1,30},{200002,0,1,30},{200003,0,1,30},{200006,0,1,30},{200010,0,1,5},{200011,0,1,10},{200012,0,1,10},{200013,0,1,10},{200015,0,1,10},{200016,0,1,10},{200017,0,1,10},{200019,0,1,10},{201000,0,1,30},{201001,0,1,30},{201002,0,1,30},{201003,0,1,30},{201006,0,1,30},{201010,0,1,5},{201011,0,1,10},{201012,0,1,10},{201013,0,1,10},{201015,0,1,10},{201016,0,1,10}, | AK27: 200039 | AL27: 雷霆战靴 | AM27: 1 | AN27: 0 | AO27: 1 | AP27: 1 | AQ27: ="{"&RC[-6]&","&RC[-3]&","&RC[-2]&","&RC[-1]&"}," -> {200039,0,1,1}, | AR27: =R[-1]C&RC[-1] -> {200010,0,1,40},{200011,0,1,40},{200012,0,1,40},{200013,0,1,40},{200015,0,1,40},{200016,0,1,40},{200017,0,1,40},{200019,0,1,40},{200020,0,1,1},{200021,0,1,3},{200022,0,1,10},{200023,0,1,10},{200025,0,1,3},{200026,0,1,10},{200027,0,1,3},{200029,0,1,3},{200030,0,1,1},{200031,0,1,1},{200032,0,1,5},{200033,0,1,5},{200035,0,1,1},{200036,0,1,5},{200037,0,1,1},{200039,0,1,1}, | AT27: 200039 | AU27: 雷霆战靴 | AV27: 1 | AW27: 0 | AX27: 1 | AY27: 1 | AZ27: ="{"&RC[-6]&","&RC[-3]&","&RC[-2]&","&RC[-1]&"}," -> {200039,0,1,1}, | BA27: =RC[-1] -> {200039,0,1,1}, | BC27: 200039 | BD27: 雷霆战靴 | BE27: 1 | BF27: 0 | BG27: 1 | BH27: 1 | BI27: ="{"&RC[-6]&","&RC[-3]&","&RC[-2]&","&RC[-1]&"}," -> {200039,0,1,1}, | BJ27: =RC[-1] -> {200039,0,1,1},
S28: 201017 | T28: 法师腰带 | U28: 1 | V28: 0 | W28: 1 | X28: 10 | Y28: ="{"&RC[-6]&","&RC[-3]&","&RC[-2]&","&RC[-1]&"}," -> {201017,0,1,10}, | Z28: =R[-1]C&RC[-1] -> {200000,0,1,30},{200001,0,1,30},{200002,0,1,30},{200003,0,1,30},{200006,0,1,30},{200010,0,1,5},{200011,0,1,10},{200012,0,1,10},{200013,0,1,10},{200015,0,1,10},{200016,0,1,10},{200017,0,1,10},{200019,0,1,10},{201000,0,1,30},{201001,0,1,30},{201002,0,1,30},{201003,0,1,30},{201006,0,1,30},{201010,0,1,5},{201011,0,1,10},{201012,0,1,10},{201013,0,1,10},{201015,0,1,10},{201016,0,1,10},{201017,0,1,10}, | AB28: 201017 | AC28: 法师腰带 | AD28: 1 | AE28: 0 | AF28: 1 | AG28: 10 | AH28: ="{"&RC[-6]&","&RC[-3]&","&RC[-2]&","&RC[-1]&"}," -> {201017,0,1,10}, | AI28: =R[-1]C&RC[-1] -> {200000,0,1,30},{200001,0,1,30},{200002,0,1,30},{200003,0,1,30},{200006,0,1,30},{200010,0,1,5},{200011,0,1,10},{200012,0,1,10},{200013,0,1,10},{200015,0,1,10},{200016,0,1,10},{200017,0,1,10},{200019,0,1,10},{201000,0,1,30},{201001,0,1,30},{201002,0,1,30},{201003,0,1,30},{201006,0,1,30},{201010,0,1,5},{201011,0,1,10},{201012,0,1,10},{201013,0,1,10},{201015,0,1,10},{201016,0,1,10},{201017,0,1,10}, | AK28: 201010 | AL28: 魔杖 | AM28: 1 | AN28: 0 | AO28: 1 | AP28: 40 | AQ28: ="{"&RC[-6]&","&RC[-3]&","&RC[-2]&","&RC[-1]&"}," -> {201010,0,1,40}, | AR28: =R[-1]C&RC[-1] -> {200010,0,1,40},{200011,0,1,40},{200012,0,1,40},{200013,0,1,40},{200015,0,1,40},{200016,0,1,40},{200017,0,1,40},{200019,0,1,40},{200020,0,1,1},{200021,0,1,3},{200022,0,1,10},{200023,0,1,10},{200025,0,1,3},{200026,0,1,10},{200027,0,1,3},{200029,0,1,3},{200030,0,1,1},{200031,0,1,1},{200032,0,1,5},{200033,0,1,5},{200035,0,1,1},{200036,0,1,5},{200037,0,1,1},{200039,0,1,1},{201010,0,1,40}, | AT28: 201010 | AU28: 魔杖 | AV28: 1 | AW28: 0 | AX28: 1 | AY28: 30 | AZ28: ="{"&RC[-6]&","&RC[-3]&","&RC[-2]&","&RC[-1]&"}," -> {201010,0,1,30}, | BA28: =RC[-1] -> {201010,0,1,30}, | BC28: 201010 | BD28: 魔杖 | BE28: 1 | BF28: 0 | BG28: 1 | BH28: 30 | BI28: ="{"&RC[-6]&","&RC[-3]&","&RC[-2]&","&RC[-1]&"}," -> {201010,0,1,30}, | BJ28: =RC[-1] -> {201010,0,1,30},
S29: 201019 | T29: 法师鞋子 | U29: 1 | V29: 0 | W29: 1 | X29: 10 | Y29: ="{"&RC[-6]&","&RC[-3]&","&RC[-2]&","&RC[-1]&"}," -> {201019,0,1,10}, | Z29: =R[-1]C&RC[-1] -> {200000,0,1,30},{200001,0,1,30},{200002,0,1,30},{200003,0,1,30},{200006,0,1,30},{200010,0,1,5},{200011,0,1,10},{200012,0,1,10},{200013,0,1,10},{200015,0,1,10},{200016,0,1,10},{200017,0,1,10},{200019,0,1,10},{201000,0,1,30},{201001,0,1,30},{201002,0,1,30},{201003,0,1,30},{201006,0,1,30},{201010,0,1,5},{201011,0,1,10},{201012,0,1,10},{201013,0,1,10},{201015,0,1,10},{201016,0,1,10},{201017,0,1,10},{201019,0,1,10}, | AB29: 201019 | AC29: 法师鞋子 | AD29: 1 | AE29: 0 | AF29: 1 | AG29: 10 | AH29: ="{"&RC[-6]&","&RC[-3]&","&RC[-2]&","&RC[-1]&"}," -> {201019,0,1,10}, | AI29: =R[-1]C&RC[-1] -> {200000,0,1,30},{200001,0,1,30},{200002,0,1,30},{200003,0,1,30},{200006,0,1,30},{200010,0,1,5},{200011,0,1,10},{200012,0,1,10},{200013,0,1,10},{200015,0,1,10},{200016,0,1,10},{200017,0,1,10},{200019,0,1,10},{201000,0,1,30},{201001,0,1,30},{201002,0,1,30},{201003,0,1,30},{201006,0,1,30},{201010,0,1,5},{201011,0,1,10},{201012,0,1,10},{201013,0,1,10},{201015,0,1,10},{201016,0,1,10},{201017,0,1,10},{201019,0,1,10}, | AK29: 201011 | AL29: 恶魔铃铛 | AM29: 1 | AN29: 0 | AO29: 1 | AP29: 40 | AQ29: ="{"&RC[-6]&","&RC[-3]&","&RC[-2]&","&RC[-1]&"}," -> {201011,0,1,40}, | AR29: =R[-1]C&RC[-1] -> {200010,0,1,40},{200011,0,1,40},{200012,0,1,40},{200013,0,1,40},{200015,0,1,40},{200016,0,1,40},{200017,0,1,40},{200019,0,1,40},{200020,0,1,1},{200021,0,1,3},{200022,0,1,10},{200023,0,1,10},{200025,0,1,3},{200026,0,1,10},{200027,0,1,3},{200029,0,1,3},{200030,0,1,1},{200031,0,1,1},{200032,0,1,5},{200033,0,1,5},{200035,0,1,1},{200036,0,1,5},{200037,0,1,1},{200039,0,1,1},{201010,0,1,40},{201011,0,1,40}, | AT29: 201011 | AU29: 恶魔铃铛 | AV29: 1 | AW29: 0 | AX29: 1 | AY29: 30 | AZ29: ="{"&RC[-6]&","&RC[-3]&","&RC[-2]&","&RC[-1]&"}," -> {201011,0,1,30}, | BA29: =RC[-1] -> {201011,0,1,30}, | BC29: 201011 | BD29: 恶魔铃铛 | BE29: 1 | BF29: 0 | BG29: 1 | BH29: 30 | BI29: ="{"&RC[-6]&","&RC[-3]&","&RC[-2]&","&RC[-1]&"}," -> {201011,0,1,30}, | BJ29: =RC[-1] -> {201011,0,1,30},
A30: BOSS怪掉落 | F30: 装备 | G30: 概率／100 | J30: 110023 | K30: 烈火剑法书 | L30: 1 | M30: 0 | N30: 1 | O30: 5 | P30: ="{"&RC[-6]&","&RC[-3]&","&RC[-2]&","&RC[-1]&"}," -> {110023,0,1,5}, | Q30: =RC[-1] -> {110023,0,1,5}, | S30: 202000 | T30: 半月 | U30: 1 | V30: 0 | W30: 1 | X30: 30 | Y30: ="{"&RC[-6]&","&RC[-3]&","&RC[-2]&","&RC[-1]&"}," -> {202000,0,1,30}, | Z30: =R[-1]C&RC[-1] -> {200000,0,1,30},{200001,0,1,30},{200002,0,1,30},{200003,0,1,30},{200006,0,1,30},{200010,0,1,5},{200011,0,1,10},{200012,0,1,10},{200013,0,1,10},{200015,0,1,10},{200016,0,1,10},{200017,0,1,10},{200019,0,1,10},{201000,0,1,30},{201001,0,1,30},{201002,0,1,30},{201003,0,1,30},{201006,0,1,30},{201010,0,1,5},{201011,0,1,10},{201012,0,1,10},{201013,0,1,10},{201015,0,1,10},{201016,0,1,10},{201017,0,1,10},{201019,0,1,10},{202000,0,1,30}, | AB30: 202000 | AC30: 半月 | AD30: 1 | AE30: 0 | AF30: 1 | AG30: 30 | AH30: ="{"&RC[-6]&","&RC[-3]&","&RC[-2]&","&RC[-1]&"}," -> {202000,0,1,30}, | AI30: =R[-1]C&RC[-1] -> {200000,0,1,30},{200001,0,1,30},{200002,0,1,30},{200003,0,1,30},{200006,0,1,30},{200010,0,1,5},{200011,0,1,10},{200012,0,1,10},{200013,0,1,10},{200015,0,1,10},{200016,0,1,10},{200017,0,1,10},{200019,0,1,10},{201000,0,1,30},{201001,0,1,30},{201002,0,1,30},{201003,0,1,30},{201006,0,1,30},{201010,0,1,5},{201011,0,1,10},{201012,0,1,10},{201013,0,1,10},{201015,0,1,10},{201016,0,1,10},{201017,0,1,10},{201019,0,1,10},{202000,0,1,30}, | AK30: 201012 | AL30: 恶魔长袍 | AM30: 1 | AN30: 0 | AO30: 1 | AP30: 40 | AQ30: ="{"&RC[-6]&","&RC[-3]&","&RC[-2]&","&RC[-1]&"}," -> {201012,0,1,40}, | AR30: =R[-1]C&RC[-1] -> {200010,0,1,40},{200011,0,1,40},{200012,0,1,40},{200013,0,1,40},{200015,0,1,40},{200016,0,1,40},{200017,0,1,40},{200019,0,1,40},{200020,0,1,1},{200021,0,1,3},{200022,0,1,10},{200023,0,1,10},{200025,0,1,3},{200026,0,1,10},{200027,0,1,3},{200029,0,1,3},{200030,0,1,1},{200031,0,1,1},{200032,0,1,5},{200033,0,1,5},{200035,0,1,1},{200036,0,1,5},{200037,0,1,1},{200039,0,1,1},{201010,0,1,40},{201011,0,1,40},{201012,0,1,40}, | AT30: 201012 | AU30: 恶魔长袍 | AV30: 1 | AW30: 0 | AX30: 1 | AY30: 30 | AZ30: ="{"&RC[-6]&","&RC[-3]&","&RC[-2]&","&RC[-1]&"}," -> {201012,0,1,30}, | BA30: =RC[-1] -> {201012,0,1,30}, | BC30: 201012 | BD30: 恶魔长袍 | BE30: 1 | BF30: 0 | BG30: 1 | BH30: 30 | BI30: ="{"&RC[-6]&","&RC[-3]&","&RC[-2]&","&RC[-1]&"}," -> {201012,0,1,30}, | BJ30: =RC[-1] -> {201012,0,1,30},
F31: 3 | G31: 100 | H31: ="{0,[{"&RC[-2]&","&RC[-1]&"}],["&R[-13]C&"]}" -> {0,[{3,100}],[{200000,0,1,100},{200001,0,1,100},{200002,0,1,100},{200003,0,1,100},{200006,0,1,100},{201000,0,1,100},{201001,0,1,100},{201002,0,1,100},{201003,0,1,100},{201006,0,1,100},{202000,0,1,100},{202001,0,1,100},{202002,0,1,100},{202003,0,1,100},{202006,0,1,100}]} | J31: 110024 | K31: 狂风斩书 | L31: 1 | M31: 0 | N31: 1 | O31: 5 | P31: ="{"&RC[-6]&","&RC[-3]&","&RC[-2]&","&RC[-1]&"}," -> {110024,0,1,5}, | Q31: =R[-1]C&RC[-1] -> {110023,0,1,5},{110024,0,1,5}, | S31: 202001 | T31: 轻盔 | U31: 1 | V31: 0 | W31: 1 | X31: 30 | Y31: ="{"&RC[-6]&","&RC[-3]&","&RC[-2]&","&RC[-1]&"}," -> {202001,0,1,30}, | Z31: =R[-1]C&RC[-1] -> {200000,0,1,30},{200001,0,1,30},{200002,0,1,30},{200003,0,1,30},{200006,0,1,30},{200010,0,1,5},{200011,0,1,10},{200012,0,1,10},{200013,0,1,10},{200015,0,1,10},{200016,0,1,10},{200017,0,1,10},{200019,0,1,10},{201000,0,1,30},{201001,0,1,30},{201002,0,1,30},{201003,0,1,30},{201006,0,1,30},{201010,0,1,5},{201011,0,1,10},{201012,0,1,10},{201013,0,1,10},{201015,0,1,10},{201016,0,1,10},{201017,0,1,10},{201019,0,1,10},{202000,0,1,30},{202001,0,1,30}, | AB31: 202001 | AC31: 轻盔 | AD31: 1 | AE31: 0 | AF31: 1 | AG31: 30 | AH31: ="{"&RC[-6]&","&RC[-3]&","&RC[-2]&","&RC[-1]&"}," -> {202001,0,1,30}, | AI31: =R[-1]C&RC[-1] -> {200000,0,1,30},{200001,0,1,30},{200002,0,1,30},{200003,0,1,30},{200006,0,1,30},{200010,0,1,5},{200011,0,1,10},{200012,0,1,10},{200013,0,1,10},{200015,0,1,10},{200016,0,1,10},{200017,0,1,10},{200019,0,1,10},{201000,0,1,30},{201001,0,1,30},{201002,0,1,30},{201003,0,1,30},{201006,0,1,30},{201010,0,1,5},{201011,0,1,10},{201012,0,1,10},{201013,0,1,10},{201015,0,1,10},{201016,0,1,10},{201017,0,1,10},{201019,0,1,10},{202000,0,1,30},{202001,0,1,30}, | AK31: 201013 | AL31: 紫碧螺 | AM31: 1 | AN31: 0 | AO31: 1 | AP31: 40 | AQ31: ="{"&RC[-6]&","&RC[-3]&","&RC[-2]&","&RC[-1]&"}," -> {201013,0,1,40}, | AR31: =R[-1]C&RC[-1] -> {200010,0,1,40},{200011,0,1,40},{200012,0,1,40},{200013,0,1,40},{200015,0,1,40},{200016,0,1,40},{200017,0,1,40},{200019,0,1,40},{200020,0,1,1},{200021,0,1,3},{200022,0,1,10},{200023,0,1,10},{200025,0,1,3},{200026,0,1,10},{200027,0,1,3},{200029,0,1,3},{200030,0,1,1},{200031,0,1,1},{200032,0,1,5},{200033,0,1,5},{200035,0,1,1},{200036,0,1,5},{200037,0,1,1},{200039,0,1,1},{201010,0,1,40},{201011,0,1,40},{201012,0,1,40},{201013,0,1,40}, | AT31: 201013 | AU31: 紫碧螺 | AV31: 1 | AW31: 0 | AX31: 1 | AY31: 30 | AZ31: ="{"&RC[-6]&","&RC[-3]&","&RC[-2]&","&RC[-1]&"}," -> {201013,0,1,30}, | BA31: =RC[-1] -> {201013,0,1,30}, | BC31: 201013 | BD31: 紫碧螺 | BE31: 1 | BF31: 0 | BG31: 1 | BH31: 30 | BI31: ="{"&RC[-6]&","&RC[-3]&","&RC[-2]&","&RC[-1]&"}," -> {201013,0,1,30}, | BJ31: =RC[-1] -> {201013,0,1,30},
F32: 道具 | G32: 概率／100 | J32: 110025 | K32: 逐日剑法书 | L32: 1 | M32: 0 | N32: 1 | O32: 5 | P32: ="{"&RC[-6]&","&RC[-3]&","&RC[-2]&","&RC[-1]&"}," -> {110025,0,1,5}, | Q32: =R[-1]C&RC[-1] -> {110023,0,1,5},{110024,0,1,5},{110025,0,1,5}, | S32: 202002 | T32: 铂金戒指 | U32: 1 | V32: 0 | W32: 1 | X32: 30 | Y32: ="{"&RC[-6]&","&RC[-3]&","&RC[-2]&","&RC[-1]&"}," -> {202002,0,1,30}, | Z32: =R[-1]C&RC[-1] -> {200000,0,1,30},{200001,0,1,30},{200002,0,1,30},{200003,0,1,30},{200006,0,1,30},{200010,0,1,5},{200011,0,1,10},{200012,0,1,10},{200013,0,1,10},{200015,0,1,10},{200016,0,1,10},{200017,0,1,10},{200019,0,1,10},{201000,0,1,30},{201001,0,1,30},{201002,0,1,30},{201003,0,1,30},{201006,0,1,30},{201010,0,1,5},{201011,0,1,10},{201012,0,1,10},{201013,0,1,10},{201015,0,1,10},{201016,0,1,10},{201017,0,1,10},{201019,0,1,10},{202000,0,1,30},{202001,0,1,30},{202002,0,1,30}, | AB32: 202002 | AC32: 铂金戒指 | AD32: 1 | AE32: 0 | AF32: 1 | AG32: 30 | AH32: ="{"&RC[-6]&","&RC[-3]&","&RC[-2]&","&RC[-1]&"}," -> {202002,0,1,30}, | AI32: =R[-1]C&RC[-1] -> {200000,0,1,30},{200001,0,1,30},{200002,0,1,30},{200003,0,1,30},{200006,0,1,30},{200010,0,1,5},{200011,0,1,10},{200012,0,1,10},{200013,0,1,10},{200015,0,1,10},{200016,0,1,10},{200017,0,1,10},{200019,0,1,10},{201000,0,1,30},{201001,0,1,30},{201002,0,1,30},{201003,0,1,30},{201006,0,1,30},{201010,0,1,5},{201011,0,1,10},{201012,0,1,10},{201013,0,1,10},{201015,0,1,10},{201016,0,1,10},{201017,0,1,10},{201019,0,1,10},{202000,0,1,30},{202001,0,1,30},{202002,0,1,30}, | AK32: 201015 | AL32: 法师头盔 | AM32: 1 | AN32: 0 | AO32: 1 | AP32: 40 | AQ32: ="{"&RC[-6]&","&RC[-3]&","&RC[-2]&","&RC[-1]&"}," -> {201015,0,1,40}, | AR32: =R[-1]C&RC[-1] -> {200010,0,1,40},{200011,0,1,40},{200012,0,1,40},{200013,0,1,40},{200015,0,1,40},{200016,0,1,40},{200017,0,1,40},{200019,0,1,40},{200020,0,1,1},{200021,0,1,3},{200022,0,1,10},{200023,0,1,10},{200025,0,1,3},{200026,0,1,10},{200027,0,1,3},{200029,0,1,3},{200030,0,1,1},{200031,0,1,1},{200032,0,1,5},{200033,0,1,5},{200035,0,1,1},{200036,0,1,5},{200037,0,1,1},{200039,0,1,1},{201010,0,1,40},{201011,0,1,40},{201012,0,1,40},{201013,0,1,40},{201015,0,1,40}, | AT32: 201015 | AU32: 法师头盔 | AV32: 1 | AW32: 0 | AX32: 1 | AY32: 30 | AZ32: ="{"&RC[-6]&","&RC[-3]&","&RC[-2]&","&RC[-1]&"}," -> {201015,0,1,30}, | BA32: =RC[-1] -> {201015,0,1,30}, | BC32: 201015 | BD32: 法师头盔 | BE32: 1 | BF32: 0 | BG32: 1 | BH32: 30 | BI32: ="{"&RC[-6]&","&RC[-3]&","&RC[-2]&","&RC[-1]&"}," -> {201015,0,1,30}, | BJ32: =RC[-1] -> {201015,0,1,30},
F33: 2 | G33: 100 | H33: ="{0,[{"&RC[-2]&","&RC[-1]&"}],["&R[-6]C&"]}" -> {0,[{2,100}],[{110083,0,2,1},{110003,0,2,2},{110004,0,1,3},{110005,0,1,3},{110010,0,1,3},{110011,0,1,3},{110012,0,1,3}]} | J33: 110026 | K33: 灵魂火符书 | L33: 1 | M33: 0 | N33: 1 | O33: 5 | P33: ="{"&RC[-6]&","&RC[-3]&","&RC[-2]&","&RC[-1]&"}," -> {110026,0,1,5}, | Q33: =R[-1]C&RC[-1] -> {110023,0,1,5},{110024,0,1,5},{110025,0,1,5},{110026,0,1,5}, | S33: 202003 | T33: 三眼手镯 | U33: 1 | V33: 0 | W33: 1 | X33: 30 | Y33: ="{"&RC[-6]&","&RC[-3]&","&RC[-2]&","&RC[-1]&"}," -> {202003,0,1,30}, | Z33: =R[-1]C&RC[-1] -> {200000,0,1,30},{200001,0,1,30},{200002,0,1,30},{200003,0,1,30},{200006,0,1,30},{200010,0,1,5},{200011,0,1,10},{200012,0,1,10},{200013,0,1,10},{200015,0,1,10},{200016,0,1,10},{200017,0,1,10},{200019,0,1,10},{201000,0,1,30},{201001,0,1,30},{201002,0,1,30},{201003,0,1,30},{201006,0,1,30},{201010,0,1,5},{201011,0,1,10},{201012,0,1,10},{201013,0,1,10},{201015,0,1,10},{201016,0,1,10},{201017,0,1,10},{201019,0,1,10},{202000,0,1,30},{202001,0,1,30},{202002,0,1,30},{202003,0,1,30}, | AB33: 202003 | AC33: 三眼手镯 | AD33: 1 | AE33: 0 | AF33: 1 | AG33: 30 | AH33: ="{"&RC[-6]&","&RC[-3]&","&RC[-2]&","&RC[-1]&"}," -> {202003,0,1,30}, | AI33: =R[-1]C&RC[-1] -> {200000,0,1,30},{200001,0,1,30},{200002,0,1,30},{200003,0,1,30},{200006,0,1,30},{200010,0,1,5},{200011,0,1,10},{200012,0,1,10},{200013,0,1,10},{200015,0,1,10},{200016,0,1,10},{200017,0,1,10},{200019,0,1,10},{201000,0,1,30},{201001,0,1,30},{201002,0,1,30},{201003,0,1,30},{201006,0,1,30},{201010,0,1,5},{201011,0,1,10},{201012,0,1,10},{201013,0,1,10},{201015,0,1,10},{201016,0,1,10},{201017,0,1,10},{201019,0,1,10},{202000,0,1,30},{202001,0,1,30},{202002,0,1,30},{202003,0,1,30}, | AK33: 201016 | AL33: 龙之手镯 | AM33: 1 | AN33: 0 | AO33: 1 | AP33: 40 | AQ33: ="{"&RC[-6]&","&RC[-3]&","&RC[-2]&","&RC[-1]&"}," -> {201016,0,1,40}, | AR33: =R[-1]C&RC[-1] -> {200010,0,1,40},{200011,0,1,40},{200012,0,1,40},{200013,0,1,40},{200015,0,1,40},{200016,0,1,40},{200017,0,1,40},{200019,0,1,40},{200020,0,1,1},{200021,0,1,3},{200022,0,1,10},{200023,0,1,10},{200025,0,1,3},{200026,0,1,10},{200027,0,1,3},{200029,0,1,3},{200030,0,1,1},{200031,0,1,1},{200032,0,1,5},{200033,0,1,5},{200035,0,1,1},{200036,0,1,5},{200037,0,1,1},{200039,0,1,1},{201010,0,1,40},{201011,0,1,40},{201012,0,1,40},{201013,0,1,40},{201015,0,1,40},{201016,0,1,40}, | AT33: 201016 | AU33: 龙之手镯 | AV33: 1 | AW33: 0 | AX33: 1 | AY33: 30 | AZ33: ="{"&RC[-6]&","&RC[-3]&","&RC[-2]&","&RC[-1]&"}," -> {201016,0,1,30}, | BA33: =RC[-1] -> {201016,0,1,30}, | BC33: 201016 | BD33: 龙之手镯 | BE33: 1 | BF33: 0 | BG33: 1 | BH33: 30 | BI33: ="{"&RC[-6]&","&RC[-3]&","&RC[-2]&","&RC[-1]&"}," -> {201016,0,1,30}, | BJ33: =RC[-1] -> {201016,0,1,30},
F34: 金币 | G34: 概率／100 | J34: 110030 | K34: 战甲术书 | L34: 1 | M34: 0 | N34: 1 | O34: 5 | P34: ="{"&RC[-6]&","&RC[-3]&","&RC[-2]&","&RC[-1]&"}," -> {110030,0,1,5}, | Q34: =R[-1]C&RC[-1] -> {110023,0,1,5},{110024,0,1,5},{110025,0,1,5},{110026,0,1,5},{110030,0,1,5}, | S34: 202006 | T34: 凤凰明珠 | U34: 1 | V34: 0 | W34: 1 | X34: 30 | Y34: ="{"&RC[-6]&","&RC[-3]&","&RC[-2]&","&RC[-1]&"}," -> {202006,0,1,30}, | Z34: =R[-1]C&RC[-1] -> {200000,0,1,30},{200001,0,1,30},{200002,0,1,30},{200003,0,1,30},{200006,0,1,30},{200010,0,1,5},{200011,0,1,10},{200012,0,1,10},{200013,0,1,10},{200015,0,1,10},{200016,0,1,10},{200017,0,1,10},{200019,0,1,10},{201000,0,1,30},{201001,0,1,30},{201002,0,1,30},{201003,0,1,30},{201006,0,1,30},{201010,0,1,5},{201011,0,1,10},{201012,0,1,10},{201013,0,1,10},{201015,0,1,10},{201016,0,1,10},{201017,0,1,10},{201019,0,1,10},{202000,0,1,30},{202001,0,1,30},{202002,0,1,30},{202003,0,1,30},{202006,0,1,30}, | AB34: 202006 | AC34: 凤凰明珠 | AD34: 1 | AE34: 0 | AF34: 1 | AG34: 30 | AH34: ="{"&RC[-6]&","&RC[-3]&","&RC[-2]&","&RC[-1]&"}," -> {202006,0,1,30}, | AI34: =R[-1]C&RC[-1] -> {200000,0,1,30},{200001,0,1,30},{200002,0,1,30},{200003,0,1,30},{200006,0,1,30},{200010,0,1,5},{200011,0,1,10},{200012,0,1,10},{200013,0,1,10},{200015,0,1,10},{200016,0,1,10},{200017,0,1,10},{200019,0,1,10},{201000,0,1,30},{201001,0,1,30},{201002,0,1,30},{201003,0,1,30},{201006,0,1,30},{201010,0,1,5},{201011,0,1,10},{201012,0,1,10},{201013,0,1,10},{201015,0,1,10},{201016,0,1,10},{201017,0,1,10},{201019,0,1,10},{202000,0,1,30},{202001,0,1,30},{202002,0,1,30},{202003,0,1,30},{202006,0,1,30}, | AK34: 201017 | AL34: 法师腰带 | AM34: 1 | AN34: 0 | AO34: 1 | AP34: 40 | AQ34: ="{"&RC[-6]&","&RC[-3]&","&RC[-2]&","&RC[-1]&"}," -> {201017,0,1,40}, | AR34: =R[-1]C&RC[-1] -> {200010,0,1,40},{200011,0,1,40},{200012,0,1,40},{200013,0,1,40},{200015,0,1,40},{200016,0,1,40},{200017,0,1,40},{200019,0,1,40},{200020,0,1,1},{200021,0,1,3},{200022,0,1,10},{200023,0,1,10},{200025,0,1,3},{200026,0,1,10},{200027,0,1,3},{200029,0,1,3},{200030,0,1,1},{200031,0,1,1},{200032,0,1,5},{200033,0,1,5},{200035,0,1,1},{200036,0,1,5},{200037,0,1,1},{200039,0,1,1},{201010,0,1,40},{201011,0,1,40},{201012,0,1,40},{201013,0,1,40},{201015,0,1,40},{201016,0,1,40},{201017,0,1,40}, | AT34: 201017 | AU34: 法师腰带 | AV34: 1 | AW34: 0 | AX34: 1 | AY34: 30 | AZ34: ="{"&RC[-6]&","&RC[-3]&","&RC[-2]&","&RC[-1]&"}," -> {201017,0,1,30}, | BA34: =RC[-1] -> {201017,0,1,30}, | BC34: 201017 | BD34: 法师腰带 | BE34: 1 | BF34: 0 | BG34: 1 | BH34: 30 | BI34: ="{"&RC[-6]&","&RC[-3]&","&RC[-2]&","&RC[-1]&"}," -> {201017,0,1,30}, | BJ34: =RC[-1] -> {201017,0,1,30},
F35: 3 | G35: 100 | H35: {0,[{10,100}],[{110009,1,1000,1}]} | J35: 110031 | K35: 召唤神兽书 | L35: 1 | M35: 0 | N35: 1 | O35: 5 | P35: ="{"&RC[-6]&","&RC[-3]&","&RC[-2]&","&RC[-1]&"}," -> {110031,0,1,5}, | Q35: =R[-1]C&RC[-1] -> {110023,0,1,5},{110024,0,1,5},{110025,0,1,5},{110026,0,1,5},{110030,0,1,5},{110031,0,1,5}, | S35: 202010 | T35: 银蛇 | U35: 1 | V35: 0 | W35: 1 | X35: 5 | Y35: ="{"&RC[-6]&","&RC[-3]&","&RC[-2]&","&RC[-1]&"}," -> {202010,0,1,5}, | Z35: =R[-1]C&RC[-1] -> {200000,0,1,30},{200001,0,1,30},{200002,0,1,30},{200003,0,1,30},{200006,0,1,30},{200010,0,1,5},{200011,0,1,10},{200012,0,1,10},{200013,0,1,10},{200015,0,1,10},{200016,0,1,10},{200017,0,1,10},{200019,0,1,10},{201000,0,1,30},{201001,0,1,30},{201002,0,1,30},{201003,0,1,30},{201006,0,1,30},{201010,0,1,5},{201011,0,1,10},{201012,0,1,10},{201013,0,1,10},{201015,0,1,10},{201016,0,1,10},{201017,0,1,10},{201019,0,1,10},{202000,0,1,30},{202001,0,1,30},{202002,0,1,30},{202003,0,1,30},{202006,0,1,30},{202010,0,1,5}, | AB35: 202010 | AC35: 银蛇 | AD35: 1 | AE35: 0 | AF35: 1 | AG35: 5 | AH35: ="{"&RC[-6]&","&RC[-3]&","&RC[-2]&","&RC[-1]&"}," -> {202010,0,1,5}, | AI35: =R[-1]C&RC[-1] -> {200000,0,1,30},{200001,0,1,30},{200002,0,1,30},{200003,0,1,30},{200006,0,1,30},{200010,0,1,5},{200011,0,1,10},{200012,0,1,10},{200013,0,1,10},{200015,0,1,10},{200016,0,1,10},{200017,0,1,10},{200019,0,1,10},{201000,0,1,30},{201001,0,1,30},{201002,0,1,30},{201003,0,1,30},{201006,0,1,30},{201010,0,1,5},{201011,0,1,10},{201012,0,1,10},{201013,0,1,10},{201015,0,1,10},{201016,0,1,10},{201017,0,1,10},{201019,0,1,10},{202000,0,1,30},{202001,0,1,30},{202002,0,1,30},{202003,0,1,30},{202006,0,1,30},{202010,0,1,5}, | AK35: 201019 | AL35: 法师鞋子 | AM35: 1 | AN35: 0 | AO35: 1 | AP35: 40 | AQ35: ="{"&RC[-6]&","&RC[-3]&","&RC[-2]&","&RC[-1]&"}," -> {201019,0,1,40}, | AR35: =R[-1]C&RC[-1] -> {200010,0,1,40},{200011,0,1,40},{200012,0,1,40},{200013,0,1,40},{200015,0,1,40},{200016,0,1,40},{200017,0,1,40},{200019,0,1,40},{200020,0,1,1},{200021,0,1,3},{200022,0,1,10},{200023,0,1,10},{200025,0,1,3},{200026,0,1,10},{200027,0,1,3},{200029,0,1,3},{200030,0,1,1},{200031,0,1,1},{200032,0,1,5},{200033,0,1,5},{200035,0,1,1},{200036,0,1,5},{200037,0,1,1},{200039,0,1,1},{201010,0,1,40},{201011,0,1,40},{201012,0,1,40},{201013,0,1,40},{201015,0,1,40},{201016,0,1,40},{201017,0,1,40},{201019,0,1,40}, | AT35: 201019 | AU35: 法师鞋子 | AV35: 1 | AW35: 0 | AX35: 1 | AY35: 30 | AZ35: ="{"&RC[-6]&","&RC[-3]&","&RC[-2]&","&RC[-1]&"}," -> {201019,0,1,30}, | BA35: =RC[-1] -> {201019,0,1,30}, | BC35: 201019 | BD35: 法师鞋子 | BE35: 1 | BF35: 0 | BG35: 1 | BH35: 30 | BI35: ="{"&RC[-6]&","&RC[-3]&","&RC[-2]&","&RC[-1]&"}," -> {201019,0,1,30}, | BJ35: =RC[-1] -> {201019,0,1,30},
J36: 110032 | K36: 嗜血术书 | L36: 1 | M36: 0 | N36: 1 | O36: 5 | P36: ="{"&RC[-6]&","&RC[-3]&","&RC[-2]&","&RC[-1]&"}," -> {110032,0,1,5}, | Q36: =R[-1]C&RC[-1] -> {110023,0,1,5},{110024,0,1,5},{110025,0,1,5},{110026,0,1,5},{110030,0,1,5},{110031,0,1,5},{110032,0,1,5}, | S36: 202011 | T36: 天珠道链 | U36: 1 | V36: 0 | W36: 1 | X36: 10 | Y36: ="{"&RC[-6]&","&RC[-3]&","&RC[-2]&","&RC[-1]&"}," -> {202011,0,1,10}, | Z36: =R[-1]C&RC[-1] -> {200000,0,1,30},{200001,0,1,30},{200002,0,1,30},{200003,0,1,30},{200006,0,1,30},{200010,0,1,5},{200011,0,1,10},{200012,0,1,10},{200013,0,1,10},{200015,0,1,10},{200016,0,1,10},{200017,0,1,10},{200019,0,1,10},{201000,0,1,30},{201001,0,1,30},{201002,0,1,30},{201003,0,1,30},{201006,0,1,30},{201010,0,1,5},{201011,0,1,10},{201012,0,1,10},{201013,0,1,10},{201015,0,1,10},{201016,0,1,10},{201017,0,1,10},{201019,0,1,10},{202000,0,1,30},{202001,0,1,30},{202002,0,1,30},{202003,0,1,30},{202006,0,1,30},{202010,0,1,5},{202011,0,1,10}, | AB36: 202011 | AC36: 天珠道链 | AD36: 1 | AE36: 0 | AF36: 1 | AG36: 10 | AH36: ="{"&RC[-6]&","&RC[-3]&","&RC[-2]&","&RC[-1]&"}," -> {202011,0,1,10}, | AI36: =R[-1]C&RC[-1] -> {200000,0,1,30},{200001,0,1,30},{200002,0,1,30},{200003,0,1,30},{200006,0,1,30},{200010,0,1,5},{200011,0,1,10},{200012,0,1,10},{200013,0,1,10},{200015,0,1,10},{200016,0,1,10},{200017,0,1,10},{200019,0,1,10},{201000,0,1,30},{201001,0,1,30},{201002,0,1,30},{201003,0,1,30},{201006,0,1,30},{201010,0,1,5},{201011,0,1,10},{201012,0,1,10},{201013,0,1,10},{201015,0,1,10},{201016,0,1,10},{201017,0,1,10},{201019,0,1,10},{202000,0,1,30},{202001,0,1,30},{202002,0,1,30},{202003,0,1,30},{202006,0,1,30},{202010,0,1,5},{202011,0,1,10}, | AK36: 201020 | AL36: 骨玉 | AM36: 1 | AN36: 0 | AO36: 1 | AP36: 1 | AQ36: ="{"&RC[-6]&","&RC[-3]&","&RC[-2]&","&RC[-1]&"}," -> {201020,0,1,1}, | AR36: =R[-1]C&RC[-1] -> {200010,0,1,40},{200011,0,1,40},{200012,0,1,40},{200013,0,1,40},{200015,0,1,40},{200016,0,1,40},{200017,0,1,40},{200019,0,1,40},{200020,0,1,1},{200021,0,1,3},{200022,0,1,10},{200023,0,1,10},{200025,0,1,3},{200026,0,1,10},{200027,0,1,3},{200029,0,1,3},{200030,0,1,1},{200031,0,1,1},{200032,0,1,5},{200033,0,1,5},{200035,0,1,1},{200036,0,1,5},{200037,0,1,1},{200039,0,1,1},{201010,0,1,40},{201011,0,1,40},{201012,0,1,40},{201013,0,1,40},{201015,0,1,40},{201016,0,1,40},{201017,0,1,40},{201019,0,1,40},{201020,0,1,1}, | AT36: 201020 | AU36: 骨玉 | AV36: 1 | AW36: 0 | AX36: 1 | AY36: 1 | AZ36: ="{"&RC[-6]&","&RC[-3]&","&RC[-2]&","&RC[-1]&"}," -> {201020,0,1,1}, | BA36: =RC[-1] -> {201020,0,1,1}, | BC36: 201020 | BD36: 骨玉 | BE36: 1 | BF36: 0 | BG36: 1 | BH36: 1 | BI36: ="{"&RC[-6]&","&RC[-3]&","&RC[-2]&","&RC[-1]&"}," -> {201020,0,1,1}, | BJ36: =RC[-1] -> {201020,0,1,1},
H37: ="["&R[-6]C&","&R[-4]C&","&R[-2]C&"]" -> [{0,[{3,100}],[{200000,0,1,100},{200001,0,1,100},{200002,0,1,100},{200003,0,1,100},{200006,0,1,100},{201000,0,1,100},{201001,0,1,100},{201002,0,1,100},{201003,0,1,100},{201006,0,1,100},{202000,0,1,100},{202001,0,1,100},{202002,0,1,100},{202003,0,1,100},{202006,0,1,100}]},{0,[{2,100}],[{110083,0,2,1},{110003,0,2,2},{110004,0,1,3},{110005,0,1,3},{110010,0,1,3},{110011,0,1,3},{110012,0,1,3}]},{0,[{10,100}],[{110009,1,1000,1}]}] | J37: 110033 | K37: 雷电术书 | L37: 1 | M37: 0 | N37: 1 | O37: 5 | P37: ="{"&RC[-6]&","&RC[-3]&","&RC[-2]&","&RC[-1]&"}," -> {110033,0,1,5}, | Q37: =R[-1]C&RC[-1] -> {110023,0,1,5},{110024,0,1,5},{110025,0,1,5},{110026,0,1,5},{110030,0,1,5},{110031,0,1,5},{110032,0,1,5},{110033,0,1,5}, | S37: 202012 | T37: 灵魂道袍 | U37: 1 | V37: 0 | W37: 1 | X37: 10 | Y37: ="{"&RC[-6]&","&RC[-3]&","&RC[-2]&","&RC[-1]&"}," -> {202012,0,1,10}, | Z37: =R[-1]C&RC[-1] -> {200000,0,1,30},{200001,0,1,30},{200002,0,1,30},{200003,0,1,30},{200006,0,1,30},{200010,0,1,5},{200011,0,1,10},{200012,0,1,10},{200013,0,1,10},{200015,0,1,10},{200016,0,1,10},{200017,0,1,10},{200019,0,1,10},{201000,0,1,30},{201001,0,1,30},{201002,0,1,30},{201003,0,1,30},{201006,0,1,30},{201010,0,1,5},{201011,0,1,10},{201012,0,1,10},{201013,0,1,10},{201015,0,1,10},{201016,0,1,10},{201017,0,1,10},{201019,0,1,10},{202000,0,1,30},{202001,0,1,30},{202002,0,1,30},{202003,0,1,30},{202006,0,1,30},{202010,0,1,5},{202011,0,1,10},{202012,0,1,10}, | AB37: 202012 | AC37: 灵魂道袍 | AD37: 1 | AE37: 0 | AF37: 1 | AG37: 10 | AH37: ="{"&RC[-6]&","&RC[-3]&","&RC[-2]&","&RC[-1]&"}," -> {202012,0,1,10}, | AI37: =R[-1]C&RC[-1] -> {200000,0,1,30},{200001,0,1,30},{200002,0,1,30},{200003,0,1,30},{200006,0,1,30},{200010,0,1,5},{200011,0,1,10},{200012,0,1,10},{200013,0,1,10},{200015,0,1,10},{200016,0,1,10},{200017,0,1,10},{200019,0,1,10},{201000,0,1,30},{201001,0,1,30},{201002,0,1,30},{201003,0,1,30},{201006,0,1,30},{201010,0,1,5},{201011,0,1,10},{201012,0,1,10},{201013,0,1,10},{201015,0,1,10},{201016,0,1,10},{201017,0,1,10},{201019,0,1,10},{202000,0,1,30},{202001,0,1,30},{202002,0,1,30},{202003,0,1,30},{202006,0,1,30},{202010,0,1,5},{202011,0,1,10},{202012,0,1,10}, | AK37: 201021 | AL37: 法神披风 | AM37: 1 | AN37: 0 | AO37: 1 | AP37: 3 | AQ37: ="{"&RC[-6]&","&RC[-3]&","&RC[-2]&","&RC[-1]&"}," -> {201021,0,1,3}, | AR37: =R[-1]C&RC[-1] -> {200010,0,1,40},{200011,0,1,40},{200012,0,1,40},{200013,0,1,40},{200015,0,1,40},{200016,0,1,40},{200017,0,1,40},{200019,0,1,40},{200020,0,1,1},{200021,0,1,3},{200022,0,1,10},{200023,0,1,10},{200025,0,1,3},{200026,0,1,10},{200027,0,1,3},{200029,0,1,3},{200030,0,1,1},{200031,0,1,1},{200032,0,1,5},{200033,0,1,5},{200035,0,1,1},{200036,0,1,5},{200037,0,1,1},{200039,0,1,1},{201010,0,1,40},{201011,0,1,40},{201012,0,1,40},{201013,0,1,40},{201015,0,1,40},{201016,0,1,40},{201017,0,1,40},{201019,0,1,40},{201020,0,1,1},{201021,0,1,3}, | AT37: 201021 | AU37: 法神披风 | AV37: 1 | AW37: 0 | AX37: 1 | AY37: 3 | AZ37: ="{"&RC[-6]&","&RC[-3]&","&RC[-2]&","&RC[-1]&"}," -> {201021,0,1,3}, | BA37: =RC[-1] -> {201021,0,1,3}, | BC37: 201021 | BD37: 法神披风 | BE37: 1 | BF37: 0 | BG37: 1 | BH37: 3 | BI37: ="{"&RC[-6]&","&RC[-3]&","&RC[-2]&","&RC[-1]&"}," -> {201021,0,1,3}, | BJ37: =RC[-1] -> {201021,0,1,3},
J38: 110038 | K38: 冰咆哮书 | L38: 1 | M38: 0 | N38: 1 | O38: 5 | P38: ="{"&RC[-6]&","&RC[-3]&","&RC[-2]&","&RC[-1]&"}," -> {110038,0,1,5}, | Q38: =R[-1]C&RC[-1] -> {110023,0,1,5},{110024,0,1,5},{110025,0,1,5},{110026,0,1,5},{110030,0,1,5},{110031,0,1,5},{110032,0,1,5},{110033,0,1,5},{110038,0,1,5}, | S38: 202013 | T38: 泰坦戒指 | U38: 1 | V38: 0 | W38: 1 | X38: 10 | Y38: ="{"&RC[-6]&","&RC[-3]&","&RC[-2]&","&RC[-1]&"}," -> {202013,0,1,10}, | Z38: =R[-1]C&RC[-1] -> {200000,0,1,30},{200001,0,1,30},{200002,0,1,30},{200003,0,1,30},{200006,0,1,30},{200010,0,1,5},{200011,0,1,10},{200012,0,1,10},{200013,0,1,10},{200015,0,1,10},{200016,0,1,10},{200017,0,1,10},{200019,0,1,10},{201000,0,1,30},{201001,0,1,30},{201002,0,1,30},{201003,0,1,30},{201006,0,1,30},{201010,0,1,5},{201011,0,1,10},{201012,0,1,10},{201013,0,1,10},{201015,0,1,10},{201016,0,1,10},{201017,0,1,10},{201019,0,1,10},{202000,0,1,30},{202001,0,1,30},{202002,0,1,30},{202003,0,1,30},{202006,0,1,30},{202010,0,1,5},{202011,0,1,10},{202012,0,1,10},{202013,0,1,10}, | AB38: 202013 | AC38: 泰坦戒指 | AD38: 1 | AE38: 0 | AF38: 1 | AG38: 10 | AH38: ="{"&RC[-6]&","&RC[-3]&","&RC[-2]&","&RC[-1]&"}," -> {202013,0,1,10}, | AI38: =R[-1]C&RC[-1] -> {200000,0,1,30},{200001,0,1,30},{200002,0,1,30},{200003,0,1,30},{200006,0,1,30},{200010,0,1,5},{200011,0,1,10},{200012,0,1,10},{200013,0,1,10},{200015,0,1,10},{200016,0,1,10},{200017,0,1,10},{200019,0,1,10},{201000,0,1,30},{201001,0,1,30},{201002,0,1,30},{201003,0,1,30},{201006,0,1,30},{201010,0,1,5},{201011,0,1,10},{201012,0,1,10},{201013,0,1,10},{201015,0,1,10},{201016,0,1,10},{201017,0,1,10},{201019,0,1,10},{202000,0,1,30},{202001,0,1,30},{202002,0,1,30},{202003,0,1,30},{202006,0,1,30},{202010,0,1,5},{202011,0,1,10},{202012,0,1,10},{202013,0,1,10}, | AK38: 201022 | AL38: 法神项链 | AM38: 1 | AN38: 0 | AO38: 1 | AP38: 10 | AQ38: ="{"&RC[-6]&","&RC[-3]&","&RC[-2]&","&RC[-1]&"}," -> {201022,0,1,10}, | AR38: =R[-1]C&RC[-1] -> {200010,0,1,40},{200011,0,1,40},{200012,0,1,40},{200013,0,1,40},{200015,0,1,40},{200016,0,1,40},{200017,0,1,40},{200019,0,1,40},{200020,0,1,1},{200021,0,1,3},{200022,0,1,10},{200023,0,1,10},{200025,0,1,3},{200026,0,1,10},{200027,0,1,3},{200029,0,1,3},{200030,0,1,1},{200031,0,1,1},{200032,0,1,5},{200033,0,1,5},{200035,0,1,1},{200036,0,1,5},{200037,0,1,1},{200039,0,1,1},{201010,0,1,40},{201011,0,1,40},{201012,0,1,40},{201013,0,1,40},{201015,0,1,40},{201016,0,1,40},{201017,0,1,40},{201019,0,1,40},{201020,0,1,1},{201021,0,1,3},{201022,0,1,10}, | AT38: 201022 | AU38: 法神项链 | AV38: 1 | AW38: 0 | AX38: 1 | AY38: 10 | AZ38: ="{"&RC[-6]&","&RC[-3]&","&RC[-2]&","&RC[-1]&"}," -> {201022,0,1,10}, | BA38: =RC[-1] -> {201022,0,1,10}, | BC38: 201022 | BD38: 法神项链 | BE38: 1 | BF38: 0 | BG38: 1 | BH38: 10 | BI38: ="{"&RC[-6]&","&RC[-3]&","&RC[-2]&","&RC[-1]&"}," -> {201022,0,1,10}, | BJ38: =RC[-1] -> {201022,0,1,10},
J39: 110039 | K39: 抗拒火环书 | L39: 1 | M39: 0 | N39: 1 | O39: 5 | P39: ="{"&RC[-6]&","&RC[-3]&","&RC[-2]&","&RC[-1]&"}," -> {110039,0,1,5}, | Q39: =R[-1]C&RC[-1] -> {110023,0,1,5},{110024,0,1,5},{110025,0,1,5},{110026,0,1,5},{110030,0,1,5},{110031,0,1,5},{110032,0,1,5},{110033,0,1,5},{110038,0,1,5},{110039,0,1,5}, | S39: 202015 | T39: 道士头盔 | U39: 1 | V39: 0 | W39: 1 | X39: 10 | Y39: ="{"&RC[-6]&","&RC[-3]&","&RC[-2]&","&RC[-1]&"}," -> {202015,0,1,10}, | Z39: =R[-1]C&RC[-1] -> {200000,0,1,30},{200001,0,1,30},{200002,0,1,30},{200003,0,1,30},{200006,0,1,30},{200010,0,1,5},{200011,0,1,10},{200012,0,1,10},{200013,0,1,10},{200015,0,1,10},{200016,0,1,10},{200017,0,1,10},{200019,0,1,10},{201000,0,1,30},{201001,0,1,30},{201002,0,1,30},{201003,0,1,30},{201006,0,1,30},{201010,0,1,5},{201011,0,1,10},{201012,0,1,10},{201013,0,1,10},{201015,0,1,10},{201016,0,1,10},{201017,0,1,10},{201019,0,1,10},{202000,0,1,30},{202001,0,1,30},{202002,0,1,30},{202003,0,1,30},{202006,0,1,30},{202010,0,1,5},{202011,0,1,10},{202012,0,1,10},{202013,0,1,10},{202015,0,1,10}, | AB39: 202015 | AC39: 道士头盔 | AD39: 1 | AE39: 0 | AF39: 1 | AG39: 10 | AH39: ="{"&RC[-6]&","&RC[-3]&","&RC[-2]&","&RC[-1]&"}," -> {202015,0,1,10}, | AI39: =R[-1]C&RC[-1] -> {200000,0,1,30},{200001,0,1,30},{200002,0,1,30},{200003,0,1,30},{200006,0,1,30},{200010,0,1,5},{200011,0,1,10},{200012,0,1,10},{200013,0,1,10},{200015,0,1,10},{200016,0,1,10},{200017,0,1,10},{200019,0,1,10},{201000,0,1,30},{201001,0,1,30},{201002,0,1,30},{201003,0,1,30},{201006,0,1,30},{201010,0,1,5},{201011,0,1,10},{201012,0,1,10},{201013,0,1,10},{201015,0,1,10},{201016,0,1,10},{201017,0,1,10},{201019,0,1,10},{202000,0,1,30},{202001,0,1,30},{202002,0,1,30},{202003,0,1,30},{202006,0,1,30},{202010,0,1,5},{202011,0,1,10},{202012,0,1,10},{202013,0,1,10},{202015,0,1,10}, | AK39: 201023 | AL39: 法神戒指 | AM39: 1 | AN39: 0 | AO39: 1 | AP39: 10 | AQ39: ="{"&RC[-6]&","&RC[-3]&","&RC[-2]&","&RC[-1]&"}," -> {201023,0,1,10}, | AR39: =R[-1]C&RC[-1] -> {200010,0,1,40},{200011,0,1,40},{200012,0,1,40},{200013,0,1,40},{200015,0,1,40},{200016,0,1,40},{200017,0,1,40},{200019,0,1,40},{200020,0,1,1},{200021,0,1,3},{200022,0,1,10},{200023,0,1,10},{200025,0,1,3},{200026,0,1,10},{200027,0,1,3},{200029,0,1,3},{200030,0,1,1},{200031,0,1,1},{200032,0,1,5},{200033,0,1,5},{200035,0,1,1},{200036,0,1,5},{200037,0,1,1},{200039,0,1,1},{201010,0,1,40},{201011,0,1,40},{201012,0,1,40},{201013,0,1,40},{201015,0,1,40},{201016,0,1,40},{201017,0,1,40},{201019,0,1,40},{201020,0,1,1},{201021,0,1,3},{201022,0,1,10},{201023,0,1,10}, | AT39: 201023 | AU39: 法神戒指 | AV39: 1 | AW39: 0 | AX39: 1 | AY39: 10 | AZ39: ="{"&RC[-6]&","&RC[-3]&","&RC[-2]&","&RC[-1]&"}," -> {201023,0,1,10}, | BA39: =RC[-1] -> {201023,0,1,10}, | BC39: 201023 | BD39: 法神戒指 | BE39: 1 | BF39: 0 | BG39: 1 | BH39: 10 | BI39: ="{"&RC[-6]&","&RC[-3]&","&RC[-2]&","&RC[-1]&"}," -> {201023,0,1,10}, | BJ39: =RC[-1] -> {201023,0,1,10},
J40: 110040 | K40: 流星火雨书 | L40: 1 | M40: 0 | N40: 1 | O40: 5 | P40: ="{"&RC[-6]&","&RC[-3]&","&RC[-2]&","&RC[-1]&"}," -> {110040,0,1,5}, | Q40: =R[-1]C&RC[-1] -> {110023,0,1,5},{110024,0,1,5},{110025,0,1,5},{110026,0,1,5},{110030,0,1,5},{110031,0,1,5},{110032,0,1,5},{110033,0,1,5},{110038,0,1,5},{110039,0,1,5},{110040,0,1,5}, | S40: 202016 | T40: 幽灵手镯 | U40: 1 | V40: 0 | W40: 1 | X40: 10 | Y40: ="{"&RC[-6]&","&RC[-3]&","&RC[-2]&","&RC[-1]&"}," -> {202016,0,1,10}, | Z40: =R[-1]C&RC[-1] -> {200000,0,1,30},{200001,0,1,30},{200002,0,1,30},{200003,0,1,30},{200006,0,1,30},{200010,0,1,5},{200011,0,1,10},{200012,0,1,10},{200013,0,1,10},{200015,0,1,10},{200016,0,1,10},{200017,0,1,10},{200019,0,1,10},{201000,0,1,30},{201001,0,1,30},{201002,0,1,30},{201003,0,1,30},{201006,0,1,30},{201010,0,1,5},{201011,0,1,10},{201012,0,1,10},{201013,0,1,10},{201015,0,1,10},{201016,0,1,10},{201017,0,1,10},{201019,0,1,10},{202000,0,1,30},{202001,0,1,30},{202002,0,1,30},{202003,0,1,30},{202006,0,1,30},{202010,0,1,5},{202011,0,1,10},{202012,0,1,10},{202013,0,1,10},{202015,0,1,10},{202016,0,1,10}, | AB40: 202016 | AC40: 幽灵手镯 | AD40: 1 | AE40: 0 | AF40: 1 | AG40: 10 | AH40: ="{"&RC[-6]&","&RC[-3]&","&RC[-2]&","&RC[-1]&"}," -> {202016,0,1,10}, | AI40: =R[-1]C&RC[-1] -> {200000,0,1,30},{200001,0,1,30},{200002,0,1,30},{200003,0,1,30},{200006,0,1,30},{200010,0,1,5},{200011,0,1,10},{200012,0,1,10},{200013,0,1,10},{200015,0,1,10},{200016,0,1,10},{200017,0,1,10},{200019,0,1,10},{201000,0,1,30},{201001,0,1,30},{201002,0,1,30},{201003,0,1,30},{201006,0,1,30},{201010,0,1,5},{201011,0,1,10},{201012,0,1,10},{201013,0,1,10},{201015,0,1,10},{201016,0,1,10},{201017,0,1,10},{201019,0,1,10},{202000,0,1,30},{202001,0,1,30},{202002,0,1,30},{202003,0,1,30},{202006,0,1,30},{202010,0,1,5},{202011,0,1,10},{202012,0,1,10},{202013,0,1,10},{202015,0,1,10},{202016,0,1,10}, | AK40: 201025 | AL40: 法神头盔 | AM40: 1 | AN40: 0 | AO40: 1 | AP40: 3 | AQ40: ="{"&RC[-6]&","&RC[-3]&","&RC[-2]&","&RC[-1]&"}," -> {201025,0,1,3}, | AR40: =R[-1]C&RC[-1] -> {200010,0,1,40},{200011,0,1,40},{200012,0,1,40},{200013,0,1,40},{200015,0,1,40},{200016,0,1,40},{200017,0,1,40},{200019,0,1,40},{200020,0,1,1},{200021,0,1,3},{200022,0,1,10},{200023,0,1,10},{200025,0,1,3},{200026,0,1,10},{200027,0,1,3},{200029,0,1,3},{200030,0,1,1},{200031,0,1,1},{200032,0,1,5},{200033,0,1,5},{200035,0,1,1},{200036,0,1,5},{200037,0,1,1},{200039,0,1,1},{201010,0,1,40},{201011,0,1,40},{201012,0,1,40},{201013,0,1,40},{201015,0,1,40},{201016,0,1,40},{201017,0,1,40},{201019,0,1,40},{201020,0,1,1},{201021,0,1,3},{201022,0,1,10},{201023,0,1,10},{201025,0,1,3}, | AT40: 201025 | AU40: 法神头盔 | AV40: 1 | AW40: 0 | AX40: 1 | AY40: 3 | AZ40: ="{"&RC[-6]&","&RC[-3]&","&RC[-2]&","&RC[-1]&"}," -> {201025,0,1,3}, | BA40: =RC[-1] -> {201025,0,1,3}, | BC40: 201025 | BD40: 法神头盔 | BE40: 1 | BF40: 0 | BG40: 1 | BH40: 3 | BI40: ="{"&RC[-6]&","&RC[-3]&","&RC[-2]&","&RC[-1]&"}," -> {201025,0,1,3}, | BJ40: =RC[-1] -> {201025,0,1,3},
J41: 110067 | K41: 诱惑之光书 | L41: 1 | M41: 0 | N41: 1 | O41: 5 | P41: ="{"&RC[-6]&","&RC[-3]&","&RC[-2]&","&RC[-1]&"}" -> {110067,0,1,5} | Q41: =R[-1]C&RC[-1] -> {110023,0,1,5},{110024,0,1,5},{110025,0,1,5},{110026,0,1,5},{110030,0,1,5},{110031,0,1,5},{110032,0,1,5},{110033,0,1,5},{110038,0,1,5},{110039,0,1,5},{110040,0,1,5},{110067,0,1,5} | S41: 202017 | T41: 道士腰带 | U41: 1 | V41: 0 | W41: 1 | X41: 10 | Y41: ="{"&RC[-6]&","&RC[-3]&","&RC[-2]&","&RC[-1]&"}," -> {202017,0,1,10}, | Z41: =R[-1]C&RC[-1] -> {200000,0,1,30},{200001,0,1,30},{200002,0,1,30},{200003,0,1,30},{200006,0,1,30},{200010,0,1,5},{200011,0,1,10},{200012,0,1,10},{200013,0,1,10},{200015,0,1,10},{200016,0,1,10},{200017,0,1,10},{200019,0,1,10},{201000,0,1,30},{201001,0,1,30},{201002,0,1,30},{201003,0,1,30},{201006,0,1,30},{201010,0,1,5},{201011,0,1,10},{201012,0,1,10},{201013,0,1,10},{201015,0,1,10},{201016,0,1,10},{201017,0,1,10},{201019,0,1,10},{202000,0,1,30},{202001,0,1,30},{202002,0,1,30},{202003,0,1,30},{202006,0,1,30},{202010,0,1,5},{202011,0,1,10},{202012,0,1,10},{202013,0,1,10},{202015,0,1,10},{202016,0,1,10},{202017,0,1,10}, | AB41: 202017 | AC41: 道士腰带 | AD41: 1 | AE41: 0 | AF41: 1 | AG41: 10 | AH41: ="{"&RC[-6]&","&RC[-3]&","&RC[-2]&","&RC[-1]&"}," -> {202017,0,1,10}, | AI41: =R[-1]C&RC[-1] -> {200000,0,1,30},{200001,0,1,30},{200002,0,1,30},{200003,0,1,30},{200006,0,1,30},{200010,0,1,5},{200011,0,1,10},{200012,0,1,10},{200013,0,1,10},{200015,0,1,10},{200016,0,1,10},{200017,0,1,10},{200019,0,1,10},{201000,0,1,30},{201001,0,1,30},{201002,0,1,30},{201003,0,1,30},{201006,0,1,30},{201010,0,1,5},{201011,0,1,10},{201012,0,1,10},{201013,0,1,10},{201015,0,1,10},{201016,0,1,10},{201017,0,1,10},{201019,0,1,10},{202000,0,1,30},{202001,0,1,30},{202002,0,1,30},{202003,0,1,30},{202006,0,1,30},{202010,0,1,5},{202011,0,1,10},{202012,0,1,10},{202013,0,1,10},{202015,0,1,10},{202016,0,1,10},{202017,0,1,10}, | AK41: 201026 | AL41: 法神手镯 | AM41: 1 | AN41: 0 | AO41: 1 | AP41: 10 | AQ41: ="{"&RC[-6]&","&RC[-3]&","&RC[-2]&","&RC[-1]&"}," -> {201026,0,1,10}, | AR41: =R[-1]C&RC[-1] -> {200010,0,1,40},{200011,0,1,40},{200012,0,1,40},{200013,0,1,40},{200015,0,1,40},{200016,0,1,40},{200017,0,1,40},{200019,0,1,40},{200020,0,1,1},{200021,0,1,3},{200022,0,1,10},{200023,0,1,10},{200025,0,1,3},{200026,0,1,10},{200027,0,1,3},{200029,0,1,3},{200030,0,1,1},{200031,0,1,1},{200032,0,1,5},{200033,0,1,5},{200035,0,1,1},{200036,0,1,5},{200037,0,1,1},{200039,0,1,1},{201010,0,1,40},{201011,0,1,40},{201012,0,1,40},{201013,0,1,40},{201015,0,1,40},{201016,0,1,40},{201017,0,1,40},{201019,0,1,40},{201020,0,1,1},{201021,0,1,3},{201022,0,1,10},{201023,0,1,10},{201025,0,1,3},{201026,0,1,10}, | AT41: 201026 | AU41: 法神手镯 | AV41: 1 | AW41: 0 | AX41: 1 | AY41: 10 | AZ41: ="{"&RC[-6]&","&RC[-3]&","&RC[-2]&","&RC[-1]&"}," -> {201026,0,1,10}, | BA41: =RC[-1] -> {201026,0,1,10}, | BC41: 201026 | BD41: 法神手镯 | BE41: 1 | BF41: 0 | BG41: 1 | BH41: 10 | BI41: ="{"&RC[-6]&","&RC[-3]&","&RC[-2]&","&RC[-1]&"}," -> {201026,0,1,10}, | BJ41: =RC[-1] -> {201026,0,1,10},
S42: 202019 | T42: 道士鞋子 | U42: 1 | V42: 0 | W42: 1 | X42: 10 | Y42: ="{"&RC[-6]&","&RC[-3]&","&RC[-2]&","&RC[-1]&"}" -> {202019,0,1,10} | Z42: =R[-1]C&RC[-1] -> {200000,0,1,30},{200001,0,1,30},{200002,0,1,30},{200003,0,1,30},{200006,0,1,30},{200010,0,1,5},{200011,0,1,10},{200012,0,1,10},{200013,0,1,10},{200015,0,1,10},{200016,0,1,10},{200017,0,1,10},{200019,0,1,10},{201000,0,1,30},{201001,0,1,30},{201002,0,1,30},{201003,0,1,30},{201006,0,1,30},{201010,0,1,5},{201011,0,1,10},{201012,0,1,10},{201013,0,1,10},{201015,0,1,10},{201016,0,1,10},{201017,0,1,10},{201019,0,1,10},{202000,0,1,30},{202001,0,1,30},{202002,0,1,30},{202003,0,1,30},{202006,0,1,30},{202010,0,1,5},{202011,0,1,10},{202012,0,1,10},{202013,0,1,10},{202015,0,1,10},{202016,0,1,10},{202017,0,1,10},{202019,0,1,10} | AB42: 202019 | AC42: 道士鞋子 | AD42: 1 | AE42: 0 | AF42: 1 | AG42: 10 | AH42: ="{"&RC[-6]&","&RC[-3]&","&RC[-2]&","&RC[-1]&"}" -> {202019,0,1,10} | AI42: =R[-1]C&RC[-1] -> {200000,0,1,30},{200001,0,1,30},{200002,0,1,30},{200003,0,1,30},{200006,0,1,30},{200010,0,1,5},{200011,0,1,10},{200012,0,1,10},{200013,0,1,10},{200015,0,1,10},{200016,0,1,10},{200017,0,1,10},{200019,0,1,10},{201000,0,1,30},{201001,0,1,30},{201002,0,1,30},{201003,0,1,30},{201006,0,1,30},{201010,0,1,5},{201011,0,1,10},{201012,0,1,10},{201013,0,1,10},{201015,0,1,10},{201016,0,1,10},{201017,0,1,10},{201019,0,1,10},{202000,0,1,30},{202001,0,1,30},{202002,0,1,30},{202003,0,1,30},{202006,0,1,30},{202010,0,1,5},{202011,0,1,10},{202012,0,1,10},{202013,0,1,10},{202015,0,1,10},{202016,0,1,10},{202017,0,1,10},{202019,0,1,10} | AK42: 201027 | AL42: 法神腰带 | AM42: 1 | AN42: 0 | AO42: 1 | AP42: 3 | AQ42: ="{"&RC[-6]&","&RC[-3]&","&RC[-2]&","&RC[-1]&"}," -> {201027,0,1,3}, | AR42: =R[-1]C&RC[-1] -> {200010,0,1,40},{200011,0,1,40},{200012,0,1,40},{200013,0,1,40},{200015,0,1,40},{200016,0,1,40},{200017,0,1,40},{200019,0,1,40},{200020,0,1,1},{200021,0,1,3},{200022,0,1,10},{200023,0,1,10},{200025,0,1,3},{200026,0,1,10},{200027,0,1,3},{200029,0,1,3},{200030,0,1,1},{200031,0,1,1},{200032,0,1,5},{200033,0,1,5},{200035,0,1,1},{200036,0,1,5},{200037,0,1,1},{200039,0,1,1},{201010,0,1,40},{201011,0,1,40},{201012,0,1,40},{201013,0,1,40},{201015,0,1,40},{201016,0,1,40},{201017,0,1,40},{201019,0,1,40},{201020,0,1,1},{201021,0,1,3},{201022,0,1,10},{201023,0,1,10},{201025,0,1,3},{201026,0,1,10},{201027,0,1,3}, | AT42: 201027 | AU42: 法神腰带 | AV42: 1 | AW42: 0 | AX42: 1 | AY42: 3 | AZ42: ="{"&RC[-6]&","&RC[-3]&","&RC[-2]&","&RC[-1]&"}," -> {201027,0,1,3}, | BA42: =RC[-1] -> {201027,0,1,3}, | BC42: 201027 | BD42: 法神腰带 | BE42: 1 | BF42: 0 | BG42: 1 | BH42: 3 | BI42: ="{"&RC[-6]&","&RC[-3]&","&RC[-2]&","&RC[-1]&"}," -> {201027,0,1,3}, | BJ42: =RC[-1] -> {201027,0,1,3},
AK43: 201029 | AL43: 法神鞋子 | AM43: 1 | AN43: 0 | AO43: 1 | AP43: 3 | AQ43: ="{"&RC[-6]&","&RC[-3]&","&RC[-2]&","&RC[-1]&"}," -> {201029,0,1,3}, | AR43: =R[-1]C&RC[-1] -> {200010,0,1,40},{200011,0,1,40},{200012,0,1,40},{200013,0,1,40},{200015,0,1,40},{200016,0,1,40},{200017,0,1,40},{200019,0,1,40},{200020,0,1,1},{200021,0,1,3},{200022,0,1,10},{200023,0,1,10},{200025,0,1,3},{200026,0,1,10},{200027,0,1,3},{200029,0,1,3},{200030,0,1,1},{200031,0,1,1},{200032,0,1,5},{200033,0,1,5},{200035,0,1,1},{200036,0,1,5},{200037,0,1,1},{200039,0,1,1},{201010,0,1,40},{201011,0,1,40},{201012,0,1,40},{201013,0,1,40},{201015,0,1,40},{201016,0,1,40},{201017,0,1,40},{201019,0,1,40},{201020,0,1,1},{201021,0,1,3},{201022,0,1,10},{201023,0,1,10},{201025,0,1,3},{201026,0,1,10},{201027,0,1,3},{201029,0,1,3}, | AT43: 201029 | AU43: 法神鞋子 | AV43: 1 | AW43: 0 | AX43: 1 | AY43: 3 | AZ43: ="{"&RC[-6]&","&RC[-3]&","&RC[-2]&","&RC[-1]&"}," -> {201029,0,1,3}, | BA43: =RC[-1] -> {201029,0,1,3}, | BC43: 201029 | BD43: 法神鞋子 | BE43: 1 | BF43: 0 | BG43: 1 | BH43: 3 | BI43: ="{"&RC[-6]&","&RC[-3]&","&RC[-2]&","&RC[-1]&"}," -> {201029,0,1,3}, | BJ43: =RC[-1] -> {201029,0,1,3},
J44: 110086 | K44: 黑铁矿+8 | M44: 0 | N44: 2 | O44: 1 | P44: ="{"&RC[-6]&","&RC[-3]&","&RC[-2]&","&RC[-1]&"}," -> {110086,0,2,1}, | Q44: =RC[-1] -> {110086,0,2,1}, | AK44: 201030 | AL44: 震天 | AM44: 1 | AN44: 0 | AO44: 1 | AP44: 1 | AQ44: ="{"&RC[-6]&","&RC[-3]&","&RC[-2]&","&RC[-1]&"}," -> {201030,0,1,1}, | AR44: =R[-1]C&RC[-1] -> {200010,0,1,40},{200011,0,1,40},{200012,0,1,40},{200013,0,1,40},{200015,0,1,40},{200016,0,1,40},{200017,0,1,40},{200019,0,1,40},{200020,0,1,1},{200021,0,1,3},{200022,0,1,10},{200023,0,1,10},{200025,0,1,3},{200026,0,1,10},{200027,0,1,3},{200029,0,1,3},{200030,0,1,1},{200031,0,1,1},{200032,0,1,5},{200033,0,1,5},{200035,0,1,1},{200036,0,1,5},{200037,0,1,1},{200039,0,1,1},{201010,0,1,40},{201011,0,1,40},{201012,0,1,40},{201013,0,1,40},{201015,0,1,40},{201016,0,1,40},{201017,0,1,40},{201019,0,1,40},{201020,0,1,1},{201021,0,1,3},{201022,0,1,10},{201023,0,1,10},{201025,0,1,3},{201026,0,1,10},{201027,0,1,3},{201029,0,1,3},{201030,0,1,1}, | AT44: 201030 | AU44: 震天 | AV44: 1 | AW44: 0 | AX44: 1 | AY44: 1 | AZ44: ="{"&RC[-6]&","&RC[-3]&","&RC[-2]&","&RC[-1]&"}," -> {201030,0,1,1}, | BA44: =RC[-1] -> {201030,0,1,1}, | BC44: 201030 | BD44: 震天 | BE44: 1 | BF44: 0 | BG44: 1 | BH44: 1 | BI44: ="{"&RC[-6]&","&RC[-3]&","&RC[-2]&","&RC[-1]&"}," -> {201030,0,1,1}, | BJ44: =RC[-1] -> {201030,0,1,1},
J45: 110003 | K45: 洗炼石 | M45: 0 | N45: 2 | O45: 2 | P45: ="{"&RC[-6]&","&RC[-3]&","&RC[-2]&","&RC[-1]&"}," -> {110003,0,2,2}, | Q45: =R[-1]C&RC[-1] -> {110086,0,2,1},{110003,0,2,2}, | S45: 110023 | T45: 烈火剑法书 | U45: 1 | V45: 0 | W45: 1 | X45: 1 | Y45: ="{"&RC[-6]&","&RC[-3]&","&RC[-2]&","&RC[-1]&"}," -> {110023,0,1,1}, | Z45: =RC[-1] -> {110023,0,1,1}, | AB45: 110023 | AC45: 烈火剑法书 | AD45: 1 | AE45: 0 | AF45: 1 | AG45: 2 | AH45: ="{"&RC[-6]&","&RC[-3]&","&RC[-2]&","&RC[-1]&"}," -> {110023,0,1,2}, | AI45: =RC[-1] -> {110023,0,1,2}, | AK45: 201031 | AL45: 烈焰法袍 | AM45: 1 | AN45: 0 | AO45: 1 | AP45: 1 | AQ45: ="{"&RC[-6]&","&RC[-3]&","&RC[-2]&","&RC[-1]&"}," -> {201031,0,1,1}, | AR45: =R[-1]C&RC[-1] -> {200010,0,1,40},{200011,0,1,40},{200012,0,1,40},{200013,0,1,40},{200015,0,1,40},{200016,0,1,40},{200017,0,1,40},{200019,0,1,40},{200020,0,1,1},{200021,0,1,3},{200022,0,1,10},{200023,0,1,10},{200025,0,1,3},{200026,0,1,10},{200027,0,1,3},{200029,0,1,3},{200030,0,1,1},{200031,0,1,1},{200032,0,1,5},{200033,0,1,5},{200035,0,1,1},{200036,0,1,5},{200037,0,1,1},{200039,0,1,1},{201010,0,1,40},{201011,0,1,40},{201012,0,1,40},{201013,0,1,40},{201015,0,1,40},{201016,0,1,40},{201017,0,1,40},{201019,0,1,40},{201020,0,1,1},{201021,0,1,3},{201022,0,1,10},{201023,0,1,10},{201025,0,1,3},{201026,0,1,10},{201027,0,1,3},{201029,0,1,3},{201030,0,1,1},{201031,0,1,1}, | AT45: 201031 | AU45: 烈焰法袍 | AV45: 1 | AW45: 0 | AX45: 1 | AY45: 1 | AZ45: ="{"&RC[-6]&","&RC[-3]&","&RC[-2]&","&RC[-1]&"}," -> {201031,0,1,1}, | BA45: =RC[-1] -> {201031,0,1,1}, | BC45: 201031 | BD45: 烈焰法袍 | BE45: 1 | BF45: 0 | BG45: 1 | BH45: 1 | BI45: ="{"&RC[-6]&","&RC[-3]&","&RC[-2]&","&RC[-1]&"}," -> {201031,0,1,1}, | BJ45: =RC[-1] -> {201031,0,1,1},
J46: 110004 | K46: 红药 | M46: 0 | N46: 1 | O46: 3 | P46: ="{"&RC[-6]&","&RC[-3]&","&RC[-2]&","&RC[-1]&"}," -> {110004,0,1,3}, | Q46: =R[-1]C&RC[-1] -> {110086,0,2,1},{110003,0,2,2},{110004,0,1,3}, | S46: 110024 | T46: 狂风斩书 | U46: 1 | V46: 0 | W46: 1 | X46: 1 | Y46: ="{"&RC[-6]&","&RC[-3]&","&RC[-2]&","&RC[-1]&"}," -> {110024,0,1,1}, | Z46: =R[-1]C&RC[-1] -> {110023,0,1,1},{110024,0,1,1}, | AB46: 110024 | AC46: 狂风斩书 | AD46: 1 | AE46: 0 | AF46: 1 | AG46: 2 | AH46: ="{"&RC[-6]&","&RC[-3]&","&RC[-2]&","&RC[-1]&"}," -> {110024,0,1,2}, | AI46: =R[-1]C&RC[-1] -> {110023,0,1,2},{110024,0,1,2}, | AK46: 201032 | AL46: 烈焰魔链 | AM46: 1 | AN46: 0 | AO46: 1 | AP46: 5 | AQ46: ="{"&RC[-6]&","&RC[-3]&","&RC[-2]&","&RC[-1]&"}," -> {201032,0,1,5}, | AR46: =R[-1]C&RC[-1] -> {200010,0,1,40},{200011,0,1,40},{200012,0,1,40},{200013,0,1,40},{200015,0,1,40},{200016,0,1,40},{200017,0,1,40},{200019,0,1,40},{200020,0,1,1},{200021,0,1,3},{200022,0,1,10},{200023,0,1,10},{200025,0,1,3},{200026,0,1,10},{200027,0,1,3},{200029,0,1,3},{200030,0,1,1},{200031,0,1,1},{200032,0,1,5},{200033,0,1,5},{200035,0,1,1},{200036,0,1,5},{200037,0,1,1},{200039,0,1,1},{201010,0,1,40},{201011,0,1,40},{201012,0,1,40},{201013,0,1,40},{201015,0,1,40},{201016,0,1,40},{201017,0,1,40},{201019,0,1,40},{201020,0,1,1},{201021,0,1,3},{201022,0,1,10},{201023,0,1,10},{201025,0,1,3},{201026,0,1,10},{201027,0,1,3},{201029,0,1,3},{201030,0,1,1},{201031,0,1,1},{201032,0,1,5}, | AT46: 201032 | AU46: 烈焰魔链 | AV46: 1 | AW46: 0 | AX46: 1 | AY46: 5 | AZ46: ="{"&RC[-6]&","&RC[-3]&","&RC[-2]&","&RC[-1]&"}," -> {201032,0,1,5}, | BA46: =RC[-1] -> {201032,0,1,5}, | BC46: 201032 | BD46: 烈焰魔链 | BE46: 1 | BF46: 0 | BG46: 1 | BH46: 5 | BI46: ="{"&RC[-6]&","&RC[-3]&","&RC[-2]&","&RC[-1]&"}," -> {201032,0,1,5}, | BJ46: =RC[-1] -> {201032,0,1,5},
J47: 110005 | K47: 蓝药 | M47: 0 | N47: 1 | O47: 3 | P47: ="{"&RC[-6]&","&RC[-3]&","&RC[-2]&","&RC[-1]&"}," -> {110005,0,1,3}, | Q47: =R[-1]C&RC[-1] -> {110086,0,2,1},{110003,0,2,2},{110004,0,1,3},{110005,0,1,3}, | S47: 110025 | T47: 逐日剑法书 | U47: 1 | V47: 0 | W47: 1 | X47: 1 | Y47: ="{"&RC[-6]&","&RC[-3]&","&RC[-2]&","&RC[-1]&"}," -> {110025,0,1,1}, | Z47: =R[-1]C&RC[-1] -> {110023,0,1,1},{110024,0,1,1},{110025,0,1,1}, | AB47: 110025 | AC47: 逐日剑法书 | AD47: 1 | AE47: 0 | AF47: 1 | AG47: 2 | AH47: ="{"&RC[-6]&","&RC[-3]&","&RC[-2]&","&RC[-1]&"}," -> {110025,0,1,2}, | AI47: =R[-1]C&RC[-1] -> {110023,0,1,2},{110024,0,1,2},{110025,0,1,2}, | AK47: 201033 | AL47: 烈焰魔指 | AM47: 1 | AN47: 0 | AO47: 1 | AP47: 5 | AQ47: ="{"&RC[-6]&","&RC[-3]&","&RC[-2]&","&RC[-1]&"}," -> {201033,0,1,5}, | AR47: =R[-1]C&RC[-1] -> {200010,0,1,40},{200011,0,1,40},{200012,0,1,40},{200013,0,1,40},{200015,0,1,40},{200016,0,1,40},{200017,0,1,40},{200019,0,1,40},{200020,0,1,1},{200021,0,1,3},{200022,0,1,10},{200023,0,1,10},{200025,0,1,3},{200026,0,1,10},{200027,0,1,3},{200029,0,1,3},{200030,0,1,1},{200031,0,1,1},{200032,0,1,5},{200033,0,1,5},{200035,0,1,1},{200036,0,1,5},{200037,0,1,1},{200039,0,1,1},{201010,0,1,40},{201011,0,1,40},{201012,0,1,40},{201013,0,1,40},{201015,0,1,40},{201016,0,1,40},{201017,0,1,40},{201019,0,1,40},{201020,0,1,1},{201021,0,1,3},{201022,0,1,10},{201023,0,1,10},{201025,0,1,3},{201026,0,1,10},{201027,0,1,3},{201029,0,1,3},{201030,0,1,1},{201031,0,1,1},{201032,0,1,5},{201033,0,1,5}, | AT47: 201033 | AU47: 烈焰魔指 | AV47: 1 | AW47: 0 | AX47: 1 | AY47: 5 | AZ47: ="{"&RC[-6]&","&RC[-3]&","&RC[-2]&","&RC[-1]&"}," -> {201033,0,1,5}, | BA47: =RC[-1] -> {201033,0,1,5}, | BC47: 201033 | BD47: 烈焰魔指 | BE47: 1 | BF47: 0 | BG47: 1 | BH47: 5 | BI47: ="{"&RC[-6]&","&RC[-3]&","&RC[-2]&","&RC[-1]&"}," -> {201033,0,1,5}, | BJ47: =RC[-1] -> {201033,0,1,5},
J48: 110010 | K48: 普通武装碎片 | M48: 0 | N48: 1 | O48: 3 | P48: ="{"&RC[-6]&","&RC[-3]&","&RC[-2]&","&RC[-1]&"}," -> {110010,0,1,3}, | Q48: =R[-1]C&RC[-1] -> {110086,0,2,1},{110003,0,2,2},{110004,0,1,3},{110005,0,1,3},{110010,0,1,3}, | S48: 110026 | T48: 灵魂火符书 | U48: 1 | V48: 0 | W48: 1 | X48: 1 | Y48: ="{"&RC[-6]&","&RC[-3]&","&RC[-2]&","&RC[-1]&"}," -> {110026,0,1,1}, | Z48: =R[-1]C&RC[-1] -> {110023,0,1,1},{110024,0,1,1},{110025,0,1,1},{110026,0,1,1}, | AB48: 110026 | AC48: 灵魂火符书 | AD48: 1 | AE48: 0 | AF48: 1 | AG48: 2 | AH48: ="{"&RC[-6]&","&RC[-3]&","&RC[-2]&","&RC[-1]&"}," -> {110026,0,1,2}, | AI48: =R[-1]C&RC[-1] -> {110023,0,1,2},{110024,0,1,2},{110025,0,1,2},{110026,0,1,2}, | AK48: 201035 | AL48: 烈焰头盔 | AM48: 1 | AN48: 0 | AO48: 1 | AP48: 1 | AQ48: ="{"&RC[-6]&","&RC[-3]&","&RC[-2]&","&RC[-1]&"}," -> {201035,0,1,1}, | AR48: =R[-1]C&RC[-1] -> {200010,0,1,40},{200011,0,1,40},{200012,0,1,40},{200013,0,1,40},{200015,0,1,40},{200016,0,1,40},{200017,0,1,40},{200019,0,1,40},{200020,0,1,1},{200021,0,1,3},{200022,0,1,10},{200023,0,1,10},{200025,0,1,3},{200026,0,1,10},{200027,0,1,3},{200029,0,1,3},{200030,0,1,1},{200031,0,1,1},{200032,0,1,5},{200033,0,1,5},{200035,0,1,1},{200036,0,1,5},{200037,0,1,1},{200039,0,1,1},{201010,0,1,40},{201011,0,1,40},{201012,0,1,40},{201013,0,1,40},{201015,0,1,40},{201016,0,1,40},{201017,0,1,40},{201019,0,1,40},{201020,0,1,1},{201021,0,1,3},{201022,0,1,10},{201023,0,1,10},{201025,0,1,3},{201026,0,1,10},{201027,0,1,3},{201029,0,1,3},{201030,0,1,1},{201031,0,1,1},{201032,0,1,5},{201033,0,1,5},{201035,0,1,1}, | AT48: 201035 | AU48: 烈焰头盔 | AV48: 1 | AW48: 0 | AX48: 1 | AY48: 1 | AZ48: ="{"&RC[-6]&","&RC[-3]&","&RC[-2]&","&RC[-1]&"}," -> {201035,0,1,1}, | BA48: =RC[-1] -> {201035,0,1,1}, | BC48: 201035 | BD48: 烈焰头盔 | BE48: 1 | BF48: 0 | BG48: 1 | BH48: 1 | BI48: ="{"&RC[-6]&","&RC[-3]&","&RC[-2]&","&RC[-1]&"}," -> {201035,0,1,1}, | BJ48: =RC[-1] -> {201035,0,1,1},
J49: 110011 | K49: 普通防具碎片 | M49: 0 | N49: 1 | O49: 3 | P49: ="{"&RC[-6]&","&RC[-3]&","&RC[-2]&","&RC[-1]&"}," -> {110011,0,1,3}, | Q49: =R[-1]C&RC[-1] -> {110086,0,2,1},{110003,0,2,2},{110004,0,1,3},{110005,0,1,3},{110010,0,1,3},{110011,0,1,3}, | S49: 110030 | T49: 战甲术书 | U49: 1 | V49: 0 | W49: 1 | X49: 1 | Y49: ="{"&RC[-6]&","&RC[-3]&","&RC[-2]&","&RC[-1]&"}," -> {110030,0,1,1}, | Z49: =R[-1]C&RC[-1] -> {110023,0,1,1},{110024,0,1,1},{110025,0,1,1},{110026,0,1,1},{110030,0,1,1}, | AB49: 110030 | AC49: 战甲术书 | AD49: 1 | AE49: 0 | AF49: 1 | AG49: 2 | AH49: ="{"&RC[-6]&","&RC[-3]&","&RC[-2]&","&RC[-1]&"}," -> {110030,0,1,2}, | AI49: =R[-1]C&RC[-1] -> {110023,0,1,2},{110024,0,1,2},{110025,0,1,2},{110026,0,1,2},{110030,0,1,2}, | AK49: 201036 | AL49: 烈焰护腕 | AM49: 1 | AN49: 0 | AO49: 1 | AP49: 5 | AQ49: ="{"&RC[-6]&","&RC[-3]&","&RC[-2]&","&RC[-1]&"}," -> {201036,0,1,5}, | AR49: =R[-1]C&RC[-1] -> {200010,0,1,40},{200011,0,1,40},{200012,0,1,40},{200013,0,1,40},{200015,0,1,40},{200016,0,1,40},{200017,0,1,40},{200019,0,1,40},{200020,0,1,1},{200021,0,1,3},{200022,0,1,10},{200023,0,1,10},{200025,0,1,3},{200026,0,1,10},{200027,0,1,3},{200029,0,1,3},{200030,0,1,1},{200031,0,1,1},{200032,0,1,5},{200033,0,1,5},{200035,0,1,1},{200036,0,1,5},{200037,0,1,1},{200039,0,1,1},{201010,0,1,40},{201011,0,1,40},{201012,0,1,40},{201013,0,1,40},{201015,0,1,40},{201016,0,1,40},{201017,0,1,40},{201019,0,1,40},{201020,0,1,1},{201021,0,1,3},{201022,0,1,10},{201023,0,1,10},{201025,0,1,3},{201026,0,1,10},{201027,0,1,3},{201029,0,1,3},{201030,0,1,1},{201031,0,1,1},{201032,0,1,5},{201033,0,1,5},{201035,0,1,1},{201036,0,1,5}, | AT49: 201036 | AU49: 烈焰护腕 | AV49: 1 | AW49: 0 | AX49: 1 | AY49: 5 | AZ49: ="{"&RC[-6]&","&RC[-3]&","&RC[-2]&","&RC[-1]&"}," -> {201036,0,1,5}, | BA49: =RC[-1] -> {201036,0,1,5}, | BC49: 201036 | BD49: 烈焰护腕 | BE49: 1 | BF49: 0 | BG49: 1 | BH49: 5 | BI49: ="{"&RC[-6]&","&RC[-3]&","&RC[-2]&","&RC[-1]&"}," -> {201036,0,1,5}, | BJ49: =RC[-1] -> {201036,0,1,5},
J50: 110012 | K50: 普通首饰碎片 | M50: 0 | N50: 1 | O50: 3 | P50: ="{"&RC[-6]&","&RC[-3]&","&RC[-2]&","&RC[-1]&"}" -> {110012,0,1,3} | Q50: =R[-1]C&RC[-1] -> {110086,0,2,1},{110003,0,2,2},{110004,0,1,3},{110005,0,1,3},{110010,0,1,3},{110011,0,1,3},{110012,0,1,3} | S50: 110031 | T50: 召唤神兽书 | U50: 1 | V50: 0 | W50: 1 | X50: 1 | Y50: ="{"&RC[-6]&","&RC[-3]&","&RC[-2]&","&RC[-1]&"}," -> {110031,0,1,1}, | Z50: =R[-1]C&RC[-1] -> {110023,0,1,1},{110024,0,1,1},{110025,0,1,1},{110026,0,1,1},{110030,0,1,1},{110031,0,1,1}, | AB50: 110031 | AC50: 召唤神兽书 | AD50: 1 | AE50: 0 | AF50: 1 | AG50: 2 | AH50: ="{"&RC[-6]&","&RC[-3]&","&RC[-2]&","&RC[-1]&"}," -> {110031,0,1,2}, | AI50: =R[-1]C&RC[-1] -> {110023,0,1,2},{110024,0,1,2},{110025,0,1,2},{110026,0,1,2},{110030,0,1,2},{110031,0,1,2}, | AK50: 201037 | AL50: 烈焰腰带 | AM50: 1 | AN50: 0 | AO50: 1 | AP50: 1 | AQ50: ="{"&RC[-6]&","&RC[-3]&","&RC[-2]&","&RC[-1]&"}," -> {201037,0,1,1}, | AR50: =R[-1]C&RC[-1] -> {200010,0,1,40},{200011,0,1,40},{200012,0,1,40},{200013,0,1,40},{200015,0,1,40},{200016,0,1,40},{200017,0,1,40},{200019,0,1,40},{200020,0,1,1},{200021,0,1,3},{200022,0,1,10},{200023,0,1,10},{200025,0,1,3},{200026,0,1,10},{200027,0,1,3},{200029,0,1,3},{200030,0,1,1},{200031,0,1,1},{200032,0,1,5},{200033,0,1,5},{200035,0,1,1},{200036,0,1,5},{200037,0,1,1},{200039,0,1,1},{201010,0,1,40},{201011,0,1,40},{201012,0,1,40},{201013,0,1,40},{201015,0,1,40},{201016,0,1,40},{201017,0,1,40},{201019,0,1,40},{201020,0,1,1},{201021,0,1,3},{201022,0,1,10},{201023,0,1,10},{201025,0,1,3},{201026,0,1,10},{201027,0,1,3},{201029,0,1,3},{201030,0,1,1},{201031,0,1,1},{201032,0,1,5},{201033,0,1,5},{201035,0,1,1},{201036,0,1,5},{201037,0,1,1}, | AT50: 201037 | AU50: 烈焰腰带 | AV50: 1 | AW50: 0 | AX50: 1 | AY50: 1 | AZ50: ="{"&RC[-6]&","&RC[-3]&","&RC[-2]&","&RC[-1]&"}," -> {201037,0,1,1}, | BA50: =RC[-1] -> {201037,0,1,1}, | BC50: 201037 | BD50: 烈焰腰带 | BE50: 1 | BF50: 0 | BG50: 1 | BH50: 1 | BI50: ="{"&RC[-6]&","&RC[-3]&","&RC[-2]&","&RC[-1]&"}," -> {201037,0,1,1}, | BJ50: =RC[-1] -> {201037,0,1,1},
S51: 110032 | T51: 嗜血术书 | U51: 1 | V51: 0 | W51: 1 | X51: 1 | Y51: ="{"&RC[-6]&","&RC[-3]&","&RC[-2]&","&RC[-1]&"}," -> {110032,0,1,1}, | Z51: =R[-1]C&RC[-1] -> {110023,0,1,1},{110024,0,1,1},{110025,0,1,1},{110026,0,1,1},{110030,0,1,1},{110031,0,1,1},{110032,0,1,1}, | AB51: 110032 | AC51: 嗜血术书 | AD51: 1 | AE51: 0 | AF51: 1 | AG51: 2 | AH51: ="{"&RC[-6]&","&RC[-3]&","&RC[-2]&","&RC[-1]&"}," -> {110032,0,1,2}, | AI51: =R[-1]C&RC[-1] -> {110023,0,1,2},{110024,0,1,2},{110025,0,1,2},{110026,0,1,2},{110030,0,1,2},{110031,0,1,2},{110032,0,1,2}, | AK51: 201039 | AL51: 烈焰魔靴 | AM51: 1 | AN51: 0 | AO51: 1 | AP51: 1 | AQ51: ="{"&RC[-6]&","&RC[-3]&","&RC[-2]&","&RC[-1]&"}," -> {201039,0,1,1}, | AR51: =R[-1]C&RC[-1] -> {200010,0,1,40},{200011,0,1,40},{200012,0,1,40},{200013,0,1,40},{200015,0,1,40},{200016,0,1,40},{200017,0,1,40},{200019,0,1,40},{200020,0,1,1},{200021,0,1,3},{200022,0,1,10},{200023,0,1,10},{200025,0,1,3},{200026,0,1,10},{200027,0,1,3},{200029,0,1,3},{200030,0,1,1},{200031,0,1,1},{200032,0,1,5},{200033,0,1,5},{200035,0,1,1},{200036,0,1,5},{200037,0,1,1},{200039,0,1,1},{201010,0,1,40},{201011,0,1,40},{201012,0,1,40},{201013,0,1,40},{201015,0,1,40},{201016,0,1,40},{201017,0,1,40},{201019,0,1,40},{201020,0,1,1},{201021,0,1,3},{201022,0,1,10},{201023,0,1,10},{201025,0,1,3},{201026,0,1,10},{201027,0,1,3},{201029,0,1,3},{201030,0,1,1},{201031,0,1,1},{201032,0,1,5},{201033,0,1,5},{201035,0,1,1},{201036,0,1,5},{201037,0,1,1},{201039,0,1,1}, | AT51: 201039 | AU51: 烈焰魔靴 | AV51: 1 | AW51: 0 | AX51: 1 | AY51: 1 | AZ51: ="{"&RC[-6]&","&RC[-3]&","&RC[-2]&","&RC[-1]&"}," -> {201039,0,1,1}, | BA51: =RC[-1] -> {201039,0,1,1}, | BC51: 201039 | BD51: 烈焰魔靴 | BE51: 1 | BF51: 0 | BG51: 1 | BH51: 1 | BI51: ="{"&RC[-6]&","&RC[-3]&","&RC[-2]&","&RC[-1]&"}," -> {201039,0,1,1}, | BJ51: =RC[-1] -> {201039,0,1,1},
S52: 110033 | T52: 雷电术书 | U52: 1 | V52: 0 | W52: 1 | X52: 1 | Y52: ="{"&RC[-6]&","&RC[-3]&","&RC[-2]&","&RC[-1]&"}," -> {110033,0,1,1}, | Z52: =R[-1]C&RC[-1] -> {110023,0,1,1},{110024,0,1,1},{110025,0,1,1},{110026,0,1,1},{110030,0,1,1},{110031,0,1,1},{110032,0,1,1},{110033,0,1,1}, | AB52: 110033 | AC52: 雷电术书 | AD52: 1 | AE52: 0 | AF52: 1 | AG52: 2 | AH52: ="{"&RC[-6]&","&RC[-3]&","&RC[-2]&","&RC[-1]&"}," -> {110033,0,1,2}, | AI52: =R[-1]C&RC[-1] -> {110023,0,1,2},{110024,0,1,2},{110025,0,1,2},{110026,0,1,2},{110030,0,1,2},{110031,0,1,2},{110032,0,1,2},{110033,0,1,2}, | AK52: 202010 | AL52: 银蛇 | AM52: 1 | AN52: 0 | AO52: 1 | AP52: 40 | AQ52: ="{"&RC[-6]&","&RC[-3]&","&RC[-2]&","&RC[-1]&"}," -> {202010,0,1,40}, | AR52: =R[-1]C&RC[-1] -> {200010,0,1,40},{200011,0,1,40},{200012,0,1,40},{200013,0,1,40},{200015,0,1,40},{200016,0,1,40},{200017,0,1,40},{200019,0,1,40},{200020,0,1,1},{200021,0,1,3},{200022,0,1,10},{200023,0,1,10},{200025,0,1,3},{200026,0,1,10},{200027,0,1,3},{200029,0,1,3},{200030,0,1,1},{200031,0,1,1},{200032,0,1,5},{200033,0,1,5},{200035,0,1,1},{200036,0,1,5},{200037,0,1,1},{200039,0,1,1},{201010,0,1,40},{201011,0,1,40},{201012,0,1,40},{201013,0,1,40},{201015,0,1,40},{201016,0,1,40},{201017,0,1,40},{201019,0,1,40},{201020,0,1,1},{201021,0,1,3},{201022,0,1,10},{201023,0,1,10},{201025,0,1,3},{201026,0,1,10},{201027,0,1,3},{201029,0,1,3},{201030,0,1,1},{201031,0,1,1},{201032,0,1,5},{201033,0,1,5},{201035,0,1,1},{201036,0,1,5},{201037,0,1,1},{201039,0,1,1},{202010,0,1,40}, | AT52: 202010 | AU52: 银蛇 | AV52: 1 | AW52: 0 | AX52: 1 | AY52: 30 | AZ52: ="{"&RC[-6]&","&RC[-3]&","&RC[-2]&","&RC[-1]&"}," -> {202010,0,1,30}, | BA52: =RC[-1] -> {202010,0,1,30}, | BC52: 202010 | BD52: 银蛇 | BE52: 1 | BF52: 0 | BG52: 1 | BH52: 30 | BI52: ="{"&RC[-6]&","&RC[-3]&","&RC[-2]&","&RC[-1]&"}," -> {202010,0,1,30}, | BJ52: =RC[-1] -> {202010,0,1,30},
J53: BOSS怪掉落 | O53: 装备 | P53: 概率／100 | S53: 110038 | T53: 冰咆哮书 | U53: 1 | V53: 0 | W53: 1 | X53: 1 | Y53: ="{"&RC[-6]&","&RC[-3]&","&RC[-2]&","&RC[-1]&"}," -> {110038,0,1,1}, | Z53: =R[-1]C&RC[-1] -> {110023,0,1,1},{110024,0,1,1},{110025,0,1,1},{110026,0,1,1},{110030,0,1,1},{110031,0,1,1},{110032,0,1,1},{110033,0,1,1},{110038,0,1,1}, | AB53: 110038 | AC53: 冰咆哮书 | AD53: 1 | AE53: 0 | AF53: 1 | AG53: 2 | AH53: ="{"&RC[-6]&","&RC[-3]&","&RC[-2]&","&RC[-1]&"}," -> {110038,0,1,2}, | AI53: =R[-1]C&RC[-1] -> {110023,0,1,2},{110024,0,1,2},{110025,0,1,2},{110026,0,1,2},{110030,0,1,2},{110031,0,1,2},{110032,0,1,2},{110033,0,1,2},{110038,0,1,2}, | AK53: 202011 | AL53: 天珠道链 | AM53: 1 | AN53: 0 | AO53: 1 | AP53: 40 | AQ53: ="{"&RC[-6]&","&RC[-3]&","&RC[-2]&","&RC[-1]&"}," -> {202011,0,1,40}, | AR53: =R[-1]C&RC[-1] -> {200010,0,1,40},{200011,0,1,40},{200012,0,1,40},{200013,0,1,40},{200015,0,1,40},{200016,0,1,40},{200017,0,1,40},{200019,0,1,40},{200020,0,1,1},{200021,0,1,3},{200022,0,1,10},{200023,0,1,10},{200025,0,1,3},{200026,0,1,10},{200027,0,1,3},{200029,0,1,3},{200030,0,1,1},{200031,0,1,1},{200032,0,1,5},{200033,0,1,5},{200035,0,1,1},{200036,0,1,5},{200037,0,1,1},{200039,0,1,1},{201010,0,1,40},{201011,0,1,40},{201012,0,1,40},{201013,0,1,40},{201015,0,1,40},{201016,0,1,40},{201017,0,1,40},{201019,0,1,40},{201020,0,1,1},{201021,0,1,3},{201022,0,1,10},{201023,0,1,10},{201025,0,1,3},{201026,0,1,10},{201027,0,1,3},{201029,0,1,3},{201030,0,1,1},{201031,0,1,1},{201032,0,1,5},{201033,0,1,5},{201035,0,1,1},{201036,0,1,5},{201037,0,1,1},{201039,0,1,1},{202010,0,1,40},{202011,0,1,40}, | AT53: 202011 | AU53: 天珠道链 | AV53: 1 | AW53: 0 | AX53: 1 | AY53: 30 | AZ53: ="{"&RC[-6]&","&RC[-3]&","&RC[-2]&","&RC[-1]&"}," -> {202011,0,1,30}, | BA53: =RC[-1] -> {202011,0,1,30}, | BC53: 202011 | BD53: 天珠道链 | BE53: 1 | BF53: 0 | BG53: 1 | BH53: 30 | BI53: ="{"&RC[-6]&","&RC[-3]&","&RC[-2]&","&RC[-1]&"}," -> {202011,0,1,30}, | BJ53: =RC[-1] -> {202011,0,1,30},
O54: 3 | P54: 100 | Q54: ="{0,[{"&RC[-2]&","&RC[-1]&"}],["&R[-27]C&"]}" -> {0,[{3,100}],[{200000,0,1,30},{200001,0,1,30},{200002,0,1,30},{200003,0,1,30},{200006,0,1,30},{200010,0,1,5},{200011,0,1,10},{200012,0,1,10},{201000,0,1,30},{201001,0,1,30},{201002,0,1,30},{201003,0,1,30},{201006,0,1,30},{201010,0,1,5},{201011,0,1,10},{201012,0,1,10},{202000,0,1,30},{202001,0,1,30},{202002,0,1,30},{202003,0,1,30},{202006,0,1,30},{202010,0,1,5},{202011,0,1,10},{202012,0,1,10}]} | S54: 110039 | T54: 抗拒火环书 | U54: 1 | V54: 0 | W54: 1 | X54: 1 | Y54: ="{"&RC[-6]&","&RC[-3]&","&RC[-2]&","&RC[-1]&"}," -> {110039,0,1,1}, | Z54: =R[-1]C&RC[-1] -> {110023,0,1,1},{110024,0,1,1},{110025,0,1,1},{110026,0,1,1},{110030,0,1,1},{110031,0,1,1},{110032,0,1,1},{110033,0,1,1},{110038,0,1,1},{110039,0,1,1}, | AB54: 110039 | AC54: 抗拒火环书 | AD54: 1 | AE54: 0 | AF54: 1 | AG54: 2 | AH54: ="{"&RC[-6]&","&RC[-3]&","&RC[-2]&","&RC[-1]&"}," -> {110039,0,1,2}, | AI54: =R[-1]C&RC[-1] -> {110023,0,1,2},{110024,0,1,2},{110025,0,1,2},{110026,0,1,2},{110030,0,1,2},{110031,0,1,2},{110032,0,1,2},{110033,0,1,2},{110038,0,1,2},{110039,0,1,2}, | AK54: 202012 | AL54: 灵魂道袍 | AM54: 1 | AN54: 0 | AO54: 1 | AP54: 40 | AQ54: ="{"&RC[-6]&","&RC[-3]&","&RC[-2]&","&RC[-1]&"}," -> {202012,0,1,40}, | AR54: =R[-1]C&RC[-1] -> {200010,0,1,40},{200011,0,1,40},{200012,0,1,40},{200013,0,1,40},{200015,0,1,40},{200016,0,1,40},{200017,0,1,40},{200019,0,1,40},{200020,0,1,1},{200021,0,1,3},{200022,0,1,10},{200023,0,1,10},{200025,0,1,3},{200026,0,1,10},{200027,0,1,3},{200029,0,1,3},{200030,0,1,1},{200031,0,1,1},{200032,0,1,5},{200033,0,1,5},{200035,0,1,1},{200036,0,1,5},{200037,0,1,1},{200039,0,1,1},{201010,0,1,40},{201011,0,1,40},{201012,0,1,40},{201013,0,1,40},{201015,0,1,40},{201016,0,1,40},{201017,0,1,40},{201019,0,1,40},{201020,0,1,1},{201021,0,1,3},{201022,0,1,10},{201023,0,1,10},{201025,0,1,3},{201026,0,1,10},{201027,0,1,3},{201029,0,1,3},{201030,0,1,1},{201031,0,1,1},{201032,0,1,5},{201033,0,1,5},{201035,0,1,1},{201036,0,1,5},{201037,0,1,1},{201039,0,1,1},{202010,0,1,40},{202011,0,1,40},{202012,0,1,40}, | AT54: 202012 | AU54: 灵魂道袍 | AV54: 1 | AW54: 0 | AX54: 1 | AY54: 30 | AZ54: ="{"&RC[-6]&","&RC[-3]&","&RC[-2]&","&RC[-1]&"}," -> {202012,0,1,30}, | BA54: =RC[-1] -> {202012,0,1,30}, | BC54: 202012 | BD54: 灵魂道袍 | BE54: 1 | BF54: 0 | BG54: 1 | BH54: 30 | BI54: ="{"&RC[-6]&","&RC[-3]&","&RC[-2]&","&RC[-1]&"}," -> {202012,0,1,30}, | BJ54: =RC[-1] -> {202012,0,1,30},
O55: 道具 | P55: 概率／100 | S55: 110040 | T55: 流星火雨书 | U55: 1 | V55: 0 | W55: 1 | X55: 1 | Y55: ="{"&RC[-6]&","&RC[-3]&","&RC[-2]&","&RC[-1]&"}," -> {110040,0,1,1}, | Z55: =R[-1]C&RC[-1] -> {110023,0,1,1},{110024,0,1,1},{110025,0,1,1},{110026,0,1,1},{110030,0,1,1},{110031,0,1,1},{110032,0,1,1},{110033,0,1,1},{110038,0,1,1},{110039,0,1,1},{110040,0,1,1}, | AB55: 110040 | AC55: 流星火雨书 | AD55: 1 | AE55: 0 | AF55: 1 | AG55: 2 | AH55: ="{"&RC[-6]&","&RC[-3]&","&RC[-2]&","&RC[-1]&"}," -> {110040,0,1,2}, | AI55: =R[-1]C&RC[-1] -> {110023,0,1,2},{110024,0,1,2},{110025,0,1,2},{110026,0,1,2},{110030,0,1,2},{110031,0,1,2},{110032,0,1,2},{110033,0,1,2},{110038,0,1,2},{110039,0,1,2},{110040,0,1,2}, | AK55: 202013 | AL55: 泰坦戒指 | AM55: 1 | AN55: 0 | AO55: 1 | AP55: 40 | AQ55: ="{"&RC[-6]&","&RC[-3]&","&RC[-2]&","&RC[-1]&"}," -> {202013,0,1,40}, | AR55: =R[-1]C&RC[-1] -> {200010,0,1,40},{200011,0,1,40},{200012,0,1,40},{200013,0,1,40},{200015,0,1,40},{200016,0,1,40},{200017,0,1,40},{200019,0,1,40},{200020,0,1,1},{200021,0,1,3},{200022,0,1,10},{200023,0,1,10},{200025,0,1,3},{200026,0,1,10},{200027,0,1,3},{200029,0,1,3},{200030,0,1,1},{200031,0,1,1},{200032,0,1,5},{200033,0,1,5},{200035,0,1,1},{200036,0,1,5},{200037,0,1,1},{200039,0,1,1},{201010,0,1,40},{201011,0,1,40},{201012,0,1,40},{201013,0,1,40},{201015,0,1,40},{201016,0,1,40},{201017,0,1,40},{201019,0,1,40},{201020,0,1,1},{201021,0,1,3},{201022,0,1,10},{201023,0,1,10},{201025,0,1,3},{201026,0,1,10},{201027,0,1,3},{201029,0,1,3},{201030,0,1,1},{201031,0,1,1},{201032,0,1,5},{201033,0,1,5},{201035,0,1,1},{201036,0,1,5},{201037,0,1,1},{201039,0,1,1},{202010,0,1,40},{202011,0,1,40},{202012,0,1,40},{202013,0,1,40}, | AT55: 202013 | AU55: 泰坦戒指 | AV55: 1 | AW55: 0 | AX55: 1 | AY55: 30 | AZ55: ="{"&RC[-6]&","&RC[-3]&","&RC[-2]&","&RC[-1]&"}," -> {202013,0,1,30}, | BA55: =RC[-1] -> {202013,0,1,30}, | BC55: 202013 | BD55: 泰坦戒指 | BE55: 1 | BF55: 0 | BG55: 1 | BH55: 30 | BI55: ="{"&RC[-6]&","&RC[-3]&","&RC[-2]&","&RC[-1]&"}," -> {202013,0,1,30}, | BJ55: =RC[-1] -> {202013,0,1,30},
O56: 2 | P56: 100 | Q56: ="{0,[{"&RC[-2]&","&RC[-1]&"}],["&R[-6]C&"]}" -> {0,[{2,100}],[{110086,0,2,1},{110003,0,2,2},{110004,0,1,3},{110005,0,1,3},{110010,0,1,3},{110011,0,1,3},{110012,0,1,3}]} | S56: 110067 | T56: 诱惑之光书 | U56: 1 | V56: 0 | W56: 1 | X56: 1 | Y56: ="{"&RC[-6]&","&RC[-3]&","&RC[-2]&","&RC[-1]&"}" -> {110067,0,1,1} | Z56: =R[-1]C&RC[-1] -> {110023,0,1,1},{110024,0,1,1},{110025,0,1,1},{110026,0,1,1},{110030,0,1,1},{110031,0,1,1},{110032,0,1,1},{110033,0,1,1},{110038,0,1,1},{110039,0,1,1},{110040,0,1,1},{110067,0,1,1} | AB56: 110067 | AC56: 诱惑之光书 | AD56: 1 | AE56: 0 | AF56: 1 | AG56: 2 | AH56: ="{"&RC[-6]&","&RC[-3]&","&RC[-2]&","&RC[-1]&"}" -> {110067,0,1,2} | AI56: =R[-1]C&RC[-1] -> {110023,0,1,2},{110024,0,1,2},{110025,0,1,2},{110026,0,1,2},{110030,0,1,2},{110031,0,1,2},{110032,0,1,2},{110033,0,1,2},{110038,0,1,2},{110039,0,1,2},{110040,0,1,2},{110067,0,1,2} | AK56: 202015 | AL56: 道士头盔 | AM56: 1 | AN56: 0 | AO56: 1 | AP56: 40 | AQ56: ="{"&RC[-6]&","&RC[-3]&","&RC[-2]&","&RC[-1]&"}," -> {202015,0,1,40}, | AR56: =R[-1]C&RC[-1] -> {200010,0,1,40},{200011,0,1,40},{200012,0,1,40},{200013,0,1,40},{200015,0,1,40},{200016,0,1,40},{200017,0,1,40},{200019,0,1,40},{200020,0,1,1},{200021,0,1,3},{200022,0,1,10},{200023,0,1,10},{200025,0,1,3},{200026,0,1,10},{200027,0,1,3},{200029,0,1,3},{200030,0,1,1},{200031,0,1,1},{200032,0,1,5},{200033,0,1,5},{200035,0,1,1},{200036,0,1,5},{200037,0,1,1},{200039,0,1,1},{201010,0,1,40},{201011,0,1,40},{201012,0,1,40},{201013,0,1,40},{201015,0,1,40},{201016,0,1,40},{201017,0,1,40},{201019,0,1,40},{201020,0,1,1},{201021,0,1,3},{201022,0,1,10},{201023,0,1,10},{201025,0,1,3},{201026,0,1,10},{201027,0,1,3},{201029,0,1,3},{201030,0,1,1},{201031,0,1,1},{201032,0,1,5},{201033,0,1,5},{201035,0,1,1},{201036,0,1,5},{201037,0,1,1},{201039,0,1,1},{202010,0,1,40},{202011,0,1,40},{202012,0,1,40},{202013,0,1,40},{202015,0,1,40}, | AT56: 202015 | AU56: 道士头盔 | AV56: 1 | AW56: 0 | AX56: 1 | AY56: 30 | AZ56: ="{"&RC[-6]&","&RC[-3]&","&RC[-2]&","&RC[-1]&"}," -> {202015,0,1,30}, | BA56: =RC[-1] -> {202015,0,1,30}, | BC56: 202015 | BD56: 道士头盔 | BE56: 1 | BF56: 0 | BG56: 1 | BH56: 30 | BI56: ="{"&RC[-6]&","&RC[-3]&","&RC[-2]&","&RC[-1]&"}," -> {202015,0,1,30}, | BJ56: =RC[-1] -> {202015,0,1,30},
O57: 金币 | P57: 概率／100 | AK57: 202016 | AL57: 幽灵手镯 | AM57: 1 | AN57: 0 | AO57: 1 | AP57: 40 | AQ57: ="{"&RC[-6]&","&RC[-3]&","&RC[-2]&","&RC[-1]&"}," -> {202016,0,1,40}, | AR57: =R[-1]C&RC[-1] -> {200010,0,1,40},{200011,0,1,40},{200012,0,1,40},{200013,0,1,40},{200015,0,1,40},{200016,0,1,40},{200017,0,1,40},{200019,0,1,40},{200020,0,1,1},{200021,0,1,3},{200022,0,1,10},{200023,0,1,10},{200025,0,1,3},{200026,0,1,10},{200027,0,1,3},{200029,0,1,3},{200030,0,1,1},{200031,0,1,1},{200032,0,1,5},{200033,0,1,5},{200035,0,1,1},{200036,0,1,5},{200037,0,1,1},{200039,0,1,1},{201010,0,1,40},{201011,0,1,40},{201012,0,1,40},{201013,0,1,40},{201015,0,1,40},{201016,0,1,40},{201017,0,1,40},{201019,0,1,40},{201020,0,1,1},{201021,0,1,3},{201022,0,1,10},{201023,0,1,10},{201025,0,1,3},{201026,0,1,10},{201027,0,1,3},{201029,0,1,3},{201030,0,1,1},{201031,0,1,1},{201032,0,1,5},{201033,0,1,5},{201035,0,1,1},{201036,0,1,5},{201037,0,1,1},{201039,0,1,1},{202010,0,1,40},{202011,0,1,40},{202012,0,1,40},{202013,0,1,40},{202015,0,1,40},{202016,0,1,40}, | AT57: 202016 | AU57: 幽灵手镯 | AV57: 1 | AW57: 0 | AX57: 1 | AY57: 30 | AZ57: ="{"&RC[-6]&","&RC[-3]&","&RC[-2]&","&RC[-1]&"}," -> {202016,0,1,30}, | BA57: =RC[-1] -> {202016,0,1,30}, | BC57: 202016 | BD57: 幽灵手镯 | BE57: 1 | BF57: 0 | BG57: 1 | BH57: 30 | BI57: ="{"&RC[-6]&","&RC[-3]&","&RC[-2]&","&RC[-1]&"}," -> {202016,0,1,30}, | BJ57: =RC[-1] -> {202016,0,1,30},
O58: 3 | P58: 100 | Q58: {0,[{10,100}],[{110009,1,1000,1}]} | S58: 110086 | T58: 黑铁矿+8 | V58: 0 | W58: 2 | X58: 1 | Y58: ="{"&RC[-6]&","&RC[-3]&","&RC[-2]&","&RC[-1]&"}," -> {110086,0,2,1}, | Z58: =RC[-1] -> {110086,0,2,1}, | AB58: 110093 | AC58: 紫水晶+5 | AE58: 0 | AF58: 2 | AG58: 2 | AH58: ="{"&RC[-6]&","&RC[-3]&","&RC[-2]&","&RC[-1]&"}," -> {110093,0,2,2}, | AI58: =RC[-1] -> {110093,0,2,2}, | AK58: 202017 | AL58: 道士腰带 | AM58: 1 | AN58: 0 | AO58: 1 | AP58: 40 | AQ58: ="{"&RC[-6]&","&RC[-3]&","&RC[-2]&","&RC[-1]&"}," -> {202017,0,1,40}, | AR58: =R[-1]C&RC[-1] -> {200010,0,1,40},{200011,0,1,40},{200012,0,1,40},{200013,0,1,40},{200015,0,1,40},{200016,0,1,40},{200017,0,1,40},{200019,0,1,40},{200020,0,1,1},{200021,0,1,3},{200022,0,1,10},{200023,0,1,10},{200025,0,1,3},{200026,0,1,10},{200027,0,1,3},{200029,0,1,3},{200030,0,1,1},{200031,0,1,1},{200032,0,1,5},{200033,0,1,5},{200035,0,1,1},{200036,0,1,5},{200037,0,1,1},{200039,0,1,1},{201010,0,1,40},{201011,0,1,40},{201012,0,1,40},{201013,0,1,40},{201015,0,1,40},{201016,0,1,40},{201017,0,1,40},{201019,0,1,40},{201020,0,1,1},{201021,0,1,3},{201022,0,1,10},{201023,0,1,10},{201025,0,1,3},{201026,0,1,10},{201027,0,1,3},{201029,0,1,3},{201030,0,1,1},{201031,0,1,1},{201032,0,1,5},{201033,0,1,5},{201035,0,1,1},{201036,0,1,5},{201037,0,1,1},{201039,0,1,1},{202010,0,1,40},{202011,0,1,40},{202012,0,1,40},{202013,0,1,40},{202015,0,1,40},{202016,0,1,40},{202017,0,1,40}, | AT58: 202017 | AU58: 道士腰带 | AV58: 1 | AW58: 0 | AX58: 1 | AY58: 30 | AZ58: ="{"&RC[-6]&","&RC[-3]&","&RC[-2]&","&RC[-1]&"}," -> {202017,0,1,30}, | BA58: =RC[-1] -> {202017,0,1,30}, | BC58: 202017 | BD58: 道士腰带 | BE58: 1 | BF58: 0 | BG58: 1 | BH58: 30 | BI58: ="{"&RC[-6]&","&RC[-3]&","&RC[-2]&","&RC[-1]&"}," -> {202017,0,1,30}, | BJ58: =RC[-1] -> {202017,0,1,30},
O59: 技能书 | P59: 概率／100 | S59: 110003 | T59: 洗炼石 | V59: 0 | W59: 2 | X59: 2 | Y59: ="{"&RC[-6]&","&RC[-3]&","&RC[-2]&","&RC[-1]&"}," -> {110003,0,2,2}, | Z59: =R[-1]C&RC[-1] -> {110086,0,2,1},{110003,0,2,2}, | AB59: 110003 | AC59: 洗炼石 | AE59: 0 | AF59: 2 | AG59: 2 | AH59: ="{"&RC[-6]&","&RC[-3]&","&RC[-2]&","&RC[-1]&"}," -> {110003,0,2,2}, | AI59: =R[-1]C&RC[-1] -> {110093,0,2,2},{110003,0,2,2}, | AK59: 202019 | AL59: 道士鞋子 | AM59: 1 | AN59: 0 | AO59: 1 | AP59: 40 | AQ59: ="{"&RC[-6]&","&RC[-3]&","&RC[-2]&","&RC[-1]&"}," -> {202019,0,1,40}, | AR59: =R[-1]C&RC[-1] -> {200010,0,1,40},{200011,0,1,40},{200012,0,1,40},{200013,0,1,40},{200015,0,1,40},{200016,0,1,40},{200017,0,1,40},{200019,0,1,40},{200020,0,1,1},{200021,0,1,3},{200022,0,1,10},{200023,0,1,10},{200025,0,1,3},{200026,0,1,10},{200027,0,1,3},{200029,0,1,3},{200030,0,1,1},{200031,0,1,1},{200032,0,1,5},{200033,0,1,5},{200035,0,1,1},{200036,0,1,5},{200037,0,1,1},{200039,0,1,1},{201010,0,1,40},{201011,0,1,40},{201012,0,1,40},{201013,0,1,40},{201015,0,1,40},{201016,0,1,40},{201017,0,1,40},{201019,0,1,40},{201020,0,1,1},{201021,0,1,3},{201022,0,1,10},{201023,0,1,10},{201025,0,1,3},{201026,0,1,10},{201027,0,1,3},{201029,0,1,3},{201030,0,1,1},{201031,0,1,1},{201032,0,1,5},{201033,0,1,5},{201035,0,1,1},{201036,0,1,5},{201037,0,1,1},{201039,0,1,1},{202010,0,1,40},{202011,0,1,40},{202012,0,1,40},{202013,0,1,40},{202015,0,1,40},{202016,0,1,40},{202017,0,1,40},{202019,0,1,40}, | AT59: 202019 | AU59: 道士鞋子 | AV59: 1 | AW59: 0 | AX59: 1 | AY59: 30 | AZ59: ="{"&RC[-6]&","&RC[-3]&","&RC[-2]&","&RC[-1]&"}," -> {202019,0,1,30}, | BA59: =RC[-1] -> {202019,0,1,30}, | BC59: 202019 | BD59: 道士鞋子 | BE59: 1 | BF59: 0 | BG59: 1 | BH59: 30 | BI59: ="{"&RC[-6]&","&RC[-3]&","&RC[-2]&","&RC[-1]&"}," -> {202019,0,1,30}, | BJ59: =RC[-1] -> {202019,0,1,30},
O60: 1 | P60: 100 | Q60: ="{0,[{"&RC[-2]&","&RC[-1]&"}],["&R[-19]C&"]}" -> {0,[{1,100}],[{110023,0,1,5},{110024,0,1,5},{110025,0,1,5},{110026,0,1,5},{110030,0,1,5},{110031,0,1,5},{110032,0,1,5},{110033,0,1,5},{110038,0,1,5},{110039,0,1,5},{110040,0,1,5},{110067,0,1,5}]} | S60: 110004 | T60: 红药 | V60: 0 | W60: 1 | X60: 3 | Y60: ="{"&RC[-6]&","&RC[-3]&","&RC[-2]&","&RC[-1]&"}," -> {110004,0,1,3}, | Z60: =R[-1]C&RC[-1] -> {110086,0,2,1},{110003,0,2,2},{110004,0,1,3}, | AB60: 110004 | AC60: 红药 | AE60: 0 | AF60: 1 | AG60: 3 | AH60: ="{"&RC[-6]&","&RC[-3]&","&RC[-2]&","&RC[-1]&"}," -> {110004,0,1,3}, | AI60: =R[-1]C&RC[-1] -> {110093,0,2,2},{110003,0,2,2},{110004,0,1,3}, | AK60: 202020 | AL60: 龙纹 | AM60: 1 | AN60: 0 | AO60: 1 | AP60: 1 | AQ60: ="{"&RC[-6]&","&RC[-3]&","&RC[-2]&","&RC[-1]&"}," -> {202020,0,1,1}, | AR60: =R[-1]C&RC[-1] -> {200010,0,1,40},{200011,0,1,40},{200012,0,1,40},{200013,0,1,40},{200015,0,1,40},{200016,0,1,40},{200017,0,1,40},{200019,0,1,40},{200020,0,1,1},{200021,0,1,3},{200022,0,1,10},{200023,0,1,10},{200025,0,1,3},{200026,0,1,10},{200027,0,1,3},{200029,0,1,3},{200030,0,1,1},{200031,0,1,1},{200032,0,1,5},{200033,0,1,5},{200035,0,1,1},{200036,0,1,5},{200037,0,1,1},{200039,0,1,1},{201010,0,1,40},{201011,0,1,40},{201012,0,1,40},{201013,0,1,40},{201015,0,1,40},{201016,0,1,40},{201017,0,1,40},{201019,0,1,40},{201020,0,1,1},{201021,0,1,3},{201022,0,1,10},{201023,0,1,10},{201025,0,1,3},{201026,0,1,10},{201027,0,1,3},{201029,0,1,3},{201030,0,1,1},{201031,0,1,1},{201032,0,1,5},{201033,0,1,5},{201035,0,1,1},{201036,0,1,5},{201037,0,1,1},{201039,0,1,1},{202010,0,1,40},{202011,0,1,40},{202012,0,1,40},{202013,0,1,40},{202015,0,1,40},{202016,0,1,40},{202017,0,1,40},{202019,0,1,40},{202020,0,1,1}, | AT60: 202020 | AU60: 龙纹 | AV60: 1 | AW60: 0 | AX60: 1 | AY60: 1 | AZ60: ="{"&RC[-6]&","&RC[-3]&","&RC[-2]&","&RC[-1]&"}," -> {202020,0,1,1}, | BA60: =RC[-1] -> {202020,0,1,1}, | BC60: 202020 | BD60: 龙纹 | BE60: 1 | BF60: 0 | BG60: 1 | BH60: 1 | BI60: ="{"&RC[-6]&","&RC[-3]&","&RC[-2]&","&RC[-1]&"}," -> {202020,0,1,1}, | BJ60: =RC[-1] -> {202020,0,1,1},
S61: 110005 | T61: 蓝药 | V61: 0 | W61: 1 | X61: 3 | Y61: ="{"&RC[-6]&","&RC[-3]&","&RC[-2]&","&RC[-1]&"}," -> {110005,0,1,3}, | Z61: =R[-1]C&RC[-1] -> {110086,0,2,1},{110003,0,2,2},{110004,0,1,3},{110005,0,1,3}, | AB61: 110005 | AC61: 蓝药 | AE61: 0 | AF61: 1 | AG61: 3 | AH61: ="{"&RC[-6]&","&RC[-3]&","&RC[-2]&","&RC[-1]&"}," -> {110005,0,1,3}, | AI61: =R[-1]C&RC[-1] -> {110093,0,2,2},{110003,0,2,2},{110004,0,1,3},{110005,0,1,3}, | AK61: 202021 | AL61: 天尊道袍 | AM61: 1 | AN61: 0 | AO61: 1 | AP61: 3 | AQ61: ="{"&RC[-6]&","&RC[-3]&","&RC[-2]&","&RC[-1]&"}," -> {202021,0,1,3}, | AR61: =R[-1]C&RC[-1] -> {200010,0,1,40},{200011,0,1,40},{200012,0,1,40},{200013,0,1,40},{200015,0,1,40},{200016,0,1,40},{200017,0,1,40},{200019,0,1,40},{200020,0,1,1},{200021,0,1,3},{200022,0,1,10},{200023,0,1,10},{200025,0,1,3},{200026,0,1,10},{200027,0,1,3},{200029,0,1,3},{200030,0,1,1},{200031,0,1,1},{200032,0,1,5},{200033,0,1,5},{200035,0,1,1},{200036,0,1,5},{200037,0,1,1},{200039,0,1,1},{201010,0,1,40},{201011,0,1,40},{201012,0,1,40},{201013,0,1,40},{201015,0,1,40},{201016,0,1,40},{201017,0,1,40},{201019,0,1,40},{201020,0,1,1},{201021,0,1,3},{201022,0,1,10},{201023,0,1,10},{201025,0,1,3},{201026,0,1,10},{201027,0,1,3},{201029,0,1,3},{201030,0,1,1},{201031,0,1,1},{201032,0,1,5},{201033,0,1,5},{201035,0,1,1},{201036,0,1,5},{201037,0,1,1},{201039,0,1,1},{202010,0,1,40},{202011,0,1,40},{202012,0,1,40},{202013,0,1,40},{202015,0,1,40},{202016,0,1,40},{202017,0,1,40},{202019,0,1,40},{202020,0,1,1},{202021,0,1,3}, | AT61: 202021 | AU61: 天尊道袍 | AV61: 1 | AW61: 0 | AX61: 1 | AY61: 3 | AZ61: ="{"&RC[-6]&","&RC[-3]&","&RC[-2]&","&RC[-1]&"}," -> {202021,0,1,3}, | BA61: =RC[-1] -> {202021,0,1,3}, | BC61: 202021 | BD61: 天尊道袍 | BE61: 1 | BF61: 0 | BG61: 1 | BH61: 3 | BI61: ="{"&RC[-6]&","&RC[-3]&","&RC[-2]&","&RC[-1]&"}," -> {202021,0,1,3}, | BJ61: =RC[-1] -> {202021,0,1,3},
Q62: ="["&R[-8]C&","&R[-6]C&","&R[-4]C&","&R[-2]C&"]" -> [{0,[{3,100}],[{200000,0,1,30},{200001,0,1,30},{200002,0,1,30},{200003,0,1,30},{200006,0,1,30},{200010,0,1,5},{200011,0,1,10},{200012,0,1,10},{201000,0,1,30},{201001,0,1,30},{201002,0,1,30},{201003,0,1,30},{201006,0,1,30},{201010,0,1,5},{201011,0,1,10},{201012,0,1,10},{202000,0,1,30},{202001,0,1,30},{202002,0,1,30},{202003,0,1,30},{202006,0,1,30},{202010,0,1,5},{202011,0,1,10},{202012,0,1,10}]},{0,[{2,100}],[{110086,0,2,1},{110003,0,2,2},{110004,0,1,3},{110005,0,1,3},{110010,0,1,3},{110011,0,1,3},{110012,0,1,3}]},{0,[{10,100}],[{110009,1,1000,1}]},{0,[{1,100}],[{110023,0,1,5},{110024,0,1,5},{110025,0,1,5},{110026,0,1,5},{110030,0,1,5},{110031,0,1,5},{110032,0,1,5},{110033,0,1,5},{110038,0,1,5},{110039,0,1,5},{110040,0,1,5},{110067,0,1,5}]}] | S62: 110013 | T62: 精炼武装碎片 | V62: 0 | W62: 1 | X62: 3 | Y62: ="{"&RC[-6]&","&RC[-3]&","&RC[-2]&","&RC[-1]&"}," -> {110013,0,1,3}, | Z62: =R[-1]C&RC[-1] -> {110086,0,2,1},{110003,0,2,2},{110004,0,1,3},{110005,0,1,3},{110013,0,1,3}, | AB62: 110013 | AC62: 精炼武装碎片 | AE62: 0 | AF62: 1 | AG62: 3 | AH62: ="{"&RC[-6]&","&RC[-3]&","&RC[-2]&","&RC[-1]&"}," -> {110013,0,1,3}, | AI62: =R[-1]C&RC[-1] -> {110093,0,2,2},{110003,0,2,2},{110004,0,1,3},{110005,0,1,3},{110013,0,1,3}, | AK62: 202022 | AL62: 天尊项链 | AM62: 1 | AN62: 0 | AO62: 1 | AP62: 10 | AQ62: ="{"&RC[-6]&","&RC[-3]&","&RC[-2]&","&RC[-1]&"}," -> {202022,0,1,10}, | AR62: =R[-1]C&RC[-1] -> {200010,0,1,40},{200011,0,1,40},{200012,0,1,40},{200013,0,1,40},{200015,0,1,40},{200016,0,1,40},{200017,0,1,40},{200019,0,1,40},{200020,0,1,1},{200021,0,1,3},{200022,0,1,10},{200023,0,1,10},{200025,0,1,3},{200026,0,1,10},{200027,0,1,3},{200029,0,1,3},{200030,0,1,1},{200031,0,1,1},{200032,0,1,5},{200033,0,1,5},{200035,0,1,1},{200036,0,1,5},{200037,0,1,1},{200039,0,1,1},{201010,0,1,40},{201011,0,1,40},{201012,0,1,40},{201013,0,1,40},{201015,0,1,40},{201016,0,1,40},{201017,0,1,40},{201019,0,1,40},{201020,0,1,1},{201021,0,1,3},{201022,0,1,10},{201023,0,1,10},{201025,0,1,3},{201026,0,1,10},{201027,0,1,3},{201029,0,1,3},{201030,0,1,1},{201031,0,1,1},{201032,0,1,5},{201033,0,1,5},{201035,0,1,1},{201036,0,1,5},{201037,0,1,1},{201039,0,1,1},{202010,0,1,40},{202011,0,1,40},{202012,0,1,40},{202013,0,1,40},{202015,0,1,40},{202016,0,1,40},{202017,0,1,40},{202019,0,1,40},{202020,0,1,1},{202021,0,1,3},{202022,0,1,10}, | AT62: 202022 | AU62: 天尊项链 | AV62: 1 | AW62: 0 | AX62: 1 | AY62: 10 | AZ62: ="{"&RC[-6]&","&RC[-3]&","&RC[-2]&","&RC[-1]&"}," -> {202022,0,1,10}, | BA62: =RC[-1] -> {202022,0,1,10}, | BC62: 202022 | BD62: 天尊项链 | BE62: 1 | BF62: 0 | BG62: 1 | BH62: 10 | BI62: ="{"&RC[-6]&","&RC[-3]&","&RC[-2]&","&RC[-1]&"}," -> {202022,0,1,10}, | BJ62: =RC[-1] -> {202022,0,1,10},
S63: 110014 | T63: 精炼防具碎片 | V63: 0 | W63: 1 | X63: 3 | Y63: ="{"&RC[-6]&","&RC[-3]&","&RC[-2]&","&RC[-1]&"}," -> {110014,0,1,3}, | Z63: =R[-1]C&RC[-1] -> {110086,0,2,1},{110003,0,2,2},{110004,0,1,3},{110005,0,1,3},{110013,0,1,3},{110014,0,1,3}, | AB63: 110014 | AC63: 精炼防具碎片 | AE63: 0 | AF63: 1 | AG63: 3 | AH63: ="{"&RC[-6]&","&RC[-3]&","&RC[-2]&","&RC[-1]&"}," -> {110014,0,1,3}, | AI63: =R[-1]C&RC[-1] -> {110093,0,2,2},{110003,0,2,2},{110004,0,1,3},{110005,0,1,3},{110013,0,1,3},{110014,0,1,3}, | AK63: 202023 | AL63: 天尊戒指 | AM63: 1 | AN63: 0 | AO63: 1 | AP63: 10 | AQ63: ="{"&RC[-6]&","&RC[-3]&","&RC[-2]&","&RC[-1]&"}," -> {202023,0,1,10}, | AR63: =R[-1]C&RC[-1] -> {200010,0,1,40},{200011,0,1,40},{200012,0,1,40},{200013,0,1,40},{200015,0,1,40},{200016,0,1,40},{200017,0,1,40},{200019,0,1,40},{200020,0,1,1},{200021,0,1,3},{200022,0,1,10},{200023,0,1,10},{200025,0,1,3},{200026,0,1,10},{200027,0,1,3},{200029,0,1,3},{200030,0,1,1},{200031,0,1,1},{200032,0,1,5},{200033,0,1,5},{200035,0,1,1},{200036,0,1,5},{200037,0,1,1},{200039,0,1,1},{201010,0,1,40},{201011,0,1,40},{201012,0,1,40},{201013,0,1,40},{201015,0,1,40},{201016,0,1,40},{201017,0,1,40},{201019,0,1,40},{201020,0,1,1},{201021,0,1,3},{201022,0,1,10},{201023,0,1,10},{201025,0,1,3},{201026,0,1,10},{201027,0,1,3},{201029,0,1,3},{201030,0,1,1},{201031,0,1,1},{201032,0,1,5},{201033,0,1,5},{201035,0,1,1},{201036,0,1,5},{201037,0,1,1},{201039,0,1,1},{202010,0,1,40},{202011,0,1,40},{202012,0,1,40},{202013,0,1,40},{202015,0,1,40},{202016,0,1,40},{202017,0,1,40},{202019,0,1,40},{202020,0,1,1},{202021,0,1,3},{202022,0,1,10},{202023,0,1,10}, | AT63: 202023 | AU63: 天尊戒指 | AV63: 1 | AW63: 0 | AX63: 1 | AY63: 10 | AZ63: ="{"&RC[-6]&","&RC[-3]&","&RC[-2]&","&RC[-1]&"}," -> {202023,0,1,10}, | BA63: =RC[-1] -> {202023,0,1,10}, | BC63: 202023 | BD63: 天尊戒指 | BE63: 1 | BF63: 0 | BG63: 1 | BH63: 10 | BI63: ="{"&RC[-6]&","&RC[-3]&","&RC[-2]&","&RC[-1]&"}," -> {202023,0,1,10}, | BJ63: =RC[-1] -> {202023,0,1,10},
S64: 110015 | T64: 精炼首饰碎片 | V64: 0 | W64: 1 | X64: 3 | Y64: ="{"&RC[-6]&","&RC[-3]&","&RC[-2]&","&RC[-1]&"}" -> {110015,0,1,3} | Z64: =R[-1]C&RC[-1] -> {110086,0,2,1},{110003,0,2,2},{110004,0,1,3},{110005,0,1,3},{110013,0,1,3},{110014,0,1,3},{110015,0,1,3} | AB64: 110015 | AC64: 精炼首饰碎片 | AE64: 0 | AF64: 1 | AG64: 3 | AH64: ="{"&RC[-6]&","&RC[-3]&","&RC[-2]&","&RC[-1]&"}" -> {110015,0,1,3} | AI64: =R[-1]C&RC[-1] -> {110093,0,2,2},{110003,0,2,2},{110004,0,1,3},{110005,0,1,3},{110013,0,1,3},{110014,0,1,3},{110015,0,1,3} | AK64: 202025 | AL64: 天尊头盔 | AM64: 1 | AN64: 0 | AO64: 1 | AP64: 3 | AQ64: ="{"&RC[-6]&","&RC[-3]&","&RC[-2]&","&RC[-1]&"}," -> {202025,0,1,3}, | AR64: =R[-1]C&RC[-1] -> {200010,0,1,40},{200011,0,1,40},{200012,0,1,40},{200013,0,1,40},{200015,0,1,40},{200016,0,1,40},{200017,0,1,40},{200019,0,1,40},{200020,0,1,1},{200021,0,1,3},{200022,0,1,10},{200023,0,1,10},{200025,0,1,3},{200026,0,1,10},{200027,0,1,3},{200029,0,1,3},{200030,0,1,1},{200031,0,1,1},{200032,0,1,5},{200033,0,1,5},{200035,0,1,1},{200036,0,1,5},{200037,0,1,1},{200039,0,1,1},{201010,0,1,40},{201011,0,1,40},{201012,0,1,40},{201013,0,1,40},{201015,0,1,40},{201016,0,1,40},{201017,0,1,40},{201019,0,1,40},{201020,0,1,1},{201021,0,1,3},{201022,0,1,10},{201023,0,1,10},{201025,0,1,3},{201026,0,1,10},{201027,0,1,3},{201029,0,1,3},{201030,0,1,1},{201031,0,1,1},{201032,0,1,5},{201033,0,1,5},{201035,0,1,1},{201036,0,1,5},{201037,0,1,1},{201039,0,1,1},{202010,0,1,40},{202011,0,1,40},{202012,0,1,40},{202013,0,1,40},{202015,0,1,40},{202016,0,1,40},{202017,0,1,40},{202019,0,1,40},{202020,0,1,1},{202021,0,1,3},{202022,0,1,10},{202023,0,1,10},{202025,0,1,3}, | AT64: 202025 | AU64: 天尊头盔 | AV64: 1 | AW64: 0 | AX64: 1 | AY64: 3 | AZ64: ="{"&RC[-6]&","&RC[-3]&","&RC[-2]&","&RC[-1]&"}," -> {202025,0,1,3}, | BA64: =RC[-1] -> {202025,0,1,3}, | BC64: 202025 | BD64: 天尊头盔 | BE64: 1 | BF64: 0 | BG64: 1 | BH64: 3 | BI64: ="{"&RC[-6]&","&RC[-3]&","&RC[-2]&","&RC[-1]&"}," -> {202025,0,1,3}, | BJ64: =RC[-1] -> {202025,0,1,3},
AK65: 202026 | AL65: 天尊手镯 | AM65: 1 | AN65: 0 | AO65: 1 | AP65: 10 | AQ65: ="{"&RC[-6]&","&RC[-3]&","&RC[-2]&","&RC[-1]&"}," -> {202026,0,1,10}, | AR65: =R[-1]C&RC[-1] -> {200010,0,1,40},{200011,0,1,40},{200012,0,1,40},{200013,0,1,40},{200015,0,1,40},{200016,0,1,40},{200017,0,1,40},{200019,0,1,40},{200020,0,1,1},{200021,0,1,3},{200022,0,1,10},{200023,0,1,10},{200025,0,1,3},{200026,0,1,10},{200027,0,1,3},{200029,0,1,3},{200030,0,1,1},{200031,0,1,1},{200032,0,1,5},{200033,0,1,5},{200035,0,1,1},{200036,0,1,5},{200037,0,1,1},{200039,0,1,1},{201010,0,1,40},{201011,0,1,40},{201012,0,1,40},{201013,0,1,40},{201015,0,1,40},{201016,0,1,40},{201017,0,1,40},{201019,0,1,40},{201020,0,1,1},{201021,0,1,3},{201022,0,1,10},{201023,0,1,10},{201025,0,1,3},{201026,0,1,10},{201027,0,1,3},{201029,0,1,3},{201030,0,1,1},{201031,0,1,1},{201032,0,1,5},{201033,0,1,5},{201035,0,1,1},{201036,0,1,5},{201037,0,1,1},{201039,0,1,1},{202010,0,1,40},{202011,0,1,40},{202012,0,1,40},{202013,0,1,40},{202015,0,1,40},{202016,0,1,40},{202017,0,1,40},{202019,0,1,40},{202020,0,1,1},{202021,0,1,3},{202022,0,1,10},{202023,0,1,10},{202025,0,1,3},{202026,0,1,10}, | AT65: 202026 | AU65: 天尊手镯 | AV65: 1 | AW65: 0 | AX65: 1 | AY65: 10 | AZ65: ="{"&RC[-6]&","&RC[-3]&","&RC[-2]&","&RC[-1]&"}," -> {202026,0,1,10}, | BA65: =RC[-1] -> {202026,0,1,10}, | BC65: 202026 | BD65: 天尊手镯 | BE65: 1 | BF65: 0 | BG65: 1 | BH65: 10 | BI65: ="{"&RC[-6]&","&RC[-3]&","&RC[-2]&","&RC[-1]&"}," -> {202026,0,1,10}, | BJ65: =RC[-1] -> {202026,0,1,10},
AK66: 202027 | AL66: 天尊腰带 | AM66: 1 | AN66: 0 | AO66: 1 | AP66: 3 | AQ66: ="{"&RC[-6]&","&RC[-3]&","&RC[-2]&","&RC[-1]&"}," -> {202027,0,1,3}, | AR66: =R[-1]C&RC[-1] -> {200010,0,1,40},{200011,0,1,40},{200012,0,1,40},{200013,0,1,40},{200015,0,1,40},{200016,0,1,40},{200017,0,1,40},{200019,0,1,40},{200020,0,1,1},{200021,0,1,3},{200022,0,1,10},{200023,0,1,10},{200025,0,1,3},{200026,0,1,10},{200027,0,1,3},{200029,0,1,3},{200030,0,1,1},{200031,0,1,1},{200032,0,1,5},{200033,0,1,5},{200035,0,1,1},{200036,0,1,5},{200037,0,1,1},{200039,0,1,1},{201010,0,1,40},{201011,0,1,40},{201012,0,1,40},{201013,0,1,40},{201015,0,1,40},{201016,0,1,40},{201017,0,1,40},{201019,0,1,40},{201020,0,1,1},{201021,0,1,3},{201022,0,1,10},{201023,0,1,10},{201025,0,1,3},{201026,0,1,10},{201027,0,1,3},{201029,0,1,3},{201030,0,1,1},{201031,0,1,1},{201032,0,1,5},{201033,0,1,5},{201035,0,1,1},{201036,0,1,5},{201037,0,1,1},{201039,0,1,1},{202010,0,1,40},{202011,0,1,40},{202012,0,1,40},{202013,0,1,40},{202015,0,1,40},{202016,0,1,40},{202017,0,1,40},{202019,0,1,40},{202020,0,1,1},{202021,0,1,3},{202022,0,1,10},{202023,0,1,10},{202025,0,1,3},{202026,0,1,10},{202027,0,1,3}, | AT66: 202027 | AU66: 天尊腰带 | AV66: 1 | AW66: 0 | AX66: 1 | AY66: 3 | AZ66: ="{"&RC[-6]&","&RC[-3]&","&RC[-2]&","&RC[-1]&"}," -> {202027,0,1,3}, | BA66: =RC[-1] -> {202027,0,1,3}, | BC66: 202027 | BD66: 天尊腰带 | BE66: 1 | BF66: 0 | BG66: 1 | BH66: 3 | BI66: ="{"&RC[-6]&","&RC[-3]&","&RC[-2]&","&RC[-1]&"}," -> {202027,0,1,3}, | BJ66: =RC[-1] -> {202027,0,1,3},
S67: BOSS怪掉落 | X67: 装备 | Y67: 概率／100 | AB67: BOSS怪掉落 | AG67: 装备 | AH67: 概率／100 | AK67: 202029 | AL67: 天尊鞋子 | AM67: 1 | AN67: 0 | AO67: 1 | AP67: 3 | AQ67: ="{"&RC[-6]&","&RC[-3]&","&RC[-2]&","&RC[-1]&"}," -> {202029,0,1,3}, | AR67: =R[-1]C&RC[-1] -> {200010,0,1,40},{200011,0,1,40},{200012,0,1,40},{200013,0,1,40},{200015,0,1,40},{200016,0,1,40},{200017,0,1,40},{200019,0,1,40},{200020,0,1,1},{200021,0,1,3},{200022,0,1,10},{200023,0,1,10},{200025,0,1,3},{200026,0,1,10},{200027,0,1,3},{200029,0,1,3},{200030,0,1,1},{200031,0,1,1},{200032,0,1,5},{200033,0,1,5},{200035,0,1,1},{200036,0,1,5},{200037,0,1,1},{200039,0,1,1},{201010,0,1,40},{201011,0,1,40},{201012,0,1,40},{201013,0,1,40},{201015,0,1,40},{201016,0,1,40},{201017,0,1,40},{201019,0,1,40},{201020,0,1,1},{201021,0,1,3},{201022,0,1,10},{201023,0,1,10},{201025,0,1,3},{201026,0,1,10},{201027,0,1,3},{201029,0,1,3},{201030,0,1,1},{201031,0,1,1},{201032,0,1,5},{201033,0,1,5},{201035,0,1,1},{201036,0,1,5},{201037,0,1,1},{201039,0,1,1},{202010,0,1,40},{202011,0,1,40},{202012,0,1,40},{202013,0,1,40},{202015,0,1,40},{202016,0,1,40},{202017,0,1,40},{202019,0,1,40},{202020,0,1,1},{202021,0,1,3},{202022,0,1,10},{202023,0,1,10},{202025,0,1,3},{202026,0,1,10},{202027,0,1,3},{202029,0,1,3}, | AT67: 202029 | AU67: 天尊鞋子 | AV67: 1 | AW67: 0 | AX67: 1 | AY67: 3 | AZ67: ="{"&RC[-6]&","&RC[-3]&","&RC[-2]&","&RC[-1]&"}," -> {202029,0,1,3}, | BA67: =RC[-1] -> {202029,0,1,3}, | BC67: 202029 | BD67: 天尊鞋子 | BE67: 1 | BF67: 0 | BG67: 1 | BH67: 3 | BI67: ="{"&RC[-6]&","&RC[-3]&","&RC[-2]&","&RC[-1]&"}," -> {202029,0,1,3}, | BJ67: =RC[-1] -> {202029,0,1,3},
X68: 3 | Y68: 100 | Z68: ="{0,[{"&RC[-2]&","&RC[-1]&"}],["&R[-26]C&"]}" -> {0,[{3,100}],[{200000,0,1,30},{200001,0,1,30},{200002,0,1,30},{200003,0,1,30},{200006,0,1,30},{200010,0,1,5},{200011,0,1,10},{200012,0,1,10},{200013,0,1,10},{200015,0,1,10},{200016,0,1,10},{200017,0,1,10},{200019,0,1,10},{201000,0,1,30},{201001,0,1,30},{201002,0,1,30},{201003,0,1,30},{201006,0,1,30},{201010,0,1,5},{201011,0,1,10},{201012,0,1,10},{201013,0,1,10},{201015,0,1,10},{201016,0,1,10},{201017,0,1,10},{201019,0,1,10},{202000,0,1,30},{202001,0,1,30},{202002,0,1,30},{202003,0,1,30},{202006,0,1,30},{202010,0,1,5},{202011,0,1,10},{202012,0,1,10},{202013,0,1,10},{202015,0,1,10},{202016,0,1,10},{202017,0,1,10},{202019,0,1,10}]} | AG68: 3 | AH68: 100 | AI68: ="{0,[{"&RC[-2]&","&RC[-1]&"}],["&R[-26]C&"]}" -> {0,[{3,100}],[{200000,0,1,30},{200001,0,1,30},{200002,0,1,30},{200003,0,1,30},{200006,0,1,30},{200010,0,1,5},{200011,0,1,10},{200012,0,1,10},{200013,0,1,10},{200015,0,1,10},{200016,0,1,10},{200017,0,1,10},{200019,0,1,10},{201000,0,1,30},{201001,0,1,30},{201002,0,1,30},{201003,0,1,30},{201006,0,1,30},{201010,0,1,5},{201011,0,1,10},{201012,0,1,10},{201013,0,1,10},{201015,0,1,10},{201016,0,1,10},{201017,0,1,10},{201019,0,1,10},{202000,0,1,30},{202001,0,1,30},{202002,0,1,30},{202003,0,1,30},{202006,0,1,30},{202010,0,1,5},{202011,0,1,10},{202012,0,1,10},{202013,0,1,10},{202015,0,1,10},{202016,0,1,10},{202017,0,1,10},{202019,0,1,10}]} | AK68: 202030 | AL68: 玄天 | AM68: 1 | AN68: 0 | AO68: 1 | AP68: 1 | AQ68: ="{"&RC[-6]&","&RC[-3]&","&RC[-2]&","&RC[-1]&"}," -> {202030,0,1,1}, | AR68: =R[-1]C&RC[-1] -> {200010,0,1,40},{200011,0,1,40},{200012,0,1,40},{200013,0,1,40},{200015,0,1,40},{200016,0,1,40},{200017,0,1,40},{200019,0,1,40},{200020,0,1,1},{200021,0,1,3},{200022,0,1,10},{200023,0,1,10},{200025,0,1,3},{200026,0,1,10},{200027,0,1,3},{200029,0,1,3},{200030,0,1,1},{200031,0,1,1},{200032,0,1,5},{200033,0,1,5},{200035,0,1,1},{200036,0,1,5},{200037,0,1,1},{200039,0,1,1},{201010,0,1,40},{201011,0,1,40},{201012,0,1,40},{201013,0,1,40},{201015,0,1,40},{201016,0,1,40},{201017,0,1,40},{201019,0,1,40},{201020,0,1,1},{201021,0,1,3},{201022,0,1,10},{201023,0,1,10},{201025,0,1,3},{201026,0,1,10},{201027,0,1,3},{201029,0,1,3},{201030,0,1,1},{201031,0,1,1},{201032,0,1,5},{201033,0,1,5},{201035,0,1,1},{201036,0,1,5},{201037,0,1,1},{201039,0,1,1},{202010,0,1,40},{202011,0,1,40},{202012,0,1,40},{202013,0,1,40},{202015,0,1,40},{202016,0,1,40},{202017,0,1,40},{202019,0,1,40},{202020,0,1,1},{202021,0,1,3},{202022,0,1,10},{202023,0,1,10},{202025,0,1,3},{202026,0,1,10},{202027,0,1,3},{202029,0,1,3},{202030,0,1,1}, | AT68: 202030 | AU68: 玄天 | AV68: 1 | AW68: 0 | AX68: 1 | AY68: 1 | AZ68: ="{"&RC[-6]&","&RC[-3]&","&RC[-2]&","&RC[-1]&"}," -> {202030,0,1,1}, | BA68: =RC[-1] -> {202030,0,1,1}, | BC68: 202030 | BD68: 玄天 | BE68: 1 | BF68: 0 | BG68: 1 | BH68: 1 | BI68: ="{"&RC[-6]&","&RC[-3]&","&RC[-2]&","&RC[-1]&"}," -> {202030,0,1,1}, | BJ68: =RC[-1] -> {202030,0,1,1},
X69: 道具 | Y69: 概率／100 | AG69: 道具 | AH69: 概率／100 | AK69: 202031 | AL69: 光芒道袍 | AM69: 1 | AN69: 0 | AO69: 1 | AP69: 1 | AQ69: ="{"&RC[-6]&","&RC[-3]&","&RC[-2]&","&RC[-1]&"}," -> {202031,0,1,1}, | AR69: =R[-1]C&RC[-1] -> {200010,0,1,40},{200011,0,1,40},{200012,0,1,40},{200013,0,1,40},{200015,0,1,40},{200016,0,1,40},{200017,0,1,40},{200019,0,1,40},{200020,0,1,1},{200021,0,1,3},{200022,0,1,10},{200023,0,1,10},{200025,0,1,3},{200026,0,1,10},{200027,0,1,3},{200029,0,1,3},{200030,0,1,1},{200031,0,1,1},{200032,0,1,5},{200033,0,1,5},{200035,0,1,1},{200036,0,1,5},{200037,0,1,1},{200039,0,1,1},{201010,0,1,40},{201011,0,1,40},{201012,0,1,40},{201013,0,1,40},{201015,0,1,40},{201016,0,1,40},{201017,0,1,40},{201019,0,1,40},{201020,0,1,1},{201021,0,1,3},{201022,0,1,10},{201023,0,1,10},{201025,0,1,3},{201026,0,1,10},{201027,0,1,3},{201029,0,1,3},{201030,0,1,1},{201031,0,1,1},{201032,0,1,5},{201033,0,1,5},{201035,0,1,1},{201036,0,1,5},{201037,0,1,1},{201039,0,1,1},{202010,0,1,40},{202011,0,1,40},{202012,0,1,40},{202013,0,1,40},{202015,0,1,40},{202016,0,1,40},{202017,0,1,40},{202019,0,1,40},{202020,0,1,1},{202021,0,1,3},{202022,0,1,10},{202023,0,1,10},{202025,0,1,3},{202026,0,1,10},{202027,0,1,3},{202029,0,1,3},{202030,0,1,1},{202031,0,1,1}, | AT69: 202031 | AU69: 光芒道袍 | AV69: 1 | AW69: 0 | AX69: 1 | AY69: 1 | AZ69: ="{"&RC[-6]&","&RC[-3]&","&RC[-2]&","&RC[-1]&"}," -> {202031,0,1,1}, | BA69: =RC[-1] -> {202031,0,1,1}, | BC69: 202031 | BD69: 光芒道袍 | BE69: 1 | BF69: 0 | BG69: 1 | BH69: 1 | BI69: ="{"&RC[-6]&","&RC[-3]&","&RC[-2]&","&RC[-1]&"}," -> {202031,0,1,1}, | BJ69: =RC[-1] -> {202031,0,1,1},
X70: 2 | Y70: 100 | Z70: ="{0,[{"&RC[-2]&","&RC[-1]&"}],["&R[-6]C&"]}" -> {0,[{2,100}],[{110086,0,2,1},{110003,0,2,2},{110004,0,1,3},{110005,0,1,3},{110013,0,1,3},{110014,0,1,3},{110015,0,1,3}]} | AG70: 2 | AH70: 100 | AI70: ="{0,[{"&RC[-2]&","&RC[-1]&"}],["&R[-6]C&"]}" -> {0,[{2,100}],[{110093,0,2,2},{110003,0,2,2},{110004,0,1,3},{110005,0,1,3},{110013,0,1,3},{110014,0,1,3},{110015,0,1,3}]} | AK70: 202032 | AL70: 光芒道链 | AM70: 1 | AN70: 0 | AO70: 1 | AP70: 5 | AQ70: ="{"&RC[-6]&","&RC[-3]&","&RC[-2]&","&RC[-1]&"}," -> {202032,0,1,5}, | AR70: =R[-1]C&RC[-1] -> {200010,0,1,40},{200011,0,1,40},{200012,0,1,40},{200013,0,1,40},{200015,0,1,40},{200016,0,1,40},{200017,0,1,40},{200019,0,1,40},{200020,0,1,1},{200021,0,1,3},{200022,0,1,10},{200023,0,1,10},{200025,0,1,3},{200026,0,1,10},{200027,0,1,3},{200029,0,1,3},{200030,0,1,1},{200031,0,1,1},{200032,0,1,5},{200033,0,1,5},{200035,0,1,1},{200036,0,1,5},{200037,0,1,1},{200039,0,1,1},{201010,0,1,40},{201011,0,1,40},{201012,0,1,40},{201013,0,1,40},{201015,0,1,40},{201016,0,1,40},{201017,0,1,40},{201019,0,1,40},{201020,0,1,1},{201021,0,1,3},{201022,0,1,10},{201023,0,1,10},{201025,0,1,3},{201026,0,1,10},{201027,0,1,3},{201029,0,1,3},{201030,0,1,1},{201031,0,1,1},{201032,0,1,5},{201033,0,1,5},{201035,0,1,1},{201036,0,1,5},{201037,0,1,1},{201039,0,1,1},{202010,0,1,40},{202011,0,1,40},{202012,0,1,40},{202013,0,1,40},{202015,0,1,40},{202016,0,1,40},{202017,0,1,40},{202019,0,1,40},{202020,0,1,1},{202021,0,1,3},{202022,0,1,10},{202023,0,1,10},{202025,0,1,3},{202026,0,1,10},{202027,0,1,3},{202029,0,1,3},{202030,0,1,1},{202031,0,1,1},{202032,0,1,5}, | AT70: 202032 | AU70: 光芒道链 | AV70: 1 | AW70: 0 | AX70: 1 | AY70: 5 | AZ70: ="{"&RC[-6]&","&RC[-3]&","&RC[-2]&","&RC[-1]&"}," -> {202032,0,1,5}, | BA70: =RC[-1] -> {202032,0,1,5}, | BC70: 202032 | BD70: 光芒道链 | BE70: 1 | BF70: 0 | BG70: 1 | BH70: 5 | BI70: ="{"&RC[-6]&","&RC[-3]&","&RC[-2]&","&RC[-1]&"}," -> {202032,0,1,5}, | BJ70: =RC[-1] -> {202032,0,1,5},
X71: 金币 | Y71: 概率／100 | AG71: 金币 | AH71: 概率／100 | AK71: 202033 | AL71: 光芒道戒 | AM71: 1 | AN71: 0 | AO71: 1 | AP71: 5 | AQ71: ="{"&RC[-6]&","&RC[-3]&","&RC[-2]&","&RC[-1]&"}," -> {202033,0,1,5}, | AR71: =R[-1]C&RC[-1] -> {200010,0,1,40},{200011,0,1,40},{200012,0,1,40},{200013,0,1,40},{200015,0,1,40},{200016,0,1,40},{200017,0,1,40},{200019,0,1,40},{200020,0,1,1},{200021,0,1,3},{200022,0,1,10},{200023,0,1,10},{200025,0,1,3},{200026,0,1,10},{200027,0,1,3},{200029,0,1,3},{200030,0,1,1},{200031,0,1,1},{200032,0,1,5},{200033,0,1,5},{200035,0,1,1},{200036,0,1,5},{200037,0,1,1},{200039,0,1,1},{201010,0,1,40},{201011,0,1,40},{201012,0,1,40},{201013,0,1,40},{201015,0,1,40},{201016,0,1,40},{201017,0,1,40},{201019,0,1,40},{201020,0,1,1},{201021,0,1,3},{201022,0,1,10},{201023,0,1,10},{201025,0,1,3},{201026,0,1,10},{201027,0,1,3},{201029,0,1,3},{201030,0,1,1},{201031,0,1,1},{201032,0,1,5},{201033,0,1,5},{201035,0,1,1},{201036,0,1,5},{201037,0,1,1},{201039,0,1,1},{202010,0,1,40},{202011,0,1,40},{202012,0,1,40},{202013,0,1,40},{202015,0,1,40},{202016,0,1,40},{202017,0,1,40},{202019,0,1,40},{202020,0,1,1},{202021,0,1,3},{202022,0,1,10},{202023,0,1,10},{202025,0,1,3},{202026,0,1,10},{202027,0,1,3},{202029,0,1,3},{202030,0,1,1},{202031,0,1,1},{202032,0,1,5},{202033,0,1,5}, | AT71: 202033 | AU71: 光芒道戒 | AV71: 1 | AW71: 0 | AX71: 1 | AY71: 5 | AZ71: ="{"&RC[-6]&","&RC[-3]&","&RC[-2]&","&RC[-1]&"}," -> {202033,0,1,5}, | BA71: =RC[-1] -> {202033,0,1,5}, | BC71: 202033 | BD71: 光芒道戒 | BE71: 1 | BF71: 0 | BG71: 1 | BH71: 5 | BI71: ="{"&RC[-6]&","&RC[-3]&","&RC[-2]&","&RC[-1]&"}," -> {202033,0,1,5}, | BJ71: =RC[-1] -> {202033,0,1,5},
X72: 3 | Y72: 100 | Z72: {0,[{10,100}],[{110009,1,1000,1}]} | AG72: 3 | AH72: 100 | AI72: {0,[{10,100}],[{110009,1,1000,1}]} | AK72: 202035 | AL72: 光芒头盔 | AM72: 1 | AN72: 0 | AO72: 1 | AP72: 1 | AQ72: ="{"&RC[-6]&","&RC[-3]&","&RC[-2]&","&RC[-1]&"}," -> {202035,0,1,1}, | AR72: =R[-1]C&RC[-1] -> {200010,0,1,40},{200011,0,1,40},{200012,0,1,40},{200013,0,1,40},{200015,0,1,40},{200016,0,1,40},{200017,0,1,40},{200019,0,1,40},{200020,0,1,1},{200021,0,1,3},{200022,0,1,10},{200023,0,1,10},{200025,0,1,3},{200026,0,1,10},{200027,0,1,3},{200029,0,1,3},{200030,0,1,1},{200031,0,1,1},{200032,0,1,5},{200033,0,1,5},{200035,0,1,1},{200036,0,1,5},{200037,0,1,1},{200039,0,1,1},{201010,0,1,40},{201011,0,1,40},{201012,0,1,40},{201013,0,1,40},{201015,0,1,40},{201016,0,1,40},{201017,0,1,40},{201019,0,1,40},{201020,0,1,1},{201021,0,1,3},{201022,0,1,10},{201023,0,1,10},{201025,0,1,3},{201026,0,1,10},{201027,0,1,3},{201029,0,1,3},{201030,0,1,1},{201031,0,1,1},{201032,0,1,5},{201033,0,1,5},{201035,0,1,1},{201036,0,1,5},{201037,0,1,1},{201039,0,1,1},{202010,0,1,40},{202011,0,1,40},{202012,0,1,40},{202013,0,1,40},{202015,0,1,40},{202016,0,1,40},{202017,0,1,40},{202019,0,1,40},{202020,0,1,1},{202021,0,1,3},{202022,0,1,10},{202023,0,1,10},{202025,0,1,3},{202026,0,1,10},{202027,0,1,3},{202029,0,1,3},{202030,0,1,1},{202031,0,1,1},{202032,0,1,5},{202033,0,1,5},{202035,0,1,1}, | AT72: 202035 | AU72: 光芒头盔 | AV72: 1 | AW72: 0 | AX72: 1 | AY72: 1 | AZ72: ="{"&RC[-6]&","&RC[-3]&","&RC[-2]&","&RC[-1]&"}," -> {202035,0,1,1}, | BA72: =RC[-1] -> {202035,0,1,1}, | BC72: 202035 | BD72: 光芒头盔 | BE72: 1 | BF72: 0 | BG72: 1 | BH72: 1 | BI72: ="{"&RC[-6]&","&RC[-3]&","&RC[-2]&","&RC[-1]&"}," -> {202035,0,1,1}, | BJ72: =RC[-1] -> {202035,0,1,1},
X73: 技能书 | Y73: 概率／100 | AG73: 技能书 | AH73: 概率／100 | AK73: 202036 | AL73: 光芒护腕 | AM73: 1 | AN73: 0 | AO73: 1 | AP73: 5 | AQ73: ="{"&RC[-6]&","&RC[-3]&","&RC[-2]&","&RC[-1]&"}," -> {202036,0,1,5}, | AR73: =R[-1]C&RC[-1] -> {200010,0,1,40},{200011,0,1,40},{200012,0,1,40},{200013,0,1,40},{200015,0,1,40},{200016,0,1,40},{200017,0,1,40},{200019,0,1,40},{200020,0,1,1},{200021,0,1,3},{200022,0,1,10},{200023,0,1,10},{200025,0,1,3},{200026,0,1,10},{200027,0,1,3},{200029,0,1,3},{200030,0,1,1},{200031,0,1,1},{200032,0,1,5},{200033,0,1,5},{200035,0,1,1},{200036,0,1,5},{200037,0,1,1},{200039,0,1,1},{201010,0,1,40},{201011,0,1,40},{201012,0,1,40},{201013,0,1,40},{201015,0,1,40},{201016,0,1,40},{201017,0,1,40},{201019,0,1,40},{201020,0,1,1},{201021,0,1,3},{201022,0,1,10},{201023,0,1,10},{201025,0,1,3},{201026,0,1,10},{201027,0,1,3},{201029,0,1,3},{201030,0,1,1},{201031,0,1,1},{201032,0,1,5},{201033,0,1,5},{201035,0,1,1},{201036,0,1,5},{201037,0,1,1},{201039,0,1,1},{202010,0,1,40},{202011,0,1,40},{202012,0,1,40},{202013,0,1,40},{202015,0,1,40},{202016,0,1,40},{202017,0,1,40},{202019,0,1,40},{202020,0,1,1},{202021,0,1,3},{202022,0,1,10},{202023,0,1,10},{202025,0,1,3},{202026,0,1,10},{202027,0,1,3},{202029,0,1,3},{202030,0,1,1},{202031,0,1,1},{202032,0,1,5},{202033,0,1,5},{202035,0,1,1},{202036,0,1,5}, | AT73: 202036 | AU73: 光芒护腕 | AV73: 1 | AW73: 0 | AX73: 1 | AY73: 5 | AZ73: ="{"&RC[-6]&","&RC[-3]&","&RC[-2]&","&RC[-1]&"}," -> {202036,0,1,5}, | BA73: =RC[-1] -> {202036,0,1,5}, | BC73: 202036 | BD73: 光芒护腕 | BE73: 1 | BF73: 0 | BG73: 1 | BH73: 5 | BI73: ="{"&RC[-6]&","&RC[-3]&","&RC[-2]&","&RC[-1]&"}," -> {202036,0,1,5}, | BJ73: =RC[-1] -> {202036,0,1,5},
X74: 1 | Y74: 100 | Z74: ="{0,[{"&RC[-2]&","&RC[-1]&"}],["&R[-18]C&"]}" -> {0,[{1,100}],[{110023,0,1,1},{110024,0,1,1},{110025,0,1,1},{110026,0,1,1},{110030,0,1,1},{110031,0,1,1},{110032,0,1,1},{110033,0,1,1},{110038,0,1,1},{110039,0,1,1},{110040,0,1,1},{110067,0,1,1}]} | AG74: 1 | AH74: 100 | AI74: ="{0,[{"&RC[-2]&","&RC[-1]&"}],["&R[-18]C&"]}" -> {0,[{1,100}],[{110023,0,1,2},{110024,0,1,2},{110025,0,1,2},{110026,0,1,2},{110030,0,1,2},{110031,0,1,2},{110032,0,1,2},{110033,0,1,2},{110038,0,1,2},{110039,0,1,2},{110040,0,1,2},{110067,0,1,2}]} | AK74: 202037 | AL74: 光芒腰带 | AM74: 1 | AN74: 0 | AO74: 1 | AP74: 1 | AQ74: ="{"&RC[-6]&","&RC[-3]&","&RC[-2]&","&RC[-1]&"}," -> {202037,0,1,1}, | AR74: =R[-1]C&RC[-1] -> {200010,0,1,40},{200011,0,1,40},{200012,0,1,40},{200013,0,1,40},{200015,0,1,40},{200016,0,1,40},{200017,0,1,40},{200019,0,1,40},{200020,0,1,1},{200021,0,1,3},{200022,0,1,10},{200023,0,1,10},{200025,0,1,3},{200026,0,1,10},{200027,0,1,3},{200029,0,1,3},{200030,0,1,1},{200031,0,1,1},{200032,0,1,5},{200033,0,1,5},{200035,0,1,1},{200036,0,1,5},{200037,0,1,1},{200039,0,1,1},{201010,0,1,40},{201011,0,1,40},{201012,0,1,40},{201013,0,1,40},{201015,0,1,40},{201016,0,1,40},{201017,0,1,40},{201019,0,1,40},{201020,0,1,1},{201021,0,1,3},{201022,0,1,10},{201023,0,1,10},{201025,0,1,3},{201026,0,1,10},{201027,0,1,3},{201029,0,1,3},{201030,0,1,1},{201031,0,1,1},{201032,0,1,5},{201033,0,1,5},{201035,0,1,1},{201036,0,1,5},{201037,0,1,1},{201039,0,1,1},{202010,0,1,40},{202011,0,1,40},{202012,0,1,40},{202013,0,1,40},{202015,0,1,40},{202016,0,1,40},{202017,0,1,40},{202019,0,1,40},{202020,0,1,1},{202021,0,1,3},{202022,0,1,10},{202023,0,1,10},{202025,0,1,3},{202026,0,1,10},{202027,0,1,3},{202029,0,1,3},{202030,0,1,1},{202031,0,1,1},{202032,0,1,5},{202033,0,1,5},{202035,0,1,1},{202036,0,1,5},{202037,0,1,1}, | AT74: 202037 | AU74: 光芒腰带 | AV74: 1 | AW74: 0 | AX74: 1 | AY74: 1 | AZ74: ="{"&RC[-6]&","&RC[-3]&","&RC[-2]&","&RC[-1]&"}," -> {202037,0,1,1}, | BA74: =RC[-1] -> {202037,0,1,1}, | BC74: 202037 | BD74: 光芒腰带 | BE74: 1 | BF74: 0 | BG74: 1 | BH74: 1 | BI74: ="{"&RC[-6]&","&RC[-3]&","&RC[-2]&","&RC[-1]&"}," -> {202037,0,1,1}, | BJ74: =RC[-1] -> {202037,0,1,1},
AK75: 202039 | AL75: 光芒道靴 | AM75: 1 | AN75: 0 | AO75: 1 | AP75: 1 | AQ75: ="{"&RC[-6]&","&RC[-3]&","&RC[-2]&","&RC[-1]&"}," -> {202039,0,1,1}, | AR75: =R[-1]C&RC[-1] -> {200010,0,1,40},{200011,0,1,40},{200012,0,1,40},{200013,0,1,40},{200015,0,1,40},{200016,0,1,40},{200017,0,1,40},{200019,0,1,40},{200020,0,1,1},{200021,0,1,3},{200022,0,1,10},{200023,0,1,10},{200025,0,1,3},{200026,0,1,10},{200027,0,1,3},{200029,0,1,3},{200030,0,1,1},{200031,0,1,1},{200032,0,1,5},{200033,0,1,5},{200035,0,1,1},{200036,0,1,5},{200037,0,1,1},{200039,0,1,1},{201010,0,1,40},{201011,0,1,40},{201012,0,1,40},{201013,0,1,40},{201015,0,1,40},{201016,0,1,40},{201017,0,1,40},{201019,0,1,40},{201020,0,1,1},{201021,0,1,3},{201022,0,1,10},{201023,0,1,10},{201025,0,1,3},{201026,0,1,10},{201027,0,1,3},{201029,0,1,3},{201030,0,1,1},{201031,0,1,1},{201032,0,1,5},{201033,0,1,5},{201035,0,1,1},{201036,0,1,5},{201037,0,1,1},{201039,0,1,1},{202010,0,1,40},{202011,0,1,40},{202012,0,1,40},{202013,0,1,40},{202015,0,1,40},{202016,0,1,40},{202017,0,1,40},{202019,0,1,40},{202020,0,1,1},{202021,0,1,3},{202022,0,1,10},{202023,0,1,10},{202025,0,1,3},{202026,0,1,10},{202027,0,1,3},{202029,0,1,3},{202030,0,1,1},{202031,0,1,1},{202032,0,1,5},{202033,0,1,5},{202035,0,1,1},{202036,0,1,5},{202037,0,1,1},{202039,0,1,1}, | AT75: 202039 | AU75: 光芒道靴 | AV75: 1 | AW75: 0 | AX75: 1 | AY75: 1 | AZ75: ="{"&RC[-6]&","&RC[-3]&","&RC[-2]&","&RC[-1]&"}," -> {202039,0,1,1}, | BA75: =RC[-1] -> {202039,0,1,1}, | BC75: 202039 | BD75: 光芒道靴 | BE75: 1 | BF75: 0 | BG75: 1 | BH75: 1 | BI75: ="{"&RC[-6]&","&RC[-3]&","&RC[-2]&","&RC[-1]&"}," -> {202039,0,1,1}, | BJ75: =RC[-1] -> {202039,0,1,1},
Z76: ="["&R[-8]C&","&R[-6]C&","&R[-4]C&","&R[-2]C&"]" -> [{0,[{3,100}],[{200000,0,1,30},{200001,0,1,30},{200002,0,1,30},{200003,0,1,30},{200006,0,1,30},{200010,0,1,5},{200011,0,1,10},{200012,0,1,10},{200013,0,1,10},{200015,0,1,10},{200016,0,1,10},{200017,0,1,10},{200019,0,1,10},{201000,0,1,30},{201001,0,1,30},{201002,0,1,30},{201003,0,1,30},{201006,0,1,30},{201010,0,1,5},{201011,0,1,10},{201012,0,1,10},{201013,0,1,10},{201015,0,1,10},{201016,0,1,10},{201017,0,1,10},{201019,0,1,10},{202000,0,1,30},{202001,0,1,30},{202002,0,1,30},{202003,0,1,30},{202006,0,1,30},{202010,0,1,5},{202011,0,1,10},{202012,0,1,10},{202013,0,1,10},{202015,0,1,10},{202016,0,1,10},{202017,0,1,10},{202019,0,1,10}]},{0,[{2,100}],[{110086,0,2,1},{110003,0,2,2},{110004,0,1,3},{110005,0,1,3},{110013,0,1,3},{110014,0,1,3},{110015,0,1,3}]},{0,[{10,100}],[{110009,1,1000,1}]},{0,[{1,100}],[{110023,0,1,1},{110024,0,1,1},{110025,0,1,1},{110026,0,1,1},{110030,0,1,1},{110031,0,1,1},{110032,0,1,1},{110033,0,1,1},{110038,0,1,1},{110039,0,1,1},{110040,0,1,1},{110067,0,1,1}]}] | AI76: ="["&R[-8]C&","&R[-6]C&","&R[-4]C&","&R[-2]C&"]" -> [{0,[{3,100}],[{200000,0,1,30},{200001,0,1,30},{200002,0,1,30},{200003,0,1,30},{200006,0,1,30},{200010,0,1,5},{200011,0,1,10},{200012,0,1,10},{200013,0,1,10},{200015,0,1,10},{200016,0,1,10},{200017,0,1,10},{200019,0,1,10},{201000,0,1,30},{201001,0,1,30},{201002,0,1,30},{201003,0,1,30},{201006,0,1,30},{201010,0,1,5},{201011,0,1,10},{201012,0,1,10},{201013,0,1,10},{201015,0,1,10},{201016,0,1,10},{201017,0,1,10},{201019,0,1,10},{202000,0,1,30},{202001,0,1,30},{202002,0,1,30},{202003,0,1,30},{202006,0,1,30},{202010,0,1,5},{202011,0,1,10},{202012,0,1,10},{202013,0,1,10},{202015,0,1,10},{202016,0,1,10},{202017,0,1,10},{202019,0,1,10}]},{0,[{2,100}],[{110093,0,2,2},{110003,0,2,2},{110004,0,1,3},{110005,0,1,3},{110013,0,1,3},{110014,0,1,3},{110015,0,1,3}]},{0,[{10,100}],[{110009,1,1000,1}]},{0,[{1,100}],[{110023,0,1,2},{110024,0,1,2},{110025,0,1,2},{110026,0,1,2},{110030,0,1,2},{110031,0,1,2},{110032,0,1,2},{110033,0,1,2},{110038,0,1,2},{110039,0,1,2},{110040,0,1,2},{110067,0,1,2}]}] | AK76: 305003 | AL76: 怒斩 | AM76: 1 | AN76: 0 | AO76: 1 | AP76: 2 | AQ76: ="{"&RC[-6]&","&RC[-3]&","&RC[-2]&","&RC[-1]&"}," -> {305003,0,1,2}, | AR76: =R[-1]C&RC[-1] -> {200010,0,1,40},{200011,0,1,40},{200012,0,1,40},{200013,0,1,40},{200015,0,1,40},{200016,0,1,40},{200017,0,1,40},{200019,0,1,40},{200020,0,1,1},{200021,0,1,3},{200022,0,1,10},{200023,0,1,10},{200025,0,1,3},{200026,0,1,10},{200027,0,1,3},{200029,0,1,3},{200030,0,1,1},{200031,0,1,1},{200032,0,1,5},{200033,0,1,5},{200035,0,1,1},{200036,0,1,5},{200037,0,1,1},{200039,0,1,1},{201010,0,1,40},{201011,0,1,40},{201012,0,1,40},{201013,0,1,40},{201015,0,1,40},{201016,0,1,40},{201017,0,1,40},{201019,0,1,40},{201020,0,1,1},{201021,0,1,3},{201022,0,1,10},{201023,0,1,10},{201025,0,1,3},{201026,0,1,10},{201027,0,1,3},{201029,0,1,3},{201030,0,1,1},{201031,0,1,1},{201032,0,1,5},{201033,0,1,5},{201035,0,1,1},{201036,0,1,5},{201037,0,1,1},{201039,0,1,1},{202010,0,1,40},{202011,0,1,40},{202012,0,1,40},{202013,0,1,40},{202015,0,1,40},{202016,0,1,40},{202017,0,1,40},{202019,0,1,40},{202020,0,1,1},{202021,0,1,3},{202022,0,1,10},{202023,0,1,10},{202025,0,1,3},{202026,0,1,10},{202027,0,1,3},{202029,0,1,3},{202030,0,1,1},{202031,0,1,1},{202032,0,1,5},{202033,0,1,5},{202035,0,1,1},{202036,0,1,5},{202037,0,1,1},{202039,0,1,1},{305003,0,1,2}, | AT76: 305003 | AU76: 怒斩 | AV76: 1 | AW76: 0 | AX76: 1 | AY76: 5 | AZ76: ="{"&RC[-6]&","&RC[-3]&","&RC[-2]&","&RC[-1]&"}," -> {305003,0,1,5}, | BA76: =RC[-1] -> {305003,0,1,5}, | BC76: 305003 | BD76: 怒斩 | BE76: 1 | BF76: 0 | BG76: 1 | BH76: 10 | BI76: ="{"&RC[-6]&","&RC[-3]&","&RC[-2]&","&RC[-1]&"}," -> {305003,0,1,10}, | BJ76: =RC[-1] -> {305003,0,1,10},
AK77: 305004 | AL77: 龙牙 | AM77: 1 | AN77: 0 | AO77: 1 | AP77: 2 | AQ77: ="{"&RC[-6]&","&RC[-3]&","&RC[-2]&","&RC[-1]&"}," -> {305004,0,1,2}, | AR77: =R[-1]C&RC[-1] -> {200010,0,1,40},{200011,0,1,40},{200012,0,1,40},{200013,0,1,40},{200015,0,1,40},{200016,0,1,40},{200017,0,1,40},{200019,0,1,40},{200020,0,1,1},{200021,0,1,3},{200022,0,1,10},{200023,0,1,10},{200025,0,1,3},{200026,0,1,10},{200027,0,1,3},{200029,0,1,3},{200030,0,1,1},{200031,0,1,1},{200032,0,1,5},{200033,0,1,5},{200035,0,1,1},{200036,0,1,5},{200037,0,1,1},{200039,0,1,1},{201010,0,1,40},{201011,0,1,40},{201012,0,1,40},{201013,0,1,40},{201015,0,1,40},{201016,0,1,40},{201017,0,1,40},{201019,0,1,40},{201020,0,1,1},{201021,0,1,3},{201022,0,1,10},{201023,0,1,10},{201025,0,1,3},{201026,0,1,10},{201027,0,1,3},{201029,0,1,3},{201030,0,1,1},{201031,0,1,1},{201032,0,1,5},{201033,0,1,5},{201035,0,1,1},{201036,0,1,5},{201037,0,1,1},{201039,0,1,1},{202010,0,1,40},{202011,0,1,40},{202012,0,1,40},{202013,0,1,40},{202015,0,1,40},{202016,0,1,40},{202017,0,1,40},{202019,0,1,40},{202020,0,1,1},{202021,0,1,3},{202022,0,1,10},{202023,0,1,10},{202025,0,1,3},{202026,0,1,10},{202027,0,1,3},{202029,0,1,3},{202030,0,1,1},{202031,0,1,1},{202032,0,1,5},{202033,0,1,5},{202035,0,1,1},{202036,0,1,5},{202037,0,1,1},{202039,0,1,1},{305003,0,1,2},{305004,0,1,2}, | AT77: 305004 | AU77: 龙牙 | AV77: 1 | AW77: 0 | AX77: 1 | AY77: 5 | AZ77: ="{"&RC[-6]&","&RC[-3]&","&RC[-2]&","&RC[-1]&"}," -> {305004,0,1,5}, | BA77: =RC[-1] -> {305004,0,1,5}, | BC77: 305004 | BD77: 龙牙 | BE77: 1 | BF77: 0 | BG77: 1 | BH77: 10 | BI77: ="{"&RC[-6]&","&RC[-3]&","&RC[-2]&","&RC[-1]&"}," -> {305004,0,1,10}, | BJ77: =RC[-1] -> {305004,0,1,10},
AK78: 305005 | AL78: 逍遥扇 | AM78: 1 | AN78: 0 | AO78: 1 | AP78: 2 | AQ78: ="{"&RC[-6]&","&RC[-3]&","&RC[-2]&","&RC[-1]&"}" -> {305005,0,1,2} | AR78: =R[-1]C&RC[-1] -> {200010,0,1,40},{200011,0,1,40},{200012,0,1,40},{200013,0,1,40},{200015,0,1,40},{200016,0,1,40},{200017,0,1,40},{200019,0,1,40},{200020,0,1,1},{200021,0,1,3},{200022,0,1,10},{200023,0,1,10},{200025,0,1,3},{200026,0,1,10},{200027,0,1,3},{200029,0,1,3},{200030,0,1,1},{200031,0,1,1},{200032,0,1,5},{200033,0,1,5},{200035,0,1,1},{200036,0,1,5},{200037,0,1,1},{200039,0,1,1},{201010,0,1,40},{201011,0,1,40},{201012,0,1,40},{201013,0,1,40},{201015,0,1,40},{201016,0,1,40},{201017,0,1,40},{201019,0,1,40},{201020,0,1,1},{201021,0,1,3},{201022,0,1,10},{201023,0,1,10},{201025,0,1,3},{201026,0,1,10},{201027,0,1,3},{201029,0,1,3},{201030,0,1,1},{201031,0,1,1},{201032,0,1,5},{201033,0,1,5},{201035,0,1,1},{201036,0,1,5},{201037,0,1,1},{201039,0,1,1},{202010,0,1,40},{202011,0,1,40},{202012,0,1,40},{202013,0,1,40},{202015,0,1,40},{202016,0,1,40},{202017,0,1,40},{202019,0,1,40},{202020,0,1,1},{202021,0,1,3},{202022,0,1,10},{202023,0,1,10},{202025,0,1,3},{202026,0,1,10},{202027,0,1,3},{202029,0,1,3},{202030,0,1,1},{202031,0,1,1},{202032,0,1,5},{202033,0,1,5},{202035,0,1,1},{202036,0,1,5},{202037,0,1,1},{202039,0,1,1},{305003,0,1,2},{305004,0,1,2},{305005,0,1,2} | AT78: 305005 | AU78: 逍遥扇 | AV78: 1 | AW78: 0 | AX78: 1 | AY78: 5 | AZ78: ="{"&RC[-6]&","&RC[-3]&","&RC[-2]&","&RC[-1]&"}" -> {305005,0,1,5} | BA78: =RC[-1] -> {305005,0,1,5} | BC78: 305005 | BD78: 逍遥扇 | BE78: 1 | BF78: 0 | BG78: 1 | BH78: 10 | BI78: ="{"&RC[-6]&","&RC[-3]&","&RC[-2]&","&RC[-1]&"}" -> {305005,0,1,10} | BJ78: =RC[-1] -> {305005,0,1,10}
AK81: 110025 | AL81: 逐日剑法书 | AM81: 1 | AN81: 0 | AO81: 1 | AP81: 2 | AQ81: ="{"&RC[-6]&","&RC[-3]&","&RC[-2]&","&RC[-1]&"}," -> {110025,0,1,2}, | AR81: =RC[-1] -> {110025,0,1,2}, | AT81: 110025 | AU81: 逐日剑法书 | AV81: 1 | AW81: 0 | AX81: 1 | AY81: 2 | AZ81: ="{"&RC[-6]&","&RC[-3]&","&RC[-2]&","&RC[-1]&"}," -> {110025,0,1,2}, | BA81: =RC[-1] -> {110025,0,1,2}, | BC81: 110025 | BD81: 逐日剑法书 | BE81: 1 | BF81: 0 | BG81: 1 | BH81: 2 | BI81: ="{"&RC[-6]&","&RC[-3]&","&RC[-2]&","&RC[-1]&"}," -> {110025,0,1,2}, | BJ81: =RC[-1] -> {110025,0,1,2},
AK82: 110040 | AL82: 流星火雨书 | AM82: 1 | AN82: 0 | AO82: 1 | AP82: 2 | AQ82: ="{"&RC[-6]&","&RC[-3]&","&RC[-2]&","&RC[-1]&"}," -> {110040,0,1,2}, | AR82: =R[-1]C&RC[-1] -> {110025,0,1,2},{110040,0,1,2}, | AT82: 110040 | AU82: 流星火雨书 | AV82: 1 | AW82: 0 | AX82: 1 | AY82: 2 | AZ82: ="{"&RC[-6]&","&RC[-3]&","&RC[-2]&","&RC[-1]&"}," -> {110040,0,1,2}, | BA82: =R[-1]C&RC[-1] -> {110025,0,1,2},{110040,0,1,2}, | BC82: 110040 | BD82: 流星火雨书 | BE82: 1 | BF82: 0 | BG82: 1 | BH82: 2 | BI82: ="{"&RC[-6]&","&RC[-3]&","&RC[-2]&","&RC[-1]&"}," -> {110040,0,1,2}, | BJ82: =R[-1]C&RC[-1] -> {110025,0,1,2},{110040,0,1,2},
AK83: 110032 | AL83: 嗜血术书 | AM83: 1 | AN83: 0 | AO83: 1 | AP83: 2 | AQ83: ="{"&RC[-6]&","&RC[-3]&","&RC[-2]&","&RC[-1]&"}," -> {110032,0,1,2}, | AR83: =R[-1]C&RC[-1] -> {110025,0,1,2},{110040,0,1,2},{110032,0,1,2}, | AT83: 110032 | AU83: 嗜血术书 | AV83: 1 | AW83: 0 | AX83: 1 | AY83: 2 | AZ83: ="{"&RC[-6]&","&RC[-3]&","&RC[-2]&","&RC[-1]&"}," -> {110032,0,1,2}, | BA83: =R[-1]C&RC[-1] -> {110025,0,1,2},{110040,0,1,2},{110032,0,1,2}, | BC83: 110032 | BD83: 嗜血术书 | BE83: 1 | BF83: 0 | BG83: 1 | BH83: 2 | BI83: ="{"&RC[-6]&","&RC[-3]&","&RC[-2]&","&RC[-1]&"}," -> {110032,0,1,2}, | BJ83: =R[-1]C&RC[-1] -> {110025,0,1,2},{110040,0,1,2},{110032,0,1,2},
AK84: 110023 | AL84: 烈火剑法书 | AM84: 1 | AN84: 0 | AO84: 1 | AP84: 10 | AQ84: ="{"&RC[-6]&","&RC[-3]&","&RC[-2]&","&RC[-1]&"}," -> {110023,0,1,10}, | AR84: =R[-1]C&RC[-1] -> {110025,0,1,2},{110040,0,1,2},{110032,0,1,2},{110023,0,1,10}, | AT84: 110023 | AU84: 烈火剑法书 | AV84: 1 | AW84: 0 | AX84: 1 | AY84: 10 | AZ84: ="{"&RC[-6]&","&RC[-3]&","&RC[-2]&","&RC[-1]&"}," -> {110023,0,1,10}, | BA84: =R[-1]C&RC[-1] -> {110025,0,1,2},{110040,0,1,2},{110032,0,1,2},{110023,0,1,10}, | BC84: 110023 | BD84: 烈火剑法书 | BE84: 1 | BF84: 0 | BG84: 1 | BH84: 10 | BI84: ="{"&RC[-6]&","&RC[-3]&","&RC[-2]&","&RC[-1]&"}," -> {110023,0,1,10}, | BJ84: =R[-1]C&RC[-1] -> {110025,0,1,2},{110040,0,1,2},{110032,0,1,2},{110023,0,1,10},
AK85: 110024 | AL85: 狂风斩书 | AM85: 1 | AN85: 0 | AO85: 1 | AP85: 10 | AQ85: ="{"&RC[-6]&","&RC[-3]&","&RC[-2]&","&RC[-1]&"}," -> {110024,0,1,10}, | AR85: =R[-1]C&RC[-1] -> {110025,0,1,2},{110040,0,1,2},{110032,0,1,2},{110023,0,1,10},{110024,0,1,10}, | AT85: 110024 | AU85: 狂风斩书 | AV85: 1 | AW85: 0 | AX85: 1 | AY85: 10 | AZ85: ="{"&RC[-6]&","&RC[-3]&","&RC[-2]&","&RC[-1]&"}," -> {110024,0,1,10}, | BA85: =R[-1]C&RC[-1] -> {110025,0,1,2},{110040,0,1,2},{110032,0,1,2},{110023,0,1,10},{110024,0,1,10}, | BC85: 110024 | BD85: 狂风斩书 | BE85: 1 | BF85: 0 | BG85: 1 | BH85: 10 | BI85: ="{"&RC[-6]&","&RC[-3]&","&RC[-2]&","&RC[-1]&"}," -> {110024,0,1,10}, | BJ85: =R[-1]C&RC[-1] -> {110025,0,1,2},{110040,0,1,2},{110032,0,1,2},{110023,0,1,10},{110024,0,1,10},
AK86: 110025 | AL86: 逐日剑法书 | AM86: 1 | AN86: 0 | AO86: 1 | AP86: 10 | AQ86: ="{"&RC[-6]&","&RC[-3]&","&RC[-2]&","&RC[-1]&"}," -> {110025,0,1,10}, | AR86: =R[-1]C&RC[-1] -> {110025,0,1,2},{110040,0,1,2},{110032,0,1,2},{110023,0,1,10},{110024,0,1,10},{110025,0,1,10}, | AT86: 110025 | AU86: 逐日剑法书 | AV86: 1 | AW86: 0 | AX86: 1 | AY86: 10 | AZ86: ="{"&RC[-6]&","&RC[-3]&","&RC[-2]&","&RC[-1]&"}," -> {110025,0,1,10}, | BA86: =R[-1]C&RC[-1] -> {110025,0,1,2},{110040,0,1,2},{110032,0,1,2},{110023,0,1,10},{110024,0,1,10},{110025,0,1,10}, | BC86: 110025 | BD86: 逐日剑法书 | BE86: 1 | BF86: 0 | BG86: 1 | BH86: 10 | BI86: ="{"&RC[-6]&","&RC[-3]&","&RC[-2]&","&RC[-1]&"}," -> {110025,0,1,10}, | BJ86: =R[-1]C&RC[-1] -> {110025,0,1,2},{110040,0,1,2},{110032,0,1,2},{110023,0,1,10},{110024,0,1,10},{110025,0,1,10},
AK87: 110026 | AL87: 灵魂火符书 | AM87: 1 | AN87: 0 | AO87: 1 | AP87: 10 | AQ87: ="{"&RC[-6]&","&RC[-3]&","&RC[-2]&","&RC[-1]&"}," -> {110026,0,1,10}, | AR87: =R[-1]C&RC[-1] -> {110025,0,1,2},{110040,0,1,2},{110032,0,1,2},{110023,0,1,10},{110024,0,1,10},{110025,0,1,10},{110026,0,1,10}, | AT87: 110026 | AU87: 灵魂火符书 | AV87: 1 | AW87: 0 | AX87: 1 | AY87: 10 | AZ87: ="{"&RC[-6]&","&RC[-3]&","&RC[-2]&","&RC[-1]&"}," -> {110026,0,1,10}, | BA87: =R[-1]C&RC[-1] -> {110025,0,1,2},{110040,0,1,2},{110032,0,1,2},{110023,0,1,10},{110024,0,1,10},{110025,0,1,10},{110026,0,1,10}, | BC87: 110026 | BD87: 灵魂火符书 | BE87: 1 | BF87: 0 | BG87: 1 | BH87: 10 | BI87: ="{"&RC[-6]&","&RC[-3]&","&RC[-2]&","&RC[-1]&"}," -> {110026,0,1,10}, | BJ87: =R[-1]C&RC[-1] -> {110025,0,1,2},{110040,0,1,2},{110032,0,1,2},{110023,0,1,10},{110024,0,1,10},{110025,0,1,10},{110026,0,1,10},
AK88: 110030 | AL88: 战甲术书 | AM88: 1 | AN88: 0 | AO88: 1 | AP88: 10 | AQ88: ="{"&RC[-6]&","&RC[-3]&","&RC[-2]&","&RC[-1]&"}," -> {110030,0,1,10}, | AR88: =R[-1]C&RC[-1] -> {110025,0,1,2},{110040,0,1,2},{110032,0,1,2},{110023,0,1,10},{110024,0,1,10},{110025,0,1,10},{110026,0,1,10},{110030,0,1,10}, | AT88: 110030 | AU88: 战甲术书 | AV88: 1 | AW88: 0 | AX88: 1 | AY88: 10 | AZ88: ="{"&RC[-6]&","&RC[-3]&","&RC[-2]&","&RC[-1]&"}," -> {110030,0,1,10}, | BA88: =R[-1]C&RC[-1] -> {110025,0,1,2},{110040,0,1,2},{110032,0,1,2},{110023,0,1,10},{110024,0,1,10},{110025,0,1,10},{110026,0,1,10},{110030,0,1,10}, | BC88: 110030 | BD88: 战甲术书 | BE88: 1 | BF88: 0 | BG88: 1 | BH88: 10 | BI88: ="{"&RC[-6]&","&RC[-3]&","&RC[-2]&","&RC[-1]&"}," -> {110030,0,1,10}, | BJ88: =R[-1]C&RC[-1] -> {110025,0,1,2},{110040,0,1,2},{110032,0,1,2},{110023,0,1,10},{110024,0,1,10},{110025,0,1,10},{110026,0,1,10},{110030,0,1,10},
AK89: 110031 | AL89: 召唤神兽书 | AM89: 1 | AN89: 0 | AO89: 1 | AP89: 10 | AQ89: ="{"&RC[-6]&","&RC[-3]&","&RC[-2]&","&RC[-1]&"}," -> {110031,0,1,10}, | AR89: =R[-1]C&RC[-1] -> {110025,0,1,2},{110040,0,1,2},{110032,0,1,2},{110023,0,1,10},{110024,0,1,10},{110025,0,1,10},{110026,0,1,10},{110030,0,1,10},{110031,0,1,10}, | AT89: 110031 | AU89: 召唤神兽书 | AV89: 1 | AW89: 0 | AX89: 1 | AY89: 10 | AZ89: ="{"&RC[-6]&","&RC[-3]&","&RC[-2]&","&RC[-1]&"}," -> {110031,0,1,10}, | BA89: =R[-1]C&RC[-1] -> {110025,0,1,2},{110040,0,1,2},{110032,0,1,2},{110023,0,1,10},{110024,0,1,10},{110025,0,1,10},{110026,0,1,10},{110030,0,1,10},{110031,0,1,10}, | BC89: 110031 | BD89: 召唤神兽书 | BE89: 1 | BF89: 0 | BG89: 1 | BH89: 10 | BI89: ="{"&RC[-6]&","&RC[-3]&","&RC[-2]&","&RC[-1]&"}," -> {110031,0,1,10}, | BJ89: =R[-1]C&RC[-1] -> {110025,0,1,2},{110040,0,1,2},{110032,0,1,2},{110023,0,1,10},{110024,0,1,10},{110025,0,1,10},{110026,0,1,10},{110030,0,1,10},{110031,0,1,10},
AK90: 110032 | AL90: 嗜血术书 | AM90: 1 | AN90: 0 | AO90: 1 | AP90: 10 | AQ90: ="{"&RC[-6]&","&RC[-3]&","&RC[-2]&","&RC[-1]&"}," -> {110032,0,1,10}, | AR90: =R[-1]C&RC[-1] -> {110025,0,1,2},{110040,0,1,2},{110032,0,1,2},{110023,0,1,10},{110024,0,1,10},{110025,0,1,10},{110026,0,1,10},{110030,0,1,10},{110031,0,1,10},{110032,0,1,10}, | AT90: 110032 | AU90: 嗜血术书 | AV90: 1 | AW90: 0 | AX90: 1 | AY90: 10 | AZ90: ="{"&RC[-6]&","&RC[-3]&","&RC[-2]&","&RC[-1]&"}," -> {110032,0,1,10}, | BA90: =R[-1]C&RC[-1] -> {110025,0,1,2},{110040,0,1,2},{110032,0,1,2},{110023,0,1,10},{110024,0,1,10},{110025,0,1,10},{110026,0,1,10},{110030,0,1,10},{110031,0,1,10},{110032,0,1,10}, | BC90: 110032 | BD90: 嗜血术书 | BE90: 1 | BF90: 0 | BG90: 1 | BH90: 10 | BI90: ="{"&RC[-6]&","&RC[-3]&","&RC[-2]&","&RC[-1]&"}," -> {110032,0,1,10}, | BJ90: =R[-1]C&RC[-1] -> {110025,0,1,2},{110040,0,1,2},{110032,0,1,2},{110023,0,1,10},{110024,0,1,10},{110025,0,1,10},{110026,0,1,10},{110030,0,1,10},{110031,0,1,10},{110032,0,1,10},
AK91: 110033 | AL91: 雷电术书 | AM91: 1 | AN91: 0 | AO91: 1 | AP91: 10 | AQ91: ="{"&RC[-6]&","&RC[-3]&","&RC[-2]&","&RC[-1]&"}," -> {110033,0,1,10}, | AR91: =R[-1]C&RC[-1] -> {110025,0,1,2},{110040,0,1,2},{110032,0,1,2},{110023,0,1,10},{110024,0,1,10},{110025,0,1,10},{110026,0,1,10},{110030,0,1,10},{110031,0,1,10},{110032,0,1,10},{110033,0,1,10}, | AT91: 110033 | AU91: 雷电术书 | AV91: 1 | AW91: 0 | AX91: 1 | AY91: 10 | AZ91: ="{"&RC[-6]&","&RC[-3]&","&RC[-2]&","&RC[-1]&"}," -> {110033,0,1,10}, | BA91: =R[-1]C&RC[-1] -> {110025,0,1,2},{110040,0,1,2},{110032,0,1,2},{110023,0,1,10},{110024,0,1,10},{110025,0,1,10},{110026,0,1,10},{110030,0,1,10},{110031,0,1,10},{110032,0,1,10},{110033,0,1,10}, | BC91: 110033 | BD91: 雷电术书 | BE91: 1 | BF91: 0 | BG91: 1 | BH91: 10 | BI91: ="{"&RC[-6]&","&RC[-3]&","&RC[-2]&","&RC[-1]&"}," -> {110033,0,1,10}, | BJ91: =R[-1]C&RC[-1] -> {110025,0,1,2},{110040,0,1,2},{110032,0,1,2},{110023,0,1,10},{110024,0,1,10},{110025,0,1,10},{110026,0,1,10},{110030,0,1,10},{110031,0,1,10},{110032,0,1,10},{110033,0,1,10},
AK92: 110038 | AL92: 冰咆哮书 | AM92: 1 | AN92: 0 | AO92: 1 | AP92: 10 | AQ92: ="{"&RC[-6]&","&RC[-3]&","&RC[-2]&","&RC[-1]&"}," -> {110038,0,1,10}, | AR92: =R[-1]C&RC[-1] -> {110025,0,1,2},{110040,0,1,2},{110032,0,1,2},{110023,0,1,10},{110024,0,1,10},{110025,0,1,10},{110026,0,1,10},{110030,0,1,10},{110031,0,1,10},{110032,0,1,10},{110033,0,1,10},{110038,0,1,10}, | AT92: 110038 | AU92: 冰咆哮书 | AV92: 1 | AW92: 0 | AX92: 1 | AY92: 10 | AZ92: ="{"&RC[-6]&","&RC[-3]&","&RC[-2]&","&RC[-1]&"}," -> {110038,0,1,10}, | BA92: =R[-1]C&RC[-1] -> {110025,0,1,2},{110040,0,1,2},{110032,0,1,2},{110023,0,1,10},{110024,0,1,10},{110025,0,1,10},{110026,0,1,10},{110030,0,1,10},{110031,0,1,10},{110032,0,1,10},{110033,0,1,10},{110038,0,1,10}, | BC92: 110038 | BD92: 冰咆哮书 | BE92: 1 | BF92: 0 | BG92: 1 | BH92: 10 | BI92: ="{"&RC[-6]&","&RC[-3]&","&RC[-2]&","&RC[-1]&"}," -> {110038,0,1,10}, | BJ92: =R[-1]C&RC[-1] -> {110025,0,1,2},{110040,0,1,2},{110032,0,1,2},{110023,0,1,10},{110024,0,1,10},{110025,0,1,10},{110026,0,1,10},{110030,0,1,10},{110031,0,1,10},{110032,0,1,10},{110033,0,1,10},{110038,0,1,10},
AK93: 110039 | AL93: 抗拒火环书 | AM93: 1 | AN93: 0 | AO93: 1 | AP93: 10 | AQ93: ="{"&RC[-6]&","&RC[-3]&","&RC[-2]&","&RC[-1]&"}," -> {110039,0,1,10}, | AR93: =R[-1]C&RC[-1] -> {110025,0,1,2},{110040,0,1,2},{110032,0,1,2},{110023,0,1,10},{110024,0,1,10},{110025,0,1,10},{110026,0,1,10},{110030,0,1,10},{110031,0,1,10},{110032,0,1,10},{110033,0,1,10},{110038,0,1,10},{110039,0,1,10}, | AT93: 110039 | AU93: 抗拒火环书 | AV93: 1 | AW93: 0 | AX93: 1 | AY93: 10 | AZ93: ="{"&RC[-6]&","&RC[-3]&","&RC[-2]&","&RC[-1]&"}," -> {110039,0,1,10}, | BA93: =R[-1]C&RC[-1] -> {110025,0,1,2},{110040,0,1,2},{110032,0,1,2},{110023,0,1,10},{110024,0,1,10},{110025,0,1,10},{110026,0,1,10},{110030,0,1,10},{110031,0,1,10},{110032,0,1,10},{110033,0,1,10},{110038,0,1,10},{110039,0,1,10}, | BC93: 110039 | BD93: 抗拒火环书 | BE93: 1 | BF93: 0 | BG93: 1 | BH93: 10 | BI93: ="{"&RC[-6]&","&RC[-3]&","&RC[-2]&","&RC[-1]&"}," -> {110039,0,1,10}, | BJ93: =R[-1]C&RC[-1] -> {110025,0,1,2},{110040,0,1,2},{110032,0,1,2},{110023,0,1,10},{110024,0,1,10},{110025,0,1,10},{110026,0,1,10},{110030,0,1,10},{110031,0,1,10},{110032,0,1,10},{110033,0,1,10},{110038,0,1,10},{110039,0,1,10},
AK94: 110040 | AL94: 流星火雨书 | AM94: 1 | AN94: 0 | AO94: 1 | AP94: 10 | AQ94: ="{"&RC[-6]&","&RC[-3]&","&RC[-2]&","&RC[-1]&"}," -> {110040,0,1,10}, | AR94: =R[-1]C&RC[-1] -> {110025,0,1,2},{110040,0,1,2},{110032,0,1,2},{110023,0,1,10},{110024,0,1,10},{110025,0,1,10},{110026,0,1,10},{110030,0,1,10},{110031,0,1,10},{110032,0,1,10},{110033,0,1,10},{110038,0,1,10},{110039,0,1,10},{110040,0,1,10}, | AT94: 110040 | AU94: 流星火雨书 | AV94: 1 | AW94: 0 | AX94: 1 | AY94: 10 | AZ94: ="{"&RC[-6]&","&RC[-3]&","&RC[-2]&","&RC[-1]&"}," -> {110040,0,1,10}, | BA94: =R[-1]C&RC[-1] -> {110025,0,1,2},{110040,0,1,2},{110032,0,1,2},{110023,0,1,10},{110024,0,1,10},{110025,0,1,10},{110026,0,1,10},{110030,0,1,10},{110031,0,1,10},{110032,0,1,10},{110033,0,1,10},{110038,0,1,10},{110039,0,1,10},{110040,0,1,10}, | BC94: 110040 | BD94: 流星火雨书 | BE94: 1 | BF94: 0 | BG94: 1 | BH94: 10 | BI94: ="{"&RC[-6]&","&RC[-3]&","&RC[-2]&","&RC[-1]&"}," -> {110040,0,1,10}, | BJ94: =R[-1]C&RC[-1] -> {110025,0,1,2},{110040,0,1,2},{110032,0,1,2},{110023,0,1,10},{110024,0,1,10},{110025,0,1,10},{110026,0,1,10},{110030,0,1,10},{110031,0,1,10},{110032,0,1,10},{110033,0,1,10},{110038,0,1,10},{110039,0,1,10},{110040,0,1,10},
AK95: 110067 | AL95: 诱惑之光书 | AM95: 1 | AN95: 0 | AO95: 1 | AP95: 10 | AQ95: ="{"&RC[-6]&","&RC[-3]&","&RC[-2]&","&RC[-1]&"}" -> {110067,0,1,10} | AR95: =R[-1]C&RC[-1] -> {110025,0,1,2},{110040,0,1,2},{110032,0,1,2},{110023,0,1,10},{110024,0,1,10},{110025,0,1,10},{110026,0,1,10},{110030,0,1,10},{110031,0,1,10},{110032,0,1,10},{110033,0,1,10},{110038,0,1,10},{110039,0,1,10},{110040,0,1,10},{110067,0,1,10} | AT95: 110067 | AU95: 诱惑之光书 | AV95: 1 | AW95: 0 | AX95: 1 | AY95: 10 | AZ95: ="{"&RC[-6]&","&RC[-3]&","&RC[-2]&","&RC[-1]&"}" -> {110067,0,1,10} | BA95: =R[-1]C&RC[-1] -> {110025,0,1,2},{110040,0,1,2},{110032,0,1,2},{110023,0,1,10},{110024,0,1,10},{110025,0,1,10},{110026,0,1,10},{110030,0,1,10},{110031,0,1,10},{110032,0,1,10},{110033,0,1,10},{110038,0,1,10},{110039,0,1,10},{110040,0,1,10},{110067,0,1,10} | BC95: 110067 | BD95: 诱惑之光书 | BE95: 1 | BF95: 0 | BG95: 1 | BH95: 10 | BI95: ="{"&RC[-6]&","&RC[-3]&","&RC[-2]&","&RC[-1]&"}" -> {110067,0,1,10} | BJ95: =R[-1]C&RC[-1] -> {110025,0,1,2},{110040,0,1,2},{110032,0,1,2},{110023,0,1,10},{110024,0,1,10},{110025,0,1,10},{110026,0,1,10},{110030,0,1,10},{110031,0,1,10},{110032,0,1,10},{110033,0,1,10},{110038,0,1,10},{110039,0,1,10},{110040,0,1,10},{110067,0,1,10}
AK98: 110093 | AL98: 紫水晶+5 | AN98: 0 | AO98: 2 | AP98: 2 | AQ98: ="{"&RC[-6]&","&RC[-3]&","&RC[-2]&","&RC[-1]&"}," -> {110093,0,2,2}, | AR98: =RC[-1] -> {110093,0,2,2}, | AT98: 110093 | AU98: 紫水晶+5 | AW98: 0 | AX98: 2 | AY98: 2 | AZ98: ="{"&RC[-6]&","&RC[-3]&","&RC[-2]&","&RC[-1]&"}," -> {110093,0,2,2}, | BA98: =RC[-1] -> {110093,0,2,2}, | BC98: 110093 | BD98: 紫水晶+5 | BF98: 0 | BG98: 2 | BH98: 2 | BI98: ="{"&RC[-6]&","&RC[-3]&","&RC[-2]&","&RC[-1]&"}," -> {110093,0,2,2}, | BJ98: =RC[-1] -> {110093,0,2,2},
AK99: 110003 | AL99: 洗炼石 | AN99: 0 | AO99: 2 | AP99: 2 | AQ99: ="{"&RC[-6]&","&RC[-3]&","&RC[-2]&","&RC[-1]&"}," -> {110003,0,2,2}, | AR99: =R[-1]C&RC[-1] -> {110093,0,2,2},{110003,0,2,2}, | AT99: 110003 | AU99: 洗炼石 | AW99: 0 | AX99: 2 | AY99: 2 | AZ99: ="{"&RC[-6]&","&RC[-3]&","&RC[-2]&","&RC[-1]&"}," -> {110003,0,2,2}, | BA99: =R[-1]C&RC[-1] -> {110093,0,2,2},{110003,0,2,2}, | BC99: 110003 | BD99: 洗炼石 | BF99: 0 | BG99: 2 | BH99: 2 | BI99: ="{"&RC[-6]&","&RC[-3]&","&RC[-2]&","&RC[-1]&"}," -> {110003,0,2,2}, | BJ99: =R[-1]C&RC[-1] -> {110093,0,2,2},{110003,0,2,2},
AK100: 110004 | AL100: 红药 | AN100: 0 | AO100: 1 | AP100: 3 | AQ100: ="{"&RC[-6]&","&RC[-3]&","&RC[-2]&","&RC[-1]&"}," -> {110004,0,1,3}, | AR100: =R[-1]C&RC[-1] -> {110093,0,2,2},{110003,0,2,2},{110004,0,1,3}, | AT100: 110004 | AU100: 红药 | AW100: 0 | AX100: 1 | AY100: 3 | AZ100: ="{"&RC[-6]&","&RC[-3]&","&RC[-2]&","&RC[-1]&"}," -> {110004,0,1,3}, | BA100: =R[-1]C&RC[-1] -> {110093,0,2,2},{110003,0,2,2},{110004,0,1,3}, | BC100: 110004 | BD100: 红药 | BF100: 0 | BG100: 1 | BH100: 3 | BI100: ="{"&RC[-6]&","&RC[-3]&","&RC[-2]&","&RC[-1]&"}," -> {110004,0,1,3}, | BJ100: =R[-1]C&RC[-1] -> {110093,0,2,2},{110003,0,2,2},{110004,0,1,3},
AK101: 110005 | AL101: 蓝药 | AN101: 0 | AO101: 1 | AP101: 3 | AQ101: ="{"&RC[-6]&","&RC[-3]&","&RC[-2]&","&RC[-1]&"}," -> {110005,0,1,3}, | AR101: =R[-1]C&RC[-1] -> {110093,0,2,2},{110003,0,2,2},{110004,0,1,3},{110005,0,1,3}, | AT101: 110005 | AU101: 蓝药 | AW101: 0 | AX101: 1 | AY101: 3 | AZ101: ="{"&RC[-6]&","&RC[-3]&","&RC[-2]&","&RC[-1]&"}," -> {110005,0,1,3}, | BA101: =R[-1]C&RC[-1] -> {110093,0,2,2},{110003,0,2,2},{110004,0,1,3},{110005,0,1,3}, | BC101: 110005 | BD101: 蓝药 | BF101: 0 | BG101: 1 | BH101: 3 | BI101: ="{"&RC[-6]&","&RC[-3]&","&RC[-2]&","&RC[-1]&"}," -> {110005,0,1,3}, | BJ101: =R[-1]C&RC[-1] -> {110093,0,2,2},{110003,0,2,2},{110004,0,1,3},{110005,0,1,3},
AK102: 110050 | AL102: 金条 | AN102: 0 | AO102: 1 | AP102: 3 | AQ102: ="{"&RC[-6]&","&RC[-3]&","&RC[-2]&","&RC[-1]&"}," -> {110050,0,1,3}, | AR102: =R[-1]C&RC[-1] -> {110093,0,2,2},{110003,0,2,2},{110004,0,1,3},{110005,0,1,3},{110050,0,1,3}, | AT102: 110050 | AU102: 金条 | AW102: 0 | AX102: 1 | AY102: 3 | AZ102: ="{"&RC[-6]&","&RC[-3]&","&RC[-2]&","&RC[-1]&"}," -> {110050,0,1,3}, | BA102: =R[-1]C&RC[-1] -> {110093,0,2,2},{110003,0,2,2},{110004,0,1,3},{110005,0,1,3},{110050,0,1,3}, | BC102: 110050 | BD102: 金条 | BF102: 0 | BG102: 1 | BH102: 3 | BI102: ="{"&RC[-6]&","&RC[-3]&","&RC[-2]&","&RC[-1]&"}," -> {110050,0,1,3}, | BJ102: =R[-1]C&RC[-1] -> {110093,0,2,2},{110003,0,2,2},{110004,0,1,3},{110005,0,1,3},{110050,0,1,3},
AK103: 110010 | AL103: 普通武装碎片 | AN103: 0 | AO103: 1 | AP103: 0 | AQ103: ="{"&RC[-6]&","&RC[-3]&","&RC[-2]&","&RC[-1]&"}," -> {110010,0,1,0}, | AR103: =R[-1]C&RC[-1] -> {110093,0,2,2},{110003,0,2,2},{110004,0,1,3},{110005,0,1,3},{110050,0,1,3},{110010,0,1,0}, | AT103: 110010 | AU103: 普通武装碎片 | AW103: 0 | AX103: 1 | AY103: 0 | AZ103: ="{"&RC[-6]&","&RC[-3]&","&RC[-2]&","&RC[-1]&"}," -> {110010,0,1,0}, | BA103: =R[-1]C&RC[-1] -> {110093,0,2,2},{110003,0,2,2},{110004,0,1,3},{110005,0,1,3},{110050,0,1,3},{110010,0,1,0}, | BC103: 110010 | BD103: 普通武装碎片 | BF103: 0 | BG103: 1 | BH103: 0 | BI103: ="{"&RC[-6]&","&RC[-3]&","&RC[-2]&","&RC[-1]&"}," -> {110010,0,1,0}, | BJ103: =R[-1]C&RC[-1] -> {110093,0,2,2},{110003,0,2,2},{110004,0,1,3},{110005,0,1,3},{110050,0,1,3},{110010,0,1,0},
AK104: 110011 | AL104: 普通防具碎片 | AN104: 0 | AO104: 1 | AP104: 0 | AQ104: ="{"&RC[-6]&","&RC[-3]&","&RC[-2]&","&RC[-1]&"}," -> {110011,0,1,0}, | AR104: =R[-1]C&RC[-1] -> {110093,0,2,2},{110003,0,2,2},{110004,0,1,3},{110005,0,1,3},{110050,0,1,3},{110010,0,1,0},{110011,0,1,0}, | AT104: 110011 | AU104: 普通防具碎片 | AW104: 0 | AX104: 1 | AY104: 0 | AZ104: ="{"&RC[-6]&","&RC[-3]&","&RC[-2]&","&RC[-1]&"}," -> {110011,0,1,0}, | BA104: =R[-1]C&RC[-1] -> {110093,0,2,2},{110003,0,2,2},{110004,0,1,3},{110005,0,1,3},{110050,0,1,3},{110010,0,1,0},{110011,0,1,0}, | BC104: 110011 | BD104: 普通防具碎片 | BF104: 0 | BG104: 1 | BH104: 0 | BI104: ="{"&RC[-6]&","&RC[-3]&","&RC[-2]&","&RC[-1]&"}," -> {110011,0,1,0}, | BJ104: =R[-1]C&RC[-1] -> {110093,0,2,2},{110003,0,2,2},{110004,0,1,3},{110005,0,1,3},{110050,0,1,3},{110010,0,1,0},{110011,0,1,0},
AK105: 110012 | AL105: 普通首饰碎片 | AN105: 0 | AO105: 1 | AP105: 0 | AQ105: ="{"&RC[-6]&","&RC[-3]&","&RC[-2]&","&RC[-1]&"}," -> {110012,0,1,0}, | AR105: =R[-1]C&RC[-1] -> {110093,0,2,2},{110003,0,2,2},{110004,0,1,3},{110005,0,1,3},{110050,0,1,3},{110010,0,1,0},{110011,0,1,0},{110012,0,1,0}, | AT105: 110012 | AU105: 普通首饰碎片 | AW105: 0 | AX105: 1 | AY105: 0 | AZ105: ="{"&RC[-6]&","&RC[-3]&","&RC[-2]&","&RC[-1]&"}," -> {110012,0,1,0}, | BA105: =R[-1]C&RC[-1] -> {110093,0,2,2},{110003,0,2,2},{110004,0,1,3},{110005,0,1,3},{110050,0,1,3},{110010,0,1,0},{110011,0,1,0},{110012,0,1,0}, | BC105: 110012 | BD105: 普通首饰碎片 | BF105: 0 | BG105: 1 | BH105: 0 | BI105: ="{"&RC[-6]&","&RC[-3]&","&RC[-2]&","&RC[-1]&"}," -> {110012,0,1,0}, | BJ105: =R[-1]C&RC[-1] -> {110093,0,2,2},{110003,0,2,2},{110004,0,1,3},{110005,0,1,3},{110050,0,1,3},{110010,0,1,0},{110011,0,1,0},{110012,0,1,0},
AK106: 110013 | AL106: 精炼武装碎片 | AN106: 0 | AO106: 1 | AP106: 3 | AQ106: ="{"&RC[-6]&","&RC[-3]&","&RC[-2]&","&RC[-1]&"}," -> {110013,0,1,3}, | AR106: =R[-1]C&RC[-1] -> {110093,0,2,2},{110003,0,2,2},{110004,0,1,3},{110005,0,1,3},{110050,0,1,3},{110010,0,1,0},{110011,0,1,0},{110012,0,1,0},{110013,0,1,3}, | AT106: 110013 | AU106: 精炼武装碎片 | AW106: 0 | AX106: 1 | AY106: 3 | AZ106: ="{"&RC[-6]&","&RC[-3]&","&RC[-2]&","&RC[-1]&"}," -> {110013,0,1,3}, | BA106: =R[-1]C&RC[-1] -> {110093,0,2,2},{110003,0,2,2},{110004,0,1,3},{110005,0,1,3},{110050,0,1,3},{110010,0,1,0},{110011,0,1,0},{110012,0,1,0},{110013,0,1,3}, | BC106: 110013 | BD106: 精炼武装碎片 | BF106: 0 | BG106: 1 | BH106: 3 | BI106: ="{"&RC[-6]&","&RC[-3]&","&RC[-2]&","&RC[-1]&"}," -> {110013,0,1,3}, | BJ106: =R[-1]C&RC[-1] -> {110093,0,2,2},{110003,0,2,2},{110004,0,1,3},{110005,0,1,3},{110050,0,1,3},{110010,0,1,0},{110011,0,1,0},{110012,0,1,0},{110013,0,1,3},
AK107: 110014 | AL107: 精炼防具碎片 | AN107: 0 | AO107: 1 | AP107: 3 | AQ107: ="{"&RC[-6]&","&RC[-3]&","&RC[-2]&","&RC[-1]&"}," -> {110014,0,1,3}, | AR107: =R[-1]C&RC[-1] -> {110093,0,2,2},{110003,0,2,2},{110004,0,1,3},{110005,0,1,3},{110050,0,1,3},{110010,0,1,0},{110011,0,1,0},{110012,0,1,0},{110013,0,1,3},{110014,0,1,3}, | AT107: 110014 | AU107: 精炼防具碎片 | AW107: 0 | AX107: 1 | AY107: 3 | AZ107: ="{"&RC[-6]&","&RC[-3]&","&RC[-2]&","&RC[-1]&"}," -> {110014,0,1,3}, | BA107: =R[-1]C&RC[-1] -> {110093,0,2,2},{110003,0,2,2},{110004,0,1,3},{110005,0,1,3},{110050,0,1,3},{110010,0,1,0},{110011,0,1,0},{110012,0,1,0},{110013,0,1,3},{110014,0,1,3}, | BC107: 110014 | BD107: 精炼防具碎片 | BF107: 0 | BG107: 1 | BH107: 3 | BI107: ="{"&RC[-6]&","&RC[-3]&","&RC[-2]&","&RC[-1]&"}," -> {110014,0,1,3}, | BJ107: =R[-1]C&RC[-1] -> {110093,0,2,2},{110003,0,2,2},{110004,0,1,3},{110005,0,1,3},{110050,0,1,3},{110010,0,1,0},{110011,0,1,0},{110012,0,1,0},{110013,0,1,3},{110014,0,1,3},
AK108: 110015 | AL108: 精炼首饰碎片 | AN108: 0 | AO108: 1 | AP108: 3 | AQ108: ="{"&RC[-6]&","&RC[-3]&","&RC[-2]&","&RC[-1]&"}" -> {110015,0,1,3} | AR108: =R[-1]C&RC[-1] -> {110093,0,2,2},{110003,0,2,2},{110004,0,1,3},{110005,0,1,3},{110050,0,1,3},{110010,0,1,0},{110011,0,1,0},{110012,0,1,0},{110013,0,1,3},{110014,0,1,3},{110015,0,1,3} | AT108: 110015 | AU108: 精炼首饰碎片 | AW108: 0 | AX108: 1 | AY108: 3 | AZ108: ="{"&RC[-6]&","&RC[-3]&","&RC[-2]&","&RC[-1]&"}" -> {110015,0,1,3} | BA108: =R[-1]C&RC[-1] -> {110093,0,2,2},{110003,0,2,2},{110004,0,1,3},{110005,0,1,3},{110050,0,1,3},{110010,0,1,0},{110011,0,1,0},{110012,0,1,0},{110013,0,1,3},{110014,0,1,3},{110015,0,1,3} | BC108: 110015 | BD108: 精炼首饰碎片 | BF108: 0 | BG108: 1 | BH108: 3 | BI108: ="{"&RC[-6]&","&RC[-3]&","&RC[-2]&","&RC[-1]&"}" -> {110015,0,1,3} | BJ108: =R[-1]C&RC[-1] -> {110093,0,2,2},{110003,0,2,2},{110004,0,1,3},{110005,0,1,3},{110050,0,1,3},{110010,0,1,0},{110011,0,1,0},{110012,0,1,0},{110013,0,1,3},{110014,0,1,3},{110015,0,1,3}
AK110: BOSS怪掉落 | AP110: 装备 | AQ110: 概率／100 | AT110: BOSS怪掉落 | AY110: 装备 | AZ110: 概率／100 | BC110: BOSS怪掉落 | BH110: 装备 | BI110: 概率／100
AP111: 3 | AQ111: 100 | AR111: ="{0,[{"&RC[-2]&","&RC[-1]&"}],["&R[-33]C&"]}" -> {0,[{3,100}],[{200010,0,1,40},{200011,0,1,40},{200012,0,1,40},{200013,0,1,40},{200015,0,1,40},{200016,0,1,40},{200017,0,1,40},{200019,0,1,40},{200020,0,1,1},{200021,0,1,3},{200022,0,1,10},{200023,0,1,10},{200025,0,1,3},{200026,0,1,10},{200027,0,1,3},{200029,0,1,3},{200030,0,1,1},{200031,0,1,1},{200032,0,1,5},{200033,0,1,5},{200035,0,1,1},{200036,0,1,5},{200037,0,1,1},{200039,0,1,1},{201010,0,1,40},{201011,0,1,40},{201012,0,1,40},{201013,0,1,40},{201015,0,1,40},{201016,0,1,40},{201017,0,1,40},{201019,0,1,40},{201020,0,1,1},{201021,0,1,3},{201022,0,1,10},{201023,0,1,10},{201025,0,1,3},{201026,0,1,10},{201027,0,1,3},{201029,0,1,3},{201030,0,1,1},{201031,0,1,1},{201032,0,1,5},{201033,0,1,5},{201035,0,1,1},{201036,0,1,5},{201037,0,1,1},{201039,0,1,1},{202010,0,1,40},{202011,0,1,40},{202012,0,1,40},{202013,0,1,40},{202015,0,1,40},{202016,0,1,40},{202017,0,1,40},{202019,0,1,40},{202020,0,1,1},{202021,0,1,3},{202022,0,1,10},{202023,0,1,10},{202025,0,1,3},{202026,0,1,10},{202027,0,1,3},{202029,0,1,3},{202030,0,1,1},{202031,0,1,1},{202032,0,1,5},{202033,0,1,5},{202035,0,1,1},{202036,0,1,5},{202037,0,1,1},{202039,0,1,1},{305003,0,1,2},{305004,0,1,2},{305005,0,1,2}]} | AY111: 3 | AZ111: 100 | BA111: ="{0,[{"&RC[-2]&","&RC[-1]&"}],["&R[-33]C&"]}" -> {0,[{3,100}],[{305005,0,1,5}]} | BH111: 3 | BI111: 100 | BJ111: ="{0,[{"&RC[-2]&","&RC[-1]&"}],["&R[-33]C&"]}" -> {0,[{3,100}],[{305005,0,1,10}]}
AP112: 道具 | AQ112: 概率／100 | AY112: 道具 | AZ112: 概率／100 | BH112: 道具 | BI112: 概率／100
AP113: 2 | AQ113: 100 | AR113: ="{0,[{"&RC[-2]&","&RC[-1]&"}],["&R[-5]C&"]}" -> {0,[{2,100}],[{110093,0,2,2},{110003,0,2,2},{110004,0,1,3},{110005,0,1,3},{110050,0,1,3},{110010,0,1,0},{110011,0,1,0},{110012,0,1,0},{110013,0,1,3},{110014,0,1,3},{110015,0,1,3}]} | AY113: 2 | AZ113: 100 | BA113: ="{0,[{"&RC[-2]&","&RC[-1]&"}],["&R[-5]C&"]}" -> {0,[{2,100}],[{110093,0,2,2},{110003,0,2,2},{110004,0,1,3},{110005,0,1,3},{110050,0,1,3},{110010,0,1,0},{110011,0,1,0},{110012,0,1,0},{110013,0,1,3},{110014,0,1,3},{110015,0,1,3}]} | BH113: 2 | BI113: 100 | BJ113: ="{0,[{"&RC[-2]&","&RC[-1]&"}],["&R[-5]C&"]}" -> {0,[{2,100}],[{110093,0,2,2},{110003,0,2,2},{110004,0,1,3},{110005,0,1,3},{110050,0,1,3},{110010,0,1,0},{110011,0,1,0},{110012,0,1,0},{110013,0,1,3},{110014,0,1,3},{110015,0,1,3}]}
AP114: 金币 | AQ114: 概率／100 | AY114: 金币 | AZ114: 概率／100 | BH114: 金币 | BI114: 概率／100
AP115: 3 | AQ115: 100 | AR115: {0,[{10,100}],[{110009,1,1000,1}]} | AY115: 3 | AZ115: 100 | BA115: {0,[{10,100}],[{110009,1,1000,1}]} | BH115: 3 | BI115: 100 | BJ115: {0,[{10,100}],[{110009,1,1000,1}]}
AP116: 技能书 | AQ116: 概率／100 | AY116: 技能书 | AZ116: 概率／100 | BH116: 技能书 | BI116: 概率／100
AP117: 1 | AQ117: 100 | AR117: ="{0,[{"&RC[-2]&","&RC[-1]&"}],["&R[-22]C&"]}" -> {0,[{1,100}],[{110025,0,1,2},{110040,0,1,2},{110032,0,1,2},{110023,0,1,10},{110024,0,1,10},{110025,0,1,10},{110026,0,1,10},{110030,0,1,10},{110031,0,1,10},{110032,0,1,10},{110033,0,1,10},{110038,0,1,10},{110039,0,1,10},{110040,0,1,10},{110067,0,1,10}]} | AY117: 1 | AZ117: 100 | BA117: ="{0,[{"&RC[-2]&","&RC[-1]&"}],["&R[-22]C&"]}" -> {0,[{1,100}],[{110025,0,1,2},{110040,0,1,2},{110032,0,1,2},{110023,0,1,10},{110024,0,1,10},{110025,0,1,10},{110026,0,1,10},{110030,0,1,10},{110031,0,1,10},{110032,0,1,10},{110033,0,1,10},{110038,0,1,10},{110039,0,1,10},{110040,0,1,10},{110067,0,1,10}]} | BH117: 1 | BI117: 100 | BJ117: ="{0,[{"&RC[-2]&","&RC[-1]&"}],["&R[-22]C&"]}" -> {0,[{1,100}],[{110025,0,1,2},{110040,0,1,2},{110032,0,1,2},{110023,0,1,10},{110024,0,1,10},{110025,0,1,10},{110026,0,1,10},{110030,0,1,10},{110031,0,1,10},{110032,0,1,10},{110033,0,1,10},{110038,0,1,10},{110039,0,1,10},{110040,0,1,10},{110067,0,1,10}]}
AR119: ="["&R[-8]C&","&R[-6]C&","&R[-4]C&","&R[-2]C&"]" -> [{0,[{3,100}],[{200010,0,1,40},{200011,0,1,40},{200012,0,1,40},{200013,0,1,40},{200015,0,1,40},{200016,0,1,40},{200017,0,1,40},{200019,0,1,40},{200020,0,1,1},{200021,0,1,3},{200022,0,1,10},{200023,0,1,10},{200025,0,1,3},{200026,0,1,10},{200027,0,1,3},{200029,0,1,3},{200030,0,1,1},{200031,0,1,1},{200032,0,1,5},{200033,0,1,5},{200035,0,1,1},{200036,0,1,5},{200037,0,1,1},{200039,0,1,1},{201010,0,1,40},{201011,0,1,40},{201012,0,1,40},{201013,0,1,40},{201015,0,1,40},{201016,0,1,40},{201017,0,1,40},{201019,0,1,40},{201020,0,1,1},{201021,0,1,3},{201022,0,1,10},{201023,0,1,10},{201025,0,1,3},{201026,0,1,10},{201027,0,1,3},{201029,0,1,3},{201030,0,1,1},{201031,0,1,1},{201032,0,1,5},{201033,0,1,5},{201035,0,1,1},{201036,0,1,5},{201037,0,1,1},{201039,0,1,1},{202010,0,1,40},{202011,0,1,40},{202012,0,1,40},{202013,0,1,40},{202015,0,1,40},{202016,0,1,40},{202017,0,1,40},{202019,0,1,40},{202020,0,1,1},{202021,0,1,3},{202022,0,1,10},{202023,0,1,10},{202025,0,1,3},{202026,0,1,10},{202027,0,1,3},{202029,0,1,3},{202030,0,1,1},{202031,0,1,1},{202032,0,1,5},{202033,0,1,5},{202035,0,1,1},{202036,0,1,5},{202037,0,1,1},{202039,0,1,1},{305003,0,1,2},{305004,0,1,2},{305005,0,1,2}]},{0,[{2,100}],[{110093,0,2,2},{110003,0,2,2},{110004,0,1,3},{110005,0,1,3},{110050,0,1,3},{110010,0,1,0},{110011,0,1,0},{110012,0,1,0},{110013,0,1,3},{110014,0,1,3},{110015,0,1,3}]},{0,[{10,100}],[{110009,1,1000,1}]},{0,[{1,100}],[{110025,0,1,2},{110040,0,1,2},{110032,0,1,2},{110023,0,1,10},{110024,0,1,10},{110025,0,1,10},{110026,0,1,10},{110030,0,1,10},{110031,0,1,10},{110032,0,1,10},{110033,0,1,10},{110038,0,1,10},{110039,0,1,10},{110040,0,1,10},{110067,0,1,10}]}] | BA119: ="["&R[-8]C&","&R[-6]C&","&R[-4]C&","&R[-2]C&"]" -> [{0,[{3,100}],[{305005,0,1,5}]},{0,[{2,100}],[{110093,0,2,2},{110003,0,2,2},{110004,0,1,3},{110005,0,1,3},{110050,0,1,3},{110010,0,1,0},{110011,0,1,0},{110012,0,1,0},{110013,0,1,3},{110014,0,1,3},{110015,0,1,3}]},{0,[{10,100}],[{110009,1,1000,1}]},{0,[{1,100}],[{110025,0,1,2},{110040,0,1,2},{110032,0,1,2},{110023,0,1,10},{110024,0,1,10},{110025,0,1,10},{110026,0,1,10},{110030,0,1,10},{110031,0,1,10},{110032,0,1,10},{110033,0,1,10},{110038,0,1,10},{110039,0,1,10},{110040,0,1,10},{110067,0,1,10}]}] | BJ119: ="["&R[-8]C&","&R[-6]C&","&R[-4]C&","&R[-2]C&"]" -> [{0,[{3,100}],[{305005,0,1,10}]},{0,[{2,100}],[{110093,0,2,2},{110003,0,2,2},{110004,0,1,3},{110005,0,1,3},{110050,0,1,3},{110010,0,1,0},{110011,0,1,0},{110012,0,1,0},{110013,0,1,3},{110014,0,1,3},{110015,0,1,3}]},{0,[{10,100}],[{110009,1,1000,1}]},{0,[{1,100}],[{110025,0,1,2},{110040,0,1,2},{110032,0,1,2},{110023,0,1,10},{110024,0,1,10},{110025,0,1,10},{110026,0,1,10},{110030,0,1,10},{110031,0,1,10},{110032,0,1,10},{110033,0,1,10},{110038,0,1,10},{110039,0,1,10},{110040,0,1,10},{110067,0,1,10}]}]

Sheet: 行会副本BOSS
A2: 副本1（1-30级装备掉落+首冲武器） | J2: 副本2（1-35级装备掉落+首冲武器） | S2: 副本3（15-40级装备掉落）
A3: ID | B3: 名称 | C3: 品质 | D3: 是否绑定 | E3: 数量 | J3: ID | K3: 名称 | L3: 品质 | M3: 是否绑定 | N3: 数量 | S3: ID | T3: 名称 | U3: 品质 | V3: 是否绑定 | W3: 数量
A4: 200000 | B4: 八荒 | C4: 1 | D4: 0 | E4: 1 | F4: 30 | G4: ="{"&RC[-6]&","&RC[-3]&","&RC[-2]&","&RC[-1]&"}," -> {200000,0,1,30}, | H4: =RC[-1] -> {200000,0,1,30}, | J4: 200010 | K4: 炼狱 | L4: 1 | M4: 0 | N4: 1 | O4: 60 | P4: ="{"&RC[-6]&","&RC[-3]&","&RC[-2]&","&RC[-1]&"}," -> {200010,0,1,60}, | Q4: =RC[-1] -> {200010,0,1,60}, | S4: 200010 | T4: 炼狱 | U4: 1 | V4: 0 | W4: 1 | X4: 50 | Y4: ="{"&RC[-6]&","&RC[-3]&","&RC[-2]&","&RC[-1]&"}," -> {200010,0,1,50}, | Z4: =RC[-1] -> {200010,0,1,50},
A5: 200001 | B5: 轻盔 | C5: 1 | D5: 0 | E5: 1 | F5: 30 | G5: ="{"&RC[-6]&","&RC[-3]&","&RC[-2]&","&RC[-1]&"}," -> {200001,0,1,30}, | H5: =R[-1]C&RC[-1] -> {200000,0,1,30},{200001,0,1,30}, | J5: 200011 | K5: 绿色项链 | L5: 1 | M5: 0 | N5: 1 | O5: 60 | P5: ="{"&RC[-6]&","&RC[-3]&","&RC[-2]&","&RC[-1]&"}," -> {200011,0,1,60}, | Q5: =R[-1]C&RC[-1] -> {200010,0,1,60},{200011,0,1,60}, | S5: 200011 | T5: 绿色项链 | U5: 1 | V5: 0 | W5: 1 | X5: 50 | Y5: ="{"&RC[-6]&","&RC[-3]&","&RC[-2]&","&RC[-1]&"}," -> {200011,0,1,50}, | Z5: =R[-1]C&RC[-1] -> {200010,0,1,50},{200011,0,1,50},
A6: 200002 | B6: 珊瑚戒指 | C6: 1 | D6: 0 | E6: 1 | F6: 30 | G6: ="{"&RC[-6]&","&RC[-3]&","&RC[-2]&","&RC[-1]&"}," -> {200002,0,1,30}, | H6: =R[-1]C&RC[-1] -> {200000,0,1,30},{200001,0,1,30},{200002,0,1,30}, | J6: 200012 | K6: 战神盔甲 | L6: 1 | M6: 0 | N6: 1 | O6: 60 | P6: ="{"&RC[-6]&","&RC[-3]&","&RC[-2]&","&RC[-1]&"}," -> {200012,0,1,60}, | Q6: =R[-1]C&RC[-1] -> {200010,0,1,60},{200011,0,1,60},{200012,0,1,60}, | S6: 200012 | T6: 战神盔甲 | U6: 1 | V6: 0 | W6: 1 | X6: 50 | Y6: ="{"&RC[-6]&","&RC[-3]&","&RC[-2]&","&RC[-1]&"}," -> {200012,0,1,50}, | Z6: =R[-1]C&RC[-1] -> {200010,0,1,50},{200011,0,1,50},{200012,0,1,50},
A7: 200003 | B7: 魔力手镯 | C7: 1 | D7: 0 | E7: 1 | F7: 30 | G7: ="{"&RC[-6]&","&RC[-3]&","&RC[-2]&","&RC[-1]&"}," -> {200003,0,1,30}, | H7: =R[-1]C&RC[-1] -> {200000,0,1,30},{200001,0,1,30},{200002,0,1,30},{200003,0,1,30}, | J7: 200013 | K7: 力量戒指 | L7: 1 | M7: 0 | N7: 1 | O7: 60 | P7: ="{"&RC[-6]&","&RC[-3]&","&RC[-2]&","&RC[-1]&"}," -> {200013,0,1,60}, | Q7: =R[-1]C&RC[-1] -> {200010,0,1,60},{200011,0,1,60},{200012,0,1,60},{200013,0,1,60}, | S7: 200013 | T7: 力量戒指 | U7: 1 | V7: 0 | W7: 1 | X7: 50 | Y7: ="{"&RC[-6]&","&RC[-3]&","&RC[-2]&","&RC[-1]&"}," -> {200013,0,1,50}, | Z7: =R[-1]C&RC[-1] -> {200010,0,1,50},{200011,0,1,50},{200012,0,1,50},{200013,0,1,50},
A8: 200006 | B8: 恶魔项链 | C8: 1 | D8: 0 | E8: 1 | F8: 30 | G8: ="{"&RC[-6]&","&RC[-3]&","&RC[-2]&","&RC[-1]&"}," -> {200006,0,1,30}, | H8: =R[-1]C&RC[-1] -> {200000,0,1,30},{200001,0,1,30},{200002,0,1,30},{200003,0,1,30},{200006,0,1,30}, | J8: 200015 | K8: 战士头盔 | L8: 1 | M8: 0 | N8: 1 | O8: 60 | P8: ="{"&RC[-6]&","&RC[-3]&","&RC[-2]&","&RC[-1]&"}," -> {200015,0,1,60}, | Q8: =R[-1]C&RC[-1] -> {200010,0,1,60},{200011,0,1,60},{200012,0,1,60},{200013,0,1,60},{200015,0,1,60}, | S8: 200015 | T8: 战士头盔 | U8: 1 | V8: 0 | W8: 1 | X8: 50 | Y8: ="{"&RC[-6]&","&RC[-3]&","&RC[-2]&","&RC[-1]&"}," -> {200015,0,1,50}, | Z8: =R[-1]C&RC[-1] -> {200010,0,1,50},{200011,0,1,50},{200012,0,1,50},{200013,0,1,50},{200015,0,1,50},
A9: 200010 | B9: 炼狱 | C9: 1 | D9: 0 | E9: 1 | F9: 5 | G9: ="{"&RC[-6]&","&RC[-3]&","&RC[-2]&","&RC[-1]&"}," -> {200010,0,1,5}, | H9: =R[-1]C&RC[-1] -> {200000,0,1,30},{200001,0,1,30},{200002,0,1,30},{200003,0,1,30},{200006,0,1,30},{200010,0,1,5}, | J9: 200016 | K9: 阎罗手镯 | L9: 1 | M9: 0 | N9: 1 | O9: 60 | P9: ="{"&RC[-6]&","&RC[-3]&","&RC[-2]&","&RC[-1]&"}," -> {200016,0,1,60}, | Q9: =R[-1]C&RC[-1] -> {200010,0,1,60},{200011,0,1,60},{200012,0,1,60},{200013,0,1,60},{200015,0,1,60},{200016,0,1,60}, | S9: 200016 | T9: 阎罗手镯 | U9: 1 | V9: 0 | W9: 1 | X9: 50 | Y9: ="{"&RC[-6]&","&RC[-3]&","&RC[-2]&","&RC[-1]&"}," -> {200016,0,1,50}, | Z9: =R[-1]C&RC[-1] -> {200010,0,1,50},{200011,0,1,50},{200012,0,1,50},{200013,0,1,50},{200015,0,1,50},{200016,0,1,50},
A10: 200011 | B10: 绿色项链 | C10: 1 | D10: 0 | E10: 1 | F10: 10 | G10: ="{"&RC[-6]&","&RC[-3]&","&RC[-2]&","&RC[-1]&"}," -> {200011,0,1,10}, | H10: =R[-1]C&RC[-1] -> {200000,0,1,30},{200001,0,1,30},{200002,0,1,30},{200003,0,1,30},{200006,0,1,30},{200010,0,1,5},{200011,0,1,10}, | J10: 200017 | K10: 战士腰带 | L10: 1 | M10: 0 | N10: 1 | O10: 60 | P10: ="{"&RC[-6]&","&RC[-3]&","&RC[-2]&","&RC[-1]&"}," -> {200017,0,1,60}, | Q10: =R[-1]C&RC[-1] -> {200010,0,1,60},{200011,0,1,60},{200012,0,1,60},{200013,0,1,60},{200015,0,1,60},{200016,0,1,60},{200017,0,1,60}, | S10: 200017 | T10: 战士腰带 | U10: 1 | V10: 0 | W10: 1 | X10: 50 | Y10: ="{"&RC[-6]&","&RC[-3]&","&RC[-2]&","&RC[-1]&"}," -> {200017,0,1,50}, | Z10: =R[-1]C&RC[-1] -> {200010,0,1,50},{200011,0,1,50},{200012,0,1,50},{200013,0,1,50},{200015,0,1,50},{200016,0,1,50},{200017,0,1,50},
A11: 200012 | B11: 战神盔甲 | C11: 1 | D11: 0 | E11: 1 | F11: 10 | G11: ="{"&RC[-6]&","&RC[-3]&","&RC[-2]&","&RC[-1]&"}," -> {200012,0,1,10}, | H11: =R[-1]C&RC[-1] -> {200000,0,1,30},{200001,0,1,30},{200002,0,1,30},{200003,0,1,30},{200006,0,1,30},{200010,0,1,5},{200011,0,1,10},{200012,0,1,10}, | J11: 200019 | K11: 战士鞋子 | L11: 1 | M11: 0 | N11: 1 | O11: 60 | P11: ="{"&RC[-6]&","&RC[-3]&","&RC[-2]&","&RC[-1]&"}," -> {200019,0,1,60}, | Q11: =R[-1]C&RC[-1] -> {200010,0,1,60},{200011,0,1,60},{200012,0,1,60},{200013,0,1,60},{200015,0,1,60},{200016,0,1,60},{200017,0,1,60},{200019,0,1,60}, | S11: 200019 | T11: 战士鞋子 | U11: 1 | V11: 0 | W11: 1 | X11: 50 | Y11: ="{"&RC[-6]&","&RC[-3]&","&RC[-2]&","&RC[-1]&"}," -> {200019,0,1,50}, | Z11: =R[-1]C&RC[-1] -> {200010,0,1,50},{200011,0,1,50},{200012,0,1,50},{200013,0,1,50},{200015,0,1,50},{200016,0,1,50},{200017,0,1,50},{200019,0,1,50},
A12: 200013 | B12: 力量戒指 | C12: 1 | D12: 0 | E12: 1 | F12: 10 | G12: ="{"&RC[-6]&","&RC[-3]&","&RC[-2]&","&RC[-1]&"}," -> {200013,0,1,10}, | H12: =R[-1]C&RC[-1] -> {200000,0,1,30},{200001,0,1,30},{200002,0,1,30},{200003,0,1,30},{200006,0,1,30},{200010,0,1,5},{200011,0,1,10},{200012,0,1,10},{200013,0,1,10}, | J12: 200020 | K12: 裁决 | L12: 1 | M12: 0 | N12: 1 | O12: 2 | P12: ="{"&RC[-6]&","&RC[-3]&","&RC[-2]&","&RC[-1]&"}," -> {200020,0,1,2}, | Q12: =R[-1]C&RC[-1] -> {200010,0,1,60},{200011,0,1,60},{200012,0,1,60},{200013,0,1,60},{200015,0,1,60},{200016,0,1,60},{200017,0,1,60},{200019,0,1,60},{200020,0,1,2}, | S12: 200020 | T12: 裁决 | U12: 1 | V12: 0 | W12: 1 | X12: 2 | Y12: ="{"&RC[-6]&","&RC[-3]&","&RC[-2]&","&RC[-1]&"}," -> {200020,0,1,2}, | Z12: =R[-1]C&RC[-1] -> {200010,0,1,50},{200011,0,1,50},{200012,0,1,50},{200013,0,1,50},{200015,0,1,50},{200016,0,1,50},{200017,0,1,50},{200019,0,1,50},{200020,0,1,2},
A13: 200015 | B13: 战士头盔 | C13: 1 | D13: 0 | E13: 1 | F13: 10 | G13: ="{"&RC[-6]&","&RC[-3]&","&RC[-2]&","&RC[-1]&"}," -> {200015,0,1,10}, | H13: =R[-1]C&RC[-1] -> {200000,0,1,30},{200001,0,1,30},{200002,0,1,30},{200003,0,1,30},{200006,0,1,30},{200010,0,1,5},{200011,0,1,10},{200012,0,1,10},{200013,0,1,10},{200015,0,1,10}, | J13: 200021 | K13: 圣战战甲 | L13: 1 | M13: 0 | N13: 1 | O13: 5 | P13: ="{"&RC[-6]&","&RC[-3]&","&RC[-2]&","&RC[-1]&"}," -> {200021,0,1,5}, | Q13: =R[-1]C&RC[-1] -> {200010,0,1,60},{200011,0,1,60},{200012,0,1,60},{200013,0,1,60},{200015,0,1,60},{200016,0,1,60},{200017,0,1,60},{200019,0,1,60},{200020,0,1,2},{200021,0,1,5}, | S13: 200021 | T13: 圣战战甲 | U13: 1 | V13: 0 | W13: 1 | X13: 5 | Y13: ="{"&RC[-6]&","&RC[-3]&","&RC[-2]&","&RC[-1]&"}," -> {200021,0,1,5}, | Z13: =R[-1]C&RC[-1] -> {200010,0,1,50},{200011,0,1,50},{200012,0,1,50},{200013,0,1,50},{200015,0,1,50},{200016,0,1,50},{200017,0,1,50},{200019,0,1,50},{200020,0,1,2},{200021,0,1,5},
A14: 200016 | B14: 阎罗手镯 | C14: 1 | D14: 0 | E14: 1 | F14: 10 | G14: ="{"&RC[-6]&","&RC[-3]&","&RC[-2]&","&RC[-1]&"}," -> {200016,0,1,10}, | H14: =R[-1]C&RC[-1] -> {200000,0,1,30},{200001,0,1,30},{200002,0,1,30},{200003,0,1,30},{200006,0,1,30},{200010,0,1,5},{200011,0,1,10},{200012,0,1,10},{200013,0,1,10},{200015,0,1,10},{200016,0,1,10}, | J14: 200022 | K14: 圣战项链 | L14: 1 | M14: 0 | N14: 1 | O14: 5 | P14: ="{"&RC[-6]&","&RC[-3]&","&RC[-2]&","&RC[-1]&"}," -> {200022,0,1,5}, | Q14: =R[-1]C&RC[-1] -> {200010,0,1,60},{200011,0,1,60},{200012,0,1,60},{200013,0,1,60},{200015,0,1,60},{200016,0,1,60},{200017,0,1,60},{200019,0,1,60},{200020,0,1,2},{200021,0,1,5},{200022,0,1,5}, | S14: 200022 | T14: 圣战项链 | U14: 1 | V14: 0 | W14: 1 | X14: 5 | Y14: ="{"&RC[-6]&","&RC[-3]&","&RC[-2]&","&RC[-1]&"}," -> {200022,0,1,5}, | Z14: =R[-1]C&RC[-1] -> {200010,0,1,50},{200011,0,1,50},{200012,0,1,50},{200013,0,1,50},{200015,0,1,50},{200016,0,1,50},{200017,0,1,50},{200019,0,1,50},{200020,0,1,2},{200021,0,1,5},{200022,0,1,5},
A15: 200017 | B15: 战士腰带 | C15: 1 | D15: 0 | E15: 1 | F15: 10 | G15: ="{"&RC[-6]&","&RC[-3]&","&RC[-2]&","&RC[-1]&"}," -> {200017,0,1,10}, | H15: =R[-1]C&RC[-1] -> {200000,0,1,30},{200001,0,1,30},{200002,0,1,30},{200003,0,1,30},{200006,0,1,30},{200010,0,1,5},{200011,0,1,10},{200012,0,1,10},{200013,0,1,10},{200015,0,1,10},{200016,0,1,10},{200017,0,1,10}, | J15: 200023 | K15: 圣战戒指 | L15: 1 | M15: 0 | N15: 1 | O15: 5 | P15: ="{"&RC[-6]&","&RC[-3]&","&RC[-2]&","&RC[-1]&"}," -> {200023,0,1,5}, | Q15: =R[-1]C&RC[-1] -> {200010,0,1,60},{200011,0,1,60},{200012,0,1,60},{200013,0,1,60},{200015,0,1,60},{200016,0,1,60},{200017,0,1,60},{200019,0,1,60},{200020,0,1,2},{200021,0,1,5},{200022,0,1,5},{200023,0,1,5}, | S15: 200023 | T15: 圣战戒指 | U15: 1 | V15: 0 | W15: 1 | X15: 5 | Y15: ="{"&RC[-6]&","&RC[-3]&","&RC[-2]&","&RC[-1]&"}," -> {200023,0,1,5}, | Z15: =R[-1]C&RC[-1] -> {200010,0,1,50},{200011,0,1,50},{200012,0,1,50},{200013,0,1,50},{200015,0,1,50},{200016,0,1,50},{200017,0,1,50},{200019,0,1,50},{200020,0,1,2},{200021,0,1,5},{200022,0,1,5},{200023,0,1,5},
A16: 200019 | B16: 战士鞋子 | C16: 1 | D16: 0 | E16: 1 | F16: 10 | G16: ="{"&RC[-6]&","&RC[-3]&","&RC[-2]&","&RC[-1]&"}," -> {200019,0,1,10}, | H16: =R[-1]C&RC[-1] -> {200000,0,1,30},{200001,0,1,30},{200002,0,1,30},{200003,0,1,30},{200006,0,1,30},{200010,0,1,5},{200011,0,1,10},{200012,0,1,10},{200013,0,1,10},{200015,0,1,10},{200016,0,1,10},{200017,0,1,10},{200019,0,1,10}, | J16: 200025 | K16: 圣战头盔 | L16: 1 | M16: 0 | N16: 1 | O16: 5 | P16: ="{"&RC[-6]&","&RC[-3]&","&RC[-2]&","&RC[-1]&"}," -> {200025,0,1,5}, | Q16: =R[-1]C&RC[-1] -> {200010,0,1,60},{200011,0,1,60},{200012,0,1,60},{200013,0,1,60},{200015,0,1,60},{200016,0,1,60},{200017,0,1,60},{200019,0,1,60},{200020,0,1,2},{200021,0,1,5},{200022,0,1,5},{200023,0,1,5},{200025,0,1,5}, | S16: 200025 | T16: 圣战头盔 | U16: 1 | V16: 0 | W16: 1 | X16: 5 | Y16: ="{"&RC[-6]&","&RC[-3]&","&RC[-2]&","&RC[-1]&"}," -> {200025,0,1,5}, | Z16: =R[-1]C&RC[-1] -> {200010,0,1,50},{200011,0,1,50},{200012,0,1,50},{200013,0,1,50},{200015,0,1,50},{200016,0,1,50},{200017,0,1,50},{200019,0,1,50},{200020,0,1,2},{200021,0,1,5},{200022,0,1,5},{200023,0,1,5},{200025,0,1,5},
A17: 201000 | B17: 海魂 | C17: 1 | D17: 0 | E17: 1 | F17: 30 | G17: ="{"&RC[-6]&","&RC[-3]&","&RC[-2]&","&RC[-1]&"}," -> {201000,0,1,30}, | H17: =R[-1]C&RC[-1] -> {200000,0,1,30},{200001,0,1,30},{200002,0,1,30},{200003,0,1,30},{200006,0,1,30},{200010,0,1,5},{200011,0,1,10},{200012,0,1,10},{200013,0,1,10},{200015,0,1,10},{200016,0,1,10},{200017,0,1,10},{200019,0,1,10},{201000,0,1,30}, | J17: 200026 | K17: 圣战手镯 | L17: 1 | M17: 0 | N17: 1 | O17: 5 | P17: ="{"&RC[-6]&","&RC[-3]&","&RC[-2]&","&RC[-1]&"}," -> {200026,0,1,5}, | Q17: =R[-1]C&RC[-1] -> {200010,0,1,60},{200011,0,1,60},{200012,0,1,60},{200013,0,1,60},{200015,0,1,60},{200016,0,1,60},{200017,0,1,60},{200019,0,1,60},{200020,0,1,2},{200021,0,1,5},{200022,0,1,5},{200023,0,1,5},{200025,0,1,5},{200026,0,1,5}, | S17: 200026 | T17: 圣战手镯 | U17: 1 | V17: 0 | W17: 1 | X17: 5 | Y17: ="{"&RC[-6]&","&RC[-3]&","&RC[-2]&","&RC[-1]&"}," -> {200026,0,1,5}, | Z17: =R[-1]C&RC[-1] -> {200010,0,1,50},{200011,0,1,50},{200012,0,1,50},{200013,0,1,50},{200015,0,1,50},{200016,0,1,50},{200017,0,1,50},{200019,0,1,50},{200020,0,1,2},{200021,0,1,5},{200022,0,1,5},{200023,0,1,5},{200025,0,1,5},{200026,0,1,5},
A18: 201001 | B18: 轻盔 | C18: 1 | D18: 0 | E18: 1 | F18: 30 | G18: ="{"&RC[-6]&","&RC[-3]&","&RC[-2]&","&RC[-1]&"}," -> {201001,0,1,30}, | H18: =R[-1]C&RC[-1] -> {200000,0,1,30},{200001,0,1,30},{200002,0,1,30},{200003,0,1,30},{200006,0,1,30},{200010,0,1,5},{200011,0,1,10},{200012,0,1,10},{200013,0,1,10},{200015,0,1,10},{200016,0,1,10},{200017,0,1,10},{200019,0,1,10},{201000,0,1,30},{201001,0,1,30}, | J18: 200027 | K18: 圣战腰带 | L18: 1 | M18: 0 | N18: 1 | O18: 5 | P18: ="{"&RC[-6]&","&RC[-3]&","&RC[-2]&","&RC[-1]&"}," -> {200027,0,1,5}, | Q18: =R[-1]C&RC[-1] -> {200010,0,1,60},{200011,0,1,60},{200012,0,1,60},{200013,0,1,60},{200015,0,1,60},{200016,0,1,60},{200017,0,1,60},{200019,0,1,60},{200020,0,1,2},{200021,0,1,5},{200022,0,1,5},{200023,0,1,5},{200025,0,1,5},{200026,0,1,5},{200027,0,1,5}, | S18: 200027 | T18: 圣战腰带 | U18: 1 | V18: 0 | W18: 1 | X18: 5 | Y18: ="{"&RC[-6]&","&RC[-3]&","&RC[-2]&","&RC[-1]&"}," -> {200027,0,1,5}, | Z18: =R[-1]C&RC[-1] -> {200010,0,1,50},{200011,0,1,50},{200012,0,1,50},{200013,0,1,50},{200015,0,1,50},{200016,0,1,50},{200017,0,1,50},{200019,0,1,50},{200020,0,1,2},{200021,0,1,5},{200022,0,1,5},{200023,0,1,5},{200025,0,1,5},{200026,0,1,5},{200027,0,1,5},
A19: 201002 | B19: 金戒指 | C19: 1 | D19: 0 | E19: 1 | F19: 30 | G19: ="{"&RC[-6]&","&RC[-3]&","&RC[-2]&","&RC[-1]&"}," -> {201002,0,1,30}, | H19: =R[-1]C&RC[-1] -> {200000,0,1,30},{200001,0,1,30},{200002,0,1,30},{200003,0,1,30},{200006,0,1,30},{200010,0,1,5},{200011,0,1,10},{200012,0,1,10},{200013,0,1,10},{200015,0,1,10},{200016,0,1,10},{200017,0,1,10},{200019,0,1,10},{201000,0,1,30},{201001,0,1,30},{201002,0,1,30}, | J19: 200029 | K19: 圣战鞋子 | L19: 1 | M19: 0 | N19: 1 | O19: 5 | P19: ="{"&RC[-6]&","&RC[-3]&","&RC[-2]&","&RC[-1]&"}," -> {200029,0,1,5}, | Q19: =R[-1]C&RC[-1] -> {200010,0,1,60},{200011,0,1,60},{200012,0,1,60},{200013,0,1,60},{200015,0,1,60},{200016,0,1,60},{200017,0,1,60},{200019,0,1,60},{200020,0,1,2},{200021,0,1,5},{200022,0,1,5},{200023,0,1,5},{200025,0,1,5},{200026,0,1,5},{200027,0,1,5},{200029,0,1,5}, | S19: 200029 | T19: 圣战鞋子 | U19: 1 | V19: 0 | W19: 1 | X19: 5 | Y19: ="{"&RC[-6]&","&RC[-3]&","&RC[-2]&","&RC[-1]&"}," -> {200029,0,1,5}, | Z19: =R[-1]C&RC[-1] -> {200010,0,1,50},{200011,0,1,50},{200012,0,1,50},{200013,0,1,50},{200015,0,1,50},{200016,0,1,50},{200017,0,1,50},{200019,0,1,50},{200020,0,1,2},{200021,0,1,5},{200022,0,1,5},{200023,0,1,5},{200025,0,1,5},{200026,0,1,5},{200027,0,1,5},{200029,0,1,5},
A20: 201003 | B20: 魔法手镯 | C20: 1 | D20: 0 | E20: 1 | F20: 30 | G20: ="{"&RC[-6]&","&RC[-3]&","&RC[-2]&","&RC[-1]&"}," -> {201003,0,1,30}, | H20: =R[-1]C&RC[-1] -> {200000,0,1,30},{200001,0,1,30},{200002,0,1,30},{200003,0,1,30},{200006,0,1,30},{200010,0,1,5},{200011,0,1,10},{200012,0,1,10},{200013,0,1,10},{200015,0,1,10},{200016,0,1,10},{200017,0,1,10},{200019,0,1,10},{201000,0,1,30},{201001,0,1,30},{201002,0,1,30},{201003,0,1,30}, | J20: 201010 | K20: 魔杖 | L20: 1 | M20: 0 | N20: 1 | O20: 60 | P20: ="{"&RC[-6]&","&RC[-3]&","&RC[-2]&","&RC[-1]&"}," -> {201010,0,1,60}, | Q20: =R[-1]C&RC[-1] -> {200010,0,1,60},{200011,0,1,60},{200012,0,1,60},{200013,0,1,60},{200015,0,1,60},{200016,0,1,60},{200017,0,1,60},{200019,0,1,60},{200020,0,1,2},{200021,0,1,5},{200022,0,1,5},{200023,0,1,5},{200025,0,1,5},{200026,0,1,5},{200027,0,1,5},{200029,0,1,5},{201010,0,1,60}, | S20: 201010 | T20: 魔杖 | U20: 1 | V20: 0 | W20: 1 | X20: 50 | Y20: ="{"&RC[-6]&","&RC[-3]&","&RC[-2]&","&RC[-1]&"}," -> {201010,0,1,50}, | Z20: =R[-1]C&RC[-1] -> {200010,0,1,50},{200011,0,1,50},{200012,0,1,50},{200013,0,1,50},{200015,0,1,50},{200016,0,1,50},{200017,0,1,50},{200019,0,1,50},{200020,0,1,2},{200021,0,1,5},{200022,0,1,5},{200023,0,1,5},{200025,0,1,5},{200026,0,1,5},{200027,0,1,5},{200029,0,1,5},{201010,0,1,50},
A21: 201006 | B21: 放大镜 | C21: 1 | D21: 0 | E21: 1 | F21: 30 | G21: ="{"&RC[-6]&","&RC[-3]&","&RC[-2]&","&RC[-1]&"}," -> {201006,0,1,30}, | H21: =R[-1]C&RC[-1] -> {200000,0,1,30},{200001,0,1,30},{200002,0,1,30},{200003,0,1,30},{200006,0,1,30},{200010,0,1,5},{200011,0,1,10},{200012,0,1,10},{200013,0,1,10},{200015,0,1,10},{200016,0,1,10},{200017,0,1,10},{200019,0,1,10},{201000,0,1,30},{201001,0,1,30},{201002,0,1,30},{201003,0,1,30},{201006,0,1,30}, | J21: 201011 | K21: 恶魔铃铛 | L21: 1 | M21: 0 | N21: 1 | O21: 60 | P21: ="{"&RC[-6]&","&RC[-3]&","&RC[-2]&","&RC[-1]&"}," -> {201011,0,1,60}, | Q21: =R[-1]C&RC[-1] -> {200010,0,1,60},{200011,0,1,60},{200012,0,1,60},{200013,0,1,60},{200015,0,1,60},{200016,0,1,60},{200017,0,1,60},{200019,0,1,60},{200020,0,1,2},{200021,0,1,5},{200022,0,1,5},{200023,0,1,5},{200025,0,1,5},{200026,0,1,5},{200027,0,1,5},{200029,0,1,5},{201010,0,1,60},{201011,0,1,60}, | S21: 201011 | T21: 恶魔铃铛 | U21: 1 | V21: 0 | W21: 1 | X21: 50 | Y21: ="{"&RC[-6]&","&RC[-3]&","&RC[-2]&","&RC[-1]&"}," -> {201011,0,1,50}, | Z21: =R[-1]C&RC[-1] -> {200010,0,1,50},{200011,0,1,50},{200012,0,1,50},{200013,0,1,50},{200015,0,1,50},{200016,0,1,50},{200017,0,1,50},{200019,0,1,50},{200020,0,1,2},{200021,0,1,5},{200022,0,1,5},{200023,0,1,5},{200025,0,1,5},{200026,0,1,5},{200027,0,1,5},{200029,0,1,5},{201010,0,1,50},{201011,0,1,50},
A22: 201010 | B22: 魔杖 | C22: 1 | D22: 0 | E22: 1 | F22: 5 | G22: ="{"&RC[-6]&","&RC[-3]&","&RC[-2]&","&RC[-1]&"}," -> {201010,0,1,5}, | H22: =R[-1]C&RC[-1] -> {200000,0,1,30},{200001,0,1,30},{200002,0,1,30},{200003,0,1,30},{200006,0,1,30},{200010,0,1,5},{200011,0,1,10},{200012,0,1,10},{200013,0,1,10},{200015,0,1,10},{200016,0,1,10},{200017,0,1,10},{200019,0,1,10},{201000,0,1,30},{201001,0,1,30},{201002,0,1,30},{201003,0,1,30},{201006,0,1,30},{201010,0,1,5}, | J22: 201012 | K22: 恶魔长袍 | L22: 1 | M22: 0 | N22: 1 | O22: 60 | P22: ="{"&RC[-6]&","&RC[-3]&","&RC[-2]&","&RC[-1]&"}," -> {201012,0,1,60}, | Q22: =R[-1]C&RC[-1] -> {200010,0,1,60},{200011,0,1,60},{200012,0,1,60},{200013,0,1,60},{200015,0,1,60},{200016,0,1,60},{200017,0,1,60},{200019,0,1,60},{200020,0,1,2},{200021,0,1,5},{200022,0,1,5},{200023,0,1,5},{200025,0,1,5},{200026,0,1,5},{200027,0,1,5},{200029,0,1,5},{201010,0,1,60},{201011,0,1,60},{201012,0,1,60}, | S22: 201012 | T22: 恶魔长袍 | U22: 1 | V22: 0 | W22: 1 | X22: 50 | Y22: ="{"&RC[-6]&","&RC[-3]&","&RC[-2]&","&RC[-1]&"}," -> {201012,0,1,50}, | Z22: =R[-1]C&RC[-1] -> {200010,0,1,50},{200011,0,1,50},{200012,0,1,50},{200013,0,1,50},{200015,0,1,50},{200016,0,1,50},{200017,0,1,50},{200019,0,1,50},{200020,0,1,2},{200021,0,1,5},{200022,0,1,5},{200023,0,1,5},{200025,0,1,5},{200026,0,1,5},{200027,0,1,5},{200029,0,1,5},{201010,0,1,50},{201011,0,1,50},{201012,0,1,50},
A23: 201011 | B23: 恶魔铃铛 | C23: 1 | D23: 0 | E23: 1 | F23: 10 | G23: ="{"&RC[-6]&","&RC[-3]&","&RC[-2]&","&RC[-1]&"}," -> {201011,0,1,10}, | H23: =R[-1]C&RC[-1] -> {200000,0,1,30},{200001,0,1,30},{200002,0,1,30},{200003,0,1,30},{200006,0,1,30},{200010,0,1,5},{200011,0,1,10},{200012,0,1,10},{200013,0,1,10},{200015,0,1,10},{200016,0,1,10},{200017,0,1,10},{200019,0,1,10},{201000,0,1,30},{201001,0,1,30},{201002,0,1,30},{201003,0,1,30},{201006,0,1,30},{201010,0,1,5},{201011,0,1,10}, | J23: 201013 | K23: 紫碧螺 | L23: 1 | M23: 0 | N23: 1 | O23: 60 | P23: ="{"&RC[-6]&","&RC[-3]&","&RC[-2]&","&RC[-1]&"}," -> {201013,0,1,60}, | Q23: =R[-1]C&RC[-1] -> {200010,0,1,60},{200011,0,1,60},{200012,0,1,60},{200013,0,1,60},{200015,0,1,60},{200016,0,1,60},{200017,0,1,60},{200019,0,1,60},{200020,0,1,2},{200021,0,1,5},{200022,0,1,5},{200023,0,1,5},{200025,0,1,5},{200026,0,1,5},{200027,0,1,5},{200029,0,1,5},{201010,0,1,60},{201011,0,1,60},{201012,0,1,60},{201013,0,1,60}, | S23: 201013 | T23: 紫碧螺 | U23: 1 | V23: 0 | W23: 1 | X23: 50 | Y23: ="{"&RC[-6]&","&RC[-3]&","&RC[-2]&","&RC[-1]&"}," -> {201013,0,1,50}, | Z23: =R[-1]C&RC[-1] -> {200010,0,1,50},{200011,0,1,50},{200012,0,1,50},{200013,0,1,50},{200015,0,1,50},{200016,0,1,50},{200017,0,1,50},{200019,0,1,50},{200020,0,1,2},{200021,0,1,5},{200022,0,1,5},{200023,0,1,5},{200025,0,1,5},{200026,0,1,5},{200027,0,1,5},{200029,0,1,5},{201010,0,1,50},{201011,0,1,50},{201012,0,1,50},{201013,0,1,50},
A24: 201012 | B24: 恶魔长袍 | C24: 1 | D24: 0 | E24: 1 | F24: 10 | G24: ="{"&RC[-6]&","&RC[-3]&","&RC[-2]&","&RC[-1]&"}," -> {201012,0,1,10}, | H24: =R[-1]C&RC[-1] -> {200000,0,1,30},{200001,0,1,30},{200002,0,1,30},{200003,0,1,30},{200006,0,1,30},{200010,0,1,5},{200011,0,1,10},{200012,0,1,10},{200013,0,1,10},{200015,0,1,10},{200016,0,1,10},{200017,0,1,10},{200019,0,1,10},{201000,0,1,30},{201001,0,1,30},{201002,0,1,30},{201003,0,1,30},{201006,0,1,30},{201010,0,1,5},{201011,0,1,10},{201012,0,1,10}, | J24: 201015 | K24: 法师头盔 | L24: 1 | M24: 0 | N24: 1 | O24: 60 | P24: ="{"&RC[-6]&","&RC[-3]&","&RC[-2]&","&RC[-1]&"}," -> {201015,0,1,60}, | Q24: =R[-1]C&RC[-1] -> {200010,0,1,60},{200011,0,1,60},{200012,0,1,60},{200013,0,1,60},{200015,0,1,60},{200016,0,1,60},{200017,0,1,60},{200019,0,1,60},{200020,0,1,2},{200021,0,1,5},{200022,0,1,5},{200023,0,1,5},{200025,0,1,5},{200026,0,1,5},{200027,0,1,5},{200029,0,1,5},{201010,0,1,60},{201011,0,1,60},{201012,0,1,60},{201013,0,1,60},{201015,0,1,60}, | S24: 201015 | T24: 法师头盔 | U24: 1 | V24: 0 | W24: 1 | X24: 50 | Y24: ="{"&RC[-6]&","&RC[-3]&","&RC[-2]&","&RC[-1]&"}," -> {201015,0,1,50}, | Z24: =R[-1]C&RC[-1] -> {200010,0,1,50},{200011,0,1,50},{200012,0,1,50},{200013,0,1,50},{200015,0,1,50},{200016,0,1,50},{200017,0,1,50},{200019,0,1,50},{200020,0,1,2},{200021,0,1,5},{200022,0,1,5},{200023,0,1,5},{200025,0,1,5},{200026,0,1,5},{200027,0,1,5},{200029,0,1,5},{201010,0,1,50},{201011,0,1,50},{201012,0,1,50},{201013,0,1,50},{201015,0,1,50},
A25: 201013 | B25: 紫碧螺 | C25: 1 | D25: 0 | E25: 1 | F25: 10 | G25: ="{"&RC[-6]&","&RC[-3]&","&RC[-2]&","&RC[-1]&"}," -> {201013,0,1,10}, | H25: =R[-1]C&RC[-1] -> {200000,0,1,30},{200001,0,1,30},{200002,0,1,30},{200003,0,1,30},{200006,0,1,30},{200010,0,1,5},{200011,0,1,10},{200012,0,1,10},{200013,0,1,10},{200015,0,1,10},{200016,0,1,10},{200017,0,1,10},{200019,0,1,10},{201000,0,1,30},{201001,0,1,30},{201002,0,1,30},{201003,0,1,30},{201006,0,1,30},{201010,0,1,5},{201011,0,1,10},{201012,0,1,10},{201013,0,1,10}, | J25: 201016 | K25: 龙之手镯 | L25: 1 | M25: 0 | N25: 1 | O25: 60 | P25: ="{"&RC[-6]&","&RC[-3]&","&RC[-2]&","&RC[-1]&"}," -> {201016,0,1,60}, | Q25: =R[-1]C&RC[-1] -> {200010,0,1,60},{200011,0,1,60},{200012,0,1,60},{200013,0,1,60},{200015,0,1,60},{200016,0,1,60},{200017,0,1,60},{200019,0,1,60},{200020,0,1,2},{200021,0,1,5},{200022,0,1,5},{200023,0,1,5},{200025,0,1,5},{200026,0,1,5},{200027,0,1,5},{200029,0,1,5},{201010,0,1,60},{201011,0,1,60},{201012,0,1,60},{201013,0,1,60},{201015,0,1,60},{201016,0,1,60}, | S25: 201016 | T25: 龙之手镯 | U25: 1 | V25: 0 | W25: 1 | X25: 50 | Y25: ="{"&RC[-6]&","&RC[-3]&","&RC[-2]&","&RC[-1]&"}," -> {201016,0,1,50}, | Z25: =R[-1]C&RC[-1] -> {200010,0,1,50},{200011,0,1,50},{200012,0,1,50},{200013,0,1,50},{200015,0,1,50},{200016,0,1,50},{200017,0,1,50},{200019,0,1,50},{200020,0,1,2},{200021,0,1,5},{200022,0,1,5},{200023,0,1,5},{200025,0,1,5},{200026,0,1,5},{200027,0,1,5},{200029,0,1,5},{201010,0,1,50},{201011,0,1,50},{201012,0,1,50},{201013,0,1,50},{201015,0,1,50},{201016,0,1,50},
A26: 201015 | B26: 法师头盔 | C26: 1 | D26: 0 | E26: 1 | F26: 10 | G26: ="{"&RC[-6]&","&RC[-3]&","&RC[-2]&","&RC[-1]&"}," -> {201015,0,1,10}, | H26: =R[-1]C&RC[-1] -> {200000,0,1,30},{200001,0,1,30},{200002,0,1,30},{200003,0,1,30},{200006,0,1,30},{200010,0,1,5},{200011,0,1,10},{200012,0,1,10},{200013,0,1,10},{200015,0,1,10},{200016,0,1,10},{200017,0,1,10},{200019,0,1,10},{201000,0,1,30},{201001,0,1,30},{201002,0,1,30},{201003,0,1,30},{201006,0,1,30},{201010,0,1,5},{201011,0,1,10},{201012,0,1,10},{201013,0,1,10},{201015,0,1,10}, | J26: 201017 | K26: 法师腰带 | L26: 1 | M26: 0 | N26: 1 | O26: 60 | P26: ="{"&RC[-6]&","&RC[-3]&","&RC[-2]&","&RC[-1]&"}," -> {201017,0,1,60}, | Q26: =R[-1]C&RC[-1] -> {200010,0,1,60},{200011,0,1,60},{200012,0,1,60},{200013,0,1,60},{200015,0,1,60},{200016,0,1,60},{200017,0,1,60},{200019,0,1,60},{200020,0,1,2},{200021,0,1,5},{200022,0,1,5},{200023,0,1,5},{200025,0,1,5},{200026,0,1,5},{200027,0,1,5},{200029,0,1,5},{201010,0,1,60},{201011,0,1,60},{201012,0,1,60},{201013,0,1,60},{201015,0,1,60},{201016,0,1,60},{201017,0,1,60}, | S26: 201017 | T26: 法师腰带 | U26: 1 | V26: 0 | W26: 1 | X26: 50 | Y26: ="{"&RC[-6]&","&RC[-3]&","&RC[-2]&","&RC[-1]&"}," -> {201017,0,1,50}, | Z26: =R[-1]C&RC[-1] -> {200010,0,1,50},{200011,0,1,50},{200012,0,1,50},{200013,0,1,50},{200015,0,1,50},{200016,0,1,50},{200017,0,1,50},{200019,0,1,50},{200020,0,1,2},{200021,0,1,5},{200022,0,1,5},{200023,0,1,5},{200025,0,1,5},{200026,0,1,5},{200027,0,1,5},{200029,0,1,5},{201010,0,1,50},{201011,0,1,50},{201012,0,1,50},{201013,0,1,50},{201015,0,1,50},{201016,0,1,50},{201017,0,1,50},
A27: 201016 | B27: 龙之手镯 | C27: 1 | D27: 0 | E27: 1 | F27: 10 | G27: ="{"&RC[-6]&","&RC[-3]&","&RC[-2]&","&RC[-1]&"}," -> {201016,0,1,10}, | H27: =R[-1]C&RC[-1] -> {200000,0,1,30},{200001,0,1,30},{200002,0,1,30},{200003,0,1,30},{200006,0,1,30},{200010,0,1,5},{200011,0,1,10},{200012,0,1,10},{200013,0,1,10},{200015,0,1,10},{200016,0,1,10},{200017,0,1,10},{200019,0,1,10},{201000,0,1,30},{201001,0,1,30},{201002,0,1,30},{201003,0,1,30},{201006,0,1,30},{201010,0,1,5},{201011,0,1,10},{201012,0,1,10},{201013,0,1,10},{201015,0,1,10},{201016,0,1,10}, | J27: 201019 | K27: 法师鞋子 | L27: 1 | M27: 0 | N27: 1 | O27: 60 | P27: ="{"&RC[-6]&","&RC[-3]&","&RC[-2]&","&RC[-1]&"}," -> {201019,0,1,60}, | Q27: =R[-1]C&RC[-1] -> {200010,0,1,60},{200011,0,1,60},{200012,0,1,60},{200013,0,1,60},{200015,0,1,60},{200016,0,1,60},{200017,0,1,60},{200019,0,1,60},{200020,0,1,2},{200021,0,1,5},{200022,0,1,5},{200023,0,1,5},{200025,0,1,5},{200026,0,1,5},{200027,0,1,5},{200029,0,1,5},{201010,0,1,60},{201011,0,1,60},{201012,0,1,60},{201013,0,1,60},{201015,0,1,60},{201016,0,1,60},{201017,0,1,60},{201019,0,1,60}, | S27: 201019 | T27: 法师鞋子 | U27: 1 | V27: 0 | W27: 1 | X27: 50 | Y27: ="{"&RC[-6]&","&RC[-3]&","&RC[-2]&","&RC[-1]&"}," -> {201019,0,1,50}, | Z27: =R[-1]C&RC[-1] -> {200010,0,1,50},{200011,0,1,50},{200012,0,1,50},{200013,0,1,50},{200015,0,1,50},{200016,0,1,50},{200017,0,1,50},{200019,0,1,50},{200020,0,1,2},{200021,0,1,5},{200022,0,1,5},{200023,0,1,5},{200025,0,1,5},{200026,0,1,5},{200027,0,1,5},{200029,0,1,5},{201010,0,1,50},{201011,0,1,50},{201012,0,1,50},{201013,0,1,50},{201015,0,1,50},{201016,0,1,50},{201017,0,1,50},{201019,0,1,50},
A28: 201017 | B28: 法师腰带 | C28: 1 | D28: 0 | E28: 1 | F28: 10 | G28: ="{"&RC[-6]&","&RC[-3]&","&RC[-2]&","&RC[-1]&"}," -> {201017,0,1,10}, | H28: =R[-1]C&RC[-1] -> {200000,0,1,30},{200001,0,1,30},{200002,0,1,30},{200003,0,1,30},{200006,0,1,30},{200010,0,1,5},{200011,0,1,10},{200012,0,1,10},{200013,0,1,10},{200015,0,1,10},{200016,0,1,10},{200017,0,1,10},{200019,0,1,10},{201000,0,1,30},{201001,0,1,30},{201002,0,1,30},{201003,0,1,30},{201006,0,1,30},{201010,0,1,5},{201011,0,1,10},{201012,0,1,10},{201013,0,1,10},{201015,0,1,10},{201016,0,1,10},{201017,0,1,10}, | J28: 201020 | K28: 骨玉 | L28: 1 | M28: 0 | N28: 1 | O28: 2 | P28: ="{"&RC[-6]&","&RC[-3]&","&RC[-2]&","&RC[-1]&"}," -> {201020,0,1,2}, | Q28: =R[-1]C&RC[-1] -> {200010,0,1,60},{200011,0,1,60},{200012,0,1,60},{200013,0,1,60},{200015,0,1,60},{200016,0,1,60},{200017,0,1,60},{200019,0,1,60},{200020,0,1,2},{200021,0,1,5},{200022,0,1,5},{200023,0,1,5},{200025,0,1,5},{200026,0,1,5},{200027,0,1,5},{200029,0,1,5},{201010,0,1,60},{201011,0,1,60},{201012,0,1,60},{201013,0,1,60},{201015,0,1,60},{201016,0,1,60},{201017,0,1,60},{201019,0,1,60},{201020,0,1,2}, | S28: 201020 | T28: 骨玉 | U28: 1 | V28: 0 | W28: 1 | X28: 2 | Y28: ="{"&RC[-6]&","&RC[-3]&","&RC[-2]&","&RC[-1]&"}," -> {201020,0,1,2}, | Z28: =R[-1]C&RC[-1] -> {200010,0,1,50},{200011,0,1,50},{200012,0,1,50},{200013,0,1,50},{200015,0,1,50},{200016,0,1,50},{200017,0,1,50},{200019,0,1,50},{200020,0,1,2},{200021,0,1,5},{200022,0,1,5},{200023,0,1,5},{200025,0,1,5},{200026,0,1,5},{200027,0,1,5},{200029,0,1,5},{201010,0,1,50},{201011,0,1,50},{201012,0,1,50},{201013,0,1,50},{201015,0,1,50},{201016,0,1,50},{201017,0,1,50},{201019,0,1,50},{201020,0,1,2},
A29: 201019 | B29: 法师鞋子 | C29: 1 | D29: 0 | E29: 1 | F29: 10 | G29: ="{"&RC[-6]&","&RC[-3]&","&RC[-2]&","&RC[-1]&"}," -> {201019,0,1,10}, | H29: =R[-1]C&RC[-1] -> {200000,0,1,30},{200001,0,1,30},{200002,0,1,30},{200003,0,1,30},{200006,0,1,30},{200010,0,1,5},{200011,0,1,10},{200012,0,1,10},{200013,0,1,10},{200015,0,1,10},{200016,0,1,10},{200017,0,1,10},{200019,0,1,10},{201000,0,1,30},{201001,0,1,30},{201002,0,1,30},{201003,0,1,30},{201006,0,1,30},{201010,0,1,5},{201011,0,1,10},{201012,0,1,10},{201013,0,1,10},{201015,0,1,10},{201016,0,1,10},{201017,0,1,10},{201019,0,1,10}, | J29: 201021 | K29: 法神披风 | L29: 1 | M29: 0 | N29: 1 | O29: 5 | P29: ="{"&RC[-6]&","&RC[-3]&","&RC[-2]&","&RC[-1]&"}," -> {201021,0,1,5}, | Q29: =R[-1]C&RC[-1] -> {200010,0,1,60},{200011,0,1,60},{200012,0,1,60},{200013,0,1,60},{200015,0,1,60},{200016,0,1,60},{200017,0,1,60},{200019,0,1,60},{200020,0,1,2},{200021,0,1,5},{200022,0,1,5},{200023,0,1,5},{200025,0,1,5},{200026,0,1,5},{200027,0,1,5},{200029,0,1,5},{201010,0,1,60},{201011,0,1,60},{201012,0,1,60},{201013,0,1,60},{201015,0,1,60},{201016,0,1,60},{201017,0,1,60},{201019,0,1,60},{201020,0,1,2},{201021,0,1,5}, | S29: 201021 | T29: 法神披风 | U29: 1 | V29: 0 | W29: 1 | X29: 5 | Y29: ="{"&RC[-6]&","&RC[-3]&","&RC[-2]&","&RC[-1]&"}," -> {201021,0,1,5}, | Z29: =R[-1]C&RC[-1] -> {200010,0,1,50},{200011,0,1,50},{200012,0,1,50},{200013,0,1,50},{200015,0,1,50},{200016,0,1,50},{200017,0,1,50},{200019,0,1,50},{200020,0,1,2},{200021,0,1,5},{200022,0,1,5},{200023,0,1,5},{200025,0,1,5},{200026,0,1,5},{200027,0,1,5},{200029,0,1,5},{201010,0,1,50},{201011,0,1,50},{201012,0,1,50},{201013,0,1,50},{201015,0,1,50},{201016,0,1,50},{201017,0,1,50},{201019,0,1,50},{201020,0,1,2},{201021,0,1,5},
A30: 202000 | B30: 半月 | C30: 1 | D30: 0 | E30: 1 | F30: 30 | G30: ="{"&RC[-6]&","&RC[-3]&","&RC[-2]&","&RC[-1]&"}," -> {202000,0,1,30}, | H30: =R[-1]C&RC[-1] -> {200000,0,1,30},{200001,0,1,30},{200002,0,1,30},{200003,0,1,30},{200006,0,1,30},{200010,0,1,5},{200011,0,1,10},{200012,0,1,10},{200013,0,1,10},{200015,0,1,10},{200016,0,1,10},{200017,0,1,10},{200019,0,1,10},{201000,0,1,30},{201001,0,1,30},{201002,0,1,30},{201003,0,1,30},{201006,0,1,30},{201010,0,1,5},{201011,0,1,10},{201012,0,1,10},{201013,0,1,10},{201015,0,1,10},{201016,0,1,10},{201017,0,1,10},{201019,0,1,10},{202000,0,1,30}, | J30: 201022 | K30: 法神项链 | L30: 1 | M30: 0 | N30: 1 | O30: 5 | P30: ="{"&RC[-6]&","&RC[-3]&","&RC[-2]&","&RC[-1]&"}," -> {201022,0,1,5}, | Q30: =R[-1]C&RC[-1] -> {200010,0,1,60},{200011,0,1,60},{200012,0,1,60},{200013,0,1,60},{200015,0,1,60},{200016,0,1,60},{200017,0,1,60},{200019,0,1,60},{200020,0,1,2},{200021,0,1,5},{200022,0,1,5},{200023,0,1,5},{200025,0,1,5},{200026,0,1,5},{200027,0,1,5},{200029,0,1,5},{201010,0,1,60},{201011,0,1,60},{201012,0,1,60},{201013,0,1,60},{201015,0,1,60},{201016,0,1,60},{201017,0,1,60},{201019,0,1,60},{201020,0,1,2},{201021,0,1,5},{201022,0,1,5}, | S30: 201022 | T30: 法神项链 | U30: 1 | V30: 0 | W30: 1 | X30: 5 | Y30: ="{"&RC[-6]&","&RC[-3]&","&RC[-2]&","&RC[-1]&"}," -> {201022,0,1,5}, | Z30: =R[-1]C&RC[-1] -> {200010,0,1,50},{200011,0,1,50},{200012,0,1,50},{200013,0,1,50},{200015,0,1,50},{200016,0,1,50},{200017,0,1,50},{200019,0,1,50},{200020,0,1,2},{200021,0,1,5},{200022,0,1,5},{200023,0,1,5},{200025,0,1,5},{200026,0,1,5},{200027,0,1,5},{200029,0,1,5},{201010,0,1,50},{201011,0,1,50},{201012,0,1,50},{201013,0,1,50},{201015,0,1,50},{201016,0,1,50},{201017,0,1,50},{201019,0,1,50},{201020,0,1,2},{201021,0,1,5},{201022,0,1,5},
A31: 202001 | B31: 轻盔 | C31: 1 | D31: 0 | E31: 1 | F31: 30 | G31: ="{"&RC[-6]&","&RC[-3]&","&RC[-2]&","&RC[-1]&"}," -> {202001,0,1,30}, | H31: =R[-1]C&RC[-1] -> {200000,0,1,30},{200001,0,1,30},{200002,0,1,30},{200003,0,1,30},{200006,0,1,30},{200010,0,1,5},{200011,0,1,10},{200012,0,1,10},{200013,0,1,10},{200015,0,1,10},{200016,0,1,10},{200017,0,1,10},{200019,0,1,10},{201000,0,1,30},{201001,0,1,30},{201002,0,1,30},{201003,0,1,30},{201006,0,1,30},{201010,0,1,5},{201011,0,1,10},{201012,0,1,10},{201013,0,1,10},{201015,0,1,10},{201016,0,1,10},{201017,0,1,10},{201019,0,1,10},{202000,0,1,30},{202001,0,1,30}, | J31: 201023 | K31: 法神戒指 | L31: 1 | M31: 0 | N31: 1 | O31: 5 | P31: ="{"&RC[-6]&","&RC[-3]&","&RC[-2]&","&RC[-1]&"}," -> {201023,0,1,5}, | Q31: =R[-1]C&RC[-1] -> {200010,0,1,60},{200011,0,1,60},{200012,0,1,60},{200013,0,1,60},{200015,0,1,60},{200016,0,1,60},{200017,0,1,60},{200019,0,1,60},{200020,0,1,2},{200021,0,1,5},{200022,0,1,5},{200023,0,1,5},{200025,0,1,5},{200026,0,1,5},{200027,0,1,5},{200029,0,1,5},{201010,0,1,60},{201011,0,1,60},{201012,0,1,60},{201013,0,1,60},{201015,0,1,60},{201016,0,1,60},{201017,0,1,60},{201019,0,1,60},{201020,0,1,2},{201021,0,1,5},{201022,0,1,5},{201023,0,1,5}, | S31: 201023 | T31: 法神戒指 | U31: 1 | V31: 0 | W31: 1 | X31: 5 | Y31: ="{"&RC[-6]&","&RC[-3]&","&RC[-2]&","&RC[-1]&"}," -> {201023,0,1,5}, | Z31: =R[-1]C&RC[-1] -> {200010,0,1,50},{200011,0,1,50},{200012,0,1,50},{200013,0,1,50},{200015,0,1,50},{200016,0,1,50},{200017,0,1,50},{200019,0,1,50},{200020,0,1,2},{200021,0,1,5},{200022,0,1,5},{200023,0,1,5},{200025,0,1,5},{200026,0,1,5},{200027,0,1,5},{200029,0,1,5},{201010,0,1,50},{201011,0,1,50},{201012,0,1,50},{201013,0,1,50},{201015,0,1,50},{201016,0,1,50},{201017,0,1,50},{201019,0,1,50},{201020,0,1,2},{201021,0,1,5},{201022,0,1,5},{201023,0,1,5},
A32: 202002 | B32: 铂金戒指 | C32: 1 | D32: 0 | E32: 1 | F32: 30 | G32: ="{"&RC[-6]&","&RC[-3]&","&RC[-2]&","&RC[-1]&"}," -> {202002,0,1,30}, | H32: =R[-1]C&RC[-1] -> {200000,0,1,30},{200001,0,1,30},{200002,0,1,30},{200003,0,1,30},{200006,0,1,30},{200010,0,1,5},{200011,0,1,10},{200012,0,1,10},{200013,0,1,10},{200015,0,1,10},{200016,0,1,10},{200017,0,1,10},{200019,0,1,10},{201000,0,1,30},{201001,0,1,30},{201002,0,1,30},{201003,0,1,30},{201006,0,1,30},{201010,0,1,5},{201011,0,1,10},{201012,0,1,10},{201013,0,1,10},{201015,0,1,10},{201016,0,1,10},{201017,0,1,10},{201019,0,1,10},{202000,0,1,30},{202001,0,1,30},{202002,0,1,30}, | J32: 201025 | K32: 法神头盔 | L32: 1 | M32: 0 | N32: 1 | O32: 5 | P32: ="{"&RC[-6]&","&RC[-3]&","&RC[-2]&","&RC[-1]&"}," -> {201025,0,1,5}, | Q32: =R[-1]C&RC[-1] -> {200010,0,1,60},{200011,0,1,60},{200012,0,1,60},{200013,0,1,60},{200015,0,1,60},{200016,0,1,60},{200017,0,1,60},{200019,0,1,60},{200020,0,1,2},{200021,0,1,5},{200022,0,1,5},{200023,0,1,5},{200025,0,1,5},{200026,0,1,5},{200027,0,1,5},{200029,0,1,5},{201010,0,1,60},{201011,0,1,60},{201012,0,1,60},{201013,0,1,60},{201015,0,1,60},{201016,0,1,60},{201017,0,1,60},{201019,0,1,60},{201020,0,1,2},{201021,0,1,5},{201022,0,1,5},{201023,0,1,5},{201025,0,1,5}, | S32: 201025 | T32: 法神头盔 | U32: 1 | V32: 0 | W32: 1 | X32: 5 | Y32: ="{"&RC[-6]&","&RC[-3]&","&RC[-2]&","&RC[-1]&"}," -> {201025,0,1,5}, | Z32: =R[-1]C&RC[-1] -> {200010,0,1,50},{200011,0,1,50},{200012,0,1,50},{200013,0,1,50},{200015,0,1,50},{200016,0,1,50},{200017,0,1,50},{200019,0,1,50},{200020,0,1,2},{200021,0,1,5},{200022,0,1,5},{200023,0,1,5},{200025,0,1,5},{200026,0,1,5},{200027,0,1,5},{200029,0,1,5},{201010,0,1,50},{201011,0,1,50},{201012,0,1,50},{201013,0,1,50},{201015,0,1,50},{201016,0,1,50},{201017,0,1,50},{201019,0,1,50},{201020,0,1,2},{201021,0,1,5},{201022,0,1,5},{201023,0,1,5},{201025,0,1,5},
A33: 202003 | B33: 三眼手镯 | C33: 1 | D33: 0 | E33: 1 | F33: 30 | G33: ="{"&RC[-6]&","&RC[-3]&","&RC[-2]&","&RC[-1]&"}," -> {202003,0,1,30}, | H33: =R[-1]C&RC[-1] -> {200000,0,1,30},{200001,0,1,30},{200002,0,1,30},{200003,0,1,30},{200006,0,1,30},{200010,0,1,5},{200011,0,1,10},{200012,0,1,10},{200013,0,1,10},{200015,0,1,10},{200016,0,1,10},{200017,0,1,10},{200019,0,1,10},{201000,0,1,30},{201001,0,1,30},{201002,0,1,30},{201003,0,1,30},{201006,0,1,30},{201010,0,1,5},{201011,0,1,10},{201012,0,1,10},{201013,0,1,10},{201015,0,1,10},{201016,0,1,10},{201017,0,1,10},{201019,0,1,10},{202000,0,1,30},{202001,0,1,30},{202002,0,1,30},{202003,0,1,30}, | J33: 201026 | K33: 法神手镯 | L33: 1 | M33: 0 | N33: 1 | O33: 5 | P33: ="{"&RC[-6]&","&RC[-3]&","&RC[-2]&","&RC[-1]&"}," -> {201026,0,1,5}, | Q33: =R[-1]C&RC[-1] -> {200010,0,1,60},{200011,0,1,60},{200012,0,1,60},{200013,0,1,60},{200015,0,1,60},{200016,0,1,60},{200017,0,1,60},{200019,0,1,60},{200020,0,1,2},{200021,0,1,5},{200022,0,1,5},{200023,0,1,5},{200025,0,1,5},{200026,0,1,5},{200027,0,1,5},{200029,0,1,5},{201010,0,1,60},{201011,0,1,60},{201012,0,1,60},{201013,0,1,60},{201015,0,1,60},{201016,0,1,60},{201017,0,1,60},{201019,0,1,60},{201020,0,1,2},{201021,0,1,5},{201022,0,1,5},{201023,0,1,5},{201025,0,1,5},{201026,0,1,5}, | S33: 201026 | T33: 法神手镯 | U33: 1 | V33: 0 | W33: 1 | X33: 5 | Y33: ="{"&RC[-6]&","&RC[-3]&","&RC[-2]&","&RC[-1]&"}," -> {201026,0,1,5}, | Z33: =R[-1]C&RC[-1] -> {200010,0,1,50},{200011,0,1,50},{200012,0,1,50},{200013,0,1,50},{200015,0,1,50},{200016,0,1,50},{200017,0,1,50},{200019,0,1,50},{200020,0,1,2},{200021,0,1,5},{200022,0,1,5},{200023,0,1,5},{200025,0,1,5},{200026,0,1,5},{200027,0,1,5},{200029,0,1,5},{201010,0,1,50},{201011,0,1,50},{201012,0,1,50},{201013,0,1,50},{201015,0,1,50},{201016,0,1,50},{201017,0,1,50},{201019,0,1,50},{201020,0,1,2},{201021,0,1,5},{201022,0,1,5},{201023,0,1,5},{201025,0,1,5},{201026,0,1,5},
A34: 202006 | B34: 凤凰明珠 | C34: 1 | D34: 0 | E34: 1 | F34: 30 | G34: ="{"&RC[-6]&","&RC[-3]&","&RC[-2]&","&RC[-1]&"}," -> {202006,0,1,30}, | H34: =R[-1]C&RC[-1] -> {200000,0,1,30},{200001,0,1,30},{200002,0,1,30},{200003,0,1,30},{200006,0,1,30},{200010,0,1,5},{200011,0,1,10},{200012,0,1,10},{200013,0,1,10},{200015,0,1,10},{200016,0,1,10},{200017,0,1,10},{200019,0,1,10},{201000,0,1,30},{201001,0,1,30},{201002,0,1,30},{201003,0,1,30},{201006,0,1,30},{201010,0,1,5},{201011,0,1,10},{201012,0,1,10},{201013,0,1,10},{201015,0,1,10},{201016,0,1,10},{201017,0,1,10},{201019,0,1,10},{202000,0,1,30},{202001,0,1,30},{202002,0,1,30},{202003,0,1,30},{202006,0,1,30}, | J34: 201027 | K34: 法神腰带 | L34: 1 | M34: 0 | N34: 1 | O34: 5 | P34: ="{"&RC[-6]&","&RC[-3]&","&RC[-2]&","&RC[-1]&"}," -> {201027,0,1,5}, | Q34: =R[-1]C&RC[-1] -> {200010,0,1,60},{200011,0,1,60},{200012,0,1,60},{200013,0,1,60},{200015,0,1,60},{200016,0,1,60},{200017,0,1,60},{200019,0,1,60},{200020,0,1,2},{200021,0,1,5},{200022,0,1,5},{200023,0,1,5},{200025,0,1,5},{200026,0,1,5},{200027,0,1,5},{200029,0,1,5},{201010,0,1,60},{201011,0,1,60},{201012,0,1,60},{201013,0,1,60},{201015,0,1,60},{201016,0,1,60},{201017,0,1,60},{201019,0,1,60},{201020,0,1,2},{201021,0,1,5},{201022,0,1,5},{201023,0,1,5},{201025,0,1,5},{201026,0,1,5},{201027,0,1,5}, | S34: 201027 | T34: 法神腰带 | U34: 1 | V34: 0 | W34: 1 | X34: 5 | Y34: ="{"&RC[-6]&","&RC[-3]&","&RC[-2]&","&RC[-1]&"}," -> {201027,0,1,5}, | Z34: =R[-1]C&RC[-1] -> {200010,0,1,50},{200011,0,1,50},{200012,0,1,50},{200013,0,1,50},{200015,0,1,50},{200016,0,1,50},{200017,0,1,50},{200019,0,1,50},{200020,0,1,2},{200021,0,1,5},{200022,0,1,5},{200023,0,1,5},{200025,0,1,5},{200026,0,1,5},{200027,0,1,5},{200029,0,1,5},{201010,0,1,50},{201011,0,1,50},{201012,0,1,50},{201013,0,1,50},{201015,0,1,50},{201016,0,1,50},{201017,0,1,50},{201019,0,1,50},{201020,0,1,2},{201021,0,1,5},{201022,0,1,5},{201023,0,1,5},{201025,0,1,5},{201026,0,1,5},{201027,0,1,5},
A35: 202010 | B35: 银蛇 | C35: 1 | D35: 0 | E35: 1 | F35: 5 | G35: ="{"&RC[-6]&","&RC[-3]&","&RC[-2]&","&RC[-1]&"}," -> {202010,0,1,5}, | H35: =R[-1]C&RC[-1] -> {200000,0,1,30},{200001,0,1,30},{200002,0,1,30},{200003,0,1,30},{200006,0,1,30},{200010,0,1,5},{200011,0,1,10},{200012,0,1,10},{200013,0,1,10},{200015,0,1,10},{200016,0,1,10},{200017,0,1,10},{200019,0,1,10},{201000,0,1,30},{201001,0,1,30},{201002,0,1,30},{201003,0,1,30},{201006,0,1,30},{201010,0,1,5},{201011,0,1,10},{201012,0,1,10},{201013,0,1,10},{201015,0,1,10},{201016,0,1,10},{201017,0,1,10},{201019,0,1,10},{202000,0,1,30},{202001,0,1,30},{202002,0,1,30},{202003,0,1,30},{202006,0,1,30},{202010,0,1,5}, | J35: 201029 | K35: 法神鞋子 | L35: 1 | M35: 0 | N35: 1 | O35: 5 | P35: ="{"&RC[-6]&","&RC[-3]&","&RC[-2]&","&RC[-1]&"}," -> {201029,0,1,5}, | Q35: =R[-1]C&RC[-1] -> {200010,0,1,60},{200011,0,1,60},{200012,0,1,60},{200013,0,1,60},{200015,0,1,60},{200016,0,1,60},{200017,0,1,60},{200019,0,1,60},{200020,0,1,2},{200021,0,1,5},{200022,0,1,5},{200023,0,1,5},{200025,0,1,5},{200026,0,1,5},{200027,0,1,5},{200029,0,1,5},{201010,0,1,60},{201011,0,1,60},{201012,0,1,60},{201013,0,1,60},{201015,0,1,60},{201016,0,1,60},{201017,0,1,60},{201019,0,1,60},{201020,0,1,2},{201021,0,1,5},{201022,0,1,5},{201023,0,1,5},{201025,0,1,5},{201026,0,1,5},{201027,0,1,5},{201029,0,1,5}, | S35: 201029 | T35: 法神鞋子 | U35: 1 | V35: 0 | W35: 1 | X35: 5 | Y35: ="{"&RC[-6]&","&RC[-3]&","&RC[-2]&","&RC[-1]&"}," -> {201029,0,1,5}, | Z35: =R[-1]C&RC[-1] -> {200010,0,1,50},{200011,0,1,50},{200012,0,1,50},{200013,0,1,50},{200015,0,1,50},{200016,0,1,50},{200017,0,1,50},{200019,0,1,50},{200020,0,1,2},{200021,0,1,5},{200022,0,1,5},{200023,0,1,5},{200025,0,1,5},{200026,0,1,5},{200027,0,1,5},{200029,0,1,5},{201010,0,1,50},{201011,0,1,50},{201012,0,1,50},{201013,0,1,50},{201015,0,1,50},{201016,0,1,50},{201017,0,1,50},{201019,0,1,50},{201020,0,1,2},{201021,0,1,5},{201022,0,1,5},{201023,0,1,5},{201025,0,1,5},{201026,0,1,5},{201027,0,1,5},{201029,0,1,5},
A36: 202011 | B36: 天珠道链 | C36: 1 | D36: 0 | E36: 1 | F36: 10 | G36: ="{"&RC[-6]&","&RC[-3]&","&RC[-2]&","&RC[-1]&"}," -> {202011,0,1,10}, | H36: =R[-1]C&RC[-1] -> {200000,0,1,30},{200001,0,1,30},{200002,0,1,30},{200003,0,1,30},{200006,0,1,30},{200010,0,1,5},{200011,0,1,10},{200012,0,1,10},{200013,0,1,10},{200015,0,1,10},{200016,0,1,10},{200017,0,1,10},{200019,0,1,10},{201000,0,1,30},{201001,0,1,30},{201002,0,1,30},{201003,0,1,30},{201006,0,1,30},{201010,0,1,5},{201011,0,1,10},{201012,0,1,10},{201013,0,1,10},{201015,0,1,10},{201016,0,1,10},{201017,0,1,10},{201019,0,1,10},{202000,0,1,30},{202001,0,1,30},{202002,0,1,30},{202003,0,1,30},{202006,0,1,30},{202010,0,1,5},{202011,0,1,10}, | J36: 202010 | K36: 银蛇 | L36: 1 | M36: 0 | N36: 1 | O36: 60 | P36: ="{"&RC[-6]&","&RC[-3]&","&RC[-2]&","&RC[-1]&"}," -> {202010,0,1,60}, | Q36: =R[-1]C&RC[-1] -> {200010,0,1,60},{200011,0,1,60},{200012,0,1,60},{200013,0,1,60},{200015,0,1,60},{200016,0,1,60},{200017,0,1,60},{200019,0,1,60},{200020,0,1,2},{200021,0,1,5},{200022,0,1,5},{200023,0,1,5},{200025,0,1,5},{200026,0,1,5},{200027,0,1,5},{200029,0,1,5},{201010,0,1,60},{201011,0,1,60},{201012,0,1,60},{201013,0,1,60},{201015,0,1,60},{201016,0,1,60},{201017,0,1,60},{201019,0,1,60},{201020,0,1,2},{201021,0,1,5},{201022,0,1,5},{201023,0,1,5},{201025,0,1,5},{201026,0,1,5},{201027,0,1,5},{201029,0,1,5},{202010,0,1,60}, | S36: 202010 | T36: 银蛇 | U36: 1 | V36: 0 | W36: 1 | X36: 50 | Y36: ="{"&RC[-6]&","&RC[-3]&","&RC[-2]&","&RC[-1]&"}," -> {202010,0,1,50}, | Z36: =R[-1]C&RC[-1] -> {200010,0,1,50},{200011,0,1,50},{200012,0,1,50},{200013,0,1,50},{200015,0,1,50},{200016,0,1,50},{200017,0,1,50},{200019,0,1,50},{200020,0,1,2},{200021,0,1,5},{200022,0,1,5},{200023,0,1,5},{200025,0,1,5},{200026,0,1,5},{200027,0,1,5},{200029,0,1,5},{201010,0,1,50},{201011,0,1,50},{201012,0,1,50},{201013,0,1,50},{201015,0,1,50},{201016,0,1,50},{201017,0,1,50},{201019,0,1,50},{201020,0,1,2},{201021,0,1,5},{201022,0,1,5},{201023,0,1,5},{201025,0,1,5},{201026,0,1,5},{201027,0,1,5},{201029,0,1,5},{202010,0,1,50},
A37: 202012 | B37: 灵魂道袍 | C37: 1 | D37: 0 | E37: 1 | F37: 10 | G37: ="{"&RC[-6]&","&RC[-3]&","&RC[-2]&","&RC[-1]&"}," -> {202012,0,1,10}, | H37: =R[-1]C&RC[-1] -> {200000,0,1,30},{200001,0,1,30},{200002,0,1,30},{200003,0,1,30},{200006,0,1,30},{200010,0,1,5},{200011,0,1,10},{200012,0,1,10},{200013,0,1,10},{200015,0,1,10},{200016,0,1,10},{200017,0,1,10},{200019,0,1,10},{201000,0,1,30},{201001,0,1,30},{201002,0,1,30},{201003,0,1,30},{201006,0,1,30},{201010,0,1,5},{201011,0,1,10},{201012,0,1,10},{201013,0,1,10},{201015,0,1,10},{201016,0,1,10},{201017,0,1,10},{201019,0,1,10},{202000,0,1,30},{202001,0,1,30},{202002,0,1,30},{202003,0,1,30},{202006,0,1,30},{202010,0,1,5},{202011,0,1,10},{202012,0,1,10}, | J37: 202011 | K37: 天珠道链 | L37: 1 | M37: 0 | N37: 1 | O37: 60 | P37: ="{"&RC[-6]&","&RC[-3]&","&RC[-2]&","&RC[-1]&"}," -> {202011,0,1,60}, | Q37: =R[-1]C&RC[-1] -> {200010,0,1,60},{200011,0,1,60},{200012,0,1,60},{200013,0,1,60},{200015,0,1,60},{200016,0,1,60},{200017,0,1,60},{200019,0,1,60},{200020,0,1,2},{200021,0,1,5},{200022,0,1,5},{200023,0,1,5},{200025,0,1,5},{200026,0,1,5},{200027,0,1,5},{200029,0,1,5},{201010,0,1,60},{201011,0,1,60},{201012,0,1,60},{201013,0,1,60},{201015,0,1,60},{201016,0,1,60},{201017,0,1,60},{201019,0,1,60},{201020,0,1,2},{201021,0,1,5},{201022,0,1,5},{201023,0,1,5},{201025,0,1,5},{201026,0,1,5},{201027,0,1,5},{201029,0,1,5},{202010,0,1,60},{202011,0,1,60}, | S37: 202011 | T37: 天珠道链 | U37: 1 | V37: 0 | W37: 1 | X37: 50 | Y37: ="{"&RC[-6]&","&RC[-3]&","&RC[-2]&","&RC[-1]&"}," -> {202011,0,1,50}, | Z37: =R[-1]C&RC[-1] -> {200010,0,1,50},{200011,0,1,50},{200012,0,1,50},{200013,0,1,50},{200015,0,1,50},{200016,0,1,50},{200017,0,1,50},{200019,0,1,50},{200020,0,1,2},{200021,0,1,5},{200022,0,1,5},{200023,0,1,5},{200025,0,1,5},{200026,0,1,5},{200027,0,1,5},{200029,0,1,5},{201010,0,1,50},{201011,0,1,50},{201012,0,1,50},{201013,0,1,50},{201015,0,1,50},{201016,0,1,50},{201017,0,1,50},{201019,0,1,50},{201020,0,1,2},{201021,0,1,5},{201022,0,1,5},{201023,0,1,5},{201025,0,1,5},{201026,0,1,5},{201027,0,1,5},{201029,0,1,5},{202010,0,1,50},{202011,0,1,50},
A38: 202013 | B38: 泰坦戒指 | C38: 1 | D38: 0 | E38: 1 | F38: 10 | G38: ="{"&RC[-6]&","&RC[-3]&","&RC[-2]&","&RC[-1]&"}," -> {202013,0,1,10}, | H38: =R[-1]C&RC[-1] -> {200000,0,1,30},{200001,0,1,30},{200002,0,1,30},{200003,0,1,30},{200006,0,1,30},{200010,0,1,5},{200011,0,1,10},{200012,0,1,10},{200013,0,1,10},{200015,0,1,10},{200016,0,1,10},{200017,0,1,10},{200019,0,1,10},{201000,0,1,30},{201001,0,1,30},{201002,0,1,30},{201003,0,1,30},{201006,0,1,30},{201010,0,1,5},{201011,0,1,10},{201012,0,1,10},{201013,0,1,10},{201015,0,1,10},{201016,0,1,10},{201017,0,1,10},{201019,0,1,10},{202000,0,1,30},{202001,0,1,30},{202002,0,1,30},{202003,0,1,30},{202006,0,1,30},{202010,0,1,5},{202011,0,1,10},{202012,0,1,10},{202013,0,1,10}, | J38: 202012 | K38: 灵魂道袍 | L38: 1 | M38: 0 | N38: 1 | O38: 60 | P38: ="{"&RC[-6]&","&RC[-3]&","&RC[-2]&","&RC[-1]&"}," -> {202012,0,1,60}, | Q38: =R[-1]C&RC[-1] -> {200010,0,1,60},{200011,0,1,60},{200012,0,1,60},{200013,0,1,60},{200015,0,1,60},{200016,0,1,60},{200017,0,1,60},{200019,0,1,60},{200020,0,1,2},{200021,0,1,5},{200022,0,1,5},{200023,0,1,5},{200025,0,1,5},{200026,0,1,5},{200027,0,1,5},{200029,0,1,5},{201010,0,1,60},{201011,0,1,60},{201012,0,1,60},{201013,0,1,60},{201015,0,1,60},{201016,0,1,60},{201017,0,1,60},{201019,0,1,60},{201020,0,1,2},{201021,0,1,5},{201022,0,1,5},{201023,0,1,5},{201025,0,1,5},{201026,0,1,5},{201027,0,1,5},{201029,0,1,5},{202010,0,1,60},{202011,0,1,60},{202012,0,1,60}, | S38: 202012 | T38: 灵魂道袍 | U38: 1 | V38: 0 | W38: 1 | X38: 50 | Y38: ="{"&RC[-6]&","&RC[-3]&","&RC[-2]&","&RC[-1]&"}," -> {202012,0,1,50}, | Z38: =R[-1]C&RC[-1] -> {200010,0,1,50},{200011,0,1,50},{200012,0,1,50},{200013,0,1,50},{200015,0,1,50},{200016,0,1,50},{200017,0,1,50},{200019,0,1,50},{200020,0,1,2},{200021,0,1,5},{200022,0,1,5},{200023,0,1,5},{200025,0,1,5},{200026,0,1,5},{200027,0,1,5},{200029,0,1,5},{201010,0,1,50},{201011,0,1,50},{201012,0,1,50},{201013,0,1,50},{201015,0,1,50},{201016,0,1,50},{201017,0,1,50},{201019,0,1,50},{201020,0,1,2},{201021,0,1,5},{201022,0,1,5},{201023,0,1,5},{201025,0,1,5},{201026,0,1,5},{201027,0,1,5},{201029,0,1,5},{202010,0,1,50},{202011,0,1,50},{202012,0,1,50},
A39: 202015 | B39: 道士头盔 | C39: 1 | D39: 0 | E39: 1 | F39: 10 | G39: ="{"&RC[-6]&","&RC[-3]&","&RC[-2]&","&RC[-1]&"}," -> {202015,0,1,10}, | H39: =R[-1]C&RC[-1] -> {200000,0,1,30},{200001,0,1,30},{200002,0,1,30},{200003,0,1,30},{200006,0,1,30},{200010,0,1,5},{200011,0,1,10},{200012,0,1,10},{200013,0,1,10},{200015,0,1,10},{200016,0,1,10},{200017,0,1,10},{200019,0,1,10},{201000,0,1,30},{201001,0,1,30},{201002,0,1,30},{201003,0,1,30},{201006,0,1,30},{201010,0,1,5},{201011,0,1,10},{201012,0,1,10},{201013,0,1,10},{201015,0,1,10},{201016,0,1,10},{201017,0,1,10},{201019,0,1,10},{202000,0,1,30},{202001,0,1,30},{202002,0,1,30},{202003,0,1,30},{202006,0,1,30},{202010,0,1,5},{202011,0,1,10},{202012,0,1,10},{202013,0,1,10},{202015,0,1,10}, | J39: 202013 | K39: 泰坦戒指 | L39: 1 | M39: 0 | N39: 1 | O39: 60 | P39: ="{"&RC[-6]&","&RC[-3]&","&RC[-2]&","&RC[-1]&"}," -> {202013,0,1,60}, | Q39: =R[-1]C&RC[-1] -> {200010,0,1,60},{200011,0,1,60},{200012,0,1,60},{200013,0,1,60},{200015,0,1,60},{200016,0,1,60},{200017,0,1,60},{200019,0,1,60},{200020,0,1,2},{200021,0,1,5},{200022,0,1,5},{200023,0,1,5},{200025,0,1,5},{200026,0,1,5},{200027,0,1,5},{200029,0,1,5},{201010,0,1,60},{201011,0,1,60},{201012,0,1,60},{201013,0,1,60},{201015,0,1,60},{201016,0,1,60},{201017,0,1,60},{201019,0,1,60},{201020,0,1,2},{201021,0,1,5},{201022,0,1,5},{201023,0,1,5},{201025,0,1,5},{201026,0,1,5},{201027,0,1,5},{201029,0,1,5},{202010,0,1,60},{202011,0,1,60},{202012,0,1,60},{202013,0,1,60}, | S39: 202013 | T39: 泰坦戒指 | U39: 1 | V39: 0 | W39: 1 | X39: 50 | Y39: ="{"&RC[-6]&","&RC[-3]&","&RC[-2]&","&RC[-1]&"}," -> {202013,0,1,50}, | Z39: =R[-1]C&RC[-1] -> {200010,0,1,50},{200011,0,1,50},{200012,0,1,50},{200013,0,1,50},{200015,0,1,50},{200016,0,1,50},{200017,0,1,50},{200019,0,1,50},{200020,0,1,2},{200021,0,1,5},{200022,0,1,5},{200023,0,1,5},{200025,0,1,5},{200026,0,1,5},{200027,0,1,5},{200029,0,1,5},{201010,0,1,50},{201011,0,1,50},{201012,0,1,50},{201013,0,1,50},{201015,0,1,50},{201016,0,1,50},{201017,0,1,50},{201019,0,1,50},{201020,0,1,2},{201021,0,1,5},{201022,0,1,5},{201023,0,1,5},{201025,0,1,5},{201026,0,1,5},{201027,0,1,5},{201029,0,1,5},{202010,0,1,50},{202011,0,1,50},{202012,0,1,50},{202013,0,1,50},
A40: 202016 | B40: 幽灵手镯 | C40: 1 | D40: 0 | E40: 1 | F40: 10 | G40: ="{"&RC[-6]&","&RC[-3]&","&RC[-2]&","&RC[-1]&"}," -> {202016,0,1,10}, | H40: =R[-1]C&RC[-1] -> {200000,0,1,30},{200001,0,1,30},{200002,0,1,30},{200003,0,1,30},{200006,0,1,30},{200010,0,1,5},{200011,0,1,10},{200012,0,1,10},{200013,0,1,10},{200015,0,1,10},{200016,0,1,10},{200017,0,1,10},{200019,0,1,10},{201000,0,1,30},{201001,0,1,30},{201002,0,1,30},{201003,0,1,30},{201006,0,1,30},{201010,0,1,5},{201011,0,1,10},{201012,0,1,10},{201013,0,1,10},{201015,0,1,10},{201016,0,1,10},{201017,0,1,10},{201019,0,1,10},{202000,0,1,30},{202001,0,1,30},{202002,0,1,30},{202003,0,1,30},{202006,0,1,30},{202010,0,1,5},{202011,0,1,10},{202012,0,1,10},{202013,0,1,10},{202015,0,1,10},{202016,0,1,10}, | J40: 202015 | K40: 道士头盔 | L40: 1 | M40: 0 | N40: 1 | O40: 60 | P40: ="{"&RC[-6]&","&RC[-3]&","&RC[-2]&","&RC[-1]&"}," -> {202015,0,1,60}, | Q40: =R[-1]C&RC[-1] -> {200010,0,1,60},{200011,0,1,60},{200012,0,1,60},{200013,0,1,60},{200015,0,1,60},{200016,0,1,60},{200017,0,1,60},{200019,0,1,60},{200020,0,1,2},{200021,0,1,5},{200022,0,1,5},{200023,0,1,5},{200025,0,1,5},{200026,0,1,5},{200027,0,1,5},{200029,0,1,5},{201010,0,1,60},{201011,0,1,60},{201012,0,1,60},{201013,0,1,60},{201015,0,1,60},{201016,0,1,60},{201017,0,1,60},{201019,0,1,60},{201020,0,1,2},{201021,0,1,5},{201022,0,1,5},{201023,0,1,5},{201025,0,1,5},{201026,0,1,5},{201027,0,1,5},{201029,0,1,5},{202010,0,1,60},{202011,0,1,60},{202012,0,1,60},{202013,0,1,60},{202015,0,1,60}, | S40: 202015 | T40: 道士头盔 | U40: 1 | V40: 0 | W40: 1 | X40: 50 | Y40: ="{"&RC[-6]&","&RC[-3]&","&RC[-2]&","&RC[-1]&"}," -> {202015,0,1,50}, | Z40: =R[-1]C&RC[-1] -> {200010,0,1,50},{200011,0,1,50},{200012,0,1,50},{200013,0,1,50},{200015,0,1,50},{200016,0,1,50},{200017,0,1,50},{200019,0,1,50},{200020,0,1,2},{200021,0,1,5},{200022,0,1,5},{200023,0,1,5},{200025,0,1,5},{200026,0,1,5},{200027,0,1,5},{200029,0,1,5},{201010,0,1,50},{201011,0,1,50},{201012,0,1,50},{201013,0,1,50},{201015,0,1,50},{201016,0,1,50},{201017,0,1,50},{201019,0,1,50},{201020,0,1,2},{201021,0,1,5},{201022,0,1,5},{201023,0,1,5},{201025,0,1,5},{201026,0,1,5},{201027,0,1,5},{201029,0,1,5},{202010,0,1,50},{202011,0,1,50},{202012,0,1,50},{202013,0,1,50},{202015,0,1,50},
A41: 202017 | B41: 道士腰带 | C41: 1 | D41: 0 | E41: 1 | F41: 10 | G41: ="{"&RC[-6]&","&RC[-3]&","&RC[-2]&","&RC[-1]&"}," -> {202017,0,1,10}, | H41: =R[-1]C&RC[-1] -> {200000,0,1,30},{200001,0,1,30},{200002,0,1,30},{200003,0,1,30},{200006,0,1,30},{200010,0,1,5},{200011,0,1,10},{200012,0,1,10},{200013,0,1,10},{200015,0,1,10},{200016,0,1,10},{200017,0,1,10},{200019,0,1,10},{201000,0,1,30},{201001,0,1,30},{201002,0,1,30},{201003,0,1,30},{201006,0,1,30},{201010,0,1,5},{201011,0,1,10},{201012,0,1,10},{201013,0,1,10},{201015,0,1,10},{201016,0,1,10},{201017,0,1,10},{201019,0,1,10},{202000,0,1,30},{202001,0,1,30},{202002,0,1,30},{202003,0,1,30},{202006,0,1,30},{202010,0,1,5},{202011,0,1,10},{202012,0,1,10},{202013,0,1,10},{202015,0,1,10},{202016,0,1,10},{202017,0,1,10}, | J41: 202016 | K41: 幽灵手镯 | L41: 1 | M41: 0 | N41: 1 | O41: 60 | P41: ="{"&RC[-6]&","&RC[-3]&","&RC[-2]&","&RC[-1]&"}," -> {202016,0,1,60}, | Q41: =R[-1]C&RC[-1] -> {200010,0,1,60},{200011,0,1,60},{200012,0,1,60},{200013,0,1,60},{200015,0,1,60},{200016,0,1,60},{200017,0,1,60},{200019,0,1,60},{200020,0,1,2},{200021,0,1,5},{200022,0,1,5},{200023,0,1,5},{200025,0,1,5},{200026,0,1,5},{200027,0,1,5},{200029,0,1,5},{201010,0,1,60},{201011,0,1,60},{201012,0,1,60},{201013,0,1,60},{201015,0,1,60},{201016,0,1,60},{201017,0,1,60},{201019,0,1,60},{201020,0,1,2},{201021,0,1,5},{201022,0,1,5},{201023,0,1,5},{201025,0,1,5},{201026,0,1,5},{201027,0,1,5},{201029,0,1,5},{202010,0,1,60},{202011,0,1,60},{202012,0,1,60},{202013,0,1,60},{202015,0,1,60},{202016,0,1,60}, | S41: 202016 | T41: 幽灵手镯 | U41: 1 | V41: 0 | W41: 1 | X41: 50 | Y41: ="{"&RC[-6]&","&RC[-3]&","&RC[-2]&","&RC[-1]&"}," -> {202016,0,1,50}, | Z41: =R[-1]C&RC[-1] -> {200010,0,1,50},{200011,0,1,50},{200012,0,1,50},{200013,0,1,50},{200015,0,1,50},{200016,0,1,50},{200017,0,1,50},{200019,0,1,50},{200020,0,1,2},{200021,0,1,5},{200022,0,1,5},{200023,0,1,5},{200025,0,1,5},{200026,0,1,5},{200027,0,1,5},{200029,0,1,5},{201010,0,1,50},{201011,0,1,50},{201012,0,1,50},{201013,0,1,50},{201015,0,1,50},{201016,0,1,50},{201017,0,1,50},{201019,0,1,50},{201020,0,1,2},{201021,0,1,5},{201022,0,1,5},{201023,0,1,5},{201025,0,1,5},{201026,0,1,5},{201027,0,1,5},{201029,0,1,5},{202010,0,1,50},{202011,0,1,50},{202012,0,1,50},{202013,0,1,50},{202015,0,1,50},{202016,0,1,50},
A42: 202019 | B42: 道士鞋子 | C42: 1 | D42: 0 | E42: 1 | F42: 10 | G42: ="{"&RC[-6]&","&RC[-3]&","&RC[-2]&","&RC[-1]&"}" -> {202019,0,1,10} | H42: =R[-1]C&RC[-1] -> {200000,0,1,30},{200001,0,1,30},{200002,0,1,30},{200003,0,1,30},{200006,0,1,30},{200010,0,1,5},{200011,0,1,10},{200012,0,1,10},{200013,0,1,10},{200015,0,1,10},{200016,0,1,10},{200017,0,1,10},{200019,0,1,10},{201000,0,1,30},{201001,0,1,30},{201002,0,1,30},{201003,0,1,30},{201006,0,1,30},{201010,0,1,5},{201011,0,1,10},{201012,0,1,10},{201013,0,1,10},{201015,0,1,10},{201016,0,1,10},{201017,0,1,10},{201019,0,1,10},{202000,0,1,30},{202001,0,1,30},{202002,0,1,30},{202003,0,1,30},{202006,0,1,30},{202010,0,1,5},{202011,0,1,10},{202012,0,1,10},{202013,0,1,10},{202015,0,1,10},{202016,0,1,10},{202017,0,1,10},{202019,0,1,10} | J42: 202017 | K42: 道士腰带 | L42: 1 | M42: 0 | N42: 1 | O42: 60 | P42: ="{"&RC[-6]&","&RC[-3]&","&RC[-2]&","&RC[-1]&"}," -> {202017,0,1,60}, | Q42: =R[-1]C&RC[-1] -> {200010,0,1,60},{200011,0,1,60},{200012,0,1,60},{200013,0,1,60},{200015,0,1,60},{200016,0,1,60},{200017,0,1,60},{200019,0,1,60},{200020,0,1,2},{200021,0,1,5},{200022,0,1,5},{200023,0,1,5},{200025,0,1,5},{200026,0,1,5},{200027,0,1,5},{200029,0,1,5},{201010,0,1,60},{201011,0,1,60},{201012,0,1,60},{201013,0,1,60},{201015,0,1,60},{201016,0,1,60},{201017,0,1,60},{201019,0,1,60},{201020,0,1,2},{201021,0,1,5},{201022,0,1,5},{201023,0,1,5},{201025,0,1,5},{201026,0,1,5},{201027,0,1,5},{201029,0,1,5},{202010,0,1,60},{202011,0,1,60},{202012,0,1,60},{202013,0,1,60},{202015,0,1,60},{202016,0,1,60},{202017,0,1,60}, | S42: 202017 | T42: 道士腰带 | U42: 1 | V42: 0 | W42: 1 | X42: 50 | Y42: ="{"&RC[-6]&","&RC[-3]&","&RC[-2]&","&RC[-1]&"}," -> {202017,0,1,50}, | Z42: =R[-1]C&RC[-1] -> {200010,0,1,50},{200011,0,1,50},{200012,0,1,50},{200013,0,1,50},{200015,0,1,50},{200016,0,1,50},{200017,0,1,50},{200019,0,1,50},{200020,0,1,2},{200021,0,1,5},{200022,0,1,5},{200023,0,1,5},{200025,0,1,5},{200026,0,1,5},{200027,0,1,5},{200029,0,1,5},{201010,0,1,50},{201011,0,1,50},{201012,0,1,50},{201013,0,1,50},{201015,0,1,50},{201016,0,1,50},{201017,0,1,50},{201019,0,1,50},{201020,0,1,2},{201021,0,1,5},{201022,0,1,5},{201023,0,1,5},{201025,0,1,5},{201026,0,1,5},{201027,0,1,5},{201029,0,1,5},{202010,0,1,50},{202011,0,1,50},{202012,0,1,50},{202013,0,1,50},{202015,0,1,50},{202016,0,1,50},{202017,0,1,50},
J43: 202019 | K43: 道士鞋子 | L43: 1 | M43: 0 | N43: 1 | O43: 60 | P43: ="{"&RC[-6]&","&RC[-3]&","&RC[-2]&","&RC[-1]&"}," -> {202019,0,1,60}, | Q43: =R[-1]C&RC[-1] -> {200010,0,1,60},{200011,0,1,60},{200012,0,1,60},{200013,0,1,60},{200015,0,1,60},{200016,0,1,60},{200017,0,1,60},{200019,0,1,60},{200020,0,1,2},{200021,0,1,5},{200022,0,1,5},{200023,0,1,5},{200025,0,1,5},{200026,0,1,5},{200027,0,1,5},{200029,0,1,5},{201010,0,1,60},{201011,0,1,60},{201012,0,1,60},{201013,0,1,60},{201015,0,1,60},{201016,0,1,60},{201017,0,1,60},{201019,0,1,60},{201020,0,1,2},{201021,0,1,5},{201022,0,1,5},{201023,0,1,5},{201025,0,1,5},{201026,0,1,5},{201027,0,1,5},{201029,0,1,5},{202010,0,1,60},{202011,0,1,60},{202012,0,1,60},{202013,0,1,60},{202015,0,1,60},{202016,0,1,60},{202017,0,1,60},{202019,0,1,60}, | S43: 202019 | T43: 道士鞋子 | U43: 1 | V43: 0 | W43: 1 | X43: 50 | Y43: ="{"&RC[-6]&","&RC[-3]&","&RC[-2]&","&RC[-1]&"}," -> {202019,0,1,50}, | Z43: =R[-1]C&RC[-1] -> {200010,0,1,50},{200011,0,1,50},{200012,0,1,50},{200013,0,1,50},{200015,0,1,50},{200016,0,1,50},{200017,0,1,50},{200019,0,1,50},{200020,0,1,2},{200021,0,1,5},{200022,0,1,5},{200023,0,1,5},{200025,0,1,5},{200026,0,1,5},{200027,0,1,5},{200029,0,1,5},{201010,0,1,50},{201011,0,1,50},{201012,0,1,50},{201013,0,1,50},{201015,0,1,50},{201016,0,1,50},{201017,0,1,50},{201019,0,1,50},{201020,0,1,2},{201021,0,1,5},{201022,0,1,5},{201023,0,1,5},{201025,0,1,5},{201026,0,1,5},{201027,0,1,5},{201029,0,1,5},{202010,0,1,50},{202011,0,1,50},{202012,0,1,50},{202013,0,1,50},{202015,0,1,50},{202016,0,1,50},{202017,0,1,50},{202019,0,1,50},
J44: 202020 | K44: 龙纹 | L44: 1 | M44: 0 | N44: 1 | O44: 2 | P44: ="{"&RC[-6]&","&RC[-3]&","&RC[-2]&","&RC[-1]&"}," -> {202020,0,1,2}, | Q44: =R[-1]C&RC[-1] -> {200010,0,1,60},{200011,0,1,60},{200012,0,1,60},{200013,0,1,60},{200015,0,1,60},{200016,0,1,60},{200017,0,1,60},{200019,0,1,60},{200020,0,1,2},{200021,0,1,5},{200022,0,1,5},{200023,0,1,5},{200025,0,1,5},{200026,0,1,5},{200027,0,1,5},{200029,0,1,5},{201010,0,1,60},{201011,0,1,60},{201012,0,1,60},{201013,0,1,60},{201015,0,1,60},{201016,0,1,60},{201017,0,1,60},{201019,0,1,60},{201020,0,1,2},{201021,0,1,5},{201022,0,1,5},{201023,0,1,5},{201025,0,1,5},{201026,0,1,5},{201027,0,1,5},{201029,0,1,5},{202010,0,1,60},{202011,0,1,60},{202012,0,1,60},{202013,0,1,60},{202015,0,1,60},{202016,0,1,60},{202017,0,1,60},{202019,0,1,60},{202020,0,1,2}, | S44: 202020 | T44: 龙纹 | U44: 1 | V44: 0 | W44: 1 | X44: 2 | Y44: ="{"&RC[-6]&","&RC[-3]&","&RC[-2]&","&RC[-1]&"}," -> {202020,0,1,2}, | Z44: =R[-1]C&RC[-1] -> {200010,0,1,50},{200011,0,1,50},{200012,0,1,50},{200013,0,1,50},{200015,0,1,50},{200016,0,1,50},{200017,0,1,50},{200019,0,1,50},{200020,0,1,2},{200021,0,1,5},{200022,0,1,5},{200023,0,1,5},{200025,0,1,5},{200026,0,1,5},{200027,0,1,5},{200029,0,1,5},{201010,0,1,50},{201011,0,1,50},{201012,0,1,50},{201013,0,1,50},{201015,0,1,50},{201016,0,1,50},{201017,0,1,50},{201019,0,1,50},{201020,0,1,2},{201021,0,1,5},{201022,0,1,5},{201023,0,1,5},{201025,0,1,5},{201026,0,1,5},{201027,0,1,5},{201029,0,1,5},{202010,0,1,50},{202011,0,1,50},{202012,0,1,50},{202013,0,1,50},{202015,0,1,50},{202016,0,1,50},{202017,0,1,50},{202019,0,1,50},{202020,0,1,2},
A45: 110002 | B45: 强化石 | D45: 0 | E45: 2 | F45: 0 | G45: ="{"&RC[-6]&","&RC[-3]&","&RC[-2]&","&RC[-1]&"}," -> {110002,0,2,0}, | H45: =RC[-1] -> {110002,0,2,0}, | J45: 202021 | K45: 天尊道袍 | L45: 1 | M45: 0 | N45: 1 | O45: 5 | P45: ="{"&RC[-6]&","&RC[-3]&","&RC[-2]&","&RC[-1]&"}," -> {202021,0,1,5}, | Q45: =R[-1]C&RC[-1] -> {200010,0,1,60},{200011,0,1,60},{200012,0,1,60},{200013,0,1,60},{200015,0,1,60},{200016,0,1,60},{200017,0,1,60},{200019,0,1,60},{200020,0,1,2},{200021,0,1,5},{200022,0,1,5},{200023,0,1,5},{200025,0,1,5},{200026,0,1,5},{200027,0,1,5},{200029,0,1,5},{201010,0,1,60},{201011,0,1,60},{201012,0,1,60},{201013,0,1,60},{201015,0,1,60},{201016,0,1,60},{201017,0,1,60},{201019,0,1,60},{201020,0,1,2},{201021,0,1,5},{201022,0,1,5},{201023,0,1,5},{201025,0,1,5},{201026,0,1,5},{201027,0,1,5},{201029,0,1,5},{202010,0,1,60},{202011,0,1,60},{202012,0,1,60},{202013,0,1,60},{202015,0,1,60},{202016,0,1,60},{202017,0,1,60},{202019,0,1,60},{202020,0,1,2},{202021,0,1,5}, | S45: 202021 | T45: 天尊道袍 | U45: 1 | V45: 0 | W45: 1 | X45: 5 | Y45: ="{"&RC[-6]&","&RC[-3]&","&RC[-2]&","&RC[-1]&"}," -> {202021,0,1,5}, | Z45: =R[-1]C&RC[-1] -> {200010,0,1,50},{200011,0,1,50},{200012,0,1,50},{200013,0,1,50},{200015,0,1,50},{200016,0,1,50},{200017,0,1,50},{200019,0,1,50},{200020,0,1,2},{200021,0,1,5},{200022,0,1,5},{200023,0,1,5},{200025,0,1,5},{200026,0,1,5},{200027,0,1,5},{200029,0,1,5},{201010,0,1,50},{201011,0,1,50},{201012,0,1,50},{201013,0,1,50},{201015,0,1,50},{201016,0,1,50},{201017,0,1,50},{201019,0,1,50},{201020,0,1,2},{201021,0,1,5},{201022,0,1,5},{201023,0,1,5},{201025,0,1,5},{201026,0,1,5},{201027,0,1,5},{201029,0,1,5},{202010,0,1,50},{202011,0,1,50},{202012,0,1,50},{202013,0,1,50},{202015,0,1,50},{202016,0,1,50},{202017,0,1,50},{202019,0,1,50},{202020,0,1,2},{202021,0,1,5},
A46: 110003 | B46: 洗炼石 | D46: 0 | E46: 2 | F46: 0 | G46: ="{"&RC[-6]&","&RC[-3]&","&RC[-2]&","&RC[-1]&"}," -> {110003,0,2,0}, | H46: =R[-1]C&RC[-1] -> {110002,0,2,0},{110003,0,2,0}, | J46: 202022 | K46: 天尊项链 | L46: 1 | M46: 0 | N46: 1 | O46: 5 | P46: ="{"&RC[-6]&","&RC[-3]&","&RC[-2]&","&RC[-1]&"}," -> {202022,0,1,5}, | Q46: =R[-1]C&RC[-1] -> {200010,0,1,60},{200011,0,1,60},{200012,0,1,60},{200013,0,1,60},{200015,0,1,60},{200016,0,1,60},{200017,0,1,60},{200019,0,1,60},{200020,0,1,2},{200021,0,1,5},{200022,0,1,5},{200023,0,1,5},{200025,0,1,5},{200026,0,1,5},{200027,0,1,5},{200029,0,1,5},{201010,0,1,60},{201011,0,1,60},{201012,0,1,60},{201013,0,1,60},{201015,0,1,60},{201016,0,1,60},{201017,0,1,60},{201019,0,1,60},{201020,0,1,2},{201021,0,1,5},{201022,0,1,5},{201023,0,1,5},{201025,0,1,5},{201026,0,1,5},{201027,0,1,5},{201029,0,1,5},{202010,0,1,60},{202011,0,1,60},{202012,0,1,60},{202013,0,1,60},{202015,0,1,60},{202016,0,1,60},{202017,0,1,60},{202019,0,1,60},{202020,0,1,2},{202021,0,1,5},{202022,0,1,5}, | S46: 202022 | T46: 天尊项链 | U46: 1 | V46: 0 | W46: 1 | X46: 5 | Y46: ="{"&RC[-6]&","&RC[-3]&","&RC[-2]&","&RC[-1]&"}," -> {202022,0,1,5}, | Z46: =R[-1]C&RC[-1] -> {200010,0,1,50},{200011,0,1,50},{200012,0,1,50},{200013,0,1,50},{200015,0,1,50},{200016,0,1,50},{200017,0,1,50},{200019,0,1,50},{200020,0,1,2},{200021,0,1,5},{200022,0,1,5},{200023,0,1,5},{200025,0,1,5},{200026,0,1,5},{200027,0,1,5},{200029,0,1,5},{201010,0,1,50},{201011,0,1,50},{201012,0,1,50},{201013,0,1,50},{201015,0,1,50},{201016,0,1,50},{201017,0,1,50},{201019,0,1,50},{201020,0,1,2},{201021,0,1,5},{201022,0,1,5},{201023,0,1,5},{201025,0,1,5},{201026,0,1,5},{201027,0,1,5},{201029,0,1,5},{202010,0,1,50},{202011,0,1,50},{202012,0,1,50},{202013,0,1,50},{202015,0,1,50},{202016,0,1,50},{202017,0,1,50},{202019,0,1,50},{202020,0,1,2},{202021,0,1,5},{202022,0,1,5}, | AB46: =2/1200 -> 1.6666666666666668E-3
A47: 110004 | B47: 红药 | D47: 0 | E47: 1 | F47: 0 | G47: ="{"&RC[-6]&","&RC[-3]&","&RC[-2]&","&RC[-1]&"}," -> {110004,0,1,0}, | H47: =R[-1]C&RC[-1] -> {110002,0,2,0},{110003,0,2,0},{110004,0,1,0}, | J47: 202023 | K47: 天尊戒指 | L47: 1 | M47: 0 | N47: 1 | O47: 5 | P47: ="{"&RC[-6]&","&RC[-3]&","&RC[-2]&","&RC[-1]&"}," -> {202023,0,1,5}, | Q47: =R[-1]C&RC[-1] -> {200010,0,1,60},{200011,0,1,60},{200012,0,1,60},{200013,0,1,60},{200015,0,1,60},{200016,0,1,60},{200017,0,1,60},{200019,0,1,60},{200020,0,1,2},{200021,0,1,5},{200022,0,1,5},{200023,0,1,5},{200025,0,1,5},{200026,0,1,5},{200027,0,1,5},{200029,0,1,5},{201010,0,1,60},{201011,0,1,60},{201012,0,1,60},{201013,0,1,60},{201015,0,1,60},{201016,0,1,60},{201017,0,1,60},{201019,0,1,60},{201020,0,1,2},{201021,0,1,5},{201022,0,1,5},{201023,0,1,5},{201025,0,1,5},{201026,0,1,5},{201027,0,1,5},{201029,0,1,5},{202010,0,1,60},{202011,0,1,60},{202012,0,1,60},{202013,0,1,60},{202015,0,1,60},{202016,0,1,60},{202017,0,1,60},{202019,0,1,60},{202020,0,1,2},{202021,0,1,5},{202022,0,1,5},{202023,0,1,5}, | S47: 202023 | T47: 天尊戒指 | U47: 1 | V47: 0 | W47: 1 | X47: 5 | Y47: ="{"&RC[-6]&","&RC[-3]&","&RC[-2]&","&RC[-1]&"}," -> {202023,0,1,5}, | Z47: =R[-1]C&RC[-1] -> {200010,0,1,50},{200011,0,1,50},{200012,0,1,50},{200013,0,1,50},{200015,0,1,50},{200016,0,1,50},{200017,0,1,50},{200019,0,1,50},{200020,0,1,2},{200021,0,1,5},{200022,0,1,5},{200023,0,1,5},{200025,0,1,5},{200026,0,1,5},{200027,0,1,5},{200029,0,1,5},{201010,0,1,50},{201011,0,1,50},{201012,0,1,50},{201013,0,1,50},{201015,0,1,50},{201016,0,1,50},{201017,0,1,50},{201019,0,1,50},{201020,0,1,2},{201021,0,1,5},{201022,0,1,5},{201023,0,1,5},{201025,0,1,5},{201026,0,1,5},{201027,0,1,5},{201029,0,1,5},{202010,0,1,50},{202011,0,1,50},{202012,0,1,50},{202013,0,1,50},{202015,0,1,50},{202016,0,1,50},{202017,0,1,50},{202019,0,1,50},{202020,0,1,2},{202021,0,1,5},{202022,0,1,5},{202023,0,1,5}, | AB47: =24/3 -> 8
A48: 110005 | B48: 蓝药 | D48: 0 | E48: 1 | F48: 0 | G48: ="{"&RC[-6]&","&RC[-3]&","&RC[-2]&","&RC[-1]&"}," -> {110005,0,1,0}, | H48: =R[-1]C&RC[-1] -> {110002,0,2,0},{110003,0,2,0},{110004,0,1,0},{110005,0,1,0}, | J48: 202025 | K48: 天尊头盔 | L48: 1 | M48: 0 | N48: 1 | O48: 5 | P48: ="{"&RC[-6]&","&RC[-3]&","&RC[-2]&","&RC[-1]&"}," -> {202025,0,1,5}, | Q48: =R[-1]C&RC[-1] -> {200010,0,1,60},{200011,0,1,60},{200012,0,1,60},{200013,0,1,60},{200015,0,1,60},{200016,0,1,60},{200017,0,1,60},{200019,0,1,60},{200020,0,1,2},{200021,0,1,5},{200022,0,1,5},{200023,0,1,5},{200025,0,1,5},{200026,0,1,5},{200027,0,1,5},{200029,0,1,5},{201010,0,1,60},{201011,0,1,60},{201012,0,1,60},{201013,0,1,60},{201015,0,1,60},{201016,0,1,60},{201017,0,1,60},{201019,0,1,60},{201020,0,1,2},{201021,0,1,5},{201022,0,1,5},{201023,0,1,5},{201025,0,1,5},{201026,0,1,5},{201027,0,1,5},{201029,0,1,5},{202010,0,1,60},{202011,0,1,60},{202012,0,1,60},{202013,0,1,60},{202015,0,1,60},{202016,0,1,60},{202017,0,1,60},{202019,0,1,60},{202020,0,1,2},{202021,0,1,5},{202022,0,1,5},{202023,0,1,5},{202025,0,1,5}, | S48: 202025 | T48: 天尊头盔 | U48: 1 | V48: 0 | W48: 1 | X48: 5 | Y48: ="{"&RC[-6]&","&RC[-3]&","&RC[-2]&","&RC[-1]&"}," -> {202025,0,1,5}, | Z48: =R[-1]C&RC[-1] -> {200010,0,1,50},{200011,0,1,50},{200012,0,1,50},{200013,0,1,50},{200015,0,1,50},{200016,0,1,50},{200017,0,1,50},{200019,0,1,50},{200020,0,1,2},{200021,0,1,5},{200022,0,1,5},{200023,0,1,5},{200025,0,1,5},{200026,0,1,5},{200027,0,1,5},{200029,0,1,5},{201010,0,1,50},{201011,0,1,50},{201012,0,1,50},{201013,0,1,50},{201015,0,1,50},{201016,0,1,50},{201017,0,1,50},{201019,0,1,50},{201020,0,1,2},{201021,0,1,5},{201022,0,1,5},{201023,0,1,5},{201025,0,1,5},{201026,0,1,5},{201027,0,1,5},{201029,0,1,5},{202010,0,1,50},{202011,0,1,50},{202012,0,1,50},{202013,0,1,50},{202015,0,1,50},{202016,0,1,50},{202017,0,1,50},{202019,0,1,50},{202020,0,1,2},{202021,0,1,5},{202022,0,1,5},{202023,0,1,5},{202025,0,1,5}, | AB48: =R[-1]C*30*3 -> 720
A49: 110010 | B49: 普通武装碎片 | D49: 0 | E49: 1 | F49: 2 | G49: ="{"&RC[-6]&","&RC[-3]&","&RC[-2]&","&RC[-1]&"}," -> {110010,0,1,2}, | H49: =R[-1]C&RC[-1] -> {110002,0,2,0},{110003,0,2,0},{110004,0,1,0},{110005,0,1,0},{110010,0,1,2}, | J49: 202026 | K49: 天尊手镯 | L49: 1 | M49: 0 | N49: 1 | O49: 5 | P49: ="{"&RC[-6]&","&RC[-3]&","&RC[-2]&","&RC[-1]&"}," -> {202026,0,1,5}, | Q49: =R[-1]C&RC[-1] -> {200010,0,1,60},{200011,0,1,60},{200012,0,1,60},{200013,0,1,60},{200015,0,1,60},{200016,0,1,60},{200017,0,1,60},{200019,0,1,60},{200020,0,1,2},{200021,0,1,5},{200022,0,1,5},{200023,0,1,5},{200025,0,1,5},{200026,0,1,5},{200027,0,1,5},{200029,0,1,5},{201010,0,1,60},{201011,0,1,60},{201012,0,1,60},{201013,0,1,60},{201015,0,1,60},{201016,0,1,60},{201017,0,1,60},{201019,0,1,60},{201020,0,1,2},{201021,0,1,5},{201022,0,1,5},{201023,0,1,5},{201025,0,1,5},{201026,0,1,5},{201027,0,1,5},{201029,0,1,5},{202010,0,1,60},{202011,0,1,60},{202012,0,1,60},{202013,0,1,60},{202015,0,1,60},{202016,0,1,60},{202017,0,1,60},{202019,0,1,60},{202020,0,1,2},{202021,0,1,5},{202022,0,1,5},{202023,0,1,5},{202025,0,1,5},{202026,0,1,5}, | S49: 202026 | T49: 天尊手镯 | U49: 1 | V49: 0 | W49: 1 | X49: 5 | Y49: ="{"&RC[-6]&","&RC[-3]&","&RC[-2]&","&RC[-1]&"}," -> {202026,0,1,5}, | Z49: =R[-1]C&RC[-1] -> {200010,0,1,50},{200011,0,1,50},{200012,0,1,50},{200013,0,1,50},{200015,0,1,50},{200016,0,1,50},{200017,0,1,50},{200019,0,1,50},{200020,0,1,2},{200021,0,1,5},{200022,0,1,5},{200023,0,1,5},{200025,0,1,5},{200026,0,1,5},{200027,0,1,5},{200029,0,1,5},{201010,0,1,50},{201011,0,1,50},{201012,0,1,50},{201013,0,1,50},{201015,0,1,50},{201016,0,1,50},{201017,0,1,50},{201019,0,1,50},{201020,0,1,2},{201021,0,1,5},{201022,0,1,5},{201023,0,1,5},{201025,0,1,5},{201026,0,1,5},{201027,0,1,5},{201029,0,1,5},{202010,0,1,50},{202011,0,1,50},{202012,0,1,50},{202013,0,1,50},{202015,0,1,50},{202016,0,1,50},{202017,0,1,50},{202019,0,1,50},{202020,0,1,2},{202021,0,1,5},{202022,0,1,5},{202023,0,1,5},{202025,0,1,5},{202026,0,1,5}, | AB49: =R[-3]C*R[-1]C -> 1.2000000000000002
A50: 110011 | B50: 普通防具碎片 | D50: 0 | E50: 1 | F50: 3 | G50: ="{"&RC[-6]&","&RC[-3]&","&RC[-2]&","&RC[-1]&"}," -> {110011,0,1,3}, | H50: =R[-1]C&RC[-1] -> {110002,0,2,0},{110003,0,2,0},{110004,0,1,0},{110005,0,1,0},{110010,0,1,2},{110011,0,1,3}, | J50: 202027 | K50: 天尊腰带 | L50: 1 | M50: 0 | N50: 1 | O50: 5 | P50: ="{"&RC[-6]&","&RC[-3]&","&RC[-2]&","&RC[-1]&"}," -> {202027,0,1,5}, | Q50: =R[-1]C&RC[-1] -> {200010,0,1,60},{200011,0,1,60},{200012,0,1,60},{200013,0,1,60},{200015,0,1,60},{200016,0,1,60},{200017,0,1,60},{200019,0,1,60},{200020,0,1,2},{200021,0,1,5},{200022,0,1,5},{200023,0,1,5},{200025,0,1,5},{200026,0,1,5},{200027,0,1,5},{200029,0,1,5},{201010,0,1,60},{201011,0,1,60},{201012,0,1,60},{201013,0,1,60},{201015,0,1,60},{201016,0,1,60},{201017,0,1,60},{201019,0,1,60},{201020,0,1,2},{201021,0,1,5},{201022,0,1,5},{201023,0,1,5},{201025,0,1,5},{201026,0,1,5},{201027,0,1,5},{201029,0,1,5},{202010,0,1,60},{202011,0,1,60},{202012,0,1,60},{202013,0,1,60},{202015,0,1,60},{202016,0,1,60},{202017,0,1,60},{202019,0,1,60},{202020,0,1,2},{202021,0,1,5},{202022,0,1,5},{202023,0,1,5},{202025,0,1,5},{202026,0,1,5},{202027,0,1,5}, | S50: 202027 | T50: 天尊腰带 | U50: 1 | V50: 0 | W50: 1 | X50: 5 | Y50: ="{"&RC[-6]&","&RC[-3]&","&RC[-2]&","&RC[-1]&"}," -> {202027,0,1,5}, | Z50: =R[-1]C&RC[-1] -> {200010,0,1,50},{200011,0,1,50},{200012,0,1,50},{200013,0,1,50},{200015,0,1,50},{200016,0,1,50},{200017,0,1,50},{200019,0,1,50},{200020,0,1,2},{200021,0,1,5},{200022,0,1,5},{200023,0,1,5},{200025,0,1,5},{200026,0,1,5},{200027,0,1,5},{200029,0,1,5},{201010,0,1,50},{201011,0,1,50},{201012,0,1,50},{201013,0,1,50},{201015,0,1,50},{201016,0,1,50},{201017,0,1,50},{201019,0,1,50},{201020,0,1,2},{201021,0,1,5},{201022,0,1,5},{201023,0,1,5},{201025,0,1,5},{201026,0,1,5},{201027,0,1,5},{201029,0,1,5},{202010,0,1,50},{202011,0,1,50},{202012,0,1,50},{202013,0,1,50},{202015,0,1,50},{202016,0,1,50},{202017,0,1,50},{202019,0,1,50},{202020,0,1,2},{202021,0,1,5},{202022,0,1,5},{202023,0,1,5},{202025,0,1,5},{202026,0,1,5},{202027,0,1,5},
A51: 110012 | B51: 普通首饰碎片 | D51: 0 | E51: 1 | F51: 3 | G51: ="{"&RC[-6]&","&RC[-3]&","&RC[-2]&","&RC[-1]&"}," -> {110012,0,1,3}, | H51: =R[-1]C&RC[-1] -> {110002,0,2,0},{110003,0,2,0},{110004,0,1,0},{110005,0,1,0},{110010,0,1,2},{110011,0,1,3},{110012,0,1,3}, | J51: 202029 | K51: 天尊鞋子 | L51: 1 | M51: 0 | N51: 1 | O51: 5 | P51: ="{"&RC[-6]&","&RC[-3]&","&RC[-2]&","&RC[-1]&"}," -> {202029,0,1,5}, | Q51: =R[-1]C&RC[-1] -> {200010,0,1,60},{200011,0,1,60},{200012,0,1,60},{200013,0,1,60},{200015,0,1,60},{200016,0,1,60},{200017,0,1,60},{200019,0,1,60},{200020,0,1,2},{200021,0,1,5},{200022,0,1,5},{200023,0,1,5},{200025,0,1,5},{200026,0,1,5},{200027,0,1,5},{200029,0,1,5},{201010,0,1,60},{201011,0,1,60},{201012,0,1,60},{201013,0,1,60},{201015,0,1,60},{201016,0,1,60},{201017,0,1,60},{201019,0,1,60},{201020,0,1,2},{201021,0,1,5},{201022,0,1,5},{201023,0,1,5},{201025,0,1,5},{201026,0,1,5},{201027,0,1,5},{201029,0,1,5},{202010,0,1,60},{202011,0,1,60},{202012,0,1,60},{202013,0,1,60},{202015,0,1,60},{202016,0,1,60},{202017,0,1,60},{202019,0,1,60},{202020,0,1,2},{202021,0,1,5},{202022,0,1,5},{202023,0,1,5},{202025,0,1,5},{202026,0,1,5},{202027,0,1,5},{202029,0,1,5}, | S51: 202029 | T51: 天尊鞋子 | U51: 1 | V51: 0 | W51: 1 | X51: 5 | Y51: ="{"&RC[-6]&","&RC[-3]&","&RC[-2]&","&RC[-1]&"}," -> {202029,0,1,5}, | Z51: =R[-1]C&RC[-1] -> {200010,0,1,50},{200011,0,1,50},{200012,0,1,50},{200013,0,1,50},{200015,0,1,50},{200016,0,1,50},{200017,0,1,50},{200019,0,1,50},{200020,0,1,2},{200021,0,1,5},{200022,0,1,5},{200023,0,1,5},{200025,0,1,5},{200026,0,1,5},{200027,0,1,5},{200029,0,1,5},{201010,0,1,50},{201011,0,1,50},{201012,0,1,50},{201013,0,1,50},{201015,0,1,50},{201016,0,1,50},{201017,0,1,50},{201019,0,1,50},{201020,0,1,2},{201021,0,1,5},{201022,0,1,5},{201023,0,1,5},{201025,0,1,5},{201026,0,1,5},{201027,0,1,5},{201029,0,1,5},{202010,0,1,50},{202011,0,1,50},{202012,0,1,50},{202013,0,1,50},{202015,0,1,50},{202016,0,1,50},{202017,0,1,50},{202019,0,1,50},{202020,0,1,2},{202021,0,1,5},{202022,0,1,5},{202023,0,1,5},{202025,0,1,5},{202026,0,1,5},{202027,0,1,5},{202029,0,1,5},
A52: 110013 | B52: 精炼武装碎片 | D52: 0 | E52: 1 | F52: 0 | G52: ="{"&RC[-6]&","&RC[-3]&","&RC[-2]&","&RC[-1]&"}," -> {110013,0,1,0}, | H52: =R[-1]C&RC[-1] -> {110002,0,2,0},{110003,0,2,0},{110004,0,1,0},{110005,0,1,0},{110010,0,1,2},{110011,0,1,3},{110012,0,1,3},{110013,0,1,0}, | J52: 305003 | K52: 怒斩 | L52: 1 | M52: 0 | N52: 1 | O52: 10 | P52: ="{"&RC[-6]&","&RC[-3]&","&RC[-2]&","&RC[-1]&"}," -> {305003,0,1,10}, | Q52: =R[-1]C&RC[-1] -> {200010,0,1,60},{200011,0,1,60},{200012,0,1,60},{200013,0,1,60},{200015,0,1,60},{200016,0,1,60},{200017,0,1,60},{200019,0,1,60},{200020,0,1,2},{200021,0,1,5},{200022,0,1,5},{200023,0,1,5},{200025,0,1,5},{200026,0,1,5},{200027,0,1,5},{200029,0,1,5},{201010,0,1,60},{201011,0,1,60},{201012,0,1,60},{201013,0,1,60},{201015,0,1,60},{201016,0,1,60},{201017,0,1,60},{201019,0,1,60},{201020,0,1,2},{201021,0,1,5},{201022,0,1,5},{201023,0,1,5},{201025,0,1,5},{201026,0,1,5},{201027,0,1,5},{201029,0,1,5},{202010,0,1,60},{202011,0,1,60},{202012,0,1,60},{202013,0,1,60},{202015,0,1,60},{202016,0,1,60},{202017,0,1,60},{202019,0,1,60},{202020,0,1,2},{202021,0,1,5},{202022,0,1,5},{202023,0,1,5},{202025,0,1,5},{202026,0,1,5},{202027,0,1,5},{202029,0,1,5},{305003,0,1,10}, | S52: 305003 | T52: 怒斩 | U52: 1 | V52: 0 | W52: 1 | X52: 10 | Y52: ="{"&RC[-6]&","&RC[-3]&","&RC[-2]&","&RC[-1]&"}," -> {305003,0,1,10}, | Z52: =R[-1]C&RC[-1] -> {200010,0,1,50},{200011,0,1,50},{200012,0,1,50},{200013,0,1,50},{200015,0,1,50},{200016,0,1,50},{200017,0,1,50},{200019,0,1,50},{200020,0,1,2},{200021,0,1,5},{200022,0,1,5},{200023,0,1,5},{200025,0,1,5},{200026,0,1,5},{200027,0,1,5},{200029,0,1,5},{201010,0,1,50},{201011,0,1,50},{201012,0,1,50},{201013,0,1,50},{201015,0,1,50},{201016,0,1,50},{201017,0,1,50},{201019,0,1,50},{201020,0,1,2},{201021,0,1,5},{201022,0,1,5},{201023,0,1,5},{201025,0,1,5},{201026,0,1,5},{201027,0,1,5},{201029,0,1,5},{202010,0,1,50},{202011,0,1,50},{202012,0,1,50},{202013,0,1,50},{202015,0,1,50},{202016,0,1,50},{202017,0,1,50},{202019,0,1,50},{202020,0,1,2},{202021,0,1,5},{202022,0,1,5},{202023,0,1,5},{202025,0,1,5},{202026,0,1,5},{202027,0,1,5},{202029,0,1,5},{305003,0,1,10},
A53: 110014 | B53: 精炼防具碎片 | D53: 0 | E53: 1 | F53: 0 | G53: ="{"&RC[-6]&","&RC[-3]&","&RC[-2]&","&RC[-1]&"}," -> {110014,0,1,0}, | H53: =R[-1]C&RC[-1] -> {110002,0,2,0},{110003,0,2,0},{110004,0,1,0},{110005,0,1,0},{110010,0,1,2},{110011,0,1,3},{110012,0,1,3},{110013,0,1,0},{110014,0,1,0}, | J53: 305004 | K53: 龙牙 | L53: 1 | M53: 0 | N53: 1 | O53: 10 | P53: ="{"&RC[-6]&","&RC[-3]&","&RC[-2]&","&RC[-1]&"}," -> {305004,0,1,10}, | Q53: =R[-1]C&RC[-1] -> {200010,0,1,60},{200011,0,1,60},{200012,0,1,60},{200013,0,1,60},{200015,0,1,60},{200016,0,1,60},{200017,0,1,60},{200019,0,1,60},{200020,0,1,2},{200021,0,1,5},{200022,0,1,5},{200023,0,1,5},{200025,0,1,5},{200026,0,1,5},{200027,0,1,5},{200029,0,1,5},{201010,0,1,60},{201011,0,1,60},{201012,0,1,60},{201013,0,1,60},{201015,0,1,60},{201016,0,1,60},{201017,0,1,60},{201019,0,1,60},{201020,0,1,2},{201021,0,1,5},{201022,0,1,5},{201023,0,1,5},{201025,0,1,5},{201026,0,1,5},{201027,0,1,5},{201029,0,1,5},{202010,0,1,60},{202011,0,1,60},{202012,0,1,60},{202013,0,1,60},{202015,0,1,60},{202016,0,1,60},{202017,0,1,60},{202019,0,1,60},{202020,0,1,2},{202021,0,1,5},{202022,0,1,5},{202023,0,1,5},{202025,0,1,5},{202026,0,1,5},{202027,0,1,5},{202029,0,1,5},{305003,0,1,10},{305004,0,1,10}, | S53: 305004 | T53: 龙牙 | U53: 1 | V53: 0 | W53: 1 | X53: 10 | Y53: ="{"&RC[-6]&","&RC[-3]&","&RC[-2]&","&RC[-1]&"}," -> {305004,0,1,10}, | Z53: =R[-1]C&RC[-1] -> {200010,0,1,50},{200011,0,1,50},{200012,0,1,50},{200013,0,1,50},{200015,0,1,50},{200016,0,1,50},{200017,0,1,50},{200019,0,1,50},{200020,0,1,2},{200021,0,1,5},{200022,0,1,5},{200023,0,1,5},{200025,0,1,5},{200026,0,1,5},{200027,0,1,5},{200029,0,1,5},{201010,0,1,50},{201011,0,1,50},{201012,0,1,50},{201013,0,1,50},{201015,0,1,50},{201016,0,1,50},{201017,0,1,50},{201019,0,1,50},{201020,0,1,2},{201021,0,1,5},{201022,0,1,5},{201023,0,1,5},{201025,0,1,5},{201026,0,1,5},{201027,0,1,5},{201029,0,1,5},{202010,0,1,50},{202011,0,1,50},{202012,0,1,50},{202013,0,1,50},{202015,0,1,50},{202016,0,1,50},{202017,0,1,50},{202019,0,1,50},{202020,0,1,2},{202021,0,1,5},{202022,0,1,5},{202023,0,1,5},{202025,0,1,5},{202026,0,1,5},{202027,0,1,5},{202029,0,1,5},{305003,0,1,10},{305004,0,1,10},
A54: 110015 | B54: 精炼首饰碎片 | D54: 0 | E54: 1 | F54: 0 | G54: ="{"&RC[-6]&","&RC[-3]&","&RC[-2]&","&RC[-1]&"}" -> {110015,0,1,0} | H54: =R[-1]C&RC[-1] -> {110002,0,2,0},{110003,0,2,0},{110004,0,1,0},{110005,0,1,0},{110010,0,1,2},{110011,0,1,3},{110012,0,1,3},{110013,0,1,0},{110014,0,1,0},{110015,0,1,0} | J54: 305005 | K54: 逍遥扇 | L54: 1 | M54: 0 | N54: 1 | O54: 10 | P54: ="{"&RC[-6]&","&RC[-3]&","&RC[-2]&","&RC[-1]&"}" -> {305005,0,1,10} | Q54: =R[-1]C&RC[-1] -> {200010,0,1,60},{200011,0,1,60},{200012,0,1,60},{200013,0,1,60},{200015,0,1,60},{200016,0,1,60},{200017,0,1,60},{200019,0,1,60},{200020,0,1,2},{200021,0,1,5},{200022,0,1,5},{200023,0,1,5},{200025,0,1,5},{200026,0,1,5},{200027,0,1,5},{200029,0,1,5},{201010,0,1,60},{201011,0,1,60},{201012,0,1,60},{201013,0,1,60},{201015,0,1,60},{201016,0,1,60},{201017,0,1,60},{201019,0,1,60},{201020,0,1,2},{201021,0,1,5},{201022,0,1,5},{201023,0,1,5},{201025,0,1,5},{201026,0,1,5},{201027,0,1,5},{201029,0,1,5},{202010,0,1,60},{202011,0,1,60},{202012,0,1,60},{202013,0,1,60},{202015,0,1,60},{202016,0,1,60},{202017,0,1,60},{202019,0,1,60},{202020,0,1,2},{202021,0,1,5},{202022,0,1,5},{202023,0,1,5},{202025,0,1,5},{202026,0,1,5},{202027,0,1,5},{202029,0,1,5},{305003,0,1,10},{305004,0,1,10},{305005,0,1,10} | S54: 305005 | T54: 逍遥扇 | U54: 1 | V54: 0 | W54: 1 | X54: 10 | Y54: ="{"&RC[-6]&","&RC[-3]&","&RC[-2]&","&RC[-1]&"}" -> {305005,0,1,10} | Z54: =R[-1]C&RC[-1] -> {200010,0,1,50},{200011,0,1,50},{200012,0,1,50},{200013,0,1,50},{200015,0,1,50},{200016,0,1,50},{200017,0,1,50},{200019,0,1,50},{200020,0,1,2},{200021,0,1,5},{200022,0,1,5},{200023,0,1,5},{200025,0,1,5},{200026,0,1,5},{200027,0,1,5},{200029,0,1,5},{201010,0,1,50},{201011,0,1,50},{201012,0,1,50},{201013,0,1,50},{201015,0,1,50},{201016,0,1,50},{201017,0,1,50},{201019,0,1,50},{201020,0,1,2},{201021,0,1,5},{201022,0,1,5},{201023,0,1,5},{201025,0,1,5},{201026,0,1,5},{201027,0,1,5},{201029,0,1,5},{202010,0,1,50},{202011,0,1,50},{202012,0,1,50},{202013,0,1,50},{202015,0,1,50},{202016,0,1,50},{202017,0,1,50},{202019,0,1,50},{202020,0,1,2},{202021,0,1,5},{202022,0,1,5},{202023,0,1,5},{202025,0,1,5},{202026,0,1,5},{202027,0,1,5},{202029,0,1,5},{305003,0,1,10},{305004,0,1,10},{305005,0,1,10}
A57: BOSS怪掉落 | F57: 装备 | G57: 概率／100 | J57: 110002 | K57: 强化石 | M57: 1 | N57: 2 | O57: 0 | P57: ="{"&RC[-6]&","&RC[-3]&","&RC[-2]&","&RC[-1]&"}," -> {110002,1,2,0}, | Q57: =RC[-1] -> {110002,1,2,0}, | S57: 110002 | T57: 强化石 | V57: 1 | W57: 2 | X57: 0 | Y57: ="{"&RC[-6]&","&RC[-3]&","&RC[-2]&","&RC[-1]&"}," -> {110002,1,2,0}, | Z57: =RC[-1] -> {110002,1,2,0},
F58: 3 | G58: 100 | H58: ="{0,[{"&RC[-2]&","&RC[-1]&"}],["&R[-16]C&"]}" -> {0,[{3,100}],[{200000,0,1,30},{200001,0,1,30},{200002,0,1,30},{200003,0,1,30},{200006,0,1,30},{200010,0,1,5},{200011,0,1,10},{200012,0,1,10},{200013,0,1,10},{200015,0,1,10},{200016,0,1,10},{200017,0,1,10},{200019,0,1,10},{201000,0,1,30},{201001,0,1,30},{201002,0,1,30},{201003,0,1,30},{201006,0,1,30},{201010,0,1,5},{201011,0,1,10},{201012,0,1,10},{201013,0,1,10},{201015,0,1,10},{201016,0,1,10},{201017,0,1,10},{201019,0,1,10},{202000,0,1,30},{202001,0,1,30},{202002,0,1,30},{202003,0,1,30},{202006,0,1,30},{202010,0,1,5},{202011,0,1,10},{202012,0,1,10},{202013,0,1,10},{202015,0,1,10},{202016,0,1,10},{202017,0,1,10},{202019,0,1,10}]} | J58: 110003 | K58: 洗炼石 | M58: 1 | N58: 2 | O58: 0 | P58: ="{"&RC[-6]&","&RC[-3]&","&RC[-2]&","&RC[-1]&"}," -> {110003,1,2,0}, | Q58: =R[-1]C&RC[-1] -> {110002,1,2,0},{110003,1,2,0}, | S58: 110003 | T58: 洗炼石 | V58: 1 | W58: 2 | X58: 0 | Y58: ="{"&RC[-6]&","&RC[-3]&","&RC[-2]&","&RC[-1]&"}," -> {110003,1,2,0}, | Z58: =R[-1]C&RC[-1] -> {110002,1,2,0},{110003,1,2,0},
F59: 道具 | G59: 概率／100 | J59: 110004 | K59: 红药 | M59: 1 | N59: 1 | O59: 0 | P59: ="{"&RC[-6]&","&RC[-3]&","&RC[-2]&","&RC[-1]&"}," -> {110004,1,1,0}, | Q59: =R[-1]C&RC[-1] -> {110002,1,2,0},{110003,1,2,0},{110004,1,1,0}, | S59: 110004 | T59: 红药 | V59: 1 | W59: 1 | X59: 0 | Y59: ="{"&RC[-6]&","&RC[-3]&","&RC[-2]&","&RC[-1]&"}," -> {110004,1,1,0}, | Z59: =R[-1]C&RC[-1] -> {110002,1,2,0},{110003,1,2,0},{110004,1,1,0},
F60: 2 | G60: 100 | H60: ="{0,[{"&RC[-2]&","&RC[-1]&"}],["&R[-6]C&"]}" -> {0,[{2,100}],[{110002,0,2,0},{110003,0,2,0},{110004,0,1,0},{110005,0,1,0},{110010,0,1,2},{110011,0,1,3},{110012,0,1,3},{110013,0,1,0},{110014,0,1,0},{110015,0,1,0}]} | J60: 110005 | K60: 蓝药 | M60: 1 | N60: 1 | O60: 0 | P60: ="{"&RC[-6]&","&RC[-3]&","&RC[-2]&","&RC[-1]&"}," -> {110005,1,1,0}, | Q60: =R[-1]C&RC[-1] -> {110002,1,2,0},{110003,1,2,0},{110004,1,1,0},{110005,1,1,0}, | S60: 110005 | T60: 蓝药 | V60: 1 | W60: 1 | X60: 0 | Y60: ="{"&RC[-6]&","&RC[-3]&","&RC[-2]&","&RC[-1]&"}," -> {110005,1,1,0}, | Z60: =R[-1]C&RC[-1] -> {110002,1,2,0},{110003,1,2,0},{110004,1,1,0},{110005,1,1,0},
F61: 金币 | G61: 概率／100 | J61: 110010 | K61: 普通武装碎片 | M61: 1 | N61: 1 | O61: 2 | P61: ="{"&RC[-6]&","&RC[-3]&","&RC[-2]&","&RC[-1]&"}," -> {110010,1,1,2}, | Q61: =R[-1]C&RC[-1] -> {110002,1,2,0},{110003,1,2,0},{110004,1,1,0},{110005,1,1,0},{110010,1,1,2}, | S61: 110010 | T61: 普通武装碎片 | V61: 1 | W61: 1 | X61: 2 | Y61: ="{"&RC[-6]&","&RC[-3]&","&RC[-2]&","&RC[-1]&"}," -> {110010,1,1,2}, | Z61: =R[-1]C&RC[-1] -> {110002,1,2,0},{110003,1,2,0},{110004,1,1,0},{110005,1,1,0},{110010,1,1,2},
F62: 3 | G62: 100 | H62: {0,[{10,100}],[{110009,1,1000,1}]} | J62: 110011 | K62: 普通防具碎片 | M62: 1 | N62: 1 | O62: 3 | P62: ="{"&RC[-6]&","&RC[-3]&","&RC[-2]&","&RC[-1]&"}," -> {110011,1,1,3}, | Q62: =R[-1]C&RC[-1] -> {110002,1,2,0},{110003,1,2,0},{110004,1,1,0},{110005,1,1,0},{110010,1,1,2},{110011,1,1,3}, | S62: 110011 | T62: 普通防具碎片 | V62: 1 | W62: 1 | X62: 3 | Y62: ="{"&RC[-6]&","&RC[-3]&","&RC[-2]&","&RC[-1]&"}," -> {110011,1,1,3}, | Z62: =R[-1]C&RC[-1] -> {110002,1,2,0},{110003,1,2,0},{110004,1,1,0},{110005,1,1,0},{110010,1,1,2},{110011,1,1,3},
J63: 110012 | K63: 普通首饰碎片 | M63: 1 | N63: 1 | O63: 3 | P63: ="{"&RC[-6]&","&RC[-3]&","&RC[-2]&","&RC[-1]&"}," -> {110012,1,1,3}, | Q63: =R[-1]C&RC[-1] -> {110002,1,2,0},{110003,1,2,0},{110004,1,1,0},{110005,1,1,0},{110010,1,1,2},{110011,1,1,3},{110012,1,1,3}, | S63: 110012 | T63: 普通首饰碎片 | V63: 1 | W63: 1 | X63: 3 | Y63: ="{"&RC[-6]&","&RC[-3]&","&RC[-2]&","&RC[-1]&"}," -> {110012,1,1,3}, | Z63: =R[-1]C&RC[-1] -> {110002,1,2,0},{110003,1,2,0},{110004,1,1,0},{110005,1,1,0},{110010,1,1,2},{110011,1,1,3},{110012,1,1,3},
H64: ="["&R[-6]C&","&R[-4]C&","&R[-2]C&"]" -> [{0,[{3,100}],[{200000,0,1,30},{200001,0,1,30},{200002,0,1,30},{200003,0,1,30},{200006,0,1,30},{200010,0,1,5},{200011,0,1,10},{200012,0,1,10},{200013,0,1,10},{200015,0,1,10},{200016,0,1,10},{200017,0,1,10},{200019,0,1,10},{201000,0,1,30},{201001,0,1,30},{201002,0,1,30},{201003,0,1,30},{201006,0,1,30},{201010,0,1,5},{201011,0,1,10},{201012,0,1,10},{201013,0,1,10},{201015,0,1,10},{201016,0,1,10},{201017,0,1,10},{201019,0,1,10},{202000,0,1,30},{202001,0,1,30},{202002,0,1,30},{202003,0,1,30},{202006,0,1,30},{202010,0,1,5},{202011,0,1,10},{202012,0,1,10},{202013,0,1,10},{202015,0,1,10},{202016,0,1,10},{202017,0,1,10},{202019,0,1,10}]},{0,[{2,100}],[{110002,0,2,0},{110003,0,2,0},{110004,0,1,0},{110005,0,1,0},{110010,0,1,2},{110011,0,1,3},{110012,0,1,3},{110013,0,1,0},{110014,0,1,0},{110015,0,1,0}]},{0,[{10,100}],[{110009,1,1000,1}]}] | J64: 110013 | K64: 精炼武装碎片 | M64: 0 | N64: 1 | O64: 1 | P64: ="{"&RC[-6]&","&RC[-3]&","&RC[-2]&","&RC[-1]&"}," -> {110013,0,1,1}, | Q64: =R[-1]C&RC[-1] -> {110002,1,2,0},{110003,1,2,0},{110004,1,1,0},{110005,1,1,0},{110010,1,1,2},{110011,1,1,3},{110012,1,1,3},{110013,0,1,1}, | S64: 110013 | T64: 精炼武装碎片 | V64: 0 | W64: 1 | X64: 2 | Y64: ="{"&RC[-6]&","&RC[-3]&","&RC[-2]&","&RC[-1]&"}," -> {110013,0,1,2}, | Z64: =R[-1]C&RC[-1] -> {110002,1,2,0},{110003,1,2,0},{110004,1,1,0},{110005,1,1,0},{110010,1,1,2},{110011,1,1,3},{110012,1,1,3},{110013,0,1,2},
J65: 110014 | K65: 精炼防具碎片 | M65: 0 | N65: 1 | O65: 2 | P65: ="{"&RC[-6]&","&RC[-3]&","&RC[-2]&","&RC[-1]&"}," -> {110014,0,1,2}, | Q65: =R[-1]C&RC[-1] -> {110002,1,2,0},{110003,1,2,0},{110004,1,1,0},{110005,1,1,0},{110010,1,1,2},{110011,1,1,3},{110012,1,1,3},{110013,0,1,1},{110014,0,1,2}, | S65: 110014 | T65: 精炼防具碎片 | V65: 0 | W65: 1 | X65: 3 | Y65: ="{"&RC[-6]&","&RC[-3]&","&RC[-2]&","&RC[-1]&"}," -> {110014,0,1,3}, | Z65: =R[-1]C&RC[-1] -> {110002,1,2,0},{110003,1,2,0},{110004,1,1,0},{110005,1,1,0},{110010,1,1,2},{110011,1,1,3},{110012,1,1,3},{110013,0,1,2},{110014,0,1,3},
J66: 110015 | K66: 精炼首饰碎片 | M66: 0 | N66: 1 | O66: 2 | P66: ="{"&RC[-6]&","&RC[-3]&","&RC[-2]&","&RC[-1]&"}" -> {110015,0,1,2} | Q66: =R[-1]C&RC[-1] -> {110002,1,2,0},{110003,1,2,0},{110004,1,1,0},{110005,1,1,0},{110010,1,1,2},{110011,1,1,3},{110012,1,1,3},{110013,0,1,1},{110014,0,1,2},{110015,0,1,2} | S66: 110015 | T66: 精炼首饰碎片 | V66: 0 | W66: 1 | X66: 3 | Y66: ="{"&RC[-6]&","&RC[-3]&","&RC[-2]&","&RC[-1]&"}" -> {110015,0,1,3} | Z66: =R[-1]C&RC[-1] -> {110002,1,2,0},{110003,1,2,0},{110004,1,1,0},{110005,1,1,0},{110010,1,1,2},{110011,1,1,3},{110012,1,1,3},{110013,0,1,2},{110014,0,1,3},{110015,0,1,3}
J70: BOSS怪掉落 | O70: 装备 | P70: 概率／100 | S70: BOSS怪掉落 | X70: 装备 | Y70: 概率／100
O71: 3 | P71: 100 | Q71: ="{0,[{"&RC[-2]&","&RC[-1]&"}],["&R[-17]C&"]}" -> {0,[{3,100}],[{200010,0,1,60},{200011,0,1,60},{200012,0,1,60},{200013,0,1,60},{200015,0,1,60},{200016,0,1,60},{200017,0,1,60},{200019,0,1,60},{200020,0,1,2},{200021,0,1,5},{200022,0,1,5},{200023,0,1,5},{200025,0,1,5},{200026,0,1,5},{200027,0,1,5},{200029,0,1,5},{201010,0,1,60},{201011,0,1,60},{201012,0,1,60},{201013,0,1,60},{201015,0,1,60},{201016,0,1,60},{201017,0,1,60},{201019,0,1,60},{201020,0,1,2},{201021,0,1,5},{201022,0,1,5},{201023,0,1,5},{201025,0,1,5},{201026,0,1,5},{201027,0,1,5},{201029,0,1,5},{202010,0,1,60},{202011,0,1,60},{202012,0,1,60},{202013,0,1,60},{202015,0,1,60},{202016,0,1,60},{202017,0,1,60},{202019,0,1,60},{202020,0,1,2},{202021,0,1,5},{202022,0,1,5},{202023,0,1,5},{202025,0,1,5},{202026,0,1,5},{202027,0,1,5},{202029,0,1,5},{305003,0,1,10},{305004,0,1,10},{305005,0,1,10}]} | X71: 3 | Y71: 100 | Z71: ="{0,[{"&RC[-2]&","&RC[-1]&"}],["&R[-17]C&"]}" -> {0,[{3,100}],[{200010,0,1,50},{200011,0,1,50},{200012,0,1,50},{200013,0,1,50},{200015,0,1,50},{200016,0,1,50},{200017,0,1,50},{200019,0,1,50},{200020,0,1,2},{200021,0,1,5},{200022,0,1,5},{200023,0,1,5},{200025,0,1,5},{200026,0,1,5},{200027,0,1,5},{200029,0,1,5},{201010,0,1,50},{201011,0,1,50},{201012,0,1,50},{201013,0,1,50},{201015,0,1,50},{201016,0,1,50},{201017,0,1,50},{201019,0,1,50},{201020,0,1,2},{201021,0,1,5},{201022,0,1,5},{201023,0,1,5},{201025,0,1,5},{201026,0,1,5},{201027,0,1,5},{201029,0,1,5},{202010,0,1,50},{202011,0,1,50},{202012,0,1,50},{202013,0,1,50},{202015,0,1,50},{202016,0,1,50},{202017,0,1,50},{202019,0,1,50},{202020,0,1,2},{202021,0,1,5},{202022,0,1,5},{202023,0,1,5},{202025,0,1,5},{202026,0,1,5},{202027,0,1,5},{202029,0,1,5},{305003,0,1,10},{305004,0,1,10},{305005,0,1,10}]}
O72: 道具 | P72: 概率／100 | X72: 道具 | Y72: 概率／100
O73: 2 | P73: 100 | Q73: ="{0,[{"&RC[-2]&","&RC[-1]&"}],["&R[-7]C&"]}" -> {0,[{2,100}],[{110002,1,2,0},{110003,1,2,0},{110004,1,1,0},{110005,1,1,0},{110010,1,1,2},{110011,1,1,3},{110012,1,1,3},{110013,0,1,1},{110014,0,1,2},{110015,0,1,2}]} | X73: 2 | Y73: 100 | Z73: ="{0,[{"&RC[-2]&","&RC[-1]&"}],["&R[-7]C&"]}" -> {0,[{2,100}],[{110002,1,2,0},{110003,1,2,0},{110004,1,1,0},{110005,1,1,0},{110010,1,1,2},{110011,1,1,3},{110012,1,1,3},{110013,0,1,2},{110014,0,1,3},{110015,0,1,3}]}
O74: 金币 | P74: 概率／100 | X74: 金币 | Y74: 概率／100
O75: 3 | P75: 100 | Q75: {0,[{10,100}],[{110009,1,1000,1}]} | X75: 3 | Y75: 100 | Z75: {0,[{10,100}],[{110009,1,1000,1}]}
Q77: ="["&R[-6]C&","&R[-4]C&","&R[-2]C&"]" -> [{0,[{3,100}],[{200010,0,1,60},{200011,0,1,60},{200012,0,1,60},{200013,0,1,60},{200015,0,1,60},{200016,0,1,60},{200017,0,1,60},{200019,0,1,60},{200020,0,1,2},{200021,0,1,5},{200022,0,1,5},{200023,0,1,5},{200025,0,1,5},{200026,0,1,5},{200027,0,1,5},{200029,0,1,5},{201010,0,1,60},{201011,0,1,60},{201012,0,1,60},{201013,0,1,60},{201015,0,1,60},{201016,0,1,60},{201017,0,1,60},{201019,0,1,60},{201020,0,1,2},{201021,0,1,5},{201022,0,1,5},{201023,0,1,5},{201025,0,1,5},{201026,0,1,5},{201027,0,1,5},{201029,0,1,5},{202010,0,1,60},{202011,0,1,60},{202012,0,1,60},{202013,0,1,60},{202015,0,1,60},{202016,0,1,60},{202017,0,1,60},{202019,0,1,60},{202020,0,1,2},{202021,0,1,5},{202022,0,1,5},{202023,0,1,5},{202025,0,1,5},{202026,0,1,5},{202027,0,1,5},{202029,0,1,5},{305003,0,1,10},{305004,0,1,10},{305005,0,1,10}]},{0,[{2,100}],[{110002,1,2,0},{110003,1,2,0},{110004,1,1,0},{110005,1,1,0},{110010,1,1,2},{110011,1,1,3},{110012,1,1,3},{110013,0,1,1},{110014,0,1,2},{110015,0,1,2}]},{0,[{10,100}],[{110009,1,1000,1}]}] | Z77: ="["&R[-6]C&","&R[-4]C&","&R[-2]C&"]" -> [{0,[{3,100}],[{200010,0,1,50},{200011,0,1,50},{200012,0,1,50},{200013,0,1,50},{200015,0,1,50},{200016,0,1,50},{200017,0,1,50},{200019,0,1,50},{200020,0,1,2},{200021,0,1,5},{200022,0,1,5},{200023,0,1,5},{200025,0,1,5},{200026,0,1,5},{200027,0,1,5},{200029,0,1,5},{201010,0,1,50},{201011,0,1,50},{201012,0,1,50},{201013,0,1,50},{201015,0,1,50},{201016,0,1,50},{201017,0,1,50},{201019,0,1,50},{201020,0,1,2},{201021,0,1,5},{201022,0,1,5},{201023,0,1,5},{201025,0,1,5},{201026,0,1,5},{201027,0,1,5},{201029,0,1,5},{202010,0,1,50},{202011,0,1,50},{202012,0,1,50},{202013,0,1,50},{202015,0,1,50},{202016,0,1,50},{202017,0,1,50},{202019,0,1,50},{202020,0,1,2},{202021,0,1,5},{202022,0,1,5},{202023,0,1,5},{202025,0,1,5},{202026,0,1,5},{202027,0,1,5},{202029,0,1,5},{305003,0,1,10},{305004,0,1,10},{305005,0,1,10}]},{0,[{2,100}],[{110002,1,2,0},{110003,1,2,0},{110004,1,1,0},{110005,1,1,0},{110010,1,1,2},{110011,1,1,3},{110012,1,1,3},{110013,0,1,2},{110014,0,1,3},{110015,0,1,3}]},{0,[{10,100}],[{110009,1,1000,1}]}]

Sheet: 行会秘境BOSS
A2: 秘境1（1-30级装备掉落+首冲武器） | J2: 秘境2（1-35级装备掉落+首冲武器） | S2: 秘境3（15-40级装备掉落）
A3: ID | B3: 名称 | C3: 品质 | D3: 是否绑定 | E3: 数量 | J3: ID | K3: 名称 | L3: 品质 | M3: 是否绑定 | N3: 数量 | S3: ID | T3: 名称 | U3: 品质 | V3: 是否绑定 | W3: 数量
A4: 200000 | B4: 八荒 | C4: 1 | D4: 0 | E4: 1 | F4: 30 | G4: ="{"&RC[-6]&","&RC[-3]&","&RC[-2]&","&RC[-1]&"}," -> {200000,0,1,30}, | H4: =RC[-1] -> {200000,0,1,30}, | J4: 200010 | K4: 炼狱 | L4: 1 | M4: 0 | N4: 1 | O4: 40 | P4: ="{"&RC[-6]&","&RC[-3]&","&RC[-2]&","&RC[-1]&"}," -> {200010,0,1,40}, | Q4: =RC[-1] -> {200010,0,1,40}, | S4: 200010 | T4: 炼狱 | U4: 1 | V4: 0 | W4: 1 | X4: 30 | Y4: ="{"&RC[-6]&","&RC[-3]&","&RC[-2]&","&RC[-1]&"}," -> {200010,0,1,30}, | Z4: =RC[-1] -> {200010,0,1,30},
A5: 200001 | B5: 轻盔 | C5: 1 | D5: 0 | E5: 1 | F5: 30 | G5: ="{"&RC[-6]&","&RC[-3]&","&RC[-2]&","&RC[-1]&"}," -> {200001,0,1,30}, | H5: =R[-1]C&RC[-1] -> {200000,0,1,30},{200001,0,1,30}, | J5: 200011 | K5: 绿色项链 | L5: 1 | M5: 0 | N5: 1 | O5: 40 | P5: ="{"&RC[-6]&","&RC[-3]&","&RC[-2]&","&RC[-1]&"}," -> {200011,0,1,40}, | Q5: =R[-1]C&RC[-1] -> {200010,0,1,40},{200011,0,1,40}, | S5: 200011 | T5: 绿色项链 | U5: 1 | V5: 0 | W5: 1 | X5: 30 | Y5: ="{"&RC[-6]&","&RC[-3]&","&RC[-2]&","&RC[-1]&"}," -> {200011,0,1,30}, | Z5: =R[-1]C&RC[-1] -> {200010,0,1,30},{200011,0,1,30},
A6: 200002 | B6: 珊瑚戒指 | C6: 1 | D6: 0 | E6: 1 | F6: 30 | G6: ="{"&RC[-6]&","&RC[-3]&","&RC[-2]&","&RC[-1]&"}," -> {200002,0,1,30}, | H6: =R[-1]C&RC[-1] -> {200000,0,1,30},{200001,0,1,30},{200002,0,1,30}, | J6: 200012 | K6: 战神盔甲 | L6: 1 | M6: 0 | N6: 1 | O6: 40 | P6: ="{"&RC[-6]&","&RC[-3]&","&RC[-2]&","&RC[-1]&"}," -> {200012,0,1,40}, | Q6: =R[-1]C&RC[-1] -> {200010,0,1,40},{200011,0,1,40},{200012,0,1,40}, | S6: 200012 | T6: 战神盔甲 | U6: 1 | V6: 0 | W6: 1 | X6: 30 | Y6: ="{"&RC[-6]&","&RC[-3]&","&RC[-2]&","&RC[-1]&"}," -> {200012,0,1,30}, | Z6: =R[-1]C&RC[-1] -> {200010,0,1,30},{200011,0,1,30},{200012,0,1,30},
A7: 200003 | B7: 魔力手镯 | C7: 1 | D7: 0 | E7: 1 | F7: 30 | G7: ="{"&RC[-6]&","&RC[-3]&","&RC[-2]&","&RC[-1]&"}," -> {200003,0,1,30}, | H7: =R[-1]C&RC[-1] -> {200000,0,1,30},{200001,0,1,30},{200002,0,1,30},{200003,0,1,30}, | J7: 200013 | K7: 力量戒指 | L7: 1 | M7: 0 | N7: 1 | O7: 40 | P7: ="{"&RC[-6]&","&RC[-3]&","&RC[-2]&","&RC[-1]&"}," -> {200013,0,1,40}, | Q7: =R[-1]C&RC[-1] -> {200010,0,1,40},{200011,0,1,40},{200012,0,1,40},{200013,0,1,40}, | S7: 200013 | T7: 力量戒指 | U7: 1 | V7: 0 | W7: 1 | X7: 30 | Y7: ="{"&RC[-6]&","&RC[-3]&","&RC[-2]&","&RC[-1]&"}," -> {200013,0,1,30}, | Z7: =R[-1]C&RC[-1] -> {200010,0,1,30},{200011,0,1,30},{200012,0,1,30},{200013,0,1,30},
A8: 200006 | B8: 恶魔项链 | C8: 1 | D8: 0 | E8: 1 | F8: 30 | G8: ="{"&RC[-6]&","&RC[-3]&","&RC[-2]&","&RC[-1]&"}," -> {200006,0,1,30}, | H8: =R[-1]C&RC[-1] -> {200000,0,1,30},{200001,0,1,30},{200002,0,1,30},{200003,0,1,30},{200006,0,1,30}, | J8: 200015 | K8: 战士头盔 | L8: 1 | M8: 0 | N8: 1 | O8: 40 | P8: ="{"&RC[-6]&","&RC[-3]&","&RC[-2]&","&RC[-1]&"}," -> {200015,0,1,40}, | Q8: =R[-1]C&RC[-1] -> {200010,0,1,40},{200011,0,1,40},{200012,0,1,40},{200013,0,1,40},{200015,0,1,40}, | S8: 200015 | T8: 战士头盔 | U8: 1 | V8: 0 | W8: 1 | X8: 30 | Y8: ="{"&RC[-6]&","&RC[-3]&","&RC[-2]&","&RC[-1]&"}," -> {200015,0,1,30}, | Z8: =R[-1]C&RC[-1] -> {200010,0,1,30},{200011,0,1,30},{200012,0,1,30},{200013,0,1,30},{200015,0,1,30},
A9: 200010 | B9: 炼狱 | C9: 1 | D9: 0 | E9: 1 | F9: 5 | G9: ="{"&RC[-6]&","&RC[-3]&","&RC[-2]&","&RC[-1]&"}," -> {200010,0,1,5}, | H9: =R[-1]C&RC[-1] -> {200000,0,1,30},{200001,0,1,30},{200002,0,1,30},{200003,0,1,30},{200006,0,1,30},{200010,0,1,5}, | J9: 200016 | K9: 阎罗手镯 | L9: 1 | M9: 0 | N9: 1 | O9: 40 | P9: ="{"&RC[-6]&","&RC[-3]&","&RC[-2]&","&RC[-1]&"}," -> {200016,0,1,40}, | Q9: =R[-1]C&RC[-1] -> {200010,0,1,40},{200011,0,1,40},{200012,0,1,40},{200013,0,1,40},{200015,0,1,40},{200016,0,1,40}, | S9: 200016 | T9: 阎罗手镯 | U9: 1 | V9: 0 | W9: 1 | X9: 30 | Y9: ="{"&RC[-6]&","&RC[-3]&","&RC[-2]&","&RC[-1]&"}," -> {200016,0,1,30}, | Z9: =R[-1]C&RC[-1] -> {200010,0,1,30},{200011,0,1,30},{200012,0,1,30},{200013,0,1,30},{200015,0,1,30},{200016,0,1,30},
A10: 200011 | B10: 绿色项链 | C10: 1 | D10: 0 | E10: 1 | F10: 10 | G10: ="{"&RC[-6]&","&RC[-3]&","&RC[-2]&","&RC[-1]&"}," -> {200011,0,1,10}, | H10: =R[-1]C&RC[-1] -> {200000,0,1,30},{200001,0,1,30},{200002,0,1,30},{200003,0,1,30},{200006,0,1,30},{200010,0,1,5},{200011,0,1,10}, | J10: 200017 | K10: 战士腰带 | L10: 1 | M10: 0 | N10: 1 | O10: 40 | P10: ="{"&RC[-6]&","&RC[-3]&","&RC[-2]&","&RC[-1]&"}," -> {200017,0,1,40}, | Q10: =R[-1]C&RC[-1] -> {200010,0,1,40},{200011,0,1,40},{200012,0,1,40},{200013,0,1,40},{200015,0,1,40},{200016,0,1,40},{200017,0,1,40}, | S10: 200017 | T10: 战士腰带 | U10: 1 | V10: 0 | W10: 1 | X10: 30 | Y10: ="{"&RC[-6]&","&RC[-3]&","&RC[-2]&","&RC[-1]&"}," -> {200017,0,1,30}, | Z10: =R[-1]C&RC[-1] -> {200010,0,1,30},{200011,0,1,30},{200012,0,1,30},{200013,0,1,30},{200015,0,1,30},{200016,0,1,30},{200017,0,1,30},
A11: 200012 | B11: 战神盔甲 | C11: 1 | D11: 0 | E11: 1 | F11: 10 | G11: ="{"&RC[-6]&","&RC[-3]&","&RC[-2]&","&RC[-1]&"}," -> {200012,0,1,10}, | H11: =R[-1]C&RC[-1] -> {200000,0,1,30},{200001,0,1,30},{200002,0,1,30},{200003,0,1,30},{200006,0,1,30},{200010,0,1,5},{200011,0,1,10},{200012,0,1,10}, | J11: 200019 | K11: 战士鞋子 | L11: 1 | M11: 0 | N11: 1 | O11: 40 | P11: ="{"&RC[-6]&","&RC[-3]&","&RC[-2]&","&RC[-1]&"}," -> {200019,0,1,40}, | Q11: =R[-1]C&RC[-1] -> {200010,0,1,40},{200011,0,1,40},{200012,0,1,40},{200013,0,1,40},{200015,0,1,40},{200016,0,1,40},{200017,0,1,40},{200019,0,1,40}, | S11: 200019 | T11: 战士鞋子 | U11: 1 | V11: 0 | W11: 1 | X11: 30 | Y11: ="{"&RC[-6]&","&RC[-3]&","&RC[-2]&","&RC[-1]&"}," -> {200019,0,1,30}, | Z11: =R[-1]C&RC[-1] -> {200010,0,1,30},{200011,0,1,30},{200012,0,1,30},{200013,0,1,30},{200015,0,1,30},{200016,0,1,30},{200017,0,1,30},{200019,0,1,30},
A12: 200013 | B12: 力量戒指 | C12: 1 | D12: 0 | E12: 1 | F12: 10 | G12: ="{"&RC[-6]&","&RC[-3]&","&RC[-2]&","&RC[-1]&"}," -> {200013,0,1,10}, | H12: =R[-1]C&RC[-1] -> {200000,0,1,30},{200001,0,1,30},{200002,0,1,30},{200003,0,1,30},{200006,0,1,30},{200010,0,1,5},{200011,0,1,10},{200012,0,1,10},{200013,0,1,10}, | J12: 200020 | K12: 裁决 | L12: 1 | M12: 0 | N12: 1 | O12: 1 | P12: ="{"&RC[-6]&","&RC[-3]&","&RC[-2]&","&RC[-1]&"}," -> {200020,0,1,1}, | Q12: =R[-1]C&RC[-1] -> {200010,0,1,40},{200011,0,1,40},{200012,0,1,40},{200013,0,1,40},{200015,0,1,40},{200016,0,1,40},{200017,0,1,40},{200019,0,1,40},{200020,0,1,1}, | S12: 200020 | T12: 裁决 | U12: 1 | V12: 0 | W12: 1 | X12: 1 | Y12: ="{"&RC[-6]&","&RC[-3]&","&RC[-2]&","&RC[-1]&"}," -> {200020,0,1,1}, | Z12: =R[-1]C&RC[-1] -> {200010,0,1,30},{200011,0,1,30},{200012,0,1,30},{200013,0,1,30},{200015,0,1,30},{200016,0,1,30},{200017,0,1,30},{200019,0,1,30},{200020,0,1,1},
A13: 200015 | B13: 战士头盔 | C13: 1 | D13: 0 | E13: 1 | F13: 10 | G13: ="{"&RC[-6]&","&RC[-3]&","&RC[-2]&","&RC[-1]&"}," -> {200015,0,1,10}, | H13: =R[-1]C&RC[-1] -> {200000,0,1,30},{200001,0,1,30},{200002,0,1,30},{200003,0,1,30},{200006,0,1,30},{200010,0,1,5},{200011,0,1,10},{200012,0,1,10},{200013,0,1,10},{200015,0,1,10}, | J13: 200021 | K13: 圣战战甲 | L13: 1 | M13: 0 | N13: 1 | O13: 2 | P13: ="{"&RC[-6]&","&RC[-3]&","&RC[-2]&","&RC[-1]&"}," -> {200021,0,1,2}, | Q13: =R[-1]C&RC[-1] -> {200010,0,1,40},{200011,0,1,40},{200012,0,1,40},{200013,0,1,40},{200015,0,1,40},{200016,0,1,40},{200017,0,1,40},{200019,0,1,40},{200020,0,1,1},{200021,0,1,2}, | S13: 200021 | T13: 圣战战甲 | U13: 1 | V13: 0 | W13: 1 | X13: 3 | Y13: ="{"&RC[-6]&","&RC[-3]&","&RC[-2]&","&RC[-1]&"}," -> {200021,0,1,3}, | Z13: =R[-1]C&RC[-1] -> {200010,0,1,30},{200011,0,1,30},{200012,0,1,30},{200013,0,1,30},{200015,0,1,30},{200016,0,1,30},{200017,0,1,30},{200019,0,1,30},{200020,0,1,1},{200021,0,1,3},
A14: 200016 | B14: 阎罗手镯 | C14: 1 | D14: 0 | E14: 1 | F14: 10 | G14: ="{"&RC[-6]&","&RC[-3]&","&RC[-2]&","&RC[-1]&"}," -> {200016,0,1,10}, | H14: =R[-1]C&RC[-1] -> {200000,0,1,30},{200001,0,1,30},{200002,0,1,30},{200003,0,1,30},{200006,0,1,30},{200010,0,1,5},{200011,0,1,10},{200012,0,1,10},{200013,0,1,10},{200015,0,1,10},{200016,0,1,10}, | J14: 200022 | K14: 圣战项链 | L14: 1 | M14: 0 | N14: 1 | O14: 2 | P14: ="{"&RC[-6]&","&RC[-3]&","&RC[-2]&","&RC[-1]&"}," -> {200022,0,1,2}, | Q14: =R[-1]C&RC[-1] -> {200010,0,1,40},{200011,0,1,40},{200012,0,1,40},{200013,0,1,40},{200015,0,1,40},{200016,0,1,40},{200017,0,1,40},{200019,0,1,40},{200020,0,1,1},{200021,0,1,2},{200022,0,1,2}, | S14: 200022 | T14: 圣战项链 | U14: 1 | V14: 0 | W14: 1 | X14: 3 | Y14: ="{"&RC[-6]&","&RC[-3]&","&RC[-2]&","&RC[-1]&"}," -> {200022,0,1,3}, | Z14: =R[-1]C&RC[-1] -> {200010,0,1,30},{200011,0,1,30},{200012,0,1,30},{200013,0,1,30},{200015,0,1,30},{200016,0,1,30},{200017,0,1,30},{200019,0,1,30},{200020,0,1,1},{200021,0,1,3},{200022,0,1,3},
A15: 200017 | B15: 战士腰带 | C15: 1 | D15: 0 | E15: 1 | F15: 10 | G15: ="{"&RC[-6]&","&RC[-3]&","&RC[-2]&","&RC[-1]&"}," -> {200017,0,1,10}, | H15: =R[-1]C&RC[-1] -> {200000,0,1,30},{200001,0,1,30},{200002,0,1,30},{200003,0,1,30},{200006,0,1,30},{200010,0,1,5},{200011,0,1,10},{200012,0,1,10},{200013,0,1,10},{200015,0,1,10},{200016,0,1,10},{200017,0,1,10}, | J15: 200023 | K15: 圣战戒指 | L15: 1 | M15: 0 | N15: 1 | O15: 2 | P15: ="{"&RC[-6]&","&RC[-3]&","&RC[-2]&","&RC[-1]&"}," -> {200023,0,1,2}, | Q15: =R[-1]C&RC[-1] -> {200010,0,1,40},{200011,0,1,40},{200012,0,1,40},{200013,0,1,40},{200015,0,1,40},{200016,0,1,40},{200017,0,1,40},{200019,0,1,40},{200020,0,1,1},{200021,0,1,2},{200022,0,1,2},{200023,0,1,2}, | S15: 200023 | T15: 圣战戒指 | U15: 1 | V15: 0 | W15: 1 | X15: 3 | Y15: ="{"&RC[-6]&","&RC[-3]&","&RC[-2]&","&RC[-1]&"}," -> {200023,0,1,3}, | Z15: =R[-1]C&RC[-1] -> {200010,0,1,30},{200011,0,1,30},{200012,0,1,30},{200013,0,1,30},{200015,0,1,30},{200016,0,1,30},{200017,0,1,30},{200019,0,1,30},{200020,0,1,1},{200021,0,1,3},{200022,0,1,3},{200023,0,1,3},
A16: 200019 | B16: 战士鞋子 | C16: 1 | D16: 0 | E16: 1 | F16: 10 | G16: ="{"&RC[-6]&","&RC[-3]&","&RC[-2]&","&RC[-1]&"}," -> {200019,0,1,10}, | H16: =R[-1]C&RC[-1] -> {200000,0,1,30},{200001,0,1,30},{200002,0,1,30},{200003,0,1,30},{200006,0,1,30},{200010,0,1,5},{200011,0,1,10},{200012,0,1,10},{200013,0,1,10},{200015,0,1,10},{200016,0,1,10},{200017,0,1,10},{200019,0,1,10}, | J16: 200025 | K16: 圣战头盔 | L16: 1 | M16: 0 | N16: 1 | O16: 2 | P16: ="{"&RC[-6]&","&RC[-3]&","&RC[-2]&","&RC[-1]&"}," -> {200025,0,1,2}, | Q16: =R[-1]C&RC[-1] -> {200010,0,1,40},{200011,0,1,40},{200012,0,1,40},{200013,0,1,40},{200015,0,1,40},{200016,0,1,40},{200017,0,1,40},{200019,0,1,40},{200020,0,1,1},{200021,0,1,2},{200022,0,1,2},{200023,0,1,2},{200025,0,1,2}, | S16: 200025 | T16: 圣战头盔 | U16: 1 | V16: 0 | W16: 1 | X16: 3 | Y16: ="{"&RC[-6]&","&RC[-3]&","&RC[-2]&","&RC[-1]&"}," -> {200025,0,1,3}, | Z16: =R[-1]C&RC[-1] -> {200010,0,1,30},{200011,0,1,30},{200012,0,1,30},{200013,0,1,30},{200015,0,1,30},{200016,0,1,30},{200017,0,1,30},{200019,0,1,30},{200020,0,1,1},{200021,0,1,3},{200022,0,1,3},{200023,0,1,3},{200025,0,1,3},
A17: 201000 | B17: 海魂 | C17: 1 | D17: 0 | E17: 1 | F17: 30 | G17: ="{"&RC[-6]&","&RC[-3]&","&RC[-2]&","&RC[-1]&"}," -> {201000,0,1,30}, | H17: =R[-1]C&RC[-1] -> {200000,0,1,30},{200001,0,1,30},{200002,0,1,30},{200003,0,1,30},{200006,0,1,30},{200010,0,1,5},{200011,0,1,10},{200012,0,1,10},{200013,0,1,10},{200015,0,1,10},{200016,0,1,10},{200017,0,1,10},{200019,0,1,10},{201000,0,1,30}, | J17: 200026 | K17: 圣战手镯 | L17: 1 | M17: 0 | N17: 1 | O17: 2 | P17: ="{"&RC[-6]&","&RC[-3]&","&RC[-2]&","&RC[-1]&"}," -> {200026,0,1,2}, | Q17: =R[-1]C&RC[-1] -> {200010,0,1,40},{200011,0,1,40},{200012,0,1,40},{200013,0,1,40},{200015,0,1,40},{200016,0,1,40},{200017,0,1,40},{200019,0,1,40},{200020,0,1,1},{200021,0,1,2},{200022,0,1,2},{200023,0,1,2},{200025,0,1,2},{200026,0,1,2}, | S17: 200026 | T17: 圣战手镯 | U17: 1 | V17: 0 | W17: 1 | X17: 3 | Y17: ="{"&RC[-6]&","&RC[-3]&","&RC[-2]&","&RC[-1]&"}," -> {200026,0,1,3}, | Z17: =R[-1]C&RC[-1] -> {200010,0,1,30},{200011,0,1,30},{200012,0,1,30},{200013,0,1,30},{200015,0,1,30},{200016,0,1,30},{200017,0,1,30},{200019,0,1,30},{200020,0,1,1},{200021,0,1,3},{200022,0,1,3},{200023,0,1,3},{200025,0,1,3},{200026,0,1,3},
A18: 201001 | B18: 轻盔 | C18: 1 | D18: 0 | E18: 1 | F18: 30 | G18: ="{"&RC[-6]&","&RC[-3]&","&RC[-2]&","&RC[-1]&"}," -> {201001,0,1,30}, | H18: =R[-1]C&RC[-1] -> {200000,0,1,30},{200001,0,1,30},{200002,0,1,30},{200003,0,1,30},{200006,0,1,30},{200010,0,1,5},{200011,0,1,10},{200012,0,1,10},{200013,0,1,10},{200015,0,1,10},{200016,0,1,10},{200017,0,1,10},{200019,0,1,10},{201000,0,1,30},{201001,0,1,30}, | J18: 200027 | K18: 圣战腰带 | L18: 1 | M18: 0 | N18: 1 | O18: 2 | P18: ="{"&RC[-6]&","&RC[-3]&","&RC[-2]&","&RC[-1]&"}," -> {200027,0,1,2}, | Q18: =R[-1]C&RC[-1] -> {200010,0,1,40},{200011,0,1,40},{200012,0,1,40},{200013,0,1,40},{200015,0,1,40},{200016,0,1,40},{200017,0,1,40},{200019,0,1,40},{200020,0,1,1},{200021,0,1,2},{200022,0,1,2},{200023,0,1,2},{200025,0,1,2},{200026,0,1,2},{200027,0,1,2}, | S18: 200027 | T18: 圣战腰带 | U18: 1 | V18: 0 | W18: 1 | X18: 3 | Y18: ="{"&RC[-6]&","&RC[-3]&","&RC[-2]&","&RC[-1]&"}," -> {200027,0,1,3}, | Z18: =R[-1]C&RC[-1] -> {200010,0,1,30},{200011,0,1,30},{200012,0,1,30},{200013,0,1,30},{200015,0,1,30},{200016,0,1,30},{200017,0,1,30},{200019,0,1,30},{200020,0,1,1},{200021,0,1,3},{200022,0,1,3},{200023,0,1,3},{200025,0,1,3},{200026,0,1,3},{200027,0,1,3},
A19: 201002 | B19: 金戒指 | C19: 1 | D19: 0 | E19: 1 | F19: 30 | G19: ="{"&RC[-6]&","&RC[-3]&","&RC[-2]&","&RC[-1]&"}," -> {201002,0,1,30}, | H19: =R[-1]C&RC[-1] -> {200000,0,1,30},{200001,0,1,30},{200002,0,1,30},{200003,0,1,30},{200006,0,1,30},{200010,0,1,5},{200011,0,1,10},{200012,0,1,10},{200013,0,1,10},{200015,0,1,10},{200016,0,1,10},{200017,0,1,10},{200019,0,1,10},{201000,0,1,30},{201001,0,1,30},{201002,0,1,30}, | J19: 200029 | K19: 圣战鞋子 | L19: 1 | M19: 0 | N19: 1 | O19: 2 | P19: ="{"&RC[-6]&","&RC[-3]&","&RC[-2]&","&RC[-1]&"}," -> {200029,0,1,2}, | Q19: =R[-1]C&RC[-1] -> {200010,0,1,40},{200011,0,1,40},{200012,0,1,40},{200013,0,1,40},{200015,0,1,40},{200016,0,1,40},{200017,0,1,40},{200019,0,1,40},{200020,0,1,1},{200021,0,1,2},{200022,0,1,2},{200023,0,1,2},{200025,0,1,2},{200026,0,1,2},{200027,0,1,2},{200029,0,1,2}, | S19: 200029 | T19: 圣战鞋子 | U19: 1 | V19: 0 | W19: 1 | X19: 3 | Y19: ="{"&RC[-6]&","&RC[-3]&","&RC[-2]&","&RC[-1]&"}," -> {200029,0,1,3}, | Z19: =R[-1]C&RC[-1] -> {200010,0,1,30},{200011,0,1,30},{200012,0,1,30},{200013,0,1,30},{200015,0,1,30},{200016,0,1,30},{200017,0,1,30},{200019,0,1,30},{200020,0,1,1},{200021,0,1,3},{200022,0,1,3},{200023,0,1,3},{200025,0,1,3},{200026,0,1,3},{200027,0,1,3},{200029,0,1,3},
A20: 201003 | B20: 魔法手镯 | C20: 1 | D20: 0 | E20: 1 | F20: 30 | G20: ="{"&RC[-6]&","&RC[-3]&","&RC[-2]&","&RC[-1]&"}," -> {201003,0,1,30}, | H20: =R[-1]C&RC[-1] -> {200000,0,1,30},{200001,0,1,30},{200002,0,1,30},{200003,0,1,30},{200006,0,1,30},{200010,0,1,5},{200011,0,1,10},{200012,0,1,10},{200013,0,1,10},{200015,0,1,10},{200016,0,1,10},{200017,0,1,10},{200019,0,1,10},{201000,0,1,30},{201001,0,1,30},{201002,0,1,30},{201003,0,1,30}, | J20: 201010 | K20: 魔杖 | L20: 1 | M20: 0 | N20: 1 | O20: 40 | P20: ="{"&RC[-6]&","&RC[-3]&","&RC[-2]&","&RC[-1]&"}," -> {201010,0,1,40}, | Q20: =R[-1]C&RC[-1] -> {200010,0,1,40},{200011,0,1,40},{200012,0,1,40},{200013,0,1,40},{200015,0,1,40},{200016,0,1,40},{200017,0,1,40},{200019,0,1,40},{200020,0,1,1},{200021,0,1,2},{200022,0,1,2},{200023,0,1,2},{200025,0,1,2},{200026,0,1,2},{200027,0,1,2},{200029,0,1,2},{201010,0,1,40}, | S20: 201010 | T20: 魔杖 | U20: 1 | V20: 0 | W20: 1 | X20: 30 | Y20: ="{"&RC[-6]&","&RC[-3]&","&RC[-2]&","&RC[-1]&"}," -> {201010,0,1,30}, | Z20: =R[-1]C&RC[-1] -> {200010,0,1,30},{200011,0,1,30},{200012,0,1,30},{200013,0,1,30},{200015,0,1,30},{200016,0,1,30},{200017,0,1,30},{200019,0,1,30},{200020,0,1,1},{200021,0,1,3},{200022,0,1,3},{200023,0,1,3},{200025,0,1,3},{200026,0,1,3},{200027,0,1,3},{200029,0,1,3},{201010,0,1,30},
A21: 201006 | B21: 放大镜 | C21: 1 | D21: 0 | E21: 1 | F21: 30 | G21: ="{"&RC[-6]&","&RC[-3]&","&RC[-2]&","&RC[-1]&"}," -> {201006,0,1,30}, | H21: =R[-1]C&RC[-1] -> {200000,0,1,30},{200001,0,1,30},{200002,0,1,30},{200003,0,1,30},{200006,0,1,30},{200010,0,1,5},{200011,0,1,10},{200012,0,1,10},{200013,0,1,10},{200015,0,1,10},{200016,0,1,10},{200017,0,1,10},{200019,0,1,10},{201000,0,1,30},{201001,0,1,30},{201002,0,1,30},{201003,0,1,30},{201006,0,1,30}, | J21: 201011 | K21: 恶魔铃铛 | L21: 1 | M21: 0 | N21: 1 | O21: 40 | P21: ="{"&RC[-6]&","&RC[-3]&","&RC[-2]&","&RC[-1]&"}," -> {201011,0,1,40}, | Q21: =R[-1]C&RC[-1] -> {200010,0,1,40},{200011,0,1,40},{200012,0,1,40},{200013,0,1,40},{200015,0,1,40},{200016,0,1,40},{200017,0,1,40},{200019,0,1,40},{200020,0,1,1},{200021,0,1,2},{200022,0,1,2},{200023,0,1,2},{200025,0,1,2},{200026,0,1,2},{200027,0,1,2},{200029,0,1,2},{201010,0,1,40},{201011,0,1,40}, | S21: 201011 | T21: 恶魔铃铛 | U21: 1 | V21: 0 | W21: 1 | X21: 30 | Y21: ="{"&RC[-6]&","&RC[-3]&","&RC[-2]&","&RC[-1]&"}," -> {201011,0,1,30}, | Z21: =R[-1]C&RC[-1] -> {200010,0,1,30},{200011,0,1,30},{200012,0,1,30},{200013,0,1,30},{200015,0,1,30},{200016,0,1,30},{200017,0,1,30},{200019,0,1,30},{200020,0,1,1},{200021,0,1,3},{200022,0,1,3},{200023,0,1,3},{200025,0,1,3},{200026,0,1,3},{200027,0,1,3},{200029,0,1,3},{201010,0,1,30},{201011,0,1,30},
A22: 201010 | B22: 魔杖 | C22: 1 | D22: 0 | E22: 1 | F22: 5 | G22: ="{"&RC[-6]&","&RC[-3]&","&RC[-2]&","&RC[-1]&"}," -> {201010,0,1,5}, | H22: =R[-1]C&RC[-1] -> {200000,0,1,30},{200001,0,1,30},{200002,0,1,30},{200003,0,1,30},{200006,0,1,30},{200010,0,1,5},{200011,0,1,10},{200012,0,1,10},{200013,0,1,10},{200015,0,1,10},{200016,0,1,10},{200017,0,1,10},{200019,0,1,10},{201000,0,1,30},{201001,0,1,30},{201002,0,1,30},{201003,0,1,30},{201006,0,1,30},{201010,0,1,5}, | J22: 201012 | K22: 恶魔长袍 | L22: 1 | M22: 0 | N22: 1 | O22: 40 | P22: ="{"&RC[-6]&","&RC[-3]&","&RC[-2]&","&RC[-1]&"}," -> {201012,0,1,40}, | Q22: =R[-1]C&RC[-1] -> {200010,0,1,40},{200011,0,1,40},{200012,0,1,40},{200013,0,1,40},{200015,0,1,40},{200016,0,1,40},{200017,0,1,40},{200019,0,1,40},{200020,0,1,1},{200021,0,1,2},{200022,0,1,2},{200023,0,1,2},{200025,0,1,2},{200026,0,1,2},{200027,0,1,2},{200029,0,1,2},{201010,0,1,40},{201011,0,1,40},{201012,0,1,40}, | S22: 201012 | T22: 恶魔长袍 | U22: 1 | V22: 0 | W22: 1 | X22: 30 | Y22: ="{"&RC[-6]&","&RC[-3]&","&RC[-2]&","&RC[-1]&"}," -> {201012,0,1,30}, | Z22: =R[-1]C&RC[-1] -> {200010,0,1,30},{200011,0,1,30},{200012,0,1,30},{200013,0,1,30},{200015,0,1,30},{200016,0,1,30},{200017,0,1,30},{200019,0,1,30},{200020,0,1,1},{200021,0,1,3},{200022,0,1,3},{200023,0,1,3},{200025,0,1,3},{200026,0,1,3},{200027,0,1,3},{200029,0,1,3},{201010,0,1,30},{201011,0,1,30},{201012,0,1,30},
A23: 201011 | B23: 恶魔铃铛 | C23: 1 | D23: 0 | E23: 1 | F23: 10 | G23: ="{"&RC[-6]&","&RC[-3]&","&RC[-2]&","&RC[-1]&"}," -> {201011,0,1,10}, | H23: =R[-1]C&RC[-1] -> {200000,0,1,30},{200001,0,1,30},{200002,0,1,30},{200003,0,1,30},{200006,0,1,30},{200010,0,1,5},{200011,0,1,10},{200012,0,1,10},{200013,0,1,10},{200015,0,1,10},{200016,0,1,10},{200017,0,1,10},{200019,0,1,10},{201000,0,1,30},{201001,0,1,30},{201002,0,1,30},{201003,0,1,30},{201006,0,1,30},{201010,0,1,5},{201011,0,1,10}, | J23: 201013 | K23: 紫碧螺 | L23: 1 | M23: 0 | N23: 1 | O23: 40 | P23: ="{"&RC[-6]&","&RC[-3]&","&RC[-2]&","&RC[-1]&"}," -> {201013,0,1,40}, | Q23: =R[-1]C&RC[-1] -> {200010,0,1,40},{200011,0,1,40},{200012,0,1,40},{200013,0,1,40},{200015,0,1,40},{200016,0,1,40},{200017,0,1,40},{200019,0,1,40},{200020,0,1,1},{200021,0,1,2},{200022,0,1,2},{200023,0,1,2},{200025,0,1,2},{200026,0,1,2},{200027,0,1,2},{200029,0,1,2},{201010,0,1,40},{201011,0,1,40},{201012,0,1,40},{201013,0,1,40}, | S23: 201013 | T23: 紫碧螺 | U23: 1 | V23: 0 | W23: 1 | X23: 30 | Y23: ="{"&RC[-6]&","&RC[-3]&","&RC[-2]&","&RC[-1]&"}," -> {201013,0,1,30}, | Z23: =R[-1]C&RC[-1] -> {200010,0,1,30},{200011,0,1,30},{200012,0,1,30},{200013,0,1,30},{200015,0,1,30},{200016,0,1,30},{200017,0,1,30},{200019,0,1,30},{200020,0,1,1},{200021,0,1,3},{200022,0,1,3},{200023,0,1,3},{200025,0,1,3},{200026,0,1,3},{200027,0,1,3},{200029,0,1,3},{201010,0,1,30},{201011,0,1,30},{201012,0,1,30},{201013,0,1,30},
A24: 201012 | B24: 恶魔长袍 | C24: 1 | D24: 0 | E24: 1 | F24: 10 | G24: ="{"&RC[-6]&","&RC[-3]&","&RC[-2]&","&RC[-1]&"}," -> {201012,0,1,10}, | H24: =R[-1]C&RC[-1] -> {200000,0,1,30},{200001,0,1,30},{200002,0,1,30},{200003,0,1,30},{200006,0,1,30},{200010,0,1,5},{200011,0,1,10},{200012,0,1,10},{200013,0,1,10},{200015,0,1,10},{200016,0,1,10},{200017,0,1,10},{200019,0,1,10},{201000,0,1,30},{201001,0,1,30},{201002,0,1,30},{201003,0,1,30},{201006,0,1,30},{201010,0,1,5},{201011,0,1,10},{201012,0,1,10}, | J24: 201015 | K24: 法师头盔 | L24: 1 | M24: 0 | N24: 1 | O24: 40 | P24: ="{"&RC[-6]&","&RC[-3]&","&RC[-2]&","&RC[-1]&"}," -> {201015,0,1,40}, | Q24: =R[-1]C&RC[-1] -> {200010,0,1,40},{200011,0,1,40},{200012,0,1,40},{200013,0,1,40},{200015,0,1,40},{200016,0,1,40},{200017,0,1,40},{200019,0,1,40},{200020,0,1,1},{200021,0,1,2},{200022,0,1,2},{200023,0,1,2},{200025,0,1,2},{200026,0,1,2},{200027,0,1,2},{200029,0,1,2},{201010,0,1,40},{201011,0,1,40},{201012,0,1,40},{201013,0,1,40},{201015,0,1,40}, | S24: 201015 | T24: 法师头盔 | U24: 1 | V24: 0 | W24: 1 | X24: 30 | Y24: ="{"&RC[-6]&","&RC[-3]&","&RC[-2]&","&RC[-1]&"}," -> {201015,0,1,30}, | Z24: =R[-1]C&RC[-1] -> {200010,0,1,30},{200011,0,1,30},{200012,0,1,30},{200013,0,1,30},{200015,0,1,30},{200016,0,1,30},{200017,0,1,30},{200019,0,1,30},{200020,0,1,1},{200021,0,1,3},{200022,0,1,3},{200023,0,1,3},{200025,0,1,3},{200026,0,1,3},{200027,0,1,3},{200029,0,1,3},{201010,0,1,30},{201011,0,1,30},{201012,0,1,30},{201013,0,1,30},{201015,0,1,30},
A25: 201013 | B25: 紫碧螺 | C25: 1 | D25: 0 | E25: 1 | F25: 10 | G25: ="{"&RC[-6]&","&RC[-3]&","&RC[-2]&","&RC[-1]&"}," -> {201013,0,1,10}, | H25: =R[-1]C&RC[-1] -> {200000,0,1,30},{200001,0,1,30},{200002,0,1,30},{200003,0,1,30},{200006,0,1,30},{200010,0,1,5},{200011,0,1,10},{200012,0,1,10},{200013,0,1,10},{200015,0,1,10},{200016,0,1,10},{200017,0,1,10},{200019,0,1,10},{201000,0,1,30},{201001,0,1,30},{201002,0,1,30},{201003,0,1,30},{201006,0,1,30},{201010,0,1,5},{201011,0,1,10},{201012,0,1,10},{201013,0,1,10}, | J25: 201016 | K25: 龙之手镯 | L25: 1 | M25: 0 | N25: 1 | O25: 40 | P25: ="{"&RC[-6]&","&RC[-3]&","&RC[-2]&","&RC[-1]&"}," -> {201016,0,1,40}, | Q25: =R[-1]C&RC[-1] -> {200010,0,1,40},{200011,0,1,40},{200012,0,1,40},{200013,0,1,40},{200015,0,1,40},{200016,0,1,40},{200017,0,1,40},{200019,0,1,40},{200020,0,1,1},{200021,0,1,2},{200022,0,1,2},{200023,0,1,2},{200025,0,1,2},{200026,0,1,2},{200027,0,1,2},{200029,0,1,2},{201010,0,1,40},{201011,0,1,40},{201012,0,1,40},{201013,0,1,40},{201015,0,1,40},{201016,0,1,40}, | S25: 201016 | T25: 龙之手镯 | U25: 1 | V25: 0 | W25: 1 | X25: 30 | Y25: ="{"&RC[-6]&","&RC[-3]&","&RC[-2]&","&RC[-1]&"}," -> {201016,0,1,30}, | Z25: =R[-1]C&RC[-1] -> {200010,0,1,30},{200011,0,1,30},{200012,0,1,30},{200013,0,1,30},{200015,0,1,30},{200016,0,1,30},{200017,0,1,30},{200019,0,1,30},{200020,0,1,1},{200021,0,1,3},{200022,0,1,3},{200023,0,1,3},{200025,0,1,3},{200026,0,1,3},{200027,0,1,3},{200029,0,1,3},{201010,0,1,30},{201011,0,1,30},{201012,0,1,30},{201013,0,1,30},{201015,0,1,30},{201016,0,1,30},
A26: 201015 | B26: 法师头盔 | C26: 1 | D26: 0 | E26: 1 | F26: 10 | G26: ="{"&RC[-6]&","&RC[-3]&","&RC[-2]&","&RC[-1]&"}," -> {201015,0,1,10}, | H26: =R[-1]C&RC[-1] -> {200000,0,1,30},{200001,0,1,30},{200002,0,1,30},{200003,0,1,30},{200006,0,1,30},{200010,0,1,5},{200011,0,1,10},{200012,0,1,10},{200013,0,1,10},{200015,0,1,10},{200016,0,1,10},{200017,0,1,10},{200019,0,1,10},{201000,0,1,30},{201001,0,1,30},{201002,0,1,30},{201003,0,1,30},{201006,0,1,30},{201010,0,1,5},{201011,0,1,10},{201012,0,1,10},{201013,0,1,10},{201015,0,1,10}, | J26: 201017 | K26: 法师腰带 | L26: 1 | M26: 0 | N26: 1 | O26: 40 | P26: ="{"&RC[-6]&","&RC[-3]&","&RC[-2]&","&RC[-1]&"}," -> {201017,0,1,40}, | Q26: =R[-1]C&RC[-1] -> {200010,0,1,40},{200011,0,1,40},{200012,0,1,40},{200013,0,1,40},{200015,0,1,40},{200016,0,1,40},{200017,0,1,40},{200019,0,1,40},{200020,0,1,1},{200021,0,1,2},{200022,0,1,2},{200023,0,1,2},{200025,0,1,2},{200026,0,1,2},{200027,0,1,2},{200029,0,1,2},{201010,0,1,40},{201011,0,1,40},{201012,0,1,40},{201013,0,1,40},{201015,0,1,40},{201016,0,1,40},{201017,0,1,40}, | S26: 201017 | T26: 法师腰带 | U26: 1 | V26: 0 | W26: 1 | X26: 30 | Y26: ="{"&RC[-6]&","&RC[-3]&","&RC[-2]&","&RC[-1]&"}," -> {201017,0,1,30}, | Z26: =R[-1]C&RC[-1] -> {200010,0,1,30},{200011,0,1,30},{200012,0,1,30},{200013,0,1,30},{200015,0,1,30},{200016,0,1,30},{200017,0,1,30},{200019,0,1,30},{200020,0,1,1},{200021,0,1,3},{200022,0,1,3},{200023,0,1,3},{200025,0,1,3},{200026,0,1,3},{200027,0,1,3},{200029,0,1,3},{201010,0,1,30},{201011,0,1,30},{201012,0,1,30},{201013,0,1,30},{201015,0,1,30},{201016,0,1,30},{201017,0,1,30},
A27: 201016 | B27: 龙之手镯 | C27: 1 | D27: 0 | E27: 1 | F27: 10 | G27: ="{"&RC[-6]&","&RC[-3]&","&RC[-2]&","&RC[-1]&"}," -> {201016,0,1,10}, | H27: =R[-1]C&RC[-1] -> {200000,0,1,30},{200001,0,1,30},{200002,0,1,30},{200003,0,1,30},{200006,0,1,30},{200010,0,1,5},{200011,0,1,10},{200012,0,1,10},{200013,0,1,10},{200015,0,1,10},{200016,0,1,10},{200017,0,1,10},{200019,0,1,10},{201000,0,1,30},{201001,0,1,30},{201002,0,1,30},{201003,0,1,30},{201006,0,1,30},{201010,0,1,5},{201011,0,1,10},{201012,0,1,10},{201013,0,1,10},{201015,0,1,10},{201016,0,1,10}, | J27: 201019 | K27: 法师鞋子 | L27: 1 | M27: 0 | N27: 1 | O27: 40 | P27: ="{"&RC[-6]&","&RC[-3]&","&RC[-2]&","&RC[-1]&"}," -> {201019,0,1,40}, | Q27: =R[-1]C&RC[-1] -> {200010,0,1,40},{200011,0,1,40},{200012,0,1,40},{200013,0,1,40},{200015,0,1,40},{200016,0,1,40},{200017,0,1,40},{200019,0,1,40},{200020,0,1,1},{200021,0,1,2},{200022,0,1,2},{200023,0,1,2},{200025,0,1,2},{200026,0,1,2},{200027,0,1,2},{200029,0,1,2},{201010,0,1,40},{201011,0,1,40},{201012,0,1,40},{201013,0,1,40},{201015,0,1,40},{201016,0,1,40},{201017,0,1,40},{201019,0,1,40}, | S27: 201019 | T27: 法师鞋子 | U27: 1 | V27: 0 | W27: 1 | X27: 30 | Y27: ="{"&RC[-6]&","&RC[-3]&","&RC[-2]&","&RC[-1]&"}," -> {201019,0,1,30}, | Z27: =R[-1]C&RC[-1] -> {200010,0,1,30},{200011,0,1,30},{200012,0,1,30},{200013,0,1,30},{200015,0,1,30},{200016,0,1,30},{200017,0,1,30},{200019,0,1,30},{200020,0,1,1},{200021,0,1,3},{200022,0,1,3},{200023,0,1,3},{200025,0,1,3},{200026,0,1,3},{200027,0,1,3},{200029,0,1,3},{201010,0,1,30},{201011,0,1,30},{201012,0,1,30},{201013,0,1,30},{201015,0,1,30},{201016,0,1,30},{201017,0,1,30},{201019,0,1,30},
A28: 201017 | B28: 法师腰带 | C28: 1 | D28: 0 | E28: 1 | F28: 10 | G28: ="{"&RC[-6]&","&RC[-3]&","&RC[-2]&","&RC[-1]&"}," -> {201017,0,1,10}, | H28: =R[-1]C&RC[-1] -> {200000,0,1,30},{200001,0,1,30},{200002,0,1,30},{200003,0,1,30},{200006,0,1,30},{200010,0,1,5},{200011,0,1,10},{200012,0,1,10},{200013,0,1,10},{200015,0,1,10},{200016,0,1,10},{200017,0,1,10},{200019,0,1,10},{201000,0,1,30},{201001,0,1,30},{201002,0,1,30},{201003,0,1,30},{201006,0,1,30},{201010,0,1,5},{201011,0,1,10},{201012,0,1,10},{201013,0,1,10},{201015,0,1,10},{201016,0,1,10},{201017,0,1,10}, | J28: 201020 | K28: 骨玉 | L28: 1 | M28: 0 | N28: 1 | O28: 1 | P28: ="{"&RC[-6]&","&RC[-3]&","&RC[-2]&","&RC[-1]&"}," -> {201020,0,1,1}, | Q28: =R[-1]C&RC[-1] -> {200010,0,1,40},{200011,0,1,40},{200012,0,1,40},{200013,0,1,40},{200015,0,1,40},{200016,0,1,40},{200017,0,1,40},{200019,0,1,40},{200020,0,1,1},{200021,0,1,2},{200022,0,1,2},{200023,0,1,2},{200025,0,1,2},{200026,0,1,2},{200027,0,1,2},{200029,0,1,2},{201010,0,1,40},{201011,0,1,40},{201012,0,1,40},{201013,0,1,40},{201015,0,1,40},{201016,0,1,40},{201017,0,1,40},{201019,0,1,40},{201020,0,1,1}, | S28: 201020 | T28: 骨玉 | U28: 1 | V28: 0 | W28: 1 | X28: 1 | Y28: ="{"&RC[-6]&","&RC[-3]&","&RC[-2]&","&RC[-1]&"}," -> {201020,0,1,1}, | Z28: =R[-1]C&RC[-1] -> {200010,0,1,30},{200011,0,1,30},{200012,0,1,30},{200013,0,1,30},{200015,0,1,30},{200016,0,1,30},{200017,0,1,30},{200019,0,1,30},{200020,0,1,1},{200021,0,1,3},{200022,0,1,3},{200023,0,1,3},{200025,0,1,3},{200026,0,1,3},{200027,0,1,3},{200029,0,1,3},{201010,0,1,30},{201011,0,1,30},{201012,0,1,30},{201013,0,1,30},{201015,0,1,30},{201016,0,1,30},{201017,0,1,30},{201019,0,1,30},{201020,0,1,1},
A29: 201019 | B29: 法师鞋子 | C29: 1 | D29: 0 | E29: 1 | F29: 10 | G29: ="{"&RC[-6]&","&RC[-3]&","&RC[-2]&","&RC[-1]&"}," -> {201019,0,1,10}, | H29: =R[-1]C&RC[-1] -> {200000,0,1,30},{200001,0,1,30},{200002,0,1,30},{200003,0,1,30},{200006,0,1,30},{200010,0,1,5},{200011,0,1,10},{200012,0,1,10},{200013,0,1,10},{200015,0,1,10},{200016,0,1,10},{200017,0,1,10},{200019,0,1,10},{201000,0,1,30},{201001,0,1,30},{201002,0,1,30},{201003,0,1,30},{201006,0,1,30},{201010,0,1,5},{201011,0,1,10},{201012,0,1,10},{201013,0,1,10},{201015,0,1,10},{201016,0,1,10},{201017,0,1,10},{201019,0,1,10}, | J29: 201021 | K29: 法神披风 | L29: 1 | M29: 0 | N29: 1 | O29: 2 | P29: ="{"&RC[-6]&","&RC[-3]&","&RC[-2]&","&RC[-1]&"}," -> {201021,0,1,2}, | Q29: =R[-1]C&RC[-1] -> {200010,0,1,40},{200011,0,1,40},{200012,0,1,40},{200013,0,1,40},{200015,0,1,40},{200016,0,1,40},{200017,0,1,40},{200019,0,1,40},{200020,0,1,1},{200021,0,1,2},{200022,0,1,2},{200023,0,1,2},{200025,0,1,2},{200026,0,1,2},{200027,0,1,2},{200029,0,1,2},{201010,0,1,40},{201011,0,1,40},{201012,0,1,40},{201013,0,1,40},{201015,0,1,40},{201016,0,1,40},{201017,0,1,40},{201019,0,1,40},{201020,0,1,1},{201021,0,1,2}, | S29: 201021 | T29: 法神披风 | U29: 1 | V29: 0 | W29: 1 | X29: 3 | Y29: ="{"&RC[-6]&","&RC[-3]&","&RC[-2]&","&RC[-1]&"}," -> {201021,0,1,3}, | Z29: =R[-1]C&RC[-1] -> {200010,0,1,30},{200011,0,1,30},{200012,0,1,30},{200013,0,1,30},{200015,0,1,30},{200016,0,1,30},{200017,0,1,30},{200019,0,1,30},{200020,0,1,1},{200021,0,1,3},{200022,0,1,3},{200023,0,1,3},{200025,0,1,3},{200026,0,1,3},{200027,0,1,3},{200029,0,1,3},{201010,0,1,30},{201011,0,1,30},{201012,0,1,30},{201013,0,1,30},{201015,0,1,30},{201016,0,1,30},{201017,0,1,30},{201019,0,1,30},{201020,0,1,1},{201021,0,1,3},
A30: 202000 | B30: 半月 | C30: 1 | D30: 0 | E30: 1 | F30: 30 | G30: ="{"&RC[-6]&","&RC[-3]&","&RC[-2]&","&RC[-1]&"}," -> {202000,0,1,30}, | H30: =R[-1]C&RC[-1] -> {200000,0,1,30},{200001,0,1,30},{200002,0,1,30},{200003,0,1,30},{200006,0,1,30},{200010,0,1,5},{200011,0,1,10},{200012,0,1,10},{200013,0,1,10},{200015,0,1,10},{200016,0,1,10},{200017,0,1,10},{200019,0,1,10},{201000,0,1,30},{201001,0,1,30},{201002,0,1,30},{201003,0,1,30},{201006,0,1,30},{201010,0,1,5},{201011,0,1,10},{201012,0,1,10},{201013,0,1,10},{201015,0,1,10},{201016,0,1,10},{201017,0,1,10},{201019,0,1,10},{202000,0,1,30}, | J30: 201022 | K30: 法神项链 | L30: 1 | M30: 0 | N30: 1 | O30: 2 | P30: ="{"&RC[-6]&","&RC[-3]&","&RC[-2]&","&RC[-1]&"}," -> {201022,0,1,2}, | Q30: =R[-1]C&RC[-1] -> {200010,0,1,40},{200011,0,1,40},{200012,0,1,40},{200013,0,1,40},{200015,0,1,40},{200016,0,1,40},{200017,0,1,40},{200019,0,1,40},{200020,0,1,1},{200021,0,1,2},{200022,0,1,2},{200023,0,1,2},{200025,0,1,2},{200026,0,1,2},{200027,0,1,2},{200029,0,1,2},{201010,0,1,40},{201011,0,1,40},{201012,0,1,40},{201013,0,1,40},{201015,0,1,40},{201016,0,1,40},{201017,0,1,40},{201019,0,1,40},{201020,0,1,1},{201021,0,1,2},{201022,0,1,2}, | S30: 201022 | T30: 法神项链 | U30: 1 | V30: 0 | W30: 1 | X30: 3 | Y30: ="{"&RC[-6]&","&RC[-3]&","&RC[-2]&","&RC[-1]&"}," -> {201022,0,1,3}, | Z30: =R[-1]C&RC[-1] -> {200010,0,1,30},{200011,0,1,30},{200012,0,1,30},{200013,0,1,30},{200015,0,1,30},{200016,0,1,30},{200017,0,1,30},{200019,0,1,30},{200020,0,1,1},{200021,0,1,3},{200022,0,1,3},{200023,0,1,3},{200025,0,1,3},{200026,0,1,3},{200027,0,1,3},{200029,0,1,3},{201010,0,1,30},{201011,0,1,30},{201012,0,1,30},{201013,0,1,30},{201015,0,1,30},{201016,0,1,30},{201017,0,1,30},{201019,0,1,30},{201020,0,1,1},{201021,0,1,3},{201022,0,1,3},
A31: 202001 | B31: 轻盔 | C31: 1 | D31: 0 | E31: 1 | F31: 30 | G31: ="{"&RC[-6]&","&RC[-3]&","&RC[-2]&","&RC[-1]&"}," -> {202001,0,1,30}, | H31: =R[-1]C&RC[-1] -> {200000,0,1,30},{200001,0,1,30},{200002,0,1,30},{200003,0,1,30},{200006,0,1,30},{200010,0,1,5},{200011,0,1,10},{200012,0,1,10},{200013,0,1,10},{200015,0,1,10},{200016,0,1,10},{200017,0,1,10},{200019,0,1,10},{201000,0,1,30},{201001,0,1,30},{201002,0,1,30},{201003,0,1,30},{201006,0,1,30},{201010,0,1,5},{201011,0,1,10},{201012,0,1,10},{201013,0,1,10},{201015,0,1,10},{201016,0,1,10},{201017,0,1,10},{201019,0,1,10},{202000,0,1,30},{202001,0,1,30}, | J31: 201023 | K31: 法神戒指 | L31: 1 | M31: 0 | N31: 1 | O31: 2 | P31: ="{"&RC[-6]&","&RC[-3]&","&RC[-2]&","&RC[-1]&"}," -> {201023,0,1,2}, | Q31: =R[-1]C&RC[-1] -> {200010,0,1,40},{200011,0,1,40},{200012,0,1,40},{200013,0,1,40},{200015,0,1,40},{200016,0,1,40},{200017,0,1,40},{200019,0,1,40},{200020,0,1,1},{200021,0,1,2},{200022,0,1,2},{200023,0,1,2},{200025,0,1,2},{200026,0,1,2},{200027,0,1,2},{200029,0,1,2},{201010,0,1,40},{201011,0,1,40},{201012,0,1,40},{201013,0,1,40},{201015,0,1,40},{201016,0,1,40},{201017,0,1,40},{201019,0,1,40},{201020,0,1,1},{201021,0,1,2},{201022,0,1,2},{201023,0,1,2}, | S31: 201023 | T31: 法神戒指 | U31: 1 | V31: 0 | W31: 1 | X31: 3 | Y31: ="{"&RC[-6]&","&RC[-3]&","&RC[-2]&","&RC[-1]&"}," -> {201023,0,1,3}, | Z31: =R[-1]C&RC[-1] -> {200010,0,1,30},{200011,0,1,30},{200012,0,1,30},{200013,0,1,30},{200015,0,1,30},{200016,0,1,30},{200017,0,1,30},{200019,0,1,30},{200020,0,1,1},{200021,0,1,3},{200022,0,1,3},{200023,0,1,3},{200025,0,1,3},{200026,0,1,3},{200027,0,1,3},{200029,0,1,3},{201010,0,1,30},{201011,0,1,30},{201012,0,1,30},{201013,0,1,30},{201015,0,1,30},{201016,0,1,30},{201017,0,1,30},{201019,0,1,30},{201020,0,1,1},{201021,0,1,3},{201022,0,1,3},{201023,0,1,3},
A32: 202002 | B32: 铂金戒指 | C32: 1 | D32: 0 | E32: 1 | F32: 30 | G32: ="{"&RC[-6]&","&RC[-3]&","&RC[-2]&","&RC[-1]&"}," -> {202002,0,1,30}, | H32: =R[-1]C&RC[-1] -> {200000,0,1,30},{200001,0,1,30},{200002,0,1,30},{200003,0,1,30},{200006,0,1,30},{200010,0,1,5},{200011,0,1,10},{200012,0,1,10},{200013,0,1,10},{200015,0,1,10},{200016,0,1,10},{200017,0,1,10},{200019,0,1,10},{201000,0,1,30},{201001,0,1,30},{201002,0,1,30},{201003,0,1,30},{201006,0,1,30},{201010,0,1,5},{201011,0,1,10},{201012,0,1,10},{201013,0,1,10},{201015,0,1,10},{201016,0,1,10},{201017,0,1,10},{201019,0,1,10},{202000,0,1,30},{202001,0,1,30},{202002,0,1,30}, | J32: 201025 | K32: 法神头盔 | L32: 1 | M32: 0 | N32: 1 | O32: 2 | P32: ="{"&RC[-6]&","&RC[-3]&","&RC[-2]&","&RC[-1]&"}," -> {201025,0,1,2}, | Q32: =R[-1]C&RC[-1] -> {200010,0,1,40},{200011,0,1,40},{200012,0,1,40},{200013,0,1,40},{200015,0,1,40},{200016,0,1,40},{200017,0,1,40},{200019,0,1,40},{200020,0,1,1},{200021,0,1,2},{200022,0,1,2},{200023,0,1,2},{200025,0,1,2},{200026,0,1,2},{200027,0,1,2},{200029,0,1,2},{201010,0,1,40},{201011,0,1,40},{201012,0,1,40},{201013,0,1,40},{201015,0,1,40},{201016,0,1,40},{201017,0,1,40},{201019,0,1,40},{201020,0,1,1},{201021,0,1,2},{201022,0,1,2},{201023,0,1,2},{201025,0,1,2}, | S32: 201025 | T32: 法神头盔 | U32: 1 | V32: 0 | W32: 1 | X32: 3 | Y32: ="{"&RC[-6]&","&RC[-3]&","&RC[-2]&","&RC[-1]&"}," -> {201025,0,1,3}, | Z32: =R[-1]C&RC[-1] -> {200010,0,1,30},{200011,0,1,30},{200012,0,1,30},{200013,0,1,30},{200015,0,1,30},{200016,0,1,30},{200017,0,1,30},{200019,0,1,30},{200020,0,1,1},{200021,0,1,3},{200022,0,1,3},{200023,0,1,3},{200025,0,1,3},{200026,0,1,3},{200027,0,1,3},{200029,0,1,3},{201010,0,1,30},{201011,0,1,30},{201012,0,1,30},{201013,0,1,30},{201015,0,1,30},{201016,0,1,30},{201017,0,1,30},{201019,0,1,30},{201020,0,1,1},{201021,0,1,3},{201022,0,1,3},{201023,0,1,3},{201025,0,1,3},
A33: 202003 | B33: 三眼手镯 | C33: 1 | D33: 0 | E33: 1 | F33: 30 | G33: ="{"&RC[-6]&","&RC[-3]&","&RC[-2]&","&RC[-1]&"}," -> {202003,0,1,30}, | H33: =R[-1]C&RC[-1] -> {200000,0,1,30},{200001,0,1,30},{200002,0,1,30},{200003,0,1,30},{200006,0,1,30},{200010,0,1,5},{200011,0,1,10},{200012,0,1,10},{200013,0,1,10},{200015,0,1,10},{200016,0,1,10},{200017,0,1,10},{200019,0,1,10},{201000,0,1,30},{201001,0,1,30},{201002,0,1,30},{201003,0,1,30},{201006,0,1,30},{201010,0,1,5},{201011,0,1,10},{201012,0,1,10},{201013,0,1,10},{201015,0,1,10},{201016,0,1,10},{201017,0,1,10},{201019,0,1,10},{202000,0,1,30},{202001,0,1,30},{202002,0,1,30},{202003,0,1,30}, | J33: 201026 | K33: 法神手镯 | L33: 1 | M33: 0 | N33: 1 | O33: 2 | P33: ="{"&RC[-6]&","&RC[-3]&","&RC[-2]&","&RC[-1]&"}," -> {201026,0,1,2}, | Q33: =R[-1]C&RC[-1] -> {200010,0,1,40},{200011,0,1,40},{200012,0,1,40},{200013,0,1,40},{200015,0,1,40},{200016,0,1,40},{200017,0,1,40},{200019,0,1,40},{200020,0,1,1},{200021,0,1,2},{200022,0,1,2},{200023,0,1,2},{200025,0,1,2},{200026,0,1,2},{200027,0,1,2},{200029,0,1,2},{201010,0,1,40},{201011,0,1,40},{201012,0,1,40},{201013,0,1,40},{201015,0,1,40},{201016,0,1,40},{201017,0,1,40},{201019,0,1,40},{201020,0,1,1},{201021,0,1,2},{201022,0,1,2},{201023,0,1,2},{201025,0,1,2},{201026,0,1,2}, | S33: 201026 | T33: 法神手镯 | U33: 1 | V33: 0 | W33: 1 | X33: 3 | Y33: ="{"&RC[-6]&","&RC[-3]&","&RC[-2]&","&RC[-1]&"}," -> {201026,0,1,3}, | Z33: =R[-1]C&RC[-1] -> {200010,0,1,30},{200011,0,1,30},{200012,0,1,30},{200013,0,1,30},{200015,0,1,30},{200016,0,1,30},{200017,0,1,30},{200019,0,1,30},{200020,0,1,1},{200021,0,1,3},{200022,0,1,3},{200023,0,1,3},{200025,0,1,3},{200026,0,1,3},{200027,0,1,3},{200029,0,1,3},{201010,0,1,30},{201011,0,1,30},{201012,0,1,30},{201013,0,1,30},{201015,0,1,30},{201016,0,1,30},{201017,0,1,30},{201019,0,1,30},{201020,0,1,1},{201021,0,1,3},{201022,0,1,3},{201023,0,1,3},{201025,0,1,3},{201026,0,1,3},
A34: 202006 | B34: 凤凰明珠 | C34: 1 | D34: 0 | E34: 1 | F34: 30 | G34: ="{"&RC[-6]&","&RC[-3]&","&RC[-2]&","&RC[-1]&"}," -> {202006,0,1,30}, | H34: =R[-1]C&RC[-1] -> {200000,0,1,30},{200001,0,1,30},{200002,0,1,30},{200003,0,1,30},{200006,0,1,30},{200010,0,1,5},{200011,0,1,10},{200012,0,1,10},{200013,0,1,10},{200015,0,1,10},{200016,0,1,10},{200017,0,1,10},{200019,0,1,10},{201000,0,1,30},{201001,0,1,30},{201002,0,1,30},{201003,0,1,30},{201006,0,1,30},{201010,0,1,5},{201011,0,1,10},{201012,0,1,10},{201013,0,1,10},{201015,0,1,10},{201016,0,1,10},{201017,0,1,10},{201019,0,1,10},{202000,0,1,30},{202001,0,1,30},{202002,0,1,30},{202003,0,1,30},{202006,0,1,30}, | J34: 201027 | K34: 法神腰带 | L34: 1 | M34: 0 | N34: 1 | O34: 2 | P34: ="{"&RC[-6]&","&RC[-3]&","&RC[-2]&","&RC[-1]&"}," -> {201027,0,1,2}, | Q34: =R[-1]C&RC[-1] -> {200010,0,1,40},{200011,0,1,40},{200012,0,1,40},{200013,0,1,40},{200015,0,1,40},{200016,0,1,40},{200017,0,1,40},{200019,0,1,40},{200020,0,1,1},{200021,0,1,2},{200022,0,1,2},{200023,0,1,2},{200025,0,1,2},{200026,0,1,2},{200027,0,1,2},{200029,0,1,2},{201010,0,1,40},{201011,0,1,40},{201012,0,1,40},{201013,0,1,40},{201015,0,1,40},{201016,0,1,40},{201017,0,1,40},{201019,0,1,40},{201020,0,1,1},{201021,0,1,2},{201022,0,1,2},{201023,0,1,2},{201025,0,1,2},{201026,0,1,2},{201027,0,1,2}, | S34: 201027 | T34: 法神腰带 | U34: 1 | V34: 0 | W34: 1 | X34: 3 | Y34: ="{"&RC[-6]&","&RC[-3]&","&RC[-2]&","&RC[-1]&"}," -> {201027,0,1,3}, | Z34: =R[-1]C&RC[-1] -> {200010,0,1,30},{200011,0,1,30},{200012,0,1,30},{200013,0,1,30},{200015,0,1,30},{200016,0,1,30},{200017,0,1,30},{200019,0,1,30},{200020,0,1,1},{200021,0,1,3},{200022,0,1,3},{200023,0,1,3},{200025,0,1,3},{200026,0,1,3},{200027,0,1,3},{200029,0,1,3},{201010,0,1,30},{201011,0,1,30},{201012,0,1,30},{201013,0,1,30},{201015,0,1,30},{201016,0,1,30},{201017,0,1,30},{201019,0,1,30},{201020,0,1,1},{201021,0,1,3},{201022,0,1,3},{201023,0,1,3},{201025,0,1,3},{201026,0,1,3},{201027,0,1,3},
A35: 202010 | B35: 银蛇 | C35: 1 | D35: 0 | E35: 1 | F35: 5 | G35: ="{"&RC[-6]&","&RC[-3]&","&RC[-2]&","&RC[-1]&"}," -> {202010,0,1,5}, | H35: =R[-1]C&RC[-1] -> {200000,0,1,30},{200001,0,1,30},{200002,0,1,30},{200003,0,1,30},{200006,0,1,30},{200010,0,1,5},{200011,0,1,10},{200012,0,1,10},{200013,0,1,10},{200015,0,1,10},{200016,0,1,10},{200017,0,1,10},{200019,0,1,10},{201000,0,1,30},{201001,0,1,30},{201002,0,1,30},{201003,0,1,30},{201006,0,1,30},{201010,0,1,5},{201011,0,1,10},{201012,0,1,10},{201013,0,1,10},{201015,0,1,10},{201016,0,1,10},{201017,0,1,10},{201019,0,1,10},{202000,0,1,30},{202001,0,1,30},{202002,0,1,30},{202003,0,1,30},{202006,0,1,30},{202010,0,1,5}, | J35: 201029 | K35: 法神鞋子 | L35: 1 | M35: 0 | N35: 1 | O35: 2 | P35: ="{"&RC[-6]&","&RC[-3]&","&RC[-2]&","&RC[-1]&"}," -> {201029,0,1,2}, | Q35: =R[-1]C&RC[-1] -> {200010,0,1,40},{200011,0,1,40},{200012,0,1,40},{200013,0,1,40},{200015,0,1,40},{200016,0,1,40},{200017,0,1,40},{200019,0,1,40},{200020,0,1,1},{200021,0,1,2},{200022,0,1,2},{200023,0,1,2},{200025,0,1,2},{200026,0,1,2},{200027,0,1,2},{200029,0,1,2},{201010,0,1,40},{201011,0,1,40},{201012,0,1,40},{201013,0,1,40},{201015,0,1,40},{201016,0,1,40},{201017,0,1,40},{201019,0,1,40},{201020,0,1,1},{201021,0,1,2},{201022,0,1,2},{201023,0,1,2},{201025,0,1,2},{201026,0,1,2},{201027,0,1,2},{201029,0,1,2}, | S35: 201029 | T35: 法神鞋子 | U35: 1 | V35: 0 | W35: 1 | X35: 3 | Y35: ="{"&RC[-6]&","&RC[-3]&","&RC[-2]&","&RC[-1]&"}," -> {201029,0,1,3}, | Z35: =R[-1]C&RC[-1] -> {200010,0,1,30},{200011,0,1,30},{200012,0,1,30},{200013,0,1,30},{200015,0,1,30},{200016,0,1,30},{200017,0,1,30},{200019,0,1,30},{200020,0,1,1},{200021,0,1,3},{200022,0,1,3},{200023,0,1,3},{200025,0,1,3},{200026,0,1,3},{200027,0,1,3},{200029,0,1,3},{201010,0,1,30},{201011,0,1,30},{201012,0,1,30},{201013,0,1,30},{201015,0,1,30},{201016,0,1,30},{201017,0,1,30},{201019,0,1,30},{201020,0,1,1},{201021,0,1,3},{201022,0,1,3},{201023,0,1,3},{201025,0,1,3},{201026,0,1,3},{201027,0,1,3},{201029,0,1,3},
A36: 202011 | B36: 天珠道链 | C36: 1 | D36: 0 | E36: 1 | F36: 10 | G36: ="{"&RC[-6]&","&RC[-3]&","&RC[-2]&","&RC[-1]&"}," -> {202011,0,1,10}, | H36: =R[-1]C&RC[-1] -> {200000,0,1,30},{200001,0,1,30},{200002,0,1,30},{200003,0,1,30},{200006,0,1,30},{200010,0,1,5},{200011,0,1,10},{200012,0,1,10},{200013,0,1,10},{200015,0,1,10},{200016,0,1,10},{200017,0,1,10},{200019,0,1,10},{201000,0,1,30},{201001,0,1,30},{201002,0,1,30},{201003,0,1,30},{201006,0,1,30},{201010,0,1,5},{201011,0,1,10},{201012,0,1,10},{201013,0,1,10},{201015,0,1,10},{201016,0,1,10},{201017,0,1,10},{201019,0,1,10},{202000,0,1,30},{202001,0,1,30},{202002,0,1,30},{202003,0,1,30},{202006,0,1,30},{202010,0,1,5},{202011,0,1,10}, | J36: 202010 | K36: 银蛇 | L36: 1 | M36: 0 | N36: 1 | O36: 40 | P36: ="{"&RC[-6]&","&RC[-3]&","&RC[-2]&","&RC[-1]&"}," -> {202010,0,1,40}, | Q36: =R[-1]C&RC[-1] -> {200010,0,1,40},{200011,0,1,40},{200012,0,1,40},{200013,0,1,40},{200015,0,1,40},{200016,0,1,40},{200017,0,1,40},{200019,0,1,40},{200020,0,1,1},{200021,0,1,2},{200022,0,1,2},{200023,0,1,2},{200025,0,1,2},{200026,0,1,2},{200027,0,1,2},{200029,0,1,2},{201010,0,1,40},{201011,0,1,40},{201012,0,1,40},{201013,0,1,40},{201015,0,1,40},{201016,0,1,40},{201017,0,1,40},{201019,0,1,40},{201020,0,1,1},{201021,0,1,2},{201022,0,1,2},{201023,0,1,2},{201025,0,1,2},{201026,0,1,2},{201027,0,1,2},{201029,0,1,2},{202010,0,1,40}, | S36: 202010 | T36: 银蛇 | U36: 1 | V36: 0 | W36: 1 | X36: 30 | Y36: ="{"&RC[-6]&","&RC[-3]&","&RC[-2]&","&RC[-1]&"}," -> {202010,0,1,30}, | Z36: =R[-1]C&RC[-1] -> {200010,0,1,30},{200011,0,1,30},{200012,0,1,30},{200013,0,1,30},{200015,0,1,30},{200016,0,1,30},{200017,0,1,30},{200019,0,1,30},{200020,0,1,1},{200021,0,1,3},{200022,0,1,3},{200023,0,1,3},{200025,0,1,3},{200026,0,1,3},{200027,0,1,3},{200029,0,1,3},{201010,0,1,30},{201011,0,1,30},{201012,0,1,30},{201013,0,1,30},{201015,0,1,30},{201016,0,1,30},{201017,0,1,30},{201019,0,1,30},{201020,0,1,1},{201021,0,1,3},{201022,0,1,3},{201023,0,1,3},{201025,0,1,3},{201026,0,1,3},{201027,0,1,3},{201029,0,1,3},{202010,0,1,30},
A37: 202012 | B37: 灵魂道袍 | C37: 1 | D37: 0 | E37: 1 | F37: 10 | G37: ="{"&RC[-6]&","&RC[-3]&","&RC[-2]&","&RC[-1]&"}," -> {202012,0,1,10}, | H37: =R[-1]C&RC[-1] -> {200000,0,1,30},{200001,0,1,30},{200002,0,1,30},{200003,0,1,30},{200006,0,1,30},{200010,0,1,5},{200011,0,1,10},{200012,0,1,10},{200013,0,1,10},{200015,0,1,10},{200016,0,1,10},{200017,0,1,10},{200019,0,1,10},{201000,0,1,30},{201001,0,1,30},{201002,0,1,30},{201003,0,1,30},{201006,0,1,30},{201010,0,1,5},{201011,0,1,10},{201012,0,1,10},{201013,0,1,10},{201015,0,1,10},{201016,0,1,10},{201017,0,1,10},{201019,0,1,10},{202000,0,1,30},{202001,0,1,30},{202002,0,1,30},{202003,0,1,30},{202006,0,1,30},{202010,0,1,5},{202011,0,1,10},{202012,0,1,10}, | J37: 202011 | K37: 天珠道链 | L37: 1 | M37: 0 | N37: 1 | O37: 40 | P37: ="{"&RC[-6]&","&RC[-3]&","&RC[-2]&","&RC[-1]&"}," -> {202011,0,1,40}, | Q37: =R[-1]C&RC[-1] -> {200010,0,1,40},{200011,0,1,40},{200012,0,1,40},{200013,0,1,40},{200015,0,1,40},{200016,0,1,40},{200017,0,1,40},{200019,0,1,40},{200020,0,1,1},{200021,0,1,2},{200022,0,1,2},{200023,0,1,2},{200025,0,1,2},{200026,0,1,2},{200027,0,1,2},{200029,0,1,2},{201010,0,1,40},{201011,0,1,40},{201012,0,1,40},{201013,0,1,40},{201015,0,1,40},{201016,0,1,40},{201017,0,1,40},{201019,0,1,40},{201020,0,1,1},{201021,0,1,2},{201022,0,1,2},{201023,0,1,2},{201025,0,1,2},{201026,0,1,2},{201027,0,1,2},{201029,0,1,2},{202010,0,1,40},{202011,0,1,40}, | S37: 202011 | T37: 天珠道链 | U37: 1 | V37: 0 | W37: 1 | X37: 30 | Y37: ="{"&RC[-6]&","&RC[-3]&","&RC[-2]&","&RC[-1]&"}," -> {202011,0,1,30}, | Z37: =R[-1]C&RC[-1] -> {200010,0,1,30},{200011,0,1,30},{200012,0,1,30},{200013,0,1,30},{200015,0,1,30},{200016,0,1,30},{200017,0,1,30},{200019,0,1,30},{200020,0,1,1},{200021,0,1,3},{200022,0,1,3},{200023,0,1,3},{200025,0,1,3},{200026,0,1,3},{200027,0,1,3},{200029,0,1,3},{201010,0,1,30},{201011,0,1,30},{201012,0,1,30},{201013,0,1,30},{201015,0,1,30},{201016,0,1,30},{201017,0,1,30},{201019,0,1,30},{201020,0,1,1},{201021,0,1,3},{201022,0,1,3},{201023,0,1,3},{201025,0,1,3},{201026,0,1,3},{201027,0,1,3},{201029,0,1,3},{202010,0,1,30},{202011,0,1,30},
A38: 202013 | B38: 泰坦戒指 | C38: 1 | D38: 0 | E38: 1 | F38: 10 | G38: ="{"&RC[-6]&","&RC[-3]&","&RC[-2]&","&RC[-1]&"}," -> {202013,0,1,10}, | H38: =R[-1]C&RC[-1] -> {200000,0,1,30},{200001,0,1,30},{200002,0,1,30},{200003,0,1,30},{200006,0,1,30},{200010,0,1,5},{200011,0,1,10},{200012,0,1,10},{200013,0,1,10},{200015,0,1,10},{200016,0,1,10},{200017,0,1,10},{200019,0,1,10},{201000,0,1,30},{201001,0,1,30},{201002,0,1,30},{201003,0,1,30},{201006,0,1,30},{201010,0,1,5},{201011,0,1,10},{201012,0,1,10},{201013,0,1,10},{201015,0,1,10},{201016,0,1,10},{201017,0,1,10},{201019,0,1,10},{202000,0,1,30},{202001,0,1,30},{202002,0,1,30},{202003,0,1,30},{202006,0,1,30},{202010,0,1,5},{202011,0,1,10},{202012,0,1,10},{202013,0,1,10}, | J38: 202012 | K38: 灵魂道袍 | L38: 1 | M38: 0 | N38: 1 | O38: 40 | P38: ="{"&RC[-6]&","&RC[-3]&","&RC[-2]&","&RC[-1]&"}," -> {202012,0,1,40}, | Q38: =R[-1]C&RC[-1] -> {200010,0,1,40},{200011,0,1,40},{200012,0,1,40},{200013,0,1,40},{200015,0,1,40},{200016,0,1,40},{200017,0,1,40},{200019,0,1,40},{200020,0,1,1},{200021,0,1,2},{200022,0,1,2},{200023,0,1,2},{200025,0,1,2},{200026,0,1,2},{200027,0,1,2},{200029,0,1,2},{201010,0,1,40},{201011,0,1,40},{201012,0,1,40},{201013,0,1,40},{201015,0,1,40},{201016,0,1,40},{201017,0,1,40},{201019,0,1,40},{201020,0,1,1},{201021,0,1,2},{201022,0,1,2},{201023,0,1,2},{201025,0,1,2},{201026,0,1,2},{201027,0,1,2},{201029,0,1,2},{202010,0,1,40},{202011,0,1,40},{202012,0,1,40}, | S38: 202012 | T38: 灵魂道袍 | U38: 1 | V38: 0 | W38: 1 | X38: 30 | Y38: ="{"&RC[-6]&","&RC[-3]&","&RC[-2]&","&RC[-1]&"}," -> {202012,0,1,30}, | Z38: =R[-1]C&RC[-1] -> {200010,0,1,30},{200011,0,1,30},{200012,0,1,30},{200013,0,1,30},{200015,0,1,30},{200016,0,1,30},{200017,0,1,30},{200019,0,1,30},{200020,0,1,1},{200021,0,1,3},{200022,0,1,3},{200023,0,1,3},{200025,0,1,3},{200026,0,1,3},{200027,0,1,3},{200029,0,1,3},{201010,0,1,30},{201011,0,1,30},{201012,0,1,30},{201013,0,1,30},{201015,0,1,30},{201016,0,1,30},{201017,0,1,30},{201019,0,1,30},{201020,0,1,1},{201021,0,1,3},{201022,0,1,3},{201023,0,1,3},{201025,0,1,3},{201026,0,1,3},{201027,0,1,3},{201029,0,1,3},{202010,0,1,30},{202011,0,1,30},{202012,0,1,30},
A39: 202015 | B39: 道士头盔 | C39: 1 | D39: 0 | E39: 1 | F39: 10 | G39: ="{"&RC[-6]&","&RC[-3]&","&RC[-2]&","&RC[-1]&"}," -> {202015,0,1,10}, | H39: =R[-1]C&RC[-1] -> {200000,0,1,30},{200001,0,1,30},{200002,0,1,30},{200003,0,1,30},{200006,0,1,30},{200010,0,1,5},{200011,0,1,10},{200012,0,1,10},{200013,0,1,10},{200015,0,1,10},{200016,0,1,10},{200017,0,1,10},{200019,0,1,10},{201000,0,1,30},{201001,0,1,30},{201002,0,1,30},{201003,0,1,30},{201006,0,1,30},{201010,0,1,5},{201011,0,1,10},{201012,0,1,10},{201013,0,1,10},{201015,0,1,10},{201016,0,1,10},{201017,0,1,10},{201019,0,1,10},{202000,0,1,30},{202001,0,1,30},{202002,0,1,30},{202003,0,1,30},{202006,0,1,30},{202010,0,1,5},{202011,0,1,10},{202012,0,1,10},{202013,0,1,10},{202015,0,1,10}, | J39: 202013 | K39: 泰坦戒指 | L39: 1 | M39: 0 | N39: 1 | O39: 40 | P39: ="{"&RC[-6]&","&RC[-3]&","&RC[-2]&","&RC[-1]&"}," -> {202013,0,1,40}, | Q39: =R[-1]C&RC[-1] -> {200010,0,1,40},{200011,0,1,40},{200012,0,1,40},{200013,0,1,40},{200015,0,1,40},{200016,0,1,40},{200017,0,1,40},{200019,0,1,40},{200020,0,1,1},{200021,0,1,2},{200022,0,1,2},{200023,0,1,2},{200025,0,1,2},{200026,0,1,2},{200027,0,1,2},{200029,0,1,2},{201010,0,1,40},{201011,0,1,40},{201012,0,1,40},{201013,0,1,40},{201015,0,1,40},{201016,0,1,40},{201017,0,1,40},{201019,0,1,40},{201020,0,1,1},{201021,0,1,2},{201022,0,1,2},{201023,0,1,2},{201025,0,1,2},{201026,0,1,2},{201027,0,1,2},{201029,0,1,2},{202010,0,1,40},{202011,0,1,40},{202012,0,1,40},{202013,0,1,40}, | S39: 202013 | T39: 泰坦戒指 | U39: 1 | V39: 0 | W39: 1 | X39: 30 | Y39: ="{"&RC[-6]&","&RC[-3]&","&RC[-2]&","&RC[-1]&"}," -> {202013,0,1,30}, | Z39: =R[-1]C&RC[-1] -> {200010,0,1,30},{200011,0,1,30},{200012,0,1,30},{200013,0,1,30},{200015,0,1,30},{200016,0,1,30},{200017,0,1,30},{200019,0,1,30},{200020,0,1,1},{200021,0,1,3},{200022,0,1,3},{200023,0,1,3},{200025,0,1,3},{200026,0,1,3},{200027,0,1,3},{200029,0,1,3},{201010,0,1,30},{201011,0,1,30},{201012,0,1,30},{201013,0,1,30},{201015,0,1,30},{201016,0,1,30},{201017,0,1,30},{201019,0,1,30},{201020,0,1,1},{201021,0,1,3},{201022,0,1,3},{201023,0,1,3},{201025,0,1,3},{201026,0,1,3},{201027,0,1,3},{201029,0,1,3},{202010,0,1,30},{202011,0,1,30},{202012,0,1,30},{202013,0,1,30},
A40: 202016 | B40: 幽灵手镯 | C40: 1 | D40: 0 | E40: 1 | F40: 10 | G40: ="{"&RC[-6]&","&RC[-3]&","&RC[-2]&","&RC[-1]&"}," -> {202016,0,1,10}, | H40: =R[-1]C&RC[-1] -> {200000,0,1,30},{200001,0,1,30},{200002,0,1,30},{200003,0,1,30},{200006,0,1,30},{200010,0,1,5},{200011,0,1,10},{200012,0,1,10},{200013,0,1,10},{200015,0,1,10},{200016,0,1,10},{200017,0,1,10},{200019,0,1,10},{201000,0,1,30},{201001,0,1,30},{201002,0,1,30},{201003,0,1,30},{201006,0,1,30},{201010,0,1,5},{201011,0,1,10},{201012,0,1,10},{201013,0,1,10},{201015,0,1,10},{201016,0,1,10},{201017,0,1,10},{201019,0,1,10},{202000,0,1,30},{202001,0,1,30},{202002,0,1,30},{202003,0,1,30},{202006,0,1,30},{202010,0,1,5},{202011,0,1,10},{202012,0,1,10},{202013,0,1,10},{202015,0,1,10},{202016,0,1,10}, | J40: 202015 | K40: 道士头盔 | L40: 1 | M40: 0 | N40: 1 | O40: 40 | P40: ="{"&RC[-6]&","&RC[-3]&","&RC[-2]&","&RC[-1]&"}," -> {202015,0,1,40}, | Q40: =R[-1]C&RC[-1] -> {200010,0,1,40},{200011,0,1,40},{200012,0,1,40},{200013,0,1,40},{200015,0,1,40},{200016,0,1,40},{200017,0,1,40},{200019,0,1,40},{200020,0,1,1},{200021,0,1,2},{200022,0,1,2},{200023,0,1,2},{200025,0,1,2},{200026,0,1,2},{200027,0,1,2},{200029,0,1,2},{201010,0,1,40},{201011,0,1,40},{201012,0,1,40},{201013,0,1,40},{201015,0,1,40},{201016,0,1,40},{201017,0,1,40},{201019,0,1,40},{201020,0,1,1},{201021,0,1,2},{201022,0,1,2},{201023,0,1,2},{201025,0,1,2},{201026,0,1,2},{201027,0,1,2},{201029,0,1,2},{202010,0,1,40},{202011,0,1,40},{202012,0,1,40},{202013,0,1,40},{202015,0,1,40}, | S40: 202015 | T40: 道士头盔 | U40: 1 | V40: 0 | W40: 1 | X40: 30 | Y40: ="{"&RC[-6]&","&RC[-3]&","&RC[-2]&","&RC[-1]&"}," -> {202015,0,1,30}, | Z40: =R[-1]C&RC[-1] -> {200010,0,1,30},{200011,0,1,30},{200012,0,1,30},{200013,0,1,30},{200015,0,1,30},{200016,0,1,30},{200017,0,1,30},{200019,0,1,30},{200020,0,1,1},{200021,0,1,3},{200022,0,1,3},{200023,0,1,3},{200025,0,1,3},{200026,0,1,3},{200027,0,1,3},{200029,0,1,3},{201010,0,1,30},{201011,0,1,30},{201012,0,1,30},{201013,0,1,30},{201015,0,1,30},{201016,0,1,30},{201017,0,1,30},{201019,0,1,30},{201020,0,1,1},{201021,0,1,3},{201022,0,1,3},{201023,0,1,3},{201025,0,1,3},{201026,0,1,3},{201027,0,1,3},{201029,0,1,3},{202010,0,1,30},{202011,0,1,30},{202012,0,1,30},{202013,0,1,30},{202015,0,1,30},
A41: 202017 | B41: 道士腰带 | C41: 1 | D41: 0 | E41: 1 | F41: 10 | G41: ="{"&RC[-6]&","&RC[-3]&","&RC[-2]&","&RC[-1]&"}," -> {202017,0,1,10}, | H41: =R[-1]C&RC[-1] -> {200000,0,1,30},{200001,0,1,30},{200002,0,1,30},{200003,0,1,30},{200006,0,1,30},{200010,0,1,5},{200011,0,1,10},{200012,0,1,10},{200013,0,1,10},{200015,0,1,10},{200016,0,1,10},{200017,0,1,10},{200019,0,1,10},{201000,0,1,30},{201001,0,1,30},{201002,0,1,30},{201003,0,1,30},{201006,0,1,30},{201010,0,1,5},{201011,0,1,10},{201012,0,1,10},{201013,0,1,10},{201015,0,1,10},{201016,0,1,10},{201017,0,1,10},{201019,0,1,10},{202000,0,1,30},{202001,0,1,30},{202002,0,1,30},{202003,0,1,30},{202006,0,1,30},{202010,0,1,5},{202011,0,1,10},{202012,0,1,10},{202013,0,1,10},{202015,0,1,10},{202016,0,1,10},{202017,0,1,10}, | J41: 202016 | K41: 幽灵手镯 | L41: 1 | M41: 0 | N41: 1 | O41: 40 | P41: ="{"&RC[-6]&","&RC[-3]&","&RC[-2]&","&RC[-1]&"}," -> {202016,0,1,40}, | Q41: =R[-1]C&RC[-1] -> {200010,0,1,40},{200011,0,1,40},{200012,0,1,40},{200013,0,1,40},{200015,0,1,40},{200016,0,1,40},{200017,0,1,40},{200019,0,1,40},{200020,0,1,1},{200021,0,1,2},{200022,0,1,2},{200023,0,1,2},{200025,0,1,2},{200026,0,1,2},{200027,0,1,2},{200029,0,1,2},{201010,0,1,40},{201011,0,1,40},{201012,0,1,40},{201013,0,1,40},{201015,0,1,40},{201016,0,1,40},{201017,0,1,40},{201019,0,1,40},{201020,0,1,1},{201021,0,1,2},{201022,0,1,2},{201023,0,1,2},{201025,0,1,2},{201026,0,1,2},{201027,0,1,2},{201029,0,1,2},{202010,0,1,40},{202011,0,1,40},{202012,0,1,40},{202013,0,1,40},{202015,0,1,40},{202016,0,1,40}, | S41: 202016 | T41: 幽灵手镯 | U41: 1 | V41: 0 | W41: 1 | X41: 30 | Y41: ="{"&RC[-6]&","&RC[-3]&","&RC[-2]&","&RC[-1]&"}," -> {202016,0,1,30}, | Z41: =R[-1]C&RC[-1] -> {200010,0,1,30},{200011,0,1,30},{200012,0,1,30},{200013,0,1,30},{200015,0,1,30},{200016,0,1,30},{200017,0,1,30},{200019,0,1,30},{200020,0,1,1},{200021,0,1,3},{200022,0,1,3},{200023,0,1,3},{200025,0,1,3},{200026,0,1,3},{200027,0,1,3},{200029,0,1,3},{201010,0,1,30},{201011,0,1,30},{201012,0,1,30},{201013,0,1,30},{201015,0,1,30},{201016,0,1,30},{201017,0,1,30},{201019,0,1,30},{201020,0,1,1},{201021,0,1,3},{201022,0,1,3},{201023,0,1,3},{201025,0,1,3},{201026,0,1,3},{201027,0,1,3},{201029,0,1,3},{202010,0,1,30},{202011,0,1,30},{202012,0,1,30},{202013,0,1,30},{202015,0,1,30},{202016,0,1,30},
A42: 202019 | B42: 道士鞋子 | C42: 1 | D42: 0 | E42: 1 | F42: 10 | G42: ="{"&RC[-6]&","&RC[-3]&","&RC[-2]&","&RC[-1]&"}" -> {202019,0,1,10} | H42: =R[-1]C&RC[-1] -> {200000,0,1,30},{200001,0,1,30},{200002,0,1,30},{200003,0,1,30},{200006,0,1,30},{200010,0,1,5},{200011,0,1,10},{200012,0,1,10},{200013,0,1,10},{200015,0,1,10},{200016,0,1,10},{200017,0,1,10},{200019,0,1,10},{201000,0,1,30},{201001,0,1,30},{201002,0,1,30},{201003,0,1,30},{201006,0,1,30},{201010,0,1,5},{201011,0,1,10},{201012,0,1,10},{201013,0,1,10},{201015,0,1,10},{201016,0,1,10},{201017,0,1,10},{201019,0,1,10},{202000,0,1,30},{202001,0,1,30},{202002,0,1,30},{202003,0,1,30},{202006,0,1,30},{202010,0,1,5},{202011,0,1,10},{202012,0,1,10},{202013,0,1,10},{202015,0,1,10},{202016,0,1,10},{202017,0,1,10},{202019,0,1,10} | J42: 202017 | K42: 道士腰带 | L42: 1 | M42: 0 | N42: 1 | O42: 40 | P42: ="{"&RC[-6]&","&RC[-3]&","&RC[-2]&","&RC[-1]&"}," -> {202017,0,1,40}, | Q42: =R[-1]C&RC[-1] -> {200010,0,1,40},{200011,0,1,40},{200012,0,1,40},{200013,0,1,40},{200015,0,1,40},{200016,0,1,40},{200017,0,1,40},{200019,0,1,40},{200020,0,1,1},{200021,0,1,2},{200022,0,1,2},{200023,0,1,2},{200025,0,1,2},{200026,0,1,2},{200027,0,1,2},{200029,0,1,2},{201010,0,1,40},{201011,0,1,40},{201012,0,1,40},{201013,0,1,40},{201015,0,1,40},{201016,0,1,40},{201017,0,1,40},{201019,0,1,40},{201020,0,1,1},{201021,0,1,2},{201022,0,1,2},{201023,0,1,2},{201025,0,1,2},{201026,0,1,2},{201027,0,1,2},{201029,0,1,2},{202010,0,1,40},{202011,0,1,40},{202012,0,1,40},{202013,0,1,40},{202015,0,1,40},{202016,0,1,40},{202017,0,1,40}, | S42: 202017 | T42: 道士腰带 | U42: 1 | V42: 0 | W42: 1 | X42: 30 | Y42: ="{"&RC[-6]&","&RC[-3]&","&RC[-2]&","&RC[-1]&"}," -> {202017,0,1,30}, | Z42: =R[-1]C&RC[-1] -> {200010,0,1,30},{200011,0,1,30},{200012,0,1,30},{200013,0,1,30},{200015,0,1,30},{200016,0,1,30},{200017,0,1,30},{200019,0,1,30},{200020,0,1,1},{200021,0,1,3},{200022,0,1,3},{200023,0,1,3},{200025,0,1,3},{200026,0,1,3},{200027,0,1,3},{200029,0,1,3},{201010,0,1,30},{201011,0,1,30},{201012,0,1,30},{201013,0,1,30},{201015,0,1,30},{201016,0,1,30},{201017,0,1,30},{201019,0,1,30},{201020,0,1,1},{201021,0,1,3},{201022,0,1,3},{201023,0,1,3},{201025,0,1,3},{201026,0,1,3},{201027,0,1,3},{201029,0,1,3},{202010,0,1,30},{202011,0,1,30},{202012,0,1,30},{202013,0,1,30},{202015,0,1,30},{202016,0,1,30},{202017,0,1,30},
J43: 202019 | K43: 道士鞋子 | L43: 1 | M43: 0 | N43: 1 | O43: 40 | P43: ="{"&RC[-6]&","&RC[-3]&","&RC[-2]&","&RC[-1]&"}," -> {202019,0,1,40}, | Q43: =R[-1]C&RC[-1] -> {200010,0,1,40},{200011,0,1,40},{200012,0,1,40},{200013,0,1,40},{200015,0,1,40},{200016,0,1,40},{200017,0,1,40},{200019,0,1,40},{200020,0,1,1},{200021,0,1,2},{200022,0,1,2},{200023,0,1,2},{200025,0,1,2},{200026,0,1,2},{200027,0,1,2},{200029,0,1,2},{201010,0,1,40},{201011,0,1,40},{201012,0,1,40},{201013,0,1,40},{201015,0,1,40},{201016,0,1,40},{201017,0,1,40},{201019,0,1,40},{201020,0,1,1},{201021,0,1,2},{201022,0,1,2},{201023,0,1,2},{201025,0,1,2},{201026,0,1,2},{201027,0,1,2},{201029,0,1,2},{202010,0,1,40},{202011,0,1,40},{202012,0,1,40},{202013,0,1,40},{202015,0,1,40},{202016,0,1,40},{202017,0,1,40},{202019,0,1,40}, | S43: 202019 | T43: 道士鞋子 | U43: 1 | V43: 0 | W43: 1 | X43: 30 | Y43: ="{"&RC[-6]&","&RC[-3]&","&RC[-2]&","&RC[-1]&"}," -> {202019,0,1,30}, | Z43: =R[-1]C&RC[-1] -> {200010,0,1,30},{200011,0,1,30},{200012,0,1,30},{200013,0,1,30},{200015,0,1,30},{200016,0,1,30},{200017,0,1,30},{200019,0,1,30},{200020,0,1,1},{200021,0,1,3},{200022,0,1,3},{200023,0,1,3},{200025,0,1,3},{200026,0,1,3},{200027,0,1,3},{200029,0,1,3},{201010,0,1,30},{201011,0,1,30},{201012,0,1,30},{201013,0,1,30},{201015,0,1,30},{201016,0,1,30},{201017,0,1,30},{201019,0,1,30},{201020,0,1,1},{201021,0,1,3},{201022,0,1,3},{201023,0,1,3},{201025,0,1,3},{201026,0,1,3},{201027,0,1,3},{201029,0,1,3},{202010,0,1,30},{202011,0,1,30},{202012,0,1,30},{202013,0,1,30},{202015,0,1,30},{202016,0,1,30},{202017,0,1,30},{202019,0,1,30},
J44: 202020 | K44: 龙纹 | L44: 1 | M44: 0 | N44: 1 | O44: 1 | P44: ="{"&RC[-6]&","&RC[-3]&","&RC[-2]&","&RC[-1]&"}," -> {202020,0,1,1}, | Q44: =R[-1]C&RC[-1] -> {200010,0,1,40},{200011,0,1,40},{200012,0,1,40},{200013,0,1,40},{200015,0,1,40},{200016,0,1,40},{200017,0,1,40},{200019,0,1,40},{200020,0,1,1},{200021,0,1,2},{200022,0,1,2},{200023,0,1,2},{200025,0,1,2},{200026,0,1,2},{200027,0,1,2},{200029,0,1,2},{201010,0,1,40},{201011,0,1,40},{201012,0,1,40},{201013,0,1,40},{201015,0,1,40},{201016,0,1,40},{201017,0,1,40},{201019,0,1,40},{201020,0,1,1},{201021,0,1,2},{201022,0,1,2},{201023,0,1,2},{201025,0,1,2},{201026,0,1,2},{201027,0,1,2},{201029,0,1,2},{202010,0,1,40},{202011,0,1,40},{202012,0,1,40},{202013,0,1,40},{202015,0,1,40},{202016,0,1,40},{202017,0,1,40},{202019,0,1,40},{202020,0,1,1}, | S44: 202020 | T44: 龙纹 | U44: 1 | V44: 0 | W44: 1 | X44: 1 | Y44: ="{"&RC[-6]&","&RC[-3]&","&RC[-2]&","&RC[-1]&"}," -> {202020,0,1,1}, | Z44: =R[-1]C&RC[-1] -> {200010,0,1,30},{200011,0,1,30},{200012,0,1,30},{200013,0,1,30},{200015,0,1,30},{200016,0,1,30},{200017,0,1,30},{200019,0,1,30},{200020,0,1,1},{200021,0,1,3},{200022,0,1,3},{200023,0,1,3},{200025,0,1,3},{200026,0,1,3},{200027,0,1,3},{200029,0,1,3},{201010,0,1,30},{201011,0,1,30},{201012,0,1,30},{201013,0,1,30},{201015,0,1,30},{201016,0,1,30},{201017,0,1,30},{201019,0,1,30},{201020,0,1,1},{201021,0,1,3},{201022,0,1,3},{201023,0,1,3},{201025,0,1,3},{201026,0,1,3},{201027,0,1,3},{201029,0,1,3},{202010,0,1,30},{202011,0,1,30},{202012,0,1,30},{202013,0,1,30},{202015,0,1,30},{202016,0,1,30},{202017,0,1,30},{202019,0,1,30},{202020,0,1,1},
A45: 110002 | B45: 强化石 | D45: 0 | E45: 2 | F45: 0 | G45: ="{"&RC[-6]&","&RC[-3]&","&RC[-2]&","&RC[-1]&"}," -> {110002,0,2,0}, | H45: =RC[-1] -> {110002,0,2,0}, | J45: 202021 | K45: 天尊道袍 | L45: 1 | M45: 0 | N45: 1 | O45: 2 | P45: ="{"&RC[-6]&","&RC[-3]&","&RC[-2]&","&RC[-1]&"}," -> {202021,0,1,2}, | Q45: =R[-1]C&RC[-1] -> {200010,0,1,40},{200011,0,1,40},{200012,0,1,40},{200013,0,1,40},{200015,0,1,40},{200016,0,1,40},{200017,0,1,40},{200019,0,1,40},{200020,0,1,1},{200021,0,1,2},{200022,0,1,2},{200023,0,1,2},{200025,0,1,2},{200026,0,1,2},{200027,0,1,2},{200029,0,1,2},{201010,0,1,40},{201011,0,1,40},{201012,0,1,40},{201013,0,1,40},{201015,0,1,40},{201016,0,1,40},{201017,0,1,40},{201019,0,1,40},{201020,0,1,1},{201021,0,1,2},{201022,0,1,2},{201023,0,1,2},{201025,0,1,2},{201026,0,1,2},{201027,0,1,2},{201029,0,1,2},{202010,0,1,40},{202011,0,1,40},{202012,0,1,40},{202013,0,1,40},{202015,0,1,40},{202016,0,1,40},{202017,0,1,40},{202019,0,1,40},{202020,0,1,1},{202021,0,1,2}, | S45: 202021 | T45: 天尊道袍 | U45: 1 | V45: 0 | W45: 1 | X45: 3 | Y45: ="{"&RC[-6]&","&RC[-3]&","&RC[-2]&","&RC[-1]&"}," -> {202021,0,1,3}, | Z45: =R[-1]C&RC[-1] -> {200010,0,1,30},{200011,0,1,30},{200012,0,1,30},{200013,0,1,30},{200015,0,1,30},{200016,0,1,30},{200017,0,1,30},{200019,0,1,30},{200020,0,1,1},{200021,0,1,3},{200022,0,1,3},{200023,0,1,3},{200025,0,1,3},{200026,0,1,3},{200027,0,1,3},{200029,0,1,3},{201010,0,1,30},{201011,0,1,30},{201012,0,1,30},{201013,0,1,30},{201015,0,1,30},{201016,0,1,30},{201017,0,1,30},{201019,0,1,30},{201020,0,1,1},{201021,0,1,3},{201022,0,1,3},{201023,0,1,3},{201025,0,1,3},{201026,0,1,3},{201027,0,1,3},{201029,0,1,3},{202010,0,1,30},{202011,0,1,30},{202012,0,1,30},{202013,0,1,30},{202015,0,1,30},{202016,0,1,30},{202017,0,1,30},{202019,0,1,30},{202020,0,1,1},{202021,0,1,3},
A46: 110003 | B46: 洗炼石 | D46: 0 | E46: 2 | F46: 0 | G46: ="{"&RC[-6]&","&RC[-3]&","&RC[-2]&","&RC[-1]&"}," -> {110003,0,2,0}, | H46: =R[-1]C&RC[-1] -> {110002,0,2,0},{110003,0,2,0}, | J46: 202022 | K46: 天尊项链 | L46: 1 | M46: 0 | N46: 1 | O46: 2 | P46: ="{"&RC[-6]&","&RC[-3]&","&RC[-2]&","&RC[-1]&"}," -> {202022,0,1,2}, | Q46: =R[-1]C&RC[-1] -> {200010,0,1,40},{200011,0,1,40},{200012,0,1,40},{200013,0,1,40},{200015,0,1,40},{200016,0,1,40},{200017,0,1,40},{200019,0,1,40},{200020,0,1,1},{200021,0,1,2},{200022,0,1,2},{200023,0,1,2},{200025,0,1,2},{200026,0,1,2},{200027,0,1,2},{200029,0,1,2},{201010,0,1,40},{201011,0,1,40},{201012,0,1,40},{201013,0,1,40},{201015,0,1,40},{201016,0,1,40},{201017,0,1,40},{201019,0,1,40},{201020,0,1,1},{201021,0,1,2},{201022,0,1,2},{201023,0,1,2},{201025,0,1,2},{201026,0,1,2},{201027,0,1,2},{201029,0,1,2},{202010,0,1,40},{202011,0,1,40},{202012,0,1,40},{202013,0,1,40},{202015,0,1,40},{202016,0,1,40},{202017,0,1,40},{202019,0,1,40},{202020,0,1,1},{202021,0,1,2},{202022,0,1,2}, | S46: 202022 | T46: 天尊项链 | U46: 1 | V46: 0 | W46: 1 | X46: 3 | Y46: ="{"&RC[-6]&","&RC[-3]&","&RC[-2]&","&RC[-1]&"}," -> {202022,0,1,3}, | Z46: =R[-1]C&RC[-1] -> {200010,0,1,30},{200011,0,1,30},{200012,0,1,30},{200013,0,1,30},{200015,0,1,30},{200016,0,1,30},{200017,0,1,30},{200019,0,1,30},{200020,0,1,1},{200021,0,1,3},{200022,0,1,3},{200023,0,1,3},{200025,0,1,3},{200026,0,1,3},{200027,0,1,3},{200029,0,1,3},{201010,0,1,30},{201011,0,1,30},{201012,0,1,30},{201013,0,1,30},{201015,0,1,30},{201016,0,1,30},{201017,0,1,30},{201019,0,1,30},{201020,0,1,1},{201021,0,1,3},{201022,0,1,3},{201023,0,1,3},{201025,0,1,3},{201026,0,1,3},{201027,0,1,3},{201029,0,1,3},{202010,0,1,30},{202011,0,1,30},{202012,0,1,30},{202013,0,1,30},{202015,0,1,30},{202016,0,1,30},{202017,0,1,30},{202019,0,1,30},{202020,0,1,1},{202021,0,1,3},{202022,0,1,3},
A47: 110004 | B47: 红药 | D47: 0 | E47: 1 | F47: 0 | G47: ="{"&RC[-6]&","&RC[-3]&","&RC[-2]&","&RC[-1]&"}," -> {110004,0,1,0}, | H47: =R[-1]C&RC[-1] -> {110002,0,2,0},{110003,0,2,0},{110004,0,1,0}, | J47: 202023 | K47: 天尊戒指 | L47: 1 | M47: 0 | N47: 1 | O47: 2 | P47: ="{"&RC[-6]&","&RC[-3]&","&RC[-2]&","&RC[-1]&"}," -> {202023,0,1,2}, | Q47: =R[-1]C&RC[-1] -> {200010,0,1,40},{200011,0,1,40},{200012,0,1,40},{200013,0,1,40},{200015,0,1,40},{200016,0,1,40},{200017,0,1,40},{200019,0,1,40},{200020,0,1,1},{200021,0,1,2},{200022,0,1,2},{200023,0,1,2},{200025,0,1,2},{200026,0,1,2},{200027,0,1,2},{200029,0,1,2},{201010,0,1,40},{201011,0,1,40},{201012,0,1,40},{201013,0,1,40},{201015,0,1,40},{201016,0,1,40},{201017,0,1,40},{201019,0,1,40},{201020,0,1,1},{201021,0,1,2},{201022,0,1,2},{201023,0,1,2},{201025,0,1,2},{201026,0,1,2},{201027,0,1,2},{201029,0,1,2},{202010,0,1,40},{202011,0,1,40},{202012,0,1,40},{202013,0,1,40},{202015,0,1,40},{202016,0,1,40},{202017,0,1,40},{202019,0,1,40},{202020,0,1,1},{202021,0,1,2},{202022,0,1,2},{202023,0,1,2}, | S47: 202023 | T47: 天尊戒指 | U47: 1 | V47: 0 | W47: 1 | X47: 3 | Y47: ="{"&RC[-6]&","&RC[-3]&","&RC[-2]&","&RC[-1]&"}," -> {202023,0,1,3}, | Z47: =R[-1]C&RC[-1] -> {200010,0,1,30},{200011,0,1,30},{200012,0,1,30},{200013,0,1,30},{200015,0,1,30},{200016,0,1,30},{200017,0,1,30},{200019,0,1,30},{200020,0,1,1},{200021,0,1,3},{200022,0,1,3},{200023,0,1,3},{200025,0,1,3},{200026,0,1,3},{200027,0,1,3},{200029,0,1,3},{201010,0,1,30},{201011,0,1,30},{201012,0,1,30},{201013,0,1,30},{201015,0,1,30},{201016,0,1,30},{201017,0,1,30},{201019,0,1,30},{201020,0,1,1},{201021,0,1,3},{201022,0,1,3},{201023,0,1,3},{201025,0,1,3},{201026,0,1,3},{201027,0,1,3},{201029,0,1,3},{202010,0,1,30},{202011,0,1,30},{202012,0,1,30},{202013,0,1,30},{202015,0,1,30},{202016,0,1,30},{202017,0,1,30},{202019,0,1,30},{202020,0,1,1},{202021,0,1,3},{202022,0,1,3},{202023,0,1,3},
A48: 110005 | B48: 蓝药 | D48: 0 | E48: 1 | F48: 0 | G48: ="{"&RC[-6]&","&RC[-3]&","&RC[-2]&","&RC[-1]&"}," -> {110005,0,1,0}, | H48: =R[-1]C&RC[-1] -> {110002,0,2,0},{110003,0,2,0},{110004,0,1,0},{110005,0,1,0}, | J48: 202025 | K48: 天尊头盔 | L48: 1 | M48: 0 | N48: 1 | O48: 2 | P48: ="{"&RC[-6]&","&RC[-3]&","&RC[-2]&","&RC[-1]&"}," -> {202025,0,1,2}, | Q48: =R[-1]C&RC[-1] -> {200010,0,1,40},{200011,0,1,40},{200012,0,1,40},{200013,0,1,40},{200015,0,1,40},{200016,0,1,40},{200017,0,1,40},{200019,0,1,40},{200020,0,1,1},{200021,0,1,2},{200022,0,1,2},{200023,0,1,2},{200025,0,1,2},{200026,0,1,2},{200027,0,1,2},{200029,0,1,2},{201010,0,1,40},{201011,0,1,40},{201012,0,1,40},{201013,0,1,40},{201015,0,1,40},{201016,0,1,40},{201017,0,1,40},{201019,0,1,40},{201020,0,1,1},{201021,0,1,2},{201022,0,1,2},{201023,0,1,2},{201025,0,1,2},{201026,0,1,2},{201027,0,1,2},{201029,0,1,2},{202010,0,1,40},{202011,0,1,40},{202012,0,1,40},{202013,0,1,40},{202015,0,1,40},{202016,0,1,40},{202017,0,1,40},{202019,0,1,40},{202020,0,1,1},{202021,0,1,2},{202022,0,1,2},{202023,0,1,2},{202025,0,1,2}, | S48: 202025 | T48: 天尊头盔 | U48: 1 | V48: 0 | W48: 1 | X48: 3 | Y48: ="{"&RC[-6]&","&RC[-3]&","&RC[-2]&","&RC[-1]&"}," -> {202025,0,1,3}, | Z48: =R[-1]C&RC[-1] -> {200010,0,1,30},{200011,0,1,30},{200012,0,1,30},{200013,0,1,30},{200015,0,1,30},{200016,0,1,30},{200017,0,1,30},{200019,0,1,30},{200020,0,1,1},{200021,0,1,3},{200022,0,1,3},{200023,0,1,3},{200025,0,1,3},{200026,0,1,3},{200027,0,1,3},{200029,0,1,3},{201010,0,1,30},{201011,0,1,30},{201012,0,1,30},{201013,0,1,30},{201015,0,1,30},{201016,0,1,30},{201017,0,1,30},{201019,0,1,30},{201020,0,1,1},{201021,0,1,3},{201022,0,1,3},{201023,0,1,3},{201025,0,1,3},{201026,0,1,3},{201027,0,1,3},{201029,0,1,3},{202010,0,1,30},{202011,0,1,30},{202012,0,1,30},{202013,0,1,30},{202015,0,1,30},{202016,0,1,30},{202017,0,1,30},{202019,0,1,30},{202020,0,1,1},{202021,0,1,3},{202022,0,1,3},{202023,0,1,3},{202025,0,1,3},
A49: 110010 | B49: 普通武装碎片 | D49: 0 | E49: 1 | F49: 2 | G49: ="{"&RC[-6]&","&RC[-3]&","&RC[-2]&","&RC[-1]&"}," -> {110010,0,1,2}, | H49: =R[-1]C&RC[-1] -> {110002,0,2,0},{110003,0,2,0},{110004,0,1,0},{110005,0,1,0},{110010,0,1,2}, | J49: 202026 | K49: 天尊手镯 | L49: 1 | M49: 0 | N49: 1 | O49: 2 | P49: ="{"&RC[-6]&","&RC[-3]&","&RC[-2]&","&RC[-1]&"}," -> {202026,0,1,2}, | Q49: =R[-1]C&RC[-1] -> {200010,0,1,40},{200011,0,1,40},{200012,0,1,40},{200013,0,1,40},{200015,0,1,40},{200016,0,1,40},{200017,0,1,40},{200019,0,1,40},{200020,0,1,1},{200021,0,1,2},{200022,0,1,2},{200023,0,1,2},{200025,0,1,2},{200026,0,1,2},{200027,0,1,2},{200029,0,1,2},{201010,0,1,40},{201011,0,1,40},{201012,0,1,40},{201013,0,1,40},{201015,0,1,40},{201016,0,1,40},{201017,0,1,40},{201019,0,1,40},{201020,0,1,1},{201021,0,1,2},{201022,0,1,2},{201023,0,1,2},{201025,0,1,2},{201026,0,1,2},{201027,0,1,2},{201029,0,1,2},{202010,0,1,40},{202011,0,1,40},{202012,0,1,40},{202013,0,1,40},{202015,0,1,40},{202016,0,1,40},{202017,0,1,40},{202019,0,1,40},{202020,0,1,1},{202021,0,1,2},{202022,0,1,2},{202023,0,1,2},{202025,0,1,2},{202026,0,1,2}, | S49: 202026 | T49: 天尊手镯 | U49: 1 | V49: 0 | W49: 1 | X49: 3 | Y49: ="{"&RC[-6]&","&RC[-3]&","&RC[-2]&","&RC[-1]&"}," -> {202026,0,1,3}, | Z49: =R[-1]C&RC[-1] -> {200010,0,1,30},{200011,0,1,30},{200012,0,1,30},{200013,0,1,30},{200015,0,1,30},{200016,0,1,30},{200017,0,1,30},{200019,0,1,30},{200020,0,1,1},{200021,0,1,3},{200022,0,1,3},{200023,0,1,3},{200025,0,1,3},{200026,0,1,3},{200027,0,1,3},{200029,0,1,3},{201010,0,1,30},{201011,0,1,30},{201012,0,1,30},{201013,0,1,30},{201015,0,1,30},{201016,0,1,30},{201017,0,1,30},{201019,0,1,30},{201020,0,1,1},{201021,0,1,3},{201022,0,1,3},{201023,0,1,3},{201025,0,1,3},{201026,0,1,3},{201027,0,1,3},{201029,0,1,3},{202010,0,1,30},{202011,0,1,30},{202012,0,1,30},{202013,0,1,30},{202015,0,1,30},{202016,0,1,30},{202017,0,1,30},{202019,0,1,30},{202020,0,1,1},{202021,0,1,3},{202022,0,1,3},{202023,0,1,3},{202025,0,1,3},{202026,0,1,3},
A50: 110011 | B50: 普通防具碎片 | D50: 0 | E50: 1 | F50: 3 | G50: ="{"&RC[-6]&","&RC[-3]&","&RC[-2]&","&RC[-1]&"}," -> {110011,0,1,3}, | H50: =R[-1]C&RC[-1] -> {110002,0,2,0},{110003,0,2,0},{110004,0,1,0},{110005,0,1,0},{110010,0,1,2},{110011,0,1,3}, | J50: 202027 | K50: 天尊腰带 | L50: 1 | M50: 0 | N50: 1 | O50: 2 | P50: ="{"&RC[-6]&","&RC[-3]&","&RC[-2]&","&RC[-1]&"}," -> {202027,0,1,2}, | Q50: =R[-1]C&RC[-1] -> {200010,0,1,40},{200011,0,1,40},{200012,0,1,40},{200013,0,1,40},{200015,0,1,40},{200016,0,1,40},{200017,0,1,40},{200019,0,1,40},{200020,0,1,1},{200021,0,1,2},{200022,0,1,2},{200023,0,1,2},{200025,0,1,2},{200026,0,1,2},{200027,0,1,2},{200029,0,1,2},{201010,0,1,40},{201011,0,1,40},{201012,0,1,40},{201013,0,1,40},{201015,0,1,40},{201016,0,1,40},{201017,0,1,40},{201019,0,1,40},{201020,0,1,1},{201021,0,1,2},{201022,0,1,2},{201023,0,1,2},{201025,0,1,2},{201026,0,1,2},{201027,0,1,2},{201029,0,1,2},{202010,0,1,40},{202011,0,1,40},{202012,0,1,40},{202013,0,1,40},{202015,0,1,40},{202016,0,1,40},{202017,0,1,40},{202019,0,1,40},{202020,0,1,1},{202021,0,1,2},{202022,0,1,2},{202023,0,1,2},{202025,0,1,2},{202026,0,1,2},{202027,0,1,2}, | S50: 202027 | T50: 天尊腰带 | U50: 1 | V50: 0 | W50: 1 | X50: 3 | Y50: ="{"&RC[-6]&","&RC[-3]&","&RC[-2]&","&RC[-1]&"}," -> {202027,0,1,3}, | Z50: =R[-1]C&RC[-1] -> {200010,0,1,30},{200011,0,1,30},{200012,0,1,30},{200013,0,1,30},{200015,0,1,30},{200016,0,1,30},{200017,0,1,30},{200019,0,1,30},{200020,0,1,1},{200021,0,1,3},{200022,0,1,3},{200023,0,1,3},{200025,0,1,3},{200026,0,1,3},{200027,0,1,3},{200029,0,1,3},{201010,0,1,30},{201011,0,1,30},{201012,0,1,30},{201013,0,1,30},{201015,0,1,30},{201016,0,1,30},{201017,0,1,30},{201019,0,1,30},{201020,0,1,1},{201021,0,1,3},{201022,0,1,3},{201023,0,1,3},{201025,0,1,3},{201026,0,1,3},{201027,0,1,3},{201029,0,1,3},{202010,0,1,30},{202011,0,1,30},{202012,0,1,30},{202013,0,1,30},{202015,0,1,30},{202016,0,1,30},{202017,0,1,30},{202019,0,1,30},{202020,0,1,1},{202021,0,1,3},{202022,0,1,3},{202023,0,1,3},{202025,0,1,3},{202026,0,1,3},{202027,0,1,3},
A51: 110012 | B51: 普通首饰碎片 | D51: 0 | E51: 1 | F51: 3 | G51: ="{"&RC[-6]&","&RC[-3]&","&RC[-2]&","&RC[-1]&"}," -> {110012,0,1,3}, | H51: =R[-1]C&RC[-1] -> {110002,0,2,0},{110003,0,2,0},{110004,0,1,0},{110005,0,1,0},{110010,0,1,2},{110011,0,1,3},{110012,0,1,3}, | J51: 202029 | K51: 天尊鞋子 | L51: 1 | M51: 0 | N51: 1 | O51: 2 | P51: ="{"&RC[-6]&","&RC[-3]&","&RC[-2]&","&RC[-1]&"}," -> {202029,0,1,2}, | Q51: =R[-1]C&RC[-1] -> {200010,0,1,40},{200011,0,1,40},{200012,0,1,40},{200013,0,1,40},{200015,0,1,40},{200016,0,1,40},{200017,0,1,40},{200019,0,1,40},{200020,0,1,1},{200021,0,1,2},{200022,0,1,2},{200023,0,1,2},{200025,0,1,2},{200026,0,1,2},{200027,0,1,2},{200029,0,1,2},{201010,0,1,40},{201011,0,1,40},{201012,0,1,40},{201013,0,1,40},{201015,0,1,40},{201016,0,1,40},{201017,0,1,40},{201019,0,1,40},{201020,0,1,1},{201021,0,1,2},{201022,0,1,2},{201023,0,1,2},{201025,0,1,2},{201026,0,1,2},{201027,0,1,2},{201029,0,1,2},{202010,0,1,40},{202011,0,1,40},{202012,0,1,40},{202013,0,1,40},{202015,0,1,40},{202016,0,1,40},{202017,0,1,40},{202019,0,1,40},{202020,0,1,1},{202021,0,1,2},{202022,0,1,2},{202023,0,1,2},{202025,0,1,2},{202026,0,1,2},{202027,0,1,2},{202029,0,1,2}, | S51: 202029 | T51: 天尊鞋子 | U51: 1 | V51: 0 | W51: 1 | X51: 3 | Y51: ="{"&RC[-6]&","&RC[-3]&","&RC[-2]&","&RC[-1]&"}," -> {202029,0,1,3}, | Z51: =R[-1]C&RC[-1] -> {200010,0,1,30},{200011,0,1,30},{200012,0,1,30},{200013,0,1,30},{200015,0,1,30},{200016,0,1,30},{200017,0,1,30},{200019,0,1,30},{200020,0,1,1},{200021,0,1,3},{200022,0,1,3},{200023,0,1,3},{200025,0,1,3},{200026,0,1,3},{200027,0,1,3},{200029,0,1,3},{201010,0,1,30},{201011,0,1,30},{201012,0,1,30},{201013,0,1,30},{201015,0,1,30},{201016,0,1,30},{201017,0,1,30},{201019,0,1,30},{201020,0,1,1},{201021,0,1,3},{201022,0,1,3},{201023,0,1,3},{201025,0,1,3},{201026,0,1,3},{201027,0,1,3},{201029,0,1,3},{202010,0,1,30},{202011,0,1,30},{202012,0,1,30},{202013,0,1,30},{202015,0,1,30},{202016,0,1,30},{202017,0,1,30},{202019,0,1,30},{202020,0,1,1},{202021,0,1,3},{202022,0,1,3},{202023,0,1,3},{202025,0,1,3},{202026,0,1,3},{202027,0,1,3},{202029,0,1,3},
A52: 110013 | B52: 精炼武装碎片 | D52: 0 | E52: 1 | F52: 0 | G52: ="{"&RC[-6]&","&RC[-3]&","&RC[-2]&","&RC[-1]&"}," -> {110013,0,1,0}, | H52: =R[-1]C&RC[-1] -> {110002,0,2,0},{110003,0,2,0},{110004,0,1,0},{110005,0,1,0},{110010,0,1,2},{110011,0,1,3},{110012,0,1,3},{110013,0,1,0}, | J52: 305003 | K52: 怒斩 | L52: 1 | M52: 0 | N52: 1 | O52: 2 | P52: ="{"&RC[-6]&","&RC[-3]&","&RC[-2]&","&RC[-1]&"}," -> {305003,0,1,2}, | Q52: =R[-1]C&RC[-1] -> {200010,0,1,40},{200011,0,1,40},{200012,0,1,40},{200013,0,1,40},{200015,0,1,40},{200016,0,1,40},{200017,0,1,40},{200019,0,1,40},{200020,0,1,1},{200021,0,1,2},{200022,0,1,2},{200023,0,1,2},{200025,0,1,2},{200026,0,1,2},{200027,0,1,2},{200029,0,1,2},{201010,0,1,40},{201011,0,1,40},{201012,0,1,40},{201013,0,1,40},{201015,0,1,40},{201016,0,1,40},{201017,0,1,40},{201019,0,1,40},{201020,0,1,1},{201021,0,1,2},{201022,0,1,2},{201023,0,1,2},{201025,0,1,2},{201026,0,1,2},{201027,0,1,2},{201029,0,1,2},{202010,0,1,40},{202011,0,1,40},{202012,0,1,40},{202013,0,1,40},{202015,0,1,40},{202016,0,1,40},{202017,0,1,40},{202019,0,1,40},{202020,0,1,1},{202021,0,1,2},{202022,0,1,2},{202023,0,1,2},{202025,0,1,2},{202026,0,1,2},{202027,0,1,2},{202029,0,1,2},{305003,0,1,2}, | S52: 305003 | T52: 怒斩 | U52: 1 | V52: 0 | W52: 1 | X52: 2 | Y52: ="{"&RC[-6]&","&RC[-3]&","&RC[-2]&","&RC[-1]&"}," -> {305003,0,1,2}, | Z52: =R[-1]C&RC[-1] -> {200010,0,1,30},{200011,0,1,30},{200012,0,1,30},{200013,0,1,30},{200015,0,1,30},{200016,0,1,30},{200017,0,1,30},{200019,0,1,30},{200020,0,1,1},{200021,0,1,3},{200022,0,1,3},{200023,0,1,3},{200025,0,1,3},{200026,0,1,3},{200027,0,1,3},{200029,0,1,3},{201010,0,1,30},{201011,0,1,30},{201012,0,1,30},{201013,0,1,30},{201015,0,1,30},{201016,0,1,30},{201017,0,1,30},{201019,0,1,30},{201020,0,1,1},{201021,0,1,3},{201022,0,1,3},{201023,0,1,3},{201025,0,1,3},{201026,0,1,3},{201027,0,1,3},{201029,0,1,3},{202010,0,1,30},{202011,0,1,30},{202012,0,1,30},{202013,0,1,30},{202015,0,1,30},{202016,0,1,30},{202017,0,1,30},{202019,0,1,30},{202020,0,1,1},{202021,0,1,3},{202022,0,1,3},{202023,0,1,3},{202025,0,1,3},{202026,0,1,3},{202027,0,1,3},{202029,0,1,3},{305003,0,1,2},
A53: 110014 | B53: 精炼防具碎片 | D53: 0 | E53: 1 | F53: 0 | G53: ="{"&RC[-6]&","&RC[-3]&","&RC[-2]&","&RC[-1]&"}," -> {110014,0,1,0}, | H53: =R[-1]C&RC[-1] -> {110002,0,2,0},{110003,0,2,0},{110004,0,1,0},{110005,0,1,0},{110010,0,1,2},{110011,0,1,3},{110012,0,1,3},{110013,0,1,0},{110014,0,1,0}, | J53: 305004 | K53: 龙牙 | L53: 1 | M53: 0 | N53: 1 | O53: 2 | P53: ="{"&RC[-6]&","&RC[-3]&","&RC[-2]&","&RC[-1]&"}," -> {305004,0,1,2}, | Q53: =R[-1]C&RC[-1] -> {200010,0,1,40},{200011,0,1,40},{200012,0,1,40},{200013,0,1,40},{200015,0,1,40},{200016,0,1,40},{200017,0,1,40},{200019,0,1,40},{200020,0,1,1},{200021,0,1,2},{200022,0,1,2},{200023,0,1,2},{200025,0,1,2},{200026,0,1,2},{200027,0,1,2},{200029,0,1,2},{201010,0,1,40},{201011,0,1,40},{201012,0,1,40},{201013,0,1,40},{201015,0,1,40},{201016,0,1,40},{201017,0,1,40},{201019,0,1,40},{201020,0,1,1},{201021,0,1,2},{201022,0,1,2},{201023,0,1,2},{201025,0,1,2},{201026,0,1,2},{201027,0,1,2},{201029,0,1,2},{202010,0,1,40},{202011,0,1,40},{202012,0,1,40},{202013,0,1,40},{202015,0,1,40},{202016,0,1,40},{202017,0,1,40},{202019,0,1,40},{202020,0,1,1},{202021,0,1,2},{202022,0,1,2},{202023,0,1,2},{202025,0,1,2},{202026,0,1,2},{202027,0,1,2},{202029,0,1,2},{305003,0,1,2},{305004,0,1,2}, | S53: 305004 | T53: 龙牙 | U53: 1 | V53: 0 | W53: 1 | X53: 2 | Y53: ="{"&RC[-6]&","&RC[-3]&","&RC[-2]&","&RC[-1]&"}," -> {305004,0,1,2}, | Z53: =R[-1]C&RC[-1] -> {200010,0,1,30},{200011,0,1,30},{200012,0,1,30},{200013,0,1,30},{200015,0,1,30},{200016,0,1,30},{200017,0,1,30},{200019,0,1,30},{200020,0,1,1},{200021,0,1,3},{200022,0,1,3},{200023,0,1,3},{200025,0,1,3},{200026,0,1,3},{200027,0,1,3},{200029,0,1,3},{201010,0,1,30},{201011,0,1,30},{201012,0,1,30},{201013,0,1,30},{201015,0,1,30},{201016,0,1,30},{201017,0,1,30},{201019,0,1,30},{201020,0,1,1},{201021,0,1,3},{201022,0,1,3},{201023,0,1,3},{201025,0,1,3},{201026,0,1,3},{201027,0,1,3},{201029,0,1,3},{202010,0,1,30},{202011,0,1,30},{202012,0,1,30},{202013,0,1,30},{202015,0,1,30},{202016,0,1,30},{202017,0,1,30},{202019,0,1,30},{202020,0,1,1},{202021,0,1,3},{202022,0,1,3},{202023,0,1,3},{202025,0,1,3},{202026,0,1,3},{202027,0,1,3},{202029,0,1,3},{305003,0,1,2},{305004,0,1,2},
A54: 110015 | B54: 精炼首饰碎片 | D54: 0 | E54: 1 | F54: 0 | G54: ="{"&RC[-6]&","&RC[-3]&","&RC[-2]&","&RC[-1]&"}" -> {110015,0,1,0} | H54: =R[-1]C&RC[-1] -> {110002,0,2,0},{110003,0,2,0},{110004,0,1,0},{110005,0,1,0},{110010,0,1,2},{110011,0,1,3},{110012,0,1,3},{110013,0,1,0},{110014,0,1,0},{110015,0,1,0} | J54: 305005 | K54: 逍遥扇 | L54: 1 | M54: 0 | N54: 1 | O54: 2 | P54: ="{"&RC[-6]&","&RC[-3]&","&RC[-2]&","&RC[-1]&"}" -> {305005,0,1,2} | Q54: =R[-1]C&RC[-1] -> {200010,0,1,40},{200011,0,1,40},{200012,0,1,40},{200013,0,1,40},{200015,0,1,40},{200016,0,1,40},{200017,0,1,40},{200019,0,1,40},{200020,0,1,1},{200021,0,1,2},{200022,0,1,2},{200023,0,1,2},{200025,0,1,2},{200026,0,1,2},{200027,0,1,2},{200029,0,1,2},{201010,0,1,40},{201011,0,1,40},{201012,0,1,40},{201013,0,1,40},{201015,0,1,40},{201016,0,1,40},{201017,0,1,40},{201019,0,1,40},{201020,0,1,1},{201021,0,1,2},{201022,0,1,2},{201023,0,1,2},{201025,0,1,2},{201026,0,1,2},{201027,0,1,2},{201029,0,1,2},{202010,0,1,40},{202011,0,1,40},{202012,0,1,40},{202013,0,1,40},{202015,0,1,40},{202016,0,1,40},{202017,0,1,40},{202019,0,1,40},{202020,0,1,1},{202021,0,1,2},{202022,0,1,2},{202023,0,1,2},{202025,0,1,2},{202026,0,1,2},{202027,0,1,2},{202029,0,1,2},{305003,0,1,2},{305004,0,1,2},{305005,0,1,2} | S54: 305005 | T54: 逍遥扇 | U54: 1 | V54: 0 | W54: 1 | X54: 2 | Y54: ="{"&RC[-6]&","&RC[-3]&","&RC[-2]&","&RC[-1]&"}" -> {305005,0,1,2} | Z54: =R[-1]C&RC[-1] -> {200010,0,1,30},{200011,0,1,30},{200012,0,1,30},{200013,0,1,30},{200015,0,1,30},{200016,0,1,30},{200017,0,1,30},{200019,0,1,30},{200020,0,1,1},{200021,0,1,3},{200022,0,1,3},{200023,0,1,3},{200025,0,1,3},{200026,0,1,3},{200027,0,1,3},{200029,0,1,3},{201010,0,1,30},{201011,0,1,30},{201012,0,1,30},{201013,0,1,30},{201015,0,1,30},{201016,0,1,30},{201017,0,1,30},{201019,0,1,30},{201020,0,1,1},{201021,0,1,3},{201022,0,1,3},{201023,0,1,3},{201025,0,1,3},{201026,0,1,3},{201027,0,1,3},{201029,0,1,3},{202010,0,1,30},{202011,0,1,30},{202012,0,1,30},{202013,0,1,30},{202015,0,1,30},{202016,0,1,30},{202017,0,1,30},{202019,0,1,30},{202020,0,1,1},{202021,0,1,3},{202022,0,1,3},{202023,0,1,3},{202025,0,1,3},{202026,0,1,3},{202027,0,1,3},{202029,0,1,3},{305003,0,1,2},{305004,0,1,2},{305005,0,1,2}
A57: BOSS怪掉落 | F57: 装备 | G57: 概率／100 | J57: 110002 | K57: 强化石 | M57: 1 | N57: 2 | O57: 0 | P57: ="{"&RC[-6]&","&RC[-3]&","&RC[-2]&","&RC[-1]&"}," -> {110002,1,2,0}, | Q57: =RC[-1] -> {110002,1,2,0}, | S57: 110002 | T57: 强化石 | V57: 1 | W57: 2 | X57: 0 | Y57: ="{"&RC[-6]&","&RC[-3]&","&RC[-2]&","&RC[-1]&"}," -> {110002,1,2,0}, | Z57: =RC[-1] -> {110002,1,2,0},
F58: 3 | G58: 100 | H58: ="{0,[{"&RC[-2]&","&RC[-1]&"}],["&R[-16]C&"]}" -> {0,[{3,100}],[{200000,0,1,30},{200001,0,1,30},{200002,0,1,30},{200003,0,1,30},{200006,0,1,30},{200010,0,1,5},{200011,0,1,10},{200012,0,1,10},{200013,0,1,10},{200015,0,1,10},{200016,0,1,10},{200017,0,1,10},{200019,0,1,10},{201000,0,1,30},{201001,0,1,30},{201002,0,1,30},{201003,0,1,30},{201006,0,1,30},{201010,0,1,5},{201011,0,1,10},{201012,0,1,10},{201013,0,1,10},{201015,0,1,10},{201016,0,1,10},{201017,0,1,10},{201019,0,1,10},{202000,0,1,30},{202001,0,1,30},{202002,0,1,30},{202003,0,1,30},{202006,0,1,30},{202010,0,1,5},{202011,0,1,10},{202012,0,1,10},{202013,0,1,10},{202015,0,1,10},{202016,0,1,10},{202017,0,1,10},{202019,0,1,10}]} | J58: 110003 | K58: 洗炼石 | M58: 1 | N58: 2 | O58: 0 | P58: ="{"&RC[-6]&","&RC[-3]&","&RC[-2]&","&RC[-1]&"}," -> {110003,1,2,0}, | Q58: =R[-1]C&RC[-1] -> {110002,1,2,0},{110003,1,2,0}, | S58: 110003 | T58: 洗炼石 | V58: 1 | W58: 2 | X58: 0 | Y58: ="{"&RC[-6]&","&RC[-3]&","&RC[-2]&","&RC[-1]&"}," -> {110003,1,2,0}, | Z58: =R[-1]C&RC[-1] -> {110002,1,2,0},{110003,1,2,0},
F59: 道具 | G59: 概率／100 | J59: 110004 | K59: 红药 | M59: 1 | N59: 1 | O59: 0 | P59: ="{"&RC[-6]&","&RC[-3]&","&RC[-2]&","&RC[-1]&"}," -> {110004,1,1,0}, | Q59: =R[-1]C&RC[-1] -> {110002,1,2,0},{110003,1,2,0},{110004,1,1,0}, | S59: 110004 | T59: 红药 | V59: 1 | W59: 1 | X59: 0 | Y59: ="{"&RC[-6]&","&RC[-3]&","&RC[-2]&","&RC[-1]&"}," -> {110004,1,1,0}, | Z59: =R[-1]C&RC[-1] -> {110002,1,2,0},{110003,1,2,0},{110004,1,1,0},
F60: 2 | G60: 100 | H60: ="{0,[{"&RC[-2]&","&RC[-1]&"}],["&R[-6]C&"]}" -> {0,[{2,100}],[{110002,0,2,0},{110003,0,2,0},{110004,0,1,0},{110005,0,1,0},{110010,0,1,2},{110011,0,1,3},{110012,0,1,3},{110013,0,1,0},{110014,0,1,0},{110015,0,1,0}]} | J60: 110005 | K60: 蓝药 | M60: 1 | N60: 1 | O60: 0 | P60: ="{"&RC[-6]&","&RC[-3]&","&RC[-2]&","&RC[-1]&"}," -> {110005,1,1,0}, | Q60: =R[-1]C&RC[-1] -> {110002,1,2,0},{110003,1,2,0},{110004,1,1,0},{110005,1,1,0}, | S60: 110005 | T60: 蓝药 | V60: 1 | W60: 1 | X60: 0 | Y60: ="{"&RC[-6]&","&RC[-3]&","&RC[-2]&","&RC[-1]&"}," -> {110005,1,1,0}, | Z60: =R[-1]C&RC[-1] -> {110002,1,2,0},{110003,1,2,0},{110004,1,1,0},{110005,1,1,0},
F61: 金币 | G61: 概率／100 | J61: 110010 | K61: 普通武装碎片 | M61: 1 | N61: 1 | O61: 2 | P61: ="{"&RC[-6]&","&RC[-3]&","&RC[-2]&","&RC[-1]&"}," -> {110010,1,1,2}, | Q61: =R[-1]C&RC[-1] -> {110002,1,2,0},{110003,1,2,0},{110004,1,1,0},{110005,1,1,0},{110010,1,1,2}, | S61: 110010 | T61: 普通武装碎片 | V61: 1 | W61: 1 | X61: 2 | Y61: ="{"&RC[-6]&","&RC[-3]&","&RC[-2]&","&RC[-1]&"}," -> {110010,1,1,2}, | Z61: =R[-1]C&RC[-1] -> {110002,1,2,0},{110003,1,2,0},{110004,1,1,0},{110005,1,1,0},{110010,1,1,2},
F62: 3 | G62: 100 | H62: {0,[{10,100}],[{110009,1,1000,1}]} | J62: 110011 | K62: 普通防具碎片 | M62: 1 | N62: 1 | O62: 3 | P62: ="{"&RC[-6]&","&RC[-3]&","&RC[-2]&","&RC[-1]&"}," -> {110011,1,1,3}, | Q62: =R[-1]C&RC[-1] -> {110002,1,2,0},{110003,1,2,0},{110004,1,1,0},{110005,1,1,0},{110010,1,1,2},{110011,1,1,3}, | S62: 110011 | T62: 普通防具碎片 | V62: 1 | W62: 1 | X62: 3 | Y62: ="{"&RC[-6]&","&RC[-3]&","&RC[-2]&","&RC[-1]&"}," -> {110011,1,1,3}, | Z62: =R[-1]C&RC[-1] -> {110002,1,2,0},{110003,1,2,0},{110004,1,1,0},{110005,1,1,0},{110010,1,1,2},{110011,1,1,3},
J63: 110012 | K63: 普通首饰碎片 | M63: 1 | N63: 1 | O63: 3 | P63: ="{"&RC[-6]&","&RC[-3]&","&RC[-2]&","&RC[-1]&"}," -> {110012,1,1,3}, | Q63: =R[-1]C&RC[-1] -> {110002,1,2,0},{110003,1,2,0},{110004,1,1,0},{110005,1,1,0},{110010,1,1,2},{110011,1,1,3},{110012,1,1,3}, | S63: 110012 | T63: 普通首饰碎片 | V63: 1 | W63: 1 | X63: 3 | Y63: ="{"&RC[-6]&","&RC[-3]&","&RC[-2]&","&RC[-1]&"}," -> {110012,1,1,3}, | Z63: =R[-1]C&RC[-1] -> {110002,1,2,0},{110003,1,2,0},{110004,1,1,0},{110005,1,1,0},{110010,1,1,2},{110011,1,1,3},{110012,1,1,3},
H64: ="["&R[-6]C&","&R[-4]C&","&R[-2]C&"]" -> [{0,[{3,100}],[{200000,0,1,30},{200001,0,1,30},{200002,0,1,30},{200003,0,1,30},{200006,0,1,30},{200010,0,1,5},{200011,0,1,10},{200012,0,1,10},{200013,0,1,10},{200015,0,1,10},{200016,0,1,10},{200017,0,1,10},{200019,0,1,10},{201000,0,1,30},{201001,0,1,30},{201002,0,1,30},{201003,0,1,30},{201006,0,1,30},{201010,0,1,5},{201011,0,1,10},{201012,0,1,10},{201013,0,1,10},{201015,0,1,10},{201016,0,1,10},{201017,0,1,10},{201019,0,1,10},{202000,0,1,30},{202001,0,1,30},{202002,0,1,30},{202003,0,1,30},{202006,0,1,30},{202010,0,1,5},{202011,0,1,10},{202012,0,1,10},{202013,0,1,10},{202015,0,1,10},{202016,0,1,10},{202017,0,1,10},{202019,0,1,10}]},{0,[{2,100}],[{110002,0,2,0},{110003,0,2,0},{110004,0,1,0},{110005,0,1,0},{110010,0,1,2},{110011,0,1,3},{110012,0,1,3},{110013,0,1,0},{110014,0,1,0},{110015,0,1,0}]},{0,[{10,100}],[{110009,1,1000,1}]}] | J64: 110013 | K64: 精炼武装碎片 | M64: 0 | N64: 1 | O64: 1 | P64: ="{"&RC[-6]&","&RC[-3]&","&RC[-2]&","&RC[-1]&"}," -> {110013,0,1,1}, | Q64: =R[-1]C&RC[-1] -> {110002,1,2,0},{110003,1,2,0},{110004,1,1,0},{110005,1,1,0},{110010,1,1,2},{110011,1,1,3},{110012,1,1,3},{110013,0,1,1}, | S64: 110013 | T64: 精炼武装碎片 | V64: 0 | W64: 1 | X64: 2 | Y64: ="{"&RC[-6]&","&RC[-3]&","&RC[-2]&","&RC[-1]&"}," -> {110013,0,1,2}, | Z64: =R[-1]C&RC[-1] -> {110002,1,2,0},{110003,1,2,0},{110004,1,1,0},{110005,1,1,0},{110010,1,1,2},{110011,1,1,3},{110012,1,1,3},{110013,0,1,2},
J65: 110014 | K65: 精炼防具碎片 | M65: 0 | N65: 1 | O65: 2 | P65: ="{"&RC[-6]&","&RC[-3]&","&RC[-2]&","&RC[-1]&"}," -> {110014,0,1,2}, | Q65: =R[-1]C&RC[-1] -> {110002,1,2,0},{110003,1,2,0},{110004,1,1,0},{110005,1,1,0},{110010,1,1,2},{110011,1,1,3},{110012,1,1,3},{110013,0,1,1},{110014,0,1,2}, | S65: 110014 | T65: 精炼防具碎片 | V65: 0 | W65: 1 | X65: 3 | Y65: ="{"&RC[-6]&","&RC[-3]&","&RC[-2]&","&RC[-1]&"}," -> {110014,0,1,3}, | Z65: =R[-1]C&RC[-1] -> {110002,1,2,0},{110003,1,2,0},{110004,1,1,0},{110005,1,1,0},{110010,1,1,2},{110011,1,1,3},{110012,1,1,3},{110013,0,1,2},{110014,0,1,3},
J66: 110015 | K66: 精炼首饰碎片 | M66: 0 | N66: 1 | O66: 2 | P66: ="{"&RC[-6]&","&RC[-3]&","&RC[-2]&","&RC[-1]&"}" -> {110015,0,1,2} | Q66: =R[-1]C&RC[-1] -> {110002,1,2,0},{110003,1,2,0},{110004,1,1,0},{110005,1,1,0},{110010,1,1,2},{110011,1,1,3},{110012,1,1,3},{110013,0,1,1},{110014,0,1,2},{110015,0,1,2} | S66: 110015 | T66: 精炼首饰碎片 | V66: 0 | W66: 1 | X66: 3 | Y66: ="{"&RC[-6]&","&RC[-3]&","&RC[-2]&","&RC[-1]&"}" -> {110015,0,1,3} | Z66: =R[-1]C&RC[-1] -> {110002,1,2,0},{110003,1,2,0},{110004,1,1,0},{110005,1,1,0},{110010,1,1,2},{110011,1,1,3},{110012,1,1,3},{110013,0,1,2},{110014,0,1,3},{110015,0,1,3}
J70: BOSS怪掉落 | O70: 装备 | P70: 概率／100 | S70: BOSS怪掉落 | X70: 装备 | Y70: 概率／100
O71: 3 | P71: 100 | Q71: ="{0,[{"&RC[-2]&","&RC[-1]&"}],["&R[-17]C&"]}" -> {0,[{3,100}],[{200010,0,1,40},{200011,0,1,40},{200012,0,1,40},{200013,0,1,40},{200015,0,1,40},{200016,0,1,40},{200017,0,1,40},{200019,0,1,40},{200020,0,1,1},{200021,0,1,2},{200022,0,1,2},{200023,0,1,2},{200025,0,1,2},{200026,0,1,2},{200027,0,1,2},{200029,0,1,2},{201010,0,1,40},{201011,0,1,40},{201012,0,1,40},{201013,0,1,40},{201015,0,1,40},{201016,0,1,40},{201017,0,1,40},{201019,0,1,40},{201020,0,1,1},{201021,0,1,2},{201022,0,1,2},{201023,0,1,2},{201025,0,1,2},{201026,0,1,2},{201027,0,1,2},{201029,0,1,2},{202010,0,1,40},{202011,0,1,40},{202012,0,1,40},{202013,0,1,40},{202015,0,1,40},{202016,0,1,40},{202017,0,1,40},{202019,0,1,40},{202020,0,1,1},{202021,0,1,2},{202022,0,1,2},{202023,0,1,2},{202025,0,1,2},{202026,0,1,2},{202027,0,1,2},{202029,0,1,2},{305003,0,1,2},{305004,0,1,2},{305005,0,1,2}]} | X71: 3 | Y71: 100 | Z71: ="{0,[{"&RC[-2]&","&RC[-1]&"}],["&R[-17]C&"]}" -> {0,[{3,100}],[{200010,0,1,30},{200011,0,1,30},{200012,0,1,30},{200013,0,1,30},{200015,0,1,30},{200016,0,1,30},{200017,0,1,30},{200019,0,1,30},{200020,0,1,1},{200021,0,1,3},{200022,0,1,3},{200023,0,1,3},{200025,0,1,3},{200026,0,1,3},{200027,0,1,3},{200029,0,1,3},{201010,0,1,30},{201011,0,1,30},{201012,0,1,30},{201013,0,1,30},{201015,0,1,30},{201016,0,1,30},{201017,0,1,30},{201019,0,1,30},{201020,0,1,1},{201021,0,1,3},{201022,0,1,3},{201023,0,1,3},{201025,0,1,3},{201026,0,1,3},{201027,0,1,3},{201029,0,1,3},{202010,0,1,30},{202011,0,1,30},{202012,0,1,30},{202013,0,1,30},{202015,0,1,30},{202016,0,1,30},{202017,0,1,30},{202019,0,1,30},{202020,0,1,1},{202021,0,1,3},{202022,0,1,3},{202023,0,1,3},{202025,0,1,3},{202026,0,1,3},{202027,0,1,3},{202029,0,1,3},{305003,0,1,2},{305004,0,1,2},{305005,0,1,2}]}
O72: 道具 | P72: 概率／100 | X72: 道具 | Y72: 概率／100
O73: 2 | P73: 100 | Q73: ="{0,[{"&RC[-2]&","&RC[-1]&"}],["&R[-7]C&"]}" -> {0,[{2,100}],[{110002,1,2,0},{110003,1,2,0},{110004,1,1,0},{110005,1,1,0},{110010,1,1,2},{110011,1,1,3},{110012,1,1,3},{110013,0,1,1},{110014,0,1,2},{110015,0,1,2}]} | X73: 2 | Y73: 100 | Z73: ="{0,[{"&RC[-2]&","&RC[-1]&"}],["&R[-7]C&"]}" -> {0,[{2,100}],[{110002,1,2,0},{110003,1,2,0},{110004,1,1,0},{110005,1,1,0},{110010,1,1,2},{110011,1,1,3},{110012,1,1,3},{110013,0,1,2},{110014,0,1,3},{110015,0,1,3}]}
O74: 金币 | P74: 概率／100 | X74: 金币 | Y74: 概率／100
O75: 3 | P75: 100 | Q75: {0,[{10,100}],[{110009,1,1000,1}]} | X75: 3 | Y75: 100 | Z75: {0,[{10,100}],[{110009,1,1000,1}]}
Q77: ="["&R[-6]C&","&R[-4]C&","&R[-2]C&"]" -> [{0,[{3,100}],[{200010,0,1,40},{200011,0,1,40},{200012,0,1,40},{200013,0,1,40},{200015,0,1,40},{200016,0,1,40},{200017,0,1,40},{200019,0,1,40},{200020,0,1,1},{200021,0,1,2},{200022,0,1,2},{200023,0,1,2},{200025,0,1,2},{200026,0,1,2},{200027,0,1,2},{200029,0,1,2},{201010,0,1,40},{201011,0,1,40},{201012,0,1,40},{201013,0,1,40},{201015,0,1,40},{201016,0,1,40},{201017,0,1,40},{201019,0,1,40},{201020,0,1,1},{201021,0,1,2},{201022,0,1,2},{201023,0,1,2},{201025,0,1,2},{201026,0,1,2},{201027,0,1,2},{201029,0,1,2},{202010,0,1,40},{202011,0,1,40},{202012,0,1,40},{202013,0,1,40},{202015,0,1,40},{202016,0,1,40},{202017,0,1,40},{202019,0,1,40},{202020,0,1,1},{202021,0,1,2},{202022,0,1,2},{202023,0,1,2},{202025,0,1,2},{202026,0,1,2},{202027,0,1,2},{202029,0,1,2},{305003,0,1,2},{305004,0,1,2},{305005,0,1,2}]},{0,[{2,100}],[{110002,1,2,0},{110003,1,2,0},{110004,1,1,0},{110005,1,1,0},{110010,1,1,2},{110011,1,1,3},{110012,1,1,3},{110013,0,1,1},{110014,0,1,2},{110015,0,1,2}]},{0,[{10,100}],[{110009,1,1000,1}]}] | Z77: ="["&R[-6]C&","&R[-4]C&","&R[-2]C&"]" -> [{0,[{3,100}],[{200010,0,1,30},{200011,0,1,30},{200012,0,1,30},{200013,0,1,30},{200015,0,1,30},{200016,0,1,30},{200017,0,1,30},{200019,0,1,30},{200020,0,1,1},{200021,0,1,3},{200022,0,1,3},{200023,0,1,3},{200025,0,1,3},{200026,0,1,3},{200027,0,1,3},{200029,0,1,3},{201010,0,1,30},{201011,0,1,30},{201012,0,1,30},{201013,0,1,30},{201015,0,1,30},{201016,0,1,30},{201017,0,1,30},{201019,0,1,30},{201020,0,1,1},{201021,0,1,3},{201022,0,1,3},{201023,0,1,3},{201025,0,1,3},{201026,0,1,3},{201027,0,1,3},{201029,0,1,3},{202010,0,1,30},{202011,0,1,30},{202012,0,1,30},{202013,0,1,30},{202015,0,1,30},{202016,0,1,30},{202017,0,1,30},{202019,0,1,30},{202020,0,1,1},{202021,0,1,3},{202022,0,1,3},{202023,0,1,3},{202025,0,1,3},{202026,0,1,3},{202027,0,1,3},{202029,0,1,3},{305003,0,1,2},{305004,0,1,2},{305005,0,1,2}]},{0,[{2,100}],[{110002,1,2,0},{110003,1,2,0},{110004,1,1,0},{110005,1,1,0},{110010,1,1,2},{110011,1,1,3},{110012,1,1,3},{110013,0,1,2},{110014,0,1,3},{110015,0,1,3}]},{0,[{10,100}],[{110009,1,1000,1}]}]

Sheet: 沙巴克秘境
A2: 沙巴克秘境（15-40级装备掉落）
A3: ID | B3: 名称 | C3: 品质 | D3: 是否绑定 | E3: 数量
A4: 200010 | B4: 炼狱 | C4: 1 | D4: 0 | E4: 1 | F4: 10 | G4: ="{"&RC[-6]&","&RC[-3]&","&RC[-2]&","&RC[-1]&"}," -> {200010,0,1,10}, | H4: =RC[-1] -> {200010,0,1,10},
A5: 200011 | B5: 绿色项链 | C5: 1 | D5: 0 | E5: 1 | F5: 30 | G5: ="{"&RC[-6]&","&RC[-3]&","&RC[-2]&","&RC[-1]&"}," -> {200011,0,1,30}, | H5: =R[-1]C&RC[-1] -> {200010,0,1,10},{200011,0,1,30},
A6: 200012 | B6: 战神盔甲 | C6: 1 | D6: 0 | E6: 1 | F6: 30 | G6: ="{"&RC[-6]&","&RC[-3]&","&RC[-2]&","&RC[-1]&"}," -> {200012,0,1,30}, | H6: =R[-1]C&RC[-1] -> {200010,0,1,10},{200011,0,1,30},{200012,0,1,30},
A7: 200013 | B7: 力量戒指 | C7: 1 | D7: 0 | E7: 1 | F7: 30 | G7: ="{"&RC[-6]&","&RC[-3]&","&RC[-2]&","&RC[-1]&"}," -> {200013,0,1,30}, | H7: =R[-1]C&RC[-1] -> {200010,0,1,10},{200011,0,1,30},{200012,0,1,30},{200013,0,1,30},
A8: 200015 | B8: 战士头盔 | C8: 1 | D8: 0 | E8: 1 | F8: 30 | G8: ="{"&RC[-6]&","&RC[-3]&","&RC[-2]&","&RC[-1]&"}," -> {200015,0,1,30}, | H8: =R[-1]C&RC[-1] -> {200010,0,1,10},{200011,0,1,30},{200012,0,1,30},{200013,0,1,30},{200015,0,1,30},
A9: 200016 | B9: 阎罗手镯 | C9: 1 | D9: 0 | E9: 1 | F9: 30 | G9: ="{"&RC[-6]&","&RC[-3]&","&RC[-2]&","&RC[-1]&"}," -> {200016,0,1,30}, | H9: =R[-1]C&RC[-1] -> {200010,0,1,10},{200011,0,1,30},{200012,0,1,30},{200013,0,1,30},{200015,0,1,30},{200016,0,1,30},
A10: 200017 | B10: 战士腰带 | C10: 1 | D10: 0 | E10: 1 | F10: 30 | G10: ="{"&RC[-6]&","&RC[-3]&","&RC[-2]&","&RC[-1]&"}," -> {200017,0,1,30}, | H10: =R[-1]C&RC[-1] -> {200010,0,1,10},{200011,0,1,30},{200012,0,1,30},{200013,0,1,30},{200015,0,1,30},{200016,0,1,30},{200017,0,1,30},
A11: 200019 | B11: 战士鞋子 | C11: 1 | D11: 0 | E11: 1 | F11: 30 | G11: ="{"&RC[-6]&","&RC[-3]&","&RC[-2]&","&RC[-1]&"}," -> {200019,0,1,30}, | H11: =R[-1]C&RC[-1] -> {200010,0,1,10},{200011,0,1,30},{200012,0,1,30},{200013,0,1,30},{200015,0,1,30},{200016,0,1,30},{200017,0,1,30},{200019,0,1,30},
A12: 200020 | B12: 裁决 | C12: 1 | D12: 0 | E12: 1 | F12: 2 | G12: ="{"&RC[-6]&","&RC[-3]&","&RC[-2]&","&RC[-1]&"}," -> {200020,0,1,2}, | H12: =R[-1]C&RC[-1] -> {200010,0,1,10},{200011,0,1,30},{200012,0,1,30},{200013,0,1,30},{200015,0,1,30},{200016,0,1,30},{200017,0,1,30},{200019,0,1,30},{200020,0,1,2},
A13: 200021 | B13: 圣战战甲 | C13: 1 | D13: 0 | E13: 1 | F13: 10 | G13: ="{"&RC[-6]&","&RC[-3]&","&RC[-2]&","&RC[-1]&"}," -> {200021,0,1,10}, | H13: =R[-1]C&RC[-1] -> {200010,0,1,10},{200011,0,1,30},{200012,0,1,30},{200013,0,1,30},{200015,0,1,30},{200016,0,1,30},{200017,0,1,30},{200019,0,1,30},{200020,0,1,2},{200021,0,1,10},
A14: 200022 | B14: 圣战项链 | C14: 1 | D14: 0 | E14: 1 | F14: 10 | G14: ="{"&RC[-6]&","&RC[-3]&","&RC[-2]&","&RC[-1]&"}," -> {200022,0,1,10}, | H14: =R[-1]C&RC[-1] -> {200010,0,1,10},{200011,0,1,30},{200012,0,1,30},{200013,0,1,30},{200015,0,1,30},{200016,0,1,30},{200017,0,1,30},{200019,0,1,30},{200020,0,1,2},{200021,0,1,10},{200022,0,1,10},
A15: 200023 | B15: 圣战戒指 | C15: 1 | D15: 0 | E15: 1 | F15: 10 | G15: ="{"&RC[-6]&","&RC[-3]&","&RC[-2]&","&RC[-1]&"}," -> {200023,0,1,10}, | H15: =R[-1]C&RC[-1] -> {200010,0,1,10},{200011,0,1,30},{200012,0,1,30},{200013,0,1,30},{200015,0,1,30},{200016,0,1,30},{200017,0,1,30},{200019,0,1,30},{200020,0,1,2},{200021,0,1,10},{200022,0,1,10},{200023,0,1,10},
A16: 200025 | B16: 圣战头盔 | C16: 1 | D16: 0 | E16: 1 | F16: 10 | G16: ="{"&RC[-6]&","&RC[-3]&","&RC[-2]&","&RC[-1]&"}," -> {200025,0,1,10}, | H16: =R[-1]C&RC[-1] -> {200010,0,1,10},{200011,0,1,30},{200012,0,1,30},{200013,0,1,30},{200015,0,1,30},{200016,0,1,30},{200017,0,1,30},{200019,0,1,30},{200020,0,1,2},{200021,0,1,10},{200022,0,1,10},{200023,0,1,10},{200025,0,1,10},
A17: 200026 | B17: 圣战手镯 | C17: 1 | D17: 0 | E17: 1 | F17: 10 | G17: ="{"&RC[-6]&","&RC[-3]&","&RC[-2]&","&RC[-1]&"}," -> {200026,0,1,10}, | H17: =R[-1]C&RC[-1] -> {200010,0,1,10},{200011,0,1,30},{200012,0,1,30},{200013,0,1,30},{200015,0,1,30},{200016,0,1,30},{200017,0,1,30},{200019,0,1,30},{200020,0,1,2},{200021,0,1,10},{200022,0,1,10},{200023,0,1,10},{200025,0,1,10},{200026,0,1,10},
A18: 200027 | B18: 圣战腰带 | C18: 1 | D18: 0 | E18: 1 | F18: 10 | G18: ="{"&RC[-6]&","&RC[-3]&","&RC[-2]&","&RC[-1]&"}," -> {200027,0,1,10}, | H18: =R[-1]C&RC[-1] -> {200010,0,1,10},{200011,0,1,30},{200012,0,1,30},{200013,0,1,30},{200015,0,1,30},{200016,0,1,30},{200017,0,1,30},{200019,0,1,30},{200020,0,1,2},{200021,0,1,10},{200022,0,1,10},{200023,0,1,10},{200025,0,1,10},{200026,0,1,10},{200027,0,1,10},
A19: 200029 | B19: 圣战鞋子 | C19: 1 | D19: 0 | E19: 1 | F19: 10 | G19: ="{"&RC[-6]&","&RC[-3]&","&RC[-2]&","&RC[-1]&"}," -> {200029,0,1,10}, | H19: =R[-1]C&RC[-1] -> {200010,0,1,10},{200011,0,1,30},{200012,0,1,30},{200013,0,1,30},{200015,0,1,30},{200016,0,1,30},{200017,0,1,30},{200019,0,1,30},{200020,0,1,2},{200021,0,1,10},{200022,0,1,10},{200023,0,1,10},{200025,0,1,10},{200026,0,1,10},{200027,0,1,10},{200029,0,1,10},
A20: 200030 | B20: 开天 | C20: 1 | D20: 0 | E20: 1 | F20: 1 | G20: ="{"&RC[-6]&","&RC[-3]&","&RC[-2]&","&RC[-1]&"}," -> {200030,0,1,1}, | H20: =R[-1]C&RC[-1] -> {200010,0,1,10},{200011,0,1,30},{200012,0,1,30},{200013,0,1,30},{200015,0,1,30},{200016,0,1,30},{200017,0,1,30},{200019,0,1,30},{200020,0,1,2},{200021,0,1,10},{200022,0,1,10},{200023,0,1,10},{200025,0,1,10},{200026,0,1,10},{200027,0,1,10},{200029,0,1,10},{200030,0,1,1},
A21: 200031 | B21: 雷霆战甲 | C21: 1 | D21: 0 | E21: 1 | F21: 3 | G21: ="{"&RC[-6]&","&RC[-3]&","&RC[-2]&","&RC[-1]&"}," -> {200031,0,1,3}, | H21: =R[-1]C&RC[-1] -> {200010,0,1,10},{200011,0,1,30},{200012,0,1,30},{200013,0,1,30},{200015,0,1,30},{200016,0,1,30},{200017,0,1,30},{200019,0,1,30},{200020,0,1,2},{200021,0,1,10},{200022,0,1,10},{200023,0,1,10},{200025,0,1,10},{200026,0,1,10},{200027,0,1,10},{200029,0,1,10},{200030,0,1,1},{200031,0,1,3},
A22: 200032 | B22: 雷霆项链 | C22: 1 | D22: 0 | E22: 1 | F22: 3 | G22: ="{"&RC[-6]&","&RC[-3]&","&RC[-2]&","&RC[-1]&"}," -> {200032,0,1,3}, | H22: =R[-1]C&RC[-1] -> {200010,0,1,10},{200011,0,1,30},{200012,0,1,30},{200013,0,1,30},{200015,0,1,30},{200016,0,1,30},{200017,0,1,30},{200019,0,1,30},{200020,0,1,2},{200021,0,1,10},{200022,0,1,10},{200023,0,1,10},{200025,0,1,10},{200026,0,1,10},{200027,0,1,10},{200029,0,1,10},{200030,0,1,1},{200031,0,1,3},{200032,0,1,3},
A23: 200033 | B23: 雷霆戒指 | C23: 1 | D23: 0 | E23: 1 | F23: 3 | G23: ="{"&RC[-6]&","&RC[-3]&","&RC[-2]&","&RC[-1]&"}," -> {200033,0,1,3}, | H23: =R[-1]C&RC[-1] -> {200010,0,1,10},{200011,0,1,30},{200012,0,1,30},{200013,0,1,30},{200015,0,1,30},{200016,0,1,30},{200017,0,1,30},{200019,0,1,30},{200020,0,1,2},{200021,0,1,10},{200022,0,1,10},{200023,0,1,10},{200025,0,1,10},{200026,0,1,10},{200027,0,1,10},{200029,0,1,10},{200030,0,1,1},{200031,0,1,3},{200032,0,1,3},{200033,0,1,3},
A24: 200035 | B24: 雷霆头盔 | C24: 1 | D24: 0 | E24: 1 | F24: 3 | G24: ="{"&RC[-6]&","&RC[-3]&","&RC[-2]&","&RC[-1]&"}," -> {200035,0,1,3}, | H24: =R[-1]C&RC[-1] -> {200010,0,1,10},{200011,0,1,30},{200012,0,1,30},{200013,0,1,30},{200015,0,1,30},{200016,0,1,30},{200017,0,1,30},{200019,0,1,30},{200020,0,1,2},{200021,0,1,10},{200022,0,1,10},{200023,0,1,10},{200025,0,1,10},{200026,0,1,10},{200027,0,1,10},{200029,0,1,10},{200030,0,1,1},{200031,0,1,3},{200032,0,1,3},{200033,0,1,3},{200035,0,1,3},
A25: 200036 | B25: 雷霆护腕 | C25: 1 | D25: 0 | E25: 1 | F25: 3 | G25: ="{"&RC[-6]&","&RC[-3]&","&RC[-2]&","&RC[-1]&"}," -> {200036,0,1,3}, | H25: =R[-1]C&RC[-1] -> {200010,0,1,10},{200011,0,1,30},{200012,0,1,30},{200013,0,1,30},{200015,0,1,30},{200016,0,1,30},{200017,0,1,30},{200019,0,1,30},{200020,0,1,2},{200021,0,1,10},{200022,0,1,10},{200023,0,1,10},{200025,0,1,10},{200026,0,1,10},{200027,0,1,10},{200029,0,1,10},{200030,0,1,1},{200031,0,1,3},{200032,0,1,3},{200033,0,1,3},{200035,0,1,3},{200036,0,1,3},
A26: 200037 | B26: 雷霆腰带 | C26: 1 | D26: 0 | E26: 1 | F26: 3 | G26: ="{"&RC[-6]&","&RC[-3]&","&RC[-2]&","&RC[-1]&"}," -> {200037,0,1,3}, | H26: =R[-1]C&RC[-1] -> {200010,0,1,10},{200011,0,1,30},{200012,0,1,30},{200013,0,1,30},{200015,0,1,30},{200016,0,1,30},{200017,0,1,30},{200019,0,1,30},{200020,0,1,2},{200021,0,1,10},{200022,0,1,10},{200023,0,1,10},{200025,0,1,10},{200026,0,1,10},{200027,0,1,10},{200029,0,1,10},{200030,0,1,1},{200031,0,1,3},{200032,0,1,3},{200033,0,1,3},{200035,0,1,3},{200036,0,1,3},{200037,0,1,3},
A27: 200039 | B27: 雷霆战靴 | C27: 1 | D27: 0 | E27: 1 | F27: 3 | G27: ="{"&RC[-6]&","&RC[-3]&","&RC[-2]&","&RC[-1]&"}," -> {200039,0,1,3}, | H27: =R[-1]C&RC[-1] -> {200010,0,1,10},{200011,0,1,30},{200012,0,1,30},{200013,0,1,30},{200015,0,1,30},{200016,0,1,30},{200017,0,1,30},{200019,0,1,30},{200020,0,1,2},{200021,0,1,10},{200022,0,1,10},{200023,0,1,10},{200025,0,1,10},{200026,0,1,10},{200027,0,1,10},{200029,0,1,10},{200030,0,1,1},{200031,0,1,3},{200032,0,1,3},{200033,0,1,3},{200035,0,1,3},{200036,0,1,3},{200037,0,1,3},{200039,0,1,3},
A28: 201010 | B28: 魔杖 | C28: 1 | D28: 0 | E28: 1 | F28: 10 | G28: ="{"&RC[-6]&","&RC[-3]&","&RC[-2]&","&RC[-1]&"}," -> {201010,0,1,10}, | H28: =R[-1]C&RC[-1] -> {200010,0,1,10},{200011,0,1,30},{200012,0,1,30},{200013,0,1,30},{200015,0,1,30},{200016,0,1,30},{200017,0,1,30},{200019,0,1,30},{200020,0,1,2},{200021,0,1,10},{200022,0,1,10},{200023,0,1,10},{200025,0,1,10},{200026,0,1,10},{200027,0,1,10},{200029,0,1,10},{200030,0,1,1},{200031,0,1,3},{200032,0,1,3},{200033,0,1,3},{200035,0,1,3},{200036,0,1,3},{200037,0,1,3},{200039,0,1,3},{201010,0,1,10},
A29: 201011 | B29: 恶魔铃铛 | C29: 1 | D29: 0 | E29: 1 | F29: 30 | G29: ="{"&RC[-6]&","&RC[-3]&","&RC[-2]&","&RC[-1]&"}," -> {201011,0,1,30}, | H29: =R[-1]C&RC[-1] -> {200010,0,1,10},{200011,0,1,30},{200012,0,1,30},{200013,0,1,30},{200015,0,1,30},{200016,0,1,30},{200017,0,1,30},{200019,0,1,30},{200020,0,1,2},{200021,0,1,10},{200022,0,1,10},{200023,0,1,10},{200025,0,1,10},{200026,0,1,10},{200027,0,1,10},{200029,0,1,10},{200030,0,1,1},{200031,0,1,3},{200032,0,1,3},{200033,0,1,3},{200035,0,1,3},{200036,0,1,3},{200037,0,1,3},{200039,0,1,3},{201010,0,1,10},{201011,0,1,30},
A30: 201012 | B30: 恶魔长袍 | C30: 1 | D30: 0 | E30: 1 | F30: 30 | G30: ="{"&RC[-6]&","&RC[-3]&","&RC[-2]&","&RC[-1]&"}," -> {201012,0,1,30}, | H30: =R[-1]C&RC[-1] -> {200010,0,1,10},{200011,0,1,30},{200012,0,1,30},{200013,0,1,30},{200015,0,1,30},{200016,0,1,30},{200017,0,1,30},{200019,0,1,30},{200020,0,1,2},{200021,0,1,10},{200022,0,1,10},{200023,0,1,10},{200025,0,1,10},{200026,0,1,10},{200027,0,1,10},{200029,0,1,10},{200030,0,1,1},{200031,0,1,3},{200032,0,1,3},{200033,0,1,3},{200035,0,1,3},{200036,0,1,3},{200037,0,1,3},{200039,0,1,3},{201010,0,1,10},{201011,0,1,30},{201012,0,1,30},
A31: 201013 | B31: 紫碧螺 | C31: 1 | D31: 0 | E31: 1 | F31: 30 | G31: ="{"&RC[-6]&","&RC[-3]&","&RC[-2]&","&RC[-1]&"}," -> {201013,0,1,30}, | H31: =R[-1]C&RC[-1] -> {200010,0,1,10},{200011,0,1,30},{200012,0,1,30},{200013,0,1,30},{200015,0,1,30},{200016,0,1,30},{200017,0,1,30},{200019,0,1,30},{200020,0,1,2},{200021,0,1,10},{200022,0,1,10},{200023,0,1,10},{200025,0,1,10},{200026,0,1,10},{200027,0,1,10},{200029,0,1,10},{200030,0,1,1},{200031,0,1,3},{200032,0,1,3},{200033,0,1,3},{200035,0,1,3},{200036,0,1,3},{200037,0,1,3},{200039,0,1,3},{201010,0,1,10},{201011,0,1,30},{201012,0,1,30},{201013,0,1,30},
A32: 201015 | B32: 法师头盔 | C32: 1 | D32: 0 | E32: 1 | F32: 30 | G32: ="{"&RC[-6]&","&RC[-3]&","&RC[-2]&","&RC[-1]&"}," -> {201015,0,1,30}, | H32: =R[-1]C&RC[-1] -> {200010,0,1,10},{200011,0,1,30},{200012,0,1,30},{200013,0,1,30},{200015,0,1,30},{200016,0,1,30},{200017,0,1,30},{200019,0,1,30},{200020,0,1,2},{200021,0,1,10},{200022,0,1,10},{200023,0,1,10},{200025,0,1,10},{200026,0,1,10},{200027,0,1,10},{200029,0,1,10},{200030,0,1,1},{200031,0,1,3},{200032,0,1,3},{200033,0,1,3},{200035,0,1,3},{200036,0,1,3},{200037,0,1,3},{200039,0,1,3},{201010,0,1,10},{201011,0,1,30},{201012,0,1,30},{201013,0,1,30},{201015,0,1,30},
A33: 201016 | B33: 龙之手镯 | C33: 1 | D33: 0 | E33: 1 | F33: 30 | G33: ="{"&RC[-6]&","&RC[-3]&","&RC[-2]&","&RC[-1]&"}," -> {201016,0,1,30}, | H33: =R[-1]C&RC[-1] -> {200010,0,1,10},{200011,0,1,30},{200012,0,1,30},{200013,0,1,30},{200015,0,1,30},{200016,0,1,30},{200017,0,1,30},{200019,0,1,30},{200020,0,1,2},{200021,0,1,10},{200022,0,1,10},{200023,0,1,10},{200025,0,1,10},{200026,0,1,10},{200027,0,1,10},{200029,0,1,10},{200030,0,1,1},{200031,0,1,3},{200032,0,1,3},{200033,0,1,3},{200035,0,1,3},{200036,0,1,3},{200037,0,1,3},{200039,0,1,3},{201010,0,1,10},{201011,0,1,30},{201012,0,1,30},{201013,0,1,30},{201015,0,1,30},{201016,0,1,30},
A34: 201017 | B34: 法师腰带 | C34: 1 | D34: 0 | E34: 1 | F34: 30 | G34: ="{"&RC[-6]&","&RC[-3]&","&RC[-2]&","&RC[-1]&"}," -> {201017,0,1,30}, | H34: =R[-1]C&RC[-1] -> {200010,0,1,10},{200011,0,1,30},{200012,0,1,30},{200013,0,1,30},{200015,0,1,30},{200016,0,1,30},{200017,0,1,30},{200019,0,1,30},{200020,0,1,2},{200021,0,1,10},{200022,0,1,10},{200023,0,1,10},{200025,0,1,10},{200026,0,1,10},{200027,0,1,10},{200029,0,1,10},{200030,0,1,1},{200031,0,1,3},{200032,0,1,3},{200033,0,1,3},{200035,0,1,3},{200036,0,1,3},{200037,0,1,3},{200039,0,1,3},{201010,0,1,10},{201011,0,1,30},{201012,0,1,30},{201013,0,1,30},{201015,0,1,30},{201016,0,1,30},{201017,0,1,30},
A35: 201019 | B35: 法师鞋子 | C35: 1 | D35: 0 | E35: 1 | F35: 30 | G35: ="{"&RC[-6]&","&RC[-3]&","&RC[-2]&","&RC[-1]&"}," -> {201019,0,1,30}, | H35: =R[-1]C&RC[-1] -> {200010,0,1,10},{200011,0,1,30},{200012,0,1,30},{200013,0,1,30},{200015,0,1,30},{200016,0,1,30},{200017,0,1,30},{200019,0,1,30},{200020,0,1,2},{200021,0,1,10},{200022,0,1,10},{200023,0,1,10},{200025,0,1,10},{200026,0,1,10},{200027,0,1,10},{200029,0,1,10},{200030,0,1,1},{200031,0,1,3},{200032,0,1,3},{200033,0,1,3},{200035,0,1,3},{200036,0,1,3},{200037,0,1,3},{200039,0,1,3},{201010,0,1,10},{201011,0,1,30},{201012,0,1,30},{201013,0,1,30},{201015,0,1,30},{201016,0,1,30},{201017,0,1,30},{201019,0,1,30},
A36: 201020 | B36: 骨玉 | C36: 1 | D36: 0 | E36: 1 | F36: 2 | G36: ="{"&RC[-6]&","&RC[-3]&","&RC[-2]&","&RC[-1]&"}," -> {201020,0,1,2}, | H36: =R[-1]C&RC[-1] -> {200010,0,1,10},{200011,0,1,30},{200012,0,1,30},{200013,0,1,30},{200015,0,1,30},{200016,0,1,30},{200017,0,1,30},{200019,0,1,30},{200020,0,1,2},{200021,0,1,10},{200022,0,1,10},{200023,0,1,10},{200025,0,1,10},{200026,0,1,10},{200027,0,1,10},{200029,0,1,10},{200030,0,1,1},{200031,0,1,3},{200032,0,1,3},{200033,0,1,3},{200035,0,1,3},{200036,0,1,3},{200037,0,1,3},{200039,0,1,3},{201010,0,1,10},{201011,0,1,30},{201012,0,1,30},{201013,0,1,30},{201015,0,1,30},{201016,0,1,30},{201017,0,1,30},{201019,0,1,30},{201020,0,1,2},
A37: 201021 | B37: 法神披风 | C37: 1 | D37: 0 | E37: 1 | F37: 10 | G37: ="{"&RC[-6]&","&RC[-3]&","&RC[-2]&","&RC[-1]&"}," -> {201021,0,1,10}, | H37: =R[-1]C&RC[-1] -> {200010,0,1,10},{200011,0,1,30},{200012,0,1,30},{200013,0,1,30},{200015,0,1,30},{200016,0,1,30},{200017,0,1,30},{200019,0,1,30},{200020,0,1,2},{200021,0,1,10},{200022,0,1,10},{200023,0,1,10},{200025,0,1,10},{200026,0,1,10},{200027,0,1,10},{200029,0,1,10},{200030,0,1,1},{200031,0,1,3},{200032,0,1,3},{200033,0,1,3},{200035,0,1,3},{200036,0,1,3},{200037,0,1,3},{200039,0,1,3},{201010,0,1,10},{201011,0,1,30},{201012,0,1,30},{201013,0,1,30},{201015,0,1,30},{201016,0,1,30},{201017,0,1,30},{201019,0,1,30},{201020,0,1,2},{201021,0,1,10},
A38: 201022 | B38: 法神项链 | C38: 1 | D38: 0 | E38: 1 | F38: 10 | G38: ="{"&RC[-6]&","&RC[-3]&","&RC[-2]&","&RC[-1]&"}," -> {201022,0,1,10}, | H38: =R[-1]C&RC[-1] -> {200010,0,1,10},{200011,0,1,30},{200012,0,1,30},{200013,0,1,30},{200015,0,1,30},{200016,0,1,30},{200017,0,1,30},{200019,0,1,30},{200020,0,1,2},{200021,0,1,10},{200022,0,1,10},{200023,0,1,10},{200025,0,1,10},{200026,0,1,10},{200027,0,1,10},{200029,0,1,10},{200030,0,1,1},{200031,0,1,3},{200032,0,1,3},{200033,0,1,3},{200035,0,1,3},{200036,0,1,3},{200037,0,1,3},{200039,0,1,3},{201010,0,1,10},{201011,0,1,30},{201012,0,1,30},{201013,0,1,30},{201015,0,1,30},{201016,0,1,30},{201017,0,1,30},{201019,0,1,30},{201020,0,1,2},{201021,0,1,10},{201022,0,1,10},
A39: 201023 | B39: 法神戒指 | C39: 1 | D39: 0 | E39: 1 | F39: 10 | G39: ="{"&RC[-6]&","&RC[-3]&","&RC[-2]&","&RC[-1]&"}," -> {201023,0,1,10}, | H39: =R[-1]C&RC[-1] -> {200010,0,1,10},{200011,0,1,30},{200012,0,1,30},{200013,0,1,30},{200015,0,1,30},{200016,0,1,30},{200017,0,1,30},{200019,0,1,30},{200020,0,1,2},{200021,0,1,10},{200022,0,1,10},{200023,0,1,10},{200025,0,1,10},{200026,0,1,10},{200027,0,1,10},{200029,0,1,10},{200030,0,1,1},{200031,0,1,3},{200032,0,1,3},{200033,0,1,3},{200035,0,1,3},{200036,0,1,3},{200037,0,1,3},{200039,0,1,3},{201010,0,1,10},{201011,0,1,30},{201012,0,1,30},{201013,0,1,30},{201015,0,1,30},{201016,0,1,30},{201017,0,1,30},{201019,0,1,30},{201020,0,1,2},{201021,0,1,10},{201022,0,1,10},{201023,0,1,10},
A40: 201025 | B40: 法神头盔 | C40: 1 | D40: 0 | E40: 1 | F40: 10 | G40: ="{"&RC[-6]&","&RC[-3]&","&RC[-2]&","&RC[-1]&"}," -> {201025,0,1,10}, | H40: =R[-1]C&RC[-1] -> {200010,0,1,10},{200011,0,1,30},{200012,0,1,30},{200013,0,1,30},{200015,0,1,30},{200016,0,1,30},{200017,0,1,30},{200019,0,1,30},{200020,0,1,2},{200021,0,1,10},{200022,0,1,10},{200023,0,1,10},{200025,0,1,10},{200026,0,1,10},{200027,0,1,10},{200029,0,1,10},{200030,0,1,1},{200031,0,1,3},{200032,0,1,3},{200033,0,1,3},{200035,0,1,3},{200036,0,1,3},{200037,0,1,3},{200039,0,1,3},{201010,0,1,10},{201011,0,1,30},{201012,0,1,30},{201013,0,1,30},{201015,0,1,30},{201016,0,1,30},{201017,0,1,30},{201019,0,1,30},{201020,0,1,2},{201021,0,1,10},{201022,0,1,10},{201023,0,1,10},{201025,0,1,10},
A41: 201026 | B41: 法神手镯 | C41: 1 | D41: 0 | E41: 1 | F41: 10 | G41: ="{"&RC[-6]&","&RC[-3]&","&RC[-2]&","&RC[-1]&"}," -> {201026,0,1,10}, | H41: =R[-1]C&RC[-1] -> {200010,0,1,10},{200011,0,1,30},{200012,0,1,30},{200013,0,1,30},{200015,0,1,30},{200016,0,1,30},{200017,0,1,30},{200019,0,1,30},{200020,0,1,2},{200021,0,1,10},{200022,0,1,10},{200023,0,1,10},{200025,0,1,10},{200026,0,1,10},{200027,0,1,10},{200029,0,1,10},{200030,0,1,1},{200031,0,1,3},{200032,0,1,3},{200033,0,1,3},{200035,0,1,3},{200036,0,1,3},{200037,0,1,3},{200039,0,1,3},{201010,0,1,10},{201011,0,1,30},{201012,0,1,30},{201013,0,1,30},{201015,0,1,30},{201016,0,1,30},{201017,0,1,30},{201019,0,1,30},{201020,0,1,2},{201021,0,1,10},{201022,0,1,10},{201023,0,1,10},{201025,0,1,10},{201026,0,1,10},
A42: 201027 | B42: 法神腰带 | C42: 1 | D42: 0 | E42: 1 | F42: 10 | G42: ="{"&RC[-6]&","&RC[-3]&","&RC[-2]&","&RC[-1]&"}," -> {201027,0,1,10}, | H42: =R[-1]C&RC[-1] -> {200010,0,1,10},{200011,0,1,30},{200012,0,1,30},{200013,0,1,30},{200015,0,1,30},{200016,0,1,30},{200017,0,1,30},{200019,0,1,30},{200020,0,1,2},{200021,0,1,10},{200022,0,1,10},{200023,0,1,10},{200025,0,1,10},{200026,0,1,10},{200027,0,1,10},{200029,0,1,10},{200030,0,1,1},{200031,0,1,3},{200032,0,1,3},{200033,0,1,3},{200035,0,1,3},{200036,0,1,3},{200037,0,1,3},{200039,0,1,3},{201010,0,1,10},{201011,0,1,30},{201012,0,1,30},{201013,0,1,30},{201015,0,1,30},{201016,0,1,30},{201017,0,1,30},{201019,0,1,30},{201020,0,1,2},{201021,0,1,10},{201022,0,1,10},{201023,0,1,10},{201025,0,1,10},{201026,0,1,10},{201027,0,1,10},
A43: 201029 | B43: 法神鞋子 | C43: 1 | D43: 0 | E43: 1 | F43: 10 | G43: ="{"&RC[-6]&","&RC[-3]&","&RC[-2]&","&RC[-1]&"}," -> {201029,0,1,10}, | H43: =R[-1]C&RC[-1] -> {200010,0,1,10},{200011,0,1,30},{200012,0,1,30},{200013,0,1,30},{200015,0,1,30},{200016,0,1,30},{200017,0,1,30},{200019,0,1,30},{200020,0,1,2},{200021,0,1,10},{200022,0,1,10},{200023,0,1,10},{200025,0,1,10},{200026,0,1,10},{200027,0,1,10},{200029,0,1,10},{200030,0,1,1},{200031,0,1,3},{200032,0,1,3},{200033,0,1,3},{200035,0,1,3},{200036,0,1,3},{200037,0,1,3},{200039,0,1,3},{201010,0,1,10},{201011,0,1,30},{201012,0,1,30},{201013,0,1,30},{201015,0,1,30},{201016,0,1,30},{201017,0,1,30},{201019,0,1,30},{201020,0,1,2},{201021,0,1,10},{201022,0,1,10},{201023,0,1,10},{201025,0,1,10},{201026,0,1,10},{201027,0,1,10},{201029,0,1,10},
A44: 201040 | B44: 震天（沙） | C44: 1 | D44: 0 | E44: 1 | F44: 1 | G44: ="{"&RC[-6]&","&RC[-3]&","&RC[-2]&","&RC[-1]&"}," -> {201040,0,1,1}, | H44: =R[-1]C&RC[-1] -> {200010,0,1,10},{200011,0,1,30},{200012,0,1,30},{200013,0,1,30},{200015,0,1,30},{200016,0,1,30},{200017,0,1,30},{200019,0,1,30},{200020,0,1,2},{200021,0,1,10},{200022,0,1,10},{200023,0,1,10},{200025,0,1,10},{200026,0,1,10},{200027,0,1,10},{200029,0,1,10},{200030,0,1,1},{200031,0,1,3},{200032,0,1,3},{200033,0,1,3},{200035,0,1,3},{200036,0,1,3},{200037,0,1,3},{200039,0,1,3},{201010,0,1,10},{201011,0,1,30},{201012,0,1,30},{201013,0,1,30},{201015,0,1,30},{201016,0,1,30},{201017,0,1,30},{201019,0,1,30},{201020,0,1,2},{201021,0,1,10},{201022,0,1,10},{201023,0,1,10},{201025,0,1,10},{201026,0,1,10},{201027,0,1,10},{201029,0,1,10},{201040,0,1,1},
A45: 201041 | B45: 烈焰法袍（沙） | C45: 1 | D45: 0 | E45: 1 | F45: 3 | G45: ="{"&RC[-6]&","&RC[-3]&","&RC[-2]&","&RC[-1]&"}," -> {201041,0,1,3}, | H45: =R[-1]C&RC[-1] -> {200010,0,1,10},{200011,0,1,30},{200012,0,1,30},{200013,0,1,30},{200015,0,1,30},{200016,0,1,30},{200017,0,1,30},{200019,0,1,30},{200020,0,1,2},{200021,0,1,10},{200022,0,1,10},{200023,0,1,10},{200025,0,1,10},{200026,0,1,10},{200027,0,1,10},{200029,0,1,10},{200030,0,1,1},{200031,0,1,3},{200032,0,1,3},{200033,0,1,3},{200035,0,1,3},{200036,0,1,3},{200037,0,1,3},{200039,0,1,3},{201010,0,1,10},{201011,0,1,30},{201012,0,1,30},{201013,0,1,30},{201015,0,1,30},{201016,0,1,30},{201017,0,1,30},{201019,0,1,30},{201020,0,1,2},{201021,0,1,10},{201022,0,1,10},{201023,0,1,10},{201025,0,1,10},{201026,0,1,10},{201027,0,1,10},{201029,0,1,10},{201040,0,1,1},{201041,0,1,3},
A46: 201042 | B46: 烈焰魔链（沙） | C46: 1 | D46: 0 | E46: 1 | F46: 3 | G46: ="{"&RC[-6]&","&RC[-3]&","&RC[-2]&","&RC[-1]&"}," -> {201042,0,1,3}, | H46: =R[-1]C&RC[-1] -> {200010,0,1,10},{200011,0,1,30},{200012,0,1,30},{200013,0,1,30},{200015,0,1,30},{200016,0,1,30},{200017,0,1,30},{200019,0,1,30},{200020,0,1,2},{200021,0,1,10},{200022,0,1,10},{200023,0,1,10},{200025,0,1,10},{200026,0,1,10},{200027,0,1,10},{200029,0,1,10},{200030,0,1,1},{200031,0,1,3},{200032,0,1,3},{200033,0,1,3},{200035,0,1,3},{200036,0,1,3},{200037,0,1,3},{200039,0,1,3},{201010,0,1,10},{201011,0,1,30},{201012,0,1,30},{201013,0,1,30},{201015,0,1,30},{201016,0,1,30},{201017,0,1,30},{201019,0,1,30},{201020,0,1,2},{201021,0,1,10},{201022,0,1,10},{201023,0,1,10},{201025,0,1,10},{201026,0,1,10},{201027,0,1,10},{201029,0,1,10},{201040,0,1,1},{201041,0,1,3},{201042,0,1,3},
A47: 201043 | B47: 烈焰魔指（沙） | C47: 1 | D47: 0 | E47: 1 | F47: 3 | G47: ="{"&RC[-6]&","&RC[-3]&","&RC[-2]&","&RC[-1]&"}," -> {201043,0,1,3}, | H47: =R[-1]C&RC[-1] -> {200010,0,1,10},{200011,0,1,30},{200012,0,1,30},{200013,0,1,30},{200015,0,1,30},{200016,0,1,30},{200017,0,1,30},{200019,0,1,30},{200020,0,1,2},{200021,0,1,10},{200022,0,1,10},{200023,0,1,10},{200025,0,1,10},{200026,0,1,10},{200027,0,1,10},{200029,0,1,10},{200030,0,1,1},{200031,0,1,3},{200032,0,1,3},{200033,0,1,3},{200035,0,1,3},{200036,0,1,3},{200037,0,1,3},{200039,0,1,3},{201010,0,1,10},{201011,0,1,30},{201012,0,1,30},{201013,0,1,30},{201015,0,1,30},{201016,0,1,30},{201017,0,1,30},{201019,0,1,30},{201020,0,1,2},{201021,0,1,10},{201022,0,1,10},{201023,0,1,10},{201025,0,1,10},{201026,0,1,10},{201027,0,1,10},{201029,0,1,10},{201040,0,1,1},{201041,0,1,3},{201042,0,1,3},{201043,0,1,3},
A48: 201045 | B48: 烈焰头盔（沙） | C48: 1 | D48: 0 | E48: 1 | F48: 3 | G48: ="{"&RC[-6]&","&RC[-3]&","&RC[-2]&","&RC[-1]&"}," -> {201045,0,1,3}, | H48: =R[-1]C&RC[-1] -> {200010,0,1,10},{200011,0,1,30},{200012,0,1,30},{200013,0,1,30},{200015,0,1,30},{200016,0,1,30},{200017,0,1,30},{200019,0,1,30},{200020,0,1,2},{200021,0,1,10},{200022,0,1,10},{200023,0,1,10},{200025,0,1,10},{200026,0,1,10},{200027,0,1,10},{200029,0,1,10},{200030,0,1,1},{200031,0,1,3},{200032,0,1,3},{200033,0,1,3},{200035,0,1,3},{200036,0,1,3},{200037,0,1,3},{200039,0,1,3},{201010,0,1,10},{201011,0,1,30},{201012,0,1,30},{201013,0,1,30},{201015,0,1,30},{201016,0,1,30},{201017,0,1,30},{201019,0,1,30},{201020,0,1,2},{201021,0,1,10},{201022,0,1,10},{201023,0,1,10},{201025,0,1,10},{201026,0,1,10},{201027,0,1,10},{201029,0,1,10},{201040,0,1,1},{201041,0,1,3},{201042,0,1,3},{201043,0,1,3},{201045,0,1,3},
A49: 201046 | B49: 烈焰护腕（沙） | C49: 1 | D49: 0 | E49: 1 | F49: 3 | G49: ="{"&RC[-6]&","&RC[-3]&","&RC[-2]&","&RC[-1]&"}," -> {201046,0,1,3}, | H49: =R[-1]C&RC[-1] -> {200010,0,1,10},{200011,0,1,30},{200012,0,1,30},{200013,0,1,30},{200015,0,1,30},{200016,0,1,30},{200017,0,1,30},{200019,0,1,30},{200020,0,1,2},{200021,0,1,10},{200022,0,1,10},{200023,0,1,10},{200025,0,1,10},{200026,0,1,10},{200027,0,1,10},{200029,0,1,10},{200030,0,1,1},{200031,0,1,3},{200032,0,1,3},{200033,0,1,3},{200035,0,1,3},{200036,0,1,3},{200037,0,1,3},{200039,0,1,3},{201010,0,1,10},{201011,0,1,30},{201012,0,1,30},{201013,0,1,30},{201015,0,1,30},{201016,0,1,30},{201017,0,1,30},{201019,0,1,30},{201020,0,1,2},{201021,0,1,10},{201022,0,1,10},{201023,0,1,10},{201025,0,1,10},{201026,0,1,10},{201027,0,1,10},{201029,0,1,10},{201040,0,1,1},{201041,0,1,3},{201042,0,1,3},{201043,0,1,3},{201045,0,1,3},{201046,0,1,3},
A50: 201047 | B50: 烈焰腰带（沙） | C50: 1 | D50: 0 | E50: 1 | F50: 3 | G50: ="{"&RC[-6]&","&RC[-3]&","&RC[-2]&","&RC[-1]&"}," -> {201047,0,1,3}, | H50: =R[-1]C&RC[-1] -> {200010,0,1,10},{200011,0,1,30},{200012,0,1,30},{200013,0,1,30},{200015,0,1,30},{200016,0,1,30},{200017,0,1,30},{200019,0,1,30},{200020,0,1,2},{200021,0,1,10},{200022,0,1,10},{200023,0,1,10},{200025,0,1,10},{200026,0,1,10},{200027,0,1,10},{200029,0,1,10},{200030,0,1,1},{200031,0,1,3},{200032,0,1,3},{200033,0,1,3},{200035,0,1,3},{200036,0,1,3},{200037,0,1,3},{200039,0,1,3},{201010,0,1,10},{201011,0,1,30},{201012,0,1,30},{201013,0,1,30},{201015,0,1,30},{201016,0,1,30},{201017,0,1,30},{201019,0,1,30},{201020,0,1,2},{201021,0,1,10},{201022,0,1,10},{201023,0,1,10},{201025,0,1,10},{201026,0,1,10},{201027,0,1,10},{201029,0,1,10},{201040,0,1,1},{201041,0,1,3},{201042,0,1,3},{201043,0,1,3},{201045,0,1,3},{201046,0,1,3},{201047,0,1,3},
A51: 201049 | B51: 烈焰魔靴（沙） | C51: 1 | D51: 0 | E51: 1 | F51: 3 | G51: ="{"&RC[-6]&","&RC[-3]&","&RC[-2]&","&RC[-1]&"}," -> {201049,0,1,3}, | H51: =R[-1]C&RC[-1] -> {200010,0,1,10},{200011,0,1,30},{200012,0,1,30},{200013,0,1,30},{200015,0,1,30},{200016,0,1,30},{200017,0,1,30},{200019,0,1,30},{200020,0,1,2},{200021,0,1,10},{200022,0,1,10},{200023,0,1,10},{200025,0,1,10},{200026,0,1,10},{200027,0,1,10},{200029,0,1,10},{200030,0,1,1},{200031,0,1,3},{200032,0,1,3},{200033,0,1,3},{200035,0,1,3},{200036,0,1,3},{200037,0,1,3},{200039,0,1,3},{201010,0,1,10},{201011,0,1,30},{201012,0,1,30},{201013,0,1,30},{201015,0,1,30},{201016,0,1,30},{201017,0,1,30},{201019,0,1,30},{201020,0,1,2},{201021,0,1,10},{201022,0,1,10},{201023,0,1,10},{201025,0,1,10},{201026,0,1,10},{201027,0,1,10},{201029,0,1,10},{201040,0,1,1},{201041,0,1,3},{201042,0,1,3},{201043,0,1,3},{201045,0,1,3},{201046,0,1,3},{201047,0,1,3},{201049,0,1,3},
A52: 202010 | B52: 银蛇 | C52: 1 | D52: 0 | E52: 1 | F52: 10 | G52: ="{"&RC[-6]&","&RC[-3]&","&RC[-2]&","&RC[-1]&"}," -> {202010,0,1,10}, | H52: =R[-1]C&RC[-1] -> {200010,0,1,10},{200011,0,1,30},{200012,0,1,30},{200013,0,1,30},{200015,0,1,30},{200016,0,1,30},{200017,0,1,30},{200019,0,1,30},{200020,0,1,2},{200021,0,1,10},{200022,0,1,10},{200023,0,1,10},{200025,0,1,10},{200026,0,1,10},{200027,0,1,10},{200029,0,1,10},{200030,0,1,1},{200031,0,1,3},{200032,0,1,3},{200033,0,1,3},{200035,0,1,3},{200036,0,1,3},{200037,0,1,3},{200039,0,1,3},{201010,0,1,10},{201011,0,1,30},{201012,0,1,30},{201013,0,1,30},{201015,0,1,30},{201016,0,1,30},{201017,0,1,30},{201019,0,1,30},{201020,0,1,2},{201021,0,1,10},{201022,0,1,10},{201023,0,1,10},{201025,0,1,10},{201026,0,1,10},{201027,0,1,10},{201029,0,1,10},{201040,0,1,1},{201041,0,1,3},{201042,0,1,3},{201043,0,1,3},{201045,0,1,3},{201046,0,1,3},{201047,0,1,3},{201049,0,1,3},{202010,0,1,10},
A53: 202011 | B53: 天珠道链 | C53: 1 | D53: 0 | E53: 1 | F53: 30 | G53: ="{"&RC[-6]&","&RC[-3]&","&RC[-2]&","&RC[-1]&"}," -> {202011,0,1,30}, | H53: =R[-1]C&RC[-1] -> {200010,0,1,10},{200011,0,1,30},{200012,0,1,30},{200013,0,1,30},{200015,0,1,30},{200016,0,1,30},{200017,0,1,30},{200019,0,1,30},{200020,0,1,2},{200021,0,1,10},{200022,0,1,10},{200023,0,1,10},{200025,0,1,10},{200026,0,1,10},{200027,0,1,10},{200029,0,1,10},{200030,0,1,1},{200031,0,1,3},{200032,0,1,3},{200033,0,1,3},{200035,0,1,3},{200036,0,1,3},{200037,0,1,3},{200039,0,1,3},{201010,0,1,10},{201011,0,1,30},{201012,0,1,30},{201013,0,1,30},{201015,0,1,30},{201016,0,1,30},{201017,0,1,30},{201019,0,1,30},{201020,0,1,2},{201021,0,1,10},{201022,0,1,10},{201023,0,1,10},{201025,0,1,10},{201026,0,1,10},{201027,0,1,10},{201029,0,1,10},{201040,0,1,1},{201041,0,1,3},{201042,0,1,3},{201043,0,1,3},{201045,0,1,3},{201046,0,1,3},{201047,0,1,3},{201049,0,1,3},{202010,0,1,10},{202011,0,1,30},
A54: 202012 | B54: 灵魂道袍 | C54: 1 | D54: 0 | E54: 1 | F54: 30 | G54: ="{"&RC[-6]&","&RC[-3]&","&RC[-2]&","&RC[-1]&"}," -> {202012,0,1,30}, | H54: =R[-1]C&RC[-1] -> {200010,0,1,10},{200011,0,1,30},{200012,0,1,30},{200013,0,1,30},{200015,0,1,30},{200016,0,1,30},{200017,0,1,30},{200019,0,1,30},{200020,0,1,2},{200021,0,1,10},{200022,0,1,10},{200023,0,1,10},{200025,0,1,10},{200026,0,1,10},{200027,0,1,10},{200029,0,1,10},{200030,0,1,1},{200031,0,1,3},{200032,0,1,3},{200033,0,1,3},{200035,0,1,3},{200036,0,1,3},{200037,0,1,3},{200039,0,1,3},{201010,0,1,10},{201011,0,1,30},{201012,0,1,30},{201013,0,1,30},{201015,0,1,30},{201016,0,1,30},{201017,0,1,30},{201019,0,1,30},{201020,0,1,2},{201021,0,1,10},{201022,0,1,10},{201023,0,1,10},{201025,0,1,10},{201026,0,1,10},{201027,0,1,10},{201029,0,1,10},{201040,0,1,1},{201041,0,1,3},{201042,0,1,3},{201043,0,1,3},{201045,0,1,3},{201046,0,1,3},{201047,0,1,3},{201049,0,1,3},{202010,0,1,10},{202011,0,1,30},{202012,0,1,30},
A55: 202013 | B55: 泰坦戒指 | C55: 1 | D55: 0 | E55: 1 | F55: 30 | G55: ="{"&RC[-6]&","&RC[-3]&","&RC[-2]&","&RC[-1]&"}," -> {202013,0,1,30}, | H55: =R[-1]C&RC[-1] -> {200010,0,1,10},{200011,0,1,30},{200012,0,1,30},{200013,0,1,30},{200015,0,1,30},{200016,0,1,30},{200017,0,1,30},{200019,0,1,30},{200020,0,1,2},{200021,0,1,10},{200022,0,1,10},{200023,0,1,10},{200025,0,1,10},{200026,0,1,10},{200027,0,1,10},{200029,0,1,10},{200030,0,1,1},{200031,0,1,3},{200032,0,1,3},{200033,0,1,3},{200035,0,1,3},{200036,0,1,3},{200037,0,1,3},{200039,0,1,3},{201010,0,1,10},{201011,0,1,30},{201012,0,1,30},{201013,0,1,30},{201015,0,1,30},{201016,0,1,30},{201017,0,1,30},{201019,0,1,30},{201020,0,1,2},{201021,0,1,10},{201022,0,1,10},{201023,0,1,10},{201025,0,1,10},{201026,0,1,10},{201027,0,1,10},{201029,0,1,10},{201040,0,1,1},{201041,0,1,3},{201042,0,1,3},{201043,0,1,3},{201045,0,1,3},{201046,0,1,3},{201047,0,1,3},{201049,0,1,3},{202010,0,1,10},{202011,0,1,30},{202012,0,1,30},{202013,0,1,30},
A56: 202015 | B56: 道士头盔 | C56: 1 | D56: 0 | E56: 1 | F56: 30 | G56: ="{"&RC[-6]&","&RC[-3]&","&RC[-2]&","&RC[-1]&"}," -> {202015,0,1,30}, | H56: =R[-1]C&RC[-1] -> {200010,0,1,10},{200011,0,1,30},{200012,0,1,30},{200013,0,1,30},{200015,0,1,30},{200016,0,1,30},{200017,0,1,30},{200019,0,1,30},{200020,0,1,2},{200021,0,1,10},{200022,0,1,10},{200023,0,1,10},{200025,0,1,10},{200026,0,1,10},{200027,0,1,10},{200029,0,1,10},{200030,0,1,1},{200031,0,1,3},{200032,0,1,3},{200033,0,1,3},{200035,0,1,3},{200036,0,1,3},{200037,0,1,3},{200039,0,1,3},{201010,0,1,10},{201011,0,1,30},{201012,0,1,30},{201013,0,1,30},{201015,0,1,30},{201016,0,1,30},{201017,0,1,30},{201019,0,1,30},{201020,0,1,2},{201021,0,1,10},{201022,0,1,10},{201023,0,1,10},{201025,0,1,10},{201026,0,1,10},{201027,0,1,10},{201029,0,1,10},{201040,0,1,1},{201041,0,1,3},{201042,0,1,3},{201043,0,1,3},{201045,0,1,3},{201046,0,1,3},{201047,0,1,3},{201049,0,1,3},{202010,0,1,10},{202011,0,1,30},{202012,0,1,30},{202013,0,1,30},{202015,0,1,30},
A57: 202016 | B57: 幽灵手镯 | C57: 1 | D57: 0 | E57: 1 | F57: 30 | G57: ="{"&RC[-6]&","&RC[-3]&","&RC[-2]&","&RC[-1]&"}," -> {202016,0,1,30}, | H57: =R[-1]C&RC[-1] -> {200010,0,1,10},{200011,0,1,30},{200012,0,1,30},{200013,0,1,30},{200015,0,1,30},{200016,0,1,30},{200017,0,1,30},{200019,0,1,30},{200020,0,1,2},{200021,0,1,10},{200022,0,1,10},{200023,0,1,10},{200025,0,1,10},{200026,0,1,10},{200027,0,1,10},{200029,0,1,10},{200030,0,1,1},{200031,0,1,3},{200032,0,1,3},{200033,0,1,3},{200035,0,1,3},{200036,0,1,3},{200037,0,1,3},{200039,0,1,3},{201010,0,1,10},{201011,0,1,30},{201012,0,1,30},{201013,0,1,30},{201015,0,1,30},{201016,0,1,30},{201017,0,1,30},{201019,0,1,30},{201020,0,1,2},{201021,0,1,10},{201022,0,1,10},{201023,0,1,10},{201025,0,1,10},{201026,0,1,10},{201027,0,1,10},{201029,0,1,10},{201040,0,1,1},{201041,0,1,3},{201042,0,1,3},{201043,0,1,3},{201045,0,1,3},{201046,0,1,3},{201047,0,1,3},{201049,0,1,3},{202010,0,1,10},{202011,0,1,30},{202012,0,1,30},{202013,0,1,30},{202015,0,1,30},{202016,0,1,30},
A58: 202017 | B58: 道士腰带 | C58: 1 | D58: 0 | E58: 1 | F58: 30 | G58: ="{"&RC[-6]&","&RC[-3]&","&RC[-2]&","&RC[-1]&"}," -> {202017,0,1,30}, | H58: =R[-1]C&RC[-1] -> {200010,0,1,10},{200011,0,1,30},{200012,0,1,30},{200013,0,1,30},{200015,0,1,30},{200016,0,1,30},{200017,0,1,30},{200019,0,1,30},{200020,0,1,2},{200021,0,1,10},{200022,0,1,10},{200023,0,1,10},{200025,0,1,10},{200026,0,1,10},{200027,0,1,10},{200029,0,1,10},{200030,0,1,1},{200031,0,1,3},{200032,0,1,3},{200033,0,1,3},{200035,0,1,3},{200036,0,1,3},{200037,0,1,3},{200039,0,1,3},{201010,0,1,10},{201011,0,1,30},{201012,0,1,30},{201013,0,1,30},{201015,0,1,30},{201016,0,1,30},{201017,0,1,30},{201019,0,1,30},{201020,0,1,2},{201021,0,1,10},{201022,0,1,10},{201023,0,1,10},{201025,0,1,10},{201026,0,1,10},{201027,0,1,10},{201029,0,1,10},{201040,0,1,1},{201041,0,1,3},{201042,0,1,3},{201043,0,1,3},{201045,0,1,3},{201046,0,1,3},{201047,0,1,3},{201049,0,1,3},{202010,0,1,10},{202011,0,1,30},{202012,0,1,30},{202013,0,1,30},{202015,0,1,30},{202016,0,1,30},{202017,0,1,30},
A59: 202019 | B59: 道士鞋子 | C59: 1 | D59: 0 | E59: 1 | F59: 30 | G59: ="{"&RC[-6]&","&RC[-3]&","&RC[-2]&","&RC[-1]&"}," -> {202019,0,1,30}, | H59: =R[-1]C&RC[-1] -> {200010,0,1,10},{200011,0,1,30},{200012,0,1,30},{200013,0,1,30},{200015,0,1,30},{200016,0,1,30},{200017,0,1,30},{200019,0,1,30},{200020,0,1,2},{200021,0,1,10},{200022,0,1,10},{200023,0,1,10},{200025,0,1,10},{200026,0,1,10},{200027,0,1,10},{200029,0,1,10},{200030,0,1,1},{200031,0,1,3},{200032,0,1,3},{200033,0,1,3},{200035,0,1,3},{200036,0,1,3},{200037,0,1,3},{200039,0,1,3},{201010,0,1,10},{201011,0,1,30},{201012,0,1,30},{201013,0,1,30},{201015,0,1,30},{201016,0,1,30},{201017,0,1,30},{201019,0,1,30},{201020,0,1,2},{201021,0,1,10},{201022,0,1,10},{201023,0,1,10},{201025,0,1,10},{201026,0,1,10},{201027,0,1,10},{201029,0,1,10},{201040,0,1,1},{201041,0,1,3},{201042,0,1,3},{201043,0,1,3},{201045,0,1,3},{201046,0,1,3},{201047,0,1,3},{201049,0,1,3},{202010,0,1,10},{202011,0,1,30},{202012,0,1,30},{202013,0,1,30},{202015,0,1,30},{202016,0,1,30},{202017,0,1,30},{202019,0,1,30},
A60: 202020 | B60: 龙纹 | C60: 1 | D60: 0 | E60: 1 | F60: 2 | G60: ="{"&RC[-6]&","&RC[-3]&","&RC[-2]&","&RC[-1]&"}," -> {202020,0,1,2}, | H60: =R[-1]C&RC[-1] -> {200010,0,1,10},{200011,0,1,30},{200012,0,1,30},{200013,0,1,30},{200015,0,1,30},{200016,0,1,30},{200017,0,1,30},{200019,0,1,30},{200020,0,1,2},{200021,0,1,10},{200022,0,1,10},{200023,0,1,10},{200025,0,1,10},{200026,0,1,10},{200027,0,1,10},{200029,0,1,10},{200030,0,1,1},{200031,0,1,3},{200032,0,1,3},{200033,0,1,3},{200035,0,1,3},{200036,0,1,3},{200037,0,1,3},{200039,0,1,3},{201010,0,1,10},{201011,0,1,30},{201012,0,1,30},{201013,0,1,30},{201015,0,1,30},{201016,0,1,30},{201017,0,1,30},{201019,0,1,30},{201020,0,1,2},{201021,0,1,10},{201022,0,1,10},{201023,0,1,10},{201025,0,1,10},{201026,0,1,10},{201027,0,1,10},{201029,0,1,10},{201040,0,1,1},{201041,0,1,3},{201042,0,1,3},{201043,0,1,3},{201045,0,1,3},{201046,0,1,3},{201047,0,1,3},{201049,0,1,3},{202010,0,1,10},{202011,0,1,30},{202012,0,1,30},{202013,0,1,30},{202015,0,1,30},{202016,0,1,30},{202017,0,1,30},{202019,0,1,30},{202020,0,1,2},
A61: 202021 | B61: 天尊道袍 | C61: 1 | D61: 0 | E61: 1 | F61: 10 | G61: ="{"&RC[-6]&","&RC[-3]&","&RC[-2]&","&RC[-1]&"}," -> {202021,0,1,10}, | H61: =R[-1]C&RC[-1] -> {200010,0,1,10},{200011,0,1,30},{200012,0,1,30},{200013,0,1,30},{200015,0,1,30},{200016,0,1,30},{200017,0,1,30},{200019,0,1,30},{200020,0,1,2},{200021,0,1,10},{200022,0,1,10},{200023,0,1,10},{200025,0,1,10},{200026,0,1,10},{200027,0,1,10},{200029,0,1,10},{200030,0,1,1},{200031,0,1,3},{200032,0,1,3},{200033,0,1,3},{200035,0,1,3},{200036,0,1,3},{200037,0,1,3},{200039,0,1,3},{201010,0,1,10},{201011,0,1,30},{201012,0,1,30},{201013,0,1,30},{201015,0,1,30},{201016,0,1,30},{201017,0,1,30},{201019,0,1,30},{201020,0,1,2},{201021,0,1,10},{201022,0,1,10},{201023,0,1,10},{201025,0,1,10},{201026,0,1,10},{201027,0,1,10},{201029,0,1,10},{201040,0,1,1},{201041,0,1,3},{201042,0,1,3},{201043,0,1,3},{201045,0,1,3},{201046,0,1,3},{201047,0,1,3},{201049,0,1,3},{202010,0,1,10},{202011,0,1,30},{202012,0,1,30},{202013,0,1,30},{202015,0,1,30},{202016,0,1,30},{202017,0,1,30},{202019,0,1,30},{202020,0,1,2},{202021,0,1,10},
A62: 202022 | B62: 天尊项链 | C62: 1 | D62: 0 | E62: 1 | F62: 10 | G62: ="{"&RC[-6]&","&RC[-3]&","&RC[-2]&","&RC[-1]&"}," -> {202022,0,1,10}, | H62: =R[-1]C&RC[-1] -> {200010,0,1,10},{200011,0,1,30},{200012,0,1,30},{200013,0,1,30},{200015,0,1,30},{200016,0,1,30},{200017,0,1,30},{200019,0,1,30},{200020,0,1,2},{200021,0,1,10},{200022,0,1,10},{200023,0,1,10},{200025,0,1,10},{200026,0,1,10},{200027,0,1,10},{200029,0,1,10},{200030,0,1,1},{200031,0,1,3},{200032,0,1,3},{200033,0,1,3},{200035,0,1,3},{200036,0,1,3},{200037,0,1,3},{200039,0,1,3},{201010,0,1,10},{201011,0,1,30},{201012,0,1,30},{201013,0,1,30},{201015,0,1,30},{201016,0,1,30},{201017,0,1,30},{201019,0,1,30},{201020,0,1,2},{201021,0,1,10},{201022,0,1,10},{201023,0,1,10},{201025,0,1,10},{201026,0,1,10},{201027,0,1,10},{201029,0,1,10},{201040,0,1,1},{201041,0,1,3},{201042,0,1,3},{201043,0,1,3},{201045,0,1,3},{201046,0,1,3},{201047,0,1,3},{201049,0,1,3},{202010,0,1,10},{202011,0,1,30},{202012,0,1,30},{202013,0,1,30},{202015,0,1,30},{202016,0,1,30},{202017,0,1,30},{202019,0,1,30},{202020,0,1,2},{202021,0,1,10},{202022,0,1,10},
A63: 202023 | B63: 天尊戒指 | C63: 1 | D63: 0 | E63: 1 | F63: 10 | G63: ="{"&RC[-6]&","&RC[-3]&","&RC[-2]&","&RC[-1]&"}," -> {202023,0,1,10}, | H63: =R[-1]C&RC[-1] -> {200010,0,1,10},{200011,0,1,30},{200012,0,1,30},{200013,0,1,30},{200015,0,1,30},{200016,0,1,30},{200017,0,1,30},{200019,0,1,30},{200020,0,1,2},{200021,0,1,10},{200022,0,1,10},{200023,0,1,10},{200025,0,1,10},{200026,0,1,10},{200027,0,1,10},{200029,0,1,10},{200030,0,1,1},{200031,0,1,3},{200032,0,1,3},{200033,0,1,3},{200035,0,1,3},{200036,0,1,3},{200037,0,1,3},{200039,0,1,3},{201010,0,1,10},{201011,0,1,30},{201012,0,1,30},{201013,0,1,30},{201015,0,1,30},{201016,0,1,30},{201017,0,1,30},{201019,0,1,30},{201020,0,1,2},{201021,0,1,10},{201022,0,1,10},{201023,0,1,10},{201025,0,1,10},{201026,0,1,10},{201027,0,1,10},{201029,0,1,10},{201040,0,1,1},{201041,0,1,3},{201042,0,1,3},{201043,0,1,3},{201045,0,1,3},{201046,0,1,3},{201047,0,1,3},{201049,0,1,3},{202010,0,1,10},{202011,0,1,30},{202012,0,1,30},{202013,0,1,30},{202015,0,1,30},{202016,0,1,30},{202017,0,1,30},{202019,0,1,30},{202020,0,1,2},{202021,0,1,10},{202022,0,1,10},{202023,0,1,10},
A64: 202025 | B64: 天尊头盔 | C64: 1 | D64: 0 | E64: 1 | F64: 10 | G64: ="{"&RC[-6]&","&RC[-3]&","&RC[-2]&","&RC[-1]&"}," -> {202025,0,1,10}, | H64: =R[-1]C&RC[-1] -> {200010,0,1,10},{200011,0,1,30},{200012,0,1,30},{200013,0,1,30},{200015,0,1,30},{200016,0,1,30},{200017,0,1,30},{200019,0,1,30},{200020,0,1,2},{200021,0,1,10},{200022,0,1,10},{200023,0,1,10},{200025,0,1,10},{200026,0,1,10},{200027,0,1,10},{200029,0,1,10},{200030,0,1,1},{200031,0,1,3},{200032,0,1,3},{200033,0,1,3},{200035,0,1,3},{200036,0,1,3},{200037,0,1,3},{200039,0,1,3},{201010,0,1,10},{201011,0,1,30},{201012,0,1,30},{201013,0,1,30},{201015,0,1,30},{201016,0,1,30},{201017,0,1,30},{201019,0,1,30},{201020,0,1,2},{201021,0,1,10},{201022,0,1,10},{201023,0,1,10},{201025,0,1,10},{201026,0,1,10},{201027,0,1,10},{201029,0,1,10},{201040,0,1,1},{201041,0,1,3},{201042,0,1,3},{201043,0,1,3},{201045,0,1,3},{201046,0,1,3},{201047,0,1,3},{201049,0,1,3},{202010,0,1,10},{202011,0,1,30},{202012,0,1,30},{202013,0,1,30},{202015,0,1,30},{202016,0,1,30},{202017,0,1,30},{202019,0,1,30},{202020,0,1,2},{202021,0,1,10},{202022,0,1,10},{202023,0,1,10},{202025,0,1,10},
A65: 202026 | B65: 天尊手镯 | C65: 1 | D65: 0 | E65: 1 | F65: 10 | G65: ="{"&RC[-6]&","&RC[-3]&","&RC[-2]&","&RC[-1]&"}," -> {202026,0,1,10}, | H65: =R[-1]C&RC[-1] -> {200010,0,1,10},{200011,0,1,30},{200012,0,1,30},{200013,0,1,30},{200015,0,1,30},{200016,0,1,30},{200017,0,1,30},{200019,0,1,30},{200020,0,1,2},{200021,0,1,10},{200022,0,1,10},{200023,0,1,10},{200025,0,1,10},{200026,0,1,10},{200027,0,1,10},{200029,0,1,10},{200030,0,1,1},{200031,0,1,3},{200032,0,1,3},{200033,0,1,3},{200035,0,1,3},{200036,0,1,3},{200037,0,1,3},{200039,0,1,3},{201010,0,1,10},{201011,0,1,30},{201012,0,1,30},{201013,0,1,30},{201015,0,1,30},{201016,0,1,30},{201017,0,1,30},{201019,0,1,30},{201020,0,1,2},{201021,0,1,10},{201022,0,1,10},{201023,0,1,10},{201025,0,1,10},{201026,0,1,10},{201027,0,1,10},{201029,0,1,10},{201040,0,1,1},{201041,0,1,3},{201042,0,1,3},{201043,0,1,3},{201045,0,1,3},{201046,0,1,3},{201047,0,1,3},{201049,0,1,3},{202010,0,1,10},{202011,0,1,30},{202012,0,1,30},{202013,0,1,30},{202015,0,1,30},{202016,0,1,30},{202017,0,1,30},{202019,0,1,30},{202020,0,1,2},{202021,0,1,10},{202022,0,1,10},{202023,0,1,10},{202025,0,1,10},{202026,0,1,10},
A66: 202027 | B66: 天尊腰带 | C66: 1 | D66: 0 | E66: 1 | F66: 10 | G66: ="{"&RC[-6]&","&RC[-3]&","&RC[-2]&","&RC[-1]&"}," -> {202027,0,1,10}, | H66: =R[-1]C&RC[-1] -> {200010,0,1,10},{200011,0,1,30},{200012,0,1,30},{200013,0,1,30},{200015,0,1,30},{200016,0,1,30},{200017,0,1,30},{200019,0,1,30},{200020,0,1,2},{200021,0,1,10},{200022,0,1,10},{200023,0,1,10},{200025,0,1,10},{200026,0,1,10},{200027,0,1,10},{200029,0,1,10},{200030,0,1,1},{200031,0,1,3},{200032,0,1,3},{200033,0,1,3},{200035,0,1,3},{200036,0,1,3},{200037,0,1,3},{200039,0,1,3},{201010,0,1,10},{201011,0,1,30},{201012,0,1,30},{201013,0,1,30},{201015,0,1,30},{201016,0,1,30},{201017,0,1,30},{201019,0,1,30},{201020,0,1,2},{201021,0,1,10},{201022,0,1,10},{201023,0,1,10},{201025,0,1,10},{201026,0,1,10},{201027,0,1,10},{201029,0,1,10},{201040,0,1,1},{201041,0,1,3},{201042,0,1,3},{201043,0,1,3},{201045,0,1,3},{201046,0,1,3},{201047,0,1,3},{201049,0,1,3},{202010,0,1,10},{202011,0,1,30},{202012,0,1,30},{202013,0,1,30},{202015,0,1,30},{202016,0,1,30},{202017,0,1,30},{202019,0,1,30},{202020,0,1,2},{202021,0,1,10},{202022,0,1,10},{202023,0,1,10},{202025,0,1,10},{202026,0,1,10},{202027,0,1,10},
A67: 202029 | B67: 天尊鞋子 | C67: 1 | D67: 0 | E67: 1 | F67: 10 | G67: ="{"&RC[-6]&","&RC[-3]&","&RC[-2]&","&RC[-1]&"}," -> {202029,0,1,10}, | H67: =R[-1]C&RC[-1] -> {200010,0,1,10},{200011,0,1,30},{200012,0,1,30},{200013,0,1,30},{200015,0,1,30},{200016,0,1,30},{200017,0,1,30},{200019,0,1,30},{200020,0,1,2},{200021,0,1,10},{200022,0,1,10},{200023,0,1,10},{200025,0,1,10},{200026,0,1,10},{200027,0,1,10},{200029,0,1,10},{200030,0,1,1},{200031,0,1,3},{200032,0,1,3},{200033,0,1,3},{200035,0,1,3},{200036,0,1,3},{200037,0,1,3},{200039,0,1,3},{201010,0,1,10},{201011,0,1,30},{201012,0,1,30},{201013,0,1,30},{201015,0,1,30},{201016,0,1,30},{201017,0,1,30},{201019,0,1,30},{201020,0,1,2},{201021,0,1,10},{201022,0,1,10},{201023,0,1,10},{201025,0,1,10},{201026,0,1,10},{201027,0,1,10},{201029,0,1,10},{201040,0,1,1},{201041,0,1,3},{201042,0,1,3},{201043,0,1,3},{201045,0,1,3},{201046,0,1,3},{201047,0,1,3},{201049,0,1,3},{202010,0,1,10},{202011,0,1,30},{202012,0,1,30},{202013,0,1,30},{202015,0,1,30},{202016,0,1,30},{202017,0,1,30},{202019,0,1,30},{202020,0,1,2},{202021,0,1,10},{202022,0,1,10},{202023,0,1,10},{202025,0,1,10},{202026,0,1,10},{202027,0,1,10},{202029,0,1,10},
A68: 202030 | B68: 玄天 | C68: 1 | D68: 0 | E68: 1 | F68: 1 | G68: ="{"&RC[-6]&","&RC[-3]&","&RC[-2]&","&RC[-1]&"}," -> {202030,0,1,1}, | H68: =R[-1]C&RC[-1] -> {200010,0,1,10},{200011,0,1,30},{200012,0,1,30},{200013,0,1,30},{200015,0,1,30},{200016,0,1,30},{200017,0,1,30},{200019,0,1,30},{200020,0,1,2},{200021,0,1,10},{200022,0,1,10},{200023,0,1,10},{200025,0,1,10},{200026,0,1,10},{200027,0,1,10},{200029,0,1,10},{200030,0,1,1},{200031,0,1,3},{200032,0,1,3},{200033,0,1,3},{200035,0,1,3},{200036,0,1,3},{200037,0,1,3},{200039,0,1,3},{201010,0,1,10},{201011,0,1,30},{201012,0,1,30},{201013,0,1,30},{201015,0,1,30},{201016,0,1,30},{201017,0,1,30},{201019,0,1,30},{201020,0,1,2},{201021,0,1,10},{201022,0,1,10},{201023,0,1,10},{201025,0,1,10},{201026,0,1,10},{201027,0,1,10},{201029,0,1,10},{201040,0,1,1},{201041,0,1,3},{201042,0,1,3},{201043,0,1,3},{201045,0,1,3},{201046,0,1,3},{201047,0,1,3},{201049,0,1,3},{202010,0,1,10},{202011,0,1,30},{202012,0,1,30},{202013,0,1,30},{202015,0,1,30},{202016,0,1,30},{202017,0,1,30},{202019,0,1,30},{202020,0,1,2},{202021,0,1,10},{202022,0,1,10},{202023,0,1,10},{202025,0,1,10},{202026,0,1,10},{202027,0,1,10},{202029,0,1,10},{202030,0,1,1},
A69: 202031 | B69: 光芒道袍 | C69: 1 | D69: 0 | E69: 1 | F69: 3 | G69: ="{"&RC[-6]&","&RC[-3]&","&RC[-2]&","&RC[-1]&"}," -> {202031,0,1,3}, | H69: =R[-1]C&RC[-1] -> {200010,0,1,10},{200011,0,1,30},{200012,0,1,30},{200013,0,1,30},{200015,0,1,30},{200016,0,1,30},{200017,0,1,30},{200019,0,1,30},{200020,0,1,2},{200021,0,1,10},{200022,0,1,10},{200023,0,1,10},{200025,0,1,10},{200026,0,1,10},{200027,0,1,10},{200029,0,1,10},{200030,0,1,1},{200031,0,1,3},{200032,0,1,3},{200033,0,1,3},{200035,0,1,3},{200036,0,1,3},{200037,0,1,3},{200039,0,1,3},{201010,0,1,10},{201011,0,1,30},{201012,0,1,30},{201013,0,1,30},{201015,0,1,30},{201016,0,1,30},{201017,0,1,30},{201019,0,1,30},{201020,0,1,2},{201021,0,1,10},{201022,0,1,10},{201023,0,1,10},{201025,0,1,10},{201026,0,1,10},{201027,0,1,10},{201029,0,1,10},{201040,0,1,1},{201041,0,1,3},{201042,0,1,3},{201043,0,1,3},{201045,0,1,3},{201046,0,1,3},{201047,0,1,3},{201049,0,1,3},{202010,0,1,10},{202011,0,1,30},{202012,0,1,30},{202013,0,1,30},{202015,0,1,30},{202016,0,1,30},{202017,0,1,30},{202019,0,1,30},{202020,0,1,2},{202021,0,1,10},{202022,0,1,10},{202023,0,1,10},{202025,0,1,10},{202026,0,1,10},{202027,0,1,10},{202029,0,1,10},{202030,0,1,1},{202031,0,1,3},
A70: 202032 | B70: 光芒道链 | C70: 1 | D70: 0 | E70: 1 | F70: 3 | G70: ="{"&RC[-6]&","&RC[-3]&","&RC[-2]&","&RC[-1]&"}," -> {202032,0,1,3}, | H70: =R[-1]C&RC[-1] -> {200010,0,1,10},{200011,0,1,30},{200012,0,1,30},{200013,0,1,30},{200015,0,1,30},{200016,0,1,30},{200017,0,1,30},{200019,0,1,30},{200020,0,1,2},{200021,0,1,10},{200022,0,1,10},{200023,0,1,10},{200025,0,1,10},{200026,0,1,10},{200027,0,1,10},{200029,0,1,10},{200030,0,1,1},{200031,0,1,3},{200032,0,1,3},{200033,0,1,3},{200035,0,1,3},{200036,0,1,3},{200037,0,1,3},{200039,0,1,3},{201010,0,1,10},{201011,0,1,30},{201012,0,1,30},{201013,0,1,30},{201015,0,1,30},{201016,0,1,30},{201017,0,1,30},{201019,0,1,30},{201020,0,1,2},{201021,0,1,10},{201022,0,1,10},{201023,0,1,10},{201025,0,1,10},{201026,0,1,10},{201027,0,1,10},{201029,0,1,10},{201040,0,1,1},{201041,0,1,3},{201042,0,1,3},{201043,0,1,3},{201045,0,1,3},{201046,0,1,3},{201047,0,1,3},{201049,0,1,3},{202010,0,1,10},{202011,0,1,30},{202012,0,1,30},{202013,0,1,30},{202015,0,1,30},{202016,0,1,30},{202017,0,1,30},{202019,0,1,30},{202020,0,1,2},{202021,0,1,10},{202022,0,1,10},{202023,0,1,10},{202025,0,1,10},{202026,0,1,10},{202027,0,1,10},{202029,0,1,10},{202030,0,1,1},{202031,0,1,3},{202032,0,1,3},
A71: 202033 | B71: 光芒道戒 | C71: 1 | D71: 0 | E71: 1 | F71: 3 | G71: ="{"&RC[-6]&","&RC[-3]&","&RC[-2]&","&RC[-1]&"}," -> {202033,0,1,3}, | H71: =R[-1]C&RC[-1] -> {200010,0,1,10},{200011,0,1,30},{200012,0,1,30},{200013,0,1,30},{200015,0,1,30},{200016,0,1,30},{200017,0,1,30},{200019,0,1,30},{200020,0,1,2},{200021,0,1,10},{200022,0,1,10},{200023,0,1,10},{200025,0,1,10},{200026,0,1,10},{200027,0,1,10},{200029,0,1,10},{200030,0,1,1},{200031,0,1,3},{200032,0,1,3},{200033,0,1,3},{200035,0,1,3},{200036,0,1,3},{200037,0,1,3},{200039,0,1,3},{201010,0,1,10},{201011,0,1,30},{201012,0,1,30},{201013,0,1,30},{201015,0,1,30},{201016,0,1,30},{201017,0,1,30},{201019,0,1,30},{201020,0,1,2},{201021,0,1,10},{201022,0,1,10},{201023,0,1,10},{201025,0,1,10},{201026,0,1,10},{201027,0,1,10},{201029,0,1,10},{201040,0,1,1},{201041,0,1,3},{201042,0,1,3},{201043,0,1,3},{201045,0,1,3},{201046,0,1,3},{201047,0,1,3},{201049,0,1,3},{202010,0,1,10},{202011,0,1,30},{202012,0,1,30},{202013,0,1,30},{202015,0,1,30},{202016,0,1,30},{202017,0,1,30},{202019,0,1,30},{202020,0,1,2},{202021,0,1,10},{202022,0,1,10},{202023,0,1,10},{202025,0,1,10},{202026,0,1,10},{202027,0,1,10},{202029,0,1,10},{202030,0,1,1},{202031,0,1,3},{202032,0,1,3},{202033,0,1,3},
A72: 202035 | B72: 光芒头盔 | C72: 1 | D72: 0 | E72: 1 | F72: 3 | G72: ="{"&RC[-6]&","&RC[-3]&","&RC[-2]&","&RC[-1]&"}," -> {202035,0,1,3}, | H72: =R[-1]C&RC[-1] -> {200010,0,1,10},{200011,0,1,30},{200012,0,1,30},{200013,0,1,30},{200015,0,1,30},{200016,0,1,30},{200017,0,1,30},{200019,0,1,30},{200020,0,1,2},{200021,0,1,10},{200022,0,1,10},{200023,0,1,10},{200025,0,1,10},{200026,0,1,10},{200027,0,1,10},{200029,0,1,10},{200030,0,1,1},{200031,0,1,3},{200032,0,1,3},{200033,0,1,3},{200035,0,1,3},{200036,0,1,3},{200037,0,1,3},{200039,0,1,3},{201010,0,1,10},{201011,0,1,30},{201012,0,1,30},{201013,0,1,30},{201015,0,1,30},{201016,0,1,30},{201017,0,1,30},{201019,0,1,30},{201020,0,1,2},{201021,0,1,10},{201022,0,1,10},{201023,0,1,10},{201025,0,1,10},{201026,0,1,10},{201027,0,1,10},{201029,0,1,10},{201040,0,1,1},{201041,0,1,3},{201042,0,1,3},{201043,0,1,3},{201045,0,1,3},{201046,0,1,3},{201047,0,1,3},{201049,0,1,3},{202010,0,1,10},{202011,0,1,30},{202012,0,1,30},{202013,0,1,30},{202015,0,1,30},{202016,0,1,30},{202017,0,1,30},{202019,0,1,30},{202020,0,1,2},{202021,0,1,10},{202022,0,1,10},{202023,0,1,10},{202025,0,1,10},{202026,0,1,10},{202027,0,1,10},{202029,0,1,10},{202030,0,1,1},{202031,0,1,3},{202032,0,1,3},{202033,0,1,3},{202035,0,1,3},
A73: 202036 | B73: 光芒护腕 | C73: 1 | D73: 0 | E73: 1 | F73: 3 | G73: ="{"&RC[-6]&","&RC[-3]&","&RC[-2]&","&RC[-1]&"}," -> {202036,0,1,3}, | H73: =R[-1]C&RC[-1] -> {200010,0,1,10},{200011,0,1,30},{200012,0,1,30},{200013,0,1,30},{200015,0,1,30},{200016,0,1,30},{200017,0,1,30},{200019,0,1,30},{200020,0,1,2},{200021,0,1,10},{200022,0,1,10},{200023,0,1,10},{200025,0,1,10},{200026,0,1,10},{200027,0,1,10},{200029,0,1,10},{200030,0,1,1},{200031,0,1,3},{200032,0,1,3},{200033,0,1,3},{200035,0,1,3},{200036,0,1,3},{200037,0,1,3},{200039,0,1,3},{201010,0,1,10},{201011,0,1,30},{201012,0,1,30},{201013,0,1,30},{201015,0,1,30},{201016,0,1,30},{201017,0,1,30},{201019,0,1,30},{201020,0,1,2},{201021,0,1,10},{201022,0,1,10},{201023,0,1,10},{201025,0,1,10},{201026,0,1,10},{201027,0,1,10},{201029,0,1,10},{201040,0,1,1},{201041,0,1,3},{201042,0,1,3},{201043,0,1,3},{201045,0,1,3},{201046,0,1,3},{201047,0,1,3},{201049,0,1,3},{202010,0,1,10},{202011,0,1,30},{202012,0,1,30},{202013,0,1,30},{202015,0,1,30},{202016,0,1,30},{202017,0,1,30},{202019,0,1,30},{202020,0,1,2},{202021,0,1,10},{202022,0,1,10},{202023,0,1,10},{202025,0,1,10},{202026,0,1,10},{202027,0,1,10},{202029,0,1,10},{202030,0,1,1},{202031,0,1,3},{202032,0,1,3},{202033,0,1,3},{202035,0,1,3},{202036,0,1,3},
A74: 202037 | B74: 光芒腰带 | C74: 1 | D74: 0 | E74: 1 | F74: 3 | G74: ="{"&RC[-6]&","&RC[-3]&","&RC[-2]&","&RC[-1]&"}," -> {202037,0,1,3}, | H74: =R[-1]C&RC[-1] -> {200010,0,1,10},{200011,0,1,30},{200012,0,1,30},{200013,0,1,30},{200015,0,1,30},{200016,0,1,30},{200017,0,1,30},{200019,0,1,30},{200020,0,1,2},{200021,0,1,10},{200022,0,1,10},{200023,0,1,10},{200025,0,1,10},{200026,0,1,10},{200027,0,1,10},{200029,0,1,10},{200030,0,1,1},{200031,0,1,3},{200032,0,1,3},{200033,0,1,3},{200035,0,1,3},{200036,0,1,3},{200037,0,1,3},{200039,0,1,3},{201010,0,1,10},{201011,0,1,30},{201012,0,1,30},{201013,0,1,30},{201015,0,1,30},{201016,0,1,30},{201017,0,1,30},{201019,0,1,30},{201020,0,1,2},{201021,0,1,10},{201022,0,1,10},{201023,0,1,10},{201025,0,1,10},{201026,0,1,10},{201027,0,1,10},{201029,0,1,10},{201040,0,1,1},{201041,0,1,3},{201042,0,1,3},{201043,0,1,3},{201045,0,1,3},{201046,0,1,3},{201047,0,1,3},{201049,0,1,3},{202010,0,1,10},{202011,0,1,30},{202012,0,1,30},{202013,0,1,30},{202015,0,1,30},{202016,0,1,30},{202017,0,1,30},{202019,0,1,30},{202020,0,1,2},{202021,0,1,10},{202022,0,1,10},{202023,0,1,10},{202025,0,1,10},{202026,0,1,10},{202027,0,1,10},{202029,0,1,10},{202030,0,1,1},{202031,0,1,3},{202032,0,1,3},{202033,0,1,3},{202035,0,1,3},{202036,0,1,3},{202037,0,1,3},
A75: 202039 | B75: 光芒道靴 | C75: 1 | D75: 0 | E75: 1 | F75: 3 | G75: ="{"&RC[-6]&","&RC[-3]&","&RC[-2]&","&RC[-1]&"}," -> {202039,0,1,3}, | H75: =R[-1]C&RC[-1] -> {200010,0,1,10},{200011,0,1,30},{200012,0,1,30},{200013,0,1,30},{200015,0,1,30},{200016,0,1,30},{200017,0,1,30},{200019,0,1,30},{200020,0,1,2},{200021,0,1,10},{200022,0,1,10},{200023,0,1,10},{200025,0,1,10},{200026,0,1,10},{200027,0,1,10},{200029,0,1,10},{200030,0,1,1},{200031,0,1,3},{200032,0,1,3},{200033,0,1,3},{200035,0,1,3},{200036,0,1,3},{200037,0,1,3},{200039,0,1,3},{201010,0,1,10},{201011,0,1,30},{201012,0,1,30},{201013,0,1,30},{201015,0,1,30},{201016,0,1,30},{201017,0,1,30},{201019,0,1,30},{201020,0,1,2},{201021,0,1,10},{201022,0,1,10},{201023,0,1,10},{201025,0,1,10},{201026,0,1,10},{201027,0,1,10},{201029,0,1,10},{201040,0,1,1},{201041,0,1,3},{201042,0,1,3},{201043,0,1,3},{201045,0,1,3},{201046,0,1,3},{201047,0,1,3},{201049,0,1,3},{202010,0,1,10},{202011,0,1,30},{202012,0,1,30},{202013,0,1,30},{202015,0,1,30},{202016,0,1,30},{202017,0,1,30},{202019,0,1,30},{202020,0,1,2},{202021,0,1,10},{202022,0,1,10},{202023,0,1,10},{202025,0,1,10},{202026,0,1,10},{202027,0,1,10},{202029,0,1,10},{202030,0,1,1},{202031,0,1,3},{202032,0,1,3},{202033,0,1,3},{202035,0,1,3},{202036,0,1,3},{202037,0,1,3},{202039,0,1,3},
A76: 305003 | B76: 怒斩 | C76: 1 | D76: 0 | E76: 1 | F76: 2 | G76: ="{"&RC[-6]&","&RC[-3]&","&RC[-2]&","&RC[-1]&"}," -> {305003,0,1,2}, | H76: =R[-1]C&RC[-1] -> {200010,0,1,10},{200011,0,1,30},{200012,0,1,30},{200013,0,1,30},{200015,0,1,30},{200016,0,1,30},{200017,0,1,30},{200019,0,1,30},{200020,0,1,2},{200021,0,1,10},{200022,0,1,10},{200023,0,1,10},{200025,0,1,10},{200026,0,1,10},{200027,0,1,10},{200029,0,1,10},{200030,0,1,1},{200031,0,1,3},{200032,0,1,3},{200033,0,1,3},{200035,0,1,3},{200036,0,1,3},{200037,0,1,3},{200039,0,1,3},{201010,0,1,10},{201011,0,1,30},{201012,0,1,30},{201013,0,1,30},{201015,0,1,30},{201016,0,1,30},{201017,0,1,30},{201019,0,1,30},{201020,0,1,2},{201021,0,1,10},{201022,0,1,10},{201023,0,1,10},{201025,0,1,10},{201026,0,1,10},{201027,0,1,10},{201029,0,1,10},{201040,0,1,1},{201041,0,1,3},{201042,0,1,3},{201043,0,1,3},{201045,0,1,3},{201046,0,1,3},{201047,0,1,3},{201049,0,1,3},{202010,0,1,10},{202011,0,1,30},{202012,0,1,30},{202013,0,1,30},{202015,0,1,30},{202016,0,1,30},{202017,0,1,30},{202019,0,1,30},{202020,0,1,2},{202021,0,1,10},{202022,0,1,10},{202023,0,1,10},{202025,0,1,10},{202026,0,1,10},{202027,0,1,10},{202029,0,1,10},{202030,0,1,1},{202031,0,1,3},{202032,0,1,3},{202033,0,1,3},{202035,0,1,3},{202036,0,1,3},{202037,0,1,3},{202039,0,1,3},{305003,0,1,2},
A77: 305004 | B77: 龙牙 | C77: 1 | D77: 0 | E77: 1 | F77: 2 | G77: ="{"&RC[-6]&","&RC[-3]&","&RC[-2]&","&RC[-1]&"}," -> {305004,0,1,2}, | H77: =R[-1]C&RC[-1] -> {200010,0,1,10},{200011,0,1,30},{200012,0,1,30},{200013,0,1,30},{200015,0,1,30},{200016,0,1,30},{200017,0,1,30},{200019,0,1,30},{200020,0,1,2},{200021,0,1,10},{200022,0,1,10},{200023,0,1,10},{200025,0,1,10},{200026,0,1,10},{200027,0,1,10},{200029,0,1,10},{200030,0,1,1},{200031,0,1,3},{200032,0,1,3},{200033,0,1,3},{200035,0,1,3},{200036,0,1,3},{200037,0,1,3},{200039,0,1,3},{201010,0,1,10},{201011,0,1,30},{201012,0,1,30},{201013,0,1,30},{201015,0,1,30},{201016,0,1,30},{201017,0,1,30},{201019,0,1,30},{201020,0,1,2},{201021,0,1,10},{201022,0,1,10},{201023,0,1,10},{201025,0,1,10},{201026,0,1,10},{201027,0,1,10},{201029,0,1,10},{201040,0,1,1},{201041,0,1,3},{201042,0,1,3},{201043,0,1,3},{201045,0,1,3},{201046,0,1,3},{201047,0,1,3},{201049,0,1,3},{202010,0,1,10},{202011,0,1,30},{202012,0,1,30},{202013,0,1,30},{202015,0,1,30},{202016,0,1,30},{202017,0,1,30},{202019,0,1,30},{202020,0,1,2},{202021,0,1,10},{202022,0,1,10},{202023,0,1,10},{202025,0,1,10},{202026,0,1,10},{202027,0,1,10},{202029,0,1,10},{202030,0,1,1},{202031,0,1,3},{202032,0,1,3},{202033,0,1,3},{202035,0,1,3},{202036,0,1,3},{202037,0,1,3},{202039,0,1,3},{305003,0,1,2},{305004,0,1,2},
A78: 305005 | B78: 逍遥扇 | C78: 1 | D78: 0 | E78: 1 | F78: 2 | G78: ="{"&RC[-6]&","&RC[-3]&","&RC[-2]&","&RC[-1]&"}" -> {305005,0,1,2} | H78: =R[-1]C&RC[-1] -> {200010,0,1,10},{200011,0,1,30},{200012,0,1,30},{200013,0,1,30},{200015,0,1,30},{200016,0,1,30},{200017,0,1,30},{200019,0,1,30},{200020,0,1,2},{200021,0,1,10},{200022,0,1,10},{200023,0,1,10},{200025,0,1,10},{200026,0,1,10},{200027,0,1,10},{200029,0,1,10},{200030,0,1,1},{200031,0,1,3},{200032,0,1,3},{200033,0,1,3},{200035,0,1,3},{200036,0,1,3},{200037,0,1,3},{200039,0,1,3},{201010,0,1,10},{201011,0,1,30},{201012,0,1,30},{201013,0,1,30},{201015,0,1,30},{201016,0,1,30},{201017,0,1,30},{201019,0,1,30},{201020,0,1,2},{201021,0,1,10},{201022,0,1,10},{201023,0,1,10},{201025,0,1,10},{201026,0,1,10},{201027,0,1,10},{201029,0,1,10},{201040,0,1,1},{201041,0,1,3},{201042,0,1,3},{201043,0,1,3},{201045,0,1,3},{201046,0,1,3},{201047,0,1,3},{201049,0,1,3},{202010,0,1,10},{202011,0,1,30},{202012,0,1,30},{202013,0,1,30},{202015,0,1,30},{202016,0,1,30},{202017,0,1,30},{202019,0,1,30},{202020,0,1,2},{202021,0,1,10},{202022,0,1,10},{202023,0,1,10},{202025,0,1,10},{202026,0,1,10},{202027,0,1,10},{202029,0,1,10},{202030,0,1,1},{202031,0,1,3},{202032,0,1,3},{202033,0,1,3},{202035,0,1,3},{202036,0,1,3},{202037,0,1,3},{202039,0,1,3},{305003,0,1,2},{305004,0,1,2},{305005,0,1,2}
A81: 200040 | B81: 开天（沙） | C81: 1 | D81: 0 | E81: 1 | F81: 1 | G81: ="{"&RC[-6]&","&RC[-3]&","&RC[-2]&","&RC[-1]&"}," -> {200040,0,1,1}, | H81: =RC[-1] -> {200040,0,1,1},
A82: 200041 | B82: 雷霆战甲（沙） | C82: 1 | D82: 0 | E82: 1 | F82: 10 | G82: ="{"&RC[-6]&","&RC[-3]&","&RC[-2]&","&RC[-1]&"}," -> {200041,0,1,10}, | H82: =R[-1]C&RC[-1] -> {200040,0,1,1},{200041,0,1,10},
A83: 200042 | B83: 雷霆项链（沙） | C83: 1 | D83: 0 | E83: 1 | F83: 10 | G83: ="{"&RC[-6]&","&RC[-3]&","&RC[-2]&","&RC[-1]&"}," -> {200042,0,1,10}, | H83: =R[-1]C&RC[-1] -> {200040,0,1,1},{200041,0,1,10},{200042,0,1,10},
A84: 200043 | B84: 雷霆戒指（沙） | C84: 1 | D84: 0 | E84: 1 | F84: 10 | G84: ="{"&RC[-6]&","&RC[-3]&","&RC[-2]&","&RC[-1]&"}," -> {200043,0,1,10}, | H84: =R[-1]C&RC[-1] -> {200040,0,1,1},{200041,0,1,10},{200042,0,1,10},{200043,0,1,10},
A85: 200045 | B85: 雷霆头盔（沙） | C85: 1 | D85: 0 | E85: 1 | F85: 10 | G85: ="{"&RC[-6]&","&RC[-3]&","&RC[-2]&","&RC[-1]&"}," -> {200045,0,1,10}, | H85: =R[-1]C&RC[-1] -> {200040,0,1,1},{200041,0,1,10},{200042,0,1,10},{200043,0,1,10},{200045,0,1,10},
A86: 200046 | B86: 雷霆护腕（沙） | C86: 1 | D86: 0 | E86: 1 | F86: 10 | G86: ="{"&RC[-6]&","&RC[-3]&","&RC[-2]&","&RC[-1]&"}," -> {200046,0,1,10}, | H86: =R[-1]C&RC[-1] -> {200040,0,1,1},{200041,0,1,10},{200042,0,1,10},{200043,0,1,10},{200045,0,1,10},{200046,0,1,10},
A87: 200047 | B87: 雷霆腰带（沙） | C87: 1 | D87: 0 | E87: 1 | F87: 10 | G87: ="{"&RC[-6]&","&RC[-3]&","&RC[-2]&","&RC[-1]&"}," -> {200047,0,1,10}, | H87: =R[-1]C&RC[-1] -> {200040,0,1,1},{200041,0,1,10},{200042,0,1,10},{200043,0,1,10},{200045,0,1,10},{200046,0,1,10},{200047,0,1,10},
A88: 200049 | B88: 雷霆战靴（沙） | C88: 1 | D88: 0 | E88: 1 | F88: 10 | G88: ="{"&RC[-6]&","&RC[-3]&","&RC[-2]&","&RC[-1]&"}," -> {200049,0,1,10}, | H88: =R[-1]C&RC[-1] -> {200040,0,1,1},{200041,0,1,10},{200042,0,1,10},{200043,0,1,10},{200045,0,1,10},{200046,0,1,10},{200047,0,1,10},{200049,0,1,10},
A89: 201040 | B89: 震天（沙） | C89: 1 | D89: 0 | E89: 1 | F89: 1 | G89: ="{"&RC[-6]&","&RC[-3]&","&RC[-2]&","&RC[-1]&"}," -> {201040,0,1,1}, | H89: =R[-1]C&RC[-1] -> {200040,0,1,1},{200041,0,1,10},{200042,0,1,10},{200043,0,1,10},{200045,0,1,10},{200046,0,1,10},{200047,0,1,10},{200049,0,1,10},{201040,0,1,1},
A90: 201041 | B90: 烈焰法袍（沙） | C90: 1 | D90: 0 | E90: 1 | F90: 10 | G90: ="{"&RC[-6]&","&RC[-3]&","&RC[-2]&","&RC[-1]&"}," -> {201041,0,1,10}, | H90: =R[-1]C&RC[-1] -> {200040,0,1,1},{200041,0,1,10},{200042,0,1,10},{200043,0,1,10},{200045,0,1,10},{200046,0,1,10},{200047,0,1,10},{200049,0,1,10},{201040,0,1,1},{201041,0,1,10},
A91: 201042 | B91: 烈焰魔链（沙） | C91: 1 | D91: 0 | E91: 1 | F91: 10 | G91: ="{"&RC[-6]&","&RC[-3]&","&RC[-2]&","&RC[-1]&"}," -> {201042,0,1,10}, | H91: =R[-1]C&RC[-1] -> {200040,0,1,1},{200041,0,1,10},{200042,0,1,10},{200043,0,1,10},{200045,0,1,10},{200046,0,1,10},{200047,0,1,10},{200049,0,1,10},{201040,0,1,1},{201041,0,1,10},{201042,0,1,10},
A92: 201043 | B92: 烈焰魔指（沙） | C92: 1 | D92: 0 | E92: 1 | F92: 10 | G92: ="{"&RC[-6]&","&RC[-3]&","&RC[-2]&","&RC[-1]&"}," -> {201043,0,1,10}, | H92: =R[-1]C&RC[-1] -> {200040,0,1,1},{200041,0,1,10},{200042,0,1,10},{200043,0,1,10},{200045,0,1,10},{200046,0,1,10},{200047,0,1,10},{200049,0,1,10},{201040,0,1,1},{201041,0,1,10},{201042,0,1,10},{201043,0,1,10},
A93: 201045 | B93: 烈焰头盔（沙） | C93: 1 | D93: 0 | E93: 1 | F93: 10 | G93: ="{"&RC[-6]&","&RC[-3]&","&RC[-2]&","&RC[-1]&"}," -> {201045,0,1,10}, | H93: =R[-1]C&RC[-1] -> {200040,0,1,1},{200041,0,1,10},{200042,0,1,10},{200043,0,1,10},{200045,0,1,10},{200046,0,1,10},{200047,0,1,10},{200049,0,1,10},{201040,0,1,1},{201041,0,1,10},{201042,0,1,10},{201043,0,1,10},{201045,0,1,10},
A94: 201046 | B94: 烈焰护腕（沙） | C94: 1 | D94: 0 | E94: 1 | F94: 10 | G94: ="{"&RC[-6]&","&RC[-3]&","&RC[-2]&","&RC[-1]&"}," -> {201046,0,1,10}, | H94: =R[-1]C&RC[-1] -> {200040,0,1,1},{200041,0,1,10},{200042,0,1,10},{200043,0,1,10},{200045,0,1,10},{200046,0,1,10},{200047,0,1,10},{200049,0,1,10},{201040,0,1,1},{201041,0,1,10},{201042,0,1,10},{201043,0,1,10},{201045,0,1,10},{201046,0,1,10},
A95: 201047 | B95: 烈焰腰带（沙） | C95: 1 | D95: 0 | E95: 1 | F95: 10 | G95: ="{"&RC[-6]&","&RC[-3]&","&RC[-2]&","&RC[-1]&"}," -> {201047,0,1,10}, | H95: =R[-1]C&RC[-1] -> {200040,0,1,1},{200041,0,1,10},{200042,0,1,10},{200043,0,1,10},{200045,0,1,10},{200046,0,1,10},{200047,0,1,10},{200049,0,1,10},{201040,0,1,1},{201041,0,1,10},{201042,0,1,10},{201043,0,1,10},{201045,0,1,10},{201046,0,1,10},{201047,0,1,10},
A96: 201049 | B96: 烈焰魔靴（沙） | C96: 1 | D96: 0 | E96: 1 | F96: 10 | G96: ="{"&RC[-6]&","&RC[-3]&","&RC[-2]&","&RC[-1]&"}," -> {201049,0,1,10}, | H96: =R[-1]C&RC[-1] -> {200040,0,1,1},{200041,0,1,10},{200042,0,1,10},{200043,0,1,10},{200045,0,1,10},{200046,0,1,10},{200047,0,1,10},{200049,0,1,10},{201040,0,1,1},{201041,0,1,10},{201042,0,1,10},{201043,0,1,10},{201045,0,1,10},{201046,0,1,10},{201047,0,1,10},{201049,0,1,10},
A97: 202040 | B97: 玄天（沙） | C97: 1 | D97: 0 | E97: 1 | F97: 1 | G97: ="{"&RC[-6]&","&RC[-3]&","&RC[-2]&","&RC[-1]&"}," -> {202040,0,1,1}, | H97: =R[-1]C&RC[-1] -> {200040,0,1,1},{200041,0,1,10},{200042,0,1,10},{200043,0,1,10},{200045,0,1,10},{200046,0,1,10},{200047,0,1,10},{200049,0,1,10},{201040,0,1,1},{201041,0,1,10},{201042,0,1,10},{201043,0,1,10},{201045,0,1,10},{201046,0,1,10},{201047,0,1,10},{201049,0,1,10},{202040,0,1,1},
A98: 202041 | B98: 光芒道袍（沙） | C98: 1 | D98: 0 | E98: 1 | F98: 10 | G98: ="{"&RC[-6]&","&RC[-3]&","&RC[-2]&","&RC[-1]&"}," -> {202041,0,1,10}, | H98: =R[-1]C&RC[-1] -> {200040,0,1,1},{200041,0,1,10},{200042,0,1,10},{200043,0,1,10},{200045,0,1,10},{200046,0,1,10},{200047,0,1,10},{200049,0,1,10},{201040,0,1,1},{201041,0,1,10},{201042,0,1,10},{201043,0,1,10},{201045,0,1,10},{201046,0,1,10},{201047,0,1,10},{201049,0,1,10},{202040,0,1,1},{202041,0,1,10},
A99: 202042 | B99: 光芒道链（沙） | C99: 1 | D99: 0 | E99: 1 | F99: 10 | G99: ="{"&RC[-6]&","&RC[-3]&","&RC[-2]&","&RC[-1]&"}," -> {202042,0,1,10}, | H99: =R[-1]C&RC[-1] -> {200040,0,1,1},{200041,0,1,10},{200042,0,1,10},{200043,0,1,10},{200045,0,1,10},{200046,0,1,10},{200047,0,1,10},{200049,0,1,10},{201040,0,1,1},{201041,0,1,10},{201042,0,1,10},{201043,0,1,10},{201045,0,1,10},{201046,0,1,10},{201047,0,1,10},{201049,0,1,10},{202040,0,1,1},{202041,0,1,10},{202042,0,1,10},
A100: 202043 | B100: 光芒道戒（沙） | C100: 1 | D100: 0 | E100: 1 | F100: 10 | G100: ="{"&RC[-6]&","&RC[-3]&","&RC[-2]&","&RC[-1]&"}," -> {202043,0,1,10}, | H100: =R[-1]C&RC[-1] -> {200040,0,1,1},{200041,0,1,10},{200042,0,1,10},{200043,0,1,10},{200045,0,1,10},{200046,0,1,10},{200047,0,1,10},{200049,0,1,10},{201040,0,1,1},{201041,0,1,10},{201042,0,1,10},{201043,0,1,10},{201045,0,1,10},{201046,0,1,10},{201047,0,1,10},{201049,0,1,10},{202040,0,1,1},{202041,0,1,10},{202042,0,1,10},{202043,0,1,10},
A101: 202045 | B101: 光芒头盔（沙） | C101: 1 | D101: 0 | E101: 1 | F101: 10 | G101: ="{"&RC[-6]&","&RC[-3]&","&RC[-2]&","&RC[-1]&"}," -> {202045,0,1,10}, | H101: =R[-1]C&RC[-1] -> {200040,0,1,1},{200041,0,1,10},{200042,0,1,10},{200043,0,1,10},{200045,0,1,10},{200046,0,1,10},{200047,0,1,10},{200049,0,1,10},{201040,0,1,1},{201041,0,1,10},{201042,0,1,10},{201043,0,1,10},{201045,0,1,10},{201046,0,1,10},{201047,0,1,10},{201049,0,1,10},{202040,0,1,1},{202041,0,1,10},{202042,0,1,10},{202043,0,1,10},{202045,0,1,10},
A102: 202046 | B102: 光芒护腕（沙） | C102: 1 | D102: 0 | E102: 1 | F102: 10 | G102: ="{"&RC[-6]&","&RC[-3]&","&RC[-2]&","&RC[-1]&"}," -> {202046,0,1,10}, | H102: =R[-1]C&RC[-1] -> {200040,0,1,1},{200041,0,1,10},{200042,0,1,10},{200043,0,1,10},{200045,0,1,10},{200046,0,1,10},{200047,0,1,10},{200049,0,1,10},{201040,0,1,1},{201041,0,1,10},{201042,0,1,10},{201043,0,1,10},{201045,0,1,10},{201046,0,1,10},{201047,0,1,10},{201049,0,1,10},{202040,0,1,1},{202041,0,1,10},{202042,0,1,10},{202043,0,1,10},{202045,0,1,10},{202046,0,1,10},
A103: 202047 | B103: 光芒腰带（沙） | C103: 1 | D103: 0 | E103: 1 | F103: 10 | G103: ="{"&RC[-6]&","&RC[-3]&","&RC[-2]&","&RC[-1]&"}," -> {202047,0,1,10}, | H103: =R[-1]C&RC[-1] -> {200040,0,1,1},{200041,0,1,10},{200042,0,1,10},{200043,0,1,10},{200045,0,1,10},{200046,0,1,10},{200047,0,1,10},{200049,0,1,10},{201040,0,1,1},{201041,0,1,10},{201042,0,1,10},{201043,0,1,10},{201045,0,1,10},{201046,0,1,10},{201047,0,1,10},{201049,0,1,10},{202040,0,1,1},{202041,0,1,10},{202042,0,1,10},{202043,0,1,10},{202045,0,1,10},{202046,0,1,10},{202047,0,1,10},
A104: 202049 | B104: 光芒道靴（沙） | C104: 1 | D104: 0 | E104: 1 | F104: 10 | G104: ="{"&RC[-6]&","&RC[-3]&","&RC[-2]&","&RC[-1]&"}" -> {202049,0,1,10} | H104: =R[-1]C&RC[-1] -> {200040,0,1,1},{200041,0,1,10},{200042,0,1,10},{200043,0,1,10},{200045,0,1,10},{200046,0,1,10},{200047,0,1,10},{200049,0,1,10},{201040,0,1,1},{201041,0,1,10},{201042,0,1,10},{201043,0,1,10},{201045,0,1,10},{201046,0,1,10},{201047,0,1,10},{201049,0,1,10},{202040,0,1,1},{202041,0,1,10},{202042,0,1,10},{202043,0,1,10},{202045,0,1,10},{202046,0,1,10},{202047,0,1,10},{202049,0,1,10}
A107: 110093 | B107: 紫水晶+5 | D107: 0 | E107: 2 | F107: 2 | G107: ="{"&RC[-6]&","&RC[-3]&","&RC[-2]&","&RC[-1]&"}," -> {110093,0,2,2}, | H107: =RC[-1] -> {110093,0,2,2},
A108: 110003 | B108: 洗炼石 | D108: 0 | E108: 2 | F108: 5 | G108: ="{"&RC[-6]&","&RC[-3]&","&RC[-2]&","&RC[-1]&"}," -> {110003,0,2,5}, | H108: =R[-1]C&RC[-1] -> {110093,0,2,2},{110003,0,2,5},
A109: 110004 | B109: 红药 | D109: 0 | E109: 1 | F109: 0 | G109: ="{"&RC[-6]&","&RC[-3]&","&RC[-2]&","&RC[-1]&"}," -> {110004,0,1,0}, | H109: =R[-1]C&RC[-1] -> {110093,0,2,2},{110003,0,2,5},{110004,0,1,0},
A110: 110005 | B110: 蓝药 | D110: 0 | E110: 1 | F110: 0 | G110: ="{"&RC[-6]&","&RC[-3]&","&RC[-2]&","&RC[-1]&"}," -> {110005,0,1,0}, | H110: =R[-1]C&RC[-1] -> {110093,0,2,2},{110003,0,2,5},{110004,0,1,0},{110005,0,1,0},
A111: 110050 | B111: 金条 | D111: 0 | E111: 1 | F111: 3 | G111: ="{"&RC[-6]&","&RC[-3]&","&RC[-2]&","&RC[-1]&"}," -> {110050,0,1,3}, | H111: =R[-1]C&RC[-1] -> {110093,0,2,2},{110003,0,2,5},{110004,0,1,0},{110005,0,1,0},{110050,0,1,3},
A112: 110010 | B112: 普通武装碎片 | D112: 0 | E112: 1 | F112: 2 | G112: ="{"&RC[-6]&","&RC[-3]&","&RC[-2]&","&RC[-1]&"}," -> {110010,0,1,2}, | H112: =R[-1]C&RC[-1] -> {110093,0,2,2},{110003,0,2,5},{110004,0,1,0},{110005,0,1,0},{110050,0,1,3},{110010,0,1,2},
A113: 110011 | B113: 普通防具碎片 | D113: 0 | E113: 1 | F113: 3 | G113: ="{"&RC[-6]&","&RC[-3]&","&RC[-2]&","&RC[-1]&"}," -> {110011,0,1,3}, | H113: =R[-1]C&RC[-1] -> {110093,0,2,2},{110003,0,2,5},{110004,0,1,0},{110005,0,1,0},{110050,0,1,3},{110010,0,1,2},{110011,0,1,3},
A114: 110012 | B114: 普通首饰碎片 | D114: 0 | E114: 1 | F114: 3 | G114: ="{"&RC[-6]&","&RC[-3]&","&RC[-2]&","&RC[-1]&"}," -> {110012,0,1,3}, | H114: =R[-1]C&RC[-1] -> {110093,0,2,2},{110003,0,2,5},{110004,0,1,0},{110005,0,1,0},{110050,0,1,3},{110010,0,1,2},{110011,0,1,3},{110012,0,1,3},
A115: 110013 | B115: 精炼武装碎片 | D115: 0 | E115: 1 | F115: 2 | G115: ="{"&RC[-6]&","&RC[-3]&","&RC[-2]&","&RC[-1]&"}," -> {110013,0,1,2}, | H115: =R[-1]C&RC[-1] -> {110093,0,2,2},{110003,0,2,5},{110004,0,1,0},{110005,0,1,0},{110050,0,1,3},{110010,0,1,2},{110011,0,1,3},{110012,0,1,3},{110013,0,1,2},
A116: 110014 | B116: 精炼防具碎片 | D116: 0 | E116: 1 | F116: 3 | G116: ="{"&RC[-6]&","&RC[-3]&","&RC[-2]&","&RC[-1]&"}," -> {110014,0,1,3}, | H116: =R[-1]C&RC[-1] -> {110093,0,2,2},{110003,0,2,5},{110004,0,1,0},{110005,0,1,0},{110050,0,1,3},{110010,0,1,2},{110011,0,1,3},{110012,0,1,3},{110013,0,1,2},{110014,0,1,3},
A117: 110015 | B117: 精炼首饰碎片 | D117: 0 | E117: 1 | F117: 3 | G117: ="{"&RC[-6]&","&RC[-3]&","&RC[-2]&","&RC[-1]&"}" -> {110015,0,1,3} | H117: =R[-1]C&RC[-1] -> {110093,0,2,2},{110003,0,2,5},{110004,0,1,0},{110005,0,1,0},{110050,0,1,3},{110010,0,1,2},{110011,0,1,3},{110012,0,1,3},{110013,0,1,2},{110014,0,1,3},{110015,0,1,3}
A121: BOSS怪掉落 | F121: 装备 | G121: 概率／100
F122: 3 | G122: 100 | H122: ="{0,[{"&RC[-2]&","&RC[-1]&"}],["&R[-44]C&"]}" -> {0,[{3,100}],[{200010,0,1,10},{200011,0,1,30},{200012,0,1,30},{200013,0,1,30},{200015,0,1,30},{200016,0,1,30},{200017,0,1,30},{200019,0,1,30},{200020,0,1,2},{200021,0,1,10},{200022,0,1,10},{200023,0,1,10},{200025,0,1,10},{200026,0,1,10},{200027,0,1,10},{200029,0,1,10},{200030,0,1,1},{200031,0,1,3},{200032,0,1,3},{200033,0,1,3},{200035,0,1,3},{200036,0,1,3},{200037,0,1,3},{200039,0,1,3},{201010,0,1,10},{201011,0,1,30},{201012,0,1,30},{201013,0,1,30},{201015,0,1,30},{201016,0,1,30},{201017,0,1,30},{201019,0,1,30},{201020,0,1,2},{201021,0,1,10},{201022,0,1,10},{201023,0,1,10},{201025,0,1,10},{201026,0,1,10},{201027,0,1,10},{201029,0,1,10},{201040,0,1,1},{201041,0,1,3},{201042,0,1,3},{201043,0,1,3},{201045,0,1,3},{201046,0,1,3},{201047,0,1,3},{201049,0,1,3},{202010,0,1,10},{202011,0,1,30},{202012,0,1,30},{202013,0,1,30},{202015,0,1,30},{202016,0,1,30},{202017,0,1,30},{202019,0,1,30},{202020,0,1,2},{202021,0,1,10},{202022,0,1,10},{202023,0,1,10},{202025,0,1,10},{202026,0,1,10},{202027,0,1,10},{202029,0,1,10},{202030,0,1,1},{202031,0,1,3},{202032,0,1,3},{202033,0,1,3},{202035,0,1,3},{202036,0,1,3},{202037,0,1,3},{202039,0,1,3},{305003,0,1,2},{305004,0,1,2},{305005,0,1,2}]}
F123: 道具 | G123: 概率／100
F124: 4 | G124: 100 | H124: ="{0,[{"&RC[-2]&","&RC[-1]&"}],["&R[-7]C&"]}" -> {0,[{4,100}],[{110093,0,2,2},{110003,0,2,5},{110004,0,1,0},{110005,0,1,0},{110050,0,1,3},{110010,0,1,2},{110011,0,1,3},{110012,0,1,3},{110013,0,1,2},{110014,0,1,3},{110015,0,1,3}]}
F125: 金币 | G125: 概率／100
F126: 8 | G126: 100 | H126: {0,[{10,100}],[{110009,1,10000,1}]}
F127: 沙巴克 | G127: 概率／100
F128: 1 | G128: 100 | H128: ="{0,[{"&RC[-2]&","&RC[-1]&"}],["&R[-24]C&"]}" -> {0,[{1,100}],[{200040,0,1,1},{200041,0,1,10},{200042,0,1,10},{200043,0,1,10},{200045,0,1,10},{200046,0,1,10},{200047,0,1,10},{200049,0,1,10},{201040,0,1,1},{201041,0,1,10},{201042,0,1,10},{201043,0,1,10},{201045,0,1,10},{201046,0,1,10},{201047,0,1,10},{201049,0,1,10},{202040,0,1,1},{202041,0,1,10},{202042,0,1,10},{202043,0,1,10},{202045,0,1,10},{202046,0,1,10},{202047,0,1,10},{202049,0,1,10}]}
H130: ="["&R[-8]C&","&R[-6]C&","&R[-4]C&"]" -> [{0,[{3,100}],[{200010,0,1,10},{200011,0,1,30},{200012,0,1,30},{200013,0,1,30},{200015,0,1,30},{200016,0,1,30},{200017,0,1,30},{200019,0,1,30},{200020,0,1,2},{200021,0,1,10},{200022,0,1,10},{200023,0,1,10},{200025,0,1,10},{200026,0,1,10},{200027,0,1,10},{200029,0,1,10},{200030,0,1,1},{200031,0,1,3},{200032,0,1,3},{200033,0,1,3},{200035,0,1,3},{200036,0,1,3},{200037,0,1,3},{200039,0,1,3},{201010,0,1,10},{201011,0,1,30},{201012,0,1,30},{201013,0,1,30},{201015,0,1,30},{201016,0,1,30},{201017,0,1,30},{201019,0,1,30},{201020,0,1,2},{201021,0,1,10},{201022,0,1,10},{201023,0,1,10},{201025,0,1,10},{201026,0,1,10},{201027,0,1,10},{201029,0,1,10},{201040,0,1,1},{201041,0,1,3},{201042,0,1,3},{201043,0,1,3},{201045,0,1,3},{201046,0,1,3},{201047,0,1,3},{201049,0,1,3},{202010,0,1,10},{202011,0,1,30},{202012,0,1,30},{202013,0,1,30},{202015,0,1,30},{202016,0,1,30},{202017,0,1,30},{202019,0,1,30},{202020,0,1,2},{202021,0,1,10},{202022,0,1,10},{202023,0,1,10},{202025,0,1,10},{202026,0,1,10},{202027,0,1,10},{202029,0,1,10},{202030,0,1,1},{202031,0,1,3},{202032,0,1,3},{202033,0,1,3},{202035,0,1,3},{202036,0,1,3},{202037,0,1,3},{202039,0,1,3},{305003,0,1,2},{305004,0,1,2},{305005,0,1,2}]},{0,[{4,100}],[{110093,0,2,2},{110003,0,2,5},{110004,0,1,0},{110005,0,1,0},{110050,0,1,3},{110010,0,1,2},{110011,0,1,3},{110012,0,1,3},{110013,0,1,2},{110014,0,1,3},{110015,0,1,3}]},{0,[{10,100}],[{110009,1,10000,1}]}]