Sheet: 怪物攻城排名奖励配置
A1: key | B1: min_rank | C1: max_rank | D1: win_mail_id | E1: lose_mail_id
A2: key | B2: min_rank | C2: max_rank | F2: rewaed_item | G2: fail_item
A3: key | B3: 排名小 | C3: 排名大 | D3: 胜利邮件id | E3: 失败邮件id | F3: 奖励物品 | G3: 奖励物品
A4: 1 | B4: 1 | C4: 1 | D4: 69 | E4: 76 | F4: [{110045,1,200},{110195,1,10000},{110196,1,10000},{110197,1,10000},{110198,1,10000}] | G4: [{110045,1,100},{110195,1,5000},{110196,1,5000},{110197,1,5000},{110198,1,5000}]
A5: 2 | B5: 2 | C5: 2 | D5: 70 | E5: 77 | F5: [{110045,1,150},{110195,1,8000},{110196,1,8000},{110197,1,8000},{110198,1,8000}] | G5: [{110045,1,75},{110195,1,4000},{110196,1,4000},{110197,1,4000},{110198,1,4000}]
A6: 3 | B6: 3 | C6: 3 | D6: 71 | E6: 78 | F6: [{110045,1,100},{110195,1,6000},{110196,1,6000},{110197,1,6000},{110198,1,6000}] | G6: [{110045,1,50},{110195,1,3000},{110196,1,3000},{110197,1,3000},{110198,1,3000}]
A7: 4 | B7: 4 | C7: 5 | D7: 72 | E7: 79 | F7: [{110045,1,100},{110195,1,5000},{110196,1,5000},{110197,1,5000},{110198,1,5000}] | G7: [{110045,1,50},{110195,1,2500},{110196,1,2500},{110197,1,2500},{110198,1,2500}]
A8: 5 | B8: 6 | C8: 10 | D8: 73 | E8: 80 | F8: [{110045,1,100},{110195,1,3000},{110196,1,3000},{110197,1,3000},{110198,1,3000}] | G8: [{110045,1,50},{110195,1,1500},{110196,1,1500},{110197,1,1500},{110198,1,1500}]
A9: 6 | B9: 11 | C9: 50 | D9: 74 | E9: 81 | F9: [{110045,1,100},{110195,1,2000},{110196,1,2000},{110197,1,2000},{110198,1,2000}] | G9: [{110045,1,50},{110195,1,1000},{110196,1,1000},{110197,1,1000},{110198,1,1000}]
A10: 7 | B10: 51 | C10: 99999 | D10: 75 | E10: 82 | F10: [{110045,1,50},{110195,1,1000},{110196,1,1000},{110197,1,1000},{110198,1,1000}] | G10: [{110045,1,25},{110195,1,500},{110196,1,500},{110197,1,500},{110198,1,500}]

Sheet: 说明
A1: [{物品ID,是否绑定,数量}]
A3: 0:非绑定
A4: 1:绑定 | D4: 胜利奖励 | K4: 失败奖励
D5: 绑元 | E5: 生命印记 | F5: 攻击印记 | G5: 物防印记 | H5: 法防印记 | K5: 绑元 | L5: 生命印记 | M5: 攻击印记 | N5: 物防印记 | O5: 法防印记
D6: 110045 | E6: 110195 | F6: 110196 | G6: 110197 | H6: 110198 | K6: 110045 | L6: 110195 | M6: 110196 | N6: 110197 | O6: 110198
C7: 第1名 | D7: 200 | E7: 10000 | F7: 10000 | G7: 10000 | H7: 10000 | K7: =RC[-7]*0.5 -> 100 | L7: =RC[-7]*0.5 -> 5000 | M7: =RC[-7]*0.5 -> 5000 | N7: =RC[-7]*0.5 -> 5000 | O7: =RC[-7]*0.5 -> 5000
C8: 第2名 | D8: 150 | E8: 8000 | F8: 8000 | G8: 8000 | H8: 8000 | K8: =RC[-7]*0.5 -> 75 | L8: =RC[-7]*0.5 -> 4000 | M8: =RC[-7]*0.5 -> 4000 | N8: =RC[-7]*0.5 -> 4000 | O8: =RC[-7]*0.5 -> 4000
C9: 第3名 | D9: 100 | E9: 6000 | F9: 6000 | G9: 6000 | H9: 6000 | K9: =RC[-7]*0.5 -> 50 | L9: =RC[-7]*0.5 -> 3000 | M9: =RC[-7]*0.5 -> 3000 | N9: =RC[-7]*0.5 -> 3000 | O9: =RC[-7]*0.5 -> 3000
C10: 第4-5名 | D10: 100 | E10: 5000 | F10: 5000 | G10: 5000 | H10: 5000 | K10: =RC[-7]*0.5 -> 50 | L10: =RC[-7]*0.5 -> 2500 | M10: =RC[-7]*0.5 -> 2500 | N10: =RC[-7]*0.5 -> 2500 | O10: =RC[-7]*0.5 -> 2500
C11: 第6-10名 | D11: 100 | E11: 3000 | F11: 3000 | G11: 3000 | H11: 3000 | K11: =RC[-7]*0.5 -> 50 | L11: =RC[-7]*0.5 -> 1500 | M11: =RC[-7]*0.5 -> 1500 | N11: =RC[-7]*0.5 -> 1500 | O11: =RC[-7]*0.5 -> 1500
C12: 第11-50名 | D12: 100 | E12: 2000 | F12: 2000 | G12: 2000 | H12: 2000 | K12: =RC[-7]*0.5 -> 50 | L12: =RC[-7]*0.5 -> 1000 | M12: =RC[-7]*0.5 -> 1000 | N12: =RC[-7]*0.5 -> 1000 | O12: =RC[-7]*0.5 -> 1000
C13: 第50以后 | D13: 50 | E13: 1000 | F13: 1000 | G13: 1000 | H13: 1000 | K13: =RC[-7]*0.5 -> 25 | L13: =RC[-7]*0.5 -> 500 | M13: =RC[-7]*0.5 -> 500 | N13: =RC[-7]*0.5 -> 500 | O13: =RC[-7]*0.5 -> 500
D16: ="{"&R6C&",1,"&R[-9]C&"}," -> {110045,1,200}, | E16: ="{"&R6C&",1,"&R[-9]C&"}," -> {110195,1,10000}, | F16: ="{"&R6C&",1,"&R[-9]C&"}," -> {110196,1,10000}, | G16: ="{"&R6C&",1,"&R[-9]C&"}," -> {110197,1,10000}, | H16: ="{"&R6C&",1,"&R[-9]C&"}" -> {110198,1,10000} | I16: =RC[-5]&RC[-4]&RC[-3]&RC[-2]&RC[-1] -> {110045,1,200},{110195,1,10000},{110196,1,10000},{110197,1,10000},{110198,1,10000} | J16: ="["&RC[-1]&"]" -> [{110045,1,200},{110195,1,10000},{110196,1,10000},{110197,1,10000},{110198,1,10000}] | K16: ="{"&R6C&",1,"&R[-9]C&"}," -> {110045,1,100}, | L16: ="{"&R6C&",1,"&R[-9]C&"}," -> {110195,1,5000}, | M16: ="{"&R6C&",1,"&R[-9]C&"}," -> {110196,1,5000}, | N16: ="{"&R6C&",1,"&R[-9]C&"}," -> {110197,1,5000}, | O16: ="{"&R6C&",1,"&R[-9]C&"}" -> {110198,1,5000} | P16: =RC[-5]&RC[-4]&RC[-3]&RC[-2]&RC[-1] -> {110045,1,100},{110195,1,5000},{110196,1,5000},{110197,1,5000},{110198,1,5000} | Q16: ="["&RC[-1]&"]" -> [{110045,1,100},{110195,1,5000},{110196,1,5000},{110197,1,5000},{110198,1,5000}]
D17: ="{"&R6C&",1,"&R[-9]C&"}," -> {110045,1,150}, | E17: ="{"&R6C&",1,"&R[-9]C&"}," -> {110195,1,8000}, | F17: ="{"&R6C&",1,"&R[-9]C&"}," -> {110196,1,8000}, | G17: ="{"&R6C&",1,"&R[-9]C&"}," -> {110197,1,8000}, | H17: ="{"&R6C&",1,"&R[-9]C&"}" -> {110198,1,8000} | I17: =RC[-5]&RC[-4]&RC[-3]&RC[-2]&RC[-1] -> {110045,1,150},{110195,1,8000},{110196,1,8000},{110197,1,8000},{110198,1,8000} | J17: ="["&RC[-1]&"]" -> [{110045,1,150},{110195,1,8000},{110196,1,8000},{110197,1,8000},{110198,1,8000}] | K17: ="{"&R6C&",1,"&R[-9]C&"}," -> {110045,1,75}, | L17: ="{"&R6C&",1,"&R[-9]C&"}," -> {110195,1,4000}, | M17: ="{"&R6C&",1,"&R[-9]C&"}," -> {110196,1,4000}, | N17: ="{"&R6C&",1,"&R[-9]C&"}," -> {110197,1,4000}, | O17: ="{"&R6C&",1,"&R[-9]C&"}" -> {110198,1,4000} | P17: =RC[-5]&RC[-4]&RC[-3]&RC[-2]&RC[-1] -> {110045,1,75},{110195,1,4000},{110196,1,4000},{110197,1,4000},{110198,1,4000} | Q17: ="["&RC[-1]&"]" -> [{110045,1,75},{110195,1,4000},{110196,1,4000},{110197,1,4000},{110198,1,4000}]
D18: ="{"&R6C&",1,"&R[-9]C&"}," -> {110045,1,100}, | E18: ="{"&R6C&",1,"&R[-9]C&"}," -> {110195,1,6000}, | F18: ="{"&R6C&",1,"&R[-9]C&"}," -> {110196,1,6000}, | G18: ="{"&R6C&",1,"&R[-9]C&"}," -> {110197,1,6000}, | H18: ="{"&R6C&",1,"&R[-9]C&"}" -> {110198,1,6000} | I18: =RC[-5]&RC[-4]&RC[-3]&RC[-2]&RC[-1] -> {110045,1,100},{110195,1,6000},{110196,1,6000},{110197,1,6000},{110198,1,6000} | J18: ="["&RC[-1]&"]" -> [{110045,1,100},{110195,1,6000},{110196,1,6000},{110197,1,6000},{110198,1,6000}] | K18: ="{"&R6C&",1,"&R[-9]C&"}," -> {110045,1,50}, | L18: ="{"&R6C&",1,"&R[-9]C&"}," -> {110195,1,3000}, | M18: ="{"&R6C&",1,"&R[-9]C&"}," -> {110196,1,3000}, | N18: ="{"&R6C&",1,"&R[-9]C&"}," -> {110197,1,3000}, | O18: ="{"&R6C&",1,"&R[-9]C&"}" -> {110198,1,3000} | P18: =RC[-5]&RC[-4]&RC[-3]&RC[-2]&RC[-1] -> {110045,1,50},{110195,1,3000},{110196,1,3000},{110197,1,3000},{110198,1,3000} | Q18: ="["&RC[-1]&"]" -> [{110045,1,50},{110195,1,3000},{110196,1,3000},{110197,1,3000},{110198,1,3000}]
D19: ="{"&R6C&",1,"&R[-9]C&"}," -> {110045,1,100}, | E19: ="{"&R6C&",1,"&R[-9]C&"}," -> {110195,1,5000}, | F19: ="{"&R6C&",1,"&R[-9]C&"}," -> {110196,1,5000}, | G19: ="{"&R6C&",1,"&R[-9]C&"}," -> {110197,1,5000}, | H19: ="{"&R6C&",1,"&R[-9]C&"}" -> {110198,1,5000} | I19: =RC[-5]&RC[-4]&RC[-3]&RC[-2]&RC[-1] -> {110045,1,100},{110195,1,5000},{110196,1,5000},{110197,1,5000},{110198,1,5000} | J19: ="["&RC[-1]&"]" -> [{110045,1,100},{110195,1,5000},{110196,1,5000},{110197,1,5000},{110198,1,5000}] | K19: ="{"&R6C&",1,"&R[-9]C&"}," -> {110045,1,50}, | L19: ="{"&R6C&",1,"&R[-9]C&"}," -> {110195,1,2500}, | M19: ="{"&R6C&",1,"&R[-9]C&"}," -> {110196,1,2500}, | N19: ="{"&R6C&",1,"&R[-9]C&"}," -> {110197,1,2500}, | O19: ="{"&R6C&",1,"&R[-9]C&"}" -> {110198,1,2500} | P19: =RC[-5]&RC[-4]&RC[-3]&RC[-2]&RC[-1] -> {110045,1,50},{110195,1,2500},{110196,1,2500},{110197,1,2500},{110198,1,2500} | Q19: ="["&RC[-1]&"]" -> [{110045,1,50},{110195,1,2500},{110196,1,2500},{110197,1,2500},{110198,1,2500}]
D20: ="{"&R6C&",1,"&R[-9]C&"}," -> {110045,1,100}, | E20: ="{"&R6C&",1,"&R[-9]C&"}," -> {110195,1,3000}, | F20: ="{"&R6C&",1,"&R[-9]C&"}," -> {110196,1,3000}, | G20: ="{"&R6C&",1,"&R[-9]C&"}," -> {110197,1,3000}, | H20: ="{"&R6C&",1,"&R[-9]C&"}" -> {110198,1,3000} | I20: =RC[-5]&RC[-4]&RC[-3]&RC[-2]&RC[-1] -> {110045,1,100},{110195,1,3000},{110196,1,3000},{110197,1,3000},{110198,1,3000} | J20: ="["&RC[-1]&"]" -> [{110045,1,100},{110195,1,3000},{110196,1,3000},{110197,1,3000},{110198,1,3000}] | K20: ="{"&R6C&",1,"&R[-9]C&"}," -> {110045,1,50}, | L20: ="{"&R6C&",1,"&R[-9]C&"}," -> {110195,1,1500}, | M20: ="{"&R6C&",1,"&R[-9]C&"}," -> {110196,1,1500}, | N20: ="{"&R6C&",1,"&R[-9]C&"}," -> {110197,1,1500}, | O20: ="{"&R6C&",1,"&R[-9]C&"}" -> {110198,1,1500} | P20: =RC[-5]&RC[-4]&RC[-3]&RC[-2]&RC[-1] -> {110045,1,50},{110195,1,1500},{110196,1,1500},{110197,1,1500},{110198,1,1500} | Q20: ="["&RC[-1]&"]" -> [{110045,1,50},{110195,1,1500},{110196,1,1500},{110197,1,1500},{110198,1,1500}]
D21: ="{"&R6C&",1,"&R[-9]C&"}," -> {110045,1,100}, | E21: ="{"&R6C&",1,"&R[-9]C&"}," -> {110195,1,2000}, | F21: ="{"&R6C&",1,"&R[-9]C&"}," -> {110196,1,2000}, | G21: ="{"&R6C&",1,"&R[-9]C&"}," -> {110197,1,2000}, | H21: ="{"&R6C&",1,"&R[-9]C&"}" -> {110198,1,2000} | I21: =RC[-5]&RC[-4]&RC[-3]&RC[-2]&RC[-1] -> {110045,1,100},{110195,1,2000},{110196,1,2000},{110197,1,2000},{110198,1,2000} | J21: ="["&RC[-1]&"]" -> [{110045,1,100},{110195,1,2000},{110196,1,2000},{110197,1,2000},{110198,1,2000}] | K21: ="{"&R6C&",1,"&R[-9]C&"}," -> {110045,1,50}, | L21: ="{"&R6C&",1,"&R[-9]C&"}," -> {110195,1,1000}, | M21: ="{"&R6C&",1,"&R[-9]C&"}," -> {110196,1,1000}, | N21: ="{"&R6C&",1,"&R[-9]C&"}," -> {110197,1,1000}, | O21: ="{"&R6C&",1,"&R[-9]C&"}" -> {110198,1,1000} | P21: =RC[-5]&RC[-4]&RC[-3]&RC[-2]&RC[-1] -> {110045,1,50},{110195,1,1000},{110196,1,1000},{110197,1,1000},{110198,1,1000} | Q21: ="["&RC[-1]&"]" -> [{110045,1,50},{110195,1,1000},{110196,1,1000},{110197,1,1000},{110198,1,1000}]
D22: ="{"&R6C&",1,"&R[-9]C&"}," -> {110045,1,50}, | E22: ="{"&R6C&",1,"&R[-9]C&"}," -> {110195,1,1000}, | F22: ="{"&R6C&",1,"&R[-9]C&"}," -> {110196,1,1000}, | G22: ="{"&R6C&",1,"&R[-9]C&"}," -> {110197,1,1000}, | H22: ="{"&R6C&",1,"&R[-9]C&"}" -> {110198,1,1000} | I22: =RC[-5]&RC[-4]&RC[-3]&RC[-2]&RC[-1] -> {110045,1,50},{110195,1,1000},{110196,1,1000},{110197,1,1000},{110198,1,1000} | J22: ="["&RC[-1]&"]" -> [{110045,1,50},{110195,1,1000},{110196,1,1000},{110197,1,1000},{110198,1,1000}] | K22: ="{"&R6C&",1,"&R[-9]C&"}," -> {110045,1,25}, | L22: ="{"&R6C&",1,"&R[-9]C&"}," -> {110195,1,500}, | M22: ="{"&R6C&",1,"&R[-9]C&"}," -> {110196,1,500}, | N22: ="{"&R6C&",1,"&R[-9]C&"}," -> {110197,1,500}, | O22: ="{"&R6C&",1,"&R[-9]C&"}" -> {110198,1,500} | P22: =RC[-5]&RC[-4]&RC[-3]&RC[-2]&RC[-1] -> {110045,1,25},{110195,1,500},{110196,1,500},{110197,1,500},{110198,1,500} | Q22: ="["&RC[-1]&"]" -> [{110045,1,25},{110195,1,500},{110196,1,500},{110197,1,500},{110198,1,500}]