Sheet: 升级表
A1: lv | B1: need_exp
A2: lv | B2: need_exp
A3: 等级 | B3: 需求经验
A4: 1 | B4: 60
A5: 2 | B5: 70
A6: 3 | B6: 90
A7: 4 | B7: 130
A8: 5 | B8: 210
A9: 6 | B9: 320
A10: 7 | B10: 480
A11: 8 | B11: 680
A12: 9 | B12: 950
A13: 10 | B13: 1280
A14: 11 | B14: 1578
A15: 12 | B15: 2032
A16: 13 | B16: 2568
A17: 14 | B17: 3193
A18: 15 | B18: 3914
A19: 16 | B19: 4738
A20: 17 | B20: 5672
A21: 18 | B21: 6723
A22: 19 | B22: 7896
A23: 20 | B23: 9201
A24: 21 | B24: 10252
A25: 22 | B25: 11779
A26: 23 | B26: 13452
A27: 24 | B27: 15276
A28: 25 | B28: 17259
A29: 26 | B29: 19408
A30: 27 | B30: 21728
A31: 28 | B31: 24226
A32: 29 | B32: 26910
A33: 30 | B33: 29785
A34: 31 | B34: 92589
A35: 32 | B35: 101826
A36: 33 | B36: 111659
A37: 34 | B37: 122106
A38: 35 | B38: 133186
A39: 36 | B39: 144918
A40: 37 | B40: 157320
A41: 38 | B41: 170410
A42: 39 | B42: 184208
A43: 40 | B43: 198732
A44: 41 | B44: 381142
A45: 42 | B45: 409695
A46: 43 | B46: 439641
A47: 44 | B47: 471013
A48: 45 | B48: 503844
A49: 46 | B49: 538166
A50: 47 | B50: 574014
A51: 48 | B51: 611421
A52: 49 | B52: 650418
A53: 50 | B53: 691041
A54: 51 | B54: =INT(RC[1]/2) -> 808134 | C54: 1616268
A55: 52 | B55: =INT(RC[1]/2) -> 856591 | C55: 1713183
A56: 53 | B56: =INT(RC[1]/2) -> 906949 | C56: 1813898
A57: 54 | B57: =INT(RC[1]/2) -> 959242 | C57: 1918485
A58: 55 | B58: =INT(RC[1]/2) -> 1013509 | C58: 2027019
A59: 56 | B59: =INT(RC[1]/2) -> 1069786 | C59: 2139573
A60: 57 | B60: =INT(RC[1]/2) -> 1128109 | C60: 2256218
A61: 58 | B61: =INT(RC[1]/2) -> 1188515 | C61: 2377030
A62: 59 | B62: =INT(RC[1]/2) -> 1251039 | C62: 2502079
A63: 60 | B63: =INT(RC[1]/2) -> 1315720 | C63: 2631441
A64: 61 | B64: =INT(RC[1]/2) -> 3504219 | C64: 7008439
A65: 62 | B65: =INT(RC[1]/2) -> 3679360 | C65: 7358721
A66: 63 | B66: =INT(RC[1]/2) -> 3860243 | C66: 7720486
A67: 64 | B67: =INT(RC[1]/2) -> 4046960 | C67: 8093920
A68: 65 | B68: =INT(RC[1]/2) -> 4239604 | C68: 8479208
A69: 66 | B69: =INT(RC[1]/2) -> 4438268 | C69: 8876536
A70: 67 | B70: =INT(RC[1]/2) -> 4643043 | C70: 9286087
A71: 68 | B71: =INT(RC[1]/2) -> 4854024 | C71: 9708049
A72: 69 | B72: =INT(RC[1]/2) -> 5071303 | C72: 10142606
A73: 70 | B73: =INT(RC[1]/2) -> 5294971 | C73: 10589942
A74: 71 | B74: =INT(RC[1]/2) -> 8656894 | C74: 17313789
A75: 72 | B75: =INT(RC[1]/2) -> 9027803 | C75: 18055607
A76: 73 | B76: =INT(RC[1]/2) -> 9409159 | C76: 18818319
A77: 74 | B77: =INT(RC[1]/2) -> 9801108 | C77: 19602216
A78: 75 | B78: =INT(RC[1]/2) -> 10203794 | C78: 20407588
A79: 76 | B79: =INT(RC[1]/2) -> 10617363 | C79: 21234726
A80: 77 | B80: =INT(RC[1]/2) -> 11041960 | C80: 22083920
A81: 78 | B81: =INT(RC[1]/2) -> 11477729 | C81: 22955459
A82: 79 | B82: =INT(RC[1]/2) -> 11924817 | C82: 23849635
A83: 80 | B83: =INT(RC[1]/2) -> 12383368 | C83: 24766737
A84: 81 | B84: =INT(RC[1]/2) -> 20647045 | C84: 41294090
A85: 82 | B85: =INT(RC[1]/2) -> 21421157 | C85: 42842314
A86: 83 | B86: =INT(RC[1]/2) -> 22214382 | C86: 44428765
A87: 84 | B87: =INT(RC[1]/2) -> 23026953 | C87: 46053907
A88: 85 | B88: =INT(RC[1]/2) -> 23859103 | C88: 47718207
A89: 86 | B89: =INT(RC[1]/2) -> 24711066 | C89: 49422132
A90: 87 | B90: =INT(RC[1]/2) -> 25583073 | C90: 51166147
A91: 88 | B91: =INT(RC[1]/2) -> 26475359 | C91: 52950719
A92: 89 | B92: =INT(RC[1]/2) -> 27388157 | C92: 54776314
A93: 90 | B93: =INT(RC[1]/2) -> 28321699 | C93: 56643398
A94: 91 | B94: =INT(RC[1]/2) -> 30006868 | C94: 60013736
A95: 92 | B95: =INT(RC[1]/2) -> 31006950 | C95: 62013900
A96: 93 | B96: =INT(RC[1]/2) -> 32029010 | C96: 64058021
A97: 94 | B97: =INT(RC[1]/2) -> 33073289 | C97: 66146578
A98: 95 | B98: =INT(RC[1]/2) -> 34140024 | C98: 68280048
A99: 96 | B99: =INT(RC[1]/2) -> 35229455 | C99: 70458910
A100: 97 | B100: =INT(RC[1]/2) -> 36341820 | C100: 72683640
A101: 98 | B101: =INT(RC[1]/2) -> 37477359 | C101: 74954718
A102: 99 | B102: =INT(RC[1]/2) -> 38636310 | C102: 77272620
A103: 100 | B103: =INT(RC[1]/2) -> 39818912 | C103: 79637825
A104: 101 | B104: =INT(RC[1]/2) -> 113688735 | C104: 227377470
A105: 102 | B105: =INT(RC[1]/2) -> 117099007 | C105: 234198015
A106: 103 | B106: =INT(RC[1]/2) -> 120576808 | C106: 241153616
A107: 104 | B107: =INT(RC[1]/2) -> 124122798 | C107: 248245597
A108: 105 | B108: =INT(RC[1]/2) -> 127737641 | C108: 255475282
A109: 106 | B109: =INT(RC[1]/2) -> 131421997 | C109: 262843995
A110: 107 | B110: =INT(RC[1]/2) -> 135176530 | C110: 270353061
A111: 108 | B111: =INT(RC[1]/2) -> 139001901 | C111: 278003803
A112: 109 | B112: =INT(RC[1]/2) -> 142898772 | C112: 285797545
A113: 110 | B113: =INT(RC[1]/2) -> 146867806 | C113: 293735612
A114: 111 | B114: =INT(RC[1]/2) -> 184021262 | C114: 368042524
A115: 112 | B115: =INT(RC[1]/2) -> 189039567 | C115: 378079135
A116: 113 | B116: =INT(RC[1]/2) -> 194148290 | C116: 388296581
A117: 114 | B117: =INT(RC[1]/2) -> 199348238 | C117: 398696476
A118: 115 | B118: =INT(RC[1]/2) -> 204640218 | C118: 409280436
A119: 116 | B119: =INT(RC[1]/2) -> 210025037 | C119: 420050074
A120: 117 | B120: =INT(RC[1]/2) -> 215503503 | C120: 431007006
A121: 118 | B121: =INT(RC[1]/2) -> 221076423 | C121: 442152846
A122: 119 | B122: =INT(RC[1]/2) -> 226744604 | C122: 453489208
A123: 120 | B123: =INT(RC[1]/2) -> 232508854 | C123: 465017708
A124: 121 | B124: =INT(RC[1]/2) -> 279010624 | C124: 558021249
A125: 122 | B125: =INT(RC[1]/2) -> 306911686 | C125: 613823373
A126: 123 | B126: =INT(RC[1]/2) -> 337602855 | C126: 675205710
A127: 124 | B127: =INT(RC[1]/2) -> 371363140 | C127: 742726281
A128: 125 | B128: =INT(RC[1]/2) -> 557044710 | C128: 1114089421
A129: 126 | B129: =INT(RC[1]/2) -> 612749181 | C129: 1225498363
A130: 127 | B130: =INT(RC[1]/2) -> 674024099 | C130: 1348048199
A131: 128 | B131: =INT(RC[1]/2) -> 741426509 | C131: 1482853018
A132: 129 | B132: =INT(RC[1]/2) -> 815569159 | C132: 1631138319
A133: 130 | B133: =INT(RC[1]/2) -> 1000000000 | C133: 2000000000

Sheet: Sheet2
A1: 120-130级