Sheet: 角色信息
A1: career | B1: lv | C1: hp | D1: mp | E1: min_ac | F1: max_ac | G1: min_mac | H1: max_mac | I1: min_sc | J1: max_sc | K1: min_def | L1: max_def | M1: min_res | N1: max_res | O1: crit | P1: crit_att | Q1: hit | R1: dodge
A2: career | B2: lv | C2: hp | D2: mp | E2: min_ac | F2: max_ac | G2: min_mac | H2: max_mac | I2: min_sc | J2: max_sc | K2: min_def | L2: max_def | M2: min_res | N2: max_res | O2: crit | P2: crit_att | Q2: hit | R2: dodge
A3: 职业 | B3: 等级 | C3: 生命 | D3: 魔法 | E3: 最小物理攻击 | F3: 最大物理攻击 | G3: 最小魔法攻击 | H3: 最大魔法攻击 | I3: 最小道术攻击 | J3: 最大道术攻击 | K3: 最小物防 | L3: 最大物防 | M3: 最小法防 | N3: 最大法防 | O3: 暴击 | P3: 暴击力 | Q3: 准确 | R3: 敏捷
A4: 1000 | B4: 1 | C4: 25 | D4: 13 | E4: 1 | F4: 2 | G4: 0 | H4: 0 | I4: 0 | J4: 0 | K4: 0 | L4: 1 | M4: 0 | N4: 1 | O4: 0 | P4: 5 | Q4: 15 | R4: 15
A5: 1000 | B5: =R[-1]C+1 -> 2 | C5: 70 | D5: 37 | E5: 2 | F5: 5 | G5: 0 | H5: 0 | I5: 0 | J5: 0 | K5: 0 | L5: 3 | M5: 0 | N5: 3 | O5: 0 | P5: 5 | Q5: 15 | R5: 15
A6: 1000 | B6: =R[-1]C+1 -> 3 | C6: 115 | D6: 61 | E6: 4 | F6: 8 | G6: 0 | H6: 0 | I6: 0 | J6: 0 | K6: 1 | L6: 4 | M6: 1 | N6: 4 | O6: 0 | P6: 5 | Q6: 15 | R6: 15
A7: 1000 | B7: =R[-1]C+1 -> 4 | C7: 160 | D7: 85 | E7: 6 | F7: 12 | G7: 0 | H7: 0 | I7: 0 | J7: 0 | K7: 2 | L7: 6 | M7: 2 | N7: 6 | O7: 0 | P7: 5 | Q7: 15 | R7: 15
A8: 1000 | B8: =R[-1]C+1 -> 5 | C8: 205 | D8: 109 | E8: 7 | F8: 15 | G8: 0 | H8: 0 | I8: 0 | J8: 0 | K8: 3 | L8: 7 | M8: 3 | N8: 7 | O8: 0 | P8: 5 | Q8: 15 | R8: 15
A9: 1000 | B9: =R[-1]C+1 -> 6 | C9: 250 | D9: 133 | E9: 9 | F9: 18 | G9: 0 | H9: 0 | I9: 0 | J9: 0 | K9: 3 | L9: 9 | M9: 3 | N9: 9 | O9: 0 | P9: 5 | Q9: 15 | R9: 15
A10: 1000 | B10: =R[-1]C+1 -> 7 | C10: 295 | D10: 157 | E10: 11 | F10: 22 | G10: 0 | H10: 0 | I10: 0 | J10: 0 | K10: 4 | L10: 10 | M10: 4 | N10: 10 | O10: 0 | P10: 5 | Q10: 15 | R10: 15
A11: 1000 | B11: =R[-1]C+1 -> 8 | C11: 340 | D11: 181 | E11: 12 | F11: 25 | G11: 0 | H11: 0 | I11: 0 | J11: 0 | K11: 5 | L11: 12 | M11: 5 | N11: 12 | O11: 0 | P11: 5 | Q11: 15 | R11: 15
A12: 1000 | B12: =R[-1]C+1 -> 9 | C12: 385 | D12: 205 | E12: 14 | F12: 28 | G12: 0 | H12: 0 | I12: 0 | J12: 0 | K12: 6 | L12: 13 | M12: 6 | N12: 13 | O12: 0 | P12: 5 | Q12: 15 | R12: 15
A13: 1000 | B13: =R[-1]C+1 -> 10 | C13: 430 | D13: 229 | E13: 15 | F13: 31 | G13: 0 | H13: 0 | I13: 0 | J13: 0 | K13: 6 | L13: 15 | M13: 6 | N13: 15 | O13: 0 | P13: 5 | Q13: 15 | R13: 15
A14: 1000 | B14: =R[-1]C+1 -> 11 | C14: 475 | D14: 253 | E14: 17 | F14: 35 | G14: 0 | H14: 0 | I14: 0 | J14: 0 | K14: 7 | L14: 16 | M14: 7 | N14: 16 | O14: 0 | P14: =R[-10]C+5 -> 10 | Q14: 15 | R14: 15
A15: 1000 | B15: =R[-1]C+1 -> 12 | C15: 520 | D15: 277 | E15: 19 | F15: 38 | G15: 0 | H15: 0 | I15: 0 | J15: 0 | K15: 8 | L15: 18 | M15: 8 | N15: 18 | O15: 0 | P15: =R[-10]C+5 -> 10 | Q15: 15 | R15: 15
A16: 1000 | B16: =R[-1]C+1 -> 13 | C16: 565 | D16: 301 | E16: 20 | F16: 41 | G16: 0 | H16: 0 | I16: 0 | J16: 0 | K16: 9 | L16: 19 | M16: 9 | N16: 19 | O16: 0 | P16: =R[-10]C+5 -> 10 | Q16: 15 | R16: 15
A17: 1000 | B17: =R[-1]C+1 -> 14 | C17: 610 | D17: 325 | E17: 22 | F17: 45 | G17: 0 | H17: 0 | I17: 0 | J17: 0 | K17: 9 | L17: 21 | M17: 9 | N17: 21 | O17: 0 | P17: =R[-10]C+5 -> 10 | Q17: 15 | R17: 15
A18: 1000 | B18: =R[-1]C+1 -> 15 | C18: 655 | D18: 349 | E18: 24 | F18: 48 | G18: 0 | H18: 0 | I18: 0 | J18: 0 | K18: 10 | L18: 22 | M18: 10 | N18: 22 | O18: 0 | P18: =R[-10]C+5 -> 10 | Q18: 15 | R18: 15
A19: 1000 | B19: =R[-1]C+1 -> 16 | C19: 700 | D19: 373 | E19: 25 | F19: 51 | G19: 0 | H19: 0 | I19: 0 | J19: 0 | K19: 11 | L19: 24 | M19: 11 | N19: 24 | O19: 0 | P19: =R[-10]C+5 -> 10 | Q19: 15 | R19: 15
A20: 1000 | B20: =R[-1]C+1 -> 17 | C20: 745 | D20: 397 | E20: 27 | F20: 55 | G20: 0 | H20: 0 | I20: 0 | J20: 0 | K20: 12 | L20: 25 | M20: 12 | N20: 25 | O20: 0 | P20: =R[-10]C+5 -> 10 | Q20: 15 | R20: 15
A21: 1000 | B21: =R[-1]C+1 -> 18 | C21: 790 | D21: 421 | E21: 29 | F21: 58 | G21: 0 | H21: 0 | I21: 0 | J21: 0 | K21: 12 | L21: 27 | M21: 12 | N21: 27 | O21: 0 | P21: =R[-10]C+5 -> 10 | Q21: 15 | R21: 15
A22: 1000 | B22: =R[-1]C+1 -> 19 | C22: 835 | D22: 445 | E22: 30 | F22: 61 | G22: 0 | H22: 0 | I22: 0 | J22: 0 | K22: 13 | L22: 28 | M22: 13 | N22: 28 | O22: 0 | P22: =R[-10]C+5 -> 10 | Q22: 15 | R22: 15
A23: 1000 | B23: =R[-1]C+1 -> 20 | C23: 903 | D23: 481 | E23: 33 | F23: 66 | G23: 0 | H23: 0 | I23: 0 | J23: 0 | K23: 14 | L23: 30 | M23: 14 | N23: 30 | O23: 0 | P23: =R[-10]C+5 -> 10 | Q23: 15 | R23: 15
A24: 1000 | B24: =R[-1]C+1 -> 21 | C24: 970 | D24: 517 | E24: 35 | F24: 71 | G24: 0 | H24: 0 | I24: 0 | J24: 0 | K24: 15 | L24: 33 | M24: 15 | N24: 33 | O24: 0 | P24: =R[-10]C+5 -> 15 | Q24: 15 | R24: 15
A25: 1000 | B25: =R[-1]C+1 -> 22 | C25: 1038 | D25: 553 | E25: 38 | F25: 76 | G25: 0 | H25: 0 | I25: 0 | J25: 0 | K25: 16 | L25: 35 | M25: 16 | N25: 35 | O25: 0 | P25: =R[-10]C+5 -> 15 | Q25: 15 | R25: 15
A26: 1000 | B26: =R[-1]C+1 -> 23 | C26: 1105 | D26: 589 | E26: 40 | F26: 81 | G26: 0 | H26: 0 | I26: 0 | J26: 0 | K26: 18 | L26: 37 | M26: 18 | N26: 37 | O26: 0 | P26: =R[-10]C+5 -> 15 | Q26: 15 | R26: 15
A27: 1000 | B27: =R[-1]C+1 -> 24 | C27: 1173 | D27: 625 | E27: 43 | F27: 86 | G27: 0 | H27: 0 | I27: 0 | J27: 0 | K27: 19 | L27: 39 | M27: 19 | N27: 39 | O27: 0 | P27: =R[-10]C+5 -> 15 | Q27: 15 | R27: 15
A28: 1000 | B28: =R[-1]C+1 -> 25 | C28: 1240 | D28: 661 | E28: 45 | F28: 91 | G28: 0 | H28: 0 | I28: 0 | J28: 0 | K28: 20 | L28: 42 | M28: 20 | N28: 42 | O28: 0 | P28: =R[-10]C+5 -> 15 | Q28: 15 | R28: 15
A29: 1000 | B29: =R[-1]C+1 -> 26 | C29: 1308 | D29: 697 | E29: 48 | F29: 96 | G29: 0 | H29: 0 | I29: 0 | J29: 0 | K29: 21 | L29: 44 | M29: 21 | N29: 44 | O29: 0 | P29: =R[-10]C+5 -> 15 | Q29: 15 | R29: 15
A30: 1000 | B30: =R[-1]C+1 -> 27 | C30: 1375 | D30: 733 | E30: 50 | F30: 101 | G30: 0 | H30: 0 | I30: 0 | J30: 0 | K30: 22 | L30: 46 | M30: 22 | N30: 46 | O30: 0 | P30: =R[-10]C+5 -> 15 | Q30: 15 | R30: 15
A31: 1000 | B31: =R[-1]C+1 -> 28 | C31: 1443 | D31: 769 | E31: 53 | F31: 106 | G31: 0 | H31: 0 | I31: 0 | J31: 0 | K31: 23 | L31: 48 | M31: 23 | N31: 48 | O31: 0 | P31: =R[-10]C+5 -> 15 | Q31: 15 | R31: 15
A32: 1000 | B32: =R[-1]C+1 -> 29 | C32: 1510 | D32: 805 | E32: 55 | F32: 111 | G32: 0 | H32: 0 | I32: 0 | J32: 0 | K32: 24 | L32: 51 | M32: 24 | N32: 51 | O32: 0 | P32: =R[-10]C+5 -> 15 | Q32: 15 | R32: 15
A33: 1000 | B33: =R[-1]C+1 -> 30 | C33: 1614 | D33: 860 | E33: 59 | F33: 118 | G33: 0 | H33: 0 | I33: 0 | J33: 0 | K33: 26 | L33: 54 | M33: 26 | N33: 54 | O33: 0 | P33: =R[-10]C+5 -> 15 | Q33: 15 | R33: 15
A34: 1000 | B34: =R[-1]C+1 -> 31 | C34: 1717 | D34: 916 | E34: 63 | F34: 126 | G34: 0 | H34: 0 | I34: 0 | J34: 0 | K34: 28 | L34: 57 | M34: 28 | N34: 57 | O34: 0 | P34: =R[-10]C+5 -> 20 | Q34: 15 | R34: 15
A35: 1000 | B35: =R[-1]C+1 -> 32 | C35: 1821 | D35: 971 | E35: 66 | F35: 133 | G35: 0 | H35: 0 | I35: 0 | J35: 0 | K35: 29 | L35: 61 | M35: 29 | N35: 61 | O35: 0 | P35: =R[-10]C+5 -> 20 | Q35: 15 | R35: 15
A36: 1000 | B36: =R[-1]C+1 -> 33 | C36: 1924 | D36: 1026 | E36: 70 | F36: 141 | G36: 0 | H36: 0 | I36: 0 | J36: 0 | K36: 31 | L36: 64 | M36: 31 | N36: 64 | O36: 0 | P36: =R[-10]C+5 -> 20 | Q36: 15 | R36: 15
A37: 1000 | B37: =R[-1]C+1 -> 34 | C37: 2028 | D37: 1081 | E37: 74 | F37: 149 | G37: 0 | H37: 0 | I37: 0 | J37: 0 | K37: 33 | L37: 68 | M37: 33 | N37: 68 | O37: 0 | P37: =R[-10]C+5 -> 20 | Q37: 15 | R37: 15
A38: 1000 | B38: =R[-1]C+1 -> 35 | C38: 2131 | D38: 1136 | E38: 78 | F38: 156 | G38: 0 | H38: 0 | I38: 0 | J38: 0 | K38: 35 | L38: 71 | M38: 35 | N38: 71 | O38: 0 | P38: =R[-10]C+5 -> 20 | Q38: 15 | R38: 15
A39: 1000 | B39: =R[-1]C+1 -> 36 | C39: 2235 | D39: 1192 | E39: 82 | F39: 164 | G39: 0 | H39: 0 | I39: 0 | J39: 0 | K39: 36 | L39: 75 | M39: 36 | N39: 75 | O39: 0 | P39: =R[-10]C+5 -> 20 | Q39: 15 | R39: 15
A40: 1000 | B40: =R[-1]C+1 -> 37 | C40: 2338 | D40: 1247 | E40: 85 | F40: 171 | G40: 0 | H40: 0 | I40: 0 | J40: 0 | K40: 38 | L40: 78 | M40: 38 | N40: 78 | O40: 0 | P40: =R[-10]C+5 -> 20 | Q40: 15 | R40: 15
A41: 1000 | B41: =R[-1]C+1 -> 38 | C41: 2442 | D41: 1302 | E41: 89 | F41: 179 | G41: 0 | H41: 0 | I41: 0 | J41: 0 | K41: 40 | L41: 82 | M41: 40 | N41: 82 | O41: 0 | P41: =R[-10]C+5 -> 20 | Q41: 15 | R41: 15
A42: 1000 | B42: =R[-1]C+1 -> 39 | C42: 2545 | D42: 1357 | E42: 93 | F42: 187 | G42: 0 | H42: 0 | I42: 0 | J42: 0 | K42: 42 | L42: 85 | M42: 42 | N42: 85 | O42: 0 | P42: =R[-10]C+5 -> 20 | Q42: 15 | R42: 15
A43: 1000 | B43: =R[-1]C+1 -> 40 | C43: 2680 | D43: 1429 | E43: 98 | F43: 196 | G43: 0 | H43: 0 | I43: 0 | J43: 0 | K43: 44 | L43: 90 | M43: 44 | N43: 90 | O43: 0 | P43: =R[-10]C+5 -> 20 | Q43: 15 | R43: 15
A44: 1000 | B44: =R[-1]C+1 -> 41 | C44: 2815 | D44: 1501 | E44: 103 | F44: 206 | G44: 0 | H44: 0 | I44: 0 | J44: 0 | K44: 46 | L44: 94 | M44: 46 | N44: 94 | O44: 0 | P44: =R[-10]C+5 -> 25 | Q44: 15 | R44: 15
A45: 1000 | B45: =R[-1]C+1 -> 42 | C45: 2950 | D45: 1573 | E45: 108 | F45: 216 | G45: 0 | H45: 0 | I45: 0 | J45: 0 | K45: 48 | L45: 99 | M45: 48 | N45: 99 | O45: 0 | P45: =R[-10]C+5 -> 25 | Q45: 15 | R45: 15
A46: 1000 | B46: =R[-1]C+1 -> 43 | C46: 3085 | D46: 1645 | E46: 113 | F46: 226 | G46: 0 | H46: 0 | I46: 0 | J46: 0 | K46: 51 | L46: 103 | M46: 51 | N46: 103 | O46: 0 | P46: =R[-10]C+5 -> 25 | Q46: 15 | R46: 15
A47: 1000 | B47: =R[-1]C+1 -> 44 | C47: 3220 | D47: 1717 | E47: 118 | F47: 236 | G47: 0 | H47: 0 | I47: 0 | J47: 0 | K47: 53 | L47: 108 | M47: 53 | N47: 108 | O47: 0 | P47: =R[-10]C+5 -> 25 | Q47: 15 | R47: 15
A48: 1000 | B48: =R[-1]C+1 -> 45 | C48: 3355 | D48: 1789 | E48: 123 | F48: 246 | G48: 0 | H48: 0 | I48: 0 | J48: 0 | K48: 55 | L48: 112 | M48: 55 | N48: 112 | O48: 0 | P48: =R[-10]C+5 -> 25 | Q48: 15 | R48: 15
A49: 1000 | B49: =R[-1]C+1 -> 46 | C49: 3490 | D49: 1861 | E49: 128 | F49: 256 | G49: 0 | H49: 0 | I49: 0 | J49: 0 | K49: 57 | L49: 117 | M49: 57 | N49: 117 | O49: 0 | P49: =R[-10]C+5 -> 25 | Q49: 15 | R49: 15
A50: 1000 | B50: =R[-1]C+1 -> 47 | C50: 3625 | D50: 1933 | E50: 133 | F50: 266 | G50: 0 | H50: 0 | I50: 0 | J50: 0 | K50: 60 | L50: 121 | M50: 60 | N50: 121 | O50: 0 | P50: =R[-10]C+5 -> 25 | Q50: 15 | R50: 15
A51: 1000 | B51: =R[-1]C+1 -> 48 | C51: 3760 | D51: 2005 | E51: 138 | F51: 276 | G51: 0 | H51: 0 | I51: 0 | J51: 0 | K51: 62 | L51: 126 | M51: 62 | N51: 126 | O51: 0 | P51: =R[-10]C+5 -> 25 | Q51: 15 | R51: 15
A52: 1000 | B52: =R[-1]C+1 -> 49 | C52: 3895 | D52: 2077 | E52: 143 | F52: 286 | G52: 0 | H52: 0 | I52: 0 | J52: 0 | K52: 64 | L52: 130 | M52: 64 | N52: 130 | O52: 0 | P52: =R[-10]C+5 -> 25 | Q52: 15 | R52: 15
A53: 1000 | B53: =R[-1]C+1 -> 50 | C53: 4075 | D53: 2173 | E53: 149 | F53: 299 | G53: 0 | H53: 0 | I53: 0 | J53: 0 | K53: 67 | L53: 136 | M53: 67 | N53: 136 | O53: 0 | P53: =R[-10]C+5 -> 25 | Q53: 15 | R53: 15
A54: 1000 | B54: =R[-1]C+1 -> 51 | C54: 4255 | D54: 2269 | E54: 156 | F54: 312 | G54: 0 | H54: 0 | I54: 0 | J54: 0 | K54: 70 | L54: 142 | M54: 70 | N54: 142 | O54: 0 | P54: =R[-10]C+5 -> 30 | Q54: 15 | R54: 15
A55: 1000 | B55: =R[-1]C+1 -> 52 | C55: 4435 | D55: 2365 | E55: 162 | F55: 325 | G55: 0 | H55: 0 | I55: 0 | J55: 0 | K55: 73 | L55: 148 | M55: 73 | N55: 148 | O55: 0 | P55: =R[-10]C+5 -> 30 | Q55: 15 | R55: 15
A56: 1000 | B56: =R[-1]C+1 -> 53 | C56: 4615 | D56: 2461 | E56: 169 | F56: 338 | G56: 0 | H56: 0 | I56: 0 | J56: 0 | K56: 76 | L56: 154 | M56: 76 | N56: 154 | O56: 0 | P56: =R[-10]C+5 -> 30 | Q56: 15 | R56: 15
A57: 1000 | B57: =R[-1]C+1 -> 54 | C57: 4795 | D57: 2557 | E57: 176 | F57: 352 | G57: 0 | H57: 0 | I57: 0 | J57: 0 | K57: 79 | L57: 160 | M57: 79 | N57: 160 | O57: 0 | P57: =R[-10]C+5 -> 30 | Q57: 15 | R57: 15
A58: 1000 | B58: =R[-1]C+1 -> 55 | C58: 4975 | D58: 2653 | E58: 182 | F58: 365 | G58: 0 | H58: 0 | I58: 0 | J58: 0 | K58: 82 | L58: 166 | M58: 82 | N58: 166 | O58: 0 | P58: =R[-10]C+5 -> 30 | Q58: 15 | R58: 15
A59: 1000 | B59: =R[-1]C+1 -> 56 | C59: 5155 | D59: 2749 | E59: 189 | F59: 378 | G59: 0 | H59: 0 | I59: 0 | J59: 0 | K59: 85 | L59: 172 | M59: 85 | N59: 172 | O59: 0 | P59: =R[-10]C+5 -> 30 | Q59: 15 | R59: 15
A60: 1000 | B60: =R[-1]C+1 -> 57 | C60: 5335 | D60: 2845 | E60: 195 | F60: 391 | G60: 0 | H60: 0 | I60: 0 | J60: 0 | K60: 88 | L60: 178 | M60: 88 | N60: 178 | O60: 0 | P60: =R[-10]C+5 -> 30 | Q60: 15 | R60: 15
A61: 1000 | B61: =R[-1]C+1 -> 58 | C61: 5515 | D61: 2941 | E61: 202 | F61: 404 | G61: 0 | H61: 0 | I61: 0 | J61: 0 | K61: 91 | L61: 184 | M61: 91 | N61: 184 | O61: 0 | P61: =R[-10]C+5 -> 30 | Q61: 15 | R61: 15
A62: 1000 | B62: =R[-1]C+1 -> 59 | C62: 5695 | D62: 3037 | E62: 209 | F62: 418 | G62: 0 | H62: 0 | I62: 0 | J62: 0 | K62: 94 | L62: 190 | M62: 94 | N62: 190 | O62: 0 | P62: =R[-10]C+5 -> 30 | Q62: 15 | R62: 15
A63: 1000 | B63: =R[-1]C+1 -> 60 | C63: 5898 | D63: 3145 | E63: 216 | F63: 432 | G63: 0 | H63: 0 | I63: 0 | J63: 0 | K63: 97 | L63: 197 | M63: 97 | N63: 197 | O63: 0 | P63: =R[-10]C+5 -> 30 | Q63: 15 | R63: 15
A64: 1000 | B64: =R[-1]C+1 -> 61 | C64: 6100 | D64: 3253 | E64: 223 | F64: 447 | G64: 0 | H64: 0 | I64: 0 | J64: 0 | K64: 101 | L64: 204 | M64: 101 | N64: 204 | O64: 0 | P64: =R[-10]C+5 -> 35 | Q64: 15 | R64: 15
A65: 1000 | B65: =R[-1]C+1 -> 62 | C65: 6303 | D65: 3361 | E65: 231 | F65: 462 | G65: 0 | H65: 0 | I65: 0 | J65: 0 | K65: 104 | L65: 210 | M65: 104 | N65: 210 | O65: 0 | P65: =R[-10]C+5 -> 35 | Q65: 15 | R65: 15
A66: 1000 | B66: =R[-1]C+1 -> 63 | C66: 6505 | D66: 3469 | E66: 238 | F66: 477 | G66: 0 | H66: 0 | I66: 0 | J66: 0 | K66: 108 | L66: 217 | M66: 108 | N66: 217 | O66: 0 | P66: =R[-10]C+5 -> 35 | Q66: 15 | R66: 15
A67: 1000 | B67: =R[-1]C+1 -> 64 | C67: 6708 | D67: 3577 | E67: 246 | F67: 492 | G67: 0 | H67: 0 | I67: 0 | J67: 0 | K67: 111 | L67: 224 | M67: 111 | N67: 224 | O67: 0 | P67: =R[-10]C+5 -> 35 | Q67: 15 | R67: 15
A68: 1000 | B68: =R[-1]C+1 -> 65 | C68: 6910 | D68: 3685 | E68: 253 | F68: 507 | G68: 0 | H68: 0 | I68: 0 | J68: 0 | K68: 114 | L68: 231 | M68: 114 | N68: 231 | O68: 0 | P68: =R[-10]C+5 -> 35 | Q68: 15 | R68: 15
A69: 1000 | B69: =R[-1]C+1 -> 66 | C69: 7113 | D69: 3793 | E69: 260 | F69: 521 | G69: 0 | H69: 0 | I69: 0 | J69: 0 | K69: 118 | L69: 237 | M69: 118 | N69: 237 | O69: 0 | P69: =R[-10]C+5 -> 35 | Q69: 15 | R69: 15
A70: 1000 | B70: =R[-1]C+1 -> 67 | C70: 7315 | D70: 3901 | E70: 268 | F70: 536 | G70: 0 | H70: 0 | I70: 0 | J70: 0 | K70: 121 | L70: 244 | M70: 121 | N70: 244 | O70: 0 | P70: =R[-10]C+5 -> 35 | Q70: 15 | R70: 15
A71: 1000 | B71: =R[-1]C+1 -> 68 | C71: 7518 | D71: 4009 | E71: 275 | F71: 551 | G71: 0 | H71: 0 | I71: 0 | J71: 0 | K71: 124 | L71: 251 | M71: 124 | N71: 251 | O71: 0 | P71: =R[-10]C+5 -> 35 | Q71: 15 | R71: 15
A72: 1000 | B72: =R[-1]C+1 -> 69 | C72: 7720 | D72: 4117 | E72: 283 | F72: 566 | G72: 0 | H72: 0 | I72: 0 | J72: 0 | K72: 128 | L72: 258 | M72: 128 | N72: 258 | O72: 0 | P72: =R[-10]C+5 -> 35 | Q72: 15 | R72: 15
A73: 1000 | B73: =R[-1]C+1 -> 70 | C73: 7945 | D73: 4237 | E73: 291 | F73: 583 | G73: 0 | H73: 0 | I73: 0 | J73: 0 | K73: 132 | L73: 265 | M73: 132 | N73: 265 | O73: 0 | P73: =R[-10]C+5 -> 35 | Q73: 15 | R73: 15
A74: 1000 | B74: =R[-1]C+1 -> 71 | C74: 8170 | D74: 4357 | E74: 299 | F74: 599 | G74: 0 | H74: 0 | I74: 0 | J74: 0 | K74: 135 | L74: 273 | M74: 135 | N74: 273 | O74: 0 | P74: =R[-10]C+5 -> 40 | Q74: 15 | R74: 15
A75: 1000 | B75: =R[-1]C+1 -> 72 | C75: 8395 | D75: 4477 | E75: 308 | F75: 616 | G75: 0 | H75: 0 | I75: 0 | J75: 0 | K75: 139 | L75: 280 | M75: 139 | N75: 280 | O75: 0 | P75: =R[-10]C+5 -> 40 | Q75: 15 | R75: 15
A76: 1000 | B76: =R[-1]C+1 -> 73 | C76: 8620 | D76: 4597 | E76: 316 | F76: 632 | G76: 0 | H76: 0 | I76: 0 | J76: 0 | K76: 143 | L76: 288 | M76: 143 | N76: 288 | O76: 0 | P76: =R[-10]C+5 -> 40 | Q76: 15 | R76: 15
A77: 1000 | B77: =R[-1]C+1 -> 74 | C77: 8845 | D77: 4717 | E77: 324 | F77: 649 | G77: 0 | H77: 0 | I77: 0 | J77: 0 | K77: 147 | L77: 295 | M77: 147 | N77: 295 | O77: 0 | P77: =R[-10]C+5 -> 40 | Q77: 15 | R77: 15
A78: 1000 | B78: =R[-1]C+1 -> 75 | C78: 9070 | D78: 4837 | E78: 332 | F78: 665 | G78: 0 | H78: 0 | I78: 0 | J78: 0 | K78: 150 | L78: 303 | M78: 150 | N78: 303 | O78: 0 | P78: =R[-10]C+5 -> 40 | Q78: 15 | R78: 15
A79: 1000 | B79: =R[-1]C+1 -> 76 | C79: 9295 | D79: 4957 | E79: 341 | F79: 682 | G79: 0 | H79: 0 | I79: 0 | J79: 0 | K79: 154 | L79: 310 | M79: 154 | N79: 310 | O79: 0 | P79: =R[-10]C+5 -> 40 | Q79: 15 | R79: 15
A80: 1000 | B80: =R[-1]C+1 -> 77 | C80: 9520 | D80: 5077 | E80: 349 | F80: 698 | G80: 0 | H80: 0 | I80: 0 | J80: 0 | K80: 158 | L80: 318 | M80: 158 | N80: 318 | O80: 0 | P80: =R[-10]C+5 -> 40 | Q80: 15 | R80: 15
A81: 1000 | B81: =R[-1]C+1 -> 78 | C81: 9745 | D81: 5197 | E81: 357 | F81: 715 | G81: 0 | H81: 0 | I81: 0 | J81: 0 | K81: 162 | L81: 325 | M81: 162 | N81: 325 | O81: 0 | P81: =R[-10]C+5 -> 40 | Q81: 15 | R81: 15
A82: 1000 | B82: =R[-1]C+1 -> 79 | C82: 9970 | D82: 5317 | E82: 365 | F82: 731 | G82: 0 | H82: 0 | I82: 0 | J82: 0 | K82: 165 | L82: 333 | M82: 165 | N82: 333 | O82: 0 | P82: =R[-10]C+5 -> 40 | Q82: 15 | R82: 15
A83: 1000 | B83: =R[-1]C+1 -> 80 | C83: 10209 | D83: 5444 | E83: 374 | F83: 748 | G83: 0 | H83: 0 | I83: 0 | J83: 0 | K83: 169 | L83: 340 | M83: 169 | N83: 340 | O83: 0 | P83: =R[-10]C+5 -> 40 | Q83: 15 | R83: 15
A84: 1000 | B84: =R[-1]C+1 -> 81 | C84: 10447 | D84: 5572 | E84: 383 | F84: 766 | G84: 0 | H84: 0 | I84: 0 | J84: 0 | K84: 173 | L84: 348 | M84: 173 | N84: 348 | O84: 0 | P84: =R[-10]C+5 -> 45 | Q84: 15 | R84: 15
A85: 1000 | B85: =R[-1]C+1 -> 82 | C85: 10686 | D85: 5699 | E85: 391 | F85: 783 | G85: 0 | H85: 0 | I85: 0 | J85: 0 | K85: 177 | L85: 356 | M85: 177 | N85: 356 | O85: 0 | P85: =R[-10]C+5 -> 45 | Q85: 15 | R85: 15
A86: 1000 | B86: =R[-1]C+1 -> 83 | C86: 10924 | D86: 5826 | E86: 400 | F86: 801 | G86: 0 | H86: 0 | I86: 0 | J86: 0 | K86: 181 | L86: 364 | M86: 181 | N86: 364 | O86: 0 | P86: =R[-10]C+5 -> 45 | Q86: 15 | R86: 15
A87: 1000 | B87: =R[-1]C+1 -> 84 | C87: 11163 | D87: 5953 | E87: 409 | F87: 818 | G87: 0 | H87: 0 | I87: 0 | J87: 0 | K87: 185 | L87: 372 | M87: 185 | N87: 372 | O87: 0 | P87: =R[-10]C+5 -> 45 | Q87: 15 | R87: 15
A88: 1000 | B88: =R[-1]C+1 -> 85 | C88: 11401 | D88: 6080 | E88: 418 | F88: 836 | G88: 0 | H88: 0 | I88: 0 | J88: 0 | K88: 189 | L88: 380 | M88: 189 | N88: 380 | O88: 0 | P88: =R[-10]C+5 -> 45 | Q88: 15 | R88: 15
A89: 1000 | B89: =R[-1]C+1 -> 86 | C89: 11640 | D89: 6208 | E89: 426 | F89: 853 | G89: 0 | H89: 0 | I89: 0 | J89: 0 | K89: 193 | L89: 388 | M89: 193 | N89: 388 | O89: 0 | P89: =R[-10]C+5 -> 45 | Q89: 15 | R89: 15
A90: 1000 | B90: =R[-1]C+1 -> 87 | C90: 11878 | D90: 6335 | E90: 435 | F90: 871 | G90: 0 | H90: 0 | I90: 0 | J90: 0 | K90: 197 | L90: 396 | M90: 197 | N90: 396 | O90: 0 | P90: =R[-10]C+5 -> 45 | Q90: 15 | R90: 15
A91: 1000 | B91: =R[-1]C+1 -> 88 | C91: 12117 | D91: 6462 | E91: 444 | F91: 888 | G91: 0 | H91: 0 | I91: 0 | J91: 0 | K91: 201 | L91: 404 | M91: 201 | N91: 404 | O91: 0 | P91: =R[-10]C+5 -> 45 | Q91: 15 | R91: 15
A92: 1000 | B92: =R[-1]C+1 -> 89 | C92: 12355 | D92: 6589 | E92: 453 | F92: 906 | G92: 0 | H92: 0 | I92: 0 | J92: 0 | K92: 205 | L92: 412 | M92: 205 | N92: 412 | O92: 0 | P92: =R[-10]C+5 -> 45 | Q92: 15 | R92: 15
A93: 1000 | B93: =R[-1]C+1 -> 90 | C93: 12607 | D93: 6724 | E93: 462 | F93: 924 | G93: 0 | H93: 0 | I93: 0 | J93: 0 | K93: 209 | L93: 420 | M93: 209 | N93: 420 | O93: 0 | P93: =R[-10]C+5 -> 45 | Q93: 15 | R93: 15
A94: 1000 | B94: =R[-1]C+1 -> 91 | C94: 12859 | D94: 6858 | E94: 471 | F94: 943 | G94: 0 | H94: 0 | I94: 0 | J94: 0 | K94: 213 | L94: 429 | M94: 213 | N94: 429 | O94: 0 | P94: =R[-10]C+5 -> 50 | Q94: 15 | R94: 15
A95: 1000 | B95: =R[-1]C+1 -> 92 | C95: 13111 | D95: 6992 | E95: 480 | F95: 961 | G95: 0 | H95: 0 | I95: 0 | J95: 0 | K95: 218 | L95: 437 | M95: 218 | N95: 437 | O95: 0 | P95: =R[-10]C+5 -> 50 | Q95: 15 | R95: 15
A96: 1000 | B96: =R[-1]C+1 -> 93 | C96: 13363 | D96: 7127 | E96: 490 | F96: 980 | G96: 0 | H96: 0 | I96: 0 | J96: 0 | K96: 222 | L96: 446 | M96: 222 | N96: 446 | O96: 0 | P96: =R[-10]C+5 -> 50 | Q96: 15 | R96: 15
A97: 1000 | B97: =R[-1]C+1 -> 94 | C97: 13615 | D97: 7261 | E97: 499 | F97: 998 | G97: 0 | H97: 0 | I97: 0 | J97: 0 | K97: 226 | L97: 454 | M97: 226 | N97: 454 | O97: 0 | P97: =R[-10]C+5 -> 50 | Q97: 15 | R97: 15
A98: 1000 | B98: =R[-1]C+1 -> 95 | C98: 13867 | D98: 7396 | E98: 508 | F98: 1017 | G98: 0 | H98: 0 | I98: 0 | J98: 0 | K98: 230 | L98: 462 | M98: 230 | N98: 462 | O98: 0 | P98: =R[-10]C+5 -> 50 | Q98: 15 | R98: 15
A99: 1000 | B99: =R[-1]C+1 -> 96 | C99: 14119 | D99: 7530 | E99: 517 | F99: 1035 | G99: 0 | H99: 0 | I99: 0 | J99: 0 | K99: 234 | L99: 471 | M99: 234 | N99: 471 | O99: 0 | P99: =R[-10]C+5 -> 50 | Q99: 15 | R99: 15
A100: 1000 | B100: =R[-1]C+1 -> 97 | C100: 14371 | D100: 7664 | E100: 527 | F100: 1054 | G100: 0 | H100: 0 | I100: 0 | J100: 0 | K100: 239 | L100: 479 | M100: 239 | N100: 479 | O100: 0 | P100: =R[-10]C+5 -> 50 | Q100: 15 | R100: 15
A101: 1000 | B101: =R[-1]C+1 -> 98 | C101: 14623 | D101: 7799 | E101: 536 | F101: 1072 | G101: 0 | H101: 0 | I101: 0 | J101: 0 | K101: 243 | L101: 488 | M101: 243 | N101: 488 | O101: 0 | P101: =R[-10]C+5 -> 50 | Q101: 15 | R101: 15
A102: 1000 | B102: =R[-1]C+1 -> 99 | C102: 14875 | D102: 7933 | E102: 545 | F102: 1091 | G102: 0 | H102: 0 | I102: 0 | J102: 0 | K102: 247 | L102: 496 | M102: 247 | N102: 496 | O102: 0 | P102: =R[-10]C+5 -> 50 | Q102: 15 | R102: 15
A103: 1000 | B103: =R[-1]C+1 -> 100 | C103: 15145 | D103: 8077 | E103: 555 | F103: 1111 | G103: 0 | H103: 0 | I103: 0 | J103: 0 | K103: 252 | L103: 505 | M103: 252 | N103: 505 | O103: 0 | P103: =R[-10]C+5 -> 50 | Q103: 15 | R103: 15
A104: 1000 | B104: =R[-1]C+1 -> 101 | C104: 15415 | D104: 8221 | E104: 565 | F104: 1130 | G104: 0 | H104: 0 | I104: 0 | J104: 0 | K104: 256 | L104: 514 | M104: 256 | N104: 514 | O104: 0 | P104: =R[-10]C+5 -> 55 | Q104: 15 | R104: 15
A105: 1000 | B105: =R[-1]C+1 -> 102 | C105: 15685 | D105: 8365 | E105: 575 | F105: 1150 | G105: 0 | H105: 0 | I105: 0 | J105: 0 | K105: 261 | L105: 523 | M105: 261 | N105: 523 | O105: 0 | P105: =R[-10]C+5 -> 55 | Q105: 15 | R105: 15
A106: 1000 | B106: =R[-1]C+1 -> 103 | C106: 15955 | D106: 8509 | E106: 585 | F106: 1170 | G106: 0 | H106: 0 | I106: 0 | J106: 0 | K106: 265 | L106: 532 | M106: 265 | N106: 532 | O106: 0 | P106: =R[-10]C+5 -> 55 | Q106: 15 | R106: 15
A107: 1000 | B107: =R[-1]C+1 -> 104 | C107: 16225 | D107: 8653 | E107: 595 | F107: 1190 | G107: 0 | H107: 0 | I107: 0 | J107: 0 | K107: 270 | L107: 541 | M107: 270 | N107: 541 | O107: 0 | P107: =R[-10]C+5 -> 55 | Q107: 15 | R107: 15
A108: 1000 | B108: =R[-1]C+1 -> 105 | C108: 16495 | D108: 8797 | E108: 605 | F108: 1210 | G108: 0 | H108: 0 | I108: 0 | J108: 0 | K108: 274 | L108: 550 | M108: 274 | N108: 550 | O108: 0 | P108: =R[-10]C+5 -> 55 | Q108: 15 | R108: 15
A109: 1000 | B109: =R[-1]C+1 -> 106 | C109: 16765 | D109: 8941 | E109: 614 | F109: 1229 | G109: 0 | H109: 0 | I109: 0 | J109: 0 | K109: 279 | L109: 559 | M109: 279 | N109: 559 | O109: 0 | P109: =R[-10]C+5 -> 55 | Q109: 15 | R109: 15
A110: 1000 | B110: =R[-1]C+1 -> 107 | C110: 17035 | D110: 9085 | E110: 624 | F110: 1249 | G110: 0 | H110: 0 | I110: 0 | J110: 0 | K110: 283 | L110: 568 | M110: 283 | N110: 568 | O110: 0 | P110: =R[-10]C+5 -> 55 | Q110: 15 | R110: 15
A111: 1000 | B111: =R[-1]C+1 -> 108 | C111: 17305 | D111: 9229 | E111: 634 | F111: 1269 | G111: 0 | H111: 0 | I111: 0 | J111: 0 | K111: 288 | L111: 577 | M111: 288 | N111: 577 | O111: 0 | P111: =R[-10]C+5 -> 55 | Q111: 15 | R111: 15
A112: 1000 | B112: =R[-1]C+1 -> 109 | C112: 17575 | D112: 9373 | E112: 644 | F112: 1289 | G112: 0 | H112: 0 | I112: 0 | J112: 0 | K112: 292 | L112: 586 | M112: 292 | N112: 586 | O112: 0 | P112: =R[-10]C+5 -> 55 | Q112: 15 | R112: 15
A113: 1000 | B113: =R[-1]C+1 -> 110 | C113: 17863 | D113: 9527 | E113: 655 | F113: 1310 | G113: 0 | H113: 0 | I113: 0 | J113: 0 | K113: 297 | L113: 596 | M113: 297 | N113: 596 | O113: 0 | P113: =R[-10]C+5 -> 55 | Q113: 15 | R113: 15
A114: 1000 | B114: =R[-1]C+1 -> 111 | C114: 18151 | D114: 9680 | E114: 665 | F114: 1331 | G114: 0 | H114: 0 | I114: 0 | J114: 0 | K114: 302 | L114: 605 | M114: 302 | N114: 605 | O114: 0 | P114: =R[-10]C+5 -> 60 | Q114: 15 | R114: 15
A115: 1000 | B115: =R[-1]C+1 -> 112 | C115: 18439 | D115: 9834 | E115: 676 | F115: 1352 | G115: 0 | H115: 0 | I115: 0 | J115: 0 | K115: 306 | L115: 615 | M115: 306 | N115: 615 | O115: 0 | P115: =R[-10]C+5 -> 60 | Q115: 15 | R115: 15
A116: 1000 | B116: =R[-1]C+1 -> 113 | C116: 18727 | D116: 9988 | E116: 686 | F116: 1373 | G116: 0 | H116: 0 | I116: 0 | J116: 0 | K116: 311 | L116: 624 | M116: 311 | N116: 624 | O116: 0 | P116: =R[-10]C+5 -> 60 | Q116: 15 | R116: 15
A117: 1000 | B117: =R[-1]C+1 -> 114 | C117: 19015 | D117: 10141 | E117: 697 | F117: 1394 | G117: 0 | H117: 0 | I117: 0 | J117: 0 | K117: 316 | L117: 634 | M117: 316 | N117: 634 | O117: 0 | P117: =R[-10]C+5 -> 60 | Q117: 15 | R117: 15
A118: 1000 | B118: =R[-1]C+1 -> 115 | C118: 19303 | D118: 10295 | E118: 707 | F118: 1415 | G118: 0 | H118: 0 | I118: 0 | J118: 0 | K118: 321 | L118: 644 | M118: 321 | N118: 644 | O118: 0 | P118: =R[-10]C+5 -> 60 | Q118: 15 | R118: 15
A119: 1000 | B119: =R[-1]C+1 -> 116 | C119: 19591 | D119: 10448 | E119: 718 | F119: 1437 | G119: 0 | H119: 0 | I119: 0 | J119: 0 | K119: 326 | L119: 653 | M119: 326 | N119: 653 | O119: 0 | P119: =R[-10]C+5 -> 60 | Q119: 15 | R119: 15
A120: 1000 | B120: =R[-1]C+1 -> 117 | C120: 19879 | D120: 10602 | E120: 729 | F120: 1458 | G120: 0 | H120: 0 | I120: 0 | J120: 0 | K120: 330 | L120: 663 | M120: 330 | N120: 663 | O120: 0 | P120: =R[-10]C+5 -> 60 | Q120: 15 | R120: 15
A121: 1000 | B121: =R[-1]C+1 -> 118 | C121: 20167 | D121: 10756 | E121: 739 | F121: 1479 | G121: 0 | H121: 0 | I121: 0 | J121: 0 | K121: 335 | L121: 672 | M121: 335 | N121: 672 | O121: 0 | P121: =R[-10]C+5 -> 60 | Q121: 15 | R121: 15
A122: 1000 | B122: =R[-1]C+1 -> 119 | C122: 20455 | D122: 10909 | E122: 750 | F122: 1500 | G122: 0 | H122: 0 | I122: 0 | J122: 0 | K122: 340 | L122: 682 | M122: 340 | N122: 682 | O122: 0 | P122: =R[-10]C+5 -> 60 | Q122: 15 | R122: 15
A123: 1000 | B123: =R[-1]C+1 -> 120 | C123: 20761 | D123: 11072 | E123: 761 | F123: 1522 | G123: 0 | H123: 0 | I123: 0 | J123: 0 | K123: 345 | L123: 692 | M123: 345 | N123: 692 | O123: 0 | P123: =R[-10]C+5 -> 60 | Q123: 15 | R123: 15
A124: 1000 | B124: 121 | C124: 21067 | D124: 11236 | E124: 772 | F124: 1545 | G124: 0 | H124: 0 | I124: 0 | J124: 0 | K124: 350 | L124: 702 | M124: 350 | N124: 702 | O124: 0 | P124: 65 | Q124: 15 | R124: 15
A125: 1000 | B125: 122 | C125: 21373 | D125: 11399 | E125: 783 | F125: 1567 | G125: 0 | H125: 0 | I125: 0 | J125: 0 | K125: 355 | L125: 713 | M125: 355 | N125: 713 | O125: 0 | P125: 65 | Q125: 15 | R125: 15
A126: 1000 | B126: 123 | C126: 21679 | D126: 11562 | E126: 795 | F126: 1590 | G126: 0 | H126: 0 | I126: 0 | J126: 0 | K126: 360 | L126: 723 | M126: 360 | N126: 723 | O126: 0 | P126: 65 | Q126: 15 | R126: 15
A127: 1000 | B127: 124 | C127: 21985 | D127: 11725 | E127: 806 | F127: 1612 | G127: 0 | H127: 0 | I127: 0 | J127: 0 | K127: 366 | L127: 733 | M127: 366 | N127: 733 | O127: 0 | P127: 65 | Q127: 15 | R127: 15
A128: 1000 | B128: 125 | C128: 22291 | D128: 11888 | E128: 817 | F128: 1635 | G128: 0 | H128: 0 | I128: 0 | J128: 0 | K128: 371 | L128: 743 | M128: 371 | N128: 743 | O128: 0 | P128: 65 | Q128: 15 | R128: 15
A129: 1000 | B129: 126 | C129: 22597 | D129: 12052 | E129: 828 | F129: 1657 | G129: 0 | H129: 0 | I129: 0 | J129: 0 | K129: 376 | L129: 753 | M129: 376 | N129: 753 | O129: 0 | P129: 65 | Q129: 15 | R129: 15
A130: 1000 | B130: 127 | C130: 22903 | D130: 12215 | E130: 839 | F130: 1679 | G130: 0 | H130: 0 | I130: 0 | J130: 0 | K130: 381 | L130: 764 | M130: 381 | N130: 764 | O130: 0 | P130: 65 | Q130: 15 | R130: 15
A131: 1000 | B131: 128 | C131: 23209 | D131: 12378 | E131: 851 | F131: 1702 | G131: 0 | H131: 0 | I131: 0 | J131: 0 | K131: 386 | L131: 774 | M131: 386 | N131: 774 | O131: 0 | P131: 65 | Q131: 15 | R131: 15
A132: 1000 | B132: 129 | C132: 23515 | D132: 12541 | E132: 862 | F132: 1724 | G132: 0 | H132: 0 | I132: 0 | J132: 0 | K132: 391 | L132: 784 | M132: 391 | N132: 784 | O132: 0 | P132: 65 | Q132: 15 | R132: 15
A133: 1000 | B133: 130 | C133: 23839 | D133: 12714 | E133: 874 | F133: 1748 | G133: 0 | H133: 0 | I133: 0 | J133: 0 | K133: 396 | L133: 795 | M133: 396 | N133: 795 | O133: 0 | P133: 65 | Q133: 15 | R133: 15
A134: 2000 | B134: 1 | C134: 11 | D134: 22 | E134: 0 | F134: 0 | G134: 1 | H134: 2 | I134: 0 | J134: 0 | K134: 0 | L134: 0 | M134: 0 | N134: 1 | O134: 0 | P134: 5 | Q134: 15 | R134: 15
A135: 2000 | B135: =R[-1]C+1 -> 2 | C135: 32 | D135: 61 | E135: 0 | F135: 0 | G135: 3 | H135: 6 | I135: 0 | J135: 0 | K135: 0 | L135: 1 | M135: 0 | N135: 2 | O135: 0 | P135: 5 | Q135: 15 | R135: 15
A136: 2000 | B136: =R[-1]C+1 -> 3 | C136: 53 | D136: 100 | E136: 0 | F136: 0 | G136: 5 | H136: 10 | I136: 0 | J136: 0 | K136: 0 | L136: 2 | M136: 1 | N136: 3 | O136: 0 | P136: 5 | Q136: 15 | R136: 15
A137: 2000 | B137: =R[-1]C+1 -> 4 | C137: 74 | D137: 139 | E137: 0 | F137: 0 | G137: 7 | H137: 14 | I137: 0 | J137: 0 | K137: 1 | L137: 2 | M137: 1 | N137: 5 | O137: 0 | P137: 5 | Q137: 15 | R137: 15
A138: 2000 | B138: =R[-1]C+1 -> 5 | C138: 95 | D138: 178 | E138: 0 | F138: 0 | G138: 9 | H138: 18 | I138: 0 | J138: 0 | K138: 1 | L138: 3 | M138: 2 | N138: 6 | O138: 0 | P138: 5 | Q138: 15 | R138: 15
A139: 2000 | B139: =R[-1]C+1 -> 6 | C139: 116 | D139: 217 | E139: 0 | F139: 0 | G139: 11 | H139: 22 | I139: 0 | J139: 0 | K139: 1 | L139: 4 | M139: 3 | N139: 7 | O139: 0 | P139: 5 | Q139: 15 | R139: 15
A140: 2000 | B140: =R[-1]C+1 -> 7 | C140: 137 | D140: 256 | E140: 0 | F140: 0 | G140: 13 | H140: 26 | I140: 0 | J140: 0 | K140: 2 | L140: 4 | M140: 3 | N140: 9 | O140: 0 | P140: 5 | Q140: 15 | R140: 15
A141: 2000 | B141: =R[-1]C+1 -> 8 | C141: 158 | D141: 295 | E141: 0 | F141: 0 | G141: 14 | H141: 29 | I141: 0 | J141: 0 | K141: 2 | L141: 5 | M141: 4 | N141: 10 | O141: 0 | P141: 5 | Q141: 15 | R141: 15
A142: 2000 | B142: =R[-1]C+1 -> 9 | C142: 179 | D142: 334 | E142: 0 | F142: 0 | G142: 16 | H142: 33 | I142: 0 | J142: 0 | K142: 2 | L142: 6 | M142: 5 | N142: 11 | O142: 0 | P142: 5 | Q142: 15 | R142: 15
A143: 2000 | B143: =R[-1]C+1 -> 10 | C143: 200 | D143: 373 | E143: 0 | F143: 0 | G143: 18 | H143: 37 | I143: 0 | J143: 0 | K143: 3 | L143: 7 | M143: 5 | N143: 13 | O143: 0 | P143: 5 | Q143: 15 | R143: 15
A144: 2000 | B144: =R[-1]C+1 -> 11 | C144: 221 | D144: 412 | E144: 0 | F144: 0 | G144: 20 | H144: 41 | I144: 0 | J144: 0 | K144: 3 | L144: 7 | M144: 6 | N144: 14 | O144: 0 | P144: =R[-10]C+5 -> 10 | Q144: 15 | R144: 15
A145: 2000 | B145: =R[-1]C+1 -> 12 | C145: 242 | D145: 451 | E145: 0 | F145: 0 | G145: 22 | H145: 45 | I145: 0 | J145: 0 | K145: 3 | L145: 8 | M145: 7 | N145: 15 | O145: 0 | P145: =R[-10]C+5 -> 10 | Q145: 15 | R145: 15
A146: 2000 | B146: =R[-1]C+1 -> 13 | C146: 263 | D146: 490 | E146: 0 | F146: 0 | G146: 24 | H146: 49 | I146: 0 | J146: 0 | K146: 4 | L146: 9 | M146: 7 | N146: 16 | O146: 0 | P146: =R[-10]C+5 -> 10 | Q146: 15 | R146: 15
A147: 2000 | B147: =R[-1]C+1 -> 14 | C147: 284 | D147: 529 | E147: 0 | F147: 0 | G147: 26 | H147: 53 | I147: 0 | J147: 0 | K147: 4 | L147: 9 | M147: 8 | N147: 18 | O147: 0 | P147: =R[-10]C+5 -> 10 | Q147: 15 | R147: 15
A148: 2000 | B148: =R[-1]C+1 -> 15 | C148: 305 | D148: 568 | E148: 0 | F148: 0 | G148: 28 | H148: 57 | I148: 0 | J148: 0 | K148: 4 | L148: 10 | M148: 9 | N148: 19 | O148: 0 | P148: =R[-10]C+5 -> 10 | Q148: 15 | R148: 15
A149: 2000 | B149: =R[-1]C+1 -> 16 | C149: 326 | D149: 607 | E149: 0 | F149: 0 | G149: 30 | H149: 61 | I149: 0 | J149: 0 | K149: 5 | L149: 11 | M149: 9 | N149: 20 | O149: 0 | P149: =R[-10]C+5 -> 10 | Q149: 15 | R149: 15
A150: 2000 | B150: =R[-1]C+1 -> 17 | C150: 347 | D150: 646 | E150: 0 | F150: 0 | G150: 32 | H150: 65 | I150: 0 | J150: 0 | K150: 5 | L150: 11 | M150: 10 | N150: 22 | O150: 0 | P150: =R[-10]C+5 -> 10 | Q150: 15 | R150: 15
A151: 2000 | B151: =R[-1]C+1 -> 18 | C151: 368 | D151: 685 | E151: 0 | F151: 0 | G151: 34 | H151: 68 | I151: 0 | J151: 0 | K151: 5 | L151: 12 | M151: 11 | N151: 23 | O151: 0 | P151: =R[-10]C+5 -> 10 | Q151: 15 | R151: 15
A152: 2000 | B152: =R[-1]C+1 -> 19 | C152: 389 | D152: 724 | E152: 0 | F152: 0 | G152: 36 | H152: 72 | I152: 0 | J152: 0 | K152: 6 | L152: 13 | M152: 11 | N152: 24 | O152: 0 | P152: =R[-10]C+5 -> 10 | Q152: 15 | R152: 15
A153: 2000 | B153: =R[-1]C+1 -> 20 | C153: 421 | D153: 782 | E153: 0 | F153: 0 | G153: 39 | H153: 78 | I153: 0 | J153: 0 | K153: 6 | L153: 14 | M153: 12 | N153: 26 | O153: 0 | P153: =R[-10]C+5 -> 10 | Q153: 15 | R153: 15
A154: 2000 | B154: =R[-1]C+1 -> 21 | C154: 452 | D154: 841 | E154: 0 | F154: 0 | G154: 42 | H154: 84 | I154: 0 | J154: 0 | K154: 7 | L154: 15 | M154: 13 | N154: 28 | O154: 0 | P154: =R[-10]C+5 -> 15 | Q154: 15 | R154: 15
A155: 2000 | B155: =R[-1]C+1 -> 22 | C155: 484 | D155: 899 | E155: 0 | F155: 0 | G155: 45 | H155: 90 | I155: 0 | J155: 0 | K155: 7 | L155: 16 | M155: 14 | N155: 30 | O155: 0 | P155: =R[-10]C+5 -> 15 | Q155: 15 | R155: 15
A156: 2000 | B156: =R[-1]C+1 -> 23 | C156: 515 | D156: 958 | E156: 0 | F156: 0 | G156: 48 | H156: 96 | I156: 0 | J156: 0 | K156: 8 | L156: 17 | M156: 15 | N156: 32 | O156: 0 | P156: =R[-10]C+5 -> 15 | Q156: 15 | R156: 15
A157: 2000 | B157: =R[-1]C+1 -> 24 | C157: 547 | D157: 1016 | E157: 0 | F157: 0 | G157: 51 | H157: 102 | I157: 0 | J157: 0 | K157: 8 | L157: 18 | M157: 16 | N157: 34 | O157: 0 | P157: =R[-10]C+5 -> 15 | Q157: 15 | R157: 15
A158: 2000 | B158: =R[-1]C+1 -> 25 | C158: 578 | D158: 1075 | E158: 0 | F158: 0 | G158: 53 | H158: 107 | I158: 0 | J158: 0 | K158: 9 | L158: 19 | M158: 17 | N158: 36 | O158: 0 | P158: =R[-10]C+5 -> 15 | Q158: 15 | R158: 15
A159: 2000 | B159: =R[-1]C+1 -> 26 | C159: 610 | D159: 1133 | E159: 0 | F159: 0 | G159: 56 | H159: 113 | I159: 0 | J159: 0 | K159: 9 | L159: 20 | M159: 18 | N159: 38 | O159: 0 | P159: =R[-10]C+5 -> 15 | Q159: 15 | R159: 15
A160: 2000 | B160: =R[-1]C+1 -> 27 | C160: 641 | D160: 1192 | E160: 0 | F160: 0 | G160: 59 | H160: 119 | I160: 0 | J160: 0 | K160: 10 | L160: 21 | M160: 19 | N160: 40 | O160: 0 | P160: =R[-10]C+5 -> 15 | Q160: 15 | R160: 15
A161: 2000 | B161: =R[-1]C+1 -> 28 | C161: 673 | D161: 1250 | E161: 0 | F161: 0 | G161: 62 | H161: 125 | I161: 0 | J161: 0 | K161: 11 | L161: 22 | M161: 20 | N161: 42 | O161: 0 | P161: =R[-10]C+5 -> 15 | Q161: 15 | R161: 15
A162: 2000 | B162: =R[-1]C+1 -> 29 | C162: 704 | D162: 1309 | E162: 0 | F162: 0 | G162: 65 | H162: 131 | I162: 0 | J162: 0 | K162: 11 | L162: 23 | M162: 21 | N162: 44 | O162: 0 | P162: =R[-10]C+5 -> 15 | Q162: 15 | R162: 15
A163: 2000 | B163: =R[-1]C+1 -> 30 | C163: 753 | D163: 1398 | E163: 0 | F163: 0 | G163: 70 | H163: 140 | I163: 0 | J163: 0 | K163: 12 | L163: 25 | M163: 22 | N163: 47 | O163: 0 | P163: =R[-10]C+5 -> 15 | Q163: 15 | R163: 15
A164: 2000 | B164: =R[-1]C+1 -> 31 | C164: 801 | D164: 1488 | E164: 0 | F164: 0 | G164: 74 | H164: 149 | I164: 0 | J164: 0 | K164: 13 | L164: 27 | M164: 24 | N164: 50 | O164: 0 | P164: =R[-10]C+5 -> 20 | Q164: 15 | R164: 15
A165: 2000 | B165: =R[-1]C+1 -> 32 | C165: 849 | D165: 1578 | E165: 0 | F165: 0 | G165: 79 | H165: 158 | I165: 0 | J165: 0 | K165: 13 | L165: 28 | M165: 25 | N165: 53 | O165: 0 | P165: =R[-10]C+5 -> 20 | Q165: 15 | R165: 15
A166: 2000 | B166: =R[-1]C+1 -> 33 | C166: 898 | D166: 1667 | E166: 0 | F166: 0 | G166: 83 | H166: 167 | I166: 0 | J166: 0 | K166: 14 | L166: 30 | M166: 27 | N166: 56 | O166: 0 | P166: =R[-10]C+5 -> 20 | Q166: 15 | R166: 15
A167: 2000 | B167: =R[-1]C+1 -> 34 | C167: 946 | D167: 1757 | E167: 0 | F167: 0 | G167: 88 | H167: 176 | I167: 0 | J167: 0 | K167: 15 | L167: 31 | M167: 28 | N167: 59 | O167: 0 | P167: =R[-10]C+5 -> 20 | Q167: 15 | R167: 15
A168: 2000 | B168: =R[-1]C+1 -> 35 | C168: 994 | D168: 1847 | E168: 0 | F168: 0 | G168: 92 | H168: 185 | I168: 0 | J168: 0 | K168: 16 | L168: 33 | M168: 30 | N168: 62 | O168: 0 | P168: =R[-10]C+5 -> 20 | Q168: 15 | R168: 15
A169: 2000 | B169: =R[-1]C+1 -> 36 | C169: 1043 | D169: 1937 | E169: 0 | F169: 0 | G169: 97 | H169: 194 | I169: 0 | J169: 0 | K169: 17 | L169: 35 | M169: 31 | N169: 65 | O169: 0 | P169: =R[-10]C+5 -> 20 | Q169: 15 | R169: 15
A170: 2000 | B170: =R[-1]C+1 -> 37 | C170: 1091 | D170: 2026 | E170: 0 | F170: 0 | G170: 101 | H170: 203 | I170: 0 | J170: 0 | K170: 17 | L170: 36 | M170: 33 | N170: 68 | O170: 0 | P170: =R[-10]C+5 -> 20 | Q170: 15 | R170: 15
A171: 2000 | B171: =R[-1]C+1 -> 38 | C171: 1139 | D171: 2116 | E171: 0 | F171: 0 | G171: 106 | H171: 212 | I171: 0 | J171: 0 | K171: 18 | L171: 38 | M171: 34 | N171: 71 | O171: 0 | P171: =R[-10]C+5 -> 20 | Q171: 15 | R171: 15
A172: 2000 | B172: =R[-1]C+1 -> 39 | C172: 1187 | D172: 2206 | E172: 0 | F172: 0 | G172: 110 | H172: 221 | I172: 0 | J172: 0 | K172: 19 | L172: 39 | M172: 36 | N172: 74 | O172: 0 | P172: =R[-10]C+5 -> 20 | Q172: 15 | R172: 15
A173: 2000 | B173: =R[-1]C+1 -> 40 | C173: 1250 | D173: 2323 | E173: 0 | F173: 0 | G173: 116 | H173: 232 | I173: 0 | J173: 0 | K173: 20 | L173: 42 | M173: 38 | N173: 78 | O173: 0 | P173: =R[-10]C+5 -> 20 | Q173: 15 | R173: 15
A174: 2000 | B174: =R[-1]C+1 -> 41 | C174: 1313 | D174: 2440 | E174: 0 | F174: 0 | G174: 122 | H174: 244 | I174: 0 | J174: 0 | K174: 21 | L174: 44 | M174: 40 | N174: 81 | O174: 0 | P174: =R[-10]C+5 -> 25 | Q174: 15 | R174: 15
A175: 2000 | B175: =R[-1]C+1 -> 42 | C175: 1376 | D175: 2557 | E175: 0 | F175: 0 | G175: 128 | H175: 256 | I175: 0 | J175: 0 | K175: 22 | L175: 46 | M175: 42 | N175: 85 | O175: 0 | P175: =R[-10]C+5 -> 25 | Q175: 15 | R175: 15
A176: 2000 | B176: =R[-1]C+1 -> 43 | C176: 1439 | D176: 2674 | E176: 0 | F176: 0 | G176: 133 | H176: 267 | I176: 0 | J176: 0 | K176: 23 | L176: 48 | M176: 44 | N176: 89 | O176: 0 | P176: =R[-10]C+5 -> 25 | Q176: 15 | R176: 15
A177: 2000 | B177: =R[-1]C+1 -> 44 | C177: 1502 | D177: 2791 | E177: 0 | F177: 0 | G177: 139 | H177: 279 | I177: 0 | J177: 0 | K177: 24 | L177: 50 | M177: 46 | N177: 93 | O177: 0 | P177: =R[-10]C+5 -> 25 | Q177: 15 | R177: 15
A178: 2000 | B178: =R[-1]C+1 -> 45 | C178: 1565 | D178: 2908 | E178: 0 | F178: 0 | G178: 145 | H178: 291 | I178: 0 | J178: 0 | K178: 25 | L178: 52 | M178: 48 | N178: 97 | O178: 0 | P178: =R[-10]C+5 -> 25 | Q178: 15 | R178: 15
A179: 2000 | B179: =R[-1]C+1 -> 46 | C179: 1628 | D179: 3025 | E179: 0 | F179: 0 | G179: 151 | H179: 302 | I179: 0 | J179: 0 | K179: 26 | L179: 54 | M179: 50 | N179: 101 | O179: 0 | P179: =R[-10]C+5 -> 25 | Q179: 15 | R179: 15
A180: 2000 | B180: =R[-1]C+1 -> 47 | C180: 1691 | D180: 3142 | E180: 0 | F180: 0 | G180: 157 | H180: 314 | I180: 0 | J180: 0 | K180: 28 | L180: 56 | M180: 52 | N180: 105 | O180: 0 | P180: =R[-10]C+5 -> 25 | Q180: 15 | R180: 15
A181: 2000 | B181: =R[-1]C+1 -> 48 | C181: 1754 | D181: 3259 | E181: 0 | F181: 0 | G181: 163 | H181: 326 | I181: 0 | J181: 0 | K181: 29 | L181: 58 | M181: 53 | N181: 109 | O181: 0 | P181: =R[-10]C+5 -> 25 | Q181: 15 | R181: 15
A182: 2000 | B182: =R[-1]C+1 -> 49 | C182: 1817 | D182: 3376 | E182: 0 | F182: 0 | G182: 169 | H182: 338 | I182: 0 | J182: 0 | K182: 30 | L182: 60 | M182: 55 | N182: 113 | O182: 0 | P182: =R[-10]C+5 -> 25 | Q182: 15 | R182: 15
A183: 2000 | B183: =R[-1]C+1 -> 50 | C183: 1901 | D183: 3532 | E183: 0 | F183: 0 | G183: 176 | H183: 353 | I183: 0 | J183: 0 | K183: 31 | L183: 63 | M183: 58 | N183: 118 | O183: 0 | P183: =R[-10]C+5 -> 25 | Q183: 15 | R183: 15
A184: 2000 | B184: =R[-1]C+1 -> 51 | C184: 1985 | D184: 3688 | E184: 0 | F184: 0 | G184: 184 | H184: 369 | I184: 0 | J184: 0 | K184: 32 | L184: 66 | M184: 61 | N184: 123 | O184: 0 | P184: =R[-10]C+5 -> 30 | Q184: 15 | R184: 15
A185: 2000 | B185: =R[-1]C+1 -> 52 | C185: 2069 | D185: 3844 | E185: 0 | F185: 0 | G185: 192 | H185: 384 | I185: 0 | J185: 0 | K185: 34 | L185: 69 | M185: 63 | N185: 128 | O185: 0 | P185: =R[-10]C+5 -> 30 | Q185: 15 | R185: 15
A186: 2000 | B186: =R[-1]C+1 -> 53 | C186: 2153 | D186: 4000 | E186: 0 | F186: 0 | G186: 200 | H186: 400 | I186: 0 | J186: 0 | K186: 35 | L186: 72 | M186: 66 | N186: 133 | O186: 0 | P186: =R[-10]C+5 -> 30 | Q186: 15 | R186: 15
A187: 2000 | B187: =R[-1]C+1 -> 54 | C187: 2237 | D187: 4156 | E187: 0 | F187: 0 | G187: 208 | H187: 416 | I187: 0 | J187: 0 | K187: 37 | L187: 74 | M187: 68 | N187: 139 | O187: 0 | P187: =R[-10]C+5 -> 30 | Q187: 15 | R187: 15
A188: 2000 | B188: =R[-1]C+1 -> 55 | C188: 2321 | D188: 4312 | E188: 0 | F188: 0 | G188: 215 | H188: 431 | I188: 0 | J188: 0 | K188: 38 | L188: 77 | M188: 71 | N188: 144 | O188: 0 | P188: =R[-10]C+5 -> 30 | Q188: 15 | R188: 15
A189: 2000 | B189: =R[-1]C+1 -> 56 | C189: 2405 | D189: 4468 | E189: 0 | F189: 0 | G189: 223 | H189: 447 | I189: 0 | J189: 0 | K189: 39 | L189: 80 | M189: 74 | N189: 149 | O189: 0 | P189: =R[-10]C+5 -> 30 | Q189: 15 | R189: 15
A190: 2000 | B190: =R[-1]C+1 -> 57 | C190: 2489 | D190: 4624 | E190: 0 | F190: 0 | G190: 231 | H190: 462 | I190: 0 | J190: 0 | K190: 41 | L190: 83 | M190: 76 | N190: 154 | O190: 0 | P190: =R[-10]C+5 -> 30 | Q190: 15 | R190: 15
A191: 2000 | B191: =R[-1]C+1 -> 58 | C191: 2573 | D191: 4780 | E191: 0 | F191: 0 | G191: 239 | H191: 478 | I191: 0 | J191: 0 | K191: 42 | L191: 86 | M191: 79 | N191: 159 | O191: 0 | P191: =R[-10]C+5 -> 30 | Q191: 15 | R191: 15
A192: 2000 | B192: =R[-1]C+1 -> 59 | C192: 2657 | D192: 4936 | E192: 0 | F192: 0 | G192: 247 | H192: 494 | I192: 0 | J192: 0 | K192: 44 | L192: 88 | M192: 81 | N192: 165 | O192: 0 | P192: =R[-10]C+5 -> 30 | Q192: 15 | R192: 15
A193: 2000 | B193: =R[-1]C+1 -> 60 | C193: 2752 | D193: 5111 | E193: 0 | F193: 0 | G193: 255 | H193: 511 | I193: 0 | J193: 0 | K193: 45 | L193: 92 | M193: 84 | N193: 170 | O193: 0 | P193: =R[-10]C+5 -> 30 | Q193: 15 | R193: 15
A194: 2000 | B194: =R[-1]C+1 -> 61 | C194: 2846 | D194: 5287 | E194: 0 | F194: 0 | G194: 264 | H194: 529 | I194: 0 | J194: 0 | K194: 47 | L194: 95 | M194: 87 | N194: 176 | O194: 0 | P194: =R[-10]C+5 -> 35 | Q194: 15 | R194: 15
A195: 2000 | B195: =R[-1]C+1 -> 62 | C195: 2941 | D195: 5462 | E195: 0 | F195: 0 | G195: 273 | H195: 546 | I195: 0 | J195: 0 | K195: 48 | L195: 98 | M195: 90 | N195: 182 | O195: 0 | P195: =R[-10]C+5 -> 35 | Q195: 15 | R195: 15
A196: 2000 | B196: =R[-1]C+1 -> 63 | C196: 3035 | D196: 5638 | E196: 0 | F196: 0 | G196: 282 | H196: 564 | I196: 0 | J196: 0 | K196: 50 | L196: 101 | M196: 93 | N196: 188 | O196: 0 | P196: =R[-10]C+5 -> 35 | Q196: 15 | R196: 15
A197: 2000 | B197: =R[-1]C+1 -> 64 | C197: 3130 | D197: 5813 | E197: 0 | F197: 0 | G197: 290 | H197: 581 | I197: 0 | J197: 0 | K197: 51 | L197: 104 | M197: 96 | N197: 194 | O197: 0 | P197: =R[-10]C+5 -> 35 | Q197: 15 | R197: 15
A198: 2000 | B198: =R[-1]C+1 -> 65 | C198: 3224 | D198: 5989 | E198: 0 | F198: 0 | G198: 299 | H198: 599 | I198: 0 | J198: 0 | K198: 53 | L198: 107 | M198: 99 | N198: 200 | O198: 0 | P198: =R[-10]C+5 -> 35 | Q198: 15 | R198: 15
A199: 2000 | B199: =R[-1]C+1 -> 66 | C199: 3319 | D199: 6164 | E199: 0 | F199: 0 | G199: 308 | H199: 616 | I199: 0 | J199: 0 | K199: 55 | L199: 110 | M199: 102 | N199: 206 | O199: 0 | P199: =R[-10]C+5 -> 35 | Q199: 15 | R199: 15
A200: 2000 | B200: =R[-1]C+1 -> 67 | C200: 3413 | D200: 6340 | E200: 0 | F200: 0 | G200: 317 | H200: 634 | I200: 0 | J200: 0 | K200: 56 | L200: 114 | M200: 105 | N200: 211 | O200: 0 | P200: =R[-10]C+5 -> 35 | Q200: 15 | R200: 15
A201: 2000 | B201: =R[-1]C+1 -> 68 | C201: 3508 | D201: 6515 | E201: 0 | F201: 0 | G201: 325 | H201: 651 | I201: 0 | J201: 0 | K201: 58 | L201: 117 | M201: 108 | N201: 217 | O201: 0 | P201: =R[-10]C+5 -> 35 | Q201: 15 | R201: 15
A202: 2000 | B202: =R[-1]C+1 -> 69 | C202: 3602 | D202: 6691 | E202: 0 | F202: 0 | G202: 334 | H202: 669 | I202: 0 | J202: 0 | K202: 59 | L202: 120 | M202: 111 | N202: 223 | O202: 0 | P202: =R[-10]C+5 -> 35 | Q202: 15 | R202: 15
A203: 2000 | B203: =R[-1]C+1 -> 70 | C203: 3707 | D203: 6886 | E203: 0 | F203: 0 | G203: 344 | H203: 689 | I203: 0 | J203: 0 | K203: 61 | L203: 123 | M203: 114 | N203: 230 | O203: 0 | P203: =R[-10]C+5 -> 35 | Q203: 15 | R203: 15
A204: 2000 | B204: =R[-1]C+1 -> 71 | C204: 3812 | D204: 7081 | E204: 0 | F204: 0 | G204: 354 | H204: 708 | I204: 0 | J204: 0 | K204: 63 | L204: 127 | M204: 117 | N204: 236 | O204: 0 | P204: =R[-10]C+5 -> 40 | Q204: 15 | R204: 15
A205: 2000 | B205: =R[-1]C+1 -> 72 | C205: 3917 | D205: 7276 | E205: 0 | F205: 0 | G205: 364 | H205: 728 | I205: 0 | J205: 0 | K205: 65 | L205: 130 | M205: 120 | N205: 243 | O205: 0 | P205: =R[-10]C+5 -> 40 | Q205: 15 | R205: 15
A206: 2000 | B206: =R[-1]C+1 -> 73 | C206: 4022 | D206: 7471 | E206: 0 | F206: 0 | G206: 373 | H206: 747 | I206: 0 | J206: 0 | K206: 66 | L206: 134 | M206: 124 | N206: 249 | O206: 0 | P206: =R[-10]C+5 -> 40 | Q206: 15 | R206: 15
A207: 2000 | B207: =R[-1]C+1 -> 74 | C207: 4127 | D207: 7666 | E207: 0 | F207: 0 | G207: 383 | H207: 767 | I207: 0 | J207: 0 | K207: 68 | L207: 137 | M207: 127 | N207: 256 | O207: 0 | P207: =R[-10]C+5 -> 40 | Q207: 15 | R207: 15
A208: 2000 | B208: =R[-1]C+1 -> 75 | C208: 4232 | D208: 7861 | E208: 0 | F208: 0 | G208: 393 | H208: 786 | I208: 0 | J208: 0 | K208: 70 | L208: 141 | M208: 130 | N208: 262 | O208: 0 | P208: =R[-10]C+5 -> 40 | Q208: 15 | R208: 15
A209: 2000 | B209: =R[-1]C+1 -> 76 | C209: 4337 | D209: 8056 | E209: 0 | F209: 0 | G209: 403 | H209: 806 | I209: 0 | J209: 0 | K209: 72 | L209: 144 | M209: 133 | N209: 269 | O209: 0 | P209: =R[-10]C+5 -> 40 | Q209: 15 | R209: 15
A210: 2000 | B210: =R[-1]C+1 -> 77 | C210: 4442 | D210: 8251 | E210: 0 | F210: 0 | G210: 412 | H210: 825 | I210: 0 | J210: 0 | K210: 73 | L210: 148 | M210: 137 | N210: 275 | O210: 0 | P210: =R[-10]C+5 -> 40 | Q210: 15 | R210: 15
A211: 2000 | B211: =R[-1]C+1 -> 78 | C211: 4547 | D211: 8446 | E211: 0 | F211: 0 | G211: 422 | H211: 845 | I211: 0 | J211: 0 | K211: 75 | L211: 151 | M211: 140 | N211: 282 | O211: 0 | P211: =R[-10]C+5 -> 40 | Q211: 15 | R211: 15
A212: 2000 | B212: =R[-1]C+1 -> 79 | C212: 4652 | D212: 8641 | E212: 0 | F212: 0 | G212: 432 | H212: 864 | I212: 0 | J212: 0 | K212: 77 | L212: 155 | M212: 143 | N212: 288 | O212: 0 | P212: =R[-10]C+5 -> 40 | Q212: 15 | R212: 15
A213: 2000 | B213: =R[-1]C+1 -> 80 | C213: 4764 | D213: 8847 | E213: 0 | F213: 0 | G213: 442 | H213: 885 | I213: 0 | J213: 0 | K213: 79 | L213: 159 | M213: 147 | N213: 295 | O213: 0 | P213: =R[-10]C+5 -> 40 | Q213: 15 | R213: 15
A214: 2000 | B214: =R[-1]C+1 -> 81 | C214: 4875 | D214: 9054 | E214: 0 | F214: 0 | G214: 452 | H214: 905 | I214: 0 | J214: 0 | K214: 81 | L214: 162 | M214: 150 | N214: 302 | O214: 0 | P214: =R[-10]C+5 -> 45 | Q214: 15 | R214: 15
A215: 2000 | B215: =R[-1]C+1 -> 82 | C215: 4986 | D215: 9261 | E215: 0 | F215: 0 | G215: 463 | H215: 926 | I215: 0 | J215: 0 | K215: 82 | L215: 166 | M215: 153 | N215: 309 | O215: 0 | P215: =R[-10]C+5 -> 45 | Q215: 15 | R215: 15
A216: 2000 | B216: =R[-1]C+1 -> 83 | C216: 5098 | D216: 9467 | E216: 0 | F216: 0 | G216: 473 | H216: 947 | I216: 0 | J216: 0 | K216: 84 | L216: 170 | M216: 157 | N216: 316 | O216: 0 | P216: =R[-10]C+5 -> 45 | Q216: 15 | R216: 15
A217: 2000 | B217: =R[-1]C+1 -> 84 | C217: 5209 | D217: 9674 | E217: 0 | F217: 0 | G217: 483 | H217: 967 | I217: 0 | J217: 0 | K217: 86 | L217: 173 | M217: 160 | N217: 323 | O217: 0 | P217: =R[-10]C+5 -> 45 | Q217: 15 | R217: 15
A218: 2000 | B218: =R[-1]C+1 -> 85 | C218: 5320 | D218: 9881 | E218: 0 | F218: 0 | G218: 494 | H218: 988 | I218: 0 | J218: 0 | K218: 88 | L218: 177 | M218: 164 | N218: 329 | O218: 0 | P218: =R[-10]C+5 -> 45 | Q218: 15 | R218: 15
A219: 2000 | B219: =R[-1]C+1 -> 86 | C219: 5432 | D219: 10088 | E219: 0 | F219: 0 | G219: 504 | H219: 1009 | I219: 0 | J219: 0 | K219: 90 | L219: 181 | M219: 167 | N219: 336 | O219: 0 | P219: =R[-10]C+5 -> 45 | Q219: 15 | R219: 15
A220: 2000 | B220: =R[-1]C+1 -> 87 | C220: 5543 | D220: 10294 | E220: 0 | F220: 0 | G220: 514 | H220: 1029 | I220: 0 | J220: 0 | K220: 92 | L220: 185 | M220: 171 | N220: 343 | O220: 0 | P220: =R[-10]C+5 -> 45 | Q220: 15 | R220: 15
A221: 2000 | B221: =R[-1]C+1 -> 88 | C221: 5654 | D221: 10501 | E221: 0 | F221: 0 | G221: 525 | H221: 1050 | I221: 0 | J221: 0 | K221: 94 | L221: 188 | M221: 174 | N221: 350 | O221: 0 | P221: =R[-10]C+5 -> 45 | Q221: 15 | R221: 15
A222: 2000 | B222: =R[-1]C+1 -> 89 | C222: 5765 | D222: 10708 | E222: 0 | F222: 0 | G222: 535 | H222: 1071 | I222: 0 | J222: 0 | K222: 95 | L222: 192 | M222: 178 | N222: 357 | O222: 0 | P222: =R[-10]C+5 -> 45 | Q222: 15 | R222: 15
A223: 2000 | B223: =R[-1]C+1 -> 90 | C223: 5883 | D223: 10926 | E223: 0 | F223: 0 | G223: 546 | H223: 1093 | I223: 0 | J223: 0 | K223: 97 | L223: 196 | M223: 181 | N223: 364 | O223: 0 | P223: =R[-10]C+5 -> 45 | Q223: 15 | R223: 15
A224: 2000 | B224: =R[-1]C+1 -> 91 | C224: 6001 | D224: 11144 | E224: 0 | F224: 0 | G224: 557 | H224: 1114 | I224: 0 | J224: 0 | K224: 99 | L224: 200 | M224: 185 | N224: 372 | O224: 0 | P224: =R[-10]C+5 -> 50 | Q224: 15 | R224: 15
A225: 2000 | B225: =R[-1]C+1 -> 92 | C225: 6118 | D225: 11363 | E225: 0 | F225: 0 | G225: 568 | H225: 1136 | I225: 0 | J225: 0 | K225: 101 | L225: 204 | M225: 189 | N225: 379 | O225: 0 | P225: =R[-10]C+5 -> 50 | Q225: 15 | R225: 15
A226: 2000 | B226: =R[-1]C+1 -> 93 | C226: 6236 | D226: 11581 | E226: 0 | F226: 0 | G226: 579 | H226: 1158 | I226: 0 | J226: 0 | K226: 103 | L226: 208 | M226: 192 | N226: 386 | O226: 0 | P226: =R[-10]C+5 -> 50 | Q226: 15 | R226: 15
A227: 2000 | B227: =R[-1]C+1 -> 94 | C227: 6353 | D227: 11800 | E227: 0 | F227: 0 | G227: 590 | H227: 1180 | I227: 0 | J227: 0 | K227: 105 | L227: 212 | M227: 196 | N227: 393 | O227: 0 | P227: =R[-10]C+5 -> 50 | Q227: 15 | R227: 15
A228: 2000 | B228: =R[-1]C+1 -> 95 | C228: 6471 | D228: 12018 | E228: 0 | F228: 0 | G228: 601 | H228: 1202 | I228: 0 | J228: 0 | K228: 107 | L228: 216 | M228: 199 | N228: 401 | O228: 0 | P228: =R[-10]C+5 -> 50 | Q228: 15 | R228: 15
A229: 2000 | B229: =R[-1]C+1 -> 96 | C229: 6589 | D229: 12236 | E229: 0 | F229: 0 | G229: 612 | H229: 1224 | I229: 0 | J229: 0 | K229: 109 | L229: 219 | M229: 203 | N229: 408 | O229: 0 | P229: =R[-10]C+5 -> 50 | Q229: 15 | R229: 15
A230: 2000 | B230: =R[-1]C+1 -> 97 | C230: 6706 | D230: 12455 | E230: 0 | F230: 0 | G230: 622 | H230: 1245 | I230: 0 | J230: 0 | K230: 111 | L230: 223 | M230: 207 | N230: 415 | O230: 0 | P230: =R[-10]C+5 -> 50 | Q230: 15 | R230: 15
A231: 2000 | B231: =R[-1]C+1 -> 98 | C231: 6824 | D231: 12673 | E231: 0 | F231: 0 | G231: 633 | H231: 1267 | I231: 0 | J231: 0 | K231: 113 | L231: 227 | M231: 210 | N231: 423 | O231: 0 | P231: =R[-10]C+5 -> 50 | Q231: 15 | R231: 15
A232: 2000 | B232: =R[-1]C+1 -> 99 | C232: 6941 | D232: 12892 | E232: 0 | F232: 0 | G232: 644 | H232: 1289 | I232: 0 | J232: 0 | K232: 115 | L232: 231 | M232: 214 | N232: 430 | O232: 0 | P232: =R[-10]C+5 -> 50 | Q232: 15 | R232: 15
A233: 2000 | B233: =R[-1]C+1 -> 100 | C233: 7067 | D233: 13126 | E233: 0 | F233: 0 | G233: 656 | H233: 1313 | I233: 0 | J233: 0 | K233: 117 | L233: 235 | M233: 218 | N233: 438 | O233: 0 | P233: =R[-10]C+5 -> 50 | Q233: 15 | R233: 15
A234: 2000 | B234: =R[-1]C+1 -> 101 | C234: 7193 | D234: 13360 | E234: 0 | F234: 0 | G234: 668 | H234: 1336 | I234: 0 | J234: 0 | K234: 119 | L234: 240 | M234: 222 | N234: 445 | O234: 0 | P234: =R[-10]C+5 -> 55 | Q234: 15 | R234: 15
A235: 2000 | B235: =R[-1]C+1 -> 102 | C235: 7319 | D235: 13594 | E235: 0 | F235: 0 | G235: 679 | H235: 1359 | I235: 0 | J235: 0 | K235: 121 | L235: 244 | M235: 226 | N235: 453 | O235: 0 | P235: =R[-10]C+5 -> 55 | Q235: 15 | R235: 15
A236: 2000 | B236: =R[-1]C+1 -> 103 | C236: 7445 | D236: 13828 | E236: 0 | F236: 0 | G236: 691 | H236: 1383 | I236: 0 | J236: 0 | K236: 123 | L236: 248 | M236: 230 | N236: 461 | O236: 0 | P236: =R[-10]C+5 -> 55 | Q236: 15 | R236: 15
A237: 2000 | B237: =R[-1]C+1 -> 104 | C237: 7571 | D237: 14062 | E237: 0 | F237: 0 | G237: 703 | H237: 1406 | I237: 0 | J237: 0 | K237: 126 | L237: 252 | M237: 234 | N237: 469 | O237: 0 | P237: =R[-10]C+5 -> 55 | Q237: 15 | R237: 15
A238: 2000 | B238: =R[-1]C+1 -> 105 | C238: 7697 | D238: 14296 | E238: 0 | F238: 0 | G238: 715 | H238: 1430 | I238: 0 | J238: 0 | K238: 128 | L238: 256 | M238: 237 | N238: 477 | O238: 0 | P238: =R[-10]C+5 -> 55 | Q238: 15 | R238: 15
A239: 2000 | B239: =R[-1]C+1 -> 106 | C239: 7823 | D239: 14530 | E239: 0 | F239: 0 | G239: 726 | H239: 1453 | I239: 0 | J239: 0 | K239: 130 | L239: 261 | M239: 241 | N239: 484 | O239: 0 | P239: =R[-10]C+5 -> 55 | Q239: 15 | R239: 15
A240: 2000 | B240: =R[-1]C+1 -> 107 | C240: 7949 | D240: 14764 | E240: 0 | F240: 0 | G240: 738 | H240: 1476 | I240: 0 | J240: 0 | K240: 132 | L240: 265 | M240: 245 | N240: 492 | O240: 0 | P240: =R[-10]C+5 -> 55 | Q240: 15 | R240: 15
A241: 2000 | B241: =R[-1]C+1 -> 108 | C241: 8075 | D241: 14998 | E241: 0 | F241: 0 | G241: 750 | H241: 1500 | I241: 0 | J241: 0 | K241: 134 | L241: 269 | M241: 249 | N241: 500 | O241: 0 | P241: =R[-10]C+5 -> 55 | Q241: 15 | R241: 15
A242: 2000 | B242: =R[-1]C+1 -> 109 | C242: 8201 | D242: 15232 | E242: 0 | F242: 0 | G242: 761 | H242: 1523 | I242: 0 | J242: 0 | K242: 136 | L242: 273 | M242: 253 | N242: 508 | O242: 0 | P242: =R[-10]C+5 -> 55 | Q242: 15 | R242: 15
A243: 2000 | B243: =R[-1]C+1 -> 110 | C243: 8336 | D243: 15481 | E243: 0 | F243: 0 | G243: 774 | H243: 1548 | I243: 0 | J243: 0 | K243: 138 | L243: 278 | M243: 257 | N243: 516 | O243: 0 | P243: =R[-10]C+5 -> 55 | Q243: 15 | R243: 15
A244: 2000 | B244: =R[-1]C+1 -> 111 | C244: 8470 | D244: 15731 | E244: 0 | F244: 0 | G244: 786 | H244: 1573 | I244: 0 | J244: 0 | K244: 140 | L244: 282 | M244: 261 | N244: 524 | O244: 0 | P244: =R[-10]C+5 -> 60 | Q244: 15 | R244: 15
A245: 2000 | B245: =R[-1]C+1 -> 112 | C245: 8605 | D245: 15980 | E245: 0 | F245: 0 | G245: 799 | H245: 1598 | I245: 0 | J245: 0 | K245: 143 | L245: 287 | M245: 265 | N245: 533 | O245: 0 | P245: =R[-10]C+5 -> 60 | Q245: 15 | R245: 15
A246: 2000 | B246: =R[-1]C+1 -> 113 | C246: 8739 | D246: 16230 | E246: 0 | F246: 0 | G246: 811 | H246: 1623 | I246: 0 | J246: 0 | K246: 145 | L246: 291 | M246: 270 | N246: 541 | O246: 0 | P246: =R[-10]C+5 -> 60 | Q246: 15 | R246: 15
A247: 2000 | B247: =R[-1]C+1 -> 114 | C247: 8873 | D247: 16480 | E247: 0 | F247: 0 | G247: 824 | H247: 1648 | I247: 0 | J247: 0 | K247: 147 | L247: 296 | M247: 274 | N247: 549 | O247: 0 | P247: =R[-10]C+5 -> 60 | Q247: 15 | R247: 15
A248: 2000 | B248: =R[-1]C+1 -> 115 | C248: 9008 | D248: 16729 | E248: 0 | F248: 0 | G248: 836 | H248: 1673 | I248: 0 | J248: 0 | K248: 149 | L248: 300 | M248: 278 | N248: 558 | O248: 0 | P248: =R[-10]C+5 -> 60 | Q248: 15 | R248: 15
A249: 2000 | B249: =R[-1]C+1 -> 116 | C249: 9142 | D249: 16979 | E249: 0 | F249: 0 | G249: 849 | H249: 1698 | I249: 0 | J249: 0 | K249: 152 | L249: 305 | M249: 282 | N249: 566 | O249: 0 | P249: =R[-10]C+5 -> 60 | Q249: 15 | R249: 15
A250: 2000 | B250: =R[-1]C+1 -> 117 | C250: 9277 | D250: 17228 | E250: 0 | F250: 0 | G250: 861 | H250: 1723 | I250: 0 | J250: 0 | K250: 154 | L250: 309 | M250: 286 | N250: 574 | O250: 0 | P250: =R[-10]C+5 -> 60 | Q250: 15 | R250: 15
A251: 2000 | B251: =R[-1]C+1 -> 118 | C251: 9411 | D251: 17478 | E251: 0 | F251: 0 | G251: 874 | H251: 1748 | I251: 0 | J251: 0 | K251: 156 | L251: 314 | M251: 290 | N251: 583 | O251: 0 | P251: =R[-10]C+5 -> 60 | Q251: 15 | R251: 15
A252: 2000 | B252: =R[-1]C+1 -> 119 | C252: 9545 | D252: 17728 | E252: 0 | F252: 0 | G252: 886 | H252: 1773 | I252: 0 | J252: 0 | K252: 158 | L252: 318 | M252: 295 | N252: 591 | O252: 0 | P252: =R[-10]C+5 -> 60 | Q252: 15 | R252: 15
A253: 2000 | B253: =R[-1]C+1 -> 120 | C253: 9688 | D253: 17993 | E253: 0 | F253: 0 | G253: 899 | H253: 1799 | I253: 0 | J253: 0 | K253: 161 | L253: 323 | M253: 299 | N253: 600 | O253: 0 | P253: =R[-10]C+5 -> 60 | Q253: 15 | R253: 15
A254: 2000 | B254: 121 | C254: 9831 | D254: 18258 | E254: 0 | F254: 0 | G254: 913 | H254: 1826 | I254: 0 | J254: 0 | K254: 163 | L254: 328 | M254: 303 | N254: 609 | O254: 0 | P254: 65 | Q254: 15 | R254: 15
A255: 2000 | B255: 122 | C255: 9974 | D255: 18523 | E255: 0 | F255: 0 | G255: 926 | H255: 1852 | I255: 0 | J255: 0 | K255: 166 | L255: 332 | M255: 308 | N255: 618 | O255: 0 | P255: 65 | Q255: 15 | R255: 15
A256: 2000 | B256: 123 | C256: 10117 | D256: 18788 | E256: 0 | F256: 0 | G256: 939 | H256: 1879 | I256: 0 | J256: 0 | K256: 168 | L256: 337 | M256: 312 | N256: 626 | O256: 0 | P256: 65 | Q256: 15 | R256: 15
A257: 2000 | B257: 124 | C257: 10259 | D257: 19054 | E257: 0 | F257: 0 | G257: 952 | H257: 1905 | I257: 0 | J257: 0 | K257: 170 | L257: 342 | M257: 317 | N257: 635 | O257: 0 | P257: 65 | Q257: 15 | R257: 15
A258: 2000 | B258: 125 | C258: 10402 | D258: 19319 | E258: 0 | F258: 0 | G258: 966 | H258: 1932 | I258: 0 | J258: 0 | K258: 173 | L258: 347 | M258: 321 | N258: 644 | O258: 0 | P258: 65 | Q258: 15 | R258: 15
A259: 2000 | B259: 126 | C259: 10545 | D259: 19584 | E259: 0 | F259: 0 | G259: 979 | H259: 1958 | I259: 0 | J259: 0 | K259: 175 | L259: 351 | M259: 326 | N259: 653 | O259: 0 | P259: 65 | Q259: 15 | R259: 15
A260: 2000 | B260: 127 | C260: 10688 | D260: 19849 | E260: 0 | F260: 0 | G260: 992 | H260: 1985 | I260: 0 | J260: 0 | K260: 177 | L260: 356 | M260: 330 | N260: 662 | O260: 0 | P260: 65 | Q260: 15 | R260: 15
A261: 2000 | B261: 128 | C261: 10831 | D261: 20114 | E261: 0 | F261: 0 | G261: 1005 | H261: 2011 | I261: 0 | J261: 0 | K261: 180 | L261: 361 | M261: 334 | N261: 671 | O261: 0 | P261: 65 | Q261: 15 | R261: 15
A262: 2000 | B262: 129 | C262: 10973 | D262: 20380 | E262: 0 | F262: 0 | G262: 1019 | H262: 2038 | I262: 0 | J262: 0 | K262: 182 | L262: 366 | M262: 339 | N262: 679 | O262: 0 | P262: 65 | Q262: 15 | R262: 15
A263: 2000 | B263: 130 | C263: 11125 | D263: 20660 | E263: 0 | F263: 0 | G263: 1033 | H263: 2066 | I263: 0 | J263: 0 | K263: 185 | L263: 371 | M263: 343 | N263: 689 | O263: 0 | P263: 65 | Q263: 15 | R263: 15
A264: 3000 | B264: 1 | C264: 18 | D264: 18 | E264: 0 | F264: 0 | G264: 0 | H264: 0 | I264: 1 | J264: 2 | K264: 0 | L264: 1 | M264: 0 | N264: 1 | O264: 0 | P264: 5 | Q264: 15 | R264: 15
A265: 3000 | B265: =R[-1]C+1 -> 2 | C265: 51 | D265: 51 | E265: 0 | F265: 0 | G265: 0 | H265: 0 | I265: 3 | J265: 6 | K265: 0 | L265: 2 | M265: 0 | N265: 2 | O265: 0 | P265: 5 | Q265: 15 | R265: 15
A266: 3000 | B266: =R[-1]C+1 -> 3 | C266: 84 | D266: 84 | E266: 0 | F266: 0 | G266: 0 | H266: 0 | I266: 4 | J266: 9 | K266: 1 | L266: 3 | M266: 1 | N266: 3 | O266: 0 | P266: 5 | Q266: 15 | R266: 15
A267: 3000 | B267: =R[-1]C+1 -> 4 | C267: 117 | D267: 117 | E267: 0 | F267: 0 | G267: 0 | H267: 0 | I267: 6 | J267: 13 | K267: 1 | L267: 4 | M267: 1 | N267: 4 | O267: 0 | P267: 5 | Q267: 15 | R267: 15
A268: 3000 | B268: =R[-1]C+1 -> 5 | C268: 150 | D268: 150 | E268: 0 | F268: 0 | G268: 0 | H268: 0 | I268: 8 | J268: 16 | K268: 2 | L268: 5 | M268: 2 | N268: 6 | O268: 0 | P268: 5 | Q268: 15 | R268: 15
A269: 3000 | B269: =R[-1]C+1 -> 6 | C269: 183 | D269: 183 | E269: 0 | F269: 0 | G269: 0 | H269: 0 | I269: 10 | J269: 20 | K269: 2 | L269: 6 | M269: 3 | N269: 7 | O269: 0 | P269: 5 | Q269: 15 | R269: 15
A270: 3000 | B270: =R[-1]C+1 -> 7 | C270: 216 | D270: 216 | E270: 0 | F270: 0 | G270: 0 | H270: 0 | I270: 12 | J270: 24 | K270: 3 | L270: 7 | M270: 3 | N270: 8 | O270: 0 | P270: 5 | Q270: 15 | R270: 15
A271: 3000 | B271: =R[-1]C+1 -> 8 | C271: 249 | D271: 249 | E271: 0 | F271: 0 | G271: 0 | H271: 0 | I271: 13 | J271: 27 | K271: 3 | L271: 8 | M271: 4 | N271: 9 | O271: 0 | P271: 5 | Q271: 15 | R271: 15
A272: 3000 | B272: =R[-1]C+1 -> 9 | C272: 282 | D272: 282 | E272: 0 | F272: 0 | G272: 0 | H272: 0 | I272: 15 | J272: 31 | K272: 4 | L272: 9 | M272: 4 | N272: 10 | O272: 0 | P272: 5 | Q272: 15 | R272: 15
A273: 3000 | B273: =R[-1]C+1 -> 10 | C273: 315 | D273: 315 | E273: 0 | F273: 0 | G273: 0 | H273: 0 | I273: 17 | J273: 34 | K273: 4 | L273: 11 | M273: 5 | N273: 12 | O273: 0 | P273: 5 | Q273: 15 | R273: 15
A274: 3000 | B274: =R[-1]C+1 -> 11 | C274: 348 | D274: 348 | E274: 0 | F274: 0 | G274: 0 | H274: 0 | I274: 19 | J274: 38 | K274: 5 | L274: 12 | M274: 6 | N274: 13 | O274: 0 | P274: =R[-10]C+5 -> 10 | Q274: 15 | R274: 15
A275: 3000 | B275: =R[-1]C+1 -> 12 | C275: 381 | D275: 381 | E275: 0 | F275: 0 | G275: 0 | H275: 0 | I275: 21 | J275: 42 | K275: 6 | L275: 13 | M275: 6 | N275: 14 | O275: 0 | P275: =R[-10]C+5 -> 10 | Q275: 15 | R275: 15
A276: 3000 | B276: =R[-1]C+1 -> 13 | C276: 414 | D276: 414 | E276: 0 | F276: 0 | G276: 0 | H276: 0 | I276: 22 | J276: 45 | K276: 6 | L276: 14 | M276: 7 | N276: 15 | O276: 0 | P276: =R[-10]C+5 -> 10 | Q276: 15 | R276: 15
A277: 3000 | B277: =R[-1]C+1 -> 14 | C277: 447 | D277: 447 | E277: 0 | F277: 0 | G277: 0 | H277: 0 | I277: 24 | J277: 49 | K277: 7 | L277: 15 | M277: 7 | N277: 16 | O277: 0 | P277: =R[-10]C+5 -> 10 | Q277: 15 | R277: 15
A278: 3000 | B278: =R[-1]C+1 -> 15 | C278: 480 | D278: 480 | E278: 0 | F278: 0 | G278: 0 | H278: 0 | I278: 26 | J278: 52 | K278: 7 | L278: 16 | M278: 8 | N278: 18 | O278: 0 | P278: =R[-10]C+5 -> 10 | Q278: 15 | R278: 15
A279: 3000 | B279: =R[-1]C+1 -> 16 | C279: 513 | D279: 513 | E279: 0 | F279: 0 | G279: 0 | H279: 0 | I279: 28 | J279: 56 | K279: 8 | L279: 17 | M279: 9 | N279: 19 | O279: 0 | P279: =R[-10]C+5 -> 10 | Q279: 15 | R279: 15
A280: 3000 | B280: =R[-1]C+1 -> 17 | C280: 546 | D280: 546 | E280: 0 | F280: 0 | G280: 0 | H280: 0 | I280: 30 | J280: 60 | K280: 8 | L280: 18 | M280: 9 | N280: 20 | O280: 0 | P280: =R[-10]C+5 -> 10 | Q280: 15 | R280: 15
A281: 3000 | B281: =R[-1]C+1 -> 18 | C281: 579 | D281: 579 | E281: 0 | F281: 0 | G281: 0 | H281: 0 | I281: 31 | J281: 63 | K281: 9 | L281: 19 | M281: 10 | N281: 21 | O281: 0 | P281: =R[-10]C+5 -> 10 | Q281: 15 | R281: 15
A282: 3000 | B282: =R[-1]C+1 -> 19 | C282: 612 | D282: 612 | E282: 0 | F282: 0 | G282: 0 | H282: 0 | I282: 33 | J282: 67 | K282: 9 | L282: 20 | M282: 10 | N282: 22 | O282: 0 | P282: =R[-10]C+5 -> 10 | Q282: 15 | R282: 15
A283: 3000 | B283: =R[-1]C+1 -> 20 | C283: 662 | D283: 662 | E283: 0 | F283: 0 | G283: 0 | H283: 0 | I283: 36 | J283: 72 | K283: 10 | L283: 22 | M283: 11 | N283: 24 | O283: 0 | P283: =R[-10]C+5 -> 10 | Q283: 15 | R283: 15
A284: 3000 | B284: =R[-1]C+1 -> 21 | C284: 711 | D284: 711 | E284: 0 | F284: 0 | G284: 0 | H284: 0 | I284: 39 | J284: 78 | K284: 11 | L284: 24 | M284: 12 | N284: 26 | O284: 0 | P284: =R[-10]C+5 -> 15 | Q284: 15 | R284: 15
A285: 3000 | B285: =R[-1]C+1 -> 22 | C285: 761 | D285: 761 | E285: 0 | F285: 0 | G285: 0 | H285: 0 | I285: 41 | J285: 83 | K285: 12 | L285: 25 | M285: 13 | N285: 28 | O285: 0 | P285: =R[-10]C+5 -> 15 | Q285: 15 | R285: 15
A286: 3000 | B286: =R[-1]C+1 -> 23 | C286: 810 | D286: 810 | E286: 0 | F286: 0 | G286: 0 | H286: 0 | I286: 44 | J286: 88 | K286: 13 | L286: 27 | M286: 14 | N286: 30 | O286: 0 | P286: =R[-10]C+5 -> 15 | Q286: 15 | R286: 15
A287: 3000 | B287: =R[-1]C+1 -> 24 | C287: 860 | D287: 860 | E287: 0 | F287: 0 | G287: 0 | H287: 0 | I287: 47 | J287: 94 | K287: 14 | L287: 29 | M287: 15 | N287: 31 | O287: 0 | P287: =R[-10]C+5 -> 15 | Q287: 15 | R287: 15
A288: 3000 | B288: =R[-1]C+1 -> 25 | C288: 909 | D288: 909 | E288: 0 | F288: 0 | G288: 0 | H288: 0 | I288: 49 | J288: 99 | K288: 14 | L288: 30 | M288: 16 | N288: 33 | O288: 0 | P288: =R[-10]C+5 -> 15 | Q288: 15 | R288: 15
A289: 3000 | B289: =R[-1]C+1 -> 26 | C289: 959 | D289: 959 | E289: 0 | F289: 0 | G289: 0 | H289: 0 | I289: 52 | J289: 105 | K289: 15 | L289: 32 | M289: 17 | N289: 35 | O289: 0 | P289: =R[-10]C+5 -> 15 | Q289: 15 | R289: 15
A290: 3000 | B290: =R[-1]C+1 -> 27 | C290: 1008 | D290: 1008 | E290: 0 | F290: 0 | G290: 0 | H290: 0 | I290: 55 | J290: 110 | K290: 16 | L290: 34 | M290: 18 | N290: 37 | O290: 0 | P290: =R[-10]C+5 -> 15 | Q290: 15 | R290: 15
A291: 3000 | B291: =R[-1]C+1 -> 28 | C291: 1058 | D291: 1058 | E291: 0 | F291: 0 | G291: 0 | H291: 0 | I291: 57 | J291: 115 | K291: 17 | L291: 35 | M291: 18 | N291: 39 | O291: 0 | P291: =R[-10]C+5 -> 15 | Q291: 15 | R291: 15
A292: 3000 | B292: =R[-1]C+1 -> 29 | C292: 1107 | D292: 1107 | E292: 0 | F292: 0 | G292: 0 | H292: 0 | I292: 60 | J292: 121 | K292: 18 | L292: 37 | M292: 19 | N292: 40 | O292: 0 | P292: =R[-10]C+5 -> 15 | Q292: 15 | R292: 15
A293: 3000 | B293: =R[-1]C+1 -> 30 | C293: 1183 | D293: 1183 | E293: 0 | F293: 0 | G293: 0 | H293: 0 | I293: 64 | J293: 129 | K293: 19 | L293: 39 | M293: 21 | N293: 43 | O293: 0 | P293: =R[-10]C+5 -> 15 | Q293: 15 | R293: 15
A294: 3000 | B294: =R[-1]C+1 -> 31 | C294: 1259 | D294: 1259 | E294: 0 | F294: 0 | G294: 0 | H294: 0 | I294: 68 | J294: 137 | K294: 20 | L294: 42 | M294: 22 | N294: 46 | O294: 0 | P294: =R[-10]C+5 -> 20 | Q294: 15 | R294: 15
A295: 3000 | B295: =R[-1]C+1 -> 32 | C295: 1335 | D295: 1335 | E295: 0 | F295: 0 | G295: 0 | H295: 0 | I295: 73 | J295: 146 | K295: 21 | L295: 44 | M295: 23 | N295: 49 | O295: 0 | P295: =R[-10]C+5 -> 20 | Q295: 15 | R295: 15
A296: 3000 | B296: =R[-1]C+1 -> 33 | C296: 1411 | D296: 1411 | E296: 0 | F296: 0 | G296: 0 | H296: 0 | I296: 77 | J296: 154 | K296: 23 | L296: 47 | M296: 25 | N296: 51 | O296: 0 | P296: =R[-10]C+5 -> 20 | Q296: 15 | R296: 15
A297: 3000 | B297: =R[-1]C+1 -> 34 | C297: 1487 | D297: 1487 | E297: 0 | F297: 0 | G297: 0 | H297: 0 | I297: 81 | J297: 162 | K297: 24 | L297: 50 | M297: 26 | N297: 54 | O297: 0 | P297: =R[-10]C+5 -> 20 | Q297: 15 | R297: 15
A298: 3000 | B298: =R[-1]C+1 -> 35 | C298: 1563 | D298: 1563 | E298: 0 | F298: 0 | G298: 0 | H298: 0 | I298: 85 | J298: 170 | K298: 25 | L298: 52 | M298: 28 | N298: 57 | O298: 0 | P298: =R[-10]C+5 -> 20 | Q298: 15 | R298: 15
A299: 3000 | B299: =R[-1]C+1 -> 36 | C299: 1639 | D299: 1639 | E299: 0 | F299: 0 | G299: 0 | H299: 0 | I299: 89 | J299: 179 | K299: 27 | L299: 55 | M299: 29 | N299: 60 | O299: 0 | P299: =R[-10]C+5 -> 20 | Q299: 15 | R299: 15
A300: 3000 | B300: =R[-1]C+1 -> 37 | C300: 1714 | D300: 1714 | E300: 0 | F300: 0 | G300: 0 | H300: 0 | I300: 93 | J300: 187 | K300: 28 | L300: 57 | M300: 30 | N300: 62 | O300: 0 | P300: =R[-10]C+5 -> 20 | Q300: 15 | R300: 15
A301: 3000 | B301: =R[-1]C+1 -> 38 | C301: 1790 | D301: 1790 | E301: 0 | F301: 0 | G301: 0 | H301: 0 | I301: 97 | J301: 195 | K301: 29 | L301: 60 | M301: 32 | N301: 65 | O301: 0 | P301: =R[-10]C+5 -> 20 | Q301: 15 | R301: 15
A302: 3000 | B302: =R[-1]C+1 -> 39 | C302: 1866 | D302: 1866 | E302: 0 | F302: 0 | G302: 0 | H302: 0 | I302: 102 | J302: 204 | K302: 30 | L302: 62 | M302: 33 | N302: 68 | O302: 0 | P302: =R[-10]C+5 -> 20 | Q302: 15 | R302: 15
A303: 3000 | B303: =R[-1]C+1 -> 40 | C303: 1965 | D303: 1965 | E303: 0 | F303: 0 | G303: 0 | H303: 0 | I303: 107 | J303: 214 | K303: 32 | L303: 66 | M303: 35 | N303: 72 | O303: 0 | P303: =R[-10]C+5 -> 20 | Q303: 15 | R303: 15
A304: 3000 | B304: =R[-1]C+1 -> 41 | C304: 2064 | D304: 2064 | E304: 0 | F304: 0 | G304: 0 | H304: 0 | I304: 112 | J304: 225 | K304: 34 | L304: 69 | M304: 37 | N304: 75 | O304: 0 | P304: =R[-10]C+5 -> 25 | Q304: 15 | R304: 15
A305: 3000 | B305: =R[-1]C+1 -> 42 | C305: 2163 | D305: 2163 | E305: 0 | F305: 0 | G305: 0 | H305: 0 | I305: 118 | J305: 236 | K305: 35 | L305: 72 | M305: 39 | N305: 79 | O305: 0 | P305: =R[-10]C+5 -> 25 | Q305: 15 | R305: 15
A306: 3000 | B306: =R[-1]C+1 -> 43 | C306: 2262 | D306: 2262 | E306: 0 | F306: 0 | G306: 0 | H306: 0 | I306: 123 | J306: 247 | K306: 37 | L306: 75 | M306: 40 | N306: 82 | O306: 0 | P306: =R[-10]C+5 -> 25 | Q306: 15 | R306: 15
A307: 3000 | B307: =R[-1]C+1 -> 44 | C307: 2361 | D307: 2361 | E307: 0 | F307: 0 | G307: 0 | H307: 0 | I307: 129 | J307: 258 | K307: 39 | L307: 79 | M307: 42 | N307: 86 | O307: 0 | P307: =R[-10]C+5 -> 25 | Q307: 15 | R307: 15
A308: 3000 | B308: =R[-1]C+1 -> 45 | C308: 2460 | D308: 2460 | E308: 0 | F308: 0 | G308: 0 | H308: 0 | I308: 134 | J308: 268 | K308: 40 | L308: 82 | M308: 44 | N308: 90 | O308: 0 | P308: =R[-10]C+5 -> 25 | Q308: 15 | R308: 15
A309: 3000 | B309: =R[-1]C+1 -> 46 | C309: 2559 | D309: 2559 | E309: 0 | F309: 0 | G309: 0 | H309: 0 | I309: 139 | J309: 279 | K309: 42 | L309: 85 | M309: 46 | N309: 93 | O309: 0 | P309: =R[-10]C+5 -> 25 | Q309: 15 | R309: 15
A310: 3000 | B310: =R[-1]C+1 -> 47 | C310: 2658 | D310: 2658 | E310: 0 | F310: 0 | G310: 0 | H310: 0 | I310: 145 | J310: 290 | K310: 44 | L310: 89 | M310: 48 | N310: 97 | O310: 0 | P310: =R[-10]C+5 -> 25 | Q310: 15 | R310: 15
A311: 3000 | B311: =R[-1]C+1 -> 48 | C311: 2757 | D311: 2757 | E311: 0 | F311: 0 | G311: 0 | H311: 0 | I311: 150 | J311: 301 | K311: 45 | L311: 92 | M311: 49 | N311: 100 | O311: 0 | P311: =R[-10]C+5 -> 25 | Q311: 15 | R311: 15
A312: 3000 | B312: =R[-1]C+1 -> 49 | C312: 2856 | D312: 2856 | E312: 0 | F312: 0 | G312: 0 | H312: 0 | I312: 156 | J312: 312 | K312: 47 | L312: 95 | M312: 51 | N312: 104 | O312: 0 | P312: =R[-10]C+5 -> 25 | Q312: 15 | R312: 15
A313: 3000 | B313: =R[-1]C+1 -> 50 | C313: 2988 | D313: 2988 | E313: 0 | F313: 0 | G313: 0 | H313: 0 | I313: 163 | J313: 326 | K313: 49 | L313: 100 | M313: 54 | N313: 109 | O313: 0 | P313: =R[-10]C+5 -> 25 | Q313: 15 | R313: 15
A314: 3000 | B314: =R[-1]C+1 -> 51 | C314: 3120 | D314: 3120 | E314: 0 | F314: 0 | G314: 0 | H314: 0 | I314: 170 | J314: 340 | K314: 51 | L314: 104 | M314: 56 | N314: 114 | O314: 0 | P314: =R[-10]C+5 -> 30 | Q314: 15 | R314: 15
A315: 3000 | B315: =R[-1]C+1 -> 52 | C315: 3252 | D315: 3252 | E315: 0 | F315: 0 | G315: 0 | H315: 0 | I315: 177 | J315: 355 | K315: 53 | L315: 108 | M315: 58 | N315: 118 | O315: 0 | P315: =R[-10]C+5 -> 30 | Q315: 15 | R315: 15
A316: 3000 | B316: =R[-1]C+1 -> 53 | C316: 3384 | D316: 3384 | E316: 0 | F316: 0 | G316: 0 | H316: 0 | I316: 184 | J316: 369 | K316: 56 | L316: 113 | M316: 61 | N316: 123 | O316: 0 | P316: =R[-10]C+5 -> 30 | Q316: 15 | R316: 15
A317: 3000 | B317: =R[-1]C+1 -> 54 | C317: 3516 | D317: 3516 | E317: 0 | F317: 0 | G317: 0 | H317: 0 | I317: 192 | J317: 384 | K317: 58 | L317: 117 | M317: 63 | N317: 128 | O317: 0 | P317: =R[-10]C+5 -> 30 | Q317: 15 | R317: 15
A318: 3000 | B318: =R[-1]C+1 -> 55 | C318: 3648 | D318: 3648 | E318: 0 | F318: 0 | G318: 0 | H318: 0 | I318: 199 | J318: 398 | K318: 60 | L318: 122 | M318: 66 | N318: 133 | O318: 0 | P318: =R[-10]C+5 -> 30 | Q318: 15 | R318: 15
A319: 3000 | B319: =R[-1]C+1 -> 56 | C319: 3780 | D319: 3780 | E319: 0 | F319: 0 | G319: 0 | H319: 0 | I319: 206 | J319: 412 | K319: 62 | L319: 126 | M319: 68 | N319: 138 | O319: 0 | P319: =R[-10]C+5 -> 30 | Q319: 15 | R319: 15
A320: 3000 | B320: =R[-1]C+1 -> 57 | C320: 3912 | D320: 3912 | E320: 0 | F320: 0 | G320: 0 | H320: 0 | I320: 213 | J320: 427 | K320: 64 | L320: 130 | M320: 70 | N320: 142 | O320: 0 | P320: =R[-10]C+5 -> 30 | Q320: 15 | R320: 15
A321: 3000 | B321: =R[-1]C+1 -> 58 | C321: 4044 | D321: 4044 | E321: 0 | F321: 0 | G321: 0 | H321: 0 | I321: 220 | J321: 441 | K321: 67 | L321: 135 | M321: 73 | N321: 147 | O321: 0 | P321: =R[-10]C+5 -> 30 | Q321: 15 | R321: 15
A322: 3000 | B322: =R[-1]C+1 -> 59 | C322: 4176 | D322: 4176 | E322: 0 | F322: 0 | G322: 0 | H322: 0 | I322: 228 | J322: 456 | K322: 69 | L322: 139 | M322: 75 | N322: 152 | O322: 0 | P322: =R[-10]C+5 -> 30 | Q322: 15 | R322: 15
A323: 3000 | B323: =R[-1]C+1 -> 60 | C323: 4325 | D323: 4325 | E323: 0 | F323: 0 | G323: 0 | H323: 0 | I323: 236 | J323: 472 | K323: 71 | L323: 144 | M323: 78 | N323: 157 | O323: 0 | P323: =R[-10]C+5 -> 30 | Q323: 15 | R323: 15
A324: 3000 | B324: =R[-1]C+1 -> 61 | C324: 4473 | D324: 4473 | E324: 0 | F324: 0 | G324: 0 | H324: 0 | I324: 244 | J324: 488 | K324: 74 | L324: 149 | M324: 81 | N324: 163 | O324: 0 | P324: =R[-10]C+5 -> 35 | Q324: 15 | R324: 15
A325: 3000 | B325: =R[-1]C+1 -> 62 | C325: 4622 | D325: 4622 | E325: 0 | F325: 0 | G325: 0 | H325: 0 | I325: 252 | J325: 504 | K325: 76 | L325: 154 | M325: 83 | N325: 168 | O325: 0 | P325: =R[-10]C+5 -> 35 | Q325: 15 | R325: 15
A326: 3000 | B326: =R[-1]C+1 -> 63 | C326: 4770 | D326: 4770 | E326: 0 | F326: 0 | G326: 0 | H326: 0 | I326: 260 | J326: 520 | K326: 79 | L326: 159 | M326: 86 | N326: 174 | O326: 0 | P326: =R[-10]C+5 -> 35 | Q326: 15 | R326: 15
A327: 3000 | B327: =R[-1]C+1 -> 64 | C327: 4919 | D327: 4919 | E327: 0 | F327: 0 | G327: 0 | H327: 0 | I327: 268 | J327: 537 | K327: 81 | L327: 164 | M327: 89 | N327: 179 | O327: 0 | P327: =R[-10]C+5 -> 35 | Q327: 15 | R327: 15
A328: 3000 | B328: =R[-1]C+1 -> 65 | C328: 5067 | D328: 5067 | E328: 0 | F328: 0 | G328: 0 | H328: 0 | I328: 276 | J328: 553 | K328: 84 | L328: 169 | M328: 91 | N328: 184 | O328: 0 | P328: =R[-10]C+5 -> 35 | Q328: 15 | R328: 15
A329: 3000 | B329: =R[-1]C+1 -> 66 | C329: 5216 | D329: 5216 | E329: 0 | F329: 0 | G329: 0 | H329: 0 | I329: 284 | J329: 569 | K329: 86 | L329: 174 | M329: 94 | N329: 190 | O329: 0 | P329: =R[-10]C+5 -> 35 | Q329: 15 | R329: 15
A330: 3000 | B330: =R[-1]C+1 -> 67 | C330: 5364 | D330: 5364 | E330: 0 | F330: 0 | G330: 0 | H330: 0 | I330: 292 | J330: 585 | K330: 89 | L330: 179 | M330: 97 | N330: 195 | O330: 0 | P330: =R[-10]C+5 -> 35 | Q330: 15 | R330: 15
A331: 3000 | B331: =R[-1]C+1 -> 68 | C331: 5513 | D331: 5513 | E331: 0 | F331: 0 | G331: 0 | H331: 0 | I331: 300 | J331: 601 | K331: 91 | L331: 184 | M331: 99 | N331: 201 | O331: 0 | P331: =R[-10]C+5 -> 35 | Q331: 15 | R331: 15
A332: 3000 | B332: =R[-1]C+1 -> 69 | C332: 5661 | D332: 5661 | E332: 0 | F332: 0 | G332: 0 | H332: 0 | I332: 309 | J332: 618 | K332: 94 | L332: 189 | M332: 102 | N332: 206 | O332: 0 | P332: =R[-10]C+5 -> 35 | Q332: 15 | R332: 15
A333: 3000 | B333: =R[-1]C+1 -> 70 | C333: 5826 | D333: 5826 | E333: 0 | F333: 0 | G333: 0 | H333: 0 | I333: 318 | J333: 636 | K333: 96 | L333: 194 | M333: 105 | N333: 212 | O333: 0 | P333: =R[-10]C+5 -> 35 | Q333: 15 | R333: 15
A334: 3000 | B334: =R[-1]C+1 -> 71 | C334: 5991 | D334: 5991 | E334: 0 | F334: 0 | G334: 0 | H334: 0 | I334: 327 | J334: 654 | K334: 99 | L334: 200 | M334: 108 | N334: 218 | O334: 0 | P334: =R[-10]C+5 -> 40 | Q334: 15 | R334: 15
A335: 3000 | B335: =R[-1]C+1 -> 72 | C335: 6156 | D335: 6156 | E335: 0 | F335: 0 | G335: 0 | H335: 0 | I335: 336 | J335: 672 | K335: 102 | L335: 205 | M335: 111 | N335: 224 | O335: 0 | P335: =R[-10]C+5 -> 40 | Q335: 15 | R335: 15
A336: 3000 | B336: =R[-1]C+1 -> 73 | C336: 6321 | D336: 6321 | E336: 0 | F336: 0 | G336: 0 | H336: 0 | I336: 345 | J336: 690 | K336: 105 | L336: 211 | M336: 114 | N336: 230 | O336: 0 | P336: =R[-10]C+5 -> 40 | Q336: 15 | R336: 15
A337: 3000 | B337: =R[-1]C+1 -> 74 | C337: 6486 | D337: 6486 | E337: 0 | F337: 0 | G337: 0 | H337: 0 | I337: 354 | J337: 708 | K337: 107 | L337: 216 | M337: 117 | N337: 236 | O337: 0 | P337: =R[-10]C+5 -> 40 | Q337: 15 | R337: 15
A338: 3000 | B338: =R[-1]C+1 -> 75 | C338: 6651 | D338: 6651 | E338: 0 | F338: 0 | G338: 0 | H338: 0 | I338: 363 | J338: 726 | K338: 110 | L338: 222 | M338: 120 | N338: 242 | O338: 0 | P338: =R[-10]C+5 -> 40 | Q338: 15 | R338: 15
A339: 3000 | B339: =R[-1]C+1 -> 76 | C339: 6816 | D339: 6816 | E339: 0 | F339: 0 | G339: 0 | H339: 0 | I339: 372 | J339: 744 | K339: 113 | L339: 227 | M339: 123 | N339: 248 | O339: 0 | P339: =R[-10]C+5 -> 40 | Q339: 15 | R339: 15
A340: 3000 | B340: =R[-1]C+1 -> 77 | C340: 6981 | D340: 6981 | E340: 0 | F340: 0 | G340: 0 | H340: 0 | I340: 381 | J340: 762 | K340: 116 | L340: 233 | M340: 126 | N340: 254 | O340: 0 | P340: =R[-10]C+5 -> 40 | Q340: 15 | R340: 15
A341: 3000 | B341: =R[-1]C+1 -> 78 | C341: 7146 | D341: 7146 | E341: 0 | F341: 0 | G341: 0 | H341: 0 | I341: 390 | J341: 780 | K341: 118 | L341: 238 | M341: 129 | N341: 260 | O341: 0 | P341: =R[-10]C+5 -> 40 | Q341: 15 | R341: 15
A342: 3000 | B342: =R[-1]C+1 -> 79 | C342: 7311 | D342: 7311 | E342: 0 | F342: 0 | G342: 0 | H342: 0 | I342: 399 | J342: 798 | K342: 121 | L342: 244 | M342: 132 | N342: 266 | O342: 0 | P342: =R[-10]C+5 -> 40 | Q342: 15 | R342: 15
A343: 3000 | B343: =R[-1]C+1 -> 80 | C343: 7486 | D343: 7486 | E343: 0 | F343: 0 | G343: 0 | H343: 0 | I343: 408 | J343: 817 | K343: 124 | L343: 250 | M343: 135 | N343: 272 | O343: 0 | P343: =R[-10]C+5 -> 40 | Q343: 15 | R343: 15
A344: 3000 | B344: =R[-1]C+1 -> 81 | C344: 7661 | D344: 7661 | E344: 0 | F344: 0 | G344: 0 | H344: 0 | I344: 418 | J344: 836 | K344: 127 | L344: 255 | M344: 138 | N344: 279 | O344: 0 | P344: =R[-10]C+5 -> 45 | Q344: 15 | R344: 15
A345: 3000 | B345: =R[-1]C+1 -> 82 | C345: 7836 | D345: 7836 | E345: 0 | F345: 0 | G345: 0 | H345: 0 | I345: 427 | J345: 855 | K345: 130 | L345: 261 | M345: 142 | N345: 285 | O345: 0 | P345: =R[-10]C+5 -> 45 | Q345: 15 | R345: 15
A346: 3000 | B346: =R[-1]C+1 -> 83 | C346: 8011 | D346: 8011 | E346: 0 | F346: 0 | G346: 0 | H346: 0 | I346: 437 | J346: 874 | K346: 133 | L346: 267 | M346: 145 | N346: 291 | O346: 0 | P346: =R[-10]C+5 -> 45 | Q346: 15 | R346: 15
A347: 3000 | B347: =R[-1]C+1 -> 84 | C347: 8186 | D347: 8186 | E347: 0 | F347: 0 | G347: 0 | H347: 0 | I347: 446 | J347: 893 | K347: 136 | L347: 273 | M347: 148 | N347: 298 | O347: 0 | P347: =R[-10]C+5 -> 45 | Q347: 15 | R347: 15
A348: 3000 | B348: =R[-1]C+1 -> 85 | C348: 8361 | D348: 8361 | E348: 0 | F348: 0 | G348: 0 | H348: 0 | I348: 456 | J348: 912 | K348: 139 | L348: 279 | M348: 151 | N348: 304 | O348: 0 | P348: =R[-10]C+5 -> 45 | Q348: 15 | R348: 15
A349: 3000 | B349: =R[-1]C+1 -> 86 | C349: 8536 | D349: 8536 | E349: 0 | F349: 0 | G349: 0 | H349: 0 | I349: 465 | J349: 931 | K349: 141 | L349: 285 | M349: 154 | N349: 310 | O349: 0 | P349: =R[-10]C+5 -> 45 | Q349: 15 | R349: 15
A350: 3000 | B350: =R[-1]C+1 -> 87 | C350: 8710 | D350: 8710 | E350: 0 | F350: 0 | G350: 0 | H350: 0 | I350: 475 | J350: 950 | K350: 144 | L350: 290 | M350: 158 | N350: 317 | O350: 0 | P350: =R[-10]C+5 -> 45 | Q350: 15 | R350: 15
A351: 3000 | B351: =R[-1]C+1 -> 88 | C351: 8885 | D351: 8885 | E351: 0 | F351: 0 | G351: 0 | H351: 0 | I351: 484 | J351: 969 | K351: 147 | L351: 296 | M351: 161 | N351: 323 | O351: 0 | P351: =R[-10]C+5 -> 45 | Q351: 15 | R351: 15
A352: 3000 | B352: =R[-1]C+1 -> 89 | C352: 9060 | D352: 9060 | E352: 0 | F352: 0 | G352: 0 | H352: 0 | I352: 494 | J352: 988 | K352: 150 | L352: 302 | M352: 164 | N352: 330 | O352: 0 | P352: =R[-10]C+5 -> 45 | Q352: 15 | R352: 15
A353: 3000 | B353: =R[-1]C+1 -> 90 | C353: 9245 | D353: 9245 | E353: 0 | F353: 0 | G353: 0 | H353: 0 | I353: 504 | J353: 1008 | K353: 153 | L353: 308 | M353: 167 | N353: 336 | O353: 0 | P353: =R[-10]C+5 -> 45 | Q353: 15 | R353: 15
A354: 3000 | B354: =R[-1]C+1 -> 91 | C354: 9430 | D354: 9430 | E354: 0 | F354: 0 | G354: 0 | H354: 0 | I354: 514 | J354: 1029 | K354: 156 | L354: 314 | M354: 171 | N354: 343 | O354: 0 | P354: =R[-10]C+5 -> 50 | Q354: 15 | R354: 15
A355: 3000 | B355: =R[-1]C+1 -> 92 | C355: 9615 | D355: 9615 | E355: 0 | F355: 0 | G355: 0 | H355: 0 | I355: 524 | J355: 1049 | K355: 159 | L355: 320 | M355: 174 | N355: 350 | O355: 0 | P355: =R[-10]C+5 -> 50 | Q355: 15 | R355: 15
A356: 3000 | B356: =R[-1]C+1 -> 93 | C356: 9799 | D356: 9799 | E356: 0 | F356: 0 | G356: 0 | H356: 0 | I356: 534 | J356: 1069 | K356: 163 | L356: 327 | M356: 177 | N356: 356 | O356: 0 | P356: =R[-10]C+5 -> 50 | Q356: 15 | R356: 15
A357: 3000 | B357: =R[-1]C+1 -> 94 | C357: 9984 | D357: 9984 | E357: 0 | F357: 0 | G357: 0 | H357: 0 | I357: 544 | J357: 1089 | K357: 166 | L357: 333 | M357: 181 | N357: 363 | O357: 0 | P357: =R[-10]C+5 -> 50 | Q357: 15 | R357: 15
A358: 3000 | B358: =R[-1]C+1 -> 95 | C358: 10169 | D358: 10169 | E358: 0 | F358: 0 | G358: 0 | H358: 0 | I358: 554 | J358: 1109 | K358: 169 | L358: 339 | M358: 184 | N358: 370 | O358: 0 | P358: =R[-10]C+5 -> 50 | Q358: 15 | R358: 15
A359: 3000 | B359: =R[-1]C+1 -> 96 | C359: 10354 | D359: 10354 | E359: 0 | F359: 0 | G359: 0 | H359: 0 | I359: 564 | J359: 1129 | K359: 172 | L359: 345 | M359: 187 | N359: 377 | O359: 0 | P359: =R[-10]C+5 -> 50 | Q359: 15 | R359: 15
A360: 3000 | B360: =R[-1]C+1 -> 97 | C360: 10539 | D360: 10539 | E360: 0 | F360: 0 | G360: 0 | H360: 0 | I360: 575 | J360: 1150 | K360: 175 | L360: 351 | M360: 191 | N360: 383 | O360: 0 | P360: =R[-10]C+5 -> 50 | Q360: 15 | R360: 15
A361: 3000 | B361: =R[-1]C+1 -> 98 | C361: 10723 | D361: 10723 | E361: 0 | F361: 0 | G361: 0 | H361: 0 | I361: 585 | J361: 1170 | K361: 178 | L361: 357 | M361: 194 | N361: 390 | O361: 0 | P361: =R[-10]C+5 -> 50 | Q361: 15 | R361: 15
A362: 3000 | B362: =R[-1]C+1 -> 99 | C362: 10908 | D362: 10908 | E362: 0 | F362: 0 | G362: 0 | H362: 0 | I362: 595 | J362: 1190 | K362: 181 | L362: 364 | M362: 198 | N362: 397 | O362: 0 | P362: =R[-10]C+5 -> 50 | Q362: 15 | R362: 15
A363: 3000 | B363: =R[-1]C+1 -> 100 | C363: 11106 | D363: 11106 | E363: 0 | F363: 0 | G363: 0 | H363: 0 | I363: 606 | J363: 1212 | K363: 184 | L363: 370 | M363: 201 | N363: 404 | O363: 0 | P363: =R[-10]C+5 -> 50 | Q363: 15 | R363: 15
A364: 3000 | B364: =R[-1]C+1 -> 101 | C364: 11304 | D364: 11304 | E364: 0 | F364: 0 | G364: 0 | H364: 0 | I364: 616 | J364: 1233 | K364: 188 | L364: 377 | M364: 205 | N364: 411 | O364: 0 | P364: =R[-10]C+5 -> 55 | Q364: 15 | R364: 15
A365: 3000 | B365: =R[-1]C+1 -> 102 | C365: 11502 | D365: 11502 | E365: 0 | F365: 0 | G365: 0 | H365: 0 | I365: 627 | J365: 1255 | K365: 191 | L365: 383 | M365: 208 | N365: 418 | O365: 0 | P365: =R[-10]C+5 -> 55 | Q365: 15 | R365: 15
A366: 3000 | B366: =R[-1]C+1 -> 103 | C366: 11700 | D366: 11700 | E366: 0 | F366: 0 | G366: 0 | H366: 0 | I366: 638 | J366: 1276 | K366: 194 | L366: 390 | M366: 212 | N366: 426 | O366: 0 | P366: =R[-10]C+5 -> 55 | Q366: 15 | R366: 15
A367: 3000 | B367: =R[-1]C+1 -> 104 | C367: 11898 | D367: 11898 | E367: 0 | F367: 0 | G367: 0 | H367: 0 | I367: 649 | J367: 1298 | K367: 198 | L367: 397 | M367: 216 | N367: 433 | O367: 0 | P367: =R[-10]C+5 -> 55 | Q367: 15 | R367: 15
A368: 3000 | B368: =R[-1]C+1 -> 105 | C368: 12096 | D368: 12096 | E368: 0 | F368: 0 | G368: 0 | H368: 0 | I368: 660 | J368: 1320 | K368: 201 | L368: 403 | M368: 219 | N368: 440 | O368: 0 | P368: =R[-10]C+5 -> 55 | Q368: 15 | R368: 15
A369: 3000 | B369: =R[-1]C+1 -> 106 | C369: 12294 | D369: 12294 | E369: 0 | F369: 0 | G369: 0 | H369: 0 | I369: 670 | J369: 1341 | K369: 204 | L369: 410 | M369: 223 | N369: 447 | O369: 0 | P369: =R[-10]C+5 -> 55 | Q369: 15 | R369: 15
A370: 3000 | B370: =R[-1]C+1 -> 107 | C370: 12492 | D370: 12492 | E370: 0 | F370: 0 | G370: 0 | H370: 0 | I370: 681 | J370: 1363 | K370: 207 | L370: 416 | M370: 226 | N370: 454 | O370: 0 | P370: =R[-10]C+5 -> 55 | Q370: 15 | R370: 15
A371: 3000 | B371: =R[-1]C+1 -> 108 | C371: 12690 | D371: 12690 | E371: 0 | F371: 0 | G371: 0 | H371: 0 | I371: 692 | J371: 1384 | K371: 211 | L371: 423 | M371: 230 | N371: 462 | O371: 0 | P371: =R[-10]C+5 -> 55 | Q371: 15 | R371: 15
A372: 3000 | B372: =R[-1]C+1 -> 109 | C372: 12888 | D372: 12888 | E372: 0 | F372: 0 | G372: 0 | H372: 0 | I372: 703 | J372: 1406 | K372: 214 | L372: 430 | M372: 234 | N372: 469 | O372: 0 | P372: =R[-10]C+5 -> 55 | Q372: 15 | R372: 15
A373: 3000 | B373: =R[-1]C+1 -> 110 | C373: 13099 | D373: 13099 | E373: 0 | F373: 0 | G373: 0 | H373: 0 | I373: 714 | J373: 1429 | K373: 218 | L373: 437 | M373: 237 | N373: 476 | O373: 0 | P373: =R[-10]C+5 -> 55 | Q373: 15 | R373: 15
A374: 3000 | B374: =R[-1]C+1 -> 111 | C374: 13311 | D374: 13311 | E374: 0 | F374: 0 | G374: 0 | H374: 0 | I374: 726 | J374: 1452 | K374: 221 | L374: 444 | M374: 241 | N374: 484 | O374: 0 | P374: =R[-10]C+5 -> 60 | Q374: 15 | R374: 15
A375: 3000 | B375: =R[-1]C+1 -> 112 | C375: 13522 | D375: 13522 | E375: 0 | F375: 0 | G375: 0 | H375: 0 | I375: 737 | J375: 1475 | K375: 225 | L375: 451 | M375: 245 | N375: 492 | O375: 0 | P375: =R[-10]C+5 -> 60 | Q375: 15 | R375: 15
A376: 3000 | B376: =R[-1]C+1 -> 113 | C376: 13733 | D376: 13733 | E376: 0 | F376: 0 | G376: 0 | H376: 0 | I376: 749 | J376: 1498 | K376: 228 | L376: 458 | M376: 249 | N376: 499 | O376: 0 | P376: =R[-10]C+5 -> 60 | Q376: 15 | R376: 15
A377: 3000 | B377: =R[-1]C+1 -> 114 | C377: 13944 | D377: 13944 | E377: 0 | F377: 0 | G377: 0 | H377: 0 | I377: 760 | J377: 1521 | K377: 232 | L377: 465 | M377: 253 | N377: 507 | O377: 0 | P377: =R[-10]C+5 -> 60 | Q377: 15 | R377: 15
A378: 3000 | B378: =R[-1]C+1 -> 115 | C378: 14155 | D378: 14155 | E378: 0 | F378: 0 | G378: 0 | H378: 0 | I378: 772 | J378: 1544 | K378: 235 | L378: 472 | M378: 257 | N378: 515 | O378: 0 | P378: =R[-10]C+5 -> 60 | Q378: 15 | R378: 15
A379: 3000 | B379: =R[-1]C+1 -> 116 | C379: 14367 | D379: 14367 | E379: 0 | F379: 0 | G379: 0 | H379: 0 | I379: 783 | J379: 1567 | K379: 239 | L379: 479 | M379: 260 | N379: 522 | O379: 0 | P379: =R[-10]C+5 -> 60 | Q379: 15 | R379: 15
A380: 3000 | B380: =R[-1]C+1 -> 117 | C380: 14578 | D380: 14578 | E380: 0 | F380: 0 | G380: 0 | H380: 0 | I380: 795 | J380: 1590 | K380: 242 | L380: 486 | M380: 264 | N380: 530 | O380: 0 | P380: =R[-10]C+5 -> 60 | Q380: 15 | R380: 15
A381: 3000 | B381: =R[-1]C+1 -> 118 | C381: 14789 | D381: 14789 | E381: 0 | F381: 0 | G381: 0 | H381: 0 | I381: 806 | J381: 1613 | K381: 246 | L381: 493 | M381: 268 | N381: 538 | O381: 0 | P381: =R[-10]C+5 -> 60 | Q381: 15 | R381: 15
A382: 3000 | B382: =R[-1]C+1 -> 119 | C382: 15000 | D382: 15000 | E382: 0 | F382: 0 | G382: 0 | H382: 0 | I382: 818 | J382: 1636 | K382: 249 | L382: 500 | M382: 272 | N382: 546 | O382: 0 | P382: =R[-10]C+5 -> 60 | Q382: 15 | R382: 15
A383: 3000 | B383: =R[-1]C+1 -> 120 | C383: 15225 | D383: 15225 | E383: 0 | F383: 0 | G383: 0 | H383: 0 | I383: 830 | J383: 1661 | K383: 253 | L383: 507 | M383: 276 | N383: 554 | O383: 0 | P383: =R[-10]C+5 -> 60 | Q383: 15 | R383: 15
A384: 3000 | B384: 121 | C384: 15449 | D384: 15449 | E384: 0 | F384: 0 | G384: 0 | H384: 0 | I384: 842 | J384: 1685 | K384: 257 | L384: 515 | M384: 280 | N384: 562 | O384: 0 | P384: 65 | Q384: 15 | R384: 15
A385: 3000 | B385: 122 | C385: 15673 | D385: 15673 | E385: 0 | F385: 0 | G385: 0 | H385: 0 | I385: 855 | J385: 1710 | K385: 260 | L385: 522 | M385: 284 | N385: 570 | O385: 0 | P385: 65 | Q385: 15 | R385: 15
A386: 3000 | B386: 123 | C386: 15898 | D386: 15898 | E386: 0 | F386: 0 | G386: 0 | H386: 0 | I386: 867 | J386: 1734 | K386: 264 | L386: 530 | M386: 288 | N386: 578 | O386: 0 | P386: 65 | Q386: 15 | R386: 15
A387: 3000 | B387: 124 | C387: 16122 | D387: 16122 | E387: 0 | F387: 0 | G387: 0 | H387: 0 | I387: 879 | J387: 1759 | K387: 268 | L387: 537 | M387: 292 | N387: 586 | O387: 0 | P387: 65 | Q387: 15 | R387: 15
A388: 3000 | B388: 125 | C388: 16347 | D388: 16347 | E388: 0 | F388: 0 | G388: 0 | H388: 0 | I388: 891 | J388: 1783 | K388: 272 | L388: 545 | M388: 296 | N388: 594 | O388: 0 | P388: 65 | Q388: 15 | R388: 15
A389: 3000 | B389: 126 | C389: 16571 | D389: 16571 | E389: 0 | F389: 0 | G389: 0 | H389: 0 | I389: 904 | J389: 1808 | K389: 275 | L389: 552 | M389: 300 | N389: 603 | O389: 0 | P389: 65 | Q389: 15 | R389: 15
A390: 3000 | B390: 127 | C390: 16795 | D390: 16795 | E390: 0 | F390: 0 | G390: 0 | H390: 0 | I390: 916 | J390: 1832 | K390: 279 | L390: 560 | M390: 305 | N390: 611 | O390: 0 | P390: 65 | Q390: 15 | R390: 15
A391: 3000 | B391: 128 | C391: 17020 | D391: 17020 | E391: 0 | F391: 0 | G391: 0 | H391: 0 | I391: 928 | J391: 1857 | K391: 283 | L391: 567 | M391: 309 | N391: 619 | O391: 0 | P391: 65 | Q391: 15 | R391: 15
A392: 3000 | B392: 129 | C392: 17244 | D392: 17244 | E392: 0 | F392: 0 | G392: 0 | H392: 0 | I392: 940 | J392: 1881 | K392: 287 | L392: 575 | M392: 313 | N392: 627 | O392: 0 | P392: 65 | Q392: 15 | R392: 15
A393: 3000 | B393: 130 | C393: 17482 | D393: 17482 | E393: 0 | F393: 0 | G393: 0 | H393: 0 | I393: 953 | J393: 1907 | K393: 291 | L393: 583 | M393: 317 | N393: 636 | O393: 0 | P393: 65 | Q393: 15 | R393: 15