Sheet: 场景配置
A1: scene_id | B1: function_id
A2: scene_id
A3: 场景id | B3: 对应的功能id
A4: 20243 | B4: 87
A5: 20244 | B5: 87
A6: 20245 | B6: 87
A7: 32116 | B7: 87
A8: 32117 | B8: 87
A9: 32118 | B9: 87
A10: 32119 | B10: 87
A11: 32120 | B11: 87
A12: 32121 | B12: 87

Sheet: 说明
A1: 怪物列表说明:
A2: 元素格式1刷怪间隔作用于每个怪物: {monster_type, 怪物id, 刷怪数量, 刷怪间隔（秒）, 刷怪位置} 元素格式2刷怪间隔作用于一个区域: {area_type, 区域id, 怪物id, 刷怪数量, 刷怪间隔（秒）, 刷怪位置}
A3: 刷怪位置: 1.{point_list, 坐标列表}如 {point_list, [{123, 12}, {1234, 12}]} 2.{area, 左上角坐标, 右下角坐标}如 {area, {1, 1}, {3, 3}}
A4: 刷怪间隔: -1：死亡不刷新 0：死亡立即刷新 大于0：固定时间刷新
A5: 场景类型: 1.主城 2.野外 3.副本 | H5: {7201, 1, 10,{area, {40, 22}, {60, 40}}}
A6: 活动id: 0.无活动 1.沙城争霸活动-沙城 2.沙城争霸活动-皇宫 | C6: x1 | D6: y1 | E6: x2 | F6: y2 | G6: 小怪id | H6: 数量 | L6: 刷新时间 | M6: 配置
A8: exit_scene出口场景:在这个图死了后 复活的地方。如果本身没复活点才生效；如果是副本场景，点退出按钮的时回到的地方
A11: %% pk模式
A12: -define(PK_MODE_PEACE, 1). %% 和平
A13: -define(PK_MODE_ALL, 2). %% 全体
A14: -define(PK_MODE_GUILD, 3). %% 帮派
A15: -define(PK_MODE_TEAM, 4). %% 队伍
A16: -define(PK_MODE_JUSTICE, 5). %% 善恶
A17: -define(PK_MODE_NOOB, 6). %% 新手
A18: -define(PK_MODE_FOE, 7). %% 仇人模式
A19: -define(PK_MODE_LEGION, 8). %%军团模式
A23: [ {monster_type,7402,0,1,10,{point_list,[{62,18}]}}, {monster_type,7402,0,1,10,{point_list,[{65,20}]}}, {monster_type,7402,0,1,10,{point_list,[{30,29}]}}, {monster_type,7402,0,1,10,{point_list,[{24,34}]}} ] | B23: 比奇大刀数据
A24: rule_monster_list 规则加载怪物列表
A25: 加载条件 0没有特殊条件 [{加载条件,波数,怪物列表},{加载条件,波数,怪物列表}]第一波填在原来的地方 场景rule_monster_list字段配置第二波后的怪物波数 第一个参数配置2波间的间隔时间 秒
A28: [{0,2,[{area_type,1,7306,5,-1,{area,{13,13},{14,16}}}, {area_type,2,7306,5,-1,{area,{18,14},{26,19}}}, {area_type,3,7306,5,-1,{area,{23,8},{26,12}}}, {area_type,4,7306,5,-1,{area,{28,13},{36,16}}}, {monster_type,7303,1,-1,{point_list,[{32,9}]}} ]},{0,3,[{area_type,1,7306,5,-1,{area,{13,13},{14,16}}}, {area_type,2,7306,5,-1,{area,{18,14},{26,19}}}, {area_type,3,7306,5,-1,{area,{23,8},{26,12}}}, {area_type,4,7306,5,-1,{area,{28,13},{36,16}}}, {monster_type,7303,1,-1,{point_list,[{32,9}]}} ]}]
A31: copy_num
A33: 需要复制场景个数,默认1
A35: 自动战斗状态
A36: 1.进入该场景开启自动战斗。（用于PK类活动地图） | C36: 王城
A37: 2.进入该场景关闭自动战斗。（用于主城类地图） | C37: X | D37: Y | G37: 随机BOSS | H37: 刷新地图 | I37: 刷新时间/分 | J37: 刷新时间/秒
A38: 3.进入该场景保持之前的战斗状态。（用于野外类地图） | B38: 1 | C38: 116 | D38: 62 | E38: ="{"&RC[-2]&","&RC[-1]&"}," -> {116,62}, | G38: 骷髅精灵 | H38: 王城 | I38: 30 | J38: =RC[-1]*60 -> 1800 | K38: 8150 | L38: =RC[-7]&R[1]C[-7]&R[2]C[-7]&R[3]C[-7]&R[4]C[-7]&R[5]C[-7] -> {116,62},{70,93},{46,94},{6,66},{12,54},{17,36}
B39: 2 | C39: 70 | D39: 93 | E39: ="{"&RC[-2]&","&RC[-1]&"}," -> {70,93}, | G39: 铁甲尸王 | H39: 王城 | I39: 60 | J39: =RC[-1]*60 -> 3600 | K39: 8153 | L39: =R[5]C[-7]&R[6]C[-7]&R[7]C[-7]&R[8]C[-7]&R[9]C[-7]&R[10]C[-7] -> {41,19},{65,5},{69,15},{93,5},{89,91},{120,71}
A40: 场景消耗，需要门票进入。格式[{222,1},{222,3}] | B40: 3 | C40: 46 | D40: 94 | E40: ="{"&RC[-2]&","&RC[-1]&"}," -> {46,94}, | G40: 奥玛教主 | H40: 王城 | I40: 90 | J40: =RC[-1]*60 -> 5400 | K40: 8154 | L40: =R[10]C[-7]&R[11]C[-7]&R[12]C[-7]&R[13]C[-7]&R[14]C[-7]&R[15]C[-7] -> {27,93},{6,78},{6,33},{29,17},{46,5},{109,4}
B41: 4 | C41: 6 | D41: 66 | E41: ="{"&RC[-2]&","&RC[-1]&"}," -> {6,66}, | G41: 巨型多角虫 | H41: 土城 | I41: 30 | J41: =RC[-1]*60 -> 1800 | K41: 8151 | L41: =R[18]C[-7]&R[19]C[-7]&R[20]C[-7] -> {27,6},{34,56},{83,30}
B42: 5 | C42: 12 | D42: 54 | E42: ="{"&RC[-2]&","&RC[-1]&"}," -> {12,54}, | G42: 巨型钳虫 | H42: 土城 | I42: 30 | J42: =RC[-1]*60 -> 1800 | K42: 8152 | L42: =R[20]C[-7]&R[21]C[-7]&R[22]C[-7] -> {3,32},{61,57},{85,17}
B43: 6 | C43: 17 | D43: 36 | E43: ="{"&RC[-2]&","&RC[-1]&"}" -> {17,36} | G43: 邪恶触龙 | H43: 土城 | I43: 120 | J43: =RC[-1]*60 -> 7200 | K43: 8155 | L43: =R[22]C[-7]&R[23]C[-7]&R[24]C[-7] -> {2,17},{73,52},{73,17}
B44: 7 | C44: 41 | D44: 19 | E44: ="{"&RC[-2]&","&RC[-1]&"}," -> {41,19}, | G44: 白野猪王 | H44: 土城 | I44: 90 | J44: =RC[-1]*60 -> 5400 | K44: 8156 | L44: =R[24]C[-7]&R[25]C[-7]&R[26]C[-7] -> {7,42},{85,55},{63,11}
B45: 8 | C45: 65 | D45: 5 | E45: ="{"&RC[-2]&","&RC[-1]&"}," -> {65,5}, | G45: 祖玛教主 | H45: 土城 | I45: 120 | J45: =RC[-1]*60 -> 7200 | K45: 8157 | L45: =R[26]C[-7]&R[27]C[-7]&R[28]C[-7] -> {4,56},{86,44},{57,3}
B46: 9 | C46: 69 | D46: 15 | E46: ="{"&RC[-2]&","&RC[-1]&"}," -> {69,15}, | G46: 巨型双头恶魔 | H46: 白日天门 | I46: 180 | J46: =RC[-1]*60 -> 10800 | K46: 8158 | L46: =R[31]C[-7]&R[32]C[-7] -> {53,39},{57,5}
B47: 10 | C47: 93 | D47: 5 | E47: ="{"&RC[-2]&","&RC[-1]&"}," -> {93,5}, | G47: 赤月老魔 | H47: 白日天门 | I47: 240 | J47: =RC[-1]*60 -> 14400 | K47: 8159 | L47: =R[32]C[-7]&R[33]C[-7] -> {31,39},{9,28}
B48: 11 | C48: 89 | D48: 91 | E48: ="{"&RC[-2]&","&RC[-1]&"}," -> {89,91}, | G48: 冥蛇女妖 | H48: 沧月岛 | I48: 240 | J48: =RC[-1]*60 -> 14400 | K48: 8160 | L48: =R[36]C[-7]&R[37]C[-7]&R[38]C[-7] -> {67,5},{70,49},{19,34}
B49: 12 | C49: 120 | D49: 71 | E49: ="{"&RC[-2]&","&RC[-1]&"}" -> {120,71} | G49: 冥海领主 | H49: 沧月岛 | I49: 360 | J49: =RC[-1]*60 -> 21600 | K49: 8161 | L49: =R[38]C[-7]&R[39]C[-7]&R[40]C[-7] -> {75,14},{56,54},{10,23}
B50: 13 | C50: 27 | D50: 93 | E50: ="{"&RC[-2]&","&RC[-1]&"}," -> {27,93}, | G50: 虹魔教主 | H50: 沧月岛 | I50: 360 | J50: =RC[-1]*60 -> 21600 | K50: 8162 | L50: =R[40]C[-7]&R[41]C[-7]&R[42]C[-7] -> {61,19},{64,46},{23,9}
B51: 14 | C51: 6 | D51: 78 | E51: ="{"&RC[-2]&","&RC[-1]&"}," -> {6,78}, | G51: 牛魔王 | H51: 沧月岛 | I51: 480 | J51: =RC[-1]*60 -> 28800 | K51: 8163 | L51: =R[42]C[-7]&R[43]C[-7]&R[44]C[-7] -> {83,31},{10,38},{41,6}
B52: 15 | C52: 6 | D52: 33 | E52: ="{"&RC[-2]&","&RC[-1]&"}," -> {6,33},
B53: 16 | C53: 29 | D53: 17 | E53: ="{"&RC[-2]&","&RC[-1]&"}," -> {29,17},
B54: 17 | C54: 46 | D54: 5 | E54: ="{"&RC[-2]&","&RC[-1]&"}," -> {46,5},
B55: 18 | C55: 109 | D55: 4 | E55: ="{"&RC[-2]&","&RC[-1]&"}" -> {109,4}
C57: 土城
C58: X | D58: Y
B59: 1 | C59: 27 | D59: 6 | E59: ="{"&RC[-2]&","&RC[-1]&"}," -> {27,6},
B60: 2 | C60: 34 | D60: 56 | E60: ="{"&RC[-2]&","&RC[-1]&"}," -> {34,56},
B61: 3 | C61: 83 | D61: 30 | E61: ="{"&RC[-2]&","&RC[-1]&"}" -> {83,30}
B62: 4 | C62: 3 | D62: 32 | E62: ="{"&RC[-2]&","&RC[-1]&"}," -> {3,32},
B63: 5 | C63: 61 | D63: 57 | E63: ="{"&RC[-2]&","&RC[-1]&"}," -> {61,57},
B64: 6 | C64: 85 | D64: 17 | E64: ="{"&RC[-2]&","&RC[-1]&"}" -> {85,17}
B65: 7 | C65: 2 | D65: 17 | E65: ="{"&RC[-2]&","&RC[-1]&"}," -> {2,17},
B66: 8 | C66: 73 | D66: 52 | E66: ="{"&RC[-2]&","&RC[-1]&"}," -> {73,52},
B67: 9 | C67: 73 | D67: 17 | E67: ="{"&RC[-2]&","&RC[-1]&"}" -> {73,17}
B68: 10 | C68: 7 | D68: 42 | E68: ="{"&RC[-2]&","&RC[-1]&"}," -> {7,42},
B69: 11 | C69: 85 | D69: 55 | E69: ="{"&RC[-2]&","&RC[-1]&"}," -> {85,55},
B70: 12 | C70: 63 | D70: 11 | E70: ="{"&RC[-2]&","&RC[-1]&"}" -> {63,11}
B71: 13 | C71: 4 | D71: 56 | E71: ="{"&RC[-2]&","&RC[-1]&"}," -> {4,56},
B72: 14 | C72: 86 | D72: 44 | E72: ="{"&RC[-2]&","&RC[-1]&"}," -> {86,44},
B73: 15 | C73: 57 | D73: 3 | E73: ="{"&RC[-2]&","&RC[-1]&"}" -> {57,3}
C75: 白日天门
C76: X | D76: Y
B77: 1 | C77: 53 | D77: 39 | E77: ="{"&RC[-2]&","&RC[-1]&"}," -> {53,39},
B78: 2 | C78: 57 | D78: 5 | E78: ="{"&RC[-2]&","&RC[-1]&"}" -> {57,5}
B79: 3 | C79: 31 | D79: 39 | E79: ="{"&RC[-2]&","&RC[-1]&"}," -> {31,39},
B80: 4 | C80: 9 | D80: 28 | E80: ="{"&RC[-2]&","&RC[-1]&"}" -> {9,28}
C82: 沧月岛
C83: X | D83: Y
B84: 1 | C84: 67 | D84: 5 | E84: ="{"&RC[-2]&","&RC[-1]&"}," -> {67,5},
B85: 2 | C85: 70 | D85: 49 | E85: ="{"&RC[-2]&","&RC[-1]&"}," -> {70,49},
B86: 3 | C86: 19 | D86: 34 | E86: ="{"&RC[-2]&","&RC[-1]&"}" -> {19,34}
B87: 4 | C87: 75 | D87: 14 | E87: ="{"&RC[-2]&","&RC[-1]&"}," -> {75,14},
B88: 5 | C88: 56 | D88: 54 | E88: ="{"&RC[-2]&","&RC[-1]&"}," -> {56,54},
B89: 6 | C89: 10 | D89: 23 | E89: ="{"&RC[-2]&","&RC[-1]&"}" -> {10,23}
B90: 7 | C90: 61 | D90: 19 | E90: ="{"&RC[-2]&","&RC[-1]&"}," -> {61,19},
B91: 8 | C91: 64 | D91: 46 | E91: ="{"&RC[-2]&","&RC[-1]&"}," -> {64,46},
B92: 9 | C92: 23 | D92: 9 | E92: ="{"&RC[-2]&","&RC[-1]&"}" -> {23,9}
B93: 10 | C93: 83 | D93: 31 | E93: ="{"&RC[-2]&","&RC[-1]&"}," -> {83,31},
B94: 11 | C94: 10 | D94: 38 | E94: ="{"&RC[-2]&","&RC[-1]&"}," -> {10,38},
B95: 12 | C95: 41 | D95: 6 | E95: ="{"&RC[-2]&","&RC[-1]&"}" -> {41,6}