Sheet: 掉落周期类型配置
A1: drop_type | B1: drop_limit | C1: drop_unit | D1: drop_cycle
A2: drop_type
A3: 掉落类型 | B3: 掉落限制数量 | C3: 掉落周期 | D3: 周期数 | E3: 物品名称 | F3: 对应怪物
A4: 1 | B4: =VLOOKUP(RC[-1],工作表3!C[-1]:C[3],2,0) -> 5 | C4: day | D4: =VLOOKUP(RC[-3],工作表3!C[-3]:C[1],3,0) -> 1 | E4: =VLOOKUP(RC[-4],工作表3!C[-4]:C,5,0) -> 金刚石 | F4: =VLOOKUP(RC[-5],工作表3!C[-5]:C[-1],4,0) -> 野外小怪
A5: 2 | B5: =VLOOKUP(RC[-1],工作表3!C[-1]:C[3],2,0) -> 50 | C5: day | D5: =VLOOKUP(RC[-3],工作表3!C[-3]:C[1],3,0) -> 1 | E5: =VLOOKUP(RC[-4],工作表3!C[-4]:C,5,0) -> 进阶丹 | F5: =VLOOKUP(RC[-5],工作表3!C[-5]:C[-1],4,0) -> 野外小怪
A6: 3 | B6: =VLOOKUP(RC[-1],工作表3!C[-1]:C[3],2,0) -> 250 | C6: day | D6: =VLOOKUP(RC[-3],工作表3!C[-3]:C[1],3,0) -> 1 | E6: =VLOOKUP(RC[-4],工作表3!C[-4]:C,5,0) -> 2元宝 | F6: =VLOOKUP(RC[-5],工作表3!C[-5]:C[-1],4,0) -> 野外小怪
A7: 4 | B7: =VLOOKUP(RC[-1],工作表3!C[-1]:C[3],2,0) -> 200 | C7: day | D7: =VLOOKUP(RC[-3],工作表3!C[-3]:C[1],3,0) -> 1 | E7: =VLOOKUP(RC[-4],工作表3!C[-4]:C,5,0) -> 超级太阳水 | F7: =VLOOKUP(RC[-5],工作表3!C[-5]:C[-1],4,0) -> 野外小怪
A8: 5 | B8: =VLOOKUP(RC[-1],工作表3!C[-1]:C[3],2,0) -> 50 | C8: day | D8: =VLOOKUP(RC[-3],工作表3!C[-3]:C[1],3,0) -> 1 | E8: =VLOOKUP(RC[-4],工作表3!C[-4]:C,5,0) -> 5元宝 | F8: =VLOOKUP(RC[-5],工作表3!C[-5]:C[-1],4,0) -> 精英怪
A9: 6 | B9: =VLOOKUP(RC[-1],工作表3!C[-1]:C[3],2,0) -> 25 | C9: day | D9: =VLOOKUP(RC[-3],工作表3!C[-3]:C[1],3,0) -> 1 | E9: =VLOOKUP(RC[-4],工作表3!C[-4]:C,5,0) -> 10元宝 | F9: =VLOOKUP(RC[-5],工作表3!C[-5]:C[-1],4,0) -> 精英怪
A10: 7 | B10: =VLOOKUP(RC[-1],工作表3!C[-1]:C[3],2,0) -> 1 | C10: day | D10: =VLOOKUP(RC[-3],工作表3!C[-3]:C[1],3,0) -> 1 | E10: =VLOOKUP(RC[-4],工作表3!C[-4]:C,5,0) -> 特腿 | F10: =VLOOKUP(RC[-5],工作表3!C[-5]:C[-1],4,0) -> 骷髅精灵
A11: 8 | B11: =VLOOKUP(RC[-1],工作表3!C[-1]:C[3],2,0) -> 1 | C11: day | D11: =VLOOKUP(RC[-3],工作表3!C[-3]:C[1],3,0) -> 1 | E11: =VLOOKUP(RC[-4],工作表3!C[-4]:C,5,0) -> 特肩 | F11: =VLOOKUP(RC[-5],工作表3!C[-5]:C[-1],4,0) -> 骷髅精灵
A12: 9 | B12: =VLOOKUP(RC[-1],工作表3!C[-1]:C[3],2,0) -> 1 | C12: day | D12: =VLOOKUP(RC[-3],工作表3!C[-3]:C[1],3,0) -> 1 | E12: =VLOOKUP(RC[-4],工作表3!C[-4]:C,5,0) -> 狂风斩书 | F12: =VLOOKUP(RC[-5],工作表3!C[-5]:C[-1],4,0) -> 铁甲尸王
A13: 10 | B13: =VLOOKUP(RC[-1],工作表3!C[-1]:C[3],2,0) -> 1 | C13: day | D13: =VLOOKUP(RC[-3],工作表3!C[-3]:C[1],3,0) -> 1 | E13: =VLOOKUP(RC[-4],工作表3!C[-4]:C,5,0) -> 逐日剑法书 | F13: =VLOOKUP(RC[-5],工作表3!C[-5]:C[-1],4,0) -> 铁甲尸王
A14: 11 | B14: =VLOOKUP(RC[-1],工作表3!C[-1]:C[3],2,0) -> 1 | C14: day | D14: =VLOOKUP(RC[-3],工作表3!C[-3]:C[1],3,0) -> 1 | E14: =VLOOKUP(RC[-4],工作表3!C[-4]:C,5,0) -> 诱惑之光书 | F14: =VLOOKUP(RC[-5],工作表3!C[-5]:C[-1],4,0) -> 铁甲尸王
A15: 12 | B15: =VLOOKUP(RC[-1],工作表3!C[-1]:C[3],2,0) -> 1 | C15: day | D15: =VLOOKUP(RC[-3],工作表3!C[-3]:C[1],3,0) -> 1 | E15: =VLOOKUP(RC[-4],工作表3!C[-4]:C,5,0) -> 流星火雨书 | F15: =VLOOKUP(RC[-5],工作表3!C[-5]:C[-1],4,0) -> 铁甲尸王
A16: 13 | B16: =VLOOKUP(RC[-1],工作表3!C[-1]:C[3],2,0) -> 1 | C16: day | D16: =VLOOKUP(RC[-3],工作表3!C[-3]:C[1],3,0) -> 1 | E16: =VLOOKUP(RC[-4],工作表3!C[-4]:C,5,0) -> 召唤神兽书 | F16: =VLOOKUP(RC[-5],工作表3!C[-5]:C[-1],4,0) -> 铁甲尸王
A17: 14 | B17: =VLOOKUP(RC[-1],工作表3!C[-1]:C[3],2,0) -> 1 | C17: day | D17: =VLOOKUP(RC[-3],工作表3!C[-3]:C[1],3,0) -> 1 | E17: =VLOOKUP(RC[-4],工作表3!C[-4]:C,5,0) -> 嗜血术书 | F17: =VLOOKUP(RC[-5],工作表3!C[-5]:C[-1],4,0) -> 铁甲尸王
A18: 15 | B18: =VLOOKUP(RC[-1],工作表3!C[-1]:C[3],2,0) -> 1 | C18: day | D18: =VLOOKUP(RC[-3],工作表3!C[-3]:C[1],3,0) -> 1 | E18: =VLOOKUP(RC[-4],工作表3!C[-4]:C,5,0) -> 怒斩 | F18: =VLOOKUP(RC[-5],工作表3!C[-5]:C[-1],4,0) -> 骷髅精灵
A19: 16 | B19: =VLOOKUP(RC[-1],工作表3!C[-1]:C[3],2,0) -> 1 | C19: day | D19: =VLOOKUP(RC[-3],工作表3!C[-3]:C[1],3,0) -> 1 | E19: =VLOOKUP(RC[-4],工作表3!C[-4]:C,5,0) -> 至尊屠龙 | F19: =VLOOKUP(RC[-5],工作表3!C[-5]:C[-1],4,0) -> 骷髅精灵
A20: 17 | B20: =VLOOKUP(RC[-1],工作表3!C[-1]:C[3],2,0) -> 20 | C20: day | D20: =VLOOKUP(RC[-3],工作表3!C[-3]:C[1],3,0) -> 1 | E20: =VLOOKUP(RC[-4],工作表3!C[-4]:C,5,0) -> 进阶丹 | F20: =VLOOKUP(RC[-5],工作表3!C[-5]:C[-1],4,0) -> 骷髅精灵
A21: 18 | B21: =VLOOKUP(RC[-1],工作表3!C[-1]:C[3],2,0) -> 1 | C21: day | D21: =VLOOKUP(RC[-3],工作表3!C[-3]:C[1],3,0) -> 1 | E21: =VLOOKUP(RC[-4],工作表3!C[-4]:C,5,0) -> 金刚石 | F21: =VLOOKUP(RC[-5],工作表3!C[-5]:C[-1],4,0) -> 骷髅精灵
A22: 19 | B22: =VLOOKUP(RC[-1],工作表3!C[-1]:C[3],2,0) -> 100 | C22: day | D22: =VLOOKUP(RC[-3],工作表3!C[-3]:C[1],3,0) -> 1 | E22: =VLOOKUP(RC[-4],工作表3!C[-4]:C,5,0) -> 2元宝 | F22: =VLOOKUP(RC[-5],工作表3!C[-5]:C[-1],4,0) -> 骷髅精灵
A23: 20 | B23: =VLOOKUP(RC[-1],工作表3!C[-1]:C[3],2,0) -> 10 | C23: day | D23: =VLOOKUP(RC[-3],工作表3!C[-3]:C[1],3,0) -> 1 | E23: =VLOOKUP(RC[-4],工作表3!C[-4]:C,5,0) -> 5元宝 | F23: =VLOOKUP(RC[-5],工作表3!C[-5]:C[-1],4,0) -> 骷髅精灵
A24: 21 | B24: =VLOOKUP(RC[-1],工作表3!C[-1]:C[3],2,0) -> 10 | C24: day | D24: =VLOOKUP(RC[-3],工作表3!C[-3]:C[1],3,0) -> 1 | E24: =VLOOKUP(RC[-4],工作表3!C[-4]:C,5,0) -> 10元宝 | F24: =VLOOKUP(RC[-5],工作表3!C[-5]:C[-1],4,0) -> 骷髅精灵
A25: 22 | B25: =VLOOKUP(RC[-1],工作表3!C[-1]:C[3],2,0) -> 10 | C25: day | D25: =VLOOKUP(RC[-3],工作表3!C[-3]:C[1],3,0) -> 1 | E25: =VLOOKUP(RC[-4],工作表3!C[-4]:C,5,0) -> 20元宝 | F25: =VLOOKUP(RC[-5],工作表3!C[-5]:C[-1],4,0) -> 骷髅精灵
A26: 23 | B26: =VLOOKUP(RC[-1],工作表3!C[-1]:C[3],2,0) -> 5 | C26: day | D26: =VLOOKUP(RC[-3],工作表3!C[-3]:C[1],3,0) -> 1 | E26: =VLOOKUP(RC[-4],工作表3!C[-4]:C,5,0) -> 50元宝 | F26: =VLOOKUP(RC[-5],工作表3!C[-5]:C[-1],4,0) -> 骷髅精灵
A27: 24 | B27: =VLOOKUP(RC[-1],工作表3!C[-1]:C[3],2,0) -> 6 | C27: day | D27: =VLOOKUP(RC[-3],工作表3!C[-3]:C[1],3,0) -> 1 | E27: =VLOOKUP(RC[-4],工作表3!C[-4]:C,5,0) -> 100元宝 | F27: =VLOOKUP(RC[-5],工作表3!C[-5]:C[-1],4,0) -> 骷髅精灵
A28: 25 | B28: =VLOOKUP(RC[-1],工作表3!C[-1]:C[3],2,0) -> 4 | C28: day | D28: =VLOOKUP(RC[-3],工作表3!C[-3]:C[1],3,0) -> 1 | E28: =VLOOKUP(RC[-4],工作表3!C[-4]:C,5,0) -> 150元宝 | F28: =VLOOKUP(RC[-5],工作表3!C[-5]:C[-1],4,0) -> 骷髅精灵
A29: 26 | B29: =VLOOKUP(RC[-1],工作表3!C[-1]:C[3],2,0) -> 3 | C29: day | D29: =VLOOKUP(RC[-3],工作表3!C[-3]:C[1],3,0) -> 1 | E29: =VLOOKUP(RC[-4],工作表3!C[-4]:C,5,0) -> 200元宝 | F29: =VLOOKUP(RC[-5],工作表3!C[-5]:C[-1],4,0) -> 骷髅精灵
A30: 28 | B30: =VLOOKUP(RC[-1],工作表3!C[-1]:C[3],2,0) -> 1 | C30: day | D30: =VLOOKUP(RC[-3],工作表3!C[-3]:C[1],3,0) -> 1 | E30: =VLOOKUP(RC[-4],工作表3!C[-4]:C,5,0) -> 开天 | F30: =VLOOKUP(RC[-5],工作表3!C[-5]:C[-1],4,0) -> 铁甲尸王
A31: 29 | B31: =VLOOKUP(RC[-1],工作表3!C[-1]:C[3],2,0) -> 1 | C31: day | D31: =VLOOKUP(RC[-3],工作表3!C[-3]:C[1],3,0) -> 1 | E31: =VLOOKUP(RC[-4],工作表3!C[-4]:C,5,0) -> 混沌 | F31: =VLOOKUP(RC[-5],工作表3!C[-5]:C[-1],4,0) -> 铁甲尸王
A32: 30 | B32: =VLOOKUP(RC[-1],工作表3!C[-1]:C[3],2,0) -> 1 | C32: day | D32: =VLOOKUP(RC[-3],工作表3!C[-3]:C[1],3,0) -> 3 | E32: =VLOOKUP(RC[-4],工作表3!C[-4]:C,5,0) -> 战刃 | F32: =VLOOKUP(RC[-5],工作表3!C[-5]:C[-1],4,0) -> 铁甲尸王
A33: 31 | B33: =VLOOKUP(RC[-1],工作表3!C[-1]:C[3],2,0) -> 1 | C33: day | D33: =VLOOKUP(RC[-3],工作表3!C[-3]:C[1],3,0) -> 7 | E33: =VLOOKUP(RC[-4],工作表3!C[-4]:C,5,0) -> 麻痹戒指 | F33: =VLOOKUP(RC[-5],工作表3!C[-5]:C[-1],4,0) -> 铁甲尸王
A34: 32 | B34: =VLOOKUP(RC[-1],工作表3!C[-1]:C[3],2,0) -> 5 | C34: day | D34: =VLOOKUP(RC[-3],工作表3!C[-3]:C[1],3,0) -> 1 | E34: =VLOOKUP(RC[-4],工作表3!C[-4]:C,5,0) -> 上古神石 | F34: =VLOOKUP(RC[-5],工作表3!C[-5]:C[-1],4,0) -> 铁甲尸王
A35: 33 | B35: =VLOOKUP(RC[-1],工作表3!C[-1]:C[3],2,0) -> 1 | C35: day | D35: =VLOOKUP(RC[-3],工作表3!C[-3]:C[1],3,0) -> 1 | E35: =VLOOKUP(RC[-4],工作表3!C[-4]:C,5,0) -> 特面 | F35: =VLOOKUP(RC[-5],工作表3!C[-5]:C[-1],4,0) -> 铁甲尸王
A36: 34 | B36: =VLOOKUP(RC[-1],工作表3!C[-1]:C[3],2,0) -> 1 | C36: day | D36: =VLOOKUP(RC[-3],工作表3!C[-3]:C[1],3,0) -> 1 | E36: =VLOOKUP(RC[-4],工作表3!C[-4]:C,5,0) -> 特腿 | F36: =VLOOKUP(RC[-5],工作表3!C[-5]:C[-1],4,0) -> 铁甲尸王
A37: 35 | B37: =VLOOKUP(RC[-1],工作表3!C[-1]:C[3],2,0) -> 1 | C37: day | D37: =VLOOKUP(RC[-3],工作表3!C[-3]:C[1],3,0) -> 1 | E37: =VLOOKUP(RC[-4],工作表3!C[-4]:C,5,0) -> 特肩 | F37: =VLOOKUP(RC[-5],工作表3!C[-5]:C[-1],4,0) -> 铁甲尸王
A38: 36 | B38: =VLOOKUP(RC[-1],工作表3!C[-1]:C[3],2,0) -> 1 | C38: day | D38: =VLOOKUP(RC[-3],工作表3!C[-3]:C[1],3,0) -> 1 | E38: =VLOOKUP(RC[-4],工作表3!C[-4]:C,5,0) -> 狂风斩书 | F38: =VLOOKUP(RC[-5],工作表3!C[-5]:C[-1],4,0) -> 骷髅精灵
A39: 37 | B39: =VLOOKUP(RC[-1],工作表3!C[-1]:C[3],2,0) -> 1 | C39: day | D39: =VLOOKUP(RC[-3],工作表3!C[-3]:C[1],3,0) -> 1 | E39: =VLOOKUP(RC[-4],工作表3!C[-4]:C,5,0) -> 逐日剑法书 | F39: =VLOOKUP(RC[-5],工作表3!C[-5]:C[-1],4,0) -> 骷髅精灵
A40: 38 | B40: =VLOOKUP(RC[-1],工作表3!C[-1]:C[3],2,0) -> 1 | C40: day | D40: =VLOOKUP(RC[-3],工作表3!C[-3]:C[1],3,0) -> 1 | E40: =VLOOKUP(RC[-4],工作表3!C[-4]:C,5,0) -> 诱惑之光书 | F40: =VLOOKUP(RC[-5],工作表3!C[-5]:C[-1],4,0) -> 骷髅精灵
A41: 39 | B41: =VLOOKUP(RC[-1],工作表3!C[-1]:C[3],2,0) -> 1 | C41: day | D41: =VLOOKUP(RC[-3],工作表3!C[-3]:C[1],3,0) -> 1 | E41: =VLOOKUP(RC[-4],工作表3!C[-4]:C,5,0) -> 流星火雨书 | F41: =VLOOKUP(RC[-5],工作表3!C[-5]:C[-1],4,0) -> 骷髅精灵
A42: 40 | B42: =VLOOKUP(RC[-1],工作表3!C[-1]:C[3],2,0) -> 1 | C42: day | D42: =VLOOKUP(RC[-3],工作表3!C[-3]:C[1],3,0) -> 1 | E42: =VLOOKUP(RC[-4],工作表3!C[-4]:C,5,0) -> 召唤神兽书 | F42: =VLOOKUP(RC[-5],工作表3!C[-5]:C[-1],4,0) -> 骷髅精灵
A43: 41 | B43: =VLOOKUP(RC[-1],工作表3!C[-1]:C[3],2,0) -> 1 | C43: day | D43: =VLOOKUP(RC[-3],工作表3!C[-3]:C[1],3,0) -> 1 | E43: =VLOOKUP(RC[-4],工作表3!C[-4]:C,5,0) -> 嗜血术书 | F43: =VLOOKUP(RC[-5],工作表3!C[-5]:C[-1],4,0) -> 骷髅精灵
A44: 42 | B44: =VLOOKUP(RC[-1],工作表3!C[-1]:C[3],2,0) -> 1 | C44: day | D44: =VLOOKUP(RC[-3],工作表3!C[-3]:C[1],3,0) -> 1 | E44: =VLOOKUP(RC[-4],工作表3!C[-4]:C,5,0) -> 怒斩 | F44: =VLOOKUP(RC[-5],工作表3!C[-5]:C[-1],4,0) -> 铁甲尸王
A45: 43 | B45: =VLOOKUP(RC[-1],工作表3!C[-1]:C[3],2,0) -> 1 | C45: day | D45: =VLOOKUP(RC[-3],工作表3!C[-3]:C[1],3,0) -> 1 | E45: =VLOOKUP(RC[-4],工作表3!C[-4]:C,5,0) -> 至尊屠龙 | F45: =VLOOKUP(RC[-5],工作表3!C[-5]:C[-1],4,0) -> 铁甲尸王
A46: 44 | B46: =VLOOKUP(RC[-1],工作表3!C[-1]:C[3],2,0) -> 20 | C46: day | D46: =VLOOKUP(RC[-3],工作表3!C[-3]:C[1],3,0) -> 1 | E46: =VLOOKUP(RC[-4],工作表3!C[-4]:C,5,0) -> 进阶丹 | F46: =VLOOKUP(RC[-5],工作表3!C[-5]:C[-1],4,0) -> 铁甲尸王
A47: 45 | B47: =VLOOKUP(RC[-1],工作表3!C[-1]:C[3],2,0) -> 1 | C47: day | D47: =VLOOKUP(RC[-3],工作表3!C[-3]:C[1],3,0) -> 1 | E47: =VLOOKUP(RC[-4],工作表3!C[-4]:C,5,0) -> 金刚石 | F47: =VLOOKUP(RC[-5],工作表3!C[-5]:C[-1],4,0) -> 铁甲尸王
A48: 46 | B48: =VLOOKUP(RC[-1],工作表3!C[-1]:C[3],2,0) -> 100 | C48: day | D48: =VLOOKUP(RC[-3],工作表3!C[-3]:C[1],3,0) -> 1 | E48: =VLOOKUP(RC[-4],工作表3!C[-4]:C,5,0) -> 2元宝 | F48: =VLOOKUP(RC[-5],工作表3!C[-5]:C[-1],4,0) -> 铁甲尸王
A49: 47 | B49: =VLOOKUP(RC[-1],工作表3!C[-1]:C[3],2,0) -> 10 | C49: day | D49: =VLOOKUP(RC[-3],工作表3!C[-3]:C[1],3,0) -> 1 | E49: =VLOOKUP(RC[-4],工作表3!C[-4]:C,5,0) -> 5元宝 | F49: =VLOOKUP(RC[-5],工作表3!C[-5]:C[-1],4,0) -> 铁甲尸王
A50: 48 | B50: =VLOOKUP(RC[-1],工作表3!C[-1]:C[3],2,0) -> 10 | C50: day | D50: =VLOOKUP(RC[-3],工作表3!C[-3]:C[1],3,0) -> 1 | E50: =VLOOKUP(RC[-4],工作表3!C[-4]:C,5,0) -> 10元宝 | F50: =VLOOKUP(RC[-5],工作表3!C[-5]:C[-1],4,0) -> 铁甲尸王
A51: 49 | B51: =VLOOKUP(RC[-1],工作表3!C[-1]:C[3],2,0) -> 10 | C51: day | D51: =VLOOKUP(RC[-3],工作表3!C[-3]:C[1],3,0) -> 1 | E51: =VLOOKUP(RC[-4],工作表3!C[-4]:C,5,0) -> 20元宝 | F51: =VLOOKUP(RC[-5],工作表3!C[-5]:C[-1],4,0) -> 铁甲尸王
A52: 50 | B52: =VLOOKUP(RC[-1],工作表3!C[-1]:C[3],2,0) -> 5 | C52: day | D52: =VLOOKUP(RC[-3],工作表3!C[-3]:C[1],3,0) -> 1 | E52: =VLOOKUP(RC[-4],工作表3!C[-4]:C,5,0) -> 50元宝 | F52: =VLOOKUP(RC[-5],工作表3!C[-5]:C[-1],4,0) -> 铁甲尸王
A53: 51 | B53: =VLOOKUP(RC[-1],工作表3!C[-1]:C[3],2,0) -> 6 | C53: day | D53: =VLOOKUP(RC[-3],工作表3!C[-3]:C[1],3,0) -> 1 | E53: =VLOOKUP(RC[-4],工作表3!C[-4]:C,5,0) -> 100元宝 | F53: =VLOOKUP(RC[-5],工作表3!C[-5]:C[-1],4,0) -> 铁甲尸王
A54: 52 | B54: =VLOOKUP(RC[-1],工作表3!C[-1]:C[3],2,0) -> 4 | C54: day | D54: =VLOOKUP(RC[-3],工作表3!C[-3]:C[1],3,0) -> 1 | E54: =VLOOKUP(RC[-4],工作表3!C[-4]:C,5,0) -> 150元宝 | F54: =VLOOKUP(RC[-5],工作表3!C[-5]:C[-1],4,0) -> 铁甲尸王
A55: 53 | B55: =VLOOKUP(RC[-1],工作表3!C[-1]:C[3],2,0) -> 3 | C55: day | D55: =VLOOKUP(RC[-3],工作表3!C[-3]:C[1],3,0) -> 1 | E55: =VLOOKUP(RC[-4],工作表3!C[-4]:C,5,0) -> 200元宝 | F55: =VLOOKUP(RC[-5],工作表3!C[-5]:C[-1],4,0) -> 铁甲尸王
A56: 55 | B56: =VLOOKUP(RC[-1],工作表3!C[-1]:C[3],2,0) -> 1 | C56: day | D56: =VLOOKUP(RC[-3],工作表3!C[-3]:C[1],3,0) -> 1 | E56: =VLOOKUP(RC[-4],工作表3!C[-4]:C,5,0) -> 开天 | F56: =VLOOKUP(RC[-5],工作表3!C[-5]:C[-1],4,0) -> 奥玛教主
A57: 56 | B57: =VLOOKUP(RC[-1],工作表3!C[-1]:C[3],2,0) -> 1 | C57: day | D57: =VLOOKUP(RC[-3],工作表3!C[-3]:C[1],3,0) -> 1 | E57: =VLOOKUP(RC[-4],工作表3!C[-4]:C,5,0) -> 混沌 | F57: =VLOOKUP(RC[-5],工作表3!C[-5]:C[-1],4,0) -> 奥玛教主
A58: 57 | B58: =VLOOKUP(RC[-1],工作表3!C[-1]:C[3],2,0) -> 1 | C58: day | D58: =VLOOKUP(RC[-3],工作表3!C[-3]:C[1],3,0) -> 3 | E58: =VLOOKUP(RC[-4],工作表3!C[-4]:C,5,0) -> 战刃 | F58: =VLOOKUP(RC[-5],工作表3!C[-5]:C[-1],4,0) -> 奥玛教主
A59: 58 | B59: =VLOOKUP(RC[-1],工作表3!C[-1]:C[3],2,0) -> 1 | C59: day | D59: =VLOOKUP(RC[-3],工作表3!C[-3]:C[1],3,0) -> 7 | E59: =VLOOKUP(RC[-4],工作表3!C[-4]:C,5,0) -> 麻痹戒指 | F59: =VLOOKUP(RC[-5],工作表3!C[-5]:C[-1],4,0) -> 奥玛教主
A60: 59 | B60: =VLOOKUP(RC[-1],工作表3!C[-1]:C[3],2,0) -> 5 | C60: day | D60: =VLOOKUP(RC[-3],工作表3!C[-3]:C[1],3,0) -> 1 | E60: =VLOOKUP(RC[-4],工作表3!C[-4]:C,5,0) -> 上古神石 | F60: =VLOOKUP(RC[-5],工作表3!C[-5]:C[-1],4,0) -> 奥玛教主
A61: 60 | B61: =VLOOKUP(RC[-1],工作表3!C[-1]:C[3],2,0) -> 1 | C61: day | D61: =VLOOKUP(RC[-3],工作表3!C[-3]:C[1],3,0) -> 1 | E61: =VLOOKUP(RC[-4],工作表3!C[-4]:C,5,0) -> 特面 | F61: =VLOOKUP(RC[-5],工作表3!C[-5]:C[-1],4,0) -> 奥玛教主
A62: 61 | B62: =VLOOKUP(RC[-1],工作表3!C[-1]:C[3],2,0) -> 1 | C62: day | D62: =VLOOKUP(RC[-3],工作表3!C[-3]:C[1],3,0) -> 1 | E62: =VLOOKUP(RC[-4],工作表3!C[-4]:C,5,0) -> 特腿 | F62: =VLOOKUP(RC[-5],工作表3!C[-5]:C[-1],4,0) -> 奥玛教主
A63: 62 | B63: =VLOOKUP(RC[-1],工作表3!C[-1]:C[3],2,0) -> 1 | C63: day | D63: =VLOOKUP(RC[-3],工作表3!C[-3]:C[1],3,0) -> 1 | E63: =VLOOKUP(RC[-4],工作表3!C[-4]:C,5,0) -> 特肩 | F63: =VLOOKUP(RC[-5],工作表3!C[-5]:C[-1],4,0) -> 奥玛教主
A64: 69 | B64: =VLOOKUP(RC[-1],工作表3!C[-1]:C[3],2,0) -> 1 | C64: day | D64: =VLOOKUP(RC[-3],工作表3!C[-3]:C[1],3,0) -> 1 | E64: =VLOOKUP(RC[-4],工作表3!C[-4]:C,5,0) -> 怒斩 | F64: =VLOOKUP(RC[-5],工作表3!C[-5]:C[-1],4,0) -> 奥玛教主
A65: 70 | B65: =VLOOKUP(RC[-1],工作表3!C[-1]:C[3],2,0) -> 1 | C65: day | D65: =VLOOKUP(RC[-3],工作表3!C[-3]:C[1],3,0) -> 1 | E65: =VLOOKUP(RC[-4],工作表3!C[-4]:C,5,0) -> 至尊屠龙 | F65: =VLOOKUP(RC[-5],工作表3!C[-5]:C[-1],4,0) -> 奥玛教主
A66: 71 | B66: =VLOOKUP(RC[-1],工作表3!C[-1]:C[3],2,0) -> 24 | C66: day | D66: =VLOOKUP(RC[-3],工作表3!C[-3]:C[1],3,0) -> 1 | E66: =VLOOKUP(RC[-4],工作表3!C[-4]:C,5,0) -> 进阶丹 | F66: =VLOOKUP(RC[-5],工作表3!C[-5]:C[-1],4,0) -> 奥玛教主
A67: 72 | B67: =VLOOKUP(RC[-1],工作表3!C[-1]:C[3],2,0) -> 1 | C67: day | D67: =VLOOKUP(RC[-3],工作表3!C[-3]:C[1],3,0) -> 1 | E67: =VLOOKUP(RC[-4],工作表3!C[-4]:C,5,0) -> 金刚石 | F67: =VLOOKUP(RC[-5],工作表3!C[-5]:C[-1],4,0) -> 奥玛教主
A68: 73 | B68: =VLOOKUP(RC[-1],工作表3!C[-1]:C[3],2,0) -> 100 | C68: day | D68: =VLOOKUP(RC[-3],工作表3!C[-3]:C[1],3,0) -> 1 | E68: =VLOOKUP(RC[-4],工作表3!C[-4]:C,5,0) -> 2元宝 | F68: =VLOOKUP(RC[-5],工作表3!C[-5]:C[-1],4,0) -> 奥玛教主
A69: 74 | B69: =VLOOKUP(RC[-1],工作表3!C[-1]:C[3],2,0) -> 10 | C69: day | D69: =VLOOKUP(RC[-3],工作表3!C[-3]:C[1],3,0) -> 1 | E69: =VLOOKUP(RC[-4],工作表3!C[-4]:C,5,0) -> 5元宝 | F69: =VLOOKUP(RC[-5],工作表3!C[-5]:C[-1],4,0) -> 奥玛教主
A70: 75 | B70: =VLOOKUP(RC[-1],工作表3!C[-1]:C[3],2,0) -> 10 | C70: day | D70: =VLOOKUP(RC[-3],工作表3!C[-3]:C[1],3,0) -> 1 | E70: =VLOOKUP(RC[-4],工作表3!C[-4]:C,5,0) -> 10元宝 | F70: =VLOOKUP(RC[-5],工作表3!C[-5]:C[-1],4,0) -> 奥玛教主
A71: 76 | B71: =VLOOKUP(RC[-1],工作表3!C[-1]:C[3],2,0) -> 8 | C71: day | D71: =VLOOKUP(RC[-3],工作表3!C[-3]:C[1],3,0) -> 1 | E71: =VLOOKUP(RC[-4],工作表3!C[-4]:C,5,0) -> 20元宝 | F71: =VLOOKUP(RC[-5],工作表3!C[-5]:C[-1],4,0) -> 奥玛教主
A72: 77 | B72: =VLOOKUP(RC[-1],工作表3!C[-1]:C[3],2,0) -> 5 | C72: day | D72: =VLOOKUP(RC[-3],工作表3!C[-3]:C[1],3,0) -> 1 | E72: =VLOOKUP(RC[-4],工作表3!C[-4]:C,5,0) -> 50元宝 | F72: =VLOOKUP(RC[-5],工作表3!C[-5]:C[-1],4,0) -> 奥玛教主
A73: 78 | B73: =VLOOKUP(RC[-1],工作表3!C[-1]:C[3],2,0) -> 6 | C73: day | D73: =VLOOKUP(RC[-3],工作表3!C[-3]:C[1],3,0) -> 1 | E73: =VLOOKUP(RC[-4],工作表3!C[-4]:C,5,0) -> 100元宝 | F73: =VLOOKUP(RC[-5],工作表3!C[-5]:C[-1],4,0) -> 奥玛教主
A74: 79 | B74: =VLOOKUP(RC[-1],工作表3!C[-1]:C[3],2,0) -> 4 | C74: day | D74: =VLOOKUP(RC[-3],工作表3!C[-3]:C[1],3,0) -> 1 | E74: =VLOOKUP(RC[-4],工作表3!C[-4]:C,5,0) -> 150元宝 | F74: =VLOOKUP(RC[-5],工作表3!C[-5]:C[-1],4,0) -> 奥玛教主
A75: 80 | B75: =VLOOKUP(RC[-1],工作表3!C[-1]:C[3],2,0) -> 3 | C75: day | D75: =VLOOKUP(RC[-3],工作表3!C[-3]:C[1],3,0) -> 1 | E75: =VLOOKUP(RC[-4],工作表3!C[-4]:C,5,0) -> 200元宝 | F75: =VLOOKUP(RC[-5],工作表3!C[-5]:C[-1],4,0) -> 奥玛教主
A76: 82 | B76: =VLOOKUP(RC[-1],工作表3!C[-1]:C[3],2,0) -> 1 | C76: day | D76: =VLOOKUP(RC[-3],工作表3!C[-3]:C[1],3,0) -> 1 | E76: =VLOOKUP(RC[-4],工作表3!C[-4]:C,5,0) -> 开天 | F76: =VLOOKUP(RC[-5],工作表3!C[-5]:C[-1],4,0) -> 邪恶触龙
A77: 83 | B77: =VLOOKUP(RC[-1],工作表3!C[-1]:C[3],2,0) -> 1 | C77: day | D77: =VLOOKUP(RC[-3],工作表3!C[-3]:C[1],3,0) -> 1 | E77: =VLOOKUP(RC[-4],工作表3!C[-4]:C,5,0) -> 混沌 | F77: =VLOOKUP(RC[-5],工作表3!C[-5]:C[-1],4,0) -> 邪恶触龙
A78: 84 | B78: =VLOOKUP(RC[-1],工作表3!C[-1]:C[3],2,0) -> 1 | C78: day | D78: =VLOOKUP(RC[-3],工作表3!C[-3]:C[1],3,0) -> 3 | E78: =VLOOKUP(RC[-4],工作表3!C[-4]:C,5,0) -> 战刃 | F78: =VLOOKUP(RC[-5],工作表3!C[-5]:C[-1],4,0) -> 邪恶触龙
A79: 85 | B79: =VLOOKUP(RC[-1],工作表3!C[-1]:C[3],2,0) -> 1 | C79: day | D79: =VLOOKUP(RC[-3],工作表3!C[-3]:C[1],3,0) -> 7 | E79: =VLOOKUP(RC[-4],工作表3!C[-4]:C,5,0) -> 麻痹戒指 | F79: =VLOOKUP(RC[-5],工作表3!C[-5]:C[-1],4,0) -> 邪恶触龙
A80: 86 | B80: =VLOOKUP(RC[-1],工作表3!C[-1]:C[3],2,0) -> 5 | C80: day | D80: =VLOOKUP(RC[-3],工作表3!C[-3]:C[1],3,0) -> 1 | E80: =VLOOKUP(RC[-4],工作表3!C[-4]:C,5,0) -> 上古神石 | F80: =VLOOKUP(RC[-5],工作表3!C[-5]:C[-1],4,0) -> 邪恶触龙
A81: 87 | B81: =VLOOKUP(RC[-1],工作表3!C[-1]:C[3],2,0) -> 1 | C81: day | D81: =VLOOKUP(RC[-3],工作表3!C[-3]:C[1],3,0) -> 1 | E81: =VLOOKUP(RC[-4],工作表3!C[-4]:C,5,0) -> 特面 | F81: =VLOOKUP(RC[-5],工作表3!C[-5]:C[-1],4,0) -> 邪恶触龙
A82: 88 | B82: =VLOOKUP(RC[-1],工作表3!C[-1]:C[3],2,0) -> 1 | C82: day | D82: =VLOOKUP(RC[-3],工作表3!C[-3]:C[1],3,0) -> 1 | E82: =VLOOKUP(RC[-4],工作表3!C[-4]:C,5,0) -> 特腿 | F82: =VLOOKUP(RC[-5],工作表3!C[-5]:C[-1],4,0) -> 邪恶触龙
A83: 89 | B83: =VLOOKUP(RC[-1],工作表3!C[-1]:C[3],2,0) -> 1 | C83: day | D83: =VLOOKUP(RC[-3],工作表3!C[-3]:C[1],3,0) -> 1 | E83: =VLOOKUP(RC[-4],工作表3!C[-4]:C,5,0) -> 特肩 | F83: =VLOOKUP(RC[-5],工作表3!C[-5]:C[-1],4,0) -> 邪恶触龙
A84: 96 | B84: =VLOOKUP(RC[-1],工作表3!C[-1]:C[3],2,0) -> 1 | C84: day | D84: =VLOOKUP(RC[-3],工作表3!C[-3]:C[1],3,0) -> 1 | E84: =VLOOKUP(RC[-4],工作表3!C[-4]:C,5,0) -> 怒斩 | F84: =VLOOKUP(RC[-5],工作表3!C[-5]:C[-1],4,0) -> 邪恶触龙
A85: 97 | B85: =VLOOKUP(RC[-1],工作表3!C[-1]:C[3],2,0) -> 1 | C85: day | D85: =VLOOKUP(RC[-3],工作表3!C[-3]:C[1],3,0) -> 1 | E85: =VLOOKUP(RC[-4],工作表3!C[-4]:C,5,0) -> 至尊屠龙 | F85: =VLOOKUP(RC[-5],工作表3!C[-5]:C[-1],4,0) -> 邪恶触龙
A86: 98 | B86: =VLOOKUP(RC[-1],工作表3!C[-1]:C[3],2,0) -> 20 | C86: day | D86: =VLOOKUP(RC[-3],工作表3!C[-3]:C[1],3,0) -> 1 | E86: =VLOOKUP(RC[-4],工作表3!C[-4]:C,5,0) -> 进阶丹 | F86: =VLOOKUP(RC[-5],工作表3!C[-5]:C[-1],4,0) -> 邪恶触龙
A87: 99 | B87: =VLOOKUP(RC[-1],工作表3!C[-1]:C[3],2,0) -> 1 | C87: day | D87: =VLOOKUP(RC[-3],工作表3!C[-3]:C[1],3,0) -> 1 | E87: =VLOOKUP(RC[-4],工作表3!C[-4]:C,5,0) -> 金刚石 | F87: =VLOOKUP(RC[-5],工作表3!C[-5]:C[-1],4,0) -> 邪恶触龙
A88: 100 | B88: =VLOOKUP(RC[-1],工作表3!C[-1]:C[3],2,0) -> 100 | C88: day | D88: =VLOOKUP(RC[-3],工作表3!C[-3]:C[1],3,0) -> 1 | E88: =VLOOKUP(RC[-4],工作表3!C[-4]:C,5,0) -> 2元宝 | F88: =VLOOKUP(RC[-5],工作表3!C[-5]:C[-1],4,0) -> 邪恶触龙
A89: 101 | B89: =VLOOKUP(RC[-1],工作表3!C[-1]:C[3],2,0) -> 10 | C89: day | D89: =VLOOKUP(RC[-3],工作表3!C[-3]:C[1],3,0) -> 1 | E89: =VLOOKUP(RC[-4],工作表3!C[-4]:C,5,0) -> 5元宝 | F89: =VLOOKUP(RC[-5],工作表3!C[-5]:C[-1],4,0) -> 邪恶触龙
A90: 102 | B90: =VLOOKUP(RC[-1],工作表3!C[-1]:C[3],2,0) -> 10 | C90: day | D90: =VLOOKUP(RC[-3],工作表3!C[-3]:C[1],3,0) -> 1 | E90: =VLOOKUP(RC[-4],工作表3!C[-4]:C,5,0) -> 10元宝 | F90: =VLOOKUP(RC[-5],工作表3!C[-5]:C[-1],4,0) -> 邪恶触龙
A91: 103 | B91: =VLOOKUP(RC[-1],工作表3!C[-1]:C[3],2,0) -> 10 | C91: day | D91: =VLOOKUP(RC[-3],工作表3!C[-3]:C[1],3,0) -> 1 | E91: =VLOOKUP(RC[-4],工作表3!C[-4]:C,5,0) -> 20元宝 | F91: =VLOOKUP(RC[-5],工作表3!C[-5]:C[-1],4,0) -> 邪恶触龙
A92: 104 | B92: =VLOOKUP(RC[-1],工作表3!C[-1]:C[3],2,0) -> 5 | C92: day | D92: =VLOOKUP(RC[-3],工作表3!C[-3]:C[1],3,0) -> 1 | E92: =VLOOKUP(RC[-4],工作表3!C[-4]:C,5,0) -> 50元宝 | F92: =VLOOKUP(RC[-5],工作表3!C[-5]:C[-1],4,0) -> 邪恶触龙
A93: 105 | B93: =VLOOKUP(RC[-1],工作表3!C[-1]:C[3],2,0) -> 6 | C93: day | D93: =VLOOKUP(RC[-3],工作表3!C[-3]:C[1],3,0) -> 1 | E93: =VLOOKUP(RC[-4],工作表3!C[-4]:C,5,0) -> 100元宝 | F93: =VLOOKUP(RC[-5],工作表3!C[-5]:C[-1],4,0) -> 邪恶触龙
A94: 106 | B94: =VLOOKUP(RC[-1],工作表3!C[-1]:C[3],2,0) -> 4 | C94: day | D94: =VLOOKUP(RC[-3],工作表3!C[-3]:C[1],3,0) -> 1 | E94: =VLOOKUP(RC[-4],工作表3!C[-4]:C,5,0) -> 150元宝 | F94: =VLOOKUP(RC[-5],工作表3!C[-5]:C[-1],4,0) -> 邪恶触龙
A95: 107 | B95: =VLOOKUP(RC[-1],工作表3!C[-1]:C[3],2,0) -> 3 | C95: day | D95: =VLOOKUP(RC[-3],工作表3!C[-3]:C[1],3,0) -> 1 | E95: =VLOOKUP(RC[-4],工作表3!C[-4]:C,5,0) -> 200元宝 | F95: =VLOOKUP(RC[-5],工作表3!C[-5]:C[-1],4,0) -> 邪恶触龙
A96: 109 | B96: =VLOOKUP(RC[-1],工作表3!C[-1]:C[3],2,0) -> 1 | C96: day | D96: =VLOOKUP(RC[-3],工作表3!C[-3]:C[1],3,0) -> 1 | E96: =VLOOKUP(RC[-4],工作表3!C[-4]:C,5,0) -> 开天 | F96: =VLOOKUP(RC[-5],工作表3!C[-5]:C[-1],4,0) -> 白野猪王
A97: 111 | B97: =VLOOKUP(RC[-1],工作表3!C[-1]:C[3],2,0) -> 1 | C97: day | D97: =VLOOKUP(RC[-3],工作表3!C[-3]:C[1],3,0) -> 3 | E97: =VLOOKUP(RC[-4],工作表3!C[-4]:C,5,0) -> 战刃 | F97: =VLOOKUP(RC[-5],工作表3!C[-5]:C[-1],4,0) -> 白野猪王
A98: 112 | B98: =VLOOKUP(RC[-1],工作表3!C[-1]:C[3],2,0) -> 1 | C98: day | D98: =VLOOKUP(RC[-3],工作表3!C[-3]:C[1],3,0) -> 7 | E98: =VLOOKUP(RC[-4],工作表3!C[-4]:C,5,0) -> 麻痹戒指 | F98: =VLOOKUP(RC[-5],工作表3!C[-5]:C[-1],4,0) -> 白野猪王
A99: 113 | B99: =VLOOKUP(RC[-1],工作表3!C[-1]:C[3],2,0) -> 5 | C99: day | D99: =VLOOKUP(RC[-3],工作表3!C[-3]:C[1],3,0) -> 1 | E99: =VLOOKUP(RC[-4],工作表3!C[-4]:C,5,0) -> 上古神石 | F99: =VLOOKUP(RC[-5],工作表3!C[-5]:C[-1],4,0) -> 白野猪王
A100: 114 | B100: =VLOOKUP(RC[-1],工作表3!C[-1]:C[3],2,0) -> 1 | C100: day | D100: =VLOOKUP(RC[-3],工作表3!C[-3]:C[1],3,0) -> 1 | E100: =VLOOKUP(RC[-4],工作表3!C[-4]:C,5,0) -> 特面 | F100: =VLOOKUP(RC[-5],工作表3!C[-5]:C[-1],4,0) -> 白野猪王
A101: 115 | B101: =VLOOKUP(RC[-1],工作表3!C[-1]:C[3],2,0) -> 1 | C101: day | D101: =VLOOKUP(RC[-3],工作表3!C[-3]:C[1],3,0) -> 1 | E101: =VLOOKUP(RC[-4],工作表3!C[-4]:C,5,0) -> 特腿 | F101: =VLOOKUP(RC[-5],工作表3!C[-5]:C[-1],4,0) -> 白野猪王
A102: 116 | B102: =VLOOKUP(RC[-1],工作表3!C[-1]:C[3],2,0) -> 1 | C102: day | D102: =VLOOKUP(RC[-3],工作表3!C[-3]:C[1],3,0) -> 1 | E102: =VLOOKUP(RC[-4],工作表3!C[-4]:C,5,0) -> 特肩 | F102: =VLOOKUP(RC[-5],工作表3!C[-5]:C[-1],4,0) -> 白野猪王
A103: 123 | B103: =VLOOKUP(RC[-1],工作表3!C[-1]:C[3],2,0) -> 1 | C103: day | D103: =VLOOKUP(RC[-3],工作表3!C[-3]:C[1],3,0) -> 1 | E103: =VLOOKUP(RC[-4],工作表3!C[-4]:C,5,0) -> 怒斩 | F103: =VLOOKUP(RC[-5],工作表3!C[-5]:C[-1],4,0) -> 白野猪王
A104: 124 | B104: =VLOOKUP(RC[-1],工作表3!C[-1]:C[3],2,0) -> 1 | C104: day | D104: =VLOOKUP(RC[-3],工作表3!C[-3]:C[1],3,0) -> 1 | E104: =VLOOKUP(RC[-4],工作表3!C[-4]:C,5,0) -> 至尊屠龙 | F104: =VLOOKUP(RC[-5],工作表3!C[-5]:C[-1],4,0) -> 白野猪王
A105: 125 | B105: =VLOOKUP(RC[-1],工作表3!C[-1]:C[3],2,0) -> 20 | C105: day | D105: =VLOOKUP(RC[-3],工作表3!C[-3]:C[1],3,0) -> 1 | E105: =VLOOKUP(RC[-4],工作表3!C[-4]:C,5,0) -> 进阶丹 | F105: =VLOOKUP(RC[-5],工作表3!C[-5]:C[-1],4,0) -> 白野猪王
A106: 126 | B106: =VLOOKUP(RC[-1],工作表3!C[-1]:C[3],2,0) -> 1 | C106: day | D106: =VLOOKUP(RC[-3],工作表3!C[-3]:C[1],3,0) -> 1 | E106: =VLOOKUP(RC[-4],工作表3!C[-4]:C,5,0) -> 金刚石 | F106: =VLOOKUP(RC[-5],工作表3!C[-5]:C[-1],4,0) -> 白野猪王
A107: 127 | B107: =VLOOKUP(RC[-1],工作表3!C[-1]:C[3],2,0) -> 100 | C107: day | D107: =VLOOKUP(RC[-3],工作表3!C[-3]:C[1],3,0) -> 1 | E107: =VLOOKUP(RC[-4],工作表3!C[-4]:C,5,0) -> 2元宝 | F107: =VLOOKUP(RC[-5],工作表3!C[-5]:C[-1],4,0) -> 白野猪王
A108: 128 | B108: =VLOOKUP(RC[-1],工作表3!C[-1]:C[3],2,0) -> 10 | C108: day | D108: =VLOOKUP(RC[-3],工作表3!C[-3]:C[1],3,0) -> 1 | E108: =VLOOKUP(RC[-4],工作表3!C[-4]:C,5,0) -> 5元宝 | F108: =VLOOKUP(RC[-5],工作表3!C[-5]:C[-1],4,0) -> 白野猪王
A109: 129 | B109: =VLOOKUP(RC[-1],工作表3!C[-1]:C[3],2,0) -> 10 | C109: day | D109: =VLOOKUP(RC[-3],工作表3!C[-3]:C[1],3,0) -> 1 | E109: =VLOOKUP(RC[-4],工作表3!C[-4]:C,5,0) -> 10元宝 | F109: =VLOOKUP(RC[-5],工作表3!C[-5]:C[-1],4,0) -> 白野猪王
A110: 130 | B110: =VLOOKUP(RC[-1],工作表3!C[-1]:C[3],2,0) -> 10 | C110: day | D110: =VLOOKUP(RC[-3],工作表3!C[-3]:C[1],3,0) -> 1 | E110: =VLOOKUP(RC[-4],工作表3!C[-4]:C,5,0) -> 20元宝 | F110: =VLOOKUP(RC[-5],工作表3!C[-5]:C[-1],4,0) -> 白野猪王
A111: 131 | B111: =VLOOKUP(RC[-1],工作表3!C[-1]:C[3],2,0) -> 5 | C111: day | D111: =VLOOKUP(RC[-3],工作表3!C[-3]:C[1],3,0) -> 1 | E111: =VLOOKUP(RC[-4],工作表3!C[-4]:C,5,0) -> 50元宝 | F111: =VLOOKUP(RC[-5],工作表3!C[-5]:C[-1],4,0) -> 白野猪王
A112: 132 | B112: =VLOOKUP(RC[-1],工作表3!C[-1]:C[3],2,0) -> 6 | C112: day | D112: =VLOOKUP(RC[-3],工作表3!C[-3]:C[1],3,0) -> 1 | E112: =VLOOKUP(RC[-4],工作表3!C[-4]:C,5,0) -> 100元宝 | F112: =VLOOKUP(RC[-5],工作表3!C[-5]:C[-1],4,0) -> 白野猪王
A113: 133 | B113: =VLOOKUP(RC[-1],工作表3!C[-1]:C[3],2,0) -> 4 | C113: day | D113: =VLOOKUP(RC[-3],工作表3!C[-3]:C[1],3,0) -> 1 | E113: =VLOOKUP(RC[-4],工作表3!C[-4]:C,5,0) -> 150元宝 | F113: =VLOOKUP(RC[-5],工作表3!C[-5]:C[-1],4,0) -> 白野猪王
A114: 134 | B114: =VLOOKUP(RC[-1],工作表3!C[-1]:C[3],2,0) -> 3 | C114: day | D114: =VLOOKUP(RC[-3],工作表3!C[-3]:C[1],3,0) -> 1 | E114: =VLOOKUP(RC[-4],工作表3!C[-4]:C,5,0) -> 200元宝 | F114: =VLOOKUP(RC[-5],工作表3!C[-5]:C[-1],4,0) -> 白野猪王
A115: 136 | B115: =VLOOKUP(RC[-1],工作表3!C[-1]:C[3],2,0) -> 1 | C115: day | D115: =VLOOKUP(RC[-3],工作表3!C[-3]:C[1],3,0) -> 1 | E115: =VLOOKUP(RC[-4],工作表3!C[-4]:C,5,0) -> 开天 | F115: =VLOOKUP(RC[-5],工作表3!C[-5]:C[-1],4,0) -> 祖玛教主
A116: 138 | B116: =VLOOKUP(RC[-1],工作表3!C[-1]:C[3],2,0) -> 1 | C116: day | D116: =VLOOKUP(RC[-3],工作表3!C[-3]:C[1],3,0) -> 3 | E116: =VLOOKUP(RC[-4],工作表3!C[-4]:C,5,0) -> 战刃 | F116: =VLOOKUP(RC[-5],工作表3!C[-5]:C[-1],4,0) -> 祖玛教主
A117: 139 | B117: =VLOOKUP(RC[-1],工作表3!C[-1]:C[3],2,0) -> 1 | C117: day | D117: =VLOOKUP(RC[-3],工作表3!C[-3]:C[1],3,0) -> 7 | E117: =VLOOKUP(RC[-4],工作表3!C[-4]:C,5,0) -> 麻痹戒指 | F117: =VLOOKUP(RC[-5],工作表3!C[-5]:C[-1],4,0) -> 祖玛教主
A118: 140 | B118: =VLOOKUP(RC[-1],工作表3!C[-1]:C[3],2,0) -> 5 | C118: day | D118: =VLOOKUP(RC[-3],工作表3!C[-3]:C[1],3,0) -> 1 | E118: =VLOOKUP(RC[-4],工作表3!C[-4]:C,5,0) -> 上古神石 | F118: =VLOOKUP(RC[-5],工作表3!C[-5]:C[-1],4,0) -> 祖玛教主
A119: 141 | B119: =VLOOKUP(RC[-1],工作表3!C[-1]:C[3],2,0) -> 1 | C119: day | D119: =VLOOKUP(RC[-3],工作表3!C[-3]:C[1],3,0) -> 1 | E119: =VLOOKUP(RC[-4],工作表3!C[-4]:C,5,0) -> 特面 | F119: =VLOOKUP(RC[-5],工作表3!C[-5]:C[-1],4,0) -> 祖玛教主
A120: 142 | B120: =VLOOKUP(RC[-1],工作表3!C[-1]:C[3],2,0) -> 1 | C120: day | D120: =VLOOKUP(RC[-3],工作表3!C[-3]:C[1],3,0) -> 1 | E120: =VLOOKUP(RC[-4],工作表3!C[-4]:C,5,0) -> 特腿 | F120: =VLOOKUP(RC[-5],工作表3!C[-5]:C[-1],4,0) -> 祖玛教主
A121: 143 | B121: =VLOOKUP(RC[-1],工作表3!C[-1]:C[3],2,0) -> 1 | C121: day | D121: =VLOOKUP(RC[-3],工作表3!C[-3]:C[1],3,0) -> 1 | E121: =VLOOKUP(RC[-4],工作表3!C[-4]:C,5,0) -> 特肩 | F121: =VLOOKUP(RC[-5],工作表3!C[-5]:C[-1],4,0) -> 祖玛教主
A122: 150 | B122: =VLOOKUP(RC[-1],工作表3!C[-1]:C[3],2,0) -> 1 | C122: day | D122: =VLOOKUP(RC[-3],工作表3!C[-3]:C[1],3,0) -> 1 | E122: =VLOOKUP(RC[-4],工作表3!C[-4]:C,5,0) -> 怒斩 | F122: =VLOOKUP(RC[-5],工作表3!C[-5]:C[-1],4,0) -> 祖玛教主
A123: 151 | B123: =VLOOKUP(RC[-1],工作表3!C[-1]:C[3],2,0) -> 1 | C123: day | D123: =VLOOKUP(RC[-3],工作表3!C[-3]:C[1],3,0) -> 1 | E123: =VLOOKUP(RC[-4],工作表3!C[-4]:C,5,0) -> 至尊屠龙 | F123: =VLOOKUP(RC[-5],工作表3!C[-5]:C[-1],4,0) -> 祖玛教主
A124: 152 | B124: =VLOOKUP(RC[-1],工作表3!C[-1]:C[3],2,0) -> 20 | C124: day | D124: =VLOOKUP(RC[-3],工作表3!C[-3]:C[1],3,0) -> 1 | E124: =VLOOKUP(RC[-4],工作表3!C[-4]:C,5,0) -> 进阶丹 | F124: =VLOOKUP(RC[-5],工作表3!C[-5]:C[-1],4,0) -> 祖玛教主
A125: 153 | B125: =VLOOKUP(RC[-1],工作表3!C[-1]:C[3],2,0) -> 1 | C125: day | D125: =VLOOKUP(RC[-3],工作表3!C[-3]:C[1],3,0) -> 1 | E125: =VLOOKUP(RC[-4],工作表3!C[-4]:C,5,0) -> 金刚石 | F125: =VLOOKUP(RC[-5],工作表3!C[-5]:C[-1],4,0) -> 祖玛教主
A126: 154 | B126: =VLOOKUP(RC[-1],工作表3!C[-1]:C[3],2,0) -> 100 | C126: day | D126: =VLOOKUP(RC[-3],工作表3!C[-3]:C[1],3,0) -> 1 | E126: =VLOOKUP(RC[-4],工作表3!C[-4]:C,5,0) -> 2元宝 | F126: =VLOOKUP(RC[-5],工作表3!C[-5]:C[-1],4,0) -> 祖玛教主
A127: 155 | B127: =VLOOKUP(RC[-1],工作表3!C[-1]:C[3],2,0) -> 10 | C127: day | D127: =VLOOKUP(RC[-3],工作表3!C[-3]:C[1],3,0) -> 1 | E127: =VLOOKUP(RC[-4],工作表3!C[-4]:C,5,0) -> 5元宝 | F127: =VLOOKUP(RC[-5],工作表3!C[-5]:C[-1],4,0) -> 祖玛教主
A128: 156 | B128: =VLOOKUP(RC[-1],工作表3!C[-1]:C[3],2,0) -> 10 | C128: day | D128: =VLOOKUP(RC[-3],工作表3!C[-3]:C[1],3,0) -> 1 | E128: =VLOOKUP(RC[-4],工作表3!C[-4]:C,5,0) -> 10元宝 | F128: =VLOOKUP(RC[-5],工作表3!C[-5]:C[-1],4,0) -> 祖玛教主
A129: 157 | B129: =VLOOKUP(RC[-1],工作表3!C[-1]:C[3],2,0) -> 10 | C129: day | D129: =VLOOKUP(RC[-3],工作表3!C[-3]:C[1],3,0) -> 1 | E129: =VLOOKUP(RC[-4],工作表3!C[-4]:C,5,0) -> 20元宝 | F129: =VLOOKUP(RC[-5],工作表3!C[-5]:C[-1],4,0) -> 祖玛教主
A130: 158 | B130: =VLOOKUP(RC[-1],工作表3!C[-1]:C[3],2,0) -> 5 | C130: day | D130: =VLOOKUP(RC[-3],工作表3!C[-3]:C[1],3,0) -> 1 | E130: =VLOOKUP(RC[-4],工作表3!C[-4]:C,5,0) -> 50元宝 | F130: =VLOOKUP(RC[-5],工作表3!C[-5]:C[-1],4,0) -> 祖玛教主
A131: 159 | B131: =VLOOKUP(RC[-1],工作表3!C[-1]:C[3],2,0) -> 6 | C131: day | D131: =VLOOKUP(RC[-3],工作表3!C[-3]:C[1],3,0) -> 1 | E131: =VLOOKUP(RC[-4],工作表3!C[-4]:C,5,0) -> 100元宝 | F131: =VLOOKUP(RC[-5],工作表3!C[-5]:C[-1],4,0) -> 祖玛教主
A132: 160 | B132: =VLOOKUP(RC[-1],工作表3!C[-1]:C[3],2,0) -> 4 | C132: day | D132: =VLOOKUP(RC[-3],工作表3!C[-3]:C[1],3,0) -> 1 | E132: =VLOOKUP(RC[-4],工作表3!C[-4]:C,5,0) -> 150元宝 | F132: =VLOOKUP(RC[-5],工作表3!C[-5]:C[-1],4,0) -> 祖玛教主
A133: 161 | B133: =VLOOKUP(RC[-1],工作表3!C[-1]:C[3],2,0) -> 3 | C133: day | D133: =VLOOKUP(RC[-3],工作表3!C[-3]:C[1],3,0) -> 1 | E133: =VLOOKUP(RC[-4],工作表3!C[-4]:C,5,0) -> 200元宝 | F133: =VLOOKUP(RC[-5],工作表3!C[-5]:C[-1],4,0) -> 祖玛教主
A134: 163 | B134: =VLOOKUP(RC[-1],工作表3!C[-1]:C[3],2,0) -> 4 | C134: day | D134: =VLOOKUP(RC[-3],工作表3!C[-3]:C[1],3,0) -> 1 | E134: =VLOOKUP(RC[-4],工作表3!C[-4]:C,5,0) -> 开天 | F134: =VLOOKUP(RC[-5],工作表3!C[-5]:C[-1],4,0) -> 赤月老魔
A135: 164 | B135: =VLOOKUP(RC[-1],工作表3!C[-1]:C[3],2,0) -> 1 | C135: day | D135: =VLOOKUP(RC[-3],工作表3!C[-3]:C[1],3,0) -> 1 | E135: =VLOOKUP(RC[-4],工作表3!C[-4]:C,5,0) -> 混沌 | F135: =VLOOKUP(RC[-5],工作表3!C[-5]:C[-1],4,0) -> 赤月老魔
A136: 165 | B136: =VLOOKUP(RC[-1],工作表3!C[-1]:C[3],2,0) -> 1 | C136: day | D136: =VLOOKUP(RC[-3],工作表3!C[-3]:C[1],3,0) -> 3 | E136: =VLOOKUP(RC[-4],工作表3!C[-4]:C,5,0) -> 战刃 | F136: =VLOOKUP(RC[-5],工作表3!C[-5]:C[-1],4,0) -> 赤月老魔
A137: 166 | B137: =VLOOKUP(RC[-1],工作表3!C[-1]:C[3],2,0) -> 1 | C137: day | D137: =VLOOKUP(RC[-3],工作表3!C[-3]:C[1],3,0) -> 7 | E137: =VLOOKUP(RC[-4],工作表3!C[-4]:C,5,0) -> 麻痹戒指 | F137: =VLOOKUP(RC[-5],工作表3!C[-5]:C[-1],4,0) -> 赤月老魔
A138: 167 | B138: =VLOOKUP(RC[-1],工作表3!C[-1]:C[3],2,0) -> 5 | C138: day | D138: =VLOOKUP(RC[-3],工作表3!C[-3]:C[1],3,0) -> 1 | E138: =VLOOKUP(RC[-4],工作表3!C[-4]:C,5,0) -> 上古神石 | F138: =VLOOKUP(RC[-5],工作表3!C[-5]:C[-1],4,0) -> 赤月老魔
A139: 168 | B139: =VLOOKUP(RC[-1],工作表3!C[-1]:C[3],2,0) -> 1 | C139: day | D139: =VLOOKUP(RC[-3],工作表3!C[-3]:C[1],3,0) -> 1 | E139: =VLOOKUP(RC[-4],工作表3!C[-4]:C,5,0) -> 特面 | F139: =VLOOKUP(RC[-5],工作表3!C[-5]:C[-1],4,0) -> 赤月老魔
A140: 169 | B140: =VLOOKUP(RC[-1],工作表3!C[-1]:C[3],2,0) -> 1 | C140: day | D140: =VLOOKUP(RC[-3],工作表3!C[-3]:C[1],3,0) -> 1 | E140: =VLOOKUP(RC[-4],工作表3!C[-4]:C,5,0) -> 特腿 | F140: =VLOOKUP(RC[-5],工作表3!C[-5]:C[-1],4,0) -> 赤月老魔
A141: 170 | B141: =VLOOKUP(RC[-1],工作表3!C[-1]:C[3],2,0) -> 1 | C141: day | D141: =VLOOKUP(RC[-3],工作表3!C[-3]:C[1],3,0) -> 1 | E141: =VLOOKUP(RC[-4],工作表3!C[-4]:C,5,0) -> 特肩 | F141: =VLOOKUP(RC[-5],工作表3!C[-5]:C[-1],4,0) -> 赤月老魔
A142: 177 | B142: =VLOOKUP(RC[-1],工作表3!C[-1]:C[3],2,0) -> 1 | C142: day | D142: =VLOOKUP(RC[-3],工作表3!C[-3]:C[1],3,0) -> 1 | E142: =VLOOKUP(RC[-4],工作表3!C[-4]:C,5,0) -> 怒斩 | F142: =VLOOKUP(RC[-5],工作表3!C[-5]:C[-1],4,0) -> 赤月老魔
A143: 178 | B143: =VLOOKUP(RC[-1],工作表3!C[-1]:C[3],2,0) -> 1 | C143: day | D143: =VLOOKUP(RC[-3],工作表3!C[-3]:C[1],3,0) -> 1 | E143: =VLOOKUP(RC[-4],工作表3!C[-4]:C,5,0) -> 至尊屠龙 | F143: =VLOOKUP(RC[-5],工作表3!C[-5]:C[-1],4,0) -> 赤月老魔
A144: 179 | B144: =VLOOKUP(RC[-1],工作表3!C[-1]:C[3],2,0) -> 22 | C144: day | D144: =VLOOKUP(RC[-3],工作表3!C[-3]:C[1],3,0) -> 1 | E144: =VLOOKUP(RC[-4],工作表3!C[-4]:C,5,0) -> 进阶丹 | F144: =VLOOKUP(RC[-5],工作表3!C[-5]:C[-1],4,0) -> 赤月老魔
A145: 180 | B145: =VLOOKUP(RC[-1],工作表3!C[-1]:C[3],2,0) -> 5 | C145: day | D145: =VLOOKUP(RC[-3],工作表3!C[-3]:C[1],3,0) -> 1 | E145: =VLOOKUP(RC[-4],工作表3!C[-4]:C,5,0) -> 金刚石 | F145: =VLOOKUP(RC[-5],工作表3!C[-5]:C[-1],4,0) -> 赤月老魔
A146: 181 | B146: =VLOOKUP(RC[-1],工作表3!C[-1]:C[3],2,0) -> 100 | C146: day | D146: =VLOOKUP(RC[-3],工作表3!C[-3]:C[1],3,0) -> 1 | E146: =VLOOKUP(RC[-4],工作表3!C[-4]:C,5,0) -> 2元宝 | F146: =VLOOKUP(RC[-5],工作表3!C[-5]:C[-1],4,0) -> 赤月老魔
A147: 182 | B147: =VLOOKUP(RC[-1],工作表3!C[-1]:C[3],2,0) -> 10 | C147: day | D147: =VLOOKUP(RC[-3],工作表3!C[-3]:C[1],3,0) -> 1 | E147: =VLOOKUP(RC[-4],工作表3!C[-4]:C,5,0) -> 5元宝 | F147: =VLOOKUP(RC[-5],工作表3!C[-5]:C[-1],4,0) -> 赤月老魔
A148: 183 | B148: =VLOOKUP(RC[-1],工作表3!C[-1]:C[3],2,0) -> 10 | C148: day | D148: =VLOOKUP(RC[-3],工作表3!C[-3]:C[1],3,0) -> 1 | E148: =VLOOKUP(RC[-4],工作表3!C[-4]:C,5,0) -> 10元宝 | F148: =VLOOKUP(RC[-5],工作表3!C[-5]:C[-1],4,0) -> 赤月老魔
A149: 184 | B149: =VLOOKUP(RC[-1],工作表3!C[-1]:C[3],2,0) -> 10 | C149: day | D149: =VLOOKUP(RC[-3],工作表3!C[-3]:C[1],3,0) -> 1 | E149: =VLOOKUP(RC[-4],工作表3!C[-4]:C,5,0) -> 20元宝 | F149: =VLOOKUP(RC[-5],工作表3!C[-5]:C[-1],4,0) -> 赤月老魔
A150: 185 | B150: =VLOOKUP(RC[-1],工作表3!C[-1]:C[3],2,0) -> 5 | C150: day | D150: =VLOOKUP(RC[-3],工作表3!C[-3]:C[1],3,0) -> 1 | E150: =VLOOKUP(RC[-4],工作表3!C[-4]:C,5,0) -> 50元宝 | F150: =VLOOKUP(RC[-5],工作表3!C[-5]:C[-1],4,0) -> 赤月老魔
A151: 186 | B151: =VLOOKUP(RC[-1],工作表3!C[-1]:C[3],2,0) -> 5 | C151: day | D151: =VLOOKUP(RC[-3],工作表3!C[-3]:C[1],3,0) -> 1 | E151: =VLOOKUP(RC[-4],工作表3!C[-4]:C,5,0) -> 100元宝 | F151: =VLOOKUP(RC[-5],工作表3!C[-5]:C[-1],4,0) -> 赤月老魔
A152: 187 | B152: =VLOOKUP(RC[-1],工作表3!C[-1]:C[3],2,0) -> 4 | C152: day | D152: =VLOOKUP(RC[-3],工作表3!C[-3]:C[1],3,0) -> 1 | E152: =VLOOKUP(RC[-4],工作表3!C[-4]:C,5,0) -> 150元宝 | F152: =VLOOKUP(RC[-5],工作表3!C[-5]:C[-1],4,0) -> 赤月老魔
A153: 188 | B153: =VLOOKUP(RC[-1],工作表3!C[-1]:C[3],2,0) -> 3 | C153: day | D153: =VLOOKUP(RC[-3],工作表3!C[-3]:C[1],3,0) -> 1 | E153: =VLOOKUP(RC[-4],工作表3!C[-4]:C,5,0) -> 200元宝 | F153: =VLOOKUP(RC[-5],工作表3!C[-5]:C[-1],4,0) -> 赤月老魔
A154: 190 | B154: =VLOOKUP(RC[-1],工作表3!C[-1]:C[3],2,0) -> 1 | C154: day | D154: =VLOOKUP(RC[-3],工作表3!C[-3]:C[1],3,0) -> 1 | E154: =VLOOKUP(RC[-4],工作表3!C[-4]:C,5,0) -> 开天 | F154: =VLOOKUP(RC[-5],工作表3!C[-5]:C[-1],4,0) -> 巨型多角虫
A155: 191 | B155: =VLOOKUP(RC[-1],工作表3!C[-1]:C[3],2,0) -> 1 | C155: day | D155: =VLOOKUP(RC[-3],工作表3!C[-3]:C[1],3,0) -> 1 | E155: =VLOOKUP(RC[-4],工作表3!C[-4]:C,5,0) -> 混沌 | F155: =VLOOKUP(RC[-5],工作表3!C[-5]:C[-1],4,0) -> 巨型多角虫
A156: 192 | B156: =VLOOKUP(RC[-1],工作表3!C[-1]:C[3],2,0) -> 1 | C156: day | D156: =VLOOKUP(RC[-3],工作表3!C[-3]:C[1],3,0) -> 3 | E156: =VLOOKUP(RC[-4],工作表3!C[-4]:C,5,0) -> 战刃 | F156: =VLOOKUP(RC[-5],工作表3!C[-5]:C[-1],4,0) -> 巨型多角虫
A157: 193 | B157: =VLOOKUP(RC[-1],工作表3!C[-1]:C[3],2,0) -> 1 | C157: day | D157: =VLOOKUP(RC[-3],工作表3!C[-3]:C[1],3,0) -> 7 | E157: =VLOOKUP(RC[-4],工作表3!C[-4]:C,5,0) -> 麻痹戒指 | F157: =VLOOKUP(RC[-5],工作表3!C[-5]:C[-1],4,0) -> 巨型多角虫
A158: 194 | B158: =VLOOKUP(RC[-1],工作表3!C[-1]:C[3],2,0) -> 5 | C158: day | D158: =VLOOKUP(RC[-3],工作表3!C[-3]:C[1],3,0) -> 1 | E158: =VLOOKUP(RC[-4],工作表3!C[-4]:C,5,0) -> 上古神石 | F158: =VLOOKUP(RC[-5],工作表3!C[-5]:C[-1],4,0) -> 巨型多角虫
A159: 195 | B159: =VLOOKUP(RC[-1],工作表3!C[-1]:C[3],2,0) -> 1 | C159: day | D159: =VLOOKUP(RC[-3],工作表3!C[-3]:C[1],3,0) -> 1 | E159: =VLOOKUP(RC[-4],工作表3!C[-4]:C,5,0) -> 特面 | F159: =VLOOKUP(RC[-5],工作表3!C[-5]:C[-1],4,0) -> 巨型多角虫
A160: 196 | B160: =VLOOKUP(RC[-1],工作表3!C[-1]:C[3],2,0) -> 1 | C160: day | D160: =VLOOKUP(RC[-3],工作表3!C[-3]:C[1],3,0) -> 1 | E160: =VLOOKUP(RC[-4],工作表3!C[-4]:C,5,0) -> 特腿 | F160: =VLOOKUP(RC[-5],工作表3!C[-5]:C[-1],4,0) -> 巨型多角虫
A161: 197 | B161: =VLOOKUP(RC[-1],工作表3!C[-1]:C[3],2,0) -> 1 | C161: day | D161: =VLOOKUP(RC[-3],工作表3!C[-3]:C[1],3,0) -> 1 | E161: =VLOOKUP(RC[-4],工作表3!C[-4]:C,5,0) -> 特肩 | F161: =VLOOKUP(RC[-5],工作表3!C[-5]:C[-1],4,0) -> 巨型多角虫
A162: 204 | B162: =VLOOKUP(RC[-1],工作表3!C[-1]:C[3],2,0) -> 1 | C162: day | D162: =VLOOKUP(RC[-3],工作表3!C[-3]:C[1],3,0) -> 1 | E162: =VLOOKUP(RC[-4],工作表3!C[-4]:C,5,0) -> 怒斩 | F162: =VLOOKUP(RC[-5],工作表3!C[-5]:C[-1],4,0) -> 巨型多角虫
A163: 205 | B163: =VLOOKUP(RC[-1],工作表3!C[-1]:C[3],2,0) -> 1 | C163: day | D163: =VLOOKUP(RC[-3],工作表3!C[-3]:C[1],3,0) -> 1 | E163: =VLOOKUP(RC[-4],工作表3!C[-4]:C,5,0) -> 至尊屠龙 | F163: =VLOOKUP(RC[-5],工作表3!C[-5]:C[-1],4,0) -> 巨型多角虫
A164: 206 | B164: =VLOOKUP(RC[-1],工作表3!C[-1]:C[3],2,0) -> 20 | C164: day | D164: =VLOOKUP(RC[-3],工作表3!C[-3]:C[1],3,0) -> 1 | E164: =VLOOKUP(RC[-4],工作表3!C[-4]:C,5,0) -> 进阶丹 | F164: =VLOOKUP(RC[-5],工作表3!C[-5]:C[-1],4,0) -> 巨型多角虫
A165: 207 | B165: =VLOOKUP(RC[-1],工作表3!C[-1]:C[3],2,0) -> 1 | C165: day | D165: =VLOOKUP(RC[-3],工作表3!C[-3]:C[1],3,0) -> 1 | E165: =VLOOKUP(RC[-4],工作表3!C[-4]:C,5,0) -> 金刚石 | F165: =VLOOKUP(RC[-5],工作表3!C[-5]:C[-1],4,0) -> 巨型多角虫
A166: 208 | B166: =VLOOKUP(RC[-1],工作表3!C[-1]:C[3],2,0) -> 100 | C166: day | D166: =VLOOKUP(RC[-3],工作表3!C[-3]:C[1],3,0) -> 1 | E166: =VLOOKUP(RC[-4],工作表3!C[-4]:C,5,0) -> 2元宝 | F166: =VLOOKUP(RC[-5],工作表3!C[-5]:C[-1],4,0) -> 巨型多角虫
A167: 209 | B167: =VLOOKUP(RC[-1],工作表3!C[-1]:C[3],2,0) -> 10 | C167: day | D167: =VLOOKUP(RC[-3],工作表3!C[-3]:C[1],3,0) -> 1 | E167: =VLOOKUP(RC[-4],工作表3!C[-4]:C,5,0) -> 5元宝 | F167: =VLOOKUP(RC[-5],工作表3!C[-5]:C[-1],4,0) -> 巨型多角虫
A168: 210 | B168: =VLOOKUP(RC[-1],工作表3!C[-1]:C[3],2,0) -> 10 | C168: day | D168: =VLOOKUP(RC[-3],工作表3!C[-3]:C[1],3,0) -> 1 | E168: =VLOOKUP(RC[-4],工作表3!C[-4]:C,5,0) -> 10元宝 | F168: =VLOOKUP(RC[-5],工作表3!C[-5]:C[-1],4,0) -> 巨型多角虫
A169: 211 | B169: =VLOOKUP(RC[-1],工作表3!C[-1]:C[3],2,0) -> 10 | C169: day | D169: =VLOOKUP(RC[-3],工作表3!C[-3]:C[1],3,0) -> 1 | E169: =VLOOKUP(RC[-4],工作表3!C[-4]:C,5,0) -> 20元宝 | F169: =VLOOKUP(RC[-5],工作表3!C[-5]:C[-1],4,0) -> 巨型多角虫
A170: 212 | B170: =VLOOKUP(RC[-1],工作表3!C[-1]:C[3],2,0) -> 5 | C170: day | D170: =VLOOKUP(RC[-3],工作表3!C[-3]:C[1],3,0) -> 1 | E170: =VLOOKUP(RC[-4],工作表3!C[-4]:C,5,0) -> 50元宝 | F170: =VLOOKUP(RC[-5],工作表3!C[-5]:C[-1],4,0) -> 巨型多角虫
A171: 213 | B171: =VLOOKUP(RC[-1],工作表3!C[-1]:C[3],2,0) -> 6 | C171: day | D171: =VLOOKUP(RC[-3],工作表3!C[-3]:C[1],3,0) -> 1 | E171: =VLOOKUP(RC[-4],工作表3!C[-4]:C,5,0) -> 100元宝 | F171: =VLOOKUP(RC[-5],工作表3!C[-5]:C[-1],4,0) -> 巨型多角虫
A172: 214 | B172: =VLOOKUP(RC[-1],工作表3!C[-1]:C[3],2,0) -> 4 | C172: day | D172: =VLOOKUP(RC[-3],工作表3!C[-3]:C[1],3,0) -> 1 | E172: =VLOOKUP(RC[-4],工作表3!C[-4]:C,5,0) -> 150元宝 | F172: =VLOOKUP(RC[-5],工作表3!C[-5]:C[-1],4,0) -> 巨型多角虫
A173: 215 | B173: =VLOOKUP(RC[-1],工作表3!C[-1]:C[3],2,0) -> 3 | C173: day | D173: =VLOOKUP(RC[-3],工作表3!C[-3]:C[1],3,0) -> 1 | E173: =VLOOKUP(RC[-4],工作表3!C[-4]:C,5,0) -> 200元宝 | F173: =VLOOKUP(RC[-5],工作表3!C[-5]:C[-1],4,0) -> 巨型多角虫
A174: 217 | B174: =VLOOKUP(RC[-1],工作表3!C[-1]:C[3],2,0) -> 1 | C174: day | D174: =VLOOKUP(RC[-3],工作表3!C[-3]:C[1],3,0) -> 1 | E174: =VLOOKUP(RC[-4],工作表3!C[-4]:C,5,0) -> 开天 | F174: =VLOOKUP(RC[-5],工作表3!C[-5]:C[-1],4,0) -> 巨型钳虫
A175: 218 | B175: =VLOOKUP(RC[-1],工作表3!C[-1]:C[3],2,0) -> 1 | C175: day | D175: =VLOOKUP(RC[-3],工作表3!C[-3]:C[1],3,0) -> 1 | E175: =VLOOKUP(RC[-4],工作表3!C[-4]:C,5,0) -> 混沌 | F175: =VLOOKUP(RC[-5],工作表3!C[-5]:C[-1],4,0) -> 巨型钳虫
A176: 219 | B176: =VLOOKUP(RC[-1],工作表3!C[-1]:C[3],2,0) -> 1 | C176: day | D176: =VLOOKUP(RC[-3],工作表3!C[-3]:C[1],3,0) -> 3 | E176: =VLOOKUP(RC[-4],工作表3!C[-4]:C,5,0) -> 战刃 | F176: =VLOOKUP(RC[-5],工作表3!C[-5]:C[-1],4,0) -> 巨型钳虫
A177: 220 | B177: =VLOOKUP(RC[-1],工作表3!C[-1]:C[3],2,0) -> 1 | C177: day | D177: =VLOOKUP(RC[-3],工作表3!C[-3]:C[1],3,0) -> 7 | E177: =VLOOKUP(RC[-4],工作表3!C[-4]:C,5,0) -> 麻痹戒指 | F177: =VLOOKUP(RC[-5],工作表3!C[-5]:C[-1],4,0) -> 巨型钳虫
A178: 221 | B178: =VLOOKUP(RC[-1],工作表3!C[-1]:C[3],2,0) -> 5 | C178: day | D178: =VLOOKUP(RC[-3],工作表3!C[-3]:C[1],3,0) -> 1 | E178: =VLOOKUP(RC[-4],工作表3!C[-4]:C,5,0) -> 上古神石 | F178: =VLOOKUP(RC[-5],工作表3!C[-5]:C[-1],4,0) -> 巨型钳虫
A179: 222 | B179: =VLOOKUP(RC[-1],工作表3!C[-1]:C[3],2,0) -> 1 | C179: day | D179: =VLOOKUP(RC[-3],工作表3!C[-3]:C[1],3,0) -> 1 | E179: =VLOOKUP(RC[-4],工作表3!C[-4]:C,5,0) -> 特面 | F179: =VLOOKUP(RC[-5],工作表3!C[-5]:C[-1],4,0) -> 巨型钳虫
A180: 223 | B180: =VLOOKUP(RC[-1],工作表3!C[-1]:C[3],2,0) -> 1 | C180: day | D180: =VLOOKUP(RC[-3],工作表3!C[-3]:C[1],3,0) -> 1 | E180: =VLOOKUP(RC[-4],工作表3!C[-4]:C,5,0) -> 特腿 | F180: =VLOOKUP(RC[-5],工作表3!C[-5]:C[-1],4,0) -> 巨型钳虫
A181: 224 | B181: =VLOOKUP(RC[-1],工作表3!C[-1]:C[3],2,0) -> 1 | C181: day | D181: =VLOOKUP(RC[-3],工作表3!C[-3]:C[1],3,0) -> 1 | E181: =VLOOKUP(RC[-4],工作表3!C[-4]:C,5,0) -> 特肩 | F181: =VLOOKUP(RC[-5],工作表3!C[-5]:C[-1],4,0) -> 巨型钳虫
A182: 231 | B182: =VLOOKUP(RC[-1],工作表3!C[-1]:C[3],2,0) -> 1 | C182: day | D182: =VLOOKUP(RC[-3],工作表3!C[-3]:C[1],3,0) -> 1 | E182: =VLOOKUP(RC[-4],工作表3!C[-4]:C,5,0) -> 怒斩 | F182: =VLOOKUP(RC[-5],工作表3!C[-5]:C[-1],4,0) -> 巨型钳虫
A183: 232 | B183: =VLOOKUP(RC[-1],工作表3!C[-1]:C[3],2,0) -> 1 | C183: day | D183: =VLOOKUP(RC[-3],工作表3!C[-3]:C[1],3,0) -> 1 | E183: =VLOOKUP(RC[-4],工作表3!C[-4]:C,5,0) -> 至尊屠龙 | F183: =VLOOKUP(RC[-5],工作表3!C[-5]:C[-1],4,0) -> 巨型钳虫
A184: 233 | B184: =VLOOKUP(RC[-1],工作表3!C[-1]:C[3],2,0) -> 20 | C184: day | D184: =VLOOKUP(RC[-3],工作表3!C[-3]:C[1],3,0) -> 1 | E184: =VLOOKUP(RC[-4],工作表3!C[-4]:C,5,0) -> 进阶丹 | F184: =VLOOKUP(RC[-5],工作表3!C[-5]:C[-1],4,0) -> 巨型钳虫
A185: 234 | B185: =VLOOKUP(RC[-1],工作表3!C[-1]:C[3],2,0) -> 1 | C185: day | D185: =VLOOKUP(RC[-3],工作表3!C[-3]:C[1],3,0) -> 1 | E185: =VLOOKUP(RC[-4],工作表3!C[-4]:C,5,0) -> 金刚石 | F185: =VLOOKUP(RC[-5],工作表3!C[-5]:C[-1],4,0) -> 巨型钳虫
A186: 235 | B186: =VLOOKUP(RC[-1],工作表3!C[-1]:C[3],2,0) -> 100 | C186: day | D186: =VLOOKUP(RC[-3],工作表3!C[-3]:C[1],3,0) -> 1 | E186: =VLOOKUP(RC[-4],工作表3!C[-4]:C,5,0) -> 2元宝 | F186: =VLOOKUP(RC[-5],工作表3!C[-5]:C[-1],4,0) -> 巨型钳虫
A187: 236 | B187: =VLOOKUP(RC[-1],工作表3!C[-1]:C[3],2,0) -> 10 | C187: day | D187: =VLOOKUP(RC[-3],工作表3!C[-3]:C[1],3,0) -> 1 | E187: =VLOOKUP(RC[-4],工作表3!C[-4]:C,5,0) -> 5元宝 | F187: =VLOOKUP(RC[-5],工作表3!C[-5]:C[-1],4,0) -> 巨型钳虫
A188: 237 | B188: =VLOOKUP(RC[-1],工作表3!C[-1]:C[3],2,0) -> 10 | C188: day | D188: =VLOOKUP(RC[-3],工作表3!C[-3]:C[1],3,0) -> 1 | E188: =VLOOKUP(RC[-4],工作表3!C[-4]:C,5,0) -> 10元宝 | F188: =VLOOKUP(RC[-5],工作表3!C[-5]:C[-1],4,0) -> 巨型钳虫
A189: 238 | B189: =VLOOKUP(RC[-1],工作表3!C[-1]:C[3],2,0) -> 10 | C189: day | D189: =VLOOKUP(RC[-3],工作表3!C[-3]:C[1],3,0) -> 1 | E189: =VLOOKUP(RC[-4],工作表3!C[-4]:C,5,0) -> 20元宝 | F189: =VLOOKUP(RC[-5],工作表3!C[-5]:C[-1],4,0) -> 巨型钳虫
A190: 239 | B190: =VLOOKUP(RC[-1],工作表3!C[-1]:C[3],2,0) -> 5 | C190: day | D190: =VLOOKUP(RC[-3],工作表3!C[-3]:C[1],3,0) -> 1 | E190: =VLOOKUP(RC[-4],工作表3!C[-4]:C,5,0) -> 50元宝 | F190: =VLOOKUP(RC[-5],工作表3!C[-5]:C[-1],4,0) -> 巨型钳虫
A191: 240 | B191: =VLOOKUP(RC[-1],工作表3!C[-1]:C[3],2,0) -> 6 | C191: day | D191: =VLOOKUP(RC[-3],工作表3!C[-3]:C[1],3,0) -> 1 | E191: =VLOOKUP(RC[-4],工作表3!C[-4]:C,5,0) -> 100元宝 | F191: =VLOOKUP(RC[-5],工作表3!C[-5]:C[-1],4,0) -> 巨型钳虫
A192: 241 | B192: =VLOOKUP(RC[-1],工作表3!C[-1]:C[3],2,0) -> 4 | C192: day | D192: =VLOOKUP(RC[-3],工作表3!C[-3]:C[1],3,0) -> 1 | E192: =VLOOKUP(RC[-4],工作表3!C[-4]:C,5,0) -> 150元宝 | F192: =VLOOKUP(RC[-5],工作表3!C[-5]:C[-1],4,0) -> 巨型钳虫
A193: 242 | B193: =VLOOKUP(RC[-1],工作表3!C[-1]:C[3],2,0) -> 3 | C193: day | D193: =VLOOKUP(RC[-3],工作表3!C[-3]:C[1],3,0) -> 1 | E193: =VLOOKUP(RC[-4],工作表3!C[-4]:C,5,0) -> 200元宝 | F193: =VLOOKUP(RC[-5],工作表3!C[-5]:C[-1],4,0) -> 巨型钳虫
A194: 244 | B194: =VLOOKUP(RC[-1],工作表3!C[-1]:C[3],2,0) -> 3 | C194: day | D194: =VLOOKUP(RC[-3],工作表3!C[-3]:C[1],3,0) -> 1 | E194: =VLOOKUP(RC[-4],工作表3!C[-4]:C,5,0) -> 开天 | F194: =VLOOKUP(RC[-5],工作表3!C[-5]:C[-1],4,0) -> 巨型双头恶魔
A195: 246 | B195: =VLOOKUP(RC[-1],工作表3!C[-1]:C[3],2,0) -> 1 | C195: day | D195: =VLOOKUP(RC[-3],工作表3!C[-3]:C[1],3,0) -> 3 | E195: =VLOOKUP(RC[-4],工作表3!C[-4]:C,5,0) -> 战刃 | F195: =VLOOKUP(RC[-5],工作表3!C[-5]:C[-1],4,0) -> 巨型双头恶魔
A196: 247 | B196: =VLOOKUP(RC[-1],工作表3!C[-1]:C[3],2,0) -> 1 | C196: day | D196: =VLOOKUP(RC[-3],工作表3!C[-3]:C[1],3,0) -> 7 | E196: =VLOOKUP(RC[-4],工作表3!C[-4]:C,5,0) -> 麻痹戒指 | F196: =VLOOKUP(RC[-5],工作表3!C[-5]:C[-1],4,0) -> 巨型双头恶魔
A197: 248 | B197: =VLOOKUP(RC[-1],工作表3!C[-1]:C[3],2,0) -> 5 | C197: day | D197: =VLOOKUP(RC[-3],工作表3!C[-3]:C[1],3,0) -> 1 | E197: =VLOOKUP(RC[-4],工作表3!C[-4]:C,5,0) -> 上古神石 | F197: =VLOOKUP(RC[-5],工作表3!C[-5]:C[-1],4,0) -> 巨型双头恶魔
A198: 249 | B198: =VLOOKUP(RC[-1],工作表3!C[-1]:C[3],2,0) -> 1 | C198: day | D198: =VLOOKUP(RC[-3],工作表3!C[-3]:C[1],3,0) -> 1 | E198: =VLOOKUP(RC[-4],工作表3!C[-4]:C,5,0) -> 特面 | F198: =VLOOKUP(RC[-5],工作表3!C[-5]:C[-1],4,0) -> 巨型双头恶魔
A199: 250 | B199: =VLOOKUP(RC[-1],工作表3!C[-1]:C[3],2,0) -> 1 | C199: day | D199: =VLOOKUP(RC[-3],工作表3!C[-3]:C[1],3,0) -> 1 | E199: =VLOOKUP(RC[-4],工作表3!C[-4]:C,5,0) -> 特腿 | F199: =VLOOKUP(RC[-5],工作表3!C[-5]:C[-1],4,0) -> 巨型双头恶魔
A200: 251 | B200: =VLOOKUP(RC[-1],工作表3!C[-1]:C[3],2,0) -> 1 | C200: day | D200: =VLOOKUP(RC[-3],工作表3!C[-3]:C[1],3,0) -> 1 | E200: =VLOOKUP(RC[-4],工作表3!C[-4]:C,5,0) -> 特肩 | F200: =VLOOKUP(RC[-5],工作表3!C[-5]:C[-1],4,0) -> 巨型双头恶魔
A201: 258 | B201: =VLOOKUP(RC[-1],工作表3!C[-1]:C[3],2,0) -> 1 | C201: day | D201: =VLOOKUP(RC[-3],工作表3!C[-3]:C[1],3,0) -> 1 | E201: =VLOOKUP(RC[-4],工作表3!C[-4]:C,5,0) -> 怒斩 | F201: =VLOOKUP(RC[-5],工作表3!C[-5]:C[-1],4,0) -> 巨型双头恶魔
A202: 259 | B202: =VLOOKUP(RC[-1],工作表3!C[-1]:C[3],2,0) -> 1 | C202: day | D202: =VLOOKUP(RC[-3],工作表3!C[-3]:C[1],3,0) -> 1 | E202: =VLOOKUP(RC[-4],工作表3!C[-4]:C,5,0) -> 至尊屠龙 | F202: =VLOOKUP(RC[-5],工作表3!C[-5]:C[-1],4,0) -> 巨型双头恶魔
A203: 260 | B203: =VLOOKUP(RC[-1],工作表3!C[-1]:C[3],2,0) -> 20 | C203: day | D203: =VLOOKUP(RC[-3],工作表3!C[-3]:C[1],3,0) -> 1 | E203: =VLOOKUP(RC[-4],工作表3!C[-4]:C,5,0) -> 进阶丹 | F203: =VLOOKUP(RC[-5],工作表3!C[-5]:C[-1],4,0) -> 巨型双头恶魔
A204: 261 | B204: =VLOOKUP(RC[-1],工作表3!C[-1]:C[3],2,0) -> 6 | C204: day | D204: =VLOOKUP(RC[-3],工作表3!C[-3]:C[1],3,0) -> 1 | E204: =VLOOKUP(RC[-4],工作表3!C[-4]:C,5,0) -> 金刚石 | F204: =VLOOKUP(RC[-5],工作表3!C[-5]:C[-1],4,0) -> 巨型双头恶魔
A205: 262 | B205: =VLOOKUP(RC[-1],工作表3!C[-1]:C[3],2,0) -> 100 | C205: day | D205: =VLOOKUP(RC[-3],工作表3!C[-3]:C[1],3,0) -> 1 | E205: =VLOOKUP(RC[-4],工作表3!C[-4]:C,5,0) -> 2元宝 | F205: =VLOOKUP(RC[-5],工作表3!C[-5]:C[-1],4,0) -> 巨型双头恶魔
A206: 263 | B206: =VLOOKUP(RC[-1],工作表3!C[-1]:C[3],2,0) -> 10 | C206: day | D206: =VLOOKUP(RC[-3],工作表3!C[-3]:C[1],3,0) -> 1 | E206: =VLOOKUP(RC[-4],工作表3!C[-4]:C,5,0) -> 5元宝 | F206: =VLOOKUP(RC[-5],工作表3!C[-5]:C[-1],4,0) -> 巨型双头恶魔
A207: 264 | B207: =VLOOKUP(RC[-1],工作表3!C[-1]:C[3],2,0) -> 10 | C207: day | D207: =VLOOKUP(RC[-3],工作表3!C[-3]:C[1],3,0) -> 1 | E207: =VLOOKUP(RC[-4],工作表3!C[-4]:C,5,0) -> 10元宝 | F207: =VLOOKUP(RC[-5],工作表3!C[-5]:C[-1],4,0) -> 巨型双头恶魔
A208: 265 | B208: =VLOOKUP(RC[-1],工作表3!C[-1]:C[3],2,0) -> 10 | C208: day | D208: =VLOOKUP(RC[-3],工作表3!C[-3]:C[1],3,0) -> 1 | E208: =VLOOKUP(RC[-4],工作表3!C[-4]:C,5,0) -> 20元宝 | F208: =VLOOKUP(RC[-5],工作表3!C[-5]:C[-1],4,0) -> 巨型双头恶魔
A209: 266 | B209: =VLOOKUP(RC[-1],工作表3!C[-1]:C[3],2,0) -> 4 | C209: day | D209: =VLOOKUP(RC[-3],工作表3!C[-3]:C[1],3,0) -> 1 | E209: =VLOOKUP(RC[-4],工作表3!C[-4]:C,5,0) -> 50元宝 | F209: =VLOOKUP(RC[-5],工作表3!C[-5]:C[-1],4,0) -> 巨型双头恶魔
A210: 267 | B210: =VLOOKUP(RC[-1],工作表3!C[-1]:C[3],2,0) -> 6 | C210: day | D210: =VLOOKUP(RC[-3],工作表3!C[-3]:C[1],3,0) -> 1 | E210: =VLOOKUP(RC[-4],工作表3!C[-4]:C,5,0) -> 100元宝 | F210: =VLOOKUP(RC[-5],工作表3!C[-5]:C[-1],4,0) -> 巨型双头恶魔
A211: 268 | B211: =VLOOKUP(RC[-1],工作表3!C[-1]:C[3],2,0) -> 4 | C211: day | D211: =VLOOKUP(RC[-3],工作表3!C[-3]:C[1],3,0) -> 1 | E211: =VLOOKUP(RC[-4],工作表3!C[-4]:C,5,0) -> 150元宝 | F211: =VLOOKUP(RC[-5],工作表3!C[-5]:C[-1],4,0) -> 巨型双头恶魔
A212: 269 | B212: =VLOOKUP(RC[-1],工作表3!C[-1]:C[3],2,0) -> 3 | C212: day | D212: =VLOOKUP(RC[-3],工作表3!C[-3]:C[1],3,0) -> 1 | E212: =VLOOKUP(RC[-4],工作表3!C[-4]:C,5,0) -> 200元宝 | F212: =VLOOKUP(RC[-5],工作表3!C[-5]:C[-1],4,0) -> 巨型双头恶魔
A213: 271 | B213: =VLOOKUP(RC[-1],工作表3!C[-1]:C[3],2,0) -> 8 | C213: day | D213: =VLOOKUP(RC[-3],工作表3!C[-3]:C[1],3,0) -> 1 | E213: =VLOOKUP(RC[-4],工作表3!C[-4]:C,5,0) -> 开天 | F213: =VLOOKUP(RC[-5],工作表3!C[-5]:C[-1],4,0) -> 海底BOSS1
A214: 272 | B214: =VLOOKUP(RC[-1],工作表3!C[-1]:C[3],2,0) -> 1 | C214: day | D214: =VLOOKUP(RC[-3],工作表3!C[-3]:C[1],3,0) -> 1 | E214: =VLOOKUP(RC[-4],工作表3!C[-4]:C,5,0) -> 混沌 | F214: =VLOOKUP(RC[-5],工作表3!C[-5]:C[-1],4,0) -> 海底BOSS1
A215: 273 | B215: =VLOOKUP(RC[-1],工作表3!C[-1]:C[3],2,0) -> 1 | C215: day | D215: =VLOOKUP(RC[-3],工作表3!C[-3]:C[1],3,0) -> 3 | E215: =VLOOKUP(RC[-4],工作表3!C[-4]:C,5,0) -> 战刃 | F215: =VLOOKUP(RC[-5],工作表3!C[-5]:C[-1],4,0) -> 海底BOSS1
A216: 275 | B216: 8 | C216: day | D216: =VLOOKUP(RC[-3],工作表3!C[-3]:C[1],3,0) -> 1 | E216: =VLOOKUP(RC[-4],工作表3!C[-4]:C,5,0) -> 上古神石 | F216: =VLOOKUP(RC[-5],工作表3!C[-5]:C[-1],4,0) -> 海底BOSS1
A217: 276 | B217: =VLOOKUP(RC[-1],工作表3!C[-1]:C[3],2,0) -> 1 | C217: day | D217: =VLOOKUP(RC[-3],工作表3!C[-3]:C[1],3,0) -> 1 | E217: =VLOOKUP(RC[-4],工作表3!C[-4]:C,5,0) -> 特面 | F217: =VLOOKUP(RC[-5],工作表3!C[-5]:C[-1],4,0) -> 海底BOSS1
A218: 277 | B218: =VLOOKUP(RC[-1],工作表3!C[-1]:C[3],2,0) -> 1 | C218: day | D218: =VLOOKUP(RC[-3],工作表3!C[-3]:C[1],3,0) -> 1 | E218: =VLOOKUP(RC[-4],工作表3!C[-4]:C,5,0) -> 特腿 | F218: =VLOOKUP(RC[-5],工作表3!C[-5]:C[-1],4,0) -> 海底BOSS1
A219: 278 | B219: =VLOOKUP(RC[-1],工作表3!C[-1]:C[3],2,0) -> 1 | C219: day | D219: =VLOOKUP(RC[-3],工作表3!C[-3]:C[1],3,0) -> 1 | E219: =VLOOKUP(RC[-4],工作表3!C[-4]:C,5,0) -> 特肩 | F219: =VLOOKUP(RC[-5],工作表3!C[-5]:C[-1],4,0) -> 海底BOSS1
A220: 285 | B220: =VLOOKUP(RC[-1],工作表3!C[-1]:C[3],2,0) -> 1 | C220: day | D220: =VLOOKUP(RC[-3],工作表3!C[-3]:C[1],3,0) -> 1 | E220: =VLOOKUP(RC[-4],工作表3!C[-4]:C,5,0) -> 怒斩 | F220: =VLOOKUP(RC[-5],工作表3!C[-5]:C[-1],4,0) -> 海底BOSS1
A221: 286 | B221: =VLOOKUP(RC[-1],工作表3!C[-1]:C[3],2,0) -> 1 | C221: day | D221: =VLOOKUP(RC[-3],工作表3!C[-3]:C[1],3,0) -> 1 | E221: =VLOOKUP(RC[-4],工作表3!C[-4]:C,5,0) -> 至尊屠龙 | F221: =VLOOKUP(RC[-5],工作表3!C[-5]:C[-1],4,0) -> 海底BOSS1
A222: 287 | B222: 20 | C222: day | D222: =VLOOKUP(RC[-3],工作表3!C[-3]:C[1],3,0) -> 1 | E222: =VLOOKUP(RC[-4],工作表3!C[-4]:C,5,0) -> 进阶丹 | F222: =VLOOKUP(RC[-5],工作表3!C[-5]:C[-1],4,0) -> 海底BOSS1
A223: 288 | B223: =VLOOKUP(RC[-1],工作表3!C[-1]:C[3],2,0) -> 8 | C223: day | D223: =VLOOKUP(RC[-3],工作表3!C[-3]:C[1],3,0) -> 1 | E223: =VLOOKUP(RC[-4],工作表3!C[-4]:C,5,0) -> 金刚石 | F223: =VLOOKUP(RC[-5],工作表3!C[-5]:C[-1],4,0) -> 海底BOSS1
A224: 289 | B224: =VLOOKUP(RC[-1],工作表3!C[-1]:C[3],2,0) -> 100 | C224: day | D224: =VLOOKUP(RC[-3],工作表3!C[-3]:C[1],3,0) -> 1 | E224: =VLOOKUP(RC[-4],工作表3!C[-4]:C,5,0) -> 2元宝 | F224: =VLOOKUP(RC[-5],工作表3!C[-5]:C[-1],4,0) -> 海底BOSS1
A225: 290 | B225: =VLOOKUP(RC[-1],工作表3!C[-1]:C[3],2,0) -> 10 | C225: day | D225: =VLOOKUP(RC[-3],工作表3!C[-3]:C[1],3,0) -> 1 | E225: =VLOOKUP(RC[-4],工作表3!C[-4]:C,5,0) -> 5元宝 | F225: =VLOOKUP(RC[-5],工作表3!C[-5]:C[-1],4,0) -> 海底BOSS1
A226: 291 | B226: =VLOOKUP(RC[-1],工作表3!C[-1]:C[3],2,0) -> 10 | C226: day | D226: =VLOOKUP(RC[-3],工作表3!C[-3]:C[1],3,0) -> 1 | E226: =VLOOKUP(RC[-4],工作表3!C[-4]:C,5,0) -> 10元宝 | F226: =VLOOKUP(RC[-5],工作表3!C[-5]:C[-1],4,0) -> 海底BOSS1
A227: 292 | B227: =VLOOKUP(RC[-1],工作表3!C[-1]:C[3],2,0) -> 10 | C227: day | D227: =VLOOKUP(RC[-3],工作表3!C[-3]:C[1],3,0) -> 1 | E227: =VLOOKUP(RC[-4],工作表3!C[-4]:C,5,0) -> 20元宝 | F227: =VLOOKUP(RC[-5],工作表3!C[-5]:C[-1],4,0) -> 海底BOSS1
A228: 293 | B228: =VLOOKUP(RC[-1],工作表3!C[-1]:C[3],2,0) -> 5 | C228: day | D228: =VLOOKUP(RC[-3],工作表3!C[-3]:C[1],3,0) -> 1 | E228: =VLOOKUP(RC[-4],工作表3!C[-4]:C,5,0) -> 50元宝 | F228: =VLOOKUP(RC[-5],工作表3!C[-5]:C[-1],4,0) -> 海底BOSS1
A229: 294 | B229: =VLOOKUP(RC[-1],工作表3!C[-1]:C[3],2,0) -> 6 | C229: day | D229: =VLOOKUP(RC[-3],工作表3!C[-3]:C[1],3,0) -> 1 | E229: =VLOOKUP(RC[-4],工作表3!C[-4]:C,5,0) -> 100元宝 | F229: =VLOOKUP(RC[-5],工作表3!C[-5]:C[-1],4,0) -> 海底BOSS1
A230: 295 | B230: =VLOOKUP(RC[-1],工作表3!C[-1]:C[3],2,0) -> 6 | C230: day | D230: =VLOOKUP(RC[-3],工作表3!C[-3]:C[1],3,0) -> 1 | E230: =VLOOKUP(RC[-4],工作表3!C[-4]:C,5,0) -> 150元宝 | F230: =VLOOKUP(RC[-5],工作表3!C[-5]:C[-1],4,0) -> 海底BOSS1
A231: 296 | B231: =VLOOKUP(RC[-1],工作表3!C[-1]:C[3],2,0) -> 3 | C231: day | D231: =VLOOKUP(RC[-3],工作表3!C[-3]:C[1],3,0) -> 1 | E231: =VLOOKUP(RC[-4],工作表3!C[-4]:C,5,0) -> 200元宝 | F231: =VLOOKUP(RC[-5],工作表3!C[-5]:C[-1],4,0) -> 海底BOSS1
A232: 298 | B232: =VLOOKUP(RC[-1],工作表3!C[-1]:C[3],2,0) -> 6 | C232: day | D232: =VLOOKUP(RC[-3],工作表3!C[-3]:C[1],3,0) -> 1 | E232: =VLOOKUP(RC[-4],工作表3!C[-4]:C,5,0) -> 开天 | F232: =VLOOKUP(RC[-5],工作表3!C[-5]:C[-1],4,0) -> 海底BOSS2
A233: 299 | B233: =VLOOKUP(RC[-1],工作表3!C[-1]:C[3],2,0) -> 1 | C233: day | D233: =VLOOKUP(RC[-3],工作表3!C[-3]:C[1],3,0) -> 1 | E233: =VLOOKUP(RC[-4],工作表3!C[-4]:C,5,0) -> 混沌 | F233: =VLOOKUP(RC[-5],工作表3!C[-5]:C[-1],4,0) -> 海底BOSS2
A234: 300 | B234: =VLOOKUP(RC[-1],工作表3!C[-1]:C[3],2,0) -> 1 | C234: day | D234: =VLOOKUP(RC[-3],工作表3!C[-3]:C[1],3,0) -> 3 | E234: =VLOOKUP(RC[-4],工作表3!C[-4]:C,5,0) -> 战刃 | F234: =VLOOKUP(RC[-5],工作表3!C[-5]:C[-1],4,0) -> 海底BOSS2
A235: 302 | B235: 12 | C235: day | D235: =VLOOKUP(RC[-3],工作表3!C[-3]:C[1],3,0) -> 1 | E235: =VLOOKUP(RC[-4],工作表3!C[-4]:C,5,0) -> 上古神石 | F235: =VLOOKUP(RC[-5],工作表3!C[-5]:C[-1],4,0) -> 海底BOSS2
A236: 303 | B236: =VLOOKUP(RC[-1],工作表3!C[-1]:C[3],2,0) -> 1 | C236: day | D236: =VLOOKUP(RC[-3],工作表3!C[-3]:C[1],3,0) -> 1 | E236: =VLOOKUP(RC[-4],工作表3!C[-4]:C,5,0) -> 特面 | F236: =VLOOKUP(RC[-5],工作表3!C[-5]:C[-1],4,0) -> 海底BOSS2
A237: 304 | B237: =VLOOKUP(RC[-1],工作表3!C[-1]:C[3],2,0) -> 1 | C237: day | D237: =VLOOKUP(RC[-3],工作表3!C[-3]:C[1],3,0) -> 1 | E237: =VLOOKUP(RC[-4],工作表3!C[-4]:C,5,0) -> 特腿 | F237: =VLOOKUP(RC[-5],工作表3!C[-5]:C[-1],4,0) -> 海底BOSS2
A238: 305 | B238: =VLOOKUP(RC[-1],工作表3!C[-1]:C[3],2,0) -> 1 | C238: day | D238: =VLOOKUP(RC[-3],工作表3!C[-3]:C[1],3,0) -> 1 | E238: =VLOOKUP(RC[-4],工作表3!C[-4]:C,5,0) -> 特肩 | F238: =VLOOKUP(RC[-5],工作表3!C[-5]:C[-1],4,0) -> 海底BOSS2
A239: 312 | B239: =VLOOKUP(RC[-1],工作表3!C[-1]:C[3],2,0) -> 1 | C239: day | D239: =VLOOKUP(RC[-3],工作表3!C[-3]:C[1],3,0) -> 1 | E239: =VLOOKUP(RC[-4],工作表3!C[-4]:C,5,0) -> 怒斩 | F239: =VLOOKUP(RC[-5],工作表3!C[-5]:C[-1],4,0) -> 海底BOSS2
A240: 313 | B240: =VLOOKUP(RC[-1],工作表3!C[-1]:C[3],2,0) -> 1 | C240: day | D240: =VLOOKUP(RC[-3],工作表3!C[-3]:C[1],3,0) -> 1 | E240: =VLOOKUP(RC[-4],工作表3!C[-4]:C,5,0) -> 至尊屠龙 | F240: =VLOOKUP(RC[-5],工作表3!C[-5]:C[-1],4,0) -> 海底BOSS2
A241: 314 | B241: =VLOOKUP(RC[-1],工作表3!C[-1]:C[3],2,0) -> 20 | C241: day | D241: =VLOOKUP(RC[-3],工作表3!C[-3]:C[1],3,0) -> 1 | E241: =VLOOKUP(RC[-4],工作表3!C[-4]:C,5,0) -> 进阶丹 | F241: =VLOOKUP(RC[-5],工作表3!C[-5]:C[-1],4,0) -> 海底BOSS2
A242: 315 | B242: =VLOOKUP(RC[-1],工作表3!C[-1]:C[3],2,0) -> 6 | C242: day | D242: =VLOOKUP(RC[-3],工作表3!C[-3]:C[1],3,0) -> 1 | E242: =VLOOKUP(RC[-4],工作表3!C[-4]:C,5,0) -> 金刚石 | F242: =VLOOKUP(RC[-5],工作表3!C[-5]:C[-1],4,0) -> 海底BOSS2
A243: 316 | B243: =VLOOKUP(RC[-1],工作表3!C[-1]:C[3],2,0) -> 100 | C243: day | D243: =VLOOKUP(RC[-3],工作表3!C[-3]:C[1],3,0) -> 1 | E243: =VLOOKUP(RC[-4],工作表3!C[-4]:C,5,0) -> 2元宝 | F243: =VLOOKUP(RC[-5],工作表3!C[-5]:C[-1],4,0) -> 海底BOSS2
A244: 317 | B244: =VLOOKUP(RC[-1],工作表3!C[-1]:C[3],2,0) -> 10 | C244: day | D244: =VLOOKUP(RC[-3],工作表3!C[-3]:C[1],3,0) -> 1 | E244: =VLOOKUP(RC[-4],工作表3!C[-4]:C,5,0) -> 5元宝 | F244: =VLOOKUP(RC[-5],工作表3!C[-5]:C[-1],4,0) -> 海底BOSS2
A245: 318 | B245: =VLOOKUP(RC[-1],工作表3!C[-1]:C[3],2,0) -> 10 | C245: day | D245: =VLOOKUP(RC[-3],工作表3!C[-3]:C[1],3,0) -> 1 | E245: =VLOOKUP(RC[-4],工作表3!C[-4]:C,5,0) -> 10元宝 | F245: =VLOOKUP(RC[-5],工作表3!C[-5]:C[-1],4,0) -> 海底BOSS2
A246: 319 | B246: =VLOOKUP(RC[-1],工作表3!C[-1]:C[3],2,0) -> 10 | C246: day | D246: =VLOOKUP(RC[-3],工作表3!C[-3]:C[1],3,0) -> 1 | E246: =VLOOKUP(RC[-4],工作表3!C[-4]:C,5,0) -> 20元宝 | F246: =VLOOKUP(RC[-5],工作表3!C[-5]:C[-1],4,0) -> 海底BOSS2
A247: 320 | B247: =VLOOKUP(RC[-1],工作表3!C[-1]:C[3],2,0) -> 5 | C247: day | D247: =VLOOKUP(RC[-3],工作表3!C[-3]:C[1],3,0) -> 1 | E247: =VLOOKUP(RC[-4],工作表3!C[-4]:C,5,0) -> 50元宝 | F247: =VLOOKUP(RC[-5],工作表3!C[-5]:C[-1],4,0) -> 海底BOSS2
A248: 321 | B248: =VLOOKUP(RC[-1],工作表3!C[-1]:C[3],2,0) -> 6 | C248: day | D248: =VLOOKUP(RC[-3],工作表3!C[-3]:C[1],3,0) -> 1 | E248: =VLOOKUP(RC[-4],工作表3!C[-4]:C,5,0) -> 100元宝 | F248: =VLOOKUP(RC[-5],工作表3!C[-5]:C[-1],4,0) -> 海底BOSS2
A249: 322 | B249: =VLOOKUP(RC[-1],工作表3!C[-1]:C[3],2,0) -> 6 | C249: day | D249: =VLOOKUP(RC[-3],工作表3!C[-3]:C[1],3,0) -> 1 | E249: =VLOOKUP(RC[-4],工作表3!C[-4]:C,5,0) -> 150元宝 | F249: =VLOOKUP(RC[-5],工作表3!C[-5]:C[-1],4,0) -> 海底BOSS2
A250: 323 | B250: =VLOOKUP(RC[-1],工作表3!C[-1]:C[3],2,0) -> 3 | C250: day | D250: =VLOOKUP(RC[-3],工作表3!C[-3]:C[1],3,0) -> 1 | E250: =VLOOKUP(RC[-4],工作表3!C[-4]:C,5,0) -> 200元宝 | F250: =VLOOKUP(RC[-5],工作表3!C[-5]:C[-1],4,0) -> 海底BOSS2
A251: 325 | B251: 6 | C251: day | D251: =VLOOKUP(RC[-3],工作表3!C[-3]:C[1],3,0) -> 1 | E251: =VLOOKUP(RC[-4],工作表3!C[-4]:C,5,0) -> 开天 | F251: =VLOOKUP(RC[-5],工作表3!C[-5]:C[-1],4,0) -> 牛魔BOSS1
A252: 326 | B252: =VLOOKUP(RC[-1],工作表3!C[-1]:C[3],2,0) -> 1 | C252: day | D252: =VLOOKUP(RC[-3],工作表3!C[-3]:C[1],3,0) -> 1 | E252: =VLOOKUP(RC[-4],工作表3!C[-4]:C,5,0) -> 混沌 | F252: =VLOOKUP(RC[-5],工作表3!C[-5]:C[-1],4,0) -> 牛魔BOSS1
A253: 327 | B253: =VLOOKUP(RC[-1],工作表3!C[-1]:C[3],2,0) -> 1 | C253: day | D253: =VLOOKUP(RC[-3],工作表3!C[-3]:C[1],3,0) -> 3 | E253: =VLOOKUP(RC[-4],工作表3!C[-4]:C,5,0) -> 战刃 | F253: =VLOOKUP(RC[-5],工作表3!C[-5]:C[-1],4,0) -> 牛魔BOSS1
A254: 329 | B254: 6 | C254: day | D254: =VLOOKUP(RC[-3],工作表3!C[-3]:C[1],3,0) -> 1 | E254: =VLOOKUP(RC[-4],工作表3!C[-4]:C,5,0) -> 上古神石 | F254: =VLOOKUP(RC[-5],工作表3!C[-5]:C[-1],4,0) -> 牛魔BOSS1
A255: 330 | B255: =VLOOKUP(RC[-1],工作表3!C[-1]:C[3],2,0) -> 1 | C255: day | D255: =VLOOKUP(RC[-3],工作表3!C[-3]:C[1],3,0) -> 1 | E255: =VLOOKUP(RC[-4],工作表3!C[-4]:C,5,0) -> 特面 | F255: =VLOOKUP(RC[-5],工作表3!C[-5]:C[-1],4,0) -> 牛魔BOSS1
A256: 331 | B256: =VLOOKUP(RC[-1],工作表3!C[-1]:C[3],2,0) -> 1 | C256: day | D256: =VLOOKUP(RC[-3],工作表3!C[-3]:C[1],3,0) -> 1 | E256: =VLOOKUP(RC[-4],工作表3!C[-4]:C,5,0) -> 特腿 | F256: =VLOOKUP(RC[-5],工作表3!C[-5]:C[-1],4,0) -> 牛魔BOSS1
A257: 332 | B257: =VLOOKUP(RC[-1],工作表3!C[-1]:C[3],2,0) -> 1 | C257: day | D257: =VLOOKUP(RC[-3],工作表3!C[-3]:C[1],3,0) -> 1 | E257: =VLOOKUP(RC[-4],工作表3!C[-4]:C,5,0) -> 特肩 | F257: =VLOOKUP(RC[-5],工作表3!C[-5]:C[-1],4,0) -> 牛魔BOSS1
A258: 339 | B258: =VLOOKUP(RC[-1],工作表3!C[-1]:C[3],2,0) -> 1 | C258: day | D258: =VLOOKUP(RC[-3],工作表3!C[-3]:C[1],3,0) -> 1 | E258: =VLOOKUP(RC[-4],工作表3!C[-4]:C,5,0) -> 怒斩 | F258: =VLOOKUP(RC[-5],工作表3!C[-5]:C[-1],4,0) -> 牛魔BOSS1
A259: 340 | B259: =VLOOKUP(RC[-1],工作表3!C[-1]:C[3],2,0) -> 1 | C259: day | D259: =VLOOKUP(RC[-3],工作表3!C[-3]:C[1],3,0) -> 1 | E259: =VLOOKUP(RC[-4],工作表3!C[-4]:C,5,0) -> 至尊屠龙 | F259: =VLOOKUP(RC[-5],工作表3!C[-5]:C[-1],4,0) -> 牛魔BOSS1
A260: 341 | B260: =VLOOKUP(RC[-1],工作表3!C[-1]:C[3],2,0) -> 20 | C260: day | D260: =VLOOKUP(RC[-3],工作表3!C[-3]:C[1],3,0) -> 1 | E260: =VLOOKUP(RC[-4],工作表3!C[-4]:C,5,0) -> 进阶丹 | F260: =VLOOKUP(RC[-5],工作表3!C[-5]:C[-1],4,0) -> 牛魔BOSS1
A261: 342 | B261: 6 | C261: day | D261: =VLOOKUP(RC[-3],工作表3!C[-3]:C[1],3,0) -> 1 | E261: =VLOOKUP(RC[-4],工作表3!C[-4]:C,5,0) -> 金刚石 | F261: =VLOOKUP(RC[-5],工作表3!C[-5]:C[-1],4,0) -> 牛魔BOSS1
A262: 343 | B262: =VLOOKUP(RC[-1],工作表3!C[-1]:C[3],2,0) -> 100 | C262: day | D262: =VLOOKUP(RC[-3],工作表3!C[-3]:C[1],3,0) -> 1 | E262: =VLOOKUP(RC[-4],工作表3!C[-4]:C,5,0) -> 2元宝 | F262: =VLOOKUP(RC[-5],工作表3!C[-5]:C[-1],4,0) -> 牛魔BOSS1
A263: 344 | B263: =VLOOKUP(RC[-1],工作表3!C[-1]:C[3],2,0) -> 10 | C263: day | D263: =VLOOKUP(RC[-3],工作表3!C[-3]:C[1],3,0) -> 1 | E263: =VLOOKUP(RC[-4],工作表3!C[-4]:C,5,0) -> 5元宝 | F263: =VLOOKUP(RC[-5],工作表3!C[-5]:C[-1],4,0) -> 牛魔BOSS1
A264: 345 | B264: =VLOOKUP(RC[-1],工作表3!C[-1]:C[3],2,0) -> 10 | C264: day | D264: =VLOOKUP(RC[-3],工作表3!C[-3]:C[1],3,0) -> 1 | E264: =VLOOKUP(RC[-4],工作表3!C[-4]:C,5,0) -> 10元宝 | F264: =VLOOKUP(RC[-5],工作表3!C[-5]:C[-1],4,0) -> 牛魔BOSS1
A265: 346 | B265: =VLOOKUP(RC[-1],工作表3!C[-1]:C[3],2,0) -> 10 | C265: day | D265: =VLOOKUP(RC[-3],工作表3!C[-3]:C[1],3,0) -> 1 | E265: =VLOOKUP(RC[-4],工作表3!C[-4]:C,5,0) -> 20元宝 | F265: =VLOOKUP(RC[-5],工作表3!C[-5]:C[-1],4,0) -> 牛魔BOSS1
A266: 347 | B266: =VLOOKUP(RC[-1],工作表3!C[-1]:C[3],2,0) -> 5 | C266: day | D266: =VLOOKUP(RC[-3],工作表3!C[-3]:C[1],3,0) -> 1 | E266: =VLOOKUP(RC[-4],工作表3!C[-4]:C,5,0) -> 50元宝 | F266: =VLOOKUP(RC[-5],工作表3!C[-5]:C[-1],4,0) -> 牛魔BOSS1
A267: 348 | B267: =VLOOKUP(RC[-1],工作表3!C[-1]:C[3],2,0) -> 6 | C267: day | D267: =VLOOKUP(RC[-3],工作表3!C[-3]:C[1],3,0) -> 1 | E267: =VLOOKUP(RC[-4],工作表3!C[-4]:C,5,0) -> 100元宝 | F267: =VLOOKUP(RC[-5],工作表3!C[-5]:C[-1],4,0) -> 牛魔BOSS1
A268: 349 | B268: =VLOOKUP(RC[-1],工作表3!C[-1]:C[3],2,0) -> 6 | C268: day | D268: =VLOOKUP(RC[-3],工作表3!C[-3]:C[1],3,0) -> 1 | E268: =VLOOKUP(RC[-4],工作表3!C[-4]:C,5,0) -> 150元宝 | F268: =VLOOKUP(RC[-5],工作表3!C[-5]:C[-1],4,0) -> 牛魔BOSS1
A269: 350 | B269: 6 | C269: day | D269: =VLOOKUP(RC[-3],工作表3!C[-3]:C[1],3,0) -> 1 | E269: =VLOOKUP(RC[-4],工作表3!C[-4]:C,5,0) -> 200元宝 | F269: =VLOOKUP(RC[-5],工作表3!C[-5]:C[-1],4,0) -> 牛魔BOSS1
A270: 352 | B270: 5 | C270: day | D270: =VLOOKUP(RC[-3],工作表3!C[-3]:C[1],3,0) -> 1 | E270: =VLOOKUP(RC[-4],工作表3!C[-4]:C,5,0) -> 开天 | F270: =VLOOKUP(RC[-5],工作表3!C[-5]:C[-1],4,0) -> 牛魔BOSS2
A271: 353 | B271: =VLOOKUP(RC[-1],工作表3!C[-1]:C[3],2,0) -> 1 | C271: day | D271: =VLOOKUP(RC[-3],工作表3!C[-3]:C[1],3,0) -> 1 | E271: =VLOOKUP(RC[-4],工作表3!C[-4]:C,5,0) -> 混沌 | F271: =VLOOKUP(RC[-5],工作表3!C[-5]:C[-1],4,0) -> 牛魔BOSS2
A272: 354 | B272: =VLOOKUP(RC[-1],工作表3!C[-1]:C[3],2,0) -> 1 | C272: day | D272: =VLOOKUP(RC[-3],工作表3!C[-3]:C[1],3,0) -> 3 | E272: =VLOOKUP(RC[-4],工作表3!C[-4]:C,5,0) -> 战刃 | F272: =VLOOKUP(RC[-5],工作表3!C[-5]:C[-1],4,0) -> 牛魔BOSS2
A273: 356 | B273: 8 | C273: day | D273: =VLOOKUP(RC[-3],工作表3!C[-3]:C[1],3,0) -> 1 | E273: =VLOOKUP(RC[-4],工作表3!C[-4]:C,5,0) -> 上古神石 | F273: =VLOOKUP(RC[-5],工作表3!C[-5]:C[-1],4,0) -> 牛魔BOSS2
A274: 357 | B274: =VLOOKUP(RC[-1],工作表3!C[-1]:C[3],2,0) -> 1 | C274: day | D274: =VLOOKUP(RC[-3],工作表3!C[-3]:C[1],3,0) -> 1 | E274: =VLOOKUP(RC[-4],工作表3!C[-4]:C,5,0) -> 特面 | F274: =VLOOKUP(RC[-5],工作表3!C[-5]:C[-1],4,0) -> 牛魔BOSS2
A275: 358 | B275: =VLOOKUP(RC[-1],工作表3!C[-1]:C[3],2,0) -> 1 | C275: day | D275: =VLOOKUP(RC[-3],工作表3!C[-3]:C[1],3,0) -> 1 | E275: =VLOOKUP(RC[-4],工作表3!C[-4]:C,5,0) -> 特腿 | F275: =VLOOKUP(RC[-5],工作表3!C[-5]:C[-1],4,0) -> 牛魔BOSS2
A276: 359 | B276: =VLOOKUP(RC[-1],工作表3!C[-1]:C[3],2,0) -> 1 | C276: day | D276: =VLOOKUP(RC[-3],工作表3!C[-3]:C[1],3,0) -> 1 | E276: =VLOOKUP(RC[-4],工作表3!C[-4]:C,5,0) -> 特肩 | F276: =VLOOKUP(RC[-5],工作表3!C[-5]:C[-1],4,0) -> 牛魔BOSS2
A277: 366 | B277: =VLOOKUP(RC[-1],工作表3!C[-1]:C[3],2,0) -> 1 | C277: day | D277: =VLOOKUP(RC[-3],工作表3!C[-3]:C[1],3,0) -> 1 | E277: =VLOOKUP(RC[-4],工作表3!C[-4]:C,5,0) -> 怒斩 | F277: =VLOOKUP(RC[-5],工作表3!C[-5]:C[-1],4,0) -> 牛魔BOSS2
A278: 367 | B278: =VLOOKUP(RC[-1],工作表3!C[-1]:C[3],2,0) -> 1 | C278: day | D278: =VLOOKUP(RC[-3],工作表3!C[-3]:C[1],3,0) -> 1 | E278: =VLOOKUP(RC[-4],工作表3!C[-4]:C,5,0) -> 至尊屠龙 | F278: =VLOOKUP(RC[-5],工作表3!C[-5]:C[-1],4,0) -> 牛魔BOSS2
A279: 368 | B279: =VLOOKUP(RC[-1],工作表3!C[-1]:C[3],2,0) -> 20 | C279: day | D279: =VLOOKUP(RC[-3],工作表3!C[-3]:C[1],3,0) -> 1 | E279: =VLOOKUP(RC[-4],工作表3!C[-4]:C,5,0) -> 进阶丹 | F279: =VLOOKUP(RC[-5],工作表3!C[-5]:C[-1],4,0) -> 牛魔BOSS2
A280: 369 | B280: 5 | C280: day | D280: =VLOOKUP(RC[-3],工作表3!C[-3]:C[1],3,0) -> 1 | E280: =VLOOKUP(RC[-4],工作表3!C[-4]:C,5,0) -> 金刚石 | F280: =VLOOKUP(RC[-5],工作表3!C[-5]:C[-1],4,0) -> 牛魔BOSS2
A281: 370 | B281: =VLOOKUP(RC[-1],工作表3!C[-1]:C[3],2,0) -> 100 | C281: day | D281: =VLOOKUP(RC[-3],工作表3!C[-3]:C[1],3,0) -> 1 | E281: =VLOOKUP(RC[-4],工作表3!C[-4]:C,5,0) -> 2元宝 | F281: =VLOOKUP(RC[-5],工作表3!C[-5]:C[-1],4,0) -> 牛魔BOSS2
A282: 371 | B282: =VLOOKUP(RC[-1],工作表3!C[-1]:C[3],2,0) -> 10 | C282: day | D282: =VLOOKUP(RC[-3],工作表3!C[-3]:C[1],3,0) -> 1 | E282: =VLOOKUP(RC[-4],工作表3!C[-4]:C,5,0) -> 5元宝 | F282: =VLOOKUP(RC[-5],工作表3!C[-5]:C[-1],4,0) -> 牛魔BOSS2
A283: 372 | B283: =VLOOKUP(RC[-1],工作表3!C[-1]:C[3],2,0) -> 10 | C283: day | D283: =VLOOKUP(RC[-3],工作表3!C[-3]:C[1],3,0) -> 1 | E283: =VLOOKUP(RC[-4],工作表3!C[-4]:C,5,0) -> 10元宝 | F283: =VLOOKUP(RC[-5],工作表3!C[-5]:C[-1],4,0) -> 牛魔BOSS2
A284: 373 | B284: =VLOOKUP(RC[-1],工作表3!C[-1]:C[3],2,0) -> 10 | C284: day | D284: =VLOOKUP(RC[-3],工作表3!C[-3]:C[1],3,0) -> 1 | E284: =VLOOKUP(RC[-4],工作表3!C[-4]:C,5,0) -> 20元宝 | F284: =VLOOKUP(RC[-5],工作表3!C[-5]:C[-1],4,0) -> 牛魔BOSS2
A285: 374 | B285: =VLOOKUP(RC[-1],工作表3!C[-1]:C[3],2,0) -> 5 | C285: day | D285: =VLOOKUP(RC[-3],工作表3!C[-3]:C[1],3,0) -> 1 | E285: =VLOOKUP(RC[-4],工作表3!C[-4]:C,5,0) -> 50元宝 | F285: =VLOOKUP(RC[-5],工作表3!C[-5]:C[-1],4,0) -> 牛魔BOSS2
A286: 375 | B286: =VLOOKUP(RC[-1],工作表3!C[-1]:C[3],2,0) -> 6 | C286: day | D286: =VLOOKUP(RC[-3],工作表3!C[-3]:C[1],3,0) -> 1 | E286: =VLOOKUP(RC[-4],工作表3!C[-4]:C,5,0) -> 100元宝 | F286: =VLOOKUP(RC[-5],工作表3!C[-5]:C[-1],4,0) -> 牛魔BOSS2
A287: 376 | B287: 5 | C287: day | D287: =VLOOKUP(RC[-3],工作表3!C[-3]:C[1],3,0) -> 1 | E287: =VLOOKUP(RC[-4],工作表3!C[-4]:C,5,0) -> 150元宝 | F287: =VLOOKUP(RC[-5],工作表3!C[-5]:C[-1],4,0) -> 牛魔BOSS2
A288: 377 | B288: 5 | C288: day | D288: =VLOOKUP(RC[-3],工作表3!C[-3]:C[1],3,0) -> 1 | E288: =VLOOKUP(RC[-4],工作表3!C[-4]:C,5,0) -> 200元宝 | F288: =VLOOKUP(RC[-5],工作表3!C[-5]:C[-1],4,0) -> 牛魔BOSS2
A289: 378 | B289: 2 | C289: day | D289: 1 | E289: 女娲神石 | F289: 火龙
A290: 379 | B290: 4 | C290: day | D290: 1 | E290: 女娲神石 | F290: 雪山boss1
A291: 380 | B291: 6 | C291: day | D291: 1 | E291: 女娲神石 | F291: 雪山BOSS2
A292: 381 | B292: 4 | C292: hour | D292: 1 | E292: 金刚石 | F292: 本服暗殿1小怪
A293: 382 | B293: 1 | C293: day | D293: 7 | E293: 烈焰装备 | F293: 本服暗殿1小怪
A294: 383 | B294: 2 | C294: day | D294: 7 | E294: 烈焰装备 | F294: 本服暗殿2小怪
A295: 384 | B295: 1 | C295: day | D295: 7 | E295: 星王装备 | F295: 本服暗殿2小怪
A296: 385 | B296: 2 | C296: hour | D296: 1 | E296: 上古神石 | F296: 本服暗殿2小怪
A297: 386 | B297: 1 | C297: day | D297: 7 | E297: 星王装备 | F297: 跨服暗1小怪
A298: 387 | B298: 2 | C298: day | D298: 3 | E298: 烈焰装备 | F298: 跨服暗1小怪
A299: 388 | B299: 3 | C299: hour | D299: 1 | E299: 上古神石 | F299: 跨服暗1小怪
A300: 389 | B300: 1 | C300: day | D300: 7 | E300: 金牛装备 | F300: 跨服暗2小怪
A301: 390 | B301: 1 | C301: hour | D301: 1 | E301: 女娲神石 | F301: 跨服暗2小怪
A302: 391 | B302: 6 | C302: hour | D302: 3 | E302: 女娲神石 | F302: 跨服暗殿2BOSS
A303: 392 | B303: 1 | C303: day | D303: 7 | E303: 烈焰装备 | F303: 本服1层BOSS
A304: 393 | B304: 1 | C304: day | D304: 7 | E304: 星王装备 | F304: 本服2层BOSS
A305: 394 | B305: 1 | C305: day | D305: 7 | E305: 星王装备 | F305: 跨服1层BOSS
A306: 395 | B306: 1 | C306: day | D306: 7 | E306: 金牛装备 | F306: 跨服2层BOSS
A307: 396 | B307: 1 | C307: day | D307: 7 | E307: 橙特装 | F307: 跨服1、2橙特装掉落
A308: 397 | B308: 2 | C308: day | D308: 1 | E308: 女娲神石 | F308: 雪山精英
A309: 398 | B309: 4 | C309: day | D309: 1 | E309: 上古神石 | F309: 雪山精英
A310: 399 | B310: 400 | C310: day | D310: 1 | E310: 5元宝 | F310: 火龙精英
A311: 400 | B311: 80 | C311: day | D311: 1 | E311: 20元宝 | F311: 火龙精英
A312: 401 | B312: 2 | C312: day | D312: 1 | E312: 上古神石 | F312: 牛魔海底精英
A313: 402 | B313: 4 | C313: day | D313: 1 | E313: 金刚石 | F313: 牛魔海底精英
A314: 403 | B314: 4 | C314: hour | D314: 1 | E314: 金刚石 | F314: 本服火龙精英
A315: 404 | B315: 2 | C315: hour | D315: 1 | E315: 烈焰装备 | F315: 本服火龙精英
A316: 405 | B316: 1 | C316: day | D316: 3 | E316: 星王装备 | F316: 本服火龙
A317: 406 | B317: 99 | C317: hour | D317: 3 | E317: 金刚石 | F317: 本服1层尸王
A318: 407 | B318: 99 | C318: hour | D318: 3 | E318: 金刚石 | F318: 本服1层奥玛
A319: 408 | B319: 99 | C319: hour | D319: 3 | E319: 金刚石 | F319: 本服1层白野猪
A320: 409 | B320: 99 | C320: hour | D320: 3 | E320: 金刚石 | F320: 本服1层白野猪
A321: 410 | B321: 99 | C321: hour | D321: 3 | E321: 上古神石 | F321: 本服2女妖
A322: 411 | B322: 99 | C322: hour | D322: 3 | E322: 上古神石 | F322: 本服2领主
A323: 412 | B323: 99 | C323: hour | D323: 3 | E323: 上古神石 | F323: 本服2虹魔
A324: 413 | B324: 99 | C324: hour | D324: 3 | E324: 上古神石 | F324: 本服2牛魔
A325: 414 | B325: 99 | C325: hour | D325: 3 | E325: 上古神石 | F325: 本服2鱼人
A326: 415 | B326: 99 | C326: hour | D326: 3 | E326: 上古神石 | F326: 本服2蟹
A327: 416 | B327: 5 | C327: day | D327: 1 | E327: 赤炼魂石 | F327: 幻境之地BOSS
A328: 417 | B328: 18 | C328: day | D328: 1 | E328: 幻境钥匙 | F328: 幻境之地BOSS
A329: 418 | B329: 30 | C329: day | D329: 1 | E329: 上古神石 | F329: 幻境之地BOSS
A330: 419 | B330: 6 | C330: day | D330: 1 | E330: 金刚石 | F330: 本服幻境之地BOSS
A331: 420 | B331: 2 | C331: day | D331: 1 | E331: 女娲神石 | F331: 魔龙岭精英
A332: 421 | B332: 4 | C332: day | D332: 1 | E332: 上古神石 | F332: 魔龙岭精英
A333: 422 | B333: 1 | C333: day | D333: 1 | E333: 王者卷轴 | F333: 魔龙岭精英
A334: 423 | B334: 3 | C334: hour | D334: 1 | E334: 金刚石 | F334: 地宫1层小怪
A335: 424 | B335: 2 | C335: hour | D335: 1 | E335: 上古神石 | F335: 地宫1层小怪
A336: 425 | B336: 3 | C336: hour | D336: 1 | E336: 上古神石 | F336: 地宫2层小怪
A337: 426 | B337: 1 | C337: hour | D337: 1 | E337: 女娲神石 | F337: 地宫2层小怪
A338: 427 | B338: 4 | C338: hour | D338: 1 | E338: 上古神石 | F338: 地宫3层小怪
A339: 428 | B339: 1 | C339: hour | D339: 1 | E339: 女娲神石 | F339: 地宫3层小怪
A340: 429 | B340: 1 | C340: hour | D340: 1 | E340: 王者卷轴 | F340: 地宫3层小怪
A341: 430 | B341: 5 | C341: hour | D341: 1 | E341: 上古神石 | F341: 地宫4层小怪
A342: 431 | B342: 1 | C342: hour | D342: 1 | E342: 女娲神石 | F342: 地宫4层小怪
A343: 432 | B343: 1 | C343: hour | D343: 1 | E343: 王者卷轴 | F343: 地宫4层小怪

Sheet: 工作表2
B3: <font color='0xffffff' size='20' opacity='255'>hhghgg</font> | D3: 1 | E3: 野外小怪
D4: 2 | E4: 精英怪 | I4: 麻痹戒指 | J4: 166
D5: 3 | E5: 骷髅精灵 | I5: 护身戒指 | J5: 166
D6: 4 | E6: 铁甲尸王 | I6: 复活戒指 | J6: 166
D7: 5 | E7: 奥玛教主
D8: 6 | E8: 邪恶触龙
D9: 7 | E9: 白野猪王
D10: 8 | E10: 祖玛教主
D11: 9 | E11: 赤月老魔
D12: 10 | E12: 巨型多角虫
D13: 11 | E13: 巨型钳虫
D14: 12 | E14: 巨型双头恶魔
D15: 13 | E15: 海底BOSS1
D16: 14 | E16: 海底BOSS2
D17: 15 | E17: 牛魔BOSS1
D18: 16 | E18: 牛魔BOSS2
A21: 掉落物品上限控制

Sheet: 工作表3
A1: 掉落分类 | B1: 掉落数量限制 | C1: 掉落周期(天) | D1: 怪物类型 | E1: 物品名称
A2: 1 | B2: 5 | C2: 1 | D2: 野外小怪 | E2: 金刚石
A3: 2 | B3: 50 | C3: 1 | D3: 野外小怪 | E3: 进阶丹
A4: 3 | B4: 250 | C4: 1 | D4: 野外小怪 | E4: 2元宝
A5: 4 | B5: 200 | C5: 1 | D5: 野外小怪 | E5: 超级太阳水
A6: 1 | B6: 5 | C6: 1 | D6: 精英怪 | E6: 金刚石
A7: 5 | B7: 50 | C7: 1 | D7: 精英怪 | E7: 5元宝
A8: 6 | B8: 25 | C8: 1 | D8: 精英怪 | E8: 10元宝
A9: 1 | B9: 1 | C9: 1 | D9: 骷髅精灵 | E9: 开天
A10: 1 | B10: 1 | C10: 1 | D10: 骷髅精灵 | E10: 雷霆战甲
A11: 1 | B11: 1 | C11: 1 | D11: 骷髅精灵 | E11: 雷霆项链
A12: 1 | B12: 1 | C12: 1 | D12: 骷髅精灵 | E12: 雷霆戒指
A13: 1 | B13: 1 | C13: 1 | D13: 骷髅精灵 | E13: 雷霆头盔
A14: 1 | B14: 1 | C14: 1 | D14: 骷髅精灵 | E14: 雷霆护腕
A15: 1 | B15: 1 | C15: 1 | D15: 骷髅精灵 | E15: 雷霆腰带
A16: 1 | B16: 1 | C16: 1 | D16: 骷髅精灵 | E16: 雷霆战靴
A17: 1 | B17: 1 | C17: 1 | D17: 骷髅精灵 | E17: 震天
A18: 1 | B18: 1 | C18: 1 | D18: 骷髅精灵 | E18: 烈焰法袍
A19: 1 | B19: 1 | C19: 1 | D19: 骷髅精灵 | E19: 烈焰魔链
A20: 1 | B20: 1 | C20: 1 | D20: 骷髅精灵 | E20: 烈焰魔指
A21: 1 | B21: 1 | C21: 1 | D21: 骷髅精灵 | E21: 烈焰头盔
A22: 1 | B22: 1 | C22: 1 | D22: 骷髅精灵 | E22: 烈焰护腕
A23: 1 | B23: 1 | C23: 1 | D23: 骷髅精灵 | E23: 烈焰腰带
A24: 1 | B24: 1 | C24: 1 | D24: 骷髅精灵 | E24: 烈焰魔靴
A25: 1 | B25: 1 | C25: 1 | D25: 骷髅精灵 | E25: 玄天
A26: 1 | B26: 1 | C26: 1 | D26: 骷髅精灵 | E26: 光芒道袍
A27: 1 | B27: 1 | C27: 1 | D27: 骷髅精灵 | E27: 光芒道链
A28: 1 | B28: 1 | C28: 1 | D28: 骷髅精灵 | E28: 光芒道戒
A29: 1 | B29: 1 | C29: 1 | D29: 骷髅精灵 | E29: 光芒头盔
A30: 1 | B30: 1 | C30: 1 | D30: 骷髅精灵 | E30: 光芒护腕
A31: 1 | B31: 1 | C31: 1 | D31: 骷髅精灵 | E31: 光芒腰带
A32: 1 | B32: 1 | C32: 1 | D32: 骷髅精灵 | E32: 光芒道靴
A33: 2 | B33: 1 | C33: 1 | D33: 骷髅精灵 | E33: 混沌
A34: 2 | B34: 1 | C34: 1 | D34: 骷髅精灵 | E34: 白虎衣服
A35: 2 | B35: 1 | C35: 1 | D35: 骷髅精灵 | E35: 白虎头盔
A36: 2 | B36: 1 | C36: 1 | D36: 骷髅精灵 | E36: 白虎项链
A37: 2 | B37: 1 | C37: 1 | D37: 骷髅精灵 | E37: 白虎手镯
A38: 2 | B38: 1 | C38: 1 | D38: 骷髅精灵 | E38: 白虎戒指
A39: 2 | B39: 1 | C39: 1 | D39: 骷髅精灵 | E39: 白虎腰带
A40: 2 | B40: 1 | C40: 1 | D40: 骷髅精灵 | E40: 白虎鞋子
A41: 2 | B41: 1 | C41: 1 | D41: 骷髅精灵 | E41: 狂龙
A42: 2 | B42: 1 | C42: 1 | D42: 骷髅精灵 | E42: 朱雀衣服
A43: 2 | B43: 1 | C43: 1 | D43: 骷髅精灵 | E43: 朱雀头盔
A44: 2 | B44: 1 | C44: 1 | D44: 骷髅精灵 | E44: 朱雀项链
A45: 2 | B45: 1 | C45: 1 | D45: 骷髅精灵 | E45: 朱雀手镯
A46: 2 | B46: 1 | C46: 1 | D46: 骷髅精灵 | E46: 朱雀戒指
A47: 2 | B47: 1 | C47: 1 | D47: 骷髅精灵 | E47: 朱雀腰带
A48: 2 | B48: 1 | C48: 1 | D48: 骷髅精灵 | E48: 朱雀鞋子
A49: 2 | B49: 1 | C49: 1 | D49: 骷髅精灵 | E49: 天蛇
A50: 2 | B50: 1 | C50: 1 | D50: 骷髅精灵 | E50: 青龙衣服
A51: 2 | B51: 1 | C51: 1 | D51: 骷髅精灵 | E51: 青龙头盔
A52: 2 | B52: 1 | C52: 1 | D52: 骷髅精灵 | E52: 青龙项链
A53: 2 | B53: 1 | C53: 1 | D53: 骷髅精灵 | E53: 青龙手镯
A54: 2 | B54: 1 | C54: 1 | D54: 骷髅精灵 | E54: 青龙戒指
A55: 2 | B55: 1 | C55: 1 | D55: 骷髅精灵 | E55: 青龙腰带
A56: 2 | B56: 1 | C56: 1 | D56: 骷髅精灵 | E56: 青龙鞋子
A57: 3 | B57: 1 | C57: 3 | D57: 骷髅精灵 | E57: 战刃
A58: 3 | B58: 1 | C58: 3 | D58: 骷髅精灵 | E58: 圣武衣服
A59: 3 | B59: 1 | C59: 3 | D59: 骷髅精灵 | E59: 圣武项链
A60: 3 | B60: 1 | C60: 3 | D60: 骷髅精灵 | E60: 圣武戒指
A61: 3 | B61: 1 | C61: 3 | D61: 骷髅精灵 | E61: 圣武头盔
A62: 3 | B62: 1 | C62: 3 | D62: 骷髅精灵 | E62: 圣武手镯
A63: 3 | B63: 1 | C63: 3 | D63: 骷髅精灵 | E63: 圣武腰带
A64: 3 | B64: 1 | C64: 3 | D64: 骷髅精灵 | E64: 圣武鞋子
A65: 3 | B65: 1 | C65: 3 | D65: 骷髅精灵 | E65: 轮回
A66: 3 | B66: 1 | C66: 3 | D66: 骷髅精灵 | E66: 圣魔衣服
A67: 3 | B67: 1 | C67: 3 | D67: 骷髅精灵 | E67: 圣魔项链
A68: 3 | B68: 1 | C68: 3 | D68: 骷髅精灵 | E68: 圣魔戒指
A69: 3 | B69: 1 | C69: 3 | D69: 骷髅精灵 | E69: 圣魔头盔
A70: 3 | B70: 1 | C70: 3 | D70: 骷髅精灵 | E70: 圣魔手镯
A71: 3 | B71: 1 | C71: 3 | D71: 骷髅精灵 | E71: 圣魔腰带
A72: 3 | B72: 1 | C72: 3 | D72: 骷髅精灵 | E72: 圣魔鞋子
A73: 3 | B73: 1 | C73: 3 | D73: 骷髅精灵 | E73: 太虚
A74: 3 | B74: 1 | C74: 3 | D74: 骷髅精灵 | E74: 圣魂衣服
A75: 3 | B75: 1 | C75: 3 | D75: 骷髅精灵 | E75: 圣魂项链
A76: 3 | B76: 1 | C76: 3 | D76: 骷髅精灵 | E76: 圣魂戒指
A77: 3 | B77: 1 | C77: 3 | D77: 骷髅精灵 | E77: 圣魂头盔
A78: 3 | B78: 1 | C78: 3 | D78: 骷髅精灵 | E78: 圣魂手镯
A79: 3 | B79: 1 | C79: 3 | D79: 骷髅精灵 | E79: 圣魂腰带
A80: 3 | B80: 1 | C80: 3 | D80: 骷髅精灵 | E80: 圣魂鞋子
A81: 4 | B81: 1 | C81: 7 | D81: 骷髅精灵 | E81: 麻痹戒指
A82: 4 | B82: 1 | C82: 7 | D82: 骷髅精灵 | E82: 护身戒指
A83: 4 | B83: 1 | C83: 7 | D83: 骷髅精灵 | E83: 复活戒指
A84: 5 | B84: 5 | C84: 1 | D84: 骷髅精灵 | E84: 上古神石
A85: 6 | B85: 1 | C85: 1 | D85: 骷髅精灵 | E85: 特面
A86: 7 | B86: 1 | C86: 1 | D86: 骷髅精灵 | E86: 特腿
A87: 8 | B87: 1 | C87: 1 | D87: 骷髅精灵 | E87: 特肩
A88: 36 | B88: 1 | C88: 1 | D88: 骷髅精灵 | E88: 狂风斩书
A89: 37 | B89: 1 | C89: 1 | D89: 骷髅精灵 | E89: 逐日剑法书
A90: 38 | B90: 1 | C90: 1 | D90: 骷髅精灵 | E90: 诱惑之光书
A91: 39 | B91: 1 | C91: 1 | D91: 骷髅精灵 | E91: 流星火雨书
A92: 40 | B92: 1 | C92: 1 | D92: 骷髅精灵 | E92: 召唤神兽书
A93: 41 | B93: 1 | C93: 1 | D93: 骷髅精灵 | E93: 嗜血术书
A94: 15 | B94: 1 | C94: 1 | D94: 骷髅精灵 | E94: 怒斩
A95: 15 | B95: 1 | C95: 1 | D95: 骷髅精灵 | E95: 龙牙
A96: 15 | B96: 1 | C96: 1 | D96: 骷髅精灵 | E96: 龙纹
A97: 16 | B97: 1 | C97: 1 | D97: 骷髅精灵 | E97: 至尊屠龙
A98: 16 | B98: 1 | C98: 1 | D98: 骷髅精灵 | E98: 至尊噬魂
A99: 16 | B99: 1 | C99: 1 | D99: 骷髅精灵 | E99: 至尊逍遥扇
A100: 17 | B100: 20 | C100: 1 | D100: 骷髅精灵 | E100: 进阶丹
A101: 18 | B101: 1 | C101: 1 | D101: 骷髅精灵 | E101: 金刚石
A102: 19 | B102: 100 | C102: 1 | D102: 骷髅精灵 | E102: 2元宝
A103: 20 | B103: 10 | C103: 1 | D103: 骷髅精灵 | E103: 5元宝
A104: 21 | B104: 10 | C104: 1 | D104: 骷髅精灵 | E104: 10元宝
A105: 22 | B105: 10 | C105: 1 | D105: 骷髅精灵 | E105: 20元宝
A106: 23 | B106: 5 | C106: 1 | D106: 骷髅精灵 | E106: 50元宝
A107: 24 | B107: 6 | C107: 1 | D107: 骷髅精灵 | E107: 100元宝
A108: 25 | B108: 4 | C108: 1 | D108: 骷髅精灵 | E108: 150元宝
A109: 26 | B109: 3 | C109: 1 | D109: 骷髅精灵 | E109: 200元宝
A110: 28 | B110: 1 | C110: 1 | D110: 铁甲尸王 | E110: 开天
A111: 28 | B111: 1 | C111: 1 | D111: 铁甲尸王 | E111: 雷霆战甲
A112: 28 | B112: 1 | C112: 1 | D112: 铁甲尸王 | E112: 雷霆项链
A113: 28 | B113: 1 | C113: 1 | D113: 铁甲尸王 | E113: 雷霆戒指
A114: 28 | B114: 1 | C114: 1 | D114: 铁甲尸王 | E114: 雷霆头盔
A115: 28 | B115: 1 | C115: 1 | D115: 铁甲尸王 | E115: 雷霆护腕
A116: 28 | B116: 1 | C116: 1 | D116: 铁甲尸王 | E116: 雷霆腰带
A117: 28 | B117: 1 | C117: 1 | D117: 铁甲尸王 | E117: 雷霆战靴
A118: 28 | B118: 1 | C118: 1 | D118: 铁甲尸王 | E118: 震天
A119: 28 | B119: 1 | C119: 1 | D119: 铁甲尸王 | E119: 烈焰法袍
A120: 28 | B120: 1 | C120: 1 | D120: 铁甲尸王 | E120: 烈焰魔链
A121: 28 | B121: 1 | C121: 1 | D121: 铁甲尸王 | E121: 烈焰魔指
A122: 28 | B122: 1 | C122: 1 | D122: 铁甲尸王 | E122: 烈焰头盔
A123: 28 | B123: 1 | C123: 1 | D123: 铁甲尸王 | E123: 烈焰护腕
A124: 28 | B124: 1 | C124: 1 | D124: 铁甲尸王 | E124: 烈焰腰带
A125: 28 | B125: 1 | C125: 1 | D125: 铁甲尸王 | E125: 烈焰魔靴
A126: 28 | B126: 1 | C126: 1 | D126: 铁甲尸王 | E126: 玄天
A127: 28 | B127: 1 | C127: 1 | D127: 铁甲尸王 | E127: 光芒道袍
A128: 28 | B128: 1 | C128: 1 | D128: 铁甲尸王 | E128: 光芒道链
A129: 28 | B129: 1 | C129: 1 | D129: 铁甲尸王 | E129: 光芒道戒
A130: 28 | B130: 1 | C130: 1 | D130: 铁甲尸王 | E130: 光芒头盔
A131: 28 | B131: 1 | C131: 1 | D131: 铁甲尸王 | E131: 光芒护腕
A132: 28 | B132: 1 | C132: 1 | D132: 铁甲尸王 | E132: 光芒腰带
A133: 28 | B133: 1 | C133: 1 | D133: 铁甲尸王 | E133: 光芒道靴
A134: 29 | B134: 1 | C134: 1 | D134: 铁甲尸王 | E134: 混沌
A135: 29 | B135: 1 | C135: 1 | D135: 铁甲尸王 | E135: 白虎衣服
A136: 29 | B136: 1 | C136: 1 | D136: 铁甲尸王 | E136: 白虎头盔
A137: 29 | B137: 1 | C137: 1 | D137: 铁甲尸王 | E137: 白虎项链
A138: 29 | B138: 1 | C138: 1 | D138: 铁甲尸王 | E138: 白虎手镯
A139: 29 | B139: 1 | C139: 1 | D139: 铁甲尸王 | E139: 白虎戒指
A140: 29 | B140: 1 | C140: 1 | D140: 铁甲尸王 | E140: 白虎腰带
A141: 29 | B141: 1 | C141: 1 | D141: 铁甲尸王 | E141: 白虎鞋子
A142: 29 | B142: 1 | C142: 1 | D142: 铁甲尸王 | E142: 狂龙
A143: 29 | B143: 1 | C143: 1 | D143: 铁甲尸王 | E143: 朱雀衣服
A144: 29 | B144: 1 | C144: 1 | D144: 铁甲尸王 | E144: 朱雀头盔
A145: 29 | B145: 1 | C145: 1 | D145: 铁甲尸王 | E145: 朱雀项链
A146: 29 | B146: 1 | C146: 1 | D146: 铁甲尸王 | E146: 朱雀手镯
A147: 29 | B147: 1 | C147: 1 | D147: 铁甲尸王 | E147: 朱雀戒指
A148: 29 | B148: 1 | C148: 1 | D148: 铁甲尸王 | E148: 朱雀腰带
A149: 29 | B149: 1 | C149: 1 | D149: 铁甲尸王 | E149: 朱雀鞋子
A150: 29 | B150: 1 | C150: 1 | D150: 铁甲尸王 | E150: 天蛇
A151: 29 | B151: 1 | C151: 1 | D151: 铁甲尸王 | E151: 青龙衣服
A152: 29 | B152: 1 | C152: 1 | D152: 铁甲尸王 | E152: 青龙头盔
A153: 29 | B153: 1 | C153: 1 | D153: 铁甲尸王 | E153: 青龙项链
A154: 29 | B154: 1 | C154: 1 | D154: 铁甲尸王 | E154: 青龙手镯
A155: 29 | B155: 1 | C155: 1 | D155: 铁甲尸王 | E155: 青龙戒指
A156: 29 | B156: 1 | C156: 1 | D156: 铁甲尸王 | E156: 青龙腰带
A157: 29 | B157: 1 | C157: 1 | D157: 铁甲尸王 | E157: 青龙鞋子
A158: 30 | B158: 1 | C158: 3 | D158: 铁甲尸王 | E158: 战刃
A159: 30 | B159: 1 | C159: 3 | D159: 铁甲尸王 | E159: 圣武衣服
A160: 30 | B160: 1 | C160: 3 | D160: 铁甲尸王 | E160: 圣武项链
A161: 30 | B161: 1 | C161: 3 | D161: 铁甲尸王 | E161: 圣武戒指
A162: 30 | B162: 1 | C162: 3 | D162: 铁甲尸王 | E162: 圣武头盔
A163: 30 | B163: 1 | C163: 3 | D163: 铁甲尸王 | E163: 圣武手镯
A164: 30 | B164: 1 | C164: 3 | D164: 铁甲尸王 | E164: 圣武腰带
A165: 30 | B165: 1 | C165: 3 | D165: 铁甲尸王 | E165: 圣武鞋子
A166: 30 | B166: 1 | C166: 3 | D166: 铁甲尸王 | E166: 轮回
A167: 30 | B167: 1 | C167: 3 | D167: 铁甲尸王 | E167: 圣魔衣服
A168: 30 | B168: 1 | C168: 3 | D168: 铁甲尸王 | E168: 圣魔项链
A169: 30 | B169: 1 | C169: 3 | D169: 铁甲尸王 | E169: 圣魔戒指
A170: 30 | B170: 1 | C170: 3 | D170: 铁甲尸王 | E170: 圣魔头盔
A171: 30 | B171: 1 | C171: 3 | D171: 铁甲尸王 | E171: 圣魔手镯
A172: 30 | B172: 1 | C172: 3 | D172: 铁甲尸王 | E172: 圣魔腰带
A173: 30 | B173: 1 | C173: 3 | D173: 铁甲尸王 | E173: 圣魔鞋子
A174: 30 | B174: 1 | C174: 3 | D174: 铁甲尸王 | E174: 太虚
A175: 30 | B175: 1 | C175: 3 | D175: 铁甲尸王 | E175: 圣魂衣服
A176: 30 | B176: 1 | C176: 3 | D176: 铁甲尸王 | E176: 圣魂项链
A177: 30 | B177: 1 | C177: 3 | D177: 铁甲尸王 | E177: 圣魂戒指
A178: 30 | B178: 1 | C178: 3 | D178: 铁甲尸王 | E178: 圣魂头盔
A179: 30 | B179: 1 | C179: 3 | D179: 铁甲尸王 | E179: 圣魂手镯
A180: 30 | B180: 1 | C180: 3 | D180: 铁甲尸王 | E180: 圣魂腰带
A181: 30 | B181: 1 | C181: 3 | D181: 铁甲尸王 | E181: 圣魂鞋子
A182: 31 | B182: 1 | C182: 7 | D182: 铁甲尸王 | E182: 麻痹戒指
A183: 31 | B183: 1 | C183: 7 | D183: 铁甲尸王 | E183: 护身戒指
A184: 31 | B184: 1 | C184: 7 | D184: 铁甲尸王 | E184: 复活戒指
A185: 32 | B185: 5 | C185: 1 | D185: 铁甲尸王 | E185: 上古神石
A186: 33 | B186: 1 | C186: 1 | D186: 铁甲尸王 | E186: 特面
A187: 34 | B187: 1 | C187: 1 | D187: 铁甲尸王 | E187: 特腿
A188: 35 | B188: 1 | C188: 1 | D188: 铁甲尸王 | E188: 特肩
A189: 9 | B189: 1 | C189: 1 | D189: 铁甲尸王 | E189: 狂风斩书
A190: 10 | B190: 1 | C190: 1 | D190: 铁甲尸王 | E190: 逐日剑法书
A191: 11 | B191: 1 | C191: 1 | D191: 铁甲尸王 | E191: 诱惑之光书
A192: 12 | B192: 1 | C192: 1 | D192: 铁甲尸王 | E192: 流星火雨书
A193: 13 | B193: 1 | C193: 1 | D193: 铁甲尸王 | E193: 召唤神兽书
A194: 14 | B194: 1 | C194: 1 | D194: 铁甲尸王 | E194: 嗜血术书
A195: 42 | B195: 1 | C195: 1 | D195: 铁甲尸王 | E195: 怒斩
A196: 42 | B196: 1 | C196: 1 | D196: 铁甲尸王 | E196: 龙牙
A197: 42 | B197: 1 | C197: 1 | D197: 铁甲尸王 | E197: 龙纹
A198: 43 | B198: 1 | C198: 1 | D198: 铁甲尸王 | E198: 至尊屠龙
A199: 43 | B199: 1 | C199: 1 | D199: 铁甲尸王 | E199: 至尊噬魂
A200: 43 | B200: 1 | C200: 1 | D200: 铁甲尸王 | E200: 至尊逍遥扇
A201: 44 | B201: 20 | C201: 1 | D201: 铁甲尸王 | E201: 进阶丹
A202: 45 | B202: 1 | C202: 1 | D202: 铁甲尸王 | E202: 金刚石
A203: 46 | B203: 100 | C203: 1 | D203: 铁甲尸王 | E203: 2元宝
A204: 47 | B204: 10 | C204: 1 | D204: 铁甲尸王 | E204: 5元宝
A205: 48 | B205: 10 | C205: 1 | D205: 铁甲尸王 | E205: 10元宝
A206: 49 | B206: 10 | C206: 1 | D206: 铁甲尸王 | E206: 20元宝
A207: 50 | B207: 5 | C207: 1 | D207: 铁甲尸王 | E207: 50元宝
A208: 51 | B208: 6 | C208: 1 | D208: 铁甲尸王 | E208: 100元宝
A209: 52 | B209: 4 | C209: 1 | D209: 铁甲尸王 | E209: 150元宝
A210: 53 | B210: 3 | C210: 1 | D210: 铁甲尸王 | E210: 200元宝
A211: 55 | B211: 1 | C211: 1 | D211: 奥玛教主 | E211: 开天
A212: 55 | B212: 1 | C212: 1 | D212: 奥玛教主 | E212: 雷霆战甲
A213: 55 | B213: 1 | C213: 1 | D213: 奥玛教主 | E213: 雷霆项链
A214: 55 | B214: 1 | C214: 1 | D214: 奥玛教主 | E214: 雷霆戒指
A215: 55 | B215: 1 | C215: 1 | D215: 奥玛教主 | E215: 雷霆头盔
A216: 55 | B216: 1 | C216: 1 | D216: 奥玛教主 | E216: 雷霆护腕
A217: 55 | B217: 1 | C217: 1 | D217: 奥玛教主 | E217: 雷霆腰带
A218: 55 | B218: 1 | C218: 1 | D218: 奥玛教主 | E218: 雷霆战靴
A219: 55 | B219: 1 | C219: 1 | D219: 奥玛教主 | E219: 震天
A220: 55 | B220: 1 | C220: 1 | D220: 奥玛教主 | E220: 烈焰法袍
A221: 55 | B221: 1 | C221: 1 | D221: 奥玛教主 | E221: 烈焰魔链
A222: 55 | B222: 1 | C222: 1 | D222: 奥玛教主 | E222: 烈焰魔指
A223: 55 | B223: 1 | C223: 1 | D223: 奥玛教主 | E223: 烈焰头盔
A224: 55 | B224: 1 | C224: 1 | D224: 奥玛教主 | E224: 烈焰护腕
A225: 55 | B225: 1 | C225: 1 | D225: 奥玛教主 | E225: 烈焰腰带
A226: 55 | B226: 1 | C226: 1 | D226: 奥玛教主 | E226: 烈焰魔靴
A227: 55 | B227: 1 | C227: 1 | D227: 奥玛教主 | E227: 玄天
A228: 55 | B228: 1 | C228: 1 | D228: 奥玛教主 | E228: 光芒道袍
A229: 55 | B229: 1 | C229: 1 | D229: 奥玛教主 | E229: 光芒道链
A230: 55 | B230: 1 | C230: 1 | D230: 奥玛教主 | E230: 光芒道戒
A231: 55 | B231: 1 | C231: 1 | D231: 奥玛教主 | E231: 光芒头盔
A232: 55 | B232: 1 | C232: 1 | D232: 奥玛教主 | E232: 光芒护腕
A233: 55 | B233: 1 | C233: 1 | D233: 奥玛教主 | E233: 光芒腰带
A234: 55 | B234: 1 | C234: 1 | D234: 奥玛教主 | E234: 光芒道靴
A235: 56 | B235: 1 | C235: 1 | D235: 奥玛教主 | E235: 混沌
A236: 56 | B236: 1 | C236: 1 | D236: 奥玛教主 | E236: 白虎衣服
A237: 56 | B237: 1 | C237: 1 | D237: 奥玛教主 | E237: 白虎头盔
A238: 56 | B238: 1 | C238: 1 | D238: 奥玛教主 | E238: 白虎项链
A239: 56 | B239: 1 | C239: 1 | D239: 奥玛教主 | E239: 白虎手镯
A240: 56 | B240: 1 | C240: 1 | D240: 奥玛教主 | E240: 白虎戒指
A241: 56 | B241: 1 | C241: 1 | D241: 奥玛教主 | E241: 白虎腰带
A242: 56 | B242: 1 | C242: 1 | D242: 奥玛教主 | E242: 白虎鞋子
A243: 56 | B243: 1 | C243: 1 | D243: 奥玛教主 | E243: 狂龙
A244: 56 | B244: 1 | C244: 1 | D244: 奥玛教主 | E244: 朱雀衣服
A245: 56 | B245: 1 | C245: 1 | D245: 奥玛教主 | E245: 朱雀头盔
A246: 56 | B246: 1 | C246: 1 | D246: 奥玛教主 | E246: 朱雀项链
A247: 56 | B247: 1 | C247: 1 | D247: 奥玛教主 | E247: 朱雀手镯
A248: 56 | B248: 1 | C248: 1 | D248: 奥玛教主 | E248: 朱雀戒指
A249: 56 | B249: 1 | C249: 1 | D249: 奥玛教主 | E249: 朱雀腰带
A250: 56 | B250: 1 | C250: 1 | D250: 奥玛教主 | E250: 朱雀鞋子
A251: 56 | B251: 1 | C251: 1 | D251: 奥玛教主 | E251: 天蛇
A252: 56 | B252: 1 | C252: 1 | D252: 奥玛教主 | E252: 青龙衣服
A253: 56 | B253: 1 | C253: 1 | D253: 奥玛教主 | E253: 青龙头盔
A254: 56 | B254: 1 | C254: 1 | D254: 奥玛教主 | E254: 青龙项链
A255: 56 | B255: 1 | C255: 1 | D255: 奥玛教主 | E255: 青龙手镯
A256: 56 | B256: 1 | C256: 1 | D256: 奥玛教主 | E256: 青龙戒指
A257: 56 | B257: 1 | C257: 1 | D257: 奥玛教主 | E257: 青龙腰带
A258: 56 | B258: 1 | C258: 1 | D258: 奥玛教主 | E258: 青龙鞋子
A259: 57 | B259: 1 | C259: 3 | D259: 奥玛教主 | E259: 战刃
A260: 57 | B260: 1 | C260: 3 | D260: 奥玛教主 | E260: 圣武衣服
A261: 57 | B261: 1 | C261: 3 | D261: 奥玛教主 | E261: 圣武项链
A262: 57 | B262: 1 | C262: 3 | D262: 奥玛教主 | E262: 圣武戒指
A263: 57 | B263: 1 | C263: 3 | D263: 奥玛教主 | E263: 圣武头盔
A264: 57 | B264: 1 | C264: 3 | D264: 奥玛教主 | E264: 圣武手镯
A265: 57 | B265: 1 | C265: 3 | D265: 奥玛教主 | E265: 圣武腰带
A266: 57 | B266: 1 | C266: 3 | D266: 奥玛教主 | E266: 圣武鞋子
A267: 57 | B267: 1 | C267: 3 | D267: 奥玛教主 | E267: 轮回
A268: 57 | B268: 1 | C268: 3 | D268: 奥玛教主 | E268: 圣魔衣服
A269: 57 | B269: 1 | C269: 3 | D269: 奥玛教主 | E269: 圣魔项链
A270: 57 | B270: 1 | C270: 3 | D270: 奥玛教主 | E270: 圣魔戒指
A271: 57 | B271: 1 | C271: 3 | D271: 奥玛教主 | E271: 圣魔头盔
A272: 57 | B272: 1 | C272: 3 | D272: 奥玛教主 | E272: 圣魔手镯
A273: 57 | B273: 1 | C273: 3 | D273: 奥玛教主 | E273: 圣魔腰带
A274: 57 | B274: 1 | C274: 3 | D274: 奥玛教主 | E274: 圣魔鞋子
A275: 57 | B275: 1 | C275: 3 | D275: 奥玛教主 | E275: 太虚
A276: 57 | B276: 1 | C276: 3 | D276: 奥玛教主 | E276: 圣魂衣服
A277: 57 | B277: 1 | C277: 3 | D277: 奥玛教主 | E277: 圣魂项链
A278: 57 | B278: 1 | C278: 3 | D278: 奥玛教主 | E278: 圣魂戒指
A279: 57 | B279: 1 | C279: 3 | D279: 奥玛教主 | E279: 圣魂头盔
A280: 57 | B280: 1 | C280: 3 | D280: 奥玛教主 | E280: 圣魂手镯
A281: 57 | B281: 1 | C281: 3 | D281: 奥玛教主 | E281: 圣魂腰带
A282: 57 | B282: 1 | C282: 3 | D282: 奥玛教主 | E282: 圣魂鞋子
A283: 58 | B283: 1 | C283: 7 | D283: 奥玛教主 | E283: 麻痹戒指
A284: 58 | B284: 1 | C284: 7 | D284: 奥玛教主 | E284: 护身戒指
A285: 58 | B285: 1 | C285: 7 | D285: 奥玛教主 | E285: 复活戒指
A286: 59 | B286: 5 | C286: 1 | D286: 奥玛教主 | E286: 上古神石
A287: 60 | B287: 1 | C287: 1 | D287: 奥玛教主 | E287: 特面
A288: 61 | B288: 1 | C288: 1 | D288: 奥玛教主 | E288: 特腿
A289: 62 | B289: 1 | C289: 1 | D289: 奥玛教主 | E289: 特肩
A290: 36 | B290: 1 | C290: 1 | D290: 奥玛教主 | E290: 狂风斩书
A291: 37 | B291: 1 | C291: 1 | D291: 奥玛教主 | E291: 逐日剑法书
A292: 38 | B292: 1 | C292: 1 | D292: 奥玛教主 | E292: 诱惑之光书
A293: 39 | B293: 1 | C293: 1 | D293: 奥玛教主 | E293: 流星火雨书
A294: 40 | B294: 1 | C294: 1 | D294: 奥玛教主 | E294: 召唤神兽书
A295: 41 | B295: 1 | C295: 1 | D295: 奥玛教主 | E295: 嗜血术书
A296: 69 | B296: 1 | C296: 1 | D296: 奥玛教主 | E296: 怒斩
A297: 69 | B297: 1 | C297: 1 | D297: 奥玛教主 | E297: 龙牙
A298: 69 | B298: 1 | C298: 1 | D298: 奥玛教主 | E298: 龙纹
A299: 70 | B299: 1 | C299: 1 | D299: 奥玛教主 | E299: 至尊屠龙
A300: 70 | B300: 1 | C300: 1 | D300: 奥玛教主 | E300: 至尊噬魂
A301: 70 | B301: 1 | C301: 1 | D301: 奥玛教主 | E301: 至尊逍遥扇
A302: 71 | B302: 24 | C302: 1 | D302: 奥玛教主 | E302: 进阶丹
A303: 72 | B303: 1 | C303: 1 | D303: 奥玛教主 | E303: 金刚石
A304: 73 | B304: 100 | C304: 1 | D304: 奥玛教主 | E304: 2元宝
A305: 74 | B305: 10 | C305: 1 | D305: 奥玛教主 | E305: 5元宝
A306: 75 | B306: 10 | C306: 1 | D306: 奥玛教主 | E306: 10元宝
A307: 76 | B307: 8 | C307: 1 | D307: 奥玛教主 | E307: 20元宝
A308: 77 | B308: 5 | C308: 1 | D308: 奥玛教主 | E308: 50元宝
A309: 78 | B309: 6 | C309: 1 | D309: 奥玛教主 | E309: 100元宝
A310: 79 | B310: 4 | C310: 1 | D310: 奥玛教主 | E310: 150元宝
A311: 80 | B311: 3 | C311: 1 | D311: 奥玛教主 | E311: 200元宝
A312: 82 | B312: 1 | C312: 1 | D312: 邪恶触龙 | E312: 开天
A313: 82 | B313: 1 | C313: 1 | D313: 邪恶触龙 | E313: 雷霆战甲
A314: 82 | B314: 1 | C314: 1 | D314: 邪恶触龙 | E314: 雷霆项链
A315: 82 | B315: 1 | C315: 1 | D315: 邪恶触龙 | E315: 雷霆戒指
A316: 82 | B316: 1 | C316: 1 | D316: 邪恶触龙 | E316: 雷霆头盔
A317: 82 | B317: 1 | C317: 1 | D317: 邪恶触龙 | E317: 雷霆护腕
A318: 82 | B318: 1 | C318: 1 | D318: 邪恶触龙 | E318: 雷霆腰带
A319: 82 | B319: 1 | C319: 1 | D319: 邪恶触龙 | E319: 雷霆战靴
A320: 82 | B320: 1 | C320: 1 | D320: 邪恶触龙 | E320: 震天
A321: 82 | B321: 1 | C321: 1 | D321: 邪恶触龙 | E321: 烈焰法袍
A322: 82 | B322: 1 | C322: 1 | D322: 邪恶触龙 | E322: 烈焰魔链
A323: 82 | B323: 1 | C323: 1 | D323: 邪恶触龙 | E323: 烈焰魔指
A324: 82 | B324: 1 | C324: 1 | D324: 邪恶触龙 | E324: 烈焰头盔
A325: 82 | B325: 1 | C325: 1 | D325: 邪恶触龙 | E325: 烈焰护腕
A326: 82 | B326: 1 | C326: 1 | D326: 邪恶触龙 | E326: 烈焰腰带
A327: 82 | B327: 1 | C327: 1 | D327: 邪恶触龙 | E327: 烈焰魔靴
A328: 82 | B328: 1 | C328: 1 | D328: 邪恶触龙 | E328: 玄天
A329: 82 | B329: 1 | C329: 1 | D329: 邪恶触龙 | E329: 光芒道袍
A330: 82 | B330: 1 | C330: 1 | D330: 邪恶触龙 | E330: 光芒道链
A331: 82 | B331: 1 | C331: 1 | D331: 邪恶触龙 | E331: 光芒道戒
A332: 82 | B332: 1 | C332: 1 | D332: 邪恶触龙 | E332: 光芒头盔
A333: 82 | B333: 1 | C333: 1 | D333: 邪恶触龙 | E333: 光芒护腕
A334: 82 | B334: 1 | C334: 1 | D334: 邪恶触龙 | E334: 光芒腰带
A335: 82 | B335: 1 | C335: 1 | D335: 邪恶触龙 | E335: 光芒道靴
A336: 83 | B336: 1 | C336: 1 | D336: 邪恶触龙 | E336: 混沌
A337: 83 | B337: 1 | C337: 1 | D337: 邪恶触龙 | E337: 白虎衣服
A338: 83 | B338: 1 | C338: 1 | D338: 邪恶触龙 | E338: 白虎头盔
A339: 83 | B339: 1 | C339: 1 | D339: 邪恶触龙 | E339: 白虎项链
A340: 83 | B340: 1 | C340: 1 | D340: 邪恶触龙 | E340: 白虎手镯
A341: 83 | B341: 1 | C341: 1 | D341: 邪恶触龙 | E341: 白虎戒指
A342: 83 | B342: 1 | C342: 1 | D342: 邪恶触龙 | E342: 白虎腰带
A343: 83 | B343: 1 | C343: 1 | D343: 邪恶触龙 | E343: 白虎鞋子
A344: 83 | B344: 1 | C344: 1 | D344: 邪恶触龙 | E344: 狂龙
A345: 83 | B345: 1 | C345: 1 | D345: 邪恶触龙 | E345: 朱雀衣服
A346: 83 | B346: 1 | C346: 1 | D346: 邪恶触龙 | E346: 朱雀头盔
A347: 83 | B347: 1 | C347: 1 | D347: 邪恶触龙 | E347: 朱雀项链
A348: 83 | B348: 1 | C348: 1 | D348: 邪恶触龙 | E348: 朱雀手镯
A349: 83 | B349: 1 | C349: 1 | D349: 邪恶触龙 | E349: 朱雀戒指
A350: 83 | B350: 1 | C350: 1 | D350: 邪恶触龙 | E350: 朱雀腰带
A351: 83 | B351: 1 | C351: 1 | D351: 邪恶触龙 | E351: 朱雀鞋子
A352: 83 | B352: 1 | C352: 1 | D352: 邪恶触龙 | E352: 天蛇
A353: 83 | B353: 1 | C353: 1 | D353: 邪恶触龙 | E353: 青龙衣服
A354: 83 | B354: 1 | C354: 1 | D354: 邪恶触龙 | E354: 青龙头盔
A355: 83 | B355: 1 | C355: 1 | D355: 邪恶触龙 | E355: 青龙项链
A356: 83 | B356: 1 | C356: 1 | D356: 邪恶触龙 | E356: 青龙手镯
A357: 83 | B357: 1 | C357: 1 | D357: 邪恶触龙 | E357: 青龙戒指
A358: 83 | B358: 1 | C358: 1 | D358: 邪恶触龙 | E358: 青龙腰带
A359: 83 | B359: 1 | C359: 1 | D359: 邪恶触龙 | E359: 青龙鞋子
A360: 84 | B360: 1 | C360: 3 | D360: 邪恶触龙 | E360: 战刃
A361: 84 | B361: 1 | C361: 3 | D361: 邪恶触龙 | E361: 圣武衣服
A362: 84 | B362: 1 | C362: 3 | D362: 邪恶触龙 | E362: 圣武项链
A363: 84 | B363: 1 | C363: 3 | D363: 邪恶触龙 | E363: 圣武戒指
A364: 84 | B364: 1 | C364: 3 | D364: 邪恶触龙 | E364: 圣武头盔
A365: 84 | B365: 1 | C365: 3 | D365: 邪恶触龙 | E365: 圣武手镯
A366: 84 | B366: 1 | C366: 3 | D366: 邪恶触龙 | E366: 圣武腰带
A367: 84 | B367: 1 | C367: 3 | D367: 邪恶触龙 | E367: 圣武鞋子
A368: 84 | B368: 1 | C368: 3 | D368: 邪恶触龙 | E368: 轮回
A369: 84 | B369: 1 | C369: 3 | D369: 邪恶触龙 | E369: 圣魔衣服
A370: 84 | B370: 1 | C370: 3 | D370: 邪恶触龙 | E370: 圣魔项链
A371: 84 | B371: 1 | C371: 3 | D371: 邪恶触龙 | E371: 圣魔戒指
A372: 84 | B372: 1 | C372: 3 | D372: 邪恶触龙 | E372: 圣魔头盔
A373: 84 | B373: 1 | C373: 3 | D373: 邪恶触龙 | E373: 圣魔手镯
A374: 84 | B374: 1 | C374: 3 | D374: 邪恶触龙 | E374: 圣魔腰带
A375: 84 | B375: 1 | C375: 3 | D375: 邪恶触龙 | E375: 圣魔鞋子
A376: 84 | B376: 1 | C376: 3 | D376: 邪恶触龙 | E376: 太虚
A377: 84 | B377: 1 | C377: 3 | D377: 邪恶触龙 | E377: 圣魂衣服
A378: 84 | B378: 1 | C378: 3 | D378: 邪恶触龙 | E378: 圣魂项链
A379: 84 | B379: 1 | C379: 3 | D379: 邪恶触龙 | E379: 圣魂戒指
A380: 84 | B380: 1 | C380: 3 | D380: 邪恶触龙 | E380: 圣魂头盔
A381: 84 | B381: 1 | C381: 3 | D381: 邪恶触龙 | E381: 圣魂手镯
A382: 84 | B382: 1 | C382: 3 | D382: 邪恶触龙 | E382: 圣魂腰带
A383: 84 | B383: 1 | C383: 3 | D383: 邪恶触龙 | E383: 圣魂鞋子
A384: 85 | B384: 1 | C384: 7 | D384: 邪恶触龙 | E384: 麻痹戒指
A385: 85 | B385: 1 | C385: 7 | D385: 邪恶触龙 | E385: 护身戒指
A386: 85 | B386: 1 | C386: 7 | D386: 邪恶触龙 | E386: 复活戒指
A387: 86 | B387: 5 | C387: 1 | D387: 邪恶触龙 | E387: 上古神石
A388: 87 | B388: 1 | C388: 1 | D388: 邪恶触龙 | E388: 特面
A389: 88 | B389: 1 | C389: 1 | D389: 邪恶触龙 | E389: 特腿
A390: 89 | B390: 1 | C390: 1 | D390: 邪恶触龙 | E390: 特肩
A391: 36 | B391: 1 | C391: 1 | D391: 邪恶触龙 | E391: 狂风斩书
A392: 37 | B392: 1 | C392: 1 | D392: 邪恶触龙 | E392: 逐日剑法书
A393: 38 | B393: 1 | C393: 1 | D393: 邪恶触龙 | E393: 诱惑之光书
A394: 39 | B394: 1 | C394: 1 | D394: 邪恶触龙 | E394: 流星火雨书
A395: 40 | B395: 1 | C395: 1 | D395: 邪恶触龙 | E395: 召唤神兽书
A396: 41 | B396: 1 | C396: 1 | D396: 邪恶触龙 | E396: 嗜血术书
A397: 96 | B397: 1 | C397: 1 | D397: 邪恶触龙 | E397: 怒斩
A398: 96 | B398: 1 | C398: 1 | D398: 邪恶触龙 | E398: 龙牙
A399: 96 | B399: 1 | C399: 1 | D399: 邪恶触龙 | E399: 龙纹
A400: 97 | B400: 1 | C400: 1 | D400: 邪恶触龙 | E400: 至尊屠龙
A401: 97 | B401: 1 | C401: 1 | D401: 邪恶触龙 | E401: 至尊噬魂
A402: 97 | B402: 1 | C402: 1 | D402: 邪恶触龙 | E402: 至尊逍遥扇
A403: 98 | B403: 20 | C403: 1 | D403: 邪恶触龙 | E403: 进阶丹
A404: 99 | B404: 1 | C404: 1 | D404: 邪恶触龙 | E404: 金刚石
A405: 100 | B405: 100 | C405: 1 | D405: 邪恶触龙 | E405: 2元宝
A406: 101 | B406: 10 | C406: 1 | D406: 邪恶触龙 | E406: 5元宝
A407: 102 | B407: 10 | C407: 1 | D407: 邪恶触龙 | E407: 10元宝
A408: 103 | B408: 10 | C408: 1 | D408: 邪恶触龙 | E408: 20元宝
A409: 104 | B409: 5 | C409: 1 | D409: 邪恶触龙 | E409: 50元宝
A410: 105 | B410: 6 | C410: 1 | D410: 邪恶触龙 | E410: 100元宝
A411: 106 | B411: 4 | C411: 1 | D411: 邪恶触龙 | E411: 150元宝
A412: 107 | B412: 3 | C412: 1 | D412: 邪恶触龙 | E412: 200元宝
A413: 109 | B413: 1 | C413: 1 | D413: 白野猪王 | E413: 开天
A414: 109 | B414: 1 | C414: 1 | D414: 白野猪王 | E414: 雷霆战甲
A415: 109 | B415: 1 | C415: 1 | D415: 白野猪王 | E415: 雷霆项链
A416: 109 | B416: 1 | C416: 1 | D416: 白野猪王 | E416: 雷霆戒指
A417: 109 | B417: 1 | C417: 1 | D417: 白野猪王 | E417: 雷霆头盔
A418: 109 | B418: 1 | C418: 1 | D418: 白野猪王 | E418: 雷霆护腕
A419: 109 | B419: 1 | C419: 1 | D419: 白野猪王 | E419: 雷霆腰带
A420: 109 | B420: 1 | C420: 1 | D420: 白野猪王 | E420: 雷霆战靴
A421: 109 | B421: 1 | C421: 1 | D421: 白野猪王 | E421: 震天
A422: 109 | B422: 1 | C422: 1 | D422: 白野猪王 | E422: 烈焰法袍
A423: 109 | B423: 1 | C423: 1 | D423: 白野猪王 | E423: 烈焰魔链
A424: 109 | B424: 1 | C424: 1 | D424: 白野猪王 | E424: 烈焰魔指
A425: 109 | B425: 1 | C425: 1 | D425: 白野猪王 | E425: 烈焰头盔
A426: 109 | B426: 1 | C426: 1 | D426: 白野猪王 | E426: 烈焰护腕
A427: 109 | B427: 1 | C427: 1 | D427: 白野猪王 | E427: 烈焰腰带
A428: 109 | B428: 1 | C428: 1 | D428: 白野猪王 | E428: 烈焰魔靴
A429: 109 | B429: 1 | C429: 1 | D429: 白野猪王 | E429: 玄天
A430: 109 | B430: 1 | C430: 1 | D430: 白野猪王 | E430: 光芒道袍
A431: 109 | B431: 1 | C431: 1 | D431: 白野猪王 | E431: 光芒道链
A432: 109 | B432: 1 | C432: 1 | D432: 白野猪王 | E432: 光芒道戒
A433: 109 | B433: 1 | C433: 1 | D433: 白野猪王 | E433: 光芒头盔
A434: 109 | B434: 1 | C434: 1 | D434: 白野猪王 | E434: 光芒护腕
A435: 109 | B435: 1 | C435: 1 | D435: 白野猪王 | E435: 光芒腰带
A436: 109 | B436: 1 | C436: 1 | D436: 白野猪王 | E436: 光芒道靴
A437: 83 | B437: 1 | C437: 1 | D437: 白野猪王 | E437: 混沌
A438: 83 | B438: 1 | C438: 1 | D438: 白野猪王 | E438: 白虎衣服
A439: 83 | B439: 1 | C439: 1 | D439: 白野猪王 | E439: 白虎头盔
A440: 83 | B440: 1 | C440: 1 | D440: 白野猪王 | E440: 白虎项链
A441: 83 | B441: 1 | C441: 1 | D441: 白野猪王 | E441: 白虎手镯
A442: 83 | B442: 1 | C442: 1 | D442: 白野猪王 | E442: 白虎戒指
A443: 83 | B443: 1 | C443: 1 | D443: 白野猪王 | E443: 白虎腰带
A444: 83 | B444: 1 | C444: 1 | D444: 白野猪王 | E444: 白虎鞋子
A445: 83 | B445: 1 | C445: 1 | D445: 白野猪王 | E445: 狂龙
A446: 83 | B446: 1 | C446: 1 | D446: 白野猪王 | E446: 朱雀衣服
A447: 83 | B447: 1 | C447: 1 | D447: 白野猪王 | E447: 朱雀头盔
A448: 83 | B448: 1 | C448: 1 | D448: 白野猪王 | E448: 朱雀项链
A449: 83 | B449: 1 | C449: 1 | D449: 白野猪王 | E449: 朱雀手镯
A450: 83 | B450: 1 | C450: 1 | D450: 白野猪王 | E450: 朱雀戒指
A451: 83 | B451: 1 | C451: 1 | D451: 白野猪王 | E451: 朱雀腰带
A452: 83 | B452: 1 | C452: 1 | D452: 白野猪王 | E452: 朱雀鞋子
A453: 83 | B453: 1 | C453: 1 | D453: 白野猪王 | E453: 天蛇
A454: 83 | B454: 1 | C454: 1 | D454: 白野猪王 | E454: 青龙衣服
A455: 83 | B455: 1 | C455: 1 | D455: 白野猪王 | E455: 青龙头盔
A456: 83 | B456: 1 | C456: 1 | D456: 白野猪王 | E456: 青龙项链
A457: 83 | B457: 1 | C457: 1 | D457: 白野猪王 | E457: 青龙手镯
A458: 83 | B458: 1 | C458: 1 | D458: 白野猪王 | E458: 青龙戒指
A459: 83 | B459: 1 | C459: 1 | D459: 白野猪王 | E459: 青龙腰带
A460: 83 | B460: 1 | C460: 1 | D460: 白野猪王 | E460: 青龙鞋子
A461: 111 | B461: 1 | C461: 3 | D461: 白野猪王 | E461: 战刃
A462: 111 | B462: 1 | C462: 3 | D462: 白野猪王 | E462: 圣武衣服
A463: 111 | B463: 1 | C463: 3 | D463: 白野猪王 | E463: 圣武项链
A464: 111 | B464: 1 | C464: 3 | D464: 白野猪王 | E464: 圣武戒指
A465: 111 | B465: 1 | C465: 3 | D465: 白野猪王 | E465: 圣武头盔
A466: 111 | B466: 1 | C466: 3 | D466: 白野猪王 | E466: 圣武手镯
A467: 111 | B467: 1 | C467: 3 | D467: 白野猪王 | E467: 圣武腰带
A468: 111 | B468: 1 | C468: 3 | D468: 白野猪王 | E468: 圣武鞋子
A469: 111 | B469: 1 | C469: 3 | D469: 白野猪王 | E469: 轮回
A470: 111 | B470: 1 | C470: 3 | D470: 白野猪王 | E470: 圣魔衣服
A471: 111 | B471: 1 | C471: 3 | D471: 白野猪王 | E471: 圣魔项链
A472: 111 | B472: 1 | C472: 3 | D472: 白野猪王 | E472: 圣魔戒指
A473: 111 | B473: 1 | C473: 3 | D473: 白野猪王 | E473: 圣魔头盔
A474: 111 | B474: 1 | C474: 3 | D474: 白野猪王 | E474: 圣魔手镯
A475: 111 | B475: 1 | C475: 3 | D475: 白野猪王 | E475: 圣魔腰带
A476: 111 | B476: 1 | C476: 3 | D476: 白野猪王 | E476: 圣魔鞋子
A477: 111 | B477: 1 | C477: 3 | D477: 白野猪王 | E477: 太虚
A478: 111 | B478: 1 | C478: 3 | D478: 白野猪王 | E478: 圣魂衣服
A479: 111 | B479: 1 | C479: 3 | D479: 白野猪王 | E479: 圣魂项链
A480: 111 | B480: 1 | C480: 3 | D480: 白野猪王 | E480: 圣魂戒指
A481: 111 | B481: 1 | C481: 3 | D481: 白野猪王 | E481: 圣魂头盔
A482: 111 | B482: 1 | C482: 3 | D482: 白野猪王 | E482: 圣魂手镯
A483: 111 | B483: 1 | C483: 3 | D483: 白野猪王 | E483: 圣魂腰带
A484: 111 | B484: 1 | C484: 3 | D484: 白野猪王 | E484: 圣魂鞋子
A485: 112 | B485: 1 | C485: 7 | D485: 白野猪王 | E485: 麻痹戒指
A486: 112 | B486: 1 | C486: 7 | D486: 白野猪王 | E486: 护身戒指
A487: 112 | B487: 1 | C487: 7 | D487: 白野猪王 | E487: 复活戒指
A488: 113 | B488: 5 | C488: 1 | D488: 白野猪王 | E488: 上古神石
A489: 114 | B489: 1 | C489: 1 | D489: 白野猪王 | E489: 特面
A490: 115 | B490: 1 | C490: 1 | D490: 白野猪王 | E490: 特腿
A491: 116 | B491: 1 | C491: 1 | D491: 白野猪王 | E491: 特肩
A492: 36 | B492: 1 | C492: 1 | D492: 白野猪王 | E492: 狂风斩书
A493: 37 | B493: 1 | C493: 1 | D493: 白野猪王 | E493: 逐日剑法书
A494: 38 | B494: 1 | C494: 1 | D494: 白野猪王 | E494: 诱惑之光书
A495: 39 | B495: 1 | C495: 1 | D495: 白野猪王 | E495: 流星火雨书
A496: 40 | B496: 1 | C496: 1 | D496: 白野猪王 | E496: 召唤神兽书
A497: 41 | B497: 1 | C497: 1 | D497: 白野猪王 | E497: 嗜血术书
A498: 123 | B498: 1 | C498: 1 | D498: 白野猪王 | E498: 怒斩
A499: 123 | B499: 1 | C499: 1 | D499: 白野猪王 | E499: 龙牙
A500: 123 | B500: 1 | C500: 1 | D500: 白野猪王 | E500: 龙纹
A501: 124 | B501: 1 | C501: 1 | D501: 白野猪王 | E501: 至尊屠龙
A502: 124 | B502: 1 | C502: 1 | D502: 白野猪王 | E502: 至尊噬魂
A503: 124 | B503: 1 | C503: 1 | D503: 白野猪王 | E503: 至尊逍遥扇
A504: 125 | B504: 20 | C504: 1 | D504: 白野猪王 | E504: 进阶丹
A505: 126 | B505: 1 | C505: 1 | D505: 白野猪王 | E505: 金刚石
A506: 127 | B506: 100 | C506: 1 | D506: 白野猪王 | E506: 2元宝
A507: 128 | B507: 10 | C507: 1 | D507: 白野猪王 | E507: 5元宝
A508: 129 | B508: 10 | C508: 1 | D508: 白野猪王 | E508: 10元宝
A509: 130 | B509: 10 | C509: 1 | D509: 白野猪王 | E509: 20元宝
A510: 131 | B510: 5 | C510: 1 | D510: 白野猪王 | E510: 50元宝
A511: 132 | B511: 6 | C511: 1 | D511: 白野猪王 | E511: 100元宝
A512: 133 | B512: 4 | C512: 1 | D512: 白野猪王 | E512: 150元宝
A513: 134 | B513: 3 | C513: 1 | D513: 白野猪王 | E513: 200元宝
A514: 136 | B514: 1 | C514: 1 | D514: 祖玛教主 | E514: 开天
A515: 136 | B515: 1 | C515: 1 | D515: 祖玛教主 | E515: 雷霆战甲
A516: 136 | B516: 1 | C516: 1 | D516: 祖玛教主 | E516: 雷霆项链
A517: 136 | B517: 1 | C517: 1 | D517: 祖玛教主 | E517: 雷霆戒指
A518: 136 | B518: 1 | C518: 1 | D518: 祖玛教主 | E518: 雷霆头盔
A519: 136 | B519: 1 | C519: 1 | D519: 祖玛教主 | E519: 雷霆护腕
A520: 136 | B520: 1 | C520: 1 | D520: 祖玛教主 | E520: 雷霆腰带
A521: 136 | B521: 1 | C521: 1 | D521: 祖玛教主 | E521: 雷霆战靴
A522: 136 | B522: 1 | C522: 1 | D522: 祖玛教主 | E522: 震天
A523: 136 | B523: 1 | C523: 1 | D523: 祖玛教主 | E523: 烈焰法袍
A524: 136 | B524: 1 | C524: 1 | D524: 祖玛教主 | E524: 烈焰魔链
A525: 136 | B525: 1 | C525: 1 | D525: 祖玛教主 | E525: 烈焰魔指
A526: 136 | B526: 1 | C526: 1 | D526: 祖玛教主 | E526: 烈焰头盔
A527: 136 | B527: 1 | C527: 1 | D527: 祖玛教主 | E527: 烈焰护腕
A528: 136 | B528: 1 | C528: 1 | D528: 祖玛教主 | E528: 烈焰腰带
A529: 136 | B529: 1 | C529: 1 | D529: 祖玛教主 | E529: 烈焰魔靴
A530: 136 | B530: 1 | C530: 1 | D530: 祖玛教主 | E530: 玄天
A531: 136 | B531: 1 | C531: 1 | D531: 祖玛教主 | E531: 光芒道袍
A532: 136 | B532: 1 | C532: 1 | D532: 祖玛教主 | E532: 光芒道链
A533: 136 | B533: 1 | C533: 1 | D533: 祖玛教主 | E533: 光芒道戒
A534: 136 | B534: 1 | C534: 1 | D534: 祖玛教主 | E534: 光芒头盔
A535: 136 | B535: 1 | C535: 1 | D535: 祖玛教主 | E535: 光芒护腕
A536: 136 | B536: 1 | C536: 1 | D536: 祖玛教主 | E536: 光芒腰带
A537: 136 | B537: 1 | C537: 1 | D537: 祖玛教主 | E537: 光芒道靴
A538: 83 | B538: 1 | C538: 1 | D538: 祖玛教主 | E538: 混沌
A539: 83 | B539: 1 | C539: 1 | D539: 祖玛教主 | E539: 白虎衣服
A540: 83 | B540: 1 | C540: 1 | D540: 祖玛教主 | E540: 白虎头盔
A541: 83 | B541: 1 | C541: 1 | D541: 祖玛教主 | E541: 白虎项链
A542: 83 | B542: 1 | C542: 1 | D542: 祖玛教主 | E542: 白虎手镯
A543: 83 | B543: 1 | C543: 1 | D543: 祖玛教主 | E543: 白虎戒指
A544: 83 | B544: 1 | C544: 1 | D544: 祖玛教主 | E544: 白虎腰带
A545: 83 | B545: 1 | C545: 1 | D545: 祖玛教主 | E545: 白虎鞋子
A546: 83 | B546: 1 | C546: 1 | D546: 祖玛教主 | E546: 狂龙
A547: 83 | B547: 1 | C547: 1 | D547: 祖玛教主 | E547: 朱雀衣服
A548: 83 | B548: 1 | C548: 1 | D548: 祖玛教主 | E548: 朱雀头盔
A549: 83 | B549: 1 | C549: 1 | D549: 祖玛教主 | E549: 朱雀项链
A550: 83 | B550: 1 | C550: 1 | D550: 祖玛教主 | E550: 朱雀手镯
A551: 83 | B551: 1 | C551: 1 | D551: 祖玛教主 | E551: 朱雀戒指
A552: 83 | B552: 1 | C552: 1 | D552: 祖玛教主 | E552: 朱雀腰带
A553: 83 | B553: 1 | C553: 1 | D553: 祖玛教主 | E553: 朱雀鞋子
A554: 83 | B554: 1 | C554: 1 | D554: 祖玛教主 | E554: 天蛇
A555: 83 | B555: 1 | C555: 1 | D555: 祖玛教主 | E555: 青龙衣服
A556: 83 | B556: 1 | C556: 1 | D556: 祖玛教主 | E556: 青龙头盔
A557: 83 | B557: 1 | C557: 1 | D557: 祖玛教主 | E557: 青龙项链
A558: 83 | B558: 1 | C558: 1 | D558: 祖玛教主 | E558: 青龙手镯
A559: 83 | B559: 1 | C559: 1 | D559: 祖玛教主 | E559: 青龙戒指
A560: 83 | B560: 1 | C560: 1 | D560: 祖玛教主 | E560: 青龙腰带
A561: 83 | B561: 1 | C561: 1 | D561: 祖玛教主 | E561: 青龙鞋子
A562: 138 | B562: 1 | C562: 3 | D562: 祖玛教主 | E562: 战刃
A563: 138 | B563: 1 | C563: 3 | D563: 祖玛教主 | E563: 圣武衣服
A564: 138 | B564: 1 | C564: 3 | D564: 祖玛教主 | E564: 圣武项链
A565: 138 | B565: 1 | C565: 3 | D565: 祖玛教主 | E565: 圣武戒指
A566: 138 | B566: 1 | C566: 3 | D566: 祖玛教主 | E566: 圣武头盔
A567: 138 | B567: 1 | C567: 3 | D567: 祖玛教主 | E567: 圣武手镯
A568: 138 | B568: 1 | C568: 3 | D568: 祖玛教主 | E568: 圣武腰带
A569: 138 | B569: 1 | C569: 3 | D569: 祖玛教主 | E569: 圣武鞋子
A570: 138 | B570: 1 | C570: 3 | D570: 祖玛教主 | E570: 轮回
A571: 138 | B571: 1 | C571: 3 | D571: 祖玛教主 | E571: 圣魔衣服
A572: 138 | B572: 1 | C572: 3 | D572: 祖玛教主 | E572: 圣魔项链
A573: 138 | B573: 1 | C573: 3 | D573: 祖玛教主 | E573: 圣魔戒指
A574: 138 | B574: 1 | C574: 3 | D574: 祖玛教主 | E574: 圣魔头盔
A575: 138 | B575: 1 | C575: 3 | D575: 祖玛教主 | E575: 圣魔手镯
A576: 138 | B576: 1 | C576: 3 | D576: 祖玛教主 | E576: 圣魔腰带
A577: 138 | B577: 1 | C577: 3 | D577: 祖玛教主 | E577: 圣魔鞋子
A578: 138 | B578: 1 | C578: 3 | D578: 祖玛教主 | E578: 太虚
A579: 138 | B579: 1 | C579: 3 | D579: 祖玛教主 | E579: 圣魂衣服
A580: 138 | B580: 1 | C580: 3 | D580: 祖玛教主 | E580: 圣魂项链
A581: 138 | B581: 1 | C581: 3 | D581: 祖玛教主 | E581: 圣魂戒指
A582: 138 | B582: 1 | C582: 3 | D582: 祖玛教主 | E582: 圣魂头盔
A583: 138 | B583: 1 | C583: 3 | D583: 祖玛教主 | E583: 圣魂手镯
A584: 138 | B584: 1 | C584: 3 | D584: 祖玛教主 | E584: 圣魂腰带
A585: 138 | B585: 1 | C585: 3 | D585: 祖玛教主 | E585: 圣魂鞋子
A586: 139 | B586: 1 | C586: 7 | D586: 祖玛教主 | E586: 麻痹戒指
A587: 139 | B587: 1 | C587: 7 | D587: 祖玛教主 | E587: 护身戒指
A588: 139 | B588: 1 | C588: 7 | D588: 祖玛教主 | E588: 复活戒指
A589: 140 | B589: 5 | C589: 1 | D589: 祖玛教主 | E589: 上古神石
A590: 141 | B590: 1 | C590: 1 | D590: 祖玛教主 | E590: 特面
A591: 142 | B591: 1 | C591: 1 | D591: 祖玛教主 | E591: 特腿
A592: 143 | B592: 1 | C592: 1 | D592: 祖玛教主 | E592: 特肩
A593: 36 | B593: 1 | C593: 1 | D593: 祖玛教主 | E593: 狂风斩书
A594: 37 | B594: 1 | C594: 1 | D594: 祖玛教主 | E594: 逐日剑法书
A595: 38 | B595: 1 | C595: 1 | D595: 祖玛教主 | E595: 诱惑之光书
A596: 39 | B596: 1 | C596: 1 | D596: 祖玛教主 | E596: 流星火雨书
A597: 40 | B597: 1 | C597: 1 | D597: 祖玛教主 | E597: 召唤神兽书
A598: 41 | B598: 1 | C598: 1 | D598: 祖玛教主 | E598: 嗜血术书
A599: 150 | B599: 1 | C599: 1 | D599: 祖玛教主 | E599: 怒斩
A600: 150 | B600: 1 | C600: 1 | D600: 祖玛教主 | E600: 龙牙
A601: 150 | B601: 1 | C601: 1 | D601: 祖玛教主 | E601: 龙纹
A602: 151 | B602: 1 | C602: 1 | D602: 祖玛教主 | E602: 至尊屠龙
A603: 151 | B603: 1 | C603: 1 | D603: 祖玛教主 | E603: 至尊噬魂
A604: 151 | B604: 1 | C604: 1 | D604: 祖玛教主 | E604: 至尊逍遥扇
A605: 152 | B605: 20 | C605: 1 | D605: 祖玛教主 | E605: 进阶丹
A606: 153 | B606: 1 | C606: 1 | D606: 祖玛教主 | E606: 金刚石
A607: 154 | B607: 100 | C607: 1 | D607: 祖玛教主 | E607: 2元宝
A608: 155 | B608: 10 | C608: 1 | D608: 祖玛教主 | E608: 5元宝
A609: 156 | B609: 10 | C609: 1 | D609: 祖玛教主 | E609: 10元宝
A610: 157 | B610: 10 | C610: 1 | D610: 祖玛教主 | E610: 20元宝
A611: 158 | B611: 5 | C611: 1 | D611: 祖玛教主 | E611: 50元宝
A612: 159 | B612: 6 | C612: 1 | D612: 祖玛教主 | E612: 100元宝
A613: 160 | B613: 4 | C613: 1 | D613: 祖玛教主 | E613: 150元宝
A614: 161 | B614: 3 | C614: 1 | D614: 祖玛教主 | E614: 200元宝
A615: 163 | B615: 4 | C615: 1 | D615: 赤月老魔 | E615: 开天
A616: 163 | B616: 4 | C616: 1 | D616: 赤月老魔 | E616: 雷霆战甲
A617: 163 | B617: 4 | C617: 1 | D617: 赤月老魔 | E617: 雷霆项链
A618: 163 | B618: 4 | C618: 1 | D618: 赤月老魔 | E618: 雷霆戒指
A619: 163 | B619: 4 | C619: 1 | D619: 赤月老魔 | E619: 雷霆头盔
A620: 163 | B620: 4 | C620: 1 | D620: 赤月老魔 | E620: 雷霆护腕
A621: 163 | B621: 4 | C621: 1 | D621: 赤月老魔 | E621: 雷霆腰带
A622: 163 | B622: 4 | C622: 1 | D622: 赤月老魔 | E622: 雷霆战靴
A623: 163 | B623: 4 | C623: 1 | D623: 赤月老魔 | E623: 震天
A624: 163 | B624: 4 | C624: 1 | D624: 赤月老魔 | E624: 烈焰法袍
A625: 163 | B625: 4 | C625: 1 | D625: 赤月老魔 | E625: 烈焰魔链
A626: 163 | B626: 4 | C626: 1 | D626: 赤月老魔 | E626: 烈焰魔指
A627: 163 | B627: 4 | C627: 1 | D627: 赤月老魔 | E627: 烈焰头盔
A628: 163 | B628: 4 | C628: 1 | D628: 赤月老魔 | E628: 烈焰护腕
A629: 163 | B629: 4 | C629: 1 | D629: 赤月老魔 | E629: 烈焰腰带
A630: 163 | B630: 4 | C630: 1 | D630: 赤月老魔 | E630: 烈焰魔靴
A631: 163 | B631: 4 | C631: 1 | D631: 赤月老魔 | E631: 玄天
A632: 163 | B632: 4 | C632: 1 | D632: 赤月老魔 | E632: 光芒道袍
A633: 163 | B633: 4 | C633: 1 | D633: 赤月老魔 | E633: 光芒道链
A634: 163 | B634: 4 | C634: 1 | D634: 赤月老魔 | E634: 光芒道戒
A635: 163 | B635: 4 | C635: 1 | D635: 赤月老魔 | E635: 光芒头盔
A636: 163 | B636: 4 | C636: 1 | D636: 赤月老魔 | E636: 光芒护腕
A637: 163 | B637: 4 | C637: 1 | D637: 赤月老魔 | E637: 光芒腰带
A638: 163 | B638: 4 | C638: 1 | D638: 赤月老魔 | E638: 光芒道靴
A639: 164 | B639: 1 | C639: 1 | D639: 赤月老魔 | E639: 混沌
A640: 164 | B640: 1 | C640: 1 | D640: 赤月老魔 | E640: 白虎衣服
A641: 164 | B641: 1 | C641: 1 | D641: 赤月老魔 | E641: 白虎头盔
A642: 164 | B642: 1 | C642: 1 | D642: 赤月老魔 | E642: 白虎项链
A643: 164 | B643: 1 | C643: 1 | D643: 赤月老魔 | E643: 白虎手镯
A644: 164 | B644: 1 | C644: 1 | D644: 赤月老魔 | E644: 白虎戒指
A645: 164 | B645: 1 | C645: 1 | D645: 赤月老魔 | E645: 白虎腰带
A646: 164 | B646: 1 | C646: 1 | D646: 赤月老魔 | E646: 白虎鞋子
A647: 164 | B647: 1 | C647: 1 | D647: 赤月老魔 | E647: 狂龙
A648: 164 | B648: 1 | C648: 1 | D648: 赤月老魔 | E648: 朱雀衣服
A649: 164 | B649: 1 | C649: 1 | D649: 赤月老魔 | E649: 朱雀头盔
A650: 164 | B650: 1 | C650: 1 | D650: 赤月老魔 | E650: 朱雀项链
A651: 164 | B651: 1 | C651: 1 | D651: 赤月老魔 | E651: 朱雀手镯
A652: 164 | B652: 1 | C652: 1 | D652: 赤月老魔 | E652: 朱雀戒指
A653: 164 | B653: 1 | C653: 1 | D653: 赤月老魔 | E653: 朱雀腰带
A654: 164 | B654: 1 | C654: 1 | D654: 赤月老魔 | E654: 朱雀鞋子
A655: 164 | B655: 1 | C655: 1 | D655: 赤月老魔 | E655: 天蛇
A656: 164 | B656: 1 | C656: 1 | D656: 赤月老魔 | E656: 青龙衣服
A657: 164 | B657: 1 | C657: 1 | D657: 赤月老魔 | E657: 青龙头盔
A658: 164 | B658: 1 | C658: 1 | D658: 赤月老魔 | E658: 青龙项链
A659: 164 | B659: 1 | C659: 1 | D659: 赤月老魔 | E659: 青龙手镯
A660: 164 | B660: 1 | C660: 1 | D660: 赤月老魔 | E660: 青龙戒指
A661: 164 | B661: 1 | C661: 1 | D661: 赤月老魔 | E661: 青龙腰带
A662: 164 | B662: 1 | C662: 1 | D662: 赤月老魔 | E662: 青龙鞋子
A663: 165 | B663: 1 | C663: 3 | D663: 赤月老魔 | E663: 战刃
A664: 165 | B664: 1 | C664: 3 | D664: 赤月老魔 | E664: 圣武衣服
A665: 165 | B665: 1 | C665: 3 | D665: 赤月老魔 | E665: 圣武项链
A666: 165 | B666: 1 | C666: 3 | D666: 赤月老魔 | E666: 圣武戒指
A667: 165 | B667: 1 | C667: 3 | D667: 赤月老魔 | E667: 圣武头盔
A668: 165 | B668: 1 | C668: 3 | D668: 赤月老魔 | E668: 圣武手镯
A669: 165 | B669: 1 | C669: 3 | D669: 赤月老魔 | E669: 圣武腰带
A670: 165 | B670: 1 | C670: 3 | D670: 赤月老魔 | E670: 圣武鞋子
A671: 165 | B671: 1 | C671: 3 | D671: 赤月老魔 | E671: 轮回
A672: 165 | B672: 1 | C672: 3 | D672: 赤月老魔 | E672: 圣魔衣服
A673: 165 | B673: 1 | C673: 3 | D673: 赤月老魔 | E673: 圣魔项链
A674: 165 | B674: 1 | C674: 3 | D674: 赤月老魔 | E674: 圣魔戒指
A675: 165 | B675: 1 | C675: 3 | D675: 赤月老魔 | E675: 圣魔头盔
A676: 165 | B676: 1 | C676: 3 | D676: 赤月老魔 | E676: 圣魔手镯
A677: 165 | B677: 1 | C677: 3 | D677: 赤月老魔 | E677: 圣魔腰带
A678: 165 | B678: 1 | C678: 3 | D678: 赤月老魔 | E678: 圣魔鞋子
A679: 165 | B679: 1 | C679: 3 | D679: 赤月老魔 | E679: 太虚
A680: 165 | B680: 1 | C680: 3 | D680: 赤月老魔 | E680: 圣魂衣服
A681: 165 | B681: 1 | C681: 3 | D681: 赤月老魔 | E681: 圣魂项链
A682: 165 | B682: 1 | C682: 3 | D682: 赤月老魔 | E682: 圣魂戒指
A683: 165 | B683: 1 | C683: 3 | D683: 赤月老魔 | E683: 圣魂头盔
A684: 165 | B684: 1 | C684: 3 | D684: 赤月老魔 | E684: 圣魂手镯
A685: 165 | B685: 1 | C685: 3 | D685: 赤月老魔 | E685: 圣魂腰带
A686: 165 | B686: 1 | C686: 3 | D686: 赤月老魔 | E686: 圣魂鞋子
A687: 166 | B687: 1 | C687: 7 | D687: 赤月老魔 | E687: 麻痹戒指
A688: 166 | B688: 1 | C688: 7 | D688: 赤月老魔 | E688: 护身戒指
A689: 166 | B689: 1 | C689: 7 | D689: 赤月老魔 | E689: 复活戒指
A690: 167 | B690: 5 | C690: 1 | D690: 赤月老魔 | E690: 上古神石
A691: 168 | B691: 1 | C691: 1 | D691: 赤月老魔 | E691: 特面
A692: 169 | B692: 1 | C692: 1 | D692: 赤月老魔 | E692: 特腿
A693: 170 | B693: 1 | C693: 1 | D693: 赤月老魔 | E693: 特肩
A694: 36 | B694: 1 | C694: 1 | D694: 赤月老魔 | E694: 狂风斩书
A695: 37 | B695: 1 | C695: 1 | D695: 赤月老魔 | E695: 逐日剑法书
A696: 38 | B696: 1 | C696: 1 | D696: 赤月老魔 | E696: 诱惑之光书
A697: 39 | B697: 1 | C697: 1 | D697: 赤月老魔 | E697: 流星火雨书
A698: 40 | B698: 1 | C698: 1 | D698: 赤月老魔 | E698: 召唤神兽书
A699: 41 | B699: 1 | C699: 1 | D699: 赤月老魔 | E699: 嗜血术书
A700: 177 | B700: 1 | C700: 1 | D700: 赤月老魔 | E700: 怒斩
A701: 177 | B701: 1 | C701: 1 | D701: 赤月老魔 | E701: 龙牙
A702: 177 | B702: 1 | C702: 1 | D702: 赤月老魔 | E702: 龙纹
A703: 178 | B703: 1 | C703: 1 | D703: 赤月老魔 | E703: 至尊屠龙
A704: 178 | B704: 1 | C704: 1 | D704: 赤月老魔 | E704: 至尊噬魂
A705: 178 | B705: 1 | C705: 1 | D705: 赤月老魔 | E705: 至尊逍遥扇
A706: 179 | B706: 22 | C706: 1 | D706: 赤月老魔 | E706: 进阶丹
A707: 180 | B707: 5 | C707: 1 | D707: 赤月老魔 | E707: 金刚石
A708: 181 | B708: 100 | C708: 1 | D708: 赤月老魔 | E708: 2元宝
A709: 182 | B709: 10 | C709: 1 | D709: 赤月老魔 | E709: 5元宝
A710: 183 | B710: 10 | C710: 1 | D710: 赤月老魔 | E710: 10元宝
A711: 184 | B711: 10 | C711: 1 | D711: 赤月老魔 | E711: 20元宝
A712: 185 | B712: 5 | C712: 1 | D712: 赤月老魔 | E712: 50元宝
A713: 186 | B713: 5 | C713: 1 | D713: 赤月老魔 | E713: 100元宝
A714: 187 | B714: 4 | C714: 1 | D714: 赤月老魔 | E714: 150元宝
A715: 188 | B715: 3 | C715: 1 | D715: 赤月老魔 | E715: 200元宝
A716: 190 | B716: 1 | C716: 1 | D716: 巨型多角虫 | E716: 开天
A717: 190 | B717: 1 | C717: 1 | D717: 巨型多角虫 | E717: 雷霆战甲
A718: 190 | B718: 1 | C718: 1 | D718: 巨型多角虫 | E718: 雷霆项链
A719: 190 | B719: 1 | C719: 1 | D719: 巨型多角虫 | E719: 雷霆戒指
A720: 190 | B720: 1 | C720: 1 | D720: 巨型多角虫 | E720: 雷霆头盔
A721: 190 | B721: 1 | C721: 1 | D721: 巨型多角虫 | E721: 雷霆护腕
A722: 190 | B722: 1 | C722: 1 | D722: 巨型多角虫 | E722: 雷霆腰带
A723: 190 | B723: 1 | C723: 1 | D723: 巨型多角虫 | E723: 雷霆战靴
A724: 190 | B724: 1 | C724: 1 | D724: 巨型多角虫 | E724: 震天
A725: 190 | B725: 1 | C725: 1 | D725: 巨型多角虫 | E725: 烈焰法袍
A726: 190 | B726: 1 | C726: 1 | D726: 巨型多角虫 | E726: 烈焰魔链
A727: 190 | B727: 1 | C727: 1 | D727: 巨型多角虫 | E727: 烈焰魔指
A728: 190 | B728: 1 | C728: 1 | D728: 巨型多角虫 | E728: 烈焰头盔
A729: 190 | B729: 1 | C729: 1 | D729: 巨型多角虫 | E729: 烈焰护腕
A730: 190 | B730: 1 | C730: 1 | D730: 巨型多角虫 | E730: 烈焰腰带
A731: 190 | B731: 1 | C731: 1 | D731: 巨型多角虫 | E731: 烈焰魔靴
A732: 190 | B732: 1 | C732: 1 | D732: 巨型多角虫 | E732: 玄天
A733: 190 | B733: 1 | C733: 1 | D733: 巨型多角虫 | E733: 光芒道袍
A734: 190 | B734: 1 | C734: 1 | D734: 巨型多角虫 | E734: 光芒道链
A735: 190 | B735: 1 | C735: 1 | D735: 巨型多角虫 | E735: 光芒道戒
A736: 190 | B736: 1 | C736: 1 | D736: 巨型多角虫 | E736: 光芒头盔
A737: 190 | B737: 1 | C737: 1 | D737: 巨型多角虫 | E737: 光芒护腕
A738: 190 | B738: 1 | C738: 1 | D738: 巨型多角虫 | E738: 光芒腰带
A739: 190 | B739: 1 | C739: 1 | D739: 巨型多角虫 | E739: 光芒道靴
A740: 191 | B740: 1 | C740: 1 | D740: 巨型多角虫 | E740: 混沌
A741: 191 | B741: 1 | C741: 1 | D741: 巨型多角虫 | E741: 白虎衣服
A742: 191 | B742: 1 | C742: 1 | D742: 巨型多角虫 | E742: 白虎头盔
A743: 191 | B743: 1 | C743: 1 | D743: 巨型多角虫 | E743: 白虎项链
A744: 191 | B744: 1 | C744: 1 | D744: 巨型多角虫 | E744: 白虎手镯
A745: 191 | B745: 1 | C745: 1 | D745: 巨型多角虫 | E745: 白虎戒指
A746: 191 | B746: 1 | C746: 1 | D746: 巨型多角虫 | E746: 白虎腰带
A747: 191 | B747: 1 | C747: 1 | D747: 巨型多角虫 | E747: 白虎鞋子
A748: 191 | B748: 1 | C748: 1 | D748: 巨型多角虫 | E748: 狂龙
A749: 191 | B749: 1 | C749: 1 | D749: 巨型多角虫 | E749: 朱雀衣服
A750: 191 | B750: 1 | C750: 1 | D750: 巨型多角虫 | E750: 朱雀头盔
A751: 191 | B751: 1 | C751: 1 | D751: 巨型多角虫 | E751: 朱雀项链
A752: 191 | B752: 1 | C752: 1 | D752: 巨型多角虫 | E752: 朱雀手镯
A753: 191 | B753: 1 | C753: 1 | D753: 巨型多角虫 | E753: 朱雀戒指
A754: 191 | B754: 1 | C754: 1 | D754: 巨型多角虫 | E754: 朱雀腰带
A755: 191 | B755: 1 | C755: 1 | D755: 巨型多角虫 | E755: 朱雀鞋子
A756: 191 | B756: 1 | C756: 1 | D756: 巨型多角虫 | E756: 天蛇
A757: 191 | B757: 1 | C757: 1 | D757: 巨型多角虫 | E757: 青龙衣服
A758: 191 | B758: 1 | C758: 1 | D758: 巨型多角虫 | E758: 青龙头盔
A759: 191 | B759: 1 | C759: 1 | D759: 巨型多角虫 | E759: 青龙项链
A760: 191 | B760: 1 | C760: 1 | D760: 巨型多角虫 | E760: 青龙手镯
A761: 191 | B761: 1 | C761: 1 | D761: 巨型多角虫 | E761: 青龙戒指
A762: 191 | B762: 1 | C762: 1 | D762: 巨型多角虫 | E762: 青龙腰带
A763: 191 | B763: 1 | C763: 1 | D763: 巨型多角虫 | E763: 青龙鞋子
A764: 192 | B764: 1 | C764: 3 | D764: 巨型多角虫 | E764: 战刃
A765: 192 | B765: 1 | C765: 3 | D765: 巨型多角虫 | E765: 圣武衣服
A766: 192 | B766: 1 | C766: 3 | D766: 巨型多角虫 | E766: 圣武项链
A767: 192 | B767: 1 | C767: 3 | D767: 巨型多角虫 | E767: 圣武戒指
A768: 192 | B768: 1 | C768: 3 | D768: 巨型多角虫 | E768: 圣武头盔
A769: 192 | B769: 1 | C769: 3 | D769: 巨型多角虫 | E769: 圣武手镯
A770: 192 | B770: 1 | C770: 3 | D770: 巨型多角虫 | E770: 圣武腰带
A771: 192 | B771: 1 | C771: 3 | D771: 巨型多角虫 | E771: 圣武鞋子
A772: 192 | B772: 1 | C772: 3 | D772: 巨型多角虫 | E772: 轮回
A773: 192 | B773: 1 | C773: 3 | D773: 巨型多角虫 | E773: 圣魔衣服
A774: 192 | B774: 1 | C774: 3 | D774: 巨型多角虫 | E774: 圣魔项链
A775: 192 | B775: 1 | C775: 3 | D775: 巨型多角虫 | E775: 圣魔戒指
A776: 192 | B776: 1 | C776: 3 | D776: 巨型多角虫 | E776: 圣魔头盔
A777: 192 | B777: 1 | C777: 3 | D777: 巨型多角虫 | E777: 圣魔手镯
A778: 192 | B778: 1 | C778: 3 | D778: 巨型多角虫 | E778: 圣魔腰带
A779: 192 | B779: 1 | C779: 3 | D779: 巨型多角虫 | E779: 圣魔鞋子
A780: 192 | B780: 1 | C780: 3 | D780: 巨型多角虫 | E780: 太虚
A781: 192 | B781: 1 | C781: 3 | D781: 巨型多角虫 | E781: 圣魂衣服
A782: 192 | B782: 1 | C782: 3 | D782: 巨型多角虫 | E782: 圣魂项链
A783: 192 | B783: 1 | C783: 3 | D783: 巨型多角虫 | E783: 圣魂戒指
A784: 192 | B784: 1 | C784: 3 | D784: 巨型多角虫 | E784: 圣魂头盔
A785: 192 | B785: 1 | C785: 3 | D785: 巨型多角虫 | E785: 圣魂手镯
A786: 192 | B786: 1 | C786: 3 | D786: 巨型多角虫 | E786: 圣魂腰带
A787: 192 | B787: 1 | C787: 3 | D787: 巨型多角虫 | E787: 圣魂鞋子
A788: 193 | B788: 1 | C788: 7 | D788: 巨型多角虫 | E788: 麻痹戒指
A789: 193 | B789: 1 | C789: 7 | D789: 巨型多角虫 | E789: 护身戒指
A790: 193 | B790: 1 | C790: 7 | D790: 巨型多角虫 | E790: 复活戒指
A791: 194 | B791: 5 | C791: 1 | D791: 巨型多角虫 | E791: 上古神石
A792: 195 | B792: 1 | C792: 1 | D792: 巨型多角虫 | E792: 特面
A793: 196 | B793: 1 | C793: 1 | D793: 巨型多角虫 | E793: 特腿
A794: 197 | B794: 1 | C794: 1 | D794: 巨型多角虫 | E794: 特肩
A795: 36 | B795: 1 | C795: 1 | D795: 巨型多角虫 | E795: 狂风斩书
A796: 37 | B796: 1 | C796: 1 | D796: 巨型多角虫 | E796: 逐日剑法书
A797: 38 | B797: 1 | C797: 1 | D797: 巨型多角虫 | E797: 诱惑之光书
A798: 39 | B798: 1 | C798: 1 | D798: 巨型多角虫 | E798: 流星火雨书
A799: 40 | B799: 1 | C799: 1 | D799: 巨型多角虫 | E799: 召唤神兽书
A800: 41 | B800: 1 | C800: 1 | D800: 巨型多角虫 | E800: 嗜血术书
A801: 204 | B801: 1 | C801: 1 | D801: 巨型多角虫 | E801: 怒斩
A802: 204 | B802: 1 | C802: 1 | D802: 巨型多角虫 | E802: 龙牙
A803: 204 | B803: 1 | C803: 1 | D803: 巨型多角虫 | E803: 龙纹
A804: 205 | B804: 1 | C804: 1 | D804: 巨型多角虫 | E804: 至尊屠龙
A805: 205 | B805: 1 | C805: 1 | D805: 巨型多角虫 | E805: 至尊噬魂
A806: 205 | B806: 1 | C806: 1 | D806: 巨型多角虫 | E806: 至尊逍遥扇
A807: 206 | B807: 20 | C807: 1 | D807: 巨型多角虫 | E807: 进阶丹
A808: 207 | B808: 1 | C808: 1 | D808: 巨型多角虫 | E808: 金刚石
A809: 208 | B809: 100 | C809: 1 | D809: 巨型多角虫 | E809: 2元宝
A810: 209 | B810: 10 | C810: 1 | D810: 巨型多角虫 | E810: 5元宝
A811: 210 | B811: 10 | C811: 1 | D811: 巨型多角虫 | E811: 10元宝
A812: 211 | B812: 10 | C812: 1 | D812: 巨型多角虫 | E812: 20元宝
A813: 212 | B813: 5 | C813: 1 | D813: 巨型多角虫 | E813: 50元宝
A814: 213 | B814: 6 | C814: 1 | D814: 巨型多角虫 | E814: 100元宝
A815: 214 | B815: 4 | C815: 1 | D815: 巨型多角虫 | E815: 150元宝
A816: 215 | B816: 3 | C816: 1 | D816: 巨型多角虫 | E816: 200元宝
A817: 217 | B817: 1 | C817: 1 | D817: 巨型钳虫 | E817: 开天
A818: 217 | B818: 1 | C818: 1 | D818: 巨型钳虫 | E818: 雷霆战甲
A819: 217 | B819: 1 | C819: 1 | D819: 巨型钳虫 | E819: 雷霆项链
A820: 217 | B820: 1 | C820: 1 | D820: 巨型钳虫 | E820: 雷霆戒指
A821: 217 | B821: 1 | C821: 1 | D821: 巨型钳虫 | E821: 雷霆头盔
A822: 217 | B822: 1 | C822: 1 | D822: 巨型钳虫 | E822: 雷霆护腕
A823: 217 | B823: 1 | C823: 1 | D823: 巨型钳虫 | E823: 雷霆腰带
A824: 217 | B824: 1 | C824: 1 | D824: 巨型钳虫 | E824: 雷霆战靴
A825: 217 | B825: 1 | C825: 1 | D825: 巨型钳虫 | E825: 震天
A826: 217 | B826: 1 | C826: 1 | D826: 巨型钳虫 | E826: 烈焰法袍
A827: 217 | B827: 1 | C827: 1 | D827: 巨型钳虫 | E827: 烈焰魔链
A828: 217 | B828: 1 | C828: 1 | D828: 巨型钳虫 | E828: 烈焰魔指
A829: 217 | B829: 1 | C829: 1 | D829: 巨型钳虫 | E829: 烈焰头盔
A830: 217 | B830: 1 | C830: 1 | D830: 巨型钳虫 | E830: 烈焰护腕
A831: 217 | B831: 1 | C831: 1 | D831: 巨型钳虫 | E831: 烈焰腰带
A832: 217 | B832: 1 | C832: 1 | D832: 巨型钳虫 | E832: 烈焰魔靴
A833: 217 | B833: 1 | C833: 1 | D833: 巨型钳虫 | E833: 玄天
A834: 217 | B834: 1 | C834: 1 | D834: 巨型钳虫 | E834: 光芒道袍
A835: 217 | B835: 1 | C835: 1 | D835: 巨型钳虫 | E835: 光芒道链
A836: 217 | B836: 1 | C836: 1 | D836: 巨型钳虫 | E836: 光芒道戒
A837: 217 | B837: 1 | C837: 1 | D837: 巨型钳虫 | E837: 光芒头盔
A838: 217 | B838: 1 | C838: 1 | D838: 巨型钳虫 | E838: 光芒护腕
A839: 217 | B839: 1 | C839: 1 | D839: 巨型钳虫 | E839: 光芒腰带
A840: 217 | B840: 1 | C840: 1 | D840: 巨型钳虫 | E840: 光芒道靴
A841: 218 | B841: 1 | C841: 1 | D841: 巨型钳虫 | E841: 混沌
A842: 218 | B842: 1 | C842: 1 | D842: 巨型钳虫 | E842: 白虎衣服
A843: 218 | B843: 1 | C843: 1 | D843: 巨型钳虫 | E843: 白虎头盔
A844: 218 | B844: 1 | C844: 1 | D844: 巨型钳虫 | E844: 白虎项链
A845: 218 | B845: 1 | C845: 1 | D845: 巨型钳虫 | E845: 白虎手镯
A846: 218 | B846: 1 | C846: 1 | D846: 巨型钳虫 | E846: 白虎戒指
A847: 218 | B847: 1 | C847: 1 | D847: 巨型钳虫 | E847: 白虎腰带
A848: 218 | B848: 1 | C848: 1 | D848: 巨型钳虫 | E848: 白虎鞋子
A849: 218 | B849: 1 | C849: 1 | D849: 巨型钳虫 | E849: 狂龙
A850: 218 | B850: 1 | C850: 1 | D850: 巨型钳虫 | E850: 朱雀衣服
A851: 218 | B851: 1 | C851: 1 | D851: 巨型钳虫 | E851: 朱雀头盔
A852: 218 | B852: 1 | C852: 1 | D852: 巨型钳虫 | E852: 朱雀项链
A853: 218 | B853: 1 | C853: 1 | D853: 巨型钳虫 | E853: 朱雀手镯
A854: 218 | B854: 1 | C854: 1 | D854: 巨型钳虫 | E854: 朱雀戒指
A855: 218 | B855: 1 | C855: 1 | D855: 巨型钳虫 | E855: 朱雀腰带
A856: 218 | B856: 1 | C856: 1 | D856: 巨型钳虫 | E856: 朱雀鞋子
A857: 218 | B857: 1 | C857: 1 | D857: 巨型钳虫 | E857: 天蛇
A858: 218 | B858: 1 | C858: 1 | D858: 巨型钳虫 | E858: 青龙衣服
A859: 218 | B859: 1 | C859: 1 | D859: 巨型钳虫 | E859: 青龙头盔
A860: 218 | B860: 1 | C860: 1 | D860: 巨型钳虫 | E860: 青龙项链
A861: 218 | B861: 1 | C861: 1 | D861: 巨型钳虫 | E861: 青龙手镯
A862: 218 | B862: 1 | C862: 1 | D862: 巨型钳虫 | E862: 青龙戒指
A863: 218 | B863: 1 | C863: 1 | D863: 巨型钳虫 | E863: 青龙腰带
A864: 218 | B864: 1 | C864: 1 | D864: 巨型钳虫 | E864: 青龙鞋子
A865: 219 | B865: 1 | C865: 3 | D865: 巨型钳虫 | E865: 战刃
A866: 219 | B866: 1 | C866: 3 | D866: 巨型钳虫 | E866: 圣武衣服
A867: 219 | B867: 1 | C867: 3 | D867: 巨型钳虫 | E867: 圣武项链
A868: 219 | B868: 1 | C868: 3 | D868: 巨型钳虫 | E868: 圣武戒指
A869: 219 | B869: 1 | C869: 3 | D869: 巨型钳虫 | E869: 圣武头盔
A870: 219 | B870: 1 | C870: 3 | D870: 巨型钳虫 | E870: 圣武手镯
A871: 219 | B871: 1 | C871: 3 | D871: 巨型钳虫 | E871: 圣武腰带
A872: 219 | B872: 1 | C872: 3 | D872: 巨型钳虫 | E872: 圣武鞋子
A873: 219 | B873: 1 | C873: 3 | D873: 巨型钳虫 | E873: 轮回
A874: 219 | B874: 1 | C874: 3 | D874: 巨型钳虫 | E874: 圣魔衣服
A875: 219 | B875: 1 | C875: 3 | D875: 巨型钳虫 | E875: 圣魔项链
A876: 219 | B876: 1 | C876: 3 | D876: 巨型钳虫 | E876: 圣魔戒指
A877: 219 | B877: 1 | C877: 3 | D877: 巨型钳虫 | E877: 圣魔头盔
A878: 219 | B878: 1 | C878: 3 | D878: 巨型钳虫 | E878: 圣魔手镯
A879: 219 | B879: 1 | C879: 3 | D879: 巨型钳虫 | E879: 圣魔腰带
A880: 219 | B880: 1 | C880: 3 | D880: 巨型钳虫 | E880: 圣魔鞋子
A881: 219 | B881: 1 | C881: 3 | D881: 巨型钳虫 | E881: 太虚
A882: 219 | B882: 1 | C882: 3 | D882: 巨型钳虫 | E882: 圣魂衣服
A883: 219 | B883: 1 | C883: 3 | D883: 巨型钳虫 | E883: 圣魂项链
A884: 219 | B884: 1 | C884: 3 | D884: 巨型钳虫 | E884: 圣魂戒指
A885: 219 | B885: 1 | C885: 3 | D885: 巨型钳虫 | E885: 圣魂头盔
A886: 219 | B886: 1 | C886: 3 | D886: 巨型钳虫 | E886: 圣魂手镯
A887: 219 | B887: 1 | C887: 3 | D887: 巨型钳虫 | E887: 圣魂腰带
A888: 219 | B888: 1 | C888: 3 | D888: 巨型钳虫 | E888: 圣魂鞋子
A889: 220 | B889: 1 | C889: 7 | D889: 巨型钳虫 | E889: 麻痹戒指
A890: 220 | B890: 1 | C890: 7 | D890: 巨型钳虫 | E890: 护身戒指
A891: 220 | B891: 1 | C891: 7 | D891: 巨型钳虫 | E891: 复活戒指
A892: 221 | B892: 5 | C892: 1 | D892: 巨型钳虫 | E892: 上古神石
A893: 222 | B893: 1 | C893: 1 | D893: 巨型钳虫 | E893: 特面
A894: 223 | B894: 1 | C894: 1 | D894: 巨型钳虫 | E894: 特腿
A895: 224 | B895: 1 | C895: 1 | D895: 巨型钳虫 | E895: 特肩
A896: 36 | B896: 1 | C896: 1 | D896: 巨型钳虫 | E896: 狂风斩书
A897: 37 | B897: 1 | C897: 1 | D897: 巨型钳虫 | E897: 逐日剑法书
A898: 38 | B898: 1 | C898: 1 | D898: 巨型钳虫 | E898: 诱惑之光书
A899: 39 | B899: 1 | C899: 1 | D899: 巨型钳虫 | E899: 流星火雨书
A900: 40 | B900: 1 | C900: 1 | D900: 巨型钳虫 | E900: 召唤神兽书
A901: 41 | B901: 1 | C901: 1 | D901: 巨型钳虫 | E901: 嗜血术书
A902: 231 | B902: 1 | C902: 1 | D902: 巨型钳虫 | E902: 怒斩
A903: 231 | B903: 1 | C903: 1 | D903: 巨型钳虫 | E903: 龙牙
A904: 231 | B904: 1 | C904: 1 | D904: 巨型钳虫 | E904: 龙纹
A905: 232 | B905: 1 | C905: 1 | D905: 巨型钳虫 | E905: 至尊屠龙
A906: 232 | B906: 1 | C906: 1 | D906: 巨型钳虫 | E906: 至尊噬魂
A907: 232 | B907: 1 | C907: 1 | D907: 巨型钳虫 | E907: 至尊逍遥扇
A908: 233 | B908: 20 | C908: 1 | D908: 巨型钳虫 | E908: 进阶丹
A909: 234 | B909: 1 | C909: 1 | D909: 巨型钳虫 | E909: 金刚石
A910: 235 | B910: 100 | C910: 1 | D910: 巨型钳虫 | E910: 2元宝
A911: 236 | B911: 10 | C911: 1 | D911: 巨型钳虫 | E911: 5元宝
A912: 237 | B912: 10 | C912: 1 | D912: 巨型钳虫 | E912: 10元宝
A913: 238 | B913: 10 | C913: 1 | D913: 巨型钳虫 | E913: 20元宝
A914: 239 | B914: 5 | C914: 1 | D914: 巨型钳虫 | E914: 50元宝
A915: 240 | B915: 6 | C915: 1 | D915: 巨型钳虫 | E915: 100元宝
A916: 241 | B916: 4 | C916: 1 | D916: 巨型钳虫 | E916: 150元宝
A917: 242 | B917: 3 | C917: 1 | D917: 巨型钳虫 | E917: 200元宝
A918: 244 | B918: 3 | C918: 1 | D918: 巨型双头恶魔 | E918: 开天
A919: 244 | B919: 3 | C919: 1 | D919: 巨型双头恶魔 | E919: 雷霆战甲
A920: 244 | B920: 3 | C920: 1 | D920: 巨型双头恶魔 | E920: 雷霆项链
A921: 244 | B921: 3 | C921: 1 | D921: 巨型双头恶魔 | E921: 雷霆戒指
A922: 244 | B922: 3 | C922: 1 | D922: 巨型双头恶魔 | E922: 雷霆头盔
A923: 244 | B923: 3 | C923: 1 | D923: 巨型双头恶魔 | E923: 雷霆护腕
A924: 244 | B924: 3 | C924: 1 | D924: 巨型双头恶魔 | E924: 雷霆腰带
A925: 244 | B925: 3 | C925: 1 | D925: 巨型双头恶魔 | E925: 雷霆战靴
A926: 244 | B926: 3 | C926: 1 | D926: 巨型双头恶魔 | E926: 震天
A927: 244 | B927: 3 | C927: 1 | D927: 巨型双头恶魔 | E927: 烈焰法袍
A928: 244 | B928: 3 | C928: 1 | D928: 巨型双头恶魔 | E928: 烈焰魔链
A929: 244 | B929: 3 | C929: 1 | D929: 巨型双头恶魔 | E929: 烈焰魔指
A930: 244 | B930: 3 | C930: 1 | D930: 巨型双头恶魔 | E930: 烈焰头盔
A931: 244 | B931: 3 | C931: 1 | D931: 巨型双头恶魔 | E931: 烈焰护腕
A932: 244 | B932: 3 | C932: 1 | D932: 巨型双头恶魔 | E932: 烈焰腰带
A933: 244 | B933: 3 | C933: 1 | D933: 巨型双头恶魔 | E933: 烈焰魔靴
A934: 244 | B934: 3 | C934: 1 | D934: 巨型双头恶魔 | E934: 玄天
A935: 244 | B935: 3 | C935: 1 | D935: 巨型双头恶魔 | E935: 光芒道袍
A936: 244 | B936: 3 | C936: 1 | D936: 巨型双头恶魔 | E936: 光芒道链
A937: 244 | B937: 3 | C937: 1 | D937: 巨型双头恶魔 | E937: 光芒道戒
A938: 244 | B938: 3 | C938: 1 | D938: 巨型双头恶魔 | E938: 光芒头盔
A939: 244 | B939: 3 | C939: 1 | D939: 巨型双头恶魔 | E939: 光芒护腕
A940: 244 | B940: 3 | C940: 1 | D940: 巨型双头恶魔 | E940: 光芒腰带
A941: 244 | B941: 3 | C941: 1 | D941: 巨型双头恶魔 | E941: 光芒道靴
A942: 83 | B942: 1 | C942: 1 | D942: 巨型双头恶魔 | E942: 混沌
A943: 83 | B943: 1 | C943: 1 | D943: 巨型双头恶魔 | E943: 白虎衣服
A944: 83 | B944: 1 | C944: 1 | D944: 巨型双头恶魔 | E944: 白虎头盔
A945: 83 | B945: 1 | C945: 1 | D945: 巨型双头恶魔 | E945: 白虎项链
A946: 83 | B946: 1 | C946: 1 | D946: 巨型双头恶魔 | E946: 白虎手镯
A947: 83 | B947: 1 | C947: 1 | D947: 巨型双头恶魔 | E947: 白虎戒指
A948: 83 | B948: 1 | C948: 1 | D948: 巨型双头恶魔 | E948: 白虎腰带
A949: 83 | B949: 1 | C949: 1 | D949: 巨型双头恶魔 | E949: 白虎鞋子
A950: 83 | B950: 1 | C950: 1 | D950: 巨型双头恶魔 | E950: 狂龙
A951: 83 | B951: 1 | C951: 1 | D951: 巨型双头恶魔 | E951: 朱雀衣服
A952: 83 | B952: 1 | C952: 1 | D952: 巨型双头恶魔 | E952: 朱雀头盔
A953: 83 | B953: 1 | C953: 1 | D953: 巨型双头恶魔 | E953: 朱雀项链
A954: 83 | B954: 1 | C954: 1 | D954: 巨型双头恶魔 | E954: 朱雀手镯
A955: 83 | B955: 1 | C955: 1 | D955: 巨型双头恶魔 | E955: 朱雀戒指
A956: 83 | B956: 1 | C956: 1 | D956: 巨型双头恶魔 | E956: 朱雀腰带
A957: 83 | B957: 1 | C957: 1 | D957: 巨型双头恶魔 | E957: 朱雀鞋子
A958: 83 | B958: 1 | C958: 1 | D958: 巨型双头恶魔 | E958: 天蛇
A959: 83 | B959: 1 | C959: 1 | D959: 巨型双头恶魔 | E959: 青龙衣服
A960: 83 | B960: 1 | C960: 1 | D960: 巨型双头恶魔 | E960: 青龙头盔
A961: 83 | B961: 1 | C961: 1 | D961: 巨型双头恶魔 | E961: 青龙项链
A962: 83 | B962: 1 | C962: 1 | D962: 巨型双头恶魔 | E962: 青龙手镯
A963: 83 | B963: 1 | C963: 1 | D963: 巨型双头恶魔 | E963: 青龙戒指
A964: 83 | B964: 1 | C964: 1 | D964: 巨型双头恶魔 | E964: 青龙腰带
A965: 83 | B965: 1 | C965: 1 | D965: 巨型双头恶魔 | E965: 青龙鞋子
A966: 246 | B966: 1 | C966: 3 | D966: 巨型双头恶魔 | E966: 战刃
A967: 246 | B967: 1 | C967: 3 | D967: 巨型双头恶魔 | E967: 圣武衣服
A968: 246 | B968: 1 | C968: 3 | D968: 巨型双头恶魔 | E968: 圣武项链
A969: 246 | B969: 1 | C969: 3 | D969: 巨型双头恶魔 | E969: 圣武戒指
A970: 246 | B970: 1 | C970: 3 | D970: 巨型双头恶魔 | E970: 圣武头盔
A971: 246 | B971: 1 | C971: 3 | D971: 巨型双头恶魔 | E971: 圣武手镯
A972: 246 | B972: 1 | C972: 3 | D972: 巨型双头恶魔 | E972: 圣武腰带
A973: 246 | B973: 1 | C973: 3 | D973: 巨型双头恶魔 | E973: 圣武鞋子
A974: 246 | B974: 1 | C974: 3 | D974: 巨型双头恶魔 | E974: 轮回
A975: 246 | B975: 1 | C975: 3 | D975: 巨型双头恶魔 | E975: 圣魔衣服
A976: 246 | B976: 1 | C976: 3 | D976: 巨型双头恶魔 | E976: 圣魔项链
A977: 246 | B977: 1 | C977: 3 | D977: 巨型双头恶魔 | E977: 圣魔戒指
A978: 246 | B978: 1 | C978: 3 | D978: 巨型双头恶魔 | E978: 圣魔头盔
A979: 246 | B979: 1 | C979: 3 | D979: 巨型双头恶魔 | E979: 圣魔手镯
A980: 246 | B980: 1 | C980: 3 | D980: 巨型双头恶魔 | E980: 圣魔腰带
A981: 246 | B981: 1 | C981: 3 | D981: 巨型双头恶魔 | E981: 圣魔鞋子
A982: 246 | B982: 1 | C982: 3 | D982: 巨型双头恶魔 | E982: 太虚
A983: 246 | B983: 1 | C983: 3 | D983: 巨型双头恶魔 | E983: 圣魂衣服
A984: 246 | B984: 1 | C984: 3 | D984: 巨型双头恶魔 | E984: 圣魂项链
A985: 246 | B985: 1 | C985: 3 | D985: 巨型双头恶魔 | E985: 圣魂戒指
A986: 246 | B986: 1 | C986: 3 | D986: 巨型双头恶魔 | E986: 圣魂头盔
A987: 246 | B987: 1 | C987: 3 | D987: 巨型双头恶魔 | E987: 圣魂手镯
A988: 246 | B988: 1 | C988: 3 | D988: 巨型双头恶魔 | E988: 圣魂腰带
A989: 246 | B989: 1 | C989: 3 | D989: 巨型双头恶魔 | E989: 圣魂鞋子
A990: 247 | B990: 1 | C990: 7 | D990: 巨型双头恶魔 | E990: 麻痹戒指
A991: 247 | B991: 1 | C991: 7 | D991: 巨型双头恶魔 | E991: 护身戒指
A992: 247 | B992: 1 | C992: 7 | D992: 巨型双头恶魔 | E992: 复活戒指
A993: 248 | B993: 5 | C993: 1 | D993: 巨型双头恶魔 | E993: 上古神石
A994: 249 | B994: 1 | C994: 1 | D994: 巨型双头恶魔 | E994: 特面
A995: 250 | B995: 1 | C995: 1 | D995: 巨型双头恶魔 | E995: 特腿
A996: 251 | B996: 1 | C996: 1 | D996: 巨型双头恶魔 | E996: 特肩
A997: 36 | B997: 1 | C997: 1 | D997: 巨型双头恶魔 | E997: 狂风斩书
A998: 37 | B998: 1 | C998: 1 | D998: 巨型双头恶魔 | E998: 逐日剑法书
A999: 38 | B999: 1 | C999: 1 | D999: 巨型双头恶魔 | E999: 诱惑之光书
A1000: 39 | B1000: 1 | C1000: 1 | D1000: 巨型双头恶魔 | E1000: 流星火雨书
A1001: 40 | B1001: 1 | C1001: 1 | D1001: 巨型双头恶魔 | E1001: 召唤神兽书
A1002: 41 | B1002: 1 | C1002: 1 | D1002: 巨型双头恶魔 | E1002: 嗜血术书
A1003: 258 | B1003: 1 | C1003: 1 | D1003: 巨型双头恶魔 | E1003: 怒斩
A1004: 258 | B1004: 1 | C1004: 1 | D1004: 巨型双头恶魔 | E1004: 龙牙
A1005: 258 | B1005: 1 | C1005: 1 | D1005: 巨型双头恶魔 | E1005: 龙纹
A1006: 259 | B1006: 1 | C1006: 1 | D1006: 巨型双头恶魔 | E1006: 至尊屠龙
A1007: 259 | B1007: 1 | C1007: 1 | D1007: 巨型双头恶魔 | E1007: 至尊噬魂
A1008: 259 | B1008: 1 | C1008: 1 | D1008: 巨型双头恶魔 | E1008: 至尊逍遥扇
A1009: 260 | B1009: 20 | C1009: 1 | D1009: 巨型双头恶魔 | E1009: 进阶丹
A1010: 261 | B1010: 6 | C1010: 1 | D1010: 巨型双头恶魔 | E1010: 金刚石
A1011: 262 | B1011: 100 | C1011: 1 | D1011: 巨型双头恶魔 | E1011: 2元宝
A1012: 263 | B1012: 10 | C1012: 1 | D1012: 巨型双头恶魔 | E1012: 5元宝
A1013: 264 | B1013: 10 | C1013: 1 | D1013: 巨型双头恶魔 | E1013: 10元宝
A1014: 265 | B1014: 10 | C1014: 1 | D1014: 巨型双头恶魔 | E1014: 20元宝
A1015: 266 | B1015: 4 | C1015: 1 | D1015: 巨型双头恶魔 | E1015: 50元宝
A1016: 267 | B1016: 6 | C1016: 1 | D1016: 巨型双头恶魔 | E1016: 100元宝
A1017: 268 | B1017: 4 | C1017: 1 | D1017: 巨型双头恶魔 | E1017: 150元宝
A1018: 269 | B1018: 3 | C1018: 1 | D1018: 巨型双头恶魔 | E1018: 200元宝
A1019: 271 | B1019: 8 | C1019: 1 | D1019: 海底BOSS1 | E1019: 开天
A1020: 271 | B1020: 8 | C1020: 1 | D1020: 海底BOSS1 | E1020: 雷霆战甲
A1021: 271 | B1021: 8 | C1021: 1 | D1021: 海底BOSS1 | E1021: 雷霆项链
A1022: 271 | B1022: 8 | C1022: 1 | D1022: 海底BOSS1 | E1022: 雷霆戒指
A1023: 271 | B1023: 8 | C1023: 1 | D1023: 海底BOSS1 | E1023: 雷霆头盔
A1024: 271 | B1024: 8 | C1024: 1 | D1024: 海底BOSS1 | E1024: 雷霆护腕
A1025: 271 | B1025: 8 | C1025: 1 | D1025: 海底BOSS1 | E1025: 雷霆腰带
A1026: 271 | B1026: 8 | C1026: 1 | D1026: 海底BOSS1 | E1026: 雷霆战靴
A1027: 271 | B1027: 8 | C1027: 1 | D1027: 海底BOSS1 | E1027: 震天
A1028: 271 | B1028: 8 | C1028: 1 | D1028: 海底BOSS1 | E1028: 烈焰法袍
A1029: 271 | B1029: 8 | C1029: 1 | D1029: 海底BOSS1 | E1029: 烈焰魔链
A1030: 271 | B1030: 8 | C1030: 1 | D1030: 海底BOSS1 | E1030: 烈焰魔指
A1031: 271 | B1031: 8 | C1031: 1 | D1031: 海底BOSS1 | E1031: 烈焰头盔
A1032: 271 | B1032: 8 | C1032: 1 | D1032: 海底BOSS1 | E1032: 烈焰护腕
A1033: 271 | B1033: 8 | C1033: 1 | D1033: 海底BOSS1 | E1033: 烈焰腰带
A1034: 271 | B1034: 8 | C1034: 1 | D1034: 海底BOSS1 | E1034: 烈焰魔靴
A1035: 271 | B1035: 8 | C1035: 1 | D1035: 海底BOSS1 | E1035: 玄天
A1036: 271 | B1036: 8 | C1036: 1 | D1036: 海底BOSS1 | E1036: 光芒道袍
A1037: 271 | B1037: 8 | C1037: 1 | D1037: 海底BOSS1 | E1037: 光芒道链
A1038: 271 | B1038: 8 | C1038: 1 | D1038: 海底BOSS1 | E1038: 光芒道戒
A1039: 271 | B1039: 8 | C1039: 1 | D1039: 海底BOSS1 | E1039: 光芒头盔
A1040: 271 | B1040: 8 | C1040: 1 | D1040: 海底BOSS1 | E1040: 光芒护腕
A1041: 271 | B1041: 8 | C1041: 1 | D1041: 海底BOSS1 | E1041: 光芒腰带
A1042: 271 | B1042: 8 | C1042: 1 | D1042: 海底BOSS1 | E1042: 光芒道靴
A1043: 272 | B1043: 1 | C1043: 1 | D1043: 海底BOSS1 | E1043: 混沌
A1044: 272 | B1044: 1 | C1044: 1 | D1044: 海底BOSS1 | E1044: 白虎衣服
A1045: 272 | B1045: 1 | C1045: 1 | D1045: 海底BOSS1 | E1045: 白虎头盔
A1046: 272 | B1046: 1 | C1046: 1 | D1046: 海底BOSS1 | E1046: 白虎项链
A1047: 272 | B1047: 1 | C1047: 1 | D1047: 海底BOSS1 | E1047: 白虎手镯
A1048: 272 | B1048: 1 | C1048: 1 | D1048: 海底BOSS1 | E1048: 白虎戒指
A1049: 272 | B1049: 1 | C1049: 1 | D1049: 海底BOSS1 | E1049: 白虎腰带
A1050: 272 | B1050: 1 | C1050: 1 | D1050: 海底BOSS1 | E1050: 白虎鞋子
A1051: 272 | B1051: 1 | C1051: 1 | D1051: 海底BOSS1 | E1051: 狂龙
A1052: 272 | B1052: 1 | C1052: 1 | D1052: 海底BOSS1 | E1052: 朱雀衣服
A1053: 272 | B1053: 1 | C1053: 1 | D1053: 海底BOSS1 | E1053: 朱雀头盔
A1054: 272 | B1054: 1 | C1054: 1 | D1054: 海底BOSS1 | E1054: 朱雀项链
A1055: 272 | B1055: 1 | C1055: 1 | D1055: 海底BOSS1 | E1055: 朱雀手镯
A1056: 272 | B1056: 1 | C1056: 1 | D1056: 海底BOSS1 | E1056: 朱雀戒指
A1057: 272 | B1057: 1 | C1057: 1 | D1057: 海底BOSS1 | E1057: 朱雀腰带
A1058: 272 | B1058: 1 | C1058: 1 | D1058: 海底BOSS1 | E1058: 朱雀鞋子
A1059: 272 | B1059: 1 | C1059: 1 | D1059: 海底BOSS1 | E1059: 天蛇
A1060: 272 | B1060: 1 | C1060: 1 | D1060: 海底BOSS1 | E1060: 青龙衣服
A1061: 272 | B1061: 1 | C1061: 1 | D1061: 海底BOSS1 | E1061: 青龙头盔
A1062: 272 | B1062: 1 | C1062: 1 | D1062: 海底BOSS1 | E1062: 青龙项链
A1063: 272 | B1063: 1 | C1063: 1 | D1063: 海底BOSS1 | E1063: 青龙手镯
A1064: 272 | B1064: 1 | C1064: 1 | D1064: 海底BOSS1 | E1064: 青龙戒指
A1065: 272 | B1065: 1 | C1065: 1 | D1065: 海底BOSS1 | E1065: 青龙腰带
A1066: 272 | B1066: 1 | C1066: 1 | D1066: 海底BOSS1 | E1066: 青龙鞋子
A1067: 273 | B1067: 1 | C1067: 3 | D1067: 海底BOSS1 | E1067: 战刃
A1068: 273 | B1068: 1 | C1068: 3 | D1068: 海底BOSS1 | E1068: 圣武衣服
A1069: 273 | B1069: 1 | C1069: 3 | D1069: 海底BOSS1 | E1069: 圣武项链
A1070: 273 | B1070: 1 | C1070: 3 | D1070: 海底BOSS1 | E1070: 圣武戒指
A1071: 273 | B1071: 1 | C1071: 3 | D1071: 海底BOSS1 | E1071: 圣武头盔
A1072: 273 | B1072: 1 | C1072: 3 | D1072: 海底BOSS1 | E1072: 圣武手镯
A1073: 273 | B1073: 1 | C1073: 3 | D1073: 海底BOSS1 | E1073: 圣武腰带
A1074: 273 | B1074: 1 | C1074: 3 | D1074: 海底BOSS1 | E1074: 圣武鞋子
A1075: 273 | B1075: 1 | C1075: 3 | D1075: 海底BOSS1 | E1075: 轮回
A1076: 273 | B1076: 1 | C1076: 3 | D1076: 海底BOSS1 | E1076: 圣魔衣服
A1077: 273 | B1077: 1 | C1077: 3 | D1077: 海底BOSS1 | E1077: 圣魔项链
A1078: 273 | B1078: 1 | C1078: 3 | D1078: 海底BOSS1 | E1078: 圣魔戒指
A1079: 273 | B1079: 1 | C1079: 3 | D1079: 海底BOSS1 | E1079: 圣魔头盔
A1080: 273 | B1080: 1 | C1080: 3 | D1080: 海底BOSS1 | E1080: 圣魔手镯
A1081: 273 | B1081: 1 | C1081: 3 | D1081: 海底BOSS1 | E1081: 圣魔腰带
A1082: 273 | B1082: 1 | C1082: 3 | D1082: 海底BOSS1 | E1082: 圣魔鞋子
A1083: 273 | B1083: 1 | C1083: 3 | D1083: 海底BOSS1 | E1083: 太虚
A1084: 273 | B1084: 1 | C1084: 3 | D1084: 海底BOSS1 | E1084: 圣魂衣服
A1085: 273 | B1085: 1 | C1085: 3 | D1085: 海底BOSS1 | E1085: 圣魂项链
A1086: 273 | B1086: 1 | C1086: 3 | D1086: 海底BOSS1 | E1086: 圣魂戒指
A1087: 273 | B1087: 1 | C1087: 3 | D1087: 海底BOSS1 | E1087: 圣魂头盔
A1088: 273 | B1088: 1 | C1088: 3 | D1088: 海底BOSS1 | E1088: 圣魂手镯
A1089: 273 | B1089: 1 | C1089: 3 | D1089: 海底BOSS1 | E1089: 圣魂腰带
A1090: 273 | B1090: 1 | C1090: 3 | D1090: 海底BOSS1 | E1090: 圣魂鞋子
A1091: 166 | B1091: 1 | C1091: 7 | D1091: 海底BOSS1 | E1091: 麻痹戒指
A1092: 166 | B1092: 1 | C1092: 7 | D1092: 海底BOSS1 | E1092: 护身戒指
A1093: 166 | B1093: 1 | C1093: 7 | D1093: 海底BOSS1 | E1093: 复活戒指
A1094: 275 | B1094: 3 | C1094: 1 | D1094: 海底BOSS1 | E1094: 上古神石
A1095: 276 | B1095: 1 | C1095: 1 | D1095: 海底BOSS1 | E1095: 特面
A1096: 277 | B1096: 1 | C1096: 1 | D1096: 海底BOSS1 | E1096: 特腿
A1097: 278 | B1097: 1 | C1097: 1 | D1097: 海底BOSS1 | E1097: 特肩
A1098: 36 | B1098: 1 | C1098: 1 | D1098: 海底BOSS1 | E1098: 狂风斩书
A1099: 37 | B1099: 1 | C1099: 1 | D1099: 海底BOSS1 | E1099: 逐日剑法书
A1100: 38 | B1100: 1 | C1100: 1 | D1100: 海底BOSS1 | E1100: 诱惑之光书
A1101: 39 | B1101: 1 | C1101: 1 | D1101: 海底BOSS1 | E1101: 流星火雨书
A1102: 40 | B1102: 1 | C1102: 1 | D1102: 海底BOSS1 | E1102: 召唤神兽书
A1103: 41 | B1103: 1 | C1103: 1 | D1103: 海底BOSS1 | E1103: 嗜血术书
A1104: 285 | B1104: 1 | C1104: 1 | D1104: 海底BOSS1 | E1104: 怒斩
A1105: 285 | B1105: 1 | C1105: 1 | D1105: 海底BOSS1 | E1105: 龙牙
A1106: 285 | B1106: 1 | C1106: 1 | D1106: 海底BOSS1 | E1106: 龙纹
A1107: 286 | B1107: 1 | C1107: 1 | D1107: 海底BOSS1 | E1107: 至尊屠龙
A1108: 286 | B1108: 1 | C1108: 1 | D1108: 海底BOSS1 | E1108: 至尊噬魂
A1109: 286 | B1109: 1 | C1109: 1 | D1109: 海底BOSS1 | E1109: 至尊逍遥扇
A1110: 287 | B1110: 20 | C1110: 1 | D1110: 海底BOSS1 | E1110: 进阶丹
A1111: 288 | B1111: 8 | C1111: 1 | D1111: 海底BOSS1 | E1111: 金刚石
A1112: 289 | B1112: 100 | C1112: 1 | D1112: 海底BOSS1 | E1112: 2元宝
A1113: 290 | B1113: 10 | C1113: 1 | D1113: 海底BOSS1 | E1113: 5元宝
A1114: 291 | B1114: 10 | C1114: 1 | D1114: 海底BOSS1 | E1114: 10元宝
A1115: 292 | B1115: 10 | C1115: 1 | D1115: 海底BOSS1 | E1115: 20元宝
A1116: 293 | B1116: 5 | C1116: 1 | D1116: 海底BOSS1 | E1116: 50元宝
A1117: 294 | B1117: 6 | C1117: 1 | D1117: 海底BOSS1 | E1117: 100元宝
A1118: 295 | B1118: 6 | C1118: 1 | D1118: 海底BOSS1 | E1118: 150元宝
A1119: 296 | B1119: 3 | C1119: 1 | D1119: 海底BOSS1 | E1119: 200元宝
A1120: 298 | B1120: 6 | C1120: 1 | D1120: 海底BOSS2 | E1120: 开天
A1121: 298 | B1121: 6 | C1121: 1 | D1121: 海底BOSS2 | E1121: 雷霆战甲
A1122: 298 | B1122: 6 | C1122: 1 | D1122: 海底BOSS2 | E1122: 雷霆项链
A1123: 298 | B1123: 6 | C1123: 1 | D1123: 海底BOSS2 | E1123: 雷霆戒指
A1124: 298 | B1124: 6 | C1124: 1 | D1124: 海底BOSS2 | E1124: 雷霆头盔
A1125: 298 | B1125: 6 | C1125: 1 | D1125: 海底BOSS2 | E1125: 雷霆护腕
A1126: 298 | B1126: 6 | C1126: 1 | D1126: 海底BOSS2 | E1126: 雷霆腰带
A1127: 298 | B1127: 6 | C1127: 1 | D1127: 海底BOSS2 | E1127: 雷霆战靴
A1128: 298 | B1128: 6 | C1128: 1 | D1128: 海底BOSS2 | E1128: 震天
A1129: 298 | B1129: 6 | C1129: 1 | D1129: 海底BOSS2 | E1129: 烈焰法袍
A1130: 298 | B1130: 6 | C1130: 1 | D1130: 海底BOSS2 | E1130: 烈焰魔链
A1131: 298 | B1131: 6 | C1131: 1 | D1131: 海底BOSS2 | E1131: 烈焰魔指
A1132: 298 | B1132: 6 | C1132: 1 | D1132: 海底BOSS2 | E1132: 烈焰头盔
A1133: 298 | B1133: 6 | C1133: 1 | D1133: 海底BOSS2 | E1133: 烈焰护腕
A1134: 298 | B1134: 6 | C1134: 1 | D1134: 海底BOSS2 | E1134: 烈焰腰带
A1135: 298 | B1135: 6 | C1135: 1 | D1135: 海底BOSS2 | E1135: 烈焰魔靴
A1136: 298 | B1136: 6 | C1136: 1 | D1136: 海底BOSS2 | E1136: 玄天
A1137: 298 | B1137: 6 | C1137: 1 | D1137: 海底BOSS2 | E1137: 光芒道袍
A1138: 298 | B1138: 6 | C1138: 1 | D1138: 海底BOSS2 | E1138: 光芒道链
A1139: 298 | B1139: 6 | C1139: 1 | D1139: 海底BOSS2 | E1139: 光芒道戒
A1140: 298 | B1140: 6 | C1140: 1 | D1140: 海底BOSS2 | E1140: 光芒头盔
A1141: 298 | B1141: 6 | C1141: 1 | D1141: 海底BOSS2 | E1141: 光芒护腕
A1142: 298 | B1142: 6 | C1142: 1 | D1142: 海底BOSS2 | E1142: 光芒腰带
A1143: 298 | B1143: 6 | C1143: 1 | D1143: 海底BOSS2 | E1143: 光芒道靴
A1144: 299 | B1144: 1 | C1144: 1 | D1144: 海底BOSS2 | E1144: 混沌
A1145: 299 | B1145: 1 | C1145: 1 | D1145: 海底BOSS2 | E1145: 白虎衣服
A1146: 299 | B1146: 1 | C1146: 1 | D1146: 海底BOSS2 | E1146: 白虎头盔
A1147: 299 | B1147: 1 | C1147: 1 | D1147: 海底BOSS2 | E1147: 白虎项链
A1148: 299 | B1148: 1 | C1148: 1 | D1148: 海底BOSS2 | E1148: 白虎手镯
A1149: 299 | B1149: 1 | C1149: 1 | D1149: 海底BOSS2 | E1149: 白虎戒指
A1150: 299 | B1150: 1 | C1150: 1 | D1150: 海底BOSS2 | E1150: 白虎腰带
A1151: 299 | B1151: 1 | C1151: 1 | D1151: 海底BOSS2 | E1151: 白虎鞋子
A1152: 299 | B1152: 1 | C1152: 1 | D1152: 海底BOSS2 | E1152: 狂龙
A1153: 299 | B1153: 1 | C1153: 1 | D1153: 海底BOSS2 | E1153: 朱雀衣服
A1154: 299 | B1154: 1 | C1154: 1 | D1154: 海底BOSS2 | E1154: 朱雀头盔
A1155: 299 | B1155: 1 | C1155: 1 | D1155: 海底BOSS2 | E1155: 朱雀项链
A1156: 299 | B1156: 1 | C1156: 1 | D1156: 海底BOSS2 | E1156: 朱雀手镯
A1157: 299 | B1157: 1 | C1157: 1 | D1157: 海底BOSS2 | E1157: 朱雀戒指
A1158: 299 | B1158: 1 | C1158: 1 | D1158: 海底BOSS2 | E1158: 朱雀腰带
A1159: 299 | B1159: 1 | C1159: 1 | D1159: 海底BOSS2 | E1159: 朱雀鞋子
A1160: 299 | B1160: 1 | C1160: 1 | D1160: 海底BOSS2 | E1160: 天蛇
A1161: 299 | B1161: 1 | C1161: 1 | D1161: 海底BOSS2 | E1161: 青龙衣服
A1162: 299 | B1162: 1 | C1162: 1 | D1162: 海底BOSS2 | E1162: 青龙头盔
A1163: 299 | B1163: 1 | C1163: 1 | D1163: 海底BOSS2 | E1163: 青龙项链
A1164: 299 | B1164: 1 | C1164: 1 | D1164: 海底BOSS2 | E1164: 青龙手镯
A1165: 299 | B1165: 1 | C1165: 1 | D1165: 海底BOSS2 | E1165: 青龙戒指
A1166: 299 | B1166: 1 | C1166: 1 | D1166: 海底BOSS2 | E1166: 青龙腰带
A1167: 299 | B1167: 1 | C1167: 1 | D1167: 海底BOSS2 | E1167: 青龙鞋子
A1168: 300 | B1168: 1 | C1168: 3 | D1168: 海底BOSS2 | E1168: 战刃
A1169: 300 | B1169: 1 | C1169: 3 | D1169: 海底BOSS2 | E1169: 圣武衣服
A1170: 300 | B1170: 1 | C1170: 3 | D1170: 海底BOSS2 | E1170: 圣武项链
A1171: 300 | B1171: 1 | C1171: 3 | D1171: 海底BOSS2 | E1171: 圣武戒指
A1172: 300 | B1172: 1 | C1172: 3 | D1172: 海底BOSS2 | E1172: 圣武头盔
A1173: 300 | B1173: 1 | C1173: 3 | D1173: 海底BOSS2 | E1173: 圣武手镯
A1174: 300 | B1174: 1 | C1174: 3 | D1174: 海底BOSS2 | E1174: 圣武腰带
A1175: 300 | B1175: 1 | C1175: 3 | D1175: 海底BOSS2 | E1175: 圣武鞋子
A1176: 300 | B1176: 1 | C1176: 3 | D1176: 海底BOSS2 | E1176: 轮回
A1177: 300 | B1177: 1 | C1177: 3 | D1177: 海底BOSS2 | E1177: 圣魔衣服
A1178: 300 | B1178: 1 | C1178: 3 | D1178: 海底BOSS2 | E1178: 圣魔项链
A1179: 300 | B1179: 1 | C1179: 3 | D1179: 海底BOSS2 | E1179: 圣魔戒指
A1180: 300 | B1180: 1 | C1180: 3 | D1180: 海底BOSS2 | E1180: 圣魔头盔
A1181: 300 | B1181: 1 | C1181: 3 | D1181: 海底BOSS2 | E1181: 圣魔手镯
A1182: 300 | B1182: 1 | C1182: 3 | D1182: 海底BOSS2 | E1182: 圣魔腰带
A1183: 300 | B1183: 1 | C1183: 3 | D1183: 海底BOSS2 | E1183: 圣魔鞋子
A1184: 300 | B1184: 1 | C1184: 3 | D1184: 海底BOSS2 | E1184: 太虚
A1185: 300 | B1185: 1 | C1185: 3 | D1185: 海底BOSS2 | E1185: 圣魂衣服
A1186: 300 | B1186: 1 | C1186: 3 | D1186: 海底BOSS2 | E1186: 圣魂项链
A1187: 300 | B1187: 1 | C1187: 3 | D1187: 海底BOSS2 | E1187: 圣魂戒指
A1188: 300 | B1188: 1 | C1188: 3 | D1188: 海底BOSS2 | E1188: 圣魂头盔
A1189: 300 | B1189: 1 | C1189: 3 | D1189: 海底BOSS2 | E1189: 圣魂手镯
A1190: 300 | B1190: 1 | C1190: 3 | D1190: 海底BOSS2 | E1190: 圣魂腰带
A1191: 300 | B1191: 1 | C1191: 3 | D1191: 海底BOSS2 | E1191: 圣魂鞋子
A1192: 166 | B1192: 1 | C1192: 7 | D1192: 海底BOSS2 | E1192: 麻痹戒指
A1193: 166 | B1193: 1 | C1193: 7 | D1193: 海底BOSS2 | E1193: 护身戒指
A1194: 166 | B1194: 1 | C1194: 7 | D1194: 海底BOSS2 | E1194: 复活戒指
A1195: 302 | B1195: 4 | C1195: 1 | D1195: 海底BOSS2 | E1195: 上古神石
A1196: 303 | B1196: 1 | C1196: 1 | D1196: 海底BOSS2 | E1196: 特面
A1197: 304 | B1197: 1 | C1197: 1 | D1197: 海底BOSS2 | E1197: 特腿
A1198: 305 | B1198: 1 | C1198: 1 | D1198: 海底BOSS2 | E1198: 特肩
A1199: 36 | B1199: 1 | C1199: 1 | D1199: 海底BOSS2 | E1199: 狂风斩书
A1200: 37 | B1200: 1 | C1200: 1 | D1200: 海底BOSS2 | E1200: 逐日剑法书
A1201: 38 | B1201: 1 | C1201: 1 | D1201: 海底BOSS2 | E1201: 诱惑之光书
A1202: 39 | B1202: 1 | C1202: 1 | D1202: 海底BOSS2 | E1202: 流星火雨书
A1203: 40 | B1203: 1 | C1203: 1 | D1203: 海底BOSS2 | E1203: 召唤神兽书
A1204: 41 | B1204: 1 | C1204: 1 | D1204: 海底BOSS2 | E1204: 嗜血术书
A1205: 312 | B1205: 1 | C1205: 1 | D1205: 海底BOSS2 | E1205: 怒斩
A1206: 312 | B1206: 1 | C1206: 1 | D1206: 海底BOSS2 | E1206: 龙牙
A1207: 312 | B1207: 1 | C1207: 1 | D1207: 海底BOSS2 | E1207: 龙纹
A1208: 313 | B1208: 1 | C1208: 1 | D1208: 海底BOSS2 | E1208: 至尊屠龙
A1209: 313 | B1209: 1 | C1209: 1 | D1209: 海底BOSS2 | E1209: 至尊噬魂
A1210: 313 | B1210: 1 | C1210: 1 | D1210: 海底BOSS2 | E1210: 至尊逍遥扇
A1211: 314 | B1211: 20 | C1211: 1 | D1211: 海底BOSS2 | E1211: 进阶丹
A1212: 315 | B1212: 6 | C1212: 1 | D1212: 海底BOSS2 | E1212: 金刚石
A1213: 316 | B1213: 100 | C1213: 1 | D1213: 海底BOSS2 | E1213: 2元宝
A1214: 317 | B1214: 10 | C1214: 1 | D1214: 海底BOSS2 | E1214: 5元宝
A1215: 318 | B1215: 10 | C1215: 1 | D1215: 海底BOSS2 | E1215: 10元宝
A1216: 319 | B1216: 10 | C1216: 1 | D1216: 海底BOSS2 | E1216: 20元宝
A1217: 320 | B1217: 5 | C1217: 1 | D1217: 海底BOSS2 | E1217: 50元宝
A1218: 321 | B1218: 6 | C1218: 1 | D1218: 海底BOSS2 | E1218: 100元宝
A1219: 322 | B1219: 6 | C1219: 1 | D1219: 海底BOSS2 | E1219: 150元宝
A1220: 323 | B1220: 3 | C1220: 1 | D1220: 海底BOSS2 | E1220: 200元宝
A1221: 325 | B1221: 1 | C1221: 1 | D1221: 牛魔BOSS1 | E1221: 开天
A1222: 325 | B1222: 1 | C1222: 1 | D1222: 牛魔BOSS1 | E1222: 雷霆战甲
A1223: 325 | B1223: 1 | C1223: 1 | D1223: 牛魔BOSS1 | E1223: 雷霆项链
A1224: 325 | B1224: 1 | C1224: 1 | D1224: 牛魔BOSS1 | E1224: 雷霆戒指
A1225: 325 | B1225: 1 | C1225: 1 | D1225: 牛魔BOSS1 | E1225: 雷霆头盔
A1226: 325 | B1226: 1 | C1226: 1 | D1226: 牛魔BOSS1 | E1226: 雷霆护腕
A1227: 325 | B1227: 1 | C1227: 1 | D1227: 牛魔BOSS1 | E1227: 雷霆腰带
A1228: 325 | B1228: 1 | C1228: 1 | D1228: 牛魔BOSS1 | E1228: 雷霆战靴
A1229: 325 | B1229: 1 | C1229: 1 | D1229: 牛魔BOSS1 | E1229: 震天
A1230: 325 | B1230: 1 | C1230: 1 | D1230: 牛魔BOSS1 | E1230: 烈焰法袍
A1231: 325 | B1231: 1 | C1231: 1 | D1231: 牛魔BOSS1 | E1231: 烈焰魔链
A1232: 325 | B1232: 1 | C1232: 1 | D1232: 牛魔BOSS1 | E1232: 烈焰魔指
A1233: 325 | B1233: 1 | C1233: 1 | D1233: 牛魔BOSS1 | E1233: 烈焰头盔
A1234: 325 | B1234: 1 | C1234: 1 | D1234: 牛魔BOSS1 | E1234: 烈焰护腕
A1235: 325 | B1235: 1 | C1235: 1 | D1235: 牛魔BOSS1 | E1235: 烈焰腰带
A1236: 325 | B1236: 1 | C1236: 1 | D1236: 牛魔BOSS1 | E1236: 烈焰魔靴
A1237: 325 | B1237: 1 | C1237: 1 | D1237: 牛魔BOSS1 | E1237: 玄天
A1238: 325 | B1238: 1 | C1238: 1 | D1238: 牛魔BOSS1 | E1238: 光芒道袍
A1239: 325 | B1239: 1 | C1239: 1 | D1239: 牛魔BOSS1 | E1239: 光芒道链
A1240: 325 | B1240: 1 | C1240: 1 | D1240: 牛魔BOSS1 | E1240: 光芒道戒
A1241: 325 | B1241: 1 | C1241: 1 | D1241: 牛魔BOSS1 | E1241: 光芒头盔
A1242: 325 | B1242: 1 | C1242: 1 | D1242: 牛魔BOSS1 | E1242: 光芒护腕
A1243: 325 | B1243: 1 | C1243: 1 | D1243: 牛魔BOSS1 | E1243: 光芒腰带
A1244: 325 | B1244: 1 | C1244: 1 | D1244: 牛魔BOSS1 | E1244: 光芒道靴
A1245: 326 | B1245: 1 | C1245: 1 | D1245: 牛魔BOSS1 | E1245: 混沌
A1246: 326 | B1246: 1 | C1246: 1 | D1246: 牛魔BOSS1 | E1246: 白虎衣服
A1247: 326 | B1247: 1 | C1247: 1 | D1247: 牛魔BOSS1 | E1247: 白虎头盔
A1248: 326 | B1248: 1 | C1248: 1 | D1248: 牛魔BOSS1 | E1248: 白虎项链
A1249: 326 | B1249: 1 | C1249: 1 | D1249: 牛魔BOSS1 | E1249: 白虎手镯
A1250: 326 | B1250: 1 | C1250: 1 | D1250: 牛魔BOSS1 | E1250: 白虎戒指
A1251: 326 | B1251: 1 | C1251: 1 | D1251: 牛魔BOSS1 | E1251: 白虎腰带
A1252: 326 | B1252: 1 | C1252: 1 | D1252: 牛魔BOSS1 | E1252: 白虎鞋子
A1253: 326 | B1253: 1 | C1253: 1 | D1253: 牛魔BOSS1 | E1253: 狂龙
A1254: 326 | B1254: 1 | C1254: 1 | D1254: 牛魔BOSS1 | E1254: 朱雀衣服
A1255: 326 | B1255: 1 | C1255: 1 | D1255: 牛魔BOSS1 | E1255: 朱雀头盔
A1256: 326 | B1256: 1 | C1256: 1 | D1256: 牛魔BOSS1 | E1256: 朱雀项链
A1257: 326 | B1257: 1 | C1257: 1 | D1257: 牛魔BOSS1 | E1257: 朱雀手镯
A1258: 326 | B1258: 1 | C1258: 1 | D1258: 牛魔BOSS1 | E1258: 朱雀戒指
A1259: 326 | B1259: 1 | C1259: 1 | D1259: 牛魔BOSS1 | E1259: 朱雀腰带
A1260: 326 | B1260: 1 | C1260: 1 | D1260: 牛魔BOSS1 | E1260: 朱雀鞋子
A1261: 326 | B1261: 1 | C1261: 1 | D1261: 牛魔BOSS1 | E1261: 天蛇
A1262: 326 | B1262: 1 | C1262: 1 | D1262: 牛魔BOSS1 | E1262: 青龙衣服
A1263: 326 | B1263: 1 | C1263: 1 | D1263: 牛魔BOSS1 | E1263: 青龙头盔
A1264: 326 | B1264: 1 | C1264: 1 | D1264: 牛魔BOSS1 | E1264: 青龙项链
A1265: 326 | B1265: 1 | C1265: 1 | D1265: 牛魔BOSS1 | E1265: 青龙手镯
A1266: 326 | B1266: 1 | C1266: 1 | D1266: 牛魔BOSS1 | E1266: 青龙戒指
A1267: 326 | B1267: 1 | C1267: 1 | D1267: 牛魔BOSS1 | E1267: 青龙腰带
A1268: 326 | B1268: 1 | C1268: 1 | D1268: 牛魔BOSS1 | E1268: 青龙鞋子
A1269: 327 | B1269: 1 | C1269: 3 | D1269: 牛魔BOSS1 | E1269: 战刃
A1270: 327 | B1270: 1 | C1270: 3 | D1270: 牛魔BOSS1 | E1270: 圣武衣服
A1271: 327 | B1271: 1 | C1271: 3 | D1271: 牛魔BOSS1 | E1271: 圣武项链
A1272: 327 | B1272: 1 | C1272: 3 | D1272: 牛魔BOSS1 | E1272: 圣武戒指
A1273: 327 | B1273: 1 | C1273: 3 | D1273: 牛魔BOSS1 | E1273: 圣武头盔
A1274: 327 | B1274: 1 | C1274: 3 | D1274: 牛魔BOSS1 | E1274: 圣武手镯
A1275: 327 | B1275: 1 | C1275: 3 | D1275: 牛魔BOSS1 | E1275: 圣武腰带
A1276: 327 | B1276: 1 | C1276: 3 | D1276: 牛魔BOSS1 | E1276: 圣武鞋子
A1277: 327 | B1277: 1 | C1277: 3 | D1277: 牛魔BOSS1 | E1277: 轮回
A1278: 327 | B1278: 1 | C1278: 3 | D1278: 牛魔BOSS1 | E1278: 圣魔衣服
A1279: 327 | B1279: 1 | C1279: 3 | D1279: 牛魔BOSS1 | E1279: 圣魔项链
A1280: 327 | B1280: 1 | C1280: 3 | D1280: 牛魔BOSS1 | E1280: 圣魔戒指
A1281: 327 | B1281: 1 | C1281: 3 | D1281: 牛魔BOSS1 | E1281: 圣魔头盔
A1282: 327 | B1282: 1 | C1282: 3 | D1282: 牛魔BOSS1 | E1282: 圣魔手镯
A1283: 327 | B1283: 1 | C1283: 3 | D1283: 牛魔BOSS1 | E1283: 圣魔腰带
A1284: 327 | B1284: 1 | C1284: 3 | D1284: 牛魔BOSS1 | E1284: 圣魔鞋子
A1285: 327 | B1285: 1 | C1285: 3 | D1285: 牛魔BOSS1 | E1285: 太虚
A1286: 327 | B1286: 1 | C1286: 3 | D1286: 牛魔BOSS1 | E1286: 圣魂衣服
A1287: 327 | B1287: 1 | C1287: 3 | D1287: 牛魔BOSS1 | E1287: 圣魂项链
A1288: 327 | B1288: 1 | C1288: 3 | D1288: 牛魔BOSS1 | E1288: 圣魂戒指
A1289: 327 | B1289: 1 | C1289: 3 | D1289: 牛魔BOSS1 | E1289: 圣魂头盔
A1290: 327 | B1290: 1 | C1290: 3 | D1290: 牛魔BOSS1 | E1290: 圣魂手镯
A1291: 327 | B1291: 1 | C1291: 3 | D1291: 牛魔BOSS1 | E1291: 圣魂腰带
A1292: 327 | B1292: 1 | C1292: 3 | D1292: 牛魔BOSS1 | E1292: 圣魂鞋子
A1293: 166 | B1293: 1 | C1293: 7 | D1293: 牛魔BOSS1 | E1293: 麻痹戒指
A1294: 166 | B1294: 1 | C1294: 7 | D1294: 牛魔BOSS1 | E1294: 护身戒指
A1295: 166 | B1295: 1 | C1295: 7 | D1295: 牛魔BOSS1 | E1295: 复活戒指
A1296: 329 | B1296: 3 | C1296: 1 | D1296: 牛魔BOSS1 | E1296: 上古神石
A1297: 330 | B1297: 1 | C1297: 1 | D1297: 牛魔BOSS1 | E1297: 特面
A1298: 331 | B1298: 1 | C1298: 1 | D1298: 牛魔BOSS1 | E1298: 特腿
A1299: 332 | B1299: 1 | C1299: 1 | D1299: 牛魔BOSS1 | E1299: 特肩
A1300: 36 | B1300: 1 | C1300: 1 | D1300: 牛魔BOSS1 | E1300: 狂风斩书
A1301: 37 | B1301: 1 | C1301: 1 | D1301: 牛魔BOSS1 | E1301: 逐日剑法书
A1302: 38 | B1302: 1 | C1302: 1 | D1302: 牛魔BOSS1 | E1302: 诱惑之光书
A1303: 39 | B1303: 1 | C1303: 1 | D1303: 牛魔BOSS1 | E1303: 流星火雨书
A1304: 40 | B1304: 1 | C1304: 1 | D1304: 牛魔BOSS1 | E1304: 召唤神兽书
A1305: 41 | B1305: 1 | C1305: 1 | D1305: 牛魔BOSS1 | E1305: 嗜血术书
A1306: 339 | B1306: 1 | C1306: 1 | D1306: 牛魔BOSS1 | E1306: 怒斩
A1307: 339 | B1307: 1 | C1307: 1 | D1307: 牛魔BOSS1 | E1307: 龙牙
A1308: 339 | B1308: 1 | C1308: 1 | D1308: 牛魔BOSS1 | E1308: 龙纹
A1309: 340 | B1309: 1 | C1309: 1 | D1309: 牛魔BOSS1 | E1309: 至尊屠龙
A1310: 340 | B1310: 1 | C1310: 1 | D1310: 牛魔BOSS1 | E1310: 至尊噬魂
A1311: 340 | B1311: 1 | C1311: 1 | D1311: 牛魔BOSS1 | E1311: 至尊逍遥扇
A1312: 341 | B1312: 20 | C1312: 1 | D1312: 牛魔BOSS1 | E1312: 进阶丹
A1313: 342 | B1313: 1 | C1313: 1 | D1313: 牛魔BOSS1 | E1313: 金刚石
A1314: 343 | B1314: 100 | C1314: 1 | D1314: 牛魔BOSS1 | E1314: 2元宝
A1315: 344 | B1315: 10 | C1315: 1 | D1315: 牛魔BOSS1 | E1315: 5元宝
A1316: 345 | B1316: 10 | C1316: 1 | D1316: 牛魔BOSS1 | E1316: 10元宝
A1317: 346 | B1317: 10 | C1317: 1 | D1317: 牛魔BOSS1 | E1317: 20元宝
A1318: 347 | B1318: 5 | C1318: 1 | D1318: 牛魔BOSS1 | E1318: 50元宝
A1319: 348 | B1319: 6 | C1319: 1 | D1319: 牛魔BOSS1 | E1319: 100元宝
A1320: 349 | B1320: 6 | C1320: 1 | D1320: 牛魔BOSS1 | E1320: 150元宝
A1321: 350 | B1321: 3 | C1321: 1 | D1321: 牛魔BOSS1 | E1321: 200元宝
A1322: 352 | B1322: 1 | C1322: 1 | D1322: 牛魔BOSS2 | E1322: 开天
A1323: 352 | B1323: 1 | C1323: 1 | D1323: 牛魔BOSS2 | E1323: 雷霆战甲
A1324: 352 | B1324: 1 | C1324: 1 | D1324: 牛魔BOSS2 | E1324: 雷霆项链
A1325: 352 | B1325: 1 | C1325: 1 | D1325: 牛魔BOSS2 | E1325: 雷霆戒指
A1326: 352 | B1326: 1 | C1326: 1 | D1326: 牛魔BOSS2 | E1326: 雷霆头盔
A1327: 352 | B1327: 1 | C1327: 1 | D1327: 牛魔BOSS2 | E1327: 雷霆护腕
A1328: 352 | B1328: 1 | C1328: 1 | D1328: 牛魔BOSS2 | E1328: 雷霆腰带
A1329: 352 | B1329: 1 | C1329: 1 | D1329: 牛魔BOSS2 | E1329: 雷霆战靴
A1330: 352 | B1330: 1 | C1330: 1 | D1330: 牛魔BOSS2 | E1330: 震天
A1331: 352 | B1331: 1 | C1331: 1 | D1331: 牛魔BOSS2 | E1331: 烈焰法袍
A1332: 352 | B1332: 1 | C1332: 1 | D1332: 牛魔BOSS2 | E1332: 烈焰魔链
A1333: 352 | B1333: 1 | C1333: 1 | D1333: 牛魔BOSS2 | E1333: 烈焰魔指
A1334: 352 | B1334: 1 | C1334: 1 | D1334: 牛魔BOSS2 | E1334: 烈焰头盔
A1335: 352 | B1335: 1 | C1335: 1 | D1335: 牛魔BOSS2 | E1335: 烈焰护腕
A1336: 352 | B1336: 1 | C1336: 1 | D1336: 牛魔BOSS2 | E1336: 烈焰腰带
A1337: 352 | B1337: 1 | C1337: 1 | D1337: 牛魔BOSS2 | E1337: 烈焰魔靴
A1338: 352 | B1338: 1 | C1338: 1 | D1338: 牛魔BOSS2 | E1338: 玄天
A1339: 352 | B1339: 1 | C1339: 1 | D1339: 牛魔BOSS2 | E1339: 光芒道袍
A1340: 352 | B1340: 1 | C1340: 1 | D1340: 牛魔BOSS2 | E1340: 光芒道链
A1341: 352 | B1341: 1 | C1341: 1 | D1341: 牛魔BOSS2 | E1341: 光芒道戒
A1342: 352 | B1342: 1 | C1342: 1 | D1342: 牛魔BOSS2 | E1342: 光芒头盔
A1343: 352 | B1343: 1 | C1343: 1 | D1343: 牛魔BOSS2 | E1343: 光芒护腕
A1344: 352 | B1344: 1 | C1344: 1 | D1344: 牛魔BOSS2 | E1344: 光芒腰带
A1345: 352 | B1345: 1 | C1345: 1 | D1345: 牛魔BOSS2 | E1345: 光芒道靴
A1346: 353 | B1346: 1 | C1346: 1 | D1346: 牛魔BOSS2 | E1346: 混沌
A1347: 353 | B1347: 1 | C1347: 1 | D1347: 牛魔BOSS2 | E1347: 白虎衣服
A1348: 353 | B1348: 1 | C1348: 1 | D1348: 牛魔BOSS2 | E1348: 白虎头盔
A1349: 353 | B1349: 1 | C1349: 1 | D1349: 牛魔BOSS2 | E1349: 白虎项链
A1350: 353 | B1350: 1 | C1350: 1 | D1350: 牛魔BOSS2 | E1350: 白虎手镯
A1351: 353 | B1351: 1 | C1351: 1 | D1351: 牛魔BOSS2 | E1351: 白虎戒指
A1352: 353 | B1352: 1 | C1352: 1 | D1352: 牛魔BOSS2 | E1352: 白虎腰带
A1353: 353 | B1353: 1 | C1353: 1 | D1353: 牛魔BOSS2 | E1353: 白虎鞋子
A1354: 353 | B1354: 1 | C1354: 1 | D1354: 牛魔BOSS2 | E1354: 狂龙
A1355: 353 | B1355: 1 | C1355: 1 | D1355: 牛魔BOSS2 | E1355: 朱雀衣服
A1356: 353 | B1356: 1 | C1356: 1 | D1356: 牛魔BOSS2 | E1356: 朱雀头盔
A1357: 353 | B1357: 1 | C1357: 1 | D1357: 牛魔BOSS2 | E1357: 朱雀项链
A1358: 353 | B1358: 1 | C1358: 1 | D1358: 牛魔BOSS2 | E1358: 朱雀手镯
A1359: 353 | B1359: 1 | C1359: 1 | D1359: 牛魔BOSS2 | E1359: 朱雀戒指
A1360: 353 | B1360: 1 | C1360: 1 | D1360: 牛魔BOSS2 | E1360: 朱雀腰带
A1361: 353 | B1361: 1 | C1361: 1 | D1361: 牛魔BOSS2 | E1361: 朱雀鞋子
A1362: 353 | B1362: 1 | C1362: 1 | D1362: 牛魔BOSS2 | E1362: 天蛇
A1363: 353 | B1363: 1 | C1363: 1 | D1363: 牛魔BOSS2 | E1363: 青龙衣服
A1364: 353 | B1364: 1 | C1364: 1 | D1364: 牛魔BOSS2 | E1364: 青龙头盔
A1365: 353 | B1365: 1 | C1365: 1 | D1365: 牛魔BOSS2 | E1365: 青龙项链
A1366: 353 | B1366: 1 | C1366: 1 | D1366: 牛魔BOSS2 | E1366: 青龙手镯
A1367: 353 | B1367: 1 | C1367: 1 | D1367: 牛魔BOSS2 | E1367: 青龙戒指
A1368: 353 | B1368: 1 | C1368: 1 | D1368: 牛魔BOSS2 | E1368: 青龙腰带
A1369: 353 | B1369: 1 | C1369: 1 | D1369: 牛魔BOSS2 | E1369: 青龙鞋子
A1370: 354 | B1370: 1 | C1370: 3 | D1370: 牛魔BOSS2 | E1370: 战刃
A1371: 354 | B1371: 1 | C1371: 3 | D1371: 牛魔BOSS2 | E1371: 圣武衣服
A1372: 354 | B1372: 1 | C1372: 3 | D1372: 牛魔BOSS2 | E1372: 圣武项链
A1373: 354 | B1373: 1 | C1373: 3 | D1373: 牛魔BOSS2 | E1373: 圣武戒指
A1374: 354 | B1374: 1 | C1374: 3 | D1374: 牛魔BOSS2 | E1374: 圣武头盔
A1375: 354 | B1375: 1 | C1375: 3 | D1375: 牛魔BOSS2 | E1375: 圣武手镯
A1376: 354 | B1376: 1 | C1376: 3 | D1376: 牛魔BOSS2 | E1376: 圣武腰带
A1377: 354 | B1377: 1 | C1377: 3 | D1377: 牛魔BOSS2 | E1377: 圣武鞋子
A1378: 354 | B1378: 1 | C1378: 3 | D1378: 牛魔BOSS2 | E1378: 轮回
A1379: 354 | B1379: 1 | C1379: 3 | D1379: 牛魔BOSS2 | E1379: 圣魔衣服
A1380: 354 | B1380: 1 | C1380: 3 | D1380: 牛魔BOSS2 | E1380: 圣魔项链
A1381: 354 | B1381: 1 | C1381: 3 | D1381: 牛魔BOSS2 | E1381: 圣魔戒指
A1382: 354 | B1382: 1 | C1382: 3 | D1382: 牛魔BOSS2 | E1382: 圣魔头盔
A1383: 354 | B1383: 1 | C1383: 3 | D1383: 牛魔BOSS2 | E1383: 圣魔手镯
A1384: 354 | B1384: 1 | C1384: 3 | D1384: 牛魔BOSS2 | E1384: 圣魔腰带
A1385: 354 | B1385: 1 | C1385: 3 | D1385: 牛魔BOSS2 | E1385: 圣魔鞋子
A1386: 354 | B1386: 1 | C1386: 3 | D1386: 牛魔BOSS2 | E1386: 太虚
A1387: 354 | B1387: 1 | C1387: 3 | D1387: 牛魔BOSS2 | E1387: 圣魂衣服
A1388: 354 | B1388: 1 | C1388: 3 | D1388: 牛魔BOSS2 | E1388: 圣魂项链
A1389: 354 | B1389: 1 | C1389: 3 | D1389: 牛魔BOSS2 | E1389: 圣魂戒指
A1390: 354 | B1390: 1 | C1390: 3 | D1390: 牛魔BOSS2 | E1390: 圣魂头盔
A1391: 354 | B1391: 1 | C1391: 3 | D1391: 牛魔BOSS2 | E1391: 圣魂手镯
A1392: 354 | B1392: 1 | C1392: 3 | D1392: 牛魔BOSS2 | E1392: 圣魂腰带
A1393: 354 | B1393: 1 | C1393: 3 | D1393: 牛魔BOSS2 | E1393: 圣魂鞋子
A1394: 166 | B1394: 1 | C1394: 7 | D1394: 牛魔BOSS2 | E1394: 麻痹戒指
A1395: 166 | B1395: 1 | C1395: 7 | D1395: 牛魔BOSS2 | E1395: 护身戒指
A1396: 166 | B1396: 1 | C1396: 7 | D1396: 牛魔BOSS2 | E1396: 复活戒指
A1397: 356 | B1397: 4 | C1397: 1 | D1397: 牛魔BOSS2 | E1397: 上古神石
A1398: 357 | B1398: 1 | C1398: 1 | D1398: 牛魔BOSS2 | E1398: 特面
A1399: 358 | B1399: 1 | C1399: 1 | D1399: 牛魔BOSS2 | E1399: 特腿
A1400: 359 | B1400: 1 | C1400: 1 | D1400: 牛魔BOSS2 | E1400: 特肩
A1401: 36 | B1401: 1 | C1401: 1 | D1401: 牛魔BOSS2 | E1401: 狂风斩书
A1402: 37 | B1402: 1 | C1402: 1 | D1402: 牛魔BOSS2 | E1402: 逐日剑法书
A1403: 38 | B1403: 1 | C1403: 1 | D1403: 牛魔BOSS2 | E1403: 诱惑之光书
A1404: 39 | B1404: 1 | C1404: 1 | D1404: 牛魔BOSS2 | E1404: 流星火雨书
A1405: 40 | B1405: 1 | C1405: 1 | D1405: 牛魔BOSS2 | E1405: 召唤神兽书
A1406: 41 | B1406: 1 | C1406: 1 | D1406: 牛魔BOSS2 | E1406: 嗜血术书
A1407: 366 | B1407: 1 | C1407: 1 | D1407: 牛魔BOSS2 | E1407: 怒斩
A1408: 366 | B1408: 1 | C1408: 1 | D1408: 牛魔BOSS2 | E1408: 龙牙
A1409: 366 | B1409: 1 | C1409: 1 | D1409: 牛魔BOSS2 | E1409: 龙纹
A1410: 367 | B1410: 1 | C1410: 1 | D1410: 牛魔BOSS2 | E1410: 至尊屠龙
A1411: 367 | B1411: 1 | C1411: 1 | D1411: 牛魔BOSS2 | E1411: 至尊噬魂
A1412: 367 | B1412: 1 | C1412: 1 | D1412: 牛魔BOSS2 | E1412: 至尊逍遥扇
A1413: 368 | B1413: 20 | C1413: 1 | D1413: 牛魔BOSS2 | E1413: 进阶丹
A1414: 369 | B1414: 1 | C1414: 1 | D1414: 牛魔BOSS2 | E1414: 金刚石
A1415: 370 | B1415: 100 | C1415: 1 | D1415: 牛魔BOSS2 | E1415: 2元宝
A1416: 371 | B1416: 10 | C1416: 1 | D1416: 牛魔BOSS2 | E1416: 5元宝
A1417: 372 | B1417: 10 | C1417: 1 | D1417: 牛魔BOSS2 | E1417: 10元宝
A1418: 373 | B1418: 10 | C1418: 1 | D1418: 牛魔BOSS2 | E1418: 20元宝
A1419: 374 | B1419: 5 | C1419: 1 | D1419: 牛魔BOSS2 | E1419: 50元宝
A1420: 375 | B1420: 6 | C1420: 1 | D1420: 牛魔BOSS2 | E1420: 100元宝
A1421: 376 | B1421: 4 | C1421: 1 | D1421: 牛魔BOSS2 | E1421: 150元宝
A1422: 377 | B1422: 3 | C1422: 1 | D1422: 牛魔BOSS2 | E1422: 200元宝