Sheet: 掉落周期配置
A1: goods_id | B1: type | E1: drop_type
A2: id
A3: 道具id | B3: 怪物掉落类型 | C3: 怪物类型 | D3: 物品名称 | E3: 掉落分类
A4: 110109 | B4: 1 | C4: =VLOOKUP(RC[-1],工作表2!C[1]:C[2],2,0) -> 野外小怪 | D4: 金刚石 | E4: 1
A5: 110140 | B5: 1 | C5: =VLOOKUP(RC[-1],工作表2!C[1]:C[2],2,0) -> 野外小怪 | D5: 进阶丹 | E5: 2
A6: 110154 | B6: 1 | C6: =VLOOKUP(RC[-1],工作表2!C[1]:C[2],2,0) -> 野外小怪 | D6: 2元宝 | E6: 3
A7: 110007 | B7: 1 | C7: =VLOOKUP(RC[-1],工作表2!C[1]:C[2],2,0) -> 野外小怪 | D7: 超级太阳水 | E7: 4
A8: 110109 | B8: 2 | C8: =VLOOKUP(RC[-1],工作表2!C[1]:C[2],2,0) -> 精英怪 | D8: 金刚石 | E8: 1
A9: 110155 | B9: 2 | C9: =VLOOKUP(RC[-1],工作表2!C[1]:C[2],2,0) -> 精英怪 | D9: 5元宝 | E9: 5
A10: 110156 | B10: 2 | C10: =VLOOKUP(RC[-1],工作表2!C[1]:C[2],2,0) -> 精英怪 | D10: 10元宝 | E10: 6
A11: 200030 | B11: 3 | C11: =VLOOKUP(RC[-1],工作表2!C[1]:C[2],2,0) -> 骷髅精灵 | D11: 开天 | E11: 1
A12: 200031 | B12: 3 | C12: =VLOOKUP(RC[-1],工作表2!C[1]:C[2],2,0) -> 骷髅精灵 | D12: 雷霆战甲 | E12: 1
A13: 200032 | B13: 3 | C13: =VLOOKUP(RC[-1],工作表2!C[1]:C[2],2,0) -> 骷髅精灵 | D13: 雷霆项链 | E13: 1
A14: 200033 | B14: 3 | C14: =VLOOKUP(RC[-1],工作表2!C[1]:C[2],2,0) -> 骷髅精灵 | D14: 雷霆戒指 | E14: 1
A15: 200035 | B15: 3 | C15: =VLOOKUP(RC[-1],工作表2!C[1]:C[2],2,0) -> 骷髅精灵 | D15: 雷霆头盔 | E15: 1
A16: 200036 | B16: 3 | C16: =VLOOKUP(RC[-1],工作表2!C[1]:C[2],2,0) -> 骷髅精灵 | D16: 雷霆护腕 | E16: 1
A17: 200037 | B17: 3 | C17: =VLOOKUP(RC[-1],工作表2!C[1]:C[2],2,0) -> 骷髅精灵 | D17: 雷霆腰带 | E17: 1
A18: 200039 | B18: 3 | C18: =VLOOKUP(RC[-1],工作表2!C[1]:C[2],2,0) -> 骷髅精灵 | D18: 雷霆战靴 | E18: 1
A19: 201030 | B19: 3 | C19: =VLOOKUP(RC[-1],工作表2!C[1]:C[2],2,0) -> 骷髅精灵 | D19: 震天 | E19: 1
A20: 201031 | B20: 3 | C20: =VLOOKUP(RC[-1],工作表2!C[1]:C[2],2,0) -> 骷髅精灵 | D20: 烈焰法袍 | E20: 1
A21: 201032 | B21: 3 | C21: =VLOOKUP(RC[-1],工作表2!C[1]:C[2],2,0) -> 骷髅精灵 | D21: 烈焰魔链 | E21: 1
A22: 201033 | B22: 3 | C22: =VLOOKUP(RC[-1],工作表2!C[1]:C[2],2,0) -> 骷髅精灵 | D22: 烈焰魔指 | E22: 1
A23: 201035 | B23: 3 | C23: =VLOOKUP(RC[-1],工作表2!C[1]:C[2],2,0) -> 骷髅精灵 | D23: 烈焰头盔 | E23: 1
A24: 201036 | B24: 3 | C24: =VLOOKUP(RC[-1],工作表2!C[1]:C[2],2,0) -> 骷髅精灵 | D24: 烈焰护腕 | E24: 1
A25: 201037 | B25: 3 | C25: =VLOOKUP(RC[-1],工作表2!C[1]:C[2],2,0) -> 骷髅精灵 | D25: 烈焰腰带 | E25: 1
A26: 201039 | B26: 3 | C26: =VLOOKUP(RC[-1],工作表2!C[1]:C[2],2,0) -> 骷髅精灵 | D26: 烈焰魔靴 | E26: 1
A27: 202030 | B27: 3 | C27: =VLOOKUP(RC[-1],工作表2!C[1]:C[2],2,0) -> 骷髅精灵 | D27: 玄天 | E27: 1
A28: 202031 | B28: 3 | C28: =VLOOKUP(RC[-1],工作表2!C[1]:C[2],2,0) -> 骷髅精灵 | D28: 光芒道袍 | E28: 1
A29: 202032 | B29: 3 | C29: =VLOOKUP(RC[-1],工作表2!C[1]:C[2],2,0) -> 骷髅精灵 | D29: 光芒道链 | E29: 1
A30: 202033 | B30: 3 | C30: =VLOOKUP(RC[-1],工作表2!C[1]:C[2],2,0) -> 骷髅精灵 | D30: 光芒道戒 | E30: 1
A31: 202035 | B31: 3 | C31: =VLOOKUP(RC[-1],工作表2!C[1]:C[2],2,0) -> 骷髅精灵 | D31: 光芒头盔 | E31: 1
A32: 202036 | B32: 3 | C32: =VLOOKUP(RC[-1],工作表2!C[1]:C[2],2,0) -> 骷髅精灵 | D32: 光芒护腕 | E32: 1
A33: 202037 | B33: 3 | C33: =VLOOKUP(RC[-1],工作表2!C[1]:C[2],2,0) -> 骷髅精灵 | D33: 光芒腰带 | E33: 1
A34: 202039 | B34: 3 | C34: =VLOOKUP(RC[-1],工作表2!C[1]:C[2],2,0) -> 骷髅精灵 | D34: 光芒道靴 | E34: 1
A35: 200060 | B35: 3 | C35: =VLOOKUP(RC[-1],工作表2!C[1]:C[2],2,0) -> 骷髅精灵 | D35: 混沌 | E35: 2
A36: 200061 | B36: 3 | C36: =VLOOKUP(RC[-1],工作表2!C[1]:C[2],2,0) -> 骷髅精灵 | D36: 白虎衣服 | E36: 2
A37: 200062 | B37: 3 | C37: =VLOOKUP(RC[-1],工作表2!C[1]:C[2],2,0) -> 骷髅精灵 | D37: 白虎头盔 | E37: 2
A38: 200063 | B38: 3 | C38: =VLOOKUP(RC[-1],工作表2!C[1]:C[2],2,0) -> 骷髅精灵 | D38: 白虎项链 | E38: 2
A39: 200065 | B39: 3 | C39: =VLOOKUP(RC[-1],工作表2!C[1]:C[2],2,0) -> 骷髅精灵 | D39: 白虎手镯 | E39: 2
A40: 200066 | B40: 3 | C40: =VLOOKUP(RC[-1],工作表2!C[1]:C[2],2,0) -> 骷髅精灵 | D40: 白虎戒指 | E40: 2
A41: 200067 | B41: 3 | C41: =VLOOKUP(RC[-1],工作表2!C[1]:C[2],2,0) -> 骷髅精灵 | D41: 白虎腰带 | E41: 2
A42: 200069 | B42: 3 | C42: =VLOOKUP(RC[-1],工作表2!C[1]:C[2],2,0) -> 骷髅精灵 | D42: 白虎鞋子 | E42: 2
A43: 201060 | B43: 3 | C43: =VLOOKUP(RC[-1],工作表2!C[1]:C[2],2,0) -> 骷髅精灵 | D43: 狂龙 | E43: 2
A44: 201061 | B44: 3 | C44: =VLOOKUP(RC[-1],工作表2!C[1]:C[2],2,0) -> 骷髅精灵 | D44: 朱雀衣服 | E44: 2
A45: 201062 | B45: 3 | C45: =VLOOKUP(RC[-1],工作表2!C[1]:C[2],2,0) -> 骷髅精灵 | D45: 朱雀头盔 | E45: 2
A46: 201063 | B46: 3 | C46: =VLOOKUP(RC[-1],工作表2!C[1]:C[2],2,0) -> 骷髅精灵 | D46: 朱雀项链 | E46: 2
A47: 201065 | B47: 3 | C47: =VLOOKUP(RC[-1],工作表2!C[1]:C[2],2,0) -> 骷髅精灵 | D47: 朱雀手镯 | E47: 2
A48: 201066 | B48: 3 | C48: =VLOOKUP(RC[-1],工作表2!C[1]:C[2],2,0) -> 骷髅精灵 | D48: 朱雀戒指 | E48: 2
A49: 201067 | B49: 3 | C49: =VLOOKUP(RC[-1],工作表2!C[1]:C[2],2,0) -> 骷髅精灵 | D49: 朱雀腰带 | E49: 2
A50: 201069 | B50: 3 | C50: =VLOOKUP(RC[-1],工作表2!C[1]:C[2],2,0) -> 骷髅精灵 | D50: 朱雀鞋子 | E50: 2
A51: 202060 | B51: 3 | C51: =VLOOKUP(RC[-1],工作表2!C[1]:C[2],2,0) -> 骷髅精灵 | D51: 天蛇 | E51: 2
A52: 202061 | B52: 3 | C52: =VLOOKUP(RC[-1],工作表2!C[1]:C[2],2,0) -> 骷髅精灵 | D52: 青龙衣服 | E52: 2
A53: 202062 | B53: 3 | C53: =VLOOKUP(RC[-1],工作表2!C[1]:C[2],2,0) -> 骷髅精灵 | D53: 青龙头盔 | E53: 2
A54: 202063 | B54: 3 | C54: =VLOOKUP(RC[-1],工作表2!C[1]:C[2],2,0) -> 骷髅精灵 | D54: 青龙项链 | E54: 2
A55: 202065 | B55: 3 | C55: =VLOOKUP(RC[-1],工作表2!C[1]:C[2],2,0) -> 骷髅精灵 | D55: 青龙手镯 | E55: 2
A56: 202066 | B56: 3 | C56: =VLOOKUP(RC[-1],工作表2!C[1]:C[2],2,0) -> 骷髅精灵 | D56: 青龙戒指 | E56: 2
A57: 202067 | B57: 3 | C57: =VLOOKUP(RC[-1],工作表2!C[1]:C[2],2,0) -> 骷髅精灵 | D57: 青龙腰带 | E57: 2
A58: 202069 | B58: 3 | C58: =VLOOKUP(RC[-1],工作表2!C[1]:C[2],2,0) -> 骷髅精灵 | D58: 青龙鞋子 | E58: 2
A59: 200070 | B59: 3 | C59: =VLOOKUP(RC[-1],工作表2!C[1]:C[2],2,0) -> 骷髅精灵 | D59: 战刃 | E59: 3
A60: 200071 | B60: 3 | C60: =VLOOKUP(RC[-1],工作表2!C[1]:C[2],2,0) -> 骷髅精灵 | D60: 圣武衣服 | E60: 3
A61: 200072 | B61: 3 | C61: =VLOOKUP(RC[-1],工作表2!C[1]:C[2],2,0) -> 骷髅精灵 | D61: 圣武项链 | E61: 3
A62: 200073 | B62: 3 | C62: =VLOOKUP(RC[-1],工作表2!C[1]:C[2],2,0) -> 骷髅精灵 | D62: 圣武戒指 | E62: 3
A63: 200075 | B63: 3 | C63: =VLOOKUP(RC[-1],工作表2!C[1]:C[2],2,0) -> 骷髅精灵 | D63: 圣武头盔 | E63: 3
A64: 200076 | B64: 3 | C64: =VLOOKUP(RC[-1],工作表2!C[1]:C[2],2,0) -> 骷髅精灵 | D64: 圣武手镯 | E64: 3
A65: 200077 | B65: 3 | C65: =VLOOKUP(RC[-1],工作表2!C[1]:C[2],2,0) -> 骷髅精灵 | D65: 圣武腰带 | E65: 3
A66: 200079 | B66: 3 | C66: =VLOOKUP(RC[-1],工作表2!C[1]:C[2],2,0) -> 骷髅精灵 | D66: 圣武鞋子 | E66: 3
A67: 201070 | B67: 3 | C67: =VLOOKUP(RC[-1],工作表2!C[1]:C[2],2,0) -> 骷髅精灵 | D67: 轮回 | E67: 3
A68: 201071 | B68: 3 | C68: =VLOOKUP(RC[-1],工作表2!C[1]:C[2],2,0) -> 骷髅精灵 | D68: 圣魔衣服 | E68: 3
A69: 201072 | B69: 3 | C69: =VLOOKUP(RC[-1],工作表2!C[1]:C[2],2,0) -> 骷髅精灵 | D69: 圣魔项链 | E69: 3
A70: 201073 | B70: 3 | C70: =VLOOKUP(RC[-1],工作表2!C[1]:C[2],2,0) -> 骷髅精灵 | D70: 圣魔戒指 | E70: 3
A71: 201075 | B71: 3 | C71: =VLOOKUP(RC[-1],工作表2!C[1]:C[2],2,0) -> 骷髅精灵 | D71: 圣魔头盔 | E71: 3
A72: 201076 | B72: 3 | C72: =VLOOKUP(RC[-1],工作表2!C[1]:C[2],2,0) -> 骷髅精灵 | D72: 圣魔手镯 | E72: 3
A73: 201077 | B73: 3 | C73: =VLOOKUP(RC[-1],工作表2!C[1]:C[2],2,0) -> 骷髅精灵 | D73: 圣魔腰带 | E73: 3
A74: 201079 | B74: 3 | C74: =VLOOKUP(RC[-1],工作表2!C[1]:C[2],2,0) -> 骷髅精灵 | D74: 圣魔鞋子 | E74: 3
A75: 202070 | B75: 3 | C75: =VLOOKUP(RC[-1],工作表2!C[1]:C[2],2,0) -> 骷髅精灵 | D75: 太虚 | E75: 3
A76: 202071 | B76: 3 | C76: =VLOOKUP(RC[-1],工作表2!C[1]:C[2],2,0) -> 骷髅精灵 | D76: 圣魂衣服 | E76: 3
A77: 202072 | B77: 3 | C77: =VLOOKUP(RC[-1],工作表2!C[1]:C[2],2,0) -> 骷髅精灵 | D77: 圣魂项链 | E77: 3
A78: 202073 | B78: 3 | C78: =VLOOKUP(RC[-1],工作表2!C[1]:C[2],2,0) -> 骷髅精灵 | D78: 圣魂戒指 | E78: 3
A79: 202075 | B79: 3 | C79: =VLOOKUP(RC[-1],工作表2!C[1]:C[2],2,0) -> 骷髅精灵 | D79: 圣魂头盔 | E79: 3
A80: 202076 | B80: 3 | C80: =VLOOKUP(RC[-1],工作表2!C[1]:C[2],2,0) -> 骷髅精灵 | D80: 圣魂手镯 | E80: 3
A81: 202077 | B81: 3 | C81: =VLOOKUP(RC[-1],工作表2!C[1]:C[2],2,0) -> 骷髅精灵 | D81: 圣魂腰带 | E81: 3
A82: 202079 | B82: 3 | C82: =VLOOKUP(RC[-1],工作表2!C[1]:C[2],2,0) -> 骷髅精灵 | D82: 圣魂鞋子 | E82: 3
A83: 305000 | B83: 3 | C83: =VLOOKUP(RC[-1],工作表2!C[1]:C[2],2,0) -> 骷髅精灵 | D83: 麻痹戒指 | E83: 4
A84: 305001 | B84: 3 | C84: =VLOOKUP(RC[-1],工作表2!C[1]:C[2],2,0) -> 骷髅精灵 | D84: 护身戒指 | E84: 4
A85: 305002 | B85: 3 | C85: =VLOOKUP(RC[-1],工作表2!C[1]:C[2],2,0) -> 骷髅精灵 | D85: 复活戒指 | E85: 4
A86: 110163 | B86: 3 | C86: =VLOOKUP(RC[-1],工作表2!C[1]:C[2],2,0) -> 骷髅精灵 | D86: 上古神石 | E86: 5
A87: 305013 | B87: 3 | C87: =VLOOKUP(RC[-1],工作表2!C[1]:C[2],2,0) -> 骷髅精灵 | D87: 特面 | E87: 6
A88: 305014 | B88: 3 | C88: =VLOOKUP(RC[-1],工作表2!C[1]:C[2],2,0) -> 骷髅精灵 | D88: 特腿 | E88: 7
A89: 305015 | B89: 3 | C89: =VLOOKUP(RC[-1],工作表2!C[1]:C[2],2,0) -> 骷髅精灵 | D89: 特肩 | E89: 8
A90: 110024 | B90: 3 | C90: =VLOOKUP(RC[-1],工作表2!C[1]:C[2],2,0) -> 骷髅精灵 | D90: 狂风斩书 | E90: 36
A91: 110025 | B91: 3 | C91: =VLOOKUP(RC[-1],工作表2!C[1]:C[2],2,0) -> 骷髅精灵 | D91: 逐日剑法书 | E91: 37
A92: 110067 | B92: 3 | C92: =VLOOKUP(RC[-1],工作表2!C[1]:C[2],2,0) -> 骷髅精灵 | D92: 诱惑之光书 | E92: 38
A93: 110040 | B93: 3 | C93: =VLOOKUP(RC[-1],工作表2!C[1]:C[2],2,0) -> 骷髅精灵 | D93: 流星火雨书 | E93: 39
A94: 110031 | B94: 3 | C94: =VLOOKUP(RC[-1],工作表2!C[1]:C[2],2,0) -> 骷髅精灵 | D94: 召唤神兽书 | E94: 40
A95: 110032 | B95: 3 | C95: =VLOOKUP(RC[-1],工作表2!C[1]:C[2],2,0) -> 骷髅精灵 | D95: 嗜血术书 | E95: 41
A96: 305003 | B96: 3 | C96: =VLOOKUP(RC[-1],工作表2!C[1]:C[2],2,0) -> 骷髅精灵 | D96: 怒斩 | E96: 15
A97: 305004 | B97: 3 | C97: =VLOOKUP(RC[-1],工作表2!C[1]:C[2],2,0) -> 骷髅精灵 | D97: 龙牙 | E97: 15
A98: 305005 | B98: 3 | C98: =VLOOKUP(RC[-1],工作表2!C[1]:C[2],2,0) -> 骷髅精灵 | D98: 龙纹 | E98: 15
A99: 305006 | B99: 3 | C99: =VLOOKUP(RC[-1],工作表2!C[1]:C[2],2,0) -> 骷髅精灵 | D99: 至尊屠龙 | E99: 16
A100: 305007 | B100: 3 | C100: =VLOOKUP(RC[-1],工作表2!C[1]:C[2],2,0) -> 骷髅精灵 | D100: 至尊噬魂 | E100: 16
A101: 305008 | B101: 3 | C101: =VLOOKUP(RC[-1],工作表2!C[1]:C[2],2,0) -> 骷髅精灵 | D101: 至尊逍遥扇 | E101: 16
A102: 110140 | B102: 3 | C102: =VLOOKUP(RC[-1],工作表2!C[1]:C[2],2,0) -> 骷髅精灵 | D102: 进阶丹 | E102: 17
A103: 110109 | B103: 3 | C103: =VLOOKUP(RC[-1],工作表2!C[1]:C[2],2,0) -> 骷髅精灵 | D103: 金刚石 | E103: 18
A104: 110154 | B104: 3 | C104: =VLOOKUP(RC[-1],工作表2!C[1]:C[2],2,0) -> 骷髅精灵 | D104: 2元宝 | E104: 19
A105: 110155 | B105: 3 | C105: =VLOOKUP(RC[-1],工作表2!C[1]:C[2],2,0) -> 骷髅精灵 | D105: 5元宝 | E105: 20
A106: 110156 | B106: 3 | C106: =VLOOKUP(RC[-1],工作表2!C[1]:C[2],2,0) -> 骷髅精灵 | D106: 10元宝 | E106: 21
A107: 110157 | B107: 3 | C107: =VLOOKUP(RC[-1],工作表2!C[1]:C[2],2,0) -> 骷髅精灵 | D107: 20元宝 | E107: 22
A108: 110158 | B108: 3 | C108: =VLOOKUP(RC[-1],工作表2!C[1]:C[2],2,0) -> 骷髅精灵 | D108: 50元宝 | E108: 23
A109: 110159 | B109: 3 | C109: =VLOOKUP(RC[-1],工作表2!C[1]:C[2],2,0) -> 骷髅精灵 | D109: 100元宝 | E109: 24
A110: 110164 | B110: 3 | C110: =VLOOKUP(RC[-1],工作表2!C[1]:C[2],2,0) -> 骷髅精灵 | D110: 150元宝 | E110: 25
A111: 110165 | B111: 3 | C111: =VLOOKUP(RC[-1],工作表2!C[1]:C[2],2,0) -> 骷髅精灵 | D111: 200元宝 | E111: 26
A112: 200030 | B112: =R[-101]C+1 -> 4 | C112: =VLOOKUP(RC[-1],工作表2!C[1]:C[2],2,0) -> 铁甲尸王 | D112: 开天 | E112: 28
A113: 200031 | B113: =R[-101]C+1 -> 4 | C113: =VLOOKUP(RC[-1],工作表2!C[1]:C[2],2,0) -> 铁甲尸王 | D113: 雷霆战甲 | E113: 28
A114: 200032 | B114: =R[-101]C+1 -> 4 | C114: =VLOOKUP(RC[-1],工作表2!C[1]:C[2],2,0) -> 铁甲尸王 | D114: 雷霆项链 | E114: 28
A115: 200033 | B115: =R[-101]C+1 -> 4 | C115: =VLOOKUP(RC[-1],工作表2!C[1]:C[2],2,0) -> 铁甲尸王 | D115: 雷霆戒指 | E115: 28
A116: 200035 | B116: =R[-101]C+1 -> 4 | C116: =VLOOKUP(RC[-1],工作表2!C[1]:C[2],2,0) -> 铁甲尸王 | D116: 雷霆头盔 | E116: 28
A117: 200036 | B117: =R[-101]C+1 -> 4 | C117: =VLOOKUP(RC[-1],工作表2!C[1]:C[2],2,0) -> 铁甲尸王 | D117: 雷霆护腕 | E117: 28
A118: 200037 | B118: =R[-101]C+1 -> 4 | C118: =VLOOKUP(RC[-1],工作表2!C[1]:C[2],2,0) -> 铁甲尸王 | D118: 雷霆腰带 | E118: 28
A119: 200039 | B119: =R[-101]C+1 -> 4 | C119: =VLOOKUP(RC[-1],工作表2!C[1]:C[2],2,0) -> 铁甲尸王 | D119: 雷霆战靴 | E119: 28
A120: 201030 | B120: =R[-101]C+1 -> 4 | C120: =VLOOKUP(RC[-1],工作表2!C[1]:C[2],2,0) -> 铁甲尸王 | D120: 震天 | E120: 28
A121: 201031 | B121: =R[-101]C+1 -> 4 | C121: =VLOOKUP(RC[-1],工作表2!C[1]:C[2],2,0) -> 铁甲尸王 | D121: 烈焰法袍 | E121: 28
A122: 201032 | B122: =R[-101]C+1 -> 4 | C122: =VLOOKUP(RC[-1],工作表2!C[1]:C[2],2,0) -> 铁甲尸王 | D122: 烈焰魔链 | E122: 28
A123: 201033 | B123: =R[-101]C+1 -> 4 | C123: =VLOOKUP(RC[-1],工作表2!C[1]:C[2],2,0) -> 铁甲尸王 | D123: 烈焰魔指 | E123: 28
A124: 201035 | B124: =R[-101]C+1 -> 4 | C124: =VLOOKUP(RC[-1],工作表2!C[1]:C[2],2,0) -> 铁甲尸王 | D124: 烈焰头盔 | E124: 28
A125: 201036 | B125: =R[-101]C+1 -> 4 | C125: =VLOOKUP(RC[-1],工作表2!C[1]:C[2],2,0) -> 铁甲尸王 | D125: 烈焰护腕 | E125: 28
A126: 201037 | B126: =R[-101]C+1 -> 4 | C126: =VLOOKUP(RC[-1],工作表2!C[1]:C[2],2,0) -> 铁甲尸王 | D126: 烈焰腰带 | E126: 28
A127: 201039 | B127: =R[-101]C+1 -> 4 | C127: =VLOOKUP(RC[-1],工作表2!C[1]:C[2],2,0) -> 铁甲尸王 | D127: 烈焰魔靴 | E127: 28
A128: 202030 | B128: =R[-101]C+1 -> 4 | C128: =VLOOKUP(RC[-1],工作表2!C[1]:C[2],2,0) -> 铁甲尸王 | D128: 玄天 | E128: 28
A129: 202031 | B129: =R[-101]C+1 -> 4 | C129: =VLOOKUP(RC[-1],工作表2!C[1]:C[2],2,0) -> 铁甲尸王 | D129: 光芒道袍 | E129: 28
A130: 202032 | B130: =R[-101]C+1 -> 4 | C130: =VLOOKUP(RC[-1],工作表2!C[1]:C[2],2,0) -> 铁甲尸王 | D130: 光芒道链 | E130: 28
A131: 202033 | B131: =R[-101]C+1 -> 4 | C131: =VLOOKUP(RC[-1],工作表2!C[1]:C[2],2,0) -> 铁甲尸王 | D131: 光芒道戒 | E131: 28
A132: 202035 | B132: =R[-101]C+1 -> 4 | C132: =VLOOKUP(RC[-1],工作表2!C[1]:C[2],2,0) -> 铁甲尸王 | D132: 光芒头盔 | E132: 28
A133: 202036 | B133: =R[-101]C+1 -> 4 | C133: =VLOOKUP(RC[-1],工作表2!C[1]:C[2],2,0) -> 铁甲尸王 | D133: 光芒护腕 | E133: 28
A134: 202037 | B134: =R[-101]C+1 -> 4 | C134: =VLOOKUP(RC[-1],工作表2!C[1]:C[2],2,0) -> 铁甲尸王 | D134: 光芒腰带 | E134: 28
A135: 202039 | B135: =R[-101]C+1 -> 4 | C135: =VLOOKUP(RC[-1],工作表2!C[1]:C[2],2,0) -> 铁甲尸王 | D135: 光芒道靴 | E135: 28
A136: 200060 | B136: =R[-101]C+1 -> 4 | C136: =VLOOKUP(RC[-1],工作表2!C[1]:C[2],2,0) -> 铁甲尸王 | D136: 混沌 | E136: 29
A137: 200061 | B137: =R[-101]C+1 -> 4 | C137: =VLOOKUP(RC[-1],工作表2!C[1]:C[2],2,0) -> 铁甲尸王 | D137: 白虎衣服 | E137: 29
A138: 200062 | B138: =R[-101]C+1 -> 4 | C138: =VLOOKUP(RC[-1],工作表2!C[1]:C[2],2,0) -> 铁甲尸王 | D138: 白虎头盔 | E138: 29
A139: 200063 | B139: =R[-101]C+1 -> 4 | C139: =VLOOKUP(RC[-1],工作表2!C[1]:C[2],2,0) -> 铁甲尸王 | D139: 白虎项链 | E139: 29
A140: 200065 | B140: =R[-101]C+1 -> 4 | C140: =VLOOKUP(RC[-1],工作表2!C[1]:C[2],2,0) -> 铁甲尸王 | D140: 白虎手镯 | E140: 29
A141: 200066 | B141: =R[-101]C+1 -> 4 | C141: =VLOOKUP(RC[-1],工作表2!C[1]:C[2],2,0) -> 铁甲尸王 | D141: 白虎戒指 | E141: 29
A142: 200067 | B142: =R[-101]C+1 -> 4 | C142: =VLOOKUP(RC[-1],工作表2!C[1]:C[2],2,0) -> 铁甲尸王 | D142: 白虎腰带 | E142: 29
A143: 200069 | B143: =R[-101]C+1 -> 4 | C143: =VLOOKUP(RC[-1],工作表2!C[1]:C[2],2,0) -> 铁甲尸王 | D143: 白虎鞋子 | E143: 29
A144: 201060 | B144: =R[-101]C+1 -> 4 | C144: =VLOOKUP(RC[-1],工作表2!C[1]:C[2],2,0) -> 铁甲尸王 | D144: 狂龙 | E144: 29
A145: 201061 | B145: =R[-101]C+1 -> 4 | C145: =VLOOKUP(RC[-1],工作表2!C[1]:C[2],2,0) -> 铁甲尸王 | D145: 朱雀衣服 | E145: 29
A146: 201062 | B146: =R[-101]C+1 -> 4 | C146: =VLOOKUP(RC[-1],工作表2!C[1]:C[2],2,0) -> 铁甲尸王 | D146: 朱雀头盔 | E146: 29
A147: 201063 | B147: =R[-101]C+1 -> 4 | C147: =VLOOKUP(RC[-1],工作表2!C[1]:C[2],2,0) -> 铁甲尸王 | D147: 朱雀项链 | E147: 29
A148: 201065 | B148: =R[-101]C+1 -> 4 | C148: =VLOOKUP(RC[-1],工作表2!C[1]:C[2],2,0) -> 铁甲尸王 | D148: 朱雀手镯 | E148: 29
A149: 201066 | B149: =R[-101]C+1 -> 4 | C149: =VLOOKUP(RC[-1],工作表2!C[1]:C[2],2,0) -> 铁甲尸王 | D149: 朱雀戒指 | E149: 29
A150: 201067 | B150: =R[-101]C+1 -> 4 | C150: =VLOOKUP(RC[-1],工作表2!C[1]:C[2],2,0) -> 铁甲尸王 | D150: 朱雀腰带 | E150: 29
A151: 201069 | B151: =R[-101]C+1 -> 4 | C151: =VLOOKUP(RC[-1],工作表2!C[1]:C[2],2,0) -> 铁甲尸王 | D151: 朱雀鞋子 | E151: 29
A152: 202060 | B152: =R[-101]C+1 -> 4 | C152: =VLOOKUP(RC[-1],工作表2!C[1]:C[2],2,0) -> 铁甲尸王 | D152: 天蛇 | E152: 29
A153: 202061 | B153: =R[-101]C+1 -> 4 | C153: =VLOOKUP(RC[-1],工作表2!C[1]:C[2],2,0) -> 铁甲尸王 | D153: 青龙衣服 | E153: 29
A154: 202062 | B154: =R[-101]C+1 -> 4 | C154: =VLOOKUP(RC[-1],工作表2!C[1]:C[2],2,0) -> 铁甲尸王 | D154: 青龙头盔 | E154: 29
A155: 202063 | B155: =R[-101]C+1 -> 4 | C155: =VLOOKUP(RC[-1],工作表2!C[1]:C[2],2,0) -> 铁甲尸王 | D155: 青龙项链 | E155: 29
A156: 202065 | B156: =R[-101]C+1 -> 4 | C156: =VLOOKUP(RC[-1],工作表2!C[1]:C[2],2,0) -> 铁甲尸王 | D156: 青龙手镯 | E156: 29
A157: 202066 | B157: =R[-101]C+1 -> 4 | C157: =VLOOKUP(RC[-1],工作表2!C[1]:C[2],2,0) -> 铁甲尸王 | D157: 青龙戒指 | E157: 29
A158: 202067 | B158: =R[-101]C+1 -> 4 | C158: =VLOOKUP(RC[-1],工作表2!C[1]:C[2],2,0) -> 铁甲尸王 | D158: 青龙腰带 | E158: 29
A159: 202069 | B159: =R[-101]C+1 -> 4 | C159: =VLOOKUP(RC[-1],工作表2!C[1]:C[2],2,0) -> 铁甲尸王 | D159: 青龙鞋子 | E159: 29
A160: 200070 | B160: =R[-101]C+1 -> 4 | C160: =VLOOKUP(RC[-1],工作表2!C[1]:C[2],2,0) -> 铁甲尸王 | D160: 战刃 | E160: 30
A161: 200071 | B161: =R[-101]C+1 -> 4 | C161: =VLOOKUP(RC[-1],工作表2!C[1]:C[2],2,0) -> 铁甲尸王 | D161: 圣武衣服 | E161: 30
A162: 200072 | B162: =R[-101]C+1 -> 4 | C162: =VLOOKUP(RC[-1],工作表2!C[1]:C[2],2,0) -> 铁甲尸王 | D162: 圣武项链 | E162: 30
A163: 200073 | B163: =R[-101]C+1 -> 4 | C163: =VLOOKUP(RC[-1],工作表2!C[1]:C[2],2,0) -> 铁甲尸王 | D163: 圣武戒指 | E163: 30
A164: 200075 | B164: =R[-101]C+1 -> 4 | C164: =VLOOKUP(RC[-1],工作表2!C[1]:C[2],2,0) -> 铁甲尸王 | D164: 圣武头盔 | E164: 30
A165: 200076 | B165: =R[-101]C+1 -> 4 | C165: =VLOOKUP(RC[-1],工作表2!C[1]:C[2],2,0) -> 铁甲尸王 | D165: 圣武手镯 | E165: 30
A166: 200077 | B166: =R[-101]C+1 -> 4 | C166: =VLOOKUP(RC[-1],工作表2!C[1]:C[2],2,0) -> 铁甲尸王 | D166: 圣武腰带 | E166: 30
A167: 200079 | B167: =R[-101]C+1 -> 4 | C167: =VLOOKUP(RC[-1],工作表2!C[1]:C[2],2,0) -> 铁甲尸王 | D167: 圣武鞋子 | E167: 30
A168: 201070 | B168: =R[-101]C+1 -> 4 | C168: =VLOOKUP(RC[-1],工作表2!C[1]:C[2],2,0) -> 铁甲尸王 | D168: 轮回 | E168: 30
A169: 201071 | B169: =R[-101]C+1 -> 4 | C169: =VLOOKUP(RC[-1],工作表2!C[1]:C[2],2,0) -> 铁甲尸王 | D169: 圣魔衣服 | E169: 30
A170: 201072 | B170: =R[-101]C+1 -> 4 | C170: =VLOOKUP(RC[-1],工作表2!C[1]:C[2],2,0) -> 铁甲尸王 | D170: 圣魔项链 | E170: 30
A171: 201073 | B171: =R[-101]C+1 -> 4 | C171: =VLOOKUP(RC[-1],工作表2!C[1]:C[2],2,0) -> 铁甲尸王 | D171: 圣魔戒指 | E171: 30
A172: 201075 | B172: =R[-101]C+1 -> 4 | C172: =VLOOKUP(RC[-1],工作表2!C[1]:C[2],2,0) -> 铁甲尸王 | D172: 圣魔头盔 | E172: 30
A173: 201076 | B173: =R[-101]C+1 -> 4 | C173: =VLOOKUP(RC[-1],工作表2!C[1]:C[2],2,0) -> 铁甲尸王 | D173: 圣魔手镯 | E173: 30
A174: 201077 | B174: =R[-101]C+1 -> 4 | C174: =VLOOKUP(RC[-1],工作表2!C[1]:C[2],2,0) -> 铁甲尸王 | D174: 圣魔腰带 | E174: 30
A175: 201079 | B175: =R[-101]C+1 -> 4 | C175: =VLOOKUP(RC[-1],工作表2!C[1]:C[2],2,0) -> 铁甲尸王 | D175: 圣魔鞋子 | E175: 30
A176: 202070 | B176: =R[-101]C+1 -> 4 | C176: =VLOOKUP(RC[-1],工作表2!C[1]:C[2],2,0) -> 铁甲尸王 | D176: 太虚 | E176: 30
A177: 202071 | B177: =R[-101]C+1 -> 4 | C177: =VLOOKUP(RC[-1],工作表2!C[1]:C[2],2,0) -> 铁甲尸王 | D177: 圣魂衣服 | E177: 30
A178: 202072 | B178: =R[-101]C+1 -> 4 | C178: =VLOOKUP(RC[-1],工作表2!C[1]:C[2],2,0) -> 铁甲尸王 | D178: 圣魂项链 | E178: 30
A179: 202073 | B179: =R[-101]C+1 -> 4 | C179: =VLOOKUP(RC[-1],工作表2!C[1]:C[2],2,0) -> 铁甲尸王 | D179: 圣魂戒指 | E179: 30
A180: 202075 | B180: =R[-101]C+1 -> 4 | C180: =VLOOKUP(RC[-1],工作表2!C[1]:C[2],2,0) -> 铁甲尸王 | D180: 圣魂头盔 | E180: 30
A181: 202076 | B181: =R[-101]C+1 -> 4 | C181: =VLOOKUP(RC[-1],工作表2!C[1]:C[2],2,0) -> 铁甲尸王 | D181: 圣魂手镯 | E181: 30
A182: 202077 | B182: =R[-101]C+1 -> 4 | C182: =VLOOKUP(RC[-1],工作表2!C[1]:C[2],2,0) -> 铁甲尸王 | D182: 圣魂腰带 | E182: 30
A183: 202079 | B183: =R[-101]C+1 -> 4 | C183: =VLOOKUP(RC[-1],工作表2!C[1]:C[2],2,0) -> 铁甲尸王 | D183: 圣魂鞋子 | E183: 30
A184: 305000 | B184: =R[-101]C+1 -> 4 | C184: =VLOOKUP(RC[-1],工作表2!C[1]:C[2],2,0) -> 铁甲尸王 | D184: 麻痹戒指 | E184: 31
A185: 305001 | B185: =R[-101]C+1 -> 4 | C185: =VLOOKUP(RC[-1],工作表2!C[1]:C[2],2,0) -> 铁甲尸王 | D185: 护身戒指 | E185: 31
A186: 305002 | B186: =R[-101]C+1 -> 4 | C186: =VLOOKUP(RC[-1],工作表2!C[1]:C[2],2,0) -> 铁甲尸王 | D186: 复活戒指 | E186: 31
A187: 110163 | B187: =R[-101]C+1 -> 4 | C187: =VLOOKUP(RC[-1],工作表2!C[1]:C[2],2,0) -> 铁甲尸王 | D187: 上古神石 | E187: 32
A188: 305013 | B188: =R[-101]C+1 -> 4 | C188: =VLOOKUP(RC[-1],工作表2!C[1]:C[2],2,0) -> 铁甲尸王 | D188: 特面 | E188: 33
A189: 305014 | B189: =R[-101]C+1 -> 4 | C189: =VLOOKUP(RC[-1],工作表2!C[1]:C[2],2,0) -> 铁甲尸王 | D189: 特腿 | E189: 34
A190: 305015 | B190: =R[-101]C+1 -> 4 | C190: =VLOOKUP(RC[-1],工作表2!C[1]:C[2],2,0) -> 铁甲尸王 | D190: 特肩 | E190: 35
A191: 110024 | B191: =R[-101]C+1 -> 4 | C191: =VLOOKUP(RC[-1],工作表2!C[1]:C[2],2,0) -> 铁甲尸王 | D191: 狂风斩书 | E191: 9
A192: 110025 | B192: =R[-101]C+1 -> 4 | C192: =VLOOKUP(RC[-1],工作表2!C[1]:C[2],2,0) -> 铁甲尸王 | D192: 逐日剑法书 | E192: 10
A193: 110067 | B193: =R[-101]C+1 -> 4 | C193: =VLOOKUP(RC[-1],工作表2!C[1]:C[2],2,0) -> 铁甲尸王 | D193: 诱惑之光书 | E193: 11
A194: 110040 | B194: =R[-101]C+1 -> 4 | C194: =VLOOKUP(RC[-1],工作表2!C[1]:C[2],2,0) -> 铁甲尸王 | D194: 流星火雨书 | E194: 12
A195: 110031 | B195: =R[-101]C+1 -> 4 | C195: =VLOOKUP(RC[-1],工作表2!C[1]:C[2],2,0) -> 铁甲尸王 | D195: 召唤神兽书 | E195: 13
A196: 110032 | B196: =R[-101]C+1 -> 4 | C196: =VLOOKUP(RC[-1],工作表2!C[1]:C[2],2,0) -> 铁甲尸王 | D196: 嗜血术书 | E196: 14
A197: 305003 | B197: =R[-101]C+1 -> 4 | C197: =VLOOKUP(RC[-1],工作表2!C[1]:C[2],2,0) -> 铁甲尸王 | D197: 怒斩 | E197: 42
A198: 305004 | B198: =R[-101]C+1 -> 4 | C198: =VLOOKUP(RC[-1],工作表2!C[1]:C[2],2,0) -> 铁甲尸王 | D198: 龙牙 | E198: 42
A199: 305005 | B199: =R[-101]C+1 -> 4 | C199: =VLOOKUP(RC[-1],工作表2!C[1]:C[2],2,0) -> 铁甲尸王 | D199: 龙纹 | E199: 42
A200: 305006 | B200: =R[-101]C+1 -> 4 | C200: =VLOOKUP(RC[-1],工作表2!C[1]:C[2],2,0) -> 铁甲尸王 | D200: 至尊屠龙 | E200: 43
A201: 305007 | B201: =R[-101]C+1 -> 4 | C201: =VLOOKUP(RC[-1],工作表2!C[1]:C[2],2,0) -> 铁甲尸王 | D201: 至尊噬魂 | E201: 43
A202: 305008 | B202: =R[-101]C+1 -> 4 | C202: =VLOOKUP(RC[-1],工作表2!C[1]:C[2],2,0) -> 铁甲尸王 | D202: 至尊逍遥扇 | E202: 43
A203: 110140 | B203: =R[-101]C+1 -> 4 | C203: =VLOOKUP(RC[-1],工作表2!C[1]:C[2],2,0) -> 铁甲尸王 | D203: 进阶丹 | E203: 44
A204: 110109 | B204: =R[-101]C+1 -> 4 | C204: =VLOOKUP(RC[-1],工作表2!C[1]:C[2],2,0) -> 铁甲尸王 | D204: 金刚石 | E204: 45
A205: 110154 | B205: =R[-101]C+1 -> 4 | C205: =VLOOKUP(RC[-1],工作表2!C[1]:C[2],2,0) -> 铁甲尸王 | D205: 2元宝 | E205: 46
A206: 110155 | B206: =R[-101]C+1 -> 4 | C206: =VLOOKUP(RC[-1],工作表2!C[1]:C[2],2,0) -> 铁甲尸王 | D206: 5元宝 | E206: 47
A207: 110156 | B207: =R[-101]C+1 -> 4 | C207: =VLOOKUP(RC[-1],工作表2!C[1]:C[2],2,0) -> 铁甲尸王 | D207: 10元宝 | E207: 48
A208: 110157 | B208: =R[-101]C+1 -> 4 | C208: =VLOOKUP(RC[-1],工作表2!C[1]:C[2],2,0) -> 铁甲尸王 | D208: 20元宝 | E208: 49
A209: 110158 | B209: =R[-101]C+1 -> 4 | C209: =VLOOKUP(RC[-1],工作表2!C[1]:C[2],2,0) -> 铁甲尸王 | D209: 50元宝 | E209: 50
A210: 110159 | B210: =R[-101]C+1 -> 4 | C210: =VLOOKUP(RC[-1],工作表2!C[1]:C[2],2,0) -> 铁甲尸王 | D210: 100元宝 | E210: 51
A211: 110164 | B211: =R[-101]C+1 -> 4 | C211: =VLOOKUP(RC[-1],工作表2!C[1]:C[2],2,0) -> 铁甲尸王 | D211: 150元宝 | E211: 52
A212: 110165 | B212: =R[-101]C+1 -> 4 | C212: =VLOOKUP(RC[-1],工作表2!C[1]:C[2],2,0) -> 铁甲尸王 | D212: 200元宝 | E212: 53
A213: 200030 | B213: =R[-101]C+1 -> 5 | C213: =VLOOKUP(RC[-1],工作表2!C[1]:C[2],2,0) -> 奥玛教主 | D213: 开天 | E213: 55
A214: 200031 | B214: =R[-101]C+1 -> 5 | C214: =VLOOKUP(RC[-1],工作表2!C[1]:C[2],2,0) -> 奥玛教主 | D214: 雷霆战甲 | E214: 55
A215: 200032 | B215: =R[-101]C+1 -> 5 | C215: =VLOOKUP(RC[-1],工作表2!C[1]:C[2],2,0) -> 奥玛教主 | D215: 雷霆项链 | E215: 55
A216: 200033 | B216: =R[-101]C+1 -> 5 | C216: =VLOOKUP(RC[-1],工作表2!C[1]:C[2],2,0) -> 奥玛教主 | D216: 雷霆戒指 | E216: 55
A217: 200035 | B217: =R[-101]C+1 -> 5 | C217: =VLOOKUP(RC[-1],工作表2!C[1]:C[2],2,0) -> 奥玛教主 | D217: 雷霆头盔 | E217: 55
A218: 200036 | B218: =R[-101]C+1 -> 5 | C218: =VLOOKUP(RC[-1],工作表2!C[1]:C[2],2,0) -> 奥玛教主 | D218: 雷霆护腕 | E218: 55
A219: 200037 | B219: =R[-101]C+1 -> 5 | C219: =VLOOKUP(RC[-1],工作表2!C[1]:C[2],2,0) -> 奥玛教主 | D219: 雷霆腰带 | E219: 55
A220: 200039 | B220: =R[-101]C+1 -> 5 | C220: =VLOOKUP(RC[-1],工作表2!C[1]:C[2],2,0) -> 奥玛教主 | D220: 雷霆战靴 | E220: 55
A221: 201030 | B221: =R[-101]C+1 -> 5 | C221: =VLOOKUP(RC[-1],工作表2!C[1]:C[2],2,0) -> 奥玛教主 | D221: 震天 | E221: 55
A222: 201031 | B222: =R[-101]C+1 -> 5 | C222: =VLOOKUP(RC[-1],工作表2!C[1]:C[2],2,0) -> 奥玛教主 | D222: 烈焰法袍 | E222: 55
A223: 201032 | B223: =R[-101]C+1 -> 5 | C223: =VLOOKUP(RC[-1],工作表2!C[1]:C[2],2,0) -> 奥玛教主 | D223: 烈焰魔链 | E223: 55
A224: 201033 | B224: =R[-101]C+1 -> 5 | C224: =VLOOKUP(RC[-1],工作表2!C[1]:C[2],2,0) -> 奥玛教主 | D224: 烈焰魔指 | E224: 55
A225: 201035 | B225: =R[-101]C+1 -> 5 | C225: =VLOOKUP(RC[-1],工作表2!C[1]:C[2],2,0) -> 奥玛教主 | D225: 烈焰头盔 | E225: 55
A226: 201036 | B226: =R[-101]C+1 -> 5 | C226: =VLOOKUP(RC[-1],工作表2!C[1]:C[2],2,0) -> 奥玛教主 | D226: 烈焰护腕 | E226: 55
A227: 201037 | B227: =R[-101]C+1 -> 5 | C227: =VLOOKUP(RC[-1],工作表2!C[1]:C[2],2,0) -> 奥玛教主 | D227: 烈焰腰带 | E227: 55
A228: 201039 | B228: =R[-101]C+1 -> 5 | C228: =VLOOKUP(RC[-1],工作表2!C[1]:C[2],2,0) -> 奥玛教主 | D228: 烈焰魔靴 | E228: 55
A229: 202030 | B229: =R[-101]C+1 -> 5 | C229: =VLOOKUP(RC[-1],工作表2!C[1]:C[2],2,0) -> 奥玛教主 | D229: 玄天 | E229: 55
A230: 202031 | B230: =R[-101]C+1 -> 5 | C230: =VLOOKUP(RC[-1],工作表2!C[1]:C[2],2,0) -> 奥玛教主 | D230: 光芒道袍 | E230: 55
A231: 202032 | B231: =R[-101]C+1 -> 5 | C231: =VLOOKUP(RC[-1],工作表2!C[1]:C[2],2,0) -> 奥玛教主 | D231: 光芒道链 | E231: 55
A232: 202033 | B232: =R[-101]C+1 -> 5 | C232: =VLOOKUP(RC[-1],工作表2!C[1]:C[2],2,0) -> 奥玛教主 | D232: 光芒道戒 | E232: 55
A233: 202035 | B233: =R[-101]C+1 -> 5 | C233: =VLOOKUP(RC[-1],工作表2!C[1]:C[2],2,0) -> 奥玛教主 | D233: 光芒头盔 | E233: 55
A234: 202036 | B234: =R[-101]C+1 -> 5 | C234: =VLOOKUP(RC[-1],工作表2!C[1]:C[2],2,0) -> 奥玛教主 | D234: 光芒护腕 | E234: 55
A235: 202037 | B235: =R[-101]C+1 -> 5 | C235: =VLOOKUP(RC[-1],工作表2!C[1]:C[2],2,0) -> 奥玛教主 | D235: 光芒腰带 | E235: 55
A236: 202039 | B236: =R[-101]C+1 -> 5 | C236: =VLOOKUP(RC[-1],工作表2!C[1]:C[2],2,0) -> 奥玛教主 | D236: 光芒道靴 | E236: 55
A237: 200060 | B237: =R[-101]C+1 -> 5 | C237: =VLOOKUP(RC[-1],工作表2!C[1]:C[2],2,0) -> 奥玛教主 | D237: 混沌 | E237: 56
A238: 200061 | B238: =R[-101]C+1 -> 5 | C238: =VLOOKUP(RC[-1],工作表2!C[1]:C[2],2,0) -> 奥玛教主 | D238: 白虎衣服 | E238: 56
A239: 200062 | B239: =R[-101]C+1 -> 5 | C239: =VLOOKUP(RC[-1],工作表2!C[1]:C[2],2,0) -> 奥玛教主 | D239: 白虎头盔 | E239: 56
A240: 200063 | B240: =R[-101]C+1 -> 5 | C240: =VLOOKUP(RC[-1],工作表2!C[1]:C[2],2,0) -> 奥玛教主 | D240: 白虎项链 | E240: 56
A241: 200065 | B241: =R[-101]C+1 -> 5 | C241: =VLOOKUP(RC[-1],工作表2!C[1]:C[2],2,0) -> 奥玛教主 | D241: 白虎手镯 | E241: 56
A242: 200066 | B242: =R[-101]C+1 -> 5 | C242: =VLOOKUP(RC[-1],工作表2!C[1]:C[2],2,0) -> 奥玛教主 | D242: 白虎戒指 | E242: 56
A243: 200067 | B243: =R[-101]C+1 -> 5 | C243: =VLOOKUP(RC[-1],工作表2!C[1]:C[2],2,0) -> 奥玛教主 | D243: 白虎腰带 | E243: 56
A244: 200069 | B244: =R[-101]C+1 -> 5 | C244: =VLOOKUP(RC[-1],工作表2!C[1]:C[2],2,0) -> 奥玛教主 | D244: 白虎鞋子 | E244: 56
A245: 201060 | B245: =R[-101]C+1 -> 5 | C245: =VLOOKUP(RC[-1],工作表2!C[1]:C[2],2,0) -> 奥玛教主 | D245: 狂龙 | E245: 56
A246: 201061 | B246: =R[-101]C+1 -> 5 | C246: =VLOOKUP(RC[-1],工作表2!C[1]:C[2],2,0) -> 奥玛教主 | D246: 朱雀衣服 | E246: 56
A247: 201062 | B247: =R[-101]C+1 -> 5 | C247: =VLOOKUP(RC[-1],工作表2!C[1]:C[2],2,0) -> 奥玛教主 | D247: 朱雀头盔 | E247: 56
A248: 201063 | B248: =R[-101]C+1 -> 5 | C248: =VLOOKUP(RC[-1],工作表2!C[1]:C[2],2,0) -> 奥玛教主 | D248: 朱雀项链 | E248: 56
A249: 201065 | B249: =R[-101]C+1 -> 5 | C249: =VLOOKUP(RC[-1],工作表2!C[1]:C[2],2,0) -> 奥玛教主 | D249: 朱雀手镯 | E249: 56
A250: 201066 | B250: =R[-101]C+1 -> 5 | C250: =VLOOKUP(RC[-1],工作表2!C[1]:C[2],2,0) -> 奥玛教主 | D250: 朱雀戒指 | E250: 56
A251: 201067 | B251: =R[-101]C+1 -> 5 | C251: =VLOOKUP(RC[-1],工作表2!C[1]:C[2],2,0) -> 奥玛教主 | D251: 朱雀腰带 | E251: 56
A252: 201069 | B252: =R[-101]C+1 -> 5 | C252: =VLOOKUP(RC[-1],工作表2!C[1]:C[2],2,0) -> 奥玛教主 | D252: 朱雀鞋子 | E252: 56
A253: 202060 | B253: =R[-101]C+1 -> 5 | C253: =VLOOKUP(RC[-1],工作表2!C[1]:C[2],2,0) -> 奥玛教主 | D253: 天蛇 | E253: 56
A254: 202061 | B254: =R[-101]C+1 -> 5 | C254: =VLOOKUP(RC[-1],工作表2!C[1]:C[2],2,0) -> 奥玛教主 | D254: 青龙衣服 | E254: 56
A255: 202062 | B255: =R[-101]C+1 -> 5 | C255: =VLOOKUP(RC[-1],工作表2!C[1]:C[2],2,0) -> 奥玛教主 | D255: 青龙头盔 | E255: 56
A256: 202063 | B256: =R[-101]C+1 -> 5 | C256: =VLOOKUP(RC[-1],工作表2!C[1]:C[2],2,0) -> 奥玛教主 | D256: 青龙项链 | E256: 56
A257: 202065 | B257: =R[-101]C+1 -> 5 | C257: =VLOOKUP(RC[-1],工作表2!C[1]:C[2],2,0) -> 奥玛教主 | D257: 青龙手镯 | E257: 56
A258: 202066 | B258: =R[-101]C+1 -> 5 | C258: =VLOOKUP(RC[-1],工作表2!C[1]:C[2],2,0) -> 奥玛教主 | D258: 青龙戒指 | E258: 56
A259: 202067 | B259: =R[-101]C+1 -> 5 | C259: =VLOOKUP(RC[-1],工作表2!C[1]:C[2],2,0) -> 奥玛教主 | D259: 青龙腰带 | E259: 56
A260: 202069 | B260: =R[-101]C+1 -> 5 | C260: =VLOOKUP(RC[-1],工作表2!C[1]:C[2],2,0) -> 奥玛教主 | D260: 青龙鞋子 | E260: 56
A261: 200070 | B261: =R[-101]C+1 -> 5 | C261: =VLOOKUP(RC[-1],工作表2!C[1]:C[2],2,0) -> 奥玛教主 | D261: 战刃 | E261: 57
A262: 200071 | B262: =R[-101]C+1 -> 5 | C262: =VLOOKUP(RC[-1],工作表2!C[1]:C[2],2,0) -> 奥玛教主 | D262: 圣武衣服 | E262: 57
A263: 200072 | B263: =R[-101]C+1 -> 5 | C263: =VLOOKUP(RC[-1],工作表2!C[1]:C[2],2,0) -> 奥玛教主 | D263: 圣武项链 | E263: 57
A264: 200073 | B264: =R[-101]C+1 -> 5 | C264: =VLOOKUP(RC[-1],工作表2!C[1]:C[2],2,0) -> 奥玛教主 | D264: 圣武戒指 | E264: 57
A265: 200075 | B265: =R[-101]C+1 -> 5 | C265: =VLOOKUP(RC[-1],工作表2!C[1]:C[2],2,0) -> 奥玛教主 | D265: 圣武头盔 | E265: 57
A266: 200076 | B266: =R[-101]C+1 -> 5 | C266: =VLOOKUP(RC[-1],工作表2!C[1]:C[2],2,0) -> 奥玛教主 | D266: 圣武手镯 | E266: 57
A267: 200077 | B267: =R[-101]C+1 -> 5 | C267: =VLOOKUP(RC[-1],工作表2!C[1]:C[2],2,0) -> 奥玛教主 | D267: 圣武腰带 | E267: 57
A268: 200079 | B268: =R[-101]C+1 -> 5 | C268: =VLOOKUP(RC[-1],工作表2!C[1]:C[2],2,0) -> 奥玛教主 | D268: 圣武鞋子 | E268: 57
A269: 201070 | B269: =R[-101]C+1 -> 5 | C269: =VLOOKUP(RC[-1],工作表2!C[1]:C[2],2,0) -> 奥玛教主 | D269: 轮回 | E269: 57
A270: 201071 | B270: =R[-101]C+1 -> 5 | C270: =VLOOKUP(RC[-1],工作表2!C[1]:C[2],2,0) -> 奥玛教主 | D270: 圣魔衣服 | E270: 57
A271: 201072 | B271: =R[-101]C+1 -> 5 | C271: =VLOOKUP(RC[-1],工作表2!C[1]:C[2],2,0) -> 奥玛教主 | D271: 圣魔项链 | E271: 57
A272: 201073 | B272: =R[-101]C+1 -> 5 | C272: =VLOOKUP(RC[-1],工作表2!C[1]:C[2],2,0) -> 奥玛教主 | D272: 圣魔戒指 | E272: 57
A273: 201075 | B273: =R[-101]C+1 -> 5 | C273: =VLOOKUP(RC[-1],工作表2!C[1]:C[2],2,0) -> 奥玛教主 | D273: 圣魔头盔 | E273: 57
A274: 201076 | B274: =R[-101]C+1 -> 5 | C274: =VLOOKUP(RC[-1],工作表2!C[1]:C[2],2,0) -> 奥玛教主 | D274: 圣魔手镯 | E274: 57
A275: 201077 | B275: =R[-101]C+1 -> 5 | C275: =VLOOKUP(RC[-1],工作表2!C[1]:C[2],2,0) -> 奥玛教主 | D275: 圣魔腰带 | E275: 57
A276: 201079 | B276: =R[-101]C+1 -> 5 | C276: =VLOOKUP(RC[-1],工作表2!C[1]:C[2],2,0) -> 奥玛教主 | D276: 圣魔鞋子 | E276: 57
A277: 202070 | B277: =R[-101]C+1 -> 5 | C277: =VLOOKUP(RC[-1],工作表2!C[1]:C[2],2,0) -> 奥玛教主 | D277: 太虚 | E277: 57
A278: 202071 | B278: =R[-101]C+1 -> 5 | C278: =VLOOKUP(RC[-1],工作表2!C[1]:C[2],2,0) -> 奥玛教主 | D278: 圣魂衣服 | E278: 57
A279: 202072 | B279: =R[-101]C+1 -> 5 | C279: =VLOOKUP(RC[-1],工作表2!C[1]:C[2],2,0) -> 奥玛教主 | D279: 圣魂项链 | E279: 57
A280: 202073 | B280: =R[-101]C+1 -> 5 | C280: =VLOOKUP(RC[-1],工作表2!C[1]:C[2],2,0) -> 奥玛教主 | D280: 圣魂戒指 | E280: 57
A281: 202075 | B281: =R[-101]C+1 -> 5 | C281: =VLOOKUP(RC[-1],工作表2!C[1]:C[2],2,0) -> 奥玛教主 | D281: 圣魂头盔 | E281: 57
A282: 202076 | B282: =R[-101]C+1 -> 5 | C282: =VLOOKUP(RC[-1],工作表2!C[1]:C[2],2,0) -> 奥玛教主 | D282: 圣魂手镯 | E282: 57
A283: 202077 | B283: =R[-101]C+1 -> 5 | C283: =VLOOKUP(RC[-1],工作表2!C[1]:C[2],2,0) -> 奥玛教主 | D283: 圣魂腰带 | E283: 57
A284: 202079 | B284: =R[-101]C+1 -> 5 | C284: =VLOOKUP(RC[-1],工作表2!C[1]:C[2],2,0) -> 奥玛教主 | D284: 圣魂鞋子 | E284: 57
A285: 305000 | B285: =R[-101]C+1 -> 5 | C285: =VLOOKUP(RC[-1],工作表2!C[1]:C[2],2,0) -> 奥玛教主 | D285: 麻痹戒指 | E285: 58
A286: 305001 | B286: =R[-101]C+1 -> 5 | C286: =VLOOKUP(RC[-1],工作表2!C[1]:C[2],2,0) -> 奥玛教主 | D286: 护身戒指 | E286: 58
A287: 305002 | B287: =R[-101]C+1 -> 5 | C287: =VLOOKUP(RC[-1],工作表2!C[1]:C[2],2,0) -> 奥玛教主 | D287: 复活戒指 | E287: 58
A288: 110163 | B288: =R[-101]C+1 -> 5 | C288: =VLOOKUP(RC[-1],工作表2!C[1]:C[2],2,0) -> 奥玛教主 | D288: 上古神石 | E288: 59
A289: 305013 | B289: =R[-101]C+1 -> 5 | C289: =VLOOKUP(RC[-1],工作表2!C[1]:C[2],2,0) -> 奥玛教主 | D289: 特面 | E289: 60
A290: 305014 | B290: =R[-101]C+1 -> 5 | C290: =VLOOKUP(RC[-1],工作表2!C[1]:C[2],2,0) -> 奥玛教主 | D290: 特腿 | E290: 61
A291: 305015 | B291: =R[-101]C+1 -> 5 | C291: =VLOOKUP(RC[-1],工作表2!C[1]:C[2],2,0) -> 奥玛教主 | D291: 特肩 | E291: 62
A292: 110024 | B292: =R[-101]C+1 -> 5 | C292: =VLOOKUP(RC[-1],工作表2!C[1]:C[2],2,0) -> 奥玛教主 | D292: 狂风斩书 | E292: 36
A293: 110025 | B293: =R[-101]C+1 -> 5 | C293: =VLOOKUP(RC[-1],工作表2!C[1]:C[2],2,0) -> 奥玛教主 | D293: 逐日剑法书 | E293: 37
A294: 110067 | B294: =R[-101]C+1 -> 5 | C294: =VLOOKUP(RC[-1],工作表2!C[1]:C[2],2,0) -> 奥玛教主 | D294: 诱惑之光书 | E294: 38
A295: 110040 | B295: =R[-101]C+1 -> 5 | C295: =VLOOKUP(RC[-1],工作表2!C[1]:C[2],2,0) -> 奥玛教主 | D295: 流星火雨书 | E295: 39
A296: 110031 | B296: =R[-101]C+1 -> 5 | C296: =VLOOKUP(RC[-1],工作表2!C[1]:C[2],2,0) -> 奥玛教主 | D296: 召唤神兽书 | E296: 40
A297: 110032 | B297: =R[-101]C+1 -> 5 | C297: =VLOOKUP(RC[-1],工作表2!C[1]:C[2],2,0) -> 奥玛教主 | D297: 嗜血术书 | E297: 41
A298: 305003 | B298: =R[-101]C+1 -> 5 | C298: =VLOOKUP(RC[-1],工作表2!C[1]:C[2],2,0) -> 奥玛教主 | D298: 怒斩 | E298: 69
A299: 305004 | B299: =R[-101]C+1 -> 5 | C299: =VLOOKUP(RC[-1],工作表2!C[1]:C[2],2,0) -> 奥玛教主 | D299: 龙牙 | E299: 69
A300: 305005 | B300: =R[-101]C+1 -> 5 | C300: =VLOOKUP(RC[-1],工作表2!C[1]:C[2],2,0) -> 奥玛教主 | D300: 龙纹 | E300: 69
A301: 305006 | B301: =R[-101]C+1 -> 5 | C301: =VLOOKUP(RC[-1],工作表2!C[1]:C[2],2,0) -> 奥玛教主 | D301: 至尊屠龙 | E301: 70
A302: 305007 | B302: =R[-101]C+1 -> 5 | C302: =VLOOKUP(RC[-1],工作表2!C[1]:C[2],2,0) -> 奥玛教主 | D302: 至尊噬魂 | E302: 70
A303: 305008 | B303: =R[-101]C+1 -> 5 | C303: =VLOOKUP(RC[-1],工作表2!C[1]:C[2],2,0) -> 奥玛教主 | D303: 至尊逍遥扇 | E303: 70
A304: 110140 | B304: =R[-101]C+1 -> 5 | C304: =VLOOKUP(RC[-1],工作表2!C[1]:C[2],2,0) -> 奥玛教主 | D304: 进阶丹 | E304: 71
A305: 110109 | B305: =R[-101]C+1 -> 5 | C305: =VLOOKUP(RC[-1],工作表2!C[1]:C[2],2,0) -> 奥玛教主 | D305: 金刚石 | E305: 72
A306: 110154 | B306: =R[-101]C+1 -> 5 | C306: =VLOOKUP(RC[-1],工作表2!C[1]:C[2],2,0) -> 奥玛教主 | D306: 2元宝 | E306: 73
A307: 110155 | B307: =R[-101]C+1 -> 5 | C307: =VLOOKUP(RC[-1],工作表2!C[1]:C[2],2,0) -> 奥玛教主 | D307: 5元宝 | E307: 74
A308: 110156 | B308: =R[-101]C+1 -> 5 | C308: =VLOOKUP(RC[-1],工作表2!C[1]:C[2],2,0) -> 奥玛教主 | D308: 10元宝 | E308: 75
A309: 110157 | B309: =R[-101]C+1 -> 5 | C309: =VLOOKUP(RC[-1],工作表2!C[1]:C[2],2,0) -> 奥玛教主 | D309: 20元宝 | E309: 76
A310: 110158 | B310: =R[-101]C+1 -> 5 | C310: =VLOOKUP(RC[-1],工作表2!C[1]:C[2],2,0) -> 奥玛教主 | D310: 50元宝 | E310: 77
A311: 110159 | B311: =R[-101]C+1 -> 5 | C311: =VLOOKUP(RC[-1],工作表2!C[1]:C[2],2,0) -> 奥玛教主 | D311: 100元宝 | E311: 78
A312: 110164 | B312: =R[-101]C+1 -> 5 | C312: =VLOOKUP(RC[-1],工作表2!C[1]:C[2],2,0) -> 奥玛教主 | D312: 150元宝 | E312: 79
A313: 110165 | B313: =R[-101]C+1 -> 5 | C313: =VLOOKUP(RC[-1],工作表2!C[1]:C[2],2,0) -> 奥玛教主 | D313: 200元宝 | E313: 80
A314: 200030 | B314: =R[-101]C+1 -> 6 | C314: =VLOOKUP(RC[-1],工作表2!C[1]:C[2],2,0) -> 邪恶触龙 | D314: 开天 | E314: 82
A315: 200031 | B315: =R[-101]C+1 -> 6 | C315: =VLOOKUP(RC[-1],工作表2!C[1]:C[2],2,0) -> 邪恶触龙 | D315: 雷霆战甲 | E315: 82
A316: 200032 | B316: =R[-101]C+1 -> 6 | C316: =VLOOKUP(RC[-1],工作表2!C[1]:C[2],2,0) -> 邪恶触龙 | D316: 雷霆项链 | E316: 82
A317: 200033 | B317: =R[-101]C+1 -> 6 | C317: =VLOOKUP(RC[-1],工作表2!C[1]:C[2],2,0) -> 邪恶触龙 | D317: 雷霆戒指 | E317: 82
A318: 200035 | B318: =R[-101]C+1 -> 6 | C318: =VLOOKUP(RC[-1],工作表2!C[1]:C[2],2,0) -> 邪恶触龙 | D318: 雷霆头盔 | E318: 82
A319: 200036 | B319: =R[-101]C+1 -> 6 | C319: =VLOOKUP(RC[-1],工作表2!C[1]:C[2],2,0) -> 邪恶触龙 | D319: 雷霆护腕 | E319: 82
A320: 200037 | B320: =R[-101]C+1 -> 6 | C320: =VLOOKUP(RC[-1],工作表2!C[1]:C[2],2,0) -> 邪恶触龙 | D320: 雷霆腰带 | E320: 82
A321: 200039 | B321: =R[-101]C+1 -> 6 | C321: =VLOOKUP(RC[-1],工作表2!C[1]:C[2],2,0) -> 邪恶触龙 | D321: 雷霆战靴 | E321: 82
A322: 201030 | B322: =R[-101]C+1 -> 6 | C322: =VLOOKUP(RC[-1],工作表2!C[1]:C[2],2,0) -> 邪恶触龙 | D322: 震天 | E322: 82
A323: 201031 | B323: =R[-101]C+1 -> 6 | C323: =VLOOKUP(RC[-1],工作表2!C[1]:C[2],2,0) -> 邪恶触龙 | D323: 烈焰法袍 | E323: 82
A324: 201032 | B324: =R[-101]C+1 -> 6 | C324: =VLOOKUP(RC[-1],工作表2!C[1]:C[2],2,0) -> 邪恶触龙 | D324: 烈焰魔链 | E324: 82
A325: 201033 | B325: =R[-101]C+1 -> 6 | C325: =VLOOKUP(RC[-1],工作表2!C[1]:C[2],2,0) -> 邪恶触龙 | D325: 烈焰魔指 | E325: 82
A326: 201035 | B326: =R[-101]C+1 -> 6 | C326: =VLOOKUP(RC[-1],工作表2!C[1]:C[2],2,0) -> 邪恶触龙 | D326: 烈焰头盔 | E326: 82
A327: 201036 | B327: =R[-101]C+1 -> 6 | C327: =VLOOKUP(RC[-1],工作表2!C[1]:C[2],2,0) -> 邪恶触龙 | D327: 烈焰护腕 | E327: 82
A328: 201037 | B328: =R[-101]C+1 -> 6 | C328: =VLOOKUP(RC[-1],工作表2!C[1]:C[2],2,0) -> 邪恶触龙 | D328: 烈焰腰带 | E328: 82
A329: 201039 | B329: =R[-101]C+1 -> 6 | C329: =VLOOKUP(RC[-1],工作表2!C[1]:C[2],2,0) -> 邪恶触龙 | D329: 烈焰魔靴 | E329: 82
A330: 202030 | B330: =R[-101]C+1 -> 6 | C330: =VLOOKUP(RC[-1],工作表2!C[1]:C[2],2,0) -> 邪恶触龙 | D330: 玄天 | E330: 82
A331: 202031 | B331: =R[-101]C+1 -> 6 | C331: =VLOOKUP(RC[-1],工作表2!C[1]:C[2],2,0) -> 邪恶触龙 | D331: 光芒道袍 | E331: 82
A332: 202032 | B332: =R[-101]C+1 -> 6 | C332: =VLOOKUP(RC[-1],工作表2!C[1]:C[2],2,0) -> 邪恶触龙 | D332: 光芒道链 | E332: 82
A333: 202033 | B333: =R[-101]C+1 -> 6 | C333: =VLOOKUP(RC[-1],工作表2!C[1]:C[2],2,0) -> 邪恶触龙 | D333: 光芒道戒 | E333: 82
A334: 202035 | B334: =R[-101]C+1 -> 6 | C334: =VLOOKUP(RC[-1],工作表2!C[1]:C[2],2,0) -> 邪恶触龙 | D334: 光芒头盔 | E334: 82
A335: 202036 | B335: =R[-101]C+1 -> 6 | C335: =VLOOKUP(RC[-1],工作表2!C[1]:C[2],2,0) -> 邪恶触龙 | D335: 光芒护腕 | E335: 82
A336: 202037 | B336: =R[-101]C+1 -> 6 | C336: =VLOOKUP(RC[-1],工作表2!C[1]:C[2],2,0) -> 邪恶触龙 | D336: 光芒腰带 | E336: 82
A337: 202039 | B337: =R[-101]C+1 -> 6 | C337: =VLOOKUP(RC[-1],工作表2!C[1]:C[2],2,0) -> 邪恶触龙 | D337: 光芒道靴 | E337: 82
A338: 200060 | B338: =R[-101]C+1 -> 6 | C338: =VLOOKUP(RC[-1],工作表2!C[1]:C[2],2,0) -> 邪恶触龙 | D338: 混沌 | E338: 83
A339: 200061 | B339: =R[-101]C+1 -> 6 | C339: =VLOOKUP(RC[-1],工作表2!C[1]:C[2],2,0) -> 邪恶触龙 | D339: 白虎衣服 | E339: 83
A340: 200062 | B340: =R[-101]C+1 -> 6 | C340: =VLOOKUP(RC[-1],工作表2!C[1]:C[2],2,0) -> 邪恶触龙 | D340: 白虎头盔 | E340: 83
A341: 200063 | B341: =R[-101]C+1 -> 6 | C341: =VLOOKUP(RC[-1],工作表2!C[1]:C[2],2,0) -> 邪恶触龙 | D341: 白虎项链 | E341: 83
A342: 200065 | B342: =R[-101]C+1 -> 6 | C342: =VLOOKUP(RC[-1],工作表2!C[1]:C[2],2,0) -> 邪恶触龙 | D342: 白虎手镯 | E342: 83
A343: 200066 | B343: =R[-101]C+1 -> 6 | C343: =VLOOKUP(RC[-1],工作表2!C[1]:C[2],2,0) -> 邪恶触龙 | D343: 白虎戒指 | E343: 83
A344: 200067 | B344: =R[-101]C+1 -> 6 | C344: =VLOOKUP(RC[-1],工作表2!C[1]:C[2],2,0) -> 邪恶触龙 | D344: 白虎腰带 | E344: 83
A345: 200069 | B345: =R[-101]C+1 -> 6 | C345: =VLOOKUP(RC[-1],工作表2!C[1]:C[2],2,0) -> 邪恶触龙 | D345: 白虎鞋子 | E345: 83
A346: 201060 | B346: =R[-101]C+1 -> 6 | C346: =VLOOKUP(RC[-1],工作表2!C[1]:C[2],2,0) -> 邪恶触龙 | D346: 狂龙 | E346: 83
A347: 201061 | B347: =R[-101]C+1 -> 6 | C347: =VLOOKUP(RC[-1],工作表2!C[1]:C[2],2,0) -> 邪恶触龙 | D347: 朱雀衣服 | E347: 83
A348: 201062 | B348: =R[-101]C+1 -> 6 | C348: =VLOOKUP(RC[-1],工作表2!C[1]:C[2],2,0) -> 邪恶触龙 | D348: 朱雀头盔 | E348: 83
A349: 201063 | B349: =R[-101]C+1 -> 6 | C349: =VLOOKUP(RC[-1],工作表2!C[1]:C[2],2,0) -> 邪恶触龙 | D349: 朱雀项链 | E349: 83
A350: 201065 | B350: =R[-101]C+1 -> 6 | C350: =VLOOKUP(RC[-1],工作表2!C[1]:C[2],2,0) -> 邪恶触龙 | D350: 朱雀手镯 | E350: 83
A351: 201066 | B351: =R[-101]C+1 -> 6 | C351: =VLOOKUP(RC[-1],工作表2!C[1]:C[2],2,0) -> 邪恶触龙 | D351: 朱雀戒指 | E351: 83
A352: 201067 | B352: =R[-101]C+1 -> 6 | C352: =VLOOKUP(RC[-1],工作表2!C[1]:C[2],2,0) -> 邪恶触龙 | D352: 朱雀腰带 | E352: 83
A353: 201069 | B353: =R[-101]C+1 -> 6 | C353: =VLOOKUP(RC[-1],工作表2!C[1]:C[2],2,0) -> 邪恶触龙 | D353: 朱雀鞋子 | E353: 83
A354: 202060 | B354: =R[-101]C+1 -> 6 | C354: =VLOOKUP(RC[-1],工作表2!C[1]:C[2],2,0) -> 邪恶触龙 | D354: 天蛇 | E354: 83
A355: 202061 | B355: =R[-101]C+1 -> 6 | C355: =VLOOKUP(RC[-1],工作表2!C[1]:C[2],2,0) -> 邪恶触龙 | D355: 青龙衣服 | E355: 83
A356: 202062 | B356: =R[-101]C+1 -> 6 | C356: =VLOOKUP(RC[-1],工作表2!C[1]:C[2],2,0) -> 邪恶触龙 | D356: 青龙头盔 | E356: 83
A357: 202063 | B357: =R[-101]C+1 -> 6 | C357: =VLOOKUP(RC[-1],工作表2!C[1]:C[2],2,0) -> 邪恶触龙 | D357: 青龙项链 | E357: 83
A358: 202065 | B358: =R[-101]C+1 -> 6 | C358: =VLOOKUP(RC[-1],工作表2!C[1]:C[2],2,0) -> 邪恶触龙 | D358: 青龙手镯 | E358: 83
A359: 202066 | B359: =R[-101]C+1 -> 6 | C359: =VLOOKUP(RC[-1],工作表2!C[1]:C[2],2,0) -> 邪恶触龙 | D359: 青龙戒指 | E359: 83
A360: 202067 | B360: =R[-101]C+1 -> 6 | C360: =VLOOKUP(RC[-1],工作表2!C[1]:C[2],2,0) -> 邪恶触龙 | D360: 青龙腰带 | E360: 83
A361: 202069 | B361: =R[-101]C+1 -> 6 | C361: =VLOOKUP(RC[-1],工作表2!C[1]:C[2],2,0) -> 邪恶触龙 | D361: 青龙鞋子 | E361: 83
A362: 200070 | B362: =R[-101]C+1 -> 6 | C362: =VLOOKUP(RC[-1],工作表2!C[1]:C[2],2,0) -> 邪恶触龙 | D362: 战刃 | E362: 84
A363: 200071 | B363: =R[-101]C+1 -> 6 | C363: =VLOOKUP(RC[-1],工作表2!C[1]:C[2],2,0) -> 邪恶触龙 | D363: 圣武衣服 | E363: 84
A364: 200072 | B364: =R[-101]C+1 -> 6 | C364: =VLOOKUP(RC[-1],工作表2!C[1]:C[2],2,0) -> 邪恶触龙 | D364: 圣武项链 | E364: 84
A365: 200073 | B365: =R[-101]C+1 -> 6 | C365: =VLOOKUP(RC[-1],工作表2!C[1]:C[2],2,0) -> 邪恶触龙 | D365: 圣武戒指 | E365: 84
A366: 200075 | B366: =R[-101]C+1 -> 6 | C366: =VLOOKUP(RC[-1],工作表2!C[1]:C[2],2,0) -> 邪恶触龙 | D366: 圣武头盔 | E366: 84
A367: 200076 | B367: =R[-101]C+1 -> 6 | C367: =VLOOKUP(RC[-1],工作表2!C[1]:C[2],2,0) -> 邪恶触龙 | D367: 圣武手镯 | E367: 84
A368: 200077 | B368: =R[-101]C+1 -> 6 | C368: =VLOOKUP(RC[-1],工作表2!C[1]:C[2],2,0) -> 邪恶触龙 | D368: 圣武腰带 | E368: 84
A369: 200079 | B369: =R[-101]C+1 -> 6 | C369: =VLOOKUP(RC[-1],工作表2!C[1]:C[2],2,0) -> 邪恶触龙 | D369: 圣武鞋子 | E369: 84
A370: 201070 | B370: =R[-101]C+1 -> 6 | C370: =VLOOKUP(RC[-1],工作表2!C[1]:C[2],2,0) -> 邪恶触龙 | D370: 轮回 | E370: 84
A371: 201071 | B371: =R[-101]C+1 -> 6 | C371: =VLOOKUP(RC[-1],工作表2!C[1]:C[2],2,0) -> 邪恶触龙 | D371: 圣魔衣服 | E371: 84
A372: 201072 | B372: =R[-101]C+1 -> 6 | C372: =VLOOKUP(RC[-1],工作表2!C[1]:C[2],2,0) -> 邪恶触龙 | D372: 圣魔项链 | E372: 84
A373: 201073 | B373: =R[-101]C+1 -> 6 | C373: =VLOOKUP(RC[-1],工作表2!C[1]:C[2],2,0) -> 邪恶触龙 | D373: 圣魔戒指 | E373: 84
A374: 201075 | B374: =R[-101]C+1 -> 6 | C374: =VLOOKUP(RC[-1],工作表2!C[1]:C[2],2,0) -> 邪恶触龙 | D374: 圣魔头盔 | E374: 84
A375: 201076 | B375: =R[-101]C+1 -> 6 | C375: =VLOOKUP(RC[-1],工作表2!C[1]:C[2],2,0) -> 邪恶触龙 | D375: 圣魔手镯 | E375: 84
A376: 201077 | B376: =R[-101]C+1 -> 6 | C376: =VLOOKUP(RC[-1],工作表2!C[1]:C[2],2,0) -> 邪恶触龙 | D376: 圣魔腰带 | E376: 84
A377: 201079 | B377: =R[-101]C+1 -> 6 | C377: =VLOOKUP(RC[-1],工作表2!C[1]:C[2],2,0) -> 邪恶触龙 | D377: 圣魔鞋子 | E377: 84
A378: 202070 | B378: =R[-101]C+1 -> 6 | C378: =VLOOKUP(RC[-1],工作表2!C[1]:C[2],2,0) -> 邪恶触龙 | D378: 太虚 | E378: 84
A379: 202071 | B379: =R[-101]C+1 -> 6 | C379: =VLOOKUP(RC[-1],工作表2!C[1]:C[2],2,0) -> 邪恶触龙 | D379: 圣魂衣服 | E379: 84
A380: 202072 | B380: =R[-101]C+1 -> 6 | C380: =VLOOKUP(RC[-1],工作表2!C[1]:C[2],2,0) -> 邪恶触龙 | D380: 圣魂项链 | E380: 84
A381: 202073 | B381: =R[-101]C+1 -> 6 | C381: =VLOOKUP(RC[-1],工作表2!C[1]:C[2],2,0) -> 邪恶触龙 | D381: 圣魂戒指 | E381: 84
A382: 202075 | B382: =R[-101]C+1 -> 6 | C382: =VLOOKUP(RC[-1],工作表2!C[1]:C[2],2,0) -> 邪恶触龙 | D382: 圣魂头盔 | E382: 84
A383: 202076 | B383: =R[-101]C+1 -> 6 | C383: =VLOOKUP(RC[-1],工作表2!C[1]:C[2],2,0) -> 邪恶触龙 | D383: 圣魂手镯 | E383: 84
A384: 202077 | B384: =R[-101]C+1 -> 6 | C384: =VLOOKUP(RC[-1],工作表2!C[1]:C[2],2,0) -> 邪恶触龙 | D384: 圣魂腰带 | E384: 84
A385: 202079 | B385: =R[-101]C+1 -> 6 | C385: =VLOOKUP(RC[-1],工作表2!C[1]:C[2],2,0) -> 邪恶触龙 | D385: 圣魂鞋子 | E385: 84
A386: 305000 | B386: =R[-101]C+1 -> 6 | C386: =VLOOKUP(RC[-1],工作表2!C[1]:C[2],2,0) -> 邪恶触龙 | D386: 麻痹戒指 | E386: 85
A387: 305001 | B387: =R[-101]C+1 -> 6 | C387: =VLOOKUP(RC[-1],工作表2!C[1]:C[2],2,0) -> 邪恶触龙 | D387: 护身戒指 | E387: 85
A388: 305002 | B388: =R[-101]C+1 -> 6 | C388: =VLOOKUP(RC[-1],工作表2!C[1]:C[2],2,0) -> 邪恶触龙 | D388: 复活戒指 | E388: 85
A389: 110163 | B389: =R[-101]C+1 -> 6 | C389: =VLOOKUP(RC[-1],工作表2!C[1]:C[2],2,0) -> 邪恶触龙 | D389: 上古神石 | E389: 86
A390: 305013 | B390: =R[-101]C+1 -> 6 | C390: =VLOOKUP(RC[-1],工作表2!C[1]:C[2],2,0) -> 邪恶触龙 | D390: 特面 | E390: 87
A391: 305014 | B391: =R[-101]C+1 -> 6 | C391: =VLOOKUP(RC[-1],工作表2!C[1]:C[2],2,0) -> 邪恶触龙 | D391: 特腿 | E391: 88
A392: 305015 | B392: =R[-101]C+1 -> 6 | C392: =VLOOKUP(RC[-1],工作表2!C[1]:C[2],2,0) -> 邪恶触龙 | D392: 特肩 | E392: 89
A393: 110024 | B393: =R[-101]C+1 -> 6 | C393: =VLOOKUP(RC[-1],工作表2!C[1]:C[2],2,0) -> 邪恶触龙 | D393: 狂风斩书 | E393: 36
A394: 110025 | B394: =R[-101]C+1 -> 6 | C394: =VLOOKUP(RC[-1],工作表2!C[1]:C[2],2,0) -> 邪恶触龙 | D394: 逐日剑法书 | E394: 37
A395: 110067 | B395: =R[-101]C+1 -> 6 | C395: =VLOOKUP(RC[-1],工作表2!C[1]:C[2],2,0) -> 邪恶触龙 | D395: 诱惑之光书 | E395: 38
A396: 110040 | B396: =R[-101]C+1 -> 6 | C396: =VLOOKUP(RC[-1],工作表2!C[1]:C[2],2,0) -> 邪恶触龙 | D396: 流星火雨书 | E396: 39
A397: 110031 | B397: =R[-101]C+1 -> 6 | C397: =VLOOKUP(RC[-1],工作表2!C[1]:C[2],2,0) -> 邪恶触龙 | D397: 召唤神兽书 | E397: 40
A398: 110032 | B398: =R[-101]C+1 -> 6 | C398: =VLOOKUP(RC[-1],工作表2!C[1]:C[2],2,0) -> 邪恶触龙 | D398: 嗜血术书 | E398: 41
A399: 305003 | B399: =R[-101]C+1 -> 6 | C399: =VLOOKUP(RC[-1],工作表2!C[1]:C[2],2,0) -> 邪恶触龙 | D399: 怒斩 | E399: 96
A400: 305004 | B400: =R[-101]C+1 -> 6 | C400: =VLOOKUP(RC[-1],工作表2!C[1]:C[2],2,0) -> 邪恶触龙 | D400: 龙牙 | E400: 96
A401: 305005 | B401: =R[-101]C+1 -> 6 | C401: =VLOOKUP(RC[-1],工作表2!C[1]:C[2],2,0) -> 邪恶触龙 | D401: 龙纹 | E401: 96
A402: 305006 | B402: =R[-101]C+1 -> 6 | C402: =VLOOKUP(RC[-1],工作表2!C[1]:C[2],2,0) -> 邪恶触龙 | D402: 至尊屠龙 | E402: 97
A403: 305007 | B403: =R[-101]C+1 -> 6 | C403: =VLOOKUP(RC[-1],工作表2!C[1]:C[2],2,0) -> 邪恶触龙 | D403: 至尊噬魂 | E403: 97
A404: 305008 | B404: =R[-101]C+1 -> 6 | C404: =VLOOKUP(RC[-1],工作表2!C[1]:C[2],2,0) -> 邪恶触龙 | D404: 至尊逍遥扇 | E404: 97
A405: 110140 | B405: =R[-101]C+1 -> 6 | C405: =VLOOKUP(RC[-1],工作表2!C[1]:C[2],2,0) -> 邪恶触龙 | D405: 进阶丹 | E405: 98
A406: 110109 | B406: =R[-101]C+1 -> 6 | C406: =VLOOKUP(RC[-1],工作表2!C[1]:C[2],2,0) -> 邪恶触龙 | D406: 金刚石 | E406: 99
A407: 110154 | B407: =R[-101]C+1 -> 6 | C407: =VLOOKUP(RC[-1],工作表2!C[1]:C[2],2,0) -> 邪恶触龙 | D407: 2元宝 | E407: 100
A408: 110155 | B408: =R[-101]C+1 -> 6 | C408: =VLOOKUP(RC[-1],工作表2!C[1]:C[2],2,0) -> 邪恶触龙 | D408: 5元宝 | E408: 101
A409: 110156 | B409: =R[-101]C+1 -> 6 | C409: =VLOOKUP(RC[-1],工作表2!C[1]:C[2],2,0) -> 邪恶触龙 | D409: 10元宝 | E409: 102
A410: 110157 | B410: =R[-101]C+1 -> 6 | C410: =VLOOKUP(RC[-1],工作表2!C[1]:C[2],2,0) -> 邪恶触龙 | D410: 20元宝 | E410: 103
A411: 110158 | B411: =R[-101]C+1 -> 6 | C411: =VLOOKUP(RC[-1],工作表2!C[1]:C[2],2,0) -> 邪恶触龙 | D411: 50元宝 | E411: 104
A412: 110159 | B412: =R[-101]C+1 -> 6 | C412: =VLOOKUP(RC[-1],工作表2!C[1]:C[2],2,0) -> 邪恶触龙 | D412: 100元宝 | E412: 105
A413: 110164 | B413: =R[-101]C+1 -> 6 | C413: =VLOOKUP(RC[-1],工作表2!C[1]:C[2],2,0) -> 邪恶触龙 | D413: 150元宝 | E413: 106
A414: 110165 | B414: =R[-101]C+1 -> 6 | C414: =VLOOKUP(RC[-1],工作表2!C[1]:C[2],2,0) -> 邪恶触龙 | D414: 200元宝 | E414: 107
A415: 200030 | B415: =R[-101]C+1 -> 7 | C415: =VLOOKUP(RC[-1],工作表2!C[1]:C[2],2,0) -> 白野猪王 | D415: 开天 | E415: 109
A416: 200031 | B416: =R[-101]C+1 -> 7 | C416: =VLOOKUP(RC[-1],工作表2!C[1]:C[2],2,0) -> 白野猪王 | D416: 雷霆战甲 | E416: 109
A417: 200032 | B417: =R[-101]C+1 -> 7 | C417: =VLOOKUP(RC[-1],工作表2!C[1]:C[2],2,0) -> 白野猪王 | D417: 雷霆项链 | E417: 109
A418: 200033 | B418: =R[-101]C+1 -> 7 | C418: =VLOOKUP(RC[-1],工作表2!C[1]:C[2],2,0) -> 白野猪王 | D418: 雷霆戒指 | E418: 109
A419: 200035 | B419: =R[-101]C+1 -> 7 | C419: =VLOOKUP(RC[-1],工作表2!C[1]:C[2],2,0) -> 白野猪王 | D419: 雷霆头盔 | E419: 109
A420: 200036 | B420: =R[-101]C+1 -> 7 | C420: =VLOOKUP(RC[-1],工作表2!C[1]:C[2],2,0) -> 白野猪王 | D420: 雷霆护腕 | E420: 109
A421: 200037 | B421: =R[-101]C+1 -> 7 | C421: =VLOOKUP(RC[-1],工作表2!C[1]:C[2],2,0) -> 白野猪王 | D421: 雷霆腰带 | E421: 109
A422: 200039 | B422: =R[-101]C+1 -> 7 | C422: =VLOOKUP(RC[-1],工作表2!C[1]:C[2],2,0) -> 白野猪王 | D422: 雷霆战靴 | E422: 109
A423: 201030 | B423: =R[-101]C+1 -> 7 | C423: =VLOOKUP(RC[-1],工作表2!C[1]:C[2],2,0) -> 白野猪王 | D423: 震天 | E423: 109
A424: 201031 | B424: =R[-101]C+1 -> 7 | C424: =VLOOKUP(RC[-1],工作表2!C[1]:C[2],2,0) -> 白野猪王 | D424: 烈焰法袍 | E424: 109
A425: 201032 | B425: =R[-101]C+1 -> 7 | C425: =VLOOKUP(RC[-1],工作表2!C[1]:C[2],2,0) -> 白野猪王 | D425: 烈焰魔链 | E425: 109
A426: 201033 | B426: =R[-101]C+1 -> 7 | C426: =VLOOKUP(RC[-1],工作表2!C[1]:C[2],2,0) -> 白野猪王 | D426: 烈焰魔指 | E426: 109
A427: 201035 | B427: =R[-101]C+1 -> 7 | C427: =VLOOKUP(RC[-1],工作表2!C[1]:C[2],2,0) -> 白野猪王 | D427: 烈焰头盔 | E427: 109
A428: 201036 | B428: =R[-101]C+1 -> 7 | C428: =VLOOKUP(RC[-1],工作表2!C[1]:C[2],2,0) -> 白野猪王 | D428: 烈焰护腕 | E428: 109
A429: 201037 | B429: =R[-101]C+1 -> 7 | C429: =VLOOKUP(RC[-1],工作表2!C[1]:C[2],2,0) -> 白野猪王 | D429: 烈焰腰带 | E429: 109
A430: 201039 | B430: =R[-101]C+1 -> 7 | C430: =VLOOKUP(RC[-1],工作表2!C[1]:C[2],2,0) -> 白野猪王 | D430: 烈焰魔靴 | E430: 109
A431: 202030 | B431: =R[-101]C+1 -> 7 | C431: =VLOOKUP(RC[-1],工作表2!C[1]:C[2],2,0) -> 白野猪王 | D431: 玄天 | E431: 109
A432: 202031 | B432: =R[-101]C+1 -> 7 | C432: =VLOOKUP(RC[-1],工作表2!C[1]:C[2],2,0) -> 白野猪王 | D432: 光芒道袍 | E432: 109
A433: 202032 | B433: =R[-101]C+1 -> 7 | C433: =VLOOKUP(RC[-1],工作表2!C[1]:C[2],2,0) -> 白野猪王 | D433: 光芒道链 | E433: 109
A434: 202033 | B434: =R[-101]C+1 -> 7 | C434: =VLOOKUP(RC[-1],工作表2!C[1]:C[2],2,0) -> 白野猪王 | D434: 光芒道戒 | E434: 109
A435: 202035 | B435: =R[-101]C+1 -> 7 | C435: =VLOOKUP(RC[-1],工作表2!C[1]:C[2],2,0) -> 白野猪王 | D435: 光芒头盔 | E435: 109
A436: 202036 | B436: =R[-101]C+1 -> 7 | C436: =VLOOKUP(RC[-1],工作表2!C[1]:C[2],2,0) -> 白野猪王 | D436: 光芒护腕 | E436: 109
A437: 202037 | B437: =R[-101]C+1 -> 7 | C437: =VLOOKUP(RC[-1],工作表2!C[1]:C[2],2,0) -> 白野猪王 | D437: 光芒腰带 | E437: 109
A438: 202039 | B438: =R[-101]C+1 -> 7 | C438: =VLOOKUP(RC[-1],工作表2!C[1]:C[2],2,0) -> 白野猪王 | D438: 光芒道靴 | E438: 109
A439: 200060 | B439: =R[-101]C+1 -> 7 | C439: =VLOOKUP(RC[-1],工作表2!C[1]:C[2],2,0) -> 白野猪王 | D439: 混沌 | E439: 83
A440: 200061 | B440: =R[-101]C+1 -> 7 | C440: =VLOOKUP(RC[-1],工作表2!C[1]:C[2],2,0) -> 白野猪王 | D440: 白虎衣服 | E440: 83
A441: 200062 | B441: =R[-101]C+1 -> 7 | C441: =VLOOKUP(RC[-1],工作表2!C[1]:C[2],2,0) -> 白野猪王 | D441: 白虎头盔 | E441: 83
A442: 200063 | B442: =R[-101]C+1 -> 7 | C442: =VLOOKUP(RC[-1],工作表2!C[1]:C[2],2,0) -> 白野猪王 | D442: 白虎项链 | E442: 83
A443: 200065 | B443: =R[-101]C+1 -> 7 | C443: =VLOOKUP(RC[-1],工作表2!C[1]:C[2],2,0) -> 白野猪王 | D443: 白虎手镯 | E443: 83
A444: 200066 | B444: =R[-101]C+1 -> 7 | C444: =VLOOKUP(RC[-1],工作表2!C[1]:C[2],2,0) -> 白野猪王 | D444: 白虎戒指 | E444: 83
A445: 200067 | B445: =R[-101]C+1 -> 7 | C445: =VLOOKUP(RC[-1],工作表2!C[1]:C[2],2,0) -> 白野猪王 | D445: 白虎腰带 | E445: 83
A446: 200069 | B446: =R[-101]C+1 -> 7 | C446: =VLOOKUP(RC[-1],工作表2!C[1]:C[2],2,0) -> 白野猪王 | D446: 白虎鞋子 | E446: 83
A447: 201060 | B447: =R[-101]C+1 -> 7 | C447: =VLOOKUP(RC[-1],工作表2!C[1]:C[2],2,0) -> 白野猪王 | D447: 狂龙 | E447: 83
A448: 201061 | B448: =R[-101]C+1 -> 7 | C448: =VLOOKUP(RC[-1],工作表2!C[1]:C[2],2,0) -> 白野猪王 | D448: 朱雀衣服 | E448: 83
A449: 201062 | B449: =R[-101]C+1 -> 7 | C449: =VLOOKUP(RC[-1],工作表2!C[1]:C[2],2,0) -> 白野猪王 | D449: 朱雀头盔 | E449: 83
A450: 201063 | B450: =R[-101]C+1 -> 7 | C450: =VLOOKUP(RC[-1],工作表2!C[1]:C[2],2,0) -> 白野猪王 | D450: 朱雀项链 | E450: 83
A451: 201065 | B451: =R[-101]C+1 -> 7 | C451: =VLOOKUP(RC[-1],工作表2!C[1]:C[2],2,0) -> 白野猪王 | D451: 朱雀手镯 | E451: 83
A452: 201066 | B452: =R[-101]C+1 -> 7 | C452: =VLOOKUP(RC[-1],工作表2!C[1]:C[2],2,0) -> 白野猪王 | D452: 朱雀戒指 | E452: 83
A453: 201067 | B453: =R[-101]C+1 -> 7 | C453: =VLOOKUP(RC[-1],工作表2!C[1]:C[2],2,0) -> 白野猪王 | D453: 朱雀腰带 | E453: 83
A454: 201069 | B454: =R[-101]C+1 -> 7 | C454: =VLOOKUP(RC[-1],工作表2!C[1]:C[2],2,0) -> 白野猪王 | D454: 朱雀鞋子 | E454: 83
A455: 202060 | B455: =R[-101]C+1 -> 7 | C455: =VLOOKUP(RC[-1],工作表2!C[1]:C[2],2,0) -> 白野猪王 | D455: 天蛇 | E455: 83
A456: 202061 | B456: =R[-101]C+1 -> 7 | C456: =VLOOKUP(RC[-1],工作表2!C[1]:C[2],2,0) -> 白野猪王 | D456: 青龙衣服 | E456: 83
A457: 202062 | B457: =R[-101]C+1 -> 7 | C457: =VLOOKUP(RC[-1],工作表2!C[1]:C[2],2,0) -> 白野猪王 | D457: 青龙头盔 | E457: 83
A458: 202063 | B458: =R[-101]C+1 -> 7 | C458: =VLOOKUP(RC[-1],工作表2!C[1]:C[2],2,0) -> 白野猪王 | D458: 青龙项链 | E458: 83
A459: 202065 | B459: =R[-101]C+1 -> 7 | C459: =VLOOKUP(RC[-1],工作表2!C[1]:C[2],2,0) -> 白野猪王 | D459: 青龙手镯 | E459: 83
A460: 202066 | B460: =R[-101]C+1 -> 7 | C460: =VLOOKUP(RC[-1],工作表2!C[1]:C[2],2,0) -> 白野猪王 | D460: 青龙戒指 | E460: 83
A461: 202067 | B461: =R[-101]C+1 -> 7 | C461: =VLOOKUP(RC[-1],工作表2!C[1]:C[2],2,0) -> 白野猪王 | D461: 青龙腰带 | E461: 83
A462: 202069 | B462: =R[-101]C+1 -> 7 | C462: =VLOOKUP(RC[-1],工作表2!C[1]:C[2],2,0) -> 白野猪王 | D462: 青龙鞋子 | E462: 83
A463: 200070 | B463: =R[-101]C+1 -> 7 | C463: =VLOOKUP(RC[-1],工作表2!C[1]:C[2],2,0) -> 白野猪王 | D463: 战刃 | E463: 111
A464: 200071 | B464: =R[-101]C+1 -> 7 | C464: =VLOOKUP(RC[-1],工作表2!C[1]:C[2],2,0) -> 白野猪王 | D464: 圣武衣服 | E464: 111
A465: 200072 | B465: =R[-101]C+1 -> 7 | C465: =VLOOKUP(RC[-1],工作表2!C[1]:C[2],2,0) -> 白野猪王 | D465: 圣武项链 | E465: 111
A466: 200073 | B466: =R[-101]C+1 -> 7 | C466: =VLOOKUP(RC[-1],工作表2!C[1]:C[2],2,0) -> 白野猪王 | D466: 圣武戒指 | E466: 111
A467: 200075 | B467: =R[-101]C+1 -> 7 | C467: =VLOOKUP(RC[-1],工作表2!C[1]:C[2],2,0) -> 白野猪王 | D467: 圣武头盔 | E467: 111
A468: 200076 | B468: =R[-101]C+1 -> 7 | C468: =VLOOKUP(RC[-1],工作表2!C[1]:C[2],2,0) -> 白野猪王 | D468: 圣武手镯 | E468: 111
A469: 200077 | B469: =R[-101]C+1 -> 7 | C469: =VLOOKUP(RC[-1],工作表2!C[1]:C[2],2,0) -> 白野猪王 | D469: 圣武腰带 | E469: 111
A470: 200079 | B470: =R[-101]C+1 -> 7 | C470: =VLOOKUP(RC[-1],工作表2!C[1]:C[2],2,0) -> 白野猪王 | D470: 圣武鞋子 | E470: 111
A471: 201070 | B471: =R[-101]C+1 -> 7 | C471: =VLOOKUP(RC[-1],工作表2!C[1]:C[2],2,0) -> 白野猪王 | D471: 轮回 | E471: 111
A472: 201071 | B472: =R[-101]C+1 -> 7 | C472: =VLOOKUP(RC[-1],工作表2!C[1]:C[2],2,0) -> 白野猪王 | D472: 圣魔衣服 | E472: 111
A473: 201072 | B473: =R[-101]C+1 -> 7 | C473: =VLOOKUP(RC[-1],工作表2!C[1]:C[2],2,0) -> 白野猪王 | D473: 圣魔项链 | E473: 111
A474: 201073 | B474: =R[-101]C+1 -> 7 | C474: =VLOOKUP(RC[-1],工作表2!C[1]:C[2],2,0) -> 白野猪王 | D474: 圣魔戒指 | E474: 111
A475: 201075 | B475: =R[-101]C+1 -> 7 | C475: =VLOOKUP(RC[-1],工作表2!C[1]:C[2],2,0) -> 白野猪王 | D475: 圣魔头盔 | E475: 111
A476: 201076 | B476: =R[-101]C+1 -> 7 | C476: =VLOOKUP(RC[-1],工作表2!C[1]:C[2],2,0) -> 白野猪王 | D476: 圣魔手镯 | E476: 111
A477: 201077 | B477: =R[-101]C+1 -> 7 | C477: =VLOOKUP(RC[-1],工作表2!C[1]:C[2],2,0) -> 白野猪王 | D477: 圣魔腰带 | E477: 111
A478: 201079 | B478: =R[-101]C+1 -> 7 | C478: =VLOOKUP(RC[-1],工作表2!C[1]:C[2],2,0) -> 白野猪王 | D478: 圣魔鞋子 | E478: 111
A479: 202070 | B479: =R[-101]C+1 -> 7 | C479: =VLOOKUP(RC[-1],工作表2!C[1]:C[2],2,0) -> 白野猪王 | D479: 太虚 | E479: 111
A480: 202071 | B480: =R[-101]C+1 -> 7 | C480: =VLOOKUP(RC[-1],工作表2!C[1]:C[2],2,0) -> 白野猪王 | D480: 圣魂衣服 | E480: 111
A481: 202072 | B481: =R[-101]C+1 -> 7 | C481: =VLOOKUP(RC[-1],工作表2!C[1]:C[2],2,0) -> 白野猪王 | D481: 圣魂项链 | E481: 111
A482: 202073 | B482: =R[-101]C+1 -> 7 | C482: =VLOOKUP(RC[-1],工作表2!C[1]:C[2],2,0) -> 白野猪王 | D482: 圣魂戒指 | E482: 111
A483: 202075 | B483: =R[-101]C+1 -> 7 | C483: =VLOOKUP(RC[-1],工作表2!C[1]:C[2],2,0) -> 白野猪王 | D483: 圣魂头盔 | E483: 111
A484: 202076 | B484: =R[-101]C+1 -> 7 | C484: =VLOOKUP(RC[-1],工作表2!C[1]:C[2],2,0) -> 白野猪王 | D484: 圣魂手镯 | E484: 111
A485: 202077 | B485: =R[-101]C+1 -> 7 | C485: =VLOOKUP(RC[-1],工作表2!C[1]:C[2],2,0) -> 白野猪王 | D485: 圣魂腰带 | E485: 111
A486: 202079 | B486: =R[-101]C+1 -> 7 | C486: =VLOOKUP(RC[-1],工作表2!C[1]:C[2],2,0) -> 白野猪王 | D486: 圣魂鞋子 | E486: 111
A487: 305000 | B487: =R[-101]C+1 -> 7 | C487: =VLOOKUP(RC[-1],工作表2!C[1]:C[2],2,0) -> 白野猪王 | D487: 麻痹戒指 | E487: 112
A488: 305001 | B488: =R[-101]C+1 -> 7 | C488: =VLOOKUP(RC[-1],工作表2!C[1]:C[2],2,0) -> 白野猪王 | D488: 护身戒指 | E488: 112
A489: 305002 | B489: =R[-101]C+1 -> 7 | C489: =VLOOKUP(RC[-1],工作表2!C[1]:C[2],2,0) -> 白野猪王 | D489: 复活戒指 | E489: 112
A490: 110163 | B490: =R[-101]C+1 -> 7 | C490: =VLOOKUP(RC[-1],工作表2!C[1]:C[2],2,0) -> 白野猪王 | D490: 上古神石 | E490: 113
A491: 305013 | B491: =R[-101]C+1 -> 7 | C491: =VLOOKUP(RC[-1],工作表2!C[1]:C[2],2,0) -> 白野猪王 | D491: 特面 | E491: 114
A492: 305014 | B492: =R[-101]C+1 -> 7 | C492: =VLOOKUP(RC[-1],工作表2!C[1]:C[2],2,0) -> 白野猪王 | D492: 特腿 | E492: 115
A493: 305015 | B493: =R[-101]C+1 -> 7 | C493: =VLOOKUP(RC[-1],工作表2!C[1]:C[2],2,0) -> 白野猪王 | D493: 特肩 | E493: 116
A494: 110024 | B494: =R[-101]C+1 -> 7 | C494: =VLOOKUP(RC[-1],工作表2!C[1]:C[2],2,0) -> 白野猪王 | D494: 狂风斩书 | E494: 36
A495: 110025 | B495: =R[-101]C+1 -> 7 | C495: =VLOOKUP(RC[-1],工作表2!C[1]:C[2],2,0) -> 白野猪王 | D495: 逐日剑法书 | E495: 37
A496: 110067 | B496: =R[-101]C+1 -> 7 | C496: =VLOOKUP(RC[-1],工作表2!C[1]:C[2],2,0) -> 白野猪王 | D496: 诱惑之光书 | E496: 38
A497: 110040 | B497: =R[-101]C+1 -> 7 | C497: =VLOOKUP(RC[-1],工作表2!C[1]:C[2],2,0) -> 白野猪王 | D497: 流星火雨书 | E497: 39
A498: 110031 | B498: =R[-101]C+1 -> 7 | C498: =VLOOKUP(RC[-1],工作表2!C[1]:C[2],2,0) -> 白野猪王 | D498: 召唤神兽书 | E498: 40
A499: 110032 | B499: =R[-101]C+1 -> 7 | C499: =VLOOKUP(RC[-1],工作表2!C[1]:C[2],2,0) -> 白野猪王 | D499: 嗜血术书 | E499: 41
A500: 305003 | B500: =R[-101]C+1 -> 7 | C500: =VLOOKUP(RC[-1],工作表2!C[1]:C[2],2,0) -> 白野猪王 | D500: 怒斩 | E500: 123
A501: 305004 | B501: =R[-101]C+1 -> 7 | C501: =VLOOKUP(RC[-1],工作表2!C[1]:C[2],2,0) -> 白野猪王 | D501: 龙牙 | E501: 123
A502: 305005 | B502: =R[-101]C+1 -> 7 | C502: =VLOOKUP(RC[-1],工作表2!C[1]:C[2],2,0) -> 白野猪王 | D502: 龙纹 | E502: 123
A503: 305006 | B503: =R[-101]C+1 -> 7 | C503: =VLOOKUP(RC[-1],工作表2!C[1]:C[2],2,0) -> 白野猪王 | D503: 至尊屠龙 | E503: 124
A504: 305007 | B504: =R[-101]C+1 -> 7 | C504: =VLOOKUP(RC[-1],工作表2!C[1]:C[2],2,0) -> 白野猪王 | D504: 至尊噬魂 | E504: 124
A505: 305008 | B505: =R[-101]C+1 -> 7 | C505: =VLOOKUP(RC[-1],工作表2!C[1]:C[2],2,0) -> 白野猪王 | D505: 至尊逍遥扇 | E505: 124
A506: 110140 | B506: =R[-101]C+1 -> 7 | C506: =VLOOKUP(RC[-1],工作表2!C[1]:C[2],2,0) -> 白野猪王 | D506: 进阶丹 | E506: 125
A507: 110109 | B507: =R[-101]C+1 -> 7 | C507: =VLOOKUP(RC[-1],工作表2!C[1]:C[2],2,0) -> 白野猪王 | D507: 金刚石 | E507: 126
A508: 110154 | B508: =R[-101]C+1 -> 7 | C508: =VLOOKUP(RC[-1],工作表2!C[1]:C[2],2,0) -> 白野猪王 | D508: 2元宝 | E508: 127
A509: 110155 | B509: =R[-101]C+1 -> 7 | C509: =VLOOKUP(RC[-1],工作表2!C[1]:C[2],2,0) -> 白野猪王 | D509: 5元宝 | E509: 128
A510: 110156 | B510: =R[-101]C+1 -> 7 | C510: =VLOOKUP(RC[-1],工作表2!C[1]:C[2],2,0) -> 白野猪王 | D510: 10元宝 | E510: 129
A511: 110157 | B511: =R[-101]C+1 -> 7 | C511: =VLOOKUP(RC[-1],工作表2!C[1]:C[2],2,0) -> 白野猪王 | D511: 20元宝 | E511: 130
A512: 110158 | B512: =R[-101]C+1 -> 7 | C512: =VLOOKUP(RC[-1],工作表2!C[1]:C[2],2,0) -> 白野猪王 | D512: 50元宝 | E512: 131
A513: 110159 | B513: =R[-101]C+1 -> 7 | C513: =VLOOKUP(RC[-1],工作表2!C[1]:C[2],2,0) -> 白野猪王 | D513: 100元宝 | E513: 132
A514: 110164 | B514: =R[-101]C+1 -> 7 | C514: =VLOOKUP(RC[-1],工作表2!C[1]:C[2],2,0) -> 白野猪王 | D514: 150元宝 | E514: 133
A515: 110165 | B515: =R[-101]C+1 -> 7 | C515: =VLOOKUP(RC[-1],工作表2!C[1]:C[2],2,0) -> 白野猪王 | D515: 200元宝 | E515: 134
A516: 200030 | B516: =R[-101]C+1 -> 8 | C516: =VLOOKUP(RC[-1],工作表2!C[1]:C[2],2,0) -> 祖玛教主 | D516: 开天 | E516: 136
A517: 200031 | B517: =R[-101]C+1 -> 8 | C517: =VLOOKUP(RC[-1],工作表2!C[1]:C[2],2,0) -> 祖玛教主 | D517: 雷霆战甲 | E517: 136
A518: 200032 | B518: =R[-101]C+1 -> 8 | C518: =VLOOKUP(RC[-1],工作表2!C[1]:C[2],2,0) -> 祖玛教主 | D518: 雷霆项链 | E518: 136
A519: 200033 | B519: =R[-101]C+1 -> 8 | C519: =VLOOKUP(RC[-1],工作表2!C[1]:C[2],2,0) -> 祖玛教主 | D519: 雷霆戒指 | E519: 136
A520: 200035 | B520: =R[-101]C+1 -> 8 | C520: =VLOOKUP(RC[-1],工作表2!C[1]:C[2],2,0) -> 祖玛教主 | D520: 雷霆头盔 | E520: 136
A521: 200036 | B521: =R[-101]C+1 -> 8 | C521: =VLOOKUP(RC[-1],工作表2!C[1]:C[2],2,0) -> 祖玛教主 | D521: 雷霆护腕 | E521: 136
A522: 200037 | B522: =R[-101]C+1 -> 8 | C522: =VLOOKUP(RC[-1],工作表2!C[1]:C[2],2,0) -> 祖玛教主 | D522: 雷霆腰带 | E522: 136
A523: 200039 | B523: =R[-101]C+1 -> 8 | C523: =VLOOKUP(RC[-1],工作表2!C[1]:C[2],2,0) -> 祖玛教主 | D523: 雷霆战靴 | E523: 136
A524: 201030 | B524: =R[-101]C+1 -> 8 | C524: =VLOOKUP(RC[-1],工作表2!C[1]:C[2],2,0) -> 祖玛教主 | D524: 震天 | E524: 136
A525: 201031 | B525: =R[-101]C+1 -> 8 | C525: =VLOOKUP(RC[-1],工作表2!C[1]:C[2],2,0) -> 祖玛教主 | D525: 烈焰法袍 | E525: 136
A526: 201032 | B526: =R[-101]C+1 -> 8 | C526: =VLOOKUP(RC[-1],工作表2!C[1]:C[2],2,0) -> 祖玛教主 | D526: 烈焰魔链 | E526: 136
A527: 201033 | B527: =R[-101]C+1 -> 8 | C527: =VLOOKUP(RC[-1],工作表2!C[1]:C[2],2,0) -> 祖玛教主 | D527: 烈焰魔指 | E527: 136
A528: 201035 | B528: =R[-101]C+1 -> 8 | C528: =VLOOKUP(RC[-1],工作表2!C[1]:C[2],2,0) -> 祖玛教主 | D528: 烈焰头盔 | E528: 136
A529: 201036 | B529: =R[-101]C+1 -> 8 | C529: =VLOOKUP(RC[-1],工作表2!C[1]:C[2],2,0) -> 祖玛教主 | D529: 烈焰护腕 | E529: 136
A530: 201037 | B530: =R[-101]C+1 -> 8 | C530: =VLOOKUP(RC[-1],工作表2!C[1]:C[2],2,0) -> 祖玛教主 | D530: 烈焰腰带 | E530: 136
A531: 201039 | B531: =R[-101]C+1 -> 8 | C531: =VLOOKUP(RC[-1],工作表2!C[1]:C[2],2,0) -> 祖玛教主 | D531: 烈焰魔靴 | E531: 136
A532: 202030 | B532: =R[-101]C+1 -> 8 | C532: =VLOOKUP(RC[-1],工作表2!C[1]:C[2],2,0) -> 祖玛教主 | D532: 玄天 | E532: 136
A533: 202031 | B533: =R[-101]C+1 -> 8 | C533: =VLOOKUP(RC[-1],工作表2!C[1]:C[2],2,0) -> 祖玛教主 | D533: 光芒道袍 | E533: 136
A534: 202032 | B534: =R[-101]C+1 -> 8 | C534: =VLOOKUP(RC[-1],工作表2!C[1]:C[2],2,0) -> 祖玛教主 | D534: 光芒道链 | E534: 136
A535: 202033 | B535: =R[-101]C+1 -> 8 | C535: =VLOOKUP(RC[-1],工作表2!C[1]:C[2],2,0) -> 祖玛教主 | D535: 光芒道戒 | E535: 136
A536: 202035 | B536: =R[-101]C+1 -> 8 | C536: =VLOOKUP(RC[-1],工作表2!C[1]:C[2],2,0) -> 祖玛教主 | D536: 光芒头盔 | E536: 136
A537: 202036 | B537: =R[-101]C+1 -> 8 | C537: =VLOOKUP(RC[-1],工作表2!C[1]:C[2],2,0) -> 祖玛教主 | D537: 光芒护腕 | E537: 136
A538: 202037 | B538: =R[-101]C+1 -> 8 | C538: =VLOOKUP(RC[-1],工作表2!C[1]:C[2],2,0) -> 祖玛教主 | D538: 光芒腰带 | E538: 136
A539: 202039 | B539: =R[-101]C+1 -> 8 | C539: =VLOOKUP(RC[-1],工作表2!C[1]:C[2],2,0) -> 祖玛教主 | D539: 光芒道靴 | E539: 136
A540: 200060 | B540: =R[-101]C+1 -> 8 | C540: =VLOOKUP(RC[-1],工作表2!C[1]:C[2],2,0) -> 祖玛教主 | D540: 混沌 | E540: 83
A541: 200061 | B541: =R[-101]C+1 -> 8 | C541: =VLOOKUP(RC[-1],工作表2!C[1]:C[2],2,0) -> 祖玛教主 | D541: 白虎衣服 | E541: 83
A542: 200062 | B542: =R[-101]C+1 -> 8 | C542: =VLOOKUP(RC[-1],工作表2!C[1]:C[2],2,0) -> 祖玛教主 | D542: 白虎头盔 | E542: 83
A543: 200063 | B543: =R[-101]C+1 -> 8 | C543: =VLOOKUP(RC[-1],工作表2!C[1]:C[2],2,0) -> 祖玛教主 | D543: 白虎项链 | E543: 83
A544: 200065 | B544: =R[-101]C+1 -> 8 | C544: =VLOOKUP(RC[-1],工作表2!C[1]:C[2],2,0) -> 祖玛教主 | D544: 白虎手镯 | E544: 83
A545: 200066 | B545: =R[-101]C+1 -> 8 | C545: =VLOOKUP(RC[-1],工作表2!C[1]:C[2],2,0) -> 祖玛教主 | D545: 白虎戒指 | E545: 83
A546: 200067 | B546: =R[-101]C+1 -> 8 | C546: =VLOOKUP(RC[-1],工作表2!C[1]:C[2],2,0) -> 祖玛教主 | D546: 白虎腰带 | E546: 83
A547: 200069 | B547: =R[-101]C+1 -> 8 | C547: =VLOOKUP(RC[-1],工作表2!C[1]:C[2],2,0) -> 祖玛教主 | D547: 白虎鞋子 | E547: 83
A548: 201060 | B548: =R[-101]C+1 -> 8 | C548: =VLOOKUP(RC[-1],工作表2!C[1]:C[2],2,0) -> 祖玛教主 | D548: 狂龙 | E548: 83
A549: 201061 | B549: =R[-101]C+1 -> 8 | C549: =VLOOKUP(RC[-1],工作表2!C[1]:C[2],2,0) -> 祖玛教主 | D549: 朱雀衣服 | E549: 83
A550: 201062 | B550: =R[-101]C+1 -> 8 | C550: =VLOOKUP(RC[-1],工作表2!C[1]:C[2],2,0) -> 祖玛教主 | D550: 朱雀头盔 | E550: 83
A551: 201063 | B551: =R[-101]C+1 -> 8 | C551: =VLOOKUP(RC[-1],工作表2!C[1]:C[2],2,0) -> 祖玛教主 | D551: 朱雀项链 | E551: 83
A552: 201065 | B552: =R[-101]C+1 -> 8 | C552: =VLOOKUP(RC[-1],工作表2!C[1]:C[2],2,0) -> 祖玛教主 | D552: 朱雀手镯 | E552: 83
A553: 201066 | B553: =R[-101]C+1 -> 8 | C553: =VLOOKUP(RC[-1],工作表2!C[1]:C[2],2,0) -> 祖玛教主 | D553: 朱雀戒指 | E553: 83
A554: 201067 | B554: =R[-101]C+1 -> 8 | C554: =VLOOKUP(RC[-1],工作表2!C[1]:C[2],2,0) -> 祖玛教主 | D554: 朱雀腰带 | E554: 83
A555: 201069 | B555: =R[-101]C+1 -> 8 | C555: =VLOOKUP(RC[-1],工作表2!C[1]:C[2],2,0) -> 祖玛教主 | D555: 朱雀鞋子 | E555: 83
A556: 202060 | B556: =R[-101]C+1 -> 8 | C556: =VLOOKUP(RC[-1],工作表2!C[1]:C[2],2,0) -> 祖玛教主 | D556: 天蛇 | E556: 83
A557: 202061 | B557: =R[-101]C+1 -> 8 | C557: =VLOOKUP(RC[-1],工作表2!C[1]:C[2],2,0) -> 祖玛教主 | D557: 青龙衣服 | E557: 83
A558: 202062 | B558: =R[-101]C+1 -> 8 | C558: =VLOOKUP(RC[-1],工作表2!C[1]:C[2],2,0) -> 祖玛教主 | D558: 青龙头盔 | E558: 83
A559: 202063 | B559: =R[-101]C+1 -> 8 | C559: =VLOOKUP(RC[-1],工作表2!C[1]:C[2],2,0) -> 祖玛教主 | D559: 青龙项链 | E559: 83
A560: 202065 | B560: =R[-101]C+1 -> 8 | C560: =VLOOKUP(RC[-1],工作表2!C[1]:C[2],2,0) -> 祖玛教主 | D560: 青龙手镯 | E560: 83
A561: 202066 | B561: =R[-101]C+1 -> 8 | C561: =VLOOKUP(RC[-1],工作表2!C[1]:C[2],2,0) -> 祖玛教主 | D561: 青龙戒指 | E561: 83
A562: 202067 | B562: =R[-101]C+1 -> 8 | C562: =VLOOKUP(RC[-1],工作表2!C[1]:C[2],2,0) -> 祖玛教主 | D562: 青龙腰带 | E562: 83
A563: 202069 | B563: =R[-101]C+1 -> 8 | C563: =VLOOKUP(RC[-1],工作表2!C[1]:C[2],2,0) -> 祖玛教主 | D563: 青龙鞋子 | E563: 83
A564: 200070 | B564: =R[-101]C+1 -> 8 | C564: =VLOOKUP(RC[-1],工作表2!C[1]:C[2],2,0) -> 祖玛教主 | D564: 战刃 | E564: 138
A565: 200071 | B565: =R[-101]C+1 -> 8 | C565: =VLOOKUP(RC[-1],工作表2!C[1]:C[2],2,0) -> 祖玛教主 | D565: 圣武衣服 | E565: 138
A566: 200072 | B566: =R[-101]C+1 -> 8 | C566: =VLOOKUP(RC[-1],工作表2!C[1]:C[2],2,0) -> 祖玛教主 | D566: 圣武项链 | E566: 138
A567: 200073 | B567: =R[-101]C+1 -> 8 | C567: =VLOOKUP(RC[-1],工作表2!C[1]:C[2],2,0) -> 祖玛教主 | D567: 圣武戒指 | E567: 138
A568: 200075 | B568: =R[-101]C+1 -> 8 | C568: =VLOOKUP(RC[-1],工作表2!C[1]:C[2],2,0) -> 祖玛教主 | D568: 圣武头盔 | E568: 138
A569: 200076 | B569: =R[-101]C+1 -> 8 | C569: =VLOOKUP(RC[-1],工作表2!C[1]:C[2],2,0) -> 祖玛教主 | D569: 圣武手镯 | E569: 138
A570: 200077 | B570: =R[-101]C+1 -> 8 | C570: =VLOOKUP(RC[-1],工作表2!C[1]:C[2],2,0) -> 祖玛教主 | D570: 圣武腰带 | E570: 138
A571: 200079 | B571: =R[-101]C+1 -> 8 | C571: =VLOOKUP(RC[-1],工作表2!C[1]:C[2],2,0) -> 祖玛教主 | D571: 圣武鞋子 | E571: 138
A572: 201070 | B572: =R[-101]C+1 -> 8 | C572: =VLOOKUP(RC[-1],工作表2!C[1]:C[2],2,0) -> 祖玛教主 | D572: 轮回 | E572: 138
A573: 201071 | B573: =R[-101]C+1 -> 8 | C573: =VLOOKUP(RC[-1],工作表2!C[1]:C[2],2,0) -> 祖玛教主 | D573: 圣魔衣服 | E573: 138
A574: 201072 | B574: =R[-101]C+1 -> 8 | C574: =VLOOKUP(RC[-1],工作表2!C[1]:C[2],2,0) -> 祖玛教主 | D574: 圣魔项链 | E574: 138
A575: 201073 | B575: =R[-101]C+1 -> 8 | C575: =VLOOKUP(RC[-1],工作表2!C[1]:C[2],2,0) -> 祖玛教主 | D575: 圣魔戒指 | E575: 138
A576: 201075 | B576: =R[-101]C+1 -> 8 | C576: =VLOOKUP(RC[-1],工作表2!C[1]:C[2],2,0) -> 祖玛教主 | D576: 圣魔头盔 | E576: 138
A577: 201076 | B577: =R[-101]C+1 -> 8 | C577: =VLOOKUP(RC[-1],工作表2!C[1]:C[2],2,0) -> 祖玛教主 | D577: 圣魔手镯 | E577: 138
A578: 201077 | B578: =R[-101]C+1 -> 8 | C578: =VLOOKUP(RC[-1],工作表2!C[1]:C[2],2,0) -> 祖玛教主 | D578: 圣魔腰带 | E578: 138
A579: 201079 | B579: =R[-101]C+1 -> 8 | C579: =VLOOKUP(RC[-1],工作表2!C[1]:C[2],2,0) -> 祖玛教主 | D579: 圣魔鞋子 | E579: 138
A580: 202070 | B580: =R[-101]C+1 -> 8 | C580: =VLOOKUP(RC[-1],工作表2!C[1]:C[2],2,0) -> 祖玛教主 | D580: 太虚 | E580: 138
A581: 202071 | B581: =R[-101]C+1 -> 8 | C581: =VLOOKUP(RC[-1],工作表2!C[1]:C[2],2,0) -> 祖玛教主 | D581: 圣魂衣服 | E581: 138
A582: 202072 | B582: =R[-101]C+1 -> 8 | C582: =VLOOKUP(RC[-1],工作表2!C[1]:C[2],2,0) -> 祖玛教主 | D582: 圣魂项链 | E582: 138
A583: 202073 | B583: =R[-101]C+1 -> 8 | C583: =VLOOKUP(RC[-1],工作表2!C[1]:C[2],2,0) -> 祖玛教主 | D583: 圣魂戒指 | E583: 138
A584: 202075 | B584: =R[-101]C+1 -> 8 | C584: =VLOOKUP(RC[-1],工作表2!C[1]:C[2],2,0) -> 祖玛教主 | D584: 圣魂头盔 | E584: 138
A585: 202076 | B585: =R[-101]C+1 -> 8 | C585: =VLOOKUP(RC[-1],工作表2!C[1]:C[2],2,0) -> 祖玛教主 | D585: 圣魂手镯 | E585: 138
A586: 202077 | B586: =R[-101]C+1 -> 8 | C586: =VLOOKUP(RC[-1],工作表2!C[1]:C[2],2,0) -> 祖玛教主 | D586: 圣魂腰带 | E586: 138
A587: 202079 | B587: =R[-101]C+1 -> 8 | C587: =VLOOKUP(RC[-1],工作表2!C[1]:C[2],2,0) -> 祖玛教主 | D587: 圣魂鞋子 | E587: 138
A588: 305000 | B588: =R[-101]C+1 -> 8 | C588: =VLOOKUP(RC[-1],工作表2!C[1]:C[2],2,0) -> 祖玛教主 | D588: 麻痹戒指 | E588: 139
A589: 305001 | B589: =R[-101]C+1 -> 8 | C589: =VLOOKUP(RC[-1],工作表2!C[1]:C[2],2,0) -> 祖玛教主 | D589: 护身戒指 | E589: 139
A590: 305002 | B590: =R[-101]C+1 -> 8 | C590: =VLOOKUP(RC[-1],工作表2!C[1]:C[2],2,0) -> 祖玛教主 | D590: 复活戒指 | E590: 139
A591: 110163 | B591: =R[-101]C+1 -> 8 | C591: =VLOOKUP(RC[-1],工作表2!C[1]:C[2],2,0) -> 祖玛教主 | D591: 上古神石 | E591: 140
A592: 305013 | B592: =R[-101]C+1 -> 8 | C592: =VLOOKUP(RC[-1],工作表2!C[1]:C[2],2,0) -> 祖玛教主 | D592: 特面 | E592: 141
A593: 305014 | B593: =R[-101]C+1 -> 8 | C593: =VLOOKUP(RC[-1],工作表2!C[1]:C[2],2,0) -> 祖玛教主 | D593: 特腿 | E593: 142
A594: 305015 | B594: =R[-101]C+1 -> 8 | C594: =VLOOKUP(RC[-1],工作表2!C[1]:C[2],2,0) -> 祖玛教主 | D594: 特肩 | E594: 143
A595: 110024 | B595: =R[-101]C+1 -> 8 | C595: =VLOOKUP(RC[-1],工作表2!C[1]:C[2],2,0) -> 祖玛教主 | D595: 狂风斩书 | E595: 36
A596: 110025 | B596: =R[-101]C+1 -> 8 | C596: =VLOOKUP(RC[-1],工作表2!C[1]:C[2],2,0) -> 祖玛教主 | D596: 逐日剑法书 | E596: 37
A597: 110067 | B597: =R[-101]C+1 -> 8 | C597: =VLOOKUP(RC[-1],工作表2!C[1]:C[2],2,0) -> 祖玛教主 | D597: 诱惑之光书 | E597: 38
A598: 110040 | B598: =R[-101]C+1 -> 8 | C598: =VLOOKUP(RC[-1],工作表2!C[1]:C[2],2,0) -> 祖玛教主 | D598: 流星火雨书 | E598: 39
A599: 110031 | B599: =R[-101]C+1 -> 8 | C599: =VLOOKUP(RC[-1],工作表2!C[1]:C[2],2,0) -> 祖玛教主 | D599: 召唤神兽书 | E599: 40
A600: 110032 | B600: =R[-101]C+1 -> 8 | C600: =VLOOKUP(RC[-1],工作表2!C[1]:C[2],2,0) -> 祖玛教主 | D600: 嗜血术书 | E600: 41
A601: 305003 | B601: =R[-101]C+1 -> 8 | C601: =VLOOKUP(RC[-1],工作表2!C[1]:C[2],2,0) -> 祖玛教主 | D601: 怒斩 | E601: 150
A602: 305004 | B602: =R[-101]C+1 -> 8 | C602: =VLOOKUP(RC[-1],工作表2!C[1]:C[2],2,0) -> 祖玛教主 | D602: 龙牙 | E602: 150
A603: 305005 | B603: =R[-101]C+1 -> 8 | C603: =VLOOKUP(RC[-1],工作表2!C[1]:C[2],2,0) -> 祖玛教主 | D603: 龙纹 | E603: 150
A604: 305006 | B604: =R[-101]C+1 -> 8 | C604: =VLOOKUP(RC[-1],工作表2!C[1]:C[2],2,0) -> 祖玛教主 | D604: 至尊屠龙 | E604: 151
A605: 305007 | B605: =R[-101]C+1 -> 8 | C605: =VLOOKUP(RC[-1],工作表2!C[1]:C[2],2,0) -> 祖玛教主 | D605: 至尊噬魂 | E605: 151
A606: 305008 | B606: =R[-101]C+1 -> 8 | C606: =VLOOKUP(RC[-1],工作表2!C[1]:C[2],2,0) -> 祖玛教主 | D606: 至尊逍遥扇 | E606: 151
A607: 110140 | B607: =R[-101]C+1 -> 8 | C607: =VLOOKUP(RC[-1],工作表2!C[1]:C[2],2,0) -> 祖玛教主 | D607: 进阶丹 | E607: 152
A608: 110109 | B608: =R[-101]C+1 -> 8 | C608: =VLOOKUP(RC[-1],工作表2!C[1]:C[2],2,0) -> 祖玛教主 | D608: 金刚石 | E608: 153
A609: 110154 | B609: =R[-101]C+1 -> 8 | C609: =VLOOKUP(RC[-1],工作表2!C[1]:C[2],2,0) -> 祖玛教主 | D609: 2元宝 | E609: 154
A610: 110155 | B610: =R[-101]C+1 -> 8 | C610: =VLOOKUP(RC[-1],工作表2!C[1]:C[2],2,0) -> 祖玛教主 | D610: 5元宝 | E610: 155
A611: 110156 | B611: =R[-101]C+1 -> 8 | C611: =VLOOKUP(RC[-1],工作表2!C[1]:C[2],2,0) -> 祖玛教主 | D611: 10元宝 | E611: 156
A612: 110157 | B612: =R[-101]C+1 -> 8 | C612: =VLOOKUP(RC[-1],工作表2!C[1]:C[2],2,0) -> 祖玛教主 | D612: 20元宝 | E612: 157
A613: 110158 | B613: =R[-101]C+1 -> 8 | C613: =VLOOKUP(RC[-1],工作表2!C[1]:C[2],2,0) -> 祖玛教主 | D613: 50元宝 | E613: 158
A614: 110159 | B614: =R[-101]C+1 -> 8 | C614: =VLOOKUP(RC[-1],工作表2!C[1]:C[2],2,0) -> 祖玛教主 | D614: 100元宝 | E614: 159
A615: 110164 | B615: =R[-101]C+1 -> 8 | C615: =VLOOKUP(RC[-1],工作表2!C[1]:C[2],2,0) -> 祖玛教主 | D615: 150元宝 | E615: 160
A616: 110165 | B616: =R[-101]C+1 -> 8 | C616: =VLOOKUP(RC[-1],工作表2!C[1]:C[2],2,0) -> 祖玛教主 | D616: 200元宝 | E616: 161
A617: 200030 | B617: =R[-101]C+1 -> 9 | C617: =VLOOKUP(RC[-1],工作表2!C[1]:C[2],2,0) -> 赤月老魔 | D617: 开天 | E617: 163
A618: 200031 | B618: =R[-101]C+1 -> 9 | C618: =VLOOKUP(RC[-1],工作表2!C[1]:C[2],2,0) -> 赤月老魔 | D618: 雷霆战甲 | E618: 163
A619: 200032 | B619: =R[-101]C+1 -> 9 | C619: =VLOOKUP(RC[-1],工作表2!C[1]:C[2],2,0) -> 赤月老魔 | D619: 雷霆项链 | E619: 163
A620: 200033 | B620: =R[-101]C+1 -> 9 | C620: =VLOOKUP(RC[-1],工作表2!C[1]:C[2],2,0) -> 赤月老魔 | D620: 雷霆戒指 | E620: 163
A621: 200035 | B621: =R[-101]C+1 -> 9 | C621: =VLOOKUP(RC[-1],工作表2!C[1]:C[2],2,0) -> 赤月老魔 | D621: 雷霆头盔 | E621: 163
A622: 200036 | B622: =R[-101]C+1 -> 9 | C622: =VLOOKUP(RC[-1],工作表2!C[1]:C[2],2,0) -> 赤月老魔 | D622: 雷霆护腕 | E622: 163
A623: 200037 | B623: =R[-101]C+1 -> 9 | C623: =VLOOKUP(RC[-1],工作表2!C[1]:C[2],2,0) -> 赤月老魔 | D623: 雷霆腰带 | E623: 163
A624: 200039 | B624: =R[-101]C+1 -> 9 | C624: =VLOOKUP(RC[-1],工作表2!C[1]:C[2],2,0) -> 赤月老魔 | D624: 雷霆战靴 | E624: 163
A625: 201030 | B625: =R[-101]C+1 -> 9 | C625: =VLOOKUP(RC[-1],工作表2!C[1]:C[2],2,0) -> 赤月老魔 | D625: 震天 | E625: 163
A626: 201031 | B626: =R[-101]C+1 -> 9 | C626: =VLOOKUP(RC[-1],工作表2!C[1]:C[2],2,0) -> 赤月老魔 | D626: 烈焰法袍 | E626: 163
A627: 201032 | B627: =R[-101]C+1 -> 9 | C627: =VLOOKUP(RC[-1],工作表2!C[1]:C[2],2,0) -> 赤月老魔 | D627: 烈焰魔链 | E627: 163
A628: 201033 | B628: =R[-101]C+1 -> 9 | C628: =VLOOKUP(RC[-1],工作表2!C[1]:C[2],2,0) -> 赤月老魔 | D628: 烈焰魔指 | E628: 163
A629: 201035 | B629: =R[-101]C+1 -> 9 | C629: =VLOOKUP(RC[-1],工作表2!C[1]:C[2],2,0) -> 赤月老魔 | D629: 烈焰头盔 | E629: 163
A630: 201036 | B630: =R[-101]C+1 -> 9 | C630: =VLOOKUP(RC[-1],工作表2!C[1]:C[2],2,0) -> 赤月老魔 | D630: 烈焰护腕 | E630: 163
A631: 201037 | B631: =R[-101]C+1 -> 9 | C631: =VLOOKUP(RC[-1],工作表2!C[1]:C[2],2,0) -> 赤月老魔 | D631: 烈焰腰带 | E631: 163
A632: 201039 | B632: =R[-101]C+1 -> 9 | C632: =VLOOKUP(RC[-1],工作表2!C[1]:C[2],2,0) -> 赤月老魔 | D632: 烈焰魔靴 | E632: 163
A633: 202030 | B633: =R[-101]C+1 -> 9 | C633: =VLOOKUP(RC[-1],工作表2!C[1]:C[2],2,0) -> 赤月老魔 | D633: 玄天 | E633: 163
A634: 202031 | B634: =R[-101]C+1 -> 9 | C634: =VLOOKUP(RC[-1],工作表2!C[1]:C[2],2,0) -> 赤月老魔 | D634: 光芒道袍 | E634: 163
A635: 202032 | B635: =R[-101]C+1 -> 9 | C635: =VLOOKUP(RC[-1],工作表2!C[1]:C[2],2,0) -> 赤月老魔 | D635: 光芒道链 | E635: 163
A636: 202033 | B636: =R[-101]C+1 -> 9 | C636: =VLOOKUP(RC[-1],工作表2!C[1]:C[2],2,0) -> 赤月老魔 | D636: 光芒道戒 | E636: 163
A637: 202035 | B637: =R[-101]C+1 -> 9 | C637: =VLOOKUP(RC[-1],工作表2!C[1]:C[2],2,0) -> 赤月老魔 | D637: 光芒头盔 | E637: 163
A638: 202036 | B638: =R[-101]C+1 -> 9 | C638: =VLOOKUP(RC[-1],工作表2!C[1]:C[2],2,0) -> 赤月老魔 | D638: 光芒护腕 | E638: 163
A639: 202037 | B639: =R[-101]C+1 -> 9 | C639: =VLOOKUP(RC[-1],工作表2!C[1]:C[2],2,0) -> 赤月老魔 | D639: 光芒腰带 | E639: 163
A640: 202039 | B640: =R[-101]C+1 -> 9 | C640: =VLOOKUP(RC[-1],工作表2!C[1]:C[2],2,0) -> 赤月老魔 | D640: 光芒道靴 | E640: 163
A641: 200060 | B641: =R[-101]C+1 -> 9 | C641: =VLOOKUP(RC[-1],工作表2!C[1]:C[2],2,0) -> 赤月老魔 | D641: 混沌 | E641: 164
A642: 200061 | B642: =R[-101]C+1 -> 9 | C642: =VLOOKUP(RC[-1],工作表2!C[1]:C[2],2,0) -> 赤月老魔 | D642: 白虎衣服 | E642: 164
A643: 200062 | B643: =R[-101]C+1 -> 9 | C643: =VLOOKUP(RC[-1],工作表2!C[1]:C[2],2,0) -> 赤月老魔 | D643: 白虎头盔 | E643: 164
A644: 200063 | B644: =R[-101]C+1 -> 9 | C644: =VLOOKUP(RC[-1],工作表2!C[1]:C[2],2,0) -> 赤月老魔 | D644: 白虎项链 | E644: 164
A645: 200065 | B645: =R[-101]C+1 -> 9 | C645: =VLOOKUP(RC[-1],工作表2!C[1]:C[2],2,0) -> 赤月老魔 | D645: 白虎手镯 | E645: 164
A646: 200066 | B646: =R[-101]C+1 -> 9 | C646: =VLOOKUP(RC[-1],工作表2!C[1]:C[2],2,0) -> 赤月老魔 | D646: 白虎戒指 | E646: 164
A647: 200067 | B647: =R[-101]C+1 -> 9 | C647: =VLOOKUP(RC[-1],工作表2!C[1]:C[2],2,0) -> 赤月老魔 | D647: 白虎腰带 | E647: 164
A648: 200069 | B648: =R[-101]C+1 -> 9 | C648: =VLOOKUP(RC[-1],工作表2!C[1]:C[2],2,0) -> 赤月老魔 | D648: 白虎鞋子 | E648: 164
A649: 201060 | B649: =R[-101]C+1 -> 9 | C649: =VLOOKUP(RC[-1],工作表2!C[1]:C[2],2,0) -> 赤月老魔 | D649: 狂龙 | E649: 164
A650: 201061 | B650: =R[-101]C+1 -> 9 | C650: =VLOOKUP(RC[-1],工作表2!C[1]:C[2],2,0) -> 赤月老魔 | D650: 朱雀衣服 | E650: 164
A651: 201062 | B651: =R[-101]C+1 -> 9 | C651: =VLOOKUP(RC[-1],工作表2!C[1]:C[2],2,0) -> 赤月老魔 | D651: 朱雀头盔 | E651: 164
A652: 201063 | B652: =R[-101]C+1 -> 9 | C652: =VLOOKUP(RC[-1],工作表2!C[1]:C[2],2,0) -> 赤月老魔 | D652: 朱雀项链 | E652: 164
A653: 201065 | B653: =R[-101]C+1 -> 9 | C653: =VLOOKUP(RC[-1],工作表2!C[1]:C[2],2,0) -> 赤月老魔 | D653: 朱雀手镯 | E653: 164
A654: 201066 | B654: =R[-101]C+1 -> 9 | C654: =VLOOKUP(RC[-1],工作表2!C[1]:C[2],2,0) -> 赤月老魔 | D654: 朱雀戒指 | E654: 164
A655: 201067 | B655: =R[-101]C+1 -> 9 | C655: =VLOOKUP(RC[-1],工作表2!C[1]:C[2],2,0) -> 赤月老魔 | D655: 朱雀腰带 | E655: 164
A656: 201069 | B656: =R[-101]C+1 -> 9 | C656: =VLOOKUP(RC[-1],工作表2!C[1]:C[2],2,0) -> 赤月老魔 | D656: 朱雀鞋子 | E656: 164
A657: 202060 | B657: =R[-101]C+1 -> 9 | C657: =VLOOKUP(RC[-1],工作表2!C[1]:C[2],2,0) -> 赤月老魔 | D657: 天蛇 | E657: 164
A658: 202061 | B658: =R[-101]C+1 -> 9 | C658: =VLOOKUP(RC[-1],工作表2!C[1]:C[2],2,0) -> 赤月老魔 | D658: 青龙衣服 | E658: 164
A659: 202062 | B659: =R[-101]C+1 -> 9 | C659: =VLOOKUP(RC[-1],工作表2!C[1]:C[2],2,0) -> 赤月老魔 | D659: 青龙头盔 | E659: 164
A660: 202063 | B660: =R[-101]C+1 -> 9 | C660: =VLOOKUP(RC[-1],工作表2!C[1]:C[2],2,0) -> 赤月老魔 | D660: 青龙项链 | E660: 164
A661: 202065 | B661: =R[-101]C+1 -> 9 | C661: =VLOOKUP(RC[-1],工作表2!C[1]:C[2],2,0) -> 赤月老魔 | D661: 青龙手镯 | E661: 164
A662: 202066 | B662: =R[-101]C+1 -> 9 | C662: =VLOOKUP(RC[-1],工作表2!C[1]:C[2],2,0) -> 赤月老魔 | D662: 青龙戒指 | E662: 164
A663: 202067 | B663: =R[-101]C+1 -> 9 | C663: =VLOOKUP(RC[-1],工作表2!C[1]:C[2],2,0) -> 赤月老魔 | D663: 青龙腰带 | E663: 164
A664: 202069 | B664: =R[-101]C+1 -> 9 | C664: =VLOOKUP(RC[-1],工作表2!C[1]:C[2],2,0) -> 赤月老魔 | D664: 青龙鞋子 | E664: 164
A665: 200070 | B665: =R[-101]C+1 -> 9 | C665: =VLOOKUP(RC[-1],工作表2!C[1]:C[2],2,0) -> 赤月老魔 | D665: 战刃 | E665: 165
A666: 200071 | B666: =R[-101]C+1 -> 9 | C666: =VLOOKUP(RC[-1],工作表2!C[1]:C[2],2,0) -> 赤月老魔 | D666: 圣武衣服 | E666: 165
A667: 200072 | B667: =R[-101]C+1 -> 9 | C667: =VLOOKUP(RC[-1],工作表2!C[1]:C[2],2,0) -> 赤月老魔 | D667: 圣武项链 | E667: 165
A668: 200073 | B668: =R[-101]C+1 -> 9 | C668: =VLOOKUP(RC[-1],工作表2!C[1]:C[2],2,0) -> 赤月老魔 | D668: 圣武戒指 | E668: 165
A669: 200075 | B669: =R[-101]C+1 -> 9 | C669: =VLOOKUP(RC[-1],工作表2!C[1]:C[2],2,0) -> 赤月老魔 | D669: 圣武头盔 | E669: 165
A670: 200076 | B670: =R[-101]C+1 -> 9 | C670: =VLOOKUP(RC[-1],工作表2!C[1]:C[2],2,0) -> 赤月老魔 | D670: 圣武手镯 | E670: 165
A671: 200077 | B671: =R[-101]C+1 -> 9 | C671: =VLOOKUP(RC[-1],工作表2!C[1]:C[2],2,0) -> 赤月老魔 | D671: 圣武腰带 | E671: 165
A672: 200079 | B672: =R[-101]C+1 -> 9 | C672: =VLOOKUP(RC[-1],工作表2!C[1]:C[2],2,0) -> 赤月老魔 | D672: 圣武鞋子 | E672: 165
A673: 201070 | B673: =R[-101]C+1 -> 9 | C673: =VLOOKUP(RC[-1],工作表2!C[1]:C[2],2,0) -> 赤月老魔 | D673: 轮回 | E673: 165
A674: 201071 | B674: =R[-101]C+1 -> 9 | C674: =VLOOKUP(RC[-1],工作表2!C[1]:C[2],2,0) -> 赤月老魔 | D674: 圣魔衣服 | E674: 165
A675: 201072 | B675: =R[-101]C+1 -> 9 | C675: =VLOOKUP(RC[-1],工作表2!C[1]:C[2],2,0) -> 赤月老魔 | D675: 圣魔项链 | E675: 165
A676: 201073 | B676: =R[-101]C+1 -> 9 | C676: =VLOOKUP(RC[-1],工作表2!C[1]:C[2],2,0) -> 赤月老魔 | D676: 圣魔戒指 | E676: 165
A677: 201075 | B677: =R[-101]C+1 -> 9 | C677: =VLOOKUP(RC[-1],工作表2!C[1]:C[2],2,0) -> 赤月老魔 | D677: 圣魔头盔 | E677: 165
A678: 201076 | B678: =R[-101]C+1 -> 9 | C678: =VLOOKUP(RC[-1],工作表2!C[1]:C[2],2,0) -> 赤月老魔 | D678: 圣魔手镯 | E678: 165
A679: 201077 | B679: =R[-101]C+1 -> 9 | C679: =VLOOKUP(RC[-1],工作表2!C[1]:C[2],2,0) -> 赤月老魔 | D679: 圣魔腰带 | E679: 165
A680: 201079 | B680: =R[-101]C+1 -> 9 | C680: =VLOOKUP(RC[-1],工作表2!C[1]:C[2],2,0) -> 赤月老魔 | D680: 圣魔鞋子 | E680: 165
A681: 202070 | B681: =R[-101]C+1 -> 9 | C681: =VLOOKUP(RC[-1],工作表2!C[1]:C[2],2,0) -> 赤月老魔 | D681: 太虚 | E681: 165
A682: 202071 | B682: =R[-101]C+1 -> 9 | C682: =VLOOKUP(RC[-1],工作表2!C[1]:C[2],2,0) -> 赤月老魔 | D682: 圣魂衣服 | E682: 165
A683: 202072 | B683: =R[-101]C+1 -> 9 | C683: =VLOOKUP(RC[-1],工作表2!C[1]:C[2],2,0) -> 赤月老魔 | D683: 圣魂项链 | E683: 165
A684: 202073 | B684: =R[-101]C+1 -> 9 | C684: =VLOOKUP(RC[-1],工作表2!C[1]:C[2],2,0) -> 赤月老魔 | D684: 圣魂戒指 | E684: 165
A685: 202075 | B685: =R[-101]C+1 -> 9 | C685: =VLOOKUP(RC[-1],工作表2!C[1]:C[2],2,0) -> 赤月老魔 | D685: 圣魂头盔 | E685: 165
A686: 202076 | B686: =R[-101]C+1 -> 9 | C686: =VLOOKUP(RC[-1],工作表2!C[1]:C[2],2,0) -> 赤月老魔 | D686: 圣魂手镯 | E686: 165
A687: 202077 | B687: =R[-101]C+1 -> 9 | C687: =VLOOKUP(RC[-1],工作表2!C[1]:C[2],2,0) -> 赤月老魔 | D687: 圣魂腰带 | E687: 165
A688: 202079 | B688: =R[-101]C+1 -> 9 | C688: =VLOOKUP(RC[-1],工作表2!C[1]:C[2],2,0) -> 赤月老魔 | D688: 圣魂鞋子 | E688: 165
A689: 305000 | B689: =R[-101]C+1 -> 9 | C689: =VLOOKUP(RC[-1],工作表2!C[1]:C[2],2,0) -> 赤月老魔 | D689: 麻痹戒指 | E689: 166
A690: 305001 | B690: =R[-101]C+1 -> 9 | C690: =VLOOKUP(RC[-1],工作表2!C[1]:C[2],2,0) -> 赤月老魔 | D690: 护身戒指 | E690: 166
A691: 305002 | B691: =R[-101]C+1 -> 9 | C691: =VLOOKUP(RC[-1],工作表2!C[1]:C[2],2,0) -> 赤月老魔 | D691: 复活戒指 | E691: 166
A692: 110163 | B692: =R[-101]C+1 -> 9 | C692: =VLOOKUP(RC[-1],工作表2!C[1]:C[2],2,0) -> 赤月老魔 | D692: 上古神石 | E692: 167
A693: 305013 | B693: =R[-101]C+1 -> 9 | C693: =VLOOKUP(RC[-1],工作表2!C[1]:C[2],2,0) -> 赤月老魔 | D693: 特面 | E693: 168
A694: 305014 | B694: =R[-101]C+1 -> 9 | C694: =VLOOKUP(RC[-1],工作表2!C[1]:C[2],2,0) -> 赤月老魔 | D694: 特腿 | E694: 169
A695: 305015 | B695: =R[-101]C+1 -> 9 | C695: =VLOOKUP(RC[-1],工作表2!C[1]:C[2],2,0) -> 赤月老魔 | D695: 特肩 | E695: 170
A696: 110024 | B696: =R[-101]C+1 -> 9 | C696: =VLOOKUP(RC[-1],工作表2!C[1]:C[2],2,0) -> 赤月老魔 | D696: 狂风斩书 | E696: 36
A697: 110025 | B697: =R[-101]C+1 -> 9 | C697: =VLOOKUP(RC[-1],工作表2!C[1]:C[2],2,0) -> 赤月老魔 | D697: 逐日剑法书 | E697: 37
A698: 110067 | B698: =R[-101]C+1 -> 9 | C698: =VLOOKUP(RC[-1],工作表2!C[1]:C[2],2,0) -> 赤月老魔 | D698: 诱惑之光书 | E698: 38
A699: 110040 | B699: =R[-101]C+1 -> 9 | C699: =VLOOKUP(RC[-1],工作表2!C[1]:C[2],2,0) -> 赤月老魔 | D699: 流星火雨书 | E699: 39
A700: 110031 | B700: =R[-101]C+1 -> 9 | C700: =VLOOKUP(RC[-1],工作表2!C[1]:C[2],2,0) -> 赤月老魔 | D700: 召唤神兽书 | E700: 40
A701: 110032 | B701: =R[-101]C+1 -> 9 | C701: =VLOOKUP(RC[-1],工作表2!C[1]:C[2],2,0) -> 赤月老魔 | D701: 嗜血术书 | E701: 41
A702: 305003 | B702: =R[-101]C+1 -> 9 | C702: =VLOOKUP(RC[-1],工作表2!C[1]:C[2],2,0) -> 赤月老魔 | D702: 怒斩 | E702: 177
A703: 305004 | B703: =R[-101]C+1 -> 9 | C703: =VLOOKUP(RC[-1],工作表2!C[1]:C[2],2,0) -> 赤月老魔 | D703: 龙牙 | E703: 177
A704: 305005 | B704: =R[-101]C+1 -> 9 | C704: =VLOOKUP(RC[-1],工作表2!C[1]:C[2],2,0) -> 赤月老魔 | D704: 龙纹 | E704: 177
A705: 305006 | B705: =R[-101]C+1 -> 9 | C705: =VLOOKUP(RC[-1],工作表2!C[1]:C[2],2,0) -> 赤月老魔 | D705: 至尊屠龙 | E705: 178
A706: 305007 | B706: =R[-101]C+1 -> 9 | C706: =VLOOKUP(RC[-1],工作表2!C[1]:C[2],2,0) -> 赤月老魔 | D706: 至尊噬魂 | E706: 178
A707: 305008 | B707: =R[-101]C+1 -> 9 | C707: =VLOOKUP(RC[-1],工作表2!C[1]:C[2],2,0) -> 赤月老魔 | D707: 至尊逍遥扇 | E707: 178
A708: 110140 | B708: =R[-101]C+1 -> 9 | C708: =VLOOKUP(RC[-1],工作表2!C[1]:C[2],2,0) -> 赤月老魔 | D708: 进阶丹 | E708: 179
A709: 110109 | B709: =R[-101]C+1 -> 9 | C709: =VLOOKUP(RC[-1],工作表2!C[1]:C[2],2,0) -> 赤月老魔 | D709: 金刚石 | E709: 180
A710: 110154 | B710: =R[-101]C+1 -> 9 | C710: =VLOOKUP(RC[-1],工作表2!C[1]:C[2],2,0) -> 赤月老魔 | D710: 2元宝 | E710: 181
A711: 110155 | B711: =R[-101]C+1 -> 9 | C711: =VLOOKUP(RC[-1],工作表2!C[1]:C[2],2,0) -> 赤月老魔 | D711: 5元宝 | E711: 182
A712: 110156 | B712: =R[-101]C+1 -> 9 | C712: =VLOOKUP(RC[-1],工作表2!C[1]:C[2],2,0) -> 赤月老魔 | D712: 10元宝 | E712: 183
A713: 110157 | B713: =R[-101]C+1 -> 9 | C713: =VLOOKUP(RC[-1],工作表2!C[1]:C[2],2,0) -> 赤月老魔 | D713: 20元宝 | E713: 184
A714: 110158 | B714: =R[-101]C+1 -> 9 | C714: =VLOOKUP(RC[-1],工作表2!C[1]:C[2],2,0) -> 赤月老魔 | D714: 50元宝 | E714: 185
A715: 110159 | B715: =R[-101]C+1 -> 9 | C715: =VLOOKUP(RC[-1],工作表2!C[1]:C[2],2,0) -> 赤月老魔 | D715: 100元宝 | E715: 186
A716: 110164 | B716: =R[-101]C+1 -> 9 | C716: =VLOOKUP(RC[-1],工作表2!C[1]:C[2],2,0) -> 赤月老魔 | D716: 150元宝 | E716: 187
A717: 110165 | B717: =R[-101]C+1 -> 9 | C717: =VLOOKUP(RC[-1],工作表2!C[1]:C[2],2,0) -> 赤月老魔 | D717: 200元宝 | E717: 188
A718: 200030 | B718: =R[-101]C+1 -> 10 | C718: =VLOOKUP(RC[-1],工作表2!C[1]:C[2],2,0) -> 巨型多角虫 | D718: 开天 | E718: 190
A719: 200031 | B719: =R[-101]C+1 -> 10 | C719: =VLOOKUP(RC[-1],工作表2!C[1]:C[2],2,0) -> 巨型多角虫 | D719: 雷霆战甲 | E719: 190
A720: 200032 | B720: =R[-101]C+1 -> 10 | C720: =VLOOKUP(RC[-1],工作表2!C[1]:C[2],2,0) -> 巨型多角虫 | D720: 雷霆项链 | E720: 190
A721: 200033 | B721: =R[-101]C+1 -> 10 | C721: =VLOOKUP(RC[-1],工作表2!C[1]:C[2],2,0) -> 巨型多角虫 | D721: 雷霆戒指 | E721: 190
A722: 200035 | B722: =R[-101]C+1 -> 10 | C722: =VLOOKUP(RC[-1],工作表2!C[1]:C[2],2,0) -> 巨型多角虫 | D722: 雷霆头盔 | E722: 190
A723: 200036 | B723: =R[-101]C+1 -> 10 | C723: =VLOOKUP(RC[-1],工作表2!C[1]:C[2],2,0) -> 巨型多角虫 | D723: 雷霆护腕 | E723: 190
A724: 200037 | B724: =R[-101]C+1 -> 10 | C724: =VLOOKUP(RC[-1],工作表2!C[1]:C[2],2,0) -> 巨型多角虫 | D724: 雷霆腰带 | E724: 190
A725: 200039 | B725: =R[-101]C+1 -> 10 | C725: =VLOOKUP(RC[-1],工作表2!C[1]:C[2],2,0) -> 巨型多角虫 | D725: 雷霆战靴 | E725: 190
A726: 201030 | B726: =R[-101]C+1 -> 10 | C726: =VLOOKUP(RC[-1],工作表2!C[1]:C[2],2,0) -> 巨型多角虫 | D726: 震天 | E726: 190
A727: 201031 | B727: =R[-101]C+1 -> 10 | C727: =VLOOKUP(RC[-1],工作表2!C[1]:C[2],2,0) -> 巨型多角虫 | D727: 烈焰法袍 | E727: 190
A728: 201032 | B728: =R[-101]C+1 -> 10 | C728: =VLOOKUP(RC[-1],工作表2!C[1]:C[2],2,0) -> 巨型多角虫 | D728: 烈焰魔链 | E728: 190
A729: 201033 | B729: =R[-101]C+1 -> 10 | C729: =VLOOKUP(RC[-1],工作表2!C[1]:C[2],2,0) -> 巨型多角虫 | D729: 烈焰魔指 | E729: 190
A730: 201035 | B730: =R[-101]C+1 -> 10 | C730: =VLOOKUP(RC[-1],工作表2!C[1]:C[2],2,0) -> 巨型多角虫 | D730: 烈焰头盔 | E730: 190
A731: 201036 | B731: =R[-101]C+1 -> 10 | C731: =VLOOKUP(RC[-1],工作表2!C[1]:C[2],2,0) -> 巨型多角虫 | D731: 烈焰护腕 | E731: 190
A732: 201037 | B732: =R[-101]C+1 -> 10 | C732: =VLOOKUP(RC[-1],工作表2!C[1]:C[2],2,0) -> 巨型多角虫 | D732: 烈焰腰带 | E732: 190
A733: 201039 | B733: =R[-101]C+1 -> 10 | C733: =VLOOKUP(RC[-1],工作表2!C[1]:C[2],2,0) -> 巨型多角虫 | D733: 烈焰魔靴 | E733: 190
A734: 202030 | B734: =R[-101]C+1 -> 10 | C734: =VLOOKUP(RC[-1],工作表2!C[1]:C[2],2,0) -> 巨型多角虫 | D734: 玄天 | E734: 190
A735: 202031 | B735: =R[-101]C+1 -> 10 | C735: =VLOOKUP(RC[-1],工作表2!C[1]:C[2],2,0) -> 巨型多角虫 | D735: 光芒道袍 | E735: 190
A736: 202032 | B736: =R[-101]C+1 -> 10 | C736: =VLOOKUP(RC[-1],工作表2!C[1]:C[2],2,0) -> 巨型多角虫 | D736: 光芒道链 | E736: 190
A737: 202033 | B737: =R[-101]C+1 -> 10 | C737: =VLOOKUP(RC[-1],工作表2!C[1]:C[2],2,0) -> 巨型多角虫 | D737: 光芒道戒 | E737: 190
A738: 202035 | B738: =R[-101]C+1 -> 10 | C738: =VLOOKUP(RC[-1],工作表2!C[1]:C[2],2,0) -> 巨型多角虫 | D738: 光芒头盔 | E738: 190
A739: 202036 | B739: =R[-101]C+1 -> 10 | C739: =VLOOKUP(RC[-1],工作表2!C[1]:C[2],2,0) -> 巨型多角虫 | D739: 光芒护腕 | E739: 190
A740: 202037 | B740: =R[-101]C+1 -> 10 | C740: =VLOOKUP(RC[-1],工作表2!C[1]:C[2],2,0) -> 巨型多角虫 | D740: 光芒腰带 | E740: 190
A741: 202039 | B741: =R[-101]C+1 -> 10 | C741: =VLOOKUP(RC[-1],工作表2!C[1]:C[2],2,0) -> 巨型多角虫 | D741: 光芒道靴 | E741: 190
A742: 200060 | B742: =R[-101]C+1 -> 10 | C742: =VLOOKUP(RC[-1],工作表2!C[1]:C[2],2,0) -> 巨型多角虫 | D742: 混沌 | E742: 191
A743: 200061 | B743: =R[-101]C+1 -> 10 | C743: =VLOOKUP(RC[-1],工作表2!C[1]:C[2],2,0) -> 巨型多角虫 | D743: 白虎衣服 | E743: 191
A744: 200062 | B744: =R[-101]C+1 -> 10 | C744: =VLOOKUP(RC[-1],工作表2!C[1]:C[2],2,0) -> 巨型多角虫 | D744: 白虎头盔 | E744: 191
A745: 200063 | B745: =R[-101]C+1 -> 10 | C745: =VLOOKUP(RC[-1],工作表2!C[1]:C[2],2,0) -> 巨型多角虫 | D745: 白虎项链 | E745: 191
A746: 200065 | B746: =R[-101]C+1 -> 10 | C746: =VLOOKUP(RC[-1],工作表2!C[1]:C[2],2,0) -> 巨型多角虫 | D746: 白虎手镯 | E746: 191
A747: 200066 | B747: =R[-101]C+1 -> 10 | C747: =VLOOKUP(RC[-1],工作表2!C[1]:C[2],2,0) -> 巨型多角虫 | D747: 白虎戒指 | E747: 191
A748: 200067 | B748: =R[-101]C+1 -> 10 | C748: =VLOOKUP(RC[-1],工作表2!C[1]:C[2],2,0) -> 巨型多角虫 | D748: 白虎腰带 | E748: 191
A749: 200069 | B749: =R[-101]C+1 -> 10 | C749: =VLOOKUP(RC[-1],工作表2!C[1]:C[2],2,0) -> 巨型多角虫 | D749: 白虎鞋子 | E749: 191
A750: 201060 | B750: =R[-101]C+1 -> 10 | C750: =VLOOKUP(RC[-1],工作表2!C[1]:C[2],2,0) -> 巨型多角虫 | D750: 狂龙 | E750: 191
A751: 201061 | B751: =R[-101]C+1 -> 10 | C751: =VLOOKUP(RC[-1],工作表2!C[1]:C[2],2,0) -> 巨型多角虫 | D751: 朱雀衣服 | E751: 191
A752: 201062 | B752: =R[-101]C+1 -> 10 | C752: =VLOOKUP(RC[-1],工作表2!C[1]:C[2],2,0) -> 巨型多角虫 | D752: 朱雀头盔 | E752: 191
A753: 201063 | B753: =R[-101]C+1 -> 10 | C753: =VLOOKUP(RC[-1],工作表2!C[1]:C[2],2,0) -> 巨型多角虫 | D753: 朱雀项链 | E753: 191
A754: 201065 | B754: =R[-101]C+1 -> 10 | C754: =VLOOKUP(RC[-1],工作表2!C[1]:C[2],2,0) -> 巨型多角虫 | D754: 朱雀手镯 | E754: 191
A755: 201066 | B755: =R[-101]C+1 -> 10 | C755: =VLOOKUP(RC[-1],工作表2!C[1]:C[2],2,0) -> 巨型多角虫 | D755: 朱雀戒指 | E755: 191
A756: 201067 | B756: =R[-101]C+1 -> 10 | C756: =VLOOKUP(RC[-1],工作表2!C[1]:C[2],2,0) -> 巨型多角虫 | D756: 朱雀腰带 | E756: 191
A757: 201069 | B757: =R[-101]C+1 -> 10 | C757: =VLOOKUP(RC[-1],工作表2!C[1]:C[2],2,0) -> 巨型多角虫 | D757: 朱雀鞋子 | E757: 191
A758: 202060 | B758: =R[-101]C+1 -> 10 | C758: =VLOOKUP(RC[-1],工作表2!C[1]:C[2],2,0) -> 巨型多角虫 | D758: 天蛇 | E758: 191
A759: 202061 | B759: =R[-101]C+1 -> 10 | C759: =VLOOKUP(RC[-1],工作表2!C[1]:C[2],2,0) -> 巨型多角虫 | D759: 青龙衣服 | E759: 191
A760: 202062 | B760: =R[-101]C+1 -> 10 | C760: =VLOOKUP(RC[-1],工作表2!C[1]:C[2],2,0) -> 巨型多角虫 | D760: 青龙头盔 | E760: 191
A761: 202063 | B761: =R[-101]C+1 -> 10 | C761: =VLOOKUP(RC[-1],工作表2!C[1]:C[2],2,0) -> 巨型多角虫 | D761: 青龙项链 | E761: 191
A762: 202065 | B762: =R[-101]C+1 -> 10 | C762: =VLOOKUP(RC[-1],工作表2!C[1]:C[2],2,0) -> 巨型多角虫 | D762: 青龙手镯 | E762: 191
A763: 202066 | B763: =R[-101]C+1 -> 10 | C763: =VLOOKUP(RC[-1],工作表2!C[1]:C[2],2,0) -> 巨型多角虫 | D763: 青龙戒指 | E763: 191
A764: 202067 | B764: =R[-101]C+1 -> 10 | C764: =VLOOKUP(RC[-1],工作表2!C[1]:C[2],2,0) -> 巨型多角虫 | D764: 青龙腰带 | E764: 191
A765: 202069 | B765: =R[-101]C+1 -> 10 | C765: =VLOOKUP(RC[-1],工作表2!C[1]:C[2],2,0) -> 巨型多角虫 | D765: 青龙鞋子 | E765: 191
A766: 200070 | B766: =R[-101]C+1 -> 10 | C766: =VLOOKUP(RC[-1],工作表2!C[1]:C[2],2,0) -> 巨型多角虫 | D766: 战刃 | E766: 192
A767: 200071 | B767: =R[-101]C+1 -> 10 | C767: =VLOOKUP(RC[-1],工作表2!C[1]:C[2],2,0) -> 巨型多角虫 | D767: 圣武衣服 | E767: 192
A768: 200072 | B768: =R[-101]C+1 -> 10 | C768: =VLOOKUP(RC[-1],工作表2!C[1]:C[2],2,0) -> 巨型多角虫 | D768: 圣武项链 | E768: 192
A769: 200073 | B769: =R[-101]C+1 -> 10 | C769: =VLOOKUP(RC[-1],工作表2!C[1]:C[2],2,0) -> 巨型多角虫 | D769: 圣武戒指 | E769: 192
A770: 200075 | B770: =R[-101]C+1 -> 10 | C770: =VLOOKUP(RC[-1],工作表2!C[1]:C[2],2,0) -> 巨型多角虫 | D770: 圣武头盔 | E770: 192
A771: 200076 | B771: =R[-101]C+1 -> 10 | C771: =VLOOKUP(RC[-1],工作表2!C[1]:C[2],2,0) -> 巨型多角虫 | D771: 圣武手镯 | E771: 192
A772: 200077 | B772: =R[-101]C+1 -> 10 | C772: =VLOOKUP(RC[-1],工作表2!C[1]:C[2],2,0) -> 巨型多角虫 | D772: 圣武腰带 | E772: 192
A773: 200079 | B773: =R[-101]C+1 -> 10 | C773: =VLOOKUP(RC[-1],工作表2!C[1]:C[2],2,0) -> 巨型多角虫 | D773: 圣武鞋子 | E773: 192
A774: 201070 | B774: =R[-101]C+1 -> 10 | C774: =VLOOKUP(RC[-1],工作表2!C[1]:C[2],2,0) -> 巨型多角虫 | D774: 轮回 | E774: 192
A775: 201071 | B775: =R[-101]C+1 -> 10 | C775: =VLOOKUP(RC[-1],工作表2!C[1]:C[2],2,0) -> 巨型多角虫 | D775: 圣魔衣服 | E775: 192
A776: 201072 | B776: =R[-101]C+1 -> 10 | C776: =VLOOKUP(RC[-1],工作表2!C[1]:C[2],2,0) -> 巨型多角虫 | D776: 圣魔项链 | E776: 192
A777: 201073 | B777: =R[-101]C+1 -> 10 | C777: =VLOOKUP(RC[-1],工作表2!C[1]:C[2],2,0) -> 巨型多角虫 | D777: 圣魔戒指 | E777: 192
A778: 201075 | B778: =R[-101]C+1 -> 10 | C778: =VLOOKUP(RC[-1],工作表2!C[1]:C[2],2,0) -> 巨型多角虫 | D778: 圣魔头盔 | E778: 192
A779: 201076 | B779: =R[-101]C+1 -> 10 | C779: =VLOOKUP(RC[-1],工作表2!C[1]:C[2],2,0) -> 巨型多角虫 | D779: 圣魔手镯 | E779: 192
A780: 201077 | B780: =R[-101]C+1 -> 10 | C780: =VLOOKUP(RC[-1],工作表2!C[1]:C[2],2,0) -> 巨型多角虫 | D780: 圣魔腰带 | E780: 192
A781: 201079 | B781: =R[-101]C+1 -> 10 | C781: =VLOOKUP(RC[-1],工作表2!C[1]:C[2],2,0) -> 巨型多角虫 | D781: 圣魔鞋子 | E781: 192
A782: 202070 | B782: =R[-101]C+1 -> 10 | C782: =VLOOKUP(RC[-1],工作表2!C[1]:C[2],2,0) -> 巨型多角虫 | D782: 太虚 | E782: 192
A783: 202071 | B783: =R[-101]C+1 -> 10 | C783: =VLOOKUP(RC[-1],工作表2!C[1]:C[2],2,0) -> 巨型多角虫 | D783: 圣魂衣服 | E783: 192
A784: 202072 | B784: =R[-101]C+1 -> 10 | C784: =VLOOKUP(RC[-1],工作表2!C[1]:C[2],2,0) -> 巨型多角虫 | D784: 圣魂项链 | E784: 192
A785: 202073 | B785: =R[-101]C+1 -> 10 | C785: =VLOOKUP(RC[-1],工作表2!C[1]:C[2],2,0) -> 巨型多角虫 | D785: 圣魂戒指 | E785: 192
A786: 202075 | B786: =R[-101]C+1 -> 10 | C786: =VLOOKUP(RC[-1],工作表2!C[1]:C[2],2,0) -> 巨型多角虫 | D786: 圣魂头盔 | E786: 192
A787: 202076 | B787: =R[-101]C+1 -> 10 | C787: =VLOOKUP(RC[-1],工作表2!C[1]:C[2],2,0) -> 巨型多角虫 | D787: 圣魂手镯 | E787: 192
A788: 202077 | B788: =R[-101]C+1 -> 10 | C788: =VLOOKUP(RC[-1],工作表2!C[1]:C[2],2,0) -> 巨型多角虫 | D788: 圣魂腰带 | E788: 192
A789: 202079 | B789: =R[-101]C+1 -> 10 | C789: =VLOOKUP(RC[-1],工作表2!C[1]:C[2],2,0) -> 巨型多角虫 | D789: 圣魂鞋子 | E789: 192
A790: 305000 | B790: =R[-101]C+1 -> 10 | C790: =VLOOKUP(RC[-1],工作表2!C[1]:C[2],2,0) -> 巨型多角虫 | D790: 麻痹戒指 | E790: 193
A791: 305001 | B791: =R[-101]C+1 -> 10 | C791: =VLOOKUP(RC[-1],工作表2!C[1]:C[2],2,0) -> 巨型多角虫 | D791: 护身戒指 | E791: 193
A792: 305002 | B792: =R[-101]C+1 -> 10 | C792: =VLOOKUP(RC[-1],工作表2!C[1]:C[2],2,0) -> 巨型多角虫 | D792: 复活戒指 | E792: 193
A793: 110163 | B793: =R[-101]C+1 -> 10 | C793: =VLOOKUP(RC[-1],工作表2!C[1]:C[2],2,0) -> 巨型多角虫 | D793: 上古神石 | E793: 194
A794: 305013 | B794: =R[-101]C+1 -> 10 | C794: =VLOOKUP(RC[-1],工作表2!C[1]:C[2],2,0) -> 巨型多角虫 | D794: 特面 | E794: 195
A795: 305014 | B795: =R[-101]C+1 -> 10 | C795: =VLOOKUP(RC[-1],工作表2!C[1]:C[2],2,0) -> 巨型多角虫 | D795: 特腿 | E795: 196
A796: 305015 | B796: =R[-101]C+1 -> 10 | C796: =VLOOKUP(RC[-1],工作表2!C[1]:C[2],2,0) -> 巨型多角虫 | D796: 特肩 | E796: 197
A797: 110024 | B797: =R[-101]C+1 -> 10 | C797: =VLOOKUP(RC[-1],工作表2!C[1]:C[2],2,0) -> 巨型多角虫 | D797: 狂风斩书 | E797: 36
A798: 110025 | B798: =R[-101]C+1 -> 10 | C798: =VLOOKUP(RC[-1],工作表2!C[1]:C[2],2,0) -> 巨型多角虫 | D798: 逐日剑法书 | E798: 37
A799: 110067 | B799: =R[-101]C+1 -> 10 | C799: =VLOOKUP(RC[-1],工作表2!C[1]:C[2],2,0) -> 巨型多角虫 | D799: 诱惑之光书 | E799: 38
A800: 110040 | B800: =R[-101]C+1 -> 10 | C800: =VLOOKUP(RC[-1],工作表2!C[1]:C[2],2,0) -> 巨型多角虫 | D800: 流星火雨书 | E800: 39
A801: 110031 | B801: =R[-101]C+1 -> 10 | C801: =VLOOKUP(RC[-1],工作表2!C[1]:C[2],2,0) -> 巨型多角虫 | D801: 召唤神兽书 | E801: 40
A802: 110032 | B802: =R[-101]C+1 -> 10 | C802: =VLOOKUP(RC[-1],工作表2!C[1]:C[2],2,0) -> 巨型多角虫 | D802: 嗜血术书 | E802: 41
A803: 305003 | B803: =R[-101]C+1 -> 10 | C803: =VLOOKUP(RC[-1],工作表2!C[1]:C[2],2,0) -> 巨型多角虫 | D803: 怒斩 | E803: 204
A804: 305004 | B804: =R[-101]C+1 -> 10 | C804: =VLOOKUP(RC[-1],工作表2!C[1]:C[2],2,0) -> 巨型多角虫 | D804: 龙牙 | E804: 204
A805: 305005 | B805: =R[-101]C+1 -> 10 | C805: =VLOOKUP(RC[-1],工作表2!C[1]:C[2],2,0) -> 巨型多角虫 | D805: 龙纹 | E805: 204
A806: 305006 | B806: =R[-101]C+1 -> 10 | C806: =VLOOKUP(RC[-1],工作表2!C[1]:C[2],2,0) -> 巨型多角虫 | D806: 至尊屠龙 | E806: 205
A807: 305007 | B807: =R[-101]C+1 -> 10 | C807: =VLOOKUP(RC[-1],工作表2!C[1]:C[2],2,0) -> 巨型多角虫 | D807: 至尊噬魂 | E807: 205
A808: 305008 | B808: =R[-101]C+1 -> 10 | C808: =VLOOKUP(RC[-1],工作表2!C[1]:C[2],2,0) -> 巨型多角虫 | D808: 至尊逍遥扇 | E808: 205
A809: 110140 | B809: =R[-101]C+1 -> 10 | C809: =VLOOKUP(RC[-1],工作表2!C[1]:C[2],2,0) -> 巨型多角虫 | D809: 进阶丹 | E809: 206
A810: 110109 | B810: =R[-101]C+1 -> 10 | C810: =VLOOKUP(RC[-1],工作表2!C[1]:C[2],2,0) -> 巨型多角虫 | D810: 金刚石 | E810: 207
A811: 110154 | B811: =R[-101]C+1 -> 10 | C811: =VLOOKUP(RC[-1],工作表2!C[1]:C[2],2,0) -> 巨型多角虫 | D811: 2元宝 | E811: 208
A812: 110155 | B812: =R[-101]C+1 -> 10 | C812: =VLOOKUP(RC[-1],工作表2!C[1]:C[2],2,0) -> 巨型多角虫 | D812: 5元宝 | E812: 209
A813: 110156 | B813: =R[-101]C+1 -> 10 | C813: =VLOOKUP(RC[-1],工作表2!C[1]:C[2],2,0) -> 巨型多角虫 | D813: 10元宝 | E813: 210
A814: 110157 | B814: =R[-101]C+1 -> 10 | C814: =VLOOKUP(RC[-1],工作表2!C[1]:C[2],2,0) -> 巨型多角虫 | D814: 20元宝 | E814: 211
A815: 110158 | B815: =R[-101]C+1 -> 10 | C815: =VLOOKUP(RC[-1],工作表2!C[1]:C[2],2,0) -> 巨型多角虫 | D815: 50元宝 | E815: 212
A816: 110159 | B816: =R[-101]C+1 -> 10 | C816: =VLOOKUP(RC[-1],工作表2!C[1]:C[2],2,0) -> 巨型多角虫 | D816: 100元宝 | E816: 213
A817: 110164 | B817: =R[-101]C+1 -> 10 | C817: =VLOOKUP(RC[-1],工作表2!C[1]:C[2],2,0) -> 巨型多角虫 | D817: 150元宝 | E817: 214
A818: 110165 | B818: =R[-101]C+1 -> 10 | C818: =VLOOKUP(RC[-1],工作表2!C[1]:C[2],2,0) -> 巨型多角虫 | D818: 200元宝 | E818: 215
A819: 200030 | B819: =R[-101]C+1 -> 11 | C819: =VLOOKUP(RC[-1],工作表2!C[1]:C[2],2,0) -> 巨型钳虫 | D819: 开天 | E819: 217
A820: 200031 | B820: =R[-101]C+1 -> 11 | C820: =VLOOKUP(RC[-1],工作表2!C[1]:C[2],2,0) -> 巨型钳虫 | D820: 雷霆战甲 | E820: 217
A821: 200032 | B821: =R[-101]C+1 -> 11 | C821: =VLOOKUP(RC[-1],工作表2!C[1]:C[2],2,0) -> 巨型钳虫 | D821: 雷霆项链 | E821: 217
A822: 200033 | B822: =R[-101]C+1 -> 11 | C822: =VLOOKUP(RC[-1],工作表2!C[1]:C[2],2,0) -> 巨型钳虫 | D822: 雷霆戒指 | E822: 217
A823: 200035 | B823: =R[-101]C+1 -> 11 | C823: =VLOOKUP(RC[-1],工作表2!C[1]:C[2],2,0) -> 巨型钳虫 | D823: 雷霆头盔 | E823: 217
A824: 200036 | B824: =R[-101]C+1 -> 11 | C824: =VLOOKUP(RC[-1],工作表2!C[1]:C[2],2,0) -> 巨型钳虫 | D824: 雷霆护腕 | E824: 217
A825: 200037 | B825: =R[-101]C+1 -> 11 | C825: =VLOOKUP(RC[-1],工作表2!C[1]:C[2],2,0) -> 巨型钳虫 | D825: 雷霆腰带 | E825: 217
A826: 200039 | B826: =R[-101]C+1 -> 11 | C826: =VLOOKUP(RC[-1],工作表2!C[1]:C[2],2,0) -> 巨型钳虫 | D826: 雷霆战靴 | E826: 217
A827: 201030 | B827: =R[-101]C+1 -> 11 | C827: =VLOOKUP(RC[-1],工作表2!C[1]:C[2],2,0) -> 巨型钳虫 | D827: 震天 | E827: 217
A828: 201031 | B828: =R[-101]C+1 -> 11 | C828: =VLOOKUP(RC[-1],工作表2!C[1]:C[2],2,0) -> 巨型钳虫 | D828: 烈焰法袍 | E828: 217
A829: 201032 | B829: =R[-101]C+1 -> 11 | C829: =VLOOKUP(RC[-1],工作表2!C[1]:C[2],2,0) -> 巨型钳虫 | D829: 烈焰魔链 | E829: 217
A830: 201033 | B830: =R[-101]C+1 -> 11 | C830: =VLOOKUP(RC[-1],工作表2!C[1]:C[2],2,0) -> 巨型钳虫 | D830: 烈焰魔指 | E830: 217
A831: 201035 | B831: =R[-101]C+1 -> 11 | C831: =VLOOKUP(RC[-1],工作表2!C[1]:C[2],2,0) -> 巨型钳虫 | D831: 烈焰头盔 | E831: 217
A832: 201036 | B832: =R[-101]C+1 -> 11 | C832: =VLOOKUP(RC[-1],工作表2!C[1]:C[2],2,0) -> 巨型钳虫 | D832: 烈焰护腕 | E832: 217
A833: 201037 | B833: =R[-101]C+1 -> 11 | C833: =VLOOKUP(RC[-1],工作表2!C[1]:C[2],2,0) -> 巨型钳虫 | D833: 烈焰腰带 | E833: 217
A834: 201039 | B834: =R[-101]C+1 -> 11 | C834: =VLOOKUP(RC[-1],工作表2!C[1]:C[2],2,0) -> 巨型钳虫 | D834: 烈焰魔靴 | E834: 217
A835: 202030 | B835: =R[-101]C+1 -> 11 | C835: =VLOOKUP(RC[-1],工作表2!C[1]:C[2],2,0) -> 巨型钳虫 | D835: 玄天 | E835: 217
A836: 202031 | B836: =R[-101]C+1 -> 11 | C836: =VLOOKUP(RC[-1],工作表2!C[1]:C[2],2,0) -> 巨型钳虫 | D836: 光芒道袍 | E836: 217
A837: 202032 | B837: =R[-101]C+1 -> 11 | C837: =VLOOKUP(RC[-1],工作表2!C[1]:C[2],2,0) -> 巨型钳虫 | D837: 光芒道链 | E837: 217
A838: 202033 | B838: =R[-101]C+1 -> 11 | C838: =VLOOKUP(RC[-1],工作表2!C[1]:C[2],2,0) -> 巨型钳虫 | D838: 光芒道戒 | E838: 217
A839: 202035 | B839: =R[-101]C+1 -> 11 | C839: =VLOOKUP(RC[-1],工作表2!C[1]:C[2],2,0) -> 巨型钳虫 | D839: 光芒头盔 | E839: 217
A840: 202036 | B840: =R[-101]C+1 -> 11 | C840: =VLOOKUP(RC[-1],工作表2!C[1]:C[2],2,0) -> 巨型钳虫 | D840: 光芒护腕 | E840: 217
A841: 202037 | B841: =R[-101]C+1 -> 11 | C841: =VLOOKUP(RC[-1],工作表2!C[1]:C[2],2,0) -> 巨型钳虫 | D841: 光芒腰带 | E841: 217
A842: 202039 | B842: =R[-101]C+1 -> 11 | C842: =VLOOKUP(RC[-1],工作表2!C[1]:C[2],2,0) -> 巨型钳虫 | D842: 光芒道靴 | E842: 217
A843: 200060 | B843: =R[-101]C+1 -> 11 | C843: =VLOOKUP(RC[-1],工作表2!C[1]:C[2],2,0) -> 巨型钳虫 | D843: 混沌 | E843: 218
A844: 200061 | B844: =R[-101]C+1 -> 11 | C844: =VLOOKUP(RC[-1],工作表2!C[1]:C[2],2,0) -> 巨型钳虫 | D844: 白虎衣服 | E844: 218
A845: 200062 | B845: =R[-101]C+1 -> 11 | C845: =VLOOKUP(RC[-1],工作表2!C[1]:C[2],2,0) -> 巨型钳虫 | D845: 白虎头盔 | E845: 218
A846: 200063 | B846: =R[-101]C+1 -> 11 | C846: =VLOOKUP(RC[-1],工作表2!C[1]:C[2],2,0) -> 巨型钳虫 | D846: 白虎项链 | E846: 218
A847: 200065 | B847: =R[-101]C+1 -> 11 | C847: =VLOOKUP(RC[-1],工作表2!C[1]:C[2],2,0) -> 巨型钳虫 | D847: 白虎手镯 | E847: 218
A848: 200066 | B848: =R[-101]C+1 -> 11 | C848: =VLOOKUP(RC[-1],工作表2!C[1]:C[2],2,0) -> 巨型钳虫 | D848: 白虎戒指 | E848: 218
A849: 200067 | B849: =R[-101]C+1 -> 11 | C849: =VLOOKUP(RC[-1],工作表2!C[1]:C[2],2,0) -> 巨型钳虫 | D849: 白虎腰带 | E849: 218
A850: 200069 | B850: =R[-101]C+1 -> 11 | C850: =VLOOKUP(RC[-1],工作表2!C[1]:C[2],2,0) -> 巨型钳虫 | D850: 白虎鞋子 | E850: 218
A851: 201060 | B851: =R[-101]C+1 -> 11 | C851: =VLOOKUP(RC[-1],工作表2!C[1]:C[2],2,0) -> 巨型钳虫 | D851: 狂龙 | E851: 218
A852: 201061 | B852: =R[-101]C+1 -> 11 | C852: =VLOOKUP(RC[-1],工作表2!C[1]:C[2],2,0) -> 巨型钳虫 | D852: 朱雀衣服 | E852: 218
A853: 201062 | B853: =R[-101]C+1 -> 11 | C853: =VLOOKUP(RC[-1],工作表2!C[1]:C[2],2,0) -> 巨型钳虫 | D853: 朱雀头盔 | E853: 218
A854: 201063 | B854: =R[-101]C+1 -> 11 | C854: =VLOOKUP(RC[-1],工作表2!C[1]:C[2],2,0) -> 巨型钳虫 | D854: 朱雀项链 | E854: 218
A855: 201065 | B855: =R[-101]C+1 -> 11 | C855: =VLOOKUP(RC[-1],工作表2!C[1]:C[2],2,0) -> 巨型钳虫 | D855: 朱雀手镯 | E855: 218
A856: 201066 | B856: =R[-101]C+1 -> 11 | C856: =VLOOKUP(RC[-1],工作表2!C[1]:C[2],2,0) -> 巨型钳虫 | D856: 朱雀戒指 | E856: 218
A857: 201067 | B857: =R[-101]C+1 -> 11 | C857: =VLOOKUP(RC[-1],工作表2!C[1]:C[2],2,0) -> 巨型钳虫 | D857: 朱雀腰带 | E857: 218
A858: 201069 | B858: =R[-101]C+1 -> 11 | C858: =VLOOKUP(RC[-1],工作表2!C[1]:C[2],2,0) -> 巨型钳虫 | D858: 朱雀鞋子 | E858: 218
A859: 202060 | B859: =R[-101]C+1 -> 11 | C859: =VLOOKUP(RC[-1],工作表2!C[1]:C[2],2,0) -> 巨型钳虫 | D859: 天蛇 | E859: 218
A860: 202061 | B860: =R[-101]C+1 -> 11 | C860: =VLOOKUP(RC[-1],工作表2!C[1]:C[2],2,0) -> 巨型钳虫 | D860: 青龙衣服 | E860: 218
A861: 202062 | B861: =R[-101]C+1 -> 11 | C861: =VLOOKUP(RC[-1],工作表2!C[1]:C[2],2,0) -> 巨型钳虫 | D861: 青龙头盔 | E861: 218
A862: 202063 | B862: =R[-101]C+1 -> 11 | C862: =VLOOKUP(RC[-1],工作表2!C[1]:C[2],2,0) -> 巨型钳虫 | D862: 青龙项链 | E862: 218
A863: 202065 | B863: =R[-101]C+1 -> 11 | C863: =VLOOKUP(RC[-1],工作表2!C[1]:C[2],2,0) -> 巨型钳虫 | D863: 青龙手镯 | E863: 218
A864: 202066 | B864: =R[-101]C+1 -> 11 | C864: =VLOOKUP(RC[-1],工作表2!C[1]:C[2],2,0) -> 巨型钳虫 | D864: 青龙戒指 | E864: 218
A865: 202067 | B865: =R[-101]C+1 -> 11 | C865: =VLOOKUP(RC[-1],工作表2!C[1]:C[2],2,0) -> 巨型钳虫 | D865: 青龙腰带 | E865: 218
A866: 202069 | B866: =R[-101]C+1 -> 11 | C866: =VLOOKUP(RC[-1],工作表2!C[1]:C[2],2,0) -> 巨型钳虫 | D866: 青龙鞋子 | E866: 218
A867: 200070 | B867: =R[-101]C+1 -> 11 | C867: =VLOOKUP(RC[-1],工作表2!C[1]:C[2],2,0) -> 巨型钳虫 | D867: 战刃 | E867: 219
A868: 200071 | B868: =R[-101]C+1 -> 11 | C868: =VLOOKUP(RC[-1],工作表2!C[1]:C[2],2,0) -> 巨型钳虫 | D868: 圣武衣服 | E868: 219
A869: 200072 | B869: =R[-101]C+1 -> 11 | C869: =VLOOKUP(RC[-1],工作表2!C[1]:C[2],2,0) -> 巨型钳虫 | D869: 圣武项链 | E869: 219
A870: 200073 | B870: =R[-101]C+1 -> 11 | C870: =VLOOKUP(RC[-1],工作表2!C[1]:C[2],2,0) -> 巨型钳虫 | D870: 圣武戒指 | E870: 219
A871: 200075 | B871: =R[-101]C+1 -> 11 | C871: =VLOOKUP(RC[-1],工作表2!C[1]:C[2],2,0) -> 巨型钳虫 | D871: 圣武头盔 | E871: 219
A872: 200076 | B872: =R[-101]C+1 -> 11 | C872: =VLOOKUP(RC[-1],工作表2!C[1]:C[2],2,0) -> 巨型钳虫 | D872: 圣武手镯 | E872: 219
A873: 200077 | B873: =R[-101]C+1 -> 11 | C873: =VLOOKUP(RC[-1],工作表2!C[1]:C[2],2,0) -> 巨型钳虫 | D873: 圣武腰带 | E873: 219
A874: 200079 | B874: =R[-101]C+1 -> 11 | C874: =VLOOKUP(RC[-1],工作表2!C[1]:C[2],2,0) -> 巨型钳虫 | D874: 圣武鞋子 | E874: 219
A875: 201070 | B875: =R[-101]C+1 -> 11 | C875: =VLOOKUP(RC[-1],工作表2!C[1]:C[2],2,0) -> 巨型钳虫 | D875: 轮回 | E875: 219
A876: 201071 | B876: =R[-101]C+1 -> 11 | C876: =VLOOKUP(RC[-1],工作表2!C[1]:C[2],2,0) -> 巨型钳虫 | D876: 圣魔衣服 | E876: 219
A877: 201072 | B877: =R[-101]C+1 -> 11 | C877: =VLOOKUP(RC[-1],工作表2!C[1]:C[2],2,0) -> 巨型钳虫 | D877: 圣魔项链 | E877: 219
A878: 201073 | B878: =R[-101]C+1 -> 11 | C878: =VLOOKUP(RC[-1],工作表2!C[1]:C[2],2,0) -> 巨型钳虫 | D878: 圣魔戒指 | E878: 219
A879: 201075 | B879: =R[-101]C+1 -> 11 | C879: =VLOOKUP(RC[-1],工作表2!C[1]:C[2],2,0) -> 巨型钳虫 | D879: 圣魔头盔 | E879: 219
A880: 201076 | B880: =R[-101]C+1 -> 11 | C880: =VLOOKUP(RC[-1],工作表2!C[1]:C[2],2,0) -> 巨型钳虫 | D880: 圣魔手镯 | E880: 219
A881: 201077 | B881: =R[-101]C+1 -> 11 | C881: =VLOOKUP(RC[-1],工作表2!C[1]:C[2],2,0) -> 巨型钳虫 | D881: 圣魔腰带 | E881: 219
A882: 201079 | B882: =R[-101]C+1 -> 11 | C882: =VLOOKUP(RC[-1],工作表2!C[1]:C[2],2,0) -> 巨型钳虫 | D882: 圣魔鞋子 | E882: 219
A883: 202070 | B883: =R[-101]C+1 -> 11 | C883: =VLOOKUP(RC[-1],工作表2!C[1]:C[2],2,0) -> 巨型钳虫 | D883: 太虚 | E883: 219
A884: 202071 | B884: =R[-101]C+1 -> 11 | C884: =VLOOKUP(RC[-1],工作表2!C[1]:C[2],2,0) -> 巨型钳虫 | D884: 圣魂衣服 | E884: 219
A885: 202072 | B885: =R[-101]C+1 -> 11 | C885: =VLOOKUP(RC[-1],工作表2!C[1]:C[2],2,0) -> 巨型钳虫 | D885: 圣魂项链 | E885: 219
A886: 202073 | B886: =R[-101]C+1 -> 11 | C886: =VLOOKUP(RC[-1],工作表2!C[1]:C[2],2,0) -> 巨型钳虫 | D886: 圣魂戒指 | E886: 219
A887: 202075 | B887: =R[-101]C+1 -> 11 | C887: =VLOOKUP(RC[-1],工作表2!C[1]:C[2],2,0) -> 巨型钳虫 | D887: 圣魂头盔 | E887: 219
A888: 202076 | B888: =R[-101]C+1 -> 11 | C888: =VLOOKUP(RC[-1],工作表2!C[1]:C[2],2,0) -> 巨型钳虫 | D888: 圣魂手镯 | E888: 219
A889: 202077 | B889: =R[-101]C+1 -> 11 | C889: =VLOOKUP(RC[-1],工作表2!C[1]:C[2],2,0) -> 巨型钳虫 | D889: 圣魂腰带 | E889: 219
A890: 202079 | B890: =R[-101]C+1 -> 11 | C890: =VLOOKUP(RC[-1],工作表2!C[1]:C[2],2,0) -> 巨型钳虫 | D890: 圣魂鞋子 | E890: 219
A891: 305000 | B891: =R[-101]C+1 -> 11 | C891: =VLOOKUP(RC[-1],工作表2!C[1]:C[2],2,0) -> 巨型钳虫 | D891: 麻痹戒指 | E891: 220
A892: 305001 | B892: =R[-101]C+1 -> 11 | C892: =VLOOKUP(RC[-1],工作表2!C[1]:C[2],2,0) -> 巨型钳虫 | D892: 护身戒指 | E892: 220
A893: 305002 | B893: =R[-101]C+1 -> 11 | C893: =VLOOKUP(RC[-1],工作表2!C[1]:C[2],2,0) -> 巨型钳虫 | D893: 复活戒指 | E893: 220
A894: 110163 | B894: =R[-101]C+1 -> 11 | C894: =VLOOKUP(RC[-1],工作表2!C[1]:C[2],2,0) -> 巨型钳虫 | D894: 上古神石 | E894: 221
A895: 305013 | B895: =R[-101]C+1 -> 11 | C895: =VLOOKUP(RC[-1],工作表2!C[1]:C[2],2,0) -> 巨型钳虫 | D895: 特面 | E895: 222
A896: 305014 | B896: =R[-101]C+1 -> 11 | C896: =VLOOKUP(RC[-1],工作表2!C[1]:C[2],2,0) -> 巨型钳虫 | D896: 特腿 | E896: 223
A897: 305015 | B897: =R[-101]C+1 -> 11 | C897: =VLOOKUP(RC[-1],工作表2!C[1]:C[2],2,0) -> 巨型钳虫 | D897: 特肩 | E897: 224
A898: 110024 | B898: =R[-101]C+1 -> 11 | C898: =VLOOKUP(RC[-1],工作表2!C[1]:C[2],2,0) -> 巨型钳虫 | D898: 狂风斩书 | E898: 36
A899: 110025 | B899: =R[-101]C+1 -> 11 | C899: =VLOOKUP(RC[-1],工作表2!C[1]:C[2],2,0) -> 巨型钳虫 | D899: 逐日剑法书 | E899: 37
A900: 110067 | B900: =R[-101]C+1 -> 11 | C900: =VLOOKUP(RC[-1],工作表2!C[1]:C[2],2,0) -> 巨型钳虫 | D900: 诱惑之光书 | E900: 38
A901: 110040 | B901: =R[-101]C+1 -> 11 | C901: =VLOOKUP(RC[-1],工作表2!C[1]:C[2],2,0) -> 巨型钳虫 | D901: 流星火雨书 | E901: 39
A902: 110031 | B902: =R[-101]C+1 -> 11 | C902: =VLOOKUP(RC[-1],工作表2!C[1]:C[2],2,0) -> 巨型钳虫 | D902: 召唤神兽书 | E902: 40
A903: 110032 | B903: =R[-101]C+1 -> 11 | C903: =VLOOKUP(RC[-1],工作表2!C[1]:C[2],2,0) -> 巨型钳虫 | D903: 嗜血术书 | E903: 41
A904: 305003 | B904: =R[-101]C+1 -> 11 | C904: =VLOOKUP(RC[-1],工作表2!C[1]:C[2],2,0) -> 巨型钳虫 | D904: 怒斩 | E904: 231
A905: 305004 | B905: =R[-101]C+1 -> 11 | C905: =VLOOKUP(RC[-1],工作表2!C[1]:C[2],2,0) -> 巨型钳虫 | D905: 龙牙 | E905: 231
A906: 305005 | B906: =R[-101]C+1 -> 11 | C906: =VLOOKUP(RC[-1],工作表2!C[1]:C[2],2,0) -> 巨型钳虫 | D906: 龙纹 | E906: 231
A907: 305006 | B907: =R[-101]C+1 -> 11 | C907: =VLOOKUP(RC[-1],工作表2!C[1]:C[2],2,0) -> 巨型钳虫 | D907: 至尊屠龙 | E907: 232
A908: 305007 | B908: =R[-101]C+1 -> 11 | C908: =VLOOKUP(RC[-1],工作表2!C[1]:C[2],2,0) -> 巨型钳虫 | D908: 至尊噬魂 | E908: 232
A909: 305008 | B909: =R[-101]C+1 -> 11 | C909: =VLOOKUP(RC[-1],工作表2!C[1]:C[2],2,0) -> 巨型钳虫 | D909: 至尊逍遥扇 | E909: 232
A910: 110140 | B910: =R[-101]C+1 -> 11 | C910: =VLOOKUP(RC[-1],工作表2!C[1]:C[2],2,0) -> 巨型钳虫 | D910: 进阶丹 | E910: 233
A911: 110109 | B911: =R[-101]C+1 -> 11 | C911: =VLOOKUP(RC[-1],工作表2!C[1]:C[2],2,0) -> 巨型钳虫 | D911: 金刚石 | E911: 234
A912: 110154 | B912: =R[-101]C+1 -> 11 | C912: =VLOOKUP(RC[-1],工作表2!C[1]:C[2],2,0) -> 巨型钳虫 | D912: 2元宝 | E912: 235
A913: 110155 | B913: =R[-101]C+1 -> 11 | C913: =VLOOKUP(RC[-1],工作表2!C[1]:C[2],2,0) -> 巨型钳虫 | D913: 5元宝 | E913: 236
A914: 110156 | B914: =R[-101]C+1 -> 11 | C914: =VLOOKUP(RC[-1],工作表2!C[1]:C[2],2,0) -> 巨型钳虫 | D914: 10元宝 | E914: 237
A915: 110157 | B915: =R[-101]C+1 -> 11 | C915: =VLOOKUP(RC[-1],工作表2!C[1]:C[2],2,0) -> 巨型钳虫 | D915: 20元宝 | E915: 238
A916: 110158 | B916: =R[-101]C+1 -> 11 | C916: =VLOOKUP(RC[-1],工作表2!C[1]:C[2],2,0) -> 巨型钳虫 | D916: 50元宝 | E916: 239
A917: 110159 | B917: =R[-101]C+1 -> 11 | C917: =VLOOKUP(RC[-1],工作表2!C[1]:C[2],2,0) -> 巨型钳虫 | D917: 100元宝 | E917: 240
A918: 110164 | B918: =R[-101]C+1 -> 11 | C918: =VLOOKUP(RC[-1],工作表2!C[1]:C[2],2,0) -> 巨型钳虫 | D918: 150元宝 | E918: 241
A919: 110165 | B919: =R[-101]C+1 -> 11 | C919: =VLOOKUP(RC[-1],工作表2!C[1]:C[2],2,0) -> 巨型钳虫 | D919: 200元宝 | E919: 242
A920: 200030 | B920: =R[-101]C+1 -> 12 | C920: =VLOOKUP(RC[-1],工作表2!C[1]:C[2],2,0) -> 巨型双头恶魔 | D920: 开天 | E920: 244
A921: 200031 | B921: =R[-101]C+1 -> 12 | C921: =VLOOKUP(RC[-1],工作表2!C[1]:C[2],2,0) -> 巨型双头恶魔 | D921: 雷霆战甲 | E921: 244
A922: 200032 | B922: =R[-101]C+1 -> 12 | C922: =VLOOKUP(RC[-1],工作表2!C[1]:C[2],2,0) -> 巨型双头恶魔 | D922: 雷霆项链 | E922: 244
A923: 200033 | B923: =R[-101]C+1 -> 12 | C923: =VLOOKUP(RC[-1],工作表2!C[1]:C[2],2,0) -> 巨型双头恶魔 | D923: 雷霆戒指 | E923: 244
A924: 200035 | B924: =R[-101]C+1 -> 12 | C924: =VLOOKUP(RC[-1],工作表2!C[1]:C[2],2,0) -> 巨型双头恶魔 | D924: 雷霆头盔 | E924: 244
A925: 200036 | B925: =R[-101]C+1 -> 12 | C925: =VLOOKUP(RC[-1],工作表2!C[1]:C[2],2,0) -> 巨型双头恶魔 | D925: 雷霆护腕 | E925: 244
A926: 200037 | B926: =R[-101]C+1 -> 12 | C926: =VLOOKUP(RC[-1],工作表2!C[1]:C[2],2,0) -> 巨型双头恶魔 | D926: 雷霆腰带 | E926: 244
A927: 200039 | B927: =R[-101]C+1 -> 12 | C927: =VLOOKUP(RC[-1],工作表2!C[1]:C[2],2,0) -> 巨型双头恶魔 | D927: 雷霆战靴 | E927: 244
A928: 201030 | B928: =R[-101]C+1 -> 12 | C928: =VLOOKUP(RC[-1],工作表2!C[1]:C[2],2,0) -> 巨型双头恶魔 | D928: 震天 | E928: 244
A929: 201031 | B929: =R[-101]C+1 -> 12 | C929: =VLOOKUP(RC[-1],工作表2!C[1]:C[2],2,0) -> 巨型双头恶魔 | D929: 烈焰法袍 | E929: 244
A930: 201032 | B930: =R[-101]C+1 -> 12 | C930: =VLOOKUP(RC[-1],工作表2!C[1]:C[2],2,0) -> 巨型双头恶魔 | D930: 烈焰魔链 | E930: 244
A931: 201033 | B931: =R[-101]C+1 -> 12 | C931: =VLOOKUP(RC[-1],工作表2!C[1]:C[2],2,0) -> 巨型双头恶魔 | D931: 烈焰魔指 | E931: 244
A932: 201035 | B932: =R[-101]C+1 -> 12 | C932: =VLOOKUP(RC[-1],工作表2!C[1]:C[2],2,0) -> 巨型双头恶魔 | D932: 烈焰头盔 | E932: 244
A933: 201036 | B933: =R[-101]C+1 -> 12 | C933: =VLOOKUP(RC[-1],工作表2!C[1]:C[2],2,0) -> 巨型双头恶魔 | D933: 烈焰护腕 | E933: 244
A934: 201037 | B934: =R[-101]C+1 -> 12 | C934: =VLOOKUP(RC[-1],工作表2!C[1]:C[2],2,0) -> 巨型双头恶魔 | D934: 烈焰腰带 | E934: 244
A935: 201039 | B935: =R[-101]C+1 -> 12 | C935: =VLOOKUP(RC[-1],工作表2!C[1]:C[2],2,0) -> 巨型双头恶魔 | D935: 烈焰魔靴 | E935: 244
A936: 202030 | B936: =R[-101]C+1 -> 12 | C936: =VLOOKUP(RC[-1],工作表2!C[1]:C[2],2,0) -> 巨型双头恶魔 | D936: 玄天 | E936: 244
A937: 202031 | B937: =R[-101]C+1 -> 12 | C937: =VLOOKUP(RC[-1],工作表2!C[1]:C[2],2,0) -> 巨型双头恶魔 | D937: 光芒道袍 | E937: 244
A938: 202032 | B938: =R[-101]C+1 -> 12 | C938: =VLOOKUP(RC[-1],工作表2!C[1]:C[2],2,0) -> 巨型双头恶魔 | D938: 光芒道链 | E938: 244
A939: 202033 | B939: =R[-101]C+1 -> 12 | C939: =VLOOKUP(RC[-1],工作表2!C[1]:C[2],2,0) -> 巨型双头恶魔 | D939: 光芒道戒 | E939: 244
A940: 202035 | B940: =R[-101]C+1 -> 12 | C940: =VLOOKUP(RC[-1],工作表2!C[1]:C[2],2,0) -> 巨型双头恶魔 | D940: 光芒头盔 | E940: 244
A941: 202036 | B941: =R[-101]C+1 -> 12 | C941: =VLOOKUP(RC[-1],工作表2!C[1]:C[2],2,0) -> 巨型双头恶魔 | D941: 光芒护腕 | E941: 244
A942: 202037 | B942: =R[-101]C+1 -> 12 | C942: =VLOOKUP(RC[-1],工作表2!C[1]:C[2],2,0) -> 巨型双头恶魔 | D942: 光芒腰带 | E942: 244
A943: 202039 | B943: =R[-101]C+1 -> 12 | C943: =VLOOKUP(RC[-1],工作表2!C[1]:C[2],2,0) -> 巨型双头恶魔 | D943: 光芒道靴 | E943: 244
A944: 200060 | B944: =R[-101]C+1 -> 12 | C944: =VLOOKUP(RC[-1],工作表2!C[1]:C[2],2,0) -> 巨型双头恶魔 | D944: 混沌 | E944: 83
A945: 200061 | B945: =R[-101]C+1 -> 12 | C945: =VLOOKUP(RC[-1],工作表2!C[1]:C[2],2,0) -> 巨型双头恶魔 | D945: 白虎衣服 | E945: 83
A946: 200062 | B946: =R[-101]C+1 -> 12 | C946: =VLOOKUP(RC[-1],工作表2!C[1]:C[2],2,0) -> 巨型双头恶魔 | D946: 白虎头盔 | E946: 83
A947: 200063 | B947: =R[-101]C+1 -> 12 | C947: =VLOOKUP(RC[-1],工作表2!C[1]:C[2],2,0) -> 巨型双头恶魔 | D947: 白虎项链 | E947: 83
A948: 200065 | B948: =R[-101]C+1 -> 12 | C948: =VLOOKUP(RC[-1],工作表2!C[1]:C[2],2,0) -> 巨型双头恶魔 | D948: 白虎手镯 | E948: 83
A949: 200066 | B949: =R[-101]C+1 -> 12 | C949: =VLOOKUP(RC[-1],工作表2!C[1]:C[2],2,0) -> 巨型双头恶魔 | D949: 白虎戒指 | E949: 83
A950: 200067 | B950: =R[-101]C+1 -> 12 | C950: =VLOOKUP(RC[-1],工作表2!C[1]:C[2],2,0) -> 巨型双头恶魔 | D950: 白虎腰带 | E950: 83
A951: 200069 | B951: =R[-101]C+1 -> 12 | C951: =VLOOKUP(RC[-1],工作表2!C[1]:C[2],2,0) -> 巨型双头恶魔 | D951: 白虎鞋子 | E951: 83
A952: 201060 | B952: =R[-101]C+1 -> 12 | C952: =VLOOKUP(RC[-1],工作表2!C[1]:C[2],2,0) -> 巨型双头恶魔 | D952: 狂龙 | E952: 83
A953: 201061 | B953: =R[-101]C+1 -> 12 | C953: =VLOOKUP(RC[-1],工作表2!C[1]:C[2],2,0) -> 巨型双头恶魔 | D953: 朱雀衣服 | E953: 83
A954: 201062 | B954: =R[-101]C+1 -> 12 | C954: =VLOOKUP(RC[-1],工作表2!C[1]:C[2],2,0) -> 巨型双头恶魔 | D954: 朱雀头盔 | E954: 83
A955: 201063 | B955: =R[-101]C+1 -> 12 | C955: =VLOOKUP(RC[-1],工作表2!C[1]:C[2],2,0) -> 巨型双头恶魔 | D955: 朱雀项链 | E955: 83
A956: 201065 | B956: =R[-101]C+1 -> 12 | C956: =VLOOKUP(RC[-1],工作表2!C[1]:C[2],2,0) -> 巨型双头恶魔 | D956: 朱雀手镯 | E956: 83
A957: 201066 | B957: =R[-101]C+1 -> 12 | C957: =VLOOKUP(RC[-1],工作表2!C[1]:C[2],2,0) -> 巨型双头恶魔 | D957: 朱雀戒指 | E957: 83
A958: 201067 | B958: =R[-101]C+1 -> 12 | C958: =VLOOKUP(RC[-1],工作表2!C[1]:C[2],2,0) -> 巨型双头恶魔 | D958: 朱雀腰带 | E958: 83
A959: 201069 | B959: =R[-101]C+1 -> 12 | C959: =VLOOKUP(RC[-1],工作表2!C[1]:C[2],2,0) -> 巨型双头恶魔 | D959: 朱雀鞋子 | E959: 83
A960: 202060 | B960: =R[-101]C+1 -> 12 | C960: =VLOOKUP(RC[-1],工作表2!C[1]:C[2],2,0) -> 巨型双头恶魔 | D960: 天蛇 | E960: 83
A961: 202061 | B961: =R[-101]C+1 -> 12 | C961: =VLOOKUP(RC[-1],工作表2!C[1]:C[2],2,0) -> 巨型双头恶魔 | D961: 青龙衣服 | E961: 83
A962: 202062 | B962: =R[-101]C+1 -> 12 | C962: =VLOOKUP(RC[-1],工作表2!C[1]:C[2],2,0) -> 巨型双头恶魔 | D962: 青龙头盔 | E962: 83
A963: 202063 | B963: =R[-101]C+1 -> 12 | C963: =VLOOKUP(RC[-1],工作表2!C[1]:C[2],2,0) -> 巨型双头恶魔 | D963: 青龙项链 | E963: 83
A964: 202065 | B964: =R[-101]C+1 -> 12 | C964: =VLOOKUP(RC[-1],工作表2!C[1]:C[2],2,0) -> 巨型双头恶魔 | D964: 青龙手镯 | E964: 83
A965: 202066 | B965: =R[-101]C+1 -> 12 | C965: =VLOOKUP(RC[-1],工作表2!C[1]:C[2],2,0) -> 巨型双头恶魔 | D965: 青龙戒指 | E965: 83
A966: 202067 | B966: =R[-101]C+1 -> 12 | C966: =VLOOKUP(RC[-1],工作表2!C[1]:C[2],2,0) -> 巨型双头恶魔 | D966: 青龙腰带 | E966: 83
A967: 202069 | B967: =R[-101]C+1 -> 12 | C967: =VLOOKUP(RC[-1],工作表2!C[1]:C[2],2,0) -> 巨型双头恶魔 | D967: 青龙鞋子 | E967: 83
A968: 200070 | B968: =R[-101]C+1 -> 12 | C968: =VLOOKUP(RC[-1],工作表2!C[1]:C[2],2,0) -> 巨型双头恶魔 | D968: 战刃 | E968: 246
A969: 200071 | B969: =R[-101]C+1 -> 12 | C969: =VLOOKUP(RC[-1],工作表2!C[1]:C[2],2,0) -> 巨型双头恶魔 | D969: 圣武衣服 | E969: 246
A970: 200072 | B970: =R[-101]C+1 -> 12 | C970: =VLOOKUP(RC[-1],工作表2!C[1]:C[2],2,0) -> 巨型双头恶魔 | D970: 圣武项链 | E970: 246
A971: 200073 | B971: =R[-101]C+1 -> 12 | C971: =VLOOKUP(RC[-1],工作表2!C[1]:C[2],2,0) -> 巨型双头恶魔 | D971: 圣武戒指 | E971: 246
A972: 200075 | B972: =R[-101]C+1 -> 12 | C972: =VLOOKUP(RC[-1],工作表2!C[1]:C[2],2,0) -> 巨型双头恶魔 | D972: 圣武头盔 | E972: 246
A973: 200076 | B973: =R[-101]C+1 -> 12 | C973: =VLOOKUP(RC[-1],工作表2!C[1]:C[2],2,0) -> 巨型双头恶魔 | D973: 圣武手镯 | E973: 246
A974: 200077 | B974: =R[-101]C+1 -> 12 | C974: =VLOOKUP(RC[-1],工作表2!C[1]:C[2],2,0) -> 巨型双头恶魔 | D974: 圣武腰带 | E974: 246
A975: 200079 | B975: =R[-101]C+1 -> 12 | C975: =VLOOKUP(RC[-1],工作表2!C[1]:C[2],2,0) -> 巨型双头恶魔 | D975: 圣武鞋子 | E975: 246
A976: 201070 | B976: =R[-101]C+1 -> 12 | C976: =VLOOKUP(RC[-1],工作表2!C[1]:C[2],2,0) -> 巨型双头恶魔 | D976: 轮回 | E976: 246
A977: 201071 | B977: =R[-101]C+1 -> 12 | C977: =VLOOKUP(RC[-1],工作表2!C[1]:C[2],2,0) -> 巨型双头恶魔 | D977: 圣魔衣服 | E977: 246
A978: 201072 | B978: =R[-101]C+1 -> 12 | C978: =VLOOKUP(RC[-1],工作表2!C[1]:C[2],2,0) -> 巨型双头恶魔 | D978: 圣魔项链 | E978: 246
A979: 201073 | B979: =R[-101]C+1 -> 12 | C979: =VLOOKUP(RC[-1],工作表2!C[1]:C[2],2,0) -> 巨型双头恶魔 | D979: 圣魔戒指 | E979: 246
A980: 201075 | B980: =R[-101]C+1 -> 12 | C980: =VLOOKUP(RC[-1],工作表2!C[1]:C[2],2,0) -> 巨型双头恶魔 | D980: 圣魔头盔 | E980: 246
A981: 201076 | B981: =R[-101]C+1 -> 12 | C981: =VLOOKUP(RC[-1],工作表2!C[1]:C[2],2,0) -> 巨型双头恶魔 | D981: 圣魔手镯 | E981: 246
A982: 201077 | B982: =R[-101]C+1 -> 12 | C982: =VLOOKUP(RC[-1],工作表2!C[1]:C[2],2,0) -> 巨型双头恶魔 | D982: 圣魔腰带 | E982: 246
A983: 201079 | B983: =R[-101]C+1 -> 12 | C983: =VLOOKUP(RC[-1],工作表2!C[1]:C[2],2,0) -> 巨型双头恶魔 | D983: 圣魔鞋子 | E983: 246
A984: 202070 | B984: =R[-101]C+1 -> 12 | C984: =VLOOKUP(RC[-1],工作表2!C[1]:C[2],2,0) -> 巨型双头恶魔 | D984: 太虚 | E984: 246
A985: 202071 | B985: =R[-101]C+1 -> 12 | C985: =VLOOKUP(RC[-1],工作表2!C[1]:C[2],2,0) -> 巨型双头恶魔 | D985: 圣魂衣服 | E985: 246
A986: 202072 | B986: =R[-101]C+1 -> 12 | C986: =VLOOKUP(RC[-1],工作表2!C[1]:C[2],2,0) -> 巨型双头恶魔 | D986: 圣魂项链 | E986: 246
A987: 202073 | B987: =R[-101]C+1 -> 12 | C987: =VLOOKUP(RC[-1],工作表2!C[1]:C[2],2,0) -> 巨型双头恶魔 | D987: 圣魂戒指 | E987: 246
A988: 202075 | B988: =R[-101]C+1 -> 12 | C988: =VLOOKUP(RC[-1],工作表2!C[1]:C[2],2,0) -> 巨型双头恶魔 | D988: 圣魂头盔 | E988: 246
A989: 202076 | B989: =R[-101]C+1 -> 12 | C989: =VLOOKUP(RC[-1],工作表2!C[1]:C[2],2,0) -> 巨型双头恶魔 | D989: 圣魂手镯 | E989: 246
A990: 202077 | B990: =R[-101]C+1 -> 12 | C990: =VLOOKUP(RC[-1],工作表2!C[1]:C[2],2,0) -> 巨型双头恶魔 | D990: 圣魂腰带 | E990: 246
A991: 202079 | B991: =R[-101]C+1 -> 12 | C991: =VLOOKUP(RC[-1],工作表2!C[1]:C[2],2,0) -> 巨型双头恶魔 | D991: 圣魂鞋子 | E991: 246
A992: 305000 | B992: =R[-101]C+1 -> 12 | C992: =VLOOKUP(RC[-1],工作表2!C[1]:C[2],2,0) -> 巨型双头恶魔 | D992: 麻痹戒指 | E992: 247
A993: 305001 | B993: =R[-101]C+1 -> 12 | C993: =VLOOKUP(RC[-1],工作表2!C[1]:C[2],2,0) -> 巨型双头恶魔 | D993: 护身戒指 | E993: 247
A994: 305002 | B994: =R[-101]C+1 -> 12 | C994: =VLOOKUP(RC[-1],工作表2!C[1]:C[2],2,0) -> 巨型双头恶魔 | D994: 复活戒指 | E994: 247
A995: 110163 | B995: =R[-101]C+1 -> 12 | C995: =VLOOKUP(RC[-1],工作表2!C[1]:C[2],2,0) -> 巨型双头恶魔 | D995: 上古神石 | E995: 248
A996: 305013 | B996: =R[-101]C+1 -> 12 | C996: =VLOOKUP(RC[-1],工作表2!C[1]:C[2],2,0) -> 巨型双头恶魔 | D996: 特面 | E996: 249
A997: 305014 | B997: =R[-101]C+1 -> 12 | C997: =VLOOKUP(RC[-1],工作表2!C[1]:C[2],2,0) -> 巨型双头恶魔 | D997: 特腿 | E997: 250
A998: 305015 | B998: =R[-101]C+1 -> 12 | C998: =VLOOKUP(RC[-1],工作表2!C[1]:C[2],2,0) -> 巨型双头恶魔 | D998: 特肩 | E998: 251
A999: 110024 | B999: =R[-101]C+1 -> 12 | C999: =VLOOKUP(RC[-1],工作表2!C[1]:C[2],2,0) -> 巨型双头恶魔 | D999: 狂风斩书 | E999: 36
A1000: 110025 | B1000: =R[-101]C+1 -> 12 | C1000: =VLOOKUP(RC[-1],工作表2!C[1]:C[2],2,0) -> 巨型双头恶魔 | D1000: 逐日剑法书 | E1000: 37
A1001: 110067 | B1001: =R[-101]C+1 -> 12 | C1001: =VLOOKUP(RC[-1],工作表2!C[1]:C[2],2,0) -> 巨型双头恶魔 | D1001: 诱惑之光书 | E1001: 38
A1002: 110040 | B1002: =R[-101]C+1 -> 12 | C1002: =VLOOKUP(RC[-1],工作表2!C[1]:C[2],2,0) -> 巨型双头恶魔 | D1002: 流星火雨书 | E1002: 39
A1003: 110031 | B1003: =R[-101]C+1 -> 12 | C1003: =VLOOKUP(RC[-1],工作表2!C[1]:C[2],2,0) -> 巨型双头恶魔 | D1003: 召唤神兽书 | E1003: 40
A1004: 110032 | B1004: =R[-101]C+1 -> 12 | C1004: =VLOOKUP(RC[-1],工作表2!C[1]:C[2],2,0) -> 巨型双头恶魔 | D1004: 嗜血术书 | E1004: 41
A1005: 305003 | B1005: =R[-101]C+1 -> 12 | C1005: =VLOOKUP(RC[-1],工作表2!C[1]:C[2],2,0) -> 巨型双头恶魔 | D1005: 怒斩 | E1005: 258
A1006: 305004 | B1006: =R[-101]C+1 -> 12 | C1006: =VLOOKUP(RC[-1],工作表2!C[1]:C[2],2,0) -> 巨型双头恶魔 | D1006: 龙牙 | E1006: 258
A1007: 305005 | B1007: =R[-101]C+1 -> 12 | C1007: =VLOOKUP(RC[-1],工作表2!C[1]:C[2],2,0) -> 巨型双头恶魔 | D1007: 龙纹 | E1007: 258
A1008: 305006 | B1008: =R[-101]C+1 -> 12 | C1008: =VLOOKUP(RC[-1],工作表2!C[1]:C[2],2,0) -> 巨型双头恶魔 | D1008: 至尊屠龙 | E1008: 259
A1009: 305007 | B1009: =R[-101]C+1 -> 12 | C1009: =VLOOKUP(RC[-1],工作表2!C[1]:C[2],2,0) -> 巨型双头恶魔 | D1009: 至尊噬魂 | E1009: 259
A1010: 305008 | B1010: =R[-101]C+1 -> 12 | C1010: =VLOOKUP(RC[-1],工作表2!C[1]:C[2],2,0) -> 巨型双头恶魔 | D1010: 至尊逍遥扇 | E1010: 259
A1011: 110140 | B1011: =R[-101]C+1 -> 12 | C1011: =VLOOKUP(RC[-1],工作表2!C[1]:C[2],2,0) -> 巨型双头恶魔 | D1011: 进阶丹 | E1011: 260
A1012: 110109 | B1012: =R[-101]C+1 -> 12 | C1012: =VLOOKUP(RC[-1],工作表2!C[1]:C[2],2,0) -> 巨型双头恶魔 | D1012: 金刚石 | E1012: 261
A1013: 110154 | B1013: =R[-101]C+1 -> 12 | C1013: =VLOOKUP(RC[-1],工作表2!C[1]:C[2],2,0) -> 巨型双头恶魔 | D1013: 2元宝 | E1013: 262
A1014: 110155 | B1014: =R[-101]C+1 -> 12 | C1014: =VLOOKUP(RC[-1],工作表2!C[1]:C[2],2,0) -> 巨型双头恶魔 | D1014: 5元宝 | E1014: 263
A1015: 110156 | B1015: =R[-101]C+1 -> 12 | C1015: =VLOOKUP(RC[-1],工作表2!C[1]:C[2],2,0) -> 巨型双头恶魔 | D1015: 10元宝 | E1015: 264
A1016: 110157 | B1016: =R[-101]C+1 -> 12 | C1016: =VLOOKUP(RC[-1],工作表2!C[1]:C[2],2,0) -> 巨型双头恶魔 | D1016: 20元宝 | E1016: 265
A1017: 110158 | B1017: =R[-101]C+1 -> 12 | C1017: =VLOOKUP(RC[-1],工作表2!C[1]:C[2],2,0) -> 巨型双头恶魔 | D1017: 50元宝 | E1017: 266
A1018: 110159 | B1018: =R[-101]C+1 -> 12 | C1018: =VLOOKUP(RC[-1],工作表2!C[1]:C[2],2,0) -> 巨型双头恶魔 | D1018: 100元宝 | E1018: 267
A1019: 110164 | B1019: =R[-101]C+1 -> 12 | C1019: =VLOOKUP(RC[-1],工作表2!C[1]:C[2],2,0) -> 巨型双头恶魔 | D1019: 150元宝 | E1019: 268
A1020: 110165 | B1020: =R[-101]C+1 -> 12 | C1020: =VLOOKUP(RC[-1],工作表2!C[1]:C[2],2,0) -> 巨型双头恶魔 | D1020: 200元宝 | E1020: 269
A1021: 200030 | B1021: =R[-101]C+1 -> 13 | C1021: =VLOOKUP(RC[-1],工作表2!C[1]:C[2],2,0) -> 海底BOSS1 | D1021: 开天 | E1021: 271
A1022: 200031 | B1022: =R[-101]C+1 -> 13 | C1022: =VLOOKUP(RC[-1],工作表2!C[1]:C[2],2,0) -> 海底BOSS1 | D1022: 雷霆战甲 | E1022: 271
A1023: 200032 | B1023: =R[-101]C+1 -> 13 | C1023: =VLOOKUP(RC[-1],工作表2!C[1]:C[2],2,0) -> 海底BOSS1 | D1023: 雷霆项链 | E1023: 271
A1024: 200033 | B1024: =R[-101]C+1 -> 13 | C1024: =VLOOKUP(RC[-1],工作表2!C[1]:C[2],2,0) -> 海底BOSS1 | D1024: 雷霆戒指 | E1024: 271
A1025: 200035 | B1025: =R[-101]C+1 -> 13 | C1025: =VLOOKUP(RC[-1],工作表2!C[1]:C[2],2,0) -> 海底BOSS1 | D1025: 雷霆头盔 | E1025: 271
A1026: 200036 | B1026: =R[-101]C+1 -> 13 | C1026: =VLOOKUP(RC[-1],工作表2!C[1]:C[2],2,0) -> 海底BOSS1 | D1026: 雷霆护腕 | E1026: 271
A1027: 200037 | B1027: =R[-101]C+1 -> 13 | C1027: =VLOOKUP(RC[-1],工作表2!C[1]:C[2],2,0) -> 海底BOSS1 | D1027: 雷霆腰带 | E1027: 271
A1028: 200039 | B1028: =R[-101]C+1 -> 13 | C1028: =VLOOKUP(RC[-1],工作表2!C[1]:C[2],2,0) -> 海底BOSS1 | D1028: 雷霆战靴 | E1028: 271
A1029: 201030 | B1029: =R[-101]C+1 -> 13 | C1029: =VLOOKUP(RC[-1],工作表2!C[1]:C[2],2,0) -> 海底BOSS1 | D1029: 震天 | E1029: 271
A1030: 201031 | B1030: =R[-101]C+1 -> 13 | C1030: =VLOOKUP(RC[-1],工作表2!C[1]:C[2],2,0) -> 海底BOSS1 | D1030: 烈焰法袍 | E1030: 271
A1031: 201032 | B1031: =R[-101]C+1 -> 13 | C1031: =VLOOKUP(RC[-1],工作表2!C[1]:C[2],2,0) -> 海底BOSS1 | D1031: 烈焰魔链 | E1031: 271
A1032: 201033 | B1032: =R[-101]C+1 -> 13 | C1032: =VLOOKUP(RC[-1],工作表2!C[1]:C[2],2,0) -> 海底BOSS1 | D1032: 烈焰魔指 | E1032: 271
A1033: 201035 | B1033: =R[-101]C+1 -> 13 | C1033: =VLOOKUP(RC[-1],工作表2!C[1]:C[2],2,0) -> 海底BOSS1 | D1033: 烈焰头盔 | E1033: 271
A1034: 201036 | B1034: =R[-101]C+1 -> 13 | C1034: =VLOOKUP(RC[-1],工作表2!C[1]:C[2],2,0) -> 海底BOSS1 | D1034: 烈焰护腕 | E1034: 271
A1035: 201037 | B1035: =R[-101]C+1 -> 13 | C1035: =VLOOKUP(RC[-1],工作表2!C[1]:C[2],2,0) -> 海底BOSS1 | D1035: 烈焰腰带 | E1035: 271
A1036: 201039 | B1036: =R[-101]C+1 -> 13 | C1036: =VLOOKUP(RC[-1],工作表2!C[1]:C[2],2,0) -> 海底BOSS1 | D1036: 烈焰魔靴 | E1036: 271
A1037: 202030 | B1037: =R[-101]C+1 -> 13 | C1037: =VLOOKUP(RC[-1],工作表2!C[1]:C[2],2,0) -> 海底BOSS1 | D1037: 玄天 | E1037: 271
A1038: 202031 | B1038: =R[-101]C+1 -> 13 | C1038: =VLOOKUP(RC[-1],工作表2!C[1]:C[2],2,0) -> 海底BOSS1 | D1038: 光芒道袍 | E1038: 271
A1039: 202032 | B1039: =R[-101]C+1 -> 13 | C1039: =VLOOKUP(RC[-1],工作表2!C[1]:C[2],2,0) -> 海底BOSS1 | D1039: 光芒道链 | E1039: 271
A1040: 202033 | B1040: =R[-101]C+1 -> 13 | C1040: =VLOOKUP(RC[-1],工作表2!C[1]:C[2],2,0) -> 海底BOSS1 | D1040: 光芒道戒 | E1040: 271
A1041: 202035 | B1041: =R[-101]C+1 -> 13 | C1041: =VLOOKUP(RC[-1],工作表2!C[1]:C[2],2,0) -> 海底BOSS1 | D1041: 光芒头盔 | E1041: 271
A1042: 202036 | B1042: =R[-101]C+1 -> 13 | C1042: =VLOOKUP(RC[-1],工作表2!C[1]:C[2],2,0) -> 海底BOSS1 | D1042: 光芒护腕 | E1042: 271
A1043: 202037 | B1043: =R[-101]C+1 -> 13 | C1043: =VLOOKUP(RC[-1],工作表2!C[1]:C[2],2,0) -> 海底BOSS1 | D1043: 光芒腰带 | E1043: 271
A1044: 202039 | B1044: =R[-101]C+1 -> 13 | C1044: =VLOOKUP(RC[-1],工作表2!C[1]:C[2],2,0) -> 海底BOSS1 | D1044: 光芒道靴 | E1044: 271
A1045: 200060 | B1045: =R[-101]C+1 -> 13 | C1045: =VLOOKUP(RC[-1],工作表2!C[1]:C[2],2,0) -> 海底BOSS1 | D1045: 混沌 | E1045: 272
A1046: 200061 | B1046: =R[-101]C+1 -> 13 | C1046: =VLOOKUP(RC[-1],工作表2!C[1]:C[2],2,0) -> 海底BOSS1 | D1046: 白虎衣服 | E1046: 272
A1047: 200062 | B1047: =R[-101]C+1 -> 13 | C1047: =VLOOKUP(RC[-1],工作表2!C[1]:C[2],2,0) -> 海底BOSS1 | D1047: 白虎头盔 | E1047: 272
A1048: 200063 | B1048: =R[-101]C+1 -> 13 | C1048: =VLOOKUP(RC[-1],工作表2!C[1]:C[2],2,0) -> 海底BOSS1 | D1048: 白虎项链 | E1048: 272
A1049: 200065 | B1049: =R[-101]C+1 -> 13 | C1049: =VLOOKUP(RC[-1],工作表2!C[1]:C[2],2,0) -> 海底BOSS1 | D1049: 白虎手镯 | E1049: 272
A1050: 200066 | B1050: =R[-101]C+1 -> 13 | C1050: =VLOOKUP(RC[-1],工作表2!C[1]:C[2],2,0) -> 海底BOSS1 | D1050: 白虎戒指 | E1050: 272
A1051: 200067 | B1051: =R[-101]C+1 -> 13 | C1051: =VLOOKUP(RC[-1],工作表2!C[1]:C[2],2,0) -> 海底BOSS1 | D1051: 白虎腰带 | E1051: 272
A1052: 200069 | B1052: =R[-101]C+1 -> 13 | C1052: =VLOOKUP(RC[-1],工作表2!C[1]:C[2],2,0) -> 海底BOSS1 | D1052: 白虎鞋子 | E1052: 272
A1053: 201060 | B1053: =R[-101]C+1 -> 13 | C1053: =VLOOKUP(RC[-1],工作表2!C[1]:C[2],2,0) -> 海底BOSS1 | D1053: 狂龙 | E1053: 272
A1054: 201061 | B1054: =R[-101]C+1 -> 13 | C1054: =VLOOKUP(RC[-1],工作表2!C[1]:C[2],2,0) -> 海底BOSS1 | D1054: 朱雀衣服 | E1054: 272
A1055: 201062 | B1055: =R[-101]C+1 -> 13 | C1055: =VLOOKUP(RC[-1],工作表2!C[1]:C[2],2,0) -> 海底BOSS1 | D1055: 朱雀头盔 | E1055: 272
A1056: 201063 | B1056: =R[-101]C+1 -> 13 | C1056: =VLOOKUP(RC[-1],工作表2!C[1]:C[2],2,0) -> 海底BOSS1 | D1056: 朱雀项链 | E1056: 272
A1057: 201065 | B1057: =R[-101]C+1 -> 13 | C1057: =VLOOKUP(RC[-1],工作表2!C[1]:C[2],2,0) -> 海底BOSS1 | D1057: 朱雀手镯 | E1057: 272
A1058: 201066 | B1058: =R[-101]C+1 -> 13 | C1058: =VLOOKUP(RC[-1],工作表2!C[1]:C[2],2,0) -> 海底BOSS1 | D1058: 朱雀戒指 | E1058: 272
A1059: 201067 | B1059: =R[-101]C+1 -> 13 | C1059: =VLOOKUP(RC[-1],工作表2!C[1]:C[2],2,0) -> 海底BOSS1 | D1059: 朱雀腰带 | E1059: 272
A1060: 201069 | B1060: =R[-101]C+1 -> 13 | C1060: =VLOOKUP(RC[-1],工作表2!C[1]:C[2],2,0) -> 海底BOSS1 | D1060: 朱雀鞋子 | E1060: 272
A1061: 202060 | B1061: =R[-101]C+1 -> 13 | C1061: =VLOOKUP(RC[-1],工作表2!C[1]:C[2],2,0) -> 海底BOSS1 | D1061: 天蛇 | E1061: 272
A1062: 202061 | B1062: =R[-101]C+1 -> 13 | C1062: =VLOOKUP(RC[-1],工作表2!C[1]:C[2],2,0) -> 海底BOSS1 | D1062: 青龙衣服 | E1062: 272
A1063: 202062 | B1063: =R[-101]C+1 -> 13 | C1063: =VLOOKUP(RC[-1],工作表2!C[1]:C[2],2,0) -> 海底BOSS1 | D1063: 青龙头盔 | E1063: 272
A1064: 202063 | B1064: =R[-101]C+1 -> 13 | C1064: =VLOOKUP(RC[-1],工作表2!C[1]:C[2],2,0) -> 海底BOSS1 | D1064: 青龙项链 | E1064: 272
A1065: 202065 | B1065: =R[-101]C+1 -> 13 | C1065: =VLOOKUP(RC[-1],工作表2!C[1]:C[2],2,0) -> 海底BOSS1 | D1065: 青龙手镯 | E1065: 272
A1066: 202066 | B1066: =R[-101]C+1 -> 13 | C1066: =VLOOKUP(RC[-1],工作表2!C[1]:C[2],2,0) -> 海底BOSS1 | D1066: 青龙戒指 | E1066: 272
A1067: 202067 | B1067: =R[-101]C+1 -> 13 | C1067: =VLOOKUP(RC[-1],工作表2!C[1]:C[2],2,0) -> 海底BOSS1 | D1067: 青龙腰带 | E1067: 272
A1068: 202069 | B1068: =R[-101]C+1 -> 13 | C1068: =VLOOKUP(RC[-1],工作表2!C[1]:C[2],2,0) -> 海底BOSS1 | D1068: 青龙鞋子 | E1068: 272
A1069: 200070 | B1069: =R[-101]C+1 -> 13 | C1069: =VLOOKUP(RC[-1],工作表2!C[1]:C[2],2,0) -> 海底BOSS1 | D1069: 战刃 | E1069: 273
A1070: 200071 | B1070: =R[-101]C+1 -> 13 | C1070: =VLOOKUP(RC[-1],工作表2!C[1]:C[2],2,0) -> 海底BOSS1 | D1070: 圣武衣服 | E1070: 273
A1071: 200072 | B1071: =R[-101]C+1 -> 13 | C1071: =VLOOKUP(RC[-1],工作表2!C[1]:C[2],2,0) -> 海底BOSS1 | D1071: 圣武项链 | E1071: 273
A1072: 200073 | B1072: =R[-101]C+1 -> 13 | C1072: =VLOOKUP(RC[-1],工作表2!C[1]:C[2],2,0) -> 海底BOSS1 | D1072: 圣武戒指 | E1072: 273
A1073: 200075 | B1073: =R[-101]C+1 -> 13 | C1073: =VLOOKUP(RC[-1],工作表2!C[1]:C[2],2,0) -> 海底BOSS1 | D1073: 圣武头盔 | E1073: 273
A1074: 200076 | B1074: =R[-101]C+1 -> 13 | C1074: =VLOOKUP(RC[-1],工作表2!C[1]:C[2],2,0) -> 海底BOSS1 | D1074: 圣武手镯 | E1074: 273
A1075: 200077 | B1075: =R[-101]C+1 -> 13 | C1075: =VLOOKUP(RC[-1],工作表2!C[1]:C[2],2,0) -> 海底BOSS1 | D1075: 圣武腰带 | E1075: 273
A1076: 200079 | B1076: =R[-101]C+1 -> 13 | C1076: =VLOOKUP(RC[-1],工作表2!C[1]:C[2],2,0) -> 海底BOSS1 | D1076: 圣武鞋子 | E1076: 273
A1077: 201070 | B1077: =R[-101]C+1 -> 13 | C1077: =VLOOKUP(RC[-1],工作表2!C[1]:C[2],2,0) -> 海底BOSS1 | D1077: 轮回 | E1077: 273
A1078: 201071 | B1078: =R[-101]C+1 -> 13 | C1078: =VLOOKUP(RC[-1],工作表2!C[1]:C[2],2,0) -> 海底BOSS1 | D1078: 圣魔衣服 | E1078: 273
A1079: 201072 | B1079: =R[-101]C+1 -> 13 | C1079: =VLOOKUP(RC[-1],工作表2!C[1]:C[2],2,0) -> 海底BOSS1 | D1079: 圣魔项链 | E1079: 273
A1080: 201073 | B1080: =R[-101]C+1 -> 13 | C1080: =VLOOKUP(RC[-1],工作表2!C[1]:C[2],2,0) -> 海底BOSS1 | D1080: 圣魔戒指 | E1080: 273
A1081: 201075 | B1081: =R[-101]C+1 -> 13 | C1081: =VLOOKUP(RC[-1],工作表2!C[1]:C[2],2,0) -> 海底BOSS1 | D1081: 圣魔头盔 | E1081: 273
A1082: 201076 | B1082: =R[-101]C+1 -> 13 | C1082: =VLOOKUP(RC[-1],工作表2!C[1]:C[2],2,0) -> 海底BOSS1 | D1082: 圣魔手镯 | E1082: 273
A1083: 201077 | B1083: =R[-101]C+1 -> 13 | C1083: =VLOOKUP(RC[-1],工作表2!C[1]:C[2],2,0) -> 海底BOSS1 | D1083: 圣魔腰带 | E1083: 273
A1084: 201079 | B1084: =R[-101]C+1 -> 13 | C1084: =VLOOKUP(RC[-1],工作表2!C[1]:C[2],2,0) -> 海底BOSS1 | D1084: 圣魔鞋子 | E1084: 273
A1085: 202070 | B1085: =R[-101]C+1 -> 13 | C1085: =VLOOKUP(RC[-1],工作表2!C[1]:C[2],2,0) -> 海底BOSS1 | D1085: 太虚 | E1085: 273
A1086: 202071 | B1086: =R[-101]C+1 -> 13 | C1086: =VLOOKUP(RC[-1],工作表2!C[1]:C[2],2,0) -> 海底BOSS1 | D1086: 圣魂衣服 | E1086: 273
A1087: 202072 | B1087: =R[-101]C+1 -> 13 | C1087: =VLOOKUP(RC[-1],工作表2!C[1]:C[2],2,0) -> 海底BOSS1 | D1087: 圣魂项链 | E1087: 273
A1088: 202073 | B1088: =R[-101]C+1 -> 13 | C1088: =VLOOKUP(RC[-1],工作表2!C[1]:C[2],2,0) -> 海底BOSS1 | D1088: 圣魂戒指 | E1088: 273
A1089: 202075 | B1089: =R[-101]C+1 -> 13 | C1089: =VLOOKUP(RC[-1],工作表2!C[1]:C[2],2,0) -> 海底BOSS1 | D1089: 圣魂头盔 | E1089: 273
A1090: 202076 | B1090: =R[-101]C+1 -> 13 | C1090: =VLOOKUP(RC[-1],工作表2!C[1]:C[2],2,0) -> 海底BOSS1 | D1090: 圣魂手镯 | E1090: 273
A1091: 202077 | B1091: =R[-101]C+1 -> 13 | C1091: =VLOOKUP(RC[-1],工作表2!C[1]:C[2],2,0) -> 海底BOSS1 | D1091: 圣魂腰带 | E1091: 273
A1092: 202079 | B1092: =R[-101]C+1 -> 13 | C1092: =VLOOKUP(RC[-1],工作表2!C[1]:C[2],2,0) -> 海底BOSS1 | D1092: 圣魂鞋子 | E1092: 273
A1093: 305000 | B1093: =R[-101]C+1 -> 13 | C1093: =VLOOKUP(RC[-1],工作表2!C[1]:C[2],2,0) -> 海底BOSS1 | D1093: 麻痹戒指 | E1093: 166
A1094: 305001 | B1094: =R[-101]C+1 -> 13 | C1094: =VLOOKUP(RC[-1],工作表2!C[1]:C[2],2,0) -> 海底BOSS1 | D1094: 护身戒指 | E1094: 166
A1095: 305002 | B1095: =R[-101]C+1 -> 13 | C1095: =VLOOKUP(RC[-1],工作表2!C[1]:C[2],2,0) -> 海底BOSS1 | D1095: 复活戒指 | E1095: 166
A1096: 110163 | B1096: =R[-101]C+1 -> 13 | C1096: =VLOOKUP(RC[-1],工作表2!C[1]:C[2],2,0) -> 海底BOSS1 | D1096: 上古神石 | E1096: 275
A1097: 305013 | B1097: =R[-101]C+1 -> 13 | C1097: =VLOOKUP(RC[-1],工作表2!C[1]:C[2],2,0) -> 海底BOSS1 | D1097: 特面 | E1097: 276
A1098: 305014 | B1098: =R[-101]C+1 -> 13 | C1098: =VLOOKUP(RC[-1],工作表2!C[1]:C[2],2,0) -> 海底BOSS1 | D1098: 特腿 | E1098: 277
A1099: 305015 | B1099: =R[-101]C+1 -> 13 | C1099: =VLOOKUP(RC[-1],工作表2!C[1]:C[2],2,0) -> 海底BOSS1 | D1099: 特肩 | E1099: 278
A1100: 110024 | B1100: =R[-101]C+1 -> 13 | C1100: =VLOOKUP(RC[-1],工作表2!C[1]:C[2],2,0) -> 海底BOSS1 | D1100: 狂风斩书 | E1100: 36
A1101: 110025 | B1101: =R[-101]C+1 -> 13 | C1101: =VLOOKUP(RC[-1],工作表2!C[1]:C[2],2,0) -> 海底BOSS1 | D1101: 逐日剑法书 | E1101: 37
A1102: 110067 | B1102: =R[-101]C+1 -> 13 | C1102: =VLOOKUP(RC[-1],工作表2!C[1]:C[2],2,0) -> 海底BOSS1 | D1102: 诱惑之光书 | E1102: 38
A1103: 110040 | B1103: =R[-101]C+1 -> 13 | C1103: =VLOOKUP(RC[-1],工作表2!C[1]:C[2],2,0) -> 海底BOSS1 | D1103: 流星火雨书 | E1103: 39
A1104: 110031 | B1104: =R[-101]C+1 -> 13 | C1104: =VLOOKUP(RC[-1],工作表2!C[1]:C[2],2,0) -> 海底BOSS1 | D1104: 召唤神兽书 | E1104: 40
A1105: 110032 | B1105: =R[-101]C+1 -> 13 | C1105: =VLOOKUP(RC[-1],工作表2!C[1]:C[2],2,0) -> 海底BOSS1 | D1105: 嗜血术书 | E1105: 41
A1106: 305003 | B1106: =R[-101]C+1 -> 13 | C1106: =VLOOKUP(RC[-1],工作表2!C[1]:C[2],2,0) -> 海底BOSS1 | D1106: 怒斩 | E1106: 285
A1107: 305004 | B1107: =R[-101]C+1 -> 13 | C1107: =VLOOKUP(RC[-1],工作表2!C[1]:C[2],2,0) -> 海底BOSS1 | D1107: 龙牙 | E1107: 285
A1108: 305005 | B1108: =R[-101]C+1 -> 13 | C1108: =VLOOKUP(RC[-1],工作表2!C[1]:C[2],2,0) -> 海底BOSS1 | D1108: 龙纹 | E1108: 285
A1109: 305006 | B1109: =R[-101]C+1 -> 13 | C1109: =VLOOKUP(RC[-1],工作表2!C[1]:C[2],2,0) -> 海底BOSS1 | D1109: 至尊屠龙 | E1109: 286
A1110: 305007 | B1110: =R[-101]C+1 -> 13 | C1110: =VLOOKUP(RC[-1],工作表2!C[1]:C[2],2,0) -> 海底BOSS1 | D1110: 至尊噬魂 | E1110: 286
A1111: 305008 | B1111: =R[-101]C+1 -> 13 | C1111: =VLOOKUP(RC[-1],工作表2!C[1]:C[2],2,0) -> 海底BOSS1 | D1111: 至尊逍遥扇 | E1111: 286
A1112: 110140 | B1112: =R[-101]C+1 -> 13 | C1112: =VLOOKUP(RC[-1],工作表2!C[1]:C[2],2,0) -> 海底BOSS1 | D1112: 进阶丹 | E1112: 287
A1113: 110109 | B1113: =R[-101]C+1 -> 13 | C1113: =VLOOKUP(RC[-1],工作表2!C[1]:C[2],2,0) -> 海底BOSS1 | D1113: 金刚石 | E1113: 288
A1114: 110154 | B1114: =R[-101]C+1 -> 13 | C1114: =VLOOKUP(RC[-1],工作表2!C[1]:C[2],2,0) -> 海底BOSS1 | D1114: 2元宝 | E1114: 289
A1115: 110155 | B1115: =R[-101]C+1 -> 13 | C1115: =VLOOKUP(RC[-1],工作表2!C[1]:C[2],2,0) -> 海底BOSS1 | D1115: 5元宝 | E1115: 290
A1116: 110156 | B1116: =R[-101]C+1 -> 13 | C1116: =VLOOKUP(RC[-1],工作表2!C[1]:C[2],2,0) -> 海底BOSS1 | D1116: 10元宝 | E1116: 291
A1117: 110157 | B1117: =R[-101]C+1 -> 13 | C1117: =VLOOKUP(RC[-1],工作表2!C[1]:C[2],2,0) -> 海底BOSS1 | D1117: 20元宝 | E1117: 292
A1118: 110158 | B1118: =R[-101]C+1 -> 13 | C1118: =VLOOKUP(RC[-1],工作表2!C[1]:C[2],2,0) -> 海底BOSS1 | D1118: 50元宝 | E1118: 293
A1119: 110159 | B1119: =R[-101]C+1 -> 13 | C1119: =VLOOKUP(RC[-1],工作表2!C[1]:C[2],2,0) -> 海底BOSS1 | D1119: 100元宝 | E1119: 294
A1120: 110164 | B1120: =R[-101]C+1 -> 13 | C1120: =VLOOKUP(RC[-1],工作表2!C[1]:C[2],2,0) -> 海底BOSS1 | D1120: 150元宝 | E1120: 295
A1121: 110165 | B1121: =R[-101]C+1 -> 13 | C1121: =VLOOKUP(RC[-1],工作表2!C[1]:C[2],2,0) -> 海底BOSS1 | D1121: 200元宝 | E1121: 296
A1122: 200030 | B1122: =R[-101]C+1 -> 14 | C1122: =VLOOKUP(RC[-1],工作表2!C[1]:C[2],2,0) -> 海底BOSS2 | D1122: 开天 | E1122: 298
A1123: 200031 | B1123: =R[-101]C+1 -> 14 | C1123: =VLOOKUP(RC[-1],工作表2!C[1]:C[2],2,0) -> 海底BOSS2 | D1123: 雷霆战甲 | E1123: 298
A1124: 200032 | B1124: =R[-101]C+1 -> 14 | C1124: =VLOOKUP(RC[-1],工作表2!C[1]:C[2],2,0) -> 海底BOSS2 | D1124: 雷霆项链 | E1124: 298
A1125: 200033 | B1125: =R[-101]C+1 -> 14 | C1125: =VLOOKUP(RC[-1],工作表2!C[1]:C[2],2,0) -> 海底BOSS2 | D1125: 雷霆戒指 | E1125: 298
A1126: 200035 | B1126: =R[-101]C+1 -> 14 | C1126: =VLOOKUP(RC[-1],工作表2!C[1]:C[2],2,0) -> 海底BOSS2 | D1126: 雷霆头盔 | E1126: 298
A1127: 200036 | B1127: =R[-101]C+1 -> 14 | C1127: =VLOOKUP(RC[-1],工作表2!C[1]:C[2],2,0) -> 海底BOSS2 | D1127: 雷霆护腕 | E1127: 298
A1128: 200037 | B1128: =R[-101]C+1 -> 14 | C1128: =VLOOKUP(RC[-1],工作表2!C[1]:C[2],2,0) -> 海底BOSS2 | D1128: 雷霆腰带 | E1128: 298
A1129: 200039 | B1129: =R[-101]C+1 -> 14 | C1129: =VLOOKUP(RC[-1],工作表2!C[1]:C[2],2,0) -> 海底BOSS2 | D1129: 雷霆战靴 | E1129: 298
A1130: 201030 | B1130: =R[-101]C+1 -> 14 | C1130: =VLOOKUP(RC[-1],工作表2!C[1]:C[2],2,0) -> 海底BOSS2 | D1130: 震天 | E1130: 298
A1131: 201031 | B1131: =R[-101]C+1 -> 14 | C1131: =VLOOKUP(RC[-1],工作表2!C[1]:C[2],2,0) -> 海底BOSS2 | D1131: 烈焰法袍 | E1131: 298
A1132: 201032 | B1132: =R[-101]C+1 -> 14 | C1132: =VLOOKUP(RC[-1],工作表2!C[1]:C[2],2,0) -> 海底BOSS2 | D1132: 烈焰魔链 | E1132: 298
A1133: 201033 | B1133: =R[-101]C+1 -> 14 | C1133: =VLOOKUP(RC[-1],工作表2!C[1]:C[2],2,0) -> 海底BOSS2 | D1133: 烈焰魔指 | E1133: 298
A1134: 201035 | B1134: =R[-101]C+1 -> 14 | C1134: =VLOOKUP(RC[-1],工作表2!C[1]:C[2],2,0) -> 海底BOSS2 | D1134: 烈焰头盔 | E1134: 298
A1135: 201036 | B1135: =R[-101]C+1 -> 14 | C1135: =VLOOKUP(RC[-1],工作表2!C[1]:C[2],2,0) -> 海底BOSS2 | D1135: 烈焰护腕 | E1135: 298
A1136: 201037 | B1136: =R[-101]C+1 -> 14 | C1136: =VLOOKUP(RC[-1],工作表2!C[1]:C[2],2,0) -> 海底BOSS2 | D1136: 烈焰腰带 | E1136: 298
A1137: 201039 | B1137: =R[-101]C+1 -> 14 | C1137: =VLOOKUP(RC[-1],工作表2!C[1]:C[2],2,0) -> 海底BOSS2 | D1137: 烈焰魔靴 | E1137: 298
A1138: 202030 | B1138: =R[-101]C+1 -> 14 | C1138: =VLOOKUP(RC[-1],工作表2!C[1]:C[2],2,0) -> 海底BOSS2 | D1138: 玄天 | E1138: 298
A1139: 202031 | B1139: =R[-101]C+1 -> 14 | C1139: =VLOOKUP(RC[-1],工作表2!C[1]:C[2],2,0) -> 海底BOSS2 | D1139: 光芒道袍 | E1139: 298
A1140: 202032 | B1140: =R[-101]C+1 -> 14 | C1140: =VLOOKUP(RC[-1],工作表2!C[1]:C[2],2,0) -> 海底BOSS2 | D1140: 光芒道链 | E1140: 298
A1141: 202033 | B1141: =R[-101]C+1 -> 14 | C1141: =VLOOKUP(RC[-1],工作表2!C[1]:C[2],2,0) -> 海底BOSS2 | D1141: 光芒道戒 | E1141: 298
A1142: 202035 | B1142: =R[-101]C+1 -> 14 | C1142: =VLOOKUP(RC[-1],工作表2!C[1]:C[2],2,0) -> 海底BOSS2 | D1142: 光芒头盔 | E1142: 298
A1143: 202036 | B1143: =R[-101]C+1 -> 14 | C1143: =VLOOKUP(RC[-1],工作表2!C[1]:C[2],2,0) -> 海底BOSS2 | D1143: 光芒护腕 | E1143: 298
A1144: 202037 | B1144: =R[-101]C+1 -> 14 | C1144: =VLOOKUP(RC[-1],工作表2!C[1]:C[2],2,0) -> 海底BOSS2 | D1144: 光芒腰带 | E1144: 298
A1145: 202039 | B1145: =R[-101]C+1 -> 14 | C1145: =VLOOKUP(RC[-1],工作表2!C[1]:C[2],2,0) -> 海底BOSS2 | D1145: 光芒道靴 | E1145: 298
A1146: 200060 | B1146: =R[-101]C+1 -> 14 | C1146: =VLOOKUP(RC[-1],工作表2!C[1]:C[2],2,0) -> 海底BOSS2 | D1146: 混沌 | E1146: 299
A1147: 200061 | B1147: =R[-101]C+1 -> 14 | C1147: =VLOOKUP(RC[-1],工作表2!C[1]:C[2],2,0) -> 海底BOSS2 | D1147: 白虎衣服 | E1147: 299
A1148: 200062 | B1148: =R[-101]C+1 -> 14 | C1148: =VLOOKUP(RC[-1],工作表2!C[1]:C[2],2,0) -> 海底BOSS2 | D1148: 白虎头盔 | E1148: 299
A1149: 200063 | B1149: =R[-101]C+1 -> 14 | C1149: =VLOOKUP(RC[-1],工作表2!C[1]:C[2],2,0) -> 海底BOSS2 | D1149: 白虎项链 | E1149: 299
A1150: 200065 | B1150: =R[-101]C+1 -> 14 | C1150: =VLOOKUP(RC[-1],工作表2!C[1]:C[2],2,0) -> 海底BOSS2 | D1150: 白虎手镯 | E1150: 299
A1151: 200066 | B1151: =R[-101]C+1 -> 14 | C1151: =VLOOKUP(RC[-1],工作表2!C[1]:C[2],2,0) -> 海底BOSS2 | D1151: 白虎戒指 | E1151: 299
A1152: 200067 | B1152: =R[-101]C+1 -> 14 | C1152: =VLOOKUP(RC[-1],工作表2!C[1]:C[2],2,0) -> 海底BOSS2 | D1152: 白虎腰带 | E1152: 299
A1153: 200069 | B1153: =R[-101]C+1 -> 14 | C1153: =VLOOKUP(RC[-1],工作表2!C[1]:C[2],2,0) -> 海底BOSS2 | D1153: 白虎鞋子 | E1153: 299
A1154: 201060 | B1154: =R[-101]C+1 -> 14 | C1154: =VLOOKUP(RC[-1],工作表2!C[1]:C[2],2,0) -> 海底BOSS2 | D1154: 狂龙 | E1154: 299
A1155: 201061 | B1155: =R[-101]C+1 -> 14 | C1155: =VLOOKUP(RC[-1],工作表2!C[1]:C[2],2,0) -> 海底BOSS2 | D1155: 朱雀衣服 | E1155: 299
A1156: 201062 | B1156: =R[-101]C+1 -> 14 | C1156: =VLOOKUP(RC[-1],工作表2!C[1]:C[2],2,0) -> 海底BOSS2 | D1156: 朱雀头盔 | E1156: 299
A1157: 201063 | B1157: =R[-101]C+1 -> 14 | C1157: =VLOOKUP(RC[-1],工作表2!C[1]:C[2],2,0) -> 海底BOSS2 | D1157: 朱雀项链 | E1157: 299
A1158: 201065 | B1158: =R[-101]C+1 -> 14 | C1158: =VLOOKUP(RC[-1],工作表2!C[1]:C[2],2,0) -> 海底BOSS2 | D1158: 朱雀手镯 | E1158: 299
A1159: 201066 | B1159: =R[-101]C+1 -> 14 | C1159: =VLOOKUP(RC[-1],工作表2!C[1]:C[2],2,0) -> 海底BOSS2 | D1159: 朱雀戒指 | E1159: 299
A1160: 201067 | B1160: =R[-101]C+1 -> 14 | C1160: =VLOOKUP(RC[-1],工作表2!C[1]:C[2],2,0) -> 海底BOSS2 | D1160: 朱雀腰带 | E1160: 299
A1161: 201069 | B1161: =R[-101]C+1 -> 14 | C1161: =VLOOKUP(RC[-1],工作表2!C[1]:C[2],2,0) -> 海底BOSS2 | D1161: 朱雀鞋子 | E1161: 299
A1162: 202060 | B1162: =R[-101]C+1 -> 14 | C1162: =VLOOKUP(RC[-1],工作表2!C[1]:C[2],2,0) -> 海底BOSS2 | D1162: 天蛇 | E1162: 299
A1163: 202061 | B1163: =R[-101]C+1 -> 14 | C1163: =VLOOKUP(RC[-1],工作表2!C[1]:C[2],2,0) -> 海底BOSS2 | D1163: 青龙衣服 | E1163: 299
A1164: 202062 | B1164: =R[-101]C+1 -> 14 | C1164: =VLOOKUP(RC[-1],工作表2!C[1]:C[2],2,0) -> 海底BOSS2 | D1164: 青龙头盔 | E1164: 299
A1165: 202063 | B1165: =R[-101]C+1 -> 14 | C1165: =VLOOKUP(RC[-1],工作表2!C[1]:C[2],2,0) -> 海底BOSS2 | D1165: 青龙项链 | E1165: 299
A1166: 202065 | B1166: =R[-101]C+1 -> 14 | C1166: =VLOOKUP(RC[-1],工作表2!C[1]:C[2],2,0) -> 海底BOSS2 | D1166: 青龙手镯 | E1166: 299
A1167: 202066 | B1167: =R[-101]C+1 -> 14 | C1167: =VLOOKUP(RC[-1],工作表2!C[1]:C[2],2,0) -> 海底BOSS2 | D1167: 青龙戒指 | E1167: 299
A1168: 202067 | B1168: =R[-101]C+1 -> 14 | C1168: =VLOOKUP(RC[-1],工作表2!C[1]:C[2],2,0) -> 海底BOSS2 | D1168: 青龙腰带 | E1168: 299
A1169: 202069 | B1169: =R[-101]C+1 -> 14 | C1169: =VLOOKUP(RC[-1],工作表2!C[1]:C[2],2,0) -> 海底BOSS2 | D1169: 青龙鞋子 | E1169: 299
A1170: 200070 | B1170: =R[-101]C+1 -> 14 | C1170: =VLOOKUP(RC[-1],工作表2!C[1]:C[2],2,0) -> 海底BOSS2 | D1170: 战刃 | E1170: 273
A1171: 200071 | B1171: =R[-101]C+1 -> 14 | C1171: =VLOOKUP(RC[-1],工作表2!C[1]:C[2],2,0) -> 海底BOSS2 | D1171: 圣武衣服 | E1171: 273
A1172: 200072 | B1172: =R[-101]C+1 -> 14 | C1172: =VLOOKUP(RC[-1],工作表2!C[1]:C[2],2,0) -> 海底BOSS2 | D1172: 圣武项链 | E1172: 273
A1173: 200073 | B1173: =R[-101]C+1 -> 14 | C1173: =VLOOKUP(RC[-1],工作表2!C[1]:C[2],2,0) -> 海底BOSS2 | D1173: 圣武戒指 | E1173: 273
A1174: 200075 | B1174: =R[-101]C+1 -> 14 | C1174: =VLOOKUP(RC[-1],工作表2!C[1]:C[2],2,0) -> 海底BOSS2 | D1174: 圣武头盔 | E1174: 273
A1175: 200076 | B1175: =R[-101]C+1 -> 14 | C1175: =VLOOKUP(RC[-1],工作表2!C[1]:C[2],2,0) -> 海底BOSS2 | D1175: 圣武手镯 | E1175: 273
A1176: 200077 | B1176: =R[-101]C+1 -> 14 | C1176: =VLOOKUP(RC[-1],工作表2!C[1]:C[2],2,0) -> 海底BOSS2 | D1176: 圣武腰带 | E1176: 273
A1177: 200079 | B1177: =R[-101]C+1 -> 14 | C1177: =VLOOKUP(RC[-1],工作表2!C[1]:C[2],2,0) -> 海底BOSS2 | D1177: 圣武鞋子 | E1177: 273
A1178: 201070 | B1178: =R[-101]C+1 -> 14 | C1178: =VLOOKUP(RC[-1],工作表2!C[1]:C[2],2,0) -> 海底BOSS2 | D1178: 轮回 | E1178: 273
A1179: 201071 | B1179: =R[-101]C+1 -> 14 | C1179: =VLOOKUP(RC[-1],工作表2!C[1]:C[2],2,0) -> 海底BOSS2 | D1179: 圣魔衣服 | E1179: 273
A1180: 201072 | B1180: =R[-101]C+1 -> 14 | C1180: =VLOOKUP(RC[-1],工作表2!C[1]:C[2],2,0) -> 海底BOSS2 | D1180: 圣魔项链 | E1180: 273
A1181: 201073 | B1181: =R[-101]C+1 -> 14 | C1181: =VLOOKUP(RC[-1],工作表2!C[1]:C[2],2,0) -> 海底BOSS2 | D1181: 圣魔戒指 | E1181: 273
A1182: 201075 | B1182: =R[-101]C+1 -> 14 | C1182: =VLOOKUP(RC[-1],工作表2!C[1]:C[2],2,0) -> 海底BOSS2 | D1182: 圣魔头盔 | E1182: 273
A1183: 201076 | B1183: =R[-101]C+1 -> 14 | C1183: =VLOOKUP(RC[-1],工作表2!C[1]:C[2],2,0) -> 海底BOSS2 | D1183: 圣魔手镯 | E1183: 273
A1184: 201077 | B1184: =R[-101]C+1 -> 14 | C1184: =VLOOKUP(RC[-1],工作表2!C[1]:C[2],2,0) -> 海底BOSS2 | D1184: 圣魔腰带 | E1184: 273
A1185: 201079 | B1185: =R[-101]C+1 -> 14 | C1185: =VLOOKUP(RC[-1],工作表2!C[1]:C[2],2,0) -> 海底BOSS2 | D1185: 圣魔鞋子 | E1185: 273
A1186: 202070 | B1186: =R[-101]C+1 -> 14 | C1186: =VLOOKUP(RC[-1],工作表2!C[1]:C[2],2,0) -> 海底BOSS2 | D1186: 太虚 | E1186: 273
A1187: 202071 | B1187: =R[-101]C+1 -> 14 | C1187: =VLOOKUP(RC[-1],工作表2!C[1]:C[2],2,0) -> 海底BOSS2 | D1187: 圣魂衣服 | E1187: 273
A1188: 202072 | B1188: =R[-101]C+1 -> 14 | C1188: =VLOOKUP(RC[-1],工作表2!C[1]:C[2],2,0) -> 海底BOSS2 | D1188: 圣魂项链 | E1188: 273
A1189: 202073 | B1189: =R[-101]C+1 -> 14 | C1189: =VLOOKUP(RC[-1],工作表2!C[1]:C[2],2,0) -> 海底BOSS2 | D1189: 圣魂戒指 | E1189: 273
A1190: 202075 | B1190: =R[-101]C+1 -> 14 | C1190: =VLOOKUP(RC[-1],工作表2!C[1]:C[2],2,0) -> 海底BOSS2 | D1190: 圣魂头盔 | E1190: 273
A1191: 202076 | B1191: =R[-101]C+1 -> 14 | C1191: =VLOOKUP(RC[-1],工作表2!C[1]:C[2],2,0) -> 海底BOSS2 | D1191: 圣魂手镯 | E1191: 273
A1192: 202077 | B1192: =R[-101]C+1 -> 14 | C1192: =VLOOKUP(RC[-1],工作表2!C[1]:C[2],2,0) -> 海底BOSS2 | D1192: 圣魂腰带 | E1192: 273
A1193: 202079 | B1193: =R[-101]C+1 -> 14 | C1193: =VLOOKUP(RC[-1],工作表2!C[1]:C[2],2,0) -> 海底BOSS2 | D1193: 圣魂鞋子 | E1193: 273
A1194: 305000 | B1194: =R[-101]C+1 -> 14 | C1194: =VLOOKUP(RC[-1],工作表2!C[1]:C[2],2,0) -> 海底BOSS2 | D1194: 麻痹戒指 | E1194: 166
A1195: 305001 | B1195: =R[-101]C+1 -> 14 | C1195: =VLOOKUP(RC[-1],工作表2!C[1]:C[2],2,0) -> 海底BOSS2 | D1195: 护身戒指 | E1195: 166
A1196: 305002 | B1196: =R[-101]C+1 -> 14 | C1196: =VLOOKUP(RC[-1],工作表2!C[1]:C[2],2,0) -> 海底BOSS2 | D1196: 复活戒指 | E1196: 166
A1197: 110163 | B1197: =R[-101]C+1 -> 14 | C1197: =VLOOKUP(RC[-1],工作表2!C[1]:C[2],2,0) -> 海底BOSS2 | D1197: 上古神石 | E1197: 302
A1198: 305013 | B1198: =R[-101]C+1 -> 14 | C1198: =VLOOKUP(RC[-1],工作表2!C[1]:C[2],2,0) -> 海底BOSS2 | D1198: 特面 | E1198: 303
A1199: 305014 | B1199: =R[-101]C+1 -> 14 | C1199: =VLOOKUP(RC[-1],工作表2!C[1]:C[2],2,0) -> 海底BOSS2 | D1199: 特腿 | E1199: 304
A1200: 305015 | B1200: =R[-101]C+1 -> 14 | C1200: =VLOOKUP(RC[-1],工作表2!C[1]:C[2],2,0) -> 海底BOSS2 | D1200: 特肩 | E1200: 305
A1201: 110024 | B1201: =R[-101]C+1 -> 14 | C1201: =VLOOKUP(RC[-1],工作表2!C[1]:C[2],2,0) -> 海底BOSS2 | D1201: 狂风斩书 | E1201: 36
A1202: 110025 | B1202: =R[-101]C+1 -> 14 | C1202: =VLOOKUP(RC[-1],工作表2!C[1]:C[2],2,0) -> 海底BOSS2 | D1202: 逐日剑法书 | E1202: 37
A1203: 110067 | B1203: =R[-101]C+1 -> 14 | C1203: =VLOOKUP(RC[-1],工作表2!C[1]:C[2],2,0) -> 海底BOSS2 | D1203: 诱惑之光书 | E1203: 38
A1204: 110040 | B1204: =R[-101]C+1 -> 14 | C1204: =VLOOKUP(RC[-1],工作表2!C[1]:C[2],2,0) -> 海底BOSS2 | D1204: 流星火雨书 | E1204: 39
A1205: 110031 | B1205: =R[-101]C+1 -> 14 | C1205: =VLOOKUP(RC[-1],工作表2!C[1]:C[2],2,0) -> 海底BOSS2 | D1205: 召唤神兽书 | E1205: 40
A1206: 110032 | B1206: =R[-101]C+1 -> 14 | C1206: =VLOOKUP(RC[-1],工作表2!C[1]:C[2],2,0) -> 海底BOSS2 | D1206: 嗜血术书 | E1206: 41
A1207: 305003 | B1207: =R[-101]C+1 -> 14 | C1207: =VLOOKUP(RC[-1],工作表2!C[1]:C[2],2,0) -> 海底BOSS2 | D1207: 怒斩 | E1207: 312
A1208: 305004 | B1208: =R[-101]C+1 -> 14 | C1208: =VLOOKUP(RC[-1],工作表2!C[1]:C[2],2,0) -> 海底BOSS2 | D1208: 龙牙 | E1208: 312
A1209: 305005 | B1209: =R[-101]C+1 -> 14 | C1209: =VLOOKUP(RC[-1],工作表2!C[1]:C[2],2,0) -> 海底BOSS2 | D1209: 龙纹 | E1209: 312
A1210: 305006 | B1210: =R[-101]C+1 -> 14 | C1210: =VLOOKUP(RC[-1],工作表2!C[1]:C[2],2,0) -> 海底BOSS2 | D1210: 至尊屠龙 | E1210: 313
A1211: 305007 | B1211: =R[-101]C+1 -> 14 | C1211: =VLOOKUP(RC[-1],工作表2!C[1]:C[2],2,0) -> 海底BOSS2 | D1211: 至尊噬魂 | E1211: 313
A1212: 305008 | B1212: =R[-101]C+1 -> 14 | C1212: =VLOOKUP(RC[-1],工作表2!C[1]:C[2],2,0) -> 海底BOSS2 | D1212: 至尊逍遥扇 | E1212: 313
A1213: 110140 | B1213: =R[-101]C+1 -> 14 | C1213: =VLOOKUP(RC[-1],工作表2!C[1]:C[2],2,0) -> 海底BOSS2 | D1213: 进阶丹 | E1213: 314
A1214: 110109 | B1214: =R[-101]C+1 -> 14 | C1214: =VLOOKUP(RC[-1],工作表2!C[1]:C[2],2,0) -> 海底BOSS2 | D1214: 金刚石 | E1214: 315
A1215: 110154 | B1215: =R[-101]C+1 -> 14 | C1215: =VLOOKUP(RC[-1],工作表2!C[1]:C[2],2,0) -> 海底BOSS2 | D1215: 2元宝 | E1215: 316
A1216: 110155 | B1216: =R[-101]C+1 -> 14 | C1216: =VLOOKUP(RC[-1],工作表2!C[1]:C[2],2,0) -> 海底BOSS2 | D1216: 5元宝 | E1216: 317
A1217: 110156 | B1217: =R[-101]C+1 -> 14 | C1217: =VLOOKUP(RC[-1],工作表2!C[1]:C[2],2,0) -> 海底BOSS2 | D1217: 10元宝 | E1217: 318
A1218: 110157 | B1218: =R[-101]C+1 -> 14 | C1218: =VLOOKUP(RC[-1],工作表2!C[1]:C[2],2,0) -> 海底BOSS2 | D1218: 20元宝 | E1218: 319
A1219: 110158 | B1219: =R[-101]C+1 -> 14 | C1219: =VLOOKUP(RC[-1],工作表2!C[1]:C[2],2,0) -> 海底BOSS2 | D1219: 50元宝 | E1219: 320
A1220: 110159 | B1220: =R[-101]C+1 -> 14 | C1220: =VLOOKUP(RC[-1],工作表2!C[1]:C[2],2,0) -> 海底BOSS2 | D1220: 100元宝 | E1220: 321
A1221: 110164 | B1221: =R[-101]C+1 -> 14 | C1221: =VLOOKUP(RC[-1],工作表2!C[1]:C[2],2,0) -> 海底BOSS2 | D1221: 150元宝 | E1221: 322
A1222: 110165 | B1222: =R[-101]C+1 -> 14 | C1222: =VLOOKUP(RC[-1],工作表2!C[1]:C[2],2,0) -> 海底BOSS2 | D1222: 200元宝 | E1222: 323
A1223: 200030 | B1223: =R[-101]C+1 -> 15 | C1223: =VLOOKUP(RC[-1],工作表2!C[1]:C[2],2,0) -> 牛魔BOSS1 | D1223: 开天 | E1223: 325
A1224: 200031 | B1224: =R[-101]C+1 -> 15 | C1224: =VLOOKUP(RC[-1],工作表2!C[1]:C[2],2,0) -> 牛魔BOSS1 | D1224: 雷霆战甲 | E1224: 325
A1225: 200032 | B1225: =R[-101]C+1 -> 15 | C1225: =VLOOKUP(RC[-1],工作表2!C[1]:C[2],2,0) -> 牛魔BOSS1 | D1225: 雷霆项链 | E1225: 325
A1226: 200033 | B1226: =R[-101]C+1 -> 15 | C1226: =VLOOKUP(RC[-1],工作表2!C[1]:C[2],2,0) -> 牛魔BOSS1 | D1226: 雷霆戒指 | E1226: 325
A1227: 200035 | B1227: =R[-101]C+1 -> 15 | C1227: =VLOOKUP(RC[-1],工作表2!C[1]:C[2],2,0) -> 牛魔BOSS1 | D1227: 雷霆头盔 | E1227: 325
A1228: 200036 | B1228: =R[-101]C+1 -> 15 | C1228: =VLOOKUP(RC[-1],工作表2!C[1]:C[2],2,0) -> 牛魔BOSS1 | D1228: 雷霆护腕 | E1228: 325
A1229: 200037 | B1229: =R[-101]C+1 -> 15 | C1229: =VLOOKUP(RC[-1],工作表2!C[1]:C[2],2,0) -> 牛魔BOSS1 | D1229: 雷霆腰带 | E1229: 325
A1230: 200039 | B1230: =R[-101]C+1 -> 15 | C1230: =VLOOKUP(RC[-1],工作表2!C[1]:C[2],2,0) -> 牛魔BOSS1 | D1230: 雷霆战靴 | E1230: 325
A1231: 201030 | B1231: =R[-101]C+1 -> 15 | C1231: =VLOOKUP(RC[-1],工作表2!C[1]:C[2],2,0) -> 牛魔BOSS1 | D1231: 震天 | E1231: 325
A1232: 201031 | B1232: =R[-101]C+1 -> 15 | C1232: =VLOOKUP(RC[-1],工作表2!C[1]:C[2],2,0) -> 牛魔BOSS1 | D1232: 烈焰法袍 | E1232: 325
A1233: 201032 | B1233: =R[-101]C+1 -> 15 | C1233: =VLOOKUP(RC[-1],工作表2!C[1]:C[2],2,0) -> 牛魔BOSS1 | D1233: 烈焰魔链 | E1233: 325
A1234: 201033 | B1234: =R[-101]C+1 -> 15 | C1234: =VLOOKUP(RC[-1],工作表2!C[1]:C[2],2,0) -> 牛魔BOSS1 | D1234: 烈焰魔指 | E1234: 325
A1235: 201035 | B1235: =R[-101]C+1 -> 15 | C1235: =VLOOKUP(RC[-1],工作表2!C[1]:C[2],2,0) -> 牛魔BOSS1 | D1235: 烈焰头盔 | E1235: 325
A1236: 201036 | B1236: =R[-101]C+1 -> 15 | C1236: =VLOOKUP(RC[-1],工作表2!C[1]:C[2],2,0) -> 牛魔BOSS1 | D1236: 烈焰护腕 | E1236: 325
A1237: 201037 | B1237: =R[-101]C+1 -> 15 | C1237: =VLOOKUP(RC[-1],工作表2!C[1]:C[2],2,0) -> 牛魔BOSS1 | D1237: 烈焰腰带 | E1237: 325
A1238: 201039 | B1238: =R[-101]C+1 -> 15 | C1238: =VLOOKUP(RC[-1],工作表2!C[1]:C[2],2,0) -> 牛魔BOSS1 | D1238: 烈焰魔靴 | E1238: 325
A1239: 202030 | B1239: =R[-101]C+1 -> 15 | C1239: =VLOOKUP(RC[-1],工作表2!C[1]:C[2],2,0) -> 牛魔BOSS1 | D1239: 玄天 | E1239: 325
A1240: 202031 | B1240: =R[-101]C+1 -> 15 | C1240: =VLOOKUP(RC[-1],工作表2!C[1]:C[2],2,0) -> 牛魔BOSS1 | D1240: 光芒道袍 | E1240: 325
A1241: 202032 | B1241: =R[-101]C+1 -> 15 | C1241: =VLOOKUP(RC[-1],工作表2!C[1]:C[2],2,0) -> 牛魔BOSS1 | D1241: 光芒道链 | E1241: 325
A1242: 202033 | B1242: =R[-101]C+1 -> 15 | C1242: =VLOOKUP(RC[-1],工作表2!C[1]:C[2],2,0) -> 牛魔BOSS1 | D1242: 光芒道戒 | E1242: 325
A1243: 202035 | B1243: =R[-101]C+1 -> 15 | C1243: =VLOOKUP(RC[-1],工作表2!C[1]:C[2],2,0) -> 牛魔BOSS1 | D1243: 光芒头盔 | E1243: 325
A1244: 202036 | B1244: =R[-101]C+1 -> 15 | C1244: =VLOOKUP(RC[-1],工作表2!C[1]:C[2],2,0) -> 牛魔BOSS1 | D1244: 光芒护腕 | E1244: 325
A1245: 202037 | B1245: =R[-101]C+1 -> 15 | C1245: =VLOOKUP(RC[-1],工作表2!C[1]:C[2],2,0) -> 牛魔BOSS1 | D1245: 光芒腰带 | E1245: 325
A1246: 202039 | B1246: =R[-101]C+1 -> 15 | C1246: =VLOOKUP(RC[-1],工作表2!C[1]:C[2],2,0) -> 牛魔BOSS1 | D1246: 光芒道靴 | E1246: 325
A1247: 200060 | B1247: =R[-101]C+1 -> 15 | C1247: =VLOOKUP(RC[-1],工作表2!C[1]:C[2],2,0) -> 牛魔BOSS1 | D1247: 混沌 | E1247: 326
A1248: 200061 | B1248: =R[-101]C+1 -> 15 | C1248: =VLOOKUP(RC[-1],工作表2!C[1]:C[2],2,0) -> 牛魔BOSS1 | D1248: 白虎衣服 | E1248: 326
A1249: 200062 | B1249: =R[-101]C+1 -> 15 | C1249: =VLOOKUP(RC[-1],工作表2!C[1]:C[2],2,0) -> 牛魔BOSS1 | D1249: 白虎头盔 | E1249: 326
A1250: 200063 | B1250: =R[-101]C+1 -> 15 | C1250: =VLOOKUP(RC[-1],工作表2!C[1]:C[2],2,0) -> 牛魔BOSS1 | D1250: 白虎项链 | E1250: 326
A1251: 200065 | B1251: =R[-101]C+1 -> 15 | C1251: =VLOOKUP(RC[-1],工作表2!C[1]:C[2],2,0) -> 牛魔BOSS1 | D1251: 白虎手镯 | E1251: 326
A1252: 200066 | B1252: =R[-101]C+1 -> 15 | C1252: =VLOOKUP(RC[-1],工作表2!C[1]:C[2],2,0) -> 牛魔BOSS1 | D1252: 白虎戒指 | E1252: 326
A1253: 200067 | B1253: =R[-101]C+1 -> 15 | C1253: =VLOOKUP(RC[-1],工作表2!C[1]:C[2],2,0) -> 牛魔BOSS1 | D1253: 白虎腰带 | E1253: 326
A1254: 200069 | B1254: =R[-101]C+1 -> 15 | C1254: =VLOOKUP(RC[-1],工作表2!C[1]:C[2],2,0) -> 牛魔BOSS1 | D1254: 白虎鞋子 | E1254: 326
A1255: 201060 | B1255: =R[-101]C+1 -> 15 | C1255: =VLOOKUP(RC[-1],工作表2!C[1]:C[2],2,0) -> 牛魔BOSS1 | D1255: 狂龙 | E1255: 326
A1256: 201061 | B1256: =R[-101]C+1 -> 15 | C1256: =VLOOKUP(RC[-1],工作表2!C[1]:C[2],2,0) -> 牛魔BOSS1 | D1256: 朱雀衣服 | E1256: 326
A1257: 201062 | B1257: =R[-101]C+1 -> 15 | C1257: =VLOOKUP(RC[-1],工作表2!C[1]:C[2],2,0) -> 牛魔BOSS1 | D1257: 朱雀头盔 | E1257: 326
A1258: 201063 | B1258: =R[-101]C+1 -> 15 | C1258: =VLOOKUP(RC[-1],工作表2!C[1]:C[2],2,0) -> 牛魔BOSS1 | D1258: 朱雀项链 | E1258: 326
A1259: 201065 | B1259: =R[-101]C+1 -> 15 | C1259: =VLOOKUP(RC[-1],工作表2!C[1]:C[2],2,0) -> 牛魔BOSS1 | D1259: 朱雀手镯 | E1259: 326
A1260: 201066 | B1260: =R[-101]C+1 -> 15 | C1260: =VLOOKUP(RC[-1],工作表2!C[1]:C[2],2,0) -> 牛魔BOSS1 | D1260: 朱雀戒指 | E1260: 326
A1261: 201067 | B1261: =R[-101]C+1 -> 15 | C1261: =VLOOKUP(RC[-1],工作表2!C[1]:C[2],2,0) -> 牛魔BOSS1 | D1261: 朱雀腰带 | E1261: 326
A1262: 201069 | B1262: =R[-101]C+1 -> 15 | C1262: =VLOOKUP(RC[-1],工作表2!C[1]:C[2],2,0) -> 牛魔BOSS1 | D1262: 朱雀鞋子 | E1262: 326
A1263: 202060 | B1263: =R[-101]C+1 -> 15 | C1263: =VLOOKUP(RC[-1],工作表2!C[1]:C[2],2,0) -> 牛魔BOSS1 | D1263: 天蛇 | E1263: 326
A1264: 202061 | B1264: =R[-101]C+1 -> 15 | C1264: =VLOOKUP(RC[-1],工作表2!C[1]:C[2],2,0) -> 牛魔BOSS1 | D1264: 青龙衣服 | E1264: 326
A1265: 202062 | B1265: =R[-101]C+1 -> 15 | C1265: =VLOOKUP(RC[-1],工作表2!C[1]:C[2],2,0) -> 牛魔BOSS1 | D1265: 青龙头盔 | E1265: 326
A1266: 202063 | B1266: =R[-101]C+1 -> 15 | C1266: =VLOOKUP(RC[-1],工作表2!C[1]:C[2],2,0) -> 牛魔BOSS1 | D1266: 青龙项链 | E1266: 326
A1267: 202065 | B1267: =R[-101]C+1 -> 15 | C1267: =VLOOKUP(RC[-1],工作表2!C[1]:C[2],2,0) -> 牛魔BOSS1 | D1267: 青龙手镯 | E1267: 326
A1268: 202066 | B1268: =R[-101]C+1 -> 15 | C1268: =VLOOKUP(RC[-1],工作表2!C[1]:C[2],2,0) -> 牛魔BOSS1 | D1268: 青龙戒指 | E1268: 326
A1269: 202067 | B1269: =R[-101]C+1 -> 15 | C1269: =VLOOKUP(RC[-1],工作表2!C[1]:C[2],2,0) -> 牛魔BOSS1 | D1269: 青龙腰带 | E1269: 326
A1270: 202069 | B1270: =R[-101]C+1 -> 15 | C1270: =VLOOKUP(RC[-1],工作表2!C[1]:C[2],2,0) -> 牛魔BOSS1 | D1270: 青龙鞋子 | E1270: 326
A1271: 200070 | B1271: =R[-101]C+1 -> 15 | C1271: =VLOOKUP(RC[-1],工作表2!C[1]:C[2],2,0) -> 牛魔BOSS1 | D1271: 战刃 | E1271: 273
A1272: 200071 | B1272: =R[-101]C+1 -> 15 | C1272: =VLOOKUP(RC[-1],工作表2!C[1]:C[2],2,0) -> 牛魔BOSS1 | D1272: 圣武衣服 | E1272: 273
A1273: 200072 | B1273: =R[-101]C+1 -> 15 | C1273: =VLOOKUP(RC[-1],工作表2!C[1]:C[2],2,0) -> 牛魔BOSS1 | D1273: 圣武项链 | E1273: 273
A1274: 200073 | B1274: =R[-101]C+1 -> 15 | C1274: =VLOOKUP(RC[-1],工作表2!C[1]:C[2],2,0) -> 牛魔BOSS1 | D1274: 圣武戒指 | E1274: 273
A1275: 200075 | B1275: =R[-101]C+1 -> 15 | C1275: =VLOOKUP(RC[-1],工作表2!C[1]:C[2],2,0) -> 牛魔BOSS1 | D1275: 圣武头盔 | E1275: 273
A1276: 200076 | B1276: =R[-101]C+1 -> 15 | C1276: =VLOOKUP(RC[-1],工作表2!C[1]:C[2],2,0) -> 牛魔BOSS1 | D1276: 圣武手镯 | E1276: 273
A1277: 200077 | B1277: =R[-101]C+1 -> 15 | C1277: =VLOOKUP(RC[-1],工作表2!C[1]:C[2],2,0) -> 牛魔BOSS1 | D1277: 圣武腰带 | E1277: 273
A1278: 200079 | B1278: =R[-101]C+1 -> 15 | C1278: =VLOOKUP(RC[-1],工作表2!C[1]:C[2],2,0) -> 牛魔BOSS1 | D1278: 圣武鞋子 | E1278: 273
A1279: 201070 | B1279: =R[-101]C+1 -> 15 | C1279: =VLOOKUP(RC[-1],工作表2!C[1]:C[2],2,0) -> 牛魔BOSS1 | D1279: 轮回 | E1279: 273
A1280: 201071 | B1280: =R[-101]C+1 -> 15 | C1280: =VLOOKUP(RC[-1],工作表2!C[1]:C[2],2,0) -> 牛魔BOSS1 | D1280: 圣魔衣服 | E1280: 273
A1281: 201072 | B1281: =R[-101]C+1 -> 15 | C1281: =VLOOKUP(RC[-1],工作表2!C[1]:C[2],2,0) -> 牛魔BOSS1 | D1281: 圣魔项链 | E1281: 273
A1282: 201073 | B1282: =R[-101]C+1 -> 15 | C1282: =VLOOKUP(RC[-1],工作表2!C[1]:C[2],2,0) -> 牛魔BOSS1 | D1282: 圣魔戒指 | E1282: 273
A1283: 201075 | B1283: =R[-101]C+1 -> 15 | C1283: =VLOOKUP(RC[-1],工作表2!C[1]:C[2],2,0) -> 牛魔BOSS1 | D1283: 圣魔头盔 | E1283: 273
A1284: 201076 | B1284: =R[-101]C+1 -> 15 | C1284: =VLOOKUP(RC[-1],工作表2!C[1]:C[2],2,0) -> 牛魔BOSS1 | D1284: 圣魔手镯 | E1284: 273
A1285: 201077 | B1285: =R[-101]C+1 -> 15 | C1285: =VLOOKUP(RC[-1],工作表2!C[1]:C[2],2,0) -> 牛魔BOSS1 | D1285: 圣魔腰带 | E1285: 273
A1286: 201079 | B1286: =R[-101]C+1 -> 15 | C1286: =VLOOKUP(RC[-1],工作表2!C[1]:C[2],2,0) -> 牛魔BOSS1 | D1286: 圣魔鞋子 | E1286: 273
A1287: 202070 | B1287: =R[-101]C+1 -> 15 | C1287: =VLOOKUP(RC[-1],工作表2!C[1]:C[2],2,0) -> 牛魔BOSS1 | D1287: 太虚 | E1287: 273
A1288: 202071 | B1288: =R[-101]C+1 -> 15 | C1288: =VLOOKUP(RC[-1],工作表2!C[1]:C[2],2,0) -> 牛魔BOSS1 | D1288: 圣魂衣服 | E1288: 273
A1289: 202072 | B1289: =R[-101]C+1 -> 15 | C1289: =VLOOKUP(RC[-1],工作表2!C[1]:C[2],2,0) -> 牛魔BOSS1 | D1289: 圣魂项链 | E1289: 273
A1290: 202073 | B1290: =R[-101]C+1 -> 15 | C1290: =VLOOKUP(RC[-1],工作表2!C[1]:C[2],2,0) -> 牛魔BOSS1 | D1290: 圣魂戒指 | E1290: 273
A1291: 202075 | B1291: =R[-101]C+1 -> 15 | C1291: =VLOOKUP(RC[-1],工作表2!C[1]:C[2],2,0) -> 牛魔BOSS1 | D1291: 圣魂头盔 | E1291: 273
A1292: 202076 | B1292: =R[-101]C+1 -> 15 | C1292: =VLOOKUP(RC[-1],工作表2!C[1]:C[2],2,0) -> 牛魔BOSS1 | D1292: 圣魂手镯 | E1292: 273
A1293: 202077 | B1293: =R[-101]C+1 -> 15 | C1293: =VLOOKUP(RC[-1],工作表2!C[1]:C[2],2,0) -> 牛魔BOSS1 | D1293: 圣魂腰带 | E1293: 273
A1294: 202079 | B1294: =R[-101]C+1 -> 15 | C1294: =VLOOKUP(RC[-1],工作表2!C[1]:C[2],2,0) -> 牛魔BOSS1 | D1294: 圣魂鞋子 | E1294: 273
A1295: 305000 | B1295: =R[-101]C+1 -> 15 | C1295: =VLOOKUP(RC[-1],工作表2!C[1]:C[2],2,0) -> 牛魔BOSS1 | D1295: 麻痹戒指 | E1295: 166
A1296: 305001 | B1296: =R[-101]C+1 -> 15 | C1296: =VLOOKUP(RC[-1],工作表2!C[1]:C[2],2,0) -> 牛魔BOSS1 | D1296: 护身戒指 | E1296: 166
A1297: 305002 | B1297: =R[-101]C+1 -> 15 | C1297: =VLOOKUP(RC[-1],工作表2!C[1]:C[2],2,0) -> 牛魔BOSS1 | D1297: 复活戒指 | E1297: 166
A1298: 110163 | B1298: =R[-101]C+1 -> 15 | C1298: =VLOOKUP(RC[-1],工作表2!C[1]:C[2],2,0) -> 牛魔BOSS1 | D1298: 上古神石 | E1298: 329
A1299: 305013 | B1299: =R[-101]C+1 -> 15 | C1299: =VLOOKUP(RC[-1],工作表2!C[1]:C[2],2,0) -> 牛魔BOSS1 | D1299: 特面 | E1299: 330
A1300: 305014 | B1300: =R[-101]C+1 -> 15 | C1300: =VLOOKUP(RC[-1],工作表2!C[1]:C[2],2,0) -> 牛魔BOSS1 | D1300: 特腿 | E1300: 331
A1301: 305015 | B1301: =R[-101]C+1 -> 15 | C1301: =VLOOKUP(RC[-1],工作表2!C[1]:C[2],2,0) -> 牛魔BOSS1 | D1301: 特肩 | E1301: 332
A1302: 110024 | B1302: =R[-101]C+1 -> 15 | C1302: =VLOOKUP(RC[-1],工作表2!C[1]:C[2],2,0) -> 牛魔BOSS1 | D1302: 狂风斩书 | E1302: 36
A1303: 110025 | B1303: =R[-101]C+1 -> 15 | C1303: =VLOOKUP(RC[-1],工作表2!C[1]:C[2],2,0) -> 牛魔BOSS1 | D1303: 逐日剑法书 | E1303: 37
A1304: 110067 | B1304: =R[-101]C+1 -> 15 | C1304: =VLOOKUP(RC[-1],工作表2!C[1]:C[2],2,0) -> 牛魔BOSS1 | D1304: 诱惑之光书 | E1304: 38
A1305: 110040 | B1305: =R[-101]C+1 -> 15 | C1305: =VLOOKUP(RC[-1],工作表2!C[1]:C[2],2,0) -> 牛魔BOSS1 | D1305: 流星火雨书 | E1305: 39
A1306: 110031 | B1306: =R[-101]C+1 -> 15 | C1306: =VLOOKUP(RC[-1],工作表2!C[1]:C[2],2,0) -> 牛魔BOSS1 | D1306: 召唤神兽书 | E1306: 40
A1307: 110032 | B1307: =R[-101]C+1 -> 15 | C1307: =VLOOKUP(RC[-1],工作表2!C[1]:C[2],2,0) -> 牛魔BOSS1 | D1307: 嗜血术书 | E1307: 41
A1308: 305003 | B1308: =R[-101]C+1 -> 15 | C1308: =VLOOKUP(RC[-1],工作表2!C[1]:C[2],2,0) -> 牛魔BOSS1 | D1308: 怒斩 | E1308: 339
A1309: 305004 | B1309: =R[-101]C+1 -> 15 | C1309: =VLOOKUP(RC[-1],工作表2!C[1]:C[2],2,0) -> 牛魔BOSS1 | D1309: 龙牙 | E1309: 339
A1310: 305005 | B1310: =R[-101]C+1 -> 15 | C1310: =VLOOKUP(RC[-1],工作表2!C[1]:C[2],2,0) -> 牛魔BOSS1 | D1310: 龙纹 | E1310: 339
A1311: 305006 | B1311: =R[-101]C+1 -> 15 | C1311: =VLOOKUP(RC[-1],工作表2!C[1]:C[2],2,0) -> 牛魔BOSS1 | D1311: 至尊屠龙 | E1311: 340
A1312: 305007 | B1312: =R[-101]C+1 -> 15 | C1312: =VLOOKUP(RC[-1],工作表2!C[1]:C[2],2,0) -> 牛魔BOSS1 | D1312: 至尊噬魂 | E1312: 340
A1313: 305008 | B1313: =R[-101]C+1 -> 15 | C1313: =VLOOKUP(RC[-1],工作表2!C[1]:C[2],2,0) -> 牛魔BOSS1 | D1313: 至尊逍遥扇 | E1313: 340
A1314: 110140 | B1314: =R[-101]C+1 -> 15 | C1314: =VLOOKUP(RC[-1],工作表2!C[1]:C[2],2,0) -> 牛魔BOSS1 | D1314: 进阶丹 | E1314: 341
A1315: 110109 | B1315: =R[-101]C+1 -> 15 | C1315: =VLOOKUP(RC[-1],工作表2!C[1]:C[2],2,0) -> 牛魔BOSS1 | D1315: 金刚石 | E1315: 342
A1316: 110154 | B1316: =R[-101]C+1 -> 15 | C1316: =VLOOKUP(RC[-1],工作表2!C[1]:C[2],2,0) -> 牛魔BOSS1 | D1316: 2元宝 | E1316: 343
A1317: 110155 | B1317: =R[-101]C+1 -> 15 | C1317: =VLOOKUP(RC[-1],工作表2!C[1]:C[2],2,0) -> 牛魔BOSS1 | D1317: 5元宝 | E1317: 344
A1318: 110156 | B1318: =R[-101]C+1 -> 15 | C1318: =VLOOKUP(RC[-1],工作表2!C[1]:C[2],2,0) -> 牛魔BOSS1 | D1318: 10元宝 | E1318: 345
A1319: 110157 | B1319: =R[-101]C+1 -> 15 | C1319: =VLOOKUP(RC[-1],工作表2!C[1]:C[2],2,0) -> 牛魔BOSS1 | D1319: 20元宝 | E1319: 346
A1320: 110158 | B1320: =R[-101]C+1 -> 15 | C1320: =VLOOKUP(RC[-1],工作表2!C[1]:C[2],2,0) -> 牛魔BOSS1 | D1320: 50元宝 | E1320: 347
A1321: 110159 | B1321: =R[-101]C+1 -> 15 | C1321: =VLOOKUP(RC[-1],工作表2!C[1]:C[2],2,0) -> 牛魔BOSS1 | D1321: 100元宝 | E1321: 348
A1322: 110164 | B1322: =R[-101]C+1 -> 15 | C1322: =VLOOKUP(RC[-1],工作表2!C[1]:C[2],2,0) -> 牛魔BOSS1 | D1322: 150元宝 | E1322: 349
A1323: 110165 | B1323: =R[-101]C+1 -> 15 | C1323: =VLOOKUP(RC[-1],工作表2!C[1]:C[2],2,0) -> 牛魔BOSS1 | D1323: 200元宝 | E1323: 350
A1324: 200030 | B1324: =R[-101]C+1 -> 16 | C1324: =VLOOKUP(RC[-1],工作表2!C[1]:C[2],2,0) -> 牛魔BOSS2 | D1324: 开天 | E1324: 352
A1325: 200031 | B1325: =R[-101]C+1 -> 16 | C1325: =VLOOKUP(RC[-1],工作表2!C[1]:C[2],2,0) -> 牛魔BOSS2 | D1325: 雷霆战甲 | E1325: 352
A1326: 200032 | B1326: =R[-101]C+1 -> 16 | C1326: =VLOOKUP(RC[-1],工作表2!C[1]:C[2],2,0) -> 牛魔BOSS2 | D1326: 雷霆项链 | E1326: 352
A1327: 200033 | B1327: =R[-101]C+1 -> 16 | C1327: =VLOOKUP(RC[-1],工作表2!C[1]:C[2],2,0) -> 牛魔BOSS2 | D1327: 雷霆戒指 | E1327: 352
A1328: 200035 | B1328: =R[-101]C+1 -> 16 | C1328: =VLOOKUP(RC[-1],工作表2!C[1]:C[2],2,0) -> 牛魔BOSS2 | D1328: 雷霆头盔 | E1328: 352
A1329: 200036 | B1329: =R[-101]C+1 -> 16 | C1329: =VLOOKUP(RC[-1],工作表2!C[1]:C[2],2,0) -> 牛魔BOSS2 | D1329: 雷霆护腕 | E1329: 352
A1330: 200037 | B1330: =R[-101]C+1 -> 16 | C1330: =VLOOKUP(RC[-1],工作表2!C[1]:C[2],2,0) -> 牛魔BOSS2 | D1330: 雷霆腰带 | E1330: 352
A1331: 200039 | B1331: =R[-101]C+1 -> 16 | C1331: =VLOOKUP(RC[-1],工作表2!C[1]:C[2],2,0) -> 牛魔BOSS2 | D1331: 雷霆战靴 | E1331: 352
A1332: 201030 | B1332: =R[-101]C+1 -> 16 | C1332: =VLOOKUP(RC[-1],工作表2!C[1]:C[2],2,0) -> 牛魔BOSS2 | D1332: 震天 | E1332: 352
A1333: 201031 | B1333: =R[-101]C+1 -> 16 | C1333: =VLOOKUP(RC[-1],工作表2!C[1]:C[2],2,0) -> 牛魔BOSS2 | D1333: 烈焰法袍 | E1333: 352
A1334: 201032 | B1334: =R[-101]C+1 -> 16 | C1334: =VLOOKUP(RC[-1],工作表2!C[1]:C[2],2,0) -> 牛魔BOSS2 | D1334: 烈焰魔链 | E1334: 352
A1335: 201033 | B1335: =R[-101]C+1 -> 16 | C1335: =VLOOKUP(RC[-1],工作表2!C[1]:C[2],2,0) -> 牛魔BOSS2 | D1335: 烈焰魔指 | E1335: 352
A1336: 201035 | B1336: =R[-101]C+1 -> 16 | C1336: =VLOOKUP(RC[-1],工作表2!C[1]:C[2],2,0) -> 牛魔BOSS2 | D1336: 烈焰头盔 | E1336: 352
A1337: 201036 | B1337: =R[-101]C+1 -> 16 | C1337: =VLOOKUP(RC[-1],工作表2!C[1]:C[2],2,0) -> 牛魔BOSS2 | D1337: 烈焰护腕 | E1337: 352
A1338: 201037 | B1338: =R[-101]C+1 -> 16 | C1338: =VLOOKUP(RC[-1],工作表2!C[1]:C[2],2,0) -> 牛魔BOSS2 | D1338: 烈焰腰带 | E1338: 352
A1339: 201039 | B1339: =R[-101]C+1 -> 16 | C1339: =VLOOKUP(RC[-1],工作表2!C[1]:C[2],2,0) -> 牛魔BOSS2 | D1339: 烈焰魔靴 | E1339: 352
A1340: 202030 | B1340: =R[-101]C+1 -> 16 | C1340: =VLOOKUP(RC[-1],工作表2!C[1]:C[2],2,0) -> 牛魔BOSS2 | D1340: 玄天 | E1340: 352
A1341: 202031 | B1341: =R[-101]C+1 -> 16 | C1341: =VLOOKUP(RC[-1],工作表2!C[1]:C[2],2,0) -> 牛魔BOSS2 | D1341: 光芒道袍 | E1341: 352
A1342: 202032 | B1342: =R[-101]C+1 -> 16 | C1342: =VLOOKUP(RC[-1],工作表2!C[1]:C[2],2,0) -> 牛魔BOSS2 | D1342: 光芒道链 | E1342: 352
A1343: 202033 | B1343: =R[-101]C+1 -> 16 | C1343: =VLOOKUP(RC[-1],工作表2!C[1]:C[2],2,0) -> 牛魔BOSS2 | D1343: 光芒道戒 | E1343: 352
A1344: 202035 | B1344: =R[-101]C+1 -> 16 | C1344: =VLOOKUP(RC[-1],工作表2!C[1]:C[2],2,0) -> 牛魔BOSS2 | D1344: 光芒头盔 | E1344: 352
A1345: 202036 | B1345: =R[-101]C+1 -> 16 | C1345: =VLOOKUP(RC[-1],工作表2!C[1]:C[2],2,0) -> 牛魔BOSS2 | D1345: 光芒护腕 | E1345: 352
A1346: 202037 | B1346: =R[-101]C+1 -> 16 | C1346: =VLOOKUP(RC[-1],工作表2!C[1]:C[2],2,0) -> 牛魔BOSS2 | D1346: 光芒腰带 | E1346: 352
A1347: 202039 | B1347: =R[-101]C+1 -> 16 | C1347: =VLOOKUP(RC[-1],工作表2!C[1]:C[2],2,0) -> 牛魔BOSS2 | D1347: 光芒道靴 | E1347: 352
A1348: 200060 | B1348: =R[-101]C+1 -> 16 | C1348: =VLOOKUP(RC[-1],工作表2!C[1]:C[2],2,0) -> 牛魔BOSS2 | D1348: 混沌 | E1348: 353
A1349: 200061 | B1349: =R[-101]C+1 -> 16 | C1349: =VLOOKUP(RC[-1],工作表2!C[1]:C[2],2,0) -> 牛魔BOSS2 | D1349: 白虎衣服 | E1349: 353
A1350: 200062 | B1350: =R[-101]C+1 -> 16 | C1350: =VLOOKUP(RC[-1],工作表2!C[1]:C[2],2,0) -> 牛魔BOSS2 | D1350: 白虎头盔 | E1350: 353
A1351: 200063 | B1351: =R[-101]C+1 -> 16 | C1351: =VLOOKUP(RC[-1],工作表2!C[1]:C[2],2,0) -> 牛魔BOSS2 | D1351: 白虎项链 | E1351: 353
A1352: 200065 | B1352: =R[-101]C+1 -> 16 | C1352: =VLOOKUP(RC[-1],工作表2!C[1]:C[2],2,0) -> 牛魔BOSS2 | D1352: 白虎手镯 | E1352: 353
A1353: 200066 | B1353: =R[-101]C+1 -> 16 | C1353: =VLOOKUP(RC[-1],工作表2!C[1]:C[2],2,0) -> 牛魔BOSS2 | D1353: 白虎戒指 | E1353: 353
A1354: 200067 | B1354: =R[-101]C+1 -> 16 | C1354: =VLOOKUP(RC[-1],工作表2!C[1]:C[2],2,0) -> 牛魔BOSS2 | D1354: 白虎腰带 | E1354: 353
A1355: 200069 | B1355: =R[-101]C+1 -> 16 | C1355: =VLOOKUP(RC[-1],工作表2!C[1]:C[2],2,0) -> 牛魔BOSS2 | D1355: 白虎鞋子 | E1355: 353
A1356: 201060 | B1356: =R[-101]C+1 -> 16 | C1356: =VLOOKUP(RC[-1],工作表2!C[1]:C[2],2,0) -> 牛魔BOSS2 | D1356: 狂龙 | E1356: 353
A1357: 201061 | B1357: =R[-101]C+1 -> 16 | C1357: =VLOOKUP(RC[-1],工作表2!C[1]:C[2],2,0) -> 牛魔BOSS2 | D1357: 朱雀衣服 | E1357: 353
A1358: 201062 | B1358: =R[-101]C+1 -> 16 | C1358: =VLOOKUP(RC[-1],工作表2!C[1]:C[2],2,0) -> 牛魔BOSS2 | D1358: 朱雀头盔 | E1358: 353
A1359: 201063 | B1359: =R[-101]C+1 -> 16 | C1359: =VLOOKUP(RC[-1],工作表2!C[1]:C[2],2,0) -> 牛魔BOSS2 | D1359: 朱雀项链 | E1359: 353
A1360: 201065 | B1360: =R[-101]C+1 -> 16 | C1360: =VLOOKUP(RC[-1],工作表2!C[1]:C[2],2,0) -> 牛魔BOSS2 | D1360: 朱雀手镯 | E1360: 353
A1361: 201066 | B1361: =R[-101]C+1 -> 16 | C1361: =VLOOKUP(RC[-1],工作表2!C[1]:C[2],2,0) -> 牛魔BOSS2 | D1361: 朱雀戒指 | E1361: 353
A1362: 201067 | B1362: =R[-101]C+1 -> 16 | C1362: =VLOOKUP(RC[-1],工作表2!C[1]:C[2],2,0) -> 牛魔BOSS2 | D1362: 朱雀腰带 | E1362: 353
A1363: 201069 | B1363: =R[-101]C+1 -> 16 | C1363: =VLOOKUP(RC[-1],工作表2!C[1]:C[2],2,0) -> 牛魔BOSS2 | D1363: 朱雀鞋子 | E1363: 353
A1364: 202060 | B1364: =R[-101]C+1 -> 16 | C1364: =VLOOKUP(RC[-1],工作表2!C[1]:C[2],2,0) -> 牛魔BOSS2 | D1364: 天蛇 | E1364: 353
A1365: 202061 | B1365: =R[-101]C+1 -> 16 | C1365: =VLOOKUP(RC[-1],工作表2!C[1]:C[2],2,0) -> 牛魔BOSS2 | D1365: 青龙衣服 | E1365: 353
A1366: 202062 | B1366: =R[-101]C+1 -> 16 | C1366: =VLOOKUP(RC[-1],工作表2!C[1]:C[2],2,0) -> 牛魔BOSS2 | D1366: 青龙头盔 | E1366: 353
A1367: 202063 | B1367: =R[-101]C+1 -> 16 | C1367: =VLOOKUP(RC[-1],工作表2!C[1]:C[2],2,0) -> 牛魔BOSS2 | D1367: 青龙项链 | E1367: 353
A1368: 202065 | B1368: =R[-101]C+1 -> 16 | C1368: =VLOOKUP(RC[-1],工作表2!C[1]:C[2],2,0) -> 牛魔BOSS2 | D1368: 青龙手镯 | E1368: 353
A1369: 202066 | B1369: =R[-101]C+1 -> 16 | C1369: =VLOOKUP(RC[-1],工作表2!C[1]:C[2],2,0) -> 牛魔BOSS2 | D1369: 青龙戒指 | E1369: 353
A1370: 202067 | B1370: =R[-101]C+1 -> 16 | C1370: =VLOOKUP(RC[-1],工作表2!C[1]:C[2],2,0) -> 牛魔BOSS2 | D1370: 青龙腰带 | E1370: 353
A1371: 202069 | B1371: =R[-101]C+1 -> 16 | C1371: =VLOOKUP(RC[-1],工作表2!C[1]:C[2],2,0) -> 牛魔BOSS2 | D1371: 青龙鞋子 | E1371: 353
A1372: 200070 | B1372: =R[-101]C+1 -> 16 | C1372: =VLOOKUP(RC[-1],工作表2!C[1]:C[2],2,0) -> 牛魔BOSS2 | D1372: 战刃 | E1372: 273
A1373: 200071 | B1373: =R[-101]C+1 -> 16 | C1373: =VLOOKUP(RC[-1],工作表2!C[1]:C[2],2,0) -> 牛魔BOSS2 | D1373: 圣武衣服 | E1373: 273
A1374: 200072 | B1374: =R[-101]C+1 -> 16 | C1374: =VLOOKUP(RC[-1],工作表2!C[1]:C[2],2,0) -> 牛魔BOSS2 | D1374: 圣武项链 | E1374: 273
A1375: 200073 | B1375: =R[-101]C+1 -> 16 | C1375: =VLOOKUP(RC[-1],工作表2!C[1]:C[2],2,0) -> 牛魔BOSS2 | D1375: 圣武戒指 | E1375: 273
A1376: 200075 | B1376: =R[-101]C+1 -> 16 | C1376: =VLOOKUP(RC[-1],工作表2!C[1]:C[2],2,0) -> 牛魔BOSS2 | D1376: 圣武头盔 | E1376: 273
A1377: 200076 | B1377: =R[-101]C+1 -> 16 | C1377: =VLOOKUP(RC[-1],工作表2!C[1]:C[2],2,0) -> 牛魔BOSS2 | D1377: 圣武手镯 | E1377: 273
A1378: 200077 | B1378: =R[-101]C+1 -> 16 | C1378: =VLOOKUP(RC[-1],工作表2!C[1]:C[2],2,0) -> 牛魔BOSS2 | D1378: 圣武腰带 | E1378: 273
A1379: 200079 | B1379: =R[-101]C+1 -> 16 | C1379: =VLOOKUP(RC[-1],工作表2!C[1]:C[2],2,0) -> 牛魔BOSS2 | D1379: 圣武鞋子 | E1379: 273
A1380: 201070 | B1380: =R[-101]C+1 -> 16 | C1380: =VLOOKUP(RC[-1],工作表2!C[1]:C[2],2,0) -> 牛魔BOSS2 | D1380: 轮回 | E1380: 273
A1381: 201071 | B1381: =R[-101]C+1 -> 16 | C1381: =VLOOKUP(RC[-1],工作表2!C[1]:C[2],2,0) -> 牛魔BOSS2 | D1381: 圣魔衣服 | E1381: 273
A1382: 201072 | B1382: =R[-101]C+1 -> 16 | C1382: =VLOOKUP(RC[-1],工作表2!C[1]:C[2],2,0) -> 牛魔BOSS2 | D1382: 圣魔项链 | E1382: 273
A1383: 201073 | B1383: =R[-101]C+1 -> 16 | C1383: =VLOOKUP(RC[-1],工作表2!C[1]:C[2],2,0) -> 牛魔BOSS2 | D1383: 圣魔戒指 | E1383: 273
A1384: 201075 | B1384: =R[-101]C+1 -> 16 | C1384: =VLOOKUP(RC[-1],工作表2!C[1]:C[2],2,0) -> 牛魔BOSS2 | D1384: 圣魔头盔 | E1384: 273
A1385: 201076 | B1385: =R[-101]C+1 -> 16 | C1385: =VLOOKUP(RC[-1],工作表2!C[1]:C[2],2,0) -> 牛魔BOSS2 | D1385: 圣魔手镯 | E1385: 273
A1386: 201077 | B1386: =R[-101]C+1 -> 16 | C1386: =VLOOKUP(RC[-1],工作表2!C[1]:C[2],2,0) -> 牛魔BOSS2 | D1386: 圣魔腰带 | E1386: 273
A1387: 201079 | B1387: =R[-101]C+1 -> 16 | C1387: =VLOOKUP(RC[-1],工作表2!C[1]:C[2],2,0) -> 牛魔BOSS2 | D1387: 圣魔鞋子 | E1387: 273
A1388: 202070 | B1388: =R[-101]C+1 -> 16 | C1388: =VLOOKUP(RC[-1],工作表2!C[1]:C[2],2,0) -> 牛魔BOSS2 | D1388: 太虚 | E1388: 273
A1389: 202071 | B1389: =R[-101]C+1 -> 16 | C1389: =VLOOKUP(RC[-1],工作表2!C[1]:C[2],2,0) -> 牛魔BOSS2 | D1389: 圣魂衣服 | E1389: 273
A1390: 202072 | B1390: =R[-101]C+1 -> 16 | C1390: =VLOOKUP(RC[-1],工作表2!C[1]:C[2],2,0) -> 牛魔BOSS2 | D1390: 圣魂项链 | E1390: 273
A1391: 202073 | B1391: =R[-101]C+1 -> 16 | C1391: =VLOOKUP(RC[-1],工作表2!C[1]:C[2],2,0) -> 牛魔BOSS2 | D1391: 圣魂戒指 | E1391: 273
A1392: 202075 | B1392: =R[-101]C+1 -> 16 | C1392: =VLOOKUP(RC[-1],工作表2!C[1]:C[2],2,0) -> 牛魔BOSS2 | D1392: 圣魂头盔 | E1392: 273
A1393: 202076 | B1393: =R[-101]C+1 -> 16 | C1393: =VLOOKUP(RC[-1],工作表2!C[1]:C[2],2,0) -> 牛魔BOSS2 | D1393: 圣魂手镯 | E1393: 273
A1394: 202077 | B1394: =R[-101]C+1 -> 16 | C1394: =VLOOKUP(RC[-1],工作表2!C[1]:C[2],2,0) -> 牛魔BOSS2 | D1394: 圣魂腰带 | E1394: 273
A1395: 202079 | B1395: =R[-101]C+1 -> 16 | C1395: =VLOOKUP(RC[-1],工作表2!C[1]:C[2],2,0) -> 牛魔BOSS2 | D1395: 圣魂鞋子 | E1395: 273
A1396: 305000 | B1396: =R[-101]C+1 -> 16 | C1396: =VLOOKUP(RC[-1],工作表2!C[1]:C[2],2,0) -> 牛魔BOSS2 | D1396: 麻痹戒指 | E1396: 166
A1397: 305001 | B1397: =R[-101]C+1 -> 16 | C1397: =VLOOKUP(RC[-1],工作表2!C[1]:C[2],2,0) -> 牛魔BOSS2 | D1397: 护身戒指 | E1397: 166
A1398: 305002 | B1398: =R[-101]C+1 -> 16 | C1398: =VLOOKUP(RC[-1],工作表2!C[1]:C[2],2,0) -> 牛魔BOSS2 | D1398: 复活戒指 | E1398: 166
A1399: 110163 | B1399: =R[-101]C+1 -> 16 | C1399: =VLOOKUP(RC[-1],工作表2!C[1]:C[2],2,0) -> 牛魔BOSS2 | D1399: 上古神石 | E1399: 356
A1400: 305013 | B1400: =R[-101]C+1 -> 16 | C1400: =VLOOKUP(RC[-1],工作表2!C[1]:C[2],2,0) -> 牛魔BOSS2 | D1400: 特面 | E1400: 357
A1401: 305014 | B1401: =R[-101]C+1 -> 16 | C1401: =VLOOKUP(RC[-1],工作表2!C[1]:C[2],2,0) -> 牛魔BOSS2 | D1401: 特腿 | E1401: 358
A1402: 305015 | B1402: =R[-101]C+1 -> 16 | C1402: =VLOOKUP(RC[-1],工作表2!C[1]:C[2],2,0) -> 牛魔BOSS2 | D1402: 特肩 | E1402: 359
A1403: 110024 | B1403: =R[-101]C+1 -> 16 | C1403: =VLOOKUP(RC[-1],工作表2!C[1]:C[2],2,0) -> 牛魔BOSS2 | D1403: 狂风斩书 | E1403: 36
A1404: 110025 | B1404: =R[-101]C+1 -> 16 | C1404: =VLOOKUP(RC[-1],工作表2!C[1]:C[2],2,0) -> 牛魔BOSS2 | D1404: 逐日剑法书 | E1404: 37
A1405: 110067 | B1405: =R[-101]C+1 -> 16 | C1405: =VLOOKUP(RC[-1],工作表2!C[1]:C[2],2,0) -> 牛魔BOSS2 | D1405: 诱惑之光书 | E1405: 38
A1406: 110040 | B1406: =R[-101]C+1 -> 16 | C1406: =VLOOKUP(RC[-1],工作表2!C[1]:C[2],2,0) -> 牛魔BOSS2 | D1406: 流星火雨书 | E1406: 39
A1407: 110031 | B1407: =R[-101]C+1 -> 16 | C1407: =VLOOKUP(RC[-1],工作表2!C[1]:C[2],2,0) -> 牛魔BOSS2 | D1407: 召唤神兽书 | E1407: 40
A1408: 110032 | B1408: =R[-101]C+1 -> 16 | C1408: =VLOOKUP(RC[-1],工作表2!C[1]:C[2],2,0) -> 牛魔BOSS2 | D1408: 嗜血术书 | E1408: 41
A1409: 305003 | B1409: =R[-101]C+1 -> 16 | C1409: =VLOOKUP(RC[-1],工作表2!C[1]:C[2],2,0) -> 牛魔BOSS2 | D1409: 怒斩 | E1409: 366
A1410: 305004 | B1410: =R[-101]C+1 -> 16 | C1410: =VLOOKUP(RC[-1],工作表2!C[1]:C[2],2,0) -> 牛魔BOSS2 | D1410: 龙牙 | E1410: 366
A1411: 305005 | B1411: =R[-101]C+1 -> 16 | C1411: =VLOOKUP(RC[-1],工作表2!C[1]:C[2],2,0) -> 牛魔BOSS2 | D1411: 龙纹 | E1411: 366
A1412: 305006 | B1412: =R[-101]C+1 -> 16 | C1412: =VLOOKUP(RC[-1],工作表2!C[1]:C[2],2,0) -> 牛魔BOSS2 | D1412: 至尊屠龙 | E1412: 367
A1413: 305007 | B1413: =R[-101]C+1 -> 16 | C1413: =VLOOKUP(RC[-1],工作表2!C[1]:C[2],2,0) -> 牛魔BOSS2 | D1413: 至尊噬魂 | E1413: 367
A1414: 305008 | B1414: =R[-101]C+1 -> 16 | C1414: =VLOOKUP(RC[-1],工作表2!C[1]:C[2],2,0) -> 牛魔BOSS2 | D1414: 至尊逍遥扇 | E1414: 367
A1415: 110140 | B1415: =R[-101]C+1 -> 16 | C1415: =VLOOKUP(RC[-1],工作表2!C[1]:C[2],2,0) -> 牛魔BOSS2 | D1415: 进阶丹 | E1415: 368
A1416: 110109 | B1416: =R[-101]C+1 -> 16 | C1416: =VLOOKUP(RC[-1],工作表2!C[1]:C[2],2,0) -> 牛魔BOSS2 | D1416: 金刚石 | E1416: 369
A1417: 110154 | B1417: =R[-101]C+1 -> 16 | C1417: =VLOOKUP(RC[-1],工作表2!C[1]:C[2],2,0) -> 牛魔BOSS2 | D1417: 2元宝 | E1417: 370
A1418: 110155 | B1418: =R[-101]C+1 -> 16 | C1418: =VLOOKUP(RC[-1],工作表2!C[1]:C[2],2,0) -> 牛魔BOSS2 | D1418: 5元宝 | E1418: 371
A1419: 110156 | B1419: =R[-101]C+1 -> 16 | C1419: =VLOOKUP(RC[-1],工作表2!C[1]:C[2],2,0) -> 牛魔BOSS2 | D1419: 10元宝 | E1419: 372
A1420: 110157 | B1420: =R[-101]C+1 -> 16 | C1420: =VLOOKUP(RC[-1],工作表2!C[1]:C[2],2,0) -> 牛魔BOSS2 | D1420: 20元宝 | E1420: 373
A1421: 110158 | B1421: =R[-101]C+1 -> 16 | C1421: =VLOOKUP(RC[-1],工作表2!C[1]:C[2],2,0) -> 牛魔BOSS2 | D1421: 50元宝 | E1421: 374
A1422: 110159 | B1422: =R[-101]C+1 -> 16 | C1422: =VLOOKUP(RC[-1],工作表2!C[1]:C[2],2,0) -> 牛魔BOSS2 | D1422: 100元宝 | E1422: 375
A1423: 110164 | B1423: =R[-101]C+1 -> 16 | C1423: =VLOOKUP(RC[-1],工作表2!C[1]:C[2],2,0) -> 牛魔BOSS2 | D1423: 150元宝 | E1423: 376
A1424: 110165 | B1424: =R[-101]C+1 -> 16 | C1424: =VLOOKUP(RC[-1],工作表2!C[1]:C[2],2,0) -> 牛魔BOSS2 | D1424: 200元宝 | E1424: 377
A1425: 110294 | B1425: 17 | C1425: 火龙精英 | D1425: 女娲神石 | E1425: 378
A1426: 110155 | B1426: 17 | C1426: 火龙精英 | D1426: 5元宝 | E1426: 399
A1427: 110157 | B1427: 17 | C1427: 火龙精英 | D1427: 20元宝 | E1427: 400
A1428: 110294 | B1428: 18 | C1428: 雪山boss1 | D1428: 女娲神石 | E1428: 379
A1429: 110294 | B1429: 19 | C1429: 雪山BOSS2 | D1429: 女娲神石 | E1429: 380
A1430: 110109 | B1430: 20 | C1430: 本服暗殿1小怪 | D1430: 金刚石 | E1430: 381
A1431: 200032 | B1431: 20 | C1431: 本服暗殿1小怪 | D1431: 雷霆项链 | E1431: 382
A1432: 200033 | B1432: 20 | C1432: 本服暗殿1小怪 | D1432: 雷霆戒指 | E1432: 382
A1433: 200035 | B1433: 20 | C1433: 本服暗殿1小怪 | D1433: 雷霆头盔 | E1433: 382
A1434: 200036 | B1434: 20 | C1434: 本服暗殿1小怪 | D1434: 雷霆护腕 | E1434: 382
A1435: 200037 | B1435: 20 | C1435: 本服暗殿1小怪 | D1435: 雷霆腰带 | E1435: 382
A1436: 200039 | B1436: 20 | C1436: 本服暗殿1小怪 | D1436: 雷霆战靴 | E1436: 382
A1437: 201030 | B1437: 20 | C1437: 本服暗殿1小怪 | D1437: 震天魔剑 | E1437: 382
A1438: 201031 | B1438: 20 | C1438: 本服暗殿1小怪 | D1438: 烈焰披风 | E1438: 382
A1439: 201032 | B1439: 20 | C1439: 本服暗殿1小怪 | D1439: 烈焰项链 | E1439: 382
A1440: 201033 | B1440: 20 | C1440: 本服暗殿1小怪 | D1440: 烈焰戒指 | E1440: 382
A1441: 201035 | B1441: 20 | C1441: 本服暗殿1小怪 | D1441: 烈焰头盔 | E1441: 382
A1442: 201036 | B1442: 20 | C1442: 本服暗殿1小怪 | D1442: 烈焰护腕 | E1442: 382
A1443: 201037 | B1443: 20 | C1443: 本服暗殿1小怪 | D1443: 烈焰腰带 | E1443: 382
A1444: 201039 | B1444: 20 | C1444: 本服暗殿1小怪 | D1444: 烈焰魔靴 | E1444: 382
A1445: 202030 | B1445: 20 | C1445: 本服暗殿1小怪 | D1445: 玄天道剑 | E1445: 382
A1446: 202031 | B1446: 20 | C1446: 本服暗殿1小怪 | D1446: 光芒道袍 | E1446: 382
A1447: 202032 | B1447: 20 | C1447: 本服暗殿1小怪 | D1447: 光芒道链 | E1447: 382
A1448: 202033 | B1448: 20 | C1448: 本服暗殿1小怪 | D1448: 光芒道戒 | E1448: 382
A1449: 202035 | B1449: 20 | C1449: 本服暗殿1小怪 | D1449: 光芒头盔 | E1449: 382
A1450: 202036 | B1450: 20 | C1450: 本服暗殿1小怪 | D1450: 光芒护腕 | E1450: 382
A1451: 202037 | B1451: 20 | C1451: 本服暗殿1小怪 | D1451: 光芒腰带 | E1451: 382
A1452: 202039 | B1452: 20 | C1452: 本服暗殿1小怪 | D1452: 光芒道靴 | E1452: 382
A1453: 200030 | B1453: 21 | C1453: 本服暗殿2小怪 | D1453: 开天战刃 | E1453: 383
A1454: 200031 | B1454: 21 | C1454: 本服暗殿2小怪 | D1454: 雷霆重甲 | E1454: 383
A1455: 200032 | B1455: 21 | C1455: 本服暗殿2小怪 | D1455: 雷霆项链 | E1455: 383
A1456: 200033 | B1456: 21 | C1456: 本服暗殿2小怪 | D1456: 雷霆戒指 | E1456: 383
A1457: 200035 | B1457: 21 | C1457: 本服暗殿2小怪 | D1457: 雷霆头盔 | E1457: 383
A1458: 200036 | B1458: 21 | C1458: 本服暗殿2小怪 | D1458: 雷霆护腕 | E1458: 383
A1459: 200037 | B1459: 21 | C1459: 本服暗殿2小怪 | D1459: 雷霆腰带 | E1459: 383
A1460: 200039 | B1460: 21 | C1460: 本服暗殿2小怪 | D1460: 雷霆战靴 | E1460: 383
A1461: 201030 | B1461: 21 | C1461: 本服暗殿2小怪 | D1461: 震天魔剑 | E1461: 383
A1462: 201031 | B1462: 21 | C1462: 本服暗殿2小怪 | D1462: 烈焰披风 | E1462: 383
A1463: 201032 | B1463: 21 | C1463: 本服暗殿2小怪 | D1463: 烈焰项链 | E1463: 383
A1464: 201033 | B1464: 21 | C1464: 本服暗殿2小怪 | D1464: 烈焰戒指 | E1464: 383
A1465: 201035 | B1465: 21 | C1465: 本服暗殿2小怪 | D1465: 烈焰头盔 | E1465: 383
A1466: 201036 | B1466: 21 | C1466: 本服暗殿2小怪 | D1466: 烈焰护腕 | E1466: 383
A1467: 201037 | B1467: 21 | C1467: 本服暗殿2小怪 | D1467: 烈焰腰带 | E1467: 383
A1468: 201039 | B1468: 21 | C1468: 本服暗殿2小怪 | D1468: 烈焰魔靴 | E1468: 383
A1469: 202030 | B1469: 21 | C1469: 本服暗殿2小怪 | D1469: 玄天道剑 | E1469: 383
A1470: 202031 | B1470: 21 | C1470: 本服暗殿2小怪 | D1470: 光芒道袍 | E1470: 383
A1471: 202032 | B1471: 21 | C1471: 本服暗殿2小怪 | D1471: 光芒道链 | E1471: 383
A1472: 202033 | B1472: 21 | C1472: 本服暗殿2小怪 | D1472: 光芒道戒 | E1472: 383
A1473: 202035 | B1473: 21 | C1473: 本服暗殿2小怪 | D1473: 光芒头盔 | E1473: 383
A1474: 202036 | B1474: 21 | C1474: 本服暗殿2小怪 | D1474: 光芒护腕 | E1474: 383
A1475: 202037 | B1475: 21 | C1475: 本服暗殿2小怪 | D1475: 光芒腰带 | E1475: 383
A1476: 202039 | B1476: 21 | C1476: 本服暗殿2小怪 | D1476: 光芒道靴 | E1476: 383
A1477: 200060 | B1477: 21 | C1477: 本服暗殿2小怪 | D1477: 混沌 | E1477: 384
A1478: 200061 | B1478: 21 | C1478: 本服暗殿2小怪 | D1478: 白虎战甲 | E1478: 384
A1479: 200062 | B1479: 21 | C1479: 本服暗殿2小怪 | D1479: 白虎头盔 | E1479: 384
A1480: 200063 | B1480: 21 | C1480: 本服暗殿2小怪 | D1480: 白虎项链 | E1480: 384
A1481: 200065 | B1481: 21 | C1481: 本服暗殿2小怪 | D1481: 白虎手镯 | E1481: 384
A1482: 200066 | B1482: 21 | C1482: 本服暗殿2小怪 | D1482: 白虎戒指 | E1482: 384
A1483: 200067 | B1483: 21 | C1483: 本服暗殿2小怪 | D1483: 白虎腰带 | E1483: 384
A1484: 200069 | B1484: 21 | C1484: 本服暗殿2小怪 | D1484: 白虎战靴 | E1484: 384
A1485: 201060 | B1485: 21 | C1485: 本服暗殿2小怪 | D1485: 狂龙 | E1485: 384 | G1485: 110163 | H1485: 21 | I1485: 跨服暗殿2小怪 | J1485: 上古神石 | K1485: 382
A1486: 201061 | B1486: 21 | C1486: 本服暗殿2小怪 | D1486: 朱雀披风 | E1486: 384 | G1486: 110294 | H1486: 22 | I1486: 跨服暗殿3小怪 | J1486: 女娲神石 | K1486: 383
A1487: 201062 | B1487: 21 | C1487: 本服暗殿2小怪 | D1487: 朱雀头盔 | E1487: 384
A1488: 201063 | B1488: 21 | C1488: 本服暗殿2小怪 | D1488: 朱雀项链 | E1488: 384
A1489: 201065 | B1489: 21 | C1489: 本服暗殿2小怪 | D1489: 朱雀手镯 | E1489: 384
A1490: 201066 | B1490: 21 | C1490: 本服暗殿2小怪 | D1490: 朱雀戒指 | E1490: 384
A1491: 201067 | B1491: 21 | C1491: 本服暗殿2小怪 | D1491: 朱雀腰带 | E1491: 384
A1492: 201069 | B1492: 21 | C1492: 本服暗殿2小怪 | D1492: 朱雀魔靴 | E1492: 384
A1493: 202060 | B1493: 21 | C1493: 本服暗殿2小怪 | D1493: 天蛇 | E1493: 384
A1494: 202061 | B1494: 21 | C1494: 本服暗殿2小怪 | D1494: 青龙道袍 | E1494: 384
A1495: 202062 | B1495: 21 | C1495: 本服暗殿2小怪 | D1495: 青龙头盔 | E1495: 384
A1496: 202063 | B1496: 21 | C1496: 本服暗殿2小怪 | D1496: 青龙项链 | E1496: 384
A1497: 202065 | B1497: 21 | C1497: 本服暗殿2小怪 | D1497: 青龙手镯 | E1497: 384
A1498: 202066 | B1498: 21 | C1498: 本服暗殿2小怪 | D1498: 青龙戒指 | E1498: 384
A1499: 202067 | B1499: 21 | C1499: 本服暗殿2小怪 | D1499: 青龙腰带 | E1499: 384
A1500: 202069 | B1500: 21 | C1500: 本服暗殿2小怪 | D1500: 青龙道靴 | E1500: 384
A1501: 110163 | B1501: 21 | C1501: 本服暗殿2小怪 | D1501: 上古神石 | E1501: 385
A1502: 200060 | B1502: 22 | C1502: 跨服暗殿1小怪 | D1502: 混沌 | E1502: 386
A1503: 200061 | B1503: 22 | C1503: 跨服暗殿1小怪 | D1503: 白虎战甲 | E1503: 386
A1504: 200062 | B1504: 22 | C1504: 跨服暗殿1小怪 | D1504: 白虎头盔 | E1504: 386
A1505: 200063 | B1505: 22 | C1505: 跨服暗殿1小怪 | D1505: 白虎项链 | E1505: 386
A1506: 200065 | B1506: 22 | C1506: 跨服暗殿1小怪 | D1506: 白虎手镯 | E1506: 386
A1507: 200066 | B1507: 22 | C1507: 跨服暗殿1小怪 | D1507: 白虎戒指 | E1507: 386
A1508: 200067 | B1508: 22 | C1508: 跨服暗殿1小怪 | D1508: 白虎腰带 | E1508: 386
A1509: 200069 | B1509: 22 | C1509: 跨服暗殿1小怪 | D1509: 白虎战靴 | E1509: 386
A1510: 201060 | B1510: 22 | C1510: 跨服暗殿1小怪 | D1510: 狂龙 | E1510: 386
A1511: 201061 | B1511: 22 | C1511: 跨服暗殿1小怪 | D1511: 朱雀披风 | E1511: 386
A1512: 201062 | B1512: 22 | C1512: 跨服暗殿1小怪 | D1512: 朱雀头盔 | E1512: 386
A1513: 201063 | B1513: 22 | C1513: 跨服暗殿1小怪 | D1513: 朱雀项链 | E1513: 386
A1514: 201065 | B1514: 22 | C1514: 跨服暗殿1小怪 | D1514: 朱雀手镯 | E1514: 386
A1515: 201066 | B1515: 22 | C1515: 跨服暗殿1小怪 | D1515: 朱雀戒指 | E1515: 386
A1516: 201067 | B1516: 22 | C1516: 跨服暗殿1小怪 | D1516: 朱雀腰带 | E1516: 386
A1517: 201069 | B1517: 22 | C1517: 跨服暗殿1小怪 | D1517: 朱雀魔靴 | E1517: 386
A1518: 202060 | B1518: 22 | C1518: 跨服暗殿1小怪 | D1518: 天蛇 | E1518: 386
A1519: 202061 | B1519: 22 | C1519: 跨服暗殿1小怪 | D1519: 青龙道袍 | E1519: 386
A1520: 202062 | B1520: 22 | C1520: 跨服暗殿1小怪 | D1520: 青龙头盔 | E1520: 386
A1521: 202063 | B1521: 22 | C1521: 跨服暗殿1小怪 | D1521: 青龙项链 | E1521: 386
A1522: 202065 | B1522: 22 | C1522: 跨服暗殿1小怪 | D1522: 青龙手镯 | E1522: 386
A1523: 202066 | B1523: 22 | C1523: 跨服暗殿1小怪 | D1523: 青龙戒指 | E1523: 386
A1524: 202067 | B1524: 22 | C1524: 跨服暗殿1小怪 | D1524: 青龙腰带 | E1524: 386
A1525: 202069 | B1525: 22 | C1525: 跨服暗殿1小怪 | D1525: 青龙道靴 | E1525: 386
A1526: 202030 | B1526: 22 | C1526: 跨服暗殿1小怪 | D1526: 玄天道剑 | E1526: 386
A1527: 202031 | B1527: 22 | C1527: 跨服暗殿1小怪 | D1527: 光芒道袍 | E1527: 386
A1528: 202032 | B1528: 22 | C1528: 跨服暗殿1小怪 | D1528: 光芒道链 | E1528: 386
A1529: 202033 | B1529: 22 | C1529: 跨服暗殿1小怪 | D1529: 光芒道戒 | E1529: 386
A1530: 202035 | B1530: 22 | C1530: 跨服暗殿1小怪 | D1530: 光芒头盔 | E1530: 386
A1531: 202036 | B1531: 22 | C1531: 跨服暗殿1小怪 | D1531: 光芒护腕 | E1531: 386
A1532: 202037 | B1532: 22 | C1532: 跨服暗殿1小怪 | D1532: 光芒腰带 | E1532: 386
A1533: 202039 | B1533: 22 | C1533: 跨服暗殿1小怪 | D1533: 光芒道靴 | E1533: 386
A1534: 200030 | B1534: 22 | C1534: 跨服暗殿1小怪 | D1534: 开天战刃 | E1534: 387
A1535: 200031 | B1535: 22 | C1535: 跨服暗殿1小怪 | D1535: 雷霆重甲 | E1535: 387
A1536: 200032 | B1536: 22 | C1536: 跨服暗殿1小怪 | D1536: 雷霆项链 | E1536: 387
A1537: 200033 | B1537: 22 | C1537: 跨服暗殿1小怪 | D1537: 雷霆戒指 | E1537: 387
A1538: 200035 | B1538: 22 | C1538: 跨服暗殿1小怪 | D1538: 雷霆头盔 | E1538: 387
A1539: 200036 | B1539: 22 | C1539: 跨服暗殿1小怪 | D1539: 雷霆护腕 | E1539: 387
A1540: 200037 | B1540: 22 | C1540: 跨服暗殿1小怪 | D1540: 雷霆腰带 | E1540: 387
A1541: 200039 | B1541: 22 | C1541: 跨服暗殿1小怪 | D1541: 雷霆战靴 | E1541: 387
A1542: 201030 | B1542: 22 | C1542: 跨服暗殿1小怪 | D1542: 震天魔剑 | E1542: 387
A1543: 201031 | B1543: 22 | C1543: 跨服暗殿1小怪 | D1543: 烈焰披风 | E1543: 387
A1544: 201032 | B1544: 22 | C1544: 跨服暗殿1小怪 | D1544: 烈焰项链 | E1544: 387
A1545: 201033 | B1545: 22 | C1545: 跨服暗殿1小怪 | D1545: 烈焰戒指 | E1545: 387
A1546: 201035 | B1546: 22 | C1546: 跨服暗殿1小怪 | D1546: 烈焰头盔 | E1546: 387
A1547: 201036 | B1547: 22 | C1547: 跨服暗殿1小怪 | D1547: 烈焰护腕 | E1547: 387
A1548: 201037 | B1548: 22 | C1548: 跨服暗殿1小怪 | D1548: 烈焰腰带 | E1548: 387
A1549: 201039 | B1549: 22 | C1549: 跨服暗殿1小怪 | D1549: 烈焰魔靴 | E1549: 387
A1550: 110163 | B1550: 22 | C1550: 跨服暗殿1小怪 | D1550: 上古神石 | E1550: 388
A1551: 305024 | B1551: 22 | C1551: 跨服暗殿1小怪 | D1551: 霸者头巾(特) | E1551: 396
A1552: 305025 | B1552: 22 | C1552: 跨服暗殿1小怪 | D1552: 霸者护符(特) | E1552: 396
A1553: 305021 | B1553: 22 | C1553: 跨服暗殿1小怪 | D1553: 霸者面具(特) | E1553: 396
A1554: 200070 | B1554: 23 | C1554: 跨服暗殿2小怪 | D1554: 战刃 | E1554: 389
A1555: 200071 | B1555: 23 | C1555: 跨服暗殿2小怪 | D1555: 圣武衣服 | E1555: 389
A1556: 200072 | B1556: 23 | C1556: 跨服暗殿2小怪 | D1556: 圣武项链 | E1556: 389
A1557: 200073 | B1557: 23 | C1557: 跨服暗殿2小怪 | D1557: 圣武戒指 | E1557: 389
A1558: 200075 | B1558: 23 | C1558: 跨服暗殿2小怪 | D1558: 圣武头盔 | E1558: 389
A1559: 200076 | B1559: 23 | C1559: 跨服暗殿2小怪 | D1559: 圣武手镯 | E1559: 389
A1560: 200077 | B1560: 23 | C1560: 跨服暗殿2小怪 | D1560: 圣武腰带 | E1560: 389
A1561: 200079 | B1561: 23 | C1561: 跨服暗殿2小怪 | D1561: 圣武鞋子 | E1561: 389
A1562: 201070 | B1562: 23 | C1562: 跨服暗殿2小怪 | D1562: 轮回 | E1562: 389
A1563: 201071 | B1563: 23 | C1563: 跨服暗殿2小怪 | D1563: 圣魔衣服 | E1563: 389
A1564: 201072 | B1564: 23 | C1564: 跨服暗殿2小怪 | D1564: 圣魔项链 | E1564: 389
A1565: 201073 | B1565: 23 | C1565: 跨服暗殿2小怪 | D1565: 圣魔戒指 | E1565: 389
A1566: 201075 | B1566: 23 | C1566: 跨服暗殿2小怪 | D1566: 圣魔头盔 | E1566: 389
A1567: 201076 | B1567: 23 | C1567: 跨服暗殿2小怪 | D1567: 圣魔手镯 | E1567: 389
A1568: 201077 | B1568: 23 | C1568: 跨服暗殿2小怪 | D1568: 圣魔腰带 | E1568: 389
A1569: 201079 | B1569: 23 | C1569: 跨服暗殿2小怪 | D1569: 圣魔鞋子 | E1569: 389
A1570: 202070 | B1570: 23 | C1570: 跨服暗殿2小怪 | D1570: 太虚 | E1570: 389
A1571: 202071 | B1571: 23 | C1571: 跨服暗殿2小怪 | D1571: 圣魂衣服 | E1571: 389
A1572: 202072 | B1572: 23 | C1572: 跨服暗殿2小怪 | D1572: 圣魂项链 | E1572: 389
A1573: 202073 | B1573: 23 | C1573: 跨服暗殿2小怪 | D1573: 圣魂戒指 | E1573: 389
A1574: 202075 | B1574: 23 | C1574: 跨服暗殿2小怪 | D1574: 圣魂头盔 | E1574: 389
A1575: 202076 | B1575: 23 | C1575: 跨服暗殿2小怪 | D1575: 圣魂手镯 | E1575: 389
A1576: 202077 | B1576: 23 | C1576: 跨服暗殿2小怪 | D1576: 圣魂腰带 | E1576: 389
A1577: 202079 | B1577: 23 | C1577: 跨服暗殿2小怪 | D1577: 圣魂鞋子 | E1577: 389
A1578: 110294 | B1578: 23 | C1578: 跨服暗殿2小怪 | D1578: 女娲神石 | E1578: 390
A1579: 305024 | B1579: 23 | C1579: 跨服暗殿2小怪 | D1579: 霸者头巾(特) | E1579: 396
A1580: 305025 | B1580: 23 | C1580: 跨服暗殿2小怪 | D1580: 霸者护符(特) | E1580: 396
A1581: 305021 | B1581: 23 | C1581: 跨服暗殿2小怪 | D1581: 霸者面具(特) | E1581: 396
A1582: 200030 | B1582: 25 | C1582: 本服1层钉钩稻草 | D1582: 开天战刃 | E1582: 392
A1583: 200031 | B1583: 25 | C1583: 本服1层钉钩稻草 | D1583: 雷霆重甲 | E1583: 392
A1584: 200032 | B1584: 25 | C1584: 本服1层钉钩稻草 | D1584: 雷霆项链 | E1584: 392
A1585: 200033 | B1585: 25 | C1585: 本服1层钉钩稻草 | D1585: 雷霆戒指 | E1585: 392
A1586: 200035 | B1586: 25 | C1586: 本服1层钉钩稻草 | D1586: 雷霆头盔 | E1586: 392
A1587: 200036 | B1587: 25 | C1587: 本服1层钉钩稻草 | D1587: 雷霆护腕 | E1587: 392
A1588: 200037 | B1588: 25 | C1588: 本服1层钉钩稻草 | D1588: 雷霆腰带 | E1588: 392
A1589: 200039 | B1589: 25 | C1589: 本服1层钉钩稻草 | D1589: 雷霆战靴 | E1589: 392
A1590: 202030 | B1590: 25 | C1590: 本服1层钉钩稻草 | D1590: 玄天道剑 | E1590: 392
A1591: 202031 | B1591: 25 | C1591: 本服1层钉钩稻草 | D1591: 光芒道袍 | E1591: 392
A1592: 202032 | B1592: 25 | C1592: 本服1层钉钩稻草 | D1592: 光芒道链 | E1592: 392
A1593: 202033 | B1593: 25 | C1593: 本服1层钉钩稻草 | D1593: 光芒道戒 | E1593: 392
A1594: 202035 | B1594: 25 | C1594: 本服1层钉钩稻草 | D1594: 光芒头盔 | E1594: 392
A1595: 202036 | B1595: 25 | C1595: 本服1层钉钩稻草 | D1595: 光芒护腕 | E1595: 392
A1596: 202037 | B1596: 25 | C1596: 本服1层钉钩稻草 | D1596: 光芒腰带 | E1596: 392
A1597: 202039 | B1597: 25 | C1597: 本服1层钉钩稻草 | D1597: 光芒道靴 | E1597: 392
A1598: 201030 | B1598: 25 | C1598: 本服1层钉钩稻草 | D1598: 震天魔剑 | E1598: 392
A1599: 201031 | B1599: 25 | C1599: 本服1层钉钩稻草 | D1599: 烈焰披风 | E1599: 392
A1600: 201032 | B1600: 25 | C1600: 本服1层钉钩稻草 | D1600: 烈焰项链 | E1600: 392
A1601: 201033 | B1601: 25 | C1601: 本服1层钉钩稻草 | D1601: 烈焰戒指 | E1601: 392
A1602: 201035 | B1602: 25 | C1602: 本服1层钉钩稻草 | D1602: 烈焰头盔 | E1602: 392
A1603: 201036 | B1603: 25 | C1603: 本服1层钉钩稻草 | D1603: 烈焰护腕 | E1603: 392
A1604: 201037 | B1604: 25 | C1604: 本服1层钉钩稻草 | D1604: 烈焰腰带 | E1604: 392
A1605: 201039 | B1605: 25 | C1605: 本服1层钉钩稻草 | D1605: 烈焰魔靴 | E1605: 392
A1606: 200060 | B1606: 26 | C1606: 本服2层BOSS | D1606: 混沌 | E1606: 393
A1607: 200061 | B1607: 26 | C1607: 本服2层BOSS | D1607: 白虎战甲 | E1607: 393
A1608: 200062 | B1608: 26 | C1608: 本服2层BOSS | D1608: 白虎头盔 | E1608: 393
A1609: 200063 | B1609: 26 | C1609: 本服2层BOSS | D1609: 白虎项链 | E1609: 393
A1610: 200065 | B1610: 26 | C1610: 本服2层BOSS | D1610: 白虎手镯 | E1610: 393
A1611: 200066 | B1611: 26 | C1611: 本服2层BOSS | D1611: 白虎戒指 | E1611: 393
A1612: 200067 | B1612: 26 | C1612: 本服2层BOSS | D1612: 白虎腰带 | E1612: 393
A1613: 200069 | B1613: 26 | C1613: 本服2层BOSS | D1613: 白虎战靴 | E1613: 393
A1614: 201060 | B1614: 26 | C1614: 本服2层BOSS | D1614: 狂龙 | E1614: 393
A1615: 201061 | B1615: 26 | C1615: 本服2层BOSS | D1615: 朱雀披风 | E1615: 393
A1616: 201062 | B1616: 26 | C1616: 本服2层BOSS | D1616: 朱雀头盔 | E1616: 393
A1617: 201063 | B1617: 26 | C1617: 本服2层BOSS | D1617: 朱雀项链 | E1617: 393
A1618: 201065 | B1618: 26 | C1618: 本服2层BOSS | D1618: 朱雀手镯 | E1618: 393
A1619: 201066 | B1619: 26 | C1619: 本服2层BOSS | D1619: 朱雀戒指 | E1619: 393
A1620: 201067 | B1620: 26 | C1620: 本服2层BOSS | D1620: 朱雀腰带 | E1620: 393
A1621: 201069 | B1621: 26 | C1621: 本服2层BOSS | D1621: 朱雀魔靴 | E1621: 393
A1622: 202060 | B1622: 26 | C1622: 本服2层BOSS | D1622: 天蛇 | E1622: 393
A1623: 202061 | B1623: 26 | C1623: 本服2层BOSS | D1623: 青龙道袍 | E1623: 393
A1624: 202062 | B1624: 26 | C1624: 本服2层BOSS | D1624: 青龙头盔 | E1624: 393
A1625: 202063 | B1625: 26 | C1625: 本服2层BOSS | D1625: 青龙项链 | E1625: 393
A1626: 202065 | B1626: 26 | C1626: 本服2层BOSS | D1626: 青龙手镯 | E1626: 393
A1627: 202066 | B1627: 26 | C1627: 本服2层BOSS | D1627: 青龙戒指 | E1627: 393
A1628: 202067 | B1628: 26 | C1628: 本服2层BOSS | D1628: 青龙腰带 | E1628: 393
A1629: 202069 | B1629: 26 | C1629: 本服2层BOSS | D1629: 青龙道靴 | E1629: 393
A1630: 200060 | B1630: 27 | C1630: 跨服1层BOSS | D1630: 混沌 | E1630: 394
A1631: 200061 | B1631: 27 | C1631: 跨服1层BOSS | D1631: 白虎战甲 | E1631: 394
A1632: 200062 | B1632: 27 | C1632: 跨服1层BOSS | D1632: 白虎头盔 | E1632: 394
A1633: 200063 | B1633: 27 | C1633: 跨服1层BOSS | D1633: 白虎项链 | E1633: 394
A1634: 200065 | B1634: 27 | C1634: 跨服1层BOSS | D1634: 白虎手镯 | E1634: 394
A1635: 200066 | B1635: 27 | C1635: 跨服1层BOSS | D1635: 白虎戒指 | E1635: 394
A1636: 200067 | B1636: 27 | C1636: 跨服1层BOSS | D1636: 白虎腰带 | E1636: 394
A1637: 200069 | B1637: 27 | C1637: 跨服1层BOSS | D1637: 白虎战靴 | E1637: 394
A1638: 201060 | B1638: 27 | C1638: 跨服1层BOSS | D1638: 狂龙 | E1638: 394
A1639: 201061 | B1639: 27 | C1639: 跨服1层BOSS | D1639: 朱雀披风 | E1639: 394
A1640: 201062 | B1640: 27 | C1640: 跨服1层BOSS | D1640: 朱雀头盔 | E1640: 394
A1641: 201063 | B1641: 27 | C1641: 跨服1层BOSS | D1641: 朱雀项链 | E1641: 394
A1642: 201065 | B1642: 27 | C1642: 跨服1层BOSS | D1642: 朱雀手镯 | E1642: 394
A1643: 201066 | B1643: 27 | C1643: 跨服1层BOSS | D1643: 朱雀戒指 | E1643: 394
A1644: 201067 | B1644: 27 | C1644: 跨服1层BOSS | D1644: 朱雀腰带 | E1644: 394
A1645: 201069 | B1645: 27 | C1645: 跨服1层BOSS | D1645: 朱雀魔靴 | E1645: 394
A1646: 202060 | B1646: 27 | C1646: 跨服1层BOSS | D1646: 天蛇 | E1646: 394
A1647: 202061 | B1647: 27 | C1647: 跨服1层BOSS | D1647: 青龙道袍 | E1647: 394
A1648: 202062 | B1648: 27 | C1648: 跨服1层BOSS | D1648: 青龙头盔 | E1648: 394
A1649: 202063 | B1649: 27 | C1649: 跨服1层BOSS | D1649: 青龙项链 | E1649: 394
A1650: 202065 | B1650: 27 | C1650: 跨服1层BOSS | D1650: 青龙手镯 | E1650: 394
A1651: 202066 | B1651: 27 | C1651: 跨服1层BOSS | D1651: 青龙戒指 | E1651: 394
A1652: 202067 | B1652: 27 | C1652: 跨服1层BOSS | D1652: 青龙腰带 | E1652: 394
A1653: 202069 | B1653: 27 | C1653: 跨服1层BOSS | D1653: 青龙道靴 | E1653: 394
A1654: 200070 | B1654: 28 | C1654: 跨服2层BOSS | D1654: 战刃 | E1654: 395
A1655: 200071 | B1655: 28 | C1655: 跨服2层BOSS | D1655: 圣武衣服 | E1655: 395
A1656: 200072 | B1656: 28 | C1656: 跨服2层BOSS | D1656: 圣武项链 | E1656: 395
A1657: 200073 | B1657: 28 | C1657: 跨服2层BOSS | D1657: 圣武戒指 | E1657: 395
A1658: 200075 | B1658: 28 | C1658: 跨服2层BOSS | D1658: 圣武头盔 | E1658: 395
A1659: 200076 | B1659: 28 | C1659: 跨服2层BOSS | D1659: 圣武手镯 | E1659: 395
A1660: 200077 | B1660: 28 | C1660: 跨服2层BOSS | D1660: 圣武腰带 | E1660: 395
A1661: 200079 | B1661: 28 | C1661: 跨服2层BOSS | D1661: 圣武鞋子 | E1661: 395
A1662: 202070 | B1662: 28 | C1662: 跨服2层BOSS | D1662: 太虚 | E1662: 395
A1663: 202071 | B1663: 28 | C1663: 跨服2层BOSS | D1663: 圣魂衣服 | E1663: 395
A1664: 202072 | B1664: 28 | C1664: 跨服2层BOSS | D1664: 圣魂项链 | E1664: 395
A1665: 202073 | B1665: 28 | C1665: 跨服2层BOSS | D1665: 圣魂戒指 | E1665: 395
A1666: 202075 | B1666: 28 | C1666: 跨服2层BOSS | D1666: 圣魂头盔 | E1666: 395
A1667: 202076 | B1667: 28 | C1667: 跨服2层BOSS | D1667: 圣魂手镯 | E1667: 395
A1668: 202077 | B1668: 28 | C1668: 跨服2层BOSS | D1668: 圣魂腰带 | E1668: 395
A1669: 202079 | B1669: 28 | C1669: 跨服2层BOSS | D1669: 圣魂鞋子 | E1669: 395
A1670: 201070 | B1670: 28 | C1670: 跨服2层BOSS | D1670: 轮回 | E1670: 395
A1671: 201071 | B1671: 28 | C1671: 跨服2层BOSS | D1671: 圣魔衣服 | E1671: 395
A1672: 201072 | B1672: 28 | C1672: 跨服2层BOSS | D1672: 圣魔项链 | E1672: 395
A1673: 201073 | B1673: 28 | C1673: 跨服2层BOSS | D1673: 圣魔戒指 | E1673: 395
A1674: 201075 | B1674: 28 | C1674: 跨服2层BOSS | D1674: 圣魔头盔 | E1674: 395
A1675: 201076 | B1675: 28 | C1675: 跨服2层BOSS | D1675: 圣魔手镯 | E1675: 395
A1676: 201077 | B1676: 28 | C1676: 跨服2层BOSS | D1676: 圣魔腰带 | E1676: 395
A1677: 201079 | B1677: 28 | C1677: 跨服2层BOSS | D1677: 圣魔鞋子 | E1677: 395
A1678: 305024 | B1678: 28 | C1678: 跨服2层BOSS | D1678: 霸者头巾(特) | E1678: 396
A1679: 305025 | B1679: 28 | C1679: 跨服2层BOSS | D1679: 霸者护符(特) | E1679: 396
A1680: 305021 | B1680: 28 | C1680: 跨服2层BOSS | D1680: 霸者面具(特) | E1680: 396
A1681: 110294 | B1681: 28 | C1681: 跨服2层BOSS | D1681: 女娲神石 | E1681: 391
A1682: 110294 | B1682: 29 | C1682: 雪山精英 | D1682: 女娲神石 | E1682: 397
A1683: 110163 | B1683: 29 | C1683: 雪山精英 | D1683: 上古神石 | E1683: 398
A1684: 110163 | B1684: 30 | C1684: 牛魔海底精英 | D1684: 上古神石 | E1684: 401
A1685: 110109 | B1685: 30 | C1685: 牛魔海底精英 | D1685: 金刚石 | E1685: 402
A1686: 110109 | B1686: 31 | C1686: 本服火龙精英 | D1686: 金刚石 | E1686: 403
A1687: 200030 | B1687: 31 | C1687: 本服火龙精英 | D1687: 开天 | E1687: 404
A1688: 200031 | B1688: 31 | C1688: 本服火龙精英 | D1688: 雷霆战甲 | E1688: 404
A1689: 200032 | B1689: 31 | C1689: 本服火龙精英 | D1689: 雷霆项链 | E1689: 404
A1690: 200033 | B1690: 31 | C1690: 本服火龙精英 | D1690: 雷霆戒指 | E1690: 404
A1691: 200035 | B1691: 31 | C1691: 本服火龙精英 | D1691: 雷霆头盔 | E1691: 404
A1692: 200036 | B1692: 31 | C1692: 本服火龙精英 | D1692: 雷霆护腕 | E1692: 404
A1693: 200037 | B1693: 31 | C1693: 本服火龙精英 | D1693: 雷霆腰带 | E1693: 404
A1694: 200039 | B1694: 31 | C1694: 本服火龙精英 | D1694: 雷霆战靴 | E1694: 404
A1695: 201030 | B1695: 31 | C1695: 本服火龙精英 | D1695: 震天 | E1695: 404
A1696: 201031 | B1696: 31 | C1696: 本服火龙精英 | D1696: 烈焰法袍 | E1696: 404
A1697: 201032 | B1697: 31 | C1697: 本服火龙精英 | D1697: 烈焰魔链 | E1697: 404
A1698: 201033 | B1698: 31 | C1698: 本服火龙精英 | D1698: 烈焰魔指 | E1698: 404
A1699: 201035 | B1699: 31 | C1699: 本服火龙精英 | D1699: 烈焰头盔 | E1699: 404
A1700: 201036 | B1700: 31 | C1700: 本服火龙精英 | D1700: 烈焰护腕 | E1700: 404
A1701: 201037 | B1701: 31 | C1701: 本服火龙精英 | D1701: 烈焰腰带 | E1701: 404
A1702: 201039 | B1702: 31 | C1702: 本服火龙精英 | D1702: 烈焰魔靴 | E1702: 404
A1703: 202030 | B1703: 31 | C1703: 本服火龙精英 | D1703: 玄天 | E1703: 404
A1704: 202031 | B1704: 31 | C1704: 本服火龙精英 | D1704: 光芒道袍 | E1704: 404
A1705: 202032 | B1705: 31 | C1705: 本服火龙精英 | D1705: 光芒道链 | E1705: 404
A1706: 202033 | B1706: 31 | C1706: 本服火龙精英 | D1706: 光芒道戒 | E1706: 404
A1707: 202035 | B1707: 31 | C1707: 本服火龙精英 | D1707: 光芒头盔 | E1707: 404
A1708: 202036 | B1708: 31 | C1708: 本服火龙精英 | D1708: 光芒护腕 | E1708: 404
A1709: 202037 | B1709: 31 | C1709: 本服火龙精英 | D1709: 光芒腰带 | E1709: 404
A1710: 202039 | B1710: 31 | C1710: 本服火龙精英 | D1710: 光芒道靴 | E1710: 404
A1711: 200060 | B1711: 32 | C1711: 本服火龙BOSS | D1711: 混沌 | E1711: 405
A1712: 200061 | B1712: 32 | C1712: 本服火龙BOSS | D1712: 白虎战甲 | E1712: 405
A1713: 200062 | B1713: 32 | C1713: 本服火龙BOSS | D1713: 白虎头盔 | E1713: 405
A1714: 200063 | B1714: 32 | C1714: 本服火龙BOSS | D1714: 白虎项链 | E1714: 405
A1715: 200065 | B1715: 32 | C1715: 本服火龙BOSS | D1715: 白虎手镯 | E1715: 405
A1716: 200066 | B1716: 32 | C1716: 本服火龙BOSS | D1716: 白虎戒指 | E1716: 405
A1717: 200067 | B1717: 32 | C1717: 本服火龙BOSS | D1717: 白虎腰带 | E1717: 405
A1718: 200069 | B1718: 32 | C1718: 本服火龙BOSS | D1718: 白虎战靴 | E1718: 405
A1719: 201060 | B1719: 32 | C1719: 本服火龙BOSS | D1719: 狂龙 | E1719: 405
A1720: 201061 | B1720: 32 | C1720: 本服火龙BOSS | D1720: 朱雀披风 | E1720: 405
A1721: 201062 | B1721: 32 | C1721: 本服火龙BOSS | D1721: 朱雀头盔 | E1721: 405
A1722: 201063 | B1722: 32 | C1722: 本服火龙BOSS | D1722: 朱雀项链 | E1722: 405
A1723: 201065 | B1723: 32 | C1723: 本服火龙BOSS | D1723: 朱雀手镯 | E1723: 405
A1724: 201066 | B1724: 32 | C1724: 本服火龙BOSS | D1724: 朱雀戒指 | E1724: 405
A1725: 201067 | B1725: 32 | C1725: 本服火龙BOSS | D1725: 朱雀腰带 | E1725: 405
A1726: 201069 | B1726: 32 | C1726: 本服火龙BOSS | D1726: 朱雀魔靴 | E1726: 405
A1727: 202060 | B1727: 32 | C1727: 本服火龙BOSS | D1727: 天蛇 | E1727: 405
A1728: 202061 | B1728: 32 | C1728: 本服火龙BOSS | D1728: 青龙道袍 | E1728: 405
A1729: 202062 | B1729: 32 | C1729: 本服火龙BOSS | D1729: 青龙头盔 | E1729: 405
A1730: 202063 | B1730: 32 | C1730: 本服火龙BOSS | D1730: 青龙项链 | E1730: 405
A1731: 202065 | B1731: 32 | C1731: 本服火龙BOSS | D1731: 青龙手镯 | E1731: 405
A1732: 202066 | B1732: 32 | C1732: 本服火龙BOSS | D1732: 青龙戒指 | E1732: 405
A1733: 202067 | B1733: 32 | C1733: 本服火龙BOSS | D1733: 青龙腰带 | E1733: 405
A1734: 202069 | B1734: 32 | C1734: 本服火龙BOSS | D1734: 青龙道靴 | E1734: 405
A1735: 200030 | B1735: 33 | C1735: 本服1层尸王 | D1735: 开天战刃 | E1735: 392
A1736: 200031 | B1736: 33 | C1736: 本服1层尸王 | D1736: 雷霆重甲 | E1736: 392
A1737: 200032 | B1737: 33 | C1737: 本服1层尸王 | D1737: 雷霆项链 | E1737: 392
A1738: 200033 | B1738: 33 | C1738: 本服1层尸王 | D1738: 雷霆戒指 | E1738: 392
A1739: 200035 | B1739: 33 | C1739: 本服1层尸王 | D1739: 雷霆头盔 | E1739: 392
A1740: 200036 | B1740: 33 | C1740: 本服1层尸王 | D1740: 雷霆护腕 | E1740: 392
A1741: 200037 | B1741: 33 | C1741: 本服1层尸王 | D1741: 雷霆腰带 | E1741: 392
A1742: 200039 | B1742: 33 | C1742: 本服1层尸王 | D1742: 雷霆战靴 | E1742: 392
A1743: 202030 | B1743: 33 | C1743: 本服1层尸王 | D1743: 玄天道剑 | E1743: 392
A1744: 202031 | B1744: 33 | C1744: 本服1层尸王 | D1744: 光芒道袍 | E1744: 392
A1745: 202032 | B1745: 33 | C1745: 本服1层尸王 | D1745: 光芒道链 | E1745: 392
A1746: 202033 | B1746: 33 | C1746: 本服1层尸王 | D1746: 光芒道戒 | E1746: 392
A1747: 202035 | B1747: 33 | C1747: 本服1层尸王 | D1747: 光芒头盔 | E1747: 392
A1748: 202036 | B1748: 33 | C1748: 本服1层尸王 | D1748: 光芒护腕 | E1748: 392
A1749: 202037 | B1749: 33 | C1749: 本服1层尸王 | D1749: 光芒腰带 | E1749: 392
A1750: 202039 | B1750: 33 | C1750: 本服1层尸王 | D1750: 光芒道靴 | E1750: 392
A1751: 201030 | B1751: 33 | C1751: 本服1层尸王 | D1751: 震天魔剑 | E1751: 392
A1752: 201031 | B1752: 33 | C1752: 本服1层尸王 | D1752: 烈焰披风 | E1752: 392
A1753: 201032 | B1753: 33 | C1753: 本服1层尸王 | D1753: 烈焰项链 | E1753: 392
A1754: 201033 | B1754: 33 | C1754: 本服1层尸王 | D1754: 烈焰戒指 | E1754: 392
A1755: 201035 | B1755: 33 | C1755: 本服1层尸王 | D1755: 烈焰头盔 | E1755: 392
A1756: 201036 | B1756: 33 | C1756: 本服1层尸王 | D1756: 烈焰护腕 | E1756: 392
A1757: 201037 | B1757: 33 | C1757: 本服1层尸王 | D1757: 烈焰腰带 | E1757: 392
A1758: 201039 | B1758: 33 | C1758: 本服1层尸王 | D1758: 烈焰魔靴 | E1758: 392
A1759: 110109 | B1759: 33 | C1759: 本服1层尸王 | D1759: 金刚石 | E1759: 406
A1760: 200030 | B1760: 34 | C1760: 本服1层奥玛 | D1760: 开天战刃 | E1760: 392
A1761: 200031 | B1761: 34 | C1761: 本服1层奥玛 | D1761: 雷霆重甲 | E1761: 392
A1762: 200032 | B1762: 34 | C1762: 本服1层奥玛 | D1762: 雷霆项链 | E1762: 392
A1763: 200033 | B1763: 34 | C1763: 本服1层奥玛 | D1763: 雷霆戒指 | E1763: 392
A1764: 200035 | B1764: 34 | C1764: 本服1层奥玛 | D1764: 雷霆头盔 | E1764: 392
A1765: 200036 | B1765: 34 | C1765: 本服1层奥玛 | D1765: 雷霆护腕 | E1765: 392
A1766: 200037 | B1766: 34 | C1766: 本服1层奥玛 | D1766: 雷霆腰带 | E1766: 392
A1767: 200039 | B1767: 34 | C1767: 本服1层奥玛 | D1767: 雷霆战靴 | E1767: 392
A1768: 202030 | B1768: 34 | C1768: 本服1层奥玛 | D1768: 玄天道剑 | E1768: 392
A1769: 202031 | B1769: 34 | C1769: 本服1层奥玛 | D1769: 光芒道袍 | E1769: 392
A1770: 202032 | B1770: 34 | C1770: 本服1层奥玛 | D1770: 光芒道链 | E1770: 392
A1771: 202033 | B1771: 34 | C1771: 本服1层奥玛 | D1771: 光芒道戒 | E1771: 392
A1772: 202035 | B1772: 34 | C1772: 本服1层奥玛 | D1772: 光芒头盔 | E1772: 392
A1773: 202036 | B1773: 34 | C1773: 本服1层奥玛 | D1773: 光芒护腕 | E1773: 392
A1774: 202037 | B1774: 34 | C1774: 本服1层奥玛 | D1774: 光芒腰带 | E1774: 392
A1775: 202039 | B1775: 34 | C1775: 本服1层奥玛 | D1775: 光芒道靴 | E1775: 392
A1776: 201030 | B1776: 34 | C1776: 本服1层奥玛 | D1776: 震天魔剑 | E1776: 392
A1777: 201031 | B1777: 34 | C1777: 本服1层奥玛 | D1777: 烈焰披风 | E1777: 392
A1778: 201032 | B1778: 34 | C1778: 本服1层奥玛 | D1778: 烈焰项链 | E1778: 392
A1779: 201033 | B1779: 34 | C1779: 本服1层奥玛 | D1779: 烈焰戒指 | E1779: 392
A1780: 201035 | B1780: 34 | C1780: 本服1层奥玛 | D1780: 烈焰头盔 | E1780: 392
A1781: 201036 | B1781: 34 | C1781: 本服1层奥玛 | D1781: 烈焰护腕 | E1781: 392
A1782: 201037 | B1782: 34 | C1782: 本服1层奥玛 | D1782: 烈焰腰带 | E1782: 392
A1783: 201039 | B1783: 34 | C1783: 本服1层奥玛 | D1783: 烈焰魔靴 | E1783: 392
A1784: 110109 | B1784: 34 | C1784: 本服1层奥玛 | D1784: 金刚石 | E1784: 407
A1785: 200030 | B1785: 35 | C1785: 本服1层白野猪 | D1785: 开天战刃 | E1785: 392
A1786: 200031 | B1786: 35 | C1786: 本服1层白野猪 | D1786: 雷霆重甲 | E1786: 392
A1787: 200032 | B1787: 35 | C1787: 本服1层白野猪 | D1787: 雷霆项链 | E1787: 392
A1788: 200033 | B1788: 35 | C1788: 本服1层白野猪 | D1788: 雷霆戒指 | E1788: 392
A1789: 200035 | B1789: 35 | C1789: 本服1层白野猪 | D1789: 雷霆头盔 | E1789: 392
A1790: 200036 | B1790: 35 | C1790: 本服1层白野猪 | D1790: 雷霆护腕 | E1790: 392
A1791: 200037 | B1791: 35 | C1791: 本服1层白野猪 | D1791: 雷霆腰带 | E1791: 392
A1792: 200039 | B1792: 35 | C1792: 本服1层白野猪 | D1792: 雷霆战靴 | E1792: 392
A1793: 202030 | B1793: 35 | C1793: 本服1层白野猪 | D1793: 玄天道剑 | E1793: 392
A1794: 202031 | B1794: 35 | C1794: 本服1层白野猪 | D1794: 光芒道袍 | E1794: 392
A1795: 202032 | B1795: 35 | C1795: 本服1层白野猪 | D1795: 光芒道链 | E1795: 392
A1796: 202033 | B1796: 35 | C1796: 本服1层白野猪 | D1796: 光芒道戒 | E1796: 392
A1797: 202035 | B1797: 35 | C1797: 本服1层白野猪 | D1797: 光芒头盔 | E1797: 392
A1798: 202036 | B1798: 35 | C1798: 本服1层白野猪 | D1798: 光芒护腕 | E1798: 392
A1799: 202037 | B1799: 35 | C1799: 本服1层白野猪 | D1799: 光芒腰带 | E1799: 392
A1800: 202039 | B1800: 35 | C1800: 本服1层白野猪 | D1800: 光芒道靴 | E1800: 392
A1801: 201030 | B1801: 35 | C1801: 本服1层白野猪 | D1801: 震天魔剑 | E1801: 392
A1802: 201031 | B1802: 35 | C1802: 本服1层白野猪 | D1802: 烈焰披风 | E1802: 392
A1803: 201032 | B1803: 35 | C1803: 本服1层白野猪 | D1803: 烈焰项链 | E1803: 392
A1804: 201033 | B1804: 35 | C1804: 本服1层白野猪 | D1804: 烈焰戒指 | E1804: 392
A1805: 201035 | B1805: 35 | C1805: 本服1层白野猪 | D1805: 烈焰头盔 | E1805: 392
A1806: 201036 | B1806: 35 | C1806: 本服1层白野猪 | D1806: 烈焰护腕 | E1806: 392
A1807: 201037 | B1807: 35 | C1807: 本服1层白野猪 | D1807: 烈焰腰带 | E1807: 392
A1808: 201039 | B1808: 35 | C1808: 本服1层白野猪 | D1808: 烈焰魔靴 | E1808: 392
A1809: 110109 | B1809: 35 | C1809: 本服1层白野猪 | D1809: 金刚石 | E1809: 408
A1810: 200060 | B1810: 36 | C1810: 本服2层女妖 | D1810: 混沌 | E1810: 393
A1811: 200061 | B1811: 36 | C1811: 本服2层女妖 | D1811: 白虎战甲 | E1811: 393
A1812: 200062 | B1812: 36 | C1812: 本服2层女妖 | D1812: 白虎头盔 | E1812: 393
A1813: 200063 | B1813: 36 | C1813: 本服2层女妖 | D1813: 白虎项链 | E1813: 393
A1814: 200065 | B1814: 36 | C1814: 本服2层女妖 | D1814: 白虎手镯 | E1814: 393
A1815: 200066 | B1815: 36 | C1815: 本服2层女妖 | D1815: 白虎戒指 | E1815: 393
A1816: 200067 | B1816: 36 | C1816: 本服2层女妖 | D1816: 白虎腰带 | E1816: 393
A1817: 200069 | B1817: 36 | C1817: 本服2层女妖 | D1817: 白虎战靴 | E1817: 393
A1818: 201060 | B1818: 36 | C1818: 本服2层女妖 | D1818: 狂龙 | E1818: 393
A1819: 201061 | B1819: 36 | C1819: 本服2层女妖 | D1819: 朱雀披风 | E1819: 393
A1820: 201062 | B1820: 36 | C1820: 本服2层女妖 | D1820: 朱雀头盔 | E1820: 393
A1821: 201063 | B1821: 36 | C1821: 本服2层女妖 | D1821: 朱雀项链 | E1821: 393
A1822: 201065 | B1822: 36 | C1822: 本服2层女妖 | D1822: 朱雀手镯 | E1822: 393
A1823: 201066 | B1823: 36 | C1823: 本服2层女妖 | D1823: 朱雀戒指 | E1823: 393
A1824: 201067 | B1824: 36 | C1824: 本服2层女妖 | D1824: 朱雀腰带 | E1824: 393
A1825: 201069 | B1825: 36 | C1825: 本服2层女妖 | D1825: 朱雀魔靴 | E1825: 393
A1826: 202060 | B1826: 36 | C1826: 本服2层女妖 | D1826: 天蛇 | E1826: 393
A1827: 202061 | B1827: 36 | C1827: 本服2层女妖 | D1827: 青龙道袍 | E1827: 393
A1828: 202062 | B1828: 36 | C1828: 本服2层女妖 | D1828: 青龙头盔 | E1828: 393
A1829: 202063 | B1829: 36 | C1829: 本服2层女妖 | D1829: 青龙项链 | E1829: 393
A1830: 202065 | B1830: 36 | C1830: 本服2层女妖 | D1830: 青龙手镯 | E1830: 393
A1831: 202066 | B1831: 36 | C1831: 本服2层女妖 | D1831: 青龙戒指 | E1831: 393
A1832: 202067 | B1832: 36 | C1832: 本服2层女妖 | D1832: 青龙腰带 | E1832: 393
A1833: 202069 | B1833: 36 | C1833: 本服2层女妖 | D1833: 青龙道靴 | E1833: 393
A1834: 110163 | B1834: 36 | C1834: 本服2层女妖 | D1834: 上古神石 | E1834: 410
A1835: 200060 | B1835: 37 | C1835: 本服2层领主 | D1835: 混沌 | E1835: 393
A1836: 200061 | B1836: 37 | C1836: 本服2层领主 | D1836: 白虎战甲 | E1836: 393
A1837: 200062 | B1837: 37 | C1837: 本服2层领主 | D1837: 白虎头盔 | E1837: 393
A1838: 200063 | B1838: 37 | C1838: 本服2层领主 | D1838: 白虎项链 | E1838: 393
A1839: 200065 | B1839: 37 | C1839: 本服2层领主 | D1839: 白虎手镯 | E1839: 393
A1840: 200066 | B1840: 37 | C1840: 本服2层领主 | D1840: 白虎戒指 | E1840: 393
A1841: 200067 | B1841: 37 | C1841: 本服2层领主 | D1841: 白虎腰带 | E1841: 393
A1842: 200069 | B1842: 37 | C1842: 本服2层领主 | D1842: 白虎战靴 | E1842: 393
A1843: 201060 | B1843: 37 | C1843: 本服2层领主 | D1843: 狂龙 | E1843: 393
A1844: 201061 | B1844: 37 | C1844: 本服2层领主 | D1844: 朱雀披风 | E1844: 393
A1845: 201062 | B1845: 37 | C1845: 本服2层领主 | D1845: 朱雀头盔 | E1845: 393
A1846: 201063 | B1846: 37 | C1846: 本服2层领主 | D1846: 朱雀项链 | E1846: 393
A1847: 201065 | B1847: 37 | C1847: 本服2层领主 | D1847: 朱雀手镯 | E1847: 393
A1848: 201066 | B1848: 37 | C1848: 本服2层领主 | D1848: 朱雀戒指 | E1848: 393
A1849: 201067 | B1849: 37 | C1849: 本服2层领主 | D1849: 朱雀腰带 | E1849: 393
A1850: 201069 | B1850: 37 | C1850: 本服2层领主 | D1850: 朱雀魔靴 | E1850: 393
A1851: 202060 | B1851: 37 | C1851: 本服2层领主 | D1851: 天蛇 | E1851: 393
A1852: 202061 | B1852: 37 | C1852: 本服2层领主 | D1852: 青龙道袍 | E1852: 393
A1853: 202062 | B1853: 37 | C1853: 本服2层领主 | D1853: 青龙头盔 | E1853: 393
A1854: 202063 | B1854: 37 | C1854: 本服2层领主 | D1854: 青龙项链 | E1854: 393
A1855: 202065 | B1855: 37 | C1855: 本服2层领主 | D1855: 青龙手镯 | E1855: 393
A1856: 202066 | B1856: 37 | C1856: 本服2层领主 | D1856: 青龙戒指 | E1856: 393
A1857: 202067 | B1857: 37 | C1857: 本服2层领主 | D1857: 青龙腰带 | E1857: 393
A1858: 202069 | B1858: 37 | C1858: 本服2层领主 | D1858: 青龙道靴 | E1858: 393
A1859: 110163 | B1859: 37 | C1859: 本服2层领主 | D1859: 上古神石 | E1859: 411
A1860: 200060 | B1860: 38 | C1860: 本服2层虹魔 | D1860: 混沌 | E1860: 393
A1861: 200061 | B1861: 38 | C1861: 本服2层虹魔 | D1861: 白虎战甲 | E1861: 393
A1862: 200062 | B1862: 38 | C1862: 本服2层虹魔 | D1862: 白虎头盔 | E1862: 393
A1863: 200063 | B1863: 38 | C1863: 本服2层虹魔 | D1863: 白虎项链 | E1863: 393
A1864: 200065 | B1864: 38 | C1864: 本服2层虹魔 | D1864: 白虎手镯 | E1864: 393
A1865: 200066 | B1865: 38 | C1865: 本服2层虹魔 | D1865: 白虎戒指 | E1865: 393
A1866: 200067 | B1866: 38 | C1866: 本服2层虹魔 | D1866: 白虎腰带 | E1866: 393
A1867: 200069 | B1867: 38 | C1867: 本服2层虹魔 | D1867: 白虎战靴 | E1867: 393
A1868: 201060 | B1868: 38 | C1868: 本服2层虹魔 | D1868: 狂龙 | E1868: 393
A1869: 201061 | B1869: 38 | C1869: 本服2层虹魔 | D1869: 朱雀披风 | E1869: 393
A1870: 201062 | B1870: 38 | C1870: 本服2层虹魔 | D1870: 朱雀头盔 | E1870: 393
A1871: 201063 | B1871: 38 | C1871: 本服2层虹魔 | D1871: 朱雀项链 | E1871: 393
A1872: 201065 | B1872: 38 | C1872: 本服2层虹魔 | D1872: 朱雀手镯 | E1872: 393
A1873: 201066 | B1873: 38 | C1873: 本服2层虹魔 | D1873: 朱雀戒指 | E1873: 393
A1874: 201067 | B1874: 38 | C1874: 本服2层虹魔 | D1874: 朱雀腰带 | E1874: 393
A1875: 201069 | B1875: 38 | C1875: 本服2层虹魔 | D1875: 朱雀魔靴 | E1875: 393
A1876: 202060 | B1876: 38 | C1876: 本服2层虹魔 | D1876: 天蛇 | E1876: 393
A1877: 202061 | B1877: 38 | C1877: 本服2层虹魔 | D1877: 青龙道袍 | E1877: 393
A1878: 202062 | B1878: 38 | C1878: 本服2层虹魔 | D1878: 青龙头盔 | E1878: 393
A1879: 202063 | B1879: 38 | C1879: 本服2层虹魔 | D1879: 青龙项链 | E1879: 393
A1880: 202065 | B1880: 38 | C1880: 本服2层虹魔 | D1880: 青龙手镯 | E1880: 393
A1881: 202066 | B1881: 38 | C1881: 本服2层虹魔 | D1881: 青龙戒指 | E1881: 393
A1882: 202067 | B1882: 38 | C1882: 本服2层虹魔 | D1882: 青龙腰带 | E1882: 393
A1883: 202069 | B1883: 38 | C1883: 本服2层虹魔 | D1883: 青龙道靴 | E1883: 393
A1884: 110163 | B1884: 38 | C1884: 本服2层虹魔 | D1884: 上古神石 | E1884: 412
A1885: 200060 | B1885: 39 | C1885: 本服2层牛魔 | D1885: 混沌 | E1885: 393
A1886: 200061 | B1886: 39 | C1886: 本服2层牛魔 | D1886: 白虎战甲 | E1886: 393
A1887: 200062 | B1887: 39 | C1887: 本服2层牛魔 | D1887: 白虎头盔 | E1887: 393
A1888: 200063 | B1888: 39 | C1888: 本服2层牛魔 | D1888: 白虎项链 | E1888: 393
A1889: 200065 | B1889: 39 | C1889: 本服2层牛魔 | D1889: 白虎手镯 | E1889: 393
A1890: 200066 | B1890: 39 | C1890: 本服2层牛魔 | D1890: 白虎戒指 | E1890: 393
A1891: 200067 | B1891: 39 | C1891: 本服2层牛魔 | D1891: 白虎腰带 | E1891: 393
A1892: 200069 | B1892: 39 | C1892: 本服2层牛魔 | D1892: 白虎战靴 | E1892: 393
A1893: 201060 | B1893: 39 | C1893: 本服2层牛魔 | D1893: 狂龙 | E1893: 393
A1894: 201061 | B1894: 39 | C1894: 本服2层牛魔 | D1894: 朱雀披风 | E1894: 393
A1895: 201062 | B1895: 39 | C1895: 本服2层牛魔 | D1895: 朱雀头盔 | E1895: 393
A1896: 201063 | B1896: 39 | C1896: 本服2层牛魔 | D1896: 朱雀项链 | E1896: 393
A1897: 201065 | B1897: 39 | C1897: 本服2层牛魔 | D1897: 朱雀手镯 | E1897: 393
A1898: 201066 | B1898: 39 | C1898: 本服2层牛魔 | D1898: 朱雀戒指 | E1898: 393
A1899: 201067 | B1899: 39 | C1899: 本服2层牛魔 | D1899: 朱雀腰带 | E1899: 393
A1900: 201069 | B1900: 39 | C1900: 本服2层牛魔 | D1900: 朱雀魔靴 | E1900: 393
A1901: 202060 | B1901: 39 | C1901: 本服2层牛魔 | D1901: 天蛇 | E1901: 393
A1902: 202061 | B1902: 39 | C1902: 本服2层牛魔 | D1902: 青龙道袍 | E1902: 393
A1903: 202062 | B1903: 39 | C1903: 本服2层牛魔 | D1903: 青龙头盔 | E1903: 393
A1904: 202063 | B1904: 39 | C1904: 本服2层牛魔 | D1904: 青龙项链 | E1904: 393
A1905: 202065 | B1905: 39 | C1905: 本服2层牛魔 | D1905: 青龙手镯 | E1905: 393
A1906: 202066 | B1906: 39 | C1906: 本服2层牛魔 | D1906: 青龙戒指 | E1906: 393
A1907: 202067 | B1907: 39 | C1907: 本服2层牛魔 | D1907: 青龙腰带 | E1907: 393
A1908: 202069 | B1908: 39 | C1908: 本服2层牛魔 | D1908: 青龙道靴 | E1908: 393
A1909: 110163 | B1909: 39 | C1909: 本服2层牛魔 | D1909: 上古神石 | E1909: 413
A1910: 200060 | B1910: 40 | C1910: 本服2层鱼人 | D1910: 混沌 | E1910: 393
A1911: 200061 | B1911: 40 | C1911: 本服2层鱼人 | D1911: 白虎战甲 | E1911: 393
A1912: 200062 | B1912: 40 | C1912: 本服2层鱼人 | D1912: 白虎头盔 | E1912: 393
A1913: 200063 | B1913: 40 | C1913: 本服2层鱼人 | D1913: 白虎项链 | E1913: 393
A1914: 200065 | B1914: 40 | C1914: 本服2层鱼人 | D1914: 白虎手镯 | E1914: 393
A1915: 200066 | B1915: 40 | C1915: 本服2层鱼人 | D1915: 白虎戒指 | E1915: 393
A1916: 200067 | B1916: 40 | C1916: 本服2层鱼人 | D1916: 白虎腰带 | E1916: 393
A1917: 200069 | B1917: 40 | C1917: 本服2层鱼人 | D1917: 白虎战靴 | E1917: 393
A1918: 201060 | B1918: 40 | C1918: 本服2层鱼人 | D1918: 狂龙 | E1918: 393
A1919: 201061 | B1919: 40 | C1919: 本服2层鱼人 | D1919: 朱雀披风 | E1919: 393
A1920: 201062 | B1920: 40 | C1920: 本服2层鱼人 | D1920: 朱雀头盔 | E1920: 393
A1921: 201063 | B1921: 40 | C1921: 本服2层鱼人 | D1921: 朱雀项链 | E1921: 393
A1922: 201065 | B1922: 40 | C1922: 本服2层鱼人 | D1922: 朱雀手镯 | E1922: 393
A1923: 201066 | B1923: 40 | C1923: 本服2层鱼人 | D1923: 朱雀戒指 | E1923: 393
A1924: 201067 | B1924: 40 | C1924: 本服2层鱼人 | D1924: 朱雀腰带 | E1924: 393
A1925: 201069 | B1925: 40 | C1925: 本服2层鱼人 | D1925: 朱雀魔靴 | E1925: 393
A1926: 202060 | B1926: 40 | C1926: 本服2层鱼人 | D1926: 天蛇 | E1926: 393
A1927: 202061 | B1927: 40 | C1927: 本服2层鱼人 | D1927: 青龙道袍 | E1927: 393
A1928: 202062 | B1928: 40 | C1928: 本服2层鱼人 | D1928: 青龙头盔 | E1928: 393
A1929: 202063 | B1929: 40 | C1929: 本服2层鱼人 | D1929: 青龙项链 | E1929: 393
A1930: 202065 | B1930: 40 | C1930: 本服2层鱼人 | D1930: 青龙手镯 | E1930: 393
A1931: 202066 | B1931: 40 | C1931: 本服2层鱼人 | D1931: 青龙戒指 | E1931: 393
A1932: 202067 | B1932: 40 | C1932: 本服2层鱼人 | D1932: 青龙腰带 | E1932: 393
A1933: 202069 | B1933: 40 | C1933: 本服2层鱼人 | D1933: 青龙道靴 | E1933: 393
A1934: 110163 | B1934: 40 | C1934: 本服2层鱼人 | D1934: 上古神石 | E1934: 414
A1935: 200060 | B1935: 41 | C1935: 本服2层蟹 | D1935: 混沌 | E1935: 393
A1936: 200061 | B1936: 41 | C1936: 本服2层蟹 | D1936: 白虎战甲 | E1936: 393
A1937: 200062 | B1937: 41 | C1937: 本服2层蟹 | D1937: 白虎头盔 | E1937: 393
A1938: 200063 | B1938: 41 | C1938: 本服2层蟹 | D1938: 白虎项链 | E1938: 393
A1939: 200065 | B1939: 41 | C1939: 本服2层蟹 | D1939: 白虎手镯 | E1939: 393
A1940: 200066 | B1940: 41 | C1940: 本服2层蟹 | D1940: 白虎戒指 | E1940: 393
A1941: 200067 | B1941: 41 | C1941: 本服2层蟹 | D1941: 白虎腰带 | E1941: 393
A1942: 200069 | B1942: 41 | C1942: 本服2层蟹 | D1942: 白虎战靴 | E1942: 393
A1943: 201060 | B1943: 41 | C1943: 本服2层蟹 | D1943: 狂龙 | E1943: 393
A1944: 201061 | B1944: 41 | C1944: 本服2层蟹 | D1944: 朱雀披风 | E1944: 393
A1945: 201062 | B1945: 41 | C1945: 本服2层蟹 | D1945: 朱雀头盔 | E1945: 393
A1946: 201063 | B1946: 41 | C1946: 本服2层蟹 | D1946: 朱雀项链 | E1946: 393
A1947: 201065 | B1947: 41 | C1947: 本服2层蟹 | D1947: 朱雀手镯 | E1947: 393
A1948: 201066 | B1948: 41 | C1948: 本服2层蟹 | D1948: 朱雀戒指 | E1948: 393
A1949: 201067 | B1949: 41 | C1949: 本服2层蟹 | D1949: 朱雀腰带 | E1949: 393
A1950: 201069 | B1950: 41 | C1950: 本服2层蟹 | D1950: 朱雀魔靴 | E1950: 393
A1951: 202060 | B1951: 41 | C1951: 本服2层蟹 | D1951: 天蛇 | E1951: 393
A1952: 202061 | B1952: 41 | C1952: 本服2层蟹 | D1952: 青龙道袍 | E1952: 393
A1953: 202062 | B1953: 41 | C1953: 本服2层蟹 | D1953: 青龙头盔 | E1953: 393
A1954: 202063 | B1954: 41 | C1954: 本服2层蟹 | D1954: 青龙项链 | E1954: 393
A1955: 202065 | B1955: 41 | C1955: 本服2层蟹 | D1955: 青龙手镯 | E1955: 393
A1956: 202066 | B1956: 41 | C1956: 本服2层蟹 | D1956: 青龙戒指 | E1956: 393
A1957: 202067 | B1957: 41 | C1957: 本服2层蟹 | D1957: 青龙腰带 | E1957: 393
A1958: 202069 | B1958: 41 | C1958: 本服2层蟹 | D1958: 青龙道靴 | E1958: 393
A1959: 110163 | B1959: 41 | C1959: 本服2层蟹 | D1959: 上古神石 | E1959: 415
A1960: 110304 | B1960: 42 | C1960: 幻境之地BOSS | D1960: 赤炼魂石 | E1960: 416
A1961: 110319 | B1961: 42 | C1961: 幻境之地BOSS | D1961: 幻境钥匙 | E1961: 417
A1962: 110163 | B1962: 42 | C1962: 幻境之地BOSS | D1962: 上古神石 | E1962: 418
A1963: 110109 | B1963: 43 | C1963: 本服幻境之地BOSS | D1963: 金刚石 | E1963: 419
A1964: 110294 | B1964: 44 | C1964: 魔龙岭精英 | D1964: 女娲神石 | E1964: 420
A1965: 110163 | B1965: 44 | C1965: 魔龙岭精英 | D1965: 上古神石 | E1965: 421
A1966: 110320 | B1966: 44 | C1966: 魔龙岭精英 | D1966: 王者卷轴 | E1966: 422
A1967: 110109 | B1967: 45 | C1967: 地宫1层小怪 | D1967: 金刚石 | E1967: 423
A1968: 110163 | B1968: 45 | C1968: 地宫1层小怪 | D1968: 上古神石 | E1968: 424
A1969: 110294 | B1969: 45 | C1969: 地宫1层小怪 | D1969: 女娲神石 | E1969: 424
A1970: 110320 | B1970: 45 | C1970: 地宫1层小怪 | D1970: 王者卷轴 | E1970: 432
A1971: 110163 | B1971: 46 | C1971: 地宫2层小怪 | D1971: 上古神石 | E1971: 425
A1972: 110294 | B1972: 46 | C1972: 地宫2层小怪 | D1972: 女娲神石 | E1972: 426
A1973: 110320 | B1973: 46 | C1973: 地宫2层小怪 | D1973: 王者卷轴 | E1973: 432
A1974: 110163 | B1974: 47 | C1974: 地宫3层小怪 | D1974: 上古神石 | E1974: 425
A1975: 110294 | B1975: 47 | C1975: 地宫3层小怪 | D1975: 女娲神石 | E1975: 427
A1976: 110320 | B1976: 47 | C1976: 地宫3层小怪 | D1976: 王者卷轴 | E1976: 428
A1977: 110163 | B1977: 48 | C1977: 地宫4层小怪 | D1977: 上古神石 | E1977: 425
A1978: 110294 | B1978: 48 | C1978: 地宫4层小怪 | D1978: 女娲神石 | E1978: 429
A1979: 110320 | B1979: 48 | C1979: 地宫4层小怪 | D1979: 王者卷轴 | E1979: 432

Sheet: 工作表2
B3: <font color='0xffffff' size='20' opacity='255'>hhghgg</font> | D3: 1 | E3: 野外小怪
D4: 2 | E4: 精英怪 | I4: 麻痹戒指 | J4: 166
D5: 3 | E5: 骷髅精灵 | I5: 护身戒指 | J5: 166
D6: 4 | E6: 铁甲尸王 | I6: 复活戒指 | J6: 166
D7: 5 | E7: 奥玛教主
D8: 6 | E8: 邪恶触龙
D9: 7 | E9: 白野猪王
D10: 8 | E10: 祖玛教主
D11: 9 | E11: 赤月老魔
D12: 10 | E12: 巨型多角虫
D13: 11 | E13: 巨型钳虫
D14: 12 | E14: 巨型双头恶魔
D15: 13 | E15: 海底BOSS1
D16: 14 | E16: 海底BOSS2
D17: 15 | E17: 牛魔BOSS1
D18: 16 | E18: 牛魔BOSS2
A21: 此处掉落分类对应special_drop_type的掉落类型
A23: 怪物掉落类型对应monster上的特殊掉落类型