Sheet: 强化概率配置表
A1: key | B1: goods_id | D1: stren_lv | E1: rate
A2: key | B2: goods_id | C2: 策划用 | D2: stren_lv | E2: rate
A3: 递增id | B3: 强化石id | C3: 名字 | D3: 对应强化等级 | E3: 对应加成概率
A4: 1 | B4: 110079 | C4: 黑铁矿+1 | D4: 1 | E4: 2000
A5: 2 | B5: 110080 | C5: 黑铁矿+2 | D5: 1 | E5: 4000
A6: 3 | B6: 110081 | C6: 黑铁矿+3 | D6: 1 | E6: 8000
A7: 4 | B7: 110082 | C7: 黑铁矿+4 | D7: 1 | E7: 10000
A8: 5 | B8: 110083 | C8: 黑铁矿+5 | D8: 1 | E8: 10000
A9: 6 | B9: 110084 | C9: 黑铁矿+6 | D9: 1 | E9: 10000
A10: 7 | B10: 110085 | C10: 黑铁矿+7 | D10: 1 | E10: 10000
A11: 8 | B11: 110086 | C11: 黑铁矿+8 | D11: 1 | E11: 10000
A12: 9 | B12: 110087 | C12: 黑铁矿+9 | D12: 1 | E12: 10000
A13: 10 | B13: 110088 | C13: 黑铁矿+10 | D13: 1 | E13: 10000
A14: 11 | B14: 110089 | C14: 玄冰铁+1 | D14: 11 | E14: 2000
A15: 12 | B15: 110090 | C15: 玄冰铁+2 | D15: 11 | E15: 4000
A16: 13 | B16: 110091 | C16: 玄冰铁+3 | D16: 11 | E16: 8000
A17: 14 | B17: 110092 | C17: 玄冰铁+4 | D17: 11 | E17: 10000
A18: 15 | B18: 110093 | C18: 玄冰铁+5 | D18: 11 | E18: 10000
A19: 16 | B19: 110094 | C19: 玄冰铁+6 | D19: 11 | E19: 10000
A20: 17 | B20: 110095 | C20: 玄冰铁+7 | D20: 11 | E20: 10000
A21: 18 | B21: 110096 | C21: 玄冰铁+8 | D21: 11 | E21: 10000
A22: 19 | B22: 110097 | C22: 玄冰铁+9 | D22: 11 | E22: 10000
A23: 20 | B23: 110098 | C23: 玄冰铁+10 | D23: 11 | E23: 10000
A24: 21 | B24: 110099 | C24: 紫水晶+1 | D24: 21 | E24: 2000
A25: 22 | B25: 110100 | C25: 紫水晶+2 | D25: 21 | E25: 4000
A26: 23 | B26: 110101 | C26: 紫水晶+3 | D26: 21 | E26: 8000
A27: 24 | B27: 110102 | C27: 紫水晶+4 | D27: 21 | E27: 10000
A28: 25 | B28: 110103 | C28: 紫水晶+5 | D28: 21 | E28: 10000
A29: 26 | B29: 110104 | C29: 紫水晶+6 | D29: 21 | E29: 10000
A30: 27 | B30: 110105 | C30: 紫水晶+7 | D30: 21 | E30: 10000
A31: 28 | B31: 110106 | C31: 紫水晶+8 | D31: 21 | E31: 10000
A32: 29 | B32: 110107 | C32: 紫水晶+9 | D32: 21 | E32: 10000
A33: 30 | B33: 110108 | C33: 紫水晶+10 | D33: 21 | E33: 10000
A34: 31 | B34: =R[-30]C -> 110079 | C34: 黑铁矿+1 | D34: =R[-30]C+1 -> 2 | E34: 1000
A35: 32 | B35: =R[-30]C -> 110080 | C35: 黑铁矿+2 | D35: =R[-30]C+1 -> 2 | E35: 2000
A36: 33 | B36: =R[-30]C -> 110081 | C36: 黑铁矿+3 | D36: =R[-30]C+1 -> 2 | E36: 4000
A37: 34 | B37: =R[-30]C -> 110082 | C37: 黑铁矿+4 | D37: =R[-30]C+1 -> 2 | E37: 8000
A38: 35 | B38: =R[-30]C -> 110083 | C38: 黑铁矿+5 | D38: =R[-30]C+1 -> 2 | E38: 10000
A39: 36 | B39: =R[-30]C -> 110084 | C39: 黑铁矿+6 | D39: =R[-30]C+1 -> 2 | E39: 10000
A40: 37 | B40: =R[-30]C -> 110085 | C40: 黑铁矿+7 | D40: =R[-30]C+1 -> 2 | E40: 10000
A41: 38 | B41: =R[-30]C -> 110086 | C41: 黑铁矿+8 | D41: =R[-30]C+1 -> 2 | E41: 10000
A42: 39 | B42: =R[-30]C -> 110087 | C42: 黑铁矿+9 | D42: =R[-30]C+1 -> 2 | E42: 10000
A43: 40 | B43: =R[-30]C -> 110088 | C43: 黑铁矿+10 | D43: =R[-30]C+1 -> 2 | E43: 10000
A44: 41 | B44: =R[-30]C -> 110089 | C44: 玄冰铁+1 | D44: =R[-30]C+1 -> 12 | E44: 1000
A45: 42 | B45: =R[-30]C -> 110090 | C45: 玄冰铁+2 | D45: =R[-30]C+1 -> 12 | E45: 2000
A46: 43 | B46: =R[-30]C -> 110091 | C46: 玄冰铁+3 | D46: =R[-30]C+1 -> 12 | E46: 4000
A47: 44 | B47: =R[-30]C -> 110092 | C47: 玄冰铁+4 | D47: =R[-30]C+1 -> 12 | E47: 8000
A48: 45 | B48: =R[-30]C -> 110093 | C48: 玄冰铁+5 | D48: =R[-30]C+1 -> 12 | E48: 10000
A49: 46 | B49: =R[-30]C -> 110094 | C49: 玄冰铁+6 | D49: =R[-30]C+1 -> 12 | E49: 10000
A50: 47 | B50: =R[-30]C -> 110095 | C50: 玄冰铁+7 | D50: =R[-30]C+1 -> 12 | E50: 10000
A51: 48 | B51: =R[-30]C -> 110096 | C51: 玄冰铁+8 | D51: =R[-30]C+1 -> 12 | E51: 10000
A52: 49 | B52: =R[-30]C -> 110097 | C52: 玄冰铁+9 | D52: =R[-30]C+1 -> 12 | E52: 10000
A53: 50 | B53: =R[-30]C -> 110098 | C53: 玄冰铁+10 | D53: =R[-30]C+1 -> 12 | E53: 10000
A54: 51 | B54: =R[-30]C -> 110099 | C54: 紫水晶+1 | D54: =R[-30]C+1 -> 22 | E54: 1000
A55: 52 | B55: =R[-30]C -> 110100 | C55: 紫水晶+2 | D55: =R[-30]C+1 -> 22 | E55: 2000
A56: 53 | B56: =R[-30]C -> 110101 | C56: 紫水晶+3 | D56: =R[-30]C+1 -> 22 | E56: 4000
A57: 54 | B57: =R[-30]C -> 110102 | C57: 紫水晶+4 | D57: =R[-30]C+1 -> 22 | E57: 8000
A58: 55 | B58: =R[-30]C -> 110103 | C58: 紫水晶+5 | D58: =R[-30]C+1 -> 22 | E58: 10000
A59: 56 | B59: =R[-30]C -> 110104 | C59: 紫水晶+6 | D59: =R[-30]C+1 -> 22 | E59: 10000
A60: 57 | B60: =R[-30]C -> 110105 | C60: 紫水晶+7 | D60: =R[-30]C+1 -> 22 | E60: 10000
A61: 58 | B61: =R[-30]C -> 110106 | C61: 紫水晶+8 | D61: =R[-30]C+1 -> 22 | E61: 10000
A62: 59 | B62: =R[-30]C -> 110107 | C62: 紫水晶+9 | D62: =R[-30]C+1 -> 22 | E62: 10000
A63: 60 | B63: =R[-30]C -> 110108 | C63: 紫水晶+10 | D63: =R[-30]C+1 -> 22 | E63: 10000
A64: 61 | B64: =R[-30]C -> 110079 | C64: 黑铁矿+1 | D64: =R[-30]C+1 -> 3 | E64: 500
A65: 62 | B65: =R[-30]C -> 110080 | C65: 黑铁矿+2 | D65: =R[-30]C+1 -> 3 | E65: 1000
A66: 63 | B66: =R[-30]C -> 110081 | C66: 黑铁矿+3 | D66: =R[-30]C+1 -> 3 | E66: 2000
A67: 64 | B67: =R[-30]C -> 110082 | C67: 黑铁矿+4 | D67: =R[-30]C+1 -> 3 | E67: 4000
A68: 65 | B68: =R[-30]C -> 110083 | C68: 黑铁矿+5 | D68: =R[-30]C+1 -> 3 | E68: 8000
A69: 66 | B69: =R[-30]C -> 110084 | C69: 黑铁矿+6 | D69: =R[-30]C+1 -> 3 | E69: 10000
A70: 67 | B70: =R[-30]C -> 110085 | C70: 黑铁矿+7 | D70: =R[-30]C+1 -> 3 | E70: 10000
A71: 68 | B71: =R[-30]C -> 110086 | C71: 黑铁矿+8 | D71: =R[-30]C+1 -> 3 | E71: 10000
A72: 69 | B72: =R[-30]C -> 110087 | C72: 黑铁矿+9 | D72: =R[-30]C+1 -> 3 | E72: 10000
A73: 70 | B73: =R[-30]C -> 110088 | C73: 黑铁矿+10 | D73: =R[-30]C+1 -> 3 | E73: 10000
A74: 71 | B74: =R[-30]C -> 110089 | C74: 玄冰铁+1 | D74: =R[-30]C+1 -> 13 | E74: 500
A75: 72 | B75: =R[-30]C -> 110090 | C75: 玄冰铁+2 | D75: =R[-30]C+1 -> 13 | E75: 1000
A76: 73 | B76: =R[-30]C -> 110091 | C76: 玄冰铁+3 | D76: =R[-30]C+1 -> 13 | E76: 2000
A77: 74 | B77: =R[-30]C -> 110092 | C77: 玄冰铁+4 | D77: =R[-30]C+1 -> 13 | E77: 4000
A78: 75 | B78: =R[-30]C -> 110093 | C78: 玄冰铁+5 | D78: =R[-30]C+1 -> 13 | E78: 8000
A79: 76 | B79: =R[-30]C -> 110094 | C79: 玄冰铁+6 | D79: =R[-30]C+1 -> 13 | E79: 10000
A80: 77 | B80: =R[-30]C -> 110095 | C80: 玄冰铁+7 | D80: =R[-30]C+1 -> 13 | E80: 10000
A81: 78 | B81: =R[-30]C -> 110096 | C81: 玄冰铁+8 | D81: =R[-30]C+1 -> 13 | E81: 10000
A82: 79 | B82: =R[-30]C -> 110097 | C82: 玄冰铁+9 | D82: =R[-30]C+1 -> 13 | E82: 10000
A83: 80 | B83: =R[-30]C -> 110098 | C83: 玄冰铁+10 | D83: =R[-30]C+1 -> 13 | E83: 10000
A84: 81 | B84: =R[-30]C -> 110099 | C84: 紫水晶+1 | D84: =R[-30]C+1 -> 23 | E84: 500
A85: 82 | B85: =R[-30]C -> 110100 | C85: 紫水晶+2 | D85: =R[-30]C+1 -> 23 | E85: 1000
A86: 83 | B86: =R[-30]C -> 110101 | C86: 紫水晶+3 | D86: =R[-30]C+1 -> 23 | E86: 2000
A87: 84 | B87: =R[-30]C -> 110102 | C87: 紫水晶+4 | D87: =R[-30]C+1 -> 23 | E87: 4000
A88: 85 | B88: =R[-30]C -> 110103 | C88: 紫水晶+5 | D88: =R[-30]C+1 -> 23 | E88: 8000
A89: 86 | B89: =R[-30]C -> 110104 | C89: 紫水晶+6 | D89: =R[-30]C+1 -> 23 | E89: 10000
A90: 87 | B90: =R[-30]C -> 110105 | C90: 紫水晶+7 | D90: =R[-30]C+1 -> 23 | E90: 10000
A91: 88 | B91: =R[-30]C -> 110106 | C91: 紫水晶+8 | D91: =R[-30]C+1 -> 23 | E91: 10000
A92: 89 | B92: =R[-30]C -> 110107 | C92: 紫水晶+9 | D92: =R[-30]C+1 -> 23 | E92: 10000
A93: 90 | B93: =R[-30]C -> 110108 | C93: 紫水晶+10 | D93: =R[-30]C+1 -> 23 | E93: 10000
A94: 91 | B94: =R[-30]C -> 110079 | C94: 黑铁矿+1 | D94: =R[-30]C+1 -> 4 | E94: 250
A95: 92 | B95: =R[-30]C -> 110080 | C95: 黑铁矿+2 | D95: =R[-30]C+1 -> 4 | E95: 500
A96: 93 | B96: =R[-30]C -> 110081 | C96: 黑铁矿+3 | D96: =R[-30]C+1 -> 4 | E96: 1000
A97: 94 | B97: =R[-30]C -> 110082 | C97: 黑铁矿+4 | D97: =R[-30]C+1 -> 4 | E97: 2000
A98: 95 | B98: =R[-30]C -> 110083 | C98: 黑铁矿+5 | D98: =R[-30]C+1 -> 4 | E98: 4000
A99: 96 | B99: =R[-30]C -> 110084 | C99: 黑铁矿+6 | D99: =R[-30]C+1 -> 4 | E99: 8000
A100: 97 | B100: =R[-30]C -> 110085 | C100: 黑铁矿+7 | D100: =R[-30]C+1 -> 4 | E100: 10000
A101: 98 | B101: =R[-30]C -> 110086 | C101: 黑铁矿+8 | D101: =R[-30]C+1 -> 4 | E101: 10000
A102: 99 | B102: =R[-30]C -> 110087 | C102: 黑铁矿+9 | D102: =R[-30]C+1 -> 4 | E102: 10000
A103: 100 | B103: =R[-30]C -> 110088 | C103: 黑铁矿+10 | D103: =R[-30]C+1 -> 4 | E103: 10000
A104: 101 | B104: =R[-30]C -> 110089 | C104: 玄冰铁+1 | D104: =R[-30]C+1 -> 14 | E104: 250
A105: 102 | B105: =R[-30]C -> 110090 | C105: 玄冰铁+2 | D105: =R[-30]C+1 -> 14 | E105: 500
A106: 103 | B106: =R[-30]C -> 110091 | C106: 玄冰铁+3 | D106: =R[-30]C+1 -> 14 | E106: 1000
A107: 104 | B107: =R[-30]C -> 110092 | C107: 玄冰铁+4 | D107: =R[-30]C+1 -> 14 | E107: 2000
A108: 105 | B108: =R[-30]C -> 110093 | C108: 玄冰铁+5 | D108: =R[-30]C+1 -> 14 | E108: 4000
A109: 106 | B109: =R[-30]C -> 110094 | C109: 玄冰铁+6 | D109: =R[-30]C+1 -> 14 | E109: 8000
A110: 107 | B110: =R[-30]C -> 110095 | C110: 玄冰铁+7 | D110: =R[-30]C+1 -> 14 | E110: 10000
A111: 108 | B111: =R[-30]C -> 110096 | C111: 玄冰铁+8 | D111: =R[-30]C+1 -> 14 | E111: 10000
A112: 109 | B112: =R[-30]C -> 110097 | C112: 玄冰铁+9 | D112: =R[-30]C+1 -> 14 | E112: 10000
A113: 110 | B113: =R[-30]C -> 110098 | C113: 玄冰铁+10 | D113: =R[-30]C+1 -> 14 | E113: 10000
A114: 111 | B114: =R[-30]C -> 110099 | C114: 紫水晶+1 | D114: =R[-30]C+1 -> 24 | E114: 250
A115: 112 | B115: =R[-30]C -> 110100 | C115: 紫水晶+2 | D115: =R[-30]C+1 -> 24 | E115: 500
A116: 113 | B116: =R[-30]C -> 110101 | C116: 紫水晶+3 | D116: =R[-30]C+1 -> 24 | E116: 1000
A117: 114 | B117: =R[-30]C -> 110102 | C117: 紫水晶+4 | D117: =R[-30]C+1 -> 24 | E117: 2000
A118: 115 | B118: =R[-30]C -> 110103 | C118: 紫水晶+5 | D118: =R[-30]C+1 -> 24 | E118: 4000
A119: 116 | B119: =R[-30]C -> 110104 | C119: 紫水晶+6 | D119: =R[-30]C+1 -> 24 | E119: 8000
A120: 117 | B120: =R[-30]C -> 110105 | C120: 紫水晶+7 | D120: =R[-30]C+1 -> 24 | E120: 10000
A121: 118 | B121: =R[-30]C -> 110106 | C121: 紫水晶+8 | D121: =R[-30]C+1 -> 24 | E121: 10000
A122: 119 | B122: =R[-30]C -> 110107 | C122: 紫水晶+9 | D122: =R[-30]C+1 -> 24 | E122: 10000
A123: 120 | B123: =R[-30]C -> 110108 | C123: 紫水晶+10 | D123: =R[-30]C+1 -> 24 | E123: 10000
A124: 121 | B124: =R[-30]C -> 110079 | C124: 黑铁矿+1 | D124: =R[-30]C+1 -> 5 | E124: 125
A125: 122 | B125: =R[-30]C -> 110080 | C125: 黑铁矿+2 | D125: =R[-30]C+1 -> 5 | E125: 250
A126: 123 | B126: =R[-30]C -> 110081 | C126: 黑铁矿+3 | D126: =R[-30]C+1 -> 5 | E126: 500
A127: 124 | B127: =R[-30]C -> 110082 | C127: 黑铁矿+4 | D127: =R[-30]C+1 -> 5 | E127: 1000
A128: 125 | B128: =R[-30]C -> 110083 | C128: 黑铁矿+5 | D128: =R[-30]C+1 -> 5 | E128: 2000
A129: 126 | B129: =R[-30]C -> 110084 | C129: 黑铁矿+6 | D129: =R[-30]C+1 -> 5 | E129: 4000
A130: 127 | B130: =R[-30]C -> 110085 | C130: 黑铁矿+7 | D130: =R[-30]C+1 -> 5 | E130: 8000
A131: 128 | B131: =R[-30]C -> 110086 | C131: 黑铁矿+8 | D131: =R[-30]C+1 -> 5 | E131: 10000
A132: 129 | B132: =R[-30]C -> 110087 | C132: 黑铁矿+9 | D132: =R[-30]C+1 -> 5 | E132: 10000
A133: 130 | B133: =R[-30]C -> 110088 | C133: 黑铁矿+10 | D133: =R[-30]C+1 -> 5 | E133: 10000
A134: 131 | B134: =R[-30]C -> 110089 | C134: 玄冰铁+1 | D134: =R[-30]C+1 -> 15 | E134: 125
A135: 132 | B135: =R[-30]C -> 110090 | C135: 玄冰铁+2 | D135: =R[-30]C+1 -> 15 | E135: 250
A136: 133 | B136: =R[-30]C -> 110091 | C136: 玄冰铁+3 | D136: =R[-30]C+1 -> 15 | E136: 500
A137: 134 | B137: =R[-30]C -> 110092 | C137: 玄冰铁+4 | D137: =R[-30]C+1 -> 15 | E137: 1000
A138: 135 | B138: =R[-30]C -> 110093 | C138: 玄冰铁+5 | D138: =R[-30]C+1 -> 15 | E138: 2000
A139: 136 | B139: =R[-30]C -> 110094 | C139: 玄冰铁+6 | D139: =R[-30]C+1 -> 15 | E139: 4000
A140: 137 | B140: =R[-30]C -> 110095 | C140: 玄冰铁+7 | D140: =R[-30]C+1 -> 15 | E140: 8000
A141: 138 | B141: =R[-30]C -> 110096 | C141: 玄冰铁+8 | D141: =R[-30]C+1 -> 15 | E141: 10000
A142: 139 | B142: =R[-30]C -> 110097 | C142: 玄冰铁+9 | D142: =R[-30]C+1 -> 15 | E142: 10000
A143: 140 | B143: =R[-30]C -> 110098 | C143: 玄冰铁+10 | D143: =R[-30]C+1 -> 15 | E143: 10000
A144: 141 | B144: =R[-30]C -> 110099 | C144: 紫水晶+1 | D144: =R[-30]C+1 -> 25 | E144: 125
A145: 142 | B145: =R[-30]C -> 110100 | C145: 紫水晶+2 | D145: =R[-30]C+1 -> 25 | E145: 250
A146: 143 | B146: =R[-30]C -> 110101 | C146: 紫水晶+3 | D146: =R[-30]C+1 -> 25 | E146: 500
A147: 144 | B147: =R[-30]C -> 110102 | C147: 紫水晶+4 | D147: =R[-30]C+1 -> 25 | E147: 1000
A148: 145 | B148: =R[-30]C -> 110103 | C148: 紫水晶+5 | D148: =R[-30]C+1 -> 25 | E148: 2000
A149: 146 | B149: =R[-30]C -> 110104 | C149: 紫水晶+6 | D149: =R[-30]C+1 -> 25 | E149: 4000
A150: 147 | B150: =R[-30]C -> 110105 | C150: 紫水晶+7 | D150: =R[-30]C+1 -> 25 | E150: 8000
A151: 148 | B151: =R[-30]C -> 110106 | C151: 紫水晶+8 | D151: =R[-30]C+1 -> 25 | E151: 10000
A152: 149 | B152: =R[-30]C -> 110107 | C152: 紫水晶+9 | D152: =R[-30]C+1 -> 25 | E152: 10000
A153: 150 | B153: =R[-30]C -> 110108 | C153: 紫水晶+10 | D153: =R[-30]C+1 -> 25 | E153: 10000
A154: 151 | B154: =R[-30]C -> 110079 | C154: 黑铁矿+1 | D154: =R[-30]C+1 -> 6 | E154: 62
A155: 152 | B155: =R[-30]C -> 110080 | C155: 黑铁矿+2 | D155: =R[-30]C+1 -> 6 | E155: 125
A156: 153 | B156: =R[-30]C -> 110081 | C156: 黑铁矿+3 | D156: =R[-30]C+1 -> 6 | E156: 250
A157: 154 | B157: =R[-30]C -> 110082 | C157: 黑铁矿+4 | D157: =R[-30]C+1 -> 6 | E157: 500
A158: 155 | B158: =R[-30]C -> 110083 | C158: 黑铁矿+5 | D158: =R[-30]C+1 -> 6 | E158: 1000
A159: 156 | B159: =R[-30]C -> 110084 | C159: 黑铁矿+6 | D159: =R[-30]C+1 -> 6 | E159: 2000
A160: 157 | B160: =R[-30]C -> 110085 | C160: 黑铁矿+7 | D160: =R[-30]C+1 -> 6 | E160: 4000
A161: 158 | B161: =R[-30]C -> 110086 | C161: 黑铁矿+8 | D161: =R[-30]C+1 -> 6 | E161: 8000
A162: 159 | B162: =R[-30]C -> 110087 | C162: 黑铁矿+9 | D162: =R[-30]C+1 -> 6 | E162: 10000
A163: 160 | B163: =R[-30]C -> 110088 | C163: 黑铁矿+10 | D163: =R[-30]C+1 -> 6 | E163: 10000
A164: 161 | B164: =R[-30]C -> 110089 | C164: 玄冰铁+1 | D164: =R[-30]C+1 -> 16 | E164: 62
A165: 162 | B165: =R[-30]C -> 110090 | C165: 玄冰铁+2 | D165: =R[-30]C+1 -> 16 | E165: 125
A166: 163 | B166: =R[-30]C -> 110091 | C166: 玄冰铁+3 | D166: =R[-30]C+1 -> 16 | E166: 250
A167: 164 | B167: =R[-30]C -> 110092 | C167: 玄冰铁+4 | D167: =R[-30]C+1 -> 16 | E167: 500
A168: 165 | B168: =R[-30]C -> 110093 | C168: 玄冰铁+5 | D168: =R[-30]C+1 -> 16 | E168: 1000
A169: 166 | B169: =R[-30]C -> 110094 | C169: 玄冰铁+6 | D169: =R[-30]C+1 -> 16 | E169: 2000
A170: 167 | B170: =R[-30]C -> 110095 | C170: 玄冰铁+7 | D170: =R[-30]C+1 -> 16 | E170: 4000
A171: 168 | B171: =R[-30]C -> 110096 | C171: 玄冰铁+8 | D171: =R[-30]C+1 -> 16 | E171: 8000
A172: 169 | B172: =R[-30]C -> 110097 | C172: 玄冰铁+9 | D172: =R[-30]C+1 -> 16 | E172: 10000
A173: 170 | B173: =R[-30]C -> 110098 | C173: 玄冰铁+10 | D173: =R[-30]C+1 -> 16 | E173: 10000
A174: 171 | B174: =R[-30]C -> 110099 | C174: 紫水晶+1 | D174: =R[-30]C+1 -> 26 | E174: 62
A175: 172 | B175: =R[-30]C -> 110100 | C175: 紫水晶+2 | D175: =R[-30]C+1 -> 26 | E175: 125
A176: 173 | B176: =R[-30]C -> 110101 | C176: 紫水晶+3 | D176: =R[-30]C+1 -> 26 | E176: 250
A177: 174 | B177: =R[-30]C -> 110102 | C177: 紫水晶+4 | D177: =R[-30]C+1 -> 26 | E177: 500
A178: 175 | B178: =R[-30]C -> 110103 | C178: 紫水晶+5 | D178: =R[-30]C+1 -> 26 | E178: 1000
A179: 176 | B179: =R[-30]C -> 110104 | C179: 紫水晶+6 | D179: =R[-30]C+1 -> 26 | E179: 2000
A180: 177 | B180: =R[-30]C -> 110105 | C180: 紫水晶+7 | D180: =R[-30]C+1 -> 26 | E180: 4000
A181: 178 | B181: =R[-30]C -> 110106 | C181: 紫水晶+8 | D181: =R[-30]C+1 -> 26 | E181: 8000
A182: 179 | B182: =R[-30]C -> 110107 | C182: 紫水晶+9 | D182: =R[-30]C+1 -> 26 | E182: 10000
A183: 180 | B183: =R[-30]C -> 110108 | C183: 紫水晶+10 | D183: =R[-30]C+1 -> 26 | E183: 10000
A184: 181 | B184: =R[-30]C -> 110079 | C184: 黑铁矿+1 | D184: =R[-30]C+1 -> 7 | E184: 31
A185: 182 | B185: =R[-30]C -> 110080 | C185: 黑铁矿+2 | D185: =R[-30]C+1 -> 7 | E185: 62
A186: 183 | B186: =R[-30]C -> 110081 | C186: 黑铁矿+3 | D186: =R[-30]C+1 -> 7 | E186: 125
A187: 184 | B187: =R[-30]C -> 110082 | C187: 黑铁矿+4 | D187: =R[-30]C+1 -> 7 | E187: 250
A188: 185 | B188: =R[-30]C -> 110083 | C188: 黑铁矿+5 | D188: =R[-30]C+1 -> 7 | E188: 500
A189: 186 | B189: =R[-30]C -> 110084 | C189: 黑铁矿+6 | D189: =R[-30]C+1 -> 7 | E189: 1000
A190: 187 | B190: =R[-30]C -> 110085 | C190: 黑铁矿+7 | D190: =R[-30]C+1 -> 7 | E190: 2000
A191: 188 | B191: =R[-30]C -> 110086 | C191: 黑铁矿+8 | D191: =R[-30]C+1 -> 7 | E191: 4000
A192: 189 | B192: =R[-30]C -> 110087 | C192: 黑铁矿+9 | D192: =R[-30]C+1 -> 7 | E192: 8000
A193: 190 | B193: =R[-30]C -> 110088 | C193: 黑铁矿+10 | D193: =R[-30]C+1 -> 7 | E193: 10000
A194: 191 | B194: =R[-30]C -> 110089 | C194: 玄冰铁+1 | D194: =R[-30]C+1 -> 17 | E194: 31
A195: 192 | B195: =R[-30]C -> 110090 | C195: 玄冰铁+2 | D195: =R[-30]C+1 -> 17 | E195: 62
A196: 193 | B196: =R[-30]C -> 110091 | C196: 玄冰铁+3 | D196: =R[-30]C+1 -> 17 | E196: 125
A197: 194 | B197: =R[-30]C -> 110092 | C197: 玄冰铁+4 | D197: =R[-30]C+1 -> 17 | E197: 250
A198: 195 | B198: =R[-30]C -> 110093 | C198: 玄冰铁+5 | D198: =R[-30]C+1 -> 17 | E198: 500
A199: 196 | B199: =R[-30]C -> 110094 | C199: 玄冰铁+6 | D199: =R[-30]C+1 -> 17 | E199: 1000
A200: 197 | B200: =R[-30]C -> 110095 | C200: 玄冰铁+7 | D200: =R[-30]C+1 -> 17 | E200: 2000
A201: 198 | B201: =R[-30]C -> 110096 | C201: 玄冰铁+8 | D201: =R[-30]C+1 -> 17 | E201: 4000
A202: 199 | B202: =R[-30]C -> 110097 | C202: 玄冰铁+9 | D202: =R[-30]C+1 -> 17 | E202: 8000
A203: 200 | B203: =R[-30]C -> 110098 | C203: 玄冰铁+10 | D203: =R[-30]C+1 -> 17 | E203: 10000
A204: 201 | B204: =R[-30]C -> 110099 | C204: 紫水晶+1 | D204: =R[-30]C+1 -> 27 | E204: 31
A205: 202 | B205: =R[-30]C -> 110100 | C205: 紫水晶+2 | D205: =R[-30]C+1 -> 27 | E205: 62
A206: 203 | B206: =R[-30]C -> 110101 | C206: 紫水晶+3 | D206: =R[-30]C+1 -> 27 | E206: 125
A207: 204 | B207: =R[-30]C -> 110102 | C207: 紫水晶+4 | D207: =R[-30]C+1 -> 27 | E207: 250
A208: 205 | B208: =R[-30]C -> 110103 | C208: 紫水晶+5 | D208: =R[-30]C+1 -> 27 | E208: 500
A209: 206 | B209: =R[-30]C -> 110104 | C209: 紫水晶+6 | D209: =R[-30]C+1 -> 27 | E209: 1000
A210: 207 | B210: =R[-30]C -> 110105 | C210: 紫水晶+7 | D210: =R[-30]C+1 -> 27 | E210: 2000
A211: 208 | B211: =R[-30]C -> 110106 | C211: 紫水晶+8 | D211: =R[-30]C+1 -> 27 | E211: 4000
A212: 209 | B212: =R[-30]C -> 110107 | C212: 紫水晶+9 | D212: =R[-30]C+1 -> 27 | E212: 8000
A213: 210 | B213: =R[-30]C -> 110108 | C213: 紫水晶+10 | D213: =R[-30]C+1 -> 27 | E213: 10000
A214: 211 | B214: =R[-30]C -> 110079 | C214: 黑铁矿+1 | D214: =R[-30]C+1 -> 8 | E214: 15
A215: 212 | B215: =R[-30]C -> 110080 | C215: 黑铁矿+2 | D215: =R[-30]C+1 -> 8 | E215: 31
A216: 213 | B216: =R[-30]C -> 110081 | C216: 黑铁矿+3 | D216: =R[-30]C+1 -> 8 | E216: 62
A217: 214 | B217: =R[-30]C -> 110082 | C217: 黑铁矿+4 | D217: =R[-30]C+1 -> 8 | E217: 125
A218: 215 | B218: =R[-30]C -> 110083 | C218: 黑铁矿+5 | D218: =R[-30]C+1 -> 8 | E218: 250
A219: 216 | B219: =R[-30]C -> 110084 | C219: 黑铁矿+6 | D219: =R[-30]C+1 -> 8 | E219: 500
A220: 217 | B220: =R[-30]C -> 110085 | C220: 黑铁矿+7 | D220: =R[-30]C+1 -> 8 | E220: 1000
A221: 218 | B221: =R[-30]C -> 110086 | C221: 黑铁矿+8 | D221: =R[-30]C+1 -> 8 | E221: 2000
A222: 219 | B222: =R[-30]C -> 110087 | C222: 黑铁矿+9 | D222: =R[-30]C+1 -> 8 | E222: 4000
A223: 220 | B223: =R[-30]C -> 110088 | C223: 黑铁矿+10 | D223: =R[-30]C+1 -> 8 | E223: 8000
A224: 221 | B224: =R[-30]C -> 110089 | C224: 玄冰铁+1 | D224: =R[-30]C+1 -> 18 | E224: 15
A225: 222 | B225: =R[-30]C -> 110090 | C225: 玄冰铁+2 | D225: =R[-30]C+1 -> 18 | E225: 31
A226: 223 | B226: =R[-30]C -> 110091 | C226: 玄冰铁+3 | D226: =R[-30]C+1 -> 18 | E226: 62
A227: 224 | B227: =R[-30]C -> 110092 | C227: 玄冰铁+4 | D227: =R[-30]C+1 -> 18 | E227: 125
A228: 225 | B228: =R[-30]C -> 110093 | C228: 玄冰铁+5 | D228: =R[-30]C+1 -> 18 | E228: 250
A229: 226 | B229: =R[-30]C -> 110094 | C229: 玄冰铁+6 | D229: =R[-30]C+1 -> 18 | E229: 500
A230: 227 | B230: =R[-30]C -> 110095 | C230: 玄冰铁+7 | D230: =R[-30]C+1 -> 18 | E230: 1000
A231: 228 | B231: =R[-30]C -> 110096 | C231: 玄冰铁+8 | D231: =R[-30]C+1 -> 18 | E231: 2000
A232: 229 | B232: =R[-30]C -> 110097 | C232: 玄冰铁+9 | D232: =R[-30]C+1 -> 18 | E232: 4000
A233: 230 | B233: =R[-30]C -> 110098 | C233: 玄冰铁+10 | D233: =R[-30]C+1 -> 18 | E233: 8000
A234: 231 | B234: =R[-30]C -> 110099 | C234: 紫水晶+1 | D234: =R[-30]C+1 -> 28 | E234: 15
A235: 232 | B235: =R[-30]C -> 110100 | C235: 紫水晶+2 | D235: =R[-30]C+1 -> 28 | E235: 31
A236: 233 | B236: =R[-30]C -> 110101 | C236: 紫水晶+3 | D236: =R[-30]C+1 -> 28 | E236: 62
A237: 234 | B237: =R[-30]C -> 110102 | C237: 紫水晶+4 | D237: =R[-30]C+1 -> 28 | E237: 125
A238: 235 | B238: =R[-30]C -> 110103 | C238: 紫水晶+5 | D238: =R[-30]C+1 -> 28 | E238: 250
A239: 236 | B239: =R[-30]C -> 110104 | C239: 紫水晶+6 | D239: =R[-30]C+1 -> 28 | E239: 500
A240: 237 | B240: =R[-30]C -> 110105 | C240: 紫水晶+7 | D240: =R[-30]C+1 -> 28 | E240: 1000
A241: 238 | B241: =R[-30]C -> 110106 | C241: 紫水晶+8 | D241: =R[-30]C+1 -> 28 | E241: 2000
A242: 239 | B242: =R[-30]C -> 110107 | C242: 紫水晶+9 | D242: =R[-30]C+1 -> 28 | E242: 4000
A243: 240 | B243: =R[-30]C -> 110108 | C243: 紫水晶+10 | D243: =R[-30]C+1 -> 28 | E243: 8000
A244: 241 | B244: =R[-30]C -> 110079 | C244: 黑铁矿+1 | D244: =R[-30]C+1 -> 9 | E244: 7
A245: 242 | B245: =R[-30]C -> 110080 | C245: 黑铁矿+2 | D245: =R[-30]C+1 -> 9 | E245: 15
A246: 243 | B246: =R[-30]C -> 110081 | C246: 黑铁矿+3 | D246: =R[-30]C+1 -> 9 | E246: 31
A247: 244 | B247: =R[-30]C -> 110082 | C247: 黑铁矿+4 | D247: =R[-30]C+1 -> 9 | E247: 62
A248: 245 | B248: =R[-30]C -> 110083 | C248: 黑铁矿+5 | D248: =R[-30]C+1 -> 9 | E248: 125
A249: 246 | B249: =R[-30]C -> 110084 | C249: 黑铁矿+6 | D249: =R[-30]C+1 -> 9 | E249: 250
A250: 247 | B250: =R[-30]C -> 110085 | C250: 黑铁矿+7 | D250: =R[-30]C+1 -> 9 | E250: 500
A251: 248 | B251: =R[-30]C -> 110086 | C251: 黑铁矿+8 | D251: =R[-30]C+1 -> 9 | E251: 1000
A252: 249 | B252: =R[-30]C -> 110087 | C252: 黑铁矿+9 | D252: =R[-30]C+1 -> 9 | E252: 2000
A253: 250 | B253: =R[-30]C -> 110088 | C253: 黑铁矿+10 | D253: =R[-30]C+1 -> 9 | E253: 4000
A254: 251 | B254: =R[-30]C -> 110089 | C254: 玄冰铁+1 | D254: =R[-30]C+1 -> 19 | E254: 7
A255: 252 | B255: =R[-30]C -> 110090 | C255: 玄冰铁+2 | D255: =R[-30]C+1 -> 19 | E255: 15
A256: 253 | B256: =R[-30]C -> 110091 | C256: 玄冰铁+3 | D256: =R[-30]C+1 -> 19 | E256: 31
A257: 254 | B257: =R[-30]C -> 110092 | C257: 玄冰铁+4 | D257: =R[-30]C+1 -> 19 | E257: 62
A258: 255 | B258: =R[-30]C -> 110093 | C258: 玄冰铁+5 | D258: =R[-30]C+1 -> 19 | E258: 125
A259: 256 | B259: =R[-30]C -> 110094 | C259: 玄冰铁+6 | D259: =R[-30]C+1 -> 19 | E259: 250
A260: 257 | B260: =R[-30]C -> 110095 | C260: 玄冰铁+7 | D260: =R[-30]C+1 -> 19 | E260: 500
A261: 258 | B261: =R[-30]C -> 110096 | C261: 玄冰铁+8 | D261: =R[-30]C+1 -> 19 | E261: 1000
A262: 259 | B262: =R[-30]C -> 110097 | C262: 玄冰铁+9 | D262: =R[-30]C+1 -> 19 | E262: 2000
A263: 260 | B263: =R[-30]C -> 110098 | C263: 玄冰铁+10 | D263: =R[-30]C+1 -> 19 | E263: 4000
A264: 261 | B264: =R[-30]C -> 110099 | C264: 紫水晶+1 | D264: =R[-30]C+1 -> 29 | E264: 7
A265: 262 | B265: =R[-30]C -> 110100 | C265: 紫水晶+2 | D265: =R[-30]C+1 -> 29 | E265: 15
A266: 263 | B266: =R[-30]C -> 110101 | C266: 紫水晶+3 | D266: =R[-30]C+1 -> 29 | E266: 31
A267: 264 | B267: =R[-30]C -> 110102 | C267: 紫水晶+4 | D267: =R[-30]C+1 -> 29 | E267: 62
A268: 265 | B268: =R[-30]C -> 110103 | C268: 紫水晶+5 | D268: =R[-30]C+1 -> 29 | E268: 125
A269: 266 | B269: =R[-30]C -> 110104 | C269: 紫水晶+6 | D269: =R[-30]C+1 -> 29 | E269: 250
A270: 267 | B270: =R[-30]C -> 110105 | C270: 紫水晶+7 | D270: =R[-30]C+1 -> 29 | E270: 500
A271: 268 | B271: =R[-30]C -> 110106 | C271: 紫水晶+8 | D271: =R[-30]C+1 -> 29 | E271: 1000
A272: 269 | B272: =R[-30]C -> 110107 | C272: 紫水晶+9 | D272: =R[-30]C+1 -> 29 | E272: 2000
A273: 270 | B273: =R[-30]C -> 110108 | C273: 紫水晶+10 | D273: =R[-30]C+1 -> 29 | E273: 4000
A274: 271 | B274: =R[-30]C -> 110079 | C274: 黑铁矿+1 | D274: =R[-30]C+1 -> 10 | E274: 3
A275: 272 | B275: =R[-30]C -> 110080 | C275: 黑铁矿+2 | D275: =R[-30]C+1 -> 10 | E275: 7
A276: 273 | B276: =R[-30]C -> 110081 | C276: 黑铁矿+3 | D276: =R[-30]C+1 -> 10 | E276: 15
A277: 274 | B277: =R[-30]C -> 110082 | C277: 黑铁矿+4 | D277: =R[-30]C+1 -> 10 | E277: 31
A278: 275 | B278: =R[-30]C -> 110083 | C278: 黑铁矿+5 | D278: =R[-30]C+1 -> 10 | E278: 62
A279: 276 | B279: =R[-30]C -> 110084 | C279: 黑铁矿+6 | D279: =R[-30]C+1 -> 10 | E279: 125
A280: 277 | B280: =R[-30]C -> 110085 | C280: 黑铁矿+7 | D280: =R[-30]C+1 -> 10 | E280: 250
A281: 278 | B281: =R[-30]C -> 110086 | C281: 黑铁矿+8 | D281: =R[-30]C+1 -> 10 | E281: 500
A282: 279 | B282: =R[-30]C -> 110087 | C282: 黑铁矿+9 | D282: =R[-30]C+1 -> 10 | E282: 1000
A283: 280 | B283: =R[-30]C -> 110088 | C283: 黑铁矿+10 | D283: =R[-30]C+1 -> 10 | E283: 2000
A284: 281 | B284: =R[-30]C -> 110089 | C284: 玄冰铁+1 | D284: =R[-30]C+1 -> 20 | E284: 3
A285: 282 | B285: =R[-30]C -> 110090 | C285: 玄冰铁+2 | D285: =R[-30]C+1 -> 20 | E285: 7
A286: 283 | B286: =R[-30]C -> 110091 | C286: 玄冰铁+3 | D286: =R[-30]C+1 -> 20 | E286: 15
A287: 284 | B287: =R[-30]C -> 110092 | C287: 玄冰铁+4 | D287: =R[-30]C+1 -> 20 | E287: 31
A288: 285 | B288: =R[-30]C -> 110093 | C288: 玄冰铁+5 | D288: =R[-30]C+1 -> 20 | E288: 62
A289: 286 | B289: =R[-30]C -> 110094 | C289: 玄冰铁+6 | D289: =R[-30]C+1 -> 20 | E289: 125
A290: 287 | B290: =R[-30]C -> 110095 | C290: 玄冰铁+7 | D290: =R[-30]C+1 -> 20 | E290: 250
A291: 288 | B291: =R[-30]C -> 110096 | C291: 玄冰铁+8 | D291: =R[-30]C+1 -> 20 | E291: 500
A292: 289 | B292: =R[-30]C -> 110097 | C292: 玄冰铁+9 | D292: =R[-30]C+1 -> 20 | E292: 1000
A293: 290 | B293: =R[-30]C -> 110098 | C293: 玄冰铁+10 | D293: =R[-30]C+1 -> 20 | E293: 2000
A294: 291 | B294: =R[-30]C -> 110099 | C294: 紫水晶+1 | D294: =R[-30]C+1 -> 30 | E294: 3
A295: 292 | B295: =R[-30]C -> 110100 | C295: 紫水晶+2 | D295: =R[-30]C+1 -> 30 | E295: 7
A296: 293 | B296: =R[-30]C -> 110101 | C296: 紫水晶+3 | D296: =R[-30]C+1 -> 30 | E296: 15
A297: 294 | B297: =R[-30]C -> 110102 | C297: 紫水晶+4 | D297: =R[-30]C+1 -> 30 | E297: 31
A298: 295 | B298: =R[-30]C -> 110103 | C298: 紫水晶+5 | D298: =R[-30]C+1 -> 30 | E298: 62
A299: 296 | B299: =R[-30]C -> 110104 | C299: 紫水晶+6 | D299: =R[-30]C+1 -> 30 | E299: 125
A300: 297 | B300: =R[-30]C -> 110105 | C300: 紫水晶+7 | D300: =R[-30]C+1 -> 30 | E300: 250
A301: 298 | B301: =R[-30]C -> 110106 | C301: 紫水晶+8 | D301: =R[-30]C+1 -> 30 | E301: 500
A302: 299 | B302: =R[-30]C -> 110107 | C302: 紫水晶+9 | D302: =R[-30]C+1 -> 30 | E302: 1000
A303: 300 | B303: =R[-30]C -> 110108 | C303: 紫水晶+10 | D303: =R[-30]C+1 -> 30 | E303: 2000
A304: 301 | B304: 110099 | C304: 紫水晶+1 | D304: 31 | E304: 3
A305: 302 | B305: 110100 | C305: 紫水晶+2 | D305: 31 | E305: 7
A306: 303 | B306: 110101 | C306: 紫水晶+3 | D306: 31 | E306: 15
A307: 304 | B307: 110102 | C307: 紫水晶+4 | D307: 31 | E307: 31
A308: 305 | B308: 110103 | C308: 紫水晶+5 | D308: 31 | E308: 62
A309: 306 | B309: 110104 | C309: 紫水晶+6 | D309: 31 | E309: 125
A310: 307 | B310: 110105 | C310: 紫水晶+7 | D310: 31 | E310: 250
A311: 308 | B311: 110106 | C311: 紫水晶+8 | D311: 31 | E311: 500
A312: 309 | B312: 110107 | C312: 紫水晶+9 | D312: 31 | E312: 1000
A313: 310 | B313: 110108 | C313: 紫水晶+10 | D313: 31 | E313: 2000
A314: 311 | B314: 110099 | C314: 紫水晶+1 | D314: =R[-10]C+1 -> 32 | E314: 3
A315: 312 | B315: 110100 | C315: 紫水晶+2 | D315: =R[-10]C+1 -> 32 | E315: 7
A316: 313 | B316: 110101 | C316: 紫水晶+3 | D316: =R[-10]C+1 -> 32 | E316: 15
A317: 314 | B317: 110102 | C317: 紫水晶+4 | D317: =R[-10]C+1 -> 32 | E317: 31
A318: 315 | B318: 110103 | C318: 紫水晶+5 | D318: =R[-10]C+1 -> 32 | E318: 62
A319: 316 | B319: 110104 | C319: 紫水晶+6 | D319: =R[-10]C+1 -> 32 | E319: 125
A320: 317 | B320: 110105 | C320: 紫水晶+7 | D320: =R[-10]C+1 -> 32 | E320: 250
A321: 318 | B321: 110106 | C321: 紫水晶+8 | D321: =R[-10]C+1 -> 32 | E321: 500
A322: 319 | B322: 110107 | C322: 紫水晶+9 | D322: =R[-10]C+1 -> 32 | E322: 1000
A323: 320 | B323: 110108 | C323: 紫水晶+10 | D323: =R[-10]C+1 -> 32 | E323: 2000
A324: 321 | B324: 110099 | C324: 紫水晶+1 | D324: =R[-10]C+1 -> 33 | E324: 3
A325: 322 | B325: 110100 | C325: 紫水晶+2 | D325: =R[-10]C+1 -> 33 | E325: 7
A326: 323 | B326: 110101 | C326: 紫水晶+3 | D326: =R[-10]C+1 -> 33 | E326: 15
A327: 324 | B327: 110102 | C327: 紫水晶+4 | D327: =R[-10]C+1 -> 33 | E327: 31
A328: 325 | B328: 110103 | C328: 紫水晶+5 | D328: =R[-10]C+1 -> 33 | E328: 62
A329: 326 | B329: 110104 | C329: 紫水晶+6 | D329: =R[-10]C+1 -> 33 | E329: 125
A330: 327 | B330: 110105 | C330: 紫水晶+7 | D330: =R[-10]C+1 -> 33 | E330: 250
A331: 328 | B331: 110106 | C331: 紫水晶+8 | D331: =R[-10]C+1 -> 33 | E331: 500
A332: 329 | B332: 110107 | C332: 紫水晶+9 | D332: =R[-10]C+1 -> 33 | E332: 1000
A333: 330 | B333: 110108 | C333: 紫水晶+10 | D333: =R[-10]C+1 -> 33 | E333: 2000
A334: 331 | B334: 110099 | C334: 紫水晶+1 | D334: =R[-10]C+1 -> 34 | E334: 3
A335: 332 | B335: 110100 | C335: 紫水晶+2 | D335: =R[-10]C+1 -> 34 | E335: 7
A336: 333 | B336: 110101 | C336: 紫水晶+3 | D336: =R[-10]C+1 -> 34 | E336: 15
A337: 334 | B337: 110102 | C337: 紫水晶+4 | D337: =R[-10]C+1 -> 34 | E337: 31
A338: 335 | B338: 110103 | C338: 紫水晶+5 | D338: =R[-10]C+1 -> 34 | E338: 62
A339: 336 | B339: 110104 | C339: 紫水晶+6 | D339: =R[-10]C+1 -> 34 | E339: 125
A340: 337 | B340: 110105 | C340: 紫水晶+7 | D340: =R[-10]C+1 -> 34 | E340: 250
A341: 338 | B341: 110106 | C341: 紫水晶+8 | D341: =R[-10]C+1 -> 34 | E341: 500
A342: 339 | B342: 110107 | C342: 紫水晶+9 | D342: =R[-10]C+1 -> 34 | E342: 1000
A343: 340 | B343: 110108 | C343: 紫水晶+10 | D343: =R[-10]C+1 -> 34 | E343: 2000
A344: 341 | B344: 110099 | C344: 紫水晶+1 | D344: =R[-10]C+1 -> 35 | E344: 3
A345: 342 | B345: 110100 | C345: 紫水晶+2 | D345: =R[-10]C+1 -> 35 | E345: 7
A346: 343 | B346: 110101 | C346: 紫水晶+3 | D346: =R[-10]C+1 -> 35 | E346: 15
A347: 344 | B347: 110102 | C347: 紫水晶+4 | D347: =R[-10]C+1 -> 35 | E347: 31
A348: 345 | B348: 110103 | C348: 紫水晶+5 | D348: =R[-10]C+1 -> 35 | E348: 62
A349: 346 | B349: 110104 | C349: 紫水晶+6 | D349: =R[-10]C+1 -> 35 | E349: 125
A350: 347 | B350: 110105 | C350: 紫水晶+7 | D350: =R[-10]C+1 -> 35 | E350: 250
A351: 348 | B351: 110106 | C351: 紫水晶+8 | D351: =R[-10]C+1 -> 35 | E351: 500
A352: 349 | B352: 110107 | C352: 紫水晶+9 | D352: =R[-10]C+1 -> 35 | E352: 1000
A353: 350 | B353: 110108 | C353: 紫水晶+10 | D353: =R[-10]C+1 -> 35 | E353: 2000
A354: 351 | B354: 110099 | C354: 紫水晶+1 | D354: =R[-10]C+1 -> 36 | E354: 3
A355: 352 | B355: 110100 | C355: 紫水晶+2 | D355: =R[-10]C+1 -> 36 | E355: 7
A356: 353 | B356: 110101 | C356: 紫水晶+3 | D356: =R[-10]C+1 -> 36 | E356: 15
A357: 354 | B357: 110102 | C357: 紫水晶+4 | D357: =R[-10]C+1 -> 36 | E357: 31
A358: 355 | B358: 110103 | C358: 紫水晶+5 | D358: =R[-10]C+1 -> 36 | E358: 62
A359: 356 | B359: 110104 | C359: 紫水晶+6 | D359: =R[-10]C+1 -> 36 | E359: 80
A360: 357 | B360: 110105 | C360: 紫水晶+7 | D360: =R[-10]C+1 -> 36 | E360: 200
A361: 358 | B361: 110106 | C361: 紫水晶+8 | D361: =R[-10]C+1 -> 36 | E361: 400
A362: 359 | B362: 110107 | C362: 紫水晶+9 | D362: =R[-10]C+1 -> 36 | E362: 800
A363: 360 | B363: 110108 | C363: 紫水晶+10 | D363: =R[-10]C+1 -> 36 | E363: 1600
A364: 361 | B364: 110099 | C364: 紫水晶+1 | D364: =R[-10]C+1 -> 37 | E364: 3
A365: 362 | B365: 110100 | C365: 紫水晶+2 | D365: =R[-10]C+1 -> 37 | E365: 7
A366: 363 | B366: 110101 | C366: 紫水晶+3 | D366: =R[-10]C+1 -> 37 | E366: 15
A367: 364 | B367: 110102 | C367: 紫水晶+4 | D367: =R[-10]C+1 -> 37 | E367: 31
A368: 365 | B368: 110103 | C368: 紫水晶+5 | D368: =R[-10]C+1 -> 37 | E368: 62
A369: 366 | B369: 110104 | C369: 紫水晶+6 | D369: =R[-10]C+1 -> 37 | E369: 80
A370: 367 | B370: 110105 | C370: 紫水晶+7 | D370: =R[-10]C+1 -> 37 | E370: 200
A371: 368 | B371: 110106 | C371: 紫水晶+8 | D371: =R[-10]C+1 -> 37 | E371: 400
A372: 369 | B372: 110107 | C372: 紫水晶+9 | D372: =R[-10]C+1 -> 37 | E372: 800
A373: 370 | B373: 110108 | C373: 紫水晶+10 | D373: =R[-10]C+1 -> 37 | E373: 1600
A374: 371 | B374: 110099 | C374: 紫水晶+1 | D374: =R[-10]C+1 -> 38 | E374: 3
A375: 372 | B375: 110100 | C375: 紫水晶+2 | D375: =R[-10]C+1 -> 38 | E375: 7
A376: 373 | B376: 110101 | C376: 紫水晶+3 | D376: =R[-10]C+1 -> 38 | E376: 15
A377: 374 | B377: 110102 | C377: 紫水晶+4 | D377: =R[-10]C+1 -> 38 | E377: 31
A378: 375 | B378: 110103 | C378: 紫水晶+5 | D378: =R[-10]C+1 -> 38 | E378: 62
A379: 376 | B379: 110104 | C379: 紫水晶+6 | D379: =R[-10]C+1 -> 38 | E379: 80
A380: 377 | B380: 110105 | C380: 紫水晶+7 | D380: =R[-10]C+1 -> 38 | E380: 200
A381: 378 | B381: 110106 | C381: 紫水晶+8 | D381: =R[-10]C+1 -> 38 | E381: 400
A382: 379 | B382: 110107 | C382: 紫水晶+9 | D382: =R[-10]C+1 -> 38 | E382: 800
A383: 380 | B383: 110108 | C383: 紫水晶+10 | D383: =R[-10]C+1 -> 38 | E383: 1600
A384: 381 | B384: 110099 | C384: 紫水晶+1 | D384: =R[-10]C+1 -> 39 | E384: 3
A385: 382 | B385: 110100 | C385: 紫水晶+2 | D385: =R[-10]C+1 -> 39 | E385: 7
A386: 383 | B386: 110101 | C386: 紫水晶+3 | D386: =R[-10]C+1 -> 39 | E386: 15
A387: 384 | B387: 110102 | C387: 紫水晶+4 | D387: =R[-10]C+1 -> 39 | E387: 31
A388: 385 | B388: 110103 | C388: 紫水晶+5 | D388: =R[-10]C+1 -> 39 | E388: 62
A389: 386 | B389: 110104 | C389: 紫水晶+6 | D389: =R[-10]C+1 -> 39 | E389: 80
A390: 387 | B390: 110105 | C390: 紫水晶+7 | D390: =R[-10]C+1 -> 39 | E390: 200
A391: 388 | B391: 110106 | C391: 紫水晶+8 | D391: =R[-10]C+1 -> 39 | E391: 400
A392: 389 | B392: 110107 | C392: 紫水晶+9 | D392: =R[-10]C+1 -> 39 | E392: 800
A393: 390 | B393: 110108 | C393: 紫水晶+10 | D393: =R[-10]C+1 -> 39 | E393: 1600
A394: 391 | B394: 110099 | C394: 紫水晶+1 | D394: =R[-10]C+1 -> 40 | E394: 3
A395: 392 | B395: 110100 | C395: 紫水晶+2 | D395: =R[-10]C+1 -> 40 | E395: 7
A396: 393 | B396: 110101 | C396: 紫水晶+3 | D396: =R[-10]C+1 -> 40 | E396: 15
A397: 394 | B397: 110102 | C397: 紫水晶+4 | D397: =R[-10]C+1 -> 40 | E397: 31
A398: 395 | B398: 110103 | C398: 紫水晶+5 | D398: =R[-10]C+1 -> 40 | E398: 62
A399: 396 | B399: 110104 | C399: 紫水晶+6 | D399: =R[-10]C+1 -> 40 | E399: 80
A400: 397 | B400: 110105 | C400: 紫水晶+7 | D400: =R[-10]C+1 -> 40 | E400: 200
A401: 398 | B401: 110106 | C401: 紫水晶+8 | D401: =R[-10]C+1 -> 40 | E401: 400
A402: 399 | B402: 110107 | C402: 紫水晶+9 | D402: =R[-10]C+1 -> 40 | E402: 800
A403: 400 | B403: 110108 | C403: 紫水晶+10 | D403: =R[-10]C+1 -> 40 | E403: 1600

Sheet: 工作表2
A3: [{物品ID,是否绑定,数量}]
A5: 0:非绑定
A6: 1:绑定