Sheet: 翅膀升级配置
A1: key | B1: wing_id
A2: key
A3: 时效翅膀 | B3: 正版翅膀
A4: 309000 | B4: =RC[-1]-2000 -> 307000
A5: 309001 | B5: =RC[-1]-2000 -> 307001
A6: 309002 | B6: =RC[-1]-2000 -> 307002
A7: 309003 | B7: =RC[-1]-2000 -> 307003
A8: 309004 | B8: =RC[-1]-2000 -> 307004
A9: 309005 | B9: =RC[-1]-2000 -> 307005
A10: 309006 | B10: =RC[-1]-2000 -> 307006
A11: 309007 | B11: =RC[-1]-2000 -> 307007
A12: 309008 | B12: =RC[-1]-2000 -> 307008
A13: 309009 | B13: =RC[-1]-2000 -> 307009
A14: 309200 | B14: =RC[-1]-2000 -> 307200
A15: 309201 | B15: =RC[-1]-2000 -> 307201
A16: 309202 | B16: =RC[-1]-2000 -> 307202
A17: 309203 | B17: =RC[-1]-2000 -> 307203
A18: 309204 | B18: =RC[-1]-2000 -> 307204
A19: 309205 | B19: =RC[-1]-2000 -> 307205
A20: 309206 | B20: =RC[-1]-2000 -> 307206
A21: 309207 | B21: =RC[-1]-2000 -> 307207
A22: 309208 | B22: =RC[-1]-2000 -> 307208
A23: 309209 | B23: =RC[-1]-2000 -> 307209
A24: 309400 | B24: =RC[-1]-2000 -> 307400
A25: 309401 | B25: =RC[-1]-2000 -> 307401
A26: 309402 | B26: =RC[-1]-2000 -> 307402
A27: 309403 | B27: =RC[-1]-2000 -> 307403
A28: 309404 | B28: =RC[-1]-2000 -> 307404
A29: 309405 | B29: =RC[-1]-2000 -> 307405
A30: 309406 | B30: =RC[-1]-2000 -> 307406
A31: 309407 | B31: =RC[-1]-2000 -> 307407
A32: 309408 | B32: =RC[-1]-2000 -> 307408
A33: 309409 | B33: =RC[-1]-2000 -> 307409