Sheet: 世界boss排名奖励配置
A1: key | B1: min_rank | C1: max_rank | D1: min_lv | E1: max_lv | F1: mail_id
A2: key | B2: min_rank | C2: max_rank | D2: min_lv | E2: max_lv | G2: rewaed_item | I2: 经验 | J2: 龙之碎片
A3: key | B3: 排名小 | C3: 排名大 | D3: 最小等级 | E3: 最大等级 | F3: 邮件id | G3: 奖励物品 | I3: 110057 | J3: 110013
A4: 1 | B4: 1 | C4: 1 | D4: 1 | E4: 50 | F4: 17 | G4: ="[{110130,1,1},{110057,1,"&RC[2]&"},{110013,1,4}]" -> [{110130,1,1},{110057,1,300000},{110013,1,4}] | I4: 300000 | J4: 4
A5: 2 | B5: 2 | C5: 2 | D5: 1 | E5: 50 | F5: 18 | G5: ="[{110130,1,1},{110057,1,"&RC[2]&"},{110013,1,3}]" -> [{110130,1,1},{110057,1,250000},{110013,1,3}] | I5: 250000 | J5: 3
A6: 3 | B6: 3 | C6: 3 | D6: 1 | E6: 50 | F6: 19 | G6: ="[{110130,1,1},{110057,1,"&RC[2]&"},{110013,1,2}]" -> [{110130,1,1},{110057,1,200000},{110013,1,2}] | I6: 200000 | J6: 2
A7: 4 | B7: 4 | C7: 5 | D7: 1 | E7: 50 | F7: 20 | G7: ="[{110129,1,3},{110057,1,"&RC[2]&"},{110013,1,1}]" -> [{110129,1,3},{110057,1,180000},{110013,1,1}] | I7: 180000 | J7: 1
A8: 5 | B8: 6 | C8: 10 | D8: 1 | E8: 50 | F8: 21 | G8: ="[{110129,1,2},{110057,1,"&RC[2]&"},{110013,1,1}]" -> [{110129,1,2},{110057,1,150000},{110013,1,1}] | I8: 150000 | J8: 1
A9: 6 | B9: 11 | C9: 50 | D9: 1 | E9: 50 | F9: 22 | G9: ="[{110129,1,1},{110057,1,"&RC[2]&"},{110013,1,1}]" -> [{110129,1,1},{110057,1,130000},{110013,1,1}] | I9: 130000 | J9: 1
A10: 7 | B10: 51 | C10: 99999 | D10: 1 | E10: 50 | F10: 23 | G10: ="[{110128,1,1},{110009,1,"&RC[2]&"}]" -> [{110128,1,1},{110009,1,100000}] | I10: 100000
A11: 8 | B11: 1 | C11: 1 | D11: 51 | E11: 60 | F11: 31 | G11: ="[{110130,1,1},{110057,1,"&RC[2]&"},{110013,1,4}]" -> [{110130,1,1},{110057,1,350000},{110013,1,4}] | I11: =R[-7]C+50000 -> 350000
A12: 9 | B12: 2 | C12: 2 | D12: 51 | E12: 60 | F12: 32 | G12: ="[{110130,1,1},{110057,1,"&RC[2]&"},{110013,1,3}]" -> [{110130,1,1},{110057,1,300000},{110013,1,3}] | I12: =R[-7]C+50000 -> 300000
A13: 10 | B13: 3 | C13: 3 | D13: 51 | E13: 60 | F13: 33 | G13: ="[{110130,1,1},{110057,1,"&RC[2]&"},{110013,1,2}]" -> [{110130,1,1},{110057,1,250000},{110013,1,2}] | I13: =R[-7]C+50000 -> 250000
A14: 11 | B14: 4 | C14: 5 | D14: 51 | E14: 60 | F14: 34 | G14: ="[{110129,1,3},{110057,1,"&RC[2]&"},{110013,1,1}]" -> [{110129,1,3},{110057,1,230000},{110013,1,1}] | I14: =R[-7]C+50000 -> 230000
A15: 12 | B15: 6 | C15: 10 | D15: 51 | E15: 60 | F15: 35 | G15: ="[{110129,1,2},{110057,1,"&RC[2]&"},{110013,1,1}]" -> [{110129,1,2},{110057,1,200000},{110013,1,1}] | I15: =R[-7]C+50000 -> 200000
A16: 13 | B16: 11 | C16: 50 | D16: 51 | E16: 60 | F16: 36 | G16: ="[{110129,1,1},{110057,1,"&RC[2]&"},{110013,1,1}]" -> [{110129,1,1},{110057,1,180000},{110013,1,1}] | I16: =R[-7]C+50000 -> 180000
A17: 14 | B17: 51 | C17: 99999 | D17: 51 | E17: 60 | F17: 37 | G17: ="[{110128,1,1},{110009,1,"&RC[2]&"}]" -> [{110128,1,1},{110009,1,150000}] | I17: =R[-7]C+50000 -> 150000
A18: 15 | B18: 1 | C18: 1 | D18: 61 | E18: 70 | F18: 38 | G18: ="[{110130,1,1},{110057,1,"&RC[2]&"},{110013,1,4}]" -> [{110130,1,1},{110057,1,400000},{110013,1,4}] | I18: =R[-7]C+50000 -> 400000
A19: 16 | B19: 2 | C19: 2 | D19: 61 | E19: 70 | F19: 39 | G19: ="[{110130,1,1},{110057,1,"&RC[2]&"},{110013,1,3}]" -> [{110130,1,1},{110057,1,350000},{110013,1,3}] | I19: =R[-7]C+50000 -> 350000
A20: 17 | B20: 3 | C20: 3 | D20: 61 | E20: 70 | F20: 40 | G20: ="[{110130,1,1},{110057,1,"&RC[2]&"},{110013,1,2}]" -> [{110130,1,1},{110057,1,300000},{110013,1,2}] | I20: =R[-7]C+50000 -> 300000
A21: 18 | B21: 4 | C21: 5 | D21: 61 | E21: 70 | F21: 41 | G21: ="[{110129,1,3},{110057,1,"&RC[2]&"},{110013,1,1}]" -> [{110129,1,3},{110057,1,280000},{110013,1,1}] | I21: =R[-7]C+50000 -> 280000
A22: 19 | B22: 6 | C22: 10 | D22: 61 | E22: 70 | F22: 42 | G22: ="[{110129,1,2},{110057,1,"&RC[2]&"},{110013,1,1}]" -> [{110129,1,2},{110057,1,250000},{110013,1,1}] | I22: =R[-7]C+50000 -> 250000
A23: 20 | B23: 11 | C23: 50 | D23: 61 | E23: 70 | F23: 43 | G23: ="[{110129,1,1},{110057,1,"&RC[2]&"},{110013,1,1}]" -> [{110129,1,1},{110057,1,230000},{110013,1,1}] | I23: =R[-7]C+50000 -> 230000
A24: 21 | B24: 51 | C24: 99999 | D24: 61 | E24: 70 | F24: 44 | G24: ="[{110128,1,1},{110009,1,"&RC[2]&"}]" -> [{110128,1,1},{110009,1,200000}] | I24: =R[-7]C+50000 -> 200000
A25: 22 | B25: 1 | C25: 1 | D25: 71 | E25: 80 | F25: 45 | G25: ="[{110130,1,1},{110057,1,"&RC[2]&"},{110013,1,4}]" -> [{110130,1,1},{110057,1,450000},{110013,1,4}] | I25: =R[-7]C+50000 -> 450000
A26: 23 | B26: 2 | C26: 2 | D26: 71 | E26: 80 | F26: 46 | G26: ="[{110130,1,1},{110057,1,"&RC[2]&"},{110013,1,3}]" -> [{110130,1,1},{110057,1,400000},{110013,1,3}] | I26: =R[-7]C+50000 -> 400000
A27: 24 | B27: 3 | C27: 3 | D27: 71 | E27: 80 | F27: 47 | G27: ="[{110130,1,1},{110057,1,"&RC[2]&"},{110013,1,2}]" -> [{110130,1,1},{110057,1,350000},{110013,1,2}] | I27: =R[-7]C+50000 -> 350000
A28: 25 | B28: 4 | C28: 5 | D28: 71 | E28: 80 | F28: 48 | G28: ="[{110129,1,3},{110057,1,"&RC[2]&"},{110013,1,1}]" -> [{110129,1,3},{110057,1,330000},{110013,1,1}] | I28: =R[-7]C+50000 -> 330000
A29: 26 | B29: 6 | C29: 10 | D29: 71 | E29: 80 | F29: 49 | G29: ="[{110129,1,2},{110057,1,"&RC[2]&"},{110013,1,1}]" -> [{110129,1,2},{110057,1,300000},{110013,1,1}] | I29: =R[-7]C+50000 -> 300000
A30: 27 | B30: 11 | C30: 50 | D30: 71 | E30: 80 | F30: 50 | G30: ="[{110129,1,1},{110057,1,"&RC[2]&"},{110013,1,1}]" -> [{110129,1,1},{110057,1,280000},{110013,1,1}] | I30: =R[-7]C+50000 -> 280000
A31: 28 | B31: 51 | C31: 99999 | D31: 71 | E31: 80 | F31: 51 | G31: ="[{110128,1,1},{110009,1,"&RC[2]&"}]" -> [{110128,1,1},{110009,1,250000}] | I31: =R[-7]C+50000 -> 250000
A32: 29 | B32: 1 | C32: 1 | D32: 81 | E32: 90 | F32: 52 | G32: ="[{110130,1,1},{110057,1,"&RC[2]&"},{110013,1,4}]" -> [{110130,1,1},{110057,1,500000},{110013,1,4}] | I32: =R[-7]C+50000 -> 500000
A33: 30 | B33: 2 | C33: 2 | D33: 81 | E33: 90 | F33: 53 | G33: ="[{110130,1,1},{110057,1,"&RC[2]&"},{110013,1,3}]" -> [{110130,1,1},{110057,1,450000},{110013,1,3}] | I33: =R[-7]C+50000 -> 450000
A34: 31 | B34: 3 | C34: 3 | D34: 81 | E34: 90 | F34: 54 | G34: ="[{110130,1,1},{110057,1,"&RC[2]&"},{110013,1,2}]" -> [{110130,1,1},{110057,1,400000},{110013,1,2}] | I34: =R[-7]C+50000 -> 400000
A35: 32 | B35: 4 | C35: 5 | D35: 81 | E35: 90 | F35: 55 | G35: ="[{110129,1,3},{110057,1,"&RC[2]&"},{110013,1,1}]" -> [{110129,1,3},{110057,1,380000},{110013,1,1}] | I35: =R[-7]C+50000 -> 380000
A36: 33 | B36: 6 | C36: 10 | D36: 81 | E36: 90 | F36: 56 | G36: ="[{110129,1,2},{110057,1,"&RC[2]&"},{110013,1,1}]" -> [{110129,1,2},{110057,1,350000},{110013,1,1}] | I36: =R[-7]C+50000 -> 350000
A37: 34 | B37: 11 | C37: 50 | D37: 81 | E37: 90 | F37: 57 | G37: ="[{110129,1,1},{110057,1,"&RC[2]&"},{110013,1,1}]" -> [{110129,1,1},{110057,1,330000},{110013,1,1}] | I37: =R[-7]C+50000 -> 330000
A38: 35 | B38: 51 | C38: 99999 | D38: 81 | E38: 90 | F38: 58 | G38: ="[{110128,1,1},{110009,1,"&RC[2]&"}]" -> [{110128,1,1},{110009,1,300000}] | I38: =R[-7]C+50000 -> 300000
A39: 36 | B39: 1 | C39: 1 | D39: 91 | E39: 999 | F39: 59 | G39: ="[{110130,1,1},{110057,1,"&RC[2]&"},{110013,1,4}]" -> [{110130,1,1},{110057,1,550000},{110013,1,4}] | I39: =R[-7]C+50000 -> 550000
A40: 37 | B40: 2 | C40: 2 | D40: 91 | E40: 999 | F40: 60 | G40: ="[{110130,1,1},{110057,1,"&RC[2]&"},{110013,1,3}]" -> [{110130,1,1},{110057,1,500000},{110013,1,3}] | I40: =R[-7]C+50000 -> 500000
A41: 38 | B41: 3 | C41: 3 | D41: 91 | E41: 999 | F41: 61 | G41: ="[{110130,1,1},{110057,1,"&RC[2]&"},{110013,1,2}]" -> [{110130,1,1},{110057,1,450000},{110013,1,2}] | I41: =R[-7]C+50000 -> 450000
A42: 39 | B42: 4 | C42: 5 | D42: 91 | E42: 999 | F42: 62 | G42: ="[{110129,1,3},{110057,1,"&RC[2]&"},{110013,1,1}]" -> [{110129,1,3},{110057,1,430000},{110013,1,1}] | I42: =R[-7]C+50000 -> 430000
A43: 40 | B43: 6 | C43: 10 | D43: 91 | E43: 999 | F43: 63 | G43: ="[{110129,1,2},{110057,1,"&RC[2]&"},{110013,1,1}]" -> [{110129,1,2},{110057,1,400000},{110013,1,1}] | I43: =R[-7]C+50000 -> 400000
A44: 41 | B44: 11 | C44: 50 | D44: 91 | E44: 999 | F44: 64 | G44: ="[{110129,1,1},{110057,1,"&RC[2]&"},{110013,1,1}]" -> [{110129,1,1},{110057,1,380000},{110013,1,1}] | I44: =R[-7]C+50000 -> 380000
A45: 42 | B45: 51 | C45: 99999 | D45: 91 | E45: 999 | F45: 65 | G45: ="[{110128,1,1},{110009,1,"&RC[2]&"}]" -> [{110128,1,1},{110009,1,350000}] | I45: =R[-7]C+50000 -> 350000

Sheet: 说明
A1: [{物品ID,是否绑定,数量}]
A3: 0:非绑定
A4: 1:绑定
C7: 排名
C8: 1
C9: 2
C10: 3
A12: 参与数量